7124471242735944479,看来，一些年轻人的躺平也不是毫无理由的。,7,616,1,2022-07-26 08:28:41,来自河北,103928374066,温度书房
7124460367086502687,不仅查个人，对于这个人的家族也一起查一下吧,32,1455,4,2022-07-26 07:46:56,来自北京,3711541167532622,执着的可乐Fo
7124343983106573086,请疏桐流饷同志持续关注并及时更新事情的进展情况。,3,625,4,2022-07-26 00:16:20,来自湖北,1002355681928206,简单海洋QI
7124311342038844200,调查组里的伯伯叔叔阿姨可严厉了～[酷拽],28,1441,4,2022-07-25 22:07:18,来自福建,3936147801,国木之一
7124287830708732709,功臣,0,739,5,2022-07-25 20:36:32,来自贵州,64204457652,知了知了0828
7124468067723461411,不会用的都是工资吧[捂脸],10,346,1,2022-07-26 08:15:55,来自河南,1266272519859767,靓丽风景ZFM
7124464845764215555,一不小心说出大实话,6,941,3,2022-07-26 08:04:31,来自福建,3396572201,王者归来130630921
7124307603295044356,在坑爹这方面严世潘跟他没法比,15,1493,4,2022-07-25 21:53:29,来自吉林,63054934255,用户8936081690629
7124310788705288997,工作考上去的还是靠关系。,49,601,4,2022-07-25 22:05:36,来自辽宁,97359162390,高级小鱼yo
7124300001638908711,人狂必有祸,10,397,7,2022-07-25 21:23:50,,93009011212,如是我闻彩云飞
7124317814827156239,他那个不抽烟的原因看不懂,14,153,3,2022-07-25 22:32:29,来自广东,52808806542,芽圈圈
7124314652293186338,触目惊心呐。看得人心里都薄凉薄凉薄薄凉了。,14,999,4,2022-07-25 22:20:31,来自四川,102270115171,见说道
7124321801408414498,利益，和关系，共存！！！！,5,579,2,2022-07-25 22:48:19,来自广东,50517340283,知足常乐130881751
7124574741763359502,严肃追责问责到底！严肃查处绝不姑息,5,80,2,2022-07-26 15:10:11,来自天津,97112199772,唐天山道治所
7124315087993242407,是炫富的问题吗？群众关心的是有没有违规贪污。,10,514,3,2022-07-25 22:22:54,来自广东,86395113786,三式虎
7124505598435099407,这个91年的男生是几个意思,11,76,3,2022-07-26 10:41:15,来自云南,95335079571,梅子
7124598860206654219,这孩子实诚，按照接班人好好培养[捂脸],0,53,1,2022-07-26 16:44:07,来自辽宁,5371551077,野狐禅52221193
7124446868352467743,正是因为有这样的人，才能让我们普通人知道真相。,15,737,0,2022-07-26 06:54:50,来自甘肃,6061147270,小步伐迈进
7124533504163545864,言论没有不当，言论背后隐藏的逻辑，让人细思极恐。,3,234,1,2022-07-26 12:30:09,来自广东,95039177942,Lola66
7124464300131533608,挥霍的又不是自己的钱，当然是咋舒服咋花了。国资的这样“运营”方式真的合适吗？！,0,147,0,2022-07-26 08:01:21,来自四川,92820728192,儒雅可乐DF
7124319590255428359,地方国企随便进？,14,301,2,2022-07-25 22:40:08,来自江西,452597589749155,依兮凭栏2020
7124508872697742092,我想问一下，这种单位怎么样才能进去？我儿子马上毕业了，也想进这种单位，[捂脸],8,87,0,2022-07-26 10:54:52,来自广西,1745645044762695,玛莎拉蒂DD司机
7124466342866666243,昨晚加班到两点刷到这个消息，整个人都崩溃了[流泪],8,133,0,2022-07-26 08:10:18,来自浙江,3087028124658504,南江金手指
7124490357617951528,凭什么处理人家，他又没违法，只是实话实说发个朋友圈而已。,6,217,2,2022-07-26 09:41:44,来自四川,2282190041525308,喜欢偶尔发点言
7124471716973740800,这不是炫耀，家里确实有后台、有钱，或许这只是冰山一角，人家已经在努力低调了,5,448,2,2022-07-26 08:30:06,来自河北,6814763701,弘武苏伟
7124284307174654755,他父母怎么不管着他[捂脸][捂脸][捂脸],11,128,2,2022-07-25 20:22:33,来自江苏,104502019544,威武陛下
7124514463860359968,为什么只有周一个人的回复？是不是他自己的私密只有自己可见度朋友圈？,3,15,1,2022-07-26 11:16:42,来自上海,108129801100,小始末
7124468799982289703,孝子贤孙啊,0,281,1,2022-07-26 08:20:01,来自北京,65104970635,周244182851
7124303896302175013,说实话，真有点不相信二代会是这智商[捂脸],27,334,4,2022-07-25 21:38:49,来自四川,110070714913,匹夫2489
7124282949499470622,曝了一帮人，小伙子，人民感谢你[赞],2,779,4,2022-07-25 20:17:43,来自广东,4322871932098471,漫话科产教
7124543593696215842,如果查出问题，这个小伙子算自首不？,5,45,0,2022-07-26 13:08:49,来自湖北,64237580250,风前絮8人生
7124456993510769408,有些人在绞尽脑汁发火箭，有些人在绞尽脑汁花不属于自己的钱，好气,2,236,1,2022-07-26 07:32:48,来自江苏,663754204266251,yiyiyouyouyiyi
7124462409963995907,他有意无意间揭露了这个社会的真相,2,253,0,2022-07-26 07:55:05,来自湖北,67883558869,85868861
7124305629162013440,"有职务，有姓名，顺藤摸瓜，一抓一个准。
哪里找这么懂事的孩子？",2,444,3,2022-07-25 21:45:12,来自河南,14592839792,河南周工
7124482031794766633,这种公司的员工凭本事进去的不多,2,63,0,2022-07-26 09:09:58,,2375394939911534,顾村老林
7124310867172213517,处理人家干嘛？不查查他说的事情？[what],5,179,0,2022-07-25 22:05:49,来自河南,4041431089939806,吴老实001
7124312525327696675,名字好啊，终于打劫了自己家族！,10,351,1,2022-07-25 22:12:01,来自江西,97915345155,亮我中华
7124494988067029799,优秀的人啊,0,24,0,2022-07-26 09:59:47,来自安徽,67485631971,全54
7124337297788568335,哈哈哈！实话实说了，看看调查结果是什么？,10,246,0,2022-07-25 23:48:47,来自山东,3306977527335144,枫雨之林
7124326392891704072,"小孩子不懂事
尽说大实话",1,76,0,2022-07-25 23:06:35,来自重庆,100864673691,4月16新注册
7124327118473347880,建议顺藤摸瓜 一定收获满满,3,89,0,2022-07-25 23:09:07,来自四川,3906540473,终南山农人
7124484324237624098,现实…,0,36,1,2022-07-26 09:18:54,来自江苏,52078913623,善心善念幸福相伴
7124482052707795716,这孩子教育的好啊，实事求是实话实说。,7,668,1,2022-07-26 09:11:12,来自江西,99964787833,古树阳光
7124465294466155294,只说喝了20万一斤的茶叶，但没说茶叶来源啊。,11,217,1,2022-07-26 08:05:22,来自广东,22926977077,思念是堵墙
7124530814322983684,自查自纠没力度，应该避嫌，让外部力量来调查,1,21,0,2022-07-26 12:20:02,来自江西,3227771736170576,顽强清风TA
7124502541257425705,不要对实诚的孩子进行网络暴力，以后谁还敢说实话呢,1,144,0,2022-07-26 10:29:03,来自湖南,67586518592,牧莘沐非
7124501067991466792,这个正八经的查吧！不需要解释,2,43,0,2022-07-26 10:23:20,来自美国,58558851641,07Bystander
7124375116653822720,国控公司能核查个啥？查他不该乱发朋友圈？[抠鼻][抠鼻][抠鼻],2,221,1,2022-07-26 02:21:04,来自山西,69616757429,guorongtian
7124285605575410436,国营单位都一样，最高伙食费一人一天有一百二十多的，这还是送菜的供应商透露的。,3,215,1,2022-07-25 20:27:48,来自广东,659334390615262,淡定雪梨Wy
7124340311107240744,大家不要急，坐等后续，有关部门你们立功的时候到了！加油！,6,147,1,2022-07-26 00:01:01,来自广西,1997129060990259,乌鸦的思考9911
7124488919244620558,人家记录真实生活，哪里言论不当了？孩子说真话不对嘛？,3,349,2,2022-07-26 09:37:21,来自广东,2498561428175644,护肤好好规划好
7124469390468580100,不是临时员工，是普通员工？,7,266,1,2022-07-26 08:22:00,来自广东,4688189959,Gd—Sakura
7124590475163943718,周某这孩子太诚实了！,0,10,0,2022-07-26 16:11:33,来自河北,3303266575,小谈侃侃
7124293046359098112,天啊，还有这么明目张胆的，现在不都低调的不行么[捂脸],5,136,4,2022-07-25 20:56:19,来自河北,100771043467,1234567891053896
7124355985006936840,小伙子还是获奖感言发表得太早了,0,136,3,2022-07-26 01:04:49,来自云南,4384430348,不以己悲656
7124463739402715940,这智商这情商，连我这路人都看不过眼。子不教，父之过啊！,31,570,2,2022-07-26 07:59:22,来自广东,102883467050,勇敢的旭日z6
7124363846239896333,哈哈，普通员工喝20万一斤的茶叶，那领导喝多少钱一斤的茶叶啊？有没有200万一斤的茶叶啊？,47,1329,5,2022-07-26 01:35:07,来自安徽,23451673036,其妹妹
7124330253887537954,小伙子狠起来连自己也坑，牛🐮！[泪奔][泪奔][泪奔][赞],0,48,0,2022-07-25 23:21:16,来自浙江,81200763964,帅气的小小马
7124322847954076431,这小伙有啥错么？调查什么？难得活的这么真实,1,206,0,2022-07-25 22:52:11,来自湖北,5827958304,7Tom7
7124485382728680228,没有这些背景能进这个单位么？虽然是普通员工。,6,186,1,2022-07-26 09:23:25,来自四川,94413008052,xiangniannian
7124412864315753250,跟单位老大吃饭时拍的照片？那属于工款吃喝，老大恐怕也要搭进去,17,633,4,2022-07-26 04:45:02,来自黑龙江,619759177572539,香漫四季
7124452854793798413,还用调查吗，直接说说他爸姓字名谁，在哪单位任何职务,0,160,0,2022-07-26 07:17:19,来自山东,109687144764,秉持正义知足常乐
7124448702206624516,这个小孩是个明白人，知道感恩。,0,38,0,2022-07-26 07:01:57,来自山东,16772273947,就是不哈青岛啤酒
7124500256343556879,现在实诚的孩子越来越少了,1,49,0,2022-07-26 10:20:13,来自江苏,103927494007,更上一层楼1968
7124357895718355747,我认识一个女的电网二代也在朋友圈这样[黑线],42,704,4,2022-07-26 01:11:08,来自山东,111641628153,定制真皮方向盘套
7124344310149497632,好一点的国企公司里很多的员工都是关系户进入,3,117,0,2022-07-26 00:18:30,来自江西,69600393426,kldxcy
7124367599584330534,发现一起，彻查一起，为了世界的微光，万万不能纵容！,9,84,1,2022-07-26 01:54:03,来自重庆,4001827313,光光小怪獸
7124366752770704131,该集团不是什么人都可以进去吧？,36,1091,7,2022-07-26 01:49:06,来自江西,98189904180,宗遇宁
7124479998966596367,请停止对这孩子的网络暴力！！！他做错了什么？只是说实话而已,2,247,1,2022-07-26 09:02:10,来自山东,107697650936,荣誉
7124322930644894471,核查处理的结果就是教育本单位职工学会低调,0,50,0,2022-07-25 22:53:00,来自北京,59580639263,自在涅瓦河
7124431776906543912,这孩子品性还不错！,1,38,1,2022-07-26 05:55:49,来自山东,52640350604,木马138949494
7124514321711104782,真把国有资本当自家资产了,2,11,0,2022-07-26 11:15:41,来自四川,73890152973,卖鱼的理科生
7124378807867736865,目前集团并表新钢集团，建工集团等四家省属企业股权。什么叫“并表”？令人匪夷所思。,9,29,2,2022-07-26 02:40:54,来自湖北,82332211496,唐伯虎午夜梦回
7124457903863972621,孩子说出国企的实情了，孩子没有错，只是我们的国企还有很多地方要大改，不能变为少数人的国企。,0,91,1,2022-07-26 07:37:22,来自浙江,5737281481,三横一竖王62237488
7124501425190732585,这家族怎么就忘了教导这孩子，进入社会第一课就是怎么发圈？,0,29,0,2022-07-26 10:24:43,来自宁夏,1847646798745024,云海
7124480208698639137,把工资，福利能说一下吗？不一定敢吧！,3,21,1,2022-07-26 09:03:40,来自江苏,10626480959,霜天钩月
7124466436570907427,划重点，家族，一起查查。现在这样坑爹的不多，刚好一起搂了。,1,23,0,2022-07-26 08:09:28,来自陕西,888037901079309,老何游山玩水
7124285549464077071,"应该多一点这种，
不仅不应该处罚，
还应该奖励！
让更多的人愿意出来爆料！
这才是最该鼓励的！",1,108,0,2022-07-25 20:27:08,来自重庆,52540032865,赚钱清债的骏哥
7124467998702322472,这个年轻人很实诚，如讲得有不妥之处，还望社会各界宽容！？,2,555,2,2022-07-26 08:15:37,来自浙江,58959428986,神秘雪碧ZN
7124437830947898120,赞赏实名制举报的行为[赞]大聪明,0,26,0,2022-07-26 06:19:30,来自黑龙江,92131681729,公考李锦鲤
7124462351373697827,这孩子底子好 实诚[比心],0,74,0,2022-07-26 07:53:43,来自山西,1355077507612939,清风湖面
7124312911610217228,真的假的！,1,31,1,2022-07-25 22:14:08,来自四川,105045217498,阳光榴莲
7124514540658148132,这是国家的好孩子[赞][赞]实事求是,0,19,0,2022-07-26 11:16:41,来自辽宁,111168341485,过渡自己
7124338009394610975,国企这样搞能不亏损吗？,6,298,1,2022-07-25 23:52:48,来自江西,317123609508715,勇者喜鹊80
7124284234487579395,还有这种脑回路的人？[捂脸][捂脸][捂脸],1,60,0,2022-07-25 20:23:03,来自湖南,4289185768,蝶尔美容
7124335767065232163,这怎么叫不当言论？这是举报，自首,0,183,2,2022-07-25 23:43:04,来自重庆,60637132960,风167911026
7124554837714830115,这孩子多好哇，实诚不说慌，不虚伪，[我想静静],0,12,0,2022-07-26 13:52:35,来自山东,6366651331,redapple
7124458261897823017,现在的网友看到这种新闻，就像看天气预报一样平静。好魔幻。,5,136,2,2022-07-26 07:37:58,来自河南,51757090369,松树下的王二狗
7124606151597540128,家族裙带关系，应该彻查。,0,7,0,2022-07-26 17:12:33,来自湖北,86202711911,风助雨威
7124320241668801312,活的真实多好，多晒才阳光，继续加油，让穷人多开开眼界！,0,38,0,2022-07-25 22:43:14,来自江苏,50296035636,完美诱惑1
7124481759899091748,曾经在东北某地市级电视台见识过，一个家族的人可以在食堂聚餐摆几桌。[捂脸],0,13,0,2022-07-26 09:09:34,来自北京,3694052143,卸下你的防备
7124550933623358239,"优越感都快从朋友圈爆出来了[捂脸]。
这人的生活代表着一个阶层的正常生活，但这个阶层的人只在日常生活中在身边的圈子里显示他的优越，鲜少如此高调频繁的在社交圈子发，本来没什么大不了，可当他把自己的优越感公布于众后，那很多事情就不是那回事了。",1,15,0,2022-07-26 13:37:56,来自湖北,5730322658,朱迪兔的尼克胡
7124477910500950818,如果查证属实，就通报表扬一下这孩子，如果查证是他撒谎呢，就应该处分,1,135,1,2022-07-26 08:53:58,来自重庆,76717964071,谢戈同志
7124474270906155807,很多省属的融资平台经营管理都不怎么样，这是一种管理上的倒退和资源浪费。搞一些豪华办公楼，办公楼比多数央企都豪华，经营上却不见什么明显的成效。,0,30,0,2022-07-26 08:40:19,来自湖北,9444625848,唐岛湾的渔夫
7124311797498397455,说的都很真实！财富固化就是这么来的！孩子说的都是实话！官方的回应可甄别一下,0,80,0,2022-07-25 22:09:09,来自广东,110423819821,Joe的天空
7124308586213229344,这，，，挺有才学啊，哈哈。属实大义灭亲啊。[赞][赞][赞][作揖][作揖][作揖],1,162,1,2022-07-25 21:57:13,来自山东,75993639578,子小日月东
7124331603765117726,怎么进的这个单位也一起查,13,538,4,2022-07-25 23:27:11,来自四川,108793717413,ABC焦点
7124476814944666403,能看出来这孩子是个诚实听话的人，就是智商情商方面不太健全。,2,38,0,2022-07-26 08:49:46,来自广东,109406021401,啥都能说一嘴
7124502370251735840,太实诚了，还是很好审他的[呲牙],0,10,0,2022-07-26 10:28:25,,11693289256,蛮荒大彪客
7124473860703372071,"这不是不当言论引起关注！
只是真我表露，最真最纯的东西，没添加剂的真实言论引起关注。",0,13,0,2022-07-26 08:39:07,来自广东,6923761250,还有哪个昵称没人用
7124432793069110028,也有人造假炫富的[捂脸],1,30,3,2022-07-26 06:01:40,来自山东,92745234600,陌上唱歌1
7124472056770888448,国企招人是怎么样的？定向定人？,18,222,3,2022-07-26 08:31:18,来自四川,83885488072,清风夜谈
7124440343885644584,这孩子！智商情商都缺了一角，但不得不承认，这是个诚实的孩子[捂脸],1,45,0,2022-07-26 06:28:34,来自山东,55955938245,战天斗地怕过谁
7124336868510483203,人家又没违规，调查什么？难道朋友圈被带出的其他人慌了？,0,26,0,2022-07-25 23:48:40,来自重庆,54946271479,TED哥
7124487778230240004,国控集团核查什么呀？是核查他说的是不是事实吗？,0,19,0,2022-07-26 09:33:22,来自四川,2370165157671870,凤歌夕阳
7124540917000209164,普通员工能见到这么多普通人见都见不到的人[狗头],0,3,0,2022-07-26 12:59:14,来自广东,3043095805,用户名5066612
7124314007464772352,能进这个公司的基本都有关系,2,191,0,2022-07-25 22:17:52,来自湖南,4212576481,我是谁35665519
7124438855008158504,尤其是国资管理系统吧。这位同学其实是个好同学，敢于真的揭露自己，自我剖析很到位。就看纪委怎么行动了，能否按同学提供的护官图线索去理出头绪。,0,23,0,2022-07-26 06:22:50,来自甘肃,57968781492,西北老疙瘩
7124289474019869478,只要没违法乱纪，即使曝光了也拿他没多大法，只是其他人干不干净，受不受他牵连就难说了,1,40,1,2022-07-25 20:43:00,来自重庆,2832890953,粗糙的男子
7124535137504789248,这孩子不错，实话实说。只担心将来工作中别出事就好！,0,4,0,2022-07-26 12:35:49,来自天津,101730760247,LTG1234567890
7124451603226575631,不错进步了，不说临时工了，改成普通员工了！点赞[捂脸][捂脸][捂脸][捂脸],0,88,0,2022-07-26 07:12:22,来自江苏,1015587636779852,冲冲冲冲冲冲喜
7124318968869094147,我看后陷入了沉思，我无话可说！我能说什么呢？,9,156,3,2022-07-25 22:37:52,来自河南,2924341479611748,姚平河
7124525024958202639,"完全相信 周姓员工的朋友圈是真实的。 人家就是在客观描述和记录生活而已，就像普通人买个雪糕都要发个朋友圈一样。
另外作为小半个股权融资行业从业人员，我知道的故事是 类似股权管理部这样的部门，是不可能有“普通背景”员工的[打脸]。",0,43,0,2022-07-26 11:56:38,来自重庆,74273752013,我就是不告诉你我名字
7124508350163403527,天呢 现在的年轻人都这么真诚了吗 果然国家需要这样的人才[泪奔],0,12,1,2022-07-26 10:52:41,来自山东,66836573841,橘子君JJ
7124420296325219075,如此智商，是如何被提拔为领导的？,4,49,1,2022-07-26 05:15:56,来自山西,5093737481,冰峰228580091
7124317698683306752,20万一斤，哈哈哈哈哈，含泪赚19万8[呲牙][呲牙],11,128,1,2022-07-25 22:32:18,来自福建,98624244119,芋丝油炸饼
7124499419932377860,得给这孩子颁个反腐倡廉大义灭亲的奖啊。。。,0,23,0,2022-07-26 10:17:02,来自广东,100415435725,过儿我是咕咕呀
7124430957138379552,实力坑爹就是要这样的，不愧为当代的好青年！,1,65,1,2022-07-26 05:54:40,来自浙江,101415842047,路边l鼓掌人
7124539138049213219,该查的不是他，而是他爹，还有他大伯、二伯等人，言论也没有什么不当，不要搞错重点了。,0,11,0,2022-07-26 12:51:30,来自福建,54417835310,卸甲归田09
7124467655687701262,小伙子实在人，只是实话实说！见过坑爹的，这回见识了坑家族的！,0,7,0,2022-07-26 08:14:55,来自山东,510623532459486,音乐伴咖啡2022
7124457640289239849,人民需要知道人民的钱是谁在帮着花、怎么花，这位员工的汇报客观、详实，人民感谢TA,0,68,0,2022-07-26 07:35:20,来自河北,3500500740481792,流光灰舞
7124465468199060227,小伙，你是个实诚的孩子，你适合搞宣传。不错。,2,288,1,2022-07-26 08:06:56,来自四川,104975490328,夜阑箕斗
7124436707768173352,回避了这小伙说的是不是真实，其家族互帮互助的小圈大圈,0,66,1,2022-07-26 06:14:56,来自江苏,2709674369231031,未来电子科技3g9H
7124446618573079330,表达的到位，必须严查,0,8,0,2022-07-26 06:52:58,来自浙江,5472799328,钱江56041267
7124465374733058830,坑了三大爷、大爷。还坑了他爹。,9,119,0,2022-07-26 08:06:15,来自河北,92766203799,铁哥们345
7124417863552910118,国有企业亏损是有原因的！！！,0,71,0,2022-07-26 05:06:29,来自江西,111349278228,江南一客6
7124490834217108258,朋友圈当日记本，厉害的。,0,4,0,2022-07-26 09:43:43,来自上海,100882254826,飞虫之尊
7124472776543142693,实话实说才是好孩子，应该保护诚实的孩子！,0,129,0,2022-07-26 08:34:46,来自广西,2163491972595383,亚聊
7124463388298019619,现在就是拼爹的时代[发怒][发怒][发怒],0,36,0,2022-07-26 07:57:52,来自甘肃,88822685993,无聊8831
7124353579632739110,看来不是空穴来风吧！现在的社会就是这样的关系人和事，很正常的现象。,0,74,0,2022-07-26 00:57:05,来自广东,104532444054,小孩的心思猜不到
7124346236580545315,文中提到的是不是都应该查查？,0,31,1,2022-07-26 00:24:12,来自浙江,21322265116,吴江帮
7124501817589433124,实事实说而已，千万不要大惊小怪，不管你们信不信，这是板上钉钉的事。,0,13,0,2022-07-26 10:26:18,来自广西,360278763517805,踏月寻星河7I0C
7124519333405344551,跟你吃饭的单位一把手很郁闷[困],1,10,0,2022-07-26 11:35:22,来自山东,58123229011,蒙古丐帮副帮主老和
7124477956437246731,实话实说而已，调查什么?,0,11,0,2022-07-26 08:55:36,来自云南,105761709674,孤岛的鯨
7124453408547259136,大义灭亲！应该继续深挖,0,11,0,2022-07-26 07:19:07,来自安徽,101400503926,juanjuan3191
7124517203298960159,别人也有发圈的权利，只要实事求是，没有能虚作假。,0,3,0,2022-07-26 11:26:59,来自江苏,104907486522,职场老石
7124443609943982880,"劼jié谨慎 [prudent]劼,慎也。谨慎，勤勉。
——哈哈😄，笑掉大牙！",12,61,3,2022-07-26 06:42:20,来自吉林,3320145779111422,德云之光
7124425861042406175,关键是有炫耀的资本,0,43,0,2022-07-26 05:34:13,来自云南,50026995929,光辉岁月被神偷
7124543251415696132,公司自查会有什么结果？大家信不信！,0,2,0,2022-07-26 13:08:18,来自广东,1091150555912632,王旺旺9409
7124525565004251934,我一直都在纳闷：那些上万的茶叶、那些烟、那些酒，兜兜转转的最终都进了哪些人的嘴里了？今天明白了,1,12,0,2022-07-26 11:59:13,,93143438695,正义狙击炮
7124483495791248167,巨额资产来源不明加涉嫌行贿受贿,0,37,0,2022-07-26 09:16:35,来自陕西,3918269208082875,饭又烧焦了
7124382831635645225,对如此诚实的好员工，为什么要处理？依什么规定处理？还不让人说实话了？[抠鼻],0,90,0,2022-07-26 02:52:53,来自山西,2682407844320989,执着的小猫rt
7124478132249903913,本人就上过这种当，发朋友圈被小人截图告到领导那去，导致被开除，所以防小人不防君子,0,5,0,2022-07-26 08:54:58,来自江西,109513206772,分秒必争豆花S2
7124366210489205515,这个家族真厉害，平民百姓点么活呢？,0,34,1,2022-07-26 01:47:18,来自河南,50031191772,不言而遇4
7124570797481427715,天呐，普通员工都这么有钱,0,20,0,2022-07-26 14:54:51,来自辽宁,58819942831,小敏1337373780733
7124512718413415171,人家认为很正常的事情,0,4,0,2022-07-26 11:10:01,来自河北,2981514902243848,牛妞正正
7124478373245960994,期待调查结果。,1,4,0,2022-07-26 08:55:53,来自重庆,4463636564411051,一个守法的中国公民
7124446552172544768,这个人已经走上人生巅峰了，为啥这么高调,0,9,0,2022-07-26 06:52:23,来自安徽,2704406534161420,老彪哥
7124464119058645771,这叫苍天饶过谁，通过熊孩子的口举报，,3,82,1,2022-07-26 08:01:19,来自广东,8861218537,有悔m0q2
7124474902194815785,这个周某才是真正的群众监督的典范[赞],0,16,0,2022-07-26 08:42:15,来自山东,108016650957,牧韵云
7124443423649612583,这个确实就是现实！没有什么可以大惊小怪的。[不看][不看][不看],0,13,0,2022-07-26 06:41:35,来自河南,104165050806,新时代的预言者
7124455407761883945,普通员工能干这么大事？,1,200,1,2022-07-26 07:26:49,来自天津,110471385312,拓荒者23333
7124328443390903040,顺便查一下钱的来源,2,29,0,2022-07-25 23:14:16,来自江西,3066473056,陆5396729
7124516851044336399,这是个老实孩子，说得都是内心深处的真实感受，应该是个干部苗子！[大笑][捂脸][呲牙][作揖],0,2,0,2022-07-26 11:25:09,来自福建,84510637006,岭南渣渣叔
7124482932693353246,怕是卧底[捂脸][捂脸][捂脸]了解情况，通过朋友圈举报，好同志啊,1,26,1,2022-07-26 09:13:54,来自云南,4563268909,明天要早起早起
7124472690916377375,说点实话调查他什么？,0,9,0,2022-07-26 08:34:27,来自吉林,2928752871877976,喜欢清静随心的生活
7124501263211561732,诚实是一种美德！建议CCTV颁发给他2022感动中国十大人物奖,0,14,0,2022-07-26 10:24:10,来自云南,993578802746472,一心一意艺术家Wq
7124454367352701710,让咱们老百姓多见见世面开开眼，免得被人说没见过世面。,0,19,0,2022-07-26 07:23:40,来自辽宁,59083356104,月琴311
7124346064878125858,支持详细调查，证明当事人及其家族的“清白”,0,43,1,2022-07-26 00:23:24,来自江苏,61359285395,修己之备
7124478339695510283,神通广大的“普通员工”！内幕惊人。,0,33,0,2022-07-26 08:56:30,来自安徽,3562257345,黄山侠
7124468147515802383,国企干活都是临时工，发朋友圈的都是正式工。。。,0,8,0,2022-07-26 08:16:09,来自黑龙江,171149538111203,好学橘子YJ
7124332266792485663,这家伙 会不会被写入反贪历史中,2,65,2,2022-07-25 23:29:50,来自安徽,2994717817845308,CMSJ365
7124480892273476382,"努力搬砖吧[捂脸]
这样的事情太多了
只是 都很低调",0,20,0,2022-07-26 09:06:08,来自上海,6070891544,Antwit
