7124862116955521795,水流小了，自然有浑水流入,4,345,6,2022-07-27 09:44:22,来自山东,6747888700,月夜追风
7124932269760201484,corser可以扮游戏角色，中国神话角色，非得要日式的才行吗？没有自己国家的风格？,54,2487,13,2022-07-27 14:17:53,来自中国澳门,3883100205513208,11322的美景
7124952417988608803,艺术展览应该去商业发达的城市吧？为什么那么多的举办地是小县城？让人怀疑其用心！,13,875,4,2022-07-27 15:35:20,来自北京,5936592132,九月枫林
7124970497129055010,本身也不是啥正经事儿~对青少年负面的的影响很大！,2,599,4,2022-07-27 16:45:32,来自内蒙古,3666083603,云上泛舟
7124937941902181159,漫展为何遵循夏日祭的时期举办？其它日期不可以举办吗？,9,264,0,2022-07-27 14:40:17,来自广西,6785373436,点点咪咪呀咪
7124824214498591518,我们的文化和旅游局对于各种文化娱乐活动要注意内容审核,4,1072,12,2022-07-27 07:18:54,来自湖南,3853297566,说法惊堂木
7124967767136551717,漫展为什么要起名为“夏日祭”呢？,2,127,0,2022-07-27 16:35:22,来自北京,4314123795704462,自若奶酪NI
7124945655444800256,如果漫展变成张扬异国文化的载体，那么这种漫展不要也罢，宁缺毋滥，我们乐意见到自己民族的文化。,7,1414,3,2022-07-27 15:08:54,来自浙江,54290978767,独孤谜探
7124968180472890147,广州的萤火虫漫展在事情发酵的前几天就举办完了[抠鼻][抠鼻],1,7,0,2022-07-27 16:36:41,来自广东,5968156195,悲酥清风d8
7124963201758003983,不要把漫展和夏日祭联系起来,9,65,20,2022-07-27 16:17:12,来自陕西,1578516351297395,懒洋洋530
7124929313413595944,为什么广州和昆明延期，难道还想着等风声过去，继续办吗？,18,870,1,2022-07-27 14:05:45,来自江苏,6708639105,俊俏船帆YC
7124947905311769375,为什么叫夏日祭？叫动漫展不行吗？,2,45,1,2022-07-27 15:18:13,来自内蒙古,1191493211794749,奇幻生活家h
7125013094413452068,我就特别想知道，这个动漫展到底展示了什么？宣扬了什么正能量？还是给孩子们树立了良好的审美？中国，戏曲，舞蹈，乐器，剪纸，皮影，刺绣，还有各种非遗文化，这么多美的，正能量的多宣传宣传多好,0,25,0,2022-07-27 19:31:01,来自河南,91607040114,娇儿662
7124933413266178831,不是间歇性反日，而是这些做动漫的人是否觉得只有日本的动漫才是叫动漫？如果不是的话为什么动漫一定要挂钩日本？,2,299,1,2022-07-27 14:21:49,来自湖南,104708374902,喜玛拉雅蓝
7124971807870403369,离开夏日祭离了日本就没漫展了？,0,48,0,2022-07-27 16:50:38,来自广东,92836317900,alinyar
7124954840345985792,日本这些动漫深受青少年喜爱，很容易在感官上就亲近日本元素。他们没有经历过那动荡的抗战时代。没有深刻的记忆，所以很容易带偏。文化入侵才是最可怕的。,2,263,2,2022-07-27 15:44:36,来自江苏,259076966071899,优雅的鱼E
7124942635781489421,本文作者看上去取消此次夏日祭，有些不满！,9,467,1,2022-07-27 14:58:03,来自重庆,1503784404266504,充满元气的直率生活家
7124942919240663811,最讨厌看日系风格的漫展，没有国产漫展吗？,4,179,1,2022-07-27 14:59:11,来自吉林,1750010226814397,wang
7124947508559840037,真的漫展也希望文化部严格把关，爆裸图片卡通美女，青少年观展影映不好,0,141,0,2022-07-27 15:16:31,来自广西,329480632015451,A极雨
7124962510171865856,怎麼，夏日祭 想躲在 動漫文化後面活下來嗎？,0,38,0,2022-07-27 16:14:29,来自山东,96499470281,GJUNE
7124939060853900070,不是对动漫展有偏见，而是这样的漫展能传递出来的正能之风，而不是让你们忘记那些不可磨灭的历史，还弘扬日式文化！泱泱大国五千年的文化不够学习的？？？,10,738,6,2022-07-27 14:43:57,,93953496432,工地流浪客
7124933915353416452,漫展为什么是日本风，中国风不行吗？己经日化不要辩解。,1,106,1,2022-07-27 14:24:23,来自安徽,2840787074960092,非凡溪水zD
7124907117672465164,做中国的漫展,1,243,0,2022-07-27 12:40:04,来自黑龙江,97127564868,田园牧歌669
7124933421012435712,动漫人物渗透了太多的日本元素，为什么不制作一些中国风的动漫呢,7,399,3,2022-07-27 14:21:32,来自河北,4459271761175943,博学多才的小鱼im
7124960688056943398,其实踏踏实实的搞漫展不会有人举报啥的，就是文化交流活动挺好的，非要搞那些什么祭，把事情弄得不单纯了。,0,27,0,2022-07-27 16:08:00,来自北京,71489008214,迷糊的浆浆
7124915807339053864,五千年文明史的国家，自己的各种传统节日，节气多了去了，哪一个在全国范围继承发展搞起来了？反倒是圣诞节，万圣节，感恩节，闹得灯火辉煌，，，我们的节日除了放假休息，还剩啥？,16,1232,3,2022-07-27 13:13:05,来自北京,70511501512,腊月寒蝉
7124993576547369763,"为什么动漫展一定要用“夏日祭“了，为什么不改成“夏令营""了。",0,10,0,2022-07-27 18:15:07,来自福建,830879644269815,艳阳高照的火龙果
7124924373135426345,最讨厌看日系风格的漫展，没有国产漫展吗？,3,568,2,2022-07-27 13:46:31,来自广东,69571279777,官然染
7124967976373863168,日本漫展走向死亡！！！！！,0,16,0,2022-07-27 16:35:52,来自浙江,53618765027,石头142372432
7124934581308408587,汉服文化跟漫展是两回事，搞不了漫展就好好搞搞汉服文化宣传,3,179,3,2022-07-27 14:27:04,来自德国,60965459868,噜啦啦啦12
7124931949877461763,严厉追究发起人，严查深挖坚决打击！！[加油],0,291,1,2022-07-27 14:16:42,来自四川,96765516539,464751802583
7124940504903189262,动漫展为什么一定是日本元素?不能是中国元素吗？,12,612,1,2022-07-27 14:49:50,来自北京,53434321306,20161231dtt
7124917940293780224,漫画展是假的 文化渗透是真的,8,1254,3,2022-07-27 13:21:28,来自江西,92496242345,淡淡小红花
7124931357729997600,支持国漫！,0,23,0,2022-07-27 14:14:41,来自甘肃,54014090747,云停super
7124918253021365032,漫展是漫展，夏日祭是夏日祭，它们是一个吗？,15,343,4,2022-07-27 13:22:48,来自山东,89890614505,重点直击
7124926173167092493,"漫展可以不办，可以改办。
夏日祭，风情街之类是万万不能要的！
供奉战犯，不是能不能的问题，是犯罪犯法的问题！
安说这是最简单不过的道理了。有的人就是为了钱，把原则，法律法规都不要了！
怎么办？依法痛打！",0,230,0,2022-07-27 13:53:44,来自天津,3874317229113160,智勇双全旭日xg
7124932003220964130,就是日本漫画浸蚀了00后，动画片蜡笔小新掀老师裙子等不雅画面也被幼儿模仿,1,136,3,2022-07-27 14:16:22,来自重庆,53503621990,紫狐609
7124950315560370944,漫展行业？根本不该存在，免费看就好了，现在都是国漫时代,0,22,0,2022-07-27 15:27:15,来自广东,2106297779759480,gzyjchen
7124914248848917284,这个，好好推下汉服文化，是很支持的～老祖宗的很多东西值得复古一波～,8,316,4,2022-07-27 13:07:28,来自河南,434998637499188,闲趣电影
7124917585392468776,漫展就漫展，别叫夏日祭,26,991,8,2022-07-27 13:20:02,来自江苏,68802476809,清华helloYY
7124872122539164453,夏日祭什么内容啊,2,77,1,2022-07-27 10:23:11,来自河北,1161505186812400,博学糯米Ir
7125013289393914662,动漫产业美国也不差的、日本人文化输出能力太强、漫威公司和DC公司是能够对抗日本动漫的两大行业巨擘、日本人的动漫不是给宅男看的就是给少女看的、富含人生哲理与教育意义、创作题材广泛、覆盖全年龄段、画风细腻电脑制作技术精良。这是饱受低幼化痼疾困扰的国产动漫所无法企及的。国内拿得出手的漫画家除了颜开、黄玉郎、马荣成、牛佬、汤蔚青、游素兰基本不值一提。,0,0,0,2022-07-27 19:32:00,来自上海,3904141538,孤帆远影烟波江上
7124973782963684129,动漫展为什么一定是日本元素？不能是我们自己国家的元素吗？,0,9,0,2022-07-27 16:59:02,来自河南,7385406010,味道
7124926567251821353,为什么漫展要于夏日祭连在一起？,0,49,0,2022-07-27 13:55:05,来自甘肃,1538956781425023,俊俏晚风tm
7124960843141743395,漫展这些年出的事还少吗[黑线]是时候该整改了,0,11,0,2022-07-27 16:08:09,来自宁夏,5520818600,箫韶乆成
7124901451670946573,还好我家小孩没这方面的兴趣，从小这给她看抗日八年这方面的知识。,6,369,1,2022-07-27 12:17:48,来自江西,110873276077,y米淇
7124947057181721378,事实就是很多漫展会打擦边球，而且宣扬了不好的文化，青少年很容易被影响,0,15,0,2022-07-27 15:14:31,来自贵州,3737930003921516,烟巷陌
7125007089109402402,cos文化、汉服文化、洛丽塔文化等衍生业态随之诞生，也让展会愈发多元与包容。,0,1,0,2022-07-27 19:07:15,来自江西,3611226798820253,完美逗比老太太
7124902870784738063,中国不会漫展吗？,2,203,2,2022-07-27 12:23:01,来自上海,94979377781,正能量圆月GlY
7124898362016891683,做中国的漫展,7,473,4,2022-07-27 12:05:30,来自四川,61499502557,生活情感百态
7124929194924573475,那是夏日祭借了漫展的幌子才被取消吧,0,123,1,2022-07-27 14:05:19,来自广东,4195392182581128,洒脱的Sunny
7124874736995697439,我是第一次听说“夏日祭”[捂脸][捂脸],26,461,2,2022-07-27 10:33:21,来自辽宁,5309090656,杨诗云19309
7124941848061330176,漫展的出路就是去日化、去美化，突出本土元素。,0,35,0,2022-07-27 14:54:10,来自北京,5828319419,破除心中贼
7125014392638489352,我是68年的从懂事开始过正月十五，二月龙抬头，清明节，六月六，七月七，八月十五，九月九，每一个节都非常想念，最喜欢过春节，吃饺子，穿新衣服，直到现在也喜欢过中国传统的节日。,1,10,1,2022-07-27 19:36:05,来自山东,88267212236,王岁岁家的老妈
7124919605025948431,外来文化渗透太严重,0,71,0,2022-07-27 13:28:03,来自四川,100465853446,Always64053
7124925919164252963,漫画展是假的 文化渗透是真的,0,48,0,2022-07-27 13:52:22,来自四川,51680574364,无边的游荡GQ
7125016676772725539,为啥非要在这个时间举行？为啥要选在这些城市举行？为啥要叫夏日祭？为啥举办地连起来是日本地图？这些是不是都已经脱离了漫展本身举办的意义！,0,2,0,2022-07-27 19:44:33,来自山东,58010458941,为自己喝彩1413
7124927756080988942,中国五千年文化底蕴都做不出个漫展吗？！！！,10,487,0,2022-07-27 14:00:13,来自山东,106834701822,静心无欲
7124928213859992358,文化可以包容，日本的文化坚决不可以,6,393,1,2022-07-27 14:02:27,来自安徽,105721104841,渐行渐远119
7124904801951548160,什么叫“叫停”？应该是严厉打击！敌人已经渗透到全国各地了，还不加强防范吗？！,9,772,3,2022-07-27 12:30:28,来自北京,6537292355,桃小夭2019
7124920416649036584,动漫里很多价值观都有问题，对青少年有很多坏影响，没有动漫更好。,3,332,2,2022-07-27 13:31:19,来自广东,3869881669528111,霞兜CC
7124961236743799585,主要是漫展的对象大部分都是学生群体，把祖国的五千年文化拿出来更好。,0,13,0,2022-07-27 16:10:30,来自四川,4875287134,水中鱼儿1447734
7124900770000438053,我不懂那些玩意，但是我女儿看完白蛇缘起1-2，特别喜欢，还买套衣服去杭州西湖看了看，孩子也觉得挺好，没必要搞日本节日漫展节日啥的，给人家做宣传呢吗？如果我女儿喜欢那些，可能我就要教育她了，搞不清状况吗,0,50,1,2022-07-27 12:15:16,来自黑龙江,1710471085037779,o0一一一0o
7124786517180433184,漫展就是漫展为什么非要带上日本因素，这是什么用意。,51,741,4,2022-07-27 04:55:08,来自山东,110797249754,勇敢的清泉zb
7124906556776891143,我朋友的女儿也迷上了动漫，每次一听说有漫展就非要去不可，如果不给去就威胁父母说自杀跳楼[擦汗][擦汗],11,17,1,2022-07-27 12:37:46,来自广西,60454690493,糯糯宜
7124979564560466729,关了也好，以前漫展还有点活力，现在的越来越不行了，周边更新的极慢,1,13,1,2022-07-27 17:20:42,来自北京,3633551431,十二翼末日天使
7124943918781219625,这些动漫充满太多日本元素，就是日本想通过动漫推广他们的文化，通过动漫推广夏日祭，所以说动漫是这次夏日祭事件的推动者不为过，现在对动漫展管制我认为是有必要的,0,25,0,2022-07-27 15:02:25,来自广东,94480665555,隔壁的哈哈
7124922233193530147,夏日祭和动漫展从内容到形式完全不同，请别偷换感念，混淆视听。,6,173,5,2022-07-27 13:38:11,来自北京,6985391794,虫凰
7124901614486012685,文化可以包容，日本的文化坚决不可以,5,806,4,2022-07-27 12:18:45,来自河南,57669586981,静静悟理
7124931861452882726,"叫停……早些时候干啥呢❓
申办的时候是怎么通过的❓
别怕是有些人点进钱眼里了吧❓
无论是承办方还是场地提供方，还有某部门都要受到严惩，这样才能铭记历史",0,14,0,2022-07-27 14:16:21,来自河南,60765986736,默妍陌語
7124918427655029519,中国没有自己的动漫吗？这方面离了日本就活不成了，真这样的话，更没有必要举办了。,9,913,3,2022-07-27 13:23:14,来自上海,3566465731,蓝风
7124925820611117839,以后最好少播放日漫，虽然有些日漫挺优秀的，但作为孩子的童年记忆，可能会影响他的一生。我希望能影响孩子一生的是我们的经典国学，而不是其他国家的元素。现在有多少孩子只知道和喜欢奥特曼什么的，而对名族英雄和经典人物却知之甚少。,5,151,2,2022-07-27 13:52:10,来自新疆,96923331927,Smile75259335341
7124879560973894411,爱国主义教育深入人心，防止外来糟粕刻不容缓。,0,221,0,2022-07-27 10:53:26,来自浙江,110534496919,丁丁藕
7124925937913283368,就是要有敬畏，没了敬畏就抹了道德底线,0,35,0,2022-07-27 13:52:39,,66426206340,硝崖居者
7124926231375545121,为什么叫夏日祭？叫动漫展不行吗？,5,199,3,2022-07-27 13:54:17,来自广西,2897952536015373,一丝不苟豆花aH
7124873975473750818,把动漫做为文化入侵，最先受到侵害的就是我们的孩子[流泪],25,685,4,2022-07-27 10:30:28,来自山东,6334507104,金鱼缸521
7124940332374623010,中国五千年文化底蕴都做不出个漫展吗？！！！,7,275,1,2022-07-27 14:48:40,来自河南,74277654595,吃苦有福
7124922424160371471,要彻查二次元的相关商品，危害不是一般的严重！,1,116,1,2022-07-27 13:38:53,来自广西,103615999501,用户了Lz37439579764
7124971904767329064,重点不在动漫，在夏日祭，努力发展中国动漫多好。,0,5,0,2022-07-27 16:51:03,来自山东,1390262247257575,春天的牛牛
7124975609809961769,动漫展为什么一定是日本元素?不能是中国元素吗？,0,4,0,2022-07-27 17:05:31,来自四川,3043910301255935,快乐湖泊5i
7124943771829256993,日系文化，在潜移默化中矮化中国的年青一代，这是非常可怕的事实。希望更多的部门能够重视！,0,11,0,2022-07-27 15:02:15,来自浙江,78148031302,橙果Chengo
7124986945582711552,可以不需要这个行业啊！,0,6,0,2022-07-27 17:49:10,来自江苏,3003459330122052,智慧女神经
7125020660237812480,动漫展哪一个不打擦边球？别叫冤,0,3,0,2022-07-27 20:00:02,来自贵州,26042465344,风云说收藏
7124914241638892288,这些动漫、游戏毁了中国的00后们,7,189,1,2022-07-27 13:06:56,来自山东,106659979605,二哥的姜湖
7124873980943287055,追查主办方，看看是何方神圣,7,677,4,2022-07-27 10:30:31,来自山东,11814354021,不老女神nnn
7125025030648021798,希望有中国自己元素的漫展,0,0,0,2022-07-27 20:17:42,来自广东,1675291186180935,妙秒缪
7124932138298000167,北京来福士奥特曼展览跟这个有关系吗？,0,9,0,2022-07-27 14:17:11,来自北京,932804317152731,中医贤贤
7124871527434060558,叫主办方出来走走,1,299,2,2022-07-27 10:20:50,来自广东,10361972482,儒雅叶子MJ
7124904720984474409,为什么叫夏日祭？叫动漫展不行吗？,3,89,2,2022-07-27 12:30:09,来自四川,101930629407,乐天派精灵XM
7124901553823073024,其实这些传自日本的漫展根本没必要，中国文化底蕴深厚，为什么不发展基于中国文化为基础的漫画？说到底，习惯于拿来主义！,4,254,2,2022-07-27 12:17:39,来自广东,1891581881497624,W再回首童年
7124917572235182880,夏日祭是什么鬼？原谅我的孤陋寡闻，我目前懂的只有公众假期,2,48,3,2022-07-27 13:20:48,来自广西,104540632836,尔夜夜夜猫子
7124884322591048459,文化渗透真可怕,2,194,1,2022-07-27 11:12:00,来自辽宁,87110230370,安利红167
7124989457543381774,动漫人物渗透了太多的日本元素，为什么不制作一些中国风的动漫呢。,0,2,0,2022-07-27 17:59:29,来自江苏,106211156679,dxy江南水乡
7124915249341793055,为什么要日本的元素呢？中国动漫人,1,56,0,2022-07-27 13:11:32,来自广西,1886414166299496,绿城晴天
7124902308659970824,应该坚决彻查深挖幕后操纵者！,7,600,4,2022-07-27 12:21:14,来自山东,4199722954529180,聪明天空gH
7124889302530212608,中华五千年的传统文化 为什么不去多 宣传宣传？,7,238,3,2022-07-27 11:30:28,来自江苏,62965057513,心若寒冰JH
7124868478078763791,中国人民要警惕别国的文化渗透。,5,571,4,2022-07-27 10:09:03,来自日本,5695672252,进取小红花Fn
7124918733021184804,不能光是取消就完了，要把主办人名单交给公安和国安，由专业人员去查他们的后台❗❗❗[奋斗],0,19,0,2022-07-27 13:24:58,来自北京,59500728871,卯生壹
7124927946288202530,都是打着办漫展的幌子办夏日祭,0,22,0,2022-07-27 14:00:19,来自山东,5442218264,五味汤54773223
7124898095074247438,在中小学加强爱国主义教育 现在的孩子越来越忘本了 曾经的国耻对他们没半点影响,1,33,2,2022-07-27 12:04:42,来自黑龙江,1899603312774701,小关在回忆
7124940415140201224,作者居然认为南京夏日祭是因为被“多人举报”才取消的？？？,0,13,0,2022-07-27 14:48:57,来自广东,51498387763,勒爱客地个
7124874213470962472,警惕文化侵略,9,661,3,2022-07-27 10:31:18,来自北京,1446577158760500,mo上
7124917675830575910,民族情感不容践踏，更无法接受这一活动，漫展就是漫展，可以叫动漫节，可以叫盛典，但绝不可成为带有日本色彩的祭典。,0,12,0,2022-07-27 13:21:25,来自北京,3386092863623806,转菲881872179799
7124915534453605159,居然还是“多地”！太恐怖了，不知道那些参与的中国人是什么人，怎么想的？,0,24,0,2022-07-27 13:12:53,来自贵州,12800845156819,ldkdbdbdhizi
7124881989194859279,有些人为了利益，就忘记了历史，忘记了国耻,1,445,4,2022-07-27 11:02:00,来自河北,110809354553,粉月亮看太阳
7124927556087939874,作者在模糊漫展和夏日祭的界限吗？是何居心？,11,763,3,2022-07-27 13:58:49,来自山西,93480559513,清净之道
7124971216834003753,兰州的“同人动漫展”这个同人是什么意思？,0,3,0,2022-07-27 16:48:15,来自湖南,6928194551,寶feelingyou
7124914738995757831,查查谁在背后推“夏日祭”的活动,0,194,0,2022-07-27 13:09:35,来自爱尔兰,4006247083292123,爽朗的大气风筝
7124922179527443231,这还不是集体行动？还能说什么个案？,0,7,0,2022-07-27 13:38:24,来自黑龙江,58591087010,和合阅读
7124914959280341767,可以举办漫展 ，不是日本元素的就可以啊，还是说不举办日本元素的金主不给钱？,0,43,0,2022-07-27 13:10:18,来自北京,85958053690,司马天台
7124992810692215592,动漫展为何要取名叫夏日祭？知道中国最忌讳祭字。,1,1,0,2022-07-27 18:12:03,来自江西,60436398676,北斗星174011271
7124923871337710348,漫展就漫展，不要偷换概念，文化包容可以，文化入侵绝对不行,0,27,0,2022-07-27 13:45:19,来自福建,50939139139,福鼎桐山精神专科主任
7124890487634854659,有些人为了利益，就忘记了历史，忘记了国耻,0,71,0,2022-07-27 11:35:50,来自浙江,5954588337,HeIen72801228
7124916715053892360,漫展非得与夏日祭挂钩？被取消难道不应该？,0,74,0,2022-07-27 13:17:14,来自安徽,55464954770,爱家的男人都不坏
7124994152139424548,根本就不应该有举报夏日祭的想法,0,0,0,2022-07-27 18:17:35,来自重庆,71173099504,我是时间无语
7125001350442189608,冰冻三尺非一日之寒，文化渗透也是润物细无声。,0,3,0,2022-07-27 18:45:15,来自辽宁,108979066333,桃花源里的桃子
7124906558278435617,太轻描淡写了点，南京夏日祭活动被取消可不仅仅是因为举办地的原因吧,0,75,0,2022-07-27 12:38:04,来自山东,88317131905,半醒9721
7124892244796162816,支持彻查主办方！追责相关人员,1,204,1,2022-07-27 11:41:39,来自广西,5747841083,关注时事62745680
7124929643471618855,这篇文章有问题，不是漫展的问题，是因为“夏日祭”这个错误价值观的漫展,0,14,0,2022-07-27 14:07:48,来自安徽,6735523336,哈喽109662456
7124897459402785574,打着漫展旗号联系场地行举办夏日祭活动之实！,1,89,1,2022-07-27 12:02:55,来自江苏,109692931215,暖暖1869
7124908802318615328,国要强，必须先以青少年1为主-，牢记历史，警惕不良因素为主。,1,54,1,2022-07-27 12:46:27,来自陕西,2911949488138883,用户开4276730222251
7124903288696488738,囯漫一点也不差！为什么老是欣赏国外的？！,0,64,1,2022-07-27 12:24:26,来自上海,94979377781,正能量圆月GlY
7124926162983813925,漫展，中国没动漫吗,0,27,1,2022-07-27 13:54:06,来自河南,6937925709,灼灼其华1688
7124905615692415778,创新独特的中国古代传统文化漫展，没一个人举报，搞伤害民族伤疤的漫展，半个都不中…,0,60,1,2022-07-27 12:33:38,来自山东,1877617012911224,汗相
7124944115011175179,动漫不应该以依靠谁而存活，它的存在应是建立在健康性，审美性，娱乐性，对人身心有益的基础上，它才能自我成长。当其自我属性强大，其才能长足发展,0,6,0,2022-07-27 15:03:44,来自黑龙江,85681996188,潇潇·渔
7124927411384255236,漫展不一定非要沾染日本元素，漫展不是他日本一家的文化符号,0,13,0,2022-07-27 13:58:58,来自辽宁,87473537881,网友1899
7124914331695235879,一些商家无知到这种地步吗？,7,1035,0,2022-07-27 13:08:14,来自北京,2982352895611655,时间煮雨
7124921642962912012,瞧瞧这都是什么事啊？竟然多地都有准备举办这夏日祭的活动！渗透的这么深！有多少人被带偏了？,0,11,0,2022-07-27 13:36:52,来自福建,70784428194,安之若兰113
7124913632529842984,漫展就漫展，为何要搞夏日祭？,0,44,0,2022-07-27 13:04:44,来自广东,3927100498910823,木子
7125019368634712863,你们搞动漫展，公众不反对。为什么动漫展非得要日式的。难道没了日本角色。就搞不了动漫展了吗？难道非得用日式的动漫展来刺激国人，才叫动漫吗？,0,3,0,2022-07-27 19:55:10,来自辽宁,52691589524,智者贝尔3o
7124918396285797127,没有夏日祭就不叫漫展了？,0,18,0,2022-07-27 13:23:38,来自北京,98591880546,发呆的老猫444
7124897556395459369,找出举办人，严惩,0,42,0,2022-07-27 12:02:19,来自辽宁,51883701522,枫光美丽
7124893963198645005,勿忘国耻，牢记历史,0,17,1,2022-07-27 11:48:48,来自河南,53117768192,微笑枫叶Am
7124914198597223204,上海早就有，七年前我在上海地铁就有看到这种人穿动漫一类的衣服，包括化妆，头发全部是漫画人物，以前以为是什么活动，现在想想也是夏天这个时候，估计也是这个活动。,0,12,2,2022-07-27 13:07:17,来自山西,111116174148,峰浪宝
7124894260138164996,要杜绝这类事情再次发生。各个地方单位应提高警惕。,0,24,0,2022-07-27 11:50:22,来自四川,64125500301,吉祥安康607
7124918011946681103,搞不懂，喜欢看动漫就看，为什么要搞漫展？可能是我欣赏水平不高，真不觉得这些奇装异服穿的有什么好看，还有那些大街上喜欢穿和服的中国人咋想的，去年某漫展就因为穿着暴露上热搜的,0,11,1,2022-07-27 13:21:42,来自江苏,92610669640,戴面具的天使
7124971439031091998,别以漫展名义，行异国崇尚之风,0,3,0,2022-07-27 16:49:13,来自北京,642592011979688,菲
7124916676055433995,整顿小日子，影响了漫展？,0,21,0,2022-07-27 13:17:36,来自江西,1204701845269982,唱跳Rap不打篮球
7124916687346123534,漫展不是日本展，打着漫展的名号，实则在干些不好的事情,0,37,0,2022-07-27 13:17:06,来自新疆,93160659224,昆布茶72
7124885986161034020,看到有些人说抛开历史什么的，历史怎么能抛开，我们都存在就是因为历史,0,38,0,2022-07-27 11:18:02,来自浙江,1151925085538392,平平无奇路易斯古
7124916246013543203,夏日祭是什么鬼。,0,8,0,2022-07-27 13:14:54,来自天津,2559285921847192,知情达理风筝9n
7124918531527148328,漫展为何一定要日本元素,0,19,0,2022-07-27 13:23:48,来自贵州,6770523601,我心无霾
7125013986990949152,那些日本漫展侵蚀了大批青少年，模仿穿着动漫原型。这就是文化侵蚀。,0,1,0,2022-07-27 19:34:55,来自江苏,26022240876,蓝色天空143804363
