7124988939236344608,抓牢抓严抓实是好事,0,0,0,2022-07-27 17:57:36,来自浙江,3466212257,月稍金江
7124984909798114081,为什么要用日式元素，中国几千年文化去那里了？,0,0,0,2022-07-27 17:42:12,来自广东,62223827021,覃祖禄
7125000356475978509,爱国主义教育重要还是动漫重要？,0,0,0,2022-07-27 18:41:39,来自广东,95444293520,传奇88934
7124874036748501774,铭记历史，吾辈自强，不要因利而害我民族大义！,0,16,0,2022-07-27 10:30:45,来自广东,3848740573,呼风唤雨成真龙
7125015940760683271,漫展为什么非得已日本为主,0,0,0,2022-07-27 19:42:04,来自山东,272313302918061,北京宏祥三元
7124965142076572428,这是文化侵略,0,0,0,2022-07-27 16:25:15,来自浙江,4747557087,相知相闻
7124994651488125703,什么叫做反日情绪，轻描淡写一句反日情绪总结这么严肃的问题。,0,0,0,2022-07-27 18:19:37,来自浙江,15662476754,快乐人生272987866
7124965338047234828,以后要注意什么漫展了！,0,0,0,2022-07-27 16:26:01,来自河北,597740921296192,海阔天空月亮之上
7124929242223117092,现在那些人是闲的 自己都不知道是怎么消遣呢,0,1,0,2022-07-27 14:05:38,来自广东,106467637965,琦琦7028
7124965593366758156,现在的是纯粹漫展吗？早就该停了,0,0,0,2022-07-27 16:27:14,来自浙江,2422971959086292,遥望星空Q
7125005635996893990,漫展可以做，但不要打着漫展的名义，做不好的事！,0,0,0,2022-07-27 19:02:19,来自河南,55368766844,波菲尔美甲
7124981932257575694,取消就对了，大是大非面前，没有为什么，这是一种态度！,0,0,0,2022-07-27 17:30:28,来自四川,55223575477,善解人意深蓝
7124874932823491339,我个人认为，从从小学到大学毕业，都应该离不开爱国教育，应该需要加强一门学科叫做，爱国政治教育,0,11,0,2022-07-27 10:34:31,来自浙江,4314138204179299,逢水架桥1
7125005517034423075,夏日祭，祭什么？,0,0,0,2022-07-27 19:01:23,来自江苏,51001798940,谨言行行行出状元
7124975629170737961,不要说中国没有动漫，中国动漫在经过审核及被群众举报之后就基本不剩什么了。,0,0,0,2022-07-27 17:05:27,来自北京,104808944424,递出一块钱dichu1kq
7124975223111402272,漫展走向你家吧,0,0,0,2022-07-27 17:04:26,来自河南,103916292100,富贵汝花
7125022211244753703,动漫体裁很多，中国的多的是，为什么不搞个中国风格的？,0,0,0,2022-07-27 20:06:21,来自天津,110459961165,3418861324850还有吗
7124970227749618467,宁缺毋滥，我们乐意见到自己民族的文化。,0,0,0,2022-07-27 16:44:13,来自天津,57511992345,我心飞扬151578214
7124868815711912743,中国人就过中国人的节日！,0,76,1,2022-07-27 10:10:20,来自河北,11129009067,清新梦想a
7124947162009633536,文化不是旅游，应该是一种精神，一种民族气质，是人类文明进步的引领形态。而旅游只是带有文化色彩的人们的一种游戏或活动。始终不能理解什么是文化和旅游部！？一个文化源远流长的，有五千年的文明的古国，竟然把文化和旅游并列，不知何意！？,0,0,0,2022-07-27 15:14:55,来自北京,1534550297295816,爱生活的宇宙c4
7124851922326569764,没事，我u型锁已经买好了，就等着重返2012，我感觉这次能当公务员[呆无辜][呆无辜],1,10,2,2022-07-27 09:05:56,来自山东,53360256715,熊兄泼尼
7124875248994386723,究竟是谁在我们的土地上搞这些活动？,5,284,0,2022-07-27 10:35:51,来自江苏,2480121434081940,666And888
7124981040712270626,没这个就不能漫展了是吧,0,0,0,2022-07-27 17:26:30,来自广东,107950147285,caca打篮球
7124971394709996328,动漫本身就是文化渗透,0,0,0,2022-07-27 16:48:51,来自湖南,426262525123404,时代呀
7124984837810832132,你们看看，顶风作案！资本的力量有多么的强大。,0,0,0,2022-07-27 17:41:42,来自江苏,92633244871,伴始终
7124997706606445352,为什么要进行漫展，中国没有个种文化元素吗？,0,0,0,2022-07-27 18:30:55,来自吉林,65184675489,无忧的沙滩ch
7124874672391013159,这就是文化渗透，比战争更可怕。,0,9,1,2022-07-27 10:33:12,来自河南,60234792720,A凯迪熊披萨pizza
7124998980668719908,漫展没有错，错的是有人借漫展搞事,0,0,0,2022-07-27 18:36:30,来自江苏,2554884492104571,天涯未断肠
7124973745785602846,你确定南京夏日祭只是举办地的问题吗？,0,0,0,2022-07-27 16:58:31,来自陕西,3562849056863437,RTG
7124999401126478632,我先给新余市点个赞，,0,0,0,2022-07-27 18:37:37,来自黑龙江,75723016650,波哥岭南印像
7124967945658336000,应该严厉打击，重罚。还有现在很多大学，搞夏日祭,0,0,0,2022-07-27 16:35:29,来自湖北,2291009132959678,蘭陵舰长
7124885114467173120,流血几百年的伤疤好了才几十年，有些人就忘了疼。,0,9,0,2022-07-27 11:14:02,来自山东,6940889711,理想微光
7124972084283392803,文化渗透好可怕,0,0,0,2022-07-27 16:51:41,来自福建,3069432532575928,无忧的溪流AM
7125019004552528681,应该严查举办方，参与单位,0,0,0,2022-07-27 19:53:32,来自江苏,102199936032,科技也是生产力
7124873992942928643,谁批准的？,0,15,1,2022-07-27 10:30:32,来自山东,4184771415,鸢尾色蓝
7124965051500446500,为什么不弄国风展，还是主办方被授意了还是觉得自己国家的传统文化落伍啊,0,0,0,2022-07-27 16:24:40,来自湖南,52439065943,河底小舟
