7125017436130345741,漫展就漫展吧，干嘛要用“夏日祭”,0,0,0,2022-07-27 19:48:01,来自江西,2919893731902382,率真星辰WW
7125024701688316705,国人抵制的是动漫展吗？明明是在抵制夏日祭,0,0,0,2022-07-27 20:16:07,来自河南,77012804305,上善若水2542595
7124916900530438927,漫展不需要夏日祭,0,17,0,2022-07-27 13:17:32,来自广东,131545902356120,米菲之2夫
7124884172375851808,国人当自强，防止一切来犯之敌,0,57,0,2022-07-27 11:11:17,来自四川,2159056053088568,天山犳
7124905947004830464,根本就不该办，还需要取消吗？应该严查到底，一网打尽,0,17,0,2022-07-27 12:34:52,来自甘肃,184335143537399,ziruiyang
7124877505512948520,能推动这些“活动”进展的个人或团体到底是什么样的？,0,24,0,2022-07-27 10:44:34,来自贵州,98247833137,Wuziyoyo
7124900529913889536,追查彻查主办方，查明幕后黑手。,0,21,0,2022-07-27 12:13:45,来自江苏,3174997131789118,洋洋爸妈在苏州
7124882432226591525,中国的文化博大精深。不需要模仿外国人的模式。,5,179,4,2022-07-27 11:04:17,来自辽宁,2902309337839822,用户3545157676058夕
7124989125392433957,这是漫展的事吗？,0,0,0,2022-07-27 17:58:13,来自湖南,52159816468,eric
7124908418275590924,得深查、深查。,0,8,0,2022-07-27 12:45:02,来自江苏,81290221367,大气辰星Ce
7124892339617366825,就怕文化入侵,0,17,0,2022-07-27 11:42:09,来自福建,3047480784338283,呆呆遇上呆呆
7124895432308441889,为什么中国要举办这样的活动呢？难道没有人去审核这些活动内容吗？,0,31,0,2022-07-27 11:55:02,来自北京,58794916816,魔法铅笔di
7124886296195040035,时刻提高警惕,0,26,0,2022-07-27 11:18:35,来自辽宁,55554050226,酱油244
7124902839247569698,应该是发展有我国特色的汉文化动漫，以前我们小时候的连环画小本多经典！,4,51,0,2022-07-27 12:22:44,来自广东,18247765832,鸿星耐克
7124998761449227042,漫展就漫展！没必要冠上＂夏日祭＂的名头吧！直接了当的漫展，只要内容健康，没有不支持的理由！,0,0,0,2022-07-27 18:35:07,来自四川,102002518194,儒雅暖阳Ss
7124967622646514472,夏日祭是什么，传播日文化吗,0,2,0,2022-07-27 16:34:17,来自北京,71325718570,白丁女人
7124901140021904164,不知道什么是夏日祭，这个说法难以让国人相信！,0,14,0,2022-07-27 12:16:32,来自辽宁,3518027068365783,anfengli
7124922246561006376,为什么非要动漫,0,10,0,2022-07-27 13:38:14,来自河南,106463333843,安逸苹果S6
7125010925883130624,漫展就漫展，为什么要冠名“夏日祭”？,0,0,0,2022-07-27 19:22:19,来自广西,76541850062,阿四43390
7124902954045473566,忘记历史最可怕,0,18,0,2022-07-27 12:23:29,来自陕西,52142543542,知情达理沙滩n
7124919554727772961,漫展就是宣扬日本文化？,0,12,0,2022-07-27 13:28:35,来自北京,2252248655604843,布鲁尔
7125010053991940897,夏日祭不等于漫展，别偷换概念！,0,0,0,2022-07-27 19:19:43,来自吉林,92565232340,wisfy1
7125010233865028391,为什么主办方没事？那个陈睿也没事？,0,0,0,2022-07-27 19:20:39,来自福建,108994000201,moxnan楠少
7125001100813419299,为何举办画展要用＂夏日祭＂名称，请举办方说出这是什么意思？,0,0,0,2022-07-27 18:44:02,来自江苏,110931906245,智勇双全晚风t4
7125009048910988039,昆明的夏日祭还延期？,0,0,0,2022-07-27 19:15:34,来自广东,3535642693736568,我爱动漫8808
7125003366480528160,漫展为什么要叫夏日祭？,0,1,0,2022-07-27 18:53:51,来自河北,2273438539189486,1338111190
7124911649798292260,好一个大展会无惧，够胆！,1,22,0,2022-07-27 12:57:22,来自山西,6018504533,乐观的生活家09
7124881222799033124,彻查！勿忘囯耻！！！,0,265,1,2022-07-27 10:59:34,来自山西,71794014514,1866567
7125022456628527906,文化包容可以，文化入侵绝对不行。,0,0,0,2022-07-27 20:06:56,来自广东,108366411795,奋发有为可乐fN
7124982188806193960,搞中国风的漫展不行吗？,0,0,0,2022-07-27 17:30:51,来自湖南,2234641548051752,明天会更好🥰
7125010396142207758,不同情，被日本借口动漫活动实施对华文化侵略！它本身没拒绝没反抗,0,0,0,2022-07-27 19:20:40,来自浙江,6371461252,海豚86593611
7125014966830400292,叫动漫展不可以吗？为什么非要叫夏日祭？,0,0,0,2022-07-27 19:38:21,来自广西,58353466199,Aaron155071073
7124964859385086753,漫展是漫展，夏日祭是夏日祭，这次反对的是打着漫展旗号的夏日祭活动,0,1,0,2022-07-27 16:24:21,来自河北,106866744718,大梦plus
7124935076462641959,应该从小学课本加强爱国主义教育一直到大学，勿忘国耻，不要忘了前辈英烈，不要让他们付出生命换来的东西，被敌对势力潜移默化的夺取,0,6,0,2022-07-27 14:28:44,来自江苏,58531668972,晶彩饰界
7124980698939327244,漫展不反对，关键是为什么那么多漫展一定要叫夏日祭？为什么都要含日本元素？,0,0,0,2022-07-27 17:26:06,来自上海,62527613513,晨风184482250
7125007185511629604,动漫展为什么一定是日本元素?不能是中国元素吗？,0,0,0,2022-07-27 19:08:08,来自江苏,21019744663,金陵俊哥
7124973567187600167,做中国的漫展,0,0,0,2022-07-27 16:57:57,来自江苏,853637538776286,看透看淡悠悠然
7124992614256198403,漫展就漫展为什么要叫“夏日祭”？,0,0,0,2022-07-27 18:12:01,来自北京,78813593199,阿鸠110
7124919827592020771,为什么会这样？有人收黑钱吗？查清事实，从重处理。,0,11,1,2022-07-27 13:28:44,来自山东,92767006701,济宁徐瘦猴
7124895789071090469,勿忘国耻！！！,0,10,0,2022-07-27 11:55:49,来自内蒙古,4177743980015630,老实憨厚的老王
7124883709060924168,查查啥目的。,0,19,0,2022-07-27 11:09:13,来自河南,399864862615623,无忧的沙滩fK
7124865935890219811,夏日祭是什么？谁的传统？听着不像我们中华文化啊,1,71,0,2022-07-27 09:59:09,来自北京,110893545038,大瀚海的王小翰
7124980185509888804,中国文化博大精深，传统的书法绘画，民间艺术手工制作等，为什么没有资本推动全国展览。在中国古代的一些人物为什么要用动漫中奇怪造型全国去展览。,0,1,0,2022-07-27 17:23:18,来自浙江,562544460987240,风趣风筝2P
7125005182618485518,云南好秀，居然是延期，一枝独秀,0,0,0,2022-07-27 19:00:35,来自江苏,6049267934,海浪43330
7124971138207810336,文化界，好好整顿，我们祖国的优秀的文化怎么不宣扬，发展教育下一代，保持老一辈的优良传统。进行爱国主义教育呢！,0,1,0,2022-07-27 16:48:57,来自甘肃,109226444404,用户老白
7125021471751521036,披着动漫展外衣的夏日祭,0,0,0,2022-07-27 20:03:47,来自上海,465822913146763,我心照耀
7124919628694291233,"归根结底都是一个“钱""字惹的祸！",0,6,0,2022-07-27 13:28:49,来自河北,111206860640,m钱儿不多
7124906527152325415,我儿子小时候，我从来不让他看日本动漫，那是大约二十年前后的事，一看日本动漫就是文化侵略,0,11,0,2022-07-27 12:37:43,来自山东,109916492548,石材影视墙定制安装
7124869423231435523,铭记历史，勿忘国耻,0,220,2,2022-07-27 10:12:41,来自福建,92372035147,风中叶儿飞
7125007876455744296,全国人民团结抗日,0,0,0,2022-07-27 19:10:19,来自云南,104918126932,勇敢的漂流瓶UL
7124995295440208654,希望往后严格把关审核，借着漫展掩护下干坏事可不行，比如和风，军服，鸟居,0,1,0,2022-07-27 18:22:21,来自广东,3373101377,小熊说好运
7124997705599877920,说白了就是漫展的内容有过多的日系元素，如果漫展中以中国的绘画为主就不会那么难办了。从侧面也可以证明承接漫展的主办方也知道这个内情，所以就出现现在这种一切都不确定的这种情况，内心有鬼啊。,0,0,0,2022-07-27 18:31:30,来自辽宁,50770363080,白糖红糖不买黑糖
7124973821379642148,漫展就漫展，为什么要叫夏日祭,0,1,0,2022-07-27 16:59:01,来自江苏,51829569817,丢了猪的八戒
7125003577093309218,漫展就漫展可以了，但为啥非要起名夏日祭？,0,0,0,2022-07-27 18:53:52,来自广东,104960670010,Weico
7125006384189768479,为啥不岁展自己的动漫，真的是很讨厌日本的这些东西，借鉴可以但不能成为主流,0,0,0,2022-07-27 19:05:10,来自江苏,111431758410,洒脱钢琴y0
7124975717661754148,为什么搞夏日祭，祭谁？为什么要夏日举办。这些文化公司大有事,0,1,0,2022-07-27 17:06:11,来自浙江,50934147057,诗意星球m8
7124913935849046792,怎么都感觉是统一行动,0,7,0,2022-07-27 13:06:12,来自天津,84207981826,暖阳2V
7125024085016560416,夏日祭怎么变成漫展了？偷换概念。,0,0,0,2022-07-27 20:13:43,来自浙江,5538574768,多乐58974956
7125016995049472781,教育、精神、文化、传统美德是民族的根基，维护好民族根基是需要上上下下亿万华夏儿女的义务和责任,0,0,0,2022-07-27 19:46:23,来自上海,373461758250765,次缺二元
7125006754123498273,谁告诉他们漫展必须以日本文化为主题？,0,0,0,2022-07-27 19:07:11,来自四川,64793009233,ONEDAY3230
7124971435718066956,叫夏日祭确实不妥，动漫嘉年华就好了嘛,0,0,0,2022-07-27 16:50:00,来自广东,99912283834,麥氏家瑋
7124937481765847845,这几个地点选的真有代表性南京，江西，枣庄这不正是日军侵略最严重的地方吗？,0,4,0,2022-07-27 14:37:48,来自山东,54356368636,神秘蛋糕J7
7124975390937940776,希望漫展不要出现日本文化元素侵蚀内容，应该展现的中国文化元素才对！,0,0,0,2022-07-27 17:04:23,来自广东,60081645963,温暖的阳光55569
7124880019641828107,什么是夏日祭？,0,16,0,2022-07-27 10:55:14,来自江苏,72760563120,没辙了吧22
7124893296631137061,还多地？听的心惊胆战,0,14,0,2022-07-27 11:45:58,来自江西,69882814445,爱生活的向上
7124914660029727502,整天参加漫展，一些孩子说现实中的人哪里都不好，甚至说一辈子不结婚，说现实中的人没法跟动漫里的人物想比，配不上自己[捂脸],0,7,1,2022-07-27 13:09:21,来自山东,5795398900,li金秋
7124909373561783055,以夏日祭活动宣传日本军国主义文化，要严打严惩！,0,30,0,2022-07-27 12:48:08,来自江苏,23401330056,无我无住
7125000625326211879,漫展等于夏日祭？,0,0,0,2022-07-27 18:42:51,来自江苏,2422940414247211,我不讲实话
7125002683219804940,漫展=夏日祭？,0,0,0,2022-07-27 18:51:00,来自河南,6230931552,广泛前壁心肌梗死
7124980613568037666,漫展没错，夏日祭就错了何必一棍子都打死,0,0,0,2022-07-27 17:24:40,来自四川,4120616442280227,三界蚍蜉青阳子
7124998085193237288,动漫就动漫，为什么要叫夏日祭呢？,0,0,0,2022-07-27 18:32:29,来自广东,83508688883,a习惯了就好a
7125005421999325955,漫展本没有什么，但把漫展变成了宣扬日本文化的载体就变味了，值得深思和警惕！,0,0,0,2022-07-27 19:01:32,来自四川,1947928087247134,平原稻香
7124937979474330407,忘记历史，就意味着背叛,0,5,0,2022-07-27 14:39:43,来自北京,5882240433,顺子H
7124983709685859102,应该深刻反省，清除不好的思想文化引导，漫画产业才能更好发展！,0,0,0,2022-07-27 17:37:09,来自四川,5367448849,恋恋风尘52130104
7124970553261556495,漫展可以不办也不能伤害我们牺牲的英烈,0,0,0,2022-07-27 16:45:41,来自河南,50070590238,家家乐游泳场
7124929722513376041,本文作者看上去取消此次夏日祭，有些不满！,20,853,0,2022-07-27 14:07:19,来自浙江,6089376837,爱口琴
7124967825085104896,漫展？直接说日本动漫展得了呗，所以夏日祭就是漫展对不对，或者说漫展就是夏日祭,0,1,0,2022-07-27 16:35:11,来自河南,85876411697,青山处处可埋忠骨
7124992299872437022,为什么要叫夏日祭呢？这个夏日祭是祭谁的？,0,0,0,2022-07-27 18:10:40,来自新疆,3997462072406627,勇者高山aD
7125021588713554728,校园里多些爱过教育,0,0,0,2022-07-27 20:03:28,来自甘肃,92680406248,晶晶8850691528615
7124993603952837417,漫展及文化产业离了日本文化就不能发展了吗？,0,0,0,2022-07-27 18:15:13,来自北京,206317178063604,喜洋洋yong
7124997795291398920,字里行间透路着不满,0,0,0,2022-07-27 18:31:48,来自山东,118352747441380,用户早早奶奶
7124965014402515751,动漫无所谓，能不能别用夏日祭名称？,0,0,0,2022-07-27 16:25:15,来自山东,98877364544,如是清心
7124924588105925416,有多少人骂着夏日祭，却依然看着日本动漫？,57,194,32,2022-07-27 13:47:10,来自河北,4195373978499927,远方就是远方
7124896364303237900,只知钱，不识学！严惩！！！,0,11,0,2022-07-27 11:58:19,来自辽宁,57565213797,青月HBS
7124986865081484045,搞这样多的日本文化活动，谁出钱，大家相信那是漫展？,0,0,0,2022-07-27 17:49:10,来自四川,97400161977,润坤778
7124930490230506243,不能说停办了事，要严厉追究严查严惩打击！！！[加油]日本的文化入侵怎么这么猖狂了，警醒啊！深思！！！,0,5,0,2022-07-27 14:11:00,来自四川,96765516539,464751802583
7124963363800924962,国潮展顶上啊！非遗，物遗，原产地保护补位。,4,21,1,2022-07-27 16:17:50,来自广东,5394854244,芥子园酒夫
7125015126893806373,以前穿汉服的很多,0,0,0,2022-07-27 19:39:11,来自云南,102505882978,357659876723780
7124919071363285768,chinajoy以前搞得多好 ，一定要去搞什么夏日祭，无语。,0,10,0,2022-07-27 13:26:12,来自浙江,52684600420,吸吸吸吸吸
7124920116735345411,动漫靠夏日祭活着吗？那更有问题了,0,9,0,2022-07-27 13:30:55,来自甘肃,720914396233511,后天
7124967221637464836,为什么漫展都有日本元素？就不能中国化的漫展？,0,0,0,2022-07-27 16:33:10,来自新疆,470235100744456,冰叶午时花
7124943296375898917,归哪监管？[晕]…,0,3,0,2022-07-27 15:00:23,来自天津,4278934071156604,萍姐ai生活
7124994740008878855,这样的漫展不办也好,0,0,0,2022-07-27 18:19:56,来自浙江,53340149757,明月84961
7124975028751532807,只要漫展内容不涉及辱国还是可以举行的吧，我个人蛮喜欢日漫的,0,0,0,2022-07-27 17:03:27,来自江苏,105541814877,谢尔是二内
7125003065438077699,所以不要太黑心，啥钱都想挣,0,0,0,2022-07-27 18:52:24,来自四川,95564232893,用户可不能够不勇敢
7124937419731829538,那个领导批准这样的活动都要追究,0,3,0,2022-07-27 14:36:59,来自广东,1297040267813588,积极的春风Jy
7124979196288008991,漫展游戏取消，举双手欢迎[击掌],0,1,0,2022-07-27 17:19:49,来自江苏,52195618550,前后一致
7125007865190187816,我们的文化和旅游局对于各种文化娱乐活动要注意内容审核,0,0,0,2022-07-27 19:10:25,来自四川,1525767675594408,睿智的善良葡萄8q
7125022212989698849,为什么要搞夏日祭呢，不能搞真正的动漫节吗？,0,0,0,2022-07-27 20:06:35,来自广东,52986690778,乐天沧浪君
7124930808602886951,作者在模糊漫展和夏日祭的界限吗？是何居心？,0,5,0,2022-07-27 14:12:07,来自浙江,5839288295,七坞蓝霸天
7124972039442219808,为什么照搬日式的，不能学习借鉴去糟粕，把中国风的文化发扬光大,0,1,0,2022-07-27 16:52:27,来自江苏,4261353102514910,金币金币多多的
7125011225922306823,我们这边超市还有大型奥特曼展，好多小朋友迷，唉……,0,0,0,2022-07-27 19:23:53,来自浙江,4744142050,中国制造1929
7124937727128240931,关键选择在南京，太讽刺了,0,3,0,2022-07-27 14:38:13,来自湖北,97108177486,七月的小狮子oO
7125019563146347267,不需要什么漫画，中国人可以发展自己的漫画风格,0,0,0,2022-07-27 19:56:35,来自广东,97217756937,WUJING537
7124989841757979431,不破不立，正是需要先破后立的时候，传统文化那么深厚的底蕴，足够动漫产业发挥了,0,0,0,2022-07-27 18:01:00,来自北京,4208580305893213,泓乐
7125025971358974728,如果漫展变成张扬异国文化的载体，那么这种漫展不要也罢，宁缺毋滥，我们乐意见到自己民族的文化。,0,0,0,2022-07-27 20:20:56,来自湖北,2911157753757166,清闲的橘子uz
7124901288282391309,玩的文字游戏，做着亡魂的勾当,0,125,0,2022-07-27 12:17:14,来自广东,3310435313,心动暮晚
7124989579329028867,漫展是漫展，夏日祭是夏日祭！,0,0,0,2022-07-27 18:00:13,来自湖南,91655973594,菜猪CZ
7125012241451778850,今年南京究竟举没举办“夏日祭”？,0,0,0,2022-07-27 19:27:27,来自广东,105138591780,DOU说两句
7124919998678221601,漫展漫展教科书都是日式漫展吧,0,6,0,2022-07-27 13:30:20,来自海南,9131530762,森林斗士
7124903531680629512,漫展没问题，问题是取名别有用心！,0,25,0,2022-07-27 12:25:38,来自浙江,23445961370,诗意旭日hn
7124984737915552527,支持大力宣传中国动漫，动画片《红军桥》就很好[赞][赞][赞],0,1,0,2022-07-27 17:40:42,来自云南,99228529876,好摄的见山
7125007124056490759,时刻要警惕那些以和善、友好的方式对各个领域的渗透,0,0,0,2022-07-27 19:07:57,来自江苏,85920640439,小微9604
7124990687854379813,漫展就是日本文化？？？,0,0,0,2022-07-27 18:04:20,来自陕西,110224396888,勇往直前的菠萝e
7124992270273282847,漫展不能成为日展！！,0,0,0,2022-07-27 18:10:36,来自新疆,10712960450,虫二
7124990380466488098,日本的漫展也应拒。为什幺不发扬光大中国画展呢？总之，认为有直接或变相“文化入侵之嫌。”,0,0,0,2022-07-27 18:02:40,来自重庆,3817919897425360,魔法师凯希2J6
7125007766468936480,爱国主义教育深入人心，防止外来糟粕刻不容缓。,0,0,0,2022-07-27 19:10:52,来自辽宁,1557341278573112,安逸饺子4m
7124914132532871943,绝对背后有组织的，一定要追查到底,0,13,1,2022-07-27 13:07:11,来自广东,105283777566,无聊经过
7124980236244304681,为什么是日本的漫展？我们自己的漫画去哪了？,0,0,0,2022-07-27 17:23:16,来自北京,67781953311,朋月
7124903340546900766,办漫展没必要强调日本要素吧？,0,83,1,2022-07-27 12:25:15,来自陕西,23762750545,来自星星的我3631
7124972887076782878,同意，漫展一定要融入中国文化元素才能在中国立足，借漫展渲染日本文化就是不行！,0,0,0,2022-07-27 16:55:00,来自江苏,6685539720,江底龙虾
7124835139611656998,历史绝不可忘记,0,177,3,2022-07-27 08:01:16,来自山东,5356762075,水果软糖00
7125001566146380556,到底是什么人在搞这活动，这个也不清楚，那个也不清楚，总有人清楚吧,0,0,0,2022-07-27 18:46:27,来自天津,98326474972,日出江花595
7124987017544500003,“夏日祭”之前没听说过，按照字面分析就是日本夏天的祭祀活动，怎么推广到国内了？,0,0,0,2022-07-27 17:49:31,来自广东,61793696529,步步为盈5
7124870002981274401,弘扬一下老祖宗留下的传统文化和节日不好吗？,1,19,0,2022-07-27 10:15:02,来自吉林,5525174115,安逸阳光v
7125000107963466509,漫展就不能走爱国的道路吗,0,0,0,2022-07-27 18:40:46,来自江苏,10448070817,刘风随
7125005331587154729,这本身就是一种文化的侵蚀，是有文化的侵略，盲目的引导青少年去崇拜这种所谓的漫画，是对青少心灵的毒害！培养教育好青少年比追逐眼前的商业利润更有价值更有意义,0,0,0,2022-07-27 19:00:36,来自广东,5855681508,手机用户阿怪
7124965005828948773,今天看了一篇帖子，说是夏日祭改名了，正常举办,0,0,0,2022-07-27 16:24:43,来自江苏,5986787757,XanderLee
7124996720982917929,支持天官赐福国漫,0,0,0,2022-07-27 18:27:01,来自广东,57510374616,梁瑛
7125020617581413151,如果漫展变成张扬异国文化的载体，那么这种漫展不要也罢，宁缺毋滥，我们乐意见到自己民族的文化。,0,1,0,2022-07-27 20:00:11,来自广东,465781565692871,区愿军
7125022028801508111,为什么不展出中国漫画，以前的“三毛流浪记”等等非常好,0,0,0,2022-07-27 20:05:21,来自黑龙江,53538609010,热情星球hn
7124924723838403336,漫画只是漫画 取消漫展我支持 振兴中华靠科技,0,7,0,2022-07-27 13:48:28,来自福建,3636796367312779,小小唯一
7124873739690574627,中华上下五千年，传承中华优秀传统文化。[赞][赞][赞][赞],0,93,2,2022-07-27 10:29:28,来自广东,1882809757338398,海阔任鱼跃88
7125009175981540126,大疫情时代漫展注定没落,0,0,0,2022-07-27 19:15:57,来自广东,77502682247,圣洁的耗子
7124872622236123939,都潜伏下来哦？,0,133,1,2022-07-27 10:25:12,来自湖南,2634052857759860,唐叟联画
7125002113570292515,敌外势力无孔不入，我们必须提高警惕，防御外来势力的侵入。。,0,1,0,2022-07-27 18:48:06,来自黑龙江,5889063547,健康使者德昌食品
7124969284660937513,国漫发展少说也20年了，漫展都不搞国风动漫吗？,0,1,0,2022-07-27 16:40:55,来自浙江,1266291767523822,风一样的haley
7124914344365687593,漫展不反对，但需要有文化底线！,0,8,0,2022-07-27 13:07:21,来自四川,2968297929706759,禅释缠
7124922076649440037,夏日祭是什么鬼，作为平民的我表示不知道,0,5,0,2022-07-27 13:38:04,来自广东,69229569364,请叫我牛油果
7125020289679213347,以后对酒店租赁场地违规要严惩严罚,0,0,0,2022-07-27 19:58:31,来自湖北,111451013070,黑大侠王
7124988871292830500,漫展为什么要起名为“夏日祭”呢？祭什么意思呢？,0,0,0,2022-07-27 17:57:20,来自新疆,21445780008,幸福糯米dX
7124863477629895431,严查背后搞事人员,1,99,0,2022-07-27 09:49:40,来自浙江,6593391572,哒哒哒啵Q
7124988122462962470,怎么着起来象有为叫停夏日祭活动叫屈的意思呢？,0,0,0,2022-07-27 17:54:42,来自云南,98756424906,923随缘
7124961090131690280,中华五千年的传统文化 为什么不去多 宣传宣传？,0,2,0,2022-07-27 16:09:00,来自上海,4190993916637566,蜡笔小新OMjZ
7125008562023465769,最讨厌日韩风，毒,0,0,0,2022-07-27 19:13:09,来自四川,104906213907,Hjc飘飘
7124922425653445384,什么叫“叫停”？应该是严厉打击！敌人已经渗透到全国各地了，还不加强防范吗？！！！！！！！！！！,0,3,0,2022-07-27 13:39:29,来自河南,68709246850,2276541
7124946076263629598,我们中国是一个有独特文化文明的国家，不管什么时候，都不要离开爱国这个主题。,0,2,0,2022-07-27 15:11:02,来自黑龙江,387468732676251,丽紫气东来
7125020989825712926,自卑成这样？,0,0,0,2022-07-27 20:01:28,来自日本,237119341856568,铲屎官川大爷
7124977762565604130,夏日祭参与变味了,0,0,0,2022-07-27 17:13:46,来自辽宁,58955221538,石头剪子布157911237
7124921768347042595,直说吧，毒漫展取缔了会怎么样？,8,764,3,2022-07-27 13:36:21,来自重庆,92015248553787,沙漠巫女
7124966767822144260,办好我们自已的文化漫展很好呀！,0,0,0,2022-07-27 16:31:32,来自上海,86264137477,自由幸福多多
7124881471290295081,这么大年了第一次听说夏日祭这个词！为什我会有这么个祭日不明白！一定要 追查主办方！,0,62,1,2022-07-27 10:59:58,来自广东,106486003456,自在枫叶Vi
7124968344373035812,动漫人物渗透了太多的日本元素，为什么不制作一些中国风的动漫呢,0,0,0,2022-07-27 16:37:30,来自辽宁,3210191292608664,海用户3617533251738
7124916270415397666,到底是什么人牵头组织的,0,8,0,2022-07-27 13:14:53,来自山东,92327678633,顺风快刀
7125008977666229023,什么是″二次元″？我还是第一次听说,0,0,0,2022-07-27 19:15:06,来自山西,2317360877023939,出谷牵乔
7125004954045039401,商标也有注册“夏日祭，樱花祭”，好好管管吧,0,0,0,2022-07-27 18:59:04,来自江苏,2841207973,飘2841846
7124986680683578148,我都不喜欢二次元,0,0,0,2022-07-27 17:48:49,来自广东,4103014903979195,沐月手写
7124988449849508648,举办有中国特色的漫展,0,0,0,2022-07-27 17:55:18,来自河北,76265387523,吉祥勇143
7124888753830839071,第一次听说还有夏日祭,0,9,0,2022-07-27 11:28:33,来自河北,2027125682735239,无双画板IU
7125019256244617996,漫展是漫展，夏日祭是夏日祭，他俩性质都不一样别个这混淆,0,3,0,2022-07-27 19:55:11,来自吉林,2392126871065992,沉默的老朴
7125024132190192398,不懂就问“夏日祭”是什么？[惊呆],0,0,0,2022-07-27 20:13:41,来自湖南,4407263416292688,魔芋同学
7125002222081147662,本文中说道“…间歇性反日…”，显示出作者立场了。,0,0,0,2022-07-27 18:48:50,来自北京,74690248079,金龙不飞
7125001005548503849,漫画展是假的 ，以漫展为由文化渗透是真的,0,0,0,2022-07-27 18:43:49,来自湖北,2013939007753373,自强不息旭日48
7124902988837241631,书法圈也有日本文化倒灌,0,17,0,2022-07-27 12:23:42,来自河北,6939480743,谦德堂刘向春
7124901491529597726,为什么、为什么、为什么伪军这么多，百思不得其解。,0,71,0,2022-07-27 12:17:59,来自安徽,2999116814352616,无忧的咖啡Rt
7125002057362768672,一个二次元商业活动，愣是被网络喷子喷停了，佩服。,4,2,0,2022-07-27 18:48:33,来自广东,3396883765,LEARCAT
7124975322114097959,我们不反对漫展，我们反对的是挂羊头，卖狗肉。,0,1,0,2022-07-27 17:05:01,来自河南,57603530167,林信民
7124950365463970596,我是第一次听说“夏日祭”,0,0,0,2022-07-27 15:27:41,来自新疆,81759685573,心槐
7124998716775973670,漫画展，为什么非得叫夏日祭哪?,0,0,0,2022-07-27 18:36:03,来自辽宁,53337531974,狐狸141485415
