7124997555012010765,动漫展没问题，关键是经常有人夹带私货，主办方视而不见[抠鼻],0,0,0,2022-07-27 18:30:42,来自广西,2334960571922115,傲娇鬼71
7125006441840165666,应该查查谁是主办方，承办方，这样才能找到源头,0,0,0,2022-07-27 19:04:45,来自河南,53307396062,怀吉141385400
7124935583948473120,什么叫“叫停”？应该是严厉打击！敌人已经渗透到全国各地了，还不加强防范吗？！,0,1,0,2022-07-27 14:30:54,来自河南,22397612001,雷霆男孩1314
7124977578229629703,那么多节日呢，七夕节，中秋节，传统文化月，国漫展啥的，,0,0,0,2022-07-27 17:13:15,来自北京,3491640272491758,守护神的哥哥
7124986277224596258,严查严惩漫展夏日祭主办者！,0,0,0,2022-07-27 17:46:34,来自湖南,102034157194,tongnian82
7124972319101567759,先了解下“夏日祭”吧，为什么叫“夏日祭”？取消就对了,0,0,0,2022-07-27 16:52:36,来自浙江,2630485057218941,智慧火车6I
7125002700995199744,创造出中国特色动漫文化产业，走出自己文化产业之路！,0,0,0,2022-07-27 18:50:21,来自北京,82363386758,朝华之东
7124925612414255880,叫停夏日祭不应该是取缔吗？难道俺理解有误？！[捂脸][捂脸][捂脸],0,2,0,2022-07-27 13:51:46,来自山东,2013894383768861,幸福鸟9434545257155
7124951432188937001,支持彻查主办方！追责相关人员,0,2,0,2022-07-27 15:31:30,来自湖北,3369344072944812,栾新安
7124978281644196642,正常的漫展还算玩的过去，夏日祭不行[发怒][发怒],0,0,0,2022-07-27 17:15:37,来自福建,452638746097847,一束茧火
7124987865779864355,大力发展国产漫画就好了啊～现在国漫也很多很棒的作品啊～,0,0,0,2022-07-27 17:52:47,来自广西,76648977555,纳兰悠雪1
7124924776942060322,现在不能说不清楚之类的话，每一个活动都要搞清楚，别让有心人钻空子，,0,1,0,2022-07-27 13:47:55,来自江苏,1201093339515608,自若奶酪gG
7124982784321471243,间歇性反日情绪？？这个词描述的好。,0,0,0,2022-07-27 17:33:50,来自陕西,104203320744,安格拉斯基
7124979679844942595,吉林长春也举报了,0,0,0,2022-07-27 17:21:54,来自吉林,92800216743,狮子座810
7124919943606878980,7.31号的河南永城的夏日祭取消没有？真希望能取消。,0,6,0,2022-07-27 13:30:01,来自河南,52524075192,郑州A
7124984061248029455,关于日漫，我只喜欢在家用手机看看宫崎骏的动画片，其他不关注,0,0,0,2022-07-27 17:37:59,来自湖南,1741228651316942,李子不烦
7124984115753190185,为什么全国各地都要举办这种活动。,0,0,0,2022-07-27 17:38:14,来自广西,65616208333,李姐62584
7125007067881980676,漫展可以有很多造型，干嘛一定要采用日本漫画造型！,0,0,0,2022-07-27 19:07:51,来自江西,59089601856,请Callme唐长老
7124978791398949667,严厉追究发起人，严查深挖坚决打击,0,1,0,2022-07-27 17:17:36,来自云南,62428670676,保护模式ht
7125004038227821319,只是延期，意思等风头过了再说,0,5,0,2022-07-27 18:56:07,来自陕西,6991142018,miasay
7124992272365830916,什么夏日祭，听都没听说过,0,0,0,2022-07-27 18:10:48,来自广东,108403469519,上网不用吃鸡
7125024825798312737,夏日祭，祭奠什么？,0,0,0,2022-07-27 20:16:52,来自上海,50065716829,木林森asdfg
7124918228333167391,怎么不改成招魂幡,0,8,0,2022-07-27 13:22:57,来自湖北,50903157641,封心绝对1
7124938042762330887,夏日祭，是日本纪念亡灵的节日，干嘛要在中国举行？,0,2,0,2022-07-27 14:39:57,来自广东,57716352153,小熊猫275291201
7124966292272661259,有点像日军侵华前期在中国各领域的渗透,0,0,0,2022-07-27 16:30:01,,70862338132,养花能静心
7124984241947444002,中国就没动漫？,0,0,0,2022-07-27 17:38:46,来自山东,1516960279965748,quxiao
7124984880068870949,警惕文化入侵，做活动前要审核,0,2,0,2022-07-27 17:41:44,来自湖南,3394917504647343,jian静988净
7125000682402251523,我觉得现在的动漫有好多少儿不宜的涉黄元素！,0,0,0,2022-07-27 18:43:01,来自河北,66541882200,手机用户牵着蜗牛旅行
7124949615162098473,应该坚决彻查深挖幕后操纵者！,0,1,0,2022-07-27 15:24:31,来自广西,104035082515,打烊的LV
7124998710370845480,为什么会出现这种活动？,0,0,0,2022-07-27 18:34:51,来自四川,3469683491090909,大气微风EE
7124924592141206306,背后什么人在操纵，严惩,0,2,0,2022-07-27 13:47:24,来自安徽,86472857704,柳如烟313
7124967586059813665,以后凡是举办此类活动，必须详细填写资料，举办人 身份信息，活动内容，都要填写清楚，并且严格按照申报内容执行。,0,0,0,2022-07-27 16:34:43,来自辽宁,5983548373,芳菲雪74295486
7124988329220932364,总是委屈把自己装成人畜无害的小白兔。,0,0,0,2022-07-27 17:55:19,来自山西,54500602056,行者木143668591
7124971596158485283,漫展重要还是文化战争重要,0,0,0,2022-07-27 16:49:42,来自北京,104903932421,剑指倭夷and马踏纽约
7124921239462036262,B站那个怎么不回去查啊,0,1,0,2022-07-27 13:35:03,来自江苏,101164587819,songtasteV8
7124897262740407054,你要明白是非的能力,0,114,0,2022-07-27 12:01:47,来自上海,5735790228,隔壁家的小逗逼
7124973947124335360,多地？？？文化渗透太厉害了,0,0,0,2022-07-27 16:58:50,来自吉林,89857401603,微微
7124969880402592547,为什么不说一说要把动漫展与日本的夏日祭搅和到一起？,0,0,0,2022-07-27 16:43:04,来自河北,3643302948,李大匠
7124900270894629647,看车展时顺带进过动漫展厅，顿时感觉像进了鬼屋。唉！欣赏不来,0,41,0,2022-07-27 12:12:48,来自广西,5451438933,jianjlaml
7124943699683246888,支持彻查主办方，追责相关人员的责任。,0,1,0,2022-07-27 15:01:36,来自江苏,20154307610,苏十乐
7125007653113791243,请问夏日祭，祭的是谁,0,0,0,2022-07-27 19:10:26,来自河北,64363074800,寒江飘雪22
7124969937823220494,如果没有夏日祭，动漫展就办不下去的话？？？这是什么逻辑？？？？,0,0,0,2022-07-27 16:43:56,来自河南,6728347121,古v月109117776
7124974562898952999,严格按照国家标准和原则管理,0,1,0,2022-07-27 17:02:07,来自天津,1099934013072478,聪明饭团y0
7124983036990685992,希望国家文化局和旅游局以及国家媒体全力推荐和优先国漫展和国服展，以及爱国主义教育基地。,0,3,0,2022-07-27 17:34:01,来自内蒙古,68637232256,琴之森林
7124888106662494976,我们的文化和旅游局对于各种文化娱乐活动要加强了解，注意内容审核。支持！,1,10,0,2022-07-27 11:25:39,来自上海,3711585117284423,倒不了俺汉家节
7124972353680474910,桂林的被民众举报然后取消了,0,0,0,2022-07-27 16:52:54,来自广西,58234241745,才发现笑着哭最痛
7124916939872977668,动漫展真的没有必要,0,8,0,2022-07-27 13:18:25,来自河南,4098586998226103,追风者2266
7124902074021790503,原来就是纯粹的动漫谁管过？自己搞变了味，怨得了谁？,0,37,0,2022-07-27 12:20:32,来自重庆,110927496813,飞翔的了1
7124952922575749920,小孩子都爱参加的动漫活动，现在变成了夏日祭？,0,0,0,2022-07-27 15:37:47,来自吉林,413862789917151,Oliver王宁
7125022116352672542,路过几次漫展，感觉参与的没几个正常人，都是一些没烧 熟的孩子，也许它们认为我不正常吧,0,1,0,2022-07-27 20:05:53,来自安徽,56811502507,热心火车oH
7124883641330664226,漫展就是漫展车间里面的为什么非要带上日本因素，这是什么用意。,1,18,0,2022-07-27 11:08:12,来自安徽,61667786216,亮剑来回跑
7124950166670902056,此类事不能只是叫停了之！应严查举办人（组织）！举办目的？深挖彻查！,0,1,0,2022-07-27 15:26:38,来自天津,50295230328,慧眼66
7124996592587309827,我都不知道夏日祭是什么？,0,0,0,2022-07-27 18:27:29,来自江西,50694295897,豁达柑柑
7124982971249722144,仙剑奇缘国风展取消就离谱，别的随意,0,0,0,2022-07-27 17:34:55,来自江苏,89964390191,小鱼稀饭
7124900945716413218,国漫并不丢人吧！,0,94,1,2022-07-27 12:15:21,来自广西,4366738899,怀明月
7125002572268274432,我相信只是类似于夏日祭之类的漫展受到了影响。支持！,0,0,0,2022-07-27 18:50:00,来自湖南,712129109827431,端庄优雅海风YO
7124961752382931749,这真是慢慢渗透，国人都要有警惕之心,0,1,0,2022-07-27 16:11:51,来自河南,64782409252,分分钟235
7124968189058024225,我还在想什么时候多了个夏日祭，南京也弄这玩意真的就过份了，我们自己那么多节日，节气，每个城市挑点适合自己的创新举行点节目不就好了吗,0,0,0,2022-07-27 16:37:05,来自广东,18191412669,L小11
7124934652900459275,好好查查谁推广的这事,0,2,0,2022-07-27 14:26:44,来自北京,98314257516,蕡蕡878
7124975658023273255,漫展对国家发展起到了什么样的作用、请大神科普！,0,0,0,2022-07-27 17:06:19,来自江西,109738425245,岭南时光066
7124986515272876804,我们这里从来没听说也没搞过什么夏曰祭，也不知这个活动是什么含义，,0,0,0,2022-07-27 17:48:31,来自吉林,5526245081,幸福老人58411722
7124905869728482083,牢记历史 勿忘国耻,0,5,0,2022-07-27 12:34:25,来自山东,932805424191039,苑苑姐1970
7124941386608739072,年轻人小时候受日本动漫的影响太深了，好多都丧得很！,0,0,0,2022-07-27 14:52:40,来自陕西,102888248508,随遇而安3129RnU
7124966795698225961,开展漫展其实大家并不抵触，大家抵触的是举办的时间和地点。应该避开我们民族的历史,0,0,0,2022-07-27 16:31:18,来自北京,55506482505,景观工作者
7124734210359018248,主办方是谁？承办方为了钱，主办方呢？为什么没有一个说出主办方的？,4,148,1,2022-07-27 01:34:04,来自山东,1846821224716440,热情菠萝ct
7124916980162986766,非得展示日本动漫吗？我们中国动漫也不输日本动漫啊，斗破苍穹 完美世界 斗罗大陆 等都是很热门的,0,11,1,2022-07-27 13:18:13,来自湖北,118346844221171,清新辰星Vh
7124971336115585826,为啥非得叫夏日祭，你直接叫动漫展不就得了,0,0,0,2022-07-27 16:48:45,来自天津,6810877005,鹅考OL
7125022050544222988,专挑731举办，佩服佩服,0,2,0,2022-07-27 20:05:51,来自广东,50054043674,钧子3
7124952258273641220,第一次听说“夏日祭”。,0,1,0,2022-07-27 15:35:33,来自河北,285526728911256,活泼梦想家zn
7124955789252477731,应追查主办方，看是何方神圣，想达到什么目的,0,0,0,2022-07-27 15:48:18,来自湖北,3448489379134636,元气轮船am
7124983983460975394,动漫一定要带有日本的元素吗？如果是这样的话中国不需要动漫又能怎样！,0,0,0,2022-07-27 17:37:52,来自安徽,3153817273901279,路过
7124983886492877598,我还是第一次听说，为什么有这多奇葩的人呢,0,0,0,2022-07-27 17:38:12,来自北京,4248728265,豁达的退休老太
7124937459045172004,现在某些人为了眼前的经济利益什么都忘了,0,1,0,2022-07-27 14:37:34,来自辽宁,54841815833,13555849946
7125018613903393567,中国元素的动漫难道不好吗？为什么要亲日。,0,0,0,2022-07-27 19:52:22,来自山西,71002153254,坦坦荡荡341
7124976010089038629,漫展的去鬼拒招魂的净化刻不容缓，净化后的漫展才能迎来更大的支持和更好的发展。,0,0,0,2022-07-27 17:07:19,来自河南,1385032729761971,超速大沣子
7124950024962081551,日子及西方的文化对我们的下一代渗透到骨子里了，希望国家有关部门引起重视。,0,1,0,2022-07-27 15:26:04,来自浙江,104968736771,聪慧早春二月
7125022575952085774,为什么会出现夏日祭？值得人们深思！。,0,0,0,2022-07-27 20:07:40,来自广东,57644640076,淼伯1
7124948249022055204,水流小了，自然有浑水流入。,0,0,0,2022-07-27 15:19:20,来自四川,106398153211,清新小猫0U
7124977791816483616,没有日风，动漫难道还不活了？,0,0,0,2022-07-27 17:14:24,来自宁夏,72563442503,小花脸漫游果园
7124923732233650944,离了日本动漫不活了？,0,6,0,2022-07-27 13:44:06,来自河南,58849978639,林墨156803612
7124900333193069320,漫画只有日本有吗？,0,35,0,2022-07-27 12:13:35,来自江苏,479011246186563,爱理财的阿海
7125024098170274601,动漫就一定要日本的东西吗？,0,0,0,2022-07-27 20:13:21,来自广东,105412115098,文佥11
7124938472272052992,糖果里的长大的，不知道苦是什么,0,2,0,2022-07-27 14:41:17,来自山东,18680933867,菩提186809338
7124940595923567375,日本一年四季都是祭日[泪奔],0,1,0,2022-07-27 14:49:34,来自湖北,83576969409,猫小喵4580
7124935665950704424,第一次听说“夏日祭”？我们自己的老祖宗传统文化对节气非常的讲究与智慧和科学性。遵从老祖宗留下的传统文化！[祈祷][玫瑰][比心],0,1,0,2022-07-27 14:30:13,来自宁夏,3474087855003447,独自浪漫FeDM
7124919906038612736,漫展与夏日祭何干，你不知道吗？,0,5,0,2022-07-27 13:29:10,来自北京,52296628290,13552783386
7124927848972092194,啥子叫夏日祭？求科普[抠鼻][抠鼻],0,1,0,2022-07-27 13:59:55,来自贵州,104964205601,橘子6701
7124999310903051011,漫展对社会有意义吗？这个问题估计很难回答！60后，70后80后，绝大多数都是持反对态度的！,0,0,0,2022-07-27 18:38:01,来自上海,111262779115,大中国安好
7124978492260926242,又一次印证了毛主席那一句：人民群众才是真正的英雄！,0,1,0,2022-07-27 17:16:23,来自江西,55509406887,丁点332828
7124973285657903909,赶紧推动中国风动漫活动，行业不要坐以待毙，要积极变革。,0,0,0,2022-07-27 16:56:47,来自浙江,2581262133368460,渔光点点158
7124943119321236255,什么叫多地?谁让它留存下来的。。。。,0,1,0,2022-07-27 14:59:29,来自江苏,95862110703,口黑口幼
7124992328401912610,商场各种奥特曼展览和活动也是如火如荼。,0,0,0,2022-07-27 18:10:14,来自重庆,5502350102,花57368472
7124902533260378891,早就该整顿了，要重拳打击,0,20,0,2022-07-27 12:22:14,来自黑龙江,109202033416,逐风955
7124966020539859753,严厉追究发起人，严查深挖坚决打击！！[加油],0,2,0,2022-07-27 16:28:01,来自四川,111643958976,longlifeandhappy
7124860689655186214,文化入侵真的可怕,1,107,1,2022-07-27 09:38:56,来自山东,2832798613252302,482万人
7124970457912705822,为毛非要办漫展。这个作者在这个时候写这些是什么目的,0,0,0,2022-07-27 16:45:52,来自山西,1332250111391917,小小点点0306
7124953565483385634,只要有利谁都喜欢。,0,0,0,2022-07-27 15:39:52,来自湖北,111169177813,聪明的天空Vg
7124966456428692265,渗透得够厉害！够歹毒！！,0,0,0,2022-07-27 16:29:41,来自江苏,263521862171535,人间烟火似你
7124931548046672672,不防备会鸠占鹊巢～,0,1,0,2022-07-27 14:15:23,来自广东,92600635618,倪霓520
7124975112818443039,那说明漫展走错了方向。,0,0,0,2022-07-27 17:03:58,来自浙江,6204837308,多才笑三斤
7124965338047529740,典型的偷换概念，这是漫展的事吗？,0,0,0,2022-07-27 16:26:11,来自新疆,51234862845,我爱我漂亮媳妇
7124968651844829992,换个名字，还得办。有的已改成汉服某某。,0,0,0,2022-07-27 16:38:11,来自辽宁,60502378914,雨天听荷
7124925018705937182,太可恨了，应该彻底查清，不允许这些东西进入，,0,1,0,2022-07-27 13:49:18,来自陕西,822085180732600,持之以恒宝宝姐
7124943103542346507,我都不知“夏日祭”是什么东东，我以为夏天需要祭拜五谷丰登呢[呲牙][呲牙][呲牙]，恕我孤陋寡闻[偷笑][偷笑][偷笑],0,1,0,2022-07-27 14:59:44,来自广西,135970136274664,上进精灵dB
7124981855820383011,为什么昆明广州是延期而不取消？,0,0,0,2022-07-27 17:29:31,来自陕西,50053661640,优美水滴V
7124973638604391205,夏日祭，祭奠什么呢？,0,0,0,2022-07-27 16:58:04,来自山东,100143494362,积极的百灵鸟i
7124920877141246734,晚啦！都是看着日本动画片长大的孩子,0,1,1,2022-07-27 13:33:16,来自广东,54297885885,Hanajiang
7124936151463035678,希望贵阳也跟上。,0,0,0,2022-07-27 14:32:44,来自贵州,5346344919,三个娃的妈
7125011145551086348,b站目前最好的策略就是低调，先苟住在说,0,1,1,2022-07-27 19:23:54,来自上海,3496041778789342,立二拆个三
7124921711052784392,为什么会有这种活动？,0,1,0,2022-07-27 13:36:31,来自吉林,51106349749,蓝色妖姬130746570
7124983596498354980,现在的成人漫画确实做的不错，但是我们也不能一味的抄袭能不能搞一些中国特色的动漫展,0,0,0,2022-07-27 17:36:52,来自辽宁,55685410029,倾听1331468
7124870896438821632,为什么是叫停？根本就不应该批复办理！这就应该立一项规定,0,31,0,2022-07-27 10:18:25,来自河北,105921280401,乱跑的车轮
7124976417741734687,应该坚决彻查深挖幕后操纵者！,0,0,0,2022-07-27 17:08:53,来自山东,95075033788,率真星星tJ
7125009803747541794,意料之中的事,0,0,0,2022-07-27 19:18:05,来自四川,84272620488,从容442
7124867845280187168,勿忘国耻！牢记历史！,0,55,0,2022-07-27 10:06:39,来自广东,63741703749,明明是我6741
7124984668789211908,不需要审批吗,0,0,0,2022-07-27 17:41:28,来自上海,99374722275,荷叶香田田
7124954816228442910,必须好好清理一下,0,0,0,2022-07-27 15:44:54,来自四川,5367448849,恋恋风尘52130104
7124871484896019236,治标须治本。严惩那些好了伤疤忘了痛之徒……,0,30,0,2022-07-27 10:20:47,来自浙江,135967774358123,祝双福
7124888251856995080,本来就不应该有这玩意儿吧,0,11,1,2022-07-27 11:26:52,来自山东,369895972809784,水若0608
7124971807106777869,好了伤疤忘了疼，忘记历史就是背叛,0,0,0,2022-07-27 16:50:54,来自浙江,4344863785761005,快乐的湖泊k5
7124901863832666921,一直都觉得喜欢日漫和cosJK的这一部分人媚日,0,24,0,2022-07-27 12:18:58,来自河北,67253778041,L鹏云
7124971089142629160,处了夏日祭，中国没节日了吗,0,3,0,2022-07-27 16:47:51,,85634092387,八零姑娘
7124897309473309448,不需要动漫，游戏，,1,89,3,2022-07-27 12:01:58,来自山东,3276965736354061,牙膏请用国产两面针
7124931373987250980,二次元真是看不懂，,0,0,0,2022-07-27 14:14:23,来自广东,60005817672,无聊q
7124897425592648463,很严重的举动 哦！ 不查吗？,0,11,1,2022-07-27 12:01:57,来自山东,102848087005,清秋2121
7124910444078908200,抵制文化入侵，送你上热搜！,0,10,0,2022-07-27 12:52:22,来自河南,1832548521,家我爱你
7124979677906879232,什么叫漫展行业走向何方？,0,0,0,2022-07-27 17:20:55,来自江苏,80369685666,清水清清520
7124951692696732456,从前也没听说过，今年这才看到的,0,0,0,2022-07-27 15:32:20,来自北京,105047666731,学堂词馆
7124966209405354787,我不懂动漫是什么？是中华传统文化吗？有那么重要？,0,0,0,2022-07-27 16:28:44,来自河南,71566620617,用户七嘴八舌71566
7125000105710961449,世界上是不是只有我们这里才办动漫展啊？,0,0,0,2022-07-27 18:40:21,来自北京,5561204497,马弓虽
7124925886910464782,不能否认！日本动漫二次元之类确实毒害了很多青少年！不能为了产业为了钱连人都不做了！,0,8,0,2022-07-27 13:53:06,来自河北,109045670513,又说实话
7124979819334992679,动漫产业本身并无罪，有罪的是一些从业人员假借艺术之名行历史虚无主义，这种人受到必要的惩罚是应该的,0,0,0,2022-07-27 17:22:30,来自北京,1244290944087101,缺少坏心眼
7124967228642116392,你们是给日本的动漫做宣传吗？,0,0,0,2022-07-27 16:32:45,来自海南,4454456715,Lyliang
7124968992964051712,搞动漫节是没问题，但不能用带日本色彩的名称。你可以用中国、亚洲、世界等。,0,0,0,2022-07-27 16:39:44,来自广东,51832045586,渝东68
7124956617187689224,夏日祭是什么,0,0,0,2022-07-27 15:52:11,来自山东,3688683000,自强不息苹果kO
7124951374622114596,生为中国人，就要学好中国文化，德为先、善为本，我们有源源不断的民俗文化呀！[赞][赞],0,0,0,2022-07-27 15:31:52,来自山东,1688462729946376,幸运书签QQ
7124969605403362087,文化的深透和入侵，难道不是意识形态领域的战争吗？,0,0,0,2022-07-27 16:42:36,来自河北,9644329090,炽天使2056
7125009056972538638,中国是亚洲文化缔造者！文化悠久而丰富！动漫应该多加入中国元素！而不是日本文化！,0,0,0,2022-07-27 19:15:40,来自江苏,92586980826,盱眙老哥
7124898757640684329,只有死路一条,0,45,0,2022-07-27 12:07:04,来自陕西,63770817236,邪不压正1993
7124970769129636616,为什么广州和昆明延期，难道还想着等风声过去，继续办吗？,0,0,0,2022-07-27 16:46:45,来自江西,4416096151551630,獨自偷歡丶
7124965386885350185,漫展可以开，但不能触及红线，,0,0,0,2022-07-27 16:25:36,来自河南,4324222610,legolass
7124945366092530446,意识形态领域亟待大治理、大整治，大刀阔斧，长期坚持…,0,0,0,2022-07-27 15:08:17,来自陕西,102636624302,槛外人来
7124949676591907625,什么是夏日祭？第一次听说,0,0,0,2022-07-27 15:24:46,来自河南,92357364044,桃花源里梦桃花
7124925026553627392,夏日祭的祭是祭谁？,0,1,0,2022-07-27 13:48:55,来自吉林,50451013289,写给生活的情诗
7124976796059075358,漫展和夏日祭是两个东西,0,0,0,2022-07-27 17:10:07,来自湖北,294292008476110,老许I你要老婆不要
7124899692319720206,不知道搞点中国风的？,0,79,0,2022-07-27 12:10:57,来自江苏,4666367146,轻狂书生46573922
7124970959291482894,动漫毒害了几代年轻人。,0,0,0,2022-07-27 16:47:59,来自北京,50934977322,王和永
7124989540100145927,漫展和日本夏日祭为什么要联系在一起？？,0,0,0,2022-07-27 17:59:50,来自上海,5801770247,Wanderingwind
7124970692973658910,漫展本身不只是商业行为，它所携带的文化元素也是必须考虑的,0,0,0,2022-07-27 16:45:48,来自江西,6215569663,游梦123
7124921069219087115,夏日祭是什么意思？,0,0,0,2022-07-27 13:34:18,来自陕西,111051026630,真心真意過1生
7125001394536809257,真奇怪，没人追究背后的组织者吗？,0,0,0,2022-07-27 18:45:21,来自广东,5196973225,卢克船长
7125004449621836577,日本对中国动漫的影响力太大了,0,0,0,2022-07-27 18:57:59,来自浙江,59333832277,别玩虚滴
7124972984888394533,动漫就动漫呗，加上什么夏日祭做什么？,0,0,0,2022-07-27 16:55:29,来自山东,3966689550800349,有低保的老吕
7124968586057515816,很难让人相信不进行日式漫展这些企业就活不下去？,0,2,0,2022-07-27 16:38:06,来自四川,110904454613,世界和平之路
7124943258517881641,爱国主义教育深入人心，防止外来糟粕刻不容缓。,0,0,0,2022-07-27 14:59:51,来自江苏,53287628865,自由伊莱莎8y9
7125001171370689319,我个人是动漫爱好者，但是真不喜欢把日本的传统文化搬过来，不因为别的只因为二战日本的所做所为以及战后的所做所为，如果日本战后诚心认错不把战犯供到神社，你现在来搞夏日祭我可以既不支持也不反对,0,0,0,2022-07-27 18:45:28,来自广西,2664813220345716,流于隐
7124973746838422285,为什么不说物资交流大会呢,0,0,0,2022-07-27 16:58:35,来自山东,100143494362,积极的百灵鸟i
7125011855080964879,什么是漫展？很多人都说是日本的（夏日ji )，为什么不是我们的或者别的国家的东西？非得要日本的？,0,0,0,2022-07-27 19:26:03,来自广东,2743986178761647,灵巧枫叶Ub
7124901041107567401,如何才能树立起民族自尊心，不能只靠宣传和学习，应该靠法律和规矩,0,25,0,2022-07-27 12:15:46,来自云南,14015749454,乐观的露珠Ry
7124924817224450831,改了名，继续开,0,0,0,2022-07-27 13:48:11,来自吉林,50451013289,写给生活的情诗
7124903324520399654,看来作者另有所图,0,15,0,2022-07-27 12:25:21,来自河北,2405324314119128,吉仕装饰
7125005724312503079,漫展本来就有各种问题，漫画里面的女性角色是啥样子，cos成那样的话，基本就是比哪个衣服少，擦边球打得好了。,0,0,0,2022-07-27 19:02:42,来自湖北,52682645363,潮水的诺言
7124946570147578661,动漫为什么和祭祀活动搞在一起,0,0,0,2022-07-27 15:13:06,来自辽宁,5751324650,蔚然霜雪后
7124897769655419656,铭记历史、勿忘国耻！不能只停留在口头、文字上，要落实在管控教上，要加强对青少年进行爱国主义教育，要加强对宗教、动漫、娱乐的审查管控。,0,2,0,2022-07-27 12:03:43,来自江苏,3394548588,赵建林江苏泰州丽都
7124935323166999309,“夏日祭”是祭谁的？,0,0,0,2022-07-27 14:29:09,来自江苏,2247026311699028,好学面条Le1
7124966898860737317,别在南京夏日祭，每个城市有不同的历史,0,0,0,2022-07-27 16:31:54,来自四川,109434808457,Luke2334
7124865573523636992,漫展成了载体，外壳,0,38,0,2022-07-27 09:57:49,来自广东,102856225283,Wesheter
7124868299690951459,敌人近在咫尺，抵制各种渗透,0,25,0,2022-07-27 10:08:24,来自河南,742909891840360,春夏秋冬秋夏春夏秋冬
7124922370506228493,动漫也不能办,1,0,0,2022-07-27 13:39:06,来自河南,68709246850,2276541
7124989833914811174,你只关心了漫展，却不关注中国的未来在何方？,0,0,0,2022-07-27 18:01:06,来自湖南,5455822763,半支木槿丶
7124870380162073357,文化入侵腐蚀年轻人的思维,1,16,1,2022-07-27 10:16:22,来自河南,6419760911,浅-默
7124965371274560260,漫展和日本元素应该可以分开不能划等号吧。,0,0,0,2022-07-27 16:26:21,来自陕西,106694862264,偶然896
