7132680544340476704,我的娘家那边有几个大型水库，都是当年搬迁了几个乡建起来的，老人说三年不下雨这地方都不遭旱。现在我婆家这边，只有几个牛眼睛大的蓄水池，虽然他们也叫水库，两月不下雨井水都干涸，我都不明白为什么不建大水库？,1,3,0,2022-08-17 11:24:41,来自湖南,100414328695,宁静的雨天
7132641216441205542,民众对专家们的期望是要有提前预测能力并提前做好应对措施，而不是事后一大堆费话。,4,51,0,2022-08-17 08:52:27,来自重庆,6988911992,多年789
7132636128695943977,可控，你能控制老天爷？,6,148,0,2022-08-17 08:32:13,来自重庆,103968100229,看见更大的世界qwe
7132660351216222983,如果继续干旱的话国家应该大修水利，包括农村的堰塘，河流，不然农村庄稼，牲畜饮水问题，天干的时候，有水心里才踏实。,0,14,0,2022-08-17 10:06:21,来自四川,52738036356,直爽凌凌
7132633816264311552,可控？意思你们把三峡库区的水故意不放？,5,66,2,2022-08-17 08:23:04,来自湖南,514213248509335,荆襄玉
7132641592183177991,肤浅的论述只能陈述这个灾害，要找到高温大旱的主要原因，必须进行全面、深入的分析，以便采取措施尽快修复。长江流域l，特别是成都地区巨量的生态破坏应该是这类大灾害的主要祸根，阻断生态破坏，尽快恢复湿地生态和农田粮油种植是阻止灾害发生发展的重要抓手！,12,35,0,2022-08-17 08:53:26,来自四川,110783739408,麦克斯弓韦
7132642313771631390,个人认为，九月后随着副热带南退长江流域，冷空气不断南下，长江流域发生秋季汛情的可能性较大。,3,12,0,2022-08-17 08:56:19,来自安徽,110871722304,和和美美之家
7132651152235348770,持续高温高热，蒸发量大于补充量，自然会干旱。不要增长人口了，我们的人口不需要增长了，站在国家社会政治和地球人类政治的高度认识，就知道我们的人口不需要增长了，综合计算一个国家的人口多少合适，我看6亿就行了，地球承载不了过多的人口，我们6亿人口保卫国家也行了。,3,7,0,2022-08-17 09:30:20,来自山西,14683668415,Fante2018
7132629787377828608,只要专家预测旱情继续那么说明过不了几天必定会下大雨。同志们欢呼起来吧,2,55,0,2022-08-17 08:07:27,来自山东,53422964354,dong274640694
7132685207308206888,之前长江上游主要是怕有大洪水、早早就放水囤库容了，那晓得今年长江上游无洪峰无大洪水、早早把江水白白放到大海去了，到至今年下游大干旱，失误啊，也是误判了天气，水贵呀，还是应该每年让三峡大坝扛一扛，尽量把上游水位放在最高位置以防干旱。,0,0,0,2022-08-17 11:42:24,来自江苏,93464528628,兴航幸福
7132638423739073294,风险可控？农业又要增收吧！,5,32,0,2022-08-17 08:41:12,来自四川,484223234879512,舞动舒兰0H6
7132637502355604262,总体可控，可以用到任何地方。疫情总体可控，经济总体可控，旱情总体可控。万能用语,5,90,1,2022-08-17 08:38:11,来自四川,6595290869,向西骑撸车记
7132656692646445836,南水北调，不能在干旱时反过来北水南调吗？,1,2,0,2022-08-17 09:52:22,来自湖北,66451357298,V202474759
7132626439458997006,"昨天本傻就说了“总体可控""比专家还早预测到。",1,75,0,2022-08-17 07:54:45,来自重庆,71305727373,宣真
7132683158713369356,世界各地高温热浪，包括我国长江中下游高温热浪，都是人类不合理活动导致的干旱造成的，绝不是温室效应所致。如果科学家还抱着温室效应这一错误理论误事，还不采取科学合理治水措施，不改变陆地表面蓄水面积严重缺失现状，不恢复水调节气温功能，干旱高温只能逐年加重，并形成常态。,0,0,0,2022-08-17 11:35:13,来自河北,68682353544,摇摆的地球
7132627445701985064,又是：总体可控[骷髅],1,94,0,2022-08-17 07:58:21,来自福建,104624177141,自强不息精灵cc
7132633758083547938,當年黄老極力反對，始終改變不了三峡大垻，往後還會有更多極端天氣出現在長江流域，人，終将為自己買單,6,22,4,2022-08-17 08:22:52,来自广西,2484538270557528,風雲秀吉
7132643871452119816,专家预判:长江旱情将持续加剧，由于经过长期建设，水利设施较完善，蓄水偏好，抗旱供水措施有效，总体风险可控。,0,7,0,2022-08-17 09:02:26,来自湖北,53662057939,wangyunbin2
7132683312207889152,专家话，应反读，风险不可控。长江中下游5亿受灾,0,2,0,2022-08-17 11:34:54,来自浙江,64854941642,侯鸟避暑
7132625900931646239,什么叫不可控,5,20,0,2022-08-17 07:52:45,来自刚果（金）,104926395175,出国得那些事
7132660282110821134,快点放水，地里的庄稼多等一天就会晒死。别讨论长谈了。,0,2,0,2022-08-17 10:06:07,来自江西,63483906144,梨花雨雾
7132685671869416225,国家的大基建应该大修水利工程了，特别是农村的沟沟渠渠，都应该重新修了，看着地里的庄稼都变黄变枯了，花生叶枯了，红薯叶枯了，菜园里的菜也枯了，看着心疼,0,0,0,2022-08-17 11:44:57,来自湖北,61043594803,一杯香茶
7132655450323075855,长江流域的干旱跟南水北调工程有没有联系？,0,4,0,2022-08-17 09:46:55,来自北京,14271459125,奋发溪水J2
7132679726393213734,下半年粮食高产稳产，丰收在望,0,2,0,2022-08-17 11:22:01,来自浙江,107704800342,幽灵海狮
7132638916267721506,初步预判长江流域旱情将持续和加剧，风险总体可控（=没说[抠鼻][抠鼻][抠鼻][抠鼻]差评！）,0,5,0,2022-08-17 08:42:46,来自湖南,81421016828,自在日月G
7132651242840392487,如果南方干旱，北方洪涝，南水北调工程能反向输水吗？估计难，因为南水北调是利用水的落差。,0,3,0,2022-08-17 09:31:19,来自河北,6607572353,顺平99150391
7132641838582334249,气温升高，第三极珠峰弱化，中东同纬度沙漠化趋同，,0,1,0,2022-08-17 08:54:18,来自湖北,6927582484,泊云岸
7132673726911038215,要南水北移了？,0,0,0,2022-08-17 10:58:35,来自河南,21615231610,心平则静
7132671588230693671,大气环流异常什么原因？,0,0,0,2022-08-17 10:50:12,来自辽宁,95974351362,狼图腾刘世汉
7132677359463138088,还有10天，天气降温，旱情缓解。,0,0,0,2022-08-17 11:11:55,来自河北,63910045834,看那一道光
7132682152277705484,又是瘟疫又是大旱，老天爷，开开眼吧。,0,0,0,2022-08-17 11:31:14,来自四川,1055950263826971,红羊劫数
7132662304797721357,汉水流域10月份大摡率会连续降雨,0,0,0,2022-08-17 10:14:07,来自陕西,5471047688,浮萍的小农生活
7132668500011057955,专家又开始预测旱情了,0,0,0,2022-08-17 10:37:34,来自河南,104668037723,雷子8795
7132649957131387682,如果南方干旱，北方洪涝，南水北调工程能反向输水吗？估计难，因为南水北调是利用水的落差。,0,1,0,2022-08-17 09:25:38,来自天津,23460912637,我家阿寿
7132640316754412323,长江水位低了，长江黄金水道的功能减弱了，水运会不会减少了，公路铁路运输就要发挥了！[捂脸][呲牙],0,2,0,2022-08-17 08:48:13,来自江苏,466633584285264,走大路，看世界
7132681547022713614,今年山东大雨多，水汪汪的，今年既然长江水少，那就北水南调吧！,0,0,0,2022-08-17 11:28:35,来自山东,105226479694,王孝弟892
7132648951475553058,旱季抓紧修水利，,0,0,0,2022-08-17 09:21:49,来自新疆,3548870876858363,善良钢笔T7
7132638717550445320,科学调度汛情雨季远末到来可水库的水早已提前放走可老天爷偏偏又与人类开起了玩笑雨下的可怜。,0,2,0,2022-08-17 08:42:36,来自北京,4052760819,东出西进
7132680454951682829,我们的地产金融危机风险也一直是总体可控的！[大笑],0,1,0,2022-08-17 11:24:16,来自广西,852853858769837,雨农江山
7132647117264503566,可防可控，专家说的,0,4,0,2022-08-17 09:15:02,来自山东,347057258502776,博学咖啡qI
7132659144552973095,专家湖北什么时侯吹点雨来,0,1,0,2022-08-17 10:02:05,来自湖北,104489974725,绿草2090
7132657866280452899,不下雨肯定缺水！是人都明白，还要砖家说吗？如果专家能准确说出什么时候能不缺水了，那才是有水平！,0,1,0,2022-08-17 09:56:33,来自上海,50921166679,鼠大爷01
7132650537849717534,冰川都化完了，长江快干了,0,1,0,2022-08-17 09:28:25,来自湖北,4481236191426989,美好情怀
7132639708684944163,欧洲的旱情可控吗？,0,3,0,2022-08-17 08:45:51,来自陕西,65546082478,草木浅
7132626661165957892,水系连通利国利民，功在当代利在千秋…,0,2,0,2022-08-17 07:56:23,来自重庆,17015053338,川味酸菜鱼
7132684170698097411,不要预防，可控，把那些所谓的专家教授的工资用在农村，多修些小型水库和池塘，这样即能防止旱涝，还能降低风险。,0,1,0,2022-08-17 11:38:54,来自安徽,3047470164608219,灵巧露珠Ku
7132637864785232640,长江干了，想不到啊,0,2,0,2022-08-17 08:38:52,来自吉林,6111701786,淡水清流79702472
7132680546962244382,风险可控的意思就是长江不会枯萎吗？,0,0,0,2022-08-17 11:24:38,来自江苏,51820830097,大切默默
7132651531899781928,水利专家说，我们坐在办公室，要茶水有茶水，要凉风有凉风，一切尽在掌握之中，,0,2,0,2022-08-17 09:31:53,来自河北,7953269670,一片冰心001
7132641115555070723,温室气体排放量大，生态环境己坏了,0,2,0,2022-08-17 08:51:58,来自江苏,108131852424,栖霞真君
7132633495088022310,等天气适合的时候，增加人工增雨作业。经常发大水的地方也遇上了这么严重的旱情。适时与增加人工增雨！[祈祷][祈祷][祈祷],0,2,0,2022-08-17 08:22:51,来自河北,109243883957,上进的正义必胜
7132684451884221184,专家说可控了，大家明白了吧,0,0,0,2022-08-17 11:39:17,来自山东,67936924990,鸡蛋壳317
7132680629288174375,总体可控，相信专家……,0,0,0,2022-08-17 11:25:21,来自广西,3685197754404172,原野DyEW
7132665410205483776,专家专家？？？,0,0,0,2022-08-17 10:25:35,来自江苏,4340506444965908,敏锐海洋0
7132631854750237455,长江水利委员会根据中央气象台精准长期天气预报，果断于6月中旬将坝前水位从175米消减到145米，为今年汛期长江流域可能发生的超大洪水提前腾空库容。,2,14,1,2022-08-17 08:15:25,来自安徽,70222609619,破山高林
7132681141491876639,长江会断流吗,0,0,0,2022-08-17 11:26:49,来自湖北,6536140806,CZX人生如梦
7132631328352109325,水利专家去现场看看去,0,1,0,2022-08-17 08:13:35,来自江苏,64822223993,洒脱的自由虾
7132652366943961886,长江中下游干旱严重水位下降，印巴的超级热浪，欧洲的干旱状态，北半球的持续高温、山火绵延，一个又一个警讯。人类只有一个地球，而它已经不起更多的折腾了。我们要关注气候，减少碳排放，爱护自然，保护我们人类共同的家园。,0,0,0,2022-08-17 09:35:50,来自广东,54931084815,深圳老邱看世界
7132664803852092200,还是水利工程少了点,0,0,0,2022-08-17 10:23:18,来自安徽,20127608073,淡泊淡泊静心静心
7132686072940954402,风险总体可控?人类能控制大自然？,0,0,0,2022-08-17 11:45:43,来自湖北,64001760380,YC老班头
7132679461610472195,不想看到澎湃新闻,0,0,0,2022-08-17 11:20:41,来自江苏,111097359600,笨笨的小人人
7132674184718746409,"可以考虑我的方案，
一，长江从宜昌起，每百公里修一座矮坝(包含船闸和小形发电设备)。
二，坝高，比最低水位高出五米即可，洪水时直接漫过，低水位时蓄水，通航，保旱！
施工方案！
一，坝釆用充填方案，坝高最低水高五米，坝基50-100米！以高密度植桩(岸上预制，再放制河中)。
二，用造岛船挖河道泥沙充填河坝，因为坝矮基宽，植桩法，再加上低位蓄水，压力小。坝成形后表面硬化即可，成本低廉，并兼疏通航道！
三，从宜昌到崇明岛，40座矮水坝即可！
项目完成后的利益！
一，通航保旱，兼顾疏通河道！！
二，稍增加当地城市共公电力供应！
三，保护长江及其支流蓄水功能，恢复生态环境！
四，给当地城市增加工作岗位！
项目完成后的敝端！
一，汛期洪峰时，矮坝阻挡了其流速，增加了洪峰时间，增加溃院风险。
二，全国统一调度长江及其支流所有水电站，错峰泄洪，就能解决问题。如果像现在各自调度，就很容易出问题！
三，货运航业受限制，但船闸采取24小时工作制，可以将受限敝端降到最低！
各位条友，我已经向国家水利部提交了方案申请，如果想投资加盟的请速度！
😂😂😂😂😂😂😂",0,1,0,2022-08-17 10:59:33,来自湖南,50579122406,周运胜
7132639393630257928,可控就别让干着，上游大坝放水吧。,0,0,0,2022-08-17 08:45:10,来自山西,3697538454,余本布衣
7132634600261829411,可以控制江河流的话本事何等了得,0,3,0,2022-08-17 08:26:03,来自广东,110836865736,壬子ok
7132676794553271055,抓紧清淤！,0,0,0,2022-08-17 11:09:41,来自内蒙古,6048043288,香如故77319051
7132680710267290375,如果人类有本事控制气候风险，人类就是神仙了！,0,0,0,2022-08-17 11:25:19,来自广西,852853858769837,雨农江山
7132676700126855968,天气预报的分析方法都来原于西方，如今西方自己也没能预测准确，就不要太苛求我们的专家了，他们也尽力了[捂脸][捂脸],0,1,0,2022-08-17 11:10:05,来自江西,51160139427,盛世红花开
7132656927221842700,这和去年老美加热北极地区电离层是不是有关[灵光一闪][灵光一闪][灵光一闪],0,0,0,2022-08-17 09:53:38,来自山东,92989075804,红尘的承诺
7132633782859580201,再来个北水南调,0,1,0,2022-08-17 08:23:05,来自河南,83721989157,行者驿站001
7132631952850862880,可控是粮食欠收，畜牧业减产都可接受,0,1,0,2022-08-17 08:16:43,来自广东,50493870140,老崔140709344
7132683146902111007,厉害了，大自然灾害都能调控自如[捂脸][捂脸][捂脸],0,0,0,2022-08-17 11:34:43,来自浙江,87247635860,呆若木鸟
7132637850897613609,最牛逼的专家：风险可控。,0,1,0,2022-08-17 08:38:37,来自内蒙古,55210399011,南山147303090
7132661098901406504,总体可控[捂脸][捂脸][捂脸]2020年初也是这么说的，不排除有限人传人，疫情总体可控[泪奔][泪奔][泪奔],0,0,0,2022-08-17 10:08:50,来自湖北,101945682105,无敌神拳帮帮主一尺枪
7132648216453382946,我知道专家会说，总体可控。,0,0,0,2022-08-17 09:18:57,来自山东,3372912259374471,大晏高飞lanhuo
7132658310155158312,对于有些专家学者们来说，只要灾难还没有出现，他们都是会告诉人们“风险可控”的。何为破坏大自然，也都是他们来定论的。,0,0,0,2022-08-17 09:58:06,来自江苏,17145886905,马文林3
7132647027942703912,今年的年卦是《明夷》之巜既济》。懂的人一看便知今年为什么是天干物燥年份。,0,0,0,2022-08-17 09:14:15,来自安徽,18155075030,河洛居士1
7132636560037528353,专家站出来说可控的时候，一般就是不可控了[捂脸][捂脸][捂脸],0,3,0,2022-08-17 08:34:12,来自四川,51833648381,昨天0155463719
7132674588500149022,今年粮食产量稳步增长相比去年有所上升,0,0,0,2022-08-17 11:01:28,来自湖北,54806785865,二流媒体
7132628724813513480,一听可控就知道，大家自求多福吧,0,14,0,2022-08-17 08:03:32,来自山东,52385347002,有钱爱说
7132651204366697249,如果出现夏秋冬连旱，总体风险还可控吗？,0,0,0,2022-08-17 09:31:24,来自江苏,107767504401,18962279671
7132654445300564751,从专家口中出来的话，都是可控！谁都会说可控,0,0,0,2022-08-17 09:42:56,来自四川,5454466740,开心就好liuming
7132649167339586311,连天灾的风险都能可控，看来人定胜天是真的！！,0,0,0,2022-08-17 09:23:07,来自浙江,9663492003,红楼夜梦1
7132644602020119307,这么引水，那么引水，都破坏了生态,0,1,0,2022-08-17 09:05:40,来自四川,56621755226,zjj787112
7132676145019568896,看见专家说“整体可控”就有点心慌,0,0,0,2022-08-17 11:07:19,来自江苏,105159259702,戒痴396
7132647952442835750,总体可控，专家经典语录[赞],0,0,0,2022-08-17 09:18:35,来自河北,6607572353,顺平99150391
7132658232639914790,流年不利。,0,0,0,2022-08-17 09:58:23,来自北京,6407944246,jfghkl
7132646440891548447,我研究发现：再过几个月冬季到来，总体温度可控,0,0,0,2022-08-17 09:12:25,来自甘肃,52661980089,西凤酒11
7132664624021357312,三峡工程利国利民的工程。,0,1,0,2022-08-17 10:22:39,来自广东,81791193169,王永忠82
7132664637040018217,不管出现什么问题，专家都是总体可控，现在又出现一个新名词，“最后一公里”。,0,0,0,2022-08-17 10:22:34,来自广西,3847911826272296,直爽葡萄8e
7132645790216225569,这还需要砖家判断，是个人都看得出来,0,0,0,2022-08-17 09:10:16,来自云南,6807333946,夜阑珊2
7132682457039864610,今年北方普遍雨水💦多，我们山东就很多,0,0,0,2022-08-17 11:31:45,来自江苏,426246656498279,汉四郡总督
7132682747864466211,风力发电应该考虑会不会影响季风,0,0,0,2022-08-17 11:32:49,来自新疆,64678041159,AM美万家
7132636089563087623,听到专家说可控就怕了！,0,1,0,2022-08-17 08:32:24,来自陕西,52488993514,飛上九天攬日
7132628774583337766,总体可控，专家经典语录[赞],0,2,0,2022-08-17 08:04:33,来自广东,68263175736,刘芹854
7132640737221100327,可防可控，江不传河。,0,1,0,2022-08-17 08:50:52,来自江苏,62643500800,南通诚德教育
7132633378813215524,三峡大坝该发挥作用了,0,1,0,2022-08-17 08:21:35,来自山东,2733053767,澎湃22620849
7132642468331963173,南方广西今年雨水比较充足,0,0,0,2022-08-17 08:57:01,来自广西,2941931730773144,井蛙1
7132683696905143080,可控不可控不关心，如果持续出现极端情况，确保可控的措施是什么？,0,0,0,2022-08-17 11:36:24,来自湖南,65251508402,活泼麻酱VT
7132637762804826884,可防可控不会人传人[灵光一闪],0,3,0,2022-08-17 08:39:13,来自广西,105171739291,异常人类研究中心主任
7132650579025134367,麻木了涝的时候预判更涝旱的时候更旱，不是专家也会这么说,0,0,0,2022-08-17 09:28:37,来自湖北,98920890192,用同一个名上网
7132672328785969957,今后水坝的前途堪忧……,0,0,0,2022-08-17 10:52:58,来自北京,2966209423,淡泊乡野郎中
7132638913801372420,没什么是专家不可控的,0,0,0,2022-08-17 08:43:36,来自湖北,93164216347,手掌710
7132677210724975394,河底捡宝,0,0,0,2022-08-17 11:11:27,来自河南,408656917301067,沉着饺子BC
7132668913757913891,农作物都干死了，你给我说怎么控,0,0,0,2022-08-17 10:39:04,来自重庆,4270104829242701,欢快春风vmf
7132658871478387495,有专家在，一切都不是问题,0,0,0,2022-08-17 10:00:56,来自陕西,6049590806,鼓楼上的燕儿
7132671143282721551,嘉陵江都断流了,0,0,0,2022-08-17 10:47:59,来自重庆,1103542751855899,热情的秦淮河畔
7132650084621665038,应该是由气象专家来判断吧,0,0,0,2022-08-17 09:26:56,来自广东,4597445520,海德三道
7132670190320059149,大旱之后防大涝,0,0,0,2022-08-17 10:44:43,来自江苏,285528764193548,123894231258
7132634514077205259,北水南调,0,0,0,2022-08-17 08:26:28,来自河北,83939883438,漫撒朝阳
7132630015946572559,风险整体可控？怎么控？谁控？,0,4,0,2022-08-17 08:08:25,来自山东,20694101870,梦幻农民IM0v
7132650239869731597,毋庸置疑，在面对自然灾害时，我国永远都会比米粒坚、落日帝国之流要强得多,0,0,0,2022-08-17 09:27:26,来自北京,1165948327306270,又丢了四块多
7132681631147868928,炎热天气可控？,0,0,0,2022-08-17 11:28:29,来自重庆,1785218079137519,莫利true
7132668914399609633,怎么控？？？是人工造水呢，还是怎么搞？,0,0,0,2022-08-17 10:39:55,来自甘肃,6271279058,期望未来84095000
7132681160190182175,如有办法有能耐，就把副高压控制弱些，也算做点实事！,0,0,0,2022-08-17 11:26:59,来自浙江,110478799163,风潇潇一石雨
7132671107236496159,别说那么多了，赶紧放水救急吧！,0,0,0,2022-08-17 10:48:09,来自山东,75623844989,宗老大8
7132684242102240033,中国的唯一一条主航道搞成啥样了，,0,0,0,2022-08-17 11:39:17,来自广东,53106536833,远山烟火
7132673294066533159,烈日炎炎似火烧。,0,0,0,2022-08-17 10:56:51,来自四川,2563680194018540,湖涂用户
7132668835219686178,水库修得过多,0,0,0,2022-08-17 10:38:51,来自福建,1183508006977310,自强不息艺术家9M
7132684587960206119,专家你倒是控啊！干枯的依旧枯,0,0,0,2022-08-17 11:40:39,来自湖南,3101979967,心语星愿小糊糊
7132666335863243561,持续加大，你怎么控？,0,0,0,2022-08-17 10:29:06,来自广东,3718812977,Tom加油
7132662812941599488,不会人传人嘛,0,0,0,2022-08-17 10:15:33,来自重庆,96176943883,不知当讲不当讲也
7132643488285836070,老天爷在天上看着我们来,0,0,0,2022-08-17 09:01:24,来自湖北,92207119682,眀年721
7132670521971589918,南水暂时就不要北调了,0,1,0,2022-08-17 10:45:46,来自江苏,52631236192,大高大全
7132684590485127936,主汛期都见底了，在干点才好,0,0,0,2022-08-17 11:39:54,来自江苏,1583717654469299,维尼5335
7132651974402802472,久晴有久阴，阴阳总平衡，没什么大不了的，只要不出人祸！,0,0,0,2022-08-17 09:33:31,来自安徽,2651616909459790,大朱花开花落
7132679968152126211,人已胜天[赞][赞][赞][呲牙][大笑][捂脸],0,0,0,2022-08-17 11:22:34,来自四川,5858093431,云卷云舒曾
7132652031252103967,哪个专家说的，把名字写出来！,0,0,1,2022-08-17 09:33:53,来自湖北,101935750735,著名画家！！！
7132673779909739296,总体可控可用于各行各业，各个方面,0,0,0,2022-08-17 10:58:46,来自湖北,58838112694,老徐子3
7132686890012623656,现在预判是早了还是迟了？,0,0,0,2022-08-17 11:48:53,来自四川,74626321261,春华望秋实
7132649647650636584,不知道风险可控是啥意思，旱的照样旱死。,0,0,0,2022-08-17 09:24:28,来自湖北,839635329090334,智慧海风VT
7132635518776951585,“风险总体可控”成了放之四海而皆准的真理。,0,1,0,2022-08-17 08:30:42,来自四川,3925722464,岩上松29863392
7132665087722242857,房地产过度开发的结果,0,0,0,2022-08-17 10:24:20,来自江苏,910044548836766,运动夏琳4R5
7132630406104859422,天若不赏饭人类就是那么渺小。,0,2,0,2022-08-17 08:10:26,来自广东,3560859640,长治图盛
7132675813040145191,有什么事情不是可控的？,0,0,0,2022-08-17 11:06:40,来自湖北,59642728953,英雄也投降
7132635050826629903,风险可控？怎么控的？,0,1,0,2022-08-17 08:27:52,来自重庆,95932520273,正奇827
7132666802894750471,"是不是，什么都要，最后加上一句：
风险总体可控？",0,0,0,2022-08-17 10:31:25,来自北京,2968331521897614,KLMeissen
7132643116288705292,风险可控，大家是不是觉得这句话很熟悉[捂脸][捂脸],0,0,0,2022-08-17 08:59:54,来自四川,892391552459005,独一无二的癞蛤蟆王子
7132634208677856034,说句不可控能咋的？,0,1,0,2022-08-17 08:24:44,来自江西,2334974668708707,非漂2010
7132662562927805199,风险总体可控这句好现在也算是时髦话了！,0,0,0,2022-08-17 10:14:38,来自广东,50429662285,福建番薯
7132652034649719587,承认错误很难吗？,0,0,0,2022-08-17 09:33:38,来自河南,51777511511,亮亮说装修
7132644823844176655,一切天大的事情都在把控之中，尔等还是专心搬砖打镙丝去吧。,0,0,0,2022-08-17 09:05:43,来自湖北,52936082755,风神宝马1
7132630311795933992,没有什么是我们总体不可控的,0,2,0,2022-08-17 08:09:30,来自河南,105126108720,我的晴晴
7132663053283918607,快看看珠穆朗玛吧，想想王子,0,0,0,2022-08-17 10:16:28,来自山东,6629558466,阿湛小记
7132631916415091497,这不用专家说,0,0,0,2022-08-17 08:15:44,来自河北,68000415796,西门吹雪2276
7132677648534487845,风险总体是可控的。,0,0,0,2022-08-17 11:13:25,来自江苏,52796226013,放牧我的心2
7132652829210723107,风险总体可控，意思就是个别地区不可控了,0,0,0,2022-08-17 09:36:56,来自河南,110165291653,秦唐纵横
7132644004537205517,无论什么事儿，都是一句总体可控!,0,0,0,2022-08-17 09:02:49,来自山东,60461673908,真实的谎言61673908
7132658523691516712,“风险整体可控”——已成普遍真理。颠扑不破！,0,0,0,2022-08-17 09:58:54,来自湖北,3307048448,含羞草10953040
7132679876884071201,在我们这里都是可控的……,0,0,0,2022-08-17 11:22:19,来自江苏,102706360719,终于某日等到你
7132683535277736742,就喜欢这句“风险总体可控,0,0,0,2022-08-17 11:36:36,来自江苏,5105121759,著名流浪汉
7132652057756566285,人定胜天[笑哭],0,0,0,2022-08-17 09:34:28,来自广东,3495794787,孤独观自在
7132630598749422369,风险总体可控，请问怎么控[捂脸][捂脸],0,2,0,2022-08-17 08:11:49,来自广东,110816550482,朴实天空4t
7132647595583259405,你是姜子牙还是孙悟空,0,0,0,2022-08-17 09:17:05,来自浙江,110234242022,俊哥在浙江的创业生活
7132642777942524711,能蒙混的是可控，不能蒙混的就是不可控了,0,0,0,2022-08-17 08:58:34,来自山东,53583201838,海派323
7132633092019913486,风险总体可控，总体指的是什么？可控是控哪里？,0,1,0,2022-08-17 08:20:50,来自广西,99587113170,梁承美景担当派
