7132720101132174080,比亚迪汉 7天,42,380,3,2022-08-17 13:57:48,来自内蒙古,6446657849,预约快乐
7132708965183636265,比亚迪汉千山翠。据车主说，也没暴晒，刚从车库开出来就冒烟,14,79,1,2022-08-17 13:14:29,来自四川,21882088084,老韩闲聊
7132646677274100512,三元锂电池一旦起火就是爆燃，不给人逃生时间，而磷酸铁锂电池则是性命无忧,4,3,0,2022-08-17 09:13:52,来自上海,4103838433030168,潇洒清闲的梦想家
7132733663410291470,买电车一定多买点保险，运气好烧一台，运气不好烧一片……,2,40,0,2022-08-17 14:51:10,来自湖北,6254080827,若纸茹初剑
7132725987418227491,这是阴谋，刀片电池怎么可能自燃,6,71,0,2022-08-17 14:20:41,来自江苏,2634056231827982,沙滩NJ
7132736357843862304,关键是车主改装过线路没有？,1,1,0,2022-08-17 15:02:11,来自广西,6705104869,骏乐汇
7132715656759345951,几乎每天都能刷到新能源车起火的视频,12,92,0,2022-08-17 13:40:47,来自贵州,5834661137,周先森67278997
7132710457298961160,比亚迪还是比较大方的，前段时间我朋友的车被一个比亚迪新电车烧了，二手车5万，我朋友要12万，直接转账，都不报保险,14,36,0,2022-08-17 13:20:43,来自四川,5464675338,博学花月本无常
7132719769286968100,比亚迪刀片电池宇宙第一，不可能自燃，我不信[看],12,105,1,2022-08-17 13:56:55,来自河南,98435388697,咸鱼60172
7132710531139994403,比亚迪汉，被王传福吹成让自燃终结的新能源汽车,2,192,2,2022-08-17 13:20:44,来自四川,52769242225,外围尺寸
7132734644608647936,我们很搞笑，明明是电能的迁移与储存技术非要表述为新能源？是电池发的电吗？肯定不是，还是原来的水电、火电、风电、核电变了吗，电还是原来的电，新在那里？电用的越多，能源消耗就越多，表面上看污染降低了，实际上不过是污染、风险、环境变化等转移到部份地区和上游企业罢了。真正的新能源应该是清洁，高效、无污染(从生产制造到使用全程无害)、可再生或虽不能再生但地球储存量巨大，可替代煤、燃油、核能。结论，电动车不是新能车，应该储能电动车才对，储能技术很早就有，不存在新，只是技术比过去进步了，这一点不新鲜。,15,85,1,2022-08-17 14:54:17,来自四川,99280599983,乖巧圆月Gx
7132709530702021407,不是说刀片电池不会自燃吗？,19,162,2,2022-08-17 13:17:08,来自重庆,3803957763253204,Y坚持才有希望
7132724663049798435,除了特斯拉，国产新能源车自燃基本都有封口费，只要不出人命，亏不到哪去,8,141,3,2022-08-17 14:15:21,来自江苏,3821552837079639,微尘KK
7132709973934670632,新能源品牌啊，干嘛不敢说呢？,21,116,1,2022-08-17 13:18:23,来自广东,58810791341,狂潮中的小虾米
7132615888406299404,啥子车？提醒一下后面的购买人。,2,3,0,2022-08-17 07:14:47,来自四川,75724366435,千里岷山
7132725834070098723,这么多比亚迪自燃，居然还卖这么好,1,16,0,2022-08-17 14:19:57,来自浙江,18688255698,寸头不老
7132721365794505486,如果一周内没有新能源自燃，说明已经进步了[呲牙],5,51,1,2022-08-17 14:03:21,来自海南,6680951785,美食小胖胖OTG
7132711952019276585,车子里放了鞭炮起火的！,1,7,0,2022-08-17 13:26:15,来自湖南,99121761001,河里的鱼少了
7132734332204679974,这是真车主吗？要是还能有心思拍视频![吃瓜群众],2,2,0,2022-08-17 14:54:04,来自北京,102032230177,谁说都可以666
7132712080687891237,现在厂家免费送给这位车主“新能源”，他都不会要,1,43,1,2022-08-17 13:27:19,来自河北,3145275957,撒欢的Jimmy
7132732505517802252,国内的新能源车，不就是锂电池电动车吗？是新能源吗？根据能量守恒定律，生产电池也会污染环境，开发生产电池的材料更是污染环境，电池使用最多10电，处理报废的电池和电池遗留物更是污染环境，电池是多重污染，而且是持续和长久的，我不懂尾气排放怎么会比电池污染的严重了？,5,12,0,2022-08-17 14:46:47,来自北京,307483626969688,zhaoyipei
7132709204443939592,自燃之王比亚迪,11,232,6,2022-08-17 13:15:58,来自山东,518596291731304,抖音男神在头条
7132717080478302983,不知大家现在发现没有，同样的车，如果是燃油车 ，就只能卖十多万，改成电动车了就成三四十万了，我觉得多出的这二十多万拿来买油我估计也能开到车子报废,18,114,1,2022-08-17 13:46:41,来自四川,2972713687203581,海中水
7132744796887794465,比亚迪自燃车主都是下来拍视频的，特斯拉要不去找乔布斯报道，要不就要勇士拔刀相助扯出来,0,5,0,2022-08-17 15:34:26,来自广东,100240062398,不爱听当我没说
7132715884695012104,新能源汽车企业应该成立个消防公积金基金，多少消防警力都用在灭火上了！,1,14,0,2022-08-17 13:42:05,来自广东,53253429744,博扬曼巴
7132738625720238880,来嘛，我来给你们说，这是比亚迪汉ev千山翠限量版，这个三天烧了对吧？赔一辆新车的钱外加5个w。具体原因谁都还不能下结论，我是车主，我希望我的车燃起来，我也想赚钱,2,1,0,2022-08-17 15:10:17,来自重庆,4371961977,YiCollector
7132716245169865513,深圳出租车都是用磷酸铁锂电池的，保有量那么大，没听过起火的，这事吧我觉得有点诡异,10,29,4,2022-08-17 13:42:51,来自广东,654950627550924,一两点雪
7132712253027336963,新能源汽车应该配置自动灭火装置和自连火警报警功能，厂家应该好好考虑研发一下了！,3,9,0,2022-08-17 13:28:07,来自江苏,58149940659,昱达达
7132717541285217057,不可能是车的问题，王传福说刀片电池不可能自燃，肯定是司机操作失误。,12,62,3,2022-08-17 13:48:41,来自湖南,4059000743931523,格格山父
7132718427357807400,七天无理由自燃,1,57,0,2022-08-17 13:51:26,来自广西,562589004248094,羊三鹤
7132709520627090187,停车场停车离新能源远点，人家赔新车赔钱[看],16,103,2,2022-08-17 13:17:28,来自山东,85270294898,子煜图图
7132739939485664003,不是说比亚迪的刀片电池安全性能是最高的吗,0,1,0,2022-08-17 15:15:49,来自湖北,79973086005,絔合兲稥
7132718315713561355,每年燃油车自然还少吗？为什么新能源车只要有一辆着火了全国人民都知道了,24,18,3,2022-08-17 13:51:33,来自安徽,1323452729918632,樟杨趣闻
7132717249349518080,比亚迪自燃，换新车，还是高一档的，特斯拉，不管怎么燃，不论死活都是车主操作不当,1,11,1,2022-08-17 13:46:47,来自山东,4037006840047768,苦中作乐人上人
7132691061352219407,比亚迪汉千山翠，我是阆中人，我看到过现场,0,11,0,2022-08-17 12:04:57,来自四川,56349865621,你在哪里158573263
7132724336317989672,看这样子是车内打火机着了,3,15,0,2022-08-17 14:14:14,来自北京,5526427194,安逸菠萝sa
7132718656886817539,[泪奔]又是特斯拉，太可怕了，比亚迪不好吗？国外的月亮还圆不圆？[大笑],3,3,0,2022-08-17 13:53:11,来自广东,106225725237,热情星星mz
7132734789442437922,电池车果然是好车，车主过2天再提2辆[呲牙][呲牙][呲牙][呲牙],1,1,0,2022-08-17 14:55:02,来自浙江,62698958128,五里桥古柳
7132694176109527842,打火机，喷雾不能往车里放。温度太高了。,31,43,8,2022-08-17 12:17:01,来自四川,6268875464,白痴二号
7132713319760446238,珍爱生命远离电动车,1,6,0,2022-08-17 13:31:56,来自陕西,52551336042,阳光138523014
7132723186520589071,重庆的滴滴最多就是秦、长安逸动、吉利很少听说过有燃的，汉是个停车场就有，从没听说过有燃的，这个人站的位置都感觉他不像是车主，到像是摆拍,3,4,1,2022-08-17 14:09:46,来自重庆,50336174535,你好男嘉宾
7132709884860334883,多半是打火机，别个车子都是经过高温检测过，车子本身燃烧可能性很低,17,25,4,2022-08-17 13:18:07,来自四川,5786575812,红色军团-1949
7132620538384204558,如果是电动车不能在高温下暴晒容易火,2,3,0,2022-08-17 07:32:11,来自四川,97464474574,天上都有我的脚印
7132742792937259815,比亚迪没有因为自燃送走任何一位车主，这就是技术[社会社会],0,0,0,2022-08-17 15:26:31,来自广东,100240062398,不爱听当我没说
7132530534664323843,比亚迪汉千山翠的。不知道什么原因我路过的时候正在冒烟，说实话比亚迪真的不应该。,1,0,0,2022-08-17 01:50:17,来自四川,149984441279392,盖好被被
7132723479862461199,电动车包括电动汽车自燃，肯定还是电池不过关。,2,5,0,2022-08-17 14:11:05,来自四川,5924740818,淡淡的xi烟
7132695120164111142,自燃的车，是啥品牌的？,24,10,1,2022-08-17 12:21:35,来自四川,104062103071,老曾家的姥爷
7132711169558577953,国产新能源就一大坑！还是我只用进口燃油车,4,25,10,2022-08-17 13:23:31,来自广东,80082389887,富商史耀潜
7132726990431814400,这次看特斯拉咋解释，难道又是车主操作失误？,8,12,2,2022-08-17 14:24:39,来自四川,5924765893,酷酷的汤
7132703797830484744,还是新能源好，说烧就烧[小鼓掌],3,69,1,2022-08-17 12:54:50,来自四川,2489755059619839,无痕玻璃修复师
7132694110284612366,是不是燃油车，或天燃气车，电瓶车，保证没事。。。。。,1,1,0,2022-08-17 12:17:22,来自湖北,105014188192,梦回西藏彬
7132734764590809895,网上太多比亚迪自燃事件了，但爱国人士不相信啊,0,8,1,2022-08-17 14:55:30,来自湖北,1072732770140975,缤纷圆月W8
7132711307400921892,比亚迪不是用的刀片电池，怎么也着火了,10,12,2,2022-08-17 13:24:22,来自四川,50653678300,风趣梦想E
7132701014477505313,官方赔偿吗？,3,0,0,2022-08-17 12:44:01,来自四川,7586667640,董仙僧123
7132741825156694797,这一段几乎天天看到新能源起火的新闻,0,0,0,2022-08-17 15:22:51,来自河南,6901020768,雨在风中1
7132719080427340581,"由于新能源车近两年发展过快处于风口浪尖，所以自燃事件受到了广泛关注。任何新兴事物的发展都需要事件去探索，也希望消费者能够客观地看待新能源车“自燃”情况。
从公安部门的统计数据看，新能源车的自燃概率要比燃油车低很多，2020年的数据是万分之0.26，而燃油车的概率是万分之一到万分之二，比电动车高。
可能电池自燃更受关注，放大了危险系数。",8,5,5,2022-08-17 13:54:17,来自四川,3820048583,西蜀商贸人
7132709065025225504,"车主能有几多愁！
新车烧毁在街头！",0,37,0,2022-08-17 13:15:39,来自广东,50300282848,忠义双全
7132732124801286952,车内起火，要问下车主，车里放了什么？也要彻底调查下怎么回事！,0,6,1,2022-08-17 14:44:41,来自四川,99554516629,苍凉如斯
7132721919803130624,很多新能源车主不是很坚定地怼燃油车主吗,1,17,0,2022-08-17 14:04:48,来自四川,102174288398,说啥哟
7132730452641153824,只见自燃，从没见过调查结果披露，为什么？,0,1,0,2022-08-17 14:38:57,来自新疆,6880119687,高冷苹果IW
7132736487653311267,为什么比亚迪撞了不起火，反而停着会自然，到底是电控问题还是电池问题，还是什么别的原因，希望厂家调查清楚，我也是汉的车主,1,1,0,2022-08-17 15:01:34,来自江苏,1490586869172632,简单饼干rS
7132739385124258592,没人分析原因吗？同样的标准生产的为何有的会自燃呢？有高手解析没,0,0,0,2022-08-17 15:13:22,来自湖南,1842381597453006,爱币2022510
7132742183567819560,电车那么贵还危险真不如燃油车，要不是限牌，有多少人会买电动车,0,0,0,2022-08-17 15:23:25,来自广东,3007914935848112,弗朗西丝7K6
7132725091942728455,新车就燃了 太危险了 还是30多万的车byd厉害,0,2,0,2022-08-17 14:17:34,来自山西,2717645920803710,高冷山雀48
7132722436340269865,比亚迪汉，新款，刀片电池[捂脸][捂脸],1,3,0,2022-08-17 14:06:53,来自上海,105200759390,聪明的扑克A5
7132723177012527879,没可能，比亚迪不会自燃的！肯定搞错了,0,7,0,2022-08-17 14:10:19,来自广东,107782743559,朴实白云xM
7132738638101955363,国家鼓励新能源车，经常自燃爆炸谁负责,0,1,0,2022-08-17 15:09:45,来自四川,51323835690,趋势为王11
7132739561402762019,"新能源车着火原因:
没有给电池加降温系统，
一电池盒要有进风口，出风口。
二车带空调冷风围绕电池加循环冷凝管，
三电池温度高温自动警报系统。",0,0,0,2022-08-17 15:13:23,来自四川,94839008408,折月煮酒论英雄
7132711634724422441,说好的只冒烟，不起火[捂脸],0,26,0,2022-08-17 13:25:05,来自陕西,2752791877257598,博学漫步
7132736930080473887,电车成天着火，就不应该上路,0,0,0,2022-08-17 15:03:33,来自山东,3765315952,烟尘里的回忆
7132649939674727205,多做好事说说是什么车，我们买车也注意一下。,1,1,0,2022-08-17 09:25:59,来自四川,110650135241,曾经的烈火英雄LI
7132714426272449315,新能源好，自燃都不用自己打火,0,10,0,2022-08-17 13:35:46,来自四川,3188214523764318,深根毛竹
7132730540553257739,比亚迪终究是垃圾车，北汽极狐汽车至今没有车主投诉，更没有自燃，中国最安全的车,0,0,0,2022-08-17 14:38:58,来自浙江,6241518811,徐霞客
7132707979366892291,不说就是特拉斯吧,2,14,0,2022-08-17 13:11:14,来自四川,109965413962,高领资本
7132700946824020775,车内打火机燃了，气温太高不能把打火机及空气清新剂放车里了,7,16,5,2022-08-17 12:44:08,来自四川,111221459318,平心而论666
7132734492082438946,一夜间遍地新能源车，真不知他们的技术各方面达标没，换个名目价格涨高很多。,0,4,0,2022-08-17 14:53:35,来自重庆,5900493861,冬儿70756867
7132736280131191559,不是新能源，只是电动车。不要黑比亚迪啊！哪个车保证不会自燃呢？,0,0,0,2022-08-17 15:01:01,来自北京,86729875010,什么都超越
7132739721654420239,车主请稍安勿躁，水军一会到场喷水灭火,0,0,0,2022-08-17 15:13:59,来自浙江,4186967237,一袋米扛六楼
7132736937181692706,隔三差五看到特斯拉.汉起火视频，刀片电池安全吗？,0,0,0,2022-08-17 15:03:14,来自湖南,61285082433,回雁峰的风
7132740084646003493,太热，燃油车也时有自燃现象。,0,0,0,2022-08-17 15:15:47,来自陕西,105068455787,假沧海
7132736892017689374,电车自燃这么频繁，怎么不见油车自燃啊,0,0,0,2022-08-17 15:03:45,来自广东,149165343517245,清火的
7132742252430082816,是电池，短路，过流都有自燃的风险。,0,0,0,2022-08-17 15:23:50,来自安徽,5522689764,轻轻松松的歌
7132745141063844649,我不是幸灾乐祸，只是想让那些说油车这不好那不好的喷子出来看看。当然，油车也有自燃的，不过比例比电车少太多了。,0,0,0,2022-08-17 15:34:52,来自广东,4243750265294616,直率的渝
7132735494672204544,自燃一定是车子问题吗？不一定吧？,0,1,0,2022-08-17 14:57:33,来自福建,61992640748,热线666
7132700744234468103,磷酸铁锂不会燃烧[捂脸],2,15,1,2022-08-17 12:42:52,来自四川,686541981098616,虫虫儿想飞
7132713069041992489,burn your dreams 燃烧你的梦,5,60,1,2022-08-17 13:30:35,来自广东,3668902478,汽车小王子KK
7132736177048240937,前段时间广西贵港市的那辆唐DM公路上自燃的报道，没有后续了吗[what],0,1,0,2022-08-17 15:00:25,来自广西,3498446175,同学你好请问
7132737626666894115,太原的比亚迪电动出租车多少年了也没有见有自燃的！,0,0,0,2022-08-17 15:05:58,来自山西,377834992309870,绿水青山晴空万里
7132737381148492584,@比亚迪汉被曝上牌仅3天自燃,0,1,0,2022-08-17 15:08:49,来自广东,50051673701,Hoo先生
7132734481710318373,电动车就不应该上路,0,0,0,2022-08-17 14:54:04,来自广东,52694287973,zhonghualong68
7132744045914555151,接二连三，新能源汽车的弊端,0,1,0,2022-08-17 15:30:47,来自江苏,5436989164,闲庭信步66
7132728433280959232,刀片电池＝自燃,0,3,0,2022-08-17 14:30:13,来自辽宁,4240193090498611,雀硬
7132733342054613795,这种事情我是不会相信的，肯定有水军背后有竞争对手在搞鬼[灵光一闪],1,1,0,2022-08-17 14:48:59,来自广东,107669716193,翁子544
7132714414952235783,新能源车不解决自燃的问题的话，今后谁还敢买？,0,4,0,2022-08-17 13:36:12,来自重庆,405050348018491,悦箬
7132713981441458948,国产车就叫新能源，进口车就叫特斯拉[捂脸],0,26,1,2022-08-17 13:35:02,来自安徽,4417714978,QQ九五二七
7132740848869458703,听说过几起燃油车自燃的？,0,0,0,2022-08-17 15:18:25,来自广东,6614104645,川东小兵
7132733757198549800,有人说燃油车也有自燃的，但是电动车自燃要比燃油车猛烈迅速得多，而且通常是在座舱下边，留给人逃生的时间非常短。,0,0,0,2022-08-17 14:50:41,来自北京,15526660290,液体海底
7132738754951136011,四川的高温，热得车都受不了自杀了,0,0,0,2022-08-17 15:11:06,来自四川,3606839405062323,天马流星
7132717947960771343,新能源车燃烧属于爆燃，一般人反应不过来，这得配弹射座椅。,0,3,0,2022-08-17 13:49:25,来自陕西,2748411769529773,侠道列车
7132737160465548066,目前电车自燃比燃油车高多了,0,0,0,2022-08-17 15:04:08,来自四川,51055768780,律水亲山
7132721224693924608,四轮电瓶车为啥叫新能源电动车？,0,3,0,2022-08-17 14:02:12,来自四川,6848996359,你是老四吗
7132703762208736035,开电动汽车有两个注意点，一是不能暴晒，二是不能碰撞。,3,5,1,2022-08-17 12:54:27,来自四川,92768097445,Pauly
7132697184805815053,这个高温下，电动车确实要注意哦。,2,5,1,2022-08-17 12:29:04,来自四川,6994714180,龙门侠影
7132735090987303694,搜了一下，这个自称车主的确实不是车主！具体等公布吧！,0,0,0,2022-08-17 14:56:20,来自四川,4731627449,该叫撒子名字好哎
7132727236116923166,比亚迪不可能自燃！,0,2,0,2022-08-17 14:25:50,来自四川,3484287591,zuilong
7132708874842719010,其实只要不晒太阳的这个车子还是非常安全的。,3,1,0,2022-08-17 13:14:10,来自四川,100051756458,星河40066
7132739361736786722,应详细调查自燃的原因……,0,0,0,2022-08-17 15:12:32,来自广西,1499359979273933,非凡海风wg
7132738597044241152,这个夏天 比亚迪烧得有点多、不是说刀片状的电池封装最安装不起火吗？,0,1,0,2022-08-17 15:09:49,来自四川,50043503817,曾经不完全是曾经
7132733771623351081,比亚迪起火太频繁，品控堪忧,0,2,0,2022-08-17 14:51:01,来自福建,2309396826432903,聪慧的电子工程师
7132734659779576611,王传福说比亚迪汉不会自燃，但是没有说比亚迪汉不会着火🔥[捂脸][捂脸],0,0,0,2022-08-17 14:54:19,来自广东,2453737660757160,一根烟吐O
7132740389731107598,不管什么原因，都是你车主的毛病，车和厂家一点儿责任没有。,0,1,0,2022-08-17 15:16:55,来自河北,57378931039,果然不错53003
7132742788911121187,刀片电池也无法，该燃还得燃。安全电池就是一个神话，没有什么电池是绝对安全的，刀片电池被神话了。,0,0,0,2022-08-17 15:25:52,来自贵州,3350901795342094,烟雨江南一YYJN
7132733798638682895,最近比亚迪自燃好像有点多哦。,0,0,0,2022-08-17 14:51:06,来自江苏,62972401039,老牛吃甘蔗
7132743232810746637,特斯拉自燃就会说明品牌，其他品牌的车自燃就是“一新能源轿车”,0,0,0,2022-08-17 15:27:57,来自四川,3847939527556078,智慧水滴Z
7132712933116674828,电瓶车在高温下有自燃隐患！,0,4,0,2022-08-17 13:30:32,来自四川,3724790886826920,賨州居士
7132709543334757154,欢迎大家评论区，留下你们的观点。喜欢的朋友点点赞[灵光一闪][灵光一闪],0,1,0,2022-08-17 13:16:40,来自广东,902070073043517,陈乄默
7132740066375631646,电动小汽车失火，这个是很可能的，不管是国产的，还是进口的，都有一定的可能性。虽然比例不是很大，但是对购车的个人来说，就是百分之百了吧！传统的小汽车失火只存在于老旧车辆上。,0,0,0,2022-08-17 15:15:48,来自湖北,6999397079,童言无忌34
7132721825687110412,着电瓶车然火了，不好扑灭啊，一直燃烧,0,1,0,2022-08-17 14:05:07,来自四川,2352587889720439,ojpa叻
7132723571721372431,正常，总有这样的事情发生。就跟奔驰漏机油一样，雷克萨斯自燃的也不少，帕杰罗里的刹车出问题，还有大众断轴的，法拉利都有自燃的，这种事情太多了,0,1,0,2022-08-17 14:11:12,来自宁夏,59108477784,俊159418146
7132696168660353806,比亚迪20万以下的基本属于垃圾车，太危险了,13,13,1,2022-08-17 12:25:18,来自上海,15033312701,浦江飞云
7132737089434862348,我们小区那么多国产各品牌新能源电车，也没见哪辆车有问题。,0,0,0,2022-08-17 15:04:32,来自广西,3357383044,国际吹牛比赛三冠王
7132741077194834729,本来比亚迪可能会赔钱，你一曝光他们肯定会推卸责任的。,0,0,0,2022-08-17 15:19:21,来自湖北,98691254429,WH心态要好
7132738288725148429,[吃瓜群众]凡自燃而不报车企的我自动认定特斯拉。,0,0,0,2022-08-17 15:09:01,来自重庆,4043966798,三月树歌
7132739859055854376,稍有点常识的人都知道“发生火灾后，首先切断电源”，故电动车易燃，一旦电源短路容易起火，火借电势迅猛燃烧就不奇怪了[我想静静][我想静静],0,0,0,2022-08-17 15:14:34,来自重庆,6510707221,博爱93262391
7132722077110387460,自燃王，太多了,0,2,0,2022-08-17 14:06:00,来自福建,99718747086,阿巴尼古
7132735956222034695,至少说明刀片电池🔋单独破坏实验不起火，与装配在车辆里安全是另一回事。单独看都不错啊！,0,1,0,2022-08-17 14:59:51,来自天津,95914493184,js8760
7132739070748853032,用不着这么讽刺，汽油车也有自燃的，如果自燃率很高，那再说,0,0,0,2022-08-17 15:11:28,来自江苏,4642880514,落寞的绵羊
7132741082110477071,温度太高了，车里有易燃物,0,0,0,2022-08-17 15:19:17,来自四川,8888156184,清风203073668
7132730822415352588,电瓶车电动车，不是新能源车！新在哪儿了？,0,1,0,2022-08-17 14:40:26,来自重庆,4416951257,三棵树与二道湾
7132725860327228195,除了国产新能源汽车没烧过，其他进口品牌全烧了,0,1,0,2022-08-17 14:20:23,来自浙江,985611649155515,梦幻星球f9
7132728778937238312,又火了[what] 5.1期间订了Tdmi幸亏已退订。每个月都看到自燃太可怕。人没事就好。,0,0,0,2022-08-17 14:31:28,来自广东,4675247581,牛X传奇
7132741640057815821,四川这几天太热了，买电动车开真是自找麻烦,0,0,0,2022-08-17 15:21:52,来自广西,93578433822,桂E四眼
7132735958071886628,自燃之王电动车,0,0,0,2022-08-17 14:59:51,来自山东,72078559259,手机数码测试大神
7132741393026073376,特斯拉汉，我大比亚迪从来不起火！,0,0,0,2022-08-17 15:21:21,来自广东,99246364124,专注开慢车
7132715530930373410,才从一个车主拍比亚迪自燃的新闻出来就看到这条新闻，不得不说比亚迪真牛逼,0,5,0,2022-08-17 13:40:03,来自四川,52253009577,青凋牧92
7132737647117665065,三天是个什么概念，出名了,0,1,0,2022-08-17 15:09:39,来自河北,3052676966515528,有故事的生活
7132730980023943966,半夜在地下停车场起火了咋办,0,1,0,2022-08-17 14:40:25,来自江苏,51002028045,剪爱OfGn
7132733420899287820,新能源车都一鸟样，设计要是不完善有缺陷的话容易着火很正常。尽早找出问题所在。,0,0,0,2022-08-17 14:50:16,来自广东,65546875123,无恙旅行
7132738901264859944,4S店，这不赔，那不赔，保险公司，这不对，那不对，厂家，这违规了，那违规了，车主[捂脸][捂脸][捂脸][捂脸],0,0,0,2022-08-17 15:10:35,来自山东,103812019277,诗意雪梨j4
7132731545894568745,商家说此次事件是车主操作不当造成的，跟车子质量没关系,0,1,1,2022-08-17 14:42:18,来自四川,98088756139,浪浪迹余生
7132746246607192839,官方媒体请用词准确点，这是电瓶车，不是什么新能源[灵光一闪],0,0,0,2022-08-17 15:39:47,来自四川,108315113729,三杯浊酒敬红尘
7132721842007540521,比亚迪汉？不是说磷酸铁锂电池不起火吗？,0,1,0,2022-08-17 14:04:38,来自广东,55160716766,大乘寺
7132745157044814599,油车停下来是不会起火的。,0,0,0,2022-08-17 15:35:41,来自湖南,343474478001086,天马行空1970
7132732011021730594,这人长的这么个性，不像是车主,0,0,0,2022-08-17 14:43:59,来自山东,93245822168,Crystal281137421
7132725911401202447,新能源太火了！七天就着了。。。。,0,1,0,2022-08-17 14:20:34,来自北京,5171675913,第二名也无所谓
7132734642331534117,估计车里放了空气清新剂一类的压力罐,0,1,0,2022-08-17 14:54:57,来自辽宁,5384170854,悦老锐哥
7132650052723458830,最初有个视频，好像是什么迪,2,4,0,2022-08-17 09:26:17,来自西藏,4177771219400816,乐天派雪域少年
7132729635422618400,川渝这段时间新能源车要小心,0,0,0,2022-08-17 14:35:28,来自四川,111538971552,悠闲宜生
7132722758911918888,汗😓啊！这下没得话了吧。还是油车好点。新能源车估计再过十年可能才能完全成熟！,0,0,0,2022-08-17 14:08:12,来自四川,4111780564959896,区元数NFT
7132731654854574862,购买七天，上牌三天😄,0,2,0,2022-08-17 14:43:18,来自山东,3541104469,开飞机制燕子
