7132729157485921039,目前自燃得基本都是混动版 对否,0,1,0,2022-08-17 14:33:02,来自上海,11575325108,沪弄天下
7132730197264302888,电池车也太不安全啰。,0,0,0,2022-08-17 14:37:09,来自广东,6754320846,金瓜米
7132739797399290665,很好！佩服车主的勇气，差点就一步登天了！,0,0,0,2022-08-17 15:14:12,来自山东,25939301546,随性自由的溪流Ea
7132725679405662990,打火机放车上了，发生爆炸起🔥,0,2,0,2022-08-17 14:20:04,来自四川,6074566681,兵临城下78131187
7132731002249773855,比亚迪自燃了，自燃就自燃呗，用不着遮遮掩掩的，很正常,0,0,0,2022-08-17 14:40:19,来自浙江,73884371993,杭州小不点
7132738411245093663,上次蔚来撞了一下也没起火，这车咋好好的就着了？,0,0,0,2022-08-17 15:09:37,来自上海,104723866732,清闲的喜鹊V
7132736745376514824,比亚迪需要给出调查结果给自己一个高度负责,0,0,0,2022-08-17 15:03:05,来自山东,3061474337233563,山东老张爱电影
7132731171091333903,电车自燃，是有很多人为原因的，比如非法线路改装，车内放易燃易爆炸物品！,0,0,0,2022-08-17 14:40:40,来自广东,56216413211,豁达如鱼得水
7132737823693800224,关键是什么原因导致的自燃，这个要尽快调查发布,0,0,0,2022-08-17 15:07:18,来自河南,2040306500901278,percyY
7132737358184694542,电瓶车不可能自然！不可能！绝不可能！我买燃油车一直在后悔！燃油车不能弯道超车，超了是违章；电瓶车现在已经实现弯道超车了！真的后悔……,0,0,0,2022-08-17 15:05:03,来自重庆,857214104647844,独行哥
7132732422915179305,高温对于新能源车极不友好,0,0,0,2022-08-17 14:45:40,来自贵州,1600496481090701,帅帅得小武哥
7132722953892348713,电瓶车怎么叫新能源车的？,0,0,0,2022-08-17 14:08:59,来自四川,5843384813,老子SL
7132743656875901737,新能源车？捡回条命算走运了。,0,0,0,2022-08-17 15:29:11,来自广东,6174532451,DQQ47
7132710528094765837,是什么车请明确，为消费者提供买车决策。,9,8,1,2022-08-17 13:21:10,来自四川,1059564168952707,海阔天空逍遥王子
7132738320521872163,开新能源汽车千万不要系安全带，否则后果很严重。,0,0,0,2022-08-17 15:08:34,来自辽宁,3716801212724983,善良暖阳2z
7132733190292538151,看来新能源车的安全性还有待提高啊。,0,0,0,2022-08-17 14:49:24,来自辽宁,5475819886,灯神阿拉
7132739296590824195,气温太高了吗？,0,0,0,2022-08-17 15:13:04,来自湖北,101282083039,然旭然可
7132736966252299038,新能源电动汽车给环保带来了最大贡献！灾难还在后面。,0,0,0,2022-08-17 15:03:44,来自四川,63527272039,爱在路上65
7132726634850960132,国家应该统计自燃车事故原因 然后公布,0,0,0,2022-08-17 14:23:49,来自四川,101677785207,爱我有为中华
7132716015465235241,又可以开新车了,0,2,0,2022-08-17 13:42:03,来自四川,109974539565,江白步道
7132738217098937095,刀片电池是不可能燃烧的，我看了比亚迪的穿刺视频，绝对是人为操作不当导致自燃的,0,0,0,2022-08-17 15:08:41,来自四川,104742199276,百年不遇的大变局
7132734144228492065,假设这要引发的大事故，火灾什么的，保险公司能赔不？,0,0,0,2022-08-17 14:53:21,来自四川,1947942304097228,首席退堂鼓演奏大师
7132725860326540067,今年的dream car自燃了不少啊，不是说刀片电池不会自燃吗？难道是欺骗我们的？,0,1,0,2022-08-17 14:20:09,来自四川,89940219074,l辛酸的浪漫l
7132722616519115555,比亚迪一步步把自己送上热搜！牛逼！[赞][赞],0,1,0,2022-08-17 14:07:45,来自广东,3240990421040019,难道糊涂一时
7132734697867789095,看照片不是地盘下面电池着火，到底什么原因，等待调查,0,0,0,2022-08-17 14:55:12,来自安徽,1134340676531630,聪明的星球cC
7132730077439214375,开在路上燃了。要是在停车场燃车主更闹心,0,0,0,2022-08-17 14:37:23,来自重庆,92825866936,喔丝袜梗
7132741313577091880,新能源车保费贵是有原因的[捂脸][捂脸],0,0,0,2022-08-17 15:20:09,来自湖南,64960473236,A水木繁华
7132727708756411169,线路短路起火可能性要大些。,0,0,0,2022-08-17 14:28:00,来自四川,60275580758,风雨独钓寒江雪
7132736255850906375,新能源的电瓶车,0,0,0,2022-08-17 15:01:18,来自江苏,4344918567820512,用户619335255359龙游
7132717966210433824,肯定是车主自身原因造成的，比亚迪怎么会自燃呢？一定是车主的问题！！[捂脸][捂脸][捂脸],0,0,0,2022-08-17 13:50:14,来自四川,4454862813148147,喷天喷地喷鬼神
7132707407737783052,BYD是刀片电池不会着火，只会自燃……[大笑][大笑][大笑],0,3,0,2022-08-17 13:09:09,来自浙江,1750866819290848,顶级喜鹊Cc
7132737682719441698,好像国外都叫电车，就中国官方给起的高大上的名字：新能源车，还弯道超车[泪奔],0,0,0,2022-08-17 15:06:00,来自安徽,54945513889,光仔148029375
7132736336255664930,一堆电池，驱动时候电流大，易发热，起火几率高,0,0,0,2022-08-17 15:00:59,来自广东,62098512263,完美河流q7
7132729135382151969,不幸中的万幸，一是车内无人二是近旁无车更无商铺！,0,1,0,2022-08-17 14:33:49,来自山东,56151392112,鲁石A
7132699393891058446,电池在高温下存在自燃风险,0,3,0,2022-08-17 12:37:39,来自四川,53518457656,追求自由随性
7132737845592802086,我是20年之内绝对不买新能源电车,0,0,0,2022-08-17 15:07:35,来自四川,98202646775,巴蜀辣弟
7132724618179117860,个人觉得新能源车的技术还是有异常大的提升空间！,0,0,0,2022-08-17 14:15:34,来自贵州,3079835260,路人甲齐天大剩
7132727686275040036,比亚迪前面是公关做的好啊，那么多起火都没怎么见报道,0,1,0,2022-08-17 14:27:36,来自浙江,96627493221,薛定谔猫的shi咖啡
7132698978876998435,是啥车，应该说明,11,5,1,2022-08-17 12:35:34,来自四川,6802447289,怀揣梦想的胡礼金
7132736147545490210,新能源车太可怕啦,0,0,0,2022-08-17 15:00:17,来自湖北,2748431868629116,新能源手机
7132725399213130533,调查一下起火原因吧，然后针对性解决后续问题，一步一步来,0,0,0,2022-08-17 14:18:42,来自四川,58562433913,皓月悬天冷千山
7132725497289081613,不像是电池短路，如果是不知道烧成啥样了，可能打火机爆了。静候调查结果,0,0,0,2022-08-17 14:19:21,来自广东,98662902398,龙哥哥7266
7132732684526404364,新能源车安全这一块应该引起重视,0,0,0,2022-08-17 14:47:24,来自缅甸,1126338993589531,森林运动不止
7132737731217605387,特斯拉掉个螺丝全国都知道，比亚迪烧十个没人知,0,0,0,2022-08-17 15:06:49,来自浙江,52059768041,俞铭赫豆豆
7132731581034726185,比亚迪车现在真是不行，质量非常差。为了赚暴力加快生产，质量严重下滑，这样罔顾消费者利益，罔顾老百姓生命财产安全。应该严查,0,1,0,2022-08-17 14:42:30,来自广东,96677753001,智者生活家zu
7132739555199402787,这不是车吧？这分明是装了轮子的棺材,0,0,0,2022-08-17 15:13:21,来自广东,2023521565023246,夜风扰人
7132723424597738271,天气炎热，小心着火🔥,0,2,0,2022-08-17 14:11:04,来自四川,193112417781175,雲霄之爱
7132725996486902563,小区一工程部租房的买了一辆比亚迪 现在都停的离他远远的。,0,0,0,2022-08-17 14:20:59,来自四川,6729304314,银麟科技
7132717200246522632,这要是在发生地下车库，后果不堪设想[灵光一闪],0,2,0,2022-08-17 13:46:54,来自四川,50630162133,强胜将君
7132722121855320866,电动车为什么非要叫新能源车！,0,0,0,2022-08-17 14:05:34,来自四川,6369441186,可靠致虚守静
7132736666640974606,2.5排量跑10万公里的排放也不如这个着火10分钟污染大吧？,0,0,0,2022-08-17 15:02:43,来自北京,3628036432339115,隔壁王大爷的隔壁
7132725161455223555,还是新能源好，说烧就烧[鼓掌][鼓掌],0,0,0,2022-08-17 14:18:21,来自宁夏,364663630212836,秋天的玉树
7132714492466660131,船夫哥：刀片电池，把自燃从新能源字典中移除！,0,0,0,2022-08-17 13:35:54,来自四川,105151205840,绵阳打工人
7132732895386944270,不是说刀片电池不起火么？,0,0,0,2022-08-17 14:48:05,来自广东,52856792126,走向平凡
7132717971956433679,也有可能车内放了什么易燃物，什么打火机之类的,0,1,0,2022-08-17 13:49:30,来自四川,84550110194,shun99960
7132729937551229710,注意车主录视频的最后一个动作配表情！！唉！万恶的资本家。,0,0,0,2022-08-17 14:36:38,来自广东,3068613591,木次方家居
7132738739129860878,刚要下手买比亚迪混动 视频一放 年头打消,0,0,0,2022-08-17 15:10:24,来自江苏,21345228122,卿卿149406826
7132739612308669218,电池只要短路一定会起火燃烧 ，小概率事件。,0,0,0,2022-08-17 15:13:34,来自广东,51012531103,六月的风0616
7132742369791066914,比亚迪，我看了好多新闻都是比亚迪烧了，到底咋了[吐血],0,0,0,2022-08-17 15:24:16,来自江苏,1504553077313260,我們的約束
7132737528519508766,电动公交就不自然，自然的都是私家车，因为公交车没法放火,0,0,0,2022-08-17 15:05:47,来自江苏,92456244052,路过水果摊
7132731815114162985,现在算算成本，到底是电动车省钱？还是燃油车省钱？,0,0,0,2022-08-17 14:43:19,来自山东,58955689319,旭日东升203542996
7132738914384872226,不是特斯拉统称新能源[吃瓜群众],0,0,0,2022-08-17 15:10:50,来自浙江,81781227583,王德法克克
7132734745574310688,车主自拍视频了 提车7天 停路边自燃,0,0,0,2022-08-17 14:55:40,来自湖南,5503757958,清闲的清泉L
7132710319717597964,"车主能有几多愁！
新车烧毁在街头！",0,8,0,2022-08-17 13:20:45,来自广东,50300282848,忠义双全
7132692835077964577,比亚迪又火了,5,33,1,2022-08-17 12:12:41,来自四川,91989645723851,创想者时代
7132740026550813453,刚看到新闻，希望车企能自查自纠[赞],0,0,0,2022-08-17 15:15:35,来自甘肃,107974071180,绘画视界
7132741526588834600,新能源一碰到撞击，很多都是失火，不是一起两起了。换车我还是选燃油车。,0,0,0,2022-08-17 15:20:47,来自山东,78527776140,胶澳人家
7132699340468470531,特斯拉……汉，还是我们比亚迪安全,2,24,2,2022-08-17 12:37:49,来自四川,51040053353,充满元气的李大爷
7132737851271824167,这应该是四川比较高级的地段吧，马路那么好,0,1,0,2022-08-17 15:07:38,来自浙江,53885436882,dakaile
7132700996047979268,买西能源车是不是必须买自燃险！,2,3,1,2022-08-17 12:44:11,来自四川,50545692088,亚希伯恩强
7132723556823712527,刀片也自燃…,0,0,0,2022-08-17 14:11:22,来自浙江,53961134334,牛蛙一族
7132737702357025551,看，特斯拉-汉又着火了，肯定是刹车失灵造成的[白眼],0,0,0,2022-08-17 15:06:08,来自广东,3357832782,简单旭日XI
7132738740384088839,终于不是特斯拉了[捂脸][捂脸][捂脸],0,0,0,2022-08-17 15:10:35,来自陕西,110529937689,国强强国20
7132701476480615183,众所周知，新能源出事的新闻只有特斯拉和某新能源[狗头],0,1,0,2022-08-17 12:45:28,来自江苏,51669077591,安倍不拜鬼鬼才喷他
7132739071654920993,哎呀，燃油车又扳回一局，这车居然是B亚迪！,0,0,0,2022-08-17 15:12:31,来自广东,114761699954727,简单的南瓜头
7132740811351540483,烧了继续买 从哪里跌倒就从哪里爬起来[灵光一闪],1,1,0,2022-08-17 15:19:08,来自天津,56814423863,老吶谁也不爱
7132737378548138785,电动车起火燃烧太快太猛，逃生机会也就几秒钟！,0,0,0,2022-08-17 15:05:39,来自山东,52153821401,人间正道风雨彩虹
7132725303159374626,电动车。。。。果然电动吓人,0,0,0,2022-08-17 14:17:55,来自广东,9761026745,小來的工艺品珠宝盒
7132736893338813223,打火机起火,0,0,0,2022-08-17 15:03:56,来自四川,6677572825,为宝强加油66666666
7132734169067275041,新能源汽车现在本不靠谱，发展才多久？完全相信智能化本来就不是好现象。不老男神梦已破就是最好的认证。,0,0,0,2022-08-17 14:53:35,来自湖南,4797261251,农民工权益维护者
7132742741104296711,卖的多基数也大，没有100％良品率的，买什么感觉都是碰运气，看了大评测，电动汽车高温和严寒都是过不去的坎。,0,0,0,2022-08-17 15:26:11,来自山东,4429441066,人在旅途40574738
7132737745172448015,特斯拉果然危险,0,0,0,2022-08-17 15:06:19,来自陕西,70041723572,兜兜有糖
7132737220729160451,我最关心的车主死了没有,0,0,0,2022-08-17 15:05:16,来自广东,4275361731317795,殇訫侽朲
7132734274528199459,泰迪:肯定是车主恶意花几十万买车，又恶意纵火，就为了黑我大迪,0,2,0,2022-08-17 14:52:45,来自广东,501847111508820,来自南方的太史
7132736223012995880,着火不怕！人能逃出就万幸！,0,0,0,2022-08-17 15:00:17,来自天津,12688459912,秦汉唐宋明2
7132730365122298638,车里面起火，应该是放了香氛或打火机之类的，一暴晒着了的,0,0,0,2022-08-17 14:38:04,来自四川,1930337795456525,中国人中国心unzx
7132737491752649511,我现在对电动车也没有什么偏见，就是在默默的看着，等头几批车主使用到淘汰，看看弊端到底有多少，安全性和燃油车比较一下再做结论。,0,0,0,2022-08-17 15:06:25,来自北京,2176656224300931,抬头看监控
7132665057766949673,不想电池燃烧，像汽油,0,1,1,2022-08-17 10:24:21,来自江苏,2973539971636728,帅字当头
7132737668357735180,保险赔偿吗？[流泪],0,0,0,2022-08-17 15:06:37,来自河北,110500253147,保定市东海
7132734961081729799,不可能，是特斯拉[捂脸][捂脸]！你在车里放打火机了，，，我不信。。。为啥电动车没有碰撞测试，[泪奔][泪奔][泪奔],0,0,0,2022-08-17 14:56:03,来自陕西,3416985567,VC27
7132728958143251212,特斯拉又着火了？,0,1,0,2022-08-17 14:33:04,来自山东,3888314222390589,追风之箭
7132718206045127437,比亚迪公关部马上出场,0,3,0,2022-08-17 13:50:57,来自山东,6195554308,济宁老宋
7132738205258318592,有可能是友商出钱让一些车主想办法把车点燃,0,0,0,2022-08-17 15:08:09,来自广东,4278937855468846,随性自由的辰星t4
7132743055815738151,作为昨天刚订一台比亚迪汉的准车主，我浑身不舒服！,0,0,0,2022-08-17 15:27:50,来自陕西,63795494824,志博919
7132737267676316427,牛皮，不过这貌似是秦。刀片电池不是不会起火燃烧吗,0,0,0,2022-08-17 15:05:22,来自山东,106602285638,天之骄子3960
7132735645294134019,新能源汽车目前还是不成熟，慎买！,0,0,0,2022-08-17 14:58:49,来自陕西,3557904192,哈庫納瑪塔塔
7132725674003399435,电动车着火一律按特斯拉着火定？别问我为什么，因为我爱国。,0,0,0,2022-08-17 14:20:24,来自江苏,52114878235,ted1024
7132728838521619240,一看就知道电池没有自燃！,0,0,0,2022-08-17 14:31:47,来自黑龙江,105122942572,潇洒晚风qY
7132744999787496192,看火式向上冲，应该是电池原因，因为电池就在下面,0,0,0,2022-08-17 15:34:32,来自四川,104532770983,傲然清风697
7132729831204520704,跟电瓶车差不多,0,1,0,2022-08-17 14:35:36,来自四川,82110818291,马马灯儿er
7132745400272093993,这是概率问题，你遇见了，说明你走运[捂脸]重新换新车。,0,0,0,2022-08-17 15:35:55,来自广东,4532611046,Vlog大熊
7132741118424302377,又火了——电池车！[捂脸][捂脸][捂脸],0,0,0,2022-08-17 15:19:30,来自广西,3856737649299511,武陵hifi发烧友
7132725425339679524,自己点的，现在厂家为了平息舆论，一般会赔偿几倍的钱,0,0,0,2022-08-17 14:18:50,来自福建,74612701075,宁五德菱
7132725007930639143,爆燃几率大，瞬间释放能量越大破坏力越强。燃油转化为动力是循序渐进，功率可控。不容易出事故，出了事故破坏能力有限。电车爆燃需要100吨水才能冷却，而燃油车失火最多要5吨水就可以灭火。可能5年后整个国家都会后悔。为了减少爆燃造成的巨大伤害，其实可以把电池平均分为多个独立个体，任何一组出现问题自动脱离车体，车继续开到附近，车主慢条斯理下车看那个电池孤零零的燃烧是不是很有趣？,0,0,0,2022-08-17 14:17:42,来自四川,99546032439,Lvyuan00321
7132738578773377792,新能源车真不能买,0,0,0,2022-08-17 15:09:39,来自安徽,3702780142813584,爱生活的悠闲人
7132736539423294244,看到新闻标题我就知道不是特斯拉了,0,0,0,2022-08-17 15:02:03,来自天津,101519726797,我想婧婧007
7132739610962543395,还是以前的黄包车安全。,0,0,0,2022-08-17 15:13:35,来自重庆,11470370455,懂皇No1
7132735621944099624,新能源车不成熟啊[我想静静]我是不会买的,0,0,0,2022-08-17 14:57:55,来自北京,3870731051477597,四哥
7132700938905027362,新能源汽车必须要在各项安全技术上攻坚克难，要让消费者敢买敢用放心大胆地用,0,3,0,2022-08-17 12:43:21,来自四川,836107367362387,浮生若梦
7132726227227525892,说好的刀片电池不燃烧，不爆燃，原来也是卵的。[尬笑][鄙视][泪奔],0,0,0,2022-08-17 14:22:12,来自广东,51149460791,远山的呼唤146111633
7132729125030839043,@比亚迪汽车 需要你们的介入，澄清事实,0,0,0,2022-08-17 14:34:01,来自山东,2753626870397864,时来天地皆同力TL
7132726783048172302,新能源车，拉动内需…………,0,1,0,2022-08-17 14:24:03,来自宁夏,3332616993,刚刚的投资日记
7132744769587102505,比亚迪：室外温度过高导致，和车辆本事质量无关！,0,0,0,2022-08-17 15:33:36,来自北京,6253847002,成熟梦想YR
7132725549038371625,这个像是底部起火,0,0,0,2022-08-17 14:19:07,来自湖北,55184653253,一般般369
7132740294181323558,国内新能源车技术还不成熟。,0,0,0,2022-08-17 15:17:16,来自四川,4094199995833867,好奇东港
7132737378502099751,我的雅迪算不算新能源,0,0,0,2022-08-17 15:05:44,来自山东,93499894802,大大后
7132742055835124495,刀片电池也不安全，哎，没有安全的新能源车。,0,0,0,2022-08-17 15:23:19,来自贵州,3350901795342094,烟雨江南一YYJN
7132716540914615070,建议比亚迪设计一个慢烧模式，每天烧一点可以用来做饭烧开水，这样一次烧完太可惜了,0,1,0,2022-08-17 13:44:17,来自湖南,1301434302739031,格鱼笔记
7132732639005606696,去年本来想买腾势，价格都谈好了。发现不是奔驰生产的是比亚迪生产的。后来就不买了。买了一辆大众ID6，用过来感觉不错。外壳肯定比比亚迪好。,0,0,0,2022-08-17 14:46:31,来自浙江,52054735302,啊区
7132729665793835779,比亚迪说，这肯定是假新闻，肯定是他改装了，我的刀片不会自然,0,0,0,2022-08-17 14:35:55,来自广西,85017661727,123667890
7132724118621242126,比亚迪官方也不出来发话[狗头],0,0,0,2022-08-17 14:14:00,来自广西,100273687652,囧囧快乐326
7132739448475173673,以前的存货吧，现在的刀片电池不会迅速大火的,0,0,0,2022-08-17 15:12:56,来自河南,106126779549,嵩山道士
7132732757935588099,汉顶配版本，为了提高关注度配置了自动燃烧功能！,0,0,0,2022-08-17 14:48:04,来自四川,4424081421634687,eis028
7132734686354539264,没说出品牌的，肯定不是特斯拉[呲牙],0,0,0,2022-08-17 14:54:28,来自福建,100097236105,窗外风岭上月
7132726464864207647,特斯拉 你火了,0,0,0,2022-08-17 14:22:55,来自广东,4155450302,我是雷不死
7132737389314736936,还好人是安全的！,0,0,0,2022-08-17 15:04:50,来自上海,3861113059940109,立岑机械
7132726371037545247,车主称车也没有被暴晒过，刚出车库开出来就冒烟了。,0,1,0,2022-08-17 14:22:40,来自四川,12607596970,上帝思维
7132731509668643599,上次深圳那辆千山翠也是刚提没几天的新车。应该是出厂前电池没拿针刺过吧，刀片电池针刺过不着火。。。。[奸笑][奸笑][奸笑],0,0,0,2022-08-17 14:42:15,来自浙江,3465292274758711,尊酒莫相催
7132738261105083136,其实，电动车自燃比率都差不多，怪只怪比亚迪买得太多，显得都是它在燃[捂脸],0,0,0,2022-08-17 15:08:10,来自四川,51424037629,_131943313
7132720419337061128,国产车绝对是行业第一，不可能自燃,0,0,0,2022-08-17 13:59:25,来自四川,58799427639,瞟一眼就笑了
7132742439852966668,为了维护品牌形象，应该会给你全额退款赔偿吧。,0,0,0,2022-08-17 15:25:36,来自重庆,73073989552,细雨游风394
7132705162329850658,燃一赔三，恭喜你,0,26,0,2022-08-17 12:59:42,来自四川,1627931572,别扭丶
7132725423083225892,烧不烧无所谓，关键是省油钱就行。,0,0,0,2022-08-17 14:18:55,来自江苏,20797125274,打拳玩
7132735194700153613,新能源车成本低！,0,1,0,2022-08-17 14:56:59,来自湖南,50095775201,安康6161
7132723456042533667,才买7天，这种比亚迪赔不赔？,0,0,0,2022-08-17 14:10:51,来自贵州,77039537880,奇点inging
7132722472050492197,这会知道了是比亚迪汉，太可怕了，电动车安全性怎么这么差,0,0,0,2022-08-17 14:07:20,来自宁夏,92981561217,乐乐看人生
7132720309643526925,肯定是特斯拉！！国产车不会自燃！！！,0,1,2,2022-08-17 13:59:02,来自四川,58799427639,瞟一眼就笑了
7132740535001137951,最近某亚迪新闻有点多啊。。。,0,0,0,2022-08-17 15:17:32,来自四川,85985037687,Blues
7132735808255050496,四川种热带树木吗,0,0,0,2022-08-17 14:58:44,来自北京,50477560857,ALP3000
7132735430692848425,新能源车气温不能超过40度吗？,0,0,0,2022-08-17 14:57:26,来自四川,72068675847,正义凛然饼干ZJ
7132739177317335843,恭喜车主喜提新车，加赔偿,0,0,0,2022-08-17 15:11:51,来自四川,4558882079,只买地板
7132736059091911461,王传福肯定赔你一辆,0,0,0,2022-08-17 15:00:29,来自四川,6810147817,潇洒来生来世
7132738301332620073,有钱我宁愿买五菱神车，都不要新能源[发怒],0,0,0,2022-08-17 15:08:22,来自广西,9727518367,爆了4226278295
7132742413408011043,比亚迪汉，自燃爆出来太多了。,0,0,0,2022-08-17 15:24:31,来自重庆,3320181234079549,不坠青云之志XIAO
7132733750085190414,汉！36了….过分了,0,0,0,2022-08-17 14:51:10,来自四川,60850690362,996什么鬼
7132738533042832163,电动车技术还不成熟，大力推广是个错误。,0,0,0,2022-08-17 15:09:23,来自陕西,105151183656,冷风118
7132722112733037325,不可能，不可能是比亚迪的砍刀电池，比亚迪的砍刀电池是宇宙第一，101%是不会燃烧的，要么是车主原因、要么就是丰田代工的!,0,1,1,2022-08-17 14:06:06,来自四川,64550502319,想个别出心裁的用户名
7132724745769878304,还真不能挨着绿牌车停,0,0,0,2022-08-17 14:16:29,来自四川,3460648740,159753dYHp
7132733453878952737,好好调查下看看吧,0,0,0,2022-08-17 14:50:12,来自江苏,95028802070,安安静静做条咸鱼
7132730917528994560,充最慢的电，烧最旺的火。,0,0,0,2022-08-17 14:39:46,来自浙江,4039230608,苗岭佈依
7132732647499039529,哦，是比亚迪，大家散了吧，如果是特斯拉那才热闹那。[捂脸][捂脸][捂脸],0,0,0,2022-08-17 14:46:29,来自广东,1777282857057262,小狐
7132727013035148072,我靠又是比亚迪,0,0,0,2022-08-17 14:24:50,来自河南,104613051040,徐静伟217
7132737988140368677,特斯拉都烧了那么多辆！,0,1,0,2022-08-17 15:07:55,来自湖南,61146451324,飞过牛栏
7132736837348754216,谁说比亚迪不会着火,0,0,0,2022-08-17 15:02:50,来自福建,110894937103,君莫问1991
7132737665027687180,这是啥破车，烧成这样？,0,0,0,2022-08-17 15:06:55,来自四川,110664773071,士心丹206
7132735075913057062,比亚迪汉好火,0,0,0,2022-08-17 14:56:44,来自广东,110070157861,小志1254123
7132718401717879556,一看就是和油车燃烧样的，因为不是电池造成的燃烧，而是车内易燃易爆物品,0,0,1,2022-08-17 13:52:27,来自四川,3515026000,WdgWoX
7132736239417017125,比亚迪这几年太飘,0,0,0,2022-08-17 15:00:54,来自河南,51763029992,八十万橘猫总教头
7132745599795380996,比开始洗地了，打火机，什么的哈哈哈哈,0,0,0,2022-08-17 15:37:46,来自四川,55606791464,油爆批把
7132736291883844386,必须查清楚起火的原因,0,0,0,2022-08-17 15:00:38,来自安徽,96422524251,yaoxiang274
7132726849863811878,封面一辆白色rx5，我还以为是荣威火了呢[捂脸],0,0,0,2022-08-17 14:25:05,来自上海,6505257962,沪通南海
7132724815605039906,新能源挺能燃哦,0,0,0,2022-08-17 14:16:09,来自四川,6871165200,沧海一粟1170031
7132723930351076129,算了还是买燃油车吧！烧的莫名其妙,0,0,0,2022-08-17 14:13:22,来自湖北,685723931650011,李大爷湖北分爷
7132729617320477473,太危险了，购买需谨慎,0,0,0,2022-08-17 14:35:47,来自河北,2660447695677384,逍遥有言
7132722212917986082,别和高温联系到一起，车出厂前测试的温度比这个还苛刻，肯定是其他原因导致，但也可以肯定是质量问题,0,0,0,2022-08-17 14:06:04,来自广东,3761066413,蝎子25792816
7132745377346372390,天气热了不行冷了不行，看来燃油车还有机会,0,0,0,2022-08-17 15:36:52,来自浙江,3654378613117635,睿智橙子k
7132723237893145344,远离比亚迪，对自己负责，也对旁边的车负责[捂脸],0,1,0,2022-08-17 14:10:09,来自上海,3366432710,茨之海
7132716394659480328,纯电车，排除燃油系统着火,0,0,0,2022-08-17 13:43:55,来自山东,102939138962,风姿卓越小猫XG
7132741325329629987,一定是特斯拉汗！byd大刀电瓶是不会又爆又炸的。,0,1,0,2022-08-17 15:20:10,来自北京,60775102850,亲爱的朋友歌
