7132710280874099491,父母是孩子的第一任老师，孩子吵点可以体谅但是你要客气[抠鼻],0,0,0,2022-08-17 13:19:43,来自安徽,63636331163,老马27163
7132684213492777765,幸亏我家孩子只在家熊，是管不了那种熊，只要出门就很听话[捂脸],0,1,0,2022-08-17 11:38:50,来自江苏,2189883180585927,迪可溪
7132695752794768169,有什么爹妈就有什么小孩。,0,0,0,2022-08-17 12:23:07,来自云南,104818965981,才思敏捷的患得患失
7132688550713443084,管不了。就不要生呀,0,0,0,2022-08-17 11:55:54,来自新疆,79349106507,封存回忆157
7132705954491777796,我估计这孩子有这样的家长也教育不好了,0,1,0,2022-08-17 13:03:40,来自河北,4195360296416719,1234554321ii
7132686293658092301,"林子大了什么鸟都有，没有规矩的孩子，将来也会被社会法律管教的。
咱戴上耳机，等这娃子长大[翻白眼][抠鼻]",0,9,0,2022-08-17 11:46:45,来自江苏,2946296028599064,蓝色薄荷922
7132684563243221800,孩子不对就是不对，家长就不要在乎面子了,0,2,0,2022-08-17 11:39:52,来自陕西,53078368931,小千19851216
7132744268615140107,这就是有人生没人教,0,0,0,2022-08-17 15:32:12,来自青海,92760828188,存儿694
7132709961809265440,孩子吵吵都是父母养出来的，会养孩子的人你一个眼神都懂,0,0,0,2022-08-17 13:19:06,来自海南,102919839045,未来更好539
7132699071076582183,火车上那些开外放的真的特别烦人，小孩子现在不教育，以后进入社会就知道了。我公司班车上有个人，总是开外放打游戏，被大家鄙视。,0,3,0,2022-08-17 12:36:50,来自北京,3705781671,tramiy
7132705319389725448,谁说3岁的孩子哄不好，主要是熊家长！,0,1,0,2022-08-17 13:00:36,来自山东,2594469385346125,爱思考菠萝7a9
7132682751957795587,这样的家长能教育出好孩子吗？大家一起说教她，公共场合就不应该影响大家。[发怒][发怒][发怒],0,2,0,2022-08-17 11:33:25,来自北京,52925938560,多才柑桔eQ
7132707176749318924,说句抱歉，对不起就5个字！这说了多少话，还把自己和对方都气得够呛，得不偿失,0,1,0,2022-08-17 13:08:13,来自安徽,4566899305,薰衣草44034034
7132705282978890535,不是孩子不懂事，说白了就是父母不懂事,0,1,0,2022-08-17 13:00:39,来自海南,59424978862,明珠199502185
7132418037437367074,这样的家长和孩子需要社会能人来上课。,0,10,0,2022-08-16 18:25:42,来自广东,9485057199,我将与你同行
7132692964450747167,不是一家人不进一家门啊,0,2,0,2022-08-17 12:12:43,来自山东,3245381839229343,鲜桃麻麻
7132679809746567943,高铁还是需要设置处罚机制，比如提高此类人的购票价格！通报其单位，所在城市视频曝光等,0,2,0,2022-08-17 11:21:54,来自浙江,1692902677297548,嬴Y
7132698094302462759,3岁就管不了.那以后就更管不了！,0,2,0,2022-08-17 12:32:47,来自浙江,3953481931297975,阿喂儿
7132652478004724487,有些孩子真的安静不了[捂脸]，这位父母说话方法不对怎么叫管不了这样说话很容易激怒别人,0,4,0,2022-08-17 09:36:02,来自福建,110796622939,薰美丽节
7132671578764231458,这样子的家长会教育好孩子，有什家长就有什么孩子，这下全国人民都认识她了,0,2,0,2022-08-17 10:49:27,来自河北,53199914722,一切随风飘散2
7132673920204948258,没有谁对谁错，有些人也太过计较了点，小事非要弄大，精力旺盛。,0,1,0,2022-08-17 10:58:27,来自广东,694508609867997,乘风破浪的饼干i7
7132692362731963170,我们没有小的时候吗？,5,0,0,2022-08-17 12:10:03,来自广东,104702090132,养由基5v0d
7132738685338272553,这是什么家庭！,0,0,0,2022-08-17 15:09:56,来自辽宁,96311862560,依萍雅阁
7132673593758499625,既然这样，大家都把手机声音外放，越大声越好，最好拿个蓝牙音箱放！整个车厢都嗨起来！[呲牙],0,1,0,2022-08-17 10:57:24,来自广东,80123059931,奇妙天空ot
7132673401600459535,熊孩子，熊父母,0,3,0,2022-08-17 10:56:39,来自湖南,67026978609,李晓敏391
7132735769373934376,后续呢？怎么处理的？,0,0,0,2022-08-17 14:58:37,来自山西,51034699496,淡水60
7132713463973380898,影响到别人首先家长应该表示歉意，这样大家才能互相理解，包容……,0,5,0,2022-08-17 13:32:06,来自广东,1604926080038251,爱笑杰西1s2
7132719774240834318,把外放声音发出来，听听多少分贝，到底高不高，不过也有挑事的乘客明明不高，就说音高，确有不高非说声音高。,1,0,0,2022-08-17 13:57:07,来自北京,4155782101468187,宝蛋妈妈2010
7132719637124481806,要反着来，给熊孩子糖，鼓励熊孩子闹！,0,0,0,2022-08-17 13:56:22,来自甘肃,106071391625,舞动凯利9N9
7132677326575436578,乘高铁小孩哭闹我也碰到过。一般不是小孩无理取闹的原因（有时小孩身体不适头昏），绝大多数人都会原谅。小孩该教育时还是得教育一下，成习惯就不好了。,0,3,0,2022-08-17 11:11:43,来自湖北,93542830019,持之以恒展翅
7132689271600825118,天气这么热就不能心平气和吗,0,1,0,2022-08-17 11:58:24,来自贵州,59600419624,yhy淡淡
7132700643806053132,[笑哭]尤其是开大声音，循环播放...[流泪],0,1,0,2022-08-17 12:42:41,来自江苏,104958107996,喵酱丶
7132694180752786180,如果我在开声音更大,0,1,0,2022-08-17 12:17:41,来自广东,2656028484,梵文明的哦
7132698766176125707,当孩子吵架，勺子家长！,0,1,0,2022-08-17 12:35:43,来自新疆,5887349483,芳芳妞妞亮亮
7132633806401848079,管不了不要生孩子,0,64,0,2022-08-17 08:23:00,来自四川,63674020010,超级杀手有点二
7132692633096684325,全车厢也都放声音大的，全车厢嗨起来。,0,1,0,2022-08-17 12:11:30,来自河北,6755802801,路过地球2000
7132720581232968482,孩子不好管理可以理解，但家长不讲道理把孩子吵看成是天经地义理解不了。,0,3,0,2022-08-17 13:59:40,来自山东,2097502527430382,用户柳桦
7132701505366672140,这是家长言传身教的问题，关系到教养以及品行,0,4,0,2022-08-17 12:46:12,来自广东,3703587913078039,郭大米
7132678690416821022,这样的家长，能把孩子教育好吗？等孩子长大了有苦难言了[流泪],0,1,0,2022-08-17 11:17:40,来自甘肃,57779434829,元气轮船Pq
7132643585447183141,显然，小孩外放声音不小，这是前提，但不是判断冲突对错的关键。如果先善意提醒了，家长还蛮不讲理，那就是家长不对。但如果上来就拿素质说事，家长自然也气愤不过，回怼也正常。这个视频掐头去尾，不能全面反映事实,3,5,0,2022-08-17 09:01:30,来自广东,1798455199006936,一只蹄花压海棠
7132679613830284062,有熊家长就有熊孩子！,0,1,0,2022-08-17 11:21:06,来自江苏,50020790655,手机用户朴素年代
7132705022969873166,家长看似维护自己孩子，其实她是在害自己的孩子！,0,1,0,2022-08-17 12:59:26,来自河北,97652281907,艳阳j
7132671798667248384,以后的熊孩子会越来越多[抠鼻]老师都不敢管了。,0,70,0,2022-08-17 10:50:18,来自江苏,62909212147,音符211047307
7132697385003959077,孩子都闹，管管就行，暑假坐高铁，孩子想看风景，后面女的非得关窗帘子，说开一点都不行，又没太阳，后来我老公没惯着她，全拉开了。,0,1,0,2022-08-17 12:29:57,来自四川,93045478356,风趣的简单溪水
7132657759144772360,这种素质的父母绝对教育不好下一代，孩子长大绝对是人才,0,2,0,2022-08-17 09:56:23,来自广东,62568052151,无杂念
7132690763514676009,车厢里口罩扯了犯法的哦,0,1,0,2022-08-17 12:03:49,来自重庆,6906461828,玛璐果
7132679203027337984,昨天看了完整视频，这女的怼人可厉害了,0,0,0,2022-08-17 11:19:01,来自湖南,108164716715,朵儿hh
7132699714889483039,每次娃的班上有小朋友们打架的事，家长群里就有家长们吵架，看的烦。,0,1,0,2022-08-17 12:38:47,来自江西,3900714107,jiujiangbaby
7132681743840428840,我会在她旁边发出噪音，让她报警,0,1,0,2022-08-17 11:28:50,来自北京,2845190738674259,可爱的柳柳7
7132703012342727460,这种家长教育出来的孩子会反噬到家长身上的,0,1,0,2022-08-17 12:52:00,来自上海,96785904634,酸龙拿走
7132729576568308492,"孩子在列车上大闹本身就不对，
作为家长，此时更应该控制好自己的情绪，不是和别人吵架。如此发泄，在众人面前丢脸，老话说当面教子，三岁打爹骂娘，爹娘笑，家教有方家兴旺，家教无方家败光…",0,0,0,2022-08-17 14:35:21,来自山西,1525710316907992,育儿冷知识平衡车
7132705246702519052,你是孩子的爹，哈哈,0,0,0,2022-08-17 13:00:33,来自四川,4126934717,有范yf
7132671929387041550,生了孩子就觉得孩子是全世界的祖宗,0,2,0,2022-08-17 10:51:21,来自辽宁,3174985425487255,快乐铅笔8D
7132708550186615563,对，使劲惯，自己的孩子是个宝，必须宠着，呵呵[得意][得意][得意],0,1,0,2022-08-17 13:13:44,来自浙江,52536574794,曾经沧海笑春风
7132712904096400136,所以像这种家长生出来的孩子，你说如果在校学校的老师敢管吗？,0,0,0,2022-08-17 13:30:16,来自广东,110122713687,3844496812147
7132674203761509150,这样的家长能培养出怎样的孩子[what],0,1,0,2022-08-17 11:00:16,来自安徽,5788470660,非洲印迹
7132710087822689063,言传身教，从小就培养孩子不守规矩[中国赞],0,0,0,2022-08-17 13:19:30,来自广东,53335969659,刘姥姥4126
7132670992857613096,我感觉我怎么有点占到那小孩子的家长那边,9,15,1,2022-08-17 10:47:10,来自安徽,3047484390909523,Mia宣传组灬璃悦
7132685516780241704,父母啥素质，就养什么样的孩子，社会会教育他的！,0,1,0,2022-08-17 11:43:29,来自河北,2576858270402936,如影随形hd
7132743579885323011,子不教不成材。,0,0,0,2022-08-17 15:29:39,来自北京,55863999762,亲切孔雀jP
7132698045711614735,确实讨厌，是该报警，国家应该立法,0,1,0,2022-08-17 12:31:59,来自北京,6453722993,疯狂打卤面
7132707200871023391,一家人都是一样人品，,0,0,0,2022-08-17 13:08:10,来自黑龙江,51038853724,君子棋561
7132698986812736288,这就是我们现今很多的原生家庭教育，堪忧啊……,0,1,0,2022-08-17 12:36:14,来自广东,6995131888,做人係要识do
7132688663704109857,有什么样的母亲就会教育出什么样的子女，我邻居从未上班靠认识的男人生活，她生的老大40多了，离了，结，结了离,0,1,0,2022-08-17 11:56:32,来自甘肃,58939621736,淡泊的梦想K
7132679918991360783,"孩子吵控制不住可以理解，不是所有三岁小孩都能管得好。每个孩子品性不同。旁边的人抱怨可以理解，道歉好好赔不是就好了。但怼回去就不对了。
如果道歉好好赔不是，旁边的人还是不依不饶，唠叨不停，我也怼回去，想不吵自己包车去。我坐飞机也遇到几次小孩从上飞机哭闹到下飞机的，虽然心里很烦，但只怪自己倒霉，周边乘客没有一个人责怪的。",1,4,0,2022-08-17 11:21:55,来自广东,1063973528019790,偶遇她老公
7132654316338479908,护犊子可以理解 得有个尺度 孩子吵闹影响别人在先 反倒歪理一堆,0,69,0,2022-08-17 09:42:56,来自广东,1688440747858958,基数越来越大
7132710204252144397,早晚会得到教训的,0,1,0,2022-08-17 13:19:35,来自新疆,3175695928,纳兰小晓
7132673519640494882,有这样的家长，孩子以后绝对吃个大亏。她不教育，等她不在身边的时候，自然有别人教育,0,1,0,2022-08-17 10:56:57,来自山东,96586778032,聪慧足智多谋枫叶
7132671262094066466,好“伟大”的母亲，她一定能教育好孩子[捂脸][捂脸][捂脸],0,1,0,2022-08-17 10:48:08,来自黑龙江,109647482280,静坐常思己过258
7132707317283816192,现在有些年轻客人不知道尊老爱幼，要原谅老人和孩子的一些行为。多包容。,0,0,0,2022-08-17 13:08:14,来自天津,2915536857473707,安逸精灵mv
7132675003786642189,小孩父母不懂道理。这是公共所，不是你家。,0,0,0,2022-08-17 11:03:07,来自湖南,2788001362493735,奇幻星球7A
7132698993142301474,可怜的家长，浪费了一次绝佳的教育引导孩子的机会！惯子如杀子，以后自己感受吧！,0,1,0,2022-08-17 12:35:47,来自四川,52756769498,姆拉克爵士
7132703534277706511,惯子如杀子，,0,1,0,2022-08-17 12:53:32,来自山东,1161555077502176,牡丹
7132685932259803938,上社会会有人替它教训的[发怒][发怒][发怒][发怒][发怒][发怒],0,1,0,2022-08-17 11:45:08,来自四川,98457139545,隔着山头看月亮
7132670621565715237,一巴掌就能解决，舍不得呗,0,1,0,2022-08-17 10:46:26,来自湖北,84966742490,博学多才的糕糕糕糕糕
7132685922302690060,什么事情都会反噬，一般熊孩子的背后都有一样的家长。我也是家长，坐车就特别担心孩子打扰别人。,0,1,0,2022-08-17 11:45:49,来自山东,107842805131,调皮小谷神星
7132683225680003855,还好有道理,0,1,0,2022-08-17 11:34:39,来自陕西,93187941077,陈祥聪
7132660118214771467,狗不懂事 主人更不懂事 。[大笑],0,38,0,2022-08-17 10:05:54,来自吉林,1658505695077811,苍鹰之乡鄂伦春自治旗
7132666775161946913,有啥父母就有啥孩子[捂脸],0,2,0,2022-08-17 10:31:27,来自山西,86813007316,萍姐爱旅行
7132683564550292232,自己的孩子犯法好多家长都还袒护，更别说这样的事！以后等社会去教训他吧！[震惊],0,0,0,2022-08-17 11:36:29,来自陕西,73621167801,偶艺奇缘
7132714673803330315,确实，有几次被这些孩子吵得头疼,0,0,0,2022-08-17 13:37:24,来自四川,88049454310,小牛妞97
7132704510064984869,我觉得列车长可以发挥些作用,0,0,0,2022-08-17 12:57:32,来自浙江,54528765341,宝妈的悠闲生活
7132701171311657763,问题儿童背后有熊父母，先天病态的儿童除外。三岁看70，上学前父母没教会孩子守规矩，将来哭的是父母。,0,4,0,2022-08-17 12:44:17,来自广西,5522263642,越崟
7132678458303791887,公共场合说话声音都要小声点，不要打扰别人。这是素质和教养。,0,1,0,2022-08-17 11:16:07,来自天津,1152709569559133,爽朗的春节快乐
7132679690837508897,首先起身给大伙赔礼道歉，想办法让小孩停止他的行为！,2,8,0,2022-08-17 11:21:40,来自陕西,72804864747,魔法师杰米6j4
7132734398893736716,低龄儿童有的确实爱哭闹。家长也很无耐。打也打了骂也骂了。就是哭闹[裂了],0,3,0,2022-08-17 14:54:10,来自江苏,5753147340,乐网友
7132693909318370048,三岁小管不了 等30岁再管吧[捂脸],0,0,0,2022-08-17 12:16:01,来自河北,808843520250292,梦里花629
7132669543436288780,上次坐高铁，前座一年轻男女大声外放斗地主游戏的声音（男的穿那种后面一个鹰的黑衣服，与上次某地打架的一样），长时间不停，烦到了周围的人也不自知，我最后实在忍不住大喊一声：哪里那么大声！他们才收小声音。,1,1,0,2022-08-17 10:42:19,来自广东,13298495351,阿忆123
7132677590795453191,喜欢安静不受打扰的可以自驾游四方，真的。,0,1,0,2022-08-17 11:13:00,来自辽宁,373489449056958,天天眯眯
7132664831563481897,养不教，父之过。这孩子在这家庭长大不改没会丢了，社会淘太。,0,21,0,2022-08-17 10:23:11,来自湖北,57873676516,柏158453925
7132706537558295308,关注后续，他该给全车的人道歉,0,0,0,2022-08-17 13:05:44,来自四川,4126934717,有范yf
7132387916239913743,言传身教，一代会比一代强。,0,29,0,2022-08-16 16:28:48,来自四川,102248602668,周先生9956
7132693723834155812,这妈比孩子吵[捂脸][捂脸],0,1,0,2022-08-17 12:15:54,来自四川,103033441534,tedddyyy
7132658436575085347,惯着这个孩子让他说这样太好了，你家人做的对，在过十年你看他[呲牙],0,20,0,2022-08-17 09:58:28,来自内蒙古,108469690777,酒中仙鲁
7132682484277412642,真是一家人！都一个獤样！,0,1,0,2022-08-17 11:31:41,来自江苏,74143187502,乐天派艾伯特4N0
7132684037239391009,我有一次坐飞机，昆明飞深圳，我邻座一个13岁上下的男孩，把扣的鼻涕全部擦在前座椅背面，他妈就坐他旁边，没有制止像没事一样，口音云南人。,0,0,0,2022-08-17 11:38:20,来自广东,52546832872,豌豆公主M
7132673737266840335,暑假出游，动车上就像游乐场，不敢说，怕吵不过气半死[石化]，支持伸张正义的人,0,1,0,2022-08-17 10:58:00,来自广西,6169982699,蛋糖果1
7132674123079336738,应该可以报警吧，寻衅滋事扰乱公共秩序……,0,1,0,2022-08-17 10:59:19,来自北京,8583617534,蜜蜂蝴蝶
7132685189243437839,立法！！！,0,1,0,2022-08-17 11:42:24,来自北京,80732484321,红39667
7132690525106373376,这样的家长能教育出什么好孩子[尬笑],0,1,0,2022-08-17 12:02:53,来自天津,3105443642606735,b宇智波佐助
7132664106743644968,小孩不懂，大人也不懂？,0,4,0,2022-08-17 10:20:33,来自广东,6929201557,雨众不桐山清水秀
7132690955002037004,什么家长什么孩子，原生家庭就这样，将来孩子什么样也可以预见了。,0,0,0,2022-08-17 12:05:23,来自上海,105149725472,比利利哗啦啦啦
7132673721303221022,家长是孩子最好的老师。,0,1,0,2022-08-17 10:58:29,来自北京,3466122348469128,博学多才的多拉格
7132675639068852999,这样的家长能教育出好孩子来？,0,1,0,2022-08-17 11:05:47,来自浙江,10595410469,智者必正
7132673539580412676,＂我的小孩我管不了他，我控制不了！＂这家长当得！,0,3,0,2022-08-17 10:57:52,来自福建,3963062356555886,王二狼的妈妈
7132658954492576525,教养是大管小养成的，这一家几代不知道什么叫教养。,1,8,0,2022-08-17 10:01:12,来自新疆,50751643633,魔法师固原3K8
7132677281491452704,声音小点正常，如果是我，我会主动告诉自己孩子，不要影响到别人,0,1,0,2022-08-17 11:12:36,来自吉林,51673938842,嘟嘟139503021
7132702326569386788,怎么三岁就不懂了 不懂才要教 懂了还用你教什么？,0,5,1,2022-08-17 12:48:58,来自上海,1481796888824749,小艾丶艾
7132674066620334889,一家人都不讲道理,0,0,0,2022-08-17 10:59:13,来自陕西,79310518922,快乐518
7132643240939340557,管不了大了交给社会管,0,13,0,2022-08-17 08:59:57,来自山东,95542074343,无缘旅行
7132705279825036072,还不少处罚不够严格！,0,1,0,2022-08-17 13:00:09,来自广东,20501776218,广州昌哥
7132733417682715405,表面是爱护孩子，其实是给孩子挖坑，真是特别会坑孩子的父母！,0,0,0,2022-08-17 14:50:03,来自广东,95081743664,互联心声
7132672978047075072,这是铁路部门应该管理的事，硬性规定不能外放不行吗？这样就可以减少不必要的矛盾了。,0,0,0,2022-08-17 10:54:54,来自广东,50775185515,书乃黄金屋
7132680549281334052,理解一下，毕竟孩子不懂事，有的熊孩子就是管不住，皮的很！,0,3,1,2022-08-17 11:24:32,来自江苏,2559298704258157,梅花鹿h
7132671005403153159,上行下效！,0,1,0,2022-08-17 10:47:50,来自北京,70774629460,梅子227774396303
7132696481152533289,昨天坐高铁，从庐山站来北京，暑假孩子特别多，边上有一个孩子外放手机，妈妈很严肃的让她看座椅背后的提示。还有一对小孩从上车到下车嘴巴就没停过，家长一句话都没说过孩子。,0,1,0,2022-08-17 12:26:01,来自北京,62074382980,月之民天
7132383239259833122,监护人应当承担责任，替你娃行政拘留7日，以后就“注意”了,0,23,0,2022-08-16 16:10:48,来自陕西,5872924043,为和為
7132665345709818664,三岁看大，这个说法没听过吗？,0,0,0,2022-08-17 10:25:19,来自广东,60853318200,鑫鑫的小日常
7132715089882858247,子不教，父之过，扰乱社会秩序，危害公共安全重罚重判，永久列入黑名单,0,0,0,2022-08-17 13:38:55,来自山东,3858339483,大海无边哥
7132704846583137062,还都戴眼镜，文化人儿？,0,0,0,2022-08-17 12:59:19,来自山东,59384512805,甜蜜人生46
7132675448140186408,这样的母亲能培养出好孩子吗？,0,0,0,2022-08-17 11:04:39,来自黑龙江,88075611270,Aying007
7132614251747181316,小不教老来哭,0,38,0,2022-08-17 07:08:41,来自湖南,85612289578,有li走天下
7132717448624735015,成为熊孩子身边一定有个熊家长。,0,0,0,2022-08-17 13:48:18,来自河北,171125757453853,张弛有道很多年了
7132677070987559719,希望这个孩子长不大,0,0,0,2022-08-17 11:11:42,来自四川,63495914777,南瓜里面是黄黄的
7132652915206652679,公共场合每个人都有权利管,0,17,0,2022-08-17 09:37:54,来自山东,1077954870251694,轻松阜康6f9
7132655092331315968,中国人吗！哎！习惯就好,1,1,0,2022-08-17 09:45:45,来自内蒙古,106682722647,阿木5866
7132723515140473633,这不讲公德也是祖传世袭，如果有天，在某场合，被人胖揍一顿后，也许会戛然而止。,0,0,0,2022-08-17 14:11:48,来自湖北,5161552484,老喻163262988
7132685183991710499,凡是错误的言行几乎都跟错误的概念有关，几乎没有例外。比如本例就是事主歪解了“道德绑解”。,1,0,0,2022-08-17 11:42:12,来自广东,22001889669,南波万影音
7132677843733512994,确实是，按公知的说法，法无禁止即可为,0,0,0,2022-08-17 11:13:51,来自北京,6768346180,周鱼的鱼
7132647484559737635,什么样的父母什么样的娃,0,10,0,2022-08-17 09:16:00,来自新疆,3839120096110428,视野肯德尔8t1
7132673124805935908,现在坐火车飞机，最怕的就是这各种开设备声音，不胜其扰，只有戴耳机,0,0,0,2022-08-17 10:56:03,来自重庆,4576170132,我系李达康
7132690518739469097,没有不懂事的孩子，只有不懂事的家长，家长不好好教育孩子，以后就让社会来教育吧！,0,21,0,2022-08-17 12:02:52,来自广东,1363014319618584,南方美丽姑娘在深圳
7132695730875433767,她火了，孩子以后怎么去学校？,0,0,0,2022-08-17 12:23:46,来自河北,92590036745,唐山地震幸存者1976
7132675338404102942,"高铁上多的是，没办法，国民素质教育网还得加强。
还有，乘务员于严格管理，不听劝阻的，可草拟行政法规处罚。
现在高铁每个座位都有二维码了，可以加上投诉乘客扰乱公共秩序功能。",0,0,0,2022-08-17 11:04:29,来自安徽,3157394734982990,靖夜听语
7132654728617771788,当人道无能为力时/自有天道来惩罚/到时悔之晚矣/天道有沦回、苍天饶过谁[祈祷][祈祷][祈祷],0,54,0,2022-08-17 09:45:00,来自吉林,87573584534,石通天
7132707564709806879,打扰到别人没有一点歉意，不是一家人不进一家门.,0,0,0,2022-08-17 13:09:30,来自辽宁,3993879338813559,快乐不凡蜻蜓cc
7132714438893388585,教育不了孩子就不要坐高铁，不要去影响别人！,0,0,0,2022-08-17 13:35:59,来自天津,69371973468,剪不斷嘚情
7132697430755148558,在KTV习惯了。,0,0,0,2022-08-17 12:30:14,来自甘肃,7506911240,风度翩翩的黄河
7132725700544594720,用魔方打败魔方，他声音打你比她声音还大，他还打你，就躺地上报警,0,0,0,2022-08-17 14:20:20,来自新疆,70894602103,寒门再难出贵子
7132718236361343775,找机会带点微笑委婉点的提醒也许就不会争吵，有些人得理不饶人，简单粗暴出口伤人会招到激烈的反击的。,0,0,0,2022-08-17 13:50:58,来自广东,2738701614,龙騰四海
7132674077076751119,这事坏在3个字，怎么了？我就恨这样说话的人，不怎么，我就不让你怎么，怎么了？,1,1,0,2022-08-17 10:59:23,来自浙江,103012067699,团团他阿爸
7132686022668190498,小孩子闹人正常现象，嫌吵家里呆着睡觉去,4,13,4,2022-08-17 11:45:28,来自广东,93586070957,佳乐康鸡鸭批发配送
7132380854298379023,会有人帮你教育的,0,10,0,2022-08-16 16:01:18,来自江苏,554586999893535,海门一推
7132687629128549120,还是要开静音专列车厢,0,0,0,2022-08-17 11:51:41,来自重庆,106550756697,却道天凉好个秋Max
7132706300237923107,所以说，现在人最不怕的就是所谓报警。,0,0,0,2022-08-17 13:04:13,来自宁夏,50098627673,红崖山沙
7132686066255135521,孩子怎么带？会不会成熊孩子，主要还是看家长了！,0,1,0,2022-08-17 11:46:19,来自河南,98011281120,伊人艾美
7132681554861933346,东北、西北川渝湖北等地区相当一部分国人公共场合不顾别人感受大嗓门坏习惯要改[捂脸][祈祷],0,1,1,2022-08-17 11:28:16,来自广东,102168447790,浮萍粒
7132696133428003588,孩子不懂事的原因是大人不懂事，就是俗话说的“上梁不正下梁歪”。,0,0,0,2022-08-17 12:25:28,来自陕西,2792352043238269,快乐赤峰7D
7132702693805998882,孩子管不了，是野生的？,0,0,0,2022-08-17 12:50:06,来自河北,11088408388,左都御史3
7132688507165557515,家长耳背，可以谅解,0,0,0,2022-08-17 11:55:46,来自北京,59739272770,九月辰星
7132701775680996128,在家管着谁也管不了，家长的行为直接影响了孩子。,0,0,0,2022-08-17 12:47:08,来自山东,1820393229001856,热血青年杰里6u
7132678032585818887,这什么家长啊，这样的小孩子会好啊………这样的家长真的是小孩子悲哀,0,0,0,2022-08-17 11:14:53,来自陕西,2730830447249092,日出临东海
7132712751852028704,孩子因为你们的这种所为的爱将来会给你们带来痛的 子不教父母之过,0,0,0,2022-08-17 13:30:13,来自辽宁,7750343354,乐观遼原
7132699386018759424,长版的原视频在哪里可以看到,0,0,0,2022-08-17 12:37:23,来自广东,6741651706,海龟兄弟
7132707490206843662,唉😔！可怜可悲的家长！孩子这样家长不管好吗？,0,0,0,2022-08-17 13:09:19,来自内蒙古,82378771590,草原仁鸿
