7132693462965076750,表面看上去是在维护孩子，实际上养成了这种习惯将来给他带来的伤害更大。,2,311,0,2022-08-17 12:14:46,来自湖北,2454556789718536,风间若花
7132712239597093663,啥管不了，摸电门他也管不了？,1,6,0,2022-08-17 13:27:50,来自河北,88180541203,九儿妈
7132434976377094912,早晚有人替她教育孩子,10,974,0,2022-08-16 19:31:18,来自黑龙江,6510821273,烟雨江南93269886
7132620248591172389,孩子的素质取决于家长的素质 ！,2,397,0,2022-08-17 07:31:05,来自江苏,64299911898,艳梅生活日记
7132700247826285352,这次坐火车也遇上一家子，两个大人带两个孩子，上车开始他家儿子在车厢里连嚎带叫的闹了两个多小时。实在忍不住了，和前面那姐们一起喊了一句太闹了他家大人才活过来了招呼了一下。结果去上厕所，刚进去外边就咔咔的拧门，我说谁这么奇葩呢，开门一看他家老婆带小姑娘上厕所。看见了还觉得我出去晚了狠狠瞪我一眼，给孩子说快进去。[我想静静]我都没出来，急着进去抢屎？,1,49,1,2022-08-17 12:40:36,来自重庆,60026779112,果仁酸奶布丁
7132470482989138726,这个当妈的在给高墙内培养人才呢,7,228,0,2022-08-16 21:49:40,来自山东,105055431015,小妮可凡
7132415705294766851,每个熊孩子的背后都至少有一位熊家长,2,695,0,2022-08-16 18:17:14,来自海南,919660555676301,宣xuan9218
7132641385085895431,有的人是没有是非观的，换句话说，她自己的都是对的，说她不对的人才不辨是非。真希望有法规能约束她们 否则遇到这样的人真是烦恼,1,201,1,2022-08-17 08:52:54,来自吉林,50029280980,晴风微语
7132412697421382440,这种人不配做家长[抠鼻],2,569,0,2022-08-16 18:05:02,来自辽宁,10829071931,快乐红
7132406008106091297,有其母必有其子。,11,1938,1,2022-08-16 17:39:44,来自内蒙古,3548817726643192,多才葡萄Xc6
7132410848090014497,这种家长不知怎么想的？让孩子遵守公德很吃亏吗？,2,307,0,2022-08-16 17:58:45,来自陕西,63191743138,清清水泉
7132417215554650921,素质教育很重要，这个小孩让家长害了,1,407,0,2022-08-16 18:22:28,来自湖南,87042266104,Z1511789
7132417826400895752,全国人民都要认识她了,4,411,0,2022-08-16 18:25:26,来自北京,3677234139772573,正大光明青山4y
7132644580415046436,其实不用上纲上线，有的小孩天生比较调皮，我家还好，如果要到处跑我就给他看动画片，或者多买点平常不给他吃的零食。,1,8,0,2022-08-17 09:04:59,来自重庆,3325373765910621,科技戴利6b3
7132704703938675491,吵到人家应该感到抱歉，态度不应该这样嚣张，虽然小孩子吵闹是正常现象,3,17,0,2022-08-17 12:57:58,,5876628066,mia69
7132698968370430754,这样家长孩子三十岁不懂事她都能给找到借口，三岁小孩其实已经都懂了。不懂就是没挨巴掌！,1,16,0,2022-08-17 12:35:37,来自黑龙江,1525777643869453,狗点点她姐姐
7132445920754582304,没有法律，只能吵架。,1,71,0,2022-08-16 20:14:10,来自新疆,79775920608,天山上的松鼠
7132374456391271203,这样的家长教育不出好的孩子,8,722,1,2022-08-16 15:36:35,来自北京,69739032239,多彩鲸鱼HH
7132674147590849315,我闺女今年不到三岁，由于各种原因，已经坐过六次飞机，无数次高铁了，就算是听不懂人话的时候，也没有在外边吵闹过，从来没有，一次都没有，最过分的一次，就哭了两声，跟我说，妈妈我有点难过，我就好好抱了抱她，就好了，孩子需要从小就教育，不是突然一天能懂事的,10,159,1,2022-08-17 10:59:24,来自河北,59132546661,lemonmonel
7132630246310314767,三岁就管不了了。[捂脸],1,38,0,2022-08-17 08:09:16,来自山东,62171137199,与春风共舞呀
7132424908872745739,错了就是错了，不对就是不对，不懂这种人为什么错了还那么理直气壮,15,595,1,2022-08-16 18:53:04,来自黑龙江,3822251966,a金珂
7132699227523793704,家长放纵才会导致孩子无休止的吵闹，我们孩子不会这样，就是以自我为中心习惯了，所以没法制止住孩子，孩子吵闹正常，但只要家长管，不可能还会一直吵，我们以前坐车孩子声音大，我只要手比在嘴巴嘘嘘嘘，他马上把嘴巴捂住,0,6,0,2022-08-17 12:36:37,来自福建,5496975090,Alice57044705
7132383685671895843,熊孩子后面的熊家长,3,461,1,2022-08-16 16:12:22,来自江苏,2879201823,带着蜗牛散步
7132375944005845774,那就报警呗,7,360,1,2022-08-16 15:42:45,来自四川,3427181002,鱼唇姐姐
7132660811071275783,不讲理的家长、不懂事的孩子、有苦头吃呢……,0,45,0,2022-08-17 10:07:56,来自江苏,102858743593,悠闲橡皮3b
7132395503379596036,这位母亲真伟大，[思考]再大声点，让孩子以后无论上学还是上班还是做任何事情都这样放肆，千万别控制,10,805,1,2022-08-16 16:59:00,来自辽宁,940770873311373,豁达的涂涂
7132668664587174669,外出如果要给孩子听东西，我一定会让他带耳机，有人说小孩子带耳机不好，但是我觉得跟打扰别人相比，还是带着吧，而且也不会太长时间，影响不大。我最讨厌的就是外放，跟骚扰一个级别，就是强迫你接受你不想接受的东西。,1,14,0,2022-08-17 10:38:45,来自江苏,2181906431483583,极速菠萝2n7
7132600884856816420,家长是孩子的第一任老师[灵光一闪],1,56,0,2022-08-17 06:16:15,来自河北,3633249843950583,勇往直前龙神保佑
7132410053478810406,高铁，地铁都不允许外放，工作人员来了就知道了。,1,267,1,2022-08-16 17:55:31,来自河南,3320173254688295,上进梦想4k
7132647000918672142,三岁看到老,2,23,0,2022-08-17 09:14:27,来自黑龙江,105468584937,22544866
7132641761541358369,又给拘留所，监狱培养一个优秀人才[捂脸],0,47,0,2022-08-17 08:54:54,来自河北,1297027162187347,爱笑凯尔西1n6
7132655663951708932,有其父母，必有其子…,0,35,0,2022-08-17 09:48:34,来自四川,3192598613198919,多才小红花Lp
7132456270308836130,关键是乘客心不齐，如果大家群起而攻之，把它的气焰压下去，让它无却自容！乘客中事不关己，高高挂起的人太无正能量了！,2,115,1,2022-08-16 20:53:49,来自江苏,2348179370817534,愉悦的星辰DP
7132740733072950024,就这样的家长。教育不出来什么好孩子。爸爸妈妈就是孩子的镜子。可能在家孩子就把声音放到最大。她们自己已经习惯了。根本不在乎别人的感受。所以她就觉得她的孩子做的很好。别人一说就觉得欺负他们家孩子了。不可理喻,0,3,0,2022-08-17 15:18:22,来自甘肃,1684074132422077,终究是个笨笨
7132472617289941793,我在上海坐地铁的时候，也遇到过旁边看手机声音外放的，说的人也要把话说的好听点，我这个跟人家说下，你把声音开小一点，人家就把声音开小了，一般人你只要给他留面子，他还是愿意接受意见的，但是你不要一开张嘴就说人家没素质，那人家肯定不接受了。,12,40,2,2022-08-16 21:57:49,来自安徽,59320457930,简单晓琴
7132742896968712973,我还记得我和孩子有一次坐公交车，车来了以后他吃的冰激凌还没有吃完，上车以后我问乘务员垃圾桶在哪里，我扶着孩子让他接着垃圾桶吃完，其实我也是多高尚的人，但是公共场合一定要管好自己的孩子。,0,0,0,2022-08-17 15:26:33,来自黑龙江,58527186593,紫柔ABAB
7132704358604702494,出门怎么都可以，但不要影响别人，做不到就不要出门,8,5,1,2022-08-17 12:57:00,来自云南,73493895672,热情湖泊Tu
7132415814959104771,什么家长呀[打脸][打脸][打脸],0,156,0,2022-08-16 18:17:44,来自江西,105204817436,小兔子峰回路转
7132651273316401928,熊孩子都是熊家长带出来的！,0,80,0,2022-08-17 09:31:11,来自湖南,4468067047310743,智慧波顿
7132657452704875264,给这个爸爸和妈妈的行为打几分呢？你们夫妇的行为德行能及格吗？让你的领导和同事都看看私下里的，你们的公德意识是怎样的？两个人都戴着眼镜，应该受过一定的教育吧？那就更要好好的反省一下了！,0,16,0,2022-08-17 09:54:44,来自吉林,3240998101331134,才思敏捷的清怡
7132619252804535076,孩子才三岁都管不了，要长大了不得上天 ！,0,20,0,2022-08-17 07:27:12,来自江苏,64299911898,艳梅生活日记
7132431962656244492,子不教母之过，以后难成人！,0,55,0,2022-08-16 19:20:17,来自辽宁,79952189247,优美爱乐
7132429141659550498,这种家长能教育出好孩子？,0,77,0,2022-08-16 19:08:42,来自上海,2585693893167679,点点繁星相随
7132427046428345088,熊孩子就是这样产生的,0,69,0,2022-08-16 19:00:31,来自上海,76835485938,三六九現鈔旁友
7132378888890237696,什么家长什么孩子。我家楼下一个不到10岁的孩子，每说一句话都带好几句脏话，我听着都瘆得慌,9,885,0,2022-08-16 15:54:00,来自山东,92565011984,勇敢的钢琴zi
7132439444061537054,戴个耳机就好了,4,26,2,2022-08-16 19:48:36,来自江苏,980412855488350,上进会游泳的鱼
7132466661877449472,还想说别带口罩看看脸，结果自己一把扯了[捂脸][捂脸][捂脸],1,41,0,2022-08-16 21:34:10,来自湖南,85775553620,哈姆雷雷雷
7132734676929741581,三岁了，该懂，我儿子女儿只有2岁多时候，有点懂，衣服弄脏了，我说，不喜欢你，马上要换，后来是爷爷奶奶带，他们出去，见到谁都叫，在村上走一圈，袋子里都是吃的[捂脸]，所以孩子从小就要教好，,0,0,0,2022-08-17 14:54:39,,3061462499593358,醉狼
7132701317637915392,其实我能理解这位妈妈，不是每个三岁的孩子都能懂事，都多理解下,1,1,0,2022-08-17 12:44:40,来自福建,1574923554260072,博学巴里5w4
7132404939590337283,能教出啥样的孩子,0,34,0,2022-08-16 17:35:40,来自河南,107687981171,优优285637327
7132390907047265024,这样的家长教育不出好的孩子,0,98,0,2022-08-16 16:40:25,来自四川,96867152565,亲切帆船zC
7132410555314635535,大人应该从小给孩子树立好的形象，你的一言一形非常重要，有理不在声高。,0,45,0,2022-08-16 17:56:35,来自北京,100315105218,敏锐霍普9l0
7132706761068561191,这种家长以后早晚后悔没有教育自家的孩子,0,20,0,2022-08-17 13:06:36,来自浙江,93037687113,奶茶妞的妈咪
7132389748970341161,有什么样的家长就有什么样的孩子，终有一天会让家长尝到她自己的孩子给的苦头[灵光一闪],0,181,1,2022-08-16 16:35:52,来自河北,105856796480,果儿来咯
7132430391264543503,不是一家人不进一家门，有这样的妈还能教出什么好孩子。,0,26,0,2022-08-16 19:13:35,来自重庆,8525336568,塔兔12
7132425834358915853,妈妈如果真爱孩子，就把一车厢都包下来，爱咋的咋的，谁也管不着！,0,25,0,2022-08-16 18:56:00,来自四川,53450122749,泡泡是个大霉吕
7132735615258346248,这孩子有问题与家长有关系！,0,0,0,2022-08-17 14:58:16,来自辽宁,2291004888595677,才思敏捷的怡然
7132742614264120099,三岁是可以听话的,0,0,0,2022-08-17 15:25:09,来自四川,6002035340,好奇克
7132732641069007623,你管不了，以后有人帮你管,0,0,0,2022-08-17 14:46:49,来自浙江,85034011932,Sanking
7132414888084882216,这家长可真优秀啊！[赞],0,19,0,2022-08-16 18:13:20,来自山东,2809943946699373,敏锐书签Jk
7132733865755886336,有些孩子真的是管不住这个是真的很难[捂脸]一个班总有几个孩子闹，父母都是有素质高文化的人才，但孩子真的很让人头疼[捂脸]说也说了打也打了就是特别犟[捂脸],0,0,0,2022-08-17 14:51:14,来自浙江,677740677443175,乐天派辛集3Y2
7132668178051695395,后期派出所帮你管,0,18,0,2022-08-17 10:36:11,来自广西,3755572246360847,龙芸妈咪
7132418796903662374,孩子能这样，不就是有这样的父母吗？,0,48,1,2022-08-16 18:29:13,来自广东,102148939723,幸福我们这一家
7132442278165267200,孩子跟他娘学成这样的！,0,14,0,2022-08-16 19:59:29,来自河北,3663208431231036,奋发有为梦想ue
7132658395018249001,三岁看大 好不了,0,15,0,2022-08-17 09:58:26,来自天津,4209352574245160,健康营口9b5
7132739568498983721,家长的素质决定孩子的素质,0,0,0,2022-08-17 15:13:20,来自甘肃,6251108551,惠风和畅Z
7132495976849720064,从家长现在的样子可以看到孩子未来的样子。,0,17,0,2022-08-16 23:28:35,来自新疆,56039006800,孤芳自赏148713798
7132733603104523048,三岁就管不了，就相当于放弃了。,0,0,0,2022-08-17 14:50:25,来自辽宁,108117280023,23088不经意的风景
7132733686671295273,每个熊孩子的背后，都有熊家长,0,0,0,2022-08-17 14:50:28,来自辽宁,77359755357,小冰
7132743550458348328,早就有规定，公共场所不允许外放。,0,0,0,2022-08-17 15:28:51,来自北京,4456901313,茉莉62
7132725886566040335,这玩意，孩子也好不了,0,0,0,2022-08-17 14:20:12,来自辽宁,87270385716,成熟湖泊ti
7132734946535686927,糊涂的家长，醒悟吧！不要发现孩子有问题了在悔不当初,0,0,0,2022-08-17 14:55:30,来自北京,1135159142529047,善良精灵Um
7132475404376048399,其实很多人都会觉得是噪音。,0,8,0,2022-08-16 22:08:12,来自湖南,1930342235387396,番茄芒果酸奶
7132659893651587872,养子不教父之过…,0,12,0,2022-08-17 10:05:02,来自重庆,1530969643816440,舞动东兴3R
7132445619108692744,小孩无知，大人不懂事，将来看看谁吃亏，有德才有福,0,13,0,2022-08-16 20:12:29,来自山东,96337968348,婉晴天206
7132723808997917474,标题第一句没看懂？[what][what][what],0,0,0,2022-08-17 14:12:20,来自陕西,4490023559247367,爱吃耙耙柑的猴子
7132453523664585512,怎么有这样的母亲,0,9,0,2022-08-16 20:43:08,来自北京,81150555027,天空飞翔的大鹰
7132724763453670183,也不知道多大的孩子，不管怎样没必要闹到这种地步！现在的孩子可千万别说如何如何，大体都这样！没必要搞的这么情绪化！,0,0,0,2022-08-17 14:16:47,来自河北,53503809123,黑白204776114
7132738947582690082,孩子闹你们就多哄哄抱出走走呗,0,0,0,2022-08-17 15:10:59,来自辽宁,96311862560,依萍雅阁
7132737289301984011,只能说乘务员不作为，这种事本就不该轮到乘客管的。没办法，现在国内手机这个外放还是没有重视。高铁上真的是哎,0,0,0,2022-08-17 15:05:28,来自江苏,5773677563,围裙监督员
7132744011621663488,有些孩子就是吵闹，说了也不听的，我儿子从小就是坐车就睡觉，上车就开始睡[捂脸]，孩子小了真的怕出远门,0,0,0,2022-08-17 15:30:34,来自四川,6758674028,昊炎炎
7132735984223634213,孩子三岁知道事情，就是惯的,0,0,0,2022-08-17 15:00:06,来自新疆,82400290141,单纯辰星oV
7132702103687971614,虽然有些小孩子一直吵闹确实很难受。但是在动车和飞机上，小孩子一直待在那里不给活动，他们真的受不了大哭大闹，怎么都搞不定。别说我怎么知道的[泪奔]（那年带着外甥女去成都玩，在车厢里就是这样，没办法，只好带着她一节车厢一节车厢这样逛，她好了，我人快疯了[泪奔]）,1,7,0,2022-08-17 12:48:06,来自广东,2721982492968515,Kev_默
7132427843816342285,这孩儿后肯定有出息！,0,11,0,2022-08-16 19:03:47,来自吉林,2273424758291227,正直天空nN
7132671193001607943,家长现在不管孩子，将来社会替他管，总有吃亏的那一天[机智],0,4,0,2022-08-17 10:48:17,来自新疆,51521318024,尘埃落定208850819
7132714892808831758,言传身教，孩子学了一招,0,0,0,2022-08-17 13:37:55,来自湖南,13282516927,老聃22
7132735994101170979,支持主播的所有。解说。,0,0,0,2022-08-17 14:59:40,来自甘肃,105212548773,玛利亚6287
7132733609073083151,很多事情都是因小孩闹起来,0,1,0,2022-08-17 14:50:24,来自重庆,111633531172,重庆秀山农家土蜂蜜
7132737638548996903,真是一家人哈，怎么凑的呢,0,0,0,2022-08-17 15:06:38,来自辽宁,1776432253501720,勇往直前新生
7132718103649796904,有这种大人，所以养不出好样的孩子。,0,0,0,2022-08-17 13:50:09,来自浙江,50313411630,细腻比莉61
7132643245829587746,不能惯他们毛病！三岁看到老，将来废人一个,4,64,0,2022-08-17 08:59:33,来自山东,255534583777400,文艺桂平2D6
7132721396031537953,有其母必有其子,0,0,0,2022-08-17 14:03:58,来自河南,3161797327074808,随性自由的奶茶w5
7132738909171303205,三岁的孩子，管不了。长大成长，社会上替你管！,0,1,0,2022-08-17 15:11:09,来自山东,2941939539521035,优雅灿烂人生
7132740779021189923,小时候家长管不了，长大了警察管。,0,0,0,2022-08-17 15:17:55,来自江苏,2757164300778846,乐观飞机0JX
7132447293470409506,父母是孩子最好的老师，一目了然的坑孩子呀,0,10,0,2022-08-16 20:18:52,来自陕西,97421415741,你欠我一段小时光Sole
7132661919353766671,[捂脸][捂脸][捂脸][捂脸]不是孩子的错丶是父母的思想错了[捂脸]三岁宝宝以能听懂话了、年青父母贯孩子、小事不处理大事伤自己[捂脸]高铁是公公场面[玫瑰]必须的教育好孩子不哭不闹文明坐高铁,0,13,0,2022-08-17 10:12:08,来自黑龙江,4107392552274590,188454594260
7132449027983573767,她不教育到时有人替她教育！,0,6,0,2022-08-16 20:25:46,来自天津,16780512464,夕梦溪
7132729840519971624,国家提倡的是优生优育，不能只会优生活优身体，而没有优教育、没有优素质！,0,1,0,2022-08-17 14:35:39,来自江苏,1399015508819655,松竹梅
7132734017207911168,城市禁止养孩子[泣不成声][泣不成声][泣不成声],0,0,0,2022-08-17 14:51:52,来自山东,95599072362,送你朵大红花吧
7132676656220865317,现在的人都太娇，小孩乘车，闹一点，没什么啊，活泼开朗的孩子才喜欢动的啊！,1,0,1,2022-08-17 11:09:33,来自辽宁,373489449056958,天天眯眯
7132453930201989891,这是一位“伟大”的母亲，多么英勇的维护自己的崽儿,0,8,0,2022-08-16 20:45:26,来自河北,69427293943,冬岭白云白
7132653174418768648,有人生，没人管[灵光一闪],0,19,0,2022-08-17 09:38:39,来自山东,6677166525,淡淡女人香之密棠
7132724907280483113,家长既然不能教育好自己的孩子就不要带孩子出门，既然带孩子到公共场合就必须让它明白要遵守公约。,0,1,0,2022-08-17 14:16:33,来自湖北,9856510157,枫丹明露
7132733589867365159,三岁怎么了我一个眼神我孩子立马考试，再说了从小教育我儿子去哪儿都很听话，不管大小！是教育问题,0,1,0,2022-08-17 14:51:28,来自河北,12849688351720,只爱兔子的姐姐
7132731053416284963,这娃妈妈的声音很洪亮啊，孩子不懂事随根了[捂脸],0,1,0,2022-08-17 14:40:24,来自新疆,373453083911075,淡定的荷花Yc
7132442489956778790,什么样的妈就有什么样的儿,0,6,0,2022-08-16 20:01:09,来自贵州,111551614828,奇异冰果
7132684746790109986,孩子这样是家人惯出来的,0,4,0,2022-08-17 11:40:31,来自广西,91614108358,美食家克里斯蒂0p8
7132403680082723618,六号晚上再沧洲到长春的高铁上一个熊孩子玩游戏那枪声整列车厢都能听到！好在两站地下车啦！是真烦人啊！家长太没素质啦！,0,42,1,2022-08-16 17:29:59,来自黑龙江,6060657187,文艺伯特9g
7132710026963403531,家长管不了可以交给旁人或者警察管！,0,0,0,2022-08-17 13:19:35,来自陕西,4450435464707648,Ankang枯藤老树
7132688917304099597,我耳朵不好，公共场所数次打电话声音大，都是12岁的女儿提醒我，每次都嫌我丢人。小的时候我教她，长大了她教我[捂脸][捂脸][捂脸],0,3,0,2022-08-17 11:57:12,来自河南,1380589572204699,哈青青河边草
7132693147741897484,你听口音[捂脸]你懂的,2,4,0,2022-08-17 12:13:50,来自江苏,97307201625,江苏启东晶晶
7132707172726604551,如果我孩子这个样子，我会觉得非常尴尬跟丢脸，而且哄孩子所有人都是闭嘴打骂，这样孩子虽然能哄好但是也会有一些负面影响，可以上车之前带一些糖果跟玩具或者让他看个动画片也可以,0,1,0,2022-08-17 13:07:53,来自日本,103248037575,一只烂鱼啊
7132708697650348840,我有次坐高铁后座的孩子一直踢我座椅靠背，说了两次也那样，家长也只是说两句，孩子也不听,0,0,0,2022-08-17 13:13:35,来自黑龙江,102027622927,至美独白
7132733099028415244,这家长为他孩儿树立了榜样[呲牙],0,0,0,2022-08-17 14:49:04,来自上海,3179395963687844,坦荡的香瓜LE
7132744011622286080,这个熊孩子将来会有大出息的,0,0,0,2022-08-17 15:30:45,来自内蒙古,2440548940787259,平凡茉莉花
7132463406556775208,家长的态度决定了孩子的前途,0,6,0,2022-08-16 21:21:35,,105885637236,暖心的小狐狸
7132676491619975970,父母是孩子的第一任老师，孩子吵闹家子应该阻止,0,0,0,2022-08-17 11:08:42,来自湖北,82249226096,憨憨熊230
7132655320026989315,什么样的孩子就有什么样的家长[灵光一闪],0,2,0,2022-08-17 09:47:01,来自河北,98610076031,简安同学
7132733840237871911,可以把孩子带到车厢连接处，让孩子安静下来再回座位…别问我咋知道的，我儿子两岁多就跟着我们旅行，都是这么过来的，互相理解吧，孩子的成长阶段，要不咋办，，，想不被挑剔不被说闲话，就自己辛苦点儿[捂脸][捂脸],0,0,0,2022-08-17 14:52:17,来自辽宁,4300334324,叮当猫和铜锣烧
7132641870248821540,三岁的孩子都管不了了，以后长大了还了得啊,0,5,0,2022-08-17 08:54:35,来自新疆,4252541019751612,黑丫头9D9V
7132628060200993573,管不了就不要生。,11,338,0,2022-08-17 08:01:14,来自河北,101210749959,积极的画板R9
7132711314136908574,他还是个孩子，这个理由有时候真的很难让人信服,0,0,0,2022-08-17 13:24:13,来自四川,3038652111787336,听说爱情会下雪
7132657258911253251,大家不是包容不了孩子的吵闹，而是家长放任不管的态度。,0,3,0,2022-08-17 09:54:53,来自河北,98610076031,简安同学
7132397731338797864,这么激动容易,0,14,0,2022-08-16 17:06:48,来自福建,53319257940,在头条
7132698603139334953,不是不想管，确实是有的孩子不服管，即使责骂家长，也无济于事，不可能在那么短的时间里立刻制服孩子，其实争吵最没用，批评家长的也不见得能教育好自己的孩子,0,1,0,2022-08-17 12:34:25,来自黑龙江,95003900255,吃吃家常菜
7132743139667985190,此时此刻孩子消停了[呲牙],0,0,0,2022-08-17 15:28:10,来自辽宁,51712363497,a鳳138765704
7132705380488594188,管不了就直接从火车上扔出去,0,1,0,2022-08-17 13:01:26,来自江苏,109039701543,天涯浪子1332
7132682539802149667,等孩子长大后，回想起这一幕，会怨恨家长当时为何不批评和教育自己，会为家长这般无理而感到羞愧！,0,1,0,2022-08-17 11:32:05,来自河南,4420449168274190,认真学习好好做事
7132696050426872611,这种父母以后还得兜着走！,0,1,0,2022-08-17 12:24:22,来自贵州,69757950778,yll云游四方
7132728493129515817,熊孩子的背后往往有熊家长的推波助澜！,0,3,0,2022-08-17 14:30:35,来自江苏,1399015508819655,松竹梅
7132708251330167559,当着孩子面前吵架就有素质了，孩子怎么看，怎么想,0,0,0,2022-08-17 13:12:09,来自新疆,93267130934,游泳的海豚315
7132721295167079203,熊孩子背后就是熊家长，家教最重要,0,0,0,2022-08-17 14:02:37,来自河北,6332465969,认真看条头
7132670910922146590,熊孩子的背后的确熊家长[打脸],2,84,0,2022-08-17 10:47:23,来自黑龙江,5979683809,农村瓦西里
7132726132545897246,我儿子从不到一岁，就该跟着我满世界逛，他知道要融入环境，尤其公共场合，大声说话会打扰别人，别低估孩子的适应性，只是大人任性而已,0,1,0,2022-08-17 14:21:54,来自吉林,3140639677485517,Amethystal
7132730512321807140,三岁孩子，差不多已经在上幼儿园了，家长还是可是安抚下来的吧！,0,1,0,2022-08-17 14:38:50,来自四川,2159040076452883,LL六六呀
7132695670863102732,全国人民都要认识她了,0,1,0,2022-08-17 12:23:29,来自上海,52139226621,正宗苒儿编制绳子手链
7132687652537025280,高铁上不许外放，乘警服务员应该管理，别不作为。,0,0,0,2022-08-17 11:51:49,来自北京,78053660204,mary1972
7132693614190166824,高铁上应该友情提示，“请勿外放声音”这样会好很多！现在公交车上都有提示！,0,2,0,2022-08-17 12:14:51,来自陕西,64629934657,快乐的枫叶818
7132715488953991951,这种家长目前在国内是多数,0,0,0,2022-08-17 13:39:53,来自上海,55370372722,多彩星空T
7132697763842343695,这种家庭应该曝光,0,2,0,2022-08-17 12:31:03,来自湖南,5881071127,D下下
7132686674492261159,这个妈妈是在教孩子，将来如何对待自己[捂脸][捂脸],0,2,0,2022-08-17 11:48:37,来自山东,5259395548,于丽书法
7132684793921815330,我孩子也很牛，但是公共场合我会经量依着娃娃，不闹就好,0,3,0,2022-08-17 11:40:49,来自广西,1148339088532701,敏锐庄河6P7
7132711473537286951,小孩子怎么了？小孩就不管了？人品问题,1,2,0,2022-08-17 13:25:24,来自广东,276682163101293,開朗的網友
7132702354675548943,没有乘务员来调解的纳闷[抠鼻][抠鼻][抠鼻],0,0,0,2022-08-17 12:48:52,来自广东,2699997117680495,知情达理星球3ET
7132672735951700776,有人收拾他们,0,4,0,2022-08-17 10:53:57,来自上海,3780809117,zzz26348603
7132712711578403597,这样的妈……,0,0,0,2022-08-17 13:29:41,来自浙江,102728321047,兰若
