7132685626427949859,日期，座位号加上时间的话就能精确到人了。再加上12306等网站的易破解，其实大家知不知道只要你在公共场合其实你就在裸奔呢。不要忘记那么多网暴致死的案例。公共场合做个文明人是对自己好。,0,1,0,2022-08-17 11:43:57,来自广东,1367387212092215,芭比123Q
7132373610576347915,连家长一起处罚，他们下次就懂了。,0,50,1,2022-08-16 15:34:12,来自贵州,56351574071,JXG5
7132670021549359883,发现很多家长疏于管教孩子，那怕孩子做错了也不知理亏。建议增加鞭刑，惩罚那些做错事不思忏悔的人。,0,0,0,2022-08-17 10:44:10,来自河南,52685716633,神奇小超人
7132684711775929101,寻衅滋事，抓,0,0,0,2022-08-17 11:40:42,来自河北,22124,请叫我老天堂
7132684360087896867,放心，会被社会教育的,0,1,0,2022-08-17 11:39:05,来自湖北,105130085634,谁把我的畅想注册了
7132697253277451046,那周围的也公放，大家都听不成,0,0,0,2022-08-17 12:29:36,来自北京,5732975416,哈库那玛塔塔w
7132691877526389504,有人会教育他的，多的是这种人[泪奔],0,0,0,2022-08-17 12:08:08,来自湖南,4183800213,窑砖7533w
7132696335295841039,天大地大老子最大。哈哈,0,0,0,2022-08-17 12:25:26,来自山西,17168135280,两个人的烟火188954544
7132694543031862030,这种不用去管，反倒可以告诉小朋友，声音可以再放大一些[机智],0,0,0,2022-08-17 12:18:58,来自广东,76325988757,超级小泉子
7132671365496881961,高铁上确实能碰到素质低下的人，他们表现在各个方面比如说…………,0,0,0,2022-08-17 10:48:48,来自山东,82599539435,l孤狼归来
7132662591742018319,家长啥样孩子啥样 坐高铁时候最讨厌小孩叫，父母要言传身教！,0,12,0,2022-08-17 10:14:31,来自安徽,3139962318,豸獬说法
7132642399440487176,子不教父母之过！,0,8,0,2022-08-17 08:56:51,来自黑龙江,342676727413623,极客戴利9w5
7132688981090779935,素质，是摆在现在这个人面前的一座大山！,0,0,0,2022-08-17 11:57:13,来自黑龙江,79336131803,嘉菲旭
7132697990036407081,一家三代人证明一代不如一代，几代人管不了一个孩子，长大后肯定该公安局管[撇嘴],0,0,0,2022-08-17 12:31:50,来自湖南,158746339708223,乐天派桃子3N8
7132682296699814693,小区里好多孩子白天黑夜在健身场地大喊大叫，奔跑骑车乱跑，暴力使用健身器材，乒乓球案上蹦跳踩跺，大人就在跟前，不管。这样的人太多了，太气人了。,0,0,0,2022-08-17 11:31:30,来自河北,62478278427,zmfn789987
7132687830299869992,太好了 就这样 以后这孩子会有社会好好教育的,0,0,0,2022-08-17 11:52:30,来自安徽,71898071296,SoulJL
7132702264631788299,家长嘛德行孩子嘛德行，我儿子在外面就没吵闹过，没撒过泼，感谢我媳妇儿教育的好,0,0,0,2022-08-17 12:49:04,来自北京,3227770994307149,我在地下停车场
7132687908473438991,这下好了，绑网络上了。,0,0,0,2022-08-17 11:52:49,来自湖南,3522822623,淡泊自然哥哥
7132735082309239559,孩子犯错了很正常，主要看家长处理方法，我要是乘客不管孩子闹成啥样，只要这家长一直再管，我都不会发火，主要是这男的太不像话了，自己还是个男孩儿就别生孩子，典型的上梁不正下梁歪,0,0,0,2022-08-17 14:56:28,来自江苏,4217359349842795,健康密山47
7132698655219811086,孩子的素质取决于家长的素质 ！家长孩子教育第一老师,0,0,0,2022-08-17 12:34:49,来自浙江,96011403824,才思敏捷的美食探店
7132673033466757924,说得对，孩子进入社会，社会会狠狠的教育他，她在害自己的孩子,0,1,0,2022-08-17 10:55:44,来自广东,2167886875999694,般若正观与四禅八定
7132695014043370278,管不了，以后也给别人管的[捂脸][捂脸][捂脸],0,0,0,2022-08-17 12:20:41,来自海南,108168188544,绝狼之吻
7132698558390092584,这小孩的父母真牛逼牛逼牛逼，就这样教小孩，小孩长大就是栋梁[捂脸],0,1,0,2022-08-17 12:34:09,来自重庆,65718311849,yaxiong砥砺前行守得云开
7132696023322968839,孩子调皮，是我的话，上老虎凳，灌辣椒水。,0,0,0,2022-08-17 12:24:35,来自四川,101005306255,骑士2号679
7132714413148717865,看来这家长从小就受过良好的教育 公共场合就是自己的家 同样孩子也受过良好的教育。为这样的家长点战,0,0,0,2022-08-17 13:35:49,来自湖北,1767616770749518,跟着老
7132684548949230347,有的人从来不觉得自己是错的,0,1,0,2022-08-17 11:40:36,来自山东,93099618442,袖里谦堃
7132698710387475241,自己孩子管不了，还这么嚣张。,0,0,0,2022-08-17 12:34:39,来自江苏,110077836779,趣数
7132679962737427213,有什么样的家长，就有什么样的子女！,0,0,0,2022-08-17 11:22:19,来自浙江,86464112166,心不动于微利
7132724126716265251,公共场所不要大声喧哗，不要使用外放音箱，不要抽烟，不要随地吐痰,0,0,0,2022-08-17 14:13:34,来自湖南,92498028222,蒋立言
7132691338989994756,会生孩子不一定会带孩子更不一定会教育孩子,0,0,0,2022-08-17 12:06:45,来自广西,109856257325,666我爱我大中国666
7132697837837665024,三岁的孩子不懂事，三十来岁也不懂事。这孩子要毁在父母手上！,0,0,0,2022-08-17 12:31:12,来自内蒙古,55497509093,一叶一青山
7132696567382901508,咱不能欺负孩子，但可以让孩子亲眼看着抽他爸一顿保证怂娃今后不再犯，真的,0,0,0,2022-08-17 12:26:54,来自加拿大,83055335526,jps1071
7132699559523812134,把一个3岁的孩子哄好挺难的 技术活 哄不好咋办 捂死么 没必要的事 各有各的情绪,0,0,0,2022-08-17 12:38:23,来自新疆,2493305768646286,菇凉走你
7132725076172702498,公共场所大声喧哗 应该立法,0,0,0,2022-08-17 14:17:18,来自山东,3756356288913516,实在达西5J
7132690464855327503,乘务员没有尽到责任，乘警应该前来警告或制止。,0,0,0,2022-08-17 12:02:41,来自山东,55711088010,依番兄弟
7132711984663102244,熊孩子必有熊家长！打娃不如惯娃，哈哈。漂亮！,0,0,0,2022-08-17 13:26:41,来自陕西,51351469595,花开两朵丶天各一方
7132688434988532512,到时候就有人管了。,0,0,0,2022-08-17 11:55:37,来自辽宁,94420809530,甲午之之春
7132687130178503465,“小孩子高铁开外放声音大”，没有读懂，请赐教。,0,0,0,2022-08-17 11:49:51,来自四川,68515191860,挑灯看剑213302951
7132729935562834700,我干餐饮的，这样的家长和孩子太多了，我们都是强忍着不做声！,0,0,0,2022-08-17 14:36:43,来自天津,50887257065,小土60
7132706487889068840,这个跟服务员提醒孩子踩到餐盘那位激动的母亲是一个人吗？咋感觉这么像呢,0,0,0,2022-08-17 13:04:39,来自河南,52180823070,sunny铆金刀
7132702793282306856,孩子家长的言行说明平时娇惯出来的熊孩子，自己熊家长,0,0,0,2022-08-17 12:50:31,来自江西,93427642612,达达2328
7132690519838802701,熊孩子必有熊家长,0,0,0,2022-08-17 12:03:30,来自北京,105805903808,悟空吃素
7132712062417322784,孩子从家长心情不好，这才是导火索吧,0,0,0,2022-08-17 13:27:21,来自广东,4002639576316919,健康苹果9Q5
7132724557001032448,就这样的家族，孩子坑定不听话,0,0,0,2022-08-17 14:15:01,来自新疆,110101309344,蹭脚猫
7132699340812124940,不仅打扰别人，长大后骚扰自己,0,0,0,2022-08-17 12:37:43,来自广东,92653717117,花卷儿的成长日记
7132700315169637160,以后公共场所应该搞个卖静音耳机的项目，他们就不吵了。,0,0,0,2022-08-17 12:40:44,来自浙江,3157408642247423,湖州哈雷
7132715118152073999,父母不管教，长大后会有人教育他[抠鼻],0,0,0,2022-08-17 13:38:28,来自北京,60164483558,室内设计张戈
7132673704152580900,日本的《轻犯罪法》中国真的应该借鉴一下,0,0,0,2022-08-17 10:58:10,来自内蒙古,3978775732,布日古德30975573
7132669132491424523,农村有句老话：有娘养，无娘教！,0,5,0,2022-08-17 10:41:07,来自湖北,1996343484099035,天天向上wyj
7132687068207334180,和你争吵的永远是同路人。[呲牙],0,0,0,2022-08-17 11:49:49,来自山西,3544436390241432,商为6895
7132688649581495070,孩子而已，没必要吧,0,0,0,2022-08-17 11:56:01,来自河北,100776033418,云少帅爱做菜
7132691423362827044,这样宠溺孩子，总有你吃亏的时候吧[看],0,0,0,2022-08-17 12:06:39,来自云南,110389659798,Lemon119713
7132742237594944290,下车可以拘留了,0,0,0,2022-08-17 15:23:43,来自山东,5780713202,杨军64590819
7132729676233278249,有因必有果，以后他会后悔的。,0,0,0,2022-08-17 14:35:03,来自安徽,3660008196,你成功的忽悠了我
7132692019386417950,赶紧搞一个儿童专用车厢吧！求求了！,0,1,0,2022-08-17 12:09:20,来自北京,105805903808,悟空吃素
7132688177785324321,要不忍，要不干,0,0,0,2022-08-17 11:54:30,来自河北,3738806945588611,大气远山HY
7132696314693337868,自己还把口罩摘了，生怕全国人认不出她[泪奔],0,0,0,2022-08-17 12:26:09,来自广东,53115363718,隔岸的猪
7132722463309529886,孩子小就应该教育，从小培养素养。家长这种叫嚣对孩子影响不好。,0,0,0,2022-08-17 14:07:26,来自广东,72288998404,通理哥
7132700434137334564,我想知道有多大声？大到忍不了,0,0,0,2022-08-17 12:41:47,来自北京,64137299363,笨霸波儿二
7132723738579469068,这不由让我想起，多年以前，去北京旅游，我看见一个孩子朝公园景区湖里小便，就说他不应该，结果他母亲过来大骂我。,0,0,0,2022-08-17 14:12:50,来自广东,1099964188998532,康乐
7132690732372017955,这样的家长有这样的孩子正常！,0,0,0,2022-08-17 12:03:39,来自北京,13899661865,Isoprime100
7132669452063752973,道个歉就可以了，人家提醒或许打扰到了，干嘛那么僵,0,1,0,2022-08-17 10:41:51,来自海南,2097516209508396,三亚独行
7132682362311197476,出名其实也很容易，不是吗？！不过有臭名和美名的区别[可爱][可爱],0,0,0,2022-08-17 11:31:36,来自湖北,95478436594,老E100
7132690728102642467,没打码。很好,0,0,0,2022-08-17 12:03:49,来自四川,6404919637,容我醉时眠z
7132731259612316420,让这个孩子长大，让监狱去管,0,0,0,2022-08-17 14:41:54,来自广东,61163732212558,销售管理与内训师训练
7132670748732900131,好孩子👶🏻，好家长[吐血][吐血][吐血],0,17,0,2022-08-17 10:46:24,来自北京,71085107156,我是南漂农民工
7132741305138578191,这都是大人的关的事，别说三岁，几个月的婴儿都知道，婴儿饿了会[我想静静]，你味点奶他也不会[我想静静]。,0,0,0,2022-08-17 15:20:13,来自新疆,690134973689677,聪明鹿泉3C
7132737314211595048,这种维护孩子是慢慢在要孩子命,0,0,0,2022-08-17 15:04:31,来自山西,4309713707607006,心静则清
7132733492975813407,这样的家长和孩子也应该 限制上高铁,0,0,0,2022-08-17 14:50:16,来自吉林,528217850519383,实在贺州0H9
7132378160473670439,应该鼓励小孩声音再开大些[尬笑],0,11,0,2022-08-16 15:51:58,来自江苏,81911410775,苍石林
7132669804636455695,这样教育出来的孩子，长大了让他打自己的父母，让他父母吃苦头,0,1,0,2022-08-17 10:42:30,来自浙江,2928730752943543,认真戴利0x1
7132679255116809000,现在高铁上外放太多了，乘警就是路过说一句，然后就没有然后了，戴着降噪耳机都还是能听到外放的声音，这就是目前的主流素质水平吧！,0,1,0,2022-08-17 11:19:21,来自贵州,6069738937,米兰球迷徐建林
7132688378071794463,孩子长大了，就和他爹妈一样。,0,0,0,2022-08-17 11:54:59,来自贵州,6978966936,碧水野钓
7132720160191939332,这是在伤害自己的孩子,0,0,0,2022-08-17 13:58:43,来自四川,110360244270,建国77587
7132636196219536162,[灵光一闪]很有素质的一家真好。,0,7,0,2022-08-17 08:32:09,来自江苏,108720330632,多才多艺王大金
7132688353509901088,这个世界上有耳机这个东西。[捂脸],0,0,0,2022-08-17 11:55:14,来自湖北,3522665890,青山云作伴
7132693837344539399,别管我有没有理，我声嘶力竭声音大就是理,0,0,0,2022-08-17 12:16:21,来自河南,5829935679,龙虾糖
7132696448982385448,高铁直接把这对母子拉黑永久不能坐高铁,0,0,0,2022-08-17 12:26:00,来自天津,105235833901,sfiq
7132684174142046983,公众场合声音大确实影响别人！家长应该懂得改正！,0,1,0,2022-08-17 11:38:43,来自山东,606571737132510,Rose生活
7132701047210148644,无赖可以遗传，一赖传十代……家风如此,0,1,0,2022-08-17 12:44:00,来自北京,3944672841434075,混日子126
7132707648353010472,有其父母必有其子，其子危矣。,0,0,0,2022-08-17 13:09:34,来自浙江,1626901687579774,喜庆的饭团k0
7132674315010507555,挺好，大家都来鼓励鼓励这孩子，再接再厉，争取来个大的,0,1,0,2022-08-17 10:59:56,来自河北,3897887768,158白怼怼
7132741236721091340,一岁以下的管不了，3岁的能管了,0,0,0,2022-08-17 15:20:50,来自山东,3091461400441036,一直随心可好
7132690683218887461,熊到一窝了,0,0,0,2022-08-17 12:03:45,来自北京,105805903808,悟空吃素
7132679188062372648,让她继续纵容一成孩子吧，被纵容成熊孩子后，在往后的日子里必会遇到更多麻烦，但愿这熊孩子出门在外能平安长大。,0,0,0,2022-08-17 11:19:05,来自四川,64482105132,長疆vOWX
7132699680944898852,小孩不舒服吵闹一下还能理解，他这不是身体不舒服，而且影响到别人了，平常是家长惯的了,0,0,0,2022-08-17 12:38:47,来自广西,369041115974398,点点空星
7132699660874941188,父母是孩子的第一个老师，如果不从小培养好的素质，长大了不一定会惹出多大的事来。,0,0,0,2022-08-17 12:38:46,来自内蒙古,4495274589825171,幸福南宁1R5
7132741599163302697,对吵闹不停且不听劝的建议下一个停靠站赶下去,0,0,0,2022-08-17 15:21:21,来自湖南,2955105067339616,天天喊改名字真烦
7132705891652420360,家长的责任大！！这样的家长教育不出好孩子来！不用大声喊，有理不在声高，事实胜于雄辩！,0,0,0,2022-08-17 13:03:02,来自河北,3003481290969523,否极泰来zls
7132736240336012066,老实说，孩子吵闹家长也烦，多一份容忍，养过娃儿的都能忍，希望那自以为自己有理的永远都不要娃儿,0,0,0,2022-08-17 15:00:32,来自四川,94985125101,驫騳马413
7132695309331022595,在地铁上也是，声音外放不自觉的人非常讨人厌,0,0,0,2022-08-17 12:22:10,来自四川,5788062198,Mrx64982283
7132729161273574180,禁止喧哗，文明乘车,0,0,0,2022-08-17 14:33:32,来自江苏,111026590042,吃鱼567
7132685819558576931,这比孩子吵的欢,0,0,0,2022-08-17 11:44:33,来自辽宁,171137856710391,幸福在招唤
7132697648213197576,吵闹就是幸福，安静就是压抑！[捂脸][捂脸][捂脸]这种文化要向全世界输出？,0,0,0,2022-08-17 12:30:51,来自浙江,2576866916704040,禄因忌果
7132713367466509090,也是小题大做，不见得他就多有规矩！,0,0,0,2022-08-17 13:31:40,来自云南,65036997992,老伯209091649
7132675126978167585,家庭教育很重要，社会的毒打会让孩子体无完肤,0,1,0,2022-08-17 11:04:14,来自辽宁,4699577638,有影想
7132676347533198121,拘留几天就老实了,0,1,0,2022-08-17 11:08:05,来自北京,110743709452,Liweidong800212
7132739335665074959,那么多人，有吵的功夫，不如管好自己的小孩[捂脸],0,0,0,2022-08-17 15:12:34,来自新疆,1710469556212749,小戴sir7k5r
7132682129880384260,每一个熊孩子背后都有一个或几个熊家长[打脸][打脸]孩子毁了,0,1,0,2022-08-17 11:31:19,来自福建,99056021268,自信柠檬666p
7132742402095907584,不能因为是小孩就得一车人来忍受，这已经是属于扰乱公共秩序了，得有法律来限制了,0,0,0,2022-08-17 15:24:30,来自湖南,2955105067339616,天天喊改名字真烦
7132684347136017193,能否给带幼龄儿童的乘客，提供专用车厢，避免影响成人车厢的同时，可在幼龄专用车厢提供贴心服务和用品，也可以帮助到家长。乘客买票、订票时就可识别安排车厢。,0,0,0,2022-08-17 11:39:09,来自海南,55279102582,细思极牛逼
7132710666246816552,他们的儿子是大家的……,0,0,0,2022-08-17 13:21:16,来自江苏,1957589651300989,其乐融融原野0w8
7132669219380658957,伟大的母亲～,0,0,0,2022-08-17 10:41:01,来自安徽,72330929478,牧媱papi
7132701263628059407,家长做的对，多鼓励鼓励！,0,0,0,2022-08-17 12:44:39,来自内蒙古,55497509093,一叶一青山
7132700596347339558,三岁孩子，你们什么样,0,0,0,2022-08-17 12:42:28,来自安徽,62501616912,一个厨子的生活
7132719531365319464,后悔的机会多的是,0,0,0,2022-08-17 13:55:37,来自湖北,102162335333,农夫三拳有点疼7632
7132672050506384162,这位家长真不知道什么是言传身教，人的一生三养很重要，教养、素养、涵养、教养是最主要的，一个人从小的教养决定了长大对社会的正确认知，也就是社会上说的嚣张跋扈或者犯罪……,0,0,0,2022-08-17 10:51:23,来自陕西,118357915090552,智慧汤姆0M0
7132681402012926756,一个巴掌拍不响，那男的肯定也没好好说，那女的更没得说了，心平气和说说就过去，天热都火气大，再说一个南方人和一个北方人碰撞！,0,0,0,2022-08-17 11:28:06,来自北京,96335687216,阳光健康的贲童
7132706217520169769,这位母亲做得对，因为她的孩子正在成为下一个像她一样被所有人唾弃的人,0,1,0,2022-08-17 13:03:47,来自重庆,85642646333,太古牛鼻
7132693271750591240,[泪奔]管不了就扔了吧,0,0,0,2022-08-17 12:13:59,来自广东,50597130373,Sunny保罗
7132670076339602217,要我，就站她旁边，声音开最大,0,1,0,2022-08-17 10:43:43,来自北京,50718483404,斯蒂芬银
7132690211289088800,现在有些家长不管对错，太护着自己孩子了，真不是好事！,0,1,0,2022-08-17 12:02:41,来自河南,98011281120,伊人艾美
7132718293042987812,就是知道自己不对也不会认错的。别人就是说不得，这种人到处都是。,0,0,0,2022-08-17 13:51:05,来自广东,2902304196402222,舒韦
7132679483651654441,不给坏人打马赛克是进步……[赞],0,1,0,2022-08-17 11:20:11,来自广东,111261360307,风中烟缸
7132671063221453608,在外面不是你家里，要搞清楚,0,1,0,2022-08-17 10:47:27,来自湖南,2356956674131239,才高八斗书签Rq
7132686005425242880,一切都有回报的，不用急。长大就知道了。,0,1,0,2022-08-17 11:45:26,来自广东,1336601709123304,辉安说
7132725637500388133,如果有素质，就不用怕别人动不动拿素质说事了，对不对！[再见],0,0,0,2022-08-17 14:19:57,来自云南,11427561892,夏云帆Z
7132671154602509097,厉害的老妈👍🏻 这孩子也不会差 好榜样,0,1,0,2022-08-17 10:47:48,来自广东,25049594437,啊鑫26
7132693194902684428,手机开最大，放她耳朵旁边上,0,0,0,2022-08-17 12:14:04,来自广西,413062972310739,骑着电驴回家
7132685570740601636,到底谁道德绑架,0,0,0,2022-08-17 11:44:04,来自山东,63150272263,过劳肥的可爱大胖子
7132684005077680899,这孩子长大了！也给养费了,0,0,0,2022-08-17 11:38:22,来自天津,4186530584733427,墨然星尘
7132684775189431047,龙生龙凰生凰老鼠生来会打洞,0,0,0,2022-08-17 11:40:48,来自河南,4503197901136221,乐天派弗朗西斯0c5
7132737380977214222,管不了以后社会管,0,0,0,2022-08-17 15:05:24,来自浙江,4291752222,哈喽jacky
7132725828861149967,家长现在护着不教，将来社会上会有人替他教的！,0,0,0,2022-08-17 14:20:01,来自湖南,78189941748,天之蓝3998
7132713819092828964,不用管，长大了吃牢饭。,0,0,0,2022-08-17 13:34:05,来自重庆,62207527966,驿动的心
7132698459383153442,按她的意思 报警 本来是件小事 你这么嚣张就让你进铁路黑名单 以后就坐汽车吧,0,0,0,2022-08-17 12:33:39,来自浙江,325046830633326,撩谁妮
7132675043481682729,火车上有的小孩很讨厌，一直叫个没完没了，家长也不管，到处跑来跑去，乱窜乱跳,0,1,0,2022-08-17 11:02:51,来自江苏,5723731485,LeonYolo
7132738446410138400,管不了孩子，可以管大人，可以寻衅滋事罪罚款500元或拘留！,0,0,0,2022-08-17 15:10:19,来自新疆,1556542565917979,俊俏雪碧AI
7132696799039177480,最近关于几个东北的视频都不好[捂脸],0,0,0,2022-08-17 12:27:53,来自浙江,97874404861,无忖
7132685331413451551,这种人从来都没有边界感，不懂得什么是打搅他人,0,1,0,2022-08-17 11:43:13,来自湖南,96408526048,木日紫天362
7132731100828631812,素质这东西真不是富裕就有的,0,0,0,2022-08-17 14:41:24,来自山东,50242359271,一平yp
7132701034966745897,小孩的问题，根源都在大人。,0,0,0,2022-08-17 12:43:33,来自湖北,93318868149,夫子500
7132679718083920654,这样的母亲怎么可能教育好自己的孩子？,0,1,0,2022-08-17 11:21:24,来自山西,87975415170,华哥瞰世界
7132723040093504291,真是龙生龙，凤生凤，老鼠的孩子会打洞。,0,0,0,2022-08-17 14:09:13,来自美国,2418550381742327,厚德载物Eugene
7132742717658465039,这样家长真是让人汗颜！,0,0,0,2022-08-17 15:25:42,来自湖南,96671325554,悄悄对你说了
7132672448289620739,高铁不是禁止外放？,0,1,0,2022-08-17 10:53:33,来自北京,106486576500,小君君
7132702001628611369,娶到这样的女人是她老公一生的福分[灵光一闪],0,0,0,2022-08-17 12:47:33,来自辽宁,20123389802,风向北吹604
7132708354605974287,到社会上会有人替他们教育的，可能代价就比较大啦！,0,1,0,2022-08-17 13:12:09,来自山东,60986000865,魔法师阜新2S
7132710282648322851,那得看几岁的孩子了？你们都再说这对母子，真实情况又是怎样呢，会不会墙头草,0,0,0,2022-08-17 13:19:43,来自河北,3698890236,风行0110
7132683726416462626,遇到这种人，自认倒霉吧,0,1,0,2022-08-17 11:36:34,来自陕西,4138207025569540,我为大家讲历史
7132678463278138153,早晚有人替她教育孩子,0,1,0,2022-08-17 11:16:17,来自内蒙古,5428730467,含笑饮88
7132731846756221699,狗都会听话一点！！,0,0,0,2022-08-17 14:44:11,来自江苏,1156309780282787,此用户存在wokao
7132674943426609954,遇到过，十分讨厌，家长不管又豪横，躲又没地方躲，有其子必有其母。,0,1,0,2022-08-17 11:02:32,来自湖北,68101203733,湖北西边的快乐老逗
7132706447783314179,这家孩子是人类行为能力实验品，把他家和学校挖出来给他做记录，看他这辈子往哪个方向走！,0,0,0,2022-08-17 13:05:18,来自山西,1846797237760604,阿优杂记
7132673067825972002,这事坏在3个字，怎么了？我就恨这样说话的人，不怎么，我就不让你怎么，怎么了？,0,8,0,2022-08-17 10:55:09,来自浙江,103012067699,团团他阿爸
7132682728776139535,有一种觉得叫做我觉得[灵光一闪],0,1,0,2022-08-17 11:32:40,来自上海,804430750680028,上进的溪水Mc
7132376853373010696,孩子是啥样子就看家长好了。,0,20,1,2022-08-16 15:46:12,来自广东,157934719863431,正大光明湖泊lZ
7132735382931948327,我就见过在高铁火车上哭的小孩，有的小孩是越哄越哭,0,0,0,2022-08-17 14:57:55,来自天津,16030400010,多瑙河的妖精
7132703667647742757,以前坐高铁觉得挺安静的，最近也不知道怎么了，越来越炒了，请看好你们的小孩，小声点,0,1,0,2022-08-17 12:54:22,来自浙江,102575179585,一刀一个小鹏友
7132691958547464968,老话说得好，三天不打上房揭瓦,0,0,0,2022-08-17 12:08:48,来自山东,105191991783,西瓜小德
7132706480565863203,公共场合，外放声音小一点，不要音影响别人。,0,0,0,2022-08-17 13:04:48,来自广东,51898141193,东都校尉
7132687492548969252,孩子都是跟家长学的,0,0,0,2022-08-17 11:51:34,来自北京,105781936103,骑着毛驴追着光
7132690006657057572,熊孩子都是熊父母培养起来的,0,0,0,2022-08-17 12:01:26,来自陕西,1768442853332063,清爽溪水8Y
7132735445254816520,什么叫礼崩乐坏，这就是，这就是无理闹三分,0,0,0,2022-08-17 14:57:48,来自湖北,105220283418,老枪768
7132688180931232545,没有熊父母，哪来熊孩孑[祈祷],0,1,0,2022-08-17 11:54:42,来自广东,4283326716721340,洽洽之舟
7132701747792970500,人不到死的前一刻是不会认输的,0,0,0,2022-08-17 12:46:52,来自河北,111233945674,自强不息逆光奔跑
7132678419439272712,吵架赢了，孩子完了,0,1,0,2022-08-17 11:16:28,来自浙江,111263762602,义梅道人
7132693918588289822,这不是爱，而是在害！,0,0,0,2022-08-17 12:16:40,来自四川,50804198648,周G2
7132683263235752715,林了，大了，什么鸟都有。,0,0,0,2022-08-17 11:35:47,来自山东,9043306022,大海的声音56
7132686276121232142,熊孩子背后，一定有一家子熊家长。[打脸][打脸][打脸][打脸][打脸][打脸],0,0,0,2022-08-17 11:46:41,来自河南,3518070659494478,用户老纲
7132677141229355790,有一种情况，如果家长也在严厉地管熊孩子但熊孩子就是管不住，该怎么办？,0,0,0,2022-08-17 11:11:41,来自江苏,105133574506,Heger204
7132713914701251359,各种职业都有被培养的成分，包含囚犯,0,0,0,2022-08-17 13:34:08,来自云南,5917874999,小铃铛爱旅游
7132726969082331904,善恶有报，这样的家长和这样家长教育出来的孩子，没有一个会善终的！,0,0,0,2022-08-17 14:24:25,来自山东,106485323770,萝卜兔文化传媒
7132687397921784613,开窗户把孩子扔出去看他说啥！,0,0,0,2022-08-17 11:51:17,来自上海,4037840222823720,勇者阿萨4d3
