7132771830641279776,60岁过大寿？那么66岁过不过呢？70岁过不过呢？80岁过不过呢？,0,6,1,2022-08-17 17:19:15,来自吉林,102955979972,王眼球语文2077
7132775779939255047,主人家真有心了[赞][赞],2,17,0,2022-08-17 17:34:35,来自四川,3891917428623784,小英姐Vlog
7132814022835258148,听到60说是大寿，感觉内心不能接受。有没有和我一样的[呲牙][呲牙],3,29,0,2022-08-17 20:02:33,来自四川,86663882604,我的哥儿
7132700652136547072,节能减排，从当下做起,1,10,1,2022-08-17 12:42:15,来自江苏,2612038098234462,一蓑烟雨气自华
7132759785036530443,我老公他哥，上个月还过40岁大寿，特地叫我们过去吃饭[泪奔][泪奔]，叫我早点过去帮忙做菜，我问他什么日子:他说他过40大寿。当时听的我无言以对,5,6,1,2022-08-17 16:32:46,来自广东,3012310090913054,给我一张床
7132491850636051234,60大寿？？？？好年轻的老人哟！,45,561,2,2022-08-16 23:12:22,来自重庆,5743727562,mkrfgy
7132762657471857421,为什么不等天气凉快点再办？,6,14,0,2022-08-17 16:43:39,来自湖北,57949173452,喝不醉19
7132740361126495016,为了办这个酒席也是拼了！,2,27,0,2022-08-17 15:16:34,来自上海,54474150972,悠闲枫叶L7
7132747694103659279,六十最好不过，有一个说法是给阎王爷报信呢！另外又多少生命被杀死,1,9,0,2022-08-17 15:44:57,来自北京,53896119515,安宁因为信任所以靠近
7132500991995757327,我怎么觉得60岁不是老人 在我眼里80岁才算老人[捂脸]我爸妈70了，我觉得他们还很年轻 。,58,484,3,2022-08-16 23:48:07,来自广东,1024384468782619,芝紫花
7132451751613629196,露天空调[笑哭][笑哭][笑哭]绝对土豪啊,31,344,3,2022-08-16 20:37:01,来自湖南,3447675740758367,不穿袜子的精灵
7132750426105447204,现在疫情这么严重还聚会？,2,0,0,2022-08-17 15:56:01,来自四川,110997824126,耶律清云
7132477500881486631,拆完怎么办？回收？,9,51,1,2022-08-16 22:16:40,来自吉林,52035920195,云水禅心666888
7132737766324388612,过去人的寿命短，平均50多，所以过去人都讲究过60大寿，如今人均寿命都79岁了，平均寿命延长了20年，所以我感觉到了80岁以上过寿合适，60岁真不老，没必要过60大寿，60岁大寿个什么呀,0,1,0,2022-08-17 15:07:22,来自陕西,1662064344439064,茉莉花0160
7132750501992891151,还不如去酒店摆酒席，省事、省人力、空调设施齐全，服务周到，叫台公交车一车开去！,2,1,0,2022-08-17 16:00:50,来自湖南,3963056719672416,涅火重生衡阳
7132458506766746401,为什么不直接去饭店啊,66,111,3,2022-08-16 21:03:25,来自山东,3145404920,叮叮家的猫
7132698160232973071,农村家里宴席的好处就是左邻右舍的年纪大的腿脚不方便的也能过来吃席，如果去饭店，这些80多岁90多岁老人就不会去了,2,22,0,2022-08-17 12:32:30,来自河南,1354204563116064,独一无二的率真麻酱
7132698684197946124,露天空调，这宴席吃的刻骨铭心，此生难忘[大笑][大笑],0,4,0,2022-08-17 12:35:08,来自广东,3703587913078039,郭大米
7132470856068285215,空调用完咋处理啊？,14,28,2,2022-08-16 21:50:24,来自河北,50335408204,俺从不迷茫
7132550696917926691,60就老人大寿啦😄现在80才能算老人吧[大笑]，饭店利润太高，农村还是适合请师傅上门办席，一桌几十块工钱，台凳桌椅锅碗瓢盆炉子、大帐篷空调一应俱全带来，现在连空调都是“移动式的”，主家根据师傅给的菜名、数量到菜场采购，几百块钱一桌的菜钱，抵得上大饭店小2千的标准，大师傅的掌勺水平也很高，菜品口味不比大饭店的差，，，,4,57,1,2022-08-17 03:00:17,来自江苏,2808385258,和气自然生财
7132687181722239776,60大寿，这明显就是要钱，那么年轻过什么，还大办，真是不知道怎么想的！,11,65,2,2022-08-17 11:50:49,来自河南,83321551558,一个人要开开心心活着
7132705126292259598,古代60还算大寿，现在60还没退休呢，哪来的大寿,2,38,0,2022-08-17 12:59:59,来自山东,56717275396,鹤顶红66
7132737720044159747,真是花心思了[捂脸]还好没下雨,1,2,0,2022-08-17 15:06:51,来自浙江,3712415944685437,单纯明镜Ke
7132746064133735180,走心了，看来60大寿都很看重,1,4,0,2022-08-17 15:39:09,来自山东,2375400494216509,湖北路助听器青岛
7132837444449583875,现在60岁还年轻着呢！[呲牙][呲牙],1,3,0,2022-08-17 21:33:42,来自河南,111040519381,钱金妍
7132502603615306529,主人有诚义有实力,3,23,0,2022-08-16 23:56:08,来自广东,250322343441064,钻石之地
7132632017909007111,说实话，这么热的天，除了丧事没办法，其他的事真没必要上杆子的办宴席。,9,146,2,2022-08-17 08:16:42,来自湖北,99397792019,用户爱吃瓜的路人甲
7132478692982997772,60是大寿？我们这里80老人都不过寿，说过寿就会，，，，，,11,105,4,2022-08-16 22:21:50,来自安徽,111308283034,豆豆轩仔
7132699392976913182,主人真用心了[灵光一闪],1,17,0,2022-08-17 12:37:47,来自山东,17191126682,123321题图
7132791259051311913,太惭愧，上有老下有小收入也不高，我爸快七十了，也沒给他办个寿．,2,1,0,2022-08-17 18:33:54,来自广东,5888458343,正大光明明月Lx
7132469933640467240,60岁都过寿[赞],10,84,1,2022-08-16 21:47:02,来自河南,51698640266,善解人意的太阳花
7132735873237746467,我们这里的老人80大寿才摆席，60大寿没人摆席的，因为60岁时上有老下有小，自己父母还健在怎么办？一般都80岁大寿才摆席庆生日的，自己有父母在世，不大摆宴席庆生日,0,17,0,2022-08-17 14:59:04,来自河南,6794148990,时髦钢琴5
7132751559415005959,花钱少不了。,1,0,0,2022-08-17 16:00:32,来自河北,24403652776,记录时代风云
7132737041502815011,60岁还算大寿呢，我60周岁的时候没人能知道我60岁生日的时候是2020年3月23前一天和我弟弟侄儿弟妹给我的父母去上坟，要清明了吗？我说我明天过60周岁的生日，我那侄儿说大姑明天咱们吃个饭吧，我说那我请你们吧，第二天，兄弟家的一家三口没有一个人给我打个电话，还知道我过60周岁，想想，我20几岁父母就不在了，有个哥哥十年前过世了，我的女儿还没有成家，也没给我想着，我老哥一个很卑微的早晨，自己煮俩鸡蛋，想起了自己的爹妈，心里好难过，我母亲50几岁就没了，看看这个视频，人家的老人60岁，儿女多，孝顺，花了那么多的空调，也许有经济实力，最重要的还是在于心情，祝福，60岁寿星家丁兴旺，长命百岁,15,69,4,2022-08-17 15:03:38,来自黑龙江,52906431551,小芹3681
7132748300859523881,60就大寿啦？我好怕怕[捂脸][捂脸],0,2,0,2022-08-17 15:47:11,来自江苏,7221427133,清晖MM
7132704214467789599,这大妈一点用两个女儿,0,2,0,2022-08-17 12:56:29,来自江苏,6730708781,眼中的星辰LL
7132451540580958984,真的是天花板级别了,2,46,0,2022-08-16 20:35:26,来自浙江,17548000157,王明佐
7132737253453333279,旧社会人都短命，六十是一个甲子年，人生70叫古来稀。现在人生70是小弟弟，他才60岁做大寿，还场面搞得这么大，显然在摆阔！看完无语！,1,17,2,2022-08-17 15:04:52,来自浙江,3245393114308862,深海沉珠
7132720397325501184,60岁过什么大寿？60岁算大寿吗？,1,4,0,2022-08-17 13:58:58,来自江苏,4182174283080359,戚公杂谈
7132732822401614629,安排很周到[给力],1,2,0,2022-08-17 14:47:39,来自重庆,94124514025,村夫纪肆
7132733906851332894,40的高温天摆寿宴，确实难为了老人家的家属。不过这塑料大棚一搭，6台空调一转还真是凉快，也方便了左邻右舍相聚。,1,5,1,2022-08-17 14:51:49,来自浙江,3245353243254205,苹易敬人L
7132738391481303845,有钱任性！,1,2,1,2022-08-17 15:09:17,来自广东,3972258763,欢快枫叶xU
7132768870997852931,他们家电线受得了吗？那么多空调[呲牙][不看][吐舌],1,4,0,2022-08-17 17:08:02,来自广东,1560895089031406,广东火哥
7132700748382929677,60也叫大寿？感觉现在80以上才叫大寿，60连退休都没退休,2,19,0,2022-08-17 12:43:02,来自河北,86963108027,乖襒鬧
7132759003906032416,60还年轻的咧！[呲牙][呲牙],1,3,0,2022-08-17 16:29:40,来自河南,111040519381,钱金妍
7132838495600837387,八十再过吧！易经说过大寿就是高调的向老天爷宣布自己的年龄，担心那边会忘记？所以，不到七十还是低调一点。,0,1,0,2022-08-17 21:37:47,来自广东,3381734239119672,听秋风唱歌
7132703688552186661,为了收礼钱也是拼了,0,21,0,2022-08-17 12:54:30,来自山东,98470121936,悠悠我心岂有他人
7132760067845849896,不懂这些人，非要摆个席让别人去吃，大热天的，菜边吃边嗖,0,0,0,2022-08-17 16:32:58,来自广东,3210219417513463,哔哩哔哩干杯001
7132702354998772521,60就叫大寿，我们80岁都没有叫大寿,0,1,0,2022-08-17 12:48:54,来自广西,105071153486,打死不再追剧
7132782878865392419,60岁还很年轻呢！,0,1,0,2022-08-17 18:01:24,来自上海,111496079053,拂晓茉莉花开
7132782134913663744,说为啥不去饭店的人，你们是不懂什么叫气氛，氛围！去饭店感觉完全不一样！我农村长大的，农村办席，感觉完全不一样，亲切感，接地气，你们不懂[打脸],1,0,0,2022-08-17 17:58:44,来自西藏,62100416262,tymk
7132732887773807401,每个人都有生日，这大热天还麻烦别人，办席又得杀生，罪过，必有果报！,0,13,0,2022-08-17 14:47:21,来自甘肃,96580263728,留金岁月LZ
7132558572059280143,过个生日都这么麻烦。活了六十五也没有这么麻烦过。自己家人过一下就行了，这么热的天门也不想出，还要坐那里去吃饭，真辛苦,0,18,0,2022-08-17 03:30:48,来自浙江,105217505023,下午七八点
7132758297744261895,真没有这个必要[握手],2,14,0,2022-08-17 16:26:23,来自湖北,5781409037,545似曾相识
7132704749455262505,去饭店吃呀？,0,1,0,2022-08-17 12:58:12,来自重庆,1706043623082462,Ling奶茶
7132524492886197004,空调是租的，用完可以退，别操心了。,0,16,1,2022-08-17 01:22:29,来自湖北,86923590488,洋仔大喇叭的Vlog
7132843137441202952,上饭店不就行了吧,0,0,0,2022-08-17 21:55:27,来自山东,6038501638,琪仔吃饭
7132829031762051851,主人真用心,0,0,0,2022-08-17 21:00:59,来自江西,2295424679420120,优雅雪山1Z2
7132718379621925632,我今年也要过三十大寿，摆个十几二十桌,1,2,0,2022-08-17 13:51:06,来自浙江,3123033779738456,loseanddream167
7132455355195999011,现在60还摆啥酒，我除非活到100，可能会摆酒,17,33,1,2022-08-16 20:50:17,来自浙江,3185412273,我想吃小龙虾II
7132825407044633378,60岁现在不能算老人了，还没有退休。条件好的，朝八晚五，不好的，还要996。,0,4,0,2022-08-17 20:46:20,来自英国,3404557641057757,大张在苏
7132701294506263329,空调租赁费6.7百一天，我们这吃席也用,1,5,0,2022-08-17 12:45:02,来自浙江,3583695016,小罗威
7132702489363120926,60就叫大寿？,1,7,0,2022-08-17 12:49:46,来自四川,1085946720427235,废材废材废材
7132743830814114601,我们那挺忌讳60就办大寿的，又不是古代60算长寿了，现在80多的比比皆是才60岁办啥大寿。小时候我们那有个人办了60大寿之后没到两年就去世了，大人们就说办寿惊动了阎王爷把他收走了，不办寿把他遗忘了还能多活几十年,0,7,0,2022-08-17 15:30:02,来自安徽,3759940491033036,大虎看天下
7132642028663390991,60办大寿？我父母今年60周岁，没办，我婆婆80岁从来没办过,0,9,0,2022-08-17 08:54:51,来自江西,100327676955,人生流水
7132762335995347744,没钱想搞个二手空调都要掂量很久，从来不过生日，有钱可以任性，60都可以称之为大寿，差距啊,1,1,0,2022-08-17 16:42:48,来自安徽,3940255928689103,woshiwangyoucao
7132733735417447200,想收点礼金是真的,0,6,0,2022-08-17 14:51:28,来自河南,2603238310035232,影子正的老鼠
7132749196100797197,现在乡镇上都有农家乐，环境好，还有空调，真搞不明白这些家里办喜宴的人,0,0,0,2022-08-17 15:51:19,来自浙江,1538947561557806,豁达的小小怪
7132827938667741986,还是农村好,0,0,0,2022-08-17 20:56:00,来自甘肃,67441190395,李艳萍102
7132856438229467915,80岁还得再摆一次,0,0,0,2022-08-17 22:47:45,来自辽宁,4353665539518251,理由2020
7132700956215034635,60岁大是大寿，是叫花甲，40度高温，,0,2,0,2022-08-17 12:44:11,来自云南,3399331323058760,夕阳红1442057792762
7132751428778558238,很有心的安排！祝老人家健康！,1,1,0,2022-08-17 15:59:40,来自江苏,3698009673,扶风彧虓
7132731466253009664,要是突然停电就巴适了，哈哈,1,2,0,2022-08-17 14:41:49,来自四川,54736473779,大众双离合维修部部长
7132764202280076067,为了收寿礼，这么高温的天气这也真是拼了。,0,4,0,2022-08-17 16:49:03,来自河北,4393298682713899,杂家戏聊
7132766170914620196,60算不上大寿吧，这要是出了事故谁负责啊,0,2,0,2022-08-17 16:57:05,来自四川,848473213898228,黑码SD
7132802536909964072,真是不怕麻烦,0,0,0,2022-08-17 19:17:43,来自重庆,109679362331,子竹轩
7132814107769733900,"露天空调[笑哭][笑哭][笑哭]绝对土豪啊
过段时间，快一点了，在办不行吗",0,0,0,2022-08-17 20:03:02,来自广西,286315571346299,思妈妈3372
7132454973503292194,农村电线能不能带起来,4,13,1,2022-08-16 20:48:51,来自湖南,5485619189,资阳农民
7132758147466281769,在农村，这排场，算是大户人家了！,0,0,0,2022-08-17 16:25:21,来自湖北,98338350259,青子先生
7132766010276758279,哈哈，生活需要仪式感,0,0,0,2022-08-17 16:56:25,来自河南,110689881222,轻尘兮若草
7132762756482564896,我宴席摆了，吃不吃我就不负责了[泪奔],0,0,0,2022-08-17 16:44:14,来自湖北,1443006821708388,阳光恋冉752
7132762970958267148,六十就办寿？我七十岁父母在不做寿,0,0,0,2022-08-17 16:45:00,来自北京,52314917604,吉祥喜鹊1
7132761981727703838,"空旷炎热的环境下，不得不说这是有史以来首次伟大的创举。[呲牙]
重庆人民在火辣辣的天气里办了一场火辣辣的事儿，用火辣辣的心情品尝着火辣辣的味儿。用六台空调把六十年的生活烦恼吹散，使得40度高温的狭小空间变成一片春天。愿你岁月不老、春心永在！愿你枝叶繁茂、寿比南山！[大笑][我想静静]",2,16,1,2022-08-17 16:40:55,来自河南,2440543986261388,孤山有韵
7132722256044049190,本人今年也60虚岁，步入老年人了，咋心理感觉只有四十多岁呢！,3,2,0,2022-08-17 14:07:07,来自黑龙江,65781315485,suodd4354世外桃源
7132816686325089059,我50了都没过过生日，活到80岁就过，活不到80岁就算了[捂脸],0,0,0,2022-08-17 20:12:31,来自山东,730505312216720,简之-妮子
7132736325245010695,农村办宴席，虽然菜做工不是太精美。但是是实惠。。,1,1,0,2022-08-17 15:01:02,来自福建,104403765979,飘逸飘扬
7132730751514215207,60岁算什么大寿，刚刚退休的年龄，80岁才是真正大寿。,0,4,0,2022-08-17 14:39:56,来自福建,100103916403,林姐家的厨房
7132749036993659683,天气不好，60岁免了吧，到70岁也可以做，我也60呀，我们一家五口吃了一顿饭,0,0,0,2022-08-17 15:50:01,来自浙江,3861965429278814,好学泉妈
7132722732810797865,农村办宴席虽然环境差点，但是自己做得饭菜味道确实好，我特别爱吃。,1,4,0,2022-08-17 14:08:14,来自辽宁,3298136863809127,胜哥哥我爱你
7132458088078476043,为啥不去饭店？,6,10,1,2022-08-16 21:01:40,来自江苏,50447190238,爱读书的机器人
7132703310649672460,真的是天花板级别了,0,6,0,2022-08-17 12:53:14,来自广西,844839785887727,顺其自然302672788117
7132745528680825634,在我眼里，坝坝席是最能体现人情味的席,0,0,0,2022-08-17 15:36:32,来自重庆,104616401844,丫丫是个大侠
7132713828726850312,这才是土豪呀！真的土也真的豪[灵光一闪],0,0,0,2022-08-17 13:34:01,来自北京,945203009033779,奇妙松鼠KF
7132740436531659535,60岁，刚退休的年纪，如果档案年龄小的话还在上班，这么大的阵仗！,0,3,0,2022-08-17 15:16:47,来自山东,11814354021,不老女神nnn
7132862139001504524,叫人笑死了，60岁还大寿，我40岁过的生日，再过就80岁过了，我现在63岁了，打俩份工。,0,0,0,2022-08-17 23:10:00,来自西班牙,2612045211776957,神秘柑桔Mjg
7132648747804721920,我们村那都有专门饭店,0,5,0,2022-08-17 09:21:06,来自浙江,3682916723,德里
7132704564381319947,好多60后都说自己是年轻人，他这是闹哪样,0,7,0,2022-08-17 12:57:59,来自广东,15510840691,zwsg618
7132733266980963072,这叫与时俱进[赞][呲牙],1,1,0,2022-08-17 14:49:00,来自黑龙江,817670902514605,公输易
7132763471833891625,攀比心理人人都有，但是攀比孝敬父母，值得学习！,0,0,0,2022-08-17 16:46:16,来自河南,712954263125149,紫薯球球
7132776151051010854,我也60了，怎么觉得说“大寿”有点憋扭呢？[捂脸][捂脸][捂脸],0,0,0,2022-08-17 17:36:07,来自甘肃,85450376418,墨云贤雅
7132735489521632014,60岁就老了吗？,0,0,0,2022-08-17 14:58:00,来自山东,76432510408,yw1963
7132828067256435468,60岁就是老人了吗？！？,0,0,0,2022-08-17 20:57:05,来自江苏,63222169965,194330408
7132761640571290408,他们农村的电压可真给力，换成我们这边不可能的，即使有空调，电压也供不上一家同时6个空调用,0,0,0,2022-08-17 16:38:58,来自四川,98458717832,平安顺遂wt
7132763879939703586,60大寿？？？？好年轻的老人哟！[捂脸][捂脸][捂脸],0,0,0,2022-08-17 16:47:46,来自广西,2422966231500340,僞鎻520
7132747649102988071,又钱人实室外装空调，天花板宴席,0,2,0,2022-08-17 15:45:39,来自安徽,85980926991,北鼻默
7132823012403528463,六十就做大寿有点早，真有钱,0,1,0,2022-08-17 20:37:05,来自安徽,71959698839,信任等于零
7132473059793273639,60岁就开始办寿宴吗？,0,9,0,2022-08-16 21:59:32,来自河南,1886408170283719,爱生活的清泉jg
7132850281599058726,厉害了，现在农村不得了[赞][赞][赞],0,0,0,2022-08-17 22:23:33,来自湖北,3130999267396663,筱齐2022
7132738242549580548,现代农村人都富裕了[捂脸],0,2,0,2022-08-17 15:09:03,来自湖南,4170477186,ONLYYOU34691490
7132765851027063588,农村没空调的多了，下地干活一样热,0,0,0,2022-08-17 16:55:41,来自北京,108119245531,看破放下—妙音
7132686466341143337,我们这里好像除了丧葬，没有在家自己做的，,0,7,0,2022-08-17 11:47:03,来自江苏,64177725160,雨涵700204
7132731495907197730,相比份子钱，遭这点罪算啥？,0,3,0,2022-08-17 14:42:06,来自安徽,3025499128607279,逆风莫解意
7132622916222698276,60大寿[呲牙][呲牙],1,1,0,2022-08-17 07:41:04,来自重庆,54806457061,大学城漁夫
7132826032239477508,酷暑高温下还是那里都不去，在家吃一碗长寿面比什么都強[玫瑰][玫瑰][中国赞],0,0,0,2022-08-17 20:49:21,来自江西,6893790349,阿昆7
7132811151268184846,你的热情，好象一把火，燃烧了整个沙漠…… [捂脸][捂脸][捂脸],0,0,0,2022-08-17 19:51:24,来自山东,2620875039316221,笔剑游侠
7132733777164092168,我爸今天过生日，我打个电话回去问候一下，被告知以后生日不需要再提起了，忽略掉。,0,0,0,2022-08-17 14:51:27,来自北京,1268711831,若R初
7132848293147280158,再过几年我60那天，只想和儿子安安静静吃顿长寿面，足以！,0,0,0,2022-08-17 22:15:48,来自江苏,3796718860,懂生活的频频
7132762523296023326,这么热的天我会，办宴席的人家都好牛掰的哦,0,0,0,2022-08-17 16:43:04,来自湖南,2097516213190011,小巧玲珑喵喵
7132732514141520676,空调就是凉了自己，热了外人,0,2,0,2022-08-17 14:46:39,来自广东,77239947356,泓枢
7132812703894127371,为了回礼也是拼了,0,1,0,2022-08-17 19:57:26,来自四川,88415265100335,执着的枫叶nf
7132812570863371043,空调敞开 60一定要好横一把,0,1,0,2022-08-17 19:56:22,来自四川,110931719346,球大爷讲理
7132787515664909097,60岁还正年轻，不算老人，起码70以上才算吧。,0,0,0,2022-08-17 18:19:35,来自浙江,56649740346,茉沫沫儿
7132703570616550144,农村60岁也叫大寿,0,2,0,2022-08-17 12:53:30,来自湖北,2576852006209579,智勇双全帆船yG
7132832183597400864,这真是我看过坝坝宴最豪气的主人家，露天的空调吹的是太霸气了,0,1,0,2022-08-17 21:13:22,来自四川,60065658532,余梦儿
7132839318792061696,60办大寿？我父母今年60周岁，没办，我婆婆80岁从来没办过,0,0,0,2022-08-17 21:40:20,来自四川,4111785014593052,爱用神奇活力霜7Z0J
7132809132205392640,坝坝宴的天花板[赞][赞][赞],0,0,0,2022-08-17 19:43:10,来自四川,94878359252,笑看人生
7132827762766971679,六十岁办大寿？？？,0,0,0,2022-08-17 20:55:42,,4652261601,Coco一束米兰
7132812791957766916,别说六十，重庆满十岁，二十岁，三十岁……搬家各种酒，喜欢办的一个不落下，为什么？,0,0,0,2022-08-17 19:57:52,来自重庆,62618127704,手机用户心向未来
7132845460456915726,我家七八十岁的老人都两三个，他们都不愿意办这样的酒，，，，，， ，，,0,0,0,2022-08-17 22:04:40,来自重庆,16836984548,淡定柳叶I2
7132787712028885796,至少80才能算大寿,0,0,0,2022-08-17 18:20:35,来自陕西,105423671975,悠闲辰星OZ
7132858502573835043,好像过61的或者59的吧,0,0,0,2022-08-17 22:55:03,来自广东,98606653157,朴实小太阳
7132826248145486633,六十是大寿吗？[捂脸],0,0,0,2022-08-17 20:49:38,来自湖南,800047178189735,轻成熟路2713
7132827757461521156,露天空调，土豪呀,0,0,0,2022-08-17 20:56:08,来自广东,2010353743966303,潇潇暮雨828
7132827944158102307,哈哈[捂脸][捂脸][捂脸],0,0,0,2022-08-17 20:56:07,来自广东,4076578446516260,清风归客892500
7132723033219367714,为了份子钱，拼了,0,2,0,2022-08-17 14:09:16,来自山东,97843999946,时空穿越伴随
7132808626707710758,60花甲，70古稀，80仗朝，90耄耋，100期颐……,0,0,0,2022-08-17 19:41:47,来自安徽,52253861921,阅小海
7132829331641877285,想得很周到啊！虽然我也觉得六十还没到过大寿的年纪[捂脸],0,0,0,2022-08-17 21:01:46,来自湖南,830884654359740,桑鱼哇
7132730342217122574,卖空调的笑了[呲牙][呲牙][赞][赞],0,1,0,2022-08-17 14:37:49,来自陕西,4086231391808541,玉姐聊创业
7132756290849997600,居然有空调，这样的宴席不输大酒店,0,0,0,2022-08-17 16:19:08,来自河北,88106702777,南山草木香
7132854306722186024,生日过了自已都不知道，因为从来都不做生日，不请客之类的活动，安安静静的过好每一天。,0,0,0,2022-08-17 22:38:45,来自广东,66697756605,静风93
7132791029283128097,在四川呆6年多了，四川摆九大碗不为别的，就为收红包🧧,0,0,0,2022-08-17 18:33:46,来自四川,1525748846826104,睿智小鱼46
7132732923501249317,不能去饭店吃吗,0,1,0,2022-08-17 14:48:01,来自山东,2845149423213886,坦荡的轮船CZ
7132795023154086686,60岁怎么能叫老人？,0,0,0,2022-08-17 18:48:55,来自湖北,2787989016021421,朴实奶茶Xk
7132813892388635406,60岁怎么能叫老人呢？,0,0,0,2022-08-17 20:02:08,来自北京,5796286828,爱丽儿1888
7132698238817288992,主要是能收很多礼金，值,0,2,0,2022-08-17 12:33:22,来自山东,2137090348027095,酒肉书茶了此生
7132791718105498403,咱老家50岁都过寿了,0,0,0,2022-08-17 18:35:41,来自河南,800045821601152,风趣溪流pO
7132731649661633280,高人，能装六台空调，为什么不去饭店哪。,0,1,0,2022-08-17 14:42:32,来自山东,1187904292141600,英明果断阳光的女人
7132810992156902157,现在60的还有好多在打工欧,0,0,0,2022-08-17 19:50:43,来自吉林,3157425216568599,俊秀的秀
7132828639229772583,只是太热了,0,0,0,2022-08-17 20:59:29,来自江西,2295424679420120,优雅雪山1Z2
7132847397646238495,挺豪横的，,0,0,0,2022-08-17 22:12:11,来自甘肃,1380585091378584,用户微风
7132827765707572007,露天空调！,0,0,0,2022-08-17 20:56:20,来自广东,52378356424735,潇潇8281
7132831287295345412,我们这热天吃席就用那种大的冷风机，一边放两个，呼啦呼啦的吹冷风，还是蛮好的，也方便,0,0,0,2022-08-17 21:09:55,来自湖南,102285780415,多彩溪水Df
7132856076076286761,传统风俗能胜天！,0,0,0,2022-08-17 22:45:35,来自河北,3132342901,蒲根蒲草
7132794959933276942,40几度能去的应该都是真爱了,0,0,0,2022-08-17 18:48:41,来自北京,2907543989402029,张小磨儿
7132829716972618526,大户人家果然不一样,0,0,0,2022-08-17 21:03:17,,4301713745919703,沫沫妈妈日常生活录
7132830564713005838,大户人家[呲牙],0,0,0,2022-08-17 21:06:35,来自广西,4173400968804851,爱吃瓜的果果酱
7132844326459327267,空调就用了一天[捂脸],0,0,0,2022-08-17 21:59:47,来自江苏,1874016519072880,彼岸花
7132736485815796521,的确是新闻。,0,1,0,2022-08-17 15:01:26,来自湖北,303095960049485,thz幽幽
7132764401824301839,"减少了不必要的麻烦。
[赞][赞][赞][赞][赞][赞][赞][赞][赞]",1,1,0,2022-08-17 16:49:47,来自山东,4143434316652259,蛮子
7132701773231833856,60就大寿？太搞笑了,0,1,0,2022-08-17 12:46:34,来自江苏,2137075990398024,热情船帆Eu
7132704557037028127,只有我关心厨师会不会中暑吗？这大热天的烧锅不得热死热啊，炒菜也在空调屋里吗？,0,4,0,2022-08-17 12:57:36,来自四川,111052724760,chj何以为家
