7132631807018713897,生育下降的太快了，应该抓紧纳入医保范围，特别是山东,17,133,1,2022-08-17 08:15:04,来自山东,93581440848,乖巧钢笔td
7132622858622321441,现在那么多不孕不育，会不会跟转基因有关,17,81,2,2022-08-17 07:41:33,来自云南,96552671419,招财猫
7132497220187865896,节育手术纳入医保了没有？应该一视同仁生育节育自由。,4,64,1,2022-08-16 23:33:11,来自湖南,109278143475,阿萍94008
7132453029961712425,没有老公可以试管吗？[大笑],49,65,3,2022-08-16 20:41:17,来自广东,2198655619052616,牛牛的小老虎
7132619655986430758,人口生育率下降，国家开始鼓生小孩,5,71,0,2022-08-17 07:29:38,来自广西,53606530110,老佛要救人
7132696871944422180,没有一条对工厂做的有用,2,26,0,2022-08-17 12:28:02,来自广东,106018415438,铁山兰花
7132692147455230724,怎么鼓励的？口头鼓励？,1,38,0,2022-08-17 12:10:08,来自湖北,110956628601,皇子八号07
7132635365470995234,不结婚只要孩子，需要什么技术,2,22,0,2022-08-17 08:29:04,来自江苏,2260246815061486,掷果潘安
7132617084450095905,不是计划生育的时候了,1,21,4,2022-08-17 07:19:19,来自山东,61891418428,景色cwlu
7132649030232195847,造福无数个家庭，就应该纳入医保的。,0,67,1,2022-08-17 09:22:34,来自北京,3466122348469128,博学多才的多拉格
7132628822234776354,不是吧，五个当中就有一个不孕不育。这么高？？？不会转基因吃的吧,4,13,0,2022-08-17 08:03:43,来自福建,5464468537,真诚帆船wt
7132687424895582991,早点开'放啊，70后其实是很多是有生育意愿的，开放得太晚了。,0,12,0,2022-08-17 11:51:02,来自北京,1512523577702336,八月的猫猫
7132681861226038056,好像医保里有很多钱似的，给医保多加点钱吧,0,9,0,2022-08-17 11:29:17,来自上海,92606936750,巴布哩喵
7132636969523659553,我认为这才是抓住了推进生育的痛点，很多人想生也生不了，那不想生的人呢，你怎么鼓励也是没有用的，反而应该帮助那些想生育的人。,0,21,2,2022-08-17 08:36:08,来自广东,4594717950,科學钓鱼
7132675035965276965,计划生育基本国策，人口老龄化,0,8,0,2022-08-17 11:03:10,来自广东,21704288545,知足常乐134486951
7132647834259620645,一大半人都没医保,0,25,0,2022-08-17 09:17:41,来自浙江,58628202513,温暖晴天呀
7132639898901119781,对于有需要的人来说是刚需，进医保必定被压价，你还要看对方愿不愿意,0,9,0,2022-08-17 08:47:09,来自湖南,1855563490927384,user7871941539097
7132477047863018251,大力支持，确实经济压力太大，国家应该早点纳入医保！,0,42,1,2022-08-16 22:15:08,来自河南,3093218871,海阔天空He
7132688853168735008,可以把计生罚款还给我们家吗？,0,2,0,2022-08-17 11:57:01,来自福建,6680670686,清媒
7132695943216120613,不敢生孩子还是因为钱都被医院吧钱赚取了。所以还是从医院开刀,0,0,0,2022-08-17 12:24:17,来自陕西,3904153465,我崇拜谁我就照镜子
7132676482170340132,必须纳入医保，,0,7,0,2022-08-17 11:09:04,来自天津,5840153479,德昶农牧
7132626137142133538,鼓励生，不如善待育，善待育，不如提供住！,0,72,0,2022-08-17 07:53:18,来自广东,58738036053,何风犀语
7132667518015505188,八零九零以后该怎么活,0,3,0,2022-08-17 10:34:14,来自湖北,905597017129031,茉莉花香飘至远方
7132716976077570846,中国人也生不出来了？？,0,0,0,2022-08-17 13:45:58,来自山东,2308600531527789,zhanggaga123
7132490903105323791,看来出生率断崖式下降让国家不得已做出这种措施了,0,11,0,2022-08-16 23:08:43,来自广东,103635891843,BetterMe83654
7132765137102127905,十四亿人再减去一半都多。,0,0,0,2022-08-17 16:53:14,来自广东,5872329281,SZDDK
7132701603378905859,肯定是领导出问题了 要不然再多的人也不会入医保,0,0,0,2022-08-17 12:46:22,来自河北,3395771451326228,清新轮船BZ
7132688816329982734,医保将搞得一片混乱,0,1,0,2022-08-17 11:56:34,来自四川,1063919612078295,荷花池中药材
7132641331029689099,都不生了，你来着政策,0,3,0,2022-08-17 08:53:15,来自山东,3715984044604407,superterbo
7132641316173251332,结果晚了，生育自然低了,0,6,1,2022-08-17 08:53:06,来自广东,4011465474844893,敏锐漂流屛
7132668036506665761,医保又不是拉收桶，什么都往里扔。,0,2,0,2022-08-17 10:36:33,来自宁夏,50084144210,手机用户发表正能量
7132693723892679439,医院太黑，迟早把医保吃空，,0,1,0,2022-08-17 12:15:22,来自广东,54783855559,小丑鱼161686954
7132699994192708382,乱了，全乱了。试管都可以医保啦。但还是没人生,0,0,0,2022-08-17 12:40:15,来自贵州,1332233246082647,简单春风GF
7132706174172300036,计生专家太失职！,0,0,0,2022-08-17 13:04:05,来自广东,51424355609,韩不溜秋
7132650638596719401,本来就没人生，这些人起码想生孩子，帮忙一下，不然完蛋了,0,7,1,2022-08-17 09:28:15,来自浙江,104713892986,提剑书生一醉天涯
7132643321995428623,奖励我看不必了，只要从思想下手就可以,1,10,0,2022-08-17 08:59:47,来自广东,104747410339,深漂何同学
7132466921060533006,试管孕妈路过，前后花了接近八万，希望能早一点纳入医保,18,76,0,2022-08-16 21:35:15,来自四川,2585664997047535,是小刘啊—
7132687412253688611,国家养老，把独生子女的公婆丈母娘爹都养了，就可以考虑生俩孩子,5,22,1,2022-08-17 11:50:54,来自山东,87566239540,巴仔张春霞
7132665796127359782,"造福无数个家庭，提高生育率有帮助
纳入医保是正确的[加油][加油]",0,10,0,2022-08-17 10:27:38,来自福建,4142560058023691,薇薇逛红尘
7132630101145633576,32岁的我，等还是不等[泣不成声],7,20,0,2022-08-17 08:08:46,来自江苏,93084250263,朝气蓬勃的缤纷西柚
7132452997967479587,试管之路好几年，花了二十万都没成功，今年自然怀孕了，你跟我说可以纳入医保了[捂脸],5,41,0,2022-08-16 20:41:07,来自山东,6007341324,我在北极打溜溜
7132690742031827724,我弟34了，要了好几年娃都没有，希望赶上好政策,1,6,0,2022-08-17 12:04:35,来自江苏,105219780340,旦旦9920
7132700818868175651,把食品安全问题提上来，能好点。三个月胎停的太多了，,1,6,0,2022-08-17 12:42:49,来自吉林,53489212697,金牛座1993
7132625144496947968,生殖辅助技术确保能生出来，费用还不能过高，最好进医保。,1,12,0,2022-08-17 07:49:24,来自天津,2018300877080027,郭天喜律师
7132475196174254883,深圳一档社保，生殖科做宫腔镜都不报,11,14,0,2022-08-16 22:07:11,来自广东,4269187632,yoyo长乐未央
7132631725956104974,现在年轻人压力太大了，支持纳入医保,1,16,0,2022-08-17 08:15:37,来自山东,206320368621111,知情达理星空YL
7132496294614090526,我身边的朋友都是80后，做试管的几乎不是一次成功，花费七八万十来万的，像我们这些想生生不出来的都望而却步。要早点落实不然，八零后都没希望了,12,74,1,2022-08-16 23:29:36,来自湖南,4028209787316189,阳y阳12345678
7132691115027333926,辅助生殖技术纳入医保，为的是生育更多的孩子。可作为孩子最常用的氨酚黄那敏颗粒的感冒药，竟然不纳入医保，需要自费购买。我作为孩子妈妈特别不解。既然国家重视人口，为什么现在儿童医保范围用药越来越少！,0,2,0,2022-08-17 12:06:12,来自广东,100772419208808,巴啦啦小魔仙070606
7132699251175392037,主要是各方面成本都太高了，薪资水平跟不上，光一套房子都能熬死不少人，一旦生孩子没办法工作，一两个月顶的住，时间一长根本没有办法生活。,1,5,0,2022-08-17 12:37:05,来自江苏,101165228153,橙子C果冻
7132482510377763592,前后三次 试管 跑医院一年多时间 花费15万左右 两个男孩 马上一周岁了 就算纳入医保 也是很少一部分,1,22,0,2022-08-16 22:35:37,来自四川,1301412339788407,直爽的大陈小于
7132696448449331975,保胎都是全自费,1,4,0,2022-08-17 12:26:08,来自河北,51123455397,慧玥儿
7132648765139665664,这是好事，不孕不育现在越来越多了，好多人看不起这病。最终都离婚了。,1,13,0,2022-08-17 09:21:05,来自安徽,10611325566,好想自己努力活
7132701391147156231,独.生子女家廷父母养老.孩子成长.教育问题全免费,1,6,0,2022-08-17 12:45:25,来自山东,3642046154287448,金秋红蜜桃
7132669458698765091,这样的奖励比起生养成本来说不痛不痒,1,7,0,2022-08-17 10:41:09,来自湖北,88176508952,武汉的马吉
7132718049685553961,房价降到一万啥都解决了,1,0,0,2022-08-17 13:49:54,来自北京,2498503530006824,tete
7132665659833631521,造福无数个家庭，纳入医保是正确的[加油][加油],0,14,0,2022-08-17 10:27:06,来自福建,4142560058023691,薇薇逛红尘
7132688993032585984,同事就做的试管，经常跑医院,1,1,0,2022-08-17 11:57:05,来自安徽,97878423721,周三三的vlog
7132408549648401164,这是个好消息，太感谢国家了,2,45,1,2022-08-16 17:49:23,来自北京,103756347603,才思敏捷旭日Ze
7132699438535443214,不敢生，不想生，害怕生！[送心][送心][送心],1,2,0,2022-08-17 12:37:56,来自四川,53072503089,HOME日行一善
7132653016548705061,我有俩孩子，我现在感觉到来自孩子教育问题的压力最大，体现在时间上、心理上、财政上。,3,10,1,2022-08-17 09:37:55,来自山东,2735182013531644,我就是静
7132679547648656163,想生的生不了（70，80后），不想生的使劲催(90，00后)[酷拽],1,10,1,2022-08-17 11:20:28,来自湖南,5822337696,毛毛虫
7132598450230657827,医保也是自己的钱[流泪],1,14,1,2022-08-17 06:06:25,来自广东,4006273467557563,壹心分享Yx4D
7132625736250278660,好多人想生的生不了，试管费用高，这真是个好消息，对国家开放三胎是有利的,1,18,1,2022-08-17 07:52:15,来自湖北,3764361820117325,6号战略
7132456963841245985,广东一线城市都没纳入,2,20,1,2022-08-16 20:57:04,来自广东,111499888473,不必太当真姚
7132698602837050143,孩子可以生，孩子妈退休了，国家负责发养老金，可以吗？孩子妈用青春为祖国抚育希望，祖国为孩子妈免除后顾之忧。年纪大了再生育，质量也堪忧！好福利还是给年轻人比较合适,0,2,0,2022-08-17 12:34:39,来自江苏,3049482646,no专业小厨娘
7132680057121719044,我给宝宝办出院的时候，前面那位大哥刚生二胎，男孩，大宝也是男孩，明显感觉喜悦中透露出一丝苦闷，未来都不知道得多拼，才能把这两个孩子搞成家！,0,2,0,2022-08-17 11:22:55,来自安徽,52253861921,阅小海
7132632131657958174,建议大家都保留截图！,1,6,2,2022-08-17 08:16:48,来自北京,70629604206,乐观的苹果r1
7132676471705207586,写得真好[赞][赞][赞],1,1,0,2022-08-17 11:08:31,来自山东,2678845534921688,花自迎风
7132675776754942720,多谢分享，点赞支持[赞][赞][赞],1,1,0,2022-08-17 11:05:48,来自河北,2085143639765104,秋天的麦子W
7132756360848474921,3岁以下婴幼儿照护费用个人所得税专项附加扣除政策，这一项对好多人都没用，个人发放工资都达不到税收扣税工资，这一项有啥意义呢,1,0,0,2022-08-17 16:18:36,来自山东,92750619691,贾桂萍3
7132620634567230208,希望报销比例能大些，这些年为了要孩子花光了家里积蓄，今年37岁了，做试管是最后的选择了,3,12,1,2022-08-17 07:31:57,来自浙江,93351361072,山生堂参茸滋补
7132677245172810499,写的棒棒哒[赞],1,1,0,2022-08-17 11:12:30,来自江苏,92667618534,正大光明星球J
7132475118596703009,好多人想生的生不了，试管费用高，这真是个好消息，对国家开放三胎是有利的,0,47,0,2022-08-16 22:07:40,来自河北,104710049799,爱生活的鲸鱼i
7132677456053895936,不生孩子的根本原因是什么？,0,3,0,2022-08-17 11:12:17,来自浙江,3218988553217917,顽强海浪Dq
7132624691781141289,纳入医保是集采，压榨利润空间，怎么会暴涨呢！,0,3,0,2022-08-17 07:47:54,来自江苏,104477336854,家长有点忙
7132479668447888131,试管前前后后共花了七十多万，人财两空,6,17,0,2022-08-16 22:25:33,来自广东,98400981954,清爽小鱼qr
7132748377574015785,支持鼓励一下[赞][赞][赞][比心],1,1,0,2022-08-17 15:47:42,来自广东,3913892303998573,珠寶
7132478737387602703,希望快点实地实行，时间不等人,0,40,0,2022-08-16 22:21:01,来自广东,3931505030602829,A呦呦
7132701372243903235,95后 表示，自己996身上有几十万够首付，结婚要买房，买房了就回到解放前，不买房家里父母有什么问题可以应急，不买房兜里有钱幸福感也高，不买房自己的钱越来越多。三餐四季用不了多少。房价对年轻人来说是最好的避孕药，身边很多选择谈恋爱不结婚，望房兴叹。,1,1,0,2022-08-17 12:45:43,来自广东,63536888163,美食小罗
7132667626656498445,就问高考能不能一视同仁,3,6,0,2022-08-17 10:34:36,来自江苏,4714213176,周大奔
7132632199744471840,试管孕妈路过，前后花了接近八万，希望能早一点纳入医保,0,3,0,2022-08-17 08:17:54,来自广西,103856548120,顿顿寻找生命中的贵人
7132662964863386403,白酒起飞了,1,5,0,2022-08-17 10:16:02,来自陕西,96499391614,重温感动881
7132691386503742211,试管婴儿技术也应纳入医保。现在年人多数遇生育难题，生不出来，做试管可生希望很大.费用太高。有点难招架。国家能有政策会更好。,0,2,0,2022-08-17 12:07:22,来自黑龙江,5451436279,春晓88
7132641928939619083,多抓抓食品卫生、安全更重要，从小吃各种化学添加剂，现在难怀孕的越来越多,0,6,0,2022-08-17 08:55:02,来自河南,3535626341201438,自由的西木栗
7132623732098925347,这真是个好消息，有很多人因不孕不育做试管婴儿费用昂贵，被逼放弃生儿育女念头。,1,7,0,2022-08-17 07:44:01,来自广东,3157443505299767,乐观的鲸鱼SD
7132700306974278400,我就是生了两胎，生活品质感觉直线下降，可能还是没有达到财富自由的原因。,2,3,0,2022-08-17 12:40:46,来自湖南,1499373544418312,科技土老冒
7132658185127052047,好像公积金贷款不用还似的,1,9,0,2022-08-17 09:57:41,来自江苏,1763916968,龙飞龙飞龙飞飞
7132618183538279202,我想问下就算纳入医保，跨市医保能用吗？,1,4,0,2022-08-17 07:22:48,来自河南,92777277973,CS1234567890123
7132642397053928192,北京为什么要暂缓？,0,10,0,2022-08-17 08:56:18,来自北京,6933324539,魔法小蛀虫
7132662179903406860,大部分人没公积金,1,10,0,2022-08-17 10:13:43,来自新疆,6974217572,硬汉子9
7132631452461613838,试管太贵了，一次好几万，要不起，要了也养不起,0,12,0,2022-08-17 08:14:12,来自江苏,5926157286,寒紫依颢
7132642466620621603,这点小恩小惠对于养一个孩子的花费相当于优惠券了,4,9,0,2022-08-17 08:56:41,来自北京,4563409848,无所畏惧的勇气
7132639811730965248,唐山做了三次了，也没成功。很遭罪，没到移植我都花了有7万了吧。还是不行，也没纳入医保,0,10,0,2022-08-17 08:46:24,来自河北,6372706211,离殇柔梦雪
7132728750566884096,这是好消息,1,1,0,2022-08-17 14:31:21,来自湖南,13271543584,飘在江湖上
7132694193533059848,有一代人，是独生子女，成家之后上有老，下有小，然后鼓励生育，加上后面的延退[捂脸]！这代人真的优秀！,1,3,0,2022-08-17 12:17:37,来自福建,51545008550,LukA
7132701379570729736,直接给生娃的家庭补助就行了，简单高效。,1,4,0,2022-08-17 12:45:21,来自内蒙古,102069891303,木偶奇遇记789
7132697786528596747,现在备孕期间做检查好多还是自费呢，这个能给解决一下吗。,0,4,0,2022-08-17 12:31:40,来自北京,87407229441,乐乐ud
7132715870362600233,我们这结婚找个二婚的，彩礼都得要25万,1,0,0,2022-08-17 13:41:17,来自吉林,2384153904165294,独立评论人隔壁老王
7132641702686458658,大学毕业了几年连工作都找不到，自己都养活不了自己，还要靠父母，怎么敢结婚生子？,1,19,1,2022-08-17 08:53:35,来自云南,61773199468,心有独钟184152186
7132709421624836877,工作都没有，一个都不敢生，不要说生三个[抠鼻],1,1,0,2022-08-17 13:16:50,来自广东,68417213895,随性自由的荷叶BF
7132633836126667555,就因为最近试管，公司居然劝离职，各种理由各种借口让离职，这样哪个女士敢生，仲裁应该管一管，对于要生育的女士不公,0,4,0,2022-08-17 08:23:06,来自北京,111491029654,白鹤小姐哦
7132705999038759687,二胎的啥政策，一样没享受，还三胎,1,0,0,2022-08-17 13:03:18,来自江苏,51209371019,唐鹏坤
7132640112429007627,先保障生下来后能免费医疗，没后顾之忧了这个辅助生育才用的上。,0,4,0,2022-08-17 08:48:22,来自浙江,1917961606534222,魔法云朵Yf
7132684968656143143,多生孩子天就凉快了[赞],1,3,0,2022-08-17 11:42:10,来自江苏,5999720213,平行技术
7132691360536494861,幼儿园这么贵，谁愿意生，,1,3,0,2022-08-17 12:06:47,来自江苏,923196269794152,张桥人的快乐
7132646469718770466,最好生九个，养得起吗？[泪奔],0,3,0,2022-08-17 09:12:13,来自上海,3350926031076400,欢快高山Re
7132676669000975111,大龄生育也需重点关注！,0,5,0,2022-08-17 11:09:36,来自北京,55627342011,YanYanYuFei
7132713622945497871,国家应调查一下，什么原因造成，有那么多不孕不育的人，这事不可小觑。是生育下降的重中之重。关注。,0,1,0,2022-08-17 13:32:35,来自天津,51664945126,渔阳高堂
7132699741288416007,别光说不做，时间不等人马上40了，还能生了吗？,0,2,0,2022-08-17 12:39:02,来自吉林,53510948621,心语2115920
7132675599923217192,如果国家能同意不结婚可以有孩子估计生育率会上升，我觉得[捂脸],0,2,0,2022-08-17 11:05:02,来自湖北,1293464732705867,苏玖娘
7132695539514819359,公积金好多人是没有的，国家若真想提高青年人的生育率，唯一办法是降低生育成本。,1,4,0,2022-08-17 12:22:51,来自广西,6030874920,呼呼生威1752
7132719851550098176,现在也不需要那么多啊，几万块够了,1,1,0,2022-08-17 13:56:51,来自吉林,59993657376,永爱BEYOND
7132695286338257699,现在晚婚晚育，生育问题的人很多，生殖技可以帮助一些遇到问题的人，更好提升生育率和意愿，尽早点纳入医保！,0,3,0,2022-08-17 12:21:29,来自北京,98284341233,追剧的夜猫子
7132670738972574504,优生优育最好，不是只看数量不管质量,0,2,0,2022-08-17 10:46:19,来自四川,101590929855,媛媛7974983256985
7132704627606307618,8孩子都不补助,1,3,0,2022-08-17 12:57:35,来自福建,85967937875,lzfmzh
7132700818868192035,看到现在政策越来越好，真的是一声长叹啊，再看看肚子上的节育刀伤，真是悲从心起啊！,0,3,0,2022-08-17 12:42:49,来自宁夏,940802672172015,稀罕你的笑D
7132694761114714888,不孕不育治疗，如果可以纳入医保，那才是最好的！ 既能提高生育率，又能减轻老百姓的经济负担，才是真正得民心的举措！,0,1,0,2022-08-17 12:19:50,来自辽宁,593340143515886,博学的小羊6F
7132697873841390349,现在的生活压力和生活成本太高了，如果没有实质性政策出台恐怕绝大多数都不会（不敢）要二胎或者三胎,1,2,0,2022-08-17 12:31:42,来自宁夏,4451912448,大漠孤烟长河落日2019
7132704348471051043,三孩放开了吗,1,1,0,2022-08-17 12:56:27,来自安徽,1103506364443869,悠风客
7132699171731096324,尽快呀，不要只是准备呀。真是旱的旱死涝的涝死,0,4,0,2022-08-17 12:36:56,来自江苏,6430737722,唇下那颗朱砂痣
7132621884059386632,年纪大了很多不好生的 费用又贵,0,10,0,2022-08-17 07:37:24,来自湖北,105400255546,刘刘苗123
7132707178334552865,希望对肿瘤患者也纳入医保,0,1,0,2022-08-17 13:08:21,来自北京,4029083648794126,可心123
7132633912106730276,如实地发钱，比说一大堆文字有用,1,19,1,2022-08-17 08:23:51,来自广东,219535852715213,谢生
7132685118300504866,生得起，养不起,0,2,0,2022-08-17 11:41:56,来自河北,4473254980357531,智5467
7132671658556392199,先提高年轻人的收入吧,0,2,0,2022-08-17 10:49:55,来自天津,66652366474,菜鸡BF
7132693516392186638,育的环境不改善，很难说生。,1,4,0,2022-08-17 12:15:03,来自陕西,87566307308654,发财桃子9X2
7132706438824477481,先给二孩的解决了，才有三孩把,0,2,0,2022-08-17 13:04:41,来自四川,940811277052861,英格玲西
7132650695325123339,真好[赞]农村合作医疗可以用不？,0,5,0,2022-08-17 09:29:29,来自浙江,3122210358692112,绕月的云c
7132674477112001321,我反正不生啦，两个够了！,0,2,0,2022-08-17 11:00:40,来自甘肃,93324807777,拒绝标签的文小姐
7132682695113065231,以后未婚生育、单亲妈妈会越来越多,0,3,0,2022-08-17 11:32:40,来自广西,3724781524615843,凤行天下安
7132713199127986975,理想丰满，现实骨感。落实才是关键,1,0,0,2022-08-17 13:31:23,来自陕西,3904153465,我崇拜谁我就照镜子
7132772931765256994,备孕了一年多了，身心疲惫 ，后面在怀不上可能也要试管婴儿，但是担心资金的问题 好惨,0,0,0,2022-08-17 17:23:02,来自贵州,2488941144187279,坦荡的柑桔xU
7132712616522679054,食品安全重视起来，医保钱可以节约点,0,2,0,2022-08-17 13:29:17,来自重庆,62259072946,韭菜收割笔记
7132705787965063976,早点纳入医保,0,1,0,2022-08-17 13:02:08,来自山西,1627719801242717,，？？，。！？。。
7132629805853623051,辅助生育纳入医保非常有必要且非常迫切，高领加上生活不健康现在很多夫妇生育困难，辅助生育费用高，让人望而却步,0,6,0,2022-08-17 08:08:29,来自山东,6376359967,lsh86769781
7132640537584075561,希望快点实地实行，时间不等人,0,6,0,2022-08-17 08:49:01,来自河北,109819078060,清风3180452371373
7132626496099402509,如果看了以后买白酒产生亏损，是不是可以起诉呢！,0,5,0,2022-08-17 07:55:24,来自北京,70629604206,乐观的苹果r1
7132702377819292446,说了那么久 到底什么时候纳入呢？,0,2,0,2022-08-17 12:49:03,来自北京,60010595547,热情火车Nr
7132694589009822498,好事，可惜我没赶上,1,1,0,2022-08-17 12:18:42,来自湖北,1345399853952607,清明菜啊
7132765952776880903,就说产检费用吧，生育保险少的可怜，医保也杯水车薪，更何谈辅助生育高昂的费用，生个孩子太贵了！,0,0,0,2022-08-17 16:56:10,来自江苏,106162335464,小奔恼了
7132654200072520489,鼓励生，需要相应政策保障,0,5,0,2022-08-17 09:42:07,来自北京,624954580151071,思索索
7132676404428817184,人口负增长的情况下，这应该是好消息！,0,3,0,2022-08-17 11:09:14,来自山东,3060656649284791,周五老公
7132764360426636068,多孩本身就说明了经济实力。资源分配越来越向少部分集中了,1,1,0,2022-08-17 16:50:15,来自广东,1390224220881783,需求驱动
7132674162673419046,别逐步了，应该立即马上！有的已经大龄，时间不等人！,0,2,0,2022-08-17 11:00:01,来自广西,1367384480304247,7000米深蓝
7132649566683939614,生育率下降，年轻人不远生孩子，鼓励多生!,0,5,0,2022-08-17 09:24:46,来自湖北,111092648147,青涩水滴OT
7132705835050550027,辅助生殖，首次纳入医保！好！[赞][赞][赞][鼓掌][鼓掌][鼓掌],0,2,0,2022-08-17 13:03:15,来自湖北,111592177979,书香溢满江南岸
7132627211404215055,应该研究为何不能自然怀孕,0,4,0,2022-08-17 07:57:34,来自北京,76474464169,心止如水ing
7132673180032008990,试管婴儿纳入医保大力支持，确实经济压力太大，国家应该早点纳入医保！,0,8,1,2022-08-17 11:03:04,,6915444464,进取Sven
7132694767351300901,省内异地生育何时纳入医保？,0,2,0,2022-08-17 12:19:39,来自辽宁,870439485455623,There8t
7132695225100927785,产检应该免费,0,2,0,2022-08-17 12:21:04,来自安徽,21568620527,滴答滴答赳
7132682569275638569,说是说，北京还是不能用医保报销,0,1,0,2022-08-17 11:32:14,来自山西,93163205298,执着的高山W
7132771600260825894,再告诉你一句买老白干！！！！！,0,0,0,2022-08-17 17:18:36,来自北京,5770140556,自在朵朵
7132676796428354315,这也就是90后能赶上了，没有80后什么事了，女性上了40岁做试管成功率很低。,0,2,0,2022-08-17 11:10:34,来自山西,2137082042524216,天山白雪2008
7132634627923428137,吉林省能有这个政策吗？,0,5,0,2022-08-17 08:26:13,来自吉林,3737983849079982,智勇双全宇宙KF
7132695938162262788,万物皆可以集采,0,2,0,2022-08-17 12:24:44,来自江苏,1305869383114622,菲菲茉茉
7132677871742714659,应该早点实施！,0,2,0,2022-08-17 11:13:51,来自江苏,5399113721,海蓝蓝52978001
7132683582992483110,这真是鼓励生育的政策了。,0,2,0,2022-08-17 11:36:52,来自山东,1918010753825947,兰华帆平54656
7132617385500590888,现在大量提倡生育，新时代20后会不会以后就成为上一代的80后啊，还得适度,2,4,1,2022-08-17 07:19:33,来自广东,6613978726,Svip889
7132738301299720997,我前几年做的，现在给报销不[黑线]没赶上好政策啊[流泪],0,0,0,2022-08-17 15:09:09,来自山西,219534979499387,368495795
7132646000614884126,试管之路太痛苦了，都快倾家荡产了，还不纳入医保，只看到新闻，没有实质性实施，苦了我们怀孕难的这些人,0,4,0,2022-08-17 09:10:42,来自上海,73981790868,Cindy1049
