7130572022140109583,防君子不防小人罢了，正常人都不会带着炸弹从这进去，大家都知道有安检，就是威慑作用，真要炸地铁的估计都会从通风管道什么的去输送的，行凶者也不是傻子，不可能光明正大过安检的，此时安检有没有人认真看不重要的，只是一个威慑作用，行凶者也不会去催眠监控的人，监控者本来就不在计划之中，睡觉只是偶尔的事情，所以说适当的惩罚是要的，意思意思就行，毕竟他们也挺辛苦的[捂脸],2,13,0,2022-08-11 19:02:01,来自广东,104497469574,Minecraft年轻
7130655998981440297,没错，安检能睡觉那要安检干什么！所有人都陪她不嫌麻烦的过家家吗！虽然辛苦，但这是职责！那些老好人们，如果哪个行业都通融一下可以吗，一句都不容易…护士给你打错针要命了可行，都不容易！,0,0,1,2022-08-12 00:30:09,来自北京,17202689867848,gh4141
7130673511575864079,在其位谋其政，失职就是失职，你要觉得辛苦，你换不辛苦的工作！有些职位真的容不得一丝马虎的！有人说，人活着，谁都不容易。但是辛苦，不容易真不应该成为你推脱的理由。还有有人说，谁上班没有摸过鱼？难道你摸鱼你还有理了。当然其实无关紧要的摸鱼，偶尔为之可能不伤大雅。但是还是应该端正态度，不要觉得你摸鱼明明是错的，还觉得对了,4,29,5,2022-08-12 01:39:14,来自广西,108122998646,云烟8899
7130480526334935841,提醒一下就可以了没必要拍照上传,7,348,7,2022-08-11 13:08:05,来自上海,4257965569,大桌子
7130616582304711436,你这一下把人家工作也搞没了，说不定是加班太严重或者身体不舒服呢。,4,45,0,2022-08-11 21:55:36,来自山东,1675304848595756,三代核电从业者
7130765660690531076,如果这个安检员身体不舒服，你就发发善心叫醒他，问他怎么了，人心都是肉长的，一方面把他叫醒，一方面会让他感到温暖，如果这个世界上都充满爱，世界将变成美好的人间,0,3,0,2022-08-12 07:34:50,来自上海,4375664359118491,丁丁wei
7130602188879282956,"狼性管理，你既然干这份工作就要恪尽职守。如果一个警察一点疏忽可能造成多大的危害？一个消防员疏忽有什么危害？这是你的工作，没有一个工作会那么轻松。人情管理，可能他累了，可能他工作了多少时间，可能家里有啥事，，
有时候错误只有一次，大家都在工作，你说他有没有错？",2,11,2,2022-08-11 20:59:41,来自新疆,4373612425,小河虾米
7130550094600061710,在深圳上班一年多，每天上班坐地铁5号线上水径站上车都能看到一个小姑娘在那玩手机，她是看屏幕的但她眼睛一刻也不看屏幕……这种岗位都是外包给保安公司的，有的可能是刚毕业或快毕业的学生，缺乏培训与责任心，更缺少监督机制！,2,6,0,2022-08-11 17:37:31,来自上海,14441445058,佳思迈人力
7130778699360371486,车上睡觉？,0,0,1,2022-08-12 08:25:07,来自山东,1983136215866843,平邑融媒
7130622629601854243,"任何事情的观察面，绝对都是多角度的。
安检员，职位很小，责任很大。
建议：此职位采取双人坐岗轮值制，2小时一班换岗。
拓展思维：假设安检形同虚设，并被犯罪分子利用，且造成严重后果～
届时网络與论会怎么样？？？",5,46,1,2022-08-11 22:18:34,来自湖南,5824594415,空悠寂明
7130509742459568927,做人要厚道点，你坐在那里一天试试看吧,53,162,7,2022-08-11 15:00:54,来自北京,109119479385,潇洒可乐mp
7130785735665910558,不对就是不对啊，拍摄者没错，当事人可能也是真累，那是谁的问题呢？,2,9,0,2022-08-12 08:52:11,来自浙江,110531765178,汪汪队没立大功
7130495584808813315,都是劳务工 地铁安检日结8小时160 12小时220。24小时330 估计他是做24小时的连班 太困了,11,20,0,2022-08-11 14:06:26,来自上海,4301735776763555,直率钢笔w
7130549363109790495,"很心酸。我隔着屏幕都在心痛
这是得累成什么样，至少说明现在大多数中国人还是过的很苦的。",0,19,0,2022-08-11 17:35:02,来自湖北,95379009593,天地一沙鸥324
7130786466522956559,安检员上班时睡觉，本身就是犯错，凭什么不让发视频？如果这时有不法分子带着东西上车，出现重大事故，损失不可估量,1,31,1,2022-08-12 08:54:19,来自辽宁,4085409448466007,机械加工铁匠编程
7130612199785005828,可能是太辛苦了，身体不舒服，大家相互理解一下。,5,80,4,2022-08-11 21:38:30,来自北京,55358577290,美1468330
7130481216460981025,"刚进家门，孩子们围了上来：“爸爸，我饿，快叫外卖吧……”
“对不起，今天开始，要省一点过日子了，这份工作也丢了”
“你？！晚上做代驾，结果被投诉开除。怎么做个安检员也开除！”妻子无语。
“就是因为晚上做代驾，太累了，刚打了个盹就被人拍照放网上了……”
……
……",5,72,5,2022-08-11 13:10:23,来自上海,111118246541,妖小蛮
7130519780833968899,睡觉证明缺觉，也可能几天没睡了，也可能，不舒服了，身体有情况，做人别太教真，人不是机器，这样你能得到什么？他可能是一家的顶梁柱！,12,145,11,2022-08-11 15:39:57,来自辽宁,60374443266,工力丽
7130487178018849569,打工人何苦为难打工人？拿多少钱那么认真工作,7,204,7,2022-08-11 13:33:56,来自浙江,1478222207525229,勇敢的雪碧Q
7130608653031555843,我发现好多都说拍照发网上不对，那么我就来说一下我的看法，首先上班时间睡觉是不对的，应该尽职尽责的工作。为什么觉得谁上班不睡觉？这个想法我都觉得可笑，难道你看见有人闯红灯你就跟着闯红灯吗！那说明你们这些人工作也是不尽职，安检是一个很重要的事情，如果发生有人带违禁品进去了发生了恶性事件，我相信很多人又站出来说安检人员是怎么检查的！怎么违禁品没有检查出来！路是正的你不走非要走歪路，那是路的问题还是人的问题！,3,18,1,2022-08-11 21:24:46,来自河北,51087760362,小疯子疯子小
7130682265277154082,深圳地铁安检都是2-3个人，可见上海地铁就一个安检员，工作量大吧，,0,0,0,2022-08-12 02:09:48,来自广东,334713360744542,瓦列夫
7130487789904216865,小兄弟，你睡觉期间，若混入了管制物品，后果会很严重的。知道不？,9,62,6,2022-08-11 13:35:59,来自湖北,1899561224772599,星疏月明
7130481070671921931,才睡20分钟……你上班从不瞌睡？,11,93,11,2022-08-11 13:10:18,来自上海,52055637816,123456YY
7130617521144709895,如果不是太累，怎么会睡着呢？要将心比心，拍照上传到网上的人不厚道，生活工作中做人估计也不怎么样,3,42,0,2022-08-11 21:58:58,来自江苏,3192596083254813,一步楼楼主
7130763799220519712,怕是要丢工作了，上班睡觉是不对，但是也许有原因，可以提醒一下，谁还不犯个错误，现在疫情影响经济发展，很多人生活都很困难，在因此丢了工作，这可咋养家,0,3,0,2022-08-12 07:27:32,来自河南,111280306347,奔跑的狐狸W
7130765215638799139,上班时间睡觉确实不对，但我们也要考虑一下是不是他们上班人员太少了，轮班太密了，休息时间少，超负荷工作，打一下盹是可以理解的，这是发现者为了安全可以提醒一下就好了！,0,1,0,2022-08-12 07:32:07,来自广西,4072205838458541,英明果断豆浆3w
7130496437829862179,拍照人不地道，提醒一下就可以了，都是打工人。,2,68,7,2022-08-11 14:09:04,来自河南,90120830624,机智的阳光ms
7130791612493857575,他上班睡觉，万一发生危险怎么办，万一危险落到你们支持他睡觉一方，你们可能不会支持他睡觉了，本来不对事实，没必要争论。,2,8,0,2022-08-12 09:15:29,来自浙江,3456469233572947,武动江城
7130531683774268199,坐着都能睡着，这是有多累啊！不知道是什么原因。,6,29,3,2022-08-11 16:26:37,来自广西,75824811810,忙里偷闲罗小染
7130497444273636126,戴口罩时间长了，脑缺氧容易犯困,4,83,3,2022-08-11 14:13:14,来自辽宁,84999940602,菜叶子38
7130597687556752132,现在的人真的挺无语的，安检人员睡觉，不管是个人原因还是派遣公司的班制安排不合理，都不是这个现象可以存在的理由吧？假如有什么混进去出了事可就是一车的人，那时候你们又会说什么？,10,131,9,2022-08-11 20:42:23,来自安徽,51570422323,风儿545
7130595173557994247,我觉的可能太累了，也有可能太热了，上班时间打盹，必须警告！但是，拍摄者想进入地铁，忘记买车票，说明已经到栅栏处，自己进不去才想起来没买票！说明自身就没有基本常识！拍照更不可取，善良的做法，你如果真的在意，你可以提醒一下，真的，一句话而已！[赞][赞],0,13,0,2022-08-11 20:32:20,来自浙江,940787245522095,小钱在家
7130627696728032037,对的，善意提醒,1,2,0,2022-08-11 22:38:52,来自湖北,17004491783,静里悠闲心自乐
7130547941815173929,我也觉得说不定安检员身体不舒服，不要把人家饭碗搞丢了,0,27,1,2022-08-11 17:28:51,来自上海,63852716878,亲切海洋mN
7130517065903096579,现在一些人动不动拍视频发视频，你能提醒下咋滴，就知道一天天拍拍拍，想赚流量也不是这个赚法，不是说人没错，拍视频这个人自己也有问题，你有空等20分钟，没空提醒下人家？无非就是想搞事情。,1,12,0,2022-08-11 15:29:34,来自上海,51905198575,看着我的眼睛565
7130521184931791657,拍摄者真不地道，人心还是善良些吧,0,42,1,2022-08-11 15:44:53,来自河南,106604717745,快乐光束F
7130517200687366915,可能太辛苦了，天气炎热睡一会，应该理解一点。,5,46,5,2022-08-11 15:30:33,来自上海,4437282435377004,初心子玉
7130570106816037645,都是混日子的人呗！我们这边好几个外来打工仔每天打几份工，白天做保洁晚上做保安，白天混日子晚上睡大觉一样工作都干不好呗！我们说外地人懒就是这样看着每天从早忙到晚打几份工，结果一样工作都没做好呗！,3,10,0,2022-08-11 18:55:09,来自上海,96347598481,达叔ByteDance
7130503795913655077,日本人搭地铁不需要安检拍摄者你知道吗？,5,19,2,2022-08-11 14:37:52,来自湖北,96019076494,人生如梦活在当下
7130508422776275727,不地道因为你的这一举动他可能失业了。当下的形势工作保一份多难？这工作本身枯燥时间长。你又得到了什么、看不惯最多友善提醒一下。我倒不相信你拿了老板工资是付出100%的。,8,143,10,2022-08-11 14:55:33,来自上海,2801183622177495,淡泊自若蜻蜓
7130657004632933124,我觉得工作的时候睡觉是不对的，更何况是这么重要的岗位，如果混进去爆炸物，那么伤亡会有多大？而且他们有轮岗制度的,0,3,0,2022-08-12 00:36:08,来自浙江,3758438238,鱼香小肉丝
7130617938482463523,看来拍摄者看安检员睡了20分钟啊，那为什么不第一时间叫醒他呢？,0,12,1,2022-08-11 22:00:15,来自河南,2612028372956660,粪蛋的漂亮妈妈
7130651792836870950,工作时间怎么能睡觉呢？何况在大庭广众之下，要是真累了回宿舍去睡，这里睡算怎么回事？有些网友还认为拍视频的人太狡猾，太苛刻，会害当事人丢了工作，这点我不同意，一码归一码，不能别人提了问题，就对人家展开人身攻击。不管什么工作都应该认真对待，这是个基本的职业操守，,2,1,1,2022-08-12 00:13:26,,73239628163,白夜放歌
7130805090797093646,现在觉得有人带违禁物品麻烦了，不配合安检的时候往里冲的时候呢？有空拍20分钟的人不知道存什么心,0,0,0,2022-08-12 10:06:56,来自上海,54079442551,Phoebe披荆斩棘
7130491233583039244,我们进地铁站站需要安检，但是地铁的安检员自己下班以后背着包确有豁免权。该情况出现在桂林公园15号线6号口下来的安检口，每天14：15分左右都有发现，希望上海地铁能好好管理一下。,4,20,1,2022-08-11 13:49:22,来自上海,5528444328,我的new生活
7130612449002357539,北京地铁安检员经常这样，要么睡觉，要么聊天,0,0,0,2022-08-11 21:38:56,来自北京,58199526840,兰心777
7130764440865719076,宁愿来来回回拍视频发也不叫醒？还感觉不安全？[捂脸],0,2,0,2022-08-12 07:29:45,来自山东,3245375859987997,正直钢琴2X
7130809925973967649,"既然你知道这种行为不安全，为什么不把他叫醒？
真想举报也不是不行，毕竟安检是乘坐地铁很重要的一环。身为安检员，在工作的时候睡着，那确实是失职的行为，没得洗。
但拍个半分钟视频，送到相关负责人那里投诉就行了。
又或者，你可以拨打12345举报地铁站安检员的这种行为。
甚至，你不需要大动干戈。
只需要告诉负责人一声，地铁里都有监控，只要调取一下监控，他的直属领导就会知道怎么回事。
仅仅是一瞬间，我就能想出好几种处理这件事的办法。
但这名拍摄者就是要在那里等他睡够20分钟，然后把这段视频上传网络让大家谴责他。
比起伸张正义，这名戚先生更有一种想看好戏的感觉。
用网友说的一句话来形容那就是：
“我就不提醒他，我甚至希望他睡的更沉一点儿，这样我就能拍下他的丑态发到网上了。我也不是多在意安全，其实就是想用正当名义祸害祸害人罢了。”",0,1,0,2022-08-12 10:26:10,来自江苏,1363819166442574,虽近犹远
7130541087353209633,真是羡慕拍摄者啊，闲得没事做，还花20分钟来拍摄观察，我们都是行色匆匆为生活奔波的人，不敢浪费时间啊,0,59,3,2022-08-11 17:02:53,来自四川,111183706653,青青子衿286604820
7130643927581557511,首先要感谢这个拍照者，对于社会问题的监督；其次要说一下，现在好多安检设备已经可以对识别的危险物品报警了，安全还是有保障的；最后要说的用人单位要关注人员的工作状态，高温天气多做一些班组轮换，而不是一来问题就是罚罚罚,0,10,2,2022-08-11 23:42:56,来自陕西,3340847771,黑锋
7130478972609233676,搞笑哦，票都没买就打算进站了？想混进去吗？,2,66,6,2022-08-11 13:01:45,来自上海,109746074599,淡泊诗意西柚
7130797158911312643,我觉得就不该让乘客去叫醒他，乘客去叫醒他也只能管一时作用，还说你管闲事。但是安检关乎到所有人的生命安全，以防有人报复社会怎么办。所以应该从他们的体系开严查。而且这个责任不能只罚一个员工，而是他们领导责任更大，有问题是他们的领导层和工作体系出问题了，应该要受到重视，拍摄者没问题。安检无小事。,0,3,0,2022-08-12 09:36:45,来自江苏,96233062003,醇的酒
7130804670762648353,拍视频的人花二十分钟在旁边观察，其心思不言而喻，也只有上海人能做到,0,1,0,2022-08-12 10:05:41,来自贵州,74190334760,快乐枫叶Hx
7130630065770988288,安检员的责任非常大，和其他行业不同。因为他们要保障地铁的正常运行和乘客的生命安全。不能有丝毫的马虎。如果在他睡着的这一段时间内，有人把危险品带进地铁，后果不堪设想。,0,0,1,2022-08-11 22:47:24,来自山东,1943556105967015,快乐的可乐Ju
7130802796705792776,是我就会提醒这位安检员，而不是曝光别人，必定不知道情况。,0,0,0,2022-08-12 09:58:05,来自湖北,2802009878838424,不凡面条ye
7130501223207715625,我有一次过地铁安检机时发现三个保安都坐在椅子上低头打盹，恐怕是昨晚被拉去了什么任务。第二天我再过，发现三保安都没椅子在站着干活（认不得是不是昨天那一批人），不知是领导检查发现了打盹问题还是被人给举报了[捂脸],0,13,1,2022-08-11 14:27:34,来自广东,13872509718,一杯咖啡在手
7130795315720143629,视频者做的对 一个细节让恐怖分子有机可乘 醒醒吧那些可怜他人的人们,2,1,0,2022-08-12 09:29:18,来自辽宁,79981234437,智者湖泊qU
7130525431895278340,看了评论觉得现在世界观真的变了，错了就是错了，他只要拿工资担当这个岗位的职责就应该负责，这个岗位的设置是有意义的，为了大众的安全，在这个岗位上上班睡觉居然有那么多人表示理解，那么，只要累，任何岗位上班睡觉都能理解？谁都不容易？,7,36,4,2022-08-11 16:01:55,来自上海,6976405876,龙在边缘7
7130541230660518670,也许你会得到刷屏机会，流量噌噌上涨，但人家安检员可能面临着下岗，这样的年龄，你教他干嘛？在经济普遍不好的时候，请大家手下留情，活的都不容易，不能为一已私利，损坏别人的利益，更不能把自己的幸福建立在别人痛苦之上，伸出手，推一下，善意的提醒，人家会感激一辈子。,0,17,0,2022-08-11 17:03:15,来自上海,20938086385,甜甜的青涩
7130796600082875148,"说实话，一个人在一个固定地方坐着不动真的很容易犯困的，懂得自然懂，看到这种问题你提醒他，当场训斥或者投诉他都没有问题，但是放大到网络真的好吗？
有的时候，一件普通过错，放在网络上就变成天理难容，不杀不能平民愤的过错，这种安检员本来就是临时工，在上海也就4000多的工资",0,0,0,2022-08-12 09:34:23,来自河南,1503729044957572,一笔两用
7130529723813921577,每个人都有困的时候，应该善意提醒，拍照的目的是什么？,0,8,0,2022-08-11 16:18:18,来自上海,50287086088,ping126566976
7130731532968837919,安全和善意不是同等的，你们可怜一个不知道安全的人。有事情了谁负责,0,1,0,2022-08-12 05:24:12,来自上海,87035679565,北京木易
7130769217288143631,上海地铁的安检员都是外包工，工资低，还没有五险一金，所以他们为了多赚钱，早班加晚班的连轴干，在上海生存的他们不容易，否则连房租都交不起。,0,0,0,2022-08-12 07:47:29,来自上海,8423808970407,Amy6l777
7130776230257443587,这真是安检有人骂不安检也有人骂，以前不是一堆人控诉说地铁不应该安检吗,1,1,0,2022-08-12 08:15:56,来自河北,5258572323,肥而不腻的兔纸
7130808700885156642,我的理解是：他一定非常的疲劳，不然，谁愿意在工作岗位上打盹睡觉呢？往好的一面想，多些理解吧！,0,0,0,2022-08-12 10:20:40,来自山东,64048913564,从前有座山emtf
7130796287926190852,我是监控中心的人，我知道干这活有多枯燥。每次早班还好，夜班真的是想睡又不能睡，你们试着穿好防护服盯着电视机看上几个小时就明白了，不是那种电视节目就是那种所有电视节目放完了出现的检修的图案或者雪花屏，你一天看8个小时，一周看5天，自个试试能不能不睡着，期间除了上厕所喝水吃饭，没人说话不能看手机。我想当时那个工作人员已经可能也不知道已经睡着了，提醒一下应该马上就能清醒，我不是说这种行为是被允许的，只是希望大家能多一点理解和包容,0,2,0,2022-08-12 09:33:20,来自上海,2172231704391357,魔都版孤独的美食家
7130556387167814400,也需是安检员身体不舒服，不能片面的下结论，拍摄者应轻轻提醒或是找别的工作人员上前问问。,0,21,1,2022-08-11 18:01:42,来自云南,1424618518222317,勇敢的简单梦想
7130487445489009446,第一:安全责任永远排第一位，安检员的工作就是为了确保没有安全隐患，跟有些人说的上班摸鱼可不一样。如果有爆炸品被带进去而发生问题，你们还会不会说谁都会上班打盹儿这种话了？第二:车站这些小孩很多实习生，确实工资不高也很累。但累不是怠工的借口，更不是上班摸鱼的理由，很多人居然把上班打盹儿当成理所当然了，很奇怪的观点！第三:拍摄者也没有站在那边看了二十分钟，而是出去买票回来发现还在打盹儿，才感到愤慨拍了照片。,13,47,3,2022-08-11 13:34:34,来自北京,104467350721,一个老小孩儿
7130556389910774561,拍照人不地道，提醒一下就可以了，都是打工人,0,10,0,2022-08-11 18:02:27,来自湖北,79973086005,絔合兲稥
7130755562115564288,拍摄者为了”坐实”安检员睡了20多分钟，竟然说自己忘了购买地铁票，第一次过安检时，还在旁边站了几分钟观看，然后再去买票，折返后安检员还在睡，这种说法反而令人怀疑，有欲盖弥彰，公报私仇之嫌。经常搭乘地铁的，不是手机支付，就是用公交卡的，很少乘客逐次购票乘车。,0,0,0,2022-08-12 06:55:08,来自江苏,3733570205518675,用户POPLJL0806
7130767808795230988,这是补票和问询窗口，不是安检好吧，哪个地铁安检员在屋里面。都在传送带等进入口,0,1,0,2022-08-12 07:43:30,来自河北,61196996975464,庄里人any
7130510686639375140,天津地铁安检，早上四点起来做通勤车一个小时到站点，开站，夜里十二点回宿舍睡觉，你说困不困，能不睡觉？看图，说是六点开站，要提前去，宿舍离站点都贼远，通勤都一个小时,1,6,1,2022-08-11 15:04:31,来自广东,100592283964,飞天3185
7130810638901445413,大热天的 辛苦这位上传视频的拍摄者 [擦汗],0,0,0,2022-08-12 10:28:45,来自江西,6419000814,毛毛虫是我兄弟吖
7130594085538153252,疫情期间，各条战线上的工作人员都辛苦了。他困成这样，可能也有不得已的苦衷。如带有危禁品过安检，应该要发出声音提示吧。其实你可以好心的把他叫醒，他一定会感激你的。,0,0,1,2022-08-11 20:27:55,来自四川,3135434117883112,如雨随风178
7130513545078653727,安检一般不是两个人吗？旁边还有查绿码的，也不可能睡觉呀，不同情，这个严肃处理！,4,42,15,2022-08-11 15:15:43,来自广西,109590584442,无尾鱼527
7130606289624908582,挺危险的。给了犯罪分子可乘之机。,12,57,4,2022-08-11 21:15:38,来自北京,96567831199,细心伯蒂1W3
7130509818334348035,你不知道人家是不是不舒服或家里有什么事才这样，善意提醒一下就好了，不必发上来,1,33,4,2022-08-11 15:01:31,来自上海,11513439518,冬日暖阳150193534
7130580695000777472,一些岗位确实不应该睡觉，因为你担负这国家人民安全，比如军人站岗睡觉你觉得合适吗？警察因睡觉耽误警情，也不合适吧？医生在手术台上打盹，也不合适吧？包括地铁安检员也一样，万一有人把危险品带进地铁站而出事，那就是国际新闻！所以如果你不是某小区保安，也不是某工厂保安，那么就打起精神，好好工作吧,3,6,1,2022-08-11 19:35:48,来自上海,3020193844,矛盾说
7130770097996186409,谁上班不累，医生做这手术睡着了行吗？司机开着车睡着了行吗？你的工作就是坐在那检查违禁品。责任说小也小，说大也大。明知道坐那容易犯困就得想办法。叫醒他一会还睡呢，作者拍这个视频曝光很好，不惹事，还起到监督的作用。,0,2,0,2022-08-12 07:51:08,来自天津,75747356502,邢道荣54
7130811917362299661,为了大家的安全，可以善意地提醒一下。这个社会，任何人都不容易！多一份宽容，多一份理解！这个社会会更和谐！,0,0,0,2022-08-12 10:33:18,来自上海,70056496336,牛油果心想事成
7130657178910245632,工作再辛苦，也不能上班的时候睡觉？这样对工作太不负责任了！,0,7,1,2022-08-12 00:34:32,来自新疆,53512341570,落雪听梅142818607
7130469555914326814,你的善良应该是把他叫醒，而不是拍照,13,428,11,2022-08-11 12:24:45,来自海南,4432877120133720,乐天派无忧的明镜CC
7130723385180767008,打工者不易，有空拍视频，不如善解人意提醒一下更好吧！,0,0,0,2022-08-12 04:56:18,来自上海,3425701114152381,才高八斗咖啡62
7130520104500232997,有二十分钟拍视频，不能花二十秒提醒下，做人何必呢,0,70,2,2022-08-11 15:41:01,来自安徽,87930582573,烟囱是烤猪肉卷
7130774903544365828,安检起码连续12小时一个班，老虎都有打盹的时候，谁敢说你工作期间一分钟没偷过懒的？,0,0,0,2022-08-12 08:10:43,来自江苏,53903627704,Zyf天边一朵云
7130520674896298752,为戚先生的行为点赞！安检员如果都在玩忽职守，那还要你这些岗位干什么？车上的乘客安全谁又来保障？为什么不善意提醒？？他打盹期间出一次事故，都不是他能赔的起的。岗位要分轻重缓急，有些岗位别说睡20分钟，就是打盹几秒也会闯大祸，比如公交司机。,0,24,1,2022-08-11 15:43:00,来自广东,105943718275,Soniafiy
7130802593500152615,这个睡觉的哥们怕是麻烦了，上级挨骂，上上级也得挨批。到他那不知道会咋样，上班睡觉确实不对这个没得辩解，但是还是希望能轻fa他。,1,1,0,2022-08-12 09:57:44,来自广东,6954410282,献世1987
7130616915714081549,所以说世上什么人都有，他上班打盹肯定是不对，但这种偷拍的人也太可怕了！时时刻刻都要提醒自己防火防盗防小人[捂脸],0,17,1,2022-08-11 21:56:38,来自江苏,782487931325901,青青红
