7130656419380331305,这还真不罕见，每天上下班都坐地铁，偶尔确实看到个别看监控的安检员在打瞌睡，安检是很重要的工作岗位。可能这个工作人员没休息好，或者是长时间盯着屏幕眼睛疲劳了想睡觉。也不知道多久轮换一次班。希望公司能合理安排工作时间和强度，另外工作人员也要加强责任心。,22,41,2,2022-08-12 00:31:43,来自广西,105265440407,皮肤科程医生
7130615008836911913,现在天气太热，一直盯着屏幕确实让人犯困，理解。既然看到了可以提醒一下的。,17,213,10,2022-08-11 21:48:55,来自福建,4142560058023691,薇薇逛红尘
7130810202123322119,这个问题，在短视频横扫天下以前，可能一般人碰到了，真觉得不对不好，就走过去叫醒他，提醒他注意点，不听劝告，就找他领导反映问题，之后也就结束了。但上传视频，拍摄者本人未必出于善意，他20分钟都没有走过去叫醒他，也没有找他领导解决问题，而是选择了拍摄视频，上传网络，加上自己的个人评语，事实上，可能走了都没有去提醒当事人。,0,8,0,2022-08-12 10:27:06,来自广东,85515668313,🙊 大芳菇凉
7130796215373447936,我妹学的轨道专业，出来去广州和重庆的地铁安检实习了几个月，一天十几个小时，在广州有时候晚上还要驻站，晚上十二点多下班，驻站的话早上五点多就起来做准备工作，还动不动就加班，经常遇到无理取闹的旅客投诉，真的非常累。工资又低，实习结束就换工作了。,2,28,0,2022-08-12 09:32:19,来自上海,2260211988704791,阿阿么碎碎念
7130797955812623137,拍视频的哪里是觉得不安全了，明显的是想着终于逮住把柄了,4,75,1,2022-08-12 09:40:07,来自河北,4029482227,蚝油魏香菇
7130649090174059277,睡着了也很正常啊，肯定辛苦了，他们每天基本都要坚守岗位的，体谅一下吧，用得着这么小题大做么,2,49,0,2022-08-12 00:03:17,来自新疆,6922802146,不知所措31
7130669373873898275,超负荷工作，不打瞌睡才怪，没什么大惊小怪的,3,6,0,2022-08-12 01:22:56,来自重庆,465845405889256,冥冥之中已经注定了
7130613687521575717,如果连续加班，肯定非常累了，体谅一下吧,9,154,0,2022-08-11 21:44:03,来自江苏,60342188138,旖旎往日
7130785133992428322,虽然安检员睡觉不对，但拍视频上传人的心态真的那么磊落吗？不见得。做人还是敞亮点。上次一个娃发烧，正常等待时间里的焦躁妈看到已经下班的实习护士看手机，就拍护士视频让那个护士被开除了。真担心安全提醒下不行吗？不过是想让人家“倒霉”的阴暗心态罢了。,10,180,3,2022-08-12 08:49:12,来自四川,2708812987631757,此花雕非彼花雕
7130805417608823587,"首先上班睡觉就是不对的，更何况是安检岗位。
不懂为什么会有人质疑拍摄者动机，还异想天开的说应该去唤醒睡觉的人，这是一个过路人该做的吗？还有说什么换班累了云云，都是臆测，什么时候这么多好心人了？如果你自己或家人在这段地铁里，安全会有问题的明白不明白！",5,31,3,2022-08-12 10:07:52,来自上海,2906750136102468,诗酒趁年华67
7130627016990262047,唯恐天下不乱，多大的事？如果工作很辛苦，体谅一下叫醒了，没有必要小题大做,16,218,2,2022-08-11 22:35:57,来自天津,55981930154,快乐钢琴vI
7130620222667096832,工作很幸苦，应该有特殊原因，体谅一下都不容易,7,169,1,2022-08-11 22:09:14,来自湖南,6521540162,热情轮船my
7130794844615820071,地铁上班时间真的很长，只是说看起来轻松，我毕业出来在成都地铁站当安检员，上一天休一天，从早上6点上班，一直到晚上12点左右，外包公司特别黑，两个安检口正常8个人，一个半小时可以休一次，但是公司只上7个人，三个多接近4个小时才休息一次，而且正休息那天有时候还喊加班,4,20,1,2022-08-12 09:27:39,来自四川,97084517759,安厦
7130608304883516190,有时候提醒一下，比这样发强得多。如果是同事发，这种同事很可怕,222,3242,65,2022-08-11 21:23:10,来自广东,5354300745,广州哼嗯妈生活日记
7130511163360068365,无论如何上班时间睡觉确实不好 也别事关安全的岗位 除了问题可不是丢饭碗的事啊,4,52,0,2022-08-11 15:06:44,来自安徽,53246631358592,疾走徐观
7130618563332703010,安检员在安检时睡觉，和司机在开车时打盹，是同样危险的！,18,33,5,2022-08-11 22:02:33,来自浙江,4037030005712798,夏夜萤火虫飞飞
7130568429056049961,这么热的天还得全副武装，理解点吧！地铁安检员工作挺辛苦的,16,90,4,2022-08-11 18:48:10,来自法国,72751322381,咪咪2026
7130558679288087304,善意提醒一下，比拍视频好多了,13,326,7,2022-08-11 18:10:59,来自云南,24864240623,赵映霞2
7130521963470570279,真佩服你，盯着拍了二十分钟，不知道提醒一下，如果此时真有违禁物品，你也要负责任。,1,32,2,2022-08-11 15:48:40,来自湖南,3742339211469724,云裳炫绚
7130758806312862497,网友既然看到了，都能拍照了，为啥不当场提醒下呢？还有，媒体是否有了解过此情况是否属实，安检员是否有具体原因打盹？就这样报道出来真的好吗？,20,60,7,2022-08-12 07:08:28,来自北京,92547593359,风飞絮
7130576846282457856,加拿大都没有安检人员，就不能善意一点吗，这人肯定丢工作了,38,199,12,2022-08-11 19:21:04,来自加拿大,690962202362384,四十岁老阿姨重返职场
7130598402303771432,我觉的上班时间打盹是不对，但是，拍摄者看到了可以善意提醒他一下，拍照并上传不可取，说不定安检员会因此丢了工作，毕竟大家都不容易,122,2460,43,2022-08-11 20:44:26,来自陕西,4107367111202750,直爽的快乐
7130648570910819105,叫醒他就行了，为什么要拍了视频上传网络？,14,101,4,2022-08-12 00:01:42,来自河南,2361383551501101,梗衡
7130503422075437839,理解一下，也许特殊情况。我女儿抑郁症时我黑白的守着她，只能上班时候去办公室睡一会，不然真崩溃了。,3,32,1,2022-08-11 14:36:02,来自河北,2533694442309069,乡野红荆花
7130634804051297037,"先不说这个工作人员上班睡觉。
我想先知道，他的班安排的合理不合理？
他是不是连续的上班了很长时间？比如说已经超过12小时。
如果有这些类似的情况存在，我觉得不应该只去责备他或者曝光他。
一个班组的合理安排和调动才是最关键的。
班组长，主管有没有及时巡班？巡班的时间间隔安排的是否合理？高峰期和闲时的巡班间隔是不是安排的合理？
如果基本都做到位了，不会出现这样的情况。",78,827,12,2022-08-11 23:06:29,来自山东,2392145650521613,师说百万生涯正道
7130795008525222694,驾驶员不系安全带，不戴头盔，逆行.....是不是都有被原谅的理由……,7,26,2,2022-08-12 09:28:23,来自江苏,111561299573,老王闲不住
7130798501063476009,如果安检可以睡觉二十分钟，那这个安检这项工作就没有必要有啊，如果有带易燃易爆物品或者是毒品等上车的违法人员的话，他完全可以也有这个耐心等着安检员什么时候睡着了，他什么时候过安检,0,14,0,2022-08-12 09:41:09,来自山东,85614041946,清风月色心
7130650652123906828,作为曾经的上海地铁安检员，我想说，他是有休息时间的，就算今儿这个白班，他都是有换岗的休息时间的，在岗位上睡觉，就是他的问题，任何人不要给他找理由，开除应该不至于，但是，扣钱和队内通报是避免不了了,2,11,0,2022-08-12 00:09:36,来自四川,3328716180,长城守望之峰子
7130794006128575243,评论的矛盾就转移到了安检员和上传者之间的矛盾。但是，原本这不应该是地铁管理公司要考虑的事情吗？工作枯燥易犯困，那就改善工作环境，减少工作时长。工作质量不能打折扣。如果都靠大家自觉，那还设置这个岗位，投入x光设备干嘛？！,6,68,0,2022-08-12 09:24:32,来自上海,3157391229586435,暮夜月明Alex
7130753633750631202,我觉得拍摄者真正的心思绝对不是因为他所认为感觉挺不安全的，如果真的是这么认为的话就应该第一时间叫醒他，而且第一时间叫醒他才是真正的理解和帮助他人，因为这样做首先可以知道这个工作人员是不是因为健康原因而这样？以便于第一时间解决问题，而不是这样袖手旁观甚至有点幸灾乐祸的感觉,31,433,15,2022-08-12 06:47:34,来自浙江,109694161154,懒洋洋爱摩卡
7130746237808362273,我就这么说吧，这要是医生护士在抢救室打盹，估计就被骂死了。这位地铁安检员职责的重要性，相当于保证地铁乘客不被炸弹轰。但是却得到这么多人的谅解！不可思议！,42,109,11,2022-08-12 06:20:24,来自天津,85305708310,无敌好脾气
7130621856641827584,若是这个安检员在安检值班时睡觉，恰恰在这个时间发生了重大的安全事故，会不会评论区里面都是一片原谅.体谅的声音？,8,13,0,2022-08-11 22:15:31,来自上海,3643328454,将梦醒2012
7130553776859595561,不发视频肯定能保住他的饭碗，但能保住全体乘客的生命吗？为啥要设立安检？,4,47,5,2022-08-11 17:51:32,来自四川,101584474329,军玲潇
7130587875413934863,拍摄者不地道，也需他家有病人需要照顾，我母亲得了老年痴呆，每天到晚上不睡觉，做儿女的很累，白天稍微不注意就睡着了，所以不应该拍照，你可以叫他，都不容易，得饶人处且饶人,4,116,7,2022-08-11 20:03:29,来自上海,60859474254,高贵溪水xq
7130613502267458335,现在天气太热了，再加上一直盯着屏幕看，天气热很容易犯困，安检员工作挺重要的，但是这样拍人家有可能让人家丢工作了,36,470,17,2022-08-11 21:43:21,来自福建,3122268100369566,上进朵朵佳
7130614823695549218,你把人叫醒就行了，拍了人家，工作估计要丟了,7,82,0,2022-08-11 21:48:07,来自江苏,3890707210,zyr孙税务师
7130611574419145503,干嘛不可以叫醒人家非得发到网上，得饶人处且饶人，就算有违禁品机器也不会叫,6,271,8,2022-08-11 21:35:55,来自广东,63385859314,麻圆圆
7130645559895212814,现在的人真是怪了，感觉安检上班睡觉是可以原谅的，拍照的人是错的，那个单位员工上班可以睡觉的？何况是安检这么重要的岗位。,71,239,22,2022-08-11 23:48:57,来自上海,9090248342,喜羊羊128590271
7130795723242603305,真会转移矛盾，这个睡觉的小伙子犯了我们可能都会犯的错误，可是第一我们的岗位影响的是自己和公司，而不是公共安全。第二.我们大多数自己的公司会有监管和提醒，而不是要等到别人发现，还得帮压着,0,17,0,2022-08-12 09:30:08,来自山东,15277700899,彼得潘森淼
7130620389562286879,拍照发网上的人不知道自己工作怎么样，把自己工作发网上让大家一起监督一下更好，看你表现怎么样。安检的人睡觉不对，但人不是机器，可以提醒或者告诉领导教育批评，发网上太过分了，应该安检的人工作人员回头，告他侵权。,10,367,8,2022-08-11 22:10:13,来自天津,50307736283,胖苗苗爱睡觉
7130673403706475279,公说公有理婆说婆有理。按理说任何工作都不可以在工作时间在工作岗位睡觉，但是人毕竟不是机器，总有累的时候，只能说生活不易。个人以为，一些重要岗位还是要特殊对待，比如安检、还有高空作业行业、又或者司机等……毕竟眯着了不出事还好，万一有个万一都几乎是人命关天。得为社会，为自己跟家人负责。一些岗位用人还是得慎之又慎。也不必说放到网上有多不好，丢了工作什么云云的，三百六十行，行行出状元。总有对于他来说更适合更安全的，也总有比他更适合呆在安检岗位的，不是吗？,9,95,7,2022-08-12 01:38:47,来自江苏,2594477466192957,悲苦自渡
7130487676926903081,这些都是赶头班车上班的人，起的太早了，提醒一下可以了真不该拍照，绝对工作没了。,22,505,13,2022-08-11 13:34:57,来自上海,59950470080,古夏子
7130491513792529167,这样发上去好吗，如果有违禁品机器会报警，谁没个打盹的时候,48,764,34,2022-08-11 13:49:52,来自浙江,4666870956,我的水杯
7130738799776645902,看他的头发肯定是热的累的又无人换班，谁都是家里的顶梁柱，宁愿这个安检员休息一会平安的上班也不愿这个人累昏过去。肯定是刚开始没人太累了趴一会，想着有人会喊醒他，没想到趴着太累睡着了。拍照的人发现了可以把人家喊醒啊，坐那里数着人家睡了几分钟也太闲了吧……,11,192,8,2022-08-12 05:51:38,来自广东,6801712932,小花奶油米的vlog
7130529051995407138,现在天气太热，一直盯着屏幕确实让人犯困，理解。既然看到了可以提醒一下的。,68,633,15,2022-08-11 16:15:35,来自上海,3593631472556222,林芳9638
7130624664233247518,我个人觉得安全比什么都重要，如果困就回家睡，上班要有责任心，这可不是开玩笑的，万一有心人进入做坏事，那么大家所有人的安全就不在安全了。,16,89,7,2022-08-11 22:26:57,来自江苏,80606131000,艾薇已不存在
7130497492713702181,认为拍摄者曝光做法确实不太妥当，现在大多高铁地铁安检机器都是第三方外包的人员在上班，可能还好多夜班倒班的，一直盯着屏幕肯定视觉疲劳。人呀还是应该心存善念稍微体谅下别人好，如果真担心安危善意叫醒提醒下好了！俗话说得饶人处且饶人，每个人活着都挺不容易的……,178,1520,41,2022-08-11 14:13:20,来自湖北,2069438200,成长自定义
7130539954064704291,这事儿除了亲同事，谁也干不出来。别人也不可能20分钟。,25,686,12,2022-08-11 16:57:41,来自北京,52631034288,极光的味道
7130673792971965219,上海高温天气难免有点累-觉得提醒批评一下即可-拍照者上传过分了吧……,1,67,4,2022-08-12 01:40:52,来自上海,6727266626,大白菜Z上海
7130608917528724228,安检员很辛苦的 一天上十几个小时,78,477,12,2022-08-11 21:25:58,来自四川,4009067396,田tt
7130608375360357152,要是不舒服可以请假，但是在工作中睡觉就说不过去了，安检员的工作也挺重要的，不能麻痹大意,22,183,14,2022-08-11 21:23:49,来自青海,88184584350,山楂树琴
7130607432745157408,安检员其实非常辛苦的。,15,125,9,2022-08-11 21:20:17,来自湖北,1701652248395847,端庄优雅日月无双
7130621050484310825,可能罚款失业,1,4,0,2022-08-11 22:12:25,来自山东,399817097877619,润东龙
7130803551404245793,“将心比心、换位思考，地铁工作人员上班时睡着固然不应该，但他未必是刻意偷懒。要知道，在地铁进站口的安检工作不仅重复枯燥，而且持续的时间也不短。本来就挺辛苦，如果该工作人员是因为过于劳累而打盹，其实也情有可原“，这话写得毫无廉耻，工人上班睡觉摸鱼都还有理了,0,6,0,2022-08-12 10:01:57,来自广东,101816158526,新恐龙战队
7130749046968288041,既然看见别人在打盹，可以善意的提醒下或者投诉让其公司批评教育给予适当惩罚。没有必要拍视频发在网络上造成舆论压力，搞得不好别人会丢掉这份工作。疫情期间大家都不容易，何必这么狠呢？,7,114,6,2022-08-12 06:29:27,来自河北,111025095646,泡泡糖的元气
7130624806236062502,班上的那位同志肯定工作时间长，太累了，可能不小心一時打吨睡着了！当拍摄者看到后可以善良的拉把他，提醒他一下，那工作人员也会觉醒自己不对，而且也会感谢提醒人的！人与人之间应该相互理解一下！没必要拍照下来！更不该发出去！有些过份了，请下不为例吧！[作揖][作揖][作揖][祈祷][祈祷][祈祷],9,143,8,2022-08-11 22:27:58,来自江苏,111067468253,自在青水
7130608308700578574,提醒一下就行，拍照发出来有些不人道了，天热还穿防护服为大家检查违禁品，凡事多一分理解多一份包容！,2,168,4,2022-08-11 21:23:19,来自陕西,53472913414,竟渡
7130511186830852871,都不容易，可以提醒下他，像我们十二个小时，特别夜班，白天怎么睡，晚上还是会犯困，现在好多保安都是12个钟，天气热，稍微眯一会会下午有精神，有的会说困了让别人顶一会呗，可也得有人顶啊，他们还想着眯会呢，生活不易，得饶人处且饶人，我也是干保安的,40,672,17,2022-08-11 15:06:26,来自广东,100261048339,曾经88889
7130545148014625571,都不容易啊！何必呢？锱铢必较！如果经常这样，确实需要批评，如果有突发状况睡觉也情有可原,11,83,3,2022-08-11 17:18:07,来自广东,102074736339,初心还在吗
7130578154707600161,现在的人是真闲呐，你能在那看他二十分钟，就不能叫叫他吗？得饶人处且饶人，你给他发到网络上来干什么啊，你了解他的生活状态吗？你就不担心他会因此走向极端吗？生活不易，请多一点善意！,1,42,3,2022-08-11 19:26:28,来自山东,2928692554634590,多彩钢琴呦呦
7130486694893814563,曾经旅游时碰到一个台湾同胞，大家爬山时有好多老人拿着白萝卜卖，一个20元，我私下给那个台湾人说夸张了平时几块钱就能买到啊，台湾同胞给我说大家旅游，山上啃个萝卜新奇又舒心，老人能卖几个萝卜说不定就是他家一天的生活费，我们看看就好，不要坏人家的生存。,57,198,11,2022-08-11 13:31:16,来自北京,273124734273424,那年那月那一抹阳光
7130498916373857060,累呀！凌晨1点还没睡4点多就上班了，中间休息不到3小时。谁挣钱都辛苦。何必为难打工人ʕ•̫͡•ʔ,34,646,17,2022-08-11 14:18:58,来自北京,84971514314,勇者饺子WF
7130483578790167300,拍照人不地道，提醒一下就可以了，都是打工人,35,1164,25,2022-08-11 13:20:02,来自上海,51298521308,萍萍382
7130631022269465385,发照人不仅为大家安全出行做了一件好事，同时还可以督促相关部门改进工作。比如适当调整安检员的值班时间等，但是不管怎么说，作为安检员身系千万旅客的生命安全责任重大，上班打瞌睡是不对的。解放军很辛苦，可以在战备值班时打瞌睡吗？医护人员很辛苦，可以在手术台上打瞌睡吗？每一个在一线岗位上的人都很辛苦，但这都不是玩忽职守的理由。假如有不法分子携带危险品溜上车引发意外，危及到更多人的生命安全时又该怎么说？,9,60,9,2022-08-11 22:51:09,来自湖北,69447926558,用户夜阑数星光
7130510140633613091,对大家的评论感动了，很多人都是认为应该善意的提醒，而不是发视频谴责,30,483,12,2022-08-11 15:02:17,来自河北,2229452263134196,tlr52894
7130583971326575396,这个还好，也许是太累了天气太势了，年轻人，咱们可以谅解。可我经过衡水火车站时，买票时发现身份证和钱包都掉了，我用微信着急补办身份证时，那补办办身份证的办公室在卖票的右侧，单一间，可我过去补办时那个玻璃小门正开着，我就朝里问，同志俺补一张身份证，可里面没有人打应，我连喊了几声，因为着急买票啊，又喊了几句，可我也眼晴该瞎吧，这段时间傻没有往小窗门下看，这时只见一个特别美的铁路制服衣从窗下的沙发上懒羊羊地没好气地喊我，你想干什么?我说明快况后，那女人起来后又不耐烦了，像审二大爷似地数落了好几次,2,2,2,2022-08-11 19:48:45,来自安徽,54911694595,兆庆123456
7130790696395014923,也不能这样以为。比他辛苦的有的是。比如：科研工作者、飞行员、航天员驾驶员………不一一列举。如果都睡上20分钟……,3,19,2,2022-08-12 09:11:56,来自山东,360248920784443,有趣的豆浆TN
7130514266633061134,你可以把他叫醒！拍视者不善良！[灵光一闪]因为你的上传视频，也许他会丢了工作！,5,181,5,2022-08-11 15:18:32,来自天津,6804413750,手机用户缘就是我
7130631498134815523,1，合理排班管理人性化，可能是排班不合理导致工作人员疲惫，毕竟每个人精力有限。2，合理安排人手，两个人值班比较合适，一个不顶还有一个，不然一个人真有什么事就分身乏术，比如人有三急。3，加强工作纪律培训，干工作不能有畏难情绪或敷衍大意，可以不接，但是接了就得干好。,4,18,2,2022-08-11 22:53:18,来自重庆,60442505759,直率高山61
7130788464882287390,新闻的观点很简单，这本来就是摆设，别当真,6,17,0,2022-08-12 09:02:34,来自上海,104966236190,小卡西乌斯
7130502050013643552,就这二十分钟如果违禁品带进去了，后果不堪设想！,31,171,17,2022-08-11 14:31:30,来自新疆,391054199623518,hrq欢欢喜喜
7130658073533973259,我觉得他打盹是不对，对工作的不负责，万一出了事也就晚了。但是这位拍摄视频的先生，是看笑话一样的看了20分钟。我不觉得他做的对，大部分人都是发现问题会本能的善意去提醒别人。总不能看着别人一直错下去。,0,2,1,2022-08-12 00:40:17,来自山东,2502934022600935,晨曦爱阅读
7130795792268854024,“我们当然无从得知拍摄者的心理活动，也不该胡乱揣测其真实动机。但有一点是肯定的，在把视频上传到网络之前，我们每个人都应该慎重，更慎重。因为，视频画面不管再怎么清晰、生动，也不一定能完整、全面地反映事件的全貌。这就可能会让网友产生片面的印象，甚至形成根本性的误解。而不客观、不中立的描述，必然会引发极端、偏激的观点，以至形成不必要的舆论冲突。”写得太好了,0,10,0,2022-08-12 09:31:19,来自四川,3922648709994349,Car01ina
7130511186470732557,拍摄者真不地道，真的可以叫醒一下，你知道值班得人多幸苦吗？也许她是生病了，或者咋了，我自己就深有体会。不要一看到啥都觉得自己都是对的，人不要太咄咄逼人…很多时候不是你想得那样，你这是害人又害己。,25,276,14,2022-08-11 15:06:39,来自广东,3604216041,姜柳彤
7130735696876864270,小兄弟，你睡觉期间，若混入了管制物品，后果会很严重的。知道不？,1,17,3,2022-08-12 05:40:04,来自广东,1856423724065600,优雅双辽4V3
7130528369833558824,去过几个城市，感觉上海的地铁安检真的是最不靠谱的！主要是乘地铁的乘客很不自觉，很多人根本不安检就进站，遇到安检员拦截还要恶意辱骂，甚至打人！我同学就是地铁警察，他都被乘客打过耳光[发怒]这种情况在外地至少我没见过，都是乘客自觉安检的,34,89,16,2022-08-11 16:12:51,来自上海,84086658564,探戈舞之猫
7130587505183327007,他们都是劳务派遣，上海4800块钱一个月，除了房租所剩无几,58,432,9,2022-08-11 20:02:38,来自四川,1627722023964359,小小的水木木
7130618494349427460,如果一天在干8小时我相信不会睡觉吧！,4,7,0,2022-08-11 22:03:03,来自广东,52481220118,可乐销售
7130620056618894080,谁拍的，太不地道了，叫醒他不行吗,5,125,3,2022-08-11 22:08:41,来自河南,71959698839,信任等于零
7130503470574420736,我认为工作时再辛苦都不应该睡！安全无小事，既然在岗眼睛就应始终盯住屏幕，不能有任何疏忽！责任重于泰山！,16,61,12,2022-08-11 14:36:21,来自湖北,53271375408,玄明粉
7130521338854458116,他应该不是故意要睡觉的，疫情之下都知道找工作难，人们都会珍惜自己的工作。这种情况可以罚款批评下，别闹大了弄丢了饭碗。可能他身体原因或者家里有小婴儿吵闹，长期睡眠不太好，这天刚好就坚持不住了。,4,130,5,2022-08-11 15:46:37,来自辽宁,104821590253,团团arise
7130487253872509700,疫情期间他们这些第一线的工作人员很累，说不定你看到他时候已经连续工作20多小时了，,40,514,11,2022-08-11 13:34:09,来自海南,50026837176,霞124270016
7130574313106703116,你知道别人一天上班多少个小时吗？,58,216,18,2022-08-11 19:11:46,来自湖北,109633008617,杨阿姨173
7130493074928829191,睡就睡吧，这个岗位本来就形同虚设的,32,574,9,2022-08-11 13:56:13,来自上海,102210538154,寒冬腊月面朝大海
7130481583303721732,如果不舒服可以回家睡，在工作时间睡觉怎么也说不过去，不要说累了太累了哪个上班不累呢？,46,178,22,2022-08-11 13:12:10,来自内蒙古,501804823755327,晓儿之佳
7130724023230808839,是什么原因造成上班睡觉是另外一回事，就说安检员的工作重不重要，他的工作失误会造成什么后果[what][what][what]如果这个后果造成的伤害正好落在你家人的头上，你认为该怎样对待安检员得上班睡觉[what][what][what][what],0,30,4,2022-08-12 04:57:07,来自辽宁,1648877612051421,用户20380枫桥
7130641057166951179,有拍视频的时间为什么不叫一下安检员那 万一安检员是身体不适不就耽误了治疗时间吗,0,8,0,2022-08-11 23:31:32,来自上海,110273693157,梧桐树下8879
