7130763102446142238,安保本身工资不高。可能这位同志比较疲劳。批评教育就可以了，这种人上传就不可以了就不对了，毕竟大家都不容易。安检员都上十几个小时。特别是外地人领着最低的工资，干着最累的活。,0,1,0,2022-08-12 07:24:29,来自上海,103247879639,富足咖啡zX
7130800357000889125,给你最低工资你也会睡觉的,0,0,0,2022-08-12 09:48:56,来自上海,64893197381,36553485
7130781786237600543,意思就是 错了不认，还要责怪举报的人？,7,49,5,2022-08-12 08:36:49,来自江苏,3150675843,素天洐
7130807000367661831,据我所知，地铁工作人员是没有调休的，如果有事，只能让人顶班，再连续补班，钱💰不多工作很辛苦[流泪],0,1,0,2022-08-12 10:14:35,来自上海,4859388901,大陆199554847
7130674552065721101,这不是很正常的事情吗？人家天天盯着屏幕看，然后又坐着，到地铁里面的空调又舒服，肯定容易打瞌睡啊！肯定是这个，安检员上班时间过长了，导致打瞌睡的。,0,0,0,2022-08-12 01:46:14,来自广东,2467772949077223,平凡的人9785
7130575513366119207,拿起手机，就是自媒体……唉，一般的地铁站都不穿防护服了，除了火车站飞机场，这种天天盯着屏幕的，累不累都知道，希望还是能得到提醒，而不是这样宣传,0,0,0,2022-08-11 19:16:33,来自上海,3827223642,小小卷28061937
7130811858021499660,拍摄者上班时从来没做过其他事？,0,0,0,2022-08-12 10:33:32,来自上海,52384550840,绿色太阳海
7130575454809162499,地铁安检也累啊,0,0,0,2022-08-11 19:16:23,来自山东,50919030358,汪可喵懒兔兔
7130616889856426787,为什么不提醒一下，叫一下，你足足观察了二十分，看热闹不嫌事大，也许身体不舒服，也许加班累的，也许生病吃药犯困！成人的世界不容易！,0,42,0,2022-08-11 21:56:17,来自甘肃,51124192692,cengxiann
7130795626102883102,网络是有两面性的，一方面有积极的，一方面是消极的。有很多东西你可以表达自己正确的观点，另外一点也有容易被一些不好的事情操控。比如说我前段时间遇到了一个妈妈，她办了会员卡享受了会员的待遇，然后一转身就想把卡里的余额退掉，然后我很礼貌的跟她说这个退不掉的时候，她一边怒吼着你就是违法的，你这是霸王条款，一边威胁我，你小心我用黑网文黑死你。搞到周边的那些客户，看着她都已经很无语了。,0,0,1,2022-08-12 09:30:29,来自湖北,106287542125,大势天下
7130654538012312355,天气太热，工作人员很辛苦。既然看到了，应该提醒-下。,0,0,0,2022-08-12 00:23:34,来自陕西,2348975140381215,快乐心静如水77
7130798420453081889,"安捡员上班睡觉是不对的，即使能体谅可能因辛苦或某种原因造成，但也首先得承认这事不对。因为可能会造成安全事故。
这位拍摄者反映情况，没错。（不必过份分析动机）
但必须承认要是当时提醒“更好＂，就减少了二十分钟的＂可能产生安全事故的时间＂。
试想，假如在这二十分钟內产生了事故，这拍摄的视频就没起阻止事故发生的作用。（当然对事后分析事故，警示以后还是有作用的）
而当时叫醒提示，则可起防止作用。",0,1,1,2022-08-12 09:41:42,来自山东,62635106012,梦叟痴语
7130553112217682696,就算不睡觉，能指望他检查出东西？,0,0,0,2022-08-11 17:49:25,来自上海,1957889852,神气小白1985
7130801072381215524,每个人都把自己的工作干好，都有相互监督的义务和责任，这个社会才会健康的发展进步，监督只要不掐头去尾客观事实为自己的行为负责就是了，只要不是恶意的就行了，普通老百姓那有那么多思前想后，顾虑太多不发声是一种退步，路见不平一声吼，該出手時就出手，身正不怕影子斜。,0,2,0,2022-08-12 09:51:26,来自陕西,4076577135001684,贤二A
7130490088450081550,我老婆也是在上海地铁上班，工作时间特别长，你这一拍铁定丢饭碗,0,20,0,2022-08-11 13:44:37,来自上海,109216208207,JerryFei
7130794666987160358,工作辛苦，坐着睡了，实在太困了吧！,0,0,0,2022-08-12 09:26:59,来自湖北,94342657011,abc人在旅途
7130797521760224033,拍的是事实，从头到尾没有一点虚假，为什么不能拍？至于别人怎么看那是别人的事，公司怎么处理那是公司的事，拍摄者有什么错？不用说他睡觉我能拍，他就是不睡觉我也可以拍啊，这是公共场所不存在隐私，我拍照上传是我的自由,0,3,1,2022-08-12 09:38:09,来自山东,4234955242081972,1⃣ 💓 向💰
7130505150594564903,"年轻人找个工作不容易啊，你想过没有，你的这个视频很可能就把娃娃的工作弄没有了。
你善意的提醒他一下，是积德行善的行为。
你有20分钟拍视频的间。
现在的人都不知道咋想的。",0,10,1,2022-08-11 14:43:59,来自陕西,50030483409,文玩市场123
7130782689074397960,安检员上班时间睡觉犯错就是犯错了。一旦出现恶性事件怎么办？不要说谁都会犯错，你在家犯错和工作时犯错性质就不一样，一旦出事，造成的后果不一样。,0,0,0,2022-08-12 08:40:24,来自江苏,100449795520,淡泊的蜻蜓jl
7130811678882628367,叫醒或者找他上级领导投诉都没问题，拍视频发网络可能这个人因为你的一个视频舆论压力就丢饭碗了，得饶人处且饶人[酷拽],0,1,1,2022-08-12 10:32:02,来自广东,105517330351,佪眸毅笑
7130769122136687372,应该多问清事实真相再发图！是超长工作时间导致，还是个人原因，搞不好害的人家丢工作,0,0,0,2022-08-12 07:48:30,来自江苏,3553265988678856,向日葵请乖一点
7130500221905748767,体谅打盹的你想过没有，要是开大货在高速上打盹是什么后果？这是一种责任，你上班就应该有一个上班的样子，再说你又不是24小时都在岗，你把应该休息的时间去外面嗨掉了，你就应该上班打盹？,0,13,1,2022-08-11 14:24:04,来自重庆,1248657368164685,鹏的理想蔚来买特斯拉
7130618017004307204,希望地铁公司能了解一下情况，高温天可能有各种不适，安检员也不易，长时间盯着屏幕容易睡觉，从作息时间上考虑能否适当增加休息时间，确保一线员工的身体健康,0,0,0,2022-08-11 22:01:27,来自上海,914425386894951,自强不息星辰Ay
7130646043338883853,这也拍，防控人员也辛苦,0,0,0,2022-08-11 23:50:49,来自广西,6211964146,小阿丁丁丁
7130762467063366436,为什么感觉拍摄者也挺可怕。看着人家睡觉拍照发网上，再说可能会影响到安全，说的特别大义凛然一副为公的好样子。,0,1,0,2022-08-12 07:21:59,来自四川,2777810770,天亮初晴
7130634268782625547,曝光的好，必须要引起重视。如果你当天确实身体不适，不能完成当天任务可以提出休息一天，或让同事代岗。万不可形式主义，岗位如同虚设……。地铁安全可来不得半点马虎，这也起到了全体地铁工作人员的警示。,0,1,0,2022-08-11 23:04:50,来自上海,4623806977,发文说我呆
7130811206776013580,天气热，老盯着屏目容易犯困，打个旽也正常，虽然不对，可现场提示，何必小题大作，夺人饭碗。,0,0,0,2022-08-12 10:30:59,来自湖南,2784721944,凯儿ke
7130772436857602846,可能连轴转干了快40个小时了,0,1,0,2022-08-12 08:00:49,来自浙江,2999057307411981,江左鸟道
7130791521711997710,都是刚毕业或者实习的学生，至于拍照片？前几天晚上8点多，南京2号线，客流量比较少，安检人员也在打盹，我一笑而过，却在想，这孩子要多困啊，安检也能睡着[捂脸],0,0,0,2022-08-12 09:14:22,来自浙江,53456072886,你好我也好886
7130769665416217359,提醒一下，都不容易,0,0,0,2022-08-12 07:49:22,来自四川,110908914998,奂奂妈
7130723833476121383,你觉得安检员这个岗位形同虚设，可有可无，但你这样一拍照，岗位还在，领导还是领导，这个睡觉的人却饭碗不保了，有时候提醒一下就好，当然态度不好的再曝光！,0,0,0,2022-08-12 04:57:15,来自上海,58899893858,Mc张叫瘦
7130773355561075493,一看是上海，感觉还是严谨点比较好，毕竟那边防疫还是不能松懈的，在岗位上睡觉还是大庭广众下，比离岗睡觉造成的负面影响还严重,0,1,0,2022-08-12 08:04:21,来自天津,4252508335120691,浪淘沙MVP
7130638872593646368,地铁这些安检员并不是真正的警察，他们每小时只赚15块钱左右。,0,5,0,2022-08-11 23:23:19,来自北京,1107920661257053,一杯红糖水4y7P
7130663251225903913,我突然觉得有时候自己缺少了善良之心，但是却感觉自己很正义[捂脸],0,0,0,2022-08-12 00:58:05,来自山东,63329234564,谁的白月光谁的朱砂痣
7130801425088774952,非常时期你这一发 社会上又多了一位下岗的 每家的情况不同 谁没事会在上班时睡觉 可能这个老哥刚医院陪夜好就来上班了等等等等 和谐社会 大声的提醒下也好过看似无害的拍摄,0,0,0,2022-08-12 09:52:27,来自上海,105117993594,上海70后
7130769555571950370,你可以提醒一下，没必要发这种，你发这个可能他还在打盹，你如果提醒，他就会继续工作或者换岗,0,0,0,2022-08-12 07:48:57,来自江苏,3995987405,Nicole31265101
7130622000812770085,都是人，不是机器，我认为实在是太累扛不住了，才会在不自觉中打盹，多体谅，可以立即提醒，发视频，带着高要求，虽然不错，但是有点苛刻。因此，您应该是及时提醒，而不是发自媒体！,0,1,0,2022-08-11 22:16:32,来自江苏,92722766337,洒脱星星qo
7130612011469767432,应该提醒他一下，不要上传照片，把工作给搞丢了，年轻人也不容易,0,9,1,2022-08-11 21:37:48,来自上海,99586529438,多彩书签Qw
7130785864946893604,工作时长需要达到12个小时，能挣200都不错了，不瞌睡才怪,0,0,0,2022-08-12 08:52:39,来自河南,149950479484334,甜甜的
7130799067567145768,首先，抛开工作时间不谈，他累与不累也不谈，睡觉就肯定不对的。但是，拍摄的人想让他受到的是处罚而不是叫醒他这么简单。所以，各位看官，别想那么简单。当然，有时候处罚的教训要比叫醒他来的更深刻一些。,0,0,0,2022-08-12 09:43:25,来自辽宁,2726354832,漂泊就是远方
7130653763455025931,干的就是这份职业，安检关系重大，睡觉绝对不能原谅同情，血的教训还少吗，,0,1,0,2022-08-12 00:23:05,来自北京,1195872022181501,三万二千尺
7130598728192623397,人来人往的岗位上能睡着一定有他不易，多点理解和关心,0,0,0,2022-08-11 20:45:57,来自福建,92314855375,真名假名都没份
7130486645316961065,我每天上班，都睡一个小时，不要苛求别人,4,10,2,2022-08-11 13:31:00,来自重庆,4735183521,大号哪什么哥
7130776210355274531,现场善意提醒下就行了，工作很难找的好吧。,0,0,0,2022-08-12 08:14:45,来自宁夏,61689089235,喜爱收藏的吉祥庄
7130643021171049216,安检员的工资是多少？都是跟劳务公司签的合同，有的连保险都没有，现在的铁路客运地铁咋招人都是第三方劳务公司，比资本家还要资本,0,2,0,2022-08-11 23:38:12,来自江苏,21927310635,家有群贝
7130801693046211328,上海地铁小包需要过安检吗？？？？,0,0,0,2022-08-12 09:53:31,来自陕西,51557601024,西土安著
7130619827235930910,这是安检！既然在这个岗位就要对自己的工作负责！[酷拽],0,1,0,2022-08-11 22:07:56,来自江苏,59485533442,律政先锋丨张益达
7130567096262214435,既然是看到了，提醒一下又何妨！发在网上好像欠妥！,0,15,2,2022-08-11 18:43:12,来自重庆,6385785112,人之初87003256
7130790980559225631,应该叫醒的，不应该发到网上，不是太累了也不会这样了,0,0,0,2022-08-12 09:12:29,来自河南,7617842103,坦荡的旭日gI
7130799799493886760,谁上班没个突然犯困打盹，眼皮睁不开。或者突然不舒服的时候，提醒下就行了。,0,0,1,2022-08-12 09:46:02,来自上海,3540078139283804,火狐的天空
7130762374164054814,评论区好多奇葩，安检员是不能打盹的，工作就是工作，做不好好不能收惩罚了吗,0,1,0,2022-08-12 07:21:49,来自江苏,111041048094,机智的清风kI
7130779624803468064,北京地铁站这样的可多了，浪费乘车人的时间,0,0,0,2022-08-12 08:28:40,来自北京,6241691841,gnawvv
7130592697211355939,都是打工人，提醒一下即可，这视频一发，工作估计没了,0,0,0,2022-08-11 20:22:16,来自中国澳门,452588461362301,DAIP
7130773401534939945,这样的人应该有很多吧！昨天跟女儿坐公交车，那个驾驶员一直在一边开车，一边玩手机，坐得我们是心惊胆战的,0,0,0,2022-08-12 08:04:00,来自贵州,4208571122724908,多彩河流Yh
7130632187262731008,拍视频这种动作不可取，可能你的视频的上传，你的收视率保证了，别人可就饭碗丢了，谁也不是铁打的，毕竞不是驾驶员这类的，绝对不允许打瞌睡，善意提醒，换作是你打瞌睡，别人发照片传网上，你怎么想？,0,0,0,2022-08-11 22:55:44,来自上海,61490679975,朴实山丘sU
7130786244333699879,都喜欢马🐴儿跑，都不喜欢马🐴儿吃草[捂脸]，从早上6点上班，到晚上11点半下班，才一百多块钱，每天都睡眠不足，谁不瞌睡？ 这些大都是寒暑假干兼职的学生。谁家里没孩子？你会对自己孩子这么苛刻么？,0,0,0,2022-08-12 08:54:17,来自天津,4029040304854739,就这？
7130612826464748288,拍照人其实应该叫醒他的。这样大家都不安全。,0,11,2,2022-08-11 21:40:24,来自河北,3091418288763179,用户迎风招展
7130542739460522787,应该提醒一下，肯定有什么不舒服或别的情况，否则 不会大白天趴在那里，这么多人进进出出没有反应吧！理解一下吧,0,2,0,2022-08-11 17:08:35,来自上海,1226684722057511,多才多艺露珠yG
7130480263607927564,这是不可取的，当班吗要有当班的样。我也同情这位，大热天的不容易，但要记住自己的值责。,2,9,0,2022-08-11 13:06:59,来自浙江,2445731326343288,智勇双全苹果pp
7130620716726502174,如果真的因为他睡觉而有人带危险品进站并发生了严重的事件。我想评论可能就是另一种情况了。肯定不会有这么多人指责拍摄者,0,0,0,2022-08-11 22:11:25,来自江苏,101415502483,鸽子284550972
7130779342048723723,我看到好多人说，应该提醒他一下，我想问问，他是在干嘛，上班吧，那他自己心里没点数，人家给你发工资，你上班睡觉，还得别人提醒，[抠鼻][抠鼻][抠鼻],0,0,0,2022-08-12 08:27:35,来自安徽,1530984784209656,瑞祥制衣厂
7130662427318043403,没个人都工作，开个小差而已，处罚一下得了，别上纲上线，大家都不容易,3,1,0,2022-08-12 00:57:21,来自浙江,109981502704,张雪岗的
7130771024559309582,首先应该体谅每一位工作在一线的人员。都不容易的。发视频应该慎重，搞不好会影响人的一生。我感觉应该增加工作人员减少工作时间。也要倡导大家不要带违禁品上车。,0,0,0,2022-08-12 07:55:09,来自山东,4085405441337588,有趣的芒果CR
7130790110492853026,你叫醒他就行了，你这样曝光他，也许他就丢掉工作了，,0,0,0,2022-08-12 09:08:40,来自江苏,97370948845,想去赶海
7130791826680415007,谁上班没打过盹儿，善意提醒一下就好了，不至于发到网上吧。如果觉得提醒当事人起不到作用，给主管部门反映情况也可以，发到网上这个人不仅要丢工作，后续的生活也会受到影响。,0,0,0,2022-08-12 09:15:53,来自广东,111280809597,雲说
7130495969611318053,"你到是给他叫醒啊 
 耽误这20分钟
工作还能保住吗",0,10,1,2022-08-11 14:07:38,来自吉林,4248112343561294,热情星空JW
7130810868954628894,拍摄的人居心何在，看到了为什么不提醒，还看了20多分钟，,0,0,0,2022-08-12 10:29:47,来自江苏,51888625506,向你忏悔
7130579238252184358,太辛苦了！缺觉，提醒一下、别照[祈祷][祈祷],0,0,0,2022-08-11 19:31:03,来自北京,10621535598,运筹帷幄钢琴ef
7130768635358331682,这个安检员的工作不稳定了,0,2,0,2022-08-12 07:45:32,来自湖北,20236766202,金色阳光154898383
7130774647905518344,安检是不能有一点马虎的，这个工作的性质是为了大众的安全，如果因为这次疏忽有人带了不该带的并发生了意外，他是要承担法律责任的,0,0,0,2022-08-12 08:09:16,来自江苏,316279676997975,越割越勇的韭菜
7130619961181405967,安检员上班唾觉，他的责任呢，安全当儿戏谁不辛苦出事怎么办呀！,0,0,0,2022-08-11 22:08:09,来自海南,2141484652959572,进取暖阳kP
7130805156349887240,抛开上班睡觉不谈，抛开地铁安全不谈，拍摄者就不能替他值班吗？拍摄者就不能买两罐红牛帮下他吗？,0,0,0,2022-08-12 10:07:13,来自湖北,3105769484,Mi_雾森林
7130479615667585827,真的不应该睡觉，他的岗位责任重大，必须严肃处理,12,38,9,2022-08-11 13:03:38,来自上海,58499153482,阳光见彩虹
7130763133094200096,不管什么原因，失职就是失职，不可原谅！哨兵站岗辛苦不？难道只因辛苦就可以放下枪打瞌睡了吗？,0,1,0,2022-08-12 07:25:20,来自广东,52175212646,帅乡軍娃子
7130773985071252228,可以提醒一下，或许太累了,0,0,0,2022-08-12 08:06:56,来自河南,75679912938,ANUO
7130770195613975296,我也碰到这种事我当时叫醒了！你发网上来工作还保的了吗？都不容易互相包容一下吧,0,0,0,2022-08-12 07:51:29,来自天津,3598345014,吴雅婧
7130551948642059048,晚上热的很，没有睡好觉，白天打盹也是无奈。,0,1,0,2022-08-11 17:44:27,来自湖南,3355343897502312,单纯阳光Xs
7130600949558952743,我很多善解人意的网友点赞，希望地铁公司查实后从轻处理，宽容理解万岁！,0,0,0,2022-08-11 20:54:52,来自上海,105829929938,睿智端庄生活家
7130550287186002688,你们站在道德制高点看问题，上班睡觉对吗？错了就是错了，你可以善意，也可以理性。这个世界是🈶️规则的，睡觉🈶️两种可能，晚上出去玩了/晚上出去兼职了,0,2,0,2022-08-11 17:37:59,来自安徽,57795908236,内向小白
7130784391236272931,不是“感觉挺不安全的”，而是凭什么我在上班他能打盹“感觉挺不舒服的”。,0,0,0,2022-08-12 08:46:34,来自浙江,6905895530,十里桃花落一地
7130763584472843049,如果真是为了地铁安全着想，应该在第一时间叫醒，提醒他坚守岗位；如果只是为了热搜炒作，应该。。。算了，当我没说[黑线],0,1,0,2022-08-12 07:26:10,来自上海,97417304954,晗淚l聽雨
7130779008115589899,地铁安检睡觉碰到不是一次两次，出声提醒也不搭理，他的同事只当看不见。,0,0,0,2022-08-12 08:26:46,来自上海,2871572062027576,风雨会东方
7130785358312391427,安检靠机器会报警，谁敢说自己上班的时候没打过瞌睡，这年头都不容易，没必要砸人饭碗子吧,0,0,0,2022-08-12 08:50:56,来自山东,55533554584,风往哪里走
7130771670775628580,上海十年，地铁安检非强制，半自愿,0,0,0,2022-08-12 07:57:29,来自浙江,1864401089209279,龙先生272
7130773910643114783,全世界地铁，就中国有安检。这种安检模式只适合机场根本不适合地铁。放了也是低效、多余,0,0,0,2022-08-12 08:06:22,来自上海,949571177161827,胡木进
7130780565103854376,可否查过排班合理性、员工是否长期加班身体超负荷、员工个人的身体健康等,0,0,0,2022-08-12 08:31:38,来自福建,55914967148,沫沫148297831
7130766081983333154,安检分白夜班，并不是累的，估计是昨晚玩手机熬夜了,0,1,0,2022-08-12 07:35:33,来自江苏,6281456650,SUN84380291
7130626558909645608,安检员工作性质威慑作用大于实际作用，。。。。。,0,1,0,2022-08-11 22:33:55,来自上海,6940008405,别问我是谁120323701
7130783963232338691,"（下载红星新闻，报料有奖！）
真讽刺这篇文章最后的一句话",0,11,0,2022-08-12 08:45:31,来自广东,55343970040,-CB1
7130802851630416679,他上班睡觉是不对的，但是我觉得你善意提醒一下，比你发在网上好的多，兴许人家连续工作很久实在是太累了，都是打工人，互相理解一下会更好,0,0,0,2022-08-12 09:58:42,来自辽宁,109535645896,机器人爱泡椒
7130793299816055555,1.他们也是人，很多原因可能导致他打盹，并不一定是他偷懒。2.我们的国家没有你心理阴暗想象的那么不安全。3.你把这个发到网上，很可能会让那个小伙子丢了工作。,0,0,0,2022-08-12 09:21:45,来自广东,51853549037,王大爷粤分爷茂名支爷
7130473684368196391,完了！这个得开除了。饭碗没有了,3,9,0,2022-08-11 12:41:13,来自陕西,5984102369,兰德LX570
7130775974547309353,如果所有的安检都睡觉该多好,0,0,0,2022-08-12 08:13:54,来自上海,93698840500,tindalizym
7130755367302398754,总有人站在道德的制高点对别人指指点点，试问一下，不管是老板，还是打工人，在工作岗位上没有出过小差？,0,30,1,2022-08-12 06:54:08,来自北京,60460392795,一年改一次
7130627732971111171,确实枯燥和辛苦。见过安检的小孩站着都瞌睡,0,0,0,2022-08-11 22:39:27,来自北京,82910896577,某马木
7130495574155592459,坐地铁也碰到过。 其实说实在的，上海的地铁站真要是有坏人想带违禁物品进站，都不用过安检的。看看周围的一米五围栏。分分钟搞定。,0,5,0,2022-08-11 14:06:36,来自上海,94192405683,上海交响音乐厅
7130785507558671112,安检是安全线，你们竟然觉得安检睡觉是正常的,0,0,0,2022-08-12 08:51:33,来自福建,13711534599,美缝小余
7130649250836824845,地铁不用安检更好。,0,1,0,2022-08-12 00:04:04,来自浙江,6083885683,船78386799
7130664414571119394,非把这事拿出来上纲上线就不对了，我不光上学时偶尔犯困睡觉，参加工作后领导开会有时也会睡着，但我不认为我不是一个好同志。都是打工人，都不容易，宽容一点吧，拜托！,0,0,0,2022-08-12 01:03:14,来自山东,100335601632,鱼羊野屎
7130656570744079119,不对就是不对，别说辛苦不辛苦，我公公农民工，在工地扎钢筋，这活只能露天，一般是顶大太阳做，辛苦的多了去了，我现在才下晚班，今晚背痛得厉害，实在坚持不下去了，幸好下班了，别说什么他辛苦，一个岗位有一个岗位的不容易，失职就是失职，一群人不分好坏就跳出来说辛苦辛苦，真是道德婊,7,53,4,2022-08-12 00:31:34,来自广东,2926727320,啵一个赞
7130651017221276457,视频谁拍的？太过份了。你有空拍视频，就没空去叫醒他吗？也许是人家安检小伙子下了班还要去打另一种份工呢，人家真的是太累了，就打了个瞌睡，你去叫醒他不就行了吗。,0,2,1,2022-08-12 00:09:34,来自上海,59200449666,宝宝哥978
7130479849700901667,越是底层人越会为难底层人，就像保安总和外卖小哥过不去,1,22,2,2022-08-11 13:04:23,来自上海,3605440843,最好的时刻是当下
7130573662721409792,有许多拍摄者在危险的时刻拿着手机记录而不去施以援手 如果他或她因为没得到救助受伤或逝去生命 他们一辈子会心安理得 安全固然没错 事情明明可以做的更好 他却没有 反而伤害最大限度的体现 人心叵测i！,0,0,0,2022-08-11 19:08:26,来自浙江,69394827824,哈哈哈有一说一
7130764759506633486,安检这个岗位很重要，不能松懈，对事不对人，既然干了这份工作该有的责任心还是要有，,0,0,0,2022-08-12 07:31:10,来自河南,378644644766519,不解你de风情
7130651439126610721,安检都是合同工 不是地铁系统内的,0,0,0,2022-08-12 00:13:11,来自江苏,93134178664,努力的小康奋斗吧
7130795162414498601,你上班睡觉有理了，既然睡就不要怕人家拍视频，市民有监督的情况权利，这个新闻观点很奇葩,0,3,0,2022-08-12 09:28:16,来自江苏,78809210242,喜欢简单
7130630615653171980,地铁管理很严，夜班12小时都不让合眼，上班很累的。,0,1,0,2022-08-11 22:50:46,来自四川,85793524278,天天天蓝196
7130779348176864015,[泣不成声]孩子的工作丢了,0,0,0,2022-08-12 08:26:53,来自河南,56204303235,40花仙子
7130625107252577055,安检劳动强度太大了，要好好休息,0,0,0,2022-08-11 22:28:29,来自北京,109972285815,曲波198
7130774379285758731,安检睡觉不可以 公共安全不能有一丝马虎,0,0,0,2022-08-12 08:08:43,来自辽宁,4041423262581572,活人布兰德
7130805537435960103,特殊岗位的确要谨慎，但不排除因为晚上上班到很晚，早上还要早点起来，换谁都会困，但也反应出待遇问题，早上6点到晚上23点两班倒是不应该出现这样问，但如果是一班倒情有可原！等后续结果再作定论吧！,0,0,0,2022-08-12 10:09:06,来自广东,905594714456587,坐沙发的磕瓜群众
7130647210554917672,地铁工作人员很辛苦的，善意提醒一下，比视频曝光更人性化，你的行为会影响他的工作甚至一生。,0,0,0,2022-08-11 23:54:36,来自上海,1987545941677486,顶级远山WP
