7130505091110404902,有没有可能打盹2分钟，被拍摄者说睡了20分钟,4,18,2,2022-08-11 14:43:07,来自刚果（金）,3712372515541119,QMM0718
7130603592280834824,地铁安检员工作时间很长，这个工作都干不久，实在太辛苦了，地铁每天都在招人，工资又低,0,0,0,2022-08-11 21:04:50,来自湖北,7024254562,危机三伏
7130717845365015330,说实话，没有千日防贼。真想带，怎么都能带进去。地铁又不像高铁还有金属探测。真要身上绑个啥，又不搜身...[黑线]安检力度都是随机的，有的时候是个包都要过安检，有的时候，主动打开给检查员看就行。[狗头]只要你不嫌麻烦，一切从严也不是不行～,0,0,1,2022-08-12 04:32:09,来自上海,54370500106,高冷狸猫喵
7130731381516698372,这些都是赶头班车上班的人，起的太早了，提醒一下可以了真不该拍照，绝对工作没了。,0,1,0,2022-08-12 05:25:35,来自内蒙古,51252812959,凤传奇438
7130794818812691237,估计很累吧，善意提醒一下会不会更好一点呢？,0,0,0,2022-08-12 09:27:13,来自上海,76601821041,鸾雀
7130570234670793479,这个对地铁里工作的我最有发言权，地铁站很多都是劳务派遣，说好的8小时工作制，早班6点到下午2点，晚班14点到晚上10点，其实早班凌晨3点就要起床刷牙洗脸等到3点半就要去寝室门口等公司班车，班车一路接人停停到你上班的地铁口站就要一个多小时，到了你上班的地铁口站要打卡开晨会换工服又要几十分钟，晚班不到夜里12点半是下不了班的，最主要的是超过8小时外的都没有加班费[捂脸][捂脸][捂脸][捂脸],2,7,3,2022-08-11 18:55:49,来自安徽,100056337599,一条好汉三个绑
7130785514441409280,转发加同意：喊一下都比发这种强，无基层互相伤害，真不是啥优秀的本事，。。。。首先安检在职睡觉肯定不好，可以提醒可以批评，但发这个的更恶心，明明是不怀好意，还拿安全说事，唉。最危险的，。。。果然还是人心！！！！,0,0,0,2022-08-12 08:50:45,来自上海,59040638151,清纯的一元
7130595921872208675,"这种事情在北京地铁也不鲜见，工作人员也是人，不是机器人，谁也做不到全神贯注盯着视频几个小时。
以小见大，拍视频的这个人，在工作生活中绝非善类，定是那种背后爱打小报告、给别人扎针的宵小之辈，伪君子真小人。
如果此君真对社会安全那么在意，可以去投诉，可以把这个人叫醒，而不是在旁边守了20分钟，然后拍视频上网，刻意砸别人饭碗。[酷拽]",0,4,1,2022-08-11 20:34:52,来自北京,3671961325813559,Backinham
7130773201759699751,十二号某站的安检哥们 经常睡觉😪我连续看到过两次....震惊！,0,0,0,2022-08-12 08:04:03,来自上海,70197320502,许三妞79998
7130520705896448809,你也太坏了 换了是你亲戚呢 你也这样吗 工作都有打盹的时候 提醒一下就可以了,0,21,1,2022-08-11 15:43:11,来自山东,73073945144,吉祥5529185622648
7130546838977430303,在其位，谋其事……干不了就换工作，不要说每天只睡4小时的话，这是不可能的，都是轮岗制……地铁安全隐患安检是最重要的口子，如果地铁因为违禁品发生意外，你们还会在这里同情这个安检员吗？希望有关部门核查一下,3,20,2,2022-08-11 17:25:05,来自浙江,4037057129223224,风铃依旧
7130618668241191694,现在天气太热，一直盯着屏幕确实让人犯困 理解 既然看到了可以提醒一下!没必要拍视频至人于丢了工作啊！,0,8,1,2022-08-11 22:03:40,来自山东,6965621203,幸运追梦人
7130613507934536481,拍摄者当时可以提醒一下，照片发网上就不善良了。,0,43,3,2022-08-11 21:43:39,来自海南,111194346276,LPhk
7130613014944170787,对啊，多点善意啊，提醒比拍视频更人性………,0,1,0,2022-08-11 21:41:07,来自上海,52784838507,进取云朵VN
7130811581440541478,我第一次知道工作单调乏味偷个懒打瞌睡也情有可原的，下次领导批评我我可以说工作太单调太乏味[哈欠],0,0,0,2022-08-12 10:32:17,来自河南,3677227913067944,小小白的球球妞
7130782939629388581,上班睡觉确实不对，我觉得在你没有了解清楚的情况下你可以善意的提醒他，而不是这样网曝他，或许因为你小小的举动，他就会丢掉这份工作。,0,0,0,2022-08-12 08:41:21,来自四川,430639982329127,品安喜乐
7130797931938267944,提醒一下就行，拍照发出来有些不人道了，天热还穿防护服为大家检查违禁品，凡事多一分理解多一份包容！,0,0,0,2022-08-12 09:38:59,来自吉林,88195426490,阿利力
7130805413717050146,地铁安检员是穿这种衣服的吗？,0,0,0,2022-08-12 10:08:01,来自天津,96813448755,上进松鼠op
7130769052305818401,做人要善良，安检员也很辛苦，他一定是太累了，不自然的瞌睡了，善意的提醒他一下不好吗？干嘛要给人家发出来呢！,0,0,0,2022-08-12 07:48:08,来自河北,96692260156,用户baixiaobai
7130798726306071309,拍人家睡觉都可以拍到忘了自己要买票，想看别人的笑话，自己也成了笑话,0,0,0,2022-08-12 09:42:34,来自四川,3225206533,娓巴兒姐姐
7130469057417282339,如果是正常作息时间睡觉就是他的错，若果是长时间加班导致就是排班人的事,9,53,1,2022-08-11 12:22:32,来自西藏,5488782753,坤什么坤
7130599867709326088,真不厚道！谁没个打盹的时候。20分钟还给人看着……,0,22,3,2022-08-11 20:50:21,来自上海,55462251704,小陆177422099
7130514324997030695,老盯着屏幕，眼睛会很疲劳，趴着休息一下，也没什么不妥，做人要善良。,0,24,2,2022-08-11 15:19:13,来自北京,65516006385,风花雪月199239308
7130804939890770703,一直盯着屏幕看，感觉没意思，就休息睡一会。,0,0,0,2022-08-12 10:06:08,来自上海,2295391397614781,破译谎话精英
7130799712865370894,拍视频的人只看到了他在那睡着了这个现象，但好多原因你可能不知道，可能因为一些事情导致前一天没休息好，可能连续长时间的工作造成身体不适，亦或者是其他原因，你完全可以通过一些别的方式去提醒一下，这样武断得把视频发出来，这人什么心态？,0,0,0,2022-08-12 09:46:37,来自天津,3571626180090496,小勇🙃
7130612931041149699,如果连续加班，睡就睡吧,5,20,0,2022-08-11 21:41:10,来自上海,3069434010015918,一个散淡的凡人
7130511246407041828,这个岗位睡觉确实不应该，万一流进违禁品咋办，但是这样拍摄公示也不太好，比如直接提醒和警告，或许更有意义,0,12,1,2022-08-11 15:06:45,来自北京,2901566060,我是mt
7130478034649875204,确实有拍照的时间不能善意提醒一下吗？相信在公共场所的工作人员没有特殊情况不至于直接趴在那边睡觉。有些人有时间在旁边等了20分钟就为了曝光别人，内心的恶昭然若揭。,5,53,3,2022-08-11 12:58:09,来自上海,6047138705,一盈二靓
7130776120739463977,难受就请假 天塌了都没有自己重要 这种上班摸鱼能理解 但是拿钱办事天经地义 而且这种工作的特殊性 我觉得拍摄者没有错,8,41,3,2022-08-12 08:14:16,来自浙江,59243246679,雨落灯鸣o
7130789353084846851,说实话，现在天气热正常人一直盯着电脑屏幕真的会犯困，善意的提醒一下很有必要！,0,0,0,2022-08-12 09:06:11,来自江苏,3993869354281000,风雨兰蝶
7130655671833428769,其他不说 谁都有犯错的时候 要是一次机会也不给 那人性在哪里 很多人说应该曝光 可是曝光了就解决问题了？法律无外乎人情 人非圣贤孰能无过 善意的提醒要比一个好心干坏事好太多 网络太发达也不是好事 将心比心 希望曝光这件事的人不要被网爆,0,0,0,2022-08-12 00:29:46,来自上海,57335656466,害羞的熊熊1
7130474330219463437,不明白现在的人动不动就拍照发上网，,5,126,9,2022-08-11 12:43:24,来自广东,110488081210,露西Lucy
7130489456116826913,真的没意思了，提醒一下即可！弄不好安检员饭碗丢掉了，基层员工非常辛苦这几天高温，晚上睡不好，望多多给于谅解！,5,115,5,2022-08-11 13:42:32,来自上海,55132957981,多才青山R2
7130777075539706654,他们真的很辛苦，你可以善意提醒，而不是拍视频去指责！换位思考吧！,0,1,0,2022-08-12 08:19:09,来自河南,105558412048,自若春风D
7130653711206646568,工作累了，休息一会不行吗？打工不是卖命。若累死在工作岗位，没人同意。相反，公司还会找理说：累了为什么不休息呢？,1,1,0,2022-08-12 00:20:59,来自广东,3148599329563944,咖吗卫星
7130510003081102093,评论区的友友都很有正义感[赞]，可惜这个安检员的工作不保[流泪],0,16,2,2022-08-11 15:02:01,来自上海,53542249737,淡泊浮华1
7130799375046984489,动不动就拍照片上网，提醒一下不就好了？造成那么大舆论，是不是太极端了,0,0,0,2022-08-12 09:44:23,来自山西,108152251403,狄狄狄胖胖
7130736171319100167,现在年轻人晚上玩游戏，白天上班没精神,0,0,0,2022-08-12 05:41:12,来自陕西,111590537177,爱思考的梦由心生
7130515764532052750,这个岗位是万万不可以打瞌睡的，何况还睡20分钟。真有携带易燃易爆、枪支刀具等危险品进站或上车，后果不堪设想。岗位特殊，人命关天！想睡觉就回家去，让不瞌睡的人来干！,7,16,3,2022-08-11 15:24:15,来自江苏,4438051739667453,张张是好牌
7130800866486944542,也是太累了。这样一报道孩子和部门负责人都日子不好过了[祈祷]天气热安全确实得注意，但是这样的情况反馈给领导就可以。没有必要发上网络，这个孩子一定得另找工作了。出来寻生活都不容易。得饶人处且饶人[作揖][作揖][作揖]祝作者中元节快乐[玫瑰],0,1,0,2022-08-12 09:50:36,来自上海,75317742250,粽粽哥哥
7130790968881791755,现在天气太热了，再加上一直盯着屏幕看，天气热很容易犯困，安检员的工作非常非常重要的，身边的同事要善意提醒，但是这样网传有可能让人家丢工作了，各行各业都难，但地铁单位必须重视。,0,0,0,2022-08-12 09:12:38,来自重庆,105039693157,楚天风云汪汪队
7130792736173146910,真想大声的跟那些指责拍照真的仁问一句，难道拍照者的过错真的比睡着的安检员更大吗？你们都选择忽略或者包容睡觉安检员的过错却这么严苛的指责拍照者，是不是有点本末倒置了啊？公共场所维护公共安全的特殊岗位不应该被监督吗？作为一个普通公民行使监督权还必须得十全十美吗？那是不是还得调查清楚这睡觉的安检员是家里有什么大的困难致使他该睡觉的时候没睡够要到上班的时间来补觉，还是纯粹该睡的时候没睡，甚至隔三差五经常是这种状态？还有各种各样的可能是不是都得去调查清楚？你一个普通的地铁乘客有这义务、有这能力、有这权利？还有说替他换岗的[捂脸]，就算是同事也得分情况，要是隔三差五天天这样，你作为同事你乐意替他换岗？,0,0,0,2022-08-12 09:19:22,来自浙江,2788505374,勇美好看世界
7130614978428257036,拍照人其实应该叫醒他的。这样大家都不安全。,0,4,0,2022-08-11 21:49:41,来自浙江,1191482451824699,奋发有为柑桔ZC
7130765516469846823,"这么热的天，谁都有打盹的时候，提醒一下就好了。
这是国民好同事拍的吗[捂脸]",0,0,0,2022-08-12 07:34:39,来自江苏,1478214972871624,璽禾
7130789690575880960,拍摄者不是不理解你，这次真无法为你出声，你要有急事叫醒就行，但是我看你说工作人员睡了有二十分钟，如果确实如此而你又试图叫醒过但他依旧在睡甚至因此发生过冲突，那我理解你，毕竟现在的时代多元包容，你有拍摄视频的权利，但是最好是把它当做保护自己的手段，而不是侵犯他人的武器，否则就真的是给社会添乱了,2,18,2,2022-08-12 09:06:59,来自山西,5774762826,无为o道人
7130651126382625544,还是交警民警好上班有休息室。,0,0,0,2022-08-12 00:11:17,来自江苏,50077604972,蓝天133273011
7130782989000442655,他打盹肯定错了，但是你拍完照以后有没有叫醒他呢？,0,1,0,2022-08-12 08:41:25,来自甘肃,6896374741,小布尔乔亚之裳
7130804497261019918,当初要是这么负责“提醒”防疫防控工作多好。,0,0,0,2022-08-12 10:04:40,来自天津,3028315200,漂浮在水中的玫瑰
7130474499543450379,持续盯着屏幕看确实很容易疲劳的，发现他睡着应该即使叫醒。能持续拍摄20多分钟也是内心阴暗。,3,131,3,2022-08-11 12:44:13,来自陕西,6784294902,用户名一再重复
7130505095506608931,我家小区门口保安每天都耷拉个脑袋打盹，我路过都是轻手轻脚生怕打扰了他们睡觉[捂脸][捂脸]，谁都不容易啊[捂脸],0,15,1,2022-08-11 14:42:40,来自四川,67257554537,有你好幸福666
7130799125574173471,评论区里笑死了 上班睡觉是对的 [捂脸]各种理解 各种心疼,0,0,0,2022-08-12 09:44:09,来自山东,53659984136,巧若初平
7130657872102818563,头条是没新闻了吗？上班睡觉都能上热门,0,1,0,2022-08-12 00:39:09,来自上海,21825363043,顾雄飞
7130478643129697055,上班睡觉确实是不对，但看见了上前提醒一下就行了，没必要还拍照发网上,4,61,4,2022-08-11 12:59:59,来自湖南,3671992216852900,郑一个亿YHZ
7130797810400019235,工作做的不好，大家要理解他？？？？新闻可真会引导舆论,0,3,1,2022-08-12 09:38:29,来自山东,712137232353054,秋天的一抹云彩
7130773768385184527,大家可能忘了，上海世博会前，是没有安检的。,0,0,0,2022-08-12 08:05:11,来自河北,1644523101358784,施小泡泡
7130797503314051872,谁上班没有打盹的时候！,0,0,0,2022-08-12 09:38:20,来自山东,66295194963,格格巫200677100
7130715801304498978,12小时工作制的恶果，不是安检人员的错,0,0,0,2022-08-12 04:24:45,来自陕西,2960324069698855,努力养家糊口
7130760809886139143,拍摄者我请你善良！,0,0,0,2022-08-12 07:15:58,来自上海,62413474018,💃蓝色妖姬💏
7130790228415185664,既然觉得不安全，就应该及时叫醒他啊，难道就这么一直拍？[黑线],0,0,0,2022-08-12 09:08:52,来自上海,108675861251,高级苹果LO
7130615634070209292,上班睡觉不可以，拍视频发网上不可取,0,2,0,2022-08-11 21:51:54,来自四川,95833912935,万马306
7130485532773647143,现在的地铁安检本来就是形式大于内容！安检点设在站内就是一个巨大的隐患！正碰上要搞事的，高峰时段的车站内进出的人比车厢里多多了，根本没必要把违禁品带上车！！,1,34,1,2022-08-11 13:27:25,来自上海,1345401734045576,兔宝宝992
7130639365218452265,没必要小题大做，体谅一下，都有打盹的时候,0,3,0,2022-08-11 23:23:55,来自甘肃,641770019366720,一粒心愿
7130615238118523662,都是劳务工，一小时都一定有20元，想多赚钱只有拼命加班，一天不上个十二三个小时根本赚不了200元，不瞌睡才怪呢。北京地铁里睡觉的更才比比皆是。,0,21,0,2022-08-11 21:50:14,来自河北,63868240192,只和比我傻的交朋友
7130476843580965635,不要道德绑架作者，每个人在自己的岗位上就应该认真负责的完成工作，要睡觉辞职回家睡。,13,22,5,2022-08-11 12:53:42,来自江苏,14414195720,卫达
7130791690906272515,提醒一下就好了，这样做会让人家丢工作的都不容易,0,0,0,2022-08-12 09:15:27,来自辽宁,56992661780,多乐888
7130805211475510051,无法评价安检员是否超负荷工作，所以大家理性看待这件事情。但是拍照发网上肯定不对，容易被带节奏。[汗],0,0,0,2022-08-12 10:07:01,来自广东,2824654949,心晴nice
7130787532437979943,可能是确实累了，提醒一下比拍照发出来有用，心存善意吧,0,0,0,2022-08-12 08:59:09,来自陕西,101986679309,leah505
7130805188251632425,最好的方法，一个小时轮换一下。这样缓解眼睛疲劳。,0,0,0,2022-08-12 10:06:57,来自上海,2295391397614781,破译谎话精英
7130473875946734371,"谁上班没困过？
这种安检员看似工作轻松，
盯着屏幕一会儿就头昏眼花犯困",1,29,1,2022-08-11 12:41:10,来自湖北,21220259507,秦山剑雨
7130785705651045160,拍摄者什么用心,0,0,0,2022-08-12 08:51:25,来自江苏,5862652092,行将即远
7130495547236483881,上海不知道，在杭州这些工作人员都是劳务公派遣的，工资不高，各种强制加班，非常累，得饶人处且饶人，提醒他一下就行。,5,42,3,2022-08-11 14:05:29,来自浙江,60656326340,敗小龙
7130612822869934878,如果你真有责任心，看见了可以提醒一下，不提醒反而拍照发网上，拍摄者的做法太不地道了,0,0,0,2022-08-11 21:40:42,来自辽宁,63693596043,快乐橙子z5
7130594534584599330,如果叫醒他比拍视频更好!,0,3,0,2022-08-11 20:29:19,来自湖北,65714146371,三分投篮
7130789838457979660,疫情期间坚守岗位时间过长，有情可原。但是安检工作确实非常重要，虽然说有违禁品会发出报警，但上班时间睡觉确实违反了劳动纪律。既然已经曝光了，领导肯定要做处理的。但愿不会失去工作哟。,0,0,0,2022-08-12 09:08:12,来自山东,13489942381,邵已入川
7130501893490819855,也许他昨晚小孩闹腾没睡好，唉！为人父，为人子当下不容易，希望他以此为戒，以后认真工作,0,14,0,2022-08-11 14:30:07,来自广东,883637134040701,l乙121234Cd
7130775516961342223,这类工作很容易疲乏，是否应该考虑工时不要那么长，不要把我们的安全建立在别人的疲劳之上,0,1,0,2022-08-12 08:12:06,来自北京,1776447724195115,远见卓识芒果i8
7130607356852830990,安检员应该一小时轮岗制,0,1,0,2022-08-11 21:19:20,来自广东,4023837074664315,不凡的中国铁粉
7130571219941999367,如果觉得危险，叫醒他比拍视频更善良,0,1,0,2022-08-11 18:59:29,来自新疆,98013487421,尘寰已散
7130577647108637477,先是老师停职，这个地铁安检员工作也不保了,0,0,0,2022-08-11 19:24:10,来自山东,2999083190730029,布篇儿
7130661110151725832,工作辛苦了，不然那么重要的责任怎么会睡着，还有也许身体不舒服！,0,2,0,2022-08-12 00:51:33,来自四川,2533732825969933,网格员
7130592422496682760,说的大实话，上班时间不应该瞌睡！但是拍摄照片的同志可以轻轻提醒一下，表现下善意吧[比心][比心],0,0,0,2022-08-11 20:21:25,来自上海,107790193022,甜美伊人66
7130768143739503371,首先工作睡觉本来就不对了还能被体谅？你就知道是人家辛苦不是大半夜不睡觉？如果因为他的瞌睡出了问题，你们还能这么体谅他？如果他是你同事，因为瞌睡耽误了你汇报工作，你也能这么理解他？,0,2,0,2022-08-12 07:44:29,来自广东,5961381755,很皮很闹心
7130501829972394786,做人要善良，可以提醒一下，年轻人不容易,0,14,0,2022-08-11 14:29:55,来自河南,108434882341,珠穆朗玛513
7130514107442578207,地铁安检本来就形同虚设。何必为难别人,0,14,1,2022-08-11 15:18:07,来自上海,74976686914,通天通地
7130484216508957474,上班睡觉确实是不对，但看见了上前提醒一下就行了，没必要还拍照发网上,0,24,2,2022-08-11 13:21:32,来自上海,60124877951,文文可爱
7130600953316934415,不出事大家都谴责拍视频的人，一旦出事了，你们又会谴责谁,0,0,0,2022-08-11 20:54:14,来自上海,5762398162,诗意海洋Px
7130491719615120131,"有没有可能是不自禁？
困到一定层度，人会在不自觉中进入睡眠。看他的姿势，不像是刻意睡觉，如果是太累了，应该从工作时间安排上看是否合理，增加换班频次。如果是偷懒，应该教育培训，真没必要上纲上线。",3,16,1,2022-08-11 13:51:28,来自浙江,85487694848,中医学习中
7130785037003424553,安排不合理，上班时间长！一般都是派遣公司派来的，用人单位要负责！毕竟安检岗位是涉及到大家的公共安全！如果被犯罪分子钻了空子造成后果，谁能承担这个责任！全面履行岗位职责才是最重要的！,0,0,0,2022-08-12 08:48:45,来自四川,5992131717,高冷扑克WS
7130763231357993764,上班忍不住打吨好象是个挺普遍的现象吧，你能保证自己没有过吗？确实不对，但如果是偶尔就別太苛求了,0,1,0,2022-08-12 07:25:00,来自黑龙江,72105183900,活成一枚咸鸭蛋
7130810964626572039,每天睡3-4小时，工作16小时，还有3-4小时浪费在走路等车坐车上面。本人在深圳北站做过。上海不清楚。实在扛不住感觉整个人要猝死，工作也才6k。,0,1,0,2022-08-12 10:29:58,来自江苏,1095527192594728,fei ge
7130779040729989888,都是轮流做的，坐地铁的时候听到他们在商量，该谁坐了，该谁站那了，半小时一轮岗,0,0,0,2022-08-12 08:25:37,来自四川,5522625221,跌跌撞撞我一路走来
7130615700242547494,我遇到的不是睡觉，在聊天，而且是脑袋侧过去，压根不看屏幕，比这个性质更恶劣,0,0,0,2022-08-11 21:52:23,来自上海,3434504944100979,土豆发芽小天使
7130482708903707425,你拍照可以，但不必发出来。叫醒人家即可。大家都不容易。,3,107,2,2022-08-11 13:16:18,来自上海,2762401743114951,热情的漂流瓶gg
7130789461721416461,。。。如果我只是说如果是这个工作人员突然不舒服了，周围人没注意到，而你注意到了并只是拍照上传导致一系列无法解释清楚的后果呢？啊哈，生而为人,0,0,0,2022-08-12 09:06:15,来自海南,3395767099990430,打怪兽u
7130808933715018532,但凡有正经的渠道还需要上传网络？即使动机不纯，但事实确实在睡觉，如果有危险品进入发生事情你们又会反过来表达了吧，上班辛苦你可以辞职，但不是睡觉的理由吧谁不是在辛苦工作呢,0,1,0,2022-08-12 10:22:05,来自江苏,852862602320318,晨亦晨
7130615253624652576,是不是不舒服了呢？带病上班呢？都不容易,0,19,1,2022-08-11 21:50:34,来自北京,2357769102706190,梦幻百香果T8
7130541412944806696,你应该叫醒他提醒一下，而不是这样发到网上。,0,1,0,2022-08-11 17:03:37,来自陕西,21524767843,安伊168
7130777608073167627,是不是身体不适呀，应该是先关心询问，然后叫其他人看看什么情况，是否换个人值班，当值睡觉固然不对，但也要看是什么真实情况！,0,0,0,2022-08-12 08:20:59,来自广西,64072371146,hw000096
7130644410144375585,你支持拍摄者还是安检员？,0,0,0,2022-08-11 23:45:14,来自黑龙江,3021077356219390,麻辣家的小龙虾
7130493035536352040,打工人何必为难打工人,0,18,0,2022-08-11 13:55:49,来自上海,39224556398957,微笑辰星xL
7130700944169894656,此风不了涨，安检是重要口子，如果经常出现类似情况，就是员工工作时间太长，需要增加人手。,0,0,0,2022-08-12 03:22:22,来自江苏,1161503846492576,梦幻青山UC
7130645714346722055,无论什么样的监督都无可非议！不应当指责发照片的行为！如果工作时间可以睡觉，那这个岗位就是可有可无的！,0,0,0,2022-08-11 23:50:04,来自山西,1446593195938451,丛中笑287117386
7130474184467202853,你应该去叫醒他，你拍了照片，让人家丢了工作,4,93,3,2022-08-11 12:42:37,来自上海,68864906047,一条龙215033465
7130796660162708257,这个世界需要包容 我们现在人现在有点过激 了 外卖晚点骂 各种不舒服各种骂 所谓上班时间打盹不对 问题是人是生理需要 特殊时期如果上班时间过长 或者太频繁太累 吃不消很正常,0,0,0,2022-08-12 09:35:10,来自浙江,6233181125,青楼思残梦
7130790427933934373,安检员大多是外包零时工，地铁安保的基本都是，而且排班两班倒，有时候排班不合理会连续上，可恶的是资本家，各行业都不容易，你提醒一下好，非要偷偷举报发出来[捂脸],0,0,0,2022-08-12 09:10:05,来自广东,105175007825,你又菜又爱玩
7130638042507002656,一张照片，折射了整个上海地铁管理混乱,4,44,3,2022-08-11 23:19:31,来自上海,3982030596,复杂中国探索者
7130618017288831782,何必拍，人家也会累的，别人也不容易，这种事爆光了他是要受处分的，提醒一下就好了，林子大了见到什么都觉得稀奇,0,0,0,2022-08-11 22:01:14,来自广东,3320164540485351,单纯喜鹊Sc
7130811810869314337,评论区这么多同情睡觉的？要是普通岗位，睡了也就睡了，但这是安全岗位啊，昨天还看到因为泳池救生员擅离职守，导致带俩孩子游泳的妈妈死亡，这睡着了混进去个高压锅，就悔之晚矣[泪奔],0,0,0,2022-08-12 10:33:24,来自浙江,110580484992,轻浪五更疯
7130651324148400899,人家也不容易，地铁安检员都是临时工,0,3,0,2022-08-12 00:12:57,来自上海,3061497938844302,遇不到期
7130572072040448804,有些人心里只有流量只有钱，缺乏善良善意提醒一下有何不可，如因为这张照片导致下岗你的心不会痛吗,0,2,0,2022-08-11 19:03:06,来自新疆,20766384261,积极的喜鹊lN
7130642859018961701,这活也不好干，眼镜近距离一直盯着屏幕，会视觉疲劳！,0,0,0,2022-08-11 23:38:11,来自浙江,144756085629932,金光灿烂jh
