7130869007330116382,现在中国佛门圣地还有清净的地方么。,24,504,2,2022-08-12 14:14:52,来自湖南,3267352263928196,清风晚行舟
7130878384435004199,感觉佛门圣地，都成藏污纳垢之地了,4,458,0,2022-08-12 14:51:47,来自福建,2229421621918103,端庄奶酪Qb
7130907240756265736,纵容宗教场所商业化究竟是谁的棋？,2,102,1,2022-08-12 16:43:32,来自广东,60731879184,读书观影看世界
7130899103516803877,听说广德寺只接待老板和有来头的人，平民老百姓进不去，身为西店人一次都没去过,13,118,2,2022-08-12 16:11:51,来自浙江,64633742104,6只JioJio
7130916853149090573,当地人，去过一次，没有买门票，倒是大年初一上头香需要抢 人多的很,1,9,0,2022-08-12 17:20:59,来自浙江,92471058194,緱城-东耳
7130845015718298398,这家庙里很有花头，这个主持很有钱。。。。。,8,367,1,2022-08-12 12:41:40,来自浙江,106321910980,mangludezhuweiba
7130881526673621774,这个宁波诺丁汉大学的谢景讲的对不对？,1,18,0,2022-08-12 15:03:50,来自北京,3716199589,热心群众许老师
7130942746005275433,"(民警表示，寺院是因为疫情防控要求对进寺人员进行预约、限流，对非宗教性质的单纯的拍照打卡等活动，必须要通过预约并且有本寺僧人陪同才能进入到寺内进行拍摄)
我只想知道，在全中国范围内，当然其中包括台湾，香港，澳门，有哪一座寺庙游客进去游玩寺庙里面都会派人专程陪同的？
如果不是有鬼，怎么解释？",0,6,0,2022-08-12 19:00:59,来自浙江,50331257194,陳衙营
7130930958677082880,所谓日式建筑就是中国盛唐时学去的，和汉唐风格很像，而目前反而国内汉唐风格建筑很少了，大多都毁于战火。反而日本保存的比较多且完整，很多中国目前著名的仿唐建筑设计时，都参考过日本的建筑，所以很多网友是好心，但可能太敏感了。但是对于那种刻意的故意的使坏的我们必须抵制，坚决打击！,1,2,0,2022-08-12 18:15:05,来自陕西,52697506857,建龙154370752
7130890074690175756,我不懂建筑，但如果日本人学了我们唐朝的建筑，就认为是日式建筑了，我只能表示嘿嘿,6,98,5,2022-08-12 15:36:58,来自浙江,4437284036809960,戏曲小爱好
7130878800535372578,这就是日式建筑,4,62,2,2022-08-12 14:52:43,来自山东,57738207369,荒野牧羊
7130935998649205538,不得不说，玄奘寺供奉战犯被曝光的事情，让寺庙有了对策,0,6,0,2022-08-12 18:34:42,来自河南,96128405650,破灭刀锋706
7130848249652462371,枯山水呢，什么风格，好像没解释,1,82,1,2022-08-12 12:53:57,来自浙江,103241642981,张小刀2007
7130854193757340456,"不少账号说它“唐风禅境特色鲜明”，是“宁波小京都”——
难道“唐风禅境”是日本的？",2,64,1,2022-08-12 13:17:03,来自上海,4089781056441671,种花家的李太白
7130889426515165952,＂广德寺的僧人也参加过国外的佛学交流活动，除了日本，还去过泰国、印度等国家＂说明还是去了，而且是重点去的！,2,25,0,2022-08-12 15:34:00,来自甘肃,5832996052,虎踞龙城
7130875906449113891,拍照就打扰你清修了，功德箱收钱卖香油时怎么没影响,4,105,0,2022-08-12 14:41:44,来自浙江,4206771995,琥珀4
7130858311075136268,僧人要记住乱世救民，盛世修行，不要堕入红尘，不然枉为僧,1,28,0,2022-08-12 13:34:00,来自福建,69916881792,郁文看世界
7130949082796884768,听说广德寺只接待老板和有来头的人，平民老百姓进不去，身为西店人一次都没去过,0,1,0,2022-08-12 19:25:54,来自浙江,74018250799,鱼238219535
7130858221211927334,就算来个日式寺庙也没什么啊！我们主张文化繁荣，宁波传统古寺有，藏式寺庙也有，我们很多别墅装修都有日式。就是不让汉服进去，这说不通,4,26,6,2022-08-12 13:33:33,来自浙江,25975279523,包子铺少主
7130869772828525343,现在的寺庙皆非静土，大悲寺除外,1,15,0,2022-08-12 14:18:13,来自四川,65649186696,雪山西雕
7130953636477911839,枯山水怎么说？不解释了？,0,2,0,2022-08-12 19:43:36,来自江苏,62654925659,月下渔舟唱晚
7130858015637013259,回答流程没有问题？这是回答网友质疑的日式建筑？不允许穿汉服的游客进入等问题吗？,5,33,3,2022-08-12 13:33:06,来自北京,94219673527,山高水长1115
7130901908801766158,嘉兴学院全是这种款式的教学楼,0,4,0,2022-08-12 16:22:49,来自浙江,1728856188794807,小强a
7130847523274998543,网上说寺庙主持有到日本去考察 是否属实？,4,21,0,2022-08-12 12:51:14,来自安徽,111332846150,文武AA
7130848929608254244,第一点还好，第二点存疑，第三点的枯山水确实真的没法洗……还不如大方承认文化相互交流融入了一点儿日式元素又何妨？,1,52,5,2022-08-12 12:56:54,来自江苏,59125107817,西域江南
7130851896750965519,日式和风的建筑阴森可怖，和隋唐建筑的堂皇大气截然不同！,0,25,0,2022-08-12 13:08:10,来自山西,5572134543,郝人秋浦
7130899526588154659,和尚都很有钱,0,9,0,2022-08-12 16:13:07,来自浙江,93049692664,妮妮5v
7130907979943019264,承包寺庙浙江那一带有人非常热衷。,0,11,0,2022-08-12 16:45:49,来自山西,96257258360,酒中仙102
7130953466461635369,现在没门票的寺庙有么？？求地址！纯纯拜佛的那种！,0,0,0,2022-08-12 19:42:19,来自浙江,97284912016,醉嘉醉玲珑
7130855932933980962,还是警惕点好 防止内外勾搭 利用寺庙 搞不可搞人的目的,0,114,0,2022-08-12 13:23:52,来自浙江,51594295736,开心的吉联
7130907254387671849,除了国清寺…,2,1,0,2022-08-12 16:43:06,来自浙江,4296533348189788,我的生日是儿童节
7130908558501397288,和尚主持，方丈都是大老板，修行在寺庙，休息回家有老婆孩子.,0,7,0,2022-08-12 16:48:07,来自浙江,50041672617,活泼远山Hy
7130844917278606093,寺庙里的主持比马云还有钱,3,91,2,2022-08-12 12:41:35,来自浙江,93463709037,浙江董永
7130929740839846696,说实话宁波寺院与日本寺院有千丝万缕关系，不排除是日式寺院风格,0,3,0,2022-08-12 18:10:24,来自湖北,4393236707685115,漫驴戈壁
7130910150793757481,大兴寺庙一为敛财，二为文化浸润。此风不可长。,0,5,0,2022-08-12 16:54:22,来自四川,56279615564,在线163
7130932939386749732,"一般会有些历史渊源的。
比如江西宜丰县内有座韩式寺院，进去参拜要脱鞋的（现在不知道）。说是韩国佛教的祖庭（临济宗？好像是。）",0,2,0,2022-08-12 18:23:15,来自江西,6115991583,南昌出发
7130856190934532898,盖这么豪华，还清修,2,14,0,2022-08-12 13:25:05,来自浙江,97072216188,W太阳背后W
7130887827184960259,宁海广德寺又上了头条。,0,6,0,2022-08-12 15:28:28,来自浙江,67368141751,1314999王
7130904963894739715,"修心，修佛，不修口
戒嗔，戒痴，不戒色",0,2,0,2022-08-12 16:35:01,来自山东,59070277752,唐朝5383
7130868608032768799,确实是日本风格，中国没有这种假山假水风格,0,27,1,2022-08-12 14:13:44,来自浙江,65700395274,啷个说喃
7130867425847558950,为什么遭受日本蹂躏的南方东北都要有这些事呢,1,6,0,2022-08-12 14:09:36,来自新疆,4247671500,驼骆
7130848313540543267,修学校没钱！ 修这玩意儿哪里来的钱？[what],1,156,1,2022-08-12 12:54:17,来自浙江,54361717604,机械公社为机械而生
7130846220871828239,文化交流，取长补短，古为今用，洋为中用。不管是唐风还是汉韵，中式还是日式，这都不是大问题。关健是所崇尚的思想与精神。,6,69,20,2022-08-12 12:45:56,来自浙江,56576218428,太阳出来了781
7130906434019427087,从来不去寺庙旅游闲逛，因为那里是一个藏污纳垢的地方[机智],0,6,0,2022-08-12 16:39:53,来自黑龙江,84627856642,酒酒快乐万俊成
7130924706676769543,日本佛教就是以浙江一带为主传过去的,0,0,0,2022-08-12 17:51:08,来自浙江,110498108149,太大大哥
7130844184714085155,完完全全的日式，居然还有人洗地,2,120,3,2022-08-12 12:38:19,来自四川,6269904296,夜半奏鸣曲
7130851747287270183,其实日式的建筑就是源自唐朝,5,42,2,2022-08-12 13:08:24,来自浙江,50529541501,心房之外
7130854552018174758,起源于明末清初的寺庙，即使恢复，也应该按着明清风格设计！！没有对和风的喜好，不会贸然去搞！！！这是被污染的思想根源的问题！！,0,75,1,2022-08-12 13:19:20,来自山东,6392445236,jlh005
7130947139596911360,现在的寺庙，那里还有和尚清修，都是酒肉穿肠过，美女心中留的和尚，开着名牌小车，配上假发，发廊到处逛[捂脸][捂脸][捂脸][捂脸][捂脸],0,1,0,2022-08-12 19:17:43,,104710845665,聪明的船帆n0
7130905902596604676,日本的佛寺采用唐朝的建筑风格，这没有毛病。现在大多寺院沦为旅游公司的提款机，很多职业的假和尚，才是世人诟病的原因。,0,4,0,2022-08-12 16:38:22,来自海南,1947966685841544,海南刘建设
7130945368057283368,天下丛林饭似山，钵盂到处任君餐。黄金白玉非为贵，惟是袈裟披最贪。生民三百六十日，不及僧家半日钱！,0,0,0,2022-08-12 19:10:54,来自西藏,5566685147,君子而立FX
7130932813687751462,日本建筑主要是学习盛唐时期的建筑风格，那个时候因为技术没有那么成熟，所以飞檐翘角没有没有那么明显罢了,0,0,0,2022-08-12 18:23:12,来自江西,64557869842,星狐激情复健大放送
7130907137471103779,这就是市场化、商业化带来的后果，市场不是万能的，一旦市场化就由资本说了算，如教育市场化，寺院市场化，这样就让资本有操作空间，文化入侵就如同温水渚青蛙一点点渗透，一点点同化！,0,1,0,2022-08-12 16:42:34,来自浙江,22609320002,真诚花猫LY
7130925923029402382,打扰僧人清修？现在寺庙哪个不挣钱,0,1,0,2022-08-12 17:56:10,来自浙江,2938329782826461,乘风破浪的宇宙ve
7130909417973465870,穿不穿汉服无所谓，寺院内部不能拍照，禁止变成网红打卡地，失去了它存在的价值,0,0,0,2022-08-12 16:52:08,来自河南,111550914987,同歌韵1590
7130861767932429096,对于建筑风格，我们完全可以自信，华夏文明本为日本文化之母，历史演化中的交流是必要的，只要有益于我们自身的进步，不必视为洪水猛兽。现在一大群穿着奇装异服的小视频制作群体，有误导舆论之嫌疑。,0,6,1,2022-08-12 13:46:36,来自浙江,281907338946143,剡溪西畔
7130872865590690564,感觉就是那个招魂社[打脸],1,4,0,2022-08-12 14:30:15,来自河北,65747719940,甪䶮赟
7130936683276632866,什么邸吻破风抱夏枯山水，名字真怪,0,0,1,2022-08-12 18:37:10,来自广东,268696905066176,俄罗斯战略核威慑
7130882548095697698,应该说出发点是好的，想找回唐朝汉风，但不懂甄别、不经考证，乱套日式是不可取的！,0,6,0,2022-08-12 15:07:10,来自浙江,5822035338,江山社稷2016
7130842994840322857,赵武灵王的胡服骑射，汉朝的胡笳、琵琶乐器，大唐胡床的流行，佛教带来的宝塔，我们吸收国外的文化元素不要太多，相互影响也很正常，自古兼容并蓄的理念，啥时候成了这种小家子气？,1,32,7,2022-08-12 12:33:40,来自浙江,106482694765,疾风之狗狗
7130938897143939855,人家是寺庙呢，你只是去拍照打卡，人家自然不会同意[害羞][害羞],0,0,0,2022-08-12 18:45:57,来自吉林,65553994062,都是麻衣呀
7130897976796709665,清修多么的讽刺[捂脸][捂脸],0,2,0,2022-08-12 16:07:51,来自浙江,56542860305,洋葱大蒜生姜萝卜
7130907999576982286,我经历过的是去拜佛还可以方便用餐（当然是素菜）至与费用，绝对是随意乐助，若是有錢有心之人捐助多了难道就不净了？,0,0,0,2022-08-12 16:46:32,来自浙江,3755524267191629,简单星球h7
7130861183841649446,前几年去这个寺庙参观，吃过斋饭，味道很不错[呲牙],0,2,0,2022-08-12 13:44:47,来自浙江,59536848385,nn338
7130907512010261285,寺庙都是承包的，不懂了吧，不是清净之地,0,2,0,2022-08-12 16:44:40,来自广东,8095104217,石国强829
7130939193006211852,寺庙商业化了，,0,0,0,2022-08-12 18:48:05,来自浙江,5793867989,海雄精雕
7130931494977061664,为什么不能是日本寺庙？,0,0,0,2022-08-12 18:17:42,来自浙江,3979808572,小浪杂谈
7130951237822399235,现在哪个寺庙还有清修！！！！,0,1,0,2022-08-12 19:34:32,来自安徽,3170646722356331,正义凛然海燕Ls
7130943332116726569,看来古代有个朝代烧寺庙是正确的,0,1,0,2022-08-12 19:02:56,来自四川,95212746939,🐟
7130919347949683494,设计师的责任，唐风与和风还是有区别的,0,0,0,2022-08-12 17:30:34,来自上海,1983157226978990,万川一月影咸彰
7130947418979861281,中国寺庙有这个样式的门楼吗？大门口的门楼已经说明了一切,0,1,0,2022-08-12 19:19:38,来自山东,90119337807,金昌红豆杉
7130913543515767552,寺院也被亻委人沦陷了！,0,3,0,2022-08-12 17:07:36,来自浙江,4023801766483939,红尘散客
7130909001596420868,为啥现在的寺庙这么有钱？,0,1,0,2022-08-12 16:50:43,来自重庆,8128562102,谁叫你不多久
7130948314081805097,很感叹现在的和尚经商有道，赚的盆满钵满还说自己是出家人，实在是讽刺！,0,0,0,2022-08-12 19:22:24,来自福建,111436300539,梦幻明月是故乡
7130854738598036262,坚决反对任何人到寺庙打卡，神圣不可侵犯。,0,1,1,2022-08-12 13:20:13,来自江苏,50000207515,查振军
7130956023305257760,反正我是非常不信任那个姓谢的。,0,0,0,2022-08-12 19:52:55,来自浙江,3518033150098430,假雨村言2
7130857743263187753,对比古希腊罗马建筑，还有正宗东方建筑风韵。,0,3,1,2022-08-12 13:31:02,来自江西,1618124740770893,东庄樵
7130840296124187432,我看就是有日式风格的东西在这寺院里，应该把家寺院好好的查一下,1,44,3,2022-08-12 12:23:14,来自陕西,110563135851,魔法松鼠Nz
7130902049889649448,什么年代的寺庙？,0,0,0,2022-08-12 16:22:59,来自辽宁,681304580166019,y原子能
7130922966724477735,清修？闹市清修？,0,0,0,2022-08-12 17:45:05,来自江苏,96347308965644,mlj888666
7130868624289743655,寺庙香火好了，说明百姓缺种寄托文化没有自信信仰了,0,5,1,2022-08-12 14:13:59,来自浙江,14089910318,清风扫帚
7130933871902327591,现在的寺庙都是冲着赚钱去的。和以前相比，完全变了味，处处充满铜臭味！,0,0,0,2022-08-12 18:27:20,来自福建,2450128970976366,床头梦
7130853794929869581,如果说是疫情原因还可以理解，如果说打扰僧人做佛事，你可以划区域啊，参观的人会遵守的。其他理由很牵强,0,6,0,2022-08-12 13:16:13,来自浙江,63287762382,煮茶慰平生
7130927412564689698,就算是日式的建筑特色，我们不能取其精华吗？,0,0,0,2022-08-12 18:01:04,来自江苏,59178332656,兰花守护天使
7130941867017028365,感觉佛门圣地，都成藏污纳垢之地了。,0,0,0,2022-08-12 19:07:15,,1887178291682734,悠闲铅笔4v
7130940460474090255,当下已无所谓的佛门净地了,0,0,0,2022-08-12 18:51:52,来自云南,3869933132320670,智慧布莱恩特
7130957316630807337,这些地方成汇聚钱的地方，钱再多也难逃生老病死，何苦呢……,0,0,0,2022-08-12 19:57:08,来自陕西,2449352117460852,独立原野看风景
7130885220747707136,起源于明末清初的寺庙，即使恢复，也应该按着明清风格设计！！现弄得像啥样子！,0,2,0,2022-08-12 15:17:31,来自江苏,7040779462,应松3
7130857517122798372,千万要警惕～别被别有用心的人利用！所谓的文化入侵很危险‼️,0,7,0,2022-08-12 13:30:33,来自山东,110958758968,HBD浩邦德
7130877488582247175,我就想问问这寺院是个人的还是国家的？,0,3,1,2022-08-12 14:48:03,来自四川,108368645721,想要的网名被人注册了
7130939238056510243,除了旗袍马褂是中国的，其他都是日本韩国的，ok？,0,0,0,2022-08-12 18:47:03,来自广西,4221746378976528,Swokao
7130907471140979469,查查这寺庙的主持方丈！,0,2,0,2022-08-12 16:44:24,来自北京,5441976777,xj70
7130854811443970850,这是唐代风格，说是日式确实是误解,0,5,1,2022-08-12 13:19:24,来自浙江,4375659057521076,白萝卜吃兔子
7130849702039290656,看看和尚穿着吧，如果是日式的，就确定了。,0,8,1,2022-08-12 13:00:15,来自山西,5763707278,低温热情36
7130874440757986089,按网友们的思路，中国现代建筑恐怕都得全拆，全是西方样式。,0,4,0,2022-08-12 14:35:54,来自广东,96018538427,跳跳跳一跃千年
7130894100361970440,唐朝留下的古建筑在山西吧。,0,0,0,2022-08-12 15:52:15,来自山东,659350348381132,阿姆拉姆斯基
7130918717625877282,我个人觉得只要不穿日式拖鞋，不穿后面有背包的和服，其他一律认定是汉服，因为中国的汉服多元化,0,0,0,2022-08-12 17:27:34,来自浙江,6079891977,小雨78284742
7130899492270015232,我们要提高警惕现在寺庙有很多问题呀，,0,1,0,2022-08-12 16:12:58,来自北京,3720358672214253,局气56
7130936484978377480,现在的寺庙也不是以前的寺庙，现在的和尚也不是以前的和尚，以前的和尚吃蔬念佛一心向善，现在的和尚大鱼大肉一心为钱。,0,0,0,2022-08-12 18:36:54,来自浙江,1173898784675229,浊酒成清
7130930714837222144,我们是祖宗…流传出去的,0,0,0,2022-08-12 18:14:20,来自山东,5927475202,今晨第一眼
7130894713447645990,佛门老出事啊，今天又刷到少林寺只让外国人进，不让中国人进呢，为什么道教就没这么多“新闻”？,0,1,0,2022-08-12 15:55:08,来自四川,6340064688,清清清清清淡
7130933319445103399,会在所有领域来告诉你 已经全是窟窿,0,1,0,2022-08-12 18:25:10,来自浙江,17457362138,港鬼港神1
7130908598183428871,京都的寺庙是宁波的工匠建的，仿唐式的。,0,0,0,2022-08-12 16:48:39,来自浙江,53053992321,在水一方
7130845546100900639,日式从哪里诞生的？三国演义去哪里参观后才复制出古建筑的,0,1,2,2022-08-12 12:43:54,来自江西,1249525245681203,阿兜555
7130863701506573093,番僧,0,1,0,2022-08-12 13:54:37,来自上海,50635019246,愤怒的二毛
7130857548567380736,僧人不得做生意。做生意的并不是僧人。,0,12,1,2022-08-12 13:30:11,来自云南,52235232015,响马21
7130855244996543272,佛教传播本身就是文化交流的产物，如果正常交流确实不该上纲上线，确属非正常交流也该有明确证据才行,0,0,0,2022-08-12 13:21:03,来自江苏,4639475506,多彩咖啡mH
7130843765346468644,随便吧，把寺庙都拆了才好，只留道观,0,0,0,2022-08-12 12:37:10,来自河北,92631117232,兰陵王富贵886
7130888248796627749,有必要那么較真嗎？文化是互相交溶，互相影响中成长的，不然大家都闭门造车好了！,0,1,1,2022-08-12 15:29:42,来自浙江,4125019243546503,博学多才的孔雀Vc
7130944867643114278,一个寺庙，造的太豪华。里面的和尚，是在修行，还是在享受？,0,0,0,2022-08-12 19:09:28,来自浙江,82915017575,风丰风
7130943090957468431,中国禅意风格，各业内人士要努力。可以借鉴学习日式枯水禅风格及所谓日式简约风格，但不可硬抄，要形成自己的禅意风格。元素那么多，多采风，多了解自己的历史，并多宣传多展示。,0,0,0,2022-08-12 19:02:15,来自云南,4613713982,大音奚声
7130906302427284259,怎么说呢，日本以前也是高度模仿唐宋时期我国建筑风格,0,0,0,2022-08-12 16:39:24,来自黑龙江,5426406028,残梦殤流年
7130900427172479759,再怎么完美漂亮的解释也掩盖不了眼见的事实。,0,0,0,2022-08-12 16:16:45,来自福建,3571676189557424,枫叶林里的猫
7130857955121545992,这个寺庙里的恶行不比南京寺庙少,0,1,0,2022-08-12 13:32:11,来自江苏,15607347207,孙国勋11
7130892284359033635,哦哦，打扰了僧人清修。。。,0,0,0,2022-08-12 15:45:10,来自江西,77148725134,人在旅途24864
7130855293022077737,他是照着现在日式的仿的。现在日式寺庙是一千年前照着当时的唐朝仿的，然后延续下来的。跟唐代的有些差别,0,1,0,2022-08-12 13:21:32,来自泰国,21365976288,传递正能量的熊猫
7130899494468338472,解释的好，我居然也信了,0,0,0,2022-08-12 16:13:06,来自浙江,92503448280,实在阿尔山3A6
7130845685582201640,大家文化要自信,0,3,0,2022-08-12 12:43:57,来自浙江,52216911289,卖胶带缠绕膜的傻憨
7130892821645050639,僧人都开始出国交流深造了？我酷！！！,0,0,0,2022-08-12 15:47:04,来自浙江,101989327285,忠良19690106
7130931377293411087,人有南北，佛性有国界吗,0,0,0,2022-08-12 18:16:36,来自上海,60061031457,云水陈人
7130908253336290063,谁还清修，不都是俗人俗世吗,0,0,0,2022-08-12 16:46:48,来自山东,50217399957,estingtao
7130912993034060576,之所以叫和式，说明它已经演化出自己的特质了。东西就在那，辩解和流程都是自我曝光,0,0,0,2022-08-12 17:05:57,来自山西,30390394033267,山高人为峰126999
7130856748633916174,第一次觉得“拆”这个字有意义！,0,3,1,2022-08-12 13:27:37,来自江苏,6598695792,刘兵1119
7130914558046110467,什么日式？都是中国风！[机智],0,0,0,2022-08-12 17:11:58,来自云南,6288356948,TOP光芒
7130856488784233254,建筑看起来确实有唐代风格，但细节不能引入没有唐代的东西,0,0,0,2022-08-12 13:26:42,来自浙江,106390904626,36法郎
7130845356019467043,在“开心的锣鼓”中迷失了自我，丢失了阵地[灵光一闪],0,9,0,2022-08-12 12:42:48,来自河北,59889939784,漳州印
7130941628667298564,佛教从中国传到日本，现在是要从日本回传中国吗,0,0,0,2022-08-12 18:57:01,来自江苏,92002390907432,天堂吠鸟
7130871099918959363,唉，我这个广德人 脸上无光啊[泪奔],0,0,0,2022-08-12 14:23:28,来自安徽,6198506499,MRZRX
7130946021031019298,喜欢日本文化,0,0,0,2022-08-12 19:13:28,来自宁夏,88628853608,学而时习智2018
7130887724072026883,从来不去所谓的佛教圣地，因为没做坏事用不着佛祖保佑[捂脸],0,0,0,2022-08-12 15:27:51,来自浙江,3706668936,單手托天鎮八方
7130863784872411941,有典型的日式风格元素,0,1,0,2022-08-12 13:54:50,来自江苏,6017904978,影子76034742
7130956192746849031,以前说这样的事情感觉很生气，但是现在已经习惯了，和乱停车差不多，罚款了事，有人得到了钱，有人免于处罚，大家都高兴。[呲牙],0,0,0,2022-08-12 19:53:24,来自浙江,9620042633,五菱神话
7130879926512780067,灭佛之战需要再次打响，历史上的灭佛之路我们也需要。,0,0,1,2022-08-12 14:56:56,来自浙江,108881200370,白雾蒙蒙
7130945183805489958,门口的罗汉松已表明身份,0,0,0,2022-08-12 19:10:52,来自广东,111576084201,自由苹果Ox
7130852538961625894,佛教原本就是外来文化，好的就发扬，不好的就摒弃，没什么大不了的,0,1,0,2022-08-12 13:11:14,来自北京,3249785637181980,产业科技评论
7130856068221780749,把心放宽嘛…..,0,1,1,2022-08-12 13:25:00,来自浙江,6633007565,深蓝100924077
7130853855352750860,不信佛，不拜佛,0,3,1,2022-08-12 13:16:52,来自云南,96926400852,子海时
7130846211262677760,日本古代很多文化建筑城市管理都学唐朝。有相似的地方也很正常，比如中国汉字就有很多出现在日本文字里。别人现在也没改呀是不是。这又说明什么,0,2,3,2022-08-12 12:45:59,来自广东,109581681243,绽放的微笑873
7130894364305556264,有几个寺院不搞市场经济,0,0,0,2022-08-12 15:53:02,来自浙江,62425877286,196101201072
7130908098378089255,日式的和唐式的还是有区别的，因为日本拿回去做了一些适应性调整，变得有点畸形，没有了正宗唐式的舒展大气，所以在还原唐式建筑的时候一定不能照搬日式风格，否则会被笑话的,0,0,0,2022-08-12 16:47:15,来自浙江,1302248479793924,单口财经
7130944416000262943,连门口的石头摆放都要一比一复制，也是牛逼了,0,1,0,2022-08-12 19:07:26,来自福建,75506996737,刺杀荆轲的嬴政
7130930966964945694,现在还有真正的和尚吗,0,0,0,2022-08-12 18:15:34,来自江苏,5527713987,醋三爷
7130853819818230565,只知道现在的和尚可以吃肉，结婚，做CEO，成为商人很有钱,0,3,0,2022-08-12 13:15:54,来自江苏,1156295947457228,太仓市到虹桥机场浦东机场
7130951038181573376,国家早都应该对寺庙进行管管了,0,0,0,2022-08-12 19:32:52,来自河南,64133008150,不凡帆船Q0
7130942543050572584,往往先被质疑而后坐实，这己经不是真理的现实！难道诡辩不被事实打脸吗？,0,0,0,2022-08-12 18:59:52,来自湖北,96556615271,远山溪音
7130908245874508544,有几个是真和尚,0,0,0,2022-08-12 16:46:51,来自湖南,54359901318,好学明镜MP
7130944070415434537,太上纲上线了，日式也是学的中式,0,0,0,2022-08-12 19:06:00,来自广东,5475065930,Vijay56115933
7130952691090211599,现在看来本来是清净的地方也不清净了,0,0,0,2022-08-12 19:39:19,来自江苏,984802482203760,金凯毛绒
7130934674595709730,只有道教才是中国人自己的教,0,0,0,2022-08-12 18:29:37,来自辽宁,96167944520,博羽584
7130863472723886848,严查、抓捕！[赞][赞][赞],0,2,0,2022-08-12 13:53:10,来自海南,59155833751,相知缘份
7130897167950414633,最近日风日盛，谁在心怀不轨，相信祖国定会出手整顿！,0,0,0,2022-08-12 16:03:58,来自浙江,2787985435142119,玄月至尊
