7130549943110255360,"敢于亮剑，人不犯我我不犯人
任何势力、任何人都阻止不了祖国统一
说的对✓为汪文斌点赞[赞][赞][赞]",1,206,0,2022-08-11 17:36:28,来自福建,4142560058023691,薇薇逛红尘
7130533092074537768,[给力][给力][给力]为外交部发言人汪文斌点赞！回应霸气！,0,639,0,2022-08-11 16:31:04,来自陕西,2590084826406547,秦观鹊桥仙
7130532631749477132,中国要敢于亮剑，人不犯我我不犯人，人若犯我我必犯人！任何国家、任何人都阻止不了祖国统一！,2,493,0,2022-08-11 16:29:56,来自四川,3997453644730915,台湾回归祖国统一
7130531950294401804,支持外交部！支持国家一切回应和和政策措施。,0,335,0,2022-08-11 16:27:32,来自湖北,2933116308306711,文倩美好岁月
7130531131644511011,汪文斌！[赞][赞],2,166,0,2022-08-11 16:23:34,来自河南,1332255067223608,瑞洛溪
7130535286341239585,霸气回应真给力！为汪文斌点赞！👍,0,120,0,2022-08-11 16:40:21,来自北京,61509905767,花儿朵朵1699
7130699703914021669,出口美国的商品普遍加价10个点以上。,2,97,0,2022-08-12 03:27:25,来自湖北,109322931577,欢快香瓜z
7130773449257550629,他取消不取消是他们的事，我们普遍上调商品价格。,1,21,0,2022-08-12 08:04:41,来自河南,1653301070014078,用户冷眼观花
7130531035598619406,给外交部发言人汪文斌雷鸣般的掌声[玫瑰][玫瑰][玫瑰][玫瑰],0,133,0,2022-08-11 16:23:22,来自浙江,69341272995,感谢你关注
7130674899353600783,本来就没想取消，何来的搁置?,1,94,0,2022-08-12 01:44:47,来自浙江,20831481897,厚德采购
7130535737590219550,永远支持我国外交部发言人汪文斌观点。[赞][赞][赞],0,78,0,2022-08-11 16:42:04,来自四川,1113155842084157,蜀国鑫闲
7130534431773426444,不要考虑，见招拆招，,1,4,0,2022-08-11 16:37:21,来自广东,1798447383978595,聪慧白云Ak
7130532173710967563,支持外交部的回应！,0,19,0,2022-08-11 16:28:30,来自山东,51273143230,自在的大忙人
7130538013976871695,还真没见过美国在关税上审慎过。美国可任性了。,0,3,0,2022-08-11 16:50:12,来自广东,62787137637,黄长乐
7130536872845312809,是这个理，贸易战这张牌，你早就出尽了。,0,44,0,2022-08-11 16:45:43,来自辽宁,111300322696,钉子和尚
7130532735491621632,审慎考虑对华关税，然后呢？,0,37,0,2022-08-11 16:29:42,来自四川,73679584186,阿cool
7130532318674305831,祖国必须统一，也必然统一！祖国统一，势在必得！为外交部发言人汪文斌点赞，为祖国点赞[赞][赞][赞]！,0,84,0,2022-08-11 16:28:55,来自四川,3997453644730915,台湾回归祖国统一
7130544099694428968,关税问题怎么解决？,0,3,0,2022-08-11 17:14:00,来自北京,62703445295,搜别墅
7130531302935642917,中国绝对不会拿自己的主权尊严和领土做交易！,0,18,0,2022-08-11 16:24:49,来自山东,9381405959,王传月
7130759135825756935,以美元结算的出口商品一律提高关税。以其它外币结算的关税不变。以人民币结算的减免部分关税。,0,16,0,2022-08-12 07:09:09,来自江苏,109676970196,狗官
7130533499777680165,贸易战老美什么时候赢过,0,24,0,2022-08-11 16:33:04,来自广东,2819583700909352,玩玩而已
7130531077747196687,为外交部发言人点赞👍,0,44,0,2022-08-11 16:23:10,来自广东,62434534035,我是兵锅
7130770481489494815,除了美国日子实在不好过了，否则别指望他会取消关税！,0,1,0,2022-08-12 07:52:51,来自安徽,79790946369,寿春山人
7130777070304953100,中美贸易顺差是美国限制高科技产品输出造成的结果。,0,5,0,2022-08-12 08:18:55,来自浙江,3105440245490190,一生奔波
7130531091469042467,"中国主权不可侵！
中国人民不可侮！
中国统一不可挡！",0,14,0,2022-08-11 16:23:30,来自浙江,94552372128,灰喜雀RV
7130753874696373022,反外国制裁法要用起来！一事一反制不托延不惯着否则后患无穷！,0,1,0,2022-08-12 06:49:02,来自山西,1288255203706844,独角兽之澜
7130554235783512869,应该继续贸易战，看谁先扛不住。,0,0,0,2022-08-11 17:53:41,来自河北,3478457348001623,邢台你好2019
7130546305449001758,中国企业出口商品，人民币结算份额从10％开始，逐年递增，打败美元霸权，美帝的美梦就慢慢破灭了。,0,0,0,2022-08-11 17:22:47,来自广东,58593523362,流浪南方的北方人
7130556486530401039,中国外交部回应的好👍,0,0,0,2022-08-11 18:01:50,来自辽宁,417402357823732,正大光明暖阳JF
7130551461318574886,中美关系，丟掉幻想，准备斗争。,0,1,0,2022-08-11 17:43:23,来自北京,3166199281093336,豁达的小刘胖
7130762670617625344,老拜又要互相伤害了啊！,0,1,0,2022-08-12 07:22:17,来自山东,2035887736625476,漫步云端之深坑
7130560790737945379,支持祖国捍卫领土完整，实现中国统一！ 🇨🇳,0,1,0,2022-08-11 18:18:33,来自湖北,4294560091,爱吾中国
7130557739700896546,你降了我也不降，反正通货膨胀的不是我,0,2,0,2022-08-11 18:06:54,来自广东,82798462803,睿智待割的韭菜
7130543321210028800,7月美国通胀数据小幅回落，美国觉得自己又行了 何况取消关税降通胀对拜登中期选举也没多大作用,0,0,0,2022-08-11 17:10:42,来自江苏,111142862694,berich小新
7130762693971215134,拜登以为还是1900年[思考],0,0,0,2022-08-12 07:22:51,来自广东,2761622223094375,呆呆的梦想家Ax
7130771707253736233,想拿关税当作谈判砝码,0,2,0,2022-08-12 07:57:15,来自广东,67302112660,Hanson66
7130775372077662976,打破美帝国主义的封锁,0,1,0,2022-08-12 08:11:33,来自广东,100141761430,一往无前白云5i
7130779711173002015,只收人民币[灵光一闪],0,1,0,2022-08-12 08:28:51,来自安徽,2334967643510167,一股清风也
7130765936390325028,美国从制裁开始，就已经输了。,0,5,0,2022-08-12 07:35:20,来自湖北,2211855909530020,乖巧胖胖
7130759034080330532,美国人总想占便宜。,0,2,0,2022-08-12 07:08:44,来自北京,3254167028115660,灿烂阳光123
7130750286499054350,本来就没想调低只是用来做筹码,0,2,0,2022-08-12 06:35:18,来自新疆,60278386493,x6061
7130531308899713833,不理他！除非取消所有关税,0,1,0,2022-08-11 16:24:09,来自广东,5870258358,手机用户老長
7130783301937759017,唉，增加对美出口税又何妨！,0,0,0,2022-08-12 08:42:21,来自广东,1891581881497624,W再回首童年
7130545967858254633,老老实实的说的到位！,0,9,0,2022-08-11 17:21:07,来自安徽,69724841957,马吉克
7130778044993880862,俄罗斯油气卖少了，收入、利润却更高了！并且继续保持了油气价格长期的相对稳定。,0,0,0,2022-08-12 08:22:22,来自浙江,109156428286,高级小猫LA
7130532963100115747,合作互赢,0,5,0,2022-08-11 16:30:45,来自河南,3226270545,phyling008
7130748893650305832,不稀罕！,0,1,0,2022-08-12 06:29:21,来自河南,111407902428,用户天边雁
7130723851830510344,无所谓,0,10,0,2022-08-12 04:56:20,来自江苏,2550509860294439,高级海燕5A
7130533502994596648,别拿关税说事，我们不认为那是根胡萝卜[灵光一闪][撇嘴][发怒],0,29,0,2022-08-11 16:32:42,来自山西,7273996708,劍客0355
7130537171437847311,不用在耍人拉，我们不用你们降关税，就撑着吧。哈哈,0,2,0,2022-08-11 16:46:55,来自福建,59904013217,royxq
7130536651583292194,本来拿降关税当筹码，中国却不给台阶，那就跳下来,0,2,0,2022-08-11 16:45:01,来自陕西,104789818796,莱恩是条狗
7130534384528638732,不用审慎，无所谓，中国人习惯了。,0,0,0,2022-08-11 16:37:05,来自吉林,102519897211,顽强饭团S5
7130767298419458819,我们也要大力支持国内半道体产业链,0,0,0,2022-08-12 07:41:01,来自浙江,470201243277870,不凡火车sF
7130763284156023565,美国是饮鸩止渴,0,0,0,2022-08-12 07:25:12,来自上海,122800539969742,正义力量5903
7130551844757275430,回应霸气！为外交部发言人汪文斌点赞！[赞][赞][赞],0,9,0,2022-08-11 17:44:28,来自河南,52552367602,A格终结者
7130771845737153287,中美贸易顺差是美国限制高科技产品输出造成的结果。,0,4,0,2022-08-12 07:58:29,来自北京,13851020677,摧毁美日
7130544339692421927,支持我国外交部发言人汪文斌观点。[赞][赞][赞],0,0,0,2022-08-11 17:15:42,来自意大利,5421867155,Marcolian
7130542669767967499,祖国必须统一，也必然统一！祖国统一，势在必得！为外交部发言人汪文斌点赞，为祖国点赞[赞][赞][赞]！,0,2,0,2022-08-11 17:09:11,来自山西,105709568245,诗意辰星qa
7130531649401733920,我们对美国产品加征关税，继续推高美国的通胀。,0,36,0,2022-08-11 16:26:36,来自宁夏,1402613168603451,用户6287257284416
7130772885924889359,美方是想方设法拖延中国经济科技增强发展。所以反反复复，故意制造障碍，让中国失去耐心而让步达成美方目的。,0,2,0,2022-08-12 08:01:55,来自四川,104334729037,用户1430081481677
7130778461149004581,美国再等通胀进一步下降，到时候就可以加码贸易战，一开始我就这么认为的,0,0,0,2022-08-12 08:24:00,来自广东,8779233324,手机用户8779233324
7130765593849922338,服装，自行车，瞅这两样东西,0,1,0,2022-08-12 07:33:28,来自北京,1490537038219212,用户1358118369154
7130771966478353159,你降不降税无所谓，我们出口的产品，稍微加点价就行了。,0,1,0,2022-08-12 07:58:42,来自安徽,844074898427934,用户7570110092864
7130777634954380069,不管他,0,0,0,2022-08-12 08:20:31,来自江西,1908352626734727,用户3293859503423
7130758168128455431,你降不降税无所谓，我们出口的产品，稍微加点价就行了,0,1,0,2022-08-12 07:05:32,来自广西,50290089231,手机用户50290089231
7130531890733253384,在这节骨眼上，关税下调拜登的老脸住那放，现在只好硬着头皮顶着！,0,32,0,2022-08-11 16:26:47,来自辽宁,7002233027,率真星球JK
7130534588132180770,美国应当老老实实回到一个中国原则和中美三个联合公报上来。,0,33,0,2022-08-11 16:36:47,来自四川,6919557431,自由自在119062216
7130556851481510697,美国现在都是一群八十几岁老头老太在掌权，把民众搞得水生火热中[捂脸],0,1,0,2022-08-11 18:03:27,来自江西,3214628215861099,快乐的果粒橙
7130536730205815586,现在贸易站，真的加关税对他们有什么好处，老百姓遭殃,0,16,0,2022-08-11 16:45:20,来自湖北,21725301863,再给我两分钟丶
7130766096927769344,美国本来就没打算降低关税，只是口嗨罢了。,0,4,0,2022-08-12 07:35:36,来自江苏,71625529979,人过四十逆水行舟
7130760215158686471,中美开展贸易是双赢合作，中国人民不是靠美国施舍过日子！,0,2,0,2022-08-12 07:13:34,来自山东,50103713821,君子125575292
7130730304327009031,在等着跟中国讨价还价哪？,0,10,0,2022-08-12 05:19:31,来自黑龙江,66850284856,用户5127632979702
7130550973206102816,美国人的鬼话没有可信度。如果还有一点点是真的那么一定是逼不得已。,0,0,0,2022-08-11 17:41:21,来自上海,50420001752,宇赫成功
7130547503715631913,美国是白日做梦,0,0,0,2022-08-11 17:27:03,来自山东,51510229419,nywfjfq
