7130153404597027596,谁人不惜命，向英雄致敬！,0,13,0,2022-08-10 15:58:51,来自海南,6989687760,阿祖不收手丶
7130195826668258059,希望家人不要悲伤。有这样一位英雄应该骄傲，多少人只是嘴巴上或者小事小非上面，装好汉，到了关键时刻，依然能挺身而出才是真英雄，换了是我，一样也会救人，哪怕不幸去世，起码问心无愧,0,1,1,2022-08-10 18:43:21,来自湖北,4455691257920541,梦醒的骚年
7130166426967114511,英雄[流泪][玫瑰][玫瑰][玫瑰],0,3,0,2022-08-10 16:48:21,来自河南,80052132815,童乐家政
7130226488309236521,英雄献身，民众筹款，捐给家人，慰藉心灵。,0,1,0,2022-08-10 20:41:02,来自浙江,55841074236,MrH47081
7130529176922882816,救人的三个人都是英雄❗️应该給它们三个申报见义勇为人员奖励‼️,0,0,0,2022-08-11 16:16:03,来自海南,4540300152,安民
7130436028694840099,年轻单身时候我也救过人 喝水喝饱啦 在岸上躺尸 连句谢谢都没 庆幸阎罗王不收我 救人可以 尽力而为 不在乎人家说什么 自己摸摸良心[抠鼻],0,1,0,2022-08-11 10:14:17,来自广西,85908794327,罗飞7616
7130215267187622660,向舍己救人的英雄致敬！,0,1,0,2022-08-10 19:58:27,来自北京,2365789907723928,吉安羚悦狮奥
7130615976592540452,致敬救人英雄，一路走好！,0,0,0,2022-08-11 21:52:57,来自河南,1728877772943438,王子影视厅
7130430224894198541,舍己救人，奋不顾身，给英雄点赞[赞],0,2,0,2022-08-11 09:52:23,来自湖南,1750881047942135,霓红洲
7130175366555763487,三名救援者都是见义勇为。别只报烈士忘了英雄。,0,2,0,2022-08-10 17:23:28,来自北京,2759291716,风中的老风
7130191022554104614,向舍己救人的英雄致敬！英雄一路走好。愿英雄家人身体健康，万事顺意。[祈祷][祈祷][祈祷],0,2,0,2022-08-10 18:24:29,来自北京,95955656282,财源广进一生平安宾宾孟大宾
7130225912402608936,不能让英雄吃亏，官方发过来捐助账号，封顶500万，大家都积极捐款吧。,0,1,0,2022-08-10 20:38:59,来自河南,110151367259,荷花池水深千尺
7130415815375012649,希望被救的5人，应该扶养英雄的父母孩子，才对得起自己的良心，如果是没有他就可能是你们伍人,0,2,0,2022-08-11 08:56:05,来自江苏,101932402687,勇者咖啡0h
7130759794126062344,政府应向英雄家属捐款,0,0,0,2022-08-12 07:11:44,来自河北,6964557820,博学阳光UA
7130601253377721101,泪目，必须追认为烈士,0,0,0,2022-08-11 20:55:54,来自广西,6353006182,夕阳红AS
7130248256835126016,除了见义勇为外，应当申报评定为“烈士”才对，他的家人才能享受抚恤。,0,1,0,2022-08-10 22:05:37,来自四川,276697067567165,公平正义之声
7130214158280885027,见义勇为，方法方式重要，应量力而行，赌上自己家人一生的悲痛…,0,1,0,2022-08-10 19:53:27,来自上海,5833127832,GMS67209706
7130247360684278569,政府部门一定要做好善后工作,0,2,0,2022-08-10 22:02:07,来自北京,6942672007,刘百夷
7130557998178747147,应承遗遗孤的抚养！让英雄不留遗憾！,0,2,0,2022-08-11 18:08:27,来自四川,52852829035,优雅钢笔5xo
7130617682868618018,不是只要平躺着不动，脸就会露出水面吗,0,0,0,2022-08-11 21:59:10,来自山东,3678264249,风清云淡21557491
7130789012968637218,虽然有点迟，但是见义勇为就是英雄。,0,0,0,2022-08-12 09:04:11,来自上海,2780030188928324,ArJun.m.e
7130194547862700833,蒋筑英 蒋正全 还有...,0,1,0,2022-08-10 18:38:14,来自广东,4494417903778926,风波亭
7130204808938111756,英雄的家庭重担，应由大家来扛。全社会都要行动起来。,0,1,0,2022-08-10 19:18:10,来自黑龙江,57659493877,多才天空pl
7130554412908823307,获救的应该全是陕西人吧，陕西同胞们动起来，让恩人走的没有后顾之忧,0,1,0,2022-08-11 17:54:48,来自湖北,53143183699,OO1444060
7130764863357813545,肯定是见义勇为，为他的勇敢点赞。,0,1,0,2022-08-12 07:30:55,来自广东,3244398282,ygclnh
7130157013556298534,英雄都是平凡的中国老百姓！危机时刻尽显英雄本色！,0,7,0,2022-08-10 16:12:40,来自江苏,110809296870,风趣原野re
7130483012299113250,英雄一路走好！[祈祷][祈祷][祈祷],0,1,0,2022-08-11 13:16:48,来自山西,50565185668,韬略天下
7130598016695943943,希望政府安顿好他的儿子！,0,0,0,2022-08-11 20:43:11,来自广东,107782024641,勇往直前的西柚D5
7130178281282356008,英雄一路走好[祈祷],0,2,0,2022-08-10 17:34:22,来自浙江,51242718958,军醒狮
7130476056045601577,这是英雄，是大爱，是我们中华民族的优良传统。,0,2,0,2022-08-11 12:49:43,来自四川,64204191683,我叫曹大旺
7130581166117651200,在哪里募捐？,0,0,0,2022-08-11 19:37:35,来自湖南,3185944617,小猫8187766
7130505181082436387,致敬！愿他的孩子被社会善待[祈祷],0,0,0,2022-08-11 14:42:44,来自湖北,5967877054,园林工程材料
7130791279797224228,政府应该重奖，不应该政府发起募捐！,0,0,0,2022-08-12 09:13:31,来自山东,87389803131,绿水青山主人
7130470938793624355,一定要做好英雄的善后工作,0,1,0,2022-08-11 12:29:53,来自山东,1714879802646004,自在的优雅可乐w5
7130758800797598504,：应该正能量,0,1,0,2022-08-12 07:07:25,来自陕西,99901099395,乐观的光束m
7130145771345134336,呼吁全社会父亲教会孩子们游泳🏊‍♀️,0,16,0,2022-08-10 15:28:18,来自广东,1455392492881739,施主九月八
7130169753456673551,向舍己救人的英雄致敬！英雄一路走好[祈祷],0,2,0,2022-08-10 17:01:16,来自湖北,96261355237,扬帆AuyM
7130487851929944836,每每看到这样的新闻，都会热泪盈眶，愿英雄一路走好[流泪][祈祷][祈祷][祈祷][祈祷],0,1,0,2022-08-11 13:36:30,来自四川,104348085296,yiqi在路上
7130483642837058319,看了这样的新闻让人既感动又痛心，希望相关部门以及社会做好善后，不要让英雄的家人寒了心。,0,1,0,2022-08-11 13:19:25,来自内蒙古,1719262186316011,爱国不掺假
7130202309862900518,见义勇为的儿女应该上最好的学校，国家安排最适合他们的工作,0,1,0,2022-08-10 19:08:31,来自山东,94233200100,山东好好人
7130156297198650112,救人首先要考虑的是自身的安全。,0,6,0,2022-08-10 16:09:07,来自四川,56164007080,用户瞭望
7130473689778488094,救人英雄！一路走好！[祈祷][祈祷][祈祷],0,2,0,2022-08-11 12:40:47,来自安徽,3825901782696141,德才兼备钢笔吴勤
7130502278934512388,向英雄致敬一路走好，被救的一车人，要拿出万分感谢捐献给他们的孩子和老人，不然孩子以后生活是有困难的,0,1,0,2022-08-11 14:32:10,来自吉林,111029601227,娇阳手写知识
7130524281716441867,建议公布捐款账号，不让英雄家属心寒！,0,1,0,2022-08-11 15:57:39,来自广西,1099102638574695,热情的海浪nk
7130475599894233891,国家应该把舍命救人英雄的孩子抚养成人，并优先照顾孩子读大学。当然，相信获救的人也会帮助照顾孩子，也应该共同帮助照顾这孩子。,0,0,0,2022-08-11 12:47:56,来自广东,4142565384527630,金城大帅
7130432813370983175,这样的英雄国家直接拨款重奖，还需要捐款吗？？？,0,1,0,2022-08-11 10:02:25,来自甘肃,6693394922,热心清泉46
7130497498019971881,其实是本能，没什么想法，但被救方要懂得感恩，我亲自体念过，真的容易把自己搭进去，因为溺水的人无意识，会把你往水里按,0,0,0,2022-08-11 14:13:17,来自海南,108043374991,热心奶酪4T
7130189338591118119,应该追授为优秀党员,0,1,0,2022-08-10 18:17:43,来自广东,110743321483,挪威的森林1984
7130741504733676325,希望国家能保送小孩到好的学校读书，而不是仅仅是加分了事,0,0,0,2022-08-12 06:02:02,来自福建,100249888492,鲨鱼花生
7130179432106836776,应该奖励百万[祈祷],0,1,0,2022-08-10 17:38:52,来自安徽,2837198173904487,嗯😊
7130779264987153156,英雄的家人该如何安置啊，孩子还那么小，英雄走了最牵挂的就是他的亲人，,0,0,0,2022-08-12 08:27:28,来自辽宁,2713219048679819,润泽小书虫
7130481198010237737,泪目！致敬见义勇为的英雄，救人一命胜造七级浮屠，何况救了5个，希望被救的一家能有所表示！,0,0,0,2022-08-11 13:09:37,来自广东,2475743905857432,一心一意阳光oS
7130188363919262497,又有一位舍己救人的英雄离开了这个世界，英雄一路走好,0,2,0,2022-08-10 18:14:33,来自山东,1882009355429499,爱笑的张雪迎Sophie
7130247055322546975,一定把遇难者家属安置好。不要让英雄死不明目。愿救人的英雄安息吧。,0,3,0,2022-08-10 22:01:25,来自江苏,1513354759506750,幸运孔雀Ap
7130477012225344256,当今社会！这种感人的事迹真的很少！传播正能量！,0,1,0,2022-08-11 12:53:30,来自湖北,5508001257,昨夜星辰57611242
7130199869557523204,没有天降的英雄，只有挺身而出的凡人，英雄值得我们尊敬，英雄值得我们思忆！愿英雄一路走好！[祈祷][祈祷][祈祷],0,2,0,2022-08-10 18:58:43,来自青海,108278288706,完美原野Hi
7130488486763299625,四川好男儿,0,0,0,2022-08-11 13:38:13,来自河南,85057631248,杰森斯坦青
7130570396973482784,怎么捐款把募捐发一下,0,0,0,2022-08-11 18:56:46,来自陕西,95774556353,开心的樱桃小完犊子
7130182050937570083,农民工是实在人！,0,1,0,2022-08-10 17:48:46,来自北京,1477399354814957,用实力和行动说话
7130213437376561954,"请公布英雄的募捐账号！
我想尽点绵薄之力[泣不成声]",0,2,0,2022-08-10 19:50:41,来自辽宁,2788006695812031,会编程的松鼠
7130582635487249187,那五个人的家里人于情于理都应该帮他养小孩和父母，政府必须肯定男子的行为，给予大部分帮助，社会面也可以提供一些扶持，支持的点赞！,0,0,0,2022-08-11 19:43:21,来自四川,92324161021,多塔塔塔
7130184587795841823,被救的人应该报答救命恩人。。。,0,1,0,2022-08-10 17:59:17,来自四川,2014727059281639,清爽辰星SL
7130404697990857484,现实说中国农民朴实，善良，心里纯正。他们在救人时什么都没有想，就简单救人！,0,0,0,2022-08-11 08:13:54,来自广东,111561041382,殷裕师
7130476892985410345,真难过看到这样的新闻！保来生平安幸福！,0,1,0,2022-08-11 12:52:56,来自浙江,5754680292,东瓜自留地
7130482115250111272,致敬[作揖]英雄！,0,2,0,2022-08-11 13:13:09,来自陕西,6073802892,江湖论衡78101725
7130176910289617700,好好善待人家父母孩子，让更多的人学习,0,2,0,2022-08-10 17:29:12,来自江苏,111308039998,豁达的星空物语
7130444053107245824,国家应设立见义勇为奖金救助好人家庭,0,1,0,2022-08-11 10:45:29,来自山东,2524087713298415,起步的翅膀
7130176198399066884,英雄一路走好[祈祷][祈祷][祈祷],0,2,0,2022-08-10 17:27:03,来自江西,5839034934,长弓硬筆
7130450873452430110,不要小看着水库！大热天的！脚一下水库！下面水冰冷！,0,0,0,2022-08-11 11:12:21,来自四川,85501698625,无糖健康食品
7130507259997651725,希望政府及社会福利机构能给这位英雄的家庭带去一些温暖和奖励[祈祷],0,0,0,2022-08-11 14:51:14,来自四川,62578820165,开心的大权
7130556409959449355,申报烈士应该没问题？好人没长寿，原好人一路走好！,0,0,0,2022-08-11 18:02:36,来自河南,3443283656709979,端庄优雅百香果MP
7130645758180803332,媒体发动一下募捐，筹个几百万没问题，让两个孩子老人无忧的生活下去,0,0,0,2022-08-11 23:50:16,来自北京,2432542245129437,My尼城
7130770238735516447,应该是烈士待遇！,0,0,0,2022-08-12 07:52:01,来自湖北,55081118473,不凡星空E
7130539442095817511,希望被者能常去看望英雄的父母和儿子。,0,0,0,2022-08-11 16:56:50,来自新疆,60704979386,多彩钢琴Qw
7130461464729027367,重庆人好样的，一路走好,0,0,0,2022-08-11 11:53:50,来自重庆,100837471446,诚实的狼8889
7130405678564492066,应该追认为烈士，为人民而牺牲,0,1,0,2022-08-11 08:16:40,来自江苏,3131856848436279,心如止水
7130776649091695360,还用认定吗,0,1,0,2022-08-12 08:16:24,来自新疆,88929481982,英明果断云朵vS
7130482114054718223,向英雄致敬!,0,1,0,2022-08-11 13:13:12,来自河北,68743642573,温柔花猫Ke
7130630272877396775,被救的人哪？没见发声。,0,0,0,2022-08-11 22:48:55,来自湖南,55632763722,豁达明天更美好
7130538757161812751,国家、民间团体、相关身边人，请把感动、关心、同情、敬佩化作实实在在的一毛一块，这才最有意义。,0,0,0,2022-08-11 16:53:15,来自陕西,104789818796,莱恩是条狗
7130455044150952739,向英雄学习！向英雄致敬！,0,1,0,2022-08-11 11:28:12,来自湖南,311909665744440,极速廊坊0s
7130488800312771343,看着真难受。,0,0,0,2022-08-11 13:39:24,来自北京,2991090262620535,开朗大方海阔天空
7130486005945844493,致敬英雄的烈士！你的伟大义举感动万千人，一路走好，希望国家能赡养好这位英雄义士的老人和孩子！,0,1,0,2022-08-11 13:28:58,来自山东,4349297437192686,乖巧远山eS
7130420396733629225,人间最可爱的使者，和平年代英雄男儿，像你致敬！[玫瑰][赞],0,1,0,2022-08-11 09:13:47,来自内蒙古,85133057919,倒走千秋
7130492645750735616,向英雄致敬[祈祷][祈祷][祈祷],0,0,0,2022-08-11 13:54:03,来自广东,4003319881,Rico888
7130226453932917517,没搞清楚，旁岸边不是有好多人吗？他们在干什么？气愤！,0,1,0,2022-08-10 20:41:22,来自江西,2533722556210071,直爽禾口
7130480793776259855,致敬英雄！,0,0,0,2022-08-11 13:08:15,来自广东,104409446445,未来随风吧
7130488159209161485,蒋大哥，一路走好,0,0,0,2022-08-11 13:37:23,来自意大利,102791414844,大吴疆土4786
7130479872669238054,致敬英雄！一定要善待英雄的家人，让英雄可以含笑九泉！,0,1,0,2022-08-11 13:05:22,来自湖南,101434144724,胡一宇
7130465195885167394,"我真的希望当地政府村委会能帮助孩子健康成长成才，帮助父母善养终年。
向救人英雄无限致敬！",0,1,0,2022-08-11 12:07:39,来自江苏,72523279990,2012905
7130518536010597159,自己家庭前途渺茫了啊,0,0,0,2022-08-11 15:35:10,来自湖南,62523566715,wongbiakian
7130165139256886056,英雄一路走好……,0,3,0,2022-08-10 16:43:23,来自广东,108877968513,潇洒生活家Yg
7130180087278256930,向英雄烈士致敬！,0,1,0,2022-08-10 17:41:27,来自河北,68824526745,福虎娱乐有料想说667
7130487363117318943,太难得了，用自己的生命挽救了5个人。向英雄致敬！,0,0,0,2022-08-11 13:34:02,来自北京,50658903290,京苑3
7130405117044130590,被救五人应该为英雄的父母养老送终，儿子抚养成人，娶媳妇，你们五人的命是人家拿命换的，人要懂得感恩。,0,1,0,2022-08-11 08:15:22,来自河南,1539784453654446,智者雪碧tU
7130480618382967589,应该评为烈士,0,0,0,2022-08-11 13:07:53,来自重庆,98732510035,大雁4131
7130601083969618721,英雄[赞][赞][赞][赞][赞],0,0,0,2022-08-11 20:55:31,来自吉林,8368320636,6张小欠儿6
7130493745803526953,英雄一路走好！没有恩人的达救这五个人的生命无存活，感恩吧，无忘恩人！,0,0,0,2022-08-11 13:58:22,来自云南,64570349960,李192787701一
7130466485578892047,募捐方式公布下？,0,0,0,2022-08-11 12:12:29,来自湖南,97980936197,直接狗
7130395277986628382,应该是烈士而不是一般的见义勇为，前几年一名军人救四人本人活着记一等功，不能因为身份不同而待遇不同！,0,1,0,2022-08-11 07:37:08,来自北京,98409602871,饼干9484
7130550447618310947,向英雄致敬，英雄子女福禄全！,0,0,0,2022-08-11 17:38:37,来自广东,55122698601,潇洒侠者
7130480399394079528,这是英雄！相信英雄的儿女和父母会得到国家的善待,0,1,0,2022-08-11 13:06:33,来自河北,4459212545727308,都督的爸比
7130475259320484646,向英雄致敬！英雄一路走好!,0,1,0,2022-08-11 12:47:11,来自江苏,26030319081747,123出去浪
7130422910703223593,重庆的骄傲，江津的骄傲！,0,0,0,2022-08-11 09:23:42,来自重庆,1601324114787549,自由葡萄
7130176084477739816,舍己为人的人民英雄，一路走好！,0,3,0,2022-08-10 17:25:45,来自云南,12801937520456,淡定晚风N
7130217368133010184,捐款方式？,0,0,0,2022-08-10 20:06:17,来自广东,103204391725,Ray26348
7130440106510795520,募捐就是和水滴筹一样，都有点赚,0,0,0,2022-08-11 10:30:18,来自安徽,3443267928342167,中国安徽3312
7130486205132686095,舍已救人英雄一路走好[祈祷][祈祷][祈祷],0,0,0,2022-08-11 13:29:18,来自江苏,72621496039,JDJF253067415
7130475197743858432,望国家对子女进行抚养,0,0,0,2022-08-11 12:46:11,来自北京,4371260563790712,今朝鸿鹄
7130490869060961024,向民间英雄致敬，希望被救者给于英雄补偿。希望政府给于救助，同时大力宣传。,0,0,0,2022-08-11 13:47:31,来自陕西,88685766483,"老刘""刘叔"
7130477852554101538,哎！悲剧呀，国家也应该给予补偿吧，要不以后谁还敢救人。,0,0,0,2022-08-11 12:56:42,来自广东,2925115644840687,专注国际政治
7130475925900526349,被救者没有任何表达的话，以后大家遇到别人有困难都会冷漠。,0,0,0,2022-08-11 12:49:34,来自山东,3852308998263263,爱国在心中不在嘴上
7130258077663920899,比那些选美接娃的，值得上头条，捐款通道,0,0,0,2022-08-10 22:44:38,来自贵州,1215803506,多多益善1401
7130486299337261831,为什么不在保证自身安全的情况下救人,0,0,0,2022-08-11 13:30:01,来自河南,6603841561,老K98891196
7130170322124309260,好人啊，舍己救人无尚光荣！,0,2,0,2022-08-10 17:04:00,来自陕西,100576340594,荣耀66148
7130479338503766818,向英雄致敬🙏🙏🙏🙏,0,1,0,2022-08-11 13:02:32,来自山东,56730572672,回眸364
7130493594477380392,救人一命如再造父母，英雄一路走好,0,0,0,2022-08-11 13:57:48,来自辽宁,3795136320387132,山山黄叶飞A
7130493096931951360,应申领烈士（只要对人民和社会能关键时刻能够舍去生命的人都是英雄，去世都应称之为牺牲，牺牲了就是烈士）,0,0,0,2022-08-11 13:55:51,来自海南,106905302327,袁宝山10月
7130737882335019808,英雄一路走好！,0,0,0,2022-08-12 05:48:25,来自浙江,59172808581,风吹云飞3
7130753815825367819,"浩气长存！
英雄走好！",0,0,0,2022-08-12 06:49:37,来自辽宁,52964400998,飞雪140245546
7130204773722374944,这种人才是真英雄，人民英雄一路走好。,0,2,0,2022-08-10 19:17:42,来自广东,10228186421,廖作仁
7130618138999669544,好人一生平安……哎,0,0,0,2022-08-11 22:01:04,来自河南,3839133962474628,呀王三喜呀
7130495324653290247,好人，一路走好！,0,0,0,2022-08-11 14:05:11,来自广西,342658581539007,欢快艺术家nW
7130244805797282560,被救的5人应终生关照死者家庭，亡者家庭有困难时应尽一己之力。,0,1,0,2022-08-10 21:52:16,来自重庆,104233107499,川老叶子
7130536447484347149,感人，向英雄致敬,0,0,0,2022-08-11 16:44:43,来自江苏,307463150113447,心向菩提果
7130786334117315363,英雄这个称号还是网友给的,0,0,0,2022-08-12 08:54:00,来自广东,60632196221,江南皮革黄先生
7130484614988546831,请同时公布一下账号,0,0,0,2022-08-11 13:23:05,来自广东,6236127164,raul2021
7130215020864684835,这种英雄的孩子一定要让他免费上学安排好工作。不能让好人寒心,0,1,0,2022-08-10 19:56:53,来自山东,1037578209330815,白白嫩嫩红包不能
7130445905748034337,家人应该给予善待，让逝者安息安心。,0,0,0,2022-08-11 10:53:23,来自江苏,10325477105,夏雨139042631
7130255585832092430,那5人该都不会，认账吧！,0,0,0,2022-08-10 22:34:35,来自四川,1160686512117918,成熟芒果KS
7130502656766100259,政府奖励100万，获救的人有条件的每人出个10万，再社会上捐助一点，才对得起他！,0,0,0,2022-08-11 14:33:02,来自江苏,80787519206,sky
7130473519758312226,其他2人也要申报，不能人死了就报人死的,0,0,0,2022-08-11 12:39:49,来自安徽,56818420685831,足坛长相最丑一博格巴
7130628594057413383,向几位英雄致敬,0,0,0,2022-08-11 22:42:25,来自福建,93342194959,远望着星空
7130458926138589992,"好人不长命，唉，可惜了
见义勇为，一路走好🙏",0,1,0,2022-08-11 11:43:12,来自江苏,110233584530,江南boy
7130292467253281539,车都不被水泡过项，怎么会死人。被救也到岸边，水不会有太深了吧！,0,0,0,2022-08-11 01:02:11,来自广西,104298986696,相思红尘65
7130164652789203715,一定要善待英雄的家人。,0,3,0,2022-08-10 16:42:26,来自湖南,1600513214519512,国强民侧安
7130507787197023011,英雄的家属不希望自己的亲人成为英雄,0,0,0,2022-08-11 14:53:00,来自重庆,106646117604,緣覚
7130791429618074383,能否成为烈士,0,0,0,2022-08-12 09:13:41,来自江苏,65431416884,ylq680511
7130566013006971678,向英雄致敬，英雄一路走好！,0,0,0,2022-08-11 18:39:15,来自云南,1499356956202939,亦花亦木亦世界ing
7130166015253857059,为失去如此英雄深感悲痛，逝者安息，其家属节哀。,0,2,0,2022-08-10 16:46:39,来自上海,3324556622444029,智者轮船sp
7130472735348032263,捐，国家带头捐,0,0,0,2022-08-11 12:37:13,来自浙江,98024964848,小梁20180730
7130210655558664998,这种人国家是不是应该等同烈士对待？,0,0,0,2022-08-10 19:40:33,来自山东,87272077308,七戒不戒
7130457207770628871,悲伤的消息[流泪][流泪][流泪][流泪],0,1,0,2022-08-11 11:37:13,来自海南,5564919874,君自大秦来
7130591403486544644,致敬英雄！[祈祷],0,0,0,2022-08-11 20:17:50,来自吉林,2252269344787812,朝阳区小波山食品行
7130480767704154919,希望得救人人膳养英雄家的老小,0,0,0,2022-08-11 13:08:43,来自浙江,3179439556147667,完美微风Yt
7130475187362939651,好人啊！照顾好他家的，其他都是虚的,0,0,0,2022-08-11 12:46:51,来自上海,59263302921,苦集灭道39
7130243028597637922,向英雄致敬！@博鳌潮夫,0,1,0,2022-08-10 21:45:20,来自四川,3482896911051815,博鳌潮夫
7130636258279441192,英雄已成神！,0,0,0,2022-08-11 23:11:49,来自四川,5788668231,穿堂钟
7130402302376035072,再多的钱也救不回来一个好父亲好儿子！,0,1,0,2022-08-11 08:03:36,来自北京,104455132660,英明果断橙子wU
7130192582982353695,不想看到太多的英雄，只希望各种活动，各个环境，各种项目都有好的安全防护，避免坏的事情发生，预防不好的事情发生。,0,1,0,2022-08-10 18:30:23,来自广东,105009880098,你哦了吧啦啦
7130549279260754691,见义勇为英雄好走[祈祷],0,0,0,2022-08-11 17:34:37,来自北京,60692060241,至尊宝北京
7130450542409188111,保护好自己，在量力而行,0,0,0,2022-08-11 11:10:58,来自山东,100084233314,每一天宝哥
7130792331125048064,烈士，行不行,0,0,0,2022-08-12 09:17:19,来自天津,2356971737190983,后山人偶做前堂客9903
7130520772656841507,向英雄致敬！英雄一路走好！,0,0,0,2022-08-11 15:43:16,来自湖南,91940457702,朗洲百姓
7130494666335699726,一个工地打工的普通人，却能在危难关头挺身而出！他是一个平凡的人，也是一个高尚的人！这样的人才是我们民族的脊梁！,0,0,0,2022-08-11 14:02:25,来自天津,3698386170806739,爱说闲话家常
7130471797203469092,如何捐款，这种人我还是值得捐的，人没了但是孩子还需要生长,0,0,0,2022-08-11 12:33:21,来自云南,50259260705,云中雏鹰
7130490836198408974,国家把他的家人养老养大吧,0,0,0,2022-08-11 13:47:52,来自河北,59635873095,书香xf
7130477895432438536,捐款账号有没有？,0,0,0,2022-08-11 12:57:14,来自广东,65378068218,宁采臣88198618864
7130484883801686792,致敬英雄！[祈祷][祈祷][祈祷],0,0,0,2022-08-11 13:24:35,来自云南,364665106098451,夜AI風
7130471313231495975,英雄一路走好,0,0,0,2022-08-11 12:32:02,来自安徽,1934787251018616,字节爱唱歌
7130440407590388492,这被救家属一定要对遇难家属负起责任来！！别人的命换起你们的命！近老乡一路走好！🙏🙏🙏🙏,0,1,0,2022-08-11 10:32:16,来自湖北,72285795151,权生树
7130502740933477155,怎么没听见被救五人发声？哪怕说声感谢也是对牺牲者灵魂的一种安慰。,0,0,0,2022-08-11 14:33:29,来自广东,100280325401,羽扇轻摇纶巾飘
7130410607324840744,四川人的骄傲，英雄一路走好[流泪][流泪][流泪][流泪][流泪][流泪],0,0,0,2022-08-11 08:35:53,来自四川,2045543229168096,魅力无限
7130608847743566633,致敬英雄一路走好,0,0,0,2022-08-11 21:24:53,来自广东,102261131211,光阴的故事7
7130481577968452364,见义勇为了，儿子怎么办？,0,0,0,2022-08-11 13:11:50,来自天津,93049254190,npdpma
7130487704151868172,蒋正全——草根英雄！,0,0,0,2022-08-11 13:35:43,来自湖北,6115599787,痴萝卜
7130469698663482150,获救者要感恩，政府要膳养其家人！,0,0,0,2022-08-11 12:25:42,来自浙江,106171256651,财源广进fc
7130611070519313187,给老人孩子一个长久的保障🙏,0,0,0,2022-08-11 21:33:30,来自新疆,5005962706,西域行
7130191079395066660,向英雄致敬，英雄一路走好！,0,1,0,2022-08-10 18:24:18,来自陕西,5224173676,813039
7130517650224268068,怎么样捐？我想捐点,0,0,0,2022-08-11 15:31:44,来自浙江,68517829190,斯广
7130204453328143145,向舍己救人的英雄致敬！英雄一路走好[祈祷],0,1,0,2022-08-10 19:15:47,来自广西,62458025338,贵港车百荟二手车阿志
