7130153698089222945,向舍己救人的英雄致敬！英雄一路走好[祈祷],0,1253,4,2022-08-10 15:59:53,来自福建,4142560058023691,薇薇逛红尘
7130226642928272142,政府应给家人保障,7,200,0,2022-08-10 20:42:03,来自河南,78349352072,乘风破浪的高山B7
7130475539596870415,默哀三秒钟[祈祷][祈祷][祈祷]一路走好,2,144,3,2022-08-11 12:47:45,来自河南,597722397940999,飞来有痕
7130196578312389417,像这样的英雄，不但他本人要给予应有的褒奖，他的父母和孩子也应给相应的保障。,8,677,1,2022-08-10 18:45:16,来自内蒙古,98951918620,7913215914833
7130257989361713927,英雄一路走好[流泪][流泪][流泪]救了五个人自己却没能上岸,0,170,0,2022-08-10 22:44:20,来自江西,769253383078028,旅游达人湾儿
7130460987198980879,被救的这一车人，哪怕贷款也要去感恩,7,154,1,2022-08-11 11:51:20,来自浙江,94159137557,芽儿11353
7130469364968932096,为什么不救四个？希望英雄各个都能平安。不想听到看到救人却牺牲的消息。,1,3,0,2022-08-11 12:23:44,来自安徽,4041401737166520,合欢扇7
7130766416873030435,见义勇为应该歌颂并提倡，因为生活里到处充满着意外，可是，他年老的父母怎么办，他年幼的孩子怎么办，父母无所老，孩子再无父爱，他的妻子如果一人来承担这个家庭，幸福利率还有多大，无论如何，救人的同时切勿忘记自身的责任，不要因为自己个人行为给家人带来痛苦和负担，这才是正确的，毕竟，你也只是个普通人，忘社会的爱，可以减少他家人的痛苦[祈祷],0,4,0,2022-08-12 07:36:35,来自辽宁,100527037642,思颖7373
7130163118541816590,向舍己救人的英雄致敬！英雄一路走好。愿英雄家人身体健康，万事顺意。[祈祷][祈祷][祈祷],3,311,0,2022-08-10 16:35:55,来自北京,61274757145,大家好帮帮忙吧
7130198473420849920,被救的五人在有能力的情况下，应该照顾英雄的家人，这不是道德绑架。,19,582,5,2022-08-10 18:52:41,来自河南,5861848564,此生温柔以待525
7130429474009072424,他的父母儿子应该得到妥善安置。,1,43,0,2022-08-11 09:49:09,来自江西,92496242345,淡淡小红花
7130250391732077351,为什么别人不帮忙？！,12,49,2,2022-08-10 22:14:49,来自北京,1266236031768087,理想农人
7130168449724613376,个人觉得，见义勇为还是要量力而行。如你健在，父母妻儿的余生才有盼头。,29,342,3,2022-08-10 16:56:13,来自四川,59081189725,雪儿216087835
7130168282820690719,看旁边站了那么多人，只有你下水了，英雄一路走好！,17,178,5,2022-08-10 16:56:03,来自重庆,3002682470,秀秀爱养生
7130199750128845581,希望得救之人膳养英雄家的老小,7,188,2,2022-08-10 18:57:46,来自广西,2173058924938099,蓝色多nao河
7130195301923210017,居然是我们江津人，一路走好！,7,47,1,2022-08-10 18:41:14,来自广东,1824795123782414,婧萱吖
7130207840451003176,好人！一路走好！[祈祷][祈祷][祈祷],1,7,0,2022-08-10 19:29:01,来自福建,3267389946071053,安逸山丘ED
7130483847212729123,救人也得量力而行,2,5,0,2022-08-11 13:20:03,来自河北,102807538382,叶啡
7130473004580455172,社会捐款是大家的善举，但被救的人应该懂得感恩，担负起牺牲者孩子的抚养责任。,0,22,0,2022-08-11 12:38:35,来自四川,2349021544321112,卿卿
7130585462015656704,看的泪流心酸孩子咋办向我们的英雄致敬，救了5个人不容易体力耗尽，这样的英雄我们社会应以各种形式向英雄致敬向其家属各种帮助[流泪][流泪][流泪],0,8,0,2022-08-11 19:54:06,来自吉林,3676371860085774,成熟露珠vH
7130165686752019238,一定给他正义的补偿啊，见义勇为奖给他,0,203,1,2022-08-10 16:46:06,来自广东,3790743470876535,一纯小弥陀
7130181328297542435,这个和前段时间柳州高速发生的车祸形成鲜明的对比，河北大哥全程拍摄指挥有序从雷克萨斯救起了两人，还有一个没就出来被喷，你看看这个，救人连自己的命都搭上了，他的家人父母多伤心，老人小孩怎么办！说句不好听他可以不救不管，如河北大哥像他这样搭上命了咋办？,6,49,0,2022-08-10 17:46:12,来自广东,5774871936,风趣海岛姑娘
7130766675414549283,当年救了一家三口，人家就是说你自己愿意救得我没喊你！伤心中😔现在成了仇人。,0,1,0,2022-08-12 07:37:48,来自天津,50282311213,tianwei1803
7130409517451657987,向舍己救人的英雄致敬！我们的社会正因为有这样的好人才，让我们这个社会更加和谐和美好。希望有关部门能够处理善后事宜，安抚好英雄的家人，并给予英雄家里一定的慰问金，让英雄的孩子和父母在未来的生活中解除重要的后顾之忧。希望英雄一路走好1,0,63,2,2022-08-11 08:32:26,来自北京,95698073804,快乐智慧12688
7130485043776570152,象这样见义勇为的好人，应该提倡学习。,0,7,0,2022-08-11 13:24:45,来自湖北,1723642066765792,用户Fp160629
7130156889438257951,救人的英雄咋都这么悲惨，是巧合还是？,5,34,0,2022-08-10 16:11:43,来自河北,5877202951,空空良良
7130262813977363239,又倒下一个因为下水救人而牺牲的英雄，明知很危险还是不顾一切的冲上去，多么伟大，多么善良，用生命做好事，不计代价，愿逝者安息！[蜡烛][蜡烛][蜡烛],0,18,0,2022-08-10 23:03:56,来自广东,602993941818247,安逸远山921
7130170538676519715,见义勇为牺牲了应由国家发放奖励，奖励的是正义，奖励的是舍己为人的精神，只有国家的认可才能弘扬这种正能量！否则救人英雄会流血又流泪！这种舍己为人的精神慢慢会不复存在！,3,55,0,2022-08-10 17:04:16,来自山东,93125556647,听听味儿
7130280041648538381,这是何苦呢？凡事量力而行！留点力气上岸不好么？你也是有一家子人需要你养。我是不赞成这样救人。救人首先要保证自身安全。如果连自己都保护不好何谈救他人。也就是说有人落水你不会游泳就不要下水。,1,7,0,2022-08-11 00:11:04,来自天津,6106235484,百态轮回
7130184242935726862,太难得了，用自己的生命挽救了5个人。向英雄致敬！,0,40,0,2022-08-10 17:57:49,来自湖北,7432675831,游乐场克劳德6b5
7130207826614027008,开车注意安全，搭上了人家的性命好可惜！！向英雄致敬！！,0,25,0,2022-08-10 19:28:54,来自广东,3073843311942179,竹影墙
7130196359483261732,向舍己救人的英雄致敬！向英雄家人致敬并多保重！,0,26,0,2022-08-10 18:44:58,来自湖北,60315437674,刘全心2
7130169496572265254,耿直的重庆崽儿，英雄不问出处，悼念[伤心][伤心][伤心],0,20,0,2022-08-10 17:01:02,来自四川,3706520832,爱生活的河流Ii
7130469965081641763,"我真的很想看到，好人有好报。
现实确实，处处给你扑冷水。
我只看到好人英勇就义者多
确很少看到好人就好报的。
很多好人，牺牲了生命做好事。
他们得到了什么？
得到的是家庭破碎？
得到是几句你是好样的，你是英雄？
请问有用吗？
对于他们的亲人妻儿，是多么的残忍？",2,5,0,2022-08-11 12:26:11,来自上海,3210181220768573,谋术师
7130152215050322728,为救人失去生命，太遗憾了。致敬,1,67,0,2022-08-10 15:53:22,来自山东,2736064701138624,极速云朵05
7130163372431180584,无力时，面朝上，身体放松，自然上浮,18,30,1,2022-08-10 16:36:19,来自上海,93176278308,淡泊一路走好
7130283388259009312,向英雄致敬！一路走好！被救的五人是不是应该负担起照顾救你们的英雄留下的孩子和老人,0,9,0,2022-08-11 00:26:16,来自四川,55272578594,Joe1314520
7130484132790272809,为四川，见义勇为的小伙子点赞👍英雄一路走好[祈祷][祈祷][祈祷]离我们家很近的闫良,0,5,0,2022-08-11 13:21:03,来自北京,106874566671,英明果断漂流瓶U9
7130498148929913603,"三支利箭破水镜，
五条生命随车沉。
勇士往返终力竭，
国家岂会愧英灵！
这个视频画面感人[流泪]小车上的人应知道感恩！或许你们平常行善，所以苍天赐予三个保护神！[祈祷][祈祷][祈祷]
个人认为蒋正全追认烈士毫无异议！两个工友见义勇为亦无二话！
愿英雄一路走好！[祈祷][祈祷][祈祷]",0,4,0,2022-08-11 14:16:37,来自湖北,55961382124,民间调解
7130638080612746023,平凡的英雄更伟大。国家应当建立和完善见义勇为的奖励和保障机制，让平凡的英雄可以含笑九泉，让英雄家属可以坚强、勇敢的活下去。,0,5,0,2022-08-11 23:20:25,来自云南,3241826540333659,昆明饶律师
7130225851803321129,这么善良的人，真是可惜！国家和被救的人们还是多点感谢给他的家人们吧,0,8,0,2022-08-10 20:38:45,来自四川,2554914692923405,吴ANNIE
7130165382908379941,舍身救人，但对英雄的家庭来讲是悲剧，希望看到活着的英雄。,0,103,1,2022-08-10 16:44:46,来自上海,108131851545,用户原野之天边
7130244151471735564,希望被救的五个人良心上补偿一下救命恩人,0,24,1,2022-08-10 21:50:29,来自广东,100770872024,曾卡丽
7130653501570433806,被救的这家人应该拿出100万感谢恩人,0,4,0,2022-08-12 00:20:30,来自青海,53502391346,豆豆142307947
7130485703703823137,被救的人以及政府要对英雄的家属后期的生活给与长效帮扶，以慰逝者的在天之灵[祈祷][祈祷],0,3,0,2022-08-11 13:27:46,来自山东,575792386413043,多肉放飞自我
7130468117650359055,像这样的英雄，不但他本人要给予应有的褒奖，他的父母和孩子也应给相应的保障。,0,3,0,2022-08-11 12:19:01,来自河北,2120316121263116,高贵小红花B9
7130162219954438952,获救的，是不是应该替救人的英雄尽孝，哎，好人，一路走好[流泪],1,22,0,2022-08-10 16:32:09,来自吉林,87350219661,归一一来
7130476581671387904,"英雄一路走好[流泪]
你的精神永存[流泪]",0,4,0,2022-08-11 12:51:40,来自内蒙古,94650135330,刘秀芳8695
7130473772482200352,向我们重庆的英雄致敬！英雄一路走好！！,0,4,0,2022-08-11 12:41:49,来自重庆,69242316999,月云依兮
7130479934619288361,向舍己救人的英雄致敬！英雄一路走好[祈祷],0,3,0,2022-08-11 13:04:53,来自广东,4380090050812664,淼鑫
7130476889109775145,小时候书本上写的都是见义勇为，现在好像不提倡了，要确保自己生命安全为前提的情况下再去做，我曾经幻想过无数次自己见义勇为，救人，想做平民英雄，想给大家树立榜样，目前还没遇到这样的机会，我是九零后，我想说的是，我很佩服这样的人，也希望这样的人更多，骨子里感觉我们面对这样的事发生的时候就是要义无反顾，就是要尽自己所能，不会水你哪怕在附近大声呼救呢。小的时候几个伙伴一起下河游泳，一个不会水的伙伴误入深水区，在水面一飘一飘的，当时就什么都没想，只管游过去，他抓住我的那一瞬间死死勒住我的脖子，把我往水底摁，这样他才能呼吸，好在水不深，我憋着气，脚踩着河地慢慢把他推上了岸。一个不会游泳的人落水生命的求救欲望是非常非常强烈的，人们都说救命稻草，真的是一根稻草他都恨不得死死抓住，只要呼吸，只要活命。大家遇到这种事情，就算你会游泳也要真的保障好自己的生命安全。同时我也呼吁大家，现在生活条件都好了，孩子暑假时给孩子报个游泳班，千把块钱学一项技能，救自己命的技能。,0,4,0,2022-08-11 12:52:54,来自河南,4138980949117384,板栗山A哎艾诗哦认证
7130535729004544803,致敬！好人应该有好报，家属应该得到好报！,0,2,0,2022-08-11 16:41:28,来自广东,1604929478999219,超爱鱼子酱
7130203556367942411,应该评为烈士,0,11,0,2022-08-10 19:13:09,来自黑龙江,61137922253,忍者看人
7130484235403805480,孩子怎么办？英雄啊！赶快捐平见义勇一路走好[祈祷][祈祷][祈祷][祈祷][祈祷],0,2,0,2022-08-11 13:21:32,来自北京,3829251424,186涛声依旧
7130751589950440206,弘扬中华美德，见义勇为称号当之无愧，安息[祈祷][祈祷][祈祷],0,4,0,2022-08-12 06:40:40,来自福建,2203063071017603,飞翔雄鹰gzhx
7130475500392891144,被救者应该主动承担孩子的扶养和老人的赡养费用,0,3,0,2022-08-11 12:48:05,来自河南,110587303815,Love生活积极向上
7130479193271501572,政府应给家人保障,0,2,0,2022-08-11 13:02:27,来自湖南,3993879583401544,快乐开心幸福人
7130742295288890147,见义勇分为（一）见义勇为公民（二）见义勇为勇士（三）见义勇为英雄，是哪一个？,0,0,0,2022-08-12 06:04:21,来自辽宁,57991872543,垚仔6
7130598572675957504,向舍己救人的英雄致敬！英雄一路走好！,0,2,0,2022-08-11 20:44:59,来自山东,108199765582,轻松橘子4J1
7130475827355255585,向舍己救人的英雄致敬！向英雄家人致敬并多保重！,0,3,0,2022-08-11 12:49:25,来自上海,39227734107998,英子瑛瑛
7130479916767904527,社会国家应帮抚善后养老培育孩子成年！倡导救死扶伤义举家国共举,0,1,0,2022-08-11 13:04:37,来自安徽,52854235750,诚心232965270
7130232968962229000,向舍己救人的英雄致敬！英雄一路走好[祈祷],0,6,0,2022-08-10 21:06:40,来自辽宁,677776170427143,用户6378176270639爱
7130634542754415394,救人一命胜造七级浮屠。这才是真正的英雄。,0,1,0,2022-08-11 23:04:52,来自天津,2467734671859820,云莲591
7130467507311608613,不应该宣扬舍己救人，救人要量力而行，在保证自身安全的情况下救人。,0,2,0,2022-08-11 12:16:57,来自安徽,104909096694,进取奶酪Je
7130482181621023488,有情有义的陕西人民，懂得感恩，传承正能量！对见义勇为英雄的家人也是另一种安慰！,0,4,0,2022-08-11 13:13:38,来自四川,3909490624430620,率真叶子da
7130252033525154560,弘扬见义勇为精神，题目直接说英雄的名字就行了，为什么说男人？,0,4,0,2022-08-10 22:20:30,来自河北,72520469186,温暖的阳光开心的笑
7130170056654635817,为见义勇为勇救3多跳水者的平凡英雄蒋正全点赞！,0,13,0,2022-08-10 17:02:26,来自四川,65137979571,端庄葡萄CGY
7130572523506402063,政府应该帮助抚养孩子到成人,0,1,0,2022-08-11 19:04:05,来自四川,659334163082651,仁爱原野o8
7130777668722950927,希望被救的一车人，能感恩英雄的一家人给予孩子失去父亲一定的补偿。[流泪],0,0,0,2022-08-12 08:20:30,来自吉林,103419596374,鹿桠
7130232539348435745,向舍己救人的英雄致敬！英雄一路走好。愿英雄家人身体健康，万事顺意。[祈祷][祈祷][祈祷],0,4,0,2022-08-10 21:05:25,来自广西,50430624838,手机用户浅夏淡忆
7130157757038068484,英雄一路走好,0,19,0,2022-08-10 16:15:12,来自福建,17550789783,zlxxqh123456qq
7130598250231005985,向英雄致敬，一路走好！,0,1,0,2022-08-11 20:44:30,来自江苏,6973092215,释放iy
7130177403775222531,世间多少英雄事，却付悲伤离别中。[流泪],1,8,0,2022-08-10 17:31:47,来自山东,6490329062,君子论迹卜论心
7130635110151406371,英雄一路走好！,0,0,0,2022-08-11 23:07:02,来自四川,93874372817,2370782
7130180839275184937,向英雄致敬！,0,5,0,2022-08-10 17:44:28,来自福建,3236591791520110,睿智时髦小红花i5
7130768195472048932,必须给烈士待遇,0,0,0,2022-08-12 07:44:10,来自天津,52991756961,树也是生命
7130285270393701158,这个大哥是坠落凡间的天使，如今功德圆满返回天上了！,0,5,0,2022-08-11 00:33:01,来自湖北,2493346138042989,余生只爱自己3
7130217185729364777,他的父母儿子应该得到妥善安置。,0,6,0,2022-08-10 20:05:09,来自甘肃,64828866775,用户沙漠玫瑰666
7130485204979942158,这样的英雄不多了，孩子那么小被救者应该发起捐款养孩子和老人，英雄一路走好[祈祷][祈祷][祈祷][祈祷][祈祷],0,0,0,2022-08-11 13:25:40,来自广东,4319358594849543,SuSu
7130199043665773346,英雄一路走好，真的好痛心。救人要紧，但是得先保证自己的安全啊！,0,6,0,2022-08-10 18:54:54,来自江苏,93512935673,清潭碧水772
7130475394604057358,被救的五家人该对英雄长期援助一下为好,0,1,0,2022-08-11 12:47:35,来自黑龙江,92326603011,明媚阳光DD
7130600664119608104,被救的家庭5人应赡养恩人的老人，并抚养孩子成人。,0,0,0,2022-08-11 20:53:07,来自甘肃,6516737602,春天的花盛开
7130449308331721507,致敬[祈祷][祈祷][祈祷],0,2,0,2022-08-11 11:06:07,来自北京,1869602461869784,水中树
7130628485206573835,见义勇为有奖金么？,0,0,0,2022-08-11 22:42:19,来自上海,107301208601,故事都是这样写的
7130457932960989960,要对英雄家庭给于很好的安排！[祈祷],0,2,0,2022-08-11 11:39:43,来自浙江,16491288853,鸽子136315567
7130511112553956129,那这被救的4家人应该主动给救人者的孩子及父母提供生活帮助。,0,0,0,2022-08-11 15:06:37,来自安徽,536213994869080,乐击空谷
7130528886898656014,好人为何如此悲催？[祈祷][祈祷][祈祷],0,1,0,2022-08-11 16:15:04,来自宁夏,2735209266027469,晚樱绚烂地开
7130760732953707294,舍己救人，伟大的英雄[赞][赞],0,0,0,2022-08-12 07:15:19,来自四川,712132312697095,迷糊麻麻爱育儿
7130591720102069024,敬佩，在哪里可以捐款，,0,0,0,2022-08-11 20:19:03,来自山东,78773613767,流云a1234
7130489091761718031,见义勇为的英雄倒下了，谁来救救英雄留下的的孩子？,0,1,0,2022-08-11 13:40:15,来自广东,5795965400,假香会
7130599610338591522,牺牲自己，托起5个人的生命。向舍己救人的英雄致敬！英雄蒋正全一路走好！,0,0,0,2022-08-11 20:49:04,来自天津,101854000217,yl9446
7130506712553554700,向英雄致敬，一路走好[祈祷][祈祷][祈祷],0,0,0,2022-08-11 14:49:55,来自湖北,4146964131224392,温柔五常9X9
7130485148642444032,救起来的人呢？怎么只字未提？,0,0,0,2022-08-11 13:25:07,来自湖北,3399315348012711,淡泊星星雨
7130230918102713100,以前这样的英雄事迹都要上学校的宣传栏，希望国家多宣传这样的正能量。,0,3,0,2022-08-10 20:58:50,来自山东,5966240073,田华林
7130490039268000543,我特别不喜欢看到英雄这两个字，看到了就代表总有人牺牲了。,0,0,0,2022-08-11 13:44:29,来自重庆,6969172673,愿岁月温柔以待66
7130480815150482207,向舍身救人的英雄致敬[祈祷][祈祷][祈祷],0,0,0,2022-08-11 13:08:40,来自湖南,3026301247826120,湘西姥姥
7130791613865444137,见义勇为英雄,0,1,0,2022-08-12 09:14:27,来自北京,62703445295,搜别墅
7130632377587532582,这五个人应该知道怎么去报答救命之恩！不能上岸了，命留住了，把恩忘记了！天在看！,0,0,0,2022-08-11 22:57:23,来自安徽,62492427676,自由秋之水
7130469259687346952,该男子的见义勇为精神，是我们的楷模！看到这祖孙三代的时候，心情非常难过。想政府一定会给予照的。,0,1,0,2022-08-11 12:23:41,来自江苏,3355303747781395,魔法师布伦南6K8
7130197889389134607,英雄一路走好，[祈祷][祈祷][祈祷],0,2,0,2022-08-10 18:50:26,来自河北,1556499374544352,爱生活的溪水ee
7130232526081508135,英雄一路走好[祈祷][祈祷][祈祷],0,1,0,2022-08-10 21:05:20,来自江西,111412807469,愉悦的帆船x6
7130220028624028456,被救的5个家庭应赡养恩人的老人，并抚养孩子成人。,0,4,0,2022-08-10 20:16:07,来自云南,637341917776475,无忧的风声oH
7130206095763030818,向见义勇为的英雄点赞，一路走好！,0,13,1,2022-08-10 19:22:15,来自山西,3492487006270899,热闹菠萝1e
7130477115501282052,被救的家属应该尽自己最大的努力去帮助见义勇为者的家人！,0,0,0,2022-08-11 12:54:23,来自浙江,6378070865,竹子86811351
7130195031885185807,英雄一路走好。,0,1,0,2022-08-10 18:39:14,来自江西,55539747792,豆豆74932
7130495873750237982,生命只有一次，应该报答,0,0,0,2022-08-11 14:07:17,来自山西,3664022358720903,小鱼喃喃
7130485505996751646,孩子国家要抚养吧？,0,0,0,2022-08-11 13:26:40,来自黑龙江,110098891092,冬雨shir
7130221101212861197,英雄一路走好[祈祷][祈祷][祈祷][祈祷],0,1,0,2022-08-10 20:20:32,来自北京,3711555921251694,爱音乐贾斯蒂斯4X
7130200075430773541,向英雄致敬！一路走好！被救的五人是不是应该负担起照顾救你们的英雄留下的孩子和老人,0,13,2,2022-08-10 18:59:13,来自北京,5767072832,思禹如烟
7130488867840361216,自己孩子咋办啊,0,0,0,2022-08-11 13:39:27,来自北京,5805753239,小肥羊的幸福生活
7130235855172272911,英雄一路走好！,0,1,0,2022-08-10 21:17:40,来自河北,85753360153,1965197119932491699
7130218749168304935,太难得了，用自己的生命挽救了5个人。向英雄致敬！[赞][赞][赞][祈祷][祈祷][祈祷],0,2,0,2022-08-10 20:11:37,来自北京,2106253927266356,旅行家阿图什9J青青
7130439817556869901,向见义勇为的英雄致敬！一路走好！,0,1,0,2022-08-11 10:29:37,来自湖南,3809141337627950,一丝不苟奶酪8o
7130144523354784543,换做是我最多打个电话就行了，把自己命都搭上，留下年迈的父母，和孤儿和妻子，不知道怎么想的,6,22,1,2022-08-10 15:23:45,来自河北,1244243070038135,精神病妇科专家
7130491823034450728,能为他批准烈士吗,0,0,0,2022-08-11 13:51:08,来自江苏,101109554257,万念一锋
7130315061754905385,英雄一路走好[祈祷]向救人的好人们致敬[祈祷],0,1,0,2022-08-11 02:30:37,来自河南,50355332140,辰辰127544563
7130448630800057119,这才叫正能量！！！！平时拿正能量说事的网民们看看吧！用生命告诉我们什么才是正能量！这就是我们的英雄！[赞][赞][赞][赞][流泪][流泪][流泪][流泪]希望当地部门号召一下，为英雄做点什么！！！致敬！！！,0,2,0,2022-08-11 11:03:45,来自四川,233527086955012,惧无者行
7130540200807777039,肯定是抽筋了，不然哪怕有一口气都能游回来[祈祷][祈祷][祈祷],0,0,0,2022-08-11 16:58:52,来自江苏,2546063826766180,倪睨16I3F
7130628278037234446,好人[祈祷][祈祷][祈祷],0,1,0,2022-08-11 22:40:56,来自浙江,5403698318,祯好人生
7130491451523433255,致敬英雄 一路走好,0,0,0,2022-08-11 13:50:14,来自四川,4270133032261228,单眼皮小左
7130226672951558912,英雄一路走好！,0,1,0,2022-08-10 20:41:55,来自山东,3214596049471779,可爱的微风飘飘
7130602320047768356,向英雄致敬，一路走好,0,0,0,2022-08-11 21:00:00,来自陕西,51737213770,天和杰创
7130471127075390208,这五人遇到三位英雄太幸运了！要不然后果很严重,0,1,0,2022-08-11 12:30:29,来自陕西,58834959322,优质猕猴桃基地
7130470474417079055,英雄一路走好[祈祷][祈祷][祈祷],0,1,0,2022-08-11 12:28:10,来自浙江,61937540972,村夫6358
7130230515315606306,好心痛，一路走好英雄自己不保护好自己[祈祷][祈祷][祈祷][祈祷],0,1,0,2022-08-10 20:56:47,来自湖北,111582244749,率真火车Z
7130429652392575744,可怜的人，让他家里该怎么办 啊,0,0,0,2022-08-11 09:49:49,来自湖南,57225153840,未来的每一天
7130785508800185122,好心人在献爱心，获救之人在干嘛？,0,0,0,2022-08-12 08:50:50,来自陕西,53394466615,蓝海贝
7130405835670749967,好呀好呀好呀！,0,0,0,2022-08-11 08:17:23,来自浙江,61665022098,笑洒507
7130261472827179809,天哪，为什么没人回去救他,0,0,0,2022-08-10 22:58:00,来自浙江,59988960249,CGe程果而
7130163488899023651,英雄一路走好[流泪][流泪],0,6,0,2022-08-10 16:37:00,来自陕西,109685099065,烈岩沙尘
7130243616794493696,为英雄点赞,0,1,0,2022-08-10 21:47:42,来自北京,5564410600,超哥侃剧
7130168853879554850,[蜡烛][蜡烛]英雄走好,0,4,0,2022-08-10 16:57:57,来自辽宁,5227813708,温水煮青蛙2015
7130507418890732291,把人家一家子救活了，可是你的一家老小怎么活呢……太可怜了,0,1,0,2022-08-11 14:52:27,来自广西,52661168978,石磊的麻麻
7130465701109842700,，像英雄致敬，逝者安息，愿被救的人力所能及救助下英雄家人,0,0,0,2022-08-11 12:10:21,来自山东,2106302435701054,艺静書
7130484695049257728,英雄不问出处，值得追认见义勇为英雄。,0,8,0,2022-08-11 13:23:19,来自河北,54306629762,姜舒文集
7130471412975928077,怎么募捐？哪里捐款？,0,1,0,2022-08-11 12:31:55,来自江苏,58840836876,拉风的寂寞cium
7130477384914043682,被救人第二次生命是，救人着给的，希望自发站出来，为牺牲者尽自己的良心和做人道德去帮助牺牲者家庭。平凡的伟大之人，愿逝者安息，家属节哀！英雄一路走好！[祈祷][祈祷][祈祷][祈祷][祈祷][祈祷][祈祷],0,0,0,2022-08-11 12:54:48,来自河北,50562387982,改变人生132113412
7130249849748210469,为什么不报警啊？,0,0,0,2022-08-10 22:12:16,来自北京,6057781250,枫叶红了77632326
7130653554796282658,这说明，英雄静默于教科书，但他还活在人民群众的心里。为英雄赞。,0,1,0,2022-08-12 00:19:44,来自陕西,85088075546,A森林老大
7130186992591586083,为救人者点赞！,0,2,1,2022-08-10 18:08:14,来自北京,109827282838,misimi5028
7130168727370957575,被救的5人要承担起施救者家属的生活保障！,0,9,0,2022-08-10 16:57:43,来自江苏,5466731380,得道多助失道寡助WUFs
7130239344027108133,肯定农村的,0,0,0,2022-08-10 21:31:06,来自云南,3381738539325371,大家都大大
7130612191963333409,家属应该享有公务员待遇，国家来养这待遇不算高吧,0,2,0,2022-08-11 21:38:50,来自山东,1134311052158927,愉悦的火车vi
