7130602422900327209,向舍救人的英雄蒋正全致敬，你放心，一路走好。,0,0,0,2022-08-11 20:59:54,来自广东,157948993345663,用户2536452510945
7130477435690730251,被救的人应该主动，承担英雄家人的赡养义务。,0,0,0,2022-08-11 12:55:57,来自北京,50860306655,手机用户50860306655
7130631607198860043,向舍己救人的英雄致敬！英雄一路走好[祈祷],0,0,0,2022-08-11 22:54:15,来自四川,1692893463448583,用户6863960389702
7130612687381562145,舍身救人，但对英雄的家庭来讲是悲剧，希望看到活着的英雄。,0,1,0,2022-08-11 21:40:31,来自重庆,106181402478,用户7700411398687
7130609869811909388,向舍己救人，见义勇为的英雄致敬！,0,0,0,2022-08-11 21:32:24,,2858336940196011,用户5664116281430
7130508864176554786,好人有好报，向这位英雄致敬[祈祷][祈祷],0,0,0,2022-08-11 14:57:09,来自河南,3456461968781064,用户2949514401573
7130586679819879181,英雄一路走好,0,0,0,2022-08-11 19:59:30,来自甘肃,98613120189,用户8187429735411
7130766487023108894,人民英雄[赞],0,1,0,2022-08-12 07:37:40,来自上海,2119464509259463,用户2251830778353
7130343008037831454,我们重庆好人多英雄一路走好,0,0,0,2022-08-11 04:22:58,来自重庆,1692874802205740,用户419061581702
7130224511555339049,真是太可惜了,0,0,0,2022-08-10 20:33:31,来自浙江,1837981637290397,用户2631418061583
7130431649082737446,一路走好[祈祷][祈祷][祈祷],0,1,0,2022-08-11 09:58:36,来自浙江,50002802286,手机用户50002802286
7130457022784832264,可以评为烈士！,0,0,0,2022-08-11 11:36:19,来自四川,3482843132207455,用户6097717921798
7130437194636313377,感觉不应该提倡这种牺牲自己的见义勇为行为。,0,0,0,2022-08-11 10:19:50,来自陕西,65081670331,用户2965508784946
7130458597074682656,我老婆的同学的老公也是救人，才35岁，家里娃娃也才初二，也就评了个见义勇为。,0,0,0,2022-08-11 11:42:43,来自四川,21278780570,手机用户21278780570
7130385456008971008,不能让英雄留有遗憾，英雄家属应有抚恤。,0,0,0,2022-08-11 06:58:44,来自陕西,105370349750,用户410102870544
7130417100711281449,农民兄弟救人牺牲也应评烈士！,0,0,0,2022-08-11 09:01:05,来自湖南,1267056905028248,用户5241760048834
7130437017414353668,被救的人 还活着没？ 没见发声,0,0,0,2022-08-11 10:19:13,来自云南,5750885737,手机用户81004148933
7130456063044354850,被救之人要将爱心传递下去,0,0,0,2022-08-11 11:32:23,来自山西,1390238650608432,用户200090771561
7130429147217756962,你走了，最痛苦的是你父母，救人要量力而行,0,0,0,2022-08-11 09:47:45,来自山东,4384472237354487,用户4734585280326
