7133011850668786435,期待着疫情尽快结束了吧！,0,13,0,2022-08-18 08:50:43,来自山东,54610946519,千里迢迢风雪无阻
7133035966893753122,三亚政府有权利依法强烈抗议病毒！,0,4,0,2022-08-18 10:23:39,来自上海,50222539399,宅着的大爷
7133023396745085735,何时各地疫情能彻底结束？？,7,49,1,2022-08-18 09:35:47,来自陕西,5520107979,笑以苛
7133083581295559465,真不理解大夏天的去三亚,8,20,0,2022-08-18 13:28:24,来自山东,3012300709047796,认真的青山wl
7132997311345148711,增强防范意识，佩戴口罩，勤洗手[赞][赞][赞],1,39,0,2022-08-18 07:55:02,来自江西,70916746740,俊俏雪梨4y
7132995174107579140,三亚无症状感染者6099例加上确诊病例4393 例 一个月病例快过万了 是奥秘可溶的传播速度又增强了吗,18,42,1,2022-08-18 07:46:13,来自陕西,80412801075,不喜榴莲香g
7133072757948416768,海南这样的管理，明年还有人去吗？,8,14,1,2022-08-18 12:46:10,来自广东,59790847246,积极的乖巧梦想AP
7133063448833082112,三亚完全放开的时候，就意味着隔离进入了倒计时,1,17,0,2022-08-18 12:10:03,来自云南,52352879541,新农人洋葱头
7133029181977477895,去旅游的时候应该要有这种心理准备，因为疫情已经三年了！,3,81,3,2022-08-18 09:57:31,来自浙江,940781849289771,爱生活的溪流r
7133000751265284899,三亚加油，疫情防控人人有责，保持安全社交距离、不扎堆、不聚集。,0,28,0,2022-08-18 08:06:54,来自浙江,2700848674124347,开朗清风X0
7133045088141427471,已经三年没出去旅游了，只敢去周边一个小时内到达的地方溜达溜达……,2,51,1,2022-08-18 10:58:44,来自吉林,84680475902,人生是一场修行000
7133037974216360711,不值得同情上海9月1号开学8月18号以前不能出去旅游，家长咋想，万一出门碰到疫情回不来咋办？,2,43,6,2022-08-18 10:31:53,来自上海,51723412023,博学的书签yz
7132994783123358479,三亚17日新增417+814例,0,43,0,2022-08-18 07:43:51,来自北京,62703445295,搜别墅
7132998606889845543,增强防范意识，佩戴口罩，勤洗手，疫情防控人人有责！,0,27,1,2022-08-18 07:59:40,来自陕西,2181072159781676,302梅
7133029649005363976,既来之则安之，好好享受一下海南的气候。,2,28,0,2022-08-18 09:59:39,来自新疆,98888487628,我是美丽家园
7133013732879385359,三亚疫情防控不能松动，人人有责。,1,1,0,2022-08-18 08:57:11,来自河南,1292644546264336,快乐漂流瓶32
7133007265237680930,疫情防控人人有责！出门一定要佩戴口罩，增强自我防护意识！,0,7,0,2022-08-18 08:32:09,来自安徽,3958661420188487,幸福一家人HS
7133000397249626912,这个病毒传播速度太强了，一定要加强防范控制。,1,14,0,2022-08-18 08:11:41,,50045493569,住在鸭绿江
7133068597382939427,都静止了这么久了，还在迅速增加，请问这是在什么人群中的增加？是核酸检测过程中传染的？还是隐藏中新发的？还是核酸检测不准确的原因？为什么有的一检测就确诊了，有的确多次才检测出来？单单是个体差异？那为啥没有统计一下这些个体有没有共同点？,1,13,0,2022-08-18 12:29:56,来自山西,4266543665,似水流年36875977
7133067912374141730,都是有钱人，基层百姓是没有这份闲情的，喜欢到处旅游就要做好疫情带来的不便。所以普通百姓也有优势的时候……,1,20,1,2022-08-18 12:27:28,来自广东,76926212582,2021健康之路
7133003558550504207,一波未平，一波又起，疫情防控，人人有责,0,10,0,2022-08-18 08:17:37,来自北京,624954580151071,思索索
7133106427698316063,给你们说不是海南问题，西安，上海，海南，遇到人性问题就说城市问题，能不能说一下防疫政策问题,0,8,0,2022-08-18 14:57:20,来自四川,96259124275,一直走
7133023214448067367,疫情期间尽量不旅游,1,14,1,2022-08-18 09:35:10,来自陕西,5520107979,笑以苛
7133006152484307723,怎么啊么多无症状感染者啊，看到每天的数字害怕,0,5,0,2022-08-18 08:28:30,来自江苏,111533380261,率真心向阳
7133045390169408296,没有幸灾乐祸，学校一再强调没必要尽量不要出省，虽然花的是自己的钱，但是给国家添太多麻烦了,5,24,4,2022-08-18 11:00:05,来自陕西,1235482991398028,大气帆船n4
7133043953489920808,落地不需要核酸嘛？为什么会这么大范围蔓延？？？,1,2,0,2022-08-18 10:54:27,来自山东,6708151516,隔壁老王107391326
7133035594699391785,海南每年暑假将要结束时都会有新闻,1,6,0,2022-08-18 10:22:08,来自浙江,63200813753,欢快书签Wd
7133044446362501888,海南15日游，时间有点长了,1,5,0,2022-08-18 10:56:23,来自吉林,89873028156,宁古塔
7133019848774877967,增强防范意识，佩戴口罩，勤洗手[赞][赞][赞],0,0,0,2022-08-18 09:21:06,来自河北,24382811198,静心的品茶
7133036820686078760,不懂就问，反正都是隔离，为什么还要天天做核酸！不能等7天后在做吗！,5,6,0,2022-08-18 10:26:54,来自湖北,3328931413,短平快生活
7133057238243590924,现在不敢旅游，怕突然来的疫情，我同事去三亚刚回来，就爆发疫情了，好险,0,10,0,2022-08-18 11:46:55,来自辽宁,83184864325,青丝冉冉81
7133003301226283791,一波未平，一波又起，疫情防控，人人有责,0,2,0,2022-08-18 08:16:55,来自湖南,96378844621523,知情达理青山R
7133053012578648844,"昨晚看央视新闻了，社会面基本控制了，新增的在管控区。虽然看似增加，相信不会太久就会大幅度减少。
为三亚加油！加油！",0,0,0,2022-08-18 11:30:26,来自辽宁,215947944403019,幽默沙滩Td
7133123874342060833,今年最惨的就是上海的，在上海被困几个月，终于解封了想去三亚释放一下，结果继续封[笑哭],0,1,0,2022-08-18 16:05:20,来自安徽,91872861806,海南岛上雪花飞舞
7133015429790417704,疫情防控人人有责，配戴口罩必须的，配合防疫工作人员，坚定信心，海南定能战胜疫情！,0,1,0,2022-08-18 09:03:59,来自海南,1548565093042973,在水边6299现住址海南
7133017686824829731,三亚疫情压力大增，三亚人民受苦了，三亚的防疫工作人员辛苦了！继续努力，否极泰来，胜利属于三亚人民，加油！,0,0,0,2022-08-18 09:12:39,来自河北,2181082174719216,又是新雨后
7133013894444024583,相信政府，相信国家，不信谣，不传谣，做防疫第一责任人。,0,2,0,2022-08-18 08:58:23,来自河南,655745589185950,完美帆船8a
7133039423797003019,疫情快点结束吧，,0,0,0,2022-08-18 10:37:54,来自河北,4358079162876343,丰富布伦南4V1
7133001018706756365,疫情就是命令，防控就是责任。,0,10,2,2022-08-18 08:08:33,来自浙江,440285617205627,香雨浓情
7133003405450642191,增强防范意识，佩戴口罩，勤洗手，疫情防控人人有责！,0,1,0,2022-08-18 08:17:23,来自新疆,237132682108062,用户雅兰
7133063981572457255,困在海南的都是有钱人，不是幸灾乐祸是事实，我也想被困在海南，贫穷限制了我的脚步,0,12,1,2022-08-18 12:12:51,来自山西,50447665021,徐家探花郎
7133065956603560704,海南加油！,0,4,0,2022-08-18 12:19:52,来自宁夏,5879763307,777我只是看看
7133002524433056553,三亚疫情不容乐观，来不得半点马虎，愿在三亚所有人增强防范意识，增取疫情早日结束。,0,4,0,2022-08-18 08:13:59,来自北京,510615750189342,沈合群
7133004724647068428,外防输入内防反弹科学防控,0,3,0,2022-08-18 08:23:09,来自湖北,2431757273805932,可爸daa
7133004094360584963,严防境外输入，内防反弹，疫情防控人人有责。,0,3,0,2022-08-18 08:20:47,来自山西,83613755919,赵增水
7133029285325488903,除了通报，就没看到三亚有什么消息。[狗头],0,1,0,2022-08-18 09:58:22,来自安徽,180743622369575,热心张小凡
7132996181022032644,一波未平，一波又起，疫情防控，人人有责,0,12,0,2022-08-18 07:50:25,来自北京,103279424038,姜子牙来打野
7133007027328221964,无症状感染者越来越多，我们需要做好个人防护工作，贯彻执行防御各项政策,0,1,0,2022-08-18 08:31:54,来自江苏,92289548071,我是我1106
7133039745969472269,就担心这样的情况发生，今年全家的旅游活动取消了，孩子学校也要求不让到处乱跑，疫情期间还是合理安排比较好,0,12,0,2022-08-18 10:38:28,来自辽宁,65419241941,皮皮虾和小丸子
7132995109062214400,有死亡的吗？,1,8,0,2022-08-18 07:44:58,来自江苏,91823866565,洒脱风铃r
7133027460396466957,不值得同情，孩子要上学的，学校通知一再别出省，既然喜欢折腾就该承受,8,109,13,2022-08-18 09:51:11,来自广东,104726283241,我非柠檬为何心酸uu
7132993862477431566,啥时候是个头,1,21,0,2022-08-18 07:40:47,来自河北,53622463032,好久不见156587308
7132997270060237600,一波未平，一波又起，疫情防控，人人有责,0,2,0,2022-08-18 07:54:32,来自四川,101667119569,自在如意妙宝
7133005537708573471,前几天电视新闻不是说，保证12日社会面清零，怎么越来越多了呢？,0,3,0,2022-08-18 08:26:01,来自江西,8409865281,上进的柳叶6s
7133029494952461086,三亚疫情防控效果明显继续努力,0,0,0,2022-08-18 10:01:09,,2278648332950071,天老爷爷
7133007133888676642,一定要加强防控措施啊！三亚加油啊！,0,3,0,2022-08-18 08:31:33,来自云南,104888513197,远望702
7133033130030056224,相信政府，相信国家，不信谣，不传谣，做防疫第一责任人。,0,0,0,2022-08-18 10:13:21,来自安徽,111037770846,顶级湖泊Y1
7133080681227731743,因为疫情三年没回老家看望老母亲了[流泪],0,2,0,2022-08-18 13:17:29,来自福建,6678060052,梅子104468141
7133007489721369374,打好防疫攻坚战，三亚加油！！！！！,0,3,0,2022-08-18 08:33:47,来自广东,3853153096437923,童贽
7133021695094588160,外防输入内防反弹科学防控，动态清零是关键。,0,0,0,2022-08-18 09:28:24,来自广东,2766793343516077,风和声
7132999403471831816,疫情赶紧过去吧,0,6,0,2022-08-18 08:02:12,来自河南,3953467733849934,淼淼呆呆猫猫
7133001786889405214,增强防范意识，佩戴口罩，勤洗手[赞][赞][赞],0,2,0,2022-08-18 08:11:29,来自广东,65021167366,天边一只蟹2
7133003761765237507,三亚要加油，尽快结束疫情🙏🙏🙏🙏,0,3,0,2022-08-18 08:19:38,来自黑龙江,61279367035,薰衣草29000
7133008055193191202,增强防范意识，佩戴口罩勤洗手不聚集，按照政府及医务人员的要求。做好核酸检测。,0,1,0,2022-08-18 08:35:21,来自广东,59761002725,尹伊37
7133001071668298496,增强防范意识，佩戴口罩，勤洗手，疫情防控人人有责！[赞][赞],0,2,0,2022-08-18 08:08:12,来自广东,3697736850,LSh李
7133032661547123497,要了我命的不是病毒，而是抗疫,2,35,1,2022-08-18 10:10:46,来自河南,3399343986711927,老头哈哈哈
7133038806215344931,疫情防控，人人有责！不聚集丶不扎堆丶保持安全社交距离。,0,0,0,2022-08-18 10:34:36,来自山东,2084292371167486,俊俏葡萄1997
7132999012584014605,希望三亚疫情能早点结束！,0,3,0,2022-08-18 08:00:49,来自广东,77087926593,上善如水XC
7133002692498162445,三亚加油争取早日控制疫情消灭疫情。,0,3,0,2022-08-18 08:14:52,来自浙江,2546081976825444,阳明渐近
7133000596319666952,无症状感染者越来越多，我们需要做好个人防护工作，贯彻执行防御各项政策,0,2,0,2022-08-18 08:07:10,来自山西,111018192831,完美松鼠OC
7133111296761381635,这几年出去旅游就是给自己买“头痛”，我是不会出去旅游的！！,0,1,0,2022-08-18 15:16:50,来自广东,65268686134,缤纷葡萄Fu
7133016817190847240,怎么啊么多无症状感染者啊，看到每天的数字害怕,0,0,0,2022-08-18 09:09:54,来自上海,97826064223,天师音乐馆
7133119724132647712,抛弃海南，这辈子不想去了,0,1,0,2022-08-18 15:49:18,来自上海,58440825385,上海公平里
7133097460453049129,这是不是机场酒店变相联合，要你住高价酒店才能有机会买高价机票,0,2,0,2022-08-18 14:22:19,来自广东,5730906780,种花家平民兔
7133024680352678664,增强防范意识，佩戴口罩，勤洗手，疫情防控人人有责！增强自我保护意识！,0,0,0,2022-08-18 09:40:11,来自浙江,4494437192305982,用户梁山好
7133040936841380643,三亚加油，希望疫情快点结束吧,0,0,0,2022-08-18 10:42:41,来自广西,2555741976402094,可靠梦想家亮哥
7133005872049554216,新冠病毒传播速度太强了，一定要加强防范控制。[加油][加油][加油][加油][加油],0,5,1,2022-08-18 08:26:56,来自山东,1653287807889792,成熟糯米XN
7133001070494057251,疫情不能大意，少扎堆，能变感染就不感染,0,2,0,2022-08-18 08:08:11,来自贵州,1838859838030935,愉悦的艺术家53
7133049540139139875,目前海南疫情最重要就是尽快社会面清零和防止病毒外溢。,0,5,0,2022-08-18 11:16:06,来自江西,993585573666455,与邪斗争高震邦
7133003111106691877,希望大家平安，疫情早日清除。,0,2,0,2022-08-18 08:16:40,来自云南,15249677197,風過無痕心若静风奈何
7133049020410692390,这下知道了，最近出去旅游，一定要自己开车，而且不能去海南，舟山这种只有一两条路进出的旅游城市,0,4,1,2022-08-18 11:14:52,来自安徽,52043054211,wliteng
7132997702962807556,三亚这次的疫情真的好厉害，大家一定要遵守防疫工作,0,2,0,2022-08-18 07:56:09,来自湖北,2396589758090403,可可爱爱的布布甜
7132996165888492322,还要控制，病毒太肆虐，愿早日清零，祝三亚人民安康[加油],0,13,1,2022-08-18 07:49:06,来自海南,386680315977128,用户四六
7133089007415870249,疫情期间不要外出旅游，就是不听政府的话才造成有家回不去。,0,3,1,2022-08-18 13:49:22,来自北京,58231393861,15210657358
7133110712532189952,家里呆不住，兜里钱花不完，出去走走也无妨，只是在疫情不明郎的情况下切勿乱跑，不要给国家添堵自己还烦恼。,0,1,0,2022-08-18 15:13:37,来自江苏,68527487211,热心枫叶tA
7132998334277075725,希望疫情早点结束,0,3,0,2022-08-18 07:58:23,来自广西,2480147482550008,低调11人生
7133043978160571170,所以，大家怕的真的是病毒吗？,1,4,0,2022-08-18 10:54:24,来自江苏,78930145558,我天赋异禀
7133017685105361700,严格落实防控措施！,0,1,0,2022-08-18 09:13:12,来自上海,55484461082,秋适415
7133088808761230116,无穷无尽的循环，想到了一部电影，恐怖游轮,0,2,0,2022-08-18 13:49:02,来自湖北,690115176829960,可靠百香果O
7133126306468201230,海南这一波操作漂亮！,0,0,0,2022-08-18 16:14:36,来自湖北,2778576523,随我四方27376096
7133019867791655713,希望大家平安，疫情早日清除。,0,0,0,2022-08-18 09:22:05,来自浙江,4424031434449231,休哥爱生活
7133044307900105476,有过上海的经验，还不在第一时间逃离海南。[捂脸],0,6,0,2022-08-18 10:56:27,来自北京,5918913163,彩烟飞舞
7132995490765390633,还要控制，病毒太肆虐，愿早日清零，祝三亚人民安康[加油],0,4,0,2022-08-18 07:46:39,来自河南,3720354194524112,吉祥阿吉
7133015713040073487,保持做好个人防护，三亚加油,0,1,0,2022-08-18 09:05:05,来自广西,91687029676,彬彬9563
7133003343345713959,这些病例里面症状如何？严重么？不严重的话是不是考虑一下降低管控的力度？,0,3,0,2022-08-18 08:18:21,来自广东,2880335838711003,Sokey470
7133075166556521223,三亚无症状感染者6099例加上确诊病例4393 例 一个月病例快过万了 是奥秘可溶的传播速度又增强了吗,0,0,0,2022-08-18 12:55:55,来自广东,63560901823,灿烂高山rI
7133033492530594575,希望疫情早日结束。,0,0,0,2022-08-18 10:13:53,来自江苏,110926259061,友爱铅笔8l
7133118354530370341,防控工作不到位所就成的，早排上海解封的到来所以有今日的结果，希望早日得到控制。,0,0,0,2022-08-18 15:43:31,来自广东,3229082106,小鸟千千
7133000312885265186,希望全国各地疫情早点清零。,0,3,0,2022-08-18 08:05:16,来自天津,2208263400864032,淡定面条io
7133040666266911522,希望疫情得到彻底控制吧，三亚加油,0,0,0,2022-08-18 10:41:42,来自广西,3026310850944126,远方的路远方的水
7133010936763892515,戴口罩，勤通风,0,1,0,2022-08-18 08:46:35,来自北京,10972136464,嚮陽而生
7133106066560303885,现下疫情期间外出旅游，备好充足的银子，做好被封控长期旅游目的地度假的心理准备，放心去旅游吧，莫辜负了岁月。,0,0,0,2022-08-18 14:55:51,来自陕西,75481515064,清莲凤栖天
7133128070139101990,海南人真的害怕吗？,0,0,0,2022-08-18 16:21:34,来自北京,5856742273,秦翦之后
7133012765723673376,疫情防控、人人有責[赞][赞][赞][赞][赞][赞][加油][加油][加油][加油][加油][加油][加油],0,1,0,2022-08-18 08:54:30,来自安徽,2400977872764376,坦荡的生活家Ew陆曙光
7133067726763361035,国家层面不停释放着疫情稳定的讯息，各省市不得层层加码，督促恢复文旅产业，期间还不停的发布季度旅游出行数据报道各地防控情况下，旅游恢复的比例，像是报喜一样，没有游客，旅游城市的就业人员日子不好过，都别说游客了，是谁想让人出去玩去消费动动脑子就知道了，地方，国家都想让大家出去玩，当然是又要玩又要控，不想让大家出去玩的是怕带回去丢了乌纱帽这是主因，当然可以说为大家负责，这个好听点,0,5,0,2022-08-18 12:27:24,来自江苏,92176133949,六瓶米户主
7133056977307468547,我儿子班上很多孩子都出去旅游了，我们都只敢在周围溜达溜达，压根不出省,0,3,0,2022-08-18 11:45:57,来自安徽,51982070750,长风万里47
7133034913229996835,心态不好的人碰到一点麻烦就觉得日子过不下去了下去了，想想那些在疫情中失去家人的同胞吧,0,6,0,2022-08-18 10:19:30,来自浙江,3236591756651096,ai
7132994768011084579,希望疫情早日过去,0,11,0,2022-08-18 07:43:54,来自广西,110907022655,o夜未眠4370
7132996281504498466,封在家半个月了，还那么多，肯定那个环节出问题，应该查查,0,6,0,2022-08-18 07:49:31,来自海南,2480112161265534,正能量爱你一生
7132999299776496397,这年头还是少去人多的地方！,0,2,0,2022-08-18 08:02:07,来自广东,4059013899102955,琪怡妹
7133006093088981791,不扎堆，不聚集,0,1,0,2022-08-18 08:28:24,来自广东,4384484111418051,LAity
7133002416664265507,做好个人防范，不给国家添麻烦,0,2,0,2022-08-18 08:13:22,来自湖南,352321464971880,魔法师沙河4x2
7133065511650231080,海南这次损失残重，,0,2,0,2022-08-18 12:17:56,来自江苏,4498819948222391,XL梦唐朝
7133104794151535375,疫情产业链，放心开学前疫情肯定会好 很多人赚大了,0,0,0,2022-08-18 14:50:44,来自陕西,5487126364,龙哥休闲骑行喝茶
7133055173445976864,病毒在变，我们的防控举措是不是也要相对应的改变思路？,0,5,0,2022-08-18 11:38:36,来自广东,3667584085925582,微笑小羊Qw
7133058730828694302,估计这辈子都不想出去旅游了,0,1,0,2022-08-18 11:52:23,来自河北,101673419872,秋裳云衣
7133072021009449731,马上中秋和国庆来临，看谁有胆量出省旅游,0,0,0,2022-08-18 12:44:15,来自湖北,4488124260,金秋十月10月
7133126555114570528,血泪教训：疫情期间，是度假还是渡劫，要想清楚,0,0,0,2022-08-18 16:15:43,来自广东,2576844479539548,罗体快跑
7133048318695228200,为了一个基本毒性很低的奥密克戎 不断折腾百姓,0,7,0,2022-08-18 11:11:29,来自重庆,58143338070,二度额度撒
7133083871650218787,疫情这几年失业在家，难受,0,0,0,2022-08-18 13:29:32,来自广西,107908665870,堂堂正正做人52099
7133047818747118369,度假还是度劫要想清楚[灵光一闪],0,2,0,2022-08-18 11:10:32,来自云南,4220321771,纤纤小雨
7133053785223938850,疫情出游就得有这种心理准备。,0,2,0,2022-08-18 11:32:37,来自上海,96657257240,我系渣渣輝1027
7133052490920461087,全国这样搞 还怎么拉动内需,0,5,0,2022-08-18 11:28:03,来自上海,71172295022,Bingo
7133072235463836453,这样的新闻都不愿意看了，累了,0,2,0,2022-08-18 12:44:47,来自贵州,64155784197,123历史真相
7133043411069960963,响应旅游号召去隔离,0,2,0,2022-08-18 10:53:08,来自广西,104709560743,熊大无敌
7133115966934172452,还是在家待着好,0,0,0,2022-08-18 15:34:33,来自北京,82382032408,梨花又开放39
7133080123007976226,很多时候觉得这样无休止的循环隔离防疫还不如感染一次。,0,1,1,2022-08-18 13:14:59,来自上海,4016010808,上海锅哥
7133014562273608460,没说明是是社会面发现的还是隔离人员中发现的,0,1,0,2022-08-18 09:01:04,来自江苏,3808342791695086,锦衣卫指挥使
7133057745829397283,这时候能去旅游的，都是有钱人，不坑你们，坑谁？,0,1,0,2022-08-18 11:47:50,来自山东,628520724475799,北大不如兄大
7133082493049881384,动态清零之下，何人可以幸免？,0,2,0,2022-08-18 13:24:14,来自上海,55692098761,大明王朝18
7133030577543906063,看到头都大了，还好我7岁月25号离岛,0,0,0,2022-08-18 10:02:32,来自重庆,5753683586,朱蕊先生
7133029649797432097,现在尽量别旅游，如果非得出去，还是避开热点旅游景点,0,0,0,2022-08-18 09:59:40,来自辽宁,3007863498226864,无双扑克qs
7133004120663196431,感觉三亚还在增加呢，还是没有控制住,0,2,0,2022-08-18 08:20:07,来自北京,874863141592254,风轻云淡0527
7133054455519888142,三四年没出过远门 周边只敢2小时以内的车程市区玩玩 就怕困到哪里出不来 回不去 钱还要掏,0,3,1,2022-08-18 11:35:48,来自云南,4054300962,晴空蓝之爱
7133068441602851597,最近昆明市疫情加重了,0,0,0,2022-08-18 12:29:57,来自云南,6963123887,热情扑克kt
7133005653953741601,自觉遵守防疫规定，做好个人防护。,0,2,0,2022-08-18 08:26:50,来自北京,4178600947099787,才高八斗天空01
7133035805060268834,夏令营就是要锻炼，既来之则安之，调整心态，关键时刻才能锻炼人，把握住机会你会成长的,0,1,0,2022-08-18 10:22:50,来自河南,52350371197,番茄炒肉丝
7133046599764869921,不出门，不旅游，在家侍着，备好吃的，最安全。,0,0,0,2022-08-18 11:05:30,来自上海,6347938744,冷山雨
7133069347622322955,我昨天去中东（磷肥厂）逛了一圈，回来顺便去了趟香岗,0,0,0,2022-08-18 12:33:22,来自湖北,62028272706,太阳红957
7133049950636360452,还是老老实实在家好啊！[呲牙],0,1,0,2022-08-18 11:18:50,来自安徽,2902308773190621,沉着阳光sh
7133006240263176999,都要自己注意点。,0,0,0,2022-08-18 08:29:11,来自广东,6749941206,南风知我意18
7133114448763831048,这么多游客集中在一起，新冠病毒传播就要付出代价,0,0,0,2022-08-18 15:28:40,来自浙江,59153169911,风姿卓越天空At
7133048732186395433,这个时期还想出去旅游的，应该是有心理准备的。,0,0,0,2022-08-18 11:13:05,来自上海,109534187707,煮酒Hero
7133004472229987104,老百姓配合政府部门尽快控制住疫情！,0,2,0,2022-08-18 08:22:32,来自吉林,3853106492495995,笑看风云动0916
7133038324306527012,元方你怎么看,0,1,0,2022-08-18 10:33:13,来自上海,51723412023,博学的书签yz
7132995910627296003,无症状越来越多。有症状也是轻者居多，如何在防疫和大家的工作生活找到适合的平衡点考验政府的能力和智慧！,0,3,0,2022-08-18 07:48:52,来自天津,75349982291,评标专家谷老师J
7133027258692109060,这趟旅行估计终生难忘,0,0,0,2022-08-18 09:50:24,来自北京,13070713745,密西西比河静静流过
7133117501537600263,航空公司和酒店提前把暑假的钱挣完了…..,0,0,0,2022-08-18 15:40:32,来自陕西,4103030139006980,古城闲驴
7133000126390010665,估计没有一个月清不了零！,0,1,0,2022-08-18 08:04:39,来自上海,55692098761,大明王朝18
7133070270964957992,佩服了中国人,0,1,0,2022-08-18 12:36:32,,2268989203417376,奋发苹果w6
7133112936134050563,就不能多旅游几天吗，这么快出来，别的地方也很紧张的,0,0,0,2022-08-18 15:22:39,来自广东,1517744507068061,农村土黄牛专业养殖户
7133002484502840071,没有重症？没有死亡？,0,2,0,2022-08-18 08:14:17,来自广东,3855777524,佛山无影叼
7132996797156918016,无症状越来越多，有症状也是轻者居多，如何在防疫和大家的工作生活找到适合的平衡点考验政府的能力和智慧！,0,1,0,2022-08-18 07:51:44,来自安徽,3069446222254807,多才多艺橘子xia
7132997032906130211,都是旅游惹的祸！,0,4,0,2022-08-18 07:52:38,来自浙江,5151447316,哥伦比亚的夜
7133011753344500480,三亚防疫一团糟,0,1,0,2022-08-18 08:49:38,来自海南,1143098170935501,热心光束Rz
7133014963480036132,慢慢来，反正人生就是几十年,0,1,0,2022-08-18 09:02:37,来自上海,109579845972,时代大潮之奋勇向前
7133064855015654180,没钱能减少很多麻烦，家门口公园溜达溜达就行,0,1,0,2022-08-18 12:16:04,来自河南,5861870176,freedom1
7133003438447133440,重症率是多少？,0,1,0,2022-08-18 08:17:22,来自北京,52380545829,老黄裳
7133120064341132036,有钱还是好,0,0,0,2022-08-18 15:50:40,来自甘肃,3513672942750430,斋宅聊
7133065017074713379,疫期出游，应该做好了思想准备！,0,1,0,2022-08-18 12:16:09,来自浙江,3078220342631056,冷眼看不穿
7133069828197335816,发现第一例到现在这么多是怎么回事，天灾人祸？？？？？,0,0,0,2022-08-18 12:35:04,来自江西,1239865285948248,智慧湖泊WI
