7132850184765457192,好好为人民牟福利,0,219,0,2022-08-17 22:22:36,来自河南,2221488229584331,梦想1111
7133038578522669861,守初心担使命，践行“为人民服务”的宗旨！[赞][赞],0,196,0,2022-08-18 10:34:02,来自安徽,16789538240,smile182501421
7132854747522040610,牢记为人民服务的初心[赞][赞][赞],0,127,0,2022-08-17 22:40:14,来自重庆,103603466573,shunvdeyanlei1129
7132855906744419106,不忘初心，全心全意为人民服务。,0,159,0,2022-08-17 22:45:01,来自广西,4481249695511828,猫橘月
7133058843202470693,图片编辑的去财务算下工资,0,116,0,2022-08-18 11:52:53,来自北京,100128472286,为什么有马赛克
7132848071280722723,为人民服务，不忘初心，牢记使命。,1,59,0,2022-08-17 22:14:22,来自山东,1943534926051693,老虎4433179484938
7133050304123601697,小编从哪找的照片.?,1,234,2,2022-08-18 11:19:53,来自山东,85755138519,温柔漂流瓶E
7132856685760103183,为人民服务,0,75,0,2022-08-17 22:47:47,来自云南,110588928044,沙轱辘
7132999124874085157,只要你一心为人民服永远都是对的。所以切记把人民牢牢放在心上。,0,13,0,2022-08-18 08:01:29,来自黑龙江,83202657753213,自由的风ZYDF
7132855510302589737,肩负重任，牢记使命，为民服务,0,27,0,2022-08-17 22:43:15,来自山东,2186277766835486,林琳
7133058476435489570,照片拍成这样是怎回事？,0,25,0,2022-08-18 11:50:53,来自山西,13440317358,C泽熙
7132982135610344196,全心全意为人民着想，牢记使命。,0,19,0,2022-08-18 06:56:13,来自山西,4002636631914244,英明果断明月0x
7132991581078684457,国家的委托，人民的信任。好好为人民谋福利！,0,5,0,2022-08-18 07:31:43,来自安徽,52554416138,李子274949167
7132967817540043531,不忘初心，牢记使命，全心全意为人民服务,0,3,0,2022-08-18 06:01:44,来自陕西,1508174441484974,青涩葡萄CM
7132855112565146380,不忘初心，牢记使命，多为人民干实事，干好事。党和人民永远不会忘记你的。,0,28,0,2022-08-17 22:42:42,来自河北,3091450314364397,风姿卓越枫叶zZ
7133066211176530727,这是现在拍的照片吗？工作人员有点应付了哈。就是企业给员工颁个奖也不至于用这样的照片吧,0,25,0,2022-08-18 12:21:25,来自山东,57499368872,阅尽浮华
7133043534701773603,年轻有为、肩挑希望，牢记为人民服务宗旨，中国建设更有力量,0,38,0,2022-08-18 10:53:00,来自山东,106001160069,每天都需好心情
7132993077278901006,专业人干专业事，初心不忘。,0,14,0,2022-08-18 07:38:01,来自吉林,104674262038,快乐晚风fD
7132997126992708390,拥护国务院决定，望任命者为祖国争光，为人民服务。,0,2,0,2022-08-18 07:54:12,来自湖南,61205668474,铕缘在相缝
7133047979086922529,任重道远，砥砺前行！廉洁奉公，为了人民！,0,34,0,2022-08-18 11:11:06,来自湖北,2933116308306711,文倩美好岁月
7133049095497024286,不忘初心，牢记使命！,0,2,0,2022-08-18 11:14:50,来自江苏,104425455011,焦船
7133023018414048000,严于侓己，廉洁奉公，不忘初心，忠诚党的事业！,0,1,0,2022-08-18 09:33:10,来自重庆,3817976175789787,机智的百香果d9
7132985729294402343,为人民服务，一如既往,0,2,0,2022-08-18 07:09:52,来自湖北,743748591697655,博学晚年幸福
7133000448734446377,希望你们牢记使命，全心全意为人民服务！,0,7,0,2022-08-18 08:05:46,来自内蒙古,99636104321,我爱灰太狼666
7132983544439374605,正常的工作变动。,0,8,1,2022-08-18 07:00:56,来自山西,8733052346,神州一统2624
7132844811887002404,希望在新的岗位上再立新功,0,90,1,2022-08-17 22:01:59,来自黑龙江,4207579072,雪城DE龙
7133043778172715780,履新不忘初心，执政为了人民，愿在新岗位为祖国做出更大贡献。,0,52,2,2022-08-18 10:54:53,来自浙江,109907216018,西子菡萏
7132851939364586240,务实是硬道理，为人民群众办实事才是民心所向！,0,35,0,2022-08-17 22:29:30,来自河南,101475393978,庄园294
7132851716466606852,新的岗位上勇于担当，牢记使命,0,37,0,2022-08-17 22:29:15,来自广西,4477680669426843,小梁梁哥
7133074244682597160,真的是一表人才，中国有希望,0,9,0,2022-08-18 12:52:04,来自江西,2678065778662103,端庄优雅西柚DQ
7132850951425442596,不忘初心牢记使命，完全彻底的为人民服务，这才是我们的好干部。,0,20,0,2022-08-17 22:26:02,来自黑龙江,237102163828551,上进明镜KT
7132972854068380416,谨记：时刻把人民的切身利益放在第一位，做好人民的勤务员！[赞][赞][赞],0,0,1,2022-08-18 06:19:06,来自江苏,50469081040,丛秀美
7132950898019697422,希望做到：“为人民服务，不忘初心，牢记使命，致敬工作人员,0,17,0,2022-08-18 04:57:37,来自安徽,3716825438758653,梦幻小红花0U
7133078508393693959,必须承认，这5张照片，嗯，震撼到我了！！！,0,6,0,2022-08-18 13:09:00,来自福建,50320937706,也就半瓶醋的老头
7132873473487668003,铭记毛主席的教导，为人民服务！！！,0,8,0,2022-08-17 23:53:52,来自福建,5985980241,刘浪者亚平
7132865037269697314,重任在肩要不忘初心，牢记使命。,0,20,0,2022-08-17 23:20:30,来自北京,104658178394,李迷孝
7132878371004531471,为祖国统一大业做出贡献。,0,10,0,2022-08-18 00:13:20,来自广西,3593681309277503,桂香果
7133072680488141581,为人民服务，牢记宗旨，不忘初心，不要辜负党和人民的重托。,0,9,0,2022-08-18 12:46:29,来自河南,3771269762,导弹巡洋舰
7132997291833049887,希望新上任的同志能够不忘初心牢记使命，在新的岗位上做出更大的贡献。,0,3,0,2022-08-18 07:54:22,来自河北,2770367685866935,老哥斯拉格
7132852576064357161,不忘初心使命！不负党和人民[赞][赞][赞],0,9,0,2022-08-17 22:32:02,来自河北,51227110528,手机用户满堂红
7132853320595030798,工作要从实际岀发，要为人民利益而干。,0,8,0,2022-08-17 22:35:28,来自四川,2651642847572894,优雅西柚ne
7133066414763770663,希望对的起百姓的重托，对得起胸前的党徽！,0,9,0,2022-08-18 12:22:11,,2176643258921924,开心的朱君
7132848072547255070,不忘初心，牢记使命，希望始终要记住为人民服务！[祈祷],0,26,0,2022-08-17 22:14:40,来自广西,874810563901981,揚帆起航
7132997301681160990,干实事，干好事，做一个清亷为民的好干部。,0,1,0,2022-08-18 07:54:13,来自陕西,107898006756,好学书签k
7132977466045645601,不忘初心，牢记使命，好好为人民服务！,0,4,0,2022-08-18 06:38:13,来自辽宁,63883843563,万商贸
7132856637954097931,不负使命，服务于民！,0,15,0,2022-08-17 22:48:44,来自陕西,68706621163,率真芝麻
7133013349545100062,国家的栋梁人民的公仆只要全心全意为人民服务忠诚党牢记使命,0,1,0,2022-08-18 08:56:12,来自山西,3847930498262936,高冷孔雀v8
7132987829328069387,不负重托，坚持全心全意为人民服务的根本宗旨！,0,4,0,2022-08-18 07:18:23,来自广东,106180430703,今生来世不相逢
7133013046989652736,为人民服务任重而道远。,0,2,0,2022-08-18 08:54:45,来自湖北,63833499084,168未来人
7132884647981695783,牢记毛主席话，全心全意为人民服务！,0,6,0,2022-08-18 00:40:29,来自山东,10645025429,清爽可乐m7
7132994977889911565,不忘初心，牢记使命，全心为人民服务,0,1,0,2022-08-18 07:45:14,来自上海,1623294211003335,知情达理熊猫3b
7133079583670321928,牢记使命，不负众望，为人民服务。,0,0,0,2022-08-18 13:13:16,来自河南,92440887340,逍遥3837
7132990649833898791,好好为我们老百姓服务[赞][赞],0,1,0,2022-08-18 07:28:56,来自广东,399861450025741,好学风声to
7132988007237419813,在新的岗位上继续为人民服务,0,4,0,2022-08-18 07:18:15,来自上海,519407939107879,黄夏韵
7132871581369664286,忠于职守，为人民服务。,0,10,0,2022-08-17 23:47:12,来自重庆,6120195793,大气水滴Jz
7132853400538415905,不忘初心，牢记使命。国家干部为人民群众办实事，办好事[赞][赞][赞],0,5,0,2022-08-17 22:35:56,来自江西,2853966693278926,智勇双全蜻蜓He
7133059245037601573,牢记使命不忘初心。。,0,4,0,2022-08-18 11:54:14,来自山东,97099946126,革新小能手
7132991806337696551,只要全心全意为人民服务都是好干部，都是好领导！,0,0,0,2022-08-18 07:33:38,来自云南,3179421726938936,無極—天下粮人
7132992245367571232,全心全意为人民谋幸福，希望在新的岗位上再立新功,0,2,0,2022-08-18 07:34:39,来自海南,686560047268964,清新春风gn
7132981906551243553,为人民服务，当好官,0,3,0,2022-08-18 06:55:20,来自江苏,844078353482248,魔法师九台2Q0
7133000822304703244,全心全意为人民：[赞][啤酒][撒花],0,1,0,2022-08-18 08:08:26,来自新疆,104701708374,仁爱葡萄Zp
7132978504312029986,全心全意为人民谋幸福。,0,5,0,2022-08-18 06:41:09,来自辽宁,64867280261,马匀2fo9
7133047659845747469,腐败分子下去，一批新的上来,0,0,0,2022-08-18 11:09:31,来自甘肃,100213082953,亚可西玛
7133063038193910569,牢记使命，不忘初心！为国家谋发展，为人民谋幸福。履行人民公仆为人民的宗旨,0,0,0,2022-08-18 12:08:29,来自四川,6656122422,白天不懂夜的黑102557956
7133075350166536967,党的信任以祖国与民族为基任！,0,3,0,2022-08-18 12:56:41,来自山东,201948657356120,自由的艺术家dZ
7132849465958204163,牢记使命，为人民服务,0,4,0,2022-08-17 22:20:31,来自河北,110954236081,苏苏1234
7132980066975531816,都必须牢记为人民服务的宗旨！,0,0,0,2022-08-18 06:47:07,来自湖北,6238471071,潼的爷
7133032767935906560,只要为人民办事的都是好干部,0,1,0,2022-08-18 10:11:11,来自河南,1267065953984087,张
7132977805411451661,希望任命高官为人民办点实事！,0,2,0,2022-08-18 06:39:17,来自河南,5919437911,大气蜻蜓aj
7132996805042209571,凡正是官员做好自己的事，干好就让人记住干错了让人烦。,0,0,0,2022-08-18 07:51:44,来自河南,1217902780613581,顾礼
7133076786052694784,愿每位高官不忘为人民服务的宗旨！砥砺前行，再创辉煌！,0,5,0,2022-08-18 13:01:43,来自河南,105424842919,清爽海洋qj
7133065277579182863,海峡网这图片用的[捂脸][捂脸][捂脸][捂脸],0,3,0,2022-08-18 12:17:13,来自重庆,2079896728778632,云飞扬zy
7132977693662495521,牢记全心全意为人民，吃苦在前、享受在后的初心！,0,1,0,2022-08-18 06:39:15,来自河北,94813907406,灿烂芒果L3
7133009313827668751,人民利益高于一切，不忘初心，牢记使命。,0,0,0,2022-08-18 08:40:02,来自海南,105424804609,风雨同舟9125
7133051789414974243,把工作和职责放到第一位，,0,18,0,2022-08-18 11:25:05,来自黑龙江,3853943253,杰森布鲁森
7133046985284387599,希望为人民谋福利,0,0,0,2022-08-18 11:06:22,来自广西,3091462036400387,顶级帆船Q2
7133054228263617315,青年有为，生力军。,0,9,0,2022-08-18 11:34:17,来自河南,2150277635637708,用户有恩不忘
7133067223467770656,人民的好公仆,0,3,0,2022-08-18 12:25:33,来自山东,3935901451553208,放下WQJ
7133073859494003486,优秀共产党员[赞],0,2,0,2022-08-18 12:50:48,来自江苏,8450027304589,杀菌草
7133051348282786597,都是有才之人！[赞][赞][赞],0,7,0,2022-08-18 11:23:32,来自河北,104971034031,刚285229766
7133052283541603113,应该是人民的好公仆,0,11,1,2022-08-18 11:26:54,来自湖北,101114269046,阿来998
7133074430632362764,支持[鼓掌],0,2,0,2022-08-18 12:53:25,来自江苏,61154082063,远航170036513
7133059789524878110,这是从哪弄个照片？[捂脸],0,14,0,2022-08-18 11:56:13,来自河南,101451962448,独驾318归来
7133036229683544873,我们天津呢,0,23,0,2022-08-18 10:24:37,来自天津,109907520271,巴巴罗萨439
7132851254463742734,不忘初心,0,14,0,2022-08-17 22:26:59,来自浙江,2955112974128487,金币响叮当
7133065405853844265,好,0,0,0,2022-08-18 12:17:48,来自辽宁,6809343771,似曾相识的雨
7133053350677218083,一表人才,0,10,0,2022-08-18 11:31:04,来自天津,3374132285,逆风狂飙4
7132982973561226015,可以,0,1,0,2022-08-18 06:58:43,来自广西,2480147482550008,低调11人生
7133059029139718953,同意,0,8,0,2022-08-18 11:52:56,来自山东,50445121709,清水煮韭菜
7133066434913420071,都是为人民服务的[给力][给力][给力][给力][给力][给力],0,2,0,2022-08-18 12:22:21,来自广东,1618956470197277,香水有毒
7132978855706968870,不忘初心牢记使命，努力实现中华民族伟大复兴！[赞][赞][赞],0,6,1,2022-08-18 06:43:53,来自山东,6121599351,我是堂堂正正的大英雄
7132994906267845379,国家的委托，人民的信任。好好为人民谋福利！[鼓掌][鼓掌][鼓掌],0,11,0,2022-08-18 07:45:09,来自甘肃,3474054102918724,用户天水清茶
7132851968942342951,为国家出力，服务人民！！,0,9,0,2022-08-17 22:30:10,来自天津,2454577262632251,无忧的海风3C
7133038922859004680,希望不辜负人民的希望！,0,189,0,2022-08-18 10:35:32,来自安徽,716524981337795,乡村首席爱国者
7132851864856445727,为人民服务，不忘初心,0,10,0,2022-08-17 22:29:22,来自四川,4111785783202855,黄纤荑妈妈
7133064763298661133,年轻有为、肩挑希望，牢记为人民服务宗旨，中国建设更有力量[赞][赞][赞],0,9,0,2022-08-18 12:15:47,来自广东,2629656418195245,优雅百香果7x7
7132876949999076135,不忘初心，牢记使命，全心全意为人民服务！,0,15,1,2022-08-18 00:09:00,,54465045342,岁月静好6699
7132845738446488355,为人民服务的好干部！,0,53,0,2022-08-17 22:05:14,来自重庆,4231398399946959,他说让我们拭目以待
7132998494482596642,国家的委托，人民的信任。好好为人民谋福利！[鼓掌][鼓掌][鼓掌],0,6,0,2022-08-18 07:58:18,来自湖北,111149101640,花姐大姐大
7132986520264639273,为人民服务，不忘初心，牢记使命。[赞][赞][赞],1,2,0,2022-08-18 07:11:57,来自浙江,62047306977,李应华16
7133049088911803177,不忘初心牢记使命,0,21,0,2022-08-18 11:14:24,来自山西,5531372079,秋香58633982
7133040360816952075,不忘初心，牢记使命！,0,58,0,2022-08-18 10:41:15,来自山西,58405800210,姬煜峰
7132985017252283167,不忘初心，牢记使命，全心全意为人民服务！,0,3,0,2022-08-18 07:06:37,来自湖北,5546474204,老施59412347
7132992421650416395,为人民服务，不忘初心，牢记使命。,0,3,0,2022-08-18 07:35:46,来自海南,3422160369749352,淡定远山3x
7132992876518474526,为人民服务，不忘初心[赞],0,2,0,2022-08-18 07:37:10,来自陕西,2120288830232861,倪倪宝贝4343
7132906175909200674,为人民服务，不忘初心，牢记使命。,0,7,0,2022-08-18 02:03:25,来自广东,4033451503655358,不知道起啥名字
7132854785304937256,为人民服务，不忘初心，牢记使命。,0,9,0,2022-08-17 22:40:37,来自山东,107783795401,美好7190193586937
7132855403033674499,为人民服务，不忘初心，牢记使命。[赞],0,7,0,2022-08-17 22:44:09,来自广东,67889639202,默然回首星光道
7132854897838080799,为人民服务,0,13,0,2022-08-17 22:41:34,来自辽宁,93051237866,怕水的鲤鱼2015
7132973865865052968,为人民服务!！,0,5,0,2022-08-18 06:23:19,来自山西,111091682254,品到有道
7132956857408668451,不忘初心，牢记使命，全心全意为人民服务,0,6,0,2022-08-18 05:18:59,来自江苏,111427288018,足智多谋天空PE
7132994488498897704,不忘初心，牢记使命。全心全意为人民服务！,0,1,0,2022-08-18 07:42:51,来自辽宁,3073855304249869,眼镜是道具
7133060286986486541,不忘初心，执政为民，新岗位上为祖国做出更大贡献。,0,7,0,2022-08-18 11:58:17,来自山东,3703574726975819,善良雪梨1O
7132855566153909032,为人民服务，不忘初心,0,8,0,2022-08-17 22:43:31,来自新疆,72297740621,夜陌城风
7133051091520127785,希望各位不负众望，为国出力，,0,16,0,2022-08-18 11:22:10,来自浙江,2291025418654103,活泼爱心觉罗
7132988628195721992,不忘初心，牢记使命，全心全意为人民服务,0,3,0,2022-08-18 07:20:37,来自广东,65021167366,天边一只蟹2
7132852316981969677,不忘初心，牢记使命，多为人民干实事，干好事。党和人民永远不会忘记你的。,0,21,1,2022-08-17 22:31:31,来自青海,50599081249,持之以恒昆仑
7133009715973931817,不忘初心，全心全意为人民服务。,0,0,0,2022-08-18 08:41:48,来自福建,3699211163148012,洒脱星辰7K
7132991255751328543,为人民服务，不忘初心，牢记使命！,0,1,0,2022-08-18 07:30:53,来自广西,1767620525702728,方舟家园
7133057731560293154,不忘初心，牢记使命！,0,7,0,2022-08-18 11:47:48,来自广东,3043061124565971,不再沉睡的狮子
7133057372541043496,个个年轻有为[给力][给力][给力][给力]守初心担使命，践行“为人民服务”的宗旨！[赞][赞],0,7,0,2022-08-18 11:46:39,来自广东,52892619754,魔法光束hG
7132971720838759203,不忘初心、全心全意为人民服务,0,1,0,2022-08-18 06:14:55,来自浙江,111604019844,山洞人间
7132891929850807077,不忘初心，牢记使命。全心全意为人民服务！[赞][赞][赞][赞][赞][赞],0,3,0,2022-08-18 01:08:02,来自山东,64123097305,博雅FSS4
7132989478888751887,不忘初心牢记使命，努力实现中华民族伟大复兴！[赞][赞][赞],0,3,0,2022-08-18 07:23:22,来自福建,4292940003549975,正直帆船NL
7132853493089796900,为人民服务，不忘初心，牢记使命。[赞],0,7,0,2022-08-17 22:35:55,来自辽宁,110843987224,琦记111
7132844400870769441,为国家出力，服务人民！！,0,34,0,2022-08-17 22:00:55,来自河北,1003174163657072,用户9684157904670
7132859078933906176,希望在新的岗位上不忘初心，牢记使命！全心全意为人民服务！,0,9,0,2022-08-17 22:57:17,来自安徽,2818795743480556,用户3960841445808
7132869479054820096,为人民服务不忘初心,0,9,0,2022-08-17 23:38:05,来自山西,1636492862301796,用户359312680047
7132975117650821901,不忘初心，不负使命，忠于职守，为民服务。,0,3,0,2022-08-18 06:29:03,来自上海,1609332014462382,用户470090093672
7133045468250047235,希望不辜负人民的希望！,0,13,0,2022-08-18 11:00:48,来自内蒙古,1733295699932109,用户5703853417227
7132853786883769100,为人民服务的好干部！,0,5,0,2022-08-17 22:37:17,来自四川,558180747447592,用户8459982342176
7132982125900858144,要全心全意地为人民服务。‘,0,3,0,2022-08-18 07:02:00,,2920748433809863,用户8516729256215
7132995392534561544,不忘初心牢记使命，方得始终。,0,0,0,2022-08-18 07:46:39,来自广东,1742099202706103,悠闲清风aW
7132992182457533221,不忘初心，牢记使命！在新仔岗位上再立新功！,0,1,0,2022-08-18 07:34:22,,109245314323,用户3829464748221
7132988968895316744,牢记使命，全心全意为人民服务。在新的岗位上做出更大贡献。,0,0,0,2022-08-18 07:22:16,来自上海,448195485239742,用户531124222807
7133065958734136099,为人民服务，舍己为人，守住初心。,0,3,0,2022-08-18 12:19:52,来自湖北,3192629692205080,用户4192946547126
7132996276006011659,保持好初心,0,1,0,2022-08-18 07:50:39,来自广东,2102683360574574,用户8058254913259
7133075711715820303,牢记使命，不忘初心，新的领导岗位做更大贡献！,0,1,0,2022-08-18 12:57:42,来自湖北,1363033246142503,用户5696736115143
7133043801211405068,希望他们牢记使命，不忘初心，一心为人民服务[呲牙],0,16,0,2022-08-18 10:54:25,来自江苏,97336572766,用户3534609220841
7133057771876107041,希望各位不负众望，为国出力，,0,6,0,2022-08-18 11:48:44,来自安徽,3557657536900604,用户8808266189418
7133048780320408360,希望尊守不论职位高低都是人民的勤务员，我们所做的一切都是为人民服务。,0,12,0,2022-08-18 11:13:19,来自四川,3650005017837360,用户9619612042309
7132991249745216270,希望新任领导干部要脚踏实地为人民服务。,0,1,0,2022-08-18 07:31:01,来自新疆,1728068215379124,用户1266622809853
7132865585502962447,可以继续为人民服务,0,2,0,2022-08-17 23:22:35,来自河北,62045745581918,青涩清泉AN
7133078213005869864,年轻有为，牢记使命。不忘初心。为人民服务,0,1,0,2022-08-18 13:07:35,来自广西,87444960534,用户8087691137365
7133050665324446479,为人民服务，是永恒的理想,0,8,0,2022-08-18 11:20:34,来自湖北,452654999543111,用户2897483354259
7133044260017832719,你这是迟到的消息,0,6,0,2022-08-18 10:55:32,来自河南,84328294578,手机用户84328294578
7132843504476619535,阅读了解,0,7,1,2022-08-17 21:56:40,来自宁夏,4408259920,手机用户4408259920
7132989533192782607,牢记为人民服务的初心[赞][赞][赞],0,2,0,2022-08-18 07:23:39,来自四川,2031533024614184,用户2734656336097
7132847272962097959,为人民服务，不忘初心,0,15,0,2022-08-17 22:11:49,来自重庆,2977119492128092,用户5006058566923
7132992141143524129,为人民服务，不忘初心，牢记使命。,0,2,0,2022-08-18 07:34:29,来自广西,4086253286857021,用户7298488626337
7132845832566768392,为国家出力，服务人民！！！！！！！👍👍👍👍👍👍👍👍,0,7,1,2022-08-17 22:05:56,来自河北,1064785083118654,用户3179461123
7132858534920160015,为人民服务，不忘初心，牢记使命。,0,8,0,2022-08-17 22:55:13,来自广西,2616458784815019,用户4912826630186
7132983514697663247,牢记为人民服务的初心！,0,3,0,2022-08-18 07:00:11,来自福建,106723167458,用户9880269844115
7132982674851398435,为人民服务，不忘初心。,0,4,0,2022-08-18 06:57:10,来自浙江,4485627431098119,用户1875003655035
7132994428477932303,为人民服务，不忘初心，牢记使命。,0,2,0,2022-08-18 07:42:28,来自山西,109817513974,用户1499219220769
7133048967931773700,国家的委托，人民的信任。好好为人民谋福利！[鼓掌][鼓掌][鼓掌],0,1,0,2022-08-18 11:14:54,来自江西,108849265135,用户1454600213767
7132850985039037219,继续为国际出力，为人民服务,0,8,0,2022-08-17 22:25:46,来自江西,99597855181,漫步284094536
7132843871277105935,[赞][赞][赞][赞],0,15,0,2022-08-17 21:58:04,来自云南,1829207272334654,用户6308906983368
7132997375836406528,[赞][赞][赞][赞][赞][赞][赞][赞][赞][赞][赞][赞][赞],0,1,0,2022-08-18 07:53:56,来自浙江,110379332278040,积极的荷叶Mx
7133030724647060255,[赞][赞][赞],0,28,0,2022-08-18 10:03:42,来自河南,3368505833698215,直爽的进取健康是福
7132983123473908488,[赞],0,0,0,2022-08-18 06:59:27,来自重庆,111140429351,星辰中的星
