7132396815671886627,借贷关系是资本主义的制度基础,1,26,0,2022-08-16 17:03:09,来自河南,4594502507,观海45308994
7132676272966501132,提前还没钱咋还？,1,2,0,2022-08-17 11:08:43,来自新疆,6129568026,淡泊的水滴dC
7132272999365444386,提前还贷属于违约，我印象中几十年来一直是这样的啊，不是最近才有的,30,94,10,2022-08-16 09:02:33,来自江苏,84838773955,Snape5002
7132270935050732321,还有这情形？！,0,27,2,2022-08-16 08:55:49,来自上海,3676364613102926,叶子柚
7131876593005773599,存钱怎么没听说过额度[what][what],1,27,0,2022-08-15 07:25:41,来自四川,7097794032,金点创意
7132737229298156318,我们用银行的钱，这叫贷款，利率高，我们的钱定期存银行，银行用来投资赚取利润，给我们非常低的利息，美其名叫帮我们保管！一点不平等！如果大家的钱都在自己家放着！我看银行怎么运行！银行真的是里外捞钱！为什么我们定期放银行的钱不算贷给他们呢！[灵光一闪][灵光一闪][灵光一闪],2,11,0,2022-08-17 15:04:49,来自河北,83884008922,会魔法的灵灵子
7132298175099978537,我邮政银行APP提前还款页面都找不到了，之前还有的。,22,21,0,2022-08-16 10:40:22,来自江苏,56621912060,大顺1987
7132384082054972195,广发银行原来是提前部分还款，提前一个星期申请就可以还了。现在要一个月。就缺我那一个月利息？,2,6,0,2022-08-16 16:13:58,来自广西,3452095120541667,唐大顺手机电脑
7132502281337602850,今年4月份老妈把她的棺材本都拿来给我提前还贷款了，就是担心我们压力大[捂脸],1,2,0,2022-08-16 23:53:26,来自广东,5597925216,渼麗伈情
7132027566961263367,不是说能借多少就借多少，能借多久就借多久吗？这样才是最好的买房方式吗？怎么想起来提前还贷了？到底这说法是谁说出去的？,1,5,0,2022-08-15 17:10:46,来自河南,11934586271,Turbo365
7132314626683257613,这个房产去金融属性的直观表现，以后房子只有居住属性了。,1,9,0,2022-08-16 11:44:43,来自广东,95823762324,威少894
7132305061270668062,提前还钱还不行？,5,21,2,2022-08-16 11:07:32,来自黑龙江,4177015844,远道来的人才
7132287054234632960,提前还贷一直要收违约金的，从十几年前就这样了,6,32,2,2022-08-16 09:57:24,来自湖南,88744834581,平凡世界里的一个我
7131737204115653417,我邮政的，上个月预约的也说让排队，现在还没有信[捂脸],5,7,1,2022-08-14 22:23:30,来自天津,1935604119514797,小天天
7132734061013189390,蒙圈了！房子贬值还还什么贷？,1,1,0,2022-08-17 14:52:31,来自辽宁,3505659856295592,相约恩施
7132286141062988558,那么:这算恶意还款？,6,62,0,2022-08-16 09:54:16,来自重庆,97934072457,蒋话啊
7132299904629785379,可见银行真正的目的就是利息，,8,49,0,2022-08-16 10:47:09,来自河北,93226889300,AICLUB
7132298612457046792,银行本想吃你三十年利息，你提前还贷，必须是违约行为啊,2,27,0,2022-08-16 10:42:37,来自辽宁,5573760466,风是外衣1293
7132293522627068707,"近几年参与或者身边朋友参与的几个投资结局如下：
宝能理财，按时兑付了，但是往后晚半个月到期的，延期了。
恒大理财，都知道深度套牢。
佳兆业理财，套住了，目前还在按三个月10%的节奏兑付。
股票，赔了20%。
最后算算还是还了银行房贷收益最高。不想折腾了，累了。",2,13,0,2022-08-16 10:22:22,来自广东,52057817715,深圳阿sir
7132283037110911752,最近专家出了许多新词：“恶意还贷”“恶意存款”“恶意不消费”～,1,14,0,2022-08-16 09:42:31,来自福建,4216192591,剑指天堂
7132647000604427044,我去年提前还的房贷，工行的，交了1.7w违约金，去年就有,3,0,0,2022-08-17 09:14:38,来自江苏,18079893606,山河无恙98998
7131762451196068648,提前还款不是好事么,5,5,0,2022-08-15 00:02:29,来自山东,3109782017,zai笑青天
7132291387600552740,货币M2超发，即大于GDP+通胀时，例现在为12%，还房贷比存款划算。但当下是流动性大，且经济活力低，除了垄断行业、国有、大资本外，留资金在手里没用。所以就出现违约提前还款潮，比如借年率4.3消费贷，还5.6房贷。,1,17,0,2022-08-16 10:14:34,,54920723328,baiyedl
7132809333783970572,提前还还是对的，可以尽量减少贷款利息，背着利益没法还本金，等于一直在为银行打工，毕竟借一百万30年利息也要还百万，如果房子涨价不超过一半的话，基本就在贴钱。,0,0,0,2022-08-17 19:44:46,来自上海,3032227536,money-maker154823023
7132301512335835917,贷款合同上字最小的就是关于提前还贷的！,1,7,0,2022-08-16 10:53:55,来自四川,892407941967240,COURAY
7132292238893269763,贷款利率降低了，还了重新贷，你以为他们又有钱了？,1,13,0,2022-08-16 10:18:12,来自山东,86349816340,某某人的杂货铺
7132441275361968926,什么提前贷款，都是降贷款利息，懂不懂，前几年贷款利息高，搞笔钱降下来,1,2,0,2022-08-16 19:55:45,来自江西,50099344541,宇ABC166
7131898677312455464,早在15年就还完了所有的房贷……,4,27,0,2022-08-15 08:50:36,来自广西,101375951191,休闲的逗号
7132037151260427012,中国银行可以提前还吗,4,1,0,2022-08-15 17:48:21,来自河北,59456872129,家具人-梦想发财
7131744822255289129,我欠了信用社6万，4.35利率，然后某银行给我打电话给我30万白领通额度，4.18，好说歹说，我说那贷了6万，还了信用社的钱[捂脸],1,8,0,2022-08-14 22:53:18,来自浙江,50506322804,发光的77
7132462192578183944,投资途径不多，就是有，收益率低也低于银行贷款，只能提前了,1,3,1,2022-08-16 21:16:52,来自广东,62278435640,活泼在海边
7131875260936438539,俺不贷款不卖房，看银行怎么争钱,2,8,0,2022-08-15 07:20:30,来自贵州,99595843397,聪颖咖啡P
7132378209416708898,刚把公积金贷款还清了，还了两年，利息2万7，现在没有好的理财途径，本金也不安全，提前还了省了利息，无债一身轻,1,2,0,2022-08-16 15:51:05,来自山东,92734456618,红鲤鱼与绿鲤鱼与驴1804
7132287894630662953,不知是不是最近看得太多，银行事件，楼盘事件，唐山事件，三观开始黑化了,5,37,1,2022-08-16 10:00:41,来自广东,3276169000525037,MJ爱车爱生活
7132643319754064648,以前贷的款不也都转lpr 了吗,1,1,0,2022-08-17 09:00:09,来自浙江,94906611552,睿哥救我
7131897733157782284,提前还，关键有钱才能还。,1,5,0,2022-08-15 08:47:38,来自浙江,58615038170,宾果果6666
7132287428337582882,100万房贷三十年利息101万，和抢钱一样，所以提前还了七十五万，留一点给自己增压,1,27,1,2022-08-16 09:59:01,来自浙江,871258898312224,操哥说故事
7132725549038584617,主要在疫情情况下 对经济的不确定性增大 投资渠道狭窄 基本上赚钱的地方太少了 之前称房贷是你这辈子能借到的利息最低的一笔巨款 但是现在看利息还是太高了 手里有闲钱 逾其搁哪赚不到钱 不如赶紧还银行 还能少花点利息,0,0,0,2022-08-17 14:19:11,来自北京,382251071440756,40多岁老司机
7132123421294920489,上月已经提前全部还完！,1,3,0,2022-08-15 23:22:52,来自重庆,60019966793,呀诺达43
7132705531990590246,我刚转的公积金，农业银行收了一个月的利息作为罚金，3000多元。,1,0,0,2022-08-17 13:01:41,来自湖北,6812393370,巴伦支手术刀
7132644254874796808,聪明人越来越多了，不再选择给银行打工了。,1,5,0,2022-08-17 09:03:58,来自广东,59702021765,85老赵
7132287044717495048,借钱了，想提前还清都不行，银行是钱太多，还是怕没有人贷款。,1,24,1,2022-08-16 09:57:43,来自湖北,83359250218,13986898723
7131903323719893796,工商app提前还款关闭了[发怒],9,8,1,2022-08-15 09:08:48,来自广东,67603107844,头条把时间还我
7132763547423245092,既然降息了为什么还要提前还贷？,0,0,0,2022-08-17 16:46:49,来自黑龙江,19331938889,礼貌的蟹子
7132281576427586315,房地产与建筑对GDP的贡献为负 这句话怎么理解？,3,11,1,2022-08-16 09:37:06,来自河北,276711946325916,语无声处飞
7132883655458358049,提前还款可以，前两年不让提前还款，必须两年后可以提前还款，工行的规定，不知道你们那有没有这种规定的？,0,0,0,2022-08-18 00:36:03,来自山东,51181675871,淡泊的香瓜U
7132360074349167400,就是提前还款，花呗即日被关闭。,0,1,0,2022-08-16 14:40:41,来自广东,62912648025,上善若水一心向善
7131902123994301216,我前几天去申请提前还贷，需要三十个工作日才可以！[泪奔],1,1,0,2022-08-15 09:04:46,来自广东,102974800115,道哥张张嘴
7132281096322057000,我不理解，提前还贷对银行来说不是好事吗？为了挣我利息？那我当杨白劳了？,9,10,2,2022-08-16 09:34:16,,5870502367,无聊报告
7132296944986833677,把放贷利率继续下调,0,9,0,2022-08-16 10:36:18,来自陕西,61222600361,蒙眼的墨丘利
7132005110548284171,提前还款还不好啊？银行钱多了啊[泪奔],4,1,1,2022-08-15 15:43:51,来自广东,4265987107,老去的火焰
7132368044244517667,一直都是这样的。我2013年时提前还贷，多交了一个月的利息。,0,6,0,2022-08-16 15:11:47,来自江西,51899840228,风淡云不轻
7132294702770422559,应该出个规定，提前还贷上征信，甚至入刑法看谁还提前,4,12,2,2022-08-16 10:27:35,来自上海,59782268527,爱生活的花猫Z
7132371933387834112,我也还了20多了，还剩两万了，不会投资不会理财又一般的家庭的还完没心事了,0,4,0,2022-08-16 15:26:51,来自山东,5575332717,虹虹98
7132702628769317663,有机会提前还贷的，房贷利率都是不低的，刚需都是买房后房价降了，利率也降了。,0,2,0,2022-08-17 12:50:24,来自广东,303121044093148,荒漠里的四叶草
7132728779193172777,提前还贷也要有钱还才行啊,0,2,0,2022-08-17 14:31:30,来自广西,71973920834,雷特男孩
7131864391875658509,提前还贷确实有规定提前预约还款，规定是提前两周至一个月！贷款提前还款也有规定，贷款发放后正常还款一年后就可以提前还款了，如不足一年收入一个月本金的违约金！这都是国家命令规定有据可查的！播主说的东西都不可信，她什么都不懂，不要被她带节奏！说的70%都不对，因为不懂！,0,7,1,2022-08-15 06:38:21,来自广东,58860583497,群山漫步者
7132112040168522503,真的，我就遇到！,0,0,0,2022-08-15 22:38:43,来自四川,101092891780,燕子姐625
7132721732339122957,贷款利息不如通货膨胀高。,0,0,0,2022-08-17 14:04:40,来自山东,57313970948,无忧的辰星kS
7132288918728753933,一看你不是专业人士，在一定时间内提前还贷一直就有违约金，这个是银行防止提前还贷的，不这么做，利润不可控，但是有经营成本以及有其他烂账的风险，这是银行考虑的东西,0,9,1,2022-08-16 10:05:13,来自陕西,101286760240,中小企业融资导师
7132722508562006799,管他是不是舆论不在于涨跌一套房自住没有别的投资还是还了划算,0,0,0,2022-08-17 14:07:12,来自福建,4468049704659517,1我是她
7131715107494953743,提前还贷不划算，如果用公积金提前还才划算。,22,18,9,2022-08-14 20:57:42,来自辽宁,100412285665,极客比莉5T
7131969415377388318,多合理啊，你提前还了，他们咋挣钱[捂脸],0,2,0,2022-08-15 13:25:12,来自辽宁,111051402659,彤彤美妞儿
7132378573956449062,越降越没信心。,0,4,0,2022-08-16 15:53:19,来自湖南,14555853822,杂然的世界
7132348633236013861,的确，普遍对未来的收入没有信心了。,0,5,0,2022-08-16 13:56:57,来自湖南,56805036396548,拈朵微笑的花Magnolia
7132306367284560681,银行贷款利率调高时，房贷立马跟调；利率调低时却不跟着相应调！这是啥理？,0,9,0,2022-08-16 11:12:12,来自江苏,1187893611608755,蓝色海湾
7132859530014311203,这应该只是个别现象，不应让人误以为普遍现象,0,0,0,2022-08-17 22:58:58,来自浙江,2761607935170935,耳得闻
7131683774530323235,不难怪我今天看了建行我想提前还房贷，结果没有了,6,8,3,2022-08-14 18:56:25,来自上海,23381788664,咆哮49
7132761768136540968,一阵风，全是提前还贷的软文，[捂脸][捂脸][捂脸][捂脸],0,0,0,2022-08-17 16:39:27,来自天津,63103671205,飞机从窗外掠过
7132434134857188134,关键钱放银行也不放心，还不如提前还,0,1,0,2022-08-16 19:28:46,来自上海,13342990287,幸福的启航
7132386564307092237,提前还贷一直要付违约金的好不好。,0,3,0,2022-08-16 16:24:08,来自四川,5527326008,无尽苦行
7132291252925645572,我19年的农行贷款，条款明确5年内还，满一年罚一个月，感觉一直是这样的，只不过不同银行不一样的条款，银行缺钱的时候希望你提前还，不执行条款而已。,0,11,0,2022-08-16 10:14:19,来自上海,62216220037,tongfw
7132320418647556878,主要是前几年的房贷利率太高，都是上浮利率，现在利率这么低，肯定有钱赶紧还贷款！,0,8,0,2022-08-16 12:07:03,来自江苏,4676677529,刚刚好1985
7132716708271751974,趁自己有能力的时候早点还了,0,0,0,2022-08-17 13:45:28,来自江苏,92199936550,云淡天高雁南飞
7132306632243118883,为啥不降房贷利率？,0,8,0,2022-08-16 11:13:11,来自江苏,58239634333,哦天空之城
7132477562663486216,希望把上浮的那部分加点去掉！,0,1,0,2022-08-16 22:16:27,来自河南,3328968558388749,Zyxopm9876
7132292973202834207,正常啊，我融创房子马上停工了,0,12,0,2022-08-16 10:20:53,来自浙江,51289336405,死魂骑士
7131938196694680352,这是不是冻结银行卡其中原因之一？[捂脸],0,0,0,2022-08-15 11:24:17,来自江苏,5182745010,百合50035035
7132299830357672738,银行太无耻了，提前还贷还违约,0,9,0,2022-08-16 10:47:05,来自安徽,5835278096,"大海无边
"
7132615776334791437,还好提前还贷了一部分,0,0,0,2022-08-17 07:13:41,来自福建,2722006658457804,执着的豆花NQ
7131984426850550563,我没贷款怎么办啊？,0,1,0,2022-08-15 14:23:12,来自云南,7529976768,腾云5348511
7132730641996907294,没贷过，也没钱存[捂脸][捂脸][捂脸],0,0,0,2022-08-17 14:39:02,来自海南,1437790503174379,wu遇见最好的你
7132096463563719439,提前还了一部分！[大笑],0,1,0,2022-08-15 21:37:39,来自安徽,540593125864876,寒岁
7132293930737681187,现在的问题是没有信心，为什么没有信心？,0,8,0,2022-08-16 10:24:06,来自湖南,1710478363461933,攻城狮的副业
7132298932964770600,疫情没完没了影响很大，现在人心惶惶的不是刚需没人投资买房子的。,0,8,0,2022-08-16 10:43:25,来自广西,76581658130,自若露珠5v
7132301632829997838,那还是这部分太有钱了，要么本来是二三十年的预期收入，现在提前达到了。要么本来人家可以全款买，贷款只是加杠杆多买的，涨价获利预期不大就不玩儿了呗。,0,6,0,2022-08-16 10:54:25,来自河南,22855208751,竹节香馥
7132618811513684771,是不是在办理转贷，现在信用贷的利息很低。,0,1,0,2022-08-17 07:25:08,来自浙江,58991939148,华文56
7132292601570919206,拿人不当人。,0,8,0,2022-08-16 10:19:50,来自河北,16083452894,犄角旮旯旯旯旯
7132301163147346719,影响银行收入,0,6,0,2022-08-16 10:52:25,来自江苏,3584030732205790,Cvvcberty258963
7132289765940069159,广州农行排队四个月，一直拖,0,0,0,2022-08-16 10:08:35,来自广东,55540171529,春暖花开艳香满园
7132305364376453891,银行业扫黑除恶任重道远[灵光一闪],0,8,0,2022-08-16 11:09:06,来自山东,101169716686,Mengxiang963
7132308995678765865,房贷月支出是固定支出，负担太重，利息又高，有闲钱肯定考虑提前还了。,0,8,0,2022-08-16 11:22:24,来自海南,84790866429,南海哨兵椰子树
7132293476154245929,每个月没日没夜的干还不够还房贷利息,0,12,0,2022-08-16 10:22:10,来自江西,99372861005,不凡的柳叶
7132319737400558370,幸亏我提前还了，没被收违约金[呲牙],0,7,0,2022-08-16 12:04:06,来自江苏,4275318092,真诚蜻蜓
7132323068663808808,有多少人提前还贷我看是少之又少,0,6,0,2022-08-16 12:17:04,来自浙江,10785214150,穿越358
7132306887298532131,贷款合同怎么签的，按合同执行啊,0,0,0,2022-08-16 11:14:08,来自云南,4649792817,英雄机器猫
7132924140310545193,因为要卖房，所以提前还贷,0,0,0,2022-08-18 03:09:22,来自广西,107932311637,幸福黑利3Q9
7132293455321580329,提前还贷的都是有实力全款没有全款的,0,12,0,2022-08-16 10:22:19,来自安徽,5381625932,平凡人xbg
7132300046615986980,说明利息高的离谱,0,9,0,2022-08-16 10:48:22,来自河北,79070738739,米斯特儿lin
7132338200991335180,没搞明白为什么要提前还款？？就这通胀率还提前还款？？,0,3,0,2022-08-16 13:16:31,来自山东,72584565909,Noer
7132284417523090188,还有个重要原因是现在息差太大，很多人都加了高基点，降息lpr根本降低不了多少因为基点不动,0,13,0,2022-08-16 09:48:00,来自宁夏,2962690206,风音丶
7132526121497346820,看了你的视频，立刻提前还了部分房贷,0,0,0,2022-08-17 01:31:28,来自上海,6345856907,会笑的眼睛SS
7132296955233485583,借贷时合同就规定，可以提前还贷。,0,7,0,2022-08-16 10:35:52,来自江苏,5513831386,星系观察者
7132305540596073216,两折咋算的[泪奔],0,7,0,2022-08-16 11:09:09,来自上海,92494865741,星宇星云0320
7132289204780040968,我正在操作这个事情，贷了一百万，发现几年下来利息就还了几十万，本金还没咋到，银行确实黑，决定不给它打工了,0,15,1,2022-08-16 10:06:04,来自江苏,465026955451,彪彪07
7132296853236384546,从08年至今，我一共办了三次房贷，都提前还贷了，都没听说有违约金。,0,7,0,2022-08-16 10:35:31,来自陕西,941650441155388,善解人意秋叶
7132301907498631976,主要看你贷款合同怎么约定的，违约金的历史有10，20年了,0,7,0,2022-08-16 10:55:09,来自湖北,118365255640716,超级小航侠
7132397650393006885,五月份就提前还了[我想静静],0,0,0,2022-08-16 17:06:54,来自湖北,6101397745,悠闲平常心的平凡人
7132295903485936425,有好大一部分是被动主动还贷的（抽贷）,0,7,0,2022-08-16 10:31:36,来自重庆,65116860496,80后家里蹲
7132333052004434691,肉丝比肉块好吃[捂脸][捂脸][捂脸],0,3,0,2022-08-16 12:56:15,来自广东,1095558660101092,智勇双全阳光0D
7132301659883160332,按合同办，你银行急什么？,0,4,0,2022-08-16 10:54:39,来自广东,9493752960,金沙楼
7132290538988421919,提前还贷收不收费，收多少都在合同约定的，翻翻看看，不要乱说,0,9,0,2022-08-16 10:11:32,来自四川,74280740444,幻听年龄
7132286367874810636,其实有办法，就是存量房贷马上降低利率！否则这帮人越琢磨越亏。利率越降低他们还的越猛,0,16,0,2022-08-16 09:55:36,来自江苏,105297783372,马伯乐的太阳花
7132285173156266793,存量房贷必须马上降低利率,0,15,0,2022-08-16 09:50:04,来自山东,3765411706,我不是宋江9t0P
7132885409805746958,前五年还的主要是利息，其实提前还贷银行稳赚，一百万贷款，利息一百万，第五年提前还贷，还欠银行八十五万，还个寂寞。,0,0,0,2022-08-18 00:42:22,来自广东,3452104081935246,波士顿机器人爱好者没
7132303456244777764,现在的人这么有钱啊 我们是想提前还也没有能力,0,0,0,2022-08-16 11:01:13,来自广东,6963709258,不如乐观一点
7132294025373139715,提前还贷违不违约，签合同的时候都不看吗？这么重要的条款,0,7,0,2022-08-16 10:25:06,来自山东,4380906178493575,JET555
7132316800200835879,预约好了还款，办理的过程中不让还，可想而知[泪奔],0,3,0,2022-08-16 11:53:36,来自安徽,92934057350,名字都给你们抢完了
7132285482158785294,房地产，钢筋混凝土是最没有技术含量的实业,0,10,0,2022-08-16 09:51:37,来自湖北,110170455752,下雨不飙车
7132290072493802280,交通银行由15变成25了。,0,0,0,2022-08-16 10:09:12,来自山东,4037006536214078,洪城新人
7132474316398363407,小人物，被各个环节收割。电商费，契税，闲置物业费，房贷利息,0,5,0,2022-08-16 22:03:55,来自北京,85963572146,我是纠结的小时代
7132301421772456739,根本原因：对未来收入不确定性,0,6,0,2022-08-16 10:53:01,来自陕西,102164873568,优雅海风de默默
7132289881875071779,美女说得很好,0,0,0,2022-08-16 10:08:27,来自山东,4037006536214078,洪城新人
7132453533966271268,以前鼓吹提前还贷不划算，结果还是坑[捂脸][大笑][捂脸],0,3,0,2022-08-16 20:43:18,来自贵州,4177746882471500,富足百灵鸟uQ
7132364846397670147,居民杠杆和金融产业是最大不幸福因素，这两样把人变成工具。,0,4,0,2022-08-16 15:00:06,来自天津,93131872350,明喆山人
7132287452928328484,交通银行一直有，百分之一差不多。其他银行有的一般是规定最少还两年或是一年。,0,9,0,2022-08-16 09:59:16,来自江西,6690206496,兵者诡道zhy
7132281001468068642,强心针也救不回来了,0,9,0,2022-08-16 09:33:56,来自山西,100446137471,只做不说
7131935296115442472,还打算十月份提前还部分呢，是不是得现在开始预约？,0,0,0,2022-08-15 11:12:29,来自云南,95560551119,wind411
7132469275742962435,这个道很简单，房价下行不敢存房了提前还款，是用准备再买下一套的首付款来着的。,0,2,0,2022-08-16 21:45:06,来自贵州,1112342984407204,滴水穿石TR
7132302041552405252,拼命负债，整个社会杠杆率太高了,0,4,0,2022-08-16 10:56:19,来自重庆,3421295932604478,随风入夜101
7131905343764153121,去年提前还了110多万按揭，利率近6%，一年六七万利息实在顶不住，卖了一套小户型的房子才有钱还的。主要是未来房价不会在大涨了，继续持有多套房子，就真的成了接盘侠，把钢筋混凝土当财富了,0,1,0,2022-08-15 09:16:48,来自天津,3012297640390244,毛毛2022
7132091237397431047,俩套都是提前还,0,0,0,2022-08-15 21:17:36,来自广东,6020950320,Apinky萍
7132304458080043815,提前还贷一直都要收违约金,0,4,0,2022-08-16 11:05:42,来自广东,5397154004,谁是劳伦斯
7132316280631788329,早该清醒了,0,4,0,2022-08-16 11:50:49,来自河北,7024162112,深爱潘金莲
7132296024647123727,现在银行的钱太多啦，这些钱都流出来，又不进入房市股市的话 ，物价要暴涨,0,6,0,2022-08-16 10:32:13,来自浙江,2176684547382717,盗冰箱
7132415324397273863,烂尾的风险太大,0,0,0,2022-08-16 18:15:28,来自山东,98466495343,自由的孔雀M8
7132301382396707592,以前的业绩算了提成了，你现在以前结束贷款，利息少一大块[捂脸][捂脸][捂脸],0,5,0,2022-08-16 10:53:32,来自天津,96314306742,梦三才
7132324188937241379,可能是为了脱手手里的房子。于是提前还贷，把房产证拿到手，好转卖。,0,3,0,2022-08-16 12:21:20,来自湖北,68356987781,Tyloo2018
7132313947113816863,提前还贷，钱从哪里来？？？,0,4,0,2022-08-16 11:42:10,来自浙江,73182729019,臭豆豆w
7132303020062573348,如果是真的，没有道理啊。,0,5,0,2022-08-16 10:59:38,来自湖北,5956342502,李歌72921256
7132284240066364175,这一步还不知道要走几年，阻力太大！,0,9,0,2022-08-16 09:46:31,来自黑龙江,106895081820,四海h
7132306611565576997,继续严控疫情,0,5,0,2022-08-16 11:13:47,来自福建,74612701075,宁五德菱
7132315035573666571,你提前还贷，银行吃啥喝啥,0,4,0,2022-08-16 11:46:40,来自陕西,13207637407,咪乖虎
7132885611828527909,主要还是贷款利率高，还有契税维修基金物业费。经济不景气年轻人压力大啊,0,0,0,2022-08-18 00:43:00,来自湖南,21820296598,无为叶先生
7132279791025668901,违约金一直都存在,0,9,0,2022-08-16 09:29:49,来自天津,2931571993,一心尚好学
7132287062782690085,我是提前还不了的，真羡慕[捂脸],0,7,0,2022-08-16 09:57:55,来自湖北,96944267131,82年的健力宝366
7132280886795748131,合同没规定违约金的也收违约金？,0,8,0,2022-08-16 09:33:25,来自四川,2405377636570813,VVV小雨VVV
7131836863731876621,提前还款是对的。钱放在手里太危险了，容易消失,0,7,0,2022-08-15 04:55:08,来自黑龙江,2809985562585819,无双金桔nA
7132907882932110116,人在福建，一天之内接到不同省份的应该打电话问是否贷款。看来还款的人太多了，资金不流动了,0,0,0,2022-08-18 02:07:15,来自福建,6751668136,星星110658055
7132861332223165195,大家都提前还贷，反映了民间投资渠道少了。,0,0,0,2022-08-17 23:07:01,来自云南,57055446743,老曹169223931
7132335141275681540,银行:都提前还货，我放给谁去呀[捂脸],0,3,0,2022-08-16 13:04:30,来自安徽,50449576412,李小石一一
7132791713685062411,以前是被银行的毒鸡汤害的，说什么提前还款是傻子行为。现在大家都清醒了，原来都是替银行打工,0,2,0,2022-08-17 18:36:50,来自江苏,61849871019,波叔174475627
7132358774739993377,商业房贷利率太高了,0,2,0,2022-08-16 14:36:33,来自新疆,6411051518,每日直评
7131871187911099150,四十年来银行躺着赚钱、高收入、高福利习惯了，一时两侯儿接受不了，但这不是给提前还贷设置障碍的理由。作为银行给自己留点脸面吧！毕竟在这个社会里混呢，免得被别人看不起。,0,4,0,2022-08-15 07:04:50,来自新疆,4155806141907741,俊俏豆花e
