7132861084834824995,大龄剩女有救了,6,30,1,2022-08-17 23:05:12,来自广西,106791897860,自在阿拉尔5V
7132998824125203207,这是在鼓励未婚已育，丧失伦理吗,0,6,1,2022-08-18 08:00:01,来自广东,57046127805,草堂师兄
7133022448366715684,广西未婚生育还要罚款[呲牙]没钱上征信,0,0,0,2022-08-18 09:31:33,来自浙江,4059044554218604,乐观的熊猫Yh
7132860125526328078,大姑娘生孩子，不给吃好的还要挨打！,0,1,0,2022-08-17 23:02:03,来自陕西,3399346076520228,爱国的健
7133031814285099812,未婚先育，不负责任，道德沦陷与政策有关,0,1,0,2022-08-18 10:07:52,来自北京,4226158472998231,知情达理天空N4
7132997478173098792,就是鼓励多生,0,0,0,2022-08-18 07:54:15,来自山西,132362118628520,努力的008
7133015374744011555,未婚生育不支持，在领福利更不支持，这样多少正常家庭会被多出私生子,1,24,0,2022-08-18 09:03:34,来自河北,994408631641486,我们永远在一起
7133018554382729992,我觉得只要是生孩子都应该有津贴。[呲牙][呲牙][呲牙],0,24,0,2022-08-18 09:16:23,来自广东,4244542282017031,胡小箬在广州
7132738847548539687,那到底未婚生育的女性，没有结婚证的情况下能享受生育津贴吗？,2,5,0,2022-08-17 15:11:11,来自河北,2458148226211452,温暖的阳光sunshine
7133030067571098368,支持未婚生育的同时也该出台相应的约束措施，正常恋爱生子或是通过医学手段生都给予祝福，如果是通过破坏别人家庭做小三小四小五小六来生，是不是被道德谴责的同时更该有法律可以约束，法律需要给予已婚女士公平公正，保障社会公序良俗！当今社会优秀的女性很多，好吃懒做走捷径的女性也很多,0,2,0,2022-08-18 10:00:30,来自湖北,109595577167,容米
7133019327150113536,有时候专家的观点未必正确，未婚生子不可取，没有结婚证错上加错！,1,17,1,2022-08-18 09:19:02,来自河南,92477263487,冷欢忆君
7133002900384613159,现在这么缺人么？从国土面积看俄罗斯第一大人口1.4亿，加拿大第二大人口4千万，我们第三大人口14亿，我们已经比俄罗斯+加拿大+美国+欧洲的人口还多了，还那么缺人么,1,3,0,2022-08-18 08:16:11,来自山西,59198932979,快乐清泉8
7133005274394231586,如此必将造成未婚生育率大幅提高，变相鼓励末婚先孕先育。同时，先未婚生育造成的各种矛盾，也会大幅攀升。对于末婚子女，我们现在在社会偏见，传统思想，家庭地位上存在诸多分歧。也对孩子的生理心理造成一定影响，还可能造成社会与家庭矛盾的激化，从而影响和谐自然的社会环境。也使婚姻的重要性有所减弱，也影响对婚姻，人性，道德仁义的尊重。所以，用此方法来提高鼓励生育，并不是最好的方式。,1,7,0,2022-08-18 08:24:23,来自江苏,531818496931655,柔美的风飘悠的云
7132862715668005673,以后男的更找不到老婆了。因为女的很多光想要孩子不要老公。这个解决了这部分人的需求。,0,19,0,2022-08-17 23:11:32,来自安徽,26028854250896,管你屁事啊啊啊
7133044759979623209,非婚生子女和婚生子女同样享有继承权，那怎么解释呢？如果婚外子女，一个男的有婚外子女，那对妻子和婚内子女来说是不是也不公平？,0,1,0,2022-08-18 10:57:46,来自河南,6455661540,异乡飘零女
7133018255161623296,感觉不妥，这是支持非婚生子，没有必要非要学西方的价值观!,2,9,0,2022-08-18 09:14:55,来自辽宁,4589093438,道牙er
7133031871931925261,除了生育津贴，还应该有更多更强有力的支持鼓励政策吧,0,1,0,2022-08-18 10:08:18,来自广东,3214565654142798,茉莉花茶味悠然
7133038880147915535,先把自由职业女性自费交医保的生育险落实了吧！,0,1,0,2022-08-18 10:34:47,来自四川,3413341632209407,上进滴哦哦
7133035643835876107,支持保护女性合法权利，本来就不该按着身份来限制福利。,0,1,0,2022-08-18 10:23:17,来自山东,50549757664,蜜坛子
7133046637140263680,女性要靠的国家制度来保护自己，自力更生自强自立，而不是丈夫……,0,1,0,2022-08-18 11:04:56,来自江苏,193934955643440,纬音
7133019487368577807,女性更要洁身自爱，更加弱势了,0,3,0,2022-08-18 09:19:41,来自四川,50012331385,东琬霞飞
7133002251702240008,交生育险时又不问是否已婚，就应该给予相应的生育津贴！这和是否已婚无关，是保险合同与义务,0,1,0,2022-08-18 08:13:29,来自北京,4713465984,舌尖与胃袋
7133020321552171807,就是没有结婚证，也可以享受生育保险待遇，以前必须要结婚证才行！现在没有也可以。,0,1,0,2022-08-18 09:23:13,来自新疆,395418879926360,风轻云淡的心情
7132830478419673859,什么时候来了生育津贴，从来都没有听说过,3,5,0,2022-08-17 21:06:47,来自江西,95909851957,才思敏捷的博一博
7133018289135534879,那婚姻存续期内，男性出轨的非婚生子女，也一样，那结婚干嘛？一点保障没有了,0,1,0,2022-08-18 09:15:40,来自河南,93280836935,沧海蝴蝶415
7133034044958769960,若未婚怀孕，法律不允许堕胎，那就可以领生育津贴，这个政策应该可以的。,0,0,0,2022-08-18 10:16:14,来自甘肃,102184920462,绿竹9644
7132743229023716100,"生育政策要加大放宽，要有包容度。
生孩子，往小了说是为了小家，为大了说就是为了国家。孩子才是国家的未来！！！",0,2,0,2022-08-17 15:28:32,来自河北,2458148226211452,温暖的阳光sunshine
7133028398582334248,社会更人性化了，历史进步不可挡。,0,3,0,2022-08-18 09:54:06,来自天津,2031514706525277,心存善念天感之
7133009975878206211,为了催生，国家真的是点子越来越多了……挺好，独立的女人们有福了,0,0,0,2022-08-18 08:43:41,来自浙江,104498235455,葱花ch
7133017687840277261,给不付责人的男性找到了一个更好的办法,0,2,0,2022-08-18 09:13:26,来自陕西,4073032810767774,好学辰星3F
7133029063844905762,这个政策还要保障这个孩子属于这个妈妈的，不然过两年男方找过来要孩子，可真是气死了,0,1,0,2022-08-18 09:56:41,来自广东,53060115768,小彤3910
7133043666213536547,建议国家放开收养制度。,0,0,0,2022-08-18 10:53:17,来自山西,997992537012984,淡泊666999
7133014264000152359,对，不能因为有钱人喜欢非婚生育而抬高普通人非婚生育门槛～[看][看],0,9,0,2022-08-18 09:00:07,来自四川,3768760533530616,soardg
7132839721889317673,有能力的男人孩子越来越多,2,31,0,2022-08-17 21:41:51,来自河北,103581169529,漫不经心9201
7133045436491350787,原则上只要不违法婚姻法就没事,0,0,0,2022-08-18 11:01:09,来自江西,17713633826,一切随缘zw
7133037083492746016,建议以城市为单位制定政策，向二胎以上的全职妈妈家庭发定向消费券，二胎每胎每月发1000，三胎每胎每月1500，视城市经济能力，执行到12-18岁止。,0,2,0,2022-08-18 10:28:35,来自北京,93200511512,易北河畔的落叶
7133028212917224233,一项重大措施不应简单如标题党，还应有一系列的辅助条款作为补丁，防止漏洞。,0,0,0,2022-08-18 09:53:27,来自广西,108636409223,fangfu兮
7133000988554298125,社会发展了，人的生活方式都是多元化的，不婚，不育，已婚丁克，未婚生子都是正常的,0,1,0,2022-08-18 08:08:39,来自广东,2005939813352007,甘Z8言
7133002172493071144,头胎双胞胎都没有享受到优惠政策！,0,0,0,2022-08-18 08:12:36,来自广东,4331708942919356,钰姐家常菜
7133023331581936422,这才是社会进步的表现[大笑],0,0,0,2022-08-18 09:35:13,来自江苏,53232930057,一条天天向上的鱼
7133019390798414625,现代人生活在一个做什么事都需要鼓励的时代。,0,0,0,2022-08-18 09:19:52,来自山东,2788010129896727,微语读书
7133029741477069605,鼓励未婚的生孩子吗?,0,0,0,2022-08-18 09:59:55,来自广东,651380109882960,好奇姑娘
7133013186378793766,为啥我们这边灵活就业不让交生育险,0,0,0,2022-08-18 08:55:59,来自黑龙江,110851192989,Wmjjj
7133031140675404548,必须大力推广，单亲妈妈的希望，解决人口下滑的又一推手,0,0,0,2022-08-18 10:05:29,来自北京,9911580425,新文化街男孩
7133017087802671872,有利有弊，有个办法就当父母的都得是单身才能领这福利，不然只有坏处,0,6,0,2022-08-18 09:10:16,来自四川,105200126998,平静些剑走偏锋563
7133004414306697999,允许骂人吗？,2,2,0,2022-08-18 08:21:15,来自北京,85414770578,门边花
7132817430057386755,生育津贴？哈哈，没见过。去医院到出生到上学，开销不少！,0,0,0,2022-08-17 20:16:04,来自广西,2506509805425471,广西电动车哥
7133022464061653763,好多结婚的都不愿意生了,0,0,0,2022-08-18 09:32:09,来自湖北,1711319502568200,素心如简
7133022522035077929,不敢结婚，养不起孩子,0,3,0,2022-08-18 09:31:19,来自浙江,20469840563,5656ABC
7133038639986279205,有钱人生孩子为继承财富，穷人生孩子是为有钱人创造财富，为有钱人打工,0,1,0,2022-08-18 10:34:15,来自辽宁,12813171360,松下私语
7133035298724217638,没到结婚年龄的夫妻，肯定办不了结婚证，好政策,0,0,0,2022-08-18 10:21:39,来自浙江,4081818334930984,淘淘陶126
7133023683857498884,人口停止增长、老龄化急剧加速的特殊时期，这是没有办法的办法啊，以大局为重，理解上层的用心良苦。,0,1,1,2022-08-18 09:36:56,来自福建,85744018510,麦嘟嘟618
7133003019997758248,未婚先生育,0,1,0,2022-08-18 08:15:45,来自北京,62703445295,搜别墅
7132845600718603008,有没有想领津贴的？我助您圆梦[呲牙],0,8,0,2022-08-17 22:04:50,来自黑龙江,1442206743011054,不瞧嗟来之咪
7133014231653860111,哪来的生育津贴？,0,1,0,2022-08-18 08:59:19,来自广西,2348989325509696,十三记录美好世界
7133031874150777613,越补贴越低，到时候就傻眼了。,0,1,0,2022-08-18 10:08:10,来自江苏,923209093881998,地球的少年
7133010126877278990,结不结婚都生个娃吧[灵光一闪],0,0,0,2022-08-18 08:43:54,来自安徽,5788470660,非洲印迹
7133026426705511176,你这图有意思[呲牙],0,2,0,2022-08-18 09:46:44,来自广东,58976680122,灵魂孤独的双肩包
7133027904908903175,越来越多的负心汉哦,0,1,0,2022-08-18 09:52:52,来自重庆,2621695035447981,快乐扑克m
7133013020715975439,放心吧，法定结婚年龄一定会改的，女18男20[灵光一闪][灵光一闪][灵光一闪],0,1,0,2022-08-18 08:54:22,来自江苏,1063928364281023,t差不多的先生
7133018166258713351,"现在独身越来越多，有什么更好办法？
原来都想结婚的，后来坚持喝中药调理，还真治好了！",0,3,0,2022-08-18 09:14:51,来自河南,2299776197206611,勇往直前的小猫XP
7133040445093446439,感觉有点乱哄哄的，真的像是机器,0,0,0,2022-08-18 10:41:55,来自上海,6111647851,如梦如戏人生
7132995816540881679,结婚率更低了,0,0,0,2022-08-18 07:47:46,来自天津,3337767158816136,sunming85
7133002346917495585,那上户口哪方的？不要只是生？,0,0,0,2022-08-18 08:14:31,来自浙江,101646068305,夏日雨荷1379
7133036226189607711,这世界快乱套了,0,1,0,2022-08-18 10:24:58,来自河南,109163148371,丹桂飘香986
7133017566754112264,未婚已育在法律层面是否合法？,0,0,0,2022-08-18 09:12:20,来自湖北,105149176726,翰树亭
7133012971621745445,人性的进步。,0,1,0,2022-08-18 08:54:54,来自黑龙江,2260214876998663,澜涛99
7133006413663617826,结婚证已经彻底是废纸一张了,0,1,0,2022-08-18 08:28:50,来自广东,3825106994,韭菜农三代
7133020112965223175,这个户口好上吗？,0,0,0,2022-08-18 09:22:26,来自宁夏,5572546295,苏子卿卿
7133035233884750603,把传统道德底线再一次拉低！,0,0,0,2022-08-18 10:21:44,来自浙江,105530131085,雅香斋主人
7132876623166653218,这是什么规章制度？,0,2,0,2022-08-18 00:06:07,来自江苏,111016060969,惠聚扬州
7133003455442551589,关爱女性，就是关爱我们后代！[玫瑰][玫瑰],0,1,0,2022-08-18 08:18:15,来自江苏,84559525230,菲飞论美学
7133041028809982735,男方生育险必须缴纳， 但是不可以使用， 不可以报销,0,0,0,2022-08-18 10:43:01,来自北京,50981581045,副中心绿地
7133014562273952524,现在就要安排好这些无父子女的尊严如何被社会认可，保护他们的被选举权不受公众歧视。社会造就他们就该对他们负责。,0,0,0,2022-08-18 09:01:14,来自江苏,3993061406812979,雪落缸沿成玉带
7133051468969558824,结婚证早就是废纸一张了,0,0,0,2022-08-18 11:23:36,来自广东,3825106994,韭菜农三代
7133024418670166816,一句话！只要你愿意生娃，一切都好说！,0,0,0,2022-08-18 09:39:21,来自湖北,6471405816,卖酒的星哥
7133025775053882123,越来越觉得还是中华文化，博大精深。还是我们自己的文化好。,0,2,0,2022-08-18 09:45:11,来自河北,5753955875,修身齐家治家
7132998711877223168,难道你不知道上海还有积分落户计划生育一票否决吗,0,0,0,2022-08-18 07:59:05,来自上海,3712420998,天秤在唱歌
7133020377135170341,颠覆了三观。孩子以后问爸爸是谁？怎么回答啊😱,0,0,0,2022-08-18 09:23:28,来自广西,92786426051,洅无少年
7132989151959810829,生育津贴有哪些领过？,0,0,0,2022-08-18 07:22:47,来自贵州,12030326766,招风车
7133023047707591439,未婚已育男性同包为什么没有津贴[流泪],0,0,0,2022-08-18 09:33:29,来自广西,6134102133,梁山驳
7133051036385936163,是谁在把国人的道德底线一再拉低？[酷拽][打脸],0,0,0,2022-08-18 11:21:57,来自陕西,51817978568,热闹柳叶xu
7133005705665102592,没结婚能办准生证？,0,0,0,2022-08-18 08:26:05,来自云南,2740718045,触摸那天堂
7133002293817410345,社会进步的表现,0,0,0,2022-08-18 08:12:53,来自福建,2106318336308524,随波逐流顺势而为
7133026360209261342,那个十二三生小孩的女孩可以领钱了[赞],0,0,0,2022-08-18 09:46:39,来自天津,65891424755,大毛惠
7133008354372862735,政策出台，未来会不会有很多未婚妈妈？,0,0,0,2022-08-18 08:36:35,来自广东,4164575112203223,爱国者1949宁静致远
7132998533623431951,有社会共同抚养，哈哈钱大家一起出,0,0,0,2022-08-18 07:58:18,来自山东,6957629983,浪里白条大白宋
7133013717775631139,早知今日，何必当初呢？想生时候已经没得生,0,2,0,2022-08-18 08:57:09,来自广东,101448779791,常顺308
7132841010224268071,我就想起一个和这个没关系的，一位大哥养了五年的孩子发现不是亲生的，孩子在育儿园呆了三天没人接,1,5,0,2022-08-17 21:47:23,来自甘肃,2268990721506871,因有所欲故有所求
7132880086936290061,那男人自己带孩子有这些补助吗？[捂脸][捂脸][捂脸][捂脸],0,1,0,2022-08-18 00:21:23,来自广东,2647241589785981,无味毒药
7133024979909886724,鼓励未婚先育了？,0,0,0,2022-08-18 09:41:46,来自上海,106592535719,勇者无畏
7133016819882820359,国家已经提倡未婚生育了。只要能生，什么事情都好说,0,1,0,2022-08-18 09:09:27,来自浙江,58761182555,猇狼影视文化
7133014528140673830,非法同居也该取消了,0,0,0,2022-08-18 09:01:17,来自广东,1024390134775476,沈达科技
7133027576401969934,可想而知，现在孩子都少到什么程度了[捂脸],0,1,0,2022-08-18 09:51:15,来自四川,103387379068,巴山宇哥
7133023640106402600,现在都合法了,0,1,0,2022-08-18 09:35:39,来自上海,66844626712,我不看明星
7133027963826094880,生育政策更宽容。,0,0,0,2022-08-18 09:53:26,来自江苏,4834063670,积极的溪流ec
7132996846263468830,不错，男方可以不用给抚养费了,0,0,0,2022-08-18 07:52:25,来自湖北,106873408435,Crystalboys
7133024098586395425,和七八十年代时反过来了，未婚同居合法，未婚生子合法[大笑],0,0,0,2022-08-18 09:38:28,来自山东,88328088500,直爽的好运连连
7133010297023480609,这回，要彻底解放了,0,0,0,2022-08-18 08:45:03,,6972210447,高冷青山Vp
7133035953220469519,就是不生，看最终怎么弄,0,0,0,2022-08-18 10:23:38,来自天津,4734310297,交易与感悟
7133006925432095519,都不结婚了，也不一定对吧,0,0,0,2022-08-18 08:31:20,来自云南,59517781652,鼠标无声
7133002675209552681,结婚确实没意思了。,0,1,0,2022-08-18 08:14:31,来自甘肃,4441674774747646,德才兼备饼干5J
7133003077045207842,不是放得太松，就是管的太严[抠鼻],0,0,0,2022-08-18 08:16:09,来自吉林,50010253269,随风123928422
7133006799711617795,弊利都有，也许是给女生多条选择吧。,0,4,0,2022-08-18 08:31:08,来自陕西,68706621163,率真芝麻
7133035397789762338,听话，照做，你就不会错,0,0,0,2022-08-18 10:21:30,来自江苏,6084828221,非凡百灵鸟EQ
7133036663684530985,以后345678更多了,0,0,0,2022-08-18 10:26:04,来自广西,4375662880626699,金刀庄主
7133004064840991491,男的交生育险有意义吗,0,0,0,2022-08-18 08:20:29,来自福建,3544421480268419,Boom8611
7133020482680619817,让你自由猜测！,0,0,0,2022-08-18 09:23:26,来自河北,620581613735820,知情达理荷叶ru
7133021326390117152,那可不行，从兜里往外拿钱,0,0,1,2022-08-18 09:27:28,来自黑龙江,59352214992,TIGERTWB
7133023267795075874,为了人口啊[捂脸],0,0,0,2022-08-18 09:34:18,来自广东,1134311479452894,流河旱树
7132845726090658564,男的都急了,0,1,0,2022-08-17 22:06:01,来自湖南,7140343061,睿智的下雨天从不打伞
7133000268849562383,缺乏父爱对孩子成长是不利的,0,0,0,2022-08-18 08:05:09,来自北京,3570846065240023,聪颖宇宙Y0
7133018249339601698,太人性化了,0,1,0,2022-08-18 09:14:45,来自安徽,50032876568,将军
7133016254868128547,与时俱进，世界大同！[摸头],0,0,0,2022-08-18 09:07:02,来自山东,99423779145,pgl652
7133042507080467208,见怪不怪了,0,0,0,2022-08-18 10:49:30,来自安徽,5901234269,云云摄影
7133031084451316494,这是要开放了,0,0,0,2022-08-18 10:05:04,来自新疆,5943714187,简单叶子W
7132994165776532260,社会进步。赞,0,0,0,2022-08-18 07:42:20,来自陕西,71642938505,超级玛丽806
7133011636453458692,未婚已育？,0,0,0,2022-08-18 08:50:10,来自陕西,281104019372215,不能承受de生命之轻
7132995098222314240,这个可以有,0,0,0,2022-08-18 07:45:11,来自河南,179960619996620,玉驹66
7133009070713652006,大杂烩一起养[我想静静][泪奔],0,0,0,2022-08-18 08:40:00,来自云南,3949050090229839,直爽小羊VS
7133009435706458894,直接生，简单,0,0,0,2022-08-18 08:41:10,来自山东,76297579408,新纪园林
7133017337846416164,房子卖不动咋办,0,0,0,2022-08-18 09:11:50,来自新疆,92698901204,酷爱赛里木
7133023168277119755,翟山鹰评价的不咋样啊,0,0,0,2022-08-18 09:34:49,来自河南,65933219442,興盛
7133040662492480270,真有办法,0,0,0,2022-08-18 10:42:15,来自山东,107956054528,奇幻荷叶cX
7133002304059425536,支持,0,0,0,2022-08-18 08:12:48,来自广东,1297051354398765,YeSally
7133026497845592839,乱了,0,2,0,2022-08-18 09:47:23,来自江苏,5736894425,蓦然回首62222617
7133020082649268999,无德时代,0,7,0,2022-08-18 09:22:25,来自云南,985622124699742,搞笑大兵
7133007445379023627,门槛没了,0,0,0,2022-08-18 08:33:56,来自北京,55714461772,福筱航
7133040993011974942,挺好支持,0,0,0,2022-08-18 10:43:31,来自河南,3395731517619528,双面魔蟹
7133030509860782882,饮鸩止渴,0,1,0,2022-08-18 10:02:24,来自广东,3065895692277951,火山零一
7133004747954455327,赞👍,0,0,0,2022-08-18 08:22:40,来自湖北,4331700648149667,遇见山雀Pc
7133016638710186788,这个可以有，但还是建议补充一条法律，婚内出轨判处三年有期徒刑，婚内出轨同居判处有期徒刑10年，婚内出轨生子判处无期徒刑；明知对方已婚依旧发展婚外恋判处有期徒刑1年，明知对方已婚依旧同居判处有期徒刑三年，明知对方已婚依旧生子判处有期徒刑10年。,0,0,0,2022-08-18 09:09:10,来自重庆,57174215143,ACG漫游君
7133033703294386944,道德沦丧。。。。。。唉。。。。。。,0,1,0,2022-08-18 10:14:40,来自湖南,3478494736026104,风趣梦儿
7132839939254944543,看来出生率产不忍睹啊,0,22,0,2022-08-17 21:43:08,来自山东,2176661934319099,伤心哲别666
7133031878470337320,此举饮鸩止渴，遗祸无穷。,0,1,0,2022-08-18 10:07:38,来自广东,3065895692277951,火山零一
7133031064146543375,为了生小孩简直拼了啊，以后小孩爹是谁都不知道,0,0,0,2022-08-18 10:04:33,来自广东,106844843132,小一鸣
7133005235509330726,从道理的角度是胡来？,0,0,0,2022-08-18 08:25:23,来自天津,104751970500,千喜498
7132801575646561039,看完了也没看懂，不知所云,0,1,0,2022-08-17 19:13:51,来自江西,3601616007861079,真的好感动5
7133043330363474722,疯了,0,0,0,2022-08-18 10:52:07,来自河北,510594309962348,女足点赞
7133038786871116576,这是不是可以认为是无视道德底线吗？,0,0,0,2022-08-18 10:35:24,来自广东,97607471611,无云可随意
7133035898836353826,陷阱太深，小心,0,0,0,2022-08-18 10:23:10,来自天津,4734310297,交易与感悟
7133026686081549096,先让你们的领吧,0,0,0,2022-08-18 09:47:37,来自山东,101218337765,洒脱山丘j4
7133024617345942313,不择手段了,0,0,0,2022-08-18 09:39:35,来自上海,1416594288029095,老小虎影视
7133009448156676903,"给力！如今想生孩子不想结婚的女人太多了，为了保持我国人口的持续增长，为了中华民族的生生不息，允许不婚生育势在必行！
现在的婚姻，无法给女性带来安全感，但是想生个孩子的女性大有人在！只要人家愿意生、愿意养，就应该大开绿灯，允许单身女性生育。
现在的年轻人，不想结婚的太多了，如果不让单身女性生育孩子合法化，那么我国的人口危机就会提早出现，这可是关乎中华民族存亡的大事情！这可是关乎我国经济发展的大事情！",1,1,0,2022-08-18 08:41:33,来自四川,105662236252,仲景我师
7133010003849724709,之前交过生育保险，但是现在失业了，可以领生育津贴吗？,0,0,0,2022-08-18 08:43:15,来自湖北,443825221025228,潇洒清泉SZ
7132872121793463073,相当于酒驾出事故，保险也理赔的，真是太人性化了，保险太好了[爱慕][爱慕][爱慕][爱慕]！！,0,12,0,2022-08-17 23:49:59,来自辽宁,1081526908894980,用户3031096062325
7133022454615769871,有利有弊，国家政策是好的，但是。。。我不支持未婚先育且得政府支持。,0,0,0,2022-08-18 09:31:03,来自山东,103373377100,用户8374604658100
7133004375512892171,以后还有小三这个定义吗？如果未婚跟已婚男生育？,0,1,0,2022-08-18 08:21:41,来自四川,2444922089643854,用户4960706573890
7132871059077890852,有交医保就有啊，生育险，楼下老兄,0,2,0,2022-08-17 23:44:52,来自广东,100771285965547,用户7959534363659
7133040689260479270,我男的，我都同意，能生能养就可以，其他真没什么好说的,0,1,0,2022-08-18 10:42:40,来自广东,1552962871103523,用户2614531395614
7133017113174246152,可以上户口？,0,0,0,2022-08-18 09:10:59,来自浙江,3183793460215934,智慧喜鹊Qp
7133000798249845507,太乱了,0,0,0,2022-08-18 08:07:58,来自湖北,106791918148,用户6378336535348
7133031258426524419,乱、退,0,0,0,2022-08-18 10:05:55,来自新疆,3843489403785677,用户5428325074735
7133001531883897640,现在是鼓励你生，要是以前计划生育直接抓去打胎,0,0,0,2022-08-18 08:09:48,来自福建,105143025137,cky213
7133031765283095332,这是培育更多的小三,0,0,0,2022-08-18 10:07:45,来自山西,68149993880,服农人民
7133004552453882655,生不生跟结婚证有直接关系吗？想生的，不结婚也可以生，那是女性的自由,0,7,0,2022-08-18 08:22:11,来自上海,102930518778,攻城狮大妞
7133028316160230144,这个政策是为了独生女方便的,0,4,0,2022-08-18 09:53:52,来自广东,92049430320,部分应用不支持
7133014708344767264,笑贫不笑娼的年代,0,6,0,2022-08-18 09:01:49,来自山东,54559592906,老的真快
7133044888446255887,解放思想！,0,1,0,2022-08-18 10:58:05,来自湖北,111235017467,普朗克的小数点
7133029495069737763,你要你生国家就支持，加油使劲生,0,0,0,2022-08-18 09:58:18,来自北京,79273123088,净扯蛋27909221183
7132849284252549891,我就想看未结婚就生了孩子的女人，有多厚脸皮去领这笔补贴,8,5,0,2022-08-17 22:19:45,来自广东,51100355672,小胜纪录
7133017098611622695,[赞],0,0,0,2022-08-18 09:11:11,来自山西,606574969627512,用户3993615610551
7133007524831429380,666,0,0,0,2022-08-18 08:34:01,来自上海,56089600359,手机用户56089600359
