7133073391199863590,天灾什么时候都有。每个人都应注意，不要以身犯险。什么事都是有限度的。,0,0,0,2022-08-18 12:49:21,来自北京,3518885275647627,聪颖火车m3
7133068574893409024,西宁我的第二故乡，祝愿老乡平安度过劫难,0,0,0,2022-08-18 12:29:58,来自河北,64603660942,行者无疆CWN
7133065100789351181,我们这四川还天天高温干旱，河床都干了。,0,1,0,2022-08-18 12:17:02,来自四川,59077174961,跟丫死磕12
7133054422972056358,天佑我中华，不要再多灾多难了[祈祷][祈祷][祈祷],0,0,0,2022-08-18 11:36:02,来自江苏,52148153088,58856989
7133060562124702505,这几年的安害实在太多了，希望其他人都能够平安！,0,2,0,2022-08-18 11:58:58,来自辽宁,836097024730256,幸运3090
7133056107006067496,今年雨水都下到北方了，北方涝南方旱了,0,1,0,2022-08-18 11:41:43,来自山东,51037535835,土口车
7133077293496550177,我这边一连几十天都没下雨，高温持续，昨天好不容易人工降了点雨，比我出的汗都少,0,0,0,2022-08-18 13:04:30,来自湖北,2454587732665672,完美冰淇淋3C
7133057862548325156,天灾难防，青海人民加油[加油][加油][加油][加油],0,1,0,2022-08-18 11:48:38,来自山西,141171602504359,和谐一身
7133055622848725790,山洪无情！向所有救援人员致敬，辛苦了！愿逝者安息，所有失联人员都能够平安！,0,0,0,2022-08-18 11:40:05,来自四川,106165089255,小草7236986440377
7133043792710042382,为什么这几年天灾人祸这么多？[祈祷][祈祷],0,0,0,2022-08-18 10:54:34,来自内蒙古,4204141120848359,极速水滴kK
7133049749959770921,天都没亮，被冲走的是什么人啊，游客能这么早出门吗,0,0,0,2022-08-18 11:17:03,来自湖北,10848332217,聪明的溪水mC
7133054823523894030,山体脆弱，经不起偶然而遇的洪水冲击,0,0,0,2022-08-18 11:37:09,来自陕西,3856736541743287,钟楼传播666
7133061181845127977,我上大学的城市，那里很少有雨的，居然有山洪，愿大家平安！,0,0,0,2022-08-18 12:01:13,来自广西,4471915201,大块随记
7133068608858817319,匀一些雨水到我们这吧！这边旱的很,0,1,0,2022-08-18 12:30:36,来自江西,106571877324,曾赣南脐橙
7133040785725571843,灾害天气没有预警？,0,0,0,2022-08-18 10:43:09,来自北京,99350387893,幽默的雪山飞鹰
7133038936863458063,"多灾多难，唉。
疫情已经够难的了
咋还有这么多磨难",0,0,0,2022-08-18 10:34:56,来自山东,3985052716763135,冬季瓜
7133082834080383759,愿死亡人数不要再增加了,0,1,0,2022-08-18 13:25:32,来自北京,54339205210,快乐李壮实
7133044999620756265,每次看到这样的新闻都忍不住一阵心酸。怎么这么多的天灾人祸呢？,0,0,0,2022-08-18 10:58:35,来自广东,3281421567810591,是秃子总会发光的LHJ
7133040522016391969,西宁今年多灾多难,0,0,0,2022-08-18 10:41:43,来自浙江,3950036182,何以孤独195264735
7133044827574829828,希望大家平安归来，走的人一路走好。,0,0,0,2022-08-18 10:58:45,来自青海,54714506135,星辰144218740
7133078574822900520,对不宜居住的山沟居民移民,0,0,0,2022-08-18 13:08:52,来自江苏,59219103567,灵顺手记
7133056441921176335,预报没有提前下通知吗？俺这里只要天气阴下来，手机短信就爆炸式的连续不断的提醒暴雨洪水做好防洪抗洪抢险,0,0,0,2022-08-18 11:42:56,来自河南,6995491593,云峰123104928
7133052215576822562,愿逝者安息。最近几年灾难越来越多，到底是什么原因，真的是地球发出的危险信号吗,0,0,0,2022-08-18 11:26:33,来自浙江,3470533259430959,情感小满
7133082013913023247,失联意味着害怕啊！,0,0,0,2022-08-18 13:22:07,来自云南,193944314715759,单纯天空h2
7133059925437121295,默哀[祈祷],0,0,0,2022-08-18 11:56:19,来自云南,6057696860,怒江浪子09
7133057383341392681,这是大自然要改善北部地区的生态环境吗？,0,0,0,2022-08-18 11:46:38,来自辽宁,54389563883,空心竹41
7133071361505411870,预警了每个居民都应珍惜自己生命，提高防洪意识才能最好保护自己。,0,0,0,2022-08-18 12:41:16,来自新疆,1764087277299384,逍遥逍遥
7133045599419056937,人生永远无法预料明天和意外哪个先来，珍惜当下的每一天吧。[祈祷],0,0,0,2022-08-18 11:00:58,来自山西,110755753644,无为VV
7133063882330882816,现在灾难真的好多，不知道是新闻曝光更容易还是天气越来越恶劣。,0,1,0,2022-08-18 12:11:39,来自江苏,3218973052121230,优美清泉RXN
7133065354959389481,灾害人人都不想，但愿人人平安。,0,0,0,2022-08-18 12:17:25,来自广东,51655446658,优雅柠檬1e1
7133038569648259844,自然灾害面临，要有防范意识，面对突发事件，首先保护自己，其次救助他人。,0,0,0,2022-08-18 10:34:42,来自宁夏,668965591851102,翌觉50853390409
7133056527774614313,貌似自然灾害很多。,0,1,0,2022-08-18 11:43:16,来自江西,5426252053,往事随风123456OY
7133038232878826277,高温之后的极端天气，提醒大家注意天气变化,0,1,0,2022-08-18 10:32:52,来自四川,57145938644,观澜wNcN
7133059963261633292,涝的涝旱的旱，人类该反省反省自己了！冥冥之中，头上三尺有神灵[祈祷],0,0,0,2022-08-18 11:57:15,来自重庆,64129246267,高兴56111
7133039266397012768,这是干什么啊，旱的旱，涝的涝，要不就持续高温，太难了，老天保佑吧,0,0,0,2022-08-18 10:37:09,来自山东,62031259265,DL姜先生
7133043094651585317,愿大通的朋友平安喜乐,0,0,0,2022-08-18 10:51:26,来自安徽,57613753891,敢问路在何方217685817
7133052371332252448,南方今年多地干旱，雨水都下到想不到的地方了。,0,0,0,2022-08-18 11:27:49,来自山东,98313714675,星海踪源
7133044368042558241,这疫情期间尽量不出处玩为国家添难，生在中国长在中国，应感到自豪对为了遇难人员我不同情但敢到可惜，,0,0,0,2022-08-18 10:56:50,来自湖北,1868817584621171,活泼溪水30
7133074964827521795,这个自然灾害越来越多了[祈祷][祈祷][祈祷][祈祷][祈祷],0,0,0,2022-08-18 12:55:31,来自广东,110234483821,KZH康康
7133076018931417893,今年是南方干旱，北方洪水。,0,0,0,2022-08-18 12:59:13,来自甘肃,91573892628,涅槃永生1999
7133054888082408224,希望失联的人都能活着回来！[祈祷][祈祷][祈祷][祈祷][祈祷][祈祷],0,0,0,2022-08-18 11:37:33,来自青海,105128464399,快乐可乐z
7133039128190747424,这帮人可能前几天也在关注那个新闻，结果……,0,1,0,2022-08-18 10:36:35,来自上海,1468573104744540,上海申花toutiao
7133059251597591336,逝者安息，失联的人平安无事[祈祷][祈祷][祈祷],0,0,0,2022-08-18 11:53:52,来自四川,51640718876,孺子牛99
7133068937864364800,但愿失去了那么多的生命能唤醒相关智能部门的思想，反思洪灾根源，并付诸行动，防止失去更多的生命和财产！,0,0,0,2022-08-18 12:31:24,来自江西,52200868835,一轮明月448
7133057435371356960,雨季还是远离河道,0,0,0,2022-08-18 11:47:37,来自河北,58152235087,-剑飘红
7133066678292038403,这气候异常，南京人工增雨都不够。,0,0,0,2022-08-18 12:23:20,来自江苏,24216081552,大陆好公民
7133080099326804740,太难了 今年 旱的旱 涝的涝 疫情一波又一波,0,0,0,2022-08-18 13:15:40,来自广西,106594687833,奋发阿利森6c
7133043792710042382,为什么这几年天灾人祸这么多？[祈祷][祈祷],0,0,0,2022-08-18 10:54:34,来自内蒙古,4204141120848359,极速水滴kK
7133044797564519203,希望能找到更多的失联者,0,0,0,2022-08-18 10:57:47,来自河南,82541613820,高校江湖很有料
7133044626700944158,[祈祷][祈祷][祈祷],0,0,0,2022-08-18 10:57:33,来自广东,103773051173,龙澜
7133044722964169512,那是个帐篷吗？是旅游者被冲走了？,0,0,0,2022-08-18 10:57:22,来自北京,70102702223,ryanysc
7133044527828992781,这个月已经发生了好几期山洪,0,0,0,2022-08-18 10:57:13,来自广东,6233803804,得意最春风
7133044451836035844,不敬畏自然,0,0,0,2022-08-18 10:57:04,来自河北,5977017978,腊月二十五十二点五十
7133044368042558241,这疫情期间尽量不出处玩为国家添难，生在中国长在中国，应感到自豪对为了遇难人员我不同情但敢到可惜，,0,0,0,2022-08-18 10:56:50,来自湖北,1868817584621171,活泼溪水30
7133044242057921284,此未伏彼又起[祈祷],0,0,0,2022-08-18 10:56:18,来自江苏,3013134232599565,快乐的宇宙lL
7133044393581495055,平安无事失联人员近快找到。,0,0,0,2022-08-18 10:56:12,来自甘肃,108630751876,用户3384438199343
7133044079785100070,早上七点，应该不是消暑玩水的。愿失联者平安。[祈祷][祈祷][祈祷],0,0,0,2022-08-18 10:55:43,来自陕西,55931987171,七彩神仙鱼6
7133044090853819172,河南旱啊,0,0,0,2022-08-18 10:55:33,来自河南,3333345692883479,彩蛋乄有惊喜
7133043996607890215,我滴乖乖,0,0,0,2022-08-18 10:55:28,来自浙江,101535793764,高阳886
7133043908598367012,一边是高温干旱，一边是山洪灾害。自然环境恶化，人类生存面临姚战。,0,0,0,2022-08-18 10:54:38,来自四川,100747871643,牛仔裤好看A
7133044695886316324,🙏🙏🙏,0,0,0,2022-08-18 10:57:53,来自甘肃,6810239043,桥念桥溪
7133043849781986056,极端天气照成的突发性自然灾害，愿失联者平安！,0,0,0,2022-08-18 10:54:34,来自青海,61717368721,王中249978034
7133043825181950733,[祈祷][祈祷][祈祷][祈祷][祈祷],0,0,0,2022-08-18 10:54:20,来自黑龙江,62966881005,用户名昵称不能为空
7133043488958481185,我熟悉的地方。,0,0,0,2022-08-18 10:53:28,来自云南,59011468283,手机用户周纪东
7133043496159642376,愿失联的人平安无事[祈祷],0,0,0,2022-08-18 10:53:17,来自广东,1028794726484173,88070
7133043467328127776,都不会超过40人……,0,0,0,2022-08-18 10:53:14,来自福建,105703057015,李奕萱55888
7133043239267205902,这失联的基本就……31人啊[流泪],0,0,0,2022-08-18 10:52:16,来自青海,52815162182,Mr浪
7133043217930994440,不作不会死，非要去那些危险高的地方,0,0,0,2022-08-18 10:52:10,来自广东,3463070609,wuhaoye1988
7133043301598413608,山里的河道，如果没有本地村民陪同，不要随意下去或是逗留，不熟悉就感知不到危险。,0,0,0,2022-08-18 10:51:50,来自北京,86997836558,有趣的风筝线
7133043094651585317,愿大通的朋友平安喜乐,0,0,0,2022-08-18 10:51:26,来自安徽,57613753891,敢问路在何方217685817
7133042879492457219,很难想象老爷上脚下那么宽深的大通河会被淹没，除非黑沟水库。,0,0,0,2022-08-18 10:51:11,来自安徽,3306763832,农夫与人
7133043005958882083,中华雄起！苍天保佑！,0,0,0,2022-08-18 10:50:47,来自浙江,5722990492,合和天下
7133042997964407567,还是苏州好啊,0,0,0,2022-08-18 10:50:45,来自江苏,3755525112085304,狂庸皇
7133045548873384739,又是不听劝导！？,0,0,0,2022-08-18 11:00:41,来自湖南,64373145052,仁者仁者乐山
7133046781143368448,跟三峡大坝有关系嘛？,0,0,0,2022-08-18 11:05:31,,22419367054,太平洋里的大白兔
7133046707575063330,极端天气注意防范,0,0,0,2022-08-18 11:05:13,来自宁夏,3189005156886366,真诚钢笔zs
7133046634946020133,天灾人祸，哎，什么世道,0,0,0,2022-08-18 11:05:10,来自山东,2686814796912699,幽默橘子eT
7133046361767510823,南旱北涝，沙漠变绿洲，看来预言很准[灵光一闪],0,0,0,2022-08-18 11:04:52,来自北京,1161525705576587,博学多才的露珠Rz
7133046492361311011,多灾多难但愿人人平平安安,0,0,0,2022-08-18 11:04:29,来自广西,976832673874351,奇妙百香果M4
7133046321392960293,"地球多灾多难，有了人类，地球才有了生机盎然，发现研究才知地球古老而伟大…
爱护地球，珍惜地球上所有的生命，与之相命，和睦相伴灬",0,0,0,2022-08-18 11:04:14,来自湖北,1081541851882190,豁达野草
7133046437352473384,[祈祷][祈祷][祈祷],0,0,0,2022-08-18 11:04:10,来自新疆,93009618413,陌颜1995
7133045748937491230,自然的灾害就是人类的灾难，愿大自然不要给我们的人民带来这么多的灾难。[祈祷][祈祷][祈祷][祈祷][祈祷][祈祷],0,0,0,2022-08-18 11:01:50,来自山东,51483319110,用户9953314027610
7133045787512701736,发布基本也只是发布。不采取措施。都一样,0,0,0,2022-08-18 11:01:39,来自山西,54633870498,日出东方中国兴
7133045788653257472,没有应急预案？要提前预防！,0,0,0,2022-08-18 11:01:35,来自河北,100418557800,海草海草1221
7133045664690307871,具体大通哪里啊，有没有人知道[流泪],0,0,0,2022-08-18 11:01:27,来自浙江,85660004385,W11111123
7133045599419056937,人生永远无法预料明天和意外哪个先来，珍惜当下的每一天吧。[祈祷],0,0,0,2022-08-18 11:00:58,来自山西,110755753644,无为VV
7133053480528495394,山洪暴雨太吓人,0,0,0,2022-08-18 11:31:39,来自辽宁,67460854633,热情的怀揣梦想的热心
7133045233277125413,彭州山洪视频也是教育提醒了很多人，这次青海洪灾有没有视频？,0,0,0,2022-08-18 11:00:09,来自四川,1292654628308029,原址但
7133045165375636256,特大事件应在头版发布,0,0,0,2022-08-18 10:59:55,来自广西,59740214024,道燃经典195684112
7133045194945725184,祈祷失联人员有惊无险[祈祷][祈祷][祈祷],0,0,0,2022-08-18 10:59:24,来自广东,8176765880,世家女神
7133045091526263586,第五季冰川期前兆，我觉得。,0,0,0,2022-08-18 10:58:54,来自北京,81238059260,有热闹看
7133044901277336356,唉人在自然灾害面前太弱小了,0,0,0,2022-08-18 10:58:46,来自广西,2480147482550008,低调11人生
7133044827574829828,希望大家平安归来，走的人一路走好。,0,0,0,2022-08-18 10:58:45,来自青海,54714506135,星辰144218740
7133044999620756265,每次看到这样的新闻都忍不住一阵心酸。怎么这么多的天灾人祸呢？,0,0,0,2022-08-18 10:58:35,来自广东,3281421567810591,是秃子总会发光的LHJ
7133044922990920488,敬畏自然之心!,0,0,0,2022-08-18 10:58:21,来自内蒙古,2806122501,海嗨
7133044977403298594,天灾人祸，疫情兹扰人生一世，苦多甜少，望各自珍重,0,0,0,2022-08-18 10:58:20,来自广西,4473280668638199,完美葡萄xo
7133044870339953442,预警很重要！,0,0,0,2022-08-18 10:58:08,来自广东,10820742050,天柱张三
7133044868309697314,愿佰姓们平安？,0,0,0,2022-08-18 10:57:58,来自湖南,106015105087,科技阿萨3x0老来乐
