7133070192871375653,虽然山洪灾害造成的财产损失不是很大，但因山洪灾害死亡的人数占洪涝灾害死亡人数的70%。原因就是在山区和丘陵区居住了过多的人口。没办法，14亿人口，平原比例仅12%。,0,1,0,2022-08-18 12:36:33,来自山东,16644305069,头条用户
7133048684845368079,性质不一样，这边是夜间突发山洪，那个是游客麻痹大意！,0,23,0,2022-08-18 11:12:55,来自甘肃,3392069765,真诚天空KR
7133040105379808004,开心过好每一天，这灾难和明天不知随先到,0,2,0,2022-08-18 10:40:22,来自四川,791271805033774,正能量熊猫G1
7133063940233954078,真是多灾多难,0,2,0,2022-08-18 12:12:33,来自山东,598589394126061,ss初学者
7133081397866414889,多增加防洪工程，50年、100年不遇的防洪设计理念是错误的。不干则已，要干就学习古人建长城的精神，建设永不遇的防洪设施，连敌人都能挡住的防洪设施，否则遇上了就是灾难！建1米是1米！,0,0,0,2022-08-18 13:19:46,来自山西,3698409753550187,太阳石No1
7133057341448602382,说实话，这些年西部因为干旱，很多渠里都没水，也没啥维护，垃圾乱倒，一但洪水来了，河道不畅通，很容易泡水。像山洪这种更加可怕，瞬间洪水峰值到顶，即便河道畅通，也不一定能泄洪。,0,1,0,2022-08-18 11:46:50,来自广东,59069547442,写手碌碌一生
7133064477335143183,"今年这气候。我们国家东北降水出奇的多。现在西北也开始多了起来。然后中部地区全干旱缺水……
这种自然灾害，通过七月十六号去西藏自驾游，看到的非常多，越来越频繁发生……^_^",0,2,0,2022-08-18 12:14:05,来自广东,55988965803,姜帆159797638
7133072466062459689,今年到底是怎么了？,0,0,0,2022-08-18 12:45:00,来自广东,1099142210797198,深漂特穆尔
7133083093434467105,祈祷🙏平安,0,0,0,2022-08-18 13:27:01,来自广东,4374369325,萍39505363
7133039992997741325,珍惜生命，好好活着。愿逝者安息！[祈祷][祈祷][祈祷],0,2,1,2022-08-18 10:39:46,来自河南,54334085232,云淡风清心自然
7133078923390239501,人在自然界面前多么脆弱！愿失联者平安归来！愿逝者安息！[祈祷][祈祷][祈祷],0,0,0,2022-08-18 13:10:27,来自内蒙古,54524252068,还看今朝2
7133054180457104131,极端天气，这年头真不容易，干旱地方变成了雨涝遭水灾，容易遭水灾地方，两个月都不下雨，庄稼干死。吃水都是问题了,0,2,1,2022-08-18 11:34:51,来自陕西,7001689497,lww8
7133040003315286825,年年都有灾害，今年更难了，早的早死，涝的涝死，人类太渺小了？？？愿平安！[祈祷][祈祷][祈祷],0,2,1,2022-08-18 10:39:03,来自黑龙江,3359752246272151,爱家大海8C3
7133071889064739597,这段时间天灾频繁发生，大家要多多注意安生,0,0,0,2022-08-18 12:43:20,来自广东,475459118179176,朝阳似火
7133049049875399465,老天爷去国外收人吧！唯愿失联者都有惊无险[祈祷][祈祷][祈祷],0,17,2,2022-08-18 11:14:10,来自湖北,68822548838,格外甜的猪妈
7133065026633941795,灾难无情，人有情。愿早日恢复正常！,0,1,0,2022-08-18 12:16:13,来自黑龙江,50096343499,墨人堂主人
7133077755352417065,老天在报复人类,0,0,0,2022-08-18 13:05:35,来自安徽,86472857704,柳如烟313
7133055322268615464,可怕的就是死了，找不到尸体，比如唐山烧烤店案件，失踪,0,1,0,2022-08-18 11:38:39,来自北京,91736811353,现代杜莆
7133056152015487756,青海这个降水稀少的地方有山洪确实太少了,0,1,0,2022-08-18 11:42:49,来自河北,59408571213,喜欢黑夜的小猪
7133051244792382243,789月家在山区河流边的请一定注意防范随时提高安全警惕性啊！国家再给力生命是自己的没有从来啊……,0,5,1,2022-08-18 11:22:44,来自四川,5462964696,蝴蝶的尖叫
7133041652495221539,昨天看了几个最近山洪，泥石流的视频，受害者完全有100%几率跑到安全区域，但是不知道怎么回事在那磨磨蹭蹭慢慢悠悠，在她旁边甚至后面的人都跑安全区域没事了，她还在那里……,0,1,0,2022-08-18 10:45:37,来自云南,4186545251433168,汤面好喝
7133061986929672972,灾害无情人有情,0,1,0,2022-08-18 12:05:08,来自云南,1700812793,钒26871400
7133041543031653131,天都看不下去,0,0,0,2022-08-18 10:45:47,来自广东,184370055883597,旋风巨龙王同学
7133046077234119424,阿弥陀佛[祈祷][祈祷][祈祷],0,1,0,2022-08-18 11:02:53,来自上海,5443172837,莲子54834746
7133037195627774720,人爱自然，两者才能和谐共生！环保生活迫在眉睫！,0,1,1,2022-08-18 10:28:28,来自陕西,3941081045273000,上进露珠Sc
7133049065855533835,旱得旱死，涝的涝死,0,17,0,2022-08-18 11:14:56,来自四川,50314664949,精神病重症研究室
7133038987837080354,青海都能发生山洪！气候变化有多大,0,1,0,2022-08-18 10:35:19,来自山东,58639992073,慧眼识玉
7133070631910523662,洪水猛兽袭西宁，青山、青林洪峰至，凌晨四死27人失联，洪峰过去流水坑，人财损失是天灾，治理河流保环境，保护生命最重要。,0,1,0,2022-08-18 12:38:27,来自四川,61112739295,原野小草yu
7133075814421283598,"天灾人祸
无法躲过
我心祷告
平安祥和……大通县挺住[祈祷][祈祷][祈祷][ok][ok][ok]",0,0,0,2022-08-18 12:58:20,来自湖北,95958630318,老雕61883
7133060064835240735,逝者已逝，生者坚强，日子还得过！,0,2,0,2022-08-18 11:57:30,来自山东,3043079403893063,蚂蚁想法
7133041433371575074,大家本想新疆西藏这些地区人烟稀少，疫情会很少，没想到反而疫情更严重。青海山洪有这么多人遇难失联，也说明去青海的游客也不少,0,1,0,2022-08-18 10:44:39,来自河南,65644194598,金石头名
7133073616077865728,算是极端天气吗？,0,0,0,2022-08-18 12:49:31,来自广东,1239869220993551,三弟不一样
7133079203893084969,今年的天气十分特别，历史罕见多加防范。情感生活意义光彩，平安吉祥人民幸福。书作:张正雄。谢谢！！！谢谢！！！,0,1,0,2022-08-18 13:14:21,,2752830070850615,风趣花猫11
7133068673665303308,旱的旱死，涝的涝死！希望当地政府努力救灾把损失降到最低，希望当地民众都平平安安，失联的小伙伴早日回家！,0,1,0,2022-08-18 12:31:08,来自江西,81667581335,一个正经人
7133079439176483596,两个因素都有，全球变暖气候越来越恶劣是肯定的。[中国赞][加油][祈祷][赞],0,1,0,2022-08-18 13:12:49,来自云南,110854482155,喜欢各种健康活动
7133059342391280420,我浙江沿海一带雨都不下，热死了40多度，水库都快干了。,0,2,0,2022-08-18 11:54:37,来自浙江,12816148622,奋斗中的钱钱钱
7133053164211372841,弟弟说昨天晚上都在强险，都没有合眼，也好担心,0,1,0,2022-08-18 11:30:23,来自广东,2985861294853323,良仔说能源
7133065851041350436,咋样预警？咋样撤离？咋样组织？造成这样大的灾害？是天灾，是人祸？愿大家都平安！,0,1,0,2022-08-18 12:19:51,来自陕西,782474756500664,韩稳安
7133063691884446468,祈祷失联的人都能获救[祈祷][祈祷][祈祷],0,1,0,2022-08-18 12:11:30,来自海南,98988474017,期盼来年花带雨
7133044304414622477,预警明显存在漏洞，祈愿27位失联人员能平安归来。[祈祷][心][祈祷],0,2,0,2022-08-18 10:56:14,来自四川,69784709430,銀河風輕
7133057225525822243,天灾无情、人有情，愿救援人员注意安全，再无伤亡，逝者安息！,0,2,0,2022-08-18 11:45:48,来自山西,2225823897885883,快乐的ZYS
7133059585573405474,原失联人员早点找到，灾难面前，安全第一。,0,2,0,2022-08-18 11:55:13,来自浙江,132409891754397,快乐的春风vz
7133080894759420684,大旱之后必有洪水！今年极端天气偏多，出门注意安全！,0,1,0,2022-08-18 13:18:32,来自北京,4230525251227976,晋之南阳
7133070288107569935,现在的自然灾害那么多，还是要做好防范措施！,0,1,0,2022-08-18 12:36:36,来自广东,1754431177636500,百灵鸟春光
7133062694248170270,山洪来势汹汹，愿逝者安息,0,2,0,2022-08-18 12:07:28,来自陕西,57953669376,童年记忆中的老辈们
7133062626674115368,愿逝者安息，愿失联者快些找到[祈祷][祈祷][祈祷]愿无灾无难,0,1,0,2022-08-18 12:06:56,来自四川,92358250626,缘274748781
7133053120754107147,游玩？你在家里游玩？,0,0,0,2022-08-18 11:30:58,来自陕西,25519453219,秋秋秋水伊人
7133071139094135559,臭氧层破坏，沙漠化加重，现代工业化……，人类在发展的同时不能和大自然和谐共生，如果不保护环境，只有越来越糟糕。,0,0,0,2022-08-18 12:40:40,来自山西,633795475417592,奇妙艺术家4f
7133058234512474895,意外来的总是让人猝不及防，让人痛心。愿逝者安息，失联者平安[祈祷][祈祷][祈祷],0,1,0,2022-08-18 11:49:55,来自湖南,655788264403647,搞笑阿龙
7133057753484264207,老天大不公，我们这里久旱无雨热的要命，为什么不能普及各地？非要集中一个区域？天灾害死人。,0,1,0,2022-08-18 11:48:01,来自山西,6966716586,一生有缘11
7133038062699250473,多灾多难，怎么了这是！,0,2,0,2022-08-18 10:31:48,来自内蒙古,6990124499,徐永晨7180
7133070176563921668,希望不要再有更多的人伤亡或失联了！[祈祷][祈祷][祈祷][祈祷],0,1,0,2022-08-18 12:36:57,来自四川,66126659946,鯋鮽餲可楽
7133058071794369320,青海西宁洪灾。来的突然。虽然预警，但是人们还没意识到，危险即将来临户外首先要重现安全！,0,1,0,2022-08-18 11:49:21,来自吉林,51459435185,海上055
7133053875724501774,2022不平凡的一年，多灾多难，疫情，山洪，高温，暴雨，自然灾害频发，祈祷上天，佑护我中华，阿弥陀佛，善哉善哉善哉。,0,1,0,2022-08-18 11:33:30,来自北京,81676704767,宅老头
7133039621004870408,真是一方下雨一方晴，有人欢喜有人愁，,0,2,0,2022-08-18 10:38:16,来自河北,67586062680,博学多才的暖阳c
7133048932577985295,保佑平安[祈祷],0,5,0,2022-08-18 11:13:51,来自湖南,1148328397525855,安邦银黄
7133070162693505803,重庆45度持续好长时间了，能不能把广西的洪水弄到重庆来,0,0,0,2022-08-18 12:36:51,来自重庆,59642341469,彬力食足
7133042103084499723,全力搜寻失联人员，愿上帝保佑他们都平平安安！[祈祷][祈祷][祈祷],0,2,0,2022-08-18 10:47:55,来自广东,5424006188,运筹帷幄海洋abc
7133078935797187340,山洪无情！致敬所有救援人员！愿所有失联人员平安获救！,0,1,0,2022-08-18 13:10:49,来自重庆,1248669362291655,渝丁丁
7133046327398793992,愿逝者安息，失联人员平安[祈祷][祈祷][祈祷],0,3,0,2022-08-18 11:04:00,来自浙江,14970251654,边城牧野清笛
7133078789864932103,"敬畏大自然吧！对比之下人类仍是渺小不堪一击的⋯代价太大了！
记得小时课文：喝令三山五岳让道！我来了！⋯当时太藐视大自然了⋯",0,0,0,2022-08-18 13:10:08,来自内蒙古,110744930661,武陵唱晚
7133060724137902888,山洪无情，救援队辛苦了，保佑老百姓平平安安的[祈祷][祈祷][祈祷][祈祷][祈祷][祈祷],0,0,0,2022-08-18 11:59:33,来自江苏,105052381960,天下百里
7133061767735132968,岁月无情，人有情。向抗险救灾的勇士致敬，！愿逝者安息。[祈祷][祈祷][祈祷],0,1,0,2022-08-18 12:03:37,来自浙江,1610113911634704,自强不息圆满
7133063574553428739,又是山洪 多少起了？ 生命无价,0,0,0,2022-08-18 12:11:33,来自福建,1205493032305303,@小雨
7133081533057385247,哪位大能，人人意识能够扭转乾坤。把大自然的规律稍微改动一下，就不会有这么多的灾害出现了[泪奔],0,0,0,2022-08-18 13:20:52,来自云南,2960346319172796,不凡的不远万里
7133053891876766464,我只想说一句，此处省略两个字！,0,0,0,2022-08-18 11:33:07,来自广西,110634793670,老特拉福德魔神坛斗士
7133082724084515598,有些地方一直没人住，这是有道理的……,0,4,0,2022-08-18 13:25:28,来自北京,55943989905,秦川大弟
7133083044181050145,保佑善良的中国人民。[祈祷][祈祷][祈祷],0,0,0,2022-08-18 13:26:59,来自河南,62870361899,wsw52967
7133070995400721182,大通县路过一次，走青甘大环线的时候，典型的山地沟谷，遇到山洪很危险,0,1,0,2022-08-18 12:39:35,来自北京,59654254730,潇潇木鱼石
7133045542124290851,水火无情！希望失联人员平安无事。[祈祷][祈祷],0,1,0,2022-08-18 11:00:32,来自甘肃,106657000536,西北山泉
7133083076951098149,逝者安息[祈祷][祈祷][祈祷],0,1,0,2022-08-18 13:26:42,来自江苏,77567024184,慢先生慢生活
7133040495504261900,向山洪遇难者表示哀悼，希失联者能幸存，平安无事！,0,1,0,2022-08-18 10:41:49,来自江苏,3104614715764461,智者风景线
7133057685696037664,人类在自然灾害面前显得多么的渺小！逝者一路走好吧！🙏🙏,0,1,0,2022-08-18 11:48:33,来自天津,6086618477,飘落5827253310
7133060626150687495,大雨下到长江流域吧，这些地区又干又热，都快崩溃了,0,1,0,2022-08-18 11:59:35,来自四川,3606016726153421,天师中奖
7133081601927758623,山洪无情，注意防控防灾。,0,0,0,2022-08-18 13:21:02,来自内蒙古,84674463911,贺啓勇1
7133081899462853383,现在网络这么发达了，还是事故不断，可想而知这几千年劳动人民是多么艰难过来的,0,0,0,2022-08-18 13:21:54,来自广东,3131062059539087,快乐的小卉
7133080619881497357,山也不算高，怎么水灾会这么厉害！！？？,0,0,0,2022-08-18 13:17:07,来自河南,105651097212,老D不X
7133052862158111503,天灾防范安全为重，一定要有安意识！,0,1,0,2022-08-18 11:29:03,来自重庆,1249516880137320,谈好耍‘
7133039503224111880,无时无刻不在发生，只看媒体报道与否。出现一例关注度高的，媒体跟风报道一些，大家就觉得多了，其实本来就那么多,0,1,0,2022-08-18 10:37:29,来自湖北,50013922870,嫲姥唬
7133060366347010823,天灾无情！希望能尽快找到失联者，所有人都平安！[祈祷][祈祷][祈祷],0,1,0,2022-08-18 11:58:27,来自云南,60712373332,丘山了亮蛋
7133038812976268036,灾难发生之前就应该搬离，生命第一！！！,0,0,0,2022-08-18 10:35:21,来自云南,61526820334,替天行道之正义使者
7133060012846531365,旱的旱死，涝的涝死，唉…造孽啊,0,0,0,2022-08-18 11:57:02,来自福建,102641229468,Wall_E476
7133071893548237602,今年灾难好多不知是新闻曝光客易，还是天气越来越恶劣,0,1,0,2022-08-18 12:42:44,来自辽宁,3781956534285647,聪颖荷叶cz
7133044797564519203,希望能找到更多的失联者,0,0,0,2022-08-18 10:57:47,来自河南,82541613820,高校江湖很有料
7133039015900611369,天灾太多了，同胞们保护好自己吧，保护好自己就保护好了家庭，不给社会添负担。,0,1,0,2022-08-18 10:35:19,来自浙江,70623328043,何时是归途
7133043849781986056,极端天气照成的突发性自然灾害，愿失联者平安！,0,0,0,2022-08-18 10:54:34,来自青海,61717368721,王中249978034
7133040457059615520,为逝者祈祷，为失联者祈福：愿他们平安归来[祈祷],0,1,0,2022-08-18 10:42:00,来自广东,4359112645,凰鹰
7133044216217273091,呵呵 常年雨水多的地方不下了，雨水少的却淹了 沙漠都成海洋了,0,1,0,2022-08-18 10:56:24,来自江苏,4291521303,正能量ok
7133066863378203404,拿出来建房子三分之一的财力，物力，修整水利也不至于今天这样。,0,1,0,2022-08-18 12:24:03,来自北京,62013532626,同泰众生
7133076994442494728,水火无情，愿逝者安息[祈祷][祈祷][祈祷]，早日找到失联人员。,0,0,0,2022-08-18 13:02:56,来自四川,3646439116771639,爱土豆789
7133081610689905443,灾难面前，安全第一。,0,0,0,2022-08-18 13:20:47,来自青海,110110333502,智者白云Ne
7133056485353095943,该地区爆发洪水少见。向救援者致敬。,0,1,0,2022-08-18 11:43:25,来自河南,106799175698,自驾游6979843979931
7133079237548589828,愿失踪的人员能够安全的活着[祈祷][祈祷][祈祷][祈祷][祈祷][祈祷],0,0,0,2022-08-18 13:12:23,来自青海,2419392613189367,海纳百川
7133062659200533259,雨露均沾该有多好，干旱的干旱，洪涝的涝死，这日子该怎么过？,0,0,0,2022-08-18 12:07:33,来自湖南,51197505310,东方龙说说
7133055825295885087,面对自然灾害，人类是渺小的，大家注意安全！,0,1,0,2022-08-18 11:41:10,来自黑龙江,18026611636,Iliuli
7133060533414527752,今年的山洪水真的多，注意防范措施,0,1,0,2022-08-18 11:59:15,来自四川,2880358533047051,聪明的轮船i
7133038661477974796,自然灾害对人类危害太大了，各部门尽快处理！,0,1,0,2022-08-18 10:34:46,来自河北,50363481502,江水jsHW
7133049901768131335,现在最先考虑的是搜救被困人员，其它原因放一边，人定胜天,0,0,0,2022-08-18 11:18:07,来自上海,1899593012355439,异乡人1l9v
7133060998026150671,干旱的干旱，洪涝的洪涝，到底要怎么惩罚人类啊,0,0,0,2022-08-18 12:00:38,来自江苏,51626093841,工业自动化小蜜蜂
7133052477108306701,这几年灾害得别多，愿大家平平安安。,0,1,0,2022-08-18 11:27:55,来自山东,3703574726975819,善良雪梨1O
7133058064416490279,洪水、地震、疫情！愿大家都平安！,0,1,0,2022-08-18 11:49:58,来自甘肃,3553223750200974,观而望
7133060807432209183,怎么啦？旱，旱死了，涝，涝死了，热，热死了，疫情又泛滥成灾？这天年让人怎么活呀[大哭][大哭][大哭],0,1,0,2022-08-18 12:00:15,来自福建,2203063071017603,飞翔雄鹰gzhx
7133071837743514404,高温、旱、洪水，这灾害咋这么多[捂脸],0,0,0,2022-08-18 12:43:06,来自北京,3897006666,周道说道
7133076552509768478,一定要做好各种自然灾害的预防工作。,0,0,0,2022-08-18 13:01:20,来自河北,6489485003,大漠赏孤烟
7133052391293272872,如今，北方频发洪水，这是怎么了，气候带要迁移了,0,0,0,2022-08-18 11:27:21,来自陕西,413023201661688,农经理
7133082470530057000,生死关头，唯有自救。,0,0,0,2022-08-18 13:23:52,来自吉林,3690188042,长途22152218
7133038057233580834,南方人热死在秋天，北方人浸泡在秋天的雨水里。地球🌐怎么啦？,0,1,0,2022-08-18 10:31:33,来自江西,4477223304,蓝天悠悠41841616
7133037933942031145,当地部门应急响应号召人民群众做好防护措施，确保人民群众的生命安全第一。,0,1,0,2022-08-18 10:31:06,来自广东,4353667054708536,不会使用农具的农民
7133061758805885711,有地方旱，有地方涝，这是怎么了。,0,1,0,2022-08-18 12:03:39,来自湖南,2594460813766943,多彩百香果qK
7133082648301945604,坦白说，人生第一次听说青海发洪灾的。,0,3,0,2022-08-18 13:25:44,来自北京,6974630454,清流里的泥石流
7133039056053224232,到底是肿么了，怎么了,0,1,0,2022-08-18 10:35:37,来自广东,1776403867512557,小c520手机摄影
7133060856137057035,最近天灾接二连三，愿失联者平安。,0,0,0,2022-08-18 12:00:48,来自广东,70763834743,风之冰河
7133068116086735620,还新能源？原因极有可能是因为所谓的新能源引起的,0,0,0,2022-08-18 12:28:39,来自安徽,71230980016,小马哥太帅了
7133042521156322051,应该有40人死亡或失联,0,0,0,2022-08-18 10:49:50,来自青海,58360622306,直爽辰星LU
7133055617849787169,今年水多，水偏，个别地方涝的不行。,0,1,0,2022-08-18 11:40:40,来自山东,105551639603,如一204
7133054184018297630,现在是夏季，大家一定要注意安全啊！[祈祷],0,0,0,2022-08-18 11:34:40,来自天津,2915540920185912,山中的果实
7133067506323211038,西宁偏居青海省东方一隅，省会为什么不设在中部？？,0,0,0,2022-08-18 12:26:09,来自上海,4001820274866936,86八荒六合唯我独尊功
7133048975867429673,最近十年，北方雨水渐多，南方趋旱,0,0,0,2022-08-18 11:14:03,来自云南,86425809484,滇之子511
7133043648564282147,全力 寻找失联人员，[祈祷][祈祷][祈祷],0,1,0,2022-08-18 10:53:21,来自辽宁,8144202820,我是帅帅
7133042628962124577,全力搜寻失联人员，愿上帝保佑他们都平平安安！[祈祷][祈祷][祈祷],0,0,0,2022-08-18 10:50:00,来自广东,5424006188,运筹帷幄海洋abc
7133082668258460420,旱的旱死，涝的涝死,0,1,0,2022-08-18 13:25:52,来自北京,5437819019,小拓GoGo
7133075602084889344,我觉得光伏和风力发电会对地球原有的气流规律产生影响,0,0,0,2022-08-18 12:57:14,来自上海,3509277423858040,顺势而为的sunny
7133057161227305768,安逸不知危在前，居安思危多重要。,0,1,0,2022-08-18 11:45:37,来自浙江,4331728187428974,城实
7133074663726514980,怎么这么严重啊？不知道伤亡怎么样[呲牙][呲牙][呲牙][呲牙][呲牙],0,1,0,2022-08-18 12:53:52,来自安徽,108773470105,进水鑫龙
7133041034011132687,愿逝去的安息，活着一定要保护好自己[祈祷][祈祷][祈祷],0,1,0,2022-08-18 10:43:09,来自四川,19966907063,似水骄阳155288358
7133041111953949454,"旱的旱，涝的涝。还有高温天气。地球怎么了？
平安最重要！",0,1,0,2022-08-18 10:44:05,来自上海,95094646567,汴梁公杂谈
7133039225691702024,安全第一，逝者安息，生者平安！,0,0,0,2022-08-18 10:36:38,来自陕西,3245413696548205,热情的饼干6
7133048076478399235,夏天就是洪水易发，最好不要到山沟里游玩！,0,0,0,2022-08-18 11:11:16,来自湖北,63452200950,墨客观察
7133053679599043361,青海的雨水越来越多,0,0,0,2022-08-18 11:33:14,来自河南,110831363682,涠言
7133050814817927944,愿逝者安息，伤者早日康复！,0,0,0,2022-08-18 11:21:39,来自山东,98648003863,诗意荷叶f8
7133054474838557473,有的地方旱死有的地方洪水泛滥,0,0,0,2022-08-18 11:35:59,来自广东,25289325145,川127590519
7133055910461129508,今年的极端天气真多啊，希望平安！[祈祷][祈祷],0,1,0,2022-08-18 11:41:21,来自重庆,3826733987148183,魔法橘子LD
7133072270221837093,山洪无情人有情。愿逝者安息，失踪人员平安！,0,1,0,2022-08-18 12:44:36,来自广西,2163491972595383,亚聊
7133081546538058535,河湟谷地青海最好的地方。,0,0,0,2022-08-18 13:21:25,来自上海,2273410275875358,进取画板qM
7133047212632376068,每次自然灾害都会造成大部分人没有收入，如果那时候你有个副业该多好？,0,1,0,2022-08-18 11:08:03,来自内蒙古,1486190704863184,成熟云朵73
7133042632955151104,保护自然，保护生态环境，人人有责。,0,0,0,2022-08-18 10:49:22,来自广东,98702026651,独行茶友
7133058832225846055,北极快成宜居带了[捂脸],0,0,0,2022-08-18 11:53:04,来自山西,3161786030492925,匹夫亦有梦
7133081587457737503,太痛心了，死者安息吧[祈祷][祈祷][祈祷][祈祷][祈祷][祈祷],0,0,0,2022-08-18 13:21:13,来自广东,1399013731468877,成熟河流7P
7133048017929798412,哎……旱的旱死、涝的山洪灾害！愿大家都平平安安的吧！,0,0,0,2022-08-18 11:10:47,来自广东,905590115147150,洛洛小小杰
7133055402039984930,[衰]今年真的是太难了，从开年到现在，天灾就一直没停过，这日子什么时候是个头啊，[祈祷]祈求人员平安无事，钱财没了还能再赚，人没了就真的什么都没了,0,0,0,2022-08-18 11:38:55,来自广东,2903150883245086,小黄人敲可爱
7133044079785100070,早上七点，应该不是消暑玩水的。愿失联者平安。[祈祷][祈祷][祈祷],0,0,0,2022-08-18 10:55:43,来自陕西,55931987171,七彩神仙鱼6
7133074627056059148,预案…？应急值班观察人员…？预案,0,0,0,2022-08-18 12:54:09,来自甘肃,4050243503793688,淡定晚风Ae
7133062605031670561,真揪心啊，愿大家都平平安安,0,1,0,2022-08-18 12:07:50,来自河南,2964726396234067,秋木瓜
7133058816522519296,把雨水分给重庆吧,0,1,0,2022-08-18 11:52:13,来自贵州,4498799770733251,孙冰与申冰
7133048069268439822,人人干什么事都应把生命安全放第一位呀？,0,0,0,2022-08-18 11:11:03,来自四川,1715661343564062,正义凛然晚风Wg
7133060894502404897,你们有么有发现？一个事情发生之后，特别是重大事故，相继会报到一些类似的事件，这说明了什么？,0,0,0,2022-08-18 12:01:07,来自新疆,3196983889892459,那就这样吧啊
7133083085528630051,旱的旱死，涝的涝死，以后都是这种极端天气了,0,1,0,2022-08-18 13:26:25,来自湖北,88247681919,jjjjjjjjq
7133044901277336356,唉人在自然灾害面前太弱小了,0,0,0,2022-08-18 10:58:46,来自广西,2480147482550008,低调11人生
7133052458762437417,这是建大型水电站和高楼改变了气候环境,0,0,0,2022-08-18 11:27:28,来自广西,53361975733,强哥1486758
7133056498262950670,大通河也涨水了,0,1,0,2022-08-18 11:43:29,来自陕西,6210486723,青山852
7133038661809701632,大通县很少下大雨，86年我在工作几个月，西宁周边县城。,0,1,0,2022-08-18 10:34:11,来自湖南,5401612942,李四西
7133043938885190431,印象中，西宁除了东关瓦窑沟发过洪水，其他的地方极少发洪水，不知大通发洪水，会不会让小峡的水位抬升？,0,0,0,2022-08-18 10:54:40,来自中国澳门,97556245730,林林35282
7133061665033290527,又是山洪，是不是树砍的太多了？,0,0,0,2022-08-18 12:03:32,来自辽宁,391862804811255,自由帆船n1
7133066863797601036,失踪就是死了，不过就是刚开始不能说死亡，影响不好，哪怕知道死亡了，也要搜救几天后再报出由失踪变成死亡，这是不成文的约定俗成,0,0,0,2022-08-18 12:23:57,来自河南,51059659180,一叶孤舟任逍遥
