7133044452647699234,太痛心了，死者安息吧[祈祷][祈祷][祈祷][祈祷][祈祷][祈祷],0,26,0,2022-08-18 10:56:30,来自辽宁,641767309850032,柏汉看法
7133043835462173451,山洪灾害造成4人死亡，27人失[祈祷][祈祷],0,10,1,2022-08-18 10:54:40,来自辽宁,3153869147219051,风度翩翩的小猫咪01
7133040880717579048,多灾多难！愿逝者安息，愿生者坚强，愿伤者早日恢复健康！逝者安息[祈祷]愿其他人早日回家！,0,10,0,2022-08-18 10:42:33,来自辽宁,641767309850032,柏汉看法
7133044743256720132,意外来得总让人猝不及防，太让人痛心！山洪无情！愿逝者安息，其他失联人员平安！,0,9,0,2022-08-18 10:58:23,来自辽宁,638174487653565,猪小美7478
7133050915728196392,[祈祷][祈祷][祈祷]山洪无情！向所有救援人员致敬，辛苦了！愿逝者安息，所有失联人员都能够平安！,1,596,4,2022-08-18 11:21:24,来自陕西,2590084826406547,秦观鹊桥仙
7133055109080498957,西宁市就是两山夹一沟,15,142,0,2022-08-18 11:38:08,来自山西,95730460836,心何悦
7133059524327523113,瘟疫洪水，今年灾难频发，祈祷平安,1,2,0,2022-08-18 11:54:49,来自浙江,61166193476088,郁哲
7133057538479751936,我们这里树都干死了，茶树，枇杷树，栗子树等抢救不过来了，前天人工降雨了一场，没有用 又是连续大晴天，气温还40度,27,129,2,2022-08-18 11:47:08,来自江苏,83802967327,勇者风铃草
7133051694011089671,青海也有暴雨，太罕见,3,61,0,2022-08-18 11:25:01,来自湖北,4288794477,百味私房菜
7133058094833877799,大自然的灾害都是无情的,2,45,0,2022-08-18 11:50:17,来自广西,1345393324209645,月黑风高小白白
7133048474010469153,现在灾难真的好多，不知道是新闻曝光更容易还是天气越来越恶劣。,35,293,2,2022-08-18 11:12:54,来自重庆,3659594265547119,谁找门庆
7133050933868675880,县城还是乡里？,6,46,1,2022-08-18 11:21:28,来自江苏,51622330783,阿关
7133052255565677319,愿逝者安息，愿失联者快些找到[祈祷][祈祷][祈祷]愿无灾无难,4,173,1,2022-08-18 11:27:22,来自青海,2334952552412840,米粒的一家
7133050095917990695,把雨水平均一下多好，我这里要干旱死了,22,223,2,2022-08-18 11:18:52,来自四川,101987493143,谁是你的谁的谁的谁
7133042803567461124,祈祷西宁平安，百姓平安！[祈祷][祈祷][祈祷],2,5,0,2022-08-18 10:51:04,来自浙江,96625632058,周周
7133051572439221007,真的是旱的旱涝的涝，重庆都要干死了,1,2,0,2022-08-18 11:24:05,来自重庆,6163082222,快乐皮皮虾
7133053326170145566,我们四川好热，好干，好久没下雨了，橘子干掉了，庄稼没收成！唉,3,32,1,2022-08-18 11:31:31,来自四川,109182008335,热情的云朵D3
7133054531876832040,我们这里干旱的不得了,1,4,0,2022-08-18 11:35:28,来自四川,5996339497,牵手与棋74897356
7133049057806697257,今年这天气魔幻得很，全国很多地方干旱热得要死，而这里又遇到特大洪水。,8,171,2,2022-08-18 11:14:12,来自湖北,1363808740182942,五月到七月
7133066954420093704,西北动不动山洪，东南动不动高温[祈祷][祈祷][祈祷],1,2,0,2022-08-18 12:24:13,来自湖南,95806430225,联邦高登-长旺整装-汇亚磁砖婷婷
7133050860271665934,今年的灾害咋这么多，[发怒][发怒][发怒][发怒][发怒][发怒][发怒][发怒][发怒],9,73,1,2022-08-18 11:21:49,来自河北,6322972143,奋斗85257209
7133039680937542404,四川的山洪才刚过去几天，又发生山洪，又有人因此丧生，还有那么多受伤的人，看到好心痛啊！天气热，大家不要去危险的水域纳凉，出行也要注意安全。愿失联的人都平安[祈祷][祈祷][祈祷],4,6,0,2022-08-18 10:39:01,来自四川,1130723149879139,爱生活的饼干SN
7133050490459439883,"灾难面前，安全第一。
生死关头，唯有自救。",1,129,2,2022-08-18 11:20:24,来自河北,17593720291,灋臧辵噵
7133070232708842278,要学点防范知识，祈祷27人平安！,1,0,0,2022-08-18 12:37:04,来自广西,101654975003,悟人生百态7f1z
7133045430354969381,祈祷西宁平安，百姓平安！[祈祷][祈祷][祈祷],1,0,0,2022-08-18 11:00:51,来自江苏,2700870397210046,乐天派天堂雨
7133052905292612360,今年真是多事之秋，接连出现山洪事件，那对父子被困水中的画面还历历在目，又来一个更大的事故，愿没有大的人员伤亡，祝大家都平平安安，健健康康。,2,58,1,2022-08-18 11:29:43,来自四川,81415589771,微笑很甜美
7133081095725220643,但愿灾民平安早日重家园。,0,2,0,2022-08-18 13:18:37,来自湖南,102141326551,正义凛然蛋糕k9
7133052790561620769,打开头条，看到又一起洪灾，心都揪在一起了！“青海西宁”四个字特别扎眼，因为我在青海待了八年，就像是第二故乡，这是近期第二次山洪突发！痛心的死伤，措不及防！这个季节，因为青海大通有很多的沟沟。青海的人都喜欢到各种沟沟壑壑里玩，支起锅灶，悠闲舒适，能在山上待一天。我以前也经常去这样的地方游玩！太可怕了！面对突如其来的洪水，人们有多么无助和渺小！希望不要再有伤亡增加，以后真的要引以为戒！逝者安息！#青海西宁发生山洪致4死27失联#,3,20,2,2022-08-18 11:29:28,来自澳大利亚,2146668934603888,刘宁666
7133068865701610247,灾难无情人有情．希望所有的灾民．早日从灾难中走出来🙏🙏,0,1,0,2022-08-18 12:31:40,来自黑龙江,6319843706,凡人85199611
7133045124887790349,祈祷所有人平平安安,1,1,0,2022-08-18 10:59:43,来自青海,4183691636,夢海忘憂
7133039399750828815,为啥还要往外面跑,5,8,1,2022-08-18 10:36:43,来自陕西,24801283470,安逸火车c9
7133048318695097128,具体地点？,11,26,2,2022-08-18 11:11:27,来自江苏,51622330783,阿关
7133040919514874632,今年咋就这么难呢？天灾的，人为的，愿所有人平平安安就好,2,3,0,2022-08-18 10:42:59,来自云南,53579620673,温柔西柚2u
7133050721125466920,山洪猛于兽啊,1,49,1,2022-08-18 11:20:48,来自天津,303110775912516,绿色梦想123
7133052293708219177,在家乡，以前老辈人挖的大沟大渠好多都被填埋了种上庄家或者盖上房子，等下大雨发大水的时候就知道了，这两年好多庄稼都被水淹绝收,0,10,0,2022-08-18 11:26:49,来自河北,2137080781879688,一丝不苟远山pM
7133050592218071843,天呐，中部干死，西部洪水,3,10,1,2022-08-18 11:20:23,来自安徽,1956777382118551,和田不是玉
7133041938063688479,全国范围的水渠还得继续深挖呀！有的地方干旱，有的地方山洪。奈何地势有高有低，不好统一流动。希望水利能手出招,1,4,1,2022-08-18 10:46:54,来自北京,57687277883,海棠花灵均
7133052392836367111,关键是山沟沟好多农民放牧，夜里突发根本来不及撤吧，况且以前也没经历过这种洪水情况吧，祈祷[祈祷],1,12,2,2022-08-18 11:27:33,来自青海,3056289366154584,青青范范
7133056364120818466,每年夏天这类事件都很多[流泪],2,2,0,2022-08-18 11:42:35,来自安徽,87580001565,紫藤妖娆
7133055889967203105,青海的天气今年真是不同往年了，多雨 潮湿 高温，50多岁了没见过下这么大的雨，山洪多发，暴雨常有。祈愿平安吧！！,0,20,0,2022-08-18 11:41:17,来自青海,95599940197,悠然6145
7133051270973408003,真是惨啊！可恨的山洪对百姓造成了如此大的伤害，处于这样的环境生活不易。自然灾害防不胜防，希望不再出现死伤人员了！[祈祷][祈祷][祈祷],0,34,0,2022-08-18 11:23:27,来自江苏,111292035827,江南烟雨Fie7
7133043331374039840,"2022年8月18日7时03分许，西宁市大通县发生山洪灾害造成4人死亡，27人失联。
愿逝者安息！失踪的人早日回家！
每次都不想看到类似这样不好的消息，唉，心里难受的慌。",0,5,0,2022-08-18 10:52:43,来自河南,93177952968,爱咖啡豆豆
7133066223516615461,希望这样事少发生，尽最大努力找到失联的人,0,8,2,2022-08-18 12:21:23,来自内蒙古,1666482879600968,奋发弗雷德4Q0
7133072400845570856,天灾无情人间有情，愿逝者安息！生者坚强,0,0,0,2022-08-18 12:44:52,来自江西,89203714443,未来的日子123789
7133042363836121859,祈祷西宁平安，百姓平安！[祈祷][祈祷][祈祷],1,1,0,2022-08-18 10:48:53,来自上海,185195644871892,依米花2
7133064243892601632,今年极端天气严重，望上苍保佑我们华夏平安[祈祷][祈祷][祈祷],0,2,0,2022-08-18 12:13:41,来自湖北,9877987516,鱼所欲
7133047979166630667,认真最好防灾，特别是水利部门,7,36,0,2022-08-18 11:11:09,来自浙江,105723181039,晶日头苕
7133049314309964557,这么大伤亡？,3,15,0,2022-08-18 11:15:51,来自陕西,52282658214,老彭148815995
7133048869822317312,青海不是干旱少雨之地吗？,16,22,1,2022-08-18 11:13:33,来自河南,62039687270,frasnkan
7133035492039672588,又爆发山洪，之前不是有了前车之鉴么？怎么还没有预防的意识呢？这悲剧多少年都没上演了！太可惜了！,16,8,2,2022-08-18 10:22:35,来自黑龙江,70807439785,影视挖掘机一号
7133083251765166882,望失联的人都平安无恙🙏🙏🙏,0,1,0,2022-08-18 13:26:56,来自新疆,9717645101,缄默的厚度
7133053983878382350,大西北的气候属于干旱地区，过去能下点雨是很珍贵的，可是最近几年贫瘠的中国大西北居然开始雨量增加了，这应该是好事。中国西北地区气候恶略就是降水很少，植物难以生长，随着降水的增多想办法同步增加水利设施，把天然的水利用起来，不久的将来我国西北地区定会成为富饶、美丽的家园，当那广袤无垠的大地上各种植物茁壮成长，祖国又增添了一幅美丽画卷。,3,17,1,2022-08-18 11:33:39,来自北京,2620847242881564,燕云九洲
7133048460865225511,没说具体地点,2,11,0,2022-08-18 11:12:41,来自广东,1301435422088015,心在遥远vlog
7133081708501107487,现在灾难真的好多，不知道是新闻曝光更容易还是天气越来越恶劣。瘟疫洪水，今年灾难频发，祈祷平安,0,0,0,2022-08-18 13:21:41,来自湖北,4120597801472829,芒果4187
7133082163847234340,四川老家连续40°高温，好像重庆那边44°了，热疯了！但愿分点雨水过去，缓解那边旱情也能缓解这边洪涝,0,0,0,2022-08-18 13:23:23,来自天津,4015888690579208,如是之悦
7133043259781513992,少到大山区旅游，这季节事故多发！愿西宁平安[祈祷][祈祷][祈祷],1,4,0,2022-08-18 10:52:18,来自广东,3871580232,牵挂28840886
7133050680058577664,抓紧搜寻失联人员,0,0,0,2022-08-18 11:20:28,来自陕西,5133090388,林霆
7133059577134383913,愿逝者安息，愿失联者快些找到[祈祷][祈祷][祈祷]愿无灾无难[爱慕][机智][呲牙][呲牙],0,1,0,2022-08-18 11:55:08,来自山西,624981861733424,慢节奏
7133073913550013197,"山洪无情！
致敬所有救援人员！
愿所有失联人员平安获救！[祈祷][祈祷][祈祷]",0,4,0,2022-08-18 12:50:59,来自湖北,4208578288956136,一江秋水111
7133043531517772585,到底怎么了，出生人口本来就少了，现在还不停的出现各种意外。希望剩下的27人安好,0,0,0,2022-08-18 10:52:49,来自广西,3043915794227567,风中梅园
7133082940749398784,山洪无情，人有情，救援人员辛苦了,0,0,0,2022-08-18 13:25:50,来自湖北,78799600624131,车城探店
7133041213200515880,有钱人爱玩，穷人天天上班太苦,2,3,0,2022-08-18 10:43:56,来自广东,729729424951799,信寨之家
7133061329245766440,祈祷平安[祈祷][祈祷][祈祷][祈祷][祈祷][祈祷],0,2,0,2022-08-18 12:01:57,来自河北,97102450471,缘来有你9469
7133049154963522336,"自然灾害面前人民就无法阻挡，天灾人祸，在所难免，天气变得这么炎热，天气反常，自然灾害给人们带来的灾难无法避免的！
祈祷老天保佑青海再也不要山洪暴发人民平安幸福！",0,1,0,2022-08-18 11:15:09,来自湖南,3518027737081774,博学南宫9f9金异彩
7133053075912672034,27人失联……又是三十多个家庭支离破碎[祈祷][祈祷][祈祷][祈祷][祈祷],0,7,0,2022-08-18 11:29:52,来自江苏,52569526342,乖娘游世界
7133052286884152097,自然灾害面前的人民，无法阻挡，天灾人祸，在所难免，为不幸遇难的同胞痛心！,0,3,0,2022-08-18 11:27:41,来自江苏,4117019890037479,20木头人21
7133054053290148644,浙江这边差不多两个月没下雨了。,2,2,0,2022-08-18 11:34:07,来自浙江,50730549805,清风入林则徐徐向前
7133050767049229087,天灾人祸，躲不过。珍爱生命，逝者安息。🙏🙏🙏,0,1,0,2022-08-18 11:21:37,来自辽宁,4406495550906397,用户悦陶
7133081230760952616,我的家乡，大青海平安，失联人员平安[祈祷],0,0,0,2022-08-18 13:19:05,来自贵州,60899884193,心愿lygy
7133080765654975244,太难了，我们这边春季都是雨，夏季和初秋基本干旱又特别炎热，估计冬天又是爆冷。西宁的天气也是意想不到，向已逝者默哀，向救援者致敬！望老天保佑生灵，不要再出现不愉快的事情，福佑中华！,0,1,0,2022-08-18 13:18:17,来自福建,3518060739703671,极速星星AQ
7133040713570501383,[泪奔][泪奔][泪奔]我们这边改山体都要马上种草种树，防止山体滑坡,0,1,0,2022-08-18 10:42:22,来自广西,2576888446586775,啦巴啦巴啦啦能量
7133068732448539433,青海西宁市大通县特大洪水#人类灾难史# #自然#,0,2,0,2022-08-18 12:30:39,来自安徽,3861956469215661,十二少年郎
7133043102339662607,祈祷所有人平安获救🙏🏻🙏🏻🙏🏻🙏🏻🙏🏻🙏🏻🙏🏻,1,0,0,2022-08-18 10:51:06,来自甘肃,276679054329431,醉里挑灯看剑YS
7133080389010637608,这几年青海的雨水多了，防洪意识和能力都要加强,0,0,0,2022-08-18 13:15:58,来自江苏,111584888216,土豆花朵
7133064016616276777,灾难无情，人有情，愿失联人员早日找到[祈祷][祈祷][祈祷],0,1,0,2022-08-18 12:12:20,来自甘肃,109930239484,勇敢的乘风破浪的山雀
7133082648465113896,青海不是干旱少雨之地吗？生态环境越来越恶劣了,0,0,0,2022-08-18 13:24:38,来自山西,25084180748,青瓷如水12
7133068056389288717,大自然的灾难🙏🙏所有的救援人员你们辛苦了☕️☕️☕️☕️☕️☕️☕️☕️,0,1,0,2022-08-18 12:28:16,来自黑龙江,6319843706,凡人85199611
7133068498905383721,大自然的灾害都是无情的,0,2,0,2022-08-18 12:29:45,来自上海,3523259035293197,筱雨6059
7133064070416515851,"今年的天气变化莫测，一会儿是水灾，一会儿是酷暑。我们唯一能做的就是接受事实，尽最大努力保护好自己。
愿西宁凌晨突发山洪的逝者安息[祈祷][祈祷][祈祷]祝愿失联的人快些找到。愿灾难早日过去，愿人们生活富足，愿祖国更加强大，更加繁荣昌盛！",0,2,0,2022-08-18 12:13:15,来自重庆,1029570823205531,温度WD
7133067661235864332,给点水江西，四川谢谢,0,4,0,2022-08-18 12:27:09,来自江西,3576025149350844,柚稚橙熟
7133043848087487264,这个季节出门在外一定要小心点这是台风季节。抬头看看天有下雨迹象就得小心。,1,1,0,2022-08-18 10:55:00,来自福建,101827947062,放大检查
7133043049751593731,愿失联人平安[祈祷][祈祷][祈祷],0,2,0,2022-08-18 10:51:35,来自浙江,3174997554109325,天向
7133064290672165664,今年事怎么这么多 祈祷失联人员活下来,0,0,0,2022-08-18 12:14:08,来自湖南,1201080362336995,Cute小竹
7133083120613819144,我们今年雨都不下[泪奔],0,0,0,2022-08-18 13:26:54,来自江苏,5415798972,爱吃番茄酱的费鱼
7133053805444465447,暴雨，不坏，但下错了地方！,0,4,0,2022-08-18 11:33:24,来自四川,496625961679693,泸州小本
7133062561758479115,今年的自然灾害特别多，愿所有失联人员都能够平平安安,0,1,0,2022-08-18 12:07:05,来自江苏,111533380261,率真心向阳
7133067442314232611,山洪无情人有情，尽快急救排查！,0,2,0,2022-08-18 12:25:35,来自山东,3786368661591229,年过半百奔花甲
7133045967573713694,今年是怎么了，旱的旱死了，水多的地方涝死，都愿平安,0,2,0,2022-08-18 11:02:44,来自甘肃,84359638538,文姐生活
7133079751199376131,山洪无情，人间有情。向所有救援人员致敬！🙏🙏🙏,0,0,0,2022-08-18 13:14:11,来自广东,85048642352,开心5541443982886
7133053874100896552,愿所有失联的人都平平安安，,0,8,0,2022-08-18 11:32:56,来自广西,65616208333,李姐62584
7133078674601575204,山洪无情人有情！致敬所有救援人员！你们辛苦了！祈祷所有失联人员平安！愿逝者安息！[祈祷][祈祷][祈祷],0,0,0,2022-08-18 13:09:54,来自山西,4322890919456014,聪明的麻酱UnX
7133054276617863969,洪水无情人有情，愿参救人员平安[祈祷]愿失踪人员平安[祈祷]逝者安息，一路走好[祈祷]愿逝者家人节哀[祈祷],0,1,0,2022-08-18 11:35:26,来自广西,1494955473511532,洒脱程静
7133062135491887886,又是山洪[捂脸][捂脸][捂脸],0,1,0,2022-08-18 12:05:32,来自江苏,1978747787937411,简单cjh1314
7133048610849440543,无论干什么安全当在第一位！！！,0,2,0,2022-08-18 11:13:02,来自河北,395433010801576,故事小甜
7133044859715896071,明天和意外真的不知道哪一个先来，愿大家的每一次出入都是平安归家！,0,1,0,2022-08-18 10:58:35,来自广东,2189835564220974,叶子的随感
7133066800224371493,这是大通哪里啊[流泪][流泪][流泪][流泪],0,1,0,2022-08-18 12:23:18,来自青海,78356926980,用户昕月蓝殇
7133055154378670888,愿失踪者平安，逝者安息。,0,1,0,2022-08-18 11:37:51,来自新疆,3522460407305214,聪颖喜鹊fr
7133082417913119528,电闪雷鸣的下了一晚上暴雨……,0,0,0,2022-08-18 13:23:53,,54001033873,L舟横野渡
7133038676539654926,青海不是干旱地区么，怎么还会有山洪，太不正常了,0,1,0,2022-08-18 10:34:38,来自北京,729711548326702,枫丹白露May
7133062215158580009,心情真也沉重！愿尽27人员平安！愿逝者安宁！！！🙏🙏🙏,0,1,0,2022-08-18 12:05:23,来自辽宁,72874197462,宛若清荷
7133054383150875433,以前南方洪灾，今年北方洪灾,0,4,0,2022-08-18 11:34:49,来自甘肃,50763955406,巴黎农场的独角兽
7133056015406482206,向灾区受灾人民表示慰问。,0,2,0,2022-08-18 11:41:41,来自内蒙古,93284585152,上进花猫1C
7133079382532997929,死者安息吧，希望失联的平安，辛苦救援人员,0,0,0,2022-08-18 13:12:07,来自安徽,64979350555,A过敏1131
7133069594747126528,灾难无情人有情．希望所有的灾民．早日从灾难中走出来🙏🙏,0,1,0,2022-08-18 12:33:57,来自辽宁,92741996371,可靠明月Qr
7133060469728084751,山洪无情，所有救援人员辛苦了，希望所有人都平安[祈祷][祈祷][祈祷],0,1,0,2022-08-18 11:58:31,来自云南,2401753666423533,秋燕妈妈生活号
7133075534484947720,注意防灾，注意安全[祈祷][祈祷][祈祷],0,1,0,2022-08-18 12:57:16,来自河北,3703583752852960,想去敦煌修文物
7133068436196213512,川渝热的起泡泡，西宁才18度呀，希望自然灾害少点吧[祈祷],0,1,0,2022-08-18 12:29:48,来自四川,50101160411,花花和妹儿
7133076834186593039,救人要紧，先全力搜救，祈祷失联者都还活着！[祈祷][祈祷][祈祷][祈祷],0,0,0,2022-08-18 13:01:59,来自福建,1165949097478855,真诚星辰8M
7133056667990180612,注意防灾[祈祷][祈祷][祈祷],0,4,0,2022-08-18 11:44:36,来自四川,3870733158845726,姐姐关爱
7133055304442348320,看到这样的新闻真让人揪心啊,0,1,0,2022-08-18 11:39:00,来自北京,71640504566,拾言拾语
7133080128074384141,分点雨给四川吧，老百姓吃水都成问题了[捂脸],0,0,0,2022-08-18 13:15:18,来自四川,102539248525,上*^_^*帝
7133050101459272463,永远不知道明天和意外哪一个会先来？珍惜当下的美好！愿逝者安息，失联人员平安！[祈祷][祈祷][祈祷],0,1,0,2022-08-18 11:18:24,来自贵州,93129364249,聪明伶俐的雪妞
7133044103386120998,今年的自然灾害似乎比往年多很多，每次都有生命消失，这是怎么了？,0,1,0,2022-08-18 10:56:01,来自北京,3149468126944136,紫丁香
7133048144715121449,愿逝者安息[祈祷][祈祷][祈祷],0,1,0,2022-08-18 11:10:37,来自江苏,5835683417,王立品
7133062004277084966,把別地方的雨都下到这里来了南方干旱天天40多度高温老天不知怎么了,0,1,0,2022-08-18 12:05:14,来自湖北,96172037274,睿智可乐v8
7133053817599804195,老天爷把雨水均衡一下就好了，我们这边庄稼都干死啦[发怒],0,2,0,2022-08-18 11:32:47,来自安徽,3958661420188487,幸福一家人HS
7133061069374849832,今年灾情怎么这么多？愿逝者安息，失联人员平安归来[祈祷][祈祷][祈祷][祈祷][祈祷]！,0,1,0,2022-08-18 12:00:49,来自江苏,58578843043,涓涓细流x
7133082624012698382,比疫情严重,0,15,1,2022-08-18 13:25:12,来自北京,2977132273996247,自由勇敢的轮船
7133079398492324645,愿逝者安息！始终者平安！,0,1,0,2022-08-18 13:12:41,来自四川,110915432229,微雨燕飞65
7133078594104148777,愿逝者安息，愿失联者快些找到，愿无灾无难。,0,0,0,2022-08-18 13:08:50,来自广东,4875762547118,发财安德里亚4F4
7133049934030390020,灾害面前，人类是多么的渺小，失联大概率是不在了，愿逝者安息[祈祷],0,1,0,2022-08-18 11:18:12,来自安徽,52253861921,阅小海
7133076022215951144,老天爷是旱的旱死，涝的涝死。,0,0,0,2022-08-18 12:58:57,来自陕西,5856603957,淡若烟云68702257
7133057618628903694,天灾人祸呀！一定要敬畏大自然、珍惜资源！其实以前灾难还要多、只是网络不发达、不晓得而已。,0,1,0,2022-08-18 11:47:45,来自重庆,2867946300911469,幽默的可靠潇潇
7133051382596141856,这几年的灾害实在太多了，希望其他人都安全[祈祷][祈祷][祈祷],1,4,0,2022-08-18 11:23:47,来自浙江,2700028394355656,快乐燕子0713
7133061540710384392,旱的旱死涝的涝死这自然灾害太可恶了,0,1,0,2022-08-18 12:03:12,来自四川,94231551835,长耳兔1987
7133055921269965598,且行且珍惜，活着是件最幸福的事情，祈祷所有人都平安度过山洪灾害,0,1,0,2022-08-18 11:41:31,来自广东,105183046535199,夜空娱乐时事
7133053564104098594,这是大通的阿扎呀？我的家乡愿大家都平安[祈祷],0,3,0,2022-08-18 11:31:40,来自青海,4062996788,心如荷风
7133041012200506145,逝者安息！愿失踪人员平安！,0,4,0,2022-08-18 10:43:40,来自河北,54534836308,慈孝行天下
7133040221125542670,愿逝者安息，愿来年风调雨顺！,0,1,0,2022-08-18 10:40:20,来自陕西,6020944232,微笑的甜橙
7133066460142158632,自然灾害不可抗拒,0,1,0,2022-08-18 12:21:46,来自河北,71026398742,林茹88
7133044748633522978,又是去泄洪沟里扎营了吗？啥情况？是游玩的还是？,0,1,0,2022-08-18 10:57:32,来自宁夏,50703012855,天蓝如海啦啦啦啦
7133048575638242051,望平安[祈祷],0,75,1,2022-08-18 11:13:06,来自四川,2296213530215364,菜小兜
7133053468847833894,灾难面前安全第一，希望救援人员都能平安，愿逝者安息[祈祷],0,7,0,2022-08-18 11:32:16,来自天津,2884769141767559,／
7133066928742335266,大自然南水北调了[发怒]高温煎熬,0,1,0,2022-08-18 12:23:32,来自安徽,3188216985821896,朝晖夕阳
7133058836189381417,愿失联的27人平安归来,0,3,0,2022-08-18 11:52:10,来自青海,50593119004,susan坦
7133067920649487116,哎，老天保佑少一点伤亡,0,1,0,2022-08-18 12:28:21,来自四川,105028271874,嘿我是汪小汪
7133048050729681701,天灾人祸、意外不知道哪个会来；祈祷🙏平安,0,1,0,2022-08-18 11:11:03,来自江苏,3144221148057726,用户牧羊人的旅途
7133044907660870440,愿逝者安息，愿失踪者能平安归来[祈祷][祈祷][祈祷][玫瑰][玫瑰][玫瑰],0,1,0,2022-08-18 10:58:12,来自浙江,1842424574655341,爱生活的橙子NJ
7133078237655728931,又是山洪，我的天[祈祷][祈祷][祈祷][祈祷],0,0,0,2022-08-18 13:07:38,来自湖北,52663804567,小样儿144065830
7133076081208951586,大自然的灾害都是无情的，大家祈祷风调雨顺吧！,0,0,0,2022-08-18 12:59:11,来自浙江,2809995756831563,热心暖阳ix
7133080428822463272,那么大雨。。。我们湖北今年却是大旱灾。。。这是怎么了,0,0,0,2022-08-18 13:15:59,来自湖北,53654378988,涂舒丫丫
7133048068731257630,失联的人早点回来，家人在等你们,0,1,0,2022-08-18 11:10:46,来自天津,92752593979,若昔23
7133064982832890664,今年的灾害太多了，防不胜防，还是少出门吧[祈祷][祈祷][祈祷],0,2,0,2022-08-18 12:16:05,来自河北,92340141637,秋韵如歌2
7133041934360216327,有山的地方就别去了,0,1,0,2022-08-18 10:46:55,来自黑龙江,3817151995077550,快乐的枫叶nR
7133043828336034594,今年天灾比较多，都很难，愿逝者安息！愿生者坚强，好好生活！,0,1,0,2022-08-18 10:53:57,来自山东,2731627999143567,立聪堂寿光人民医院店
7133043821029638924,自然灾害难预料，愿逝者安息，祈祷失联人员平安[祈祷][祈祷][祈祷],0,1,0,2022-08-18 10:54:40,来自青海,880028202843086,一笑而过
7133065456705471247,重庆的雨迷路了,0,1,0,2022-08-18 12:17:55,来自青海,111184581195,茅之可
7133061336921408264,好熟悉的地方 20年前在那修高速公路 天佑大通吧 🙏,0,1,0,2022-08-18 12:02:21,来自辽宁,15528481991,沉着西柚n2
7133057524085392141,希望老百姓能够安然无恙！,0,1,0,2022-08-18 11:47:41,来自上海,1690212094,沁芳1128
