7126658943719473927,真正的指环王！前无古人，后也很难有来者……，R.I.P.,32,703,12,2022-08-01 05:58:49,来自广东,97283175376,雨巷生活
7126596366385758988,震惊！！！太突然了,23,105,3,2022-08-01 02:03:09,来自四川,4295832631,篮球三分线
7126742455851991842,NBA名宿比尔-拉塞尔安详离世，享年88岁。比尔-拉塞尔出生于1934年2月12日，1956年参加NBA选秀，首轮第二顺位被圣路易斯老鹰队选中，后来加盟波士顿凯尔特人。比尔-拉塞尔为凯尔特人效力13个赛季，拿到了11座NBA总冠军奖杯，其中还包括一次8连冠，被誉为指环王，是NBA历史上最伟大的球星之一，有着无与伦比的影响力。[感谢][感谢],0,2,0,2022-08-01 11:21:26,来自上海,2608511961271379,萝卜发明家
7126680838435635968,总决赛30分40篮板谁人能破？,2,13,1,2022-08-01 07:22:50,来自四川,7709654239,心海无央6
7126586680060216099,不会吧，真去世了,35,191,2,2022-08-01 01:20:00,来自安徽,2595262217595111,🐮🐴是你吗？
7126683775056200456,"拉塞尔生涯期间成就：
- 11次NBA总冠军
- 5次常规赛最有价值球员（MVP）
- 入选联盟历史25大、50大、75大球星榜单
- 2次NCAA总冠军
- 奥运会金牌得主
- 北美职业体育历史首位赢下2次NBA总冠军的黑人主教练
伟大的传奇，比尔-拉塞尔一路走好。",10,9,0,2022-08-01 07:34:54,来自江苏,1684062943325192,篮球小驿站
7126733519296611106,永别了，篮球之神!!![大哭][大哭][大哭],1,3,0,2022-08-01 10:46:22,来自河南,694490582234056,慧说 心语
7126754640486023936,他到天上和科比一起打篮球去了,2,2,0,2022-08-01 12:08:52,来自辽宁,88192086029,蓝系紫伊
7126683677740090145,拉塞尔的冠军戒指最多的吗,32,89,6,2022-08-01 07:34:37,来自黑龙江,3839141978048420,快乐的我9s6
7126674302480892684,在拉塞尔出任中锋期间，凯尔特人队在10个赛季中夺得9次NBA总冠军，其中包括一个8连冠。,11,192,8,2022-08-01 06:58:39,来自江苏,1970791721221486,听雨565656
7126802285895648011,拉塞尔只不过带着无数的荣誉，去另外一个地方会见他的老朋友们。或许在那边，也有他们钟爱一生的篮球[祈祷],0,4,0,2022-08-01 15:14:10,来自广东,351473631235118,篮球细界
7126665234882183949,"还记得他指着奥尼尔他们说：“one,two, three, four ,I will kick your ass!”",41,285,3,2022-08-01 06:23:16,来自天津,4741473215,zodiac_YU
7126659477520483113,唯一的遗憾是今年没能为凯尔特人的小伙子们颁发比尔拉塞尔杯,3,5,0,2022-08-01 06:00:35,来自北京,58086753018,去国怀忧1
7126667127494624033,老爷子去找他最爱的科比了,2,53,0,2022-08-01 06:30:47,来自河南,52418077370,东方COWBOY
7126599486788485888,指环王走好.以后不知道有谁有资格代替去颁发那个奖杯,11,18,0,2022-08-01 02:11:03,来自福建,102203102654,龙城岁月之融州赋
7126757646853636868,记得当年他对科比说：我80岁了，但我能能打败你。科比说：这个我从不怀疑！但我可以打爆凯尔特人队。 老爷子 走好！,3,12,0,2022-08-01 12:21:04,来自广东,74069446503,深圳华顺宝
7126752086649570081,作为一名NBA资深球迷，我对指环王充满敬意，听到这个消息我太难过了，希望老爷子在天堂继续篮球之旅,2,2,0,2022-08-01 11:59:36,来自江苏,3249795623564254,考一建不难
7126781910847881984,指环王落幕，传奇,0,12,0,2022-08-01 13:54:34,来自广东,6192369242,深圳诗歌
7126672129500267305,传奇永不谢幕！,1,17,0,2022-08-01 06:49:22,来自湖南,1002386493547708,山高路远jf59
7126695029284045575,拉塞尔是谁[捂脸][捂脸][捂脸][捂脸],22,22,6,2022-08-01 08:18:10,来自浙江,440285617205627,香雨浓情
7126731648330646275,上帝需要一个教练带走了拉塞尔老爷爷[流泪],1,4,0,2022-08-01 10:39:16,来自广东,52382247680,完美避风塘
7126685996506465063,"8连冠王享年88岁[玫瑰]
指环王一路走好！",1,5,0,2022-08-01 07:43:29,来自四川,54803170909,如烟144476696
7126682020524540707,记得哪一年总冠军颁发，笑话就是拿着奖杯不给老爷子，弄得气氛有点尴尬,8,55,1,2022-08-01 07:27:20,来自江苏,5745607907,Awentsai
7126680737357054754,13年11冠太强大[赞],1,5,0,2022-08-01 07:22:23,来自四川,7709654239,心海无央6
7126678694848578338,9次NBA冠军🏆，前无古人后无来者啊！,16,66,3,2022-08-01 07:14:32,来自江西,68023188752,江西大表哥Vlog
7126607313305600768,指环王拉塞尔真正的篮球先辈！值得尊敬！,0,13,0,2022-08-01 02:44:01,来自加拿大,63239941834,体育大风暴
7126670232739037960,以后谁颁发mvp?,6,1,0,2022-08-01 06:42:23,来自河南,56798153213,悟1627836
7126707810247262988,传奇谢幕，一路走好[蜡烛],0,4,0,2022-08-01 09:08:20,来自广东,92823507438984,忧郁海底椰
7126719308193481479,七、八十年代，北京体育刊物上讲，拉塞尔轻松一跳就篮板上沿，经常在空中摘下对方的长传球，厉害👍👍,11,19,1,2022-08-01 09:51:24,来自北京,3390499368744456,自由高山ss
7126655887422915339,指环王不愧为人类有史以来最伟大的篮球传奇人物！,0,15,0,2022-08-01 05:48:50,来自上海,97553605140,圆石滩
7126604365682541347,没想法老爷子也走了，找张伯伦单挑去了,3,4,0,2022-08-01 02:31:19,来自安徽,399877080104471,听枫之殇
7126666867036848930,美国体育史上冠军最多的运动员难道不是菲鱼？[what],14,42,5,2022-08-01 06:28:43,来自江苏,6042763421,烟圈里弥漫着丶殇77113760
7126689230403289859,8连冠88岁谢幕[赞][赞][赞][赞][赞],1,4,0,2022-08-01 07:56:27,来自四川,1816843496458445,清新山丘Fr
7126760082431558440,身为一个篮球爱好者，我对比尔拉塞尔表示，真正的悼念，一路走好。😭😭😭😭,0,1,0,2022-08-01 12:29:47,来自四川,2458122365707549,开朗的网友5366
7126694484200506147,篮球运动员88岁很长寿了,2,36,2,2022-08-01 08:15:21,来自浙江,5745975508,海62651466
7126605222071468832,不知道下赛季开始谁来颁发冠军戒指…,5,4,0,2022-08-01 02:40:44,来自山东,510610745859867,彼格大梨✨
7126703144579023657,"NBA传奇指环王
比尔一拉塞尔安详离世，享年88岁。
美国体育史上冠军最多的运动员，NBA历史上第一位黑人教练。
2009年，NBA总决赛最有价值球员奖更名为比尔一拉塞尔NBA总决赛最佳球员奖。
这是对比尔一拉塞尔致以的最崇高敬意！",0,19,1,2022-08-01 08:49:11,来自河北,101749237401,酒酣之际
7126691333695243049,5次MVP，却只入选了3次一阵，这是怎么回事。获得MVP的人难道不是最强的吗，为什么还会入选不了一阵？非杠，只是纯属疑惑。,10,11,1,2022-08-01 08:03:14,来自河南,5165556141,花与树的星空
7126632108219138829,前天看新闻还在说，如果他去世了，谁有资格颁发nba总冠军，没想到，今天就。。。。。,26,106,8,2022-08-01 04:22:32,来自江西,108462661686,睿智欣仔
7126612519271236359,206的人也能活88岁！了不起的老爷子！一代传奇！[赞][赞],0,10,0,2022-08-01 03:07:29,来自湖北,25181074316,Kevinding486
7126674618722812680,乖乖！职业生涯场均得到15.1分、22.5个篮板、4.3次助攻。22.5个篮板真吓人！,23,24,2,2022-08-01 06:59:10,来自浙江,64027125171,致青春205588621
7126721039207318306,瓦妮莎最后会便宜了谁呢？,6,5,1,2022-08-01 09:58:00,来自广东,4133758303215021,星耀唐
7126611139563717416,下次总冠军颁发我猜要么乔丹，要么韦斯特。,46,98,5,2022-08-01 02:59:28,来自广东,2436130676674446,广州中高端全品类货源
7126695566172062499,传奇落幕：8连冠之王享年88岁[赞],10,175,2,2022-08-01 08:19:49,来自四川,7709654239,心海无央6
7126730597187339040,09年改名比尔拉塞尔杯 那第一位获得的是 科比吗,2,8,1,2022-08-01 10:35:04,来自北京,2809982505985870,零八贰泗
7126645800075461416,传奇谢幕 永远的指环王,0,6,0,2022-08-01 05:32:16,,4353680279607725,笃定前行一生无忧
7126604197742904079,不报团有这么多荣誉，稳稳的历史第二人,4,3,2,2022-08-01 02:31:11,来自辽宁,57343278898,O旺旺小铁饼O
7126624481258390313,以后谁会颁发冠军奖杯[祈祷][祈祷],23,56,3,2022-08-01 03:50:10,来自甘肃,3056251783088531,vincesilent
7126606976775619369,那以后谁来颁发总冠军奖杯,1,1,0,2022-08-01 02:42:33,来自江苏,1832226268,西门庆
7126598746879640355,又一位传奇谢幕了，指环王一路走好,0,410,3,2022-08-01 02:08:06,来自福建,22325223563,麻辣甲鱼
7126676526325777189,老爷子一路走好，前几个月还颁发总冠军奖杯呢，永远的指环王,2,6,1,2022-08-01 07:06:21,来自天津,22567347026,小车呼啦啦
7126677697740686091,今年金州勇士夺冠，冠军都是自己拿的。没有重量级的人物到场颁奖。NBA总裁也没见人，现在比尔拉塞尔又离世了。,5,14,3,2022-08-01 07:12:02,来自上海,50835865961,寻找豆浆的那根油条
7126605181198107399,一个时代的结束，老爷子一路走好[祈祷][祈祷][祈祷],26,167,8,2022-08-01 02:38:42,来自湖南,3533980474,劳资的加特林是碟刹
7126626058535224102,这就像当年科比去世一样，让人震惊、惋惜[祈祷][祈祷],19,28,2,2022-08-01 04:03:02,来自云南,53366573292,梧桐与鱼
7126769813221098272,再见，科比，比尔。[流泪][流泪][流泪][流泪][流泪][流泪],0,1,0,2022-08-01 13:08:23,来自贵州,94816072998,爱音乐中卫2N8
7126671770224575243,"库里本赛季拿下生涯第一座
AFMVP（科比．布莱恩特）
同时荣获生涯第一座
FMVP（比尔．拉塞尔）",7,8,1,2022-08-01 06:49:14,来自北京,86359548710,齊天大聖歸來兮
7126605945450578720,最欣赏科比的老爷子也走了。[祈祷][祈祷][祈祷],2,65,1,2022-08-01 02:43:32,来自福建,106150147072,听风的歌j
7126777799339590404,指环王去了，以后谁来颁奖呢,0,0,0,2022-08-01 13:39:19,来自河南,67815591671,奶爸阿涛
7126852303113536296,今天就是八月一日！ 希望这位人能在天堂过得一切安好。,0,0,0,2022-08-01 18:27:48,来自广东,1107909610574734,科比老大的科粉
7126850267563311904,比尔拉塞尔再见了，希望你和科比打球愉快[流泪][大哭],0,1,0,2022-08-01 18:20:29,来自广东,3337764999018670,NBA我爱你们
7126675106680095503,拉塞尔的冠军戒指最多的吗,3,16,1,2022-08-01 07:00:35,来自安徽,92770763747,老苏来也
7126739730359763750,可能比尔拉赛尔去天堂重新开始他的篮球之路吧！,0,1,0,2022-08-01 11:11:28,来自浙江,2603239828628992,博响
7126710885678646028,身为一个篮球热爱者，我比尔拉塞尔表示真诚的悼念，一路走好![流泪][流泪][流泪],0,20,0,2022-08-01 09:20:01,来自四川,2946316756583319,因爱而甘拜下风
7126615948794037022,今年没来颁奖就知道身体肯定出问题了，没想到这么快走了，传奇一路走好！,6,45,4,2022-08-01 03:19:45,来自浙江,3101726182,生命的练习生
7126712913355752223,谁的青春谁小时候看过他打球,1,0,0,2022-08-01 09:27:17,来自河南,4184712358,giao霖
7126652321098072835,谁的青春又没了？,3,10,0,2022-08-01 05:35:47,来自广西,99642724459,玉哥在成长
7126754171491566339,米切尔不是顶级巨星，但是公牛这筹码想撸米切尔估计也是做梦。,1,0,1,2022-08-01 12:07:55,来自安徽,6102538341,我乃隔壁老高
7126645658437927693,？什么时候走的？,3,2,0,2022-08-01 05:08:59,来自广东,55760339174,翡翠捕猎者
7126730531538420491,科比走了，那是谁的青春没了，这次又是谁的青春逝去了,0,2,0,2022-08-01 10:34:54,来自云南,58612461641,头号小黑子ikun
7126637447907279646,打暴四大传奇中锋的人走了！！！！！,14,46,4,2022-08-01 04:39:27,来自山东,3962271717930061,正义凛然艺术家oN
7126638349720519428,88吉利且吉祥的数字，比尔-拉塞尔 指环王NBA的一代传奇巨星！愿在天堂那边依然还有篮球相伴！向传奇致敬！,0,6,0,2022-08-01 04:42:03,来自广东,430621089859088,我的频道我的观点
7126700207290876679,英雄来了又走，传奇永不谢幕。,0,1,0,2022-08-01 08:38:15,来自北京,3466122348469128,博学多才的多拉格
7126749902893695744,我还是比较关心瓦妮莎下一步的情感问题，她毕竟才40岁啊[酷拽],2,2,1,2022-08-01 11:50:22,来自山东,110121906695,谦虚低调的牛人
7126773676506465027,唉！记得当年去美国跟肯尼迪谈越南战争的事，他们邀请我观看一场篮球赛。拉塞尔这个小伙子赛后找我合影。时光荏苒，弹指一挥间，江河依旧，满目故人坟丘,0,2,0,2022-08-01 13:23:29,来自江西,2757224855515757,理想是好吃懒做
7126730773041775372,这么说吧，有的人质疑拉塞尔那个年代竞争太少，那为什么是他而不是其他人取得这么高的成就？说上古时代的人放到现在取得不了什么成就的，你要想想，以他们的身体天赋，加上现在更系统的训练，更好的医疗条件，更科学的饮食，甚至球鞋都要好得多，放到现在会是什么样，约基奇和恩比德还顶不动暮年霍华德和小加呢[捂脸][看],1,5,1,2022-08-01 10:35:46,来自重庆,87250048384,进击的腹黑呆
7126593032644477730,远古巨星，真正的凯尔特人啊!致敬传奇![惊呆],1,17,1,2022-08-01 01:46:07,来自江西,6322079635,热爱myself
7126685288935736076,一代传奇，就此陨落，享年88岁,0,9,0,2022-08-01 07:40:50,来自甘肃,106765682720,小皇帝5FiV
7126606929572938536,下次总冠军奖杯谁来颁发?,42,23,5,2022-08-01 02:42:10,来自浙江,50002449586,花式摔帽张大彪
7126697387917591337,远古巨星，真正的卡尔特人致敬传奇。,0,2,0,2022-08-01 08:26:43,来自黑龙江,105861237053,月儿弯弯赵53
7126732916579058472,"""指环王""一路走好[大哭][大哭]
科比也一路走好[玫瑰][玫瑰][玫瑰][玫瑰][玫瑰][玫瑰][玫瑰][玫瑰]",0,1,0,2022-08-01 10:44:05,来自浙江,102065154865,徐梓翔的保镖老二
7126679102605722383,作为一名80后，虽然没有看过老爷子的比赛，但是NBA直播画面中经常看到老爷子的身影，科比去世，看到老爷子留下的泪水，铁汉柔情，11枚总冠军戒指，那个年代可以单防住张伯伦的男人，一路走好,0,25,0,2022-08-01 07:15:51,来自山东,3526831687864624,壹个人的一生
7126646975251989260,以后谁来颁发总冠军戒指？,16,25,4,2022-08-01 05:15:30,来自黑龙江,60522074978,刘佳
7126737695003050790,拉塞尔老爷子您的事迹将会永存您的精神也将会永存希望您安安稳稳地走去老爷子一路走好！[玫瑰][玫瑰][玫瑰][玫瑰][玫瑰][玫瑰],0,1,0,2022-08-01 11:03:37,来自湖南,109321269800,聪明的豆花jv
7126854491630109447,拉塞尔太值得尊重了，但是也确实没啥难过的。88岁安详的死去，怎么说也算喜丧了。还是为这位伟大的球星鞠个躬，谢谢您为篮球带来的一切。,0,0,0,2022-08-01 18:36:42,来自北京,2902446626,炙热雪人
7126680418023375648,"最大的欣慰是今年看见老东家又一次进去总决赛
最大的遗憾就是没看见老东家夺冠！
最最欣慰的就是，摆脱肖华自己亲自颁发总决赛奖杯🏆",0,1,0,2022-08-01 07:22:09,来自北京,5190506310,傲狼50137846
7126640915724616448,以后只能老詹有资格来颁发总决赛fmvp了[祈祷][祈祷][祈祷],7,8,8,2022-08-01 04:50:50,来自江苏,50344446856,娱乐圈没有底
7126731196067463949,独星何止十一冠 世间再无指环王,0,15,0,2022-08-01 10:37:28,来自广西,71645037549,三岁隔扣莫兰特
7126736859610219301,"拉塞尔生涯期间成就：
- 11次NBA总冠军
- 5次常规赛最有价值球员（MVP）
- 入选联盟历史25大、50大、75大球星榜单...全文",0,0,0,2022-08-01 10:59:21,来自广东,2137923020663127,创意溪流0G4
7126679508526711587,人类历史上每一位天才和卓越成就者的离世都足以令我动容，我们人类的历史如同乐章，你我众生也许像乐曲和声一般必不可少，但他们是最能代表时代的旋律和强音，他们逝去了，如同最后的余音消散，尽管乐曲仍然奔流向前，但却再没有此等绝响了,3,14,1,2022-08-01 07:17:48,来自浙江,6455647388,布特格勒213
7126610712897782531,看到“安详离世”这四个字，在伤感的同时带有些许慰藉，老爷子一路走好！,0,8,1,2022-08-01 03:03:19,来自广东,3783349379,冉小予
7126693409179632425,前无古人，后无来者比尔一拉塞尔传奇落幕，愿一路走好,0,6,1,2022-08-01 08:11:22,来自广西,91687029676,彬彬9563
7126695685009294083,比尔的职业生涯中，他获得的奖项是前所未有的。2009年，NBA总决赛最有价值球员奖更名为比尔-拉塞尔NBA总决赛最佳球员奖,0,2,0,2022-08-01 08:21:08,来自山东,77984296169,微笑可乐jR
7126783179196826405,指环王一路走好，R.I.P.！传奇落幕，以后总冠军颁奖典礼再也看不到老爷子了,0,1,0,2022-08-01 13:59:56,来自北京,53095654859,LouisLuu
7126691293870752546,没有重量级的人物到场颁奖。NBA总裁也没见人，现在比尔拉塞尔又离世了。,0,1,0,2022-08-01 08:03:10,来自浙江,3113473071129976,桂子情感生活
7126680683896308515,指环王一路走好[握手],0,4,0,2022-08-01 07:22:07,来自四川,7709654239,心海无央6
7126764208775332639,"8连冠，总共11个冠军，活了88岁。
拉塞尔：人生就是一道算术题！",0,2,0,2022-08-01 12:46:15,来自陕西,4314111515041964,蓝5186
7126585928462271244,拉塞尔老爷子一路走好。,0,40,0,2022-08-01 01:19:56,来自山东,101256972995,KRONS
7126691051200791311,一代传奇谢幕,0,5,0,2022-08-01 08:02:14,来自贵州,1922374028507432,聪明的橘子9C
7126689551330444045,在拉塞尔出任中锋期间，凯尔特人队在10个赛季中夺得9次NBA总冠军，其中包括一个8连冠。,0,1,0,2022-08-01 07:57:01,来自甘肃,3474054102918724,用户天水清茶
7126686321720345383,拉塞尔算是NBA的开拓者[赞]伟大,1,5,0,2022-08-01 07:44:59,来自四川,54803170909,如烟144476696
7126685987337896736,一代传奇就此陨落享年88岁,0,0,0,2022-08-01 07:43:47,来自甘肃,106765682720,小皇帝5FiV
7126708264850572043,传奇球星，一路走好！,0,0,0,2022-08-01 09:09:46,来自广东,95648530568,德才兼备小羊4z
7126779689171239712,颁奖该是乔丹了,0,0,0,2022-08-01 13:47:00,来自河南,93121770311,元鼎办公耗材
7126708349940794145,前无古人，后无来者比尔一拉塞尔传奇落幕，愿一路走好。,0,4,0,2022-08-01 09:10:13,来自安徽,101877377034,6零后老许
7126715833459606310,一代传奇终落幕，老爷子还是姚明进名人堂的引荐人。。。哎[祈祷][祈祷][祈祷],0,0,0,2022-08-01 09:39:00,来自广西,94318333967,永远的大虫
7126764659898073897,拉塞尔是一个传奇，前无古人后无来者[赞],0,1,0,2022-08-01 12:47:39,来自贵州,5978512484,小木易74044572
7126736567955768095,公牛要三个得分后卫干什么？,0,6,0,2022-08-01 10:58:19,来自北京,92657720845,windmap2018
7126708197163303688,NBA传奇一路走好,0,0,0,2022-08-01 09:09:18,来自湖北,902030192288888,极客克里2U8
7126797464560698149,再也没有他来颁总决赛MVP🏆了 一路走好 名宿,0,0,0,2022-08-01 14:55:41,来自广西,97608718791,王子公园球场的潘帕斯雄鹰
7126735944719467276,真正的传奇 指环王谢幕,0,0,0,2022-08-01 10:55:52,来自北京,14045946020,和顺六条
7126678230086009600,迟暮之年，一代传奇[祈祷][祈祷][祈祷][祈祷][祈祷],0,6,0,2022-08-01 07:12:48,来自辽宁,2630506346725134,猫猫3109
7126705243979121443,9次NBA冠军🏆，前无古人后无来者啊！,0,1,0,2022-08-01 08:57:12,来自安徽,111551505965,随遇而安1332900
7126741807911813899,职业运动员能这么长寿，已经很少见了！,0,5,0,2022-08-01 11:19:38,来自山东,3060656649284791,周五老公
7126702142773117696,又一位传奇谢幕了，指环王一路走好,0,1,0,2022-08-01 08:45:00,来自重庆,73308272835,强哥67702
7126730075743159047,拉塞尔一路走好,0,2,0,2022-08-01 10:33:04,来自福建,3073830100674407,秦暮铭
7126769711182218023,不止比尔还有科比祝比尔和科比死而复生。,0,0,0,2022-08-01 13:08:04,来自贵州,94816072998,爱音乐中卫2N8
7126719728701686532,老爷子一路走好，nba值得尊敬的人,0,0,0,2022-08-01 09:52:59,来自河北,1415767905287524,村里来的小伙1
7126769635798139660,作为运动员，高强度消耗身体这么厉害，而且又是两米多的巨人，能活到这么高寿，已经是很大的福报了，篮球运动员，身高太高又过度消耗身体，很难达到拉塞尔这样的圆满,0,1,0,2022-08-01 13:07:49,来自山东,51313106427,孤阳残影21
7126675228012610315,一个伟大的传奇中锋落幕—致敬比尔-拉塞尔,0,12,0,2022-08-01 07:01:52,来自安徽,20717240957,造车jiang
7126746187008606983,NBA指环王比尔拉塞尔安然离世，一代传奇就此落幕！,0,0,0,2022-08-01 11:36:22,来自云南,60712373332,丘山了亮蛋
7126772809170207501,他是乔丹的偶像，乔丹的很多拉杆动作都有拉塞尔的影子。,0,0,0,2022-08-01 13:19:27,来自北京,954022778377851,sheepper
7126693409179632425,前无古人，后无来者比尔一拉塞尔传奇落幕，愿一路走好,0,6,1,2022-08-01 08:11:22,来自广西,91687029676,彬彬9563
7126695685009294083,比尔的职业生涯中，他获得的奖项是前所未有的。2009年，NBA总决赛最有价值球员奖更名为比尔-拉塞尔NBA总决赛最佳球员奖,0,2,0,2022-08-01 08:21:08,来自山东,77984296169,微笑可乐jR
7126783179196826405,指环王一路走好，R.I.P.！传奇落幕，以后总冠军颁奖典礼再也看不到老爷子了,0,1,0,2022-08-01 13:59:56,来自北京,53095654859,LouisLuu
7126710065306387239,老爷子前无古人后无来者，指环王👑,0,0,0,2022-08-01 09:17:01,来自内蒙古,104227875864,正大光明1000
7126691293870752546,没有重量级的人物到场颁奖。NBA总裁也没见人，现在比尔拉塞尔又离世了。,0,1,0,2022-08-01 08:03:10,来自浙江,3113473071129976,桂子情感生活
7126723231532761860,永远的“指环王”安息！[祈祷][祈祷][祈祷],0,0,0,2022-08-01 10:06:36,来自山东,84535419475,独自等待msIq
7126764208775332639,"8连冠，总共11个冠军，活了88岁。
拉塞尔：人生就是一道算术题！",0,2,0,2022-08-01 12:46:15,来自陕西,4314111515041964,蓝5186
7126585928462271244,拉塞尔老爷子一路走好。,0,40,0,2022-08-01 01:19:56,来自山东,101256972995,KRONS
7126836658964005639,指环王一路走好！传奇用不落幕！,0,0,0,2022-08-01 17:27:38,来自陕西,50421140985,雷神07
7126777055471223556,一代传奇落幕 一代传奇正在创造历史,0,0,0,2022-08-01 13:36:24,来自广东,5979408136,TanYming
7126691051200791311,一代传奇谢幕,0,5,0,2022-08-01 08:02:14,来自贵州,1922374028507432,聪明的橘子9C
7126758331049788160,"名誉和能力都是名至实归！这些总冠军戒指是前无古人后无来者！
想问问绿军会不会降半旗怀念！",0,0,0,2022-08-01 12:23:04,来自广东,50401509626,MO_The_one
7126689551330444045,在拉塞尔出任中锋期间，凯尔特人队在10个赛季中夺得9次NBA总冠军，其中包括一个8连冠。,0,1,0,2022-08-01 07:57:01,来自甘肃,3474054102918724,用户天水清茶
7126685987337896736,一代传奇就此陨落享年88岁,0,0,0,2022-08-01 07:43:47,来自甘肃,106765682720,小皇帝5FiV
7126708264850572043,传奇球星，一路走好！,0,0,0,2022-08-01 09:09:46,来自广东,95648530568,德才兼备小羊4z
7126742473925264161,走好，最伟大的传奇,0,0,0,2022-08-01 11:22:17,来自广西,63669793941,竹树开花不结果
7126779689171239712,颁奖该是乔丹了,0,0,0,2022-08-01 13:47:00,来自河南,93121770311,元鼎办公耗材
7126708349940794145,前无古人，后无来者比尔一拉塞尔传奇落幕，愿一路走好。,0,4,0,2022-08-01 09:10:13,来自安徽,101877377034,6零后老许
7126715833459606310,一代传奇终落幕，老爷子还是姚明进名人堂的引荐人。。。哎[祈祷][祈祷][祈祷],0,0,0,2022-08-01 09:39:00,来自广西,94318333967,永远的大虫
7126764659898073897,拉塞尔是一个传奇，前无古人后无来者[赞],0,1,0,2022-08-01 12:47:39,来自贵州,5978512484,小木易74044572
7126736567955768095,公牛要三个得分后卫干什么？,0,6,0,2022-08-01 10:58:19,来自北京,92657720845,windmap2018
7126708197163303688,NBA传奇一路走好,0,0,0,2022-08-01 09:09:18,来自湖北,902030192288888,极客克里2U8
7126712702445830952,这老爷子 指环王 也算一个传奇了,0,0,0,2022-08-01 09:26:15,来自黑龙江,3857545279584216,妖怪来了l
7126797464560698149,再也没有他来颁总决赛MVP🏆了 一路走好 名宿,0,0,0,2022-08-01 14:55:41,来自广西,97608718791,王子公园球场的潘帕斯雄鹰
7126735944719467276,真正的传奇 指环王谢幕,0,0,0,2022-08-01 10:55:52,来自北京,14045946020,和顺六条
7126678230086009600,迟暮之年，一代传奇[祈祷][祈祷][祈祷][祈祷][祈祷],0,6,0,2022-08-01 07:12:48,来自辽宁,2630506346725134,猫猫3109
7126705243979121443,9次NBA冠军🏆，前无古人后无来者啊！,0,1,0,2022-08-01 08:57:12,来自安徽,111551505965,随遇而安1332900
7126741807911813899,职业运动员能这么长寿，已经很少见了！,0,5,0,2022-08-01 11:19:38,来自山东,3060656649284791,周五老公
7126702142773117696,又一位传奇谢幕了，指环王一路走好,0,1,0,2022-08-01 08:45:00,来自重庆,73308272835,强哥67702
7126730075743159047,拉塞尔一路走好,0,2,0,2022-08-01 10:33:04,来自福建,3073830100674407,秦暮铭
7126769711182218023,不止比尔还有科比祝比尔和科比死而复生。,0,0,0,2022-08-01 13:08:04,来自贵州,94816072998,爱音乐中卫2N8
