7126692711213728512,"妻子二舅也是二舅
没有不妥
何必深挖神挖？
人家中心思想反映正能量，有何不妥？",2,14,2,2022-08-01 08:08:41,来自浙江,1604936908935835,微信WWW
7126779227038958373,我觉得没毛病，妻子的二舅丈夫也叫二舅，我就经常去我媳妇的姥姥家，她大舅每次都管饭还叫大姨三姨小姨和姨夫[我想静静][我想静静][我想静静]大家关注的不是残疾原因，而是残疾后的积极努力向上！残疾证办理的时间也不是重点，而且信息源自二舅的记忆，作者可能存在艺术加工！大家关注的也不是二舅实际生活情况，而是二舅对姥姥的孝顺，对邻居的帮助！我觉得与其说虚构不如说艺术加工！也的确给大家带来了对过往生活的释然，对未来美好生活向往！,0,1,0,2022-08-01 13:44:56,来自山东,3096338221,小魏拉呱
7125074020622009103,敬佩二舅，今天看了三遍，感受很深,1,3,0,2022-07-27 23:27:44,来自陕西,80065278635,好多人哦
7126773294224950024,还有，我这个亲戚的病按实上报药量，国家按季度发。去年一年，他们所在的社区医院就发给他五瓶，打电话一问，就说快呀，就是不发。傻子也知道，一年五瓶哪儿够？请问：据实上报发的药哪儿去了？,0,1,0,2022-08-01 13:21:38,来自内蒙古,62606522001,梅子220365346
7125021250107720452,只能说经历过那个年代的大舅、二舅们都差不多，那些年很多人都会多样手艺，尤其农村因为物资匮乏，经济不宽裕，家里用的东西都是亲手做，现在的年轻人不理解，我记得那时候就算是生活在城市，为了省钱家里的桌椅板凳以及锅具都是我父亲手工做的，觉得那时的父辈们手很巧的。,1,20,0,2022-07-27 20:02:58,来自上海,109157199439,并州草莓
7125002173549069089,我有五个舅，其中四舅五舅都算是和木匠挨点边，要是写出来，类似于那篇文章，这怎么能算抄袭？我五舅也是聪明的很，因为成分没能参加高考。后来做木匠活，去了洛阳安家。那个时代的人，包括现在，不都有类似的人生嘛。都陈述事实，人生也有相似的，看了文章能延伸出来那么多吗？真是的，有的人就会找别人文案的瑕疵。,9,107,2,2022-07-27 18:48:54,来自河南,110944085182,梅花楼阁
7124845755290223375,"不打扰别人才是最好的成全。
——天才二舅的歪子人生
我一直认为B站的好多视频的质量是远远高于现在的抖音快手。
二舅的视频之所以成为现象级，就是因为主人公是有故事的，而创造者更是有心的。
自媒体最大的作用是在于鼓舞人心、提供温暖的力量，而不是为了消遣、娱乐、变现。
中国人的文化传统里是不屑于做这些事的，然而在浮躁的现在，人人都奔着钱去，都急于把能利用的资源变现。根源就在于衡量“面子”的标准变了。
士大夫的面子是贫贱不能移，威武不能屈，富贵不能淫。
现在大多数人认可的面子是有钱，有权，有名，有利。
二舅的身上体现了传统文化的底蕴，那就是不因贫贱丧失自己的追求，不因生活的困苦而丧失对明天的希望，不被世界的喧嚣遮蔽自己的内心。
我们跑的太快了，让我们放下了脚步，等一等自己的灵魂。
这句话喊了好多年，我们还是没有停下来等等灵魂。
#“二舅治好了我的精神内耗”刷屏#",3,62,0,2022-07-27 08:41:24,来自河南,50641275077,李慕太白
7126717792111723302,这说的我有点云里雾里的，老婆的二舅就不能叫二舅了？还有这个残疾证，办不办下来是个问题吗？我就问他是不是残疾了。看来又是得罪哪些人了。,0,8,0,2022-08-01 09:46:51,来自浙江,94132006683,琪琪L0Ve
7126711160313299746,二舅是不是真正治好了外甥女婿的精神内耗大家可能不清楚，可是现在看来，二舅不仅没有治好大家的精神内耗，还在全社会这个层面引发了新的精神内耗。。。。造化弄人啊,0,8,0,2022-08-01 09:20:16,来自江苏,4199722582021083,萍踪侠影M
7124792328665645824,去看了这个视频，真好，感动,0,4,0,2022-07-27 05:16:26,来自天津,435005714601085,大吉品
7124995294822974219,这是我读过最直续的文章，没有用摧泪的手笔，却吸引无数眼球！赞👍,2,35,0,2022-07-27 18:22:21,来自江苏,1450967375813151,朝气蓬勃的雪花
7126718742079210273,残疾证难办不是事实吗？妻子的二舅，丈夫不喊二舅，喊什么？喊孙子？媒体只需要制造对立面。只需要转移矛盾。没有任何节操。,1,5,0,2022-08-01 09:49:01,来自江苏,2911115927623855,防渗漏托盘厂家
7124774093865534242,可敬的人！让我想起我大舅，一辈子生活在农村，左撇子，啥都会:编筐斡篓、糊墙採棚、打井垒墙、盖房铺瓦、赶车造犁……甚至会自己采草药治简单的病！活到九十岁寿终正寝。,5,161,7,2022-07-27 04:09:18,来自辽宁,5752461798,正午兔子
7126714097877598988,看了很感动，也很励志，就行了吧，还要怎样才满意[委屈],0,4,0,2022-08-01 09:32:12,来自陕西,3787836482,Zczcz
7125253142409397029,视频二舅的故事比较具体丰满，文章二舅的故事比较扁平。两位除了都有个二舅，而且都是木匠，还有什么其它的共同点呢？没有啊。照这个逻辑，天下《我的妈妈是老师》的作文都要算抄袭了,0,10,0,2022-07-28 11:02:49,来自湖南,104384189444,云河河
7125542930425004833,有千千万万的二舅，就会有千千万万的文本。我的随笔《爷爷的风流韵事》也差不多这个故事框架。所谓幸福的家庭都是相似的，不幸的家庭却各有各的不幸。,0,12,0,2022-07-29 05:49:47,来自北京,62616807769,打油诗派
7124993988687315748,搭了一点边，99%不似,7,222,2,2022-07-27 18:16:59,来自北京,1248648449766925,呆呆的呆生活
7125268893060662028,十四亿人那么多，总有些经历类似的，略有雷同，不足为奇。,0,7,0,2022-07-28 12:03:57,来自江苏,5918084567,路过没什么想说的
7124797117872866061,是侄女今天推荐给我看的《二舅》，一气看了两遍，故事温暖，叙事平静而不平淡，文案写的很哲学，十分欣赏,0,19,2,2022-07-27 05:35:14,来自英国,3737937676346424,声兰兵燕
7126678508981682980,说句不好听的，本是一个催人向上乐观积极的作品，最终缺毁在嫉贤妒能之人手上。,5,187,7,2022-08-01 07:14:02,来自山东,782506524944413,我是大姐啊大姐
7124818016206242560,感觉他视频里的二舅很真实，就像活着里的福贵,0,6,1,2022-07-27 06:54:04,来自山东,4023812897125796,幸福地平线
7126684273880679208,短片我也看了，就当是故事看，拍的也挺好的。有些短视频那质量差的不忍直视，唯一不可取的就是残疾证的问题，其他的东西很真实。,0,38,2,2022-08-01 07:36:03,来自广东,105786335642,2022心想事成
7126776947006685952,这个短片，我觉得拍的挺好，起码讽刺的够真实。不管二舅怎么样，我们不要去评论，毕竟他也是普通人，有自己普通的生活。我们讽刺的就是那些夸大事实，不分青红皂白的东西，比如说最美什么什么，大家推举了，不美也要编很多显得很美很感人的文案。其实那些事，都是我们普通人已经做了很多次的事，只不过我们没有邀功，社会需要正能量，但不是虚假的正能量，相信自己，不相信文案，我们每个人做的都很美，都配得上最什么什么的头衔！,0,1,0,2022-08-01 13:35:22,来自吉林,1332250148868493,愤怒的仙人掌掌
7125565389072876322,这样的人现实社会很多，每个街头乞丐、拾荒者都是一篇苦难人生，不同的人不同看法，如果不是网上铺天盖地的争议，我差点没耐住性子看完二舅视频，我是不是很冷的人？,2,11,0,2022-07-29 07:13:57,来自广东,67903749815,大哥59922
7124703758835450665,在B站刷完视频后10分钟就推给我了这条头条，厉害了，大数据。,15,80,0,2022-07-26 23:30:49,来自广东,51019398997,骑狗狂奔闯天涯
7124723470973354763,像极了我的二舅，但我没水平没能力来表达他的故事。,5,63,1,2022-07-27 00:50:31,来自广东,87386596504,绿黄肥瘦
7125364552132543240,"“二舅”其人、其事存不存在和“二舅”作品文案是否涉嫌抄袭自他人文章，这是完全不同的两件事。
在我看来，“二舅”是现实中的人还是艺术作品中虚构的形象，都不是最重要的，最重要的是当引发人们的思考，我们是不是在关注自身和闲暇之余，要更多的去关注普通人的生存状态和精神世界。正像路遥在《平凡的世界》中说：“人们宁愿去关心一个蹩脚电影演员的吃喝拉撒和鸡毛蒜皮，而不愿了解一个普通人波涛汹涌的内心世界”。
我想特别阐明一点：“二舅”仅仅是无数充满人性光辉、美好灵魂和良好精神状态、坚强生活和艰苦奋斗的平凡人中间的一个，任何过分的围观、解读和放大之举都不可取，而且弄不好也容易使事情发展演进到本来正向价值和意义的反面去。",1,2,0,2022-07-28 18:15:03,来自北京,9015061260,天下有道则见
7126707297753072424,说句实话，视频能火肯定是有原因的，大家关注的不是里面的情节是不是完全真实，而是那份精神带来的冲击和激励。,0,9,0,2022-08-01 09:05:04,来自广东,1601358168596792,JYQTJ
7124835816601764623,二舅是许多人的宿影，是普通人的善良和适应生活的多功能，看似平凡，实际是生活的强者，生活的意义，多姿多彩,1,11,1,2022-07-27 08:02:59,来自湖南,5997136395,昜世盗名
7126670007220273961,主要二舅办残疾证这事 打脸,2,17,0,2022-08-01 06:41:04,来自安徽,2357780007355759,古城建哥
7126567850646471435,文字确实不错，诙谐中又带着对生活的感悟，是一个很好的故事。不必吹毛求疵吧。,1,235,6,2022-08-01 00:05:36,来自山东,6796056616,雷诺Donald
7125429653992997646,大家的观点忘了一个事，故事好不好真不真实就是见仁见智的事了，但是有人怀疑文案有抄袭嫌疑，如果作者借鉴了别人的作品或受到了启发，那就直接面对，大家不会说什么，也算正常。但是如果嘴硬就是不承认，那就是品质问题了，让人自然会怀疑你整个故事的真实性了。我看了两个文案，感觉最低借鉴了。作者说没看过别人的，有点说不通啊！,1,0,0,2022-07-28 22:27:47,来自吉林,96659406782,悠闲闲读
7126719276543099689,现在网上能拍出来感人视频其实真的就看看就好了！加工过的感情不要当真了！,0,4,0,2022-08-01 09:51:12,来自浙江,92816804272,一生静待
7124794873366381312,不凑热度，只做最好的自己。赞尝品质！,0,2,0,2022-07-27 05:25:39,来自河北,7226994403,胜者为王王者荣耀
7124777875676513058,很少有这种的文案写作确实感人，比较贴近那时候的生活，现在的很多全是那些乱七八糟的东西吸引人眼球……难得,0,19,1,2022-07-27 04:22:56,来自江苏,1947957772683166,麦芽糖桂桂
7126728789127906088,紅高粱裏的奶奶是真的嗎？源於生活高於生活的藝術有什麼不好，能打動你的心的作品就是好作品。,0,3,0,2022-08-01 10:28:04,来自山东,1393834011134775,民乐君
7126688508382692099,其实直接说二舅小时候不幸得了小儿麻痹症不影响全文，没必要说打针打坏的，医生还得不到任何惩罚。其实这样写也没什么问题，作者非要声明每一个字都是真的，这就不对了。文章能引起很多人共鸣，又励志向上，肯定算好文。我更喜欢短篇《卖米》。,7,16,1,2022-08-01 07:53:09,来自浙江,67805102056,小牛214577151
7124993927924450063,现在网络太可怕，凡是火的东西，都被网曝,5,95,0,2022-07-27 18:16:20,来自陕西,6115647409,退隐扫地僧
7124835569561240352,“歌颂一位残疾人的乐观治愈健全人的心理，是这个社会最大的残疾。”某群友说[听歌],8,61,0,2022-07-27 08:03:00,来自辽宁,5722875132,位部
7126671239443645217,确实应该严谨点：这个男的是我现在老婆的姥姥的孩子，简称老婆的二舅，我也称为二舅，大家不要以为是我亲二舅，虽然我也叫二舅。二舅确实是二舅，但是不是你想的二舅。,3,35,0,2022-08-01 06:47:14,来自黑龙江,97648516923,花开花落季回首少年时
7124696675142779648,作者三观很正，二舅这样安安静静的生活在山村不好吗，努力生活的人值得尊重的。,4,274,0,2022-07-26 23:03:01,来自山东,3457319989187918,自由海浪h6
7124993603386491679,起于网上，止于线下！,1,79,0,2022-07-27 18:15:48,来自福建,1552161797061723,张秀芳唯我独秀气芬芳
7126665234584290080,文学不可以虚构吗,8,51,3,2022-08-01 06:23:45,来自陕西,105807190757,三纹鱼23years
7125382804053230350,我二舅原来也是木匠，我爸妈结婚时的衣柜不知道是不是我二舅打的，但是那个衣柜的设计图纸和图案是我爸亲自画的，后来周围好多人结婚都找我爸要设计图。我们老家原来的橱柜是我二舅打的，上面是橱柜，下面是可折叠案板。,0,0,0,2022-07-28 19:25:47,来自内蒙古,67111904335,安逸橙子AJ
7124974275316089641,希望广大网友能放过二舅,1,18,1,2022-07-27 16:59:59,来自上海,52072435719,广达电子厂打工人
7125280750576255759,我也看了二舅的视频，很是感触，其实生活中这样自强不息的小人物比比皆是，在大众眼里都曾忽视他们的存在。但一经作者的提炼升华突然觉得他们的不平凡。有些人非得对号入座，就如吃了的土鸡蛋，因为有了故事和画面感会让人觉得这山野中奔跑的鸡是与众不同的，富含着丰富的营养和绿色，但有些人会怀疑它的故事，会怀疑那只鸡是否存在，好信的他们想千方百计的找到自己认定的问题，即便他们也觉得鸡蛋确实好吃！,0,4,1,2022-07-28 12:48:55,来自辽宁,22295483720,闲时明月
7125295249295262505,起于线上，止于相忘。非常赞成，也希望可以真正做到。,0,4,0,2022-07-28 13:45:36,来自上海,2295430341729384,笨妈啸天
7126713427342656289,我认为这个文案里的事是真实发生过的，但不一定都是二舅身上发生的事，不过是浓缩在一个人身上。我们需要看到一些东西，学到一些东西，思考一些东西，而不是被有心人带着跑。,0,5,0,2022-08-01 09:29:32,来自天津,2044730457988423,不是老师啊
7124719461671813920,"新京报：你觉得二舅真的治好了你的“精神内耗”吗？
衣戈猜想：他只是短暂性地治愈了我的精神内耗，没有人可以靠别人根治心理上的顽疾。我生活在北京这么大的一个城市，一直在平衡“出人头地”和“过好自己的生活”，不知道该选择哪一个。",3,25,1,2022-07-27 00:34:27,来自四川,59048687008,三桶油
7124858800888234782,不是二舅没有理想，是被现实禁锢了，二舅从小残疾，没上学，没结婚，活在农村都知道残疾人和光棍被嘲讽和歧视的感受，在别人眼里就是个笑话，天生不公平，也无法争取公平，自己的弱势地位，只能在自己的世界里努力过好自己，小心翼翼与世无争的活着，活在自己的世界里，日复一日，年复一年，这种思想慢慢生茧禁锢，二舅认为，生活就是如此，每天就是如此。我们为什么受震动，受感动？因为我们有选择，因为我们认为有公平，因为我们认为机会多多，因为我们活在别人世界里。,0,2,0,2022-07-27 09:32:28,来自江苏,53597522515,科大讯飞助学班
7125327309385138984,我们那代人二舅的故事很平常。我老家有个弟弟小时候家乡发大水逃难时发高烧打针打瘸了拄着双拐淘得很，叔婶都以为他是姐弟们的负担。结果他过的最好家里有事都是他处理。,0,0,0,2022-07-28 15:50:12,来自辽宁,93398831669,开朗白云zK
7126690278421332774,这就是残疾的长辈面对苦难乐观积极的生活态度，那么较真干嘛！,0,10,0,2022-08-01 08:00:14,来自江苏,23971717963,洗剪吹19
7125025371745125120,我觉得只是碰巧两个二舅都会木工而已，这世界上还有很多个会木工的二舅呢。这根本不存在抄袭，如果是因为二舅和木工二字就涉嫌抄袭的话，我建议以后大家都别创作了，因为都会涉嫌抄袭！,0,14,0,2022-07-27 20:18:09,来自广东,470244035936903,这是特别没意思的名字
7125068021848818462,是的，不要打扰他们的原本平静的生活。,0,18,1,2022-07-27 23:04:51,来自吉林,4353670491677582,淡定星辰n
7125420526969176872,两个作品都品味过，各有各的精彩!题目相同，职业相同，但立意太不同，内容丰减不同，文章简练集中，是给老匠人被时代抛弃而唱的一曲哀歌，而视频繁复深刻，是给二舅虽历经挫折沧桑而精神丰盈认真生活的命运交响乐!前者让人思考，后者促人泪奔。二者重合率低，连文章的原作者也认同视频没抄袭，其精神感人至深，让人潸然泪下。,0,0,0,2022-07-28 21:51:33,来自四川,14593813235,眼里澎湃海水1
7126712137218409249,二舅的不容易和一直面对生活的勇气不该肯定么？管他谁的二舅！管他啥时候拿的残疾证！管他有没有其他兄弟姐妹照顾老人！,0,4,0,2022-08-01 09:24:42,来自北京,6012139227,8832春风得意马蹄疾
7126774172193293088,不管是谁的亲二舅，一个残疾人不屈服于命运，顽强自主，平凡坚韧生活的故事打动人心，不怨天尤人，传播正能量有什么不好？,0,1,0,2022-08-01 13:25:15,来自甘肃,4195385493949719,无忧梦想花园
7126728571145896708,二舅写得好，值得尊敬的二舅，身残志坚的二舅，助人为乐的二舅，是我学习的榜样。,0,4,0,2022-08-01 10:27:17,来自陕西,105121122531,优雅荷叶N
7126698260244873998,视频中只是说二舅办残疾证时遭到过拒绝，没有说具体时间，怎么解读者就说是最近办证遇阻了呢？也许视频作者说的是90年前后办证时，被拒绝……不管怎样，这部视频给人的作用是正能量的,0,9,0,2022-08-01 08:30:58,来自四川,22887613834,正能量漂流瓶e0
7124992498887394060,因为真实，有力量。现在的年轻人很迷茫，不知道从哪里来，要到哪里去。,3,25,0,2022-07-27 18:11:23,来自湖南,4265739904095631,早上好小蜗
7125229406347461380,"一看到那视频眼眶就湿了，想起老家诸多""二舅""人物",0,7,0,2022-07-28 09:30:56,来自四川,110671340843,芦苇草麦田
7124849040168715020,[大笑]记者别问了，作者压力太大，不敢说实话，谁看不出来视频带点无奈和嘲讽,0,8,4,2022-07-27 08:55:07,来自山东,109289520536,狸花猫135
7126531044090020648,还是周公子的朋友圈越看越有味！艺术不就是来源于生活嘛！,8,446,2,2022-07-31 21:40:54,来自湖北,66389331054,bd铜锣湾
7124799960234902304,前段时间B站还在力推日本夏日祭，现在又有一遍文章火了，搞不懂？？？,1,6,0,2022-07-27 05:46:08,来自广东,96736565912,标识标牌生产商
7126678703274558243,那年代生病吃药变哑，生病后小儿麻痺有一些人的，医学，科技不发达，时代产物，因而人生轨迹发生改变。,0,13,0,2022-08-01 07:14:23,来自江苏,2616471889911411,花红草绿了
7124698762400121611,没有看过，看见了这推荐去找来看看,0,5,0,2022-07-26 23:12:03,来自贵州,4080989534164935,叮咚咚z
7125594176901038879,作为文艺作品看，有些拔高应该不算问题！,0,1,0,2022-07-29 09:06:09,来自山东,5953361896,自然风飘
7125083011242459945,真实的二舅被藏起来了，万一被网友发现不是想象的那个样子就尴尬了[我想静静],0,5,1,2022-07-28 00:03:08,来自江苏,56006769837,股民小咩
7126540124648964899,也不能说是假的吧。她媳妇二舅也是他的二舅， 没毛病；人家又没说残疾证办不下来，可能是最先办残疾证的时候遇到了些困难；小儿麻痹症都快高考了岁了还会得吗？,9,153,8,2022-07-31 22:16:14,来自江苏,53572096619,爽朗的逆风飞扬
7126587429007704840,二舅是虚构的，周公子是真实存在的，应该给周公子拍一个短片[呲牙][呲牙][呲牙],2,225,3,2022-08-01 01:24:47,来自北京,110983572731,寒枝斋藤飞鸟
7124778567413973767,这么棒啊，一会找出二舅视频仔细看看。,0,3,1,2022-07-27 04:26:50,来自辽宁,122736211402551,和风细语755
7126690676863648527,电视剧电影很多也是虚构，为何撤销推荐？,4,24,2,2022-08-01 08:00:56,来自河南,108790970609,倡导科学育儿
7125064062416962335,发扬《二舅》这种精神，宣扬这种精神，只不过是阿Q精神打发扬！,3,10,2,2022-07-27 22:49:03,来自北京,1354208336165453,春天里那百花香1660
7126679615707939584,为什么不开诚布公说妻子的二舅，又是真实生活，所有的问题不就没有了。妻子的二舅和自己的二舅，生活中一些事和感受是不一样的，作者又以第一人称叙述，肯定会造成功误解。,2,7,1,2022-08-01 07:18:04,来自安徽,2185455635532263,质监林中小鸟
7126670447085273890,残疾的原因不是打针造成的，这才是主要的虚构成分，而不是二舅这个身份,4,14,2,2022-08-01 06:42:38,来自四川,2639255226288959,华蓥山土飞
7124994071348970277,看完就只有“二舅”两个字一样，这篇作文远不如视频文案好,5,136,1,2022-07-27 18:17:30,来自福建,4872244209,暗夜梦
7124995640765268750,小时候写作文，老师让写父亲，同学都是农村的，我写了农村的父亲，同桌写的也是他农村的父亲…………如果这个视频没火，可能就没有抄袭这件事了吧！,0,35,0,2022-07-27 18:23:23,来自浙江,50281289956,christry521521
7126684022939517737,二舅的形象是农村基层许多贫困农民的代表，这个视频之所以会火，就是触动了人们的心炅，激起了共鸣，所以没必要吹毛求疵，撤掉视频。如果这都要撤的话，那平台上还能保留几个视频？,0,31,0,2022-08-01 07:34:55,来自江西,883655798429719,111求真
7126737588207321886,这个确实有点上岗上线了，谁能保证咱们看到的视频都是真实的，娱乐而已再说作者发布视频的初衷又不是为了讨要残疾证，还有就是自己老婆的二舅该如何称呼，希望给个明确答案。,0,2,0,2022-08-01 11:02:23,来自陕西,6382918352,漠绅
7124841089672626956,"二舅触碰了多少人的内心！
疫情此起彼伏，距家两个小时车程的临市而（九个多月）不能回。农村家中父母六十五有余，在城市的话是退休后精致生活的年龄了。姥姥年近九十了，两个月前摔坏了，进行了髋关节置换。当时正是老家疫情严重时，种种原因无法回家看望，心理甚是挂念不安。好在术后恢复不错，在儿女家轮换照顾。（之前是怎么也不愿意去儿女家生活的，大概是怕连累子女吧）
两周前，小朋友暑假开始了，疫情稳定下来了，回家终于成行。看望父母，看看术后恢复不错的姥姥。把小朋友放在父母家。（去年寒假疫情严重没有回去，小朋友埋怨了好久）
视频中二舅身残志坚，活出了自我。这或许就是引起共鸣的生活工作中太多的不能不得已的你我他的原因吧！",1,8,0,2022-07-27 08:24:37,来自山东,77013533939,翔宇0001
7124997333716501259,有网友问，这又说明什么问题呢？,0,28,0,2022-07-27 18:30:17,来自河北,50577328190,作家书童诺雅
7125235272426193698,我都看了，无论作者看没看我都觉得不算抄袭,0,43,0,2022-07-28 09:53:06,来自湖北,6219096101,幸运水滴d
7124831585962525448,“二舅”刷屏了。总结一下，“二舅”的终生精神支柱就是毛主席的四句话十六个字。这是什么？这就是坚定的信仰和信念。,5,9,0,2022-07-27 07:47:06,来自辽宁,1489988497,视线2018
7125003876444734216,作者接受采访的现场表达也不比文案差，根本可以无视这种谣言,0,14,0,2022-07-27 18:55:14,,9070240054,童牧野优视医疗
7126573290399023876,弱弱打听一句，电影都是真的吗？都没有艺术加工吧,7,53,1,2022-08-01 00:28:12,来自重庆,6078902544,KK3264
7124995935519802112,平心而论，说这文案抄袭，那确实有二个字是一样的，就是二舅，但这并不是专有的，没有先后顺序。,1,47,0,2022-07-27 18:24:09,来自广西,73186307097,凭海临风153
7124701852021277448,二舅的视频看得我好难过[泪奔]回不去的故乡，融不进的他乡；故乡已成他乡，他乡还未成故乡！为了活着，都成了无处安放的灵魂[流泪][流泪]想着老家的爸妈，真的好难受[流泪],7,111,3,2022-07-26 23:24:04,来自浙江,92457452477,哦吼又要搬砖了
7124992275243434791,这个世界上第一快乐的人，是不需要对别人负责的人。第二快乐的人，是从不回头看的人。二舅给我做的小板凳一直还在,1,7,0,2022-07-27 18:10:44,来自上海,16763732459,风一样的男人
7126701051013153577,电影不也是虚构多于实际吗？人们应该关注的是片中的正能量，不明白有人为什么还要纠结那些不重要的东西！,0,4,0,2022-08-01 08:40:59,来自河北,59221716375,翟文娟77481
