7126741749410005797,因为不是他自己的亲二舅，所以信息来源肯定都是来自自己的老婆和老婆的亲戚，有出入很正常啊！,0,0,0,2022-08-01 11:19:14,来自河南,4471737651,郑载努力
7124694823633683214,B站还在，是大家的责任。,3,39,0,2022-07-26 22:56:02,来自广东,901228094035851,冇嘢嘅
7124816544948912928,请大家多点点关注，点点赞，争取冲到一个亿的赞。请不要打扰二舅。千万不要去详细调查，万一穿帮了呢。,2,1,3,2022-07-27 06:49:21,来自广东,413023062461343,浪花一朵朵2088
7124995645223863074,两篇内容相差的远了,0,20,0,2022-07-27 18:23:03,来自湖北,399843385685726,沧海大观
7126769867742577448,本来就是专业的团队拍摄及后期制作、配音，一开始就能看出来，怎么可能是一个手机随便拍出来的效果，看见二舅这个视频的那天我就这么认为的，也是这么说的！,0,0,0,2022-08-01 13:07:45,来自河北,102140229304,划船不用桨
7126689606094979873,为什么老是纠结于一个亲二舅、残疾证，只要二舅乐观向上，乐于助人的精神是真实的已经足够了。,0,4,0,2022-08-01 07:57:14,来自湖北,3985088828148221,MIXatan
7126555865712608038,b站的视频什么时候要真实了，搞笑啊，就当电影看不行么,2,30,2,2022-07-31 23:18:37,来自江苏,1085927547485367,大呀么大表哥
7126747439671378703,"不管人物真不真，只要作品鼓舞人。
就算不写他二舅，还有三叔和四婶。
———就当文学作品看也是挺好的[白眼]",0,0,0,2022-08-01 11:40:49,来自河北,78629845509,金山0066
7124902857459254023,谢谢媒体让我们了解这个聪明、坚韧、朴实、善良的二舅! 在这些默默无闻的人身上，我们汲取了很多前行的能量。[玫瑰][玫瑰][玫瑰],0,1,0,2022-07-27 12:23:19,来自上海,1402627605142504,海燕看天下
7126759263120868136,"几十年前确实不如现在，要虚心接受历史原因做的不如现在好。
时代在发展，要用发展的眼光回顾历史原状，而不是以现在的标准去衡量几十年前的贫困年代。",0,0,0,2022-08-01 12:26:44,来自广东,12334885585,春来日暖
7125304899038577408,不太喜欢这种消费苦难的心灵鸡汤作品，感觉像以前于丹讲论语，宣传逆来顺受，认命听话,7,2,1,2022-07-28 14:23:21,来自山东,2801984700167472,成熟铅笔mq
7126688751228961574,现在b站要求视频真实？？？先不说这个真假，我拍个小短剧也不行？,0,2,1,2022-08-01 07:54:37,来自天津,3707079843,南杨州的长颈鹿
7124796696386650910,二舅视频到底讲啥？,0,1,0,2022-07-27 05:33:03,来自浙江,2330583626157543,程成江
7124834413980107534,建议拍成《长津湖之二舅的故事》肯定刷新中国票房！哈哈,4,11,6,2022-07-27 07:57:54,来自浙江,99729069861,圣马力诺国家队主帅
7126675660458296098,本来作为励志正能量宣传，可是与周公子事件对比冲击太大，起到了反作用，找个理由撤销就不奇怪了。,0,14,0,2022-08-01 07:02:44,来自安徽,518568620605135,勇者强降雪
7126542431419728653,二舅就看着像清朝思想的,1,8,1,2022-07-31 22:25:40,来自广东,51981576184,无为wuwei也
7125295380106871564,"真实的二舅，真实的人生，即使雷同，也只能说人间生活的大同小异。这正是因为雷同，才激发了无数人的家乡情怀，也是视频火爆的真正原因！
我自己的大舅也有非常类似的经历，看了感同身受，这才是人间烟火。",0,0,0,2022-07-28 13:46:41,来自山东,632916107338999,识在旅途
7126737139382977315,妻子的二舅就“不是主人公自己的二舅”？？,0,0,0,2022-08-01 11:00:23,来自江西,1293446873098391,正能量乐天派小猫3n
7124718806253159175,今天二舅在朋友圈也火了,0,4,0,2022-07-27 00:31:06,来自广东,6104825076,小邓79425956
7124913239288185632,在B站刷完视频后10分钟就推给我了这条头条，厉害了，大数据。,0,1,0,2022-07-27 13:03:35,来自海南,5828343255,带着风儿去流浪
7125038062119355171,见不得别人好的人对什么都质疑！,0,1,0,2022-07-27 21:07:24,来自河南,2049090919339415,小鱼儿17888
7124811804391375619,刚才看了《二舅》视频，立马看到这篇报道，更加感觉到要珍惜人生，享受生活。,0,1,0,2022-07-27 06:30:59,来自湖南,5755645972,渐入佳境198
7126147593520136990,我在众多外甥口中和心中也是位名副其实的“二舅”！从农村到城市一路奔波，不想大富大贵，只求平平淡淡！生活俭节，幸福简单！,0,1,0,2022-07-30 20:53:18,来自湖北,55999875438,在那遥远点的小山村
7124986144701678350,人生就是一场修行，好牌烂牌同样精彩,0,0,0,2022-07-27 17:46:32,来自广东,110937410942,平凡的生活NN
7126662266338116382,看过让人感动，就是好作品。可能是打了一些人的脸，所以拼命证明它是假的,0,16,2,2022-08-01 06:11:52,来自江苏,75701874073,阳光普照心明朗
7126688453257036577,二舅可能并不真实，也许是几个人的事迹拼在一起，但在农村，在那个时代，二舅这样的人还是有的，一个短视频而已，又不是纪实文学，不需要如此细扣,0,5,1,2022-08-01 07:52:54,来自安徽,68115265225,爱可迅传播
7124696758395372322,二舅平凡人中的个案，作者用质朴的笔触记录真实的事，真实朴素最动人心,0,29,0,2022-07-26 23:03:26,来自四川,22763388930,如歌的行板21
7126794213919965965,一个短视频，而已，不管真假，感动人就可以。网上的短视频有几个是真实的？,0,0,0,2022-08-01 14:42:46,来自山东,3140677524,言逊
7125545119025267463,怎么就抄袭了？我有四个舅舅，可偏偏我的二舅也有些残疾，也是自强不息，勤劳善良，帮助了很多人。幸运的是很早就享受政府帮扶！看到二舅视频也想起了我二舅！,0,0,0,2022-07-29 05:56:49,来自吉林,96686932257,我思故我赚
7126611074979300104,"一个视频，讲了一个故事。
很好~",0,10,0,2022-08-01 03:00:24,来自辽宁,289866559264462,硬件杀手
7124995913336619809,有些人就是见不得别人好，别人一火就来挑刺,0,8,0,2022-07-27 18:25:02,来自广东,77261211521,无敌是多么寂寞xy
7126792998570132262,没搞懂，老婆的二舅难道自己不该喊二舅？,0,0,0,2022-08-01 14:38:25,来自浙江,111473559361,爆炸的地瓜
7124930228585284355,看了余华的活着，看了作者的二舅，还有啥不能治愈？有啥困难过不去？,0,2,0,2022-07-27 14:10:05,来自山东,76064539350,不念过往不惧将来
7126571780537385763,主要是观众不吃他那一套，试图对人说教，要安于苦难，苦难是福。,4,38,5,2022-08-01 00:20:13,来自北京,57252970815,荡云寒烟子规
7124994335736791808,吓得我想写写俺二舅的想法赶快放弃了,4,19,0,2022-07-27 18:17:53,来自河南,5884507239,石材专家
7124945103911273247,"二舅的苦难，是人为的，却没人需要为此负责！
人为苦难，不是财富，而是犯罪！",6,21,1,2022-07-27 15:07:30,来自广东,59273925501,商1183
7125307883877139237,我在想，以后还有这些二舅、三姨、四叔、小姑的吗，以前一个家庭生好多个，才有这么多的亲人，以后怕是统称我朋友……,0,0,0,2022-07-28 14:35:28,来自安徽,102163907792,阳光2015
7126539103549997839,喜欢看何苦的「最后的棒棒」纪实片[呲牙],4,9,0,2022-07-31 22:12:16,来自上海,3988629861173932,顾若影
7125741722508198689,二舅是在人生的苦难中修行成功的人，在艰难和困苦中，保持着一颗善良豁达的心和始终积极自救、以及救助他人的正面态度。当然，在民间肯定还有很多相似的这样的人。,0,1,0,2022-07-29 18:39:05,来自广东,2291799822985335,行绿水前舟
7125055788845957928,最真实的感情流露，更能引起人们的共鸣。二舅一定是喜欢平静的生活，希望大家不要去打扰别人的生活，各自安好是一种美的意境,0,8,1,2022-07-27 22:16:11,来自山东,82233182081,育儿孝老此一生
7125012891885011724,就二舅俩字抄袭了[捂脸],0,4,0,2022-07-27 19:30:45,来自广东,64202615152,旺仔小馒D
7126594141588751119,颇有山东某作家的风格，视频版本的，可以拿奥斯卡最佳剧本。,0,3,0,2022-08-01 01:50:16,来自重庆,6502072521,人生长短句
7124980076022039311,也许这就是中国人的品质，曾经生病，被西方列强胡乱医治，导致残疾差点站不起来，还好有一颗坚强的信念和乐观的精神让自己强大起来。,3,17,2,2022-07-27 17:22:43,来自福建,5772800204,我哦去嗯
7125001171919602469,吓死人了，我也有个会做木工的二舅，还好我没写个文章赞扬他[捂脸],0,7,0,2022-07-27 18:44:46,来自上海,108013012714,嗷喵星人
7124872698975175463,想起了我的大舅，像文中的二舅一样聪明能干，年轻时开过砖厂，办过粮食加工厂，养过羊，当过电工，帮村里人维修电器，还能砌砖墙建房子，在农村几乎什么都会，在村里很受人尊敬！,0,1,0,2022-07-27 10:25:32,来自广东,3553025907,帅气sunnyday
7126721886272619296,妻子二舅不叫二舅叫啥，这是啥理由[捂脸],0,0,0,2022-08-01 10:01:21,来自北京,3732557037,尼古拉斯钱多多
7125029434398327593,抄袭是肯定是不好的。相似甚至相同是有可能的。我的真实姓名，户口登记的时候有一个字登记错了。后来我上广东省的户口登记处查询，结果发现有人和我名同姓。我就在用我原来正确的字查询，也发现有人和我同名同姓。,0,1,0,2022-07-27 20:33:49,来自广东,98702026651,独行茶友
7126693730798732069,那么多名著也不是真实的故事，不影响它流传千古,0,2,0,2022-08-01 08:13:01,来自山西,70885941371,双鱼337
7125323103559156517,这两个二舅除了都是都是二舅和木工外，并未看出什么相似之处，其实在中国农村可能还有千千万万个这样的二舅、大舅、三姨夫等等，也许他们的经历不相似，但是他们都有勇敢生活的态度。,0,0,0,2022-07-28 15:34:12,来自江苏,1473761770,小米饭1018
7124718295944905487,不幸的人有各自的不幸，与其替人家伤心，还不如多关心自己的父母，再者说人家二舅过得也很开心，接受自己、减少欲望。,0,6,0,2022-07-27 00:28:26,来自河北,6892055741,cccinoicq
7126708641314554624,好像妻子二舅就不能叫二舅一样。如果写上视频自真实事件自真实事件改编会不会好一点。,0,0,0,2022-08-01 09:10:14,来自广东,3435718591,寻找地平线
7126776513391231779,妻子的二舅不是二舅吗？他应该叫什么呢？,0,0,0,2022-08-01 13:33:45,来自山东,1758856992020702,爱笑海林2j3
7126552143485747968,做了这么多年的网民还不清楚吗，看看就行，信与不信何必当真,0,17,0,2022-07-31 23:03:05,来自江苏,7020670622,波利的魔法屋
7126699592968192803,二舅不是一个具体的人，他就是一个象征，一个代表，一个生活在最底层，处境艰难，卑微且乐观的活着的一群人。,0,2,0,2022-08-01 08:35:22,来自陕西,3993018439,皇家空军一号
7126762040290935587,作者片尾加个字幕就好了，本短视频内容有些虚构，仅供励志,0,0,0,2022-08-01 12:37:27,来自天津,79366170500,crazy小黄黄
7124794523137409832,贴近实际、贴近生活、贴近群众就是好素材，给勤劳朴实的二舅点赞👍！,0,3,0,2022-07-27 05:24:16,来自浙江,94552372128,朝气蓬勃的灰喜雀
7124694794638656295,二舅品质高贵，是个非常优秀的人！不论是小时候学习，还是以后学木工，做什么都那么认真，全力以赴帮助别人，是位热心朴实善良的农村老人[赞][赞][赞][赞],0,88,5,2022-07-26 22:56:12,来自山东,105541538133,名字爱我中华
7124750214694880033,越是真实的东西才有生命力。也才有流量。,0,4,0,2022-07-27 02:43:25,来自广东,8391556548,快乐一生6134
7124665555377767172,二舅单腿的人生，却撑起了现代年轻人的希望,4,26,3,2022-07-26 21:02:22,,1354222410408013,地心力阿龙
7126722569306473250,拍摄者妻子的二舅……叫二舅没什么问题。但对残疾原因造假就是大问题了。,0,0,0,2022-08-01 10:03:57,来自重庆,3836973237,智点江湖
7125209071313027844,把有光的人们的故事展现，是传承这个民族传统美德，让我们一起检点初心，回归初心，传播正能量。,0,0,0,2022-07-28 08:11:52,来自陕西,67217424261,聪慧苹果U
7126763767966712579,短视频何必较真呢,0,0,0,2022-08-01 12:44:47,来自江西,101763211336,自由的风4253
7126692027073037097,这个视频更侧重的是文学性，文学本来就是源于生活高于生活，作者确实不该在视频中强调这都是真的，要不然还是一个很好的作品,0,1,0,2022-08-01 08:06:09,来自北京,4234961418987483,大魚2020
7126742132685472512,拍者老婆的二舅也是二舅呀，这没毛病呀！残疾人证是否早给了，忘了，极有可能，因为从没有人帮困，自己也就忘了，这不算什么呀。对于普通人的普通故事来讲，这己足够生活了！,0,0,0,2022-08-01 11:20:15,来自天津,5781051973,TJ天津老实人
7124857874253447976,故事感人，拍成电影上座率恐怕不行。,2,0,0,2022-07-27 09:28:26,来自辽宁,109588643752,胜利超哥C919
7126545453172556575,但是比二舅更苦的苦难还有很多,1,21,0,2022-07-31 22:37:32,来自湖北,61914678569,杂人
7124782794814849832,二舅真的像表现出来的那样快乐吗？命运的作弄和生活的重压无奈之下唯有以微笑面对而已！,1,14,0,2022-07-27 04:39:47,来自辽宁,3612625216,JACKY老宫
7124804849010656014,贴近实际、贴近生活、贴近群众就是好素材，给勤劳朴实的二舅点赞👍！,0,2,0,2022-07-27 06:04:05,来自上海,96785904634,酸龙拿走
7124696769661371139,下午B站看到后即刻转发了！同样出身农村的人有共鸣，但是没有文中二舅的修为，大多数人反而看到了农村的落后与不堪。可见世外桃园不在于是否处在桃花源，而在于人的心态。,0,37,1,2022-07-26 23:04:27,来自山东,105933729527,梦想是科学家的我
7125023596426511144,只要故事是真实的，管他什么流言蜚语呢！,0,2,0,2022-07-27 20:11:14,来自黑龙江,9534245677,黑龙江可心
7125282261213479684,我觉得真实性99%。首长给二舅搓澡需要回应一下，这个有疑问,0,0,0,2022-07-28 12:54:45,来自浙江,6176990409,二代目教父
7125395343093285664,在网上看看就好了，别去打扰人家生活。,0,1,0,2022-07-28 20:14:42,来自江苏,3007854003884443,多些好风景
7126736589098910467,他老婆的二舅说明他不够了解，有些事情自己经历都不一定清楚原委，更何况很多情节是多人转述，也许他不是故意的，只是把听说变成了事实。,0,1,0,2022-08-01 10:58:23,来自广东,2041164302390264,龙888168
7126758195537920803,有时候拍了真实的视频，为什么不给推荐？是因为太真实吗？,0,0,0,2022-08-01 12:22:40,来自河北,4233130897,知足常乐36144659
7126731879826359040,是妻子二舅这属于反转？ 真是开了眼了,0,0,0,2022-08-01 10:39:59,来自辽宁,4232909498,树袋熊的小熊熊
7125009044519256866,除了二舅两个字一样，我读不出来哪个地方抄袭？！[擦汗],0,4,0,2022-07-27 19:14:59,来自广西,1688451665895536,鸿梓康
7125248412286796558,最重要的是视频传达给我们的精神内核。,0,0,0,2022-07-28 10:44:08,来自陕西,4314126771568206,奋发松鼠Ud
7125066758365119235,看到你写的“二舅”，深有感触。与我弟弟的经历非常相似。结果也相似。我弟弟已经七十多岁了，仍然默默地生活在农村。,0,0,0,2022-07-27 23:00:24,来自河北,60268153146,羊羊187120385
7125005259768070944,视频和文章不是一个水平，视频明显好多了。,0,5,0,2022-07-27 19:01:00,来自贵州,1134305760517015,凌云上九霄
7125066195581616928,那个是他二舅的人生，又不是写作文，什么叫抄袭?只能说大部分普通人的人生都差不多，不普通的是他二舅一个残疾人能够过成正常普通人的样子，而且还有担当得多。,0,1,0,2022-07-27 22:57:39,来自广东,52033938079,花非花蝶非蝶
7125372110092026658,扼杀了别人原本原本清贫安静的生活[捂脸],0,1,0,2022-07-28 18:43:50,来自山东,3861076981846491,齐都脱兔
7126681360613442317,我以前以为文学有好多种文学，现在才知道文学只有一种就是纪实文学，要这么说，像什么新闻，里面说说的，纷纷同意，纷纷赞许，是不是也该停了，,0,4,0,2022-08-01 07:25:20,来自山西,1121132550295166,沉着枫叶eX
7125263461143675689,两篇文章貌似并没有相似性，如果一定说有的话，那就是写的都是“二舅”[捂脸]谁还没有二舅呢[奸笑]支持衣戈猜想,0,0,0,2022-07-28 11:42:17,来自安徽,4230547022545512,心理咨询师嘉兰
7125352378844627726,能吸引我们普通人共鸣的视频，就是普通百姓真实生活写照！二舅是真实的二舅！,0,0,0,2022-07-28 17:27:54,来自吉林,14055546793,1969XY
7126737071506899748,《活着》是百分百真实的么？！人家这次的短视频也没啥负面的东西啊，撤销。。何必呢！,0,0,0,2022-08-01 11:00:14,来自新疆,93199297241,大磊5274
7125232569792807714,真是奇葩，现在网络好可怕。善待他人就是善待自己吧。,0,0,0,2022-07-28 09:42:34,来自福建,70237100106,你的柠檬茶
7124865667396354847,我被视频感动落泪了，祝福二舅健康快乐！,0,2,0,2022-07-27 09:58:10,来自河南,6630001157,行摄天地中
7125572278032892707,主旨、情节无雷同之处，只是身份、称谓一致，绝非抄袭！,0,0,0,2022-07-29 07:40:45,来自江苏,3922683758122507,容则宽
7125641026588853029,如果是抄袭，还叫二舅？三舅四舅不香吗？[抠鼻],0,1,0,2022-07-29 12:07:44,来自辽宁,3241895148,平安淡幽居
7126744547015213860,哈哈，意料之中啊，没想到姗姗来迟[捂脸][捂脸][得意],0,0,0,2022-08-01 11:30:04,来自辽宁,1538939917436541,完美叶子Hi
7124694280379187983,“印象中的家乡永远是冬天”一句真实得让人倍感凄凉的话！,2,10,0,2022-07-26 22:53:38,来自贵州,3210186530758656,刘观察看
7126574419535364902,妻子的二舅就不是拍视者的二舅，结婚证白扯了[笑哭],1,65,2,2022-08-01 00:33:32,来自广东,99225797030,秋色几层
7125715230734435113,人是有共情的，每个人的经历不一定相同，但是恰好几个元素对上了，得到的感受就会一样，也因此写出来的东西就会雷同，这很正常。就拿歌曲创作来说，有太多的音调节奏旋律甚至歌词都类似的作品，仍然不影响它们各自的优秀。世界之大，面孔相似的两个人都大把，何况一篇文章呢？！,0,0,0,2022-07-29 16:55:16,来自陕西,1530110495689816,欢螺颂
7124999348459012897,不是不可以改，只要注明就行啦。头条上面还是要支持原创，我感觉我的视频99%是原创，就是不怎么生动。,0,4,1,2022-07-27 18:38:13,来自湖北,2933116308306711,文倩美好岁月
7125249436762604322,如果这也算抄袭？那么谁的文章不是抄？,0,13,0,2022-07-28 10:47:53,来自浙江,11310829591,番薯藤mff1
7126732784362160927,一看就是经过艺术加工的 九真一假 那一假无非是为了戏剧冲突 就和写小说一个道理,0,0,0,2022-08-01 10:43:38,来自江苏,50930049179,智慧超
7125611829422129920,网络什么人都有，但更希望多一些善意的人,0,1,0,2022-07-29 10:13:42,来自浙江,109582934905,豆豆88288
7126772020574470912,作者妻子的二舅也是他二舅啊，怎么就成假的了？,0,0,0,2022-08-01 13:16:17,来自辽宁,92657210039,锋芒对外温柔对你
7125051069688005384,"又怎么样呢。总是见不得别人好，真人真事还要质疑。
用这个精神去质疑社会上各种不公吧",0,1,0,2022-07-27 21:58:20,来自四川,6736424366,开心姐109747966
7125254159230305059,二舅视频真实吗？内容真实吗？,0,4,0,2022-07-28 11:06:21,来自浙江,87473276256,会当凌绝览众山
7126543724536578853,没下架啊，还能看,1,0,0,2022-07-31 22:30:56,来自辽宁,72505548935,娜扎就是我
7126713356568380196,当全网去推一个东西的时候，这东西只是个商品，真假难辨。,0,0,0,2022-08-01 09:29:26,来自江苏,6208098903,moddan
7125050723083584296,可以拍成一部悲伤的喜剧片！,0,1,0,2022-07-27 21:56:39,来自北京,1864371580182045,爱崽崽1314
7124814836458455839,乡土是中国人的根，希望你能够拍出更多的好视频，加油[赞][赞][赞][赞][赞][赞][赞][赞][赞],0,2,0,2022-07-27 06:42:48,来自湖北,91949380217,九口人家
7126787009917551394,我觉得“二舅”这个短视频之所以能爆火，之所以受欢迎是自有其道理的…,0,0,0,2022-08-01 14:14:25,来自湖北,63769215889,金蛋67语言作者王久武
7126741442956935972,看了视频，确实很好 很现实！若是虚假，那又有几个真实的？,0,1,0,2022-08-01 11:17:47,来自甘肃,10761677920,远方92
7124980483087188747,看二舅的视频想起了《活着》,0,2,0,2022-07-27 17:24:49,来自广东,3360552818847451,轻松家常美食
7125000079400305444,此二舅非彼二舅，视频没火之前你二舅就是你二舅，火了别人的二舅也是你二舅,0,5,0,2022-07-27 18:40:48,来自广东,106076595715,小草66045
7125037612968002311,小说也是来源于生活，现实中的二舅可能和书中的相似，但现实中的二舅是真实存在的，也不算是抄袭！,0,2,0,2022-07-27 21:05:52,来自湖北,108172111793,雁子2713623024511
7126160725558444830,"在我看来，作者想表达的是二舅那种在经历磨难与命运做斗争到底的精神。
最最重要的事情是作者说二舅笔记本第一页的那句话，不就是二舅自己以及那个时代的信仰么",0,0,0,2022-07-30 21:44:07,来自广东,1521361876172571,Linok
7125294361550160681,这样的故事，哪里都有，会码字的人诉诸了笔端，不会码字，也是谈资，开导人，教育人,0,0,0,2022-07-28 13:42:19,来自江苏,59315508208,学思WhL写字的人
7126647325677601576,为什么一定要完全真实呢？,0,9,1,2022-08-01 05:14:17,来自广东,110249795980,露西小弟l
7124829688103043875,这up主文案写得太棒了，流畅中又不乏幽默。,0,6,1,2022-07-27 07:39:16,来自河北,110971504488,你怎么不去做饭
7126697180160705280,重点是视频内容不能吐槽残疾证不好办[捂脸][捂脸][捂脸][祈祷][祈祷][祈祷],0,0,0,2022-08-01 08:25:49,来自广东,51634244777,文化渴乐
7125009430634758949,只要故事是真实的，管他什么流言蜚语。,0,1,0,2022-07-27 19:16:56,来自黑龙江,3043922884171695,丽丽
7124961860041835298,作者自己都说了，他只想表达二舅的四个字“庄敬自强”。不要把二舅推向功利社会。,0,2,0,2022-07-27 16:11:46,来自天津,4290440524,哏都刘二
7126747974977733380,怕舆论 所以不得不假唉 还有什么是真的,0,0,0,2022-08-01 11:43:41,来自河北,4231353594030992,风姿卓越云朵NB
7126578361098453773,原谅我看了一遍之后压根没看懂怎么个治疗内耗[捂脸],0,6,0,2022-08-01 00:47:59,来自浙江,4063764797,Miss徐baby
7126684548381377291,不得不承认这作品，一级棒！艺术来源生活，高于生活！年度最佳创意短篇非二舅莫属！点赞！,0,3,1,2022-08-01 07:38:12,来自江西,1908347719136718,落雨夏冬
7124859657055011619,这股清流才应是自媒体的初心,0,6,0,2022-07-27 09:35:25,来自山西,15244093257,布衣212117572
7126710065058693901,反正抖音现在段子拍的越来越真，手法是娴熟了不少，挺唬人,0,1,0,2022-08-01 09:16:26,来自广东,6625983031,木了个木了
7126660393309291268,不需要非要外甥拍，不需要全部真实，允许艺术加工，因为这个视频传递的精神值得宣扬,9,39,6,2022-08-01 06:05:36,来自浙江,338272613577612,一个想变成桔子的苹果
7126711368300610335,火起来的视频，大家蹭热点的方式合不相同。有分析的，有类比，有说假的~哈哈哈,0,2,0,2022-08-01 09:21:40,来自重庆,5450194414,TUZKI008
7126725027726197538,人人都觉得二舅厉害，人人都不想当二舅。人人都骂周勋，人人都想成为周勋,1,1,0,2022-08-01 10:13:25,来自广西,92110911509,新长征路上程雷峰
7125296544664257316,真的假不了假的也难圆成真的,0,0,0,2022-07-28 13:51:05,来自江苏,94602891576,金子不发光558
7126557072460251934,何必在意真假呢，艺术创作来源于生活高于生活,0,7,0,2022-07-31 23:23:14,来自广东,50448166067,歘歘5
7124907777868727071,巧了，我的外甥叫我二舅。,0,3,0,2022-07-27 12:42:26,来自河南,2906743752102508,工信科
7126720808881505039,光知道很火，没看过具体内容，现在想来，二舅这个视频怕是治好了我的自我感动吧。生活都已经这样了，灌再多的鸡汤也没用，踏实过好每一天就行了,0,0,0,2022-08-01 09:57:10,来自河南,111065188215,#盛夏光年#
7126651334048318219,我不理解，文学作品不都是虚构的么？又不是纪实,0,2,0,2022-08-01 05:31:20,来自上海,51625101263,Charles8888
7125239562544382734,艺术源于生活，生活也可以很艺术。,0,0,0,2022-07-28 10:09:55,来自四川,99027199175,有趣的小李哥
7125252207561474855,二舅的身影，不就是千千万万个乐观、善良、顽强、大爱的中国人，凭借自已的智慧，战胜困难，创造幸福生活的励志事迹吗？,0,11,0,2022-07-28 10:59:15,来自广东,1025179709873659,直爽光束eo
7126689524578566953,作品挺好，能感动很多人，当做故事看啊。,0,2,0,2022-08-01 07:56:09,来自重庆,85032977566,我见青山多妩媚A
