7126768961588527906,大概二舅的苦难，会映射某些部门的失职。此外不能否认的是，因为观众认为是真实事件，因而更加感动。如果一开始就说纯属虚构，估计也就没那么感人了。,0,0,0,2022-08-01 13:04:14,来自天津,4174159793363336,面包宝宝和面包妈妈
7124854353408049920,可以拍出来，但是不要有悲情的东西，这应该是一个充满希望充满欢乐的故事，,4,7,0,2022-07-27 09:14:44,来自山东,50086323522,打个喷嚏321啊嘁
7126711523761996584,现在很多事情都不按常理了，纠结二舅是不是真实的有意义吗？是不是把重点搞错了？,0,2,0,2022-08-01 09:21:33,来自安徽,98268008036,毛团麻麻
7124757997079446308,请问是组织“夏日祭”那个B站吗？[抠鼻],2,13,0,2022-07-27 03:13:04,来自贵州,54326538582,孤帆逐海
7126689500935635748,真实版的二舅随处都有，这么刨根究底他是不是真的，才是问题所在吧,0,8,1,2022-08-01 07:56:39,来自江苏,3175310350,花田蜗牛
7125009271573463842,看完就只有“二舅”两个字一样，这篇作文远不如视频文案好,0,13,0,2022-07-27 19:15:48,来自北京,3192619799944148,用户妮卡
7125007874421441295,芸芸众生亿亿万，偶有职业相似，经历相似，人生感悟相似的，又有何不可？一部作品，基于现实生活的类似与相似，不宜擅自认定为所谓的抄袭。若是全篇虚构，而内容、思想、主旨相似或相同，那才有可能是在借鉴的基础上抄袭！,0,11,0,2022-07-27 19:10:21,来自福建,104045591872,漫步人生路dhb
7126687320111072030,亲戚家的二舅与这个“二舅”很像。小时候得了小儿麻痹，不能站立，但是这个二舅有低保，有老婆孩子，也是修家电谋生，兄妹5个，老母亲也是跟二舅生活,0,5,0,2022-08-01 07:48:05,来自江苏,59167020679,从头再来512478
7124855160895537957,作者三观很正，二舅这样安安静静的生活在山村不好吗，努力生活的人值得尊重的。,1,4,0,2022-07-27 09:18:27,来自山东,79639020045117,积极的苹果up
7125312460726584095,看完二舅，你的内心有没有触动？为什么现在的人从别人那里得到了恩惠，不加以感谢，还要不停的去置疑怀疑。这是个友善的人吗？,0,1,0,2022-07-28 14:52:58,来自江苏,92775535206,你家香姐
7124878111556158239,这位历史老师非常清醒，内心亮堂，对世事洞察深刻。,1,0,0,2022-07-27 10:47:12,来自广东,98799704366,高级动物4663
7126579777263141666,只敢查二舅，不敢查大伯三伯,4,258,0,2022-08-01 00:51:52,来自江苏,3319494278,绿YOYOO
7126712109287359272,抛开实力情况，这个短片故事确实不错。。,0,3,0,2022-08-01 09:23:59,来自山东,73600533799,齐赫曦
7124807915265491745,二舅真的像表现出来的那样快乐吗？命运的作弄和生活的重压无奈之下唯有以微笑面对而已！,12,23,2,2022-07-27 06:16:58,来自北京,1609275012036840,聪慧的温文尔雅
7125005019837104937,"#济南头条# 此类型的电影其实已经拍过很多，只是没被网友们发现并关注而已，因为现在的这几个视频网站压根就没想着购买。再就是之前院线也根本没有排片，央六也播不过来，要知道每年没有机会上线电影几千上万部。原因都知道，没有市场，没有票房，好在如今的自媒体发达了，可以看到更多的作品，但冷静下来看，这种心酸的，辛酸的故事不该捧的太高，理解了，感受了就好要理解故事主人公的看到自己的坎坷再一次被放大不是什么好感受。
【关注眼光，关注平凡的生活】",0,0,0,2022-07-27 18:59:14,来自山东,10605748211,眼光说
7126563133548118791,视频还能看呀，到底信谁的,8,4,2,2022-07-31 23:47:05,来自吉林,844060109840685,无双星辰DF
7124949753469092644,农村人生活真实写照,2,13,1,2022-07-27 15:25:36,来自河南,88647031625,骆驼6120
7126554966407840546,这个理由比较牵强，估计多数普通人反感的原因吧,1,86,1,2022-07-31 23:14:18,来自上海,52996132830,hy154516826
7126768251572847396,但凡是成为偶像，成为我们膜拜的英雄，或多或少都是有包装的成分。其实真英雄，就是普通人，这个社会，辛苦工作，努力生活的人都是英雄。和宣传的那些英雄一样伟大。,0,0,0,2022-08-01 13:02:01,来自四川,3830294880721108,小小愚鱼
7124816769390707469,还没看到此文。[红脸],0,1,0,2022-07-27 06:50:04,来自山西,6137775778,宁静运城市
7125788518584304425,咋看的是抄袭呢！视频里的二舅积极乐观活得通透，作者那么幽默，把那些场景写得让人忍俊不禁，却又觉得那么深刻，这是吴标华的二舅根本比不了的。,0,0,0,2022-07-29 21:39:38,来自新疆,102061680281,海风18157
7124822988637782824,平淡之中的深情，所以才能被大众接受传播。,0,2,0,2022-07-27 07:13:17,来自浙江,149130903044397,上进的艺术家9p
7126741151675646761,老婆的亲戚就不是亲戚了吗？见面就不能叫了吗？这是天大的笑话。,0,2,0,2022-08-01 11:16:27,来自河南,18082037298,我的昵称不告诉你
7126742025063596836,“…涉及内容虚构被撤销推荐”，作品如果是正能量，有励志且对现实社会不良现象有正确批判观点应该推荐，因为故事非新闻或报道性，为了增添作品的文彩和可读性虚构些也无可厚非…是吧,0,1,0,2022-08-01 11:20:16,来自广东,104968242850,潮社E哥
7125006046586454796,我二舅年轻时是包工头，年纪大了开始卖煤，近些年生意难做身体也不太好，七十岁了终于下定决心安心养老。,0,12,0,2022-07-27 19:04:11,来自辽宁,2352587410779422,jjlzjl
7125044104719024908,为什么要接走呢？又不是见不得人的事，害怕什么，别人来探望不好吗？又可以改善一下生活,34,7,3,2022-07-27 21:31:29,来自广东,98117518207,14525896
7126752563751846692,大家看了，感动了，产生共鸣了，由此激发自己的斗志了，这还不够吗？还要一个字眼一个字眼的扣？,0,1,0,2022-08-01 12:01:13,来自江苏,1473761770,小米饭1018
7126788088827462415,正能量就好啦！,0,0,0,2022-08-01 14:18:44,来自黑龙江,102122437168,五棵树人
7126772361117860620,文学创作，什么时候必须百分百真实了？能感动人，感染人 教育人，不就行了吗,0,0,0,2022-08-01 13:18:09,来自山东,2066717146875150,好好学会长大
7125641181950313257,"作品怎么来的不重要，
好就行",0,1,0,2022-07-29 12:07:55,来自山东,73655619430,琉璃飞
7126649290529030916,文艺创作硬要按公安查案的要求审。再有老婆的二舅不是他二舅只有六亲不认的人能有此结论。[呲牙],4,88,1,2022-08-01 05:23:55,来自内蒙古,75952203890,逍遥246092761
7125648759098770215,底层生活中的《二舅》，其实很多，我们多少人对此熟视无睹？如今，《二舅》竟然成了金矿，也许不久，各种《二伯》、《二叔》会席卷而来，无语😓,0,0,0,2022-07-29 12:38:04,来自河南,58008666413,焦作峰哥
7126703220277232395,只要是积极向上的视频都可以推荐，哪有十全十美,0,4,0,2022-08-01 08:50:05,来自山东,92910014808,龙行天下278006613
7124708839333249807,今天微信朋友圈两个人发了二舅，不知所以然，也不喜欢看视频，就没看，原来很有故事。大概讲什么的？,3,8,2,2022-07-26 23:51:13,来自广东,105201261390,长缨在手217
7124822094198276877,二舅大家这么喜欢呀！只要大家都喜欢，肯定是不错的！,0,2,1,2022-07-27 07:10:49,来自内蒙古,53209973152,博学菠萝8V
7126692161991000873,其实发表的时候提前提醒：本篇根据真实人物和事件改编，有艺术加工成份。如有雷同纯属巧合！,0,5,0,2022-08-01 08:06:39,来自陕西,82030809062,Dahuaxiyou
7124819655776617247,在现在的农村有着很多这样的二舅，淳朴，善良！,0,1,0,2022-07-27 07:01:08,来自湖南,3073860918055843,浪淘沙沁园春
7124988550122128163,“起于线上，止于相忘，渺渺神交一场”,0,46,0,2022-07-27 17:55:24,来自广东,830851516206269,行者孙的走读星球
7125623636102251299,这有什么质疑是，比较吴标华文章中的二舅和衣戈的二舅，明显此二舅非彼二舅。再说二舅多了去了，农村会干木工活的二舅也多了去了。有些人就总是怀疑一切，见不得别人的作品好，自己没本事没能力弄一个好作品，只喜欢挑别人的剌。,0,0,0,2022-07-29 10:59:46,来自安徽,18255249494,清风轻步水云间
7125089848788517669,看了一遍，没理清宁宁的人物关系。,10,0,2,2022-07-28 00:31:18,来自湖南,64505604338,左右1949
7126673053928440617,管他呢 反正我看完了 感动过了,0,20,0,2022-08-01 06:52:20,来自甘肃,76459349131,无情客28
7124792110603764512,二舅是啥？专门看了视频，原来是正能量，支持！全网推！,0,3,0,2022-07-27 05:18:06,来自广东,108263530237,哈哈遇见是缘
7126715765503787789,视频写了100%真实吗？,0,1,0,2022-08-01 09:38:38,来自江苏,93213386875,每日看新闻的宝宝
7124732750405780265,让人肃然起敬！,0,3,0,2022-07-27 01:26:37,来自北京,492189135156606,红梅花开——111
7126726500149789475,这有点类似司法的程序正义，你再感人，但是事先不声明是演戏，那就是欺骗，所有赏金理应退还。三国演义不管怎么编，人家告诉你这就是个小说，没毛病。你信誓旦旦说这二舅是真的，就是诈骗行为。,0,1,0,2022-08-01 10:19:14,来自广东,1376227128510440,可说呢臭不要脸的
7125572387185525545,现实中有句话叫做人红事非多，更别说网络上谁也不认识，想说什么就说什么了，作者这样冷处理是对的。,0,6,0,2022-07-29 07:41:14,来自河南,1754474939688888,荷韵悠然
7126657647050785571,虚构[捂脸][捂脸][捂脸]我们爱看这样的虚构[呲牙],0,26,0,2022-08-01 05:53:41,来自江苏,59142556386,红斑马2
7124807961268519715,和我的哥哥很像，只是他不残疾，就是脾气不好，但心灵手巧。,0,1,0,2022-07-27 06:15:36,来自北京,50371199137,卧石
7126712897124385570,视频还是个好视频，作者最不该的就是保证属实，每一个字都属实。,0,4,0,2022-08-01 09:26:58,来自广东,2141492408485163,依依可见前世
7126674895547220743,以后拍电影也审查，和事实但有一点不符的不许上映。,1,3,0,2022-08-01 07:00:40,来自安徽,4275901988,昆仑草37126525
7124807463773209376,在B站刷完视频后10分钟就推给我了这条头条，厉害了，大数据。,0,2,0,2022-07-27 06:14:32,来自山东,325916942402308,霹雳侠
7126728788977124136,自己二舅跟妻子二舅有区别吗？为啥是虚假？,0,0,0,2022-08-01 10:28:09,来自河北,111580630902,跟着小白学财税
7125283604745339656,故事真实的何惧流言蜚语,0,2,0,2022-07-28 12:59:55,来自北京,110274624972,哈哈飞飞
7126635702498362127,二舅也触犯谁的利益了？这么卑微而坚强的活着污了谁的眼？,16,191,3,2022-08-01 04:31:53,来自安徽,6831626885,就是点赞哥
7126542455222567684,说说哪里是虚构的，不给理由不能说服大家,3,39,2,2022-07-31 22:25:56,来自上海,55036626587,鱼肉虾饺
7126741837322896136,天！这个被撤销太可惜了，非常完美的电影题材,0,1,0,2022-08-01 11:19:45,来自贵州,1609309991218269,王雯萱
7126704950910108446,有感动到就对了，其实身边也有这样的人，何必去纠结他是不是你的二舅呢？,0,2,0,2022-08-01 08:56:23,来自福建,101025862349,博学多才的圆月xT
7124673949065446180,这up主文案写得太棒了，流畅中又不乏幽默。,0,39,1,2022-07-26 21:34:47,来自广东,4372545699,五轮真彦
7124979841157841705,平凡真实的生活是被人羡慕而不是被打扰的，不要去扰乱平静的生活！,0,13,0,2022-07-27 17:21:39,来自福建,108396247065,灵机自在
7124722841320915746,今天下午抖音里刷到这个视频。听后很震撼。也及时点赞了,0,5,0,2022-07-27 00:46:52,来自浙江,50023165852,啸云杭州
7124996408650089251,不能因为是有和他人写的文章相似就说成抄袭，只有有利于国家发展，社会稳定，人民群众喜闻乐见，题材健康就好，如果以前有人写了类似的文章没有流传，那只能是他们的失败，不能因为后来者居上就心理不平衡，这不是正能量,3,19,0,2022-07-27 18:26:05,来自河南,57179458858,聪慧辰星S8
7126745317701141259,虚构怎么了？艺术创作本来就可以虚构适当夸张嘛，如有雷同，纯属虚构，怎么不可以了？内容上引起共鸣，冷峻的玩笑，没有躺平，应该宣扬，不要过分要求内容真实,0,0,0,2022-08-01 11:33:08,来自河南,1187090133425368,快乐的饺子fx
7126730660215374599,"妻子的二舅难道就不是二舅吗？
如果因为这个理由被删，简直就是无理取闹",0,0,0,2022-08-01 10:35:21,来自山西,1252258299,三张王517
7124795474275468040,二舅是啥？专门看了视频，原来是正能量，支持！全网推！,0,1,0,2022-07-27 05:28:09,来自江苏,11008675862,njgsls
7125009414549553956,视频文案把二舅叙述的丰满高大，内涵深刻，励志的榜样，当今不多见的好素材，值得赏读！,0,8,0,2022-07-27 19:16:56,来自江苏,55247485830,别于凡夫
7124995128099472168,没觉得有什么“抄袭”，除了“二舅”这个称呼相同，没觉得有什么相同！,0,47,0,2022-07-27 18:20:58,来自天津,51321097053,风中的纸屑0119
7125295578376405796,除了二舅和木匠是一样的，其他都不一样啊！不能你写了二舅，其他人就不能写了吧,0,21,0,2022-07-28 13:47:33,来自山东,105461254443,duangduang66
7124815901538386699,我看的泪流满面，不知道为什么哭，就是很难受,0,1,0,2022-07-27 06:46:50,来自山东,110102878552,鸽子9402
7124939373405422347,我是不是太老土了，居然不知道B站,1,1,0,2022-07-27 14:45:30,来自重庆,111266342255,与你同在哈哈
7125006910663328552,只要故事是真实的，管他什么流言蜚语呢，支持作者！,0,7,0,2022-07-27 19:06:50,来自天津,88811307994,无忧26275
7124819256327619369,《二舅》击中的是二舅的人生信条，二舅的为人方式，二舅待人的态度。二舅也让我想到我哥，我哥也是一个和二舅差不多的人，他的乐观豁达也总是在感染我。酸甜苦辣，生老病死，都是人生的颜色，你的感受，其实就是你自己的喜好。,0,5,1,2022-07-27 06:58:51,来自广东,60861369950,路过别人的风景
7124725241221317391,马上去搜一下，看看内容是什么,0,2,0,2022-07-27 00:55:36,来自安徽,5870184391,星凝紫怡
7126731048922268416,现实总比文学创作精彩，好好去了解群众，会发现很多让人震撼的题材,0,0,0,2022-08-01 10:36:45,来自新疆,58237900945,喜欢分享的朋克女孩
7126687501242663691,当他说不希望那个二舅被打扰，我就觉得怕被挖出来内容不符[捂脸]，往往越是煽情的东西，文学渲染浓厚，可能对不准的情况越多,0,0,0,2022-08-01 07:49:34,来自陕西,52304013703,嘎嘎嘎嘎达头
7124995844663231265,抄袭了“二舅”两个字[偷笑],0,20,0,2022-07-27 18:24:47,来自北京,62910105247,云边无心
7126771882954900237,他二舅那样故事的人，很多农村都有，但艺术加工成分有多少，很难说,0,0,0,2022-08-01 13:16:00,来自江苏,2463360455542302,张律师Lawyer
7125556413036233507,作者的表述原于生活高于生活值得赞！,0,3,0,2022-07-29 06:39:34,来自江苏,74438864227,王慧华6
7124682994849710883,现在的媒体也是谁火就褒奖谁 这更是一种感性的选择性褒奖 是一种导向性的怪象,0,18,0,2022-07-26 22:09:45,来自四川,6175533884,xmt000
7125197487078097697,看了视频 讲述的这些事迹 是真是假？ 还是自己编出来的？没别的意思 只是觉得说的真好！,0,2,0,2022-07-28 07:27:40,来自重庆,1930369106454798,晴空蓝兮夜夜
7125049964941951784,看完就只有，二舅，两个字一样，这篇作文远不如视频文案好,0,2,0,2022-07-27 21:53:40,来自山西,1864411095511687,悠闲花猫M5
7124843939529999111,只有如此清醒的作者，才能拍出如此真实的二舅[中国赞],1,0,0,2022-07-27 08:34:54,来自浙江,65383298213,SJ794
7125244147812205323,都是二舅，都是农村的木匠！这算抄吗？,3,21,0,2022-07-28 10:28:16,来自浙江,5751188342,自由溪流z
7125082951532069663,可以说，村医的打错的几针改变了二舅的一生,0,1,0,2022-07-28 00:03:38,来自河南,65149212252,悠闲荷叶Mo
7126745436497068808,这和真的是不是他二舅有什么关系？只要视频的基本事实是真的，为什么要把这样励志的视频删除呢？反过来说，网上发表的自媒体的视频，是不是完全都是百分之百的真实，而没有一点点的添油加醋呢？,0,0,0,2022-08-01 11:33:51,来自广东,51699441091,白云仙翁1
7125767115696915241,今天看第四遍这个文章了，励志哥的真善美，表现的淋漓尽致。致敬平凡的人[比心][比心][比心][比心][祈祷][祈祷][祈祷][祈祷][祈祷][祈祷],0,1,0,2022-07-29 20:16:31,来自四川,3773999127477512,墨语思悠悠
7126729614961361668,二舅是触动了某些人的利益吧,0,0,0,2022-08-01 10:31:19,来自山东,95072212447,活到我的使命结束
7124820136510571302,越是朴素的感情，平凡的事越能走λ人心。,0,1,0,2022-07-27 07:03:17,来自广东,71277007172,独一无二的悦心情
7124912813789152035,什么是精神内耗？,22,10,1,2022-07-27 13:01:30,来自浙江,59596084195,大头的条头
7125198697533047564,普通人的苦难 值得做教材吗？,2,2,0,2022-07-28 07:32:14,来自贵州,6206696234,光落幻境
7126531731419251456,基本，主要事实真实,7,49,2,2022-07-31 21:43:39,来自上海,650523326030375,历史中的人和事
7125653281728873255,二叔、二大爷、二溜子、二，都对此表示不服！,0,0,0,2022-07-29 12:55:43,来自北京,2985927871562708,Yuan曰Yuan画
7126706836204061475,以后最好加一句：本故事纯属虚构，如有雷同实属巧合,0,2,0,2022-08-01 09:03:36,来自广东,64013706182,目镜x80
7125696836949852936,我不认为抄袭，让可能就想谢谢二舅的人生。没想到会火而已。,0,0,0,2022-07-29 15:44:21,,3368493510559707,若隐若现如浮云
7126712238266401543,二舅很励志，就算虚构也很励志，人残志坚，自強不息，中国人人有这志气，中国不是更快強大。,0,1,1,2022-08-01 09:25:00,来自上海,22956016145,多才多艺豆浆Sq
7124995848945009421,现在网络太可怕，凡是火的东西，都被网曝,0,11,0,2022-07-27 18:24:10,,3874325362120083,充满元气的睿智追梦人
7124889313187791620,我看完了，依然精神内耗，看来我已经不能从视频上治好我的精神内耗了，也许告别手机，拿起书本才是好办法。,0,3,0,2022-07-27 11:31:20,来自山东,3856711756286366,云崖水暖
7126771126323364643,喜欢就当微电影来看,0,0,0,2022-08-01 13:12:39,来自广西,4309708456857661,绿城锦绣
7126690493081404195,不论是否涉及虚构，这类带给人们鼓励上进的正能量精神食粮是任何时候都需要的。,0,2,0,2022-08-01 08:00:05,来自北京,1389418632447304,没文化
7126733773039403809,如果因虚构就撤销推荐，那请问一下，那些小说、电影有多少是真实的？这里面是否有不为人知的猫腻？,0,2,0,2022-08-01 10:47:25,来自江苏,962791554429896,順達國際
7124878227830915848,看着文字版采访眼眶湿润了[流泪]我生活在北京这么大的一个城市，一直在平衡“出人头地”和“过好自己的生活”，不知道该选择哪一个。,0,0,0,2022-07-27 10:47:58,来自江西,61324063928,Z1708
7124818058287760169,二舅是啥？专门看了视频，原来是正能量，支持！全网推！,0,1,0,2022-07-27 06:54:24,来自陕西,88644059927,九月7102
7126572894314496808,一出来朋友圈各种推…看了没两分钟就关了…一点没治愈…,5,16,1,2022-08-01 00:25:00,来自广东,1952378888917406,千刀并发万剑归宗
7125012038878905092,此前《二舅》视频曾被质疑它的真实性。,0,3,0,2022-07-27 19:27:13,来自河南,237932696570403,依然
7124962486612509481,人有活着的勇气和担当才不枉为人！,0,25,0,2022-07-27 16:14:23,来自辽宁,4164603834020397,仁爱艺术家Ca
7126731965063463718,这是个作品，艺术来源生活而高于生活，能看到二舅的乐观生存足也，何必非到刨根问底呢,0,1,0,2022-08-01 10:40:26,来自四川,2348162736726616,幸福画中人
7124824858458587938,其实农村有着千千万万的二舅这样生活着，他们鲜为人知，默默无闻的活着！,0,16,0,2022-07-27 07:20:45,来自山东,3355310031382119,烟威故乡人
7124973902379533097,那个喜欢二舅的女人，她的人生也值得思考,0,0,0,2022-07-27 16:58:33,来自北京,58623255620,青春美少女组合
7124746481353622287,b站就是哔哩哔哩吗？,6,13,0,2022-07-27 02:22:26,来自重庆,102655106501,wohayoyo
7126749630721295137,"这样苛责一个作者是不合适的
如果按这个标准来要求真实，请告诉我们这样要求的真实目的是什么？以前也是这么要求每个视频都要比二舅更真实么？",0,1,0,2022-08-01 11:50:19,来自河北,3843691691,独自鸣叫的蝈蝈
7126737748484391720,这本来就有艺术品的成分，来源于生活，高于生活，100%的真实本来也不可能，如果这么严苛的话，还有什么创作可言？,0,3,0,2022-08-01 11:03:08,来自江苏,518604661721391,微笑艺术家5P
7126731494726484736,不要说感人不感人，要正视二舅背后的问题，这才是文学创作的意义，,0,0,0,2022-08-01 10:38:33,来自新疆,58237900945,喜欢分享的朋克女孩
7126730556805219072,阿Q有没有虚构成份？祥林嫂有没有虚构成份？闰土有没有虚构成份？,0,0,0,2022-08-01 10:35:01,来自河南,51060060663,韩大侃
7124969423022375720,这么做是对的，不应该打扰二舅平静的生活。,0,20,0,2022-07-27 16:41:17,来自山东,60379840530,自在清泉123
7126663281044914947,其实这也不是记录片，没那么较真，当个故事看看，就得了。艺术多少有些渲染，有些夸张，只要受用就好。,1,32,1,2022-08-01 06:16:03,来自河北,6814776390,诺亚星云
7126529107609338665,只有假的才能顶流，因为可以根据市场，进行精准投射，如果真的就比较难了。,2,96,3,2022-07-31 21:33:24,来自上海,5351057145,维清weiqing
7126744905535849257,不管有没有虚构的成分，但其揭示的内容，宣扬的观点对人是有益的！再说，我的二舅与我妻子的二舅也是我的二舅有必要抬这无聊的杠吗？,0,1,0,2022-08-01 11:31:06,来自山东,2919892856629304,时髦花猫l6
7126536882078745344,没看过，看了标题，看了几篇介绍的文章就很多疑惑，关键这么多人信，太容易被骗了被蛊惑了。。。,4,24,3,2022-07-31 22:03:43,来自山东,54390305676,小刀学地理
7125000753894130432,哎，咋说呢，我二舅大概也是这样的，聪明，可惜那个特殊年代不能上学，也是学了木匠，一生艰辛，已过世三年，仍清晰的记得二舅乐观开朗的笑容……谁说谁抄袭，或许只是有那么一点相似的影子吧。同一代人，是有些相似的。,0,8,0,2022-07-27 18:42:42,来自北京,764896995977085,锋锋火火
7126673050853983009,"多年前看过某方便面电视广告 ，违规处罚：颤巍巍的碗里出现大块子牛肉，虚假！和事实大小不符。
二：一掀开碗里出现一头牛，可以！属于艺术夸张。",0,15,1,2022-08-01 06:53:17,来自河北,60080606692,冀教之窗
7126357234258330406,"古今中外人生在世
祸福一路相随
二舅聪慧坚韧敢斗善斗
事实证明自强不息的中华民族
是生存能力最强的民族",0,0,0,2022-07-31 10:26:16,来自江苏,86407847619,九章算经
7125356438150464286,这就算抄袭啊，别人二舅不能干木匠呗[捂脸],0,0,0,2022-07-28 17:43:19,来自河北,92465496447,真他娘是个人才
7126737667370681123,媳妇二舅也叫二舅，如果以此理由，可以说所有视频平台除了个数新闻，其他都不能推荐，没有一个不是虚构的，甚至是谎言谣言,0,0,0,2022-08-01 11:02:35,来自云南,1855621564478280,西部飞尘
7126577110272967437,"我一看就知道不少片段是""艺术加工""的[做鬼脸][做鬼脸][做鬼脸][做鬼脸][做鬼脸][做鬼脸][做鬼脸]",1,9,2,2022-08-01 00:42:23,来自江苏,6167307257,为什么会变成这样呢
7126672536662196995,哪个视频剧情100%是真的？就更不说电影电视剧了,1,10,1,2022-08-01 06:51:49,来自河北,98442116040,水尝无华121
7125619857374561064,这才是始于自然，回归于自然。视频制作本身就是源自于生活的方方面面而已，不管真与假，虚与实，好与坏，大家都不要的过度指责，你我心里都有数，但愿我们的国家越来越好，让社会底层的人们活得更好与更有尊严[祈祷][祈祷][祈祷],0,0,0,2022-07-29 10:45:14,来自广西,698897851758251,奔向复兴
7124976590135804711,生活中有好多的无奈！现实生活中，心想事成的事没有那么多，只能是随遇而安！小说（活着）里的福贵何不是这样的！,0,7,0,2022-07-27 17:09:59,来自贵州,52907453816,han255
7126741066820567838,原来妻子的二舅不是二舅，二舅是因为残疾证得罪了谁……,0,0,0,2022-08-01 11:16:42,来自北京,70414431031,伊克斯派克托派丘姆
7126605647307277095,匪夷所思，妻子的二舅自己不叫二舅，难道叫那个男的？！,0,67,1,2022-08-01 02:43:08,来自山东,111615404482,创业10年的邪头
