7126746665989948201,艺术都高于生活，我觉得没问题，他又没说具体村子，具体人名.抖音里的段子99%都是抄的！,2,66,1,2022-08-01 11:37:51,来自北京,58623255620,青春美少女组合
7126699116649825037,每个名人传记都是百分百真实的吗？我看了这个短视频，很励志很感人，不管他残疾的原因、是不是拍摄者的亲二舅，我是他当成一个励志小电影看。身残志坚的二舅确实鼓舞了很多人，比其他乱七八糟的视频强多了。,34,691,10,2022-08-01 08:33:45,来自山东,86717130645,小蛮幺
7124994450845369122,[微笑][微笑]二舅还是他的二舅，姥姥还是他的姥姥，文章或许有艺术的修饰，但生活是现实的。选择支持衣戈猜想。,1,924,7,2022-07-27 18:18:21,来自陕西,2590084826406547,秦观鹊桥仙
7126693048184652551,虽为纪实作品，毕竟也是一个作品，有基本的真实，大多数的真实已经很不错了。没有十全十美的作品，不必过于苛求。该作品文案写得好，拍得也不错，更主要是故事打动了人，引起了深深共呜。我认为比起网络上允斥的那许多编造的雷同的“情感故事”的价值大太多了。,17,502,16,2022-08-01 08:10:50,来自四川,109139340652,川南老岩
7126667514943161092,夫妻双方不能互喊吗？老婆的二舅不是丈夫的二舅？,50,996,6,2022-08-01 06:32:02,来自山东,63539280659,饮水思源7690
7124966837590459175,网暴太可怕了,10,151,1,2022-07-27 16:31:56,来自河北,88106702777,南山草木香
7124945530052625152,起于线上，止于相忘，非常赞成!,0,567,2,2022-07-27 15:08:40,来自上海,2295430341729384,笨妈啸天
7126761917645341454,这个短片无论从选材、拍摄手法，文案策划、剪辑都是专业的，越专业就越容易失去真实。当然这无可厚非，它不是纪录片，不是采访，而是一种带有目的性的艺术创作，艺术源于生活而高于生活，二舅这个人是存在的，人生经历也大致如此，至于如何呈现以及想传达的内容就是高于生活的部分了。,2,7,0,2022-08-01 12:37:25,来自天津,107854450975,昼锦唐
7126694330274267904,文案写的好，让大家看到积极向上的力量就好。纠结残疾证的人才是真正有问题的！,19,358,16,2022-08-01 08:14:59,来自山东,3812708361974605,乐观的星辰M1
7124997804266816292,只要故事是真实的，管他什么流言蜚语呢,13,459,4,2022-07-27 18:31:52,来自河南,3861790832,小崔带你吃喝玩乐
7125329933580649249,这怎么是抄袭？衣戈猜想的二舅人生经历那么曲折多彩，视频和文字完美结合；这篇文章写的二舅却比较平淡。类似的地方就是：都是二舅，都做木匠，这样类似的人多了去了。社会就是这样，人一旦出名了，总会引来各种非议。赞同视频作者的做法，把二舅接到没人找到的地方很明智。,11,121,2,2022-07-28 16:01:23,来自河北,106703700434,清风书话
7126705373578871565,二舅视频很感人，喜欢看，没必要去吹毛求疵，时代真实感很强，能引起从那个年代走来的人的共鸣，这样就够了。,7,160,3,2022-08-01 08:58:18,来自安徽,72012158942,12不知道自己是谁2345
7124882044043264798,今早看了二舅视频，让我想说说我的二姨夫，上周五去世的，77岁，二姨夫一生永远是面带笑容，邻居家老人需要抬抬搬搬洗澡这种事都找他帮忙，从来没有不情愿，在小区人缘好口碑好。二姨夫对二姨下辈子真是马首是瞻，二姨享受了所有的关爱，二姨夫真的是好人，但只有一个遗憾就是不会赚钱，五十岁企业下岗，好不容易到六十岁领到每月二千块退休金，二姨长得漂亮，年轻时追求的人也不少，这些年周围姐妹同事大都比她过得有钱，二姨牢骚挺多，二姨夫总是面带笑容不争辩。二姨夫的死也是因为钱，一个多月前就感觉乏力呼吸不畅，表妹要带他看医生坚决不去，说看也没用白花钱，上周五下午呼吸不畅赶去医院心肌梗死了，周日火化下葬，表妹哭着喊着的最多的话就是二姨夫一辈子省钱，为了省钱命都没了。二姨家表弟表妹收入不多，日子过得捉襟见肘，但也都是继承了二姨夫总是面带笑容，阳光积极，每次看到他们都让我很受鼓舞。,0,37,0,2022-07-27 11:02:26,来自山东,5892282202,Lswqsb
7126706072358060811,70年代残疾，90年代办证，哪里虚构？,1,27,0,2022-08-01 09:01:12,来自河南,109631193043,LW0673
7124994388178469636,可能二舅们的经历相似吧？？也可能两个人的写作水平差不多？？,32,253,11,2022-07-27 18:18:57,来自陕西,5520107979,仙女大妈笑以苛
7126772003385672479,有啥假不假的。我的亲戚的残疾证，年年换的时候，今天发微信，明天上午10点左右就得送到固定地点，否则，后果自负！他在铁路沿线上班，一下回不来，残疾证在他手里；他老婆在外地陪儿子，通融通融都不行；还有一次，办事人员说她要交儿子的保险费，在微信上让我亲戚的老婆打过五六仟元，说有时间下街取上钱还。他老婆和这个工作人员就是有个微信，领残疾证时见过一面，一张嘴就借五六仟元。这叫什么事？欺负残疾人的事多了去了，还虚假，都是真的。,0,10,0,2022-08-01 13:16:29,来自内蒙古,62606522001,梅子220365346
7126696571051983629,二舅写得好！应该推荐！,3,190,4,2022-08-01 08:24:27,来自北京,92997130743,红豆7747
7125039992933942052,一件很好的事情，被一些好事者挖得让人恐慌。就让人家安安心心、安安静静过自己的日子不行么？！,8,101,4,2022-07-27 21:15:15,来自浙江,50287133343,半生李
7124747630185693990,看过这个视频，温馨，感动，主人公不屈不挠,0,152,3,2022-07-27 02:31:19,来自福建,4142560058023691,薇薇逛红尘
7125590672568501026,文字相差不止一点点，文中的二舅和视频里的二舅，相似点只有一个：会木匠活，但视频里的二舅因少年发烧打针而突发变故，整个人生自强不息！令人震撼，敬佩！那些说抄袭文案的人，到底有没有仔细看过视频以及对比这篇作文？？？,2,14,0,2022-07-29 08:52:04,来自福建,52663790152,conniehan
7125003689965650701,拍摄剪辑文案解说都是非常专业，有人质疑也很正常。如果想核实真假，希望有局外记者采访同村邻居可以得到答案吧。,9,85,2,2022-07-27 18:54:27,来自四川,61167348986,大王来巡山00
7125084244724122409,视频看看就好，真要把真人真事扒出来，谁也禁不起考验,9,67,4,2022-07-28 00:07:49,来自江苏,56006769837,股民小咩
7126791547047822115,"谁的二舅就不用苛求了，既然证实是老婆的二舅，就说明这点没虚构。老婆口述，作者整理出来发表，没问题啊！就算不是老婆的二舅，是朋友或某个采访对象的二舅，用第一人称写，发表，也不算虚构啊。
人物真实，事件大部分真实，写的也不错，带给读者是好的感受，就是好的作品。远比各种无聊的诸如吃啊、猫狗啊、婆媳矛盾、邻居很差啊…这类视频文章强多了。
平台编辑的素质越来越差了。基本逻辑都弄不清楚了。",0,1,0,2022-08-01 14:32:15,来自上海,4503250786854872,简单自在的气定神闲
7126661201375363870,“二舅”短片撤销推荐是因为：1有些情节与实际情况不相符；2短片拍摄者夹带私货（拍摄者曾是历史老师）。,52,88,10,2022-08-01 06:08:13,来自湖北,52731105037,聪慧风声IY
7125006151053476623,为啥必须是二舅，大舅、小舅、大姨妈，小姨子不行吗？,19,56,8,2022-07-27 19:03:49,来自河南,11992230172,建造师备考小组组长
7125270781852336896,世间可以有吴标华的二舅，那是个因为衣柜被时代抛弃而落寞的木匠，世上还有衣戈猜想的二舅，这个二舅聪明睿智，既救赎了自己也护得母亲和养女的周全。更是街坊四邻的主心骨！没有所谓的抄袭，只有灵魂的治愈！感谢二舅，用他踏实的脚步告诉我们：哪怕路再崎岖，哪怕腿有残疾，人生的路依然可以走向幸福！感谢衣戈猜想，用他的激情讲述了这个感人肺腑的故事！我备受鼓舞，愿以二舅为榜样，让自己不大如意的人生活出个样来，让生命不以物喜，不以己悲，活出自我，活出方向！,3,68,0,2022-07-28 12:10:10,来自辽宁,92599547127,励志的雨荷妹妹
7124866515916800776,不建议拍成电影。就像《活着》一样，写成书作为文学作品可以得到很多人喜爱，可是拍成电影就不卖座了，因为苦难的人生虽然值得尊重，可是不会有人向往。,3,27,0,2022-07-27 10:01:31,来自云南,83858730557,元元277372958
7124809289755493155,沉痛悼念刘学州[蜡烛][蜡烛][蜡烛][蜡烛],1,9,0,2022-07-27 06:20:45,来自广东,86849990054,活成自己喜欢的样子Y
7125015390899880712,视频作者是一位优秀的历史老师，讲课风格幽默风趣，文案出彩，应该不足为奇。视频的真实性毋庸置疑，关键是二舅艰难而饱满的一生，带给我们的思索，和二舅身上面对苦难，隐忍、坚韧、顽强、热忱的生活态度，带给我们的心灵震撼，和精神自我消耗的治愈！其他都不重要了。每一个努力活着的平凡的人，都值得我们去尊重！每一个传递正能量的人，都值得拥有我们的支持！,15,249,2,2022-07-27 19:40:11,来自河北,3021070981406942,一路繁花ly
7125053186373239592,二舅的人生经历在于，从迷茫到接受到敢于面对现实，找到可行的目标，学习一技之长，自立生存。没有抱怨，没有高远欲望，顺其自然，善良助人，从中获得成就感。在纯朴的山间小村，享受自然的阳光，清爽的空气，乡里乡亲的乡情。这是很多人缺少的生活理念，高不可达的欲望，充占了大脑，纷绕的纠缠积聚了心中，活的太累太累。二舅生活态度似一股清泉，流淌过人们的心灵，冲荡着人们的思考，这是看后的感受。,11,78,0,2022-07-27 22:06:17,来自天津,3491683052820206,用户大胖
7126706354945098499,天啊，我只当一个非常好的文学作品在看，还推荐给了女儿读。奈何有些人想多了，这世道……,15,99,1,2022-08-01 09:02:44,来自天津,94703244737,东方不瘦
7124867291124335392,"在这条千万级播放量的视频里，我最欣赏的台词，是这句：
“遗憾谁没有呢？人往往都是快死的时候才发现，人生最大的遗憾就是一直在遗憾过去的遗憾。遗憾在电影里是主角崛起的前戏，在生活里是让人沉沦的毒药。”
有人质疑UP主衣戈猜想是在消费亲人的苦难，我倒是觉得，他给了我们一个与命运和解的例子，在时代风云变化中，谁都不过是麦苗，被摧毁只在一瞬之间。
二舅是别人的，感动是瞬间的，故事是他人的。自己的日子、疼痛和艰难，最终还是需要自己鼓起勇气去面对。",3,46,1,2022-07-27 10:04:30,来自浙江,99215256001,喻若曦的声色江湖
7125329669372609318,我支持作者。我看了两篇文章，我觉得没有抄袭的可能。我也这与了个头条文章写的是二舅，比作者早几个月，我写的二舅也是木匠，这巧合说明了在早些年的农村，木匠是常见的职业。我就想不明白了，为什么我们看到一个好的东西不是去享受他事来的震撼和美感，而是去莫名地找毛病、去寻找可能下脚的”缝“。欲加之罪，何患无辞！你有没有刚想说出的话和别人想的几乎一样？只是表达不同？再说了，这两个文字，很是不同。总之，支持衣戈猜想，感动于你带来的那份感动！,4,49,1,2022-07-28 15:59:57,来自河南,56209765375,安若素雪
7126662659679798050,拍二舅不行，还是拍大伯三伯周公子吧,9,478,7,2022-08-01 06:12:29,来自浙江,61640052425,吾道苑茶业
7124979607148839695,张艺谋应该把二舅拍成电影或者电视剧，准能出彩，创造票房排行榜第一,3,12,0,2022-07-27 17:20:47,来自黑龙江,108055145650,李亚茹933
7125016693776368416,现在网络太可怕，凡是火的东西，都被网曝,1,22,0,2022-07-27 19:45:17,来自山东,2867180002085694,被风吹走的蒲公英飘呀
7124994714335789828,生活远远比文案更精彩,7,312,3,2022-07-27 18:20:17,来自山东,94329185693,寂静欢喜Z
7125057591243326215,"卑微的伟大着的平凡中国人。二舅其实是一个非常平凡的中国人，一个平凡的人为什么能引起不平凡的流量和关注，是因为从二舅身上看到了平凡的中国人的大多数，从而引起来大家的共鸣。
还记得“流调中最辛苦的中国人”吗？胡锡进有句点评非常到位“千千万万个岳某善良，坚韧，吃苦耐劳，遇了难自己撑着，不怨天尤人，他们参与支撑了我们社会的底盘，做出了各自有尊严的贡献。岳某是我们社会普通百姓温良勤劳、能过的去就不给社会惹麻烦的缩影”，而二舅也是这么一个缩影。这也许就是中华民族的魂，正是因为中华民族的这种吃苦耐劳的魂，才让我们这个华夏文明延续千年不倒。",1,5,0,2022-07-27 22:23:36,来自山东,3860808903,春风下的杨柳
7125108152550343461,我百分百相信这是一个真实的故事。质疑的人说明没在农村生活过。,13,76,2,2022-07-28 01:45:30,来自安徽,110247095447,东宝和阿宝
7125422111207818017,"看了两篇文章，没有觉得抄袭。
小时候写过一篇作文，同学看了说像抄袭，并给我看了，我一看，自己都觉得像抄袭，但是我确实没抄袭，因为我写的是下雨天妈妈骑着自行车送我上学，情节很熟悉，所以两篇撞一起了。但是我清楚记得那时我看着两篇相似的文章，说不出一句解释的话。
但是这两篇不同，唯一类似的就是：二舅，木工。其余没类似的，不能说抄袭吧",0,13,0,2022-07-28 21:58:21,来自河南,16428718973,马小哈10
7125049465337086761,"除了两个二舅都做过木工活儿外，看不出任何相似之处，衣戈猜想的文笔更像是汪曾祺、余华、张贤亮，写苦难，也写光辉；有眼泪，也有温情；有超脱，也有世俗；两个字就是： 生活！
谁能抄袭谁的生活呢？",6,179,1,2022-07-27 21:51:37,来自河北,105059701215,木棉和橡树
7126671324529132291,精神内耗是什么意思？,7,5,0,2022-08-01 06:47:15,来自广西,65404452472,觅大叔
7124867040602964750,我的叔叔当年也是一个聪明娃，因为赤脚医生打屁股针半身瘫痪，后来多次治疗能走路了，但还是成为了跛脚。遗憾，可惜，心痛!,4,11,0,2022-07-27 10:03:31,来自黑龙江,6037726191,小悠生活随笔
7124933031995310855,记住二舅勤勉为人，善良待人，积极乐观，直面生活磨难，不折不挠就行！努力于自身修为，不断完善自我、成长自我，散发人性光芒和人格魅力！,9,236,0,2022-07-27 14:20:39,来自重庆,59146568382,行走之
7124997898021995299,这哪儿跟哪儿啊？有个二舅都是抄袭啦？作者写了一个二舅就不能允许别人家也有一个做木匠的二舅了？不然就是抄袭了，这也太搞笑了,4,66,0,2022-07-27 18:31:40,来自浙江,99683886824,毛哥哥就是我
7126723526924665615,哪个视频都是真实的，大家喜欢，触动人灵魂深处就行了,0,12,0,2022-08-01 10:07:37,来自山东,94358417463,岁月静好yy0806
7124865078838969095,二舅的残疾证在视频过了后 办下来了[微笑][微笑][微笑][微笑],2,5,0,2022-07-27 09:55:51,来自四川,1651470344,南无奥特曼菩萨
7125005277719905062,这怎么算抄袭，二舅是真二舅,0,102,1,2022-07-27 19:01:13,来自河北,88106702777,南山草木香
7126772990066475806,老婆的二舅也是二舅，老婆全家的亲戚都是亲戚，没毛病。腿部残疾究竟怎么造成的，残疾证到底办没办，把证据亮出来。虚构这三点并不能对视频有提升作用，这视频的精华完全不在于此，所以我倾向于没有虚构。,0,2,0,2022-08-01 13:20:22,来自黑龙江,104724231320,过客JJ
7126670808529404685,艺术是源于生活而高于生活的，作品宣扬正能量，使人看了有所感动，有所思考，这已是难得的好作品，即使有所虚构也无可厚非。,2,102,0,2022-08-01 06:44:56,来自安徽,1820443046056670,玉壶藏心
7126541374967186187,我是90年农村长大的，看了二舅这个视频我就觉得很假，打家具，去北京，首长给他搓背，我不相信的，原来真是假的,33,216,10,2022-07-31 22:22:08,来自广西,12705232207,拿可乐当水喝
7126722082779513637,只是一个励志的视频么，当电视剧小短剧看不就得了，传递的也是正能量，唉……人性啊，你永远不懂[害羞],0,28,1,2022-08-01 10:02:00,来自甘肃,109459233452,qn丶蕜嘁
7126686938559873827,那个年代的农民，即使是打针致残也没人找医生的麻烦，残疾证肯定是很长时间才办理下来，工作人员态度肯定不好（那个年代都是那样）。二舅的故事很真实，不要鸡蛋里挑骨头。,16,211,2,2022-08-01 07:46:22,来自河北,76708493073,阳光xiaorong
7124743642668974859,二舅是啥？专门看了视频，原来是正能量，支持！全网推！,0,27,0,2022-07-27 02:13:02,来自陕西,94696778756,陈词陈调
7126601020742402824,"跟着老婆叫二舅没错，但对别人介绍时说这是我二舅，还是说是我老婆的二舅？同理，都称呼岳父母叫爸妈，但对别人介绍都会说清楚这是岳父母还是爸妈。
拍视频的时候可以不说清楚，但后来记者采访的时候也不说清楚，就有点说不过去了。最起码不够严谨，那干嘛还斩钉截铁的说每个字都是真实的？",19,154,6,2022-08-01 02:22:11,来自浙江,3560037131,天气天的
7126795124193133319,残疾是真，收养是真，孤身一人一生是真，木匠是真，修修补补养活自己与老母亲是真，已经够好了。这样一辈子坎坷却要强的老人，农村和城市都有很多，活着就需要竭尽全力，他们还努力活得自在坦然能发光发热帮助别人，这样的人本来就很伟大，都是平凡人中的英雄。吸引我的主要是他的文案，是他关注的视角。,0,1,0,2022-08-01 14:46:22,来自湖北,60492880342,悠闲绿豆糕
7126706717521871646,你以为我真的是因为看二舅感动的吗？中国过去的社会背景下二舅这样的人物原型不在少数，都是勤勤恳恳的农民，朴素而又真挚，平淡而又热情的生活着。作者的文案把这种平凡人的隐藏品质升华了，可能我们就是需要在同款人物中找到自己的亮点，所以更容易感动吧,0,38,2,2022-08-01 09:03:30,来自湖北,105726295848,田悠悠然
7126711452681339660,叫二舅没问题。残疾证办好20年了 ，二舅现在66岁，残疾时大概10多岁。残疾原因可能是病，也可能是打针的原因，现在基本都取消打屁股针了。,0,19,0,2022-08-01 09:22:24,来自广东,54206661496,小小明和小明
7125600052948730632,"除了二舅和木工的身份恰好相同外，没有任何相似之处，主旨和立意也相差千里万里。视频版的二舅是一个脚踏实地，直面困难，乐观善良的人，而吴标华的""二舅""更多关注的是时代飞速发展同时带来的阵痛以及一些普通人被时代抛弃的落寞。",0,3,0,2022-07-29 09:28:50,来自黑龙江,102070678653,红红火火9xo4
7125010758136152839,up主的这回应我特别喜欢！“”这些人爱说什么就说什么吧，我也不在乎这些”！句号。,5,52,1,2022-07-27 19:22:14,来自北京,259100305272663,足智多谋熊猫RR
7126727158520775437,如今网络上的内容有多少真实的？人与人接触过程中都充斥着各种虚情假意，更何况网络之上呢。,0,6,0,2022-08-01 10:21:41,来自天津,5507914424,Taurusimon
7124933367765975845,"我没有转发“二舅”的视频，但是视频的内容，我是全部都看了。实话，我不知道要有多空虚的人才需要这样的视频来治疗自己。我混杂在这个社会，起点本该很好的，却因为意外变得不好了，但是这不是我应该关注的焦点，我应该做的是向前看，对的，就是向前看，不是“向钱看”。
有些意外，总是出奇的类似，我却遇见了两次；是出奇类似的两次，同样的在猪年里同样年龄的属兔的人。意外，我控制不了，唯有的是，再次从头再来，还好，我虽然没有胡什么大牌，却也没有把烂牌打烂。我知道的是，在路上，一切都是机会。也要半百的人了，没什么需要慰藉的，当我站在厨房里，我感觉我无所不能，但是这几年却开始倡导轻食，连最后的这点东西也不需要了。“二舅”只是二舅他自己，我们应该做的也是我们自己。",0,30,1,2022-07-27 14:21:38,来自贵州,51211179817,狐瓦拉
7126670120130626315,这要是张艺谋拍的电影，一定说这就是普罗大众最最真实的人生，呵呵！,3,35,2,2022-08-01 06:42:24,来自黑龙江,3280549319805816,小样像风
7124933432966120222,真的很害怕网络现在,5,114,1,2022-07-27 14:21:46,来自河南,4336065966776652,牛牛的文小蚊
7124820989380870952,你这个二舅自强不息，我的二舅把身边的每个人逼成了自强不息,2,7,0,2022-07-27 07:05:43,来自福建,638181279806407,乐
7125725311601820447,其实我觉得不存在抄袭，因为“二舅”这样的人和故事就是我们上一代父辈们的故事。我没有看过这两个二舅的故事，但是我看完衣戈猜想的“二舅”，做木匠活，我的父亲也是这样的手艺，我们家的家具都是父亲做的。还有父亲学医，从来就没有动过收钱的念头，治好了很多人的病。我在二舅的故事中看到了很多父亲当时对待生活的身影。简单，纯粹的善良,0,2,0,2022-07-29 17:35:08,来自甘肃,6366415751,蓝雪讲故事
7125007665658413824,有些人是以此为生吧，一个生活小案，不需要质疑不质疑，选择尊重别人，让别人安静的生活。这世上，你要是善于去发现，身边，都是极其精彩的故事。而且每个时代，有每个时代的特色。默默地采风，不要打搅他们的宁静，有的人喜欢聚光灯，有的人却想安静。,1,29,0,2022-07-27 19:09:35,,2616445224107671,自然小湾2020
7126589391191474944,拍摄者妻子的二舅就不叫二舅了，你老婆的三大爷你喊什么呀？,20,226,6,2022-08-01 01:31:17,来自北京,5921816616,王封臣
7124673079288726275,"乡土中国的根
排除万难 走向胜利！这是一段人生的胜利人性的胜利（想一想二舅对医生的原谅……）
名字是平淡中见真情了",4,110,4,2022-07-26 21:31:52,来自四川,1723648102120020,杨桃yangtao
7126579127112975137,这种好视频为何如此较真，大部分真实就OK了！重要的是里面的人生哲理[灵光一闪][赞][鼓掌][鼓掌][鼓掌][鼓掌][鼓掌],17,466,13,2022-08-01 00:52:04,来自广东,3971057017947907,律政盛哥
7124852543771083560,上一个称自己没有团队的视频博主叫李子柒，然后就爆出跟背后的资方有矛盾，视频停更了,9,9,2,2022-07-27 09:07:44,来自上海,4076642182633309,天涯若比邻Grace
7125013339675116326,这两天一直在说二舅视频，到底是什么样的视频哦，二舅我也不认识，还没听说过,7,9,1,2022-07-27 19:32:02,来自浙江,3598038112934483,二丫头YAN
7126529218095170345,我不看苦难文学，（生活够苦了，我想看甜的。）所以那个视频我仅限于知道一个标题[大笑],26,313,3,2022-07-31 21:33:45,来自山东,6300860238,卡戎卡戎
7124821360803300108,二舅是啥？专门看了视频，原来是正能量，支持！全网推！,0,5,0,2022-07-27 07:08:28,来自陕西,100239972893,阳yang029
7125013420420350757,如果有二舅的账号 我愿意送上一份微薄的敬意,2,5,2,2022-07-27 19:32:30,来自河北,6500248244,上进辰星h
7126727793790337807,现在的短视频，假的太多。需要擦亮慧眼啊！,0,4,1,2022-08-01 10:24:15,来自江苏,55449322280,鹰眼视点
7126695304803943206,艺术没有必要完全真实,1,4,0,2022-08-01 08:19:33,来自湖北,52345454512,辛亥春秋
7125069418207593216,二舅是聪明的，他开始不想拍视频，就是不想要一个不愉快的结尾。（虽然他现在还不知道被接走与拍视频有关）,2,13,1,2022-07-27 23:09:30,来自广东,75715732490,杨小肥424
7126718936905073443,"妻舅也叫舅，哪里虚构了？？？小儿麻痹症是双腿，这个明显就是打针引起的，残疾证肯定没有及时办理，要不然二舅的生活状态不是这样的，
这个二舅，没人关心他，包括他的家人，",0,12,1,2022-08-01 09:49:56,来自山东,2005134099625805,奋发饭团CA
7124808708517184270,我是一个八十年代考出来的农村娃，在外面拼搏了半辈子，虽然生活衣食无忧，感觉还是只有回到老家才能找到那份安静轻松和踏实!,3,16,1,2022-07-27 06:19:09,来自河北,3639440381,安居心悦
7124994453144306466,"又怎么样呢。总是见不得别人好，真人真事还要质疑。
用这个精神去质疑社会上各种不公吧",8,285,2,2022-07-27 18:18:25,来自江苏,954016753259267,祯翕Sherry
7124994002364941059,这哪里是抄袭啊,3,69,0,2022-07-27 18:17:12,来自新疆,50268595194,明天会更好126336663
