7126523292869215008,甲醛主要是软装，窗帘，衣柜，沙发，床品之类的！[呲牙][呲牙],15,90,7,2022-07-31 21:11:28,来自福建,4142560058023691,薇薇逛红尘
7126499743286559503,主要是，就一家得病？,0,3,0,2022-07-31 19:39:29,来自湖南,89983166679,大雷chanle
7126505004537529118,本案原告证据不足，败诉[我想静静]为解决纷争，房屋装修施工单位出于人道主义关怀，希望以自有资金补偿原告5000元，该款项通过被告在本案中代为支付。,3,57,7,2022-07-31 20:00:09,来自浙江,109322405947,李娜Lawyer
7126514319608841000,我买的恒大的精装修，感觉挺好的，没啥大毛病,53,41,11,2022-07-31 20:35:59,来自河南,61626468808,恩宇妈妈520
7126507075719119650,现在这房子值二千多个W了,12,34,2,2022-07-31 20:08:02,来自江苏,17229231031,正大光明喜鹊xw
7126539984630399751,"也是佩服你。合同写
毛坯，交付精装你也敢刷卡",1,12,1,2022-07-31 22:16:04,来自广西,2370139421160078,出走明天
7126699395420373796,新房子确实是住着头晕😵,0,1,0,2022-08-01 08:35:11,来自广东,5476102928,医疗手术落后了
7126508926531273502,"不讲诚信的开发商
很多时候保险公司，甚至银行也不……",1,57,2,2022-07-31 20:15:37,来自广东,108179057974,怪怪的教授
7126665729076118272,一看就知道，都是在维护开发商的做法。[握手][玫瑰],2,42,1,2022-08-01 06:24:28,来自广东,106583007011,文妮问你吻你
7126515201306526477,这个容易判断，如果超标就不可能他一家，看看别家是否有同样症状的病人啊？,7,33,2,2022-07-31 20:39:56,来自安徽,50296278819,哈利波特130351922
7126548137191473961,就应该有较真的人！加油,0,1,0,2022-07-31 22:47:27,来自上海,104971435946,艾玛的小狐
7126699600769090304,甲醛致病本来就不好判断[捂脸],0,0,0,2022-08-01 08:35:12,来自湖北,95420431727,夏花9527
7126504154650641167,外痔不能算在开发商装修头上吧[我想静静][我想静静][我想静静],10,40,3,2022-07-31 19:56:49,来自湖北,51651299168,169313500
7126703506861441826,买二手房就不会有这种问题了,0,0,0,2022-08-01 08:50:25,,104317706688,陈凯丰教授
7126501696045679399,"简直了～这房价啊……132平也不大呀
这些钱在外地啥都解决了
人们不知道咋想的…",18,66,3,2022-07-31 19:47:42,来自江苏,2696436319527549,月明金樽
7126504363413439240,九百多万去别的地方买栋别墅不好吗？贵就代表好了？,5,10,2,2022-07-31 19:57:58,来自福建,3211020498378541,映雪博芳
7126504467771638532,中国敢买精装房的都是高人啊,16,88,4,2022-07-31 19:58:30,来自浙江,5871679953,风半帆
7126521429378057001,这要是在美国，何先生必赢,2,72,2,2022-07-31 21:03:40,来自湖北,55717889730,飛雲堂堂主
7126555785241051916,给5000就不错了 ，官司很难打，国家工程标准18883 是按一个小时密闭检测的，就是为了装修检测通关的，不负责人居健康，50325标准密闭12小时以上才是人居健康标准检测，前者宽松后者严格，标准都不一样,4,16,0,2022-07-31 23:18:28,来自山东,3588442954948904,自信阿利森0a6
7126686959216395039,"很多人装修就是在瞎装。
一层，装修只看价格
二层，装修只看外观
三层，装修只看品牌
我就问问，装修不首先看健康，不关注环保，你装修房子干什么。
房子与其说是装起来的，不如说是粘起来的。以卫生间为例，墙砖用瓷砖背胶瓷砖胶、所有砖缝用美缝剂、防水用801胶、吊顶门套边马桶洗漱盆用玻璃胶，门窗安装用发泡胶，还有小物件安装的免钉胶。
甲醛超标很正常，中国无醛胶技术唯一的是万华，万华无醛胶产量质量世界第一，世界化工排名29",0,3,0,2022-08-01 07:46:47,来自山东,2164254016551160,万华0醛全系涂料专家
7126538126562198283,1420万这套吗？,5,6,0,2022-07-31 22:09:07,来自广东,3346565647841575,进击的洋葱
7126509136228909854,甲醛主要是软装，窗帘，衣柜，沙发，床品之类的！硬装水泥钢筋地板砖有个毛甲醛。木地板也有点,8,3,0,2022-07-31 20:16:04,来自广东,51892346079,熊猫喝佰威
7126495913153676045,刚拿房就敢住[赞][赞][赞]，为了健康也不能这么任性[捂脸],3,33,0,2022-07-31 19:25:28,来自上海,3583999053406984,勇敢者1821
7126544748357616419,"都是套路，踩不完的买房坑，精装房变成了“惊装房”、“要命房”。花九百多万买个房，蕞后，住出一身病来，还投诉无门，起诉被驳回，简直是气不过啊！
一句话，买房的业主，永远斗不过卖房的开发商！",0,27,1,2022-07-31 22:34:18,来自广西,3931486643033000,蒲公英之恋1216
7126501830636585764,所谓精装，材料用的是最便宜的，否则怎么会叫做精呢？必须自己选材，否则质量完全失控,1,51,0,2022-07-31 19:47:57,来自贵州,103632350722,天高海阔加油
7126703282525143843,甲醛会得白血病的,0,0,0,2022-08-01 08:49:34,来自浙江,52712993522,贾美美vlog
7126499918168720163,所谓开发商精装房，其实就是烂装房，全国统一，不接受反驳,7,212,4,2022-07-31 19:40:26,来自广东,2656024389491664,知情达理星辰iEQ
7126688155041989380,"甲醛房该由谁监管？
检测标准二选一，哪个有利选哪个[灵光一闪]",0,0,0,2022-08-01 07:51:43,来自山东,94329185693,寂静欢喜Z
7126690154991469353,我觉得在本案中，法院应该更多的要从这个居住的实际情况去考虑，虽然现在在检测标准上有两个版本不同，但是我们更多的应该倾向于弱势群体，消费者一方，案件中房子属于精装房，你现在合同签署上是有瑕疵的，而且在交房之后，诸如很多的装修问题也不应该是精装房应该有的，陆家嘴作为全国性的大的房地产企业提供这样的商品给消费者，确实少了大企业的担当和责任！因为一个小区，一个装修问题，未来失去整片市场，这样的企业你还信任吗？,0,1,0,2022-08-01 07:58:50,来自河北,704101217730740,最爱人间烟火CC
7126495402144121639,即使甲醛超标，超这一点点，仅仅住了这么短时间，就得这么多病，显然不可能,12,14,3,2022-07-31 19:23:21,来自河北,110972561796,泉水叮咚roy
7126604993473594147,甲醛来自装修材料，就是自己挑选的材料也起码要晾半年，怎么能马上住呢？还有怎么会检不出来，甲醛释放长达15年呢！,0,0,0,2022-08-01 02:34:08,来自江西,2603279464009278,博学多才的攸攸姐
7126554306127741736,房主后续又装修了，买了家具家电，这些甲醛不能都怪开发商。开发商的装修也只是基本装修，甲醛最多的是家具里,0,4,0,2022-07-31 23:11:40,来自河南,4484075316,大白兔女郎
7126496496295772932,淸除甲醛除异味设备该上场了！😄,4,9,1,2022-07-31 19:27:52,来自上海,6499454772,FengYi92542516
7126551244734432032,"家装领域需要“佛系”的装饰工程项目的监管人才起到监护权作用。
环保建材领域的生产厂家也不要“唯利是图”，要严把原材料关，哪怕你卖的贵点，毕竟是人命大于天！[祈祷][祈祷][祈祷]",0,1,0,2022-07-31 23:00:14,来自山东,2458162010272151,东方旭旭旭旭
7126505524597654280,有一千万，花二百万在环境好的中小城市安个家。剩余八百万存银行，以4%利息计，年收入32万，当甩手老板都实现了财务自由，岂不美哉！,13,22,3,2022-07-31 20:02:19,来自四川,10163939643,淸泉石上
7126604990747001635,各地情况不同，不好说。总归开发商有质量，业主住放心。在合理范围内，双方协调。,0,0,0,2022-08-01 02:32:52,来自云南,109615788628,一心一意云南路人
7126599154096849679,上海中环附近新楼盘价格，目前13万一平以上的房子，算高档，10万出头一些的就是普通平房，什么绿化少，采光差，噪音，墙面渗水，甲醛超标，墙面地板单薄不隔音，车位少，电梯渗水都有可能发生，目前就是这样，一分钱一分货，10万一平的房子在上海就这质量[捂脸],0,0,1,2022-08-01 02:10:50,来自上海,99447749033,GrMGRMgRM
7126679919514075915,精装修就是个坑，希望大家不要上当，我现在就是住的恒大的精装修，说起来都是泪,0,1,0,2022-08-01 07:20:39,来自山东,71624826025,常青藤的海伦
7126598067024839455,开发商精装房，其实就是烂装房，全国统一,0,2,0,2022-08-01 02:06:51,来自重庆,3218975743022583,青涩天空PU
7126702112037634830,精装房经常出问题，为什么呢？,0,0,0,2022-08-01 08:45:36,来自山东,59908862720,顽强法斗士
7126500334259684129,"支持事主维权，就得有较真的人。
不过，从检测结果看，甲醛致病的可能性不大，TVOC的可能性大。特别是如果2月份入住，室内温度低，实际甲醛浓度应低于4月份的检测值。
事主装修完应该通风一段时间再入住，另外，检测时间是4月份，温度还不太高，到了夏天，甲醛浓度更高。",0,26,2,2022-07-31 19:42:23,来自北京,58679686892,行勝於言
7126694720495649547,这是明显维护开发商吧。,0,1,0,2022-08-01 08:17:33,来自安徽,111042964917,铁树也开花结果
7126662138688488232,买房的业主，永远斗不过卖房的开发商,0,3,0,2022-08-01 06:10:34,来自宁夏,76311010312,倦岫云还
7126697094756778756,老白姓倾其一生积蓄买套房，真难！！！！开发商追求利润，降低装修环保标准，坑了买房人，国家应该统一房屋环保检测标准，开发商交房时应有环保检测报告，并且有当时检测人员负责，如后期超标则追责。,0,2,0,2022-08-01 08:26:43,来自河南,6912699439,和syc
7126565832192590607,在我们这1000万，买20套,0,6,0,2022-07-31 23:56:42,来自河南,4239320345493188,阳光0407
7126502091106976549,945万，我工作十几年9400块存款都从来没有没有过，那些都是天文数字,2,2,1,2022-07-31 19:49:01,来自广西,5818777046,怀揣梦想的天涯海角
7126661644347900686,精装房你给我十个胆我也不敢去住——地板、墙材、天花板、家具、粘合剂、涂料……哪一样我不一个字一个字看明白配料表，你免费送我我都不要；买了我还心里担心你骗我，无他，就看这样的牛气公司还人道主义赔你5000元！,0,0,0,2022-08-01 06:09:29,来自重庆,3639897018,摩羯玉战士
7126691079156122407,个人很难打赢官司，,0,1,0,2022-08-01 08:03:23,来自广西,3650821361502104,一往无前天空cL
7126678974255923998,我家装修完我就找了专业的除甲醛的除，然后还放了两年，才住进去。,0,0,0,2022-08-01 07:16:03,来自江苏,2772199476,天音鹄途蚕丝被
7126698584682070821,这个人明知道甲醛超标，住进去监工？,0,0,0,2022-08-01 08:31:47,来自四川,3953996563,玥玥小小宝贝
7126691655860290304,开放商就是忽悠客户没有他们懂条例,0,0,0,2022-08-01 08:04:45,来自上海,1557349299651980,行星laura
7126527012285563682,扯皮到何时，原告花多年积蓄买房，就是这个结果，能斗过开发商吗?,0,13,2,2022-07-31 21:25:17,来自天津,13689843309,大胖刘刘
7126504409391203112,有关清除甲醛除异味的又得涨一波价,0,0,0,2022-07-31 19:57:40,来自广东,2648054409202717,村间田野
7126665022969414435,检测甲醛必须关门三五天再进行检测，这是常识，如果不被认同，可经法院出面，甲乙双方找一个共同认同的检测部门去检测，有问题，开发商不应该回避，应该寻找解决问题的方法，这才是王道，支持这位先生继续起诉，直到问题解决为止,0,1,1,2022-08-01 06:21:54,来自海南,94964839923,瑞泽宥霆394
7126550547628442399,"故意找茬的，文章写的不全面，房价跌了没有，买房人是不是炒房缺因为楼市低迷无法脱手，买房人近期是不是资金出现问题，是不是提出了索赔的要求，同样的问题有多少同小区的业主提出来…
很负责任告诉大家，其实最大的污染室内空气的，是家具，软装，特别是地毯、墙布、贴皮家具",0,1,1,2022-07-31 22:57:13,来自浙江,72186426214,44岁1978
7126670233363825442,无良的开发商，你根本斗不过,0,1,0,2022-08-01 06:41:33,来自湖北,73050116130,灵敏原野kJ
7126686442646553352,法院坚持公平和正义,0,0,0,2022-08-01 07:45:12,来自云南,63347505916,訚訚如也111
7126647793838146304,为什么推广精装房？,0,1,0,2022-08-01 05:16:40,来自江苏,14975367779,云淡风情33
7126690585179669287,精装，有时候木制地板就是有毒呀，应该看看其他人家，都咋样了，另外体质不一样也有差异,0,0,0,2022-08-01 08:01:05,来自陕西,2260218119455704,小小晴光
7126687322871579424,对于我这种买不起精装房和上百万十万东西房子的我没有那种烦恼,0,0,0,2022-08-01 07:48:58,来自四川,105119741475,339spce
7126519470608106281,不通风半年一年的真不能住,0,5,0,2022-07-31 20:55:52,来自北京,52670288262,不吐不快
7126566064796435211,"换一种方式告呢？
合同毛坯
实际精装
要求恢复毛坯并赔偿损失
1000多万的房子买了
自己装修下不过分啊",0,0,0,2022-07-31 23:59:55,来自河北,51088036875,一个网民5508
7126539026961908487,高学历，高智商应比常人更清楚新装修的房子危险性。至少闲置通风三四个月或半年才能入住。过度装俢的一般甲醛多年以后还能测出残留。抓住了质量却损害了健康。,0,0,0,2022-07-31 22:12:24,来自甘肃,1925941311313031,高冷溪水S
7126576032299123486,新房最少放置6个月以上。,0,0,0,2022-08-01 00:38:16,来自广东,3400136902,鹏城小高
7126654565235720993,装修这样让人怀疑房子的质量,0,1,0,2022-08-01 05:44:23,来自湖北,111146228193,物理悟理WL
7126682796323799808,相信陆家嘴，给你一个锦绣前程。,0,0,0,2022-08-01 07:30:16,来自重庆,11470370455,懂皇No1
7126649004968362752,看看其他业主咋样,0,0,0,2022-08-01 05:20:51,来自陕西,4474034738,毛毛雨180
7126516622504313613,所以精装房买不得，哪怕买二手房，毛坯，自己装，二手房。比起命和生病，房子真不重要。在医院里钱就不是钱,0,7,1,2022-07-31 20:45:23,来自上海,109333450808,站在云端的天使
7126685483802870536,上海冬天屋里比外面冷！,0,0,0,2022-08-01 07:41:03,来自吉林,3680805613740484,jljl415
7126685124795843363,估计陆家嘴集团是国企？,0,1,0,2022-08-01 07:39:16,来自河南,68291923851,書豪DG
7126546437915165453,拆了重新装修吧……,0,0,0,2022-07-31 22:41:14,来自辽宁,51465718596,金玉yyy
7126505526666216192,你永远干不过开发商[捂脸][捂脸][捂脸],0,13,0,2022-07-31 20:02:05,来自辽宁,86386920062,一丝不苟艺术家Sq
7126670153248785183,别买精装房，唉😔,0,0,0,2022-08-01 06:41:59,来自山东,3963064371643102,灵巧海燕90
7126682293850309412,官司没打好，问题没解决。,0,0,0,2022-08-01 07:28:58,来自浙江,110626363018,上海婚姻律师
7126520679147242251,其实大部分精装房都会出现这种问题，和发展商扯皮费神还费钱。我是一收楼就找专业公司来除醛，这钱可不能省。,0,4,1,2022-07-31 21:01:28,来自广东,2977131982758556,亮亮哈利宝贝
7126542164179452683,真有钱这男的😂,0,0,0,2022-07-31 22:24:38,来自河北,91747283560,漫步思雨z
7126542699524129539,[抠鼻][泪奔][抠鼻]有钱人的世界，我们[吃瓜群众][吃瓜群众],0,2,0,2022-07-31 22:27:07,来自福建,1464985472218280,人生苦短旅途中
7126527926744810275,精装修房就是怕材料有问题,0,1,0,2022-07-31 21:28:56,来自湖北,686513284715528,初夏的青绿
7126546371012313889,所有味道来自苯，甲醛是无味的哇,0,0,0,2022-07-31 22:41:30,来自湖北,3878671458251549,船船船船船
7126510056698888974,和国企打官司，比登天还难,0,15,1,2022-07-31 20:20:00,来自广东,102416521074,xfane
7126510747878277929,所谓精装就是设计、装饰好看而已，材料不敢保证[抠鼻],0,1,0,2022-07-31 20:22:20,来自四川,3070291507685099,闻道在今
7126545626929922847,装修还得靠自己[捂脸],0,0,0,2022-07-31 22:38:10,来自天津,92367330840,碧海晴空5289
7126545317104861964,一句话，有钱还是自己装修,0,1,0,2022-07-31 22:37:03,来自福建,108235171381,足观音
7126675101583967017,幸福感爆棚了这下。,0,0,0,2022-08-01 07:00:51,来自湖北,5938831559,收复旧山河
7126531518377329422,就是污染的问题,0,0,0,2022-07-31 21:42:55,来自北京,81293652846,s12345u
7126503910042518307,信人不如信自己,0,3,0,2022-07-31 19:55:42,来自北京,21613229928,头条威武
7126506900225229583,等到我们花钱放心的时候才能说中国强大了！,0,10,0,2022-07-31 20:07:23,来自吉林,95818242795,狂牛527
7126509118101291790,说实话精装房并不包括家具什么的，就算甲醛超标你也要在家具没进场前测量，等到家具进场住进去以后再测，谁知道到底是精装房装修甲醛超标，还是后期进场的家具超标,0,1,0,2022-07-31 20:16:08,来自浙江,55398256005,路的原点
7126504409391203112,有关清除甲醛除异味的又得涨一波价,0,0,0,2022-07-31 19:57:40,来自广东,2648054409202717,村间田野
7126517478330483456,看来装修好的房子不能买。,0,0,0,2022-07-31 20:48:07,来自云南,63614200654,抗衰驻颜堂
7126559596592202500,交了智商税,0,0,0,2022-07-31 23:33:19,来自广西,76707678696,耗子007
7126678163954565921,收房是孩子都快一岁了,0,0,0,2022-08-01 07:13:40,来自北京,9911580425,新文化街男孩
7126588990618501895,千万不要买装修好了的房子，我亲戚就是这样得的白雪病，赔钱也无用，生命大于一切。,0,0,0,2022-08-01 01:31:40,来自广东,6055649652,乐天派山丘p
7126693021696918309,所谓开发商精装房，其实就是烂装房，全国统一！,0,1,0,2022-08-01 08:10:04,来自河南,86240864011,领悟
7126672149267465001,房屋装修甲醛超标问题普遍存在！需要从国家层面解决。从装修材料的源头治理！现市面上充斥着大量甲醛超标的材料！,0,0,0,2022-08-01 06:48:58,来自内蒙古,57685383538,LYZ今朝静好
7126506262338290445,扫黑除恶这么多年，任重而道远,0,6,0,2022-07-31 20:05:14,来自北京,66163349033,W卓而不群L
7126599441825710881,这种问题就必须找志愿者，做实验！拿第一首数据！进行甲醛影响身体指标的专业性数据分析！进行全行业索赔！,0,0,0,2022-08-01 02:15:54,来自山东,24702362924,风的问候qer
7126534156300960512,开发商都没人性，标准还变来变去，肯定是执行严格的,0,0,0,2022-07-31 21:52:58,来自天津,950398156826621,739915
7126701029869011752,法官房子甲醛超标会怎么样,0,0,0,2022-08-01 08:40:49,来自广东,6238358927,蒙嗨83198587
7126701990184239904,甲醛是健康的敌人，一定要抵制甲醛,0,0,0,2022-08-01 08:45:14,来自山东,1050771099496883,潇洒豆花sw
7126517026109375235,这装修污染再厉害也不至于进去住几天就这样,0,1,1,2022-07-31 20:47:09,来自山东,408650886422548,高冷的榴莲
7126701685459895077,向陈佩斯老师好好学习返璞归真，水泥地，红砖墙,0,0,0,2022-08-01 08:44:09,来自宁夏,93654956440,啤酒人生
7126530610004837124,中国的地产商信用可信吗？挂羊头，卖狗肉，虚假宣传、忽悠是常态.,0,0,0,2022-07-31 21:40:09,来自贵州,106639982854,空谷传声557
7126701334732456742,这个确实不好判断鉴定。随着时间推移，气味是变化的。没法固定还原。,0,0,0,2022-08-01 08:43:03,来自江苏,2251402876036311,有一说一2022
7126503713875444514,装修完后都应该空置一年，这是常识，与开发商无关。,0,0,0,2022-07-31 19:55:10,来自湖北,109088085327,用户纪舟
7126502779753169694,庆幸及早发现了，否则等得了白血病就晚了,0,6,0,2022-07-31 19:51:40,来自辽宁,1425398150208792,万家宝贝
7126609833843344160,法院发现这种纠纷完全可以找检测机构去检测一下还需要这种扯皮吗？,0,0,0,2022-08-01 02:59:14,来自上海,102694378039,不喜欢被束缚的灵魂
7126703201994933025,花钱找罪受,0,0,0,2022-08-01 08:50:30,来自河北,94592699606,真的猛士0
7126574232896570120,其实精装修里面啥都没，也就门、厨柜有一点，通下气就好了，远远不可能造成这么多疾病。至于装修质量，全国都一样，交付就等于扯皮。,0,0,0,2022-08-01 00:30:58,来自湖北,1929417706,幽灵舞步
7126589950530700047,硬装基本没啥甲醛,0,0,0,2022-08-01 01:32:54,来自四川,4477228643,怀揣梦想的still
7126557978228228875,我永远不买这样的房子,0,1,0,2022-07-31 23:26:40,来自甘肃,100022433778,厚积薄发3973
7126670832415785743,买精装房也看运气,0,1,0,2022-08-01 06:44:11,来自广东,3244398282,ygclnh
7126504943783510820,不要买精装房，精装房材料就是不可信,0,5,0,2022-07-31 19:59:59,来自四川,107874396740,智者水滴Mw
7126503459494298398,精装房千万不能买！！！！！！,0,7,0,2022-07-31 19:54:06,来自安徽,95982232811,创造晴天720
7126679226073482021,买房人心大了，当时图方便 。这个楼盘备案毛坯，你非要精装，相当于单独给开发商一个生意，他不会认真做的。这种情况还不如当时找个装修公司给你做,0,0,0,2022-08-01 07:17:01,来自江苏,57177925943,小旋风柴进2
7126555548593537829,应由政府主导，明确装修后的检测标准，有利于保护业主利益。,0,0,0,2022-07-31 23:16:57,来自江苏,3466081838574983,一路狂飙赚钱
7126556132470653732,这哥们够倔的，明知山有虎偏向虎山行！！！搞不赢的！！！唉！,0,0,0,2022-07-31 23:19:46,来自江苏,110240303161,呆呆二木
7126702936725685006,人道主义，赔偿大5000元,0,0,0,2022-08-01 08:48:42,来自黑龙江,3191852631,微笑同学嘀银河
7126694050044068621,起诉很天真，搞事是正道,0,0,0,2022-08-01 08:14:33,来自上海,4428434447805427,商业连线
7126677401408389895,精装房还想环保材料，国内不可能实现啊。,0,0,0,2022-08-01 07:09:47,来自江苏,624114523704110,倭人爱核弹
7126519380674396964,要求太高不适合买精装房,0,1,0,2022-07-31 20:56:02,来自广西,396283062525207,禾刀禾华
7126672875708941070,普通人与开发商，就是蚂蚁与大象的关系，官司很难打赢。两家鉴定机构退卷是亮点。,0,0,0,2022-08-01 06:52:49,来自湖北,52585864013,老秋哥
7126698771270189858,小编不够认真，天津案例中，两个标准，写反了@济南时报-新黄河,0,0,0,2022-08-01 08:32:06,来自江西,1007575442398856,吉探NFT
7126695238211044132,再买一套吧，反正有钱,0,0,0,2022-08-01 08:19:06,来自江苏,99195176891,凤舞2021
7126696120474452766,国企真讲究,0,0,0,2022-08-01 08:22:30,来自黑龙江,4459220878501582,养猪大户王百万
7126556930050786062,精装修都不咋样 我买了重新装修一下 开发商的材料不靠谱,0,0,0,2022-07-31 23:22:40,来自安徽,3079077766103181,网上吹牛逼很过瘾吗
7126696929706607398,过度装修，有害物致癌，还有很多被毒害的人，即将爆发,0,0,0,2022-08-01 08:25:46,来自福建,99026401417,海钓走起
7126531027925091087,山东人在上海的法院打这种官司赢的可能性没有。,0,0,0,2022-07-31 21:40:54,来自山东,4546310066,LA43459932
7126700697118278434,墙纸千万不要搞，大量化学胶水,0,0,0,2022-08-01 08:39:35,来自广东,57610610784,一日不作一日不食
7126665881291408159,惊装房基本是最劣质材料，怨大头，装修污染不可忽视，只有开着窗过日子，别怕脏怕冷,0,0,0,2022-08-01 06:25:52,来自江苏,1547736206548039,浩瀚大海8188
7126663806243619618,开发商的检测报告是对自己有利的，如果无利，那报告是不会拿出来的,0,0,0,2022-08-01 06:17:08,来自四川,51597188208,安乐山人
7126565273398297384,2016年花945万购房，应该包括银行贷款的吧，后面真的需要好身板打工还债。能罗列房子的52条毛病，貌似有强迫症和精神洁癖。,0,0,0,2022-07-31 23:54:51,来自上海,3670351932,魔都魅影
7126509239933862694,精装房靠开发商自己监督自己装修品质，想想都不会好,0,2,0,2022-07-31 20:17:07,来自江苏,97102622433,午夜0918
7126686105055298308,945万都花了，入住之前做个甲醛检测都不舍得？,0,0,0,2022-08-01 07:43:58,来自河南,50641108910,骑途DF
7126596100286743335,装修材料甲醛超标,0,0,0,2022-08-01 02:01:37,来自河北,2942736544571891,优美梦想无需昭告天下
7126535093447476002,甲醛主要是家具，难道精装房家具也带？,0,0,0,2022-07-31 21:56:44,来自山西,85344198355,个大方
7126695680977994509,鲁人是想诈点Q而已，他怎么不申请退房？,0,0,0,2022-08-01 08:20:29,来自上海,111406014625,就是Pk我依然玉树临风
7126670453133247269,新房装修好过三个月检查甲醛是否超标。,0,0,0,2022-08-01 06:43:08,来自广东,99439077286,人人在法律面前平等
7126692135478936354,这是明星的富贵病！[赞][赞][赞],0,0,0,2022-08-01 08:06:40,来自陕西,101255045709,清新海洋F
7126513867894620965,支持维权到底！,0,0,0,2022-07-31 20:34:31,来自上海,2884749530247216,疯！～
7126695145818456840,945万买一个这样的房子，不服你服谁,0,0,0,2022-08-01 08:18:32,来自河南,106090955799,李小茼李小南
7126609953628373772,看完这篇文章，喝完一杯15元的老叶茶泡的水静静地想想，我是不是很高兴😊自己住在乡下建的15万左右楼🏠,0,0,0,2022-08-01 03:01:12,来自广东,3013109617796187,等我
7126676248084628235,买房子还是买毛坯房最好,0,0,0,2022-08-01 07:06:35,来自江苏,68745389025,三堂主2
