7126504943540355875,没个好啊,0,1,0,2022-07-31 19:59:48,来自湖北,109587375052,我的事我话事
7126604588299436813,有钱人,0,0,0,2022-08-01 02:33:35,来自浙江,5918075058,wzmjg
7126692933231035168,还是农村房子好啊,0,0,0,2022-08-01 08:10:35,来自江苏,5836304631,蓝色的爱恋
7126695994163184384,又是上海,0,0,0,2022-08-01 08:21:34,来自江苏,108111108001,古彭老萧
7126564874943480617,干不赢的,0,0,0,2022-07-31 23:53:10,来自河南,655744358680428,蓝语紫烁
7126673711885058856,真贵呀！,0,0,0,2022-08-01 06:55:13,来自辽宁,2018325408529911,liucbhs
7126665770972726053,可恶致极,0,0,0,2022-08-01 06:25:01,来自四川,83892675518,小哥4405
7126520191148278558,买个娲,0,0,0,2022-07-31 20:59:19,来自广东,62574720896,端庄优雅荷叶6
7126680961647248163,敲诈勒索,0,0,0,2022-08-01 07:23:11,来自上海,3197884788,開心大砲
7126689795715318563,我认为好,0,0,0,2022-08-01 07:57:13,来自广东,707720185657804,管海杰先生
7126507152189342464,北京呢,0,0,0,2022-07-31 20:08:20,来自河北,93889594722,端庄金桔ko
7126685453792887592,上海啊,0,0,0,2022-08-01 07:40:30,来自广东,58869978995,陆璐38
7126551253207008013,爱了,0,0,0,2022-07-31 23:00:12,,1865210813749559,几味
7126524457497445160,那就退房,0,0,0,2022-07-31 21:15:22,来自上海,52927161037,你家隔壁那位老王
7126696732544713513,1楼？,0,0,0,2022-08-01 08:24:12,来自浙江,4628132063,大柳市
7126505210667320099,很人道,0,0,0,2022-07-31 20:00:52,来自广东,72091592587,哈哈哈哈哈哈8888899
7126497555181454114,然后呢？,0,1,0,2022-07-31 19:31:13,来自吉林,56553221844,柳小帅
7126698136122655495,高级碰瓷,0,0,0,2022-08-01 08:30:17,来自河南,1235478749119613,用户这个春天很冷
7126657718580298527,无奈啊,0,0,0,2022-08-01 05:54:48,来自河南,5799693487,小视界大宇宙
7126555890895225641,牛逼,0,0,0,2022-07-31 23:17:53,来自宁夏,111009861894,JaiMa
7126530763201872655,神了！,0,0,0,2022-07-31 21:39:52,来自广东,102536589844,烟斗上的雾
7126501301781070624,很地产,0,0,0,2022-07-31 19:46:26,来自广东,4308558427,阿苏蘇甦蘓
7126551952263480079,这是我听到的最不人道的“人道主义”！,0,0,0,2022-07-31 23:02:25,来自北京,1451815711810588,北京吴律师
7126528005798970125,精装就图省事 比毛坯的同类型每平贵5 到六千 100平就贵50万 拿这钱装什么不好,0,0,0,2022-07-31 21:29:27,来自陕西,92725055784,不断长大你
7126529792220021515,开发商不要脸，有国家标准，可以告他,1,0,0,2022-07-31 21:36:33,来自河南,67585707352,赵208814374
7126589075045729024,精装的意思是，开发商既精明又会装，吃亏倒霉的永远是老百姓,0,1,0,2022-08-01 01:29:43,来自山东,3095831352204647,威风啸林海
7126513484724126464,真是昧着良心赚钱，无耻的无良开发商,0,1,0,2022-07-31 20:32:48,来自上海,110821422809,老刘江湖杂谈
7126684024797561632,现在检测市场太乱了 假报告太多,0,0,0,2022-08-01 07:35:49,来自山东,1116693756657127,jnshyy
7126695751056704297,笨蛋。申请鉴定的时候，同时请求公证处做现场取样音视频留存公证。这是最有说服力的证据。,0,0,0,2022-08-01 08:20:23,来自内蒙古,5986038931,0472龙哥
7126672181928837899,这只能说明自己自找的，有这么多钱，存银行，利息租房多好啊！利息一年有40多万块,0,0,0,2022-08-01 06:50:13,来自广东,2823170132555614,糖尿病治疗设备
7126602721779778304,花千万吸毒，新房子有那么好吗,0,0,0,2022-08-01 02:24:31,来自浙江,3518049713918423,多萌达
7126673191347028743,拿命试毒，有必要吗？,0,0,0,2022-08-01 06:53:53,来自北京,2101900747217768,汉舞帝bui
7126687651302294312,"四个月就敢住进去？胆子真大，没个半年都不用去测，放上一年才稍微放点
心。这搞不好会得白血病的。",0,0,0,2022-08-01 07:49:05,来自重庆,1384977895528104,扫除世间不平事
7126518556518351624,敲了重新装修吧，个人怎么搞得过陆家嘴集团，真是笑话,0,0,0,2022-07-31 20:52:45,来自上海,106474568085,正能量健身老帅哥
7126511168297943839,可见这种检测有多水份,0,0,0,2022-07-31 20:24:05,来自四川,68691679386,Dylan124
7126531297513718543,店大欺客，主弱奴强,0,0,0,2022-07-31 21:41:52,来自河北,52045917310,当时我就脸红了
7126504722747786015,妖气太大，民间无法降妖！,0,0,0,2022-07-31 19:59:18,来自北京,50233327576,星辰Z6
7126502474566976256,开发商卷款跑路，买房人接盘侠,0,0,0,2022-07-31 19:50:04,来自河北,93408898348,cishewu
7126503573277426435,800万卖了，留五百万养老，剩三百万买条腿[捂脸][捂脸][捂脸][捂脸][捂脸],0,0,0,2022-07-31 19:54:59,来自天津,6878279246,都都老大
7126503339356980009,人道主义笑话！开发商的精装房别要！太次,0,0,0,2022-07-31 19:53:28,来自吉林,106082114993,雨天里的阳光1963
7126503297434813224,只有傻子才会相信精装房,0,0,0,2022-07-31 19:53:16,来自江苏,62972186127,大气咖啡Af
7126694070809871112,好房子，好房子[发怒][发怒][发怒][赞][赞][赞][赞][赞][赞],0,0,0,2022-08-01 08:14:27,来自湖北,4284153805681207,奋发小猫nk越来越好
7126586681335022368,店大欺客,0,0,0,2022-08-01 01:21:49,来自上海,102906056602,小步向前走
7126493467077313293,个人认为：房子简单装修！越简洁越好！,1,7,0,2022-07-31 19:15:55,来自上海,3953482928499560,用户1044012898937
7126681787421901607,所谓精装修房，其实是开发商想多赚买房人的钱，经常听到精装修房甲醛超标，房子多处地方装修不合格，需要维修，所以尽量不要买精装修房，希望开发商一定要卖精装修房，一定要认真装修，不要偷工减料，让老百姓化了一辈子的钱而买来很多烦闹！,0,0,0,2022-08-01 07:27:37,来自上海,58949656954,用户282392256
7126676855109108518,甲醛主要是软装，窗帘，衣柜，沙发，床品之类的！[呲牙][呲牙],0,0,0,2022-08-01 07:08:23,来自山东,3166218800352539,用户65172519267
7126676520273986340,你有钱，开发商不仅仅有钱,0,0,0,2022-08-01 07:07:13,来自吉林,1882803024169405,用户7113345827293
7126665912488903424,为啥法院不找一个鉴定机构,0,0,0,2022-08-01 06:25:14,来自吉林,61829927227,用户9079269911609
7126520820969177856,开发商的无法保证环保，自装如果不懂的，也无法保证环保。最好简单一点装修，尽量买实木家具。最重要的是：无论开暖气还是冷气，一定要保持二十四小时通风，通风条件不好的，安排进、排气的设备。保持、三五年，最好十年以上。损失的冷、暖气钱同健康不值一提。,0,0,0,2022-07-31 21:01:21,来自湖南,2106267848687355,用户5028666491780
7126677383578632998,"不讲诚信的开发商
很多时候保险公司，甚至银行也不……",0,0,0,2022-08-01 07:10:19,来自湖北,2356966541238519,用户1346771532525
7126684040719090447,"也是佩服你。合同写
毛坯，交付精装你也敢刷卡",0,0,0,2022-08-01 07:34:56,来自北京,919663411478415,用户256019456887
7126492505520341768,任何装修完的房子都不能马上入住，必须24小时对流通风3个月才能入住,0,5,1,2022-07-31 19:11:56,来自北京,228322402111280,用户5780920065716
7126517392083550991,难道以后买房要买二手房了，前面房主主过的！[呲牙][呲牙],0,0,0,2022-07-31 20:48:01,来自广东,100425084713,用户100425084713
7126703102555865870,房屋装修超标几乎涉及到全国每一个家庭 我们每一个人 几乎没有人能躲得过 只有多强身健体 多户外 自住房装修材料用好点 自求多福吧,0,0,0,2022-08-01 08:49:21,来自重庆,4468010734329943,用户720691200220
7126519401045623582,房子还是毛胚房自己装修好，基本上装修隐藏材料都较差的，由其油漆工做这块，我们干活在里面都受不了那甲醛味道，有些装修住进真的会生病。,0,0,0,2022-07-31 20:56:04,来自浙江,1903973694178557,用户9520728348395
7126528025382142761,你跟开发商打官司能打赢吗 ，人家有钱 有钱可以是鬼推磨 ，现在的精装房甲醛中的很,0,2,0,2022-07-31 21:29:13,来自四川,1991952260399800,用户5286806527958
7126512478640685832,其实就是房主觉得精装房被坑了，碍于无法修改合同就找事。都知道新房装修完要通风闲置一段时间,0,0,0,2022-07-31 20:29:19,来自福建,4248148197512247,用户268520
7126494550822470434,请记住，只要是开发商卖的精装修，就是6仟一平米的也是次材料,0,5,0,2022-07-31 19:19:35,来自天津,4050223131797211,用户6777940386844
7126580977576624935,为什么国人意见大，这只是方方面面的一小点[捂脸],0,0,0,2022-08-01 00:58:49,来自安徽,1213478056497579,用户976608605602
7126534789050123046,几千块的工资。几千万的水泥壳。,0,0,0,2022-07-31 21:56:11,来自广东,3786358345961124,用户1415630729895
7126696822940402466,这种官司不好打。时间太长了。,0,0,0,2022-08-01 08:24:37,来自北京,11708638323,手机用户11708638323
7126501174160655119,肯定利益驱使使用污染材料,0,5,0,2022-07-31 19:45:05,来自浙江,59396119865,手机用户59396119865
7126672064211485475,现在还有房屋开发商是有良心的呢,0,0,0,2022-08-01 06:48:45,来自四川,3500484483093864,用户9046399886108
7126681362576491264,所谓精装，材料用的是最便宜的，否则怎么会叫做精呢？必须自己选材，否则质量完全失控,0,0,0,2022-08-01 07:24:45,来自广西,2620843738007563,用户4957183673663
7126534860663178014,这房子过几年能不能卖一个亿,0,0,0,2022-07-31 21:56:09,来自江苏,1191489646101293,用户7829871346456
7126522559945540387,条件允许，买的精装房应该砸了重新装修,0,0,0,2022-07-31 21:07:58,来自安徽,61212189527752,用户2899511244521
7126679977818325801,“人道主义补偿5000元”——很够意思~~~,0,0,0,2022-08-01 07:19:11,来自福建,101765868034,用户101765868034
7126535380157104937,讲道理谁听！,0,0,0,2022-07-31 21:57:46,来自山西,102253120398,用户3434822730687
7126548855080583936,现在这个小区11万单价,0,0,0,2022-07-31 22:50:26,来自上海,103951490837,用户3214116284888
7126514674229297935,支持维权，无论何时何地检查都不能超标！！,0,0,0,2022-07-31 20:37:30,来自江苏,4305315082804701,用户272775499018
7126561724467446558,花钱买罪受，,0,0,0,2022-07-31 23:41:43,来自江西,66738686044,手机用户66738686044
7126528398633075496,房价翻了一番,0,0,0,2022-07-31 21:30:36,来自山西,105056802771,用户9502401898248
7126529723643593487,自己装修放心,0,0,0,2022-07-31 21:35:54,来自江苏,127166585518046,用户7544569975118
7126675482090930957,那法院再指派一家去测不就好了，何必推卸责任,0,0,0,2022-08-01 07:02:30,来自上海,104657064951,用户7705426515053
7126549095233520392,有钱人就是喜欢这种味道！,0,0,0,2022-07-31 22:51:45,来自广东,3104660363675068,用户3662814517747
7126541036343952143,法院？,0,0,0,2022-07-31 22:19:52,来自河北,4124986482897656,用户5651724681384
7126503531401904937,千万别买精装房，买了就活该倒霉，这是全国精装房的通病,0,0,0,2022-07-31 19:54:20,来自四川,52015957309,手机用户52015957309
7126662387486245636,最后看到付建出场，河南开封淮河医院换子案杜方代理躺赢律[机智],0,0,0,2022-08-01 06:12:53,来自天津,52196249581,雅正YZ
7126504860588999438,房子装修别搞得那么乱七八糟的，随便装一下，环保而健康,0,1,0,2022-07-31 19:59:40,来自湖南,602955238615421,英明果断苹果O
7126565025984348940,房产是骚操作最多的产业,0,0,0,2022-07-31 23:54:55,来自上海,4190971989592195,用户7614448404682
7126517823085822728,精装房出事就装精了！,0,0,0,2022-07-31 20:49:54,来自天津,102256378521,高府媛邸
7126692175735636773,这有什么好对比的，你这么说鹤岗能买200套[呆无辜],0,0,0,2022-08-01 08:07:10,来自江苏,193124830022627,自动化研究员
7126522181818827535,买个毛胚房随便你装……,0,0,0,2022-07-31 21:06:21,来自广东,101123685388,豫见晓磊
7126694179476226827,取消精装修吧，没什么用，要设计没设计，工艺也不咋地,0,0,0,2022-08-01 08:15:15,来自北京,61000303969,宇宙第一设计师丶
7126531118291649284,上海真H,0,0,0,2022-07-31 21:42:05,来自黑龙江,51759624206,悠闲大明哥来了
7126550223601697544,,0,0,0,2022-07-31 22:56:05,来自北京,79109578032,jet291
7126516861143204619,谁让你有钱呢？花个百八十万买个毛坯自己装多好，这就是有钱人的悲哀,0,0,0,2022-07-31 20:46:32,来自伊拉克,3197014365180107,友爱小红花gf
7126692999560151822,没有一样正经毛病！,0,0,0,2022-08-01 08:10:41,来自辽宁,86197226148,焚殇倩倩
7126537460393411341,[马思纯的微笑],0,0,0,2022-07-31 22:06:11,来自广东,3289340663302192,无风起浪1H4g
