7128984014098088743,我以前在药店上班有个同事到现在一直在推销增高之类的产品，也不知道真的假的，买的人挺多的，很多人相信药店的,1,4,0,2022-08-07 12:20:23,来自上海,4152176821451288,波啊霸七一气
7128861436952478501,管理混乱，漏洞百出啊,2,191,2,2022-08-07 04:27:25,来自山西,94570598231,仁爱湖泊R
7128776717502055203,都说了智商税，人智商高就得缴税不是,0,71,0,2022-08-06 22:55:34,来自江西,98999689101,默默3603
7128979156524073768,不要迷信保健品[汗],0,16,0,2022-08-07 12:00:59,来自广东,75234270116,佳品难寻
7128923778071561000,现在假的东西太多了，国家对假广告，假信息，要要打，特别是电视台，台电，一开机全是广告，,1,87,0,2022-08-07 08:26:17,来自江苏,3460891947841748,多才溪流Zl
7128728967414727465,有几个专业鉴定机构是讲原则，讲信誉的？,2,155,0,2022-08-06 19:50:09,来自山东,100636685818,老王童2221
7128880744663089951,请问一片药的成本是多少，卖几十上百元难道不是暴利[捂脸],1,53,0,2022-08-07 05:41:14,来自山东,58801111026,yu的旋律
7128956447467651853,谢谢上海闵行区警方的干警，你们为全国人民除了一害，都要有你们这样敬业，咱们社会就有希望了。,0,17,0,2022-08-07 10:32:33,来自内蒙古,3355365738819992,大木头1122
7128929960261288736,请问各位人士，是不是真的有增高粉[作揖],3,3,0,2022-08-07 08:50:53,来自广东,3923475431426919,酒醉声大
7128903415031563012,现在的虚假信息多数是经过电视台传送，连国人认为最权威可以信赖的中央电视台亦有虚假信息，何况我们星斗市民那能分别出来真与假？,3,84,2,2022-08-07 07:08:53,来自广西,3492477919038839,用户言轻力薄
7128909580771918626,上海闵行区警方的做法应向全国公安推广,0,36,1,2022-08-07 07:31:29,来自山东,5831101671,西施宗光
7128917356994315045,茅台酒呢？成本多少，又卖多少钱啊？,4,24,1,2022-08-07 08:01:43,来自广东,6457327321,闲人90109362
7128968249844171561,警方对这种诈骗团伙必须严惩。,0,4,0,2022-08-07 11:18:35,来自辽宁,98016462696,乐观的河流MW
7128935082157097761,坑蒙拐骗的事太多了,1,4,0,2022-08-07 09:11:11,来自四川,22873082153,勇者风声F
7128926023969800967,中国要加强鉴管电视及网络广告的力度，杜绝虚假广告，维护消费者的利益。,0,17,0,2022-08-07 08:35:22,来自广西,105344435189,仙人长
7128993089641366306,百度一下，很多都是骗局,0,3,0,2022-08-07 12:55:13,来自浙江,62435474503,生活帮帮人
7129003429225366279,不仅仅严查严惩这些造假的人，还要严惩做推广的报纸，电视台等等推广人员。,0,5,0,2022-08-07 13:35:39,来自四川,1874050695,天从人愿7079
7129009913669845797,像增高粉这类东西都是假的，主要是市场需求，家长心急，又不相信科学，没办法,0,0,0,2022-08-07 14:00:50,来自湖南,52434236127,木子胡爱论情感
7128915978532602638,网络上的虚假宣传要不要罚款？,0,15,0,2022-08-07 07:56:50,来自安徽,3353613935,风雨无阻12340831
7128951211931992868,犯罪分子成本低加大力度,0,4,0,2022-08-07 10:12:13,来自山西,2194215884820183,率真风声RO
7129002970603176716,来钱容易的买。,0,2,0,2022-08-07 13:34:08,来自湖南,88012658172,取人长补我短
7129022495159993099,这叫正事，还有食品安全，再不下大力气抓的话……。,0,0,0,2022-08-07 14:50:18,来自山东,103619116142,仁爱山丘DF
7129019749593793320,直播间不归警方管辖吧？,0,0,0,2022-08-07 14:38:46,来自天津,52951883312,浮躁文化
7128922817621902091,市场经济 选择由己。,6,3,0,2022-08-07 08:23:31,来自山东,3624452115668276,水木石6
7128792965116035870,是不是属于诈骗,0,31,0,2022-08-07 00:00:36,来自山东,2964757152545262,多才多艺钢琴4e
7129060744057996047,依法从严从重打击这类犯罪分子！净化社会空气。,0,0,0,2022-08-07 17:17:34,来自江苏,6256267762,真-善-美83617700
7128986120679047940,抓的卖增高粉的身高男的在160，女的150,0,3,0,2022-08-07 12:28:55,来自广东,55354140836,人淡如菊147756844
7129050238077436687,我也购买过一些网够药品，价格高，无作用，常在头条中推广。而且是你要什么就就诱导你买什么。,0,0,0,2022-08-07 16:36:58,来自四川,329449604916947,奇幻明月o3
7128802489080021790,终于，破案了！,0,10,0,2022-08-07 00:38:34,来自新疆,54953722723,寒夜孤灯残梦
7128937357742801703,哪机构鉴定说有功效？又是哪部门给订价5000元？,0,3,0,2022-08-07 09:19:41,来自河南,3896267647758603,淡泊的星辰2Q
7129046576651535119,智商税！[大笑],0,0,0,2022-08-07 16:22:40,来自云南,113975292860839,才高八斗星球D4
7128966281121989376,外国的产品，例如衣服，包包，手表等成本才多少，几十万，十几万卖,0,1,0,2022-08-07 11:10:59,来自重庆,105328395051,三哥8516
7128959660275057446,"这种食品比比皆是！
不知六个核桃里有没有核桃？酸奶里面有没有奶？果汁里面有没有果？……",0,2,0,2022-08-07 10:46:19,来自四川,5821019177,保家卫国1
7128962882347418383,"成本是個很玄的問題，可虛可實，虛則實之，實則虛之。
市場上的商品基本都是”不計成本”的價格出售。
消費者應該考慮的是產品的安全性和有效性以及產品的生產商",0,1,0,2022-08-07 10:57:52,来自广东,5475657708,阿林阿林阿林
7129000145077109536,增高鞋增高粉，以后还有增高服增高帽，竟然有人相信,0,0,0,2022-08-07 13:23:22,来自重庆,3821694396,多才风铃uO
7128892808471757608,脑百金咋没人管呢？,0,10,0,2022-08-07 06:26:59,来自河北,105000189204,Zf者
7128947325523149606,网上的东西也有好多，不实在的有，卖低了没人相信，就是要卖高一点才有人相信这个是真的。,0,1,0,2022-08-07 09:57:05,来自重庆,111307608816,诗意海洋jk
7128771744546554655,不卖贵谁会相信它的功效呢,0,7,0,2022-08-06 22:36:48,来自广东,50731945137,凤凰单丛专营店
7128944689210065704,茅台酒成本多少钱？,0,2,0,2022-08-07 09:46:49,来自安徽,6173705786,棋林一
7128788063223989025,每股一元的原始股，上市就能卖几百元呢？[大笑],0,14,0,2022-08-06 23:41:05,来自上海,97738547327,善良咖啡wQ
7128899156630471456,形式名堂挺多，但顾此失彼，一个都打不掉。[酷拽][酷拽][酷拽],0,6,0,2022-08-07 06:52:33,来自广东,54846496125,草蜢33
7128951365480792862,一百五成本，很良心了,0,1,1,2022-08-07 10:12:41,来自黑龙江,61444196213,潇洒宇宙Ed
7128801554672550694,严打，打尽，为人民。,0,14,0,2022-08-07 00:34:55,来自浙江,3531256763780692,裸眼看世界
7129027965039592225,卖给智商低的人的，会有这种药吗？,0,1,0,2022-08-07 15:11:12,来自上海,109637166193,用户假痴不癫
7128729803192697613,专利谁批的？？？？？,1,36,0,2022-08-06 19:54:01,来自广东,4235477269,蝶娉瘦身
7128963275253252876,还是应该有个定价机制，任何产品都不能任由生产者随意定价,0,1,0,2022-08-07 11:00:03,来自陕西,110905590312,老山羊8888
7129038163527435049,楼房也一样，建筑成本一二千，卖价10几万。,0,0,0,2022-08-07 15:49:55,来自甘肃,3104622828594429,温馨居家说装修
7128954911995298573,这些人都是生意高手啊，太有经济头脑了,0,1,0,2022-08-07 10:26:29,来自福建,73622435873,鄉巴佬頭
7128977069274776356,上海在行动，这样的事全国都有，！,0,1,0,2022-08-07 11:53:27,来自甘肃,6260119138,淡泊的芒果MV石林
7128946059208246016,货真价实，1元成本卖1千也正常。怕是假货，无用且有害的货物。,0,1,1,2022-08-07 09:52:08,来自江苏,2453717853674152,有趣的船帆TQ
7128888222775722787,沒有医院的药品利润高。,0,11,2,2022-08-07 06:08:50,来自四川,50421417754,弓长1515036
7128924442985595662,老百姓各方面就管得严,0,3,0,2022-08-07 08:29:07,来自福建,101460335652,梦缘23264
7128935127769547552,严厉打击……,0,1,0,2022-08-07 09:10:50,来自重庆,105960101515,CQAC蔡权
7128916622772814627,要是人能够凭人工力量简简单单增高、减肥，而世上还有矮子、胖子吗,0,3,0,2022-08-07 07:58:31,来自江苏,66162917635,幽默青山Sm
7129024790698312480,利用人们在某些方面的无知，而渴望改善某些不足，进行哄骗，容易得手。,0,0,0,2022-08-07 14:58:57,来自四川,3508587981,德才兼备西柚2
7128976148146668301,判重刑。要有警示作用。,0,1,0,2022-08-07 11:49:39,来自山西,2950745468442508,乘风破浪的精灵jE
7128996552709849856,但凡有点常识的人也不会上当啊,0,0,0,2022-08-07 13:08:22,来自云南,55034710726,波波145615776
7128958781727900446,信的都是有钱人，,0,1,0,2022-08-07 10:41:48,来自广东,4164985961,心谊明
7128877799112770308,47人卖了100万，这是要把自己玩破产,0,3,0,2022-08-07 05:32:05,来自四川,54593349257,德意志之声
7128916413033202469,还有“专利”,0,2,0,2022-08-07 07:58:36,来自浙江,110916444896,用户衣尚轩
7128973045263287074,严打，再严打。,0,1,0,2022-08-07 11:37:08,来自山东,95727112792,正义凛然暖阳O3
7129000385297728271,有几个专业鉴定机构是讲原则，讲信誉的？,0,0,0,2022-08-07 13:23:34,来自甘肃,111152520683,一笑而过玥
7128906274142176033,市场经济由呾定价，都是正確的！別埋怨了，赶上了这个好时代。,0,3,0,2022-08-07 07:20:02,来自甘肃,448188904114468,润芝
7129037295293891363,一夲万利商家笑，生意兴隆达三江。,0,0,0,2022-08-07 15:46:49,来自甘肃,584576330113396,自然1952
7129021068253840166,总是被收割智商税,0,0,0,2022-08-07 14:44:57,来自广东,6488549752,太阳金风
7128920341468005134,现在的虚假信息多数是经过电视台传送，连国人认为最权威可以信赖的中央电视台亦有虚假信息，何况我们星斗市民那能分别出来真与假？,0,2,0,2022-08-07 08:13:13,来自河北,87712674490,老李曼陀罗有毒
7129000378213597963,专利证书也不澄清一下？,0,0,0,2022-08-07 13:24:23,来自上海,108833701266,高速友
7129049848732893984,肯定是广东的，不用猜,0,0,0,2022-08-07 16:36:15,来自上海,85794376108,论理
7129034363715175209,你骗我到骗你你骗我我骗你[大笑][大笑][大笑],0,0,0,2022-08-07 15:35:25,来自浙江,4452275950,单纯雪碧U
7128940914970198795,保健品产品很混乱,0,0,0,2022-08-07 09:33:44,来自山西,55756587377,朶那
7129056057913017099,智商税，还真有人买！,0,0,0,2022-08-07 17:00:09,来自云南,2819592706069172,精阳•蜉蝣
7128987526903186210,怎么不去医院查？,0,0,0,2022-08-07 12:33:22,来自山东,21824035689,寻找童年的记亿
7129039882277667584,人口太多了，管理跟不上了！,0,0,0,2022-08-07 15:56:40,来自广东,70952138351,走走看看看世界
7128945392704308008,验证机拘给钱就给报告？,0,0,0,2022-08-07 09:49:37,来自江苏,2453717853674152,有趣的船帆TQ
7128982112534889231,相信中医的容易上当,0,1,0,2022-08-07 12:12:26,来自江苏,59408436049,优美松鼠IT
7128992703303484174,牙齿的利润可比茅台。,0,0,0,2022-08-07 12:53:56,来自上海,1758866642043911,快乐百灵鸟Vc
7128966975098749731,物价部门看后怎么个感想,0,0,0,2022-08-07 11:13:38,来自天津,13743044606,明天的太阳更新
7128916053207565067,吃了像刘翔那么高吗？,0,1,0,2022-08-07 07:57:16,来自广东,3170641010239997,用户wto
7128872549630542604,就像汽车装的“速M力”和“珠珠”一模一样。[我想静静][大笑],0,1,0,2022-08-07 05:11:58,来自广东,888018730497294,奔跑De猴子
7128942538610017035,8848手机怎么就没人查呢？？？？,0,0,0,2022-08-07 09:39:27,来自广东,60248975544,马安
7128936268423545635,挺正常的，现在卖的就是概念，信了你才会输,0,0,0,2022-08-07 09:14:41,来自北京,3210202313656840,自在的我就是那不一样
7129030531555115816,中医中药打假势在必行。,0,0,0,2022-08-07 15:20:18,来自湖北,588992652259720,足智多谋饭团xY
7128918401162052392,是不是那个叫一米八八的奶粉？,0,0,0,2022-08-07 08:05:19,来自陕西,2546063556217004,汉江之哥
7128928356980589325,不少人交了智商税[恐惧],0,0,0,2022-08-07 08:44:29,来自四川,54998387120,高原行者666
7128762097928176388,又是网上卖,0,1,0,2022-08-06 21:59:22,来自浙江,98145925219,仁丹173
7128908299084301069,现在是真的太少了,0,0,0,2022-08-07 07:26:42,来自北京,751701332333060,运筹帷幄面条30
7129043388468822820,网购陷阱,0,0,0,2022-08-07 16:10:55,来自广东,61217683924,万忠林845
7129002127959294735,严厉打击,0,0,0,2022-08-07 13:30:13,来自新疆,4134601972268334,寂寞独行客
7128801920768017152,金钱能收买一切！,0,2,0,2022-08-07 00:34:47,来自河南,93370479382,自由人71562
7128972598390162189,一团糟,0,0,0,2022-08-07 11:36:03,来自宁夏,3654364558010024,狼族后裔
7128933518708998947,太黑了,0,0,0,2022-08-07 09:04:03,来自山西,6601717957,同志一恋老
7128792887685006092,智商税。,0,2,0,2022-08-07 00:00:35,,5397199946,黄的男人
7129060498687443712,智商税,0,0,0,2022-08-07 17:16:47,来自福建,105321532134,Ai天涯
7128936653694960396,管理问题,0,1,0,2022-08-07 09:16:38,来自浙江,3192588940350397,欧阳东风
7128781961627714319,智商税,0,2,0,2022-08-06 23:16:13,来自云南,52722317767,无拘无束的明月Z1
7128910217194177315,痛！,0,0,0,2022-08-07 07:33:45,来自河北,66643983094,高级铅笔ts
7128973908786758435,广告都在瞎做，早些年打击过的燕窝不也是卷土重来吗？那些保健品里面大部分都是淀粉，成本多少卖多少，包装盒的成本可能都比有效成分成本高，查了吗？[呲牙],0,0,0,2022-08-07 11:40:31,来自江苏,2409740312253998,走向老腊肉的道路上
7128953440780518144,还是打击力度不够，诈骗花样层出不穷,0,1,0,2022-08-07 10:20:48,来自广西,2809961354366724,相当于数字用户
7128921032106738463,用高价吹嘘产品质量的太多了，比如：美容产品，保健品，特别出格的是冬虫夏草，如果有关部门能负责任的把这些东西拿来鉴定一下，并告知大家，上当受骗的人会大大减少。,0,1,0,2022-08-07 08:16:19,来自湖南,5380172180,真诚手机用户冬瓜
7128891274379543331,现在的人想钱想疯了，不择手段,0,5,0,2022-08-07 06:20:46,来自安徽,5764519220,等到春暖花开时63705847
7128951199042175775,打击力度弱，骗子太多,0,1,0,2022-08-07 10:12:01,来自湖北,3923526126404327,简单溪水Ok
7128932751793193767,虚假广告，不处罚平台吗？,0,1,0,2022-08-07 09:01:53,来自湖南,2669230788720603,qjx285
7129058060032246563,鉴定机构把钱一收，管你吃死吃活呢。,0,0,0,2022-08-07 17:07:12,来自宁夏,4314119365199054,多才多艺书签qd
7129056257427735334,都知道中国的假货很多，不管是什么,0,0,0,2022-08-07 17:00:48,来自上海,102103354662,春天被偷走
7128881564108604160,只要学过生物就应该知道！到了年龄骨质张实就不可能在长了！有的人有几率长几公分！不是所有人！智商堪忧,0,1,0,2022-08-07 05:43:43,来自吉林,106082114993,雨天里的阳光1963
7128940966496600847,把那些集资诈骗的收拾一下，到处是的,0,0,0,2022-08-07 09:32:55,来自广东,4419690789345246,睿智苹果ed
7128979452385592072,都是一些傻子被骗[捂脸],0,0,0,2022-08-07 12:02:28,来自上海,62334896383,库里卡拉古图扎旺
7128933151803458304,坑人,0,0,0,2022-08-07 09:02:26,来自黑龙江,63266836569,雪傲森林
7128980651441242888,转发了,0,0,0,2022-08-07 12:19:46,,100046951728,九龙居士786
7128999585234043648,转发了,0,0,0,2022-08-07 13:20:16,来自湖北,3941071847424759,Teacher朱2518
7129049535162368779,转发了,0,0,0,2022-08-07 16:37:43,,730489810332493,热心松鼠RV
7128931105113162537,转发了,0,0,0,2022-08-07 08:57:45,,54309900356,WFY展望未来
7128931105113178921,转发了,0,0,0,2022-08-07 08:57:50,,54309900356,WFY展望未来
7128895820044731149,转发了,0,0,0,2022-08-07 06:39:07,来自江苏,87236697225,灵敏精灵dr
7128929664206521127,转发了,0,0,0,2022-08-07 08:49:44,来自四川,92908419160,朱朝华的
7128956030167663371,转发了,0,0,0,2022-08-07 10:30:53,来自上海,105735049015,夜放花
7128978885064688387,现在的骗子太多，防不胜防，希望大家提高警惕，少上当受骗。,0,0,0,2022-08-07 12:00:56,来自北京,81223871190,用户5024887577578
7129029063725450024,对这种行骗人员佈满了全国各地，比如龙岩就有多家，象恒艾集团就是其中之一，希望能大力抓捕他们，彻底还龙岩城区的一个清静美好城市,0,0,0,2022-08-07 15:14:48,来自福建,1261854148533859,用户6143061881848
7128841833178284811,严打拼多多的商业诈骗形为！！！,0,8,0,2022-08-07 03:21:11,来自四川,5512722098,手机用户5512722098
7129013034089431848,诈骗犯罪利益链作案成本低泛滥成灾,0,0,0,2022-08-07 14:12:40,来自广东,68549012214,用户7764121179962
7129001425044210440,严打灭掉售假，诈骗行为,0,0,0,2022-08-07 13:27:52,来自陕西,580995212649276,用户7219585630077
7128939557407572769,医院药利润更高，为什么不严打[耶],0,1,0,2022-08-07 09:28:03,来自上海,1842378736678990,用户5251241733774
7129040016260858665,看电视台广告，真心整治效果超好！,0,0,0,2022-08-07 15:57:15,来自河北,14383789317,手机用户14383789317
7129059172246995727,有几个做生意是有良心的，有良心的挣不了钱,0,0,0,2022-08-07 17:11:30,来自广西,2682451772070567,用户4117580589309
7128897345131315999,一包中华烟成本多少，,0,5,0,2022-08-07 06:44:48,来自江苏,105284494730,用户7375879790877
7128971857453499174,不骗不赚。[灵光一闪][大笑][抠鼻][酷拽][黑脸],0,0,0,2022-08-07 11:33:33,来自吉林,2792356502322947,用户9152708108099
7128968338012766991,房地产呢，,0,0,0,2022-08-07 11:18:54,来自湖南,100763708687165,用户4313692412348
7128994210056798983,今天去三甲医院看病开的药吃了也没效果,0,0,0,2022-08-07 12:59:39,来自广东,55105927696,手机用户55105927696
7129054998259909414,这都是电视台及网络的功劳！,0,0,0,2022-08-07 16:55:54,来自广西,2625287499817164,用户9989394136095
7128779632161604352,都是交智商税,0,3,0,2022-08-06 23:06:59,来自甘肃,852815303687111,用户2765493458265
7128938898831147808,专利申请怎么走来的,0,0,0,2022-08-07 09:25:56,来自河南,6115416356,手机用户6115416356
7128917559285924643,怎么行成的批文的，怎么流入市场的，网络就是法外之地吗？,0,3,0,2022-08-07 08:02:12,来自青海,3482908249560495,用户8551518757385
7128933554431804191,严惩不贷,0,1,0,2022-08-07 09:04:37,来自贵州,58703223297,智者叶子Oe
7128933632927990531,这骗子真是无孔不入，想着法的骗人太可恨了，抓到一定要严惩。,0,0,0,2022-08-07 09:05:08,来自北京,405073109190155,用户2738630555045
7128957278602216228,自己人骗自己人，这是什么人，,0,1,0,2022-08-07 10:35:40,来自陕西,2695646342035645,用户7703142436052
7128926424178131727,无良商家，坑蒙拐骗！一定要狠狠打击！,0,1,0,2022-08-07 08:36:34,来自上海,39200841807699,用户1189513675004
7128935108089840384,还是骗子有手段！,0,0,0,2022-08-07 09:10:01,来自四川,2982336330476348,用户1723854252470
7129030742352708356,向老年人讲课推销的保健品，有哪样要得？,0,0,0,2022-08-07 15:21:53,来自重庆,50418603075,www88888888
7128993325831045901,市面的各种保健品，吃后肚子还填不饱的，人民务必重视知道啦！,0,0,0,2022-08-07 12:56:30,来自广东,97787043886,正气之光688699
7129045321992536867,拼多多上的假货谁去管管？,0,0,0,2022-08-07 16:17:52,来自湖南,61827031058,勇敢的阳光BS
7128957673189851911,卖保健品的都发财了,0,0,0,2022-08-07 10:37:14,来自河南,1266234075126175,胡辣汤糊啦
7129002892429787936,居然还有人相信增高粉,0,0,0,2022-08-07 13:33:49,来自广东,1332204848815364,生生日新
7128938890446586628,这个产品真有疗效还需打广告吗？发明者早就成为世界首富了,0,0,0,2022-08-07 09:25:40,来自江西,104395192934,缤纷清风G
7128989683597460232,都跟你讲了，网上的保健品一律都是假的，有钱多点好的，自然美才永久的。,0,0,0,2022-08-07 12:42:06,来自广东,53120264769,晚秋150358368
7128960000587973389,再说保健品,0,6,0,2022-08-07 10:47:05,来自山东,3193112407,黄河口一郎
7128941072411427591,许多假广告都是电视里播的,0,1,0,2022-08-07 09:33:46,来自江西,6215569663,游梦123
7129059155196937000,二货太多了，什么时候都不缺二货，不然诈骗分子总能诈骗成功，假冒伪劣产品总不愁销路！,0,0,0,2022-08-07 17:11:21,来自四川,55488646451,云淡风清162888678
7128962756753244958,钱这么好骗谁还有心事研发高科技,0,0,0,2022-08-07 10:57:48,来自安徽,19258364247,手机用户前途无亮
7129021281441415970,我总是遇不到傻仔，傻女的，老是遇到的都是人精。,0,0,0,2022-08-07 14:44:29,来自广东,2656890905170871,奋发阿勒泰5i1
