7122336368726033190,最难的是法律意识。企业有标准，为什么不执行？就是觉得换个签儿，侵害一下别人的利益，不会有什么事情。大量通过违法的恶性竞争留存下来的企业永远不会有什么竞争力。,1,61,2,2022-07-20 14:24:23,来自上海,3742359753331293,非凡生活家Mz
7122297414622855971,病从口入，最安全的餐厅，还是自己家的厨房。。。,79,2004,4,2022-07-20 11:52:31,,646100828300148,王飞频道
7122289757862331174,"最安全的餐厅，还是自己家的厨房
没有绝对，但是吃的心安理得[呲牙]",3,1493,6,2022-07-20 11:23:40,来自福建,4142560058023691,薇薇逛红尘
7122269345870545678,食品安全问题不容忽视，一定要严管。,6,178,1,2022-07-20 10:03:55,来自海南,219515365105447,盛开红色广场舞
7122287555722576640,连锁店尚如此，那些小的家庭作坊店铺更不堪设想。每天吃外卖，看似方便，实则对自己身体的伤害逐年累积。能自己做饭还是要自己做啊。告诫自己。[雾霾],2,86,1,2022-07-20 11:14:20,来自上海,22415224869975,闫许双律师
7122423016033944331,外面吃饭很大概率这样啊[捂脸]我去汉堡王，麦当劳，都碰到过。安格斯牛肉饼能防身，炸鸡腿又黑又硬。汉堡王的阿姨还解释一句说是炸过头了，麦当劳根本不解释[捂脸],1,44,1,2022-07-20 20:00:26,来自北京,4217359706897005,张美丽齐步走
7122304082009916175,我不吃油炸食品！！！大家也要少吃。,1,29,0,2022-07-20 12:17:47,来自湖北,104849348069,湖北依然
7122271656969650951,利润够高的了，还这么节省呢？,8,139,5,2022-07-20 10:12:50,来自四川,94979298739,退休花姐
7122280426450141963,必胜客出现类似问题不是一次两次了[发怒],53,1346,5,2022-07-20 10:47:25,来自河北,88106702777,南山草木香
7122453107980141352,"有没有人和我一样从来没有吃过必胜客的？

说真的那些洋快餐我就吃过啃德起和麦当娜，别的都没吃过，好几次徘徊在必胜客和星巴克的门口，就是没进去！

以前是吃不起，后来吃的起了，又提不起兴趣了！中午二两驴肉 一份凉菜 一份鸡蛋汤，营养全面，吃的很饱，35元。弱弱的问下在必胜客这点钱能吃点什么？",0,0,0,2022-07-20 21:56:33,来自河北,97308832143,张垒医生
7122244414549852965,从来不换烹炸油的听过吗？我认识一个炸豆腐的，油从来不换，不够了就添。,203,1446,10,2022-07-20 08:27:14,来自广东,98391901845,我在乡下
7122419764844282635,首先佩服这个女记者有勇有谋，的确是个人才。凭感觉换油，为食品改头换面续命这都是无良商家牟取利润的手段。据专家讲，烹炸油使用三次以内就应该及时更换，不然长期使用会引发心脑血管疾病，心脏问题，还会导致老年痴呆，致癌等等疾病。必胜客是个老牌子店还会犯这些普通的商家的错，是利欲熏心，自己搬起石头砸自己脚，自毁前程。舌尖上的安全我们的态度就是零容忍，食品应该做到阳光化公开化，除了加强自身监管外，市场监督管理部门也要按照食品安全法对其监督管理，需食品保持清洁卫生公开透明，商家无视法律制度，必须严肃查处，还百姓舌尖上的安全安心。,0,0,0,2022-07-20 19:47:46,来自江苏,2717626266554020,用户花开花落总有时
7122410391829447459,好奇别的品牌多少天换[撇嘴][惊呆]，我今天去吃了尊宝的炸薯条，不知道多少天换油[捂脸][捂脸][捂脸],14,8,1,2022-07-20 19:11:00,来自广东,80611139105,小羊咩嘻嘻
7122318289644258086,十多年前很喜欢去必胜客！有一次去长春市人民广场的必胜客吃饭的时候去了一次哪里的卫生间，结果卫生真的很差就和外面的苍蝇馆子一样！瞬间就没了食欲回到餐桌上点的东西也没吃直接走人！太恶心了，从此以后在也没去过必胜客吃饭！,1,5,0,2022-07-20 13:14:14,来自吉林,3861082054077752,豁达的真实的淼淼
7122310499148366605,食品安全问题关系到人民的生命安全，对于任何商家违反《食品安全法》的行为必须予以严厉打击！必胜客必须给我们广大消费者一个交代！,0,1,0,2022-07-20 12:42:53,来自广东,4265708779481703,扬帆正当时
7122257612065800999,罚得太轻了，重罚并公开才能让其收敛，才能让它们看到食品安全的底线,28,1426,7,2022-07-20 09:18:38,来自湖北,69546081535,凌小小凌
7122270981930009352,不管必胜客，所有的快餐卫生都不和格，,5,90,1,2022-07-20 10:10:16,来自黑龙江,1328680701014703,率真星星qi
7122280063785075488,作为营业餐厅，光罚款不行。通过上面案例可以看出，你罚得越多，他们越想办法违规使用过期产品，这样才能收回更多损失的成本费。他们这种行为是以伤害消费者健康为基础的，有可能给人和社会造成各种疾病的，必须立法入刑！,8,370,2,2022-07-20 10:45:37,来自辽宁,111042485555,S修羅王S
7122241734683149097,不知道的黑幕还有多少？尽量不去外面吃饭，回家自己动手做，卫生安全才有保障,48,1548,9,2022-07-20 08:16:21,来自河北,7023303221,七月敏子
7122440668744172328,每次我舍不得倒掉剩菜的时候，每当我不想扔掉过期的食品时，每当我淡定地捡起桌上的菜吃时，每当我激动地说话唾沫横飞时，每当我不想清理厨房的时候......我就对外面的餐厅失去绝大部份的兴趣，我自己都很难做到绝对的卫生、健康，更何况身为或希望成为资本家的他们？！,0,9,0,2022-07-20 21:08:20,来自四川,1077168313735400,直率风声1g
7122262546073551651,每家炸鸡店都是这样的，没人会换油炸，所以基本不吃炸鸡,8,79,2,2022-07-20 09:37:22,来自山东,60553486873,天天wxm
7122289866066838311,外面的熟食怎么可能干净卫生，花钱多不说，吃出毛病来没人管，还不如自己动手做的干净,0,178,1,2022-07-20 11:23:58,来自福建,4142560058023691,薇薇逛红尘
7122297180475523877,完了，以后不吃必胜客了。谁去查查papaJohn的后厨，还能吃不啊？,2,24,0,2022-07-20 11:51:49,来自北京,2991148100237475,南墙伊伊
7122299279758213895,我曾经在西餐厅后厨洗碗。前台制作的冰淇淋、冰碗的机器不归我清理。那机器多长时间前台都不会清理。一股臭脚丫子味儿。甜的东西发酵也没人管，苍蝇直盯。抹布多久都不用臭着。因为那不属于我的工作范围所以我也不会理会。想想看你们去西餐厅要的冷饮品是怎么端上桌的[呲牙],4,81,1,2022-07-20 12:00:01,来自河北,2563664059573675,既不负如来亦不负卿
7122335421598008100,一点都不把人民健康放眼里，我平时爱吃，颈 椎 病和肩 周 炎[流泪]反反复复好不了跟营养没跟上吃垃圾食品有关系的吧，肩膀好疼啊请问有什么法子吗？,11,41,0,2022-07-20 14:20:19,来自福建,1253910992664509,爱家富锦5i2
7122338159014200103,最安全的餐厅，还是自己家的厨房。。。,9,119,0,2022-07-20 14:31:03,来自贵州,102840486571,快乐小Y
7122291734067233570,我曾经是必胜客的拥趸者，披萨，肉酱面，海鲜面，焗饭都非常爱。疫情后就常点外卖，有次路过就自取了，那是一家可以直接看到后厨的餐厅，当时几乎没有客人，厨房也没俩人，前面的经理说她去做就进了后厨，我当时很好奇就站在外面看，靠，我目睹了一堆东西从冰柜里拿出来到出锅变成所谓意大利肉酱面、海鲜面的全过程。。。就不描述了，怪不得谁都能做。从此再也没碰过他家任何东西。,26,184,5,2022-07-20 11:30:31,来自北京,30414778401155,几度秋凉呢
7122336789947597598,为卧底记者点赞[呲牙][呲牙][赞][赞][赞],2,182,1,2022-07-20 14:25:44,来自四川,94979298739,退休花姐
7122452499646874404,国家应该加大食品安全问题的管控了！象疫情、环保一样重视才行。,1,9,0,2022-07-20 21:54:46,来自四川,3900657223336494,波斯猫09
7122267543737516814,是人们赞助，大力赞助，一日不吃想三遍，好吃懒做，让它开的经久不衰！继续依然继续开，用不了三天就忘了这一段黑历史 菜重打鼓另开张了！[呲牙][呲牙],1,37,0,2022-07-20 09:57:09,来自天津,92546779202,多才远山hJ
7122263357016621838,唉，这还是所谓的知名品牌呢，不知名的食品都不知道有多恶心呢。,20,371,1,2022-07-20 09:40:41,来自安徽,3658783550871917,我爱读头条
7122284181275034380,油炸食品还是少吃吧。,1,26,0,2022-07-20 11:01:52,来自陕西,85686523488,岁月静好
7122373193087779615,2019年大年初四，我带着宝宝和弟弟去的必胜客吃，因为宝宝小，只吃了一点披萨的面饼，而我跟我弟弟两个人正常吃的披萨和其他食物，晚上到家，我俩上吐下泻，我因为害怕打针忍着腹痛没去卫生室，但是我弟弟扛不住去挂水了。[酷拽][酷拽][酷拽],1,24,1,2022-07-20 16:46:48,来自江苏,59392209351,丸子敏
7122307140257104676,20年前抱着好奇心加入了肯德基管理组，亲身经历了“魔鬼训练营”试用期阶段，那时各项指标要求真的超严格，公司的“神秘顾客”制度也让员工和店长压力山大！也是因为身体超负荷我做满试用期就离职了，没多久听说，带过我的一个小组长因为偷换汉堡🍔效期标牌（超时没卖出去）被店长发现直接被开除了，他可是入职好几年的老员工了，大家都特别惊讶也有人暗地里骂店长没有人情味。但后来我才觉得对于餐饮业，能有一位如此有底线有原则的店长，真的是食客们莫大的幸运！如今所谓的洋餐厅都本土化了，除了迎合国人的胃，也彻底遗弃了以往的标准…可悲！,15,132,4,2022-07-20 12:29:45,,1490570526332408,Donna同学
7122379196906963749,都一样，不过是有些没给曝光而已，我在日本企业好麦道兼职的时候那个炸制食品的油也是用了又用，每天都要捞黑渣出来，直到油颜色太黑才不用，但不是倒掉而是专门用油桶装起来等着攒够了卖给地沟油加工商,0,4,0,2022-07-20 17:10:21,来自北京,1327862899814077,我为金币来
7122273690259784480,必胜客现在确实不如以前了，餐具都洗不干净，服务员都是雇佣短期学生兼职，因为外卖比较多，堂食在饭点时很慢，而且很多都是预制餐包，烤箱再加工下，有次点了个芝士焗啥，外面是烫的，里面还是冰冻渣子。体验一点都不好。,4,154,1,2022-07-20 10:21:32,来自陕西,59676835171,蛮蛮不啦啦
7122318226662998816,那天我去吃必胜客，其中有一个牛肉焗饭，味道特别奇怪，饭感觉是酸的，最后重新给我换了炒饭[泪奔]并且结账的时候还没退差价，当时核对的时候应该是值班经理一直说对的，最后打电话到总部反馈这个问题才退给我了[红脸][红脸],1,66,2,2022-07-20 13:13:59,来自浙江,1332211533747533,雅趣江南
7122375977929982756,以前吃饭会找店面干净的地方吃才放心，后来看了些曝光画面发现无论店面怎么干净，后面的厨房都是同样不干净，现在是能不出去就不出去吃了,0,22,0,2022-07-20 16:57:52,来自辽宁,96836232516,我心我情
7122312518231982863,哪家都一样，疫情下，能自己做饭是一种基本生存技能，如果不赶时间，还是尽量少在外面就餐。所谓美食，都是各种调味添加剂而已，色即是空，空即是色，或许你自己做不出餐馆的味道，那才是食物本来应该有的味道[微笑],2,46,0,2022-07-20 12:51:09,来自浙江,53119197840,Simultaneous
7122267543737385742,麦当劳也有这个问题 我曾在那打工 他家面包经常过期换标签 可是不换吧 扔了真挺可惜 快餐都是冷冻速食 解冻再加工 所以少吃,1,43,0,2022-07-20 09:57:06,来自北京,102030553623,奇幻喜鹊ZG
7122453975630627621,我觉得肯德基必胜客麦当劳食材等等都比其他的放心多了[机智]在那兼职过上过班的都懂不骗人,4,16,2,2022-07-20 22:00:29,来自广东,106480716151,可爱的爱笑女孩
7122261239958897408,又难吃又贵,14,331,1,2022-07-20 09:32:17,来自云南,5722542523,巧厨娘苹果酱
7122270483885884167,麦当劳也改效期标签，有的食物掉地下了捡起来继续出售，,11,174,2,2022-07-20 10:08:33,来自北京,62332198027,MDDGGSSMM
7122259901955097374,前几年去麦当劳，每次去都拉肚子。前天去北京大兴生物医药基地地铁站肯德基买了个汉堡，六小时后，开始拉肚子。这些洋快餐，真的需要好好监督管理了。不敢去了！,48,294,3,2022-07-20 09:27:41,来自山西,53495359019,自在豁达风声ev
7122253207094805286,最安全的餐厅，还是自己家的厨房。,29,384,3,2022-07-20 09:01:59,来自安徽,2983720249,江淮好男儿
7122349692805530383,"必胜客管理层回应店面食材管理一事，对我做过餐饮管理多年之人而言必胜客公司回应店面关店、彻查都纯属应付媒体声音、降低媒体热度、展示公司态度而已，而问题本质恰恰是公司管理造成的结果。
作为餐饮管理过程如果做到食材管控安全，则基本方法是公司设计店面资源时要为食材存储保证足够的存储空间，保证食材在冷冻、缓化时能够有足够的食材摆放与标签展示空间，而往往很多餐厅没有足够空间让食材存放能充分标识、不混放，而更多的是聚堆存放，造成取用食材非常不方便、食材也无法每天盘点，所以先进先出做不到。
时间关系，简单分享大家，如果朋友们需要找时间详细为大家分享目前大多数餐饮店食材管控的基本形态。",1,21,1,2022-07-20 15:15:33,来自辽宁,97068530813,家教言行工作室
7122424073837576964,十天换一次已经很良心了。估计拍照的时候还没处理这个油吧，不是有一种东西沉淀过滤吗？我们这里有一家卖的很好的炸货摊，我就没见他换过油。那油也是黑的不得了,2,9,1,2022-07-20 20:04:29,来自黑龙江,86669284050,青山松月
7122324486514656004,很奇怪，记者为什么不起底中餐后厨,6,10,4,2022-07-20 13:38:28,来自湖南,4103832004470692,暖洋洋的小饭堂
7122314652512158476,必剩客一般家庭真的吃不起，一块半生不熟的那个什么饼，还有那个比米线还粗的面🍜，赚的有钱人的钱！我们普通人还是吃中国的大饼好吃！但是不管便宜还是贵，你食物质量要有保证吧，食材过期，烹炸用的油十多天一换（富含多种致癌物）不是害人吗？赚该赚的钱，莫赚黑心🖤钱💰,1,3,0,2022-07-20 12:59:03,来自江苏,11295274187,宜恋八段锦
7122241687329702664,只盯着这种大品牌罚，小门店连效期管理都没有,35,519,9,2022-07-20 08:16:50,来自辽宁,93180222770,赵大宝579
7122309214223385359,看来曝光一些无良商家，重点是能卧底，才能了解真相。商家获取利润的时候太黑了，不会在意你是否吃的健康。,0,24,0,2022-07-20 12:37:42,来自黑龙江,554634786646240,智勇双全钢琴47
7122263997709763332,只盯着这种大品牌罚，小门店连效期管理都没有,3,56,2,2022-07-20 09:43:55,来自四川,333848020266567,喵喵娱乐呀
7122266511498265376,天啊。我还说去必胜客吃一餐呢。结果刷到这一幕。还好没去吃[祈祷],5,23,0,2022-07-20 09:53:17,来自广东,109435477167,平安和美
7122267289864504067,看标题觉得我不要再去必胜客了，看完文章觉得还是去吃必胜客吧，毕竟是餐饮大头，居然把保质期设置的这么短，相信绝大部分餐饮店是压根不会这么严格设定食材保质期的,11,98,6,2022-07-20 09:56:27,来自江苏,149128633127219,养猫的兔
7122318520960582441,掀开了冰山一角！只是必胜客？,4,53,1,2022-07-20 13:14:28,来自安徽,87807169857,超级物理
7122311719930282756,快餐店屡次曝光，却一直火爆！而且最重要的是价位一路飙升！咱就得寻找自身原因了，明知道快餐食品不安全，却做不到拒绝！[呲牙],0,1,0,2022-07-20 12:47:43,来自河北,107670908049,看不落的太阳yx
7122256252742435587,必胜客炸制油十天一换，食材过期换签使用。,5,19,1,2022-07-20 09:41:40,,52508960733,夏皑心心
7122272181794652939,我今年前半年在必胜客兼职，我在的门店压根不存在这种情况，所有的食材都有效期，开封或者化冻了的东西当天用不完当天就废了，不存在第二天接着用的情况，炸东西的油虽然不是每天都换，但是每天晚上闭餐后都会检测，不合格就换,14,35,11,2022-07-20 10:15:16,来自新疆,70251131370,儒雅天空61
7122255812898374407,感觉必胜客不如肯德基，我从来不吃必胜客，因为失望了，要吃就吃肯德基，口感还新鲜些,62,69,7,2022-07-20 09:11:33,来自北京,1714838412470704,wzzwwommomo
7122418500131881741,"全民饮食健康,全靠工商餐饮部门把关.此事应引起各地餐饮部门重视,为百姓把好进口这道关,为国为民做贡献.大力作为！",0,0,0,2022-07-20 19:42:46,来自江苏,4028236646854919,一心一意叶子y
7122481818775520037,"十天一换可能算不错的，看看早餐炸油条的，那油就没见过本色，永远跟换下来的机油一样的颜色，还不是食客盈门？何况油炸到什么程度就要更换有国家标准吗？如果没有，完全靠消费者自己判断，显然不应该是未来市场常态。既然没有相应的标准，监督管理存在难点，不如采取疏导的办法，要求食品经营者采用油品净化过滤技术，通过不断循环净化，尽可能减少油炸食品带来的危害，我相信这个问题可以解决了。
相关检验部门要求实际一点，净化油属于地沟油一种，但净化后，有害物质总是会减少的，鼓励大家采用带净化过滤的油炸设备吧",0,0,0,2022-07-20 23:49:44,来自江西,59177437005,鶇飞天
7122442681292866342,这个我应该有发言权，作为曾经在必胜客工作了七年的管理组，食品安全一直是必胜客最重视的，各种体系和制度也很完善，但有时个别管理组为了绩效，数据好看，也会去做篡改效期的事情，员工也是如此，很多时候为了省点事，该废弃的食材直接效期一改就放冷藏库和冻库了。虽然一直都强调食品安全红线，各种内部稽核也有，但还是有人要乱搞。唉……,0,1,0,2022-07-20 21:16:42,来自四川,4278768153,A大鱼先生A
7122271075492348708,炸油十天一换，可以算是中国最良心企业了吧，这是在给必胜客做广告么[what]传统饮食店，没有换油一说，都是定期加新油进去的,13,20,0,2022-07-20 10:10:39,来自湖北,64961127955,万氏针灸
7122284504253055784,唉，这还是所谓的知名品牌呢，不知名的食品都不知道有多恶心呢。,1,13,0,2022-07-20 11:02:26,来自山西,93167590843,琴shh
7122243439122711337,2006年在西安必胜客餐厅做过半年的餐厅经理，那是品控很严格。[赞]公司区经理不定时会来检查，出错会狠批的。,15,85,8,2022-07-20 08:23:10,来自陕西,2616436794340747,我是一只中子星
7122313885041902375,10年前刚毕业，应聘K店储备店长，去店里实习两天后，就对油炸食品产生了抵抗。食用油不达标、更换日期、地上分拣鸡腿等，都存在。,0,0,0,2022-07-20 12:55:57,来自山东,86244265238,熊小木家族
7122270494443127590,在肯德基试过一个晚上的临时工，那个门店负责人还用仪器检测用油，到了一个什么指标就换，刚好我帮忙换过一次油，废油抽出来，按我们正常人炸东西的标准看着还能用，就抽出来了，换新的油是棕榈油，看着和咱们的猪油一样。不过我也就知道那一家门店那一段时间是这样，其他的不清楚，但是对肯德基的好印象提高不少。,0,20,0,2022-07-20 10:09:05,来自广东,105527889363,无理书语
7122274247820772126,最喜欢必胜客了，看来以后不能吃了[捂脸],3,19,0,2022-07-20 10:23:01,来自北京,3821520668868510,风随经幡带来好消息
7122389492547715872,很久不吃必胜客了，都是自己在家DIY，比必胜客披萨好吃，咸淡都是自己最ok的，其他那些都可以买半成品自己DIY，披萨饼坯和酱还有芝士这些网上买才四十多，但是可以做四个披萨，肠买台湾烤肠，自己做随时随地很方便，空气炸锅也就十分钟搞定,4,2,0,2022-07-20 17:50:44,来自黑龙江,3183816579485915,勇者辰星e8
7122303597655704359,有可能！因为从科学的角度来讲，食用油不宜反复使用！从口味的角度来看应可复用口味香点，但也不能起过三次不换新油。必胜客为了追求利润最大化，反复使用过期油这是必然的，否则就不叫必胜客了！个人观点，请指政！,0,0,0,2022-07-20 12:16:17,来自安徽,1060356451210951,怀揣梦想的枫叶红
7122280190352786187,肯定不止这一家店是这样的，只是别家没发现而已,7,147,2,2022-07-20 10:46:22,来自河南,5905327787,爱生活的80宝妈
7122245020887302946,点过他家的烤鸡，臭的，肉都过期了还给顾客吃,11,69,3,2022-07-20 08:29:14,来自北京,677723383007896,美食家飞机0pi
7122261805477053225,外面的熟食怎么可能干净卫生，花钱多不说，吃出毛病来没人管，还不如自己动手做的干净,2,60,0,2022-07-20 09:34:29,来自山东,52687093648,上帝的番茄酱2016
7122245758673437472,百胜的卫生算是餐饮的天花板了，可以想象其他餐饮的卫生是怎么样的，还是在家吃吧,9,117,1,2022-07-20 08:32:54,来自广东,59359713101,古月在深漂
7122280005073437474,对，又贵又脏，只有自己小年轻去吃，不知道这钱是大水淌来的，大风刮来的样，还有外卖没有比外卖最脏的了，最垃圾的采边角料的菜，卖最好的价，懒得要命，夫妻两个人买两份外卖，30几块钱最少，可以给一家三口吃一天的伙食，而且好的不得了，为什么要点外卖呢，懒惰，现在年轻人以后怎么办？,1,6,3,2022-07-20 10:44:57,,2106265669206615,朴实梦想Mj
7122304584730854152,我去，这还是大牌呢，以后可不能吃了[吐舌],0,0,0,2022-07-20 12:19:57,来自北京,5834578241,我用旅拍看世界
7122437329700717352,《卧底必胜客后厨:过期食材改标签继续卖，烹炸油十天一换“墨一样黑”》……1.撕掉包装掩盖保质期，过期食材“化整为零”;2.被处罚未整改，米饭意大利面过期扔在用;3.被改有效期的食材不止这些，还有过期米饭和🍜面条;4.过期食材“续命”;标签改了又改;5.烹炸油十天才换一次，酸价超标近一倍;6.专家:整改不到位还是因违法成本低?😡😡😡,0,3,0,2022-07-20 20:55:20,来自河南,53060582275,洛阳凤凰
7122245507133063949,"相比多数外卖商家小店 这简直就是食品界天花板了
我见过我家楼下外卖操作间 到处油污 臭味熏天 照样有生意",7,172,5,2022-07-20 08:31:53,来自辽宁,4472040527,海绵宝宝41474537
7122354449343152931,油炸都这样的，之前有炸鸡店说他们油都是沉淀下来的不要，其他是补新油进去的,6,16,1,2022-07-20 15:33:53,来自江西,100597577702,悠悠0113
7122273225992143646,举一反三，全国大排查，确保食品安全！！,7,82,2,2022-07-20 10:19:19,来自江苏,554572463210996,神秘风声3l
7122267965545808654,必胜客不行啊，我上大学在肯德基后厨干过，基本三两天就过滤一遍油，一到两个星期换新油，不可能让油很脏的，但是换保质期条是肯定的,11,51,2,2022-07-20 09:58:38,来自河北,50404308933,初源2022
7122423079124632350,这个是被爆出来的，那些没爆出来的应该也存在不少这个现象。这种为了追求利润节约成本，而不管顾客健康利益的商家，简直可恶。还好我不怎么吃必胜客，所以不是没办法，最好少吃这些，食品安全没保障。[汗],0,9,0,2022-07-20 20:00:23,来自广东,106607404165,乐观的书签rA
7122306674299388680,坐标武汉，18年去吃必胜客，导致肠胃炎，又拉又吐，夜里去医院急诊，医生都说是食物引起的，结果必胜客的门店经理就是不承认自己的卫生状况，所以这辈子都不会去吃了[再见],2,34,3,2022-07-20 12:27:57,来自湖北,6873497890,敉籽1
7122337122354316066,我家孩子们都喜欢披萨、汉堡包、薯条这些，我都是自己做，披萨自己做饼底也是很简单的，甚至用馒头和鸡蛋都可以做个饼底，馅料自己用新鲜牛肉、大虾、鸡腿肉这些搭配水果，芝士碎按喜好加多加少都可以。平时奶昔、水果茶、冰沙都是自己做给她们吃。,0,28,1,2022-07-20 14:26:34,来自广东,3671997036637725,远嫁内蒙的顺德人
7122397070132052749,我读大学的时候在麦当劳做过3年半的兼职，里面炸鸡的油是固体棕榈油，炸肉多了油就炸黑了，经理就倒一袋子类似白砂糖晶体的物体进去，开火升温，油就变得清亮的，还不让我拍照，刻意回避我们后厨工作人员，希望麦当劳出面回应一下，晶体颗粒是什么？,4,16,1,2022-07-20 18:19:14,来自湖北,6137501644,犁地的大黑牛
7122252658723390219,从来就不相信这些企业人前一套说法背后另一套做法！都是假大空！喊得越凶的猫腻越多！,2,37,0,2022-07-20 08:59:55,来自四川,13938997570,狮子座的七月
