7122334065046373161,"我们这一家早餐店，人们每天早上排长队买油条。
据说他家中午的包子面条不好卖",0,3,0,2022-07-20 14:14:37,来自河北,96660293572,锦绣1295
7122329165013500704,为了自身和家人的健康安全还是降低外面油炸食品及饮食购买的次数！,0,1,0,2022-07-20 13:56:49,来自安徽,62898587101,锦绣河山168
7122454306648949519,病从口入，最安全的餐厅，还是自己家的厨房。。。,0,0,0,2022-07-20 22:01:08,来自湖北,3668420941054302,多多妈zhx
7122457836025856808,才过一天很良心了吧，这些连锁企业比百分之九十的餐饮店卫生多了,0,0,0,2022-07-20 22:14:58,来自广东,53076470926,绝色拉拉
7122336378146603812,感觉违规成本有点低……起不到太大作用[黑线],0,0,0,2022-07-20 14:24:09,来自重庆,60418858691,妖小静166953646
7122437960788017928,要想吃得安全，还是自己在家做的放心。,0,0,0,2022-07-20 20:57:57,来自辽宁,3184627333207326,热情风铃L
7122456692868383503,最安全就是不要吃外面的,0,0,0,2022-07-20 22:10:28,来自四川,22895804087,世界没了光我便是光
7122276354669675278,百年老汤怎么说？,0,5,0,2022-07-20 10:31:00,来自广东,650518360500061,何易解忧
7122449576623342336,要想吃的健康，最好的办法就是在家吃。,0,0,0,2022-07-20 21:42:42,来自河北,105205142723,阳光
7122242336716964643,为什么这些企业在国外合规经营，到中国就各种坑呢？值得思考,7,46,1,2022-07-20 08:18:47,来自河南,2704413113986532,小粉和老白
7122425604942709542,病从口入，最安全的餐厅，还是自己家的厨房。。。,0,0,0,2022-07-20 20:10:15,来自辽宁,109630149445,上进的风铃Zf
7122386342260589353,这不够吧！得对近期的消费者赔偿！,0,0,0,2022-07-20 17:37:41,来自北京,3466137091969981,乐灰狼呀乐灰狼
7122409858972156676,必胜客和街边摊谁油好一点？,2,4,1,2022-07-20 19:09:25,来自辽宁,96521559533,lolo5007
7122339848132018956,食品安全无小事，一定要严管重罚。,0,1,0,2022-07-20 14:38:15,来自青海,6021603378,大浪淘沙76219269
7122432485392352034,去大饼油条 街边小吃卧底下啊，必胜客算干净狠多了,0,0,0,2022-07-20 20:36:28,来自浙江,2968290110736951,125896艾斯比
7122470214213960482,国人吃的更香[呲牙],0,0,0,2022-07-20 23:03:07,来自广东,1538929997133488,火星人在广东
7122305441854128930,罚的轻了，重罚 这种现象能强一些,0,1,0,2022-07-20 12:23:05,来自辽宁,63074638126,带火苗的冰雹188089195
7122420853018493730,你的论点很有意思，选用的图片更有意思，只字未提必胜客，哟西！,0,3,0,2022-07-20 19:51:14,来自辽宁,8898754964,laofu7
7122264635164263208,查对来说，肯德基麦当劳必胜客餐厅，在处理剩余餐料上是很规范的，可以说是所有中国餐饮中乃至超市，都不及的！超市剩余食品，照样拿来卖！,0,6,0,2022-07-20 09:45:27,来自北京,1891593831857740,雪亭暖阳
7122287854767620895,我同事上大学期间在必胜客打过工，所以从来不喝他家的饮料，你懂的[呲牙],0,0,0,2022-07-20 11:15:35,来自北京,51560748873,智慧帆船Fk
7122433710225523468,任何一家餐厅厨房都经不起考验。除非你自己做。,0,0,0,2022-07-20 20:41:39,来自辽宁,59440360276,惜悦小镇
7122361214105649920,严惩必胜客，严惩肯德基，麦当劳，华莱士等这些快餐厅,0,5,0,2022-07-20 16:00:14,来自福建,1807016280,情满荆楚
7122458134974890791,这叫自己砸了自己的招牌，树立一个好的品牌需要几年十年时间，砸确只要一分钟,0,0,0,2022-07-20 22:16:47,来自四川,835243210967736,聪明葡萄Ap
7122448188237431587,太黑心了，难怪好多病都年轻化，严查……,0,2,0,2022-07-20 21:37:19,来自广东,4152226938887531,热情的光束4v
7122456082248925952,入乡随俗，[赞][赞],0,1,0,2022-07-20 22:08:04,来自陕西,3531238001881800,青皮桔子
7122462612935639822,我一直的高大尚餐厅,0,0,0,2022-07-20 22:34:01,来自天津,96088953125,馨紫百合
7122293494168732448,就这还死贵呢，而且还都排队去吃呢！,0,0,0,2022-07-20 11:38:00,来自北京,6813252935,美丽转眼即逝
7122365301433795366,食品安全问题 屡禁不止,0,2,0,2022-07-20 16:16:44,来自河南,110516676841,用户雨中过客
7122464465983636238,必胜客这样，以后谁还敢去,0,0,0,2022-07-20 22:41:32,来自上海,1359416553640679,缨蓉的生活百味
7122457035178328867,在外吃饭担心，回家吃饭安心。,0,2,0,2022-07-20 22:11:52,来自辽宁,108979066333,桃花源里的桃子
7122318629467325218,无论是什么品牌的食品都没家里的安全卫生！！只是你没看到而已！,0,0,0,2022-07-20 13:14:58,来自北京,79978068099,她你仔细我
7122438004257489701,昨天还吃了必胜客,0,0,0,2022-07-20 20:58:06,来自上海,1508182169751725,阳光雪山沙滩
7122365348334404383,我们很少去吃“必胜客”，因为贫穷！,0,0,0,2022-07-20 16:16:26,来自广东,2010354126955511,做个努力的宝妈
7122431826060854019,希望大学生都以这种方式兼职。,0,0,0,2022-07-20 20:34:38,来自北京,9911580425,新文化街男孩
7122418348008260363,那肯德基是不是也不安全了？,0,1,0,2022-07-20 19:42:06,来自广东,1077964739977230,蜜姐说家常
7122308090678166303,吃不起快餐，只能在家做饭,0,0,0,2022-07-20 12:33:26,来自山东,3853114539,为梦想奋斗28532964
7122413711167521576,酒店厨房里炒菜油都是黑的一天炸那么多食材不可能炸一次就倒掉的 。,0,2,0,2022-07-20 19:23:45,来自山东,110064034906,Goodloak
7122434910702846757,海底捞等餐饮企业同样也是这样搞，多少顾客吃的都是过期食品,0,0,0,2022-07-20 20:46:14,来自北京,3091444320961180,学哥9413541
7122412849695146787,还是在家里吃安全啊[笑哭][笑哭][笑哭][笑哭],0,2,0,2022-07-20 19:20:18,来自江苏,101067855540,多多钱的麻麻205
7122265340788687630,我们的监管部门在干么？为什么大部分食品问题都是媒体在揭发？,0,4,0,2022-07-20 09:48:40,来自甘肃,3755552538886494,多才多艺海风aQ
7122455104816530180,大惊小怪！饮料牛奶面包全部都可以改日期标签的,0,0,0,2022-07-20 22:04:43,来自广东,396286756658975,木子李田园记
7122438539224433444,举一反三，全国大排查，确保食品安全！！,0,1,0,2022-07-20 21:00:18,来自辽宁,3712401411154416,笑得太过分
7122424089683362600,长时间夜晚，在肯德基干过维修，每个店做汉堡的面包都多是裸放在架子上的，关键蟑螂老鼠是餐饮业店的常客，,0,0,0,2022-07-20 20:03:49,来自湖北,72123724676,盛世盘龙
7122416866903442191,天下餐厅一般黑，最干净的饮食，就是自己动手。为了健康，少吃外卖，少吃快餐。,0,1,0,2022-07-20 19:36:06,来自广东,3790707755583063,专利转让吴建辉
7122416167180305183,以前我不懂为什么食品安全这么难管，十几年后当我带着奶奶住院看到医院满满的人 住院还住不进去的时候 我好像明白了什么！,0,0,0,2022-07-20 19:33:45,来自安徽,540585338868845,魔方的大叔
7122405487668773673,都是为了节约成本，不得不这样做，做餐饮企业的基本上都是这样，或多或少都存在一定问题,0,0,0,2022-07-20 18:51:56,来自湖北,4477656194621567,潇洒豆花jY
7122299396226204451,百胜集团都是这样的，肯德基也快一个月星期的,0,0,0,2022-07-20 12:00:15,来自江苏,51843772510,海洋之星1001
7122448611887121193,告诉你们一个真像，小饭馆的菜是最新鲜和卫生的，越是高级餐厅越差，你吃的饭都是提前做好的剩饭，你用的餐具洗洁精都没洗干净，在高级饭店干过的都知道。,0,0,0,2022-07-20 21:39:00,来自河南,108740509988,阿龙社会哥
7122449673029780256,其实不必较真，超食品保质期1-2天食用问题不大，不要超很长时间，毕竟保质期的设定也没那么精确。不过篡改保质期的行为有恶劣,0,0,0,2022-07-20 21:43:53,来自浙江,6705029974,命运与双手
7122311410948375311,食品安全必须严肃处理,0,5,0,2022-07-20 12:46:42,来自湖北,2744860515507827,迷茫的路上有钱捡
7122347993155748620,少在外面吃东西，特别是必胜客、麦当劳、肯得基，它们的东西对健康相当不利。偶尔吃一点还行，如果经常吃必伤身体。,0,0,0,2022-07-20 15:09:17,来自湖南,62214358594,手机用户张菊芳
7122458743345906436,曝光的好[赞],0,0,0,2022-07-20 22:19:02,来自四川,65787062849,月牙餃子
7122440967940031273,这根本不是新鲜事儿，餐饮业都存在，有一个死循环就是老油做的东西确实更好吃，真想要绝对卫生，只能自己做了。,0,0,0,2022-07-20 21:09:19,来自河北,3817960847444878,绝对领域小舒飞刀
7122261401447432971,作为商家，怎么就不知道诚信第一呢？必有蹊跷,0,3,0,2022-07-20 09:33:24,来自北京,66922123313,澜姨
7122334116112286468,那一天食品安全，食品健康决定餐厅生意是的时候。我想那天应该越来越近了,0,0,0,2022-07-20 14:15:54,来自湖南,2665643362237639,悟空你长胖了
7122367752202912526,这个记者，应获得年度最佳新闻奖和个人大奖。,2,20,0,2022-07-20 16:25:33,来自黑龙江,82180828130,正直cisc
7122317854523458315,何止必胜客，次，出去吃饭闭上眼睛吃就行了，食品安全环境差又不是一天两天了,0,0,0,2022-07-20 13:11:29,来自山东,483377129195223,云影设计
7122371490292564740,必胜客的这些操作属于餐饮业正常操作，不相信多去暗访几家试试！！！[酷拽],0,0,0,2022-07-20 16:40:34,来自广东,86301027827,a懒人做菜
7122447291847852815,昨天吃必胜客吃披萨发现好几根头发,0,0,0,2022-07-20 21:34:00,来自河北,98846654069,meng7010
7122413653957182216,何止必胜客，食品安全问题来不得半点马虎，必须严加监管。,0,1,0,2022-07-20 19:23:53,来自江苏,105893496076,广陵珠峰
7122466604956386089,多监督一下，肯定不止一家店，不止一个品牌。,0,0,0,2022-07-20 22:49:05,来自江苏,1865204610117452,云淡风轻的金士顿
7122448584590508811,高标准的餐厅过期个几天不影响品质。,0,0,0,2022-07-20 21:39:11,来自山东,1914738360,海风382201
7122291596372067086,所以我很少给孩子买外面的油炸食品，都是在家做，,0,1,0,2022-07-20 11:30:13,来自山东,1622514162218280,花开花落一家人
7122478512086221582,什么餐厅都不经查，除非他不赚钱,0,0,0,2022-07-20 23:36:04,,3767111296,灵活死胖子
7122429329744970537,都下敢买必胜客了，每年都买了他家的尊享会员。看来还是自己做更安全,0,0,0,2022-07-20 20:24:13,来自四川,1997169703789431,莘莘
7122375029471314688,餐厅的后厨，灶火🔥下的罪恶,0,0,0,2022-07-20 16:53:36,来自湖北,3980653546702300,一心一意星辰cV
7122475296393249551,外面的饭店都是这样的，[呲牙][呲牙][呲牙]所以还是在家吃吧,0,0,0,2022-07-20 23:23:05,来自河南,71959698839,信任等于零
7122292341418918660,眼不见为净，每个餐馆厨房都一样，从不吃油炸食品。,0,1,0,2022-07-20 11:33:24,来自广东,70763834743,风之冰河
7122443725892027170,还不如尊宝披萨，亲眼看到他们当天用不完的食材倒掉，太浪费了太可惜了,0,0,0,2022-07-20 21:19:56,来自广东,712105548842221,溪流荡漾
7122300852961870599,必胜客是失道寡助了，连内部员工，管理人员，都不说好,0,0,0,2022-07-20 12:06:11,来自山东,58703199369,钵衣天罡淳风
7122466132758004480,必胜客正常，炸锅里的发热管积了厚厚的黑油泥都没人清理，那些更恶心,0,0,0,2022-07-20 22:47:27,来自广东,73317056616,哈人儿
7122264167763559209,记者应聘进入必胜客北京和谐广场店和魏公村店，发现后厨存在多种食品安全问题？这是咋回事，故意卧底吧[捂脸],0,1,0,2022-07-20 09:43:38,来自山东,64641311290,煮茶读闲书
7122265425672569640,我认为吃的东西一定要重视起来，现在的食品安全让人担心,0,2,0,2022-07-20 09:48:24,来自江苏,1516971009245976,随缘51Q
7122450622901043983,除了自己家，甭管五星七星大饭店还是米其林亦或者私家小厨，百年老店都是别进后厨，别看食材来源，您就吃个高兴就得了[灵光一闪],0,0,0,2022-07-20 21:46:54,来自北京,94424633582,江天一色无纤尘79
7122482439049642759,这，每次去看到餐厅都是满的，难怪经常看到油炸品好黑颜色好深啊。[酷拽][酷拽][酷拽],0,0,0,2022-07-20 23:51:33,来自江苏,5565113660,崆山上的峰哥
7122452372215382824,油炸食品还是少吃吧。,0,0,0,2022-07-20 21:53:41,来自福建,2378972592873964,人生在奋斗中前行
7122451555429270308,很久以前吃，现在都不去了，一直以为会比KFc或者M好点，结果都一样！还是自己下厨安全。,0,0,0,2022-07-20 21:51:02,来自四川,4002639172601699,活泼原野4i
7122419552713016064,现在人心墨黑，啥品牌不品牌,0,1,0,2022-07-20 19:46:19,来自江苏,58836836464,总要笑对生活吧
7122464274605196047,这么说来，还是在自家吃，比较卫生、安心,0,0,0,2022-07-20 22:39:59,来自江苏,106457545163,笑看人生szhn
7122462296794006285,少吃快餐食品，特别是油炸食品。,0,0,0,2022-07-20 22:32:40,来自甘肃,108648263963,做人如水善待余生
7122453172601619241,必胜客从来不吃，吃不起啊。,0,0,0,2022-07-20 21:56:48,来自辽宁,97996206377,天通苑西三
7122417446120080141,难怪去必胜客吃了回来拉肚子[发怒],0,4,0,2022-07-20 19:38:39,来自山东,97918153193,活泼小鱼Uy
7122313024845267712,肯德基也是他们一个集团的？才知道，我说呢不如麦当劳好吃,0,0,0,2022-07-20 12:53:05,来自辽宁,105591702174,聪颖白云ew
7122451869251322624,十年前上大学的时候在必胜客打过工，当时真是一天一换油，豆台做的饼底当天卖不完全部烤成大饼扔了。结果现在被资本搞成这样,0,0,0,2022-07-20 21:51:48,来自山东,82472743744,大生123
7122434014875222821,卖过期食品在美国的食品店是合法的吧，有专门卖过期食品的超市啊,0,0,0,2022-07-20 20:43:00,来自北京,131532256194823,大内平手22
7122418517957821219,以后不能带孩子吃了,0,0,0,2022-07-20 19:42:34,来自吉林,540574387289812,时髦豆花rp
7122298302808671017,食品安全大事 不能糊弄,0,1,0,2022-07-20 11:55:54,来自辽宁,50096392826,北大青鸟IT教育
7122418694172558119,"还是在家吃吧，以后和必胜客说拜拜了[捂脸][捂脸]
本人头条首部小说《明朝打更人》上线，期待各位看官赏光！",0,1,0,2022-07-20 19:43:33,来自四川,52899279295,小镇小说家
7122446766813299464,必须用剩下的东西给客人，简称必胜客,0,1,0,2022-07-20 21:32:14,来自北京,86340199351,大手大脚的飞
7122312599739548457,必胜客老板很奇怪：油还要换的吗，不是百年老油更好吗？,0,0,0,2022-07-20 12:51:18,来自湖南,6237225016,贱客奇材
7122246305371620100,哪个后厨经得起查的？,0,6,0,2022-07-20 08:35:04,来自山东,105055431015,小妮可凡
7122317274664829735,必须严惩食品杀手，绝不姑息,0,0,0,2022-07-20 13:09:08,来自上海,3465251650017230,安逸钢琴Sy
7122449255893189388,必胜客暴露的问题只是中国饮食界的冰山一角，必胜客不是第一家，也不是最后一家！,0,0,0,2022-07-20 21:41:56,来自广东,106180430703,今生来世不相逢
7122413117245637376,跟大润发一样的，大润发广州发发点，所有包子馒头都是头一天的，麻花，等油炸食品，包装时期到期后，换包装继续贴新日期,0,1,0,2022-07-20 19:21:26,来自四川,105172178839296,包包1987
7122283102533436163,来查查房山区窦店镇必胜客吧，披萨的饼用的油辣嗓子，其他的就不知道了，反正披萨跟以前不一样了,0,1,0,2022-07-20 10:57:52,来自北京,4363329764595133,智慧的丞言丞语
7122312969384100640,祸害，必须严惩！,0,0,0,2022-07-20 12:52:33,来自山东,1459790905615464,yanjingxiu
7122394318417707813,食品质量堪忧,0,17,0,2022-07-20 18:08:58,来自河北,5961241167,阅读时间
7122454102563013388,必胜客现在确实不如以前了，餐具都洗不干净，服务员都是雇佣短期学生兼职，因为外卖比较多，堂食在饭点时很慢，而且很多都是预制餐包，烤箱再加工下，有次点了个芝士焗啥，外面是烫的，里面还是冰冻渣子。体验一点都不好。,0,0,0,2022-07-20 22:01:08,来自湖北,2041154089779438,灿烂船帆7L
7122444786699223842,唉～这都不是事儿了，这种事多了去了，以前就有个开酒水批发的，经常这样做。改一个下标签从新打印一下生产日期。,0,0,0,2022-07-20 21:24:13,来自福建,6554328388,木子95729506
7122324267559650086,餐饮业这种情况已经是常态，川菜回收油又不是没见过，饭店大多数的烹炸油不是被收走就是做成辣椒油了。大家都是眼不见心不烦。,0,0,0,2022-07-20 13:37:41,来自辽宁,19439761998,二师兄前来觐见
7122265042888180519,一定要严惩😡食品安全是大事，不能疏忽大意！,0,2,0,2022-07-20 09:47:55,来自浙江,1816046013527571,鑫电阀门陈柯冰
7122433136797303590,"中国饭店特色
卧底去查
没有几家达标？！",0,0,0,2022-07-20 20:39:44,来自内蒙古,100178463187,快乐的饭团X
7122449858996847401,这也不错了，最起码服务好，不象淮阳西关老回中路口的赵记香辣虾，网上定餐，吃完饭收餐具费，，不认可收费，老板娘放出狠话，再来不接待，这个是要歇业的前兆吗？,0,1,0,2022-07-20 21:43:58,来自河南,3825927204636221,乐天派生活家zp
7122324036373267208,都一样，汉堡王，肯德基，麦丹劳以及其它炸鸡店，都是这样的，见怪不怪，起酥油，直接进血管，其它的自己百度查去吧,0,0,0,2022-07-20 13:35:45,来自辽宁,87786836823,Walking的鱼丸粗面
7122410869745124110,肯德基必胜客，他们用的油都不如路边摊位炸油条的。炸油条的也不敢三天不换油[呲牙],0,1,0,2022-07-20 19:13:25,来自山东,98179443941,人生39713
7122442187774034729,还不如外边小摊呢，我朋友炸臭豆腐都是一天一换油呢,0,0,0,2022-07-20 21:14:07,来自辽宁,85152635089,遨游太虚的鱼
7122262581603009321,举一反三，全国大排查，确保食品安全！！,0,7,0,2022-07-20 09:37:18,来自辽宁,2673664406076861,一凡舟
7122466388015022856,油，一天一换的不会超过一成，话说枪打出头鸟，同等条件下，我还是相信诸如必胜客等大牌,0,0,0,2022-07-20 22:48:57,来自上海,100243720484,袁亦琦
7122468369252827945,民以食为天！在食品行业中一定加大监管力度，严查严管严厉打击！任何一个行业不能嚯嚯国民的健康啊！！！！,0,0,0,2022-07-20 22:56:00,来自山东,2260198840346299,國泰民安1983
7122421903973204750,该死的必胜客，但是，中餐馆是不是更是有过之而无不及呢？,0,1,0,2022-07-20 19:56:00,来自河北,104082014525,老故事客栈I同居旅居
7122415798140257039,和肯德基麦当劳一样[捂脸],0,0,0,2022-07-20 19:31:56,来自江苏,1327815744030424,爱吃瓜子的老鼠
7122240581971100431,不是某个商家的问题 而是人的问题 再追究下去就是道德问题 信仰问题 文化问题……,3,51,1,2022-07-20 08:11:59,来自湖南,369055761199336,第10颗行星
7122306686073438991,哈哈，中国人不骗中国人,0,9,1,2022-07-20 12:27:53,来自广东,3576810959,真正举头三尺有神明
7122424360052605731,这还能吃吗？对这种不良商家，必须要重罚，严肃处理。,0,1,0,2022-07-20 20:05:03,来自浙江,633739942822128,随风而来
7122422617172738846,又要黄一家，支持[赞],0,2,0,2022-07-20 19:58:44,来自云南,4563268909,明天要早起早起
7122376072758788878,卖油炸食品的老板有一两天换一次油的吗？,0,0,0,2022-07-20 16:58:08,来自湖南,110934767284,拔凉拔凉的
7122439836019360553,据说全国后厨最好的地方是麦当劳，肯德基。,0,0,0,2022-07-20 21:05:02,来自福建,53098190314,千年老妖呗
7122442144103039780,从来都不去买这些东西吃，价格又贵又不健康又有食品安全隐患！以后看到这些店坚决不进入消费,0,0,0,2022-07-20 21:14:23,来自甘肃,6100402958,pretty2016
7122446793849455367,希望国家重视食品安全问题,0,2,0,2022-07-20 21:32:22,来自广东,74583925340,狸猫犯太岁
7122478593607123727,其实油炸食品新油炸出来的不好吃，为啥有些人自己在家炸，味道和外面的不一样，就是因为用的新油。就像油条一样，他们临下班炸出来的油条就是比早上的好吃。,0,0,0,2022-07-20 23:36:01,来自青海,52264745427,88年的大叔HZ
7122446171628684039,无良商家，不知道有多少次了呢，明知故犯，，小朋友吃了，身体健康能好吗，就该重罚,0,1,0,2022-07-20 21:29:47,来自山东,54869038639,充满元气的小田同学
7122288084628783912,食品安全保障是生命线，不容有管理真空区域，要顶格重罚无上限。现在食品餐饮行业违法成本太低。,0,0,0,2022-07-20 11:16:19,来自上海,55961628845,霸道总裁兔8
7122393384962065187,坐标上海，我们这必胜客这两年已经大幅度被达美乐取代了，达美乐的扩张势头比较猛，跟必胜客同为披萨届三巨头,0,0,1,2022-07-20 18:04:52,来自上海,62228913160,nihassle
7122309276630156063,这一代青少年太惨了，总是吃这些垃圾食品,0,0,0,2022-07-20 12:38:04,来自四川,2692062386861479,快乐沙滩uh
7122446844600648462,必须用剩下的东西给客人，简称必胜客,0,3,0,2022-07-20 21:32:33,来自北京,86340199351,大手大脚的飞
7122340550006620968,好多年，没有吃过了实在是太贵,0,0,0,2022-07-20 14:39:53,来自湖南,109190075316,欧阳家的希希
7122424896898614054,想想那超标的油，各类疾病、癌症的元凶啊！食客的无奈啊。,0,0,0,2022-07-20 20:07:55,来自陕西,105692539377,一盏茶细细品
7122339787998626568,食品安全问题不容忽视，一定要严管。,0,0,0,2022-07-20 14:37:19,来自广东,2818801566492088,端庄风铃4SE
7122458925198230313,哎，别的查过吗？餐厅哪家卫生？,0,0,0,2022-07-20 22:19:00,来自陕西,1640091052154126,梦华读书
7122443952213148431,从来不吃这种垃圾食品。也不可能摊上这种事,0,0,0,2022-07-20 21:21:00,来自天津,835242889324270,深夜食糖
7122435620965925669,食品安全事件，病从口入，建议严惩重罚,0,0,0,2022-07-20 20:48:51,来自福建,2330597231172119,奋发辰星2mk
7122477934770340641,曝光的好，让大家都抵制,0,0,0,2022-07-20 23:34:44,来自宁夏,104357775807,时髦清风rg
7122421540918035236,以后不敢吃必胜客了,0,0,0,2022-07-20 19:54:25,来自北京,4451270667278014,势如破竹小班马
7122430127103394595,为啥爆出这么多问题人还络绎不绝，就是大家都秉着眼不见为净的思想，反正我又看不见，爱咋滴咋滴呗,0,0,0,2022-07-20 20:27:22,来自山东,1631314501702551,积极的胖兔子
7122460072898872098,直到6月29日，足足使用了十天之后，餐厅的管理人员才同意更换新油。,0,1,0,2022-07-20 22:23:47,来自江苏,2919904147671150,天山星驰
7122280747427316516,之前做飲食業，油五天左右換，一般變色就會換，有人來收，收的錢師付要，不換給老板省錢。,0,0,0,2022-07-20 10:48:11,,2524115400921949,龍的傳人棒棒
7122482197461746468,从没吃过必胜客，以后也不能吃，学做饭，家里的饭最安全！,0,0,0,2022-07-20 23:50:42,来自北京,4089829122644728,林双水
7122313805517849378,必胜客都如此再去看看街边那些小店吧,1,0,0,2022-07-20 12:55:50,,50299967896,他大叔来了
7122418475897094946,去其他店也一样，任何餐饮也做不到,0,1,0,2022-07-20 19:42:18,来自北京,111329125188,朝气蓬勃996
7122289768595014403,油炸食品不都这样？要想健康饮食，就吃清淡少油，蒸煮类的食物,0,1,0,2022-07-20 11:23:19,来自湖北,1310273325511080,罗那耳多
7122454757532320542,@大家。你们不知道薯条想炸成金黄色。必须用黑色的油。新油炸出是死死白白的不好看。,0,0,0,2022-07-20 22:03:08,,1679689992387693,正义凛然小鱼D
7122421637932319524,不敢吃了，这种事情不是一次两次了,0,0,0,2022-07-20 19:54:49,来自上海,3931486299370680,猫咪爱吃鱼吖
7122305499211121449,除了自己的厨房，商家的都不咋滴让人放心[微笑],0,0,0,2022-07-20 12:23:16,来自河北,2436119656406387,有重名的呗
7122412340754023207,原来你是这样的必胜客…,0,2,0,2022-07-20 19:19:05,来自山东,54296797506,豁达橘子z
7122452700779971331,"良心商家从来不坑穷人
太过了必胜客吃不起",0,1,0,2022-07-20 21:55:22,来自浙江,4513654926,以身作则传递正能量
7122452207290598182,网络上人家卖了几元钱的商品，罚5万10万的，必胜客这样做也才罚5万？？？值得深思，看不懂,0,0,0,2022-07-20 21:53:26,来自江苏,1143092577042600,期待197030
7122311825660134157,应切实有力监管，永不录用相关责任管理人员。人民食品安全大于天,0,0,0,2022-07-20 12:48:01,来自北京,997989010128072,蛇53
7122453921917993739,有良心的商家太少了。能吃到靠运气,0,0,0,2022-07-20 22:00:11,来自江苏,4913091569,假装我在拉萨
7122294271603933992,金絮其外，败絮其中。快餐基本操作！,0,0,0,2022-07-20 11:40:11,来自辽宁,50384575729,怒苍山
7122417759925142287,天下餐厅一般黑，最干净的饮食，就是自己动手。为了健康，少吃外卖，少吃快餐。,0,0,0,2022-07-20 19:39:25,来自广东,3790707755583063,专利转让吴建辉
