7122440250408108815,"品牌越大查的越少，很多外卖都是隐蔽家庭作坊缺乏监管，相反临街小炒店查得比较严！
油炸食品、烧烤类、外卖少吃就是对自己的保护！",0,0,0,2022-07-20 21:06:32,来自四川,104039939255,乡村匠人的vlog
7122343904632587011,这年头，感觉只要不是自己做饭，都不知道会爆出什么吓人的东西，关键是孩子爱吃。太可怕了！！！严惩！！,0,1,0,2022-07-20 14:53:53,来自山东,51057788514,娜娜小蹦蹦
7122350519729144579,类似的商家有很多，只是我们没看见而已，食品安全是关乎大众健康的大事。呼吁食品监管部门整改排查！,0,1,0,2022-07-20 15:19:14,来自江苏,111003045545,wupiaomiao
7122248685903774494,不要以偏概全，百胜餐饮在食安方面，绝对是最可以信赖的，全国10000个门店，有个车餐厅管理上出了问题，需要的是加强问题餐厅的管理和处罚。哪些监测不要说超标，对于绝大部分餐饮，可能都没有听说过。,0,15,1,2022-07-20 08:43:59,来自江苏,5382156082,酷热四叔
7122455543117316899,在外头吃饭，凭商家的良心，在家吃饭，自己安心。,0,0,0,2022-07-20 22:06:00,来自辽宁,108979066333,桃花源里的桃子
7122336979919913763,食品安全问题不容忽视，一定要严管。,0,0,0,2022-07-20 14:26:02,来自河南,3312188694988568,高冷苹果sG
7122408764196176648,想想点过外卖，多少家长点过给孩子吃,0,0,0,2022-07-20 19:05:05,来自湖北,2678828128017351,爱学习的妈妈tian
7122269012666974983,类似的商家有很多，只是我们没看见而已，食品安全是关乎大众健康的大事。呼吁食品监管部门整改排查！,0,25,1,2022-07-20 10:02:56,来自河南,59132615038,LYD浅秋
7122310922764387113,再也不吃了,0,0,0,2022-07-20 12:44:25,来自四川,50023799292,暴走的徐阿肥
7122316004805477124,必胜客出现类似问题不是一次两次了[发怒],0,0,0,2022-07-20 13:04:12,来自江西,814106416788237,F66554
7122464956247147264,我很少去饭店吃饭，更别提外卖了，总觉得哪里不对劲,0,0,0,2022-07-20 22:42:48,来自上海,104675710843,玲子588
7122436135624344356,肯德基，必胜客麦当劳，我从来不去吃了解了黑厨更不去了,0,0,0,2022-07-20 20:51:04,来自天津,103241616755,田姐天津
7122261796928832296,必胜客挺贵的！！,2,44,1,2022-07-20 09:34:23,来自江西,817664725097279,尧饶陈
7122354753354957608,必胜客事件颠覆了“大企业更安全”的观念，食品安全需要食品企业自身“洁身自律”，监管部门也必须常态化管理，只有把食品安全提高到与企业“生命”同等重要的高度，才能让人民群众彻底放心……,0,0,0,2022-07-20 15:35:05,来自河南,111604002230,深蓝的世界观
7122433801904980748,必胜客还赠送过一块蛋糕给我，我当时觉得服务好好哦。现在看来，大概率是已经过期的。[流泪],0,0,0,2022-07-20 20:42:17,来自重庆,4104161934,babyu33414133
7122434094155547424,这样的知名餐饮企业怎么同小作房的质量标准等同，唉…食品安全应放首位,0,1,0,2022-07-20 20:43:15,来自湖北,106134018976,永不放弃用户
7122308242511889192,有一次在快餐店吃饭，餐厅没粥又没水喝，上厨房要碗水，那厨子老板猛然大声妖呵:谁叫你进来的，给我出去！,0,0,0,2022-07-20 12:33:52,来自山东,60753060152,摇旗呐喊啊
7122301610424320809,这些都是国人自己做出来的，请问，店里经理是不是国人？店长是不是国人？,1,0,0,2022-07-20 12:08:49,来自福建,2445778546070139,街尾遇汝
7122286247745372968,脚疼医脚 上述门店关门而已,0,9,0,2022-07-20 11:09:07,来自北京,87602891068382,凝夏ING145
7122478395253965582,舌尖上的安全，必须严查到底,0,0,0,2022-07-20 23:35:54,来自北京,1415769322161139,用平安健康
7122482485107458855,必胜客的米饭和意粉过期说明它本身生意也不好[呲牙]～长期没有人帮衬～何况现在餐饮竞争压力那么大～质量不行就不帮衬它～或者很偶尔才帮衬它一次～让必胜客持续亏损又必须纳税和交租养人[呲牙],0,0,0,2022-07-20 23:52:27,来自广东,3578211381,Jackie85
7122431862828090153,这样的事件在连锁店屡见不鲜，如有卧底都跑不掉！,0,0,0,2022-07-20 20:34:08,来自海南,55476055654,迟凤玲
7122478414623179559,食品安全是很严谨的。必胜客为何这么乱。,0,1,0,2022-07-20 23:36:05,来自福建,2185450121074180,多看多阅读
7122304905016460071,食品安全已经是老问题了，这次还是那么大连锁店[捂脸][捂脸][捂脸][捂脸],0,0,0,2022-07-20 12:21:08,来自湖南,1063929136813550,李锋6b4Z
7122359859597263631,路边炸油条的油换过吗,1,2,0,2022-07-20 15:55:02,来自山东,55357437925,地排车3
7122336257107411719,这么一说油炸食品哪是食品呀，那应该分明是隐形的毒药呀！可是小孩还特别喜欢吃 ，能怎么办。,0,0,0,2022-07-20 14:23:25,来自马来西亚,3496077378485342,东北人KL
7122305528977933063,闭店调查是否可以理解为扔掉所有不合格的食品？,0,3,0,2022-07-20 12:23:33,来自四川,55965584822,梦是最闪亮的星光
7122295674150175525,这都不用曝光就是意料之中的事情，想吃就别怕中毒[捂脸],0,0,0,2022-07-20 11:46:14,来自内蒙古,4222599192653726,点妈妈
7122455088668902179,以后不敢去必胜客吃了，怕吃坏肚子。,0,0,0,2022-07-20 22:04:15,来自湖北,110675934361,冬天的雪糕6677
7122349425523295013,有丰富社会经验的人，是不会去吃；需要打广告，而且是连锁店，食材不能见，用油炸加各种香料做成的食品，现代病的大批量出现，应该是自己不明智的代价！[流泪][流泪],0,1,0,2022-07-20 15:14:29,来自浙江,103735465918,朱国标330
7122278981860786955,是不是很多店都会这样，还是不要吃！看着光鲜亮丽。,4,24,1,2022-07-20 10:42:03,来自浙江,3963065962608052,偶尔减肥的胖子
7122292561666360072,哎，做食品的良心很重要的。（监管不可能时时刻刻盯着）,0,1,0,2022-07-20 11:34:13,来自广东,110879484996,淡定山鹤
7122311286431712036,外国连锁加盟店不靠谱，,0,0,0,2022-07-20 12:45:53,来自广东,79979476834,飞飞飞和飞飞
7122316627873989384,谁家的油就算我放到过期了都不带换的？ 不都用完了才管的么？,0,3,0,2022-07-20 13:06:40,来自天津,51750362703,树上的青柠之夏
7122281463613604608,我认为吃的东西一定要重视起来，现在的食品安全让人担心,0,6,0,2022-07-20 10:50:37,来自湖北,3377311174888734,l圈圈
7122451521706705705,对于这样大型联锁餐饮店，食品卫生监督主管单位，消协以及消费者代表，要不定期开展抽检，真正杜绝此类现像。,0,0,0,2022-07-20 21:50:14,来自广东,6055377968,白石布衣
7122404581329896207,谁来检查肯德基，俺经常吃肯德基哦！,0,0,0,2022-07-20 18:48:26,来自湖南,1943537796786397,明天你好—666999
7122281624330519304,屡查屡犯，应依法重处。其中必胜客北京和谐广场店，曾因食材超保质期，于今年3月被丰台区市场监督管理局处以没收违法所得、罚款5万元的处罚。,0,6,0,2022-07-20 10:51:31,来自甘肃,6558720607,小路不平
7122337497191351077,类似的商家有很多，只是我们没看见而已，食品安全是关乎大众健康的大事。呼吁食品监管部门整改排查！,0,0,0,2022-07-20 14:28:27,来自山东,1434221804007069,进步凯希0e4
7122321203838124835,食品安全不容忽视，加大全国食品问题排查,0,0,0,2022-07-20 13:24:44,来自四川,3707175753497396,汤圆配泡菜
7122323461536072455,我们国人的饮食习惯必须改变啊，高油高盐的食物真的不能吃。我们小学就应该开设简单易懂的营养学，这一点要学习日本,0,0,0,2022-07-20 13:33:44,来自辽宁,1538939917436541,完美叶子Hi
7122321068455035661,外面的饭闭着眼吃，不要看做饭流程，不要想用的什么材料，干不干净，卫不卫生，细思极恐，顿时不想吃了！还是回家吃粗茶淡饭吧！,0,0,0,2022-07-20 13:24:48,来自浙江,105002069993,北人南客写人生
7122355199460934436,估计小摊上的十天都不会换吧？反正不买它来吃就是了。,0,0,0,2022-07-20 15:37:04,来自四川,3983829515,爱晒太阳的人儿
7122454740646052638,怪不得现在一吃必胜客就拉肚子,0,0,0,2022-07-20 22:03:09,来自辽宁,6002062423,随性自由的梦想FJ
7122308557873513231,必胜客官方回复:经闭店调查，未发现报道中提到的违规行为，必胜客一如既往的为大家提供安全卫生健康的食品，对谣言抹黑必胜客的行为保留追究法律责任的权利！,0,2,0,2022-07-20 12:35:09,来自湖北,1442192739539310,天亮以后
7122477144781243177,挂不得孩子上吐下泻 我没事 可能是抵抗力强 所以没想这么大品牌会这样 太可恶了 再也不去了,0,0,0,2022-07-20 23:30:21,来自安徽,50276489194,只求真相
7122342160468607758,外面的东西真不能吃了[流泪],0,0,0,2022-07-20 14:46:25,来自江苏,102434180136,落叶随风
7122312464074965771,对于涉及食品安全问题的企业，严重影响到我们消费者的身体健康，我们一定要零容忍！,0,0,0,2022-07-20 12:50:30,来自福建,85002334872,没文化爱卖弄
7122442605832766245,外面的油炸食品应该很多都有这个问题 这就是为什么少在外面吃油炸食品,0,0,0,2022-07-20 21:16:02,来自河南,4178764650,小毛孩39
7122262379794383627,必须重视食品安全,0,16,0,2022-07-20 09:37:27,来自辽宁,3975486591995645,用户徐徐动人
7122303205354210084,还真别说，人家过期食品、超标物质都这样了客流量那么多，也没有人说这个不好那个贵。小餐饮店现进现卖有人说贵,0,0,0,2022-07-20 12:15:12,来自天津,111344382648,曾经的过去90后
7122480011022074631,能自己烧就尽量自己烧，尽量不吃深度加工的食物哈,0,1,0,2022-07-20 23:42:44,来自浙江,93891620006,456893495106
7122341005076169483,都别去吃不就完了吗,0,0,0,2022-07-20 14:42:23,来自河北,75131944981,我爱小咪s
7122450690093368075,难怪我每次吃完必胜客的披萨胃都比较难受,0,0,0,2022-07-20 21:47:29,来自湖南,92773796427,耕田心安乐
7122266673776362276,你们去查查乡村基吧,0,8,0,2022-07-20 09:53:45,来自四川,5556380177,刘思骋
7122341370857734949,天下乌鸦一般黑，最安全的食品，还是自己家生产的靠谱。,0,0,0,2022-07-20 14:43:36,来自四川,712132312697095,迷糊麻麻爱育儿
7122284136202633997,一个比萨卖近100块，各种成本加起来多少啊，还这样泯灭良心,0,1,0,2022-07-20 11:01:16,来自四川,97786447806,愉悦的海洋818
7122275186036622117,可能好多店鋪存在問題，只是看不到。,0,3,0,2022-07-20 10:26:59,,2524115400921949,龍的傳人棒棒
7122264776880784132,我想知道到底有没有人来管,0,11,0,2022-07-20 09:46:47,来自山东,4010610479074871,运筹帷幄百香果wh
7122376470198387487,“对涉事两家餐厅闭店调查”那么别的餐厅有没有说明要自查、要查漏补缺呢？明显的管理问题基本可以认为是默许。所以请大家不要盲目迷信洋品牌。,0,0,0,2022-07-20 16:59:41,来自上海,67637721566,吉米路亚
7122285588900135680,油炸的食品是很好吃，但是为了身体健康还是要少吃！尤其是小孩子！,0,2,0,2022-07-20 11:06:38,来自辽宁,3522485736707100,亲切露珠Q1
7122296393707946790,肯定不止这一家店是这样的，只是别家没发现而已,0,4,0,2022-07-20 11:49:02,来自河北,111110697435,186的我
7122314982242812702,只要不变质，质量符合要求即可。油有多久保质期？,0,0,0,2022-07-20 13:00:15,来自湖南,52130757845,suyu168
7122350626931655432,民以食为天，食品安全没有妥协的空间！必须严打严控！不仅要行政处罚，更要查查是否涉嫌犯罪！食品安全必须出重拳！,0,0,0,2022-07-20 15:19:20,来自浙江,82172682530,樊律师专注民商案件
7122297075282477838,我还看见中餐馆打潲水油来加工再炒菜，看得我恶心了好几天，再也不去吃小餐厅了，回家泡方便面吃也不去外面吃了,2,1,0,2022-07-20 11:51:30,来自四川,10201780114,呀哟58
7122304247802315554,食品安全问题不容忽视，一定要严管。,0,1,0,2022-07-20 12:18:22,来自辽宁,108233210896,雷先森
7122429887868355362,中餐馆后厨更糟糕,0,0,0,2022-07-20 20:26:21,来自湖北,3141449638,luciferwll
7122292012132713223,[捂脸]常在这个和谐广场店点外卖[抠鼻],0,2,0,2022-07-20 11:31:58,来自北京,52356645264,墨墨姨姥姥
7122261082462896935,新京报的记者同志，请去暗访一下中餐的后厨，尤其是那些夫妻店。,0,8,0,2022-07-20 09:32:28,来自山东,4481357278,荆山传媒
7122302240337462020,食品安全不容忽视，严查整顿。,0,0,0,2022-07-20 12:12:00,来自湖南,2383341074515123,星火燎原ZO
7122270710533243683,外面的熟食还是不可靠。,2,12,1,2022-07-20 10:08:47,来自山西,106039503870,诗意枫叶x0
7122335316518224672,食品安全问题很严重呀，哪里有安心的食物,0,0,0,2022-07-20 14:20:40,来自广东,1209093164380669,g150126
7122299303875511040,哈哈！我在里面做过几年，以前还是真的每天换油，保质期好多东西都是几天的，过期的要不就扔了，还有就是员工拿回家了。现在估计是承包给私人老板了，所以为了利润，只要不吃出啥问题，管他呢！,0,0,0,2022-07-20 11:59:47,来自四川,874842653984376,剑门蜀道影视
7122350119231554312,食品安全问题绝对要引起有关部门的重视！这是关系到老百姓身体健康的大事呀,0,1,0,2022-07-20 15:17:05,来自内蒙古,53209973152,博学菠萝8V
7122348849075028774,从来没有吃过：必胜客、肯德基、外卖，也没有点过外卖，因为我送过外卖，所以你懂的,2,13,0,2022-07-20 15:13:06,来自四川,2963923741707575,家是软肋也是铠甲
7122345826676540168,从没去吃过。,0,0,0,2022-07-20 15:00:39,来自广东,71730304383,知否知否中国历史
7122346203014120228,中国食品市场太大了。人们的需求更是数不胜数。要求商家到个体商户更应该注重安全卫生，把需求者的身心健康放在第一位，其次才是利益，否则害人害己，得不偿失。,0,1,0,2022-07-20 15:02:01,来自甘肃,3423151774,啦啦啦啦存在手机用户
7122447109672583967,这么大的店还差这点钱，吃坏了就不是钱的事。,0,0,0,2022-07-20 21:33:43,来自黑龙江,96837947255,茗子
7122300259782460195,不知道他们是承包制，还是成本会影响提成，反正就是管事的想降低成本。应该重罚他，得不偿失就不能了。,0,4,0,2022-07-20 12:03:29,来自北京,109162245929,财神爷回来了
7122444090670760739,下次去卧卧麦当劳和肯德基试试！,0,0,0,2022-07-20 21:21:25,来自江苏,61874525180,温柔芒果gQ
7122310602764731169,没吃过[捂脸],0,0,0,2022-07-20 12:43:18,来自河北,2726378384398638,聪颖阳光gS
7122282826258596612,能自己动手尽量动手，少吃外面的垃圾食品。金玉其外败絮其中的食品多了去。,0,4,0,2022-07-20 10:56:25,来自江西,65952528663,诗艾章菊梅
7122314493023257385,这么大的企业都这样，外卖店就更不要说了，食品安全，任重道远,0,0,0,2022-07-20 12:58:39,来自福建,4448572484,ldy3210
7122287743346344739,食品安全问题不容忽视，一定要严管。,0,0,0,2022-07-20 11:15:04,来自湖北,7007363598,爽朗的小幸福
7122441942579512098,在日本，餐厅里油槽里的油5天换一次。,0,0,0,2022-07-20 21:13:13,来自上海,76941072336,鲤鱼精霸奔波
7122424375793664775,要卧底都卧，别只卧一家。曝光一家有问题，不代表其他别的食品店铺没问题。,0,0,0,2022-07-20 20:05:24,来自江苏,106894964861,山的海的东的牛
7122305937582785320,以后坚决不去必胜客，炸鸡也不能吃[晕],0,1,0,2022-07-20 12:24:59,来自河南,65601403225,爱吾及屋
7122340235391943424,外面油炸食品，那油想想都知道是反复用的,0,0,0,2022-07-20 14:38:42,来自广东,110764323199,耄耋不厌
7122415906621342499,食品安全大于天！应该严查,0,1,0,2022-07-20 19:32:13,来自重庆,4363323400261047,一粒小橙埃
7122266724858430212,天啊，太黑了！应该从严查处！,0,27,2,2022-07-20 09:54:17,来自上海,61515259338,雷珍鸿
7122289867861689103,食品安全，是该重视！,0,2,0,2022-07-20 11:23:06,来自广东,100356089594,雨缘美好
7122314239914148644,做食品的更绝，除了面粉，其他全是过期的。这些只是冰山一角，有些事你没见过绝对想不到。,0,0,0,2022-07-20 12:57:24,来自广东,972436057893069,无形AAB
7122360144273097513,餐饮都这样，又不是每天当饭吃，又要便宜又要好吃，又要服务号，自己去做做生意呗！看能做的下去不,1,1,0,2022-07-20 15:56:11,来自广西,107182542567,伍程
7122337901346292488,认真查起来，外面的食品应该没有几样质量能过关的。,0,1,0,2022-07-20 14:30:13,来自四川,3790711387861277,可靠面条Fz
7122450226979275535,肯德基、麦当劳管理方式还是很科学的，就是执行不到位。烹炸油锅按规定是不能用洗涤剂清洗的，只能用开水冲洗，但是实际操作中都在用洗涤剂而且清水冲洗不彻底,0,0,0,2022-07-20 21:45:10,来自浙江,99084748329,梅伶韵
7122469908776764175,你们说火锅店的大白菜洗吗？,0,1,0,2022-07-20 23:02:06,来自安徽,82947719352,小小的锦鲤儿
7122282998833234720,危害人民的食品必须严惩重判[碰拳][碰拳][碰拳],0,2,0,2022-07-20 10:57:09,来自四川,2717633613140734,热情星空V7
7122430093548340005,我不喜欢吃快餐店的东西。,0,1,0,2022-07-20 20:27:26,来自四川,110915432229,微雨燕飞65
7122307313683579656,还是要多管住自己的嘴，平时自己偶尔也会吃油炸食品，现在也不敢去了，不能拿自己的健康开玩笑。,0,0,0,2022-07-20 12:30:29,来自江西,4490868468482248,二嘻与二哈快乐频道
7122443149338886916,必胜客的菜价贵，一小碗菜汤三十七元,0,0,0,2022-07-20 21:18:13,来自黑龙江,59275002376,谷凤珠
7122471581464429346,餐厅一包花椒能罚50万，这种暴利的快餐行业食品都过期了才罚5万？？？,0,0,0,2022-07-20 23:08:20,来自内蒙古,5850865388,风姿卓越青山Lv
7122438745504531240,道德丧失是根本，什么导致了道德丧失呢这是个值得思考的问题，存在都是有原因的，太复杂了，太难解决了，我觉得西餐还好吧，中餐问题更多,0,1,0,2022-07-20 21:00:41,来自吉林,13011778049,遒147866189
7122303020859441920,哪一任能真正解决食品安全？,0,0,0,2022-07-20 12:14:11,来自北京,211558010457919,甲醛检测治理010
7122274228296139523,必胜客的价位也不低，我们还吃了那么多次，尤其是带小孩子吃很多次[流泪]必须严惩,0,11,1,2022-07-20 10:23:07,来自广东,109958115542,coco盖
7122304389850858248,必胜客都这样其他可想而知,0,0,0,2022-07-20 12:19:05,来自广东,96865922133,淡泊的乡情
7122328656240231199,不用臥底，在無良心沒誠意的環境之中，都差不多，互坑互害以成常態。,1,10,0,2022-07-20 13:54:01,来自内蒙古,50564113053,玮国2
7122304734555734799,眼不见为净，背后是什么操作谁知道，经营者以利益为重，这就是害人利己。,0,0,0,2022-07-20 12:20:18,来自上海,2454549526225180,大荒无限
7122428672682509086,一年搞几天自助就是为了清理快过期的库存吧[泪奔],0,0,0,2022-07-20 20:22:11,来自江苏,50902363140,mm130235535
7122244298095674125,大品牌应该有自己的责任心，老百姓相信你的标准才来光顾的。过保质期一天可能的确还没变质，但是如果连明确标注的保质期都无视，那么看不见摸不着的其他服务标准是不是也会被无视？我们凭什么还能相信你？,0,11,0,2022-07-20 08:27:09,来自上海,3909909971,爱思寂寞狗
7122339963517616896,外面吃是有风险的，疫情一来管控一下食材就过期了,0,0,0,2022-07-20 14:37:48,来自浙江,158808942316375,热情冰淇淋品茶
7122464400481141516,有钱人吃的东西,0,1,0,2022-07-20 22:41:24,来自天津,110317326678,为正义而言
7122445489177396002,有次吃了必胜客的提拉米苏后就拉肚子了,0,0,0,2022-07-20 21:26:50,来自浙江,3931485669426535,面壁莫言
7122447159743562536,作为一个厨师我不相信一锅可以用10天，我是做日餐。生意好，一天可以换几次，黑有可能是淀粉造成的。这种知名餐厅不可能犯这种低级错误，据我所知连锁店的死规矩很多，也挺严的。,0,0,0,2022-07-20 21:33:14,来自浙江,72898505047,kang5613
7122455550315053837,国外必胜客这样能存活吗？也就只有中国人做食品能这么黑心吧,0,1,0,2022-07-20 22:06:37,来自广东,92527247623,观今论古
7122432362486940416,必胜客都这样，天朝餐饮可想而知，料理包 预制菜 的质量可想而知,0,0,0,2022-07-20 20:36:00,来自黑龙江,108902693587,阿木木871
7122424613372003106,14年前的双种子餐厅都已经做到炸串的油一两天一换，地板砖的缝隔一段时间就刷油，用的是炸串的油，不够就直接用没使用过的调和油，是不是很浪费。后来更干脆直接取消炸品类餐饮。,0,0,0,2022-07-20 20:06:03,来自广东,616158632358567,小四跟你看世界
7122462355577553694,从不吃洋快餐！,0,0,0,2022-07-20 22:33:04,来自陕西,99723046518,yiluyuejing
7122377650576409378,现在社会，道德是口头禅，利息是驱动力。我很理解商家快速积累财富的心情，欧力给，反正我吃不起外面的美食[呲牙],0,0,0,2022-07-20 17:03:53,来自江苏,50659922628,饿死也不做内卷狗
7122457632736035621,从不吃必胜客。[不看][不看][不看],0,0,0,2022-07-20 22:14:29,来自湖南,110032417398,清心如水吖
7122428748338791180,啊！刚刚吃了必胜客,0,0,0,2022-07-20 20:22:33,来自江苏,1732479019917952,闪闪假装不高兴
7122364045852132109,太黑了，看了你还到外面吃饭吗？还是自己在家做好，里面可能还有别的黑幕是我们不知道的。#热点# #必胜客# #爆料# @头条热榜,0,0,0,2022-07-20 16:11:26,来自河南,4124974024237376,怀旧自媒体
7122318526799053607,食品安全必须严肃处理，同时尽量少吃油炸东西,0,15,0,2022-07-20 13:15:29,来自湖南,1213505183691550,闲人老五
7122310834097357583,食品一定要有良心的人做,0,0,0,2022-07-20 12:44:02,来自湖北,3668410395526688,灵敏奶酪So
7122269121211499302,食品入口，安全不可忽视。,0,4,0,2022-07-20 10:03:48,来自辽宁,3026296336816126,浩瀚星空看月亮
7122284389391696671,说句实话，其实大部分门店都是这样，利益驱使之下………,0,8,0,2022-07-20 11:02:08,来自福建,110907980829,JCKS铁云
7122453608298791684,从不去必胜客吃东西,0,0,0,2022-07-20 21:58:50,来自江苏,2928718311598936,牛牛幸福97
7122440649835905833,看你们以后还敢去这些地方吃东西，要知道现在外面的食物不仅仅是添加剂种类超多超量而且各种想不到的事情商家为了钱都敢去做，问题是看门人守夜人在装睡。,0,0,0,2022-07-20 21:08:06,来自上海,58494938050,好人一生平安是福气
7122302731393729291,谁还敢再去！,0,0,0,2022-07-20 12:13:43,来自四川,50758272660,广袤天空1
7122418241234502404,最安全的餐厅其实还是自己家的厨房。在外面偶尔吃吃还是可以的,0,1,0,2022-07-20 19:42:07,来自广东,78046355278,Lin22246
7122390262751593255,只盯着这种大品牌罚，小门店连效期管理都没有,0,0,0,2022-07-20 17:53:26,来自广东,536154201916875,默默121222
7122452451999515429,我已经有7-8年没去必胜客吃了，06年时必胜客还是不错的，后面越来越难吃，上餐速度还特别慢，特别是自己会烘焙以后，想吃菩萨自己做，现烤现吃，什么口味自己定，还都是薄底的。,0,0,0,2022-07-20 21:54:32,来自河南,2656054503541744,吃瓜群众臭鱼鱼
7122309265372644135,食品安全入刑，不能交单罚款了事,0,0,0,2022-07-20 12:37:59,来自北京,107840684005,伴随足球逝去的青春
7122457102530659079,幸好我穷，一天只吃一根拍黄瓜,0,0,0,2022-07-20 22:12:39,来自广东,92734247881,把你打成大白菜
7122279714081293089,外面的熟食怎么可能干净卫生，花钱多不说，吃出毛病来没人管，还不如自己动手做的干净,0,4,0,2022-07-20 10:44:39,来自四川,2159074946594136,二胖1314
7122437458151179049,昨天才吃完必胜客，今天就刷到了这贴子[what]看来还是在家里自做最安全，大品牌也不能相信了[捂脸][捂脸],0,0,0,2022-07-20 20:55:47,来自河南,241538433297879,像皮梳
7122441235939754787,必胜客又贵又难吃，服务还差！幸亏几年前就不让孩子吃了！,0,0,0,2022-07-20 21:10:29,来自山东,3615267401,奕想天开V
7122421753355272991,其它餐厅呢 行业规则,0,0,0,2022-07-20 19:55:08,来自北京,111222400961,134巨蟹座
7122308699976336169,外面的少吃,0,0,0,2022-07-20 12:35:41,来自安徽,93367255657,橙子草莓兔
7122435327650399013,过期食品撕掉过期标签继续使用或许就是餐饮行业的潜规则,0,0,0,2022-07-20 20:47:50,来自北京,3091444320961180,学哥9413541
7122284670326752008,对这些黑心店，要严加惩罚,0,6,0,2022-07-20 11:03:39,来自四川,2911143037507037,高贵面条gf
7122414452019921696,有哪家餐厅的食材及配料油料不过期的，大家都在吃,0,1,0,2022-07-20 19:27:09,来自广西,63930175551,康景农苑
