7122407872621413159,"烹炸油十天才换一次，酸价超标近一倍。撕掉包装掩盖保质期，过期食材“化整为零”。专家：整改不到位还是因违法成本低。
民以食为天，食品安全关系你我。希望对食品行业严查整冶，让老百姓买得放心，吃得放心。",0,5,0,2022-07-20 19:02:07,来自北京,3654373690584989,豁达海风iS
7122254106286342945,早发现了，最爱吃的必胜客越来越完蛋了，难吃的要命，过去的口感没了，尤其是还爱买一送一砸自己牌子，送的那个就跟不会做饭的人烙的饼一样，干巴巴的，你不如不送，以前那个至尊多好吃，现在味道完全变了,7,68,3,2022-07-20 09:05:13,来自北京,99344379584,墨香晓屋
7122368901735809830,看看国内每天早点炸油条的油,2,7,1,2022-07-20 16:30:36,来自山西,110857976692,飘3199519
7122406344162067211,我不吃油炸食品！！！大家也要少吃。,0,0,0,2022-07-20 18:55:48,来自黑龙江,1930374833781595,阿琴梦梦
7122312779264049960,农村人不知道什么是必胜客，只知道萝卜腌菜。我们不喜欢吃也吃不起,0,0,0,2022-07-20 12:52:05,来自浙江,1842424574655341,爱生活的橙子NJ
7122333437729669928,现在还是少吃外卖，尤其是油炸食品。那个油不知道炸了几百几千回也不换一下。油少了就再添油，里面总会有省油，想想有多可怕！自己家偶尔炸的油下次用心里都觉得不安全，何况外面千锤百炼的油？食品安全什么时候能放到第一位？这才是重中之重！,0,5,0,2022-07-20 14:12:23,来自辽宁,73241477111,我爱车厘子a
7122330896941826829,必胜客都不让人省心，可是大牌子呀？那其它呢？,0,7,0,2022-07-20 14:02:06,来自山东,2604120930524391,内心的勇气
7122276088147428104,之前在必胜客干活，烤箱的链条一周刷一次，炸小吃的油平时不忙久一点换，周末都是两天一换[捂脸]做披萨的那个饼基本上都是两天就来一次货，所有的食材有时候还会去其他门店去借，干活的地方是必胜客宅急送，只有外卖的，不知道他们餐厅是什么样的,0,9,0,2022-07-20 10:30:25,来自北京,2427349817636279,终极梦想
7122351609962922786,还以为这些大品牌的会注重质量管理的，原来并不是如此,6,47,1,2022-07-20 15:22:53,来自江苏,4574124669,柠檬草的味道44311691
7122280087554720551,食品安全民生福祉，不能不管。,3,16,1,2022-07-20 10:46:15,来自陕西,2516105565834292,自在赞雪
7122277212539060992,我13年上大学在必胜客做过兼职，可能每家店管理不一样。我干的这家，油大概2天一换，起酥油，每次都是我去冰库搬的，店长每天打烊前和上班前都会用一个对讲机一样的仪器测一下油的品质，如果不好就立马换。,4,16,1,2022-07-20 10:33:56,来自安徽,85541618605,诺诺维323
7122284528495772423,别说必胜客，老早以前肯德基鸡肉炸出来是金黄色的，因为那时候肯德基每家店生意都很好，现在的肯德基鸡肉颜色还能看吗，我做过炸鸡生意，所以我太知道了，看到鸡肉颜色我就知道油是什么情况,8,21,0,2022-07-20 11:02:48,来自江苏,97108564859,黒瘋俠
7122312673705853737,有几个换的，都差不多,0,0,0,2022-07-20 12:51:23,来自山东,3399045199,紫色划过的忧伤
7122416338224038694,虽然我没吃过必胜客。但是不得不说，像这种又不卫生的小吃，真的味道又好吃。我家里清洗很多遍的锅碗，却做不出那种好吃的味。[捂脸],0,0,0,2022-07-20 19:34:45,来自山东,61927518725,61927518725
7122257610250289952,曾经七八年前在必胜客干了大半年，卫生状况看个人，毕竟我每个厨台都做过，我主要做水吧，有些杯子容器的确洗得不太干净，因为洗碗机洗的，但是我看到不干净的都会重新冲洗干净再用，因为我有强迫症，但是我那个同事是大大咧咧的人，他可不管这些拿起来就用，至于食材还是挺新鲜的，因为我们下班前都搞了不少吃，炸炉得油也不见很黑，自己也炸点吃，肚子饿了也偷偷吃点，至于那些蛋糕类的我感觉不太新鲜，有时解冻了值班经理又拿回去冷藏室去,1,10,0,2022-07-20 09:19:10,来自广东,59480127299,手头有点紧
7122307273812411147,肯德基、必胜客等都一样，哪有天天换油的。举出一个例子来。,0,0,0,2022-07-20 12:30:21,来自上海,2700001484478931,顽强橙子Ve
7122345172788216613,不管是什么洋快餐品牌店，到了中国境内经营，都是要按照中国法律法规来合法经营。不能因为披着洋外衣就无底线乱来。不过我知道的是，就算是洋快餐，也是某些中国人搞这些套路搞成习惯了，只要能让他们多赚钱降成本，管你是卖给谁吃的，他们只要他的利润最大化。太可恶了,0,5,0,2022-07-20 14:57:57,来自湖南,109985185621,谁也不能阻挡中国前进
7122339579163853603,太过分了，我经常吃必胜 客平时也不太爱 动，下面现在长了混 合 痔[流泪]，咋整啊，好难 受啊,11,19,1,2022-07-20 14:36:14,来自云南,3400159730870510,牛逼克斯拉999
7122243948978422562,花不便宜的钱，吃“糟糕”的饭,6,87,2,2022-07-20 08:25:12,来自山东,107885193051,陀螺8418
7122426538494362379,勤工俭学的时候在康师傅牛肉面馆做过兼职，真的是我见过最干净的餐厅，煮错的面超过时间就全部废弃，当天剩下的牛肉菜品全部废弃，油菜要一片一片的洗但是不能掰开，地面一天拖4-6遍，最可怕的就是刷踢脚线，真的是蹲着用清洁剂把踢脚线刷一遍[泪奔][泪奔][泪奔]，接触过异物后要用消毒液洗手，消毒液2个小时换一次，我收拾自己家都做不到这样,0,21,1,2022-07-20 20:14:15,来自山东,6762535656,下雨的毛毛虫
7122312331853906718,我还以为我有心里疾病，自己做的不管好不好吃，都会吃的滋滋有味，外面再好吃心里也有点疑乎。所以基本不在外面吃饭。,0,0,0,2022-07-20 12:49:58,来自四川,61836787563,仙人掌278172736
7122294977371505420,名牌餐饮，不一定比小餐馆向饭菜质量好。小餐馆在意回头客，大饭店不在意。,2,25,1,2022-07-20 11:43:49,来自吉林,108878313429,用户万洁
7122267950719468303,名字就叫必胜客，谁能打败?客人来了只能是必输。,0,15,0,2022-07-20 09:58:20,来自辽宁,104145733875,兰亭1313
7122256008554611464,头条咋知道我昨天去了必胜客,13,68,2,2022-07-20 09:12:24,来自湖北,5848072050,最爱人间三月天
7122253859631940387,都一样，报废额度有定额，我以前在罗森做兼职，一大锅熬点（就是关东煮）里面掉进去只苍蝇，叫我把苍蝇捞出来接着卖[大笑]还有包子，卖不掉能搁到发臭，店里有老鼠，仓库饮料架子上好多老鼠屎，管它呢，罐装饮料拿出来直接往冰箱补货[奸笑],3,10,0,2022-07-20 09:03:33,来自上海,5994278104,曾经瘦过帅过没爱过
7122310130368004899,监管不到位、餐饮应该都一个样,0,0,0,2022-07-20 12:41:09,来自河南,60035458293,卡迪贝恩
7122451275392254751,油炸食品还是少吃吧。,0,1,0,2022-07-20 21:49:46,来自山东,50625243945,爱是一缕寂寞的愁4892
7122350353735451423,肯德基、麦当劳、华莱士几天换一次？继续暗访啊，有对比才能真实反应现状。,3,27,0,2022-07-20 15:18:16,来自江西,101760451471,风之心236
7122303554622391073,处罚太轻了，应依法追究刑事责任！,0,11,0,2022-07-20 12:16:18,来自山东,325064815290528,心若向阳无惧风霜
7122418033247273732,想起来有点恶心！之前去必胜客点了惠灵顿牛排，包着牛排的脆饼皮吃起来有那种过期油的味道，当时完全没意识到必胜客竟然会干这种事情，我还硬吃下去了，唉。,0,0,0,2022-07-20 19:41:24,来自广东,1138717572209479,无为躺平
7122402213695456035,必胜客的服务态度非常差，有一次去必胜客吃饭，吃了两百多，叫服务员结账，叫了七八次，每次服务员都说稍等一下，结果我们前前后后加起来等了一个小时，最后我们受不了了，直接走人。我在想，必胜客应该是看破红尘了，否则不会对收款也不积极,0,1,0,2022-07-20 18:39:15,来自四川,2497684127096221,李要笑死我了
7122244025960219429,这只是记者卧底看到的冰山一角，这一类快餐店都差不多，,0,63,0,2022-07-20 08:25:44,来自河北,97838186966,小蝌蚪4159
7122330156760728352,谢谢分享！还是少吃油炸食品，有点吓人。[赞][赞][赞][赞][赞][赞][赞][赞],0,4,0,2022-07-20 14:00:24,来自云南,3240991714184483,陈华友167503
7122305236131889957,都想浑水摸鱼，坑害消费者。必须严惩！,0,0,0,2022-07-20 12:22:29,来自内蒙古,101439269793,xinxindema
7122362862957593359,早就不吃必胜客了忒难吃[吐],3,8,1,2022-07-20 16:06:31,来自山东,76047957651,卢旺达的鱼931
7122275428005741344,我在包括必胜客等好多家知名连锁餐饮企业后厨干过，相对来说百胜集团还是好的。起码他有一套健全的规章制度，公司统一配送的食材也全部是高档货。和那些全凭老板良心在做的中餐小饭店比，不可同日而语。,10,36,2,2022-07-20 10:27:48,来自上海,51563419243,缤纷清风vS
7122475221567210247,作为一名必胜客普通员工来说一句，没那么夸张，不是每个店都那样，我工作的店该费弃就费弃，炸台的油一个礼拜换两次，别的小作坊还不知道脏成啥样了。个人观点，不是为老板洗白[捂脸],0,0,0,2022-07-20 23:23:31,来自上海,108077349603,花钱的主是东方雨
7122311647318000388,严厉打击食品安全问题，,0,0,0,2022-07-20 12:47:16,来自福建,2643683807867885,豁达晚风2X
7122385522441536292,人一旦存在认知上不足会为此买单的日子不会太久！明明知道地沟油是谁在用也清楚吃这些东会造成什么结果但就是忍不住每每去滿足想吃的欲望，侥幸心理让你欲罢不能，其实患癌的机率在积累，某一天医生说已是晚期你还抱怨说自己咋那么倒霉，可笑又可怜！,0,0,0,2022-07-20 17:34:51,来自天津,105990495150,66双鱼
7122268023599858473,这已经很良心了，街边小摊卖油炸食品的哪个不是终年不换油[捂脸],1,6,2,2022-07-20 09:58:36,来自河南,5545381338,宝驹737
7122351101034890025,"大部分这种连锁店都是加盟，虽然是统一管理，但是餐厅营运背后的利润都和加盟老板利益挂钩。相信职业经理人不会违背管理的最低线食品卫生安全，但是背后老板需要节省成本拿利润会迫使他们不得不做一些违背餐饮管理的事情，实属无奈。
我觉得根治的根本做法还是要总部加强合作商的食品卫生意识，定期检查考核，严惩不规范操作，甚至严重的可以收回加盟权，才能杜绝此类事情发生。@必胜客官方 @中国食品安全网",0,0,0,2022-07-20 15:20:59,来自福建,10596139905,比利刘
7122434287432893218,我早就不敢去那吃东西了，在2018年左右，广东梅州的分店用过期N年的进囗牛肉做披萨，都长绿毛的，被工商局查到，不了了之。,0,0,0,2022-07-20 20:43:18,来自广东,70573506905,云222552913
7122351107170730752,犯错成本太低，偷换合格标签等与卖假货一样，应当严厉依法追究责任，罚个倾家荡产。,0,5,0,2022-07-20 15:20:57,来自湖北,3984233932009644,Simple202002
7122469366989570830,小区门口路边有炸油条的，一口敞开式大铁锅，油估计一个月都不会换一次，老板穿着背心就在旁边炸，排队买油条的人还是很多[捂脸],0,0,0,2022-07-20 23:00:14,来自河南,65114604804,碧灵巧儿
7122264468649722627,食品安全不容忽视。举一反三，全国大排查，确保食品安全。,0,30,0,2022-07-20 09:45:20,来自内蒙古,103893639330,一生平安5456848286818
7122309884233794344,早就知道外国品牌的套路了[狗头]我都是自己买回来做,0,0,0,2022-07-20 12:40:14,来自广西,50051561127,北音北音
7122450957623477026,十多年前必胜客就把客人喝剩的饮料回收，继续上给其他顾客。,0,0,0,2022-07-20 21:48:12,来自黑龙江,58597201913,小鱼跃跃
7122394874288653059,曝光大快人心，但这不能解决根本问题，靠自觉不如强监管。,1,30,0,2022-07-20 18:11:40,来自重庆,4098578732294880,穿越雾都
7122455484560655108,病从口入，最安全的餐厅，还是自己家的厨房。。。,0,1,0,2022-07-20 22:06:25,,56194083266,beyonf友爱
7122240990420927240,你们倒是查查美团外卖的商家啊,17,130,1,2022-07-20 08:14:14,来自河北,2651617776116508,看着贼过瘾
7122456907905794856,食品安全问题，要好好整治啊！,0,0,0,2022-07-20 22:11:09,来自湖北,98338350259,青子先生
7122401527335666436,食品安全成了奢望,0,48,0,2022-07-20 18:37:22,来自河北,11243452280,罗亚兴
7122294840343429928,天下餐饮行业大到政府食堂，小到地摊作坊，食用油只用一次就倒掉不现实。,1,14,0,2022-07-20 11:42:31,来自江苏,71912314538,多才多艺云朵pe
7122302937271223053,肯德基 麦当劳 也该突击一下,0,0,0,2022-07-20 12:14:14,来自北京,70414431031,伊克斯派克托派丘姆
7122261186246460160,以后不吃必胜客 改自己做,8,113,1,2022-07-20 09:32:01,来自北京,3527924151,mikelovec
7122242354039374630,"蘑菇在最后一天腌制，有问题么？
后面的太多没往下看了",2,11,0,2022-07-20 08:19:50,来自北京,109222872625,放野山林
7122257474924675854,餐饮是良心活，哪家店查一查都有这样那样的问题，问题的根源在于监管和处罚都不到位！,0,20,0,2022-07-20 09:17:56,来自山东,1268182736,主持人雷哥
7122446211139306271,开过咖啡厅做西餐简餐，用上等食材，当天用不完的全部丢弃，自己平时就吃店里的出品，其实卖的是情怀，然后撑不到一年倒闭了[捂脸],0,0,0,2022-07-20 21:30:09,来自广东,3404528162187725,一祎Fiona
7122373244409283342,哪个餐厅不如此？不说全球，就中国而言，又有几家餐厅真正做到良心商家，一旦发现，罚到它破产，你看还有人敢吗？,0,0,0,2022-07-20 16:47:00,来自陕西,4428423938715463,念奴娇红
7122257812079903500,看完胃直往上翻！[吐血]看来不光必胜客，还有很多我们未知的餐厅，冷饮店都如此，只不过是发现和没发现的问题。食品卫生任重道远！,0,12,0,2022-07-20 09:19:48,来自河北,78415695598,最美香香公主598
7122452265947923240,食品安全始终是全民最关心的事情！现在的上班族大多都是订外卖的多！所以要加强这方面的监管！,0,1,0,2022-07-20 21:53:06,来自山东,4164556570763374,用户6183994099050梅
7122404135001211648,不吃必胜客了，贵，还生意不好。那肯德基，有多人长期卧底检查吗？,0,0,0,2022-07-20 18:46:36,来自湖南,1943537796786397,明天你好—666999
7122476785303864072,民以食为天，所以餐厅的食材、食物必须以保证身体健康为原则，遵纪守法，才能让企业长远发展！,0,0,0,2022-07-20 23:29:15,来自广东,18357843607,取消不开心
7122469532501017356,必胜客卫生极差，最明显的是杯子上沉积许久的泥垢,0,0,0,2022-07-20 23:01:22,来自河北,96356115731,梅粉冀
7122321032295973666,我从来不吃什么必胜客麦当劳肯德基啊！可能我没钱，只能在家做饭吃[呲牙][呲牙][我想静静][我想静静],0,1,0,2022-07-20 13:24:22,来自江苏,106633083677,高贵暖阳LF
7122349531182416674,肯德基也是，这些只能靠自己管住嘴。,1,14,1,2022-07-20 15:15:05,来自湖南,1042765757562440,足智多谋山丘7R
7122416085244560163,我最烦的就是必胜客，说句实话我被必胜客赶过两次，都是是在没地方去了我就那里坐两分钟，立马服务员都赶我走，我承认我是穷逼，但是他们这个做法实在是有点高高在上的感觉，这一点中国大部分店还是很人性化的，麦当劳更不用说，所以我们这个城市必胜客都在被压缩，品牌越来越弱，他的不行是实实在在的,0,1,0,2022-07-20 19:33:04,来自河南,92981430459,爱上进666
7122243393828913960,不是必胜客这么做，肯德基也一样有这样的做法，可能比必胜客更厉害！,1,9,0,2022-07-20 08:23:09,来自浙江,104653240100,用户5817376331822吕
7122397692479423235,食品卫生问题任重道远！,0,66,0,2022-07-20 18:22:34,来自河北,78415695598,最美香香公主598
7122463210393568007,这十天换一次油，很有危害啊？那我们家那边炸油条，炸点心的油，一年到头也不换，也没工商局来查！,0,1,0,2022-07-20 22:36:43,来自江苏,1314628273441566,哭鼻子的毛毛虫
7122404211152929569,反正我不吃！但这样黑心的商家必须严惩！,0,0,0,2022-07-20 18:47:42,来自重庆,50259019170,善良是一种品德
7122331797936997161,每家炸鸡店都是这样的，没人会换油炸，所以基本不吃炸鸡,0,0,0,2022-07-20 14:05:53,来自广东,1201129871128797,聪明铁力8E2
7122404004642013987,10天一次算良心了，给换就是良心商家，有多少商家不用完是不会换的,2,10,1,2022-07-20 18:45:57,来自安徽,461429556911067,似水年华19831120
7122243385188598564,前几天看报道，说是美国超市有的食品几个小时没卖掉就倒掉垃圾桶。再看中国？想方设法延长食品保质期继续出售。,5,26,2,2022-07-20 08:23:41,来自北京,52590621712,高级枫叶J9
7122392724514947853,支持曝光！,0,47,0,2022-07-20 18:02:44,,2818800909038829,夜雨诗书
7122255993350226729,以后谁还好吃，必胜客是大品牌，里面的东西不便宜。吃却不放心。谁还敢相信品牌呢？,0,10,0,2022-07-20 09:11:58,来自河南,1837985001908908,高贵芒果qU
7122267787443667724,我姐家的店都是两天一换油，感觉好良心了[泪奔],0,6,0,2022-07-20 09:58:37,来自浙江,3280587559287181,苟延残喘的毛毛
7122337962188686118,一直提倡少吃油炸食品。,0,1,0,2022-07-20 14:30:59,来自江苏,6914213306,杨柳青A
7122444291716301568,其实哪家店都一样的，没有餐厅经理不背成本的，扔不起。即使处罚力度再重还会有人铤而走险，所以平时还是减少在外用餐得次数吧[尬笑],0,0,0,2022-07-20 21:22:09,来自浙江,84570774540,天使宝贝不在家
7122383132213117699,只有在家里自己做饭吃最好，经济实惠，最重要的是卫生。永记！！！[害羞][害羞][害羞],0,0,0,2022-07-20 17:26:01,来自辽宁,93408313508,洒脱晚风5O
7122295253733851912,我基本上算是一个快餐，熟食店的无缘人了，也许有人会说我矫情，我就是只要一吃外面的饭菜就会拉肚子，在外面十多年了都是自己做的吃，不管怎么样卫生和食材来源相对而言比较放心点的,3,2,0,2022-07-20 11:44:20,来自广东,1824842196461879,梅姐聊成长
7122261674056991499,食品安全，是该重视。,0,124,1,2022-07-20 09:35:05,来自内蒙古,81768906136,兰兰26884
7122283073819034400,食品行业是良心行业。没有良心的人干不了。,1,4,0,2022-07-20 10:57:27,来自江苏,15867961349,翰墨蛋仔
7122442605874578215,外边的餐厅真的不敢吃，特别是油炸食品，不知道油用了多久，是不是转基因……又贵又不健康，但是有时真的很懒，还是尽量少吃，自己勤快点，既健康又省钱！[害羞][害羞],0,0,0,2022-07-20 21:16:12,来自上海,3875139653209752,无法更换名称
7122451600861954856,可以不吃必胜客了，我越来越省钱了。,0,0,0,2022-07-20 21:50:42,来自黑龙江,103599615016,中国二级抬杠运动员
7122340847685354280,病从口入，最安全的餐厅，还是自己家的厨房。。。,0,1,0,2022-07-20 14:41:18,来自山东,3980425685,丰富德鲁1
7122327486578918185,在外面吃上一顿饭，回家嘚翻两天的“肠子”。反省总结了一下，商家炒饭菜用的油基本“有毒”，肠胃顶不住[捂脸],0,0,0,2022-07-20 13:49:15,来自北京,6165487586,我滴妈
7122319260063695630,必须感谢这位勇敢、正直的好记者，否则厨房的内幕不可能被大家所知！[玫瑰][赞],0,5,0,2022-07-20 13:17:25,来自陕西,959232468330974,诗意菠萝iY
7122285783973151499,外卖便利，但卫生安全没保障，最安全的餐厅，还是自己家的厨房。,0,10,0,2022-07-20 11:08:20,来自河北,110907630501,墨羽倾璇Anne
7122309478913409795,从未去过必胜客[捂脸],0,0,0,2022-07-20 12:38:55,来自北京,7000760155,琳爱婉
7122384035619390245,不吃这些，自己家的厨房吃着就挺好，为啥要花钱买没保障的东西,0,0,0,2022-07-20 17:28:53,来自河北,1548562983561656,丽秀云山
7122457275553596171,人们以为吃这些速食就显得很高档，很小资，其实不知道自己吃的都是垃圾。,0,1,0,2022-07-20 22:13:31,来自重庆,6257321637,abc83659861
7122307999682741007,所以，饭店里看着光鲜亮丽的各种美食，还是尽量少吃；花钱吃出病来，还得用你自己的钱买药吃，受罪的也是你自己。在家最起码自己做饭吃的油，不会买转基因的油，不会有反复炸食品的高温油，也不会往饭菜里加各种添加剂。多听朱教授的话，多跟着朱教授学，吃的尽量健康些。,0,6,0,2022-07-20 12:33:00,来自河南,105068432230,壶与茶和水儿
7122335094781788936,说句实在的话，如果食品安全全部按规定做，成本增加3-4成都有可能。,1,1,0,2022-07-20 14:19:02,来自广东,1494926136981383,无名only1979
7122469854103749411,最安全的饭是自己亲手做的饭。自己动手，安全放心，丰衣足食。,0,1,0,2022-07-20 23:01:53,来自广西,1425436681447992,海花岛爆笑
7122304258787296014,为什么日本等发达国家也会冒出这些问题呢？这是个看似简单实际上复杂的问题！涉及到经济学、行政管理学等多方面!你有没有发现随着经济越来越发达，这些问题是不是慢慢变少了。想想九十年代比现在多得多!,1,0,0,2022-07-20 12:18:37,来自江苏,58574158331,影子传说2017
7122417573232804623,天啊，我还挺喜欢吃必胜客披萨的[发怒]，以后可不敢再去了[酷拽],0,1,0,2022-07-20 19:38:51,来自北京,2480114506944679,做个有温度的宝妈
7122412899183903523,举一反三，全国大排查，确保食品安全,0,0,0,2022-07-20 19:20:32,来自陕西,8098006280,冰雪64558
7122265107153421086,"举一反三，查二见全貌！食品安全大问题，必须严查的！
还是自己在家做着吃放心[灵光一闪]",0,12,0,2022-07-20 09:47:40,来自北京,92656417493,卸载重来
7122414705704272670,哪家不是这样，有的餐厅不止十天换一次,0,1,0,2022-07-20 19:28:01,来自广东,56322458176,208597006清若如水
7122246124664226575,做餐饮的人里，有良心的一只手就数的过来，有些事必须用严刑峻法来约束，不要指望道德,1,18,0,2022-07-20 08:33:30,来自吉林,109559024619,RainMan203
7122439908480533289,这种情况在披萨店里是普遍现象，3天的保质期和7天的保质期，保质期的标签，到期后更改，那家店里的都是这么操作的,0,0,0,2022-07-20 21:05:22,来自上海,13239042482,小小雨点9
7122250299292926757,已经很久不去吃必胜客了，越来越不好吃了,0,10,0,2022-07-20 08:50:09,来自北京,5793639474,sunny_lna
7122452622992278284,"良心商家从来不坑穷人
太过了必胜客吃不起",0,1,0,2022-07-20 21:55:04,来自浙江,4513654926,以身作则传递正能量
7122300804404740871,这样下去，不知道以后这些商家会不会禁止员工带电子产品上班,0,4,0,2022-07-20 12:06:00,来自广东,2805591340230061,减肥中de小璃儿
7122306766134313762,肯德基我在过后厨，油一天一换，挺卫生的，就是食材全是冷冻食品，不健康。,0,0,0,2022-07-20 12:28:14,来自云南,4569563448,稻草人PcLE
7122263071427134242,所以你以为干净的必胜客麦当劳肯德基这一系列其实也未必干净，不能顿顿自己做饭的就闭眼瞎吃吧[笑哭],0,9,0,2022-07-20 09:39:29,来自北京,85633945814,克劳猴
7122355977949135654,啥生客也不行，专一卖油炸的都这样，炸一遍东西就扔油亏死他。跟传统中餐不一样，炸一遍东西的油刚好用来炒菜。所以炸鸡，什么肯德基，麦当劳，炸鸡薯条，油条，通通超标,0,0,0,2022-07-20 15:40:53,来自河南,58608163843,期中靠试
7122294360800281380,你们觉得只有这两个店这样吗？必胜客所有的店都如此操作，别问我为啥知道,1,8,0,2022-07-20 11:41:05,来自北京,6198965323,finallyM
7122300350140252964,下次不吃了,0,0,0,2022-07-20 12:04:06,来自浙江,2128274145680765,顺其自然
7122351210271146789,举一反三，全国大排查，确保食品安全！！,0,0,0,2022-07-20 15:21:35,来自甘肃,593347125198174,李戴桃疆
7122259858522391296,从来没去过必胜客吃东西的飘过，看了报道…以后也不会去[抠鼻],0,10,0,2022-07-20 09:26:37,来自江苏,99709547658,结果皆是因果
7122312672116392743,他们天天换油你们信吗？谁家不是一样的,0,0,0,2022-07-20 12:51:16,来自浙江,3013122103978179,A亚一珠宝
7122380327850902302,很是少吃油炸食品,0,0,0,2022-07-20 17:14:44,来自北京,60718984222,叮当77252
7122242591873729295,有空卧底早餐炸油条的早餐店,1,9,0,2022-07-20 08:20:01,来自山东,5800910886,环游世界的Tang
7122302064398877480,还是罚的力度不够，商家觉得罚了依然有利可图,0,0,0,2022-07-20 12:10:27,来自天津,2686854472150935,小野fish爱吐槽
