7122267273431450404,油,0,0,0,2022-07-20 09:55:56,来自上海,1068351135419149,深山老屋
7122228484432265992,水景房,0,1,0,2022-07-20 07:25:42,来自上海,111523148984,多彩海浪n4
7122256611950985991,都是人才,0,0,0,2022-07-20 09:14:32,来自山东,106167795996,成品油亮亮
7122279662222770952,"应该让某些人看看是不是100年的设计。这采访也太不靠谱了，什么时候入住的，房子已经住了多少年了，这些关键信息都没有说出来。
很明显的堵漏公司不专业，按照他们的玩法，直接把顶楼给拆了就不漏水了，只能证明他们玩的不彻底呀。
一个顶楼像那样子挖坑，住在下面的只是漏水还是好的。那顶楼掉下去了，不知道能砸塌多少层。
花了钱买这样的房子，那真的是倒了大霉了。",0,0,0,2022-07-20 10:44:20,来自湖南,70617213440,锄弱扶墙义薄晕甜
7122055368486077222,物业经验不足，不老鬼。此类生活外包给专业公司修，专业的事让专业做，只能讲评估失误。接下来，修补好，再像老公房一样，改为尖顶，不能再漏水了，双保险。一次投资，长期受益。,7,3,0,2022-07-19 20:13:50,来自上海,84223826008,机智的星空Lt
7122247796513719081,房子成了负担，整天为漏雨提心吊胆，开发商是大功臣！急功近利，为获取高额利润，无所不用其极。这样的例子还少吗？而且令人难解的是，这样质量的房子，是怎么通过质检的？房子，可是老百姓最大的财富，弄成这样的局面，谁来收拾残局？令人难以想象！,0,1,0,2022-07-20 08:39:53,来自上海,166769838265437,风趣齐天大圣
7122227237411160866,真作孽啊 其实很简单的事情 浇点柏油就可以了 以前都是这样的,0,1,0,2022-07-20 07:20:20,来自上海,3234597777,优雅暖阳666
7122222375269368589,70年的楼龄正当壮年缺浑身是病！你说吓不吓人,1,4,0,2022-07-20 07:02:06,来自山东,5884678465,飞雪在寒冬
7122228389289296655,我就说嘛，地球第一贵的钱，买了质量最差的房，部分房子30年贷款还完，房子基本报废了，所以专家说中国房子的平均寿命30年。,0,1,0,2022-07-20 07:24:59,来自上海,1433377954862723,芝麻开花哇塞
7122264486320685864,这物业就是害人的，不修小漏修了大漏，顶楼漏水只能重新做防水，或者加工顶棚，哪能把楼板刨了啊！,0,0,0,2022-07-20 09:44:45,来自广东,75509747968,王恩聪63
7122038374374507305,才18年房子就烂了，服,1,7,0,2022-07-19 19:07:24,来自浙江,4204963510101087,浙里得人
7122218663419609856,一直很奇怪为什么屋顶的防水层一定是黑的，采用浅色夏天不是能反射阳光更有利降温吗。国内有那么多大学，那么多研究院，发那么多奖，怎么涉及基本民生的事就没有人有兴趣研究一下呢？,0,1,0,2022-07-20 06:47:16,来自上海,109455750792,Wxj23006884
7122256543219041028,国人都能上天揽月了，就是房屋顶楼漏水的问题解决不了，真是服了。[捂脸],0,0,0,2022-07-20 09:14:37,来自辽宁,422632411894237,即墨如歌
7122231466293035814,这个物业是作孽！修房顶捉漏是绝对的技术活，可以这样随心所欲？简直是拆房子了！,0,1,0,2022-07-20 07:37:21,来自上海,59692581806,奇妙咖啡9W9
7122223452366488334,豆腐渣工程，设计、监理在干什么？是如何通过验收的？,0,1,0,2022-07-20 07:06:19,来自上海,817650713238919,乘风破浪树干
7122234075339490059,找开发商，这是豆腐渣工程啊,0,1,0,2022-07-20 07:47:58,来自上海,1539796436787671,快乐～一生
7122249664749126415,上海从不缺聪明人。偏偏这里的业主碰上了聪明的笨蛋。,0,0,0,2022-07-20 08:47:10,来自上海,106644971220,焊工老董
7122257839464350478,只有10几年的房子质量问题这么严重…可想建造时的管理人是不合格的，豆腐渣工程。,0,0,0,2022-07-20 09:19:22,来自广西,5498907936,姚伦权57184559
7122049071044805391,物业补漏，越补越漏。本来就是收钱的，真正本事没有的？！,0,6,0,2022-07-19 19:48:43,来自上海,5804743124,摄影爱好者LBXZ
7122225121502855947,住上这种房子真是倒了八辈子霉！不管什么＂会＂什么部门，将心比心不会吗！？,0,1,0,2022-07-20 07:13:42,来自上海,58838677723,老胡电话换了
7122262602994483968,把开发商和物业一起告，,0,0,0,2022-07-20 09:37:31,来自上海,3579601820329272,青涩火车A5
7122232323638641442,在中国才不到二十年，就叫年久失修了[捂脸],0,0,0,2022-07-20 07:40:12,来自辽宁,106640503570,Buletneige
7122276341365670692,这可真会补，这样补不越补越漏才怪！,0,0,0,2022-07-20 10:31:09,来自山东,50230068342,乾莳雪
7122257669230134028,开发商垃圾,0,0,0,2022-07-20 09:19:14,来自上海,55794243494,东江村夫
7122264871189988100,红杏出墙图,0,0,0,2022-07-20 09:47:07,来自上海,1728058150093700,燕子飞来的时候是春天
