7122208505318245156,屋面捉漏头回见到如此施工作业的，像是拆房大队承揽的屋顶补漏工程。,0,8,0,2022-07-20 06:08:44,来自上海,105388244565,请帮记忙
7122116269923025696,搬物业办公室住去,4,5,0,2022-07-20 00:13:03,来自辽宁,85880227377,逆旅归途
7122223899924513551,天台挖坑这是奇葩的操作，直接在平台上全部做防水层不就解决家家户户的漏水情况了吗,0,3,0,2022-07-20 07:07:38,来自上海,88174935314,W日出东方
7122225631798706979,平改坡就行了，这屋顶为啥挖这么大一个坑，顶层混凝土怎么会这么厚？,0,3,0,2022-07-20 07:14:23,来自上海,75800571525,开水白菜78
7122217821509632802,层层转包都想赚大钱，以前是农民今天转身成建筑工人，这房子的质量可想而知了。,0,5,0,2022-07-20 06:44:05,来自上海,65280667111,Biao哥
7122244227618292514,这明显是修理方案出问题了，屋顶漏水这样修是越修越漏。,0,2,0,2022-07-20 08:26:09,来自上海,3205806209903172,老王董是我
7122260415261704968,这种用了夹层保温材料的平面房顶是根本没办法维修好的，除了在上面加盖一层彩钢瓦或者玻璃，如果说把房顶打开了重新修理，只会越修越漏，,0,1,0,2022-07-20 09:29:17,来自江苏,5683406622,远见卓识雪碧oG
7122240342732161825,德国日本人的建筑极少有屋顶漏水,0,2,0,2022-07-20 08:12:00,来自上海,102465818808,清新苹果wH
7122239077424366351,豆腐渣工程，要追究开发商的责任！,0,3,0,2022-07-20 08:06:21,来自江苏,50460380794,六月艳阳天1
7122272740668736296,居无所安是老百姓的大事。住在这么糟心的房子里，真的很崩溃。,0,1,0,2022-07-20 10:16:44,来自上海,1508131984115244,三楼主333
7122221397338145539,应该平改坡，一般平屋顶由于房子沉降基本上没几年大多数要漏，除非桩基打到岩层，所以平顶房顶层绝对不能要。,0,2,0,2022-07-20 06:58:56,来自上海,57725353844,淡定明月X1
7122233390484636455,每个小区不是住户都岀了维修基金吗？这钱不拿来做整栋楼顶的防水。,0,2,0,2022-07-20 07:45:12,来自西藏,60905832751,川蜀老幺
7122224026210468648,现在物业和居委会就是搪塞，媒体已曝光，就有希望解决了。,0,2,1,2022-07-20 07:07:53,来自天津,109205123141,山岚shanlan
7122092120739447556,维修差到无语。浇加钢筋水泥层顶，再上沥青防水层，斜顶。,0,8,0,2022-07-19 22:36:43,来自上海,3795155514559485,求真实s
7122248932763386628,顶楼加盖一层，隔热防雨层，彻底的解决了问题,0,1,0,2022-07-20 08:45:12,来自江苏,3618712802,家有租客
7122260934685115175,非常同情，叫物业加个屋面得了，按理说现在屋面修漏方法很多，看来物业没有找到很专业施工团队。,0,1,0,2022-07-20 09:31:59,来自上海,50039897244,潇洒蜻蜓A3
7122229154296414987,十多年房龄就这样了？就是动迁房也不会这么差？怎么会是平顶？,0,2,0,2022-07-20 07:28:53,来自上海,111262132468,1169195
7122259741098902312,百年大计的房子十几年就不行了？什么质量？,0,1,0,2022-07-20 09:26:19,来自上海,55610020885,淡定圆月z4
7122216561112990501,这种房子越修越漏，小修小l大修大l，一定要改装，才能平安无事！就像老人补牙齿一样，你补了一个牙，他接下来一个一个都动了，啥道理，，，老了[大笑],0,4,1,2022-07-20 06:40:02,来自上海,91756636224,木子825359932282
7122247232811893536,几大怪像：1十几年的房子成危房，2漏水越修越漏，3裂缝越修越多！,0,2,0,2022-07-20 08:38:39,来自陕西,93116794992,幸福一生279381861
7122236921815827237,这种屋顶漏水的严重程度是否应该归到抢救范畴？,0,2,0,2022-07-20 07:58:10,来自上海,6370233151,大尾巴220
7122244317779575560,单位以前的五层老楼都没听说谁家漏水，还是五个单元，楼梯2户型。分明就是建筑的时候偷工减料[捂脸][捂脸][捂脸],0,2,1,2022-07-20 08:27:28,来自广西,53971686583,夜風68
7122275080339899139,精致的阿拉竟然住漏水的房子？国家还不赶紧给它们换新的。,0,1,0,2022-07-20 10:26:42,来自福建,6093340196,空白78771028
7122042130361025314,千万不要买顶层的房子，时间久了没有不漏的。,2,13,3,2022-07-19 19:21:53,来自内蒙古,104917931797,上进云朵pL
7122256543785468713,把原来的垃圾清理掉以后，加做一层发泡剂就是人家做彩钢这种东西交了以后会渗透，隔热彩钢瓦的那种发泡剂，液体的加整个一个屋面就可以了,0,1,0,2022-07-20 09:14:03,来自上海,4614888924,夏天的风1352
7122224019080495908,莲花新苑，名字很熟悉，是不是当年倒楼的那个？看样子只有做坡顶，才能解决漏水问题。,0,3,0,2022-07-20 07:08:46,来自上海,102201217065,梦里不知在异界
7122232943678210852,这样的房子存在质量问题、再加上大雨的冲刷、啥问题都出现了、希望有关部门能尽快解决问题、不然的话后果更严重、更可怕,0,3,0,2022-07-20 07:42:53,来自上海,598584018615304,潇洒溪水xX
7122223243997545216,这个莲花新苑是不是曾经楼倒倒那个,0,2,0,2022-07-20 07:04:44,来自上海,5160312,上善若水206055506
7122210348555961102,小问题被物业修成大问题，责任方在物业，由物业负责赔偿。,0,8,0,2022-07-20 06:16:10,来自上海,103097011479,鄙视黑暗
7122232064841220896,屋面上造个玻璃房，一可以解决晾衣服的地方，二可以防止漏雨这个问题。,0,2,0,2022-07-20 07:39:55,来自广东,4623480421,一彡宾
7122258654124081923,这个物业，平改坡不会呀？又防雨，又隔热，还造价底。,0,1,0,2022-07-20 09:23:04,来自上海,102265025695,deletecn
7122227755865244446,屋顶防水老化，靠这样补不解决问题反而带来更大问题，屋面全新新做防水可能保几年。也不是一劳永逸。,0,2,0,2022-07-20 07:23:02,来自上海,61786832236,张征东1174043871
7122219262319526663,平改坡是治本之策！这样的修复，原理没问题！实际施工、材料、工艺、人的工作质量，现在的现实没法保证！,0,3,0,2022-07-20 06:49:56,来自澳大利亚,2137042375959790,博学清泉tM
7122248828597650176,唉，这顶层漏雨是普遍现象吗？多年前，我的房子就是顶层，每到雨季就从雨水下水管处渗水，一直都没法装修，后面让我卖了[捂脸],0,0,0,2022-07-20 08:43:58,来自北京,108580561785,东北璟斐的Vlog
7122229049661522727,层层扒皮的工程不漏水才怪呢[抠鼻],0,2,0,2022-07-20 07:28:23,来自上海,5574966209,刺客60542246
7122228460508267298,没见过这样补漏的 人才啊,1,1,0,2022-07-20 07:25:07,来自广东,5864254465,独自寒江
7122052560974021409,居无所安是老百姓的大事。住在这么糟心的房子里，真的很崩溃。,0,13,0,2022-07-19 20:02:55,来自上海,3720382198587166,热闹白云2t
7122209845943796510,房顶没积水，基本不会这样,0,2,0,2022-07-20 06:13:49,来自上海,102685510637,不一样的烟火25559
7122268580594729731,上海还会有这样的房子？,0,0,0,2022-07-20 10:01:42,来自重庆,6059751836,周娜周萍
7122252471288185614,关键问题是没钱，物业没钱，6楼居民没钱，反正就大家推呗。居民找物业，物业找业委会，业委会说必须2/3居民同意。,0,0,0,2022-07-20 08:58:49,来自上海,68009251873,左手右手9756
7122083954366726925,開發商建造房屋時用的材質有問題，再怎麼修都無濟於事。,0,13,1,2022-07-19 22:04:24,来自上海,417421430620302,足智多谋钢笔uV
7122212498526176004,重做成人字型屋顶，隔成架空层，不漏水，又隔热，。,0,4,1,2022-07-20 06:24:43,来自广东,18366690406,振文16
7122225448263959335,搞个平改坡工程就彻底解决问题，且一劳永逸。小修小补于事无补，浪费资源！,0,3,0,2022-07-20 07:14:34,来自上海,7787399706,外向露珠DW
7122259667518325508,屋顶围栏拆除，再浇一个屋顶，在砌好护栏。,0,1,0,2022-07-20 09:26:41,来自上海,55587687498,小木木核
7122221302697526028,现在的物业办事能像收费一样积极什么事都不是问题,0,2,0,2022-07-20 06:58:11,来自陕西,59584591251,农村宝妈7O0l
7122265329799365376,房子并不是物业所说的年久失修吧！应该本身房子建筑质量有很大问题。,0,1,0,2022-07-20 09:48:00,来自甘肃,13153195859,东湾人民也
7122241253877891874,"老祖宗的经验不要，非要用新式方法。
以前的坡顶不是很好吗，没有积水",0,2,0,2022-07-20 08:14:40,来自上海,53305893722,s夜光美酒
7122247026586649359,顶层的房好多都系刚过了发展商规定的保修期满后不几年就漏水的，每个小区都有这种情况。,0,2,0,2022-07-20 08:37:04,来自广东,4446012901702052,安逸面条iW
7122268136153826055,告物业公司，不按规范操作，小修工程变大修改造，从中牟利。,0,1,0,2022-07-20 09:59:21,来自上海,67504841893,虚渺天地间
7122255093327479592,上加斜顶密封防雨防热层,0,1,0,2022-07-20 09:08:10,来自浙江,2953652535,孤鳏闲云
7122250787681698564,直接搞一个1米高的彩钢顶棚不就好了，一户几千块钱搞定了，搞1cm厚的钢板也要不了多少钱,0,1,0,2022-07-20 08:52:19,来自江苏,3298819398,精彩继续2333
7122216773927043873,物业领导不作为。维修工人枝能，工作能力不实在。我们住过两年这样的房子。,0,2,0,2022-07-20 06:40:48,来自上海,63899610583,让蓝天更美好
7122242142264787747,要改变，只有平改坡,0,2,0,2022-07-20 08:18:02,来自上海,62160479385,老虎吃小鱼
7122232476008973071,整个楼顶用屋架形式，用彩钢瓦履盖一遍，就可以了。,0,3,0,2022-07-20 07:40:44,来自上海,52365873239,智慧海燕Oz
7122237124074013478,这是低层住宅啊！可以拆了重建吗？[泪奔][泪奔][泪奔],0,2,0,2022-07-20 07:59:49,来自重庆,2049103229365053,榭茳
7122213880595989279,房子质量差，物业水平差，都碰上了。,0,4,0,2022-07-20 06:29:31,来自上海,4705131902,上海小民
7122254793020228363,十多年的房龄已属年久失修，房子是用来住的还是给维修队创收的，现在的房子寿命正的很短么，10多年巳属年久失修，看来离危房拆迁不远了，住户们熬出头啦。,0,0,0,2022-07-20 09:08:13,来自上海,106645223412,风中的人生yy
7122260063980585728,这个是施工不当造成大面积渗透的问题用震动工具把本来偷工减料的顶震了全漏水了！,0,1,0,2022-07-20 09:27:33,来自上海,52629878223,清闲人也可称无聊人
7122221087966544671,这明显是上海等拆迁的，我们老家房子都漏塌了，该咋着？,0,3,0,2022-07-20 06:57:27,,103111691606,淘气的小乖羊
7122255470265877256,楼顶漏雨居然挖大坑？真特么牛逼[赞][大笑],0,0,0,2022-07-20 09:10:25,来自河北,6325000615,胖怼怼plus
7122265690660209408,上海这边房子质量的确堪忧。好多刚建成两三年的房子都漏水，包括有些别墅都这样。,0,1,0,2022-07-20 09:49:15,来自上海,290714998294109,真理无限
7122235405201621764,估计是天顶防水失效了，重新做防水。,0,2,0,2022-07-20 07:52:35,来自湖南,22001343242,世水长流1
7122275478484419339,其实一开始漏的时候用那种类似轮胎的胶皮火补一下就能防漏了，没看明白物业为什么要这样搞,0,1,0,2022-07-20 10:28:22,来自上海,58518259919,愛生活爱美女
7122228939480810240,坡顶一般不漏，平顶防漏防水一定要做得特别好，农村里自己盖的平顶一般不漏,0,2,0,2022-07-20 07:26:54,来自山东,5750681949,小可34023705
7122237387626922756,楼顶加个塑料棚子就行，让水落不到楼顶。,0,2,1,2022-07-20 08:00:30,来自上海,4100660952,乘风破浪会有时啊
7122223795351733033,问题就出在回填，人才啊！重新挖掉新材料做才是正确的！,1,2,0,2022-07-20 07:06:59,来自河南,109865310794,灵敏咖啡E0
7122274428536668963,物业收的物业费不找专业的人员修这是在胡闹，所有这个楼的业主找物业赔偿,0,1,0,2022-07-20 10:23:23,来自广东,602991273456014,爱家可乐5J2
7122260527983903503,直接盖一个屋面 上面铺瓦 一次性,0,0,0,2022-07-20 09:29:32,来自湖南,104619070814,一心一意豆花LI
7122208670116545287,自己找专业做防水的弄一下就行了，指望物业没用,0,4,0,2022-07-20 06:09:09,来自上海,6207914064,心似零碎的夜
7122220755533890342,总之顶楼不要买就对了！,0,2,0,2022-07-20 06:56:19,来自上海,56108749162,乡下人56108749162
7122199482238452495,质量问题，立即投诉,1,2,0,2022-07-20 05:34:05,来自安徽,52359062529,冬天不下雪18
7122232439707714315,平改坡估计可以,0,2,0,2022-07-20 07:41:50,来自上海,954832050200862,妮妮的外公
7122222231153099531,2004 年久失修。 70年产权呢,0,3,0,2022-07-20 07:02:10,来自上海,51202974267,汉东第一李达康
7122232985676038943,04年的房子，也叫年久失修，真是笑死我了！,0,2,0,2022-07-20 07:43:21,来自上海,97435795263,2353869
7122040818336432911,这就是胡乱干的结果，现在责任方就一推了之，不能维修，谁在顶楼干GA,0,7,0,2022-07-19 19:16:42,来自广东,52753232495,詹俊庭800217
7122214887903773447,2004年建设，那么建成到现在应该不足二十年，一家人几辈子积蓄买房子十几年就这样子，真糟心。,0,5,0,2022-07-20 06:32:58,来自江苏,69512951184,老姜2179549
7122215464239579943,我以前的顶楼房子也是这样，太烦人了！,0,2,0,2022-07-20 06:36:25,来自上海,1371811157639374,沪A红一军团
7122235553088586508,街道社区应该出面解决问题 这是关系居民的大事。,0,2,0,2022-07-20 07:53:36,来自上海,55594131564,冰雪烈焰1
7122218872496784167,物业明显缺乏维修技术，把小漏修成大漏。吓死人了。,0,3,0,2022-07-20 06:48:43,来自上海,53774912145,心静止水jc1999
7122246070088319779,谁是房子业主谁负责。,0,2,0,2022-07-20 08:33:25,来自上海,4661675408,46481032
7122253939789660966,这房子质量堪忧啊，才18年，就这样了，70年的产权，可能一半还没住到就要垮塌了,0,0,0,2022-07-20 09:04:51,来自广东,50573833658,老猫第6感
7122264772313416455,房子质量问题，可以投诉呀！修不好赔钱[捂脸][捂脸],0,1,0,2022-07-20 09:46:18,来自上海,72684770121,小可18260137729
7122212690353144611,建成18年的房屋就叫年久失修，佩服佩服。,0,2,0,2022-07-20 06:24:18,来自江苏,58270132383,忙碌每天2
7122260830355407647,物业到底是修楼还是拆楼！,0,1,0,2022-07-20 09:31:09,来自安徽,4275373929149235,蓝海YZY
7122239606175023908,看看楼顶以前用的水泥和沙子，就知道原施工单位多么缺德，这样的材料怎能不漏,0,2,0,2022-07-20 08:09:00,来自安徽,566982727188173,十千文子
7122250458076758818,简单的很的问题，楼顶全部盖瓦，不可能有漏了。,0,1,0,2022-07-20 08:50:23,来自江西,104542249837,我不是你的风景丶
7122247472956818212,惨不忍睹，房顶成啥样子了,0,2,0,2022-07-20 08:39:14,来自河南,923188267844556,快乐黄骅5n4
7122237988339794725,业委会停摆？这种事情不是一直找物业的吗？,0,2,0,2022-07-20 08:02:52,来自上海,871264292454296,聪慧星球ZT
7122235913652667167,上海平移的那红房子经过那么多年，还经过一次大平移还是完好无损，可见以前外国人造的房子质量真心好，现在我们造十几年的房子成这样，说豆腐渣不为过吧,0,2,1,2022-07-20 07:54:42,来自上海,70707596077,春诵夏
7122241887716524830,这房子不等70年，自动到期,0,2,0,2022-07-20 08:17:24,来自广东,61938950790,冷太阳637
7122243064303076104,先不说房子老不老漏不漏，物业干的啥事啊，有这么糊弄的吗，收物业费的时候恐怕拖一天都不行吧,0,0,0,2022-07-20 08:22:18,来自河北,55626362374,诸葛亮亮9
7122252651207262983,我前年买的二手顶楼有点漏，去年花2万多做了个阳光房，完美解决了！,0,0,0,2022-07-20 08:59:36,来自四川,1701692592362056,懒人修行
7122265924970857219,国人都能上天揽月，就是房屋顶楼漏水的问题解决不了，真的服了[赞][赞][赞],0,2,0,2022-07-20 09:51:02,来自上海,2375414519963851,无忧的糯米89
7122227599082324767,这问题，物业一定要彻底解决好！才能得民心！,0,2,0,2022-07-20 07:22:28,来自上海,97161588598,博学多才的画板v
7122282395486864169,卷材防水不行吗？,0,0,0,2022-07-20 10:54:12,来自重庆,105133070513,梦幻山城阳光
7122269200173237000,关键是人家质量验收合格啊，怎么合格的？？,0,0,0,2022-07-20 10:03:36,来自云南,52965148673,高峰177675188
7122254846400791296,是不是以前倒楼的那个莲花小区？,0,0,0,2022-07-20 09:07:18,来自浙江,52158020485,天地不交
7122217572854219520,这个故事告诉我们买房不要买顶楼，风险大[捂脸],0,1,0,2022-07-20 06:43:03,来自上海,60391428266,Small搬砖娃
7122256746777002752,希望今日头条能与我协会联系，帮助居民解决多年渗漏的疑难杂症，不知怎样与你们联系？,0,0,0,2022-07-20 09:14:46,来自上海,5947763747,南方草民
7122228036699439908,需要动用大修基金，而动用大修基金要业主同意，没有业委会物业才不会一家家去签字呢。这事急的是漏雨的房主，他们需要自救。第一，看能否追究开发商责任。第二，逼物业找业主签字，动用大修基金，对楼内需要大修的，全部一次搞定。对了，必须监督维修工程款项，最好实行公开招标。,0,2,0,2022-07-20 07:24:24,来自上海,62618278551,兰雅飘馨龚
7122279796989575971,渗漏案例！,0,0,0,2022-07-20 10:43:59,来自广东,738482172206813,整人君子
7122244813499564840,我家也有画架,0,2,0,2022-07-20 08:28:17,来自上海,4320655212,宝宝布娃娃
7122237997030294306,我们楼道的顶墙也差不多，漏了修，修了漏,0,1,0,2022-07-20 08:02:06,来自上海,23019345639,咖吧老九
7122231444680393503,莲花？估计是不是就是当年倒塌的莲花河畔景苑,0,2,0,2022-07-20 07:37:14,来自上海,98442433837,红色大金鱼
7122236303818867490,买房子碰到这样的开发商，住户倒霉死了，退房赔钱,0,1,0,2022-07-20 07:55:21,来自广东,3399319700908828,乐天派喜鹊oW
7122264285077898024,04年的房子就年久失修了？,0,0,0,2022-07-20 09:43:58,来自北京,59065978409,弓长弓
7122233478783058701,04年的房子年久失修？！,0,1,0,2022-07-20 07:44:56,来自上海,2646548015,宝哥就是凹凸曼
7122267813817205539,民生无小事，大家邦侬忙。,0,1,0,2022-07-20 09:57:38,来自上海,73142040625,勇往直前的梦想家P
7122249494259499779,物业明显缺乏维修技术，把小漏修成大漏。吓死人了。,0,1,0,2022-07-20 08:47:36,来自广东,2085110732818775,微风吹散雾
7122208121937806112,这个就是节约成本，没做好防水，很好解决的问题，重新做防水就可以了。,0,2,0,2022-07-20 06:07:03,来自上海,4455648319774976,专业防水丶维修丶补漏
7122077423859974950,只有做一个装饰坡屋面来解决屋面漏水问题。,0,1,0,2022-07-19 21:38:58,来自上海,92916791544,聪慧漂流瓶iS
7122209937589027616,有没有商品房质量问题赔偿机制？,0,3,0,2022-07-20 06:14:38,来自上海,2887478866,正夫齐家
7122265633664025375,这是什么情况吗？几个意思啊？建造这些房子的工人都是打瞌睡间的吗？[呲牙][呲牙][呲牙][呲牙],0,1,0,2022-07-20 09:49:43,来自江苏,3218972531758040,鲨鱼骑行
7122213561170314020,物业真牛逼，什么都会修,0,2,0,2022-07-20 06:28:26,来自上海,5787828253,M0NSTERCHOW
7122260869656036130,楼倒倒的莲花路和这个莲花小区近吗？？,0,0,0,2022-07-20 09:30:41,来自上海,87256579578,古道西风人多
7122221765954814734,不到二十年，就年久失修了？,0,1,0,2022-07-20 07:00:00,来自上海,63505105349,海事良
7122268836031890207,[酷拽]几百万的房子十年就年久失修了,0,0,0,2022-07-20 10:02:06,来自河北,6019283841,猪不理不理
7122249520310141710,才短短二十年的时间，建筑就产生这么大的漏水问题。,0,0,0,2022-07-20 08:47:22,来自上海,2546118828764644,次元动漫的乱太郎
7122209067124261673,物业明显缺乏维修技能，把小漏修成了大漏，眼下物业应该抓紧时间请专业维修人员把屋顶渗漏问题快速彻底解决，让深受其害的居民早日过上安稳的生活。,0,1,0,2022-07-20 06:09:58,来自上海,61184060966,王小冬冬541301
7122221232334586658,这个小区业主碰到了一个愚蠢的且不负责任的物业公司[流泪],0,2,0,2022-07-20 06:57:25,来自上海,20793374751,沉默的大公鸡
7122244832391021312,我们家也是的，报修难,0,1,0,2022-07-20 08:28:32,来自上海,92672946060,13916452957
7122211612840215303,又是梅陇地区的就是房倒倒边上的那个莲花河畔边上房子，,0,1,0,2022-07-20 06:20:15,来自上海,2721993464489693,上海卢湾
7122266570709697317,我老家的祖屋四百多年了现在还能住人！,0,0,0,2022-07-20 09:53:28,来自广东,68307415076,自在的机械师
7122251592979809065,04年的房子已经年久失修了？[捂脸],0,0,0,2022-07-20 08:54:43,来自上海,4342233009,夏天
7122250883802989319,这应动用维修基金了，还有吗？不足由住户补充。物业只能小修小补！,0,0,0,2022-07-20 08:52:37,来自上海,106409354268,清爽微风V5
7122227537022911272,04年的房子就这样了，这质量真是惨不忍睹,0,1,0,2022-07-20 07:21:25,来自上海,4829566175,消防员阿尔维斯
7122035980861047586,这房子质量太差啦,0,6,2,2022-07-19 18:58:04,来自上海,108067626113,maggie4505
7122239783115637536,上海闵行区吗，富人区啊,0,2,0,2022-07-20 08:09:36,来自广东,3663212086836611,小L独钓寒江雪
7122229284437754632,04年就叫年久了？我们84年的怎么办？平改坡搞一下,0,1,0,2022-07-20 07:29:07,来自上海,3540874723852845,四十二亩水田
7122252965360485155,这事说大不大，说小不小，问题是有没有人出手解决。,0,0,0,2022-07-20 09:00:03,来自江苏,896824617470863,月华水果儿
7122261667446555431,这样修不好的。很简单，做个三角屋顶，问题彻底解决，而且一劳永逸。,0,0,0,2022-07-20 09:34:49,来自上海,101822401041,朴实明镜jE
7122218657975173926,平改坡就能解决的事，为什么不做，六楼的自己出点钱也愿意。,0,1,0,2022-07-20 06:48:27,来自上海,53774912145,心静止水jc1999
7122265521168810788,才十来年的房龄就叫年久失修？,0,0,0,2022-07-20 09:49:23,来自福建,21595827541,声琴并茂
7122267962626933539,说到底钱不到位啊，整屋全重新黏贴防水,0,0,0,2022-07-20 09:58:14,来自山东,69462317889,淡定苹果5
7122279549836673827,斜坡顶了解一下,0,0,0,2022-07-20 10:43:16,来自福建,51387542023,莉枝圆滚滚1
7122229547403363080,只要顶楼按东西，做防水没用,0,1,0,2022-07-20 07:29:52,来自山东,60645485626,单纯小红花i
7122271043792356103,来，上我们农村，免贾送一套200平的房子给你住。,0,0,0,2022-07-20 10:10:58,来自安徽,1623333526318062,优雅小红花Rn
7122279365265605380,顶楼的房子再便宜也不能买,0,0,0,2022-07-20 10:42:57,来自浙江,79984381853,正义凛然清泉SF
7122240808694219560,很简单个事，搞这么复杂，屋顶盖个瓦不就解决了,0,1,0,2022-07-20 08:12:48,来自广东,4167041250,午夜来香aa
7122240116957299487,10多年的房子叫年久失修？那五六十年的房子叫啥？[抠鼻],0,2,0,2022-07-20 08:10:55,来自上海,97536288620,戒烟难戒你更难
7122260384089670430,物业明显缺乏维修技术，把小漏修成大漏，害死老百姓了。,0,0,0,2022-07-20 09:29:21,来自上海,97822912270,大树3579
7122232406434300711,每天五个字,0,2,0,2022-07-20 07:41:41,来自上海,1002380854571406,canrilinna
7122034985279734561,这就看出物业真没存在的理由！,0,35,2,2022-07-19 18:54:37,来自上海,102751098103,用户倔强的山羊
7122222321657479951,上海还有这事？奇了怪了。,0,1,0,2022-07-20 07:01:12,来自上海,104979196816,玲铃1
7122241283032122112,10多年就成这样了，我们这93年的6层屋顶都蛮好，人啊还是以前做事实在。,0,1,0,2022-07-20 08:14:38,来自马来西亚,1824825600126599,富贵花开23589
7122220914577556256,真是新鲜事，还有这样修房的,0,5,0,2022-07-20 06:56:45,来自河北,92730480383,998765466
7122271800125997862,这样的顶越堵越漏，只有在上面再加一层轻钢房才能解决问题,0,0,0,2022-07-20 10:13:57,,51068530307,万物的春天
7122232369117397800,平改坡就彻底解决了！,0,1,0,2022-07-20 07:40:16,来自浙江,5529150129,悟心依旧LH
7122223745204470562,没有这样修法，挖大洞是为了毁尸灭迹。销毁偷工减料的证据。,0,1,0,2022-07-20 07:06:54,来自上海,3021245263,退而不休Luke
7122241717465563916,赚钱业委会、物业，有事摆摆手！,0,1,0,2022-07-20 08:17:07,来自上海,105180191118,海上神树
7122217029402510116,补漏应该不难吧，用得着开挖吗？肯定是有其它的矛盾吧,0,1,0,2022-07-20 06:41:37,来自上海,75511441134,多彩山雀9k
7122179054618739497,楼顶修不全面修根本就余事无补。,0,3,0,2022-07-20 04:17:54,来自内蒙古,107789465533,淘汽的傻猪
7122233531786347297,这种房子最有效的办法是平改坡。,0,2,0,2022-07-20 07:45:40,来自上海,54805273120,钱江潮小桥流水
7122263691340464935,上海应该对超过15年房龄的房子定期进行房屋安全监测和维修了。,0,0,0,2022-07-20 09:42:29,来自上海,4212935484513607,无妨无畏
7122247771721827107,顶层大多都是平顶，为什么不盖带大瓦房那种的,0,2,0,2022-07-20 08:40:07,来自广西,58952943989,琰淇
