7122259415432381184,外面倾盆大雨，家里大雨倾盆。这是全国各地普遍存在的问题，应该纳入法律程序，依法约束开发商对质量的重视。延长质保期才是解决问题的根本方法，,0,1,2,2022-07-20 09:25:09,来自黑龙江,1877580338962195,博爱诗书
7122251268890280744,十年房子就变成这样，不用想也应该是建筑时偷工减料而且验收时耍了手段。澳洲房屋是有好多年保修期的，承建方好像是承担全部维修责任与费用。感觉只有这种机制才能确保施工材料与技术的负责任，才能从根源上去除安全隐患。,1,34,0,2022-07-20 08:53:32,来自广东,53592625562,Emma1128608
7122052677907497762,顶上搭层彩钢,13,61,1,2022-07-19 20:02:43,来自河南,62347860998,博
7122256385273987878,漏雨可以做个铁皮顶棚，就不会漏了，主要怕房子泡坏了，带来危险，要请懂行的人来看看，免得住着不安心，安全无小事，一定要抓紧，切身安全，和同样楼顶的业主沟通，凑钱先修，以后再维权，不然拖拖拖，物业可以拖，楼顶住户拖不起，夏天多暴雨，安全第一。,7,38,1,2022-07-20 09:14:10,来自安徽,2493316546180958,云自在的简生活
7122226590867620649,我小叔子家也是顶楼，下雨就漏水，修修补补是一点用都没有，所以，今年他们顶层的邻居一块，都按上了彩钢瓦，全部都罩起来了,4,20,1,2022-07-20 07:17:39,来自山东,3276200544571524,人间小丑
7122230572227134243,就不能买平顶的楼房，平顶楼房10个里面8个漏。我就不明白了，屋顶为啥要建平的，连老祖宗房子屋顶都是斜的，现代人的想法真奇怪🤔,35,124,3,2022-07-20 07:33:19,来自上海,6064855267,黑曜白子互豪
7122082985716892446,国人都能上天揽月，就是房屋顶楼漏水的问题解决不了，真的服了,8,354,6,2022-07-19 22:00:35,来自上海,409462666442788,元气帆船9L
7122211235168944909,只有10几年的房子质量问题这么严重…可想建造时的管理人是不合格的,27,285,2,2022-07-20 06:19:29,来自上海,58659927174,Y130130
7122222265848660777,我家也是屋顶漏水，已二十年之久物业修了无数次，楼上又不配合觉得跟他们家无关，每天台风季节担惊受怕，怎么办，求帮忙！,11,51,2,2022-07-20 07:01:21,来自上海,102902863181,上进的星辰fW
7122035789084721920,物业明显缺乏维修技术，把小漏修成大漏。吓死人了。,10,257,4,2022-07-19 18:57:09,来自上海,853682035363100,乐天派小羊8j
7122237287384269603,“10多年房龄的小区一梯两户5个门洞，顶楼家家户户都在漏。”10年的房子也不算老吧，正常二三十年房龄的房子都不会漏水成这样，这房子质量也太差了，当年怎么通过验收的,0,27,0,2022-07-20 07:59:19,来自江苏,92398743660,Yangexing
7122239092716782374,我是专业防水20余年了。这个屋面很简单，屋面开挖的地方，坚决不能用开挖出来的渣土回填，一定要用新的混凝土现浇。渣土回填，一旦屋面其它地方渗水，流到开挖处，渣土回填的地方又相当于保温层了。重新吸满水，久而久之就又会渗漏。开挖出来的地方，一定要找到漏水点的裂缝，先处理裂缝，再做防水，防水做好后做闭水试验，48小时无渗漏现象，再浇混凝土。最后再在浇混凝土面层上做SBS防水卷材。,5,65,0,2022-07-20 08:07:14,来自上海,103055826975,川怡防水
7122224614294176547,几大怪像：1十几年的房子成危房，2漏水越修越漏，3裂缝越修越多！,1,44,1,2022-07-20 07:10:20,来自江苏,6103776513,龙腾飞猪
7122211136761643808,现在有多少房子不偷工减料的，装修房子也是，防水材料都能参水，都成习惯了，好像不搞点小动作就没办法做事。,3,115,1,2022-07-20 06:19:32,来自上海,6858407961,TD123色拉油
7122216693421818665,居民的房屋漏水问题解决不了，干嘛还要物业存在？一个物业这些事情都没有办法解决，漏水问题是头等大事，外面下大雨，家里下小雨，这日子怎么过啊,12,90,4,2022-07-20 06:39:38,来自上海,1226654542214104,勇敢的小鱼儿喜欢自由
7122250215042237217,我家也是屋顶漏水，已二十年之久物业修了无数次，楼上又不配合觉得跟他们家无关，每天台风季节担惊受怕，怎么办，求帮忙！就不能买平顶的楼房，平顶楼房10个里面8个漏。我就不明白了，屋顶为啥要建平的，连老祖宗房子屋顶都是斜的，现代人的想法真奇怪🤔,0,0,0,2022-07-20 08:50:40,来自湖南,659343548362200,细心布莱恩6A
7122221830643499810,楼顶真是被修理的掺不忍赌，这种平顶老楼房年份长了漏水是通病，主要是排水沟不通畅，下暴雨来不及排水，还有楼板有裂缝引起漏水，要治好漏水代价很大！,3,4,0,2022-07-20 06:59:37,来自上海,2484528114569027,敏锐布莱恩5I1
7122097754885276427,04年的房子成年久失修的危房了…,2,61,0,2022-07-19 22:58:54,来自山东,63860252814,豁达星空i
7122081240035214113,平改坡就能解决的事，为什么不做，六楼的自己出点钱也愿意。,10,64,3,2022-07-19 21:53:57,来自上海,23178558473,酸甜苦辣咸生活五味子
7122225530568917772,那里的房子在造的时候不就是豆腐渣工程吗？刚造好就倒掉了一幢楼，这种房子还有人买。,4,32,3,2022-07-20 07:14:51,来自上海,958427483613630,进取开心的溜溜
7122260584476721960,搞不懂，农村自建平方很少有漏的，到了商品房这里顶楼很少有不漏的，这些开发商的水平还没农村施工队高吗？有没有专家出来解释下,3,0,0,2022-07-20 09:29:31,来自山东,82092045807,一笑647
7122220613850792737,自己掏钱修啊，顶楼自己维起来，刷水泥，做防水，贴瓷砖，妥妥的,4,4,0,2022-07-20 06:56:24,来自浙江,347071780229623,Eagle6868
7122245006282949416,看了这个案例应该知道如何进行旧楼改造了吗？不光装电梯？有比装电梯更严重的老旧小区需要维修改造，勿略关键核心，那可以怀疑旧楼装电梯不光解决老人下楼？更有笫三方施工利益在内？只要居民出资工程基本断定不是免费午餐？,2,7,0,2022-07-20 08:29:19,来自天津,3554056855361358,雅杰
7122245783369663269,"住顶层的好处：住得高看得远。
价格还便宜！
坏处是:容易漏☔️，冬天更冷夏天更热！就像现在其他楼谁愿意跟你一起去大修？最后说明一个问题：买房子最好不要贪便宜买顶层！因为以后你要为买房子时候的便宜买单，还受罪！有同意这个看法的吗？",2,3,0,2022-07-20 08:32:40,来自云南,105037574192,没心没肺开心每一
7122237133468795648,止水钉就是个伪命题。堵漏不能从逆水方向堵，越堵越漏。最好把整个屋顶统一做层防水，再改成坡顶，才能从根本上改善屋顶漏水现象,1,12,0,2022-07-20 07:58:37,来自安徽,13682625854,映日果子鱼
7122036298168353548,想要三分之二的业主同意动用小区维修基金，来为10户人家维修屋顶漏水，推动起来不容易吧[吃瓜群众][吃瓜群众][吃瓜群众],8,32,0,2022-07-19 18:59:52,来自上海,3883086064125691,魔都喜羊羊
7122254985916302118,保温层出问题了，2004年屋面保温层流行“膨胀珍珠岩保温板”，一旦小漏遇水就膨胀，破坏防水层，造成漏水，维修没有方向的。而且这水非常的毒，工人维修不戴手套碰着，手皮要溃烂，拆卸下来放在地面上淋雨后连草多死掉，说的难听的绝对是致癌物质。解决必须整个屋面全部铲除至结构层，按现在的防水规范重做。,0,5,0,2022-07-20 09:09:04,来自上海,71448561545,shqyl
7122199325140419363,莲花新苑是由上海闵行城建开发有限公司于2004年建设的，房屋年久失修，顶层10户人家的漏水问题，简单的修修补补根本解决不了问题，这个压根不是维修问题，这个是质量问题，才十几年而已,14,106,1,2022-07-20 05:33:15,来自安徽,52359062529,冬天不下雪18
7122254228772602663,看到屋顶那么多太阳能就知道问题在哪里了@_@,0,5,0,2022-07-20 09:05:44,来自上海,55012780051,微小幸是我
7122230410566239007,房屋质量确实不好，农村自建住房几十年也不会这样,1,10,0,2022-07-20 07:33:19,来自湖北,103471793679,百战映像
7122270828716131086,屋外倾盆大雨屋内大雨倾盆，住这样的房子揪心无奈，赶紧给修修吧,0,2,0,2022-07-20 10:09:42,来自北京,413027047324013,松龄鹤寿
7122225877785838336,直接上面挨着顶楼四周围墙做一个蓬应该会好很多，不过不要做太高,2,12,3,2022-07-20 07:15:08,来自上海,2937548950996416,卜丁卜卜
7122237749319025441,物业收的物业费不找专业的人员修这是在胡闹，所有这个楼的业主找物业赔偿,0,10,0,2022-07-20 08:02:03,来自山东,109219296992,率真南北方行
7122243572636107554,房顶漏水不要找小工程队乱修，如果破坏防水层，水会到处窜，渗漏更严重。上海的小区如有渗漏问题，可以跟我联系，我们是防水材料生产厂家，维修工程质保5~10年不漏。,0,7,0,2022-07-20 08:23:41,来自上海,65591962028,火星三元子
7122250749996401421,莲花新苑日浸月泡之下，屋发霉、墙开裂，小区顶楼10户人家提心吊胆也该修整解除隐患，安全第一……,0,5,0,2022-07-20 08:52:09,来自广东,761313505850984,头条D新仔
7122249778557207334,物业明显缺乏维修技术，把小漏修成大漏。吓死人了。,1,8,0,2022-07-20 08:48:21,来自广东,2085110732818775,微风吹散雾
7122172575148802851,重做成人字型屋顶，隔成架空层，不漏水，又隔热，。,4,50,1,2022-07-20 03:54:47,来自四川,68876703656,佳丽思家装饰
7122238323594461985,我国造的房子顶楼基本上都会漏，我们小区顶楼家家漏，基本的都做不好，还做高科技,1,6,0,2022-07-20 08:04:14,来自上海,51624591205,132882403
7122268700966798084,以前房管部门，三年小修，六年大修。现在有物业管理，没专业的技术，临时工多。基本是扫扫地，换个灯泡，就可以了。重要任务就是收物业费！,0,2,0,2022-07-20 10:01:44,来自上海,980386484586788,多彩可乐Ky
7122224078810874658,很简单，再简单不过的事，原有房屋上面的水泥，保温板千万不能破坏，谨记，切记，让外行的物业把一丁点小事搞成天大的事，俺是搞建筑30多年经验，每平方米成本3百元不到可保N年不坏事，可笑的外行物业，可笑的外行执行者，？？？？？,0,24,1,2022-07-20 07:07:57,来自浙江,100379510189,心神气
7122222776421073703,04年建的房子就叫年久失修,1,21,0,2022-07-20 07:04:17,来自贵州,73776476423,幽默豆浆m2
7122256396720358185,楼破破最怕雨，还不知找谁去。,0,0,0,2022-07-20 09:13:20,来自浙江,54290978767,独孤谜探
7122217201344185123,“小区业委会“停摆”，由居委会托管，大修方案要征得三分之二业主同意，才能实施。”——小区业委会“停摆”是关键，居委会托管，居委会有权能决定动用“维修基金”吗？如果没权力，大修的费用如何解决？房顶漏水大修的问题可能面临像多层楼安装电梯一样尴尬的局面。经费怎么摊，资金何处来？,1,14,1,2022-07-20 06:41:55,来自上海,5363439313,踏遍青山52108330
7122089406018077474,这样的房子一开始建的时候就有问题。现在上海的房子其实已经一代不如一代了。物业管理就更不要说了，除了退步一无是处。,5,73,1,2022-07-19 22:25:19,来自上海,6579942894,菲菲97199299
7122252670198530831,我家小区也是漏水严重，现在居然物业都没有了，清洁也没人管，小区内车子乱停乱放，脏乱差,0,4,0,2022-07-20 08:58:47,来自四川,1759675819494942,快乐波波姐姐
7122278586563937054,重做成人字型屋顶，隔成架空层，不漏水，又隔热，。,0,0,0,2022-07-20 10:39:51,来自江西,1710458337235127,才思敏捷玲姐姐
7122232067882615589,保温层这个技术根本没有过关，许多房子外立面墙面掉落，现在这个屋顶漏水，都是和保温层有关。房子的质量才是应该重点关注的。而保温层还是不要使用的好。现在这个是越修越漏，说明修理技术一塌糊涂，现在这个房子看起来需要整个屋顶重建了，修修补补已经解决不了问题了。,0,7,1,2022-07-20 07:39:50,来自上海,245923932286083,浦江畔
7122210665452045091,开发商偷工减料省成本的后果！让住户承受痛苦，物业管理服务跟不上，顶层楼的人怨声载道。谢谢记者为民发声！,0,47,1,2022-07-20 06:16:31,来自黑龙江,3299298333,微言勿喷
7122214258452218635,04建的房子，到现在还不到20年，就年久失修了？,1,4,0,2022-07-20 06:31:44,来自上海,6232922030,滴水湖畔
7122213318802391823,其实这个漏水问题很好解决，一个办法就是评论区里说的平改坡，从屋面构造上进行改善，另一个办法就是清理屋面杂物后，做防水修复，最好是外漏型材料，降低屋面荷载！,2,15,2,2022-07-20 06:26:33,来自上海,70082116207,沪漂小温
7122045181293626119,想到小时候我家屋顶外头大雨里头小雨。落雪屋顶天窗隔缝里毛毛雪鞋子放在大床底下。祖宗遗留老木头梁瓦片后来大队修建队👌,0,10,1,2022-07-19 19:34:21,来自上海,100414206224,爱生活的河流PGQ
7122176628801061643,在上面盖一层彩钢瓦，架空的！OK！,3,17,0,2022-07-20 04:14:18,来自湖北,1371795917665624,追风逐月往事如烟
7122239168599671563,物业就是外行，应该负主要责任，赔偿居民损失。,0,5,0,2022-07-20 08:07:18,来自上海,81424769989,青涩星辰nS
7122248815368799014,国人都能上天揽月，就是房屋顶楼漏水的问题解决不了，真的服了[酷拽],0,3,0,2022-07-20 08:44:43,来自河北,110907630501,墨羽倾璇Anne
7122263977366799107,我家顶楼就不漏，因为收房后，也有点漏，我马上请工人彻底搞了防漏工程，台风来了都没问题。,0,0,0,2022-07-20 09:43:24,来自贵州,103226210307,正义凛然风姿卓越丽丽
7122016128968278824,物业明显缺乏维修技能，把小漏修成了大漏，眼下物业应该抓紧时间请专业维修人员把屋顶渗漏问题快速彻底解决，让深受其害的居民早日过上安稳的生活。,3,40,1,2022-07-19 17:40:46,来自上海,66053743865,一无言无语
7122255705377293087,虽然我不懂维修，但是这个房顶涂家里装修用的防水，在上面再抹一层水泥四周低的那种，再在周围高出来的房檐钻上排水孔不行嘛[捂脸],0,0,0,2022-07-20 09:11:06,来自山东,93174768966,心意0依然
7122235570227266311,房屋建造质量堪忧,0,4,0,2022-07-20 07:53:25,来自上海,2700826695698636,热情的糯米6C
7122249218475459369,我家顶楼，漏的是空调机位，隔壁把放空调机位占了，物业把地漏堵了，于是乎往家里渗水了,0,2,0,2022-07-20 08:45:31,来自江苏,123574904165070,乖咪妈咪
7122217951285347076,才十几年的房子就这样了，太恐怖了[捂脸],0,13,0,2022-07-20 06:45:42,来自上海,3039828750,小兔乖乖5029238
7122237329661510436,凡是坐顶层的同胞们，隔三差五的还是自己上楼面去检查检查下水囗是否有青苔类的堵塞，必要时清理一下，也花不了多少时间。不要老是等物业派人去处理，物业很难做到全面的`。否则吃亏的绝对是业主自己,0,4,0,2022-07-20 07:59:50,来自四川,52593611850,一往无前春风34
7122112872633041699,看楼下酒店屋顶是黑的，旁边楼顶有三家是水泥的，,0,1,0,2022-07-19 23:57:07,来自山东,6933661230,木易木易my
7122265720826217229,我家住在老旧小区住在四层，一到下雨外边下大雨，我家小雨都得拿盆接水，我们老旧小区最高是五层。,0,0,0,2022-07-20 09:50:12,来自北京,68445737327,萍萍淡淡162
7122267675060896552,把原防水层揭掉，底部哂干，重新做防水！避开下雨天！,0,1,0,2022-07-20 09:57:03,来自甘肃,4280124378,12346水
7122271245684507426,2004年的房子 就算年久的房子？？我们这90年代的房子都不会这样 质量差质量差 说个实话这么难吗？？？,1,1,0,2022-07-20 10:10:59,来自福建,59235065831,佑宝家
7122254710945514244,看了文章知道了不能买这种平顶的顶层房子，以前还觉得顶楼的房子是个宝呢！,0,1,0,2022-07-20 09:07:24,来自江苏,104740592227,十九是只可爱的狗
7122223475623854889,物业明显缺乏维修技术，把小漏修成大漏。吓死人了。,0,6,0,2022-07-20 07:05:52,来自上海,3913903433057456,用户李菲儿
7122244714677814019,2004年的房子，居然说年久失修！有辱词汇！,1,3,0,2022-07-20 08:29:06,来自山东,12107482779,瓢哥已变瓢大爷
7122248763741356803,2004年的房子叫年久失修？,0,3,0,2022-07-20 08:44:33,来自上海,22549263595,窗边的小豆豆1217
7122234379220370207,坑弄大了才好动用业主的大修基金啊！不然怎么赚钱呢,0,3,0,2022-07-20 07:48:32,来自上海,6075060214,过眼云烟lcl701017
7122249420132844292,贷款还 没有还清房子 成了危房，十几年也不算太久可想而知现在房子的质量令人担忧。,0,2,0,2022-07-20 08:46:49,来自上海,52589897862,俊俏阳光y
7122244791064806157,应该要平改坡，否则很难根治顶楼漏水问题。,0,4,1,2022-07-20 08:29:03,来自上海,58510921884,鄙视罪恶的小三
7122277759472812837,上海闵行城建开发有限公司于2004年建设，房子能破成这样？顶层10户人家的漏水问题，简单的修修补补根本解决不了问题，必须整层整体维修。,0,1,0,2022-07-20 10:36:50,来自上海,5812481291,土豆就是土豆
7122249169557521187,2004年建的房子“年久失修”,0,2,0,2022-07-20 08:45:34,来自上海,2818494557,日月130019941
7122027491006448414,就怕为了钱才修，没有好处就不修。屋顶漏水，小区业主共有，物业小修造成大修，有没有责任？,1,20,2,2022-07-19 18:25:27,来自上海,5812481291,土豆就是土豆
7122279265341211407,良心建筑商啊，免费修建水帘洞,0,0,0,2022-07-20 10:42:07,来自江苏,409472727780087,嘤嘤嘤剪辑
7122256010240279304,我家也是顶楼，一点也不漏水,0,1,0,2022-07-20 09:12:12,来自上海,55576703419,勇者豆花3j
7122222624112968489,南方房子真的不宜平顶,0,7,0,2022-07-20 07:02:22,来自上海,103652484941,用户清和253177526705
7122220789222933279,第一次就应该平改坡！我家顶楼10年的房子，从来不漏,0,3,0,2022-07-20 06:56:17,来自上海,110597829421,时间的果果
7122259555027469093,十几年的房子漏成这样，现在买房，房贷就是三十年，是不是房贷还没还完房子就不能住了,0,0,0,2022-07-20 09:26:14,来自山东,58689589195,七星椒789
7122227498112811810,重做成人字型屋顶，隔成架空层，不漏水，又隔热，。,0,4,1,2022-07-20 07:21:27,来自北京,3501312487198480,微笑旭日6y
7122278040889082665,我家以前頂樓复式，漏成水帘洞，物業不作為，求助无門，掙扎幾年，去年終于淺買成功！！！,0,0,0,2022-07-20 10:37:10,来自湖南,5813770789,和气生财xh4a
7122257537692549888,我们小时候见过茅草屋，也会漏雨,0,1,0,2022-07-20 09:17:46,来自上海,105861906786,cjuan5
7122235388361949989,记得多年前也是那个地方有整栋楼的倒塌事件，看起来当初没选择买那里的房子是完全正确的,0,4,0,2022-07-20 07:52:33,来自上海,135978647292039,自由糯米h7
7122250709562589987,做防水的人偷工减料，绝对不应该用渣土回填，即使开挖后防水做好闭水测试通过，渣土回填也会再次造成新做的防水层破坏，至于防水卷材裸露在外面日晒雨淋加之可能沾接不好，绝对是修了个寂寞。,0,1,0,2022-07-20 08:51:10,来自上海,4195324808673966,单纯海风VH
7122236973007733504,找开发商讨个说法,0,4,0,2022-07-20 07:58:06,来自云南,1399046542199280,芷萱的外婆
7122204923969946409,承建单位的无良施工，物业的无知乱修乱建才造成如此局面，此楼层如想住人危机重重，望有关方严肃正确处理，还业主安全感！,0,22,0,2022-07-20 05:54:31,来自广西,3997457212250904,沉着漂流瓶l6
7122279933967336229,2004年的房子，修成这样，不到二十年，父母家上世纪80年代的房还好好的，真的是让人无语了。,0,0,0,2022-07-20 10:45:15,来自广西,3887467083349773,正义凛然香瓜VD
7122265658704511785,我刚买的小区就是04年的房子，平改坡的,0,1,0,2022-07-20 09:49:27,来自上海,2027941391514492,七五
7122266839044539136,应该找专门做防水的的去修，物业有几个懂的，越修越漏。,0,1,0,2022-07-20 09:54:02,来自上海,1240677380815517,为了春晚
7122264091129430820,楼上是挖的游泳迟吗？,0,1,0,2022-07-20 09:43:57,来自上海,81709158680,有一说一IV0G
7122209058371306275,平改坡就能解决的事，为什么不做，六楼的自己出点钱也愿意。,0,11,0,2022-07-20 06:10:19,来自上海,61184060966,王小冬冬541301
7122266714192741152,不是修不好，而是无利可图。我老妈家也是顶楼，十年房龄还不到，也是下雨天就漏，物业修了多次都没修好，后来自己出了一万多元钱，再请他们修，好了，现在不漏了。你们说，是什么问题。,0,1,0,2022-07-20 09:54:31,来自上海,71053545363,冯琦49
7122234522871694115,70年产权现在才多久？这房子算是完蛋了。,1,5,1,2022-07-20 07:48:47,来自上海,92773599938,优淼宇鸿
7122256995876733703,我家本来是顶楼就因为漏水，和别人换了楼下面积小的,0,2,0,2022-07-20 09:16:18,来自上海,92457267118,红275156181
7122214364140192553,危房很危险，修补多次无果，拆了吧,0,6,0,2022-07-20 06:30:38,来自上海,1626865466869854,多才香瓜S
7122068176116089641,质量太差了[捂脸]我老家平房都住了40多年了。从来不漏雨,1,15,1,2022-07-19 21:02:44,来自上海,3803942427567374,乐天派河流lo
7122249311752258336,才十几年的房子就这样了，太恐怖了[捂脸],0,2,0,2022-07-20 08:46:43,来自上海,4592869148,庄芸2
7122212416972833577,国人都能上天揽月，就是房屋顶楼漏水的问题解决不了，真的服了,0,9,0,2022-07-20 06:23:21,来自江苏,58270132383,忙碌每天2
7122266570709517093,劝君买房千万别买顶楼，再便宜都不能要！后患无穷哪！,0,1,0,2022-07-20 09:53:20,来自福建,21595827541,声琴并茂
7122243488104170281,顶没做好，重新返工。墙体打钉灌浆，用聚氨酯气泵灌入。做防漏处理。,0,2,0,2022-07-20 08:23:25,来自上海,5984815246,真诚鲸鱼巴克
7122245397158527781,上海康城1997年，98年造的房子，小区里从来没听说过什么顶楼漏雨啊，漏水呀，那么多房子没听说过，造房子的时候用点心就不用修房子的时候多费心,0,3,0,2022-07-20 08:31:26,来自上海,80108811696,平凡的爱国者
7122237286863209220,找物业赔偿，物业跟本就不会修,0,4,0,2022-07-20 08:00:18,来自山东,109219296992,率真南北方行
7122220917560279842,2004年建的房子怎么会漏成这样，为什么沒有平改坡呢？,0,3,0,2022-07-20 06:56:08,来自上海,61852455183,木子1708375
7122228381990617860,顶上重新浇一层防水层，再做一个彩钢板的屋顶就没问题了,0,2,0,2022-07-20 07:25:34,来自上海,4571376833,華衛平
7122264979998294784,不敢相想：70年的产权，只有十几年变成这样了，这个问题怎么解决呀？,0,3,0,2022-07-20 09:46:35,来自上海,2000766459709534,秀秀理想的老太太
7122253008905847593,平顶房的落水管需要经常疏通，否则时间长了会堵，房顶长期积水肯定会漏水，物业费低的楼盘不能支撑维护成本，年年补吧,0,1,0,2022-07-20 09:00:27,来自上海,9794660483,你们可以0910
7122209818424918788,我刚才查询了一下，就这房子二手房均价在7.3万一平方米[泪奔][泪奔][泪奔]你让我情何以堪……,1,5,1,2022-07-20 06:14:32,来自上海,4234944867219995,充满元气的神秘精灵
7122222099083264802,房屋渗水，漏水都变成全国性大问题了，难道就一点办法都没有吗？,0,6,0,2022-07-20 07:00:50,来自上海,62314972706,东海冰柱
7122250090089775883,平改坡解决问题啊……,0,1,0,2022-07-20 08:49:49,来自上海,105913988951,一个无所事事的浪人
7122249800527151875,住了十几年的房子就成了这样，真闹心，买房子还是不能买顶层呀,0,2,0,2022-07-20 08:48:35,来自广东,1508136843746398,用户快乐啄木鸟
7122234616585077539,04年的房，屋面防水材料已老化，裂缝，要么平改坡，要么顶面全部做防水，修修补补没用。,0,3,0,2022-07-20 07:49:07,来自江苏,110001671842,动舞439
7122218903556211469,10多年房子就成这样？质量太差了吧？,0,4,0,2022-07-20 06:49:02,来自上海,3236565955132151,微评阁
7122225706209788712,一看到闵行、莲花这些关键词就想到楼塌塌,0,2,0,2022-07-20 07:14:35,来自广东,56934552564,镜像35
7122232415246025485,屋面漏水小修小补根本解决不了问题，只有重新做卷材防水，这个物业把小洞补成了大洞,0,2,0,2022-07-20 07:41:02,来自上海,89351934968,花无缺人有戏
7122264720454746891,这样的房顶就全部从作防水，整栋全作，关键是漏水口那防水作好，，再一个就是防水高度要勾高，水口不够，少，也会漏水,0,1,0,2022-07-20 09:46:36,来自吉林,5865644839,阿凡提69190627
