7129791652902241027,一个中国原则就是对台海现状的清晰界定。违背、挑战一个中国原则，就是改变台海现状。汪文斌驳斥太给力了！,1,722,0,2022-08-09 16:34:59,来自北京,61509905767,花儿朵朵1699
7129815591166870313,不是说理的时代了，是凭实力的时代了，中国要强大啊！,7,575,0,2022-08-09 18:07:01,来自安徽,3580391880,徐老师物理学堂
7129869686149661455,为外交部发言汪文斌坚定有力的回答点赞[赞][赞][赞],0,24,0,2022-08-09 21:36:37,来自上海,59145281716,幸福菠萝莲花
7129801405979689763,美国用国内法长臂管辖别国之事，才是一而再、再而三地早就在改变台海现状！,1,354,1,2022-08-09 17:11:47,来自广东,3179436985817325,自在的老骥
7129854965853700879,两岸同属中华民族，既是历史也是现状，没有所谓的改变不改变！,0,51,0,2022-08-09 20:39:24,来自江苏,77980338634,kong3080
7129822561588232973,事情是你美帝挑衅而起，再三劝阻警告不听，一意孤行，才导致当今的局面。,1,104,0,2022-08-09 18:34:28,来自安徽,50513107767,繁字辈
7129837608918319886,改变现状是中国自己做主 中国要的就是统一。,0,32,0,2022-08-09 19:32:54,来自浙江,1688453474429832,淡泊的风铃hd
7129847539310232353,美国低估了我国进行统一的坚定决心，要在这个时候亮出我国的雷霆手段，粉碎美台勾连谋独的阴谋。,0,27,0,2022-08-09 20:11:34,来自广东,3237407459653339,LA188
7129820922625737475,我们志愿军先烈们为了抗美援朝报价卫国敢以血肉之躯打败美帝侵略者，为了解放台湾更加会不计代价打败一切来犯之敌！,0,101,0,2022-08-09 18:28:02,来自安徽,3162214130,天行者大郑
7129846842694812430,台海本就一家，家务事，自己解决。,0,22,0,2022-08-09 20:08:18,来自广东,51058528895,宁江12
7129836483838214925,"思路清晰，直击要害。
为大国发言人点赞[赞][赞][赞]",0,18,0,2022-08-09 19:28:25,来自湖南,5456652054,方块字小学生写字课
7129796175951233833,两岸同属中华民族，既是历史也是现状，岂能改变同属一个中国的事实？,0,127,0,2022-08-09 16:51:29,来自吉林,55463555097,清风古道M
7129822253629391616,掷地有声的回复，,0,31,0,2022-08-09 18:32:40,来自湖北,54138843166,初心召唤神龙
7129826585674564352,坚决支持伟大祖国，祖国必然统一[赞][赞][赞][赞][赞][赞],0,44,0,2022-08-09 18:49:29,来自贵州,5736625050,宠惠多
7129854171780121379,统一势不可挡，民心所向！,0,9,0,2022-08-09 20:36:25,来自四川,91703627660,唯我追逐
7129854876875899661,祖国尚未统一，解放军解放台湾依然使命在肩,0,6,0,2022-08-09 20:39:31,来自河南,3348557556,天地遥远
7129880848853467945,为中国外交部汪文斌发言人点赞！,0,3,0,2022-08-09 22:20:01,来自四川,106904681457,寒秋288
7129791943018267425,句句珠玑，针针见血，确实如此！坚决支持汪文斌！,0,32,0,2022-08-09 16:36:04,来自北京,61509905767,花儿朵朵1699
7129870514298290974,坚决支持国家的任何决定，祖国一定统一。,0,5,0,2022-08-09 21:40:21,来自湖南,107768151542,奋发微风0K
7129833534856381222,说的好！坚决反对一切敌对势力！,0,23,0,2022-08-09 19:17:23,来自宁夏,901230404578108,huanshui
7129839700068139790,是时候该出手就出手了,0,10,0,2022-08-09 19:40:51,来自江西,2396591442892168,洪城律者
7129833703840858884,美国一直在改变世界，唯一不变的就是把其它国家不断分裂、变小，从而从根本上消除竞争对手，妄想在地球上永久称霸！,0,34,0,2022-08-09 19:18:03,来自山东,51104489439,茶屋辉哥
7129849367586226983,打破台湾倚美图独的现状。,0,9,0,2022-08-09 20:18:26,来自辽宁,92465728559,寒冰7638
7129809983256347392,驳斥有力！为祖国骄傲！,0,34,0,2022-08-09 17:45:11,来自湖南,104228358180,為祖國而歌
7129859181863584553,这话讲的真是铿锵有力掷地有声！我们是用事实说话！[赞][赞][赞][鼓掌][鼓掌][鼓掌],0,4,0,2022-08-09 20:55:54,来自安徽,2836387392401863,远见卓识船帆uZ
7129867621038031650,美国不断地切香肠，终于切到了自己的手指！,0,3,0,2022-08-09 21:28:37,来自山西,57466659589,Userok
7129811600185230093,多少年也没用，中国必须统一才是真的,0,15,0,2022-08-09 17:51:48,来自内蒙古,101936266404,董国强819
7129809823302058767,必须赞[灵光一闪],0,15,0,2022-08-09 17:44:23,来自广东,4402879138,越秀长剑
7129817912797774605,统一祖国就是要改变，不然怎么统一？,0,18,0,2022-08-09 18:16:21,来自浙江,5500250289,阿秋123456
7129875806927029000,为了统一祖国，我们当然要改变现状！,0,2,0,2022-08-09 22:00:50,来自广东,54049736247,longyuhangchuan
7129809442740405022,变不变与他无关，这是中国主权。,0,17,0,2022-08-09 17:43:29,来自广西,52740116174,国君爱
7129818990570636039,当然是因为我们啦，我们的步伐始终在向着统一前进，想让台湾长期漂在外面？没门！,0,15,0,2022-08-09 18:20:45,来自广东,3144213812485374,陈虎008
7129829161954509600,美国喜欢倒打一耙，支持中国的任何决定。,0,8,0,2022-08-09 19:00:24,来自江苏,110926351445,勇往直前198561
7129861595442053924,對于臺灣問題，也可用普大帝的真理只在大炮射程之內的高見來看待。,0,1,0,2022-08-09 21:05:30,来自河南,93307833390,淡定葡萄S2
7129791329257194273,布林肯又玩甩锅游戏了！,0,4,0,2022-08-09 16:33:44,来自北京,61509905767,花儿朵朵1699
7129809855967757088,中国人民有不信邪、不怕鬼的勇气，有万众一心、众志成城的决心，更有坚决捍卫国家主权、民族尊严的能力[赞][赞],0,21,0,2022-08-09 17:45:37,来自四川,6276764386,zz1835989
7129818438780601122,中国自己的事，别人不用操心,0,9,0,2022-08-09 18:18:01,来自上海,3667624262643613,淡定海风03
7129815543397286689,不改变现状怎么统一呢？所以现状必须要改,0,8,0,2022-08-09 18:07:14,来自山西,110822488230,18392G4
7129824728671666979,"会说，能说，优秀的外交官。
反驳力度大。",0,6,0,2022-08-09 18:42:14,来自江苏,53387705477,一画化
7129879272537522985,现在就是要改变现状的时候了，七十多年太久只争朝夕！,0,1,0,2022-08-09 22:13:53,来自山东,24164550596,聪颖蜻蜓ET
7129865648536568609,不真正打疼他会变本加厉,0,2,0,2022-08-09 21:21:46,来自浙江,106093104081,盆景初入者
7129804799863702283,肯定要改变现状的，中国统一不改变现状怎么统？,0,5,0,2022-08-09 17:25:39,来自河北,64176766183,我就是个流量
7129835806252581662,开始明着赖了,0,4,0,2022-08-09 19:25:48,来自河北,4226975174500167,智慧湖泊3Y
7129883849412494118,早该变了。,0,1,0,2022-08-09 22:32:44,来自湖北,57402821191,谎言会被我揭穿
7129829487742845730,你打我一巴掌，还要说我为什么要生气，,0,3,0,2022-08-09 19:00:44,来自浙江,2063129965499197,不含糊
7129890806449603368,义正辞严，彰显大国风度和霸气！,0,1,0,2022-08-09 22:58:49,来自河北,95977204028,半梦半醒7123
7129825680883483396,掷地有声！,0,4,0,2022-08-09 18:46:32,来自广东,65356673020,辰尹
7129832310371386115,力量才是真理,0,2,0,2022-08-09 19:12:38,来自江苏,51997027945,穿越星际的鱼
7129847313157833505,跟敌人讲道理累不？,0,3,0,2022-08-09 20:10:38,来自浙江,3051851307027836,老哥WJM
7129873286422741798,真理只在大炮射程之内[赞],0,1,0,2022-08-09 21:51:11,来自河南,1464175567839820,嘟嘟嘟鑫鑫嘟
7129806265282724608,为何要听信美帝的话！,0,10,0,2022-08-09 17:30:45,来自广东,3030681085810391,诗意咖啡h0
7129855827661947688,真理在飞机大炮的射程范围内！任由你们乍说乍唱！我们做好自己的事就好[呲牙][呲牙],0,2,0,2022-08-09 20:42:50,来自广东,11577047079,城里猎手
7129839368835023650,不理他 按自己的节奏 该干嘛干嘛,0,2,0,2022-08-09 19:38:55,来自河南,3628018132852478,爱吃鱼的鱼8818
7129832747610227490,与时俱进，必须改变。如何改变，何时改变，改成何样，中国人自己决定。,0,2,0,2022-08-09 19:13:22,来自湖北,1182709760135293,热心风声cO
7129860975624389410,就是我们强大了才改变的，咋地了[抠鼻],0,2,0,2022-08-09 21:02:46,来自山东,65537666348,黑猫1207
7129816268588598047,改不改变不是美帝说了算！,0,4,0,2022-08-09 18:09:55,来自广西,50042060674,聪明才智D2y0
7129878557676913445,不用解释，直说：就改变现状了，怎么了？！迟早要改变，现在不变，何时变？！,0,0,0,2022-08-09 22:11:29,来自广东,96970584922,Whocan653
7129818897062134562,布林肯比蓬比奥更阴暗[呲牙][呲牙],0,7,0,2022-08-09 18:19:35,来自四川,96680104406,散户打板
7129868927290934049,布林肯说谎不怕脸红？？,0,2,0,2022-08-09 21:34:27,来自河北,6015975380,莫言其妙6015975380
7129886463684330253,无所谓了，大家都需要一个契机嘛！,0,1,0,2022-08-09 22:42:29,来自四川,2088684486929854,苍山如黛人生如梦
7129887189068497671,美国通过售台武器等方法一直在改变现状。,0,0,0,2022-08-09 22:45:28,来自广东,109923114399,随便扯别当真为为蔡
7129814455017407244,布林肯干啥啥不行，甩锅第一名[捂脸],0,3,0,2022-08-09 18:03:02,来自山东,105861463741,自投络网654499
7129801899947623171,早就应当改变[呲牙],0,10,0,2022-08-09 17:14:38,来自吉林,2242606742904908,不凡鲸鱼Z7
7129826808451023657,美国人倒打一耙玩的很溜,0,3,0,2022-08-09 18:50:19,来自江苏,4410868152155262,历史观察哨
7129817384180859661,布林肯真是大言不惭！！！！,0,2,0,2022-08-09 18:13:58,来自江苏,3168607184,神龙7755721
7129849460066337568,可是，我们就是期盼改变现状啊,0,1,0,2022-08-09 20:18:36,来自浙江,3483672948513271,自由观察员
7129840116239614761,强词夺理倒打一耙,0,2,0,2022-08-09 19:42:01,来自辽宁,1195896101147821,匚㤟苑
7129896261221794594,美帝以为世人都是瞎子和聋子吗？,0,0,0,2022-08-09 23:20:12,来自江苏,50917197823,我是ttsd
7129799276670681889,布林肯：我又没有牙，谁会相信我说的话。,0,13,0,2022-08-09 17:04:27,来自山东,96277539589,高冷原野Hx
7129800416447660835,问下布林肯:他老婆出轨了，要离婚，肯定是布林肯错,0,3,0,2022-08-09 17:08:09,来自浙江,81852095247,诗意海风z7
7129869180077343523,太解气了，畅酣淋漓。,0,2,0,2022-08-09 21:34:34,来自广东,624953624899357,佛系灿哥
7129818678467625760,无论如何，旧状况已改变，新的现状已形成。,0,4,0,2022-08-09 18:19:33,来自黑龙江,25321266559,随机观察者
7129807441084252962,布林肯才从政几天哦，懂都不球懂。,0,3,0,2022-08-09 17:35:10,来自重庆,5523126198,雨萱926
7129815404415238945,制裁布林肯,0,1,0,2022-08-09 18:06:59,来自浙江,3066255309,大仙193857923
7129837881094521614,布林肯是不是德云社函授学员啊,0,2,0,2022-08-09 19:33:35,来自湖北,6881077791,薇薇安闲逛
7129822839611507494,布林肯已经听不懂人话了,0,3,0,2022-08-09 18:35:32,来自广东,54940226542,日升汤谷1668
7129799725959922471,布林肯每一句针对中国的话，都是谎言！,0,2,0,2022-08-09 17:06:01,来自广东,3364131275290171,驿边梅
7129825403908571934,必须要改变啊！,0,3,0,2022-08-09 18:45:32,来自广东,1837972258034862,正直沙滩xd
7129870958139294501,和他们说不清，道不明,0,1,0,2022-08-09 21:41:51,来自山西,5366888067,冬雪飘白
7129846016097960745,布林肯：我说的话我都不信,0,1,0,2022-08-09 20:04:39,来自浙江,2867267759,12路公交车上的背包
7129824841913352997,这个是对方设置的辩论陷阱,0,2,0,2022-08-09 18:43:03,来自福建,91990853683779,天天杂谭
7129824814008910592,这是需要问问佩洛西吧[大笑][大笑][大笑][大笑][大笑][大笑],0,2,0,2022-08-09 18:42:38,来自山东,94816268067,老许看头条
7129839563069637411,美国的字典里没有无耻这个词,0,1,0,2022-08-09 19:39:53,来自山东,61961293147,幽灵岛剑客
7129837900648858406,喋喋不休的布林嫂,0,1,0,2022-08-09 19:34:17,来自福建,3350945150809966,专下好棋
7129828643580494624,你切香肠，我就包饺子！,0,1,0,2022-08-09 18:58:17,来自河南,60317969575,A正义行天下A
7129826692071523072,就改变了，你能怎么地吧[呆无辜],0,1,0,2022-08-09 18:49:58,来自浙江,5837893151,九座荒岛
7129823162006864680,霸气[赞],0,1,0,2022-08-09 18:36:20,来自浙江,848458654956312,mqj33222
7129814691383771916,夜长梦多啊,0,2,0,2022-08-09 18:04:30,来自山东,51807248324,伏虎53
7129817394679202564,无耻至极,0,1,0,2022-08-09 18:14:39,来自广东,681335056774461,太空遗民
7129878886137168644,是又怎样,0,0,0,2022-08-09 22:13:06,来自广东,76373078549,民富国强守住亚洲之光
7129845302424732429,强词夺理是西方强盗最拿手的,0,1,0,2022-08-09 20:02:15,来自湖北,70720981575,悟道酬勤之9
7129818741525005094,"中国有句古话，来而不往非礼也。
美国人玩火必自焚！",0,2,0,2022-08-09 18:19:55,来自四川,14750778986,allen016
7129853898478977830,西方人的思维已经妖魔化了，讲不通了，,0,1,0,2022-08-09 20:36:02,来自江苏,92856083111,exuN
7129851112035451685,中国有句俗话，当你用一根手指指着别人时候，别忘了还有四根手指指着自己,0,1,0,2022-08-09 20:25:00,来自浙江,1073573090302328,习惯性追未来
7129894203588952867,美国怎么会变的如此之虚伪？真的有损形象！,0,0,0,2022-08-09 23:12:23,来自江西,102089985481,吃钢饭
7129810188718572299,送布林肯一个字：滚！,0,3,0,2022-08-09 17:46:44,来自广东,4558020284,红尘逆行
7129876604813230863,我想骂人，大家不要劝我行不行？,0,1,0,2022-08-09 22:03:25,来自内蒙古,59481018556,湖城骏马
7129819134946951976,布林肯是鹰酱精英诈骗头目,0,1,0,2022-08-09 18:20:45,来自湖北,6649484211,金刀Man
7129796857618301707,布林肯精神病又犯了，要去神经医院了！,0,1,0,2022-08-09 16:55:07,来自广东,83046126795,坦荡的柳叶ac
7129821057036829481,无耻之徒！,0,2,0,2022-08-09 18:28:10,来自广西,77685104482,神剑黄金剑
7129860123694072615,美国用国内法长臂管辖别国之事，才是一而再、再而三地早就在改变台海现状！,0,1,0,2022-08-09 21:00:01,来自黑龙江,3315733614830861,大家喜欢的四哥
7129871081250603807,坚决支持伟大祖国，祖国必然统一[赞][赞][赞][赞][赞][赞],0,3,0,2022-08-09 21:42:20,来自海南,84387432323,江油凌氏书画
7129857751664083719,两岸同属中华民族，既是历史也是现状，岂能改变同属一个中国的事实？,0,16,0,2022-08-09 20:50:29,来自广东,1610108828138128,科技橡皮4g9
7129878422243345156,一个中国原则就是对台海现状的清晰界定。违背、挑战一个中国原则，就是改变台海现状。汪文斌驳斥太给力了！,0,0,0,2022-08-09 22:11:40,来自河北,93456879647,最爱梅西利物浦米兰
7129884769902887717,我们当然要改变现状，统一祖国！！！,0,0,0,2022-08-09 22:35:57,来自广西,55443830659,长城汉吴
7129844597459043102,中国人民有不信邪、不怕鬼的勇气，有万众一心、众志成城的决心，更有坚决捍卫国家主权、民族尊严的能力！[赞][赞][赞],0,2,0,2022-08-09 19:59:39,来自贵州,4292938343383789,亚平宁一抹蓝
7129858683907015462,一个中国原则就是对台海现状的清晰界定。违背、挑战一个中国原则，就是改变台海现状。汪文斌驳斥太给力了！,0,3,0,2022-08-09 20:54:12,来自浙江,6913690965,可靠枫叶RX
7129888689924129576,"中国人民有不信邪、不怕鬼的勇气，有万众一心、众志成城的决心，更有坚决捍卫国家主权、民族尊严的能力。
[加油][加油][加油][加油][加油][加油][加油][加油][加油][加油][加油][加油][加油][加油][加油][加油][加油][加油][加油][加油][加油][机智][加油]",0,1,0,2022-08-09 22:50:35,来自山东,3786368661591229,年过半百奔花甲
7129845142869443343,美方违背在中美三个联合公报中所做的承诺，在虚化、掏空、歪曲一个中国原则的道路上越走越远。,0,1,0,2022-08-09 20:01:26,来自山东,107946882841,用户7747933244788
7129879611244725000,回答很给力！有理有据，底气足！为汪文斌发言人点赞！,0,0,0,2022-08-09 22:16:04,来自浙江,4314938677930062,用户5073810650762
7129855665715348224,支持我们的外交部,0,1,0,2022-08-09 20:42:09,来自四川,56164795927,用户5616479
7129880159540839176,如果现状改变了，那中国就做对了，必须改变，不改变怎么统一？,0,0,0,2022-08-09 22:18:03,来自江西,92998072227,用户1462954114734
7129813386166338339,中国的台湾，没有所谓的改变不改变！,0,1,0,2022-08-09 17:58:16,来自贵州,2634019531145054,用户5747358363554
7129823192168153891,我们就是要改变现状,0,1,0,2022-08-09 18:36:26,来自天津,18011876233899,智者海浪A0
7129818343934346015,布林肯太无耻了！,0,1,0,2022-08-09 18:17:55,来自宁夏,106590062299,用户43864363773
7129833971768443648,美国傲慢，虚伪，无底线。,0,1,0,2022-08-09 19:18:07,来自海南,993563962516877,用户9089353407154
7129820702148281125,刚刚得到消息，布林肯已经得老年痴呆了,0,1,0,2022-08-09 18:27:06,来自湖北,6685183524,手机用户6685183524
7129862279453147940,统一势不可挡，民心所向！,0,2,0,2022-08-09 21:08:04,来自湖北,2897921390675443,用户8775656176129
7129823125952512775,每一次我都被美国的厚脸皮与无耻给震惊到！[石化],0,3,0,2022-08-09 18:36:27,来自广东,96155669451,林存存622
7129880644041360169,国民党成了民进党的跟班亦步亦驱，成不了气候,0,1,0,2022-08-09 22:19:13,来自安徽,83288089814,岁月静好270398901
7129861094134809381,现状也是我们中国的现状，是家务事，更与你美国无关,0,2,0,2022-08-09 21:03:38,来自福建,149147313256360,用户5182089591135
7129805070187299599,都是被你美国给逼的，我们只能提前实现国家统一了！,0,1,0,2022-08-09 17:26:12,来自辽宁,109835675715,勿忘备战
7129826485296972584,呵呵，老太太是哪国人？,0,1,0,2022-08-09 18:49:16,来自广东,2773565475,牛熊交割线
7129869498085770015,美帝国主义二战后什么时候对哪个国家论过理了？,0,1,0,2022-08-09 21:36:28,来自浙江,76312081724,路不熟669
7129828143128920868,好好好好好好好好好好好,0,2,0,2022-08-09 18:55:59,来自四川,50630370565,叁月风1
7129819965545005858,布林肯就是放了个屁。,0,1,0,2022-08-09 18:23:58,来自北京,923233082160248,多才多艺菠萝ZC
7129850730898948879,谎言帝国,0,2,0,2022-08-09 20:23:08,来自四川,71222576627,一只碗儿
7129806598452953863,美国贼喊捉贼是惯用技量，这种流氓让人不耻更不待见。,0,1,0,2022-08-09 17:32:17,来自浙江,7737346338,美名二三
7129802546432361250,美帝贼喊作贼，无耻至极,0,3,0,2022-08-09 17:16:19,来自陕西,3918258897169083,刑天舞干qi
7129805808409707305,美国贼喊捉贼，居心叵测！,0,2,0,2022-08-09 17:28:58,来自福建,59239092321,知音1605805
7129812829528015627,美国说话当放屁，就是个打屁虫，其他西方国家是跟屁虫,0,2,0,2022-08-09 17:57:00,来自四川,21825599278,聪颖云朵yy
7129820849942741801,恬不知耻，强盗逻辑的美国鬼子,0,1,0,2022-08-09 18:27:17,来自安徽,101912301069,十二82692
7129821046177383183,直接杠他，说美国说的都是屁话,0,1,0,2022-08-09 18:27:54,来自山西,101927170410,乘风破浪的星球XF
7129804095149540131,美国布林肯真是个狗娘养的，不得好死。,0,2,0,2022-08-09 17:22:17,来自湖南,96096645154,知情达理沙滩gi
7129817686355575589,布林肯这货估计和林肯一样下场,0,2,0,2022-08-09 18:15:27,来自浙江,8782659847,钢坛老铁
7129807149236552482,布林肯是个傻子，胡说八道！,0,3,0,2022-08-09 17:34:13,来自贵州,54627430376,哈哈儿1015
7129818908453913374,布林肯睁眼说瞎话,0,2,0,2022-08-09 18:20:02,来自江苏,53249239027,wang1960老土
7129801223095976708,布林肯是用嘴说话吗？满口喷粪！,0,2,0,2022-08-09 17:12:06,来自辽宁,3423809403,顽强松鼠H3
7129806179068281641,布林肯简直就是放狗屁[炸弹][炸弹][炸弹],0,1,0,2022-08-09 17:30:14,来自福建,2616464764842331,梦见武统
7129845365746434828,[赞][赞][赞][赞],0,1,0,2022-08-09 20:03:01,来自广东,23207845518,及以上
7129862561700971298,[赞][赞],0,1,0,2022-08-09 21:09:05,来自湖南,1328634210818739,苦哈
