7123049117261349635,实力派演员，我爱她,0,5,0,2022-07-22 12:30:02,来自河南,52477300040,陈七灵
7123092110152188704,为什么淳朴的东西能打动人心，因为现在的社会太浮躁了，怀念七八十年代，人与人之间的那份关系。,0,0,0,2022-07-22 15:17:02,来自湖北,11414266742,读书喝茶武汉
7123334009643795214,海清是位好演员，比那些流量明星强的N倍！,0,0,0,2022-07-23 06:55:00,来自辽宁,4165677082,鸿运当头76Z07
7123090044038660899,所以农业生产一定要机械化，要把农民从繁重的体力劳动中解放出来。我种过一分地累的我腰酸背痛大汗淋漓呀。,0,0,0,2022-07-22 15:08:29,来自北京,105628811102,玉城sun
7123076705740391198,再好也不想看，偏远地区还是有苦地方，,0,0,0,2022-07-22 14:16:57,来自陕西,4391245833,611720
7123063787288789798,为什么非得这种片子才能得奖？,0,0,0,2022-07-22 13:27:19,来自江苏,1777251783022775,蔚蓝蓝
7123358806012150532,十分喜欢海清,0,0,0,2022-07-23 08:32:01,来自河南,23376699890,秋风的韵脚
7123356739936322334,这篇文章虽然篇幅不长，但写得很好。写出了海清的内在思想。不是大多数八卦新闻。,0,0,0,2022-07-23 08:23:55,来自湖南,1041982283332611,高级糯米aj
7123326013765075752,这种演员很少了,0,0,0,2022-07-23 06:24:37,来自广东,474624443550910,睿智纳河6U6
7123061055193875203,演技好，能吃苦，,0,2,0,2022-07-22 13:16:16,来自北京,923220668849725,缭乱的风
7123330290584142604,一个有实力和演技的好演员,0,0,0,2022-07-23 06:42:16,来自辽宁,58980791244,煽风点火30
7123340117095596841,海清的巅峰还是玉观音里面，面试佟大为那个镜头😂,0,0,0,2022-07-23 07:18:54,来自重庆,3399324635512296,蒙古白海舰队司令
7123352170862510885,请大家关注一下农村生活及生活在农村中的人。,0,1,0,2022-07-23 08:06:09,来自山东,71849993987,花开富贵大婶
7123347883319608072,海清的实力有目共睹。[赞][赞][赞],0,0,0,2022-07-23 07:49:39,来自江苏,285507296179918,用户薛妈妈
7123347419735753513,专业，真诚，喜欢海清[赞][赞],0,0,0,2022-07-23 07:47:22,来自河南,110579106953,寻灵魂净土
7123358568631780131,海清长得不漂亮，但是专业态度好。,0,0,0,2022-07-23 08:30:22,来自河南,54371074179,积极的奋发有为鲸鱼
7123088685515965225,为什么非得这种片子才能得奖？,0,0,0,2022-07-22 15:03:05,来自河南,1297029235738948,用户柳国敏
7123105435116503816,一直很喜欢海清,0,0,0,2022-07-22 16:08:18,来自广东,92568271532,书墨尘
7123351479931011852,现在能体验生活的演员少之又少了,0,0,0,2022-07-23 08:04:01,来自北京,102181751284,没事277
7123092748269339407,我想问的是职业和非职业的一起合作，还很顺畅，那职业在哪？还是说非职业的如此有天赋？,0,0,0,2022-07-22 15:18:40,来自北京,193103418642718,平凡的中国女性
7123332301835993897,不看电视剧很多年了，大多是一个套路,0,1,0,2022-07-23 06:48:35,来自四川,56167874396,缁衣顿改
7123183230152852263,海清的名字没在第一个，是不是该带一句...排名不分先后。,0,0,0,2022-07-22 21:10:16,来自河北,111554499663,河北70后老乡
7123338331903492864,现在能体验生活的演员少之又少了,0,0,0,2022-07-23 07:12:03,来自重庆,6704047192,__106850333
7123317282008957730,现在能体验生活的演员少之又少了,0,1,0,2022-07-23 05:51:19,来自山东,4046622483285196,持秦砖扔汉瓦
7123333616180183819,这部电影让人很有点意难平,0,0,0,2022-07-23 06:54:45,来自湖北,892397083428263,qiuyang0019
7123068321313948429,啥时候上映？,0,0,0,2022-07-22 13:44:09,来自山东,101244330373,科学种养
7123082493989176064,有些地方还是很贫穷,0,0,0,2022-07-22 14:39:12,来自河南,1688463530266184,人间所有美好属于你
7123052946236932902,只要是嗑趁的演员，演技都好,0,0,0,2022-07-22 12:44:45,来自河北,5601923913,hui70hou
7123353338720256807,人民的好演员,0,0,0,2022-07-23 08:10:49,来自江苏,75980671720,Kiwi凌
7123063267085714189,这才是演员,0,0,0,2022-07-22 13:24:44,来自广东,5955709172,一双筷子一碗面
7123318652933735204,喜欢海清及她演得每个角色,0,1,0,2022-07-23 05:57:16,来自河北,59208389251,晨晓323
7123063093415936799,为什么获奖的都是这种题材的影片，搞不懂,0,0,0,2022-07-22 13:23:59,来自山西,430647009885119,墨染冰尘
7123193310071784207,现在谁还会为了一个角色花费那么多心血去体验生活，无论人物形象背景如何总要把自己打扮的油头粉面漂漂亮亮的，比划几下钱到手了走人,0,0,0,2022-07-22 21:48:45,来自浙江,19046547998,梦在想我2
7123089558770238242,其实，年轻人更应该多吃些苦,0,0,0,2022-07-22 15:06:33,来自河北,64627578705,子木的家
7123060056983634721,喜欢她演的没有原因就是喜欢,0,2,0,2022-07-22 13:12:43,来自甘肃,52286786456,作妈有作娃
7123068830008148751,海清，非常喜欢她[赞],0,0,0,2022-07-22 13:46:04,来自山西,93864579582,热心小猫QF
7123172064924058408,都认不出来了,0,0,0,2022-07-22 20:26:23,来自广东,105488820230,是凌萱吖
7123352372277003019,喜欢海清从电视剧《玉观音》开始。,0,0,0,2022-07-23 08:06:53,来自吉林,92856236279,温宏志12345
7123065017947636520,这才是实力派 突然间想起了金巧巧的那番言论,0,0,0,2022-07-22 13:31:15,来自内蒙古,3927871713979341,幸福柠檬7i9
7123351734017704712,这两幅剧照，有魅力！,0,0,0,2022-07-23 08:04:37,来自北京,106723826897,导演青宁
7123051128992236327,海清，超级喜欢她！,0,3,0,2022-07-22 12:37:56,来自山东,111070444140,小咬咬滴
7123333284427547426,有和我一样感觉篇幅太长的吗？,0,0,0,2022-07-23 06:52:33,来自北京,6373964985,美满人生l
7123063002701988608,有资格被称为演员。,0,0,0,2022-07-22 13:23:23,来自江苏,3445980438,刘新13919
7122964979380896544,写的真好！细腻，具体！,0,10,0,2022-07-22 07:04:41,来自安徽,4618039546,我是我001021
7123051596552143657,实力派演员,0,2,0,2022-07-22 12:38:58,来自山东,96446974673,道燃长苏
7123339172786144032,说句实话我10年没看国产电影了，这部影片一定要看。,0,0,0,2022-07-23 07:16:35,来自河南,81475935511,AB爱咋咋地AB
7123012182283305759,看看这才是真正的女演员[赞],0,6,0,2022-07-22 10:05:42,来自江苏,6555518563,明天会更好95728319
7123349742406828814,职业的精神成就职业的成功女性，贊你海青,0,0,0,2022-07-23 07:56:36,来自山西,16241866114,佛爷1745
7123359796866319140,别再演激娃 贩卖焦虑的大城市家长角色就行[我想静静],0,0,0,2022-07-23 08:35:33,来自江苏,93081202645,渴望信息的哲学家
7123322646644802311,海清是南京人的骄傲,0,0,0,2022-07-23 06:12:15,来自江苏,3756355399452032,优雅钢琴1g
7122798762476520223,我就想知道那个手机还要吗？还是用手捡起来了？,0,0,0,2022-07-21 20:18:14,来自四川,1362985669367902,克里斯大炮
7123135762572985125,抵制小鲜肉，,0,0,0,2022-07-22 18:06:06,来自四川,4368044787,51D神笔
7123322235154236200,敬业是成功的关键因素。,0,0,0,2022-07-23 06:09:47,来自山东,93636096741,囤龙
7123264584467333896,清者自清，浊者自浊！做人只要行得正，怕啥流言蜚语[灵光一闪][流泪][害羞][爱慕],0,9,0,2022-07-23 02:34:55,来自四川,4125785980930831,热心梦想家4l
7123358778137002786,去做你热爱的事，追求卓越。成功就会在不经意间追上你。,0,0,0,2022-07-23 08:31:04,来自山东,53657057040,烽巢
7123022102550496015,只有民族的才是世界的，现代的信息沟通越来越方便，世界大同之势越来越明显，而民族的印记只有在信息传播不发达的过去。,0,1,0,2022-07-22 10:44:33,来自河南,63074128870,1980zhi
7123109270669116175,不化妆，本色出演而已,0,0,0,2022-07-22 16:22:54,来自内蒙古,18855816401,moto19
7123053632710656799,值得表扬，可他们就是干这个的啊，这是工作,0,2,0,2022-07-22 12:47:02,来自山东,111095378567,江南雨客winner
7123094105588581120,只是做了应该做的事情,0,0,0,2022-07-22 15:24:14,来自辽宁,3271782701470880,孙哥颜姐蜗居行
7122715219524174624,为什么是公羊呢？母羊不行啊！[捂脸],0,0,0,2022-07-21 14:54:40,来自湖北,4591611397,深深太平洋底
7120873122022441764,陕甘宁都这样装扮,0,1,0,2022-07-16 15:46:14,来自甘肃,4189720670,一匹小凶许
7122966059707794176,这还是我们认识的那个海清吗[呲牙],0,2,0,2022-07-22 07:07:36,来自四川,3237403284738856,长天孤影
7123305407099323167,文章立意挺好的，但写得太琐碎了，还是应该提炼一下的。,0,0,0,2022-07-23 05:07:49,来自江苏,4014863101,君子与贤为友
7123348864920666914,忘我的进入角色也是英雄！,0,0,0,2022-07-23 07:52:47,来自上海,53211590335,徐伟人
7123165845576041251,你是我的神,0,0,0,2022-07-22 20:02:10,来自北京,4548837549,lebojerry
7123265055512511243,心居不好评价，个人观点勿喷,0,5,0,2022-07-23 02:39:04,来自重庆,5986193952,豪哥大花猫
7122596604984623884,还是公羊抗下了所有的错,0,2,0,2022-07-21 07:14:46,来自内蒙古,5722754109,小楼昨夜又东风61476157
7123334417007117096,海清：你不懂我的欢喜[呲牙],0,0,0,2022-07-23 06:56:53,来自重庆,5754013069,美好人生63089626
7123056436057309960,好像真的现在这样的剧容易获奖,0,0,0,2022-07-22 12:57:51,来自甘肃,976019218772365,小贝爱写作
7123353797216830242,有这样的职业精神拿适当的高薪才是应该的。,0,0,0,2022-07-23 08:12:03,来自湖南,2340180302279167,又是一年残雪尽
7123351255481172747,灵魂美，淳朴美，大美也,0,0,0,2022-07-23 08:03:05,来自北京,106496468728,tts386
7123051986337612577,抖音里的大西北不错,0,2,0,2022-07-22 12:41:16,来自山东,9571175984,一心一意的的喜鹊x3
7123339977995993869,海青实力很强[赞],0,0,0,2022-07-23 07:19:10,来自山东,3179403749101015,坦坦荡荡的时髦星球PQ
7123106858755932932,期待早日上映！🌹🌹🌹,0,0,0,2022-07-22 16:14:31,来自安徽,12118337340,衣画谢华华
7123065508932387622,海清都演成这样了啊[我想静静][我想静静][我想静静],0,0,0,2022-07-22 13:33:36,来自山东,1826767078,我是真诚的
7123340766197842728,永远的女神,0,0,0,2022-07-23 07:21:32,来自山东,2796763184891552,灵巧海浪H0
7123344054515188515,职业精神过关,0,0,0,2022-07-23 07:34:09,来自新疆,105530355651,光阴的故事986
7123056148877493005,这算是素颜照吧,0,0,0,2022-07-22 12:56:41,来自北京,7003233973,和平之父002
7122660400214164224,羊上。。。[我想静静][捂脸],0,0,0,2022-07-21 11:20:57,来自安徽,92496277401,王健天天
7123321515277550375,人生哪有容易，普通人也一样，或许更加艰难。,0,0,0,2022-07-23 06:08:31,来自山东,86724263176,无与伦比的爱
7123337695665095459,你不是摆款吗？,0,0,0,2022-07-23 07:09:33,来自广东,1525728023685015,自强不息山雀lw
7123318712660558607,真实生活水平哪里体现？,0,0,0,2022-07-23 05:56:30,来自北京,103208054407,暗明圆方土金水木火
7122656096040567582,茫茫草原一片黑。,0,0,0,2022-07-21 11:04:40,来自河北,57684963730,宗纪青
7123052269444645666,又可以到国外领奖了[发怒],0,1,0,2022-07-22 12:41:34,来自广西,58992118233,钱铺3
7123320330579854114,我就想知道疯读小说咋回事,0,0,0,2022-07-23 06:02:44,来自山东,58870544465,雨林沐风26
7123107748451582723,造型师厉害,0,0,0,2022-07-22 16:17:47,来自山东,5577633808,大湋啊
7122975244495373069,谁说她演出了村姑来着？,0,0,1,2022-07-22 07:43:51,来自吉林,1820381480497427,灬鬼修罗
7122648935130678057,甘肃省高台县拍的，九十年代初差不多就是这样的，各方面条件都差一些。,0,0,1,2022-07-21 10:36:40,来自北京,100900815347,爱民5373
7123033614375256836,男的演的比海清好,0,0,0,2022-07-22 11:29:43,来自山东,3923529921471056,赵少猫
7122978369876362018,这就是她的本色,0,0,0,2022-07-22 07:54:57,来自安徽,1472977958084020,一丝不苟香瓜hg
7123320491015668516,老了还想赚钱就是这个意思,0,0,1,2022-07-23 06:03:44,来自安徽,51848414951,依窗品雨8321
7123282424532009763,也蛮努力的！,0,1,0,2022-07-23 03:41:02,来自江苏,109801665822,阿立55151
7123355670422274857,现在还有人用小一年的时间去体验生活，应该是不错的一部戏,0,0,0,2022-07-23 08:19:14,来自北京,681324244909467,要起风
7122666809144673038,公羊在后面跳了吗？,0,0,0,2022-07-21 11:46:19,来自北京,3175819944935262,晚风轻抚麦香岭
7122446470455853858,是的,0,0,0,2022-07-20 21:30:35,来自四川,52780502643,安全行车一辈子
7121981457807229736,刚看了，,0,0,0,2022-07-19 15:26:32,来自四川,102679591218,00小仙芋
7123349788691153667,好电影,0,0,0,2022-07-23 07:57:26,来自上海,59750547834,热炙灼热
7121182960535569193,真的吗,0,1,0,2022-07-17 11:47:56,来自广东,53362098406,黄恩佑
7123316267632739111,实力剧就得有实力将来就位,0,0,0,2022-07-23 05:48:36,来自江苏,63317758458,汉卿518
7123330604548539170,艺术精神,0,0,0,2022-07-23 06:42:21,来自山东,50034352632,奋斗124411363
7123294276897342244,玉观音,0,0,0,2022-07-23 04:28:18,来自江苏,86307557741,郁州废人
7123051645721805602,中国电影在国外获奖的99%都是农村生活题材，各种贫困、各种受到欺压、各种伦理道德败坏，而国内的导演们也抓住了西方影评人的心里，只要拍反应中国落后、不民主、不公平的影片最少也有个最佳外语片提名！也不知是我们导演有问题还是外国评委有问题。,0,1,0,2022-07-22 12:39:06,,57610855070,十三春秋
7123087571777127198,这穿着打扮是五六十年代偏远农村吧，感觉太丑化了，拔高不可取，抹黑更不可取，为什么不能贴近现实生活？,0,0,0,2022-07-22 14:58:13,来自广东,56306580800,西关生活
7123346015247581959,舍得沉入生活去演戏，会是一个好演员，肯定比那些流量明星好太多了。就是脑残粉太多了。,0,0,0,2022-07-23 07:42:16,来自广西,52553958077,桂贵开心
7123113254771573511,这是演员的最基本的素质，俗话说得好，演什么像什么！大家记得《秋菊打官司》巩俐的表演吗？如果不仔细看谁知道那是巩俐，这才是真正的演员必备的素质。,0,0,0,2022-07-22 16:38:44,来自北京,1654078539575790,弘州一庶
7123062379654873897,"海清是演技派
甩流量星赵什么颖几条街",0,0,0,2022-07-22 13:20:56,来自安徽,3724744931159495,燕歌行2019
7122980670703567655,要表达什么？,0,0,0,2022-07-22 08:04:49,来自陕西,101280840639,尼古拉斯好奇1641
7123053692550693668,海清“毁容”了。,0,0,0,2022-07-22 12:47:15,来自上海,1820408446190990,承前启后源远流长
7123072307492356872,海青成名不是偶然的，是必然的。她能为拍好一部戏降贵纡尊亲身体验西北贫困地区的艰苦生活，那些年轻演员真的应该好好学习！,0,1,0,2022-07-22 13:59:36,来自辽宁,2111527661349915,用户9290508964039
7123248476305687327,喜欢海清和她主演的每一部戏，是个很好的演员。[赞][赞][赞],0,9,0,2022-07-23 01:29:21,来自甘肃,2871576327881374,用户1865480451194
7123351601825743657,海清是一个比较认真的演员，喜欢她的每个角色。,0,0,0,2022-07-23 08:03:29,来自上海,396274728450920,用户3023552464435
7123342965254636303,海清的演技真的不错，演员必须要像海清一样深入生活，才能塑造更好的角色，为海清点赞！[赞][赞][赞][鼓掌][鼓掌][鼓掌],0,0,0,2022-07-23 07:30:04,来自天津,99010818961,用户2627683990742
7123352573985915684,为敬业的演员点赞,0,1,0,2022-07-23 08:07:48,来自北京,54364773985,用户1360536246667
7123082926883046177,扎根农村，源于生活，一部泥土气息扑鼻的作品！,0,0,0,2022-07-22 14:41:19,来自山西,2875914912543400,用户2411611134584
7123332314050151201,海清是个非常优秀的演员，她的实力大家有目共睹，喜欢看她饰演的影视剧！,0,0,0,2022-07-23 06:49:52,来自河南,2137074723467006,用户8923898409641
7123350569054028557,海清很个正能量的好演员，喜欢,0,0,0,2022-07-23 08:00:04,来自重庆,100612624494,用户6387621136249
7123319146531717921,很喜欢海清主演的角色，是一位有实力派的演员。点赞！,0,0,0,2022-07-23 05:59:25,来自甘肃,71820976572,用户4102265826985
7123280002061714211,海青演每一个角色都很入戏，很好看，她本人很有气质，很高贵、大方很喜欢看她时作品。,0,3,0,2022-07-23 03:33:22,来自山东,1349841293684893,用户2900706233562
7123342954479141632,最早在落地请开机里发现了她 和孙红雷淹对手戏 感觉她爆发力很强，在戏中戏份不多但是每次出来都能让印象深刻，一个配角感觉应该和孙这个主要在一起飙戏 就应该越来越火的,0,0,0,2022-07-23 07:29:54,来自山东,104995754033,用户104995754033
7123348568048157443,最喜欢海清主演的电视剧，个个 好看，她的长相就讨人喜欢的,0,0,0,2022-07-23 07:52:40,来自河南,3271760263777581,用户814902899248
7123321096564359936,特别喜欢海清演的电视剧，真实，演技高，她有一种对演员的专业精神，[赞][赞][赞][赞][赞],0,0,0,2022-07-23 06:05:30,来自山西,3905068077941591,用户8073951
7123342784135791396,喜欢海青演的戏。一个很有演技很用心去做事的演员。,0,0,0,2022-07-23 07:29:35,来自江苏,79179310406,用户2272765729939
7123355250794644257,还是中老年人那一代演员功底好，现在的年轻演员差的不是一星半点。,0,0,0,2022-07-23 08:18:27,来自山东,827297052243619,用户7352752413814
7123312068639359752,我很喜欢看海清演的每个作品，实力派演员,0,1,0,2022-07-23 05:31:00,来自北京,1362998428964190,用户4727587740001
7123340066273248037,海清演的每一个觉色都喜欢，非常真实！,0,0,0,2022-07-23 07:19:21,来自河北,2375419955533479,用户2473343940638
7123339767492018944,海清是个敬业的好演员,0,0,0,2022-07-23 07:17:31,来自天津,1750847970617091,用户5684344899531
7123341292523979553,喜欢海青演的戏，一个很有演技的演员，不做作。,0,0,0,2022-07-23 07:24:21,来自黑龙江,2312974859249992,用户3592771704070
7123354836254442272,喜欢海清的表演简直太好看了,0,0,0,2022-07-23 08:16:43,来自四川,3844359489847774,用户2648735463218
7123328731808416549,海清演技不错！是很有实力的好演员！,0,0,0,2022-07-23 06:35:39,来自山东,1864391053805791,用户3605337402236
7123340185932284685,海青的演技好，是个好演员！[赞][赞][赞][赞][比心][比心][比心][比心],0,0,0,2022-07-23 07:19:49,来自江苏,99904410835,用户7655945646290
7123344091912028963,海青好样的，喜欢看海青演的戏。,0,0,0,2022-07-23 07:34:33,来自重庆,118368670591623,用户9925599096969
7123341831626277632,人民需要这样的敬业演员！,0,1,0,2022-07-23 07:25:25,来自天津,698880342897107,用户1249417629382
7123359444759167748,海青真实，用心，望没演技的一天不要把心思花在整容上，这个行业都用心了就行了,0,0,0,2022-07-23 08:34:53,来自新疆,835250527679860,用户1629879357901
7123330210891760414,喜欢海青，实力派演员，某些小鲜肉根本没有一比。,0,0,0,2022-07-23 06:40:16,来自天津,104893866027,用户6089452635669
7123014700006441742,演员只是在演这种苦难的日子，而在这生活了一辈子的是真实的人生，,0,0,0,2022-07-22 10:15:25,来自四川,2330567955980052,用户1063951983414
7123341352829993763,从看双面胶开始，一直很喜欢她！[赞][赞][赞][赞][赞][赞][赞][赞],0,1,0,2022-07-23 07:23:46,来自陕西,413070711335485,用户7796394828133
7123301392999056166,海清是我最喜欢的女演技派之一，她的表演溶入了角色，一点不做作，非常喜欢她。,0,1,0,2022-07-23 04:54:05,来自山西,105562713290,用户4498243079077
7123315844469670667,喜欢海清的扮演。表演真实不做作。,0,0,0,2022-07-23 05:47:24,来自辽宁,1345397089641496,用户9030741923118
7123344279523050278,海清的演技很精湛，朴实自然,0,0,0,2022-07-23 07:36:03,来自湖北,1161549990081192,用户4379878042253
7123332852749533987,海青是个实力派演员，演技好，,0,0,1,2022-07-23 06:50:42,来自河南,61447816316,用户61447816316
7123322426737984271,是敬业的好演员[赞],0,0,0,2022-07-23 06:10:59,来自浙江,237935714377111,用户7426004588525
7123331958830646031,海清是一位为事业献身的人。让人敬配！,0,0,0,2022-07-23 06:47:22,来自天津,105071357619,用户8348032522448
7123358463539528488,喜欢海清的戏,0,0,0,2022-07-23 08:30:01,来自湖北,756894055275439,用户553619398321
7123335027542623017,敬业的专业演员,0,0,0,2022-07-23 06:59:11,来自山西,738496358390160,用户7862093454543
7123351652090069794,海清，一位值得尊敬的演员。,0,0,0,2022-07-23 08:03:33,来自上海,88443590238,用户5174189585334
7123320086190392071,为海青这种敬业精神点赞！！！,0,0,0,2022-07-23 06:02:37,来自山东,2920723793584223,用户719019037794
7123337534985290532,很喜欢海青演的戏，且很专业。,0,0,0,2022-07-23 07:09:13,来自河北,105713581360,用户3543561835595
7123317321347384078,海清是实力派演员，没有架子，不耍大牌，不矫情不做作，非常喜欢。,0,0,0,2022-07-23 05:52:35,来自辽宁,3579651299480062,用户5246260213003
7123338150776193826,喜欢海清[赞][赞][赞][比心],0,0,0,2022-07-23 07:11:18,来自广东,58769157665,用户5651074205381
7123314714922435363,若演员个个都像海清，焉能拍不出好片子来？,0,0,0,2022-07-23 05:41:25,来自北京,92969548894,用户9438781158918
7123353739205100300,演员体验生活的，这个已经多长时间没听说了。,0,0,0,2022-07-23 08:12:36,来自北京,73610986850,用户4587956021575
7123345173048197928,有一种精神叫专业精神，海清就是肯钻的实力演员。戏如人生，人生如戏，她在戏里体验不同的人生，用角色告诉我们各类人物的真实写实人生，若演员都能如此敬业，我也愿意成为追星人。,0,1,0,2022-07-23 07:38:35,来自福建,73086519909,手机用户73086519909
7123310679154656041,演员还是要自爱自尊！,0,0,0,2022-07-23 05:25:56,来自山东,55559297666,用户6913960589658
7123338417114776355,海清的实力有目共睹。,0,0,0,2022-07-23 07:12:18,来自江苏,110158025912,用户8363140162874
7123311538962187019,海清的《心术》很好看。,0,0,0,2022-07-23 05:31:17,来自湖北,107900198649,用户3595654247234
7123003415843668770,海清，非常喜欢她的演技，有些青涩，但又耐人回味！[赞],0,2,0,2022-07-22 09:32:05,来自吉林,3720352011139374,用户1501144366917
7123105776587309854,这才叫演员，再看看好莱坞那些巨星，基本上大片里面把形象都毁了，观众才会买账，比如小李子饰演的荒野猎人,0,0,0,2022-07-22 16:09:37,来自河南,597757876509390,用户1109500136134
7123326746606289695,的确是实力派演员，演啥像啥！,0,0,0,2022-07-23 06:27:48,来自云南,108695201332,用户8887441706834
7123329615744992041,怕显不着自己。,0,0,0,2022-07-23 06:38:19,来自北京,1745645194445116,用户5769321190672
7123342486411658025,好演员,0,0,0,2022-07-23 07:28:03,来自河南,26042603669784,用户8829361829106
7123321029132452643,没有不劳而获,0,0,0,2022-07-23 06:05:15,来自辽宁,102059590379,用户7932071125957
7123332974489453320,同为中年的孙俪、马伊利不买账。,0,0,0,2022-07-23 06:50:51,来自上海,111528432250,用户4869822349600
7123185121570112259,我六十年代人也没见过这样的,0,0,0,2022-07-22 21:17:40,来自北京,73977030649,用户176293659935
7123069769444115207,真正偏远地区，还这样,0,0,0,2022-07-22 13:50:10,来自山东,17248194400,手机用户17248194400
7123302230979134208,喜欢海清,0,0,0,2022-07-23 04:54:22,来自辽宁,2735217211605639,用户1889213583673
7123321365159297792,为了翻红，也是拼拉,0,0,0,2022-07-23 06:06:37,来自黑龙江,68366816415,用户1685386323623
7123326756370973477,喜欢海青,0,0,0,2022-07-23 06:28:08,来自四川,3328963321531687,用户2240223616791
7123339782788334372,突然发现，一直以来都不喜欢她,0,0,0,2022-07-23 07:18:15,来自云南,65632004489,用户65632004489
7123170811548664611,中国就喜欢演这种苦情戏了 时不时冒出来一个 是忆苦思甜吧,0,0,0,2022-07-22 20:21:27,来自广东,5131400324,文文燕
7123109651763512096,没明白，这种情景算艺术吗，，农村的景象有什么可折腾？,0,0,0,2022-07-22 16:25:04,来自北京,836075087205348,杨总
7120923447877714702,[中国赞],1,1,0,2022-07-16 19:01:03,来自广西,3364937699956660,小小鱼1213
7123051190992225055,不错，七八十年代西北妇女的形象就是这样,0,1,0,2022-07-22 12:37:18,来自甘肃,13977257367,高冷铅笔bA
7123068066665857827,演吧，越是把以前中国妇女土里土气的形象演出来，越是吧旧社会妇女的守旧无知的思想演出来，越是能在国外得奖[捂脸],0,0,0,2022-07-22 13:43:12,来自黑龙江,69441634382,侃天侃地侃出奇迹
7123326058128556814,说你行你就行,0,0,0,2022-07-23 06:25:33,来自北京,71041795831,丰富铁力8E8
7123051365160633126,有演技么,0,0,0,2022-07-22 12:38:42,来自安徽,53898158018,龙在kk
7123056621651297060,我就不懂了，为什么进入国际竞赛的中国影片都是这种化妆得脏兮兮的、丑化的片子,0,0,0,2022-07-22 12:58:38,来自福建,2546066115527964,端庄优雅荷叶z1
