7123086658819506976,"不是变丑就是好演员，
那样太简单了。
变丑是演员基本态度，是忘记自我进入角色的开端。
符合剧情中的人物 也别丑过度，适合就好。
现在农村的媳妇姑娘比城市热还俏。
当年我不是潘金莲，范冰冰也不惜变丑，具备好态度。说明她真心实意想做个好演员，不想一直靠美貌。
可是天赋这种东西，不是使劲就达到的，比如孙俪，演技被封神，可我看离好演员还差那么点火候。但是她也是愿意用功的好演员，因为她具有敬业精神。
我们尊重为艺术付出的演员，我们喜爱即为艺术付出又有精湛演技的演员。",2,16,0,2022-07-22 14:55:57,来自山东,2361372443152621,一缕流苏
7123090427699446541,我85后，我前婆婆有件西服外套，穿了好多年，邻居大姐说90年她嫁到这个村（她与前婆婆家是对门）就看见前婆婆除了夏天不穿这个西服，其他三个季节都穿，二十年后，10年我嫁到前夫家，前婆婆还在穿这个西服。前夫的姐姐给前婆婆买了好多衣服都压箱底了。这都成老古董了，比我年龄都大。同款围头发的围巾也有。所以现在前夫家人给我女儿买的新衣服也是被前婆婆压箱底了,0,3,0,2022-07-22 15:10:10,来自山西,102398857942,沁0325
7123044832330990371,要想获大奖 必须形象往死里糙 想想秋菊打官司的巩俐 再看现在的海清 女演员这样不计形象的演绎角色 值得一个奖,5,43,0,2022-07-22 12:12:46,来自湖北,69060101978,胖胖瞄
7123053024783844096,说实话，这个形象感觉像四五十年代，现在农村形象哪里还有这么苦哈哈的？虽然是艺术，但有点过了的感觉。,16,20,1,2022-07-22 12:44:25,来自重庆,1081538449775229,清心玉如
7123302781448291084,有一种精神叫专业精神，海清就是肯钻的实力演员。戏如人生，人生如戏，她在戏里体验不同的人生，用角色告诉我们各类人物的真实写实人生，若演员都能如此敬业，我也愿意成为追星人。,1,160,4,2022-07-23 05:00:05,来自浙江,2682423001744702,我是阿娅
7123059621589385992,这应该是六七十年代时期的农村现象，也属于偏远地区的农民形象，那时穿的的确不好，偏远地区风吹日晒会有这种情况，大家说的越是这种片子越拿国际大奖，是有的，这种题材会拿到国际上评选，国外很多人会看到，也就是很多国家一直以为中国就是这个样子的，很多国家不会给国人讲中国有多好多发达，甚至摸黑中国，这种片子会引进去看，有好处也有坏处吧,2,36,2,2022-07-22 13:10:26,来自山东,59618959064,拾光小楼
7123325490118574851,海清是个有职业精神的好演员，每一个角色扮演都很到位，是我喜欢的演员。,0,121,1,2022-07-23 06:23:22,来自河南,7385406010,味道
7123053307207156521,看着就觉得沉重，现在的农村也没这么苦吧,3,5,0,2022-07-22 12:45:28,来自浙江,95774132968,漁非漁
7122985879089972005,越穷苦越土气越容易获国际大奖,2,38,0,2022-07-22 08:24:47,来自山东,54567799598,安然无吃不欢
7123058389647049479,农村早就不是这个样子的了，新中国，新农村,3,16,1,2022-07-22 13:05:40,来自广东,110864635060,用户糖豆妈妈
7123151583772672783,听老师这么说，我也想看这部电影！[赞][赞][赞][玫瑰][玫瑰][玫瑰],1,2,0,2022-07-22 19:07:05,来自四川,2524112109202592,冠英爱
7123330904940561188,喜欢海青演的戏。一个很有演技的演员。,0,60,1,2022-07-23 06:43:03,来自辽宁,110801229331,许多个9的名字
7123328046727840519,咋一看还真没认出来，海清是好演员，台词清晰有特色[赞],0,37,0,2022-07-23 06:32:25,来自上海,96785904634,酸龙拿走
7121515062677799687,在黄土背景的映衬下，海清脸上的沟壑更显辛酸。在西北农村拍摄的十个多月里，海清学习方言、学习播种，拍水戏时也曾反复将头浸在脏水中……但剧中的她仍然穿着色彩艳丽的服装，在微风吹拂下一切又显得那么平静温馨。,0,1,0,2022-07-18 09:17:02,来自陕西,111045576770,继续征途我的梦想
7123315056309306115,现在能体验生活的演员少之又少了,0,81,1,2022-07-23 05:44:09,来自北京,3742368070119988,安山宝
7123295507883770627,海清的实力有目共睹。,1,84,2,2022-07-23 04:35:42,来自辽宁,88058587717,人微言轻之多轻
7123338292158448388,海清是个好演员，但还没有一部颠覆自我的大作，这部剧希望她能突破。颠覆形象不难，颠覆所有的自我，打碎了重塑，需要勇气也需要内心的支撑。祝福海清遇到这个角色 ，祝愿她成功！,0,8,0,2022-07-23 07:13:10,来自湖南,3908400590,麦田29476124
7123358384418128655,扮演农村妇女太损害演员的颜值了！为海清点赞！不容易啊！,0,0,0,2022-07-23 08:29:45,来自陕西,84467883173,清爽青山wR
7123359943236453155,海清扮演的角色真实，很喜欢她！,0,0,0,2022-07-23 08:35:37,来自黑龙江,4029055659151432,一瓣心香yxx
7123338260491289359,海清是个好演员！喜欢她！[赞][赞][赞][赞][赞][赞][玫瑰][玫瑰][玫瑰][玫瑰][玫瑰][玫瑰][玫瑰],0,13,0,2022-07-23 07:11:44,来自天津,2115095298586708,旭助晓旭
7123330862049395487,经纪人原本计划陪同，但上了厕所后当晚就回县城的宾馆住了。助理对她说：“姐你自己干活吧，我又不体验生活，我给你拍花絮。”[偷笑][流泪][憨笑][红脸],0,4,0,2022-07-23 06:42:48,来自河北,55653937234,天凉凉月无霜
7123319677157868323,海清是敬业的专业演员[赞][赞][赞],0,38,1,2022-07-23 06:00:36,来自山东,99870826819,馋嘴女生
7123150147021947683,概括得非常好！感谢分享！,1,3,1,2022-07-22 19:01:20,来自山东,16147283175,蔷薇已开透
7123053387645977376,海清的所有作品我都喜欢，从开始的玉观音到前几天演的乡下女子到上海打拼，找了个窝囊丈夫，碰上精明强干的大姑子，挑剔的奶奶婆，善良的公公。演技好的没谁了。,0,6,0,2022-07-22 12:46:39,来自北京,2295425364931431,叶薇慧
7123340329457222435,这是应该倡导的正确三观，不是有颜值就能当演员，不是有流量就是当红，看过海清的多部戏，莫名的喜欢她。,0,5,0,2022-07-23 07:19:41,来自河南,1081550145586925,天之中暖阳
7123346095719400204,喜欢海清，海清是一个很好的优秀演员，喜欢看她演的戏，她演戏非常敬业[赞][赞][赞][鼓掌][鼓掌][鼓掌],0,3,0,2022-07-23 07:43:01,来自贵州,448197268608332,上进聪明的阳光Lv
7123121721590891277,欣赏佳作[赞],1,1,0,2022-07-22 17:11:49,来自宁夏,106686221231,饭团2z
7123346953554985767,海清是一个实力派好演员。把每个角色到演泽得很到位。,0,3,0,2022-07-23 07:46:08,来自江苏,6914213306,杨柳青A
7123060177150673679,结局悲惨才能更深入人心吧！！！我哭[流泪][流泪][流泪][流泪][流泪]但愿世间如此努力生活的人们都能过上好日子，都能幸福到老！！[流泪][流泪][流泪][流泪],0,3,0,2022-07-22 13:12:34,来自黑龙江,71592766898,人生抛物线
7123334167572005632,现在越来越多的演员开始沉淀下来，琢磨自己的演技，不再追逐流量，踏踏实实的去做好自己的工作，恪守自己的职业操守，这才是演员这个职业该有的素质。,0,7,0,2022-07-23 06:56:05,来自河南,110983558095,用户回看
7123351950359905038,"海清是个有演技的好演员.有思想、有内涵,文化修养高.和那些花瓶演员不是一个档次",0,2,0,2022-07-23 08:05:22,来自江苏,12363971880,柠檬145270811
7123357840294839074,看上面的图片的确没有看出来是海清。海清是个好妈妈。确实演员和明星是两个不同的概念。海清是个好演员[赞][赞][赞][赞][赞][赞][赞],0,0,0,2022-07-23 08:27:29,来自江西,105943878600,回忆9078492401960
7123351984400810764,还是中老年人那一代演员功底好，现在的年轻演员差的不是一星半点。,0,3,0,2022-07-23 08:06:04,来自山东,1349834458281992,青涩香瓜R7
7123341740265882404,演员漂不漂亮是一回事，会不会演戏是一回事，肯不肯下功夫又是一回事，海清三者皆有。,0,3,0,2022-07-23 07:25:37,来自浙江,53640696263,听风5360
7123336816404906786,海清才是真正的演员，专业，低调，很喜欢她,0,5,0,2022-07-23 07:06:08,来自湖南,59040510154,青涩水滴U
7123346862803223311,很喜欢海清演的电视剧角色，也喜欢她的人。,0,2,0,2022-07-23 07:45:08,来自浙江,108076983592,牙苏妈
7123343074306212611,喜欢海青演的戏。一个很有演技的演员。,0,2,0,2022-07-23 07:31:17,来自湖北,111192806520,用户福气盈门
7123356404345996045,非常喜欢海清，实力派演员，为她的敬业精神点赞[赞][赞][赞],0,0,0,2022-07-23 08:22:47,来自河北,5872702003,爱生活的坤妈
7123346921871131429,实力派演员海清，我很欣赏她的作品。,0,2,0,2022-07-23 07:45:36,来自四川,102642441736,真诚友人
7123354884585702158,喜欢她的演出，琐琐碎碎的柴米油盐，真实,0,0,0,2022-07-23 08:16:32,来自吉林,111061095388,我是胖胖啊aaaa
7123357170007704351,海清是个敬业的实力派好演员！,0,0,0,2022-07-23 08:25:39,来自广东,55203861489,紫蝶云裳
7123335395126969121,海清很个正能量的好演员，喜欢,0,9,1,2022-07-23 07:01:48,来自山西,4274505192312734,听荷花
7123334407293371136,实力派演员，喜欢海清饰演的角色，深入人心。,0,12,1,2022-07-23 06:56:59,来自江西,3944683031772606,热情的宇宙OX
7123355296424215303,很专业的一个演员，记得最早看她的剧是蜗居，印象很深。,0,0,0,2022-07-23 08:18:11,来自山东,52146475058,江水绿如蓝0623
7123355778022441728,海清是个敬业的好演员，女性的娇娇者。,0,0,0,2022-07-23 08:19:24,来自浙江,111177361918,高贵天空OD
7123074397409887014,不了解这个电影。但就形象来看，作品故事背景起码上世纪七十年代以前，如果超出这个年代，那就糙笨的有点过了。我六零后农民,0,3,0,2022-07-22 14:08:40,来自辽宁,2541668663569944,最炫芳芳
7123312648459911936,海青演技不错，是个好演员。,0,28,1,2022-07-23 05:33:11,来自河南,71444275403,赵翠萍88747
7123326264765235999,海青是个实力派演员，演技好，喜欢！,0,8,0,2022-07-23 06:26:12,来自上海,84581309357,柳溪694
7123344366990983944,海青是个实力派演员，演技好棒！,0,1,0,2022-07-23 07:36:02,来自上海,3412489515326664,m120101
7123100153426658084,现在的农村已经不是这个形象了吧？精准扶贫政策以后连偏远地区都开始有大变化了,0,1,0,2022-07-22 15:48:06,来自浙江,51338276982,mytrue88
7123347162272203560,海清是敬业的专业演员[赞][赞][赞],0,1,0,2022-07-23 07:46:09,来自江苏,342655923396375,mututu
7123357411196273419,只有深入生活，才能演绎出鲜活的人物形像。海青是个好演员。,0,0,0,2022-07-23 08:26:22,来自北京,879206965721453,上进的橙子5F7
7123336628877771551,海青的演技很棒！[赞][赞][赞][赞],0,3,0,2022-07-23 07:05:22,来自内蒙古,22896696642,忠实头条迷
7123240388202283791,应该倡导的正确三观，不是有颜值就能当演员，不是有流量就是当红。,0,70,1,2022-07-23 00:53:25,来自湖南,4371252768682020,七星生态农夫
7122966734029669133,为啥这种苦兮兮的故事 人物 会更容易进入国际电影节啊[摊手],16,30,2,2022-07-22 07:10:38,来自山东,66747133335,热心市民霍先生丶1
7123341860981998366,海清演技挺好的，通过那两件事，感觉她性格也很好，大气,0,1,0,2022-07-23 07:25:59,来自湖北,82355826855,末末
7123343601626628871,演员顾名思义需要演技，不是只要那张脸，希望各位演员贡献自己的演技，演出更好的角色，而不是考别的,0,1,0,2022-07-23 07:32:46,来自河北,105977683338,正义凛然旭日4e
7123061613481034535,为了获奖这些苦吃得值[可爱][可爱][可爱]不过还是希望能看到这个时代的影片能获奖。而不是自黑才能获奖,0,4,0,2022-07-22 13:18:39,来自福建,6037133521,复76887046
7123337214608229135,实力派演员，喜欢,0,1,0,2022-07-23 07:07:55,来自四川,55167786543,木土月木土月
7123350385003365128,喜欢海青演的戏。一个很有演技的演员。,0,0,0,2022-07-23 07:59:12,来自陕西,730542212916392,随萍
7123106261490549511,中国农村不是这个形象了！,0,1,0,2022-07-22 16:11:19,来自甘肃,2621702563184387,爱生活119116
7123329114651804420,海清是个优秀演员，她又是个很有实力大家有目共睹。,0,7,1,2022-07-23 06:37:16,来自江西,69777449224,生活充满阳光yg
7123353702198838031,敬业！专业！点赞海清姐！,0,0,0,2022-07-23 08:11:30,来自广东,56140760339,流浪的小孩要回家
7123116032805487374,说实话我不喜欢看这种类型题材的电影，觉得太压抑了！,0,1,0,2022-07-22 16:49:26,来自广东,3518885598596695,加油吧MBA
7123356487426753321,有性情，有担当，她是一个仗义执声的勇者，一个热爱表演的纯粹的演员职业者，这都是海清身上特有的标配。她活得那样真实，不为世俗言论所羁绊，这才是我们想要看到的真正的明星！,0,0,0,2022-07-23 08:22:27,来自江苏,5745470578,段鹏翔
7123051051724735264,我一农村长大的农民，虽然没种过地吧，但是现在电视剧里这些农民…感觉不是一个地球,0,18,1,2022-07-22 12:37:25,来自山东,6039347955,乖巧星星
7123347503172518694,海清的戏都很好！,0,1,0,2022-07-23 07:48:23,来自湖南,105107794094,用户北平
7122648762761167650,如果手机掉下去摄像头朝上才好呢[尬笑],1,5,0,2022-07-21 10:35:49,来自北京,2604121345498807,疯人院院长
7123352773672518436,演技，实力派演员！,0,0,0,2022-07-23 08:08:39,来自天津,5927571786,静心阿美
7123011965768975104,长的不好看的女的演技都好[抠鼻],8,4,5,2022-07-22 10:04:50,来自山东,3821555663241880,毛毛飞飞
7123339752862384926,喜欢海清的每一个作品,0,1,0,2022-07-23 07:18:11,来自河北,3246178122868996,进取海风2g
7123343021026181888,为海清点赞！[赞][赞][赞][玫瑰][玫瑰][玫瑰],0,0,0,2022-07-23 07:30:11,来自湖南,3386908752486095,开朗苹果9D
7123352632571773732,海清的第一部戏应该是《玉观音》。,0,0,0,2022-07-23 08:08:01,来自上海,53757601116,大姐头0209
7123069466132824873,海清终于有决心转型了，不再是那个摇尾乞怜要角色的演员了，真为她感到高兴。,0,1,0,2022-07-22 13:48:27,来自江苏,50002571763,蔷薇紫陌211
7123313268407550760,海清多敬业啊，某些小鲜肉根本没法比,0,11,0,2022-07-23 05:35:35,来自辽宁,1205479596373036,自若西柚0r
7123336634934379305,应该倡导的正确三观，不是有颜值就能当演员，不是有流量就是当红。,0,1,0,2022-07-23 07:05:30,来自河南,5888162077,语嫣0503
7122970735882076940,为啥这种苦兮兮的故事 人物 会更容易进入国际电影节啊[抠鼻][抠鼻][抠鼻][抠鼻],4,5,1,2022-07-22 07:26:12,来自黑龙江,2277840940200236,2021彬彬有礼
7123325428471350046,在当下的市场环境下，为艺术和心中的事业舍弃和放下一些影响自己的东西，是非常难能可贵。海青做到了，所以她能获得人们的赞予。有演技且在份繁诱惑下不失我心，知道自己要的是什么，有脑子的清醒，是一个好演员基本的本份。,0,5,0,2022-07-23 06:23:15,来自四川,62139691694,说啥你看看
7123092475228521250,外国人通过影片认为中国就是这么贫穷落后，应该拍新农村的生活，树立新形象。,0,1,0,2022-07-22 15:17:40,来自辽宁,1055164099995312,会飞的鱼jxD7
7123352855247340288,一个有职业操守的好演员，这个点赞。比较喜欢海清这个演员和他所演的角色。,0,0,0,2022-07-23 08:08:19,来自湖北,1292639042284527,积极的旭日oT
7123353003037688587,实力派演员，喜欢海清饰演的角色,0,0,0,2022-07-23 08:09:41,来自河北,99555493350,平凡62423
7123344310200222498,现在能体验生活的演员少之又少了。,0,1,0,2022-07-23 07:35:20,来自安徽,3355320248703502,博学多才的周四新
7123324413327868704,诲清是很有实力的，我非常喜欢看她拍的戏。,0,2,0,2022-07-23 06:19:35,来自安徽,3228593090205395,梅朵
7123349230282310435,她演戏还不错，敬业！,0,1,0,2022-07-23 07:54:14,来自广东,52526063311,Oo兰32星
7123349868143428382,咋一看还真没认出来，海清是好演员，台词清晰有特色[赞],0,0,0,2022-07-23 07:57:04,来自青海,72807226722,李桐165
7123312442880443139,喜欢海清，她的表演的实力有目共睹 [笑],0,5,0,2022-07-23 05:34:29,来自吉林,4579989119,金子44605077
7123173078129591075,海清演技不错，这回终于跳出家长和职场女性的框架，狠心把自己祸害一把[赞][赞],0,0,0,2022-07-22 20:30:24,来自黑龙江,35654759889508,春日限定奶绿
7123342183825933093,喜欢海青演的戏。一个很有演技的演员。,0,1,0,2022-07-23 07:27:18,来自广东,3271751022418775,摇扇品茗
7123000887299719976,看来大家还是喜欢淳朴年代，淳朴的人；曾经我以为只要努力肯干活着是简单的事情，现在才知道活着很不容易,0,7,0,2022-07-22 09:22:26,来自广东,4314121061534628,觅远方
7123345739895489313,海清演技很好，是个很优秀的演员！,0,0,0,2022-07-23 07:41:29,来自宁夏,4481256830541463,勇者暖阳KB
7123272397377028875,虽然以前演员多多少少都会去体验生活，但不得不佩服海清能去那么穷苦条件很差的地方体验那么长的时间，想想连一个普通的都市人都很难做到。,0,20,1,2022-07-23 03:06:05,来自江苏,97046415589,云淡风轻轻谈风云
7123329500167144204,海清的演技真是没得说，实属实力派演员。,0,0,0,2022-07-23 06:39:21,来自河南,67189230528,海军6117
7123062849047560975,该是七八十代的西北农村吧！,0,2,0,2022-07-22 13:22:40,来自湖南,2097491767726599,优美葡萄bm
7123337870999978766,海清才是真正的演员，专业，低调，很喜欢她。,0,1,0,2022-07-23 07:11:01,来自陕西,51869460173,老大十三狼
7123330816033506089,海青演技不错，是敬业的专业演员，海演技好，喜欢！,0,2,0,2022-07-23 06:42:59,来自湖北,5262039612,大山小丘51136711
7123337811587547938,记得看过她的第一部电视剧是梅花档案,0,1,0,2022-07-23 07:10:08,来自吉林,86181909989,殷海艳
7123319155449201441,好剧好人好戏,0,2,0,2022-07-23 05:59:53,来自上海,2317365735065102,两道山水
7123353345049969420,海青是个实力派演员，有敬业精神，演技好，喜欢！,0,0,0,2022-07-23 08:11:13,来自湖南,48005350696580,非必要不外出
7123359038708122401,是个好演员！确实是个好演员！[赞][赞][赞],0,1,0,2022-07-23 08:32:44,来自陕西,5706447663,生活不易0044
7123063941575721736,准备去看这部电影，海清扮演农民的角色在银屏上是首次吧！,0,0,0,2022-07-22 13:27:02,来自陕西,515001885141053,喜洋洋
7123336152777753347,会演戏，爱演戏，心存敬意的好演员,0,1,0,2022-07-23 07:04:34,来自四川,149168709438679,我爱红酒加豆汁
7123354117837914919,海清是一个有演技的女演员,0,0,0,2022-07-23 08:14:24,来自江西,111142156074,飞侠ZHT
7123340450756395807,"海清确实是个好演员
一直喜欢她",0,0,0,2022-07-23 07:20:29,来自北京,102580194101,老李士282
7123329671810351902,应该倡导的正确三观，不是有颜值就能当演员，不是有流量就是当红。,0,2,0,2022-07-23 06:38:13,来自安徽,69789385312,润风8878
7123321031074874112,喜欢海清演的各种角色,0,1,0,2022-07-23 06:05:40,来自江苏,971589542745716,努力学习的妹妹
7123320722479072037,海清是个有职业精神的好演员，每个角色扮演很到位，是我喜欢的演员。,0,0,0,2022-07-23 06:05:20,来自安徽,55594032309,美丽超越1
7123336233103409950,海清演技可以的,0,0,0,2022-07-23 07:03:45,来自广东,800872015607248,弎葉虫
7123326935358358272,演员就是要像海清这样敬业，深入生活，才能塑造好角色。,0,1,0,2022-07-23 06:28:03,来自安徽,85300198439,搞个一百万再说
7123343755260052259,是我们南京姑凉，我家女儿开学也要成为她北电的校友了,0,0,0,2022-07-23 07:32:53,来自江苏,56704147663,人间烟火慢煮生活
7123272889402655503,海清演技不错。,0,12,0,2022-07-23 03:03:45,来自河北,483419244998704,可爱的波斯猫喵喵喵
7123339879924253471,很喜欢海清,0,1,0,2022-07-23 07:18:29,来自河南,3060687285519342,开心的教书匠红姐
7123339172467442436,很喜欢海青塑造的每个角色，感觉很真实。,0,1,0,2022-07-23 07:16:30,来自山东,60740403503,活泼风声sL
7123332917664727822,是个好演员，人品不错。,0,1,0,2022-07-23 06:50:38,来自山东,105530990905,用户独居老人
7123355278392771362,很喜欢海清,0,0,0,2022-07-23 08:17:31,来自北京,95167694991,手机用13383687798
7123342708412400415,一次次的体验生活，只为塑造一个让人记住的形象，点赞！！！！！！,0,0,0,2022-07-23 07:29:48,来自北京,4182155222597160,用户名享受生活
7123339934257136419,很喜欢她的作品,0,0,0,2022-07-23 07:17:59,来自四川,105035164850,知情达理春风HQ
7123330082843820807,现在能体验生活的演员可能没有第二个了。,0,0,0,2022-07-23 06:39:40,来自湖南,72930376736,普洱香6933
7123071471592948516,被风刮来刮去，麦子能说个啥？被飞过的麻雀啄食，麦子能说个啥？……,0,0,0,2022-07-22 13:56:28,来自北京,109550164184,看窗外雪花飞
7123327564428362535,演员必须深入生活 ，才能呈现给观众近以真实的作品[赞][赞][赞],0,2,0,2022-07-23 06:31:36,来自河南,7784531932,刘跃平9
7123326151640187679,应该倡导的正确三观，不是有颜值就能当演员，不是有流量就是当红。,0,1,0,2022-07-23 06:25:28,来自山西,90103932516,锋发韵流8
7123329236387660547,海清还是具有职业操守的一个演员，不做作，不炒作，干净利索,0,1,0,2022-07-23 06:38:29,来自上海,60444396826,上海宝德金海运
7123342443340710691,看了你的推荐，很想去看看[握手][握手],0,0,0,2022-07-23 07:28:08,来自河南,4406459449489960,莲本无馨
7123334587442791198,只要她不要再想着去演年轻的，漂亮的，愿意沉下心来还是有角色演的。,0,0,0,2022-07-23 06:57:24,来自贵州,100063391622,信马由缰自主张
7123327579343684387,非常喜欢海清演的电视剧。,0,2,1,2022-07-23 06:30:40,来自河北,3642034193705373,乖巧饭团Ho
7123350057851634464,很喜欢海青，真性情！,0,0,0,2022-07-23 07:57:59,来自四川,1969934051574439,用户胡蝶恋上花
7123347031351444254,高素质的演员，真正的演员[赞],0,0,0,2022-07-23 07:46:04,来自河南,822088096809048,岚之衫
7123078402986345216,这才叫演员，再看看好莱坞那些巨星，基本上大片里面把形象都毁了，观众才会买账，比如小李子饰演的荒野猎人,0,1,0,2022-07-22 14:23:09,来自浙江,3342987530086128,将相本毋种
7123323296607388450,海清是敬业的专业演员[赞][赞][赞],0,1,0,2022-07-23 06:14:19,来自天津,122755908385735,欣欣此生意自而为佳节
7123098598912852774,很贴近现实生活,0,0,0,2022-07-22 15:42:10,来自河南,4116214196212702,以后要快乐生活
7123325641520431880,海清是一个真正热爱表演的演员,0,0,1,2022-07-23 06:23:31,来自辽宁,111087018881,精神科主治医师
7123268402776539944,人家是演员，不是当红明星，档次都不一样，追求当然也不同,0,12,1,2022-07-23 02:45:51,来自四川,72556071860,逃避完美
7123315520442860300,应该倡导的正确三观，不是有颜值就能当演员，不是有流量就是当红。[赞][赞][赞][赞],0,0,0,2022-07-23 05:46:03,来自浙江,55148523712,跑车里练字
7123359545841402657,真正的演员。,0,0,0,2022-07-23 08:34:57,来自山东,110953645257,熊猫哪去了
7123068682959782691,不得不说，这样才是演员。那些古装玄幻片我根本就不看，当然，我也二十年没看过电视了,0,1,0,2022-07-22 13:45:23,来自浙江,108824989466,形而之上
7123050903825105705,现在反应农村题材接地气的电影作品越来越少,0,2,1,2022-07-22 12:36:16,来自四川,108841840742,银河系之烈火雄心
7123330273131037480,真正的演员决不是我们看到的流量明星,0,1,0,2022-07-23 06:40:46,来自江苏,58945333389,xznum1
7123328556994052872,这种角色演的好了演的多了就会成为伟大的演员，艺术家！,0,1,0,2022-07-23 06:34:52,来自山西,52360221676,猴眉怪眼3421
7123326480570630912,老版玉观音中是不是有海清？爱上佟大为的富家女。,0,1,0,2022-07-23 06:26:33,来自湖南,6361591370,俊哥86246181
7123349436536881923,头脑清醒，自信自律，伶牙俐齿一身正气！,0,0,0,2022-07-23 07:55:56,来自北京,3861126530210203,十师子弟
7123343262596842243,这才是演员应该做的事情，以前的老演员不都是要体验生活的吗？,0,0,0,2022-07-23 07:31:54,来自北京,20781400313,jerrywang1
7123323195226456835,海清这么呼吁也没什么错啊，人家毕竟业务能力是在线的，求机会很正常，好演员没戏拍才可惜,0,2,0,2022-07-23 06:14:56,来自安徽,50812255344,桑波BOBO
7123333901375996706,那些抠图演员，数字演员看了有何感想？,0,0,0,2022-07-23 06:54:57,来自重庆,5225143241,闪电gq
7123349722449937167,海清比较专业，特别喜欢看她拍的电视剧,0,0,0,2022-07-23 07:55:59,来自江西,50102368209,致青春125549079
7123055524257776417,海清是一个不错的演员,0,3,0,2022-07-22 12:54:59,来自河北,2163465554235732,繁荣昌盛的大中国
