7123457249850557221,临终关怀，留给病人最后的尊严。这样的医院，这样的医生有大爱,0,137,0,2022-07-23 14:53:28,来自广东,65557819884,自在的如初
7123537112322130726,还是不告诉的好一些，好多人接受不了的,0,0,0,2022-07-23 20:03:47,,88106702777,南山草木香
7123532038745408297,现实就是生活中没碰到过这样的大夫，我妈妈在肿瘤医院住院的时候大夫忙的根本没时间搭理你，你总去问病情也不愿意和你聊，得了癌症大夫就是让你做一系列的放化疗，带搭不惜理的样子，因为他们接触的太多了，麻木了，没有一个这样温柔的大夫,9,20,0,2022-07-23 19:43:26,来自黑龙江,58536258986,木子雨26
7123452247178478340,我妈也是高危病人再我没回来时她老人家己放弃治疗。为了妈妈我抛家舍业回来己半年了，现在一天比一天好，不管老人得什么病你尽管好好爱她，陪伴她，招顾她奇迹总是会出现。为妈妈加油，为自己加油吧,2,38,0,2022-07-23 14:34:52,来自新疆,4410838163915518,元气海浪dj
7123475021447643939,向死而生，我就是年轻的肿瘤患者，有质量的活了三年多，要质量换长度,4,23,0,2022-07-23 16:02:08,来自上海,3236568650488032,水清丫丫
7123526700893946665,我爸爸去世以后，我在网上搜索过，临终关怀这份职业，我觉得这份职业和入殓师一样是一份很神圣很值得尊敬和推崇的职业。我对我的爸爸永远都是内疚自责和遗憾[流泪],2,10,0,2022-07-23 19:22:53,来自内蒙古,50421242391,微雨浥青岚
7123568637709255439,我的83岁老父亲得了不治之症，他的心态崩了，总是哭。我们几个儿女内心自责又煎熬，我们有经济能力可上天不给机会！无力回天的感觉好无助啊！此刻的我以泪流满面。,1,1,0,2022-07-23 22:05:19,来自黑龙江,86497450161,豹子黑
7123496157041115939,临终前还舒舒服服的医院在哪里？我人到中年，想到最后痛苦的时光就害怕！,2,3,0,2022-07-23 17:24:23,来自广西,13220833314,春水初生66
7123391204494279458,怕啥，死忘每个人都有这一天,3,26,0,2022-07-23 10:36:48,来自重庆,2894371344628125,爱生活武安0R5
7123455637052457742,家属比大夫更清楚患者心理承受能力，对于心里没有抗压力的患者，家属选择不告诉患者，不是没道理，所以大夫要征求患者家属的建议，不是你以为的就是你以为的。我认识一个阿姨，家属选择没告诉患者，阿姨问孩子怎么住在肿瘤病房，孩子说没有病房了，所以只能住在这儿，家属把打药的也提前遮挡或者撕了，阿姨每天在医院乐呵呵的，和谁都嘻嘻哈哈，孩子说要定期来医院住一个月是为了巩固病情，有一次大夫说病人要有知情权，要知道自己的生存期，结果大夫告知患者得癌症了，生存期只有一年，阿姨一下精神就崩了，不到一个月就去世了,5,25,1,2022-07-23 14:47:04,来自辽宁,96044493144,爱喝可乐的鱼1228
7123469999410840332,这医生好和蔼！这让我想起去年我的宫颈癌晚期婆婆临终前三个月，我日日夜夜陪伴着她，喂她饭，给她搓澡，陪她笑，陪她哭。我知道她舍不得我们，我们也舍不得她，最后她在痛苦中走了[流泪],5,17,1,2022-07-23 15:43:37,来自浙江,60290156105,萌淑儿66
7123467735409525543,"第一：我可以死，但是不要痛苦的死。
第二：我可以死，但是不要不要孤独的死。
第三：我可以死，但是要有尊严的死。
第四：我可以死，……（个体的愿望什么的）",7,31,1,2022-07-23 15:34:59,来自上海,4239321652270749,岩中红葩
7123530396901868288,我已步入老年，我与上面的患者观点一直，不怕死，不留念，但怕痛，怕过多的治疗给我带来无尊严的一口气，希望有那一天時，身上有用就捐给用的着的机构。,0,13,0,2022-07-23 19:37:06,来自上海,993587715903997,用9425862晚熟的猴
7123517379816276776,这个主任真好[赞][赞][赞]，温暖[玫瑰][玫瑰][玫瑰]病人最后就是要活的有尊严！,1,1,0,2022-07-23 18:46:33,来自河南,1996315393789712,蔡蔡小溪
7123542998545269518,我姑胃癌做手术就瞒着她，告诉她胆囊切除，化疗不行身体吃不消，后来吃中药，活了十几年，今年刚去世肠癌扩散了，如果当时她知道胃癌晚期估计活不了这么多年！,0,2,0,2022-07-23 20:26:04,来自江苏,104709207291,淡泊的心向暖阳
7123453019765359397,死不怕就怕生病过程的痛苦，真希望安乐死,0,76,1,2022-07-23 14:37:13,来自山东,3457277087464776,茶香
7123515687192625954,人不是害怕死亡，而是害怕未知！因为未知而恐惧，若明白死亡就是无感，就是幻灭，就是无痛无恐无惧，也就不怕了。,1,0,0,2022-07-23 18:40:07,来自辽宁,92442283650,四月风起的时候
7122088750158627584,我爸也是刚查出来肺癌，但是我们瞒着他，怕他知道后承受不住，现在治疗中，他还和以前一样，能吃能喝，没有思想负担，我们打算一直瞒下去,20,8,2,2022-07-19 22:22:36,来自山东,6275352759,红樱桃的五月
7121610625872659238,我今年67岁了，去年的九月份，突然子宫出血，因为是星期六，所以到星期一才去医院。我三年前在另一个医院去看过妇科，去看了两次，就配了点药。这一次我还是认为沒事，我去了本市最好的医院，老公开车送到医院门口，因为医院难停车，我就一个人去了，上午没看完，下午一个人又去了，做了很多检查，当时就查出宫颈上有一个近5公分的肿瘤，医生当场就给我说情况不大好，直接做活检。一星期后就确诊宫颈癌2期，9月22日就做了手术，子宫、卵巢等全部切除，后来又是化疗放疗，这里痛那里痛，又做了许多检查，目前在喝中药调理。我认为，首先心态要好，自己要坚强，我得病后从来沒掉过眼泪，每天照样洗衣做饭，哭哭啼啼是没用的，要想战胜疾病，唯有靠自己。,3,69,6,2022-07-18 15:28:32,来自江苏,9266978497,FJ花美
7123490684996715300,有质量的活着更重要！,1,5,0,2022-07-23 17:03:12,来自内蒙古,52348813637,FIONA51
7123476349381640967,医生一句“我们有的是办法”，感觉有光明了,5,11,2,2022-07-23 16:08:04,来自河南,100414945734,三公主你好
7121638902003417886,我爸肠癌晚期造瘘手术三年了没事。,2,9,1,2022-07-18 17:17:39,来自河南,102896697632,原野暮秋658
7123522785909605154,"是啊，不告知病情的抗癌没有意义。
死后将切换到另一生存方式，故S不可怕。
不留遗憾的离开这个世界，就是活着的时候认认真真做人，本本分分做事。",0,2,0,2022-07-23 19:07:39,来自河北,3773179692325631,究竟道57
7123448354520580903,一个例子，同学没有告诉妈妈病情，去医院开刀实际没有开刀，只是打开腹腔又缝合。同学告诉妈妈很成功。后同学妈妈活了七年，没有治疗。另一个同学妈妈得了癌症，开刀，吃靶向药等等，后活了三年。我当医生的同学说，实际上很多癌症病人是精神负担很重加重了病情去世的。如果心情很好没有精神负担，一般可以多活一段时间的。很多人是接收不了病情的。一知道救不了了，就郁郁寡欢。,1,11,0,2022-07-23 14:19:54,来自湖南,91992786211172,为了一切真理
7123450831286469376,病人都希望遇到你这样的医生,0,43,0,2022-07-23 14:28:34,来自陕西,100139147281,用户小期待
7123571455090033420,我母亲胃癌刚做完手术，目前在化疗阶段；起初我也想瞒着，不过最终还是和母亲说了病情，最初可以感受到母亲的恐惧和担心，担心花费金钱，拖累儿女；我认为还是让病人提早知道更好，能够和家人一起面对，一同关注治疗问题等等，重要的是陪伴，让亲人安心。,0,0,0,2022-07-23 22:16:45,来自河南,92668873840,米小阳
7123531951591785228,非常认真看完视频，被路医生打动，希望我们临终都能被这样对待,0,12,0,2022-07-23 19:43:53,,52365623397,guo叮当
7123469760494469899,希望安乐死尽快合法！让病人可以选择有尊严的离去！,1,18,0,2022-07-23 15:42:27,来自上海,3781946664302884,上海精品二手挖掘机
7123555283506725644,温柔的医生电视机里多,0,0,0,2022-07-23 21:14:03,来自河北,51353908409,6路飞飞
7123387876699718436,你接受，不等于病人也接受，不同层次的人对生死的认知不同。所以应不应该告知，还是让家属定夺为好。,0,0,0,2022-07-23 10:23:38,来自河北,76558987709,顶级溪水o
7123456108517917454,病人都希望碰到好医生,0,12,0,2022-07-23 14:49:08,来自浙江,12813863199,user6014883118114
7123495021609255687,好死不如赖活着，1天痛快换10年受罪，我宁可痛苦10年[抠鼻],2,0,0,2022-07-23 17:20:28,来自河北,3519671977,王晶就是王晶
7123559603052593950,家人总是以为不告诉是对病人好，但是每天做这么多的治疗，病人就开始怀疑，心情就会变得更不好，反而会加重病情！虽然告诉了一时难以接受，但是一个成年人是具有调节好自己情绪的能力！,0,0,0,2022-07-23 21:30:39,来自广东,2642865096235083,优雅暖阳mM
7123537644843516708,好医生是真的设身处地，有耐心为患者着想，只是少了点。,1,3,0,2022-07-23 20:05:34,来自河南,3091438381052301,nicolaswen
7123498300326085410,以前不信鬼神，自从有一天晚上睡觉的时候老婆不声不响的就走了，我在梦里碰到一个已经逝去的老爷爷他是我家的邻居，然后我跟那个老爷爷聊了几句，他跟我说你家门没关赶紧回去看看，我一下子就醒了过来，结果发现老婆离家出走了，家里灯和门果真都没有关。,0,5,0,2022-07-23 17:32:34,来自江苏,59644776950,独一无二的昭昭
7123482587804582697,死不害怕！怕的是痛苦孤独的在重症监护室里生不如死的离去。我支持这种有尊严，减少痛苦中离去。,0,6,0,2022-07-23 16:31:31,来自北京,3755525463084696,洎洎
7121618353122558758,早发现 早治疗的为好，问下腰突有啥办法？？腿 麻 坐 骨 痛，是不是跟久坐有关，缺 乏锻 炼导致的呢？？,7,12,9,2022-07-18 15:58:25,来自河南,602976890655901,九台打板
7123570234854212391,"这医生，面相特别好！
每个人都要面对死亡，怕的不是死，是舍不得的东西太多",0,1,0,2022-07-23 22:12:11,来自广西,6129220928,包姐爱生活
7123495822436107049,这样的临终病房好肯定是好！但是这一看收费不低！不是普通老百姓能消费的起的！在就是希望这样的可以全国推广,2,3,0,2022-07-23 17:23:00,来自湖北,53247411164,谭大少爷
7123498966922265379,多希望这样的临终关怀的医院普及到全国各地的市级医院。,0,4,0,2022-07-23 17:35:05,来自河南,23246284834,何玉芬5
7123563923727041311,只有爱，可以超越生死！有多少人，明白这句话的真正含义！,0,1,0,2022-07-23 21:47:28,来自天津,2700006314483054,rylandwzy
7123506159038202658,谢谢医生，没有什么能比临终关怀更重要，让病人充分享受家人的关爱，无憾的离开这个世界是最美好的,0,1,0,2022-07-23 18:03:06,来自山东,94675350262,lmy789
7123596495903474446,医生讲得太好了：只有爱能超越生死。,0,0,0,2022-07-23 23:55:30,来自河南,540556527413731,世界如此广阔
7123573161681470215,值得尊敬的医生！,0,1,0,2022-07-23 22:23:25,来自辽宁,93074862678,釐尔女士
7123530046777738016,大夫说的太对了，疼痛大于死亡的话，那就没有意义的活下去了，有时候痛苦大于希望，人啊来到这个世界还生死离别才最痛苦的，希望女士战胜病魔[祈祷][祈祷][祈祷][祈祷]早日康复,0,0,0,2022-07-23 19:36:19,来自黑龙江,1547758767972800,自强不息雪碧To
7123468760933663491,只有爱可以超越生死💞💞💞,0,8,0,2022-07-23 15:38:46,来自甘肃,59211609501,悟为小妮
7123475403561468680,都70以上的人，最怕的是痛苦，没尊严地活着！,0,3,0,2022-07-23 16:04:15,来自广东,1763271326566788,爱生活的奶酪DN
7123457438006772513,真的得了这个病不要痛苦的死去,0,2,0,2022-07-23 14:54:36,来自上海,1420204634026276,微笑生活家QX
7123584107191436043,如果我得了绝症，我会自我了结。我命由我不由天。我不会让疾病折磨我,1,0,0,2022-07-23 23:06:26,来自福建,6396799329,好可爱的翁翁
7123520842591552271,作为一名基层老年病科医生，特别希望能有机会跟上老师学习安宁照护相关内容！,0,3,0,2022-07-23 18:59:53,来自陕西,53209558801,笑对人生yan
7123388725966848780,医生讲得好,0,45,1,2022-07-23 10:28:04,来自上海,77803022918,管鈺珍
7123450979223634688,你们的存在很伟大！！！中国人最大的毛病就是不放弃！其实少活一段没啥！要有尊严，有质量的活着才好！,0,22,0,2022-07-23 14:29:04,来自河南,5844114334,时过惊奇
7121581925248140065,叙述混乱，前5年得病，中途出院，三个月后复发，一年后走了，这是什么意思？,2,16,3,2022-07-18 13:36:43,来自内蒙古,5892412926,老兵a0
7123529831660716839,这个大夫真好，临终关怀语言非常重要,0,1,0,2022-07-23 19:35:57,来自山西,5514099000,不能遗忘的金鱼泡泡
7123508225768915744,12年了，希望妈妈还有下一个12年，甚至更多…,0,0,0,2022-07-23 18:11:40,来自浙江,852848109161998,小鱼日记本
7123567758519911183,凡人一生都在对死亡的恐惧中，却不知道，那个时刻其实是喜悦的。,0,0,0,2022-07-23 22:01:52,来自河南,2902306830162126,魏艳枫
7123553961302885134,别过于自责 你家人也是觉得不能陪你们走下去了心里难受才把怨气发泄到你们身上的,0,0,0,2022-07-23 21:08:47,来自浙江,50455912763,水晶之恋3O6D
7121600880620897060,现在的人都有点文化，接触的知识也多，瞒不住的。在猜疑中知道实情是迟早的事。,1,6,0,2022-07-18 14:50:13,来自内蒙古,58549935293,沙柳根1
7123455823266743071,每个人的最终结局，正确认识生死，医生说的对，做好最后关怀，无所畏惧。,0,1,0,2022-07-23 14:47:43,来自辽宁,71347083899,海纳百川看世界
7123491429598921485,能减少痛苦是医生最大的慈悲[赞][玫瑰],0,1,0,2022-07-23 17:06:14,来自新疆,50586933044,视野伯内特1N8
7123519735434101534,看了旅途这个视频我第一反应就是。。。即便是医生，已经看过了很多很多病人最后的情况和面对死亡的述说，但是有一天当自己面对死亡的时候，是不是会有同样的勇气和淡定呢,0,0,0,2022-07-23 18:56:12,来自陕西,87545818862,好吃的大熊哥
7123525407068193574,隐瞒是对的，知道了就是倒计时，数秒活着太残酷，人活是是因为有希望,0,1,0,2022-07-23 19:18:30,来自辽宁,110942343591,往事不随风ZX
7123567033723175720,不要到生命的最后才后悔自己所从事的事业不是自己精神的慰藉与生命的支撑。,0,0,0,2022-07-23 21:59:03,来自河南,2902306830162126,魏艳枫
7121598365959897896,肠癌早期是几种比较容易治的病。没有告诉是你们的错。,1,9,1,2022-07-18 14:40:10,来自重庆,1728054911580028,沉着鲸鱼Sk
7123590359157834535,真的，每个人都有一天要迎接死亡，希望这一天到了的时候，我们没有痛苦没有挣扎，希望世界最后留给你我的是善良和笑容。,0,0,0,2022-07-23 23:31:03,来自广东,2880308916796526,碧水蓝天一抹红
7123558292001555232,家人癌症晚期 现在在治疗中 看到路医生的暖心治疗 对于病人和家属来说 是很温暖的！,0,1,0,2022-07-23 21:25:52,来自上海,18486940846,菲妈在黄浦
7123549594642400041,好医生为你点赞。,0,1,0,2022-07-23 20:51:28,来自陕西,2911097691575096,健康伊夫林3D8
7123556348541043471,了不起的医生！,0,1,0,2022-07-23 21:17:30,来自安徽,417464687011389,笑遇人生
7123453626999718669,有尊严无痛苦是唯一愿望。好医生面对的不易，辛苦了！,0,6,1,2022-07-23 14:39:30,来自河北,1508184159171044,红月亮cl
7123523824728965929,人活着太难了，好好的死也不容易的！,0,0,0,2022-07-23 19:11:33,来自湖北,104940110267,潘氏三姐
7123479398346769156,希望每个医院都有临终关怀！,0,1,0,2022-07-23 16:19:49,来自山东,110924538830,wspfz
7123491510536586021,医生说到点,0,1,0,2022-07-23 17:06:33,来自广东,58917666889,悠闲快乐的小猫
7123584743995622151,只有爱可以超越生死,0,0,0,2022-07-23 23:08:22,来自江苏,70981142973,民27851
7123514135627121442,希望我能遇到这样满怀爱意的表达，期盼不久将来安乐死[鼓掌],0,0,0,2022-07-23 18:34:01,来自安徽,105885523353,快乐山丘We
7123452047562933029,好欣慰，等我不行了我会好不犹豫的告诉大夫，我要结束,0,3,0,2022-07-23 14:33:19,来自天津,2938314629915568,快乐小主hk
7123470348355486502,看的心里太难受了[流泪][流泪][流泪]要死就死在你怀里[快哭了][快哭了],0,3,0,2022-07-23 15:44:40,来自上海,2269004921583879,一眼一生1314
7123580556234965768,医者仁心 这位医生点赞👍🏻👍🏻👍🏻👍🏻,0,0,0,2022-07-23 22:51:56,来自山东,2911103396351223,MYNGYUE
7123498800471622434,很多人，都是压力增加后，担心吓，，个人认为没必要告知，尾生接受顺应活就行，，。,0,0,0,2022-07-23 17:34:32,来自河南,102033747900,鸟語闻香
7123536126740366087,已经和老公登记了器官捐献，希望以后能帮到人。,0,7,0,2022-07-23 19:59:29,来自广东,109712760392,77包子蓉
7123529424284369679,如果谎言可以让不久的余生过得舒服一点，为什么要让残酷的真相打破心理防线，击垮精神堡垒,0,0,0,2022-07-23 19:33:14,来自江苏,3262976493633118,趟过人间
7123570963442271016,不是每个人都能善终，临终能在这样的环境下走完余生，那也是前世修来的福报！,0,0,0,2022-07-23 22:14:19,来自新疆,909987100499251,益西公子
7123567553964049160,只有爱可以超越生死[祈祷],0,0,0,2022-07-23 22:01:38,来自吉林,2999058086232552,小乔mt
7123511363024143119,医是从巫派生出来的，在远古，巫其实很大一部分的作用就是安抚即将逝去的人以及他的亲人的！一旦医生们这么做了，他们就变成了天使。,0,2,0,2022-07-23 18:23:09,来自广东,81899694349,又又
7123454284725142304,每个人的最终结局，正确认识生死，医生说的对，做好最后关怀，无所畏惧。,0,3,0,2022-07-23 14:42:35,来自四川,5779790928,常勃齐
7123524251055571746,只有爱可以超越生死！说得太好了！,0,0,1,2022-07-23 19:13:25,来自湖北,104940110267,潘氏三姐
7123534897012163340,太好了医生,0,0,0,2022-07-23 19:54:52,来自山东,923206438104851,蕾蕾睿睿妈妈爱唱歌
7123550448590111523,中国应该多些这样的好医生。,0,0,0,2022-07-23 20:54:47,来自陕西,2911097691575096,健康伊夫林3D8
7123593067126801160,好医德 大爱无疆，让病人活的有尊严[赞][赞][赞],0,0,0,2022-07-23 23:41:30,来自辽宁,105231273900,故乡云428
7123536749816775458,不怕死，怕没有尊严的活,0,10,1,2022-07-23 20:01:34,来自北京,104950813240,处处有学问
7123499310062715678,好医生[赞][赞][赞][赞][赞][赞][赞],0,1,0,2022-07-23 17:36:40,来自甘肃,58761006989,黄风20
7121694711056433954,和同病房的一聊天就知道八九不离十了，瞒着难那,0,2,2,2022-07-18 20:53:36,来自上海,6855945707,徽姑
7123517152728138509,好医生，点赞,0,0,0,2022-07-23 18:46:05,来自辽宁,79967767837,霞光蝶影71
7123449759486034729,一想到死这个事，心里也怕，但是终归要面对这个事，所以，不要遭罪就可以了。,0,15,0,2022-07-23 14:24:08,来自上海,61685254299,山顶黄金叶
7123540458928259855,只有爱可以超越生死,0,0,0,2022-07-23 20:16:02,来自安徽,50689875820,么宝2016
7121982003259933480,肠癌早期治疗的几率是很大的，可以告诉他，因为肠癌早期是比较容易治的病！,0,3,0,2022-07-19 15:28:39,来自山东,108124951450,裕头河
7123559336957690631,路大夫，别两头跑了就留在北京吧，两头跑太累了，伤身体。留出时间研究治疗肿瘤的方法挽救更多的生命。,0,2,0,2022-07-23 21:29:38,来自北京,5885495052,cwbcwb1111
7123472424200536873,这样的医院这样的医生多一些就好了,0,0,0,2022-07-23 15:52:10,来自湖北,5479583000,小河幸福桥
7123568692420002594,只有爱与信仰能够超越生死,0,0,0,2022-07-23 22:05:37,来自河南,2902306830162126,魏艳枫
7123414151162299151,谵妄。。。,0,1,0,2022-07-23 12:05:54,来自江西,51422197762,小小小万先生
7123574903059677966,当病情控制不住的时候，可以有什么办法，选择慢慢睡去，应该会好点吧,0,0,0,2022-07-23 22:30:02,来自陕西,6581449408,我来说两嘴
7122055129616368418,现在的人不管老年还是青年，都会上网，就像我。只要身体有不舒服，就会在网上打几个字造个句，查询一下，只要描述得正确。会跳出来很多相同的病的解答，自己就能大概知道是什么了，根本瞒不住。,0,2,1,2022-07-19 20:12:18,来自上海,1121133318120883,太极戈
7121691967020909323,可以探索病人对死亡的接收承受能力，每个都享有知情权按排自己的归宿，也是尊重,0,1,0,2022-07-18 20:43:30,来自河北,100929932892,缤纷钢琴jS
7123596774497108766,我堂叔45岁，肝癌晚期今天上午走了！两个月了，三天前才知道自己的病情，上吐下泻都是血才知道的。,0,0,0,2022-07-23 23:55:58,来自河南,53062516300,蜀北风光
7123497798808978188,为这个大夫点赞。好大夫,0,0,0,2022-07-23 17:31:37,来自北京,100980828399,云彩547
7123526072926978849,看这些就不后悔老父亲临终时对他老人家的照顾和陪伴！老父亲你再多活几年多好！,0,0,0,2022-07-23 19:21:18,来自吉林,5751935460,晓秋62996221
7123557168107750147,医生都会说 天天面临生离死别 都练出来了,0,0,0,2022-07-23 21:21:15,来自北京,94509945654,对你一薪一亿328
7121587264325124904,肠癌发现一般都是晚期，还是告诉他，,0,1,0,2022-07-18 13:57:02,来自河南,6048607142,lzsslzss
7123548825322750760,有些人过于惧怕死亡，活的时候过得没有遗憾，坦然接受死亡,0,0,0,2022-07-23 20:48:32,来自浙江,6579708730,小火车971401
7123469358844363527,只有爱能够超越生死[赞],0,0,0,2022-07-23 15:41:10,来自山西,122748307781373,幸福布里顿8H4
7121592870741558029,最好不要说 说了 活在压力下对病没有好处,0,13,6,2022-07-18 14:18:58,来自北京,93061834460,西西qy
7123567224958305024,个人觉得老百姓只要觉得身体健康，最好不要自己花钱就体什么检，只要心情好，抵抗力、免疫力就好，不知不觉中健健康康。,0,1,0,2022-07-23 21:59:46,来自江苏,50016027798,小蕊230
7123480787567313664,良心好医生,0,2,0,2022-07-23 16:24:41,来自甘肃,1574128025080206,6426934
7123473336579015456,"别强求不放弃，，，延长的是痛苦
总要走，，，体会陪伴老爷子6个月",0,0,0,2022-07-23 15:56:17,来自云南,84913735449,想入非非野脚
7121707226531922688,无须自责，做的没错。,0,3,0,2022-07-18 21:42:02,来自内蒙古,108752732113,奇幻菠萝x
7123573521783145229,背后发凉 这个用词可当？,0,0,0,2022-07-23 22:24:33,来自广西,61854722491,清雅晚枫
7121642670313325324,还是不告诉好 心态再好的人也会有压力 对病沒好处 应在人生有数的曰子里轻松幸福的去度过,0,1,1,2022-07-18 17:32:45,来自北京,8432722946,元气艺术家P9
7123537502988124969,忍受疼痛是软暴力,0,0,0,2022-07-23 20:04:39,来自北京,88233215991,殷学尧
7121668079335572235,是否告知或者什么时候告知，要根据患者的心理承受能力和病情而定，不能一概而论。,0,7,1,2022-07-18 19:11:09,来自广东,246765938548952,清茶一杯
7123446380773065476,也没说啥病啊,0,0,0,2022-07-23 14:11:44,来自山西,100464311583,铁血三晋王
7123529437269738278,今天下午刚刚买了你的书，准备拜读[作揖],1,3,0,2022-07-23 19:33:53,来自江苏,6029255844,绿色风景线1976
7121547308965528335,应该告知他，除非他不识字，现在患病后要做那么多检查，不可能隐瞒的了的,0,8,1,2022-07-18 11:21:46,来自广东,50318486461,亚洲猪猪侠
7123517646905393927,路大夫真的和蔼可亲，大慈悲,0,0,0,2022-07-23 18:48:07,来自天津,4901207757,SusanMAMA
7123448760848007947,表姐的婶婶，中期，告知病情，天天哭，半年就没了，我们都觉得是吓死的，心态没调整好。我伯伯，中期，联合医生没告诉，骗着说是癌前病变，根治术后痊愈。,0,1,0,2022-07-23 14:21:18,来自浙江,440238254341000,碎薯片
7123470587372552968,主任真亲切,0,3,0,2022-07-23 15:45:35,来自北京,4327299813215934,善良的爱莲
7123459862645801765,除了医术，还要掌握心理医生素质,0,1,0,2022-07-23 15:03:46,来自福建,2286613058822493,子墨成长记
7122851109601379113,我们老家有个说法叫乱做乱着。这也是一种大度。意思是你不告诉是对的，你若若告诉也是对的。你爸爸应大度和包容后辈。他耿耿于怀是欠妥的。,0,0,1,2022-07-21 23:41:44,来自广东,94536568927,user4524390121278
7123579033522160424,但愿人世间少些疾病,0,0,0,2022-07-23 22:45:47,来自北京,3715350728,南淝水人家
7121716587723703075,是不是五年前的事？叙述缺乏条理性罢了！愿天下有癌能治愈的日子这就到来吧[祈祷],0,2,0,2022-07-18 22:18:41,来自山东,21518199362,奇妙菠萝XZ
