7123495277792789261,应该是不甘心吧,0,0,0,2022-07-23 17:21:12,来自广东,3157449592544583,顺其自然爱心吧
7123489156483547919,路大夫功德无量[祈祷][祈祷][祈祷],0,0,0,2022-07-23 16:56:58,来自上海,84124254727,一碗汤98
7123508117929460488,任何人终有一死，迟早这一天都要来的，活的质量确实比长度重要得多，,0,0,0,2022-07-23 18:11:15,来自广东,58895080294,漫步人生路186082835
7123557189788664576,感恩父母！日行一善！,0,2,0,2022-07-23 21:20:51,来自浙江,111168802041,悠闲sky
7123588095496667939,说得太好了,0,0,0,2022-07-23 23:21:16,来自湖北,104940110267,潘氏三姐
7123486198588556063,这样的医院多一点，人都要走的，走的舒服一点，安详一点,0,0,0,2022-07-23 16:46:02,来自浙江,6044450094,李东77185287
7123596455079936776,难得糊涂，不是没有道理的,0,0,0,2022-07-23 23:54:56,来自广东,101789731685,桂Dd
7123588378196951846,事实证明，一个人只听得见谎言，活在幻想中，不接受事实,0,0,0,2022-07-23 23:23:23,来自广西,98206750014,广西周小龙
7122302802550473483,现在告不告诉早点晚点。病人都会知道。除非85岁以老人[呲牙],0,1,0,2022-07-20 12:14:15,来自广东,3976274362767837,龙哥
7123563345739449095,哈哈！从开始就没怕过,0,0,0,2022-07-23 21:45:24,来自北京,1002393699099963,勇者胜8127
7121699685693522719,你做的对，早告诉他走的更快，它就是个代名词，放下心结,0,3,3,2022-07-18 21:13:03,来自云南,659317152550079,进取松鼠uM
7123423930190627618,没有生死。,0,6,0,2022-07-23 12:43:57,来自山东,55186007291,zhaohua699
7123441040429679400,凭良心说。五年后复发，家属已经做的不错了，,0,0,0,2022-07-23 13:50:12,来自上海,1610120554879536,丁丁蓝莲花
7123548384270566185,"害不害怕也没用
人早晚都会死
无常大鬼不期而至
一饮一啄莫非前定",0,0,0,2022-07-23 20:46:34,来自天津,3566430478414637,南極能
7123488275557991183,不用恐惧死亡如果爸爸妈妈都过世了其实就是去找爸爸妈妈了！这样一想反而快乐了，就当自己还是儿时的自己还是那么依恋妈妈的怀抱！,0,0,0,2022-07-23 16:53:43,来自黑龙江,1666468006855636,软笔硬笔板书高效精讲讲的透彻听的明白
7123512029067019042,一点不害怕，是假的。只是无能为力，没办法。麻木了。变成了不害怕。能成成，不能成，也无所谓，还能怎样。,0,0,0,2022-07-23 18:25:47,来自河南,76574403631,草根250017176
7123366847647007499,你爸之所以耿耿于怀，就是觉得人财两空不值得，很可能这就是他埋怨你们的根本原因，老人只希望你们比他过得好就很知足，不希望钱花了人没了，给你们增加不必要的负担。,0,0,0,2022-07-23 09:03:31,来自山东,110175665182,海的那一边wkd
7123583097891242763,还是不告诉的好吧！,0,0,0,2022-07-23 23:02:42,来自北京,329480336846675,不凡小羊Pn
7123149509625922335,如果让亲人死不明白，你会后悔一辈子！,0,0,0,2022-07-22 18:59:06,来自江西,5458100048,15879072298
7123533922952053544,有那么好的医生吗？,0,0,0,2022-07-23 19:50:39,来自广东,75166190358,gdcpb
7123518994233312036,最好还是瞒着,0,0,0,2022-07-23 18:53:18,来自河北,79889177517,夏梦53408
7121562884094051105,文化水平高的人，根本瞒不住,0,8,2,2022-07-18 12:23:06,来自山东,95377743123,月光溶溶
7123520851106087721,天天面对那些心理真强大。,0,2,0,2022-07-23 18:59:59,来自江苏,110283141168,好奇卡梅尔7j2
7123486884890084111,这种问题，很残酷[思考][思考][思考],0,0,0,2022-07-23 16:48:13,来自上海,84124254727,一碗汤98
7123424270549517070,质量更重要！,0,7,1,2022-07-23 12:45:17,来自上海,2903156743218604,牛娃宝贝
7123524250908394276,这个医院可以做维达纸巾的代言人,0,0,0,2022-07-23 19:13:45,来自广东,6712320971,工人农民当家做主
7123424062390518563,不存在生死。,0,1,1,2022-07-23 12:44:13,来自山东,55186007291,zhaohua699
7123572666808222468,感谢大夫[祈祷]感谢护士[祈祷],0,0,0,2022-07-23 22:21:50,来自甘肃,87812151853,鼎.com【服务车之家】
7121555285168390926,对文化水平比较高的病人，想瞒也难！,0,5,1,2022-07-18 11:53:04,来自北京,2480132791743176,M42
7123547416351572750,太感人了，医者大爱,0,0,0,2022-07-23 20:43:23,来自黑龙江,69994242150,爱有时像杯苦茶
7122616244356104975,天生不讲理的告知于否都会怪罪他人,0,0,0,2022-07-21 08:29:43,来自江苏,3110689826,kw14
7123579194671629088,好医生！,0,0,0,2022-07-23 22:47:12,来自山东,111002640141,智勇双全荷叶gB
7121930991299855140,幸好你没有告诉他，否则他早就走了！,0,0,0,2022-07-19 12:10:11,来自广西,813280980378364,广西李局
7123495357875012359,希望当你的乘客会越来越少,0,1,0,2022-07-23 17:21:45,来自广东,2396553068695715,最聪明
7123454500521952030,怎么找到你们,0,0,0,2022-07-23 14:42:47,来自山东,3457277087464776,茶香
7123581887817925391,谁也跑不了 顺其自然就好,0,0,0,2022-07-23 22:57:08,来自湖北,2555678711361278,相往正义
7123454801752933135,每个人都会到那时候，坦然面对，当两个世界，这个世界结束了去下一个世界！,0,1,0,2022-07-23 14:43:57,来自江苏,72308143467,米白色的蔷薇
7121582800218211072,告诉他也是死，不告诉他也许多活几个月，也是好意。,0,16,2,2022-07-18 13:39:33,来自上海,1499374465846007,勇往直前的明月2v
7123453481482175236,我想活到150岁再死！[大笑][大笑][大笑],0,0,0,2022-07-23 14:39:20,来自吉林,65028400781,自日工
7123534231032201988,化作了光 继续照亮黑暗,0,2,0,2022-07-23 19:52:31,来自广东,6522588488,czi93906511
7123438209736327948,大夫说的真好,0,1,0,2022-07-23 13:39:55,来自内蒙古,70691229398,fmrobin
7123552670069162789,我父亲就是在我怀里走的[流泪][流泪][流泪],0,0,0,2022-07-23 21:03:32,来自天津,50817170219,159286666
7123514435717251872,谵语，应是热症。,0,0,0,2022-07-23 18:36:11,来自贵州,52845260767,爱思考草莓6k
7121600602375308066,要是一直不说，就没事了,0,3,0,2022-07-18 14:48:42,来自山东,110612025147,97777701724106
7121732977922704141,请问你爸是动手术后几个月转严重的？,0,1,0,2022-07-18 23:23:24,来自贵州,63415121705,用户ywP63415121705
7123495268145742600,好伤心！[祈祷][祈祷][祈祷],0,1,0,2022-07-23 17:21:01,来自山东,2393012372248878,优美像风一样自由
7123423875769647872,三世因果，六道轮回。,0,4,1,2022-07-23 12:43:42,来自山东,55186007291,zhaohua699
7123455118070301481,《旅途》。,0,0,0,2022-07-23 14:44:56,来自内蒙古,111412492256,爱乐无忧
7123447357647323943,最好是不要告诉,0,0,1,2022-07-23 14:15:32,来自湖南,91992786211172,为了一切真理
7121737152887096075,应该告知的,0,1,0,2022-07-18 23:40:31,来自江苏,102295442560,罗罗的联想
7123479436925747999,好心酸[流泪][流泪][流泪],0,1,0,2022-07-23 16:19:43,来自四川,246712368896407,幸福梅卡伦
7123468461149700878,好感人,0,1,0,2022-07-23 15:37:12,来自山东,104022224124,坦荡的小猫4u
7123444645719360264,质量重要,0,2,0,2022-07-23 14:04:40,来自安徽,61794573689,可人hp
7123580659088065280,怕死,0,0,0,2022-07-23 22:52:15,来自重庆,50062731864,李雄武1
7123453651204752128,怕疼,0,0,0,2022-07-23 14:39:23,来自江西,111349666689,自在的幽默天空
7123389572356784926,别难过,0,0,0,2022-07-23 10:31:16,来自湖南,2291835165745919,睿智高山3D4
7121648805287789320,不必介怀！即使一早就告诉了他，临了快走的前几个月有很多人也会精神崩溃掉！甚至有的人还会狂躁焦虑精神分裂！有的人一直胡言乱语骂人什么的，我爸一生儒雅绅士，到癌症晚期最后一个月就进入瞻望状态，幻听幻觉，自言自语，有时在发表讲话，后让大家鼓掌灬总之由于对生命的绝望，巨裂的疼痛，止痛药的刺激，常期不能进食激素电解质紊乱等原因会让一个患者彻底失去理智，有些人会骂亲人，会抱怨，会对生命报希望之后的绝望…..。太痛苦了，愿天堂没有病痛！现在回想起来还会泪奔!!！,0,0,0,2022-07-18 17:55:54,来自山东,6091529096,飞舞飘落啊
7123570579571311401,中国人接受的死亡教育太少了，都对死亡有一种莫大的恐惧，慢慢的我们也要多了解，多去宣传些死亡教育，让病人知道死亡并没那么害怕，最主要是不要在最后的阶段太痛苦。,0,0,0,2022-07-23 22:12:47,来自上海,5329872477,菲儿呢喃
7123477185881080576,这里的医生怎么会这么善良，真生病来这医院看也算是有福之人了。,0,3,0,2022-07-23 16:10:45,来自浙江,111629156832,闲草62
7123474992079307528,很好的医生，医院，医疗服务！我们都应该这样对待生死！没有质量的活着有什么意义？,0,1,0,2022-07-23 16:02:39,来自广东,1763271326566788,爱生活的奶酪DN
7123433749467579140,第一次听到晚期病人谵妄的词 。唉…..,2,6,0,2022-07-23 13:22:53,来自上海,23052173801,峨媚
7123517978771129120,好医生有大爱[赞]临终关怀医院多一些像您这样的医生，是临终病人和家人最大的福气[赞],0,0,0,2022-07-23 18:49:32,来自浙江,50675073341,景色真好看
7123526457091638057,这样的医院比心♥️更伟大，应该极力推荐，让百姓都死得起,0,0,0,2022-07-23 19:21:58,来自北京,101764034892,缤纷铅笔j
7123557250643886886,有道义有善义的好医生，能在他手里临终也是一种福。,0,0,0,2022-07-23 21:21:38,来自山西,2383342098448711,多才多艺的花豆
7123550911620203299,有多少有医德良知的医生。。。。[发怒][发怒][发怒],0,0,0,2022-07-23 20:56:35,来自安徽,593367714511646,咒骰L
7123462514147033856,希望这样的医生多一些，特别是老年死者再缺关怀。,0,0,0,2022-07-23 15:13:52,来自浙江,101827381292,喻瑞耿
7121609792422462223,肿瘤病人治疗的比不治疗死的更快！唯一的就是有个好的心态！,0,1,2,2022-07-18 15:24:22,来自江苏,64336682754,黄老邪K歌男神
7123575495278740224,我爸在icu走的[流泪],0,0,0,2022-07-23 22:31:59,来自陕西,91658143510,OnceYou915
7123594849190396702,"医生大多也想工作时间做仁心之事儿，但是社会是功利的，有考核指标。
不是有钱人真的付出足够钱保住医生收入，真是没法让医生静心去了解你的情况。",0,0,0,2022-07-23 23:48:48,来自江苏,75521950814,donglintao
7123474576654631718,这是在为安乐si造势吗？,0,0,0,2022-07-23 16:01:29,来自广东,64482029403,大侠82096
7121620398034404109,估计写文章的思绪很乱，语无伦次,0,0,0,2022-07-18 16:05:53,来自四川,3847889204034029,鹏程万里六号门
7123568213589345062,人性化服务！！[赞][赞][赞][赞][赞][赞][赞][赞][赞][赞][赞][赞][赞][赞][赞][赞][赞][赞][赞][赞][赞],0,0,0,2022-07-23 22:04:13,来自澳大利亚,50077322822,大连小欢乐
7121552300216517415,至于吗？,0,0,0,2022-07-18 11:41:56,来自北京,93269482064,年儿52
7123566470956696354,不要把病人一个人孤独地丢在死亡里,0,0,0,2022-07-23 21:56:45,来自河南,2902306830162126,魏艳枫
7123528905172091685,有钱真好，临终可以去这种医院，减少痛苦,0,0,0,2022-07-23 19:31:37,来自四川,6187758119,wys用户
7123454636711117603,我从查出患癌晚期，医生让我出去，让老伴留下，我就知道了，得了癌症，从来没有自己的病伤心流泪过，从不担心什么时候离世，只是希望临终时，不是那么痛苦，既期待能够好好的活着，又希望哪天，晚上睡着了，再也不再醒来，对于癌症 晚期病人来说，是幸福的！,2,1,0,2022-07-23 14:43:06,来自湖北,6003349679,用户6003349679
7121569969082778405,大夫说大部分的癌症都能治好，前提是最好不要让患者知道病情，如果患者提前知道了还没等治就吓死了,2,3,0,2022-07-18 12:50:00,来自山东,99760583477,用户6682976933465
7122085997886194432,我婆婆肠癌一发现马上做手术现在又活了15年了,0,0,0,2022-07-19 22:12:05,来自北京,104415197351,用户5307391364462
7123582628410065702,大夫 我希望一个人孤独的死去 正常吗？,0,0,0,2022-07-23 23:00:50,来自湖北,6990724771,手机用户6990724771
7123557152857785129,这个医生很值得尊敬的，他的语言有力量有智慧…,0,0,0,2022-07-23 21:20:44,来自湖南,3487296771856675,用户6851273207389
7122013934227374888,最好不要说 说了 活在压力下对病没有好处,0,1,0,2022-07-19 17:32:28,来自山西,1882827175765277,用户3308277422999
7123503512306565888,給这个医生点赞，耐心有担当[赞][祈祷],0,2,0,2022-07-23 17:52:54,来自山西,237092795846343,用户5500308512625
7123590502284509991,我的奶奶前不久去世，96岁，也是捐献者。,0,0,0,2022-07-23 23:31:36,来自浙江,100376764530,用户8644511474030
7123405680681190147,生死是每个人必须要面对的，关键是坦然面对，有尊严的活好每一天！,0,18,1,2022-07-23 11:33:38,来自山东,84349885446,用户6571867321168
7123457835291329284,医生讲得好[比心][比心][比心][比心],0,2,0,2022-07-23 14:56:03,来自陕西,1679681667209339,用户2425782870754
7123531977055683328,遇到有爱心的医生是每个患者所期盼的，希望所有的医护工作者都是患者眼中的白衣天使[祈祷][祈祷][祈祷][赞][赞][赞][玫瑰][玫瑰][玫瑰],0,0,0,2022-07-23 19:43:15,来自上海,563403409588527,用户3702388928149
7123499171155673892,祖国中医药是能解决肿瘤患者晚期疼痛的，为啥不用呢,1,0,0,2022-07-23 17:36:10,来自辽宁,104859695711,用户9205323983370
7123458242491515682,哪里的医院，这么好的医生，和蔼可亲平易近人，唉，原来是拍摄角度。,0,0,0,2022-07-23 14:57:17,来自黑龙江,99807647275,用户99807647275
7123556005048288040,好医生，这个工作不简单,0,0,0,2022-07-23 21:16:12,来自湖南,3487296771856675,用户6851273207389
7123450597739315975,这医生太面善，心服口服，,0,5,0,2022-07-23 14:27:49,来自广西,110114200226,用户4105164789956
7123489185377878814,难遇这样的好医生,0,0,0,2022-07-23 16:57:17,来自山西,103063804126,用户7521405257687
7121652612604396303,隐瞒病情是善意的谎言,0,2,0,2022-07-18 18:10:24,来自广东,97157550210,用户302663730281
7123594602212262669,一直不知道这是哪里的医院。,0,0,0,2022-07-23 23:47:04,来自湖南,2198640330292701,用户549085551778
7123593621886272292,这是哪里的医院,0,0,0,2022-07-23 23:43:47,来自湖南,2198640330292701,用户549085551778
7123594033817174815,这个医院在哪里？,0,0,0,2022-07-23 23:45:02,来自湖南,2198640330292701,用户549085551778
7123511099747664652,致敬好医生，祝好人一生平安[666][666],0,0,0,2022-07-23 18:22:35,来自广西,101126055426,用户3914323355633
7121632718085702441,如果家属陪着看病的，还是不告诉为好，但要吃药配合治疗，心情好有助于康复或延缓病情！,0,1,0,2022-07-18 16:53:21,来自上海,2964749809097056,用户4965486103175
7123591795745145634,这个大夫好伟大[赞][赞][玫瑰][玫瑰],0,0,0,2022-07-23 23:35:52,来自北京,1860018981584174,用户6654501188355
7123515957968110343,这医生好。,0,0,0,2022-07-23 18:41:23,来自江苏,417448336038846,用户720979255512
7123531399927874343,我觉得每个城市都应该有个这样的医院。,0,0,0,2022-07-23 19:42:00,来自重庆,108833291748,用户9411860631343
7123261436519957262,病情应如实告之患者，他有知情权！当子女的不耍自以为是，这样太伤害老了！,0,0,0,2022-07-23 02:20:46,来自山东,107877307618,用户2688696767340
7121898427462124291,世事无常，不知哪天就到自己身上了,0,1,1,2022-07-19 10:05:28,来自北京,2743998669130587,用户4629632993370
7123570326751200014,关注路桂军主任,0,0,0,2022-07-23 22:12:13,来自重庆,725333955843422,用户9033313183338
7123568631275406115,这医院在哪？,0,0,0,2022-07-23 22:05:16,来自辽宁,3597254473291486,用户3850555988891
7123521561068012329,死不怕，痛快点,0,0,0,2022-07-23 19:03:02,来自湖南,4239341112277118,用户6329741225888
7123495569616012035,超越生死的，只有爱。,0,0,0,2022-07-23 17:22:37,来自山东,1767632615249488,用户2672292394859
7123535885291455263,支持国家立法通过安乐死法䅁！,0,0,0,2022-07-23 19:58:58,来自新疆,110144416292,用户3839631002320
7121858911665865472,不做手术吗？,0,1,0,2022-07-19 07:31:16,来自广东,1433366287623822,用户7270536947804
7121567541642363682,早告诉，早知道，少遭罪。,0,3,1,2022-07-18 12:40:17,来自北京,3051866028515015,用户358190837439
7121691074816983808,做得不对！,0,0,0,2022-07-18 20:39:32,来自吉林,553767482173150,用户4226312116332
7122070129151935247,如果告诉他 早就走了,0,0,0,2022-07-19 21:10:15,来自四川,901240150828652,用户7207059932500
7123456127089738510,好医生,0,0,0,2022-07-23 14:48:55,来自吉林,4089830968138573,用户3757862530540
7123569245673816840,这个不好说,0,0,0,2022-07-23 22:08:14,来自北京,105101410409,用户3503067468190
7121594706613781263,信息这么发达满住一个人非常难，除非没有读书，网上一查就知道了，，，,0,2,1,2022-07-18 14:25:46,来自湖南,2488886310996728,用户5207410999497
7123547901149807398,关注了！,0,2,0,2022-07-23 20:45:13,来自上海,98238233081,用户98238233081
7123508438701441792,希望中国有安乐死啊,0,1,0,2022-07-23 18:12:07,来自广西,927600475646141,y125635896731
7123446991061074688,千古艰难唯一死,0,2,0,2022-07-23 14:13:32,来自江苏,2686862134633211,再展征程
7123488207387329295,安乐死啥时候能通过呀[流泪],0,0,0,2022-07-23 16:53:13,来自青海,68340801441,起来讲话
7123460721056400128,转发,0,0,0,2022-07-23 15:06:38,来自北京,2176660541800519,海燕啊你可长点心吧
7122765658601259807,从来不看,0,0,0,2022-07-21 18:10:09,来自浙江,2691235450489368,温柔深州5P3
7123448638936171305,希望可以安乐死,0,8,0,2022-07-23 14:19:57,来自广西,88608136801,宁愿从没遇见
7123566970318422820,真的希望我们国家以后可以实施安乐死，,0,0,0,2022-07-23 21:59:19,来自河北,22324892773,奋斗213787166
7123480513721533191,如果我到了这一天，希望能选择安乐死。,0,1,0,2022-07-23 17:24:31,,101903416358,清风逐月897
7123493886022140680,有安乐死就好了。,1,0,0,2022-07-23 17:15:39,来自上海,110532016198,热爱评弹
7123508636005565216,强烈建议安乐死实施,0,0,0,2022-07-23 18:13:40,来自安徽,58639196770,奋发有为高山Gs
7123465872555410217,[祈祷][祈祷][祈祷],0,1,0,2022-07-23 15:26:49,来自江苏,6421176204,A墨染指尖忧
7123452389810111243,[赞][赞][赞][赞],0,0,0,2022-07-23 14:35:21,来自辽宁,2203049262317800,只因有你不孤独g
7123448496317514511,[祈祷][祈祷][祈祷],0,1,0,2022-07-23 14:19:23,来自广东,3865533435877976,愿力行
7123545178065077022,[祈祷][祈祷][祈祷][祈祷][祈祷][祈祷][祈祷],0,0,0,2022-07-23 20:34:34,来自黑龙江,69994242150,爱有时像杯苦茶
7123512667813724962,[赞][赞][赞][赞],0,0,0,2022-07-23 18:28:15,来自广东,53032333187,手机用户53032333187
7122052735390335784,[赞],0,0,0,2022-07-19 20:02:58,来自辽宁,3175864392750352,用户2887843163064
