7123515399161348899,上次听说景泰是去年马拉松事件，21人死亡。,13,392,2,2022-07-23 18:38:55,来自北京,3197014391667315,城市有爱
7123515343850472232,现在的单位净顾着挣钱了,9,351,5,2022-07-23 18:38:29,来自河北,2062309900167806,淡定雪梨qC
7123515333264425762,创城加罢了，安全一票否决,3,163,1,2022-07-23 18:38:40,来自甘肃,5922847980,一片雄心在西凉
7123514731004117797,调查组马上到,2,146,2,2022-07-23 18:36:37,来自海南,100170315512,佛来咯饿么
7123551033175147297,煤矿工作较危险，要注意生产安全。,1,7,0,2022-07-23 20:57:32,来自福建,4142560058023691,薇薇逛红尘
7123514993777672975,痛心！应该都是家里的顶梁柱，太不幸了。愿逝者安息，伤者早日康复。失联人员平安无事。[祈祷][祈祷][祈祷],3,388,8,2022-07-23 18:37:23,来自陕西,2590084826406547,秦观鹊桥仙
7123547034392871714,"7月23日11:15左右，景泰县一煤矿企业内发生一起山体坍塌事故，将施工人员及车辆掩埋，目前已造成9人死亡，7人轻伤，仍有1人失联。
作为煤矿，进厂道路两侧的地质情况应该清楚，应该了解哪些地段可能出现塌方，并安排人员监测，以防出现塌方。
从发生的这起事故看，煤矿对进厂道路的情况不了解，也没有安排人员监测，应吸取教训，做好煤矿全范围的安全工作。",0,18,0,2022-07-23 20:41:31,来自福建,3988633799889240,Zhtl
7123542657125106446,"又是几个家庭失去儿子丈夫父亲，一路走好~
像我们这样的家庭，稍稍有点积蓄，谁会干那危险的工作，我的父亲，快70了，还在工地上干小工，老实本分做好自己的事，生怕老板觉得年纪大了，不要父亲干了，我可怜的父亲，一生都在为生活奔波！
愿好人都平安",6,48,0,2022-07-23 20:24:57,来自湖北,5845841633,扬洁
7123521990094635807,失联一人是关键，相差一人，事故级别就不一样了,10,104,0,2022-07-23 19:05:10,来自河北,92598396287,1325468097
7123514632866071336,甘肃现在好难啊[祈祷][祈祷][祈祷],2,198,2,2022-07-23 18:35:59,来自北京,70642010776,是孟掌柜吖
7123537078948250371,山体滑坡的原因是什么？出了这么大的事故，让人痛心。,1,15,0,2022-07-23 20:03:54,来自浙江,1085943275858573,完美白云晓晓
7123517101788349224,9人死亡属于较大事故，10人死亡为重大事故,13,101,2,2022-07-23 18:45:29,来自上海,107865926034,邱树强讲建造师
7123527610222887684,作为一个安全管理工作者，心里真不好受。9人死亡，1人失踪，看来要成为重大安全事故了。,1,36,0,2022-07-23 19:26:59,来自甘肃,65036001898,前进的微风
7123515382971351823,我的天呐[震惊][震惊][震惊]辛苦的煤矿工人高危职业啊[震惊][震惊][震惊][震惊]鲜活的九条生命啊，瞬间即逝[震惊][震惊]请一路走好……,1,80,0,2022-07-23 18:38:55,来自浙江,50002628658,红红正者无敌
7123519702110241544,这属于重大安全事故了吧，死这么多人。,3,23,0,2022-07-23 18:56:08,来自贵州,1134305760517015,凌云上九霄
7123525288327316235,我是煤矿长大的孩子，记得小时候事故发生的多，有时候死很多都是放停尸房，我们孩子从来不敢从那里去走的。还好我爸爸是修理机器的，有时候也会下井去修理，感谢老天保佑，现在退休很多年了。矿山工人都是不容易的，为了生活，负重前行。,0,14,2,2022-07-23 19:17:53,来自湖南,3267506880,秋水盈盈10086054
7123516395471749927,重大事故，报国务院，省级应急管理部调查。,5,72,1,2022-07-23 18:43:18,来自北京,106070376495,龙玉7562
7123517547153982243,甘肃景泰煤矿坍塌事故已致9人死亡，坍塌的可是9个家庭的顶梁柱，真让人心痛！愿逝者安息🙏安全生产警钟长鸣！,0,105,1,2022-07-23 18:47:19,来自河北,50577328190,作家书童诺雅
7123530133856158471,矿山作业安全第一！出这么大的事故，矿长是第一责任人，安全检查员付全责！,1,5,0,2022-07-23 19:36:30,来自内蒙古,62710775304,莲的心事王美莲
7123527058235638560,安全第一，希望这样的事故不要发生了，逝者安息吧,0,3,1,2022-07-23 19:24:53,来自江西,2802002941444379,铭果果好歌
7123514789191861029,这是安全事故还是自然灾害？！,14,81,4,2022-07-23 18:37:03,来自甘肃,80577206071,云淡风轻hanb
7123514828467208968,目前已造成9人死亡，7人轻伤，仍有1人失联。[流泪][流泪][祈祷][祈祷][祈祷],1,38,1,2022-07-23 18:36:58,来自上海,993555120396158,你好kRyc
7123516160670466827,当地已成立了现场指挥部，下设应急救援、医疗救治、善后处置、事故调查等5个工作组，组织消防、应急、医疗、公安、矿山救护队、信号保障等力量全力开展救援。,2,31,1,2022-07-23 18:42:27,来自河南,237932696570403,依然
7123515044683907874,又是一起安全事故 ，愿死者一路走好 ！家属节哀 ！愿伤者早日康复 ！失联者尽快解救 ！,1,98,2,2022-07-23 18:37:38,来自吉林,109265838524,开心1002923576858
7123551004850733856,年年强调安全生产，还是会有这样的事情发生,0,5,0,2022-07-23 20:57:17,来自福建,4142560058023691,薇薇逛红尘
7123514805348287232,痛心！应该都是家里的顶梁柱，太不幸了。愿逝者安息。[祈祷][祈祷][祈祷],0,103,1,2022-07-23 18:36:33,来自陕西,2590084826406547,秦观鹊桥仙
7123515486071505701,都是家里的顶梁柱，早日查明原因。,3,78,2,2022-07-23 18:39:40,来自山东,2973492860176958,直率明月66
7123521804471649064,人生无常，悲剧痛心啊，希望其他被困人员尽快被安全救出，辛苦救援人员了，注意安全,0,77,1,2022-07-23 19:03:51,来自广西,68026245895,你的小红帽已上线
7123517729453196043,"山西焦煤民爆集团工作人员正在前往甘肃泓胜煤业作业途中，突遇山体坍塌，将施工人员及车辆掩埋。
说明让人弄不清，在井下还是井上。总之9人死亡，一人失踪，伤亡数很大。",5,13,0,2022-07-23 18:48:26,来自四川,5937784511,明事益言
7123523793343021858,9人死亡，这是个重大事故，痛心，愿逝者安息，伤者早日康复。,1,12,1,2022-07-23 19:11:22,来自山东,67689488362,直爽海浪oH
7123524439874650914,煤矿工人死了九人算不算重大责任事故？,1,23,0,2022-07-23 19:13:59,来自吉林,3244989028,高枫DJ
7123516171491820303,安全第一，希望这样的事故不要发生了，逝者安息吧[祈祷][祈祷][祈祷],1,33,0,2022-07-23 18:41:48,来自陕西,1785218499612287,廉水河畔
7123520502433530664,希望伤亡人数不要再增加了，痛心,1,6,1,2022-07-23 18:58:36,来自甘肃,1029593399574174,灵巧画板7D
7123530242282603298,安全责任，重于泰山！,0,2,1,2022-07-23 19:36:28,来自四川,7742029394,大杨说法
7123535299380691727,"希望轻伤的7人尽快康复，失踪的一人尽快找到。
救援队员一定要注意安全，你们辛苦了！",0,15,0,2022-07-23 19:56:10,来自山东,92229091067,幸福心盈
7123515001675006732,天哪天哪。调查什么造成的？逝者安息。搜救人员也要注意安全啊,1,11,1,2022-07-23 18:37:59,来自四川,99731013308,麦子2511
7123526470198117131,煤矿工作较危险，要注意生产安全。,0,35,0,2022-07-23 19:22:18,来自浙江,103202792224,乐观的豁达霞姐
7123558935965696802,越野出事的那个景泰县吧？,2,4,0,2022-07-23 21:27:45,来自广东,6096876703,明利78902471
7123584346652967684,煤矿山体坍塌事故，已致九人死亡，一人失踪，愿死者安息， 生者无恙[加油][加油][加油],0,1,0,2022-07-23 23:07:39,来自北京,64052424912,一往无前画板g8
7123527961491686156,每次看到这样的新闻，心情久久不能平复，为何往往发生事故的时候，总有矿工在井下作业？煤矿企业的消防安全是否到位？对于这样的突发情况，有没有预警机制？是企业在偷工减料还是不可预测的意外？,2,17,1,2022-07-23 19:28:25,来自重庆,2787996714150359,大气艺术家3h
7123516305415783209,煤矿生产，安全措施一定要做好，愿逝者天堂里没有灾难[祈祷][祈祷][祈祷][祈祷],1,14,1,2022-07-23 18:42:21,来自新疆,184335909002219,九月菊花傲枝头
7123531997368599331,希望能找到失联人员，救援人员辛苦了！,0,12,0,2022-07-23 19:43:15,来自辽宁,931990306566791,用户自由飞翔一鸿雁
7123515560667087653,目前已造成9人死亡，7人轻伤，仍有1人失联。愿逝者安息！伤者早日康复！失联者尽快解救！[祈祷][祈祷][祈祷],0,41,0,2022-07-23 18:40:04,来自上海,993555120396158,你好kRyc
7123525103274771204,可惜了。看到听到这类报道很痛心，鲜活的生命就这样没了,0,34,1,2022-07-23 19:17:02,来自浙江,55081452224,竹语声150277169
7123522287168832296,“景泰县一煤矿企业”与“甘肃泓胜煤业”什么关系，文章没有说清。,1,1,0,2022-07-23 19:05:35,来自江苏,43633275315599,吴县风筝
7123529839672034087,安全无小事，9条鲜活的生命，9个家庭的悲剧！逝者安息，愿天堂无苦难[祈祷][祈祷][祈祷],0,13,0,2022-07-23 19:35:52,来自浙江,4121423918148318,过去邦邦两圈
7123583214886978315,甘肃景泰一煤矿企业内山体坍塌事故已致9人死亡。愿逝者安息，伤者早日康复。失联人员平安无事。愿一切安好。,0,0,0,2022-07-23 23:02:51,来自福建,1244263130604359,欧阳楚陌
7123524678689686313,多灾多难。愿逝者安息！家人节哀！,0,9,0,2022-07-23 19:14:52,来自湖南,554600593372527,爱音乐伊夫琳5W8
7123514615694787328,愿逝者安息，愿生者坚强，人生无常，珍惜当下！希望其他被困人员安全救出,1,74,1,2022-07-23 18:36:01,来自广西,68026245895,你的小红帽已上线
7123531163628684073,章义伍说过，每天安排一个副矿长跟着矿工一起下井，煤矿事故会降低很多很多。我觉得他说的很有道理。,1,6,0,2022-07-23 19:40:04,来自甘肃,69961674506,沉默95386
7123528375855612712,一名90后作为曾经的煤矿工人，深有体会煤矿一线生产队的艰辛！！！工作餐吃不到一口热饭！ 工作强度非常大！煤矿效益好了普通工人每月满勤也才一万左右！ 曾经的同学在煤矿欠薪7个月！ 真心不容易！希望他们能得到足够的物质补偿！让其子女能够安身立命！！！,0,1,0,2022-07-23 19:29:18,来自湖北,109703596597,一生幸福285926219
7123532159524061985,现在可以挖露天煤矿？,2,1,0,2022-07-23 19:44:23,来自山西,99698869696,文锦R
7123522054476874536,人生无常，悲剧痛心啊，希望其他被困人员尽快被安全救出，愿逝者安息，愿生者坚强,0,4,0,2022-07-23 19:04:37,来自广西,68026245895,你的小红帽已上线
7123548910513701668,煤矿最怕的就是山体坍塌，意味着有人被活埋，意味着有人死亡，愿伤者早日康复，失联一人早日找到，死者一路走好,0,2,1,2022-07-23 20:49:11,来自江苏,1939954550187991,王晓琴0355
7123554168014799651,甘肃泓胜煤业作业途中，突遇山体坍塌，将施工人员反车辆掩埋，已致9人死亡，太痛心了，愿逝者安息！,0,1,0,2022-07-23 21:09:15,来自上海,59145281716,幸福菠萝莲花
7123557436400976640,又是甘肃景泰，最近几年发生的安全事故太多了吧[伤心],0,0,0,2022-07-23 21:21:50,来自天津,110943430732,洋芋博士
7123590897308664607,煤矿工人死了九人算不算重大责任事故？,0,0,0,2022-07-23 23:33:03,来自湖北,4217359121259108,亲切荷叶AM
7123528720588997406,甘肃景泰一煤矿企业内山体坍塌事故已致九人死亡,0,5,0,2022-07-23 19:30:56,来自北京,2752789769095860,爱笑的笑雪
7123527321894028036,又是天灾，可怜逝去生命的人[祈祷][祈祷][祈祷],0,8,0,2022-07-23 19:26:09,来自江苏,58740052496,潘朵拉33
7123531840766083876,最不愿看到的就是这类新闻，每每看到心里难受，要是没有事故多好,0,7,0,2022-07-23 19:43:12,来自甘肃,3483674344962792,余生去逍遥
7123575937417102121,又是甘肃景泰，这个县安全事故也太多了吧[灵光一闪],0,0,0,2022-07-23 22:33:47,来自天津,110943430732,洋芋博士
7123547816219460386,山体坍塌属于自然灾害。希望伤亡人数不要再增加[祈祷][祈祷][祈祷][祈祷],0,1,0,2022-07-23 20:44:25,来自甘肃,109743327578,不喝花露水
7123539172149265184,景泰这个名字是不是有问题，前两年的马拉松事件还记忆犹新啊,0,5,1,2022-07-23 20:11:44,来自宁夏,3837874857,鸢鸢咪
7123544537338839843,最近雨水过多，隔两天下一场大雨，就容易引起黄土松动滑坡，大家注意防护，多留意山体坍塌。,0,4,0,2022-07-23 20:31:45,来自甘肃,111071873695,百毒不侵yaya
7123528609348469508,煤矿工作比较危险，要注意生产安全！,0,7,0,2022-07-23 19:31:12,来自湖南,4222586973076915,春春241069905665
7123582021561713443,安全第一，希望这样的事故不要发生了，逝者安息吧,0,1,0,2022-07-23 22:57:38,来自广西,2550465410120311,梦里水乡ynwe
7123544004645552930,甘肃最近雨水也多，自然灾害频发。所以有没有可能是雨水多致使山体松软滑坡，从而导致灾难的发生？,0,3,0,2022-07-23 20:29:41,来自甘肃,51220164324,玻璃心131304363
7123521939263587106,希望其他被困人员安全救出，辛苦救援人员了，注意安全,0,15,0,2022-07-23 19:04:10,来自广西,68026245895,你的小红帽已上线
7123524778463445798,煤矿坍塌一直是重灾啊,0,5,0,2022-07-23 19:15:46,来自上海,4081800782551707,诗旖41
7123539547937702696,这新闻写的真无语，看了两遍才明白，还以为两起关联事故呢,0,0,0,2022-07-23 20:12:32,来自河南,52516676227,2你我他2
7123583609868600075,真是痛心，保佑活着的人平安吉祥。[祈祷][祈祷][祈祷],0,0,0,2022-07-23 23:04:38,来自山东,2546097169907052,信佛的老头
7123522704053191465,先安全后生产、不安全不生产！,0,12,0,2022-07-23 19:07:14,来自广东,2648054409202717,村间田野
7123525186431320843,希望被困人员能安全救出,0,5,0,2022-07-23 19:17:35,来自江苏,111591636473,开车带你去看世界
7123539837738615582,希望赶紧找到失联人员[祈祷][祈祷][祈祷][祈祷][祈祷],0,4,0,2022-07-23 20:13:54,来自江苏,111613805384,积极向上月亮之上928
7123529463228367646,天哪，又是一个重大事故，9人死亡，真是让人痛心，愿逝者安息，伤者早日康复,0,1,0,2022-07-23 19:33:47,来自云南,15124968647,带刺的精灵花
7123573338575962884,失联的人也是凶多吉少。愿逝者安息，家属节哀！,0,1,0,2022-07-23 22:24:21,来自湖北,2933116308306711,文倩美好岁月
7123539265258799910,为什么是9人，因为10人以上是重大事故,4,9,1,2022-07-23 20:12:23,来自新疆,971586676203803,胜天半子的乡下亲戚
7123527555135062819,重大事故，报国务院，省级应急管理部调查。,0,2,0,2022-07-23 19:26:13,来自江苏,1903972460528503,端庄奶酪YH
7123538582941844254,希望救援人员尽快找到失踪人员，祈祷一切平安无事[祈祷][祈祷][祈祷],0,2,0,2022-07-23 20:09:14,来自上海,1402627605142504,海燕看天下
7123566861467468555,去年的马拉松事件也是甘肃的景泰县吗？,0,0,0,2022-07-23 21:58:54,来自湖南,1464205810342903,小平头Ttiao
7123540828374696704,又是安全事故，平时注意安检是必须的,0,1,0,2022-07-23 20:17:22,来自北京,985622078033101,开朗奶茶5l
7123527675109065502,突遇危险，每天都有危险发生，安全是多么的重要啊！[捂脸][捂脸][捂脸],0,4,0,2022-07-23 19:27:00,来自广东,2110655964920248,鸿哥gold
7123526567556612903,愿失联者平安。,0,11,0,2022-07-23 19:22:50,来自山西,2480946296653694,智慧漾泉
7123514558480171791,希望其他被困人员安全救出，辛苦救援人员注意安全，,0,14,0,2022-07-23 18:35:44,来自广西,68026245895,你的小红帽已上线
7123569065704227620,为何会山体坍塌？是开上放炮造成的坍塌，还是山洪泥石流造成的？,0,1,0,2022-07-23 22:07:21,来自广东,5795965400,假香会
7123547233764950817,又是一起这样事故，咋没在施工之前，检查一下，把事故降到最小的。,0,1,0,2022-07-23 20:42:45,来自北京,223909517204899,李培凤0I8h
7123531656543109919,又一安全事故。血的教训。,0,4,0,2022-07-23 19:41:41,来自浙江,1138722340609459,敏锐辰星D0
7123590390581723916,希望这样的事故以后不要发生了！愿逝者安息[祈祷][祈祷],0,0,0,2022-07-23 23:31:17,来自北京,4318523627941356,文静690301494549
7123526878396744483,令人痛心！愿逝者安息！安全生产，警钟长鸣！🙏🙏🙏,0,2,0,2022-07-23 19:23:34,来自浙江,6967944084,莉莉1228
7123554290081547023,黄土地，土质松软，近期雨水多易引起山体滑坡、坍塌，愿逝者安息。,0,0,0,2022-07-23 21:09:37,来自甘肃,104727477941,悠闲河流666
7123520665646613260,甘肃这两天祸不单行呐，又是病毒，煤矿又出事了，又是洪灾，甘肃人民也不好过啊，日子[黑线][黑线][黑线][黑线],0,2,0,2022-07-23 19:00:08,来自陕西,3672019213486766,聪颖豆花sw
7123529990389760771,为什么看到很多新闻，只报9人，因为10人事故就上升了一级！,0,1,0,2022-07-23 19:36:23,来自北京,1068339682095672,勇者兔爷
7123523242350150403,太不幸了。愿逝者安息，伤者早日康复。失联人员平安无事。[祈祷][祈祷][祈祷],0,1,0,2022-07-23 19:10:13,来自河北,1486974531680659,足智多谋暖阳57
7123567206126535459,人往往在自然灾难面前显得很渺小，在山体坍塌这种灾难面前，我们要做的就是共担风雨，心心相通，相信一定会共渡难关。让我们一起加油！,0,0,0,2022-07-23 21:59:55,来自甘肃,62678000960,善为易者
7123565946384024350,逝者安息，家人节哀，伤者早日康复[祈祷],0,0,0,2022-07-23 21:55:32,来自广东,4072227439393863,今夕何夕看世界
7123573688120722208,看到是我们山西的焦煤员工，太心痛了，无意间丢失了生命，以后下雨多的地方，有人活动的山体也要安全检测，这是隐患，要小心预防，节哀吧，希望你们下辈子可以过的幸福，过的好一点[祈祷][祈祷][祈祷],0,1,0,2022-07-23 22:25:33,来自山西,2084271843714445,乖巧光束D
7123526676436517672,新闻上一看到甘肃两字我就紧张,0,1,0,2022-07-23 19:22:39,来自甘肃,1855626062084624,梦的翅膀8960
7123515347198051108,人的生命很脆弱，明天和意外不知道哪个先来。愿逝者安息，伤者早日康复。🙏🏻🙏🏻🙏🏻,0,19,0,2022-07-23 18:39:21,来自湖南,3047486243218675,没钱充话费
7123530883688301327,"看到这个消息很痛心！
已造成9人死亡，七人轻伤！
煤矿安全无小事！祈祷失联的人安然无恙[祈祷][祈祷][祈祷]",0,5,0,2022-07-23 19:38:57,来自甘肃,8446094716,筝韵心弦
7123529676202869545,涉险17人，已救出16人送往医院救治，其中1人当场死亡，2人送往医院途中死亡，重伤6人经全力抢救无效死亡，7人轻伤。失联1人正在全力搜救。,0,3,0,2022-07-23 19:34:12,来自江苏,2919904147671150,天山星驰
7123561596286599977,痛心！应该都是家里的顶梁柱，太不幸了。希望不要再增加人数了愿逝者安息。[祈祷][祈祷][祈祷],0,0,0,2022-07-23 21:37:52,来自四川,1362989468098052,芯雨悠悠
7123552268020581154,是自然灾害还是安全事故？,0,0,0,2022-07-23 21:01:51,来自浙江,111177361918,高贵天空OD
7123560977090134824,煤矿坍塌每年都有，维护保养不能疏忽更不能为了完成工作，走个流程，不出事就罢了，出事就是大事，人命关天，相关责任人好好反思吧,0,0,0,2022-07-23 21:35:39,,3979151861,你个臭哇塞
7123540920049419019,煤矿工作较危险，一定要注意生产安全。,0,1,0,2022-07-23 20:18:23,来自河北,110907630501,墨羽倾璇Anne
7123527047582040864,煤矿，重注意的是提前严管严防安全问题，等出事就晚了,0,3,0,2022-07-23 19:24:46,来自山东,65535977712,骊山25
7123532772253106979,煤矿工作较危险，要注意生产安全。,0,2,0,2022-07-23 19:46:05,来自甘肃,3879534580991720,夕妍73
7123522119950304034,人生无常，愿逝者安息！安抚好家属，伤者早日康复，,0,1,0,2022-07-23 19:04:58,来自湖北,97096659596,年伢4k5z
7123535110791758625,9人死亡，这是个重大事故，痛心，愿逝者安息，伤者早日康复。,0,2,1,2022-07-23 19:56:03,来自山东,2867180002085694,被风吹走的蒲公英飘呀
7123547365130306318,是山西焦煤民爆集团的人，还是当地煤矿的人？事故叙述不清。愿灾难不在重演，愿逝者安息，愿人人安全平安！,0,0,0,2022-07-23 20:42:57,来自山西,63870007903,青涩星球YD
7123547127108289292,问题说清楚，如果是途中遇山体滑坡这是自然灾害事故不属于安全生产事故，跟人家单位有毛关系，如果是矿区内边坡滑坡就属于安全事故，跟企业就关系大了,0,1,0,2022-07-23 20:42:30,来自新疆,4878756584,挥霍这年华
7123522716455666469,为了生活再苦再累再危险的工作都有人干。逝者安息，愿天堂无苦难。[祈祷][祈祷][祈祷],0,1,0,2022-07-23 19:07:29,来自广东,71302422834,睿智傲雪梅
7123524743424148255,唐山打人事件，让我对轻伤有了一个清晰的认知[尬笑],0,15,0,2022-07-23 19:15:16,来自江苏,65275139150,呆囧囧呆
7123523217692050191,救援人员辛苦了，一定要全力救治，给你们加油了！,0,9,0,2022-07-23 19:09:23,来自甘肃,106657000536,西北山泉
7123553979954463518,能不能想个办法不要让事故发生啊？,0,0,0,2022-07-23 21:08:42,来自青海,2313838815878907,快活跃号
7123560143794979584,近期的气候是比较反常，雨水多易造成山体滑坡，希望大家多注意防护。,0,0,0,2022-07-23 21:32:23,来自甘肃,70042793197,旷野歌者
7123536695177315080,煤矿上真的又苦又累血汗钱又容易出事,0,0,0,2022-07-23 20:01:39,来自湖北,1508152494785052,蔷薇之角
7123532475028013864,重伤人员也未能抢救回来，天灾之下生命如此脆弱，家属节哀！[祈祷][祈祷],0,2,0,2022-07-23 19:45:02,来自宁夏,2630470318166471,无双苹果4H3
7123546022785598240,不是煤矿坍塌，是山体滑坡坍塌，，原因、地点没说清楚,0,1,0,2022-07-23 20:38:09,来自山东,206303874522948,清闲的高山ud
7123515042590655269,愿逝者安息！伤者早日康复！,0,10,0,2022-07-23 18:38:02,来自青海,5755659027,正大光明糯米T
7123522579998442251,"上次听说景泰是去年马拉松事件，21人死亡。
这次又是9人。
同一个县城，安全事故[赞][赞][赞]",0,2,0,2022-07-23 19:07:41,来自甘肃,71608615414,伊梦关山月
7123521784682398494,安全第一，希望这样的事故不要发生了。,0,2,0,2022-07-23 19:03:56,来自山东,2651660270177080,诚信快乐zh
7123545630391468812,珍惜生命，安全第一，祈祷失联人员平安,0,0,0,2022-07-23 20:36:37,来自广东,92047089101,燕274090421
7123527910039864096,现在煤矿很少能出现这么大的事故，估计又是私营煤矿，九个鲜活的生命就这样消失了让人悲痛！希望处理好死者后事及家人生活！,0,1,0,2022-07-23 19:28:00,来自甘肃,1601306817206592,梦幻小羊b0
7123522783359238948,事故猛于虎，多少家庭破碎,0,14,0,2022-07-23 19:08:03,来自江苏,3988676425028075,热情的高山Cb
7123563549498311432,关键看是意外还是人祸。,1,3,0,2022-07-23 21:45:52,来自江苏,1600541951002253,金牛座属民
7123529206935601927,好心痛啊 九条鲜活的生命就这样消失了,0,2,0,2022-07-23 19:32:56,来自甘肃,6035155692,柠檬12285819
7123515197503161121,看不得这样的新闻，心痛,0,11,0,2022-07-23 18:38:49,来自河南,76223938723,墨白的白噜噜
7123559508089537310,白银上次马拉松死亡20多人。安全看来在这有很大问题。,0,1,0,2022-07-23 21:30:19,来自山西,104407834640,实事求是评论员
7123535836452668196,安全第一，警钟长鸣！请家属节哀、逝者安息！[祈祷][祈祷][祈祷],0,2,0,2022-07-23 19:58:28,来自安徽,85217618351,文竹2191
7123526045063676713,这么多人，这是重大事故，逝者安息，,0,1,0,2022-07-23 19:20:09,来自河北,2805565245372439,追梦的小丑木木
7123546823951778571,甘肃省白银市景泰县，去年刚刚发生了马拉松事故。[祈祷],0,0,0,2022-07-23 20:41:13,来自陕西,1090316073699693,无欲则刚Edmond
7123543804393161504,大家都注意防护吧，今年7月份以来，这边几乎每两天下一场大雨，多留意山体坍塌,0,2,0,2022-07-23 20:29:48,来自甘肃,92006710248686,农场主有什么不好呢
7123549117766255364,最近雨水增多，容易照成山体滑坡，愿逝者安息！,0,0,0,2022-07-23 20:49:57,来自甘肃,5856174704,温柔蜻蜓uN
7123554419954189056,看了让人痛心，人活着这么难啊，为什么会这样。,0,0,0,2022-07-23 21:10:11,,100041416867,用户501568998218舒心
7123532030453285669,山体坍塌，不是煤矿坍塌,0,1,0,2022-07-23 19:43:56,来自甘肃,94788759712,真的什么都不懂
7123571394197734177,煤矿风险太大，不是瓦斯爆炸，就是透水故意，这下矿井又坍塌了，防不胜防！,0,0,0,2022-07-23 22:16:56,来自福建,3192626949401448,才高八斗老叶
7123520802767061760,作业途中，突遇山体坍塌,0,3,0,2022-07-23 18:59:53,来自河北,259108222280651,顽强阳光Q5
7123557513613656872,突遇山体坍塌，这应该算是自然灾害还是安全事故？,0,1,0,2022-07-23 21:22:00,来自重庆,72633641211,高星海
