7123584419650831139,为遇难的矿工兄弟们祈祷。祈祷这些矿工兄弟们在天堂一切安好，沒有贫困。遇难的矿工兄弟们一路走好！[玫瑰][玫瑰][玫瑰],0,0,0,2022-07-23 23:07:03,来自四川,55490295069,潇洒书签Yy
7123552099229156104,甘肃景泰一煤矿企业内山体坍塌事故已致9人死亡。,0,0,0,2022-07-23 21:01:38,来自江苏,1011143029031790,勇者花猫hU
7123536452457857833,又一场人间悲剧，毁了9个家庭，愿逝者安息！,0,0,0,2022-07-23 20:00:32,来自河北,2397368069920892,张姐爱生活7t2I
7123550201453003560,重大事故，报国务院，省级应急管理部调查。,0,1,0,2022-07-23 20:53:40,来自山东,60103664899,老班长165547779
7123535055401567007,又一起重大事故,0,2,0,2022-07-23 19:55:20,来自内蒙古,386618034229928,灵敏钢笔ZM
7123524067755426601,煤矿安全事故近年频发，国家该重视起来,0,2,0,2022-07-23 19:12:27,来自江苏,4001827072784424,24K永恒
7123575443223315235,一般露天矿山滑坡或坍塌多是为节省剥离成本，矿坑坡脚过于陡峭，高度较高，上部过载，雨水浸泡，边坡失稳导致。,0,0,0,2022-07-23 22:31:50,来自广西,5491731142,胸中自有盛世
7123528252635333410,人生无常，悲剧痛心啊，希望其他被困人员尽快被安全救出，辛苦救援人员了，注意安全,0,4,0,2022-07-23 19:28:55,来自江苏,102013310271,无聊啊741
7123581542651872030,1974年冬天，我在兰炼景泰农场劳动时，曾跟车去这里拉过煤。那时还是小煤窑，靠人工钻洞开采，背筐出来。工人们很可怜，穿着单薄，黑黑的脸庞上只有鼻子下有两道白，永远难忘的场景。为逝者祈祷，安息[祈祷],0,0,0,2022-07-23 22:56:04,来自北京,4232653784,艾尼野明
7123524177088971557,看着鲜活的生命就这样消失了！痛心！,0,1,0,2022-07-23 19:13:35,来自陕西,102638946532,恰似鲸落沉寰宇
7123574220764332814,有些人没看明白就发声。注意，是进矿道路上方的山体坍塌埋压。大概率是因近期降雨量过大，山体松软导致。,0,0,0,2022-07-23 22:27:44,来自甘肃,67543744013,老袁寒山
7123548034113340163,景泰还有煤炭，希望早点救援完成,0,0,0,2022-07-23 20:45:49,来自陕西,102948795297,社会和谐520
7123548034113340163,景泰还有煤炭，希望早点救援完成,0,0,0,2022-07-23 20:45:49,来自陕西,102948795297,社会和谐520
7123539402789946115,这是多大的事故，逝者家属请节哀！,0,1,1,2022-07-23 20:12:46,来自河南,2581283554473085,用户283315865408洛阳
7123561940659995433,山体坍塌，不是煤矿事故，这应该是自然灾害，可能和近期雨水太多有关系。,0,2,0,2022-07-23 21:39:21,来自甘肃,97185678979,侠骨柔情313
7123530941552886563,祈祷！尽快救出失联者，他的家人都该急坏了。[祈祷][祈祷],0,1,0,2022-07-23 19:39:09,来自甘肃,106657000536,西北山泉
7123537530364052258,愿失联人员能平安无事[祈祷],0,1,0,2022-07-23 20:04:34,来自辽宁,2322630099086158,晶滢紫潇
7123532528988144417,山西焦煤民爆集团职工属于山西焦煤员工吗？,0,1,0,2022-07-23 19:46:13,来自山西,51896541432,一凡之俗
7123535330871395084,这是一次重大事故，很让人心痛啊，希望吸取教训，做好安全防护措施。,0,1,0,2022-07-23 19:56:54,来自辽宁,109351391756,平安是福7677650214792
7123540934365152000,景泰县为什么总出事？,0,1,0,2022-07-23 20:17:58,来自辽宁,2788801724298383,远山qy
7123515360195871520,[祈祷][祈祷][祈祷]天哪！又是一起安全事故！愿逝者安息！伤者早日康复！,0,12,2,2022-07-23 18:39:11,来自河南,52552367602,A格终结者
7123547834569589544,这是一次重大事故，很让人心痛啊，希望吸取教训，做好安全防护措施，,0,1,0,2022-07-23 20:44:31,来自福建,2049128555349735,用户男儿当自强ww
7123522457029640990,突遇危险，每天都有危险发生，安全是多么的重要啊！,0,12,0,2022-07-23 19:06:46,来自浙江,2488928146848183,细腻乔伊斯7k8
7123524290728756008,甘肃景泰一煤矿企业内山体坍塌事故已致9人死亡 ！,0,1,0,2022-07-23 19:13:18,来自安徽,95791042781,双木成林493
7123532963635675904,快讯:甘肃景泰一煤矿企业内山体坍塌事故已致9人死亡。,0,1,0,2022-07-23 19:47:08,来自福建,3289330042541663,东风枼
7123531860126597899,安全第一，希望这样的事故不要发生了，逝者安息吧[祈祷][祈祷][祈祷][祈祷][祈祷],0,1,0,2022-07-23 19:43:20,来自山西,63285002451,布了320
7123521737316385570,恶性事故频发、令人痛心，罹难者都是每一个家庭的顶梁柱，亲友要节哀顺变……[祈祷],0,2,0,2022-07-23 19:03:23,来自江苏,1882784814873104,一心一意梦想mL
7123529855932662531,真不是个好消息啊，逝者让人心痛，愿逝者安息[祈祷],0,1,0,2022-07-23 19:35:41,来自甘肃,281896883332062,正大光明春风qJ
7123522324137476879,年年强调安全生产，为什么时有这样的事情发生？,2,7,1,2022-07-23 19:05:44,来自江西,65785963984,朝画夕拾1980
7123514850738815780,重大事故，报国务院，省级应急管理部调查。,0,6,0,2022-07-23 18:37:04,来自辽宁,59656332905,Victory祖国梦
7123533373074817824,人生无常，悲剧痛心啊，希望其他被困人员尽快被安全救出，辛苦救援人员了，注意安全！,0,2,0,2022-07-23 19:49:30,来自安徽,84229077306,偷闲享受一下
7123525002242065193,真的很不想看到这样的新闻！每次都是煤矿发生坍塌事故！都会有人员的伤亡！,0,1,0,2022-07-23 19:16:02,来自广东,1754431177636500,百灵鸟春光
7123549025001046821,安全无小事，9条鲜活的生命，9个家庭的悲剧！逝者安息，愿天堂无苦难[祈祷][祈祷][祈祷],0,0,0,2022-07-23 20:49:31,来自安徽,87199353088,萍水4604
7123545055482626852,煤矿坍塌是造成人员伤亡最多的事件。,0,0,0,2022-07-23 20:34:19,来自山东,86952347777,水也能倒流
7123515116783911693,妈呀，逝者安息，祝伤者早日康复！安全生产很重要！,0,7,0,2022-07-23 18:38:15,来自陕西,64544366301,如戏人生啊
7123534835322356512,景泰又一次冲上了热搜,0,1,0,2022-07-23 19:54:56,来自甘肃,57649339856,莣亽166177566
7123530230811558688,今年各种各样的事故比较多，更加要把安全放在第一位。,0,2,0,2022-07-23 19:37:15,来自广西,2409726371444296,道似水
7123555833983828751,山体坍塌…前阵子刚下完暴雨，地质灾害很容易发生的，愿逝者安息[祈祷][祈祷][祈祷],0,1,0,2022-07-23 21:15:33,来自甘肃,106803156503,塞北火狐
7123550436879008548,安全生产天天抓，怎么还是有这样的事故发生！一定要严查！杜绝类似事故发生！,0,2,0,2022-07-23 20:54:48,来自山东,86356482537,淡泊明志danpomingzhi
7123532980290716429,为什么今年的事故那么多呢，愿平安,0,2,0,2022-07-23 19:47:01,来自天津,1204720792243982,夏天走了只留下秋天
7123536346270483239,安全生产责任重于泰山,0,1,0,2022-07-23 20:00:49,来自山东,74455597300,感恩ZCD
7123527286514893606,人生无常，悲剧痛心啊，希望其他被困人员尽快被安全救出，辛苦救援人员了，注意安全,0,2,0,2022-07-23 19:25:41,来自广东,51572525375,wattking
7123537183680152333,我在煤矿干了一天，果断放弃了！安全第一啊！希望失联的人没事,0,1,0,2022-07-23 20:03:49,来自甘肃,63227068214,白银旅行者
7123539369063334670,一人失联肯定是死亡，就是十人死亡重大事故，真的很痛心，愿逝者安息，一路走好🙏🙏,0,0,0,2022-07-23 20:12:15,来自青海,88714181494,老山兰花草
7123514946675311392,途中，这真的是生死无常啊，在路上就连车埋了,0,7,0,2022-07-23 18:37:42,来自甘肃,50010087674,我丑我骄傲2
7123520657681449743,为了生活再苦再累再危险的工作都有人干。逝者安息，愿天堂无苦难。[祈祷][祈祷][祈祷],0,11,0,2022-07-23 18:59:12,来自浙江,105946918235,月风WEN
7123514458647216909,隔三差五就有这类消息，真令人痛心！,0,15,0,2022-07-23 18:35:45,来自四川,84413865566,老邹1966
7123537011599966990,突遇山体坍塌，将施工人员及车辆掩埋。此事无法预防。,0,2,0,2022-07-23 20:03:00,来自河北,3166201042179998,用户清闲
7123521571071132419,露天煤矿，民爆公司是去爆破去了吧。估计是自然灾害一类，在矿区估计就是安全事故了,0,1,0,2022-07-23 19:03:40,来自山西,5521478421,晓峰58214387
7123566295207543584,唉！煤矿事故都是大事故呀！[捂脸][捂脸][捂脸],0,0,0,2022-07-23 21:56:56,来自北京,69229429160,失眠收留所
7123547116983075623,天灾人祸，愿所有人平安健康,2,0,0,2022-07-23 20:42:27,来自甘肃,4045844752907997,@爱自己@
7123558890016555814,白银市总有大新闻,0,1,0,2022-07-23 21:27:55,来自北京,3196977798458333,鲁赤水看不起齐白石
7123551912448312101,逝者安息，家属节哀！都是为了生活！,0,1,0,2022-07-23 21:00:53,来自辽宁,103250430188,🍬 蚂蚁爱冲浪🍭 🍹
7123548457885008670,上一次知道景泰这个地名也是事故[流泪],0,0,0,2022-07-23 20:47:19,来自青海,102154757554,工程路上探索的我
7123550984848098056,最近死伤的事故太多了，今年这是怎么了？爆炸，坍塌，车祸，水灾...,0,0,0,2022-07-23 20:56:57,来自山东,87031221970,青岛小咖
7123535384223089423,又是一起重大事故，安全重于一切！,0,0,0,2022-07-23 19:56:26,来自黑龙江,4471895864,mrak41462106
7123527382271116046,愿逝者安息，伤者早日康复！,0,1,0,2022-07-23 19:25:52,来自山东,77841570846,孙芝红
7123560342315238155,突遇山体坍塌,0,1,0,2022-07-23 21:33:33,来自甘肃,18501432918,白云过后
7123538074159760136,失联一人是关键，相差一人，事故级别就不一样了。,0,0,0,2022-07-23 20:07:10,来自河北,1178306413082894,风姿卓越荷叶d
7123545400652956427,较大生产安全事故,0,2,0,2022-07-23 20:35:56,来自江苏,50378659316,上进满满的正能量
7123548167048135457,最近雨水多得很，很容易发生山体滑坡,0,0,0,2022-07-23 20:46:29,来自甘肃,114796720827988,须臾～
7123532962360525581,重伤人员也未能抢救回来，天灾之下生命如此脆弱，家属节哀！[祈祷][祈祷],0,2,0,2022-07-23 19:47:06,来自辽宁,3712401411154416,笑得太过分
7123532962360525581,重伤人员也未能抢救回来，天灾之下生命如此脆弱，家属节哀！[祈祷][祈祷],0,2,0,2022-07-23 19:47:06,来自辽宁,3712401411154416,笑得太过分
7123565333025243934,遇难没在井下，却在路上丧生，老天太不长眼了！,0,0,0,2022-07-23 21:52:44,来自北京,75982102825,user4528901325379
7123533307584709389,又是安全事故，平时注意安检是必须的,0,3,0,2022-07-23 19:48:27,来自河北,61772904701,那些事议议议
7123531740471853824,希望尽快找到失联人员，愿失联人员平安！祝愿伤者早日康复！逝者安息！,0,1,0,2022-07-23 19:42:26,来自河南,1521321045656832,温柔的馒头iv
7123515556716020510,1人失联对事故的定性起决定性作用,0,5,0,2022-07-23 18:39:55,来自辽宁,105489089327,越过山丘KY
7123574340436034307,十人死亡属重大事故，景泰又热了。,0,0,0,2022-07-23 22:28:24,来自甘肃,50313557060,灿烂旭日ps
7123530600833188648,愿逝者安息！希望有生命存活！[祈祷][祈祷][祈祷][祈祷][祈祷][祈祷],0,1,0,2022-07-23 19:37:59,来自内蒙古,105534827637,美丽草原102
7123526932079084319,安全第一，希望这样的事故不要发生了，逝者安息吧[祈祷][祈祷][祈祷],0,2,0,2022-07-23 19:23:55,来自四川,102291646604,惜缘SS
7123521471124947747,失联，其实已经遇难。,0,4,0,2022-07-23 19:02:27,来自安徽,67079240806,金发老者
7123525157205230375,这个属于意外事故，不属于生产事故，跟企业没关系，为遇难者默哀！,0,1,0,2022-07-23 19:17:21,来自辽宁,1732427935908142,云巅云水
7123520841627108129,愿逝者安息，伤者早日康复。失联的平安。,0,1,0,2022-07-23 19:00:38,来自江苏,102922732445,跃的云
7123526324915946240,希望其他被困人员安全救出，辛苦救援人员了，注意安全,0,1,0,2022-07-23 19:21:25,来自山东,1868789157470765,往事随风CQMk
7123537604825662211,祈祷，不要再有伤亡数的增加,0,0,0,2022-07-23 20:05:32,来自上海,110161416284,蓝莓虾滑
7123525526673146655,失联一人是关键，相差一人，事故级别就不一样了,0,1,0,2022-07-23 19:18:41,来自湖北,1917170373102846,xiaoxingyiyi
7123548285155443468,只有是露天矿才会发生边坡垮塌事故……,0,0,0,2022-07-23 20:46:58,来自内蒙古,56647464822,草原de草
7123530684253324032,紧急救援！,0,2,0,2022-07-23 19:38:05,来自青海,83069706189,河湟传奇
7123515999210865445,希望政府妥善安置好遇难者家属！,0,7,0,2022-07-23 18:41:47,来自河南,3874325362120083,充满元气的睿智追梦人
7123565723099890463,又是一起煤矿事故,0,2,0,2022-07-23 21:54:21,来自河南,104941978798,20看我行20
7123528931847734053,安全第一，希望这样的事故不要发生了，逝者安息吧[祈祷][祈祷][祈祷],0,2,0,2022-07-23 19:31:44,来自重庆,479026777687612,辉煌岁月Love
7123544174452130575,近期雨水多，导致山体坍塌,0,0,0,2022-07-23 20:30:25,来自甘肃,59490018377,jcd689
7123552562997510952,又是好几个家庭毁了 痛心,0,0,0,2022-07-23 21:02:58,来自湖南,1038389148658128,狐蝶灬
7123556728138072863,人活着真的是太累了，祝逝者安息，望他们在天堂保护他们的家人吧[流泪],0,0,0,2022-07-23 21:19:06,来自山东,2845140689884120,聪慧生活家pP
7123542057859547945,这是安全事故还是自然灾害！[流泪],0,1,0,2022-07-23 20:22:11,来自福建,84736560989,渴死的鱼738
7123550511902851880,生命至上，安全生产尤为重要，安全隐患来不得半点马虎！,0,0,0,2022-07-23 20:54:59,来自吉林,2066679103752158,家事国事天下事w
7123514884637508391,刚还看到三人死亡，现在已经9人了。[祈祷][祈祷][祈祷],0,19,0,2022-07-23 18:37:38,来自辽宁,3790716706764621,初秋的宏
7123535459380429581,令人痛心的消息，愿逝者安息、伤者早日康复！,0,0,0,2022-07-23 19:57:01,来自广东,5719323079,文极辉
7123531627867063080,突遇危险，每天都有危险发生，安全是多么的重要啊！,0,3,0,2022-07-23 19:41:55,来自广东,510615750189342,沈合群
7123576867793912612,属于不可抗拒的意外事故，非安全生产事故，定性完毕。,0,0,0,2022-07-23 22:38:10,来自甘肃,5571827480,人材机管利规税
7123521946876576527,又有九个家庭支离破碎，悲痛欲绝[泪奔][泪奔],0,1,0,2022-07-23 19:04:23,来自广东,3988654599187623,小丸子21623
7123525027387130655,愿逝者安息！伤者早日康复！🙏🙏🙏,0,0,0,2022-07-23 19:16:26,来自湖南,545788837235901,蓝0201
7123533033106015017,这是一次重大事故，很让人心痛啊，希望吸取教训，做好安全防护措施，,0,0,0,2022-07-23 19:47:23,来自广东,624127468378771,我要看头条极速版
7123514468780557068,希望伤亡人数不要再增加,0,12,1,2022-07-23 18:36:01,来自广东,3873780355,淘气鬼来啦
7123537031388709667,可惜了。看到听到这类报道很痛心，鲜活的生命就这样没了,0,1,0,2022-07-23 20:02:37,来自辽宁,3377309423764862,诚心诚意的问候
7123589866885088037,哎！景泰，这两年走霉运。愿逝者安息，伤者安康[祈祷][祈祷][祈祷],0,0,0,2022-07-23 23:28:49,来自重庆,1925945142816616,老家茶山下
7123531453241344798,安全事故太多了，真的受够了。,0,1,0,2022-07-23 19:40:57,来自浙江,3408083358063019,青龍庇佑我大汉
7123531682418311973,又是一起群死群伤的事故[恐惧][恐惧],0,1,0,2022-07-23 19:42:07,来自北京,2431762795606520,83823堃
7123543670171239179,人生无常，悲剧痛心啊，希望其他被困人员尽快被安全救出，辛苦救援人员了，注意安全,0,1,0,2022-07-23 20:29:23,来自上海,3069434010015918,一个散淡的凡人
7123569001011282726,安全生产天天喊，疏忽大意忘一边。坍塌事故十人亡，警钟长鸣驻心间！,0,0,0,2022-07-23 22:07:14,来自河南,527384010828727,春天之时万物生长
7123567914351215392,2022年灾难多，希望大家平安。,0,0,0,2022-07-23 22:03:05,来自湖南,62645678917,zhy6499
7123533999196422950,人生无常，愿逝者安息！安抚好家属，伤者早日康复。,0,0,0,2022-07-23 19:51:40,来自辽宁,109351391756,平安是福7677650214792
7123523738745832222,这可是安全事故啊，希望早日查明原因。,0,1,0,2022-07-23 19:11:37,来自广西,2163491972595383,亚聊
7123520365300859651,好痛心，这些都是农村里一家老小的顶梁柱，给死者家庭带来的后果无法估计。,0,2,0,2022-07-23 18:58:50,来自贵州,3111587637,实事求是123
7123546181288002345,又有灾了，九个家庭失去了顶梁柱,0,0,0,2022-07-23 20:38:03,来自北京,59388287754,乐珍
7123521192765473551,白银景泰这是怎么了？多灾多难呀！逝者安息吧。[祈祷][祈祷][祈祷],0,1,0,2022-07-23 19:01:20,来自甘肃,106657000536,西北山泉
7123522947742614283,这种矿山一定会做地质突害风险评估的，事故发生前会有异响、位移等前兆的，不是完全防不胜防,0,1,0,2022-07-23 19:09:14,来自内蒙古,5720969391,云中石燕
7123547120300213023,这个假期怎么了，有这么多的安全事故！,0,0,0,2022-07-23 20:41:51,来自江苏,85682654634,自由溪水eI
7123532328940634917,突遇危险，每天都有危险发生，安全是多么的重要啊！,0,2,0,2022-07-23 19:45:01,来自江苏,3571629348103918,乖巧梦想家ki
7123560023653532451,这就是高危工作，只能降低安全事故发生频率，不能杜绝。因为只要干，就有隐患,0,0,0,2022-07-23 21:31:55,来自山东,102799393518,青岛大林的生活
7123529083724186399,7月23日11:15左右，景泰县一煤矿企业内发生一起山体坍塌事故。目前已造成9人死亡，7人轻伤，仍有1人失联。,0,2,0,2022-07-23 19:32:37,来自黑龙江,104584802720,安雅宁
7123520422565987107,生命至上，尽快抢救，减少伤亡！,0,2,0,2022-07-23 18:58:32,来自江西,3880813635,荷源飞鸽
7123522761552610083,又是一起安全事故 ，愿死者一路走好 ！家属节哀 ！愿伤者早日康复 ！失联者尽快解救 ！,0,2,0,2022-07-23 19:07:23,来自湖北,91674552640,梦醉西楼376
7123514994956174121,安全第一生命无价,0,11,0,2022-07-23 18:37:25,来自天津,223898947558183,福兮祸伏祸兮福倚
7123526948211065638,愿逝者安息，不要在发生意外的事了,0,0,0,2022-07-23 19:24:39,来自河南,110965195450,清荷珺子
7123544919133651747,这是天灾啊！谁也无法预知啊,0,1,0,2022-07-23 20:33:13,来自广东,201922597618128,缤纷孔雀r3
7123527697548182306,安全生产应放在第一位！逝者安息！[流泪],1,0,0,2022-07-23 19:26:34,来自山东,1868789157470765,往事随风CQMk
7123523577714508559,现在不是追究责任的时候。大家要保持平常心，不是来看笑话的，每个死亡的人都有家庭的。[发怒],0,2,0,2022-07-23 19:10:51,来自江苏,92327201089,认真的宇宙Ai
7123545115536900897,几个家庭又坍塌了[流泪][流泪][流泪],0,1,0,2022-07-23 20:34:46,来自辽宁,1732448328624024,揣着明白装小白兔
7123538735014740740,煤矿一出事儿的人不少啊。愿逝者安息吧！,0,1,0,2022-07-23 20:10:17,来自北京,4072226848783870,我的佛灯
7123545340183429926,祈祷平安[祈祷][祈祷][祈祷],0,0,0,2022-07-23 20:35:41,来自陕西,62629695469,热～Dilvab
7123543842372387591,又一起重大安全事故啊，及时抢救相关人员，查明原因！,0,0,0,2022-07-23 20:29:27,来自重庆,4344922188297460,岁月如歌yunshu
7123529964804571908,又一起安全事故，心痛啊！,0,1,0,2022-07-23 19:36:09,来自浙江,68168019708,聪慧夕阳红花
7123571409993450278,较大事故变成重大事故了，,0,0,0,2022-07-23 22:17:02,来自河北,50225368415,七彩人生125777606
7123548227021947651,近期雨水过多，黄土松软，容易引起山体滑坡，多注意防范。[祈祷][祈祷][祈祷],0,0,0,2022-07-23 20:46:28,来自甘肃,92768255761,幽默星辰xC
7123534331607712550,甘肃这两年的负面新闻太多,0,2,0,2022-07-23 19:53:01,来自甘肃,111367420827,北冥有鱼0256
7123562697002025741,煤炭事故基本上都会死人的。,0,1,0,2022-07-23 21:42:36,来自江苏,1494947898879288,天上掉下来的红鲤鱼
7123562182595412768,天灾事故，可惜了悲伤,0,0,0,2022-07-23 21:40:40,来自甘肃,55493796209,潇洒漂流瓶UK
7123553402667664165,采矿把山体掏空了吗？,0,0,0,2022-07-23 21:06:31,来自黑龙江,2559309538922791,剩下十年
7123535670245098274,9人！卡点卡的不错哦[灵光一闪][呲牙],1,9,0,2022-07-23 19:57:30,来自甘肃,3254151103914509,童年忆阿财写作
7123526630987186974,甘肃景泰煤矿坍塌事故已致9人死亡，坍塌的可是9个家庭的顶梁柱，真让人心痛！愿逝者安息🙏安全生产警钟长鸣！,0,2,0,2022-07-23 19:22:59,来自浙江,100227575086,自足常乐2007
7123520099466330895,山体滑坡，防不胜防，天灾人祸[祈祷][祈祷][祈祷],0,2,0,2022-07-23 18:57:10,来自广东,9873316690,星星Xing
7123521875636044579,死亡9人，就是9个家庭呀！实在痛心！,0,1,0,2022-07-23 19:03:59,来自甘肃,106657000536,西北山泉
7123530437032641314,这个好像是自然灾害吧，愿逝者安息！,0,1,0,2022-07-23 19:37:09,来自湖北,2238237215047256,真真a
7123514341026562854,持续关注，祈祷奇迹发生！[祈祷][祈祷][祈祷],0,6,0,2022-07-23 18:35:35,来自山西,3157101663,执着灬等待
7123529913336300322,去年21人的事故也发生在景泰！,0,1,0,2022-07-23 19:35:23,来自甘肃,108199719721,刀锋砺刃
7123565383742784295,安全生产，常抓不懈啊，这下几个家庭顶梁柱塌了,0,0,0,2022-07-23 21:53:05,来自江西,93178879211,阿耀620
7123524572107899681,痛心！应该都是家里的顶梁柱，太不幸了。愿逝者安息，伤者早日康复。失联人员平安无事。,0,1,0,2022-07-23 19:15:04,来自天津,93177325414,萌图图妈
7123544749747045150,作为一个矿山人听到矿山兄弟出事心情特难受😭,0,1,0,2022-07-23 20:33:02,来自陕西,1358630734281220,中掘建设矿山一级资质
7123522970122994463,安全生产大于天，不能光顾挣钱忽视安全,0,2,0,2022-07-23 19:08:38,来自河南,3914691760627182,森林玉
7123552366192247584,痛心！应该都是家里的顶梁柱，太不幸了。愿逝者安息！,0,0,0,2022-07-23 21:02:55,来自广东,108278893279,高贵青山ty
7123535847752221448,甘肃景泰煤矿坍塌事故已致9人死亡，坍塌的可是9个家庭的顶梁柱，真让人心痛！愿逝者安息🙏安全生产警钟长鸣！,0,1,0,2022-07-23 19:58:35,来自福建,3817974803216327,幽默失忘
7123515298703721251,以人为本，安全大似天。平安吉祥快乐是大家。矿上发生不幸的事故，与责任人(付责人)有直接关系，应追究妥善处理该事故(事情)之好！！！书作:张正雄。谢谢！！！谢谢！！！,0,8,1,2022-07-23 18:38:39,来自湖北,2752830070850615,风趣花猫11
7123531087124693791,甘肃景泰煤矿坍塌事故已致9人死亡，坍塌的可是9个家庭的顶梁柱，真让人心痛！愿逝者安息🙏安全生产警钟长鸣！,0,1,0,2022-07-23 19:39:33,来自湖南,103980508873,快乐阳光fV
7123539531256791846,又是一个不幸的消息，希望接下来都是好消息啊。,0,2,0,2022-07-23 20:13:07,来自福建,2185450121074180,多看多阅读
7123572386326545159,一线的卖苦力只有自己注意安全。,0,0,0,2022-07-23 22:20:24,来自北京,96206958636,金茶一杯
7123524027414758156,这段时间，安全事故发生的有点多，千万不能放松安全问题呀,0,2,0,2022-07-23 19:13:07,来自湖南,70939245192,乡里人918
7123522028829246221,又是重大事故！！！严肃追责！,0,2,0,2022-07-23 19:05:17,来自重庆,795687044266845,333玉煌大帝
7123521351751009035,甘肃景泰煤矿坍塌事故已致9人死亡，坍塌的可是9个家庭的顶梁柱，真让人心痛！愿逝者安息🙏安全生产警钟长鸣！,0,1,0,2022-07-23 19:02:51,来自重庆,53051775700,用户丐帮帮主
7123524234890560271,安全生产，但愿人都没事,0,1,0,2022-07-23 19:13:11,来自湖南,111124445697,五月二十520
7123562561592804103,严查安全隐患排查者责任,0,0,0,2022-07-23 21:42:00,来自甘肃,228333321462672,一丝不苟露珠Hg
7123547074993701668,祝愿生者平安，逝者安息，失联者平安无事。,0,0,0,2022-07-23 20:41:54,来自河南,3126642886585115,东升的耀阳
7123524130515206953,9条生命没了，9个家庭破了，明天和意外不知道哪个先来！珍爱生命，安全第一。逝者安息吧！,0,1,0,2022-07-23 19:12:51,来自甘肃,106657000536,西北山泉
7123533652692222759,这两年景泰红火的很,0,7,0,2022-07-23 19:50:10,来自甘肃,58902169154,无双星球No
7123534853135958819,现在的安全隐患而出的事故越来越多。国家要重视起来。,0,0,0,2022-07-23 19:54:19,来自湖南,281063844746862,方行
7123520364168594190,又是 景泰 前年 越野跑 死了20多生命 今年又报矿…,0,1,0,2022-07-23 18:58:47,来自北京,101763037997,善良百灵鸟yl
7123515403607147297,希望最后一人能平安无事，死者安息！[祈祷][祈祷][祈祷],0,7,0,2022-07-23 18:39:39,来自新疆,51803184112,DBEN
7123515679646728964,多少人为了生活，去没有安全的地方工作！[流泪][流泪],0,8,0,2022-07-23 18:40:35,来自河南,52552367602,A格终结者
