7132038785164083983,为了避免谣言满天飞，中国女排公布了世锦赛22人大名单。,1,4,2,2022-08-15 17:53:58,来自福建,6847571727,老褚说球
7132033875945407246,希望蔡导带领女排再次走向领奖台，加油吧。,5,6,0,2022-08-15 17:35:26,来自新疆,2076296731701991,用户默莫
7132055340224463628,一看到主攻名单有金王二人就来气，必输无疑，没希望了，想进8强都难,26,306,15,2022-08-15 18:58:46,来自广东,51024886315,雨后彩虹130387101
7132052188842853131,看看人家吴胜教练,1,5,0,2022-08-15 18:46:40,来自山东,99811892930,燕俐933
7132048070250152719,张常宁退役了吗？,12,28,5,2022-08-15 18:29:56,来自广西,107712383797,加油吧老爸
7132029965968818984,蔡导的选人用人眼光与很多人不同，比如世联赛两位金王主攻，二传人选也迫值得商榷。当然，蔡导是主教练，又是二传出身，经过了世联赛洗礼，多少会有收获，选择相信他。,2,7,2,2022-08-15 17:19:41,来自山东,52692417500,竹溪柚
7132092074941547300,二传用姚笛和李莹莹搭配最佳,5,39,2,2022-08-15 21:20:54,来自北京,106530268257,用紫气东来
7132049580002411276,除了李盈盈，龚翔宇，剩下的没看头,18,186,9,2022-08-15 18:36:37,来自吉林,3315725929025336,风少的剑
7132050554183910180,张常宁呢？,7,3,2,2022-08-15 18:39:52,来自辽宁,681332924220013,聪明雪梨Kt
7132060533582856992,王云蕗拉低了女排档次[流泪][流泪],3,132,12,2022-08-15 19:19:10,来自安徽,2031497699930783,zky林
7132079296084656909,女排姑娘们要加油，一定要把女排的精神发扬下去，,1,2,1,2022-08-15 20:31:31,来自北京,93503949376,李婧彤
7132062610383782692,二传即使不要姚迪，也不能是郁啊，她不也在国内联赛里总是让人替下么，没看到天赋和优势～国内联赛那么多好二传孙海平，梅笑寒，还有个北京队小将雷海林敢打敢拼的～看不懂蔡导的用人！是否还想来个二次下台？,1,72,8,2022-08-15 19:26:39,来自天津,4155794971952472,悠闲奶酪wr
7132032593834672936,中国女排有王梦洁在场上，再给李盈莹找一好对角争前四有希望了。,20,154,18,2022-08-15 17:29:58,来自山东,64548409591,爱和平925
7132056288796082952,还是郎平做女排主教练吗？,1,3,1,2022-08-15 19:02:22,来自广西,4720932791,老百姓发现身边人和事
7132037983498699523,中国女排应该大胆锻炼新人，不要太过于计较成绩。,23,186,25,2022-08-15 17:51:45,来自广西,1152703237992285,一一云朵
7132063274392224553,主攻只有李莹莹一个还行，别的人都是跟上旅游的。[灵光一闪][灵光一闪],1,15,2,2022-08-15 19:28:49,,3970700566,李祥元律师
7132041799358661380,没有强攻与李莹莹打对角，比较悬。,5,5,1,2022-08-15 18:06:20,来自广东,61276883240,慧心50000
7132042936271291169,胡名媛，为什么不用，比现在这阵容里好多人强吧,5,70,5,2022-08-15 18:11:06,来自广东,63426093856,远山近城H
7132076588635767591,女排精神成过去式了,1,36,6,2022-08-15 20:21:00,来自江西,95941258370,王初琴
7132051741977314052,没有朱婷张常宁的中国女排，也就是前八的水平。前四也就是想想。,2,5,0,2022-08-15 18:45:01,来自河北,74939077650,神秘奶酪F0
7132037545118384896,中国女排世锦赛22人大名单出炉，没有张常宁、姚迪。,0,4,0,2022-08-15 17:49:08,来自福建,6847571727,老褚说球
7132106150711018247,为啥朱婷、张常宁不回女排？是不愿意回来？还是什么愿因？她们如能回来，实力大增。否则真没什么看头！,5,8,1,2022-08-15 22:15:33,来自陕西,465831049560958,视野石榴6Y5
7132115140803379968,只有看到袁心玥、丁霞、王梦洁心中才有一些欣慰！其他的不想评论…[哈欠][哈欠],1,1,0,2022-08-15 22:50:15,来自北京,59797082267,流金岁月八一七
7132080982785917735,就冲这主攻名单——这蔡斌是死不悔改，一条道走到黑啊！夺牌不用想，四强没有戏，打好了能第五，估计也就在第六七之间。,4,48,7,2022-08-15 20:38:23,来自天津,5258760707,风来翰墨香51008135
7132059933960438560,王云蕗金烨的能力不够国手水准,2,31,0,2022-08-15 19:16:38,来自辽宁,110850317037,膀爷老王
7132028368169796387,中国女排主要是接球，发球，扣球，拦网，二传，只要把这些都训练好了就是一只世界上的强队。,1,0,0,2022-08-15 17:13:32,来自四川,63217291993,正大光明梦想eu
7132042091647353639,以前有排球比赛还会看，现在直接换台[捂脸],19,138,18,2022-08-15 18:07:38,来自广东,95705218809,Rbubu
7132034063800206114,为什么朱婷不回归,3,4,0,2022-08-15 17:35:47,来自河南,4573179008,zz知音
7132094611845710627,放开思想，放下包袱。女排夲身和全国球迷都别太看重成绩。体育运动的夲质是健身和娱乐！,1,0,0,2022-08-15 21:30:27,来自北京,989996735013822,清新天空3k
7132059497157608233,金烨，王云路能主攻啊？能吗？发愁,3,57,5,2022-08-15 19:14:19,来自甘肃,92363120085,柔儿93
7132079778106295051,我感觉王逸凡做李盈莹的对角比较合适，王逸凡属于全面型的主攻，年轻有冲劲儿，只是大赛经验少，看好她。,0,1,0,2022-08-15 20:33:30,来自天津,64974437601,老球迷奶奶
7132045769968386856,朱婷怎么了？,1,2,0,2022-08-15 18:21:14,来自江西,76480801122,平燕明
7132051553984709389,不知咋地，看到那位高脚人就不想看女排比赛了。,1,3,0,2022-08-15 18:43:59,来自山东,68685723838,风趣冰淇淋Y
7132045123516646185,这主攻位置没有李盈盈的对角，要想走上领奖台，有点难。,1,4,0,2022-08-15 18:18:32,来自湖南,58909867392,追梦176028861
7132043457526907683,锻炼新人 即使没有成绩 球迷和队伍都不会泄气 只要别带王金 我觉得中国女排就有希望,1,5,0,2022-08-15 18:12:14,来自辽宁,6217030933,某某的嚒
7132119722560652070,我是一个比较懂排球的体育老师我觉得孙海平确实不错。袁新月难当大任,1,1,0,2022-08-15 23:09:25,来自湖北,52237606258,老公球迷
7132031407890907919,郁佳睿好像在广东的时候就不行，参加世锦赛是不是有点扯了。,3,2,0,2022-08-15 17:25:15,来自上海,109113115143,Kenny9441
7132082963654787877,队长袁心玥領衔最正确！李盈莹龚翔宇是主攻接应的队员。,1,0,0,2022-08-15 20:45:30,来自陕西,100403780748,秦川农事
7132050342333743872,中国女排以现在公布的没有朱婷，张嫦宁等核心队员名单出征世锦赛名单，相信大家都在心中打鼓，比赛中夺冠无望。,1,1,0,2022-08-15 18:38:47,来自广西,5958999580,喜庆的帆船Ve
7132184623429370624,怎么没有朱婷,0,1,0,2022-08-16 03:24:44,来自天津,107698560216,直爽溪流e4
7132057596127003427,没有朱婷张常宁？,2,14,1,2022-08-15 19:06:56,来自浙江,97804503175,豁达用户独钓寒江雪
7132042993057694464,基本上容易创造世锦赛最差战绩，不必期望过高,3,3,0,2022-08-15 18:10:16,来自广东,104566764800,聪哥不是谁都能叫的
7132036330527294222,我倒是一直关注吴梦洁，希望她能成长。,1,6,1,2022-08-15 17:44:42,来自新加坡,93164546253,我很爱读历史
7132091299608003360,我就是进来看有没有王芸路的，有她中国队就没戏，她根本就不会扣球，她扣球基本上都是冲过头然后往后仰，球能过网就不错了，而且这种习惯已经定型，改不了的，无弹跳也无力量。这种人还能在国家队混下去，悲哀。,2,9,1,2022-08-15 21:18:16,来自重庆,60653184031,没想好25178
7132032266775593731,不培养年轻队员看不到希望，,2,11,2,2022-08-15 17:29:20,来自浙江,103101100614,Asfghjjk
7132084334756250376,这女排一点竞争力都没有！,1,4,0,2022-08-15 20:50:51,来自宁夏,6845835870,百川21
7132090649587499776,为了国家利益，张常宁应该推迟到30 岁再考虑结婚，培养一个优秀运动员真的不容易。当打之年好可惜呀！像女排其它队员差不多退役了才结婚，惠若琪，魏秋月，曾春蕾都能做到，,1,7,1,2022-08-15 21:15:08,来自浙江,104042036961,欢快海浪yc
7132153272369955620,走不了多远，这阵容不看好，缺主攻，现在的这支队伍，都让人研究透了，更难打了，没有奇兵，主攻就看好李莹莹，一人撑不起来,0,0,0,2022-08-16 01:21:54,来自辽宁,58886432626,梦花如雪30
7132032677779686182,接不了一传的自由人怎么还在队中？门子够硬鸭！,1,8,1,2022-08-15 17:31:12,来自天津,55534028272,我从草原来NmAa
7132047596452889380,加油，中国女排[加油][加油][加油],0,3,0,2022-08-15 18:28:21,来自江苏,1978747787937411,简单cjh1314
7132037465581290273,这次大赛二传 边攻必须调整！,1,1,0,2022-08-15 17:49:15,来自河南,5461615536,豫您有约
7132065109694382848,要重塑女排的辉煌就必须发现培养新人，陈忠和如此郎平也是如此，希望蔡斌也能如此。,1,8,0,2022-08-15 19:36:05,来自安徽,105793364364,凡人乐事2012
7132036757029208873,辽宁的段放，广东的栗瑶都比北京的金烨，王云露强，,1,11,0,2022-08-15 17:46:00,来自辽宁,9271564968,淡定柳叶sa
7132060592667607815,朱婷呢，能到国外参加比赛，不能参加国家队比赛吗？,10,24,3,2022-08-15 19:18:49,来自江苏,3856727888627543,涛哥有观点
7132125778930025216,为什么不用姚迪？,0,0,0,2022-08-15 23:32:07,来自河南,4380073689089880,行云流水hy
7132031692356780839,彻底玩完了…,19,252,5,2022-08-15 17:27:06,来自广西,97260866701,70后的我们一直在奋斗
7132052759162913574,有王云蕗和王唯漪两个身形笨重的队员，而主教练又随时让她们上场，在刚过去的世界排球联赛中已彻底暴露了她俩的短板，怎么又进了大名单？无语了。,3,23,2,2022-08-15 18:48:44,来自云南,6237172399,风从水面过
7132045577612837663,早上新闻都说张常宁21号归队，难道是假的[捂脸],8,16,1,2022-08-15 18:20:39,来自湖南,52760077648,北郭先森
7132042970840793896,为什么没有朱婷？能出国打球，不能代表国家队参加世锦赛？,16,81,8,2022-08-15 18:10:19,来自河北,109315475430,探秦皇
7132055627195007784,看了看去，还是信任郎导那批队员！龚翔宇、袁心玥、丁霞、王梦洁、李盈莹、王媛媛。王云璐技术粗糙。,2,12,2,2022-08-15 18:59:21,来自河南,5425694657,生活洞察
7132081829187765030,这次22人大名单是蔡斌无奈的选择，朱婷丶张常宁缺席，主攻位置中除李盈莹外，像金丶王不用试，吴梦洁丶王逸凡二位新人，初次进入大名单可以一试。仲慧的水平比金丶王的水平相差不大。,0,2,2,2022-08-15 20:41:18,来自江苏,4485638611282957,外向海浪KT
7132155570706432808,女排完了[捂脸],1,0,0,2022-08-16 01:30:13,来自广东,50301069797,用户飘逸的晚风
7132039427396125443,朱婷张常宁呢,21,46,6,2022-08-15 17:57:05,来自新疆,59730177482,正直小羊tE
7132050514270913321,王云露差的是责任心和荣誉感，傻乎乎的，不可大用。金烨缺点灵性但很努力，狠练弹跳和打点，苦练高抛发球。,1,7,0,2022-08-15 18:39:23,来自广东,3079051535207629,木头3M194
7132061915618149120,为什么金王二位也进入名单[what],2,22,4,2022-08-15 19:23:34,来自海南,6762132257,共剪西窗话闲常
7132079649580057376,为什么没有胡明媛,0,4,0,2022-08-15 20:32:52,来自吉林,61287781532,听诊器血压计
7132048606236361512,朱婷还没恢复嘛？！,2,13,2,2022-08-15 18:32:13,来自山东,4404729951,桃仁桃子
7132046172709159714,自由人若用王唯漪，输球是大概率的，这人站位意识差，移动速度慢，脚下灌铅，判断力不够……。,8,74,1,2022-08-15 18:22:36,来自安徽,101689105754,朴实雪梨is
7132054749620585251,22人打酱油的不少，最终14人入选，淘汰8人估计没什么变化，看蔡斌锻炼这两个人，估计还是那帮人。两水货不落选，成绩好不了,0,2,0,2022-08-15 18:55:55,来自天津,50027943552,活的明白L
7132124633595396871,不是我消极，最近几年中国女排很难出彩,0,0,0,2022-08-15 23:27:53,来自湖北,62546834156,运筹帷幄葡萄r4
7132078996832961311,王梦洁又回来啦,0,7,0,2022-08-15 20:29:59,来自广西,63310140933,自律的女人不会差
7132050965293368097,主教练是谁？为什么不公布？中国女排头号主攻朱婷为什么不出战？成为全国球迷的期待，根据现在公布的这份名单，作为一代老球迷，进八强都难，,3,19,5,2022-08-15 18:42:09,来自湖北,71470260461,彭方炎
7132047007980094248,朱婷和张常宁难道永远退出国家队了？世锦赛是三大赛里含金量最高的，这都不参加是啥子情况？,7,24,3,2022-08-15 18:25:58,来自江苏,108179554396,敌场称霸
7132066847557747496,山东队的杜青青能打主攻也可以打接应防守也不错,1,12,1,2022-08-15 19:42:44,来自北京,111235927638,一往无前咖啡ov
7132057338449527552,中国队没有一个再像刘晓彤和张常宁，胡名媛这样发球冲击对方也是不会赢的，要是安家杰当主教练就好了。,1,9,2,2022-08-15 19:05:43,来自海南,84127207983,chenggong
7132039745265779490,怎么没有胡铭媛呀,2,0,1,2022-08-15 17:57:43,来自福建,4571732764,华仔44221147
7132074975053873954,胡铭缓，为什么没有参加,0,0,0,2022-08-15 20:14:18,来自江苏,9369679259,英明果断钢琴iJ
7132043814252167976,梦洁终于来了，其实副攻还有没有人啊，小清新说实话，防守和拦网都不是很好，没有恶意，板凳深度也可以一块加些新人,0,11,1,2022-08-15 18:13:28,来自广东,4296545594508236,不要草莓只要啵啵
7132043528796193569,中国女排世锦赛名单,0,11,1,2022-08-15 18:12:24,,461432063572828,喜欢猫的妞
7132034540251841315,不是说张常宁归队了吗？,20,29,6,2022-08-15 17:37:35,来自河北,59783939605,与你同行163962245
7132067632278520614,现在看见中国女排都没兴趣，特别不爱看了,0,2,0,2022-08-15 19:46:30,来自湖北,95084538347,木子瓜子里
7132052815316861737,蔡斌离不开金烨王云路吗？,1,20,1,2022-08-15 18:48:31,来自甘肃,3021075625292404,自在梦想FV
7132044425068610334,朱婷，张常宁呢？国家和人民培养了她们，关键时刻怎么一声不吭了？,12,27,8,2022-08-15 18:16:16,来自浙江,65741394012,悠闲海风ON
7132035877916148521,朱婷呢，女排头号主力缺席，进前四都够呛。,19,38,6,2022-08-15 17:42:51,来自北京,5861927512,YSH1860
7132042153052357390,金烨本身身体素质不错，弹跳也还可以，看看男排的主攻俞元泰，身高才1米83，打的多好，高度不行下手一定要快，用一些技巧才行，学学吧！,1,8,1,2022-08-15 18:07:35,来自四川,6291712084,洒脱喜鹊oe
7132072553958933279,说实话希望越大，失望就越大！那么期待中国女排能把活干的漂亮点儿，结果备受打击，一蹶不振，看女排受内伤现在还没有回复元气呢，唉这个阵容只怕又没戏了？,0,4,5,2022-08-15 20:05:18,来自甘肃,103505314073,小溪Erin
7132037076937343747,朱婷呢？？？,2,0,0,2022-08-15 17:47:55,来自山东,105517543023,东旭540
7132074229482603264,主攻换上刘晏含,1,7,3,2022-08-15 20:11:27,来自广东,1446603401725316,随风飘逸
7132040460834702091,这主攻阵容，除了盈莹，别的和强队比，是三流，盈莹也算不上一流，要进前四，难于上青天！接应龚翔宇，二传丁霞还可以。当锻炼队伍吧！,2,16,4,2022-08-15 18:01:02,来自山东,108029645865,单纯远山R
7132039964615328516,丁霞不是退役了吗,3,11,2,2022-08-15 17:59:23,来自河北,606522913071838,山高树为峰211
7132043550669144863,主攻上刘宴晗队伍可以提升一个档次,1,10,2,2022-08-15 18:12:57,来自湖南,52205915371,跟着冬前迈
7132045483723703047,没有主攻朱婷，女排进前四都困难！,7,21,4,2022-08-15 18:20:29,来自河南,2727262424137819,彭照玉
7132127111590216483,我是一个跟随一直支持中国女排20多年的球迷，这个名单，真的不想看了，有10名之外就不错了，现在对中国女排没有信心，对这种教练更没信心，不在支持，现在没兴趣，我脱粉,0,2,1,2022-08-15 23:37:06,来自广东,58243296706,追风者联盟
7132043416946869023,炒作的水分终于被挤干了，选择了能选择的最佳集合。接下来全队要摒弃杂念，专注训练。相信蔡导的队伍能从逆境爆发的中国男排的故事中汲取力量和得到升华。中国女排，好运！,4,12,3,2022-08-15 18:12:23,来自广东,3900493752,君行早29302369
7132036230581551913,这份名单用姚迪替换郁佳睿就成为目前国内最强阵容了，已经没有其他选择,2,32,4,2022-08-15 17:44:06,来自重庆,610941733702891,眺望我是海
7132047114359620352,朱婷呢？功成名就？,3,20,3,2022-08-15 18:26:11,来自山东,71014200120,乐观的风趣随缘
7132042992063578921,主攻手为什么在新手跟不上的情况下，不把功成刘晏含列入其中。说明女排队伍？,6,23,4,2022-08-15 18:10:16,来自四川,110832580612,神秘蛋糕gy
7132107613361537823,没有看到朱亭的命字。好想看到朱亭啊！,0,0,0,2022-08-15 22:21:24,来自河南,102296943525,淡泊的风声7
7132043052923208451,主攻那怕输也不要紧，新人主攻要年纪小的才好培养啊,1,9,2,2022-08-15 18:11:38,来自贵州,63179480663,再戒不了
7132048737572242209,这个阵容就别指望能取得好成绩了，主攻不行，自由人不行，靠得住的只有李盈莹，龚翔宇和王媛媛。,0,9,0,2022-08-15 18:33:18,来自湖北,918821808388120,睿智钢琴Jy
7132033720831574818,朱婷的伤还没好吗？,7,17,3,2022-08-15 17:34:20,来自天津,106537411485,极速柳叶Vv
7132040265531622157,主攻缺少朱、张，中国女排难难难！世锦赛能否进八强？悬悬悬！,2,18,2,2022-08-15 18:00:23,来自浙江,2176621899418168,侠影飞大唐
7132070342579421991,看了名单前四都进不去。,1,5,0,2022-08-15 19:57:02,来自黑龙江,79367744712,何玉东1
7132052006499992323,亚洲杯女排10号拉胯！,2,4,4,2022-08-15 18:46:21,来自山东,6033978474,shj277277
7132043869016998688,名单肯定会引起球迷不满,5,36,3,2022-08-15 18:14:17,来自江西,52110855126,捡漏子
7132047045380719371,这几个人还是算了吧？扣球都没有份量，软绵绵的，要选拔两个像艾格努，塞拉这样的，女排才有希望。看了上次世联赛。好失望,8,4,6,2022-08-15 18:27:03,来自浙江,5909889424,浙江一个蛋
7132045316429955880,如果是打着玩派谁去都可以，如果是冲着冠亚军去别看人不少（22人的队伍真不少，其实可以分成一队和二队），可能性微乎其微！这样也好，女排想怎么打就怎么打，往娱乐方向打都可以别考虑名次这个负担了！,0,7,1,2022-08-15 18:19:27,来自河南,5780751560,青海湖64595636
7132032330327720736,看来女排世锦赛冠军还不知要等多少年！,2,40,4,2022-08-15 17:29:44,来自上海,52261065054,伊枫飘飘
7132202454220866339,看完名单不用打就知道中国队会是个什么样的成绩！5～6名吧！对蔡斌真的不能寄于厚望！现在再看女排已没了热血沸腾，还有点担心别让人打的太难看。,0,0,0,2022-08-16 04:33:17,来自辽宁,3008719839565968,亮
7132026570176791332,王梦洁 必须留下来，否则就没看头了,3,6,1,2022-08-15 17:07:14,来自广西,2418573636026205,好学清泉xI
7132050973887070976,太可怕的主攻线,0,4,0,2022-08-15 18:41:14,来自广西,3979875618659892,知恩578
7132100117062402816,为什么朱婷不参与国家队啊,0,0,2,2022-08-15 21:51:48,来自江苏,74717353039,晴空257468839
7132150683914158860,没有朱袁张，这比赛没有看点，前八都难,0,0,0,2022-08-16 01:13:14,来自广西,59595197825,美西西10
7132057751245013760,支持盈盈，王梦洁[赞][玫瑰],0,7,1,2022-08-15 19:07:37,来自陕西,72075184785,自由人士7138
7132043136557695785,中国女排世锦赛加油,0,7,1,2022-08-15 18:10:54,来自浙江,111436859580,俊俏微风EK
7132050980430365476,主攻七人，那么只有六人名字呢,0,0,0,2022-08-15 18:41:36,来自云南,2022730953660584,直爽聪慧的完美
7132077160026243875,为什么没有朱婷？,0,2,1,2022-08-15 20:22:42,来自甘肃,5749842793,MEGABkop
7132047881716400935,比赛时间是何时?中国女排加油！[加油][加油][加油],0,1,1,2022-08-15 18:30:09,来自福建,2164258314133579,灿烂笑容耶
7132097423803122466,朱婷伤尚未痊愈，不能为国家队打球，只能为意大利俱乐部打球,0,2,0,2022-08-15 21:41:18,来自黑龙江,109150870225,用户F117
7132055749148263179,这个阵容基本很难进四强，李莹盈孤掌难鸣！,1,8,2,2022-08-15 19:00:25,来自河南,6563063743,远见卓识奶酪kh
7132096456260879115,只有李盈莹、龚翔宇两人使人放心，丁霞也行，其余的不入流！,0,3,0,2022-08-15 21:38:07,来自湖北,474622759021688,直率的皮蛋
7132072385880589094,什么女排精神都没有了。就剩下内斗。,0,5,0,2022-08-15 20:04:57,来自辽宁,4296532558087703,燕京晓林A
7132106175474680590,主攻金王居然还在,0,0,0,2022-08-15 22:15:56,来自陕西,99774118462,芳芳3694252504900
7132042673099522816,李盈莹可以休息了，有虚烨、王芸路这两名蔡斌手下大将足够了！,0,14,1,2022-08-15 18:09:06,来自重庆,769247135673355,S一11111
7132106725335122688,预祝中国女排在2022年世锦赛上勇闯榜首，为祖国争取无上荣誉！[666][666][666],0,1,0,2022-08-15 22:17:35,来自广西,102988999002,智慧上石
7132048520265876263,丁霞不是退役了嘛,0,6,1,2022-08-15 18:32:54,来自广东,4294979586,向阳季
7132033014120858398,必须用新人，世锦赛没戏，锻炼队伍，为巴黎奥运作准备。,3,45,6,2022-08-15 17:32:13,来自贵州,53332719264,好人93262
7132047645308158761,上次二传够次的，一点儿都不灵活，传好了都有可能迎意大利，不是丁霞是另一位，忘了是谁了,0,3,5,2022-08-15 18:28:18,来自天津,10896106772,快乐幸福的我陶醉着
7132038102860055332,老蔡：虽然说换汤不换药，但不至于连汤不用换。墨守成规，一成不变。一帅不才，累及之军。只可惜李妹妹，前场，后场满场飞，当了劳模，成不了英雄。,2,33,5,2022-08-15 17:51:54,来自广西,102574122009,热闹青山ix
7132066039630250767,有丁霞，龚翔宇，袁心玥在能战胜一切困难，中国女排加油！,0,0,0,2022-08-15 19:39:42,来自广东,103887001190,勇敢的麻酱WB
7132078218756309793,女排亚洲杯马上开打，从中可以考察新人吴梦洁丶王逸凡的真实水平，是否能充当李盈莹的对角，,0,1,0,2022-08-15 20:27:13,来自江苏,4485638611282957,外向海浪KT
7132044464331916043,一看这名单进四强没戏。,1,13,2,2022-08-15 18:17:00,来自甘肃,54564738493,Zhangqf
7132038227766428450,带三个自由人？这也太自由了,4,16,4,2022-08-15 17:51:54,来自浙江,3532529512,杨铁板
7132108370961810217,女排锦标赛能去22人。这只能说目前的集训名单。[捂脸],0,0,0,2022-08-15 22:23:57,来自上海,103585646353,清闲的星辰WQ
7132040131745891072,"金 王 上场？
没戏了",2,8,0,2022-08-15 17:59:20,来自吉林,58963741819,梅里18
7132071659020387072,男排夺冠，就看女排啦。,0,0,0,2022-08-15 20:01:27,来自山东,97038064968,敏锐云朵It
7132063581843342095,为什么女排这么厉害，你看看她们的名字80％都比较男性化[捂脸],0,0,0,2022-08-15 19:30:06,来自四川,2273445283635228,齐鸣一一陈
7132057375112250146,中国女排怎么啦，让人看不懂，成功了扬眉吐气，失败了一盘散沙。,0,0,0,2022-08-15 19:06:05,来自河南,106202778454,好学百香果oD
7132065836957270825,姚笛年纪大了，要培养新人,0,0,0,2022-08-15 19:38:53,来自江苏,1358627559706126,一心一意明月Sv
7132121659083571983,主攻为什不带上刘晏含，二传为什么没有姚迪，孙海平。这阵容可惜了！！！！！,0,0,0,2022-08-15 23:15:59,来自广东,108179699048,开悟991
7132045471522292484,主攻可以锻炼其他人了,0,8,1,2022-08-15 18:20:49,来自甘肃,72916752849,轻描淡写8623
7132070542194361103,以现在的女排实力，在世界上也只能排在5—8名。新人还需要大赛的历练和磨合。,0,1,0,2022-08-15 19:57:01,来自天津,883650546113308,自由的海洋Sd
7132033341234201379,我就想问问胡铭媛怎么就这么不受待见,6,30,6,2022-08-15 17:32:50,来自吉林,55891339815,锐霖伯
7132040403343819560,最有可能进入14人名单的，反倒是王梦洁，其他新人就不必期待了！,0,3,0,2022-08-15 18:00:23,来自北京,60807124803,诗与远方726
7132060660284244768,以老带新的队伍，非常好，从锻炼新人入手，用两年的时间，奥运会前打造出一支能夺前三名的世界女排强队。,0,0,2,2022-08-15 19:19:38,来自安徽,54884032342,李苏溧
7132100225954972447,主攻太弱，除了李盈盈，金和王下球能力太差，王根本就跳不起来！,0,0,0,2022-08-15 21:52:35,来自山东,57901407992,彦哥说宏观
7132027914802971433,蔡斌想留下谁就留下谁，想让谁上就让谁上，老话早就说了，爱谁谁!,1,2,0,2022-08-15 17:11:42,来自北京,6835693103,杜新1
7132067440632611617,这些女排队员世锦赛想争金夺银很难，能不能晋级八强都是个未知数。,0,0,0,2022-08-15 19:45:54,来自广东,2326190562479127,真诚张万敏
7132106638261388071,没有朱婷张常宁的球队，我真的不再关心,0,0,0,2022-08-15 22:17:58,来自江苏,52744972464,亮剑55285
7132053147128202017,女排千万不要从一个极端走向另一个极端。老队员价值连城，请用好老队员。,0,0,0,2022-08-15 18:50:26,来自甘肃,110714511593,黄河边没水
