7132092773805261583,为什么不是姚笛,0,1,0,2022-08-15 21:23:22,来自重庆,20835698512,英131237081
7132139847896351503,这个阵容进前四基本没戏，关键主攻，除了李盈盈，其他人基本是陪衬，对世界球队起不到关键时刻能拿分的作用。,0,0,0,2022-08-16 00:27:20,来自山东,54793368632,睿智常人
7132040569597559552,为什么不用胡名媛,0,11,1,2022-08-15 18:01:01,来自江苏,1609283248075806,乐天派鲸鱼Pw
7132050527701369604,祝中国女排能取得好成绩。,0,0,2,2022-08-15 18:40:16,来自江苏,1900430631664915,红阳
7132099840574046990,理性看待中国女排吧，想看了就看几场比赛，不想看了就不看了呗。,0,0,0,2022-08-15 21:51:11,来自宁夏,22906789276,自在的王小二
7132035360636977935,看来主攻还在遴选阶段。,1,5,6,2022-08-15 17:40:43,来自天津,2248593143,来的都是客28
7132071027257082659,谁也无法改变名单，希望这次女排姑娘们有所突破取得好成绩，为李盈莹.龚翔宇及女排姑娘们加油！💐💐💐,0,1,0,2022-08-15 19:58:49,来自天津,852868874382686,进取星空ak
7132096636918170405,朱婷为什么不参加，朱婷有伤应该也跟随队里，有内幕，,0,0,0,2022-08-15 21:38:29,来自山东,83349282483,单纯圆月08
7132062012884222754,就二传方面来讲，女排未来几年没有竞争力了，不培养年轻二传,0,0,0,2022-08-15 19:24:01,来自上海,1019952561921383,瓶底锅盖
7132082375555203855,祝中国女排旗开得胜。,0,1,0,2022-08-15 20:43:01,来自河北,104895691136,豁达豆花Uc
7132097440174048035,说明朱婷、张常宁，不参加世锦赛了！超级失望！回来吧！回来吧！为了祖国荣誉！为了球迷！,0,0,0,2022-08-15 21:41:32,来自河北,61735684693,万里大堤
7132150861396673315,加油！中国女排！祝福！中国女排！,0,0,0,2022-08-16 01:11:28,来自广西,78907325841,衣上洒痕
7132053619498566412,队员身体素质和技术能力都不错！唯一不足就是菜鸟教练水平有限！要想拿冠军这个教练真的不可能！,0,2,0,2022-08-15 18:52:00,来自河北,99663284666,风姿卓越风筝vK
7132031218912772864,蔡导要勇于换人无论是谁。向吴胜指导学习排兵布阵。打不好换累了也换。,0,5,0,2022-08-15 17:24:43,来自黑龙江,4089825975355479,聪慧圆月Rr
7132053351667319552,朱婷为什么不上？,0,2,0,2022-08-15 18:50:24,来自江苏,5456018490,kan西
7132063157375501089,我们女排主教练不换，还是没希望了！,0,2,0,2022-08-15 19:29:08,来自福建,105955706046,友爱云朵wR
7132033757737124643,干脆锻炼新人吧，或许还有惊喜呢，这就要看教练的胆识和水平了，道理很简单，上老人儿继续输，没有希望拿好成绩，肯定的！,2,26,1,2022-08-15 17:34:27,来自天津,67185173823,巍巍五指山
7132051558418301710,这个周期顶流是国兵，不是女排了,0,1,0,2022-08-15 18:44:06,来自浙江,4456533382,Zrt317
7132093375402509097,排球结束，走下坡路了，,0,0,0,2022-08-15 21:25:41,来自上海,61750422297,爱在深秋听雨
7132082297033311013,王云路打球粗糙，光有蛮劲,0,2,0,2022-08-15 20:43:00,来自陕西,6088640463,静心78590193
7132066130750964495,男排，女排，教练有现在的男排队教练任教，换去女排教练蔡斌，女排还有㠻望。,0,1,0,2022-08-15 19:39:53,来自河南,5523138562,三月雨666666
7132134406932120350,为什么不说主教练？中国女排最好的教练只有郎平和陈忠和。,0,0,0,2022-08-16 00:06:49,来自贵州,5594884795,tlyyty
7132100368540042018,张常宁还未拍完商业广告吗？杂没在大名单之内。,0,1,0,2022-08-15 21:52:49,来自山东,62853882138,雪山巨峰
7132068169044968200,朱婷退役了吗,0,1,0,2022-08-15 19:48:18,来自浙江,818504241277800,小陈
7132059972875649832,为什么没有朱婷?,0,2,0,2022-08-15 19:16:11,来自内蒙古,2466930240002707,上进的远山n
7132071253485781767,这支没有朱婷的队伍，没啥希望的！,0,0,0,2022-08-15 20:00:17,来自浙江,5968323587,高兴73516514
7132061638777766696,朱，闫，张一退[流泪][流泪][流泪]女排在亚洲怕就难立足了哦！！,0,2,0,2022-08-15 19:22:43,来自陕西,101793075832,知情达理海风dn
7132034595700261671,有金王，就少了一个进攻点。,1,11,0,2022-08-15 17:38:19,来自江苏,17610019969,Iamwaffling
7132057936939582242,女排从此在菜指导的指导下，逐步退出世界女排强队之列,0,1,0,2022-08-15 19:08:17,来自天津,105954368368,善良好心情100
7132149427527238438,没有朱婷的中国女排需要培养一个强力的主攻。,0,0,0,2022-08-16 01:08:04,来自新疆,10722205100,信仰之环
7132081357731545894,还是没有朱婷、张常宁,0,0,0,2022-08-15 20:39:30,来自四川,14750778986,allen016
7132104295805518626,名单一公布，多数球迷对世锦赛中国队的成绩有了答案，但教练却没有！,0,0,0,2022-08-15 22:08:00,来自山东,103984540310,正大光明奶茶Vr
7132053841784734497,朱婷这是退役了吗？,0,0,2,2022-08-15 18:53:12,来自广东,76938086919,莹莹11763
7132046072452825869,不管谁，成绩如何，是女排就无条件的支持。中国女排，加油加油！,0,1,0,2022-08-15 18:22:41,来自北京,58409768216,永恒的帝国之心
7132115200647611139,朱婷，张常宁，姚迪这三个人关键时刻都干嘛去了？,0,0,0,2022-08-15 22:51:17,来自北京,106027117314,愉悦的可乐qR
7132049257674277667,以前女排比赛是一场都不落下的，现在是全部比赛都落下，,0,1,0,2022-08-15 18:34:32,来自江西,8813868079,话就是睡不着
7132087904595182369,没有朱婷很难胜,0,1,0,2022-08-15 21:04:45,来自四川,74875972841,分秒必争画板e9
7132047413937996576,蔡导加油！只要打出女排精神！,0,1,0,2022-08-15 18:28:19,来自江苏,3593659425753880,老卞
7132062822393463566,支持王梦洁！,0,4,0,2022-08-15 19:27:36,来自福建,103973165569,谷丰99
7132079821731414797,朱婷和张常宁什么情况,0,0,0,2022-08-15 20:33:27,来自四川,54437876149,诚也
7132041732782949134,支持中国女排，加油！！,0,6,3,2022-08-15 18:05:59,来自云南,210755641681304,仁爱荷叶ST
7132123984887857935,中国女排，努力吧。,0,0,0,2022-08-15 23:25:01,来自江苏,104465150008,天山剑360
7132067200906593059,中國女排没有郎平挂帅，没有朱婷，张常宁彻底完了！前八都进不去！,0,2,1,2022-08-15 19:43:56,来自河北,62142881027,热心饼干Oi
7132058849905361664,朱婷怎么了,0,2,0,2022-08-15 19:11:48,来自吉林,58708562748,无所蔚3
7132105701639406351,没有朱亭，张常宁参赛，可以讲定输旡疑！应该吸取上次的教训！,0,1,0,2022-08-15 22:13:29,来自天津,59836345653,悠闲明月gQ
7132117431640408873,没有新人冒出啊，接下来女排很难出成绩了,0,0,0,2022-08-15 22:59:28,来自四川,2264590423965411,由来一声笑男儿自横行
7132072102881985294,没有了朱婷主将，很难争前四了，加油吧！,0,1,0,2022-08-15 20:03:22,来自广西,1991951576205415,52o三弟弟
7132046436178952992,就这些队员世锦赛没戏,0,4,0,2022-08-15 18:24:40,来自辽宁,107930498507,张兴伟830
7132118339564503844,朱婷张常宁不归队，一切等于零。,0,0,0,2022-08-15 23:03:36,来自四川,101617856298,huangjinlong12
7132062102021571360,只看好丁霞 袁心玥和李盈盈！,0,2,1,2022-08-15 19:25:05,来自河南,954789774764877,人在天涯
7132045734367068962,锻炼新人说得过去，但是我发现现在的女排不够团结，,0,3,0,2022-08-15 18:20:59,来自浙江,6894646495,几渡余钝
7132055016885764904,女排只喜欢王媛媛[大笑],0,0,0,2022-08-15 18:56:55,来自陕西,5868075935,博69309102
7132039595210097442,怎么还有王云蕗和金烨？这两个在场上进不了前六。,1,5,0,2022-08-15 17:57:12,来自江苏,3702981437,朱闻籁
7132123001604031263,个个都是大美女，个个都是女排的佼佼；每位都在负重前行，每位都是祖国的巾帼。,0,0,0,2022-08-15 23:21:18,来自甘肃,111225440587,人近贤良
7132090548126548775,为何没有打包队这几个队员！为了能进国家队，嗓子都拼哑啦！,0,1,0,2022-08-15 21:15:09,来自天津,55534028272,我从草原来NmAa
7132114071314973470,朱婷张常宁人呢,0,0,0,2022-08-15 22:46:47,来自陕西,69611450043,清爽芒果nJ
7132063403883365131,以前有排球比赛还会看，现在直接换台[捂脸],0,0,2,2022-08-15 19:30:12,来自天津,5951234147,青涩奶酪5
7132093762952004392,没有朱婷？？？？,0,0,0,2022-08-15 21:27:11,来自山东,50449887428,yantaizql
7132077036290130692,看看选的主攻（金王）就知道是几流球队！[捂脸][敲打],0,2,0,2022-08-15 20:22:59,来自四川,50096718716,福羊1577
7132085751751607080,不知道能不能创造2010年的世锦赛第十名的新低,0,0,0,2022-08-15 20:56:04,来自北京,3830345064776584,爱朱婷爱女排
7132065543179911968,现在的女排看着堵心,0,1,0,2022-08-15 19:38:29,来自广西,25977331113,拭目以待都小民
7132034107051590400,一首凉凉送给蔡斌指导，我大胆预言进不了4强[泪奔]不要喷我,8,40,2,2022-08-15 17:35:57,来自北京,87908436670,爱吃香蕉的男孩
7132114178621948676,我们的朱婷呢？,0,0,0,2022-08-15 22:47:43,来自河南,70293306221,赠香2
7132066081241826086,就认识袁心玥龚翔宇丁霞,0,0,0,2022-08-15 19:40:37,来自四川,4503010292,果园里的悟空
7132092096894206759,什么是女排精神？没有内幕，也任人唯才也是其一！,0,0,0,2022-08-15 21:21:06,来自北京,104480315356,执着的明镜Pq
7132090403414901536,女排到底怎么了？有什么事？领队？主教练？,0,0,0,2022-08-15 21:14:40,来自北京,104480315356,执着的明镜Pq
7132074712963777288,女排打法死板:前排烂网丶后排缺乏判断力丶提前做好矛防丶防调球:,0,0,0,2022-08-15 20:13:31,来自辽宁,24017153362,多彩人生沙
7132101115193312036,小个也有春天，这个真看天赋和努力，向俞元泰学习，另，教练选材视野要宽，有能力的队员多有性格，要包容团结，不要拘于地域、身高，要看球商球技，看天赋和朝气,0,0,0,2022-08-15 21:56:01,来自吉林,92817127934,天晴有语
7132051342004749071,不是说张常宁归队了吗？,0,0,0,2022-08-15 18:42:47,来自辽宁,68353610990,老张夕阳
7132034861040943908,段放名单都没进？,1,0,1,2022-08-15 17:39:21,来自浙江,2608483485882776,哆啦A梦2112
7132140640762151720,袁心玥？还是算了吧。,0,0,0,2022-08-16 00:30:16,来自江苏,5425505620,半山一棵松
7132077292100305668,我的天哪，女排个个是美女！,0,0,0,2022-08-15 20:23:47,来自上海,74892342578,宇宙天地
7132055270573884193,宇宙第一主攻线，金王势力真强！必夺冠军,0,2,0,2022-08-15 18:58:31,来自陕西,102470085078,海阔云作岸
7132052278130885415,为什么还带上金烨，王云蕗，已经证明二人实力不行，难道是找到主攻了吗？,0,2,0,2022-08-15 18:46:54,来自内蒙古,91686804363,端庄溪流E
7132056537966658338,世锦赛中国女排第八名,0,0,0,2022-08-15 19:02:41,来自福建,99510921614,高级生活家C3
7132066881359758121,胡铭媛基本没有拦网,0,1,0,2022-08-15 19:42:53,来自陕西,97069302190,MacroNi
7132052376525325060,没有朱婷，张常宁？,0,0,0,2022-08-15 18:47:36,来自北京,59249665687,亦毅3
7132038671599338278,蔡导真行，认准了王云露，金烨，夺冠有望了！,9,33,2,2022-08-15 17:54:17,来自内蒙古,108173449371,淡定山雀ww
7132047114359800576,没有老将林莉和姚迪，蔡斌玩完了！,0,5,1,2022-08-15 18:26:15,来自福建,109630926543,我是乡下男人
7132060839741571874,朱婷呢？去哪啦，我看又有点麻烦！,0,1,0,2022-08-15 19:19:27,,51639965133,元气钢笔1
7132078707308839720,朱婷为什么没在队,0,0,0,2022-08-15 20:28:37,来自北京,111074048012,简单圆月C3
7132046070808396577,为中国女排加油,0,1,0,2022-08-15 18:22:55,来自河北,58650226253,哈哈1113103
7132052714695639822,朱婷哪去了,0,2,0,2022-08-15 18:48:36,来自内蒙古,3232189803932355,知卜一
7132047054280590117,为何没有胡铭媛[捂脸],0,2,0,2022-08-15 18:26:24,来自广东,6400859236,思念不减
7132034542164509480,中国女排加油！,0,2,0,2022-08-15 17:37:37,来自北京,60807124803,诗与远方726
7132080220718318368,女排有金烨在就行！,0,0,0,2022-08-15 20:34:59,来自浙江,378707518959620,风姿卓越画板9S
7132064532503610146,不管是谁上，女排精神不能丢！！,0,0,0,2022-08-15 19:33:52,来自山东,71901046690,文雨
7132047654053348135,不看好蔡斌，太固执了,0,4,0,2022-08-15 18:28:59,来自安徽,59314578556,风过无痕288
7132067826252563238,没郎平，朱婷，没戏,0,1,0,2022-08-15 19:47:18,来自北京,1143911481883567,宣武补刀
7132077015406215944,朱婷是退役了吗,0,1,0,2022-08-15 20:22:24,来自内蒙古,6101510825,希望之冀
7132045201266197263,目前女排这支队伍，不会有多大的进步！,0,1,0,2022-08-15 18:18:49,来自广西,104308293340,淡定蜻蜓u8
7132055418607600425,青黄不接的时期，中国女排加油！胜利属于你们！,0,0,0,2022-08-15 18:58:25,来自江苏,92722864000,善良用户吉祥如意
7132097627709162254,有关报道，张常宁下月中国队报到，为什么这没名字？自由人还是王梦洁好用。,0,0,0,2022-08-15 21:42:23,来自山东,6482259925,潜望镜kangjixiang
7132052781821133603,中国历来用人就是感情用事，本来朱婷还可以上场的，就是不合现任的意图！,0,3,2,2022-08-15 18:48:20,来自广东,1724453793319664,只为福霖天下
7132099414520791823,朱婷退役了吗,0,0,0,2022-08-15 21:49:05,来自江西,4601289779,2o1o818
7132045125383242507,站在国家立场上为女排加油⛽站在专业立场上为蔡斌叹息！！！站在荣誉立场上为队员们惋惜！！！,0,1,0,2022-08-15 18:19:26,来自河南,51108348747,和为贵jhr
7132044152896455439,写错了吧？李盈莹不是自由人吗？,0,2,0,2022-08-15 18:14:59,来自天津,62830478392,董惠山
7132033853090349859,感觉世锦赛成绩不会好，不如带上吴梦洁王逸凡锻炼一下,0,1,0,2022-08-15 17:34:54,来自广东,1354191279495015,头头是道Sports
7132117782187508510,终于看到有王梦洁了。,0,0,0,2022-08-15 23:01:04,来自甘肃,764864481989904,可靠星球PV
7132118402051195660,‘难道中国就有一个朱婷吗？,0,0,0,2022-08-15 23:04:05,来自广西,68264081278,无忧的荷叶Kv
7132104673888584482,看到北京那两个主攻还在我都觉得没戏了， 蔡教练选人真的不行。,0,0,0,2022-08-15 22:09:34,来自广东,50238228943,冷酷7343
7132076352391578371,主攻还是塌了一角，不看好……,0,1,0,2022-08-15 20:20:10,来自云南,83485945369,韬城
7132056717613105934,希望中国女排可以打出高水平,0,1,0,2022-08-15 19:03:51,来自黑龙江,94394118030,哈尔滨任平
7132065198668088075,朱婷不参加，实力有所减弱，但也可以培养启用新人！,0,1,1,2022-08-15 19:37:01,来自江西,61353107246,自然成12
7132048397951320871,这名单想取得好成绩挺难，主攻除了李盈盈都不咋地！,0,2,2,2022-08-15 18:32:04,来自山东,104995821311,清新风筝sv
7132084523650679593,看男排吧，心痛盈盈和小雨，估计世锦赛会累死。,0,1,1,2022-08-15 20:51:10,来自湖南,78520019864,自由快乐9989
7132060891176780557,没有好主帅，中国女排难雄起！,0,1,0,2022-08-15 19:20:16,来自陕西,61802010300,陈邦彦1
7132045305633309481,现在的女排比赛基本上不看了，看了让人生气,0,0,0,2022-08-15 18:19:14,来自江西,84896685327,豁达铅笔hc
7132070298967098149,确实大。22人。最后定下来会少不少吧？集训时，大名单上的球员都会参加吧？！,0,2,0,2022-08-15 19:56:40,来自安徽,59838687870,江南雨中行
7132064801529955113,为啥二传不用姚迪？,0,1,1,2022-08-15 19:34:44,来自江苏,329444901272878,用户五谷岛主
7132104715843666719,喜欢李盈盈，打球有灵性[赞][赞],0,0,0,2022-08-15 22:09:55,来自江西,54795662283,春风杨李万千条
7132063520879215399,女排可能要沉沦5到8年,0,0,0,2022-08-15 19:30:35,来自天津,81684915614,jo
7132102869381137167,朱婷是不是弃用了？,0,0,0,2022-08-15 22:02:24,来自云南,5833508261,风趣乐观的山雀
7132057848465081103,都世锦赛了，主力还不回归呀？,0,1,0,2022-08-15 19:08:03,来自江苏,364657824238107,半日闲068
7132054323974603533,谁说的张常宁回归了呢？,0,0,0,2022-08-15 18:54:51,来自四川,71501952970,李玉国228893642
7132054428122645248,就看李盈莹了，朱婷啥时候来啊,0,0,0,2022-08-15 18:54:34,来自江苏,2203039421174659,蔷薇夜
7132045359878128421,李盈莹领衔差不多，本人认为龚翔宇好一点，李队长关键时候发球经常送分，攻杀出错的问题令人深刻，需要淬炼老辣一点。相信自己，超越朱婷！,0,1,2,2022-08-15 18:19:47,来自广东,61930968081,潇洒白云Q2
7132044404763968291,副攻后三个去了也不用还让去干嘛！,0,1,0,2022-08-15 18:15:47,来自辽宁,2164254098065671,连群
7132045794256962334,中国女排，期待你们重新开始，加油！,0,1,1,2022-08-15 18:21:35,来自湖北,105897731553,独自等待1998
7132077241483494158,中国体育这是怎么了，篮球，排球在用人上有问题，这是想让中国篮球和排球退出世界舞台吗？,0,1,0,2022-08-15 20:23:18,来自山东,105841321600,张鲁明163
7132049283591013161,看到有金，王两位主攻还在，没戏。,0,5,1,2022-08-15 18:34:40,来自海南,5451630122,橄榄品
7132063151902343939,没朱挺，张常宁，加上三进宫的某个教练，真的有点难！,0,1,0,2022-08-15 19:29:07,来自湖北,1178266189699918,渔乐之颠
7132051036906799875,丁霞也该退了，年龄不小了。,0,1,0,2022-08-15 18:42:21,来自广西,5844865769,远见卓识原野qh
7132052746274325278,这阵容输得一塌糊涂 女排精神让他们损失殆尽,0,1,1,2022-08-15 18:48:38,来自辽宁,109959693015,富足熊猫KJ
7132043488769917699,蔡斌把姚笛和胡铭媛死死地暗出了国家队,0,5,1,2022-08-15 18:12:58,来自广西,2576849401286910,记成长
7132118529251558174,可惜了李盈盈，没赶上好时候,0,0,0,2022-08-15 23:04:04,来自广东,64817057926,llllllgggg11111
7132059216826991401,王云路加油吧，吴梦洁加油吧。机会是给你们了，一定要把握住。,0,0,0,2022-08-15 19:13:11,来自山东,1393834011134775,民乐君
7132071203720151849,支持中国女排大长腿！[赞][呲牙],0,0,0,2022-08-15 19:59:39,来自广东,98007487499,华哥哥923
7132073143912383262,中国女排还以快打法为好❗两位副攻短平快拿分不少！很效丿,0,0,1,2022-08-15 20:07:19,来自辽宁,24017153362,多彩人生沙
7132049046285419304,朱婷呢？！,0,1,0,2022-08-15 18:33:39,来自上海,879213340525636,欧赔天下
7132072507544666910,老蔡找的主攻只有李盈盈可以其它的都不行。,0,1,1,2022-08-15 20:05:04,来自广东,63263979912,闲人184475882
7132067743130026785,只要主教练不是蔡斌就好,0,3,0,2022-08-15 19:47:01,来自吉林,62692576826,博学多才的饼干eu
7132102171172520718,能拼的有林丽,0,0,0,2022-08-15 22:00:16,来自安徽,53122140941,一路风尘跌跌闯闯
7132047258195264259,二传没有天津的？,0,2,1,2022-08-15 18:27:45,来自江苏,2159059490317908,gf815118
7132054743920493351,真服了蔡斌，固执的硬！,0,1,0,2022-08-15 18:56:37,来自河北,54009015791,风之语5577
7132037733379408654,主攻实力不行。队长的人选非常重要。,0,10,1,2022-08-15 17:50:11,来自山东,93577208253,洒脱艺术家v8
7132045846954836768,没有最好二传姚迪的中国女排就是世锦赛的过客匆匆！,0,1,2,2022-08-15 18:22:17,来自四川,91680917295,格非若似
7132097255770882831,希望吴梦洁能锻炼打好小主攻 加油,0,0,0,2022-08-15 21:40:38,来自河南,111148288868,特呢
7132056285163537187,朱婷为何不回国效力？,0,0,0,2022-08-15 19:01:50,来自湖南,104716032491,九疑山下123
7132092485128143629,又是个大赛煅练队伍的教练。,0,0,0,2022-08-15 21:22:40,来自上海,108996360657,智者不懂
7132047547715175172,刘宴含，姚迪呢,0,2,1,2022-08-15 18:28:39,来自江苏,6920959271,名叫Alex的医学僧
7132045148034040589,朱婷怎没参加,0,1,0,2022-08-15 18:19:03,来自安徽,1689271487431351,倪不䧏子
7132061555721716494,王梦洁自由人比那两个强👍,0,1,1,2022-08-15 19:22:37,来自四川,5542976126,师尹59218009
7132077112148378376,没有张常宁？以前吹热闹。,0,0,0,2022-08-15 20:23:07,来自广西,3087078358000223,时髦冰淇淋QI
7132096673530446626,主攻去那么多有点浪费公款的嫌疑[耶],0,0,0,2022-08-15 21:38:24,来自四川,52296699806,耙耳朵诺维奇
7132051005579150094,这么多年都没有培养第二个朱婷，张常宁也不在，这个阵容真不行,0,1,1,2022-08-15 18:41:49,来自重庆,105885205267,天外天445566
7132051345620058921,感觉这次有王梦洁王逸凡好多了，我看好这两位,0,1,1,2022-08-15 18:42:44,来自天津,12383545430,很无聊的11爸
7132079829201224484,少了朱、张两佳，主攻得分少了保障,0,0,0,2022-08-15 20:33:28,来自广东,6801674311,山人16
7132066711993549571,朱婷去哪儿了？,0,1,1,2022-08-15 19:42:54,来自河南,9333322308,锦绣山川LIU
7132043586790818598,自由人王唯一就算了,0,3,0,2022-08-15 18:13:27,来自河北,101662645324,自若原野x6
7132116156374090536,世联赛时我就已经预言，只要菜死用金王打主力不换人就是为了让不够资格的吴梦洁进国家队做铺垫，结果被我一言中的。世联赛上他这样的操作，临场指挥和用人世人一眼看穿。,0,0,0,2022-08-15 22:54:09,来自天津,111053577855,顺势而为168168778
7132074192169992973,姚迪真的是被放弃了吗？,0,1,1,2022-08-15 20:11:32,来自四川,734125716155805,我是喜欢看热闹的群众
7132037763520267043,很难受，现在的主攻要不一传不咋地，要不进攻不咋地,0,5,1,2022-08-15 17:50:06,来自上海,52542551530,汷亐朩衟
7132098433707885346,换个主教练吧，一直不看好蔡斌！看排协怎么选帅？,0,0,0,2022-08-15 21:45:16,来自浙江,58556440529,分秒必争柑桔eC
7132045030478693135,除了增加了王梦洁和郑益昕，其他还是老样子，结果十有八九没什么好！[抠鼻],0,1,0,2022-08-15 18:18:14,来自云南,93085712027,阿昭989
7132052579063874341,朱婷为什么不打了？！,0,1,0,2022-08-15 18:47:42,来自广东,2334954254253763,GZFC2022
7132047581697934121,主攻除了小李，其余的与大刘、段放相比根本就不是一个级别的。联赛、全运会的表现已经是一目了然。,0,2,2,2022-08-15 18:28:12,来自辽宁,4740694602,北极星48032491
7132061215492375299,张常宁？朱婷这些呢？,0,0,0,2022-08-15 19:21:28,来自四川,3189241296,活的v潇洒
7132058439006225167,不用说李盈盈对角用吴梦洁，种仲惠,0,0,0,2022-08-15 19:10:22,来自甘肃,74315843975,洒脱糯米Y
7132035321776784169,这个王唯漪明显不行，还进入大名单?,0,20,2,2022-08-15 17:40:36,来自吉林,103283629627,直爽士心
7132044901369660193,女排没有明星了不看了，道是男排还可以看看。,0,0,1,2022-08-15 18:18:42,来自甘肃,54564738493,Zhangqf
7132050717544268583,姚笛为啥没有进入大名单？,0,1,1,2022-08-15 18:40:56,来自新疆,75889174227,快乐晚风HKS
7132080425069200158,为什么不招进胡铭媛？她打球速度快，猛，头脑灵活,0,0,0,2022-08-15 20:35:37,来自广东,3698389064098644,分秒必争小猫J1
7132052187131151145,看了名单，基本没戏。,0,4,0,2022-08-15 18:45:55,来自广西,111316773751,爱生活的海浪ms
7132038859113644839,又一个女足的贾秀全！玩了！,0,6,0,2022-08-15 17:54:57,来自湖北,58036283401,往事如梦150316004
7132072789368013568,主攻线真的是找不到合适的人选,0,0,0,2022-08-15 20:05:42,来自江苏,5212653353,团团哈哈一起赞
7132061824845103904,王梦洁回来了！有希望[呲牙],0,1,1,2022-08-15 19:23:59,来自重庆,97715868997,热火392
7132064273051845411,怎么没是朱挺&张常宁啊？,0,1,0,2022-08-15 19:32:43,来自美国,93006336319,知情达理书签dR
7132055423720702756,无异于前世联赛的阵型，世锦赛能比世联赛走得更远吗？悬！,0,1,0,2022-08-15 18:58:50,来自四川,51839746605,零界10
7132064283269497630,名单随时都会调整，国家队会安排妥妥的。,0,0,0,2022-08-15 19:33:25,来自陕西,6303162246,一杯清茶84808428
7132056518383993631,期待中国队派出最强阵容出战,0,2,0,2022-08-15 19:03:14,来自黑龙江,94394118030,哈尔滨任平
7132057743623684898,人员已经确定好了，现在的主要任务是苦练基本功，队员的配合，努力提高基本技能，争取比原来有一个大的提升！,0,0,0,2022-08-15 19:07:30,来自湖北,813286363245852,岁月无声13SV
7132046304687375145,不见朱婷可惜！,0,1,1,2022-08-15 18:23:16,来自广西,3087020677148477,优美可乐z4
7132090321483776780,世锦赛可以带多少人？,0,1,0,2022-08-15 21:14:35,来自湖北,311888526449598,kane5201314
7132103296097026816,张常宁呢？,0,1,0,2022-08-15 22:04:04,来自云南,3249799861643229,十八岁的心
7132084359246873344,依蔡导秉性，可能金王二将仍难割舍，果真如此那世锦赛没啥看头,0,0,0,2022-08-15 20:50:43,来自湖南,3953434270109976,优美微风ve
7132065089515635459,菜教练带队不靠能力，他需要的队员，听话是第一位的。,0,3,0,2022-08-15 19:36:44,来自河南,12580565382,端庄优雅橙子sq
7132039494383158024,金王还在，想不通,1,6,0,2022-08-15 17:57:04,来自陕西,1345403090114862,成熟星辰b2
7132060012100944655,张常宁要生娃了,0,1,0,2022-08-15 19:16:24,来自山西,106724102931,12997HAw
