7132364676826661673,歪风邪气,0,12,0,2022-08-16 14:58:49,来自广东,101338927131,为你而来HH
7132308459126588167,储教授太情绪化了。法治社会不能纵容以暴制暴。,9,42,4,2022-08-16 11:20:48,来自广东,102185081228,运筹帷幄清风zs
7132330670118568735,多么无耻啊的男人啊，他说他们没结婚证，不算是家暴，只是算打人事件，和唐山打人事件一样性质…,2,211,0,2022-08-16 12:47:00,来自湖北,62598697416,凤在梧桐
7132331387608728351,"娘家兄弟多就是有好处。
当年我姐夫揍了我姐。
她家和我家隔着一条马路。
我姐回家哭诉。
我哥哥弟弟立马飞奔过去。
从此，夫妻俩再生气拌嘴，我姐夫没敢动我姐一指头[灵光一闪][灵光一闪]",22,62,0,2022-08-16 12:49:46,来自山西,3671957717130731,彤灿妈
7132278876306637571,自扇耳光是艺术行为？哈哈😃 长见识了,13,390,0,2022-08-16 09:26:35,来自浙江,63905458639,若飞若
7132373723008484134,同居没领结婚证，一方对另一方实施的暴力也叫家暴？,4,7,0,2022-08-16 15:34:22,来自北京,109057415365,怎可辜负了这美好
7132299882492740388,你的观点很多时候很接地气[捂脸]，我赞同。,1,95,2,2022-08-16 10:47:47,来自江苏,57175436700,超级无敌雷霆暴龙战士
7132363173973476104,余秀华也撒了谎，没扯证，说扯证了。,2,18,0,2022-08-16 14:53:11,来自上海,2194249931823676,脸大的圆圆
7132364357753258788,相由心生 看这男的嬉皮笑脸的样子以及把自己打人说的那么冠冕堂皇 感觉他对爱的理解很荒谬 他还是很有目的性的 虽然全网骂他的人很多 可他因此还是获得了不少的流量 也许他当初跟余在一起要的就是这种效果吧[抠鼻][抠鼻],1,63,0,2022-08-16 14:58:01,来自陕西,98336421396,Bella
7132369946604749602,这是荒诞喜剧主角啊，还逮着别人一块演[呲牙],0,29,0,2022-08-16 15:19:16,来自福建,4142560058023691,薇薇逛红尘
7132309793402290978,人家还没有结婚呢，何谈家暴？,5,23,0,2022-08-16 11:25:36,来自山东,2664828144201288,琴岛青
7132300133907612450,赞同观点[玫瑰][玫瑰][玫瑰][赞]。余秀华一把年纪长了个恋爱脑，遇到一个极品渣男,1,25,0,2022-08-16 10:48:07,来自辽宁,1041963929053335,落花流水77
7132474115944301343,"一下子不知道该说啥好。只是觉得，当事人的声音是重要的。哪怕人的语言和行为如此矛盾，充满了人的复杂性。但倾听，当事者如何说，还是能修正一些认知。
此前觉得这个人太不堪了，此前也觉得两个人的爱情童话碎的彻底。
现在再看呢？至少感情还是值得肯定的。
包括之前对这个人表演型人格的一个判断，包括说他不懂真正的爱，其实我又有什么资格去这样说别人的感情。我们毕竟都是站得很远的人，而且我们只知道一点局部，真正的爱是什么，又怎么说得清。九派深度的视频",0,1,0,2022-08-16 22:03:08,来自浙江,325075144811438,白羽和妈妈
7132331111237468969,采访这种人是什么媒体,5,118,1,2022-08-16 12:48:11,来自广东,2757183812934795,优美可乐dt
7132280984091443983,看到一半左右就看不下去了，就一个感觉，这男的应该就是戏精本尊[泪奔],3,132,0,2022-08-16 09:34:05,来自山西,101034510168,李律666
7132321396914422543,他们没结婚何来家暴,2,4,0,2022-08-16 12:10:27,来自河北,994408631641486,我们永远在一起
7132283931206042409,有才华的人都那么另类吗？家暴与自伤是行为艺术？那杀人算吗？[呲牙][呲牙][呲牙],3,73,0,2022-08-16 09:45:15,来自湖南,2203057104361262,3167413431281静心
7132362828732252960,杨不是无缘无故的跟余在一起的，他的母亲和爷爷都是残疾人，他内心是有伤痕或者说心理创伤的，他跟余在一起，也是跟自己和解,3,2,0,2022-08-16 14:52:22,来自河南,55600261087,王嘉显
7132296825184781088,恶人还需恶人磨！,5,84,0,2022-08-16 10:36:08,来自福建,111207691783,yuan910423
7132322614496330535,如果说语言暴力也是暴力的话，那么他俩彼此彼此，哈哈,3,40,1,2022-08-16 12:16:09,来自北京,95945753385,涟漪9638
7132303234160853793,哈哈，我实在不想看到这个男人的那副嘴脸，所以就全部换成风景画。[大笑][笑哭],0,7,0,2022-08-16 11:00:47,来自广东,3883108218452644,简笺
7132314715711701793,我弟去练散打，发现一半同学是女生。可见现在女孩的自我保护意识越来越强了。对付家暴男，狠狠揍上两顿，让他一个月起不来床，就老实了,2,13,0,2022-08-16 11:45:27,来自北京,4270096277320488,虫小可可
7132487047243563791,[捂脸]女人对爱情太执着,1,1,0,2022-08-16 22:53:33,来自山东,110941336649,蔷薇说心情
7132374520245371689,"接受访问的这言论表情更像“行为艺术”[捂脸]……
爱情:我再虚无缥缈再稀有，也不是他嘴里吐出来的那样子啊……
还有摔手里卫生纸的样子，也太妖娆了吧……
好吧，我认真点评论:真该去看看心理医生了。
散了吧，再关注实在没有意思。",0,18,1,2022-08-16 15:36:55,来自甘肃,111559324154,臣安
7132280250721272579,这男的从面相上看，就是一个算计很多的人，但不管怎么说，男人打女人是家暴，那女人打男人就不算家暴了[捂脸][捂脸],3,152,3,2022-08-16 09:31:44,来自湖北,3668444925657608,远见卓识微风yX
7132300894582293283,为什么我感觉他跟林生斌长得有点神似。,4,135,1,2022-08-16 10:51:06,来自广西,1416631724029816,元宇宙、
7132279283468370720,家暴还要理由？一个有素养的男人绝不会对女人动手，何况是给你饭吃的那个人！,6,209,4,2022-08-16 09:27:48,来自四川,3997453644730915,台湾回归祖国统一
7132384367543862052,我天，突然发现这长相跟我前夫很像，他妈的也是一吵架就掐我脖子，在外是个怂包，在家窝里横,1,7,0,2022-08-16 16:15:25,来自湖南,70083111365,7102HCY
7132278754499805984,不以结婚的恋爱是不是耍流氓。,5,162,2,2022-08-16 09:26:03,来自内蒙古,86633868733,小瞳的心
7132370123402707747,爱在他们嘴里如此轻巧的蹦出来[赞],0,90,3,2022-08-16 15:19:47,来自福建,4142560058023691,薇薇逛红尘
7132280643442180879,你能相信爱一个人就是暴打她吗？,7,121,3,2022-08-16 09:32:29,来自安徽,96597385915,全食物秘笈
7132278046551884576,余秀华:你都上吊了，他还以为你在荡秋千！[呆无辜],4,217,5,2022-08-16 09:23:24,来自河北,17593720291,灋臧辵噵
7132307596094636800,为啥没有刑事责任,1,4,0,2022-08-16 11:17:08,来自广东,2585681888281096,小凡艾可劳伦斯
7132311480581718819,家暴，必须追责，必须零容忍。坚决追责。,1,29,1,2022-08-16 11:32:05,来自黑龙江,4152208190628000,雨水044
7132323835944452904,他说什么都有理，无理也能辩三分！这种男人厉害👍,1,47,1,2022-08-16 12:19:57,来自湖南,3949922311222637,雨柔klp
7132310970160546564,一点也不同情余诗人，可忴余诗人,3,6,0,2022-08-16 11:31:04,来自江西,6746359721,我樂多遊
7132316421145182991,BPD人格障碍,1,5,0,2022-08-16 11:51:22,来自四川,55557366412,三径园丁
7132303583349424937,打人还有理，真是奇葩,0,54,0,2022-08-16 11:01:36,来自广西,624158028071247,菲菲xyd
7132279083677008675,病态的人生，病态的需求，病态的生活,5,288,2,2022-08-16 09:26:31,来自江苏,2735184866454199,灿烂柑桔fg
7132357793943995173,爱！那是呵护，理解，包容，疼惜。爱她，怎么可能将拳头落在她身上！他说自己打人叫行为艺术？谁相信，这里还存在爱情！疯狂打自己，接近扭曲而变态人性。如果在他口中所言，打余是一种行为艺术，那是不是让人可以理解为，杀人，也是一门另类的行为艺术呢！,0,5,0,2022-08-16 14:32:19,来自新疆,74110566418,魅力人生8078
7132304171357094686,林黛玉要是遇到他，活不过半天。,1,38,0,2022-08-16 11:04:13,来自浙江,4694954990,星星之火取暖
7132352484450124559,为什么要采访这样的男人？对社会有正能量的影响吗？,0,25,0,2022-08-16 14:11:17,来自河南,5949184506,花华胡
7132278594058945316,那请问他，怎样才算家暴？看得气死人。[发怒],1,79,1,2022-08-16 09:24:49,来自江西,81280858351,蓝天碧水1970
7132366283626021672,看杨的眼神很那个的，眼睛是心灵的窗口,0,8,0,2022-08-16 15:04:45,来自内蒙古,57249000958,用心创造快乐680
7132283119658763038,他说什么都有理，无理也能辩三分！这种男人厉害👍,1,65,2,2022-08-16 09:42:44,来自河北,70915774090,悠闲悠闲溪流qx
7132278499058123559,现在还爱她？却跟别人在一起？,4,78,1,2022-08-16 09:24:45,来自上海,3500453215079032,否否胖乎乎
7132297562891174668,他俩从开始到结束一句话总结：一个愿打，一个从愿挨到不愿挨。,1,57,1,2022-08-16 10:38:51,来自广东,4191794313320260,秋棠摇曳
7132359598249460510,这男人巧舌如簧能言善辩，一看就不是简单的人，余秀华文字功力虽好，吵架还真吵不过他，前期估计也是被他甜言蜜语的哄得上头了…,0,76,2,2022-08-16 14:39:12,来自上海,1099109249855741,微笑的心99
7132332195557229327,家暴就是家暴，别说是没扯证，两个人在一起哪怕不是夫妻，男女关系，打人就是家暴。,0,51,1,2022-08-16 12:52:20,来自福建,104571895484,蛮可爱滴
7132283668210402048,病态的人生，病态的需求，病态的生活。,1,46,1,2022-08-16 09:44:01,来自湖北,105199040923,凡是归宗
7132327034156122919,这是现实时代的矛盾产物吗？,0,34,0,2022-08-16 12:32:48,,110715907425,蓝调轻吟001
7132292809733833475,和唐山打人事件一样，就应该受到法律制裁,0,30,2,2022-08-16 10:20:23,来自重庆,110938245603,怡然wsh
7132275737918456617,没有歧视残疾人的意思，但是我不相信一个身体健全，心理健康的人会爱上一个残疾人，除非他有所图,13,203,4,2022-08-16 09:13:22,来自山东,3707867423,小兔子乖乖23975207
7132278753644184353,爱在他们嘴里如此轻巧的蹦出来,2,83,1,2022-08-16 09:26:00,来自上海,111066603087,植云柏
7132287477485961984,为什么要采访他？,1,17,1,2022-08-16 09:59:02,来自山东,588936262461806,家有小宝
7132391001536135967,储教授出身可不是接地气的家庭，但是很多观点接地气。这说的没毛病，以暴制暴[偷笑]。娘家有兄弟的，一般都不敢家暴女方。,0,3,0,2022-08-16 16:41:03,来自陕西,52694855533,英喵的絮叨叨
7132414466561966884,两人简直是真人版的人教版教材,1,1,0,2022-08-16 18:12:31,来自陕西,3350963038458040,华美子de明天
7132278660497392422,打人还是被逼的，奇闻，你真优秀[赞],0,38,0,2022-08-16 09:25:49,来自四川,3997453644730915,台湾回归祖国统一
7132482709662106368,和唐山打人事件一样，就应该受到法律制裁！,0,1,0,2022-08-16 22:36:36,来自重庆,721730736760878,春暖花开
7132306395797832483,你能相信爱一个人就是暴打她吗？,0,23,0,2022-08-16 11:12:23,来自甘肃,1645300391092623,乐天派橘子5A
7132366257176904478,这媒体是多么想流量，才会去采访这样的人,0,12,0,2022-08-16 15:05:09,来自浙江,5441618142,草乙石
7132288826302595843,无论如何，打女人就是不对，会下手打她，说明不是爱,7,44,2,2022-08-16 10:04:47,来自四川,70801590590708,清新晚风e
7132359548992127785,俩人是各取所需，一场闹剧。但男人打人这事得教训他，这个我赞同。,0,4,0,2022-08-16 14:39:00,来自江苏,6172135548,行摄者心之兰
7132304880064168743,有时候以暴制暴是必要的，万一打失手，不是也把娘家人害了，有一个弟弟看到姐姐被家暴，拿酒瓶子把姐夫，结果打死了，,0,6,0,2022-08-16 11:07:01,来自北京,3536505180794080,小溪的树洞
7132331652076356389,无感，从个人观点来看，我个人也不是很喜欢余秀华[捂脸]，感觉跟她三观不合，她的作品我也欣赏不来[尬笑],0,24,1,2022-08-16 12:50:52,来自福建,615378244865351,京城子小北
7132392805984879396,余和杨的话都是真真假假假假真真，不知该信谁。俩人很般配倒是真的[灵光一闪],1,2,0,2022-08-16 16:48:21,来自辽宁,63372012429,返影青苔
7132283519891768064,为什么要拜访这种人，,1,15,1,2022-08-16 09:43:44,来自安徽,1622530208565550,乘风破浪的暖阳MZ
7132281084016132905,99%有家暴？只是你这么认为,1,75,1,2022-08-16 09:34:16,来自山东,58931611154,爱的阳光6666AADT
7132486145212613415,怎么感觉这哥们真配不上他前妻呀,0,1,0,2022-08-16 22:50:59,来自河北,88106702777,南山草木香
7132281687841096463,哎……各取所需，无语，这样的男人还叫打人,0,33,0,2022-08-16 09:36:39,来自广东,2405340976259684,祁阳乡下妹子
7132280070202852133,始于才华.忠于现实.,1,34,1,2022-08-16 09:30:52,来自广东,4314110430546312,焦糖Machiato
7132400647550927646,电视连续剧,1,1,0,2022-08-16 17:18:50,来自陕西,3311384857680548,幽兰轩
7132300626482332427,好有道理……不是一家人不算家暴。那算不算袭击？,1,25,0,2022-08-16 10:50:42,来自四川,51789981922,梦觉绿窗花影畔
7132470413363954470,家暴就是家暴，别说是没扯证，两个人在一起哪怕不是夫妻，男女关系，打人就是家暴。,0,3,0,2022-08-16 21:49:27,来自内蒙古,2994717751510621,正义凛然黄二军
7132279433490318083,余秀华，生活不只有诗和远方，还有掐脖子和抽耳光，所有人都知道他不爱你[泣不成声]。,0,23,0,2022-08-16 09:28:27,来自四川,3997453644730915,台湾回归祖国统一
7132293293509116712,家暴的男人就是渣男！,1,9,0,2022-08-16 10:21:30,来自上海,111001722948,乐观的书签mv
7132283160607621921,不管怎么狡辩，打人就是不对，到现在还说爱她。,0,25,0,2022-08-16 09:43:10,来自湖北,2933116308306711,文倩美好岁月
7132353320400159488,唉……看着他俩我就闹心。没什么可说的，一个愿打一个愿挨，谁也没逼迫他俩在一起。各取所需，爱咋咋地，就是求你们别让其他人难受好吗,0,6,0,2022-08-16 14:14:34,来自北京,3289333698412431,静心轩主
7132434077663249156,多么无耻啊的男人啊，他说他们没结婚证，不算是家暴，只是算打人事件，和唐山打人事件一样性质…,0,1,0,2022-08-16 19:28:21,来自湖北,92830718558,宝宝的满格
7132299688870708007,我就想问问，老公打老婆算家暴，像我这种老婆打老公的算什么？,2,2,0,2022-08-16 10:47:06,来自江苏,3683570368,幸福撞心房
7132298492156248845,我就是从小让女儿练哑铃杠铃，防止被男人欺负,9,4,0,2022-08-16 10:42:09,来自河南,729682935284207,残冬冷月
7132380726238102308,打女人就是无论如何是不对的，这不叫爱情,0,2,0,2022-08-16 16:01:10,来自上海,70836198318283,Viotry
7132279575774085922,不是前夫吗？怎么是前男友了？,2,3,0,2022-08-16 09:28:37,来自广西,86947191758,烟和酒的烟酒
7132329770393633576,渴望爱情没有错，但是对渣男还是要有点鉴别能力。出了事，社会的同情解决不了问题，罪还是自己受。,0,6,0,2022-08-16 12:42:53,来自广东,901228758042379,青禾如一
7132419457301201699,事实婚姻在了就是家暴,0,3,0,2022-08-16 18:31:12,来自浙江,87173656858,阿莹137
7132329841940054819,“杨槠策加油！”言犹在耳，忽然传出家暴消息，有点意思，很有意思,1,2,0,2022-08-16 12:43:09,来自浙江,105206516157,港台节度使
7132378237724033833,虽然以暴治暴不合适，但是对待家庭暴力的就该这样收拾。这点支持储教授[呲牙][呲牙][呲牙],0,2,1,2022-08-16 15:51:14,来自陕西,107763453566,王6139
7132344478832083750,世界不疯狂，是你自己够疯狂,0,9,0,2022-08-16 13:40:45,来自山东,9643065696,正turn
7132286059530044193,不管怎么样，打人就是错！就要严惩😡！不结婚为什么要在一起呢？你图她什么呢？,0,26,1,2022-08-16 09:54:13,来自广东,3782766739857728,艳平姐❤️❤️
7132283747122053901,杨说：渣是一门艺术，我是这门艺术界的大师！[吐],0,84,1,2022-08-16 09:44:46,来自陕西,98108816644,秦耕
7132290169344295680,这是家务事，包公都难断,1,6,2,2022-08-16 10:09:35,来自湖北,4002699061495054,豁达的愚翁
7132374587656160014,谈打人满脸的笑。,0,6,0,2022-08-16 15:37:36,来自湖北,5879078870,蓝莓69953859
7132274021710152461,想吃点软的，胃受不了！技巧又不够，还有点小狂，结局是注定的,5,113,0,2022-08-16 09:07:21,来自广东,22569684373,犁田2
7132280319763890978,急得余老师说话都流利了[捂脸],8,24,0,2022-08-16 09:31:19,来自云南,63188131148,云南乐居之眼民宿主
7132289588684800799,不爱可以不家暴，好聚好散！,1,6,1,2022-08-16 10:07:41,来自安徽,6672512117,为非不作歹
7132341974635889445,打人还有理，真是奇葩,0,11,1,2022-08-16 13:30:59,来自湖南,109537229002,潮流达人中卫6l
7132398408605713192,储殷还是见识短，余秀华可不是一般的家庭主妇。,1,4,0,2022-08-16 17:09:25,来自宁夏,63834850293,奇怪而高的山洞
7132496885725643552,没结婚就这样，领证了以后会怎么下狠手……此处省略一万字,0,0,0,2022-08-16 23:32:59,来自陕西,919634577215613,一丝不苟菠萝fi
7132452101539971875,采访这种人是什么媒体，,0,1,0,2022-08-16 20:37:36,来自湖南,3113423709946686,悠闲阳光Fh
7132322424934466336,两个人半斤八两，但是男人打人和诋毁是不对的。,0,5,0,2022-08-16 12:15:14,来自北京,61760331217,琪女王
7132392926646879017,说得好！[赞][赞][赞][给力],0,1,0,2022-08-16 16:48:25,来自重庆,22591946438,风趣饭团Jy
7132281513214870308,说句实在话，这俩人我看不懂。只有一句大千世界无奇不有。,1,9,0,2022-08-16 09:36:19,来自河南,102216684315,善良光束dM
7132311177195619072,我也不知道这两人干了啥，还上热榜了[捂脸],0,25,0,2022-08-16 11:31:06,来自广西,94347718931,青青河里的锦鲤
7132385432389894916,他还不后悔打人[发怒],0,2,0,2022-08-16 16:19:47,来自广东,862471119189111,奋发海浪F
7132415713129693956,看动作表情没有一点真诚的东西，他的出现还不如不出现，又一次伤害了这个女人,0,2,0,2022-08-16 18:17:22,来自内蒙古,6018609514,媛儿爱生活
7132489469760471843,这男人能言善辩巧舌如簧，也不一般,0,0,0,2022-08-16 23:02:59,来自江苏,5849979481,星梦68273141
7132460442370294565,没有足够的惩戒，让施暴者忏悔就是个笑话。,0,1,0,2022-08-16 21:09:54,来自浙江,64151135845,流月去无声189
7132427240864056076,有时候拳头更解气。,0,2,1,2022-08-16 19:02:09,来自北京,101594262680,积极的溪水v
7132347845415502626,他们之间谈爱 玷污了爱情,0,7,0,2022-08-16 13:53:16,来自河南,78532090221,困兽的月亮
7132313297734353704,一对阿怪[耶],0,26,0,2022-08-16 11:39:02,来自陕西,4633099415,然团
7132366023038272268,看来，女方结婚前得练练散打、柔道，特别自己没有兄弟的[碰拳],0,1,0,2022-08-16 15:04:42,来自湖南,76716605600,Rose8888
7132296698814628611,"一个无情无义，
一个虚情假意，
谁也伤不了谁。[大笑][大笑][大笑]",0,7,0,2022-08-16 10:35:42,来自福建,111207691783,yuan910423
7132408410255393547,唉，一言难尽，每一个成年人都得为自己的行为负责，有些事情后悔不来的。,0,0,0,2022-08-16 17:49:09,来自安徽,58786883004,细雨霏霏润紫嫣
7132444511598723878,语言暴力也算是家暴，中国男性承担了太多的语言暴力,0,0,0,2022-08-16 20:08:52,来自湖南,65518788349,兔八哥故事
7132286536309343014,哈哈哈，涨资势，艺术行为[赞][赞][赞],0,11,0,2022-08-16 09:56:18,来自广东,764898781719758,开心的豆豆20212021
7132435246104478476,提问的恰到好处[机智]这男的挺会说话的，还一副我没错的感觉，讲起来道貌岸然[吐],0,2,0,2022-08-16 19:33:09,来自安徽,110627016483,眠眠嗷呜一大口
7132336496539058959,自始至终一场游戏一场闹剧,0,7,1,2022-08-16 13:09:07,来自贵州,81497524271,笨妞73
7132327406269940487,应该拘留他，殴打中年残疾妇女，已经不是道德谴责的范畴了。,0,5,0,2022-08-16 12:34:07,来自北京,82246311930,黑风寨店小二
7132278578644845315,其实都在意料之内，只不过没想到会这么快！,0,12,0,2022-08-16 09:25:07,来自四川,3997453644730915,台湾回归祖国统一
7132461186582446860,暴力只对家庭以外的人使用，一般情况对外比自己弱小的也不要轻易施以暴力。,0,0,0,2022-08-16 21:13:13,来自江苏,102924417765,疾风知劲草aaaa
7132324578264793891,这家暴也是爱，长见识了,0,2,0,2022-08-16 12:22:49,来自浙江,1187937125672799,奇妙白云3t
7132286019625485092,这男的越看越像林生斌类型一个模子刻出来性格一样，,0,18,0,2022-08-16 09:53:47,来自广东,98195511675,梦缘七零后
7132384730695697155,幸亏没结婚,0,1,0,2022-08-16 16:17:28,来自广东,862471119189111,奋发海浪F
7132444744953201411,家暴，必须追责，必须零容忍。坚决追责！,0,2,0,2022-08-16 20:09:50,来自广东,6352020090,往事只能回味85951943
7132279515015217957,病态的人生，病态的需求，病态的生活！,0,20,0,2022-08-16 09:28:45,来自浙江,72655557045,甘露涓涓润
7132420337010066213,你最近没关注打死岳父的吗？那个更残忍,0,1,0,2022-08-16 18:34:29,来自安徽,50620754934,颜侧
7132382666477421344,杨可能觉得自己在教育余，还觉得是在帮她，所以回忆家暴的时候还面带微笑[石化][皱眉][打脸][打脸],0,0,0,2022-08-16 16:09:22,来自湖北,3878676750139691,biliboli巴啦啦能量
7132287868898902791,不爱就分手，何必这样对待一个女人,0,6,0,2022-08-16 10:01:12,来自河南,6981929676,宝珠19
7132327542882829089,他俩从开始到结束一句话总结：一个愿打，一个从愿挨到不愿挨。,0,4,0,2022-08-16 12:34:53,来自陕西,108679081235,所得皆所愿8
7132276059499725568,不管怎么样，打人就不行,0,38,0,2022-08-16 09:14:43,来自云南,651354019201995,那色小嫩
7132304121847579432,摇头晃脑的明眼人一看就晓得了。,0,6,0,2022-08-16 11:03:37,来自湖南,50935034623,31周加二
7132382714078659368,雇人的话性质就变了。余秀华想教育他只能用法律的武器。所以啊，女人面对爱情的时候，一定要冷静。,0,1,0,2022-08-16 16:08:48,来自河北,88707894771,沐沐羊
7132418303859639080,家暴男都说是别人逼的他不得不动手,0,1,0,2022-08-16 18:26:50,来自安徽,10830489036,亚圣后裔家里炖
7132431578059539237,家暴，必须追责，必须零容忍。坚决追责。,0,1,0,2022-08-16 19:18:10,来自上海,6239354006,JIN一休
7132487828336395049,这种人好可怕！披着羊皮的狼[恐惧][恐惧][恐惧],0,0,0,2022-08-16 22:56:44,来自陕西,4641485120,猫咪46197813
7132369245236937510,没一个好的，因果不虚，苍天饶过谁,0,3,0,2022-08-16 15:17:04,来自北京,171154213447198,amybai
7132370643374899981,支持余秀华,0,0,1,2022-08-16 15:22:19,来自云南,69379468973,独巴候
7132427399639302945,99%？这数据从杨他家族亲戚的家庭里算出来的？,0,0,0,2022-08-16 19:02:41,来自辽宁,103846210562,有趣的西柚S6X
7132302493711041321,说得太过了，我就是被女朋友家暴的，之前身上很多抓痕咬印淤痕。[泪奔][泪奔][泪奔]他为自己找借口罢了。。。[捂脸][捂脸][捂脸],0,1,0,2022-08-16 10:57:14,来自广西,72227309661,去年被禁
7132283933739483938,无论有什么理由打人就是不对，无论是打女人还是男人。,0,5,0,2022-08-16 09:45:19,来自浙江,2123862322983966,挚爱糯米饭
7132323404984320805,最新司法解释，关于司法保护令的表述中，有恋爱关系的也算家暴,0,2,0,2022-08-16 12:18:48,来自甘肃,103967324820,涛哥2549868
7132455059392840478,这是一种什么样的感情？反正我不能接受这种年龄差的感情，不管是老夫少妻还是老妻少夫，何况还身体不健康的情况下,0,0,0,2022-08-16 20:49:14,来自湖北,1874000884808542,欢快青山8I
7132282356995883783,病态的人生，病态的需求，病态的生活,0,15,1,2022-08-16 09:39:44,来自浙江,100227575086,自足常乐2007
7132412280629101324,不是一家人 不进一家门,0,0,0,2022-08-16 18:04:11,来自江西,7378295098,只想一二不思八九
7132330652686631711,呵呵，这样的男人真的会有真爱吗？,0,1,0,2022-08-16 12:46:38,来自黑龙江,905605183977720,自信可乐2r2
7132338737475781416,我可能要多读些书了，看到的和听到的都不能确定是不是真实[笑哭],0,4,0,2022-08-16 13:17:46,来自湖北,3843507291165496,开心逗逗
7132385069091881739,秀华:穿过大半个中国来揍我![捂脸]爽歪歪。,0,3,0,2022-08-16 16:18:29,来自山东,108183218422,田原ym
7132278142907646753,这小子想一出是一出,0,27,0,2022-08-16 09:23:42,来自北京,822032868316892,一点半很困
7132281945207227168,相爱相杀，不知道为什么我觉得他们可能真有爱，但两个人的性格都太冲动了，还没有磨合好就夭折了！,0,8,0,2022-08-16 09:38:19,来自北京,95945753385,涟漪9638
7132379036231336718,这个人和林生斌有一比,0,3,0,2022-08-16 15:54:39,来自陕西,100415273126,哈皮皮1
7132400237138019087,这个采访毒啦,0,0,0,2022-08-16 17:16:36,来自山东,3060637754465256,蜗居的方言
7132475375896265487,乖乖，一个多月送两三万的蜂蜜，你是齁死她了呀,0,2,0,2022-08-16 22:07:59,来自江苏,3223389957793827,hshhazjb
7132329285842715433,恋母情节起的作用！,1,2,0,2022-08-16 12:41:03,来自安徽,1346253669800084,滁州隔壁老王0537
