7132101488683270948,看看大连一周的天气[呲牙]晚上睡觉得盖上小被子才行,5,8,0,2022-08-15 21:57:18,,4652261601,Coco一束米兰
7132088183080502057,大雨来湖北吧，太热了,1,18,0,2022-08-15 21:05:30,来自湖北,3598046221839736,K歌快乐
7131930959066776335,预计一般都不会下。今年所有的降温，降雨预报都不准，所有高温预报都准了。,17,224,8,2022-08-15 10:55:34,来自陕西,1398169338128792,臭美大妈日记
7131927227549123367,以前夏天都有台风的，今年夏天咋一个台风没有呢？都跑哪里去了台风[捂脸][捂脸],26,112,3,2022-08-15 10:41:40,来自江苏,756089577539804,聪颖雪儿
7132087095980213033,给江西抚州来一场大雨吧，太热了,1,9,0,2022-08-15 21:01:23,来自江西,764858622031192,广西妹远嫁的姑娘
7132084275914048297,感谢天，感谢地，感谢暴雨，滋润着大地。自从有了雨世界变得好美丽[泪奔],2,12,1,2022-08-15 20:50:12,来自福建,184322436368939,瞧瞧侃侃
7132007383773610760,给我们四川来点雨吧，简直太热了,6,57,4,2022-08-15 15:52:45,来自四川,111096501748,zz5689
7132036609461043983,大范围降雨完美的避开了高温预警地区,3,39,0,2022-08-15 17:45:28,来自四川,3134539126,阿尔法aerfa
7132085622226895627,现在的天气预报越来越不准,1,3,1,2022-08-15 20:56:01,来自浙江,575751540450324,元气海洋El
7132089418659709710,我儿子说“数伏”天为什么不舒服呢？😂,2,4,1,2022-08-15 21:10:41,来自河北,589799654956109,布丁
7131935883611308807,今年夏天别说下雨，就是雷声都没听到过，怀念往年夏天雨声哗哗雷声阵阵！,5,36,3,2022-08-15 11:15:09,来自四川,52845681462,夏荷露出尖尖角
7131649294456914703,看了半天西安还是热沒有点雨[捂脸],1,13,0,2022-08-14 16:42:28,来自陕西,553799972293928,勇敢的天空E3
7132000208241967886,江苏完美避开,2,4,0,2022-08-15 15:24:41,来自江苏,5571221916,梦幻微风g
7131943337052996366,终于看到地图上有绿色了，静待降温。[赞][赞][赞],2,13,4,2022-08-15 11:43:50,来自江苏,1359442947868365,潘春蕾
7132030792838103843,陕西汉中来场暴雨吧，40多度了。,0,22,0,2022-08-15 17:22:51,来自陕西,52099105119,千鲤锦
7131939025761567524,建议气象台多建一些水池多养些青蛙之类的动物如叫就不会下雨反之雨必下或多收藏些盐菜干如滴水必下雨比你预报准,1,4,0,2022-08-15 11:27:10,来自江苏,347043023039748,胡心雁
7131922019486532389,气象台：好歹你也猜准一回，别老猜错。,4,120,3,2022-08-15 10:21:23,来自河南,8361046180,灯火阑珊1302528
7131926224414212875,没入夏的时候，有人说今年冷夏。结果比哪一年都热！,6,19,0,2022-08-15 10:37:44,来自辽宁,55361828330,崇山峻岭022168
7132224776415986435,今年夏季的温度高，持续时间长，再不降温，空调室里待的要生病了……[可怜],0,0,0,2022-08-16 05:58:19,来自江苏,404248733158196,熊猫鱼儿
7132018058860233508,重庆人民发来贺电：高温天气遭不住了,3,8,1,2022-08-15 16:34:13,来自重庆,82492911200,重庆号巡洋舰
7132209420135170848,太好了，下雨对高温天气有缓解,0,0,0,2022-08-16 05:02:02,来自湖北,1116709650432599,智勇双全溪水Wh
7131966569689334566,近来，天气预报，高温很准，下雨太不准确。这次雨带南移江淮黄淮，祈祷🙏🏻这次预报准确，解解心中的焦灼。天天高温橙色预警，看着不爽。不出门闷的慌，出门晒成非洲人。好歹下点吧，谢天谢地！,1,14,3,2022-08-15 13:14:47,来自江苏,81872947175,信马无疆亚克西
7132136080803169039,四大火炉，武汉，南京，重庆，还有个谁,2,0,0,2022-08-16 00:12:25,来自山东,6216902417,明仔6666
7131912600027841314,还是等到下了雨再说吧。雨云一片黑，一阵风又不知道刮哪里去了。,0,57,0,2022-08-15 09:44:26,来自山东,14458048368,雪花冬天1
7132004533886436136,高温区域都集中在城市群。说明什么,2,2,1,2022-08-15 15:41:14,来自江苏,70353221509,朴实橘子o
7131914714556793613,报不准就不用报了，手机上报天天有雷阵雨，本来要担水浇花，一听有雨就等下雨吧，等了十几天也没下一滴水，可怜的花木盆栽只能当柴火烧了，几年的心血白花了！,9,40,2,2022-08-15 09:53:15,来自江苏,107951759327,門外漢123
7132231178211984158,雨都下山东了，胶东地区今年几乎天天下雨，高温天气也有十天左右，下了雨也不凉快，发闷，但是早晚还不错,0,0,0,2022-08-16 06:22:25,来自北京,106680710595,雾里看花817210
7132084679762674472,大范围降雨完美的避开了高温预警地区,0,6,1,2022-08-15 20:51:47,来自河南,3324537467059143,道甲5Y8p
7131942154305553164,我浙江仍在眼巴巴望着雨水的到来[汗],1,8,0,2022-08-15 11:39:42,来自浙江,97689679546,一往无前山雀XD
7132278644936377101,支持友友[玫瑰][赞],1,0,0,2022-08-16 09:25:30,来自北京,110446030051,烯萌的梦想天堂
7131954955568907016,外面阳光这么毒辣，现在又是38度高温，可手机里天气预报显示，明天中雨，最高温度29度，这在10天前就这样预报的，现在已经是下午了，怎么没有一点下雨的迹象啊，看样子，天气预报又不准啦，另外，希望越大，失望也越大。,1,12,5,2022-08-15 12:29:00,来自江苏,53213540796,hgd101101
7132114798573355810,高温干旱，空气污染。只有下雨，才能降温，下雨就可清新空气。全球气温变暖，这也是全球民众的灾难。。。,0,6,0,2022-08-15 22:49:01,来自广东,51714587092,梁山好汉135447885
7131930582623453988,已经破历史高温纪录啦！别再说冷秋啦！,1,12,1,2022-08-15 10:54:29,来自河南,1226684878557947,乐观的天空W
7132097272078189315,哈哈，这种天气来玩爽歪歪,0,1,0,2022-08-15 21:41:10,来自海南,739308962063357,独家一号
7132299598165164808,"安徽持续高温……[衰][衰]
热的头晕",0,0,0,2022-08-16 10:46:30,来自安徽,102891173062,可爱的天竺葵
7132024692558611237,只想知道高温何时休？干旱何时解？,1,6,1,2022-08-15 16:59:44,来自安徽,3988632949503700,乐观的红星
7131924095033361166,徐州市气象台今天预报有雨，不知道能不能下。,2,12,2,2022-08-15 10:29:15,来自江苏,422692431864541,自在微风49
7131944361507947300,三伏天里多雨水，入秋时节盖棉被。实际上只不过是囗头谗，天气的变化，无规无律，自然形成，谁也左右不了。,0,2,0,2022-08-15 11:47:54,来自河南,3210188379391191,阳光日月
7131962483044746021,都已经立秋了，天还是这么热，这个月结束不知道会不会凉快点。,0,1,0,2022-08-15 12:58:21,来自江苏,5211641646,端宁1
7131930149909725990,天气预报不靠谱,1,21,1,2022-08-15 10:53:09,来自安徽,111089171477,磨磨叽叽的兔子
7131911752534459176,老天爷，我们滁州热死人了，快下雨吧！，，,6,21,1,2022-08-15 09:41:00,来自安徽,51485511422,笑看人生197675076
7131634798976320270,今天七月十七，我这太阳大好，争晴天，怎么讲,0,3,3,2022-08-14 15:47:01,来自山东,104959343780,无拘无束的幸福一生
7132079810096136994,一场秋雨一场寒，下点雨凉快凉快一些吧。确实太热了,0,2,0,2022-08-15 20:32:56,来自河南,6991670005,你好阳光581226
7131935044775707433,东海龙王 南海龙王都生气了 不行请孙大圣出面协调降雨 那些地方做的不对及时补上[呲牙],2,7,1,2022-08-15 11:11:16,来自安徽,470182397479805,知情达理百香果vU
7132236381614850820,看着天气预报说要下雨进来了，一看降雨范围完美的避开了超级热的杭州[流泪][流泪][流泪],0,0,0,2022-08-16 06:42:44,来自浙江,857255120478062,聪明的菠萝Kp
7132011934211736352,这雨都跑到华北，东北去了,0,2,0,2022-08-15 16:10:48,来自上海,1209105759866759,清新船帆t6
7131929145202115358,高温干旱地域，若天有云，应多试人工增雨，以缓燃眉之急[可怜],2,9,2,2022-08-15 10:48:58,来自安徽,102946870878,皖东小调
7132013288065975076,老天爷给大地来了一段时间的热烈拥抱，这个太热情似火的拥抱让大家都喊受不了啦，搞得大家都哪里凉快就想到哪里去呆着，退退火🔥。,0,4,2,2022-08-15 16:15:39,来自重庆,110254406307,苹果红笑脸
7132024334637679394,陕南下暴雨吧，太热了,0,5,0,2022-08-15 16:57:54,来自陕西,52585285589,爱生活的饭团P
7132082897208722213,南方太热啥时候下雨降温,0,3,0,2022-08-15 20:45:12,来自福建,106538690197,请回答1984年
7132065722406093609,我省是哪个省？,1,3,1,2022-08-15 19:38:13,来自湖北,185194511606056,优雅原野5Z
7132019625244099362,别预报了，找农谚问去,1,8,2,2022-08-15 16:39:44,来自山东,6177057011,一丝不苟星空F8
7132046094783087392,立秋晚上热死牛，今天又冷秋。,0,1,0,2022-08-15 18:23:02,来自河南,55131479915,星火燎原8683008
7131938293381858061,"立秋不知秋，
冰山泛小舟，
烈日空中悬，
四海热浪流，
稻田禾枯焦，
何人有忧愁？",0,11,0,2022-08-15 11:24:28,来自上海,483402560579127,外向星球xV
7132008956653798144,等待老天爷降温[呲牙][微笑][祈祷][祈祷][祈祷][祈祷][祈祷][玫瑰],0,1,0,2022-08-15 15:58:11,来自安徽,1381432527166267,幽默可乐04
7132284598830154509,北京昨天35℃可晚上可凉快了，以后没有太热的天了，从立秋开始特别凉爽,0,0,0,2022-08-16 09:48:16,来自北京,98629258923,更改用户各张明芝
7132098147282666280,"人生，总会有坎坷，不可避免；生活，总会有波折，无法逃避；我们能做的就是砥砺前行，逆风而上。世上有两种人值得我们去珍惜，不富 却愿意为你倾其所有的人
很忙 却愿意为你有空的人。  
忆当年，我一袭青衣至客舟，你犹抱琵琶半遮面。初次相见，没有俗套的礼数，亦没有过多的寒暄，眼眸尽处，是深深的相知，是静默的疼惜。同是天涯沦落人，不相识却相逢，如此，你知我，我懂你，懂你的命途多舛，懂你的心事无限……
“光是抓不住的，雾也总会散的，人也总要学着和自己握不住的东西说再见的”最遗憾的大概是，经营了这么久的感情，最后分手连面都没见一面，隔着屏幕就结束了所有",0,2,0,2022-08-15 21:44:05,来自湖南,101238755947,谭方宜
7131964656809591567,好怀念夏天下大暴雨，打雷的日子。。,0,5,1,2022-08-15 13:06:15,来自安徽,2890087125,兔子笔芯兔子
7132105811799163684,陕西地区也热的受不了了[抠鼻],0,5,0,2022-08-15 22:14:35,来自陕西,56422733306,磨人小妖精Go
7131641175483941662,一小时前刚下了场暴雨，现在太阳🌞火辣辣的，怎说,1,8,4,2022-08-14 16:11:28,来自江苏,15324598453,爱你千百回666
7131999526185567013,我们这山东南部，只打了n个响雷，一滴雨沒下,4,0,0,2022-08-15 15:22:19,来自山东,76494456273,山东省枣庄老字号外贸
7132037082129646374,这是这几天看到最好的消息啦[呲牙][呲牙][呲牙],0,0,0,2022-08-15 17:48:00,来自安徽,102929382641,热情的海浪PL
7132050718407787294,坐标昆明，每天到点下班就暴雨，还有带着冰雹,0,0,1,2022-08-15 18:40:42,来自云南,52061596153,活泼水滴0
7131989975633068840,南京40°，体感温度43，不知道准不准,1,0,1,2022-08-15 14:44:40,来自江苏,54632551719,陈0405
7131961421478478633,这个时候天气预报的绿色比健康绿码还要让人激动,0,2,0,2022-08-15 12:53:45,来自江苏,927600757187428,江苏我乐装饰大燕子
7132029358764081950,今年夏天不平凡，老农伯伯热的喘；立秋已过一礼拜，天空亦然无云彩,0,2,0,2022-08-15 17:18:13,来自湖北,109014658425,海涛1981
7131934031780135687,气象台…天气预报，不是天气准报,0,8,2,2022-08-15 11:07:59,来自安徽,52283647340,萌萌20140309
7131995507983516430,黄河涨水长江下降，北方暴雨南方干热,0,4,0,2022-08-15 15:06:32,来自湖北,3580422819166328,温柔豆浆TC
7132019261857841931,雨来南方吧？太热了!台风一个也没来,0,8,0,2022-08-15 16:38:58,来自浙江,2766788327390683,想赚钱好难
7132000393299051279,雨难下：天气预报准确率低，6小时以内，。期望中央气象台发布准确！,0,1,0,2022-08-15 15:25:06,来自安徽,52219425709,大气小羊uX
7131980067169321769,驻马店天天报的阴天，结果是段云睛天，晒死人预报不准了,0,1,0,2022-08-15 14:06:18,来自河南,105937391852,清爽雪碧ou
7131969945935774504,今年这天气热的真太反常了。梅雨季都没有,0,2,0,2022-08-15 13:26:48,来自江苏,51245743330,明德正己
7131999417325978383,昨天说大雨要降温，今天说暂缓。路上拥堵吗？,0,1,0,2022-08-15 15:21:08,来自河南,61773000868,豫海隆
7132115317588919051,湖北是热在三伏，冷在三久，这样湖北还有大概10天高温,0,1,0,2022-08-15 22:51:41,来自湖北,96143842687,枫林晚738
7132116078130086692,必须要对大自然有敬畏之心。人类在自然界面前是很渺小的。尽早防范灾害的发生。,0,0,0,2022-08-15 22:54:39,来自新疆,106712993042,曬途
7131943531857445646,现在连小鬼们都不信天气预报了吧[尬笑],0,3,0,2022-08-15 11:44:43,来自湖北,59113128012,战地54672
7131928165022548739,我们湖南根本不要煮饭，大米加点水放到太阳底下晒几分钟就熟了。还冷秋,1,9,3,2022-08-15 10:45:29,来自广东,103335151356,用户老刘就是老实
7131960275729318671,我们的天气预报是转发外国的,0,0,0,2022-08-15 12:49:17,来自河南,4146951101354419,豫乡豫农鸽舍
7131999318063711009,天气已经热好长时间了，等待天气转凉,0,0,0,2022-08-15 15:21:46,来自安徽,94164934234,悠闲可乐Vl
7131946283585356556,预警能解决问题吗？,0,0,0,2022-08-15 11:55:37,来自江西,2563677010276510,豁达青山DK
7132072964321461007,浙江这👻👻天气[捂脸][捂脸][捂脸]热化了,0,1,0,2022-08-15 20:06:38,来自浙江,54870701158,美丽中国145173666
7132227283657982751,让暴风雨来的更猛烈些吧！,0,0,0,2022-08-16 06:06:53,来自河北,2924347689280828,马哥劝学
7131924796115534629,现在这天气预报名字该改了，天气迟报比较合适！,0,20,1,2022-08-15 10:32:17,来自河南,6311601043,所想即到
7132112571565900559,哪里都有唯独不见浙江,0,0,0,2022-08-15 22:40:23,来自浙江,93220863404,Q好名字
7132112156233384742,上海人民盼大雨，连续的高温烤得不敢出家门，不知啥时候可降温了,0,0,0,2022-08-15 22:39:34,来自上海,108764236948,单纯雪梨id
7132008925842916135,天意弄人，人定难胜天，地震难测定，预报气象难上难。,0,0,0,2022-08-15 15:59:00,来自四川,66660194968,舍得贤人
7132102153858515745,明天会下雨吗？,0,0,0,2022-08-15 22:00:25,来自江苏,3386972091461319,静呼吸
7132187930822689568,看了一下统计，是，青岛这里的降雨量是去年的降雨量两倍[抠鼻]这才8月份……,0,1,0,2022-08-16 03:44:09,来自山东,104918343309,一朵一往无前的云
7132099437178520360,鲁南大旱，高温。八月十五号雷声大，雨点小。,0,1,0,2022-08-15 21:49:13,来自山东,786839058267319,开朗晚风kf
7131924494272774950,老天爷越来越狡猾…,1,10,1,2022-08-15 10:31:24,来自安徽,1508153825964664,直率船帆cx
7132118239593218850,"明天就下雨了
太好了",0,0,0,2022-08-15 23:02:38,来自安徽,5565519054,合肥80后小彩
7131942451002721063,地震难测，天气更难准确测定。,0,2,0,2022-08-15 11:41:07,来自上海,62452077350,积极的糯米Uu
7132114985173926671,大范围降雨完美的避开了高温预警地区,0,5,1,2022-08-15 22:49:44,来自山东,1943534926051693,老虎4433179484938
7131984376988320545,我在济南已经快热死了，不知道红色地区的人们还好吗？,2,1,1,2022-08-15 14:23:57,来自山东,5959196271,AlexJones
7132088130647851810,下点雨吧，天天40度高温真难熬,0,0,0,2022-08-15 21:05:22,来自安徽,4037820376419933,玲玲
7131922747831649056,爱看天气预报，尽管知道准确率不高。,0,7,0,2022-08-15 10:24:32,来自河南,18372278350,冯玉兴1
7131946579699254023,天气预报不如不报，,0,3,0,2022-08-15 11:56:32,来自山东,55951639466,欢快山丘Z
7131935175134839590,对今年江浙沪等地区高温农谚咋说的？,0,0,0,2022-08-15 11:12:36,来自浙江,822040623843732,自若苹果hx
7132217989499372329,全国高温地方希望暴风雨来的再猛烈些吧。希望天遂人愿。,0,1,0,2022-08-16 05:30:49,来自黑龙江,61226534563,轻聊今天
7131968153320063785,坐标四川东北部，龙王已在路上，给四川东北部下一场大雨,0,2,1,2022-08-15 13:19:59,来自四川,50793242775,274546927
7131923062563717919,高温天气照顾西安，还要连续多天！[可爱][可爱][可爱],0,1,0,2022-08-15 10:25:19,来自陕西,2480955742501999,安逸豆花px
7132112243096945443,我们这边经常下雨，这几天还是大暴雨,0,2,0,2022-08-15 22:39:01,来自广东,58501916381,桂妹256452824
7132003921270276879,我不管，我们河南一定要拥有一场雨🌧️，快热死了,0,2,0,2022-08-15 15:38:36,来自河南,2907529065024430,戒碳水是不可能的事儿
7132099703734633216,天气好热，什么时候下雨,0,0,0,2022-08-15 21:50:13,来自广东,3654419475338718,晓梦H
7132034564092134144,重庆会下暴雨吗？,0,0,0,2022-08-15 17:37:31,来自重庆,109966719008,潇洒精灵CE
7132104042846896931,太好了，下雨对高温天气有缓解,0,0,0,2022-08-15 22:06:58,来自陕西,888054473845998,董少静2012
7132047945113223944,看高温区域南下，河北区域终于晴天啦。,0,0,0,2022-08-15 18:29:58,来自河北,1191489692770126,乐天派山丘Yg
7132083660467225377,，今天8月15日再熬IO天大局已定!坚持到25日，濡热等來年吧！胜利在望了！,0,2,0,2022-08-15 20:48:32,来自北京,2093931981970343,jessy
7131953582076724003,希望降雨降温。,0,0,0,2022-08-15 12:23:07,来自浙江,110162614775,漫煮人生
7131659051414848297,江苏今年真难，前面疫情现在高温，经济影响挺大的。,0,1,0,2022-08-14 17:20:30,来自江苏,9233030563,中国人23288
7131985437392044835,老天不下雨，玉米正抽穗高温杀雄看秃玉米很多，明显减少产量。请老天帮忙。,0,0,0,2022-08-15 14:26:57,来自摩洛哥,3175864399834255,番茄3175864399834255
7131671170864825129,漯河赶紧下大雨吧,0,1,0,2022-08-14 18:07:36,来自河南,220321209915547,博学多才的郭玉玺
7132216729874416391,凉快点，总比热死人强。秋天来了就好了。,0,1,0,2022-08-16 05:27:11,来自辽宁,61391865144,崔全营
7132001033387115272,你说怪不，今年暴雨下到东北干旱区域和新疆沙漠里去了，那边后面变江南了,0,0,0,2022-08-15 15:27:55,来自四川,22887613834,正能量漂流瓶e0
7132102866332386061,这里今年雨水多，立秋后，大大小小已经下了六场雨，十场秋雨要穿棉，快了[呲牙],0,2,0,2022-08-15 22:03:04,来自北京,3399340896816695,执着的荷叶rc
7132004341544092431,多谢老天爷，多谢南宁邕江老龙王。这个时候我们广西天气还可以，不干不燥不热，因为前阵子下了几场雨☔️！,0,2,0,2022-08-15 15:40:21,来自广西,1415824743610560,歼二拾
7131925785409291045,高温区和降雨区重叠部分是要下开水吗？,1,4,2,2022-08-15 10:35:44,来自河南,6757262681,交叉跑位
7132048980011877161,湖南没有降雨[流泪][流泪][流泪],0,1,1,2022-08-15 18:33:37,来自湖南,89331821671,静静地看着周围
7131920306092655374,气象台要还有存在的可能，就说说昨天和前天的天气情况。,0,18,1,2022-08-15 10:14:54,来自江苏,93695123105,直爽扑克0k
7132123547623162665,天气环境太恶劣了,0,1,1,2022-08-15 23:23:17,来自湖南,54076216137,狐山诗行
7132088527936226084,贵州南部急需大雨,0,2,0,2022-08-15 21:07:10,来自贵州,1908401677013335,朴实橙子yM
7131912083045647104,下大雨是不是预示着天要变凉爽一点了[祈祷],0,3,1,2022-08-15 09:42:14,来自江苏,3601420713,真诚艺术家Ue
7131944296273937193,安徽农田大面积干旱，水稻苗🌾严重缺水。,0,1,0,2022-08-15 11:47:20,来自安徽,76567899186,alyx249407354
7131935862669689633,冷秋？？？你去江浙沪了没有？你来重庆了没有？？[呲牙][呲牙][呲牙][呲牙],0,3,1,2022-08-15 11:15:30,来自重庆,96935147058,小妖7809
7131962823198245667,气象部门值得表扬,0,1,0,2022-08-15 12:59:06,来自江苏,97277759572,江苏pan
7132143567099216681,浙江天天高温，雨都不敢下，台风不敢来，冷空气都不好使,0,0,0,2022-08-16 00:42:18,来自浙江,85776270492,我有医保vip我先上
7132135946434921246,我是进来看看湖南有没有在里面的[泪奔],0,0,0,2022-08-16 00:13:27,来自湖南,8946612447,这辈子3166
7131938448625632012,40多度高温持续长久已成特旱，你来个冷秋，不遭口淘吗？,0,1,0,2022-08-15 11:25:27,来自四川,6258589169,小青莲仙
7131923344512910115,天气预报，天天闹着玩呢,0,16,1,2022-08-15 10:25:54,来自安徽,108692129130,握手言和722
7131999202489860899,今年天气预报就没准过，苏州已经好久没下雨了，往年的现在暴雨台风，今年一个没有,0,2,1,2022-08-15 15:20:36,来自江苏,93338047598,正义凛然花猫ry
7132161975370695431,降雨降温，希望不要有损失！,0,0,0,2022-08-16 01:57:30,来自湖北,86187300091,王勇男
7132003276803474217,高温是一种现象，雷雨是一种祈求。,0,0,0,2022-08-15 15:36:19,来自湖北,10868867980,手机用户名老牛
7132098460630647567,请问32度可以称之为最冷吗？记者文字功底不能这么差吧，最低温度不行吗？,0,1,0,2022-08-15 21:45:19,来自湖南,95837424493,视野橙子2n4
7131925271796138756,今年巢湖市热的早，时间长，气温高！,0,0,0,2022-08-15 10:34:31,来自安徽,2176627554395319,执着的阳光nr
7132046632182793000,非常遗憾 从来不相信天气预报,0,4,1,2022-08-15 18:24:27,来自湖北,3035097635755719,奇妙小猫ql
7132092203836441380,哪里会下雨，一直的高温天气,0,0,0,2022-08-15 21:21:14,来自湖南,61074416465,Wolf175332905
7131993565563011873,"河南整天桑拿天[流泪][流泪][流泪]
要么一直不下热死[流泪][流泪][流泪]
要么一直下个不停淹了[流泪][流泪][流泪]",0,4,0,2022-08-15 14:59:08,来自河南,9737530691,是恐龙小姐姐哈
7131934195177440015,雨走到半路被劫了，人工降雨不讲武德。天气预报被整得一点不准了。[捂脸],0,4,0,2022-08-15 11:08:05,来自安徽,2502131032787917,wei你娘喊你回去吃饭
7132096276358955817,天气预报准确率能达到多少？别今天不下明天下，害死农民了。,0,0,0,2022-08-15 21:36:48,来自安徽,104721744104,奋发画板VL
7132078381332120350,我非常相信天气预报。,0,1,0,2022-08-15 20:38:25,,3186917224,碧海8215539
7132254923177689863,苏州今年梅雨季几乎没下雨，我这几天都中暑了，这个夏天怎么了，老天到底在惩罚谁？我不是什么好人，但也不是混蛋。,0,0,0,2022-08-16 07:53:29,来自江苏,1217903475831067,905355226
7132073633354777377,我只关心这次强降雨有没得重庆，没得就算了反正我也快热死了[流泪],0,0,1,2022-08-15 20:09:52,来自重庆,3807905156,优雅的路灯花
7132234457767609099,跪求西安暴雨,0,0,0,2022-08-16 06:35:36,来自陕西,100111230346,屈虎生
7131926419794002721,天气乱报吧，没准过一天,0,2,0,2022-08-15 10:39:00,,52995975835,亦无亦幻
7132036418016871172,没看见有大范围降雨,0,0,0,2022-08-15 17:45:36,来自湖南,86403187861,奋斗者自强
7132085149583950622,科技是越来越进步，天气预报却越来越不准了,0,1,0,2022-08-15 20:54:09,来自浙江,3350944499373565,西瓜丶大大
7131997906605064968,以前这些地方都是发洪水的地方，今年高温,0,0,0,2022-08-15 15:15:50,来自宁夏,4243733996372600,刘彬彬彬彬彬彬彬彬
7132004852217299720,快40度了出去要中暑啊,0,2,0,2022-08-15 15:42:47,来自河南,1336626153267527,热心梦想家ol
7132129596522169119,深圳好热，快点下雨凉快凉快,0,0,0,2022-08-15 23:47:40,来自广东,103378096486,优雅艺术家aw
7132018251105567496,今天报昨天的天气挺准，其它的不准,0,0,0,2022-08-15 16:34:30,来自安徽,4515601481,推销员老甘
7132125859951182631,让暴风雨来得更猛烈些吧！今年台风这么少呢,0,0,0,2022-08-15 23:33:02,来自辽宁,99892463948,三脚笨虎
7132103638998385441,江西这几天都好热呀,0,1,0,2022-08-15 22:06:07,来自江西,83758197972,行走的向日葵358
7132143526472860420,能不能北水南调啊！快热死了,0,0,0,2022-08-16 00:43:54,来自江西,3905054061899134,灵界记闻
7132001284170384168,发觉今年的天气预报基本上没准过！,0,0,0,2022-08-15 15:28:27,来自四川,5800351839,宁静致远65592543
7131976343457891080,昨天下午我处有7o岁老妇去井边打水，中暑晕在井边上，老伴去拉也中暑昏在水井边，两老人活活烫死了，真可怜,0,1,2,2022-08-15 13:52:31,来自江苏,92878603197,洒脱光束VH
7132048137375515392,现在只有气象部门对天气变化预测不准，不会被追责。要是其他事业单位的工作人员，工作上出现差错，一定会被严格罪责的。,0,0,0,2022-08-15 18:30:06,来自安徽,6926933015,巴黎春晓
7132071986615960332,感觉现在的天气预报那是相当的不准！！！,0,0,0,2022-08-15 20:02:01,来自安徽,5576952211,雪回针兮
7132117889477919500,我不喜欢下雨,0,0,0,2022-08-15 23:02:11,来自广东,3900688831885067,青清之河
7132115893596799782,我就是进来看看武汉有没有在里面。,0,1,0,2022-08-15 22:53:59,来自湖北,3056048927,U-222
