7126105703768916749,特斯拉没有自动驾驶对吧？最开始叫完全自动驾驶包，后来质疑造假又变成辅助驾驶,0,0,0,2022-07-30 18:11:07,来自重庆,6302498286,狼牙84796857
7126425526323118888,自己坐后排。不喝酒人帮助起动就可以回家了。到家小孩帮助息火。,0,1,0,2022-07-31 14:51:42,来自湖北,59010577076,白云3932
7126029092687741729,你说算吧 他没在驾驶位置上 也没有开车 你说不算吧 又是他启动车辆的 罚款算车主的 扣分算自动驾驶系统的 要么就找特斯拉,0,1,0,2022-07-30 13:13:52,来自浙江,1425386628717915,聪明的冰淇淋GNM
7126165679220245260,代驾岂不是白跑一趟了？,0,1,0,2022-07-30 22:03:45,来自山东,2146706353583211,耗子T
7126078245056807710,自动驾驶的汽车在路上启用都是杀手！！,0,0,0,2022-07-30 16:24:26,来自广东,10643010096,汕头老黄
7126361607231554307,不管他是坐副驾驶还是骑在车顶上，现行交规都禁止双手脱盘操作，所以基本不用考虑能躲过处罚,0,0,0,2022-07-31 10:43:13,来自重庆,3070993603,汽车浏
7126476750753907490,100%属于酒驾（醉驾），设置自动驾驶时就处在酒醉状态，谁能保证他设置没有错误？并且这车只具备L2级别的辅助驾驶功能。,0,0,0,2022-07-31 18:10:36,来自甘肃,3851654421,玝襾
7126476985878643493,不是真正的自动驾驶，肯定判醉驾！,0,0,0,2022-07-31 18:12:03,来自广东,7001122627,世间都是浮云
7126417083495121703,建议取消自动驾驶功能，突发情况根本处理不了，如果有小孩横路怎么办？,0,6,0,2022-07-31 14:19:27,来自湖南,91843137999,壹站到底
7126018806874850078,说明特斯拉自动驾驶技术不行,7,33,2,2022-07-30 12:33:40,来自贵州,101946658586,顶级星空NR
7126507695204631311,我们的交通法应该顺应时代潮流，针对新出现的自动辅助驾驶情况进行明确立法,0,0,0,2022-07-31 20:10:17,来自浙江,96400127037600,三月风9882540802051
7126305172011500320,特斯拉回应：车主说法不实！,0,0,0,2022-07-31 07:05:58,来自重庆,4420508002030452,优雅暖阳5l
7126371163085407006,这车主不以酒驾论处？？？,0,0,0,2022-07-31 11:21:09,来自湖北,748086097900638,小y
7126447851848303367,完了 保险不保 自掏腰包 还要吊销驾照 和拘留,0,0,0,2022-07-31 16:18:44,来自山东,16326180905,执着的露珠DY
7126107494044615435,TSL的单踏板模式，遇突发紧急情况，十有八九会出事故，老司机也避免不了，说没事的，是还没遇到过紧急情况的！,0,0,0,2022-07-30 18:18:26,来自广东,6937896692,唐子翔1
7126064672994050850,酒驾 不认 归到车子的问题,0,7,1,2022-07-30 15:31:25,来自江苏,4178617045625751,Mandy
7126445425259119372,喝酒设置自动驾驶设备上路也是酒驾。,0,0,0,2022-07-31 16:09:53,来自天津,5994449541,风风雨雨坎坷路
7126423811805430543,特斯拉是在转移注意力，酒驾是真的跑不了了。,0,0,0,2022-07-31 14:45:12,来自河北,3910279149916359,刘克如
7126490536357561100,搞不懂，为什么还有人开特斯拉，真的不爱惜生命吗？,0,0,0,2022-07-31 19:04:46,来自河南,62895875990,割鹿刀1981
7126450887123747620,酒驾危害不大，那些加塞、乱按喇叭、半夜开跑车扰民的才可恶,0,0,0,2022-07-31 16:30:32,来自广东,6371479921,顽强豆花ql
7126090987613209357,司机说谎，想逃避酒驾责任追责,0,0,0,2022-07-30 17:14:12,来自江苏,4494412666377373,坦荡的小红花pX
7126452917997306665,车主这回事儿了，真是不懂自动驾驶的运行规则。不坐在主驾驶的位置上是不可能开始自动驾驶的,0,0,0,2022-07-31 16:38:06,来自黑龙江,71194501854,心灵囚牢
7126447548671460137,哇塞这世上还真有这么不要命的人？居然敢把生命交给垃圾的自动驾驶太有勇气了！[捂脸][捂脸][捂脸],0,0,0,2022-07-31 16:17:04,来自湖南,51590311055,天涯初胖
7126476789681046302,乚2的自动驾驶确实难以置信，上次我在高速上，由于过于相信。所以就开着ACC就睡着了，随着“一声巨响，吓醒过来，”靠边停下，发现是左边碰上护拦，唉：还是不靠谱呀！,0,0,0,2022-07-31 18:11:04,来自浙江,66552965460,汇海漂澪
7126401220482351876,自动驾驶算不算危害公共安全,0,0,0,2022-07-31 13:17:52,来自重庆,2964725235,Hhu朝花夕拾
7126083829533541157,车主说特斯拉官方真不厚道[流泪],0,0,0,2022-07-30 16:45:57,来自湖北,75787380237,老唐48765
7126444765763076875,罪名更大，叫危害社会公共安全罪！[发怒][发怒][发怒],0,0,0,2022-07-31 16:07:01,来自广东,4275547544,生活Wu平凡
7126445962863608612,应该是要算酒驾的，不管车的自动驾驶级别有多高，车是你启动和设置的吧，主观意识还是驾车回去。,0,0,0,2022-07-31 16:11:15,来自广东,55152557275,无双飞扬
7126190247570440995,又是新能源车，怎么天天有，到底质量有没有问题？,0,0,0,2022-07-30 23:39:10,来自浙江,1355019992438631,方老师F
7126430895514501918,谁启动的？谁设置的路线？还是车主你么，只要人车交互了，那不是酒驾是什么。,0,1,0,2022-07-31 15:12:48,来自甘肃,52347568259,专属区123
7126465828450599715,酒后驾驶，只要你喝了酒，就不能驾驶机动车，不管坐到哪里！,0,0,0,2022-07-31 17:27:56,来自河北,105886062323,正能亮从我做起
7126431092915471111,这车自动驾驶害死人,0,1,0,2022-07-31 15:13:39,来自黑龙江,98001115651,用户中方祥军
7126377368456921871,想起来了以前有个人把定速巡航当成了ACC全速自适应巡航，上了高速设置好了以后，就躺下睡觉，幸亏人没事，车废了。,0,0,0,2022-07-31 11:44:39,来自湖北,99771864925,培钧先生
7126102345943384867,反正就是特斯拉不对,2,19,1,2022-07-30 17:57:38,来自北京,3240979342295748,懦善不可为
7126445276525183781,司机饮酒未开，是特斯拉醉酒出事了。,0,0,0,2022-07-31 16:09:02,来自甘肃,2418549560983101,阳晖
7126176870852477709,我看了标题就知道该车主为了逃避酒驾而说谎,0,1,0,2022-07-30 22:47:15,来自江苏,4631552764,两江节度使
7126464201551905544,按照这样说，那醉驾更是以危险方法危害公共安全罪了[捂脸],0,0,0,2022-07-31 17:22:29,来自陕西,6920678602,国家级抬杠运动员001
7126072757506540329,撞到人 怎么算 车子主动驾驶,0,0,0,2022-07-30 16:02:48,来自浙江,50426576440,wz0577
7126467197379789599,如果司机座在副驾，那该叫无证驾驶了吧？,0,0,0,2022-07-31 17:34:11,来自浙江,3136242689251528,之午之言建言
7126458403290956547,我只想说，别为了躲避责罚而撒更大的谎，弄不好罪名更大,0,0,0,2022-07-31 17:00:02,来自四川,835243210967736,聪明葡萄Ap
7126473314847654664,车主撒谎了，很简单的一件事情,0,0,0,2022-07-31 17:57:47,来自江苏,107764772847,Mr王丶某人
7126480962330231563,还好是特斯拉，要是其它的电动车非起火爆炸不可。,0,0,0,2022-07-31 18:27:44,来自北京,7465328183,辽宁老刘
7126505388387664651,自动驾驶功能也不安全啊,0,0,0,2022-07-31 20:02:05,来自广西,4195368881360471,李姐慢生活
7126358058737058573,特斯拉车主真的是胆大命大,0,0,0,2022-07-31 10:29:22,来自四川,58321195561,你到底要干嘛
7126051627848647457,特斯拉自动驾驶必须感知到主驾驶座位上有人，方向盘必须感知有触碰力度才能触发开启自动驾驶功能,0,4,2,2022-07-30 14:41:28,来自浙江,53640836402,梦中梦171331550
7126123963965178665,没有自动驾驶，有的是辅助驾驶。前一个酒驾，后一个，危害公共安全罪自己选,0,3,1,2022-07-30 19:21:36,来自浙江,4325961028,邦本邦宁
7126486020157555496,L2，司机手是不能离开方向盘的，一会儿就报警,0,0,0,2022-07-31 18:46:33,来自河北,7404447553,小小丽果
7126484668840706830,我在高速上看到一个大哥，开着特斯拉在驾驶室两个手在那捧着手机玩游戏，跟他并排好一会，就在那玩时速125左右。想想出点事就可以见上帝了，不知道摄像头排到双手离开方向盘扣不扣分？,0,0,0,2022-07-31 18:41:40,来自山东,5790352063,卫鑫糖糕
7126469171781190400,参考下深圳关于自动驾驶的责任区分，L5的才是厂家负责，其余的都是驾驶人负责。,0,0,0,2022-07-31 17:41:11,来自四川,3601592641656782,想要的名字一个都没了
7126086293742306089,特斯拉自动驾驶不算酒驾[偷笑],0,2,0,2022-07-30 16:55:22,来自广东,68206120302,我爱看电影a
7126461371772142339,座椅应该有压力传感器，特斯拉后台应该有记录。,0,0,0,2022-07-31 17:11:32,来自陕西,3886941731,武之舞515528
7126133511568032525,[中国赞]给这位机智的特斯拉车主点个赞！！,0,0,0,2022-07-30 19:58:39,来自浙江,87630022064,王大爷的快乐时光
7126473705706078987,聪明反被聪明误～自驾车可以酒后操作吗？从设置自驾程序到开启程序就应该算酒驾了！,0,0,0,2022-07-31 17:59:25,来自山东,4099421062838524,仁爱奶茶yAm
7126451671454499621,也许特斯拉自动驾驶对喝了酒的人不服从指令吧。,0,0,0,2022-07-31 16:33:42,来自河南,2150271168284669,虎啸龙吟3l6b
7126189953147175719,反正失事都是车主有问题,0,0,0,2022-07-30 23:39:42,来自福建,3780508114,漳州靓点
7126465738394665736,算不算酒驾只要法院判了才能确定，谁说了也不算。,0,0,0,2022-07-31 17:28:03,来自山西,105119701401,用户兵老
7126486129792074537,如果是特斯拉自动驾驶，厂家要负责，因为你销售的时候说可以自动驾驶，现在出问题了，你说只能辅助驾驶，那做广告的时候，为什么不说明！,0,0,0,2022-07-31 18:46:48,来自江苏,50682441381,羌栋梁
7126251115611652879,坐在哪边也跑不了你！只要你喝了酒！,0,1,0,2022-07-31 03:41:10,来自山东,75760071988,龙行天下fys899666
7126078784427524903,上次有个新闻说特斯拉的老总在高速出车祸死亡到底是怎么回事？有了解的吗？,0,0,0,2022-07-30 16:26:46,来自湖南,102160977874,御景园空中花园
7126064118096053024,又是这个牌子车子[抠鼻],0,8,0,2022-07-30 15:30:10,来自天津,606531711404119,麦兜看世界521
7126449985360741153,车主可以告特斯拉了，虚假宣传，买的时候不是说能自动驾驶的吗。,0,0,0,2022-07-31 16:27:20,来自北京,60450331215,不再等待175037953
7126469550749008680,是不是自动驾驶，司机有没有开车，查一下车辆设置和行车记录仪就行了。,0,0,0,2022-07-31 17:42:34,来自广东,101244839888,天狮集成灶888
7126484240832774942,自动驾驶也要感应到手在方向盘上，坐副驾驶是狡辩,0,0,0,2022-07-31 18:39:53,来自江西,105014892007,赣州新视觉光电科技
7126459054721319683,"不出事是自动驾驶功能
出了事就变成辅助驾驶
特斯拉又一次出名了[笑哭]",0,0,0,2022-07-31 17:02:29,来自上海,2132700681733299,洪哥3676
7126503331476144928,过去有人老催特斯拉自动驾驶功能如何如何先进，特斯拉之所以高档主要是自动驾驶如何了的，现在怎么不催了？,0,0,0,2022-07-31 19:53:58,来自四川,2150291110363947,草原Oc
7126478997155840776,怎么不是酒驾？因为自动驾驶的设置还是他本人操作的，实际上还是算他在操控汽车！,0,0,0,2022-07-31 18:19:43,来自重庆,58588116865,sc902
7126507257067750183,请有识之士给我上课一下，我无证正常驾使对方从小路窜出被撞上，请问我应该负多少责任,0,0,0,2022-07-31 20:09:23,来自海南,92598819619,顽强小鱼vC
7126483953414472459,肯定喝了不少，要不咋敢用特斯拉自动驾驶,0,0,0,2022-07-31 18:39:11,来自河南,62405740027,吃垮老店
7126121705176679208,我绝对相信，特斯拉可以远程操控。如果车上有重要人物，想想后果……,0,0,0,2022-07-30 19:12:39,来自四川,100438082411,蜀国资深玩家
7126076582737216297,特斯拉在中国的是L2辅助驾驶，根本达不到自动驾驶，特斯拉的L4级别只在美国开放！,0,1,0,2022-07-30 16:17:37,来自上海,51254424145,开怀看世界看自己
7126339446043329295,"问题的关键是喝酒的特斯拉车主。
而不是特斯拉车主喝酒",0,0,0,2022-07-31 09:17:38,来自河南,51429888827,洒脱生活家ar
7126086713445008163,因为人没有坐在驾驶座，没有重力感应，不能使用辅助驾驶,0,0,0,2022-07-30 16:56:52,来自广东,2132698178523821,喜欢看头条的老黄
7126065040742302504,酒驾无疑，因为至少车子是你启动的。另外这只是个蹩脚的谎言而已。,0,2,0,2022-07-30 15:32:56,来自山东,70162323231,双面煎的鱼
7126175932175401769,现在的自动驾驶跟辅助驾驶国家应该明确，而不是拿自动驾驶作为卖点让很多人认为车子自动驾驶了,0,0,0,2022-07-30 22:42:59,来自浙江,104965915203,傻时光哈
7126117994803446561,司机咋想的？坐副驾驶不算酒驾？？,0,3,0,2022-07-30 18:59:11,来自河南,72510828293,大师赵奋基
7126377986412380941,国产吉利新能源都是标配L2级辅助驾驶，国内把特斯拉都神化了。,0,0,0,2022-07-31 11:47:31,来自广东,6147806423,冷风语者
7126452761792906019,这还不醉驾？我就问自动驾驶是谁开启的？,0,0,0,2022-07-31 16:37:26,来自云南,109461121607,用户常在河边走
7126084611737764611,第一，酒驾实锤了。第二，特斯拉自动驾驶是容易出事坟的，去年闹到了今年了，如果是真的没有一点刹车、自动问题，会闹到现在还未停熄吗？,0,0,0,2022-07-30 16:49:31,来自浙江,3368500361962891,豹哥几个
7126480249839649566,除非车子自动启动和熄火，除此之外都是酒驾。故意为之主观意愿跟结果一致而且并没有进行中没产生危害的时候中止。,0,0,0,2022-07-31 18:24:35,来自天津,78643765923,天津马到成功
7126486950366348040,请问自动驾驶考了驾照吗,0,0,0,2022-07-31 18:50:39,来自上海,92970457484,西红柿炖牛肉111
7126075638909338403,要么酒驾；要么危险驾驶非法使用自动驾驶。反正都是车主责任。这波怪不着车,0,0,0,2022-07-30 16:13:49,来自北京,65666988291,战栗的小猫
7126192172185240333,查一下过镜的路口监控就知道司机有没有开车,0,1,0,2022-07-30 23:47:21,来自浙江,2968302462971677,智慧冰淇淋EP
7126468032628966144,看了这么多特撕拉，我真以为是可以自动驾驶的，只是人放不放心的问题,0,0,0,2022-07-31 17:36:40,来自广东,101893263382,赏花赏月871
7126443930929529633,就是用遥控器，也是酒后驾驶。,0,0,0,2022-07-31 16:03:56,来自天津,50003460851,自然JP
7126058972813624094,算车主驾驶,0,0,0,2022-07-30 15:09:59,来自浙江,5919751559,陶斌斌
7126454100098990884,酒驾，只要轮胎没移动，何来酒驾？天热了，或天冷了，酒后人在车上休息一下，发动机打开，享受空调，算酒驾吗？,0,0,0,2022-07-31 16:43:04,来自浙江,102534115034,单纯圆月ev
7126416016372040451,啥叫辅助驾驶，紧急情况下辅助，撞车了不属于紧急情况吗[笑哭]。L2这个自动驾驶看来是个大坑[捂脸],0,12,0,2022-07-31 14:15:25,来自陕西,50506484035,雪豹爱水晶
7126469988927882022,有时搞明白，其它电动车也有不少L2级别的，为什么特斯拉车主就这么迷之自信，是因为特斯拉卖得贵吗？还是这些车主看不懂说明？,0,0,0,2022-07-31 17:44:50,来自湖南,2981482202147511,观然后再语
7126453682669601571,特斯拉的车主都是些什么人啊。。,0,0,0,2022-07-31 16:41:01,来自安徽,267936709751827,平淡看世界的智人
7126188449975403303,人家证明碰撞不会起火，应该感谢,0,0,0,2022-07-30 23:33:16,来自浙江,3795149694,凡花有缺
7126332255219680039,这个算酒驾吧。12分呀。一句自动驾驶就完了？,0,0,0,2022-07-31 08:50:39,来自广东,4530866884,吃盐的强人
7126100659258229517,车主必须严惩,0,3,0,2022-07-30 17:51:23,来自上海,22337520815,黄KHZ
7126358481761764127,特斯拉车主和车企都很团结一致啊，他们不会不知道淘宝上那些特斯拉专用方向盘配重什么的都卖给谁了吧，晒买家秀时可优越得很啊,0,0,0,2022-07-31 10:31:02,来自四川,1922870502,炎夏语冰
7126081030586958633,这么说自动驾驶只是一个摆设，一个卖点，多卖钱的一个理由。,0,0,0,2022-07-30 16:35:00,来自山东,4023848899976472,新天地名车行
7126076690954339112,敢问我的偶像林志颖是坐在副驾驶吗？为啥他作为一个职业赛车手开车怎么撞的这么严重？,0,1,0,2022-07-30 16:18:03,来自浙江,97788470298,StevenGwo
7126309430786343717,宁愿花点钱找代驾也不愿这样搞生命只有一条钱没了可以再挣,0,2,0,2022-07-31 07:22:13,来自浙江,1306657921185959,足智多谋贵族
7126467091989201702,以危险方法危害公共安全罪,0,0,0,2022-07-31 17:33:49,来自山东,6854040037,冰峰弯月
7126461805722862376,只要车辆启动打火，就算酒驾,0,0,0,2022-07-31 17:12:20,来自黑龙江,5234432130,魔力凹凸曼
7126122416870392608,当然算，法规没有允许杭州可以有社会无人驾驶车辆上路,0,2,0,2022-07-30 19:16:06,来自浙江,98931556540,虞宸
7126492973797868326,车主坐后排就好了,0,0,0,2022-07-31 19:14:20,来自辽宁,6851165050,远航一路水
7126163089296818984,不应该叫自动辅助驾驶，应该叫辅助人工驾驶。商家为了扩大虚假宣传，往往在文字上做游戏，让一些人莫名其妙的上当受骗。,0,0,0,2022-07-30 21:53:08,来自浙江,58838453849,三眼老顾
7126458158238810913,特斯拉没这么神，代驾司机过不来，不能打滴吗？,0,0,0,2022-07-31 16:58:47,来自浙江,6271380326,小白兔108
7126204707810575104,就是自适应巡航，还是要人操作才行。司机应该说谎了,0,0,0,2022-07-31 00:36:09,来自安徽,1873167735065192,汪塘没有塘
7126458609122837248,你怕是不知道，有人工启动的步骤，车不动都算酒驾吧！,0,0,0,2022-07-31 17:00:10,来自湖北,3861100983486622,神秘兮兮666
7126479698641060619,司机设置的时候，就已经算驾驶了,0,0,0,2022-07-31 18:22:50,来自山东,55030841859,阳光灿烂11079
7126354833879221031,在高速上见过特S拉车主在快速道时速100+低头双手玩手机游戏。,0,0,0,2022-07-31 10:16:53,来自湖北,5983498609,LH74290547
7126311518023074563,国内新能源汽车现在都有辅助驾驶，自动泊车，自动去充电功能，不过本人没试过[捂脸],0,0,0,2022-07-31 07:30:51,来自广东,4345698172811336,空间混合
7126091258304463654,那么问题来了，接下来交警会对车主怎样处理？,0,0,0,2022-07-30 17:14:57,来自浙江,5817140548,小旋风66332426
7126336801367147299,特斯拉汽车出了这么多事情，应该查一下汽车的主板，是不是可以导航控制,0,0,0,2022-07-31 09:07:28,来自浙江,69562491763,现在218575862
7126448214417015564,他对车子寄予这么大的期望啊，无人驾驶带他回家？怎么想的[呲牙],0,0,0,2022-07-31 16:20:55,来自福建,111176276730,晓风夜语
7126490546021466915,特斯拉说驾驶座没人是无法启动辅助驾驶的,0,0,0,2022-07-31 19:04:05,来自福建,3803946016048483,千山踏遍人未老
7126478388306527011,这个好，万一撞了人是车的责任，与坐副驾驶无关[捂脸],0,0,0,2022-07-31 18:16:47,来自云南,3988666222650907,牛仔没裤
7126160297802646275,自动驾驶功能，到底自动在什么地方，跟人为驾驶有什么区别,0,0,0,2022-07-30 21:42:54,来自江苏,92291526645,信义房产中介
7126460284671279907,酒后不开车，请代驾好简单的事，何必才复杂呢？,0,0,0,2022-07-31 17:06:29,来自湖南,52195853646,岳阳县锦绣戏剧团
7126362749852205824,又是特斯拉，看来买这车的人要慎重啊，安全可不是闹着玩的,0,0,0,2022-07-31 10:47:35,来自江西,111554883792,奇妙小红花mt
7126112771397387044,总的来说：这是特斯拉车主的福音[赞][赞][赞][撒花][撒花][撒花][捂脸][捂脸][捂脸],0,0,0,2022-07-30 18:38:27,来自四川,6736694730,1369347309X
7126477966867202850,不理解买特斯拉的人是什么心里,0,0,0,2022-07-31 18:15:08,来自河北,4393247326611316,完美饼干qe
7126069832071922436,是不知什么叫辅助驾驶功能？,0,2,0,2022-07-30 15:52:14,来自浙江,53231702211,shen141110938
7126314363770094373,司机肯定是撒谎,0,0,0,2022-07-31 07:40:35,来自上海,1437772153370131,jack8824401
7126122629958206221,如果真的可以自动驾驶，那么车主还要不要考驾照？[what],0,0,0,2022-07-30 19:16:43,来自浙江,4195358107245175,景行行止叕
7126461636243620643,这个特斯拉是不是要上热搜了,0,0,0,2022-07-31 17:11:39,来自河北,2396579108502952,北戴河房产宋营
7126473722626147084,重点在于，撞了，没火,0,0,0,2022-07-31 17:59:37,来自山东,3759929036651539,嘎嘣脆头
7126085349713314596,总之又是特拉斯出事故了😱😱,0,0,0,2022-07-30 16:52:06,来自广东,2656061851959837,°～ 清💃
7126348864629867304,不坐在驾驶位，能开启自动辅助驾驶？！,0,0,0,2022-07-31 09:53:49,来自湖北,2854775905063854,浔江隐士
7126503612528132899,你坐后排都算酒驾！,0,0,0,2022-07-31 19:54:35,来自江苏,2343811037016072,太阳很孤单
7126487197410771716,不管是什么广告，广告制作者，广告代言人，广告推送人都应对夸大广告功能负责,0,0,0,2022-07-31 18:51:59,来自广东,3817159827135789,用户秋风雨
