7126428700580987680,自动驾驶是一个很牛的程序。当然，程序的编写没有一个程序员保证没有一丝问题。所以，程序的完善是在使用过程中，随着出错改正的，这需要时间和使用次数去堆积。所以我暂时还是开燃油车[泪奔],0,6,1,2022-07-31 15:04:51,来自浙江,14830594471,暴走的小白羊
7126114667705664268,酒驾啊，喝醉后启动车辆，打开自动驾驶的动作就是酒后驾驶行为；如果是别人代为启动，就是蓄意谋杀,0,25,1,2022-07-30 18:46:15,来自浙江,3693958570195502,我要出去浪
7126472456751235853,特斯拉：对啊，车本来是我在驾驶，可你坐副驾位子上对我一阵乱拨弄，造成事故，你这就是犯了以危险方式危害公共安全罪呀[捂脸],0,0,0,2022-07-31 17:54:17,来自上海,3943029862,zhou-j
7126095668661732136,逃避酒驾有新招了？这司机自作聪明了,0,0,0,2022-07-30 17:31:44,来自江苏,59667579028,配音译术家
7126477551576613639,特斯拉 驾驶着 车主肇了个事儿，元方你怎么看？！特斯拉相信车主对它的信任，撒欢儿了！,0,0,0,2022-07-31 18:13:57,来自黑龙江,414176785550,明湛1199
7126475596548948766,自动驾驶算危害公共安全？那自动驾驶公交车、自动驾驶送外卖车都违法了？,0,1,0,2022-07-31 18:06:37,来自福建,4416505770,沙鏸精
7126364551331054368,绝对算酒驾啊，自动驾驶也是需要人操作启动程序……,0,1,0,2022-07-31 10:55:43,来自山东,3394928123319784,一丝不挂的小鱼
7126174400583762719,离不开驾驶员的“自动”驾驶[呲牙],0,3,0,2022-07-30 22:37:44,来自河北,50868517368,哈哈镜141681793
7126066513567580943,特斯拉有起飞的功能,0,10,0,2022-07-30 15:38:26,来自广西,84642958861,爱生活杰米0E2
7126500982003614502,明显酒驾后躲避责任做副驾的,0,0,0,2022-07-31 19:45:22,来自浙江,2444937096082227,千寻宠
7126396278413837093,哈哈哈，心也太大了，那么相信自动驾驶吗？,0,0,0,2022-07-31 12:58:30,来自吉林,21583061074,快乐在自媒体
7126033747879314216,当然算，特尸拉这个自动驾驶级别，驾驶位必须要有人。文中这个案例，车主涉嫌非法开车和醉酒驾驶,0,5,0,2022-07-30 13:31:29,来自浙江,3619237782893245,明天的星空666
7126499920995205918,出了事情，交警算你责任，你不服，你告这个提供自动驾驶的去,0,0,0,2022-07-31 19:40:46,来自安徽,1055989461168667,冰陨寒天
7126137900915360551,以前看个视频，特斯拉自动驾驶还是在高速上，车主在后排睡觉？,0,1,0,2022-07-30 20:15:59,来自黑龙江,5563439520,3679333376
7126392437773796134,我没开车，是车子自己开的，车主赶紧解释！以后就这样对交警说！,0,0,0,2022-07-31 12:44:07,来自广东,100805196497,股海第六感
7126498331660403463,我认为车主也算酒驾，因为车主是醉酒的情况下启动操作无人驾驶模式，除非无人驾驶模式是一键启动无别的设置，否则也算酒驾。,0,1,0,2022-07-31 19:34:43,来自贵州,6228414240,划破天空的云82914582
7126061007994536741,酒后驾驶，想逃避责任[呲牙],0,17,1,2022-07-30 15:17:39,来自湖北,5942590738,烟花三月古月
7126060776385233695,如果坐在副驾驶就能开车，那是无人驾驶吧,0,18,0,2022-07-30 15:16:49,来自上海,59180677743,是小芋圆呀
7126451623370621731,这个是特斯拉夸大自动驾驶功能，车主有点冤！,0,0,0,2022-07-31 16:32:54,来自贵州,4468005188411613,乐天派清泉75
7126122419970196254,酒驾应该包含各种危害公众安全的延伸驾驶行为，谁都不想莫名其妙路上被意外，这次路灯倒霉。开车还是要有认知,0,0,0,2022-07-30 19:15:49,来自浙江,58404424947,魚小虎
7126498671742599976,很简单啊，交警调出事前几个路口的监控就可以了呀。看看能坐在哪里呀，又不是中央电台未解之谜。,0,0,0,2022-07-31 19:35:25,来自浙江,11265300762,外向小羊AZ
7126344200865661731,特斯拉一直声明自己是辅助驾驶，为啥这些车主总自以为买的是自动驾驶？实在搞不懂“精英”的逻辑理解能力啊,0,0,0,2022-07-31 09:36:05,来自江苏,97916564000,只是静静地看着你装逼
7126158748653683456,酒驾+撒谎企图逃避责任，罪加一等,0,6,0,2022-07-30 21:36:20,来自浙江,58741602796,艾沙520
7126454632821818153,上诉特斯拉无人驾驶机动车枝朮不过关，要不是撞到路灯上，交警还抓不酒驾丁。,0,1,0,2022-07-31 16:44:41,来自江苏,3139811438504511,悠闲辰星dX
7126488158123967263,酒驾已坐实，你说的是醉话，警察不会采用。伤了车，保险不赔偿，还得刑拘！,0,0,0,2022-07-31 18:55:07,来自山东,108681525237,海水翻滚
7126159555347874571,怎么没结果？酒后坐副驾驶座位上使用自动驾驶模式这算不算酒后驾驶或违法？求结果求结果[祈祷][祈祷][祈祷],0,0,1,2022-07-30 21:39:56,来自浙江,51071294531,刘丽灯
7126475202334065423,事故原因是因为他醉酒后设置的自动驾驶模式，导致模式醉开撞杆，难逃干系[呲牙],0,0,0,2022-07-31 18:04:18,来自陕西,6048839663,阳光章老大
7126340719094137635,特斯拉（特难刹）这次又该起诉车主了[呲牙],0,0,0,2022-07-31 09:22:30,来自河南,92560722499,逍遥72391
7126459942067929887,就是自动驾驶，车子也是酒后设置，不然怎么会没多远就撞上呢！不算酒驾算酒后肇事吧！,0,0,0,2022-07-31 17:05:33,来自江苏,92588748086,运动快乐永不止步
7126181059234480931,喝了酒使用车子自助驾驶功能，到底算不算酒驾,0,0,0,2022-07-30 23:03:22,来自浙江,93107627540,万燊行钣喷材料
7126065781724857119,我相信车主，可能他不会操作，坐在副驾，以为操作成功，所有没成功过一会就出事了，挂的可以强行挂缺。d档的,0,6,0,2022-07-30 15:36:20,来自广东,50714173192,我是你的kkFs
7126185558640116514,酒驾拘留15天，危险驾驶最低三年，特斯拉车主: 我选B[捂脸],0,0,0,2022-07-30 23:20:42,来自北京,106724725142,freerain1
7126102100660355848,这妥妥的酒驾 不然以后开特斯拉喝酒出了事儿都赖车子了？,0,1,0,2022-07-30 17:57:01,来自浙江,81538166808,Loong1996
7126465625895043855,如果不喝酒坐副驾驶让车自动驾驶呢，算以危险方法危害公共安全罪吗？如果不算为什么喝了酒算？如果算自动驾驶功能有个屁用？,0,0,0,2022-07-31 17:27:09,来自河北,2862773252404589,全工力
7126186182887326464,特车主确实需要教育，为什么那么多人坚信特斯拉有自动驾驶功能？,0,1,0,2022-07-30 23:23:19,来自山东,4046622483285196,持秦砖扔汉瓦
7126089635025322785,喝了酒使用车子自助驾驶功能，算不算酒驾,0,1,0,2022-07-30 17:09:11,来自江苏,92516111810,龙爷376
7126324213849260831,自动驾驶功能就是试验品，拿车主性命来试验，关键还要车主花钱买这个功能。,0,0,0,2022-07-31 08:18:52,来自安徽,4397670969904576,不留评论
7126117534201643808,喝了酒使用车子自助驾驶功能，算不算酒驾,0,0,0,2022-07-30 18:57:08,来自天津,98096383701,握力苏打鸿德记
7126448056320459534,车不是他开的，那问题就更严重了，他的车可以没有驾驶员就上路吗，就算可以，所谓的无人驾驶，依然要有人坐在驾驶员位置，处理突发事件，他目前面临的比酒驾跟严重的处罚,0,0,0,2022-07-31 16:19:26,来自陕西,5341407868,小牛51511353
7126438467688481543,酒后驾驶，操控，甚至遥控汽车行驶，都算酒驾。像你这么说自动挡都不算驾驶了，只有手动挡算驾驶？只是人参与的程度不同而已,0,1,0,2022-07-31 15:42:05,来自黑龙江,6962257739,瓜尔佳放
7126483801408783115,[泪奔]又是你，特斯拉,0,1,0,2022-07-31 18:38:30,来自广东,3703587913078039,郭郭爱读书
7126369792931693315,这个肯定算，毕竟是人在操控，逮捕该驾驶员时候，可以告知他，你酒驾，至于你如何驾驶还是全操控，还是借助高科技操控，甚至你在家遥控，都不能饮酒，很多行业都是全自动的，那都喝酒乱弄那不是乱了啊,0,0,0,2022-07-31 11:16:00,来自江苏,18546140039,驼铃声声寒
7126342931770032908,"可以不算酒驾，因为真的没有自己开车。
但是可以判定为危险驾驶、危害公共安全",0,0,0,2022-07-31 09:32:02,来自山东,52408222753076,马牧部人
7126362855175340836,这位司机，如果别人同样喝酒，然后开特斯拉的“自动驾驶”，把你撞残废了，你会怎么想？你会怪车还是怪醉驾的司机？,0,0,0,2022-07-31 10:48:09,来自浙江,6596609382,心晴之窗
7126179527860208418,酒后驾车，害人害己，我们都要远离酒驾醉驾。,0,1,0,2022-07-30 22:57:07,来自安徽,54501924235,飞哥22002200
7126059843177431848,现在，好像是L2自动辅助驾驶，有几个已达到L3自动辅助驾驶。不知道TSL是咋样的。总之，车主要了解充分车辆功能，才能有的放矢。否则，小心驾驶！,0,5,1,2022-07-30 15:12:46,来自上海,5047218212,Leo行健0801Taurus
7126457902549975848,鬼才相信他会坐副驾，反正我是不信,0,0,0,2022-07-31 16:57:19,来自山西,54598250274,阿明143908456
7126320103326647048,特斯拉:你自己的事，我不背锅，在说一次那个叫辅助驾驶，辅助驾驶。不是自动驾驶。,0,0,0,2022-07-31 08:03:19,来自四川,5206753042,哦豁洗白求了
7126504880311321385,人家喝了酒在车里睡觉，没开，都算酒驾。,0,0,0,2022-07-31 19:59:36,来自山东,2607659698368334,凯撒欧克
7126090492160557837,这车主不算醉驾，因为他还清醒的知道让自动驾驶系统来担责[赞][大笑],0,1,0,2022-07-30 17:12:03,来自四川,81044111666,宁静致远佚名
7126433331541164838,该车主行为符合酒驾认定。,0,2,0,2022-07-31 15:22:54,来自四川,20668668096,118清竹
7126064162824241931,喝了酒自动驾驶。那肯定算饮酒驾车,0,5,0,2022-07-30 15:30:26,来自浙江,51335855416,顺其自然149916706
7126442920596980495,"如果人坐在副驾驶上能开启自动驾驶？
该工作人员回复说，开不了，车都动不了。
如果是这样的话，说谎就没意思了……",0,0,0,2022-07-31 15:59:13,来自江西,3645610781318460,滑冰橙香满园
7126347148279005983,即使坐在副驾，开了自动驾驶也应算酒驾。如果撞人了呢?,0,1,0,2022-07-31 09:47:12,来自广东,4283348350422446,用户名已存在二
7126312293335991078,特车主确实需要教育，为什么那么多人坚信特斯拉有自动驾驶功能？,0,0,0,2022-07-31 07:33:39,来自湖北,3149980731,一人一车一世界HS
7126102918432326438,那它的自动刹车呢？就算酒驾自动刹车，为什么启动不了？包括林志颖的车辆出交通事故的时候，也没有自动刹车。,0,1,0,2022-07-30 18:00:32,来自上海,1640091485747207,天虹11668
7126278597824152328,而且里面还提到车子撞到了路灯，开到路边在休息，撞完后谁开到路边休息的，自动驾驶吗？很明显是司机，所以醉驾跑不掉,0,1,0,2022-07-31 05:24:39,来自福建,3563403449,优雅星空xs
7126166541670368000,幸好人没事，万幸，酒后最好不要碰车[呲牙],0,0,0,2022-07-30 22:06:35,来自浙江,3985064660574044,15五彩斑斓
7126507029124104992,不管是L几，我就想知道以后真正实现自动驾驶了发生事故了是人的责任还是机器的责任？如果是机器的责任，那机器拿什么来负责？,0,0,0,2022-07-31 20:08:25,,73539475994,请输入用户名该名已存
7126455883487527692,不明白为什么愿意将生命交给自己驾驶[我想静静],0,0,0,2022-07-31 16:50:13,来自广东,74377102990,angelsw
7126498478519567145,酒驾是不算了，算危险驾驶罪[偷笑],0,0,0,2022-07-31 19:34:44,来自湖南,55383499542,张捷55
7126451177801450277,告诉车主要么领一个酒后驾驶罪，要么领一个危害公共安全罪，让他自己挑[大笑][大笑],0,0,0,2022-07-31 16:31:48,来自河南,110935770408,时髦糯米60
7126417634279310110,"特斯拉：特斯拉没有自动驾驶、只有辅助驾驶。。。
而且特斯拉立场很明确，一直强调，现在的在售车型都是辅助驾驶，没有自动驾驶",0,0,0,2022-07-31 14:21:49,来自北京,2185473733433276,寒云柔
7126499785275933481,你说这要是比亚迪，车主在车外跟玩具车一样用钥匙遥控，算不算酒驾？,0,0,0,2022-07-31 19:39:45,来自陕西,67184541222,首席扯蛋官
7126346571096605470,没有驾照怎么罚款扣分,0,0,0,2022-07-31 09:45:01,来自河南,5854461197,清风china明月
7126473240956011295,你喝酒坐在副驾驶也算酒驾。因为你的酒气熏到司机，造成司机昏晕迷糊，精神不振，视觉不清变成司机带酒气开车属于酒驾，这种叫做酒醉转嫁开车。,0,0,1,2022-07-31 17:57:05,来自广西,110864193094,weizhongji
7126458970906706718,根据特斯拉的重力感应设置，人不坐在主驾驶座上，车辆是无法启动的，特斯拉官方说的,0,0,0,2022-07-31 17:02:05,来自吉林,92745254405,忆江南276992456
7126359404814828323,我记得以前美国有一场车祸，一对年轻男女坐特斯拉后座自动驾驶然后撞树死亡的！,0,0,0,2022-07-31 10:34:35,来自浙江,22994580660,骇七搭八
7126456141369901835,车主在副驾驶位，设置自动驾驶还有司机？[打脸][打脸][打脸],0,0,0,2022-07-31 16:51:01,来自云南,57957898137,茶水河
7126112851382944523,是的，什么事故都是车主的错，你们的说法可实了,0,7,1,2022-07-30 18:39:05,来自内蒙古,57791048493,大漠飞沙1481
7126511607668163362,自动驾驶也是你喝了酒设置的，就是酒驾无疑！,0,0,0,2022-07-31 20:25:27,来自广西,61692379828,_中国435
7126443265477968672,应该就是酒驾自己撞上了，然后又坐到副驾上去了,0,0,0,2022-07-31 16:01:29,来自河北,108614205437,正能量光束wL
7126369826813248256,特斯拉车主出来下，你们到底啥时候主动刹车有过用？,0,0,0,2022-07-31 11:15:29,来自江苏,2150282204034323,摆正心态刷评论
7126428576718963489,这次不是司机驾驶习惯不好，是坐的不对，我这么说特斯拉可还满意？,0,0,0,2022-07-31 15:04:16,来自河北,6193041481,珊81899133
7126381450056368930,任何车的自动驾驶都是鸡肋，突发情况多种多样，自己的双手最安全。,0,0,0,2022-07-31 12:00:41,来自辽宁,91673710930,腐烂的衣土人云
7126472760075158307,酒驾怎么判,0,0,0,2022-07-31 17:54:59,来自贵州,1380621503432493,正大光明暖阳oy
7126422216153072419,林志颖的事情还没搞清楚呢，特斯拉又出问题！,0,16,0,2022-07-31 14:38:50,来自湖北,2488917154336220,逸素心
7126069377551680288,据我所知，也是亲眼所见，特斯拉是可以自动驾驶的，（用手机操作）至于坐在付驾算不算酒驾要听交管怎么说了。,0,2,0,2022-07-30 15:50:24,来自浙江,67110721920,毛博357
7126506294898869024,如此事属实，因判特斯拉酒驾。,0,0,0,2022-07-31 20:05:41,来自江苏,906441778266647,无限风景
7126475406529987343,就算是再完善的自动驾驶，他也是酒后进行设置的。所以严格来说还是酒驾。,0,0,0,2022-07-31 18:05:18,来自江苏,85310281494,有空不空
7126362477486473991,说了半天没说到重点，如果是全自动驾驶，算不算酒驾？,0,0,0,2022-07-31 10:46:32,来自江苏,71673033609,隔壁王三狗
7126335048512946948,特斯拉保有量太大了，负面消息少不了。,0,1,0,2022-07-31 09:01:39,,2392972089627352,小马一家在海南
7126395491213918976,不请代驾的代价,0,0,0,2022-07-31 12:54:55,来自广东,1675303539193227,养神清心
7126490707808076574,买特斯拉车的时候，自动驾驶可说的这么详细，你虚假宣传，造成的后果自然要承担了,0,0,0,2022-07-31 19:05:12,来自江苏,1437802892376131,Ericroger
7126060796261745422,@杭州交警 ，酒驾好好查查！,0,8,0,2022-07-30 15:16:37,来自四川,6536155932,种花的老王
7126491675253539592,纠正一下，以危险方法危害公共安全是状态犯，如果当时路上没有啥行人的话，是不可能构成这个罪的。,0,0,0,2022-07-31 19:08:53,来自安徽,108361023780,安静4589
7126496019157615363,这事主要是特斯拉公司的责任，存在虚假宣传，欺骗消费者。宣传有自动驾驶功能，出来问题说不能自动驾驶。,0,0,0,2022-07-31 19:26:00,来自山东,25226841579,手机用户万能数据芯片
7126097785363333919,不是代驾过不来打电话一问是特斯拉车怕出事不好意思拒绝说过不来罢了,0,0,0,2022-07-30 17:40:29,来自浙江,6626311916,张庆稳100372221
7126375760268952355,不算酒驾，应该由自动驾驶设计安装的负责。,0,0,0,2022-07-31 11:38:36,来自广西,3787156816666424,盲客人间
7126154021807194888,佩服买特斯拉的车主，拿命搏一搏,0,1,0,2022-07-30 21:18:23,来自贵州,110927125242,开水烫小鸟
7126464256807027463,法院判的没有任何问题，车主如果觉得冤枉，可以起诉特斯拉害了自己，一码归一码,0,0,0,2022-07-31 17:22:16,来自上海,20986979098,一抹天青
7126407283186975524,喝酒不开车，就是有人记不住，大家千万注意，安全无小事。[祈祷][祈祷][祈祷],0,0,0,2022-07-31 13:41:26,来自天津,106033975036,百事乐590
7126438113635320584,我没有机会犯这样的错误,0,0,0,2022-07-31 15:41:21,来自山东,6803939510,村花大婶子
7126308643788096289,霉出事故车主说tsl很安全，出事故后，tsl说，车子很安全。,0,0,0,2022-07-31 07:19:53,来自福建,6405791936,香茗樵翁
7126254055046841129,酒后操作当然算酒驾，要不然我双手离把，撞到的都算绿源厂家的,0,1,0,2022-07-31 03:52:08,来自浙江,6714963571,全心全意老天鹅
7126077221823087364,这种事故正常车辆气囊肯定会爆，气囊爆了安全带就会锁死，看他哪个安全带锁死了不就知道他坐在哪个座椅了？,0,0,0,2022-07-30 16:20:50,来自山东,58485955020,李153881431
7126453669406671628,那以后真实现自动驾驶了算不算以危险方法危害公共安全呢？,0,0,0,2022-07-31 16:41:46,来自陕西,63037943192,出三木
7126498181642814216,谁操作的找谁啊。。。你喝酒操作的肯定算酒驾啊,0,0,0,2022-07-31 19:34:08,来自山东,4222381649,杨大宁
7126340471068312354,车主这么说是为了逃避酒驾责任……然而蒙不了大众[捂脸],0,1,0,2022-07-31 09:21:42,来自山东,95741703358,东方酷男之李强
7126424303780414245,这自动驾驶的车，是否生产厂家涉嫌危害公共安全罪？,0,7,1,2022-07-31 14:47:40,来自广东,2378973698858404,宝龙在江湖
7126453759815451403,有没有可能这个司机已经不是第一次干这事了,0,0,0,2022-07-31 16:42:24,来自安徽,60752668439,年月无恙
7126494286199718659,这样自动驾驶是不是更危险⚠️,0,0,0,2022-07-31 19:19:28,来自北京,55714461772,福筱航
7126471825605100322,"说明一个事实，特斯拉自动驾驶不靠谱！
有自动驾驶功能，原则上无司机无架照是可以的！",0,0,0,2022-07-31 17:51:15,来自海南,149139773472403,正者开颜
7126456161636811555,危害社会公共安全罪，没有完成严重后果，或者情节轻微，是可以免责处罚的。,0,0,0,2022-07-31 16:50:31,,5915999131,我儿子是小胖猪
7126118782023664421,我认为不算，首先车主有叫代驾，其次车主没有主观上没有主动驾驶车辆，起码不能算酒驾，至于其他法律责任另算,0,0,1,2022-07-30 19:01:37,来自浙江,7926751194,你浑身都是道理
7126466842553549580,喝了酒还可以设置自驾模式，这绝对是对酒驾法律的挑战,0,0,0,2022-07-31 17:32:35,来自陕西,2397347853372685,成熟麻酱O3
7126374991440544524,消防员们赶到时，车内已没有人员，在车外，消防员们找到了车主。这都写的什么东西啊[捂脸],0,0,0,2022-07-31 11:36:16,来自广西,94667863356,时来运展
7126089596273754895,即使是使用了自动驾驶，车主也是酒驾，自动驾驶开启总是车主开启的，这话没毛病吧,0,0,0,2022-07-30 17:07:58,来自浙江,1750021542526771,微风无形
7126464420695278370,楼主好好学学道法，就算整个驾驶过程自动驾驶，启动和设置都是司机干的，只要他做了这些都是酒驾！,0,0,0,2022-07-31 17:22:30,来自四川,63996883737,临风回眸爽
7126448388152902413,他设置自动驾驶了，而且还在车内，已经参与车辆驾驶行为了，应该属于酒驾。,0,0,0,2022-07-31 16:20:46,来自河南,61694058602,孤独的大雁23
7126481569598440207,一，喝酒了，二，车子在你的操作下启动行驶了（不管自动，还是手动）。就是酒驾，这个只要不是智力障碍都不难理解吧！！！,0,0,1,2022-07-31 18:29:19,来自江苏,58813442002,哎哎哎627
7126506663812727565,自动驾驶在中国意义不大，再牛逼的技术也挡不住不守法的人,0,0,0,2022-07-31 20:06:38,来自河南,104790213430,云霄宫殿
7126486477718356751,"按作者说法，酒驾推着车走也没事了？？
驾驶车辆，并不单指握着方向盘开车，让车走都算",0,0,0,2022-07-31 18:48:14,来自吉林,6680636905,镶蓝伊拉齐
7126088915895108389,车主故意总自动驾驶骗交警，肯定是他自己驾驶的，否则就提供车内视频看看,0,0,0,2022-07-30 17:06:00,来自安徽,1570536818747271,小明同学l0
7126487973784568611,车主不算酒驾，但车子算酒驾！毕竟里面全是酒味，所以车子酒醉撞上了。,0,0,0,2022-07-31 18:54:01,来自广东,4473248150201070,犇犇
7126364619786388256,特斯拉是在转移注意力，酒驾是真的跑不了了,0,1,0,2022-07-31 10:56:16,来自河南,63994098182,睿智热心群众
7126041335420797710,属于酒后命令汽车自动驾驶，就跟酒后命令小李开车一样，责任属于小李，所以这个责任属于特斯拉,0,3,0,2022-07-30 14:01:03,来自浙江,93317125264,countsai
7126313578554262287,这是不现实的，只能辅助自动驾驶功能，不能一味的依赖它，如果有这种功能让它自动开回去，跟机器人可有一比了。功能越多，故障发生率就越多，事故也会多！,0,0,0,2022-07-31 07:37:32,来自江苏,109722387407,难得糊涂陈永平
7126079869678715686,珍爱生命，远离特斯拉[抠鼻][抠鼻],0,2,0,2022-07-30 16:31:01,来自四川,4117701095,聪亦白i
7126420375462380323,“但是，司机将构成一个更严重的罪名，以危险方法危害公共安全罪”，不对吧，这个罪名应该由特斯拉承担吧？,0,10,2,2022-07-31 14:31:53,来自福建,82591746958,clian525
7126158536610497316,我不会买自动驾驶的车辆，自己的命还是握在自己手里更安全,0,7,0,2022-07-30 21:35:56,来自广西,897630272228619,四月红123
7126462153963963139,车主:那我还是酒驾吧！[笑哭][笑哭][笑哭],0,0,0,2022-07-31 17:14:49,来自广西,62841169104,——骏明
7126480738010759966,特斯拉出事故的报道真不少！,0,0,0,2022-07-31 18:26:38,来自山东,3694836221487000,宋欣9733
7126182458718602025,车主自己酒驾还诬赖特斯拉。,0,1,0,2022-07-30 23:08:44,来自江苏,61749739034,宅在家里没事做
7126459133796533031,不管自动驾驶的功能如何，他已然是酒驾！因为他是在酒后启动车辆开启自动驾驶的，所以是酒驾。,0,0,0,2022-07-31 17:02:53,来自山东,68086753047,高级梦想家C3
7126386111232131874,酒驾！自动驾驶撞死人了驾驶员不用担责吗,0,0,0,2022-07-31 12:18:36,来自江苏,54100051267,智慧的尘埃
7126482732175721224,应该问厂商自动驾驶功能会不会危害公共安全！,0,0,0,2022-07-31 18:34:18,来自河南,2774768769578219,无拘无束的聪明的小猫
7126113839275836175,"讲不清楚的事情我不想讲也不参与讨论。
肇事车就是特斯拉品牌应该是事实吧？
我想问问，酒后启动自动驾驶功能坐车回家是否合法？",0,0,0,2022-07-30 18:42:10,来自安徽,3499259290,寿春陈
7126293851589215013,什么是自动驾驶？,0,0,0,2022-07-31 06:22:00,来自贵州,4111794271172563,清爽柳叶A1
7126415777347322654,既然自动驾驶是危害国家公共安全，为什么要销售 ，为什么还要设计自动驾驶。既然允许，就不存在危害国家安全了。,0,22,1,2022-07-31 14:14:16,来自新疆,110004114759,蒋新890
7126399201600291621,特斯拉自动驾驶仪也醉酒了？,0,0,0,2022-07-31 13:09:42,来自浙江,3557801199,愉悦的梦想家a
7126294849627947811,座在副驾驶室，让车子自动驾驶，若是撞上人那可就麻烦了。,0,0,0,2022-07-31 06:25:04,来自浙江,51353262311,吴东18
7126416974032323335,特斯拉有人驾驶还会撞呢何况无人驾驶,1,43,3,2022-07-31 14:18:41,来自广东,3438915656883053,励志强哥lifuqiang
7126067436444680967,判车子有罪，人在车内，车子属于酒后开车～,0,1,0,2022-07-30 15:42:35,来自浙江,101100416236,猫咪的罐头
7126490718830986019,你不管是坐在副驾驶就算坐在后排，通过任何方式操控车辆前行，都算酒驾。,0,0,0,2022-07-31 19:04:43,来自江苏,6599049715,新华云媒视频
7126164312041227047,太雷了，不先做驾驶座开车，怎么启动自动驾驶,0,1,0,2022-07-30 21:58:37,来自浙江,100680151412,J里头个SS10
7126089602880111399,现在的自动驾驶是不成立的，官方名称叫辅助驾驶系统，用来辅助驾驶员的。酒驾妥妥的！,0,0,0,2022-07-30 17:09:00,来自浙江,100603689751,biebie491
7126155618557838116,驾驶位没有安全带记着无法开启fsd呀，嗨，叫个带驾能解决的事情非要搞得自己出名又车损，保险大概率还不能赔偿，真是活的不通透,0,0,0,2022-07-30 21:24:31,来自浙江,99193216173,KINGCC840
7126360070094766863,那还设技自动驾驶干嘛呢？？？,0,0,0,2022-07-31 10:37:13,来自四川,56242125794,快乐猴14
