7126474101598012193,[思考][思考]大家认为男子到底没有没撒谎？,0,6,0,2022-07-31 18:00:58,来自上海,52649386854,法律公开课
7126502200708252429,不成熟就不要搞个半成品自动辅助驾驶,0,0,0,2022-07-31 19:49:26,来自广东,6016103900,維朕独尊
7126498736120808226,特斯拉这么牛的嘛[捂脸],0,0,0,2022-07-31 19:35:35,来自上海,52077759881,Qiantingting
7126432091356545825,车有自驾功能，怎么能算以危险方法危害公共安全罪？,78,324,15,2022-07-31 15:17:52,来自黑龙江,63348225256,历史沉淀的理性
7126327904727991074,大概率是本人开的[笑哭][笑哭],19,111,1,2022-07-31 08:32:54,来自河南,597722397940999,飞来有痕
7126444820570473256,特斯拉的自动驾驶，是不允许车主坐在副驾驶的,33,123,4,2022-07-31 16:06:37,来自安徽,100247483076,一园子的花
7126323335810056974,撒谎判个刑 就会有所改善了,2,14,0,2022-07-31 08:15:41,来自浙江,3545408512,軼車视界
7126423728594617121,喝酒不开车，开车就不要喝酒，更何况喝酒后想启动汽车自动驾驶功能还是需要人工去操作的，所以说喝酒千万不要开车，可以叫代驾或者直接打车。,2,17,0,2022-07-31 14:45:45,来自广东,105896480642,小小黄生活记
7126305932195136295,国外有L5级别的自动驾驶了？,13,29,1,2022-07-31 07:08:37,来自天津,56575902448,慢慢成长的老马
7126153533300802344,请问一下，无驾照的人能否使用自动驾驶机动车,26,50,1,2022-07-30 21:16:10,来自上海,88131114136,江峰178
7126362743506649867,一看就是驾驶员自己酒后驾车撞到电线杆上，由于撞击过大酒也吓醒了一半，为了逃避坐牢，编造了谎言说车子开启自动驾驶辅助功能，但是他忘记了必须要自己坐在驾驶位置上才能开启自动驾驶辅助功能模式，其实沿路都可以查看监控谎言不攻自破。可以吊销驾驶证，六个月的劳狱生活，好好去检讨。,3,72,4,2022-07-31 10:47:40,来自浙江,10875227331,上海万佳
7126031326524211968,我猜车主撒谎了。肯定坐在驾驶位，至于是不是自动驾驶不可知。,17,96,3,2022-07-30 13:21:56,来自浙江,5961526266,wujue1904
7126076053013201702,喝了酒使用车子自助驾驶功能，算不算酒驾,37,187,8,2022-07-30 16:16:18,来自湖北,79973086005,絔合兲稥
7126432747845288718,特斯拉的自动驾驶据说是最好的，看来是水土不服。,0,3,2,2022-07-31 15:20:18,来自江苏,4202503509,金陵五阿哥
7126055670746776360,车主说：自己喝了酒，事发时“坐在车辆副驾驶座上”，是“使用了车辆的自动驾驶功能”。,19,47,0,2022-07-30 14:56:25,来自山西,6503589081,若愚2482
7126076472510956325,每个车都有事故，为啥特斯拉那么火。谁来帮咱解答一下[捂脸],30,91,3,2022-07-30 16:17:44,,5860625476,稀饭不是盐
7126311652928488196,有没可能就是自己酒驾开的撞了才说在副驾驶用自动驾驶功能？,5,45,1,2022-07-31 07:31:07,来自广东,104404799356,非标设备自动化设计
7126069489367565063,车主自己酒驾还诬赖特斯拉。,34,397,17,2022-07-30 15:50:23,来自江苏,1604932230456733,随风
7126093524810089254,"肯定是酒驾了
“我没开车，是车子自己开的”[捂脸]",1,12,0,2022-07-30 17:23:58,来自广东,106918582132,轩然1316
7126143920727720717,我想知道手不放在方向盘上自动驾驶会立马取消吗？还是一直提醒你要手握方向盘,1,0,0,2022-07-30 20:39:08,来自江苏,51849093389,梅梅148482870
7126169125680022305,车主连车的功能都没搞清楚就说启动自动驾驶。现在哪个自动驾驶允许驾驶员位置没人的啊[大笑],9,21,0,2022-07-30 22:16:58,来自上海,8994018521,虎子1109
7126137735102169891,车主撒谎丢脸。特斯拉对外事务部工作人员之后回应《钱江晚报》称，这起事故中的车主说法不实。特斯拉具有的这项功能准确名称是“自动辅助驾驶”，必须要驾驶员坐在驾驶位上才能开启使用这项功能，坐在副驾驶位上是无法开启这项功能的。,1,16,0,2022-07-30 20:14:49,来自浙江,105143298975,哪里的春风吻上我的脸
7126043796257342243,又是特斯拉，最近特斯拉事故好多啊,35,368,17,2022-07-30 14:10:37,来自广西,68026245895,你的小红帽已上线
7126298156848972576,还有人敢坐自动驾驶的车？,2,19,0,2022-07-31 06:38:54,来自河南,103026634224,大河2847
7126497995835310863,这算酒驾吗？酒坐,0,0,0,2022-07-31 19:32:59,来自广东,2648054409202717,村间田野
7126057017889964808,酒驾，鉴定完毕！,7,480,10,2022-07-30 15:02:07,来自安徽,99900911871,慧༵⃐
7126409064522810127,不懂法，记得张三法律解读，坐副驾也是驾驶室，也属于酒驾。,95,117,23,2022-07-31 13:47:39,来自山东,51161998621,工程怎么搞
7126453397351826216,喝酒不开车，开车就不要喝酒，更何况喝酒后想启动汽车自动驾驶功能还是需要人工去操作的，所以说喝酒千万不要开车，可以叫代驾或者直接打车。,0,2,0,2022-07-31 16:39:58,来自福建,4142560058023691,薇薇逛红尘
7126128017914479360,就是想逃避酒驾责任，坐副驾驶自动辅助驾驶功能是开不了的,14,151,1,2022-07-30 19:36:58,来自浙江,3430477603,水镜帘外
7126504384183419686,科技在发展，但是一些科技是需要时间与实践来推进并且改善升级的的。而此时汽车的所谓的自动驾驶还只是初级阶段，太过于相信这些技术，是把自己和路人置于危险境地。而且机械也有闹脾气的时候……,0,0,0,2022-07-31 19:58:04,来自河北,109655387717,简墨135
7126254272836666143,无驾照不能开，酒后不能开，自动驾驶功能有什么价值。,4,16,0,2022-07-31 03:57:07,来自河南,6641698342,明101544021
7126415233958740739,有没有这种可能坐主驾开启自动驾驶后再爬过去副驾坐着？,2,8,0,2022-07-31 14:12:47,来自福建,54947104253,mimosa6
7126346708141261582,"乘坐自动驾驶，是否需要具备驾驶证，如果违章是否也得需要扣分，
那么自动驾驶的意义是什么？它的目的是什么？它会给人带来什么好处？",2,1,0,2022-07-31 09:45:28,,92820865428,一笑而过的666
7126430347121951502,永远不要把自己的生命交给一台机器来主宰[灵光一闪],17,201,11,2022-07-31 15:10:52,来自湖北,1623205216,竹林桥电脑
7126451538364728072,酒驾是喝了酒坐在车里点火发动了车那一刻起就算酒驾了，你别告诉我特斯拉不用先打火就能设置自动驾驶的程序哦。,20,58,9,2022-07-31 16:33:03,来自湖南,51082143958,米兰是朵花
7126460279847863073,无论车辆是否具备自动驾驶功能，驾驶员都不应该喝酒后启动车辆，喝酒开车即谋杀！,0,6,0,2022-07-31 17:07:00,来自湖北,111146228193,物理悟理WL
7126388206333494051,交警叔叔这次不是酒驾,0,1,0,2022-07-31 12:26:52,来自广东,3645873771,深圳邓哥
7126392248266900255,这是二个问题，一，概念是什么是无人驾驶。二，自助驾驶是人驾驶吗，它做的广告是…打开笔记本电脑在在车上办公，与驾驶位和副驾驶座没有关系，交警要验血，和自助驾驶有关系吗？,0,1,0,2022-07-31 12:43:07,来自山东,5868038561,13061383146
7126149577589326624,这个事情就无解了。驾驶员做副驾特斯拉说不可能；如果驾驶员做驾驶座位，就是酒驾或醉驾，你说咋办？,5,17,2,2022-07-30 21:01:07,来自北京,3967481423338516,用户沧海一栗
7126362864319480588,好家伙，开启自动驾驶必须双手在方向盘上不能离开？那我两手都在方向盘上我要什么自动驾驶,2,2,0,2022-07-31 10:48:31,来自江苏,2260190876409512,青玉案CC
7126056419614376739,那自动停车，自动出库怎么算？,15,44,1,2022-07-30 14:59:14,来自浙江,84671645021,杭州我家小宠
7126347717072405255,既然有自动驾驶那么他就应该符合国家法规要求，符合国家要求为什么不能使用自动驾驶，如果法律不认可，那为什么特斯拉的自动驾驶们能安装在汽车上？,2,7,1,2022-07-31 09:49:21,来自江苏,84980679401,好男人
7126478459311784744,目前没有一辆车达到L3级别的自动驾驶，所谓的“自动驾驶”都只是广告效应，最多也就是L2级别，都必须以人为主，靠人操控的，只是个辅助功能，相信车子自己能上路行驶也真是拿自己的命开玩笑,18,52,7,2022-07-31 18:16:58,来自上海,92335262075,年年有鱼年年有鱼
7126006887010681633,喝了酒使用车子自助驾驶功能，算不算酒驾？,24,37,3,2022-07-30 11:47:45,来自浙江,4141736428,后世欧
7126455465953116942,这个有意思，分开讨论：1、坐副驾驶启动车后设置自动驾驶算不算酒驾，2、自动驾驶出事故是人还是车企涉嫌危害公共安全？,5,11,0,2022-07-31 16:48:32,来自山东,17060119144,黄花大小子Q
7126065059628909323,"个人分析一下两种可能性的不同结果。假设驾驶员说的是实情1,如果事情发生在国外，尤其是美国，特斯拉可能要话费巨额律师费，最后与司机达成协议，赔偿N亿美刀结束。2,发生在杭州的这件事有可能会以司机向特斯拉道歉，切因喝醉酒驾判刑。以上可能性纯属个人臆测，本人不负任何法律连带责任。",11,4,1,2022-07-30 15:33:35,来自浙江,108828637978,乙乙川川
7126337629062710053,要驾驶员坐车坐位上才能使用自动驾驶功能（因为有驾史员在与无驾驶员在出现交通事故的责任认定结果完全不一样），自动驾驶功能有何意义？,0,1,0,2022-07-31 09:11:14,来自广东,6253461833,明珠83553035
7126179781695374094,这单保险肯定不会赔了，不在保险的范围之内，保险条款应该是要去有合规的驾驶员，且无违法驾驶情况。如果自动驾驶，没合规的驾驶员，保险不认，如果他自己开的，是酒后驾驶，保险同样不赔，没撞到豪车算他运气好了,0,12,0,2022-07-30 22:58:30,来自湖北,52569075511,过客也论道
7126385872068510468,没毛病吧，车主坐主驾驶位启动了自动驾驶，然后在副驾驶上使用,1,0,1,2022-07-31 12:18:21,来自浙江,6094196432,烤肉78800669
7126099868451390212,有种可能是喝酒了，怕被判酒驾，不敢承认自己在开车。谎称车是在自动驾驶模式下行驶的。,3,28,2,2022-07-30 17:48:27,来自山东,92496893391,艾山之石
7126068204530565926,"2021年全国因交通事故死亡人数是61703人。2021年中国交通事故死亡人数为61703人，同比下降1.7%；中国交通事故受伤人数为250723人，同比下降2.1%。
可怕吧，一年身故6万多人，见诸报端的车辆品牌有几个？我看就一个",8,60,1,2022-07-30 15:45:38,来自湖北,6713226191,二向箔冢
7126115798582002432,我没有驾照，也不会开车，本想买辆自动驾驶的汽车，这回没戏了[流泪][流泪],3,18,1,2022-07-30 18:49:54,来自辽宁,52198284905,好学明月1s
7126116110630142755,让没喝酒的驾驶员帮忙启动不行吗,5,36,1,2022-07-30 18:51:05,来自贵州,3509245993826167,幸福面条Qq
7126129013420376867,特斯拉先把林志颖的事故说说清楚吧,4,18,1,2022-07-30 19:41:08,来自浙江,1539788672613828,勇往直前的松鼠n8
7126320608233030433,交警离开的时候有没有带走司机？[害羞],1,5,0,2022-07-31 08:05:41,来自山东,101164933323,道家弟子理财规划
7126072837853070094,这…特斯拉的自动驾驶挺厉害的吧，上周坐过老板的特斯拉model3，在高速上他都是开自动驾驶，双手完全离开方向盘，时速固定在一百多，就这样从上高速自动驾驶到下高速，二百多公里，安全抵达。,26,26,5,2022-07-30 16:03:58,来自安徽,1063973931980221,杨先生YC
7126154318650475264,胆子真大，敢相信自动驾驶,4,40,1,2022-07-30 21:19:05,来自广东,3118658323494477,无德无才不配名
7126345925329060608,我在空旷道路上测试过自己的车，开启车道保持和自适应巡航，从提醒手握方向盘到道路无标线后紧急报警声响起，我都没介入，然后车辆提示语言变成韩文，主动开启双闪并减速，我接管车辆随后恢复正常！必须赞！,0,2,0,2022-07-31 09:42:28,来自山东,6207355407,小胡82325965
7126481942664856350,为了省钱代驾,1,4,0,2022-07-31 18:31:13,来自江苏,5363045195,再生资源总监
7126333693337158436,特斯拉只有辅助驾驶功能，需要驾驶座有人，手放到方向盘、离开方向盘几分钟就会锁死自动驾驶。,0,4,0,2022-07-31 08:55:50,来自浙江,109884285388,舒芙蕾朱古力
7126318061992280870,酒后自动驾驶杭州特斯拉上热搜啦，代驾的竞争对手[我想静静],0,1,0,2022-07-31 07:55:22,来自广东,75555989371,谣不传
7126070859806491430,特斯拉还有人会买吗？,4,22,4,2022-07-30 15:56:19,来自浙江,3378266940,北北酱啊
7126232151863067426,明显酒后驾驶！！司机在说谎！！,0,3,0,2022-07-31 02:25:54,来自河南,1261831939702455,儒雅宁静的校园
7126073123425747749,车主这智商只有喝过酒的人才会信,8,164,2,2022-07-30 16:04:20,来自浙江,3101061211769902,独钓寒江雪1
7126327715271344935,"2021年3月份，公安部发布《道路交通安全法（修订建议稿）》，明确了具有自动驾驶功能的汽车进行道路测试和通行的相关要求，以及违法和事故责任分担规定。
具有自动驾驶功能且具备人工直接操作模式的汽车开展道路测试或者上道路通行时，应当实时记录行驶数据；驾驶人应当处于副驾驶座位上，监控车辆运行状态及周围环境，随时准备接管车辆。发生道路交通安全违法行为或者交通事故的，应当依法确定驾驶人、自动驾驶系统开发单位的责任，并依照有关法律、法规确定损害赔偿责任。构成犯罪的，依法追究刑事责任。",0,3,0,2022-07-31 08:32:59,来自山西,64674220640,镇宅Toyota
7126437013012022054,主驾驶没人车可以启动AP?,0,1,0,2022-07-31 15:37:06,来自贵州,3016662840783304,年轻人不讲伍德lol
7126132434584093472,只要你酒后启动车，一定会被认定酒驾！,5,32,1,2022-07-30 19:54:52,来自天津,109535033731,聪慧的东北虎
7126424323363390221,如果承认喝了酒，但司机只是启动车并设置为自动驾驶，然后爬到副驾驶座位，按理特斯拉也不该撞树啊,1,3,1,2022-07-31 14:47:30,来自海南,6104742348,79415956
7126509623816848142,不懂车，前几天看到一个司机开车，应该是这种的，没有把方向盘，虽然科技发达，但真的可以完全依靠电脑自动吗？周围好多车，一些突发情况，真的能紧急处理好吗？,0,0,0,2022-07-31 20:18:07,来自辽宁,73574064306,娜笔芯
7126389946667746082,启动不开不算酒驾，这是新规，车主启动操作后去副驾驶，就是自动驾驶，出问题了，和特斯拉有直接关系,0,1,0,2022-07-31 12:33:32,来自河北,51810756827,平平淡淡才是真145480811
7126082897093640992,开过特斯拉的都知道，不是任何路段都是可以启动自动驾驶的！,4,32,4,2022-07-30 16:42:40,来自浙江,5502158056,无-空
7126126589011706665,如果驾驶人身体不适是不是可以开启自动驾驶？感觉特斯拉太不靠谱。,1,22,1,2022-07-30 19:31:34,来自天津,2000737110866461,龙哥pKIE
7126459603180651303,喝酒不开车，开车就不要喝酒，建议车辆设计一个有酒精检测装置，如果是酒驾车辆不能正常启动多好啊！[呲牙][呲牙][呲牙],0,0,0,2022-07-31 17:04:38,来自内蒙古,1689327267754056,拥抱阳光WZ
7126162691752051495,"道路交通安全法没有规定自动驾驶，法不禁止即可行。
反过来还可以说，道路交通安全法没有允许无人驾驶或自动驾驶，如果启动自动驾驶就是违法。
自己琢磨去吧！",0,3,0,2022-07-30 21:52:12,来自北京,102845810180,成熟宇宙XC
7126211039208850208,那些还想着喝酒了使用自动驾驶的人还想买这车吗[捂脸][捂脸][捂脸][捂脸]人不在驾驶室自动驾驶功能不能用,0,2,0,2022-07-31 01:03:14,来自广西,50333272861,喷你mei商量
7126102111758058281,现在只要出事，车主的反馈就是刹车失灵什么的，其实都是自己误操作所至。就是把责任推给车企，那个人没私心,8,45,7,2022-07-30 17:56:34,来自江苏,104914657416,清爽扑克n5
7126059950958789412,为什么总找厂家，不是都保险了吗？但这例外酒后驾驶。,10,45,1,2022-07-30 15:13:41,来自浙江,25507565086,yeye873
7126130686737629965,特斯拉为什么都是车主问题？难道特斯拉是道德有亏人专用车吗？,4,20,3,2022-07-30 19:47:36,来自北京,95095729746,我要发狂发狂
7126070881659110152,有个问题，假如车主喝酒座副驾驶，然后在驾驶位放些东西，让车以为有人，然后如果被交警逮到了，是算酒驾还是不算,7,10,2,2022-07-30 15:56:02,来自福建,64181184053,铛里个当
7126451011422126884,就算是自动驾驶也是喝了酒的司机自己设置的，怎么不算酒驾？你知道他设置程序的时候清醒不清醒？,0,6,0,2022-07-31 16:31:13,来自湖南,51082143958,米兰是朵花
7126075828886536964,特斯拉根本就没有“自动驾驶”功能，只有“辅助驾驶”功能，而司机竟然坐在副驾驶位，肯定是司机全责，而且还涉嫌以危险方法危害公共安全罪。,7,29,3,2022-07-30 16:15:37,来自浙江,4134617843764275,梦里轻舟
7126058999845831432,刚开始车主说的好科技化呀，要不是看了后面的说只是辅助自动驾驶，我还真想买一辆体验一下我坐副驾驶车子自动驾驶的感觉,6,26,1,2022-07-30 15:09:53,来自浙江,3297527775,燎沐缘
7126452314269500167,赔了夫人又折兵得不偿失哎喝酒不开车开车不喝酒,0,3,0,2022-07-31 16:36:17,来自浙江,2378969828827619,冥王极光
7126491376719545119,有次坐朋友纯进口的T，买得早，120w+，自动驾驶模式，结果都靠近大货车了都不减速，也不变道，还好货车是停住的，朋友赶紧一脚刹车，坐副驾的我吓坏了,0,2,1,2022-07-31 19:07:44,来自江西,4806545477,欣婷48387506
7126395512311726852,既然自动驾驶启动后有一定的危险性，为什么还要让厂家营运到市场上让消费者使用呢？如果出了事故，监管部门和商家负责任吗？,0,1,0,2022-07-31 12:55:56,来自河北,5779511842,旧事惘然64528263
7126108300030001935,酒驾被查怕被抓这锅甩的手段确实是高[赞],2,35,3,2022-07-30 18:20:37,来自海南,3973665808,弱鸡001
7126076188350595873,喝了点酒。“我叫了代驾，代驾在北门过不来。我就想着我这车有自动驾驶功能，就用自动驾驶功能操作一下把车挪到北门。没想到刚开出没多久就出事了。,0,8,1,2022-07-30 16:16:33,来自广东,4367102998,莫负时光也莫负已
7126473282568323881,"第一，驾驶，外来词，drive，有操控的意思。喝酒后，不管坐在哪儿，只要你控制车辆移动，就是酒驾。
第二，特斯拉的自动驾驶，其实是辅助驾驶，它并不能代替你的判断。
第三，喝完酒，操控车辆移动，说小点，就是酒驾，严重点，你是危害公共安全！",0,9,1,2022-07-31 17:57:08,来自辽宁,70023623496,紫气东来20180731
7126444344919606028,我觉得这次是特斯拉车主的问题,0,2,0,2022-07-31 16:05:38,来自山东,1750023308324692,公园遛鸟老头
7126128948794557221,想问一下国外回来的人 目前国外L3 L4 L5可以自动驾驶吗？ 都说国外的月亮比较圆 不知道是不是真的,22,31,1,2022-07-30 19:41:05,来自浙江,6219195890,白云向南飞
7126156659642860296,胆子真大，酒后敢用自动驾驶。,2,3,1,2022-07-30 21:28:44,来自山东,1816034573039416,5886130387881
7126300250893320998,既然不成熟风险高大，还允许投入社会使用，真是一面理,0,0,0,2022-07-31 06:47:08,来自河南,100774860473,骤海风
7126013890425045800,喝了酒启动了车这就够了，酒驾跑不了。,7,38,4,2022-07-30 12:14:25,来自浙江,84715883636,纵横文三路
7126068068891362088,是真的，当时我在现场，那位先生跟车子连说了三次，去北门去北门去北门，哪知道特斯拉自己往电线杆上开。,2,5,2,2022-07-30 15:44:43,来自广西,4438052198160631,快菜x
7126058235563590415,我买车的时候身边人劝我买特斯拉，我没买，然后说我土，说我脑子不好，不知道现在他还会不会这样说？,29,34,3,2022-07-30 15:06:23,来自江苏,103556453767,菩提树下菩提果
7126347350834610959,"可惜这车不是威振天了，否则的话车会做证[捂脸]
真相只有一个，慌言终会被拆穿。
有行车记录仪[可爱]",0,1,0,2022-07-31 09:47:57,来自河北,2590877226121230,庄周折蝶
7126401247146083109,酒后驾驶，本来想甩锅，无奈变成不打自招[笑哭],0,2,0,2022-07-31 13:18:07,来自广东,3756352193435784,大禹1698
7126088977639179046,当然算酒驾，启动自动驾驶必须有司机在驾驶室，而这个司机喝了酒去启动自动驾驶算违规了,0,5,0,2022-07-30 17:06:18,来自广东,92777325632,甜甜小刺猬
7126143927702684427,特死拉有后台监控！拿出数据就知道是否在自动驾驶状态！,5,21,1,2022-07-30 20:39:27,来自北京,3982399514,天蓝蓝31034907
7126051861563949831,如果坐副驾驶算酒驾，那么如果他不在车里，只是让车子去接代驾，那算酒驾吗?,4,1,1,2022-07-30 14:42:16,来自浙江,50094874938,恺恺16
7126052910324712192,首先自动驾驶还没完全开放，所以自动驾驶是要有驾驶员监督的。一定要开脱责任的话，我认为机器和人各付一半责任，机器（车子）返厂深造，人按酒驾罚。,5,4,0,2022-07-30 14:45:51,来自浙江,1930219517,第六弦歌
7126091310687142656,特斯拉不是FSD（FULL SELF-DRIVE）吗？怎么成了自动辅助驾驶呢？,14,21,3,2022-07-30 17:14:36,来自贵州,92725636854,LiuZhiGuo
7126418107182351116,酒驾必须赔偿车辆？保险公司不会赔滴！不论有人驾驶还是无人驾驶！,0,0,0,2022-07-31 14:23:38,来自北京,69666897814,才高八斗小猫SR
7126382464431653670,酒后使用自动驾驶应该不算酒驾吧？,0,1,0,2022-07-31 12:05:16,来自广东,56483560472,苟京山
7126073076072481543,胆子大还是嫌自己的命大！林志颖那么好的驾驶技术……,1,86,5,2022-07-30 16:04:42,来自四川,73760536761,旗姐爱美儿
7126418454181167912,如果判定为危害公共安全罪，那特斯拉也算是共犯！,13,151,2,2022-07-31 14:24:06,来自四川,52723875253,YH160152328
7126426357689008911,车辆自动驾驶功能是厂家制造且新车销售就有的，说明书上白纸黑字写着的，国家批准该车上市销售，又通过了车管部门年度审验，驾驶员高度信任它，还主动坐到副驾驶，出事了责任就是驾驶员的了？以上所有的企业、法人单位和管理部门什么负担责任呢？,12,110,6,2022-07-31 14:55:02,来自山西,71584901163,李之红2
7126315393324909325,昨天就有个新闻，公交车没有司机，还在运营载客。是不是也不合法。,0,1,0,2022-07-31 07:45:07,来自广东,4691650120,不问出处123
7126186611595543328,按照中华人民共和国道路交通法，还不承认自动驾驶，即便车子有这个功能，你开启了这个功能，出了事故，一切都是算驾驶员的，那么这个就是酒后驾车保险不赔？,0,7,0,2022-07-30 23:26:22,来自浙江,4244281071,魔魔就是我
7126159652920443678,自动驾驶什么情况下才能使用,3,5,0,2022-07-30 21:40:18,来自江苏,13105420892,异国风情like
7126349080875893542,怎么每次特死拉官方都说车主说法不实？过一段时间就有车主出来承认？,1,0,0,2022-07-31 09:54:43,来自四川,92948054404,老胆胆
7126054627535618857,妥妥的酒驾，拿自动驾驶来说事没用。,6,106,4,2022-07-30 14:52:33,来自浙江,4928258960,苦一行
7126059954427577126,和林志颖一样，又是特斯拉…… 特斯拉最近火的一塌糊涂啊,14,106,5,2022-07-30 15:14:18,来自河南,61685463417,跳尸跳跳
7126341581002867487,自动驾驶也离不开人的操控下，这就是人的行为，行为人在醉酒状态下开启自动状态驾驶车辆，并未超出醉驾的含义。,0,2,0,2022-07-31 09:26:26,来自河南,1209086521652253,周口庄文通律师
7126418060332237581,按照这样来说，自动驾驶的功能一点都没用，何必说出这种功能呢？,0,0,0,2022-07-31 14:23:16,来自广西,791252690020190,2591309067005梁六
7126388690510906126,酒后自动驾驶[赞],0,0,0,2022-07-31 12:28:58,来自广东,95901725270,潇洒滴热心市民
7126479175162561295,笔者认为，如果司机真是坐副驾驶出事了，不能算酒驾，车不是他开的，怎么能算酒驾呢？但是，司机将构成一个更严重的罪名，以危险方法危害公共安全罪。最后的结果，还不如酒驾呢！,0,3,0,2022-07-31 18:19:57,来自山东,6863290801,一叶小舟飘啊飘
7126338424260821772,“不是不是，我没开车，是车子自己开的。”车主赶紧解释，说事发时他坐在车辆的副驾驶座上，是使用了车辆的自动驾驶功能。一辆白色特斯拉SUV冲出了路面，撞翻了路边的路灯杆。什么自动驾驶，是自动驾死？[捂脸],0,0,0,2022-07-31 09:14:34,来自广东,3783379087,海啸雷鸣
7126090378084369192,特车主确实需要教育，为什么那么多人坚信特斯拉有自动驾驶功能？,1,1,1,2022-07-30 17:11:14,来自河南,94208538766,黎明31034
7126415083261592355,可以起诉特斯拉吗？是特斯拉骗了消费者有自动驾驶功能。人家才会使用自动驾驶。,5,161,4,2022-07-31 14:11:15,来自江西,100521515527,海峰2476
