7126104698645627659,怎么特斯拉都爱撞柱子是什么原因？[打脸],7,34,3,2022-07-30 18:07:18,来自广东,110266716742,吴增辉
7126456282437501704,酒驾这个问题三令五申反复的说，仍然有人要去犯，没办法自作孽不可活,0,1,0,2022-07-31 16:51:37,来自云南,3797301380,依米花68
7126088731139851043,特斯拉不可能有问题的，肯定是车主问题[捂脸],9,42,4,2022-07-30 17:04:43,来自黑龙江,98016819019,动物医院精神科主任
7126063288584078095,自己酒驾，推到自动驾驶上了,1,51,3,2022-07-30 15:25:57,来自浙江,3686738723,22048436
7126430085011833612,这事主要是特斯拉公司的责任，存在虚假宣传，欺骗消费者。宣传有自动驾驶功能，出来问题说不能自动驾驶。,1,41,2,2022-07-31 15:10:17,来自黑龙江,2088666084153805,曲浩文143195
7126118900328170281,国内有没有统计特斯拉出货量和出事故量？占比是多少？,1,7,1,2022-07-30 19:01:45,来自广西,58338749875,大老99
7126122981171938051,除非喝酒的一直做后排，没给车下任何指令，没按任何按键。然后别人帮你按，那就不算酒驾了。当然了，万一出事故了，全部责任就是给你按的人担责了，你可以当喝醉了啥都不知道,2,12,1,2022-07-30 19:18:09,来自浙江,63179744348,建江43
7126321574663652109,特斯拉车主怎么都喜欢撒谎？[看],0,0,0,2022-07-31 08:09:04,来自印度尼西亚,108676767344,尘世1俗人123
7126423873788068608,这必须算酒驾，还得算危险驾驶，在中国还没承认私家车可以自动驾驶。,1,29,1,2022-07-31 14:45:10,来自湖北,57163851680,偷心小贼吧
7126110208736363298,都是驾驶者不懂车,1,10,0,2022-07-30 18:28:01,来自北京,70044204984,快乐库尔勒9P6
7126308237532087054,自动驾驶，你用真够胆大的！！！要对自己的生命负责！,0,0,0,2022-07-31 07:17:48,来自河南,1842398796456648,敏锐微风Ldk
7126167822505460517,如果真的开启了自动驾驶且人在一直坐在副驾，而副驾只能算乘客，主驾才是驾驶位，,4,4,3,2022-07-30 22:11:49,来自浙江,96783938965,德丽46908788
7126352010571989764,这样不错呢，免了请代驾的钱，损失反正是保险公司的。只是看运气，搞不好费命。,0,0,0,2022-07-31 10:06:04,来自四川,3887476296910556,港湾5170
7126058262914777889,这车不能买,5,46,4,2022-07-30 15:07:21,来自安徽,84365075203,农村带娃的施施
7126442524843426572,酒驾酒驾，固而言之就是酒后驾驶。酒后他没驾驶而交给自动驾使了，出事了就应该找谁驾使谁负责，自动驾使的就应找自动，自动负不了责就该找生产自动的责任人和付权人，跟使用人有一毛钱关系吗？,2,21,2,2022-07-31 15:58:34,来自河北,92345867975,位卑民言
7126420188274787107,这个是特斯拉夸大自动驾驶功能，车主有点冤！,1,90,6,2022-07-31 14:31:09,来自云南,2348155331158731,诗意清风s6
7126323113839231784,从特斯拉官方回复来看，大部分肇事司机都不诚实！看来特斯拉车主群体素质堪忧！,0,7,0,2022-07-31 08:14:33,来自贵州,17211897321,老李世宁
7126150307289580319,我想问问为什么出事的车子都是叫特斯拉？？？？？,0,5,0,2022-07-30 21:03:54,来自浙江,4020284276352215,安逸阳光3s
7126091971881943808,特斯拉才在重庆石柱撞死了2个，伤了4个！肯定是车主的错！厂商肯定没有错！[捂脸],24,66,8,2022-07-30 17:17:24,来自重庆,1644498266368903,在水十几方
7126162769786716942,行在公路上的特斯拉车主表示：瑟瑟发抖,0,3,1,2022-07-30 21:52:04,来自浙江,7661784377,社会小小猪99
7126401123476620043,功能叫自动驾驶，结果不能自动驾驶？,15,241,2,2022-07-31 13:17:39,来自吉林,58700235495,北落紫衫1
7126360186184483598,特斯拉：这锅不背[捂脸],0,3,1,2022-07-31 10:37:39,来自江苏,3260111818,龙城金沁
7126029855132746528,特斯拉自动驾驶时，驾驶员必须座在驾驶位置，同时双手还需要把握着方向盘（自动驾驶系统感知方向盘有外力），这样特斯拉还启动自动驾驶（AP）。,3,23,3,2022-07-30 13:17:02,来自四川,61452338576,海啸后晴天
7126421649234527017,汽车不需要发动吗？只要是他发动就是酒驾。。为什么禁止酒驾？就是酒驾危险，等同于没有人控制车辆。就算他坐副驾驶，那驾驶位没人控制岂不是更危险？严重点还可以定个危险驾驶！,8,22,4,2022-07-31 14:36:47,来自浙江,104630870600,乐观的星辰hR
7126205726116119308,自动驾驶是当你长时间开车累了困了开启自动驾驶然后自己睡一觉[捂脸],0,0,0,2022-07-31 00:42:14,来自河南,6499252970,青青陌上柳
7126127958296806182,驾驶位上没有人根本不可能启动得了,4,15,1,2022-07-30 19:37:29,来自浙江,65754330301,有美Mr章
7126448922150667048,有自驾功能，为啥车主不可用？用了就是犯罪？,3,5,1,2022-07-31 16:22:19,来自四川,100728587751,指甲比冰鎬好使
7126490785167950626,还不能确定是不是真的自动驾驶，特斯拉方说主驾没人车子是不会动的[黑线],0,2,0,2022-07-31 19:04:57,来自浙江,85435976219,北鱼读书
7126492958912332558,车有自驾功能，怎么能算以危险方法危害公共安全罪？,0,1,0,2022-07-31 19:13:58,来自广西,2686813801032643,清爽香瓜9G
7126492617524724483,"如果特斯拉宣传的有自动驾驶功能，车主这样操作是有道理的。事故责任也有特斯拉的。男子无责任或减轻责任。
如果宣传的是辅助驾驶功能，车主这样做是危害公共安全或者是酒驾。",0,1,1,2022-07-31 19:12:30,来自河南,4012547713,太墟清风
7126036178708808452,特斯拉自动驾驶说啦，只适合城市高架高速路面。,5,8,2,2022-07-30 13:41:41,来自浙江,89888037535,柏麟
7126371231560975136,真如司机描述的情况，涉嫌危害公共安全罪！,0,0,0,2022-07-31 11:21:23,来自上海,106100694810,空间能量加油站
7126392486058296103,这个罪大了，酒后竟然坐在副驾开车[强],0,0,0,2022-07-31 12:43:57,来自广东,6784312261,好奇的匹夫
7126077861181899535,倒霉的是无辜的灯杆，下次不要换成倒霉的群众.至于是车辆问题又或者车主是否高智商低素质，其实我们不关心，反正不值得同情,0,29,0,2022-07-30 16:22:32,来自四川,4164577131510525,无拘无束的时光穿梭机
7126444661576680232,"你喝醉酒下的命令设置的路程算酒驾！
你没喝酒设置的自动驾驶路程算交通事故！
酒后的设置命令本来就不符合正常人思维逻辑！
不然出事的就多了…！",0,7,0,2022-07-31 16:05:50,来自四川,84306965027,欢乐豆691
7126061246604575529,只要是特斯拉的事，就会被带节奏，有点强龙难压地头蛇的感觉。但是，不管怎么贬低，车子还是畅销全球。,2,27,4,2022-07-30 15:18:15,来自浙江,96691040728,大海里的一粒盐
7126294293530723085,这算不算酒驾？,0,0,0,2022-07-31 06:23:55,来自上海,75956429526,美好岁月的djx
7126197556459340552,不可相信自动驾驶，辅助驾驶而已[灵光一闪],0,0,0,2022-07-31 00:08:35,来自内蒙古,82809115787,L风花雪月
7126452074954933024,就是车主撒谎躲避酒驾，那我们当傻子呢,0,4,0,2022-07-31 16:35:36,来自山东,104677779155,你的幸福请允许我旁观
7126453621444641576,胆子太大了，代驾是不敢送你吧？,0,2,0,2022-07-31 16:40:39,来自河北,50018501652,热爱美食美景的小主妇
7126055627264803619,原来喝了酒可以开特斯拉啊……,3,27,2,2022-07-30 14:56:31,来自江苏,102760812078,优博士识字讲故事
7126319797507982121,中国人到底怎么了？喝了酒去主驾驶位操作自动辅助驾驶然后坐到副驾驶位，这也是酒驾，因为你喝酒操作车子了，保险公司都不会赔，就算车子有问题，保险公司也会因为你喝酒开车也不赔，是保险公司无赖吗？,0,2,1,2022-07-31 08:01:50,来自山东,73686997466,卍信仰mma
7126418897532306207,明显是自己酒驾，想赖给自动驾驶,10,37,6,2022-07-31 14:26:24,来自浙江,110739270064,小豆丁他爹
7126419253234041641,首先我反对酒驾，喝酒后不能开车，反而让车自己开可以，真奇葩！,7,33,3,2022-07-31 14:27:17,来自山东,62708678209,A专业生产彩涂板镀锌
7126053599381701408,还真有这样的人去相信特斯拉的自动驾驶[抠鼻],3,1,1,2022-07-30 14:49:28,来自浙江,5776802394,云上飞正能量
7126458362929103646,曾经有人酒后坐车里吹空调等代驾，也算酒驾，说是启动了走没走都算。,0,2,0,2022-07-31 16:59:25,来自福建,94825494744,橡皮擦0
7126163894569304862,喝了酒在副驾驶打开自动驾驶，就是酒驾！,0,0,0,2022-07-30 21:56:41,来自浙江,53544808499,地瓜薯条君
7126060511015273250,众所周知电动车分为特斯拉跟其他新能源汽车[泪奔][泪奔]只要是特斯拉就一定写特斯拉，是比亚迪或者国内汽车就写新能源汽车还给车标打码[泪奔],2,21,1,2022-07-30 15:15:09,来自浙江,93036172530,谨慎生
7126414049943831310,这是在用生命检验自动驾驶如何。,0,4,0,2022-07-31 14:56:17,,5919736531,极速湖泊zo
7126024838980387616,既然是自动驾驶，实际上并无驾驶人员，车主不应该算酒驾。至于损坏的财产，应该赔偿。,7,4,4,2022-07-30 12:57:39,来自浙江,105328013394,智慧荷叶yM
7126465049341870878,我觉得还是要看车辆说明书吧？如果说明书说可以无人驾驶，则当事人应该免责，由车辆生产和销售商及保险公司承担责任！千万不要低估了产品说明书的法律效率！它构成产品买卖合同重要组成部分！,3,9,2,2022-07-31 17:25:17,来自安徽,110475299201,自然子2021
7126102499052274439,如果人双手长时间不在方向盘上，有可能会取消自动驾驶，就是说也有可能不会取消自动驾驶咯,3,11,2,2022-07-30 17:58:48,来自浙江,54760035117,可以问吗
7126509639457325854,L2级不是把手搭方向盘就可以了，还要主驾位置上拍到车主人像，车才自己走，文中司机没有满足以上几点，肯定出事,0,0,0,2022-07-31 20:18:08,来自贵州,3211764407,天赋异禀御极
7126128525106889476,特拉斯凭什么说不实？你在现场？,2,15,1,2022-07-30 19:39:52,来自广东,92552534472,低调3127
7126393910469362467,我宁可相信世上有鬼，都不敢相信自动驾驶,0,0,0,2022-07-31 12:48:57,来自广东,99880482891,何腞123
7126363005210346280,特斯拉哪来的自动驾驶？？？L2.5的智能辅助驾驶好吗,0,0,0,2022-07-31 10:49:07,来自福建,3788018873,禽兽旺財
7126385083485192999,应该是酒驾，车主是为了逃避责任，才这么说的吧？,0,1,0,2022-07-31 12:15:20,来自湖北,58625650630,郭花花
7126486494667522849,个人以为，即使是坐在副驾驶操控汽车行驶，也属于“驾驶”行为。所谓的“自动驾驶”，是车辆的辅助行驶功能，并不达到成熟人工智能行驶功能，仍然需要“驾驶人”操控启动、关闭相应功能，其行为仍然属于驾驶机动车的行为范畴。,0,1,0,2022-07-31 18:48:54,,3960078607,小木30643185
7126456873485779743,一特斯拉车主酒后坐副驾驶，并开启自动驾驶模式，不料车子发生事故。关键词：特斯拉 酒后坐副驾驶 开启自动驾驶模式 出车祸,0,2,0,2022-07-31 16:53:48,来自四川,104798437633,巴蜀飞云
7126443895981900577,这个事件暴露好几个问题，1：自驾功能的定义，2：副驾驶怎么能说醉驾？3:为啥给定义危害公共安全罪？4:特斯拉问题这么多为啥卖的好？5:能不能定特斯拉虚假宣传？6:欢迎大神们补充和解答,0,6,0,2022-07-31 16:03:25,来自山东,3803940378648669,自由v空间
7126057617801249566,敬佩开特斯拉的勇士们,4,27,0,2022-07-30 15:04:24,来自北京,77225986752,Liaolintongzhi
7126430830951662371,按照这个逻辑，那是不是以后只要是自动驾驶出了事故都算是危险方法驾驶罪？那请问：自动驾驶功能的研发违法吗？毕竟研发的时候全程都是自动驾驶，虽未构成伤害，但已经是危险驾驶了！各大厂家是不是应该挨个去坐一遍牢？,5,27,5,2022-07-31 15:12:11,来自重庆,79110534283,康佳8K人工智能电视
7126349909502608168,无人驾驶，空车是否可以自动到达目的地？,0,0,0,2022-07-31 09:57:51,来自河南,1956754948359720,回头望中年
7126337774873477903,猪喝醉了叫醉猪。算不算醉驾？但是肯定是以危险方法妨害公共安全罪，第一肯定是醉驾，因为你不操作汽车自己不会启动（它没有智能），第二，即使汽车是L5级智能车也不能无人驾驶，不合法，得先修改交通法规才能上路。,0,1,0,2022-07-31 09:11:14,来自河北,3430908424884456,言行美好红微薄被克隆
7126478315624055593,"通俗地讲，L2级自动辅助驾驶的驾驶主体依旧是人类，系统只是减轻人类的驾驶负担，并且可以帮忙预防一些紧急事情而已…
撞到路灯杆不是紧急情况？目前自动驾驶就是个笑话！",0,2,0,2022-07-31 18:16:40,来自山东,6660412232,外向越野
7126441912961270543,喝醉的人设置自己驾驶，肯定是属于酒驾。一般没喝酒的人不会这么干,0,3,0,2022-07-31 15:55:11,来自广东,6328470621,执着的风景
7126190988108432162,估计这车主不知道特斯拉是“坐在副驾位置是不能打开自动辅助驾驶”的这种功能，为了逃避酒驾处罚才这么说吧,0,5,0,2022-07-30 23:42:11,来自海南,6786724396,树Z
7126436376455201539,这么简单的问题，还拿出来说道！[捂脸]无论人力驾驶或自动驾驶，一个是用自身的能力驾，另一个就是以车的功能驾驶，其行为人都是司机，也就是说当司机饮了酒，司机就是酒后开启了自动驾驶功能，就必须负这次责任！,9,18,4,2022-07-31 15:34:45,来自广东,61281705320,把盏夜话
7126477096234566441,应该算酒驾，最简洁明了的理由是，因为喝酒的人先设置了自动驾驶并启动了程序，最终发生了事故。,0,1,0,2022-07-31 18:11:46,来自青海,21938719151,黑老马2
7126111770917815048,说真的，特斯拉谎说多了，我不信了。。。,3,30,3,2022-07-30 18:34:42,来自江苏,3598044482768407,幽默风筝Z3
7126399215860728612,纯粹是驾驶员的狡辩,0,0,0,2022-07-31 13:09:51,来自四川,52679794960,天山雪223975227
7126335337454191394,肯定算酒驾，而且车主确实开了车，发生事故后离开驾驶位，谎称坐在副驾驶，谎言不攻自破。,0,0,0,2022-07-31 09:01:46,来自浙江,1235794943,NBALen
7126351404536857377,这车这么有魔性 事故接连发生,0,1,0,2022-07-31 10:03:40,来自海南,61257819629,wax23
7126092857811338019,错在不应该造出车子，那样就没车祸了,2,4,1,2022-07-30 17:20:50,来自浙江,52091331658,路过一寸
7126422905633981219,喜欢特斯拉的车主，反正他们不相信蛇会上树。,0,0,0,2022-07-31 14:41:32,来自广东,435042674285576,淡定海风iS
7126423399613760271,估计喝酒了吧？[呲牙]，坐副驾，开启自动驾驶，不算酒驾,0,3,0,2022-07-31 14:43:20,来自天津,101751913673,旺得福
7126476505168806690,主架没人都能启动L2驾驶模式？如果真是这样，那特斯拉绝对全责。,0,0,0,2022-07-31 18:09:25,来自重庆,52074498141,阳阳142481654
7126499548431745804,人才，这样都想得出来[我想静静],0,1,0,2022-07-31 19:39:26,来自广东,2840740616996551,广东G哥
7126478161122132776,无人驾驶汽车还要坐驾驶员什么东东,0,0,0,2022-07-31 18:15:53,来自贵州,50555850654,微笑轮船HD
7126493082753057548,算酒驾，因为启动设置，中途应急介入（未来得及）都是他，全车无别人，他难辞其咎。,0,1,1,2022-07-31 19:14:29,来自江苏,3727695653,爱格律吧
7126465411436233502,如果说明书上载明可以自动驾驶（且工信部报批时同意），其不构成犯罪。否则涉嫌构成以危险方法危害公共安全罪。,0,0,0,2022-07-31 17:26:47,来自内蒙古,104144255116,旅行者cjd
7126090792259191585,车上的座椅、方向盘上都有重力感应，如果发现失去重力感应，车子会自动退出自动辅助驾驶功能的，原来是这样子的,0,1,0,2022-07-30 17:13:49,来自浙江,5322474092,飘庄
7126423864074355456,又是特斯拉，最近特斯拉事故好多啊,0,0,0,2022-07-31 14:45:12,来自江苏,3636333637,木子梓木
7126078757886771983,自动辅助驾驶功能是不是还不够全面,0,1,0,2022-07-30 16:26:17,来自江西,92827312413,浅酌低唱唤浮名497
7126474535595148047,如果不算危害公共犯罪？ 假如在路上撞了无辜的行人？ 怎么办？谁负责？,0,0,0,2022-07-31 18:01:46,来自湖南,3660673463,爱旅游的80后
7126418870105277224,"自动驾驶功能让卖车的过大宣传了，才会出现这样的情况，他要是知道自动驾驶功能这么不靠谱，他敢坐吗？
如果一个3岁小孩驾驶一辆汽车，在公路上飞快的奔跑，跑到你面前邀请你坐车，他免费送到目的地，你坐吗？",2,26,2,2022-07-31 14:25:43,来自辽宁,3435630036,哆啦A梦15083667
7126355358423319332,林志颖都开不明白，这哥们还敢怎么玩！,0,1,0,2022-07-31 10:18:59,来自河南,66220270935,飘浮的人生5
7126102670510801697,美国有一起类似的交通事故着火，导致车门无法打开车内两名人员伤亡，但是主驾驶没有司机。后来警察调查说是主驾驶没人无人驾驶。,0,0,0,2022-07-30 17:59:27,来自上海,1640091485747207,天虹11668
7126420734054073118,酒不酒驾的，活着就好。,0,0,0,2022-07-31 14:33:32,来自河北,56911220241,李TAO221885291
7126083428512498440,敢开特斯拉的都是不怕死的主,0,7,0,2022-07-30 16:44:51,来自浙江,3585219522,热心市民MrS
7126501709056852768,如果是这样的话，自动驾驶技术就不用研发了，，就算研发出来我想没人敢用，因为没人保证机器不出问，到时候以危险方法危害公公安全罪有谁吃得消,0,1,0,2022-07-31 19:48:10,来自江西,5919179747,244684
7126400774460523279,特斯拉成了事故标杆了,0,0,0,2022-07-31 13:15:39,来自浙江,93590471745,用户4555703213139浮
7126412030248010533,特斯拉是在转移注意力，酒驾是真的跑不了了。,0,11,0,2022-07-31 13:59:38,来自上海,108848033767,聪明喜鹊5M
7126508448376390434,人在副驾驶，怎么算危害公共安全罪,0,0,0,2022-07-31 20:13:25,来自上海,5731675957,yc61977016
7126155349786673954,肯定赖车主，特斯拉系统怎么可能出毛病？[吐],0,5,1,2022-07-30 21:23:07,来自北京,3834294683,克隆PANDA
7126308223581471524,老是听到特斯拉出事故，大家为了安全，谨慎驾驶，远离危险车辆。,0,1,1,2022-07-31 07:17:18,来自浙江,54831974472,浙江省杨梅乡土专家
7126435182773158693,现在只评论喝酒开特斯拉自动驾驶模式，算酒驾吗？,0,0,0,2022-07-31 15:29:48,来自辽宁,4441633304879373,愉悦的天空Om
7126085520274473758,赛车手都搞不定的车子，你还敢让它自动驾驶[赞][赞],0,4,1,2022-07-30 16:52:37,来自浙江,1635699489256238,叶叶🍃
7126324222930371340,恭喜特斯拉车主,0,0,0,2022-07-31 08:19:30,来自河南,83962615011,无双海燕FN
7126440114070618921,这是严重的对公众不负责任，什么驾驶辅助、自动驾驶，都是发生事故后为了减轻惩处的说词罢了，这种行为要严惩。,0,4,0,2022-07-31 15:48:17,来自陕西,4314679262,宁静才致远38283987
7126471759913894671,吧自己的命交给自动驾驶。心真大。,0,1,0,2022-07-31 17:51:09,来自内蒙古,51971825053,草原那里花如海
7126508951277437736,先不管喝酒的事 如果是自动驾驶出事故谁负责[灵光一闪][灵光一闪][灵光一闪],0,0,0,2022-07-31 20:15:16,来自广东,2370174767864827,逍遥境界
7126452734773478147,代驾笑了笑:-D,0,0,0,2022-07-31 16:38:12,来自河南,96559430742,念旧
7126025368620139272,酒后乘坐自动无人驾驶的出租车是否也算酒驾？[我想静静],2,23,1,2022-07-30 12:59:09,来自浙江,50788314536,沈杨勇
7126480320333562665,我提一句，如果车主把自动驾驶打开，自己走到目的地，算酒驾吗？,0,0,0,2022-07-31 18:24:27,来自安徽,52104364300,黄山太上黄
7126355579181908776,很明显司机为了逃避责任，故意这么说的,0,0,0,2022-07-31 10:19:47,来自河南,4187375184132167,崔贞涵
7126122880081265420,使用‘自动辅助驾驶’这项功能的时候，双手也是必须要放在方向盘上，系统会时不时地提醒要转动一下方向盘，否则‘自动辅助驾驶’就会被取消。”，，，，，，高速行驶中退出，不也很危险吗？？？,0,0,0,2022-07-30 19:18:02,来自江苏,10196630590,音羽4
7126413947313865486,酒后设置自动驾驶 怎么知道设置的对不对 设置错误 就会有错误的结果 同样涉嫌危害公共安全,1,9,5,2022-07-31 14:07:20,来自四川,6935410640,梦幻面条OT
7126432310568387335,只要车移动了位置就算酒驾，哪怕没坐车上，用手机遥控的，也是酒驾，酒驾是认定酒后驾驶行驶车辆，只要你动了车，管你是不是自动，都是酒驾,0,2,0,2022-07-31 15:18:39,来自内蒙古,74533540036,城市猎人240829511
7126445437518856968,既然是坐在副驾驶的位置，就应该认定为副酒驾，承担酒驾一半的责任。,0,1,0,2022-07-31 16:09:18,来自山西,5510247565,智者豆浆J0
7126503518399480579,这个不能算酒驾，算危害公共安全罪,0,0,0,2022-07-31 19:55:02,来自河南,4129355267579438,隔壁王大爷nzOD
7126463816363885353,特斯拉所谓的自动驾驶全是骗人的，出了事告诉你是辅助驾驶！买车的时候估计不会告诉你,0,2,0,2022-07-31 17:20:26,来自山西,100186544079,英飒吉利
7126465399189062435,哪来的自动驾驶？交通法里就没有自动驾驶,0,0,0,2022-07-31 17:26:27,来自内蒙古,99929166805,设计是空2002
7126345744285647650,自动驾驶也算啊，[呲牙]那要他干嘛,0,0,0,2022-07-31 09:41:38,来自上海,109469640160,黄雀螳螂禅
7126091161278317323,酒驾指车里负责车行驶的人，且喝了酒达到规定量的[呲牙][呲牙],0,1,0,2022-07-30 17:15:06,来自新疆,5888623972,桂子AK
7126056293709792008,别问，问就是车主的问题,5,43,4,2022-07-30 14:59:16,来自江苏,3623628662908126,常州原牛
7126471228420244261,坐在主驾驶位是不是酒后驾驶,0,0,0,2022-07-31 17:49:32,来自福建,2493345792282456,专注集美新城
7126397924216963881,很可能酒驾怕被抓，就说是车辆自己开车的,0,0,0,2022-07-31 13:04:30,来自湖南,6020764257,萌萌开心小萝卜
7126055982052328225,"特斯拉市场保有量，和出事故量！
事故率还是很高的",2,14,2,2022-07-30 14:58:38,来自安徽,75078818288,harbour_wen241984768
7126477738138944268,强烈支持不算酒驾。。。。。。。。以危害公共安全罪判个三年有期徒刑就好了，不至于到酒驾,0,0,0,2022-07-31 18:14:53,来自浙江,106258353418,betterme356
7126337144901862180,酒驾害人不浅，必须严惩,0,0,0,2022-07-31 09:09:26,来自江苏,4125825996953949,沸点人气爆棚
7126066962111005479,就是酒后驾车出事的，想推到特斯拉自动驾驶的头上去，虽然我也不建议买特斯拉这车安全性得不到很好的保障，但是这次明显是背锅了,0,8,1,2022-07-30 15:41:07,来自江西,3325679062,设计幸福丶
7126509949970744095,问题来了，如果没有喝酒，设定L2自动驾驶发生事故，能是危险公共安全罪？,0,0,0,2022-07-31 20:19:39,来自浙江,53198147609,社会观察者上善若水
7126331728113369864,那你看到一辆特斯拉 车上没有人 车从停车场自动开开到这个酒店门门口 车主面前的 车上没有人 车是 怎样自己开到车主面前的,0,1,0,2022-07-31 08:48:18,来自江苏,1317912872,195956866
7126494998715171619,既然这车有自驾功能，为啥用了此功能就是犯罪？那么有自驾功能的车就不应该销售出厂，出厂就是制造犯罪机率。,0,0,0,2022-07-31 19:21:14,来自江苏,237929849426440,海
7126329014532834089,说白了就是自动驾驶没啥用处呗,0,0,0,2022-07-31 08:37:21,来自山东,93125120419,给点阳光就灿烂8178
7126476543383847688,无论是坐哪都是酒驾！因为这个车不具备全自动驾驶功能，他喝多了以为有！酒后误判,0,0,0,2022-07-31 18:10:26,来自广东,3227765543024414,Xsalee
7126397433999459086,车主自己酒驾还诬赖特斯拉。,0,1,0,2022-07-31 13:03:13,来自四川,102291646604,惜缘SS
7126062950406308643,一般来讲、自动驾驶辅助功能、手离开方向盘1分钟左右车辆就会发出提醒安全驾驶的警报音,0,5,0,2022-07-30 15:24:53,来自浙江,1820393988687662,義一良品
7126343633426957071,是不是无人驾驶就可以酒后驾驶了？,0,0,0,2022-07-31 09:33:52,来自江苏,6625214695,热情的海风G
7126358375390216997,自动驾驶功能就像，达文西的发明一样厉害，手电筒有关就能亮，没光它不亮！,0,0,0,2022-07-31 10:30:40,来自江苏,105692082457,大当家0001
7126456738341110542,自动驾驶谁设置的，是不是喝完酒设置的，还不是酒驾,0,0,0,2022-07-31 16:53:11,来自陕西,65020687614,信步行山
7126414495169233668,这个行为也违法吧，要是撞到人，那人家不是好冤枉。,0,19,2,2022-07-31 14:09:31,来自广西,1604931179788283,寐豆
7126057045228880672,其实就是酒驾怪特斯拉,0,22,0,2022-07-30 15:02:48,来自浙江,103873415532,积极的田小白
7126113548849447692,特斯拉：所有车辆问题和我无关,1,3,1,2022-07-30 18:41:48,来自安徽,111149413599,刘皇叔也下厨
