7126344039808615183,经常上综艺的，拍广告的，得奖率都不高！,97,1107,9,2022-07-31 09:35:23,来自北京,58623255620,青春美少女组合
7126443188898366223,这么多年，电影界评选有几个是大众喜欢的，这次真正暴露了贾玲，沈腾，孙俪邓超，大众不喜欢,6,29,1,2022-07-31 16:00:21,来自浙江,66311301344,香椿树iavL
7126414432770949888,"沈腾还是适合演小品，电视剧还是算了吧。
海清不行，她一直都是在演，在炫演技，并没有真正深入她演的那个角色，也就是说，她没有变成她演的角色，永远都是在演而已。不像刘琳、冯恩鹤这些演员，她们演谁就是谁，看不出演的痕迹。而海清永远都是在演，演的痕迹太浓重",21,163,4,2022-07-31 14:08:37,来自北京,3369378584986535,简单快乐林晓梦
7126355308510757672,什么情况啊？,1,10,0,2022-07-31 10:18:35,来自河南,111519720991,魔法英语王老师
7126346478779613952,沈腾：不装了，我是负责搞笑的，我摊牌了[捂脸][捂脸][捂脸],22,742,6,2022-07-31 09:44:29,来自陕西,92507332047,卤蛋游侠
7126270037132084000,假如您是大众评审席当中一员，您会给海清和沈腾投票吗？,111,57,0,2022-07-31 04:55:07,来自湖北,101486477061,要啥自行车com
7126331271038567183,"百花奖是一个专业性非常强的奖项，必须代表演员的综合素质，演技，人品，敬业，口碑，电影是要表达深层次的感悟，需要内涵。
张泽实至名归，多部电影，电视剧表现出色，为人低调，敬业每一个角色都给人们留下深刻的印象。
沈腾获零票也不奇怪，他排演的电影，多半有喜剧成份，到达经典还要走很长的路。在塑造角色上有痕迹，为表演喜剧而表演。为评委的公平公正电赞[赞][赞][中国赞][中国赞]",123,1421,24,2022-07-31 08:45:48,来自吉林,87258163107,晨曦话语
7126351972462101285,"五位提名都是实至名归
[捂脸][捂脸][捂脸][捂脸][捂脸][捂脸]",4,146,7,2022-07-31 10:05:49,来自贵州,6058906154,用户CAI与时俱进
7126301801976365858,有些落后的评选机制，真投票评选的话，不如直播间里一人一票评选更刺激。进直播间人脸验证，不能造假。,44,106,14,2022-07-31 06:52:01,来自河北,99720510390,飞鹤游天
7126317104080487181,张译是真的很有演技。他确实实至名归。但是沈腾也不至于一票没有。我很喜欢看搞笑电影。沈腾给了我很多笑点。但是如果说专注的话。我喜欢张译。他一直专注于演戏。沈腾的综艺太多了。没有时间揣摩演技,13,319,0,2022-07-31 07:51:35,来自北京,51317594309,Raina1002
7126196776608629519,我会投海清，演技真的有目共睹！,53,1434,76,2022-07-31 00:05:00,来自江苏,3390549716383607,小鱿娱
7126335969242399503,海清那十年如一日的咋呼演技,18,286,1,2022-07-31 09:04:13,来自河南,57087985627,一隅时光
7126320918179545893,个人认为主要是沈腾平凡上综艺捞钱，他的综艺人设干预了演员本身，对自身演员的身份没有好好保护。张译和袁泉基本不上综艺，都是全身心做个演员。,7,46,0,2022-07-31 08:06:32,来自上海,54254494169,nn143178153
7126320796863660811,沈腾正常，海清不正常,17,220,8,2022-07-31 08:06:29,来自印度尼西亚,6223222764,AlEinstein
7126495650165850914,张译，袁泉获奖实至名归，很公正。沈腾贾玲如果获奖那就太不正常了，贾玲的《李焕英》除了消费去世的父母外，资本炒作太厉害了。以前演的小品还好，俩人自从上了综艺后，从头至尾的尬笑，小品也出不了作品，越来越不喜欢他俩！,1,123,2,2022-07-31 19:23:41,来自甘肃,5923918300,马香玲
7126297286640304928,会的！海清实力派,8,373,18,2022-07-31 06:36:03,来自山东,63539280659,饮水思源7690
7126407955754894119,海清在电视剧中一直一个样，风风火火咋咋呼呼聒噪叽歪，千万别再和黄磊拍戏了，再拍就和他一块废了。从没有看到令人惊艳的演技，这说明大众评委还是有水平的。,3,40,0,2022-07-31 13:44:23,来自山东,1477380372176365,欢快清风fv
7126395688740586274,朱媛媛票最高说明她接地气。演技丶人气都高。袁泉票居第二，是有些人欣赏不了她带西欧风格的气质美。理解！,2,33,0,2022-07-31 12:55:48,来自安徽,5416834566,聪慧溪水Fr
7126396675077784334,业界的羡慕嫉妒恨！不好意思✅完全不喜欢袁泉的表演,20,38,25,2022-07-31 13:00:12,来自江苏,93187908834,西西不是软妹子
7126319130479182592,周也也就算了，海清、沈腾算怎么回事？0票，这不是打脸吗？,1,2,0,2022-07-31 07:59:11,来自四川,2000744236200652,侃剧娱扒婆
7126380307095438119,朱媛媛没来 很喜欢她 演技好真实不做作,3,42,1,2022-07-31 11:56:55,来自江苏,2739615746505214,用心对待每一天ML
7126402358891922189,演技这东西，我平凡人看不出来，什么情感细腻，台词功底，都没觉得什么比较的，这几位都是职业演员只是不同领域，单话说回来0票有点过了，怎么着倒数第一也得有几票吧。考试还都能蒙几分的可能呢。,3,10,2,2022-07-31 13:22:08,来自吉林,100724598687,我有一个嘤嘤怪
7126328559987196706,我只记住了社区大爷回答马冬梅以及老师发怒的片段，其他片段不记得了，沈腾、贾玲参与的其他影片都没看，总觉得他们有些做作，也许是喜剧作品很难突破的原因吧。,15,262,14,2022-07-31 08:35:26,来自湖北,2594489141297662,华老Style
7126319170261877541,海清也是很优秀的演员,1,9,0,2022-07-31 07:59:29,来自河南,107959586710,神秘面条al
7126300615244415756,张译的演技，已到炉火纯青了，祝贺张译袁泉得奖[鼓掌][比心],9,332,2,2022-07-31 06:48:37,来自广东,3158235488453275,小粤叮咚
7126383229028156200,"其实我非常讨厌贾玲的表演。真的假。
至于沈腾，几部电影确实不错。问题是，这一两年好像没有。",2,49,0,2022-07-31 12:07:26,来自上海,59824878241,鱼儿游一圈
7126308511134499615,说明评委是很公正的，维护了百花奖的使命和责任。,12,219,7,2022-07-31 07:18:19,来自湖北,101491676308,百年多多话
7126466279048938275,朱媛媛以前演过一个啥电视剧，名字记不住了，觉得她演的太好了[呲牙],10,18,1,2022-07-31 17:29:49,来自辽宁,72919660962,叫我牛顿
7126537722902561550,感觉海清演什么都一个样。沈腾最好的就是《夏洛特烦恼》其它的就没什么新意，都差不多一个样。感觉他俩就是用肢体在演戏。个人观点，不喜勿喷。袁泉和张译都是一个眼神，一个表情就可以诠释一个人物的内心和情感，是用眼睛和表情在演戏。个人观点，不喜勿喷。,1,21,1,2022-07-31 22:07:15,来自辽宁,3241778209363223,若无执念青春何以青春J
7126467072028820237,贾玲比海清多？这都什么人给评的？[泪奔],4,32,2,2022-07-31 17:33:34,来自辽宁,6659514189,小叮当2021
7126362818370831117,反而觉得这样可能更合理，首先提名是有1300万名观众选出来的，后由101再次投票选择，提名时参与人数多，肯定有所谓的“唯粉”投票，其次两人都是有献礼集合电影参选，一个四分之一的电影片段的人物饱满度及演技表现和其他参选作品肯定是有一定时间限制的！最后101个观众可能也更专业，考虑的因素肯定会更多，这样的结果不稀奇，稀奇的是出现0票,5,33,3,2022-07-31 10:48:03,来自河南,75727899252,紫在逍遥客
7126365551270068999,张译大奖，沈腾0分，再一次证明电影百花奖的专业与权威！,5,270,6,2022-07-31 10:59:28,来自山东,690121951163287,莱哥正能量
7126357357780894499,可是，可是沈腾又一次火了，有没有一种可能，这是反向宣传[捂脸][捂脸][捂脸],0,8,0,2022-07-31 10:26:43,来自陕西,92507332047,卤蛋游侠
7126467858019959585,yi特讨厌沈腾和贾玲，他她们的作品从来不看。,14,165,4,2022-07-31 17:36:21,来自海南,52436960150,哈呼1122
7126181364420248361,沈腾扛起了票房，却输了奖项,59,589,23,2022-07-30 23:04:22,来自广西,68026245895,你的小红帽已上线
7126345659028292352,我最喜欢的男女演员：张译、袁泉,2,7,1,2022-07-31 09:41:21,来自陕西,1288253697428685,贪吃鱼恋上猫
7126333727642485542,"所谓百花奖的投票，应该是建立在过去一年（两年？没搞清楚，下同）内有关人员（演员、导演、编剧等）的公开上映的电影作品的基础上的。那么，海清和沈腾在这一年有什么值得称道的作品吗？如果有，没人投票确实离谱，因为一百个人里面总应该有人喜欢他们的；而如果没有，那没人投票不是很正常吗？
我好像耳闻沈腾有新的电影出来，至于票房如何、口碑如何就不知道了；而海清，没有听说过啊。
不能因为是否名气大、是否实力派，而没什么叫得响的作品（过去一年内）就要有人投票吧？总不能根据过去N多年前的“战绩”来给今年的奖项投票吧？",1,40,4,2022-07-31 08:56:17,来自上海,70206707790,种花家的绣球
7126397500650570533,以后沈腾还敢称百亿票房男神吗,1,7,1,2022-07-31 13:03:07,来自浙江,66651994494,泡芙0119
7126378576664085261,我觉得海清就应该是零票，实至名归。,2,194,4,2022-07-31 11:49:53,来自黑龙江,2277796070297807,灵敏精灵z0
7126363616512934687,0票很正常，对比一下女主和男主，德艺双馨、0绯闻、从不参加综艺捞钱，成天到处买房的消息，演员就是演戏不是靠那些负面的而成名的；这届电影百花奖非常棒，选出的得奖者满满都正能量，老百姓的奖👍,4,53,1,2022-07-31 10:51:44,来自北京,75634355870,多多妹2189
7126362033469588239,海清其实也很不错，但感觉演技有些千篇一律。,1,2,0,2022-07-31 10:44:57,来自贵州,2924348746773352,高原部落
7126301163570004776,"张译他们很少或者基本不上综艺，杠杠的实力派。沈腾好像综艺上得蛮多，貌似走了流量的线路。
当然，这只是一点愚见，不喜勿喷。",73,1118,9,2022-07-31 06:49:46,来自河南,4064259785371907,朱小漫
7126338728507048736,你看看是什么电影提名的，我和我的父辈，海清的角色我都忘了她演的是谁了，还要百度下，说明什么问题。沈腾在父辈里演的那个机器人，不是我说只是为了喜剧效果让他出演有票房吧，谁做机器人做成沈腾那样。。。肚子都遮不住了。机器人这段并不好看，我觉得人家不给票很正常。,8,77,5,2022-07-31 09:15:37,来自云南,51415313833,杜若zy
7126181501653287694,袁泉演技炸裂,19,240,3,2022-07-30 23:05:18,来自河北,62107881693,那谁
7126338765442401065,坐在那里投票的有几个是自己买票进影院看电影的，沈腾演技好不好听听王晶对他的评价就知道了，前天刚刚去看了沈腾的新片《独行月球》，没毛病，一定是暑期票房冠军，得不得奖对他来说一点都不重要，观众喜欢就好。[玫瑰][玫瑰][玫瑰],17,59,11,2022-07-31 09:15:07,来自山西,67956781810,宽宽仔仔
7126334919873807140,张译踏踏实实演戏，低调做人，口碑一直很好，演技也是越来越精湛，得奖实至名归。沈腾演些娱乐性片子，还是有票房的，但是做演员论演技，他还是需要很努力打磨的，比较浮夸，没有张译的细腻和沉淀，没有可比性,4,442,5,2022-07-31 09:00:49,来自广东,111636965413,831314111
7126422601274245922,看看《独行月球》的最终票房，就能明白一切，这世上没有无缘无故的爱，也没有无缘无故的恨。,0,5,0,2022-07-31 14:40:15,来自上海,75369228233,极墒观察
7126346244670243618,海清参选影片是什么？没看过,5,10,4,2022-07-31 09:43:36,来自山东,51279815501,喜灵子
7126372096904889092,朱媛媛票数最高为啥是最佳女配,53,125,15,2022-07-31 11:25:01,来自河北,52607061832,秦时明月eUL9
7126278468824449795,有7人投了弃权票，不然实票数与投票人数对不上。既然评委都不喜欢沈腾演的这部电影，那还提名干嘛？,42,317,10,2022-07-31 05:25:42,来自北京,93859896725,beijinghaidian35351
7126493856505545487,不喜欢看沈腾贾玲的作品,2,82,1,2022-07-31 19:16:46,来自天津,1697246439282791,一片清荷
7126410991424422656,不会给沈腾投票。他零票是实至名归，海青没当选也是合情合理。[赞],5,117,4,2022-07-31 13:55:30,来自江苏,111363507325,风姿卓越奶茶ph
7126322268669821707,看不懂沈腾为什么红？欣赏不来他的所谓演技，没奖才是正常,20,293,12,2022-07-31 08:12:01,来自广东,96850244883,喵喵喵喵猪
7126322146355462951,哈哈，说说投票的主体呗？有没有网络投票环节？如果没有，这就跟观众缘基本没关系吧，百花奖的评委应该都是专业电影人吧，这只能说明沈腾的电影在主流电影界需要打磨的东西还挺多的。张译的演技和职业素养还是可圈可点的。,22,206,3,2022-07-31 08:11:37,来自北京,73555496232,芳香展
7126300372801159936,沈腾的演技是在地质礼堂里打磨出来的…功勋演员…只能说演员遇到适合自己的好剧本不易…题外话：独行月球不错…,6,25,3,2022-07-31 06:46:37,来自辽宁,3775905766,水火1983
7126242777000035113,沈腾0票更加说明百花奖注重的是作品里演员的演技，而不是名气。,116,2705,18,2022-07-31 03:09:37,来自广西,4309708456857661,绿城锦绣
7126318975222448929,看了下得票数量，还是比较符合我心里演技排名的，张译实至名归，沈腾本来就是走的搞笑路线，有什么演技可言？只要搞笑就行了，又不是周星驰那种可以发人深思的类型,40,345,13,2022-07-31 07:59:07,来自陕西,102712835791,小淳宝宝
7126213572652401408,沈腾他们拍点娱乐性的电影还可以，这种奖项是给像张译他们这些实力派的，不适合沈腾他们。意料之中，看来群众的眼光是雪亮的[吃瓜群众],44,1947,19,2022-07-31 01:11:31,来自北京,5744513954,聪明的奶酪面包
7126291490057339660,好多人都说沈腾，贾玲是喜剧人，没演技，可是星爷也是拍无厘头喜剧的呀，那星爷的演技如何？如果他参加评选，会得百花奖影帝吗？,97,53,15,2022-07-31 06:13:15,来自黑龙江,88451810293,Angela
7126304573987537700,以前大家计较开心麻花电影的含腾量，为什么这个文章底下却对沈腾批评这么多？我不太理解什么转变的。就我个人而言我挺喜欢沈腾、吴京的电影的，另外沈腾的演技我也不认为在这几个人中是最差的，至少不觉得比四字差。,9,64,6,2022-07-31 07:03:14,来自陕西,57298051539,拭说
7126307642276512549,我觉得刘烨演技很好👍,3,22,1,2022-07-31 07:15:31,来自河南,5258520759,蕾蕾51009677
7126390608197174052,海清的演技？没感受到，感觉各个角色都很雷同,1,14,0,2022-07-31 12:36:25,来自江苏,62132031569,追逐梦想的兔娃娃
7126287608141251340,我觉得沈腾演技还是很一般，我看过他演的“李焕英…”，尽管这电影宣传得让它票房不错，我，作为一个七十多岁，那个时代的过来人，觉得一点不好看，不知道他们笑什么？我也上山下乡过，回上海后也再次奋斗…这部电影没啥内容，我是个很容易哭的人，看这电影我一点没哭也没笑…,77,719,23,2022-07-31 05:59:10,来自上海,108210399561,聪慧柳叶ny
7126336198217974541,如果海清和朱媛媛二选一，我选朱媛媛，朱媛媛的演技自然真实，海清有些用力过猛。,6,297,3,2022-07-31 09:05:43,来自北京,52192766478,珠儿149814013
7126337654870082335,很正常，我也较喜欢沈腾，但喜欢归喜欢，就事论事的说，票房高并不代表演技就高，也不代表一定就是很好。说明这个百花奖评选还较真实，这101位大众评审也还很有品味，实事求是，没有随波逐流，很公正。说明中国电影还有救，还有希望可在！,27,233,7,2022-07-31 09:11:04,来自吉林,6084029400,红运佳人788856789
7126347255904240399,正常啊，没什么奇怪的。只是他们在参评的作品中表现的不出彩。比如海清，在很多影视剧中的人物形象还是非常不错的。,0,27,0,2022-07-31 09:47:29,来自河北,61220983428,铃子170419874
7126301159488815908,沈腾的演技和张译不在一个段位。,51,772,9,2022-07-31 06:50:17,来自浙江,4310523666774347,里外不是1
7126330117466686241,海清和沈腾的演技真不如朱媛媛和张译的自然、精湛！！！,7,240,2,2022-07-31 08:42:09,来自广东,79206132487,一青
7126296489852797735,这两个演员说心里话我也一个都不投，海清演了几十年的戏了，演技还行吧，角色基本一样，有点审美疲劳了。沈腾我一点不喜欢太贫演小品时还看看，综艺和电影不看了。,19,864,13,2022-07-31 06:33:14,来自新疆,91634274109,用户墨竹ZJ
7126369482880189215,演员平时做人越低调就越受大众喜爱，最好的例子，袁泉就是这样一个人，平时从来不号加娱乐节目，又不做广告，她是当之无愧的好演员！,15,659,8,2022-07-31 11:14:26,来自上海,5261680963,华华51119503
7126561359076066084,腾哥，没关系的，不拿奖没关系，我今晚为了支持腾哥，去看了独行月球，真棒！支持沈腾～,0,0,0,2022-07-31 23:39:43,来自广东,110299598561,fannylaw
7126293023331779367,沈腾或得0票值得细品，至今无法超越的240亿票房。,10,25,4,2022-07-31 06:20:03,来自北京,2308625298897891,聪慧钢琴Tf
7126197037435093794,如果你在现场，会给他俩投票吗？欢迎大家一起讨论[送心],46,170,54,2022-07-31 00:05:34,来自江苏,3390549716383607,小鱿娱
7126377772050137863,会给海清投，但是不会给沈腾投票，不太喜欢沈腾出演人物，咋咋呼呼演技夸张,0,13,0,2022-07-31 11:46:53,来自新疆,109414334702,顽强葡萄W1
7126464465684054799,实至名归！袁泉，张译，朱媛媛都是真正的演员！,2,95,4,2022-07-31 17:22:59,来自北京,106525630730,梦幻百香果VA
7126463927240033059,不喜欢沈腾和海清。,0,7,0,2022-07-31 17:20:41,来自河北,84384647914,13102871340
7126340280659624742,袁泉和张铎实至名归，难道沈腾比什么易烊千玺还差吗？,2,29,0,2022-07-31 09:21:43,来自甘肃,4222563361235852,花伟玥
7126295980076499743,101位大众评委，应该过半数以上才能为男主角奖，38票，28票、15票、13票、0票，太可笑了哈。不严肃，不尊重演员，不负责任，更不尊重艺术。[抠鼻],6,41,12,2022-07-31 06:30:00,来自北京,1895213010269021,奇幻可乐Kn
7126383363673424675,张译和袁泉名至实归，都是非常棒的演员！,1,86,1,2022-07-31 12:07:57,来自江西,637349578422955,猪元气
7126273883027555087,海清在这次百花奖最佳女演员也是0票,12,89,7,2022-07-31 05:05:17,来自北京,2101881948346840,快乐风筝FC
7126319304832123682,从来不喜欢看沈腾的电影，小品也尬笑，一点都没赵本山小品那种捧腹大笑的自然，不知道为什么红的,13,175,5,2022-07-31 07:59:40,来自广东,50286607947,A小碗儿66
7126432939977474857,个人觉得，沈腾演技有点过誉了,1,32,3,2022-07-31 15:20:23,来自云南,111136471544,歌声如我
7126360249330172684,公正！你好李焕英那部电影票房先放一放，电影本身是真的距离电影这两个字还差太远了[呲牙]就是个加长版的小品，个人意见，不喜勿喷！,60,615,14,2022-07-31 10:38:02,来自上海,377835176601339,啸啸2020
7126303715824599815,还是要有实力说话，张译实至名归。沈腾有观众缘，但演技确实和前面的几个还是有些差距的。好的电影看过一遍还想看，因为还没看够，有的时候再看一遍会有会意的感觉，因为看一遍是故事，看二遍是冲着里面的人物去的。看三遍是因为里面的台词让你意犹未尽。喜欢看一些好的侦探片，就是里面的故事人物让你意犹未尽。,7,298,10,2022-07-31 07:00:00,来自上海,63343995033,诗意青山W3
7126471000187077410,贾玲估计是大众评委从安慰角度给的奖。毕竟是东道主，而且一个奖都没有得过。,2,5,0,2022-07-31 17:48:14,来自上海,79881655495,疾飞马
7126294654928454408,评委除了演员的演技外，我觉得也有自身喜欢的原因，如果我是大众评委的一员，我会投给海清一票，演技好坏我不懂，只是个人喜好而已。,1,8,1,2022-07-31 06:25:01,来自辽宁,2841598360857624,霞姐爱瞎唱
7126223529573974822,有些可以说说笑笑娱乐大家，但难登大雅之堂，可能好多影评人对笑星的评价吧。近几年小品人都进军做电影，综艺一打开都是这些人，赚得盆满钵满。让多少电影圈里科班人和导演叫苦。有票房不能说有演技，可能舞台剧上需要夸张表演，但电影不一样吧。连周星驰没奖，他是0没什么出奇的，也真心没觉得他哪套电影好看。张译演技没得说，默默做好自己工作，实至名归,19,761,14,2022-07-31 01:55:25,来自广东,1592535477400915,诗意金桔7a
7126285834655302434,沈腾这几年一直在上综艺，感觉太油腻。电影是有艺术价值的，不光是高笑，说明评委老师是有艺术品味的，是公平公正,35,1691,12,2022-07-31 05:50:43,来自广东,1362996568272136,豁达菠萝nK
7126519042281702185,专业的事就得专业的人来做。袁泉的奖，实至名归。,0,0,0,2022-07-31 20:54:17,来自河北,1015555728875607,华华丽丽的风
7126447479767466787,零票实至名归,0,5,0,2022-07-31 16:16:46,来自浙江,95931539987,ff20811
7126450085991007013,袁泉，张译太棒了两位才是真正的演员,0,1,0,2022-07-31 16:27:43,来自浙江,95733040670,青草地
7126392250820903683,朱媛媛实至名归[赞],0,18,0,2022-07-31 12:43:09,来自辽宁,24840237490,正能量葡萄0kG
7126210011185414920,沈腾的综艺挺好看，电影一部也没看，我也不知道为什么[呲牙],41,186,9,2022-07-31 00:59:43,来自广东,101720057279,萬瑞安参茸滋补
7126474687810978599,讨厌沈腾和贾玲的人真多,1,12,0,2022-07-31 18:03:18,来自吉林,2405336698337076,新天龙
7126276715026367272,贡献票房的是看热闹的，投票的才是行家！评审还是有品味的，这下放心了,14,679,14,2022-07-31 05:16:35,来自河南,62464226468,我爱我家84615
7126281712803578662,这几个提名人里！他0分实至名归,15,549,11,2022-07-31 05:36:44,来自天津,5951234147,青涩奶酪5
7126373541058183950,"媛媛和袁泉实至名归，实力取胜！
刘烨守岛人演的很棒，可惜失之交臂。张译赢在题材上，其中有点用力过猛，其演绎最好的是我和我的祖国，无声胜有声",4,173,5,2022-07-31 11:30:18,来自黑龙江,104625674334,之乎者火
7126508235649352479,"沈腾,贾玲的电影我从来不看",2,25,3,2022-07-31 20:13:02,来自广东,954014616259827,吉祥映月
7126364585259139852,朱媛媛袁泉，绝对实至名归[比心],10,650,7,2022-07-31 10:56:03,来自上海,1547752766977335,徒手无剑cc
7126198429680288519,这几个提名人里！他0分实至名归,38,1447,27,2022-07-31 00:12:27,来自山东,62243432039,缘分176802840
7126411104322536226,海清挺喜欢她的，有演技，双面胶和蜗居，演员的挺好的,3,30,5,2022-07-31 13:55:47,来自广东,103941820109,嘟嘟嘴卖萌了
7126466685548282658,女演员中的演技，我最佩服的是蒋欣，狠的温柔的，好的坏的哪种角色都能拿捏的十分到位且又不做作！蒋雯丽的演技也不错！,2,6,1,2022-07-31 17:31:19,来自湖南,399841377915203,快乐轻柔的风
7126392596691649280,搞笑只要是有包袱有笑点，谁演观众都能笑。而演技是要靠实力的。而百花奖是专业性很强的奖项，不看流量和名气，看中的是演技，这就是权威性！这也让观众更信服百花奖的含金量！无须质疑！,1,10,1,2022-07-31 12:43:49,来自北京,1900415420210575,睿智的酷鼠
7126343617744323328,大家的眼睛是雪亮的，张译，袁泉，颜丙艳等都是演艺界的一股清流，是真正的演员，演技派，对艺术有追求，不是整天上综艺，去赚钱的人。,0,16,0,2022-07-31 09:33:47,来自北京,56717502779,躺着看星星3
7126289493363786509,票房难道就不能假了吗？沈腾，一个令人难以相信的，比如冬奥会期间的广告，怎么就是连广告词都念不畅和准的沈腾呢？实事求是地讲，沈腾只是个数字沈腾，更是个背景沈腾，否则难以理解呀！,2,25,1,2022-07-31 06:05:45,来自浙江,63196233422,象山之峰
7126476329721266947,这次百花奖的评委有水平,0,3,0,2022-07-31 18:09:31,来自上海,2133478418421076,清闲的海燕9D
7126548323225666345,给海青可以，不会给沈腾因为他的演技不好笑，跟电影电视剧演员不能比，,0,1,0,2022-07-31 22:48:15,来自浙江,58827263942,清爽原野sr
7126331336331150083,海清演技好，至于沈腾张小斐宋小宝这些演小品的看着都尴尬，还是喜欢那些老一辈的 比如赵丽蓉，巩汉林 冯巩,3,105,3,2022-07-31 08:47:00,来自湖南,52373213166413,热情的风铃ce
7126311652219159300,袁泉居然有奖?,21,16,18,2022-07-31 07:30:52,来自湖南,12845061831,单翅鸟14
7126528610462548736,好的演员让观众记住的是角色，而海清和沈腾的表演个人色彩太浓烈，似乎时刻提醒观众，我是海清，记住我！我是沈腾，别忘了！[呲牙],0,4,0,2022-07-31 21:31:31,来自河南,53136291611,眷瞬的小跟班
