7126331079229358863,这说明投票的观众水平高，得奖的演员实至名归,1,179,3,2022-07-31 08:45:20,来自新疆,5447299457,老南瓜的秋天
7126384999523287816,一直不喜欢海青，总是瞪着眼，用力过猛的样子。,0,28,0,2022-07-31 12:14:33,来自山东,61238858783,狂奔的蜗牛爱旅行
7126402301241590563,海清和沈腾的演技真不如朱媛媛和张译的自然、精湛！！！,0,9,0,2022-07-31 13:21:34,来自山东,99180670144,王昭瑢
7126386784300172036,有沈腾和海清的节目和电视会马上转台，肯定不投,0,5,0,2022-07-31 12:21:45,来自北京,92541588694,柠檬70928
7126372552121303849,喜欢现场评现场揭晓。没有了内定。选出真实水平[赞][赞][赞][赞][赞][赞][赞][赞],7,181,5,2022-07-31 11:26:11,来自河南,59498677363,天山上的来客玉石加工
7126352196471882536,唯一一届不被吐槽的奖项，主角配角都实至名归[赞],7,746,13,2022-07-31 10:06:42,来自四川,7012512162,毛毛123445331
7126532229240963870,最最实至名归的一次百花奖,0,0,0,2022-07-31 21:45:54,来自山东,110856022960,智慧橙子Ah
7126311013183619853,如果沈腾和张译，肯定投张译。这就是沈腾0票的原因吧,8,388,6,2022-07-31 07:28:00,来自山东,6501679359,背影留给过去
7126292473416745741,我喜欢海清，她的表演无懈可击，演什么像什么，不做作，为艺术舍得投入，至于为什么零票？估计大家认为得奖次数太多了，想换换新面孔吧，不过绕来去还是老面孔！其实公道自在人心。,6,78,9,2022-07-31 06:17:02,来自湖南,5784272017,玩心玩味
7126375469603111719,朱媛媛真是实至名归，演技真是好,3,137,7,2022-07-31 11:37:53,来自山东,97342089547,肖有容88
7126464823852008227,如果我在场肯定会投海清的一票，但不会给沈腾投票。,0,8,0,2022-07-31 17:24:03,来自河南,58553748223,金谷子1219
7126279776516145950,不至于，评委和观众不一样心态的，既然提名了为啥又0呢！,4,31,5,2022-07-31 05:29:26,来自河南,2735278302,云中锡
7126360234028843811,沈腾和贾玲的综艺还是很不错的，但毕竟这是电影奖项，对手又是非常好的演员。喜欢袁泉、张毅、朱媛媛、刘烨。,5,122,5,2022-07-31 10:37:52,来自北京,105228854871,猫奴芝麻
7126205245541172000,贡献票房的是看热闹的，投票的才是行家！,11,412,12,2022-07-31 00:40:01,来自北京,3755567729621296,北京玉竹苑主人
7126527012344808233,这次百花奖凭的就是作品和演技，很好！,0,0,0,2022-07-31 21:25:21,来自辽宁,84703998967,ninaluowa
7126402287400157993,张译实至名归啊！沈腾常参加综艺，我觉得他的演技不怎样啊,0,1,0,2022-07-31 13:21:27,来自广东,91672063525,顾娱宸
7126287642111001375,沈腾和海清有演技，但就在这两部电影中的表现，给零票没有委屈他们！,0,183,5,2022-07-31 05:58:21,来自安徽,66654218695,风中的歌6015483769
7126392159040963365,公正的很，沈腾和贾玲小品还行，但在演员的技巧和水平上确实比不过朱媛媛和袁泉。,10,188,3,2022-07-31 12:42:18,来自北京,80348911189,万事如意大吉大利A
7126350754935341862,网上看到的贾玲沈腾全是综艺节目，他们是转移路线了？,4,79,3,2022-07-31 10:01:09,来自陕西,68408206851,生如夏花MVP
7126292284064482080,海清演的总觉得给人烦躁的感觉,19,488,11,2022-07-31 06:16:46,来自四川,51704876723,钰说时光
7126407728863888162,怎么会有0票,2,1,0,2022-07-31 13:42:41,来自河南,35630634242843,表里如一自信满满
7126407861148042019,不选海清，还是朱媛媛演技好自然，真实！,0,8,0,2022-07-31 13:43:05,来自江苏,1811590594968733,头条洋仔
7126465445099651847,朱媛媛74票怎解释？袁泉只有48票？？？？,3,1,0,2022-07-31 17:26:55,来自江苏,1767640106284248,英明果断原野fi
7126519512719672064,沈腾提名的那部电影是几个故事，完全没发挥出来沈腾的演技[捂脸],0,0,0,2022-07-31 20:56:17,来自江苏,75554950244,__还是太年轻
7126370215029408552,我会投海清一票[赞],2,2,1,2022-07-31 11:16:55,来自天津,598589219544431,坦荡清闲的星空IX
7126513475337470755,不会。他们演技不够,0,1,0,2022-07-31 20:32:43,来自黑龙江,4287685626440699,楼船夜雪1970HL
7126446646967632673,投海清一票,1,1,0,2022-07-31 16:14:26,来自广西,91982365721876,素时锦年YJ
7126348259383509798,不会投沈腾和贾玲，从不看他俩的作品，也不认识。,0,103,1,2022-07-31 09:51:28,来自江西,2366578533868056,WP
7126389346835432232,海清怎么会是0票？,4,7,6,2022-07-31 12:31:05,来自江苏,5906299146,简约好
7126538394435453696,10个亿啊10个亿……,0,0,0,2022-07-31 22:09:25,来自新疆,97840759140,凡求至德
7126320101187699456,如果我在现场是不会给沈投票的。,0,29,0,2022-07-31 08:02:45,来自山东,63024344591,翠琴206439449
7126209094125536034,独步月球，沈腾演得不错的（可以说一人扛起了整个影片)。这部科幻片应该是中国科幻片天花板。特效也不失真，和我们看到的月球传回地球的影像差不多的。用心制作的影片[赞],43,65,22,2022-07-31 00:53:44,,1305862608257827,竹妃格格
7126393445129667362,我可能会投海清 不会投沈腾,0,3,0,2022-07-31 12:47:02,来自安徽,93160845793,极速西柚wq
7126338877140615970,张译说过他从不会参加任何综艺节目。不像沈腾参加各种综艺，就是搞搞笑，没有什么演技。演员要爱惜自己的羽翼.,0,15,0,2022-07-31 09:15:32,来自河南,6679982735,二手车鉴定评估张小二
7126322365000794915,如果每个人只有一票，我肯定也不会投给沈腾和海清。其他人参赛的电影角色我都有印象，这两人在我和我的父辈里面演的什么我都记不得了，拼接电影内容太少忘了。。。根据电影角色投票，不是让你根据名气投票。,2,135,4,2022-07-31 08:11:41,来自江苏,2906729668149752,浅浅ssqq
7126268264489616159,0票当之无愧，电视节目嘻嘻哈哈，不爱看……,3,33,1,2022-07-31 04:47:18,来自北京,52508583936,真诚饺子OL
7126402650601784077,沈腾自从参加了综艺节目，口碑大不如从前。看看张译，吴京，他们从不参加综艺节目。,1,8,0,2022-07-31 13:23:20,来自山东,1437755431717368,冻冻鱼
7126405920904790819,我觉得沈腾零领票是没啥意外的，最近两年沈腾都把主要精力放在了综艺上，过度的消费是他已经无暇顾及电影，也让自己的形象过度的消费，让观众视觉疲劳，如果沈腾把自己定义为综艺咖，那无可厚非，例如杨迪！如果沈腾还把自己定义为电影人，那他就太不爱惜自己的羽毛了，他现在的羽毛已经被资本压榨到一根不剩，怪不了别人，只能怪他自己贪得无厌！,1,2,0,2022-07-31 13:35:35,来自黑龙江,82249326941,欢快海洋G
7126477735740441377,论演技，这评分不意外。,0,1,0,2022-07-31 18:15:19,来自广东,58833957798,洁静的世界
7126179292451078945,拼盘电影就不应该提名,5,240,0,2022-07-30 22:57:13,来自安徽,5490137993,车行发生的那些事
7126392872647770894,虽然0票有点儿出乎意外，但我咋觉得这个结果特别公平、公正、公开呢[中国赞]恭喜袁泉张译侯勇朱媛媛[比心],0,45,0,2022-07-31 12:45:25,来自山东,23104207649,自由自在qt
7126461417837888256,我不会投他俩！票房跟演技无关！,0,5,0,2022-07-31 17:10:50,来自四川,3689654101,萍妞姐
7126389797018993438,沈腾，不错的搞笑小品演员，夏洛特烦恼最棒，其他的一般般！,0,1,0,2022-07-31 12:33:35,来自四川,2088684486929854,苍山如黛人生如梦
7126506870289875748,会投海清！实力派演员！,0,0,0,2022-07-31 20:07:41,来自河北,69693559229,哈喽奶奶627
7126417439533073192,喜欢朱媛媛，自然，不做作，标准的青岛嫚儿[赞][赞][玫瑰][玫瑰],0,2,0,2022-07-31 14:20:19,来自山东,96458381937,智勇双全荷叶C
7126465088743162661,喜欢海清，直爽，不做作,0,3,0,2022-07-31 17:25:32,来自重庆,1165137886841933,孤独心ludxp
7126338741333033762,如果只有一票，我也肯定投张译或袁泉。实力有目共睹，当然海清演技也很好，但是和袁泉比，略逊一筹。,0,20,0,2022-07-31 09:14:54,来自湖北,4318511911403998,蜜薇琪
7126352095703597865,这就有点尴尬了[捂脸],1,1,0,2022-07-31 10:06:17,来自河南,1847649232227180,真假大专家
7126405909743436575,张译实至名归[赞][赞],0,1,0,2022-07-31 13:35:44,来自河南,51036822609,衣雅优柳柳姐
7126552358552765195,我投朱媛媛，能融入每个不同的角色，演啥像啥，海清演啥都像海清，个人意见！,0,0,0,2022-07-31 23:04:51,来自广东,105793753736,马虎小姐姐的日常vlog
7126472109597541154,大众都有各自喜欢的演员，袁泉是靠实力演技获得影后！网友们都说没有水分[赞][赞],1,1,0,2022-07-31 17:52:27,来自安徽,3158271885071220,才思敏捷的娱乐大咖
7126398705393304352,得奖的男女主都是那个浊圈里的清流 ，没有绯闻，认真演戏。实至名归！[赞][赞][赞],0,31,0,2022-07-31 13:08:12,来自浙江,2695647499662571,魔法女汉子
7126503375982199566,如果海清和朱媛媛二选一，我选朱媛媛，朱媛媛的演技自然真实，海清有些用力过猛。,0,2,0,2022-07-31 19:54:12,来自广东,443854913551367,冰儿yoyo
7126309515062248223,坚决不会投海清，她演的角色，不知是本色表演，还是永远是她自己，角色给人印象是矫情，自以为是，焦虑.....，看见她就换台。最喜欢梅婷和宋佳，何赛飞！希望她们别整容。,8,192,7,2022-07-31 07:22:32,来自北京,100455784430,洞见123
7126293588661158693,沈腾得票为0，感觉大众评委眼光真不错；但吴京还得13票就不太正常了，如果吴京与沈腾并列0票，会感觉大众评委更权威。,10,84,7,2022-07-31 06:21:34,来自黑龙江,4455463209,寻美千百度54
7126216098407793447,海清这几年的演技有点用力过猛了，她有明显的年龄焦虑，后面越发不自信了。,9,313,14,2022-07-31 01:24:52,来自广西,61567725469,铁扇凹凸曼
7126553384882635527,这俩我都不会投。,0,1,0,2022-07-31 23:08:47,来自江苏,51564429369,宁玉5691
7126461441259422464,没有深度的电影不会得奖。,0,0,0,2022-07-31 17:11:15,来自江苏,3685153718153095,云淡风轻
7126291739690107678,有沈腾我马上转台,28,938,9,2022-07-31 06:13:59,来自四川,108014878220,素娥390
7126541585047307049,得奖的没得奖的，都是实至名归。,0,0,0,2022-07-31 22:22:07,来自河南,101892889378,用户Hyjj
7126431680143000350,沈腾0票，真的出乎意料，怎么回事？,0,0,0,2022-07-31 15:15:55,来自江苏,580982412673384,风风雨雨都是春
7126286523397325582,有些演员得意忘形，大群心中太有数了，要投二人谁行，只有海清，如人数多了，要看哦。,1,31,2,2022-07-31 05:53:28,来自江苏,106787899630,柳蔚琴
7126284636158083877,不欣赏沈腾,11,243,6,2022-07-31 05:46:55,来自山东,3404566470857992,王金牌月嫂
7126490976121586446,观众的眼睛里雪亮的。,0,1,0,2022-07-31 19:06:02,来自吉林,6133983174,吉祥80370191
7126471955280233250,你发的这票数容易引起误解吧，这些票是分别在男丶女主角，男丶女配角，最佳导演，最佳电影等分别投的。比如沈腾0票是在5个提名男主角中排第5，0票。,0,1,1,2022-07-31 17:51:45,来自吉林,54096328371,吉人自有天相1209
7126418878984733444,沈腾和海清一张选票都没有确实存在问题、他们的电影没有获奖并不感到意外、评委眼光不同、沈腾的喜剧电影同质化太严重，作为喜剧演员他的电影创作有局限性。海清有演技、但是缺乏有影响力的作品、电影成就没有电视剧突出，她需要好剧本和好导演发掘她的潜质。电影节获奖本来就有随大流特色和政治宣传因素。没有拉票只不过是说辞罢了。,0,1,1,2022-07-31 14:26:39,来自上海,3904141538,孤帆远影烟波江上
7126395209713730312,海青还好吧！沈腾我是真不喜欢！他拍的电影我都不喜欢！,0,5,0,2022-07-31 12:54:28,来自陕西,6254966932,乐在潇遥
7126397691495908104,李易峰和杨颖得了这个奖，这个奖的公信力就塔了。,3,4,0,2022-07-31 13:03:56,来自北京,106688545019,深蓝与光
7126214592417612558,评审还是有品味的，这下放心了,3,399,8,2022-07-31 01:16:46,来自河北,25974857235,博岩崖
7126389922189787916,不喜欢沈腾,0,6,0,2022-07-31 12:34:24,来自北京,1763271183176355,自若阳光Ew
7126310222385922851,"我从来没有喜欢过海清[捂脸]表演浮夸。更
不喜欢沈腾，大众的眼光是雪亮的",0,62,2,2022-07-31 07:24:36,来自江苏,99030020630,春春16054
7126334183525335843,跟张译袁泉比，他0分实至名归[泪奔]除了演小品上综艺，电影电视剧他不行吧[泪奔],0,12,0,2022-07-31 08:57:06,来自福建,3506407558,一念向北一
7126519589764498210,虽然我肯定会优先去看沈腾的电影，但是要说演技他肯定得往后排。,0,0,0,2022-07-31 20:56:28,来自上海,1934091941,喵先森喵
7126308430440432420,我喜欢海清，不喜欢沈腾。,0,13,1,2022-07-31 07:18:11,来自吉林,4441066877,山鹰40830600
7126424261555684128,101名大众评委是怎么选出来的！,1,0,0,2022-07-31 14:47:27,来自山东,62121338357,运源177428056
7126216676781294377,敢于公开票数就是进步[灵光一闪],8,340,2,2022-07-31 01:23:46,来自广东,85075876969,正义的深圳律师
7126407910451790600,不管他人有多优秀，但是我本人不喜欢，我认为只有真正的科学家和劳动者[赞],0,0,0,2022-07-31 13:43:40,来自北京,5454539515,完美奶茶eK
7126519796463862543,海清和沈腾的演技真不如朱媛媛和张译的自然、精湛！！！,0,1,0,2022-07-31 20:57:17,来自上海,93231082413,老男人7366
7126319922741412642,从来没觉得沈 马 他们演的影视类作品好看 不知道为什么[捂脸][捂脸],0,17,0,2022-07-31 08:02:07,来自上海,6713781240,A轮学堂
7126352805329273613,还是金马奖和金像奖含金量高。,9,28,14,2022-07-31 10:09:06,来自广东,86237644431,哭泣的农民1978
7126513815009182505,我从来不认为喜剧更难演,0,1,0,2022-07-31 20:34:05,来自黑龙江,4287685626440699,楼船夜雪1970HL
7126541562032767776,"沈腾:任何奖项都不如票房大卖
提名不提名的无所谓 只要自己的电影大卖 名不名的无所谓",0,0,0,2022-07-31 22:22:18,来自河南,1908353144,柯伊伯带P6Q58
7126290219938841385,沈腾属于娱乐搞笑热闹派，没有沉淀下去，演技还是比不上实力派的张译。评审团有水准，赞下！,1,76,3,2022-07-31 06:07:35,来自湖南,71889095788,六月荷叶zl
7126350662963069696,"你可曾看见张译、袁泉上综艺捞金？
你可曾看见沈腾、黄渤、孙红雷频繁出没综艺节目后就再也没有什么像样的作品拿出来？
专业的演员一旦不能专注于本职，一旦沉迷于金钱，基本就废了。
像李雪健、王志文、李保田这样的戏骨越来越少了…
不接广告，不上综艺的名演员才真正能配得上“德艺双馨艺术家”的称号。
能做到这一点的演员
演艺圈还真没几个",742,4416,4,2022-07-31 10:00:47,来自江苏,4060164071,homeyes
7126305305897616132,足以看出大家对张译的肯定和喜欢。众心所向，实至名归！,0,38,0,2022-07-31 07:06:23,来自四川,70455466817,言外有声
7126452236745491241,沈腾贾玲要是拿奖，那就是不公平了，演个小品咋咋呼呼的，演电影电视剧有人看，票房卖得好也资本炒作的,0,13,0,2022-07-31 16:35:08,来自浙江,3372896243683480,顺其自然的好吧11
7126522800164684581,我会给沈腾和海青投票的,0,0,0,2022-07-31 21:09:17,来自安徽,2563671190678211,愉悦的橘子Yu
7126513127474266918,我喜欢张译和朱媛媛。两个人的演技都好，张译这些年总看着还不老呢！,0,0,0,2022-07-31 20:31:58,来自辽宁,598600065224707,朴实湖泊4L
7126397936015459105,张译实至名归，我很喜欢的实力派演员，演技好，又没什么黑料,0,19,0,2022-07-31 13:05:24,来自四川,52426339802478,红尘俗世399
7126548416708199209,朱媛媛，袁泉，观众喜欢才是最佳演员！[赞],0,1,0,2022-07-31 22:48:32,来自北京,3795139623924148,靖欣Xi
7126544334761280291,估计这种奖项，不大会颁给喜剧演员。,0,0,0,2022-07-31 22:32:42,来自河北,681349598683368,怪萌女青年
7126220313498600203,沈腾的电视剧我一部都没看过,18,779,14,2022-07-31 01:41:23,来自广东,6369226819,潇洒远山ia
7126382859581358863,张译，袁泉，实质名归,0,33,0,2022-07-31 12:06:02,来自北京,4475582026,摇摇晃晃1116
7126518904188928768,可能是弃权了吧[捂脸],0,0,0,2022-07-31 20:53:54,来自广东,70364942456,ajxixi666
7126540272288826152,会给海清投，演的挺好的,0,0,0,2022-07-31 22:16:53,来自宁夏,6990092828,hlh612101
7126304277944877865,不会投海清，还是很喜欢朱媛媛。,0,32,1,2022-07-31 07:01:22,来自美国,690143861146680,Anny200962
7126501042212340493,演技最好没有好的剧本也无济于事，这俩人近两年确实没什么印象深刻角色出现。,0,0,0,2022-07-31 19:45:04,来自江苏,16347200250,开朗溪流lt
7126413328515875599,不会投沈腾，海清的票。,0,4,1,2022-07-31 14:04:33,来自湖南,3923502698598014,分秒必争光束2
7126436599080338212,喜欢袁泉张译他们演得就是好支持,0,10,0,2022-07-31 15:35:08,来自天津,593384960700055,正直葡萄26
7126489586549293831,问题是观众评委是怎么组成的,0,0,0,2022-07-31 19:00:45,来自山西,4256916775379283,清闲的孔雀d
7126441006412661512,虽然中国医生不是袁泉最好的作品，但她在里面的演技，得奖实至名归，朱媛媛那更不用说，演技杠杠的，这两个奖项让我对百花奖又有爱了[得意][得意],0,11,0,2022-07-31 15:51:57,来自江苏,2484533070669059,勇往直前的荠菜饺子
7126392239882142502,朱媛媛实至名归[赞][赞][赞][赞][玫瑰],0,12,0,2022-07-31 12:43:12,来自北京,71499008357,勇者松鼠Se
7126318175687328545,就事论事，看情况，要对比。没看过沈腾的作品，印象中属于搞笑的，不喜欢。,0,15,0,2022-07-31 07:56:00,来自新疆,98988004523,无忧无虑的蓝天啊
7126514664854291235,我会扣投海清，不喜欢来媛媛。,0,2,0,2022-07-31 20:37:16,来自上海,52217124443,好彩陆陆
7126321923650880263,沈腾的电影看的太尬了，我个人不太喜欢。,0,38,1,2022-07-31 08:10:21,来自湖北,3874332331738420,薛木子
7126460137115599656,这届百花奨不是水奨了，四个演员都是演技派而且是观众喜爱的演员，特别是袁泉和媛媛她们都是像清泉一样干净透明，实至名归，並祝福她们今后为百姓献出更多更好的作品！,0,14,0,2022-07-31 17:05:53,来自四川,6672273466,老妈103930621
7126480687033041668,同感，真的很讨厌贾、沈二人,1,3,0,2022-07-31 18:26:46,来自云南,141189335750467,幸运白云fMc
7126321277287072527,沈腾O票意料之中，真没什么演技,6,371,4,2022-07-31 08:07:05,来自浙江,105956448116,阳光朋友1964
7126271456362726176,再怎么样，也不可能0票呀，咋回事呀,0,2,0,2022-07-31 04:58:24,来自湖北,101486477061,要啥自行车com
7126464539373306638,上综艺节目多了，演技没有深究的缘故吧,0,1,0,2022-07-31 17:23:30,来自广东,104007319784,对影成三人L
7126297497525814051,特别不喜欢看沈腾的综艺节目，太拼闹的慌[衰],4,535,10,2022-07-31 06:35:27,来自北京,91719483545,TeacherTang26
7126361202607063842,大众评委代表了大众，0票说明问题。沈腾不错的小品演员，喜剧电影看看也不错。。我的女神实至名归。。,20,301,24,2022-07-31 10:41:36,来自辽宁,2208288591587597,细腻德鲁5M9
7126489424799941416,海清是众望所归,0,0,0,2022-07-31 18:59:35,来自河南,72693603657,杨利涛防雷减灾
7126543993441764131,从来就没喜欢过沈腾和贾玲的作品风格,0,1,0,2022-07-31 22:31:25,来自四川,1644482938289840,风中行者100
7126353109861450526,沈腾和贾玲不适合电影，他们搞笑演小品还是不错的，袁泉 张译都有很深的演艺功底，实至名归,4,461,15,2022-07-31 10:10:19,来自北京,4460062545285608,雪儿lx
7126310941129491236,张译实至名归，就是实力演员，并且不上综艺，评自己的演艺能力得到大家的认可,0,16,0,2022-07-31 07:27:42,来自山东,53944807563,jyzg123456789
7126233706599777059,零票有点过分了，从概率上来说，101位大众点评没有一个人投有点不合理。再说了投其他人的票加起来也没有101，难到是有人对这几个人都不满意弃权了[捂脸],10,47,4,2022-07-31 02:33:17,来自安徽,77213486863,解忧99
7126535211067720461,我也喜欢张铎#张铎#,0,0,0,2022-07-31 21:57:30,来自河南,108699294451,双层防烫
7126337046851175209,不会给沈腾投票，那个电影他的演技好浮夸！果然，周星驰只有一个，不是哪个人都能接他的班！,0,99,2,2022-07-31 09:08:20,来自湖北,62457698575,奇妙光束fq
7126305287828472616,袁泉获奖是意料之中，人家那是真实力！,0,105,0,2022-07-31 07:05:20,来自广东,57498214567,悠闲友爱云朵
7126386717665936128,不喜欢沈腾，,0,3,0,2022-07-31 12:21:03,来自俄罗斯,50311547062,可爱的毛球子
7126441744908501790,袁泉和张译俩位评上百花奖男女主角，我们非常赞同，这次的评委是公正，公平，让广大观众心服，口服。[比心][比心][比心][玫瑰][玫瑰][玫瑰],0,20,0,2022-07-31 15:55:06,来自浙江,2739585647379628,gxoi
7126414187073045284,张译确实是实至名归,0,0,0,2022-07-31 14:08:16,来自湖南,100020452225,爱小颖的阿峰
7126382294755492639,好演员都应该像张译袁泉一样演技好做人低调。,0,69,0,2022-07-31 12:04:26,来自内蒙古,2665691082139640,gyhaaa
7126450391725720355,袁泉演技很棒！她老公夏雨的演技也非常牛！,0,6,0,2022-07-31 16:28:03,来自山东,2770373965519384,大胖狗的妈妈
7126406130280350500,张译确实演技很好。沈腾也确实是票房担当。,0,0,0,2022-07-31 13:36:49,来自山东,3721840271,老迟
7126354920932557603,没听说过观众投票的专业奖项,1,0,0,2022-07-31 10:17:23,来自北京,91649939801,南方风子12355
7126510931299222272,沈腾与这五位提名人不在一个演绎平台。前者以娱乐小品见长，后者以影视表演为专业。虽然沈腾和范伟同是小品出身，但是，范伟触电远比他早的多，演技远高于沈腾。一炮走红的演员越来越少了。,0,0,0,2022-07-31 20:22:53,来自北京,55217809820,明明白白一颗葱
7126391631607677711,小品就是小品。专业的奖项还是应该给专业的演员才是公平,1,63,3,2022-07-31 12:40:09,来自山东,1679659025579704,分秒必争星球kn
7126315012855153442,我想说观众的眼睛是雪亮的。[赞],0,35,1,2022-07-31 07:42:45,来自河北,5231171109,沐沐飞
7126394380361515780,朱媛媛演技相当自然真实！袁泉跟她比都还差很多,0,11,0,2022-07-31 12:51:36,来自四川,1068362775921735,可爱的用户lq
7126479208443806505,我这两天都在发沈腾0票这件事，我想沈腾自己心里也不好受，也挺尴尬的。要是沈腾能把喜剧演好那也不错，但他演的都是一些含金量不好的喜剧，记忆点也不高，笑过之后就会慢慢淡忘，我觉得再这样下去他给我们的印象会越来越淡,0,1,0,2022-07-31 18:19:50,来自浙江,3738781574248932,咕噜咕噜
7126269400759927566,给沈腾一票，不喜欢海清,3,46,27,2022-07-31 04:51:19,来自吉林,6092096328,水瓶jjj
7126326745581765407,"大众评委是谁选的？求解？
记得八几年，每份杂志带一张选票，剪下来，在候选人中，写下自己心目中的得奖人。然后封好寄出。邮资总付。不必贴邮票。
当选人基本与自己选的差不多。
当选人可获几千万张选票。
那时的百花奖才真是：大众百花奖
今天应取消：大众两字只留百花奖！",3,17,0,2022-07-31 08:28:50,来自黑龙江,103215154141,猎人先生
7126308910809613089,支持友友[赞],1,1,0,2022-07-31 07:20:21,来自山西,95549404530,豆丫看点
7126395857112810248,得0⃣️票的绝对是实至名归的，投票人代表了广大没有参与投票人的❤️👍😆,0,59,0,2022-07-31 12:56:52,来自广东,11293617612,Jinmao168
7126367945554707239,百花奖最早是由大众电影杂志组织，由观众投票选举产生的，最能代表普通民众的喜爱。现在的百花奖是由谁出面组织的，现场的大众评委是如何产生的，我不太清楚。这届百花奖现场由大众评委当众投票产生，基本符合大众的喜好，评选结果也比较公平公正。,4,29,3,2022-07-31 11:09:02,来自江西,71891521158,昌南月池
7126525061347181324,专业的严谨不是一般人能理解的，而搞笑，一笑了事容易，要做到能成为经典到永恒，则非常之难！95％的人，都很容易从坊间茶余饭后的谈资中获得，而沈腾做到了这点，在加上繁忙的商演和大量的广告注定他与奖项无缘！,0,0,0,2022-07-31 21:18:20,来自福建,3940734286,黑夜白话
7126386731271865088,没有喜欢过海青，从蜗居开始知道她[我想静静],4,21,1,2022-07-31 12:20:59,来自四川,936437391048078,跳舞的丁丁猫
7126346890341335848,不管别的，获奖的都是很少参加综艺专心做演员的，这个百花奖评的公道。,1,51,2,2022-07-31 09:45:59,来自山东,106731602252,物语行者
7126544486917980961,海清还行。沈腾就算了吧！综艺会毁了他！,0,1,0,2022-07-31 22:33:53,来自黑龙江,62933560021,善行天下
