7126430786798371584,沈腾的演技是尬，所以不投,0,2,0,2022-07-31 15:12:07,来自北京,78373611823,偶遇浪漫1
7126207269003445022,沈腾 确实不够资格。海清 还可以。,9,212,3,2022-07-31 00:47:20,来自广西,2189835559254319,海岛00
7126494774349136681,好的喜剧演员看到就想笑，看到沈腾，我感觉笑不出来,0,2,0,2022-07-31 19:20:24,来自西藏,2709659866375677,热心海燕J
7126430522062160672,还是《我和我的父辈》这部电影差了点,0,0,0,2022-07-31 15:11:50,来自湖北,4028614641,扯直走
7126425883774239501,这个就是真实的，请问沈腾演的角色你还有印象吗？海清的也没印象了，我是指看一次电影后。,0,3,0,2022-07-31 14:53:30,来自四川,2207407411823524,好学豆花d2p
7126416955866874628,除了演技棒还得有大剧本支撑,0,0,0,2022-07-31 14:19:19,来自广西,6811827535,得失本无常
7126384653384516359,这届百花奖获得很不公平，都是一些我们不认识的电影都不知道的获得，百花奖不能代表我们的心声,0,0,0,2022-07-31 12:13:34,来自辽宁,4209286600,时代在变化着
7126190831849128741,虽然我很喜欢张译，但实事求是的说，守岛人的刘烨比悬崖之上的张译要好！,9,71,4,2022-07-30 23:42:02,来自浙江,110786832185,chageng987
7126297456065004318,观众的眼睛是雪亮的，特别是对沈腾来说,0,24,0,2022-07-31 06:35:59,来自河南,71946318163,不念经的小和尚
7126543937736983311,不会投沈腾，因为他演的都是一个味，看过他演的一个电影，第二个不用看，大概率也是哪个表情。,0,2,0,2022-07-31 22:31:08,来自宁夏,93015290058,雨中即景671021
7126377744352559872,我两个都会投，确实他们是很好的演员！,0,0,1,2022-07-31 11:46:15,来自上海,81888008554,民民3248
7126494193463182113,张译实至名归！,0,1,0,2022-07-31 19:18:53,来自北京,52304804915,丹丹maggie
7126315727753134884,综艺上多了，看啥都会出戏的，张译实至名归，是个好演员[赞][赞][赞],0,23,1,2022-07-31 07:46:13,来自浙江,5748668321,邱果果果
7126397828536468239,不投她他两个.男的不喜欢.女的演戏太用力了,0,1,0,2022-07-31 13:04:04,来自上海,769263267756253,穿过寒冬拥抱你
7126309272459461411,反正我不会投沈腾,0,55,2,2022-07-31 07:20:49,来自四川,3606827163988239,优美春风Rk
7126306603749704488,喜欢海清，演技好，真实，不做作，不浮夸，可能系统出问题了,0,11,1,2022-07-31 07:10:30,来自山东,4058995443118414,智慧葡萄ZS
7126317189384192800,沈腾的0票实至名归！拍的确实不咋的！,0,48,1,2022-07-31 07:52:07,来自广东,17434066356,AJ155055833
7126402001747378981,张译得奖，实至名归,0,5,0,2022-07-31 13:20:47,来自四川,95870493177,小张讲电
7126330020099867405,贾玲能得票，海清没得票，也真是没法说了。,3,31,1,2022-07-31 08:41:24,来自北京,19112252936,MH6002
7126194919118947112,实力派得奖🏆！我很欣慰！真正的大众评奖！希望中国电影电视走到正轨上来！,0,41,0,2022-07-30 23:57:47,来自北京,104570270693,张七月的七月
7126299095841096452,感觉男演员里演技派好像没几个，张译确实算一个，还有觉得黄轩演技也杠杠的，咋就是不算特别出名，也是醉了。还有就是陈道明了，新生代易烊千玺也还行。,8,12,1,2022-07-31 06:43:06,来自湖北,1692882994727532,LovelySavion
7126280184311595780,沈腾有演技吗？,7,191,2,2022-07-31 05:32:08,来自湖北,67118951823,GTS31
7126498211690808104,虽然没看过守岛人，个人感觉刘烨应该得奖，悬崖之上没看出来太多出彩,0,0,0,2022-07-31 19:33:48,来自河北,87786887503,普惠财智
7126386732496552742,朱媛媛，袁泉实至名归[赞],0,45,1,2022-07-31 12:21:36,来自山东,19423053258,感恩有你一生一世
7126478013914858255,我投票吴京,0,0,0,2022-07-31 18:15:25,来自浙江,78015839504,浓墨斤斤
7126556379682767624,海清和吴京挺遗憾的没有得奖。,0,0,0,2022-07-31 23:20:32,来自黑龙江,106094124951,优美星辰Sq
7126542705773478691,沈腾本来就不是演技派的，就是搞笑出道让大家放松娱乐的,0,0,0,2022-07-31 22:26:23,来自山东,3703567750544263,玖月石榴
7126401419023762215,张译，袁泉得奖实至名归，可是海清0票就有点不正常了，海清演技也是不错的。,0,3,0,2022-07-31 13:18:40,来自山西,58367053398,彼岸200134465
7126446871970726697,又不是根据总票房量来投的，根据申报的作品来投的吧,0,0,0,2022-07-31 16:14:22,来自广东,98626244299,MMH83008
7126420683231855399,沈腾扮演的这个角色为啥要获提名，本身这个角色的安排就不是演技型的，一个机器人，不需要啥演技，也不可能有多样的表演机会。拿这个角色提名不是可笑吗？那部电影有那么多角色呢！谁演这个机器人角色被提名都不会获奖吧！,0,0,0,2022-07-31 14:34:01,来自北京,100256056934,芳心不改
7126508222688592640,从没有觉得他有演技！演什么都是沈腾！张译在演士兵突击的时候就觉得他以后肯定会大红大紫,0,0,0,2022-07-31 20:12:24,来自湖南,2682402327769646,亲切辰星
7126411038005773070,演员的奖就应该让纯粹的演员得！[赞][赞][赞],0,7,0,2022-07-31 13:55:49,来自山东,4384499393898292,柚子和糯米
7126360099656352512,这届百花奖还是比较靠谱啊，得奖演员都是实力派，超级棒。,0,120,3,2022-07-31 10:37:27,来自山东,85207706091,大红花
7126402786136834820,百花奖水分不大吗？我记得有一届李易峰打败了张译，夏雨和段奕宏也拿奖了，还有杨颖,0,3,0,2022-07-31 13:24:20,来自江苏,50622999750,坦荡轮船M2
7126392961377764131,101位能代表我们所有的老百姓？？这位电影学院的副校长也是101位电影观众投票投出来的吧！！,0,1,0,2022-07-31 12:45:13,来自山东,66097126347,鉴一面
7126378692368401160,这次评选还挺公平！确实袁泉，朱媛媛实至名归,0,31,1,2022-07-31 11:50:28,来自山东,110130407398,兰心蕙质云奕
7126508166770541342,沈腾的电影小品真的是太不讨人喜欢,0,0,0,2022-07-31 20:12:40,来自北京,3395467902,乐观的海燕l8
7126539759077573387,沈腾的表演太过于浮夸了。,0,1,0,2022-07-31 22:15:18,来自江西,106022805100,微笑云朵R5
7126395052490261286,我觉得评选结果实至名归！沈腾再不错在我这个小老百姓看来比起张译也差天远！,0,2,0,2022-07-31 12:54:11,来自广西,1279438955229572,坐看云起时98765
7126394121253798671,主角配角没一个我喜欢的[捂脸],0,0,0,2022-07-31 12:49:40,来自黑龙江,18546508951,-_-麦兜-_-
7126534192841753380,中国的演员都是程式化的学院派演技，不是这派系的都没入选资格。利益共同体！,0,0,0,2022-07-31 21:53:26,来自辽宁,5520178540,渴了的大鱼
7126200838707823394,过度消费自己,11,233,4,2022-07-31 00:20:50,来自浙江,54746249562,晓晓145398239
7126378904373822219,"观众确实按了
屏幕确实出票数了
但它们二者有必然联系么
按的只是按了
显示的只是显示了",0,0,0,2022-07-31 11:51:39,来自天津,75967125908,IIXVIIIIIIVIII
7126385749331084043,所以我会像邓超说的那样，都投！都投！算是给艺术家的尊重也得投！海清和沈腾都是非常优秀的艺术家！演技非常在线！,0,2,1,2022-07-31 12:18:07,来自湖北,4459223288647783,幸福阿幽
7126206898247959303,我和我的父辈，包括章子怡，徐峥，吴京等四个大腕呢，能提名已经是实力所在。体裁不同，表演风格不同而已，让张译演沈腾的角色，他未必演的好。,0,9,4,2022-07-31 00:45:36,来自江苏,96960400775,冰纯雪洁
7126483873730691840,百花齐放，百家争鸣。大众的眼光是雪亮的也是公正的。为这次百花奖的评选点赞！,1,2,1,2022-07-31 18:38:02,来自河南,101214380159,W回笼教主
7126302249143878436,我会给海清投票，演技很好。,0,15,1,2022-07-31 06:54:33,来自贵州,5848326116,_丫蛋_
7126463658083402529,沈腾就算了吧～各种综艺上太多，也就混个脸熟。。论演技草根出身的王宝强都比他强太多。。,0,2,0,2022-07-31 17:20:37,来自陕西,82644028784,0又双叒叕0
7126285155333292803,为什么大众百花奖不是大众投奖？101个评委凭什么可以代表大众？这种小范围的＂精英＂投票决定了谁是大众应该去认可，凭什么有代表性？毕竟是票房有代表性还是这101有代表性？,13,23,2,2022-07-31 05:50:07,来自上海,18362437754,云灵寻道
7126427798860169984,不会给他们投票,0,0,0,2022-07-31 15:00:38,来自广西,50496105309,卡拉夫斯
7126378975677137667,越来越讨厌贾玲和沈腾。,1,2,0,2022-07-31 11:51:56,来自山东,3329774774924845,用心评3D原创动漫音乐哥
7126383443957138180,0？无所谓啦，大家喜欢就OK，评委。呵呵。,0,0,0,2022-07-31 12:09:07,来自河南,4593310154,虹源吃饱再运动
7126412851216614185,"投票是真实的
也是良心的
演技一般
不冤枉
提名都不应该",0,0,0,2022-07-31 14:02:33,来自内蒙古,6815633560,琼精彩影视剪辑
7126341483934057251,0⃣票，是不是坐椅子上都很尴尬[泪奔][泪奔],0,4,0,2022-07-31 09:25:33,来自浙江,81200763964,帅气的小小马
7126430830951645987,呼叫辛柏青，夏雨都发文祝贺老婆了，你的媛媛在等你哈[呲牙][呲牙],0,1,0,2022-07-31 15:12:11,来自浙江,1793997870991759,清风度云白
7126410967705682701,沈腾和贾玲不适合电影，他们搞笑演小品还是不错的，袁泉 张译都有很深的演艺功底，实至名归,0,18,1,2022-07-31 13:55:57,来自北京,4463647217945612,圆圈圈和卷卷
7126544858726581029,不会投票的。上过综艺的演员都不投。不是演技的问题,0,0,0,2022-07-31 22:35:06,来自江苏,20868602646,天空626690
7126392456966931231,沈腾和海清0票我觉得才正常，那要看跟谁比。投票如果有同情分，就没意思了。,0,3,0,2022-07-31 12:43:42,来自山东,6665515655,小恶魔娜美
7126530663662027533,这不得看这些观众是谁选出来的,0,0,0,2022-07-31 21:39:47,来自福建,1714864208224717,太不讲规矩了
7126435938385134367,提名的电影有问题吧,0,0,0,2022-07-31 15:32:33,来自河南,70977711200,走出尘埃
7126366293061944094,这次评奖极其公平，男主、女主、男配、女配都实至名归！代表了观众的心声！,0,102,2,2022-07-31 11:02:13,来自北京,1354208336165453,春天里那百花香1660
7126205677361431331,沈腾的电影真没看过，但是小品目前还是一流的[赞][赞],4,7,7,2022-07-31 00:39:37,来自吉林,2823151503025755,诗意天空Xp
7126431957911307023,两个都不会投,0,1,0,2022-07-31 15:16:51,来自广东,2053475655755911,悠闲栗籽
7126535494825149187,说明近年好电影少，这个水平配不上提名，提上去也没人认可，凑不齐几个好的电影。,0,0,0,2022-07-31 21:58:49,来自江苏,62926257212,海舰2019
7126471010039726885,张译有可能成为李雪健这样德高望重的艺术家,0,0,0,2022-07-31 17:48:44,来自广东,104543395035,太阳2671
7126229552086631209,"我一直搞不懂为什么把沈腾，贾玲，张小斐他们称为喜剧人。一头雾水………
沈腾那口音和风格，随便找个东北人比他强好几倍。
贾玲、张小斐他们 专门抄袭韩国小品，毫无创作力……
真的搞不明白",3,135,3,2022-07-31 02:15:34,来自四川,108134485786,纯和粹之简和单
7126276318412456717,有些时候群众的眼睛是贼亮贼亮的。沈腾小品不错，电影电视剧就算了。,2,63,0,2022-07-31 05:15:25,来自贵州,52670173364,镜花水月141033656
7126425726240441125,张译是实至名归，海清和沈腾0票算是投手开眼了吧，朱媛媛可以表演到位了,0,1,0,2022-07-31 14:52:56,来自海南,55730354356,顽强星球y9
7126454004053885707,海清可以，沈腾就免了吧。,0,2,0,2022-07-31 16:43:11,来自山东,4484253317,卿乐
7126318175326667553,沈腾，马丽，就算了……,0,20,0,2022-07-31 07:56:03,来自江苏,11068191561,可儿71800
7126295816469234472,沈腾演演小品可以，做影视剧演员，那还差火侯,0,9,0,2022-07-31 06:28:42,来自上海,54049141884,DH8018
7126464153917178661,海清和袁泉比还差好几个层次,0,0,0,2022-07-31 17:22:07,来自北京,6283879372,浅蓝色的84453137
7126528699951743751,其实我觉得这个奖还是实至名归的，但是就这样写出来零分，还是挺尴尬吧！,0,0,0,2022-07-31 21:32:03,来自四川,3540050051604183,寒雪冰舞
7126532299944395554,海清演技精湛，得零票倍感意外。还是要感谢海清的所有付出。,0,0,0,2022-07-31 21:45:54,来自四川,4590473685,大侠45103519
7126542549200306985,101名观众怎么来的,0,0,0,2022-07-31 22:25:45,来自江苏,1767666757674397,极速芒果9J
7126295112267219715,观众的眼睛是雪亮的,0,8,0,2022-07-31 06:28:07,来自安徽,5783156008,己被注册啦
7126518223835071272,可见评委是很公正的，至少袁泉朱媛媛实至名归。,0,0,1,2022-07-31 20:51:19,来自辽宁,108979066333,桃花源里的桃子
7126396086109586191,沈腾得个好笑奖吧,0,4,0,2022-07-31 12:57:24,来自日本,6430861570,哼是我呀
7126347407738798848,张译演的电影叫悬崖之上，小编多次写的是悬崖之下，这是一部外国的老电影。,1,0,0,2022-07-31 09:48:12,来自浙江,102832713920,千年114
7126301360785507083,朱媛媛演技真的挺好，细节做的到位！,0,13,1,2022-07-31 06:51:15,来自河北,53410371295,宣化张姐
7126382897799758629,沈腾张小斐那些演小品的0票我理解，海清0票无法接受,0,3,0,2022-07-31 12:06:45,来自陕西,95017826710,王西鱼
7126408702722343687,刚看完沈腾的（独行月球）挺好看的呀,0,0,0,2022-07-31 13:46:52,来自湖北,50284299935,人生若只如初见CC
7126299141927535360,不会，大家的眼镜是雪亮的，实至名归[赞],0,74,1,2022-07-31 06:41:39,来自辽宁,60973947101,暖暖的夏日
7126476938327229224,沈腾没啥演技，不喜欢,0,3,0,2022-07-31 18:11:07,来自福建,3645626249126829,不凡叶子rZ
7126408415899337508,我会给海清投票，但绝不会给沈腾投票，不管他什么亿万票房，就是特不喜欢他。,0,2,0,2022-07-31 13:45:48,来自辽宁,85829087765,浪迹天涯15457678
7126382082179810060,不知道他怎么有那么高曝光率，反正零票代表了我,0,0,0,2022-07-31 12:03:56,来自日本,57517456469,范范中英文
7126381970518524703,不喜欢喜剧演员，很无聊。,0,1,0,2022-07-31 12:02:55,来自河南,3333371437804158,用户98394370枫叶
7126482260315882255,我会投海青[玫瑰],0,1,0,2022-07-31 18:31:43,,3131031900920983,豁达隨心
7126439120142205737,袁泉，朱媛媛，二位都是实力派演技！实至名归！祝贺她俩！,0,4,1,2022-07-31 15:44:24,来自辽宁,1332235333555116,热心火车aw
7126378652258206478,祝贺张译袁泉得奖[鼓掌][比心]，实至名归[玫瑰][玫瑰],0,7,1,2022-07-31 11:50:15,来自甘肃,364648798104904,乐观的可乐g2
7126434103692051237,沈腾得负一百分。,0,0,0,2022-07-31 15:25:43,来自四川,86661276745,一心一意暖阳vx
7126419251254264610,海清还是有演技的，沈胖子实至名归,0,2,0,2022-07-31 14:27:17,来自北京,6675270303,连天红888
7126415805499687716,两位低调最佳女主、配角得主凭实力取胜，说明群众眼睛是雪亮的！,0,19,1,2022-07-31 14:14:29,来自黑龙江,1195872023232094,江湖独行君
7126448126550590241,给这样明辩是非的观众评委点赞,0,1,0,2022-07-31 16:20:30,来自吉林,43622830715039,无双画板E4
7126385053227189025,不知为啥我一部电影都没看，咋就猜中了侯勇，张译和袁泉了呢？[捂脸][捂脸][捂脸],0,7,0,2022-07-31 12:15:05,来自江苏,77527790784,神秘豆花r
7126526311069811491,小品演员不能与影视演员相提并论。,0,0,0,2022-07-31 21:22:41,来自山西,13513294847,武士19
7126396900344922895,演技不错 不至于零票！,0,0,0,2022-07-31 13:00:28,来自河北,5866952794,平安硕果
7126536336165323551,评委评还得加现场观众评！不然也不尽服众！,0,0,0,2022-07-31 22:02:03,来自广东,5968329699,灼灼其华XjiI
7126455993558532894,每个人得票都是实至名归,0,6,1,2022-07-31 16:50:11,来自山东,67477600732,二代目哥斯拉最强大
7126412789228389128,啥意思？袁泉、张译拉票了？,0,0,0,2022-07-31 14:02:43,来自陕西,51952424674,成熟湖泊gK
7126428719413543693,百花奖过去是观众评出来的，现在改评委评选了,0,0,0,2022-07-31 15:04:42,来自河北,87858299624,大芳小燕子
7126444335532344079,沈腾有些飘了，太商业化追求，导致好作品失去了核心内容，这也是注定的。,0,3,0,2022-07-31 16:04:30,来自新疆,50039262132,金子168169
7126379856086336287,朱媛媛袁泉，绝对实至名归[赞][赞][赞][赞],0,10,1,2022-07-31 11:54:46,来自辽宁,58804616218,幸福高碑店1t6
7126410780970353408,朱媛媛演技很好的。,0,1,0,2022-07-31 13:54:19,来自安徽,2005969968053760,爱养多肉的贝妈
7126538543556133666,现场评分。公平。,0,0,0,2022-07-31 22:10:12,来自新疆,64200915431,红星11777
7126334311128777510,大家看到的只是表面,1,1,1,2022-07-31 08:58:27,来自河北,1622525263750116,我写文我快乐
7126414033255007017,本来今天挺烦的，看了《独行地球》还挺解闷,0,0,0,2022-07-31 14:07:01,来自广西,50509141771,瑟ss
7126559615357469454,朱媛媛很久没出作品了 这俩电影 直接让所有人刮目相看 实至名归,0,0,0,2022-07-31 23:33:03,来自北京,82291780415,海风
7126442323051447078,电影节质量严重下滑，演员气质有待提高，主持人干万不能用演员来主持了，太差了。,0,0,0,2022-07-31 15:57:54,来自四川,6274891517,盖碗虎
7126309137700717350,不喜欢沈腾与马丽小品与影视作品，说搞笑没有陈佩斯与朱时茂的基因，个人更欣赏梁朝伟与张曼玉表演，内地很多搞笑演员不搞笑:蔡明，郭冬临，贾冰，沈腾，马丽等等,0,19,1,2022-07-31 07:21:21,来自福建,64901816205,乘聞
7126433316848517924,群众的眼晴是雪亮的，结果实至名归。,0,1,0,2022-07-31 15:22:17,来自河北,55241668199,漫天飞雪入吾心
7126296437712929571,海清同样的角色观众看腻了！沈腾跟张译比还是有差距！,0,21,1,2022-07-31 06:31:12,来自湖北,106905252572,淡泊的海洋vA
7126424476464169766,非常公正，公平，为评委点赞！,0,8,0,2022-07-31 14:48:39,来自福建,197537580194903,分秒必争西柚fd
7126440621908361988,不会的，袁泉实至名归。,0,0,0,2022-07-31 15:50:54,来自海南,58135921551,当下娱乐
7126414935097803560,我最喜欢的女演员袁泉拔得头筹，我感到很高兴。从得票数来看，说明群众的眼睛是雪亮的！,0,10,2,2022-07-31 14:10:41,来自四川,85968195973,数我杨
7126403323297022724,他负责搞笑逗乐就行了，至于奖项无所谓，反正不影响他的商业价值,0,0,0,2022-07-31 13:26:21,来自江苏,50296035636,完美诱惑1
7126400807826359076,海清作品每部都一样，没新意！也就不愿意看了,0,4,0,2022-07-31 13:16:23,来自河南,795678959738772,开朗星球tO
