7126287384106320652,沈腾演电影只能说玩玩而已，论演技还有差距。,2,65,0,2022-07-31 05:58:11,来自上海,60983948560,读者小树
7126326050698658599,"综艺就是搞笑，没啥实际意义
喜欢张译老师及其塑造的角色，感人肺腑，这才是艺术家该有的风骨",0,9,0,2022-07-31 08:26:18,来自河南,3891903606034845,0一木子
7126411517377626883,不可能吧！那么多粉丝？,0,0,0,2022-07-31 13:58:09,来自北京,51411611758,Dong滢
7126315763123995427,这说明投票的观众水平高，得奖的演员实至名归,0,58,3,2022-07-31 07:45:56,来自山东,62963713277,山间流涟
7126390309205836551,刚刚看了守岛人，感动的眼泪,0,0,0,2022-07-31 12:35:13,来自四川,1890758314164504,智勇双全光束wx
7126392164070114086,会的，跟第一有差距但不至于这么大，海清加油,0,1,0,2022-07-31 12:42:48,来自辽宁,24840237490,正能量葡萄0kG
7126307505512776455,从不看沈腾，太不喜欢了,1,394,7,2022-07-31 07:14:54,来自山东,3091471864966547,WCX静言
7126507884904645389,不喜欢沈腾0票[赞],0,1,0,2022-07-31 20:11:35,来自北京,98629258923,更改用户各张明芝
7126318331883717407,公平投票，获奖演员实至名归。,1,0,0,2022-07-31 07:56:32,来自浙江,2546081976825444,阳明渐近
7126349003226415875,沈腾？别说电影了，就是他的小品我都不爱看！,12,215,5,2022-07-31 09:54:17,来自湖北,71292023895,淡定小红花hh
7126291052796887823,把提名的演员名字发到社会上，让老百姓都来选，这样的结果肯定更准确些，毕竟101个评委还是没法代表大多数观众的。当然了，我说的也不切乎实际，因为也不容易这样办,4,31,9,2022-07-31 06:10:18,来自河南,515012699888040,未经他人苦莫劝他人善
7126360084342555395,"沈腾0票陪跑,实至名归",1,0,0,2022-07-31 10:37:19,来自湖北,1033128731486364,典邦财经
7126355452464087848,贾玲那电影其实感觉不怎么样，捧的太高了,5,98,3,2022-07-31 10:19:24,来自广东,3016682865178888,地球上的日子
7126475224824447755,百姓喜欢的就是最好的！,1,0,0,2022-07-31 18:05:24,来自辽宁,86331902546,国卿原创
7126442433923711781,沈腾，贾玲实至名归,0,7,0,2022-07-31 15:57:57,来自河北,1468548823395832,杨柳卿wfz
7126343878634292001,沈腾演电影还像淹小品。挤眉弄眼的太夸张。海清参演电影的镜头太少，没啥映象。她的电视剧作品多。,0,17,1,2022-07-31 09:35:38,来自浙江,3584055480167763,梦幻漂流瓶P
7126433180030812928,袁泉、朱媛媛，实至名归[赞],0,6,0,2022-07-31 15:21:33,来自山东,85872750645,踏雪寻梅2505
7126505061941314341,海清演啥角色都一个样,0,0,0,2022-07-31 20:00:41,来自江苏,16118248419,轻描淡写你的回忆zz
7126403305752167205,朱媛媛袁泉，绝对实至名归[比心],0,9,0,2022-07-31 13:25:57,来自四川,175532322598187,上进的伊伊
7126525045584937732,啥贾玲，沈腾。我绝对不会给他们投票。,0,2,0,2022-07-31 21:18:03,来自江苏,571396196154784,清分四季
7126541748180419331,这也是学芒果台的梗了，现场投票,0,0,0,2022-07-31 22:23:21,来自山西,51582553753,123456adgjmptw
7126450476816171816,说良心话，真正得奖的都是专心打磨演技，演出健康正面主旋律的演技派，天天搞综艺虽然挣钱多格局毕竟小了，不得奖很正常。演员两个字毕竟需要点真材实料的,0,10,0,2022-07-31 16:28:37,来自河北,1701635020301923,正义凛然书签dV
7126487926623650600,为沈腾，海清零票叫好。这届评委真好！,1,2,0,2022-07-31 18:53:49,来自安徽,102347428570,yangcan73
7126306218007724834,我会给海清投一票，沈腾不会。,0,71,2,2022-07-31 07:08:50,来自北京,111413692029,富足明镜wl
7126345117094478607,我觉得评选结果，的确是实力派，很有说服力！沈腾也很不错，只是参赛作品上，没有其他几个作品的演员更加容易突显出来，更加出彩！,0,10,0,2022-07-31 09:39:09,来自北京,1389385216955005,越来越好迷迷糊糊
7126383677118513961,喜剧演员别要求这么高，大家图个乐呵，票房好就行,0,1,0,2022-07-31 12:09:15,来自山东,51752732022,热心朝阳
7126462862041596685,不喜欢沈腾，会给海清投票的。,0,2,0,2022-07-31 17:16:51,来自江苏,14010341686,我心有你59
7126307730322998023,投票，沈腾还是算了吧。,0,13,0,2022-07-31 07:15:23,来自四川,63075462132,归来YJ
7126307473421714184,沈腾演技太浮夸 不太喜欢,0,17,0,2022-07-31 07:14:20,来自江苏,5860488112,龙胜数码科技
7126442893820445480,101位大众评委选的实至名归，这次我也不会选沈腾和海清，但也不是说他们演的不好。,0,0,0,2022-07-31 15:59:08,来自山东,8815999880,众帮汽车电子技术
7126430308240622366,海清有点冤,0,0,0,2022-07-31 15:10:39,来自广东,105302462295,惦起脚尖
7126197747061326607,38+28+15+13=94，还有7票去哪儿了？,17,14,1,2022-07-31 00:08:43,来自江苏,6415364965,Royomping
7126543328506102569,但，他获得提名了，也是肯定。零不代表他不好，只代表他不是最好。,0,0,0,2022-07-31 22:28:46,来自北京,514192553810452,京桂一枝花
7126304052619182863,我在现场绝不会给沈腾投票。,0,13,0,2022-07-31 07:00:44,来自四川,10823449500,好大的风20091113
7126215347715703583,怎么说呢，海清0票，可能还出演时长有关，她就是在最后的一点点有几个镜头，可以说播放提名视频时候，估计就是她参演的全部内容了。沈腾的话，他应该放男主提名，不过他以父辈来提名了就不错了，讲实话，沈腾的喜剧的观众喜爱度还是挺高的，但是与前三部分所表达的主题感觉脱节，再说候勇以超高票数获第一，这情理之中的事，尤其是在名义的那两集，当时热度很高，加上提名的守岛人中表演，那种炸裂的演技比刘烨都高。,3,19,3,2022-07-31 01:21:00,来自广东,4117490804,及之所即
7126305573452923660,沈腾会演戏吗？他所有的角色都一个表情,0,8,0,2022-07-31 07:08:04,来自河北,4314105616532907,我只是路过看风景
7126354300292612905,不会。不喜欢海清。沈腾视觉疲劳了。,0,10,1,2022-07-31 10:14:50,来自宁夏,68528308373,九九牛娃
7126411463019135782,沈腾的演技并不好，只不过是综艺搞笑比较好，所以0票我觉得正常,0,8,0,2022-07-31 13:58:03,来自陕西,21222853775,橙色的风信子
7126397018498581256,周日愉快🌷🌷,1,3,0,2022-07-31 13:01:09,来自广西,5979581024,阿尓巴佳人
7126298644047168263,我要是能投票，给海清投，沈腾就算了,0,53,1,2022-07-31 06:40:29,来自辽宁,79289894675,额济纳的胡杨林
7126510367190713127,张译得奖非常棒，无论从电影还是电视剧他演绎的角色真的非常出彩[赞],0,1,0,2022-07-31 20:21:34,来自江苏,105053227303,睿智沙滩1I
7126393314391245604,这就是专业演技的实至名归。,0,0,0,2022-07-31 12:46:53,来自山东,6609677402,山的那边是海99280156
7126521709955990313,张译是真正的好演员，演技出色，实力派。有很多电视剧电影我都是看到张译演的片段去追的。像鸡毛飞上天张译抱石头见到骆玉珠说不出话那段，简直演技天花板啊！,0,0,1,2022-07-31 21:04:43,来自广东,5527576423,微波之言
7126386438060393253,这才是最公证的选举。流量高不代表演技就非常好，,1,84,2,2022-07-31 12:20:11,来自江苏,51082021400,艾米粒凡
7126532100169745193,会，比那几个好多了。,0,0,0,2022-07-31 21:45:06,来自山西,96794790629,董董的杂货铺
7126309468182790947,看见沈腾就换台[捂脸],0,74,2,2022-07-31 07:21:49,来自河北,4121606991,此生难舍
7126521544863859487,如果是记名投票那就更尴尬了，但结果都是众望所归，不管得奖的还是没得奖的，至少没有一个是“眼”技派演员！我印象中，海清角色除了《红海行动》其余都是千篇一律；沈腾呢，大家都觉得他是周星驰的接班人，但是哪一部你觉得他演的好呢[呲牙],0,0,1,2022-07-31 21:04:28,来自辽宁,107811222026,今天做核酸了么
7126383666259378981,所谓的大众评委眼光有限，取向为何如此统一，海青o，沈腾o，贾玲4，朱媛媛74，先不管演员演技如何，单说评委不知来自哪方！如此黙契令人愕然，差距如此之大吗？爆红市场的不一定是最好的，所以商演，炫枝另当别类，严肃，高雅应为主流艺术，主流艺术应由专业评委评选，现在大家不相任专业评委，改为大众评委，利弊纷然，中国电影界的困或！,1,16,6,2022-07-31 12:09:49,来自陕西,3623629758399773,知情达理橘子bD
7126421456111567627,不知道当事人是啥心情,0,0,0,2022-07-31 14:36:38,来自江西,387447893801214,古颜颜吖
7126467337171092263,沈腾的作品不欣赏,1,22,0,2022-07-31 17:34:32,来自海南,98143719921,勇敢的小红花rr
7126401057202897675,我在现场也不会投他俩[呲牙],0,4,0,2022-07-31 13:17:41,来自江苏,105263891240,肥肥的z
7126537419612029710,101人只有96票？,0,0,0,2022-07-31 22:05:53,来自广东,101553100762,耐死244
7126416784776807199,感觉这个奖好随意，完全是拼人缘和利益嘛,0,0,0,2022-07-31 14:17:57,来自广西,4262405707,大眼睛小宝漂亮妈
7126403100977972008,不会给海清投票，她以前非常的好，最喜欢的演员之一，现在这些年，演的痕迹明显，瞪眼怒吼，没有全身心投入角色中，,0,4,0,2022-07-31 13:24:38,来自辽宁,104070301166,昆仑骏马立
7126403922566464260,零票是对的，这个奖有含金量,0,0,0,2022-07-31 13:28:32,来自湖北,5940870404,不开心就吃
7126545431181706015,我绝对会投海青，但沈腾不认识。,0,1,0,2022-07-31 22:37:24,来自广东,5784763971,风语者64819446
7126462019943367459,我会投海清,0,0,0,2022-07-31 17:13:27,来自黑龙江,71598403135,孙子兵法1996
7126299179051172620,沈腾得零票我赞成,0,30,2,2022-07-31 06:42:35,来自湖北,2260203752662419,窜串
7126508759358276384,我想问一下，哪一项提名不是实至名归？！沈腾在这部片子里面的角色分量演技和其他思维确实没法比！,0,0,0,2022-07-31 20:15:04,来自山西,5516152988,浪涛映像修一
7126209392353264425,最佳男配角怎么会是侯勇老！不应该此人，评委这是喝酒了？！,3,13,1,2022-07-31 00:54:49,来自广东,111334636257,未来大街
7126201788848046881,没得奖的原因，让我想起了星爷没得奖的原因，评委:表情做作，略显浮夸,18,141,2,2022-07-31 00:26:33,来自湖北,60114512601,OneDay少爷
7126273566047945486,18年百花奖评奖改革。获奖演员综合素质很重要。改革当年，观众不十分熟知但人品演技过硬的中年女演员陈瑾摘得百花奖！,0,20,2,2022-07-31 05:06:44,,51061750483,开心134420715
7126429076545733414,支持这样的评选方式，公平公正,0,0,0,2022-07-31 15:06:13,来自河北,4134577245793035,淡然儿00
7126480482631500547,0票不可能吧。这是得罪人了,0,0,0,2022-07-31 18:25:39,来自广东,6370805688,曼妥思8657
7126510277671027487,这零票也太扎心了吧，能参与投票却一票也没有，还不如不提名呢[捂脸],0,0,0,2022-07-31 20:20:36,来自广东,88478660269,景向云栖
7126417847810786048,他0票还不正常的嘛[捂脸][捂脸],0,1,0,2022-07-31 14:21:56,来自上海,61934816403,电影鲨
7126293800125022990,沈腾作为综艺喜剧人，当演员实属牵强，哪些什么五十亿，一百亿票房并不代表多数人会喜欢他，不代表就喜欢他的电影，只要是他的电影至少我不会看，没有让我有兴趣去看他的电影。海清吗，我只能说，她吸引力不够！,3,117,2,2022-07-31 06:21:51,来自塞内加尔,6836576118,倔强的公鸡
7126548573777003305,哦！这样我相信没有做假，海清一般般，沈腾的火莫名其妙,0,0,0,2022-07-31 22:49:21,来自广东,102178638300,寂寞的隔壁老王
7126186633531097864,最佳男主角我支持守岛人刘烨！,7,75,4,2022-07-30 23:25:33,来自浙江,5958796177,钱塘江畔初见月
7126537090799977257,海青朱媛媛我都投，至于那个叫沈腾的只是在某个综艺节目看了一眼，不知为啥能提名,0,0,0,2022-07-31 22:04:28,来自北京,1099962789661919,心如菩提对待人生
7126394994675450664,不会投沈腾,0,2,0,2022-07-31 12:52:53,来自新疆,92335050455,jybp0320
7126299182872167199,海清不错，沈腾就是个小品演员，演技肯定不行,0,24,0,2022-07-31 06:42:24,来自山西,111147769082,平淡是真3680
7126337422710817573,101个评委，半数票也得要51张票吧，女配男配才是真的牛🐮,6,111,7,2022-07-31 09:10:06,来自陕西,101424338476,没得选了
7126332214434349828,喜欢这百位良心观众评委。投出负责任代表民心的一票。优秀演员应能承受任何评选结果。,0,13,1,2022-07-31 08:50:38,来自辽宁,58842375663,奎妈一束莲
7126450570969514787,恭喜张译，袁泉获奖！[玫瑰][玫瑰][玫瑰]实至名归，两位演员我都非常喜欢！,0,2,0,2022-07-31 16:28:44,来自黑龙江,739290172622487,ptsbh
7126383679018222348,我会投海清，但是沈腾不认识,0,2,0,2022-07-31 12:09:56,来自吉林,6571901616,珍惜96613481
7126397966323450627,沈腾演技真不咋样,0,0,0,2022-07-31 13:05:29,来自广西,3865475739289294,可爱的我们大家都好
7126383815072842496,海清演技一般，说话表情都一样，认为，梅婷，姚晨，演技好[抠鼻],0,6,1,2022-07-31 12:09:35,来自湖北,60962963979,小芳8701
7126304750655603497,张译实至名归！祝贺呀！群众的眼睛还是雪亮的！,0,21,0,2022-07-31 07:03:14,来自湖南,2334989418235469,9凡陌
7126555931206927118,那几个评委代表群众？还有张译无可厚非，但是他应该是男配角吧，于和伟才应该算男主角吧！,0,0,0,2022-07-31 23:18:47,来自广东,108202469375,愛宥會ガ
7126377805549978404,袁泉绝对实至名归,0,18,0,2022-07-31 11:46:55,来自安徽,6998569172,分秒必争饺子0
7126390510813561611,无所谓得奖啊得奖，沈腾是我喜欢的演员！,0,1,0,2022-07-31 12:36:24,来自河南,3526842765541390,谁知道这个呀
7126384570761020173,海清演技不错的。。。,0,1,0,2022-07-31 12:13:14,来自海南,3694776988476094,忧郁的情思
7126475535538733828,张译的多部片子都值得这个奖。,0,6,0,2022-07-31 18:06:52,来自北京,63801786487,头条用户1234567899
7126390596155294472,人家就是不喜欢就不投票呗！我就不喜欢沈腾[捂脸][捂脸][捂脸],0,7,0,2022-07-31 12:36:28,来自山东,104578659957,寒寒15335490010
7126489641079079716,海青有点冤，沈腾无所谓……,0,1,0,2022-07-31 19:01:05,来自湖北,3579670799,静下来说
7126432177478271757,我就不喜欢贾玲沈腾一档子,0,22,1,2022-07-31 15:17:58,来自四川,3689551085968500,儒雅海燕Lv
7126416629348909861,谁说沈腾是“大家喜欢的”了？,10,105,4,2022-07-31 14:17:34,来自北京,92772000630,自由风铃ON
7126424049181311776,沈某的电影小品我都不看，评委这次我👍🏻你一个。,0,13,0,2022-07-31 14:46:38,来自广东,96798091987,落雁95
7126410477688619784,这个几个提名的都是实至名归的。,0,0,0,2022-07-31 13:53:29,来自江苏,52588868843,怀念凡鸟
7126404048097444611,好喜欢袁泉的电视剧，气质好，比海清强多了。,0,9,0,2022-07-31 13:28:58,来自陕西,69165769501,美人鱼282662801
7126457029623235361,最佳男女主角、配角都是实至名归。,0,72,7,2022-07-31 16:54:39,来自辽宁,26020029673164,绿色阳光2021
7126367664691888903,实力派，实至名归！,1,0,0,2022-07-31 11:07:45,来自广东,2287450406793261,6677V8899
7126436048087057160,李焕英看了个寂寞，居然得奖,0,7,0,2022-07-31 15:32:55,来自四川,74195570716,逸蒙山
7126455382079193897,没人投票给沈腾这很正常，因为我不觉得他的演技有多好！,0,3,0,2022-07-31 16:47:22,来自辽宁,2159030334139323,智者湖泊HV
7126383724857721640,以后投票的规则应全国性投票，101个选票，太没有权威性,0,0,0,2022-07-31 12:09:26,来自江苏,6394533457,吉庆有余87233116
7126431005879272233,终于没有流量小鲜肉入围及获奖！特别喜欢获奖演员，他们才是演员应该学习的榜样！演艺奖项回归正常了！,0,3,0,2022-07-31 15:12:56,来自辽宁,241525684175499,GF如沐春风27
7126468942788346656,什么滕的0票是众望所归，海清说不过去,1,8,0,2022-07-31 17:40:48,来自上海,77312872321,sdlywj
7126343099114406688,张小斐总觉得演技里差点啥,2,15,0,2022-07-31 09:32:45,来自陕西,4318479633884663,Gala
7126426640565142286,袁泉，很棒！海清其实也是不错的，不知为什么零票。海清，加油！再努力！[碰拳],1,1,0,2022-07-31 14:56:29,来自浙江,50641474222,我忘了152233814
7126503771014005511,票数加起才96票，有5票弃权？,0,0,0,2022-07-31 19:55:41,来自四川,839618743244980,懿冰玉
7126455076910252840,沈腾的0票绝对属于实至名归。,1,6,0,2022-07-31 16:46:22,来自河南,6923302238,高冷西柚ec
7126414823160267528,我投给朱媛媛，,0,0,0,2022-07-31 14:10:44,来自北京,95236951044,不合群的猪
7126367035529446152,最公正公平公心的一届百花奖，得奖的都是真正的实力派演员，实至名归[赞][赞][赞][玫瑰][玫瑰][玫瑰][ok][ok][ok],0,119,3,2022-07-31 11:05:17,来自四川,7867574724,空谷鸣琴
7126378428911059719,喜好不同很正常如果我是101评审团一员也不会投海青 ，感觉海清事后会说不公平。,0,0,0,2022-07-31 11:48:58,来自内蒙古,4155775978317500,多才明镜c6
7126318351382561536,海清说不过去，沈腾实至名归,0,21,1,2022-07-31 07:55:50,来自北京,61755853546,真诚熊猫n
7126304788446348067,看来投票的人还算清楚，沈腾零票就对了。,0,10,0,2022-07-31 07:03:26,来自新疆,905623229447790,夭陇911
7126402168889951011,昨晚去看了独行月球，科幻片不像科幻片，搞笑片不像搞笑片，跟国外的科幻片一比，你就知道差距在哪里了！成龙大哥说过，中国拍的片子出不去，只有功夫片能够出去，但是现在拍功夫片的没有几个了！吴京这几年拍的都是题材电影。,0,1,0,2022-07-31 13:20:56,来自广东,102149505814,大师兄14632
7126400626027676456,我会投给海清，但不会投给沈腾，沈腾没有什么意义上的好题材。,0,1,0,2022-07-31 13:14:51,来自江西,5828136464,临夏儿
7126288971944280864,我一点不喜欢沈腾浮夸的表演，基本上他的片子看五分钟。,0,17,0,2022-07-31 06:04:05,来自四川,104225653180,张大爷Re4l
7126426147738993416,那个男的没有票，确实很正常，太夸张了。,0,1,0,2022-07-31 14:54:40,来自山东,2739573906220845,朝气蓬勃的哇咔咔
7126277121378403083,沈腾0票的结果，实质名归，既不意外，又不可惜，实话实说，他的演技水平实属太一般般，没有什么特别的地方，所以，第36届大众电影百花奖，这次参评结果比较真实可靠，这一评选结也充分的展现了既理性又客观的真实结果，并且，通过这届评选也让专业的和非专的，及广大的影迷回归正常欣赏心态，这一结果的产生也充分说明了人民的欣赏水平在逐步提高，过去被连炒在吹的捧红的个别演员，已经让人们感觉厌倦，希望，今后干万不要出现一股脑的跟风起哄追星现象，让那些既没技又水平的混混明星们，既没市场也没有表演空间，让时间淡化它们，并且，一个个的逐渐扫除演艺市场。,9,240,2,2022-07-31 05:19:30,来自辽宁,51796209610,述评123
7126350326185181956,周末愉快友友们[玫瑰][玫瑰][玫瑰],0,2,0,2022-07-31 09:59:27,来自湖北,101486477061,要啥自行车com
7126429116060680968,终于要回归正道了呀！再不往回拉拉都没人看了[黑线],0,1,0,2022-07-31 15:06:17,来自山东,64246018728,娜冰禹
7126424328614527779,海青没人投票有点说不过去，沈腾就很好理解了，小品，电影都不喜欢！,0,2,0,2022-07-31 14:47:02,来自吉林,19940670980,满堂彤
7126451573068940035,一百名观众从哪儿来，娱乐圈自娱自乐罢了,0,0,0,2022-07-31 16:33:59,来自安徽,5764684435,花花三姐
7126385834965992200,沈腾搞笑看着纯属开心，但是论深度他的影视作品是没有感觉的！这个评分很正常啊,0,1,0,2022-07-31 12:18:05,来自四川,110737352446,幽篁斋主人
7126414210154349326,支持沈腾！！！！,0,0,0,2022-07-31 14:08:25,来自江西,4296269827,追梦一站
7126496893630235430,100多人代表不了大多数观众，不合理，基数太小，评委会的作用还是很重要的。网上投票，老年人又不会,0,0,0,2022-07-31 19:29:07,来自河南,474612235513924,东亚文化传播
7126299642727760681,张译 袁泉演技很好祝贺。海清演技也不错，遗憾[玫瑰][比心],0,46,1,2022-07-31 06:43:43,来自黑龙江,99026302976,吾居高声远
7126413667814015757,只有四位提名是实至名归的[灵光一闪][灵光一闪][灵光一闪],0,0,0,2022-07-31 14:06:17,来自广东,69632742083,一鹿有桃
7126392119363273504,沈腾，海青都是很优秀,0,0,0,2022-07-31 12:42:51,来自广东,62887196924,啊uuuu
7126425418064315170,箩卜白菜，各有所爱，投票观众不喜欢呗,0,3,0,2022-07-31 14:51:24,来自河北,63676842889,雪飞书法艺术交流
7126514311379960587,海清是我佩服的实力派演员[赞]演技一流超群！请知道内情的站出来解说一下，不然难服众[机智],0,0,0,2022-07-31 20:36:44,来自山东,71122204808,清水芙蓉8262207375
7126541297645241126,投票就是投票，证明评委没有分歧。,0,0,0,2022-07-31 22:21:43,来自吉林,1969917699032843,一夜飞雪一年春
7126303623985824553,沈腾“实至名归。”,0,64,2,2022-07-31 06:58:58,来自陕西,4256910623120043,热心叶子ON
7126491600943547136,沈腾表演浮夸,0,2,0,2022-07-31 19:08:07,来自福建,59354959808,仁和75109
7126355147571086095,袁泉和张译实至名归，演戏功底超棒，一看都是正规学院毕业的，大气，不做作[赞][赞][赞],0,197,5,2022-07-31 10:18:05,来自陕西,2867127092523916,乐天派山丘gG
7126379466439770920,朱媛媛演技好，实zhimingui,0,0,0,2022-07-31 11:52:57,来自湖北,62183617786,wdw626389
7126199526641894176,张译袁泉[赞][赞][赞],0,65,0,2022-07-31 00:17:38,来自河南,3096156651,漫长时光里清澈的剪影
7126434508891161379,这二位是好演员,0,0,0,2022-07-31 15:26:41,来自浙江,4387037206,陈龙8886
7126290575212839714,就是在现场也不会给沈腾投票,0,25,0,2022-07-31 06:08:47,来自江苏,53488597172,豆爷63
7126403687664698143,我也不喜欢,0,0,0,2022-07-31 13:27:25,来自山西,5995248787,庆贰爷2
7126389937624433442,在中轻年一代演员中，最棒闩妮，海清，李小冉，袁泉。👍👍👍,0,0,0,2022-07-31 12:33:25,来自广东,67003965019,老二姆
7126414185306555175,只有这样公正透明才能让好演员走到顶端,0,9,0,2022-07-31 14:08:17,来自甘肃,105343209856,相逢是缘44909
7126489410845197086,不经常参加综艺的演员，才真是不忘初心，不什么钱都赚。,1,1,0,2022-07-31 19:00:07,来自山东,4168967646613693,大气咖啡lD
7126534151888716574,海清我会投！沈腾就算了！什么百亿那也时代造就了他罢了，如张山本时代一样！,0,2,0,2022-07-31 21:53:15,来自浙江,6987123826,无名羽1
7126214298116522763,各位网友：不知道我为什么不喜欢沈腾和贾玲的节目电视剧电影综艺！闹的慌不真实没品味！,31,356,5,2022-07-31 01:18:03,来自美国,25541100662,阳光JOHN
7126458823107363595,不会，能赚钱和演技好是两码事,0,0,0,2022-07-31 17:01:27,来自陕西,51444655266,就这样过1314
7126214353883415304,沈腾是综艺电影，贾玲是小品电影，如果这类电影能得奖那百花奖就成纯娱乐节目了,11,236,3,2022-07-31 01:15:57,来自吉林,54988515010,大不韪
7126317377306493710,只要不是吴京得奖都行。,28,109,17,2022-07-31 07:52:52,来自湖北,51002775430,杰非大帝
7126298692499948296,沈腾搞笑的点让人烦，对他喜欢不来。,0,59,2,2022-07-31 06:40:57,来自上海,1077160604610788,五颜六色的太阳花
7126193365930623751,沈腾有演技？,32,265,5,2022-07-30 23:52:28,来自江苏,93169511438,Cookie1991
7126385184051872553,沈腾我肯定不投，海青其实还不错，我会投,0,1,0,2022-07-31 12:15:01,来自广西,6416989228,拿了桔子跑啊
7126198377922544414,沈腾是因为演了太多的喜剧，影帝基本都是在正剧出。袁泉和海清的话，专家组可能觉得袁泉资历老，接的剧少但都比较好，海清还年轻，资源也多机会也还多，所以偏好袁泉获得影后选择了袁泉吧,9,22,7,2022-07-31 00:12:17,来自四川,1706861117347070,一个良心发现的地产人
7126464565671641869,真实结果，都说海清演技好，没看出来,0,0,0,2022-07-31 17:23:33,来自吉林,56686957059,才思敏捷喜鹊QQ
7126539552726467343,评心而论，沈腾真没什么演技，不管什么角色，动作，表情都一样，0票是真实的,0,0,0,2022-07-31 22:14:06,来自陕西,110259237239,自在明镜WW
7126234520370283275,想问的是，票房重要还是得奖重要呢？,2,8,1,2022-07-31 02:43:03,来自黑龙江,14562337732,休闲不是闲
7126523889857545000,海清我肯定投，沈就大陆周星驰，但表演差了好几个档次,0,0,0,2022-07-31 21:13:19,来自上海,4292137786025758,艾密死优
7126403932464808716,评的好！金奖得主实至名归！[赞][赞],0,0,0,2022-07-31 13:28:30,来自北京,109097930158,玫瑰色云朵
7126214716473017122,张译袁泉影帝影后有毛病吗？,4,21,2,2022-07-31 01:16:38,来自云南,106802898898,主西请背锅
