7126511343309947687,天啊，开车睡觉，应该取消驾照,25,615,4,2022-07-31 20:25:16,来自河北,88106702777,南山草木香
7126520691960726283,有一次我跟老公坐一辆出租车，从机场回市区的高速上，也是下午，司机困得睡着了，车还继续开着，当我们从后视镜发现时吓得一身冷汗，赶紧把师傅叫醒，一直跟他说话，但是师傅好像情绪和意识都不太高，太恐怖了！！,8,55,1,2022-07-31 21:01:24,来自广东,3486249938,名字太难起了6666
7126512107029299979,欧盟国家对公路运输业有统一规定，对司机的驾驶时间、休息时间、车速等均有严格规定。如法国规定卡车司机每周工作35到39小时，每天最多工作9到10小时，一年有5周带薪休假等。法国卡车司机的劳工权利还有一系列法律法规保护。如出车期间，每驾驶4.5小时就必须停车休息45分钟，每个月必须在途中休息6个整天。欧盟国家的警察也会根据车上的电子记录仪来监督司机，凡是超时工作、超速行驶、违规操作等均将受到罚款、吊销驾照等严厉惩罚。,34,123,3,2022-07-31 20:27:53,来自山西,435056019767885,草原狼and倪
7126519271131792132,昨天还看到新闻说一驾驶员眼睛太小被监控判开车睡觉[呲牙][呲牙],8,121,3,2022-07-31 20:55:53,来自福建,910047937831704,锁心简
7126509811516343080,我一上高速就特别困，困的睁不开眼，掐腿拧耳朵都没用，一下高速立刻精神，尤其下午返程，有时提前喝红牛能好点，据说是神经衰弱引起的[泪奔][泪奔][泪奔],84,109,4,2022-07-31 20:18:34,来自陕西,5416328024,吃个瓜瓜
7126535072131777310,我是货车驾驶员，如果这个客运司机以前就存在多次疲劳驾驶的行为，我可以负责的说该驾驶员不适合跑长途，因为有些人开车超过一两个小时就会犯困，真正休息好的司机轻轻松松可以开四个小时，我作为一个老司机从来不坐长途大巴，坐火车或高铁不香吗？,2,26,0,2022-07-31 21:57:02,来自广东,5457331361,李小璐就该封杀
7126476578355823390,疲劳驾驶很危险！切勿疲劳驾驶。,2,371,3,2022-07-31 18:10:37,来自上海,993555120396158,你好kRyc
7126528580418601763,靠…这么严重的犯困了，还好没有出事故。9分钟4次睡着了，没有伤害到人家真的不简单！大家现在终于明白了，为什么路上老是大货车出事故的原因了，大部分大货车司机就是这样了，开车开着开着就睡着了。一旦发生事故，自己也就完了完了………希望所有货车以后都要安装实时监控才行。。。而这次出现那么严重，只罚了3000元，有啥用？应该要禁止五年驾驶任何车型，第二次教育还未改进直接吊销驾驶证禁止再考。要是没有刚好查到呢？后果真的不敢想象啊！,0,19,0,2022-07-31 21:31:25,来自广东,3601736581,隔壁老黄5168
7126509435635745540,无语 就不能停服务区休息一下吗 一出事故到时候害人害己,6,15,0,2022-07-31 20:17:38,来自广东,51488068571,靓仔周影视
7126501634984788743,一车人的性命就在眨眼之间，太可怕了，这样的司机不能再开客车了,3,124,0,2022-07-31 19:47:06,来自安徽,53445719365,无影拖拉
7126510887145653033,特别困的时候，能在应急车道停车么？？？呵呵,8,20,1,2022-07-31 20:22:42,来自江苏,92359382610,长红尘
7126536330619667237,疲劳驾驶！这种状态非常危险‼️我也曾经有过这种经历，当时行驶在中间车道，因为疲惫的原因，几次无意识的闭上了眼睛，结果最危险的一次，当我睁开眼睛的时候，车辆已经行驶在了右车道！吓得我一下子惊醒了过来，车上还有我老婆。,0,3,0,2022-07-31 22:01:49,来自广东,83719379146,上仙真人董牛郎
7126508484971381504,有些服务区隔的太远了，应急车道应该搞大些。给一些实在困。或者车辆有点故障的临时停放,3,18,0,2022-07-31 20:13:28,来自广东,3931462677855358,热情的葡萄lNq
7126551341501776655,我有一次也是，下班晚上十点多出发，一直堵车没睡觉，四五点好不容易过了江，服务区全部满的，只能硬着头皮开，六点的时候忽然醒来，一辆面包车就在眼前，我急忙一把方向，堪堪避开了，吓出一身汗，我妈在后面睡着了。太恐怖了,0,0,0,2022-07-31 23:00:05,来自江苏,2625286834241271,热心精灵mx
7126526141497688844,我想知在高速公路上倦意来袭，在那停车休息？服务区太远，应急车道不许停。,4,6,1,2022-07-31 21:22:26,来自广东,4357740109,瑜伽冥想
7126511542539322145,这是什么监控系统？,4,6,0,2022-07-31 20:25:55,来自河北,764868519270316,周期万物
7126527185263264520,高速上最容易犯困，走国道反而能超长时间操持清醒。原因很简单，高速路况好绵绵不绝的车道线就是最厉害的催眠神器。其实不是你真的疲劳了，是被车道线强制催眠了。你只要开进了服务区立马解除催眠效果，精神抖数。,0,12,0,2022-07-31 21:26:19,来自广东,11354934253,房帅137
7126547381126120199,长这么大就做过一次长途大巴，以后再也不敢做了，原因就是晚上我躺着的时候打盹，准备睡觉，刚刚瞌睡来了快睡着那时司机老是一刹一刹的，就跟我的瞌睡一样一点一点的！但是我的心里就在想，我草，司机不会跟我一样在打瞌睡吧！,0,0,0,2022-07-31 22:44:47,来自四川,5382313865,聪明的奶茶Lr
7126513166075003662,疲劳驾驶员，开到服务区休息下，休息20分钟就好了,6,28,1,2022-07-31 20:32:02,来自云南,104242344051,建水30
7126478991497888552,注意安全，遵守交通规则,2,57,3,2022-07-31 18:19:05,来自广西,68026245895,你的小红帽已上线
7126515509935784741,观后谈三点：一：几十个生命太危险了，此驾驶员不谊开客车。二：为什么打瞌睡，特别是平坦舒适的高速路，要找到并解决问题的根本原因。三：各大部门顶格处理，以罚款的形式，只能让这一个司机心痛，没解决到根本问题。,0,12,0,2022-07-31 20:40:59,来自广东,6072713059,幸福涛哥
7126550929046307623,只能说这司机不宜再从事长途驾驶的职业，他是身体健康状况不许，看体态明显有三高嫌疑，糖尿病患者在没有控糖情况下，饭后血糖的飚高会使人极度困顿嗜睡，不是意志能决定的。,0,0,0,2022-07-31 22:59:20,来自陕西,5726757126,pp大侠
7126551436003590915,这拍的太仔细了，高速路上，稍有不慎，就是天大的事故！这真来不得半点马虎啊，疲乏了 可以找安全点休息休息。,0,0,0,2022-07-31 23:01:19,来自新疆,52340455245,张思远33
7126514274788868872,长途车副驾没人就可以处罚了,0,8,0,2022-07-31 20:36:17,来自广西,3114269223954221,暖风隔岸sun
7126503801829311267,建议所有高速公路每三至五公里设置一处避险港湾，为有疲劳驾驶，车辆突发故障等安全避险,9,28,3,2022-07-31 19:55:21,来自天津,4120592402885975,闻善阳光
7126496621793411881,为什么要疲劳驾驶？要从根儿上解决问题。谁愿意疲劳驾驶？,7,50,3,2022-07-31 19:27:32,来自北京,83895280795,霞霞1245
7126527738034275113,高速限速100迈是疲劳的催化剂，120会让人精神紧张，注意力集中。这是我一个三十年驾龄的司机总结出来的一条经验。看文中这个司机也是在时速98公里闭着眼的。,0,2,0,2022-07-31 21:27:58,来自湖南,59061246463,158985631传播正能量
7126509827462791970,这种情况下，不是罚款那么简单，应该。吊销驾照。,0,14,1,2022-07-31 20:18:31,来自广东,75837587504,容245485667
7126493851820294943,把一车人的生命当儿戏，是应重罚司机。,16,118,3,2022-07-31 19:17:01,来自四川,109556374504,拾起地平线
7126505136880763684,行车时遇到闪光灯刺眼，条件反射都要眨下眼，这个算不算违章？,1,13,4,2022-07-31 20:00:52,来自陕西,98498513660,道法自然YF
7126531123861783300,我靠，这哥们修行不分场所啊,1,1,0,2022-07-31 21:42:03,来自吉林,105349961619,渔樵de寻隐者奇遇记
7126513444303946530,在高速上，困了，离服务区又有段距离，不知所措的,1,1,0,2022-07-31 20:32:41,来自海南,54640894285,路易斯妙妙1
7126495798287696677,客车最好还是凌晨休息几个小时比较安全,3,8,1,2022-07-31 19:24:36,,68396353069,石小俊666666
7126529710385431329,高速还收超时费，逼得司机不敢睡觉[灵光一闪][灵光一闪][灵光一闪][灵光一闪],0,2,0,2022-07-31 21:36:21,来自湖南,3056277342661203,兰姆伽户外
7126536780262408994,当事驾驶员怎么处理的？,0,0,0,2022-07-31 22:03:21,来自湖南,12664692225,German25
7126526673310810887,这要是高速上发生事故，后果不堪设想,0,1,0,2022-07-31 21:24:23,来自广西,110528341468,相信就可以
7126528079253848839,既然有监控系统，还能远程监控，何不加一个辅助警告功能，刺耳的声音持续不断，让驾驶员自己关闭，不是更加安全吗！或者远程监控到驾驶员闭着眼睛开车了，启动远程自动拨号功能，提醒驾驶员，可行不？,0,0,0,2022-07-31 21:29:51,来自湖南,3275643836,扫地的10228686
7126528434054316834,司机真幸运，要不是被发现，不一定会发生什么事。,0,2,0,2022-07-31 21:30:50,来自黑龙江,110148462212,哎113322
7126535545177932584,为了他人和自身安全谨慎疲劳驾驶,0,0,0,2022-07-31 21:58:24,来自山东,50375673777,我是谁128400428
7126519339876434695,疲劳驾驶！拿安全当儿戏！严惩不贷！,0,9,1,2022-07-31 20:55:56,来自吉林,1200290297811556,阳春白雪39933
7126513310438753024,疲劳驾驶、害人害己！,0,5,0,2022-07-31 20:32:09,来自广东,2648054409202717,村间田野
7126513967807791903,处理得好，为行政机关点赞。,0,5,0,2022-07-31 20:35:11,来自湖南,4670293556,Wudf
7126510260223361832,生死就在一念之间，拿生命当儿戏，这个司机该下岗了！,0,7,0,2022-07-31 20:20:23,来自湖南,6072345295,新邵阳
7126517339746878215,想起当年我在一辆大巴上坐在司机后座，也是眼睁睁看着司机打盹，要不是我拍醒差点撞上隔离带，一整车的人，好可怕,0,7,0,2022-07-31 20:48:05,来自福建,52527112275,OMEGA计划
7126530987823366945,最高罚款那是对公司处罚，司机呢，已重新培训还是这样，不吊销驾照都不好意思说顶格处罚。,0,0,0,2022-07-31 21:41:19,来自广东,2833986027,花都踏浪
7126522481741497123,这司机该重罚呀，多危险,0,2,0,2022-07-31 21:07:41,来自四川,1609329169927087,静心cn
7126527422207738664,听说湖南高速公路的监控很厉害的，疲劳驾驶时间太长会打电话问候的,0,1,0,2022-07-31 21:26:50,来自上海,51379260030,啤酒小哥可
7126516834220163876,这就是为什么高速上经常发生大车事故的原因，疲劳驾驶首当其冲。,0,4,0,2022-07-31 20:46:09,来自安徽,108327407800,有行动就有可能
7126524188961096448,罚款应为辅助手段，吊销驾驶执照是保险手段,0,3,0,2022-07-31 21:14:16,来自辽宁,4468027820351166,幸福高山Lu
7126509364731085575,为智能系统点赞👍,0,10,0,2022-07-31 20:17:10,来自青海,58404752244,悠闲敏捷
7126543110679282467,有一次五一回老家，一个人连续开了16个小时，也是一直打瞌睡，一路上服务区都是排队几公里，根本进不去，其实我也想休息，实在是没有办法，只好硬着头皮开,0,0,0,2022-07-31 22:27:59,来自江苏,106796074883,洇潙碙恏喁見沵คดถง
7126509762077999905,数次了，真发生交通事故，3000元是轻还是顶格！,0,4,0,2022-07-31 20:18:53,来自北京,1904001789203095,进取宇宙Gf
7126516634122339079,谁都知道生活不易，但也不能害人害己！,0,3,0,2022-07-31 20:45:21,来自广东,3117664294,寡妇她二叔
7126537101180683043,可以升级成自动驾驶,0,0,0,2022-07-31 22:04:26,来自江苏,50259664752,惠山脚下
7126534363542127397,不应该只是罚款了事吧？如果出一次事故将造成多大的损失呢？这个司机就不合适这个职业,0,1,0,2022-07-31 21:54:22,来自广东,440273479401559,灵魂白书
7126510223779103522,拿生命当儿戏，是该重罚！,0,4,0,2022-07-31 20:20:18,来自湖北,888011512626767,淡泊直爽的大叔
7126532375529652999,这是不负责任的行为，已危害了他人安全，应严重处理此司机,0,1,0,2022-07-31 21:46:23,来自河南,62910273047,用户喜欢历史看真相
7126547295512101666,为什么就不是探照灯太亮，导致驾驶员眯眼呢？,0,0,0,2022-07-31 22:44:09,来自新疆,51657546715,灰灰鸽
7126513750638625547,太危险了，疲劳驾驶会害己害人。,0,5,1,2022-07-31 20:34:11,来自广东,104802955966,我心飞扬610
7126511130083984131,请问哪个长途卡车或者大客车哪天不疲劳驾驶？……能怎么办？不干驾驶员体会不到的！谁不想一觉睡到天亮再走……,0,6,1,2022-07-31 20:24:16,来自山东,51247557198,十月的天空下
7126537150678139678,"3千处罚太轻了
一不小心非常容易发生重大安全事故，他可是客车司机[打脸][打脸][打脸]
应对其驾照降级处理！！",0,0,0,2022-07-31 22:05:11,来自福建,1116726026569671,福多多916916999
7126546390033154855,以前做检测工作，公司领导逼迫着加班，很多次高速上疲劳驾驶，后来辞职转行了。现在想想那段日子没出事，觉得是万幸！,0,0,0,2022-07-31 22:41:17,来自广东,107960685409,智勇双全小鱼NO
7126533042390385419,司机说我只是眨了一下眼，时间久了一点而已[泪奔],0,0,0,2022-07-31 21:49:22,来自广东,1890798153242904,多彩光束z5q
7126507693686293279,人命关天，执法要严！留底备案的同时，也可以给当事人留一次机会，如若再发现此类问题，立刻吊销驾照，并终身不得再考取驾照。,0,6,0,2022-07-31 20:10:37,来自山东,66537461230,站在四维世界
7126528823545496324,有一次坐出租车跑长途，司机和我都睡着了！随着司机的头点一下，司机的脚在油门踏板也踩一下，车子就这么一耸一耸在跑着。吓死人了！,0,1,0,2022-07-31 21:32:44,来自湖南,536171435264990,爱生活的一片闲云
7126543182141670144,司机24小时待命，太难了！吃无定时，又没有加班费！当大家都下班了，突然叫你跑几个小时，问你怕不怕，看你累不累！,0,0,0,2022-07-31 22:28:19,来自广东,971599403815924,瞎聊瞎聊瞎聊
7126507130710459173,危险驾驶不入刑吗，如果撞上前车再造成后车连环事故,0,6,0,2022-07-31 20:08:40,来自湖北,19349216266,记忆碎片70
7126550068521468686,顶格处罚也只能处罚3000元，与生命相比如同儿戏，就没有更好的办法了吗？,0,1,0,2022-07-31 22:55:27,来自云南,6997837256,小松123158042
7126536628512080651,这种人不适合做长途客车驾驶员,0,0,0,2022-07-31 22:03:18,来自山东,107790985212,孟1979
7126535033321849636,去年12月G78汕昆高速贺州收费站附近就是因为大货车司机疲劳驾驶，造成4人当场死亡的重大事故！,0,0,0,2022-07-31 21:56:53,来自广西,109915208010,住你隔壁的老叶
7126497285390926607,只是罚款，简直是害他全家。应该是吊销驾照,0,4,0,2022-07-31 19:29:59,来自广西,760506721777860,率真奶酪rU
7126513173502460672,司机平时都爱打牌，作息不规律很容易疲劳驾驶,0,1,0,2022-07-31 20:31:30,来自湖北,352319222584840,多毛的大腿
7126514339297313577,支持！疲劳驾驶客运大巴太危险,0,1,0,2022-07-31 20:36:09,,102965757718,沙漠沙
7126520337092674315,一车人的性命就在眨眼之间，太可怕了，这样的司机不能再开客车了！[流泪][捂脸][握手],0,2,0,2022-07-31 20:59:46,来自云南,110854482155,喜欢各种健康活动
7126533476475683617,一定要注意，以前本人因困进入服务区车道时，车右侧还是擦了路边防护栏，是一次警告，也是唯一一次，否则疲劳不休息就是走向死亡的通道。,0,0,0,2022-07-31 21:50:55,来自山东,61187350659,诗情202782088
7126538242845180710,这哥们儿是高手，天堂地狱来回走[呲牙]可千万别害人啊,0,0,0,2022-07-31 22:09:40,来自湖北,79973086005,絔合兲稥
7126519316258505508,建议客车都应该安装ACC自适应巡航，车道保持，主动刹车等主动安全装置,0,2,0,2022-07-31 20:55:59,来自山东,110150410083,多彩的夜空
7126518249067873038,客车司机掌握几十个人的生命安全，客运公司要合理安排工作及合理工资待遇。,0,1,0,2022-07-31 20:51:39,来自四川,52079995339,老咪哥
7126517989511463720,司机师傅们太辛苦了！社会最底层的百姓，为了生活，为了口饭，为了有汤，小命在腰带上！全社会多关注，关心他们一下吧！,0,0,0,2022-07-31 20:50:12,来自天津,51324554772,帅帅奥
7126526572827853602,疲劳驾驶，太危险了,0,0,0,2022-07-31 21:23:41,来自湖北,874807546377054,你虎啊娘娘
7126529367211410216,我想知道，罚那几千块，谁会怕，大车司机都算在成本里了,0,0,0,2022-07-31 21:34:25,来自广西,24259084698,龍傑5
7126523435685593871,问问交警这种情况算不算应急事件，能不能在应急车道停车缓解一下呢？,0,1,0,2022-07-31 21:11:26,来自河南,103007365635,盼盼3624
7126532780343444239,驾驶员不扣分吗？,0,0,0,2022-07-31 21:47:51,来自内蒙古,1947979733282852,自由露珠lP
7126521738037003015,昨天我也有一瞬间无意识状态，高温天气驾车极易疲劳，后怕。,0,0,0,2022-07-31 21:05:17,来自湖南,5870248681,今宿留宿星宿
7126551502638154511,这个处罚坚决支持！,0,0,0,2022-07-31 23:00:32,来自广东,3854114575,漢海星辰
7126530328982356770,生命无价，为长记忆，顶格处罚，三千划算,0,1,0,2022-07-31 21:38:14,来自福建,101447722540,憨不是憨
7126530413031457576,千万千万不要疲劳驾驶，我昨天刚刚经历了一起高速事故现在还后怕。,0,0,0,2022-07-31 21:38:23,来自河南,3571086350,謓嘚噯妳
7126550451834716967,长途客运司机可采取双驾驶员制度,0,0,0,2022-07-31 22:57:06,来自湖南,93473447783,随风飘荡盛
7126510332029240102,有没有服务区给他停休息呢，现在高速路上很多停车区不开放，不知道是什么问题。,0,3,1,2022-07-31 20:20:52,来自广西,111410015616,大气明月JD
7126547098979943181,"疲劳驾驶危险！！！
无论什么理由，都不应该是疲劳驾驶的借口！！！",0,0,0,2022-07-31 22:44:08,来自山东,50241685359,英英爱剪辑
7126512684874629901,可能不是疲劳驾驶，这是习惯性打瞌睡了，只要往驾驶位一坐车子一晃荡，两只眼就不由自主合上了[捂脸][捂脸][捂脸],0,2,0,2022-07-31 20:30:01,来自西班牙,3597198249700328,加百利咖啡
7126507575105323816,应该吊销驾驶证,0,3,0,2022-07-31 20:10:00,来自广东,96809232419,华南美景A
7126532494384153374,中国国内的大货车驾驶员那个不是这样，现在都一个人跑，每天工作16小时以上，我就不信不打瞌睡😪😪😪😪😪😪😪😪😪😪😪,0,0,0,2022-07-31 21:46:59,来自河南,59112173592,孤风夜影1
7126524400098657057,没出事，大家觉得没多大事，批评教育一下，如果出了事，多少人伤亡 ，损失多大，多少人善后，受处理！,0,1,0,2022-07-31 21:15:55,来自河南,2308617220404124,上进的铅笔S6
7126514330204013315,疲劳驾驶比酒驾还容易坏事，酒驾多少还有意识，疲劳驾驶很容易睡着。,0,1,0,2022-07-31 20:36:48,来自湖北,6007722675,日食010
7126510995308282661,经常这样的话，吊销机动车驾驶证,0,1,0,2022-07-31 20:23:24,来自广东,101167730207,工程师刘生
7126529650482168584,疲劳驾驶是世界性问题，是一种经神难已抗拒的问题，所以说不纳入保险理赔会是一个永远的问题。给个平台，就是一个正义，不能成为永远诋毁性问题。,0,0,0,2022-07-31 21:35:44,来自江苏,6859171273,唐民德
7126503206976783139,这种人应该吊销驾照，永不得再考！,0,4,0,2022-07-31 19:53:04,来自山西,105127157129,梦的远方175
7126532920961352489,对于那些跑高速错过出口停车的人应该也要定格处理，责任一定是全责就好了。,0,0,0,2022-07-31 21:48:22,来自湖南,1359439614977884,余公祠二哥
7126505216781861636,城管也可以处罚疲劳驾驶？,0,1,0,2022-07-31 20:01:17,来自福建,3872140859,晕奶的奶娃
7126511965061219080,疲劳驾驶简直把生命当成游戏了，禁止疲劳驾驶，更要注意交通安全意识让事故降到零点,0,0,0,2022-07-31 20:27:25,来自河南,2335008922272339,真的不容易
7126527712893977347,服务区不一定就能进得去，以前都有停车岛，估计停车岛影响服务区的生意了，就都取消了。,0,1,0,2022-07-31 21:28:30,来自广东,3896268671946836,风尘红七公
7126531990387917576,能戴帽子开车吗[泪奔],0,0,0,2022-07-31 21:44:59,,149184367572992,咿呀学语哦
7126529613610337064,我看新闻说高速休息区不让睡觉，睡觉了在高速时间超了要罚款，咋办？,0,0,0,2022-07-31 21:35:30,来自新疆,97301277007,不执着不住相
7126511239014662919,疲劳驾驶可以让车在最宽敞、平坦、安全的道路上发生致命事故,0,2,0,2022-07-31 20:24:38,来自广西,70510615759,英熊不问出处
7126528758538568459,这司机哪里是在开车，分明是在开玩笑[哈欠][哈欠][哈欠],0,0,0,2022-07-31 21:32:54,来自广东,101884566146,甘肃胖子
7126545288143569676,有时候我也是开车开得困得不行。[流泪]到服务区又睡不着,0,0,0,2022-07-31 22:37:09,来自湖南,97466181750,欧小阳迎难而上
7126525794696545058,客运公司都开始996 007了？太可怕了,0,0,0,2022-07-31 21:20:40,来自湖北,3565747601,Swm
7126503634916868898,像这种如同公交车上有人袭击司机一样恐怖，必须顶格处理,0,4,0,2022-07-31 19:54:38,来自湖南,110505908799,长沙老蛮哥
7126514020340843278,没地方停车，服务区大车跟本停不进去。,0,0,0,2022-07-31 20:35:05,来自湖南,5797412053,认真的菠萝mv
7126513613581959975,历害了，闭眼睡觉就能开车。,0,1,0,2022-07-31 20:34:01,来自浙江,96768517802,浪迹天涯王世淳1
7126514287006860045,关键是你疲劳了想休息，去哪休息啊？服务区？服务区几十公里才一个。,0,0,0,2022-07-31 20:36:19,来自湖南,5475386147,ZXM17590
7126527064974410509,庆幸没出事故[捂脸],0,0,0,2022-07-31 21:25:38,来自湖南,1152705442887980,暖阳的小兔牙
7126522890245341989,不行就进服务区，别伤了自己还连累别人,0,3,0,2022-07-31 21:09:31,来自河南,4504178580,八零后大叔007
7126522820611949344,开车不是一个好干的活累了就应该休息这样很危险的,0,0,0,2022-07-31 21:09:53,来自云南,109916618953,发哥2020
7126516344513938189,高速路上车越少人就越容易犯困，特别是在夏季高温车上开着空调更是如此。,0,0,0,2022-07-31 20:44:10,来自湖北,3416924163147709,安逸豆花w
7126515019630199587,这马赛克打得跟没打一样，闭眼是不是看时长啊，抓拍眨眼不算吧,0,0,0,2022-07-31 20:38:52,来自广东,3328956995745768,大唐沉寂
7126542814372037411,这个怎么查到的？,0,0,0,2022-07-31 22:26:39,来自福建,66963667002,海内万象
7126544134118376233,这种人不该当大客司机！,0,0,0,2022-07-31 22:31:49,来自河南,51166313163,热情的百香果Pn
7126513756191867683,为什么要疲劳驾驶？要从根儿上解决问题。,0,2,0,2022-07-31 20:33:46,来自广东,3636782917757624,解放台湾007
7126525253332828943,明明有副驾驶，但是就是没地方给你换，公路规划实在是太差了，多做点停车区又怕影响服务区生意[泣不成声],0,0,0,2022-07-31 21:18:20,来自上海,3795168911730030,爱斯基摩人K99
7126519209114764062,交通管理就应该严格，安全无小事！,0,1,0,2022-07-31 20:55:24,来自河南,98472013883,cltclreie
7126533074569184015,出事就后悔了？这种人已经有过，干嘛还要让他开车？,0,0,0,2022-07-31 21:48:51,来自安徽,2922229402,吾夫农
7126549051352810271,我开车可以连续6个小时，超过6小时就会犯困，之后可以嚼口香糖驱除困意。如果再犯困，无论多急的事也要停车睡会儿，哪怕只有5分钟也完全可以继续保持清醒。,0,0,0,2022-07-31 22:51:32,来自广东,1437756266643908,CH笑苍生
7126528380753429287,疲劳驾驶监控应该不论大小车都应该装，总之，大型车的的那套监控，小车也应该装。,0,0,0,2022-07-31 21:31:18,来自广东,105132846644,影子33333
7126550257743971112,我要是开车，一般都会注意休息，在服务区睡十分钟，反正上车前要休息一下，对自己和家人负责,0,0,0,2022-07-31 22:55:58,来自湖南,71363056702,如影随形227787751
7126543892421968677,是不是有强光照射的测速点，那灯光太刺眼！,0,0,0,2022-07-31 22:31:31,来自广东,3073833376693548,潇潇洒洒策牛奔腾
7126520459407278883,害己，害人，危害社会，触目惊心！,0,2,0,2022-07-31 20:59:51,来自湖南,108306189356,高山泉流
7126523464043037455,我走过几次高速，每逢一个或者隔一个服务区就要进去停车上个厕所走走坐坐……,0,1,0,2022-07-31 21:11:31,来自广西,8245791417,卿本执拗
7126543284431913742,怎么不是吊销驾照？！,0,0,0,2022-07-31 22:28:54,来自广东,2062326597423517,聪慧豆浆Nm
7126503016831877920,大货车，泥头车，能不能实时监控！！！,0,2,0,2022-07-31 19:52:52,来自广东,3720368889820845,不凡漂流瓶em
7126540457240462115,这个处罚好，为己为人为社会[赞],0,1,0,2022-07-31 22:17:34,来自广东,369887410925992,机智的沙滩gW
