7126505801333719842,疲劳驾驶这样界定？还是4小时进站20分钟？特斯拉自动驾驶怎么界定？,0,2,0,2022-07-31 20:03:01,来自云南,102930354480,开向荒野
7126533376604980004,疲劳驾驶危害大于酒驾,0,0,0,2022-07-31 21:50:20,来自浙江,6375945055,立辉86756376
7126534837955642126,牛皮 摄像头连司机眯眼都知道[大笑],0,0,0,2022-07-31 21:56:12,,98082302063,桂G罗老虎
7126530413031490344,3000元就这么完事了？万一出车祸了是什么情况？,0,0,0,2022-07-31 21:38:24,来自湖北,769272896291292,隔壁老王大爷奥奥
7126537341703078669,此生再也不能开车了！,0,0,0,2022-07-31 22:05:49,来自江苏,5749271303,星际雲
7126530247851311907,9分钟，连续闭眼怎么闭？,1,0,0,2022-07-31 21:37:46,来自广东,110494521499,小小码农谈码码
7126528273328915234,千万不要再坐长途客运车！,0,0,0,2022-07-31 21:30:14,来自广东,51569209511,天不灭秦
7126517769382347532,疲劳驾驶的危险程度不亚于酒驾,0,0,0,2022-07-31 20:49:56,来自贵州,3033653014,ingyuing
7126512492683494159,这种客车不是两个司机吗？,0,0,0,2022-07-31 20:28:59,来自湖南,98900304422,愿得一人心4393978096863
7126526299426046724,拒绝疲劳驾驶,0,2,0,2022-07-31 21:23:01,来自河北,62528882184,冀Ji优童车店
7126512882091016972,这种司机要终身禁驾，否则迟早出大事,0,2,0,2022-07-31 20:31:04,来自湖南,62783530873,A逍遥客180681656
7126533931868603148,确认是疲劳驾驶的话，太危险了,0,0,0,2022-07-31 21:52:52,来自四川,56524970403,一1渡缶
7126519064796791582,前几天看到一个在高速上休息睡超时了，要交全程过路费，到底让休息不让休息呢,0,1,0,2022-07-31 20:54:34,来自北京,62044562298,狂风中的风筝
7126547884694225678,只找司机的毛病，他就愿意开车睡觉，这就对了,0,0,0,2022-07-31 22:46:58,来自河北,3249783481827863,时髦梦想家G8
7126532900002251553,大脑供血不足，缺氧，极易打瞌睡。我开车不能超1小时，完全熬不住，平时只要坐下来就会打瞌睡。,0,0,0,2022-07-31 21:48:46,来自湖南,2831137083,一丝不挂
7126534308382212895,状态不好坚决不开车，对自己负责也对别人负责！！！,0,0,0,2022-07-31 21:53:59,来自重庆,382232097728379,傲然星凌云
7126517989377491712,我每次经过湖南，都有交警打电话来，叫我休息,0,0,0,2022-07-31 20:50:17,来自福建,63872585691,厦门邓邓
7126510771802653475,以前雇的货车司机，睡着了还打转向灯超车,0,0,0,2022-07-31 20:22:25,来自山东,21594252705,亲切原野iU
7126550375116800808,所以这玩意才最应该率先推广L3驾驶辅助,0,0,0,2022-07-31 22:56:06,来自北京,3978794740,18x2
7126508279526064937,简直就是拿乘客的生命当儿戏！谁还敢乘坐这家客运公司的车？,0,0,0,2022-07-31 20:12:44,来自四川,5791114046,梓州木易楊
7126511498683253539,非法营运是1~3万，这个危险驾驶却是一到三千。[尬笑][尬笑][尬笑][尬笑][尬笑][尬笑][尬笑][尬笑][尬笑][尬笑][尬笑][尬笑],0,2,0,2022-07-31 20:25:02,来自广东,87642469955,阮大柱
7126535971218752268,疲劳驾驶比酒驾还严重危险性更大,0,0,0,2022-07-31 22:00:51,来自浙江,4263621376,睿智用户天天快乐
7126523696227549987,这个处罚的好，应该进一步加强这方面的监督排查,0,0,0,2022-07-31 21:12:30,来自重庆,92827024469,久久280102771
7126525606950388521,为什么不轮班驾驶？,0,0,0,2022-07-31 21:19:42,来自湖南,83169547392,惟钧
7126507701051638536,太可怕了，虽然劳动者值得尊敬，但是有必要处罚，车上承载着多少条人命多少个家庭可曾想过？！,0,2,0,2022-07-31 20:10:52,来自山西,6886238479,怀揣梦想的享受孤独刘
7126533548399706912,两客1危，这是危险品车辆吧？那这么驾驶确实不应该,0,0,0,2022-07-31 21:51:14,来自辽宁,3658807416198606,平凡世界平凡你我
7126529274567803663,这样驾驶员把乘客的生命开玩笑,0,1,0,2022-07-31 21:34:08,来自浙江,68717164987,一往无前王蒙多的铁粉
7126545744257385246,切勿疲劳驾驶，为自己为他人好！,0,0,0,2022-07-31 22:38:48,来自广东,2704393980615876,快乐天使80656
7126525313164690213,"监控这个都看得那么清晰？！
咋罪犯只能看到一个迷糊的身影！？
不懂，也不好理解。",0,0,0,2022-07-31 21:18:58,来自四川,52983029805,锘言2
7126550386781586210,疲劳驾驶太危险了[祈祷][祈祷][祈祷][祈祷],0,1,0,2022-07-31 22:56:23,来自山西,2510907062885752,细心伊宁7S5
7126521739252908808,天啊，这不是害人吗，这样子开车,0,0,0,2022-07-31 21:05:04,来自湖北,1148360991710679,星空柒柒柒
7126520909213205288,盲开，顶格处罚,0,0,0,2022-07-31 21:01:44,来自河南,21084323920,胜利127496561
7126516561397695239,小发一笔！如果一天有10个这样的司机那就是三万个大洋的收入。,0,0,1,2022-07-31 20:45:09,来自浙江,103293944208,端庄花猫Rt
7126541221069193992,我经常从广东五华出发云南，一直到广西百色才下高速休息，全程高速十多小时，中途顶多在广州附近及南宁附近服务站上个洗手间。,0,0,0,2022-07-31 22:20:47,来自广东,50263095452,亚古叔
7126521567261033247,这司机应换岗位，不然以后有事出,0,0,0,2022-07-31 21:04:21,来自江西,66641013505,13684853919
7126519321735873287,大卡车司机闭着眼开车的太多了！所以高速上要远离大卡车！,0,0,0,2022-07-31 20:55:52,来自江苏,553773818972919,来自北方的狼aL9O
7126527847073809159,一睁眼一闭眼一天过去了，一闭眼不睁眼一辈子就过去了！,0,0,0,2022-07-31 21:28:47,来自辽宁,104955650289,雨露杂谈
7126514016612205324,谁想疲劳驾驶？谁愿意拿自己生命开玩笑？,0,0,0,2022-07-31 20:35:23,来自浙江,57024951759,蒲竹斋
7126513767718388520,我越开车越精神不知道咋回事？,0,0,0,2022-07-31 20:33:58,来自浙江,14829610824,那仅仅是个梦
7126531568285467392,这司机真的也是命大，与死神擦肩而过呀,0,1,0,2022-07-31 21:42:58,来自北京,85526844293,超超有约
7126541343413060385,我12年时从广州坐车回，司机也是这样，因为当时那车不是我们这边的，是路过我们这，快到了我就坐前问司机，结果人家睡觉开。,0,0,0,2022-07-31 22:21:42,来自江西,96971499163,以爱之名
7126543308486722337,高速开车最好两个小时就在服务器休息一下,0,0,0,2022-07-31 22:29:24,来自陕西,3492461954729172,雅典娜的惊叹985
7126508378012091175,吊销驾照啊，只要钱,0,0,0,2022-07-31 20:13:30,来自江苏,51122497731,一路彩虹17
7126513661895934755,疲劳，此人不适合跑长途。,0,0,0,2022-07-31 20:33:30,来自广东,3438877848374877,魔法星辰dA
7126508076190630690,这类人不适合开车,0,0,0,2022-07-31 20:11:58,来自陕西,6795010061,白云特
7126542460163490599,一定要休息，不能这样驾驶 对自己，对家人不负责任,0,0,0,2022-07-31 22:26:00,来自湖北,3790717368677371,joywa0409
7126524700037382951,师傅你这不仅是对自己生命和家人不负责，更是对社会和他人的生命安全不负责，困了疲倦了就停车休息一下,0,0,0,2022-07-31 21:16:57,来自安徽,65645004630,西北的风
7126504566199255822,太危险了，我差一点成了疲劳驾驶受害者，命大！！！,0,0,0,2022-07-31 19:58:29,来自山东,61189719240,狼图藤66
7126490669686162216,不是两个司机吗？干嘛还这样拼,0,7,0,2022-07-31 19:04:28,来自广东,111616305544,直爽天空56
7126515493288362790,应急车道又不让停可咋办？这是不是应急情况？,0,0,0,2022-07-31 20:41:13,来自重庆,100800920697,阿里大猫
7126542329510560546,我就是开车睡着了出了一次事故，感恩没挂[捂脸]现在只要一困就休息。,0,0,0,2022-07-31 22:24:44,来自广西,108658085710,看新闻还要想个啥名字
7126516458385507102,这是对家庭的不负责任，重罚,0,0,0,2022-07-31 20:44:48,来自广东,5213943091,蓝天55156
7126502881758659331,服务区与服务区之间的距离是36公里，为什么不去服务区休息而要强行疲劳驾驶？,0,0,0,2022-07-31 19:52:27,来自广东,329445700539191,魔法火车wH
7126511844952392486,有些服务区太远了，其实可以在服务区中间位置，设置个紧急停车区,0,0,0,2022-07-31 20:26:48,来自福建,4498791829874716,机械模具设计阿旺
7126531736577606430,这样的司机，害人害己,0,0,0,2022-07-31 21:43:48,来自广东,1772024767459100,7爷i
7126532515288367886,做梦在开车，醒来发现真的在开车[打脸],0,0,0,2022-07-31 21:47:14,来自广西,100098207807,狂怒的狒狒
7126506104607720206,这不是小问题，及时制止很有必要，去年看了条视频 一司机高速打瞌睡装上隔离带小孩子飞出去了,0,1,1,2022-07-31 20:04:37,来自浙江,2483979704,驯龙高手
7126518638865236770,这太危险了，开车绝不可疲劳驾驶，否则很容易酿成大祸,0,0,0,2022-07-31 20:52:42,来自浙江,2752778357443277,照亮心扉的那缕阳光
7126521543769457447,别再开车了,0,0,0,2022-07-31 21:04:53,来自重庆,61455895300,鹤一鸣
7126529835375067942,这司机真是命大啊,0,0,0,2022-07-31 21:36:31,来自吉林,107776222413,兰咖啡豆7770
7126514965787378440,听说以前跑长途拉货的司机都是边睡边开。。。,0,0,0,2022-07-31 20:38:50,来自广东,1547707206339325,sky0537
7126544360753758990,那一车的人真的命大[捂脸],0,0,0,2022-07-31 22:33:18,来自湖南,2458104727877879,马八坨
7126502070806463247,太胖要减肥，这种未必是疲劳驾驶，而是血管狭窄，供养能力弱，需要去看病。,0,4,0,2022-07-31 19:48:30,来自上海,5351057145,维清weiqing
7126536805721260815,疲劳驾驶，拿生命换生存,0,0,0,2022-07-31 22:03:22,来自北京,2598867067995310,叁六9
7126521319894237956,疲劳驾驶，害人害己！,0,0,0,2022-07-31 21:04:00,来自湖南,50037926545,我的天空很美很浪漫
7126544801898054403,高速上困得要死，但是进了服务区又很难入睡，有没有同款？[泪奔],0,0,0,2022-07-31 22:35:10,来自广西,3824977299,wilfuntion
7126516474239943458,要命呀！不是他自己，可能危害许多人和车辆！,0,0,0,2022-07-31 20:44:27,来自内蒙古,53125047222,古山情
7126522221144720162,这人健康出了问题，不应该再开客车，高血糖高血压必定有,0,0,0,2022-07-31 21:06:37,来自江苏,3429322199,一往无前铅笔J
7126519665442030339,疲劳驾驶很可怕，特别是午后一两点[困][晕],0,0,0,2022-07-31 20:57:16,来自福建,99304397947,图钉8848
7126527329719173920,重特大交通事故的雷就在这里。,0,0,0,2022-07-31 21:27:15,来自湖南,5740948966,hai62407404
7126520192784073513,应急车道本就是应急，但又不让停，,0,0,0,2022-07-31 20:58:49,来自广东,51673209461,疯狂小橙
7126509122896003881,疲劳驾驶太可怕了[恐惧][恐惧][恐惧],0,0,0,2022-07-31 20:16:00,来自贵州,102153635245,SW2003X
7126532990947738383,小子，再大处罚是小，命保住了才是大事！,0,0,0,2022-07-31 21:48:38,来自山东,22568236137,岁月静好1oVC
7126537703239992075,[捂脸]曾经骑摩托车都差点睡着的人路过，还好路边有护栏，不然。。。当时把我吓得瞬间精神了。。。,0,0,0,2022-07-31 22:07:37,来自重庆,3148636966366700,爱我Z中华
7126525938124915456,我认为疲劳驾驶比酒驾更严重,0,0,0,2022-07-31 21:21:11,来自湖北,52709741264,我们都是搬砖人
7126523574366094111,我就觉得长途开车太累，容易打瞌睡,0,0,0,2022-07-31 21:12:19,来自浙江,66493058750,小熊维尼aaa
7126535904068027177,在高速开车睡觉？大胆。这可是范害社会公共罪。直接扯本。,0,0,0,2022-07-31 21:59:53,来自北京,58802894503,乐观贝里9v
7126502640418374431,基层百姓生活不易，生命安全不容忽视！,0,1,0,2022-07-31 19:51:12,来自安徽,8086361704,春秋之韵
7126521654695461673,闭眼4次，按每次5秒算，平均时速按90算，90000/60/60*5*4=500米，想想都恐怖😱,0,1,0,2022-07-31 21:04:19,来自湖南,1481786981359032,X101001000
7126518605281329959,该休息的时候玩手机，想休息的时候，又要赶路，这种人不适合开车,0,0,0,2022-07-31 20:53:06,来自广东,105738803910,睿智的龙杰
7126532430940881677,监控不错，否则又是一起车毁人亡的大事故。,0,0,0,2022-07-31 21:46:49,来自甘肃,17347041473,祁连山牧童
7126519061923595046,闭眼不是很正常吗？我们一分钟闭眼几十上百次，只是不要闭得太久。,0,0,0,2022-07-31 20:54:50,,59181204165,椰乡旁边
7126496684699632397,这种司机和这种公司就不能让他们有第二次犯错的机会,0,19,0,2022-07-31 19:28:11,来自山东,98736391249,国家抬杠协会名誉主席
7126543932716450591,对罚，罚他是对他自己负责也对社会负责,0,0,0,2022-07-31 22:31:35,来自河北,39215743379485,诗意饼干xg
7126521947676132104,郭德纲？不是侯震负责开车吗？,0,0,0,2022-07-31 21:05:54,来自陕西,105100762174,淡定中给力
7126507638283830031,降低司机驾照资格,0,0,0,2022-07-31 20:10:06,来自湖南,96579035849,正能量白云C2
7126512256359482125,生气就在闭眼间,0,0,0,2022-07-31 20:28:20,来自湖南,109456449633,囧西瓜7
7126513035547689732,大客车一定要安全驾驶。,0,1,0,2022-07-31 20:31:35,来自广东,4037005721221358,月无痕1188
7126539587157263141,只是罚款就算了吗？,0,0,0,2022-07-31 22:14:42,来自广东,3399315860239987,奇妙柳叶Pk
7126506699309613855,高速路上经常看到大货车不打灯慢慢偏离，真吓人[呲牙],0,0,0,2022-07-31 20:07:08,来自湖南,95979148383,泥是疯儿窝是傻
7126497087553831717,只要是凌晨我都不敢上高速，下面跑随时可以路边休息，高速上困了只能行撑着。,0,0,0,2022-07-31 19:29:36,来自山东,58983455223,哭泣的骆驼54
7126505344481788707,这得罚啊！不然车毁人亡啊！小罚款救大命啊！,0,0,0,2022-07-31 20:01:17,来自山东,5840020003,溜达琴岛
7126509814284878592,应该终身禁驾,0,0,0,2022-07-31 20:18:39,来自山东,5866815720,丶烟雨忆江南丶
7126518895569617701,这种罚我赞成，譬如说餐馆买拍黄瓜被罚我反对！,0,0,0,2022-07-31 20:54:17,来自湖北,4476840499222798,优雅柳叶TP
7126521327535883041,晚上搓麻，白天开车。,0,0,0,2022-07-31 21:03:49,来自江西,51992226599,武陵人视频分享
7126509490069553935,监控能提醒一下就好了。,0,0,0,2022-07-31 20:17:26,来自河南,7369110173,财上皇1
7126513662135354123,深圳回湖北，在湖南高速上时不时给我打个电话！这个系统可以！,0,0,0,2022-07-31 20:34:16,来自广东,50643933317,lizhipeng87
7126510323787858703,超豪华高档大巴车，装有自动驾驶系统,0,0,0,2022-07-31 20:20:35,来自广东,2893519413058584,多才多艺冰淇淋6D
7126517219282125602,这很危险的重大事故多是磕睡引发！,0,0,0,2022-07-31 20:47:11,来自湖北,465789456230407,清新海浪nZ
7126521552321528608,据说高速上司机都会睡觉,0,0,0,2022-07-31 21:04:49,来自湖北,554592351825691,瑟瑟飞飞飞
7126504850720080674,疲劳驾驶比酒驾危险得多！甚至比醉驾都危险！,0,1,0,2022-07-31 19:59:23,来自湖南,5851239232,一叶知秋WG
7126541553387995940,这是要吃席,0,0,0,2022-07-31 22:22:06,来自河北,61280894196,奔跑的猪妈妈
7126502565000332040,我关心的，这是什么车？闭着眼睛也能在高速上驾驶，这全自动技术牛啊！,0,0,0,2022-07-31 19:50:50,来自江苏,2510907881292238,此生骄傲中国人
7126530766393344771,我每次高速，必打盹，眼一闭一睁，景象各异,0,0,0,2022-07-31 21:40:28,,2776047852,22414201
7126505628101002021,怎么不了解下为什么会疲劳驾驶？,0,0,0,2022-07-31 20:02:48,来自江苏,59453356619,坚定跟党走
7126516813742998307,为了生活，，要不谁会疲劳驾驶咯！,0,0,0,2022-07-31 20:45:33,来自湖南,748094670251374,荷叶塘边
7126515158641673001,我一上高速就想睡，有次猛扇自己嘴巴，下高速脸都打肿了,0,0,0,2022-07-31 20:39:15,来自湖北,87917227765,Sandy
7126517395388842792,疲劳驾驶，真的很危险！！！,0,0,0,2022-07-31 20:48:04,来自四川,111569949805,静观人世遐想宇宙
7126514104697144079,真不容易啊，有时间谁不想好好睡觉,0,0,0,2022-07-31 20:35:19,来自安徽,52424732002,不相信命
7126505061945606920,太辛苦了！生命价更高！为了家庭都要挺住！,0,0,0,2022-07-31 20:00:36,来自广东,4292094053850523,骑着马蚁去西藏
7126512535264052005,有时候高速路上突然就非常困，但是又离服务区还有距离，特难受,0,0,0,2022-07-31 20:29:27,来自福建,82626279446,spbdev
7126502064594699045,这不是危险驾驶吗,0,1,0,2022-07-31 19:48:53,来自江苏,52870973296,游牧方外
7126541327461876518,这人以后不能开车，太危险了,0,0,0,2022-07-31 22:21:25,来自浙江,1895155144338748,以帅为实
7126506211562193703,一次意外。几十条人民可能就消失！,0,0,0,2022-07-31 20:05:22,来自广东,4226408461,爱吃酥饼的小松鼠
7126524307072762662,应该配一个副驾驶,0,0,0,2022-07-31 21:15:19,来自北京,5811890346,紫檀扇子
7126529195928372009,没出事故太幸运了,0,1,0,2022-07-31 21:33:42,来自山东,3333626361,碧波ok
7126517642789323535,开高速就是容易打瞌睡,0,0,0,2022-07-31 20:48:53,来自重庆,1983171714626167,用户创客学习
7126502380476711684,拿乘客的生命当儿戏，这属于故意杀人！,0,3,0,2022-07-31 19:50:42,来自山东,3135443123837390,一往无前咖啡g4
7126516945549771553,这是怎么监控到的呢,0,0,0,2022-07-31 20:46:59,来自浙江,1591689848828823,Cedric
7126511713595343650,饭后一小时内开车容易瞌睡,0,0,0,2022-07-31 20:25:50,来自广东,4430685764,盛兄A
7126535124984218372,一出事就是害人害己,0,0,0,2022-07-31 21:57:24,来自广东,2115085893651784,佛山老徐
7126512391655195433,车上的人命真大[震惊],0,0,0,2022-07-31 20:28:35,来自河北,88679937134,风卷红旗
7126518623010997029,无异于马路杀手,0,0,0,2022-07-31 20:52:57,来自福建,92566802930,一剑007
7126526773386576679,为什么总有这种人，真无语,0,1,0,2022-07-31 21:24:51,来自上海,3069478313140876,涂山红酒
7126504532074677025,看的我都吓出一身冷汗😰,0,0,0,2022-07-31 19:58:48,来自湖北,1701652248395847,端庄优雅日月无双
7126500768852722432,切勿疲劳驾驶。家人盼你平安回家。,0,1,0,2022-07-31 19:43:39,来自河北,5566761198,土豆60164267
7126545340438397737,上帝保佑司机们啊！,0,0,0,2022-07-31 22:36:43,来自浙江,105471678073,三亚东海滩
7126519804395537188,想想那些成天在网上晒自驾去新疆西藏啥的吧，情况大差不差，确实值得警惕关注了,0,0,0,2022-07-31 20:57:47,来自山东,106759685425,执拗的石头
7126518991404909353,应该要重新学习，再考证上岗,0,0,0,2022-07-31 20:54:07,来自湖南,50053219661,手机用户50053219661快乐的小溪
7126503853893272359,这不是改不改的问题，是此身体状况适合不适合从事该职业的问题,0,2,0,2022-07-31 19:56:00,来自上海,14910344002,一抹抑躁灵
7126504436939326243,开车时一旦犯困很难控制，只盼早点看到高速出口或服务区，亲身经历,0,1,0,2022-07-31 19:57:43,来自浙江,1178272211417896,可可杷杷
7126507883046552320,这个系统真好,0,0,0,2022-07-31 20:11:03,来自吉林,8196633308,海阔天空081
7126489611719017249,玩杂耍的司机,0,2,0,2022-07-31 19:01:02,来自广西,6952746566,乐天派未来168
7126511468245811968,太恐怖了，高速上后果很严重,0,0,0,2022-07-31 20:25:01,来自贵州,1666473729212052,欧巴带你看视界
7126512350966317824,没有服务站，累了打双闪，开应急道休息都好。,0,0,0,2022-07-31 20:28:31,来自湖北,2049125270956727,hi叽
7126512638367990565,不是赶时间 走国道好,0,0,0,2022-07-31 20:29:50,来自湖南,3579617288133880,星之美春天
7126527994923303712,我上次闭眼竟然开回家了。,0,0,0,2022-07-31 21:29:40,来自广东,101116548238,观山观水观世音2
7126515519113020163,又来了一个致富的项目,0,0,0,2022-07-31 20:41:32,来自江西,4344863010074380,江西省新余市民
7126537492878066444,太需要钱了，害人的,0,0,0,2022-07-31 22:06:27,来自湖南,75604375362,在长沙奔跑的虫子哥
7126548003459973902,太危险了[发怒],0,0,0,2022-07-31 22:47:19,来自福建,3698719534,十八罗汉1979
7126542464756417294,主要是老板的压迫,0,0,0,2022-07-31 22:26:00,来自湖南,5970177323,小王73597418
7126538484114031401,应该向酒驾看齐,0,0,0,2022-07-31 22:09:48,来自新疆,6697120824,鱼新月
7126503350417474316,一车人命真大啊，交给他了,0,1,0,2022-07-31 19:54:08,来自山东,2246990460370484,智能打印
7126508685160874783,九分钟全程监控[震惊][what],0,0,0,2022-07-31 20:14:20,来自广西,3392218113,乐乐乐k
7126502544918725387,我之前开车来深圳睡了两次，醒了快了吓死，再也不敢了，车里还有一车人,0,1,0,2022-07-31 19:51:24,来自广东,5997883227,小长河74967371
7126518135850877730,这样的情况还没出事，也是祖宗庇佑他了。,0,1,0,2022-07-31 20:50:51,来自云南,703336110364208,风姿卓越西柚Ei
7126503236244243214,这是实时跟拍吗？,0,0,0,2022-07-31 19:53:30,来自广东,96560039641,东莞蜂窝板天花
7126539875821781793,没事这路天天跑我熟！,0,0,0,2022-07-31 22:15:51,来自山东,54713254373,追梦远航2
7126517313830355727,以前我开高速也检查犯困，经常犯困，自从带了个妹子的副驾驶，就没有犯困过,0,0,0,2022-07-31 20:47:41,来自福建,1543351064330628,无与伦比
7126524664092541726,命运没到死而已。但是开车打瞌睡就要停车休息，要不命随时没有的,0,0,0,2022-07-31 21:16:37,来自广东,17742423929,笑傲江湖223413226
7126516049201464071,不多，比发生事故好万倍！,0,0,0,2022-07-31 20:43:00,来自海南,10220751620,漠风如水
7126534187058348831,监控厉害了,0,0,0,2022-07-31 21:53:39,来自四川,5570898573,小菜鸟哼哼哈嘿
7126509549166576388,敢坐这种车的人都是梁山好汉,0,0,0,2022-07-31 20:17:56,来自湖北,96009948050,上官天浪
7126520997062673191,评论的基本没有开大车的，,0,0,0,2022-07-31 21:02:30,来自陕西,5852584721,奏窝怂
7126500819301974792,只要能挣到钱，苍蝇飞过打的盹也不放过。😂😂😂,0,0,1,2022-07-31 19:44:14,来自江苏,4605360240,用户ZR1963
7126514882094449411,看着如此的奔波者。心里也有一股痛的感觉！不容易啊！,0,0,0,2022-07-31 20:38:50,来自山西,4468854089595763,直爽奶酪4C
7126516808945107742,辛亏没有永久闭眼,0,0,0,2022-07-31 20:45:55,来自江西,6525301216,江山如画jsrh
7126513499626357539,每次一上高速就想睡觉，我都是是开一段高速就走国道。,0,0,0,2022-07-31 20:32:46,来自湖南,60277101299,星星点灯190301807
7126550554754827039,喝雪碧、一打嗝、就不困[灵光一闪],0,0,0,2022-07-31 22:57:31,来自河北,65974237172,晨露点球
7126538787869999883,现在司机不睡觉，刷抖音,0,0,0,2022-07-31 22:11:52,来自浙江,6193593985,Antipoor
7126498609628971791,调销驾照,0,0,0,2022-07-31 19:35:05,来自福建,100498336527,旅游运动两不误
7126539050554655529,1开长途要保持充足的睡眠，2应该发明一些科技类的提醒作用的东西。,0,0,0,2022-07-31 22:12:03,来自江苏,70328994398,儒雅枫9006
7126517532877718307,害别人，这得多危险呀……,0,0,0,2022-07-31 20:48:25,来自湖北,62741073726,江郎才俊ajay
7126549863517078313,这样的人还让开车？？？,0,0,0,2022-07-31 22:54:23,,1552146436987598,幸福中国人1266458
7126489570778399501,身体已经不适应岗位！,0,15,0,2022-07-31 19:00:50,来自山东,104541547032,青岛三江人
7126542334971347715,长途驾驶时有时会突然意识到，自己在开车。,0,0,0,2022-07-31 22:25:24,来自江苏,52921725079,总有大来
7126522056581759744,这种情况对他人生命危害极大！,0,0,0,2022-07-31 21:06:03,来自安徽,267917562487143,理性观点
7126504831254315811,还是公司管理制度要改,0,0,0,2022-07-31 19:59:17,来自上海,7152295468,沉默星辰下
7126514931461604133,眼小走神[笑哭][笑哭][笑哭],0,0,0,2022-07-31 20:38:46,来自辽宁,6049897730,了无痕e
7126522604022350630,"这哥们是高手，天堂地狱回来走[呲牙]
但是別害人阿",0,1,0,2022-07-31 21:08:42,来自广东,103260642575,峰稚起
7126526187455365892,处罚了啥,0,0,0,2022-07-31 21:22:43,来自湖南,102395891307,行动跟上
7126491108209197837,不适宜再开这种车了，为了他人，也为了自己,0,40,1,2022-07-31 19:06:52,来自陕西,67879852107,砖瓦说家居
7126508031285969701,按杀人未遂处理,0,0,0,2022-07-31 20:12:06,来自河北,6467476906,韩飞90670917
7126513771292132136,自动驾驶可以吗？,0,0,0,2022-07-31 20:34:04,来自浙江,62363290332,Future184238536
7126525954566177575,有没有和我一样的，在高速路上困了自己打自己两个嘴巴,0,0,0,2022-07-31 21:21:46,来自贵州,449610527380,颗粒
7126550883768681250,他不要命，人家要命哦！这种行为存在巨大的危害！,0,0,0,2022-07-31 22:58:11,来自广东,98434454414,伦祖荫
7126550880367248160,自动驾驶要标配[泪奔][泪奔],0,0,0,2022-07-31 22:59:08,来自湖南,54717466474,瑟瑟蓝空
7126508081202823950,罚的合情合理物有所值,0,0,0,2022-07-31 20:12:35,来自河南,104644326164,务实中的幸福
7126518072969921292,根本原因是，如果不超时工作的话赚的钱太少，根本生活不下去。,0,0,0,2022-07-31 20:51:18,来自广西,65722049991,三文鱼198741106
7126502479055504162,为了大家，小家请勿疲劳驾驶！,0,0,0,2022-07-31 19:50:16,来自辽宁,58067603216,鲲鹏154697076
