7130953410442134311,好啊，德国汽车先退出中国市场！,5,470,0,2022-08-12 19:42:42,来自河北,5867655958,北平思想者
7131189018020053798,这不奇怪，我国不也是在走降低高科技产品对西方国家依赖的路嘛。,2,320,0,2022-08-13 10:56:54,来自浙江,101257840938,zknaaaa
7130770245786731299,减少依赖政策没啥大问题，俄罗斯已经给了教训，但是听从美国就显得愚蠢了,1,79,0,2022-08-12 07:51:43,来自四川,694524905789079,过好每一天开心最重要
7131174104023335714,不依赖俄国，不依赖中国🇨🇳德国🇩🇪和欧盟就等灭亡吧！,5,200,0,2022-08-13 09:58:39,来自北京,101093235962,悠悠晓旭
7131394313518416678,中国人口占全球1／4，是世界上最大的市场，要好好利用好我们这个优势，谁都不敢小视我们大中国！,1,4,0,2022-08-14 00:15:19,来自福建,102059872765,顽强阳光he
7131317477178458921,这样事情我们应该想到，并尽早做好内循环。,1,18,0,2022-08-13 19:14:52,来自河北,69809442332,曾经的侍郎
7130970631616987939,欧洲的大国里面除默克尔外再无真正的政治家了。,8,489,0,2022-08-12 20:48:53,来自陕西,111044078820,沉着豆浆ea
7130949935473951488,没谁邀请他访华。哪里來计划。,2,541,0,2022-08-12 19:28:41,来自贵州,70528325438,愉悦的艺术家du
7131188400648012579,德国人该怀念默克尔时代了,4,491,1,2022-08-13 10:53:58,来自湖北,50101326997,盼盼0
7131290484261749508,默克尔时代一去不复返，欧洲从此再无默克尔！,0,40,0,2022-08-13 17:31:10,来自北京,61509905767,花儿朵朵1699
7130942375044186895,别过来！这不欢迎尔？,0,581,0,2022-08-12 18:59:27,来自天津,1921578949673979,热心微风Cj
7130768379958444830,这个德国总理是这种态度的话不用来，我们也不欢迎。,2,80,0,2022-08-12 07:44:53,来自河南,99000170423,wonderhero
7130870666211574543,这种人与睿智的默克尔没可比性[灵光一闪][灵光一闪][灵光一闪][灵光一闪][灵光一闪],0,32,0,2022-08-12 14:21:09,来自浙江,50002628658,红红正者无敌
7130966598706004775,他比默克尔差的太多了,0,399,0,2022-08-12 20:34:03,来自河北,6002755962,扥儿楞
7130848300391744291,从根本上来说，西方国家并不信任中国，这在一定程度上是没有办法的事，尽量求同存异吧。,1,40,0,2022-08-12 12:54:14,来自湖南,4435253001,恺king
7130856173603586816,这孩子真是个Super Boy！[我想静静],0,53,0,2022-08-12 13:25:02,来自重庆,106850319455,诺顶山伯爵
7131184329002533671,国家应提倡企业、个人使用国产车，发展国产车。,2,240,0,2022-08-13 10:38:58,来自北京,1236271990842253,一年又一年
7130892166964658979,中国也有要做好两手准备！,1,20,0,2022-08-12 15:44:39,来自北京,22838519105,淡定葡萄tW
7131280469206762244,似乎他曾说过的要摆脱对俄天然气依赖，好像现在在求俄开放北溪1号。所以我们不必太在意，事实已经证明他说的很好，可问题是德国摆脱的了吗？,1,33,0,2022-08-13 16:51:59,来自北京,101174948567,趣味光影
7130847631316189956,嚓，ABB注意了,3,12,0,2022-08-12 12:52:27,来自吉林,3421278846584919,奔跑的胖子
7130960238190478117,欢迎德国汽车退出中国市场，为国内汽车腾出市场，振兴民族产业！,0,225,0,2022-08-12 20:08:55,来自陕西,73606814359,赵海军zhj
7131481394731402018,关键在于美国对于欧洲各国选举所施加的影响！资金，情报等等！世界和平首先应该杜绝这方面问题！目前欧洲整体向美倾斜并不符合名义，但是选举结果每每出乎意料，这背后没有美国的情报和资金是不可能的！美国窃听不会停止！那他窃听服务对象会是谁不是秘密，所以最终美国是在源头控制了欧洲而不是末端控制！,0,2,0,2022-08-14 05:52:14,来自上海,4460020133,天若有情2008
7130831442854740770,这届德国政客缺乏眼光与胆量,0,2,0,2022-08-12 11:48:55,来自四川,55861831188,快乐的饭团66
7131221637403394848,好像也没说欢迎你来,0,7,0,2022-08-13 13:03:30,来自甘肃,4124989610277280,有趣的小猫e2
7130841350014403341,对西方，我们千万不要抱任何幻想,0,107,0,2022-08-12 12:27:39,来自湖北,52837135687,華品
7131168086069199651,默克尔是个成熟的德国总理，她懂得如何在中美之间找到战略平衡，能基本做到德国的利益不受损失。而朔尓茨明显是个选边站队的角色，他更多的是受自己的喜好做事，把德国的利益放在了次要地位。,0,41,0,2022-08-13 09:35:08,来自浙江,101315759517,进步德惠2F
7130767068974285606,没了默克尔，德国魅力不再！,0,105,0,2022-08-12 07:40:12,来自德国,2805587606513519,欧洲森林
7131252549130650409,德国是看美国脸色行事的，与中国贸易固然重要，美国的脸色更重要。也不要说德国离不开中国，看看俄乌战争以来，德国连能源都不顾，何况与中国的贸易。不管德国怎样，要实现祖国统一，就必须做好最坏打算。,0,62,0,2022-08-13 15:03:09,来自北京,3825951481010604,孤独的老人A
7130761407599199012,减少依赖，没错！中国也要在能源及其关键技术领域减少对国外的依赖。,0,61,0,2022-08-12 07:18:00,来自云南,72994973912,事不关己syc
7131200875355505444,他来与不来，没人在乎，他来，崛起的中国在这，他不来，腾飞的中国巨龙更让世界瞩目。,0,7,0,2022-08-13 11:42:48,来自甘肃,1618099531422765,雪晴不孤单
7131173157834670886,德国有战略？,5,63,0,2022-08-13 09:55:48,来自北京,4585028515,小小44827262
7130812545484997376,对于德国国家利益来说，苹果不该放一个篮子，可是商人看的都是自己利益。,0,11,0,2022-08-12 10:35:39,来自江苏,3685153718153095,云淡风轻
7131251253422277376,我们为什么不减少对德国的依赖呢？我们不能，从科技水平来说我们出于弱势，所以我们还是应该大力发展高科技产业，努力追赶，在不久的将来我们能够减少对西方世界的依赖！,1,14,0,2022-08-13 14:58:06,来自江苏,1688468747452571,风云cp笑看
7130969161282863876,默克尔对德国来说真的是一代伟人,1,107,0,2022-08-12 20:43:45,来自江西,82739406462,华夏日月同辉
7131499703464248103,随便爱依赖不依赖,0,0,0,2022-08-14 07:03:54,来自四川,3773154794150269,大气水滴iS
7130955516943729449,满大街的德系日系也是醉了,7,167,0,2022-08-12 19:50:19,来自吉林,1046325667836471,半小时
7130970039402627872,我想同理，中国也不能过于依赖德国吧。,0,171,0,2022-08-12 20:47:15,来自广东,3590540488,海拍岸
7130971308866798370,不知道这对德国又什么好处？,0,0,0,2022-08-12 20:51:18,来自江西,61251629816,海天闊369
7130967778420966180,这是小人，不太友好，需提防,0,145,0,2022-08-12 20:38:09,来自广西,6978795241,多彩鲸鱼i7
7130871533698335520,德国将与欧盟团结一致，共同应对能源危机。学习他们的团结精神吧！,0,1,0,2022-08-12 14:25:21,来自四川,3870733158845726,姐姐关爱
7130842027570234127,朔尔茨被俄罗斯打懵了[大笑],0,46,0,2022-08-12 12:29:42,来自广东,13647044570,焚琴煮酒弹江湖
7130806155882447652,"没有Frau Merkel,如今的德国🇩🇪俯冲下坡📉",0,0,0,2022-08-12 10:11:23,来自四川,61024992682,monscha
7131194477767263010,德国在中国可赚了不少钱,3,61,1,2022-08-13 11:17:47,来自广东,6874819377,SG6
7130950852403462950,默克尔大妈才是德国🇩🇪政治家和欧洲领袖，朔尔茨只是美国的应声虫。,0,109,0,2022-08-12 19:32:55,来自辽宁,3133990771,老枪瞄准镜
7131313482217325326,这人成功诠释了“谁说女人不如男”，和默克尔相比，差了条银河系,0,9,0,2022-08-13 18:59:51,来自四川,107864541400,Helen9914
7130933028276847396,默克尔之后再无德国,0,14,0,2022-08-12 18:23:41,来自广东,98662902398,龙哥哥7266
7131168159218123560,德国是二战战败国，他凭什么可以向其他国家提供杀伤性武器。,0,16,0,2022-08-13 09:35:30,来自河南,5870199714,逍遥中原客69457322
7130828946949571368,外交的独立自主性不高，和俄罗斯关系非常僵，现在又要冷却对中关系，那只能是自取其短！,0,10,0,2022-08-12 11:38:56,来自内蒙古,10831071631,远伤落尽
7130846180502389539,一盘散沙的欧盟已经沦为美国的附庸，美国怎么走，它只能不情不愿跟进。可悲,0,16,0,2022-08-12 12:46:05,来自江苏,17503995838,赛德克战士
7130943617375863560,德国在朔尔茨的领导下必输无疑！,0,106,0,2022-08-12 19:04:43,来自四川,54889172718,飞龙在天存高远
7131306096840917773,德国有这样的总理呀，也好不了,0,7,0,2022-08-13 18:31:23,来自贵州,64495609869,用户曲以成调
7131313345592410918,德国其实没少吃美国的亏，可他们乐意，盲目崇拜美国！,0,4,0,2022-08-13 18:59:50,来自黑龙江,98005073695,胖大海特瘦
7130778005366473512,动不动就制裁别人，才会出现供应链问题,0,15,0,2022-08-12 08:21:43,来自广东,59590877723,欧荣Wing
7130784258863530793,我们的新能源汽车这么蓬蓬发展，就可知德国对中国的态度了。,0,0,0,2022-08-12 08:45:50,来自上海,55122690680,青春的linglingmama
7130890394258850595,俄罗斯也不能依赖，中国也不能依赖，德国你要依赖哪个？？？,0,3,0,2022-08-12 15:37:47,来自浙江,52491895464,下一目标2
7131186449537991462,所以说国家制定双循环战略是很有眼光的。国际形势好，就加强外循环；国际形势恶化，就重点实施内循环。你德国依不依耐，无所谓！,0,83,0,2022-08-13 10:47:29,来自湖北,92376748060,优雅百香果z9u
7130771564538331938,很认真的说一句，喜欢默克尔时代的中德关系，怀念啊。,0,21,0,2022-08-12 07:56:37,来自上海,57136817509,老爷子150835051
7131025464008917772,一年，就一年，国际风云诡谲多变，真是世界上唯一不变的法则就是“变”！吾辈得学会跟进与适应啊！,0,1,0,2022-08-13 00:24:30,来自江苏,56101752003,修为世界观
7131166758685115150,德国史上最差总理是他吗,0,9,0,2022-08-13 09:30:27,来自河南,6009316689,我们一起转圈圈
7131166263811998479,中国现在发展的水平也不差给德国，对我来说，宝马奔驰，大众，西门子等有没有不影响我正常生活，建议政府减少进口德国产品。,0,11,0,2022-08-13 09:28:07,来自山东,99581469795,腾飞6326977
7131165475362964260,朔尔茨：中国不能过于依赖德国,0,8,0,2022-08-13 09:25:51,来自山东,101810137168,早来枣好
7130837659387822884,同时，德国也减少对美国的依赖！,0,22,0,2022-08-12 12:13:33,来自广西,100406847535,高冷辰星7Z
7131210776571904799,现任这位德国总理，怎么看也不是一个德国人，认定他是美国人更加准确。,0,63,0,2022-08-13 12:20:59,来自贵州,111318262065,星湖话苑
7131279609462604580,也不知德国系汽车同意不,0,5,0,2022-08-13 16:48:13,来自广东,56014605420,一个有脑的无聊人士
7131236009425388300,好！你只要能卖出去,0,9,0,2022-08-13 13:59:51,来自山东,1330937781,彩山神韵
7131289337022694185,舒尔茨进一步把德国绑在美国的战车上，十分危险，是拿经济停滞的风险赌博。,0,9,0,2022-08-13 17:25:39,来自北京,67940972080,海淀山后一老翁
7131155201998062373,俄乌战争德国已亏损2600亿，惹恼中国后面再加个零。,0,8,0,2022-08-13 08:45:52,来自天津,3604477885,海河上游一户人家
7130960151435019046,一个反华政客，访华不访华无妨。,0,20,0,2022-08-12 20:08:36,来自四川,6660391711,品味人生102873766
7130912063182340901,互相减少依赖吧！我们也信不过你们！,0,7,0,2022-08-12 17:02:11,来自浙江,3379548343,南海剑客009
7130931939351200550,舒尔茨强调“各领域独立性”是种奢望，他自己说时都底气不足,0,6,0,2022-08-12 18:19:35,来自河北,84773865314,磁州山人
7130955830471443204,赶紧去依赖美国吧,0,34,0,2022-08-12 19:52:02,来自福建,58213119477,氢槽行动
7131384472267997964,不要提什么压舱石！也别说谁离不开中国，就说我们自己也要减少供应链的单一性，更应该减少对出口商品的依赖性。要强化内循环的健康发展，必须做到有顺差能活，没顺差也能活才行。,0,1,0,2022-08-13 23:36:50,来自北京,52548825012,寻道寻真
7130768812609307392,没有打仗德国会偶尔帮着中国讲话，一旦打起仗来德国必定跟着美国,0,1,0,2022-08-12 07:45:58,来自江西,54767674099,liuliu159558013
7131187681488716558,与默克尔相比，各方面相差太多,0,29,0,2022-08-13 10:51:37,来自重庆,61623319998,晴朗的天空172919732
7130962328753226535,希望在你任内减少德国车,0,33,0,2022-08-12 20:17:11,来自意大利,57260348249,wuhc3
7130952282103563012,德国有哪些企业是不是应该先列一个表,0,21,0,2022-08-12 19:38:41,来自山东,3548230225,小哥哥的人生记事
7130942615557817123,跟默克尔差了不是一星半点,0,28,0,2022-08-12 19:00:11,来自吉林,109016544742,全厂的希望哈
7131186742597796623,中国汽车应减少对德国的崇拜。[灵光一闪][灵光一闪],0,41,0,2022-08-13 10:47:31,来自山东,3839850075,蓝色海洋wallace
7130781505441710859,弹丸之地，人口也不多，不依赖中国的市场，能有多大的GDP！,0,10,0,2022-08-12 08:36:14,来自福建,22660981999,Michaux10
7131005389034373895,对经济对中国不了解的德国总理简直就是德国人的失败,0,0,0,2022-08-12 23:04:45,来自辽宁,105221326147,烈火QQ小王子
7131198961004200736,新能源汽车革了德系车的命，利益少了,0,36,0,2022-08-13 11:36:06,来自广东,2560130781297307,良知光明也
7130774105426608927,德国政客最好是不要依赖美国，实行独立的政治经济军事外交政策！,0,0,0,2022-08-12 08:06:52,来自广东,111409000033,沉着麻酱oF
7131168227434152707,燃油机时代结束了，相互理解吧,0,78,0,2022-08-13 09:36:36,来自浙江,2933125678905304,广汇汽车下来了
7130847268160160553,舒尔茨头上无毛，办事不牢,0,2,0,2022-08-12 12:50:05,来自河北,110546266882,朴实山丘e9
7131122357405877027,德国民众选择的好总理一一默克尔解决问题，蒴尔茨制造问题。哪个“好”？,0,2,0,2022-08-13 06:38:21,来自贵州,59723593219,利益边缘
7131468568650122014,朔尔茨政府若要发展与中国的关系，默克尔已树立了成功的榜样。,0,0,0,2022-08-14 05:37:00,,98057299844,娟娟70223
7131176615203373865,德国想减少对中俄的依赖，那请自便吧[捂脸],0,32,0,2022-08-13 10:08:23,来自广东,475428291358120,风姿卓越雪碧9I
7131174362014581539,我个人认为德国总理的回答没有问题他能给大家的回答多有面子,0,2,0,2022-08-13 09:59:31,来自北京,66981562966,行者方11002
7130851315952993027,同意减少依赖,0,13,0,2022-08-12 13:06:43,来自广东,6769477281,皓月舒怀
7130882710326870815,七国集团达成共识了，我们要做应对准备！,0,14,0,2022-08-12 15:08:10,来自江苏,553773818972919,来自北方的狼aL9O
7130822828793807650,愿这个新总理能学习铁娘子默克尔………[祈祷][祈祷][祈祷][祈祷][祈祷][祈祷][祈祷][祈祷],0,3,0,2022-08-12 11:15:17,来自广东,96577243187,向上而生YXvT
7130855779548283685,经贸方面德国在后退。,0,4,0,2022-08-12 13:23:40,来自广东,55917709566,超凡战队
7131162183014417187,德国企业也想多员化，问题是德国产品在其他国家没有竞争力，要面临其他发达国家和中国的竞争。,0,4,0,2022-08-13 09:12:22,来自河南,3302559100704347,程大博
7131173434553631524,嘴硬，看看德国如何过冬,0,23,0,2022-08-13 09:56:25,来自广东,4336085620754855,潇洒青山zT
7131168716380799779,自己退了就不用依赖了 真搞笑这些欧洲人 ww也说新南向结果。。,0,4,0,2022-08-13 09:37:37,来自浙江,109811084329,呦呦鹿鸣1942
7131077979412906791,感觉舒尔茨是德国历史上最蹩脚的总理，他的理政理念还不如希特勒。,0,13,0,2022-08-13 03:56:28,来自河北,21354927251,大海131273266
7131154046035477280,没有得到我们的邀请，人家不好意思来[比心],0,4,0,2022-08-13 08:42:00,来自四川,51231767652,国产品牌坚定支持者
7130817459829179151,这几年欧洲国家领导人像被附了身似的，无条件靠近美国，有没有可能棱镜计划起作用了？,0,4,0,2022-08-12 10:54:35,来自江苏,6997115671,woo14507088
7130953603740943107,缺少默克尔的格局和理性。,0,18,0,2022-08-12 19:43:35,来自湖北,3944695089341998,欣欣向荣的兔子
7130871775843959560,德国汽车将看得见地失去中国市场,0,1,0,2022-08-12 14:25:49,来自广西,104933557513,时髦帆船2Q
7131181685701444352,朔尔茨是个不成熟的政治家。,0,2,0,2022-08-13 10:28:00,来自江西,1636492864167055,大地苍茫
7130772128739722014,舒尔茨中美国反华扼华的毒了，他要毁了德国经济！,0,1,0,2022-08-12 07:59:37,来自辽宁,86142842710,灵巧喜鹊M
7131144098219885344,默克尔干了那么多年算是白干了,0,9,0,2022-08-13 08:03:18,来自天津,2690290825,凤鸣榣山
7130961563968144163,中国也不要依赖西方,0,69,1,2022-08-12 20:13:38,来自河北,67057244862,春风十里ddd4663
7130861411576136481,德国人的日子过得太好了。,0,5,0,2022-08-12 13:46:19,来自山东,73533688587,骄阳普照
7130931565202899745,中国不欢迎朔尔茨[耶],0,0,0,2022-08-12 18:18:24,来自云南,88415046964,足智多谋海洋Xq
7131166056248673038,爱来不来，对于不友好之人，不必在意来与不来。,0,3,0,2022-08-13 09:27:53,来自广西,9355944008,天琴是故乡
7131219593003418409,中欧中德经济是相互依赖互利互惠的，一味的追随美国，只会让欧洲、德国经济陷入更大的危机！[呲牙][呲牙][呲牙][赞][赞][赞][赞][赞][赞],0,18,0,2022-08-13 12:55:09,来自四川,63063558963,南人0146
7131467561044378381,所以呢？大众等企业要退出中国吗？,0,1,0,2022-08-14 05:01:41,来自四川,57673084052,川味小灰灰
7131189568426181380,德国现任领导认为世界都是他的市场，除了中国[呲牙][呲牙],0,2,0,2022-08-13 10:59:20,来自湖北,550201162210148,名旗
7131182834811306787,中国人太善良，心都操碎了,0,31,0,2022-08-13 10:32:39,来自河南,3935852753850200,自由百灵鸟TR
7131465445534057253,这个总理有魄力先把大众，西门子等德国企业召回，不要嘴上说不行动[泪奔][微笑][泪奔],0,1,0,2022-08-14 04:54:39,来自安徽,5915128486,道路ANERE
7131361649335894817,只有军事科技强大才是我们的压舱石。,0,0,0,2022-08-13 22:06:54,来自北京,5354019344,北京人51808701
7131156794398802688,奥迪A6L刚在新华社的头条号上打广告，全篇的哦。,0,2,0,2022-08-13 08:51:24,来自浙江,50687822958,谁知道呢785
7130966928478831360,这世界本来就是互通有无。细思愚蠢。自己跟自己玩吧。,0,1,0,2022-08-12 20:34:31,来自河北,3377323628050280,海哥139i
7131033425192305439,看这个人的长相能当上总理也算是奇迹了。,0,0,0,2022-08-13 00:56:17,来自广西,62421114255,楠哥218423986
7130884511411979049,德国工业多方面面临我们的赶超 特别是汽车 估计他们好日子和老本差不多了,0,4,0,2022-08-12 15:14:56,来自上海,56705374645,Tom150055142
7130773790769824548,德国重返过去的路，无药可救喽！,0,0,0,2022-08-12 08:05:38,来自广东,102094332231,深圳豪宅团长
7131186676311180065,你来不来的吧，无所谓,0,1,0,2022-08-13 10:48:18,来自广东,52411850561,观察感悟
7131393358593540896,这个家伙在走退路，前人给铺好路不走，偏剑走偏锋,0,0,0,2022-08-14 00:12:32,来自湖南,92726629508,毫无头绪心乱如麻
7130990677676262174,其实这是可以理解的，就像现在中国人对中美脱钩的判断这种极端情况所做的准备是一样的。,0,1,1,2022-08-12 22:07:08,来自广东,4322902945568718,不可意惠
7131461728022020879,很正常，必须要接受现实了！全球化的结束，脱钩只是时间问题！这是大趋势。[吃瓜群众][吃瓜群众][吃瓜群众],0,0,0,2022-08-14 04:39:25,来自四川,2322590346252910,外向钢琴zP
7130851514985546510,好日子不想过了,0,7,0,2022-08-12 13:07:12,来自江苏,4226161746387832,江北紫琅山人
7131339511870997248,严历自裁德国。,0,6,0,2022-08-13 20:40:20,来自北京,97234743997933,细腻伊登3k7
7130833577046278950,德国巴掌大一个地方，你市场多大，你不依赖中国，估计很难,0,1,0,2022-08-12 11:57:56,来自江苏,50307082180,人在旅途126802881
7131323562606723852,想法挺好，能不能办到,0,2,0,2022-08-13 19:39:30,来自江苏,93045774268,StevenZhuo
7131139541700444943,他很清醒，我们中国也没有以前那么依赖于德国了，供应链多样化也是我们中国需要做的，,0,6,0,2022-08-13 07:44:43,来自广西,59911482235,嘴炮大神
7131228873085682462,只怪中国太强大！全球第一大出口贸易国！出口遍布全球一百多个国家！,0,0,0,2022-08-13 13:31:39,来自上海,3887467649333358,L少生气多争气
7130921794147795719,欢迎默克尔再来！,0,0,0,2022-08-12 17:40:01,来自浙江,2608483485882776,哆啦A梦2112
7130920684901024526,看三星就知道了，沒有中国市场一样活的很好，这也是别人的选择@青木在德国,0,1,0,2022-08-12 17:35:36,来自广东,1719283612389246,Teabo
7130786580406747941,后面中国和德国可能会矛盾升级,0,0,0,2022-08-12 08:55:14,来自北京,60274860250,166286119
7130846811891188495,但愿朔尔茨不是下了政治生涯中最大的一步败着[呲牙],0,5,0,2022-08-12 12:48:25,来自江苏,19628040836,古木仙
7131293289868935939,德准备倒退过日子[what][捂脸][泪奔],0,2,0,2022-08-13 17:41:55,来自广东,102877256232,w一切都会过去的
7131273619103138564,这个德国总理应该是历届最差的吧,0,4,0,2022-08-13 16:25:28,来自浙江,145553007588979,哈哈哈？
7131328733482861316,不错，智齿,0,3,0,2022-08-13 19:59:18,来自广西,5528110077,忘忧草1983
7131184816065790759,德国怎么没人呼吁减少对美国的依赖呢？,0,13,0,2022-08-13 10:40:50,来自湖北,102315231889,三峡小石头
7130809502303077153,苏联人默克尔,0,1,0,2022-08-12 10:24:15,来自广西,62898225901,进取原野lv
7131349022207918862,就是担心中美开战德国重蹈俄乌冲突的覆辙。,0,0,0,2022-08-13 21:17:37,来自上海,105294776084,仙酿白开水
7130794020821385999,德国真是死脑筋。,0,1,0,2022-08-12 09:23:53,来自北京,105174140160,维持是减肥第一步
7130852824329863944,史上最差德国总理，没有之一,0,0,0,2022-08-12 13:12:11,来自广西,59680862581,火云战神S
7131312774391251715,问：为何不追求主权独立[呲牙],0,2,0,2022-08-13 18:57:55,来自福建,3526852561080542,春色盎然js
7131192204940706595,我也觉得是，不能太依赖。,0,0,0,2022-08-13 11:08:47,来自辽宁,51724808251,寶藏獵人
7131175142344098590,谁也别依赖谁！,0,1,0,2022-08-13 10:02:54,来自福建,72300303270,老傻蛋与小傻蛋
7131388981925364511,靠经济无法拉住欧洲了,0,0,0,2022-08-13 23:54:22,来自河北,4055111952,安逸饼干6p
7131362771358761760,中国产新能源设备零部件也要涨价。,0,1,0,2022-08-13 22:11:26,来自江苏,110342699695,沈宁1958
7130800749411779343,德国人选择了一个对他们非常不利的总理,0,0,0,2022-08-12 09:49:51,来自黑龙江,3761674055,不会开车斯基
7130921815710450445,减少对中国进口的依赖，但德国是顺差，出口是否也要减少依赖呐？,0,2,0,2022-08-12 17:39:53,来自上海,100023433230,MAJLR
7131247993138922253,中企也不能依赖外企。,0,0,0,2022-08-13 14:45:39,来自云南,52635569016,洪兵59
7131254774251143969,BbA退出中国啊,0,0,0,2022-08-13 15:12:47,来自河南,50980086922,落落大方1号
7131169683944358656,德国最大的危险，是摆脱不了各个方面对美国的依赖。,0,1,0,2022-08-13 09:41:35,来自浙江,100056380992,中国北斗七星
7131464717637550889,舒尔茨根本就不像一个国家的领导人。,0,1,0,2022-08-14 04:50:04,来自德国,72220563229,王老三233454809
7131031427826729759,我们也肯定是要实行多元化，加强同英法德以外对我友好国家的经贸往来和经济合作。,0,12,0,2022-08-13 00:47:58,来自新疆,3359762518668893,建Doctor
7131470783876449035,西方人还生活在过去的时代。,0,0,0,2022-08-14 05:15:27,来自河南,4142603308905342,乐观的阳光as
7131414061732004616,做好压舱石也有可能压不住的准备最好。,0,0,0,2022-08-14 01:33:56,来自伊拉克,2273442164118827,用户失败人生
7131350823702954786,德国人的意思是叫中国少买宝马奔驰等德国系列产品，多买自己国产的国货,0,0,0,2022-08-13 21:24:06,来自广东,59213491675,LWEl160394985
7131169646871053090,不欢迎！！！,0,1,0,2022-08-13 09:41:27,来自上海,51983273239,库克船长539
7131199654696010496,到了冬天就知道了,0,0,0,2022-08-13 11:37:52,来自山东,60903807772,独钓寒江雪鱼1
7131265996635194127,西方是一条路走到黑，所谓政治正确也许会死得更快。,0,4,0,2022-08-13 15:55:09,来自湖南,1037585564840094,阿爽禅师
7131153469813457668,朔尔茨要为幼稚买单。,0,2,0,2022-08-13 08:39:32,来自四川,1425418207102318,联晟
7131256210615239463,国产新能源车对德国日本的冲击会很大,0,0,0,2022-08-13 15:18:10,来自山东,272291150181805,淡泊的白云GC
7130945170182636302,这个德国总理太弱了,0,9,0,2022-08-12 19:10:36,来自广东,109392072731,宰斜阳
7131161750824977186,在舒尔茨眼里，只有美国最可靠,0,1,0,2022-08-13 09:10:45,来自河北,107954313930,天宇2866
