7130974912465961731,不欢迎，,0,3,0,2022-08-12 21:05:46,来自上海,1292647070441063,归零8从新
7130952638208246568,性骚扰把柄死死被抓住。不能不听话,0,0,0,2022-08-12 19:39:06,来自美国,1092440544,珑蔚蓝灬
7130965686368994052,这个总理可不是一般的二。,0,0,0,2022-08-12 20:30:14,来自山东,65776222005,柔水颖利
7130966912829358855,图穷见匕手，对这些老牌帝国主义，我们不能有丝毫的怜悯，丝毫的同情，毫不留情进行反击。,0,1,0,2022-08-12 20:34:29,来自安徽,50278476564,在小河那边
7130962377659056911,德国以前几任总理都还是不错的，舒尔痴怎么变得这样烂的？,0,0,0,2022-08-12 20:16:55,来自江苏,2572495601810523,路过001688
7130946310341329699,不欢迎,0,19,0,2022-08-12 19:14:35,来自浙江,57038875742,味无味处
7131252179180094240,中德合作共羸，怀念默克尔时代,0,0,0,2022-08-13 15:02:13,来自江苏,1028765788155496,用户7105321005125
7131341103072707364,当中国人都不买德国车的时候，如你所愿依赖度自然会减少的,0,0,0,2022-08-13 20:47:00,来自山东,105375637019,用户9943572093750
7131236873670279969,欢迎默大妈来,0,0,0,2022-08-13 14:03:11,来自湖北,1261868628066152,用户8306238988567
7131251056079766283,合作共羸，互惠互利，中欧友好,0,0,0,2022-08-13 14:58:01,来自江苏,1028765788155496,用户7105321005125
7131228996439671555,没有任何国家可以独自生存，即使是美国，何况德国乎。中国的优势不仅是庞大的门类齐全的制造业，更重要的是14亿人的市场。,0,2,0,2022-08-13 13:32:13,来自天津,84535884602,用户6013531735447
7131189771011638016,德国已经没有政治家了！,0,3,0,2022-08-13 10:59:31,来自安徽,77168291682,手机用户77168291682
7130877633646117636,没有默克尔的德国正江河日下,0,2,0,2022-08-12 14:48:47,来自广东,58219683932,手机用户58219683932
7131332951270589184,问题是没有人让德国经济依赖别人呀，这个伙计有点滑稽。,0,0,0,2022-08-13 20:14:53,来自山东,575793001410788,用户4970361335051
7131326391660167969,为了别人准备自残[大笑][大笑][大笑][大笑],0,1,0,2022-08-13 19:50:10,,2669219809602115,用户2494837264454
7131222849411007232,先发出请求吧看让不让你来吧！默克尔可以你舒尔茨可能不行,0,0,0,2022-08-13 13:07:47,来自湖南,3606868914604351,用户3234193445676
7131381815919215401,互惠互利才是硬道理。,0,1,0,2022-08-13 23:25:12,来自江苏,61163415806589,用户9359032763117
7131496821951808297,各国的商业往来不可能不带有政治色彩。,0,0,0,2022-08-14 06:51:18,来自海南,79804876137,用户3767445016270
7130945306522649347,朔尔茨你还嫩呢，还得好好跟黙克尔学学理政经验,0,0,0,2022-08-12 19:11:32,来自福建,857235177079067,用户3586787627444
7131309948608545551,我们也可以不进欧盟的商品呀，这不是相互的吗？,0,0,0,2022-08-13 18:45:42,来自四川,3306983398587936,用户954839725599
7131362788710744840,做好准备不要被人家牵着鼻子走,0,0,0,2022-08-13 22:11:20,来自北京,4498835188488235,用户6306842713820
7131157434949354276,西方这些美国附庸根本没有自主权。他们的行动必须符合美国需要和同意后才能实施。对德国现政府不要抱大希望。,0,0,0,2022-08-13 08:54:40,来自江苏,93140262888,用户6474203227978
7131355749078319872,没有什么不可能，脱钩断线随时有可能发生，而且将比对俄制裁更严厉，早做准备是明智之举。,0,1,0,2022-08-13 21:43:14,来自辽宁,2572487303369364,用户902026217375
7131245056035865356,谁都不愿意对别人依赖，但有时候又不得不！,0,1,0,2022-08-13 14:34:50,来自山东,3394915690884452,用户1256218011882
7130972723689587490,德国跟着美国，已经没有选择题,0,2,0,2022-08-12 20:56:54,来自湖南,3632418055262567,用户5999189150691
7130865560250450728,"不知道是智力问题还是智育问题。
一个是先天不足，一个是后天缺氧。",0,6,0,2022-08-12 14:01:28,来自江苏,2968293063278183,用户8288879530994
7131274472015348517,宁可不发展，也要任性，这就是今天的德国！,0,0,0,2022-08-13 16:28:36,来自山东,59209474180,用户162667486736
7131201672453292831,欧美在意识形态上，什么都不可能成为压舱石！,0,0,0,2022-08-13 11:45:52,来自江苏,2387731032323022,用户369404007143
7131174043902444296,跟班老美最放心？,0,0,0,2022-08-13 09:58:47,来自上海,100340859113,用户757311605598
7131277297424204551,德国现在的日子不好过，就这操作会更难过。过了冬看着吧！,0,0,0,2022-08-13 16:39:28,来自山东,2528486840603699,用户5530407445643
7131256505701319463,互相合作，取长补短，是共同发展的道理！呆了！,0,0,0,2022-08-13 15:19:13,来自江苏,54783987596,用户54783987596
7130925383792591655,这个世界又不是光西方国家,0,0,0,2022-08-12 17:54:09,来自辽宁,60644512654,手机用户60644512654
7131234141097968398,在现实面前，总会低头的。,0,0,0,2022-08-13 13:52:12,来自山东,892449102505704,用户893977528584
7131292065824113419,德国眼下正加速右转，我国应该有所准备。,0,0,0,2022-08-13 17:37:04,来自广东,3240993079435534,用户3585711063492
7131159213954597636,不稀罕，先问问我们同意不,0,1,0,2022-08-13 09:01:41,来自甘肃,1895168263065140,用户5520406354772
7130982749628269353,他会很惨的！,0,3,0,2022-08-12 21:35:54,来自山东,580130952720094,用户1592149777944
7131259429811094283,自己造没依赖！,0,0,0,2022-08-13 15:30:53,来自山东,70229666414,用户6326907481831
7131355548012479265,走光短浅,0,0,0,2022-08-13 21:43:29,来自河北,2211835337259540,用户2924291971880
7131341954008843008,不作就不会死 人作有祸 天作有雨,0,1,0,2022-08-13 20:49:49,来自辽宁,4287701247341348,用户4612290090776
7131364111404892935,这是个撕掉了绿皮的绿党！,0,0,0,2022-08-13 22:16:07,来自山东,104297179984,用户1310663586529
7131324160315867945,这是鼠目寸光。拿德国国家利益和百性利益当儿戏。,0,2,0,2022-08-13 19:40:50,来自黑龙江,1161529507973463,用户9175671541968
7131234326830400289,德国人没文化真可怕真实的谎言蔓延啊,0,0,0,2022-08-13 13:53:21,来自天津,104570945839,用户1131077053144
7131467359138677545,国家应提倡企业、个人使用国产车，发展国产车。,0,0,0,2022-08-14 04:58:59,来自内蒙古,1283817326524327,用户9194936990681
7130773276347040548,默大妈后欧洲再无政治家，,0,15,0,2022-08-12 08:03:53,来自江苏,74661035658,淡定松鼠ub
7131209631716164359,德国现在跟漂亮国跟的太紧了，吃的苦头还不够,0,1,0,2022-08-13 12:16:50,来自北京,1961171507755502,用户1078534162943
7131340343987127054,呵呵呵，德国输二次肿瘤，输三次，输四次……,0,1,0,2022-08-13 20:43:49,来自广西,1864375361341943,番茄1864375361341943
7130905623315317516,绝顶聪明，搞死德国。,0,0,0,2022-08-12 16:37:44,来自安徽,1640091818928296,平民百姓活一生
7130803968552764195,光头佬成功地降低德国的国际地位,0,0,0,2022-08-12 10:02:22,来自浙江,5854041642,小楼68528247
7130973923579429662,德企不要依赖中国，你还不如直接说德国经济增长想成负的,0,2,0,2022-08-12 21:01:56,来自重庆,71770076794,硒世宝
7130770580298662656,嘴上功夫!,0,13,0,2022-08-12 07:52:49,来自陕西,97336528894,可爱的老任家
7131362376124891939,德，日都是非正常国家,0,0,0,2022-08-13 22:08:56,来自山东,2366626307267262,@＃雨田
7130944336770253568,朔尔茨这个老小子为了讨好美国，不惜败家！,0,1,0,2022-08-12 19:06:58,来自重庆,68722131398,小溪Lyl
7131204849009476389,德国外长、英国外相还有欧盟领导疯的莱恩，欧洲三大巫婆，引领欧洲投入美国的黑暗统治。,0,0,0,2022-08-13 11:58:04,来自广东,2418563266394094,反黑人士
7130965940522550016,黙克尔可以称得上是成熟的政治家，相比之下，佩洛西就差强人意了，今十四亿中国人民不齿！,0,2,0,2022-08-12 20:30:30,来自江苏,76493690105,青山
7130872363603788559,德国总理像个孩子玩过家家呢,0,1,0,2022-08-12 14:27:38,来自河北,19279916253,愉悦的旭日Wg
7131114650976371492,德国正在跟着美国往死路狂奔！,0,2,0,2022-08-13 06:09:49,来自福建,101966365126,启智十hex
7130847092125844264,一个窝囊废当上了德国总理！,0,0,0,2022-08-12 12:49:37,来自广东,910051340982253,夏天山932
7130783372368102180,德国要起幺蛾子了……,0,1,0,2022-08-12 08:42:49,来自广东,1195887881883064,xjb860811
7130974078412456741,德国这个总理不止把俄罗斯得罪死还要跟中国玩完,0,2,0,2022-08-12 21:02:32,来自广东,5874618645,直率鲸鱼C3
7131194679353918238,德国已经没有战略自主意识，整天跟着美国后面屁颠屁颠的。,0,0,0,2022-08-13 11:19:02,来自江苏,2378996451902311,柳埠行者
7131180397157008140,你德国有这哦能力吗，现在的西方国家缺少有能力的政冶家，,0,5,0,2022-08-13 10:23:54,来自北京,58881930746,沙楞
7131280185512903439,大众车 奥迪 奔驰 宝马不想在中国赚钱了? 中国市场是这些车企能够盈利的最大市场，德国企业喝西北风吗,0,0,0,2022-08-13 16:50:15,来自浙江,6004679366,pressxia
7131283824230957860,默克尔啊，你在哪里？德国人民想念您！你什么时候再上岗拯救德国呀？,0,0,0,2022-08-13 17:04:55,来自浙江,962812159208152,奇妙清风yf
7131259331705963299,德国佬嘴巴这样说的！其实离开我国后、德国经济倒退十年！,0,0,0,2022-08-13 15:29:24,来自广东,5876016209,BoBo69791693
7131316661198029598,默大妈要被气死，德国一手好牌打烂了,0,0,0,2022-08-13 19:12:16,来自上海,106814334976,留沉默
7130790024136065833,有朔尔茨这样的总理是德国人民的悲哀,0,0,0,2022-08-12 09:08:17,来自四川,111611914681,朴实辰星SX
7131271914496410383,中国工业门类齐全也要开展国际合作才行，德国你行吗？,0,0,0,2022-08-13 16:18:03,来自河南,109749893637,一往无前清泉zr
7131298199171580675,德国现在的路线是紧抱美国大腿！,0,0,0,2022-08-13 18:00:42,来自吉林,79820649963,大气高山V
7131237089911325451,这个男人还不如个老太太,0,0,0,2022-08-13 14:03:54,来自新疆,73734078309,用户7507822580217
7131192262625166110,德国这样做就是自寻死路。,0,0,0,2022-08-13 11:09:35,来自江苏,6732044825,铁甲防务观察
7130770511470805801,那你自己搞定,0,4,0,2022-08-12 07:52:36,来自上海,100504983753,考夫大胖子
7131207203864281890,好啊！你可以到其他国家去赚钱啊德国。,0,0,0,2022-08-13 12:07:01,来自上海,101072536397,日月同辉66457
7131242517563458316,德国若离开巨大的中国市场，经济肯定下滑！欧洲国家不应盲目的听从美国指挥！,0,0,0,2022-08-13 14:25:13,来自内蒙古,4049592553,王文福
7130875309905789708,随便,0,1,0,2022-08-12 14:40:08,来自四川,59414243906,勇敢的湖泊s
7130968857988416297,你去依赖美国去吧！,0,3,0,2022-08-12 20:41:48,来自江苏,111042213541,自在的逸然
7130811630388232999,德国的好日子到头了,0,0,0,2022-08-12 10:32:42,来自安徽,1503787255863823,智慧的Cinderellaa
7130807684034544414,德国🇩🇪想抱紧美国犹太干爹大腿🦵， 可惜美国大势已去,0,0,0,2022-08-12 10:16:54,来自四川,61024992682,monscha
7130938803744719647,小人得志，德国倒退是大概率。,0,2,0,2022-08-12 18:45:43,来自广西,2189870150196015,阿新哥叔叔
7130939928065884959,确实没必要 这货当不了多久德国总理了,0,68,0,2022-08-12 18:50:15,来自澳大利亚,3138928226,耀孩儿
7131168315338294053,身在福中不知福，作死的节奏,0,1,0,2022-08-13 09:36:27,来自广东,72857223223,货架制造psTC
7130892932890657544,现任德总理骨子里是反华的，不要抱希望，它就是美帝的小弟,0,0,0,2022-08-12 15:48:10,来自四川,87139083666,远方的梦想Zhg
7130804619617714947,哪远滚哪去，你德国算个屁,0,0,0,2022-08-12 10:05:39,来自内蒙古,59560938300,修行的石头
7130960565945729833,这秃驴不是啥好东西！默克尔大妈不错！,0,3,0,2022-08-12 20:09:44,来自湖南,778085683443211,马弹钢琴
7130834075308835597,"这个德国总理 注定是垃圾一个
执政水平不敢恭维",0,0,0,2022-08-12 11:59:29,来自湖南,294258145770355,衡阳群众
7130832332538004255,现在的德国政客，只剩下傻子和莽夫！,0,1,0,2022-08-12 11:52:43,来自广西,19791966022,无本也好
7130827058380931843,低智商的总理.缺乏战略眼光，德国的悲哀！！,0,0,0,2022-08-12 11:32:52,来自浙江,51163479801,房地产研究中心
7130780600155767560,德国想要有独立性，你能吗？你敢吗？先把拴着的绳子咬断试试你的胆识！,0,0,0,2022-08-12 08:32:16,来自山西,1288255203706844,独角兽之澜
7131201916696298275,口口声声说追求独立性！德国总理有点幽默！就差跪拜牛仔裤下了[偷笑],0,2,0,2022-08-13 11:46:30,来自河南,111181675445,风趣蛋糕ta
7131299793284154142,这个小老头减少对中国和俄罗斯的依赖，将让德国暗无天日，人才啊！,0,0,0,2022-08-13 18:06:49,来自湖北,936419708112755,用户8290103604978
7130970289890542367,默克尔辛苦打下的家业迟早被这孙子败光,0,2,0,2022-08-12 20:47:57,来自云南,101735180928,小嘎巴775
7131191775649612577,朔尔茨混蛋无知无能之辈,0,1,0,2022-08-13 11:08:01,来自河北,110973413542,缤纷光束ZV
7131192291729556258,德国这个新总理挺傻逼的,0,0,0,2022-08-13 11:09:14,来自陕西,3450825121,爱新觉罗皇室贵族努尔
7130818936500716288,应该敲打一下德国,0,0,0,2022-08-12 11:00:10,来自湖北,94648811788,勇者海燕DQ
7131180268656345864,先把国家独立自主权树立起来，不然德国永远都是美国的一条犬,0,0,0,2022-08-13 10:23:09,来自天津,63101424374,東易神雕
7130820712402535183,德国没有伟大政治家，只有流氓政治家,0,0,0,2022-08-12 11:07:05,来自浙江,8084937361,风129111411
7130946130111873799,舒尔茨就是一个反华先锋美国的走狗。,0,1,0,2022-08-12 19:14:16,,61805879743,热情的雪碧wQ
7130950929750721310,舒尔茨 跪拜美国，丢尽了德国人的脸,0,1,0,2022-08-12 19:32:59,来自浙江,24084943862,敢说直话
7131187335744160550,德国这帮傻x不知好歹的东西，快去舔你美爸爸的屁股去吧！,0,0,0,2022-08-13 10:51:01,来自北京,2787968034279707,成熟梦想家Jf
7130946733261488911,谁邀请你访华了，自做多情了吧,0,3,0,2022-08-12 19:16:14,来自天津,1236284540465679,中，蜘蛛侠，小，嘻嘻嘻，吃，，
7130957900747031299,那你有哦本事叫德国车企滚出中国啊。,0,2,0,2022-08-12 20:00:27,来自江苏,1503749394931271,多情舰长无情舰
7131212261611979550,德国这是要作死的节奏,0,0,0,2022-08-13 12:27:10,来自北京,1328630975966244,仁爱可乐8u
7131186480319890180,德国企业听政府胡扯吗,0,0,0,2022-08-13 10:47:26,来自上海,4454873801177374,ZJX在路上
7131193404218327842,这个新上任的总理倒向美国！把默克尔的家底早晚败光了算！,0,0,0,2022-08-13 11:13:29,来自北京,52045137680,孺子铜牛
7131243075666150180,就是在作死。[呲牙],0,0,0,2022-08-13 14:26:59,来自安徽,60493427320,柳下垂钓1
7131178510663779111,喊给美国听的，默克尔比你有骨气多了,0,0,0,2022-08-13 10:16:23,来自北京,3432123926,北京小黑哥vlog
7130954361366594340,算什么东西？你能代表德国的经济需求吗,0,2,0,2022-08-12 19:46:02,来自山东,101370958705,博学的苹果mH
7131204206547075844,德国钱多，就让他去买更贵的别国物品吧！,0,0,0,2022-08-13 11:55:53,来自浙江,3856729303426963,积极的晚风gJ
7131263089827365662,这是个走极端的家伙，以为抱着美国的大腿，德国就万事无忧了。,0,1,0,2022-08-13 15:44:19,来自江苏,1741221667278046,一腔热血精忠报国
7130951434124034848,朔尔茨应该向美国人装出狗的样子,0,1,0,2022-08-12 19:35:02,来自上海,57011384656,FySNN
7130873776057287464,[捂脸][捂脸][捂脸][捂脸],1,0,0,2022-08-12 14:33:18,来自湖南,3456514216169144,用户4559014507947
7131328698317292319,[害羞][祈祷][祈祷][祈祷][赞][赞][赞][赞][赞][赞],0,0,0,2022-08-13 19:58:31,来自天津,1530975400758407,勇者安迪2o
7131236703385944870,[灵光一闪],0,0,0,2022-08-13 14:02:36,来自广东,23207845518,及以上
7130839707776353027,[微笑][微笑][微笑],0,1,0,2022-08-12 12:21:32,来自上海,4231398601785443,天山天湖天河
7130799220378354444,[得意],0,5,0,2022-08-12 09:44:58,来自江西,2700053834892589,用户623023208604
7130846249640968992,[赞],0,1,0,2022-08-12 12:46:55,来自山西,92504169172,春暖花开5691473799815
7130954401329529641,大众，奔驰，宝马说过这话我这么接阿。你给我找市场,0,0,0,2022-08-12 19:45:49,来自广东,105172065503,Kany407
7130792467838305037,嘴上功夫!,0,3,0,2022-08-12 09:25:56,,4460081358853287,用户4887467786091
