7131704268394349347,我囤的米够我吃一年半载了,23,94,2,2022-08-14 20:15:45,来自福建,100723675103,姜子说古书
7131607244226986786,这几年，不乱花钱，守好自己的钱袋子，过细日子，不要浪费粮食，珍惜当下。知足，不抱怨，多挣钱，少花钱。,29,791,7,2022-08-14 13:59:17,来自新疆,93137351793,清爽生活901
7131707541243364111,这事我问过印度本地人说不会存在缺粮食的说法～[捂脸],2,1,0,2022-08-14 20:28:29,来自广东,87736507433,sunny925
7131614373097161487,我就吃中国大米，其它国家从来不吃,8,48,0,2022-08-14 14:27:10,来自福建,65718704585,欣欣宝126
7131741563658896136,农民老了。干不动了。怎么办。年青人都走到城市里去了。,3,10,0,2022-08-14 22:41:16,来自陕西,1292668273956044,潇洒光束Kd
7131632327213843239,我不慌，因为我们国家已经囤了大量的粮食。[大笑],24,254,1,2022-08-14 15:37:35,来自广东,804454090158791,过冬的草莓
7131653930316219149,关键是种子，中国人有没有自主权,25,84,2,2022-08-14 17:01:00,来自上海,50014593943,竹卿卿
7131656407795565319,希望如此吧。粮食涨价,6,147,1,2022-08-14 17:10:44,来自辽宁,59962847961,台风
7131693876049511204,现在能吃上2.5一斤的大米是多么幸福的事[呲牙],8,50,1,2022-08-14 19:35:42,来自广东,4437277784159304,看各路大神表演
7131669812308443919,粮食不涨价，以后种粮食的越来越少，宁愿荒废，化肥农药，人工不停涨，粮食不涨价，这样会增加饥荒，农业是国家发展的根本,8,179,3,2022-08-14 18:02:09,来自陕西,602946046012323,宇宙圣主紫薇造物主
7131617719116022568,沒关系我吃起来两个半碗,5,68,1,2022-08-14 14:40:09,来自浙江,1006800813169163,快乐的钢笔Rj
7131637083206452004,我至少一年不着急，我种田,6,61,1,2022-08-14 15:55:40,来自广西,50801801596,你受伤害了吗
7131674467360703263,有田种的人一定好好种，,12,31,1,2022-08-14 18:20:33,来自广东,111528557347,温柔花猫h0
7131644909668958980,好家伙，你前四分半吓得我都准备去屯粮了。结果后面一分钟你告诉我不用。[捂脸],7,64,1,2022-08-14 16:26:32,来自浙江,3897106499644509,潮流达人凌源8m3
7131688282136150787,饿怕了，看曹德旺吃饭一粒米饭都不浪费。,1,2,0,2022-08-14 19:14:43,来自广东,1697270592973496,博学多才的星球Sk
7131660480606896908,从印度进不进口无所谓，印度出口的全是糙米，难吃的很，买回来也是当猪饲料的。,1,24,1,2022-08-14 17:26:42,来自广东,968034287100695,视野富锦9r8
7131625561189483304,有什么可怕的，我一人种13亩水稻，做米饭吃一半那一半喂鸡鸭，还能卖好多，换点钱买点生活物资。,3,78,2,2022-08-14 15:10:40,来自山东,54963414694,依然爱你145170283
7131632898788049703,一斤粮食还买不到一瓶水，粮食必须涨价。,4,51,3,2022-08-14 15:39:40,来自江苏,4661425562,儒雅钢琴ya
7131601187987931915,今年干旱，农民日子不好过,17,196,0,2022-08-14 13:36:31,来自安徽,111111594820,浪里小白龙希
7131617048744149796,我是农民，我从没感觉到粮价大涨，小涨都没，农村都荒田了。,4,48,0,2022-08-14 14:37:49,来自湖北,3438864205626688,严男人
7131670533057348355,曾老先生的预测，正在一个一个实现,2,14,0,2022-08-14 18:05:34,来自湖北,6805577311,西杜东詹库日天
7131615720638890752,房地产倒闭，企业效益不好，是不是都和疫情关,8,79,1,2022-08-14 14:32:18,来自福建,65718704585,欣欣宝126
7131620882128421635,就是大米卖到100一斤，农民还是穷,2,17,0,2022-08-14 14:53:09,来自江苏,3189916606,天下之藏
7131607497617949444,比房价都算是没涨价,1,57,0,2022-08-14 14:01:10,来自福建,101619329713,理杨416
7131710581853537054,别的我不知道，但贵州黔东南一带以水稻为主五谷杂粮为辅，丰收节一万斤干稻谷最好的价格卖出16000元！黔东南稻谷半分之98都是一季，在家种地收入在22000左右！除了肥料，农药，人工，机器磨损烧油各种费用，最后还能赚2000过年就不错了！,1,5,0,2022-08-14 20:40:38,来自广东,1121102766027485,乐观小健
7131612151764288290,"涨了才好回家种地去家里有21亩地呢
现在种地根本就不挣钱",6,31,0,2022-08-14 14:18:29,来自江苏,50096472809,黎明在徐州
7131610921197110027,一斤粮食还买不到一瓶水，粮食必须涨价。,31,334,1,2022-08-14 14:14:11,来自湖北,6986694602,蔡艳军1
7131633091374285606,你确定一公顷地能产2.6万吨粮食？,6,25,1,2022-08-14 15:40:41,来自广东,606580125743832,天下闻W闻天下
7131710419278299945,我就唔怕无粮食，因为中国是粮食大国储备粮是最多的，不过每一个人都应该不要浪费粮食。,0,4,1,2022-08-14 20:39:39,来自广东,201949559662912,健康艾罗9N0
7131602982101402379,中国粮食库存有五年库存。,22,68,2,2022-08-14 13:43:35,来自上海,2990299616646915,无眠xxx
7131594628347872030,就印度的大米，给钱都不敢吃！,14,112,2,2022-08-14 13:10:42,来自山东,4029080317992062,UNFARI
7131651050762748712,国内水稻收购价格对农民来说太低了。 我是东北吉林省的农民。 现在这里收购水稻价格才1.3元-1.4元/ 斤 农民粮卖不出价格，可是土地承包费用年年涨，化肥价格涨幅达到40-50% 。 农药价格也涨了30-45%。 人工费用因疫情原因涨幅达到了60-80% 。 这也无法顾上熟练工。。。 燃油也涨了不少。。。 农民太难了。 本人去年的水稻到现在没买出去14万斤。。。。 去年因缺钱买了10万斤的价格才1.12元/斤。 [捂脸][捂脸][捂脸] 可是市面上的价格是涨了的。。。 可为什么农民的买价这么便宜呢？ 都是中间的奸商太多了。 农民还无法离开商人。 这是目前的农民实际碰到的问题[发怒][发怒][发怒],2,28,1,2022-08-14 16:49:15,来自吉林,1560436386,云22370306
7131758654638473992,粮食要涨价了？家里屯点米吧,0,0,0,2022-08-14 23:48:45,来自江西,325891480882479,实在是高
7131759175163527977,我们自己种粮，自给自足，别人涨别人的，好不好吃都无所谓，只要不饿着，不得病就行,0,0,0,2022-08-14 23:49:50,来自湖北,5374166317,青青晓姚
7131706049534837504,农民辛辛苦苦的种粮食，一块三都保不住，真的是老火,0,2,0,2022-08-14 20:22:40,来自四川,102086428536,妮妮42826
7131713995186275084,中国也一样，今年粮食价格肯定要翻身了,1,0,0,2022-08-14 20:53:48,来自湖南,3737963161987805,不安于誓
7131659946097443584,涨价必须涨，城里人看不起农民涨50一斤都不贵,4,16,1,2022-08-14 17:23:52,来自浙江,55024782454,大为145990715
7131599944620393216,农民还是穷,2,37,1,2022-08-14 13:31:09,来自河南,52555661298,心扉易冷1
7131619229748577031,一公顷地等于2.6万吨？ 应该是一万公顷等于2.6万吨,0,9,0,2022-08-14 14:46:08,来自陕西,99497748555,唯美的记忆fl
7131607080213676803,喜迎大米猛涨，最好涨到200块一斤,8,102,4,2022-08-14 13:59:46,来自云南,18039352365,微笑湖泊U
7131661424082289408,中国不怕，至少三、五年的战略储备是有的。中国粮食价格的变化受国际影响并不大。这就是饭碗端在自己手里。进口的粮食大多数是支撑饲养业、食用油料。别的不说，关停1/3的酒厂，释放出的粮食存量就够用相当长的时间。,0,5,0,2022-08-14 17:29:40,来自江苏,2155474208168623,活泼扑克1L
7131689862617105183,感谢袁爷爷,0,3,0,2022-08-14 19:20:30,来自河南,607355080017076,超人视频大全
7131757256122696486,国家要整治好。,0,0,0,2022-08-14 23:43:09,来自广东,75439661473,一枝梅芬芳的花香
7131754893068878631,涨吧，反正我家还种有,0,0,0,2022-08-14 23:33:44,来自广西,60247110100,洁不说谎
7131729216911508262,说的好，为你点赞，咱老百姓手中有粮，心中不慌， 为我们身在祖国而自豪！！！,0,0,0,2022-08-14 21:53:15,来自湖北,39224256503411,番茄39224256503411
7131739153825563430,中国人以前不吃大米，小麦,0,0,0,2022-08-14 22:32:00,来自河南,2946282121865838,好学面条rj
7131677957814715143,只要有粮食就不会挨饿，其它的无所谓👏🌹,0,3,0,2022-08-14 18:34:13,来自江西,1222245350639015,丶可这
7131708454825624333,我们不需要,0,0,0,2022-08-14 20:32:20,来自安徽,50337667278,带孙子老人
7131708536245682952,感谢袁老！感恩祖国！还是存点粮吧。,0,2,1,2022-08-14 20:32:47,来自陕西,64520855933,苦咖啡90000
7131747823720612623,地瓜，土豆，玉米，木薯，芋头。这些也能当主食。,1,0,0,2022-08-14 23:05:13,来自福建,4537221929,YI容
7131716515065234210,我不慌，因为我们国家已经囤了大量的粮食。[大笑],0,0,0,2022-08-14 21:03:04,来自四川,102138877461,无双鲸鱼JM
7131735392508281640,"赶快屯粮实国库！
未雨绸缪！",0,0,0,2022-08-14 22:16:39,来自宁夏,56803567608099,万景月
7131716206439973669,对这个没得兴趣，不喜欢吃[捂脸],0,0,0,2022-08-14 21:02:15,来自四川,51636380296,001001真
7131680501094171396,我们不是有国家存粮吗[抠鼻],0,2,0,2022-08-14 18:44:34,来自贵州,2815219825116989,开朗的猎网友人
7131753362949145376,好，我们农民也可以涨价了,0,0,0,2022-08-14 23:27:59,来自广西,52198331041,海阔天空207719493
7131724731900281608,不慌、不慌、有粗粮就行！,0,0,0,2022-08-14 21:35:34,来自江苏,1085959262976276,天使掉的猪
7131750188360336132,中国人不要浪费粮食，要节约食物,0,0,0,2022-08-14 23:15:40,来自山东,2453756170471246,温柔钢笔2v3
7131610780784689950,粮涨是好事，农民种地入不敷出，米因卖5元一斤,0,27,0,2022-08-14 14:13:40,来自浙江,102182729506,勇者根河9j
7131712264482161420,囤积居奇呀,0,0,0,2022-08-14 20:47:14,来自山东,1837994934017112,优雅狸花猫
7131759657793913641,粮食是一国的的命脉，手里有了粮，心里不发慌。不涨价就行。,0,0,0,2022-08-14 23:51:29,来自北京,72085979756,为祖国而骄傲
7131718548217086758,完播支持友友强烈推荐,0,0,0,2022-08-14 21:11:55,来自河南,431432510487956,春暖花开红杜鹃lhm
7131688830616568576,新房子修路，耕地面积越来越小[流泪][流泪][流泪][流泪],0,0,0,2022-08-14 19:15:59,来自广东,62707114386,糖果虫虫1
7131715472764404491,真的是好感谢袁爷爷的努力[祈祷]我一家七口人，种二亩田可以吃两年之久了，家庭有粮心中不慌[赞],0,0,0,2022-08-14 20:59:49,来自湖南,93290946441,刘达844
7131733661829382920,一公顷能产2.6万吨？,0,0,0,2022-08-14 22:10:29,来自广东,60513799913,一缕惊喜
7131609690198868767,一公顷地等于2.6万吨？ 应该是一万公顷等于2.6万吨,0,11,0,2022-08-14 14:09:27,来自辽宁,88372165228,不系之舟Vulovic
7131728218600162088,希望粮食涨价，让农民增加收入,0,0,0,2022-08-14 21:48:46,来自福建,105313925246,金玉满堂vlog
7131747939768419108,我国粮食应该够我们吃的了。反对浪费米饭。特别是办酒席。,0,0,0,2022-08-14 23:06:17,来自安徽,4432830493370504,无双小鱼rr
7131744391966278430,我家地多饿不着，现在还是农村好,0,0,0,2022-08-14 22:52:19,来自河北,96699883083,大叔也疯狂555
7131700825822757636,种子还是关键一环。,0,0,0,2022-08-14 20:03:07,来自广东,52312432582,风塔頭
7131755689013691176,一公顷地能产2.6万吨大米？有点吓人啊！,0,0,0,2022-08-14 23:36:11,来自广东,1214328701456062,肖申克的救赎880
7131745351060603662,父母每年都强迫我回家种收粮食，心里很抵触，累惨了，如今光谷子今年收了近5000斤，,0,0,0,2022-08-14 22:55:55,来自重庆,62985295619,农村任1
7131610904328373005,对不起，我国基本不受四大粮商的牵制,0,8,0,2022-08-14 14:14:18,来自湖北,86026859919,你个大明白
7131711098654491429,粮商高兴😀粮农却一点也高兴不起来[抠鼻],0,0,0,2022-08-14 20:42:32,来自湖南,71216196995,我是谁31449
7131742738097586955,嗨，没有问题，国家粮食库里的粮食够咱吃12年，不用担心，大米的价格上涨，而且我们国家也能实现自给自足，我们国家大米的进口量是我国所有农作物里面最少的,0,0,0,2022-08-14 22:46:09,来自甘肃,105200991400,开朗的网友5729
7131743931146175272,泰国拿大米换中国的高铁的大米都要吃一段时间,0,0,0,2022-08-14 22:49:57,来自广东,2418581795504990,高级苹果oEs
7131713629052748557,就是看农民还可以工作。,0,0,0,2022-08-14 20:52:12,来自山西,1081527443405736,博学多才的使命召唤的忠实玩家
7131745252738237187,1公顷=100米×100米，怎么可能有上万吨的产量呢？,0,0,0,2022-08-14 22:56:09,来自贵州,1560896465800491,坚铤老林拒虚假
7131745171489981195,对农民来说，应該是好事。,0,0,0,2022-08-14 22:55:45,来自广东,52644825179,乾隆168238145
7131712051944506146,等一下一公顷，15亩地能产2.6万吨大米？你大米是金子也没有这么重啊。,0,0,0,2022-08-14 20:45:57,来自江苏,107749835705,银通海
7131736651000775461,作为农民的我想不通粮食涨价为啥不好，除了粮食起不了价，肥料、农药、人工、机耕啥都涨价，老老实实种庄稼一年到头赚不了几个钱...,0,0,0,2022-08-14 22:22:15,来自广东,50321133087,幻影错觉
7131726081954136840,印度自己家粮食够吃吗！印度最少有四亿人在挨饿，这样的话俄罗斯做梦都会笑醒，小麦也是主粮啊,0,0,0,2022-08-14 21:40:42,来自安徽,98892568310,至尊宝小咪眼
7131603314638668556,真的吃不起饭，人类也就不买了，也买不起了，可以去抢了,0,7,0,2022-08-14 13:45:13,来自上海,2990299616646915,无眠xxx
7131744142497088271,后面说的有点离谱，现在国家粮食已经迫在眉睫了，好多基本农田都成了厂子或者房企，请问粮食怎么办？,0,0,0,2022-08-14 22:50:39,来自河北,24515286827,谁动了我的琴弦8
7131740460930515716,不过是国际粮商借机炒作拉高出货罢了，和俄乌战争开始的时候炒作粮食危机一样,0,0,0,2022-08-14 22:37:25,来自河北,633738259906591,哋投诉此人
7131739504234644236,印度这么多人，不仅吃饱还大量出口，真厉害👍[赞][赞],0,0,0,2022-08-14 22:33:27,来自云南,241501012765879,大山里的黑石头
7131717577214411553,回家种田去[奸笑],0,0,0,2022-08-14 21:08:03,来自湖南,3429695178,o蛋蛋di忧伤
7131711080292025119,我感觉光是我村都养三个村的人啊[捂脸],0,0,0,2022-08-14 20:42:24,来自江苏,58225416622,情人劫7188
7131700697418695460,随便涨3年不种够吃五年,0,0,0,2022-08-14 20:02:27,来自江苏,4300933486887293,煙雨醉梦
7131701246163124999,我不怕，我家还有二亩地,0,0,0,2022-08-14 20:04:25,来自云南,111282850619,才高八斗苹果IX
7131740218096599844,放心！有专家解决！专家有办法种出来！,0,0,0,2022-08-14 22:35:37,来自广西,3641177638175213,运动科迪9d
7131728115487212303,我去年还剩有十多袋，太便宜了，卖了亏本，不卖长虫,0,0,0,2022-08-14 21:48:21,来自广东,3122201815960907,大多卵鱼
7131711108519396099,大米涨价看会有多少人去种田，就不会有那么多田没人种了，真心希望粮食涨价,0,0,0,2022-08-14 20:42:47,来自江西,99911030115,梦丶呀a
7131709977731121960,问题要一分为二，要全不买大米，它们会烂在仓库里的。,0,0,0,2022-08-14 20:37:56,来自天津,95323643094,老顽童6308757998907
7131707618112111400,北方人吃小麦，不愿吃米,0,0,0,2022-08-14 20:28:42,来自山东,1244249966257479,梦幻奶茶lk
7131717608500052776,赶快涨，我好回老家种田,0,0,0,2022-08-14 21:07:37,来自福建,110025249169,80后小陈
7131701980649030434,啥时候涨价我好回去种庄稼[小鼓掌],0,1,0,2022-08-14 20:06:59,来自重庆,101898821140,老帅D
7131710762225664783,退林还耕就是解决粮荒问题的应对之一。,0,0,0,2022-08-14 20:41:02,来自山东,23698928118,萌叔兰博
7131732264509768484,农村荒地好多的,0,1,0,2022-08-14 22:05:02,来自山西,417414426931451,快乐书签vg
7131759628672615168,袁爷爷，怀念您！为我们吃饱饭，功不可没。[流泪][流泪][流泪],0,0,0,2022-08-14 23:51:12,来自广东,97689227091,虎啸山河罗长生998833
7131719895423402783,所以，应适当提高大米价格才是解决根本性问题,0,0,0,2022-08-14 21:16:46,来自广东,1068319287022475,廉江黄科长
7131755268622746375,看我们的北大荒股价就知道我国缺不缺粮食了,0,0,0,2022-08-14 23:34:53,来自四川,92861440168,流士868
7131743021008995105,全球杂交水稻之父，不是我们的袁爷爷吗？,0,0,0,2022-08-14 22:47:00,来自湖南,59356458025,雷刚161357616
7131704303257633544,没事的，我家种了4亩水稻，不卖的话人吃4年都吃不完,0,0,0,2022-08-14 20:16:25,来自广东,52651408100,工程人张工1
7131708401403052811,在不涨价没人种了,0,0,0,2022-08-14 20:32:34,来自湖北,110088049976,做最浪漫de事
7131708946083054336,一公顷年产2.6万吨粮，连泥巴称吗？,0,0,0,2022-08-14 20:33:47,来自广西,6213701415,会游泳的大公鸡
7131747872797770531,我们吃土豆的[呲牙][呲牙][呲牙],0,0,0,2022-08-14 23:05:12,来自浙江,59411684372,张健161727493
7131604562842075942,疫情之下，什么都难[流泪],0,11,0,2022-08-14 13:49:38,来自湖北,452595179335179,微笑基诺
7131699257601917696,中国一份地就能养活一人，不用怕没粮吃,0,0,0,2022-08-14 19:56:19,来自浙江,3843507084069358,凉凉尘曦
7131731309453509379,应该涨价，涨得越高越好，现在每一个饭店，工厂饭堂浪费的太多太多了，明看吃不完还打那么多，全部倒掉了垃圾桶里！,0,0,0,2022-08-14 22:01:13,来自广东,2814339956875123,智者吉恩4q1
7131707040011191074,涨呢涨到十元一斤，年轻人好种地,0,0,0,2022-08-14 20:26:25,来自云南,5913336274,司马喷
7131722845071786790,广西农村野猪野菜可以够农村两年不用粮食,0,0,0,2022-08-14 21:28:31,来自广西,53157390182,青竹141175497
7131724632876598055,我自己种的大米都够一家人吃3年,0,0,0,2022-08-14 21:35:19,来自广东,80165064122,坏小子7931
7131597516764300068,趁火打劫＇[爱慕][爱慕][爱慕]／\,0,10,0,2022-08-14 13:22:15,来自广东,1148303076252008,好奇高山5k2
7131741814578840357,不好意思啊，中国的大米蓄备可供全中国吃1年多，中国进口玉米、大豆都是做饲料的多。目前中国的水稻也大丰收，米价也不涨，市场稳定供应充足。,0,0,0,2022-08-14 22:42:04,来自广西,107747645785,稻香丰收年
7131713596056781599,我就是农民。,0,0,0,2022-08-14 20:52:20,来自山西,1081527443405736,博学多才的使命召唤的忠实玩家
7131717638417924904,我不怕我有一亩三分田.自己动手丰衣足食。[微笑][微笑][微笑],0,0,0,2022-08-14 21:07:35,来自广东,3289967895,夢__凡凡ii啊
7131743272867054368,因为乌克兰危机，全球粮食短缺，果断买了2000块钱的农业基金，想随随便便挣点水果钱。最高时涨了14%，最近又跌回去了[捂脸]。,0,0,0,2022-08-14 22:48:09,来自上海,52563389877,年轻人太气盛
7131744276052558627,没关系，要是涨价了，我就回老家种大米去，你不知道，我老家80%的田都没人种稻子，都种其他作物了！还有很多直接荒废了！,0,0,0,2022-08-14 22:51:19,来自广西,68116402876,天堂不寂寞31
7131732012037358377,就说玉米吧，今年收购价格比往年提高将近20%，但是农药化肥，涨价幅度在一倍左右。相对来说，如果家里地少的，今年比往年都是亏的。,0,1,0,2022-08-14 22:03:27,来自河南,105200549451,GuHAHa
7131710787546743592,上涨一百倍，我回老家种地去[捂脸],0,0,0,2022-08-14 20:41:01,来自江苏,14023124655,清扬140100749
7131711181173080864,感谢，我的国[赞][赞][赞],0,0,0,2022-08-14 20:43:03,来自辽宁,2497679608777166,博学多才的旭日pJ
7131723926325216013,二氧化碳造淀粉来了！,0,0,0,2022-08-14 21:32:18,来自广东,59100434400,寻世义
7131720751195079455,今年夏粮市场价一块三一斤，明年决定不多种，够吃就得了,0,0,0,2022-08-14 21:19:54,来自广西,52472942979,一帆风顺cc
7131738499413361449,我家去年的谷子还满仓，今年的又马上要收割了，都没地方存放了，卖又不值钱，真愁人,0,0,0,2022-08-14 22:28:39,来自广东,6313512224,tddws
7131708695251272487,一公顷地能产2.6万吨大米？？？自印度开始种大米以来的产量吗？,0,0,0,2022-08-14 20:33:39,来自上海,3610986101,等你归来19950811
7131723534623589134,我们国家专家早就说了，我国粮食足够我国用的。不怕，只要他们涚的靠谱。,0,0,0,2022-08-14 21:30:47,来自新疆,3333326154507463,奇幻圆月cU
7131718214786024207,你的话让我担心后怕,0,0,0,2022-08-14 21:09:38,来自江西,109212276173,热血青年德惠0X1
7131733066501948173,粮价涨了，农民工就不用背井离乡了,0,0,0,2022-08-14 22:07:55,来自湖北,50508836641,不合时宜2
7131718938437698339,天灾不可怕，就怕人祸,0,0,0,2022-08-14 21:12:34,来自新疆,2488934573549950,每段路灬都是领悟
7131741697071383308,支持大米涨,0,1,0,2022-08-14 22:41:58,来自重庆,251130289598200,自由霸州4z
7131710570181100295,我想知道美国大米多少美元1斤，折合人民币多少钱一斤，什么都是以美元计算，中国的大米应该是多少钱一斤,0,0,0,2022-08-14 20:40:36,来自广西,109646230822,鸣不惊人
7131731533634978597,一瓶饮料都五块钱，建议一斤粮食五块钱,0,1,0,2022-08-14 22:01:54,来自天津,1772047181558295,振兴乡村我辈当努力
7131698527952175913,没事儿，我可以吃面,0,0,0,2022-08-14 19:53:26,来自云南,50230907659,吊形吊影125842573
7131720328820851497,中国不缺粮食,0,0,0,2022-08-14 21:17:51,来自湖北,104272128172,舞动北安6E5
7131698728989213447,现代人饭量少才过剩的。,0,0,0,2022-08-14 19:54:26,来自广东,110193383344,JQB金钱豹
7131744868896326440,今年我收获一千七百多斤玉米，稻谷一千五斤左右，下季度还没收[呲牙][呲牙][呲牙],0,0,0,2022-08-14 22:53:38,来自广西,3865509917100148,在某年认识的人
7131697749665530639,涨多少？与汽油一样吗？,0,0,0,2022-08-14 19:50:21,来自湖北,3004346360,V5874609097
7131707795456148255,活脱脱想赚咱们中国人的钱。[捂脸],0,0,0,2022-08-14 20:30:01,来自广西,107866468433,cy锦夕
7131745513728803619,一公顷地能产2.6万吨大米是真的吗 一平方公里等于100公顷吧,0,1,0,2022-08-14 22:56:15,来自安徽,55110650048,卫事业奋斗
7131737640004797196,今年水稻比去年便宜0.1元一斤。,0,0,0,2022-08-14 22:26:02,来自安徽,421822204754616,雪中乐
7131704940002951975,大米加价我一千个支持,0,0,0,2022-08-14 20:19:03,来自广东,102016658277,邵应军
7131724149416461097,俺吃玉米小麦[泪奔],0,0,0,2022-08-14 21:33:03,来自山东,1311098732815551,人生如梦似幻
7131703430556517155,家里有地，种一年吃3年,0,0,0,2022-08-14 20:12:23,来自云南,57687442605,以暴制暴方能止战
7131736156286452516,粮食是一种武器,0,0,0,2022-08-14 22:19:55,来自广西,2995540878966221,消防员带你看世界
7131733898945774349,曾老预言又准了。说了要有粮食危机了,0,0,0,2022-08-14 22:11:12,来自上海,2397373089711815,LJCGNN
7131699120544547624,中国大米不能涨价,0,0,0,2022-08-14 19:55:44,来自辽宁,4339358868,冥河蝴蝶泉
7131722210771075855,中国的粮食战略储备可以让全国人敞开吃两年，所以我们不必过于恐慌。,0,0,0,2022-08-14 21:25:23,来自广东,76133697349,JahnY
7131706756484547362,大米早该涨了,0,0,0,2022-08-14 20:25:21,来自广东,52528186747,农历九月二十五
7131699787187208973,一般不吃大米，一年也吃不几次[捂脸],0,0,0,2022-08-14 19:58:40,来自山东,2334974552321659,豬猪小王子
7131733059405398825,不要害怕，小麦和玉米也够吃的,0,0,0,2022-08-14 22:07:30,来自山东,85140776460,一直在路上987654
7131711319338058531,11亿在我国算？,0,0,0,2022-08-14 20:43:04,来自安徽,1816045135874616,敏锐风铃aE
7131724217041208104,大米涨价好事呀！农村就不会有那么多田地丢荒啦！,0,0,0,2022-08-14 21:33:14,来自广西,1701666952325725,淡泊的宇宙8n4
7131702185561178894,深挖洞 广积粮真是古老的智慧,0,0,0,2022-08-14 20:07:50,来自贵州,3137619841,莫话封侯事zero0
7131723165940335399,我家今年种地了，跟我没关系[捂脸][捂脸],0,0,0,2022-08-14 21:29:46,来自湖南,66236116022,笑传醉梦中259311429
7131728413051601676,国内专家不是说我国粮食大米完全可以自给自足吗，国际粮价高，对我们有什么影响呢,0,0,0,2022-08-14 21:50:02,来自浙江,4424027589583774,独一无二的天蝎座
7131724373408858894,我觉得挺好农民有机会致富了,0,0,0,2022-08-14 21:34:09,来自江西,66384706733,旺泽天下
7131726247641711364,袁老对国家贡献了刚需,0,0,0,2022-08-14 21:41:39,来自广东,4098599796349500,淡定船帆gj
7131744048636887819,印度大米中国不吃的，不用紧张,0,0,0,2022-08-14 22:51:04,来自乌克兰,50785196092,幸福并快乐的
7131720839279756046,今年部分地方大米减产。粮食安全不可忽视。,0,0,0,2022-08-14 21:20:14,来自贵州,3273980194,Dreamcatcher10194778
7131718407921500969,今年农民种的大米亏本。,0,0,0,2022-08-14 21:10:35,来自江西,8775290413,像当年
7131724105501737763,不出口大米他们自己都穷得只剩下米,0,0,0,2022-08-14 21:32:45,来自广西,1882820055403240,丰富卡梅伦9i3
7131720244305478407,说错了能吃一百年,0,0,0,2022-08-14 21:18:03,来自山东,106061419697,梁山好汗汗
