7131694754919629608,"汽车经过百年发展，设计师在设计时已经参考了以前的事故概率，故障概率，最基本的被动安全都会考虑的机械控制，以增加可靠性。
当新兴车企在车辆设计时，可能会因为成本或者经验等原因而忽略这些东西……",0,2,1,2022-08-14 19:38:40,来自山西,6088349123,抉择GZM
7131739053778879239,充电还开空调。你这是胆子有多肥啊！逆变器过热保护性断电了。,0,0,0,2022-08-14 22:31:19,来自上海,3304855315,陨堕亚
7131736954123207458,充电时车要断电，他开着空调是自己作死,0,0,0,2022-08-14 22:22:42,来自上海,325920438879439,大虫3329
7131749290661298947,充电不能在车里的，常识问题,0,0,0,2022-08-14 23:11:34,来自广东,4345698172811336,空间混合
7131734929615962914,不建议一边充电，一边在车内休息，是否可以改成，不建议一边充电，一边使用大功率电器。,0,0,0,2022-08-14 22:14:46,来自宁夏,55334970681,阳光1468405
7131674656603915045,电瓶车就是个骗局[发怒],2,22,1,2022-08-14 18:21:35,来自新疆,4449119095,青山绿松40977968
7131752351429722917,以后真得注意了，我也有过好几次充电时，开着空调坐在车内的,0,1,0,2022-08-14 23:23:33,来自上海,50230575291,杀手锏321
7131729640388969224,应该安装一个备用电池，仅用于开门开窗，不受车内断电控制！,0,0,0,2022-08-14 21:54:25,来自广东,93055047840,秋山溪水共长天
7131674834047779620,充电站明显处都有提示[呲牙]充电时人不能呆在车内,0,1,0,2022-08-14 18:22:03,来自山东,62479472623,犀利哥178396556
7131712779392189192,呵呵，电动车车主说电车的优势就在于可以在车内开空调睡觉,0,0,0,2022-08-14 20:49:07,来自福建,75982399549,爱看评论
7131707807862407939,假如车在行驶的时候突然全车断电,0,2,0,2022-08-14 20:29:57,来自辽宁,52876519436,鸡毛换令箭
7131750057669460770,现在看新能源车这些新闻都觉得好笑，就像当年移动支付刚开始的时候，有人误操作几毛几分的小点屁事都会大肆报道，还有什么盗刷信用卡，盗刷etc等等，搞的天天看新闻的老人家总把移动支付、银行卡当做洪水猛兽，天天提醒儿女不要被骗不要上当。,0,2,1,2022-08-14 23:13:43,来自安徽,1422966184,混在白道
7131730607780348712,充电也敢做到车里,0,0,0,2022-08-14 21:57:58,来自黑龙江,4207579072,雪城DE龙
7131716026282328840,太智能也不好还是要有物理门锁好点，万一掉水里车里断电岂不成了自备的铁棺材,0,1,0,2022-08-14 21:01:40,来自上海,61886066707,寒江钓雪蓑笠孤舟
7131744115884802829,假如，司机给汽车充电，刚喝完酒在车上被锁那就尴尬了,0,0,0,2022-08-14 22:51:34,来自广西,54871722782,柯伟22
7131726313572008738,充电时，竞然敢坐在车里！这胆子也太大了,0,1,0,2022-08-14 21:41:16,来自山东,5233977312,黄海东岸
7131744627245318947,其实就是个电瓶车穿上了汽车的外衣,0,0,0,2022-08-14 22:52:30,来自北京,5511679961,木易择
7131726369428063010,不要都自动，飞机高端吧，你什么汽车都没它高端，为什么开门关门都是手动，想过吗？其实就是纯机械有时候比智能，全自动可靠。,0,1,0,2022-08-14 21:41:39,来自浙江,52960665223,欲愚156316361
7131748665345131278,充电为什么要坐在车里呢，最起码找一家咖啡店，点一杯 星巴脸 喝，吹一时空调,0,0,0,2022-08-14 23:08:49,来自安徽,101399637852,巴普唯夫
7131640417690878750,用头枕直接就破窗户了,5,12,0,2022-08-14 16:08:35,来自天津,97042481521,幺幺零870
7131704103004242722,"司机在客服指导下找到了应急开关脱困。
拜托，买了车都好好学习一下使用手册 ，最少应急开关自己要清楚啊。[看][看][看]",0,1,0,2022-08-14 20:15:02,来自四川,77681284704,TB-Z.先生
7131733830687638312,"终于知道丰田霸道，陆巡或者雷车卖的好原因，保留了汽车的基本机械按键，有的手刹还是最原始的那种，虽然看着low, 但是出毛病的机会少，现在的新能源汽车恨不得全部电子自动化，不是什么好事",0,0,0,2022-08-14 22:10:32,来自河北,63623819276,扁担弯弯1
7131728364637307652,什么牌子的车？不能用新能源来报道，因为我用的新能源车（比亚迪汉）开车门和有没有电无关，锁车状态里面的拉手拉两次就能打开,0,0,0,2022-08-14 21:49:52,来自黑龙江,3364180357,蓝色火焰12782521
7131734821377786664,不成熟的电动车！说什么新能源今天没爆炸起火！车门又开不开了！,0,0,0,2022-08-14 22:14:16,来自安徽,2432562084985502,横山细两倒斜阳
7131706647986848527,充电汽车还任重而道远,0,1,0,2022-08-14 20:25:06,来自湖南,5525896528,翻孝
7131739974101320479,估计充电时开空调，电池过热保护了。,0,0,0,2022-08-14 22:34:52,来自河南,55122022511,阿修罗0214
7131734890546610985,估计是检测到电池过热，系统自动断电保护了。,0,0,0,2022-08-14 22:14:44,来自北京,58686377520,欧欧先生
7131751652767646494,一边充电一边开空调，可能保险丝断了，就像手机边充电边使用是非常危险的,0,0,0,2022-08-14 23:20:45,来自广东,103391798331,友缘8176
7131708093414998787,过热保护自动断电？,0,0,0,2022-08-14 20:31:15,来自江西,76914582185,安可斌
7131738496636584718,有应急钥匙的，只是他平时没留意,0,0,0,2022-08-14 22:28:53,来自广东,60398977015,紫薇山茶木棉丁香
7131684839220806400,估计开空调充电负荷大充电机保护了，然后空调把电车电放完了,0,1,0,2022-08-14 19:00:37,来自江苏,351446212293565,智慧明月gm
7131733906269307660,一堆软件几个电瓶，这就是所谓的新能源汽车，一旦系统自动升级，所有程序全部停止工作，[大笑][大笑][大笑][大笑][大笑][大笑][大笑][大笑][大笑],0,0,0,2022-08-14 22:11:37,来自浙江,3645626583881708,終南山保镖
7131717032466318087,充电怎么能在车里，有较大概率会发生燃烧,0,0,0,2022-08-14 21:05:27,来自江苏,111014832118,柯南识真相
7131695953321001742,"北汽新能源马路上开着会突然自动断电没动力更可怕，检查一切没毛病，真不知道危险性，出了事故又要推三阻四了[发怒][发怒]
大家千万不要买北汽新能源[发怒][发怒]",0,0,0,2022-08-14 19:44:02,来自浙江,6900738944,卡夫666
7131739436886377216,断电不影响车门锁吧,0,0,0,2022-08-14 22:32:17,来自广西,59595986508,闲云孤鹤123
7131740111393981195,充电时可以开着车门开一点点，不要完全关上,0,0,0,2022-08-14 22:36:08,来自江西,1094744678869740,fengye9928
7131701592139170592,这是安全设计，一般来说，人坐在车里，是不能充电的，这是为了防止万一发生自燃事故人在车里发生危险，不知道为什么这辆车居然能充上电，,0,0,0,2022-08-14 20:06:08,来自浙江,5438319515,范燕青54457881
7131678400863355679,最近看到很多人在鼓吹中国的新能源汽车制造技术已经走在世界的前列了，比特斯拉还牛🐮，不知道这些人居心何在？我也只能呵呵了。,0,6,1,2022-08-14 18:36:06,来自安徽,99180648364,风姿卓越海风6b
7131675971736126223,充电的时候不要玩手机，容易断路。,0,1,0,2022-08-14 18:26:07,来自广东,52619369167,东莞小仙
7131675916409324288,车门都是电控的，不是机械的一旦发生水灾在应急逃生的话后果不堪设想！,0,3,0,2022-08-14 18:25:54,来自广东,3325391521,凉介小城
7131732266791404323,建议，只是建议，造新能源汽车的厂家，必须原厂便配备两把破窗锤。,0,0,0,2022-08-14 22:04:29,来自四川,68491578949,一指谈笑间
7131704268834243362,这么危险呐，以后充电得开着车门充了[我想静静],0,0,0,2022-08-14 20:15:37,来自天津,1072720033359646,lvLc
7131680880993010467,只有特斯拉官方是建议车主停车开空调，有条件就插着充点开空调，内部充电器会分流一部分电直接供车用，这就是技术差距,0,0,0,2022-08-14 18:45:13,来自上海,5578877802,伊瑟拉111
7131673971698942735,垃圾车害人，新能源最害人？,0,4,0,2022-08-14 18:18:19,来自广西,73842162098,开朗枫叶oG
7131651536887202601,任何车都有强制性的手动机械锁能在车内打开车门的，这是最基本的，造谣会让车厂起诉的，不然，车是无法获得合格证出厂的,0,2,0,2022-08-14 16:51:19,来自广东,54615299451,幸会2780
7131724591378678539,最好不要买新能源车，故障平发，第一容易超火，跑高速最危险，一般二手车市场不收，硬是不要。,0,0,0,2022-08-14 21:35:20,来自湖北,103962814925,一往无前面条iQ
7131706514490114831,"咱不懂新能源，难道新能源车门里面没拉手吗？
新能源也得是机械锁呀。",0,1,0,2022-08-14 20:24:26,来自山东,101928030795,三思66940
7131687519917196039,放一把这种折叠椅在车里，充电的时候，搬着凳子在旁边睡觉，安全。,0,0,0,2022-08-14 19:11:09,来自广东,6049349225,一丁木
7131698967007593231,新能源可以启动车辆充电吗？,0,0,0,2022-08-14 19:55:06,来自江西,59823709417,左手夹烟GflM
7131731116918391591,还好是断电，要是起火那就……,0,0,0,2022-08-14 22:00:40,来自湖北,75117106702,A星河闪耀lll
7131727429886198563,充电时动力电池不工作，只有小电瓶工作，居然可以使用电空调，可以说这是厂家的设计问题。,0,0,0,2022-08-14 21:45:40,来自黑龙江,5471427628,潇洒北纬47
7131755324063286051,新能源肯定可以边冲电边来空调啊，不能的车都是垃圾电控，不用考虑。,0,0,0,2022-08-14 23:34:41,来自广东,3379755992,芝麻琐事
7131756045357695785,充电的时间可以打开空调吗？,0,0,0,2022-08-14 23:37:31,来自山东,60333244069,不戒温柔
7131734835580273449,就连手机现在都是充电使用两不误，充电同时，旁路正常供电，何来影响电池一说？,0,0,0,2022-08-14 22:14:31,来自辽宁,109933982433,用户丢失数据
7131678993975247620,电车充电还敢睡里面！真是想要命了,0,1,0,2022-08-14 18:38:36,来自北京,4286738002,丑爆了
7131747252103775009,我一直觉得车门电子锁是个非常不安全的配置。要在紧急情况下能手动打开,0,0,0,2022-08-14 23:03:50,来自浙江,51248112615,梦在飞的蜗牛
7131707171473687296,电动车窗还不如手摇的，开进河里你都有一线生机。,0,1,0,2022-08-14 20:27:06,来自辽宁,3100265539175422,繁华尽在浮云中
7131736541927506721,特斯拉有手动开门装备,0,0,0,2022-08-14 22:21:53,来自北京,64635444581,动漫731
7131703750372393768,新能源汽车技术根本就不成熟，电池也是最大的污染,0,5,1,2022-08-14 20:13:45,来自江苏,110951392975,文昌中路
7131624375501423400,汽车工业发展了上百年，全电汽车发展了多久,11,18,3,2022-08-14 15:05:55,来自陕西,5779986099,潇看天色暮看云
7131733599640535844,充电没用电快！就死机了。,0,0,0,2022-08-14 22:10:07,来自四川,111580187423,路人乙和丙
7131733019295662882,新能源是好，省油钱。就是把自己的生命交给软件程序有点不放心。,0,0,0,2022-08-14 22:07:24,来自江苏,56038657204,猫和咖啡
7131737905222910755,车子驾驶室这边完成可以做回手摇的没电 落水 紧急时可以,0,0,0,2022-08-14 22:26:15,来自江西,93876634087,虎啸神州--欢乐行户外
7131717798933480195,电动汽车不能叫新能源车吧,0,0,0,2022-08-14 21:08:44,来自山东,110660532293,瓜皮201911
7131738689017398019,小心新能源汽车集体找你打官司！你们是啥媒体？（参考海南[捂脸]）,0,0,0,2022-08-14 22:30:18,来自四川,2827540669671244,伟66625
7131734675571688228,怎么都不放把破窗锤或者救生锤在车里的？,0,0,0,2022-08-14 22:14:24,来自江苏,1367393392394996,东隅已逝桑榆非晚吗
7131719607878599439,充电要是爆炸怎么办,0,0,0,2022-08-14 21:15:15,来自广东,103550942400,沙阳光城
7131676098357936908,什么车车内无法机械开门？太危险了,0,0,0,2022-08-14 18:27:12,来自山东,53463836092,fzmy
7131739523020964616,充电不能坐车里的吧！,0,0,0,2022-08-14 22:33:18,来自河南,55122022511,阿修罗0214
7131737508450206464,新能源啊！哈哈哈，就是一个电瓶车!,0,0,0,2022-08-14 22:24:37,来自甘肃,100986740963,马文东360
7131700427757765406,是新能源，就是个电动车，难听点：棺材车！,0,0,0,2022-08-14 20:01:08,来自浙江,104916827493,观山指迷256
7131685885921559331,国家应该出车规，禁止车辆使用电动、隐藏车门开关,0,0,0,2022-08-14 19:04:27,来自云南,86040094337,想回家的流云
7131678017902068516,充电时用大功率空调，本身就危险。,0,0,0,2022-08-14 18:34:25,来自山西,70907743516,阳光223983272
7131678205538812687,如果着火，就变成烤猪了，能源车技术还不成熟,0,0,0,2022-08-14 18:34:47,来自海南,21887874354,喜欢英鎊
7131717097888940841,新能源充电的时候必须把窗户打开,0,0,0,2022-08-14 21:05:25,来自海南,6016148220,河南硬汉
7131742379686216455,打客服找到应急开关。说明车辆还是有应急设计的，车主可能在拿到车后没有详细了解车辆。,0,0,0,2022-08-14 22:44:24,来自福建,106703928002,mtiger66
7131699777800160015,车辆车门内锁设计有问题，这个有安全隐患故障的车是怎么通过安检测试的！,0,0,0,2022-08-14 19:58:13,来自广东,52326944089,自由的阳光YYZ
7131721303320970021,车门开关一定要是机械手动的，如果只有电动没有手动开关门那就是忽悠人的。,0,0,0,2022-08-14 21:22:14,来自湖北,2506495100454767,豁达的功夫熊猫
7131681398917792543,这还是不明原因，如果车载电脑被黑，主动车门锁死，全封闭开冷热空调，就能谋杀。别跟我说不可能啊！,0,2,0,2022-08-14 18:47:28,来自浙江,55070828537,村東头吴老七
7131705226071032606,车头里面的启动电瓶没有电了,0,0,0,2022-08-14 20:19:41,来自山东,7009698081,依山傍水看彩虹
7131716654488601374,新能源汽车质量还是有点不过关，看来还是不能买,0,1,0,2022-08-14 21:04:09,来自河北,52925533208,孟建芳
7131720515681141537,下次实在要休息，车门垫一下，留条缝隙即可无恙,0,0,0,2022-08-14 21:19:36,,6120158860,星星之火80100379
7131709413840585475,下雨天充电怎么办,0,0,0,2022-08-14 20:36:29,来自浙江,104813601578,霁晓岚
7131712368832267019,我经常在充电时在车内开空调，看来以后不能这样干了，最起码应该把门压着一个缝隙，避免被锁死在里面了,0,0,0,2022-08-14 20:47:37,来自安徽,56706786408,fonde
7131654926270808832,着火断电打不开车就恐怖了,0,1,0,2022-08-14 17:04:35,来自广东,100019490866,宇宙9289
7131753322763240223,还好是深夜，是中午就玩完了，警察没来已经中暑了,0,0,0,2022-08-14 23:27:02,来自广东,3424143464,江湖已有我的传说
7131703446956802850,是那个专家想出来叫新能源不就是电动车吗,0,0,0,2022-08-14 20:12:38,来自浙江,50348343922,飞哥7T9O
7131725719088349966,胆肥哦！充电还坐里面。,0,0,0,2022-08-14 21:39:25,来自广西,720915779553136,广西东春
7131742328461132544,不就是电动车吗？什么新能源,0,0,0,2022-08-14 22:43:46,来自陕西,64265416767,F1197146610
7131670902026797863,就一电瓶四轮车，非要说新能源汽车[我想静静][我想静静][我想静静],0,1,0,2022-08-14 18:07:32,来自广西,108975964650,陆地霸王应运而生
7131677000083325703,不是特斯拉，车门有窗框的，国产电(混)动车，锂电池不能一边充一边用的，过热保护了,0,1,0,2022-08-14 18:30:37,来自广西,51164238793,LeonKKK
7131679508700562210,这个故障是车机系统故障还是电池故障？车机系统故障和电池故障是一回事吗？油车有没有车机系统？这三个问题搞清楚了再来评论吧。,0,1,0,2022-08-14 18:39:45,来自陕西,487789730729261,笑揽风云淡
7131750359307305741,油车加油的时候，是不是也要求人下车？为什么，肯定是以前出过问题，大家都这么遵守了就觉得没有问题了。但是换成充电，人在车里出了问题，就变成了车的问题，为什么其他人不出这样的问题呢？,0,0,0,2022-08-14 23:15:42,来自四川,3548814822876076,tt也是tx一样的lm
7131698821998150412,特斯拉断电也有手动打开装置呀,0,0,0,2022-08-14 19:55:22,来自湖南,1059573091274131,聪明的帆船D1
7131695999743673092,好像电动车在充电的时候。最好不要发动.开空调更不合适。,0,0,0,2022-08-14 19:44:32,来自安徽,104813022500,小品小品您好
7131643417158877992,看不清这是什么牌子的车啊,12,21,1,2022-08-14 16:19:40,来自江苏,2022702759282429,三级喂鱼大师
7131636033925726983,这电器故障了轻松要人命,0,21,0,2022-08-14 15:51:29,来自湖北,2299833060165374,1精灵哥1
7131744012666798879,本来一个手机己把人绑架得无处喘息，再买一个所谓的智能电动汽车这估计窒息的感觉都有了,0,0,0,2022-08-14 22:50:38,来自江西,8592880936,淪落在风中的雨
7131636614686098217,新技术刚开始的时候肯定有瑕疵，必须要一些财力充足的人来试用，发现问题就改进，等到技术成熟成本降低时，就开始占据市场了。该经历的过程必须要经历，搞技术不可能一步登天的。现在电动车大力宣传，这也是没办法，否则没人会去买，没人买就发现不了技术问题，技术就永远成熟不了。,0,1,0,2022-08-14 15:53:22,,59018321244,同胞加油中国万岁
7131735177919316775,电动汽车一旦着火那就是一两秒钟全车爆燃，绝没有逃生机会！这个最大的安全隐患应该如何解决？,0,0,0,2022-08-14 22:16:35,来自广东,60699974309,山野171003145
7131735741298213663,新能源充电车我觉得就是个坑。,0,0,0,2022-08-14 22:18:26,来自陕西,51665186243,追风
7131687380796310283,电气故障很正常，谁经历过凌晨两三点，在乡村路上后车窗不受控制，自己一会降下一会又升起来来回回的，就像后排坐了人一样[捂脸],0,0,0,2022-08-14 19:10:53,来自宁夏,104477971735,马俊260
7131685991286702851,为什么这么多车没有电就打不开车门？！是设计师觉得这样很酷吗？[翻白眼],0,1,0,2022-08-14 19:05:36,来自河北,72173476028,哎呀242426859
7131746404992877320,肯定不是特斯拉，不然标题就是特斯拉断电车主被困。众所周知，电车就两种，一种是新能源车，一种是特斯拉,0,0,0,2022-08-14 23:00:09,来自天津,58945414369,悠闲的玩胯子弟
7131757536990659341,全车断电是安全防护吗？是为了以免充电期间漏电跑电，车开走了拉断电线？,0,0,0,2022-08-14 23:44:16,来自辽宁,5725623991,广林呈祥
7131694242740634402,一辆四轮电瓶车，说是新能源，从那里来的新能源，把电瓶拿掉，看看它的新能源能不能动，一种十几年前就是电瓶车，到现在也没有改进过。,0,0,0,2022-08-14 19:36:44,来自浙江,99606465717,建荣28844
7131673277503734543,充电的时候还启动车在里面睡觉，真牛,0,0,0,2022-08-14 18:15:30,来自广东,443857416240295,二娃子到
7131716693613298473,断电落锁。。。。,0,0,0,2022-08-14 21:04:05,来自广东,1852024423988383,Lucky me李
7131636308547519236,智能汽车，各种程序，发生意外情况太多了。做软件那帮程序员和产品都是垃圾居多，难免有bug,0,12,2,2022-08-14 15:52:49,来自江苏,6367597326,大师双城记
7131746198817506059,所有电车都有机械开锁的，这个人居然不知道,0,0,0,2022-08-14 22:59:37,来自新疆,4296524368972440,快乐侠士DW
7131702175243256579,这家伙不是公交驾驶员，是联合收割机驾驶员，因为公交驾驶员都知道应急开关，否则只能是收割（遇到危险，只能收割旅客生命）机骂驶员[流泪][流泪][流泪][捂脸][捂脸][捂脸],0,0,0,2022-08-14 20:08:02,来自安徽,50022608917,智慧的甜瓜
7131749485726286629,在车内还打不来车门？只有囚车才是这个设计！,0,0,0,2022-08-14 23:12:22,来自湖南,5147385165,望乡49924542
7131687716618027806,真心佩服那些电池车主，心不是一般的大,0,0,0,2022-08-14 19:12:08,来自广东,64223804330,打狗棒20188102
7131712244882768655,充电时本来就要锁车,0,0,0,2022-08-14 20:46:45,来自广东,382218760108275,楚天笑红尘
7131758919823213324,要休息也不能全封闭阿起码玻璃门下降一个吧，,0,0,0,2022-08-14 23:49:55,来自广东,975969287145292,五哥大林木
7131683220034618123,车辆熄火车门锁不是自动打开的吗,0,0,0,2022-08-14 18:54:59,来自广东,3126648112680648,网约车现状
7131734763764777758,买新能源车省钱啊,0,0,0,2022-08-14 22:14:31,来自安徽,5352307918,真的Y假的N
7131638928406512398,智能，就决定了智能上锁，也可能智能着火,0,4,1,2022-08-14 16:02:50,来自辽宁,106874757330,Yan2419
7131682367043191567,电动车就电动车，叫啥新能源。新能源门槛这么低吗,0,2,0,2022-08-14 18:50:56,来自浙江,6099751434,西瓜太浪a
7131681209092358923,新能源汽车真坑爹呀，建议大家不要买，不要贪图小便宜，命没了你就知道厉害了,0,0,0,2022-08-14 18:47:09,来自安徽,80127266295,端庄白云FR
7131655212880052992,新能源车除充电便宜，其他没什么优势,0,1,0,2022-08-14 17:05:40,来自江苏,106679213319,亥有福
7131688214443590413,在充电，还开空调[微笑][微笑]小电瓶给整没电了[微笑][微笑],0,0,0,2022-08-14 19:13:38,来自广东,68822369370,傲娇二狗子
7131687829406532392,车为什么不设计为断电解锁车内为机械开门？,0,1,0,2022-08-14 19:11:54,来自广西,5520611953,綂玽
7131729883516502822,设计缺陷，[抠鼻]如果车内有人，就不应该落锁,0,0,0,2022-08-14 21:56:06,来自福建,85502103711,刘草
7131657004288033570,电池汽车用户-1,0,10,0,2022-08-14 17:12:26,来自广东,2085129202703528,宫平正义999
7131627158593618688,车门都打不开，只能说这车是玩具，又一个简单的问题复杂化。,0,10,0,2022-08-14 15:16:38,来自湖南,6691117316,华华105772931
7131715063357899533,不能坐车里，在外面蒸着桑拿充着电,1,1,0,2022-08-14 20:57:47,来自江西,93483562600,车友汇60
7131664714001908513,充电期间最危险，燃烧起来怎么办？烧死在车里？心真大。,0,1,0,2022-08-14 17:43:22,来自四川,62911521401,老朋友229859571
7131736782613594914,一边充电一边玩手机习惯了。,0,0,0,2022-08-14 22:22:00,来自广东,1033129480174334,掘柑掘桔掘柑桔
7131747679855592233,新能源汽车就是鸡肋,0,0,0,2022-08-14 23:04:26,来自浙江,52863017708,为有暗香来23
7131746129582162699,电瓶车和新能源车概念不要混淆了。,0,0,0,2022-08-14 22:59:05,来自贵州,108383565420,中忠27
7131703210896704293,电动车不是新能源车,0,0,0,2022-08-14 20:11:54,来自广东,4407775769,醉清风40232910
7131689130312287012,充电可以在车内休息 但是车门不要关严 有什么情况可以随时下车,0,0,0,2022-08-14 19:17:33,来自广东,3973262797,听雨30863796
7131703637008548623,怎么没有电车车主出来说一下了！,0,0,0,2022-08-14 20:13:08,来自广西,4067832411456349,与时间相伴
7131682231022174988,不符合安全设计，这个得退车，车必须具备机械开门能力，这个竟然没有机械开门机构。事故后烧死可能性大,0,3,0,2022-08-14 18:51:07,来自重庆,1253098502763579,进取白云6Z
7131630473180119849,作为新能源动力锂电池行业的“业内人士”，特别转发此充分且必要的温馨提示。,0,1,0,2022-08-14 15:32:41,,95932436966,壹叶
7131708132719346447,这种新能源车白送给我也不敢要了，要了命的,0,0,0,2022-08-14 20:30:37,来自浙江,54579507509,最爱187505200
7131673148483322631,我的SUV尾门有个机械拉绳，打开尾门上有个小盖子，拉绳子，车门就打开了。,0,1,0,2022-08-14 18:15:41,来自云南,94163820104,runband
7131678820532847368,充电好多着火的，要是打不开车门会死人的,0,0,0,2022-08-14 18:37:37,来自山东,1050759877894307,财经知微
7131673709827523367,中国大专家确定了电动车要用脚蹬子，为什么没有确定汽车必须能从内向外开门。,0,1,0,2022-08-14 18:17:50,来自江西,2799626491,椰风绕指柔
7131730293844935439,电动车就是电动车和新能源，没有半毛钱关系呀,0,0,0,2022-08-14 21:56:44,来自河南,6257454360,军旅铸就
7131700410410828555,电控锁一定要有一个应急的机械开关，安全设计不过关,0,0,0,2022-08-14 20:01:29,来自浙江,1818292576,翱翔的神鹰
7131639564212880128,有过几回，人离开车后，自动落锁，不知道是否跟钥匙不在车里，传感器感应不到有关系？,0,1,1,2022-08-14 16:04:48,来自北京,59259164624,近山远水43911
7131711354155090718,吉利300，电池包过热息火了，长事，这个车子就是这样的！,0,0,0,2022-08-14 20:43:39,来自甘肃,53407170234,说好晴天的海59
7131746369777812265,能源车不能要,0,0,0,2022-08-14 22:59:30,来自山西,2308593424018334,低碳日化品
7131698434972582667,电动车[捂脸][捂脸][捂脸]为什么老是说新能源,0,1,0,2022-08-14 19:53:30,来自广东,104558381193,命有躲不过
7131676941878608677,汽油车要钱，新能源要命。,0,0,0,2022-08-14 18:30:17,来自北京,10577721625,杂烩一箩筐
7131711214823949094,我想知道，这是什么品牌的电动汽车🚗[灵光一闪],0,1,0,2022-08-14 20:43:02,来自江苏,61606844506,朱氏百年酱肉
7131634223815131936,没有起火都是万幸，还睡车里,0,3,0,2022-08-14 15:45:02,来自浙江,3197010117408957,高级熊猫gv
