7131663699060425483,上周刚经历过一次充电时坐车内，突发黑屏和车闭锁，原来是我家那位手欠的远程给我上锁了[石化],12,15,0,2022-08-14 17:39:34,来自广东,84392091804,Ashelyy
7131737985628013353,钥匙在车内也打不开吗？,1,0,0,2022-08-14 22:26:43,来自江苏,5778599722,蜕变64476997
7131670890462692131,充电还敢坐车里啊？[石化],34,191,1,2022-08-14 18:06:23,来自湖北,104291553549,囧兔子玖仟
7131654805285995302,充电桩提示不要坐车里充电,16,131,0,2022-08-14 17:04:49,来自福建,67933512230,福州小翁
7131662051202024195,这只是断电热一点而已！如果是短路起火了！那后果不堪设想啊！,22,303,4,2022-08-14 17:33:02,来自河北,2097509539259758,一路向阳100200
7131654418239931149,"三厢车车内被锁最简单的逃生方式就是爬到后排翻下后排座椅靠背进入后备箱，在后备箱边上有一个应急拉索扣，拉一下后备箱打开就可以爬出来了。
整个过程不超过二十秒。如果是SUV那就更快了。",80,79,3,2022-08-14 17:02:57,来自四川,4308333407,东方已晓
7131673883228373800,冬天在北方零下二十多度，不在车内取暖，如何办好？,5,0,1,2022-08-14 18:17:49,来自新疆,66000191560,风铃199508737
7131747365207212811,开了很多年德系车，高配版功能齐全的那种，后面大约8年左右俩个车都烧机油厉害！因为有个车还是原装进口的，维修保养费用很高，重点是后期问题特别多，经常会有不同的问题冒出来，现在也不修了，买了一个便宜车车代步，省油耐磨售后成本低。总结下，就是不要买功能太齐全的车车，容易坏，不好修。维修成本高。,24,29,4,2022-08-14 23:04:04,来自四川,50939051515,平常心178069747
7131713664964412193,油车没被外力暴力撞坏门的情况下，人在车内没钥匙也一定能打开门。主驾驶一定是能打开的，如果真的万一打不开（比如车贴着墙停着），后排座椅可以手动放倒，尾箱里面有个拉手可以把落锁的后备箱从里面打开，我就这么干过[捂脸],33,72,12,2022-08-14 20:52:32,来自上海,92885036340,南通和我的爱
7131669312519553799,我弟弟的车（汽油车）不知道什么毛病，上个月暴雨路面积水，他开车过去，水淹过车底了，然后所有车窗全打开了，怎么也关不上，外面大雨[捂脸][捂脸][捂脸]就这样开了20分钟。我想，如果那些掉河里的车有这功能，应该有很大可能被救。,52,214,25,2022-08-14 18:00:43,来自河北,3323676014,summer11398051
7131679573964210981,你见过在长安街手欠按了一下升级，车停哪里不动开不开门，几个便衣围上来的事情么,18,55,4,2022-08-14 18:40:34,来自福建,184338017686840,勇敢的面条5Y
7131677925719819042,都是用的电瓶，两轮的就是电动车，各种限制打压，四轮的就成了“新能源”车，各种表扬维护,9,161,0,2022-08-14 18:33:40,来自内蒙古,6683331096,蓝天无云DFZR
7131623140677419791,曝光吧，什么品牌车？,143,542,27,2022-08-14 15:01:05,来自江苏,2242647179398894,阿汤哥和皮皮妞
7131610289208541956,车门不是机械控制的吗?,14,5,0,2022-08-14 14:12:15,来自山东,58882237355,落花情a
7131731709988586255,"啥！没有机械解锁办法吗？使用说明书不看吗？
车辆充电时突然断电，肯定是故障，但肯定有机械解锁办法，这个司机肯定没有看说明书！我建议，买车后，一定要阅读并理解车辆说明书！不然闹出这种危及自己安全带事件！",0,7,0,2022-08-14 22:02:11,来自上海,1121130170026931,浪浪呀
7131569738467296007,车内打不开门？,3,12,0,2022-08-14 11:34:09,来自广东,59610166023,蒸汽大妞
7131678015419220775,车门不是机械锁？,2,9,0,2022-08-14 18:34:48,来自广西,100803581315693,浦志高1970
7131646883206497065,充电坐车里面?我从来就不敢坐，不管什么品牌。,2,16,0,2022-08-14 16:33:19,来自广西,60676195165,韋覃羽陽
7131655340998968077,充电车，逃生系统应该改进了,2,9,0,2022-08-14 17:06:31,来自四川,108371943044,牧马人19832016
7131638493993894693,肯定不是特斯拉，要是特斯拉恨不得指着鼻子说,60,236,11,2022-08-14 16:01:05,来自江西,2985881370102046,容楚州
7131661617930535718,前一段时间搭亲戚车回老家，因为长途几次停靠服务站给车子充电，当时他们带了个刚满周岁的小孩，不是要睡觉就是满服务站跑，就这情况都不敢在充电时呆车里。,9,55,10,2022-08-14 17:31:24,来自四川,6704847439,就要这般
7131673664281903906,充电时还开着空调，燃油车熄火了也不能开空调吧，😂😂,3,2,0,2022-08-14 18:17:08,来自新疆,6539381403,可爱的热心小猫
7131634924293276453,像这样新能源汽车一旦掉入河中会不会断电自动锁车门？如果也会的话，是不是一旦掉入河中，乘客会不会困死在车中？,26,107,4,2022-08-14 15:47:09,来自河南,4579324238,老李铁
7131733158039126816,一般的就是全车断电，从里面也可以打开车门，不知道他开的是的什么车？！[灵光一闪],1,0,0,2022-08-14 22:08:53,来自河北,108162584371,勇敢的钢笔Xs
7131631135980847886,很多电车的人说坐车上充电吹空调一个爽，真不怕冰火两重天？,6,28,1,2022-08-14 15:32:20,来自广东,96457991954,拜丁崇拜拉丁
7131632670807278372,这要着火不活活烧死在里面，后果不堪设想,7,109,1,2022-08-14 15:38:37,来自广东,5758217948,微笑橘子J
7131677744638903048,我的标致不管有没有电，在里面都能直接打开，锁不住里面的人。,3,2,0,2022-08-14 18:33:16,来自湖北,102511392747,没什么好说的88
7131692239730426637,汽车，不论是燃油还是电动车那这个自动化并非都是好事，车门高速落锁是好的，可是断电就落锁打不开岂不是杀人？汽车出现交通事故很普遍，都打不开锁岂不是帮倒忙？徒增死亡机会么？这样的自动化有啥好值得拥有的？,4,43,1,2022-08-14 19:29:38,来自河北,54568089840,一只来自北方的母狼
7131625772250972936,就一电动车，还新能源，电池后期处理好像很麻烦的，燃油车，油贵就少开点，没有那么多担心。,10,110,2,2022-08-14 15:11:52,来自湖南,105014188192,梦回西藏彬
7131661376431080226,实在信不过新能源汽车，觉得就是一个定时炸弹,3,34,3,2022-08-14 17:29:37,来自江苏,50674317524,云彩静好
7131699561189671716,车上所有用电设备都是用一只12V电瓶供电的，这个跟油车一样，大电池负责给车辆提供动力，和给小电瓶充电，当车辆正在充电时，大电池就不会给小电瓶充电了，你睡在车里开着空调，小电瓶很快没电，车辆断电，当然那些需要用电开启的功能就无法实现了,8,28,3,2022-08-14 19:57:50,来自江苏,3402388016,李大神5
7131713814303277832,新能源车充电时，不赞成人在车里吹空调。因为夏天气温高，电池容易发烫，如果开着空调，那更要发烫的。散热问题一下子就被放大了。有一定的危险性。但是，很多车主条件所限，出门在外充电时，无处可去，气温又高，边充电边吹空调都是常规操作。怎么办？希望厂家把安全性放在极高的位置来看待。汽车毕竟是为人服务的，安全上要做到极其严格，那是必须的。,1,13,1,2022-08-14 20:53:19,来自上海,413057750668503,乐观的柑桔fU
7131625478338790176,你见过在长安街手欠按了一下升级，车停哪里不动开不开门，几个便衣围上来的事情么,48,191,13,2022-08-14 15:10:53,来自北京,81329689028,国宝会说话
7131640319455691531,比亚迪，我们的诉求是无条件换车。我们的比亚迪Plus ev出行版新车存在一修就坏，屡修不好，在滴滴平台接单送乘客行驶中突发无法行驶，无法把乘客送达目的地，存在安全隐患。,4,2,1,2022-08-14 16:08:26,来自广西,831705704045083,小风
7131701141292827404,反正不认可充电车，还是觉得燃油车好！,0,11,0,2022-08-14 20:04:09,来自陕西,52839598630,燃烧的荆棘11208
7131641130529161999,万一电话打不通，别人又发现不了，又打不门,130,218,21,2022-08-14 16:10:48,来自湖南,3328960764583196,远见卓识饺子Z
7131636521358132009,新能源车建议要有两套供电系统，一套低压供各种服务类，另一套专供动力系统，充电时自动切断主电源仅专一充电！低压供电不停不受影响使用[捂脸][捂脸],8,31,0,2022-08-14 15:52:55,来自江苏,109334777196,爷已不是当年的哥
7131630578260230920,电车有一个严重弊端：不管是行驶中碰撞、自燃，还是驻车充电电控故障，都会自动落锁，车主无法车内打开逃生……这算不算很恐怖？,95,279,18,2022-08-14 15:30:23,来自山东,6739025605,最美乡村中国行
7131651025303487272,"不是所有东西智能化就是好的，可以智能化，至少要保留一个机械的逃命开关。
汽车发生碰撞达到一定的等级，四扇车门就应该自动脱落。
发生火灾车内到某个程度也是四门自动脱落。",3,23,1,2022-08-14 16:49:13,来自江西,2238233302810455,wxp7788
7131650439497712392,如果此时电池起火？,12,20,1,2022-08-14 16:47:24,来自湖北,3546489110,斯棱莫斯克
7131634690343535364,电池就是一过渡能源。希望国内不要跑偏。,5,20,1,2022-08-14 15:46:57,来自辽宁,52543615629,就这么决定了
7131635420319826722,电动车都有手动开关,4,7,2,2022-08-14 15:48:39,来自广东,4486462108343470,非常规手
7131668572853879565,我的雪佛来迈锐宝小车，一直有个困惑，后备箱盖没有锁孔，只有一个按钮，万一路上全车断电，想去后备箱拿工具，三角架怎么开后备箱？,2,3,1,2022-08-14 17:57:41,来自上海,4037029228198567,姜不老不辣zx
7131731765110375207,"什么车应该曝光给企业压力。给消费者买的放心。媒体的责任就是公开对的起大众。让大家知道真相而不是猜谜语。
如果下车再有个同样类似的事情发生。车主如果没有这位这么幸运怎么办。害了谁的孩子谁的父亲。",0,0,0,2022-08-14 22:03:05,来自广东,103020192457,王兴8058
7131666618199130920,车头不是比亚迪,5,13,0,2022-08-14 17:49:41,来自山东,1372607735924413,滑动青春
7131634903070524160,我最近在出租汽车公司站夜班警卫，来充电的车，驾驶员都是把四个门大开着，躺在车上休息，等待充电，我只以为是为了通风，这下明白了，是为了安全，以防万一。,5,64,6,2022-08-14 15:46:49,来自新疆,50533315516,MM爷
7131742248861532940,主驾位都有机械应急开门的机械锁啊，司机没看手册吧,1,0,1,2022-08-14 22:44:16,来自浙江,99881996916,自在小梦
7131661674935059231,买电车天天说自己的车充20块可以跑三四百公里,5,35,0,2022-08-14 17:30:56,来自广东,3808313010298288,飘游四海AD
7131641158027346723,掉进河里车门打不开，那就死定了。,10,69,1,2022-08-14 16:11:02,来自四川,4199771537151555,阿明am2
7131663721885811456,打死都不买电动车，现阶段最好的就是混动车，油电混动！,3,18,1,2022-08-14 17:38:45,来自山东,2326196387850055,情义山东欢迎你
7131664433419846433,非新能源车也有人被锁车里的状况，何必单单指责新能源车,5,6,4,2022-08-14 17:42:16,来自天津,4142549760745534,亦茶笛安
7131718923401036574,一边充电一边躺在车里吹空调，这是很多新能源车主自以为豪的用车体验，他们说，反正高速上开长途总是要进服务区休息的，我一边休息一边就把电冲了，一举两得，羡慕死你们[捂脸],0,1,0,2022-08-14 21:12:49,来自山东,6712654343,夏雨飞翔
7131654433507328804,网上视频不是有充电的时候，几秒钟就把车子烧成壳了。他的心怎么这么大，还在车里休息。,7,14,1,2022-08-14 17:03:10,来自浙江,56051315144,家后西岩山
7131627802490651428,文中有网友说充电的时候提示不要在车里，那如果是在高速服务区，疫情原因又不能或不想进入服务区休息区，那司乘人员该怎么办？明明是车辆设计有缺陷，非要归罪到司乘人员身上。,21,174,7,2022-08-14 15:19:30,来自河南,62537729537,豫见老家
7131723490448704271,都电子化真的不行，必须标配手动车门手刹车窗。,0,4,0,2022-08-14 21:30:15,来自河南,4732019142,河南的一名普通教师
7131575866378830596,这样车应该建议什么时候到不可以在车里,3,2,0,2022-08-14 11:58:17,来自安徽,57807231774,无双鲸鱼k2
7131723436182946571,"电动汽车忌讳用隐形把手，出了事故往往里外都打不开出门，太危险了！
林志颖的特斯拉碰撞失火后，要不是路人解救得快，恐怕早就挂了。",0,3,0,2022-08-14 21:30:40,来自天津,82223113243,闻伯智库
7131730923619369768,搞笑！世界之大，无奇不有！本人今年六十岁了，91年拿的驾照。从141带挂，到十几米的半挂。15年退休，买了轿车休闲旅游，20年又换了一个品牌的电动轿车。说实话，这些年来，不管开什么车，怎么开，从来没有出现什么这问题那问题。,3,6,2,2022-08-14 21:59:09,来自江苏,5830849007,中国豆腐村
7131635180128928527,估计是特斯拉，车门有隐藏机械拉手,3,9,1,2022-08-14 15:47:50,来自辽宁,98183488628,达里尼浩哥
7131647688809988864,不管什么车安全逃生设计必须要列入强制标准，要有机械开门设计，并且要在明显位置方便操作。我开过的电车，前门找半天才找到机械开门，后门到现在还没找到，外把手内藏设计，万一起火断电不知咋办了，所以不敢买电车。,1,27,3,2022-08-14 16:36:17,来自广东,1267080203606095,xman593200
7131691648651707147,新能源车主又一次敲响警钟！江苏一新能源车主在车里变充电边休息，突然全车断电被锁车内！,0,3,0,2022-08-14 19:27:17,来自重庆,72309862955,重庆刚刚
7131738217271149327,所以我们这边的充电站都有写着充电时不得在车内停留,0,0,0,2022-08-14 22:27:33,来自广东,3598718812,卡諾
7131661235992675113,确实有道理！应该🈶应急的手动开关！,0,14,0,2022-08-14 17:28:51,来自江西,3503527281,天下人关注天下事
7131686100002931494,经常有新能源的车主在炫耀，说我充电的时候坐在车里吹着空调看电影玩游戏，太香了！但如果碰到下面这种情况你还能开心起来吗？,0,1,0,2022-08-14 19:06:00,来自重庆,72309862955,重庆刚刚
7131638796537692966,我的车一旦断电，所有窗口玻璃自动打开，连天窗都开。奇怪的很，断电了哪来的电打开玻璃？,16,11,6,2022-08-14 16:02:43,来自福建,50938284318,苦皮铜骨
7131694636589908747,世界上没有百分之百可靠的事。充电不允许呆在车内属于不合理要求。这如果遇到没地方可呆呢？不呆车里呆哪？电子产品不可能百分之百不出故障。车内应该有应急脱困设施。包括自动驾驶功能，也应该有一套不依赖电子系统的人工接管手段。高风险产品应立足于“不可靠”的假设下做好预防措施。,2,6,2,2022-08-14 19:38:51,来自湖南,2692072779556780,执着的旭日RF
7131638804988986149,不管人在不在车内充电，我觉得车内应该有应急开门措施，并且在明显的位置。,0,9,1,2022-08-14 16:02:16,来自上海,92328981283,智珉同学
7131656372575486731,日本的林克萨斯油车，高速路上起火落锁打不开，救人都救不了，人活活烧死，100多万的油车！,5,17,1,2022-08-14 17:10:42,来自海南,5169285324,喜庆的生活家ci
7131627434629628709,越复杂越先进的玩意越容易故障，天宫的链接门到现在都是需要个大扳手手动机械开关！,10,87,4,2022-08-14 15:18:18,来自陕西,6060448550,嘿嘿77701784
7131656256087360268,这么热的天在车里不打开车窗吗？,5,2,1,2022-08-14 17:10:26,来自山东,60998618767,瑞禾苑
7131644744149173026,电动车的技术目前还真需要完善：刹车失灵、高速行驶中主机死机、电池燃爆、充电拔不出来枪、电池的续航里程、电车越是没电满世界找充电桩、电车跑长途既担心找不着充电桩又担心电瓶缺电，造成油门不敢踩空调不敢开的尴尬[捂脸],0,14,1,2022-08-14 16:25:01,来自江苏,4183016204,野津垂钓
7131728343779164968,新能源车还是有点不放心,0,1,0,2022-08-14 21:49:17,来自辽宁,5528480568,兔吃青青草
7131631376646472482,设计问题，车门除了电控应该有应急机械控制开门,11,43,5,2022-08-14 15:33:11,来自广东,3748273064,您输入的角色名已存在
7131681163768513318,门凭什么开不了？,2,8,0,2022-08-14 18:46:58,来自广东,93803480777,看你怎么说
7131726543491433255,车门应该断电自动恢复手动开锁，这个功能应该不难实现。智能化程度太高毫无必要。智能汽车和手机电脑一样，总有死机的时候。不能控制机器是最恐怖的。,0,7,2,2022-08-14 21:42:57,来自吉林,782469913394830,关中散客启慧数学
7131690162479792931,"现在所谓新能源车贵，根本不是贵在电池和车身上，而是里面花里胡巧的东西。比如全尺寸屏幕，智能管家，自动驾驶。。。。
比如一个大屏幕就好几万。按1/4大小的安卓平板估计5000来计算。
上次商城看到一部国产新能源车，外面看上去也就10万的样子，一问25万，然后一摸座椅，人造革的[抠鼻]。
我想万一系统死机，汽车还能停车吗？还能打开车门吗？
别说现在现在系统流畅，3年后随着系统升级，机器就会卡了。",1,7,1,2022-08-14 19:20:54,来自江苏,55028768786,无意义名字
7131631317061616414,新能源车有一个使用上的“警告”：充电时间内车主不得在车里……如果天气很热或很冷，充电期间让车主去哪里待着？,5,7,2,2022-08-14 15:33:08,来自山东,6739025605,最美乡村中国行
7131676775142540062,反正我不喜欢电动车。,0,24,0,2022-08-14 18:29:37,来自贵州,7528847076,边走边拍的莉
7131632897681179400,新能源车有问题啊，充电人不能在车里 ，人家开车累了，难道还不能在充电的时候休息休息吗，本人认为是电单车厂家对于充电时的设计有问题，假如拿出3—4度电的容量电池单独在充电时供电给车用空调，电脑，显示屏等供电，人在车里不是很舒服吗,3,9,5,2022-08-14 15:39:26,来自云南,108305968252,风景在哪里看
7131648273274307361,基本断定特斯拉，特斯拉是电子锁，没有机械锁，起码比亚迪有机械锁，我去买车看特斯拉，特斯拉我去试车就想过这个问题,3,16,2,2022-08-14 16:39:36,来自河南,3751229562,AA水之源
7131698079811912488,充电时不能坐车内是规定。黑谁,5,1,0,2022-08-14 19:51:37,来自广东,5746701113,专杀黑自媒
7131758238102176545,比亚迪唐DMI踩雷了，被欺诈销售，电池隐患，无人解决！,0,0,0,2022-08-14 23:47:33,来自北京,4579433916,人做天看2015
7131757637733581609,昨天我还刚刚看看一则新能源充电的车主都在车主等候，就有一位车主说我都是开着空调在车内等待充电…这不马上就打脸了[捂脸][捂脸][捂脸],0,0,0,2022-08-14 23:43:43,来自广西,3493131087,不锈钢林
7131622357726348067,有应急开关，只是车主不知道而已,19,26,6,2022-08-14 14:58:02,来自河南,2616471273865997,月老星系
7131729513130017536,充电的时候不要在车里？还是明确有提示？充电时间车主在车里不正常吗？连车主的安全都不能保证吗？这些问题不解决，电动汽车不能替代燃油车,0,0,0,2022-08-14 21:53:49,来自山东,2656664095,和敬2
7131650415372272395,很多新能源汽车不是传统车厂做的，光忙着冲市值抢市场，不认真测试，对生命没有敬畏感,0,45,1,2022-08-14 16:47:53,来自北京,3941064888552828,易荷尖
7131709481218179875,本来想加一台新能源车。自己掏钱买的。控制权在外面。现在不考虑，,1,0,0,2022-08-14 20:36:08,来自广东,3408118451545464,桥头粉
7131644023718232873,司机就没想过打客服电话问问吗[what],6,33,0,2022-08-14 16:22:01,来自上海,85119199286,SD
7131679274343858980,车辆相关结构还是机械的可靠，千万别迷信全车电子结构，一旦某个电子元件失效后果不堪设想,0,2,0,2022-08-14 18:39:27,来自河北,66700200130,Morality
7131627991608312584,新能源车充电的时候千万别呆车里，危险。想想那么强劲的电流就害怕。,10,14,5,2022-08-14 15:20:23,来自湖北,6948698204,典雅的司马
7131715556495033123,难道这个车子没有一点点电了？那么这个车子是怎么开到充电桩的，推过来的?还是开过来的?因为按照理论，只要有那么一点点电也能够打开车门，因此这个视频不真实，，,0,0,0,2022-08-14 20:59:27,来自江苏,109500283648,聪慧原野t8
7131626013205021476,充电不要在车里，那在哪待着，在太阳底下晒太阳吗。,13,27,2,2022-08-14 15:12:39,来自山东,4015051562562856,晃晃晃悠悠悠悠
7131625483930026789,新能源车真不能在里面睡觉，一着火跑都跑不掉，你看看现在每天全国都有新能源车自燃的报道。,6,40,2,2022-08-14 15:10:35,来自新疆,3192618745339597,氺凩悥澅
7131722653466903336,保护板保护断电了,0,0,0,2022-08-14 21:26:55,来自江苏,6827807341,天音668
7131631267195503367,有问题立马就落锁而不是开锁让乘员出来，这样的车在设计上就有问题。,9,23,3,2022-08-14 15:32:57,来自广东,3627543182,巴别塔不是塔
7131758837807383327,大众车车门落锁，里面随时能打开的！,0,0,0,2022-08-14 23:49:03,来自广东,110125880451,罗侃风云
7131567319054369576,40度，在车外等一小时？？酸爽,5,38,2,2022-08-14 11:24:22,来自上海,72090583978,林肯也能算豪车啊
7131700563825836832,家里没有私人车位装充电桩的，买电车是为了折磨自己吗？楼下商场充电桩每天凌晨都有一些车主在充电，人一直在车旁刷手机，这种情况是图啥？,0,0,0,2022-08-14 20:02:12,来自上海,5789094390,陈千户
7131702299583628047,官方回复：司机自己操作失误！汽车没有问题！,0,0,0,2022-08-14 20:07:59,来自河南,73635662411,ppig1
7131751283656672032,应急开关在哪,0,0,0,2022-08-14 23:20:05,来自江苏,3756827589,团团宝宝2015
7131749586981045022,这种情况应该是司机充电时开空调睡觉。但是没有打着汽车。只是用了小电瓶。小电瓶的电用亏电了。所以就什么都没有了。司机应该是新手。以前没有接触电车,0,0,0,2022-08-14 23:12:58,来自湖北,145603208946781,晚霞依旧好
7131700793149063951,深夜看很多人充电都在车里啊！,0,1,1,2022-08-14 20:02:13,来自广东,104321671424,牛牛我的
7131734717891740449,对此有网友说，充电时候不都提示不要在车里么。。。为什么要坐在车里休息，万一发生意外怎么办？这不就是有危险还往危险里钻[捂脸]奇葩的脑回路,0,0,0,2022-08-14 22:14:33,来自青海,52998304483,篱篱原上草1
7131746341952242432,小事，车里标配个破窗锤就欧凯了,0,0,0,2022-08-14 22:59:08,来自江苏,66743531463,仲挽
7131748703857656610,加油、充电，人员尽量不在车内。以前坐长途汽车，加油时所有人都要下车，这些年随着车辆的安全性能提高了，大家都淡漠这一操作要求了。,0,0,0,2022-08-14 23:08:39,来自重庆,4329401260,明镜台38626027
7131716605356606215,搬一下锁扣，这么简单的操作，太菜了，新能源汽车充电时用的不是电池的电，用的是充电口的电（也许有车型设计用电池的电，但是这就是不合理设计）,0,1,0,2022-08-14 21:03:57,来自四川,98478093635,呆呆85528
7131752286333977374,运气太好了，给车主点赞，幸好手机还有电！不然！后果都想的出…做死车，开空调！大隐患…弄不好…,0,0,0,2022-08-14 23:23:10,来自山东,51135193490,粉红大石榴
7131753816092869415,学学沃尔沃，在浸水断电情况下车窗会自动打开一半！或许新能源车能借鉴借鉴！,0,0,0,2022-08-14 23:29:13,来自广东,3061123798,品茗5323921
7131704363957502754,心真大，充电还坐在车里，锂电池充电是过程中性能是不稳定的，万一发生自燃只能活活烧死在车内。电车趴窝的故障率远高于燃油车。,0,1,0,2022-08-14 20:16:10,来自陕西,2427331031086430,电路板维修技师
7131728619319608101,这位车主心真大，充电时必须出来，安全第一！,0,0,0,2022-08-14 21:50:44,来自安徽,109293615093,暖风music
7131655918953366310,后门一般都可以从里面打开。什么车应该都可以的。轿车可以放倒后排座椅靠背，从后备箱出去。后备箱里有拉线开关，可以从里面打开后备箱。suv也有类似的配置。开车还是多了解一下逃生的方法。,0,1,0,2022-08-14 17:09:12,来自江苏,52617301615,烟雨一品
7131690341870355230,一般的车都有应急开关 只是多数人不了解罢了 此事一出 安全意识强的人都会打电话问问客服 紧急逃生通道开关在哪里了！,0,0,0,2022-08-14 19:22:01,来自山东,100710730007,我爱不变
7131740637262889740,我也经常在车内休息，奇瑞的，一个小时左右自动断电，可能检测到钥匙在车内，两个小时四个窗自动降一半,0,0,0,2022-08-14 22:37:49,来自广西,3372197150,提速开车
