7131687476451672873,现在的汽车功能整得多花里胡哨的！很不安全⚠️买车就是有基本功能就好！,0,0,0,2022-08-14 19:10:36,来自四川,57510508132,无雪的季节g
7131663240731624230,应该不是特斯拉，特斯拉不是说能强制开门么,0,0,0,2022-08-14 17:37:21,来自江苏,73112623148,开朗漂流瓶LU
7131646273811333895,别的车就新能源，哈哈,0,1,0,2022-08-14 16:31:12,来自湖北,6790498971,神域小陌
7131724430422246152,这种事情还要报警，浪费公共资源。,0,0,0,2022-08-14 21:34:24,来自四川,54987153536,桥架A管道
7131714258928206625,自动落锁功能很鸡肋，直接拆除改为手动模式,0,0,0,2022-08-14 20:54:54,来自四川,342692903256343,中医药传人
7131734686824940329,出事第一时间应该打售后，不要浪费警力，这么热天，出警也不容易啊,0,0,0,2022-08-14 22:13:57,来自江苏,64078941755,R罗生门
7131716833392378664,曝光吧，什么品牌车？,0,0,0,2022-08-14 21:07:41,,105118381855,坦荡淡泊清净
7131754821979554560,一充仨小时，不在车里在哪里？,0,0,0,2022-08-14 23:32:25,来自北京,51595504020,浪里个浪里白条
7131725034611442432,联系新能源汽车配个弹射座椅。,0,0,0,2022-08-14 21:36:22,来自山东,2261035456669981,勇敢的漂流瓶IW
7131719217065640740,这个应该先演练一遍应急开门……,0,0,0,2022-08-14 21:13:58,来自河南,5965907894,千山暮雪g
7131748505135645472,看来带机械模式门锁也是一个卖点。,0,0,0,2022-08-14 23:08:58,来自湖北,52918772000,乱世英熊1
7131751559960478467,严格来讲，这是电瓶汽车！只是新能源汽车的一种。,0,0,0,2022-08-14 23:20:50,来自江苏,8462254586,小峰8221
7131698211991487271,越先进出故障死亡率越高～,0,0,0,2022-08-14 19:52:57,来自浙江,50364501354,samsam5105
7131681416249131811,电动车出厂必须强制安装弹射坐椅关键时刻才能保命,0,0,0,2022-08-14 18:47:09,来自四川,57665924216,朱勇彬1
7131738471727055650,新玩具要了解透彻，知道应急开关在哪，自己不知道找客服，还要警察提醒。,0,0,0,2022-08-14 22:28:36,来自山东,4750570665,阅人间百态
7131678027804607268,为什么不开门充电,0,0,0,2022-08-14 18:34:13,来自湖北,3214671596,天赐淡淡的二
7131744088298472195,新能源真牛逼。,0,0,0,2022-08-14 22:51:18,来自江苏,67113973942,野狼204926059
7131702195527516942,电车就是把自己放在一个炸弹上放出狂奔,0,0,0,2022-08-14 20:08:09,来自浙江,62393739557,九霄御龙
7131740390071829255,自己不会打客服问问吗，还需要警察到了才打！,0,0,0,2022-08-14 22:36:38,来自河北,4164582137661591,航贰明
7131701310902354695,电动汽车毛病太多,0,0,0,2022-08-14 20:04:40,来自江苏,6185064200,故作沉思
7131736298603447080,真希望车门锁能单独一套系统控制，或者就单纯的机械就可以，要不然关键时刻弃车保帅都逃不出来,0,0,0,2022-08-14 22:20:01,来自湖北,5378540789,武汉六渡桥精神病院
7131679257721996032,这车太垃圾，门还是手动机械开的好，太依赖自动危险。,0,0,0,2022-08-14 18:38:48,来自湖南,21905438255,海燕1487325
7131653555094110990,还算幸运，打开了。,0,0,0,2022-08-14 16:59:46,来自重庆,1701694598289735,静心亭主人
7131623717037753129,副驾驶门玻璃强制安装机械手摇的[捂脸],0,14,1,2022-08-14 15:03:24,来自北京,5981659256,密云一休
7131705129249735438,从内部开门应该用机械开门，不应该自锁,0,0,0,2022-08-14 20:19:16,来自浙江,2612049689720638,xdr247
7131738496267748126,汽车电车放个安全锤,0,0,0,2022-08-14 22:29:05,来自广东,109624164337,36O地平线
7131738970853737231,我负责任的告诉你加油的时候人可以在车里。,0,0,0,2022-08-14 22:30:42,来自河北,14914425160,天空168383342
7131637967219082018,忒司拉意思就是刹车失灵时，你只能忒的往死里拉车，门打不开时也只能忒的往死里拉门，哈哈,1,1,1,2022-08-14 15:58:36,来自湖南,105170893363,天使禅心
7131684847831647016,新能源车除了比亚迪，其它绝不考虑,0,0,0,2022-08-14 19:00:39,来自广西,104928512286,王炸80186
7131694443186438943,万一手机也没电，在大白天阳光底下，太可怕了，不敢想象。,0,0,0,2022-08-14 19:37:51,来自湖北,51457809981,先天下之忧而忧2000
7131691926705275651,永远都不要相信机械，因为它总会发生故障,0,0,0,2022-08-14 19:28:48,来自江苏,51618391094,悬崖弃马
7131743805338125071,这要是着火了，跑都跑不掉啊,0,0,0,2022-08-14 22:49:30,来自天津,3069462999731037,友爱小鱼Je
7131684389624726304,太危险了，天那么热，电车感觉不太靠谱,0,0,0,2022-08-14 18:59:35,来自江苏,62444457625,隐胜石
7131630066756404008,新能源主要是新，新的科技完全应用到实践中总需要一个过程，其中可能就需要无数先行者以生命代价为后来者提供改进经验，所以，不要埋怨车企，他们也花费无数精力，而车主也是甘当小白鼠，都值得我们敬佩！,0,2,1,2022-08-14 15:27:48,来自江苏,98946209679,小爷我厉害吖
7131712390408291075,这车要是特斯拉，媒体连车架号都要给报道出来。要是国产的 就用新能源车带过....,0,0,0,2022-08-14 20:47:58,来自湖北,111617567154,不知是几多
7131716451064824607,本来汽车就是个机械，非得要智能，智能会死机的喔😲,0,3,0,2022-08-14 21:03:16,来自河北,106582853698,躺平的创业哥
7131757368299373326,新车出厂就得在车里配备上一把大锤，以备不时之需,0,0,0,2022-08-14 23:43:05,来自黑龙江,110794789980,双子金
7131748532062585635,我不信任这方面的车。,0,0,0,2022-08-14 23:07:45,来自北京,465791829677412,用户小张薇
7131733972190708480,这个新能源车问题，是否普遍存在呢？还是只这个车有，车企单位应该有个解决方案吧！,0,0,0,2022-08-14 22:13:27,,3589224691413998,行走路尚
7131707913617605383,停电还好，忽然烧起来，开打不开，那就是新人猚了,0,0,0,2022-08-14 20:30:15,来自福建,3513653194656811,真诚蜻蜓ps
7131669355553309477,咱就说电车就电车。电池替换汽油就得了呗。为啥总是有这些乱七八糟又毫无用处的功能呢,0,0,0,2022-08-14 18:00:59,来自北京,103098232735,陈鑫42349
7131703307772396303,就不要买充电车,0,2,0,2022-08-14 20:11:54,来自浙江,61702733511,剪秋
7131680146750915360,屏幕，哈哈哈，不理解，好像屏幕就是高科技。科技在于安全高效，真不理解一车屏幕好处在哪？,0,1,0,2022-08-14 18:43:17,来自北京,58676554954,一个上了年纪呢男人
7131684790339846915,难道没有手动开门？车太高端了，我们便宜车从里面是可以开门的,0,0,0,2022-08-14 19:00:49,来自广西,105494651231,足智多谋雪梨pn
7131704742774178595,我来我来我先说，肯定不是特斯拉，外国车肯定最安全的！[狗头],0,0,0,2022-08-14 20:17:40,来自福建,4823117171,取个用户名就这么难啊
7131730950639158027,购买汽车有伤人的风险！有被汽车伤了自己肉体的风险，此二种风险人人不屑一顾！,0,0,0,2022-08-14 21:59:59,来自浙江,105210128977,垄上群氓
7131692352951517967,这么危险的事没有提前告知吗,0,0,0,2022-08-14 19:29:39,来自黑龙江,70845335822,简逸行
7131715470020936486,哈哈，以后充电车毛病会越来越多，你们谁买谁知道,0,0,0,2022-08-14 20:59:38,来自湖南,59484340129,凡尘醉客文创中心
7131681289442902784,-个充电的汽车也就是加几个电瓶美名新能源。,0,0,0,2022-08-14 18:46:47,来自河北,4142581908516287,快乐的溪流Ym
7131739452275524383,电流输出量大，动力电池的散热冷却都未工作，这是额外的用电，包括不行驶时只坐车上吹空调，制冷调最凉温度长时间不跑车，电池就怕有个异常突破口高温反应，知道那种车胎打气泵吗？用点烟器的电才能打的动气，燃油车的电瓶都受不了几下，跑动的车，电池动力总成的冷却才工作，不会热保护异常断开,0,0,0,2022-08-14 22:32:50,来自江西,109645053195,H波波头H
7131691463854834472,万一电话打不通，别人又发现不了，又打不门,0,0,0,2022-08-14 19:26:04,来自上海,93231082413,老男人7366
7131759468677268238,不在车内那呆哪里,0,0,0,2022-08-14 23:51:52,来自湖南,101718180862,seabirdss
7131711970071692064,我车子就是落锁也是可以从里面拉开啊,0,0,0,2022-08-14 20:46:14,来自安徽,97309412969,花落花开无声
7131712577746764574,为什么不表明品牌厂家？这是无视消费者权益，无视消费者生命安全，只为利益服务？,0,0,0,2022-08-14 20:48:19,来自北京,704103332723614,简单白云m0
7131753437787734822,谁能告诉我电子手刹若没电了怎么刹车？,0,0,0,2022-08-14 23:27:55,来自吉林,57174604277,薰衣草不是草
7131723082323723049,还好没有冒烟起火！这是给足面子了！,0,0,0,2022-08-14 21:28:39,来自山东,93929912539,觉聖觅极
7131696197311464206,[白眼]电车安全得一逼 人家还插电睡过夜呢,0,0,0,2022-08-14 19:44:42,来自广西,5976462728,唏噓73981121
7131719955393561378,不论科技怎么高，丢了人性化，都不长远，毕竟科技是服务人的，不是难为人的。就像新版的信号灯不能长久的。,0,0,0,2022-08-14 21:16:41,来自辽宁,325084136084272,雄鸡起舞o世界太平
7131654016114639651,车主没好好学习怎么用车吧，不可能这功能都没把,0,0,0,2022-08-14 17:00:46,来自陕西,3007854107703501,峻秀xi
7131683684071195429,充电时不可以在车上，不知道吗？,0,0,0,2022-08-14 18:56:19,来自广东,2229454419557928,其实我是修理工
7131685853512368896,电动车真的危险,0,0,0,2022-08-14 19:04:21,来自广东,2027152773744451,小韭菜
7131616514683241256,这辈子都不会买电动车，不卖燃油汽车了，宁可骑自行车,0,0,0,2022-08-14 14:35:15,来自北京,3021107696242996,两只太迪的爸爸
7131678549044003591,我的欧拉要手动锁车的。没法自动自闭[吃瓜群众],0,0,0,2022-08-14 18:36:33,来自广西,3012294376164868,疯癫小霸王
7131683887880979238,写的是新能源车，那就肯定不是特斯拉了，媒体上，新能源车是国产某厂的，方便说是哪家吗？,0,0,0,2022-08-14 18:57:23,来自广西,4225352612,红魔35944695
7131699186298749726,电动车会自杀[大笑],0,0,0,2022-08-14 19:56:24,来自江苏,5870122280,adechina
7131694718596989730,车里准备个安全锤,0,0,0,2022-08-14 19:38:34,来自广东,3342589653,大象185261958717
7131678311096451844,充电时间这么久，那如果不能在车里吹空调，企不是只能在露天热晕？,0,0,0,2022-08-14 18:35:56,来自浙江,2173077221806707,永久痕迹
7131719708172223247,所以我不会买电动车，使用电动车时刻把自己放在危险的境地,0,0,0,2022-08-14 21:15:33,来自广西,104124528359,10个兄弟们
7131730989269254916,大明星开新能源车，脸毁了保了条命，还不是教训？,0,0,0,2022-08-14 22:00:18,来自广西,86801731716,亢奋的蜗牛
7131738701469893409,设计问题！应有双向开门功能！！,0,0,0,2022-08-14 22:30:15,来自江苏,1261848903057083,思无邪斋主
7131669087235064607,一拳解决的问题，玻璃那么薄，上次我的也锁了，一拳玻璃粉碎的，可惜的花了我好几百，，,0,1,0,2022-08-14 17:59:53,来自山东,1362986171118824,中国人民万万岁万岁万
7131711224441783077,什么新能源汽车，一百年以前就有。,0,0,0,2022-08-14 20:42:57,来自河北,6381126017,幸运奶茶Wj
7131679857607705359,"花钱买的车，结果命掌握在别人手里。
这就是智能化的另一面，后台能远程控制。如果车贷没能按时还上，你能开走吗？",0,0,0,2022-08-14 18:41:06,来自广西,100731803718,热心沙滩po
7131608662908683016,就差一键火化了，多危险啊！这可是电瓶车啊！,0,12,0,2022-08-14 14:05:24,来自广西,3728475267,低调的男人24711506
7131703919264236302,电动车需要更多人的生命洗礼成熟,0,0,0,2022-08-14 20:14:37,来自吉林,50404712752,崔军40
7131648168747352863,不管什么车安全逃生设计必须要列入强制标准，要有机械开门设计，并且要在明显位置方便操作。我开过的电车，前门找半天才找到机械开门，后门到现在还没找到，外把手内藏设计，万一起火断电不知咋办了，所以不敢买电车。,0,1,0,2022-08-14 16:38:22,来自陕西,2356952577354894,歼20涡扇15
7131752207409824515,正在充电期间还敢坐车里，万一起火或者爆炸，保险公司可是不赔人员伤亡的[赞][赞][赞][赞][赞][赞],0,0,0,2022-08-14 23:23:15,来自福建,6437689136,任重而道远1
7131651630076199680,很讨厌自动化程度很高的车，难道动一下手的事很累还是很丢人？,0,1,0,2022-08-14 16:51:35,来自宁夏,6829646312,漫步人生路6543
7131718667414700833,驾驶员窗户应该设计自手一体,0,0,0,2022-08-14 21:12:13,来自天津,272294551755006,121vvv121
7131705545354265385,这要是充着电起🔥了，人会怎么样？后怕呀,0,0,0,2022-08-14 20:20:42,来自山东,1091179269334315,自由自在
7131752076438258447,又增加了个不买电动车理由了[灵光一闪],0,0,0,2022-08-14 23:21:38,来自北京,6986201445,优然智造
7131719116809552670,宁可热死报警，也不能毁车！[捂脸],0,0,0,2022-08-14 21:13:46,,105129513118,西瓜和苦瓜
7131708057360679695,新能源还是不行,0,0,0,2022-08-14 20:30:26,来自江西,105172858100,爱你依然2071
7131688838711575329,注意了，电池车根本算不算新能源,0,0,0,2022-08-14 19:16:44,来自江苏,52786737304,A小柱二手车
7131702627456533282,肯定不是特斯拉，否则早就曝光了。这个电车一点也不安全，而且是要人命的那种。,0,0,0,2022-08-14 20:09:18,来自上海,64112641151,清水总无香
7131684349451813673,坐在车里面万一自燃了怎么办？,0,0,0,2022-08-14 18:58:39,来自江苏,3466080694841408,微笑风铃WP
7131701609284944678,这车还是没有燃油车安全系数高，燃油车毕竟是成熟技术，电动车呵呵,0,0,0,2022-08-14 20:06:01,来自广东,111149324985,东莞装修哥
7131699977394619140,没起火就是万幸了[大笑],0,0,0,2022-08-14 19:59:47,来自辽宁,110822262451,用户1743817400820二
7131691844911579938,国产电车没有物理开锁配置？,0,0,0,2022-08-14 19:27:30,来自浙江,3122261136255278,虎哥扯蛋
7131729566200251168,新能源车还有一大段路要走，而目前又有几家车企致力于提升安全性稳定性和经济性呢？,0,0,0,2022-08-14 21:54:32,来自山东,71106551770,始敬合久终
7131681944882463499,你们没发现所有电动车都不敢搞安全测试吗？,0,0,0,2022-08-14 18:50:01,来自湖北,6870964308,珠穆朗玛大熊
7131699928795595560,我是充电时把左脚放车外面,0,0,0,2022-08-14 19:58:55,来自广东,61406643548,成也展岚
7131730504709112606,为什么开关门也要电？？？机械的显得低端？,0,0,0,2022-08-14 21:57:51,来自广东,102125814489,言行观照
7131729434964968231,车锁和油车不一样嘛？后备箱门开不开吗,0,0,0,2022-08-14 21:54:15,来自山东,6575069193,月姬笑送帖
7131742703935079206,你倒是说下啥品牌的新能源？,0,0,0,2022-08-14 22:46:08,来自北京,59297643592,chumuBJ
7131744248474960655,新能源是来控制人口的[灵光一闪],0,0,0,2022-08-14 22:51:17,来自广东,51269410944,唯港
7131740214548087567,我一直认为，小车是交通工具，能满足基本的出行要求就可以了，功能越多越容易出问题。,0,0,0,2022-08-14 22:35:18,来自江西,1407819247784077,知情达理风铃pq
7131700763768226571,//@李大神5:车上所有用电设备都是用一只12V电瓶供电的，这个跟油车一样，大电池负责给车辆提供动力，和给小电瓶充电，当车辆正在充电时，大电池就不会给小电瓶充电了，你睡在车里开着空调，小电瓶很快没电，车辆断电，当然那些需要用电开启的功能就无法实现了,0,0,0,2022-08-14 20:08:11,,52796123103,sengqiezha2020
7131694829734167335,后备箱逃生,0,0,0,2022-08-14 19:40:01,来自江西,110822154556,飘飘似沙鸥
