7131691162456392479,充电还躲在车里，太危险了吧,0,0,0,2022-08-14 19:25:14,来自广东,58350833300,DLH2021
7131747911473611531,今天再次买车还是选择了燃油车,0,0,0,2022-08-14 23:06:23,来自四川,50939051515,平常心178069747
7131646984540881705,车主充电被困车里[大笑][大笑][捂脸][捂脸],0,1,0,2022-08-14 16:33:44,来自江苏,95875099492,灵敏溪水hv
7131693231649669925,不怕烧死，牛逼，越智能的东西以后越容易被人监控或控制，没隐私了，动不动锁电锁车的，还是油车好,0,0,0,2022-08-14 19:33:26,来自山东,64334622010,爱别离的拥抱
7131749185501954854,加油时，可以不熄火开空调啊。电瓶车…,0,0,0,2022-08-14 23:11:15,来自山东,74317715858,三月天68269
7131752688349971233,在车内不可以直接拉开锁开门走？？？？,0,0,0,2022-08-14 23:25:20,来自广东,3861965112,PanPanPanBAD
7131714198795158280,大热天电动车充电，坐车里开空调费钱还不安全！不坐车里外面热的受不了！两难的选择！,0,0,0,2022-08-14 20:54:47,来自河北,1789621148850828,优雅百灵鸟qdl
7131719450109379340,除了电控的，很多車都应该配备机械开门的功能。这无疑是最安全的。,0,0,0,2022-08-14 21:15:06,来自辽宁,1798427984803758,小康儿66
7131750069648786216,新能源靠充电桩不现实，应该是车载充电系统，省去麻烦，,0,0,0,2022-08-14 23:13:50,来自江苏,2669261264802222,苍海坚冰
7131727903146541855,驾驶位就算断电，也可拉手机械打开。一般是这个逻辑。,0,0,0,2022-08-14 21:48:00,来自四川,3784387110,迪车樵夫
7131619604564116259,在高速服务区充电不在车内，难道要在车外等着呀！这是设计缺陷。,0,11,1,2022-08-14 14:47:21,来自上海,23496951924,上岸的鱼88
7131677172498187021,绝对设计失误，假设汽车掉水里，全车断电，不完蛋了,0,0,0,2022-08-14 18:31:03,来自广东,3619181436342349,留罗国
7131658038180201224,车门机械的那可不行，电控的好，否则电动车的智商税怎么收……,0,1,0,2022-08-14 17:17:03,来自江苏,108149641762,乳白豆浆
7131682368515654436,应急开关居然要客服告知？难道不是第一应该熟知的吗？,0,0,0,2022-08-14 18:51:24,来自北京,105197746517,坚持是一切成功的秘诀
7131684725298594563,如果自燃又打不开车门,0,0,0,2022-08-14 19:00:39,来自山东,103284277828,齐海通讯专业碎屏修
7131733372891661070,看来新能源得改善了，电池做统一的，只需要换电池即可，,0,0,0,2022-08-14 22:09:10,来自江苏,111106989483,TimGreat
7131683322841056014,什么新能源哟，就是一个电瓶车,0,1,0,2022-08-14 18:54:55,来自贵州,6106054703,龙剑除奸
7131716299180868364,如果起火，后果不堪设想！,0,0,0,2022-08-14 21:03:15,来自浙江,5450808207,康妮卡特
7131683078640304930,电动汽车技术需要完善的地方太多了。要平安无事的随意处置的情境最少也得再经历五十年的不间断改进。才能达到。,0,0,0,2022-08-14 18:53:41,来自上海,6274518618,苏宁沪
7131672795066565411,这意思就是你可以随便地把人锁在车内。她没办法轻易出去的意思吗。,0,1,0,2022-08-14 18:13:36,来自广东,53568289339,joye蓝
7131713329932010274,新能源车都吹到天上了不应该呀。,0,0,0,2022-08-14 20:50:50,来自北京,4109626804,老马33511428
7131698176163857187,断电不是应该开锁吗，断电闭锁是什么逻辑？要是车子掉进河里，断电闭锁不是死定了？,0,0,0,2022-08-14 19:52:11,来自四川,97996777147,进取苹果Qb
7131667325610754819,儿子小时候就教他，在两辆车座位爬到后备箱，自己打开后备箱门出来，有些东西要学习，还要去验证一下。包括出去旅游住酒店，我也带他看一下或者走一遍逃生通道。,0,1,0,2022-08-14 17:53:30,来自江苏,56662566947,尉迟文宇
7131699153101030175,新能源电车，应该用纯机械门锁或两门配置机械门锁！,0,1,0,2022-08-14 19:56:19,来自北京,2959519983863544,一往无前白云DE
7131701212524626688,新能源汽车就是噩梦！,0,0,0,2022-08-14 20:03:49,来自山东,58935247341,AA造型松专供130440391881
7131722862427554575,不管锁没锁，车内拉两次拉手，门都要能打开。这是世界标准的吧。,0,0,0,2022-08-14 21:27:56,来自广东,2295401126569400,东莞曹查理
7131640692606468876,我如果是消防队员，去到一定砸烂挡风玻璃，以最短时间救出，绝对不用钥匙打开。,0,1,0,2022-08-14 16:10:08,来自河南,6955504409,在水一方121253456
7131728263898645281,新能源汽车跟手机一样就是个电子产品 故障率千奇百怪。氢能源是趋势,0,0,0,2022-08-14 21:49:47,来自湖北,55487422596,松鹰1688
7131743825647338270,"电动车真的很省钱
油价太贵了
以后还是电动车的天下",0,0,0,2022-08-14 22:50:11,来自江苏,24437856555,南京仙林大学城
7131735148273795878,在车里休息很正常啊,0,0,0,2022-08-14 22:16:28,来自江苏,3943133095,不会和女孩说话
7131680675098313486,没自燃就是万幸……还是换电的好啊！,0,0,0,2022-08-14 18:44:39,来自四川,1662059368944927,花飞非
7131697418982769439,充电还是别待在车里，危险且来不及,0,0,0,2022-08-14 19:49:33,来自广东,73049206087,呼呼碌碌
7131722502107824937,充电不建议在车内，那就不要让车子启动，为什么还能让车子启动呢，既然能启动那肯定可以在车子里,0,0,0,2022-08-14 21:26:35,来自上海,4098631645271836,浩然文案馆
7131729913195496227,"爱迪生发明电灯的时候
都没说电是新能源",0,0,0,2022-08-14 21:55:21,来自陕西,51115466845,顺颂商祺惜生安死
7131679468996821763,大概是小电瓶没电了！好像多媒体、车锁供电是用小电瓶，不是用动力电池。,0,1,0,2022-08-14 18:40:40,来自陕西,11825712566,活泼优雅生活家JX
7131750811164082982,车主是未成年人？,0,0,0,2022-08-14 23:18:01,来自山东,3624452115668276,水木石6
7131651465827091232,落锁里面开不了？，被锁外面开不了见过，锁里面还打不开就太奇怪了,0,1,0,2022-08-14 16:51:44,来自陕西,60972759721,麽麻达小兄弟
7131708873799107364,机械设计，没电了也可以打开，不知道这车什么设计,0,1,0,2022-08-14 20:34:00,来自陕西,3667590452360951,明心见课后
7131687088587948834,手机充电时也不支持使用手机，电车应该也是如此吧！,0,0,0,2022-08-14 19:09:09,来自上海,65280667111,Biao哥
7131674067136529187,充电时候是不建议留车里的,0,0,0,2022-08-14 18:18:51,来自广东,1895162876277196,品评世态LANLAN盈
7131657387668914974,现在你们明白了为什么飞机的门都是手动开关？？？难道飞机不先进吗？,0,1,0,2022-08-14 17:14:33,来自陕西,51437389111,山城阳光141124488
7131745728955400975,车窗也应该至少保留一个机械升降的，便于脱困，尤其水淹的时候,0,0,0,2022-08-14 22:57:02,来自上海,109220583710,野鹤闲云gwd
7131662239396266759,能机械还是机械好“特别门锁和手刹”这些基本功能机械式的比电子的安全可靠的多。别认为电子多么高大上，当几率性的遇到问题就知道什么好了。,0,1,0,2022-08-14 17:33:17,来自新疆,6289642988,浴洋
7131709497541739295,油车断电也一样打不开。,0,0,0,2022-08-14 20:36:11,来自北京,5979905906,祖传刮刮乐
7131702838665151240,一个电瓶车天天洗脑是新能源，新在哪里？,0,1,0,2022-08-14 20:10:33,来自浙江,351484627913454,再回头伊人已逝
7131685201004282659,门内机械锁断电也可以，现在不能打开的少,0,0,0,2022-08-14 19:01:55,来自辽宁,2845129506306189,可乐加冰DL
7131671908591895337,新能源车确实是未来趋势，但并不是指的电瓶车…[机智],0,3,0,2022-08-14 18:10:09,来自重庆,1420173595122523,情感作家聪聪
7131741155611935501,充电为什么不下窗,0,0,0,2022-08-14 22:39:43,来自广东,6636213540,K一K123
7131703526161629967,我不明白。中控锁。手不能扒拉嘛。现在汽车锁都这么牛了。,0,0,0,2022-08-14 20:12:47,来自重庆,78026476015,319820
7131636090091356967,司机居然不知道应急开关在哪里[捂脸],0,1,0,2022-08-14 15:51:55,来自浙江,1736853872458755,Will未来会好
7131641786527007526,其实不管什么车断电了电控失效要有机械式手控操作才能合格出厂,0,1,1,2022-08-14 16:14:14,来自云南,62095907930,6月啊吃9
7131643134685086504,充电时辐射有多大……还在车里，都嫌命长啊！！！,0,1,0,2022-08-14 16:18:30,来自上海,1881971933593182,申城喀秋莎
7131660998863635211,在车里开空调睡觉吗，就好像手机打游戏冲电也会卡，怎么想的,0,1,0,2022-08-14 17:28:51,来自江苏,3878730395297614,进取豆花Hc
7131712363745182471,英雄～用生命来检验新能源[赞][赞][赞],0,0,0,2022-08-14 20:47:36,来自广东,104984951470,顶级枫叶za
7131678873532072737,过去的机械自动化是机械工程师主导，一般都会考虑极端状态下的机械安全，现在是电气自动化，主导者一般不大懂机械安全，安全全押宝在电气控制安全上了,0,0,0,2022-08-14 18:38:12,来自上海,3325363691748071,hyf8703
7131678118842761987,新能源车目前还不成熟，频频自然，,0,1,0,2022-08-14 18:35:33,来自陕西,51192263081,太阳五陵荣光加长货运车
7131725810159469347,天气热温度高，电控容易死机失灵,0,0,0,2022-08-14 21:39:30,来自上海,63424574120,认真的帆船Xv
7131703314232345384,前段时间，懂车帝组织了一场新能源车在火焰山的测试，测试的结果是几乎全部趴窝。从这个方面来说，新能源车的安全性还有很大的提升。,0,1,0,2022-08-14 20:12:05,来自湖北,1895190569157758,抬头看山
7131682579552158479,太多不安全[害羞]！我还是行路吧！,0,1,0,2022-08-14 18:51:50,来自广东,107717385147,新悦亮
7131698733057934093,"一般电控车门都有机械解锁，通常在尾门或后箱。
估计没好好阅读用户手册。",0,0,0,2022-08-14 19:54:36,来自江苏,66705071046,阿尼刚睡醒
7131706888085553952,车门为啥不设置成机械锁？,0,1,0,2022-08-14 20:26:32,来自内蒙古,52361385051,要做前堂客
7131665807092286219,新能源汽车从百花齐放到一地鸡毛,0,0,0,2022-08-14 17:47:30,来自广西,7360686649,苏克和贝吉塔
7131678287239234319,车门还是机械的保险,0,0,0,2022-08-14 18:35:01,来自河北,4584041467,鼠标2022
7131746868757299981,电动车只有两种，一是特斯拉，二是其他电动车，本案看车外型是其他电动车,0,0,0,2022-08-14 23:02:13,来自广东,61923156901,守仁得仁
7131717515013227264,充电不让待在车内，哈哈笑死了，,0,0,0,2022-08-14 21:07:07,来自山东,3663206428707323,初次为人
7131677940701987617,看来，还是燃油车安全点！,0,1,0,2022-08-14 18:36:24,,4046670516,自由自在32247832
7131755419630371624,电网的事情 车肯定没问题 电车还是最佳选择,0,0,0,2022-08-14 23:35:06,来自辽宁,61627898339,书臭铜香
7131749744313402144,新能源车怎么能一氧化碳中毒？,0,0,0,2022-08-14 23:13:38,来自山东,229117979025503,健康流水8M2
7131711295841518373,开新能源车不代表可以是车盲。,0,0,0,2022-08-14 20:43:20,来自浙江,77399936396,巴音鲁克
7131748460940051232,没暴电车品牌，肯定不是特斯拉！,0,1,0,2022-08-14 23:08:24,来自甘肃,6082799979,秦玉龙
7131682161090511655,现在的电车做得科技感十足，上个车找个车把手没有下个车也是，什么东西都是电子式的。真的出了意外不晓得怎么办。,0,0,0,2022-08-14 18:50:58,来自重庆,102836330832,387E
7131700704917472037,还好只是锁车，要是自燃神仙都救不了[灵光一闪],0,0,0,2022-08-14 20:02:11,来自吉林,52430747986,红旗让理想飞扬
7131716884449739561,这个新闻肯定不是特斯拉，懂的都懂,0,0,0,2022-08-14 21:04:39,来自云南,6115731156,五彩视界
7131749389361578759,这一般是小电池没电了，叫个车搭一下电就可以了,0,0,0,2022-08-14 23:11:27,来自福建,86712227911,老康吐槽随手记
7131719214305624832,啥车？快充电池热，用电电池热,0,1,0,2022-08-14 21:13:41,来自江苏,58916089581,阅月悦越
7131716300694717225,对，电动车会这样的,0,1,0,2022-08-14 21:02:22,来自江苏,188763998524504,奋发画板V0
7131723570400871181,这节奏不对啊！感觉过去电动汽车有问题不是铺天盖地的质疑和维权吗？车主没说明是什么车啊？,0,0,0,2022-08-14 21:30:56,来自辽宁,51858481813,无聊渔人
7131687785006105384,我就害怕一样！没有机械锁万一车掉水里！会断电！人就会出不来！,0,1,0,2022-08-14 19:11:59,来自黑龙江,103652309250,永远的大赢家
7131710425146082060,新能源车就是不成熟，而且价格害不菲！,0,0,0,2022-08-14 20:40:17,来自山东,1519552244,社会垃圾清理工
7131722085462065927,电车充电时正好坐在车内吹空调不是常规操作吗,0,0,0,2022-08-14 21:25:13,来自湖南,4075741448,拂晓32859188
7131676710189269764,充电的时候在车里容易就地火化！,0,0,0,2022-08-14 18:29:36,来自福建,3604047680,拒绝平静的水
7131639219474285347,全世界都错了，汽车是代步工具。这是唯一宗旨。可现在的车企，都在追求花里胡俏的其它功能，什么自动驾驶，什么自动化等等。都不在安全上下功夫。想想，安全没了，其它的还有用吗？,0,1,0,2022-08-14 16:03:27,来自浙江,5859982559,翱翔与蓝天
7131673271418241792,油车的应急开关在哪里,0,1,0,2022-08-14 18:15:41,来自广东,140349892473567,陶潜水
7131677985728070439,打着新能源的幌子，除了不用油 其他各方面都不比油车便宜 剩下的油全交保险了[我想静静],0,4,0,2022-08-14 18:34:51,来自浙江,1670898431065688,如花来了哟
7131698153878864680,这电池质量还行，如果冒烟就麻烦了,0,0,0,2022-08-14 19:51:54,来自浙江,101308343577,幸运—789
7131748511091688233,机械车门的重要性。,0,0,0,2022-08-14 23:07:53,来自贵州,98552464982,来自江城的西瓜大人
7131716446304142121,车间睡着了，充电着火怎么办？,0,0,0,2022-08-14 21:02:55,来自广东,6668263878,深BD7JAD
7131701602561852173,新能源，急功近利，把一些基本人身安全都忽略了，还是油车，经过百年经历，设计近乎完美。,0,1,0,2022-08-14 20:05:55,来自江苏,53596133377,清水湾188043104
7131728466437161766,这样的新闻请备注汽车品牌,0,0,0,2022-08-14 21:50:25,来自辽宁,3309923741,沙漏沙
7131669556540064546,汽车自动落锁是一大弊端！,0,0,0,2022-08-14 18:01:13,来自山东,6469778342,兰陵珺
7131721861104632615,不知道是谁发明这个没有手动解锁的功能，竟然还被人趋之若鹜，我买车有这个功能的立马否掉，还有那个开门把手是平的也不能要,0,0,0,2022-08-14 21:24:38,来自广西,71096450474,睁眼看头条
7131698891887493903,四个轮胎的电瓶车，就叫新能源，二个轮的电饼车叫丶电车[摊手],0,1,0,2022-08-14 19:54:45,来自山东,51049575668,达撒雕
7131691549938991872,电控门不安全，还有电控方向盘，一旦失去电，立即丧失功能。,0,0,0,2022-08-14 19:26:29,来自湖北,3765155973834623,淡泊葡萄X
7131722060535546665,车子的设计或许有问题，没有考虑或考虑不周如何应对突然断电情况下可能出现的后果。,0,0,0,2022-08-14 21:24:46,来自山东,98927300270,解疑答惑942
7131627884389040932,这个车主至少以后充电或停车时肯定不敢坐在车上了,0,0,0,2022-08-14 15:20:01,来自上海,5508053209,半路出游
7131704595579355936,可以在车里准备一把应急锤 关键是什么牌子的车？,0,0,0,2022-08-14 20:17:43,来自江苏,2352582319408435,顶级风铃y
7131728720217391910,车有应急开关？,0,0,0,2022-08-14 21:51:12,来自山东,3700545907,我是Mr刘
7131708071738868520,车门绝对是可以打开的，和有电没电无关,0,0,0,2022-08-14 20:30:30,来自湖南,4540014204,楚生闲谈
7131694190698070799,为民警点赞！,0,0,0,2022-08-14 19:36:38,来自安徽,3601619166437532,建国lian
7131731775625331468,这种设计真坑啊，任何情况，停驶状态中，都得允许里面能打开车门,0,0,0,2022-08-14 22:03:08,来自河北,9100689851,Ocean140316961
7131687490649539368,他应该庆幸车没有自燃，否则后果不甚设想！[灵光一闪],0,0,0,2022-08-14 19:10:47,来自广东,5780289705,从头363再来
7131688819501662989,感觉还是油车的门方便，锁车了从里面一掰开关就可以打开,0,0,0,2022-08-14 19:16:17,来自江苏,50366737147,夜色尘埃
7131651403025515279,充电时最好不在车内[赞]真不错[作揖],0,1,0,2022-08-14 16:50:36,来自北京,103354229834,真诚孔雀Gl
7131673319207912192,小电瓶给干亏电了。,0,1,0,2022-08-14 18:15:49,来自贵州,6022201538,孤独狐
7131743431335887616,直接按机械锁扣就打开了[泪奔],0,0,0,2022-08-14 22:47:47,来自山东,5872039711,继续今天的生活
7131716376754275106,吹空调时，车窗开个一指宽的缝，费不了多少电的，也安全，紧急可逃生。,0,0,0,2022-08-14 21:02:43,来自河南,571342049518302,打天下之中国人
7131687828542587648,车子最厌恶的就是各种“自动”功能，自动启停，自动驻车，特别是自动驻车，起步时只要转速不够，活活把发动机拖到熄火为止。,0,0,0,2022-08-14 19:11:57,来自浙江,585368349453580,不凡远山7B
7131689008979608356,电车不是新能源车！,0,0,0,2022-08-14 19:17:12,来自广西,5440637178,13238234518
7131693212628435748,自动落锁功能一定要关闭,0,0,0,2022-08-14 19:33:20,来自浙江,4054633777494559,正义凛然阳光Jq
7131700597283848973,深夜客服也上班？,0,0,0,2022-08-14 20:02:07,来自广东,59744972260,inxus
7131717853069427489,这种车会在电脑被控制的情况下出事，所以奉劝大家买国产车就不要买进口车，能买汽油柴油车就不要买电动汽车,0,0,0,2022-08-14 21:08:57,来自江苏,99159339400,大冯427
7131683404298748706,不明白电车外面弄个隐藏式把手，是想省电还是美观？这倒好里面也打不开了。,0,0,0,2022-08-14 18:54:57,来自陕西,109469449606,牛瑟的灵魂734
7131692568433935145,新能源汽车也许是趋势，但大家千万不要以为新能源汽车的时代已经到来！距离那个时代还远着呢！,0,0,0,2022-08-14 19:30:35,来自安徽,1574131316567599,公子江上
7131686966500115200,电子化在牛逼，碰到没电只能……,0,0,0,2022-08-14 19:08:47,来自广东,103512709347,Buffering99244
7131759166230364960,充电别在车里，有辐射吧,0,0,0,2022-08-14 23:51:16,来自广东,6589283059,淡定决定高度
7131634075659944734,不说品牌，一律特斯拉[捂脸],3,32,2,2022-08-14 15:44:01,来自江苏,3676513743,szsqp666
7131758862125859598,人在车里也能上锁，牛逼六六六,0,0,0,2022-08-14 23:48:53,来自福建,632950288028078,海森堡r
7131608681313420069,充着充着火化了。厂家应该把应急开关位置和提示在驾驶室侧面永久提示。,0,4,1,2022-08-14 14:05:26,来自江苏,4572242567,以史明荐
7131726167102735118,"自动锁有没有问题跟新能源，旧能源没关系！
跟设计车子的经验有关系，
跟量产前测试得仔不仔细，完不完整有关系！",0,0,0,2022-08-14 21:41:03,来自广东,637353992663140,聪明的饼干V5
7131740610029323042,汽车防盗模式开启了。,0,0,0,2022-08-14 22:36:53,来自山东,51949443121,建造师大满贯
7131711031629447944,坐在车里车还是不要关严的好，留个余地,0,0,0,2022-08-14 20:42:20,来自安徽,105842194551,哆来咪发428
7131679970522317603,跑高速不在车里休息去哪里,0,0,0,2022-08-14 18:41:23,来自云南,78783729360,忘不了1171
7131636836371989278,小知识:特斯拉后座没有手动开关，只有前排有,0,1,0,2022-08-14 15:54:47,来自山东,6078766656,AA一叶知秋78238349
7131711372252971816,想起：手机充电时辐射最大🔋,0,0,0,2022-08-14 20:43:10,来自广东,69441994473,攞你命叁千
7131678171715617572,电池起火，那是灭不了的！,0,0,0,2022-08-14 18:35:01,来自江苏,4252516544421357,翛然而立
7131692651576951589,电动车充电时千万不要坐车里，防止电瓶车充电引起的火🔥灾！太可怕了。,0,0,0,2022-08-14 19:31:04,来自江苏,3290037037,正大光明面条3
7131727460349264640,喜欢不起来新能源,0,0,0,2022-08-14 21:45:45,来自陕西,4690216251,绝迹于江湖
7131690880003474189,尾箱有个紧急开关的,0,1,0,2022-08-14 19:24:03,来自广东,5128745323,深圳大鹏展翅
7131748679803159307,这种存在致命安全隐患的车肯定不能行。不允许,0,0,0,2022-08-14 23:09:34,来自广东,6769709686,下课铃声2021
7131714742569435917,还是机械锁安全，不怕没电,0,0,0,2022-08-14 20:56:37,来自山东,86587887476,风格环境酒家
7131749640718254888,系车主操作失误所至，对车辆不了解,0,0,0,2022-08-14 23:12:23,来自陕西,12693652389,青铜娱乐评论员
7131699339885511465,都快挂了还舍不得砸玻璃，还报警？,0,0,0,2022-08-14 19:56:32,来自福建,1415796221552092,但愿明天比今天更好
7131716534631875369,充电肯定不能坐车里，同理，开车也不能坐车里。,0,0,0,2022-08-14 21:03:19,来自江苏,105150052026,蓝白猫天下
7131635372211208995,新能源汽车还需要时间成熟。如果要求成立几年的车企和百年老车企各项性能一样。有点急了。,0,1,1,2022-08-14 15:48:28,来自广东,19685343824,木牛的牛
7131684956078211874,我不知道其他地方，反正我们县城充电桩旁边没有提供休息的地方，像现在四川这个天气，你叫充电的车主呆在哪里？,0,0,0,2022-08-14 19:00:56,来自四川,2203049467061884,为什么总是如果
7131639981990986535,看前脸车头还有中控屏不像比亚迪,2,12,1,2022-08-14 16:07:43,来自广东,1871045809,东莞小罗
7131702809124946699,欧洲和美系车原来好多都有落水自动开窗的功能，现在消费者不注重这些或许永远也用不上的功能，只追求大和舒适豪华功能配置，这些又没有法规要求，所以最开始减配的，就是这样一些功能。,0,0,0,2022-08-14 20:10:57,来自辽宁,4424032914516430,群山之外123
7131710242752594696,主驾有机械解锁按钮，但大部分人都是“残废”，只知道电动解锁按钮。连轮没气了换个备胎这点小事也只会干瞪眼,0,1,0,2022-08-14 20:39:19,来自浙江,1618096719146376,昨天赶紧换
7131721144503616259,看来以后充电一定不能呆在车里面了，有点危险,0,0,0,2022-08-14 21:21:59,来自四川,3526846891692040,0o我的相貌平平无奇o0
7131747580140569376,电池车只有在充电的时候才敢舒服的享受空调[捂脸],0,0,0,2022-08-14 23:05:14,来自四川,62796570324,快乐的叶子3
7131695034046530340,为何电瓶车官谓新能源车…,0,0,0,2022-08-14 19:40:09,来自山东,59683870111,共享一个梦
7131700286070620939,汽车门应该双电源！,0,0,0,2022-08-14 20:01:04,来自江苏,57822626159,多彩云朵JU
7131680569993364224,一直觉得把电动车说是新能源，就是个笑话！,0,1,0,2022-08-14 18:43:48,来自广西,92658818206,柏味生活
7131684930895397662,我的电车都有手动开门，他的车太次了,0,0,0,2022-08-14 19:01:12,来自湖南,111091599380,A一好歌
7131715272671019784,一主二备三应急，某些关键系统还是应该进行适当的冗余设计，哪怕车重一点多费点油/电。,0,0,0,2022-08-14 20:58:46,来自广东,2840780776942766,学而时习之的东东
7131670248461222686,哈哈要命的“新能源”……问题太多了。,0,1,0,2022-08-14 18:04:01,来自山东,50916722139,淡泊石头
7131729842600592168,还会有应急开关？,0,0,0,2022-08-14 21:54:52,来自江西,11044950476,冰镇西瓜10
7131709612671648525,一般在玻璃的左上角有个应急锤，用它轻轻砸一下玻璃，然后人钻出来就没事了！,0,0,0,2022-08-14 20:36:51,来自陕西,5890228408,爱吃凉皮夹馍
7131698416232809216,充个电都不能待车里，到底车服务人还是人服务车？,0,0,0,2022-08-14 19:53:06,来自江苏,50433739064,一天到晚游泳的鱼342
7131656733063136033,就是不买电动车！宁可开老爷车，安全,0,18,0,2022-08-14 17:11:59,来自吉林,2858333281467528,博学多才的大神儿
7131643813835637507,汽油车也有自动落锁，但他也有手动打开,0,1,0,2022-08-14 16:22:14,来自江苏,50378659316,上进满满的正能量
7131726974976279331,坐车里不能充电，还要这么车干什么？,0,0,0,2022-08-14 21:43:51,来自云南,3448542024968983,淡竹逸境
7131731978600727304,某些电动车主沾沾自喜津津乐道的电动车“大招”被无情打脸了[捂脸],0,0,0,2022-08-14 22:03:53,来自河南,2400925060969359,如果年轻10岁
7131634729598272296,我是要等啥时候政府部门在大量采购新能源的时候再考虑买,0,0,0,2022-08-14 15:46:11,来自重庆,96929548996,木易先㽒
7131757435878064933,电脑那么成熟了，但仍怕突然停电丢失文件！,0,0,0,2022-08-14 23:43:35,来自湖南,84959854086,懒猫听歌
7131657852938191616,就这样的质量，让人望而生畏，远而避之。捡实用而简便，安全有保障的选购才好。,0,0,0,2022-08-14 17:15:45,来自河北,1956771768303660,率真菠萝Qt
7131744527769191202,新能源也有机械拉手啊,0,0,0,2022-08-14 22:52:12,来自山东,108974092929,hdjxbxjdjebdsjzbx
7131737021688939294,胆子真大！万一车爆炸咋办！,0,0,0,2022-08-14 22:23:25,来自江苏,3280589575161896,自由远山721
7131753246452335391,目前电动汽车还是在实验摸索阶段，还很不成熟，包括动力电池，所以，会有很多人自愿当小白鼠，充当炮灰，这是科学进步的必然阶段。,0,0,0,2022-08-14 23:26:58,来自河南,52994605122,鹏程万里142046631
