7127538080927515406,私立幼儿园没有保安吗？10点过又不是上学放学接送时间？歹徒怎么进去的？太凶残了！痛心！,0,0,0,2022-08-03 14:49:05,来自广东,4110611012,达总99999
7127533138469126923,孩子，我靠，有没有人性啊。现在社会应该多关心下心理有问题的人了。这个问题越来越严重了。危害社会！,0,2,0,2022-08-03 14:30:20,来自湖南,3712340341,北折南来
7127529358600291087,保安都是拿着最低的工资，年老体衰的人。这时候指望保安去拼命吗？,0,7,0,2022-08-03 14:15:05,来自山西,11086929352,单纯百香果S4
7127530082512012072,这是报复社会的吗,0,21,0,2022-08-03 14:17:53,来自山东,105062322883,临沂大才子
7127536773030855439,从文字上看，仅能说明案发现场在幼儿园，但并没有说受害的是幼儿。,0,0,0,2022-08-03 14:43:50,来自湖北,64615690258,叧玊
7127534537646555939,每次看到这种新闻都痛心不已，试问小孩子招惹谁了？,0,1,0,2022-08-03 14:34:59,来自湖南,51602682207,武话不港
7127535336108180239,十恶不赦，一定要严惩凶手。幼儿园不是放暑假吗？怎么有还有小朋友。,0,0,0,2022-08-03 14:38:12,来自江西,53057705428,打铁匠黄胖
7127529559045751587,看来这个人还要进一步行凶,0,1,1,2022-08-03 14:15:45,来自四川,59688673595,只堵不疏
7127535845506138893,社会矛盾得解决一下了,0,0,0,2022-08-03 14:40:27,来自山东,6037434003,我爱我亲爱的祖国
7127534065905255199,初步锁定的意思就是人还没有抓着？？？？,0,1,0,2022-08-03 14:33:44,来自山东,85572651516,风雨同行0922
7127536350706500356,又是恶性事件，必须严惩,0,0,0,2022-08-03 14:43:06,来自浙江,4244584745927856,五泄蜂
7127533151857443623,杀人者想引起社会关注！希望记者跟踪报道！,0,1,0,2022-08-03 14:30:23,来自四川,3292905435,游猎者
7127531738854802176,幼儿园保安就是花钱承担责任的！一点点工资，请一帮退休的大爷，出了事第一个逃的！,0,2,1,2022-08-03 14:24:16,来自上海,3003496507905448,温柔肯德尔1j4
7127534937410192162,上级部门要加强监管幼儿园管理，必须专业保安！！,0,0,0,2022-08-03 14:36:38,来自陕西,86414572758,50911827416
7127531651701703432,巴南前几年幼儿园事件让我至今难忘，那个被k掉半边脸的小男孩现在怎么样了,0,1,0,2022-08-03 14:24:23,来自重庆,96712762261,小呆的梦想是发呆
7127533112057742095,请问幼儿园怎么进去的?现在幼儿园不是放暑假吗？,0,0,0,2022-08-03 14:29:39,来自江苏,82352613455,紫蝴蝶932
7127535865303450403,有几年没这事了，幼儿园都有保安措施了，挺严格的！,0,0,0,2022-08-03 14:40:12,来自北京,99124382117,幸福用户快乐人生
7127534663455048482,又是幼儿园，可怜的孩子，不问清楚就让陌生进来的吗,0,0,0,2022-08-03 14:35:35,来自广东,6251515984,爱说说的小者
7127534301444326179,又是幼儿园？！这丧心病狂的恶魔怎么对幼儿下手啊？,0,0,0,2022-08-03 14:34:04,来自广东,461413357716637,老推18
7127534348526027552,什么原因要对幼儿下毒手？,0,0,0,2022-08-03 14:35:12,来自湖南,786871001558509,微笑晚风o9
7127532251268629281,残暴至极，真下得了手，必须绳之以法,0,1,1,2022-08-03 14:26:51,,2357793144184628,多才画板h1
7127531398256837389,凶残的歹徒孩子是无罪的呀,0,0,0,2022-08-03 14:23:22,来自河南,51166884466,进取明镜i7
7127534806522970914,幼儿园不是放假了吗,0,0,0,2022-08-03 14:36:12,来自新疆,53653004280,小学校长232988163
7127536334927315712,和谁有仇找谁去，祸害无辜孩子罪大恶极，,0,0,0,2022-08-03 14:42:06,来自黑龙江,3689585369164171,执行者wsnd
7127535571630981892,典型的报复社会,0,0,0,2022-08-03 14:39:46,来自江苏,55648188318,9988773
7127529344813269794,这是怎么了？这也能下得去手？,0,19,1,2022-08-03 14:14:56,来自河北,2299770415612276,优雅天空6J
7127537582015415081,不是为钱就是为了爱，孩子碍你什么事了？不菅是不是你親生的也不能涉及无故啊？可憐的孩子们！一定严办！决不顾惜！！！,0,0,0,2022-08-03 14:46:57,来自河北,2598845991358084,缤纷饭团G8
7127535992890082055,幼儿园不是有保安员的人,0,0,0,2022-08-03 14:41:08,来自福建,937231072900424,甘用来
7127536493765395233,安保有问题 我们这幼儿园 学校安保和监狱差不多 一般进不去,0,0,0,2022-08-03 14:43:25,来自江苏,96663981096,起飞吧大门牙
7127533117501981480,保安工作做不到位，可怜的孩子[流泪][流泪],0,1,0,2022-08-03 14:29:37,来自贵州,61315122714,凌儿197697597
7127534628357227302,怎么进去的，一般幼儿园家长都不让进的，,0,0,1,2022-08-03 14:36:04,来自河南,1310272436051719,一现昙花
7127530811548959520,冤有头债有主，对孩子们下手天理难容[打脸][打脸][打脸],0,2,0,2022-08-03 14:21:15,来自浙江,2498561220552723,龙最泉良
7127531650275803937,普遍幼儿园保安年龄偏大！,0,0,0,2022-08-03 14:24:39,来自福建,69706995868,哥取个名字容易嘛
7127534343400669985,幼儿园或者很多学校很多保安都是年纪大的，遇到这种情况根本不可能制服这些罪犯,0,0,0,2022-08-03 14:35:13,来自湖北,6709344995,拼了107488931
7127531691362927396,这也太残酷了！无辜的孩子可怜的家长。,0,0,0,2022-08-03 14:24:31,,10125314466,溜抨
7127536262613533455,对年幼的孩子下手？[发怒][发怒][发怒][发怒][发怒],0,0,0,2022-08-03 14:41:52,来自山西,85066154265,弓蓉蓉
7127532427890754308,明显的报复社会,0,3,0,2022-08-03 14:27:23,来自山西,4090647508423128,不再开车的老司机
7127533778582536995,学校的保安应该由退役的特种兵做安保，给他们安排事业编制，不能给老大爷，做安保工作，可怜的孩子找谁惹谁了[流泪][流泪][流泪][流泪][流泪],0,1,0,2022-08-03 14:32:02,来自河南,55505908161,情岭1
7127532881907729183,坚决打击这些犯罪分子，在校园都不安全，幼儿园的安保工是干什么的[发怒],0,2,1,2022-08-03 14:28:58,来自山东,3988663125434243,黎明之光
7127536236675728136,他家没有小孩吗？为什么要拿无辜的孩子出气，太可怜了[流泪][流泪][流泪]。,0,0,0,2022-08-03 14:42:03,来自浙江,694491497643387,高山的一面湖水
7127529321300443912,天杀的，对幼儿园下手！,0,22,0,2022-08-03 14:15:22,来自辽宁,108143127306,阿迪148
7127531835416527655,林子大了什么鸟都有，抓住必严惩！可怜的小生命，就这么没了？我也疯了？！！[流泪][流泪][流泪],0,1,0,2022-08-03 14:25:24,来自北京,6372061743,明珠老赵
7127533151857689383,报复社会的,0,1,0,2022-08-03 14:30:31,来自江苏,48032328466119,撸铁组合
7127533102637155111,依法严惩犯罪分子。,0,1,0,2022-08-03 14:30:13,来自山东,3100244069846653,嘉瑞疃韵
7127535589037032227,希望尽快将杀人凶手抓获归案,0,0,0,2022-08-03 14:39:01,来自安徽,1991934768331064,linyun063321
7127533430505685800,有不少私立幼儿园为了挣钱 根本不配保安,0,0,0,2022-08-03 14:30:41,来自山东,888012553600064,在奋斗的路上垂死挣扎
7127537111779361574,对幼儿园的孩子下手，够损的了！,0,0,0,2022-08-03 14:45:52,来自吉林,103971489142,宁静致远WS
7127531500387582733,最近不知是新闻信息快还是什么原因，发现类似幼儿园事件越来越多了,0,0,0,2022-08-03 14:23:38,来自上海,67101037699,杨东1991
7127536470981853990,咋天看到我们县有些学校招保安1500-1800就这工资除了六十以上老大爷谁去,0,1,0,2022-08-03 14:43:18,来自新疆,63729007221,云淡梦清
7127536087253877515,孩子没事儿吧，就这种人抓紧去也不能让他好过了，激起民愤了都。,0,0,0,2022-08-03 14:41:53,来自辽宁,51236997011,A一个茄子
7127535613200532232,想知道死伤的是孩子吗？,0,0,0,2022-08-03 14:39:40,来自辽宁,106535353540,美丽人生yj
7127535075050554152,通报就说清楚一点儿？,0,0,0,2022-08-03 14:37:13,来自河北,78619390838,一夜落雪666
7127536301024510735,绝对是有预谋的故意杀人，罪大恶极,0,0,0,2022-08-03 14:41:52,来自江西,50366835934,金光坝老表
7127535307922162472,幼儿园是不能随便进去的，这保安有问题，,0,0,0,2022-08-03 14:37:58,来自湖南,109824050898,直爽饼干Q
7127534030718862120,私立幼儿园没有保安吗？,0,0,0,2022-08-03 14:33:03,来自浙江,51530421423,郑文汉1
7127534431543771915,典型的报复社会,0,0,0,2022-08-03 14:35:19,来自辽宁,64568792637,柒月风雨7
7127529358482359080,太没人性，抓到要严惩😡,0,4,0,2022-08-03 14:14:55,来自福建,1015566095615671,满满奶奶8p0c
7127534570135765772,死伤者身份并没有透露，保安在不在列不清楚，上来就指责！这种人换在当场必然是躲得远远的。要求别人倒是一套一套的。,0,0,0,2022-08-03 14:35:56,来自四川,55182891613,呵呵复呵呵我就要呵呵
7127531745494418215,报复社会心理,0,0,0,2022-08-03 14:24:57,来自山东,74763368322,蚂蚁咋个www
7127528295956333319,现在不是放假了吗？,2,15,0,2022-08-03 14:11:09,来自四川,3121873891,奇幻山丘J
7127533514026697475,幼儿园孩子太无辜了,0,1,1,2022-08-03 14:31:33,来自云南,1161436989,鱼鱼大象
7127537023619613480,幼儿园应该是年轻力壮的保安,0,0,0,2022-08-03 14:44:57,来自湖北,3217414845,新兴文艺
7127532331329471266,幼儿园保安，好多都是大爷，照顾好自己可能都困难。为什么，降低用人成本啊，和小区物业一样,0,3,1,2022-08-03 14:26:26,来自天津,5581867732,火炽乘龙78
7127534256859628321,以后幼儿园的保安要招复员军人或者警惕性高的人,0,0,0,2022-08-03 14:34:43,来自山东,1358628279039276,用户G二哥
7127533264209740552,为什么要伤害幼儿园的孩子？。,0,0,0,2022-08-03 14:30:26,来自广东,11938127549,悟性本无道
7127528315225096998,光天化日，这太嚣张了。,0,19,0,2022-08-03 14:11:43,来自陕西,6672944191,时髦影视厅
7127528748991120160,光天化日，这太嚣张了。,0,6,0,2022-08-03 14:13:07,来自山西,22840405507,留住青春55
7127531343063532325,现在的幼儿园、小区、单位门口的保安总共没剩几颗牙，那能起啥作用？,0,5,0,2022-08-03 14:22:59,来自青海,2242598385493832,王大爷之青海分爷
7127534287146713871,我们幼儿园除了工作人员和孩子能进家长苍蝇都不能进[呲牙],0,0,0,2022-08-03 14:34:13,来自上海,111581803461,小猪佩塔
7127531074456634147,特殊时期，对这样残忍的犯罪分子应该从快从严处理。,0,3,0,2022-08-03 14:21:48,来自加拿大,6828610273,音乐与美酒
7127533573481055006,典型的报复社会！,0,0,0,2022-08-03 14:31:39,来自广东,6972645227,頭条第一喷子
7127533367847060227,吓死我了，保安呢？干嘛去了呀？,0,1,0,2022-08-03 14:31:06,来自新疆,5996486720,口袋里的蓝胖子
7127534135979049728,从虐杀猫狗到虐杀女人孩子……对生命冷漠失去敬畏的代价……,0,0,0,2022-08-03 14:33:29,来自北京,104838416929,魔法潇洒水滴4M
7127538373640340224,幼儿园的孩子招谁惹谁了[流泪],0,1,0,2022-08-03 14:50:05,来自江西,75839182486,江西中科
7127528438554116894,幼儿园现在有人吗,2,3,2,2022-08-03 14:11:45,来自安徽,2762438250071748,合肥大当家
7127530449726931719,冤有头债有主，谁惹你你找谁去，惹不起可以找他的家人，何必欺负弱小，完全就是懦夫，不过这也符合我们目前老百姓的性格，欺善怕恶,0,1,1,2022-08-03 14:19:27,来自陕西,50040918515,FollowsLeaves
7127533301061157636,为什么要对无辜小孩下此毒手啊？？？？[流泪][流泪][流泪],0,1,0,2022-08-03 14:31:08,来自广西,572166503931627,星际飞船
7127532577719698187,幼儿园的保安都是上了年纪的，体能根本不行。,0,1,0,2022-08-03 14:28:00,来自河南,109620869792,我是橘子爸
7127536733029892902,私立幼儿园，雇不起保安,0,0,0,2022-08-03 14:44:34,来自辽宁,479037210763357,执着的春风5d
7127537090983740175,幼儿园随便进入吗？,0,0,0,2022-08-03 14:44:57,来自河北,3874476343,雁行天下
7127536457988457248,对孩子下毒手，天理难容[发怒][发怒][发怒][发怒],0,0,0,2022-08-03 14:43:33,来自山东,4110111868,树袋熊6971
7127536805142217480,他咋进的幼儿园？不扫码不登记吗？,0,0,0,2022-08-03 14:44:17,来自北京,93250970317,魔法橘子a5
7127537090983740175,幼儿园随便进入吗？,0,0,0,2022-08-03 14:44:57,来自河北,3874476343,雁行天下
7127536457988457248,对孩子下毒手，天理难容[发怒][发怒][发怒][发怒],0,0,0,2022-08-03 14:43:33,来自山东,4110111868,树袋熊6971
7127536805142217480,他咋进的幼儿园？不扫码不登记吗？,0,0,0,2022-08-03 14:44:17,来自北京,93250970317,魔法橘子a5
7127533043782386435,自从上次幼儿园事件之后全国都增强安保了，我们这也雇俩老头看门，加起来有150岁。,0,0,0,2022-08-03 14:29:45,来自山东,58980425196,淮海游子
7127534197509571362,学校和幼儿园的保安必须会擒拿格斗，不能搞形式,0,0,0,2022-08-03 14:33:41,来自湖北,98164133859,财源廣进181888
7127536256397034277,幼儿园不是放假的吗？,0,0,0,2022-08-03 14:42:01,来自广东,64716137154,liao274439911
7127533432674009890,10点幼儿园还有人？没放假？[黑线],0,1,0,2022-08-03 14:30:42,来自广西,63239287479,糖果yyd
7127535273998730018,幼儿园学费越来越贵，就不能聘请专业安保吗？加强幼儿园安全保障,0,1,0,2022-08-03 14:37:55,来自浙江,1574976965316036,养乐多Lduo
7127528628279165703,怎么进的幼儿园？门卫责任最大！,2,4,1,2022-08-03 14:12:29,来自江苏,62657783889,白杨在锡
7127537103688712967,最近是怎么了 怎么这么多凶杀案,0,0,0,2022-08-03 14:45:27,来自广西,3544455207,依然的思念你An
7127536656495919879,暑假期间，幼儿园不放假吗？,0,0,0,2022-08-03 14:43:47,来自江苏,101892816122,72611221101
7127533769313256227,怎么对小孩子下得去手的…,0,0,0,2022-08-03 14:32:06,来自河北,68388479116,那记忆化作眸一点1
7127536236822528802,保安工作不到位，还是需要专业的安保部门负责这项工作,0,0,0,2022-08-03 14:41:44,来自云南,624174589291021,勇往直前的梦想Mx
7127534498190820127,我儿子幼儿园门口的保安一看就是练过的，威慑力杠杠的。坐标武汉,0,1,0,2022-08-03 14:35:08,来自湖北,6920222422,永刚18
7127534985514369807,幼儿园没有保安吗。？,0,1,0,2022-08-03 14:36:42,来自浙江,73103379865,智者孔雀zZ
7127533470175511311,老师园长保安干什么去了,0,0,0,2022-08-03 14:30:57,来自北京,68036223697,儒雅冰淇淋qH
7127534333396697890,必须严惩不贷凶手,0,0,0,2022-08-03 14:34:16,来自山东,60950921637,宏硕集团
7127533723704279845,这里行凶，那里行凶,0,0,0,2022-08-03 14:32:15,来自浙江,52357075650,白龙出游
7127535504023028484,幼儿园的保安干啥去了？是不是在午睡[抠鼻][抠鼻],0,0,0,2022-08-03 14:39:32,来自浙江,71748324253,副站长2239480209
7127533185231618816,还好幼儿不能还手，不然就是互殴了,0,1,0,2022-08-03 14:29:59,来自江苏,68781207141,xxouterman
7127536962436776719,为什么杀人呢？,0,0,0,2022-08-03 14:44:27,来自内蒙古,3404564249189584,无双枫叶6Y
7127529496873321248,我草，🈶搞幼儿园,0,0,0,2022-08-03 14:15:55,来自江苏,4960415703,ChawYY
7127532896994722564,幼儿园保安人员干嘛！,0,1,0,2022-08-03 14:29:27,来自湖北,4495173602,富特
7127538252819104543,最近杀人事件这么多,0,0,0,2022-08-03 14:50:08,来自山东,6167546508,凯撒亮gx
7127536666340082462,近期负面的消息太多了，整个人都不好了。,0,0,0,2022-08-03 14:43:41,来自湖北,2449347841635475,小小马过河的妈
7127534029326353159,假期是谁准许幼儿园开学的？,0,0,0,2022-08-03 14:33:19,来自湖南,62563344658,詹中和
7127533433207292683,为什么要对孩子们下手,0,0,0,2022-08-03 14:31:44,来自辽宁,61262050434,坦荡进取西柚
7127530622553883431,恶魔在人间，天网恢恢，疏而不漏，望严惩,0,4,1,2022-08-03 14:20:48,来自江西,58768704347,印飞love
7127536612308812551,不光要缉凶，而且在校园安全方面要问责。,0,0,0,2022-08-03 14:43:24,来自陕西,92766723109,无名63281
7127534820305027875,幼儿园的小孩招谁惹谁了？这些人啊......,0,0,0,2022-08-03 14:36:05,来自广东,111584719045,深圳14年的深漂一员
7127534845722968868,太凶残了，必须伏法。,0,0,0,2022-08-03 14:36:44,来自江西,299544236799614,强烈不满和坚决反对
7127535600437658398,这个人是什么人？孩子伤亡情况？,0,0,0,2022-08-03 14:39:42,来自河北,3974817255,小飞30892225
7127529677261996815,性质恶劣，群情激愤，严惩不贷。,0,0,0,2022-08-03 14:16:08,来自贵州,96190546498,零零4077
7127534405614437120,为什么随便让外面的人进出幼儿园？？,0,0,0,2022-08-03 14:34:33,来自广东,50239551054,老酒鬼670
7127530468145398563,心里极度扭曲，防不胜防！可怜幼小生命[祈祷][祈祷][祈祷],0,2,2,2022-08-03 14:19:14,来自重庆,6074531366,伤深万悟
7127532122398950148,私人开的幼儿园安保没做好吧,0,1,0,2022-08-03 14:26:35,来自广西,5526924433,584377
7127533311291523852,只能去欺负幼儿园小朋友了吗，小朋友们太无辜了,0,1,0,2022-08-03 14:31:19,来自安徽,110798593444,执着的星空zj
7127535196555150083,私立幼儿园哪里来的保安！上私立幼儿园的都是老百姓，公立的幼儿园进不去啊！,0,0,0,2022-08-03 14:38:19,来自黑龙江,67225539534,清新圆月ju
7127533371358135074,最近犯病的咋这么多。幼儿园那么小的孩子能惹着谁。,0,0,0,2022-08-03 14:30:38,来自辽宁,1020759405765629,悠闲钢笔Oc
7127535613775037222,杀人犯也分好多种，杀幼儿的凶手最为懦弱无耻！,0,0,0,2022-08-03 14:39:56,来自江苏,67488835759,抓紧过
7127534989625295648,小朋友惹到谁了，毁灭人性的家伙！严惩不贷！,0,0,0,2022-08-03 14:37:33,来自贵州,2405371403832557,华华语
7127532876731826982,幼儿园没保安吗？,0,1,0,2022-08-03 14:29:24,来自广东,50270096830,快乐的百灵鸟2022
7127534681058870049,什么仇什么怨？拿无辜的孩子撒气？,0,0,0,2022-08-03 14:36:21,来自辽宁,479006774012516,蜗牛日志
7127532255333303053,很多家门口私立幼儿园没有保安,0,1,0,2022-08-03 14:26:40,来自吉林,54290127174,青藤书语
7127535098664583973,十恶不赦，严惩不贷[发怒],0,0,0,2022-08-03 14:37:42,来自广东,110789461048,网民潮起潮落
7127532186974077736,杀害无辜，严惩不贷！,0,1,0,2022-08-03 14:25:54,来自江苏,6221695455,淡泊宁静yzy
7127534567044449038,学校的保安希望是退伍军人，给正编，现在的保安，挡的住吗，大力都能推倒[捂脸]。这些孩子都是我们的未来啊！,0,0,0,2022-08-03 14:35:22,来自浙江,5234126447,阿欢50795091
7127534493447635746,近几年幼儿园发生的杀人案不少，以发生都严，不发生都松,0,0,0,2022-08-03 14:35:00,来自河南,65034848262,快乐荷叶tg
7127537063763034910,去幼儿园嚣张什么？,0,0,0,2022-08-03 14:45:18,来自辽宁,52214208938,阿来要增重
7127529978647823104,太凶残了可怜的孩子和家长早早抓到凶手,0,0,0,2022-08-03 14:17:14,来自陕西,105738777890,悠闲爱唠叨的王奶奶
7127535742603756321,无论哪个幼儿园都不应该让无关的人钻进去,0,0,0,2022-08-03 14:40:43,来自贵州,4270119060253198,小莫石
7127536569946686216,抓住必须严惩[抓狂],0,0,0,2022-08-03 14:43:23,来自广东,4208548216578903,乡下r农民
7127531499364713247,十几年前就出现过一段杀害幼儿园小朋友的事情，从那时候开始，各个学校才加强了保安管理！,0,0,0,2022-08-03 14:23:57,来自山东,50597333241,不好意思16
7127535742557324067,幼儿园学校的安全保卫工作一定要由教育局指定单位来配置，也可以将幼儿园和学校的安全保卫人员定位事业编制终身。,0,0,0,2022-08-03 14:39:44,来自青海,71301288947,避风的港湾79
7127533067237376809,幼儿园不放假，这是关键，第二保安呢，第三老师呢，,0,1,0,2022-08-03 14:29:30,来自陕西,3157432199809437,农村年轻人kk
7127531903926158115,不知道具体情况不乱猜，只关心严惩恶徒，保护好幼儿童！,0,0,0,2022-08-03 14:24:53,来自江苏,6006280490,太平盛世12321
7127528622432617256,[震惊][震惊][震惊]是值班的老师还是违规办学收的幼儿,0,8,0,2022-08-03 14:12:06,来自广东,12862120334,胜仔5693
7127536111098364680,拿最弱小的孩子出气，卑鄙懦弱，必须严惩！,0,0,0,2022-08-03 14:41:42,来自山东,93804471334,汶水西游
7127529718551413519,对小孩下手，乱伤害无辜真可恨！,0,6,0,2022-08-03 14:16:31,来自广东,98137091402,阿仁管业
7127531430330254110,保安的钢叉辣椒水呢,0,1,0,2022-08-03 14:23:24,来自河南,6990821440,喝奶吗
7127535612500525839,这些小朋友家长老师心理阴影以后怎么办,0,0,0,2022-08-03 14:39:25,来自湖南,835270467927416,胡萝卜哈哈哈哈哈哈哈
7127537303190831872,没配警械的保安也是空设,0,0,0,2022-08-03 14:45:53,来自福建,2802030784287600,聪慧松鼠Uw
7127537283905159944,新闻简单事态严重,0,0,0,2022-08-03 14:46:03,来自广东,101224713786,花都湖南人
7127535963878048553,幼儿园的安保力度怎么这么差呢,0,0,0,2022-08-03 14:40:38,来自山东,2880345706601883,春天和煦1970
7127533903623635743,安全疏忽，出人命，都是孩子們……。,0,0,0,2022-08-03 14:33:06,来自上海,4582827885,乐观的风声Pq
7127534591170134816,真是防不胜防，学校幼儿园的安保不能只是摆设,0,0,0,2022-08-03 14:35:53,来自重庆,60916309620,路踩坪
7127537084902163213,对社会不满？,0,0,0,2022-08-03 14:45:22,来自云南,5810048233,柠月如风i
7127532018480481024,现在的保安都是年纪大的，自己还走路喘气的，遇到突发状况反应慢,0,2,0,2022-08-03 14:25:13,来自河南,62705477123,睿智的事事通
7127537153071923968,我想问的是 现在不是放暑假了吗？,0,0,0,2022-08-03 14:45:05,来自湖北,3043865822062911,cute1吧
7127528496632808223,美国枪击案频发,1,8,1,2022-08-03 14:12:07,来自江苏,64538713095,五官小郎将
7127536641698612008,学校的保安在哪里？,0,0,0,2022-08-03 14:43:22,来自广东,4585941227,周生生44877053
7127529411225846565,作为安福人，安福居然以这种方式出名,0,7,1,2022-08-03 14:15:26,来自江西,57842181944,高冷菠萝l2
7127530932043072294,必须要严惩，立即公审。,0,0,0,2022-08-03 14:21:59,来自湖北,102288554112,蕲骆
7127536002159198991,伤的都是什么人啊,0,0,0,2022-08-03 14:40:38,来自广东,3214619025082701,诗意花猫7y
7127533071804564237,保安在干嘛？,0,1,0,2022-08-03 14:29:43,来自浙江,64524083660,纳菲尔一世
7127536622073692943,浮躁的世界，戾气太重 ，以后保护好自己吧,0,0,0,2022-08-03 14:43:15,来自天津,6323389998,顶级喜鹊V9
7127536223723946785,天啊，可怜的孩子们[流泪][流泪],0,0,0,2022-08-03 14:42:33,来自安徽,6599564242,淡泊看尽世间百态
7127531228508766991,保安是看管业主 外卖 快递的 等坏人来了早就跑了,0,2,0,2022-08-03 14:22:16,来自北京,67367308630,消磨时间
7127533933478380329,幼儿园怎么不放暑假？,0,1,0,2022-08-03 14:32:44,来自浙江,1323446603358707,三为吾爱
7127536906367140642,报复性伤害,0,0,0,2022-08-03 14:44:10,来自广东,104944766314,白兰香419
7127535952372695823,好像私立的幼儿园都没有寒暑假,0,0,0,2022-08-03 14:40:35,来自北京,1679690468965880,┍兰兰
7127531793771217700,无论啥情况，都不该对幼儿园的孩子下手。,0,1,0,2022-08-03 14:24:56,来自贵州,1481783821218280,平凡是本
7127535502299071247,幼儿园不放暑假这是什么骚操作？,0,0,0,2022-08-03 14:38:47,来自湖北,54258212347,肉婶儿
7127534281454748416,私立幼儿园没养得起保安，小的幼儿园就两个女教师,0,0,0,2022-08-03 14:34:05,来自广西,3174998902054459,自由的面条Gs
7127534495242502920,幼儿园不是放假了吗？,0,0,0,2022-08-03 14:35:18,来自湖北,55673172169,不惑之梦8
7127533697720746759,怎么放行入园的，非工作人员是不能放行入园的[发怒],0,0,0,2022-08-03 14:32:16,来自广东,51853138929,nana134712600
7127537341798843176,保安在干什么？,0,0,0,2022-08-03 14:45:53,来自重庆,67107611261,梦中情人一枝花
7127534800726262564,幼儿园不暑假吗,0,0,0,2022-08-03 14:36:30,来自江苏,101370944139,落起奇
7127536675676357417,进入八月水火不容暗势力抬头，注意人身安全，做好防护。,0,0,0,2022-08-03 14:43:27,来自四川,65597202762779,可乐园Mk
7127535347391185704,现在幼儿园应该还没有开学吧，伤的是什么群体？,0,0,0,2022-08-03 14:38:21,来自福建,52387663007,李OK666
7127534988560155424,幼儿园的保安呢[流泪][流泪][流泪][流泪][流泪][流泪][流泪][流泪],0,0,0,2022-08-03 14:37:47,来自湖南,51306188778,温柔青山NN
7127530373315527464,孩子招谁惹谁了？此人应严惩不贷。,0,1,0,2022-08-03 14:18:58,来自山东,94482559288,邹城房产彭雨晏
7127531203690890015,朋友圈炸了,0,0,0,2022-08-03 14:22:27,来自江西,20722653444,菜蔡蔡徐坤
7127534664272904960,这有多大的仇冤啊？,0,0,0,2022-08-03 14:35:33,来自湖北,6050253038,董光汉
7127532428004197133,现在不是放假吗？,0,2,0,2022-08-03 14:27:14,来自江苏,5926409053,尼泥娃娃
7127536644752147241,这累事情为什么还会发生,0,0,0,2022-08-03 14:43:17,来自河北,71838318004,玮
7127532226195637007,动机是什么？,0,1,0,2022-08-03 14:26:10,来自上海,734121392607991,糯玉米的vlog
