7127582368000607013,这样的绝对要判死刑,0,3,0,2022-08-03 17:41:01,来自广东,25988573700291,嘻嘻Miao
7127588347689829161,强烈要求教育局监管改革幼儿园保安是退伍出现。,0,19,2,2022-08-03 18:03:50,来自广东,83170909238808,你个大茶壶
7127582390067086113,幼儿园的安保工作是怎么做的！丧心病狂的魔鬼应千刀万剐！,2,5,0,2022-08-03 17:41:33,来自山东,85510328417,向日葵67170
7127582626525381410,为什么这种畜生总是拿小孩子下手,0,18,0,2022-08-03 17:41:46,来自青海,716534656273704,勇敢的辰星gN
7127598257337336615,这是多幺凶残的人呀，千刀万剐不足以平民愤。,0,7,0,2022-08-03 18:43:17,来自江苏,3685181994841123,周平上清
7127574792965751559,千刀万剐都不解恨！,0,10,0,2022-08-03 17:11:36,来自四川,3302544178938372,礼礼狗
7127583393793704738,千刀万剐的人渣,0,2,0,2022-08-03 17:44:51,来自河南,67357022260,小吾666
7127554080041829157,无辜的幼儿园小孩,1,189,1,2022-08-03 15:51:27,来自山西,102519479310,妈妈咪呀酱油瓶
7127552355125854976,看到这种新闻，我的心疼的不得了，孩子还那么小，怎么下得了手的？,4,251,0,2022-08-03 15:44:18,来自上海,3735856764,佳佳_小囡囡
7127547371714167586,天哪，这个世界是怎么了？,10,134,0,2022-08-03 15:24:54,来自上海,51672471541,陈小懒姐姐
7127568931153314568,死伤的是成年人还是孩子？,7,5,0,2022-08-03 16:48:49,来自四川,51113187966,暮霭opus
7127568930755511052,这人太缺德啊！对孩子下毒手！,4,136,0,2022-08-03 16:49:30,来自黑龙江,88443802070,可靠橙子YQ
7127576688905159437,幼儿园没放暑假吗？,2,3,0,2022-08-03 17:19:15,来自北京,54720505066,会飞的蜗牛儿189
7127543247174009630,为什么要杀这么多人，和谁有仇。,1,7,0,2022-08-03 15:09:20,来自广东,53217600957,才思敏捷豆浆e7
7127562785810170658,报复社会？,2,55,0,2022-08-03 16:24:37,来自北京,92577267546,瑞贝卡的兔子
7127556947980747558,怎么进去的幼儿园，可怜的孩子,2,9,0,2022-08-03 16:02:32,来自山东,3979867460996536,鼻炎lucky福星
7127562353855660812,希望警方尽快抓住凶手！这种身负命案的人在逃是非常危险的！,1,42,0,2022-08-03 16:23:44,来自湖北,4107368447089204,赫萝HL
7127572632316674854,现在学校的保安都应该选年轻力壮的，突发状况能够快速制伏歹徒，减少伤亡！,5,16,0,2022-08-03 17:03:38,来自重庆,50259019170,善良是一种品德
7127553790815060747,现在幼儿园学费那么贵，随便拔点钱注重安保力度，找年轻力壮的保安总要好点,1,21,0,2022-08-03 15:50:18,来自浙江,74879023939,奋发有为辰星Qd
7127587925319205669,幼儿园随便的人都能进去吗,1,3,0,2022-08-03 18:02:41,来自山东,16296787607,Lucky嘎嘎
7127556842242360105,当了妈之后，根本看不了这样视频，[祈祷],5,52,1,2022-08-03 16:01:38,来自山东,1363040296253725,艺诺滴
7127566835520340739,为什么又是对幼儿下手啊，幼儿园的宝安去哪里了啊！还不吸取教训加强学校的安保措施吗？,2,1,0,2022-08-03 16:41:17,来自湖北,79973086005,絔合兲稥
7127546076403729190,我见过的幼儿园隐患都很大，不出事麻都好，出事了哭到晕,1,33,0,2022-08-03 15:20:42,来自广西,632929444183719,暖暖7GA4
7127600075932779294,他是怎么进到幼儿园里面去的？[what][what],1,1,0,2022-08-03 18:49:52,来自辽宁,109734461646,co乄co
7127558810809942824,幼儿园没放暑假？,3,14,0,2022-08-03 16:09:24,来自广东,105617112903,胡说八到
7127556745488253733,保安三大原则：怼业主，吼外卖，遇到危险往后退,4,29,0,2022-08-03 16:01:34,来自贵州,68194371621,雨水一盒吧
7127562432998507303,为什么还会发生这种事？,2,14,0,2022-08-03 16:24:23,来自北京,50089632998,莱维3
7127567319471063839,小学幼儿园都有配了器材的保安呀！！罪犯肯定跑不掉，问责肯定是一大片！,3,9,0,2022-08-03 16:42:31,来自广东,53288927147,武林豪杰1111
7127574340510040866,三个保安加起来还没5颗牙，谁保护谁,1,16,0,2022-08-03 17:09:42,来自云南,50496960802,叶冷卿
7127573190578422569,今天的事么？不会是昨晚的事引起报复社会的吧,2,6,0,2022-08-03 17:05:05,来自河南,6994747444,答案8118776
7127562568684241705,暑假，幼儿园不应该放假了吗,2,3,0,2022-08-03 16:24:04,来自江苏,2950679005497676,吹妖风
7127549179119469353,我就想问一下，现在是暑假怎么回事？怎么回事？,1,8,0,2022-08-03 15:32:02,来自江西,21695408489,老顽童129724829
7127560203654677288,丧心病狂啊,0,38,0,2022-08-03 16:14:48,来自江苏,2080696407438903,拾月拾貳
7127589092225450792,我老家县城,0,3,0,2022-08-03 18:07:00,来自浙江,1798427573489214,左撇子花花
7127567397774934819,幼儿园大门锁么？怎么进去的,1,1,0,2022-08-03 16:42:41,来自江西,2326187813390940,自强不息钢笔iY
7127575123351175974,看了警察抱着孩子跑，眼睛就发酸了，哪家父母要是遇见这样的事，不得疯了啊，恶人如此残忍，对幼儿园孩子进行伤害，良心何在？,0,2,0,2022-08-03 17:13:06,来自安徽,2493316546180958,云自在的简生活
7127549370341376768,强烈呼吁恢复严打！,2,32,0,2022-08-03 15:32:34,来自陕西,53524765732,魔法雪梨tn
7127553775258092327,幼儿园安保在哪里，小孩子好可怜[祈祷][祈祷][祈祷],3,3,0,2022-08-03 15:50:19,来自广东,93178037303,我是大哥卢
7127582342717899554,看着这个封闭式的门口，，歹徒怎么进去的！！！可怜的小朋友[流泪][流泪]，现在不是放暑假了吗,0,16,0,2022-08-03 17:40:44,来自四川,92659971388,摆脱该死的生活
7127543721402794787,3000一个月的保安，真的保护不了人,2,18,1,2022-08-03 15:10:43,来自四川,549373438599275,单纯风声Y7
7127588565995258638,就想问问凶手是怎么进的去幼儿园的，这是幼儿园管理问题,0,8,0,2022-08-03 18:05:14,来自湖南,103435824221,田螺7732
7127539043780461352,天杀的，竟然去伤害这么小的孩子,0,3,0,2022-08-03 14:52:32,来自江苏,105010584012,老黄同学
7127555447837901568,不是放假了，幼儿园还有小朋友？,2,6,0,2022-08-03 15:56:14,来自福建,50420431102,无与伦比130147480
7127566992684892943,必须要有专业安保人员。,1,2,0,2022-08-03 16:41:09,来自山东,6986946440,小孩子2010
7127550615253418793,不管什么原因，斩立决,1,4,0,2022-08-03 15:37:37,来自浙江,2854340271,顿易居士
7127543721402794787,3000一个月的保安，真的保护不了人,2,18,1,2022-08-03 15:10:43,来自四川,549373438599275,单纯风声Y7
7127577847258088224,这个时间是正在上课的时候，怎么进去的？老师没和幼儿在一起吗？,1,0,0,2022-08-03 17:23:51,来自河南,4230526203869740,端庄春风GK
7127575123351175974,看了警察抱着孩子跑，眼睛就发酸了，哪家父母要是遇见这样的事，不得疯了啊，恶人如此残忍，对幼儿园孩子进行伤害，良心何在？,0,2,0,2022-08-03 17:13:06,来自安徽,2493316546180958,云自在的简生活
7127587231128519439,他怎么进去的？幼儿园不是不能随便进去的吗？,0,7,0,2022-08-03 17:59:35,来自河北,2744822349184328,舞动桦甸8f
7127594226535695112,幼儿园保安呢？竟然还让罪犯跑了？可怜的孩子们[流泪][流泪][流泪][祈祷],0,0,0,2022-08-03 18:27:21,来自江苏,85478005460,风趣888w
7127539705377358623,心痛！心疼！可怜的孩子们,0,3,0,2022-08-03 14:55:27,来自河北,23696810188,李丽霞15
7127579657260073742,孩子越来越少，国家真的应该多办公立幼儿园。私人幼儿园条件差。,0,8,0,2022-08-03 17:30:40,来自江西,52223378402,亚瑟摩根和达奇
7127582381600015134,太像罗志祥了[捂脸],0,1,0,2022-08-03 17:41:07,来自上海,742911912974749,用户雨歇
7127588932191028002,学校出的安保费用不低，都被保安公司扒皮了，所以他们用低工资招岁数大的人来用，明白吗,1,4,1,2022-08-03 18:06:07,来自北京,3368495730138061,一杯倒满的水
7127598796976243495,这个犯罪嫌疑人为什么那么凶狠呢？杀死3个小孩！受伤6人！在逃中，抓获必须严惩不贷！,0,1,0,2022-08-03 18:45:13,来自重庆,6073074983,君威君臣
7127601558228878115,现在的幼儿园保安大部分都是老弱病残根本起不到什么作用,0,0,0,2022-08-03 18:55:04,来自山东,70334711732,晨晨274575059
7127579739308573455,又是幼儿园,0,3,0,2022-08-03 17:30:30,来自山东,1857215836,半仙侠客
7127589214107140899,再大的委屈也不能伤害无辜,0,5,0,2022-08-03 18:07:18,,58507465121,上进的橙子sK
7127598364996354855,幼儿园小学中学，所有学校要加强保卫，这种教训已好多了，为什么不引起重视,0,0,0,2022-08-03 18:43:24,来自浙江,118382856765547,直率星球xR
7127602381399212815,恶魔呀！干嘛对孩子下手,0,0,0,2022-08-03 18:58:25,来自河南,64005675409,玉霞256018495
7127588180517290786,"是作为家长入校还是作为社会人员入校？
判断是个人问题还是学校管理问题",0,1,0,2022-08-03 18:03:08,来自福建,59852308876,冷落尘尘
7127597122563752737,不是暑假嘛？？,1,1,0,2022-08-03 18:38:31,来自广东,87427199170,韭菜的成长记007
7127579553119175464,不是暑假吗？幼儿园还上学？,0,0,0,2022-08-03 17:29:45,来自湖南,109817427311,卉宝宝🥰
7127565098767565583,幼儿园安全一定要重视，孩子小连躲避都不懂,0,4,0,2022-08-03 16:33:38,来自河南,6681301193,真滋味儿
7127577016148230952,现在不是放假吗,0,0,0,2022-08-03 17:19:50,来自广东,58566080357,嘉仪39
7127602006017278732,[发怒]太可恨了,0,0,0,2022-08-03 18:57:41,来自辽宁,106916032997,土豆不搬家
7127603114487595816,幼儿园不是放假吗？,0,0,0,2022-08-03 19:01:08,来自广东,5735506065,62160966
7127575234752054047,心痛[流泪][流泪]可怜的宝贝，还那么小[流泪][流泪][流泪],0,3,0,2022-08-03 17:13:25,来自山东,110676952367,南方的风经不起北方的
7127592627423888169,幼儿园为什么让他进去,0,0,0,2022-08-03 18:20:39,来自山东,53251699634,皓轩心心
7127596427278517004,谁惹你了，去攻击谁！对孩子下手算什么本事。正义永远不会缺席！,0,0,0,2022-08-03 18:36:05,来自四川,68194087871,奋发有为的茉莉花
7127579317948908323,私立的幼儿园 为了挣钱 7八月不放假 全国很多,1,1,0,2022-08-03 17:28:54,来自黑龙江,5924892115,星虫子
7127592243623494403,要靠严明的法律，而不是保安,0,0,0,2022-08-03 18:19:32,来自江苏,110390620827,金陵萍踪侠影
7127596407292773160,学校不是放假了吗？,0,0,0,2022-08-03 18:35:17,来自江苏,2422920434960883,家有大小宝哦
7127601637157372680,现在的人怎么了,0,0,0,2022-08-03 18:55:39,来自广东,105190705598621,bu酸的柠檬
7127585490261541670,太缺德了，对小孩子下毒手！,0,0,0,2022-08-03 17:53:34,来自河北,100514434696,祝福zCdU
7127602305720992523,幼儿园没有保安么？,0,0,0,2022-08-03 18:58:38,来自广东,734094482218083,雅轩CHERRY
7127592718234239784,幼儿园也有责任吧,0,0,0,2022-08-03 18:20:48,来自山东,53251699634,皓轩心心
7127547295881184012,要用重典了,0,17,0,2022-08-03 15:25:29,来自北京,86365584883,勇敢的微风Yo
7127573284153328418,追凶，严惩[发怒],0,4,0,2022-08-03 17:05:26,来自四川,3702844289,雨落无声520
7127593603345777441,感谢为保安说真话，实话。当今社会现壮确实存在很多问题，比如说年纪大，工作低！保安形同虚设。但要改变这一现壮，首先要得到社会的认可。,0,0,0,2022-08-03 18:25:02,来自云南,7065598673,吃草的鹰vs小兮
7127540508440265487,我能感受，父母双职工，家里没人带娃，就把娃托管在学校，呜呜，可怜了孩子,0,0,0,2022-08-03 14:58:25,来自四川,61121295138,小亭子2015
7127590912418661152,放暑假了，幼儿园里还有孩子吗？,0,0,0,2022-08-03 18:14:30,来自安徽,6818391017,李韵秋1
7127596292825989891,凶手怎么进去的，可怜的孩子们[祈祷][祈祷][祈祷],0,0,0,2022-08-03 18:35:36,来自辽宁,107774184105,善良的晨风
7127574015392547624,孩子爸爸妈妈有多绝望,0,1,0,2022-08-03 17:08:19,来自河南,109705598782,步履不停2022
7127568426628875042,孩子可怜！,0,1,0,2022-08-03 16:46:28,来自河南,75226866266319,塔拉的春天
7127585065970238215,为什么呢，难道就没有设防？这不是第一次发生这样的事啊，应该引起警觉了！[祈祷][祈祷],0,1,0,2022-08-03 17:51:45,来自江西,98378206925,赣南红橙恋歌
7127579188961690407,孩子现在不是正在放假期间吗？,0,0,0,2022-08-03 17:29:07,来自贵州,111642843369,素颜S避风塘奶茶店S
7127600356615422735,现在不是暑假假期吗？,0,0,0,2022-08-03 18:50:26,来自广东,85304649804,蓝色的梅子
7127600232401011497,幼儿园没放假吗,0,0,0,2022-08-03 18:49:54,来自浙江,105956448116,阳光朋友1964
7127566485656306473,小孩子真的可怜,0,7,1,2022-08-03 16:39:06,来自河南,109705598782,步履不停2022
7127594361461752616,幼儿园暑假还上课？,0,0,0,2022-08-03 18:27:13,来自浙江,103821461855,孙海洋家的坚决拥护者
7127561757640065822,冤有头债有主，欺负弱小算什么本事,0,44,0,2022-08-03 16:21:26,来自山东,86005263663,爱钓鱼的兔子先生
7127567808502055694,学校不放假吗？,0,0,0,2022-08-03 16:44:36,来自山东,51690386354,素梅142485891
7127583267641541408,保安也有责任，负主要责任，,0,0,0,2022-08-03 17:45:02,来自四川,5903836096,俊俏风铃16
7127563358429233952,为警察点赞,0,4,0,2022-08-03 16:27:39,来自四川,96572115668,可靠饼干RG
7127597747708445474,学校应该配备保安,0,0,0,2022-08-03 18:40:25,来自陕西,54709370193,穿透心灵的冰9997
7127590816977437452,不是放暑假吗？,0,1,0,2022-08-03 18:14:18,来自江苏,10749476161,寒雨130410878
7127593193004368653,好心疼啊！,0,0,0,2022-08-03 18:22:54,来自山西,104576574629,路路10834
7127594069362475779,咋回事，可怜了孩子,0,0,0,2022-08-03 18:26:53,来自陕西,62629695469,热～Dilvab
7127585639335314187,太气人了，怎么下得去手啊,0,0,0,2022-08-03 17:54:02,来自内蒙古,3692043846,王剪刀
7127589244419326723,孩子还那么小，怎么下得了手的？,0,0,0,2022-08-03 18:08:04,来自广东,96355059541,qni小妮
7127592018062738214,大叔保安，一会保护自己的工资打发退休的无聊时间,0,0,0,2022-08-03 18:19:00,来自陕西,4583007837,白石岭鹿人
7127561807933915942,幼儿园的保安都是六七十岁手老病残,0,17,0,2022-08-03 16:21:45,来自广西,5725044514,yuan28
7127590280605631269,孩子们太可怜了[可怜][流泪],0,0,0,2022-08-03 18:11:49,来自河北,3447664070624840,才高八斗橙子S
7127570392310547204,看了心难受，幸福的家没了。[祈祷][祈祷][祈祷],0,0,0,2022-08-03 16:54:48,来自山东,2546097169907052,信佛的老头
7127598496098140959,难过啊，怎么对孩子下得了手,0,0,0,2022-08-03 18:43:55,来自云南,62465954444,浪花淘气堡
7127595241641001766,幼儿园老师待遇太低了，大多才三千块，,0,0,0,2022-08-03 18:31:32,来自湖北,7961391863,金猪猪35
7127596618782360358,什么原因也不能对孩子下如此毒手啊,0,0,0,2022-08-03 18:37:03,来自湖南,3116771395,小眼睛的螃蟹
7127563637769634594,这个过分了。别的都能忍，这个有点忍不了了。[发怒],0,22,1,2022-08-03 16:27:57,来自北京,6586592188,天堂戰車
7127598319869854471,保安那里去了,0,0,0,2022-08-03 18:42:59,来自广东,1772046940897437,麦芽糖汁
7127577247145427726,好像时间管理大师…,0,0,0,2022-08-03 17:21:09,来自湖北,6288073954,马大哈jj
7127586287133000484,为什么要伤害孩子[发怒],1,0,0,2022-08-03 17:56:16,来自山东,52812053751,水上森林z
7127566687465358095,怎么进去的,0,0,0,2022-08-03 16:39:55,来自广东,57823295988,弥儿周
7127539046217728799,幼儿园的孩子招谁惹谁了[流泪],0,1,0,2022-08-03 14:53:05,来自黑龙江,4226175104189299,风中dechengnuo888
7127568637259105038,学校幼儿园安保必须要加强了，不然别开了！！！,0,7,0,2022-08-03 16:47:58,来自上海,58124950007,a䴑看
7127583838595138337,唉，痛心疾首,0,3,0,2022-08-03 17:47:12,来自河南,2942733700313200,WO喂自WO袋盐
7127540281855705890,第二个娃娃都晕厥了[流泪],0,0,0,2022-08-03 14:57:34,来自江苏,11961387341,婳欣IE
7127550190587806503,看你们说大叔保安保护不了孩子真的想笑，你敢保证年轻力壮的遇见持刀的歹徒不会撒腿就跑？不会腿软？运钞车一样有被抢的，与歹徒搏斗需要依靠的是大众的力量，还有公安局派出所可以在学校设立警务值班室。,0,16,2,2022-08-03 15:36:22,来自山东,4304534512,我试试名字能取几个字
7127581066512237312,太痛心了！必须严惩不贷！,0,0,0,2022-08-03 17:35:38,来自福建,95032225423,淡雅清茶来一杯
7127578392446665504,他怎么进去的？,0,0,0,2022-08-03 17:26:00,来自河南,4212443545,用户名已备用
7127572946520523556,受害孩子的家长怎么活啊,0,0,0,2022-08-03 17:04:37,来自内蒙古,3368512380744611,梦幻枫叶mQ
7127591469519061800,我建议幼儿园强制配置一个跆拳道或者拳击资质的长期在校体育老师。,0,2,0,2022-08-03 18:16:08,来自河南,5972392688,善恶终有报b3
7127540167161824040,可怜的娃娃，这男人真是罪大恶极,0,0,0,2022-08-03 14:56:51,来自江苏,11961387341,婳欣IE
7127575673082118948,看到这样的消息，很痛心。小孩子天真可爱，何其无辜何其不幸。对于这种反人类的恶罪，我认为应该立法，罪及犯罪分子的家人和子孙，对这种人还讲什么法治文明。犯罪代价太低，反而助长犯罪分子的气焰。,0,2,0,2022-08-03 17:15:13,来自四川,3655521495,林潾麟
7127567421501702953,社会问题严重呀，反思。,0,4,0,2022-08-03 16:42:42,来自云南,65405589409,水197473481
7127577829420057356,太心疼了[发怒][发怒],0,2,0,2022-08-03 17:23:48,来自北京,103466730720,道法自然2305
7127556035220685607,一定要严i重惩罚,0,2,0,2022-08-03 15:59:19,来自河南,110793970098,一点青山一片红
7127550729414001423,对弱小孩子下手，一定要严惩,0,14,0,2022-08-03 15:37:58,来自江西,80733953301,大千世界2020
7127547391980765952,怎么进去的？不是走不进吗？,0,4,0,2022-08-03 15:24:53,来自上海,1429815150775997,静儿
7127563085724320526,现在学校和幼儿园安保都是很严格的，当地这家幼儿园怎么回事？,0,7,0,2022-08-03 16:26:29,来自北京,5956453238,日出东方qZMi
7127545953837384460,安福出名了,0,8,0,2022-08-03 15:19:55,来自江西,110449097253,可靠小红花Xb
7127585239803298573,为什么是小孩[发怒],0,0,0,2022-08-03 17:52:26,来自北京,86969111491,家有高二孩子头疼
7127537883451343657,好心痛那些孩子,0,0,0,2022-08-03 14:47:59,来自重庆,53230003559,绿色家园zhb
7127572181965456141,他咋进去的？,0,1,0,2022-08-03 17:01:30,来自天津,105604644535,我是糊涂的大聪明
7127578942055711526,可怜的娃，暑期还在幼儿园托管的都是家中没老人带孩子，父母又要上班的，太心痛了！,0,4,0,2022-08-03 17:28:15,来自广东,104002271954,悠闲光辉岁月
7127553549076284201,那么小小的一个人儿怎么下的去手[流泪][流泪][流泪],0,1,0,2022-08-03 15:48:52,来自四川,1138695030177979,糯米汤圆儿
7127566777626247950,报复社会伤害无辜的人，哪怕他有再天大的冤屈都不值得同情了。[我想静静],0,4,0,2022-08-03 16:40:49,来自广东,1302279757504839,黑夜明月
7127583174426772239,国内幼儿园没有保安，都是看门老大爷，跑几步都会喘的那种,0,0,0,2022-08-03 17:43:46,来自广东,93894686982,哥哥使不得
7127563020435505951,报复错对象了！,0,6,0,2022-08-03 16:26:04,来自江苏,2370200161495470,有啥说啥不磨叽
7127555058564825869,性质好恶略，支持严打。,0,2,0,2022-08-03 15:55:17,来自北京,97108401568,微笑前行JIfg
7127582324233224991,安保措施及老师的应急处突能力还是不得行,0,0,0,2022-08-03 17:40:56,来自广西,4234960081267927,爆护值动动幺
7127595872707625762,幼儿园不都是封闭管理的吗，怎么进去的,0,0,0,2022-08-03 18:33:11,来自北京,3852454933,海洋loveY晨victory
7127591304254997288,孩子都那么小,0,0,0,2022-08-03 18:15:27,来自河南,67546134759,安阳小李
7127555777644561167,穿得这么诡异，怎么进去的,0,0,0,2022-08-03 15:57:38,来自广西,3483717322422308,波动母心
7127556590496170790,逃窜哪去了？,0,1,0,2022-08-03 16:01:30,来自江西,3017765763,123456佳j
7127601540487578383,老年保安不能去学校当保安,0,0,0,2022-08-03 18:55:12,来自浙江,109932594016,足智多谋溪水I5
7127558502641648384,学校还没放假,0,1,0,2022-08-03 16:08:07,来自四川,100119739134,红牛961
7127592773314331392,我一姐她自己开的私立幼儿园，她给保安公司的是，一名保安6000－7000，实际保安大叔能拿到的也就2500左右。,0,1,0,2022-08-03 18:21:11,来自湖北,6816826225,阿卡斯基
7127560430591197990,幼儿园老师的工资也不过两三千而已，保安的只会更低。在这种情况下能指望有身强力壮的年轻人来当保安？,0,13,0,2022-08-03 16:16:18,来自天津,5803754401,浣de熊
7127569960729412388,在逃，这是一颗极度危险的不定时炸弹。,0,2,0,2022-08-03 16:52:56,来自广东,104771260379,老子不是病猫
7127568622323254027,都是对社会不满，,0,3,0,2022-08-03 16:48:14,来自福建,2428176029980222,绝绝视觉
7127602506494460685,保安属于劳务外包，政府购买服务，劳务公司还要从中牟利。,0,0,0,2022-08-03 18:59:26,来自江苏,108723306410,aaaaloha
7127601161909682958,学校招保安要学生分摊，楼主好人才,0,0,0,2022-08-03 18:54:16,来自广东,50990948236,北宮南樹
7127599304416035624,校园安全，还不重视吗？这是多少次血的教训了？？？？,0,0,0,2022-08-03 18:46:27,来自广东,52317539753,52度酒精消毒
7127601625446908683,现在的保安就是看门，那么就要问了，好好的门看着它干嘛,0,0,0,2022-08-03 18:55:57,来自河北,1591685032973982,潇洒书签4
7127571322733544227,请大家仔细观察，幼儿园的保安都是老爷爷。,0,2,0,2022-08-03 16:57:56,来自广西,3974520543,MENGHEI
7127587701112554274,门口没保安？还是没有门？,0,0,0,2022-08-03 18:01:25,来自广东,3692334262,头条专业用户
7127603420995093289,太伤心了，小孩子一点反抗能力都没有，让坏人肆意砍杀。,0,0,0,2022-08-03 19:02:24,来自江苏,4310502396138736,WAJUeJi
7127603035966653199,从昨天气到现在，刚好一点又TM气的要死,0,0,0,2022-08-03 19:01:03,来自山东,4372082604649454,设计师鹏程
7127569586564186892,又是报复社会？,0,1,0,2022-08-03 16:51:49,来自江苏,51682196385,真抠门
7127602882283045669,严惩凶手！！这种伤害幼儿的人根本不配为人！,0,0,0,2022-08-03 19:00:48,来自四川,58051076107,彦五少
7127601623098704670,看到这样的新闻真是很心痛，一定得加强幼儿园安保,0,0,0,2022-08-03 18:56:03,来自重庆,1355018365570392,单纯饺子Ww
7127589088928367374,学校保安在哪里，遇到这种事，不应该是保安挡在前面嘛。为什么受伤的都是老师孩子,0,0,0,2022-08-03 18:07:13,来自浙江,111042357164,卡鲁塔
7127590514107040551,保安：退休后再就业的不二选择。,0,1,0,2022-08-03 18:13:09,来自湖北,3297421896,wujuenjie
7127554143455396643,心疼🙏阿弥陀佛,0,1,0,2022-08-03 15:51:16,来自河北,111198784843,妙音伶人
7127566127315747625,大叔保安，自保都费劲，还保护别人,0,9,0,2022-08-03 16:37:42,来自浙江,50332495335,正在路上66666
7127590307617325861,好不容易孩子3岁可以上幼稚园 家长可以休息下 ……结果…………,0,0,0,2022-08-03 18:12:02,来自湖北,51827823597,真帝一一
7127591541275198219,赚不到钱是原罪，很多赚钱的机会都被垄断了,0,0,0,2022-08-03 18:17:11,来自浙江,1446594370875236,恒春鱼饼店
7127568746872685327,为什么啊[流泪],0,3,1,2022-08-03 16:47:49,来自浙江,51439875776,多少岁月可回头1
7127602484876477188,支持选择退役军人作为安保人员。同时兼顾军事教育,0,0,0,2022-08-03 18:59:15,来自广东,5413904882,梦风-小子
7127558342582600481,儿童之家属于托管 不是正规幼儿园,0,3,0,2022-08-03 16:08:07,来自贵州,53064001830,金阳2011
7127562841783763725,无非三种情况：报复社会，精神病，私人恩怨,0,1,0,2022-08-03 16:25:25,来自重庆,66333265552,子非鱼动漫
7127591517723640606,最不愿意看到这样的新闻但还是娄娄发生，幼儿圆是弱势群体部门，安保工作值得重视与深思……,0,0,0,2022-08-03 18:16:32,来自广西,52284040415,廖师傅48
7127596915902284548,现在父母都上班，孩子只能丢幼儿园,0,0,0,2022-08-03 18:37:54,来自浙江,105219335294,大洋人民
7127593356028871432,这种人是对社会不满吗？为啥对小孩下手呢,0,0,0,2022-08-03 18:23:46,来自浙江,94954459093,日本不灭烟酒不戒
7127590337820328715,现在幼儿园的保安都是一些老大爷没用,0,0,0,2022-08-03 18:12:25,来自广东,4380883149143040,热血青年盖布里埃尔1C5
7127601733475369732,我想问下懂法律的朋友，我看他了，气不过，打殘他了，我要赔钱负责吗,0,0,0,2022-08-03 18:56:23,来自广东,3108032171,不變堅持
7127585981981115136,幼儿园没放暑假？,0,0,0,2022-08-03 17:54:47,来自陕西,104543962608,大海36209
7127597720508269319,没配备保安吗？保安干啥去了？,0,0,0,2022-08-03 18:40:50,来自四川,102126079424,正直德鲁9
