7124227736889213737,可算饶过山东了,3,19,1,2022-07-25 16:43:09,来自山东,4406439926840878,灵植花园
7124166693484249887,河南西南部要旱死吗，已经半年没有下过雨了，每次下午都没有西南部,1,1,0,2022-07-25 12:46:43,来自河南,111451034022,小图图妈
7124235617948402432,大雨怎么不来南方啊[捂脸],2,4,1,2022-07-25 17:13:37,来自广东,88464993285,紫罗兰274909353
7124203093386298145,昨天北京报有冰雹，没冰雹挺好但连雨点都没有就差意思了,8,28,4,2022-07-25 15:08:35,来自北京,501853605353406,窦音頭窕
7124217391428797221,年年说高温，今年的专家猜对了,1,6,0,2022-07-25 16:03:25,来自湖北,79531779437,百業大本營
7124201374082564898,南方高温天气什么时候结束,3,12,1,2022-07-25 15:01:01,来自山东,677765788494119,花儿与少年156
7122972784796123944,这次有呼和浩特了，看到点希望！,2,1,0,2022-07-22 07:33:39,来自内蒙古,6115795977,新创农人
7124293608122909473,北方大范围降雨来袭，部分地区还有雷暴大风，局地暴雨。,0,0,0,2022-07-25 20:58:56,来自河北,2427322489640635,热情的光束1S
7124300840231404326,此轮降雨对农作物来说是太好了，正是拔节孕穗的时候，秋天一定大丰收,0,3,0,2022-07-25 21:27:08,来自山西,229162996479454,端庄优雅铅笔5N
7124205773122749216,天气预报，只是预报,2,13,0,2022-07-25 15:18:36,来自陕西,55156227349,15991281309
7124166903513776904,七下八上〈七月下旬八月上旬〉是首都北京和华北地区的主汛期，雨水多很正常，同时湿度高体感闷热请当地同胞务必做好防暑降温工作！[祈祷][祈祷],5,52,6,2022-07-25 12:47:27,来自北京,55183725109,帝都一帅137O128
7124206354919195403,艾玛，吉林市晚上睡觉的盖被[捂脸],2,3,1,2022-07-25 15:20:56,来自吉林,62297719198,轻舞飞扬177141084
7124208689414308642,今年的天气太反常，天气热而且雨很少，我们当地山上农作物全干死了，农民的收入减少很多。,1,10,1,2022-07-25 15:29:20,来自安徽,8152858005,home270531086
7124140428974162723,今年的天气预报颠覆了多少年来对天气预报的信任！,3,64,3,2022-07-25 11:04:08,来自河北,106261263652,潇洒原野32
7124172323284419339,我就不知道为啥，现在好多人，就爱喷天气预报，科学的发展，现在天气预报已经够准确了，天气预报本身就是大范围预报，一个县城甚至一个镇都不一样，这儿下那里就不下！,22,88,9,2022-07-25 13:08:47,来自山东,558141606214315,外向暖阳Dp
7124134685298787112,好，南方凉快了，接下来要台风暴雨上场了。,2,8,3,2022-07-25 10:42:02,来自上海,3888292527615000,无奈alUE
7124273173733868326,现在的天气预报太准了，[灵光一闪][耶],0,1,0,2022-07-25 19:39:49,来自河北,84346859201,舞动奇迹889
7124298427667923712,今年的天气太热了，热的反常,0,1,0,2022-07-25 21:17:10,来自湖北,78799600624131,车城探店
7124138942597251855,地里的庄稼希望下雨解渴，城市马路不渗水怕内涝，意见不统一，这雨是下还是不下老天也犯难,6,59,5,2022-07-25 10:58:40,来自河北,51209216061,加倍幸福1
7124161722377765636,又预报中到大雨了？,1,36,4,2022-07-25 12:27:24,来自天津,3984239082086455,阿平3631
7124150969792742178,"发现这两年天气预报就没有一回靠谱过！
还不如反向预报里，反向预报准的概率要高很多！",1,31,1,2022-07-25 11:45:00,来自河南,10529357821,华豫传人
7124214619719123724,广东不是最热滴？！！,0,0,0,2022-07-25 15:52:44,来自广东,2669217884158427,俺就想偶尔露峥嵘
7124180789893399330,夏天的雨没准，很难预报，可以理解，但也要有个差不多，农民太难，本来天旱想浇水，但预报最近三天都有雨，谁还愿劳神伤财去浇水，但三天过去了，一滴水没下，禾苗旱死了三分之一，过两天说没雨了，迀过浇吧，人力物力后，天下雨了，淹死了三分之一，又过几天预报说近几天有中到大雨，农民就忙着排水，可等了几天滴水没下，又旱死棵禾苗，乘几禾苗，秋后又说亩产千公斤，只能说可笑农民，天气预报你不懂,3,42,5,2022-07-25 13:40:51,来自河南,111130030141,用户吕向阳
7124168595831423781,现在天气预报还是比较靠谱的 ，当然天气预报不是百分之百准，天有不测风云，绝对准确来说很难的，能达到百分之八十以上就很不错了。,1,8,3,2022-07-25 12:53:55,来自内蒙古,3843527982973326,热情的辰星XC
7124154598822380319,"能不能准一次 哪怕一次也行
差的也太离谱了 说的暴雨大雨 到现在出来的是大红太阳 热死个人了",3,21,4,2022-07-25 11:59:27,来自陕西,54825131813,86唐伯虎点蚊香
7124118692912268072,密切留意临近预报预警，及时做好防雨措施，同时警惕局地强降雨可能诱发的山洪、泥石流、中小河流洪水等次生灾害。,0,14,1,2022-07-25 09:39:28,来自河南,3773937528880215,用户名中文网友全知道
7124176786258854671,从现在起，谁说有雨我和谁急，补贴如果能像高温一样及时送到就好了！唉，底层人就祈盼一场雨浇下高温，可暴雨却连连爽约，真所谓爱总是来到从不缺爱的人，钱也总流向不缺钱的人，苦也总少不了吃苦的人份。,0,13,0,2022-07-25 13:25:31,来自安徽,62374398975,有思想的烟
7124280232777171727,北方大范围降雨来袭，部分地区还有雷暴大风，局地暴雨。,0,1,0,2022-07-25 20:06:44,来自河北,1038361139360807,TsDonger
7124259370812605215,"闽南网头像闽南网,闽南网官方账号,,null江南华南等地高温天气持续 北方地区将有一次较明显降雨过程 全国未来三天天气预报",0,0,0,2022-07-25 18:46:26,来自福建,1412196747716109,小慧慧珍可爱
7124148626982421259,这个夏季截至目前南海以及西太平洋几乎没有台风生成，历史以来实属罕见,2,2,1,2022-07-25 11:36:48,来自广西,1420167828472347,幽默小鱼di
7124194084654465833,气候异常时间短越来越多了，保护环境，是当务之急，极端天气会影响农作物产量，民以食为天，从现在开始绿色出行减少碳排放量，功德无量！,0,4,4,2022-07-25 14:32:36,来自北京,2946306855942247,跟老赵学打板
7124276669267280652,河北邢台今天下午下大雨了，瓢泼大雨持续下了有20分钟，不知有多少毫米的雨量。,0,0,0,2022-07-25 19:53:34,来自河北,78657622022,希希qwe
7124199192763319047,有没有台风过来[发怒][发怒][发怒],1,1,0,2022-07-25 14:53:05,来自江西,104360367858,景德镇乡下伢
7124277371393442560,天气预报员现在改成气象分析师了，名字高大上没见准确度提高？,0,1,0,2022-07-25 19:55:30,来自北京,59145381980,zhinengziyuzile
7124177993408922401,挺准的一报有大雨暴雨天就睛！[打脸][打脸][打脸][打脸],0,9,0,2022-07-25 13:31:14,来自吉林,4390957984,P540906
7124166715218887464,现在的天气预报真不如七八十岁的老农民看天上的云彩准,0,25,2,2022-07-25 12:46:17,来自河北,52405136140,苍山如海20
7124158944020939551,天气预报都不可信了[灵光一闪],0,15,0,2022-07-25 12:16:35,来自天津,52811340640,渔樵176851772
7124151485792781060,有要开始了，北方雨水明显偏多了,1,9,2,2022-07-25 11:47:41,来自河北,462229755422871,天水玉豆洗衣液生产
7124190836824916771,天气的异常的极端恶劣高压增强高温？全国各省市县广大群众注意自己的健康的防中曙降温！,0,1,0,2022-07-25 14:20:09,来自浙江,3535679089541432,乐天派比三宝如意
7124246679419339520,专家不是说，我国北方不是出现大面积降温吗？你又说高温持续、北移。,0,0,0,2022-07-25 17:56:44,来自广东,5753203460,老家伙与小家伙
7124110449280975655,千万别预报！没一次准确过！！！,8,100,5,2022-07-25 09:09:10,来自北京,103620099434,雪原286087152
7124193852487238411,也不知道天气预报的雨都下在哪里了，热的要死，还说天天有雨,0,7,1,2022-07-25 14:32:29,来自北京,64008651778,漫不经心的潇洒最棒了
7124308931706946343,这个7月真热啊！从来没感觉有这么热过，一出门汗流浃背[黑线][黑线],0,1,0,2022-07-25 21:58:53,来自广东,1477390385823095,紫晗姑娘在南方
7124201379996467982,这个季节，下雨很平常，只是别遇到强对流天气。,0,2,0,2022-07-25 15:01:26,来自河北,3606032122908237,拨云见日云上看景and
7124212743657931552,极端天气频发，注意预防次生灾害！,0,7,1,2022-07-25 15:45:52,来自陕西,3492461954729172,雅典娜的惊叹985
7124244842926195470,我现在连手机上的天气预报都不看了，上周带了一周雨伞，结果连个雨滴都没下[捂脸],0,1,0,2022-07-25 17:49:58,来自辽宁,2832815067,莲净
7124219924381795108,局部有雨 下的地方叫局部 不下的地方叫局部之外 气象局靠什么评估绩效,0,8,0,2022-07-25 16:13:30,来自北京,52925239556,竹笋
7124217405911646991,广东这里超42度气温了！,0,1,0,2022-07-25 16:03:04,来自广东,69015335173,各抒已见18218013604
7124228575377146659,这场雨一定不小，这是季节性降雨，北方干燥几天了，下完这场雨进入中伏天，闷热难耐！天气预报只是说辞而已！报不报无所谓！雨肯定下，不下中伏会很凉爽！,0,0,1,2022-07-25 16:46:31,来自天津,111090365896,平工程师
7124216863974228751,河南洛阳报的有下午有阵雨雷阵雨⛈️，估计一会就要来了。,0,1,0,2022-07-25 16:01:09,来自河南,106070198706,尽揽风月
7124249513136784143,中部地区这是准备取代江南了吗[捂脸],0,0,0,2022-07-25 18:07:36,来自河南,6050773644,时光荏苒77430412
7124232089767478016,广东什么时候下雨啊，出门要熟了[捂脸],0,3,0,2022-07-25 17:00:04,来自广东,3271798513237256,蜡笔小心
7124258844930753320,西北呼唤雨,0,2,0,2022-07-25 18:43:51,来自宁夏,62433303043,勇敢的奶酪lA
7124260545921925918,今年的天气预报颠覆了多少年来对天气预报的信任！,0,3,1,2022-07-25 18:50:50,来自河北,70426855632,平原无垠
7124253790269948706,吉林，6月加7月，晴天也就10天[可怜],0,0,0,2022-07-25 18:24:14,来自吉林,4419685175530439,用户名668
7124227153814061827,应该改成天气后报。今天报昨天的天气。就准了。,0,7,1,2022-07-25 16:41:40,来自北京,51691073370,大洋小鱼
7124222554021659399,七下八上是北方地区的雨季，各地要做好防汛抗涝的准备，以防万一。,0,0,0,2022-07-25 16:23:44,来自天津,92407959064,马群35
7124156598830334759,现在的天气预报是雨下了才报有雨，不知道怎么报的。,0,9,0,2022-07-25 12:07:50,来自北京,51427528984,优美溪水mG
7124157399711417123,宛东南看样子希望又不大？[捂脸],1,0,0,2022-07-25 12:10:01,来自河南,95314894203,老龚说生意
7124204460364317477,老天爷的心情摇摆不定，天气预报也拿捏不准啊。呵呵,0,10,2,2022-07-25 15:13:17,来自河南,69688230020,逝水无痕2738
7124234043587773215,山东南部好多雨☔️，庄稼可能要涝死不少啊,0,0,0,2022-07-25 17:08:27,来自山东,2101922055858174,长风破浪6789
7124317972088914718,天气预报，从来就没准过,0,0,0,2022-07-25 22:33:49,来自河北,6373940200,LLLLLakers
7124196977755620104,预计明后天的天气……明后天再报……,0,6,1,2022-07-25 14:44:19,来自北京,75202512401,匿名的王承恩大爷
7124140914238604065,天气预报准的概率还是很高的。天有不测风云呐，不能100%的准呐。,0,5,4,2022-07-25 11:06:47,来自辽宁,598600065224707,朴实湖泊4L
7124179656429257504,羡慕北方，气温不高，还多雨水,0,2,1,2022-07-25 13:37:16,来自浙江,25975279523,包子铺少主
7124179608799036196,坐标天津，这几天快着火了，急需要大雨🌧️降临，冲走热浪。,1,1,0,2022-07-25 13:36:53,来自天津,90123761746,一切会好947
7124215219027149598,北方北京缺雨水,0,0,0,2022-07-25 15:55:05,来自北京,6699176753,聪慧小红花oO
7124167097361728259,对北方太有利，地下水体的补充是多么的好，但做好防汛防涝势在必行。,0,1,0,2022-07-25 12:48:24,来自安徽,59865491386,Sun窝头
7124155234528052000,我们晋北连续五十年没有下大雨。地下水位直线下降。,0,3,1,2022-07-25 12:02:41,来自山西,95419200358,切实如此
7124211259004125960,山东大姜主产区又再瑟瑟发抖了！,0,0,0,2022-07-25 15:39:38,来自山东,97203302275,曹焕波573
7124151532962202408,天气预报是德云社播报的吧，每次喊1就回去，接下来就是掌声。,0,7,1,2022-07-25 11:47:19,来自天津,100783710506,生于雨后คดถง
7124206542043972382,现在的天气预报，没八十年代的中了,0,5,0,2022-07-25 15:21:38,来自四川,102291646604,惜缘SS
7124167380099498793,最近几个月天气预报不准的那叫一个准。,0,6,0,2022-07-25 12:48:44,来自山东,2498532901921869,用户6433686747393李
7124215917827490573,包头达茂旗每天高温，不下一点雨，我求老天爷了，下点把……草场庄稼都快旱死了。,0,2,1,2022-07-25 15:57:48,来自内蒙古,111190762607,爱生活的海浪Vp
7124137083694498590,每次大雨，都会完美的错过天津,5,10,3,2022-07-25 10:51:46,来自天津,50247627550,给就顶级
7124124165208638247,关注天气变化，提前做好防暑防灾准备。,0,1,1,2022-07-25 10:00:46,来自北京,100675410833,井哥65
7124210736884646691,夏天潮湿的云走的快 天气预报有时候不准 是正常的,0,0,0,2022-07-25 15:37:14,来自河北,25817978592,让心归零128233400
7124136490984112931,中央气象预报站，昨晚说的全不算,0,10,0,2022-07-25 10:48:58,来自内蒙古,4380088805103725,茶陵神少1
7124153029820990215,我觉得天气预报挺准的,0,10,2,2022-07-25 11:53:20,来自河北,96610373444,云蒸霞蔚666
7124192650261447424,我是济宁泗水县的，老天爷可不能再下雨了[流泪]我的花生跟苹果树都快涝死了[祈祷][祈祷],0,2,0,2022-07-25 14:27:09,来自山东,62474209670,年轻的心178342233
7124249361789403918,正在下雨，专家预报挺准的[笑哭],0,1,0,2022-07-25 18:07:28,来自北京,2911103880536907,时髦奶酪q2
7124195543576412939,科技越来越发达了，天气也越来越狡猾了，总报不准它。,0,1,1,2022-07-25 14:39:10,来自山东,106260993725,用户1367305039292张
7124156036273570572,天有不测风云。现在感觉大范围之内还是可以参考的。局部这个还不是谁说了算[呲牙],0,2,3,2022-07-25 12:05:46,来自内蒙古,4151427988,苍狼00
7124159165236462377,天气预报不准确了?,0,2,0,2022-07-25 12:16:48,来自河南,1758814082960191,奋发有为冰淇淋A8
7124168080436839180,预报了，下不下雨看老天爷的了。,0,44,3,2022-07-25 12:52:04,来自北京,1336629712917708,认真的松鼠W0
7124232019889963807,七点下点雨，凉快凉快太热,0,1,0,2022-07-25 17:00:02,来自河北,2972713920519432,安逸雪碧dV
7124136300571755276,天气预报不准，还经常报反了，雨下起来再报吧！,0,13,2,2022-07-25 10:49:15,来自北京,97945711003,微风山谷细雨竹翠
7124250993080435495,29号呢？不说了！[捂脸],0,0,1,2022-07-25 18:14:14,来自山东,59157414066,一切就都随缘
7124266434749825827,天气变化无常专和专家作对，进入七月以来一样也没说对，天气预报失灵！,0,0,0,2022-07-25 19:13:15,来自河南,108108753034,友爱画板9e
7124203468344083231,我人在天津，最近的天气预报就没有报准过，也奇了怪了。,0,1,1,2022-07-25 15:09:12,来自天津,51690452453,渔火仲子
7124125154703213345,北方，雨多，又凉爽啊,3,2,2,2022-07-25 10:04:35,来自江苏,102178623035,神清气爽967
7124187782536839971,河北风调雨顺五谷丰登,0,4,0,2022-07-25 14:08:10,来自河北,56786669807,端庄优雅暖阳gf
7124266727093584675,预报了就没有责任了，下不下是老天爷的事,0,0,0,2022-07-25 19:14:31,来自北京,52256192706,祈福139859977
7124302410448864038,下雨吧太热拉,1,0,0,2022-07-25 21:33:18,来自河北,108086061246,老实得竹子
7124280451107160847,今年的雨水比去年多，北方已经不缺水了！,0,0,0,2022-07-25 20:07:33,来自山东,111202097004,西域漂雪
7124133384766751522,天气最好预算了，但高楼大厦跟高山复杂地势会搅乱气候，这才是难点[灵光一闪][灵光一闪][灵光一闪]必须长时间不间断的预测才回准,0,3,2,2022-07-25 10:36:56,来自河南,6075911507,小马1986
7124167845730665223,现在的天气预报，没八十年代的中了,0,12,1,2022-07-25 12:51:04,来自河南,4533385739,良心的国人
7124129942635840260,现在的预报还是挺准的。谁报也达不到百分之百。天气系统是运动变化的。,0,18,2,2022-07-25 10:23:15,来自吉林,5465061707,雨后的太阳55857626
7124227494446203652,雨季就得有个雨季样,1,1,0,2022-07-25 16:43:03,来自山东,2629640862312365,F飞飞
7124151209510109967,今天我们豫东预报是小到中雨，现在是睛天，还是风和日丽，[捂脸],0,2,1,2022-07-25 11:46:10,来自河南,10529357821,华豫传人
7124154541562118919,下过再说吧，跟手机自带的天气预报一样,0,2,0,2022-07-25 11:59:21,来自河北,96839192847,期待幸福的爱情
7124159681572537095,真好 终于没有沈阳了[捂脸],1,6,2,2022-07-25 12:19:27,来自辽宁,110358151415,不吃猪肉的香菜妮
7124177337792758562,只有当天的气象预报才多少有点准！,0,8,1,2022-07-25 13:27:32,来自河北,704153143484987,淡泊的饭团1L
7124125309519463200,气象都不能准确！,0,16,1,2022-07-25 10:05:12,来自天津,88980922139,tinggen
7124267442989679372,这两说夜里合白天有雨，记京地区＿点雨也没下，统的太离谱了,0,0,0,2022-07-25 19:17:56,来自北京,110745287663,真诚山丘tm
7124188270354924288,今年是什么鬼天气，热死人[捂脸],0,9,1,2022-07-25 14:09:59,来自福建,6752577386,yuan的天空
7124209629298459392,科学越进步，预报越不准，机器完全代替人的结果！,0,1,0,2022-07-25 15:32:48,来自天津,4446029866088227,简单旭日vR
7124162108631057183,这是预报 不是准报,0,3,0,2022-07-25 12:28:30,来自河南,646158031532551,时髦湖泊Yd
7124189320029717251,之前谁说今年有可能是无夏之年来着[流泪][流泪],2,5,1,2022-07-25 14:14:36,来自广西,52319441334,乡村趣味分享
7124185718578725673,不信谣不传谣,0,0,0,2022-07-25 14:00:16,来自陕西,6154314698,挤眉弄眼儿
7124223599661187873,河北往年干旱 去年和今年很好 一直下到出伏才好 凉快,0,1,0,2022-07-25 16:27:51,来自河北,22732863785,我是农民百姓了
7124276061248602918,今年山西的雨水挺多,0,0,0,2022-07-25 19:51:23,来自山西,62952948761,北欧烈风
7124265316187800353,该下雨了，不然就要立秋了[呲牙][呲牙][呲牙],0,0,0,2022-07-25 19:09:31,来自内蒙古,1689327267754056,拥抱阳光WZ
7124222967110124291,今年这么热，疫情却还是爆发！太异常了[what][what][what][what],0,1,0,2022-07-25 16:25:26,来自广西,4033475252329563,听妈妈的话3144
7124157151500796708,快下点雨凉快凉快吧！这鬼天气太热了！,0,0,0,2022-07-25 12:09:24,来自天津,51058579720,外向华仔
7124184862071784228,太好啦，我们这边都快旱死啦，很长时间没下雨了，只要有台风，我们唐山就有雨水，让暴风雨来的更猛烈些吧！,0,1,0,2022-07-25 13:56:58,来自河北,2242620625789534,巨匠天工
7124140696076256036,现在天气预报还是挺准的,0,2,1,2022-07-25 11:05:38,来自北京,3971060571843095,小楼一夜听春雨CMA
7124183044633805568,没法过了，太热了。,1,1,0,2022-07-25 13:49:44,来自广东,50274011689,执着986
7124264020651574020,让雨来的再猛烈些吧，把北京的闷热洗涤一下。,0,0,0,2022-07-25 19:04:39,来自黑龙江,102551649473,CHN林哥
7124244890514572063,我的家乡最东北角黑龙江省抚远市太旱下点雨吧都有二十天没下雨了[泣不成声],0,0,0,2022-07-25 17:50:05,来自黑龙江,52295730687,北国飘雪FY
7124153886847664907,老天爷也犯难，农民喜欢的，城市人不喜欢,0,0,0,2022-07-25 11:57:05,来自河北,4199741276037790,混元弘阳
7124171614648517409,天气予报要做到精准确实不容易，但是要尽量做到，这样群众才能滿意。,0,1,0,2022-07-25 13:06:03,来自天津,87796940719,游山玩水3284
7124188159906202380,不下吧秋苗缺水，下吧警惕雨涝防洪、抗洪天地人都作难,0,0,0,2022-07-25 14:10:05,来自陕西,51823432791,端庄优雅阳光p
7124167714033877763,今年雨水这么多,0,0,0,2022-07-25 12:50:58,来自天津,3438873499141918,柳榴榴
7124172867109077799,完了完了叫你一报雨没了，不报还有雨[捂脸][捂脸],0,1,0,2022-07-25 13:10:46,来自天津,5829806050,智慧敏捷67072462
7124192755508888360,一天一个变化，不信,0,6,0,2022-07-25 14:27:29,来自辽宁,106260390197,拨戒
7124283381667562254,天天下一点雨，降温防暑,0,0,0,2022-07-25 20:19:12,来自吉林,2040327649898512,实话能发出来吗
7124187787817321250,下雨缓解旱情，麻烦风雨温柔点,0,1,1,2022-07-25 14:08:11,,1420169545780024,澜佩滢5166505249079
7124176457143714593,安徽干旱的旱死无雨，快有大半年没下雨了。庄稼都干死掉了！！！[流泪][流泪][流泪],0,4,3,2022-07-25 13:24:38,来自安徽,5809884592,孙全65966755
7124153430394077986,大暑天气,0,0,0,2022-07-25 11:54:42,来自安徽,1363855132338974,立聪堂阜阳五院国贸店
7124164596860601121,应改为天气后报比较准确。,0,1,0,2022-07-25 12:38:53,来自山西,10128565872,雅雕阁笑寒
7124165806942569256,完美的避开山东,3,5,3,2022-07-25 12:42:48,来自山东,63015643654,景途游者
7124227744854180649,今年是北方喝饱，南方渴热，,0,0,0,2022-07-25 16:43:12,来自浙江,51951143765,智勇双全冰淇淋v9
7124199281972003584,老天爷给降温了，挺好,0,1,0,2022-07-25 14:52:54,来自北京,66977555537,青年万象
7124192340822360836,南昌今天40度，蒸包子。。。,0,1,0,2022-07-25 14:26:37,来自江西,2269806862534621,鄧縂
7124147605621424908,山东今年咋了，从六月份开始天无二日清,0,1,0,2022-07-25 11:32:47,来自山东,51294850484,小爷不狂6
7124247489619690274,北方雨太多了,0,0,0,2022-07-25 17:59:35,,3353954430,无产阶级要联合起来
7124199501061702400,期待下点雨凉快凉快，太热了。,0,0,1,2022-07-25 14:53:48,来自天津,267912366008916,SG长寿花
7124199629985579817,下它个七七四十九天！超级凉爽，直到立秋！,0,5,2,2022-07-25 14:54:06,来自北京,2774812906498541,善良青山tK
7124195511024452385,别再下了，地里玉米都快淹死了,0,0,0,2022-07-25 14:39:09,来自山东,81782840902,一兔子0
7124215589518066472,该下雨了，不然就立秋了。,0,3,0,2022-07-25 15:56:02,来自北京,6848917510,晨梦7
7124254534733644584,预报了肯定不下。就是这么准,0,1,0,2022-07-25 18:27:10,来自北京,95687107481,偶爱自由
7124267242653139744,刚刚下了一小阵就停电停水了[擦汗],0,0,0,2022-07-25 19:17:26,来自河北,92729817331,小萱子118
7124137761900725032,现在的科技从气象卫星到大数据真的太厉害，赞👍🏻,0,2,0,2022-07-25 10:54:00,来自河北,85923710420,时髦金桔q2
7124172528884613903,盼着来个台风凉快凉快。冲一冲一身的火气。,0,3,0,2022-07-25 13:08:43,来自浙江,111177361918,高贵天空OD
7124278600975254303,昨天电闪雷鸣挺吓人，结果没下雨,0,0,0,2022-07-25 20:00:52,来自北京,1165114570450924,水清空气好
7124149793190396686,城市里没有庄稼老下雨、农村干旱老不下雨,0,2,0,2022-07-25 11:40:58,来自河北,54967742595,花生核挑花椒王
7124178493226943240,山东又要下雨了☔️,0,0,0,2022-07-25 13:32:17,来自山东,15309318131,成长中的韭菜君
7124193032174060328,只要是一预报肯定不下,0,6,0,2022-07-25 14:28:45,来自河北,88956559986,小岛七八九
7124166686034428706,下雨的时候一定要看预报，要么先收被子,0,0,0,2022-07-25 12:46:02,来自山东,103606078665,卧佛昆仑
7124140432770056960,高温可以缓解一下,0,3,0,2022-07-25 11:04:12,来自天津,93884468126,埋在心底的人
7124179361858765582,预报有雨就是下不来，,0,7,0,2022-07-25 13:35:50,来自北京,676934708106647,李掌柜9Y3z
7124214663348388642,台风去哪里了？今年怎么连台风都很少了？！！,0,0,0,2022-07-25 15:52:21,来自江苏,6175475817,七零后的头
7124169941439218446,看来山东可以排除了,0,0,0,2022-07-25 12:59:00,来自山东,54367861704,黎明前的一抹亮
7124132229839635238,就是报的晴天准，下雨天一个没报准过！,0,7,0,2022-07-25 10:32:00,来自天津,7005748625,嘻嘻哈哈哈哈嘻嘻w
7124210225649287972,报了，等于又没了,0,3,0,2022-07-25 15:35:54,来自北京,6036991445,老李unbending
7124183722970350367,下了再说吧！我们这大太阳，预报的有雨,0,0,1,2022-07-25 13:52:54,来自河南,70233442194,清风老友记
7124129715346309924,雨太多了就成灾了,2,2,2,2022-07-25 10:22:20,来自陕西,6531012177,无语的行者
7124139722725278464,到夏季了要注意防范,0,0,0,2022-07-25 11:01:37,来自河北,2305051061126576,魔法海浪3Y
7124203600309781283,高兴，就下点,0,2,0,2022-07-25 15:09:29,来自北京,2757190225507108,9777793446658
7124203600309781283,高兴，就下点,0,2,0,2022-07-25 15:09:29,来自北京,2757190225507108,9777793446658
7124164136329593600,下雨1点一3点一4点一5点一6点，不下就是多云转晴。,0,1,1,2022-07-25 12:36:04,来自山东,10417931975,可靠铅笔dJ
7124174325187953423,今年的玉米是完蛋了，天天下雨，天天去地里抽水 放水，,0,1,2,2022-07-25 13:15:53,来自山东,57963683428,热转印膜印刷厂家
