7126043924175045387,向美女警察致敬，为热爱生活，热爱家庭为父母分担经济压力的小女孩点赞,5,490,9,2022-07-30 14:11:43,来自江苏,157949287998238,李海标5J1w
7126041379314402083,好感人，看哭了！懂事的小女孩，为民警点赞,2,457,11,2022-07-30 14:00:56,来自广东,84242488773,家是温馨的港湾
7126029613738165024,为心细的女民警点赞👍,4,499,16,2022-07-30 13:16:01,来自上海,59014433824,小鱼儿9691
7126042737501094671,世上还是好人多，这女孩是幸运的，遇到这么好的警察，为好警察点赞[赞][赞][赞],2,210,5,2022-07-30 14:06:10,来自江苏,84804256980,好心情95413
7126073356893307678,为细心的美女警察点赞！,0,84,2,2022-07-30 16:05:12,来自北京,3281402690798256,幸福枫叶Ln
7126082672887218956,为暖心、敬业的女民警点赞！[赞],0,9,0,2022-07-30 16:41:57,来自湖南,64271997677,贺建红97
7125931595281957663,这个小女孩胆子太大了，就不怕被迫遇到坏人？为扬州的好警察致敬！[玫瑰][玫瑰][玫瑰],1,15,0,2022-07-30 06:56:02,来自江苏,1627730800818679,天涯风清
7126071739263828751,故事感人，为女民警点赞[赞][赞][赞][玫瑰][玫瑰][玫瑰],1,11,1,2022-07-30 15:58:42,来自江西,106425383699,无语34699
7126063229574316814,小女孩真幸运。遇上了好心人。为民警点赞[赞][赞]好人一生平安[祈祷],0,26,1,2022-07-30 15:26:07,来自四川,100392960001,顽强山雀yG
7126045420337300260,为好心民警点赞[赞][赞][赞],0,52,1,2022-07-30 14:17:04,来自广西,52632823823,萍
7126045194688135936,我看了这报到后、我仁不住流下了眼泪十二岁的小孩真懂事、能想到这些事都是成年人的事、我家孙子、有十八岁、二十岁的、都让人操心不下、我为这位小孩懂事点赞、这位社会民警应该直得全社会学习、我向你致敬！,2,116,3,2022-07-30 14:15:47,来自广东,122783614646732,任思曲
7126044714998317865,为心细的女民警点赞👍,0,42,1,2022-07-30 14:13:59,来自重庆,712941069675967,自信达西0k8
7126036760991564575,懂事的孩子，热心的民警。,1,24,0,2022-07-30 13:43:32,来自山东,84473381260,乐乐6218
7126068680718811937,"北青网头像北青网,北青网官方账号,,null12岁四川女孩偷偷来扬州“打工”，女警千里护送她回家",0,25,1,2022-07-30 15:47:51,来自福建,1997145504248904,兔兔哦里咯啦咯啦咯
7126036312020763392,我家怎么就没有这么懂事的孩子呀我的孩子脾气暴躁几乎天天跟我吵架天天惹我生气，我是上辈子造了什么孽呀这辈子生了这么个冤家这么个仇人烦死了😭😭儿子还好就是女儿老是跟我吵架不都说女儿是贴心小棉袄吗我看她像刺骨的尖刀还差不多😭😭😭😭😭😭😭😭😭😭😭😭😭😭😭😭😭😭😭😭😭😭😭😭😭😭😭😭😭😭😭😭😭😭😭😭😭😭😭😭😭😭😭😭😭😭😭😭😭😭😭😭😭😭😭😭😭😭😭😭😭😭😭😭😭😭😭😭😭😭😭😭😭😭😭😭😭😭😭😭😭😭😭😭😭😭😭😭😭😭😭😭😭😭😭😭😭😭😭😭😭😭😭😭😭😭😭😭😭😭😭😭😭😭😭😭😭😭😭😭😭😭😭😭😭😭😭😭,15,122,13,2022-07-30 13:41:26,来自上海,1838837052483584,恨自己555
7126057946358432552,世上还是好人多，这女孩是幸运的，遇到这么好的警察，为好警察点赞[赞][赞][赞],0,25,2,2022-07-30 15:05:29,来自陕西,540602340752924,敏锐小鱼mO
7126089093028905763,关爱未成年人成长，警察心细如发呵护[赞][赞][赞][赞][赞],0,1,0,2022-07-30 17:06:08,来自福建,2128277149853501,温馨梦梦
7126039383744611108,为警花点赞[赞][赞][赞][赞][赞][玫瑰][玫瑰][玫瑰][玫瑰][玫瑰],0,85,1,2022-07-30 13:53:57,来自黑龙江,104641919188,魔法师图们5h
7126046929311236904,为心细、责任心强的女民警点赞！为懂事的小女孩点赞！,0,42,2,2022-07-30 14:22:28,来自四川,65137979571,端庄葡萄CGY
7126074699968676615,昨天在兰州车站出站防疫检查卡口，一位乘坐Z21次列车来自石家庄的近70的老年人来登记，经过询问老人得知，她一个人从保定来兰州是寻找“快手平台”，我告诉老人说，快手平台在北京市，不在兰州市，老人打开快手视频，她指着视频上的明星靳东说：我认识他……一会又指着“鸡汤”视频上的老年老师说：她叫我‘孩子……’。看着老人的言语断定她思维有点乱：她认为快手视频和正常聊天视频一样可以通话聊天。如此情况我对老人说，你还是赶快回老家吧！上网给她查询坐时短的z22次列车并带她到售票处购买了车票。今天早上8点左右与她女儿通电话得知，老人已经是多次一个人游离了，对此老年人的女儿哭诉，还是好人多，要不她们要急死了，幸好你们帮助我们让她回家了……,1,18,2,2022-07-30 16:10:57,来自甘肃,6647947267,零点101955441
7126075678130963213,感人，小女孩好懂事，为爱心民警点赞[赞][赞][赞],0,4,0,2022-07-30 16:14:44,来自江西,99218642013,夕夕
7126037629166469920,细心有责任的好民警[赞][赞][赞],0,71,2,2022-07-30 13:47:14,来自四川,93052240428,兰不难兰
7126089028659086093,为好心人女民警点赞[赞][赞],0,1,0,2022-07-30 17:06:34,来自河北,2824013747856672,简单明镜8f
7126069953950122784,为民警点赞[赞][赞],0,5,0,2022-07-30 15:52:52,来自福建,2537295320459880,用户xXiS
7126050116641375010,人民子弟兵个个好样的，，给扬州公安民警点赞[赞][赞][赞],0,11,0,2022-07-30 14:35:04,来自广东,1947942774646844,邻家大叔00
7126045363534562063,为心细的女民警点赞。[赞][赞][赞][赞][赞],0,3,0,2022-07-30 14:16:36,来自江苏,87745930164,香儿4808
7126055934912873223,向美女警察致敬，为热爱生活，热爱家庭为父母分担经济压力的小女孩点赞,0,17,2,2022-07-30 14:58:06,来自陕西,93029595218,聪明的泽妍
7125968916203520779,向扬州的这名女警察致敬，看似简单的一件事，实际上消除了后面太多不确定因素，一个十二岁小女孩，一不小心就会落入魔窟，自己与家人将会恶梦……,0,6,0,2022-07-30 09:20:50,来自江苏,6894570782,诚相待2015116军营
7126075951510913806,细心又好心的好警察！好感动，热泪盈眶,0,3,0,2022-07-30 16:15:32,来自四川,1266235434349656,春晓8x3u
7126086047544443678,所有人都在为民警点赞，却没人思考是什么能让12岁的女孩敢孤身一人来到千里之外的扬州打工。小女孩需要的是什么，[what],0,2,0,2022-07-30 16:54:38,来自贵州,945179206890653,宝贝宝贝哦
7126056327742702376,为细心的女民警点赞。好人有好报[赞],0,23,2,2022-07-30 14:58:59,来自浙江,1767654042633966,完美柳叶vU
7126086907402076963,好感人，看哭了！懂事的小女孩，为民警点赞,0,0,0,2022-07-30 16:57:35,来自河北,61997519735824,敏锐宇宙fg
7125792037294637864,扬州就是一个和谐家园，警花也是扬州一支城市之花！,0,23,0,2022-07-29 21:53:13,来自江苏,430615887873644,红枫19691
7126079062728180480,感谢好心警察。不然家里知道孩子外出是多么担心。,0,2,0,2022-07-30 16:27:10,来自四川,3949893833465567,董老师1806494
7126080106271539979,为细心的女民警点赞！[赞][赞],0,1,0,2022-07-30 16:32:31,来自浙江,1085916043809224,积极的小鱼5G
7126063063270195983,怀赞公安糸统:全国各地公安部好？以及派出所工作人员！都努力的为人民服务办好事，敬到了公安机关单位和个人的职责。特别象懂建华女警同志:心中有大爱？关心女学生女孩子的学习和成长！关心其家人的负担和关怀名方面的生话中的勾通？元满的完成了她的心愿！希望:公安糸统全心金意为人民服务！做人民群众的贴心人？,0,20,1,2022-07-30 15:25:00,来自陕西,111057073632,桃源
7126030316057412392,警察女士你太有爱心了，向你们致敬，祝福你和家人平安快乐，小女孩太懂事，才十二岁，又太不懂事，多不安全，辛好逗到了好老板，为你们点👍好人一生平安快乐。,1,103,2,2022-07-30 13:17:54,,111632067697,微笑奶酪Gk
7126064512956302115,必须致敬细心认真负责的扬州民警董建华👍👍👍🙏🙏🙏,0,3,0,2022-07-30 15:30:49,来自四川,108883447635,已脱制服归布衣
7126074319197340456,为心细的女民警点赞点赞[玫瑰][玫瑰][玫瑰],0,1,0,2022-07-30 16:09:01,来自陕西,104940153045,多才蜻蜓6Z
7126039463628833549,人民的好警察，为你们点赞。,0,22,0,2022-07-30 13:53:56,来自山东,2889959103797815,济南大山
7126054594367161102,为心细的女民警点赞[赞][赞][赞],0,0,0,2022-07-30 14:52:59,来自广东,2809959696831612,多才多艺星空qr
7126035802890961677,向美女警察致敬，为热爱生活，热爱家庭为父母分担经济压力的小女孩点赞,0,30,0,2022-07-30 13:39:56,来自浙江,364638195155612,知情达理糯米H
7126052343870882564,世界上还是好人多为女民警点赞[赞][赞][赞][赞][赞][赞][赞][赞][赞],0,4,0,2022-07-30 14:44:15,来自广西,2150279410620740,可靠饺子pG
7125914298806698755,四川南充人民给扬州警察发来贺电，扬州警察，四川人民感谢你,0,13,0,2022-07-30 05:50:06,来自广东,73728275424,一个残疾人的沉痛呼唤
7126076507172455203,果然是穷人家的孩子早当家，我孩子同样12岁，从来不知道父母赚钱不容易，每天吃饭挑三拣四！[捂脸],0,0,0,2022-07-30 16:17:15,来自江苏,906412348670444,大度741
7126065906278990627,为心细、责任心强的女民警点赞！为懂事的小女孩点赞！[赞][赞],0,3,1,2022-07-30 15:36:14,来自山东,4046669246381758,神秘湖泊0O
7126046181335401250,为好警官点赞，致敬！,0,12,1,2022-07-30 14:19:39,来自陕西,2327035107352253,海棠花
7126073361809572608,好热心，温心，细心的董建华民警向你致敬。为你点赞。小小山区小女孩如碰到不该去的地方那不是一身都完了。,0,1,0,2022-07-30 16:05:07,来自重庆,73033319777,朴实喜鹊zH
7126033025003438882,一个懂事的孩了，一个好民警。,0,36,0,2022-07-30 13:28:33,来自江苏,681308208508046,过路的尽头
7126081005265896207,为好警察点赞👍,0,0,0,2022-07-30 16:34:47,来自浙江,726113957184191,知足
7126034916755669795,为警🌸点赞,0,35,1,2022-07-30 13:35:44,来自山东,1283833188329940,湧博
7126055116155405088,好感人，看哭了！懂事的小女孩，为民警点赞,0,2,1,2022-07-30 14:55:30,来自广东,109209815990,聪颖冰墩墩
7126040208184853248,汶河派出所，所长民警点赞，大爱一方,0,11,0,2022-07-30 13:56:19,来自河南,2516140267671568,正直人生赢在选择
7126062123179836192,为美女警察点赞[赞][赞][赞],0,1,0,2022-07-30 15:22:11,来自广东,111634831347,无忧的帆船Xa
7126041080923652875,为细心的警花点赞[比心][比心],0,11,0,2022-07-30 14:00:47,来自河南,11175306977,人生之旅1677
7126046531933405992,读完了。感动的泪流满面。为中国民警点赞！为董建华点赞！！,0,7,0,2022-07-30 14:21:13,来自山东,501012185757816,灵敏艺术家e3
7126046135390995233,女宝贝很棒，民警很热心，很有爱,0,6,1,2022-07-30 14:20:30,来自重庆,1494975305497364,大气风声wT
7126036914733777664,警察女士你大有爱心，真的令人致敬，警民之间又迈上前一步，同时祝你家人健康，幸福。,0,11,0,2022-07-30 13:43:35,来自广东,63419664335,时髦风筝oN
7126036956307440396,象这样的好警察，应该早提干。为心细的民警点赞。为人父母应该多多和小交心。多险,0,14,0,2022-07-30 13:44:42,来自广东,1459757616207016,睿智阜新6L2
7126086795217470240,为扬州民警董建华点赞，感动[赞][赞][玫瑰][玫瑰],0,0,0,2022-07-30 16:58:15,来自广东,5756025634,双河坝
7126081945905873676,为杨州美女民警点赞！也为广陵公安分局汶河派出所领导爱心执法点赞！[赞],0,0,0,2022-07-30 16:39:22,来自四川,76579960786,欧阳泽14
7126044496466952998,"为董建华点赞[赞][赞][赞]
为汶河派出所全体警员们点赞[赞][赞][赞]",0,5,0,2022-07-30 14:14:08,来自河南,74952178723,鸿运5678
7126035312643785475,为女民警点赞是人民的好警察。,0,15,0,2022-07-30 13:38:12,来自山东,97114625792,分秒必争露珠lf
7126079072618611460,多么懂事的女孩，小小年纪就知道替父母减轻家庭生活的担子[赞]为美女警察点赞[赞],0,1,0,2022-07-30 16:28:09,来自甘肃,3553258813799483,缘凤5616
7126036584067040000,向董建华警察学习为榜样，[赞][赞][赞]我看完眼泪都出来了，懂事的好孩子平安回家就好[流泪][流泪][流泪],0,0,0,2022-07-30 13:42:11,来自湖北,1733250613779024,欢迎同胞早日回家
7126087554159821583,好感人，看哭了！懂事的小女孩，为细心，责任心强的民警[赞][赞][赞][赞][赞],0,0,0,2022-07-30 17:00:07,来自湖南,77882249446,一屋不扫何以扫天下459
7126088193409631016,为心细、责任心强的女民警点赞！为懂事的小女孩点赞！,0,0,0,2022-07-30 17:02:45,来自陕西,1820392754777719,陕西省宁强县风光无限
7126083976451982111,阿云女孩虽然懂事，但做法不可取，太不安全了，幸好民警发现，要不然发生些什么事谁也说不上。为警花点赞[赞],0,0,0,2022-07-30 16:46:49,来自福建,4380930695238923,奋发高山AD
7126048911428797192,为细心的民警点赞！[赞][赞][赞],0,3,0,2022-07-30 14:30:46,来自湖北,1380583531872493,风趣风筝RZ
7126071398120555277,看到这个故事，让我为之动容！感激之情溢于言表！董建华是当之无愧的“优秀的人民警察”！向“优秀的人民警察”董建华致敬！点赞！[赞][赞][赞][赞][赞][赞][祈祷][祈祷][祈祷],0,0,0,2022-07-30 15:58:13,来自吉林,11173535366,军荣哥
7126087097567789831,我这个民警点赞 👍👍👍👍👍👍👍👍👍👍👍👍🌹🌹🌹🌹🌹🌹🌹🌹🌹🌹🌹🌹🌹🌹🌹好人一生平安,0,1,0,2022-07-30 16:58:42,来自江苏,1781682611683758,王帅
7126067400545714948,为心细、责任心强的女民警点赞！为懂事的小女孩点赞！[赞][赞],0,1,0,2022-07-30 15:42:57,来自安徽,6355996633,孤单86081092
7126050824648393486,小女孩太懂事了，父母感到欣慰，民警阿姨是人民好警察，是人民的保护神！,0,2,0,2022-07-30 14:38:24,来自安徽,6651900170,金汤湖畔
7126087003930329864,首先必须点赞警察。但作为孩子的父亲，不管工厂能不能请假，花多少钱都应该自己去扬州接孩子。请假给工厂领导讲清楚，应该没问题。,0,0,0,2022-07-30 16:58:45,来自广东,4028207447413704,真诚花猫r6
7126079708328018700,为扬州好民警点赞！[赞][赞][赞],0,1,0,2022-07-30 16:30:22,来自江苏,4002638909151859,开心消消乐
7126054907501232907,小女孩很懂事乖巧孝顺，人民好警察细心爱心善心为你们点赞[赞][赞][赞][心][心][心],0,4,0,2022-07-30 14:54:38,来自福建,67314541847,热心山雀jv
7126066789276009216,好感人，看哭了！懂事的小女孩，为民警点赞,0,1,0,2022-07-30 15:39:32,来自江苏,2458100340626359,奋发有为百灵鸟Zk
7126037039560147715,真是好警察呀[赞][赞][赞][赞][赞][赞],0,27,1,2022-07-30 13:44:50,来自广东,65940641039,懿觑y
7126053122526692132,女孩实在懂事的，出门不安全，家长时时注意孩子的动态，为了安全，为警察点赞[赞],0,2,0,2022-07-30 14:46:57,来自新疆,3830313957212877,13629328748
7126053240302945035,这个小女孩很懂事，真是要感谢这位民警慧眼识英雄。为这位好民警点赞！,0,2,0,2022-07-30 14:47:52,来自江西,104440218855,亲切百灵鸟a3
7126066301726032673,真是太感人了。好警察，好孩子，[赞][赞][赞]看的人流㺺。打工人的心酸事！,0,0,0,2022-07-30 15:38:25,来自甘肃,63168339880,中华91342
7126053733359993614,为细心观察且进一步调查的民警董建华点赞，救了一个少年女！,0,1,0,2022-07-30 14:49:27,来自浙江,64612457788,虎啸山岗986
7126062146034795296,为民警点赞 ，好人有好报 [赞][赞][赞][赞][赞][赞],0,0,0,2022-07-30 15:22:10,来自山东,3496100029274317,知情达理叶子mI
7126089542347686656,母亲般的慈爱，为百姓人家解忧纾困的好警察“董建华”同志，向你学习致敬！为你点赞！,0,0,0,2022-07-30 17:07:58,来自湖南,3650005321137652,俊俏雪碧mJ风清
7126044515642819361,为心细的女民警点赞[赞][玫瑰],0,3,0,2022-07-30 14:13:50,来自广西,3175867636258507,热闹生活家6G
7126054998924084009,"这民警好样的
满满的爱心
小女孩也孝心多多",0,2,0,2022-07-30 14:53:51,来自四川,59866602504,相逢在9月
7126071154309513995,为小女孩的懂事孝顺点赞，更为有爱心的女民警点赞！,0,0,0,2022-07-30 15:57:30,来自湖南,1327847925357454,1938165817
7126042406071468811,民警姑娘好有爱心又细心工作认真负责！[赞][赞][赞],0,2,0,2022-07-30 14:05:38,来自河南,2766025105080635,清爽松鼠Tg
7126080643758441227,有些民警确实是在为民办实事难事急事，今天我要给这个叫懂建华的民警点一百个赞！！！,0,1,0,2022-07-30 16:33:51,来自重庆,59903996566,老兵缘分
7126042099073565451,向董建华民警敬礼!,0,5,0,2022-07-30 14:04:19,来自山西,21242340410,外向精灵QT
7126078398472160030,为警察的付出大赞特赞！赞将读初中的女孩为减轻家庭负担出一分力真懂事乖巧！,0,0,0,2022-07-30 16:25:11,来自广东,5520193560,四哥陈校仁
7126058431366267685,热心细心，很有责任感，真是人民的好警察，大家一起来为最美女警察点赞！,0,2,0,2022-07-30 15:07:28,来自湖北,2620875781702759,袁一纯
7126052676319658789,谢谢扬州警官，你们的慧眼，可能挽救了小孩，保护了他们一家一生的幸福,0,2,0,2022-07-30 14:45:15,来自四川,3500451469479511,908987960
7126087198860477220,给我们的女民警点赞[赞][赞][赞][赞][赞][赞],0,0,0,2022-07-30 16:59:29,来自河北,6123656433,风趣的金峰祥云
7126048545111163680,杨州民警真是好样的，[赞][赞][赞],0,2,0,2022-07-30 14:29:56,来自北京,5855480108,5801480108
7126042644807697163,好孩子都在别人家呢[捂脸],0,3,0,2022-07-30 14:06:59,来自天津,23779690393,悠闲139161676
7126044837656642336,点赞建华民警！,0,3,0,2022-07-30 14:15:27,来自广东,3491651507460743,分秒必争海洋ea
7126059154384454439,小姑娘太懂事了，好好学习，有了本亊报孝爹娘！,0,1,0,2022-07-30 15:10:40,来自四川,479011812934883,李邓家老二
7126036890696368903,人民的好警察，愿好人有好报，祝好人一生平安健康幸福。,0,13,0,2022-07-30 13:44:11,来自江苏,96055299257,单祖祥
7126082969428919074,为美女警察点赞，为懂事的女孩说生活虽然不易，学习才是硬道理，加油好好学习！,0,0,0,2022-07-30 16:42:23,来自新疆,82720777139,灵芝草_53899
7126052413232022285,为民警点赞[赞][赞][赞],0,2,0,2022-07-30 14:44:10,来自河南,60695357136,开朗帆船J4
7126078469741855529,为富有温情的扬州警察点赞！幸亏是在扬州啊！如果遇到人贩子或者歹徒，后果不堪设想。[比心][赞][鼓掌][666][666][666],0,1,0,2022-07-30 16:24:55,来自上海,105052131634,老许285255716
7126087754576413479,可怜的孩子！好心的民警！唉！,0,0,0,2022-07-30 17:01:46,来自陕西,6980976496,向往的渴望的
7126052717411566339,一看身份信息，警察惊出一身冷汗,0,1,0,2022-07-30 14:45:48,来自北京,17092211135,港灣小舟
7126000804553147151,为扬州警察点赞[赞][赞][赞],0,0,0,2022-07-30 11:23:38,来自江苏,53041166093,五哥zcj
7126043396430463758,民警好有爱心[爱慕],0,4,0,2022-07-30 14:09:16,来自福建,290729346737118,1526枫
7126037868589957918,赞👍我的民警,0,7,0,2022-07-30 13:47:53,来自江苏,63932791227,6879139572313
7126079354089816871,幸运女孩遇上热心女警，千里护送传递正能量。[玫瑰][玫瑰][比心][比心],0,0,0,2022-07-30 16:29:12,来自广东,3781958408878235,清新葡萄yq
7126055095753966369,为警花点赞👍,0,2,0,2022-07-30 14:55:18,来自浙江,73628912446,李欣236723180
7126072734580638496,懂事有孝心的小孩，好心肠的民警！[赞],0,0,0,2022-07-30 16:03:25,来自广东,110322719575,一叶一菩提8888
7126043363425878796,一个懂事的孩子，也遇到好心民警,0,4,0,2022-07-30 14:09:34,来自陕西,5557724851,正直花猫qM
7126074072426660616,好警察，真细心👍,0,0,0,2022-07-30 16:08:14,来自河南,3249768239472760,宛广尬评
7126023901003711264,这种事情，让人感动，祝福这位女警，好人好报，一生平安，健康快乐！,0,90,4,2022-07-30 12:53:38,来自四川,69531976540,梧桐少主
7126048833372717828,最该称赞的是这位有责任心的警察。这才是人民警察为人民,0,4,0,2022-07-30 14:30:37,来自广东,2801173314142668,元气水滴eE
7126072162565833504,看的我是热泪盈眶，为人民警察点赞，为董建华一心为民的工作热忱点赞[赞][赞][玫瑰][玫瑰][玫瑰],0,0,0,2022-07-30 16:01:19,来自河南,77396913649,鈭麒東來
7126054654488085278,向董建华警察致敬！你不愧是人民警察这个光荣称告。,0,2,0,2022-07-30 14:53:12,来自湖南,102649619800,冬天的雪jmm
7126059482643579682,为女民警点赞,0,2,0,2022-07-30 15:11:19,来自吉林,712117557148304,勇敢的宇宙oM
7126068756845462310,孩子太懂事了，为你点赞👍，为警察👮同志点赞👍,0,0,0,2022-07-30 15:48:10,来自安徽,64981734134,8文艺爱好者
7126059597710426916,为这位美女警察点赞[赞][赞][赞]，并祝好人一生平安，好人有好报。愿这懂事的小女孩健康快乐地成长，将来会有美好的前程。[赞][赞][赞],0,0,0,2022-07-30 15:12:23,来自广东,66298628040,心语89305
7126058820614669096,人民的警察👮为人民，为最优秀的警察董建华同志点赞👍转发！,0,2,0,2022-07-30 15:08:48,来自江西,108595043743,绿色的爱护者
7126089347128148769,"小女孩不但懂事、而且她善意的谎言体现出其思维能力不一般、毕竟才12岁啊👍
感谢扬州民警👍",0,0,0,2022-07-30 17:08:04,来自广东,1671710445416084,zhjh.
7126042168107860743,懂事的孩子，细心且有爱心的警察大姐，都赞一个[赞]。,0,4,0,2022-07-30 14:04:32,来自山东,76931372596,风趣光束7
7126046632508523299,为细心的民警点赞！,0,2,0,2022-07-30 14:21:30,来自广东,105247010710,一枝独秀645
7126086649234457382,百姓身边无小事，为女民警点赞[赞][玫瑰]穷人家的孩子早当家,0,0,0,2022-07-30 16:57:36,来自陕西,50767735194,拚南走北
7126077008270279431,为好心女民警点赞,0,0,0,2022-07-30 16:19:52,来自江苏,84719034638,蓝天白云9451429869941
7126067655433536287,都像这样的警察，中国坏人都会变好人。为这个派出所，这个女警察点赞[比心][赞],0,0,0,2022-07-30 15:43:20,来自广东,97614631328,农夫在城里
7126072009024914187,底层劳动人好不容易，小好孩好懂事，能替父母分忧，董警察好感人啦，把我看出眼泪了。,0,0,0,2022-07-30 16:01:03,来自四川,901234611204168,随性自由的白云X0
7126081980449866530,这样的警察才对得起警察两个字！为美女警察点赞,0,0,0,2022-07-30 16:38:31,来自北京,93134841475,儒雅海风rW
7126058619871363881,啊云也是一个懂事的小女孩，希望孩子见到父母后，回去好好学习，照顾好自己爷爷奶奶,0,1,0,2022-07-30 15:08:01,来自海南,83312874883,海南岛
7126083597463143201,愿世界充满爱！愿杭州招财猫理财平台难友有人管！,0,0,0,2022-07-30 16:45:44,来自河南,3070274059373501,细腻伊宁9L1
7126054660104422147,这才是为人民服务的好警察，给予点赞！,0,3,0,2022-07-30 14:53:38,来自河北,93021082543,格拉贝美妆选购
7126055833770689291,为民警点赞,0,1,0,2022-07-30 14:57:47,来自山东,52636423588,音乐泡泡爱经典歌曲
7126025015337976591,为最美警察点赞,1,42,2,2022-07-30 12:57:24,来自北京,53884154775,高崇全
7126066076227814152,既然是“背着年迈的奶奶和在外打工的父母”，那就是4个人一起出来打工了呀？我就担心背不动，有点重……,0,0,0,2022-07-30 15:37:19,来自甘肃,101651868064,Kilimanjaro的雪
7126074534381896463,希望上级提升董建华警察支持这样的警察,0,0,0,2022-07-30 16:09:54,来自广东,2783598072837864,正义凛然星星9N
7126076382702355231,孩子的想发是广阔的，孝心满满，回家后努力读书将来有成报答祖国，还有帮助你的警察姐姐！,0,0,0,2022-07-30 16:17:32,来自广东,95587123701,八干里雲和月
7126043062086058788,为好民警点赞[赞],0,2,0,2022-07-30 14:07:57,来自天津,84688074308,鲁潍高
7126047983711634190,好姑娘遇上好警察，,0,5,0,2022-07-30 14:27:08,来自江苏,62310284998,男子汉284456741
7126069778636686114,这才是人民警察爱人民，董警官充满爱心，在所里和上级领导关怀下安全地将小女孩送到其父母身边，事迹太感人了，为这些充满爱心的警官们点个大大的赞！,0,0,0,2022-07-30 15:51:20,来自江苏,56809448156,醉人青春
7126038842502791951,人民的好警察，值得表扬,0,6,0,2022-07-30 13:51:05,来自江苏,3857554800906271,热闹海燕ph
7126042872713069347,为这样的好警官点赞[赞][赞][赞][赞][赞][赞][赞][赞],0,3,0,2022-07-30 14:06:48,来自四川,94062362294,远权哥
7126054008246027045,这才是一心一意为民办事的好民警！赞！,0,2,0,2022-07-30 14:50:14,来自河北,3452112153095459,幸福原野W8
