7126050918789038885,边上那么多车排着队，如果都把灭火器贡献出来先灭火或分工一下，边灭火边救人，应该都能救出来！,0,1,0,2022-07-30 14:38:28,来自浙江,3627491372,锦绣大观园
7125846405943542541,"看了一下评论，大多数人都在讨论救人相关，极少数人讨论这车安全性如何的问题。
 这就是紧急公关的作用，瞬间把大家注意力转移到受伤者和死者身上去了。
 人确实重要，但更需要明白为什么200万的车一次碰撞不出现这样惨重的结果！
 200万的车，安全气囊炸开了居然没有自动解锁？ 这才是大家需要更加关注的。",10,58,1,2022-07-30 01:28:49,来自江苏,97534269379,贱过不留名
7126179946267411234,救人的司机尽力了，他是见义勇为的好英雄，不要网暴他,0,0,0,2022-07-30 22:58:45,来自广东,5444868361,蝶恋花54927151
7125994559091966754,为啥前排的没事，反而后排的那么严重？没系安全带？这么豪的车，关键时刻车门打不开？,132,315,13,2022-07-30 10:59:21,来自湖南,98238756361,榴莲
7125829180256060190,这车里遇难的乘客的位置不是说是最安全的位置吗,4,9,1,2022-07-30 00:19:27,来自甘肃,6220800231,手机用户吞天宇
7125946327917331237,视频里砸开后车窗跳进去救人者直接说挂了意思是死了，（这点有失误应该是昏迷）后面出来了没有继续救，等大火起来给烧死了，，,7,1,3,2022-07-30 07:52:54,来自北京,5894968099,柳郎庄园
7126032274881331983,看过视频，救人的老哥，爬进去看了一眼就出来了，他说救不了啦！人没了！他都爬进去，但凡只是是昏迷，他都会尝试往外搬一搬，估计里面的人撞的相当惨烈。才让他一眼就确认人没了。网曝什么呢！人家可是冒这生命危险往冒着烟的车里钻啊！视频拍摄者，是没怎么去救人，但是是他拦下来了车喊来的人。也不能说人家什么！,9,36,2,2022-07-30 13:25:36,来自广东,51764597571,小虚卍解
7126115923534775040,如果一个也不救呢？还会被网暴么？就当没看见开车走掉呢？本就不是专业人士，现场那么危险，能伸出援手去救人，已经很伟大了！试问我们自己，遇到这种情况又会怎么做呢！,0,2,0,2022-07-30 18:50:24,来自吉林,1991967818661037,Scarlett1106
7125823304447542016,早几天从莞深高速有辆面包车翻车，准备停车看看要不要救人，看到前面小车辅驾伸手示意要靠边，经过事故车时见到前面已经停了两台小车，两司机正下车去救人，同时事故车司机一面懵懵的爬出来[捂脸],0,10,1,2022-07-29 23:55:43,来自广东,6754249511,PingLuckOne
7125808513938359081,雷克萨斯官方：我想问问你的570为何在高速行驶中突然出现发动机功率下降要求回4s店检查这个功能？这是多么危险的一种设计！在高速行驶中突然降速出现交通事故，厂家要负责！有没有后台操控的？这个功能应该引起厂家重视！如不解决再也不买这个品牌了。,4,6,1,2022-07-29 22:57:15,来自广东,50799358847,我在银河系中漂着
7125870372867687208,被救出俩人伤势不是很重，为什么不向几位好心救人者，告诉后面还有人呢？？？,3,15,1,2022-07-30 03:03:06,来自安徽,61459213871,ZH20020208
7126177426522080039,非常敬佩您能在别人有难的时候停下车去救援，不管喷子怎么说，在我心里您就是英雄。,0,0,0,2022-07-30 22:49:33,来自山西,98642217887,春晖永绽
7125808407881679653,全过程视频看了，拿撬棍那哥们是位英雄[赞][送自己一朵花],0,18,1,2022-07-29 22:57:36,来自山东,5853580542,国境万里
7125804136142455586,原视频不是破后窗以后进去看了一眼说人“挂了”吗？怎么现在说是腿夹住了？（不是责怪，纯粹疑问），能救出两人已经很厉害了！,11,24,2,2022-07-29 22:40:28,来自浙江,12676521479,该用户专看直播
7126018509846397732,看过六分钟的视频，各位路人救人应该点赞表扬，但是过程中几个大老爷们畏手畏脚，不够果断，甚至有一男的还站在车旁一手插着腰在抽烟看着。如果速度快一点，尽全力，那个女的应该能拉得出来，在后面就看了一眼后排的没有动就说挂了随意下结论放弃救援，就算是具尸体也尽能力拉出来呀，那时候车又还没着火。你们要是说我键盘侠我也不反驳。,5,5,1,2022-07-30 12:32:34,来自广东,6692966866,天快跑
7125993764434723584,当时救援的人要是再多两个，可能都能幸免遇难，货车司机忙着救人时如果有人灭火，或许结果不一样,5,23,2,2022-07-30 10:56:13,来自北京,6103568948,莫等闲79315641
7126032928958169897,论安全带的重要性，该车一共三名乘客，前排主驾和副驾肯定都是系了安全带的，结果只是轻微伤，前排安全带这是交通法规的硬性要求，必须要系。但是第二排，第三排一般都不会有人系安全的，所以这次后排乘客就挂了。这次事故提醒后排也需要系安全带，特别是在高速上。逝者安息[祈祷][祈祷][祈祷][祈祷][祈祷][祈祷],2,8,0,2022-07-30 13:28:19,来自湖北,817689890933304,奇谈与怪论
7125791846592267020,车辆整体变形把人卡住了，一般需要消防用破拆工具才能救出，一般人也可用车上的千斤顶顶起来，可车头着火根本不可能这么短时间找来工具帮助脱困，这么高温没防护的情况很难靠近明火把火源扑灭，就几分钟的事你很难救人！,3,20,0,2022-07-29 21:53:09,来自广西,3420005414,彩色马
7126123530802266913,最大功臣是大货车司机。,0,1,0,2022-07-30 19:20:31,来自江苏,1613706544284988,用户www666
7126031119006843683,救人司机，您是见义勇为的英雄，不用在意别人怎么评论！,1,1,0,2022-07-30 13:21:08,来自湖北,1077990146716973,淡紫色的回忆99
7125989643455349537,我觉得这起事故有蹊跷,11,14,3,2022-07-30 10:39:45,来自湖南,3079096519373307,华中小骄傲
7125938783786664719,看到这个消息，我默默的感谢上海大众斯柯达。撞断电线杆，路牌钢管，树，气囊爆了，车门自动解锁（副驾门不能完全打开），人没受一点伤。,0,8,0,2022-07-30 07:23:14,来自湖南,110877664501,有知蜗牛
7125791352868389668,百万车，还不如国民品牌五菱质量好,18,109,1,2022-07-29 21:50:59,来自广东,3048297596726199,淡定钢琴JF
7125825145780568839,学学林志颖的家属，这两个获救的人的家属也应该自觉奖励这几位救他俩的命的英雄。,8,45,5,2022-07-30 00:04:02,来自广东,1103519250134552,好学小羊yw
7126005346283701022,大家都在关注门打不开，其实门都被撬开窗也砸开了，救援人员都爬进去了，没能救出最后一人的原因是被夹住！这台车里面已经挤成一团了，外观只是车头变形而已！,0,0,1,2022-07-30 11:41:28,来自广西,95732732363,唏嘘的摩的佬
7125951420578792230,明显车门锁有问题，碰撞后车门锁自动解锁是汽车的基本安全性设计要求，这辆车完全表现不合格。别说坐在后座的人，其他几个人，要不是司机大哥果断出手，在车门锁无法打开的情况下，自己根本就出不来，大概率要挂掉。,0,8,0,2022-07-30 08:13:11,来自广西,465789280858654,儒雅豆花7W
7126047916984484645,救了两个人还有一个没有救出来心里难受。善良的司机点赞,0,0,0,2022-07-30 14:26:57,来自江苏,1310211028033320,知情达理风筝J
7126028263877051176,死者家属可以向雷克萨斯厂家要赔偿金，这么贵的车尽然能撞着火，着火了竟然没有灭火功能，电动门自己不滑开也就罢了，还自己给锁死，厂家最起码赔2000万人民币给家属,2,23,2,2022-07-30 13:10:02,来自山东,4393284875586723,哎吆妈呀我去
7125791288649155358,就是开车这个司机的责任 本来是在匝道上 速度并不快 他能撞上护栏 肯定是玩手机导致的。而且装车之后他没有及时手动解锁，发动机没有熄火，车钥匙是无法解锁的。正是这个司机的低级失误。导致了车门打不开造成人员伤亡。,17,32,4,2022-07-29 21:50:42,来自辽宁,6828739803,浩瀚瀚
7125835220381221667,没有一个年轻小伙子，有的话说不定能救出来,8,16,5,2022-07-30 00:43:00,来自浙江,92995994152,行者五六七
7126112436851753731,那个拿着撬棍的大货车司机大哥最值得称赞的，从头到尾一直在救援！,0,0,0,2022-07-30 18:37:39,来自安徽,103104796635,活着🉐折腾101
7126039578544538405,人间悲剧为救人的赵先生和货车司机，点赞👍👍,0,1,0,2022-07-30 13:54:24,来自江苏,449055195137640,坦荡的饺子5i
7125657751183196960,昨晚上群里有人发了视频，总共六分钟，只救出来两个，可惜了,6,27,1,2022-07-29 13:13:05,,51607864967,认真的小欧
7126041880915886852,大货车司机好样的,0,0,1,2022-07-30 14:04:04,来自江苏,3359741942454125,可爱小兔兔4929
7125790233907921694,司机跟副驾系了安全带的，后排的那个人应该没系安全带先死了，然后才烧的,8,11,3,2022-07-29 21:46:43,来自湖北,5951283115,港中第一帅
7126050828720538383,安全与否好像不能和售价成正比，再说这车在港澳才几十万港币一台，在日本本土那是更便宜，到了大陆售价就成倍的增长，不知是谁昧了良心钱，此次事件以后，雷克萨斯走下神坛应该是板上钉钉的事了。,0,0,0,2022-07-30 14:37:41,,2537315023196868,淡泊的宇宙lO
7125992876052054798,雷克萨斯看来也不行了,79,345,8,2022-07-30 10:53:21,来自北京,14521858447,星星之晨1
7126175196087862029,那种网喷 就是被人请了做键盘侠走流量好得钱。这位救人的大哥，不用理会那些“人”，你们救人的行为我给你大大的赞。,0,0,0,2022-07-30 22:40:45,来自广西,77238859755,小米6
7126041788028273422,给见义勇为的司机点赞，应该嘉奖。,0,1,0,2022-07-30 14:02:58,来自天津,103241616755,田姐天津
7126188082096898849,您是英雄，是好人，能有一个人指挥才不乱，不用管那些键盘侠，因为他们不在现场，能救出两人已经很不错了,0,0,0,2022-07-30 23:31:36,来自广东,94302869101,完美芒果XD
7126074034940953378,我看了几位司机从发现车祸的那一刻到救人的全视频，司机确实尽力了。,0,1,0,2022-07-30 16:07:47,来自广西,3606023803769231,只管幸福
7125998294160966400,为救人司机点赞[赞][赞][赞],0,74,0,2022-07-30 11:13:39,来自福建,1829179805925725,Dr茳
7125777914448806664,坐后面的应该是老板,5,8,0,2022-07-29 20:58:50,来自天津,4840480329,yuan198302
7126178972966421255,见义勇为实属不易！广大人民群众的眼睛是雪亮的，为您的义举壮举点赞！至于那些喷子，就当它们是一股臭气吧！衷心祝您及家人身体健康！平安喜乐！！,0,0,0,2022-07-30 22:55:33,来自新疆,111404925782,海之翼502
7126015572894384907,汽车电子化自动化程度高，再带来更好驾乘体验后，也带来一些新的问题，如断电后车窗车门打不开等问题，近些年出过几起车泡水车门车窗打不开，加上司机不掌握自救知识，淹死在车里的事件。很痛心！提高车辆设计安全的同时，关键还是司机要把握好驾车安全，避免悲剧发生。,0,0,0,2022-07-30 12:21:27,来自天津,70943899209,不是茄子
7125791481487131392,lm舒适型好噪音小，不排除司机犯困造成事故！“谢大脚”车祸就是例子。,6,9,3,2022-07-29 21:51:19,来自湖北,104011647934,槐里堂
7126042510040105731,好人一生平安，为见义勇为的英雄点赞！,0,0,0,2022-07-30 14:06:22,来自湖南,106021037016,心乐在胸
7126113996625249039,都在转移话题了，雷克萨斯反而很官方。,6,77,0,2022-07-30 18:42:51,来自广东,52095358562,陈氵钅
7125826670938211087,我13年开着新买的宝马525撞树上了，不光解锁车门，玻璃天窗都打开了,8,23,2,2022-07-30 00:08:42,来自辽宁,50947563602,运筹帷幄光束an
7125932860750086947,中间坐是商务独立坐椅，能前后调节移动。受到撞击后受惯性前移致最前端卡住那位女士腿部，以致起火后没能及时救出。希望相关主管单位好好查查，撞击后起火有些意外。估计以后的成功人士再坐。商务车时会考虑考虑到底做哪一排,2,8,3,2022-07-30 07:00:18,来自河南,94762304737,非洲小白张
7126038917723456267,太可惜了，为救人的赵先生和货车司机点赞！,0,1,0,2022-07-30 13:52:09,来自广东,1697252240277662,清新蜻蜓wz
7125794288797336334,这价位但凡开的是BBA都不至于这么惨，我不是德粉哈。日系脆皮省油不省命，数月前经过一事故现场，一老太骑电瓶车把轩逸后保险杠撞烂掉地上，老太倒地，电瓶车毫发无损，把我看笑了,12,36,3,2022-07-29 22:02:30,来自江西,110222246918,孤独之路
7126126036202586912,尽力尽心，救了两人已是不易，见义勇为，不该自责。,0,5,0,2022-07-30 19:30:16,来自天津,5951234147,青涩奶酪5
7126028916171129604,司机怎么开车的？为救人司机点赞[赞][赞][赞][赞][赞][赞],0,0,0,2022-07-30 13:13:36,来自四川,871277159804590,刷刷小米米
7125778374098010912,车门打不开，哎，家属起诉吧，200万的车。。。,20,92,2,2022-07-29 21:00:44,来自广东,51148301044,吃瓜不吐壳
7126192538951959309,网上什么人没有，不要理就是了。我们知道看到出事能伸出援手都是善人。,0,0,0,2022-07-30 23:48:49,来自广西,6016390608,蓝色的夜oOO
7125796481189643008,有这个车不是一般人，因为Sienna都炒到100万，雷克萨斯商务车就差不多要150-200万。估计后排座位上的乘客没系安全带，大多数天国人没这个自觉，理由是不舒服。一定要系！后排、第二排的所有人。安全带可以挽救43%，安全带+安全气囊可以挽救60%前排司机和乘员；安全带+安全气囊+顶部气帘，获救比例进一步提升，尤其是在非正撞的情况下；再加侧气囊，有效降低侧撞下半身瘫痪的概率。长长记性吧,3,20,3,2022-07-29 22:10:39,来自加拿大,3876198369,非常汽车VAUTOS
7126061650985239309,我的别克撞完门就开了 但是后备箱不开 估计怕丢东西 安吉星还帮忙呼叫了交警[打脸],0,2,0,2022-07-30 15:20:08,来自河南,1454762319,扎姑娘的小辫子
7126040420970349353,以前车门里面都有一个锁车自动上下的小揪揪，应急的时候手提一下就能打开门了！！！现在都为了好看给取消了，或改位置了！关键时候还是能逃生的！,2,4,1,2022-07-30 13:57:10,来自山东,93400731300,鲁遇有缘
7125855968143328030,感觉这个司机有问题，意识清醒却一问三不知，希望仔细查查他与后排女子的社会关系以及后排人有没有买巨额意外险等产品！,2,11,0,2022-07-30 02:07:08,来自江苏,95589988896,南京记忆
7126033813398471458,驾驶员有车钥匙，为什么不开车门？难道是吓蒙了？,0,0,0,2022-07-30 13:31:44,来自江西,470247126344605,奋发有为知情达理妞妞
7126040683341382432,以后开车出门，车上我得备上撬棍，真再遇到雷克萨斯，救人也有工具,13,52,6,2022-07-30 13:59:31,来自山东,103699098896,见识新农村
7126048748546999040,"路人救人是大义所至，并非义务。
向见义勇为救人的司机致敬。
生命真的很脆弱，且行且珍惜。
家属节哀。",0,7,0,2022-07-30 14:29:37,来自宁夏,2937487360267550,张辈律师
7126086051747463974,大货车司机冒着生命危险去救人，他已经尽力了，为这样的平民英雄点赞。,0,1,0,2022-07-30 16:55:08,来自北京,747267300798904,幸福水滴91
7126054767432024866,为救人的赵先生和货车司机点赞，好样的[赞][赞][赞][赞][赞][赞][赞],0,0,0,2022-07-30 14:52:55,来自山西,3430954873129235,热情的风筝3h
7126051661772702499,为好心救人的赵先生和货车司机点赞，愿逝者安息。,0,1,0,2022-07-30 14:41:05,来自山东,92588505631,王刚279526656
7125848655134851874,前面两个都救了后面那个也一定能救，就不应该说那句没气了，因为特殊情况不能主观臆断，一下把大家的积极性都浇灭了，眼睁睁看着一个大活人葬身火海，唉！不过能在危急关头做到这样也是舍命相救了，换作大部分人可能并没有他们做得好，只能说遗憾吧[祈祷],3,7,1,2022-07-30 01:36:05,来自广东,3932079677,搞笑沈公子
7126179190223029030,能不顾自身危险去救人，就是见义勇为的英雄，不要理会无端的指责。,0,0,0,2022-07-30 22:56:51,来自广东,426233410624718,何满吉
7126099115825890083,救人司机都是英雄，愿伤者早日康复,0,1,0,2022-07-30 17:45:05,来自黑龙江,2872363348401117,热心钢笔uc
7126039753564603169,救人司机已经尽力了,0,0,0,2022-07-30 13:55:35,来自四川,382240592232750,文采芳华0809
7126154747593097984,尽力了就行，别管别人说什么，能去救人，本身这个行为我们应该敬佩！！！,0,1,0,2022-07-30 21:20:36,来自山东,4049247350,卖潮品的宝妈
7126141118546314018,为救人的赵先生好其他好心人点赞！,0,0,0,2022-07-30 20:27:45,来自广西,4072205838458541,英明果断豆浆3w
7126016014718141218,我的天，居然还有网暴救人司机的？不可置信,0,12,0,2022-07-30 12:22:27,来自浙江,75362944261,花花木兰兰木花花
7126098664606581516,家属应该重酬感谢救人的司机,0,0,0,2022-07-30 17:43:54,来自广东,2519734559973092,我爱吃蜜瓜123
7126156256293094176,这司机可能这辈子都不会救人了,0,0,0,2022-07-30 21:27:11,来自四川,76093856435,对镜见白发
7126015597627851535,为冒死救人的多名热心英雄司机点赞👍 也为被烧死的女子感到心痛。,0,0,0,2022-07-30 12:20:44,来自广西,2419399706806380,无双芒果0T
7126047739951137549,还是福特厚道，不仅配置主动刹车碰撞预警，即使上锁了，在内部也可以随意开锁开门，这是物理结构，不是电控的，美系车各方面真心不错，但是大多数人不懂，崇尚大众丰田本田这种减配车！,0,2,0,2022-07-30 14:26:04,来自吉林,4336751255,德才兼备柳叶
7126030968536269603,向救人的司机师傅点赞！,0,0,0,2022-07-30 13:20:39,来自山东,58750796340,仲秋月5
7126030076252046117,好人一生平安，为见义勇为的货车司机点赞！[赞],0,1,0,2022-07-30 13:17:22,来自安徽,85217618351,文竹2191
7126055002372227881,救人司机已经尽力了，好样的，救人一命，胜造七级浮屠。为司机点赞[赞][赞][赞][赞][赞],0,0,0,2022-07-30 14:54:06,来自福建,103954873089,瑾zi
7126028563040011046,救人司机已经尽力了，为无名英雄点赞！,0,1,0,2022-07-30 13:12:06,来自四川,4019412109376695,乐天派豆花mxO8WT
7126055686362415879,为救人的善良司机点赞！[赞][赞][赞],0,0,0,2022-07-30 14:57:08,来自印度尼西亚,2845188358153155,海上看落日
7125801717396030222,别说电车起火了 油车一样起火,4,0,0,2022-07-29 22:31:12,来自四川,15547394298,俊俏书签PX
7126166401940800288,雷克萨斯必须要给死者狠家属一个交代,0,0,0,2022-07-30 22:06:24,来自陕西,3369317999051727,勇者阳光9Z
7126020049186013984,事已至此，只能说，还好解救遇难女子时她已经失去了知觉，否则眼睁睁看着大火扑身，那种恐惧感，得多绝望啊,0,0,0,2022-07-30 12:38:59,来自山东,107873696775,取个什么名字能通过
7125810261646459680,高速路管理部门要负责，限高门放在那里直接导致的事故。,2,17,2,2022-07-29 23:05:11,来自北京,66303001825,才思敏捷橙子Fl
7126011867516207879,为热心司机点赞，有些键盘侠就是喜欢蹭热度，这样的好人还要遭遇网暴，没天理了,0,1,0,2022-07-30 12:06:53,来自四川,57365585975,冬日滴暖阳
7126034889110995725,救人司机己经尽力了，为他点赞了[赞][赞][赞],0,0,0,2022-07-30 13:36:00,来自重庆,2938307802564599,ADGJL芬
7125786055718241024,驾驶员只是受轻微伤，难道不能应急处置？至少得帮助同乘人员！,1,23,1,2022-07-29 21:30:00,来自浙江,105423434273,木那黑皮
7126017441896956676,他们已经尽力了，说得难听点他们是没有义务去救人的，换作其他人估计都没有他们勇敢,0,80,0,2022-07-30 12:28:26,来自云南,72168172102,上进钢笔YP
7125811237296309026,再好的车，遇到大事故时车门都是很难打开，不是被锁死就是车门变形后锁体损坏，其实可以效仿飞机座舱盖的设计，需要时可以把门整个抛弃，方便救援。,12,9,5,2022-07-29 23:08:15,来自辽宁,53883275342,加肥猫58
7125995713443447559,活活烧死多痛苦[流泪],34,71,3,2022-07-30 11:04:06,来自上海,95425926364,杨、小姐🐭 🌻
7126074915488514854,现在的社会，总有人喷的。问心无愧就好，为你点赞,0,7,0,2022-07-30 16:11:59,来自云南,4696847624,创意巫师—商业拍摄
7125822333088154400,不明白前门打开了，探头进去看看一目了然，当然被救的两个人一声不吭，也不迅速说一还有人，这是个迷,3,15,1,2022-07-29 23:52:50,来自广东,53641634091,莫维奇5
7125807256494998276,爬进去救后排乘客的司机大哥说后面的乘客已经挂了。希望那个乘客死得没有痛苦吧。[祈祷][祈祷][祈祷],0,12,0,2022-07-29 22:53:33,来自北京,4575101047,水龙草
7126038596481860367,救人的司机已尽力了，愿逝者安息吧！,0,0,0,2022-07-30 13:50:14,来自贵州,1754433653328248,健身操玉兔75
7126088065504346918,救人的[赞]， 可能就因为怕碰瓷的，反咬一口的，导致救人者一开始不敢展开，更大幅度施救，甚至可能怕硬翘车门弄坏车，怕砸破车窗划伤别人反而被告。 导致可能施救时会谨慎很多,0,1,0,2022-07-30 17:03:05,来自广东,5965287491,我们一起酒过的日子
7126096815698903823,为救人的几位司机点赞，救人一命胜造七级浮屠[赞],0,0,0,2022-07-30 17:36:06,来自广东,883644591515939,学习少年阿缪
7126046038922248974,看了视频，一般人看见事故，直接开过去了不管不问！拍视频大哥好心，停下来招呼其他人帮忙救人。前面五分钟浪费时间了，直接砸窗救人，里面那个可能是昏迷不醒并没有死，唉😔,0,2,0,2022-07-30 14:19:33,来自广东,6105572310,暴走萝莉J
7125806600069415715,开过埃尔法在高速上发飘，车皮很薄，车漆也薄，不知道为什么都接近200万的价格了，为什么不在安全性上多花点钱,62,85,3,2022-07-29 22:49:56,来自山东,6045989389,烁烨观察
7126164455792427779,那么危险冲上去救人，我们眼不瞎，看得真真的！为你点赞，支持你！谴责那些网暴的人，空有一张嘴！！！,0,1,0,2022-07-30 21:59:02,来自安徽,1860949234,子夜0404
7126159887949251336,老哥，网络就是这样，喷子总会有，不值得和喷子计较，浪费时间，影响心情。你是记录者，还原事实真相，对之后的调查有帮助，也是吹哨人，而且也参与了救人。最起码如果没有你带头下车发起救援的话，伤亡人数就不止这个数了。,0,0,0,2022-07-30 21:40:52,来自广东,60622186979,Mr8036
7125812976573121321,救人的都是好样的，但是如果果断的砸侧窗的玻璃，或许三个人都能活下来。估计是豪车吧 群众开始不敢下手吧。。。,19,9,4,2022-07-29 23:14:48,来自上海,6826786148,那片深蓝色
7126067170417083170,车祸猛于虎！为那名施救的司机点赞！,0,0,0,2022-07-30 15:41:13,来自山东,97615864282,冬风无语1
7125820828570829581,最可恶得是被救者一男一女，意识清醒，外面几位大哥一直问里面还有没人，竟然不出声，这俩被救者是谋杀，看了视频过程，如果一开始砸窗，救延时间更多，那短路是平南段。,2,27,2,2022-07-29 23:46:59,来自广西,3782921476,林开心gg
7126158431681741579,如果我遇到 估计都不敢停下来，更不会去救人了。老哥很勇敢拉。,0,0,0,2022-07-30 21:35:47,来自江苏,5897606362,不自由的奶茶
7125800943840658191,旁人过来救援都很着急，被救出的司机只是受了点轻伤却没第一时间告知后排还有人，因脚被夹住救不出来被火烧死的得多惨，家属得难受……[祈祷][祈祷][祈祷],0,11,0,2022-07-29 22:27:47,来自广西,50269347777,文子126344305
7125994205553525536,为赵先生的救人行动点赞！这起事故再一次告诉我们主要交通安全。[祈祷][祈祷][祈祷][祈祷],0,5,1,2022-07-30 10:58:34,来自湖北,1283828650621248,涵晖王京
7125822430597202718,司机太重要了，遇到不靠谱的司机真是倒了血霉！！！如果后排坐的是老板，那估计……,0,9,0,2022-07-29 23:52:25,来自湖南,2282182797165292,Dd5009
7125793580219712267,侧拉门是最安全的，侧滑门就适合货车,1,10,1,2022-07-29 21:59:51,来自山西,4338159332,四眼二比中青年
7126021423097217829,雷克萨斯回应“遇车祸车门疑未解锁”：积极配合调查。态度看着还好😁唉😔愿逝者一路走好，生者早日康复[祈祷][祈祷][祈祷],0,0,0,2022-07-30 12:44:07,来自贵州,2260196575690397,热情金桔FW
7126042835510084367,虽然不知道遇难女乘客具体的被卡情况，但是看很多其他救援视频，就是专业救援的来了，用破拆专业工具都要弄很久，何况是几个没有救援经历、还是徒手救援的好心路人,0,8,0,2022-07-30 14:06:49,来自辽宁,3811037148,schuker0828
