7125826022469206816,安全一定要注意！,43,332,16,2022-07-30 00:07:28,来自广东,51726686285,演员吴云飞
7125810849847296768,人间悲剧！为救人的赵先生和货车司机点[赞],4,5999,13,2022-07-29 23:06:32,来自福建,4142560058023691,薇薇逛红尘
7125957795417064205,雷克萨斯为什么没有碰撞自动解锁呢？如果碰撞自动解锁的话，我估计车上的女子还能被救下来,198,743,12,2022-07-30 08:37:07,来自江苏,76290260217,80后小红
7126085825812628237,尽力尽心，救了两人已是不易，见义勇为，不该自责。,11,2918,5,2022-07-30 16:53:43,来自湖北,2454556789718536,风间若花
7126037597096837926,为什么要网暴救人者？好人一生平安，应重奖！,47,1849,6,2022-07-30 13:47:00,来自河北,88106702777,南山草木香
7126108460072731432,危急关头敢于出手救人，佩服你[中国赞],1,1519,4,2022-07-30 18:21:24,来自广东,106618994032,绿映红
7125997753301795599,我也难受，万一只是晕了就是活活烧死了，谁看着都心疼。救人的尽力了！,15,162,0,2022-07-30 11:11:46,来自山东,75559784576,凤啊凤
7126043950288749327,讨厌自动锁门？买个配置再高点的，碰撞自动解锁不就行了。,24,26,1,2022-07-30 14:11:02,来自安徽,4207080269,众泰卷尺事业部
7126043946148856610,生命脆弱，开车一定要打起十二分精神，保护自己，也保护他人！逝者安息！,1,29,0,2022-07-30 14:11:01,来自广东,97481095231,广州古东玲律师
7125802753682768679,我觉得好车最直接的标准就是安全！,428,2147,18,2022-07-29 22:35:37,来自河北,17593720291,灋臧辵噵
7126084267268129551,不管喷子如何，应该为你及所有的救人者点赞！你们尽心尽力了！,0,585,2,2022-07-30 16:47:22,来自陕西,9770454776,王宏博
7125972345474745127,"怎么会发生车祸的？司机打瞌睡了还是看手机了？
还是车爆胎了？",108,73,7,2022-07-30 09:34:00,来自上海,111118246541,妖小蛮
7126168145198416680,为什么不分青红皂白要网爆救人者，这样以后还有谁敢做好事[撇嘴][撇嘴],1,38,0,2022-07-30 22:12:42,来自辽宁,6932837074,手机用户九品芝麻官
7125811088000025378,打官司吧！不然太冤了。百万豪车安全性这么差。,2,4,0,2022-07-29 23:07:31,来自江苏,2242647179398894,阿汤哥和皮皮妞
7126000316771828518,好样的，普通人最能挺身而出，救人一命，胜造七级浮屠。,6,570,7,2022-07-30 11:22:21,来自广东,3483708088662984,荷露Eric
7126139094359065379,"救人英雄们已经尽力了，萍水相逢，不顾个人安危，拼尽全力相救，尽管结果不尽人意，足够温暖整个社会。
想起几十年，我们村的土灰窑里掉进去一台拖拉机，全村所有男人都跑去救人，齐心协力把人和车都救上来。
也正是因为这样的人和事才温暖了人心和整个社会。",0,4,0,2022-07-30 20:20:08,来自河北,2590877226121230,庄周折蝶
7126155547619115787,遇到突发事件，有个指挥非常重要！因为很少有人能够冷静处理！特别是这样的事情，必须争分夺秒救援！要在保证自身安全的前提下，在最短的时间里做最多的事情！这就是为什么有些人适合埋头苦干，有些人适合走上领导岗位！为你们点赞！[赞][赞][赞],0,101,0,2022-07-30 21:24:22,来自广西,910049572295523,幸运伍陆柒
7126093301832794919,能停下来的都是好人，别听别人说，一百个人有100个心眼，轮到他们指不定什么样呢,4,1295,5,2022-07-30 17:23:25,来自黑龙江,75641192558,飞鱼档
7125805764446487310,高速上怎么有限高架水泥墩，不是只有ETC龙门架的吗，这个水泥墩有没有占用一部份道路？,142,815,32,2022-07-29 22:47:02,来自湖北,18712747326,湖北赵子龙
7126090884169089796,这种车祸是不是司机要坐牢？,5,12,2,2022-07-30 17:14:14,来自广东,62282075110,耿直的英子
7125849434533200677,后排是航空座椅，坐着舒服，肯定不系安全带！所以伤势比较严重！,107,376,14,2022-07-30 01:41:58,来自河南,5999802354,热评社
7126081499006731008,"其实我想说，在这种突发事件面前，很难得有一个指挥，不然都慌了，没有一个人在冷静的思考，东一下、西一下的，耽误了宝贵的营救时间，可能一个也救不出！
给您点赞！[赞][赞]
向您致敬！[祈祷][祈祷]",14,1655,3,2022-07-30 16:36:41,来自山东,6908640062,观沧海之澜
7125909618609963813,救人司机已经尽力了[赞],10,630,5,2022-07-30 05:32:25,来自广东,110937410942,平凡的生活NN
7126185394898486020,危急关头挺身而出，您就是平凡的英雄，佩服你！,0,46,0,2022-07-30 23:20:48,来自河北,88106702777,南山草木香
7126079016872280862,老哥是好人，你不用在意那些人说什么，自己真的救人了就是为自己和子孙后代积德。我也曾经在车祸现场救过人，我当时大概17-8岁吧，现场的两人骑摩托车和泥头车相撞，一人昏迷一人骨折无法动弹。围观的人最多就是报警报120等人来处理。至今忘不了那个骨折的小哥哥趴着地上，哀求着说：”求求你们，送他去医院，救救他。”最可恨的是，围观中的一个人去摸了摸昏迷的人的脑袋，说：“要死了，要死了，全部都是血”他还要将血抹回到人家衣服身上。当时我看见真的是气得五窍生烟，围观的一堆人个个都是比我大十多二岁以上的人，居然一点同情心都没有，不赶快去送去医院，他会死的。我立刻拉着我朋友截停别人的士，送他去最近的医院。钱什么的都是我垫付的。曾经有网友问我，为什么不拿回钱，我觉得和救人命比起来，钱算个屁，当时那种情况脑子里就想着救人，哪里还管那么多。只要他没事活着，家里就还算团圆了，不然他死了，他父母和哥哥还有他那个一起的朋友，该有多伤心。,32,2088,7,2022-07-30 16:27:39,来自广东,3572540578,爱着你会笑
7125685256488911623,看过视频了，有个黑衣男子从后备箱进去看的时候说里面的人没气了，也就是死了，还有人说死者是个女老板，坐后面没绑安全带，脖子断了，黑衣男的进去看到死状太惨了，立马吓得赶紧下来了,27,108,3,2022-07-29 14:59:33,来自广西,89396167568,小猫咪～
7125837400798249765,为冒死救人的多名热心英雄司机点赞👍 也为被烧死的女子感到心痛。,7,626,1,2022-07-30 00:52:41,来自四川,8949546503,暂时99
7125819306553885475,救不出来，心里创伤很久[流泪][流泪]为路过的司机点赞！！！,4,909,7,2022-07-29 23:39:35,来自广西,6907192154,En嗯Hao好
7126111075682370334,好人难做呀。以前我开车发生了事故，有一个车从右侧变道超车，我都没看到他，因为在看左边的后视镜！就把他怼翻了！下了车，我第一时间过去看看人的情况，又打了110和120报警！他家属来了以后，还不依不挠的唧唧歪歪，说我开的快！！后来交警定了对方全责，关键对方还不愿意赔钱！[酷拽],0,7,1,2022-07-30 18:31:56,来自陕西,110698409257,罗士永律师
7126007703348101926,雷克萨斯为什么没有碰撞自动解锁呢？如果碰撞自动解锁的话，我估计车上的女子还能被救下来,18,44,2,2022-07-30 11:51:02,来自湖北,79973086005,絔合兲稥
7126184002893300516,您就是民间的英雄，不用在意那些键盘侠的一些话语，您做到很多普通人做不到的事情。录像和指挥救人都说明您当时已经做到最好了，况且家属也是感激您的，也在网上表示感谢。希望您能有更好的福报。如果有骚扰到您生活或者生命安全的，建议您拿起法律的武器，网络平台的一些恶人恶语是可以追究法律责任的。谢谢有您这样的乐于助人的榜样出现在生活中，给中国人树立了很好的榜样！,0,17,0,2022-07-30 23:15:28,来自辽宁,54602310371,小野hello
7126188900086809382,"有部分人就是这样子，只会站在自己的角度以道德最高点去暴别人，实际当他们自己遇到的时候，可能会和您前面那些开车走的人一样，心里面想的多一事不如少一事，不用放在心上。
公道自在人心，但求问心无愧",0,12,0,2022-07-30 23:34:43,来自广西,57181766638,太阳宁123
7125810192411378463,几名司机冒死救人已经是大英雄！请网友留德！不要给带歪！最该质疑的是为什么门都不能打开！！！,56,696,4,2022-07-29 23:04:44,来自广东,103420478724,灿烂湖泊LE
7125691534200341279,司机出来怎么一声不吭的？也不说后排还有人！,3,24,1,2022-07-29 15:23:54,来自广东,2018331650691864,薇薇安爱土豆
7125991153421665028,估计是睡着了，要不不会这样单方面事故，我亲戚也是这样，把自己撞晕了孩子多处骨折。幸亏活了过来。,3,24,4,2022-07-30 10:45:39,来自山东,1135153943686004,无忧的风铃Gp
7125684630233154308,怎么好几次了，都是好车出事了,12,16,0,2022-07-29 14:57:26,来自山东,105792362830,心想事成77902
7126043512126309154,我也看视频，那副驾确实说后面有人，估计救人大哥没想到火燃的那么快，还有刚开始女副架这边门打不开，救人的好心人弄了好久，最后把主驾拉出来，又把副架硬拉出来的，最后一个人把后面玻璃砸烂了，说人挂了，又爬进去一个人拉，但那时火明显大了，那个人肯定是拉不出来的，他们才放弃，他们几个好心人也不好受，想着差一点可能会救出来，只能说是遗憾吧，但网爆好心人就过分了吧？,38,793,8,2022-07-30 14:09:09,来自广东,95261921972,逆境之鱼
7126121425920443172,不用理会，也不屑于理会，在我眼里，凡事参与救援的人都是英雄。我一直都认为能够不顾自己安危救人的人都是真正的英雄！不接受任何反驳！祝福天底下所有的英雄一生平安，幸福！你的善举会恩荫后代子孙的！[祈祷][祈祷][祈祷],3,186,1,2022-07-30 19:12:17,来自广东,103086112278,吴式念念碎
7126002757085201186,看到危险了但还是出手相救了，能救一个是一个，救人者司机和救林志颖的工地人员都是平民英雄，但他们不是专业人士，要求不能过高，对此危难时刻救助他人的行为，全社会应予以点赞，嘉奖，弘扬中华美德，不让热心人士心寒。,30,2636,12,2022-07-30 11:31:04,来自江苏,4142553368635247,爱生活的春风jA
7125857388439077662,"2004年的时候我作为记者亲眼目睹了一场车祸，一辆拉着汽油桶的昌河面包在一个没有红绿灯的十字路口正中间撞到了一辆渣土车并发生了侧翻。我当时在路边的采访车里坐着，距离侧翻的昌河车大概50米。
我和司机看到后立即下车，我打开摄像机边拍摄边跑向昌河车，还有一些群众也围了上来，等我跑到跟前，昌河车副驾驶的人已经爬了出来，向车后跑去。司机一侧挨着地面，挡风玻璃全碎。因为司机一侧是撞击点，溃缩的方向盘卡住了司机，好几个人上去拉都拉不动。我就跑到车后，看到那个副驾驶在扒拉车厢里的杂物，应该是在找撬棍，车厢里放着一个大汽油桶，汽油啵啵的往外流。我还没反应过来就突然起火了，仅3秒钟火就顺着汽油烧到了车头驾驶位，本来在拉扯司机的几个人不得不后退，我当时手持摄像机退到了5米开外，都能感觉到严重的灼热感！！！我一边拍摄一边大喊“有汽油桶，快后退！”我的司机同时也在拨打119电话，大家都退到了30米开外。眼睁睁的看着大火吞没了司机，也就几秒钟，火势就大到完全看不清车内的情况。我试图用摄像机拉进镜头观察驾驶位的情况，却只能依稀的看到火焰中一团黑色的东西时隐时现……
当时有一种很无力的感觉！
火势很大，但是并没有发生爆炸。救火车来的也很快，消防员把人群驱离到50米开外，然后开始向昌河车喷白色泡沫灭火剂，几分钟就把火灭掉了，我从推近的摄像机取景器里看到司机已经烧成了黑色，依稀的能分辨出黑色的圆球状物体应该是头部，两根支楞起来的黑色棍状物应该是手臂，手部已经烧没了……
从开始起火到火焰吞没整个车辆也就十几秒的时间，根本没有抢救司机的机会，司机就这样活生生的被烧成了碳……太可怕了！",97,654,20,2022-07-30 02:13:18,来自河南,4389032415,龍套先生
7126074994508972811,正义无敌，问心无愧！这番举动你已经超过了网络上99%的人，有愧的是喷子！被救的伤员要好好谢谢你们的大恩大德！,1,266,1,2022-07-30 16:12:05,来自湖北,6802324264,默默名
7126073811019039523,做自己认为对的事，不用在乎别人的眼光，往往嘴上吐槽别人的人自己也没做过什么好事，只图嘴上痛快,0,627,6,2022-07-30 16:06:46,来自浙江,4015062180174574,搁浅的鱼呀
7125680484013114115,看了视频，正副驾驶的人都出来了，但后座的不知道为什么就死了，而且是没着火前，进去救的人就说已挂了，，,33,56,1,2022-07-29 14:41:20,来自浙江,3940971602,质乙品男装
7126167663101133600,有他拍的视频，死者家属可以告赢车企，证明车辆有质量问题，车门没能打开导致无法救援，出现人员损伤。,2,85,0,2022-07-30 22:11:34,来自广东,108049565878,电影不落幕
7125667628026495751,车门打不出，不会拿东西砸开吗,21,26,6,2022-07-29 13:51:07,来自湖北,76136757371,HI小辣椒
7125935785987179298,感觉男子司机，副驾驶秘书，后排老板。,49,280,6,2022-07-30 07:11:26,来自河北,2911981406784327,恙安。
7126067269889016611,非常敬佩您救人的举动，能够在这一刻舍命出手相助，实属难得，别看键盘侠，别被他们影响，好人一生平安,1,1161,4,2022-07-30 15:41:27,来自湖北,56499660738,啥名字都用烂了
7126033117529670412,人家冒着生命危险去救人，有的人事后瞅着视频觉得人这也不是那也不是。,3,155,3,2022-07-30 13:29:42,来自甘肃,3953476906783310,德才兼备香瓜LE
7125806056881947405,看了全部视频，拍摄者全程呼喊大家帮忙救援。大货车司机拿着撬棍和其他人实施救援。先撬副驾驶，打不开。后来司机位先打开的，然后副驾驶位女的从车窗拖出来。最后砸床，一个人进去摸受伤着已经没反应了，就这样车饿火着起来了！,128,512,24,2022-07-29 22:48:31,来自广东,94333843326,玉无痕Sunnie
7125797619045647136,司机太重要了，遇到不靠谱的司机真是倒了血霉！！！如果后排坐的是老板，那估计……,111,961,16,2022-07-29 22:15:52,来自上海,18322883278,大状说法网
7126043830583345955,看到危险了但还是出手相救了，能救一个是一个，救人者司机和救林志颖的工地人员都是平民英雄，但他们不是专业人士，要求不能过高，对此危难时刻救助他人的行为，全社会应予以点赞，嘉奖，弘扬中华美德，不让热心人士心寒。,1,38,0,2022-07-30 14:10:36,来自福建,4142560058023691,薇薇逛红尘
7125791453628154658,司机估计是老板的雇佣的司机年轻，下车就跑了，为啥不帮忙，哎！,83,641,23,2022-07-29 21:51:02,来自北京,105429166895,sxp599107
7126017154272674593,只要出手救人的人都是好样的，不能去对施救人吹毛求疵，救人的都是英雄[赞],2,991,6,2022-07-30 12:27:36,来自云南,72168172102,上进钢笔YP
7125934261563835151,质问司机两大问题：单方面事故，当时在干嘛？二，为何被救出后不顾车上女乘客生死？,73,164,30,2022-07-30 07:05:50,来自广东,51217506321,厚爱然共享清洗
7126088473949651750,救急，现场指挥，必须要在自身安全的前提下，立即呼唤同伴，其中甲一打电话120，110，乙和丙救人，丁，负责现场情况突发，或者新闻记录也是可以的。我刚刚学了中国红十字抢救,3,111,3,2022-07-30 17:04:45,来自江苏,1855611438893303,青果小曼
7125809943521428264,感觉男子司机，副驾驶秘书，后排老板。,40,252,12,2022-07-29 23:03:07,来自湖北,4300502841,元知元昧
7125695040978354944,为何车上受伤者都不说车上还有人,5,23,2,2022-07-29 15:37:02,来自广西,57182317628,泡泡妞妞PP
7125812417971766055,道路千万条，安全第一条，开车真是不能有一点侥幸心理，出了事故就是惨痛的，不止一个人两个人，而是一个家和几个家庭,2,141,5,2022-07-29 23:13:56,来自黑龙江,75641192558,飞鱼档
7126162587166966539,网络喷子确是很让人反感，它们不分青红皂白，就是恶意污蔑、恶意的喷，呼吁大家别给喷子点赞。,0,21,0,2022-07-30 21:51:48,来自安徽,2983720249,江淮好男儿
7126019480559600415,为什么冒烟起火不拿灭火器？,13,15,0,2022-07-30 12:36:22,来自河南,1292631573800775,游乐场安德烈娅0t7
7126100541058745119,专业救援队伍也有指挥，让大家职责分明，提高救援效率。大哥你在现场，看视频是充当了救援的指挥，沉稳有序，让救人的英雄们救出两人，另外一人遇难不是你们救援慢的缘故，阿弥陀佛，起火的情景下救人需要莫大的勇气，参与救人的各位都是英雄，录了视频也让大家认识了你们的英勇事迹和救人壮举和大义，让车祸现场为什么救援困难得到呈现，更重要的，也让救援者们自身得到保护，你们都是真英雄！,0,146,3,2022-07-30 17:50:56,来自广东,110804850108,琛景麻麻
7126168550049366821,"他必须拍，因为有视频，别人救人才无后顾之忧。而且他的指挥已经是当时的最好了。
所以那些指责的都是无脑瞎喷。换位思考一下，那些网暴者，能做到他那般方方面面都顾及到吗。而且，还是在如此短的时间内！",3,116,1,2022-07-30 22:14:40,来自重庆,1983125570465901,风雨枫启明
7126072814305755944,问心无愧就好，为你点赞！如果不是你拍摄，也没有人会看见。,1,243,1,2022-07-30 16:02:58,来自广西,51445128599,lxlhjhhjy520
7126165932413600527,支持车主，应该给你们颁发见义勇为奖,1,36,0,2022-07-30 22:04:02,来自黑龙江,290745402006792,碎尽天下zha男
7125799166026449664,这车里遇难的乘客的位置不是说是最安全的位置吗,160,302,10,2022-07-29 22:21:02,来自河南,64095283040,零下45度13
7126123991332356871,能停下出声出力的都是好人，车爆炸谁不怕啊？这个时候先想到的是救人，[赞][赞][赞],0,72,1,2022-07-30 19:21:49,来自山东,67938035287,草自春
7126005701696340773,为见义勇为的英雄们点赞！[赞][赞][赞][赞][赞],0,124,0,2022-07-30 11:42:59,来自广东,5795965400,假香会
7126032692525007628,车门锁死，一旦从内部把手打开，自动解锁，这点应列为国标。,12,26,1,2022-07-30 13:28:12,来自河南,74980700871,废都行者
7125806555223573278,不要说活活烧死，你没有证据，从尾门破窗爬进去的大哥说没希望了，放弃了救援，考虑到第2排的人又不习惯系安全带，第2排的人很可能车祸当场就撞死了，或者重伤昏迷。,1,1,0,2022-07-29 22:50:06,来自广东,99728000872,IT小杜
7126095744091718412,还是要为救人者点赞,0,42,1,2022-07-30 17:32:35,来自山东,50273272015,墨迹微冷
7125794130529583886,男司机被揪出来直接走了都不说车内还有人，请了这个司机真是悲哀！坐中间位置的不知道系安全带没？真是悲剧！愿逝者安息！,91,1062,28,2022-07-29 22:01:47,来自广西,668158022917790,热心的小荣姐
7126017245264233257,是我不敢救，汽车爆炸可能连自己都没命，救人司机冒着生命危险在救人,3,85,2,2022-07-30 12:27:19,来自广东,63854480095,桦桦濠濠的妈咪
7126005481126396707,事故怎么发生的，现场就一辆车,11,57,5,2022-07-30 11:41:40,来自江苏,86164298119,大寶ོ🔮Up Up Up!!!
7126099169483621160,我敬佩你！别在意别人怎么说！毕竟你己救出两人！前年，我们那有两游水遇溺，一老人奋力救上一人后无力也无法再去救沉下的那人了，老人救人后在岸边喘气，竟然被人喷为什么不去救另一个！也被死者家人骂偏心，只救一个，唉！世态严凉！寡情薄意！,2,42,0,2022-07-30 17:45:12,来自广东,97104251439,用户名笙歌
7125806958078313216,严重碰撞后车门打不开就是致命的，日系车普遍用的门铰都是铁皮冲压件，变形后无法正常开启，反观BBA大众法系车都是铸铁门铰，碰撞轻了没感觉，重了直接断裂，,1,5,0,2022-07-29 22:51:17,来自山东,63521430587,不忘初心的liu
7125832787642860329,看视频了，前面两个人完全能走路，后排的人为啥那么严重呢？而且司机拉出来根本没说后面还有人！,92,239,7,2022-07-30 00:33:08,来自江苏,103176702954,开心的蜗牛121
7126047731642303232,我始终质疑这两个活着的，嘴完全可以说话，为什么不说车里面还有一个，按照当时救人者数量而言，完全有时间救出来出来，即使是尸体。,9,5,0,2022-07-30 14:25:36,来自北京,320700583511388,高贵山雀vL
7126099783906886435,救人者从后面进去，说已经挂了，那个女的是车祸撞击时已经死了，还是只是晕过去了，如果只是晕过去，那真是太惋惜了,4,8,0,2022-07-30 17:47:29,来自河北,6824755013,无名小卒qysj
7126069979908506376,说句心里话，无论是谁眼睁睁看着受伤的人而自却己无能为力去救助，心里都会难受和内疚。但这位赵先生已经竭尽全力去救人了，希望他不要再内疚了。毕竟，这样的惨剧是我们每一个人都不希望发生的[祈祷][祈祷][祈祷][祈祷][祈祷][祈祷][祈祷][祈祷]！,0,11,1,2022-07-30 15:52:27,来自云南,107710747403,爱看书的农村人
7126040433028809505,不会是一场谋杀案吧，这种撞击还不至于让后排死亡,2,9,0,2022-07-30 13:57:51,来自上海,62490858930,大风西狂人胜万象48001
7126121768166933248,这个视频我们看到了。谢谢您在第一时间停好车拦车叫人帮帮忙救人。在你的急切拦车呼救下那么多帅哥司机们挺身而出，真的好勇敢，为平凡的英雄们点赞[赞][赞][赞][赞][赞][赞][比心][比心][比心][比心][比心][比心]祝好人们一生顺畅平安幸福！！！ 前后左右你都去拉车门了，全部锁已经锁住打不开。那些键盘侠喷子们的话别理会，免得让自己生气，他们闲着太无聊了。,0,95,2,2022-07-30 19:12:50,来自广东,1217891520744327,阳光萝莉
7126070551516545826,敢直接砸车救人，真的是非常有担当，这些只管帮助别人，不计得失的人，是真正的英雄。,0,15,0,2022-07-30 15:54:11,来自云南,111559374713,大门外有一只猫
7126064750668038944,不要在意那些喷子，大哥救人好样的👍👍,1,822,5,2022-07-30 15:32:20,来自广东,4353710184997608,123848976798646
7126073639451444005,遇到突发事件就（也是最）需要有一个振臂一挥的组织者，人都有避险及从众心理，遇到突发事件没个组织者就没有行动者。,0,142,1,2022-07-30 16:06:43,来自湖北,52731105037,聪慧风声IY
7125799773869245225,越好的好车越安全，发生碰撞电脑就会自动判定锁死车门，防止人员甩出车外，如果是五菱面包车门都不需要你去开，早就自己开了。,3,10,0,2022-07-29 22:23:26,来自湖北,95324976184,自驾前行
7126048487858307871,路边那么多车，，都拦下，去借灭火器，，跟水来往引擎盖，浇水。让汽车燃烧不起来，，才有希望救出更多人,2,7,0,2022-07-30 14:29:00,来自广西,77930210595,父子情深爱墨墨
7125813793745158953,那名女子被活活烧死，那是得有多痛，隔屏幕都心痛，难受,165,658,9,2022-07-29 23:18:00,来自广西,4134603719719663,赫拉女神
7126060528568550156,现在的社会，总有人喷的。问心无愧就好，为你点赞,3,1205,9,2022-07-30 15:16:11,来自四川,4316815500,阿米豆腐的懒猫猫
7125993107467830057,别再无意义的发酵了！姐姐说得对！愿妹妹走好！,5,320,1,2022-07-30 10:53:32,来自北京,52458238219,宣宣164760158
7126041398108848931,汽油内燃机起火，有百分之八十的可能发生爆炸，可以说所有参与救援的人都是冒着生命危险，别说后座乘客当时已经死了，就是活着没有施救条件，爬进去那个大哥也应该立即出来，太危险了‼️,4,28,0,2022-07-30 14:01:05,来自北京,100725550356,那天妳沒有吃冰棍
7126027140172759843,救人还被网暴 以后别救人了 就像扶老人还被敲诈 我宁愿自己冷漠一些,13,296,4,2022-07-30 13:05:44,来自广西,3616654751,让我简简单单
7125795179495342881,驾驶员意思尚可，为什么不去救人呢？你知道后面有人啊,24,177,10,2022-07-29 22:06:12,来自山东,2343808642332140,简单高山i
7126081924917232414,你们都是英雄，不用在乎别人说什么，你们也是冒着生命危险在救人，非常了不起,0,43,0,2022-07-30 16:38:52,来自四川,1063929662683629,empty丶术
7125799255851615017,原来汽油车撞了也会起火，我还以为就电车会呢,38,42,5,2022-07-29 22:21:21,来自浙江,58652929035,哦大哥
