7126085792166462223,我看了你拍的救人视频，现场分工明确，指挥得当，本身这个录制视频也是为了展示现场救援的情景和过程，也方便警察对事故现场发生的事做出了解判断，试想一下，如果没有这个视频，那么救人的几个英雄谁知道？车门打不开谁知道，现在家属就可以拿着这个视频作为证据起诉车子厂商了。,18,193,1,2022-07-30 16:53:30,来自河南,404219713300295,小弓子
7125783516863808287,救人者使劲问还有没人，那两个被救吓懵了还是什么？,140,638,10,2022-07-29 21:20:20,来自广东,71524472687,梦菲扬
7126171504958194473,前辈，我不知道喷子们是何居心，我是给你大大的赞，相比之下，有些人可能只会帮忙报个警，不曾考虑可以施救。你们施救也是尽全力了，遗憾也没办法了。希望好人你一生平安！大多数人还是力挺你的，那少数的一部分我们也不必跟他计较，问心无愧就好,0,10,0,2022-07-30 22:25:59,来自广东,104541783555,广漂80后司机
7125825777555964712,我感觉那个司机只是轻微伤，他居然不管后排的人，别人问还有没有人也不说，太奇怪了。再怎么受惊吓也不至于这样。车上的人不是亲友也是关系密切的人，怎么是这种表现呢？,23,228,6,2022-07-30 00:05:17,来自广西,109016029258,DA威说
7126019817295446822,先不管救得了救不了，这种情况只要敢去救人都是英雄，我就不懂为什么还有人喷？,9,128,0,2022-07-30 12:38:07,来自广西,1609307854484831,塞班欠我钱不还
7126114720520340264,小强实验室曝光：雷克萨斯很多车型车门制造工艺严重造假、发生碰撞时开不了门、用低劣门绞链、垃圾隔音棉、座椅塑料壳无钢板、铁制前后轮悬架、易爆铁皮油箱、低功率发动机、最低档CVT变速箱，严重期满中国消费者。雷克萨斯发生碰撞后门打不开的事故发生过很多次，此次200多万的雷克萨斯居然打不开门，简直是个悲催的笑话。,3,2,0,2022-07-30 18:45:43,来自广东,439399924375576,高贵星球Oa
7125820153598034718,最为核心的是为什么发生车祸?,33,67,15,2022-07-29 23:44:31,来自安徽,52191091750,有怨无悔
7126015142923797281,"车头起火都不会爆炸的，最主要的看油箱有没有破，地面有没有油。车头起火是油管破损泄漏一少部分油不会爆炸。所以车祸发生后现场救援第一时间要观察有没有汽油泄漏，油箱是不是破损，可以看底盘油箱的位置地面上有没有油，底盘上方有没有油渗漏 确定没有漏油，可确定没有爆炸风险，车头烧起来后不必害怕，燃烧需要时间留有足够的救援时间。
次可惜了，坐中排卡住的应该不严重，用力拉可以脱开。",3,10,0,2022-07-30 12:19:47,来自广西,1877578268806619,股忝乐CC
7126026141290939177,希望可以奖励救人英雄。不能让好人凉了心。,4,731,4,2022-07-30 13:01:52,来自广东,2401747198028375,小迷鹿ing
7126000420686316327,门打不开可以砸玻璃啊 后尾门玻璃砸碎了就可以救出,17,10,0,2022-07-30 11:23:02,来自河北,63259834189,人生如戏185667185
7126043310065451809,死者是否撞车后死亡，警方应该查一下。,3,3,0,2022-07-30 14:09:07,来自广东,110606742784,坦荡的荷叶Ht
7126118946721399591,广西贵港市雷克萨斯车祸视频完整看了。你第一时间完整提供整个营救过程的视频，也是拦住过往司机积极参与施救的组织者和指挥者，如果没在短时间内破车门营救，救出的那2人也许会葬身火海。为你的英雄义举点赞！不必理会那些喷你的人，你和一起施救的司机的义举是社会的正能量，应大力提倡和褒扬。[赞],0,38,1,2022-07-30 19:02:42,来自广东,104770594009,博学罗夕夕
7125805318243664677,为好心司机点赞,0,64,2,2022-07-29 22:45:18,来自广东,95933791431, 刘同学
7126110707384337192,这年头，不拍个视频，谁知道会不会被索赔,1,276,0,2022-07-30 18:29:56,来自广东,3687240828,路过者
7125698829068485410,首先我们替逝者祈祷🙏🏻！可惜了女老板！说白了就是和埃尔法同版本车，30万元的车加价卖到100多万。这车的骨架根本就不硬，铁皮壳子，碰严重点根本就打不开车门，只能靠命硬，25%偏置碰撞成绩本来不合格，就不知道这车怎么在市场上销售的！,6,20,1,2022-07-29 15:51:52,来自甘肃,553751984486893,淼淼点评
7125790106505888546,驾驶员有车钥匙，为什么不开车门？,125,133,19,2022-07-29 21:45:49,来自浙江,4476807023440467,爱生活的用户哲哲
7126014466172601129,疑未解锁？本来就是没解锁好吧！如果说平时没见过事故后车未解锁的，可以去看看碰撞测试，车辆发生碰撞后自动解锁，排除车辆变形的情况，车门都是可以正常打开，这个雷车明摆着车门在未明显变形的情况下居然所有门打不开，不是未解锁是什么,5,20,0,2022-07-30 12:16:26,来自青海,51015165559,好事吃瓜群众
7126077032630485763,大哥真英雄，指挥得当，比一般人强很多了，专业消防员救人经常都有人员伤亡呢。总有不明事理的键盘侠，不过他们应该并不是针对您,0,45,0,2022-07-30 16:20:10,来自海南,158777407447816,抚00尘
7125784629344240398,看了视频，怎么说呢，前排两位伤得不算重，被救出来后完全可以跟救人的人说后来还有人，结果就是那人救不出来，被烧无全shi！为s者家属默哀！,38,373,11,2022-07-29 21:24:47,来自广东,67736602274,喜欢滚滚没道理
7126087740663366439,限高架水泥墩合理不，有没有警示标志？,0,0,0,2022-07-30 17:01:34,来自江苏,104800801485,草丛里的蚂蚁
7125797550722122530,一撞就起火 车门都打不开 要是是特斯拉估计名声就真毁了,9,18,0,2022-07-29 22:14:51,来自广东,104615013333,菊花朵朵开ya
7125979938905916171,看看雷克萨斯事故后的态度，再看看某车对待事故后的态度……,6,13,4,2022-07-30 10:02:13,来自山东,884444594439160,鲁籍黔人
7126088777835578149,能想到拿灭火器，可能会有更好些的结果，还是要为救人者点赞,1,0,0,2022-07-30 17:05:33,来自湖南,5914994383,龙武LONGWU
7126124743547601694,您是个勇敢的好人，喷子啥时候都有，不要和喷子生气，您不顾个人安危，积极救援，才救回来司机和副驾的生命，我发自内心的佩服敬重您,0,10,0,2022-07-30 19:24:49,来自吉林,5421195963,香港红苹果
7126059692308054792,出事司机应该懂的：所有日本的商务车，挂了挡是打不开侧滑门的．把挡位挂在P挡就可以手动开门。 阿尔法．赛纳．大霸王。 都一样 [祈祷][祈祷][祈祷][祈祷][祈祷],0,3,0,2022-07-30 15:12:14,来自广东,6482331159,秋1991178
7126053632260227881,四分多钟 三个人可以下五吨水泥 ！太遗憾了 ！没有经验 ！上去把窗户整个打碎！围观上来的人一下子都能看到里面 ！我相信每个人都会动手帮忙 ！当时几个人开门耽误的时间太长了 ！救人者是好样的 ！但是！我还是要说 ！遗憾 遗憾 太遗憾了 ！,2,3,0,2022-07-30 14:48:27,来自湖北,64302270318,风趣的悠闲厚德载物
7125808912045179662,这车祸有问题？前面2人自行走动，后面一人又没有冲到前面去，那有这么严重的伤，,16,65,5,2022-07-29 22:59:40,来自广东,99545973792,热情远山xV
7126139105343456040,希望他不要再被网暴，发生事故很考究心理素质和应变能力，问一下自己如果在现场能做什么[祈祷],7,188,4,2022-07-30 20:19:59,来自广东,60336650988,c4790
7126167059331465999,老哥你的所作所为值得我们敬佩[赞][赞][赞]不要理会那些喷子,0,3,0,2022-07-30 22:08:38,来自陕西,897640659433416,落叶茗枫
7125929717265400617,有人问司机为什么没说后座有人？本人以前开车发生过车祸，当时脑子一片空白，家里人的电话都记不起来了（平时能记住很多人的电话），过了很长一段时间才好一些,20,69,5,2022-07-30 06:47:55,来自山东,97871878300,嗯呢9999
7125799791145075494,我五菱宏光，一撞，车门自动开,11,12,0,2022-07-29 22:23:55,来自山东,55195708952,装X天团—副团长
7125960596545323780,好人一生平安，为见义勇为的英雄点赞👍,0,26,1,2022-07-30 08:48:24,来自山东,60259079444,刚刚看到
7126010942739596047,看视频，救人者够勇敢了，砸破后车窗钻进车里救人，发现里面人已经没气了，时间不够才没拖出来的，至少不是活人被火烧没的呀。,1,36,2,2022-07-30 12:02:52,来自湖北,3165177409,微天天呀
7126139700389135104,理那些键盘侠喷子们干嘛，自己做事对得起自己的良心就得，遇见了，伸出援手，哪怕一个都就不回来也是英雄，何况现在救回了两个，功德无量了，[赞][赞][赞][赞]给你和另外帮助救人的好心人点赞[赞][赞][赞]幸好有你们，挽回了两个人的生命[鼓掌][鼓掌][鼓掌],0,22,1,2022-07-30 20:22:13,来自广西,77548050958,小茉莉蛙儿
7126138786521776931,你是最大的英雄，好多人没有停车都走了，你不停大货车不一定会停，三条生命都不会有，谢谢您，谢谢所有参与救援的人,1,19,0,2022-07-30 20:18:50,来自黑龙江,5788586514,心若菩提徐新颖
7126008013940769571,视频我看了，人家救人，怎么还会有人去网暴人家[红脸]当时我看到那个人砸破玻璃钻进车里，我都很佩服他。毕竟那个时候车有着火爆炸的危险。,3,243,2,2022-07-30 11:51:27,来自河南,92762222874,初夏幼果
7126121514872636172,俩个轻微伤不第一时间想着下车 在那磨磨唧唧 ，尤其那个男司机责任最大，我之前在路上被一个时速70的君越追尾，我车后座有俩女乘客，我第一时间就是检查俩个女孩是否受伤，确定没事后我就下来把指示牌放在距离后车几十米远的地方，避免交通阻塞，然后打电话给交警,0,0,0,2022-07-30 19:12:21,来自辽宁,54296932311,爆弹JACKS
7126043690418062088,前排能出来，第二排出不来第一次听说，这有可能是谋杀,1,2,0,2022-07-30 14:10:39,来自江苏,2432562330890783,单车旅行Sun
7125804516976624399,按道理雷克萨斯LM这个车应该比林肯领航员还要安全，不知为何会这样？,2,1,0,2022-07-29 22:41:48,来自广东,93680104189,粤之星
7126022880357434142,昨天新阐上不是说救人者问两个被救人，里面还有没有人 ，两人没有吭声吗,55,136,5,2022-07-30 12:49:29,来自江西,2084269040081544,一往无前铅笔wk
7126036912422732585,这叫命，为救人司机点赞,0,12,0,2022-07-30 13:43:40,来自广东,109669772227,幽默白云
7125822431826690819,加价神车啊，200多W，就不能想沃尔沃 多学习学习吗？把安全 放首位啊……,38,224,4,2022-07-29 23:53:33,来自陕西,105057560088,长安样式雷
7125794609615110923,车门打开？？你确定？,11,33,1,2022-07-29 22:03:42,来自山东,92657379305,糊里糊涂一世界
7125683683826467595,"完整视频看了，为救人几位大哥点赞了
后排那个有人进去看了，说已经没呼吸了，这车门完全打不开，几个人拿撬杠都搞了半天",4,33,1,2022-07-29 14:53:56,来自陕西,52447333823,飘169391708
7125814573663339272,后面有人爬进去看了，当时就说没9了，那人的头折了,59,110,6,2022-07-29 23:21:42,来自湖北,54614731489,欣欣冉冉1
7126074175919276831,有些人的爱心道德都在键盘上，他们在现场也未必比你做得好，为你的救人行为点赞，祝愿您一生平安幸福！,0,41,0,2022-07-30 16:08:36,来自北京,2097505657168764,南疆领土
7126108074750411528,为司机师傅点赞啊那些网暴的人太可怕了。,1,293,0,2022-07-30 18:20:22,来自江苏,98308134431,绝色美女
7126073525140046628,当时情况下，能救出两条生命，已经是英雄了!真英雄，不是键盘侠那种假道义!,0,241,1,2022-07-30 16:06:23,来自湖南,5841817156,田田甜椒子
7126076222760600350,"你很棒了！敢停车下来参与救人就已经比很九成的人强了。你是个勇敢善良的人！
但是，你前面可以拍视频，但是大家开始救援的时候，尤其后面有个哥们说后座那位女士不行了的时候，没人上的时候你可以立刻自己尝试而不是再指挥他人，这一点是可以再做的更棒的。
不是批评你，毕竟危机时刻你已经做的很好了，只是如果有下次，希望可以做的更棒，
不管怎么说，非常顶你，谢谢你和其他师傅们救了两个人。看完视频我特别激动，也觉得生命不易。",4,70,2,2022-07-30 16:16:32,来自四川,67386166589,风萧萧兮易水冷
7125981092116448000,开过全视频，一个门都打不开，后备箱也拉不开，副驾女子意识清楚，救出他两人后别人问后面还有没有人，直接做到旁边休息啦，都不跟别人说后面还有人，最后是有个大哥说爬进去说已经不行啦就说这人不用救啦，驾驶员也是命大，年轻，全是撞在驾驶位,0,11,1,2022-07-30 10:06:34,来自广东,149955412492951,风姿卓越溪流9h
7125734001838965539,司机和副驾驶受伤不严重啊，怎么后排人就不行了呢？看司机几乎没啥事啊,2,2,0,2022-07-29 18:08:26,来自山东,6038166124,八大江
7125789912704205580,撞了车头，中间排的人被夹住了，奇怪了,9,62,0,2022-07-29 21:45:56,来自广东,15529395756,方堂
7126072887282664205,"希望对今后的车祸救援提供有效的帮助，首先把驾驶员侧玻璃砸开，找到全车解锁键并按下，立马拉开主驾门外拉手打开门救援，只要主驾位置的一键解锁打开了，其它车门都可在外拉手开门。救人我们不能苛求救援者，但做为一个合格的驾驶员，我们都要学会最基本的汽车常识，否则下一次危机可能会出现在我们每一个人身边！
  提醒所有的开车人，驾车不仅仅是一项出行技能，更是一门专业技术，请认真掌握好驾驶员必备的专业知识。",8,14,3,2022-07-30 16:03:43,来自广东,1908352160111223,风华野马一一汽车之友
7126172375791682340,一封见义勇为表扬信以正视听,0,2,0,2022-07-30 22:29:47,来自山东,5853580542,国境万里
7126016443615429417,再给我两分钟！！！可惜生命里有太多的遗憾。赵先生您已尽力，无需自责。但凡伸出援手都是好人、英雄！,1,28,2,2022-07-30 12:24:06,来自广东,78913540821,幸福煮义
7126032037878383401,旁边每辆车都有灭火器吧？,2,1,0,2022-07-30 13:24:44,来自福建,50810493805,阿德84
7126172671591039759,是借题发挥，人家为什么喷他，可能因为他说了车门打不开，要用撬棒撬[捂脸],1,0,0,2022-07-30 22:30:23,来自上海,66805266017,风语河岸柳
7126086124908331789,现场引导、指挥很正常，现场救助的英雄们比我们这些看视频的更遗憾没有救出后座的女士，生死有命，能救一命是一命！尽力就好！,0,84,1,2022-07-30 16:54:55,来自湖南,4016179728,08121799
7125782974766891813,商务车安全性都不怎么样，,24,43,5,2022-07-29 21:18:17,来自江苏,2422926101197772,大青蛙东东
7125992805814027021,这几位大货车司机见义勇为，舍己救人！建议政府颁发奖状！,8,811,9,2022-07-30 10:53:29,来自陕西,52126821492,成熟风声mS
7126039275615142690,我看了视频，真的很佩服那个砸了玻璃窗钻进车的那位师傅，我当时想那车都快燃起来了，这师傅还敢冒险进去，真的很敬佩，搞不懂网上为啥要网暴人家[捂脸][捂脸][捂脸],0,68,0,2022-07-30 13:52:49,来自四川,93205028056,sllwwasky2019
7125792290395849480,117匹马力？都减配到这种地步了吗？大V6怎么没装这车上？有钱人的钱这么好赚吗？,16,27,1,2022-07-29 21:54:27,来自山东,1947931262588476,找寻锅巴
7125798436519609088,为参与救人的热心司机们点赞[赞][赞][赞],16,2440,17,2022-07-29 22:18:17,来自四川,74993787382,清风明月8112
7126008406858908454,可笑的是这些网曝者在现场可能车都不停就走了，还要怪罪救人者,1,146,1,2022-07-30 11:53:49,来自安徽,50714496265,发条橙橙子摄影教学
7126074709208220431,好样的，大部分人遇到这样的事都不敢上前的。不必在意喷子们！！！,0,25,0,2022-07-30 16:10:13,来自河南,5366815092,布丁52161782
7126121271238345502,走自己的路让别人随便说，好人一生平安[比心][比心][比心],0,29,1,2022-07-30 19:11:25,来自浙江,101896327207,义乌pet塑料瓶
7125954969362154248,应分一拨人灭火，同时进行。因为救援需要一定的时间，总不能一下子把女子大腿弄断救下来。这真是人间悲剧呀，明知道人还活着，却救不了，只能看着烧。我肯定受不了，只能一边躲着伤心去！,0,5,1,2022-07-30 08:26:14,来自湖北,59390182559,微言管见
7125823436987417356,为救人的大车司机点赞，虽然有一个救不出来，但是你已经尽力了。你就是活菩萨，看了几次视频，听你说有一个救不出，你很难过。其实很多人都难过，但也不必自责，其实你做了很多人不敢做的事，你称之英雄也不过分。愿你以后的人生平安顺利，好人好报[祈祷][祈祷][祈祷],3,237,3,2022-07-29 23:57:27,来自广西,3980661375638427,快乐的风筝eY
7126076619860574988,危急时候能停下来救人，那怕只是打个报警电话，也是值得表扬的。很多时候人们都会因为害怕而选择忽视而过的。,0,46,1,2022-07-30 16:18:13,来自广东,60478521782,每日一苹果
7126150269301556008,"网络里很多国外势力，搞事情！
我们国人都是很敬佩这种救人的精神的！如果有网暴你们的我们一定不会放过那些人！",0,8,0,2022-07-30 21:03:19,来自河南,105103203614,小幸运0910
7126029482250928935,这车也奇怪，正面相撞，前面两个人没有事，居然中间坐在老板椅上的挂了。,3,4,0,2022-07-30 13:15:37,来自江苏,4472448221456908,数户用字
7125674468780999424,见义勇为紧急救人精神可嘉！想不明白那么多司机行车几十年为何不懂第一时间砸窗从里面手动开门，和撬开电池头断电，断电！门从里面人工可开，电动中控锁就由于电路故障和车门变形开门磁吸本来力度就小，所以开不了的。但关键是没人懂得撞车后必须先撬开电池头断电。！！！否则随时起火！,12,29,3,2022-07-29 14:17:16,来自广东,2352567097231156,终极元素
7126080792618861348,在打不开门的情况下，就不要撬车门了，浪费时间，应该果断的砸车窗，即使事后车主要你赔偿，法院也不会支持车主的！其实遇到这种突发事件的时候，很考验一个人的智慧和组织能力，最正确的做法应该一组救人一组拿灭火器灭火，一开始就灭火是可以的,1,3,1,2022-07-30 16:34:35,来自广东,1266258760700959,宅客孤
7126068275117048584,我支持你，见义勇为，已经是满满正能量了，冒死救人，不是每个人都能在短时间内做出完美的计划。,0,213,1,2022-07-30 15:45:59,来自河北,1991953020364459,梅子585
7126115240667890440,救人真的太不容易了，为货车司机和赵先生👍👍👍,0,1,0,2022-07-30 18:48:03,来自江西,3228603886351608,喜庆的荷叶7Y3
7125794314193666857,发生车祸，驾驶位二个人没有事情，坐在后面的人竟然昏迷？然后发生大火？迷团很大，会不会是刑事案件。,21,178,1,2022-07-29 22:02:05,来自安徽,3567657245,刘乙己
7126114170730431232,人间悲剧！为救人的赵先生和货车司机点[赞],0,1,0,2022-07-30 18:43:22,来自重庆,109233411498,直爽豆浆3m
7125817072067904290,豪华Mpv为什么撞击后这么容易起火🔥，车门打不开也是安全隐患，不然后座那个女乘客有生存的时间！,4,22,0,2022-07-29 23:30:51,来自河北,6166813974,张宝国81236966
7126014177747583747,为救人司机点赞，如果当时不走运，周边没有人，那后果可想儿知，为平民英维点赞,1,50,1,2022-07-30 12:16:18,来自福建,923212644100231,一往无前奶酪UG
7126003290730922793,这都是英雄啊，特别进车这位大哥[赞],8,197,0,2022-07-30 11:33:12,来自贵州,59065719697,静心奋斗3
7126177341587456783,不要在意别人怎么说，下车救援，想了办法，救了两个，对得起天地良心，行了。那些说这说那的人，身处当时，还不知道咋样呢[比心][比心][比心],0,1,0,2022-07-30 22:48:30,来自湖南,562539543927597,秋风引何意
7125803984006382368,救人的都是英雄，临危不乱，尽力就好，先顾好自己安全，才能救人，谁的身后不是一家老小期盼着自己安全到家，舍己救人有时候真的不鼓励不提倡。,3,166,2,2022-07-29 22:40:33,来自广西,2858327319774012,我的世界缺点光
7126008566259057408,不要坐副驾驶,45,49,8,2022-07-30 11:53:33,来自四川,65632722775,海鸥飞CO
7126007898589348611,这世上有一种恶就是，袖手旁观看到别人帮忙还说三道四风凉话连篇的人！,5,499,4,2022-07-30 11:52:09,来自辽宁,6397590827,玫瑰人xixi
7126094147719021316,汽车漏油随时会爆炸，你们能不顾自己的安危救人！为你们点赞！走自己的路，做自己觉得对的事！对得起自己良心可以了。不必在意那些人说什么。,0,30,1,2022-07-30 17:26:33,来自广西,70528123963,幸福紫色的郁金香
7125696551942783778,这路太干净了，路边捡个石头，把玻璃砸开，就不会有伤亡，这火势也太猛了，太快了，跟时间跑不赢！,1,4,1,2022-07-29 15:42:55,来自广东,51156805188,聆听者hhwwff
7126033877139440397,按里面的开锁键。我记得丰田凯美瑞里面有个小钮拨一下，就可以从里面开门。还有一个解锁🔒开关。可能没开过这车的不知道开关性能。为什么不及时熄火。刚开始只是烟雾。哎，一切责任在驾驶员，怎么开车的？,0,3,0,2022-07-30 13:32:27,来自江苏,75926511361,苏南机场
7126104878741160742,为了救人的赵先生和货车司机点赞,0,1,0,2022-07-30 18:08:23,来自广西,286315571346299,思妈妈3372
7125965859042444067,后排的乘客的生命完全葬送到司机的手里。后排车门完好无损，司机被救出来神志清醒完全可以独立行走。也许中控解锁后门就可以打开救人。但是什么也没做独自离开避难。[发怒][发怒][发怒],11,36,4,2022-07-30 09:08:07,来自甘肃,100021017175,龙long399
7126044304933946127,看视频，救人司机几个很勇敢很棒。从驾驶室拉出那男的，那男的没事还能站着走出来，很淡定，一点不着急的样，没想着车上的其他人还好不好,0,17,0,2022-07-30 14:12:30,来自广西,2053484861728024,默默哒ai
7126035198885724963,这个事故原因不得而知，但是中间的女子为啥会被夹着腿这个就不知道了，而且希望改善一下碰撞后锁死车门这个固定作用可以活动一下考虑万一有什么事情从其他方向能打开门以防万一[祈祷][祈祷][祈祷][祈祷],0,3,0,2022-07-30 13:37:01,来自江苏,1455352521957091,木木冰月520
7125794841258574599,117匹马力？比1.5T的宝骏车还弱？不可能吧,4,8,0,2022-07-29 22:04:35,来自广西,104673571778,十四阿哥3478
7126048647284327205,小车一般都容易处理的，，就是人一遇到这种突发事件，，都是冷静不下来。。一时想不出更好的办法，救人,1,0,0,2022-07-30 14:29:51,来自广西,77930210595,父子情深爱墨墨
7126084477914301218,"第一车头为什么会起火。油箱在车后又不是电车
第二最安全的后排女的没有意识昏迷了，后排又没有变形女的怎么会卡住的。而车头撞得这么严重男的没有昏迷没有卡死生龙活虎的。绝对是有阳谋",15,7,3,2022-07-30 16:48:12,来自广西,1516971566054916,臻典法民
7125893360669737760,我看了视频，有没有一种可能，后排的人可能早死了，这是一起故意的车祸，正常人的思维，救出来的两个人，应该会跟其他的人喊，车里还有人，赶快救命，而不是一问三不知，还有，中间的坐的人，腿为什么会被夹住？车祸本身撞的是头部，而且，车门都被锁死，太多疑问，只能等调查清楚了才能下定论，希望死者安息，一路走好，天堂里没有车祸,9,90,3,2022-07-30 04:36:33,来自广西,60458085606,生活理解不了的想法
7126014524444525345,两个轻微伤是重点，为什么都要等货车司机[抠鼻],8,17,1,2022-07-30 12:17:37,来自云南,111220373584,全球顶级音乐0
7125689698869674767,看过视频，司机救出来后，第一个跑了。,1,3,0,2022-07-29 15:16:24,来自广西,927626367866792,低下头吻你
7126010143560532772,车锁在前排驾驶员位置按下，后排才能打开,71,117,7,2022-07-30 12:00:02,来自广西,111302663983,毛毛虫2022lMoX
7125793159879738145,救人的司机是英雄[赞][赞][赞],2,97,2,2022-07-29 21:58:34,来自山东,105055431015,小妮可凡
7126022963945685795,我有个疑问？三个人一个姓陈，一个姓彭，一个姓朱，何来的亲姐姐[what],24,51,11,2022-07-30 12:49:21,来自广东,17292857639,蓝蓝149948596
7126020750187791112,感觉车头变形不是很严重，怎么会夹住腿的。,2,4,0,2022-07-30 12:41:08,来自山东,4234928198783003,奋斗的奋斗的蜗牛
7125786661220795172,后排都脚被夹出不来，说明车辆严重变形,42,189,9,2022-07-29 21:32:53,来自江西,100289092990,针尖上的刺客
