7126015129368101667,感觉这起事故很诡异，看着不是很严重的车祸，前排人员又是轻微伤，怎么后面的人就没了，车门又这么巧打不开，看视频救援人员打破后备箱玻璃进入看到时就明确人已经死亡了，什么样的撞击力度才能让救援人员一眼就认为已经死亡了，太诡异的事情,11,24,4,2022-07-30 12:19:09,来自海南,6750151358,70年代新深圳人
7126066974009852683,"昨天看了救人者视频，却实是非常惋惜没能救出最后一名乘客。但是还是为参与救援的人员点赞！[赞][赞][赞]…
如果参与救援的人再多几个，几组人同时去施救，早点破窗救援，可能会有机会救出来！",1,31,1,2022-07-30 15:40:56,来自广东,1116734456072392,山咔啦大哥
7126008179888358144,致敬救人的货车司机，好人一生平安！救人是善举，是情义！最可气的是这部豪华雷克萨斯车事故中所有车门无法解锁……,0,32,0,2022-07-30 11:52:06,来自江西,4699013733,悠扬的纯
7126179563323212556,非常敬佩您救人的举动，能够在这一刻舍命出手相助，实属难得，为你点赞[赞][赞][赞]不要理会喷子说什么，好人一生平安,0,0,0,2022-07-30 22:58:12,来自广西,51661172285,蒙秋欣
7125666889925739298,司机可以用车钥匙打开解锁，车门应该能打开。是不是司机开车快了,1,3,0,2022-07-29 13:47:49,来自北京,95704398972,灵巧海浪mK
7125803089654956836,觉得救人的员开不了门第一时间敲玻璃而不是先敲门，看清楚车内情况再敲门救人，我认为中间的那个人不应该是被夹住脚不能拖出来，可能是脚伸进座位底下了，进去救人的司机也有点慌怕爆炸，发现拉不动就慌忙退出来了,7,21,3,2022-07-29 22:36:45,来自广西,7010006087,啊呖呖
7126042763074306816,今天我特意去雷克萨斯4s，问销售车子不加价卖吗？先生，不好意思，我们没有那么大的优惠，销售还是很屌，,1,0,0,2022-07-30 14:06:30,来自江苏,18974251602,选车爱纠结
7125804702335959819,之前就说过，特斯拉爆燃事故，根本就不需要特斯拉发布什么声明，只要不断推送燃油车事故，自然就可以转移电动车爆燃的事件影响力,3,0,0,2022-07-29 22:43:37,来自山东,4455607323,小赌沂情
7125796716972589827,救人那几个司机师傅应该找雷车上那两个人见义勇为补偿金。看那两个人就来气，人家几个司机师傅问了好多遍车上还有没有人，就是不说话自己往远处跑。白救了负心人了检查了都是轻微伤难道大脑思维都没有了还是人性太差了。可惜车上那个没有救下来不然也应该没事。都耽误在出去那两个人身上了,9,51,2,2022-07-29 22:12:30,来自河北,63025173369,凌潇萧
7125973732942136099,我看这个视频了，组织营救的司机们真让人感动，齐心合力救出前排两个人，最后砸破车窗两个人都进去看后排女乘客了，说已经没有意识了，后门打不开施救也来不及了，第一个视频约6分钟短短第二个视频两分钟整车全部燃烧起来了，我晚上十点多看的视频整晚没睡好，感觉很难受，很可惜[流泪],0,32,2,2022-07-30 09:37:59,来自山东,100692712239,祁志浩
7125808690510840591,为什么救出的人轻微伤不喊车上还有一人呢？,34,165,7,2022-07-29 22:58:11,来自江西,50480542486,热情喜鹊UE
7125674943975211790,车门打不开是多么的绝望,1,4,0,2022-07-29 14:19:47,来自广西,52690677991,寞寞25
7125790558773805863,黑衣服司机从车尾玻璃窗进去的，他说救不了了。,23,30,3,2022-07-29 21:48:09,来自广西,6707265544,风口的佩琪
7126073899729093407,你已经做的很好了，在现场挺身而出指挥救援，问心无愧就好,0,51,2,2022-07-30 16:07:40,来自浙江,1477362436803325,汐凝
7126170467303539471,在高速能停下来救人就已经很不错了，相信大家应该都清楚在高速停车是多么危险的事情，也是冒着生命危险的。,0,2,0,2022-07-30 22:21:43,来自湖北,5881499118,静待花开68
7125860365291782912,按正常汽车只要发动机熄火了车门就会自动解锁，除非车门变形打不开，但从该事故救援视频看，只是车头受损，车门车窗都是完好的，特别是四个车门和后尾厢门全部都打不开，肯定是车门锁死未解锁的原因！这就是产品质量问题了！！,11,66,2,2022-07-30 02:22:58,来自广东,62901307946,善良船帆mn
7126087128135582464,大哥，不用不理那些网络喷子，问心无愧就可以，网络喷子一直自认为站在道德的制高点，指挥他人做事，做人。你们一定要去救人，轮到事情发生在他们自己身边的时候，比任何人都冷漠的看客，它们自己想不起他只是个活在网络里的喷子。,0,47,1,2022-07-30 16:58:19,来自广西,59181940240,喝醉酒的小伙子
7125869256876901156,首先先对救助的那几名司机致敬，追封见义勇为奖。然后追查出事司机和副驾驶的女子。明显有嫌疑，救人者一直在追问后面有没有人，却一声不吭。难道司机是个哑巴吗？看视频副驾驶女的很清醒，还会说话，怎么不说后面还有人呢？是个正常人都会先讲后面有人，请求他人救助。真的想不明白。,9,108,6,2022-07-30 03:02:54,来自广西,6161022062,得失都且过
7125667542772925219,首先点赞所有施救人员！但实在太遗憾，没有准确的方法施救，首先救人的同时必须要询问有多少人在车上受困，打不开门就要马上把全部破璃窗砸掉，现场条件是可以满足的，但施救方法不对，太遗憾了！,16,62,3,2022-07-29 13:50:16,来自广东,70961754293,一起發527
7126002715167523597,我也是去年经过一起单向交通事故的，当时的情况确实很可怕，车子冒烟，爬出来已经很困难，从外面去救人心里恐惧可想而知，不知道突发情况会如何，为见义勇为人员👍,0,4,0,2022-07-30 11:31:31,来自福建,93121512820,聪颖清风tu
7126004261116609280,驾驶员的行为我不能理解，门打开他就下车跑了，如果是他家人在里面，他还会跑吗？最起码也该嘱咐两句。而且从救援来看，撞击最严重的驾驶室，主副驾都没被卡主，后排没有变形，后排人员怎么会卡住？随着大火，很多事情估计就说不清了。,1,5,0,2022-07-30 11:36:55,来自浙江,1530141928601888,豫见你们浙是我的幸运
7125979939006006029,这车真垃圾，跟纸糊的一样，巧轻脆，我有辆丰田车门撞瘪了我自己用手掰好了，丰田的车身刚才强度最多400兆帕，美系德系都在一千二百兆帕，高强度钢材，想要安全远离日系车,3,12,0,2022-07-30 10:02:08,,3790708598909037,一路没有你a
7126076575325537062,大哥，好样的，不是你们的救援也许3个人都没有了，如果你不拍视频发出来，汽车厂家也不会重视，也只有厂家重视了国家相关部门重视了才能让汽车安全进一步，以后碰撞解锁必须强制性标配，而且保留电子解锁和机械解锁两套档案！,0,26,0,2022-07-30 16:18:18,来自江苏,82988515816,此生為伴
7126047876656399145,电子锁都这样，一旦车里的电子控制板坏了，就开不了锁，就像那年北京大雨，多少车进水导致车门打不开 活活的被淹死啊。。。。当时想着我的长安面包车发现它还有有优点的。。,1,5,0,2022-07-30 14:26:17,来自山东,70408782995,飞天小神飞
7125797113204179727,后排座女士应该是撞击导致的昏迷，但是腿被夹住了，实在可惜！,8,24,1,2022-07-29 22:13:04,来自山东,15362461317,快乐的晚风K
7125808826414744355,视频上司机也不顾到那女的安危，自己下车就走开，难道是顺风车[偷笑][偷笑],14,71,3,2022-07-29 22:58:53,来自海南,67931297006,幸福小猫E9
7126089276810543912,发生车祸为什么司机和副驾轻伤，死的是后面的呢？让我想起来谢大脚的车祸现场，这是什么原理呢？不是副驾更严重吗？,0,0,0,2022-07-30 17:06:54,来自吉林,1961965415049260,端庄优雅的猪猪
7126169365812871950,在这危急的时候敢出手救人值得佩服，不要理那些健盘侠，他遇到了可能跑得比兔子还快，祝救人的几位好心人健康幸福,0,2,0,2022-07-30 22:18:05,来自四川,103578447188,德才兼备柑桔N0
7125807690114138880,主要是车头已经起火了，后座乘客处于昏迷甚至已经死亡，救人者再拖延不出来，恐怕有危险，如果不是有危险的话，就肯定会对后座乘客进一步救助的（无论生死），我觉得救人者已经很不错了，尽力了，请换位思考，人只是血肉之躯，肯定怕火烧的。[玫瑰],4,28,1,2022-07-29 22:54:05,来自广东,3135435825484148,见贤思齐h
7126014260228047651,他们已经尽力了 冒着生命危险出来了两个人了 已经是大德了,1,52,1,2022-07-30 12:15:37,来自浙江,84007754449,爱吃的小贝尔
7125788786952880928,人间悲剧，活活烧死。为救人者点赞。别说什么七七八八的，都是人。扪心自问，你突然现场遇见这会怎么做。愿逝者安息，救人者应该颁发“见义勇为”奖。,13,236,4,2022-07-29 21:41:37,来自天津,52512721673,君先生
7126004890559939342,救人的先生确实尽力了。不再不出来连他自己都会被火烧了。时间太短火就烧起来了。能救出两个人来已经不容易了。,1,30,1,2022-07-30 11:39:50,来自北京,3258583967615309,完美轮船jL
7125706389565440800,我看了原视频，感觉车里的人明明是清醒的，却一点自救意识都没有，就坐着等别人来救,3,5,1,2022-07-29 16:21:55,来自广东,1425382893429944,城市裂人🔫
7125794874074841896,这不是省油不省油的事，买这车的不在乎油耗。百万豪车，确没有带来百万的安全价值，值不值百万还是智商税值得考虑。,10,76,1,2022-07-29 22:04:21,来自河南,2141490992386078,签单书生
7125764215704404770,117匹马力？开的动吗？,9,23,2,2022-07-29 20:05:14,来自山西,56545809677,我爱草蜢
7125801686933013252,这张图片用了镜像，下车的男人是副驾驶，主驾是女人，路人撬棍都用上整半天整不开驾驶室门，女司机还被卡住，就先救了副驾驶的男人出来,8,24,3,2022-07-29 22:31:35,来自广东,3784151470,清和初阳
7125671916249711372,停车救人 违章算谁的,10,5,2,2022-07-29 14:08:13,来自山东,5754561234,A百诺恩总经销商
7125800366888928040,写的什麼？ABC又没形变，车门又能打开，但又砸玻璃，还导致人活活烧死。,3,4,2,2022-07-29 22:25:37,来自贵州,4393283638540164,足智多谋孔雀qV
7126130235963245316,你是救人英雄之一，必须力挺你，没有你们几个英雄冒着生命危险救人，这一车人毫无疑问会葬身火海，你们不是专业救援人员，能够做到这样已经是难能可贵了，那些责怪人的键盘侠隔着屏幕说话心不惊人不智，你掏心窝问一问，你做了什么？,0,6,0,2022-07-30 19:46:18,来自广西,51765725308,安然易风
7125881106272174856,看了救人原视频，有几点疑问：1、被救人员为何都不说车内还有人，因为他们被救出后都蛮清醒的，2、中间座位是最安全的，为何伤的最重，究竟是车祸前伤的还是车祸后伤的？,13,46,4,2022-07-30 03:50:22,来自江西,1742091870800462,笑傲江湖0405
7126101810922291979,救人的那些司机一点都没做错，拍摄是为了取证，没问题，被救的车里面的那两人不地道，为啥不告诉那些救人者，后排还有一个人，快救她！,0,1,0,2022-07-30 17:56:21,来自广东,66195152220,海澜之谜888
7125798812907635456,这车也着火了，怎么没有说油车着火的事，特斯拉就死抓住不放呢,3,4,0,2022-07-29 22:19:37,来自河北,4193861876,洋葱头1997
7126013330539627279,雷克萨斯销量要腰斩了吧，富豪在乎面子更在乎生命，雷车有严重安全隐患，上次es200对撞领克03也是开不开车门了，领克车主还下来帮忙施救,21,31,2,2022-07-30 12:12:02,来自河北,55982776874,凉意渐浓
7126030987469144872,为救人的好心人点赞，他们见义勇为最棒。,0,8,0,2022-07-30 13:20:39,来自陕西,104862552223,星朗星稀
7126122197663449871,我觉得没这个大哥指挥，没那么快先救两个人出来,1,152,1,2022-07-30 19:14:30,来自福建,61613127681,陳启辉
7125957360086565672,我出过车祸，当时在高速路上转了4、5圈，就像电影那种疯狂打转，车头、车尾一直在护栏和山体两边摩擦撞击，后来停下来一下，车头车尾稀烂，水箱爆裂。但是油箱没事，安全气囊都没有弹出来。要是后面来一张车，我们大家都死定了。因为我在整个高速路面转圈，根本没有人能避开。但是事后我特别冷静，一点都不害怕，做医生的面对生死确实冷静啊，老婆就吓得不行，腿都是抖的。,10,12,2,2022-07-30 08:35:12,来自云南,54866727493,宅男甲1
7125781153625228043,是好车，好车是保护司机的，撞车头司机跟副驾都没被夹，而是后座的被夹住了。,28,73,9,2022-07-29 21:11:38,来自广东,55156337361,已爆炸的煤气罐
7125807142921388807,"后座的才是BOSS，前排的都是打工的，只是这个意外挺惊人的，最让人不解的是，有这么多人施以援手，救援的时间其实是完全够的，眼见车辆可能起火，不管如何砸掉玻璃设法把人弄出来都是第一要务！
当然，事故后车门被意外锁死，这也是令人匪夷所思，难以接受。
必须点赞的是几位救人的大哥，你们都是汉子，都有福报的。
也为雷克萨斯的行动表示认可，但我作为一名资深的雷克萨斯车主（家里三台雷克萨斯），就想问，车辆事故后，紧急救援系统有通知到后台吗？或者可以说，事故发生后的第一时间，后台服务中心和司机建立过联系吗？又是否指导车祸后的司乘人员如何紧急逃生？？？",5,23,5,2022-07-29 22:52:36,来自福建,3749797922,轩25450187
7126030382553629447,看图像救了人出来啊,1,0,0,2022-07-30 13:18:36,来自湖北,57021748891,QD小丸子
7125841101265126179,被救出而且清醒的的人，为什么一问三不知？车头被撞 破损严重，为什么中间的位置乘客死亡？中间老板座位💺应该保护更加要好。逝者安息🙏,7,53,2,2022-07-30 01:06:25,来自江西,1997141261688472,不稳定的人格多可恨
7125812070230033152,车头直接碰撞前排两人都能救出，中排反而脚被卡住？到底是什么结构导致这情况想不通啊。,17,58,1,2022-07-29 23:11:15,来自广东,3321134396,玛法达与加菲
7125832407538336543,被救的司机有很大的责任，车门未解锁，他是可以在驾驶室解锁的，结果他出来后不见人了。其他救人的司机不知道控制解锁在驾驶室，门开不开女孩被烧死可惜啊！,16,57,6,2022-07-30 00:33:00,来自安徽,6812188356,智者百香果Dp
7125809859425174305,总觉得后排女子没能被救出，与司机责任很大，他被救出后神志清醒也能正常走路，为何不马上说后面还有一位女子，他出来应该积极主动让救援师傅立马砸玻璃救出后面女子，他撤退到很远的地方始终不说明情况，于情于理说不过去，一个生命就这样被耽误2分钟黄金救援时间，眼看着起火被烧死了，太遗憾了，,28,200,7,2022-07-29 23:03:35,来自山东,4226435881,智慧芒果Ev
7126036798203151119,只值20万的烂面包车被国人追捧卖成了200多万，遇到撞击危险连车门都打不开，感觉开豪车高人一等，不是有恩救命都没了。等我年龄大了没有权限开大排摩托车只能开小车，只开勇士越野类车代步终了，车架碰撞行驶安全永远是第一，其他的油耗类因素不考虑。,0,1,0,2022-07-30 13:43:01,来自四川,98323151665,末路穷极瞬生变
7125804871240155915,最近那么多起火的，打消了我买混动的念头，下一辆还买柴油车[酷拽]大不了不进市区,0,0,0,2022-07-29 22:44:02,来自西班牙,108986264616,金牌认证老司机
7126153906077729539,参与救人者都是英雄，网暴的人为啥不喷那些路过不停车的？,3,173,1,2022-07-30 21:18:00,来自广西,68545779367,和颜月摄
7126037935388345103,为救人者点赞，为遇难者致哀。希望大家能从事故中吸取教训：第一时间破窗，（后再尝试开门）第二想法断开电池，（断电可减少八成起火可能）要知道大火未燃及整车是不会爆炸的，但必须注意座椅燃烧的浓烟（极毒）汽车油箱油量一般不低于三分一是不会爆炸的，（与空气混合比的生成）。车辆必须备有拖车绳，（为人为己）遇有地方卡着人可拖拽开救人。,2,6,0,2022-07-30 13:47:39,来自广东,2352567097231156,终极元素
7125784418874376960,咱也不会开车，弱弱的问一句，前排的两个人轻微伤，按说后排座的，更安全啊！,42,64,4,2022-07-29 21:23:41,来自湖北,60433953237,聪明清风Fw
7126105981431857958,实在不能理解网络上的有的人，怎么可以这样，司机大哥已经尽力去救人了，为什么要被网暴？,0,0,0,2022-07-30 18:12:30,来自新疆,98016767631,仙人周啊周
7125808058772718373,加价近百万的“豪车”，出事故竟然打不开车门,27,276,3,2022-07-29 22:56:11,来自广东,1525737394283198,萨赫察本沙勒巴基
7126071525622678279,不要在意那些喷子，你路遇灾祸停车救人，问心无愧[赞][赞]，好人一生平安[祈祷][祈祷][祈祷],0,62,2,2022-07-30 15:58:31,来自广西,59187877339,静泊山人
7126024560675570471,不是说商务车中间座位是最安全的位置吗？怎么那个女的还是遇难了。,19,44,4,2022-07-30 12:56:18,来自安徽,63402313794,褪蘟茳餬27
7126162812334031650,没有他第一个停车下来叫人，估计后面的一台车也不会停，将心比心又有几个人敢第一时间下车，估计大多数都是那种抱着“事不关己”的心态的人多一点,1,33,0,2022-07-30 21:51:57,来自广东,61300536805,勤勤9527
7126009092795548452,车头起火，车是不会爆炸的，外面灭火器喷是没什么效果，必须打开车头盖才可以灭掉。如果火大开盖会抢火，不过有衣服保护不会受伤。不是苛求救援人员，毕竟不是专业人士，只是科普救火知识。以前我也经历过，火烧坏电池掉电池水我还以为漏油。后来修理工告诉我只要车停止启动，就算烧到油管，油也会倒流回油箱，没有空气要很长时间才会烧到油箱，所以不太需要担心爆炸,1,1,1,2022-07-30 11:56:14,来自广东,585357757783559,波
7125810034415878927,最后从后窗爬进去救人的那个司机已经尽力了，当时前面已经有明火了他还是爬进去了，面对危险救援陌生人，试问有多少人有这种勇气！,13,641,1,2022-07-29 23:03:22,来自河南,108109107204,我们参加
7125791404160942863,看到有网友说，前排的没大碍，后排的不是更安全吗？的疑问，其实，相信开车的人大多都知道，一旦发生事故，惯性作用，后排乘客受重伤的概率也是很大，因为他们很多时候是不系安全带的。你看看身边的人是否有这种习惯，我见过太多，也经常提醒，尤其是上高速。,3,16,2,2022-07-29 21:50:53,来自广东,65824959089,大海行游记
7126180649492497160,这些人是没有见过车着火，周边有多热，多危险。 对参与营救的人，致敬。 汽车着火，周边高温，如果烧着状态，20米开外，都能感受到热浪。别说救出人，能靠近都是超乎常人。这些参与救人的人，绝对的英雄[赞],0,0,0,2022-07-30 23:02:04,来自广东,54958808361,佛山陶瓷胡郭华
7126163165872145193,去看看完整版视频 第一个停车施救的 一个人打不开门 再拦车叫人帮忙一起施救 这样的好人也有人喷,0,127,0,2022-07-30 21:53:28,来自浙江,105135032449,陆月June
7126005760785957670,为救人的几个路人司机赞了，救二人太了不起了[赞][赞][赞],0,6,0,2022-07-30 11:43:41,来自福建,3377308402454302,惭愧3742
7125804605686448927,单车事故，司机疲劳驾驶、酒驾、毒驾可能性大！并且被救出后没有主动说后排还有一人不太正常，救援人员连续问都没人回答！,28,122,4,2022-07-29 22:42:57,来自河南,6464569217,笑天鼠
7126030698817504007,为见义勇为的救人英雄们点赞,0,4,0,2022-07-30 13:20:03,来自浙江,440285617205627,香雨浓情
7126190357628814116,很棒了，面对这种突发事件很多人都是不敢靠近的，停车指挥救人已经很了不起了[赞],0,0,0,2022-07-30 23:40:31,来自湖北,6277846564,小云2
7125862728417674017,货车司机好样的。救人一命胜造七级浮屠，有些事情是冥冥中注定的，生与死之间，救人者应该嘉奖感谢！逝者安息，天堂没有车祸，其他问题在调查吧，给其他人一个解释，在国外这些车就是普通的车吧，到了国内成就豪华汽车了，有些东西不得不考虑内在的,0,25,1,2022-07-30 02:38:37,来自辽宁,5871911859,Mulin1028
7125930226579784463,堂哥小舅子前年买了辆凌志小轿车款的，在路上和一辆宝骏560正面撞击，560车头撞进去到三分之一，凌志撞进去人分之二多且慢慢起火，幸亏路人抢救及时最后左腿残疾~有时候认为的高档车也不过如此,6,30,1,2022-07-30 06:49:55,来自陕西,107706727887,西咸薇琳
7126066032573186846,救人司机已经尽力了[赞],0,1,0,2022-07-30 15:36:59,来自江苏,910037902951240,母婴健康管理孙老师
7125660601233769248,“该款型车购买加价就需要100万起，到手价估计超过250万”，城不欺穷人,6,37,2,2022-07-29 13:24:14,来自广西,62985580359,八五牛年大叔
7125993130118742820,为救人的大火车司机申请见义勇为奖励,5,221,3,2022-07-30 10:54:03,来自江苏,94358081756,18921098077
7126079798530868009,为救人的司机点赞,0,0,0,2022-07-30 16:30:04,来自江苏,457815911078611,薇薇～
7125933076953596676,车祸是开车人的问题，不系安全带是乘车人的问题，腿夹住了是运气问题，车门打不开是什么问题？,19,18,1,2022-07-30 07:02:14,来自广东,5134050014,饭醉嫌疑人PC12138
7125819364460331812,车头刚开始冒小烟，太缺乏救援能力经验，还有很多人围观没参加救援。可惜了，有一个人没能救出来，参加救援的人员值得表扬！近期酷热，路面高温。大家出门注意安全[祈祷],6,11,1,2022-07-29 23:40:52,来自广东,6051955192,庄严77479464
7125805549320782633,视频里救援人员很清楚的说人救不了了，人挂了，没有说夹住了腿，当时汽车是冒烟了不过没有发现明火，究竟是车祸死的还是烧死的希望官方早点发布信息,20,31,4,2022-07-29 22:45:51,来自浙江,6949694259,浙宣五金
7125961132024185639,不是个个车车里都有备灭火器吧,9,27,2,2022-07-30 08:50:43,来自广东,78749964685,啊达选
7125801029241045801,日本车安全系数[捂脸],26,62,2,2022-07-29 22:28:19,来自四川,3049816223,舌夫
7125790530222818086,上一年雷克萨斯对撞领克03，03车主出来施救被困雷主[微笑],2,51,2,2022-07-29 21:47:57,来自广东,8092953552,naixeh
7125687501322863401,车门变形了，肯定解锁不了啊。出事就怪车？？什么情况,8,5,4,2022-07-29 15:07:56,来自北京,4107371820364190,七天的葡萄
7125992647969637124,雷克萨斯的通报好歹还感谢了救人的，交警通报只字未提，说的好像是他们救出来的！,4,71,3,2022-07-30 10:52:39,来自北京,20133059982,geniusyl
7126041814134031116,可不可以设置一款轿车。只要车内浓烟达到一定数值，就启动自动喷水功能？,4,3,1,2022-07-30 14:03:39,来自江苏,101936547858,1314520swh
7126070550921249567,支持大哥，50不是老头，好人一生平安！！！黑龙江人民支持你[祈祷][祈祷],0,73,2,2022-07-30 15:54:47,来自黑龙江,1860000153344984,金龙鱼兔兔优儿
7126038330856260365,交通事故猛于虎，安全驾驶保平安！[祈祷][祈祷][祈祷],1,1,0,2022-07-30 13:49:29,来自陕西,84454738699,张建海
7126165021356540680,为你的勇敢精神，见义勇为的献身精神点赞！因为汽车有可能会爆炸的，所以给你们现场抢救的时间不多，救了2个人，已经尽力了！,0,0,1,2022-07-30 22:01:02,来自辽宁,2291804179275134,夕阳红一正能量
7126067128218288903,日系车主：我这车全车身吸能，避免车内人员由于车身刚性太强冲击震动过大导致脑震荡，还带车门自动锁死系统，避免车内人员由于挣扎或不当救援爬出车外受到二次伤害，出了事故老老实实待在车内等120来拉就行,0,0,0,2022-07-30 15:41:33,来自北京,2916896311,大吉大利IV
7126014560594674466,应该把这些网爆救人者的人找出来！让他们跟这个救人司机道歉,1,72,0,2022-07-30 12:16:46,来自广东,2287403753815918,加快跑大叔
7126192808209417000,为您大无畏的救人点赞[赞][赞][赞]，网络上总有一些自己什么都不做，还每每站在道德制高点上去挑剔别人。,0,0,0,2022-07-30 23:49:08,来自北京,67806649520,自由清泉e
7126129827178054437,看了视频，施救者破窗看到后座的女子不行了然后放弃,0,1,0,2022-07-30 19:44:29,来自北京,646154137644670,修炼ing
7126026723895902983,这是货车司机，有撬棍，我们一般轿车SUV等没有这玩意吧。束手无策了,6,41,2,2022-07-30 13:04:20,来自广东,25320426514,dgykcsuv
7126014273457308424,雷克萨斯要赔偿死伤者吗,2,18,0,2022-07-30 12:16:22,,110897637386,每一天都是爱
