7123736208773382912,郭德纲有时确实玩笑过度！,1,11,0,2022-07-24 08:55:48,来自山东,51814267564,手机用户wz123456789
7123434514357224199,啥话题都得扯上郭德纲,5,18,0,2022-07-23 13:25:14,来自山西,93144370016,桃子树下吃桃子
7123556973651477252,难怪那么多徒弟要离开他，人品很重要,3,54,0,2022-07-23 21:20:29,来自广东,108242113873,今晚有得醉
7123432255770575654,郭德纲调侃是职业病，只要不是太过份，如果太认真了就不必要了。,3,16,0,2022-07-23 13:16:42,来自湖北,87115142138,顶级小羊iL
7123582715983102761,这世界并不善待善良的人,2,29,0,2022-07-23 23:00:17,来自广西,2572476284415636,相忘江湖1998
7123724997599740672,人品好不好无所谓？反正郭德纲搞到钱了,0,3,0,2022-07-24 08:12:20,来自江西,24474251175,261721312
7123547356150711040,性格和校长相比，差太远了！,5,5,1,2022-07-23 20:42:48,来自江西,6451023316,信风89850522
7123722770382897955,所谓的偶像，明星，只有自己的衣食父母才值得自己这么崇拜，,0,1,0,2022-07-24 08:03:53,来自江苏,97723306379,如我一般万种风情
7123769317698585378,真善美在张国荣身上体现的淋漓尽致,0,3,0,2022-07-24 11:04:07,来自广东,52742904487,Jacky1418505
7123718566997836551,不做任何评价，郭德纲和张国荣我都喜欢,0,1,0,2022-07-24 07:47:51,来自广东,522968035765819,温柔雪梨Nl
7123892136491238159,抑郁症太可怕了,0,1,0,2022-07-24 19:00:48,来自湖南,616196238477677,自由的生活家9k
7123584290793161508,张国荣 迈克尔杰克逊 都是同样的善良的人,0,18,0,2022-07-23 23:06:53,来自黑龙江,2880817112,岁月的刺青
7123675377440441103,他选择了自己想走的路。🙏🙏🙏,0,3,0,2022-07-24 05:02:17,来自云南,1935558091030350,gs
7124114188754174758,谈吐是一个人的修养。,0,0,0,2022-07-25 09:23:16,来自广东,6019054002,传承全真ccqz
7124364979612025640,老郭也犯了未经他人苦莫劝他人善的错啊……,0,1,0,2022-07-26 01:38:58,来自上海,1749112897,whatasight
7123693911034004265,不喜欢郭德纲关注你很久了,0,2,0,2022-07-24 06:12:33,来自山东,861670341879118,用户快乐的时光
7123727298813428513,对死亡的理解不同，有人恐惧死亡，有人把死亡当做解脱和通向光明之路！,0,1,0,2022-07-24 08:22:17,来自河南,3576161446,小周庄
7123593939256607495,往事不要再提 人生已多风雨……,0,7,0,2022-07-23 23:44:59,来自安徽,110630817851,临江闲人
7123744766486905637,性格过于孤僻和忧郁，是的，善良的人在这个世界容易埋藏自己！,0,0,0,2022-07-24 09:29:05,来自湖北,109224033943,次条君
7123739691698422561,"人间四月芳菲尽、
世上再无张国荣。",0,1,0,2022-07-24 09:10:18,来自广东,1319021466093844,半生塵煙
7123589342379557672,如果他有孩子可能会活下来 这世界就有了牵挂,0,5,1,2022-07-23 23:26:21,来自河北,55844825179,EDAUMY
7123444605726753536,戏戏相惜呀！,0,5,0,2022-07-23 14:04:11,,55201922597,手机用户实事求实
7123428772912956192,演员真有钱,0,4,0,2022-07-23 13:03:22,来自山西,6802692685,善解人意静观世界
7123565312242467587,好文章转发了,0,0,0,2022-07-23 21:52:50,来自山东,59745104252,飞翔259912188
7123710525309354791,还好没现场做首诗，,0,0,0,2022-07-24 07:17:35,来自河北,3624287425,随缘20132248
7123607339277566727,出言有尺，戏虐有度,0,5,0,2022-07-24 00:38:14,来自吉林,97133832871,晚安过江燕
7123679000647779102,我想问天天没了饭辙奔走的吃了上顿没下顿的能得抑郁症嘛,0,0,0,2022-07-24 05:16:56,来自辽宁,5500470629,馒头敲可耐
7123584990499308325,不一样的价值观……不一样的经历……诈富会有一些自大的表现。,0,4,0,2022-07-23 23:09:23,来自河南,2189815790187534,光明举
7123707362606842654,黑郭德纲,0,0,0,2022-07-24 07:04:31,来自浙江,5755593525,初中生恬恬的爸爸
7123609405081977640,素质，注意素质,0,3,0,2022-07-24 00:45:52,来自安徽,99656995711,红星小学五三班
7123582068860437251,不知所云,0,2,0,2022-07-23 22:58:31,来自上海,11710915803,爱思28
7123584639214076707,我想看姜文的程蝶衣定妆照 哈哈哈[泪奔][泪奔][泪奔][笑哭][笑哭][笑哭],2,40,0,2022-07-23 23:07:47,来自天津,51099483388,虹130702611
7123585647365178119,陈凯歌这辈子最后一部像样的作品了,6,33,1,2022-07-23 23:12:21,来自上海,1081528884137272,will030106
7123568188788556580,最经典的程蝶衣！永远美丽！！！,0,95,6,2022-07-23 22:03:59,来自河北,4230129247,无间隔故
7123599318002729735,哥哥阴柔，五官精致，身形瘦弱，演技精湛，妥妥的一副女人味。而卸妆后又是一枚帅气，阳光，善良。超级大帅哥！雌雄同体的超高极别的好演员！！,0,3,0,2022-07-24 00:06:14,来自湖南,6937971029,乘风破浪的海洋A0
7123563376126919456,"中国艺术电影扛鼎之作，张国荣之后再无程蝶衣！
陈凯歌应该感谢尊龙不演，他演这部电影成不了经典。不是看不起尊龙，看过他女装演戏，他就演不了程蝶衣，也只有张国荣才能把程蝶衣演到空前绝后！",5,70,4,2022-07-23 21:45:26,来自四川,52786901564,老叟蜀山散人
7123602063611183907,经典中的经典，故事只能回味，哥哥已经走了，后无来者,0,3,0,2022-07-24 00:16:22,来自广东,4134596245994056,热情的蜗牛之旅
7123594811902477071,程蝶衣是张国荣的巅峰之作，一代巨星走太早了。想起李兰娟院士说，救国还是需要科学家，此刻五味杂陈……好像当时有记者发文，院士和明星收入差距太大。但愿国家体谅院士的劳苦功高，多多加薪，愿院士们努力工作，愿祖国更加繁荣昌盛。,2,3,0,2022-07-23 23:47:31,来自上海,108142496804,fforerun
7123558498151498530,陈凯歌唯一能拿的出手的作品！,12,78,1,2022-07-23 21:25:56,来自安徽,104857855662,踏雪寻梅285198191
7123569802211541798,上次看到一个评论：陈凯歌用一辈子证明霸王别姬不是他拍的。,4,46,1,2022-07-23 22:10:40,来自广东,1657717251641981,港派顺
7123597111060333327,"就是这部戏害张国荣在戏中出不来。
也成了他跳楼的一个诱因[捂脸][汗][大哭]",1,2,0,2022-07-23 23:56:25,来自贵州,51628026355,风-过无痕
7123579173905826560,我觉得一个馒头引发的血案比霸王别姬经典，陈凯歌出手就是经典。,2,8,1,2022-07-23 22:46:17,来自四川,3139234831,嗬哟嗬哟
7124524727037133608,冥冥中注定，张丰毅也因为这部电影入戏太深，变成钙了,1,2,1,2022-07-26 11:55:36,来自广东,2141448141276967,4口口
7123586930293621535,很想看姜文演程蝶衣的定妆照，跟陈凯歌一样的把那个画面带入进去，就太搞笑了,0,5,0,2022-07-23 23:17:10,来自湖南,92471668105,茶浓花好
7123572625221698337,姜文演程蝶衣那就是喜剧片了。,2,14,1,2022-07-23 22:21:44,来自河南,1240667358244924,优雅糯米2I
7124524661127660300,尊龙可不是小有名气，是当时华人的最大牌明星,1,3,1,2022-07-26 11:56:07,来自广东,3851280706,天涯楼外
7123591504115516194,张丰毅戏里戏给个霸王演绝了,0,4,0,2022-07-23 23:34:47,来自河南,108120954983,才高八斗钢琴G
7123580789925331724,千人千面，每个人对角色的理解也不同，姜文演绎出来可能就是另一种风格的经典，不一定就比张国荣版的差。,1,1,0,2022-07-23 22:53:42,来自江苏,2678030539429959,不凡花猫yl
7123551658642735910,平行时空的姜文版“霸气”程蝶衣，估计会拍成《霸王不敢别姬》,3,26,3,2022-07-23 21:00:06,来自北京,5823962806,黑山老妖1024
7123592101174346536,这事儿是陈凯歌跟你说的吗？,0,1,0,2022-07-23 23:37:00,来自河北,58321538487,鹅城小号
7123565109775237918,张国荣演程蝶衣是本色出演！,0,23,0,2022-07-23 21:52:05,来自广东,3614835917461355,豁达白发生
7123413947390427915,人生如戏，戏如人生⋯红楼梦中的陈小旭，西游记中观音菩萨的扮演者左大玢老师⋯⋯,0,0,0,2022-07-23 12:05:46,来自辽宁,2824006182381124,芳瑜
7123586185159049995,霸王别姬虽然没参选奥斯卡，但超越绝大多数奥斯卡金典名著，张国荣的陈蝶衣更是金典中的金典-斯皮尔伯格。张国荣的死更是让香港的机票一票难求,1,1,1,2022-07-23 23:14:56,来自广东,1486156302657155,情殇
7123601248263357214,哥哥做到了前无古人后无来者的程蝶衣！！一路走好！愿天堂没有病痛！没有诽谤没有……,0,1,0,2022-07-24 00:14:02,来自湖南,6937971029,乘风破浪的海洋A0
7123572723053757199,姜文？是那个姜文？[捂脸],2,3,1,2022-07-23 22:21:18,来自山东,110602574983,又刀土田木
7124527555042034472,看了很多遍，哥哥真的演技太赞了,0,5,1,2022-07-26 12:06:27,来自江苏,86625980264,妍小妍酱酱
7123590757113660196,4月1日，手机短信发来一条短信，以为是愚人节造谣，晚上电视新闻证实后，我呆了有几分钟，心里感概抑郁症太可怕，我朋友的妈妈是前两天跳的楼，印象很深，直到现在，我都谨记一点无论如何都不能在心里闷事,0,0,0,2022-07-23 23:32:27,来自河南,51176159221,尼德兰土豆
7123940151239148318,《霸王别姬》绝对是中国近代电影里程碑电影，华语电影天花板，只有《活着》能望其项背，陈凯歌因这部电影封神！,0,1,0,2022-07-24 22:07:07,来自江苏,3774904523,山顶的火焰
7123590991441543967,你不发个姜文的程蝶衣定妆照我们怎么评价呀,0,1,0,2022-07-23 23:33:45,来自福建,3398181682,李逍遥14128537
7123587873815085839,姜文演的程蝶衣？母系社会的寨主吧？[泪奔][吐],0,3,0,2022-07-23 23:20:26,来自安徽,3711851340,孙行者老孙
7123015709479240478,风华绝代的哥哥！[玫瑰][玫瑰][玫瑰],0,2,0,2022-07-22 10:19:25,来自重庆,92918572237,挚爱哥哥么么哒
7123519613534569252,92年比现在开放啊！现在拍这电影，一定不能上映。,3,19,2,2022-07-23 18:55:37,来自四川,6573320849,蜀中细雨
7123694594138981159,张国荣很聪明，他知道这才是人人们记住他最好的方式,0,0,0,2022-07-24 06:16:40,来自辽宁,3263817226401688,分秒必争溪流m3
7123580505152930563,姜文肯定是好演员，但演程蝶衣就算了,0,6,0,2022-07-23 22:52:29,来自江苏,2937486840438060,向来痴本人
7123586973503652648,其实姜文演程蝶衣肯定能获表演国际大奖！,0,1,0,2022-07-23 23:16:54,来自北京,3413305004402767,楠捷素
7123580892421391104,姜文适合弄个铜锤花脸…花旦还是算了吧[捂脸],0,3,0,2022-07-23 22:53:12,来自陕西,5919876483,西路过客
7124509991381713700,张国荣是我们那个时代的回忆，但人生如戏。,0,4,1,2022-07-26 10:58:57,来自贵州,3985102961907230,我爱小学生6w0X
7123573719573873440,真有那么好？,2,0,0,2022-07-23 22:25:46,来自上海,7048141219,浩然之境
7124344875432084224,郭德纲有时开玩笑不知轻重,1,3,0,2022-07-26 00:18:40,来自陕西,6085951832,李大侠-
7123576411537326887,霸王别姬以后，那个扮演程蝶衣的哥哥就没了，剩下的是扮演哥哥的程蝶衣,0,4,1,2022-07-23 22:36:31,来自天津,55764917497,落落当当
7123571565249544991,尹正（袁华）也合适拍。[捂脸],1,1,1,2022-07-23 22:17:03,来自浙江,52916775003,文丑丶颜良
7123596183066477327,其实陈凯歌演蝶衣也不错,0,0,0,2022-07-23 23:52:56,来自江苏,5517818064,bluefishes
7123607278867268388,"完美的哥哥 
入戏太深了",0,0,0,2022-07-24 00:37:53,来自加拿大,62680614346,幺幺0幺幺0幺幺0
7123426303160222499,张国荣，永远的哥哥,0,31,5,2022-07-23 12:53:07,来自山东,531791553502317,努力的老张liu
7123590259073680136,张国荣是不是演程蝶衣后就变了？,0,0,0,2022-07-23 23:30:30,来自广东,1767932080,闯王
7123561442711962372,除了张国荣还真想到还有谁能演,0,6,0,2022-07-23 21:37:58,来自河南,6089523566,谁在看123
7123594716620964611,姜文演技是可以的，演的话也许能成为另一个经典！,0,0,0,2022-07-23 23:48:53,来自河南,2186258652339367,南山有神龙
7123586946618213160,姜文版程蝶衣[泪奔][泪奔],0,1,0,2022-07-23 23:16:52,来自辽宁,98857221871,VERSTEHEN487
7123590142337925919,霸王别姬是中电影史上的一座高峰！,0,1,0,2022-07-23 23:30:02,来自河北,5804823810,手摇发电机
7123560118985671424,哥哥演戏好，歌唱的好，做人也好，真的很怀念！,0,9,1,2022-07-23 21:32:17,来自上海,61781649374,醉卧酒吧君莫笑
7123594349359104807,好想看看姜文的程蝶衣定妆照[大笑],0,0,0,2022-07-23 23:47:09,来自广西,3974142498,王子卫衡
7123555268302095138,好像张国荣不是没档期，是移民加拿大了，没在香港他找不到人，最后是让黄百鸣帮忙联系的,0,2,0,2022-07-23 21:13:20,来自湖南,89350776731,想得到的名字都有了
7123571447309730560,天妒英才啊！哥哥如此出类拔萃，却英年早逝。,0,5,0,2022-07-23 22:16:13,来自江苏,1757456883,23832259
7123583432500462351,他爹扶着手拍完的[紫薇别走],0,0,0,2022-07-23 23:03:11,来自山东,1869123829,社会主义一棵草
7123426903360324386,没看到怎么怒了，人家对郭德纲是非常认可的，一整期节目都相谈甚欢，,0,2,0,2022-07-23 12:55:20,来自黑龙江,2000737988254907,魔兽霍华德靠谱
7124339540219331328,有些人活着跟死了一样，有些人走了却永远活在人们心中！永远的偶像[祈祷],0,2,0,2022-07-25 23:57:59,来自浙江,144761503089384,青葱遇艳阳
7123531720695743240,张国荣的巅峰，陈凯歌的巅峰,0,8,0,2022-07-23 19:42:24,来自湖北,93338869358,我是一个大好仁
7123589303476994827,现在居然都质疑是不是陈凯歌拍的了,0,0,0,2022-07-23 23:27:15,来自河北,360239945751192,小写意2010
7123593807585035008,霸王别姬确实好！,0,0,0,2022-07-23 23:43:43,来自赞比亚,4610849426,爱的幽兰
7123568804793484040,永远的哥哥，怀念你！,0,4,0,2022-07-23 22:06:22,来自北京,3372902373663880,淡定溪水JA
7123597383204193058,记得，93年，重庆艺术电影院，看的9点多的早场，人很少，确实经典[赞][赞],0,1,0,2022-07-23 23:57:56,来自贵州,4654721195,4590377945
7123596015449604879,霸王别姬没有拿到奥斯卡，是奥斯卡最大的失败！,0,0,0,2022-07-23 23:52:17,来自四川,2872374776306637,笑傲厍
7123575557551604515,“我本是女娇娥，又不是男儿郎”,0,0,0,2022-07-23 22:32:20,来自山东,97859813436,老同志1978
7124537212091630348,这么说是张丰毅把哥哥掰弯了,0,0,0,2022-07-26 12:44:38,来自陕西,6997687149,lslt5
7123588107261199138,实在是受不了男男腻歪，女女还行[大笑]，只看过片段，没看全片,0,0,0,2022-07-23 23:21:15,来自河南,88138524039,这是布西
7124524152718983969,往事不要再提 人生已多风雨,0,1,0,2022-07-26 11:53:51,来自广东,6684304646,雪椰巴治奥
7123526209195311912,人生如戏，戏如人生，不疯魔，不成活,0,6,0,2022-07-23 19:20:47,来自宁夏,2392975812858320,银川莽汉
7124533585742447394,我居然在电影院看的[捂脸][捂脸][捂脸]突然觉得自己老了,1,1,0,2022-07-26 12:29:49,来自山西,52784626334,心若没了139621131
7123592826331448102,真相是這出（霸王別姬）的導演是陳凱歌的爸爸，陳凱歌衹是個助理導演。,0,0,0,2022-07-23 23:40:52,来自北京,13737721608,羊角公
7124544896673022733,应该是这部戏害死了他,0,0,0,2022-07-26 13:14:09,来自北京,107788168626,吴羡美
7123431844188259104,永远的张国荣！,0,5,0,2022-07-23 13:15:37,来自山东,602156795181188,独坐小楼望南春
7123581840568648460,国产电影天花板,0,0,0,2022-07-23 22:57:39,来自江苏,102334248870,提前退休的80后老阿姨
7123559014411404068,蒋雯丽哭着笑……,0,5,0,2022-07-23 21:28:18,来自广东,1310250767760119,红黑老哥
7123551728552706856,华语最高的巅峰，没有之一,0,9,0,2022-07-23 20:59:34,来自四川,6196796521,我爱帮主
7123591438936064781,《霸王别姬》之后就江郎才尽。,0,0,0,2022-07-23 23:35:20,来自广东,12486209093,在听你的
7123583025145365248,怀念张国荣。,0,1,0,2022-07-23 23:01:33,来自湖北,4580183922,大西瓜十八号
7124517099930338086,没有如果，希望哥哥在天堂继续歌唱演电影。,0,1,0,2022-07-26 11:26:56,来自甘肃,4222563361235852,花伟玥
7123575381361541903,姜文可以演琪琪国王,0,1,1,2022-07-23 22:31:43,来自河北,59213041379,沐夕手作
7124502368947192591,人生如戏，何必当真？,0,7,3,2022-07-26 10:28:23,来自甘肃,2951931960,飞虎队队长龙飘飘
7123569696770966303,周星驰能演！！,0,0,0,2022-07-23 22:09:53,来自辽宁,50722153196,战略忽悠局局长2
7123577037486850827,张哥哥永远YYDS,0,0,0,2022-07-23 22:38:54,来自湖北,4036662849,花色20100906
7123582181272011523,把张国荣害了,0,0,0,2022-07-23 22:58:39,来自山西,65528315717,百度214506625
7123582739315999521,一个男啦啦想想也是醉了,0,0,0,2022-07-23 23:01:19,来自河南,4197065318,深蓝19731574
7123565533500457765,经典[赞][赞][赞],0,4,0,2022-07-23 21:53:35,来自四川,72106523478,黑娃232149215
7123579846332613411,越是柳暗花明，越是成就精典！,0,1,0,2022-07-23 22:49:03,来自青海,3166195142113469,偶尔话多的老头
7123596821196981024,一部足矣吹一辈子[大笑],0,0,0,2022-07-23 23:57:09,来自河南,72242147757,拒绝断奶
7123579665226433312,经典只在心中,0,1,0,2022-07-23 22:49:03,来自湖南,86377805794,禅中缘
7123596174191854343,假霸王，真虞姬！,0,0,0,2022-07-23 23:53:53,来自北京,73581554434,牛转乾坤Qf
7123595606572155661,非哥哥莫属！,0,0,0,2022-07-23 23:51:39,来自湖南,96701840217,可果糖下酒
7123577144642405120,姜文？也可以吧！呵呵呵！,0,1,0,2022-07-23 22:38:23,来自广东,4208550978270040,真诚苹果Hn
7123584794625131277,是不是演了这部后才变成男同了,0,0,0,2022-07-23 23:08:36,来自福建,59086484599,-162847652
7123582208819987235,看不懂这种艺术,0,0,0,2022-07-23 22:58:12,来自浙江,58502458957,胡巍19
7124540160712737543,有些电影角色，是不能拍的！不得不信！,0,0,1,2022-07-26 12:55:53,来自云南,1802796229729067,粉红酒窝008
7123575348646314759,不可入戏太深,0,0,0,2022-07-23 22:32:13,来自河北,95812654265,河北人独闯上海滩
7123565940033749775,尊龙最早,0,0,0,2022-07-23 21:54:49,来自河南,3320133126985707,龙猫KG
7123574098848645902,惊喜，你给翻译翻译,0,0,0,2022-07-23 22:27:17,来自陕西,1732458000687469,马德拉岛小小少年
7123452977356194568,有的人活着，可他已经死了。有的人死了，可他还活着。,0,4,0,2022-07-23 14:36:55,来自安徽,89894890411,五年级200
7123441024353026854,永远的哥哥,0,2,0,2022-07-23 13:50:57,来自广东,52133612799,二郎爱读书
7124501945364103968,想你,1,4,1,2022-07-26 10:26:42,来自四川,4033479952565085,嘉嘉莉
7124507422387061517,怀念哥哥,0,1,4,2022-07-26 10:48:53,来自广东,3554090053285693,优雅海燕x7
7123632407617651464,好戏,0,0,0,2022-07-24 02:16:29,来自湖南,5484029034,胡乱语
7124538279495795460,说滴对,0,0,0,2022-07-26 13:04:52,来自陕西,3196981420242523,电影新纪元
7123580491034919719,张丰毅是最大的败笔，姜文演好,1,0,0,2022-07-23 22:52:21,来自陕西,51001520695,康桥上的砖头
7123659177201369897,姜文要是演程蝶衣，那画面脑补一下就三个字:辣眼睛！[捂脸],0,0,0,2022-07-24 04:03:43,来自江苏,2084298678608512,滴磨成念
7123589552404529951,姜文不行，那就让姜武演程蝶衣，我倒是想看看金刚芭比反串[泪奔],0,0,0,2022-07-23 23:27:29,来自山西,75929748235,小胖哥
7123571596463571712,那等粗俗大汉，竟～程蝶衣。,0,0,0,2022-07-23 22:16:51,来自江苏,4054604145758984,嵇康A
7123591958484026146,"一去不返的时代，人走楼空，
群星闪烁的时代变成了群魔乱舞。",0,0,0,2022-07-23 23:36:21,来自北京,105384983586,未君学人
7124423859138528038,友友加油，相互支持[玫瑰][玫瑰][玫瑰][玫瑰][玫瑰],0,0,0,2022-07-26 06:14:48,来自辽宁,5510851784,信息学奥赛张新钢教练
7123562358361981727,张国荣很聪明，他知道这才是人人们记住他最好的方式,2,1,0,2022-07-23 21:41:12,来自河北,99621760780,用户8370262080733
7123445897669395203,我重度抑郁，外人无法体会的,2,4,0,2022-07-23 14:10:18,来自江苏,110796057830,用户5498936135559
7123732319752110886,老郭过分了啊！,0,0,0,2022-07-24 08:41:56,来自山东,66749050770,用户7653888987814
7123712277802599176,《霸王别姬》是陈凯歌的巅峰，没有张国荣，他就没有这样的成就，是张国荣成就了陈凯歌。,0,0,0,2022-07-24 07:23:31,来自北京,110186658178,用户9537204792765
7123608433000973064,说的有毛病吗,0,0,0,2022-07-24 00:42:30,来自河南,3918267927238188,用户3443015793177
7123626026303374087,还真不能把一个往西的好人开玩笑！,0,0,0,2022-07-24 01:52:01,来自上海,75467153363,用户9475155361544
7123738925789266719,有些玩笑真不能开，特别是死者的。,0,0,0,2022-07-24 09:06:55,来自广东,4257742551267328,用户2346579346851
7123449819045036834,是不是这部电影拍了加重病情了,2,4,0,2022-07-23 14:24:14,来自上海,104558147144,用户3618936875730
7123593360920822568,我想看姜文的程蝶衣定妆照 哈哈哈[泪奔][泪奔][泪奔][笑哭][笑哭][笑哭],0,0,0,2022-07-23 23:41:54,来自北京,3263827199930007,用户7828983846975
7123599019229922089,哇，张国荣一跳快二十年了，仿佛就在昨天一样，当时听半导体收音机播放了此消息，真是世事无常。,0,0,0,2022-07-24 00:04:21,来自江苏,79174490758,用户8579358009036
7123595571184911116,姜文确实不适合演程蝶衣,0,0,0,2022-07-23 23:51:53,来自湖南,17211617053,用户4328535865050
7124507681595441958,如果他一直只是一个普通人多好,0,2,0,2022-07-26 10:50:28,来自四川,1956754155386012,用户46192218521
7123589780788806441,有些人说过，哥哥之后再无程蝶衣！,0,0,0,2022-07-23 23:27:47,来自北京,910009768349069,用户3394413201889
7123572487287882508,每每看到，思念更深，从无偶像，唯你独尊,0,1,0,2022-07-23 22:21:18,来自广西,97702026115,用户7470707880391
7123580603769389835,没变性之前的金星也能演,0,0,0,2022-07-23 22:52:43,来自内蒙古,1859991525654691,用户5305799480284
7123448105169191680,张国荣的死其实香港娱记有一大部分的责任，之前一直在乱写人家,1,10,0,2022-07-23 14:17:52,来自广东,3953497275371256,波波夫斯基散步
7123441371280818959,郭拿逝者逗乐，这让大家伙儿怎么评价你呢？,0,22,0,2022-07-23 13:51:34,来自河北,111103288270,黄丑牛
7123565193418441511,从来不看！,0,1,0,2022-07-23 21:52:34,来自广西,105115465215,兰若寺525
7123581277265003294,姜文演程蝶衣，我去，那个纯爷们，演男男gay，得有多辣眼睛,0,0,0,2022-07-23 22:54:39,来自陕西,958385016799710,昵称1906
