7124190049117176606,签署协议第二天，俄就背信弃义导弹袭击黑海港口城市敖德萨，还有谁会信它呢？,0,0,0,2022-07-25 14:17:08,来自广东,3737951337713070,用户2462920332599
7124135574545679138,美国在捣鬼使乌克兰粮食出口不了，美国向全世界卖高价粮。,0,1,0,2022-07-25 10:45:32,来自江苏,53149864557,葛连冈
7124120814941176610,乌克兰总是钻空子 给你开路放粮 你非要放武器 谁是谁非 一目了然,0,0,0,2022-07-25 09:47:50,来自江苏,3443741084,甲乙丙丁壬癸
7124132452926522153,能有什么粮食危机，美国找借口趁机给乌克兰运送武器罢了,0,0,0,2022-07-25 10:33:00,来自江苏,1416594460513692,大自田
7124110454141993762,别逗了 这些粮全都会运到欧洲 解决世界粮荒 口气太大！,0,0,0,2022-07-25 09:08:11,来自北京,382251071440756,40多岁老司机
7124138937937560361,乌克兰就是死鸭子嘴硬。,0,0,0,2022-07-25 10:58:40,来自广东,1077165918785435,乐观的头条爱好者
7124096795663254308,乌克兰的粮食？那是美国三大粮商的粮食。,1,11,0,2022-07-25 08:15:26,来自安徽,2554889059186043,嗨四楼的
7124187786781098793,俄乌是两大粮食出口国 [灵光一闪][灵光一闪][灵光一闪],0,0,0,2022-07-25 14:08:11,来自天津,2040319552797480,大珉大舞台大珉媳妇
7124104579369026304,乌克兰的粮食？那是美国三大粮商的粮食。,0,2,0,2022-07-25 08:45:23,来自福建,4081840560541710,XMNLXZ
7123441776610132770,什么缓解？乌克兰对外卖粮，俄罗斯向西卖气，这是打持久战。。,0,0,0,2022-07-23 13:53:14,来自上海,55849628275,北上返沪
7124109376688177924,还没开始就想夹带私货,0,3,0,2022-07-25 09:04:49,来自河南,5580327693,昵称先空着
7123879076934320926,公说公有理 婆说婆有理如果乌不要亲近西方克罗米亚也不会被俄罗斯讨回,0,1,0,2022-07-24 18:10:32,来自广东,62187546506,用户4489494596886
7124137254201279262,乌粮食早就被美国控制了,0,0,0,2022-07-25 10:52:25,来自浙江,2893532177377975,端庄生活家pO
7124143325522854669,欧美就喜欢夹带私货，叙利亚人道救援也是把武器夹杂在人道救援物资中,0,0,0,2022-07-25 11:15:42,来自浙江,1622519449926012,灿烂圆月WS
7124512618856907533,俄打联合国的脸！联合国会收拾他的！只是现在还不到时候！,0,0,0,2022-07-26 11:08:48,来自四川,55837222332,老炮来了
7124129611252450083,乌克兰这个都将没有了，还签什么合同，有意义吗？？,0,0,0,2022-07-25 10:22:01,来自广西,3174998902054459,自由的面条Gs
7123725901472727848,哇喔哇喔哇塞塞,0,0,0,2022-07-24 08:15:52,来自北京,1355018431106959,元气面条yd
7124128703306662693,[赞][赞],0,1,0,2022-07-25 10:18:21,来自山西,4451287964325468,魔法豆花6m
7123792652541772544,[赞][赞][赞],0,1,0,2022-07-24 12:34:47,来自湖北,3949088131004296,用户8042955179532
7124111712474661673,…,0,3,1,2022-07-25 09:12:48,来自江西,3333318474738028,20021109lsw
