7124100739278521124,乌克兰没那么多人了，粮食赶快出口吧,1,31,3,2022-07-25 08:31:09,来自河北,53010238469,老三162077001
7124101036075746062,没有乌全世界就得挨饿，这是真的吗？,0,5,1,2022-07-25 08:32:17,来自吉林,88853899453,吴老二儿看电影
7124113954603090721,这是乌和西方国家的阴谋,0,40,6,2022-07-25 09:22:14,来自上海,1926037834,风0410
7124095982631306025,乌克兰没有粮食，粮食都是美国公司的,0,26,5,2022-07-25 08:11:57,来自天津,3298134091890990,我是一个真正的用户
7124095798123479849,该不是合起来骗全世界吧[捂脸],0,13,0,2022-07-25 08:11:08,,103204076989,坏球老狐
7124119768630051595,如果俄乌粮食绝收，世界闹荒❓,0,7,0,2022-07-25 09:43:46,来自广东,5826808741,赖风子
7124298836729692939,没有乌克兰哪来的粮食危机，真是个大祸司机,0,0,0,2022-07-25 21:19:21,来自山东,3575241045707480,籈猕嫲廢襟
7124137158146982692,不能让粮食出口去西方，省得西方有更多的力气來打俄罗斯！,0,4,2,2022-07-25 10:51:51,来自江苏,1596111265467395,诗意葡萄O4I
7124174205792961280,金融投机者正投入大宗商品投资并押注不断上涨的食品价格——这只会将世界最贫穷的人推入更深的饥饿之中。,0,2,0,2022-07-25 13:15:28,来自福建,4142560058023691,薇薇逛红尘
7124127165394158349,分折有道理丶讲得对[加油][加油][加油][玫瑰][玫瑰][玫瑰],0,12,0,2022-07-25 10:12:24,来自湖南,95840333893,好学小红花N4
7124130080468943651,玉米高楼小麦大米都在上涨，一点下降的势头都没有，再打下去哪吃的起饭哦,1,5,1,2022-07-25 10:23:43,来自吉林,92665650267,陆云990
7123782662518833958,俄罗斯不可能无缘无故轰炸敖德萨港口，乌克兰利用运粮船夹带武器是有先例的,4,145,13,2022-07-24 11:56:45,来自广东,10516549687,冰淇淋125390907
7124127918280409896,到底谁该负责人,1,3,1,2022-07-25 10:15:24,来自四川,4054587348624840,无忧的咖啡rq
7124102641759929128,全球粮食价格上涨也没见国内粮食上涨嘛,3,20,0,2022-07-25 08:37:51,来自江苏,3773123412106686,丶潇洒哥乀
7123946170145407784,谢谢分享[玫瑰][玫瑰][玫瑰][赞][赞][赞],0,13,0,2022-07-24 22:30:30,来自湖北,99685658379,缅因猫
7124100502665020200,一个乌克兰能有多少粮食,6,14,0,2022-07-25 08:29:30,来自辽宁,2317369993597155,桃tch
7124106842300678927,会影响我月底发工资吗？,11,13,0,2022-07-25 08:53:55,来自河南,111291628910,玉儿无悔
7123764962279146277,责任方在乌克兰，出尔反尔,1,94,14,2022-07-24 10:47:45,来自广东,56014605420,一个有脑的无聊人士
7123857799650198306,乌克兰挨打肯定有原因，不可能无缘无故的,1,53,7,2022-07-24 16:47:48,来自湖北,78799600624131,车城探店
7123951412383400743,俄已经承认是他打了,0,42,0,2022-07-24 22:51:15,来自广东,53980642914,和平与公平
7124449793279148804,农民很重要，粮食更重要，我们有18亿亩耕地，能播种粮食，该是多么幸福的事。一定要保护好我们的耕地，多打粮食，只有丰衣足食，才能国泰民安。,0,0,0,2022-07-26 07:05:58,来自湖北,51043692848,村妇琼姑
7123755231603163935,"联合协调中心：
检查运载乌谷物船只；防止偷运武器、弹药；避免挑衅行为；检查进出黑海船只。",0,2,0,2022-07-24 10:09:09,来自陕西,3795107886143992,诗情画意白蘋洲
7124106294289646350,相信俄罗斯，有信义么？,1,29,1,2022-07-25 08:52:20,来自江西,62727459196,山青水净风清大自然
7123925555577766669,联合国还是没办成，[捂脸],0,21,0,2022-07-24 21:10:45,来自上海,897649060613432,波浪与缠论
7123627364105749248,大俄以一国之力基本可以拖垮整个欧洲，佩服！,0,8,0,2022-07-24 01:57:35,来自广东,2648054409202717,村间田野
7124099816409645859,傻乎乎的泽连斯基,3,14,2,2022-07-25 08:26:45,来自黑龙江,85229240782,才高八斗生活家X
7123909319229276960,乌克兰出尔反尔一贯作风，老美煽风点火的结局,0,32,2,2022-07-24 20:07:53,来自上海,96596677528,豌碗豆
7123507582769251083,还是要防着出尔反尔的司机,0,18,4,2022-07-23 18:09:06,来自广东,103603366985,陈ER平
7124069217121092352,签署的是什么协议？是粮食运输协议还是敖德萨军事设施安全协议？,1,2,0,2022-07-25 06:28:50,来自河南,75468120867,刚244828374
7124317092790403852,乌克兰还是个大粮仓呢！,0,1,0,2022-07-25 22:30:29,来自重庆,58654854630,冲向云霄
7123696376873763619,"都是筹码，哪见爱心？！
皆为算计，安现宽容",0,3,0,2022-07-24 06:22:06,来自福建,4081840560541710,XMNLXZ
7124109122593129227,乌克兰的粮食卖掉了，米国的武器商有钱收了[灵光一闪]继续援助[机智],1,9,1,2022-07-25 09:03:49,来自山东,50092796346,启永2
7124146079318147852,玉米高楼小麦大米都在上涨，一点下降的势头都没有，再打下去哪吃的起饭哦？,0,1,0,2022-07-25 11:26:41,来自江西,77246616085,民娜888
7123619935041291044,俄方又一直指责俄军在黑海港口部署了大量水雷。,7,37,7,2022-07-24 01:27:52,来自内蒙古,1257493931505006,时髦清风zr
7123800113788961577,怕运的不是粮食吧,0,0,0,2022-07-24 13:03:43,来自云南,1239848701931227,萍ZZZXXXXX
7123703554200306445,乌克兰不想把自己的名字放在与俄罗斯相同的文件上，也就是说一份文件上没有俄罗斯，另文件上没有乌克兰，这协议还有什么意义？这或许是美国出的馊主意吧，为乌克兰违反协议做铺垫。,3,100,9,2022-07-24 06:50:16,来自浙江,109178291183,唛克呗118
7124170689326154500,俄罗斯与乌克兰之间的粮食协议看来十分脆弱，存在半途夭折的危险。,0,0,0,2022-07-25 13:02:37,来自福建,2850355052026828,榕城老顽童
7124144972768772872,乌克兰的粮食再卖不出去，就是雪上加霜了,0,1,0,2022-07-25 11:22:23,来自广西,1126353694374663,Yy树上的鱼
7123821838190969614,未来还是一个未知数,0,0,0,2022-07-24 14:28:40,来自黑龙江,4230518104666510,舞动人生ABC
7123751659989173026,司机不同意俄罗斯监控检查已经太明显了，如果真是这样的话，美及西方等国家的各种武器装备会源源不断的而且名正言顺的运进乌克兰，到那个时候乌克兰的武器装备绝对会抵御俄罗斯，更加会威胁到俄罗斯，我觉得俄罗斯没有那么傻，不让俄罗斯检查过往船只这个协议等于废纸一张,0,31,6,2022-07-24 09:55:13,来自辽宁,62417294450,赤缘玉藏阁
7124132443162329894,俄罗斯乌拉！,0,1,0,2022-07-25 10:33:58,来自辽宁,54247302140,庄周晓梦5
7124101498896270092,米国不希望粮食稳定,1,11,1,2022-07-25 08:34:21,来自山东,59117776701,来财123
7123885008288416547,想多了！和平带来的优势！在打下去带来什么！别在被别有用心的算计,1,8,4,2022-07-24 18:33:08,来自上海,3958660931531822,杨捷
7124131501079364387,我们粮食太多，都不涨价,0,2,0,2022-07-25 10:29:08,来自河北,100804115040568,清闲的百香果nX
7123508023062577923,美国就没想过协议，司机儿子敢守协议？,0,8,1,2022-07-23 18:11:12,来自广东,1745650529083581,锦3377
7124125390620181287,粮食运到需要的国家去,0,5,0,2022-07-25 10:05:26,来自浙江,3456475437991117,美丽草原之夜
7123914601112732454,乌方完全没有诚意才导致这样的结局,0,11,3,2022-07-24 20:28:38,来自福建,3065074514920852,江河湖海浪滔滔123
7124146906855031584,粮食安全根本不是俄乌战争的原因，全世界人口增长太多了，今天的地球根本没有办法养活80亿左右的人，这就是现实,0,0,1,2022-07-25 11:30:23,来自广东,6277577631,红枣正甜
7123660218160415524,冲突不能解决一切,1,16,5,2022-07-24 04:06:39,来自福建,5535332696,轩林58826711
7124129915532329769,乌克兰产粮，俄罗斯产化肥！现在粮食和化肥都运不出去，一个因为战争一个因为制裁！少产粮国粮食不够，产粮国化肥不够，导致粮食和化肥涨价，,0,1,0,2022-07-25 10:23:11,来自广东,111559377768,独一无二的盘龙棍
7124125028882481951,会影响我下个月没饭吃吗？,0,2,0,2022-07-25 10:04:03,来自湖南,607383947061853,蓝色沉淀
7123943189744206607,乌方完全没有诚意才导致这样的结局,0,3,0,2022-07-24 22:18:49,来自陕西,554583417164910,流浪汉8146966404073
7124117187782181645,乌克兰的军事回应：挨打、绞杀与投降！,0,2,0,2022-07-25 09:34:39,来自西藏,588993005093744,叶太和
7124110601576104717,视频没说完就没了。,0,3,0,2022-07-25 09:09:21,来自辽宁,92818569820,阳光普高照
7123894047491834628,乌克兰又在玩花样😂,0,7,2,2022-07-24 19:08:59,来自安徽,52040319710,战士55776688
7124206607940535073,不用，为中国负责[捂脸],0,0,0,2022-07-25 15:22:19,来自山西,3023975254,再思维
7124131560085209869,司机和米国勾结，借粮食通道完成利益交换。俄罗斯又不傻，打掉补给通道，自古以来就是兵家常规操作。,0,1,0,2022-07-25 10:29:23,来自江西,75876240420,wufancomy
7124107312511566627,这文章题目取的是不是有问题？,0,6,0,2022-07-25 08:55:48,来自广东,92914402906,michaelsunLB
7124107169569735424,美国想把粮食运出去吗？哈哈我不信！,0,8,2,2022-07-25 08:55:22,来自吉林,92633312935,德才兼备雪梨tY
7123521238131753739,土耳其是不是凭着威望很可能有其他国家并入期内，成为自治国!,0,0,0,2022-07-23 19:02:38,来自湖南,237928466350251,邹午宇
7123561021582656290,"都是筹码，哪见爱心？！
皆为算计，安现宽容",0,3,0,2022-07-23 21:35:39,来自广东,55800576688,鹤舞白沙QQ
7124142930566857472,乌克兰的粮食能自给吗？,0,0,0,2022-07-25 11:14:02,来自四川,109166798412,乾坤一杯装
7124204207896494887,大鹅签约是因为立陶宛开通了货物运输，但又心有不甘。,0,1,0,2022-07-25 15:12:32,来自广西,2928743286058280,摄像的头
7124129731557655304,说最狠的话，挨最狠的揍！没意思。,0,3,0,2022-07-25 10:22:24,来自河北,3649987255217303,外向帆船ux
7124107593727132457,国外三顿吃面包，我们吃的是米饭和粥，不影响,0,11,1,2022-07-25 08:56:51,来自浙江,3526822628170348,清爽沐沐
7124126513028662050,如果轰炸之后发现有美国援助的武器，说明乌克兰在毁约。,0,1,0,2022-07-25 10:09:52,来自湖北,106013751380,分秒必争湖泊ACq
7123798399497044775,可以肯定的是美方不希望这份协议得到执行。,0,8,0,2022-07-24 12:57:32,来自山东,3975439910443084,紧之
7124194487022568207,新闻看看就好，立场太明显的新闻不能作准,0,0,0,2022-07-25 14:34:14,来自广东,104934388218,海臣3108
7124112199337444136,米国不讲道理，大俄那会讲武德，豢头就是道理！！,0,5,1,2022-07-25 09:14:50,来自吉林,111368383434,奋发芒果V
7123718673139467041,乌克兰已经炮轰港口了，古大喊谴责,0,1,0,2022-07-24 07:48:59,来自浙江,2766788327390683,想赚钱好难
7123696400033956645,关键还是执行难，乌克兰出尔反尔的厉害,0,2,0,2022-07-24 06:22:18,来自上海,519407939107879,黄夏韵
7124109467381433120,千万吨啊！,0,5,0,2022-07-25 09:05:01,来自上海,4472152809,怀特的小妖精
7124153166647575327,别吓唬人，美国🇺🇸和欧盟🇪🇺利用这挤压俄罗斯🇷🇺，其实乌克兰🇺🇦归俄罗斯会有更好的发展[赞],0,0,0,2022-07-25 11:53:54,来自海南,50002067970,鱼罗非鱼
7124109681715004168,应该是乌美干的,0,7,1,2022-07-25 09:05:41,来自广西,100443917262,峻岭青松
7124181676288623368,对世界粮食安全是个利好消息,0,0,0,2022-07-25 13:44:44,来自四川,1371787022828429,饕餮游者
7124121456509780775,到底谁该负责任呢😄,0,2,0,2022-07-25 09:50:12,来自广东,51806625582,外向清风Lf
7123718478325891870,只是有希望了执行力怎么样谁知道,0,1,0,2022-07-24 07:47:39,来自山西,99014551418,超人2147
7124138391725425411,这就是乌克兰自编自导自演的又一出闹剧，到底是粮食还是武器乌克兰最清楚。,0,0,0,2022-07-25 10:56:57,来自河北,60109831019,niu牛0001
7124239282818597666,老師，分析家挺不錯👍,0,1,0,2022-07-25 17:28:00,来自广东,59822858304,我失業不怕戰爭
7124131326449828623,信任联和国还是米国呢？,0,1,0,2022-07-25 10:28:36,来自湖南,88380325262509,财源广进
7124132635924169512,这份协议偷梁换柱运输武器,0,0,0,2022-07-25 10:34:04,来自广西,6765705972,苹果重要还是面包重要
7123738129219535631,古特雷斯代表谁的利益讲话联合国吗,0,6,0,2022-07-24 09:03:24,来自浙江,1736842991372324,聪慧火车YG
7123790172612739876,四方变三方，俄乌均可以不承认自己没有签署的协议，变数自然而成，袭击成为必然。,0,5,0,2022-07-24 12:25:26,来自山东,55041088970,永恒的心145639989
7123903561687499551,不是说那几个港口，乌克兰早就布好了水雷吗？要使用，还得先排雷。,0,1,0,2022-07-24 19:45:32,来自上海,103775848202,鱼读月349
7124261388524471081,人性的弱点,0,0,0,2022-07-25 18:53:48,来自江西,5806315982,梦溪笔谈a
7124134199430382370,"这就是看点。
热点就是斗争。",0,1,0,2022-07-25 10:40:04,来自辽宁,104070301090,海淘769
7123890083899802383,字面上合体都困难重重，现实中的变数大过字面，协议安全落地不敢想象,0,1,0,2022-07-24 18:52:52,来自江苏,100692134981,天空下祈愿
7124103014188745511,玉米高楼小麦大米都在上涨，一点下降的势头都没有，再打下去哪吃的起饭哦,0,7,1,2022-07-25 08:40:01,来自贵州,1319879053673207,胡酒官
7124081911639196454,有较大倾向性的报道，但比俄罗斯环球环球分社的报道相对隐蔽,0,0,0,2022-07-25 07:18:53,来自陕西,4054643998202848,bearli2000
7124151836508635919,学会了美国做事风格！,0,0,0,2022-07-25 11:48:41,来自江西,95775890271,船老大5527
7123764193257898756,乌克兰拿到的协议没有俄罗斯的签字，俄罗斯拿到的协议没有乌克兰的签字，你认为这个协议有多大作用。,0,2,0,2022-07-24 10:45:09,来自河北,51254226963,手机山狮
7123758021645288228,乌克兰想签协议，恐怕还得看美国的脸色,0,5,0,2022-07-24 10:19:54,来自陕西,57953669376,童年记忆中的老辈们
7123745902904230695,俄方又一直指责俄军在黑海港口部署了大量水雷，应当是乌克兰部署吧。后面还有错别字，作者自己读一读哦,0,1,0,2022-07-24 09:33:59,来自江西,84301221977,腾飞华
7123778695085048587,希望战争早点结束，过上祥和的生活。,0,4,0,2022-07-24 11:41:34,来自安徽,3765184385789255,怎么取什么名字都被占
7123781695106482979,美国的粮食要运出来了，全球粮价要涨翻天了！,0,4,1,2022-07-24 11:52:03,来自江苏,2594444825343352,匡厚的传记
7124123725703725828,这就是乌克兰自编自导自演的又一出闹剧，到底是粮食还是武器乌克兰最清楚。,0,0,0,2022-07-25 09:59:00,来自甘肃,4222563361235852,花伟玥
7123781858697413384,这份协议不符合美国利益,0,2,0,2022-07-24 11:53:17,来自四川,975999879882231,乐天派高山ma
7123710223722283812,古特雷斯自始至终一直站在西方那边好吗？,0,19,2,2022-07-24 07:15:49,来自广西,55618539727,金易羊言
7123763275867079427,司机都这样了，还挺横,0,0,0,2022-07-24 10:41:32,来自广东,866070733525067,乐此不疲薅羊毛
7123750775800546079,俄方又一直指责俄军在黑海港口部署了大量水雷。,0,0,0,2022-07-24 09:51:42,来自江苏,5189266275,书途汇
7123763758572602112,这方面粮食同期需求感少百分之三十，有价无市。,0,0,0,2022-07-24 10:42:39,来自广东,2858348366010224,海心小船
7123793915538703144,事关双方，双方不在场，说明利益不在双方。事只是拉住背后利益人的链子。,0,1,0,2022-07-24 12:39:32,来自甘肃,109325070876,飞奔祁连步步高
7123767041009861379,个人感觉他俩打仗没表面说的那么简单，打打停停想打又不想打，好像打着玩一样[泪奔],0,0,0,2022-07-24 10:56:10,来自江苏,64528238886,跟往事干杯210992860
7123781183150441220,美国根本不希望达成协议，要不他们怎么挣钱,0,5,1,2022-07-24 11:51:18,来自广东,1860809452,海螺先生醒醒
7123884691890897679,本来就是一份无效协议。俄方一份没乌方签字，乌方一份没俄方签字。,0,2,1,2022-07-24 18:31:51,来自浙江,10914298818,刘赐发
7123782456175592228,一只会叫的嗖！,0,0,0,2022-07-24 11:55:32,来自广东,3425712999767566,心向明月IT
7123778040165122848,俄方又一直指责俄军在黑海港口部署了大量水雷。！！！！！！！！！！！！！！,0,1,1,2022-07-24 11:38:48,来自西藏,99592258651,柔风夜雨
7123884090138477324,演员就这样,0,2,1,2022-07-24 18:30:05,来自广东,106782689285,海纳百川37014
7123808533414150948,“不想把自己的名字放在与俄方放相同的文件上”，没有实力的口头傲娇只能被痛打,0,0,0,2022-07-24 13:36:52,来自湖南,6939684363,泉水叮咚响山涧
7123756009885172516,如果俄方未在协议上签字，俄罗斯就谈不上违约,0,5,1,2022-07-24 10:12:02,来自吉林,57010990488,崔福利2
7123742628398744360,美国想利用运粮船运武器，俄罗斯要检查，乌克兰不同意,0,6,2,2022-07-24 09:20:38,来自天津,3623363006,智勇双全星辰al
7123733259867128616,美国一插手，事情好不了。,0,1,0,2022-07-24 08:44:18,来自河北,3194319185,长天一色840862
7123764197909512972,美国还有欧洲各国根本就不想乌克兰停战，估计俄罗斯也不想,0,2,1,2022-07-24 10:45:16,来自江苏,2485363628849851,秃驴必须除
7123929527239656231,乌克兰总统是不会记情的！俄罗斯凭什么给他这个面子。运武器才是真的！,0,0,1,2022-07-24 21:26:33,来自贵州,111068623523,活泼溪流mx
7123881270660776739,乌克兰借用运送粮食出口掩护西方的武器军援！,0,2,1,2022-07-24 18:18:46,来自安徽,88375510067,爱的沉淀
7123724619026268943,比如美芳声称,0,2,2,2022-07-24 08:10:48,来自江西,3861121429418535,温柔小羊Uf
7123786295750771464,比如美芳声称要让俄罗斯“为执行该协议和使乌克兰粮食运往世界负责”。错别字都不审，可见这观点有多草率[捂脸],0,1,1,2022-07-24 12:10:24,来自安徽,106230969355,糖拌西红柿
7123739597997802279,有第三方势力在捣乱，估计是美丽的国家！,0,3,1,2022-07-24 09:10:09,来自江西,6001158865,龙75119733
7123755350813180675,美国没有同意，乌克兰政府不可能执行,0,0,1,2022-07-24 10:09:31,来自广东,6277577631,红枣正甜
7123874533840864039,找什么理由,0,0,1,2022-07-24 17:53:27,来自湖南,2414947270663219,时髦风铃eu
7123739014045664037,镜像协议，有创意！[捂脸][捂脸],0,1,1,2022-07-24 09:07:01,来自浙江,3572326112,99清风99
7123894259807159075,俄罗斯不可能无缘无故轰炸敖德萨港口，肯定发现借运粮运军火，美国、北约、泽连斯基一伙的，俄罗斯必须要先发制人，打狠打残乌军。,0,0,1,2022-07-24 19:08:59,来自广东,435049013194776,认真的白云nj
7123792471502455556,已经习惯乌克兰演戏了，不管是拙劣的还是精彩的。,0,0,1,2022-07-24 12:34:44,来自江苏,110819986407,wzh286170988
7123746595971482405,这种方式怎么谈和呀！泽林斯基这不是演戏，要从根本上认识自己的过错才对！不然无法谈和，……,0,83,12,2022-07-24 09:36:18,来自上海,22874887775,y6780198
7123746934997058345,作者的教授身份存疑,0,1,1,2022-07-24 09:36:55,来自浙江,97906559998,凌波微步3863
7123775688943469315,泽连斯基的强项还是看剧本说话,0,0,1,2022-07-24 11:29:47,来自广东,67980994307,皮卡丘02223
7124152897956725536,实则粮食是米国的，因为出不去，所以借乌克兰名义外运，只要出了黑海，立马奔米国去了，欧洲非洲想都别想，特别是非洲。,0,1,0,2022-07-25 11:53:25,来自江西,2093922702330660,舅舅就服你一个
7123827101895721740,己阅读。,0,0,0,2022-07-24 14:49:41,来自安徽,1293446083524972,菁菁
7124195448310481701,实则粮食是米国的，因为出不去，所以借乌克兰名义外运，只要出了黑海，立马奔米国去了，欧洲非洲想都别想，特别是非洲。,0,0,0,2022-07-25 14:38:10,来自山东,70925816705,飞鸽8383
7123775352984044292,走路上,0,1,0,2022-07-24 11:28:36,来自辽宁,76836242932,胖仔443
7123925106681709326,加油！,0,3,0,2022-07-24 21:08:52,来自福建,3896271902879059,温柔百香果kr
7124121670318949160,不让卖,0,0,0,2022-07-25 09:51:05,来自浙江,111165907370,飞雪连天0123
7124212914931696395,过家家,0,0,0,2022-07-25 15:46:09,来自吉林,6915940667,情怀丶大鹏
7123788695106224930,已阅读,0,1,0,2022-07-24 12:19:14,来自重庆,440278514407335,乖巧梦想iO
7123774207049515806,弱肉强食,0,0,0,2022-07-24 11:23:54,来自广东,95901725270,潇洒滴热心市民
7124052914825364262,因俄罗斯没有被联合国受权认可制裁，而是被美西方及部分北约国挣着眼睛说瞎话乱制裁俄方的粮食等其它一切产品制裁不能出口买卖。同时乌克兰的粮食和其它产品都可以出口交易资金交换美西方的武器。说实话，美西方不要想的太高兴 没门。,0,9,0,2022-07-25 05:27:55,来自浙江,104307547480,活泼小红花C
7123506757309104932,打败俄罗斯是有可能的，毕竟打了那么久俄罗斯也没什么实力能拿下基辅，俄罗斯只是每天炮轰，飞机都不敢出动,1,2,0,2022-07-23 18:05:44,来自海南,2357810932492702,花背
7123776329522529054,演员方的态度该敲打！,0,0,0,2022-07-24 11:32:02,来自江苏,910037902951240,母婴健康管理孙老师
7124130725557125922,战火下的敖德萨哪能独善其身而风平浪静？,0,0,0,2022-07-25 10:26:13,来自河北,2181082174719216,又是新雨后
7123887491282764584,没有一篇好新闻,0,0,0,2022-07-24 18:42:41,来自广东,3302552908605563,智者西柚Lr
7123782942182818595,总算有了和平的第一步，有就比没有强，娶媳妇比出殡强,0,0,0,2022-07-24 11:57:16,来自山西,4094179824632228,闻道文道
7123696995948184361,发文不严谨,0,4,1,2022-07-24 06:23:51,来自广东,4325482196,大喇叭JJ
7124154518970909444,战争期间签的任何协议跟废纸有什么区别？,0,0,0,2022-07-25 11:59:30,来自江苏,2247045224085463,不信神佛鬼怪
7123922611830457101,凡事皆有因[捂脸],0,0,0,2022-07-24 20:59:11,来自上海,63224342368,文化散步
7124138066662966016,我能评论吗,0,0,0,2022-07-25 10:55:13,,958372839697358,朝气蓬勃的龙清
7123952544829211407,没有诚信的东西千万不要去侥幸心理,0,0,0,2022-07-24 22:55:23,来自江苏,4406439644238263,用户清道夫
7123820364140151584,#你最近常听的歌是哪一首#,0,0,0,2022-07-24 14:23:07,来自湖北,100454881931,分享票务
7124163007861097246,至于敖德萨港被炸，这是俄军对乌军舰和乌军仓库的打击，并没有对民用港口和民船、存放粮食的仓库有任何伤害。所以，乌军认为有粮食协议就能避免敖德萨军港有免炸权？这是不可能的！,0,1,0,2022-07-25 12:32:10,来自浙江,98752015834,用户1579054278555
7123639674685834018,古特雷斯不就是一个配合美西方利益的发言人吗？,3,19,2,2022-07-24 02:47:03,来自广东,101419333258,用户8661511260246
7123928346857341731,谢谢老师精彩客观的点评！,0,14,0,2022-07-24 21:21:06,来自青海,1503720150416648,用户794560506180
7124112815673099011,粮食，化肥都在上涨，希望战争尽快过去，愿世界和平。,0,2,0,2022-07-25 09:17:46,来自云南,81298276955,用户7448409794174
7124130188279317256,都不要在闹腾啦 不为自己考虑 也要为地球 为人类着想一下 地球环境破坏的如此严重,0,0,0,2022-07-25 10:24:07,来自江苏,1873181461192814,用户3089869098259
7124130021396136707,再怎么开战，也不能毁了运粮之路。,0,1,0,2022-07-25 10:23:29,来自山东,4274528218000158,用户3918035689094
7123717620242826021,俄罗斯🇷🇺牛逼！！一边打一边签协议,0,1,1,2022-07-24 07:44:20,来自江西,501027478710733,用户3140816961850
7123807777591771917,"这么说来，乌克兰又错了，
是吗？",0,0,0,2022-07-24 13:33:41,来自山西,103429051902,用户6114186993226
7123877552346694414,战争还未结束签什么协议都没有用！,0,0,0,2022-07-24 18:04:34,来自广东,62187546506,用户4489494596886
7123930551446520591,安卡拉是土耳其首都,0,0,0,2022-07-24 21:29:41,来自河北,3288951046,用户124205600927
7123972263078707968,乌克兰擦着眼泪他却认为自己是老大,0,0,0,2022-07-25 00:13:10,来自四川,30407782316659,用户3718228357617
7124153395388482304,俄罗斯是彻底不想走了,0,0,0,2022-07-25 11:54:34,来自江苏,175517522994736,用户4010202593116
7123699430271845124,关键还是执行难，乌克兰出尔反尔的厉害,0,0,0,2022-07-24 06:34:44,来自辽宁,219536903640648,用户872165500109
7123771281484497699,一个字：难,0,0,0,2022-07-24 11:11:44,,1367420693120941,用户6998942823170
7123877633234322208,乌克兰不想把自己的名字放在与俄罗斯相同的文件上，也就是说一份文件上没有俄罗斯，另文件上没有乌克兰，这协议还有什么意义？这或许是美国出的馊主意吧，为乌克兰违反协议做铺垫。,0,0,0,2022-07-24 18:05:23,来自辽宁,74666767513,手机用户74666767513
7124154017533870848,和为贵,0,1,0,2022-07-25 11:57:06,来自湖北,98613425791,用户9212460023769
7124292012178293544,看看吧,0,0,0,2022-07-25 20:52:22,来自广东,1600507137243552,用户9855364204322
