7124650457863258915,不要只饱口福，健康排第一,1,7,1,2022-07-26 20:03:17,来自江西,2172281943503192,珊珊来迟2020202
7123927862210200360,肠胃不好，胆子又小，又很惜命，怎么吃得了生腌[捂脸],1,4,0,2022-07-24 21:23:04,来自河南,729693234141527,苦木方的幻想日常
7124111861590835981,看样子我还是吃辣椒炒蛋吧！专吃鸡蛋留辣椒那种,1,3,0,2022-07-25 09:14:02,来自广西,51853587511,山村老二
7123914690518319886,海鲜还是做熟了再吃吧,1,1,0,2022-07-24 20:35:59,来自辽宁,89862807345,幸福家园0102
7123952739314909992,我不敢吃生的，看着人家吃生呛虾🦐，咱享受不了，还是喜欢吃炒蔬菜[握手],1,2,0,2022-07-24 22:56:08,来自河北,104936020116,幸运光束N
7124435801072665351,我们也生腌虾，但不是基围虾，必须是野生的虾，而且非常新鲜的，肉还是半透明的。皮皮虾也生腌，但必须新鲜。,0,1,0,2022-07-26 06:11:54,来自浙江,1486155773379564,九号摩羯
7124650592479494943,最好吃熟的，反正我是不能吃生的，有寄生虫的呀,0,5,0,2022-07-26 20:04:22,来自山东,351474993866430,忧雅修心
7124630797411877636,感觉会有细菌啥的，我是不敢吃啊,0,12,1,2022-07-26 18:48:14,来自山东,107967591944,鱼妈爱手工
7124648855416750859,有两个人第一次到我们那里吃生鱼片，可能是不适应，当天晚上就闹肚子，去医院检查说是肚子里有虫，吃生鱼片引起的。我们那里喷都知道这是正常的,0,3,0,2022-07-26 19:57:55,来自河北,86001604358,夏天梅花枝
7124652564100612905,我们这海边千百年来就吃用盐腌的生梭子蟹，当然是用活蟹来腌，蟹酱、虾酱更是家家会做，没听说有因吃这些得病的。,0,3,0,2022-07-26 20:11:44,来自山东,229126379411976,逍遥5891
7124672794694222607,不知道怎么说，反正我外婆吃了一辈子，现在死了，我妈吃了几十年了，活得还不错，我也吃了几十年，很幸运我还活着,2,1,0,2022-07-26 21:30:05,来自江苏,6228040473,东张西望1985
7124603639549215526,有道理，我一福建的朋友就爱吃生腌的海鲜，我是不敢吃！,3,7,0,2022-07-26 17:02:44,来自北京,1108778760027796,奋发天空K
7124456764963750689,我超级爱吃生腌虾，你是不是没放酒啊,1,1,0,2022-07-26 07:33:34,来自湖北,100719426092,皎若琉璃
7123903823043363617,把一个传2次，不就是九宫格了。,1,2,0,2022-07-24 19:47:12,来自湖南,5901203431,谦然A
7124671936806470413,那些寄生虫连胃酸都杀不死，更不用说一些白酒蒜辣根了，所以不要吃生腌，想想身体里爬满小虫子多可怕。,0,2,0,2022-07-26 21:27:12,来自天津,50074389781,—————一
7124611564858000139,生腌就是活腌！冻死了就不是生腌了[呲牙],1,7,0,2022-07-26 17:33:14,来自北京,4006211311904387,nihaocn
7124639195548779264,以醋解毒。四十年前看电影，先放科教片，预防海鲜中毒可用醋，喝一勺。青岛海洋研究所拍的，嗜盐菌怕醋。海边人，鱼虾蟹贝螺，皮皮虾，海胆和血蛤均可生腌生吃。记住得是活的，死蟹贝蛤蜊蚬子尽量不要生腌。我连襟海边人吃腌制蟹不新鲜(蟹黄变黑)都敢吃，70多岁身体特壮,2,7,1,2022-07-26 19:19:45,来自辽宁,3425718627206571,真诚饺子Zr
7124644345281659652,这么说吧，有吃生腌习惯的地区，在历史上大多数时间都是穷山恶水不产粮的地方,2,4,1,2022-07-26 19:40:18,来自吉林,58334744250,云和海的彼端
7124676027929969408,试了一口难以下咽，与生腌无缘，欣尝不来,0,1,0,2022-07-26 21:42:31,来自广东,1231099712779260,自由的百灵鸟R
7124610806797009671,生腌再冷冻，多没意思！直接生腌煮熟就ok了！生腌能冷藏，不能冷冻，冷冻味道就不对了,3,6,1,2022-07-26 17:30:23,来自辽宁,3091444386758692,随机生成二
7124649326952973087,2006年，北京福寿螺事件，160人被感染寄生虫…,0,1,0,2022-07-26 19:59:21,来自河南,4013327281,yyy-100
7124659476057195303,生腌还是海鲜为佳。河鲜真不推荐生食,0,1,0,2022-07-26 20:38:46,来自上海,3608028680,林爸爸的大宝
7124621992212415266,我连生的三文鱼片吃进嘴又吐了出来，。,1,1,0,2022-07-26 18:13:04,来自江西,4190427794,nota
7124646699964515083,要分开来说，淡水的不行，海里的可以。怀念老家的生腌小海鱼。。。臭香臭香的，味道真的比臭豆腐还狠，真香。。。吃到高中去市里读书就没吃到了,1,0,0,2022-07-26 19:49:50,来自广东,3513646790740299,魔翠
7124572493402686241,那日本人怎么一直吃刺身,3,6,0,2022-07-26 15:02:05,来自上海,4111765739667704,Leslie199032
7122289871005008679,生腌海鲜能不吃就不吃.潮汕，佛山那边每年很多人都因为吃海鲜染上恶疾。关键这种病其它地方医院还不会治，如果是吃出问题最好去佛山和潮汕看病，那边医生临床经验比较丰富,0,1,0,2022-07-20 11:24:07,来自福建,71821982814,数码战队进攻
7124622927655519016,潮州生腌天下无双！[比心][比心][比心],0,1,0,2022-07-26 18:16:37,来自上海,2692027445162539,诗与远方的邂逅
7124653086920213280,感觉会有细菌啥的，我是不敢吃的！！,0,1,0,2022-07-26 20:14:09,来自山西,3579619129430078,765575
7124643118577697568,真不敢吃，敢吃的说甜且鲜，各有所爱吧！就好似榴莲，我和儿子都捂着鼻子怪异的看着我老婆吃得津津有味的，她倒好、连壳都不放过，又再买只鸡一起煲个汤[奸笑][奸笑][奸笑][奸笑],0,1,0,2022-07-26 19:35:44,来自广东,62487975735,金玉满堂蝴蝶舞
7124640677895996200,生吃蟹子活吃虾,2,3,0,2022-07-26 19:25:37,来自辽宁,3425718627206571,真诚饺子Zr
7124643065406980905,腌制什么东西，看不懂也不敢吃,0,1,0,2022-07-26 19:34:52,来自安徽,2199471248910140,WCL
7124684297029960451,反正我是不吃，不敢也不爱这一口。,0,1,0,2022-07-26 22:15:20,来自山东,53030049425,笑容常在8
7124632905519219456,我们这边就爱生腌的鸡血，我不敢吃[捂脸],0,1,0,2022-07-26 18:55:22,来自云南,110883873598,小在HH
7124639025809720101,生腌的都是海鲜好不好,0,4,0,2022-07-26 19:19:39,来自浙江,61109051988,让老詹先摊
7124622983796556584,海鲜比较安全 不安全就没有刺身了 河鱼河虾河螃蟹还是比较危险的 不要生吃 陈登就是吃这个吃死的,0,2,0,2022-07-26 18:17:00,来自北京,6075879486,克洛普比罗杰斯给力
7124646069555905313,冷冻里就不鲜了，不好吃了！,0,1,0,2022-07-26 19:46:56,来自广东,487789897455075,Anna小JIEJIE
7124646019723215655,也不怕寄生虫,0,1,0,2022-07-26 19:46:38,来自河南,96670479728,烟雨5076
7124640873899606816,我宁可去云南吃蘑菇也不想吃这玩意,0,1,0,2022-07-26 19:27:04,来自山东,64345938336,7up糖衣
7124579699199935268,我能吃生菜,1,1,0,2022-07-26 15:29:27,来自江苏,818467168324909,顶级孔雀3e
7124136117099856675,从未吃过的还是要慎重，可能会拉肚子,0,1,0,2022-07-25 10:53:28,来自广东,92436506483,光赚不华
7124637788464792320,看见这个口水来了，宁波人,0,2,0,2022-07-26 19:14:24,来自浙江,4375689382080835,我家QQQ
7124640347200160553,皮皮虾，丹东人叫虾爬子，我是吃生腌的，没有活的死的也敢买也敢吃，活虾贵,0,1,0,2022-07-26 19:24:17,来自辽宁,3425718627206571,真诚饺子Zr
7124650753905640224,生腌送给我不用钱都不敢吃！,0,2,0,2022-07-26 20:05:07,来自广东,6352020090,往事只能回味85951943
7124630673046520591,这什么玩意儿,1,1,0,2022-07-26 18:46:56,来自辽宁,69924675533,高深莫测之二
7123195305151071017,介绍一下怎么弄，我好想吃[呲牙][呲牙],2,1,0,2022-07-22 21:56:34,来自江西,2519729903240588,机智的柳叶2
7124646117001921280,道理讲清楚了且公告天下了，仍有不怕寄生虫的人想吃生腌，那就让他吃吧。[捂脸],0,1,0,2022-07-26 19:46:34,来自河北,3132798024,安德俺的森
7124637161449997090,丹东及东港市所有海鲜均便宜，味道美。多数海产品可生腌,0,2,0,2022-07-26 19:11:55,来自辽宁,3425718627206571,真诚饺子Zr
7124644613088592675,生腌蛏子，海螺，泥螺，梭子蟹，皮皮虾…多多益善,0,1,0,2022-07-26 19:40:55,来自浙江,58045950717,郭280591691
7124613640681947915,我给你支一招，就是敢吃生的就吃，不敢吃就煮熟了吃。,0,4,0,2022-07-26 17:41:10,来自江苏,105324689782,v静思v
7124647299116139301,我也不反驳，我只是想让你知道细菌怕热不怕冷的,0,1,0,2022-07-26 19:51:33,来自山东,3847569478,哥喝多了也醉
7123963034016023331,妹妹晚上好啊，不好想啊[微笑],0,2,0,2022-07-24 23:36:25,来自辽宁,83160664906669,清荷70
7124684507349107469,咸水寄生虫很难在人体存活，淡水养殖的不敢生吃,0,1,0,2022-07-26 22:15:56,来自浙江,4015051496501779,崔巍009
7124686490436731679,谁来直播吃个生腌猪大肠？,0,1,0,2022-07-26 22:23:26,来自新加坡,7011156466,是是你说的对
7124655227806139166,生腌的海鲜一定要活的，死的生腌的话肉不好吃没什么口感，吃了很多人都会拉肚子,0,1,1,2022-07-26 20:21:52,来自上海,97815804009,Asheng321
7124636641993900803,喜欢生吃生腌的人多起来了,0,1,0,2022-07-26 19:10:46,来自北京,1270690928138875,时间宽松
7124680624744465183,最好吃熟的，反正我是不能吃生的，有寄生虫的呀,0,1,0,2022-07-26 22:00:38,来自河南,5419006140,有你有我53529210
7124640689341940521,夏天吃生淹，秋天吃杀虫药，完美,0,2,0,2022-07-26 19:25:30,来自河南,5399231766,肛肠科胡医生
7124612869206999842,生腌要配泻立停,0,3,0,2022-07-26 17:37:32,来自福建,1015572822758692,用户我爱我国
7124670257012392719,看着就害怕,0,1,0,2022-07-26 21:20:04,来自福建,110436817764,泡芙JJ1122
7122285006780908319,"作为一个几十年的老厨师 
建议对生吃的产品 要慎用 
别图一时冲动 惩罚会很痛",0,2,0,2022-07-20 11:04:43,来自福建,22272990780,天意9
7124642223978742567,为了安全，还是煮熟了吃着放心,0,1,0,2022-07-26 19:32:13,来自黑龙江,61717989301,老张的号
7124585281328268066,估计不卫生吧？不敢吃,0,1,0,2022-07-26 15:50:49,来自江苏,96710243678,往事如歌60136
7124651060790543108,腌螃蟹早上腌晚饭吃特喜欢，腌泥螺，腌蛏子等等都是我们宁波人的最爱。,0,0,0,2022-07-26 20:06:18,来自浙江,62094699817,独孤山人6
7124648784709223168,以前最爱腌海螃蟹，就撒点盐，过几个小时就可以吃了。[捂脸],0,2,0,2022-07-26 19:56:50,来自天津,5494261032,xinyitongpu
7124650634380395305,最近好多吃播吃这些，带坏不明群众,0,1,0,2022-07-26 20:03:58,来自山东,69990456242768,萨玛
7124571240673215240,有些虾，对，就是一些河虾，土腥味重的很。,1,1,0,2022-07-26 14:56:51,来自四川,4722425443,鄙人益州蒋某人
7124672906663772969,最好还是烧熟了在吃，,0,1,0,2022-07-26 21:30:31,来自安徽,2199471248910140,WCL
7124669678403912482,还是比较危险的,0,1,0,2022-07-26 21:17:52,来自四川,5871850949,天高海阔任逍遥
7124658099604013839,吸虫又死不了人的,0,1,0,2022-07-26 20:32:53,来自广西,109470269264,偶林865
7124648073971974945,脾胃够好，吃进去虫子也变蛋白质。脾胃不好就化虫子。。脾胃太寒，虫子都呆不下去，忘上冲，吐。,0,1,0,2022-07-26 19:54:57,来自天津,1807188899146590,FOOLYOUhh
7124555170218509097,那是做的不好吃,0,1,0,2022-07-26 13:53:54,来自浙江,51131785552,主持人龄予
7124597769427354404,生腌细菌，病虫肯定多。身体不是很好肯定会伤身体,0,1,0,2022-07-26 16:39:22,来自山西,4301712660633311,聪明帆船HM
7124647869223158564,以醋解毒。四十年前看电影，先放科教片，预防海鲜中毒可用醋，喝一勺。青岛海洋研究所拍的，嗜盐菌怕醋。海边人，鱼虾蟹贝螺，皮皮虾，海胆和血蛤均可生腌生吃。记住得是活的，死蟹贝蛤蜊蚬子尽量不要生腌。我连襟海边人吃腌制蟹不新鲜(蟹黄变黑)都敢吃，70多岁身体特壮,0,1,0,2022-07-26 19:53:56,来自辽宁,2154641621780782,用户7194513000宋小宝
7124663512974574367,为什么没有，（处理只后吃这个选项？腌的红萝卜我们切丝烫完调着吃。）,0,1,0,2022-07-26 20:54:20,来自山东,92627718585,山东赵虎
7124635878354010921,双氧水泡一下,0,1,0,2022-07-26 19:07:02,来自湖北,100785272924167,未注册de新用户
7123887598115816207,可惜生的吃不来,0,3,0,2022-07-24 18:48:54,来自广东,92436506483,光赚不华
7124655466969957161,差不多就是生的，吓人吃不下……,0,1,0,2022-07-26 20:22:35,来自江苏,61519014066,乐天派风声66
7124649638610633483,海产品会好很多，淡水真不敢吃,0,1,0,2022-07-26 20:00:34,来自广东,1178322714246719,无忧的雪碧8R
7124622225247912738,绝对不要吃,0,1,0,2022-07-26 18:13:56,来自山东,62971178393,极品威哥
7124638381920830240,胆子小，不敢吃！[抠鼻][抠鼻][抠鼻][抠鼻],0,1,0,2022-07-26 19:17:10,来自四川,100849805023,随心情
7124560384522371872,那就看你啥口味了，你要是淹粑粑只有你能吃,0,1,0,2022-07-26 14:14:45,来自黑龙江,1003233476088503,李二虎点文香
7124624700747154176,醉虾都不敢吃。,0,1,0,2022-07-26 18:23:27,来自河南,105068432230,壶与茶和水儿
7124573258288333583,吃了，直接发烧。,0,1,0,2022-07-26 15:03:57,来自内蒙古,6424372373,明教首领
7124622115512369951,[呲牙][呲牙][呲牙]寄生虫专科医院还是有不少空床位的，你们不用担心！,0,0,0,2022-07-26 18:13:59,来自广西,2626105671946094,锦书寻玉录
7124709252358669056,家用冰箱怎么能有一20℃、一35℃,0,0,0,2022-07-26 23:52:32,来自广西,2484520384200844,人在李途m
7124630480867296036,各有好坏，,0,1,0,2022-07-26 18:46:25,来自重庆,51084686858,好名字都注册
7124640431719154473,生吃鱼容易染病,0,1,0,2022-07-26 19:24:30,来自辽宁,69924675533,高深莫测之二
7122491689687974660,不要为了赶时髦吃出病,0,0,0,2022-07-21 00:29:41,来自福建,5495224344,福见0591
7124616686552761101,还是做熟了好,0,1,0,2022-07-26 17:53:07,来自河北,105115973964,向阳装饰---吴
7124669997288260390,一个字，怕！,0,0,0,2022-07-26 21:19:28,来自广西,10303867001,花果神
7124648120008770345,尽量熟食,0,1,0,2022-07-26 19:54:26,来自陕西,3877004245,魔法水滴Xo
7123888816087384873,美好生活,4,2,0,2022-07-24 18:47:52,来自辽宁,3589218982955661,淡婼亦䅨
7124705182822875939,已阅读,0,0,0,2022-07-26 23:36:33,来自广东,844876117714536,Dgghgfhyh
7124632717790823201,冷冻后呢,0,0,0,2022-07-26 18:55:32,来自广东,4429253975,小云刁丝
7124705487471821598,学习了！,0,1,0,2022-07-26 23:38:44,来自河南,3773171804421031,热情的画板1g
7124603962313425705,不敢吃,0,1,0,2022-07-26 17:03:09,来自四川,54588279516,shining57
7124672373072790312,不要吃,0,0,0,2022-07-26 21:28:26,来自江苏,1801081228,唵班杂拉刹多吽
7124640404183892747,酱油蟹就是用新鲜的飞蟹生腌的，你冻死了，那就不是生腌了。,0,2,0,2022-07-26 19:25:23,来自山东,59109161796,自然的美景
7124686663095747343,冻了十几个小时，那还吃个鬼生腌啊[捂脸],0,1,0,2022-07-26 22:24:01,来自海南,77200277296,胖老鼠579
7124560442638254851,科普：正确的生腌先速冻，把寄生虫冻死，再生腌，参考三文鱼，一样道理，三文鱼新鲜也存在寄生虫[灵光一闪][灵光一闪][灵光一闪][灵光一闪]切记切记，科普，谁能看到这个科普,0,0,0,2022-07-26 14:14:41,来自福建,51614732167,阅读感悟RS
7124695744007095079,看见都没食欲,0,0,0,2022-07-26 23:00:22,来自广东,103310955601,廖照海985
7124647934817354534,但是日本人生吃的海鲜就有多次冷冻再多次用酒，醋二次处理。为的就是杀死寄生虫,1,2,0,2022-07-26 19:54:17,来自吉林,3241788457628727,用户5826183496434
7124637658567656223,海鲜比较安全 不安全就没有刺身了 河鱼河虾河螃蟹还是比较危险的 不要生吃 陈登就是吃这个吃死的,0,3,0,2022-07-26 19:14:20,来自山东,69242269830,用户1699234503857
7124548167164855047,这个弄好很美味,1,0,0,2022-07-26 13:27:04,来自重庆,329502952013256,用户3382567796696
7124644451284321064,这跟生吃没什么区别。还有什么涮活鱼。我肯定不敢吃,0,3,0,2022-07-26 19:40:04,来自河北,105209701896,用户105209701896
7124644677361795875,日本人不知道寄生虫感染是不是百分百,0,2,0,2022-07-26 19:41:06,来自重庆,2471303995208051,用户6018593846233
7124649063529825055,我不敢吃 ，怪吓人的，感觉有细菌,0,2,0,2022-07-26 19:58:17,来自山东,3632419442012734,用户6851322053708
7124648610302149376,还是煮熟再吃，安全健康,0,2,0,2022-07-26 19:56:20,来自广东,7561376591,用户8600303014058
7124477560427725576,不吃虾的路过[捂脸],1,0,0,2022-07-26 08:53:16,来自重庆,329502952013256,用户3382567796696
7124591746159903518,朱教授支招妙,0,3,0,2022-07-26 16:16:19,来自湖北,103638525605,用户6567835405747
7124679083044651810,海鲜敢吃，河鱼生鱼片就算了，那个寄生虫太多。,0,1,0,2022-07-26 21:54:28,来自辽宁,2717590495444776,用户400672822074
7124655868179972878,冷冻七天就不新鲜了，海鲜就图个新鲜吃。,0,2,0,2022-07-26 20:24:39,来自山西,106464893112,用户135988189842
7124614642382504707,海里的东西大多沒问题，我是海边人。反到是淡水的东西问题多，或者是肉类[酷拽],0,3,0,2022-07-26 17:45:05,来自辽宁,69967681422173,用户3086558814133
7124645853087843112,生猛海鲜生吃味道好，但确实不安全。,0,2,0,2022-07-26 19:45:28,来自浙江,1838024431764685,用户7223400091765
7124655699674170120,刷到几个吃猪生，鱼生的，鱼是鲤鱼,0,0,0,2022-07-26 20:24:04,来自江西,2255844017714668,用户5946196265053
7124704336621355810,看起来好吃吗😋,0,0,0,2022-07-26 23:32:54,来自重庆,110850706658,用户1335780389649
7124627712463422223,感觉没事的就吃呗，自己对自己健康负责,0,1,0,2022-07-26 18:35:21,来自北京,3729099619,为什么涨
7124638406742655759,感觉没事的就吃呗，自己对自己健康负责。,0,1,0,2022-07-26 19:16:33,来自河南,62484542126,老杨43515
7124635382981067534,浙江人超爱吃生淹货,0,1,0,2022-07-26 19:05:26,来自浙江,17932407972,一片顾乡的云
7124646629672010537,[捂脸][捂脸][捂脸],0,1,0,2022-07-26 19:48:37,来自山东,19917343302,喜庆的星星e1
7124709580667929352,[赞][赞][赞][赞][赞][赞][赞][可爱],0,0,0,2022-07-26 23:54:46,来自广东,101236385036,用户啊开
7124658871330833186,[捂脸][祈祷],0,0,0,2022-07-26 20:35:56,来自河南,175513773016510,用户7890525207494
7124646924510298884,👍👍👍👍👍,0,1,0,2022-07-26 19:50:12,来自天津,1011146704817879,用户6542701664479
7124653040921232167,[赞],0,1,0,2022-07-26 20:13:52,来自安徽,1091159884310543,dye2thcunhz0
