7124467697181721379,阅读理解都不及格吗？！文章讲得很明白了，网约车是出租车的一种“作为目前网约车主要监管依据之一的《网络预约出租汽车运营服务规范》，也清楚明白地规定，网约车的运营服务应符合GB/T 22485-2021《出租汽车运营服务规范》的行业标准”，不想附和行业标准的就别开网约车，去开黑车去不就完了嘛！！价格自己定，乘客自己找，多好啊！跟这掰持什么？！你们可以不开空调，乘客也有权选择投诉或是不坐，但想把开空调就单付10元变成行业规则门也没有！,0,0,0,2022-07-26 08:14:26,来自北京,17197255106575,babyface算计会员骗钱
7124142042888487683,其实归根结底就是平台抽成太高。把司机的利益都抽走了。乘客付的钱少抽一点是绝对够空调费的[抠鼻],1,39,0,2022-07-25 11:11:31,来自湖北,4649826987,北半球的闲适
7124149676991349519,"为了和顾客赌气，有些出租机只开鼓风机的开关，不开AC开关,面对顾客的质问，司机居然讽刺顾客没有携带温度计……！弄得顾客投诉无门[发怒][发怒][发怒]",2,7,1,2022-07-25 11:40:16,来自北京,15305709387,盛市美颜
7123838254306509579,这种司机真是不好，给他差评[抠鼻],2,2,0,2022-07-24 15:32:30,来自河南,66022210194,李阿姨谈人生
7124195577545704230,强调一下新京报说的话是不对的 上海的出租车空调开启时间从冷6月～10月 暖11月～4月 可根据乘客意愿 网约车的运营服务应符合出租车运营服务的行业标准，该行业标准明确驾驶员“应根据乘客意愿升降车窗玻璃、使用音响、视频和空调等相关服务设备”，所以，乘客要求开空调的诉求是合法、合理的。@新京报,2,1,0,2022-07-25 14:39:05,来自上海,2400942104801789,坦荡的天空Co
7124190773180318504,网约车的运营服务应符合出租车运营服务的行业标准，该行业标准明确驾驶员“应根据乘客意愿升降车窗玻璃、使用音响、视频和空调等相关服务设备”，所以，乘客要求开空调的诉求是合法、合理的。,3,1,0,2022-07-25 14:19:45,,3518889484104599,浙江安瑞律师事务所
7124226700615320356,滴滴当初就明确，专车必须满足乘客需要，就算是冬天乘客要求开冷气，也必须满足，快车则不需要，开不开空调，司机自己决定，只要安全把乘客送到目的地即可…,1,9,0,2022-07-25 16:39:36,来自湖南,51357631825,谦年老妖
7124364085210841897,还是价格的事，乘客想便宜，平台想接单，司机想赚钱，没有一个产品靠便宜能干出好事的，想便宜又想有好服务那是不可能的的，再说你是平台下的单有问题是找平台，其实你是平台的客户司机只是个帮平台送客的，不满意可以跟平台反应。不应该跟司机吵，网约车跟出租车还是有区别的，你买的产品不好你不可能找生产工人吧！,0,5,0,2022-07-26 01:36:15,来自浙江,66593300660,时尚尾货女装
7124195838271685414,38度高温天，妇幼医院门口接一个女士，上车后让把空调关了，窗户也只能开一点点，可想车内高温能不能呆，这种情况下能拒载吗？,1,4,0,2022-07-25 14:39:56,来自上海,1653272399848382,不凡溪水Wp
7124123857967170308,只要网约车平台把价格合理化这个问题迎刃而解！,2,19,0,2022-07-25 09:59:34,来自河北,80594072705,存在就是幸福
7124091103024333575,市场经济 淘汰劣质司机 让乘客安全舒适出行,13,9,5,2022-07-25 07:53:54,来自福建,6410226485,西海岸农民
7124262303050449668,如果说司乘矛盾也是和毒教材一样思想植入呢，细思极恐,1,1,0,2022-07-25 18:58:12,来自北京,12787411585900,京味小金子
7124087374010712869,司机也要活命啊！任何行业只有健康有序的发展，才能造福各类人。油价这么高，有些平台已经把价格调低到0.98元/公里。你让司机怎么活？应该想想为何会这样。,6,35,0,2022-07-25 07:38:59,来自广东,20050291370,街拍深圳的书生
7124376073391309603,司机也是人，不是神。我来分析一下，司机能忍受，说明天气可开不可开空调，高温下司机肯定会开，司机也受不了热呀！有的人认为出了钱，没开空调吃亏了，其实吧，几块钱的单子，车子除了一切开支，司机没赚到你几个钱，你要是个大单，司机肯定会按你的意思办，这是平台留创下的问题。还有的人说外面空气不好要开空调，这个问题就不是司机的问题了，是环保问题了，有的人说开窗太吵了，要开空调，什么人都有，要求就多。一分钱一分货都知道吧，打专车空调不会关，还有免费的水喝，服务好，但是你要多出钱，有的人又舍不得了吧？假如你住50块的小旅店，要有五星级酒店的环境和服务，可能吗？网约车真的利润太低了，学会感恩吧，司机真的太不容易了，车子的拆旧费，保险费，维修费，保养费，还有不固定的意外风险，大家去算一算这笔帐吧，月薪过万就是个笑话，我就体验过了,0,4,1,2022-07-26 02:25:39,来自广东,60375350104,看不惯的人与事
7124146277826511656,说这么多，就是绝口不提给司机加空调费[狗头]，不开空调是这个价格开空调也是这价格[狗头]，哪个会愿意,1,6,0,2022-07-25 11:26:55,来自湖南,1258281037468464,乐天派星球LO
7124531870498292511,其实归根结底就是平台抽成太高。把司机的利益都抽走了。乘客付的钱少抽一点是绝对够空调费的[抠鼻],0,0,0,2022-07-26 12:23:30,来自海南,99216964291,多彩星辰Af
7124212621439501087,这篇文章完全站在打车，乘客没有图便宜，服务就不会少。要便宜坐公车，地铁，大巴,1,0,0,2022-07-25 15:44:49,来自广东,70038405008,四月RtVe
7123949495213130537,新京报越来越不像话，请先了解北京出租车管理办法，出租车是公交的补充部分，出租车包含网络预约出租车，北京早就有规定乘客有权使用车内设备，司机拒绝使用的可以投诉。,7,14,3,2022-07-24 22:43:23,来自北京,3916696432,魔法喜鹊n
7124102365351346977,现在网约车内卷厉害价格没有最低只有更低，六七块钱的一口价比摩的还便宜，司机在贴钱+吆喝，我跑了一段时间顶多就是賺个快餐而已，空驶多了连油钱都会亏的这么热的天气开空调真的很费油,0,7,0,2022-07-25 08:37:52,来自广东,102938541195,身康力健
7124328852901806852,既然网约车与出租车一样为啥早晚高峰不能走公交车道，机场火车站接人为啥姚收费，为啥网约车就要🆚出租车车价高，车型好，为啥网约车不能停出租车都路边车位，为啥空车网约车能上高架，出租车空车就不能上,0,2,0,2022-07-25 23:16:44,来自上海,67252978671,仲夏之夜的玫瑰花
7124267380687782687,网约车开不开空调应该是服务中的内容，按服务规定办。,1,1,0,2022-07-25 19:17:37,来自北京,103816630489,流星74955
7124127652847420160,这个东西太简单了，所有价格默认不开空调，APP上设置一个按钮，需要打开空调，直接点击一下支付预估时间相应的费用就ok了，全程你都不用交流，你在APP上选择相应的服务，师傅的手机端直接提醒客户需要开启相应的服务。就ok了，都不用交流，把费用拆分一下，行程的费用就是行程的费用，你想要开空调，你就支付开空调的费用，我不喜欢空调，或者你想省费用也行，你就选择不开，唉，所以说其实很多问题都很简单，但是呢又因为各种各样的原因，大家没有办法解决，其实很复杂嘛，一点也不复杂，,5,17,1,2022-07-25 10:14:14,来自浙江,76234330176,像风一样自由249843971
7124114493621568288,乘客坐车 司机 要不要开空调 这两者相对而言 并不很矛盾 你换位思考一下 作为乘客 你在上面能做几分钟 而驾驶员呢 他要坐十几个小时 再比如我们上饭馆吃饭 有的开空调 有的不开空调 你要感觉热 你可以选择，所以说 都不要纠结那些东西 坐车最主要的是就把你安全的送到目的地 就好啦 ，其次就是拿钱买舒服,0,4,1,2022-07-25 09:24:32,来自广东,103235194716,狱卒007
7123837892350345987,这种司机真坏,1,0,0,2022-07-24 15:30:51,来自河南,66022210194,李阿姨谈人生
7124227696980771599,开不开空调乘客定，配不配婴儿座椅乘客定，给不给过路费乘客定，接人需要等多久乘客定，司机态度好不好乘客定，那司机定什么呢？！价格司机定可不可以呢？！,6,17,3,2022-07-25 16:43:03,来自四川,62094313954,605张
7124225364158858016,不要拿网约车跟出租车比，出租车贵，出租车不限号，出租车有五险一金，网约车什么都没有。,4,15,2,2022-07-25 16:34:40,来自北京,2880348852338331,多彩橙子ai
7124192090007372559,成本高是关键，司机起码给个收益下限吧。市场经济，双向选择，系统内司机要收空调费的明显乘客，供乘客选择。司机也可选择收与不收。这样技术上应该没问题吧,1,0,0,2022-07-25 14:24:58,来自贵州,96193861016,月基拉
7123797420324487967,有人遇到过这种不靠谱的司机吗？这种是不是很影响大家的心情呢？,6,2,0,2022-07-24 12:53:54,来自河南,110936788372,康先生聊生活
7124235252998423307,这个题目本身就有问题。开不开空调由乘客定得有个前提条件，就是价格符合双方的利益需求，低价格不可能得到好服务，便宜都让一方占了可能吗？！,2,20,2,2022-07-25 17:13:13,来自北京,52429544772366,小溪
7124260078034879266,也许我们不能选择乘客和订单，但是自己的车可以选择什么时候空调是好的，什么时候是坏的！不开空调司机能忍耐你为什么不能？专车，豪车里面吃的喝的都有！你去叫那种车啊！,1,2,1,2022-07-25 18:48:34,来自河北,78528598834,66666258111148
7124516063471043359,如果平台抽成少，不会有这种现象.出租车个个都开空调,1,0,0,2022-07-26 11:22:19,来自江苏,52535308400,来扬看琼花
7124313224408843016,电车更马夸,0,0,0,2022-07-25 22:15:02,来自山东,64728371575,军工材料
7124481613093978921,这那里是司乘矛盾啊，明明和平台有关系，平台搞了一大堆特惠，拼车啊，远远降低了司机收入，加上疫情，油价高的离谱，汽油车现在跑滴滴根本不怎么赚钱，所以说让司机吃土啊，天天做善事啊,0,2,0,2022-07-26 09:08:23,来自广东,94838334160,小张张
7124297418094920456,一般都是乘客下车后才开[抠鼻]。你一个起步价的特惠单，要开空调，那不是想多了么,0,1,0,2022-07-25 21:13:41,来自云南,5807353298,三迤散人
7123897847904879399,油费贵，给自己用给自己花钱可以，自己愿意怎么着就怎么着！特惠快车那么便宜，凭什么给别人用？？？？,1,0,0,2022-07-24 19:24:09,来自河北,68730004991,秦皇岛幸福人家
7124230116079108897,大热天的司机在车内不不知道热吗？为什么不舍得开空调？现在油价高成本高，扣的多，挣得少，谁来买单?,0,11,2,2022-07-25 16:53:01,来自北京,5376910072,12345652330531
7124194807806903040,如果像广州那样建造树根状分布（当初仿自香港）的地铁，广大市民就基本上出行不需要打车了，管你司机开不开空调，不开就直接失去80%客源。所以说，利益面前，说教和道德是无力的。,0,0,0,2022-07-25 14:35:16,来自广东,6286883478,梦碎梦醒梦无痕
7124318212197696264,一分钱一分货没毛病吧。网约车要是有出租车的价格，开空调问题不大,0,2,0,2022-07-25 22:34:45,来自北京,100702404792,某某9527
7124479034574373672,"网约车本身就是不合规、不合法的，所以在它身上发生的事有什么好议论的，累人。
 你愿意坐网约车，就准备好了把你的一切都交给它了，不然就打的。
 我觉得作为普通老百姓日常生活中千万别越位了，还是看看女足2：1胜澳大利亚吧，满满的正能量。",0,0,0,2022-07-26 08:58:20,来自上海,3302534056248755,实在心安
7124126247310983939,什么特惠，远途拼车，优先接拼车，全部都是平台想出来压榨司机利润的东西，好比滴滴，疫情期间抽成也是一分不少[打脸][打脸][打脸],0,5,0,2022-07-25 10:08:43,来自浙江,4128417067,辣辣杠滴
7124518156848792354,还是公司之间竞争，打折降价，最后还是压榨司机，油价再猛涨。我就是滴滴司机，我认识的所有滴滴司机都诅咒滴滴倒闭,0,0,0,2022-07-26 11:30:14,来自山东,62564164264,吃吃乐
7124218627733472036,想开空调就别打特惠一口价。,1,8,2,2022-07-25 16:08:27,来自北京,106359309494,竹小马
7124211329061274409,今年温度这么高，司机不开空调自己能受得了？,0,1,0,2022-07-25 15:39:27,来自广东,6030104771,辉仔的生活记录
7124298301998072616,你没坐公交吗？开空调加钱奇怪吗？,1,2,1,2022-07-25 21:16:43,来自上海,3887407078,期货交易员老威
7124489108646789919,这是投诉一下就行了，我记得上次坐车后，系统主动发过来问卷，司机有开空调吗[捂脸],0,0,0,2022-07-26 09:37:40,来自河南,52358613306,暴躁外鈹
7124441042644271903,别说网约车，我們這里医院都不给开空调。,0,1,0,2022-07-26 06:31:48,来自江苏,2384170476377279,风趣西柚3x
7123797330436064008,如果都可以像我早上打车的这个网约车司机，主动给帮忙开门，主动询问空调温度的司机，谁会不喜欢呢？,0,1,0,2022-07-24 12:53:18,来自河南,110936788372,康先生聊生活
7124481248332399396,不管理网约车平台，压榨司机快无法生存了,0,1,0,2022-07-26 09:07:31,来自江苏,69553702113,地球守护者a
7124225482903831304,特惠一口价和快车单开不开空调司机决定完全合情合理。专车默认必须开空调不开空调司机被重罚合情合理,0,8,3,2022-07-25 16:34:46,来自北京,50469091380,不老英扎吉
7124516436018086689,一公里给司机的价格达到2元没有一个司机不开空调的，钱都让平台抽走了，司机不挣钱就是一种发泄,0,0,0,2022-07-26 11:24:26,来自江苏,79338356824,缘分260953121
7124054158462419742,如果乘客打的这个车子不是滴滴和美团，那还真有可能不开空调，像高德和花小猪这么便宜司机当然不愿意,0,7,0,2022-07-25 05:32:29,来自上海,3286245338,骑28追风
7124223031727112967,垄断利益在，先把网约车统一车身标识再说吧,0,5,0,2022-07-25 16:25:09,来自北京,108049287410,yinian2000
7124280826237731622,降低平台的抽成比例在百分之十五以下，适当提高司机收入，司机师傅自然而然就会开空调。,0,1,0,2022-07-25 20:09:43,来自北京,52796811749,无岸的海
7124247165488497448,原来出租车就有规定温度多少以上必须开空调,0,0,0,2022-07-25 17:58:31,来自湖北,66225500428,古月moon
7124257424399352591,平台抽佣占了30%，乘客实际是没少付的，解决了平台抽佣问题就没问题,0,3,1,2022-07-25 18:38:17,来自四川,501814546150526,我爱我家haihan
7124517033672360745,可以收，但是作为乘客可以给你差评车里有异味，态度差，车脏，都行呀,0,0,0,2022-07-26 11:25:38,来自河南,2849537009916680,北洋水师都统
7124179234636972840,司机也要养家糊口，钱都被滴滴赚了，司机成了苦力，倒霉成了顾客的,0,1,0,2022-07-25 13:34:46,来自北京,93008651882,双枪快腿小白龙007
7124238246850511649,公交车有补贴，司机拿工资，无所谓，网约车不一样，比如出租车起步价这么高每公里也这么多钱，网约车拿什么跟他们比,0,0,0,2022-07-25 17:24:45,来自四川,93123993811,狮子大王grMJ
7124154072998920996,油价这么贵，打车费很多起步价司机开空调可能还亏钱,0,2,0,2022-07-25 11:57:23,来自江苏,6605929760,超级范大神
7124501175642604299,我是上海出租车到手平均四块一公斤 ，他们网约车才两块,0,0,0,2022-07-26 10:23:47,来自上海,96276373139,传奇立宏哥哥
7123962960187294497,油费怎么贵当然要空调费了,0,13,0,2022-07-24 23:36:45,来自广东,86671847546,theq666666
7124249028132586255,什么价格什么车型什么服务。,0,8,0,2022-07-25 18:05:46,来自北京,66825796042,壹号2号壹
7124247274821600015,司机也在车上，我不信他不热。他一直在车上，我坐一会儿就下了，看谁熬得过谁,0,1,0,2022-07-25 17:59:02,来自重庆,870403357025278,差一点我就成了厨师
7124108425898361634,一切都是平台惹的祸，你把单价搞得这么低，让司机怎么活,0,6,1,2022-07-25 09:00:20,来自广东,1306643392113815,锻铜锐劕
7124487969683718952,有时候很奇怪，那么多平台，价格低了为什么司机还做？就不会换个平台？说白了还是能挣，郑的少而已，而且现在是电车，成本应该不高才对吧,0,0,0,2022-07-26 09:33:12,,69509579399,夢醒幻破
7124224874595877669,这种事情是不是只有北京的司机朋友才干得出来？,0,0,0,2022-07-25 16:32:34,来自重庆,93918091762,雾里看不清雾里的雾
7124424993534165795,电费不贵吗，1.2元一度电，快充1.9，苦的还是司机师傅。平台太狠了,0,1,0,2022-07-26 05:30:25,来自北京,66277438113,望月泰山
7124148329642492676,平台和司机之间的利益冲突，变成了司机和乘客的矛盾,0,1,0,2022-07-25 11:35:50,来自湖北,106085619547,归根复命
7124285339854193447,不愿意开空调为啥干网约车？,0,0,0,2022-07-25 20:27:15,来自北京,2041166341364526,乐观贾斯蒂斯4X0
7124240194664317711,乘客支付的钱肯定够，只不过平台抽走了,0,0,0,2022-07-25 17:31:24,来自广东,92336819966,孤坟
7124170559646073640,关键点是网约车单价太低！比巡游出租车低很多，确实是明显不合理的！,0,0,0,2022-07-25 13:01:03,来自上海,61184321812,魔都老刘茶馆
7124261454785839883,还是契约精神的事，就像签好了合同，不能因为你成本突然增加了就想法让对方给你买单,2,1,1,2022-07-25 18:54:48,来自北京,2203064828959388,火绒团
7123797080812454663,不知道大家有没有遇到过这种不靠谱的网约车司机呢？,0,1,0,2022-07-24 12:52:24,来自河南,110936788372,康先生聊生活
7124319242954179365,我晕车所以每次坐车最希望的就是司机能把空调关了，有些司机也能接受，而且聊着聊着就开始在车上抽烟了[大笑][大笑][大笑],0,0,0,2022-07-25 22:38:31,来自广西,59386858671,小怪兽161565093
7124433379005023012,那个平台没规定根据乘客意愿使用空调的，还真不晓得，这种平台还有必要存在吗[灵光一闪],0,0,0,2022-07-26 06:02:42,来自广东,6606767321,凉热冷冻
7124129417995027212,当乘客需要开空调时，应该给司机加百分之十费用！,0,1,1,2022-07-25 10:21:03,来自河南,6672806180,等风的旗等
7124209219100345088,网约车平台把价格定的合理些，这种问题根本不是问题。,0,2,0,2022-07-25 15:31:27,来自上海,62467392137,正义的山姆
7124258361851347743,开空调算什么？如果有个美女乘客要我陪她吃饭我都服务到底。,0,1,0,2022-07-25 18:42:22,来自广东,106018079265,HE000
7124281319118930721,主要还是平台抽成太高 百分之十五 就都开空调了,0,1,1,2022-07-25 20:11:45,来自浙江,101974201659,男人海洋33439
7124539313446634271,一个车上有的人晕车，要开窗，有的要开空调，怎么办？,0,0,0,2022-07-26 12:52:45,来自广西,3227821205362663,桂林交通贫道
7124540607581815587,不开空调他自己都会热死。,0,0,0,2022-07-26 12:57:00,来自广东,6358148461,小英86147491
7124314594291647266,公交车都有普通和空调,0,2,0,2022-07-25 22:20:07,来自四川,1329625737,手手清不扯经
7124241986894578466,以前出租车好像有一块钱的什么汽油涨价费。,0,4,1,2022-07-25 17:38:27,来自北京,1103565133976056,大叔虚度
7124309868051186464,滴滴客服回复，普通快车没有空调服务，坐标青岛,0,0,0,2022-07-25 22:02:03,来自山东,3728029089,青岛一剑封喉
7124148430230536972,网约与车现在都是电车，二年了一台油车都没打到过，我还真没见过不开空调的司机。可能地方各有不同。,0,0,0,2022-07-25 11:36:18,来自广东,4498839060614028,东zd
7124244592144646945,公交车还分空调不空调呢,0,7,1,2022-07-25 17:49:25,来自北京,52281232504,焦点人生
7124423187806913320,价格要不要也执行当地出租车价格？？[捂脸],0,1,0,2022-07-26 05:23:36,来自四川,2240024602,九曲青溪
7124268220068102920,不开空调司机怎么受得了,0,0,0,2022-07-25 19:20:29,来自上海,3094599966,恒雪冷库定制厂家直销
7124228405440578311,不开空调司机也受罪啊，生活不易。,0,3,1,2022-07-25 16:46:17,来自北京,67876818391,lyrstar
7124136737223246630,好像广州这种问题少很多，像广州这种天天36度天气，司机不开空调自己都会中暑,0,0,0,2022-07-25 10:50:35,,86256635570,永远滴杰队228
7124314607736898318,一份价钱一份货。黑旅馆的价格还想有星级酒店的服务？？？,0,1,0,2022-07-25 22:20:37,来自安徽,107981943263,这个名字不太好记
7124220433557750535,快车无空调服务，司机说了算,0,3,2,2022-07-25 16:15:25,来自北京,81821293909,楠坤
7124135439598175006,司机不怕热佩服,0,0,0,2022-07-25 10:45:21,来自浙江,2488903253890494,人类万恶之源
7124077389604963072,看来是收了平台好处了,0,4,0,2022-07-25 07:00:12,来自河南,102925491330,全程记录网约车
7124185269989278498,疫情原因不能开空调，需要通风,0,1,0,2022-07-25 13:58:31,来自重庆,1794045126916894,重庆东哥民宿Vlog
7124285912062345998,《网络预约出租汽车运营运营服务的行业标准服务规范》，也清楚明白地规定，网约车的运营服务应符合出租车，运价不符合出租车管理运价，乘客支付100%的车费司机只收到70%左右的车费，所以30%左右的服务司机就服务不了！,0,1,1,2022-07-25 20:29:07,来自广东,2837190039839853,我爱加密数字货币
7124231816311227143,硕大一个北京城还用油车做滴滴？？？？不都是新能源啊？？？？,0,0,0,2022-07-25 16:59:25,来自广东,105370347002,明哥的明天
7124189299590841102,油价高，司机也要生存,0,0,0,2022-07-25 14:14:12,来自江西,6655400350,桑心欣
7124518020722115342,问题司机自己受的了吗[大笑][大笑],0,0,0,2022-07-26 11:29:57,来自江西,59367403672,虔城趣事
7124325265098179339,小编就直接回复，司机定什么？,1,0,0,2022-07-25 23:02:43,来自广西,83154773224023,吾言吾言
7124175274027598595,都是资本害的，恶性竞争为了赚钱拉低价格，结果还是平民遭殃,0,0,0,2022-07-25 13:20:19,来自广东,50017282930,天屎的眼累
7124511929166758696,油价太高了，平台抽成也高,0,0,0,2022-07-26 11:05:49,来自江西,106675158156,玖零玖壹9091
7124440926919492363,再要个开窗费，不然一起闷车里[捂脸][捂脸],0,0,0,2022-07-26 06:32:32,来自广东,6659467651,正能量的枫原万叶
7124499192374346536,沈阳出租车9元，空调10元，很合理,0,0,0,2022-07-26 10:16:04,来自辽宁,50054374100,三横一竖两点水
7124026735221703463,油价高是根本问题,2,2,0,2022-07-25 03:56:25,来自河南,5771380861,聪明的光束Tp
7124176891879801640,电车最便宜0.1每公里开空调算0.2每公里，一台自购网约车算15万，8年或60万公里强制报废0.25每公里，运营车一年一万左右保险，算10万公里一年0.1每公里，减掉空跑有效载客里程算1/2，（0.2+0.1+0.25）＊2=1.1元每公里的成本，如果价格低于这个真没法开空调[抠鼻],0,1,0,2022-07-25 13:25:51,来自广东,413028009123630,70暖男80好人90直男
7124531176685142798,没错，油价涨了，车费没长,0,0,0,2022-07-26 12:20:55,来自河北,83994068837,说都不会话了
7124148820699071271,别跑网约车了。踏踏实实的找个工作做。长痛不如短痛。兼个职跑一下还可以理解。专职去跑，真的没那个必要。,0,0,0,2022-07-25 11:37:44,来自广东,4407283387737787,乐观雨天0l6
7124276886343533349,这文章说的两边都挺爱听，就是没解决问题。,0,0,1,2022-07-25 19:54:06,来自北京,1776420537252039,牛氓柴纸
7124111589019747079,中国的出租车费是全世界最稳定的价格了，三十年前是这么多，现在不但没涨还便宜了不少，奇迹啊！,0,3,0,2022-07-25 09:12:55,来自广东,106018079265,HE000
7124193611159651079,公交车有政府补贴，网约车呢？,0,0,0,2022-07-25 14:31:10,来自福建,5850138129,路过即偶遇
7124506855762248484,滴滴出行只抽29%,0,0,0,2022-07-26 10:46:48,来自四川,2330583922125054,迎風前行
7124251914757784333,谁让滴滴给那么低的价格,0,2,1,2022-07-25 18:17:29,来自北京,3457341813961116,庆9909
7124080106733486886,司机最能吃苦,0,0,0,2022-07-25 07:11:32,来自上海,108694847308,kingsfaming
7124215218209129227,想得到服务就会产生费用。好货不便宜。,0,0,0,2022-07-25 15:55:23,来自重庆,5364048979,爱吃猫的鱼008
7124488330813211396,哪个行业都需要利润，没有利润就无法生存，无法持续发展。,0,0,0,2022-07-26 09:35:22,来自广东,4325017682,长江一号飞飞
7124473547161879304,怕不赚钱就别干,0,0,0,2022-07-26 08:37:28,来自山东,105171133686,零零落落来了老了
7124253099430789918,主要还是油价上涨的厉害，车费不见涨,0,0,0,2022-07-25 18:22:07,来自广东,100671178710,陳大哥221
