7124016291144712990,看到“仍在亏钱的平台也很难去补贴”，我笑了,0,5,0,2022-07-25 03:12:40,来自北京,1750021958829608,ChangAnNing
7124313843022742312,所以这年代打什么车，远点自己开车，近点骑电动车多方便,0,0,0,2022-07-25 22:17:07,来自广东,101532068339,126685好
7124505781902885645,主要是价格实在是太低了，真的比电动车价格还要低,0,0,0,2022-07-26 10:42:41,来自广东,1072776340313822,激流勇进
7124186755385279266,还不是平台抽的太狠 不管什么平台一出来确实不错 到后面就变了[捂脸],0,0,0,2022-07-25 14:04:13,来自福建,58876217608,曾经的老学长
7124143174632768270,不开空调也好,0,2,0,2022-07-25 11:15:12,来自四川,110791411693,博学暖阳Gp
7124520132491166494,那是因为他没双证，,0,0,0,2022-07-26 11:38:05,来自重庆,5457006150,羿割
7124114341057938184,滴滴网约车罚少[发怒][发怒][发怒][发怒][发怒][赞][赞][赞],0,0,0,2022-07-25 09:23:34,来自湖北,4284153805681207,奋发小猫nk越来越好
7124204953513870080,给空调费不就好了,0,0,0,2022-07-25 15:14:40,来自上海,96518076412,沃沃
7124445936918643490,我一般只接实时单，一口价的单看着就跟一百块掉进茅坑里一样，捡嘛恶心自己，不捡嘛偶尔遇到大单又觉得可惜,0,1,0,2022-07-26 06:50:11,来自福建,85822371214,搜狗16888
7124320962933261064,这事要是放在医院，那就是小事情而已。,0,0,0,2022-07-25 22:45:15,来自河北,5894765493,可靠乐观的先生
7124220409612059396,一个原因，油价高得离谱了。,0,0,0,2022-07-25 16:15:26,来自重庆,58624661851,不爽又能如何
7124228090339230479,说了等于没说…,0,0,1,2022-07-25 16:44:34,来自北京,51120169661,马里奥的日常
7124272769583383311,价格调高,0,1,0,2022-07-25 19:37:46,来自北京,5969585864,天行健13691069
7124142830938850063,无所谓了,0,3,0,2022-07-25 11:13:34,来自四川,6043807135,文粥粥
7124091943759512335,叫专车么,0,1,0,2022-07-25 07:56:20,来自陕西,6098471168,二级抬杠运动员阿杜
7124481074738021155,应该的,0,0,0,2022-07-26 09:06:06,来自广东,71852033649,海浪43738
7124068731944338176,平台打价格战，乘客收益，司机受伤,2,8,1,2022-07-25 06:26:34,来自湖北,575768356463123,登高望远20202
7124528160426984230,乘客没有少华钱，司机到手却很少,0,0,0,2022-07-26 12:09:26,来自天津,4287686138934397,照见吾心
7124172695243195172,挺好的营运市场让资本搅和乱了，结果无论是出租车还司机是网约车司机都不吃不饱，没听说过互相砸价能挣钱的,0,0,0,2022-07-25 13:09:45,来自天津,3773271025,小七5112
7124295228617786126,懂什么啊，空调耗油应以时间来算，与公里无关！我的车空调制冷开与不开每小时油耗相差0.7升！92油价8.74算下来就是每小时增加6块多油钱！,0,0,1,2022-07-25 21:05:07,来自上海,839680281552078,阿龙A8993
7124243034304627469,开与不开每公里差几分钱，油车司机你至于吗[大笑][大笑][大笑],0,0,0,2022-07-25 17:42:57,来自北京,5799994724,o雷老虎o
7124222613438186255,什么样的价格决定什么服务，我虽然不是开网约车的这点还是知道的，“贫”论区的某些人忒厚颜无耻了！,0,0,0,2022-07-25 16:23:24,来自广东,2827548381677399,乐天派会飞的鱼ow4h
7124106877742990112,平台无底限恶性竞争的后果,0,1,0,2022-07-25 08:55:11,来自广东,107768898643,粤漂阿飞
7124226498982806309,滴滴还没被罚死？,0,5,0,2022-07-25 16:38:52,来自北京,2304211090681655,抽烟喝酒烫头不
7123837876462764812,严重差评,1,0,0,2022-07-24 15:31:04,来自河南,66022210194,李阿姨谈人生
7123813276202533663,差评呗,1,1,0,2022-07-24 13:54:57,来自河北,2444949808487933,东西方不怕
7124207908531061507,本质的原因在于，每个平台规则不一样，价格不一样。乘客不了解每个平台规则。所谓一分钱一分货，活虾跟死吓价钱能一样嘛？,1,0,0,2022-07-25 15:27:08,来自广西,1829195101774635,用户5128497483077
7124302010471891752,油价太贵，平台抽成又高，实际利润太薄，开空调需要加十块，八块的也是合理的，多理解吧！,0,1,0,2022-07-25 21:31:14,来自北京,4270100937711230,用户9117128838701
7124174864126083854,出什么一样的钱，享什么样的服务，不必计较太多，钱出够了还怕服务不周到？,0,1,0,2022-07-25 13:18:07,来自四川,1873162649736734,用户606833836257
7124243357031383846,空调公交车也都不开空调，凭什么岀租车开空调呢！,0,0,1,2022-07-25 17:44:45,来自吉林,193116208898136,用户1327986698743
7124211831715545871,油费怎么贵当然要空调费了,0,1,0,2022-07-25 15:41:33,来自浙江,111243117692,用户7822181506059
7124298877485744936,开空调的话赚不到钱，不如在家睡觉,0,1,0,2022-07-25 21:18:54,来自河南,3210201278714184,用户1780071638504
7124541507054699264,这么热自己有精力驾驶？自己已经危险驾驶了。,0,1,0,2022-07-26 13:00:34,来自山东,1239856581184219,用户1638704126978
7124477337780962085,顺风车之前都因油价上涨加收10元现金[灵光一闪],0,0,0,2022-07-26 08:52:17,来自广东,276684943919059,用户37588588
7124343978266788641,不开你也受不了的嘛,0,0,0,2022-07-26 00:17:44,来自四川,1860019040821556,用户5770078684660
7124220113384997667,燃油附加费?[呲牙],0,0,1,2022-07-25 16:13:30,来自北京,93163155363,用户525490755242
7124513248942129927,司机开空调收费，你们说根据《出租车管理条例》，平台一次二次降价司机，提高抽成，律师站出来说过话？油价，物价高涨司机太难，平台为了占领网约车市场又推特惠单，拼车单，轻快单价格低的离谱，又有谁来管过？《网络预约出租车管理办法》出台6年，各大平台还存在着大量的不合规司机和车辆，又是谁在纵容和不作为。如果是网约车价格合理，那个司机愿意40度的天气不开空调？,0,0,0,2022-07-26 11:11:24,来自四川,1055123110106423,用户6558227191310
7124124437779563305,油价继续加油涨！问题就解决了！,0,0,0,2022-07-25 10:01:51,来自北京,1988374701288376,用户6555461408222
7124257600245564160,一句话没利润，怎么有服务，要想服务好，票子不能少,0,0,0,2022-07-25 18:38:58,来自广东,4319316251773740,东莞喻生
7124249703256195878,金钱决定服务,0,2,0,2022-07-25 18:08:59,来自浙江,1253076769973660,hanbing99999
7124219551705072398,说了等于没说,0,1,1,2022-07-25 16:12:04,来自北京,110965836113,用户5690103360753
7124148986327827207,,0,3,0,2022-07-25 11:37:57,来自四川,1592572007688344,陈陈美涵
7124220496317203207,,0,0,0,2022-07-25 16:15:42,来自北京,81821293909,楠坤
7124439404168741666,,0,0,0,2022-07-26 06:25:14,来自上海,3069473155200909,勇者本溪3Z9
7124143211081138974,,0,2,0,2022-07-25 11:15:16,来自四川,110791411693,博学暖阳Gp
7124050674509251328,[捂脸][捂脸][捂脸],0,0,0,2022-07-25 05:17:22,来自海南,18849660264,椰子树下无真情
