7124486458463224590,公告显示，相关流程预计在2022年年底前完成。其后，阿里在美国挂牌的存托股和在香港上市的普通股将可以继续互相转换。投资者可继续选择以其中一种形式持有阿里股份。阿里集团董事会主席兼首席执行官张勇表示：我们对中国的经济和未来充满信心。希望让更广泛多元的投资者，能共享阿里的成长和未来。,1,9,0,2022-07-26 09:27:49,来自黑龙江,5123053713,余丰慧
7124488007663092514,经营不易，期盼顺利，为国争光！,0,23,4,2022-07-26 09:33:15,来自河南,6911802040,中概股研究
7124484058767377183,对，不要着急，帝国主义都是心浮气躁的纸老虎，只要我们保持战略耐心，它终将露出软肋，我们也必将牢牢占据斗争的主动权。给中国人加油！头条热榜,3,8,2,2022-07-26 09:18:16,来自黑龙江,5123053713,余丰慧
7124489800924889891,经济需要复苏，企业必须强大。,1,8,2,2022-07-26 09:39:38,来自河南,104790266629,亚太上市公司研究
7124523175345439503,阿里巴巴有祖国和人民的支持。在中国香港特别行政区上市应该是等代時間的到来。,1,7,0,2022-07-26 11:49:25,来自广东,1591688355134763,仁爱帆船3
7124486372542710559,#阿里巴巴# 7月26日，阿里发布公告称：董事会已授权集团向港交所提交申请，将新增香港为双重主要上市地。在港交所完成审核程序后，阿里将在港交所主板及纽交所两地双重主要上市。,0,3,0,2022-07-26 09:27:22,来自黑龙江,5123053713,余丰慧
7124549210275398408,#阿里申请将香港新增为主要上市地# 市场一片看好！7月26日，阿里巴巴港股高开3.41%，报103港元/股，截至午间收盘，阿里巴巴港股上涨6.02%，报105.6港元/股。,0,0,1,2022-07-26 13:31:04,来自黑龙江,5123053713,余丰慧
7124599932580922119,要去收割一波了,0,0,0,2022-07-26 16:47:42,来自河南,62716313892,聊天话题终结者
7124597023705449223,坚决斗争，不要着急,0,0,0,2022-07-26 16:36:44,来自浙江,61839130606,贝琳斯卡
7124488488304984870,自古以来商场如战场，不可轻视。,0,6,0,2022-07-26 09:35:57,来自河南,1406977935421880,热爱大自然了L
7124576188362048263,阿里不是在美国上市了吗,0,0,0,2022-07-26 15:15:53,来自广东,74925312263,279504532
7124521556948108072,提前布局，中概股有美股全面退市风险[泪奔],1,32,1,2022-07-26 11:43:12,来自福建,4142560058023691,薇薇逛红尘
7124484764882764578,祝贺阿里，愿一切顺利！,1,6,0,2022-07-26 09:20:33,来自河南,99830536319,灵感的脚步
7124484903609287436,给中国人加油！,1,2,0,2022-07-26 09:21:57,来自河南,97836090810,草莓葡萄柚子酱
7124474588482503435,这是阿里的战略性布局，进可攻，退可守，做两手准备，确实厉害👍🏻,1,209,3,2022-07-26 08:42:16,来自浙江,3280542952859240,south科技君
7124476169785393952,好像还有一个企业也是如此，是b站？,9,61,0,2022-07-26 08:48:22,来自湖北,6071787387,Felix798
7124524581532222219,阿里香港上市跟我如何产生关系呢？请教内行[捂脸],3,8,0,2022-07-26 11:55:40,来自江西,77246616085,民娜888
7124474332126036749,企业已经做大做强，应该考虑国家战略，与国家一同一心，为国为民！,10,70,0,2022-07-26 08:40:20,来自河南,3874325362120083,充满元气的睿智追梦人
7124506908274344738,阿里巴巴这两手准备啊，够高明？[赞][赞][赞],1,36,3,2022-07-26 10:46:19,来自浙江,3883105801207822,秦枫观察
7124508262992921378,如何能共享阿里的成长和未来？,1,16,0,2022-07-26 10:51:54,来自广西,1947983029998798,有兴趣可以学
7124523029253899015,阿里这个策略的确很高明啊！,2,20,1,2022-07-26 11:49:26,来自黑龙江,1195872023232094,江湖独行君
7124480265690727168,"阿里，美国，香港两地上市？
这是个什么意思呢？",3,48,2,2022-07-26 09:03:11,来自湖北,78799600624131,车城探店
7124534857883403011,淘宝还是习惯,3,4,1,2022-07-26 12:35:29,来自广西,19439266190,比hao123还好
7124469250630779679,阿里不是已经上市了？,8,55,2,2022-07-26 08:21:14,来自广东,110412625800,颜初666
7124504498810487552,在香港收割了一次又来收割第二次？[发怒],2,38,3,2022-07-26 10:37:10,来自天津,109462441536,嘉森娜开
7124500858955629319,我都不在阿里巴巴买东西了，中药材小五金家用小装饰品在拼多多，大件及电子产品在京东。刷抖音，看到合适就下手,29,55,3,2022-07-26 10:22:32,来自广东,53463893960,四月临风
7124480074187014916,为什么要上市,1,8,0,2022-07-26 09:03:13,来自广西,3834742630257624,嘿嘿的烧火棍
7124468832416531239,大家好，我是中国香港人，请问你们都是哪里人呢？,42,92,8,2022-07-26 08:19:44,来自辽宁,2692179850,核弹财经
7124469802319921958,为什么要在纽约上市？,19,59,8,2022-07-26 08:23:33,来自四川,3997453644730915,蓉城阿朱
7124473369759761193,为什么不在大陆上市？,9,38,1,2022-07-26 08:36:22,来自山东,84760415519,秦绪风
7124492840910340902,企业已经做大做强，应该考虑国家战略，与国家一同一心，为国为民！,15,74,1,2022-07-26 09:51:24,来自河北,110907630501,墨羽倾璇Anne
7124513947163935488,能否问一下，中国智能手机用户有5亿人吗,3,3,0,2022-07-26 11:13:49,来自安徽,97403684008,大气春风kd
7124532051822396168,怨是不起任何作用的,1,0,0,2022-07-26 12:24:18,来自四川,99248333932,沱江之水
7124470877349249826,阿里这一步是无比正确的选择，多手准备！[赞],2,63,3,2022-07-26 08:26:51,来自北京,52691453510,Lyb110379
7124531658556015375,我在拼多多开了一个网店，也不是说阿里如何，就是看不上外资控股企业在我国这么嚣张,1,3,1,2022-07-26 12:22:20,来自山西,4226161652010087,掌贵传媒
7124526370780480270,现在谁还用淘宝[捂脸],5,10,0,2022-07-26 12:02:24,来自四川,104578041776,故人禹
7124476620605768451,欢迎阿姨回来,1,4,0,2022-07-26 08:50:06,来自江苏,12342178634,完美荷叶v
7124513321319351081,我把淘宝跟天猫都卸载了,8,16,0,2022-07-26 11:11:21,来自陕西,52240206665,洛北以北1122
7124584248396382987,挣钱时在国外，变鸡肋了来国内。国人就是善良。,2,11,0,2022-07-26 15:47:20,来自浙江,308296155143924,浩如烟海
7124469191717110564,阿里这一步很对，两手准备[赞][赞][赞],1,88,0,2022-07-26 08:20:32,来自河南,66220270935,飘浮的人生5
7124518927052915496,去掉一个零可能差不多,2,9,0,2022-07-26 11:33:12,来自河北,52389627697,涓水东
7124469705431106344,阿里不是香港，美国都已经上市了吗？,3,33,0,2022-07-26 08:22:07,来自上海,3210222217996606,8090音乐CD
7124496941702071077,2019年已经上市过了，现在又来，我看不懂，请指教一下？,3,18,0,2022-07-26 10:07:18,来自贵州,4713806244,一嘻明月
7124498874546291459,因为中概股有美股全面退市风险，这算是提前布局了,0,35,0,2022-07-26 10:14:45,来自四川,85898767726,千珊4
7124481363528991524,阿狸不是在美国，香港上市了吗？,2,8,0,2022-07-26 09:07:58,来自福建,19401886676,冷镜看福州
7124501003999118111,能把人笑死,0,12,0,2022-07-26 10:23:05,来自河北,98166179622,123347836407861
7124506876481700611,提前做好美帝资本脱钩的准备是有必要的，防患于未然,2,6,0,2022-07-26 10:47:08,来自北京,105079278877,游戏bUg
7124479367887422243,什么意思？高手给解释一下。,2,10,0,2022-07-26 08:59:45,来自辽宁,61788609630,渔樵YQ
7124469117683680013,这是什么信号？,2,26,0,2022-07-26 08:20:41,来自贵州,4292938343383789,亚平宁一抹蓝
7124471807406932772,阿里去纽约上市，为啥不在中国？,1,12,0,2022-07-26 08:31:03,来自河北,2699998526454728,醉清风
7124532693291451136,去掉刷单呢 [捂脸],2,9,0,2022-07-26 12:26:29,来自四川,118352995682755,无敌干饭人
7124470715780580130,阿里巴巴集团发布，将新增香港为双重主要上市地。其后，阿里在美国挂牌的存托股和在香港上市的普通股将可以继续互相转换。,1,22,0,2022-07-26 08:26:06,来自北京,4038537310,钢先生32100249
7124539561153282853,互联网公司带来了一定的好处，也带来了很多负面的东西，对有些领域形成了垄断，不利于实体企业发展，国家要防范市场经济活动被互联网公司绑架。,1,8,0,2022-07-26 12:53:23,来自四川,1275030973721805,老蒋杂谈说
7124498430806115107,钱都平台赚了,0,12,0,2022-07-26 10:13:04,来自安徽,106065749990,简单轮船T7
7124533541828264712,四年没有用过天猫和淘宝了。[打脸],1,3,0,2022-07-26 12:30:09,来自广东,55950668621,恬淡素朴
7124582109695542056,有没有像我一样，经常有人看好了叫我帮买东西，然后把钱给我，然后付我一点辛苦费[微笑],1,1,0,2022-07-26 15:38:13,来自广西,888821116329879,林梅的美好向往
7124483269525127947,这次奔着2000亿去了,2,29,1,2022-07-26 09:15:28,来自北京,24590631549,叶知秋尘
7124483963720614667,哎~，要那么多钱干嘛，搞不懂,2,26,1,2022-07-26 09:18:30,来自广东,2076326234694408,想暗算窗户都没有
7124470056079852328,阿里为啥不在大陆上市？,3,26,1,2022-07-26 08:23:49,来自山西,474604128444087,乖巧雪碧np
7124484533261107980,这是什么信号？,1,4,0,2022-07-26 09:20:46,来自湖北,6050207778,美食家哈德利8m8
7124509985647739663,"就是要分散开，
分散风险，
发展的机会也会更多。",0,7,0,2022-07-26 10:58:16,来自山东,18486871046,西北风管够
7124508762580960040,阿里吧吧在国家的支持下，企业已经做大做强，现在应该和国家同心协力，为国为民了。,1,1,0,2022-07-26 10:53:49,来自天津,111559146634,刘宗章1
7124470796605031208,包含蚂蚁金服吗？？,2,16,1,2022-07-26 08:26:38,来自北京,3034278405619230,jerry1119
7124469564875784960,花呗 借呗 都相继无缘无故冻结了 哈哈,5,18,1,2022-07-26 08:21:32,来自江苏,54819553041,再也回不去的昨天108
7124540313653986060,这个可以！同时要考虑规避在美国的风险,0,3,0,2022-07-26 12:56:57,来自北京,61509905767,花儿朵朵1699
7124469259681956643,蚂蚁什么时候再上市？[捂脸],7,49,3,2022-07-26 08:20:33,来自广东,51234664503,东方式
7124607762968888068,已阅读并转发,0,1,0,2022-07-26 17:18:24,来自河南,63656108414,3187112510
7124492335895184159,为什麼不到俄羅斯上市？,5,26,4,2022-07-26 09:49:28,来自福建,1240673163160043,悠闲帆船0Q
7124553643290034956,恭喜阿里完成收编,0,4,0,2022-07-26 13:48:30,来自浙江,9699054502,郭人菡
7124591568937485067,恭喜阿里完成收编,0,0,0,2022-07-26 16:15:38,来自湖北,435006135607132,qinqin0041
7124570267166655232,支持阿里巴巴，赞赞赞！,0,0,0,2022-07-26 14:52:30,来自湖北,1648867294580903,优酷080808
7124512912953606912,谁能解释下是什么意思吗？,1,0,0,2022-07-26 11:09:53,来自广西,3885999197,MrC勿忘心安
7124505456524919593,一批中概股在美上市，增进了全球资本对中国企业和中国市场的了解。,0,12,0,2022-07-26 10:40:43,来自浙江,888867927893055,漫步的多多
7124469342435410727,说明了什么？,1,12,1,2022-07-26 08:21:39,来自陕西,3988658445890493,用户你说是什么
7124527723317674782,阿里申请香港纽约双重主要上市，预计年底前完成。,0,2,0,2022-07-26 12:07:37,来自黑龙江,104584802720,安雅宁
7124545908662584068,经营不易，期盼顺利，力国争光！,0,0,0,2022-07-26 13:18:49,来自四川,1377052311697971,博学青山6
7124496736764429096,有多少人把青春献给了阿里巴巴，如果没有阿里，我们在做什么,0,1,0,2022-07-26 10:06:33,来自湖北,84651561987,正哥聊电商
7124553566593319684,香港是中国的 香港可以,0,0,0,2022-07-26 13:48:40,来自吉林,132410146043140,仁爱旭日cr
7124469265189258021,企业已经做大做强，应该考虑国家战略，与国家一同一心，为国为民！,3,21,2,2022-07-26 08:21:10,来自江苏,100765100916,阿凡提的小酒壶
7124505131671962383,在香港收割了一次又来收割第二次？[发怒],0,3,0,2022-07-26 10:39:28,来自江苏,53291020130,平平淡淡一生111111
7124482591361172259,阿里这一步是无比正确的选择，多手准备！[赞],0,12,0,2022-07-26 09:12:17,来自安徽,3189046112428573,用户暖暖的你
7124520606359667459,为阿里企业申请将香港新增为主耍上市地点赞，。[赞][赞][赞],0,0,0,2022-07-26 11:40:19,来自黑龙江,954832852099208,可靠原野8s
7124497790788944680,阿里香港上市跟我如何产生关系呢？请教内行[捂脸],0,6,0,2022-07-26 10:10:39,来自河北,3197003480177371,健康活着优雅老去
7124470357268153103,阿里，蚂蚁哪个是中国企业,5,15,1,2022-07-26 08:24:44,来自江西,3678788127,韬瓴99
7124501792067060480,马云退休了，还会参与吗？@贾美美vlog,0,2,0,2022-07-26 10:26:10,来自浙江,52712993522,贾美美vlog
7124505304804590340,因为中概股有美股全面退市风险，这算是提前布局了,0,3,0,2022-07-26 10:40:51,来自吉林,1750010226814397,wang
7124613768373994281,正常，现在连菜都可以在上面搞定了,0,0,0,2022-07-26 17:41:19,来自黑龙江,949629581276415,丶城里的月光
7124511983697052452,阿里巴巴集团申请香港纽约双重主要上市，年底前可能完成,0,0,0,2022-07-26 11:06:33,来自四川,56706401032,Q在哪里
7124540952810947343,大公司就是不一样 ，提前布局！👍,0,1,0,2022-07-26 12:58:24,来自内蒙古,110980064176,慧心常运GS
7124473588786889505,阿里这是做了两手准备，继续割美国的同时也不怕美国突然发难，高啊[赞],0,15,2,2022-07-26 08:38:24,来自浙江,3614832959435630,聪颖小鱼td
7124619060658111266,一直用淘宝，京东，拼多多也用但少，,0,0,0,2022-07-26 18:01:36,来自湖北,98767372752,柚子呼叫柠檬
7124481333623800590,在香港收割了一次又来收割第二次？[发怒],0,38,0,2022-07-26 09:08:00,来自江西,3148975702,无敌牛猛牛
7124500268385567528,"15年淘宝客户彻底心寒！
在天猫平台2021年购买以下社保代缴服务。天猫商家以各种理由告知需要延期交付，2022年3月淘宝店小二介入未能解决，至2022年7月初商家失联，店小二以联系不到商家，且在我投诉期间已将押金返还给商家等理由让我自行联系商家。这种行为包容和纵容了商家诈骗行为。
我不是黑粉，我是由粉转黑的。15年淘宝死忠粉彻底寒心了！",0,2,1,2022-07-26 10:20:21,来自浙江,71692852030,东方骏马2014
7124586921405694753,提前布局，中概股有美股全面退市风险,0,0,0,2022-07-26 15:57:50,来自河北,1169472854698973,喵婷婷1026
7124512687798911777,阿里香港上市跟我如何产生关系呢？请教内行[捂脸],0,1,0,2022-07-26 11:09:43,来自吉林,3192630190549992,335502025616四季常青
7124508206537818880,因为中概股有美股全面退市风险，这算是提前布局了,0,0,0,2022-07-26 10:51:37,来自安徽,92512117792,王中王581
7124500030555439885,支持阿里巴巴，赞赞赞,0,4,0,2022-07-26 10:19:20,来自黑龙江,4230518104666510,舞动人生ABC
7124568747373347595,为啥去美丽国上市。。,0,0,0,2022-07-26 14:47:24,来自广东,64202615152,旺仔小馒D
7124590937267110669,一切只是为了降低风险[赞],0,4,0,2022-07-26 16:13:05,来自西藏,56854739939,熊猫babei
7124496953253135139,这是阿里的战略性布局，进可攻，退可守，做两手准备，确实厉害👍🏻,0,1,0,2022-07-26 10:07:19,来自广东,84753036376,我爱我家267271049
7124523366749029120,大公司就是不一样 ，提前布局！,0,2,0,2022-07-26 11:50:21,来自广东,1882809757338398,海阔任鱼跃88
7124565898392240911,马云最聪明！,0,0,0,2022-07-26 14:35:31,来自北京,79160835234,智慧水滴c2
7124504103224902435,996的公司，开出的价格都是996，哈哈，有意思啊,0,2,0,2022-07-26 10:35:20,来自湖北,84651561987,正哥聊电商
7124489029470470942,企业想做大做强，必须做两手准备。👍👍,0,2,0,2022-07-26 09:37:28,来自山东,3967494396065374,智者奶酪8Q
7124510313844228905,阿里巴巴为中国互联网的发展做出了巨大贡献。因为中概股有美股全面退市风险，这算是提前布局了,0,1,0,2022-07-26 10:59:46,来自黑龙江,3214602554311885,杜家刘欣
7124499869154231080,老百姓个人的数据安全不？,0,3,0,2022-07-26 10:18:36,来自甘肃,106638456553,君子之交淡如水66
7124469623168500518,好久都没有阿里的新闻了，那个案子怎么样了？,0,14,1,2022-07-26 08:22:56,来自四川,3997453644730915,蓉城阿朱
7124503315538903823,不懂[憨笑],0,6,0,2022-07-26 10:32:05,来自内蒙古,704116458007911,农村大叔做平凡的事
7124477254319162127,企业想做大做强，必领做两手准备。,0,6,0,2022-07-26 08:51:36,来自江苏,4248155252068240,聪明我很幸福
7124482271465833257,这又是为以后做准备了,0,3,0,2022-07-26 09:11:04,来自陕西,4199726636340339,胖胖1126
7124558387127534377,希望中国发展越来越好[赞][赞],0,1,0,2022-07-26 14:06:19,来自浙江,108649830535,高峰蛋蛋妈
7124499652451533602,有不有哪一天，淘宝会从阿里里面分出来，不再属于阿里,0,1,0,2022-07-26 10:17:49,来自湖北,84651561987,正哥聊电商
7124489087784141568,为了上市也是拼了,0,2,0,2022-07-26 09:37:23,来自广东,1099142210797198,深漂特穆尔
7124520352797377314,阿里从这个角度上市可行！,0,1,0,2022-07-26 11:38:38,来自上海,6543571167,砚儿歌儿
7124513518166590242,买菜买些日用小东西就在拼多多，已经很少用淘宝了，处理家里闲置物品就用咸鱼，现在也不用购置大件物品了,0,0,0,2022-07-26 11:12:12,来自陕西,51233042945,rain136592752
7124514259887375140,这是什么信号？有大神给解读一下吗？,0,0,0,2022-07-26 11:15:32,来自辽宁,2832815067,莲净
7124516275434341135,有钱了多做点好事善事,0,1,0,2022-07-26 11:22:39,来自浙江,105098093315,直爽豆浆Pd
7124488605942596387,这么缺钱吗？难到是做慈善？,0,20,0,2022-07-26 09:35:32,来自江苏,70158507811,我是一根老油条
7124523745137656611,阿里就是强大的！,0,1,0,2022-07-26 11:51:44,来自浙江,107780141816,知情达理麻酱vr
7124518671086977832,阿里去纽约掛牌上市，为什么？,0,0,0,2022-07-26 11:32:11,来自广西,65616208333,李姐62584
7124481050940130056,阿里一直很强大👍👍👍,0,8,0,2022-07-26 09:06:47,来自四川,3700244394,书香致遠
7124481930116350724,马云天天想着怎么在股市上圈钱。,0,6,0,2022-07-26 09:10:25,来自广东,81352978519,挑刺猫咪
7124485846816490274,美国钱不好割了,0,21,0,2022-07-26 09:24:54,来自河北,5999550917,KeKouKele
7124484879962129184,希望让更广泛多元的投资者，能共享阿里的成长和未来。[玫瑰][玫瑰][玫瑰],0,3,1,2022-07-26 09:21:59,来自辽宁,1794829437904509,lgx7169
7124475529772090127,这才是最明智的办法，做两手准备，中国企业就是稳[灵光一闪],0,11,2,2022-07-26 08:44:54,来自浙江,53149082726,老冯观天下
7124531653904581407,中概被套的死死的，居然要转战了？,0,0,0,2022-07-26 12:22:34,来自广东,20983493832,狂风中自由行走的女孖
7124525830676103968,希望大家能共享阿里的成长和未来。[给力][鼓掌][赞],0,0,0,2022-07-26 12:00:42,来自广东,360237941657619,沁媛丫头
7124542931818218251,曾经因合伙人制错失了一次机会，这次终于把握住了。,0,0,0,2022-07-26 13:07:16,来自江苏,3219611514,看不大出
7124511585993409291,感觉上市就是在吸纳资金的同时还把风险转嫁给股民,0,0,0,2022-07-26 11:05:39,来自福建,3065074514920852,江河湖海浪滔滔123
7124501557583971108,大家科普一下，阿里已经不属于中国企业了，，已经是外国控股,0,1,0,2022-07-26 10:25:11,来自江苏,86357573332,周天说家装
7124468655400059656,阿里这一步是无比正确的选择，多手准备！[赞],0,69,4,2022-07-26 08:18:41,来自浙江,52789295643,萌大叔谈时尚
7124539699813434148,从2018年到现在，四年多没用过淘宝天猫了。[打脸],0,1,0,2022-07-26 12:54:05,来自广东,55950668621,恬淡素朴
7124491507901793032,还上市得害多少人呀,0,9,0,2022-07-26 09:46:14,来自福建,289906926560942,悦好食品
7124473804151522088,前几年没有上市吗？,0,5,0,2022-07-26 08:38:07,来自河北,110500253147,保定市东海
7124471729325556518,内地上不了，只能去外面了,0,12,0,2022-07-26 08:30:58,,4312467536,爸爸爱贝贝
7124479528931558180,难道阿里缺钱吗？还想第2次上市要圈多少钱？,0,8,0,2022-07-26 09:00:47,来自江西,518571889796445,勇者海洋eG
7124542073936134945,欢迎阿里回家不要在外面漂泊了。[赞][赞][赞],0,0,0,2022-07-26 13:03:31,来自江苏,50233556077,爱旅行的书画小鬏
7124508277882438437,阿里巴巴，阿里巴巴阿里巴巴[赞][赞][赞],0,0,0,2022-07-26 10:52:06,来自河北,92334677605,A琴弦月色781
7124470716120367876,希望中企都能回归！民企，国企都欢迎！,0,9,0,2022-07-26 08:27:07,来自北京,54980777584,一起咯d
7124510841319211806,"分散风险，
发展的机会也会更多[赞][赞]",0,0,0,2022-07-26 11:01:58,来自四川,2397385717200728,飄雪纷飞
7124506405993874188,马云知道吗？,0,1,0,2022-07-26 10:45:07,来自上海,2713164114,随性自由的小羊AP
7124602244548821797,阿里巴巴去香港上市，二级市场申购价格一定不高，最后又让外资大赚，他自己小赚，造就一批亿万富翁，就是苦了大A股民。,0,0,0,2022-07-26 16:56:54,来自重庆,110332010942,张迅518
7124480612844913423,阿里巴巴同时在纽约香港两地上市，这是它用两条腿圈钱的战术,0,2,0,2022-07-26 09:04:35,来自山东,92499826479,直达星晨大海
7124512576918635303,祝愿公司生意兴隆，多做有利于民生的事情！,0,1,1,2022-07-26 11:09:30,来自山东,3060656649284791,周五老公
7124496009274671907,一定要防止阿里这头资本巨兽资本外流。,0,3,0,2022-07-26 10:03:40,来自江苏,59644776950,独一无二的昭昭
7124493525160510223,大格局支持阿里[赞][赞][赞],0,6,0,2022-07-26 09:54:02,来自浙江,2563655276431031,一敬过往一杯酒一
7124480694340092684,两地双重主要上市[捂脸][捂脸][捂脸]又涨知识了,0,6,0,2022-07-26 09:05:44,来自天津,62893215397,紫竹苑
7124564380444017423,其实阿里是可以继续做强需求和助力实业的 为经济复苏有更大贡献，可惜啊[捂脸],0,0,0,2022-07-26 14:29:26,来自广东,16462736419,齐芳远
7124503140250649384,支持！！！,0,2,0,2022-07-26 10:31:26,来自浙江,3210171739806702,多才多艺雪梨O2
7124472453107139340,套娃经济，杠杆原理！,0,6,0,2022-07-26 08:33:32,来自浙江,7919678606,蹄踏归来
7124498748797043491,感觉现在上市就是坑害国人[黑线],0,3,0,2022-07-26 10:14:19,来自湖北,5396235583,百思不得见
7124478689492435745,企业想做大做强，必领做两手准备。[赞][赞][赞][赞][赞],0,6,0,2022-07-26 08:58:02,来自内蒙古,102538222320,随缘9239493527456
7124513846085534500,一边是资本狂吸血，一边是老百姓消费信心不足，学习恒大好榜样！,0,0,0,2022-07-26 11:13:52,来自湖北,72098183425,客居襄阳
7124479135547802368,蚂蚁发行了都被退。这样也行,0,5,0,2022-07-26 08:58:45,来自广东,109630943124,tams123
7124472713749791524,好好干实业吧，不要把精力都放在资本运作上,0,9,0,2022-07-26 08:34:19,,50448166067,歘歘5
7124487429679383331,因为中概股有美股全面退市风险，这算是提前布局了,0,8,0,2022-07-26 09:30:56,来自北京,4373066537,大耳朵39460736
7124477887512265511,左手换右手，两边倒。,0,5,0,2022-07-26 08:54:54,来自湖北,71260144983,吾在现场
7124472994541470497,马总还在西班牙玩游艇了吧,0,6,0,2022-07-26 08:35:33,来自河北,1874003537173280,运筹帷幄小猫08
7124512985439077156,又要圈钱了,0,3,0,2022-07-26 11:10:17,来自四川,5924552119,AnSen71619960
7124471566213645096,阿里还是聪明,0,8,0,2022-07-26 08:29:24,来自四川,5771635767,WQ64086418
7124489980177154831,阿里巴巴港交所代码09988， 难道重复上市,0,3,0,2022-07-26 09:40:23,来自广东,2163466056238056,快乐松鼠sy
7124511014624166690,现在某宝买东西售后具刺毛 坏了没人管 发错型号也不换对的你直接就让退款退货,0,1,0,2022-07-26 11:02:26,来自河南,1041966058185383,游戏玩家sai
7124476339050021671,为什么要在纽约上市？,0,5,0,2022-07-26 08:48:31,来自安徽,84229077306,偷闲享受一下
7124495758090535717,蚂蚁驳回不能上市，把马哥气得都不想露脸了,0,3,0,2022-07-26 10:02:41,来自广东,6529358542,kuku94332211
7124497859311469352,马云都对钱不感兴趣了，你们还在帮公司挣钱干什么？,0,6,0,2022-07-26 10:10:55,来自重庆,870403357025278,差一点我就成了厨师
7124529365488468751,"阿里，美国，香港两地上市？
这是个什么意思呢？",0,1,0,2022-07-26 12:13:30,来自云南,75322104855,彝家老先生
7124472969799926563,阿里不是香港，美国都已经上市了吗？,0,9,0,2022-07-26 08:34:59,来自山东,3795134810432135,xuexindong
7124553153458537251,阿里巴巴做大不是好事,0,0,0,2022-07-26 13:46:01,来自宁夏,4265710200299356,梦的具现化
7124518573234176781,海外上市，钱比较方便跑,0,7,0,2022-07-26 11:32:18,来自黑龙江,6782471701,一盎司二锅头
7124496679860011810,只有走向世界才能得到发展，,0,2,0,2022-07-26 10:06:16,来自安徽,1582921607550680,自在埃迪4g8
7124482128301687564,阿里巴巴这是再一次吸收股民的资金吗！,0,5,0,2022-07-26 09:11:11,来自广西,101639147282,红屁屁多多
