7127904616478049031,祈祷我们大义乌这次疫情别再扩散早日清零！,47,815,58,2022-08-04 14:31:59,来自浙江,98289706944,娜娜
7127919692446614283,义乌怎么了？疫情严重了？,62,299,39,2022-08-04 15:30:41,来自江苏,1063934154517708,悠闲与众不同
7127925479419773736,国强民盛的队伍拥向义乌支援抗击疫情，很快就会杀住疫情扩散，浙江人民团结一心抗击疫情有力，时速之快，很快就会把疫情漫沿阻止，为浙江所有参战的医院以及参战人员加油！点赞！,17,531,45,2022-08-04 15:52:12,来自浙江,1996361395870887,灿烂叶子GF
7127923590300926761,义乌加油！淅江加油！大白们纷纷前去支援，这么热的天，大白们辛苦了，为大白点赞👍！好样的！,10,430,39,2022-08-04 15:44:52,来自浙江,83173250769,活泼百香果Ny
7127926151179682571,怎么义乌又严重了？我们甘肃还没结束，,26,184,23,2022-08-04 15:55:40,来自甘肃,58781125007,快乐永远383
7127915004720120584,义乌又怎么了？,50,329,25,2022-08-04 15:12:09,来自津巴布韦,9748119879,906104194
7127909980421915399,义乌加油！一定要控制住疫情！大白辛苦了！,5,202,20,2022-08-04 14:52:21,来自浙江,949573173916349,风姿卓越河流w2
7127903624533607202,感谢各位医护工作者的支援，辛苦了，感恩，感谢🙏,2,232,26,2022-08-04 14:27:34,来自浙江,5564483099,Cecilia60046440
7127908028019475241,这么高的气温，疫情怎么还能存在,46,182,17,2022-08-04 14:44:25,来自浙江,593351289871596,乐天派山雀caY
7127898125666255648,感谢大家的支援[祈祷]，愿早日解封。,4,113,18,2022-08-04 14:06:43,来自浙江,1522174884850891,Big face
7127931509554037541,浙江驰援义乌？义乌不是浙江的？,21,100,15,2022-08-04 16:16:00,来自上海,96749756856,白水5385
7127924954037093135,我是湖北大悟县四姑镇，7月二十号回家，坐黄陂区《快3》到黄陂，再坐到河口，河口镇到了走到河口客运站，做核酸，我也去做，可是工作人员说，没有证明不做，外地人不做，如果我有病，扩不可设想，我是四姑的，本县，要证明，就回家。,34,80,30,2022-08-04 15:50:15,来自湖北,51661708735,正直葡萄sy
7127917101763494667,义乌，封城了吗？,31,96,18,2022-08-04 15:20:48,来自陕西,59210547867,喜欢热爱生活的人1
7127923098867188512,大众一心共同抗疫，义乌加油！白衣天使辛苦了！,1,15,4,2022-08-04 15:43:41,来自江苏,64873297232,用户卢政
7127922290741871371,蝴蝶效应 整个金华地区 全部都在全民核酸检测了[机智][捂脸],3,36,9,2022-08-04 15:40:22,来自浙江,98703479146,牧野流星lhh
7127907248797844258,众志成城 突破疫情关卡，非常感谢驰援义乌的医疗工作者,2,40,11,2022-08-04 14:41:33,来自浙江,91578532299,存于当世必盛感国恩
7127921030559646472,社区做核酸的人员要多少？非要专业医护人员派去。有点大惊小怪!,4,87,8,2022-08-04 15:35:39,来自浙江,672541634993399,大气海洋wP
7127925454036222759,近20几日防疫口号和戴口罩的人明显少了很多，核酸检测由原来的24小时一次改为72小时一次，出入超市也不用扫“金华防疫吗”了，这显然是防疫意识淡薄的松懈心里。,2,19,8,2022-08-04 15:53:05,来自浙江,6089301284,东阳电奴
7127915959746265871,支援是好事，但不要搞的太夸张了，医院里的病人更需要有医生在，特别是杭州几个大医院。,11,211,13,2022-08-04 15:15:18,来自浙江,50480671446,能者多劳16
7127919524589896480,义乌警方应立即溯源，查清病毒的来源，对有违法犯罪行为的，必须从快从重给予打击。,12,78,13,2022-08-04 15:29:44,来自江苏,93088558089,儒雅木子
7127931221145060130,千万要控制在义乌！不是扩散！,1,10,1,2022-08-04 16:14:25,来自湖北,57197041352,啃老本2
7127903724211274528,浙江这几天40度的高温，大白们辛苦了，加油义乌！！！,2,70,9,2022-08-04 14:28:49,来自浙江,6658202067,Dream102720876
7127922881405223691,还以为驰援东海,3,32,3,2022-08-04 15:43:02,来自江苏,6243390795,全乡我最帅
7127931401202778919,义乌怎么又出现疫情了？,2,12,5,2022-08-04 16:16:04,来自安徽,1253065255291043,勇往直前的雪梨Ix
7127924900127523624,之前报道义乌包机去巴基斯坦接在义乌经商的巴基斯坦人回来，是不是跟这有关系,5,30,7,2022-08-04 15:49:53,来自江西,778093137495896,用户网事随风
7127904128608715535,义乌疫情有多严重？,3,12,5,2022-08-04 14:29:21,来自浙江,5540869795,亘亘风光摄影
7127910311898120990,我们萧山医院怎么没医生派出去？,1,4,5,2022-08-04 14:54:20,来自浙江,13370305808,8888牛牛
7127923788075057958,义乌有疫情，还真麻烦，这个小城连通全国各地，是中国最大的小商品市场，人流量、非常之高，只有默默祈祷，听候佳音。,0,38,4,2022-08-04 15:46:24,来自江苏,95876687104,小赵赵正芳
7127927125369422622,这就是我国的抗击疫情战争，发现疫情病毒速战速决，为浙江省医护人员和政府部门点赞,0,23,7,2022-08-04 15:59:05,来自山西,92814673584,自力奔放
7127930878382342915,义乌加油！浙江加油！,0,15,10,2022-08-04 16:13:59,来自浙江,105607374070,65咖啡768
7127912886676767501,赶来赶去辛苦了。外来人员一定要核酸检测,0,9,3,2022-08-04 15:03:59,来自浙江,54563077633,火炎焱146155893
7127928189158212384,义乌，加油！早日消除疫情。,0,6,6,2022-08-04 16:03:14,来自浙江,12802091397534,亲切海风lv
7127905235796361984,浙江速度 平安浙江 加油[祈祷],0,11,1,2022-08-04 14:33:45,来自浙江,2906742657655783,最爱小兔叽
7127927232068485903,紧急驰援进行核酸检测？,0,12,4,2022-08-04 15:59:00,来自湖南,2049087267683783,扶阳护正得健康
7127922516727431977,加油，义乌，尽快控制住疫情，划出管控区。,0,8,4,2022-08-04 15:40:46,来自日本,63939312481,野洲
7127924376028070686,义乌加油！白衣天使们辛苦了！,0,11,2,2022-08-04 15:48:06,来自四川,12334322841,上进海浪wX
7127929402867958539,义乌加油！共渡难关！[加油][加油][加油][加油][加油],0,7,1,2022-08-04 16:07:58,来自内蒙古,4473942993,Ok88188
7127917442181595943,给驰援人员点赞了。,0,10,3,2022-08-04 15:22:06,来自安徽,1538921380722220,居无安所
7127913180814295849,一方有难八方支援！义乌加油，金华加油！,0,12,2,2022-08-04 15:04:27,来自浙江,6083591486,没有智慧的大脑
7127928407551132453,天黑就是紧急驰援,0,3,1,2022-08-04 16:03:54,来自河南,2836380014091987,静密
7127922066309514020,同一片天空，同一个浙江，义乌加油💪浙江加油💪,0,8,2,2022-08-04 15:39:30,来自浙江,5136234804,山伢儿
7127919656899199758,这病毒还有完没完，来回折腾受不了。,2,11,2,2022-08-04 15:29:59,来自重庆,3941111249766583,淡定百灵鸟nA
7127921989100307241,听口气疫情蛮严重的，希望义乌能平安度过。,0,6,1,2022-08-04 15:38:36,来自江西,51060644894,寸有所长14650
7127921363607995148,义乌又有啦可恨的疫情,0,1,3,2022-08-04 15:36:53,来自河北,98113741279,恒心6363
7127926013652763427,希望义乌早点疫情结束我的行头基本都是义乌和莆田的,0,6,2,2022-08-04 15:54:27,来自北京,6921100506,独孤求养
7127900451152036647,有重症或者死亡病例吗？,12,58,6,2022-08-04 14:15:55,来自重庆,57188050350,战地1942
7127921851963785988,义乌人流量大，投疫任务重，天热，温度高，义乌人会坚持不懈抗疫，支持义乌的英雄们辛苦了！,0,6,1,2022-08-04 15:39:02,来自安徽,95188547440,好心情9478054189551
7127902088444609314,加油义乌，今天的中国就是这么团结，,0,28,3,2022-08-04 14:21:25,来自福建,2273438925860891,魔法梦想家Pm
7127885104491856653,义乌又怎么啦？,5,22,2,2022-08-04 13:15:57,来自吉林,1420196706525827,正能量自由圆月
7127919404855067431,义乌加油！早日实现清零！[点亮平安灯][点亮平安灯][点亮平安灯][点亮平安灯][点亮平安灯][赞][赞][赞][赞],0,4,2,2022-08-04 15:29:10,来自甘肃,959242528630894,一往无前旭日kA
7127921058102952737,核酸检测人员，培训个几分钟，都能上岗,0,21,1,2022-08-04 15:35:37,来自江苏,51755906869,LZ大白
7127912502411232032,义乌的家乡父老乡亲们加油！加油！加油！,0,5,1,2022-08-04 15:02:38,来自浙江,50034554302,灿烂晚风mg
7127904039005946654,义乌加油，一定要把疫情控止。,0,6,0,2022-08-04 14:29:28,来自上海,95178684372,桂华893
7127918403369304864,什么时候找放毒者赔偿[what][what][what],0,21,0,2022-08-04 15:25:52,来自广东,61896744024,瞿帮井
7127903244319507214,义乌这么严重了吗,1,7,1,2022-08-04 14:26:21,来自湖北,5488050440,感同身受就是个笑话
7127906768906142467,"义乌，雄起。
义乌，加油。
我相信义乌",0,7,3,2022-08-04 14:40:14,来自浙江,61526816226,善良可乐mi
7127930961848812320,你有义乌，保自己，也为大家，防止疫情扩散。是共同的义务。,0,5,0,2022-08-04 16:14:33,来自湖北,2049920973418227,虾球传9745
7127917784877024004,等着义乌抗疫早日清零[祈祷][祈祷][祈祷],0,6,0,2022-08-04 15:23:23,来自浙江,63698912258,仆191153528
7127922705420731173,义乌！加油！,0,0,0,2022-08-04 15:42:03,来自河南,109009190991,无忧的原野fF
7127890352899900200,请问，经过义乌并且停靠的火车，比如Z47到达目的地武汉后会是什么防疫政策呢？,6,11,2,2022-08-04 13:35:56,来自浙江,3311048938,极简主义江小鱼
7127923820530631458,一切都会过去的，加油义乌！,0,5,0,2022-08-04 15:45:48,来自辽宁,1503740621502430,多彩辰星Ch
7127925054809457411,刚想月中下旬带娃玩玩横店，义乌，凉了,0,0,0,2022-08-04 15:51:17,来自浙江,734102743422764,一叶知秋201339
7127912439215260427,这么高温天气，一线防疫人员太辛苦了[赞][赞][赞],0,6,0,2022-08-04 15:02:22,来自江苏,79776401491,星星之火
7127923602154357519,怎么儿院的支持，主要是小娃娃吗,0,3,1,2022-08-04 15:45:05,来自重庆,111139538628,wu娟娟
7127931723920638753,这么多人支援，三天清零,0,8,0,2022-08-04 16:17:19,来自山东,53046047474,今个儿努力153929534
7127923778885059360,不能每天全国都出现这种局面影响太大医院起什么作用？,0,6,1,2022-08-04 15:46:04,来自四川,55553805106,上进露珠Qo
7127919580072116995,怎么热的天，还在做疫情检测了！！！,0,3,2,2022-08-04 15:29:45,来自江苏,99437228571,乐天派精灵xz
7127931627732812544,又疫情了吗,0,3,1,2022-08-04 16:16:04,来自福建,66238601172,冯晓軍
7127922195061654283,我真……我真被你们拉走了我的注意力啊~,0,5,0,2022-08-04 15:40:10,来自上海,3651945668,saicici
7127924073384067877,难道义乌不是.浙江的？,0,1,2,2022-08-04 15:47:05,来自上海,55130390718,情孑缘
7127926090290529039,愿义乌早日恢复正常。,0,3,0,2022-08-04 15:54:30,来自浙江,98386229360,姜如凡
7127923330233352964,还让人活吗,0,9,0,2022-08-04 15:44:32,来自浙江,55096382125,大家跟我一起看电影
7127905418407658251,天气这么热，一定要照顾好自己，大家辛苦了！,0,7,2,2022-08-04 14:35:18,来自浙江,1138700039749732,清新光束z2
7127910045299409698,向大白致敬！,0,4,1,2022-08-04 14:52:22,来自浙江,4515570170,假如日光会唱歌
7127931960067965733,感谢大白，辛苦啦！！[赞][赞][赞][玫瑰][玫瑰][玫瑰],0,5,1,2022-08-04 16:17:30,来自广东,3704304228,有情饮水饱v清心如水
7127924208365421327,辛苦了，白衣战土,0,4,2,2022-08-04 15:47:24,来自浙江,1332205795165075,幸福人生好好过
7127929925847597835,必胜[加油][加油],0,4,0,2022-08-04 16:10:22,来自北京,553805811034126,无忧的轮船E4
7127925885277569827,这么热的天，真的辛苦了！,0,4,1,2022-08-04 15:53:48,来自浙江,553743510942744,华亿科技3773
7127927648181355299,感动了谁,1,7,1,2022-08-04 16:00:40,来自河南,6303765496,像烟灰一样
7127925042067424040,加油,0,3,1,2022-08-04 15:50:35,来自湖北,5987505029,姚文74439730
7127930390538634025,义务加油,0,3,0,2022-08-04 16:11:18,来自浙江,1811639233684350,一颗小草
7127920287689147143,浙江加油，江浙沪一家人,0,3,0,2022-08-04 15:32:33,来自上海,83893380118,上进河流Ep
7127926112566838020,辛苦了[祈祷][祈祷][祈祷][祈祷][赞][赞][赞][赞][玫瑰][玫瑰][玫瑰],0,1,0,2022-08-04 15:55:31,来自陕西,6657679110,王102683941
7127997741472449319,义乌加油！这个让我又爱又恨的地方！带着希望去，摸爬滚打三年，和疫情陪伴了三年，7月份刚刚结束生意。虽然负债累累，但是，这个城市很有包容性，希望，尽快回到三年前！,5,7,0,2022-08-04 20:32:57,来自甘肃,1855608297887764,你我他的情感驿站
7127947631682781967,总感觉有人投毒,6,62,0,2022-08-04 17:18:14,来自广东,110188172003,红牛牛888
7127943086843953954,前一分钟还在跟我聊着天，下一个分钟电话打进来，边接听边往回跑，飞一样的速度出差了，一点准备都没有！,2,33,4,2022-08-04 17:00:40,来自浙江,3550871717,JoJo阿娇
7127935249652630280,淘宝大本营沦陷？,3,2,0,2022-08-04 16:30:41,,50301259267,足球大玩家
7127959715799532300,义乌有变，全球震撼！淘宝、拼多多、跨境电商都要受影响！,2,3,0,2022-08-04 18:05:49,来自陕西,98658503455,老秦人强哥
7127935783830487815,浙江反应十分迅速，相信很快遏制病毒。,0,60,2,2022-08-04 16:32:34,来自湖北,2454556789718536,风间若花
7127981578642883358,感谢医务人员支援义乌，辛苦你们了，愿疫情早日结束！,0,9,0,2022-08-04 19:30:32,来自湖北,1349844050390227,灵敏蜻蜓3
7128012083253920543,有很多重症需要抢救吗？需要6000医务支援？,1,4,0,2022-08-04 21:28:27,来自广东,3786261128,小齐齐加油
7127938423977558797,70个病例，却需要6000个医护人员👩‍⚕️。,4,10,4,2022-08-04 16:42:56,来自天津,107944440315,缤纷高山dj
7127941788362654479,义鸟这轮疫情一定能速战速决，希望疫情早日结束。,2,16,0,2022-08-04 16:55:33,来自江苏,110926259061,友爱铅笔8l
7128156580730012448,坚决执行疫情防控要求，做好自我防护！,0,1,0,2022-08-05 06:50:27,来自江苏,6143419698,迁徙的小候鸟
7128013298712216357,标题写明确点，派出6000多名医务工作者，这样一看就很清楚明白，,1,2,0,2022-08-04 21:33:06,来自广东,8143886618,8143886618
7127933949967844134,望招待好天使们要像苏州一样,1,15,0,2022-08-04 16:26:01,来自广西,844839785887727,顺其自然302672788117
7127969393492951842,义乌加油💪希望疫情早点过去,0,3,0,2022-08-04 18:42:36,来自浙江,96838948033,rose8686
7128028750474314528,浙江加油，义乌加油，为所有支援义乌的医护人员致敬,0,1,0,2022-08-04 22:33:52,来自湖北,2322605350599427,彭平
7127976285880107813,"一方有难，八方支援。
义乌阵容疫情一定能速战速决。",0,2,0,2022-08-04 19:10:01,来自浙江,3245353243254205,苹易敬人L
7127966879930532615,义乌怎么了？疫情严重了？一定要严加防控，一方有难八方支援。义乌加油！白衣天使们辛苦了！,0,2,0,2022-08-04 18:33:21,来自河北,95037958633,高冷远山ye
7128150570728325903,义乌加油！浙江加油！有了白衣天使们到来，大家团结一心，疫情很快就能控制,0,0,0,2022-08-05 06:26:14,来自上海,3888343749764509,正义凛然香瓜Zh
7128039818616914728,太牛了，6000多人驰援义乌[赞][赞][赞][赞],0,1,0,2022-08-04 23:16:05,来自浙江,58835157585,咚咚15663966
7127949310683759392,疫情总是不停。#义乌#,0,6,0,2022-08-04 17:25:48,来自江西,4030882151,玉珍2S3X
7127984558850753315,义乌加油！淅江加油！大白们纷纷前去支援，这么热的天，大白们辛苦了，为大白点赞👍！好样的！,0,1,0,2022-08-04 19:41:21,来自安徽,3189046112428573,暖暖的鱼儿
7128150497718715177,高温天，多建简易采样点，放置空调，防止工作人员中暑。尽量安排早晚采集做核酸。望早日控制疫情。,0,0,0,2022-08-05 06:26:14,来自江苏,1028744156283492,乐观的松鼠mD
7127954510588412706,"晚上集结,第二天早上就工作,当天晚上义乌市全部测完,医护人员就可以回来隔离休息了。",0,1,0,2022-08-04 17:44:54,来自广东,50032538039,宝妈55555
7127997147915584263,祈祷我们大义乌这次疫情别再扩散早日清零！[赞][赞][赞][赞][赞][玫瑰][玫瑰][玫瑰],0,1,0,2022-08-04 20:30:22,来自四川,2040291945092360,不惧未来勇于挑战
7128029355766694667,一波未平一波又起，今年疫情确实令医务人员疲于奔命与时间赛跑，辛苦啦！愿疫情早日得到控制，恢复往日的人间烟火，国泰民安[祈祷][祈祷][祈祷],0,0,0,2022-08-04 22:36:19,来自广西,110109978423,自在的浪花朵朵开
7127968688795730700,是不是可以考虑一下 开放了。这样根本不可能全国实现清0 现在病毒的危害性也不高 。基本都是打了疫苗。都三年了 一直这样下去何时才是头 隔段时间来一次 隔断时间来一次 这样真的有效果嘛。,1,2,0,2022-08-04 18:40:41,来自四川,50848043193,空格kobe
7128012297083339552,防控防疫，义乌加油！浙江加油！,0,1,0,2022-08-04 21:29:24,来自江西,2648041660890903,熊娃和乖宝
7127978412450775847,我们上海都是外来劳务工担任核酸采集任务，不动用医务工作者,0,3,0,2022-08-04 19:18:26,来自上海,3649972151518168,风姿卓越菠萝u2
7128026784670483240,义乌加油，浙江加油，支援的大白们注意安全[祈祷][祈祷][祈祷],0,1,0,2022-08-04 22:25:15,来自黑龙江,1042782548672223,淡定溪流9y7
7127966723248554793,果然有了核酸产业就是不一样了[灵光一闪],0,9,0,2022-08-04 18:32:24,来自上海,6050948505,匆匆77428478
7127973047793156901,中国廷住浙江廷住疫情马上会过去的 。中国加油 浙江加油 义乌加油,0,2,0,2022-08-04 18:57:12,来自河南,59376696190,幸运女神庇护
7128151210112500516,不用担心，这场疫情很快就会扑灭，浙江速度在！,0,0,0,2022-08-05 06:29:40,来自浙江,94790228052,小城雨巷337
7127975519299781412,千万别说疫情要快点过去，想疫情过去是不可能的，如果疫情过去了那些厂家不就倒闭了吗,0,6,0,2022-08-04 19:06:58,来自江苏,2475715248783656,梦想成真南京
7127935521908884262,义乌坚持，坚持，坚持，为你加油打气[点亮平安灯][加油],0,7,1,2022-08-04 16:32:06,来自广东,3703587913078039,郭大米
7128050764215845643,加油！希望疫情早日清零,0,0,0,2022-08-05 00:00:55,来自湖南,111142860003,馨儿5Y6N
7128154706996233001,这种高温天气真的辛苦了医护人员，辛苦了！,0,0,0,2022-08-05 06:42:35,来自湖南,2792357909505523,毛豆MD平江
7127966744244880164,北京这里也有极大的漏洞！无论是打疫苗，还是做核酸检测，都要完整的证明！只要手续不全，就都不给做！！！这是极大的错误！这对抗疫极其不利！应该是：只要有需要，就应该无条件地全面检测！绝对不能漏掉一个人！这才是真正抗疫的基本原则！！！,1,8,2,2022-08-04 18:32:48,来自北京,852861354800638,红楼解密第一家
7127956284179252002,义乌加油！淅江加油！大白们纷纷前去支援，这么热的天，大白们辛苦了，为大白点赞👍！好样的！,0,1,0,2022-08-04 17:51:49,来自辽宁,3382527973406462,才思敏捷孔雀cQ
7128034359310861090,一方有难，八方支援。中国就是这么牛，义乌加油！,0,0,0,2022-08-04 22:54:45,来自新疆,76704044834,那时天蓝118
7128150818452505359,我们这里也开始全员核酸了，疫情何时休？,0,0,0,2022-08-05 06:27:11,来自重庆,1719244761348675,书香满屋jxf
7128001999106425632,关键这两天，这个疫情来的有些奇怪，我们应该警惕！！,0,1,0,2022-08-04 20:49:25,来自江苏,3799548861096576,小姨wat
7128154726029624102,义乌疫情严重了吗？,0,0,0,2022-08-05 06:43:26,来自江苏,4558774066,绣球蓝色
7128021261917242123,路过义乌会黄码吗？从江西去萧山路过,0,0,0,2022-08-04 22:04:24,来自江西,496600686800743,美丽人生久久久
7128156711479247652,前两天还看见有人说大家都网购吧，义乌这两年都没有疫情，所以说……,0,0,0,2022-08-05 06:50:49,来自山东,83381032403,陆青辰
7128033335351952165,义乌加油！希望疫情早日结束！[祈祷][祈祷][祈祷],0,0,1,2022-08-04 22:51:37,来自江苏,1359442947868365,潘春蕾
7127940524061393697,"给浙江驰援义乌的白衣天使点赞[赞][赞][赞]
义乌加油！早日清零[加油][加油][加油]",0,5,0,2022-08-04 16:51:28,来自福建,4305286283668823,大气天空IH
7127904089568494367,义乌隔壁500米的东阳，瑟瑟发抖，天天核酸,6,24,3,2022-08-04 14:29:46,,105079202416,搜能量
7128002388442546957,武汉人民支援浙江人民,0,1,0,2022-08-04 20:50:38,来自湖北,87361311821,心蓝1998
7127986267958362912,精准、科学、常态防控！,0,3,0,2022-08-04 19:48:46,来自浙江,110512568804,山水尧夫
7127959768077026059,这就是中国人的力量！同胞齐心，尽快让病毒远离，义乌加油！[加油][加油][加油],0,3,0,2022-08-04 18:05:46,来自上海,103480725579,多彩星球tw
7128018427851047693,舟山这边又开始了七天核酸检测！,0,1,0,2022-08-04 21:52:57,来自浙江,92398357606,璐仪9800
7128158368560661284,到公共场合没亮码吗？到一个地方也得核酸啊？,0,0,0,2022-08-05 06:56:33,来自山东,58515469165,爱美的苏菲亚
7128028192526369568,义乌加油！小商品发货会出现问题吗？,0,0,0,2022-08-04 22:31:11,来自广东,2827539676406412,无双画板qW
7128041606430589731,众志成城，共同抗疫！浙江加油！义乌加油！[加油][加油][加油],0,0,0,2022-08-04 23:23:02,来自河南,70360988905,赶羊的胖子
7127942765040337695,整年整月整日，天天疫情，吓得人心慌慌！,0,4,0,2022-08-04 16:59:48,来自广西,64806890743,天翼用户6878631135581
7127943545238881063,义乌人民坚强一点，有共产党的领导不怕任何灾难。,0,0,0,2022-08-04 17:02:56,来自湖北,2414145885966727,不凡精灵I6
7128152617981149993,这两年，疫情愈演愈烈，无风不起浪，有因必有果，无症状感染者是怎么来的？要重拳出击查明真相，不能总是牵着鼻子被动挨打！核酸检测试剂赚得盆满钵满,0,0,0,2022-08-05 06:34:20,来自河南,4197398231,云海茫茫天地宽
7128146368736215849,义乌有疫情？,0,0,0,2022-08-05 06:10:06,来自江西,474577813112334,缤纷星球xI
7128019233917158147,含浙江省新华医院，派出的50人核酸采样队。,0,0,0,2022-08-04 21:56:42,来自浙江,15311711506,月儿明18
7128152717016728354,有些朋友问义乌怎么了，这还用问？出现疫情倍，要不能连夜驰援？重要词是，连夜驰援。,0,0,0,2022-08-05 06:34:51,来自山东,5852715419,北方的狼68444843
7127966342036472589,义务怎么了嘛？,1,2,0,2022-08-04 18:31:14,来自广东,86237644431,哭泣的农民1978
7127967543230710543,浙江速度，团结力量！抗击疫情，义乌必胜！,0,1,0,2022-08-04 18:35:30,来自浙江,111560696037,诗意芒果PN
7127956884560167715,义乌又咋了。天天上班没有看新闻,0,1,0,2022-08-04 17:54:01,来自湖北,59815494507,田1121066
7128125245713744654,白衣天使，辛苦啦！为你们点赞,0,0,0,2022-08-05 04:52:48,来自浙江,85775205040,兰花草1495
7127940068643865374,中医，中药，赶紧跟上！先让大白们喝上中药，护好自己，然后再给商户分发中药起到防护作用，边防边检边治，三管齐下，很快就会过去的！,0,2,0,2022-08-04 16:49:20,来自陕西,945177102395575,宅妈趣事
7128049014079243022,加油浙江，作为一个上海人，感恩浙江的医护，真心希望也坚信浙江很快就能把这一波疫情消灭。,0,0,0,2022-08-04 23:53:08,来自上海,6034836222,徐石头
7127996956554986253,标题是否有问题？派出6000多名，连夜驰援义乌，不知6000多名都是什么人来的？,0,2,0,2022-08-04 20:29:53,来自福建,85802002703,元气海洋N9
7127966664335475491,义乌加油！浙江加油,0,1,0,2022-08-04 18:32:11,来自福建,3478446653577307,丽锋
7127961147323663136,6000多名医务人员驰援，义乌疫情严重？,0,4,0,2022-08-04 18:11:23,来自浙江,6372618850,黑土农夫
7127983665992811299,义乌不也是浙江的麽,0,0,0,2022-08-04 19:38:03,来自辽宁,96936274526,倔强的虫子734
7128036034650325799,"浙江省派出6000多名，连夜驰援义乌
6000多名什么
[我想静静][我想静静][我想静静]",0,1,0,2022-08-04 23:02:13,来自江苏,3017530965756631,智者百灵鸟5U9
7127984976502997768,浙江加油！！！义乌这个地方本来人流量就大，要想短时间内做到清零还是有一点点困难的。而且浙江这个地方，近期又是特别炎热的天气，希望那些医护工作者不要中暑,0,1,0,2022-08-04 19:43:30,来自安徽,4264253794,仰望无边无际的你
7128155934131946255,希望义乌新冠疫情到此为零。给所有医务工作者加油和点赞[赞][赞][赞][赞][赞][赞]！。,0,0,0,2022-08-05 06:47:01,来自浙江,3645601695411038,新昌有我
7127938787446932239,为医护者点个赞，义乌加油！,0,1,0,2022-08-04 16:43:45,来自上海,3803931091676856,活泼光束MU
7127935646013899520,看到这样的新闻，只有沉默！,0,9,1,2022-08-04 16:31:38,来自甘肃,659360521922488,洒脱白云nU
7128152768300221195,高温疫情，低温了怎么办？,0,0,0,2022-08-05 06:35:41,来自湖北,5591819438,闪电云雾
