7125350802881004329,一个套接另外一个套，再烂尾呢？,32,475,1,2022-07-28 17:21:03,来自河南,2031514342659342,瞎操心呗
7126056367395554083,谁给开发商的胆子？,4,72,0,2022-07-30 14:59:12,来自内蒙古,501021113844088,自由荷叶Z7
7126074140977218345,感谢cctv，,1,12,0,2022-07-30 16:08:15,来自浙江,2840793116578189,杭州小然先生
7125961422106329896,一房多吃，大家应该感谢谁？,1,72,1,2022-07-30 08:50:54,来自广东,4592665578,米圻0
7126064370840634125,盖房人越来越坏，把买房人越迫越聪明。,1,17,1,2022-07-30 15:30:47,来自北京,78667268713,眯乎儿
7126832553457255206,这个很西安,1,4,0,2022-08-01 17:11:49,来自陕西,105093391339,大话三秦三地
7125950783338021640,创新牛，批准在北交所上市,0,27,0,2022-07-30 08:10:18,来自陕西,58960588322,清泉石15
7127835499020649247,政府不愿掏钱，开发商也不愿意掏钱，只能百姓来掏钱了,0,0,0,2022-08-04 10:03:40,来自江苏,487782308658446,天之道补补不足而损有
7125698550629663518,像这样的情况，为什么不制裁开发商？,2,20,0,2022-07-29 15:51:25,来自河南,106323562999,热情孔雀Je
7125354757203723045,就怕每平米交1800元，后来是没盖好，还得交钱,4,17,0,2022-07-28 17:36:58,来自陕西,101666907519,千里共婵娟娟子
7127571373349765896,郑州豫森城更狠，一平米补6000-8000块钱，,2,2,0,2022-08-03 16:58:21,来自河南,79572873880,勇敢的豆花d
7125420386237694732,处在小县城的我还是很庆幸啊，我这里没有一个烂尾楼,3,21,0,2022-07-28 21:51:49,来自山东,67024041418,青葱岁月留下了什么
7126027741912515364,这次交了还有下次，哈哈,2,26,0,2022-07-30 13:08:21,来自河南,2392342792,灵巧糯米rc
7126062823956480782,当然不能再给钱了！无耻是没有底线的，给了就会成无底洞,1,22,0,2022-07-30 15:24:55,来自陕西,80619697941,1275251998
7125404478698029865,房子不是用来炒的，玉米花才是炒滴,4,27,0,2022-07-28 20:49:23,来自北京,11026101271,137小黑
7125306802652234530,我买房子就是自己住的，我宁愿买二手房也不去买期房，风险太高了,1,11,0,2022-07-28 14:30:25,来自陕西,83526400769,轻香
7125381282409923362,"这是觉得之前“房价”卖低了？房价低了，工钱就低，利润也低？就拖着不开工？烂尾？
就只奔着建设后面卖的高价房🏠？利润高，工钱高？",2,24,0,2022-07-28 19:19:18,来自广东,92334980051,coolrabbit2018
7125854443358716672,买二手房不香，还是租房不香，人生有几个十年让你等,2,0,0,2022-07-30 01:59:55,来自陕西,58675676980,何韵歌baby
7125385300423328525,开发商这样违反合同，在某些国家得给天价赔偿了吧,20,312,0,2022-07-28 19:35:22,来自广东,1276440941,心情21851086
7125933726395712256,关键是开发商肯定已经把烂尾的房子，抵押给几个银行好几次了。要不是把能借的债全借了，实在借不到钱了。房子也不可能来烂尾啊！你这边给房子刚建好了，然后债权人就该来讨债。你拿不到房本呀！,0,2,0,2022-07-30 07:03:39,来自天津,110845057069,1依依的爸爸
7125374685453599524,那还不如业主集资，自己当甲方盖完,16,102,0,2022-07-28 18:54:11,来自湖南,9377813069,掘路
7125357982153802529,就是敲竹杠费,6,303,0,2022-07-28 17:50:00,来自江苏,3826854703,袁小俊9527
7125398755263808287,国家该整治房产乱象,5,46,0,2022-07-28 20:27:19,来自河南,111436855790,聪明饭团rk
7125558262183265056,不交的后果可能就是继续烂尾,4,4,0,2022-07-29 06:47:44,来自宁夏,58759575857,TOP9527
7125407070845240076,谁给他们的底气肆无忌惮毫不顾忌公开透明的这样对待购房者,2,40,0,2022-07-28 21:00:04,来自河南,57566716806,李松树林
7125997663723995942,应该把房建成具备交房条件，愿补差价者交钱收房，不愿者房子买后退还首付！,6,1,0,2022-07-30 11:11:53,来自陕西,104007996519,聪颖沙滩XM
7127554034159944484,烂尾肯定是定了，永远烂尾，就剩余的建工费都不愿意交，你还想咋样？,4,1,0,2022-08-03 15:50:59,来自陕西,6344134845,明天更好些85773031
7125708093342122792,西安真的牛逼,2,46,0,2022-07-29 16:27:52,来自四川,4694940311,无与伦比金金金
7125974934811755294,有这个开头，以后能交房的也要推迟收续建费了！,3,21,0,2022-07-30 09:42:47,来自陕西,2181038532996877,春意盎然
7125438398915330831,续交1800的理由和依据是什么？,1,4,0,2022-07-28 23:01:18,来自陕西,4353717117387316,清爽咖啡d6
7125807357325493026,国际化大都市，就是敢想敢干。,2,23,0,2022-07-29 22:52:46,来自甘肃,5548624063,蜜语1250
7125368093177758500,说的是先交1800，后面还有后交，补交…,1,49,0,2022-07-28 18:28:46,来自陕西,4292123209251172,he肯
7125651468295750407,真是奇闻和奇葩？烂尾10年了，还要交续建费？？？,2,2,0,2022-07-29 12:48:07,来自四川,92330332642,绵阳9号
7125274764733907726,不同意就行了。否则又是一次入坑。,1,15,0,2022-07-28 12:25:39,来自陕西,52633411135,OnePiece138911336
7125677611673666318,购房者没有任何错误，全款买房，因为开发商的原因，导致烂尾，复工却要求购房者增加购房款，填补房开商亏损的窟窿，相当于一房两卖，并且还是卖给同一个人，你说这预售制度坑不坑人？,1,8,0,2022-07-29 14:29:38,来自贵州,52515859039,自由随性的达达
7125703077948031784,老板心黑没法管,0,12,0,2022-07-29 16:08:10,来自江苏,3830329126954781,用户憋得慌
7125359834211599104,我在想，如果续建费投进去又被挪走打了水漂咋整？,19,95,1,2022-07-28 17:56:11,来自河南,910019460606957,giacomme
7126069752937726720,[捂脸]这骚操作是彻底把预售制弄完了,1,4,0,2022-07-30 15:51:02,来自河南,89867516945,怀思情乡
7125363590315721487,没办法制裁开发商，他以破产要挟，你一点办法没有[捂脸],12,64,1,2022-07-28 18:10:48,来自广东,4110436154,马上有钱2016
7125386680177574686,说好的契约精神呢？谁核发的预售许可证，难道不该负责吗？,4,67,1,2022-07-28 19:40:47,来自江苏,105127388815,一个谁啊
7125455823027389222,应该允许把开发商的资产抵押给银行或业主，然后业主自己筹钱续建，不是割韭菜！,1,1,0,2022-07-29 00:11:49,来自美国,50956736453,暴力40
7127572011085972263,这个在外国，有听说过吗？早被罚款了！,0,4,0,2022-08-03 17:01:31,来自北京,6027247636,琳子大了
7125384684200346401,贾老板给了他们启发[狗头],0,17,0,2022-07-28 19:33:14,来自江苏,522981130646435,三维米粒
7125382047236883241,这就是诈骗惯用的手法，想取多少钱，先冲多少钱！,1,9,0,2022-07-28 19:22:16,来自江苏,2431755831490055,打爆数字用户狗头
7125682741056144158,先收续建费，然后再次续建费，补充续建费，封顶费，内装费，电梯补充费。。。。。最后每平补充了10万，恒大奇迹般的没有外债了。[捂脸][捂脸][捂脸],1,1,0,2022-07-29 14:49:49,来自北京,54821728759,追猎者
7126067701768258344,明天房价一万八，封顶后停工两年，再收续建费一万五[捂脸],1,2,0,2022-07-30 15:43:12,来自陕西,50121195524,大圣-妖猴
7125397491688309507,[大笑][大笑][大笑][大笑][大笑]谁还敢买期房？以后开发商嫌赚少了就给你烂尾,8,13,1,2022-07-28 20:23:04,来自刚果（金）,3179408663515220,平民百姓农民工
7127846396623110953,关业主什么事？谁停工的谁负责,0,0,0,2022-08-04 10:44:53,来自湖北,101387757356,洒脱香瓜A3K
7125409323962139423,庶民：我去，我的下线呢？？,3,4,0,2022-07-28 21:08:29,来自山东,5542824277,东家59211456
7125666481521885955,交了又可能继续烂尾，老百姓上一次当还不够，还得继续上当,0,1,0,2022-07-29 13:46:54,来自陕西,5580115082,水色de薄荷
7125373138405819175,就问你服不服,2,54,1,2022-07-28 18:48:58,来自四川,111295593860,梦幻星辰zp
7125368547970810663,这种事如果发生在台湾之类民权得到极大扩张的地方，那地产商绝对要倾家荡产!,2,56,2,2022-07-28 18:31:03,来自福建,84539924420,闲心定水6
7125586018229273379,这是什么罗辑？不是明抢吗,2,4,0,2022-07-29 08:34:11,来自广东,4009582238,王者归来31539187
7125383199773492002,合同违约，不但没损失，还能捞到更多的钱，以后还有谁傻傻的按合约办事？,0,32,0,2022-07-28 19:26:55,来自广东,6423453898,LC88844596
7125381910293267232,为什么不要求开发商财务公开呢，说不赚钱就是不赚钱了，公开财务明细，看看到底是不是赚钱，如果真不赚钱可以收，但是如果赚钱了还继续收直接判刑,5,22,1,2022-07-28 19:22:36,来自陕西,360237485527439,不见深空
7125692905750758185,再缴1800元，也比现价便宜。值得。,1,1,1,2022-07-29 15:28:58,来自广东,54020814006,黄杰285925471
7125633109819048707,再交20W继续烂，过几年再交，循环利用,1,2,0,2022-07-29 11:37:34,来自陕西,58797764748,随便看一看一看
7125280932021715715,开先河，以后都这样,2,12,1,2022-07-28 12:49:32,来自陕西,104441910108,青涩旭日Xq
7127840363326587648,还有这种事，那么买的衣服还要重新向厂家缴税吗？,0,0,0,2022-08-04 10:21:57,来自湖北,54722918389,慢慢走慢慢来
7125400877179306785,这么搞烂尾更多。,0,6,0,2022-07-28 20:36:07,来自广西,479021748984520,转强十卡位
7125326633782887203,烂尾楼，开发商完成多少就退还剩余多少钱。加上剩余延期赔偿。业主可以自己盖。,1,0,0,2022-07-28 15:47:19,来自陕西,6727783060,失去了才知道珍惜可贵
7125597061508137736,一句话[呲牙]从今往后只买现房！而且必须没有公摊面积，必须一手交钱一手交房产证，否则即使房子没有烂尾让你顺利住进去也有可能房产证办不下来。。。。开发商把房产证抵押在银行，到时候还不起银行钱你的房子还是会被拍卖懂嘛。,0,1,0,2022-07-29 09:17:14,来自福建,1864405553783895,天魔孔宣
7125385721505940255,弱士群体难上加难,0,36,1,2022-07-28 19:36:47,来自山东,1689271370792071,滴水🌹
7125269953632486184,赤裸裸的抢劫。,1,25,0,2022-07-28 12:06:57,来自陕西,4475176299,爱钓鱼明子
7125753319422853895,西安是个好地方,3,7,0,2022-07-29 19:23:29,来自陕西,3856728180669406,H2O与光文明
7125689029097685760,说不合理，其实也挺合理的。换一个方向，所有业主全部退现金离场，其余债主垫钱到完工直接卖，你看看这些业主干不干。所有债主中，其他的人基本上都是还本金，业主交钱了之后得到了是经过十年增值之后的房产。加入买的时候3000，现在怎么样都有个8000，中间出1800还其他债权人的本金。,8,1,2,2022-07-29 15:13:43,来自湖北,3737961591216926,lzzccc
7126059346512970499,这个世界太疯狂,1,3,0,2022-07-30 15:11:29,来自广东,94084017688,尘外一笑醉颜酡
7126054711169450752,世界级传奇！,1,3,0,2022-07-30 14:52:41,来自山东,171128290553524,奋发有为山丘G6
7125720338008310539,不是恒大山西的楼盘吗？,1,5,0,2022-07-29 17:15:46,来自北京,6213845379,北京82491092
7125700420726735631,各地都在给优惠卖房，为什么不先把烂尾房子给解决一下,0,4,0,2022-07-29 15:57:55,来自广东,2378971132207451,仓酱0829
7125367423932089092,有限责任制就是爽。[作揖][作揖]无限责任制的苦逼买房人。,0,26,0,2022-07-28 18:26:26,来自福建,6826019503,善解人意狮子猫
7125382117689361152,报警行不行,6,4,2,2022-07-28 19:22:49,来自湖南,106725309288,A墙纸墙布壁画彩装膜
7125710394093683497,骗局，估计交了钱又跑了,0,7,0,2022-07-29 16:36:35,来自四川,50358436389,ciceIy
7126063886885028623,它在重塑我的三观,1,2,0,2022-07-30 15:28:28,来自河北,87550901890264,上进的山丘qT
7125717742477017890,烂尾楼是个好题材，又能再一次收钱，我怕房企模仿。,0,7,0,2022-07-29 17:05:13,来自陕西,103550789752,在城市消失
7127592073431155493,那么多年业户损失谁赔偿啊？把业户当成提款机了吧？,0,2,0,2022-08-03 18:18:33,来自辽宁,101652956877,用户曾闲黎
7125394655591744297,房子还没建好，你连房子都没看到，为什么要交钱给人家？这和炒期货做虚拟币有什么区别吗？是不是当初人家给你说交10000=30000，交30000=100000是不是这样子的？不要去想着占便宜，天底下没有那么好的事情！,0,4,0,2022-07-28 20:11:14,来自贵州,107853337402,回怀念军营生活
7125391095583867648,一费套一费，费费相连,1,37,1,2022-07-28 19:57:20,来自四川,102209293125,水波1968
7125575944181891871,活久见[捂脸],0,3,0,2022-07-29 07:55:22,来自浙江,2308615466655831,cwp628
7125999280573137695,而且知识初定费用，就这不靠谱的操作，我觉得悬,1,0,0,2022-07-30 11:17:57,来自陕西,4240718876,PJ19890501
7125999155008602911,交了也可能继续烂尾,1,0,0,2022-07-30 11:17:34,来自陕西,4240718876,PJ19890501
7126153473925923591,就算这个钱交了，谁又能保证一定能交房呢？,0,0,0,2022-07-30 21:16:03,来自广东,93125842559,陌然浅笑70684
7125298303394300685,"没烂尾的也得交这是重点[吐血]。
所以这玩意弄不成800多户不同意",1,4,0,2022-07-28 13:57:44,来自陕西,50096013392,秦云子风
7125281181775692585,最后肯定都交了，,1,1,0,2022-07-28 12:50:31,来自陕西,681321162878052,海水火焰123
7125678855935148832,交了钱再烂尾怎么办?,1,3,0,2022-07-29 14:35:14,来自云南,4498825163848455,浅醉kkaya
7125674493833888546,保护开发商……,0,7,0,2022-07-29 14:17:22,来自陕西,50257180894,和中堂2
7125391687681262372,还要再出钱？,1,2,0,2022-07-28 20:00:00,来自湖北,5771777850,fnks
7125614663790379789,购房者的命运捏在了开发商的手里。购房者不交钱。 烂尾楼就一直拖下去。,0,0,0,2022-07-29 10:24:42,来自上海,6014730342,安静看世事
7126102985671410447,为啥要交 这么多年延迟交房 房租 耽误的事 谁赔？,1,6,0,2022-07-30 18:00:15,来自陕西,1121157070469576,幽默mmc
7125810727306920716,陕西第九怪[捂脸][赞][赞][赞],1,16,1,2022-07-29 23:07:22,来自山西,57323082928,A张立杰
7126145450855858947,资本运作而已，不盖房就能把钱赚了为什么要费心费力的盖房子[灵光一闪],1,1,0,2022-07-30 20:45:12,来自河北,74586920505,Dooliny
7126134570751525666,续建之后又烂尾，又续建，继续续建。,2,0,0,2022-07-30 20:02:27,来自广东,110939334698,上进的菠萝FY
7126069090896364328,是新政么？,1,2,0,2022-07-30 15:48:33,来自青海,3668424107,飘逸21106309
7126109213075800832,怪事年年有，没有今年多！我就不信治不了无良开发商了。,1,0,0,2022-07-30 18:24:13,来自北京,14308777900,hhd218
7126149820095611679,全民只买准现房，严禁预售一切问题迎可而解。,1,0,0,2022-07-30 21:01:53,来自重庆,56107906841,敏锐百香果g4
7126141929666298654,以后预售制会名存实亡,2,0,0,2022-07-30 20:31:19,来自广东,1279434508473516,实现梦想88888
7125587033988760351,开发商阴险地说：小样，我有连环套还弄不死你！跟我玩嫩点！,1,2,0,2022-07-29 08:38:31,来自宁夏,51207333975,寳湖書院
7126429815715939075,恒大怎么没想到这个回生术？,1,1,0,2022-07-31 15:08:53,来自山西,12995636985,悦行云
7126098911261459234,你是不是开发商,1,0,0,2022-07-30 17:44:21,来自广东,91698627966,夏天里的雪5538
7125726686968431400,这是走之前再收一波？[狗头],0,0,0,2022-07-29 17:39:52,来自天津,99068487017,福瑞德母
7125700752567452419,好多人说，这辈子不再和开发商打交到。,0,3,0,2022-07-29 15:59:57,来自北京,60619798003,东边有河
7125303627589272350,大西安房产创新引领全国,1,9,0,2022-07-28 14:18:36,来自陕西,109204541385,秦兵看天下
7125676492361073449,就剩最后工程了每户几十万，开发商还想发比横财，自己组织弄弄路绿化什么的估计3分之一就够了,0,4,0,2022-07-29 14:25:14,来自陕西,81043195974,团宇家
7125386397292233483,这钱由谁掌控？,0,1,0,2022-07-28 19:39:45,来自陕西,1943534974548235,简单豁达小红花
7125374449931125545,这钱就不能交，不要相信他们会信守承诺,0,14,0,2022-07-28 18:53:04,来自辽宁,4624917221,暗影秋水
7126132393911911200,为什么没人告开发商违约,1,0,0,2022-07-30 19:55:01,来自河南,110448766158,叶孑红了4
7126072620818137870,万恶的资本家,0,0,0,2022-07-30 16:02:31,来自四川,3959272387,托娅灵
7125760882944656166,不能开这个头,0,1,0,2022-07-29 19:53:15,来自广东,2119494312165592,咸鱼加点盐
7125948681865429791,再不上当，回老家建房,1,4,0,2022-07-30 08:01:37,来自陕西,105888768948,鹏翼翻云起北溟
7125586445976863523,一生为房子打工都不够，都得一生一世,1,5,0,2022-07-29 08:35:48,,1662594088,华南虎23188607
7127809545619161897,烂尾这些年应该补偿业主的损失，为什么还要再交钱呢？,0,5,0,2022-08-04 08:22:19,来自山东,7011834812,公益为人人
7126093027516777256,说明什么？千万别买房。,1,0,0,2022-07-30 17:21:24,来自北京,103137385672,彰德三爷
7125708506593952520,呵呵。好事情。看还买期房吗,1,8,0,2022-07-29 16:29:36,来自湖北,106893059024,清水2568
7125922174413603624,这个和医院做手术做一半突然让加钱不加钱就不给缝合伤口的套路是一样的[捂脸],1,0,0,2022-07-30 06:18:55,来自山东,2164289016969216,公平公正主义奠基人
7126102089398928142,还有一个叫不交，为什么要交，拿合同，按合同执行。,1,0,0,2022-07-30 17:57:04,来自陕西,93104525644,雪儿寒冰嘻
7126170010758169358,不交，不买。,1,0,0,2022-07-30 22:20:36,来自广东,105163692483,天养736
7126079504372073257,房地产预售制度下的中国房地产开发商[打脸][打脸],1,0,0,2022-07-30 16:29:05,来自北京,54478380885,云鹤143632715
7125568040133428002,强大的中国,1,1,0,2022-07-29 07:24:31,来自广西,110735119960,独一无二的灯火
7127580387983213325,当初建房的钱呢？,0,3,0,2022-08-03 17:33:29,来自广东,3198854911,平凡的老潘
7125680878210417412,再一次呼吁大家不要买期房！,0,4,0,2022-07-29 14:42:58,来自江苏,5766034498,超级睿之父
7127629390682833694,确实痛苦啊,0,0,0,2022-08-03 20:43:29,来自湖北,1490527790045496,Sxy118
7125824233938469662,不断刷新认知和三观,1,7,0,2022-07-29 23:59:53,来自陕西,93176743596,windergao
7126058021075223303,还是买二手的，能看房，马上过户，心里踏实,1,0,0,2022-07-30 15:05:49,来自山西,82245750053,如风2018101
7126103980891669287,没得底线了,1,0,0,2022-07-30 18:04:56,来自湖北,5982703557,风趣雪梨kW
7125725241082708766,建一段时间再停工，再收一次续建费，反反复复，永无止境,1,0,0,2022-07-29 17:34:41,来自陕西,103638021457,Sunlogin
7125799723617174308,从头到尾用你的钱发他的财,0,8,0,2022-07-29 22:23:40,来自陕西,439424145956200,fmz1901720
7125381755888681742,肯定交不了房，先交1800，后再说钱不够，再交2000。先要填满奸商的私人腰包,0,3,0,2022-07-28 19:21:47,来自陕西,96796045292,niu528niu
7125563750555747113,宁可断供，也不给钱,0,2,0,2022-07-29 07:07:54,来自江苏,4883885880,dj观闻天下
7126076571081048840,合同在拳头大的人手里有用就是合同，没用就是废纸。,0,1,0,2022-07-30 16:18:04,来自北京,12676309370,一日春雷
7125288532818002724,以后吃饭都不敢先付款了[泪奔][泪奔][泪奔],1,4,0,2022-07-28 13:20:02,来自陕西,51509085541,大智若愚刘阿斗
7127598643649348391,带了个不好的头,0,11,0,2022-08-03 18:44:46,来自陕西,105093391339,大话三秦三地
7125574350975255331,正大光明的抢劫,0,2,0,2022-07-29 07:48:42,来自浙江,66574487887,空灵道人
7125598501849105156,不是套路就是坑，这世界怎么了？,0,1,0,2022-07-29 09:23:19,来自浙江,3755548140912061,尚革园忆
7125383601071932201,如果这事能成，以后烂尾楼会层出不穷,0,9,0,2022-07-28 19:28:26,来自安徽,2255848917701892,喜庆的芒果d3
7127808776447050509,济南天建天和园秋园烂尾五六年[流泪],0,0,0,2022-08-04 08:20:05,来自山东,93025489924,清风珀
7125383087357952808,二十年目睹之怪现状,0,6,0,2022-07-28 19:26:35,来自湖北,5735690317,横渠门下
7125811204370825998,退钱！不要了！,1,0,0,2022-07-29 23:08:33,来自河北,51754967039,youyou7677
7125675178147365669,已经有人住到里头了,3,0,0,2022-07-29 14:20:35,来自陕西,5473895099,AKA跳跳虎
7126004363071882025,三观要改写了，改成社会三要素,1,2,0,2022-07-30 11:37:20,来自湖北,1209094239953949,视频评论员5G5L
7125421249580253984,给业主赔偿20万还差不多,1,5,0,2022-07-28 21:54:53,来自陕西,1209075736511774,新新城市猎人
7125727127420306208,爱国就话就交，爱国就是道理,0,0,0,2022-07-29 17:42:08,来自广东,6664703395,醒梦人
7125709836972819234,不如去抢。,0,0,0,2022-07-29 16:34:28,来自广东,76704653290,七个一飞斋
7125408404977599267,这哪是割韭菜啊，这是连根刨啊！,0,4,0,2022-07-28 21:04:31,来自浙江,6011390701,吃瓜群众种韭菜
7125625063793328930,怎么闻到了电信诈骗的味儿。。。,1,2,0,2022-07-29 11:05:26,,104415942487,小樟圆
7125722428717777698,开发商:谁买讹谁[捂脸][捂脸],0,1,0,2022-07-29 17:23:17,来自安徽,14892301761,八戒小厨刘卫平
7126109338455999232,永远记住:别买期房！,1,1,0,2022-07-30 18:24:42,来自四川,3773955294640704,酱缸阿凡达
7125681249330627367,买的是二手新房，不用担心烂尾。,0,0,0,2022-07-29 14:44:28,来自江西,95935280366,重复名字太多起的累
7125605969156997927,血淋淋的资本家！,1,2,0,2022-07-29 09:50:51,来自山东,86649189254,锐坤钻机
7126318087112377100,因建筑材料和人工费上涨，融资成本增加，原来交的钱已经用完，房屋交房需要每平米补交2***。,1,1,0,2022-07-31 07:55:53,,96851291397,蔡都镇小虎
7125378707627377421,烂尾楼就是杀猪盘,0,14,1,2022-07-28 19:09:40,来自江苏,1657691797724068,六朝楼主9102
7125999195953251084,雪上加霜，还闲倒霉慢,1,2,0,2022-07-30 11:17:58,来自陕西,4117001475457054,随时联系我
7125974043735819023,绝对不能开先列，赚钱开发商退给业主吗？,0,1,0,2022-07-30 09:39:16,来自广西,51576091487,谭哥1818
7125691023665398536,有冤无路诉[大笑],0,0,0,2022-07-29 15:21:47,来自广西,95588095206,睿智铃儿
7125691627124900645,楼烂尾了，先交的钱归零了，续钱再买一次。一楼两卖[捂脸][捂脸][捂脸],0,2,0,2022-07-29 15:24:13,来自山东,2871547760739523,今古齐观
7126002013443343117,坚决不出钱,1,2,0,2022-07-30 11:28:35,来自陕西,52434633417,常军0211
7125643129784615721,一期续建费1800一平，后面还有二期三期四期,1,3,0,2022-07-29 12:15:26,来自陕西,67343437555,小恶魔嘟嘟
7125717750064579361,已经跳坑里了！还要自己再挖深一点吗？,0,1,0,2022-07-29 17:06:13,来自广东,6224635556,欧阳震牛
7125399103269962531,现在这两年房地产怎么老是出现令人大跌眼镜的事情，到底是哪里出现了问题？好像开发商就没人能治的了他。,0,2,0,2022-07-28 20:28:32,来自北京,14308777900,hhd218
7125373144441013029,谁拳头硬谁有理。,0,7,0,2022-07-28 18:48:12,来自湖北,75762943636,ZDM888_qvm
7125795511990223649,交的越多开发商赚的越美。楼房烂尾了也没见哪位开发商可怜了啊！还不是豪宅豪车潇洒的过的好日子啊！,0,0,0,2022-07-29 22:07:17,来自陕西,5522005642,ren无名小卒
7125707396609032964,跟贾总学的吧？[抠鼻]那得注意了，交了可能还得交。,0,0,0,2022-07-29 16:25:31,来自陕西,25987703379837,知秋一叶障目
7125395348398981900,这个要是弄成了，以后的烂尾楼只会多不会少,0,2,0,2022-07-28 20:14:50,来自河南,764861340188740,旭东来咯
7126444367631483682,有一次交钱就一定会有第N次交钱！一套房敢卖你100遍。,0,0,0,2022-07-31 16:04:43,来自广东,5738261601,云在青天水在瓶瓶
7125389286916391687,没什么惩罚措施，肆无忌惮,0,3,0,2022-07-28 19:50:54,来自山东,4195372019487788,漂动水
7125752167553860393,再次烂尾，继续烂尾，持续烂尾！,0,0,0,2022-07-29 19:18:36,来自陕西,3040999949,崩钢刀韭菜根
7125397738707403523,万恶的资本家,0,4,0,2022-07-28 20:23:51,来自陕西,110936100410,莫言1111
7126121137910317835,不割一波又一波，老板的大奔哪里来,0,0,0,2022-07-30 19:11:35,来自上海,102185571017,齐天大圣10001
7125591028924891938,20万也不算多，交了就能住新房了。,1,0,1,2022-07-29 08:53:26,来自陕西,4535797334,西安8哥
7126356065595294504,这不是明抢么，再烂尾怎么办？[微笑][微笑][微笑],0,2,0,2022-07-31 10:21:37,来自江西,61885644813,萌宝70134
7126372620618007334,还有的要求必须买停车位，不管你有车没车，又坑十几万,0,1,0,2022-07-31 11:26:56,来自山西,92763065557,张凯5394
7127577662709072655,20万交了，过几天又烂尾，业主再交20万，循环往复,0,1,0,2022-08-03 17:22:33,来自湖北,3245395999990077,朝气蓬勃的园林小哥
7125400263221035812,关键是涉及这么大数额资金的烂尾项目真的就没有办法处理吗？合同缴费单据这些固定证据都在，难道就这么一直缺席下去吗？？,0,2,0,2022-07-28 20:33:18,来自浙江,3777561245002877,苦竹庵
7126810008943723275,开发商感觉是无法无天了，持续烂尾，持续收费，割韭菜也不能这么割吧,0,1,0,2022-08-01 15:44:44,来自安徽,1543339447956779,LSFJR
