7122689609506734859,小庄的叔叔和奶奶赶到了派出所，接回了正在埋头写暑假作业的小庄。。。埋头写作业！这个孩子长大能成大事！[赞][赞][赞],4,156,0,2022-07-21 13:15:05,来自山东,98919646865,唐朝李总
7122655380039746308,"九岁小庄感情深，
想起奶奶往外奔；
巧遇警民帮一把，
值得反思庄先生。",59,915,14,2022-07-21 11:02:44,来自湖南,109144337841,冰岛日记1234shrj
7122683082674668288,谁带的多孩子就和谁亲，这个孩子应该是没有妈妈，奶奶在他的心里既是奶奶又是妈妈。为这个好司机点赞[赞]好人一生平安！,7,239,2,2022-07-21 12:48:50,来自山西,4227553401,山西二秀
7122635007596299049,懂得感恩的好孩子，奶奶要抱着小孙子亲不够了！,3,679,3,2022-07-21 09:42:05,来自浙江,72198581788,8088情义无价
7122684884996702991,孩不要全推给爷爷奶奶管，一定要陪孩子度过童年，这是培养感情的最佳时间段，错过了是补不回来的。身边有孩子对父母感情淡薄，与在爷爷奶奶身边长大有直接关系。我对儿子儿媳说过，下班没必要应酬就好好带孩子，不要让爷爷奶奶代替了父母的角色，是为你们好将来会明白。,9,55,2,2022-07-21 12:56:03,来自黑龙江,52086981072,秦风蓝关古道
7122651011319808807,爱心责任心集一身的网约车司机，祝您身体健康，万事如意，心想事成！,4,419,1,2022-07-21 10:45:34,来自北京,71888182451,大呆2356
7122644689790665502,懂得感恩的好孙子，奶奶没白疼你，好感动啊。为好心的网约车司机、警察叔叔点赞[赞][赞][赞]，孩子的叔叔和奶奶一起来接孩子叔叔也是善良之人[赞][赞][赞],4,477,7,2022-07-21 10:19:42,来自江苏,4125797938109502,极速钢琴VF
7122668639588746018,九点多去外面散步，挺热的就去儿子家接孙子出去玩了～我们住在一个小区，这俩孩子昨天晚上回家的。孙女听见奶奶来了跑出屋就抱住我了，小孙子二岁多也喊着奶奶奶奶的跑来抱住我大腿……那一刻感觉挺好的[可爱],3,106,3,2022-07-21 11:52:54,来自山东,4197283416,老玩童一凤
7122653202629034786,奶奶带这个孙子没有白带，为小孩子的孝心点赞！,5,872,6,2022-07-21 10:53:03,来自湖南,110462848685,超甜的橙
7122674674202329870,孩子没有妈妈吗？爸爸关心的不够，孩子感觉没有爱，只有奶奶给他温暖，可怜的孩子,1,2,0,2022-07-21 12:16:41,来自吉林,96960235173,小月印相
7122638111770870541,太感动了！这个九岁孩子的奶奶没白疼！感谢一路碰到的好人。,1,410,6,2022-07-21 09:54:06,来自北京,4439401209,极速熊猫az
7122647249326637854,恰好小朋友的书包里放户口本，不然就沒那么顺利找到他家人，九岁小朋友应该把户口本内容记在脑海里。弄丢了就麻烦了呢。为懂感恩的小朋友点赞，为各位好心人点赞[赞][赞][赞][赞][赞][赞][心][心][心][心][心][心][玫瑰][玫瑰][玫瑰][玫瑰][玫瑰][玫瑰],1,104,1,2022-07-21 10:30:27,来自湖南,3764320230451214,顶级饭团ff
7122642242296103721,"为好司机，好民警，点大大的赞👍🏻善心❤️美德。
[鼓掌][鼓掌][赞][赞][玫瑰][玫瑰]",2,177,2,2022-07-21 10:10:05,来自广东,59098376385,怀揣梦想的空影
7122652431280456483,我却看哭了，我家孩子都不知道爷爷奶奶长什么样子，每次他爸爸和奶奶奶通话，我让孩子喊奶奶他们都不理孩子！想想那么多年心寒。[流泪],52,67,5,2022-07-21 10:50:18,来自广东,62540524980,我爱我夫爱我仔
7122642954795713292,"这孩子，奶奶没白疼，长大也肯定是个重情重义的好男人。[比心]
奶奶见到孙孙，也肯定会幸福得泪雨滂沱。[心]",3,291,4,2022-07-21 10:12:56,来自陕西,99548996028,骊珠珠
7122644113522606885,奶奶的一切辛苦付出都是值得了，这个孙子也是有心的孩子。,1,156,1,2022-07-21 10:17:26,来自黑龙江,103731989920,快乐女主角459
7122692909900006155,看的鼻子酸酸的，宝贝心心念念的想奶奶，家长再忙也要满足宝贝的小心愿哟，我也是当奶奶的人，也心心念念想孙女呢，这种隔辈的无人能理解，希望做父母的多孩子一些关爱！[心],1,22,3,2022-07-21 13:28:12,来自浙江,21042288167,桂云62
7122682911274861348,这是一件令人暖心也令人忧心、揪心的事。暖心的是，幼小的孩子心灵洁纯洁，情感纯真，他记着自己是奶奶带大的，好久没看到奶奶了，所以想去看奶奶，让人很暖心；网约车司机的热心、爱心和警察叔叔的责任心也让人很暖心；让人忧心和揪心的是，孩子的父亲庄先生，他再忙也应该挤出时间带孩子去看他奶奶，同时也是去看自己的母亲，以这样的言传身教，很难培养出优秀的下一代！,1,22,1,2022-07-21 12:48:47,来自福建,51947155240,荣誉至上233
7122641358091289359,孩子没有妈妈吗？爸爸关心的不够，孩子感觉没有爱，只有奶奶给他温暖，可怜的孩子,6,143,2,2022-07-21 10:06:45,来自吉林,110564106777,乡间阿布
7122676107975410466,我现在带俩孙女，到目前为止孙女就和我亲，无论到那里都要奶奶跟着，妈妈哄孩子和她睡一晚，一个也不去，每天带两个孩子好累，吃饭穿衣洗澡都必须是奶奶,1,14,2,2022-07-21 12:22:02,来自湖北,773701664250343,微笑蜻蜓SL
7122697952350716676,"离家近一年了，
儿女有时就来家里看看。
邻居家3岁的孩子一听到我家有人开门，
都要出来看看是不是我回来了！
还拉着他的奶奶非要进我的房间，
看看我是不是真的回来了。
他奶奶通过微信告诉我，
令我感慨万千！
其实，
我在家的时候，
只是把微笑给了那孩子，偶尔送他一些小玩具而已。
我想好了，
回家时一定要好好“谢谢”这重情重义的孩子！
每每想起这些，
归心似箭的激动便油然而生！",0,3,0,2022-07-21 13:47:36,来自海南,3583088388,高也飞
7122682871177462569,"为好人司机点赞！
为人民警察点赞！
为想念奶奶的小帅哥点赞！
自作主张晚上出去是不应该的，遇到危险就麻烦了！",0,8,0,2022-07-21 12:48:13,来自北京,4020256890949295,孺子牛
7122660793623642920,棒棒哒！好孩子，有感情，懂得感恩的好孩子，奶奶没白疼你，好感动啊。懂得感恩的好孙子，奶奶没白疼你，好感动啊。为好孩子，好心的约车司机、好人警察叔点赞，双双好评,0,28,0,2022-07-21 11:22:45,来自新疆,13126096472,才高八斗香瓜SG
7122716351868781323,咋就那么今人敢动呢！心里暖暖的。为小男孩孝顺、网约车司机的热心点赞！警察叔叔也辛苦了！,0,0,0,2022-07-21 14:58:51,来自北京,91824804669,叶子漫步
7122679293695886094,山东德州有个小男孩从小被他的外曾祖母（他母亲的外婆）带大，后来回城上学，他九岁的时候老人去世，男孩要求和他的父母回去参加葬礼，考虑他要上学和路途遥远，没同意他去，葬礼当天他父母在老人住的房子大门后面看见自家孩子，男孩独自一人坐车几百公里回来,6,36,1,2022-07-21 12:34:43,来自山东,109419371549,明月心在天828
7122632102864732941,好有感恩心的小孩[赞],2,180,1,2022-07-21 09:31:57,来自广东,96943248093,郭靖与蓉儿
7122671124580139789,"为好司机，好民警，点大大的赞👍🏻善心❤️美德。
[鼓掌][鼓掌][赞][赞][玫瑰][玫瑰]",0,9,0,2022-07-21 12:03:12,来自山西,448197053129517,山西临汾高爱莲
7122676805579834147,必须给网约车司机点赞！,0,9,0,2022-07-21 12:24:28,来自辽宁,141156413357831,远见卓识山丘Yq
7122677121465926435,向网约车司机胡先生致敬！要不是你做好，当晚找奶奶的小孩不敢想像。再则，小孩的爸爸太粗心，小孩想见奶奶，再忙，也要抽空满足他的愿望。如远，打个的士也花不了多少钱嘛。幸好，小孩遇见了好人胡先生，最后把他送到派出所，实现了小孩的愿望。这个教训，提醒家长，小孩的正当愿望，家长应想办法解决。,0,18,0,2022-07-21 12:25:51,来自四川,9503839557,庚寅143
7122684205591102246,"看看新闻头像看看新闻,看看新闻网官方账号,,null9岁男孩深夜趁爸爸睡着徒步找奶奶：很久没见 想她",1,0,0,2022-07-21 12:54:14,来自福建,2291818847285143,Wanler
7122648427049403136,小孩子九岁了应该会记得奶奶的电话了啊！要找奶奶打个电话叫奶奶来接你就行啦！还好是个幸运的孩子碰到了好人！没有碰到坏人！,0,23,0,2022-07-21 10:34:36,来自福建,3267389946071053,安逸山丘ED
7122678582787769091,谢谢网约车叔叔，谢谢派出所民警为你们的大爱点赞👍,0,5,0,2022-07-21 12:32:16,来自内蒙古,104498582055,秀珍不袖珍926
7122666126051541768,祝福网约车司机，余生平安快乐！,0,15,0,2022-07-21 11:43:38,来自河北,111420935850,一个光明的早晨
7122715858376049416,好感动，孩子有考心.爱心❤，奶奶的辛苦值了，所有帮助孩子的叔叔都是好人,0,0,0,2022-07-21 14:56:56,来自广东,3909506544455739,Liuhuiyi
7122642799023424256,为司机点赞👍👍我孙每次回他家时，晚上吼起叫想我了，更不能视频，那吼的叫我难受死了。,0,32,0,2022-07-21 10:12:20,来自四川,52474268985,友爱苹果toei
7121625831503872808,孩子懂事，有情有义，给孩子点赞了！,0,12,0,2022-07-18 16:26:32,来自上海,2985919090014163,云清121
7122695153474831118,出门还背着作业，好孩子[赞],0,2,0,2022-07-21 13:36:17,来自广东,6024876940,糯米西西糯米糯
7122671412053197608,血浓于水有感情，独自一人出家门，想奶奶啦。可爱的孙子。,0,8,0,2022-07-21 12:03:43,来自重庆,1947924937320056,直率光束KDs
7121651227519845135,幸好被好心司机遇到了，为好心司机点赞[赞][赞][赞],0,6,0,2022-07-18 18:05:14,来自上海,59145281716,幸福菠萝莲花
7122690152098579207,大人天天忙啊忙，总是忽视孩子的想法，有些不幸就是因此发生的。此文中如果没有网约车司机的热心帮助，孩子遇到危险怎么办？,0,3,0,2022-07-21 13:16:50,来自山东,75297006672,睦子13
7122706771331973895,小孩不简单，出门知道带上户口本，谢谢司机叔叔和警察叔叔帮他见到奶奶！[祈祷],0,0,0,2022-07-21 14:21:31,来自河南,105039109438,淡泊默默无闻
7122716910273856297,孩子是谁带跟谁亲，实在是太想奶奶了，不然也不会做出这样的举动，心疼宝贝😊,0,1,0,2022-07-21 15:00:37,来自江苏,3932286090492510,难忘的记忆 💝 💞💞
7122680747458478888,为司机点赞，为孩子的孝心点赞,0,2,0,2022-07-21 12:40:01,来自江苏,50003766542,淼淼qq
7122676827923514119,乖娃娃啊，奶奶来了。,0,3,0,2022-07-21 12:25:09,来自广东,13185522114,仟貮
7122681858269217570,谢谢好心司机没让孩子出意外，9岁孩子👶🏻感恩奶奶。我外孙也特别感恩我。有同感！,0,3,0,2022-07-21 12:44:09,来自黑龙江,109598218658396,进取智慧的千里马
7122686917749015336,给司机点赞，好人必有好报！[赞][赞][祈祷][祈祷][祈祷],0,3,0,2022-07-21 13:03:49,来自宁夏,4190987532648296,顽强海浪px
7122673493233337121,孩子是谁带大的，他就给谁最有感情，家長尽量的多抽时候陪陪孩子，放假期间送他到爷爷奶奶家，这样也放心些，但必顺要随时抽查假期作业，同时告诉孩子注意人生安全。,0,3,0,2022-07-21 12:12:28,来自四川,3302559429442107,芳姐1951
7122655216554115881,一个九岁孩子，人小鬼大带着户口本？和行囊出门找奶奶👵，幸亏碰到好心司机师傅…感动是个懂得知恩图报好贤孙[赞][中国赞][比心],0,12,1,2022-07-21 11:01:07,来自陕西,135934684962238,挺好的吧啦啦啦
7122714814094656256,小孩子想奶奶了，大人应该满足他的心愿，幸好这次遇到的都是热心人，小孩子才没出事。[赞][赞],0,0,0,2022-07-21 14:52:15,来自重庆,3499030997,云淡风轻130010718
7122648856709907231,好孩子，小暖男，奶奶没有白疼你。,0,13,0,2022-07-21 10:36:53,来自江苏,1719278262301351,曾唱山歌
7122665110291645225,好孩子，不忘奶奶带养之恩，想想自己也辛苦9年，还煮饭烧菜几年，没听说过好话，算了，当做义务，只要她以后过得好，放心了。,0,5,0,2022-07-21 11:39:16,来自北京,4165414580,人亦鸣
7122663807863784192,懂得感恩的好孩子，为你点赞[赞][赞][赞],0,8,0,2022-07-21 11:34:10,来自河南,54588808777,常玉玲2
7122645279874335491,孩子暑假了，想奶奶，这个爸爸为什么不将孩子送去奶奶那里呢？尊老爱幼，老人带小孩，很疼爱他，他暑假了，就想起了疼他爱他的奶奶。社会上还是好人多，通过接力孩子如愿以偿，见到了思念已久的奶奶。这个小孩长大以后一定会孝顺奶奶的。,0,25,1,2022-07-21 10:22:19,来自江苏,1578554119159931,聪明帆船hw
7122708764872606467,孩子很懂事，知道奶奶带大，有颗感恩心，自己去找奶奶不对，遇到坏人怎么办，还好遇到了好几位好人,0,2,0,2022-07-21 14:29:52,来自四川,61508414498,潮流达人阿勒泰9M6
7122684708017947400,为这位有爱心的滴滴打车司机点赞，好人一生平安,0,1,0,2022-07-21 12:55:43,来自河北,7006746919,悟净姑姑
7122674628820173580,孩子很懂事，知道奶奶带大，懂得感感恩心，自己去奶奶不对，遇到坏人怎样算，遇到好几位好人,0,2,0,2022-07-21 12:16:52,来自广东,52233852235,心雨204737636
7122653167158510370,好孩子好样的是个重情义的人[呲牙][呲牙][呲牙][比心][比心][比心],0,10,0,2022-07-21 10:53:08,来自江苏,2471355056137965,风姿卓越火车Tk
7122653556515078912,心思细腻的孩子，奶奶得心疼坏了，还好没出什么事,0,7,0,2022-07-21 10:54:27,来自广东,109771234252,猫窝窝
7122682113530774303,幸好是遇到了好心司机，要不然谁也不敢想象一个九岁的孩子半夜独自走在路上会发生了什么...,0,1,0,2022-07-21 12:45:34,来自福建,109203990819,多才花猫9v
7122664720489874191,瞧这个爸爸，工作再忙可以打电话或微信联系老人，让孩子和老人通话也是好的，假如老人连手机都没有，这个做儿子的基本孝心都不注备，让人难受。,0,3,0,2022-07-21 11:37:43,来自湖南,51286637824,生活总是充满着希望
7122686430048551712,点赞小朋友真有良心，长大肯定好样的[赞][赞][赞][赞],0,1,0,2022-07-21 13:02:53,来自北京,95992000807,马老太君658
7122661894020137769,看着都泪目！奶奶没白疼孩子！,0,7,0,2022-07-21 11:26:52,来自北京,61232317586,liping艾特
7122681139106022155,好孩子👶🏻懂感恩奶奶没白带你，感动的我眼泪直流，要是我的孙女有这么乖巧懂事那该多好呀,0,2,0,2022-07-21 12:42:21,来自广东,3619594215,车厘粒
7122682353541153575,为网约车师傅点赞！值得大家学习！,0,1,0,2022-07-21 12:46:50,来自陕西,3425709910927773,用户大乐媳妇小乐妈
7122706140656010024,这孩子很懂事，重感情，长大了是一个好人，点赞…[赞][赞][赞][鼓掌][鼓掌][鼓掌][玫瑰][玫瑰][玫瑰],0,1,0,2022-07-21 14:18:47,来自广西,852829743622333,喜庆的船帆TJ
7122652736193332006,这孩子奶奶没白疼,0,7,0,2022-07-21 10:52:22,来自四川,6158741882,珍惜每一天80949356
7122673190236996367,为善良的好心司机点赞[赞][赞],0,2,0,2022-07-21 12:10:37,来自上海,63701025129,ywanywan
7122674366391075618,"看到视频心里暖，
九岁小庄名已传， 
中华民族好传统，↘
一代一代往下传！
点赞！[流泪][赞][玫瑰]",0,4,0,2022-07-21 12:15:10,来自辽宁,95992757970,青涩旭日cH
7122671751024100109,"奶奶帶大的孫子肯定和奶奶很亲呀！
我的大女儿，在一岁时，因妈妈又怀上了｀！家住桂林的外婆就说把她接去桂林（我俩都上班，帶俩个孩孒很难，也请不起保姆）女儿在外婆家，有两个舅舅一个姨！把她当宝贝哟！到四岁才接回上单位保育院！l
女儿和舅，姨的感情深到什么程度？举个例子！女儿今年己五十一岁了，也早有自己的家了！但我不能在她靣前讲一句她舅和姨的坏话！（她認为是坏话的）我讲一句！她立刻讲十句！反驳我！
我开玩笑问小舅小姨！你们俩怎么把我女儿收买了的？几十年过去了她还不准我讲你俩的坏话！他俩笑答！因为她聪明呀！",0,3,1,2022-07-21 12:05:27,来自广西,3636822445402925,聪慧铅笔Fy
7122674530342290184,儿子心里没有老娘吗？连孙子都想得𣎴得了，儿子依然不肯去看一眼母亲，只打电话让弟弟与母亲接走儿子。,0,1,0,2022-07-21 12:16:25,来自河南,1978742269806541,终南山外一书童
7122689745381507854,隔代亲，会感恩的孙子。棒！为司机与民警点赞！特别是好心人司机。如被坏人抱走，拐买怎么办？这类事社会上有不少例案啊！不要造成家庭悲剧发生，令家人心痛。这值得每个父母深思，教育好自己的孩子。,0,1,0,2022-07-21 13:15:23,来自广东,106476663129,智慧帆船Wc
7122668171152081705,还好，遇到了好司机！感谢好人一生平安[祈祷][祈祷][祈祷],0,3,0,2022-07-21 11:51:03,来自北京,540548436333380,奋发沙滩yh
7122653545383641892,没有发生事故，小孩平安就好。孩子随奶奶长大很有感情，想念是奶奶父母需要满足孩子的愿望，合理安排好时间，带领孩子去看望老人，看望沟通交流增进情感，有利于家庭成员的和谐！,0,4,0,2022-07-21 10:55:16,来自四川,3412503969142152,清爽原野aM
7122687184208954125,这个孩子没白疼，看到这一幕，奶奶的所有付出都是值得的！[赞][赞][赞],0,2,0,2022-07-21 13:05:16,来自河南,59132615038,LYD浅秋
7122683494576489247,首先给网约车司机点赞，再给警察叔叔点赞。再给孩子点赞。因为孩子没有忘记奶奶，没有忘记奶奶白疼他，好孩子，知恩图报，将来你一定会是一个知道感恩的人，祝你好运。,0,1,0,2022-07-21 12:51:02,来自北京,2630476739119310,幸运橘子Uk
7122679612588557091,真是好孩子.想奶奶了都不忘带作业[赞],0,1,0,2022-07-21 12:35:23,来自天津,51586791801,摇钱树5532
7122637465420071721,奶奶沒白疼他,0,46,0,2022-07-21 09:51:32,来自内蒙古,55239644806,小口袋13
7122674942848189192,重情重义的小孩子可爱极了，为你们点赞👍,0,3,0,2022-07-21 12:17:56,来自山西,4305339478193144,博学的辰星4E
7122703599494251275,为好心司机[赞][赞][赞],0,4,0,2022-07-21 14:09:23,来自山西,1706048485076051,元气小猫E
7122713735055278862,"好奶奶,出租车叔叔,警察叔叔,亲叔叔爱暖人间!懂得感恩,有情有义的男子汉。必成大器![心][赞][赞][赞]",0,0,0,2022-07-21 14:48:28,来自广东,96666589256,学品立华德客
7122671246797849381,奶奶的一切辛苦付出都是值得了，这个孙子也是有心的孩子。,0,2,0,2022-07-21 12:03:35,来自山西,448197053129517,山西临汾高爱莲
7122707710990533376,网约司机是好人：愿你万安,0,0,0,2022-07-21 14:24:46,来自四川,104921109788,句算
7122705760328844065,多可爱的孩子，想奶奶了自己去找，我被感动的热泪盈眶,0,1,0,2022-07-21 14:18:09,来自山东,75857790117,登着你前行
7122709982277288741,奶奶见了心都碎了，爸爸应反思一下,0,0,0,2022-07-21 14:33:53,来自陕西,111291918438,勇敢的柑桔mi
7122693757597975309,九岁的小朋友怎么会把户口本放书包里了？这个有点儿奇葩耶,0,1,0,2022-07-21 13:31:00,来自北京,4354098452,在信的人
7122660146673074978,奶奶没白疼，是个有心的好孩子[赞],0,2,0,2022-07-21 11:20:07,来自北京,52862269233,伊人在盼
7122662991547613964,小孩重情义，奶奶也是真心疼爱孙子,0,3,0,2022-07-21 11:31:47,来自广西,2771238526664452,I like summer
7122640521675703052,也祝愿网约车司机的孩子健康成长，没病没灾。,0,25,0,2022-07-21 10:03:30,来自北京,104915903297,奇幻铅笔Ow
7122702463455101709,为热心肠的驾驶员点赞，👍👍👍。,0,1,0,2022-07-21 14:04:47,来自重庆,3853140203150264,快乐宸伊迎瑞
7122677390693794595,这个当爸爸的不合格啊。孩子那么想见奶奶，在忙也得代孩子去看看奶奶的，做父亲的不但对不起孩子，对母亲也不孝敬，万一孩子有个三长两短的。做父亲的会后悔一辈子的，希望多关心孩子们，多孝敬父母！,0,1,0,2022-07-21 12:26:45,来自河南,55357848687,潇洒橙子lc
7122691292043772709,我家儿子四岁，离家出走找不到，我们全家去找了几个小时，后来在人民医院附近的路上找到了他，问他干嘛去了？他回答去找爷爷了，他爷爷住的离我家七公里多，他围绕着我家及他爷爷家的马路走了一个环装路线，而且发现他时他不慌张，依旧溜溜哒哒的走着。,0,1,0,2022-07-21 13:21:39,来自山东,2871561594344748,淮涉之水
7122693497747997455,不管两头老人谁待！孩子跟父亲家人亲的多可能是血缘关系！祖辈就让孩子随父姓可能就因为这个吧？事实以看清！,0,1,0,2022-07-21 13:29:22,来自北京,835222238658702,愉悦的奶茶Oh
7122672936435335970,可爱的孩子，有爱心的网约车司机，人民的好民警，只得我为你们点赞！愿你们一切安好！,0,3,0,2022-07-21 12:09:37,来自河南,93171029713,六十多岁的老头
7122679025084007181,为网约车司机点赞，好人有好报啊。,0,2,0,2022-07-21 12:33:28,来自河北,56727140199,独钓寒江174788137
7122702493150233381,正能量！好孙子！好司机！！好民警！！！为你们点赞！为报导者点赞！在中国，好人永远是绝大多数！,0,2,0,2022-07-21 14:04:52,来自湖北,104821821818,清爽鲸鱼Ca
7122647951855469312,网约车司机真是个好人！[赞],0,13,0,2022-07-21 10:32:36,来自安徽,104343739597,草底鸣虫
7122653200066626334,为网约司机，公安民警点赞！[赞],0,6,0,2022-07-21 10:53:53,来自湖南,111479342677,z16585
7122689650702942983,好孙子对奶奶想念，祖孙情深。,0,1,0,2022-07-21 13:14:51,来自湖南,4405159375,好想换个名
7122690788693607182,要感谢好心的司机和人民警察,0,1,0,2022-07-21 13:19:24,来自山东,8080632772,美好生活207475704
7122652317820371742,孩子的心思，家长不可以疏忽大意，更不要随便敷衍孩子，说出来的话一定要做到，说明天要去看爷爷奶奶，那就必须去，请假也要去，不能因为工作忙就忽视孩子的感受,0,3,0,2022-07-21 10:50:31,来自山西,77420588337,晋D有文有武
7122706340355048195,好孩子，坏爸爸，孩子的事情要记下！啥也不说了，孩子看孩子，没办法！祝福你们全家，祝福奶奶健康长寿！[赞][祈祷][玫瑰][点亮平安灯],0,1,0,2022-07-21 14:20:21,来自山东,800054785093251,朝气蓬勃的老王头
7122693006306034440,懂得感恩的孩子，长大后一定差不了！,0,1,0,2022-07-21 13:28:06,来自陕西,2516151634769740,初一好心情
7122696132035838753,谁带跟谁亲，我孙子9岁了也离不开我，放假去爸爸妈妈那里还要我陪着，我不去他也不去，2个月大就我带的,0,1,0,2022-07-21 13:40:40,来自江苏,1063934154517708,悠闲与众不同
7122640207698281220,很感人，奶奶有老者的爱心，让孙子念念不忘。,1,16,0,2022-07-21 10:02:16,来自福建,71197122474,林244531274
7122687263708300064,小男孩真是太幸运了，在夜深人静的晚上，能遇到这么善良的好心司机。如果若是遇到坏人咋办呀？希望孩子以后不要在晚上去奶奶家了。,0,1,0,2022-07-21 13:06:09,来自吉林,93167339202,香山红叶2744
7122672257499218729,大爱的网约车司机，为您点👍,0,1,0,2022-07-21 12:06:57,来自安徽,1697235808827374,外向钢琴K1
7122652023627432739,怎么看得我热泪盈眶[流泪][流泪][流泪],0,8,0,2022-07-21 10:48:42,来自重庆,108094559271,女人就是一杯茶
7122643772903015198,这个当儿子极为不合格[敲打]孩子想奶奶，当儿子的也不经常回去看老妈[敲打],1,7,0,2022-07-21 10:16:08,来自山东,2927188355,紟徃侑緣
7122684536672502561,好孙子，奶奶没有白疼他。,0,1,0,2022-07-21 12:55:25,来自广东,2154665858307527,幸运星空lF
7122660800376210210,想奶奶给奶奶视频电话吗，你要丢了奶奶咋活吗,0,1,0,2022-07-21 11:22:39,,2040309515814015,好学蜻蜓72
7122695563292377860,司机师傅好样的。小男孩真好，小小年纪懂得感恩。真好！,0,1,0,2022-07-21 13:38:39,来自新疆,102115097463,实在人DH卩
7122681082847855390,这宝宝真可爱，知道了想奶奶,0,1,0,2022-07-21 12:41:43,来自甘肃,663705178881476,知情达理面条jz
7122702803495748389,奶奶的爱，装满了小孩的心,0,1,0,2022-07-21 14:06:24,来自广东,1169520438815743,儿时纯光
7122686886077858592,这真是好孩子遇上了好司机又遇上了好警察！仨好嘎一好，好的不得了！,0,1,0,2022-07-21 13:04:24,来自北京,6215274297,老羊82497175
7122699394155217700,小男孩书包里随身携带户口本？？？,0,1,0,2022-07-21 13:52:45,来自江苏,5762805580,走肖趙63608127
7122680696648467236,好幸运，碰到热心司机良心人，为司机点赞！,0,1,0,2022-07-21 12:40:05,来自广东,8451627685565,用户怡安长乐
7122701131528667917,可怜的孩子，好心的司机，不合格的孩子爸爸。,0,1,0,2022-07-21 13:59:46,来自湖北,52007285775,热血已凉
