7122697027661906728,这孩子从小跟奶奶，对奶奶有感情，自己去找，很感人的。,0,1,0,2022-07-21 13:43:16,来自云南,99671499307,鸿雁lCUx
7122663900495332131,在派出所见到这样懂事的孙子，奶奶肯定会紧紧抱着不让别人碰……,0,1,0,2022-07-21 11:34:38,来自广东,4285486208,廖生1949369
7122710411702797092,祝好人一生平安,0,0,0,2022-07-21 14:35:53,来自山西,111588453950,奇幻辰星kH
7122713963002856203,小孩子懂得感恩长大错不了，应该感谢这位出租车师傅，这样人不多,0,0,0,2022-07-21 14:49:50,来自辽宁,69373135532,不老松216283240
7122694545380623144,我也是奶奶带大的，深有体会。我十来岁的时候我奶奶去了江西外省叔叔家，我在家天天盼奶奶回来。,0,1,0,2022-07-21 13:33:41,来自湖南,60984566316,俊俏苹果Sh
7122687028243743523,奶奶代大孙子，应该是幸福，这孙子懂得感恩了，天下的奶奶也这尽情的笑吧。,0,1,0,2022-07-21 13:04:11,来自宁夏,62588339753,静水秋萍
7122666802668340009,网约车司机好人，人民警察为人民点赞,0,2,0,2022-07-21 11:45:42,来自福建,111005687364,沉着百香果AF
7122691174816891652,懂得感恩，有些带到五六岁也不懂[赞][赞][赞],0,1,0,2022-07-21 13:21:19,来自广西,23383113148,奈何枫尘于往逝
7122691649339278118,日后应该是一条有情有义的汉子。,0,1,0,2022-07-21 13:23:04,来自天津,2414171642146603,自强不息风筝4I
7122684388386800399,9岁小孩去找奶奶，把人带进派出所还叫他家人来，9岁了还不懂奶奶家吗？,0,1,0,2022-07-21 12:53:59,来自广西,83919830299,李星燃664
7122711419640447779,奶奶带大的就和奶奶亲，一段时间不见就想的慌，正常现象。,0,0,0,2022-07-21 14:39:17,来自江苏,3623626599837847,仁者天佑mzl
7122677559678141221,这个宝贝书包里还带了户口本[捂脸][捂脸][捂脸],0,1,0,2022-07-21 12:27:47,来自北京,4439401209,极速熊猫az
7122672060287419151,网约车司机让人佩服。,0,1,0,2022-07-21 12:06:18,来自北京,3021062491609075,1552932358
7122687333338006287,为滴滴司机的暖心点赞,0,1,0,2022-07-21 13:05:37,,2827569405889912,沉着水滴K8
7122706234021233445,"小庄想奶心不安，
看父冬眠往外钻。
路遇好心胡老爹，
派出所内人团圆。",0,1,0,2022-07-21 14:19:38,来自浙江,91613113479,简单微风ho
7122680053296530176,九岁的孩子，充满了对奶奶的爱。因为奶奶一手将他带大，感恩之情铭刻在心。有情有义的好孩子会长成个好男人。而作父母的，尽管再忙，也不能忽略对孩子的关爱，否则孩子的心理会有缺失。,0,1,0,2022-07-21 12:37:03,来自山东,3751168052313773,豁达的顺其自然s6Lo
7122638830658323239,理解孩子的心情。孩子想奶奶，奶奶想孩子。凡是带孩子的老人都这么想。,0,21,0,2022-07-21 09:56:58,来自北京,104915903297,奇幻铅笔Ow
7122681065130525471,好孩子，奶奶没有白疼，出生牛犊不怕虎，做法让人担心，孩子好样的，为你点赞[赞][赞][赞],0,1,0,2022-07-21 12:41:24,来自山东,50591401807,ICBC0165
7122688730854589224,就这一次小庄想奶奶的行动，奶奶这辈子就知足了，太感动人心。,0,1,0,2022-07-21 13:10:55,来自甘肃,1411391938112734,直爽阳光6
7122686886853739301,有良心的孩子，热心的网约司机和警察。,0,1,0,2022-07-21 13:04:04,来自广东,71945890045,辛银玉
7122699700964426504,我为网约车司机善举点个赞[赞][赞][赞],0,1,0,2022-07-21 13:54:14,来自湖北,16195203023,张德海38
7122680360378745641,"九岁小庄感情深，
想起奶奶往外奔；
巧遇警民帮一把，
值得反思庄先生。",0,1,0,2022-07-21 12:38:26,来自陕西,1820392754777719,陕西省宁强县风光无限
7122683858684199718,知道感恩的孙子，爸爸忙也要抽时间带儿子去，小孩自己夜里出门太不安全了,0,1,0,2022-07-21 12:52:47,来自江苏,50439239400,別等我了
7122703226922648356,儿子是皮的，人家的，孙子才是真孙子。奶奶没白疼。,0,1,0,2022-07-21 14:07:36,来自安徽,68028028174,1程前
7122684115442631458,有个好奶奶，是个好孙子,0,1,0,2022-07-21 12:53:01,来自陕西,92606382161,果然不是浪得虚名
7122681336330584840,网约司机好心肠，善良的人必有好报，好人一生平安，健健康康[祈祷][祈祷][祈祷][玫瑰][玫瑰][玫瑰],0,1,0,2022-07-21 12:42:39,来自江西,98673722180,平安健康就是福8198
7122686246379701007,什么阻隔不了血浓于水的亲情。为善良有爱心的网约车师傅点赞。,0,1,0,2022-07-21 13:01:20,来自广东,3729147180618237,分秒必争扑克MK
7122653971928023811,不忘奶奶的伺养之恩，这孩子实在是不简单啊！懂事的心疼，看了流泪了。,0,2,0,2022-07-21 10:56:58,来自河南,3676363428990696,勇敢的喜鹊OJ
7122688336460022539,现在做好事的人是越来越多了，感谢这位的哥，好人做到底，成人之美，为的哥点赞。,0,1,0,2022-07-21 13:10:06,来自广东,10228186421,廖作仁
7122664657600627494,小小年纪的孩子知道感恩，，这孩子的人品长大后绝对不会错！为各位送孩子的好人点赞！[赞][赞][赞][赞],0,1,0,2022-07-21 11:38:15,来自河南,84353825391,姥爷克南6891
7122702279719437097,大的不及小，老鹰不如鸟，儿子不想妈，孙子想奶奶，多亏好司机，民警一起帮，孙子如愿到。,0,1,0,2022-07-21 14:03:51,来自浙江,98386229360,姜如凡
7122670905323045668,多宣传这些正能量暖心的事，为民警点赞！,0,1,0,2022-07-21 12:02:14,来自湖北,103460364411,聪颖饺子JN
7122660765114319616,带亲了孙子，小孩有情有义，聪明他知道带上户口本，晚上小孩容易迷路,0,2,0,2022-07-21 11:22:19,来自江西,72932446182,健康就是福1234563666
7122713110414246660,好司机，好警察！,0,0,0,2022-07-21 14:46:23,来自四川,92981371456,快乐扑克Er
7122681436624683813,网约车司机是个好人热心肠,0,1,0,2022-07-21 12:43:06,来自山东,2853964693906487,敏锐天空G
7122703464651703074,为这个孙子点赞！奶奶没有白亲他！,0,1,0,2022-07-21 14:08:11,来自河南,51992338381,laosong499
7122689074058248973,有好奶奶就会有好孙子，羡慕羡慕[比心],0,1,0,2022-07-21 13:12:59,来自广东,3720905670,香瓜nl
7122654802878333696,网约车司机真好样的，这件事有一个好结局，都是你的功劳，愿好心人一生平安，多福多寿！,0,2,0,2022-07-21 10:59:26,来自山东,54648918839,英明果断船帆vu
7122705259566465825,忙到忘记了亲爹妈,0,1,0,2022-07-21 14:16:02,来自山东,111475995420,羽中健尔
7122708261857542927,还知道随身带户口本[捂脸][捂脸][捂脸],0,0,0,2022-07-21 14:26:45,来自广西,50084766913,采菊东篱下5688
7122676540735259405,这个好人网约车司机，祝你一生平安幸福,0,1,0,2022-07-21 12:24:08,来自广东,2502578783,是非是空
7122657199893644064,为司机点赞，同时为孩子点赞,0,2,0,2022-07-21 11:09:38,来自河北,6270496550,文人墨客84068642
7122667732012679951,世上还是好人多，给网约車司机及派出所民警点赞,0,1,0,2022-07-21 11:49:21,来自山东,1156278631808567,青涩明月fj
7122647005339353867,好懂得感恩好有爱心的小男孩，奶奶有这样孝心的孙子是幸福快乐的。,0,4,0,2022-07-21 10:29:54,来自广东,1411395986667027,追求梦想2022
7122683518668538655,好孩子，出门还不忘记带暑假作业[捂脸][捂脸][捂脸],0,1,0,2022-07-21 12:51:01,来自内蒙古,85839193767,启l航
7122671525069062915,见此情此景，泪水难止。我也想远方的孙子，祖孙情是那么的纯真啊！,0,1,0,2022-07-21 12:04:55,来自安徽,813294595875368,健康快乐就是福LL
7122678375692796707,"这小孩子有满满的孝心
必须点赞",0,1,0,2022-07-21 12:30:36,来自四川,59866602504,相逢在9月
7122685300316488462,好人啦一生平安！[祈祷][祈祷][祈祷][赞][赞][赞],0,1,0,2022-07-21 12:57:59,来自湖南,53475701942,正能量熊猫To
7122656634530546446,好孝顺的孙子！幸福的奶奶！好孩子有三个好叔叔！孩子父母情商不咋地。,0,2,0,2022-07-21 11:06:48,来自安徽,2546075471198647,欢快雪碧VJs
7122670130571756302,这个小孙子有感恩心，真是世上只有奶奶好，给小孙子奶奶点赞！,0,1,0,2022-07-21 11:59:07,来自河北,58942914014,华亿煤业157755435
7122677290790224674,把奶奶心疼死了,0,2,0,2022-07-21 12:26:36,来自江西,4270135695382248,足智多谋远山Hn
7122669835317953317,是啊！小时也有过想奶奶的经历。,0,1,0,2022-07-21 11:58:02,来自天津,64638872626,Rosey4
7122681941778039565,好感动，孩子是个好孩子，叔叔们是好叔叔。,0,1,0,2022-07-21 12:44:57,来自安徽,50090153089,看不惯想的开
7122677419374461733,做爸的只知道工作，不考虑孩子和老人的感受，孩子想奶奶，其实奶奶是更想孙子，你今天没空明天没时间总是推辞，就上班挣钱有时间了？,0,1,0,2022-07-21 12:27:24,来自河北,8431935201,啃去承担
7122630774792209152,隔代亲，把它带大情入骨髓[赞]。,1,22,0,2022-07-21 09:26:10,来自新疆,1503746049195156,快乐的溪水wX
7122680550250300200,奶奶带这个孙子没有白带，为小孩子的孝心点赞！,0,0,0,2022-07-21 12:39:08,来自陕西,1820392754777719,陕西省宁强县风光无限
7122647854460044066,孩子的父亲不如这三位叔叔！希望再忙也要带上孩子，偶尔去看看奶奶！,0,3,0,2022-07-21 10:32:28,,1077951255287116,蜗牛也是牛Y
7122679667269698340,咋不记住奶奶电话呢！,0,1,0,2022-07-21 12:36:02,来自四川,52924436917,抽离麦芒的青稞a
7122704908436554527,奶奶带这个孙子没有白带，为小孩子的孝心点赞！,0,1,0,2022-07-21 14:14:25,来自河南,5860828970,码字长客
7122690754677506820,孩子对奶奶感情至深！可是（爸爸）太忙！忙的连自己的妈妈都忘记了吗？,0,1,0,2022-07-21 13:19:34,来自吉林,3491668808446323,站在白桦林中
7122700533126890277,"九岁小庄想奶奶，
屡提爸爸不应允。
不是爸爸不答应，
旁边有个唠叨官。",0,1,0,2022-07-21 13:57:15,来自广东,3038591518,手机用户进军号303859
7122643765419885346,不知道这位父亲有多忙,2,3,0,2022-07-21 10:15:59,来自河南,64259277058,风格209724581
7122693027596272420,好感动！爸爸应该成全孩子的要求。,0,0,0,2022-07-21 13:28:05,来自内蒙古,3478469574403661,丰收666富贵
7122652959682937640,懂得感恩的好孙子，你想奶奶了，奶奶也想你了，好感动😭[赞][赞][赞],0,1,0,2022-07-21 10:52:19,来自陕西,505398551919806,春天里的123
7122666629120393999,首先为出租车司机点赞,0,1,0,2022-07-21 11:45:04,来自北京,4256941681675886,冰哥1979
7122645331586253609,知恩图报的孙子，奶奶没有白亲你！祝你们全家幸福快乐！[玫瑰][玫瑰][玫瑰],0,8,0,2022-07-21 10:22:13,来自北京,50356175026,太平新湾
7122666519020389160,好样的，但千万不能自已出去，太危险了,0,0,0,2022-07-21 11:44:44,来自新疆,2546077661666766,善良芒果WH
7122699452762800899,爸爸接到电话为什么没来？,0,0,0,2022-07-21 13:53:42,来自江苏,3645634198379134,微风细雨o1iu
7122700710638797602,孩子一晃就大了！爸爸妈妈们珍惜这短暂的陪伴时光…心疼懂事的孩子…,0,0,0,2022-07-21 13:57:37,来自河北,62572684934,平安快乐
7122668950999647011,为好人司机点赞,0,0,0,2022-07-21 11:54:18,来自安徽,3900661433642120,怎么改写用户名
7122663761798185761,看的我都流泪了，知道感恩的孩子,0,0,0,2022-07-21 11:34:57,来自陕西,3707144574081678,605619179
7122665061189354255,[流泪]孩子，谁带大的 他就和谁亲,0,0,0,2022-07-21 11:39:13,来自山东,63386410496,潇洒花猫39
7122689061059887904,小孩的爸爸也是一个不合格的父亲，孩子尚知亲情疏不得，而孩子的爸却久不回母亲家。老人的思念，孩子的掂挂，作为人父却一点不理解，所以把你定义为不合格父亲一点不为过！,0,0,0,2022-07-21 13:13:24,来自广西,373475339941420,博学多才的圆月Kd
7122667697355506472,现在的家庭教育有几个小孩会想爷爷奶奶？为这个孩子点赞👍,0,0,0,2022-07-21 11:49:21,来自江西,101564612288,红人装e省宝合伙人
7122662430106829598,好孙子。孙子的举动看得令人心痛，隔代亲呀。,0,0,0,2022-07-21 11:29:21,来自江苏,108583638988,善良的心雨
7122683481477726990,好心的网约车司机、祝你及你家人一生平安，生意兴隆、日进斗金。,0,0,0,2022-07-21 12:50:56,来自广东,4655917811,周刘德华
7122674863273640745,我是奶奶，泪目…[流泪],0,1,0,2022-07-21 12:17:03,来自江苏,5755374519,幽默花猫iX
7122675448962073359,看完好温暖。记的小时候类似这样助人为乐伸手相助的人和事很多，我们的社会还是好人多。,0,0,0,2022-07-21 12:19:25,来自天津,60263434856,绿皮车4号线
7122644571658076967,谁养谁疼，谁疼谁爱，奶奶没白疼。,0,4,0,2022-07-21 10:19:16,来自广东,514220646474347,自在的望星空
7122659450527826718,多好的奶奶才会有心心念念想着奶奶的孙子，奶奶真的没有白痛这孙子[比心][比心],0,0,0,2022-07-21 11:17:52,来自广东,71873289788,灿烂梦想oh成才
7122628977881400095,好孙子[赞],0,53,2,2022-07-21 09:19:51,来自河北,62972599872,菩提姐
7122656923090060032,真是个好乖乖！只是应该让老爸带着去！[赞][赞][玫瑰][玫瑰],0,0,0,2022-07-21 11:07:33,来自山东,110989789837,木公同志
7122662224137028367,但是孩子的父亲做事情有点亏欠了，孩子想奶奶，他咋不想娘,0,0,0,2022-07-21 11:28:15,来自河南,95052897345,2020181866
7122683720091894543,"好孩子，有孝心
好司机，有爱心",0,0,0,2022-07-21 12:51:33,来自山东,52206124806,微笑的伤口
7122682471175111432,他奶奶肯定感动的嚎啕大哭,0,0,0,2022-07-21 12:47:10,来自辽宁,87713825063,家隔壁老赵
7122677290546905897,五十多岁的人了，看了泪奔，我也是奶奶带大的，愿奶奶天堂安好[祈祷][祈祷][祈祷][祈祷][祈祷][祈祷][祈祷],0,0,0,2022-07-21 12:26:31,来自河北,5857893981,安子68770827
7122639180572214031,让人感到，奶奶的付出终于有了贴心的爱的回报,0,11,0,2022-07-21 09:58:18,来自安徽,62114440833,健康——因与果
7122670829368460064,骨肉情深的表现，好孩子！,0,0,0,2022-07-21 12:02:23,来自辽宁,6727442725,曰出东海西山落
7121513087290737449,宣桥到书院没有地铁哦,1,3,0,2022-07-18 09:08:54,来自上海,50306298598,呆萌大叔126792037
7122693247310725900,聪明的娃，还会带上户口簿,0,0,0,2022-07-21 13:29:23,来自广东,105188544304,挤出微笑活下次
7122676847435481897,我家孩子也不知道爷爷奶奶长什么样的，有时只有过年的时候带孩子去坟墓上烧点纸钱给他爷爷奶奶,0,0,0,2022-07-21 12:24:56,来自广东,3065078362671124,极速海洋lV
7122707406211236620,好孩子奶奶没有白痛你,0,0,0,2022-07-21 14:24:17,来自山东,4468832615801630,中国🇨🇳梦
7122680786800689957,这样人间的真爱只在中国发生！好感动！,0,0,0,2022-07-21 12:40:18,来自江苏,2630504652241822,7180282856051
7122682487817487136,孩子良心很好，将来是个有爱心的人。,0,0,0,2022-07-21 12:47:11,来自云南,439409292360461,高级旭日NY
7122672450340422436,这孩子以后懂得感恩！会成为好人！,0,0,0,2022-07-21 12:08:03,来自安徽,4562583769,鸿峨艺墅
7122648391183926016,小庒不错！你以后注意点不要晚上去找奶奶！注意安全！,0,1,0,2022-07-21 10:34:32,来自江苏,4362452660679357,儒雅山丘Ok
7122670892945326882,大家要尊重警察执业,0,0,0,2022-07-21 12:01:46,来自北京,101120088950,木草324
7122655668104299296,好孩子，奶奶没白痛你，好好读书，长大后好好考敬奶奶。,0,0,0,2022-07-21 11:03:36,来自山西,54505269731,安忠9
7122659318905701151,小朋友长大后一定是个好男人，好爷们[赞][赞][赞],0,1,0,2022-07-21 11:17:03,来自重庆,23087063976,宋代祥1
7122654170712277793,真是可悲，自已不记得母亲，没有一点孝顺心，还不带孝顺的儿子见奶奶，童心是善良的，是有挂念的，那怕是10分钟时间都无办法吗？,0,0,0,2022-07-21 10:57:28,来自广东,53656214298,愉悦的葡萄iZ
7122672266920002304,奶奶有这样的孙子一定很骄傲，一切付出都值得。,0,0,0,2022-07-21 12:07:06,来自北京,105988117285,DADA闲聊
7122685489295147783,这是个懂得感恩的孩子，将来一定错不了[赞][赞][赞],0,1,0,2022-07-21 12:58:52,来自新疆,1714852381076365,温柔沙漠骆驼
7122658589243704079,司机做好事最应该感谢和表扬，但最应该感谢的还应该有奶奶！,0,1,0,2022-07-21 11:13:54,来自安徽,66813756346,天醒剑
7122712956290450176,感谢好司机！,0,0,0,2022-07-21 14:45:00,来自湖南,61839139504,奇妙芒果XF
7122708135441367842,好孩子[玫瑰],0,0,0,2022-07-21 14:26:23,来自江苏,63680071734,美眉191591311
7122660260229301031,奶奶的亲亲孙子[呲牙],0,1,0,2022-07-21 11:21:13,来自北京,108714705582,壹号钱币
7122639321597182735,有良心的小庄庄！[赞][送自己一朵花],0,14,0,2022-07-21 09:58:52,来自陕西,67785530229,茹堂和平
7122652004463264550,是一个好孩子给你和好心人点赞,0,2,0,2022-07-21 10:49:03,来自山东,110159802116,有趣的枫叶gpN
7122664859707704077,长大了肯定是有出息的，感谢好人的照顾,0,0,0,2022-07-21 11:38:53,来自湖南,70607747076,远方的客人
7121497840001827619,可见奶奶平时对大孙子有多好,0,24,0,2022-07-18 08:09:59,来自上海,2946291093210872,汉克鲁斯
7122688394836820772,大人要重视小孩的正常需求，不然要出大事情的，孩子想奶奶就应该送过去让他们团聚，这次还好没出事情，要是出事了悔的转吗？,0,1,0,2022-07-21 13:10:14,来自广东,2585651014286344,月儿圆啦
7122672060513731358,好孩子长大了要孝顺奶奶就好,0,0,0,2022-07-21 12:06:40,来自湖北,4011438091286350,过往云烟
7122673846817194782,孩子心真，大人心奸，老人赚心寒。大多帎头风吹着了，顾小家、冷落老人，这是人的可耻。两头顾好才是贤人,0,0,0,2022-07-21 12:13:28,来自广东,2296255512051838,cgytticutccyr愚憨子
7122685503350522659,这娃娃长大是有孝心之人。前途大大的！,0,1,0,2022-07-21 12:58:29,来自四川,69544214009,才思敏捷西柚AU
7122667800053023528,好感动，懂事的好孩子，！,0,0,0,2022-07-21 11:49:46,来自山东,5742379480,老农拉磨转圈圈
7122666773065155368,温暖人心的爱心，好人一生平安,0,0,0,2022-07-21 11:45:49,来自北京,73692529738,祝福8248
7122668398563214083,见见奶奶都这么难吗？查查怎么回事？,0,0,0,2022-07-21 11:52:33,来自河北,6746915516,沧州侠客扯闲篇
7122708594373804804,心心念念的人！,0,0,0,2022-07-21 14:28:59,来自河北,2137074895946621,才思敏捷湖泊5Z
7122679051177050891,奶奶没白疼爱这小子[赞],0,0,0,2022-07-21 12:34:05,来自陕西,62497957885,醉醒陈酿
7122673714117755687,老奶奶好命运，有这样的好孙子祥福吧，👍👍👍,0,0,0,2022-07-21 12:13:14,来自内蒙古,3386920211322160,钻石常琳
7122675840420496143,这孩子非常有孝心，长大后肯定有出息。,0,0,0,2022-07-21 12:20:52,来自广东,4055563956,积极的随缘人
7122693805165789960,谁带大不一样！,0,0,0,2022-07-21 13:31:11,来自河北,998003593971128,修养的修养
7122711931043709708,太感动了。,0,0,0,2022-07-21 14:42:08,来自贵州,6498675755,刘洪弄
7122665187106177822,真是一个有良心的小乖乖，懂事了知道是奶奶带大自己，就是想着奶奶这孩子，有良心知恩图报，长大之后一定有出息。,0,0,0,2022-07-21 11:40:03,来自福建,101574448636,诗意远山HH
7122707113633366825,我也是奶奶带大的，高中住校后每周非要回家看奶奶…,0,0,0,2022-07-21 14:22:21,来自湖北,3913883108522775,Ocomis
7122666121866183435,隔代亲不仅仅体现在爷爷奶奶的心里。由爷爷奶奶带大的孙辈们更能感受到这份隔代亲。这位小庄小朋友的行为就是隔代的有力佐证。,0,0,0,2022-07-21 11:44:21,来自江西,109725184092,赣中华龙
7122646851438265118,我也想我奶了，可惜再也见不到了,0,1,0,2022-07-21 10:29:04,来自辽宁,1802819697380397,认真的山丘ij
7122704005435884303,好心的网约车司机[赞][赞][赞],0,0,0,2022-07-21 14:10:17,来自安徽,105210788993,八点半562
7122648192281527070,好孩子遇到的都是好叔叔！和平胜世～这就是我们的本来样子！,0,2,0,2022-07-21 10:34:04,来自河南,4741744255,自正清白
7122669694314349346,孩子对奶奶感情有多深啊！,0,0,0,2022-07-21 11:57:12,来自甘肃,74590792630,2339026844353
7122669466416562984,小孙子很可爱，但这种方式欠妥，家长要正确教育引导呀！,0,0,0,2022-07-21 11:56:16,来自新疆,8252488049,137923031
7122663608844550953,是个好孙子，知道奶奶的好！孩子的父母要注意了，别让孩子走丢了。多和孩子沟通。,0,0,0,2022-07-21 11:33:31,来自辽宁,382219396853396,静观其变wo
7122672074509845285,奶奶带大的孩子,0,0,0,2022-07-21 12:06:32,来自山东,103631519761,乘风破浪的小鱼d
7122696196090790697,我孙子是我从他四个多月起开始带的，（他没奶奶了，白天由我一个人照看，晚上交给他妈）现在也九岁了，可我没感到他和我有多亲，反而开始嫌弃我太啰嗦太烦人了，想想真伤心！[流泪],0,0,0,2022-07-21 13:40:01,来自江苏,99565509652,用户老舟
7122681648852386564,这人啊，不知道为什么就是隔辈亲，我也是一样，自己的儿子就舍得打舍得骂，可是到有了孙子后，对孙子就是像一个宝贝一样，大声点的语气都喊不出口。[呲牙][呲牙][呲牙],0,0,0,2022-07-21 12:44:16,来自广西,77994839832,东方红98246
7122671439001928488,奶奶和你缘份深。祝福你小宝贝！人间爱无处不在。小宝贝你弄哭了好多人！,0,0,0,2022-07-21 12:03:53,来自河南,65388903262,自然28581
7122655340176737024,知道感恩的好孙子，[大笑]奶奶没白疼。奶奶看到孙子得多开心啊！[呲牙][呲牙][呲牙],0,0,0,2022-07-21 11:01:25,来自河北,6629294518,才高八斗海洋SG
7122678652244132645,奶奶带大的孙子，和奶奶感情很深。这种亲情是替代不了的。孙子感恩奶奶，想念奶奶，好样的。点[赞][赞],0,0,0,2022-07-21 12:32:07,来自河北,1081550062491054,孙跃德
7122690621748003587,太感动了。点赞！,0,0,0,2022-07-21 13:19:19,来自广西,2176642879335451,开心老人1213
7122691882664559372,这孩子，好感动[捂脸][捂脸][捂脸],0,0,0,2022-07-21 13:24:05,来自江苏,65417814139,蓝鲸2019
7122665788343042856,真是隔代亲啊,0,0,0,2022-07-21 11:41:51,来自吉林,2123874693549860,火星1花匠
7122692717393642273,在婴幼儿时，身边的亲人注定是他一辈子都会心心念念想念的人……永远不会忘记的亲人的味道……,0,0,0,2022-07-21 13:27:07,来自山西,93320613062,留心雨25
7122667957406614272,都是好人！奶奶没白疼孙子！,0,0,0,2022-07-21 11:50:22,来自广东,58837164104,元气松鼠dC
7122706324861256461,我家侄子也是他奶奶爷爷带大的。但是他能把他奶奶爷爷气吐血。别人家的好孩子。,0,0,0,2022-07-21 14:19:59,来自广东,2656014530250279,风雨同行逆风飞翔
7122662348510757671,亲情血脉谁能割断，好的哥[赞][赞][赞][赞][赞],0,0,0,2022-07-21 11:29:34,来自浙江,52028036460,凡人永锋
7122675996888711936,很懂事的小孩子不忘奶奶的养育之恩,0,0,0,2022-07-21 12:21:24,来自浙江,70855528646,水生545
7122667088963715844,有些孙子和奶奶感情很深，一辈子都忘不掉[祈祷],0,0,0,2022-07-21 11:48:02,来自甘肃,52892605528,有趣的梦想家lo
7122705305078612743,这孩子真可爱，知恩图报。丧大一定会孝顺奶奶。,0,0,0,2022-07-21 14:15:40,来自河南,1011991638185693,愉悦的小羊9M
7122710082240152320,以后多多地带小孩去看望奶奶！,0,0,0,2022-07-21 14:33:57,来自贵州,2035929750189491,喜庆的明月DW
7122684682433053475,好孩子，长大后一定大有作为,0,0,0,2022-07-21 12:55:19,来自四川,6166320506,一日三省616365
7122714337399718664,这个爸爸又要挨骂了！[捂脸],0,0,0,2022-07-21 14:51:03,来自湖北,10653188898,只争朝夕123A
7122699718559712036,好懂事、好让人感动的孩子。,0,0,0,2022-07-21 13:54:19,来自新疆,465833255241768,dashu
7122666335867962151,奶奶是男孩子天，百分之八十的男孩子都说奶奶好，古话说的好 老儿子 大孙子 老太太命根子 ，这就是传承 ？,0,0,0,2022-07-21 11:45:10,来自黑龙江,1460584610282808,顶级糯米xA
7122706482571379490,多好的小孩呵！不忘带大自己的奶奶！看的我眼泪直流。奶奶幸福啊！！！,0,0,0,2022-07-21 14:20:09,来自湖南,2480120085089120,灵巧星辰n6
7122668392473084713,小孩子想奶奶，誰對他好小孩子記得奶奶對他好，貓狗识温存！,0,0,0,2022-07-21 11:51:59,来自河南,110175153716,003路人
7122665512047723279,这男孩顶有情怀的，奶奶没有白带几年。,0,0,0,2022-07-21 11:40:54,来自湖南,111103131810,老不识泰山
7122716773602476839,孩子谁带大的他就跟谁亲,0,0,0,2022-07-21 15:00:42,来自重庆,1130735675386691,正义凛然小红花d0
7122670790290096904,孙子比爹孝顺,0,0,0,2022-07-21 12:01:49,来自河北,92364700842,按部就班539
7122658158446641951,特别理解，我也是奶奶带大的,0,0,0,2022-07-21 11:12:31,来自广东,93180148354,小阳阳0811
7122677960746042152,好有考心的孙子，感动。,0,0,0,2022-07-21 12:29:08,来自河南,57919009002,诚实人182168341
