7122639659427283749,这父亲太不称职了，要是孩子碰上歹人，跳河也不是以弥补！,0,2,0,2022-07-21 10:00:10,来自湖南,50915294050,善良明镜iX
7122668317794042627,有些儿女读大学出也比不上一个九岁小庄？,0,0,0,2022-07-21 11:52:49,来自广西,6919416518,路途遇知音
7122661976874369800,这孙子好，有情有义，而且智勇双全。,0,0,0,2022-07-21 11:27:49,来自广东,103295196081,怡宝小瓶的
7122673739036443425,小孩子_大德行！,0,0,0,2022-07-21 12:13:37,来自吉林,62596959935,灿烂橙子xP
7122626265588450087,为好心的司机点赞[赞][赞][赞],0,25,0,2022-07-21 09:09:33,来自山东,1288273200943428,用户6824603582843
7122700015675917096,"九岁男孩思奶深，
深夜独自出家门。
多谢司机留心问，
得知根源送民警。
民警电话忙联糸，
奶奶爸爸齐来见。
感谢好心好风尚，
亲人团结好暖心。
我今鼓掌又献花，
欢呼处处有亲人。
[笑哭][笑哭][笑哭][赞][赞][赞][玫瑰][玫瑰][玫瑰][玫瑰][玫瑰][玫瑰][玫瑰][玫瑰][玫瑰][玫瑰][玫瑰][玫瑰][玫瑰][玫瑰][玫瑰][玫瑰]",0,0,0,2022-07-21 13:54:56,来自重庆,78793315988510,用户2949321201593
7121524813575045923,怎么我们家没有这样可以被想念的奶奶？！,1,3,0,2022-07-18 09:53:53,来自上海,241489358886350,用户4481260459891
7122655882860987140,这小孩子可以想奶奶自己出门去看奶奶，以后在想奶奶要给家人说一下，不能一个人出门啦。好人一生平安[比心][比心][比心],0,0,0,2022-07-21 11:04:41,来自新疆,62852949065,用户7748599507965
7122676489287992079,给网约司机点赞！[赞][玫瑰]愿你今后的日子越来越好，好人一生平安！,0,0,0,2022-07-21 12:23:30,来自北京,3051842729156999,用户4132392105677
7122674852498375454,给司机点赞,0,0,0,2022-07-21 12:17:35,来自吉林,111452855948,用户4886817462774
7122673210294305570,出租车司机真是好人一位 幸福快乐会陪你一生的,0,0,0,2022-07-21 12:10:45,来自江西,97043085206,用户8824176392808
7122674133665973026,好司机一生平安[祈祷],0,0,0,2022-07-21 12:14:15,来自山东,2462529219474624,用户6846030062122
7122706796968149763,孩子谁带得多就跟谁亲，孙子记挂奶奶这是好事，天伦之乐啊[呲牙][呲牙][呲牙],0,1,0,2022-07-21 14:22:33,来自广东,3298183941718936,用户2249542857360
