7122417115172389646,警方不是公告女孩13岁，男子是其母亲男友吗？,7,15,0,2022-07-20 19:37:15,来自福建,104765760263,红颜笑w
7122264022518661922,男女朋友也不应该是这样，起码不会是厕所，起码不会提裤子，薅头发拖鞋，嘴巴还骂骂咧咧！这就是两人认识然后想强奸未遂，熟人并不是犯罪的借口,2,507,0,2022-07-20 09:42:52,来自湖北,852823966759027,优雅叶子da2
7122344337962746637,这名男子应该严惩，不然以后还有类似的事件发生的。,3,351,0,2022-07-20 14:54:46,来自贵州,105912802415,是小阳阳呀
7122471533054493480,看着心里可难受，男子在众目睽睽下，像拖一只小动物一样拖着那个女子 ，周围人就那么冷漠地看着。想想那种情景令人感到毛骨悚然。,2,68,0,2022-07-20 23:08:26,来自河南,100776233671582,珍珍幽默
7122417444178297631,为踹门黑衣女汉子点赞[赞][赞][加油],2,126,0,2022-07-20 19:38:50,来自北京,108173855003,战刀155
7122414371217326889,俺咋看不明白了，卫生间是公共的，不分男女吗？咋发生矛盾,1,2,0,2022-07-20 19:26:25,来自北京,88001949086,单纯风铃x4
7122246792468857631,就算是相识，也不能如此嚣张，必须严惩！,2,1068,1,2022-07-20 08:36:44,来自湖北,4208578288956136,一江秋水111
7122258472145519375,问一下被拉的女士就知道了，不过，男女朋友和这个暴力行为有什么关联？,1,140,0,2022-07-20 09:21:17,来自上海,64296108693,我也是手机用户啊
7122300644018438949,男女朋友也不行，在大众广庭之下做这种事儿，有失脸面，,1,28,0,2022-07-20 12:05:17,来自河北,333865150065213,万事如意3c6Q
7122421180266906401,这么一大群人，看着男人这样把女生拖向厕所隔间？,3,31,0,2022-07-20 19:53:22,来自广东,1420175675232643,星空扬波
7122337790989419294,无论之前发声什么事，生拉硬拽把人往卫生间托肯定没什么好事，严查。,0,376,0,2022-07-20 14:29:24,来自黑龙江,110811974751,莫愁用户267205732310
7122236644207444751,调查是否男女朋友关系的说法及措施不当，要看女的怎么说的，就算女的不追究男方责任，还要追究两人扰乱社会秩序的责任。,3,444,1,2022-07-20 07:56:41,来自上海,3347704700,工匠营造
7122255138420491015,幸亏当时人多，黑衣女人也是勇敢，要是人少不一定有人敢管,1,688,1,2022-07-20 09:08:47,来自广东,100675095278,静沫暖气
7122441403518468904,太猖狂了，和唐山差不多，必须严惩！,0,57,0,2022-07-20 21:11:01,来自江苏,50849306812,此处悠然
7122270194793595685,提着裤子出来是发生了矛盾？？？,1,419,0,2022-07-20 10:07:23,来自河北,3707197673442412,小米粥的爸爸
7122266909562798883,不管他俩认识不，男子的行为以构成强奸。,0,211,0,2022-07-20 09:54:05,来自湖南,110878251846,赢钱咯高兴
7122366642986369807,难道不是强奸未遂,1,193,2,2022-07-20 16:21:21,来自江西,98575864844,⼀片空白
7122237807330018061,出来还提裤子，这个是啥子矛盾？？,2,446,0,2022-07-20 08:01:39,来自西藏,11028273444,不要忘了那天的痛
7122261162846143239,看这题目，要是男女关系就没事啦呗！不知道这渣男是什么来头呢！不然怎么这么嚣张。,0,210,0,2022-07-20 09:32:19,来自河北,59019331847,樱花茂盛
7122276645754487565,是不是男女朋友已经不重要了，这男的已经犯法了！,0,117,0,2022-07-20 10:32:12,来自上海,413019739006995,123456杰姐
7122358990515897121,卫生间里发生矛盾，谁走错了？[捂脸],6,203,0,2022-07-20 15:52:02,来自辽宁,106091799779,步步高升PLUS
7122377385190048523,男女保持距离比较好，如果不是夫妻，这样大家会互相尊重一点。遇到矛盾说话客气一点，避免挨打。不高兴可以避开危险冲突，不需要正面回应。如果性骚扰，马上埋单走人！不如离开做点高兴的事。,0,56,0,2022-07-20 17:03:51,来自广东,111555212985,知己知彼方能成
7122236281853330176,即使是男女朋友，明显女孩当时是不愿意发生任何关系的，这是违背了妇女意愿，强行发生关系！涉嫌强奸！,1,519,0,2022-07-20 07:55:20,来自重庆,51032586335,直爽的洋儿
7122360386753397515,为什么男女同时会先在厕所？,1,43,0,2022-07-20 15:57:29,来自四川,2981501939236285,哥九才
7122274171128136448,无论是否男女关系 ，法治社会，这种行为必须受到法律制裁!!!观点一致的点赞[赞],0,98,0,2022-07-20 10:22:23,来自上海,8610309086,宁静yurongyou
7122365621190656801,大猖狂了！光天化日之下竟干出这种事情，不能原谅,0,99,0,2022-07-20 16:18:07,来自北京,4169778894735293,用户杨素兰
7122258843492647721,女生出门在外少喝酒注意安全，,1,40,3,2022-07-20 09:22:47,来自广东,52382478659,静儿winds
7122245196276106018,这种暴力行为，不论双方认不认识都应严惩！,0,210,0,2022-07-20 08:29:56,来自山东,109589230750,朱晓军Za
7122226888865022728,怎么可能，二个人去卫生间发生矛盾，吵架也不可能去卫生间呢,6,167,0,2022-07-20 07:19:52,来自浙江,1754451872066331,富足风声Mo
7122264789141324582,两个人为了抢一个坑位发生矛盾,1,217,0,2022-07-20 09:46:52,来自河北,3104665914312263,外向清泉LV
7122242523866940200,这种行为太恶劣了，有失公德。,0,38,0,2022-07-20 08:19:31,来自黑龙江,105861237053,月儿弯弯赵53
7122266942522098440,为勇敢踹门的女子点赞[赞][赞][赞],0,482,2,2022-07-20 09:55:02,来自天津,109736341924,用户拥抱温暖的阳光
7122580329898083112,那么多人冷漠看着，真是醉了，就一个黑衣女侠出来相助，一群大男人不羞愧吗？,0,2,0,2022-07-21 06:11:07,来自河南,109102119887,果果情感屋
7122219059424772899,写文案的人，什么叫在卫生间发生矛盾呢？就是没有实施伤害吗？,0,47,0,2022-07-20 06:48:54,来自江西,4699013733,悠扬的纯
7122231888684598056,卫生间发生矛盾？长见识了[呲牙],8,781,1,2022-07-20 07:38:23,来自浙江,2313815140087966,我有之宝
7122507759748154152,太猖狂了，一定要严惩,0,7,0,2022-07-21 01:31:41,来自河南,57791452581,外向春风Of
7122232703717720832,这是典型的犯罪行为！严惩不贷！,0,429,1,2022-07-20 07:41:21,来自安徽,5213055591,6511cdd
7122249786048774945,有点太恶劣了，有矛盾就可以拖拽、扒衣服吗？,0,34,0,2022-07-20 08:48:49,来自江苏,93259315606,2022红姐
7122250657897857806,关键是男女二人什么关系？,2,6,0,2022-07-20 08:51:51,来自广东,75956429526,美好岁月的djx
7122291942238995203,九派新闻中，叙述过程添加部分内容给人一种错误暗示！被害人和施暴者相识，两人共同饮酒。在卫生间发生矛盾？？是不是有袒护嫌疑人的嫌疑！请读者思考！！,0,315,0,2022-07-20 11:31:59,来自河南,52555410139,萬东夏庄
7122334515003294505,我想看结果,0,83,0,2022-07-20 14:16:42,来自吉林,4750476647,星语O_O
7122104862145561381,谁能解释下厕所里怎么会有监控,3,28,1,2022-07-19 23:26:21,来自广东,3337768620795182,非文王
7122455395943777027,被拖拽女孩的父亲如果在现场，他敢打这个纹身男吗？,1,5,0,2022-07-20 22:06:13,来自山东,3689550762745316,自由用户123
7122333017703498507,这名男女应该严惩，不然以后还有类似的事件发生的。,0,86,0,2022-07-20 14:11:17,来自湖北,55211069391,君君156
7122245565416981255,女子低估了流氓的嚣张！,0,132,0,2022-07-20 08:31:53,来自山西,22258047984,美人鱼的幸运
7122245311271469838,警方回应只说二人有矛盾，到底是啥矛盾没说清楚。,0,19,0,2022-07-20 08:30:54,来自广东,54649990064,健康是福13816808
7122231543057744674,纹身男子强奸未遂。警察应主持公道，不惧黑恶。,1,597,1,2022-07-20 07:37:10,来自重庆,4064636298,丁昭彬
7122127355099185927,一男一女，怎么可以在同一个厕所？,0,25,0,2022-07-20 00:57:01,来自天津,100761279010,树影伴茶香
7122264038885131041,这个地方安装监控也是当一次见,1,12,0,2022-07-20 09:44:05,来自山东,58956847747,秦淮左岸2
7122372179114738462,大庭广众之下犯罪!!!,0,256,1,2022-07-20 16:42:40,来自上海,1402627605142504,海燕看天下
7122238405241078541,男女朋友也不能这样啊。感情应该是让两个人变得更好，而不是成为一个人欺负另外一个人的理由。,0,69,0,2022-07-20 08:04:09,来自福建,58104231566,金小孟
7122252513222869771,拉着头发拖进去，看着都疼,1,74,0,2022-07-20 08:59:12,来自浙江,6996499220,纷飞的思绪1
7122313753970279199,不管他们之间发生什么矛盾，光天化日之下太猖狂了！！！！,0,12,0,2022-07-20 12:55:29,来自江苏,1648868511456435,幸运豆浆3D
7122508545014317837,奇怪，认识又怎样？认识就可以这样吗？警方的发言很有意思。,0,12,0,2022-07-21 01:37:24,来自江西,54922238646,如鱼得水144939924
7122258669852525353,警方预设了他们有可能是男女朋友的假设，这不应该。即便是男女朋友，这也属于强奸未遂了。登记结婚的夫妻，即便女方不愿意也构成强奸，男女朋友就可以逃避法律了？,0,183,0,2022-07-20 09:22:04,来自吉林,3887484273952680,哦哦哦哦哦嗯哦哦哦嗯
7122360405053555468,不知原因，勿妄加评论！,4,12,0,2022-07-20 15:57:37,来自河南,54805829922,青松评历史
7122239383939580712,为什么矛盾要进到卫生间解决？他们什么关系？,0,16,0,2022-07-20 08:07:26,来自浙江,3113473071129976,桂子情感生活
7122226800859775744,期待看到后续法律对该男子的处理结果。,0,11,0,2022-07-20 07:18:40,来自广东,105182629590,麦风华
7122223260259058467,不管他们是什么关系，这种场合严重影响社会道德，严惩不道德行为！[发怒],1,12,0,2022-07-20 07:05:01,来自湖北,1724462194755806,谁懂我的心（有关必回）
7122426294134653696,都说是吓蒙了，第一反应呢？特别是那个被拖拽的白衣服，另一个人还在帮忙摆脱女孩的手，不是正好应该制止吗？！,0,12,0,2022-07-20 20:12:32,来自湖北,71828890101,水盈袖
7122343587463070477,不管是不是男女关系，法律上将只要违背意愿做的事情就是犯法，哪怕是夫妻都不行，而且严重扰乱社会治安了。,0,2,0,2022-07-20 14:52:00,来自湖南,2344625381581624,芹菜萝卜各有所爱7a1c
7122483402456449828,人越来越像动物，一点都不文明了,0,5,0,2022-07-20 23:55:48,来自海南,5915238270,RUCI人生
7122240151522411264,男女朋友也不行啊,0,31,0,2022-07-20 08:10:21,来自山西,11998942357,老刘545454
7122194983310607140,为黑衣女子点赞吧！,0,61,1,2022-07-20 05:18:34,来自贵州,3853109923954014,陌上过翼
7122237643643093798,周围的男的伸手伸得好弱,0,13,0,2022-07-20 08:01:35,来自河北,66826264025,端端大谷
7122238892949947136,生闺女的得学散打、武术、跆拳道,0,2,0,2022-07-20 08:05:22,来自加拿大,2770419085220512,智慧苹果8j
7122238977960411912,“相识”就是说没事了吗？,1,106,0,2022-07-20 08:06:18,来自河北,4273784681,逍遥山中客37046896
7122319655150437152,是不是跑厕所交易不成起冲突了,0,34,0,2022-07-20 13:19:30,来自河南,3091422982455191,花猫咪咪9155
7122388182532440844,卫生间发生矛盾，不得不让人浮想联翩,0,19,0,2022-07-20 17:45:36,来自河北,110907630501,墨羽倾璇Anne
7122243640503665449,为保洁阿姨勇敢点赞！,0,8,0,2022-07-20 08:23:48,来自重庆,1143085570468895,多念你的好
7122244816046048034,这是官方措辞？,1,169,1,2022-07-20 08:28:31,来自河南,3227762557196974,一葉知秋L
7122306675079758606,影响极坏，依法严惩！,0,12,0,2022-07-20 12:28:02,来自山东,4234913687288872,用户拥抱太阳
7122321691791442723,提醒广大女性网友，饮酒要适量，更应该学会保护好自己，切勿因酒后贪杯而导致被他人有机可乘！,0,27,0,2022-07-20 13:26:53,来自山西,4424857739854573,爱健身的小猫咪
7122239366491144997,有点太恶劣了，有矛盾就可以拖拽、扒衣服吗？严惩！女人也要自爱！,0,9,0,2022-07-20 08:07:50,来自辽宁,1059552531329652,涛姐英儿
7122269689430229794,不管认识不认识，都不应该这样，性质太恶劣了。,0,5,0,2022-07-20 10:04:54,来自江苏,2278667966232555,归隐
7122247132354151175,还好，这次没人袖手旁观,0,10,0,2022-07-20 08:37:56,来自山东,4398468157152254,细雨微醺
7122342977074103078,女孩子们，注意安全！注意安全！注意安全！重要的事情说三遍呀，夜店酒吧少去呀[捂脸]我这样说男同胞会不会打我哟,0,32,1,2022-07-20 14:49:57,来自重庆,6508792923,乐观晴空
7122358881556661000,这个世界已经疯了！,0,336,0,2022-07-20 15:51:25,来自甘肃,5952140687,常山寺老僧
7122310994474664734,这光天化日之下如此猖狂,0,6,0,2022-07-20 12:44:48,来自吉林,110181713285,辣妈
7122247686620889860,为勇敢踹门的女子和其他施予援手的群众点赞,0,166,1,2022-07-20 08:40:37,来自山东,5828343255,带着风儿去流浪
7122448677808947975,即使互相认识，这种行为很显然是违背女性意愿的，而且薅头发是很恶劣的！必须严惩！,0,0,0,2022-07-20 21:39:33,来自吉林,2788012722237789,暖大叔感悟
7122117801737339660,卫生间里有监控？,0,5,0,2022-07-20 00:18:54,来自云南,104460415838,徐鹤眠
7122287507521717027,跟是否男女朋友无关 无论她从事什么职业 什么品性 都不应该使用暴力和迫害的方式违背妇女意志而侵犯妇女,0,8,0,2022-07-20 11:14:06,来自北京,628574913047287,xtoy
7122252511822021416,不管认不认识，他这个行为明显就是女方不是自愿的，判个意图强奸未遂是没问题的。,0,261,0,2022-07-20 08:58:24,来自上海,104541721956,同一片蓝天下123
7122583242989011747,太猖狂了，必须严惩,0,0,0,2022-07-21 06:21:57,来自辽宁,92768545665,自由自在的xiaoyuer
7122258115336553224,所以说，女人应该自尊自爱。,0,9,0,2022-07-20 09:20:32,来自福建,2185485375781564,清新白云E
7122334600831304463,无论男女朋友还是夫妻，首先这是违背妇女意愿，第二这是公共场所，已经犯法,0,5,0,2022-07-20 14:16:55,来自北京,59590838294,神箭手嗖嗖嗖
7122288366632108838,看来还是不能交男朋友，,0,0,0,2022-07-20 11:17:43,来自北京,104343771112,8788L
7122237500412281603,太嚣张了，必须严惩！,0,3,0,2022-07-20 08:01:14,来自四川,1261856313845054,昨日星辰0606
7122236110285669150,男女朋友关系重要吗？法律上将只要违背意愿做的事情就是犯法，哪怕夫妻都不行。,0,176,0,2022-07-20 07:55:22,来自河北,109132097682,一世繁华Fezon
7122192717009994527,我就想知道怎么处罚，什么矛盾解腰带,0,15,1,2022-07-20 05:09:43,来自黑龙江,1764039172562334,沉着花猫9Y
7122287529805660961,为什么要进同一个厕所，难以理解,0,15,0,2022-07-20 11:14:41,来自北京,61731028156,是洋仔呀
7122407319480353540,夫妻关系、母子关系什么关系都是恶劣行为,0,1,0,2022-07-20 18:59:27,来自广东,110373576390685,一轮红日永乐大典
7122254425321980684,涉嫌强奸，至少是暴力伤害，和男女朋友没关系。@郑警发布,0,120,0,2022-07-20 09:06:29,来自陕西,6977093768,小帅帅Xj
7122440324907057920,卫生间是男女打斗的地方吗？认识也不行，熟人间犯罪的也不少！,0,0,0,2022-07-20 21:06:45,来自河北,104058424496,进取风铃a9
7122490649194578702,等待看结果,0,1,0,2022-07-21 00:25:07,来自江西,3865490491443853,草莓猕猴桃
7122223887013954312,女性一定要注重自身安全，不给犯罪可趁之机。,0,9,0,2022-07-20 07:08:07,来自山西,8733052346,神州一统2624
7122262945908196136,相识的人 不手软啊,0,68,0,2022-07-20 09:38:57,来自山东,932805424191039,苑苑姐1970
7122231386240811811,这个渣男应该得到强监罪的处罚，大庭广众之下太消张了，可恶可恨，应严惩不贷,0,1,0,2022-07-20 07:36:25,来自北京,1249524450069667,温柔河流dr
7122346187470078756,请注意，强奸也是一种矛盾。,0,25,0,2022-07-20 15:02:08,来自黑龙江,3686588465,乱弹社长
7122297563910456075,严惩啊 女孩现在出门真的很危险,0,1,0,2022-07-20 11:53:42,来自辽宁,50096392826,北大青鸟IT教育
7122230396699296553,一个个的都疯了！,0,6,0,2022-07-20 07:32:27,来自山东,241502668205452,尊重事实就是尊重自己
7122416563005080335,这种事情已经曝光，出具谅解协议合适吗！警察放人合理吗！,0,45,0,2022-07-20 19:34:54,来自湖北,56198451360,吾心向阳1360
7122130123398251279,万家庄婚闹闹到厕所了？,0,4,0,2022-07-20 01:05:44,来自广东,98152523512,未完待续G21
7122263349064647424,必须严惩不贷,0,12,0,2022-07-20 09:40:27,来自广东,1305866095574285,我是大眼睛雪亮
7122290383358427943,在卫生间发生矛盾？同厕？,0,3,0,2022-07-20 11:25:58,来自江苏,61980397631,海边的女孩LB
7122516148562051843,感觉像黑社会(男子)惩罚或威胁 夜店工作人员(女子)，手段残忍、出手重。应该深挖一下这个男的，一定有大鱼,0,15,0,2022-07-21 02:11:06,来自新疆,5385835192,一路上最美
7122221769759097614,谨慎交友啊！我还是乖乖做个宅女吧,0,0,0,2022-07-20 07:00:13,来自山西,1701656469707427,花儿与蝴蝶7747
7122390733277348623,正常人家的孩子，谁知道这是啥阵仗,0,0,0,2022-07-20 17:54:41,来自山东,50286318027,王暁康
7122270733417775880,酒后矛盾性质轻多了,0,9,0,2022-07-20 10:09:32,来自江苏,4081800528791832,嘎嘎与哈哈
7122236806174868264,现在关键是纹身男是何许人也，他为何这么大胆子在众多人面前施暴，希望警方深查！,0,98,0,2022-07-20 07:57:18,来自江苏,2080692176955036,东方彩虹
7122123716116955917,这速度，给警察点赞[赞][赞][赞][赞][赞][赞][赞],0,4,0,2022-07-20 00:42:12,来自浙江,4494437192305982,用户梁山好
7122234903822992128,拽着头发拖进去的啊，太恶劣了，必须严惩!,0,89,0,2022-07-20 07:50:01,来自山东,58709029533,梧桐树155782823
7122298487747969826,唉世道险恶，女孩又喜欢跑去娱乐场所,0,13,0,2022-07-20 11:56:37,来自广东,1671707975761523,阿勇哥552301360
7122253393426940680,都是喝酒惹得事,0,1,0,2022-07-20 09:02:21,来自山东,2656882285618381,智者面条7k
7122340915528008456,再是怎么样的男女朋友关系也不能光天化日之下强暴拖拽拉扯女人头发拖拽,0,35,0,2022-07-20 14:41:41,来自广东,3008711612446088,俊俏雪梨51
7122247944833286950,真是无法无天，为勇敢踹门的美女及其它施救者点赞！对施暴者必须严惩不贷！[赞][比心][加油],0,65,3,2022-07-20 08:42:01,来自湖南,3439706561085284,豁达枫叶fs
7122335276650742561,这种事还不涉及法律？强奸是必须的 手段如次恶劣 不能给予和解,0,18,0,2022-07-20 14:20:04,来自福建,99000856145,清白人生王先生
7122372313391645448,挨打曝光都是熟人。没有曝光谁知道？熟人就可以大事化小。毕竟好借口从来不怕。,0,35,0,2022-07-20 16:43:41,来自山东,6532640772,清晨的落雨
7122375143817233160,这种不尊重妇女儿童公然践踏法律法规的犯罪分子应坚决严肃处理。,0,55,0,2022-07-20 16:54:36,来自辽宁,57120979647,大众来评
7122474469997822757,又是唐山？不会吧！,0,0,0,2022-07-20 23:20:21,来自山西,4587474473,陌上花4587474473xszr
7122262708418446080,严惩恶徒，太嚣张！,0,4,0,2022-07-20 09:38:06,来自四川,104502667270,井子975
7122300500896351007,别说是朋友关系，就是夫妻还有婚内强奸罪，此渣男必须严惩，还社会清明。,0,18,0,2022-07-20 12:04:43,来自山东,1644495725400452,无双香瓜Vu
7122222652659565320,严查，依法处理,0,1,0,2022-07-20 07:03:09,来自广西,63410481354,鱼儿3041
7122267224433541929,本人不接受这样的新闻稿。,0,36,0,2022-07-20 09:55:24,来自河北,2867175706606240,勇者大海7R
7122464777972122380,保安不管吗？没有安保人员吗？,0,1,0,2022-07-20 22:42:41,来自河南,1147534575410163,儒雅星球Lk
7122289416068547363,太可怕了😱,0,3,0,2022-07-20 11:21:39,来自北京,5003052396,rui若愚
7122251281674814219,是些啥子人哟？,0,2,0,2022-07-20 08:54:49,来自重庆,1873208415886391,幽默的仙客来
7122256593336681224,这太恶劣了,0,1,0,2022-07-20 09:14:56,来自上海,2700826695698636,热情的糯米6C
7122275763524780800,不管什么关系公共场合拖拽头发肢体，这能正常吗！！就这样随意动手打骂的男女关系除非受虐体质，不然0容忍,0,30,0,2022-07-20 10:28:30,来自山东,106783515168,最美还是你
7122228059902100259,都好好在家吧！,0,0,0,2022-07-20 07:23:34,来自浙江,74392251407437,Jqx15305706736
7122233120832668449,光天化日，众目睽睽，应该罪加一等吧！,0,39,0,2022-07-20 07:43:49,来自湖南,53516719735,海上雄涛
7122291364490199839,男女共同喝酒就是很正常的，在卫生间发生矛盾就不正常了。[大笑][大笑],0,9,0,2022-07-20 11:29:29,来自福建,55546515941,老陈161170169
7122270378382066467,卫生间发生什么样的矛盾？就这样一笔带过？,0,3,0,2022-07-20 10:07:31,来自广东,110917683794,柔温的臂弯
7122233328526295842,一个认识能弥盖多少的罪恶,0,247,0,2022-07-20 07:43:53,来自福建,52684114845,雍哥721684
7122217379790488351,都是什么是事啊，唉,0,2,0,2022-07-20 06:43:00,来自辽宁,356683070574200,自在蓝色的血
7122237329255269131,家暴现在都判刑，别说没有半点法律关系的男女朋友了。来头不小啊，不过这女的我一点也不同情,0,59,0,2022-07-20 08:00:30,来自上海,352301616733192,乐观伯内特9V5
7122265783430464256,要搞清楚，当时女的冲出卫生间为什么要喊救命。,1,146,0,2022-07-20 09:49:59,来自湖北,2031546353324462,奇妙蜻蜓um
7122415866805224203,还是好人多啊，黑衣人出手 [赞],0,8,0,2022-07-20 19:32:45,来自山西,104497600178,稳坐峰顶观云飘
7122265925994316578,最近天气燥热，人太容易暴怒了,0,0,0,2022-07-20 09:50:14,来自山东,1574092631446072,mmx云淡风轻
7122226982187959080,胆大妄为，严惩不贷。,0,2,0,2022-07-20 07:19:27,来自甘肃,54798791462,wzfeng219057940
7122259680714015501,这算不算强奸未遂,0,113,0,2022-07-20 09:27:16,来自山东,100386022837,高级溪水Bd
7122330574329119500,唉，这样的事希望不要再发生太负面了[发怒],0,2,0,2022-07-20 14:02:12,来自山东,2115103932298668,有没有来过
7122121051143979806,为氏么受伤的总是女人？？？？,0,4,1,2022-07-20 00:30:44,来自江西,201926695453304,青泉果蔬超市
7122257318473155368,纹身男这是顶风作案，罪加一等,0,73,0,2022-07-20 09:16:59,来自江苏,3518047449781213,金木行星707
7122290015874663203,远离“毒品”式爱情，保平安长寿[大笑],0,0,0,2022-07-20 11:23:47,来自北京,96824609220,冷冰雨
7122236281848988419,所以现在这社会，家里有女娃子练什么舞蹈，还是多练一些防身术吧，关键时刻，还是得自保[捂脸],0,0,0,2022-07-20 07:56:11,来自北京,92329735048,默默归矣
7122360585593373440,唐山的事还没了结吧？,0,249,1,2022-07-20 15:57:49,来自黑龙江,95989373817,老孙有个好乖乖
7122276255046796064,没人帮忙报警吗,0,1,0,2022-07-20 10:31:03,来自宁夏,2458119118006091,善良咖啡Xj
7122333936940401420,恶劣，“认识”？认识又怎么样,0,210,0,2022-07-20 14:15:28,来自广东,50785024714,清1441949
7122108644502209321,这都是怎么了？,0,2,0,2022-07-19 23:40:49,来自新疆,2788776497652030,有一个好女儿
7122259247207432967,正值百日行动期间，这纹身男还敢这样胆大妄为，应该作为重点打击，杀鸡儆猴。,0,30,0,2022-07-20 09:24:59,来自湖南,2581259104816126,头条老肖
7122267738953417480,相识就可以为所欲为？男女之间在卫生间发生矛盾，男、女混合卫生间？！,0,197,0,2022-07-20 09:57:59,来自广东,2400932495111656,法眼观天李伟建律师
7122233727660999459,在卫生间发生矛盾 这个是重点,0,70,0,2022-07-20 07:45:41,来自河南,56093948503,非凡雪梨Up
7122245927045432078,注意安全[赞][赞][赞],0,1,0,2022-07-20 08:33:20,来自贵州,3588440757637975,热心星空yq
7122290969412010786,"真好，有矛盾脱裤子解决，这是什么逻辑？
有没有人和我有矛盾啊！就是脱裤子解决的那种[作揖]",0,31,0,2022-07-20 11:27:31,来自山西,6107635209,坐听风雨看落花79531080
7122367460271440654,施暴和是不是熟人，是不是夫妻是不是父子没有关系，法律,0,144,0,2022-07-20 16:24:38,来自江苏,52088880132,心灵的苦役
7122263726992278305,学会自我保护，一个人人少去复杂的地方。,0,0,0,2022-07-20 09:42:37,来自贵州,98119989734,带露的草
7122259429071782694,搞笑、朋友会拉扯头发。,0,46,0,2022-07-20 09:25:40,来自广东,72926770698,愿安1123
7122235047595819811,就是男女朋友也不行,0,48,0,2022-07-20 07:50:41,来自广东,3698630773,喜欢吃鱼
7122314830249902861,既是男女朋友关系，也应依扰乱社会秩序进行处置。,0,1,0,2022-07-20 12:59:45,来自陕西,63223187574,乘风破浪的原野mu
7122333074733826820,女人越来越没安全感，还怎么结婚[捂脸][捂脸],0,0,0,2022-07-20 14:11:48,来自广东,59387220224,无言75875
7122271341377585955,啥矛盾会让一对男女在同一个卫生间里发生[机智][机智],0,36,0,2022-07-20 10:11:15,来自广东,698879687006141,缤纷扑克n1
7122265157077713664,即使是男女朋友也应按强奸未遂法办，何况还大庭广众之下更应严惩![发怒],0,31,0,2022-07-20 09:47:21,来自河南,52436033209,天与地0521
