7121542712389632782,你怎么会认为秀玉是黑户呢？,3,3,0,2022-07-18 11:04:11,来自山东,2066724528069629,颓废的小青蛙
7121489830861144872,跟万传美，互换身份啊？,1,2,0,2022-07-18 07:39:04,来自江苏,92443626034,豁达苹果SK
7122637111433577256,今早追优酷最后一集,0,7,0,2022-07-21 09:50:13,来自浙江,558198196535592,有趣的豆花Pn
7122382062271087396,[玫瑰][玫瑰][玫瑰]为郑晓龙导演和剧组点赞！辛苦了！《幸福到万家》，带领大家见证乡村振兴事业事业的蓬勃进展。祝福伟大的祖国，日新月异，繁荣昌盛、国泰民安！,0,3,0,2022-07-20 17:21:20,来自江苏,111018667725,智勇双全柳叶jx
7122400817700766472,三观很正，引领农村人积极向上的一部好剧！幸福婆婆神一般的演技，太贴近生活了，谢谢郑大导演，给你点赞！[赞][赞][赞][赞][赞][赞],0,1,0,2022-07-20 18:33:57,来自辽宁,3474923194422532,随性自由的海风4Y
7122716238946042660,看到38集已再无勇气刷下去了，何幸福查污染源就一定、必须把万家庄、老万家搞砸、搞垮为先决条件吗？,0,0,0,2022-07-21 14:58:24,来自广东,109027961421,冰焰
7122311283047006976,演员的演枝都不错、有些故事情节太牵强，,1,10,0,2022-07-20 12:46:15,来自河北,62467179899,平良心1234
7121831801429164838,还没结局呢！看样子秀玉做了网红，肯定有人挖秀玉资料，到时候真相大白了。,0,0,0,2022-07-19 05:48:39,来自山东,4221734379857085,E鹅岛
7121590332130804520,有观众说幸福无所不能 然后幸福这样的表现又不满意,0,1,0,2022-07-18 14:08:47,来自江苏,51025379458,微笑看自己
7122413733867029263,正义没错，就是太神话她了，好像她无所不能，地球离开她就不转了。把她的事迹分点给别人做，就没那么突兀了。,0,0,0,2022-07-20 19:23:49,来自江苏,106867005330,jmgpw
7122640726697722662,有些媒体讲这剧好,2,0,0,2022-07-21 10:04:22,来自安徽,52713407448,聪颖半世流离
7122632868732044043,追完幸福到万家就剧荒了,0,6,0,2022-07-21 09:35:20,来自陕西,778105395095736,奋发有为橘子oO
7122679539486343974,我还是认为幸运的这条线比较真实点，对于传家，希望他是因为猥亵进去的,0,0,0,2022-07-21 12:35:52,来自重庆,1578503200583796,剪小剧
7122772415872189199,反映新农村建设的题材，得多体现正能量的东西,0,0,0,2022-07-21 18:35:42,来自北京,76876088973,sygzyxlwt
7122621287440253737,我一直追剧[比心][赞]没看够！[祈祷],0,5,0,2022-07-21 08:49:19,来自浙江,106006051825,海洋菩提
7122438319975744256,三观很正，引领农村人积极向上的一部好剧！幸福婆婆神一般的演技，太贴近生活了，谢谢郑大导演，给你点赞！[赞][赞][赞][赞][赞][赞],0,0,0,2022-07-20 20:59:07,来自陕西,2313810445871283,简单水滴3L
7122397994364093216,开头还行，后半部越看不靠谱。,1,5,0,2022-07-20 18:23:26,来自陕西,4085631325,阶梯33030327
7122605757648126735,这种结局尽管差强人意，但符合社会需求，这也是宏扬正能量吧。,0,8,0,2022-07-21 07:49:08,来自辽宁,55178475162,博学的晚风yP
7121727145885958942,90年底顶替的更多，一个班级就有几个。,0,2,0,2022-07-18 23:00:29,来自江苏,6900858614,金毛老三
7122265958295143179,女主一路开挂，其他人波澜起伏。,2,1,0,2022-07-20 09:51:27,来自江苏,1261869277392712,胡同巷子里的阳光
7122625425570513704,好看的不行，集数少了,0,4,0,2022-07-21 09:05:29,来自云南,6978502553,想想什么的想
7122457132146361091,三观很正，引领农村人积极向上的一部好剧！幸福婆婆神一般的演技，太贴近生活了，谢谢郑大导演，给你点赞！[赞][赞][赞][赞][赞][赞][赞][比心][比心][比心][比心][比心][比心][比心][比心][比心][比心],0,0,0,2022-07-20 22:12:59,来自内蒙古,51252812959,凤传奇438
7122400207882945293,"《幸福到万家》这部电视剧，把农村的事情表现得栩栩如生，展现了农村的发展和进步！更是展现了农村现代女性的奋斗向上精神!
 优秀的剧本，!优秀的导演!优秀的演员!
一句话:整个优秀的团队!
为您们点赞！[赞][赞][赞]",0,2,0,2022-07-20 18:31:59,来自福建,1522146933481624,高冷菠萝93
7122236925997630239,一部魔幻剧,1,5,0,2022-07-20 07:58:14,来自浙江,6074911737,风无影111
7122416733692412702,三观很正，引领农村人积极向上的一部好剧！幸福婆婆神一般的演技，太贴近生活了，谢谢郑大导演，给你点赞！[赞][赞][赞][赞][赞][赞],0,1,0,2022-07-20 19:35:51,来自上海,500993335497672,端庄星空5土根
7122618386655609600,正剧就是主旋律，一切以人民为中心，不同时期需要不同的精神力量和引路人,0,7,1,2022-07-21 08:38:09,来自河南,22419509419,无心法师1221123321
7122405361528783627,"《幸福到万家》这部电视剧，把农村的事情表现得栩栩如生，展现了农村的发展和进步！更是展现了农村现代女性的奋斗向上精神!
 优秀的剧本，!优秀的导演!优秀的演员!
一句话:整个优秀的团队!
为您们点赞！[赞][赞][赞]",0,3,0,2022-07-20 18:52:01,来自上海,166753953130462,dghnddhn
7122630060015878927,超好看的剧,0,4,0,2022-07-21 09:23:18,来自云南,6978502553,想想什么的想
7122423437087834919,谢谢编剧导演，神剧终于收场了。,1,3,0,2022-07-20 20:02:24,来自辽宁,3775464844,无忧的青山3Y
7122694171596604200,这个结局蛮好的[赞],0,1,0,2022-07-21 13:32:02,来自四川,100954507061,友爱画板Az
7122433852060025639,理想主义万岁,1,2,0,2022-07-20 20:42:17,来自山东,3117865794809484,盘小葫芦
7122209436059435776,昨天不是说提交了入党申请书吗,0,7,2,2022-07-20 06:11:39,来自四川,501813097270936,杉杉得酒
7122457175070704395,三观很正，引领农村人积极向上的一部好剧！幸福婆婆神一般的演技，太贴近生活了，谢谢郑大导演，给你点赞！[赞][赞][赞][赞][赞][赞][赞][比心][比心][比心][比心][比心][比心][比心][比心][比心][比心],0,1,0,2022-07-20 22:13:01,来自内蒙古,51252812959,凤传奇438
7122428459300995851,"《幸福到万家》这部电视剧，把农村的事情表现得栩栩如生，展现了农村的发展和进步！更是展现了农村现代女性的奋斗向上精神!
 优秀的剧本，!优秀的导演!优秀的演员!
一句话:整个优秀的团队!
为您们点赞！[赞][赞][赞]",0,2,0,2022-07-20 20:21:25,来自内蒙古,1689327267754056,拥抱阳光WZ
7122281892632232734,前面有交代：递交了入党申请书。只是没具体说何时批准入党。,0,1,0,2022-07-20 10:52:49,来自江苏,3254207371555223,简单不简约2441
7122398717457548063,"《幸福到万家》这部电视剧，把农村的事情表现得栩栩如生，展现了农村的发展和进步！更是展现了农村现代女性的奋斗向上精神!
 优秀的剧本！优秀的导演!优秀的演员!
一句话:整个优秀的团队!
为您们点赞！[赞][赞][赞]",0,1,0,2022-07-20 18:26:03,来自黑龙江,6266795680,暖暖83994934
7122689925405082368,漏洞百出，很好的一部剧，拍成了神剧，素材来源于生活，可又拍的脱离了现实。,0,0,0,2022-07-21 13:15:35,来自宁夏,79070365206,草木风之
7122382675599475496,一部有温度，有深度的作品[赞][赞][赞],0,3,0,2022-07-20 17:23:21,来自四川,2392150536622315,cuncao寸草
7122727830009430788,只是觉得心想上大学的秀玉，为什么第二年没去复考。,0,0,0,2022-07-21 15:43:23,来自四川,4619173127,为自己醉
7122236957308699406,我们村就是这样，先当支书后入党,0,2,0,2022-07-20 07:58:50,来自山东,5472039083,穹顶下的眼
7122542254824244002,结局过于完美…,0,4,0,2022-07-21 03:48:52,来自云南,4583266363,MOONER
7122557757395354398,突然觉得钱不香了～[呲牙][呲牙],0,2,0,2022-07-21 04:47:16,来自山东,3619213975502660,L淡墨痕
7122412080263349032,郑导确实拍什么都好看，每个演员和相应的角色都非常到位，人物立体丰满，太好了[比心][赞]郑导确实拍什么都好看，每个演员和相应的角色都非常到位，人物立体丰满，太好了[比心][赞][赞]今夏谢谢郑导给观众带来了不一样的何幸福[鼓掌][鼓掌],0,3,0,2022-07-20 19:17:35,来自山东,51137166171,幸福阳光201215462
7122614172273853215,已过好几年，二胎都生了。,0,0,0,2022-07-21 08:22:37,来自北京,104689823143,彼海
7122385064742388518,书记和幸福的公公婆婆和老公都是演技派[赞][赞][赞],0,0,0,2022-07-20 17:33:18,来自上海,3069434010015918,一个散淡的凡人
7122640068573315881,这难道不是幸福到万家吗？非得家破人亡，妻离子散，惨不忍睹你就满意了？一部剧而已，看完哈哈一笑就齐了，哪有那么多道理是应该的！,0,4,0,2022-07-21 10:01:47,来自河北,2203052381571047,月夜孤帆
7122586821049336610,万书记的结局太惨了,0,4,0,2022-07-21 06:35:50,来自河南,74423996069,月亮背面呆着
7122715101916480297,何幸福这样的为人确实，在社会上不吃香，为正义伸张正义，会得罪很多人，但我们当今社会就是缺少这样的人，人人都只顾自己，都缩头缩尾,0,0,0,2022-07-21 14:53:30,来自广东,267903853404429,洛桑晴
7121477614640366350,郑晓龙导演没把握好方向[灵光一闪],1,3,0,2022-07-18 06:52:37,来自山东,4187010363,叶霖灏
7122732852252492557,看来以后的电视剧本要先放在社会上广泛征求意见后再定稿开拍！,0,1,0,2022-07-21 16:02:46,来自山东,102463902612,自由奶茶g4
7121734244342366984,属于诈骗。,0,1,0,2022-07-18 23:28:05,来自河北,54909302677,寒江独钓180960169
7122018209867727630,庆志呢 就想看他和亚妮分手 凤凰男,1,3,1,2022-07-19 17:49:43,来自山东,67878832998,简单19900817
7122259870266917666,可先当村主任！,0,1,0,2022-07-20 09:27:02,来自山东,6000194488,平等与公平是不同的
7121858482634523433,中国重名的人很多，身份证号重了才是关键，再说万传美的身份证是假的，走不远的。,0,0,0,2022-07-19 07:29:28,来自北京,19068008473,锅碗瓢盆协奏曲
7122611305559360287,文字，情结，不要，结果为重要，开启农村神剧先列难为导演了…,0,2,1,2022-07-21 08:11:27,来自天津,17192990293671,一丝不苟圆月2c
7122028432703456034,总算把头发扎起来了，那个幸运[泪奔],0,2,0,2022-07-19 18:28:43,来自湖北,6084566770,猪傻的可爱
7122256642489680673,幸福：一个农村女孩子，无所不能！[大笑],0,0,0,2022-07-20 09:15:02,来自河北,50272420990,力善儿
7122637093264425768,除了人世间还行外，其它的剧都是装腔作势！,0,3,0,2022-07-21 09:50:14,来自山东,104317949490,sssAAkkk
7122595984311976743,实际上你说的，都还不算急转弯。何幸福当村支部书记才是最大的反转。,0,1,0,2022-07-21 07:12:43,来自山东,86302045523,博学的云朵a9913
7122754073862144768,前面乱过七国后面我佛慈悲，矛盾与和谐，这剧如同从前有座山山里有座庙……？见证神奇的故事就要开始了？没了？,0,0,0,2022-07-21 17:24:31,来自广东,4120599736615495,幸运水滴RM
7122585874180997892,伟大的作品就在于不完美，迎合民众口味，管它春夏与秋冬！,0,3,0,2022-07-21 06:33:38,来自辽宁,2642879388329580,闲人老王123
7122767105137230624,很奇皅的剧，真敢拍，真不敢看。,0,0,0,2022-07-21 18:16:25,来自河北,1556498828234568,豆儿爷V8ft
7122741266915312421,唐山的事如果女孩完全恢复给赔很多钱，后半生，可以过的舒服了,0,0,0,2022-07-21 16:35:12,来自浙江,4322869599803646,足智多谋西柚iv
7122693811955827489,完全赞成笔者观点！,0,0,0,2022-07-21 13:31:14,来自河北,51640639953,蘓远
7122756912139092767,收尾收的太快了，前面还挺好的,0,0,0,2022-07-21 17:36:05,来自山东,3914891579,校草侦探
7122346577062789896,神剧无所不能,0,2,0,2022-07-20 15:03:39,来自浙江,57556237559,南阳之梦
7122597693432038185,你没事吧[擦汗],0,3,0,2022-07-21 07:18:07,来自安徽,2938329001109996,眰T恦
7122460415581635359,前有抗日神剧手撕鬼子，今有乡村神剧幸福万能！！！,0,0,0,2022-07-20 22:25:26,来自甘肃,6111329181,有音无像
7122699294272553743,小何是什么时候入党的啊？？,0,0,0,2022-07-21 13:52:14,来自江苏,105715935565,庄稼人866
7122235959470654223,这种情节是正常的，主要大部分人是普通人，用普通眼光看,0,0,0,2022-07-20 07:54:08,来自北京,68383630277,小宇QQ
7121511124172374799,是啊，看着剧情的发展是不了了之了，毁三观啊,0,2,1,2022-07-18 09:01:33,来自云南,58603022425,雨晨163501561
7122242791962379022,随便用手机拍张照片就把小姑子捧成网红了,0,0,0,2022-07-20 08:20:52,来自天津,1323445284517597,嗨嗨的迷咋
7122605527234413312,发表评论前应知道这部电视剧的名字，幸福到万家，就应知道结尾了。,0,1,0,2022-07-21 07:48:24,来自河南,50084557217,李文治4
7122235270090621731,本故事纯属虚构,0,1,0,2022-07-20 07:51:24,来自四川,92676399637,我是真馒头王
7122024578431320871,光良的一首歌，童话里都是骗人的,0,8,0,2022-07-19 18:14:23,来自广西,2493316083235724,可欣动人
7122030189563593483,电视剧还是往好的方面去传播，如果发生在现实。太难了！,0,2,0,2022-07-19 18:36:42,来自辽宁,64953632711,赵曰天下
7122671224953848607,何仙姑下凡,0,0,0,2022-07-21 12:03:28,来自湖南,59197687180,渔舟43
7122238863775040291,你知道什么是大女主戏吗？,0,0,0,2022-07-20 08:05:29,来自广东,5239524274,AM9A21
7122225545194341132,都可当科幻片,0,3,1,2022-07-20 07:14:44,来自贵州,4568839545,无畏有畏
7122602264997036835,好剧,0,13,0,2022-07-21 07:35:56,来自辽宁,81745732548,玉兔555
7122433137359029006,没离婚吗,3,1,0,2022-07-20 20:39:16,来自湖南,52019330903,onegoodpeople
7122598299903427341,好看,0,12,0,2022-07-21 07:21:11,来自陕西,91685592340,玉树琼花🌸💋️💋️
7122227181987840809,已弃剧,1,1,0,2022-07-20 07:20:07,来自河南,95054360694,德才兼备扑克uU
7122657279287051021,好好活,0,1,0,2022-07-21 11:09:16,来自云南,193926600075523,正大光明松鼠dY
7121993399393354530,都变好了,1,2,0,2022-07-19 16:12:50,来自山东,2872382912226840,开心大可乐
7122233585293247266,编剧编剧,0,2,0,2022-07-20 07:44:54,来自浙江,399812273383240,仁爱咖啡HJ
7121606863636120320,身份有问题的是传美，她身份是假的，秀玉的是真的怎么可能是黑户，她只是学籍被顶,0,3,0,2022-07-18 15:12:51,来自山东,106094240606,萌鸭丽莎
7122672435878527782,确实不太真实自然。幸运自己就莫名其妙的转变了；幸福干啥都有人帮；老莫啥事没有，传家从头到尾就不知道排污水的严重性吗？总的来说，万书记一家烂七八糟，幸福一家越来越好。生活不是这样的。,0,1,0,2022-07-21 12:08:07,来自河北,2238234003773976,诗意辰星p0
7121591503478276897,又不是换身份……只是大学被顶了，传美的身份证肯定是假的，但秀玉的是真的，怎么就成黑户影响结婚了？？？[我想静静][我想静静][我想静静][我想静静],1,2,0,2022-07-18 14:13:52,来自四川,105318645149,建哥说事儿
7121767365745984260,与你的看法正好相反，这部剧最失败的就是编剧。,1,2,0,2022-07-19 01:42:27,来自北京,50261162836,日月_北京
7122702750537990923,结尾有点儿烂，就像交代后事，一件一样件地交代清楚！没有一点点连贯性！而且有点儿牵强！说好听点儿就是所有演员来了一个集体谢幕罢了！,0,0,0,2022-07-21 14:06:11,来自河北,92326206616,平平安安274416601
7122632206614528779,整件事，大家都是看万书记挺好，我也觉得幸福过了，但是保健品里面那个莫总真的是个毒瘤，不把他揪出来，集团也保不住,0,0,0,2022-07-21 09:32:37,来自江苏,50957602649,仙人掌仙人掌2012
7122685304369758991,大团圆不挺好的吗，难不成非得有一些意难平，凄惨的结局才有意思吗,1,0,0,2022-07-21 12:57:28,来自安徽,50038059438,布偶猫铲屎官
7122728668740584230,你以为像武侠剧一样都得死吗[捂脸][捂脸],0,0,0,2022-07-21 15:46:54,来自福建,60499058270,武艺小太阳
7122644239389541127,编剧水平堪忧,2,2,0,2022-07-21 10:17:55,来自湖北,4160197011716590,2020大家记住了你
7121509873326113577,没有三观，导演不行,1,3,0,2022-07-18 08:56:38,来自广东,382251272508692,疯狂的石头记
7122013810546443039,什么万能的万书记，在主角光环年前也要被治,1,6,1,2022-07-19 17:32:35,来自山东,1800819316,笑谈古今往事
7122684178781061900,[笑哭]想看玛丽苏狗血剧你也不用这么踩它吧！,0,0,0,2022-07-21 12:54:04,来自山东,5502101113,西柚lyiTAL
7122028316512715531,纯过了过审。,0,0,0,2022-07-19 18:28:55,来自辽宁,104996801302,abcdefghi98765432101
7121363654696174371,组内刷到，支持友友[比心][比心][赞][赞],1,1,0,2022-07-17 23:36:39,来自广东,69364734283,有趣的诸米米
7121997837809959721,把幸福描写得太厉害万能了，脱离现实,8,71,0,2022-07-19 16:29:58,来自贵州,3403678482176720,用户7427233752682
7122350373838914304,赵丽颖演的太好了，没有表演痕迹。真是一部好剧，还有一众好演员。感觉没看够就结束了。,0,11,0,2022-07-20 15:18:04,来自河北,98134947913,用户7237110607433
7121999339723391759,感觉幸福到万家就是来搞万家的[笑哭][笑哭][笑哭],1,41,0,2022-07-19 16:35:57,来自湖北,111176352731,用户9827481455684
7122326716474721054,喜欢赵丽颖，一直都追她的剧。,0,1,0,2022-07-20 13:46:08,来自湖南,1953183874425405,用户8726064605409
7122409800985789187,我觉得好多人都是冲着颖宝，才看这个电视剧的吧，反正我一直都喜欢颖宝,0,2,0,2022-07-20 19:09:23,来自湖南,1094738432239288,用户1165072710516
7122385092634247950,赵丽颖演的很好，点赞👍🏻，如果这部剧不是她演的，我看都不会去看,0,3,0,2022-07-20 17:33:02,来自上海,100762827620846,用户1457245511337
7122384875990270753,赵丽颖演什么像什么，就喜欢看她演的剧,0,3,0,2022-07-20 17:32:28,来自黑龙江,1437814281994557,用户6109630752678
7122400958130225924,应该说赵丽颖演什么都好看,0,2,0,2022-07-20 18:34:48,来自上海,2053477587236379,用户7798151013883
7121996265096856361,认可这结局,1,6,0,2022-07-19 16:23:51,来自河北,1855578250427214,用户3870529093661
7122433313767785251,这部剧不错，值得观看。给点赞！,0,1,0,2022-07-20 20:39:40,来自广西,12780682714,用户9396358178709
7122382080675595043,这部电视剧很好看，希望郑导能多拍这样的剧[赞][赞][赞][赞],0,3,0,2022-07-20 17:21:04,来自四川,107815053361,用户7774325300750
7122016838116705060,这样的结局很好，,1,1,0,2022-07-19 17:44:26,来自福建,101888039408,用户2979118790365
7122380595867026184,幸福嫁给律师就好了[大笑][大笑][大笑],0,1,0,2022-07-20 17:15:54,来自广东,4234915134320499,用户4534151194442
7122324547201876772,看到了导演的名字，不看就知道是一部好的作品。,0,7,0,2022-07-20 13:37:46,来自辽宁,68727367858,用户6174549589603
7122216284532146985,中国式大结局挺好的，皆大欢喜。,0,2,0,2022-07-20 06:38:05,来自浙江,1363029495392423,用户8645177803107
7122063838018650915,演的女主太神了,0,11,0,2022-07-19 20:45:47,来自北京,5025548734,手机用户5025548734
7122385134804550435,有这么棒的编导这么棒的演员成就了《幸福到万家》,0,3,0,2022-07-20 17:33:11,来自重庆,13588635567,用户282308878
7122364455627326219,每天准点追这部剧[比心],0,4,0,2022-07-20 16:13:30,来自浙江,2691254184852824,用户5913394918692
7122371116014519040,针不戳，剧情还在我的心巴上面了[心][中国赞],0,2,0,2022-07-20 16:38:45,来自湖南,3711582810946280,用户4068488897186
7122076570478756623,哪个不向往美好的生活[赞]人人愉悦不好吗？,0,2,0,2022-07-19 21:35:17,来自广西,89922314897,用户3844953046926
7122265740706906880,剧情发展到后头越发不合理,0,0,0,2022-07-20 09:49:43,来自重庆,352264720227358,用户5638750154939
7122383377705288463,我们希望看到正能量满满的剧本,0,2,0,2022-07-20 17:26:06,来自山东,1015560946068600,用户5800256502284
7122389094969459492,没看过不评,0,0,0,2022-07-20 17:48:38,来自四川,105582036370,用户743655863261
7122391094679716623,多拍些悬疑，宫斗,0,0,0,2022-07-20 17:56:10,来自广东,2246995686458019,用户4069045036587
7122319551870108420,每集都追,0,10,0,2022-07-20 13:19:20,来自山东,52366820773767,用户2096458004269
7122098161116054276,小编老是说的不准，电视里和他说的都不一样,0,1,0,2022-07-19 23:00:16,来自河南,4023807802358820,用户1257265086743
7122382112023905060,任何虚拟的作品一文不值，,0,0,0,2022-07-20 17:21:47,来自广东,59014469700,手机用户59014469700
7121987716375708454,那些人的生活太过一帆风顺，看不到别人努力去拼博和奋斗，看不到别人只认一个理为家人讨公道，如果现实中的我们及亲朋好友受人欺负和暴力，你不说我不说都没有一个人有勇气站出来发声伸张正义，那我们平民百姓活着有什么公平公正可言，如果人活着连好坏对错都不分还有什么意义？所以社会需要何幸福这样的人，她可以引领千千万万个人都能成为何幸福，能带动法治建设和经济发展，提升思想文明和指导方向，给中国妇女树立了正确的价值观和人生观。,0,10,0,2022-07-19 15:51:36,来自广西,59091653918,用户1584564104791
7122604937431106318,结局是以郑导及其团队的安排，演员只能根据剧夲来演。一千个人有一千种口味，个人认为这个结局完美，不要为了凑结数，过于拖长。有的内容留给观众想象。这才是艺术，这才是人生，一部电视不是迎合某个人的意愿。,0,3,0,2022-07-21 07:46:30,来自江苏,65105488006,用户5470093236135
7121706721386922763,这就是现实，顶替之事不了了之了。看的很生气！,0,3,0,2022-07-18 21:41:00,来自内蒙古,70880326762,用户9906920046277
7122382028724781858,郑导，谢谢您的辛苦付出，很好看。唯一的不足是何幸福，如果是何泓姗演会加分很多。,0,2,0,2022-07-20 17:20:53,来自重庆,110937569631,用户4142918600379
7122397951473140488,良心好剧，郑导真棒👍🏻[呲牙][呲牙],0,2,0,2022-07-20 18:22:59,来自贵州,2445772091833758,用户4497901219740
7121973951760630568,说的好，赵丽颖就是个好演员，她演的太真实了，好看。,0,15,0,2022-07-19 14:57:30,来自内蒙古,3421276903834092,用户5205086310836
7122601503646417704,结局大家好就是不好看，最后一集法庭一章最精彩太失望。,1,1,0,2022-07-21 07:32:38,来自河南,1367392658663687,用户69425443609
7122744755666830112,说实话，结局太快了，匆忙就完了,0,0,0,2022-07-21 16:49:27,来自山东,25185252642,手机用户25185252642
7121545653498872608,身份证应该没有被换吧[捂脸]那连车都做不了，宾馆都住不了了,1,2,0,2022-07-18 11:16:08,来自浙江,2629646091297379,用户1946021052445
7122487624794833696,这个结局很完美[赞],0,13,0,2022-07-21 00:13:00,来自天津,3641223053600126,用户1662683656629
7122693102380581666,追完何幸福就剧荒了，电视不在打开，只等赵丽颖的野蛮生长！,0,2,0,2022-07-21 13:28:01,来自海南,1472961022006168,用户3692103219229
7122285859340796686,我插队当知青时，农村流行先入党后入团，捎带着当社员,0,1,0,2022-07-20 11:08:17,来自内蒙古,4059037832061726,用户9765996730302
7122578818439136000,看官们不较劲，每部剧都有教育意义和目的。谢謝何幸福为自家和村民争来的说法和补偿[赞][赞][赞],0,21,0,2022-07-21 06:05:28,来自四川,25064381035,热情的饺子gT
7121588863814484766,剧情好离谱，越看越不着掉,0,0,1,2022-07-18 14:03:44,来自山西,110854439737,用户4318938627110
7122391773363667747,非常棒的电视剧！结合当下新农村新建设新面貌！,0,3,0,2022-07-20 17:58:31,来自上海,2629653083720832,用户4474143818846
7122611372659409704,这个结局很好呀,0,2,0,2022-07-21 08:10:57,来自重庆,2277786163089935,用户1820893717154
7122699715288400677,时代的要求,0,0,0,2022-07-21 13:54:26,来自上海,50253050314,手机用户50253050314
7122643070956405545,结局很完美[赞][赞][赞][赞][赞],0,1,0,2022-07-21 10:13:17,来自广东,1978771157299512,用户5356772450265
7122637197329089316,发现电视剧超过二十集基本都是烂剧(康熙王朝除外),0,0,0,2022-07-21 09:50:37,来自天津,108993651092,用户8158703661483
7122028824044585732,幸福到万家icon”确实是一部不可多得的优秀农村题材的电视剧，对于指导我国农村的健康发展有着十分重要的现实意义！,0,4,0,2022-07-19 18:30:57,来自山东,2317363035251108,用户1423770138894
7121994631348323075,说不好的就是没看到剧的深意，太肤浅,0,10,0,2022-07-19 16:18:04,来自广东,2189836267036772,用户8318354581935
7122274383552496396,美好的生活谁不向往，电视剧传递正能量不正常吗？本来生活就一地鸡毛来点幸福美满的剧情挺好的！,0,0,0,2022-07-20 10:23:48,来自安徽,66993020275,wL阳光
7122342326122873612,刘威就是万书记，曹征是万传家本家，演的绝绝子,0,9,0,2022-07-20 14:47:47,来自广东,1609305337628926,开心鹏城小圆子
7122160865792852776,韩律师为啥屁事没有,1,1,0,2022-07-20 03:09:21,来自新疆,5667416812,我是克拉A梦
