7122194888728707840,从开始推荐给朋友看到现在一眼不看的反感，也只有这部剧了，太离谱让人心生厌恶……,0,2,0,2022-07-20 05:16:42,来自北京,2732240105,香雪蓝天
7122313452962169636,加入方圆，圆满。不错。,1,2,0,2022-07-20 12:54:23,来自江苏,50753650240,阿窦AD
7122245151594218253,最后的剧情简直太扯了,0,3,0,2022-07-20 08:30:16,来自山东,729691854483581,80后娱乐圈
7122242384548741899,秀玉上大学了？？,0,0,0,2022-07-20 08:19:45,来自上海,99857182190,执着的风声hY
7122110922235413289,我觉得挺好的，看电视剧就是图一个乐,0,3,0,2022-07-19 23:49:29,来自湖南,3135932985,热情的爱杰
7122391337898705667,[赞]非常真实,0,5,0,2022-07-20 17:57:40,来自浙江,1816860156766142,上进的原野9c
7122019142365872910,应该改名叫“幸福告万家”,0,1,0,2022-07-19 17:52:58,来自山东,4367680403682376,SMD0546
7122239188766098210,本故事纯属虚构，如有雷同纯属巧合[比心],0,1,0,2022-07-20 08:06:39,来自四川,63450115136,勇者星空Nf
7122403054896841484,每天都必刷，有种幸福感，比那些流量牛奶小生的烂剧好上百倍,0,3,0,2022-07-20 18:43:23,来自上海,61191438170,小小小小阿信
7122080373584249608,太完美不现实,0,3,0,2022-07-19 21:50:25,来自江苏,1578513046452771,as小老虎
7122457704693547791,这种题材的电视剧要多拍，反映真实生活,0,1,0,2022-07-20 22:14:15,来自河南,4257728590779687,地上小天
7122080879987999488,提着一口气看剧，矛盾一个接一个，上一个还来不及消化出现下一个了，这日子过得太紧张了[捂脸],0,3,0,2022-07-19 21:52:05,来自江苏,64207470237,张骞西域
7122380123776779039,幸福告万家,0,1,0,2022-07-20 17:13:47,来自浙江,50093300106,金不浪
7122342316887212815,剧情很多不合逻辑，比如闹婚和顶替上大学都发生在这两家，几乎不可能！,0,9,0,2022-07-20 14:47:04,来自河南,3284989170422846,无双橙子LR
7122237216306381583,现实生活的话，幸运可能都被传家搞的离开了人世,0,0,0,2022-07-20 07:58:56,来自上海,2473261842,程序员小帅V
7122418527621038883,前期是好看，自从去了城里后就变味了，等在回村里那是一言难尽,0,0,0,2022-07-20 19:42:20,来自浙江,10548656802,MILK777
7122048137648472863,演技都不错[赞][赞][赞][赞][赞][赞],0,8,0,2022-07-19 19:45:25,来自北京,2915540824492807,端庄海浪Ux
7122243895601906472,这个结局也就只能是电视剧,0,0,0,2022-07-20 08:24:55,来自甘肃,3879517227058928,cwsqh
7122007581698212648,牛哄哄的剧情,0,0,0,2022-07-19 17:07:41,来自云南,70187687934,五月的乔乔
7122244953413354272,最讨厌何幸运,0,0,0,2022-07-20 08:29:56,来自湖北,1626866219755799,安逸扑克Je
7122392755758334735,很好看的一部电视剧！[赞][赞][赞],0,5,0,2022-07-20 18:02:36,来自江苏,4577654254,心随我动44482537
7122036551601177379,一眼望到底的剧情不看,0,1,0,2022-07-19 19:00:21,来自安徽,59940637300,茉莉花香雨
7122248519368639273,这在社会中，都不现实啊,0,0,0,2022-07-20 08:42:50,来自北京,72594493813,开心的自在幸福
7122075414360916767,早就没看了，免得气人,0,2,0,2022-07-19 21:31:13,来自广东,67484756179,祺祺52099999
7122381667054043939,就我看不进去么[捂脸][捂脸],0,6,0,2022-07-20 17:19:24,来自山东,2691231228378974,乔小喘
7122102738334319360,比抗日神剧还神的剧,0,6,0,2022-07-19 23:17:16,来自内蒙古,3623607440255767,无双溪流iE
7122271618357297920,过于美化生活了,0,0,0,2022-07-20 10:12:26,来自辽宁,5948389768,奶茶72495418
7122066703597044483,这结局飘的有点过分了！,0,9,0,2022-07-19 20:57:42,来自辽宁,99288146133,小小龙的最终幻想
7122388525701481254,现代版万能女神神剧。,0,4,0,2022-07-20 17:46:38,来自四川,3757162793,外星人8848
7122408662185853696,关注下郑导的电视剧,0,3,0,2022-07-20 19:04:03,来自江苏,4001827072784424,24K永恒
7122397856027362088,这是郑导执导的最好的主旋律献礼剧。,0,3,0,2022-07-20 18:22:15,来自陕西,3927103025974883,快乐豆花rp
7122382251471799074,剧不错，天天全家人一块追,0,5,0,2022-07-20 17:21:51,来自河南,110524368290,努力只為明天
7122083584281789184,这个剧就是教人怎么发现问题再怎么教人打官司！,0,11,0,2022-07-19 22:02:28,来自山东,9177919292,我向心中无烦忧
7122383784263615243,传美偷走的不只是三年，更是秀玉的一生呐！,0,4,0,2022-07-20 17:28:31,来自四川,3997453644730915,兰芷若曦
7122198551848960772,这是第一次追颖宝的剧先是快进 后是弃剧,0,4,0,2022-07-20 05:32:08,来自四川,3936393094,Bellababe
7122417061359289099,看评论区基本都说这是部好剧，可惜没看，那就补看吧。,0,2,0,2022-07-20 19:37:28,来自青海,3781001480,ymt366
7122258545462051584,科幻片，灭霸看了都要说一句，服,0,1,0,2022-07-20 09:21:40,来自浙江,85074685974,人不如旧
7122381657050874636,没有看，不置评，抱歉！,0,2,0,2022-07-20 17:20:11,来自四川,56883656715,剑君虹云
7122381348954358539,完了就一起看,0,4,0,2022-07-20 17:19:22,来自广东,6749941206,南风知我意18
7122266694684312331,离谱到看不下去,0,0,0,2022-07-20 09:53:58,来自山东,4046652825670387,随性自由的星空w
7122386413932299022,还没看这部剧，更新完了，可以看,0,3,0,2022-07-20 17:38:10,来自广东,2018356999760540,弈轩竹
7122233638808634150,哎，这电视拍的，现实中这样的事多了去了，但是谁有主角光环呢,0,0,0,2022-07-20 07:46:11,来自辽宁,294288470844595,毛哥谈篮球
7122237715562709800,一集都没看完，看不下去[哈欠][哈欠],0,2,0,2022-07-20 08:00:53,来自河南,4238924019,只待时光静好
7122386246454117155,没看剧，不评价。,0,2,0,2022-07-20 17:37:14,来自安徽,2066676465540285,幸福崇左8F5
7122432969654207273,好多景点，都是在安徽绩溪龙川拍的[赞][赞][赞],0,1,0,2022-07-20 20:38:16,来自安徽,92362782118,朕274787718
7122419859413041961,都是比较熟悉的演员啊！,0,1,0,2022-07-20 19:47:28,来自河北,6887410917,李君昌1
7122107163983676168,不是童话是神话！,0,4,0,2022-07-19 23:35:12,来自天津,171138499230333,机智的饺子Ov
7122067049215673091,影视作品，图的就是个开心圆满！,0,7,0,2022-07-19 20:58:52,来自江苏,6936339114,Njct4501
7122294095238120229,各方利益都完美找到了归宿,0,0,0,2022-07-20 11:40:07,来自河南,102186727062,温柔圆月iD
7122216987623441164,还好吧，又不是古装非要弄个凄美或是不完美的结局？[思考][思考],0,0,0,2022-07-20 06:42:17,来自韩国,52021860163,爱擎儿
7122238677866316552,若即若离吧！既希望结局完美，又感到不符,0,0,0,2022-07-20 08:05:06,来自山西,6045788845,开馨77236475
7122342407496352512,结尾太仓促了,0,5,0,2022-07-20 14:47:07,来自北京,106879750324,一只特立独行者l
7122388545352467237,后面几集严重脱离不符合常理,0,1,0,2022-07-20 17:46:40,来自河南,2317369034680120,kingnethyh
7122381034955473701,请导演点评一下，最近几年抗战神剧，谢谢,0,1,0,2022-07-20 17:17:13,来自河北,2999067630897415,此西周非彼西周
7122380355226862377,一种感觉怎么样啊,0,1,0,2022-07-20 17:14:26,来自广东,3466096708687806,听风影视剪辑
7122288173140558629,农村更现实才对！,0,0,0,2022-07-20 11:16:52,来自湖北,88297633574,榖繁
7122270426126271243,除了电视剧，现实中任何一个都不会发生 任何一个,0,0,0,2022-07-20 10:08:40,来自江苏,58878221694,幸福漂流瓶Dg
7122203329375208233,去唐山试试,0,0,0,2022-07-20 05:48:26,来自浙江,7439812822,火云帅帅
7122240981671772931,万家庄石家庄,0,0,0,2022-07-20 08:14:41,来自河北,110741776833,FOS凤凰羽
7122384017818993441,喜欢罗晋,0,3,0,2022-07-20 17:29:14,来自江苏,5839675863,图图兔兔TuTu
7122399118823326494,演得很好,0,2,0,2022-07-20 18:27:23,来自广东,3835518476628686,自由梦想家fg
7122385510311609088,好看,0,4,0,2022-07-20 17:34:15,来自四川,3007907409964079,看戏子真多
7122380872342930217,广告,1,1,0,2022-07-20 17:16:36,来自山东,97099050253,在雨滴中
7122381924907107106,天天追剧,0,4,0,2022-07-20 17:20:23,来自河南,85158986369,竹子的日常生活
7122373033733669662,非常棒,0,6,0,2022-07-20 16:46:08,来自天津,6716160201,老艺术家ws
7122078153400926991,爽剧,0,1,0,2022-07-19 21:41:34,来自湖北,2207439416740696,才高八斗远山sC
7122058129831117605,完美童话,0,3,0,2022-07-19 20:24:00,来自河南,17322060529,来日从不方长
7122211548281651979,神剧,0,0,0,2022-07-20 06:21:15,来自北京,4072178909451479,优美原野rw
7122082287613035294,电视嘛,0,0,0,2022-07-19 21:57:57,来自福建,52387010247,那五这六
7122032314758005539,你这从哪搞的剧透,0,3,0,2022-07-19 18:43:36,来自北京,642569440854560,叚丏killua
7122038718076322574,开挂人生,0,3,0,2022-07-19 19:09:03,来自江苏,62376297741,蓝翼179319447
7122012079091335951,弃剧了，没结婚前在娘家没啥风声，结了婚在婆家能的不得了，太假了吧,2,3,0,2022-07-19 17:25:20,来自安徽,23330317363,桨叶
7122070650155549444,秀玉怎么读的，28重新考吗？要不要这么假,2,0,0,2022-07-19 21:12:49,来自四川,108743993370,wallacec
7122320050648236837,女主被神化得无所不能，而且一路有神助推，这个假得离谱了[捂脸][捂脸][捂脸],0,2,0,2022-07-20 13:20:44,来自江西,86572645471,寒柳joy
7122013072935371554,和现实生活对比太假了[不看][不看][不看]电视剧就是电视剧,1,2,0,2022-07-19 17:28:55,来自福建,102190125008,优雅葡萄8ZZ
7122048718727463715,秀玉28岁农村已经是大龄剩女了吧,9,10,0,2022-07-19 19:47:29,来自江苏,98020290762,莔月769
7122279573580022562,何幸福演技真是无语，从头到尾就两个表情，笑或者皱着个眉头，也没有眼神和情感交流互动,0,1,0,2022-07-20 10:43:18,来自北京,62619773625,hjimmj
7122094653432070943,结局太假了。,0,0,0,2022-07-19 22:46:12,来自云南,63102107290,当归小姐姐
7122156381830447909,这个剧情假的不能再假了,0,0,0,2022-07-20 02:56:27,来自重庆,5571715020,时间2022
7122058113988952871,这个太理想化了就太假了,0,2,0,2022-07-19 20:24:14,来自江苏,5729393617,清水1983
7122381974798746408,看着很来气[捂脸][捂脸][捂脸],0,0,0,2022-07-20 17:20:42,来自四川,462256050019549,-：
7122452957026599714,[耶][耶][耶][耶][耶][耶][耶],0,2,0,2022-07-20 21:55:47,来自浙江,2462542164662792,自由的柳叶su
7121500453019583240,两个人把身份证互换了不就行了。我同学两兄弟，就是哥哥拿着弟弟录取通知书去上大学，弟弟第二年重考。两个人从此就把身份互换了。,11,3,0,2022-07-18 08:20:41,来自广东,57781190686,蹭蹭小南瓜的童年
7121562275336438541,幸福也没见讨什么公道了，就是去吵了一架,2,0,0,2022-07-18 12:19:59,来自广东,61113096160,智者精灵H
7122663448302846750,何幸福之前只交了入党申请书，就当上村支书了！何幸福是虚构的人物，现实不存在，主要是弘扬敢想敢干带领村民脱贫致富的精神。,1,4,0,2022-07-21 11:33:03,来自广东,62564194652,奇妙水滴Wq
7121975056662151943,我喜欢这部片，就是因为幸福能够勇敢地争取权益，而不是和稀泥。,1,31,0,2022-07-19 15:02:28,来自福建,4470857375,我在四线小城
7121966460004156194,说得好，坚持对的，是我们不该忘记的初心,0,28,0,2022-07-19 14:28:35,来自北京,2771212764448352,扎西德勒
7122459044488463111,你想是个什么结局呢？这个结局很好啊，坏人得到惩罚，好人带着村庄前进！,2,49,1,2022-07-20 22:19:55,来自辽宁,4195334714301502,幸福已经到万家
7122135008030589730,这部剧从头到尾都在讲道理看见都烦，看见何幸福就更讨厌,3,1,1,2022-07-20 01:25:46,来自四川,60628477400,柒柒223490092
7122395183274574607,把我们农村人的状态拍得特别真实，是一部好剧。希望以后郑导有更多的好作品，关切社会，充满希望。,0,3,0,2022-07-20 18:12:05,来自山西,395463603809918,凉风习习吹过
7122576557813908265,赵丽颖不是流量女星？,4,10,0,2022-07-21 05:56:27,来自山东,10091281828,Gemininana
7122732546986951465,我已经好久不追剧了，即使看电视剧也是要等全部更新完才看。而我喜欢赵丽颖，也喜欢赵丽颖演的每部剧，因为赵丽颖我看了幸福到万家，这部剧深深地吸引我了，每天等待2级更新，不知不觉就跟完了，还有点意犹未尽的感觉。赵丽颖饰演的何幸福从农村来到大城市努力的学习、活着，那种农村人踏实朴实的劲，让我喜欢。最终终于活出了自己想要的样子。结局虽然很圆满，但是突然就结局了，太仓促了。,0,0,0,2022-07-21 16:01:13,来自辽宁,108193417284,A柠檬嘟嘟
7121518269441557263,剧还没结束呢,2,2,0,2022-07-18 09:29:10,来自广东,2251390440177728,多才明月u
7122092461882917666,那些嫌弃他烦的，一定不是吃亏的老百姓，不是走投无路无人帮出头的农民，他们一定是怕被告的人，不然为啥这样一个勇敢有担当把老百姓放心里的热心人，会被嫌烦？电视剧的导向很明显，有些人太悲观，太冷漠,0,10,0,2022-07-19 22:37:10,来自安徽,52598451469,十一138754270
7121994225574871808,幸福以一人之力捣毁了万家集团,1,22,0,2022-07-19 16:16:04,来自北京,58255766088,昔年种柳矣
7122606989691093795,好剧，喜欢正能量满满的幸福。,0,17,0,2022-07-21 07:53:50,来自北京,104818862901,我和心情
7122571736352064290,人世间才是真正不靠流量明星的一部好剧,1,15,2,2022-07-21 05:37:48,来自上海,109623544174,勇者云朵k8
7122255951654830862,真的要向万善堂道歉，之前看剧总觉得他不讲理，踢伤庆来，闹婚的时候黑白不分等等，但后来随着剧情发展，发现他真的是个好人，为了万家庄发展，没时间陪伴儿女，亲自举报自己的儿子，真的是好干部,2,9,1,2022-07-20 09:12:24,来自吉林,91629311848,雪萌萌love
7121984434089460495,现实社会需要多点何幸福,0,21,0,2022-07-19 15:38:01,来自四川,3395711726531358,笑看愚人不自知
7122021495601365763,她比较适合联合国秘书长。,7,76,1,2022-07-19 18:02:17,来自河南,86554354753,驿外断桥边
7122593575392527108,是不是要最后成悲剧了就不烂尾？现在人心态怎这样，就见不得别人好[笑哭]你要知道这里面的坏人也不是十恶不赦的死罪，只是每个人立场不同，有些人为了利益触犯了法律那肯定要受法律制裁。,1,27,3,2022-07-21 07:03:00,来自湖南,2167864886312558,a七月微凉
7121985818268730153,那些说何幸福烦的人我想都是不看电视剧的，这部电视剧只要想表达的是一个理字，有理走遍天下，要学会用法律来保护自己,0,19,0,2022-07-19 15:43:29,来自广东,51422108153,珍惜每一天846
7122087506611028736,虽然做的对，但为什么又是她而不是别人，打官司上瘾？,1,3,1,2022-07-19 22:17:58,来自河北,108956883128,踏雪远山
7122431445611922215,万能的何幸福，脱离生活。,1,4,0,2022-07-20 20:33:08,来自吉林,52482379862,平平安安年复年123
7122384993036616463,非常棒的电视剧！结合当下新农村新建设新面貌！,0,4,0,2022-07-20 17:32:22,来自山东,110936549475,书瑶之悟书
7121595475631260456,秀玉高中毕业有身份证了吧，她只是自己没上大学，但已经是大学生了，如果秀玉去找工作，是不是就是大学生了,1,0,0,2022-07-18 14:28:44,来自浙江,571370282700462,妙盈纺织
7122339288796693280,可能普通老百姓6、7分水平的“认真”过日子过习惯了，突然有人9、10满格的“认真”就让很多人不习惯了，认为太轴太计较，但这里面的错、对与否，根据自己的情况而定吧。十分清醒也是过，三分糊涂也是过……个体有差异，事事皆不同……,0,0,0,2022-07-20 14:36:06,来自甘肃,1838829150150029,颜斌的影视空间
7122430011709326088,结局真的是很令人愉悦！满满的正能量！这才是中国好干部，中国新农村！借用幸福的话，明天更美好！,1,1,0,2022-07-20 20:27:06,来自河南,5775949515,朕不一样
7122677115950727977,这剧应该叫幸福开挂[笑哭]你是置疑小赵的流量？,2,1,0,2022-07-21 12:25:53,来自贵州,4353666547982925,自若叶子fX
7122261685943370532,可以当村主任。,1,0,0,2022-07-20 09:34:36,来自新疆,79151264646,方去去去去
7121775932797076232,说不准最后就是秀玉网红的身份揭开了这事呢,0,1,0,2022-07-19 02:18:35,来自意大利,5233742188,明其心
7122661522303894307,没有赵丽颖才是没流量明星,1,2,0,2022-07-21 11:25:22,来自江苏,6568046660,幽兰96361350
7122390533183390498,刘威就是万书记演的太好了,0,2,0,2022-07-20 17:53:46,来自四川,87074456903,（四哥副食店）春
7121986661533336355,铅污染，危害到生命的事难道还是小事吗？为什么不告？,0,14,0,2022-07-19 15:46:37,来自广东,1503772452852192,阡阡陌0115
7122390717317563149,刘威就是万书记演的太好了,0,3,0,2022-07-20 17:54:37,来自浙江,100227575086,自足常乐2007
7122380581362942727,非常棒的电视剧！结合当下新农村新建设新面貌！,0,4,0,2022-07-20 17:15:49,来自山东,103080412285,端庄宝贝
7122657659567784719,这剧老戏骨们都很出彩。特别是幸福的公婆。太可乐了。,1,1,0,2022-07-21 11:10:19,来自江苏,2173057375419992,宇宙第一可爱的奶牛猫
7121486381389480715,我去，现实中发生了那么多起，难道这些人都是孤老终身，没有结婚的吗？,3,4,0,2022-07-18 07:26:30,来自上海,102292937768,书生灬
7122603401602728735,幸福到万家好看[鼓掌][鼓掌][鼓掌],0,15,0,2022-07-21 07:40:40,来自浙江,56419971928,虫虫踢飞碰瓷绿茶咖
7122389320975483687,三观很正，引领农村人积极向上的一部好剧！幸福婆婆神一般的演技，太贴近生活了，谢谢郑大导演，,0,3,0,2022-07-20 17:49:51,来自广西,1094764069913788,罗世招
7122662406312149799,不是吧，小赵没有流量？,1,2,0,2022-07-21 11:29:36,来自北京,347101260687566,吃泥巴的小土豆
7122368304178234126,看看那些三观崩坏的评论，就觉得好无力啊！幸福是让我们明白，有些事必须有人做，公平和正义是需要去争取，需要勇气的。我们大部分人都不能成为幸福，但我们可以心怀希望。作者说得很好！,0,0,0,2022-07-20 16:28:05,来自山东,13429203702,安安安全
7121564629918614272,这就是现实，不是所有的都是美好的,1,2,0,2022-07-18 12:28:53,来自重庆,62940139943,掉线好帅
7122318174015701764,不觉得，人世间的事十之八九不如意，只是大多数人都妥协了……，真希望自己能有幸福这样的能量和勇气，所以爱看,0,2,0,2022-07-20 13:13:03,来自新疆,6204292296,在云端ycy
7122420711574209316,郑导，谢谢您的辛苦付出，很好看。唯一的不足是何幸福，如果是何泓姗演会加分很多。,0,0,0,2022-07-20 19:51:09,来自广东,352294526269438,动感XMM
7121661969937400576,她怎么是黑户，她凭身份证可以把学历都拿过来找工作。别人替她学，她就直接用好了，不方便的是万传美。我觉得换回来才不好呢。,0,0,0,2022-07-18 18:46:39,来自江苏,6523295499,方法要比困难多很多
7122459755649647372,"1.你怕是不知道什么叫第一责任人吧
2.变化是漫长的，总有压死骆驼的最后一根稻草
3.秀玉自己被骂也不还嘴就怕传美活不下去，是人都会有触动，再说了，假的人生，提心吊胆
4.成人也可以考大学啊，怎么了",4,26,1,2022-07-20 22:22:57,来自河南,2918511151,洛水清源
7122012259870016297,总有人在坚持,0,9,0,2022-07-19 17:26:02,来自湖北,111410727879,林意泠泠
7121857192097678121,大结局了吗？请你看完再发言…………,0,0,0,2022-07-19 07:24:43,来自北京,2771212764448352,扎西德勒
7122631573350105886,十年前考上大学现在才去旁听，知识早就更新了，她还跟得上吗？,1,5,0,2022-07-21 09:29:40,来自上海,1156337449575918,城市老炮
7122636794994361129,这部剧实际上就是一部乡村普法栏目剧。从最初的闹婚到结尾的集体诉讼，贯穿始终的都是起诉、官司，最终也是何幸福赢了官司、赢得民心。其实按照常规做法，谁也不会去打最后的官司，但如果剧情不这么写也就起不到普法和宣传新时代、新农村、新女性的目的了。所以看这部剧不要太较真。,0,5,0,2022-07-21 09:49:02,来自北京,92654810390,建筑工程老炮儿
7121992860899296015,秀玉找男朋友了吗,2,1,0,2022-07-19 16:10:45,来自河北,2630500291710247,1928073378348
7122459597465961229,确实很牵强,0,27,0,2022-07-20 22:22:14,来自湖北,77350657208,88252332194
7122764925277405959,怎么会呢？秀玉的户口和身份是一直都在的只要传美不在使用秀玉的身份就不会在对秀玉造成什么影响力了，而且为什么一定要打官司呢最后两人和解传美归还身份承认错误不好吗,0,0,0,2022-07-21 18:07:06,来自江苏,4403922570,Aiyi推理社
7122219368780006158,至少两年才能成为正式党员,1,5,0,2022-07-20 06:50:51,来自甘肃,1516953343893227,江湖孤客
7122698911080923944,好剧 全员演技在线 看完印象深刻 正能量满满,0,0,0,2022-07-21 13:50:45,来自四川,100954507061,友爱画板Az
7121985841563681571,幸福这是一直把万家集团搞垮才算完吧[捂脸],1,38,0,2022-07-19 15:43:27,来自山东,12747812655,寂寞奥运
7122390294524052228,良心好剧！看到了文娱产业应有的责任和担当，期待更多的好作品！[赞],0,3,0,2022-07-20 17:54:01,来自贵州,105052875608,在水一方天上人间
7121986383426306824,有些事情可以忍让，有些事情必须争,0,9,0,2022-07-19 15:46:25,来自山东,1433384619613847,随机生成ba
7122380545899709225,时代的好剧，贴近生活，了解了农村生活不断提高过程。,0,3,0,2022-07-20 17:14:58,来自广西,2173052585518643,微笑海浪AD
7121524005697880867,对这就是正能量吗？,1,0,0,2022-07-18 09:50:43,来自山东,106039957313,果断的樱桃1
7122606974423794471,这剧是主旋律命题任务剧，所以最后的结局一定是要符合主流价值观的认可的，这么收尾挺好的，,0,13,2,2022-07-21 07:54:29,来自江苏,51223902553,00往事随风oo
7122637260264391461,你自己说啥结局才是不烂尾？？,0,6,1,2022-07-21 09:50:48,来自北京,105384719777,小羊羔的奇思妙想
7122240953011864335,如果一个片子要反应很多问题，就得把问题都放到一个人身上，就觉得不真实，可是这不就是电视剧该告诉我们的吗？,0,2,0,2022-07-20 08:13:23,来自河北,92140078285,雨寒434
7122380255616795427,良心好剧[赞][赞][赞][赞],0,2,0,2022-07-20 17:14:12,来自浙江,84007754449,爱吃的小贝尔
7122649016852808484,好剧，正能量满满，振兴乡村，法治社会,0,5,0,2022-07-21 10:37:31,来自浙江,105150143572,蓝色风情59
7121722921655026446,人性不堪一击,0,1,0,2022-07-18 22:43:56,来自浙江,5867115195,乐天派精灵QT
7122517938573394729,大团圆！什么烂尾！,0,24,1,2022-07-21 02:13:17,来自广东,2251390440177728,多才明月u
7121703184682500901,昨天看的很生气,0,1,0,2022-07-18 21:26:44,来自江西,55869893259,方外雅肆
7121516108431344387,现实中那些顶替别人上大学哪个不是好生活？结婚生子哪个耽误了？你以为结婚的人真不知道他们的真实情况？没钱没权的哪个能顶替的了？[抠鼻],1,2,0,2022-07-18 09:21:39,来自河北,7651925,一水云渊
7122030752979682051,现实生活中像何幸福这样的人在村里是很艰难的，会被人玩残，人性就是这样,1,16,0,2022-07-19 18:38:22,来自江西,51143886817,不获全胜不收兵
7122029786066715432,这电视剧实际上看着挺无趣的,2,16,0,2022-07-19 18:33:57,来自安徽,55670820596,大很牛
7122487768676647719,这个结局很棒,0,26,1,2022-07-21 00:13:59,来自福建,56005134038,_Ps148625152
7122629077197914880,这就是当下社会需要的吧，我们有时候已经不愿意相信社会依然有美好，也不相信有何幸福，只是因为我们认为不可能，不可能做到电视里那样，唉，还是人变了呀,0,5,1,2022-07-21 09:19:25,来自安徽,52598451469,十一138754270
7121705568926368551,现实中无法解决现实问题，河南张娜娜案例连要求13元的赔偿都没有实现。编导也无能为力！,0,2,0,2022-07-18 21:36:15,来自辽宁,2642879388329580,闲人老王123
7122228036699423524,圆满，幸运也及时止损，扎回了曾经的高马尾，并且去了方圆律师事务所上班，真好,0,5,1,2022-07-20 07:24:24,来自吉林,91629311848,雪萌萌love
7122401109318599431,三观很正，引领农村人积极向上的一部好剧！幸福婆婆神一般的演技，太贴近生活了，谢谢郑大导演，给你点赞！[赞][赞][赞][赞][赞][赞],0,2,0,2022-07-20 18:35:18,来自甘肃,756097517628573,tfr腾684781714028
7122652041659040547,是不是现实生活太苦了，接收不了好的结果[呲牙],0,3,0,2022-07-21 10:48:47,来自山西,80390305201,爱生活的悠闲小兔
7122686232383718144,不管结局是什么样 都会有观众觉得不够好 每个人都有不同的看法 开开心心看剧就好了 想那么多干什么[捂脸],0,1,0,2022-07-21 13:01:23,来自四川,109591324939,夏彤心语
7122617211831026470,非常好的一部励志剧，社会需要这种正能量👍👍👍,0,10,1,2022-07-21 08:34:21,来自云南,1983136685636935,又又e9Ia
