7122380996112352041,[玫瑰][玫瑰][玫瑰]为郑晓龙导演和剧组点赞！辛苦了！《幸福到万家》，带领大家见证乡村振兴事业事业的蓬勃进展。祝福伟大的祖国，日新月异，繁荣昌盛、国泰民安！,0,139,0,2022-07-20 17:16:52,来自陕西,2590084826406547,秦观鹊桥仙
7122370576714842910,三观很正，引领农村人积极向上的一部好剧！幸福婆婆神一般的演技，太贴近生活了，谢谢郑大导演，给你点赞！[赞][赞][赞][赞][赞][赞],1,91,0,2022-07-20 16:36:44,来自山东,1094767428779035,爱夜跑的勇士
7122300750445249321,郑导，谢谢您的辛苦付出，很好看。唯一的不足是何幸福，如果是何泓姗演会加分很多。,38,113,0,2022-07-20 12:05:28,来自内蒙古,4217344915938867,喵喵爱吃丸子
7122384557772391203,婆婆演技太真实了,1,42,0,2022-07-20 17:30:36,来自上海,5985317146,米蓝C
7122379775310005027,郑导，谢谢您的辛苦付出，很好看，如果是何泓姗演出就不会好看，还是赵丽颖出演很成功量身打造经典剧。,2,56,0,2022-07-20 17:12:18,来自天津,99455250126,聪颖的我是我
7122381093059167011,喜欢看农村电视剧，我是奔着赵丽颖去看的,1,22,0,2022-07-20 17:17:06,来自广东,6198334456,夏雪82016635
7122388335066612511,郑导确实拍什么都好看，每个演员和相应的角色都非常到位，人物立体丰满，太好了[比心][赞]郑导确实拍什么都好看，每个演员和相应的角色都非常到位，人物立体丰满，太好了[比心][赞][赞]今夏谢谢郑导给观众带来了不一样的何幸福[鼓掌][鼓掌],0,55,0,2022-07-20 17:45:44,来自浙江,56419971928,虫虫踢飞碰瓷绿茶咖
7122323632046932736,刘威就是万书记演的太好了,0,133,0,2022-07-20 13:34:16,来自辽宁,105138939845,小布点益智玩具C3-109-110
7122387041861649187,"《幸福到万家》这部电视剧，把农村的事情表现得栩栩如生，展现了农村的发展和进步！更是展现了农村现代女性的奋斗向上精神!
 优秀的剧本，!优秀的导演!优秀的演员!
一句话:整个优秀的团队!
为您们点赞！[赞][赞][赞]",0,23,0,2022-07-20 17:40:22,来自江西,6715911650,土楼7
7122301051508212480,良心好剧！看到了文娱产业应有的责任和担当，期待更多的好作品！[赞],0,71,0,2022-07-20 12:06:43,来自江苏,2999099330411790,SUMON
7122375941825004295,书记和幸福的公公婆婆和老公都是演技派[赞][赞][赞],0,58,0,2022-07-20 16:57:28,来自四川,6006089647,1571942088
7122366419635340044,一直以来都喜欢看郑导的剧，这部剧几年前剧透一下，今年终于播出了，收视率挺高的，也是我近期一直在看的电视剧，演员们的表演都很到位。赵丽颖也是我非常喜欢的演员。,0,36,0,2022-07-20 16:21:16,来自黑龙江,62073674137,安然准是和悦
7122355620917084939,良心好剧，演员各司其职演的都很好，郑导辛苦了。赵丽颖演的也很出色也没表演痕迹。没看够结束了,0,38,0,2022-07-20 15:39:03,来自北京,104899842655,子楠Aisha
7122367937578894116,赵丽颖演的很好，演什么像什么，反正我喜欢,0,47,0,2022-07-20 16:26:21,来自山东,15033385236,风清132440851
7122314783172444932,正在追的一部好剧[赞],0,61,0,2022-07-20 12:59:26,来自上海,61698255548,娜是小白兔
7122356536403886861,看到后面太不真实了，幸福就是无所不能，神剧🤔,4,38,0,2022-07-20 15:42:21,来自浙江,6793499171,淺唱那简单的啈諨
7122330563054748447,良心好剧，郑导真棒👍🏻[呲牙][呲牙],0,46,0,2022-07-20 14:01:03,来自浙江,2802000082253294,我一见你就笑987
7122354925895959326,郑导确实拍什么都好看，每个演员和相应的角色都非常到位，人物立体丰满，太好了[比心][赞][赞],0,38,0,2022-07-20 15:36:00,来自江苏,6220923423,绿色田园82702054
7122176877942932239,剧情简直离谱，拿观众当傻子。早弃剧了。,5,65,0,2022-07-20 04:10:12,来自海南,57575941510,阿古Y
7122381268910179102,把我们农村人的状态拍得特别真实，是一部好剧。希望以后郑导有更多的好作品，关切社会，充满希望。,0,17,0,2022-07-20 17:18:19,来自天津,201920991999678,路过一只叫花鸭
7122397836272665344,今晚最后一集有点恋恋不舍，演员表演精彩，好想继续看下去，精彩的一部电视剧，期待郑晓龙导演下一步电视剧[比心],0,6,0,2022-07-20 18:22:20,来自天津,4595169632,长乐萍萍45334021
7122006682527515433,理想化的结局，但现实中像何幸福这样的人能走这一步吗,2,8,0,2022-07-19 17:04:18,来自甘肃,94326778607,冰凌儿3708
7122080721933959939,今天看了不到一集，弃剧了，幸福太厉害了，太不真实了,2,40,0,2022-07-19 21:52:05,来自新疆,75624606424,汤姆281
7122380569115493151,良心好剧，喜欢郑晓龙导演的作品👍🏻[呲牙][呲牙],0,16,0,2022-07-20 17:15:43,来自上海,96785904634,酸龙拿走
7122387136879362857,期待导演和赵丽颖再次强强联手，创造佳作。,0,17,0,2022-07-20 17:40:42,来自河北,3029900330284796,拂柳素手挽清风
7122382850984526627,一部接地气的好剧,0,19,0,2022-07-20 17:24:00,来自江苏,25987779148157,可爱塞莉斯廷3U
7122102802579178240,所以不追了，要在现实，这婚早离八百回了，还二胎,1,15,0,2022-07-19 23:17:47,来自广西,2774795658991804,你都做些什么梦
7122335667929383711,演员的演技令人折服！把人物特点鲜明地表现出来。,0,17,0,2022-07-20 14:21:09,来自河南,104837328613,轻风拂柳x
7122258466001224489,觉得剧情假的，可以看玄幻、古装、推理、青偶，毕竟那些都是真的~,1,12,0,2022-07-20 09:21:28,来自河北,1068377870172974,yin陌
7122387756830950152,郑晓龙导演太厉害了，选的演员都不错，演技都很到位,0,7,0,2022-07-20 17:43:16,来自江苏,3350183738,智者咖啡Jw
7122380713004974863,谢谢郑导给我们呈现这么好的作品，很期待你跟丽颖合作下一部剧哦,0,16,0,2022-07-20 17:15:45,来自广东,95492687442,颖火漫天
7122334376079246120,难得的好剧，真实可信,0,23,0,2022-07-20 14:15:57,来自云南,86982340001,桃李不言
7122043617707311902,就是现实中没有幸福这么正直为了正义而坚持并且有大格局的人，不是为了小家，而是为了大家。总之感觉，不管怎么拍都有不同的声音，喜欢的就喜欢，不喜欢的总有各种看点去嘲讽也好。电视剧而已，现实做不到的事才让人在剧里看到真善美。,3,46,0,2022-07-19 19:28:01,来自福建,54975331803,妤194202033
7122381132729647906,良心好剧，很真实,0,11,0,2022-07-20 17:17:35,来自山东,92692739252,大吉大利456238
7122366526728045344,很真实也很现实的农家剧！,0,14,0,2022-07-20 16:21:13,来自江苏,72641032071,梅花香自苦寒来
7122395482324222720,很喜欢看这部剧，特别是赵丽颖演的女主何幸福！农村生活的真实写照😊👍,0,4,0,2022-07-20 18:13:05,来自河北,4451283587825869,旅人的日记
7122365459697353475,非常棒的电视剧！结合当下新农村新建设新面貌！,0,18,0,2022-07-20 16:17:15,来自上海,105226363341,清风Shelly
7122077206112928542,刚开始挺好的，后面的剧情越来越拉胯，过份理想主义[捂脸],0,114,0,2022-07-19 21:38:09,来自福建,2334979291874900,馆长大人姓李
7122433908385825536,幸福到万家立部剧真心好看，贴近生活，其中我最喜欢的人是何幸福。,0,4,0,2022-07-20 20:41:59,来自贵州,72883272522,健康是福237901039
7122381722779419429,这部剧不错，值得观看[赞][赞][赞][赞],0,10,0,2022-07-20 17:19:55,来自河南,1635676189885600,户金色年华
7122389399446438687,[鼓掌][鼓掌]讲得好，这部剧里的农村跟我们湛江靠海的农村不一样的好漂亮[赞],0,6,0,2022-07-20 17:49:44,来自广东,109593575652,老妖精ye
7122008598846685987,这个结局公平,1,7,0,2022-07-19 17:11:53,来自重庆,92518971134,多才多艺豆花JQ
7122020516378379047,为什么大家总是关注主角光环？电视剧是浓缩升华的社会现象，反应社会现实的同时还要给人以启迪，能引起共鸣的就是不错的，所以会有很多事情集中在一个人或几个人身上。其实电视剧就是要告诉人们，在社会发展的过程中会存在这样那样的问题，需要人们坚持正义，共同监督，共同进步，发现问题并解决问题，让社会变得更好，让自己变得更好，大家的生活也会更好。,0,3,0,2022-07-19 17:58:48,来自辽宁,108965662050,看着你的眼睛LK
7122109279674614531,幸福和庆来没离婚我就看不下去,2,26,0,2022-07-19 23:44:09,来自河北,2493281749176179,温柔河流Y
7122383361972421383,很好看，情节吸引打动人，传递正能量。编剧导演演员都好，再多几集看着就更好过瘾了。好看的电视剧实在太难找了。,0,1,0,2022-07-20 17:26:09,来自广东,61894058668,平凡的3282
7122353397462139685,这不叫成长，这叫菩萨下凡开金手指！,1,9,0,2022-07-20 15:30:03,来自江苏,56610620273,豆豆小猫18
7122380447132189470,郑晓龙导演确实太厉害了。,0,11,0,2022-07-20 17:14:54,来自广东,1486975090039031,长腿情感
7122397078000501534,幸福到万家，听名字就幸福满满啊！期待有好的生活感。,0,5,0,2022-07-20 18:19:26,来自辽宁,88629523802,辣妈―ZCY
7122011675288666880,主角光环太严重，不接地气了,1,11,0,2022-07-19 17:23:39,来自北京,1196693881096685,圆咕隆咚丁冬冬
7122382611531973412,太喜欢看了，我和婆婆一起看，跟随着里边的喜怒哀乐，跟着哭，跟着笑,0,9,0,2022-07-20 17:23:42,来自黑龙江,111110170307,宫本武藏用户
7122410866054054693,好看，通过每一个演员的出色演绎描述这每一件真实的农村故事。好看。,0,6,0,2022-07-20 19:13:14,来自天津,61495585432,A老马3
7122386577632297766,三观很正，是部反映社会主义新农村的好剧。《幸福到万家》的剧名好。,0,10,0,2022-07-20 17:39:30,来自广东,1935569719404711,用户粤桂7446
7122362178438660897,时代的好剧，贴近生活，了解了农村生活不断提高过程。,0,17,1,2022-07-20 16:04:34,来自辽宁,5818316580,风景如兰12
7122414818661434148,谢谢郑导，很喜欢你拍的电视剧。此剧中每个演员都很出色，天天追剧着急的很，今晚终于有结果啦。感谢(*^_^*),0,3,0,2022-07-20 19:28:43,来自江苏,1798454038762680,卢家老四
7122381482718987008,《幸福到万家》演员都演得非常好，每一个角色都演得非常出色！,0,9,0,2022-07-20 17:18:49,来自上海,52338264158,微笑75717
7122434347374478095,喜欢看幸福到万家这部剧是奔着赵丽颖去的。,0,4,0,2022-07-20 20:43:47,来自贵州,72883272522,健康是福237901039
7122077773405438752,编剧太尴尬了,1,18,0,2022-07-19 21:40:41,来自辽宁,7007528065,liumaoh
7122399546654966566,演员都很入戏，很接地气。为郑导点赞！,0,5,0,2022-07-20 18:29:22,来自山东,91964550594,李先维993
7121998203918729995,电视剧看看就好，还是要努力奋斗，保持真善美的。,1,20,0,2022-07-19 16:32:26,来自河南,4275330161051950,温暖的汤圆
7122380467403883298,良心好剧，真的好喜欢看[呲牙][呲牙],0,8,0,2022-07-20 17:14:59,来自江西,93406290857,小雅的生活记录
7122386311004259109,总的感觉不错，但不知为什么总想到《秋菊打官司》，是同一部小说改编的吗？,1,1,0,2022-07-20 17:37:49,来自青海,96498699031,青溜溜的海
7122034554151945000,现在电视剧，什么都可以洗白，总是好人和坏人团员融洽,2,31,0,2022-07-19 18:52:33,来自河南,59169008381,博学的糯米V
7122332456556036899,看了一下挺好看的,0,12,0,2022-07-20 14:08:35,来自广东,1560950427366039,海焕
7122369276970844928,挺好的一部剧[赞],0,13,0,2022-07-20 16:31:16,来自陕西,52507617858,某某加贝
7122276782090814246,最后这几集都没看，觉得不好看,1,1,0,2022-07-20 10:33:38,来自浙江,66598096412,善良梦之蓝
7122430662090703620,我的时间太紧了，农村题材就不看了，没时间，喜欢孙俪演的，郑导的古装剧那才好看[大笑],0,0,0,2022-07-20 20:29:55,来自上海,59477597872,跟党走没错的
7122381274685457185,神剧无疑。,1,2,0,2022-07-20 17:18:48,来自山东,106039957313,果断的樱桃1
7122393802316940065,从导演到演员都完美无瑕等第二部的到来,0,5,0,2022-07-20 18:07:31,来自天津,24058899758,爱吃鱼的小白兔822
7122383026222482212,一改往日农村题材的剧情，是比较真实的农村体验，希望我们的农村，早日实现剧中生活。,0,9,0,2022-07-20 17:24:58,来自甘肃,92658363160,一林的慢生活
7122384621954188044,😁幸福😁千万家，国家富👍强→国家👍强大！人民安居乐业笑开了🌸花！,0,9,0,2022-07-20 17:31:41,,2938321976955539,睿智奶茶K
7122034340183196454,万传美用了人家的身份，没被爆出来吗,1,28,0,2022-07-19 18:52:04,来自山东,3608634670,代号光橙
7121999649066042116,结局虽说圆满，但是过程太痛苦！果断弃剧了！！,4,6,1,2022-07-19 16:37:59,来自浙江,6061951498,美丽心情81
7122324147224544036,确实拍得好！您就是质量的保证啊！,0,11,0,2022-07-20 13:36:09,来自安徽,110931670246,阿蘅77
7122337025314865953,好看，停不下来,0,8,0,2022-07-20 14:26:47,来自江苏,93582575637,niyaokuaileya
7122366478062060322,很不错的剧，原来想小赵不适合演农村女，多看二集被她折服了，小赵真的很自然，没有表演痕迹[赞][赞][赞][赞][赞][赞],0,13,0,2022-07-20 16:20:42,来自福建,104940658617,端庄蜻蜓3b
7122389194621780777,幸福到万家，这电视剧满好看的[赞][赞][赞],0,4,0,2022-07-20 17:48:38,来自上海,2058751443738667,洁
7122359696526459682,这部剧除了女主幸福代表下游村民与万家村打官司经不起推敲外，其它应该说都不错。如果这部分内容处理的更加合理，这个电视剧应该会是精品。,1,9,0,2022-07-20 15:54:17,来自辽宁,55178475162,博学的晚风yP
7122054318609924900,整部剧就跟闹着玩一样，闹着闹着就完了[灵光一闪][灵光一闪][灵光一闪],1,104,0,2022-07-19 20:09:34,来自山东,66404399222,蜗牛2226
7122414495796445952,郑晓龙出手就是经典，再加上一群好演员演技的加持，不火不行。[赞][赞][赞][赞],0,2,0,2022-07-20 19:26:48,来自河北,483419244998704,可爱的波斯猫喵喵喵
7122384347478360869,最主要是正能量满满，保持初心，三观正，没有谈情说爱，没有离婚，教育深刻！,0,8,0,2022-07-20 17:30:05,来自广东,927590853640542,正直水滴O9
7121999485978903334,开始看着还励志，后来越看越觉得是幸福毁万家！,4,32,0,2022-07-19 16:37:23,来自山东,4015064596885308,尘世烟火轻描淡写
7122393619444908834,太喜欢这部剧了，真是看了又看[呲牙][呲牙][呲牙],0,4,0,2022-07-20 18:05:54,来自江苏,93431532252,满天星67460
7122380686744765214,好不舍，期待郑导与丽颖的三搭,0,5,0,2022-07-20 17:16:07,来自陕西,85803527928,莫失莫忘粽粽
7122392759034118952,良心好剧[赞],0,4,0,2022-07-20 18:02:36,来自广东,96523006312,向阳而生的子墨
7122395728785392416,现实生活中，很矛盾，人人都不想当幸福，可人人都希望周围有幸福……希望这部剧能激励更多的人勇敢坚持自己，相信公平、正义，我为人人，即是人人为我！,0,4,0,2022-07-20 18:14:29,来自河南,2918511151,洛水清源
7122399850221699873,刘威演的最好，那眼神，那表情，教科书级的,0,2,0,2022-07-20 18:30:34,来自湖南,66485699583,解读领袖语录
7122382618196656937,一部有温度，有深度的作品[赞][赞][赞],0,8,0,2022-07-20 17:23:14,来自四川,2392150536622315,cuncao寸草
7122009703395590926,理想化的结尾，其实，现实社会中是唐山四个被打的女孩，到现在都不知道什么情况,1,5,0,2022-07-19 17:16:37,来自北京,63213244962,乐吾天LwT
7122118445596328716,看的过程心里挺复杂，挺窒息，但是也在不断问自己：如果是我面对这些问题，我会像何幸福那样斗争到底，还是受着委屈也要息事宁人？电视剧既要展示现实问题，更重要的是要有导向作用，也就是价值观的引导。我觉得《幸福到万家》做到了，起码它让我知道：生活或许不会那么美好，但是每个人要不断努力，不断成长，最重要的是保持一颗善心。这是我的个人看法。,0,16,0,2022-07-20 00:21:10,来自广西,748095372790718,飞鱼小花园
7122381808335209249,好剧，真实，三观正！[赞][赞][赞],0,7,0,2022-07-20 17:20:49,来自湖北,101867021874,豁达的笑看风云
7122439359504384802,很火的电视剧！[赞][赞][赞],0,1,0,2022-07-20 21:03:05,来自湖南,1038389148658128,狐蝶灬
7122438454818390824,还是好看，幸福到万家,0,1,0,2022-07-20 20:59:36,来自四川,562541552733111,闻杰
7122061443126280960,实在看下去了,4,81,0,2022-07-19 20:36:46,来自江苏,56128766429,博学的暖阳qX
7122088686997144323,喜欢美好的结局，舒服，不堵心！[呲牙],0,19,0,2022-07-19 22:23:22,来自河北,50272420990,力善儿
7122400366377501452,三观正，引导正能量,0,4,0,2022-07-20 18:33:02,来自福建,3238853045,鋃啲誘惑
7122381914291520293,正能量农村好剧，每天都看！,0,5,0,2022-07-20 17:20:46,来自江苏,61378053737,江南九哥
7122381561919685412,温暖向上何幸福,0,9,0,2022-07-20 17:19:19,来自河北,1909186740628717,颖娱Y乡乐
7122101969837867817,传家确实不知情啊，为啥把传家送进去了，不是应该把他手下那个让关阀门那个送进去吗？,3,9,1,2022-07-19 23:14:27,来自山东,3800701242,就是不好好起名字
7122020447743116067,这结局真好。把理想照进现实，真好！,0,2,0,2022-07-19 17:57:53,来自四川,6977888272,岩架上的橙红色
7122382420250247974,问一下大家：你们有人看了吗？好不好看？,1,4,0,2022-07-20 17:22:54,来自四川,3997453644730915,兰芷若曦
7122295634367234854,郑晓龙导演出品，必数精品[玫瑰][玫瑰][鼓掌][鼓掌][赞][赞],0,13,0,2022-07-20 11:46:23,来自浙江,99457915161,相信公义的太阳
7122102099844465422,假如何幸福嫁到了唐山？？？[可怜][可怜],3,4,0,2022-07-19 23:15:40,来自河南,3518047444275704,请输入用户的名名
7122042086819447552,幸福倒万家，倒霉的倒！,0,34,0,2022-07-19 19:21:36,来自浙江,3513669893501084,钱塘小仙女
7122383358793155340,开篇就是比较真实的闹离婚，贴近生活,0,5,0,2022-07-20 17:26:53,来自广东,1794840882587476,shine1273
7122384517427610405,越来越不贴近生活了,1,1,0,2022-07-20 17:30:53,来自江西,3816532835,成就彼此
7122021380627448616,圆满的结局皆大欢喜[赞][赞][赞],0,2,0,2022-07-19 18:01:28,来自北京,52905695230,红姑18
7122093078315270946,把幸福塑造成了高大全的人物,0,17,0,2022-07-19 22:39:30,来自新疆,61153913049,快乐菠萝蜜WS
7122015561206563625,从要开客栈就没看了，可以想到女主后面要开挂了,1,2,0,2022-07-19 17:38:53,来自河北,5205577571,鱼吃鱼2n5Q
7121996983619486464,幸福变成救世主，可叹！,1,12,0,2022-07-19 16:26:52,来自北京,97067716844,完美饺子FC
7122016308451361536,哈哈太理想化了,2,2,0,2022-07-19 17:41:49,来自北京,78237407940,司马常疯2
7122236496392389376,我就喜欢这样美满大结局的剧 生活很烦必须来点糖,0,6,0,2022-07-20 07:56:22,来自福建,51254946821,风骨Z
7122390702604124963,喜欢看还是喜欢看，就是剧情有点不耐推敲,0,2,0,2022-07-20 17:54:28,来自河南,2559263434871919,温暖的弦1888
7122024477194109731,万传美的结局真好啊，未来一片光明。几年后，人家名利双收,0,0,0,2022-07-19 18:13:35,来自甘肃,61536073692,千千呀
7122384665289392909,突然就结束，意犹未尽。,0,4,0,2022-07-20 17:31:19,来自甘肃,92658363160,一林的慢生活
7122318389888369449,何幸福终于幸福了！[鼓掌][鼓掌][鼓掌],0,12,0,2022-07-20 13:13:56,来自湖北,9761912144,直率海洋iMZ
7122207673214993182,完美的结局也不错，心里舒坦。,0,3,0,2022-07-20 06:05:31,来自北京,3730003799062990,深夜又见昙花开
7122340553869869837,郑导，编剧感觉还不够瓷实。,0,11,0,2022-07-20 14:40:09,来自北京,102270390695,齐祖马赛
7122350993136337696,我还写了几篇观后感，郑导有兴趣可以看看[大笑],0,6,0,2022-07-20 15:21:30,来自上海,95860025664,花之灵儿
7122390200914952971,每天都在追剧中，中间还漏了几集。等播完了再重看。[赞][赞][赞],0,3,0,2022-07-20 17:53:03,来自四川,369849154936043,灿烂云朵tE
7122012343545905951,这个剧哪里是幸福到万家，简直就是幸福毁万家…,1,1,0,2022-07-19 17:26:37,来自上海,4248162537055437,风趣的梦幻海风Dt
7122313630242620171,万书记很好,0,11,0,2022-07-20 12:55:06,来自广东,101965286425,傻傻分不滴
7122382049159889702,为郑导点赞！都出好作品！,0,4,0,2022-07-20 17:22:06,来自江西,1490589335432632,我是雅雅鸭
7122017628977693448,理想很丰满现实很骨感！[捂脸][捂脸][捂脸],1,0,0,2022-07-19 17:47:18,来自北京,84527261357,自自然然561
7122383793797120783,正在追呢，有点意思！,0,3,0,2022-07-20 17:27:48,来自河南,1332255067223608,瑞洛溪
7122387959705535271,没看够啊怎么办,0,4,0,2022-07-20 17:44:35,来自北京,59540320231,要不你以为呢
7122384878494188303,正在追的剧，良心好剧,0,5,0,2022-07-20 17:31:50,来自浙江,1412195492565444,小贝尔子
7122010318452130597,总之圆满结束了,1,2,0,2022-07-19 17:18:53,来自北京,109219223930,梦幻明月ck
7122077744603235072,所以比《警察荣誉》《亲爱的小孩》《关于唐医生的一切》差。,3,10,1,2022-07-19 21:39:53,来自北京,56194508750,花鸟风月1985
7122098710648996611,剧情太不实际，越看越失望[抠鼻][抠鼻][抠鼻],0,13,0,2022-07-19 23:02:11,来自陕西,87842600616,有你陪伴的每一天真好
7122029794115797797,世上真有万能的何幸福？,0,1,0,2022-07-19 18:34:30,来自山东,79605237890,用户71225074913梦幻
7122001004920685352,幸福捣万家[捂脸],1,7,0,2022-07-19 16:42:22,来自陕西,1332249761679028,tyn9491586
7122400148579320607,此电视剧不错，一直在追剧[赞][赞][赞][赞][赞][赞][赞][赞][赞][赞],0,4,0,2022-07-20 18:31:32,来自辽宁,78359241006,就是自在的简单
7122382730372973352,一部好剧！,0,5,0,2022-07-20 17:23:32,来自湖北,80108986108,黄石陳緒漢
7122370991912993576,拍的真不错 每日追,0,6,0,2022-07-20 16:38:07,来自福建,734109106449307,AGOGO2019
7122382245163729696,什么年代了？,1,2,0,2022-07-20 17:22:32,来自广东,4388883233791751,72老农民
7122387450915586851,赵丽颖演的不错，就是肤色太白，因此显得与其他演员反差很大,0,2,0,2022-07-20 17:41:55,来自上海,1548569562327208,范范
7122393270957392675,还没看到！郑导演的作品应该不错,0,3,0,2022-07-20 18:04:40,来自山东,3786368661591229,年过半百奔花甲
7122059566526858018,人生苦难，总得要有美好向往。,0,13,0,2022-07-19 20:29:14,来自新疆,92902586236,灿烂行走NPC
7122381494416884493,哪个台播？我追剧！,0,0,0,2022-07-20 17:19:21,来自湖南,50031749270,Whhwww
7122400270105002788,还没顾上观看此剧呢,0,1,0,2022-07-20 18:31:50,来自甘肃,62881145844,执着好物推荐
7122369974844654377,感觉后面拉得太快了，还没看够呢[捂脸],0,6,0,2022-07-20 16:34:09,来自上海,103738747429,带盐自己
7122610982928794398,这样的剧，一个特征：不接地气,1,1,0,2022-07-21 08:09:57,来自河南,1025160893705480,木子君的小屋
7122192474441351977,还是喜欢看圆满的结局[大笑],0,5,0,2022-07-20 05:07:54,来自黑龙江,92329040574,心的爱在前行
7122016807577781032,幸福挑万家。,1,0,0,2022-07-19 17:43:45,来自福建,103978541071,纸上谈兵书
7122416362580247336,哪天去看看，,0,2,0,2022-07-20 19:34:05,来自新疆,2788776497652030,有一个好女儿
7122409616557933342,我特别不喜欢赵丽颖,0,0,0,2022-07-20 19:08:10,来自上海,23225070207,WUYIJ
7122009768348795686,幸福搞万家,1,1,0,2022-07-19 17:17:07,来自广东,739335020754515,英明果断芒
7122289490215125772,可惜啊，终究只是电视剧而已……,0,0,0,2022-07-20 11:22:30,来自陕西,82103965534,千纸鹤3605
7122449937510056742,有意思好看[赞][赞][赞],0,1,0,2022-07-20 21:45:08,来自四川,184360138179016,大龙796159356000
7122380348063466248,刘伟演的传神了,0,3,0,2022-07-20 17:14:54,来自广东,6917359134,跟房子打交道的设计师
7122316876256592678,这样的结局，也就电视剧有了。麻醉人,1,6,1,2022-07-20 13:07:41,来自四川,6290112610,永无止境ttyy
7122066307599729408,强行大团圆。,0,5,0,2022-07-19 20:55:28,来自江苏,3905102462060879,奋发有为海燕MT
7122407342637384483,要谢编剧导演,1,1,0,2022-07-20 18:59:03,来自江苏,59119723684,sunnyWYA
7122326572124275470,在一大堆浮夸的穷人剧面前，本剧真可以说是非常写实了,0,13,0,2022-07-20 13:45:51,来自浙江,102832713920,千年114
7122415127231496967,看了一点，剧情还可以，挺不错的一部剧,0,1,0,2022-07-20 19:29:32,来自河北,2699998526454728,醉清风
7122117221870699272,反正就当是个美好的努力实现的梦就好[捂脸],0,3,0,2022-07-20 00:15:56,来自浙江,6419064088,悠闲海风pl
7122383216526312207,迟蓬演的好[赞][赞][赞][赞],0,2,0,2022-07-20 17:25:26,来自山东,84344728949,罗兰39469
7122084908004393765,非得不完美么？如果是这样的结局，挺好！生活不就是越来越美好么！,0,19,1,2022-07-19 22:08:14,来自河南,5775949515,朕不一样
