7122568041757410055,345号位高大化是中国男篮的传统优势，姚明杜峰弄一帮小个子打什么死亡3小，结果拉了不止一次，从19年到现在，事实证明篮球是很需要身高的，CBA不是NBA，中国队不是勇士队，姚明对于国家队的改革方向一开始就是错误的。,4,41,2,2022-07-21 05:24:57,来自山东,822075504988424,磐石硬汉
7121350178111554318,大眼是球评中能客观、理性、到位的球评，是当今的一股清流，最难得的是辽籍球评；大眼说得好“我们球迷不能在球队低谷时期去落井下石”！国家队在外征战时我们球迷应该多鼓劲，不能在后方拆国家队的台，伤前方队员的心，泄队员的气，待杯赛结束后再秋后算账也不迟；球迷就是应该做好球迷应该做的本份，特别是关乎国家队荣誉的事！,0,8,1,2022-07-17 22:37:06,来自广东,51556334704,东哥24877
7122502411364746018,"杜峰“揽责”和我理解的不一样，说最大的责任在教练，为什么不检讨自己，
说和队员没关系，全在说队员不行。",7,33,2,2022-07-21 01:10:28,来自辽宁,107737203523,zenmq
7122531738898907916,任人唯亲！胡明轩mvp上场35分钟得6分，还有三不沾！顺风刷分，逆风啥用没有！ 对得起mvp称号不？杜峰下课吧,12,192,6,2022-07-21 03:15:17,来自河北,3698997824,838388309
7122596965518508831,这就是中国男篮水平，这也是杜锋的真实水平。,1,16,2,2022-07-21 07:15:31,来自河北,5582829509,三哥60841991
7122490927461024527,这次没有了辽宁队员背锅只能自己揽责了。,10,188,5,2022-07-21 00:24:27,来自辽宁,6809068511,平仄仄平
7122500986333463308,不是揽责任，而是执教能力加私心，就这场球，场上出现的机遇你没去把握，球员的失误没有及时的纠正，做换人调整，一句道歉绝对不够,1,86,4,2022-07-21 01:07:52,来自黑龙江,110657186523,清闲的冰淇淋gE
7122612298006397700,球员状态不好，失误又多，罚球不进，能怪杜锋吗？只怪球员技不如人。,2,0,2,2022-07-21 08:15:10,来自广东,2736056577309710,大星篮球
7120743660077236995,不要把什么责任都推给主教练！国内联赛的问题太多，许多球员也养成了一些臭毛病和坏习惯，在国内有球迷和粉丝宠着，许多裁判员拿他没办法，到了国际赛场被打脸，活该！让长点记性也好😊,0,1,0,2022-07-16 07:24:43,来自陕西,4160140952476300,淡泊长乐驿人
7122600978008277767,这场比赛没有主教练肯定赢了,1,15,0,2022-07-21 07:31:34,来自河南,245908028261063,吃瓜闲谈
7121565768596767500,广东球迷有这样理智的太少了,1,1,0,2022-07-18 12:34:12,来自北京,51259631234,宰相160025969
7122496343725064973,失误22次是主教练真实水平,3,75,2,2022-07-21 00:47:16,来自河北,2216271195678798,流浪牧马人
7122636232944894734,前面说的道歉的话是没办法交代，后面才是推诿自己想说的，作为一个主教练，手下的运动元身体健康不合格、还硬要派上场而且还是关键的比赛，这不是失职吗？带了12人上场就要用最好的，关键主力后卫被罚下那次，替补后卫打的很好能挑大梁，难道就不值得信任,0,12,1,2022-07-21 09:46:47,来自江苏,68616621343,老黑娃77
7122707665364878114,输球教练应负主要责任，但是杜锋说与队员没有太大关系，本人不敢苟同，与黎巴嫩这场球输掉，可以看出队员基本功不行，投篮不谁，抢不到篮板球，失误多，对抗能力差，都是败北的重要因素！,0,0,0,2022-07-21 14:24:33,来自山东,111496327114,有趣的梦想家fx
7122693952478282499,这就是杜峰的真实水平啊，不奇怪！首先说话都虚假的教练，能教队员什么呀？杜峰说这次失败的责任不在队员，而在教练，结果他进一步解释的原因全部是队员的原因，没有提到一个教练的原因啊，这样的教练怎么能教出一个好的队伍来呢？！,0,0,0,2022-07-21 13:32:13,来自内蒙古,60699898800,豁达豆浆CH
7121308383160206092,一个在国家队输球了，偷笑的人，能当国家队主教练。是不是神奇。[大笑][大笑][大笑][大笑],0,20,3,2022-07-17 19:55:16,来自辽宁,975955256940270,花架之年
7122521656018780940,姚明出来给全国人民一个交代,4,63,5,2022-07-21 02:34:52,来自河南,55141912974,陈永信老师
7122692808385233705,有高潮就有低谷，高潮时候有姚王易孙那时候是世界八强，再看看现在这批球员，在顶级联赛美国打替补的都没有，欧洲也没有，巧妇难为无米之炊，所以说全怪教练是不对的，杜峰在国家队主帅这个位置其实和在广东做主帅的处境是一样的，手下没人怎么办呢，杜峰在国家队的做法和在广东的做法是一样的，多培养新人，这也是国家队的长远计划，输球了叫杜峰背锅是不对的，叫他下课叫谁上呢，宫指导还是李春江，问题是他们不愿意，其他人选要么没经验比如李楠，换郭士强个人认为倒是可以，但他的执教战绩领导能不能同意，还有就是本人和广州队会同意么？我对杜峰的评价是负重前行，不说呕心沥血但尽职尽责还是当得起,0,0,0,2022-07-21 13:26:53,来自广东,1143966790331022,森林562
7122485326203536139,以当下中国男篮综合实力与黎巴嫩男蓝对决，输是必然，赢才是偶然，不怪谁，中国男篮继续加油！,3,51,2,2022-07-21 00:04:27,来自云南,68289733412,东篱把酒805
7122600635865957160,球队打的不像一个整体，肯定是主教练的责任，主教练在选球员的时候也得从能力角度出发，不应该是从俱乐部的角度出发。选的这个胡明轩这都是他自己的弟子，而胡明轩几乎这几场打的都不行。而且胡明轩还场场首发，打的时间还最长，所以在选人这一块儿，主教练也得担责任。这场要不是靠周琦个人能力，比分绝对是个惨案，国家队需要换教练，国家队队员也需要以辽宁为班底，当然这次主力球员有伤病也是主要原因,2,39,4,2022-07-21 07:29:19,来自天津,3891921759511116,吾乃球腻子
7122593385713992489,阿拉基是跟郭艾伦一个级别的后卫啊，参考CBA郭艾伦的统治力，阿拉基打爆咱们这些后卫群是理所当然的[流泪]赛前准备不足啊,1,12,1,2022-07-21 07:01:24,来自辽宁,52534510960,山巅观雨客
7120884240811721505,关键时刻，大家都应该团结一致，男篮主教练这个岗位是烫手山芋，换谁都是一样，特别是疫情期间影响了球队和队员的身心健康，我觉得没有谁愿意推泥带水把国家队比赛当儿戏对待！！,0,1,0,2022-07-16 16:29:23,来自福建,107890605115,不忘初心8666891191810
7122622284606522147,可以接受，胜败乃兵家常事。输了就不要发奖金了，绩效工资也不要发了，只保留基本工资。基本工资不能超过当地城市工资上限。对于持续表现不好的队员，年底俱乐部和国家队双节约。如果还不行，就节约主教练。如果仍不行，就解散成年国家队，借用举国体制优势，改从娃娃抓起,1,4,0,2022-07-21 08:53:06,来自广东,6363419107,朱文辉86281848
7122587294427202319,怪毛啊，换个教练带队你试试!发不过黎巴嫩我也是醉了,2,5,0,2022-07-21 06:37:57,来自辽宁,104468781059,现实无需实现
7122561540859462440,三后卫是最大的败笔！,2,32,0,2022-07-21 05:00:35,来自广东,3073862605477934,深漂一族模具人
7122598091815420707,作为广东佛山老球迷 李春江广东积臣 李群 时代已经开始看球 也懂那么一丁半点皮毛 中国男篮主教的确是吃力不讨好工作 干得好是应份 干不好喷子满天飞 杜导这些年白头发也添了不少 想好好提拔段练青年人 偏又遇众多的球员在澳大利亚得病 有的也去参加了NBA夏季试赛 杜导回广东吧 别遭那罪了 希望国内CBA联赛越来越好 对抗性越来越高 越来越精神 中国男篮 加油！,9,22,4,2022-07-21 07:19:42,来自广东,3443267956129379,广东加油喔
7121285575616807693,杜锋会吹口哨，适合啦啦队领导。教练没时间吹口哨，临场指挥战术人员随时要调整。,1,12,1,2022-07-17 18:26:32,来自江苏,96298291535,时空通用
7122575706194002695,本届亚洲杯赛篮协是没有成绩要求，否则杜锋不会去接这活儿，球迷可以到官网去查看，杜锋以尽了义务与名誉尽力为国出战了，后易建联时代比较困难，没有教练手.杜锋才迎难而上的。,2,1,3,2022-07-21 05:54:07,来自广东,100257684892,用户一场游戏
7122484957050012454,天天郭艾伦，他临阵退缩了回家参加综艺了,6,8,6,2022-07-21 00:02:29,来自广东,52562935367,拉布拉多豆豆
7122498495130944292,联赛水平不足以培养出一只优秀的队伍。还是想想如何把球员送到外国联赛吧，周琦打了一个赛季澳洲联赛，进步都如此明显。,3,21,1,2022-07-21 00:57:07,来自四川,19754054472,歌神1229
7122487849173385997,男篮需要巩晓彬这些没有在俱乐部任职的优秀主教练，杜锋是聪明但格局不大，就想着用广东队打国际比赛锻炼广东队球员！,3,92,2,2022-07-21 00:13:33,来自甘肃,6115689650,休莫言3
7122671539333841678,教练是最大的问题，前几天，澳大利亚对印尼，还有我们对印尼，虽然都是赢，别人都知道怎么赢该给面子还是要给，而我们只知道拼命的刷分，虽然别人说不出所以然，但这是情商的另一种体现方式，试想，情商不怎么好的人，能带出什么好队伍。,0,2,0,2022-07-21 12:04:47,来自江西,329487229655227,正义凛然菠萝BV
7121327128880251684,男篮主教练非李春江莫属,4,4,1,2022-07-17 21:07:21,来自山东,94564455053,美丽大诸城
7122632823240147748,杜峰还是有担当的，我觉得主要责任在球员，现在的男篮可以说一茬不如一茬，好球员太少了，整体水平越来越低。青训和联赛的成长体系肯定有问题,0,0,0,2022-07-21 09:34:38,来自山东,82261316930,修道士
7122607562037658409,请不要找不是理由的理由，偌大个中国十五六亿人口就打不过一个个小国吗？？？啥原因！！！球员球员不行，教练练练不行？就知道在国家拿着高薪不干活，一到关键时刻，啥也不是！好的教教好的球员压根就进不来国家队，啥原因啊？？？这简直就是悲哀是国民的耻辱！！！！,0,9,1,2022-07-21 07:56:09,来自内蒙古,6012617218,我的正义之声
7122594301918004003,技不如人，没想到黎巴嫩这么厉害！,7,9,2,2022-07-21 07:05:04,来自山东,11976067379,印台山人123
7122630216442217250,用人跟战术问题可以怪杜峰没问题，但是罚球和失误怪到他身上就有点扯了，国家队是临时组建的，又不是单独培养，能力问题不能让杜峰背锅，说句不好听的，这已经是国内最强球员和教练了，你说换还能换谁,0,0,0,2022-07-21 09:23:51,来自湖北,97464338419,寻梦启事ydxq
7122489706663052067,承认技不如人很难吗[尬笑],1,23,0,2022-07-21 00:19:50,来自北京,86005038063,你的善良要带些锋芒
7120728267849499431,主教练选人有问题,0,23,0,2022-07-16 06:24:58,来自广东,4270201007,简单饺子nF
7122482825114239755,郭艾伦打得分享球，广东三少打要享受比赛[捂脸],0,16,0,2022-07-20 23:53:39,来自四川,5541344082,bsrlvke
7122673736872461096,杜教练揽责，总比那个带过女足的假教练强,2,1,0,2022-07-21 12:12:46,来自广东,57687165247,你估小野
7121266953339093796,作为广东球迷，我一直非常喜欢这样的人，客观，到位的分析，不带双标的球迷一定会认可大眼观点。,1,31,2,2022-07-17 17:14:16,来自广东,14832692835,wubai6888
7122578826219651851,杜指导你和教练组成员及队员们辛苦了，队员们己尽力了，黎巴嫩的手脚大快了，我们的队员体力己耗完了，没事的，让队员好好上了一堂课，国际男篮的比赛对抗我们还差远了，今后好好努力，将来会赢的。我们球迷欢迎你们凯旋归来,5,18,6,2022-07-21 06:07:07,来自广东,2735174197715272,爱生活的明月fZ
7122665195163861772,中国男篮何时轮落到这地步？,1,7,0,2022-07-21 11:40:21,来自河南,2827585908903384,儒雅梦想家S3
7122543290842465064,我们的后卫不是技术不行，是身体对抗不行，国内最好的身体对抗球员郭艾伦，,1,51,2,2022-07-21 03:53:28,来自辽宁,108229793197,博学的荷叶27
7122625194220733199,为何胡一分每一节都在场上，明白人都懂，球员失误众多达到全场二十二次，主帅调兵遣将还是欠缺火候，有众多球员没有登场，说多都是泪呀[捂脸]，中国男篮和中国男足一样都要好好总结一下了！,0,1,0,2022-07-21 09:04:37,来自广东,1226691594165405,韶华已逝初心不变
7122623044874765087,"什么不是真实水平，遇弱老虎，遇强（对抗）绵羊，这就是差距，再加一个广东教练，没有大局观，不输才怪。可惜了，无才之教，累死三军，尤其周琦。
再不改变，紧追国男足。",0,0,0,2022-07-21 08:56:39,来自黑龙江,108316513660,青九莲
7122556993437188900,这次郭艾伦没上场，实在是找不着人了，只能说他自己了，如说他的三少，归根结底，还不是或者还不如说自己呢！,1,22,1,2022-07-21 04:45:53,来自辽宁,58105563880,嗡吸林姆
7122683209003270942,这球输的好像不对称，好比一个健全的成年人输给一个五岁的孩子。纯属个人观点。因为自从男足在国际上的出色表现至到现在，三大球我是坚决不看（女足除外），生不了那气。,0,0,0,2022-07-21 12:49:52,来自浙江,5491063240,冰山独客A
7122495077447975691,有西亚球队在 为什么裁判用西亚的 不应该有回避原则吗？,7,9,1,2022-07-21 00:43:02,来自广东,5549313387,aiq59510984
7122491002254066472,郭艾伦的优点就是他的缺点，缺点明显，但是能力绝对是后卫中的第一。不受杜峰待见就离远点,3,93,4,2022-07-21 00:25:06,来自河南,109678767617,豫州1992
7122626100731855631,下午国足输韩国，我并没有感到意外，因为实力摆在那，晚上男篮输黎巴嫩，我真的有点不理解，我们其实是有能力和实力击败黎巴嫩的，有时牌烂，输了就输了，但是有时牌好，照样输，不理解啊……,0,0,0,2022-07-21 09:08:05,来自河北,62717852605,老男孩180153
7122634268471329536,这场比赛里，中国男篮在长时间都处于落后的态势,0,2,0,2022-07-21 09:39:04,来自陕西,4319333604659543,是芷娴啊
7122600387114812195,孙铭徽不上场就一定赢,2,27,2,2022-07-21 07:28:31,来自云南,4358234513,大东吉瑞
7122630938122552102,打的是一大四小战容，但全场没有一个快攻，最后一节才开始联防，全场没有一个能突进去的，郭艾伦为啥不来？证明一大四小战术体系不适合中国男篮，该重拾我们内线优势了。,0,0,0,2022-07-21 09:27:28,来自广东,89925647482,吃瓜谈球
7121668641011270440,你的IP？,1,1,1,2022-07-18 19:12:28,来自福建,110937580877,奋发河流yp
7122594202231636774,啥也别说了，杜锋下课，姚明下课！,7,82,4,2022-07-21 07:05:43,来自辽宁,3817971726951438,YZY1960
7122507544845353743,既然孙，赵身体不适，为啥不换姜伟泽上场，输球在教练，,1,22,1,2022-07-21 01:32:00,来自陕西,3334189133347663,敏锐暖阳3b
7122504450874327811,杜峰太伟大了，一个人承担责任，点都没往郭艾伦身上推,1,62,4,2022-07-21 01:21:13,来自重庆,62911369086,奎哥639
7122674715810251554,杜峰在广东的联赛冠军，不代表他有多高的水平，而是广东实力太强大了 ，有易建联、两个技术全面的外援，和经验丰富、有高度的前锋(周鹏和任骏飞），谁当教练都会拿冠军的，实力摆在那里，没得说！,0,0,0,2022-07-21 12:16:34,来自四川,6135314276,清爽漂流瓶yt
7122527055648162575,这个总结还是恰当的。不看好这一代男篮了，水平真的不行。基本功，技战术都不行，打法单调。期望下一代吧,1,9,1,2022-07-21 02:50:00,来自山西,804450330215421,飞猪侃侃
7121259103451890462,关键是球迷以何心态直面中国男篮的现状。,1,10,0,2022-07-17 16:43:54,来自广东,61290665308,黄棉生
7122484887164617476,面对黎巴嫩欧式的抢断和对抗，就是郭艾伦来了也好不到哪儿去,1,2,1,2022-07-21 00:02:27,来自四川,1566122525596631,温柔夏琳1w
7122646612781826829,失误太多，最基本的罚球太没眼看了，多少个不进，看人家黎巴嫩罚球对比，进攻全部依赖内线，后卫个个不敢突，突进去又不够硬上篮造犯规，不是徐杰最后三个三分，早没了😔,0,0,0,2022-07-21 10:27:47,来自广东,96834872111,小富厨
7122594690226160420,毒蜂一半责任，孙铭徽胡明轩一半责任！,0,31,0,2022-07-21 07:06:51,来自北京,92776801969,怀揣梦想的青春之歌
7122523843696214819,这次输球就是杜峰的责任，我不知道他为什么那么痴迷所谓的三后卫？？？,3,23,0,2022-07-21 02:36:33,来自山东,3891926614676347,刀疤哥12359467646846
7120702300490171172,有什么样的教练就有什么样的球员，说明平时就对球员发火遇到刺头反抗就管不住失控。,1,33,1,2022-07-16 04:48:11,来自吉林,107788297736,缺者为贵
7120789126106235659,大家再别这样说了。篮球管理层己经无地自容了啊！,1,18,1,2022-07-16 10:19:10,来自北京,104786338616,泷泷爷爷875
7122636635916944163,国家教练心里存在小集团利益，没有大局观，没有在团队树立核心队员，把应该为核心队员进行打压，让国家对非常不团结，强北派被无限控制，手段极其恶劣，,0,6,0,2022-07-21 09:48:23,来自辽宁,64364853606,慢步人生191998566
7122490143973507881,拿国家队的比赛培养广东队员，杜峰尽力了。,3,190,6,2022-07-21 00:21:28,来自辽宁,62427645145,归零178457947
7121358674718901024,宫导，郭导没有带国家队的能力吗？不论能力、人品都比杜锋强。,1,2,1,2022-07-17 23:10:43,来自辽宁,6014732836,闲云野鹤wy
7122599618910995241,上三后卫是以短对长，整个队形偏矮小，对抗性弱于对手是输球的症结。郭艾伦，张宁这种对抗性强的球员应入国家队重用，顾全这种当小前锋，中国队还是要走高，壮，准才能在亚洲赛场上占优势。,2,9,3,2022-07-21 07:25:22,来自福建,2607689427330692,祥云飘扬
7122630906090767145,杜教练真棒，成熟了。没了郭艾伦敢于在发布会自己背锅了。我是真的好奇，胡明轩和他到底什么关系，希望广东球迷指点下。,0,20,1,2022-07-21 09:26:39,来自上海,6430924983,乌了
7122630462673535783,就这个配置中国队已经打得很不错了，不要怪杜峰，在用人上面，有自己的眼光，没有上场的三个，哪个上来都要被打花，唯一遗憾的是赵瑞发烧，状态不好。如果全主力、健康的中国队，在亚洲还是独一档的存在！加油，中国队，我永远支持你！[给力][给力][给力][比心][比心][比心],1,1,3,2022-07-21 09:25:52,来自四川,4450444364753038,蓝色童话
7122642801023861545,换教练吧！老叔！春哥！都比他强，杜峰心态崩了。,2,21,0,2022-07-21 10:12:22,来自安徽,51156264546,八票不哭
7121308035561734925,还有一个因素大眼哥没提到，这次出国比赛，大部分人都感染了新冠肺炎，导致状态严重下滑，发烧感冒咳嗽，治病加隔离，连训练都凑不齐人数，都是带病上场，能坚持打完都不错了，那些挑剔刻薄的球迷，却完全视而不见！！,1,10,2,2022-07-17 19:53:49,来自广东,107958948101,相信第一眼的感觉wvw
7122608828436595493,个别失误是正常的，全场二十几次就不应该叫失误了。队员配合及能力出了问题，反映了训练水平的高低，教练失职了！！！中国男篮不能步男足的后尘，球迷一次次失望就会远离，逐步的就会动摇根基。队员、教练、裁判不能老窝在国内联赛里自娱自乐，必须去国外高水平联赛去见风雨、开视野、提能力。一个姚明不足以改变中国篮球，当一群姚明出现时，中国篮球才会有灿烂的明天。,0,5,1,2022-07-21 08:01:44,来自陕西,52390145995,不贰归壹
7122591585803666210,我们篮球水平确实跟不上世界的潮流，在强硬的对抗下我们发挥不出水平且失误连连，在对阵印尼和黎巴嫩两个不同风格的队伍后就判若两队，值得深思！,0,11,0,2022-07-21 06:54:20,来自辽宁,1733308400286567,舞动集安8R6
7122481153164002080,人是教练选的，战术是教练定制的，责任最大是教练,0,19,0,2022-07-20 23:46:45,来自埃及,92600777741,悠闲黑龙
7122554382884979491,杜：郭艾伦关键时候掉链子，谁让你生病的[奸笑],1,11,1,2022-07-21 04:34:07,来自阿尔及利亚,76349645339,Jack-L867
7122651529240904489,想不明白胡明轩在场上软的一匹，空位三分基本投不进，胡乱上篮总是被冒，单打过不了人，杜峰为啥一直给他首发。这场比赛，要不是周琦和徐杰三个关键三分球，早就输了！,0,0,0,2022-07-21 10:46:49,来自广东,4336082264005533,周娱公子
7122596833599947560,客观的说，中国男篮碰到力量对抗性的球队，能发挥正常的少之又少，不是传球、防守失误太多，就是投球失去准星，连最基本的罚球都不过关，可见我们的体能储备存在问题，应该想办法改善和解决。,0,8,0,2022-07-21 07:14:46,来自河南,75463786427,魔法明月Bv
7120738292051706662,有什么样的教练就有什么样的队员，流里流气，匪气十足！,0,15,0,2022-07-16 07:03:32,来自陕西,593385090452007,非凡柑桔H
7122626847867372322,看完文章，我感觉教练并没揽责，还是将失败归因于队员啊。[捂脸][打脸][打脸][打脸][打脸],0,0,0,2022-07-21 09:10:59,来自山东,4108205798986831,小咯哒的妈妈
7122486715944256288,我觉得是郭艾伦的责任,1,1,0,2022-07-21 00:10:18,来自福建,4242958047,专业熏侯
7120669295600485160,"国家男名落孙山，应该有人负责！！！！
最大的责任人应该是：郭艾伦、赵继伟、付豪吧？？？？？？",2,19,5,2022-07-16 02:42:00,来自辽宁,110398987306,分秒必争雪梨qL
7122581536440353569,中国队和黎巴嫩队相比，战术，技术，拼劲都相差了许多，没进四强怨不得別人，对抗太差，还是从联赛上找原因吧[灵光一闪][灵光一闪][灵光一闪],0,1,0,2022-07-21 06:17:17,来自山东,5864580081,正源69131144
7122573470416454414,"平时训练强度不够，稍微对抗就失误。全场失误多得真是不忍看。去学学女篮吧。
多数队员缺少基本功，最简单的罚篮，这么多年了，还是那样低的命中率，这让人说些啥呢。
想玩，就踏实点，别虚胖。",0,1,0,2022-07-21 05:45:46,来自陕西,72232347918,开心276793072
7122627287904076580,这阵容，杜锋也真尽力了，后易建联时代，也没周鹏和艾伦，这场球球员失误加裁判针对，这场球真的很难。可喜的是周琦和徐杰的内外组合其实还可以的，中国队加油！,0,0,0,2022-07-21 09:13:06,来自广东,4671493263,navy46681946
7122594788355900198,哎，曾经的中国男篮打进过奥运会8强。如今，连亚洲4强都打不进去了，，中国男篮不要沦为中国男足,0,25,0,2022-07-21 07:07:31,来自浙江,6803496946,小虎17
7122623084574032643,还是技不如人，继续提高技能，中国男篮加油,0,1,0,2022-07-21 08:57:07,来自新疆,4302392342,戈壁红柳37968926
7121314603321066255,大眼哥你的说法也不都正确。二号位姜伟泽大赛经验不足得分少吗？胡明轩经验丰富又得了多少分呢？你又作何解释？,3,9,5,2022-07-17 20:18:30,来自辽宁,56930291381,老土土土土土
7122548049792647977,这场球输的好惨，最后连一个背锅的都找不到……,1,24,1,2022-07-21 04:11:05,来自黑龙江,62175194936,黑龙江蒙古人
7122480679014662915,怎么不说赵睿、胡阿迪灾难性的表现呢？,2,22,2,2022-07-20 23:44:47,来自吉林,107921809629,往事随风znx
7122484787985515303,杜峰你难道不应该说明一下为什么一直用胡明轩嘛，为什么,14,136,1,2022-07-21 00:01:10,,1698098216175515,清闲的麻酱kh
7122489334016082691,应该还怪郭艾伦，谁让他不在的[捂脸],12,109,3,2022-07-21 00:20:00,来自辽宁,72401752661,剑蓝秋雨
7122484693811315492,不是男篮真实水平，但这是你带这个男篮的真实水平，有郭艾伦在亚洲范围还是好使的,1,32,1,2022-07-21 00:00:56,来自吉林,85649969460,天行键884
7122622452572193551,输球不要输掉自信心，国人难以接受的是，输给一直没有赢过中国队的黎巴嫩，太轻敌了。,0,0,0,2022-07-21 08:53:57,来自甘肃,3800332236760496,夕阳西下水东流
7122648643835953960,中国男篮的问题，应该找姚明解决。姚明退役了，可以和郎平比吗！,0,0,0,2022-07-21 10:35:22,来自重庆,3817976175789787,机智的百香果d9
7122672733519299369,不是事后诸葛亮啊，赛前大家都预言，没有艾伦的最后就是输！,1,3,0,2022-07-21 12:08:48,来自辽宁,56575234186,勇哥10931
7122547360760496930,昨天是中国男篮和男足创造历史的一天，男足踢出一个三无，男篮打出一个梦游，耻辱的一天！,0,61,1,2022-07-21 04:09:02,来自黑龙江,62175194936,黑龙江蒙古人
