7122603313019421455,孙名徽的失误没法形容。一个主力后卫不能串联整个球队，反而失误最多,1,19,0,2022-07-21 07:39:54,来自四川,95349004824,敏锐小羊qW
7122627997010150178,从比赛中可以看到，对抗不行，一紧逼就失误，没有战术，中锋接球内线单打时其它四个人在外线站着，不跑动不去抢篮板，落后时，就靠个人单打，越单打,1,1,0,2022-07-21 09:15:31,来自北京,39226933262183,运筹帷幄画板D5
7122595809032143648,上场球打弱队还都有如神助，助攻，三分都有了，遇到强一点的对手，啥都没了，命中率呢，三分呢，运输呢，要啥没啥，就剩下以前被骂惨了无家可归的周琦了。其实输球是有先兆的，打巴林的时候就是幸运赢球，还不长教训，西亚的球队风格差不多，何况这个黎巴嫩还要比巴林强，这样看输球也就在情理之中了。赢了一个业余队各种神吹，碰到防守硬的就无所事事。,5,76,2,2022-07-21 07:12:16,来自黑龙江,92953474381,平淡逍遥
7122639775735628575,球员病了，也尽力了，确实能力有限，不能苛责球员。主教练在暂停时期，仔细听一下，除了发泄情绪，根本没有战术布置。三后卫战术，三分球不能保证，内线的优势就荡然无存，失败就是不可避免的。 分析啥啊，找五个195以上的后卫，狂练三分吧。,0,2,0,2022-07-21 10:00:37,来自湖北,93472191108,八戒75210
7122484391330349854,如果有郭艾伦可能会赢,2,10,0,2022-07-20 23:59:25,来自广东,2837167713301838,懂你的人
7122648875357799175,我是广东球迷，实事求是地说几句，个人认为第二次没把阿不都带来，我觉得确实让自己的锋线变得不堪一击，翟现在是一个相对工兵型的防守球员，进攻能力不足，防守脚步也相对慢，在国际赛场上表现也一般，阿不都上赛季的表现还不错，有能力也值得一个进国家队的名额，把范子铭换成阿不都可能会有更好的效果。个人认为中国队现在锋线上欠缺的是一个有中投能力和罚球线策应的前锋，曾经的任骏飞是一个不错的选择，可惜上赛季开始下滑太过严重。周琦确实成长了，打球不惧身体对抗，防守能力提升了很多，以前不太看好他，但现在看确实是中国队的未来，至于胡明轩、孙铭徽，表现太不稳定，有时候能打得不错能组织好，有时候却像盲头苍蝇乱打一通，郭艾伦更能适应国际赛场这种激烈身体对抗，但打球需要更多地和队友配合，更多地为队友创造机会，自己的队友有发挥，把球队串联起来，自己才有更多空间去突。姜伟泽、徐杰都是长短非常鲜明的球员，身体和防守能力是他们的短板，投篮和防守积极性是他们的长处，如果全体人员健康来算，12人名单他们估计挤不进去，但15人名单个人觉得他们还是值得带上的，主动求变的时候他们就是x因素，最终选择还得看教练的执教理念。,1,8,1,2022-07-21 10:36:57,来自广东,51965669463,16923321
7122478879687770894,杜锋，你面对现实自己提出辞职还能保留一些脸面。,6,85,1,2022-07-20 23:37:33,来自重庆,87701085675,门外里敢
7122523944187609856,没办法啊，场上没辽蓝球员只能自己担责了！一个偷笑门的主角担任国家队的主教练会把球队代到什么水平啊！,1,221,4,2022-07-21 02:37:28,来自辽宁,6160066817,端庄优雅苹果tU
7122496603373830920,fmvp胡一分 35分钟上场时间 六投0中砍下三分 与此同时 胡一分积极的防守迫使对方阿拉基艰难的得到32分 享受比赛 虽败犹荣[泪奔],8,50,1,2022-07-21 00:49:03,来自辽宁,105612414134,嘴遁5220
7122528366527365892,我就问 下cba不是号称亚洲第一联赛吗,6,20,0,2022-07-21 03:01:01,来自江西,19478174253,lg67201200
7121259240592835336,评论写得好有高度有深度有感情，身兼双职的（杜老二）多年来辛苦了，本人一直跟随（杜4）为东莞宏远拼搏球场，可谓战功畢赫，身兼双职明知山有虎偏向虎山行，没有一颗为国争光之勇气，那来精气神？不域之年白发苍苍，球迷心痛啊；诚劝弃国帅回广东再立新功，喜欢的球迷为其点赞，欢迊（杜4）回归！！！,2,33,1,2022-07-17 16:44:12,来自广东,4739484680,帕萨克
7121356419765109516,大眼哥:谈谈杜锋发布会批评郭艾伦不分享球的问题？再谈谈领先就换胡明轩上场，落后就换其他后卫上场追分的问题？,2,4,1,2022-07-17 23:02:23,来自辽宁,6014732836,闲云野鹤wy
7121460775474168609,杜峰到了该享受的年纪？！那蒋老是不会生活了？！,8,3,2,2022-07-18 05:48:20,来自辽宁,54989018716,泰格船长CaptainTiger
7122647686938936099,看了整场比赛，没有中投，一个劲突分，对手收缩篮下，中锋没有空间，后卫突破被冒要么失误。全靠硬扛，联赛又体毛犯规，扛不进去，联赛的吹罚尺度会毁了国际比赛。孙铭辉联赛那么多中投，到国际比赛没有，是教练安排还是个人意思？大秋缺席在攻防两端影响很大，有篮板有中投。,2,5,1,2022-07-21 10:31:39,来自浙江,110521779062,热心熊猫Nn
7122573116643181349,大空位投不进，上篮上不进，判罚对中国队不利，失误接着一个失误，不输才怪,1,17,0,2022-07-21 05:44:14,来自浙江,2392147725126381,一网打尽
7122636390458082051,第一教练不行，看了韩国那场球和这场，球一直都是外线倒来倒去，一传进入就失误，这不是教练问题。第二后卫不行。分数回来点，又失误，肉眼可见的失误。突又突不进去，一进去失误几率高达90%，前两节一个中投没有。第三三分手除了三分，就是废人一个，真的不会除了三分出手，假慌之后进去一点投篮两分，或者突进去，就像那个小丁一样。第四除了周琦，其他人打得没有一点骨气。输这么少，已经很好了，其实教练唯一没有错的地方，说输就是输在自己，这是真的,0,3,0,2022-07-21 09:47:27,来自广西,100235266888,闭涌
7122625416296170255,胡就会打游戏，赵睿情绪化，两人都不堪大用，唯有姓徐的可以[赞][赞][赞],1,2,0,2022-07-21 09:05:22,来自广东,103590350907,安逸蜻蜓nL
7122607371851514658,黎巴嫩上身体，全场紧逼，逼迫中国队失误。这个打法非常类似澳大利亚、美国队。中国队一直比较畏惧这种打法。防守端不敢以牙还牙。感觉黎巴嫩队敢拼敢抢。说到底还是身体素质与技术的差距。失误那么多，怎么赢球？罚球罚不进，既是技术问题。更是在逼抢之下，呼吸、节奏都不一样了。所以中国队需要选拔身体对抗能力强的、防守好的、控球能力强的后卫线。,3,10,1,2022-07-21 07:55:35,来自湖北,110944213656,夺狱困兽190202
7122599736078992163,输在胡身上！搞不清为何一直让他在场上！,3,41,2,2022-07-21 07:25:58,来自江苏,101991126774,青春自来
7122480414169695008,是杜峰打败了中国男篮,17,378,4,2022-07-20 23:44:12,来自新疆,6635502843,踏月惜笛
7122614460807676713,"一开始就没上周琦 我想就是田忌赛马
可是打了几分钟 就落后10分钟 马上换上周琦 如果开始比分更上 后面周琦上了就有机会",2,8,0,2022-07-21 08:22:50,来自四川,52623431189,俊俏宇宙n
7122511672929223459,罚球差的失误多的队员为啥不换下场呢，为什么呢？根子在教练，根子在杜峰！有杜峰中国队没好！,1,43,1,2022-07-21 01:48:08,来自黑龙江,3425694658604551,足智多谋叶子Ek
7122481937092133666,郭艾伦在哪？,4,4,0,2022-07-20 23:48:59,来自广东,101825154075,敏锐奶酪t
7122585424770040617,又是客观原因导致输球啦！郭艾伦在就好了，输球的责任一定就是郭艾伦打球独不传球效率低导致。如今输球，只能是球员伤病所致。整个球队技术、能力、战术、指挥、。。。。都是没有问题的，甚至可以说是亚洲一流的，输球是伤病所致，是裁判。。。。,0,39,1,2022-07-21 06:31:05,来自重庆,3544421716988717,端庄圆月c5
7122658244266902283,昨晚输球，从我们队员整体实力，除周琦外，单兵素质都不如对手，失误多，投不進，变幻少，对手强力压倒我方打球，这是明显实力不及，，，。,0,10,0,2022-07-21 11:13:45,来自四川,1873163406023015,曾维义
7122644741707023116,看了不到半场，就知道结果，关电视睡觉。男篮已经沦为亚洲二流！就周琦表现不错，赵睿，胡明轩纯粹打酱油，王哲林速度蜗牛！整体配合不流畅！顾全攻守都不错，以为CBA联赛呢！随意传球,0,0,0,2022-07-21 10:19:46,来自陕西,2704424700218451,率真人间正道
7120722566251447048,管理不好球员，包括球员不服从教练管理，不要找任何借口，就是你教练管理能力不行，包括球员情绪控制管理，做息时间，出去比赛和训练时间，必须得绝对服从教练管控，但有事情可以和教练勾通，但决定权在教练，其实这次就是男篮球员给大姚和杜撂挑子了，这也是大家否定它俩的一种方式，教练没有让球员达到士为之己者死，的打球精神，这是一只失去控制的球队,0,29,1,2022-07-16 06:03:18,来自吉林,632907184478781,大美东北hhmm
7122485606411682568,历史对阵11全胜，这次有郭艾伦即便胜了也会被认为正常，郭艾伦还得被挖出一堆喷点,1,6,0,2022-07-21 00:04:18,来自河北,87334076293,数字用户56789
7122600089809421091,中国男篮会不会步男足的后尘，怎么联赛越打我们在亚洲的排名越靠后，这到底是怎么了？,1,14,0,2022-07-21 07:27:19,来自江苏,104197711619,念东1968
7122648389577524009,杜锋当主教练能力不够,3,19,0,2022-07-21 10:34:37,来自山西,111451929775,德才兼备沙滩Xw
7122634130311267103,但凡失利，发布会上谁说话谁就要说是自己责任，姚明如是，杜锋如是~当然这次也确实是杜锋的责任，胡明轩就不说了，这样的表现…还一直在场上，不懂杜锋是怎么想的，也许真的打从心底喜欢吧。不过很好奇的是以前念叨“波兰中锋”和“鸡蛋饼”的那群人对于昨晚的比赛都是怎么敲击键盘的,1,7,1,2022-07-21 09:38:44,来自福建,3738079965,小神耶
7122497583893021480,怎么会怪你自己呢？怪我。我承认这并不是最强的男篮，艾伦有伤就不说了，吴前赵继伟不比这几个后卫好用？搞不懂进入国家队的标准是什么？谁能解释,33,116,2,2022-07-21 00:51:27,来自四川,109010493604,cg因你而不同
7122559689707045665,杜峰赛后先是说教练的责任，话锋一转，又甩锅给疫情，然后又甩锅给球员了，说失误多这不明显甩锅吗,4,26,2,2022-07-21 04:56:13,来自辽宁,4063446781932621,心无言
7122612495109341982,结果，让人遗憾，希望振起来，苦练技术，增强体质，为国争光,0,2,0,2022-07-21 08:15:37,来自海南,219515365105447,盛开红色广场舞
7122562102253912865,用人太固执了一点，迷信三后卫没有随机应变能力，打西亚这样身体对抗能力强的队伍需要对抗力的，在三后卫上占不到便宜时应该立即应变，比如用两后一中两内线，今天内线是占优势的，那么就应当保持两内线在场扩大优势，比如周奇/王哲林/范子明三人轮换始终保持两人在场+顾全/小川/贺希宁三人轮换+后卫两名一轮次，绝对比今晚布置的三后卫强，,3,16,1,2022-07-21 05:04:47,来自广东,68744275394,湘江盆论
7122601401796543266,"三大来气：
第一．每次在关键时刻看到罚球不进就来气，气到肠都晦青了。
第二．频繁失误，特别是在关键时刻在失误，痛心。着急来气。
第三．教练布局不合理，特别是在最后3分钟的关键时刻，应该叫暂停。可是没有。看了干着急来气",4,37,2,2022-07-21 07:32:25,来自海南,93318180332,阿达米邓文
7122484429066634025,打弱队，一个比一个厉害！遇到稍微强点的球队了，就完全崩塌，不是说体能不行，就是说身体状况原因。难道就没有技术和战术的原因吗？,10,102,1,2022-07-20 23:58:59,来自山东,51207570566,杰思设计工作室
7122574760730526475,一个国家队的主教练，在临场指挥中，面对强敌，束手无策！ 在人员使用上，曾经因为任人唯亲人设倒塌！如今，故伎重演，重蹈覆辙！有道是：树欲静风不止，峰欲甩而郭不在！,0,14,0,2022-07-21 05:51:04,来自辽宁,25636796445,刍尔
7122481167357477635,杜峰：忘了让付豪登场了，没人背锅了！,2,41,1,2022-07-20 23:46:50,来自辽宁,4212972852368856,真爱我家胖胖
7122648954856555300,郭艾伦带病上场效率低的可怕，必背锅。赵睿孙铭徽带病上场失误多不可怕，还很感动。,0,11,1,2022-07-21 10:37:18,来自黑龙江,91707507214,勤劳人848
7122597125292589861,上一场喊着队长王哲林有担当！广东三后卫闪耀亚洲杯吗,3,11,1,2022-07-21 07:16:16,来自辽宁,92340443810,走进精彩的世界
7122608509371532040,事实证明除了周琦没人能打硬仗，郭艾伦这场也和隐身了一样一分没得，胡明轩表现再不好还得了三分呢，赵继伟助攻更是0，后卫没一个拿的出手的,6,12,4,2022-07-21 08:00:13,来自北京,50343928311,星晴127109710
7122552113817256743,不接受道歉快点下课,0,97,0,2022-07-21 04:30:02,来自吉林,75965677343,红星闪闪295
7122639981277184768,中国队对黎巴嫩的比赛，中国队还是有机会的，自己没有把握住，怨不得别人，大部分球员发挥不好，可惜徐杰的三分雨了！赵睿，孙铭徽失误太多了，不是真实的水平，翟晓川好像对方的卧底，把书传到黎巴嫩队员的手里，太搞笑了。,0,1,1,2022-07-21 10:01:22,来自辽宁,108452167585,平平8490
7122601710710932255,在黎巴嫩的强力防守之下，我们的战术体系基本上被打乱了，相对于黎巴嫩队我们的球员站位重心太高了，使的我们的机动能力总比别人慢半拍，防守的的时候容易被别人突破，进攻时频繁的被黎巴嫩切球、反击。杜峰指导喜欢“快”，在频繁被别人打反击的时候咱们的一大四小完全变得忙乱不堪，“失误”很多。我们的球员条件比别人好，希望杜指导不迷信一招定天下，能博采众长。,0,9,0,2022-07-21 07:34:03,来自广西,6980281792,0773的柳叶刀
7122663834309509899,最后几分钟应该上双塔，防不住至少能攻的进，结果咱们的后卫突了几个都被防下来了，输的有点可惜[吃瓜群众][吃瓜群众],8,1,0,2022-07-21 11:35:17,来自新疆,22822083217,磊公子的魅
7122631912245822221,和教练没多大关系，战术布置下去，球员场上执行不到位，或是手感命中率不高，后卫，前锋罚球这种基本功，居然两罚不中，这能是教练的问题？还是球员的问题,0,0,0,2022-07-21 09:31:03,来自河北,7092425405,抖创
7122626404457513768,控球传球失误多，投篮不准，没有中距离投篮，没有战术配合，王哲林软弱无力，孙铭徽失误多多，胡明轩乱打乱撞，很多队员连个球也罚不进。说来说去就是技术和实力不行。基本功太差。所以中国队员连个nba的边也摸不着。,0,2,0,2022-07-21 09:09:07,来自河北,105788605443,大气冰淇淋R5
7122494638812496676,"这段比赛
胡明轩是控卫非得让打小前锋，首先他打的就不习惯，再有发挥真差。
付豪4号位让打5号位
赵和孙明知道身体不好为什么不让姜和贺多分担一点时间?
周琦内线难时为什么不让王和范子铭给周琦打配合?
 教练组确实不行!",18,78,1,2022-07-21 00:41:24,来自辽宁,105194397897917,小名胡咧咧
7122623739711685408,如果看过比赛应该知道输给黎巴嫩并不冤。那些说不上谁谁谁的，谁上场时间太多的，也不看看国内还能挑出来人吗？打黎巴嫩这场球，我可以说除了周琦，其他都不太行，但也不能让他打40分钟吧？体力扛得住吗？那些说没上郭艾伦、赵继伟、胡金秋的，你们是没关注他们伤病问题吧？哪怕上场的球员都是受新冠影响，在慢慢恢复，如果你们看过前几场比赛，就不会这样想了，中国早已不是2008年的男篮，没必要为喷而喷。,4,11,3,2022-07-21 08:59:21,来自广东,5527421493,闲拾B
7122595241496412936,是杜峰打败了中国男篮,0,55,3,2022-07-21 07:09:23,来自宁夏,86262663630,高冷饺子P4
7122630131273417484,先让姓孙那个小伙子回去把三踏步上篮学会了再来吧！没有主心骨没有彻底的贯彻执行战术体系，防守端几乎空设，没有自信心导致失误频频。。。曾经亚洲第一的中国男篮已经沦落到连亚洲杯1/4都无法过关了，姚主席，您怎么看？,0,2,0,2022-07-21 09:24:45,来自四川,105782704046,MRSummer
7122508561619534630,杜峰确实是不适合做国家队主教练，杜峰做青年队教练非常合适。如果把杜峰与杨学增对比一下就知道为什么队员在杜峰手上不能完全发挥的原因了。,10,143,4,2022-07-21 01:38:22,来自四川,4279737247343492,老陈的民间故事
7122688235931009807,输球不怨杜指倒，如果不是刘玉栋，胡卫东，王治郅，孙军他们年龄大，如果不是姚明，朱八长胖了跑不动，如果不是詹姆斯，库里，杜兰特，哈登，东契奇…他们都不愿加入中国男篮等这些不利因素，什么亚洲杯，世界杯那都是杜指倒的囊中之物。,0,0,0,2022-07-21 13:09:04,来自辽宁,54574540444,发现快乐3
7122620233768583939,不用道歉，你们已经尽力了。带病上场拼搏精神值得点赞！,0,5,0,2022-07-21 08:46:20,来自广东,1935569719404711,用户粤桂7446
7122629055589483268,男足认为输球责任在球迷…[吐血][吐血][吐血],0,1,0,2022-07-21 09:20:23,来自新疆,106621498514,夜夜秋雨孤灯无奈搞笑
7122482965447590670,郭艾伦没在场。没有甩锅的了，只能自己背着了。,2,19,2,2022-07-20 23:53:57,来自辽宁,23392932333,仁爱帆船O2
7122629978256769822,杜锋当教练，没有大蒋风度，中国队在大比分落后的时侯，他急的乱崩乱跳，大喊大叫。这一点作用都没有，主教练要知道自己的冰队有什么优势，有什么劣势，尽量发挥本队的优势，当然世界强队我们打不赢，这很正常，只要教练和队员都尽了最大努力就可以了。,0,4,1,2022-07-21 09:23:47,来自陕西,50686718178,我换手机那就是我的用
7122518558521279267,先不说队员。中国队只要是杜峰当教练，以后必然是输个一败涂地！,8,223,4,2022-07-21 02:17:13,来自上海,104940215512,兀鹰飞去
7122714311436469006,不用道歉，你们已经尽力了。带病上场拼搏精神值得点赞！👍👍👍,0,0,0,2022-07-21 14:50:37,来自湖北,4217359121259108,亲切荷叶AM
7122659021714686757,大家不觉得非常矛盾吗？国家队里伤病满营，有的人在场上累得不行，但也有人闲得上不了场，从最初选人到二次更换名单，可问题依然存在，既然入选国家队却没有上场机会，浪费了名额，这是教练问题还是球员问题？,0,3,0,2022-07-21 11:16:23,来自辽宁,1522138060694868,漠河舞蹈班
7122640043998577411,黎巴嫩是亚洲的篮球俊旅，其打球的风格类似欧洲队，技术娴熟、配合默契，整场比赛如行云流水。反观我们队员在场上的表现，确实不尽如人意。场上基本无流畅的配合，个人技术粗糙，后卫线没有起到穿针引线的作用，全场仅靠周琦支撑，与2015年亚洲杯那支队伍相比还存在相当差距。这方面主教练要承担部份责任，后卫线上的郭艾伦等怎么没随队参赛？,0,3,1,2022-07-21 10:01:31,来自湖北,92376748060,优雅百香果z9u
7122596182534570793,还是选队员有问题，要老中青结合，即使美国队也是如此，同时内线球员一定要带一个重量级的比如韩德君，周琦能跳但始终太弱，易建联为什么不带着，至少可以打5分钟关键球，当然原因很多。,7,21,1,2022-07-21 07:12:08,来自广东,145555439226159,Mr.福
7122589011717554982,球员罚球都不进，失误频频，跟平时训练没有关系吗，教练平时抓得是什么。,2,8,1,2022-07-21 06:45:49,来自辽宁,56049058775,山野散人23
7122639945495839529,现在国家队主教练需要一个独立的教练，带着广东队又带国家队不太合适，杜峰可以选一个，视野不要只放在广东那三个后卫身上，给其他更优秀的人点机会，别把锅给别人背，荣誉自己拿,0,13,0,2022-07-21 10:01:17,来自北京,6545592848,半边贝壳OAWA
7121323333865751300,杜峰虽执教能力不强，但要杨鸣优秀多了。说郭士强或广厦的刘维伟，李春江更胜一筹，还有选择！,1,3,0,2022-07-17 20:52:58,来自陕西,1869599577225470,自由山雀9l
7122594752045859625,建议李楠二进宫执教中国男篮,10,38,6,2022-07-21 07:06:33,来自河南,54530059888,喜洋洋156108191
7122636366009647875,这场比赛前赵睿发烧了，孙铭徽也出了很多的虚汗，这种反复的情况对球队影响比较大，但大家都坚持着进行比赛，这也让我很感动。”很好的借口。杜峰你究竟是承担责任还是找借口？你责任。。。说说责任在哪－,0,1,1,2022-07-21 09:47:24,来自辽宁,3008714390900867,正能量完美星辰Eh
7122562038760866560,杜峰创造了历史！从来没输过的球队也能输！,1,55,1,2022-07-21 05:02:00,来自辽宁,81791904015,白水依然666
7122574833233429289,其实最应该解释一下为什么胡明轩发挥不好却每次都是首发而且场上时间那么长时间吧！,2,11,0,2022-07-21 05:50:01,来自辽宁,55012840841,肥波46
7122615309089391375,我们不要赢了吹上天，输了贬入地。今天这场球我全程看了。队员们在场上是很拼的，带病坚持，念人感动。少点失误，罚球准点就赢了。为周琦、徐杰点赞！另外，队伍不齐，裁判黑，对方野蛮拼抢，也是我们输的原因。,0,6,1,2022-07-21 08:26:13,来自贵州,2963903697913288,正能量艺术家Sc
7122646515088130820,输给黎巴嫩在情理之中。黎巴嫩不是被赛会排在亚洲第一位吗？说实话黎巴嫩实力是不如全主力的澳大利亚。但除了澳大利亚，可能亚洲其它队很难战胜黎巴嫩。一是二十号后卫太厉害，二是有引进的归化球员。如果胡金秋，郭艾伦出战，中黎将有一搏。,0,0,0,2022-07-21 10:27:54,来自四川,109908415964,林之亭上
7122509145576080168,没有如果 输了就是输了 要是郭艾伦在场也输了呢 那会不会又是那个梗 郭艾伦打球独不会分享球 都是为国征战 理性对待吧 本质的问题是 球员体能差 基本功差 打弱队可以虐菜 只要对手打球作风强悍 防守强度大 连球都传传不出去 基本的东西都没有 谈什么战术啊,0,1,0,2022-07-21 01:38:01,来自安徽,6001915292,背上三座山
7122488525685572385,最后还上那个孙铭徽我真是服了,8,106,3,2022-07-21 00:17:26,来自广东,105128853917,督目睡
7122519324602368805,胡明轩和杜锋什么关系啊，只字不提，让他少出场5分钟估计能赢,6,53,1,2022-07-21 02:22:37,来自陕西,5451820479,事在人为别怂
7122595142384796453,如果周琦不上，这场比赛恐怕得输二十分开外。,2,47,1,2022-07-21 07:08:45,来自山东,1610135949550095,ネф̶ イω(๑•ั็ω•็ั๑)
7122592890169115404,杜峰终于为他自己的私心付出了代价，但这个代价未免太大了，翻看两队交手的历史记录，简直就是中国篮球莫大的耻辱[发怒],4,31,1,2022-07-21 07:00:30,来自辽宁,2440541957794899,爱吃烧鸡9527
7122487601851843335,输了肯定有原因。但绝对不是杜峰讲的那些不痛不痒的问题。他可能根本不知道男篮的问题。这样的教练水平如此的差，咋能带出来一个好的队伍。队员肯定也是有问题，如此多低级失误属实不应该。,11,126,4,2022-07-21 00:12:10,来自天津,923183212404846,一往无前荷叶dQ
7122628450364130082,看似揽责，实是推责，又是感冒又是伤病，好像这些问题其他球队都没有,0,12,0,2022-07-21 09:17:21,来自山西,778104399994503,散户不散
7122613397476475648,道歉是虚假的，下课是真实的！,0,2,0,2022-07-21 08:18:52,来自辽宁,96696940083,凡尘清心2723
7122612647560397604,中国男篮和男足一次次刷新的记录，不错👍，继续努力加油💪,1,9,1,2022-07-21 08:16:36,来自山东,50449350533,要跟对面说再见
7122625009746608929,"一直不理解，教练有自己钟爱的打法很正常，但不能总打一个打法吧？！选队员，是不是应该考虑各种情况？！为什么就不带三号位球员呢？！
在广东打一大四小，那是因为有威慕斯，国家队没有这个水平的球员，这套战术就没意义了！哪怕带个阿布，也是那么回事儿！顾全都要退役了，带去干嘛？表现确实好，但意义何在？",0,5,0,2022-07-21 09:04:20,来自辽宁,4388869672810704,目标人鱼线
7122480728754946827,没郭艾伦赵继伟了，也不知道把锅给谁了？[捂脸],6,39,2,2022-07-20 23:45:06,来自辽宁,72401752661,剑蓝秋雨
