7122629621941912360,战术，配合，默契消失，中国男篮明星们想个莽汉像篮下冲去，失误，失误，在失误，如果在这样下去，男篮将步入男足后尘,0,1,0,2022-07-21 09:21:49,来自天津,1284702452324620,微笑宇宙Go
7122572103627064097,真是墙倒众人推。不就是一场比赛吗？不至于都来指责杜峰。哪有常胜将军。胜败本来就是这游戏的魅力,1,0,4,2022-07-21 05:41:45,来自河南,86445265314,陶子2504
7122641068222317346,错了，杜指导！一是您可能高估了自己在球迷心中的地位，中国球迷的幸福指数在男足之后已经就没有什么不能承受了；二是技不如人已经是老生常谈，大家也都习惯了！不管如何，感谢您的付出与努力！,0,3,0,2022-07-21 10:05:32,来自山东,58159725206,百合的春天41
7122681971096159007,昨晚除周奇其他人都没有状态，这就是杜峰嫡系球员任人唯亲的结果 ，后卫线没有一个能独挡一面，那个真的是惨不忍睹，差郭艾伦十万八千里,0,2,0,2022-07-21 12:45:01,来自贵州,2502137695701048,安逸香瓜rN
7122482139052098339,这次没说虽败犹荣,1,10,0,2022-07-20 23:49:59,来自辽宁,92324017750,水滴石穿172
7120736950461465379,杜峰本身就是一个情绪容易激动的人，怎么能管控好队员情绪？,0,17,1,2022-07-16 06:57:31,来自北京,3835529102109455,风趣率真
7122665732969825058,说的对，一遇困难就喊下课，要知道当初没人接手这个烫手山芋，如果不是热爱，杜指导完全可以只做广东主教练，在家休息不爽吗？,0,1,0,2022-07-21 11:41:38,来自广东,96288445887,搬砖的小强
7122623006807524132,如果您身体健康有问题，请您回来休息吧！也不用在新闻发布会上吃药了，感谢您为中国男篮创造了新的记录！,0,0,0,2022-07-21 08:56:48,来自福建,1257431517102679,微笑奶茶0g
7122530468905845518,找郭艾伦去，可以甩锅给他。,2,13,1,2022-07-21 03:07:31,来自海南,95606003566,知情达理苹果zA
7121358137873056526,写的很好，姜伟泽第一次进国家队，连训练都没，到国家队时大家都生病，第一场是奇兵没错，第二场周琦，大王复出，开始打内线，比赛就一个球，,0,1,0,2022-07-17 23:08:17,来自广东,101013521262,12竹林听雨12
7122607669978202880,"总教练责任最大。球员身体状态竞技状态不佳也脱离不了主教练的调动。
虽在联赛后许多队员有伤病，但带队上就应该有时间调整。另对亚洲主要：竞争对手缺乏了解，对困难准备不充。",0,5,0,2022-07-21 07:56:31,来自福建,103978541071,纸上谈兵书
7121250286005682983,赞成让杜锋好好休息，让位。看看那位高人能把这期国家队带出一个新高度。,1,8,2,2022-07-17 16:10:11,来自浙江,73648308919,邑人独行
7122491086739636992,这次还是郭艾伦的责任，其他队员都为国打球，郭艾伦在家刻苦恢复训练，严重影响了其他球员享受比赛，所以才导致中国男篮创造亚洲杯最强战绩。,0,2,1,2022-07-21 00:25:06,来自辽宁,60069464181,最美风光
7122607748919214888,如果有大秋在，能减少内线周琦的压力，不得不说，打硬仗，中国男篮除了周琦，胡金秋。没有一个合格。昨晚输球责任完全在杜峰，如果战术安排得好，应该能赢下这场球。,0,2,0,2022-07-21 07:56:56,来自贵州,6006918901,聪颖船帆rA
7122647046519177984,从以前的亚洲冠军，到现在连4强都进不去。球员薪水比以前高了太多，国内联赛也经常打着，怎么水平越来越和男足看齐了？黎巴嫩又是小国，还饱受战乱之苦，人家球员是怎么做到的？,0,0,0,2022-07-21 10:29:16,来自浙江,100862429008,万物大历史
7122601076545159971,这已经说明了，中国男篮要想有好成绩，不能以广东后卫为主体打球，得以郭艾伦和周琦为主体建队。,0,10,0,2022-07-21 07:31:11,来自辽宁,111085521668,皮皮虾
7122627215421915911,我看完正常比赛，谁都不怪，球员之间配合打的太少了。这些货有时候不听话，自己打不进去还以为自己无所不能。跑位意识，协防也不行。,0,2,0,2022-07-21 09:12:39,来自新疆,4728102611,楼兰古国刺客
7122616035886269184,结果已经出来，多说已无益，希望尽快恢复过来，调整好队伍继续前进吧,0,0,0,2022-07-21 08:28:47,来自广西,2682443926616808,萍萍
7122483461700748062,有郭不也得输吗也叫郭一分吗,1,5,1,2022-07-20 23:56:00,来自吉林,6156023500,陳丽l范
7122622244014441216,还是技不如人，继续提高技能，中国男篮加油,0,0,0,2022-07-21 08:53:03,来自福建,3861932743596983,已重置
7122599796430930725,说了无数次了，中国男篮最大的症结在于让一个省队的主教练兼国家队主教练，如果不改会永无出头之日！,0,12,0,2022-07-21 07:26:52,来自湖北,5333676191,仁智51428861
7122575683746513704,中国队一传球失误太多，二罚篮丢分太多，三战斗意志不强，四是教练指责太多。一句话，技不如人，人不如人。,0,2,0,2022-07-21 05:53:32,来自湖北,1921578880998459,从头开始mzl
7122678701715915555,"强队失误弱队刷，
全场三分打首发。
攻不进去守不住，
享受比赛拿最佳。",0,1,0,2022-07-21 12:31:54,来自辽宁,6016686934,直爽三拗片
7122572892830794533,教练没压力，没责任，赢了，名利双收，输了，以道歉的名义推卸责任。,0,6,0,2022-07-21 05:43:07,来自河南,97286912580,季荣铁
7122544365674758952,胡明轩 孙明辉 赵睿 作为黎巴嫩后场核心发挥不错 姜伟泽 徐杰还年轻 输给这三个人很正常 周琦艾伦终于不用背锅了,0,15,1,2022-07-21 03:55:32,来自辽宁,1239202631,以话治话
7122598341389239073,中国男篮在赛场上乱成一团，主教练的技战术值得深思！场上瞎打乱撞，失误连连，要是不输球天理难容！,0,5,0,2022-07-21 07:21:44,来自陕西,105643386432,用户秦岭神树
7122682924721570574,别说输在了某一个人身上。关键是篮球职业联赛这么多年，从本来的亚洲第一，成绩滑坡成现在这个样子了。无法让人理解。如果篮球🏀职业化改革成了现在这个样子，还不如回到举国体制上去呢。,0,1,0,2022-07-21 12:48:54,来自河南,5868555156,15139094225
7122618312361804556,陶汉林打世界杯不行，打打亚洲杯绰绰有余吧,0,0,0,2022-07-21 08:38:37,来自天津,54671251483,阿步看世界
7122541125525259040,现在的中国男篮国家队已经变成杜家队了，不是杜疯自己人不用，比如姜伟泽,0,41,0,2022-07-21 03:52:26,来自吉林,106054186860,五月五的老五
7122519466969219844,兰球打成足球，集体下课吗？包括兰协。,1,11,0,2022-07-21 02:24:03,来自湖北,71836830912,江南奇峰7653
7122625512908210974,这种比赛不拿出真实水平是故意输？,0,3,0,2022-07-21 09:06:22,来自陕西,108224198431,山间有通途
7122584525301203744,主动揽责，说输球和队员没关系，是因为郭艾伦不在，这些都是他要精心培养的后位,0,14,0,2022-07-21 06:28:36,来自贵州,3592850304148851,张永松7
7122649039593947919,杜锋的原则就是以广东队为班底，以小个子后卫为主的策略早晚要吃亏！,0,3,1,2022-07-21 10:36:53,来自河北,6805922686,偶似王先生
7122623447595336482,主要这次男篮是残阵，新生代主力都在征战NBA，又有疫情波级，都是临时争调的二线队员，彼此合练少，还不够默契，打成这样已经很不错了，感觉这一届球迷配不上如此优秀拼搏的男篮,0,0,0,2022-07-21 08:57:36,来自湖北,5876545593,流年69825538
7122688687900476175,决定比赛的胜负的因素很多，球员的临场发挥和教练的场外指导只是一个环节，更多的因素其实在场外，在于联赛，在于青训培养机制，在于社会土壤。杜锋负不起这个责，姚明也是。,0,0,0,2022-07-21 13:10:38,来自四川,51168450653,兰思特
7122630969588859652,坚持用胡明轩，坚持3后卫小阵容，战术单一，输球杜锋不可推卸责任,0,5,0,2022-07-21 09:27:49,来自山东,85298581877,芒果豆浆
7122633416931803916,孙铭徽身体不好就让下场，为何还打完比赛？,0,0,0,2022-07-21 09:37:26,来自陕西,399816932208107,开心雨123
7122611846343066382,赢了就是自己厉害，跟教练也没关系,0,0,0,2022-07-21 08:13:20,来自云南,500979985289693,神秘葡萄98
7122621252187030309,哈哈，推责十次，终于背锅一次……但实话实说，男蓝小伙拼劲在，缺少核心统领，关键时刻没人敢出手能投进，这不是国家队真正的水平，希望继续努力！,0,3,0,2022-07-21 08:49:44,来自山西,5550122670,雪松林海
7122642566599836419,失误多一点儿，罚球差一点儿，和杜峰没关系,0,0,0,2022-07-21 10:11:20,来自北京,2981485495729085,智者海风Oq
7122595131350024968,胡明轩不是水货，他的移动、盘带都是不错的，唯一的缺点就是放不开，心理素质不行。,7,14,6,2022-07-21 07:08:57,来自江苏,1991946939677179,坦然面朝华夏
7122707712093504287,实话说，做为一个爱国心强烈的我不愿接受中国男篮止于八强！想骂杜锋教练又舍不得，因为杜锋是好教练。总之，心里五味杂陈…,0,0,0,2022-07-21 14:25:11,来自广东,98499453455,正大光明湖泊fxb
7122584493714293539,失败就会这样推责任，无聊不。如果输给强队，只要精气神在，正常。选人时候干嘛去了，训练时候干嘛去了，分析对手时候干嘛去了。,0,16,0,2022-07-21 06:27:19,来自贵州,76007037951,陌上2415662
7122588731185382185,从周琦的表现看，周琦到澳洲联赛这一年确实长球，证明cba联赛对抗不足。支持球员到欧洲、澳洲等高对抗联赛打球。,0,5,0,2022-07-21 06:43:16,来自广东,50046103819,江隆冰
7122671658665984775,打澳大利亚说郭艾伦效率低的可怕，这场胡明轩上场35分钟9中0闭口不提，又全是教练的责任了，好一个双标，厉害厉害👍,0,1,0,2022-07-21 12:05:10,来自辽宁,50688970466,XCQ丶
7122622929120183081,一切的一切，都努力过了！不用太过自责，体育不是赢了就是输了，胜负乃兵家常事！需要这种在逆境中坚持学习的精神！,4,0,1,2022-07-21 08:55:39,来自广东,52739592411,物够你惊
7121344246401663747,球队目前状况，谁当主教练都无办法达到理想程度，不能不务实际的评价杜锋。,0,6,0,2022-07-17 22:14:23,来自湖南,3214567554688619,外向清泉
7122649841041703715,不是给球迷道歉，而是全国人民,0,0,0,2022-07-21 10:40:15,来自河北,2035885947753966,富足圆月PG
7122622068264452899,唯一亮点，勇于担当，知耻后勇，未来可期。,0,2,0,2022-07-21 08:52:20,来自山东,18486871046,西北风管够
7122685456277783335,当96年中国男篮获得历史最好成绩第八名的时候，期待有新的突破就成了球迷的一种期盼，不料26年过去了，这个期盼已变得愈发遥远！放弃男足了，男篮也要让人心寒吗？,0,0,0,2022-07-21 12:58:51,来自海南,2013894197391544,谭心小语
7122596613243093796,结果令人失望，但可以接受。疫情影响，连场热身赛都没有，人员不整外加伤病缠身，能跟亚洲排名第一的球队打成这样，不容易！期待阵容完整身体健康的中国队再创辉煌！,0,7,0,2022-07-21 07:14:09,来自江苏,3718716571,淡然1366
7122606561797079843,杜锋真不适合当国家队教练,0,13,0,2022-07-21 07:52:22,来自辽宁,110327733711,rocky安
7120781310431806216,你确定中国男篮只落第三？,1,1,0,2022-07-16 09:49:49,来自广西,2128253340883310,缤纷春风x0
7122683176073544485,从第三节才看，黎巴嫩其实打得很烂，只不过国篮更烂，连续罚失几个罚球，还有最后一两分钟的那次进攻，内线对方三个人，己方没有队友在篮底还强攻，还竟然走步了，错失良机。,0,0,0,2022-07-21 12:49:44,来自广东,62992398685,微言510
7121289867506156301,吴前就怎么打不了国际大赛了，有他在还怎么用广东球员，这就是原因,1,6,3,2022-07-17 18:43:20,来自辽宁,3060651869604800,正大光明白云l1
7122610605441385227,杜锋，一个表情包的指导，现场指导所有的急躁，浮躁都写在脸长和夸张的肢体上，不是帅材的料。主帅的浮躁表现会影响球员的发挥。,0,6,0,2022-07-21 08:08:56,来自湖南,540563423900459,豁达杭州西湖
7122519781185880832,早说了不要过分乐观。。哎。新冠原因肯定有，不过现在男篮总感觉有些说不清的问题。哎，让专业的人解决吧。,1,7,1,2022-07-21 02:22:00,,4120618681771884,爱国者cat
7122619270630048516,如水壶是郭艾伦。绝对被批得体无完肤，无处可逃。,0,1,0,2022-07-21 08:42:09,来自广西,76416682204,一缕春风248541423
7122586989937574693,找个好教练吧，不要纠结于洋的还是土的，标准应当是：用人为能；有技战术训练和赛场有效指导能力；有赛场心理疏导和精神激励能力。,3,18,1,2022-07-21 06:37:36,来自北京,20155912693,随意151436121
7122642604445139749,看了整场，缺少了大侄子的有效突破是输球的原因之一。周琦+大侄子，最强联手应该能赢,0,3,0,2022-07-21 10:11:33,来自广东,4424886575693975,儒雅德哥
7122512191328699170,爱说啥就说啥吧！反正已经输了，又能怎样？回来吧！都辛苦了！,1,5,1,2022-07-21 01:50:29,来自上海,98936248775,晚风袭来
7122644959836013323,不行该换就换，教练队，早在第一节，黎巴嫩，连续得分，就应该暂停，指导，这场球，让所有球迷，逗不想看，当然，这场球，也同时表现最佳的，周奇，深受大家的赞扬，为他点赞[赞],0,0,0,2022-07-21 10:20:37,来自重庆,104804121433,进取帆船Ln
7122680108628296481,这次比赛打成这样没什么可说的，球员都已尽力。回归本质还是我们的联赛不行，和国足一样，还是要走出去多锻炼,0,1,0,2022-07-21 12:38:15,来自江苏,69967780234,金总
7122707916285264677,跟球员没关系？孙铭徽关键时刻那么多走步，失误是教练的意图？如果这都算教练的责任，那是不是可以理解为假球,0,0,0,2022-07-21 14:26:00,来自湖北,63429501570,80后的小人物
7122661871529984772,"为啥不用强悍的陶汉林
罚球太差 业余水平
广东的三个后卫 遇到防守强度就玩完 也就赵睿好点 但脾气比球技更厉害
主教练任人唯亲",0,0,0,2022-07-21 11:27:27,来自陕西,98273691936,瓦片969
7122503110161580841,这次杜峰没甩锅，主要是郭艾伦没来，要是郭艾伦来了，赢球都有甩锅,0,26,0,2022-07-21 01:13:55,来自甘肃,92162179749,心中江山
7122570027060314888,中国篮球最大的问题在队员最起码的投篮都不敢，没有自信。天天拿个战术板比划来比划去，比划下来罚球都不进。怎么能赢？还有最后1分钟真的看出来杜的执教应变能力有多差了！,0,11,0,2022-07-21 05:32:30,来自青海,95888071525,T_MAC167
7122563062418637568,一个姚，一个杜把篮球整的一团糟，输球几个字就过去了，有没有出来负责的,0,13,1,2022-07-21 05:05:47,来自云南,1802798197387612,真假不真假
7122603368601797379,#中国男篮黎巴嫩男篮# 以后国家队教练要签对赌协议，按名次拿工资，达不到协议要求，只拿基本工资，不然拿那么多钱，没有成绩，一个道歉就完事了？,0,1,0,2022-07-21 07:40:57,来自江苏,11295274187,宜恋八段锦
7121290087119274792,杜峰不适合当国家队主教练，因为他私心太重，从用人方面冲分体现了。,0,14,2,2022-07-17 18:43:28,来自山东,68148716634,好学松鼠dB
7122643273583166248,最简单的事都做不好，罚篮啊，都说姚明时期厉害，为啥你们看看罚篮就知道了，有几个罚丢的，中锋不进可以原谅，后卫罚不进，那还有啥希望,0,1,0,2022-07-21 10:14:03,来自甘肃,11409979601,极客光剪辑
7122514318704788258,历史上的今天：男足输给韩国、男篮输给黎巴嫩。悲哀之极,0,14,0,2022-07-21 01:59:34,来自贵州,54362201236,杨明6121
7122622813403677478,教练选人用人有问题，这场输主要是胡明轩投不进，孙铭徽的失误！,0,4,0,2022-07-21 08:56:02,来自四川,78885729373,楊康11
7122572503280960271,不是谁行谁上吗？22次失误，孙自己7次，最后大决战还让他在上边捣乱，不是你的责任是谁的责任，现在男篮亚洲三流了,0,8,1,2022-07-21 05:41:16,来自山东,50449361748,卡秃噜皮了
7122629763864199975,"现在的男篮和男足不逞多让 罚球不进 
运球失误 空蓝不进 中圈无任何威胁导球 无效传球 基本功太差 现在亚洲4强都进不去了 痛心疾首",0,0,0,2022-07-21 09:22:53,来自广东,5439446275,符凡迪
7122665068642943782,杜锋下课了，只能带省队，带国家队不行。私心重。,0,9,0,2022-07-21 11:40:08,来自云南,3161828948707118,快乐白云aD
7121564942540653347,到了该享受的年龄了，[捂脸][捂脸][捂脸]污辱性极强,1,1,0,2022-07-18 12:30:01,来自广西,716486110092116,西瓜太甜吗
7122627146782262028,输了是分数吗，是全国球迷的心，道歉有用吗！,0,0,0,2022-07-21 09:13:02,来自吉林,1750010226814397,wang
7122622787332145935,22次失误不是男篮的水平，单节得了3分才是！杜峰啊！？,0,0,0,2022-07-21 08:55:16,来自湖北,3380379014,桥哥13448826
7122491128070914856,应该让广东队主打首发说不定会赢！中锋苏伟，大前锋二飞，小前锋周鹏，得分后卫赵睿，控球后卫胡明轩,0,1,0,2022-07-21 00:25:53,来自福建,6231387152,元气的蓝莓
7121351780965122830,客观点，尽职就好，老杜也难，我们支持一下，换谁任教都一样，黄种人和黑种人，白种人体质上沒法比，非洲人能生吃毛肚，况且还不洗就吃，你和我能这样吃吗？差不多就行了，别这样平价一个尽心尽力的人！,0,3,0,2022-07-17 22:43:21,来自甘肃,1196689564148812,积极的远山H2
7122594819146711849,如今的男篮正在飞速追赶男足！在亚洲都沦落二流球队，何时觉醒？,0,8,0,2022-07-21 07:06:50,来自辽宁,5449966289,紫日55162127
7120742924317033229,国家队主教练应该专职！,0,4,0,2022-07-16 07:21:11,来自四川,2868005629863692,风雨兼程秋冬
7122642090471228193,这怎么还相互推锅啊 失利最重要是教练和球员一起再接再厉啊,0,0,0,2022-07-21 10:09:36,来自辽宁,50096392826,北大青鸟IT教育
7122573940631520033,杜峰的意思是说输球是队员失误太多了，和教练关系不大,0,0,0,2022-07-21 05:48:54,来自辽宁,553761818814991,有趣的苹果S0
7120711587388441381,负责应该是郭艾伦，因为没上场，输了你得背锅！[捂脸],0,6,0,2022-07-16 05:22:35,来自天津,50353007135,雪山雄鹰317
7122526933547975458,该下课了。。。,0,25,0,2022-07-21 02:49:52,来自辽宁,51952003007,嘘别BB
7122492502422291235,裁判的帮忙。黎巴嫩的队员拉、拽、推都不犯规。,0,2,0,2022-07-21 00:31:12,来自安徽,99244754034,通桥淠河2
7122679726958969607,中国篮协应好好反思反思了，这么大一个国家连亚洲四强都进不去，一输球就会以各种理由来开托，真正是什么原因，好好总结过没有。只有找到真实的问题才能走出亚洲，为国争光！,0,0,0,2022-07-21 12:36:14,来自新疆,12334322841,上进海浪wX
7120780294819054351,男篮这样下去，难免要走男足之路！,0,3,0,2022-07-16 09:45:31,来自黑龙江,421806995943044,潇洒鹏飞
7122555856956375849,既然说是你的责任，怎么个承担责任，如果下课真么简单，真的无语。篮球非得成了足球,0,4,0,2022-07-21 04:39:04,来自北京,99446215907,666否极泰来
7122667593240036110,无所谓啊，反正有男足垫底，加油以后就好,0,0,0,2022-07-21 11:49:06,来自江苏,3219838767480174,西西小屋子
7122614739666535199,真的不用道歉，男篮什么水平和实力球迷一清二楚，打三流球队都费劲，跟世界强队差距实在是太大了，输了是意料之中。,0,2,0,2022-07-21 08:24:41,来自河北,52228064482,八方六合
7122569172999045925,道歉不能解决问题，打球不能任人唯亲，下课是最好的选择。,0,9,1,2022-07-21 05:29:04,来自内蒙古,62448019011,远山的呼噜
7122492043791827747,杜锋你也有这种日子？主动辞职吧！漂亮点。,1,75,1,2022-07-21 00:29:04,来自浙江,51767247952,淡定134161421
7120701350660637480,国家队教练由俱乐部教练兼任是有缺陷的，对于全面选材用人制定战术都多了一层障碍。,0,11,0,2022-07-16 04:42:28,来自北京,17934201929,追求一句中的
7122616273557095201,CBA这球员平时就不练罚球吗？不管cba比赛还是国际比赛，基本水准都是二中一，野球场随便拉个人出来罚球也不会低于百分之八十命中率吧？,0,1,0,2022-07-21 08:31:04,来自山西,67377786051,人在山西
7122574849385808674,杜峰赶紧辞职吧！别让全国球迷闹心了！,0,5,0,2022-07-21 05:50:12,来自辽宁,3825890827451495,诗意生活家er
7122625974370026277,战术不灵活，跟不上对方的变阵；队友间基本的默契都没有，失误频频；防守不到位，外围空位出手，外围轻易突入内线；进攻不坚决，缺乏担当。不输才怪！我看了半场，下半场没敢看！,0,1,0,2022-07-21 09:08:06,来自河南,110167180333,年长球迷886
7122524324934370087,队员太紧张了，什么心理素质啊！别老喷胡明轩，这小伙子有提升的潜质。另外真的是能出去打球就别在cba打。杜峰就不评论了，用人、战术、节奏什么的看不太出来，可能我水平不够,0,1,7,2022-07-21 02:46:25,来自北京,56828032720030,michael叔叔
7121283753108226820,真正球迷的分析，值得点赞。,0,18,1,2022-07-17 18:19:40,来自广东,3913900523002253,念想的年纪
7122644560324657954,中国男篮都打不过黎巴嫩了啊？,0,0,0,2022-07-21 10:19:10,来自黑龙江,2317381850114871,纵横528
7122604813640155918,我根本没看。但如果大家认为，中国男篮本场毫无章法，那要问责教练脱不了干系！,0,4,0,2022-07-21 07:45:55,来自辽宁,91623511654,虹哥820
7122485433656738600,这时候看出来杜锋的水平了,0,6,0,2022-07-21 00:02:49,来自广东,54405856816,幸福冰淇淋r
7122608786170921743,杜锋当教练中国男篮不赢球的。,0,0,0,2022-07-21 08:01:10,来自辽宁,11015994208,user141533999171
7122605026354561824,这种教练水平有这样的成绩已经值得骄傲了，运气也不错，小组比较弱出线了,0,0,0,2022-07-21 07:47:27,来自辽宁,1944393785549160,哈哈😄
7122623333614535424,杜锋输球还是甩锅，什么输球主要责任在我们教练。应该是你主教练。,0,0,0,2022-07-21 08:57:07,来自甘肃,56031505365,友好人士
7122497369321177867,"担责喷，评下球员喷。
郭艾伦、赵继伟在地表已无对手，他到宇宙、地心找对手去了。",0,0,0,2022-07-21 00:52:50,来自广东,53213598175,没有绝对xXti
7122626086483493647,我们是职业球员，罚球不进，还打什么球！罚球都不会！我认为，罚球对职业球员来说，机械动作！,0,0,0,2022-07-21 09:08:06,来自山东,3874303592109315,梦幻芒果9H
7122623573525037824,最后时刻，孙铭徽两次突破失误，对方全部得分，这就是失败的原因。再有就是全队节奏不对，失误多。,0,6,0,2022-07-21 08:58:01,来自辽宁,51508061102,古道儒风LQ
7122626468932518687,教练当然起非常重要的作用！甚至起决定性作用！,0,0,0,2022-07-21 09:09:56,来自江苏,910037902951240,母婴健康管理孙老师
7122628995124151040,胡明轩到国际赛场真的不行，投篮不准，失误太多。杜峰太固执了点！,0,1,0,2022-07-21 09:19:14,来自河北,103113290886,于国山8777
7122667032763958050,杜峰赢了，胡明轩表现不错！上场时间稳居第一！,0,1,0,2022-07-21 11:46:46,来自黑龙江,100874757507,灵敏圆月p3
7122608248553030432,首发上王哲林就是错误，结果被打爆造成全场被动，但是轮转中锋确实没人，没关系，输了下次再来，整体打的还是可以的,0,1,0,2022-07-21 07:59:43,来自浙江,6922679621,好学熊猫SN
7122631257842451240,"“输球的最大责任在于我们教练，跟球员没有太大的关系。”
“今天输球还是自身的原因，22次失误不是球队真实的水平。”",0,0,0,2022-07-21 09:28:15,来自马来西亚,100453551948,DevilInside494
7122607956872430343,这么说吧，罚球太差，三分太差，失误太多，比赛能赢才怪呢！！！！,0,0,0,2022-07-21 07:57:58,来自山东,1425447644834627,爱生活的春风14
7122577353670542119,22对7的失误，31中19的罚球！把比赛想的太简单了！,0,1,0,2022-07-21 06:01:11,来自辽宁,60135938749,小诺米团496
7122640016459170574,罚篮成数高点不会是这结果，另点下孙明辉，赛场上不是不痛不痒的明星赛，不是玩表演地方，为什么系要背后传球？从哪球失误开始人家就起势了。,0,1,0,2022-07-21 10:01:32,来自广东,3733587046172132,F顺意
7121292612576772899,不管怎么说，全國球迷眼睛是亮的，网上总么这么多人认为杜峰不行，早點下课吧！,0,7,1,2022-07-17 18:53:14,来自吉林,84461318095,时髦山雀Tn
7122636018733368102,教练情绪控制能力不行，整场比赛没有鼓励队员，反观33岁的对方教练，总觉得有点惭愧,0,0,0,2022-07-21 09:46:02,来自陕西,6307270252,德芙棉花糖
7122509575958020898,看来男篮是在向男足靠拢啊！千万别成难兄难弟！总得给球迷一个看比赛的机会吧！,0,11,0,2022-07-21 01:40:18,来自四川,2080708757293615,高级咖啡he
