7133083637079737123,这种时候不该报警吗？,1,7,0,2022-08-18 13:28:36,来自北京,3575243276825703,月华流君
7133068602580042534,给店主点赞,4,13,0,2022-08-18 12:30:41,来自天津,104851901265,天津张姐Q2aH
7133133712317432576,家长教育不到位！这么大女孩应该知道拒绝陌生人触碰，我女儿4岁多，我经常告诉她女孩子哪些部位不可以给别人碰到，碰就是耍流氓，要和陌生人保持距离。这些她都记住了，有时候妈妈都不让碰的。,0,2,0,2022-08-18 16:42:57,来自安徽,3025499128607279,逆风莫解意
7133341787753661225,我小时候大概小学三四年级，我们家住在厂区，周围住家户很少，有天晚上我爸去朋友家喝酒，我妈让我去找我爸，中间要路过一条又黑又长的巷子，两边都是厂房的围墙，去的时候我发现有一群男的，一直跟着我，大概四五个人吧，回来快要到黑巷子的时候我发现他们还跟着我，然后我就害怕的不敢走了，正好不远有我爸另外的朋友家，我就去他们家门口玩，那群人就一直在旁边，后来过了好大一会，正好我舅妈也来找我舅舅，她问我怎么这么晚了还没回家，然后那群人就走了，过了一会我才敢回家。现在想想我爸妈心真大，后来我又自己回家了，心也挺大的，[捂脸][捂脸][捂脸],0,11,4,2022-08-19 06:10:54,来自安徽,2154648224400371,风姿卓越帆船ym
7133249189878285071,必须报警，不然还会有其他孩子遭殃,0,128,3,2022-08-19 00:12:00,来自意大利,3113872010,长颈鹿在意大利
7133228380975072037,我女儿4岁，有一次我老公的姑父一巴掌拍我女儿屁股上，我女儿很生气走开了，我给我老公说以后不带女儿回他老家……,6,34,2,2022-08-18 22:50:32,来自陕西,3939468612,馨改变
7133080437291385612,性质恶劣，必须报警！,5,922,14,2022-08-18 13:16:59,来自重庆,84684242672,山水重庆
7133193848331338530,必须报警，否则下一次不定哪个孩子受到伤害,1,1,0,2022-08-18 20:36:01,来自山西,55491424027,沈健
7133062329343787808,报警抓起来,1,1,0,2022-08-18 12:06:21,来自广东,2880549013,879c
7133167295346049826,"我有一个朋友也是流氓
在女儿五六岁时被他摸手臂和背，被我骂了一顿，回去跟女儿交代清楚，不能接触爸爸以外的男人，现在坏人很多，要警惕，特别是亲戚朋友",9,179,12,2022-08-18 18:53:14,来自云南,6426991999,熊宝1122
7133171334200673058,必须报警，孩子的母亲太没有安全意识了,6,266,6,2022-08-18 19:08:47,来自广西,111380275915,迷香L
7133204172245222152,为老板点赞！不过，人走了再报警还能找到吗？,3,208,7,2022-08-18 21:16:23,来自河南,2088711561938331,用户名吉祥如意
7133209395538428702,小女孩的称呼还够迷惑人的，我以为小女孩只有4、5岁呢，原来都14岁了，这个年龄能容忍陌生男人的非礼，恐怕自身也有问题了。,3,48,7,2022-08-18 21:36:57,来自河北,5929096601,6601欢乐老马
7133154125449282304,性质恶劣，必须报警，，都14了也是个大姑娘了，,3,230,5,2022-08-18 18:02:04,来自河南,3337716856530216,五彩缤纷LY
7133221110115746594,小女孩到底多大啊？三四岁四五岁就没有保护意识算了，十来岁了还不懂吗？陌生人搂搂抱抱咋不做声呢？,2,55,4,2022-08-18 22:21:58,来自江苏,4120612761764244,上善若水Uk5a
7133103308101387040,老板应该报警[发怒][发怒][发怒],4,240,3,2022-08-18 14:45:59,来自广西,58520726343,足智多谋阿尔法装甲
7133085035494245124,儿童安全问题真的不容忽视，还好这个店主聪明勇敢。,0,1,0,2022-08-18 13:34:51,来自广东,109954770403,稻香加油
7133061522464490251,什么鬼人都有,1,3,0,2022-08-18 12:03:09,来自湖南,22972960882,用户宠夫萍儿
7133354177652081445,必须报警，还会有累事出现，也有可能更严重的事发生，一定要报警，望母婴店老板协助小女孩家长，好人一生平安,0,0,0,2022-08-19 06:59:08,来自广东,104427667730,不凡清风Ku
7133159827999556389,唯一的办法就是报警，否则该男子还会祸害别的孩子,0,238,5,2022-08-18 18:24:25,来自新疆,4248164402996968,梦幻宇宙Lv
7133227902724129577,母婴店老板是好人，愿好人有好报！,0,40,0,2022-08-18 22:48:30,来自安徽,461438335849181,快乐小猫n8
7133183462143705867,报警对女孩名誉有影响，以后注意防范。,4,24,9,2022-08-18 19:56:19,来自山东,3526846195174391,智慧橘子HO
7133109456099476231,这位母亲的心真大。,5,182,3,2022-08-18 15:09:19,来自陕西,3323331864,平安是福140260256
7133349699918562081,关键是十四的女孩也不小了，自己怎么就没有一点风险意识，其母亲也心大的不当回事，这家人思维方式存在一定问题，如果她们还大大咧咧的没有警惕性，风险则还会重现。,0,0,0,2022-08-19 06:42:42,来自江苏,2853954885263155,自由随心所欲就好
7133103238509445891,小孩子在外，家长一定要注意安全，尤其是女孩子。[祈祷][祈祷],2,1,0,2022-08-18 14:45:34,来自陕西,15310538639,飞飞虫儿
7133288645381325601,这个母亲心也太大了，发生这样的事居然不报警，为母婴店的老板的正义之举点赞[赞][赞][赞],0,5,0,2022-08-19 02:43:43,来自安徽,86133769171,012402240405
7133344663327146786,作为一个母亲，还没有一个陌生人关心自己的孩子呢。快递点的翟先生做事果断，为人正直值得感谢,0,1,0,2022-08-19 06:22:08,来自河南,52427616954176,豫见锦鱼儿
7133064320065405730,世上还是好人多啊！亏得这位快递站老板，给这位好心的老板点赞！,1,1,0,2022-08-18 12:13:24,来自辽宁,52629917062,邢威力8942
7133172198147752719,[发怒]如果没人报警，这段视频会不会有警察叔叔介入？,0,42,0,2022-08-18 19:12:08,来自河北,60223594360,海英54071
7133045262687552286,这位老板还真是好心人啊,2,2,0,2022-08-18 11:00:00,来自广东,101175455071,乘风破浪的星空IR
7133169337632375586,感谢有社会责任感的快递店老板，他不是事不关己的人，希望我们社会这样的人多些，不法分子就没有可乘之机了。,0,94,2,2022-08-18 19:01:09,来自重庆,2471356387830957,沙漠绿洲大漠无垠
7133085690660979459,店主该出手时就出手，有水浒英雄的既视感！,0,1,0,2022-08-18 13:37:13,来自广东,109954770403,稻香加油
7133326243055321871,太感谢老板！这孩子家长太没心了，报警为上！,0,1,0,2022-08-19 05:12:29,来自湖南,3624437476244831,神秘百灵鸟wZ
7133214105405932321,应该报警把这个流氓抓起来严惩。为这个正能量老板点赞[赞],0,30,1,2022-08-18 21:55:33,来自海南,55320842233,依一行
7133208476553102117,这个人流氓行为应该报警！不然更助长他今后不知还有更坏的猥亵行为！未成年女孩一定要保护好自己！,0,22,0,2022-08-18 21:33:00,来自河北,3210175273763976,上进的饭团N7
7133096015292334885,店主[赞][赞][赞],1,1,0,2022-08-18 14:16:57,来自湖南,110309450993,机智小鱼
7133096626923029278,为店主点赞！,1,1,0,2022-08-18 14:19:19,来自湖南,104782583570,天地人天人合
7133037346446066444,警方介入了吗？查一下,0,2,0,2022-08-18 10:29:40,来自江苏,52570267799,宝哥影像记
7133317810851726112,必须报警，孩子的母亲太没有安全意识了！,0,1,0,2022-08-19 04:46:14,来自河北,4279739007115779,江南十分
7133020721613456159,幸好快递站这个人看出来了，要不事就大了,0,1,0,2022-08-18 09:24:57,来自浙江,18596996388,咖啡慢慢生活
7133064515087876903,可是这么大的娃不是经常自己在小区里玩吗？我娃也自己拿过快递啊！想想可怕,0,0,0,2022-08-18 12:14:47,来自福建,1292676904533886,奇幻阳光9K
7133208302334460704,应该报警把这个流氓抓起来严惩。为这个正能量老板点赞[赞],0,9,0,2022-08-18 21:32:44,来自浙江,6833997825,沁沁小公主
7133325546502701859,支持老板的作法，报警来守护好未成年。,0,1,0,2022-08-19 05:09:45,来自江苏,3598016729065261,春玲（手机摄影）
7133178225916281611,报警啊，否则还会祸害别人家女孩，太恐怖了。,0,58,1,2022-08-18 19:36:16,来自河北,61196996975464,庄里人any
7133045222493897487,这个人太坏了，必须要抓住了严惩不贷。,0,1,0,2022-08-18 10:59:32,来自河南,97957256416,兰草6666
7133194806557901601,为了别的孩子应该选择报警；但为了自己孩子的名誉，放他一马也是可以理解的，但回去一定要和孩子说清楚这种行为是违法的，教她如何避免再次发生。,0,3,0,2022-08-18 20:40:34,来自湖北,4388849217450270,爱吃猫的菠萝包
7133239582375904014,为老板点赞，必须报警,0,3,0,2022-08-18 23:34:53,来自重庆,68353040549,黎祥群
7133176112007856899,希望更多的儿童都能在危险时遇到好心人。,0,1,0,2022-08-18 19:28:04,来自广东,109954770403,稻香加油
7133311801962005260,点赞见义闺为的店主心细如发,1,1,0,2022-08-19 04:25:40,来自海南,73237886051,风生3mlO
7133182371193176873,家长不能没有法律意识，自己的孩子细心保护才安全！,0,13,0,2022-08-18 19:51:33,来自北京,53652776655,积极的豆花NS
7133334776027218688,这个人流氓行为应该报警！不然更助长他今后不知还有更坏的猥亵行为！未成年女孩一定要保护好自己！,0,1,0,2022-08-19 05:44:43,来自安徽,3359739960366269,吴珺
7133242025545155335,为这个老板点赞！现在坏人太嚣张了，大白天的有监控的，就敢猥亵小女孩，必须报警！,0,7,3,2022-08-18 23:44:12,来自北京,1830033251117799,千岁康
7133200007301415714,老板应该报警，这小女孩躲过啦，以后注意防范，还有其他小女孩呢，不是每个孩子都那么机灵,0,11,1,2022-08-18 20:59:54,来自重庆,201914601187917,人善必人
7133178644968866560,必须报警。不然以后这个男人肯定还要犯罪。,0,23,0,2022-08-18 19:37:08,来自重庆,92078615092,枫叶34332
7133335593673245478,为正义的店主点赞[赞][赞][赞],0,0,0,2022-08-19 05:49:33,来自山东,52759738549,东方神珠0
7133239679025038112,社会环境恶劣小朋友一刻不能离开大人，不敢生娃，特别是女娃，心都要操碎了.,0,0,0,2022-08-18 23:35:11,来自广东,91682185283,凉凉佳
7133223405167428392,现在的家长啊，还有人没给自己孩子教育这些的吗？唉,0,5,0,2022-08-18 22:30:46,来自加拿大,3636792390323773,随机生成都不行吗
7133247323442299681,性质恶劣，必须报警！,0,1,0,2022-08-19 00:06:17,来自河南,110846983507,博学的面条zQ
7133229769789342467,为老板点赞，必须报警，否则他会祸害其他女孩子,0,2,0,2022-08-18 22:56:52,来自山东,92910605244,ABC12378
7133262545057514275,这个老板可以先调监控后，再接以公众人进行举报。这样既避开女孩以后被坏人记心引报复又打击了恶人行为。,0,0,0,2022-08-19 01:04:47,来自江苏,104910081656,敏锐沙滩0
7133085160417346337,遇到好人真的是一件非常幸运的事。,0,1,0,2022-08-18 13:35:24,来自广东,109954770403,稻香加油
7133342324125893376,赶快报警，不能让坏人逍遥法外,0,0,0,2022-08-19 06:13:05,来自吉林,96880956789,邂逅97849
7133229799942357800,支持，性质恶劣，必须报警！严惩[赞][赞],0,2,0,2022-08-18 22:55:56,来自新疆,103020572388,外向星空nX
7133210066127487744,报警，赶紧抓这个祸害女童的大流氓，不然还有女童受害,0,4,0,2022-08-18 21:39:00,来自天津,1415771482760589,喜庆的风筝k5
7133330306765505284,性骚扰和猥亵是对孩子一生的影响，孩子小时候可能不懂 长大后要是回想起来 会产生严重厌恶感,0,0,0,2022-08-19 05:30:23,来自新西兰,98100881931,南半球飘雪
7133181118798824192,小女孩14岁了，应该有自我保护意识。发生这样的事应该报警，不然这男的还会害别的女孩。,0,14,1,2022-08-18 19:46:42,来自湖北,2787958845614855,文竹5191
7133253798600164131,为老板的这份警觉性、责任感点赞。这女孩有十几岁了，安全意识不强，怎能容忍陌生人在身上摸来摸去的，需要加强防范意识。,0,1,1,2022-08-19 00:30:08,来自浙江,111092775252,嘉乐说娱乐
7133233832580481807,为老板点赞！但感觉到女孩的母亲对孩子太不负责了，这样的母亲孩子的安全让人堪忧。,0,2,1,2022-08-18 23:11:30,来自上海,98645574396,鑫想事成婷
7133238590230184741,家长的反应让人不解，孩子回去希望家长能正视。,0,5,1,2022-08-18 23:31:07,来自山东,3460863538246366,馒哥的宝宝
7133245697612497705,当家长的要教育好孩子。怎样正确地保护自己。,0,1,0,2022-08-18 23:58:06,来自辽宁,111432222732,外向清风13
7133039281224467208,女孩子出事，往往都源于父母心大，以为让她独自一人没事儿，偏就出事了。,0,1,0,2022-08-18 10:36:57,来自河南,4032646873621412,生命百态
7133064893301506850,店主是好人，祝生意兴隆！,0,1,1,2022-08-18 12:15:46,来自山东,1148314809011688,89548113691
7133031239149208354,还是好人多呀！,0,1,0,2022-08-18 10:05:04,来自广东,3034290405784079,丑小鸭upup
7133346245326029607,要报警，要严惩犯罪分子[赞][赞][赞][赞],0,0,0,2022-08-19 06:35:27,,4433710363447735,爱生活的花猫8F
7133044656681911076,当地警方应该马上启动调查，立案侦破！,0,3,0,2022-08-18 10:57:39,来自陕西,3566460197152280,老虎6258035720261
7133265541028266764,性质恶劣，必须报警,0,0,0,2022-08-19 01:20:28,来自四川,54004519555,QING悟
7133210238886658855,不报警后果真的很危险，不仅解除不了以后对自己孩子的危险，还会给他人带来危险。更是使社会上这种人更多更猖獗！,0,2,0,2022-08-18 21:40:21,来自河北,901240554794157,交心讨论者
7133215106888057612,性质恶劣，应该报警,0,5,1,2022-08-18 21:59:15,来自湖南,101262000347,稻香村里稻花香
7133345305885672230,男子的行为已经涉嫌违法,0,0,0,2022-08-19 06:25:44,来自广东,3861126366629469,余生有你ZLY
7133211223285973795,必须报警，孩子的母亲太没有安全意识了,0,4,0,2022-08-18 21:43:36,来自江西,2630446250468008,愉悦的海燕tS
7133322115604529961,必须报警，把这个流氓绳之以法！否则他还会祸害别人！,0,0,0,2022-08-19 04:57:34,来自江苏,3007898686076686,梅蘭
7133205312219497250,支持报警，坏人要绳之以法！,0,9,1,2022-08-18 21:20:28,来自浙江,5786361018,老强的妈妈
7133258542835843876,为什么不报警？？？,0,0,0,2022-08-19 00:49:59,来自四川,102312005071,用户7291678911800老
7133228714233922304,好心的店主，家长连监控都不看一下吗？,0,0,0,2022-08-18 22:51:39,来自北京,2559302218296445,博学蛋糕JO
7133229446630654735,一定要报警，太可怕😱,0,0,0,2022-08-18 22:54:28,来自浙江,4441678200708895,Jessica6495
7133242482850382623,绝对报警！！！,0,1,0,2022-08-18 23:46:20,来自湖北,106898008241,缤纷漂流瓶G1
7133179646023205663,报警！让这个男的受到应有的惩罚，否则他将继续祸害其他人。,0,11,0,2022-08-18 19:41:16,来自辽宁,6625362894,兰100291016
7133220487869547279,为老板点赞[赞][赞][赞][赞][赞],0,2,0,2022-08-18 22:19:24,来自吉林,2123851260507197,有趣的小羊5n
7133181670747800355,这是什么东西？路都走不稳了还这么坏，拘捕他！,0,4,0,2022-08-18 19:48:39,来自甘肃,60019960481,爱生活的陌上清风
7133041345479869216,孩子择怎么不知道反抗,0,0,0,2022-08-18 10:44:57,来自四川,109623244496,klana88
7133206983851213599,应该报警!,0,2,0,2022-08-18 21:27:23,来自湖北,62994951732,武当微言
7133277310601560847,“小女孩的年龄明显不足14岁，而男子的行为已经涉嫌违法。”这句话很有问题，女孩如果满十四岁，男子的行为就不违法了吗？法律规定，男人摸十四岁以上女孩不违法，是吗？,0,0,0,2022-08-19 02:04:18,来自广西,105904448776,峰之剑
7133237120109740830,我同事一儿一女，她说养女儿比儿子操心多了,0,1,0,2022-08-18 23:25:09,来自新疆,99355753850,没情绪的雨
7133193033012970240,不足14岁……好惊讶。13岁左右的女孩子，不懂一点基本常识？？？,0,7,0,2022-08-18 20:32:56,来自湖南,51113403542,微熙时代
7133173379771237120,这种人应该报警抓他,0,7,0,2022-08-18 19:16:50,来自安徽,102628691560,德才兼备橘子L4
7133194075121419049,为了避免这种事情再次发生必须要报警，家长也真是心大怎能让未成年的孩子去取快递呢？万一发生啥事后果不堪设想！太可怕了！[发怒][发怒][发怒],0,3,1,2022-08-18 20:36:53,来自浙江,1903984942527284,安徽亳州人在上海浦东
7133062626308834056,孩子还小的时候，父母一定不要让孩子单独一个人出去,0,0,0,2022-08-18 12:07:10,来自陕西,1284647685980532,清新溪水DP
7133178263530439458,就要这样，不让他们有机可乘[赞][玫瑰],0,1,0,2022-08-18 19:35:36,来自江苏,2805575197404031,院上茶舍跟你弹琴说爱
7133294710336488206,为老板点赞必须报警光天华日之下性质恶劣绳之日法,0,0,0,2022-08-19 03:17:33,来自山东,4314953221676654,敏锐雪碧03
7133254540912116495,报警是唯一的选择,0,0,0,2022-08-19 00:32:51,来自辽宁,109887025020,在水一方285975446
7133144386745238312,肯定报警啊！,0,16,1,2022-08-18 17:24:17,来自安徽,163171738852760,迎古稀
7133183771717321485,应该报警，而不是赶走！,0,7,0,2022-08-18 19:57:21,来自上海,3385218042,王唯行
7133197518707508009,第一时间报警，不然坏人会有第二次，第三次甚至更多的作案机会。,0,2,0,2022-08-18 20:50:14,来自北京,59152055633,静心159929481
7133216348629009156,不报警，还会祸害别的孩子,0,3,0,2022-08-18 22:04:20,来自山西,92803566945,我shi中国百姓
7133245733058462468,为店老板点赞👍,0,0,0,2022-08-18 23:59:30,来自山东,9671821491,运筹帷幄金桔EY
7133214102448735014,[赞][赞][赞]要讲这些人给曝光，太没人性了,0,1,0,2022-08-18 21:55:16,来自贵州,1042771956731037,阁楼上的小猫咪
7133229749245461278,母亲会害了孩子,0,1,0,2022-08-18 22:56:18,来自北京,97754014907,吴越1999
7133332311789339425,老板你好，我相信你是正义的化身，请好人做到底，报警吧,0,0,0,2022-08-19 05:35:23,来自江苏,60763972661,春蜜my
7133276794119684898,那个快递按照小女孩的要求，我给她买的，怕她不知道取件信息，把写有信息的纸条给她了，她才十二岁，经常要求我给她买东西，让我随便偿试她身体的每一个部位，聪明的小女孩！,0,0,0,2022-08-19 02:02:45,来自河北,94321376517,中国123456789103333
7133188380246180623,为啥不报警呢,0,3,0,2022-08-18 20:14:46,来自新加坡,95938369239,海角天涯7763
7133289148454568717,报警吧，他还会祸害其他人,0,0,0,2022-08-19 02:46:14,来自河南,58737300051,明月167507972
7133227599987311393,我姐的女儿才4岁，我摸她头她都打我。洗澡的时候叫我走开。说我是男孩子不能看。我姐教的好,0,1,0,2022-08-18 22:47:48,来自广东,6526065344,阳ge
7133348831428903694,必须报警！！事情没那么简单,0,0,0,2022-08-19 06:38:49,来自河北,6277752339,不敢说84283849
7133237094566527756,应该报警，要不然有后患,0,1,0,2022-08-18 23:25:26,来自海南,5828343255,带着风儿去流浪
7133256476801614603,为这位好人点赞赞赞赞,0,0,0,2022-08-19 00:42:56,来自内蒙古,98087638491,心语93865
7133238847344853760,为何不报警？,0,1,0,2022-08-18 23:31:01,来自河南,2796759029909935,濡沫以秋
7133318473727705869,应该立刻取证并核实坏人身份！店主虽善但愚，小孩不小缺家教防范意识差！,0,1,0,2022-08-19 04:46:18,来自广东,108706150644,坦荡济民
7133332643068232452,为了更多的女孩的安全，必须报警。,0,0,0,2022-08-19 05:37:27,来自山西,55196877956,太阳神250552592
7133187137486439209,应该报警，不要他在祸害别的姑娘！,0,2,1,2022-08-18 20:09:58,来自河南,111075470569,平凡的一滴水
7133044417157710630,为店主点赞！满满的正能量！,0,1,0,2022-08-18 10:57:06,来自广东,87057734021,快乐的懒虫
7133182933942305548,母亲对这事看得太简单了，她不懂法律，老板懂法也该帮忙报警！否则坏男人还要祸害其他女孩。,0,1,0,2022-08-18 19:54:14,来自四川,1939186566306008,春秋复回86868
7133200757587247912,即使父母不想报警，这种情况其他人都可以报警吧？,0,2,0,2022-08-18 21:02:53,来自广东,58900628074,李锦华22
7133031168521814784,为老板点赞！,0,1,0,2022-08-18 10:04:56,来自广东,3034290405784079,丑小鸭upup
7133177615451603744,我们这里快递在小区物业的多，还有快递柜，外面小店我到还没拿过！,0,5,0,2022-08-18 19:33:35,来自江苏,81954563646,微微听雨
7133246875389444876,个子不高的小女孩，看上去没有14岁啊，确定14岁？,0,0,0,2022-08-19 00:03:56,来自山东,2612886202758318,looking
7133206566857720579,"有网友说中国是最安全的国家。我也不敢反驳，怕伤了他们的爱国心❤
什么时候小学生敢放心地自己上学，不用家长接送，再说吧",0,1,0,2022-08-18 21:26:16,来自山东,84679699427,东夷部落ok
7133162677785953036,必须报警。不然以后这个男人肯定还要犯罪。,0,12,0,2022-08-18 18:35:53,来自上海,6339178706,永长吴
7133194155312055070,肯定要报警，要不然得出现多少类似事件？？？,0,2,0,2022-08-18 20:37:29,来自北京,108248127719,黄河入海口666999
7133124611214312206,这位母亲没有意识到,1,10,0,2022-08-18 16:08:04,来自上海,50375229716,乘风破浪的百香果zV
7133219316417282847,为正义的老板点赞![赞][赞][赞],0,1,0,2022-08-18 22:15:12,来自广东,67992696433,清闲的飞鱼
7133307131210236706,不知道女孩的母亲咋想的，太没有安全意识了。,0,0,0,2022-08-19 04:02:38,来自河北,96452858132,沉着星辰Pn
7133110241935491880,养女儿真让人担忧,0,0,0,2022-08-18 15:16:30,来自上海,5724495306,快乐微风j
7133174002071470889,必须报警！！！,0,4,1,2022-08-18 19:19:07,来自云南,4388896375847655,笑笑不说话野
7133210797089866509,应该报警，这是公诉案例，当事人不举报也可定罪！,0,1,0,2022-08-18 21:42:04,来自湖南,4181900512,长剑东风荡群魔
7133215344382132999,必须报警！！！！！！让警察处理！！！！,0,1,0,2022-08-18 21:59:48,来自重庆,6297894526,单身84766752
7133153056337691428,一定要报警,0,7,0,2022-08-18 17:58:06,来自浙江,24404978893,上进奶茶Ax
7133195099219477259,必须报警！,0,3,0,2022-08-18 20:41:30,来自新疆,6118707117,手机用户冰山二二
7133214391109141262,有一种可能，这个男人和小孩母亲认识，而且有持殊关系，店主应立即报警,0,0,0,2022-08-18 21:56:10,来自江苏,286338533297037,敏锐船帆IF
7133354228219118348,还是报警，是保护了自己的孩子，也保护了其她的孩子,0,0,0,2022-08-19 07:00:20,来自重庆,637340478354648,幸福远山FM
7133236597587378952,太嚣张了，严惩不贷[刀][刀][刀],0,1,0,2022-08-18 23:23:17,来自湖南,61188117604,莲170203155
7133234180867736361,希望当地警方重视，猥亵幼女，要判刑的！必须严惩,0,1,0,2022-08-18 23:13:11,来自山西,60975796753,Q听风吟
7133229433229771535,支持报警！,0,1,0,2022-08-18 22:54:26,来自重庆,106058463187,ABcD周锦炎
7133045321562850062,这位老板还真是好心人呐,0,1,0,2022-08-18 11:00:13,来自广东,101175455071,乘风破浪的星空IR
7133061872626549540,报警,0,1,0,2022-08-18 12:04:36,来自广东,4124996745049383,江南花开
7133187263718294309,必须报警。,0,1,0,2022-08-18 20:10:48,来自广东,918826670373790,慧心若兰
7133228570201686784,前不久好像有个公开场合猥亵儿童的判了五年 这种行为是严重的犯罪行为 不是小事,0,1,0,2022-08-18 22:51:09,来自浙江,72412539009,独独大都督
7133128591244280611,现在也可以报警，取快递的地方有监控，,0,5,0,2022-08-18 16:23:06,来自江苏,86739589484,大军永余
7133275757006734087,没事千万别碰人家小女孩！,0,0,0,2022-08-19 02:00:58,来自四川,8242221761,2350532
7133335383169303300,可能孩子知道不好也不敢说,0,0,0,2022-08-19 05:48:43,来自山西,2049090997199604,wyl娃娃鱼
7133050442267411234,所以我怎么能放心孩子独自出门呢[流泪][流泪]，养女孩子就是比较操心,0,0,0,2022-08-18 11:19:49,来自广西,4182154068114264,Y515Y
7133081693186999080,防人之心不可无，女孩太小,0,7,0,2022-08-18 13:20:53,来自陕西,2682406079306014,好学橙子Z4
7133129070480835369,必须报警，,0,6,1,2022-08-18 16:24:54,来自山东,2541658736434253,分秒必争光束sm
7133183446410953507,为什么不报警？,0,1,0,2022-08-18 19:55:42,来自新疆,3513677810245827,乐观的清风MG
7133335793800102692,报警对变态及小女孩和家长都是一种警示和教育！,0,0,0,2022-08-19 05:48:55,来自湖北,3218661316,飞翎的翅膀
7133257319630766852,为老板点赞，敢于和坏人坏事做斗争[赞][赞][赞],0,0,0,2022-08-19 00:47:11,来自上海,59360420081,早春二月19
7133347886083523361,报警抓它。严惩流氓罪犯！！！,0,0,0,2022-08-19 06:36:05,来自山东,4340494496438328,永远好运相随good美
7133116085562884868,老板比亲妈靠谱,1,26,1,2022-08-18 15:35:03,来自广东,6385168425,My缪斯猫
7133216185097192205,必须报警。,0,1,0,2022-08-18 22:03:21,来自宁夏,1974344045301767,疑虑
7133176697532433192,绝对应该报警。,0,2,0,2022-08-18 19:29:31,来自山西,80926980782,心在远方9805
7133044501022769961,抓住了没？,0,0,0,2022-08-18 10:56:35,来自广东,1820400635099552,omlb0001
