7133257122334114568,这不是要不要远离大货的事，都在对向车道了，足够远离了吧？速度超过80的大货本身就有原罪,4,56,0,2022-08-19 00:44:22,来自浙江,4212952768723949,暮木谈心说情
7133236475553956646,这个交通故事要认真总结汲取教训：高速公路管理存在一些问题，一是超车道上很多司机长时间低速占道应加大处罚，二是分道限速不太合理，超车道120、中间100、边上80，三根道不超120都不能算超速。这样做便于快超车后车厢尽量不占超车道，像突发这种对面撞开防护栏的车辆事故时，逆行车辆离超车道远点，可以降低车毁人亡的概率。,51,160,3,2022-08-18 23:22:33,来自四川,76127783842,一杯有故事的水
7133266507635032868,看着像是货车为躲避汇入的前车，急踩刹车后失去控制了。,1,14,1,2022-08-19 01:22:58,来自河南,108695613035,自在平常心
7133244453178835752,今年真的不太平，到处出事故，溺水也死了好多人。,3,2,1,2022-08-18 23:53:07,来自江西,85618830960,越努力越幸运💕
7133230432262472448,可惜了，是出公差的研究院的,50,111,4,2022-08-18 22:58:13,来自四川,24480636893,悦西悦水
7133243852860687139,国家现在这么有钱，所有国家高速都修建复线吧，以后慢慢实现客货分流的高速公路，客货混行对于小车来说太可怕了！,3,68,1,2022-08-18 23:50:46,来自北京,1701663332897283,抗体抗原
7133212445627450127,看来是大货车司机全责，这个危害后果，足以判交通肇事罪了！,19,175,2,2022-08-18 21:48:13,来自云南,2968310424276664,张木法谈
7133284425580184334,这个货车没得商业险的，只有交强险。也没的钱的，认罪坐牢。只有看GL8 是不是超速认个次要责任。,3,1,0,2022-08-19 02:27:56,来自四川,2621665666668876,卡拉斯科
7133231795344343844,看了网传视频，肇事逃逸的还有一辆匝道驶入高速的货车未减速慢行引起的，主要还是黄某处置不当。应该保持直行让速不让道，这样万一出事也没这么严重，最多两货车相撞，主要责任还是匝道进入主路的货车司机，不减速反而是加速行驶,20,56,5,2022-08-18 23:04:07,来自四川,3431398774,富足面条Ow
7133246215223362338,辅路进来的大货没有避让直行肇事车，肇事司机一个急刹打方向，车辆失控冲入对向车道，这个事故责任怎么划分？,6,15,2,2022-08-19 00:00:18,来自海南,51719838131,秦奋258
7133234232549507880,大货车一律，只准走低速。低速公路上，只走最右边车道，速度40。,6,39,2,2022-08-18 23:13:06,来自广东,6761987309,飞龙在天之灵气
7133227984781050635,不知道能不能再好好管管大货车，今天走了一小节成都三环路辅道，个个大车各种超车、别车小车，感觉比看恐怖片还刺激！！！,8,73,2,2022-08-18 22:49:24,来自四川,1249497058128103,叶神
7133228683275535136,从视频来看点刹重点就行啦，咋还跑对向车道,4,4,0,2022-08-18 22:52:11,来自四川,101093807161,会游泳的小鱼123
7133245005266699022,确实应该更加严厉地管管大货车了，超重超速，在城市里都开得非常快，要是发生点什么事死伤就会非常惨烈，在高速上一旦发生事故就是毁灭性的,0,13,0,2022-08-18 23:55:49,来自四川,91522976264,笨笨710801
7133224418083848996,死亡全是企业的精英。肇事车辆缺乏经验完全没有必要变道，从辅导上高速的大货车完全是规定车道行驶，如果非得说责任就是上高速货车速度快了点吧。,15,33,5,2022-08-18 22:35:25,来自四川,3708732302,兰华体育
7133228039307445030,青龙到新津普兴那十几公里邪门的很，我从零一年开始到现在见过这段无数次车祸，自己走这段路基本都是跑三四车道，一车道一直带弧线，超级容易追尾,5,24,2,2022-08-18 22:49:52,来自四川,64570931043,戒206132668
7133229164194300683,行驶至成雅高速雅安往成都方向 K1868+470 米处碰撞并穿越中央护栏？ 和谁碰撞？,9,16,6,2022-08-18 22:54:05,来自四川,4566834981,云起先生
7133228884585612073,大货车上高速路速度应不超80！！,3,29,0,2022-08-18 22:52:16,来自四川,1059576284719501,一叶轻舟一菩提
7133282770017141539,车祸猛于虎，把宝贵的生命放在四个轮子上实在是太危险了！谨慎驾驶，保证人车安全，是司机的神圣使命！疲劳驾驶，打手机驾驶，带故障驾驶，超速驾驶……等等，这都是酿成车祸的原因，一旦发生车祸，再好的车也变成了吃人的老虎啊！奉劝司机师傅们记住这样比喻驾驶员这个职业的俗语:“手把鬼门关，脚踏生死步”。想一想，司机师傅的责任有多么重大啊？,0,0,0,2022-08-19 02:21:06,来自黑龙江,62726262006,祥昀1
7133351294953554728,大货车前排太高了，小车太低了，只顾前方，没顾上低处小车，特别是三环路铺道，个个都是大车各种各样的超车，别车小车，所以频繁出事故了。看着恐怖了！！！,0,1,0,2022-08-19 06:47:35,来自黑龙江,3359752246272151,爱家大海8C3
7133226758971032335,商务车被削顶，据说车上全是年轻的硕博,5,31,3,2022-08-18 22:44:01,来自四川,5992344238,风烟色调
7133237152221053731,无论什么原因。请大家开车不要玩手机，不要别车，不要走应急车道，不要变道舍不得打灯，不要逞能，珍惜自己的生命，饶了别人的性命,1,8,1,2022-08-18 23:24:31,来自四川,101213176512,还是不想吃饭
7133236358806094600,珍爱生命远离大货车。可这大货车从对向车道穿过来，怎么远离？以后应该规定货车在高速路上不能超过60码。,1,7,1,2022-08-18 23:22:28,来自四川,104973412848,遥远的峡
7133231015317488397,重点查查货车司机是否在看手机！！！,3,22,2,2022-08-18 23:01:25,来自四川,109865101789,吃冬瓜糖
7133224795315372815,高速路况追尾还相对轻点，毕竟相对速度慢点。但冲到对向车道伤亡更严重，是速度的叠加。中间护栏应该弄成有滚筒的能卸力的更好点,2,12,1,2022-08-18 22:36:25,来自天津,61932046394,风继续吹2450048
7133244674180907790,中国高速公路可以借鉴美国那种设计，对向的两条车道距离可以离得远一些，就可以减少这种悲剧发生了,1,3,1,2022-08-18 23:54:35,来自云南,98731403081,法外狂徒燕十三
7133266042662880011,这大货司机是不是睡着了,0,0,0,2022-08-19 01:21:49,来自山西,1935592155519335,汹涌寞红尘
7133227664412082957,大货车司机应该是疲劳驾驶！,1,4,0,2022-08-18 22:47:54,来自四川,2682457735568552,自由山雀dN
7133243467480007439,事故原因是什么？谁的责任？,0,2,0,2022-08-18 23:49:18,来自江西,4015856684119455,h蓝星儿
7133348937666609951,昨天路过看见了大货车了，车头都瘪了。,0,1,0,2022-08-19 06:39:15,来自四川,51675484869,美的太耀眼
7133214247593067299,应该是打瞌睡反应过度踩急刹，刹车单边了！,2,29,1,2022-08-18 21:55:18,来自四川,2787966992781768,成都大爷EJNX
7133245011067814693,最怕高速对向车冲过隔离带 真的一点反应的余地都没有 中间隔离带应该用重型水泥钢筋建造 看着绿化带或铁皮我就觉得不安全 一般我都走右侧车道,0,0,0,2022-08-18 23:56:15,来自湖南,104371746787,真客堂
7133231482323337988,高速公路有问题啊，匝道出来就是虚线，应该有一段很长的实线才对。,1,15,1,2022-08-18 23:03:11,来自广东,1570575677916430,易先生
7133230930470404905,今天路过了车祸地点，目睹了现场，没有拦腰断，网上夸大了,0,11,1,2022-08-18 23:00:09,来自四川,1597324274,CCCelina
7133354149693588263,如果不是大货车暴前胎引起的事故，那百分之百是大货司机疲劳驾驶造成的。小车被撞只能说是命不好，早一分钟晚一分钟行驶到碰撞位子都没事。[祈祷][祈祷],0,1,0,2022-08-19 07:00:05,来自江西,51160139427,盛世红花开
7133241600372769549,现在好多人开车都是边看手机边开车的，一点儿也不注意驾车安全问题,0,8,0,2022-08-18 23:42:31,来自广东,589773942828743,你是我的小宝贝55
7133246463039734539,大货车，尤其是大型货车，不应该走高速车道，,0,5,0,2022-08-19 00:03:06,来自广东,3469711434070173,一涂一抹深呼吸
7133345161094644493,交管部门应该高度重视，货车只许走慢车道，大货车有些驾驶员是没道德的，开车驾驶员要远离大货车。,0,0,0,2022-08-19 06:25:13,来自四川,3548826319468436,无忧的芒果Li
7133247905859224335,今年这是咋了？高温、疫情、水祸、泥石流，这又刷到车祸,0,0,0,2022-08-19 00:07:15,来自陕西,1135160257952391,逵道远
7133292187303396103,惨了！大热天司机们开慢点，10次事故9次。,0,0,0,2022-08-19 03:07:47,来自四川,61742902708,朴实星球iW
7133244003427844867,安全第一，谨慎驾驶,0,1,0,2022-08-18 23:52:43,来自内蒙古,108748900847,梦蝶0h0y
7133214795612373794,看了视频，居然猛加油?什么意思？,10,7,1,2022-08-18 21:57:20,来自四川,461448341887150,茶余饭后之天府之国
7133236367660090142,中间护栏要坚固一点，太脆弱了！,0,6,0,2022-08-18 23:22:17,来自江西,101281641470,旅行的蛙2019
7133249523618857758,看了视频，感觉货车好像左前爆胎了，爆胎后操作应该也有问题，刹车踩死了，视频中明显看到后轮冒白烟，最后车失控冲到对向车道了,0,1,0,2022-08-19 00:14:43,来自四川,50741008441,zhangyuandream
7133243400807531264,看来是大货车司机全责，这个危害后果，足以判交通肇事罪了！,0,2,0,2022-08-18 23:49:16,来自新疆,1478188801995740,金线化身
7133240369143694087,今天从城里去蒲江，结果在去眉山和雅安的岔路口被分流到乐山方向了，没想到是如此惨烈的车祸，在回成都的高速路上看到了[祈祷],0,0,0,2022-08-18 23:37:57,来自四川,51924662917,云淡风清149112414
7133228136737063713,我看到车祸视频了，太吓人了，就是我们当地的,0,6,1,2022-08-18 22:50:21,来自四川,2838335929,Q大漠骆驼
7133222011597357831,恐怖！右边匝道进来的货车离的还是有那么远，速度也不快，冲过去的货车司机头昏了吗,1,10,2,2022-08-18 22:25:42,来自四川,6791695362,ygvjkgdtujvfhjhdghsd
7133236984642011918,沃尔沃就不会发生这事，小车还是太脆了,1,0,1,2022-08-18 23:24:30,来自广东,3562832792129661,奋发有为喜鹊U5
7133238415188902656,货车司机处置不当，在距离足够的情况下刹车太急,0,5,0,2022-08-18 23:29:28,来自四川,6089815320,后来78634818
7133277049586008845,货车司机最少三年以上有期徒刑了。,0,0,0,2022-08-19 02:04:40,来自四川,4472676765,汏家的誠
7133228337610670863,所以高速路不要一直开左车道，突然冲一个车出来，鬼大爷反应的过来，货车很多都是占道,2,9,0,2022-08-18 22:50:13,来自四川,5983663390,詹姆斯虎大
7133248492428591911,大货车，尤其是大型货车，不应该走高速车道。,0,7,2,2022-08-19 00:11:20,来自四川,51077847064,旺旺86507
7133244562771821342,现在一些大车司机真的太可怕了，一次乘大客车坐副驾驶座，看到许多大车司机边开车边玩手机，自己想死，还要祸害别人！,0,3,0,2022-08-18 23:54:17,来自四川,1015549119446935,无忧的喜鹊W9
7133312062742201125,把大货车的轮毂设计小成小车轮那么大，重心底速度慢一点越障能力就没那么强了，类似车祸就应少好多了，也减少很多无妄之灾,0,0,0,2022-08-19 04:22:54,来自四川,5851021285,孤岛石匠68345894
7133344220605678344,货车驾驶员应该是疲劳驾驶,0,0,0,2022-08-19 06:21:20,来自四川,3548826319468436,无忧的芒果Li
7133253939848004365,道路千万条，安全第一条[蜡烛]活着的人更痛苦[蜡烛],0,0,0,2022-08-19 00:32:22,来自广东,3861961927299096,博学多才的猛猛讲故事
7133347991313826596,高速公路的中央护栏需要改造啊，不够坚固，改成一米宽两米高的混泥土结构,0,1,0,2022-08-19 06:35:34,来自四川,6047894324,铃铛啊哥
7133334992314762023,最讨厌的是两辆大货车在只有二车道的高速上慢悠悠的行驶，无论你后面如何闪灯提醒，就是不让你，估计心里想的是你敢来碰我吗？,0,1,0,2022-08-19 05:47:34,来自四川,2405386313279572,幽幽清泉爱悠闲
7133253170427544334,个别大货车司机开车注意力分散：疲劳驾驶、看手机、甚至看电视（小说）等，几次遇到车子跑偏又急刹又鸣喇叭又闪灯才唤醒。马路杀手、草菅人命！,0,0,0,2022-08-19 00:28:53,来自四川,602181628343484,淡烟味A
7133252793632506657,匝道并入主道路段！中间隔离带应当马上换装水泥防撞墎！防止对向车道冲击越线,0,1,0,2022-08-19 00:27:54,来自广东,6137524800,天空之城五颜六色
7133263264569524995,一直有一个疑问，这一类的重型大货车为什么不限速？,0,0,0,2022-08-19 01:10:23,来自四川,6322303986,85242345
7133247583489147684,车祸猛于虎，安全驾驶，生命第一！！,0,0,0,2022-08-19 00:06:46,来自河南,105651097212,老D不X
7133331857701782286,太可惜了，伤亡的都是年轻人[祈祷][祈祷][祈祷],0,0,0,2022-08-19 05:33:24,来自四川,52336183302,慈善099
7133246804116095783,这形同虚设的护栏质量合格吗,0,2,0,2022-08-19 00:04:16,来自江苏,51609835366,云博2000
7133249699767288610,这大货车绝对超速行驶了,0,0,0,2022-08-19 00:14:26,来自四川,5759868713,大熊188
7133231123022250789,控制车速，限号出行，减少车祸的发生,0,2,0,2022-08-18 23:01:24,来自四川,3532947383,正大光明芒果W
7133261217405174565,提醒各位司机朋友，不要长期占用超车道，运气霉了祸不单行！,0,0,0,2022-08-19 01:00:54,来自四川,51958368640,高哥不k歌
7133262006873768716,这是真的倒霉，你好好走着，别人都要跨栏撞你。这你有啥办法？[泣不成声],0,0,0,2022-08-19 01:04:35,来自山西,92202007125,倚楼听风雨276332056
7133249863055770381,货车太危险了，看到货车要远离，赶紧超过他,0,0,0,2022-08-19 00:16:05,来自广东,3412520013664600,道友请留步2311
7133251863327539975,大货车出事一律判刑！看哈那些死农民还敢不敢乱开？,0,2,0,2022-08-19 00:24:07,来自四川,89928442682,久久放映
7133241885225190152,上次四川江油那个货车司机还没判刑，这又是一起？,0,0,0,2022-08-18 23:44:02,来自重庆,59069387630,思念161758534
7133250994422530850,大货车，尤其是大型货车，不应该走高速车道，,0,0,0,2022-08-19 00:18:49,来自广东,3671987242147687,睿智陌路客人
7133353488481846055,成都绕城高速货车太多,0,0,0,2022-08-19 06:56:58,来自四川,108799785559,云淡风轻4CGu
7133243998864474914,建议将超车道改为应急车道，现应急车道改为行车道，可以提高应急反应操作时间！！,0,2,0,2022-08-18 23:51:19,来自四川,3033767108,山樵
7133280960443417358,我预测是大货车分神可能看手机之类的去了，突然发现有车进主路，下意识猛的一下打方向然后出现重大事故。正常情况不应该出现这种情况,0,0,0,2022-08-19 02:14:34,来自四川,107860584807,大月月的月月
7133239110701138703,这条是老高速，大货车总和小车抢内测车道，结果这回抢到对面车道了。。。,0,0,1,2022-08-18 23:32:16,来自四川,3333314548860807,奋发有为豆花sK
7133339321427608327,大货车司机坏得很！,0,1,0,2022-08-19 06:02:35,来自重庆,6255373797,金戈铁马和金迈郎
7133237654569108236,大货车出事都是大事，管理力度方法都有待完善啊,0,2,0,2022-08-18 23:27:51,来自四川,83571469359,博学阳光VN
7133274793386345247,别克商务车真是遇到飞来的横祸,0,0,0,2022-08-19 01:56:47,来自四川,52732805786,愉悦的山雀yw
7133352892664808232,开车一定安全为主啊,0,0,0,2022-08-19 06:53:42,来自四川,1266288056607472,冬方一条龙
7133267701082129166,命啊，跑到对面车道上去,0,0,0,2022-08-19 01:27:30,来自福建,2137872122517916,勇者铅笔0L
7133244039465943812,太惨了，感觉是大车突然刹车变道冲进对向车道的,0,0,0,2022-08-18 23:53:18,来自陕西,62961212621,吴烦恼微唠哥
7133249540056187648,这个大货车司机估计睡着了！！！远离大货车,0,0,0,2022-08-19 00:13:22,来自四川,5759868713,大熊188
7133226453386248968,远离大货车，马路杀手。,0,0,0,2022-08-18 22:43:09,来自四川,6379092358,86827388
7133240169838641961,限速80不能降低车祸次数，增加了疲劳驾驶的几率,0,0,0,2022-08-18 23:36:23,来自四川,3205830387439812,所以现在的
7133245833213903650,严管大货车！！！,0,2,1,2022-08-18 23:58:32,来自四川,102313680015,随性自由的海洋CQ
7133249268491928360,有的大货车司机开车不要命的快,0,0,0,2022-08-19 00:12:23,来自四川,1613673007947539,多才暖阳EN
7133355810960392991,护栏不科学,0,0,0,2022-08-19 07:05:27,来自湖南,52531765019,温柔小绵羊谁能代替你
7133262508945244939,路上开车，安全最重要，珍惜生命，远离大货。,0,0,0,2022-08-19 01:07:51,来自重庆,110118573954,想去郊外看风景
7133236299133403936,护栏要加水泥墩这个护栏跟纸糊的一样，还是空车。,0,0,0,2022-08-18 23:22:18,来自四川,53543265988,TK龙123
7133241416268006144,千萬別長时間在超车道上行駛！這是預防对向車道因故翻越隔離帶造成事故的發生！,0,0,1,2022-08-18 23:41:16,来自四川,3610432929801374,热情溪水s6
7133245793779172128,看了视频，一是司机技术问题，二是这辆货车车况也有问题。,0,0,0,2022-08-18 23:59:19,来自四川,2150268500708964,路过9314787279147
7133234039904895752,要限制货车速度，不要占用小车道，靠右行。,0,2,0,2022-08-18 23:12:48,来自四川,51804135351,说真话你我他
7133239623547355908,大货车如果不和轿车一个道。每天可以减少几百万人死亡,0,0,0,2022-08-18 23:35:38,来自上海,540591101318638,星辰大海kk
7133298178514092800,这种大货车司机肯定叛刑了,0,0,0,2022-08-19 03:20:52,来自重庆,6883854654,能屈能伸aa
7133237698017936162,感觉货车司机睡着了,0,3,0,2022-08-18 23:26:59,来自四川,95585129233,好事成双20140409
7133262223828583172,真的搞不懂高速要绿化带干嘛，遮挡视线？没有绿化带估计还有点操作空间！,0,1,0,2022-08-19 01:06:12,来自四川,72482259432,聪颖漂流瓶WQ
7133254387925500687,大货车上高速路速度应不超80！！,0,0,1,2022-08-19 00:32:58,来自黑龙江,105861237053,月儿弯弯赵53
7133230750518084387,货车司机安全教育刻不容缓,0,5,1,2022-08-18 22:59:36,来自四川,4158067724,raiden86
7133229391027028751,应该规定高速路上货车只能走靠外车道,0,0,0,2022-08-18 22:54:23,来自四川,50301266046,灵巧溪流Oj
7133239179210654501,成都绕城高速进出匝道设置不合理,0,0,0,2022-08-18 23:33:12,来自四川,91721102356,呜呜呜滴啊
7133222094330282764,司机师傅开车慢点！注意安全！[祈祷],0,10,2,2022-08-18 22:26:24,来自广东,360237941657619,沁媛丫头
7133240002930541327,十个事故9个快！！,0,3,1,2022-08-18 23:35:51,来自广东,4015881644163341,小海爱写作业
7133224002432107305,视频在哪？,7,2,1,2022-08-18 22:33:07,来自四川,997976713990627,一路小跑9988
7133239514109575940,飞来横祸，,0,0,0,2022-08-18 23:35:11,来自云南,4230520338135790,葬花兮居士
7133265171899777825,被匝道出来的大货车吓到了,0,0,0,2022-08-19 01:17:13,来自四川,902038034324707,率真光束PZ
7133349432762024741,经过匝道的时候，最好靠左行驶,0,0,0,2022-08-19 06:41:01,来自四川,108589481309,勇者小河弯弯
7133238369970291488,飞来横祸，招谁惹谁了[祈祷],0,3,0,2022-08-18 23:30:25,来自山东,60259079444,刚刚看到
7133249125856133888,行车安全不容忽视，对面的运气不好[祈祷][祈祷][祈祷],0,0,0,2022-08-19 00:11:59,来自四川,101910226389,南风窗264
7133257842970723084,意外无处不在，唉,0,0,0,2022-08-19 00:49:18,来自广东,4213762477291091,✨S꯭ᴛ꯭ᴀ꯭ʀ꯭s꯭ง。
7133239812886872872,天热高温天气、一定要休息、注意车况、特别是轮胎情况,0,1,0,2022-08-18 23:35:23,来自广东,6014920051,唐12138
7133254665479357199,说真的现在路上看前车刹车灯亮的频率和亮的时候，我就知道是不是老司机。不是我瞧不起有些人，白色10万以下车的司机开车大多数比较肉。,0,0,0,2022-08-19 00:33:53,来自河北,3773973070088144,蓝色陌陌
7133247777144374048,飞来横祸，大货车跑到对面道上“碰瓷”,0,0,0,2022-08-19 00:08:09,来自安徽,712957465985848,大海听潮追剧
7133252177216504609,开车还是慢点，注意观察，不要疲劳驾驶,0,1,0,2022-08-19 00:25:30,来自福建,94080860615,酒吧女见愁
7133355732632306466,再惩罚也换不来遇难者的生命,0,0,0,2022-08-19 07:04:55,来自四川,68318659760,缤纷芒果8
7133233521379885828,商务车被削顶，车上全是年轻的硕博,0,3,0,2022-08-18 23:11:10,来自甘肃,2795067323,九个九爪章鱼
7133246835728270080,血的教训太多！严管大货车！天天都在喊！结果呢？,0,0,0,2022-08-19 00:02:32,来自四川,95012658391,真诚叶457
7133228347097973515,别克车真是人在车中坐，祸从对面来！保佑伤者无碍！,0,1,0,2022-08-18 22:51:11,来自江西,101563929700,ZF梅花鹿
7133251458074018599,将超车道改变为应急车道的建议很好。,0,1,0,2022-08-19 00:23:06,来自四川,58764884989,看世界缚苍龙
7133269490846368549,可能是驾驶员分神或者是疲劳驾驶,0,0,0,2022-08-19 01:34:51,来自江苏,12892838009,好奇伊斯特尔4s
7133232540646900519,祸从天降！开车还是要注意安全,0,1,0,2022-08-18 23:07:20,来自四川,835241677959629,幸运柳叶Ld
7133353652936819486,说是命吧，他前面那个白色车就刚好躲过了，他就正正的撞上。,0,1,0,2022-08-19 06:57:26,来自四川,62117675596,道至简
7133256453917819655,这个交通故事要认真总结汲取教训：高速公路管理存在一些问题，一是超车道上很多司机长时间低速占道应加大处罚，二是分道限速不太合理，超车道120、中间100、边上80，三根道不超120都不能算超速。这样做便于快超车后车厢尽量不占超车道，像突发这种对面撞开防护栏的车辆事故时，逆行车辆离超车道远点，可以降低车毁人亡的概率。,0,0,0,2022-08-19 01:14:31,,870441792836733,王爱心新媒体工作室
7133238143490605859,四川省国土空间规划研究院的工作人员，出差一去不回了，哎可惜！,0,2,1,2022-08-18 23:28:29,来自重庆,101320086014,四川天丰石油
7133245811961807619,撞开了中间护拦？那是两层哟！可想而知？速度有多快？！,0,0,0,2022-08-18 23:59:55,来自四川,6513374017,浪子93427031
7133355684942578472,货车又在草芥人命了,0,0,0,2022-08-19 07:04:37,来自上海,5869740461,桥豆麻袋206
7133229993940861711,多半是大货车司机打瞌睡了,0,2,0,2022-08-18 22:56:29,来自四川,1868816506698852,鉴婊大师陈爽
7133239438926709541,車祸猛于虎，为車祸遇难者致哀。,0,0,0,2022-08-18 23:34:26,来自新疆,61270328024,沙漠一警
7133251215294710540,大货车必须靠右行,0,0,0,2022-08-19 00:21:33,来自四川,100091389471,别样的烟火8
7133250346054501161,开车不能大意犯困啊，如果出事，害得不光是自己,0,0,0,2022-08-19 00:16:27,来自河北,3536448773425456,爱唱歌小老斧
7133346557541696260,货车司机是否是看手机分神？,0,0,0,2022-08-19 06:30:48,来自云南,2713228549300862,我是A我是Z
7133357732559848231,飞来横祸！,0,0,0,2022-08-19 07:13:27,来自重庆,2678031454577048,聊聊居无竹
7133282326553346828,还能什么原因？睡着了！唉！,1,0,0,2022-08-19 02:19:12,来自河北,104650158179,中庸原来是中年平庸
7133211970404631311,货车没有超载，难道是疲劳驾驶？,0,3,0,2022-08-18 21:46:23,来自浙江,59596084195,大头的条头
7133229316510778147,美国枪击案多，中国车祸多,0,3,0,2022-08-18 22:54:01,来自贵州,61962390458,舍德得舍
7133230676593410829,看视频真的是飞来横祸,0,2,0,2022-08-18 22:59:47,来自四川,1212167815,大果粒小火鸡
7133251732771160846,哎，远离大货车,0,0,0,2022-08-19 00:22:59,来自四川,89928442682,久久放映
7133264739492627200,愿逝者安息，没有已知，只有后果。太可惜了。,0,0,0,2022-08-19 01:14:10,来自广东,3157443505299767,乐观的鲸鱼SD
7133355437277512451,开高速不要长时间在1道上行驶，在二三道上，随时都有2秒左右逃生时间。,0,0,0,2022-08-19 07:04:42,来自四川,77656802210,愉快的云彩
7133242854532563712,飞来横祸,0,0,0,2022-08-18 23:46:56,来自陕西,4155802302297972,晨光中的我
7133258495008326438,象故意肇事,0,0,0,2022-08-19 00:50:42,来自四川,104187948345,善解人意只有香如故
7133228059218002727,真是飞来横祸,0,4,0,2022-08-18 22:50:16,来自浙江,102501228093,积极的小鱼sk
7133242246677365535,太惨了[流泪][流泪],0,1,0,2022-08-18 23:45:25,来自河北,78598703840,汐公子说
7133230405301814054,这就是命啊，随便怎么想也想不到高速路上会被相反方向的车撞。,0,0,0,2022-08-18 22:59:02,来自四川,57573516001,白头话事人啊
7133230252755206946,每次走到高速闸刀口我都小心翼翼[泣不成声],0,0,0,2022-08-18 22:57:51,来自四川,103977222248,S88415
7133235192445076265,生命无常，危险无处不在。,0,0,0,2022-08-18 23:16:43,来自四川,102249139465,TSL双木
7133239298761032448,"愿逝者安息🙏🙏🙏
祝伤者无恙🙏🙏🙏",0,1,0,2022-08-18 23:32:55,来自四川,3645615046662108,晨光吉祥flsx
