7122654546106663680,做好六稳，六保工作，抓住经济恢复的窗口，努力经济平稳健康发展[赞][赞][赞],0,21,0,2022-07-21 10:58:15,来自湖南,2700818167112532,舒心惜惜
7122652829302997800,疫情要防住、经济要稳住、发展要安全。,0,23,0,2022-07-21 10:51:44,来自山东,102302926293,湖边依人
7121542410592699140,"疫情要防住、经济要稳住、
发展要安全、人民要幸福[赞]",0,22,0,2022-07-18 11:03:21,来自广东,2151091290789112,清风夜半扰梦
7122656931433169700,着力巩固国民经济企稳回升态势。,0,18,0,2022-07-21 11:08:14,来自黑龙江,2960341399243789,潇洒清泉PQ
7122652948416955175,疫情要防住，经济要稳住，发展要安全[赞][赞],0,11,0,2022-07-21 10:53:01,来自上海,2735192221950431,运筹帷幄钢琴0v
7121511575252665122,疫情要防住、经济要稳住、发展要安全”，在下半年交出平稳健康发展的经济成绩单！,0,9,0,2022-07-18 09:03:12,来自山东,11472414162,我爱我家275322711
7122644561087759138,巩固国民经济企稳回升势头，稳步发展经济，利国利民！[赞][赞][赞],0,42,0,2022-07-21 10:19:09,来自天津,108844068015,往事如昨88
7122651005531095812,疫情要防住、经济要稳住、发展要安全。,0,12,0,2022-07-21 10:45:20,来自黑龙江,79763662484,米粒儿185
7122656309698757376,人民时评丨着力巩固国民经济企稳回升态势！,0,15,0,2022-07-21 11:05:17,来自陕西,73522515918,霓虹606
7121527640372429609,上半年经济企稳回升，期待下半年经济更上一层楼。伟大的祖国经济永远稳定增长。,0,7,0,2022-07-18 10:04:46,来自河北,3861139245511069,魔法铅笔mP
7122650766082441996,着力巩固国民经济企稳回升态势！,0,15,0,2022-07-21 10:44:10,来自贵州,50298264795,奇妙河流fC
7122655790376289031,巩固国民经济企稳回升势头，稳步发展经济，利国利民！,0,16,0,2022-07-21 11:03:28,来自陕西,61516173434,嘉期如梦R
7122651798292513548,巩固国民经济企稳回升势头，稳步发展经济，利国利民！,0,13,0,2022-07-21 10:48:39,来自福建,95130503521,曾輈
7122655951299232545,巩固国民经济企稳回升势头，稳步发展经济，利国利民。,0,12,0,2022-07-21 11:04:23,来自重庆,1821213881540955,智勇双全香瓜Ix
7121557099976786728,上半年经济企稳回升，下半年期待更上层楼。[赞][赞],0,4,0,2022-07-18 11:59:40,来自甘肃,1117533446352608,真诚星星9I
7122656683801215779,疫情要防住，经济要稳住，发展要安全。,0,8,0,2022-07-21 11:06:43,来自湖南,110878251846,赢钱咯高兴
7122654457938133801,人民时评丨着力巩固国民经济企稳回升态势！,0,9,0,2022-07-21 10:57:52,来自浙江,1921583452539067,快乐的海浪lT
7122654550825206569,着力巩固国民经济企稳回升态势。,0,15,0,2022-07-21 10:58:12,,4389663038252819,北京鑫弘文化传媒
7121503416673272610,"上半年经济企稳回升！[赞][赞][赞]
期待下半年更上一层楼！[祈祷][祈祷][祈祷]",0,2,0,2022-07-18 08:31:44,来自北京,5758653094,六月雪520
7121547584615498530,上半年，我国GDP同比增长2.5%，总体呈现企稳回升态势，较为成功地稳住了宏观经济大盘。🤑🤑🤑🤑,0,4,0,2022-07-18 11:22:51,来自黑龙江,4121423210884071,拉把握
7121554187498062606,上半年经济企稳回升 下半年期待更上层楼！,0,4,0,2022-07-18 11:48:56,来自山西,2779986311268989,冰雪之石730663011029
7121552430953022238,中国经济，未来可期,0,4,0,2022-07-18 11:42:02,来自江苏,102107577941,立聪堂文化宫店
7122643091177702176,争取经济走上新的里锃。[赞][赞][赞],0,78,0,2022-07-21 10:13:30,来自重庆,64195778939,一心一意囯国
7121557575988200227,"上半年经济企稳回升 
下半年期待更上层楼",0,5,1,2022-07-18 12:01:27,来自山东,101889994415,多喜樂常安宁
7122646559980356383,疫情要稳住，经济要稳住，发展要安全，努力保持经济平稳健康发展。,0,81,0,2022-07-21 10:27:52,来自江西,3170616009037691,用户拥抱梦想
7121552384513983264,上半年经济稳中回升，顶住压力稳中求进，疫情要防住，经济要稳住！,0,5,0,2022-07-18 11:42:19,来自四川,2656882876224807,黄真珍9H
7122646172736537379,国民经济有望逐步恢复、保持平稳增长，发展的质量、效益也会持续回升、向好。[赞][赞][赞],0,42,0,2022-07-21 10:25:50,来自辽宁,857252899075357,小宇VIOG
7121567082760143646,上半年，我国GDP同比增长2.5%，总体呈现企稳回升态势，较为成功地稳住了宏观经济大盘。,0,4,0,2022-07-18 12:38:47,来自陕西,109624621159,温柔海风老人家
7122645806746206987,保持经济稳步增长，保持社会的稳定，要做到防疫和经济发展两手抓。,0,25,0,2022-07-21 10:25:13,来自广东,51806625582,外向清风Lf
7122644780219712271,疫情要防住，经济要稳住，发展要安全，要及时出手，克服困难，保持增长。[赞][赞][赞],0,40,0,2022-07-21 10:20:04,来自四川,3821552734046504,龙舞劲风
7122646025013281551,争取经济走上新的里锃。,0,25,0,2022-07-21 10:25:13,来自北京,93405179653,克格勃579
7122643482677838627,中流击水，更需奋楫前行,0,23,0,2022-07-21 10:14:56,来自广东,1130766660800104,中山市特美达照明
7122652639107859241,加强经济发展，提高民生福祉！,0,18,0,2022-07-21 10:51:00,来自河北,3910279149916359,刘克如
7122647914442244895,人民时评丨着力巩固国民经济企稳回升态势！,0,18,0,2022-07-21 10:33:06,来自上海,540549444277655,Lw0422
7122652217496208131,中流击水，更需奋楫前行[赞][赞],0,12,0,2022-07-21 10:49:46,来自黑龙江,1447423484104167,乖巧可乐Rc
7122652783685436191,疫情要防住、经济要稳住、发展要安全。,0,14,0,2022-07-21 10:52:08,来自福建,1116711865564989,想念用户
7122650685006545701,着力巩固国民经济企稳回升态势,0,15,0,2022-07-21 10:43:39,来自北京,109550164184,看窗外雪花飞
7122650340340024105,中国经济韧性强、潜力大、长期向好,0,20,0,2022-07-21 10:42:01,来自河北,272287467314189,石化水损控制
7122653030322881291,疫情要防住、经济要稳住、发展要安全！,0,18,0,2022-07-21 10:52:57,来自河北,1204656169578878,富足风声gC
7122656362362520360,着力巩固国民经济企稳回升态势。,0,12,0,2022-07-21 11:05:28,来自安徽,4186548469507199,龙辰溪
7121548602644333353,上半年经济稳中回升，顶住压力稳中求进，疫情要防住，经济要稳住！✊✊✊✊,0,5,0,2022-07-18 11:26:49,来自黑龙江,602986002005693,dd呦呦
7122647587169272587,人民时评丨着力巩固国民经济企稳回升态势！,0,15,0,2022-07-21 10:32:03,来自广东,59405284667,咯路KKK
7122683670527558400,防住疫情稳固经济发展的上升态势是当前工作的重中之重。👍👍👍,0,6,0,2022-07-21 12:51:13,来自黑龙江,1218726606930446,噩梦连连kk
7122650714786693901,着力巩固国民经济企稳回升态势[赞][赞][赞],0,12,0,2022-07-21 10:44:05,来自河南,106805959421,拥抱希望220
7121540812869387045,上半年经济稳中回升，顶住压力稳中求进，疫情要防住，经济要稳住！！！,0,3,0,2022-07-18 10:57:02,来自山东,3175009976859527,lty白头翁
7122651090042405636,中流击水，更需奋楫前行,0,12,0,2022-07-21 10:45:47,来自浙江,3179439556147667,完美微风Yt
7122650789268538116,疫情要防住、经济要稳住、发展要安全。,0,11,0,2022-07-21 10:44:16,来自广东,2137879609611603,Asshead
7122649656722932484,疫情要防住！经济要稳住！发展要安全！,0,10,0,2022-07-21 10:40:22,来自安徽,94550674292,才高八斗沙滩Rn
7122648365502546729,巩固国民经济企稳回升势头，稳步发展经济，利国利民。,0,11,0,2022-07-21 10:34:30,来自黑龙江,1244253483181172,高山老鹰123
7122657017487000357,疫情要防住、经济要稳住、发展要安全！,0,11,0,2022-07-21 11:08:22,来自广东,3667598910177678,一裹素衣
7121532539709702942,上半年经济企稳回升，下半年期待更上层楼。,0,6,0,2022-07-18 10:24:03,来自北京,107955583917,正能量坚不可摧
7121538885947671335,中国经济为全球“日益黯淡的经济前景”带来光亮。[赞][赞][赞],0,8,0,2022-07-18 10:50:00,来自江西,5547330612,找朋友59436595
7121510574625833740,在全球经济皮软的婧况下我国能有增长实属不易还要上下动起来一起奋斗创造新未来,0,7,0,2022-07-18 08:59:57,来自河南,132406673414148,快乐星星2A
7121537839942681383,"伟大的祖国经济永远稳定增长！
上半年经济企稳回升 。
下半年期待更上层楼。😐😐😐😐",0,4,0,2022-07-18 10:46:08,来自黑龙江,3224221355876638,ssmm小时
7122701997463110400,着力巩固国民经济企稳回升态势。,0,5,0,2022-07-21 14:02:32,来自辽宁,3668281353,我住在大连
7121505941451309858,疫情要防住、经济要稳住、发展要安全,0,8,0,2022-07-18 08:41:29,来自广西,3575235290333246,wys9870
7121534745049219874,上半年在疫情情况下，能够取得如此成绩实属不易！,0,4,0,2022-07-18 10:32:54,来自河北,3447669854583997,时髦扑克29
7121507940401447692,做到“疫情要防住、经济要稳住、发展要安全”。,0,8,0,2022-07-18 08:49:58,来自日本,73545600887,豁达的火眼金睛
7121521845874623269,带来信心和希望，经济恢复发展未来可期。上半年经济企稳回升，下半年期待更上层楼，[赞][赞][赞],0,5,0,2022-07-18 09:43:50,来自湖北,3096641025098512,859ZW
7122656936092893985,[赞][赞][赞][赞][赞][赞][赞][赞][鼓掌][赞][鼓掌][鼓掌][鼓掌][鼓掌][鼓掌][赞][赞][赞][赞][赞][赞][赞],0,6,0,2022-07-21 11:08:35,来自云南,1732461592329704,用户6392156657407
7122650273541653248,[赞][赞][赞],0,7,0,2022-07-21 10:41:48,来自吉林,2736002166431948,孤星爱音乐
7122816736272876300,[赞][赞][赞][赞][赞],0,0,0,2022-07-21 21:28:03,来自陕西,110257174976,俊俏暖阳L6
7120891610338165512,[赞][赞],0,1,0,2022-07-16 16:57:42,来自山西,4451287964325468,魔法豆花6m
7121848019586384672,👍👍👍💪,0,0,0,2022-07-19 06:50:05,来自陕西,2656841537169549,用户9229865064930
7122652137293120288,说得好说得好说得好说得好说得好说得好说得好说得好说得好说得好说得好说得好说得好说得好说得好说得好,0,11,0,2022-07-21 10:50:11,来自河南,1447426054688503,糊糊涂涂的呢
7122641744277406479,[赞][赞][赞][赞][赞][赞][赞][赞][赞][赞][赞],0,32,0,2022-07-21 10:08:14,来自广东,4476835655334718,梁伟明梁伟明
7121525218246083358,疫情要防住，经济要稳住，发展要安全[赞][赞][赞][赞][赞],0,4,0,2022-07-18 09:55:42,来自江苏,92450129570,康宁终善
7121535781583454989,我们不仅要正视困难，保持共克时艰的心态，也需要增强信心，拿出踔厉奋发的劲头。[赞][赞][赞],0,3,0,2022-07-18 10:36:34,来自黑龙江,3699224442577720,愉悦的星辰Re
7122653330804736807,疫情要防住，经济要稳住，发展要安全，要及时出手，克服困难，保持增长[赞][赞][赞][赞][赞][赞][赞][赞][赞][赞][赞],0,10,0,2022-07-21 10:54:33,来自湖北,110062731824,知情达理百灵鸟l0
7122646054163776293,疫情要防住，经济要稳住，发展要安全，要及时出手，克服困难，保持增长！,0,15,0,2022-07-21 10:25:50,来自江苏,3443291969038244,用户34094100361平安
7122646347198858023,疫情要防住，经济要稳住，发展要安全，要及时出手，克服困难，保持增长,0,15,0,2022-07-21 10:27:20,来自河北,6607572353,顺平99150391
7122652372421542693,"疫情要防住，
经济要稳住，
发展要安全，
要及时出手，
克服困难，
保持增长！[赞][赞][赞]",0,11,0,2022-07-21 10:50:24,来自黑龙江,2414993373139982,热心艺术家EA
7122654017989903144,人民时评丨着力巩固国民经济企稳回升态势！[祈祷][祈祷][祈祷],0,8,0,2022-07-21 10:56:30,来自黑龙江,1869638965134920,自强不息水滴I1
7122645620057260800,疫情要防住，经济要稳住，发展要安全，要及时出手，克服困难，保持增长,0,13,0,2022-07-21 10:23:38,来自上海,4230805190,孤独更新
7121515927614997284,“疫情要防住、经济要稳住、发展要安全”，[赞][赞][赞][赞][赞][赞][赞][赞][赞],0,5,0,2022-07-18 09:20:40,来自湖南,2581259104816126,头条老肖
7122648464223421220,要保持经济稳步增长，保持社会的稳定，要做到防疫和经济发展两手抓。💪💪💪👍👍👍,0,9,0,2022-07-21 10:35:12,来自辽宁,5990508383,水流598
7122646999857398535,疫情要防住，经济要稳住，发展要安全，要及时出手，克服困难，保持增长,0,11,0,2022-07-21 10:29:15,来自河南,792108025780215,宋文广好了
7121635699178259200,我们不仅要正视困难，保持共克时艰的心态，也需要增强信心，拿出踔厉奋发的劲头。,0,2,0,2022-07-18 17:04:38,来自浙江,73103379865,智者孔雀zZ
7122655562013131520,加大宏观政策实施力度，着力巩固经济恢复基础，必能争取今年我国经济发展达到较好水平。[赞][赞][赞],0,15,0,2022-07-21 11:02:08,来自重庆,3883068549770989,用户嚴妹妹
7122656377415779085,加大宏观政策实施力度，着力巩固经济恢复基础，必能争取今年我国经济发展达到较好水平。祝愿祖国繁荣昌盛！,0,9,0,2022-07-21 11:06:05,来自河南,792108025780215,宋文广好了
7122656719830237993,加大宏观政策实施力度，着力巩固经济恢复基础，必能争取今年我国经济发展达到较好水平。祝愿祖国繁荣昌盛！,0,11,0,2022-07-21 11:06:47,来自内蒙古,50267841415,厚道老头1
7121542622128685858,疫情要防住经济要稳住发展要安全[赞][赞][赞][赞][赞][赞][赞][赞][赞][赞][赞][赞],0,3,0,2022-07-18 11:03:41,来自河南,66490984958,云岭砺剑
7122656358981272335,加大宏观政策实施力度，着力巩固经济恢复基础，必能争取今年我国经济发展达到较好水平。[赞][赞][赞],0,9,0,2022-07-21 11:05:13,来自湖北,6958388027,李运宗
7122696884485636900,加大宏观政策实施力度，着力巩固经济恢复基础，必能争取今年我国经济发展达到较好水平。[比心][比心][比心],0,8,0,2022-07-21 13:43:24,来自云南,4474402761,李崇林
7122656989515105024,疫情要防住、经济要稳住、发展要安全，继续做好“六稳”“六保”工作。持续增效力激活力添动力，努力保持经济平稳健康发展。[赞][赞][赞],0,8,0,2022-07-21 11:07:38,来自辽宁,3025316525,博爱6688
7122784430720385800,保持经济稳步增长，保持社会的稳定，要做到防疫和经济发展两手抓。国民经济有望逐步恢复、保持平稳增长，发展的质量、效益也会持续回升、向好！,0,2,0,2022-07-21 19:22:44,来自安徽,3712382246588772,牵手一生BW
7122656736447677199,疫情要防住、经济要稳住、发展要安全，继续做好“六稳”“六保”工作。持续增效力激活力添动力，努力保持经济平稳健康发展。,0,9,0,2022-07-21 11:06:46,来自黑龙江,1741252701985560,霸气村老八
7122763038226924300,抓住、抓实、抓好经济恢复的关键窗口期，持续增效力激活力添动力，努力保持经济平稳健康发展。[赞][赞][赞],0,0,0,2022-07-21 18:00:26,来自上海,620574353132333,极爱0612
7122738140758229800,保持经济稳步增长，保持社会的稳定，要做到防疫和经济发展两手抓。国民经济有望逐步恢复、保持平稳增长，发展的质量、效益也会持续回升、向好。[玫瑰][玫瑰][玫瑰],0,1,0,2022-07-21 16:22:52,来自黑龙江,62916883381,风清花溪人
7122655012899242756,及时出手克服困难保持增长，坚持不搞“大水漫灌”不留后遗症，沉着应对挑战保持社会大局稳定……这份难得的成绩单为我们保持恢复发展态势、夺取疫情防控和经济社会发展双胜利注入信心。,0,10,0,2022-07-21 11:00:47,来自广东,1631277520523597,用户5433055575417
7121511506831426334,防住疫情，稳住经济，安全发展，中国经济一会在变局中展现出强大韧性和旺盛活力，为伟大的祖国点赞[赞][赞][赞],0,5,0,2022-07-18 09:03:36,来自广东,2515279810146728,用户8377238177288
7121510868663354112,保持共克时心态，牢牢把握有利条件。期待经济发展更上一层楼。[赞],0,8,0,2022-07-18 09:00:20,来自辽宁,4177786423492415,用户1973941971441
7121520496994911012,"疫情下，上半年经济企稳回升
稳增长，下半年期待更上层楼[加油][加油]",0,5,0,2022-07-18 09:38:33,来自江西,730538283118653,用户7236091359110
7122654877222109955,巩固国民经济企稳回升，疫情要防住，发展要安全。,0,7,0,2022-07-21 11:00:28,来自湖南,4274510443325629,用户4612883449067
7121530325695775528,在全球经济皮软的婧况下我国能有增长实属不易还要上下动起来一起奋斗创造新未来,0,5,0,2022-07-18 10:15:57,来自西藏,64488650603,用户6362360651922
7121570149396235022,"疫情要防住、经济要稳住、
发展要安全、人民要幸福[赞][赞][赞][赞]",0,3,0,2022-07-18 12:50:51,来自河北,712119186367199,用户1794265807521
7121516195102753543,疫情要防住，经济要稳住，发展要安全，全国人民要齐心协力交出健康发展的经济成绩单！[祈祷][祈祷][祈祷],0,5,0,2022-07-18 09:21:37,来自辽宁,53345562279,用户3723352487575
7122647120431760168,疫情要防住 ，经济要稳住 ，才能更好的安全发展 。,0,9,0,2022-07-21 10:29:42,来自河南,62777975677,用户3092525828485
7121551482617004815,上半年经济回升下半年经济更上一层楼,0,4,0,2022-07-18 11:37:58,来自河北,2076330605682573,用户7519126216511
7121553182635082527,为伟大的祖国经济永远稳步增长点赞！,0,5,0,2022-07-18 11:44:41,来自天津,111106271941,用户4918909454452
7122662405850596100,证了中国经济韧性强、潜力大、长期向好[赞][赞][赞],0,5,0,2022-07-21 11:29:27,来自福建,96540159686,用户7916912369569
7121560035083862823,在党中央的正确领导努力下，在各种各样的压力下，上半年中国经济企稳回升，下半年更可期[赞][赞][赞],0,3,0,2022-07-18 12:11:47,来自山东,2805569891079245,用户2835910424121
7122649855252202277,着力巩固国民经济企稳回升态势，加大宏观政策实施力度！,0,10,0,2022-07-21 10:40:52,来自广东,102015055064,用户7892042316633
7122648355959816995,疫情要防控，经济要发发展，社会要稳定,0,10,0,2022-07-21 10:34:10,来自江苏,51182773242,手机用户51182773242
7122651960142136097,疫情下中国经济持续平稳发展保持这是我国经济的潜能，年未来我国经济必将会以强劲的势头发展,0,10,0,2022-07-21 10:48:48,来自陕西,12818630595,手机用户12818630595
7121530453391098665,今年会回升怕你们写错了,0,6,0,2022-07-18 10:16:22,来自云南,52445769586,手机用户52445769586
7122653357969539877,疫情要防好，经济要抓好，菜篮要供好。[祈祷][祈祷][祈祷],0,7,0,2022-07-21 10:54:23,来自辽宁,1714878027667086,用户3810546610949
7121522871779853068,经济发展回升，祝愿我们的祖国更加繁荣昌盛,0,6,0,2022-07-18 09:46:30,来自河北,59827835251,手机用户59827835251
7121691404434916100,十四亿人民万安稳得住，干起来，真正做到疫情要防住，经济要稳住，发展要安全，努力完成全年既定目标。,0,5,0,2022-07-18 20:41:35,来自河南,106096171624,用户2808370957356
7122653449590375203,看“量”还要看“质”，读“形”更要读“势”。,0,7,0,2022-07-21 10:54:08,来自河南,3909510352087004,用户6048827384254
7121531700248625953,稳增长，好势头，前景广。[祈祷][祈祷][祈祷],0,4,0,2022-07-18 10:20:39,来自黑龙江,3980696974528157,用户2282678130090
7122653228432589579,中国经济潜力巨大。,0,7,0,2022-07-21 10:54:05,来自重庆,3175004595827453,用户691036922046
7121541519936635659,稳住经济大盘,0,4,0,2022-07-18 11:00:08,来自贵州,795674046116413,用户848414157731
7122654721718125345,冷静观察、务实进取，继续稳定宏观经济大盘。[赞][赞][赞],0,7,0,2022-07-21 11:00:04,来自上海,109737358257,用户1960197728204
7121571448891638563,祝伟大的祖国繁荣昌盛！,0,3,0,2022-07-18 12:55:09,来自安徽,92300597608,用户7691155352435
7121545773162464007,付过款了美女,0,5,0,2022-07-18 11:16:27,来自黑龙江,2063143408513614,用户4171095297277
7122655480111711016,行稳致远[赞],0,6,0,2022-07-21 11:02:09,来自黑龙江,1834428012961143,用户1578020960429
7122720434571445000,疫情要防控，经济栗稳住，努力保持经济的稳步发展。,0,1,0,2022-07-21 15:14:43,来自四川,106208830767,用户7992846107420
7120573302989128463,所以不要指望5.5了好吗！那意味着下半年需要10以上！可能吗？所以股市今年可以歇火了！,0,3,0,2022-07-15 20:22:03,来自安徽,97583537257,用户3017223622111
7122700193950827300,巩固社会经济发展才能安全，疫情的肆虐，让我们更加有利的成长。着力巩固国民经济，努力最上新台阶。中国加油！,0,6,0,2022-07-21 13:56:08,来自山东,1758834862598366,用户5434635661337
7120595603641500423,喜欢,0,0,0,2022-07-15 21:48:41,来自广东,3554042491490824,用户8924882362575
7121591736426087203,点赞了,0,0,0,2022-07-18 14:14:16,来自海南,2805593815658734,用户1967762654612
7122647543850582797,人民时评丨着力巩固国民经济企稳回升态势！,0,9,0,2022-07-21 10:31:38,来自辽宁,2727238895940974,用户8771522655419
7122649539965993764,疫情要住经济要稳住？发展要安全。,0,9,0,2022-07-21 10:39:26,来自吉林,86185762803,用户9707257307237
7122651378052547328,人民时评丨着力巩固国民经济企稳回升态势！,0,7,0,2022-07-21 10:46:06,来自山西,1103558050061182,用户6258088045316
7121569314427454221,疫情要防住，经济要稳住，发展要安全，人民要幸福,0,3,0,2022-07-18 12:47:21,来自河北,51545153895,用户55829113
7121533678761214758,中国经济有强大韧性和旺盛活力，上半年经济稳步回升，下半年拿出踔厉奋发的劲头儿，交出更好的成绩单,0,4,0,2022-07-18 10:28:34,来自广东,1011184778354399,用户8664075592233
7122649374706221837,人民时评丨着力巩固国民经济企稳回升态势！,0,7,0,2022-07-21 10:38:36,来自湖北,101488307087,用户4440129494169
7122655383604396813,疫情要防住、经济要稳住、发展要安全。,0,6,0,2022-07-21 11:02:00,来自广东,3865513292206743,用户6078382856927
7122646398939611935,可以预见，国民经济有望逐步恢复、保持平稳增长，发展的质量、效益也会持续回升、向好。,0,15,0,2022-07-21 10:27:07,来自山东,110839011354,用户4086377324047
7122654769667130143,人民时评！着力巩固国民经济企稳回升态势！[赞][赞][赞],0,6,0,2022-07-21 10:59:26,来自四川,1050752911157491,用户1513755365445
7122651472768746244,二季度实现正增长，展现出中国经济的巨大潜力与回旋余地。为强大的祖国点赞！[赞][赞][赞],0,9,0,2022-07-21 10:47:40,来自重庆,2428152664565043,用户9053183490740
7122655855472476942,人民时评丨着力巩固国民经济企稳回升态势！,0,10,0,2022-07-21 11:03:57,来自北京,2806402384142893,用户675431008486
7122648493050807052,着力巩固国民经济企稳回升态势。,0,9,0,2022-07-21 10:35:22,来自四川,2167859160825563,用户9451708888343
7122648250758300454,中流击水，更需奋楫前行。,0,8,0,2022-07-21 10:34:46,来自四川,2167859160825563,用户9451708888343
7121531907296641830,"以民为本，稳字当头。
提高质量，稳中求进。
国富民强，行稳致远。[祈祷][祈祷][祈祷]",0,4,0,2022-07-18 10:21:33,来自黑龙江,1218723848914695,用户2915420543714
7121515191443194659,保持共克时心态，牢牢把握有利条件。期待经济发展更上一层楼。[赞][赞][赞],0,5,0,2022-07-18 09:17:09,来自吉林,1975192284823774,大同拜拜
7121556558861091596,上半年经济企稳回升，下半年期待更上一层楼,0,4,0,2022-07-18 11:58:17,来自辽宁,110225717528,用户1667522839029
7122657034293625637,加强经济发展，提高民生福祉！[赞][赞][赞],0,6,0,2022-07-21 11:08:24,来自黑龙江,743712503111287,用户316985950236
7121551009876509476,上半年经济企稳回升，下半年期待更上一层楼[赞][赞][赞][赞][玫瑰][玫瑰][玫瑰][玫瑰],0,4,0,2022-07-18 11:36:15,来自黑龙江,536974918956926,用户9097315428739
7122655381901525763,疫情要稳住，经济要稳住，发展要安全，努力保持经济平稳健康发展。,0,8,0,2022-07-21 11:02:06,来自江苏,580164977165544,用户6741414047949
7122653343482888992,巩固国民经济企稳回升势头，稳步发展经济，利国利民！[赞][赞][赞],0,7,0,2022-07-21 10:54:43,来自四川,4460071118970091,用户4137087517253
7121547786214048547,中国经济有强大韧性和旺盛活力，上半年经济稳步回升，下半年拿出踔厉奋发的劲头儿，交出更好的成绩单,0,4,0,2022-07-18 11:23:29,来自北京,3325342233706958,用户774519031295
7121524149650260751,[赞][赞]上半年，我国GDP同比增长2.5%，总体呈现企稳回升态势，较为成功地稳住了宏观经济大盘。,0,4,0,2022-07-18 09:51:16,来自吉林,553792003644943,用户3311277595408
7121537231529198351,"上半年经济企稳回升 
下半年期待更上层楼
祝愿伟大的祖国繁荣
[赞][赞][玫瑰][玫瑰][鼓掌][鼓掌]",0,4,0,2022-07-18 10:42:37,来自四川,63951019694,用户4668643671846
7121514874605896463,我们不仅要正视困难，保持共克时艰的心态，也需要增强信心，拿出踔厉奋发的劲头。[赞][赞][赞],0,4,0,2022-07-18 09:16:02,来自吉林,2538142239031326,欧拉死我了
