7122647952488727300,国民经济有望逐步恢复、保持平稳增长，发展的质量、效益也会持续回升、向好。为人民日报点赞[赞][赞][赞],0,9,0,2022-07-21 10:33:24,来自江西,4081808421450224,用户5139607220087
7121530158523859753,中国经济上半年经济企稳回升 ，下半年期待更上层楼。牢牢把握有利条件，坚定信心勇向前，“中国号”经济巨轮必定能够穿越激流险滩，驶向更加壮阔的胜利彼岸。[加油][加油][加油],0,3,0,2022-07-18 10:15:25,来自山西,897623088962775,用户2865908482732
7121521679200944926,疫情要防住，经济要稳住、发展要安全，增强信心，踔厉奋发，在下半年交出平稳健康发展的经济成绩单！我们不仅要正视困难，保持共克时艰的心态。[赞][赞][赞],0,3,0,2022-07-18 09:42:52,来自福建,4300902182423534,用户5842013633901
7121532826138444576,上半年经济企稳回升，期待下半年经济更上一层楼。伟大的祖国经济永远稳定增长。[祈祷][祈祷][祈祷][祈祷],0,3,0,2022-07-18 10:25:05,来自黑龙江,479852230351304,用户6051207816012
7121514915575448335,我们不仅要正视困难，保持共克时艰的心态，也需要增强信心，拿出踔厉奋发的劲头。[玫瑰][玫瑰][玫瑰],0,4,0,2022-07-18 09:16:09,来自吉林,866873445464302,手机控撕破
7121521333896823586,我国GDP同比增长2.5%，总体呈现企稳回升态势，较为成功地稳住了宏观经济大盘。尤其是二季度经济顶住压力实现正增长，殊为不易。,0,4,1,2022-07-18 09:41:14,来自福建,3712427041760932,用户3626437202405
7120960849505731332,爱了,0,0,0,2022-07-16 21:26:15,来自广东,3571632837335047,用户9463230426656
7121603799584146208,喜欢,0,1,0,2022-07-18 15:02:06,来自广东,3571632837335047,用户9463230426656
7122646816466305831,为伟大的祖国点赞！[赞][赞][赞][赞][赞][赞][赞][赞][赞][赞],0,10,0,2022-07-21 10:29:17,来自河北,518598391512541,用户6129649481985
7121532699663352615,疫情要防住、经济要稳住、发展要安全[祈祷][祈祷][祈祷][祈祷],0,3,0,2022-07-18 10:24:37,来自黑龙江,2925166106000557,用户1217236515265
7122816890552288000,疫情要防住，经济要稳住，发展要安全，要及时出手，克服困难，保持增长,0,0,0,2022-07-21 21:28:08,来自河北,509799343327327,用户2893448873422
7122649046724199209,要保持经济稳步增长，保持社会的稳定，要做到防疫和经济发展两手抓。,0,10,0,2022-07-21 10:37:01,来自广西,3896268387264445,用户3896268387264445
7122656518092604171,巩固国民经济企稳回升势头，稳步发展经济，利国利民！[赞][赞][赞],0,6,0,2022-07-21 11:06:43,来自黑龙江,4156620928979166,用户7078172692161
7122653821323084559,要保持经济稳步增长，保持社会的稳定，要做到防疫和经济发展两手抓。[赞][赞][赞],0,7,0,2022-07-21 10:55:43,来自河南,3149466416978414,用户1485880655296
7121534858572694307,我们不仅要正视困难，保持共克时艰的心态，也需要增强信心，拿出踔厉奋发的劲头。,0,4,0,2022-07-18 10:33:36,来自云南,67761125156,用户2502945889182
7122657062018433807,加大宏观政策实施力度，着力巩固经济恢复基础，必能争取今年我国经济发展达到较好水平。[赞][赞][赞],0,7,0,2022-07-21 11:08:12,来自山东,106171326494,用户9984707265915
7122654897648124676,加大宏观政策实施力度，着力巩固经济恢复基础，必能争取今年我国经济发展达到较好水平。[赞][赞][赞],0,7,0,2022-07-21 11:00:29,来自四川,2902303825987096,用户1978625666318
7122656716621316905,加大宏观政策实施力度，着力巩固经济恢复基础，必能争取今年我国经济发展达到较好水平。[赞][赞][赞],0,6,0,2022-07-21 11:06:45,来自黑龙江,1816860193982807,用户2880281687779
7121690781664690951,额额嗯,0,0,0,2022-07-18 20:38:41,来自浙江,2590898067356984,用户2189617204324
7122734391302226700,好好好好,0,1,0,2022-07-21 16:09:03,来自上海,52260603727,神情相拥
7122644327440253726,👍👍👍👍👍👍,0,10,0,2022-07-21 10:18:16,来自甘肃,96947084479,锦瑟流年7858
7122649181734486819,[赞][玫瑰][玫瑰][玫瑰],0,8,0,2022-07-21 10:37:27,来自湖北,52081504609,神秘云朵C
7121534753786479394,[赞][赞][赞][赞][赞][加油][加油][加油][加油][加油],0,3,0,2022-07-18 10:53:04,,63847670349,爽歪歪用户
7121507770385957662,[赞][赞][赞][赞][赞][赞][赞][赞][赞][赞][赞][赞][赞][赞][赞],0,10,0,2022-07-18 08:49:13,来自甘肃,6982265605,自强不息海燕o0
7121525551839724322,👍👍👍👍👍👍👍👍👍👍👍👍👍👍,0,4,0,2022-07-18 09:56:42,来自四川,730489790141135,好
7122647527920370440,[赞][赞][赞],0,8,0,2022-07-21 10:31:26,来自广东,1609294699835400,用户9878459534785
7122650492492415784,[赞][赞][赞][赞][赞],0,8,0,2022-07-21 10:42:37,来自湖北,65771970977,牵挂着你31
7122647564214190883,[赞][赞][赞][赞][赞][赞],0,8,0,2022-07-21 10:31:23,来自四川,3962267528858427,用户9478019626556
7122656936092893985,[赞][赞][赞][赞][赞][赞][赞][赞][鼓掌][赞][鼓掌][鼓掌][鼓掌][鼓掌][鼓掌][赞][赞][赞][赞][赞][赞][赞],0,6,0,2022-07-21 11:08:35,来自云南,1732461592329704,用户6392156657407
7122650273541653248,[赞][赞][赞],0,7,0,2022-07-21 10:41:48,来自吉林,2736002166431948,孤星爱音乐
7122816736272876300,[赞][赞][赞][赞][赞],0,0,0,2022-07-21 21:28:03,来自陕西,110257174976,俊俏暖阳L6
7120891610338165512,[赞][赞],0,1,0,2022-07-16 16:57:42,来自山西,4451287964325468,魔法豆花6m
7121848019586384672,👍👍👍💪,0,0,0,2022-07-19 06:50:05,来自陕西,2656841537169549,用户9229865064930
7121534215111754507,上半年经济触底回升，下半年。[赞][赞][赞][赞][赞][赞][赞][赞][赞][赞][赞][赞][赞][赞][赞][赞][赞][赞][赞][赞][赞][赞][赞][赞],0,5,0,2022-07-18 10:30:34,来自安徽,111561942652,有情总被元情伤
7122652137293120288,说得好说得好说得好说得好说得好说得好说得好说得好说得好说得好说得好说得好说得好说得好说得好说得好,0,11,0,2022-07-21 10:50:11,来自河南,1447426054688503,糊糊涂涂的呢
7122641744277406479,[赞][赞][赞][赞][赞][赞][赞][赞][赞][赞][赞],0,32,0,2022-07-21 10:08:14,来自广东,4476835655334718,梁伟明梁伟明
7120988784593994536,[赞],0,0,0,2022-07-16 23:14:43,来自贵州,3315774015938638,富足明月qR
