7122642024368735009,加大宏观政策实施力度，着力巩固经济恢复基础，必能争取今年我国经济发展达到较好水平。[赞][赞][赞],1,2204,0,2022-07-21 10:09:16,来自福建,4142560058023691,薇薇逛红尘
7122650635648254753,着力巩固国民经济企稳回升态势。,0,1665,0,2022-07-21 10:43:51,来自湖南,109144337841,冰岛日记1234shrj
7121510036820067106,[赞][赞][赞]上半年经济企稳回升，下半年期待更上层楼。,0,306,0,2022-07-18 08:57:22,来自陕西,2590084826406547,秦观鹊桥仙
7122641658340508449,人民时评丨着力巩固国民经济企稳回升态势！,1,1636,0,2022-07-21 10:07:59,来自上海,109554259110,马大帅278
7121506363255096072,中国经济有强大韧性和旺盛活力，上半年经济稳步回升，下半年拿出踔厉奋发的劲头儿，交出更好的成绩单,0,227,1,2022-07-18 08:43:10,来自四川,892400443071779,小编卿越
7122646961274405639,巩固国民经济企稳回升势头，稳步发展经济，利国利民！[赞][赞][赞],1,1013,0,2022-07-21 10:29:14,来自山西,59702307362,好运来22175
7122652617523823368,保持经济稳步增长，保持社会的稳定，要做到防疫和经济发展两手抓。国民经济有望逐步恢复、保持平稳增长，发展的质量、效益也会持续回升、向好。,0,762,0,2022-07-21 10:51:18,来自福建,94517341521,慧红
7122644840433206016,抓住、抓实、抓好经济恢复的关键窗口期，持续增效力激活力添动力，努力保持经济平稳健康发展。[赞][赞][赞][赞][赞][赞],0,649,0,2022-07-21 10:20:17,来自湖南,67861955373,思旋10
7122646662526452521,疫情要防住、经济要稳住、发展要安全。,0,726,0,2022-07-21 10:27:38,来自辽宁,92587380141,雨后彩虹zzj
7122643281976165131,疫情要防住，经济要稳住，发展要安全，要及时出手，克服困难，保持增长,0,493,0,2022-07-21 10:14:07,来自湖南,92565064654,回归号广告费
7122652177826595584,着力巩固国民经济企稳回升态势，争取今年我国经济发展达到较好水平[加油][加油][加油],0,509,0,2022-07-21 10:49:10,来自山西,3689553921838398,往事如烟一路向前看
7121508603185660707,上半年经济企稳回升，成绩来之不易，再接再厉，期待下半年更上层楼。祝伟大的祖国经济永远稳定增长！[赞][赞][赞],1,190,0,2022-07-18 08:51:30,来自河北,102994218489,理财源
7121517679647064869,上半年经济企稳回升，保持共克时艰的心态，增强信心，拿出踔厉奋发的劲头，在下半年交出平稳健康发展的经济成绩单，更上一层楼！[赞][赞][赞],1,119,0,2022-07-18 09:27:25,来自湖北,4208578288956136,一江秋水111
7122649565471179551,疫情要稳住，经济要稳住，发展要安全，努力保持经济平稳健康发展。,0,316,0,2022-07-21 10:39:09,来自重庆,1037559346503709,亲切青山6K
7121505744826188557,我们不仅要正视困难，保持共克时艰的心态，也需要增强信心，拿出踔厉奋发的劲头。,1,194,0,2022-07-18 08:41:10,来自山东,1226655199673012,娜娜3480
7121516895396102927,上半年，我国GDP同比增长2.5%，总体呈现企稳回升态势，较为成功地稳住了宏观经济大盘。,0,90,0,2022-07-18 09:23:50,来自辽宁,958372952409340,闲人读闲书—悦心集
7122644005225153314,加大宏观政策实施力度，着力巩固经济恢复基础，必能争取今年我国经济发展达到较好水平。祝愿祖国繁荣昌盛！,1,485,1,2022-07-21 10:16:56,来自天津,108844068015,往事如昨88
7122654626419180301,以前的有防住，经济要稳住，发展才安全,0,258,0,2022-07-21 10:58:58,来自辽宁,53410009630,mm48485
7122656447791448867,着力巩固国民经济，努力最上新台阶,0,194,0,2022-07-21 11:05:33,来自湖南,102141326551,正义凛然蛋糕k9
7122642819550495525,为应对疫情冲击，各方面果断施策、加大稳增长力度，固定资产投资持续增长，生产需求边际改善，市场价格基本平稳，新产业新动能较快增长，外汇储备总体平稳。,0,290,0,2022-07-21 10:12:27,来自天津,75605989717,云龙256013933
7121506892316787495,"上半年经济企稳回升 
下半年期待更上层楼
祝愿伟大的祖国繁荣
[赞][赞][玫瑰][玫瑰][鼓掌][鼓掌]",0,359,0,2022-07-18 08:46:07,来自福建,4142560058023691,薇薇逛红尘
7122648450457486088,做好六稳，六保工作，抓住经济恢复的窗口，努力经济平稳健康发展[赞][赞][赞],0,408,1,2022-07-21 10:35:03,来自四川,110956653827,茂容密519
7121510647309091622,疫情要防住，经济要稳住、发展要安全，增强信心，踔厉奋发，在下半年交出平稳健康发展的经济成绩单！,0,121,0,2022-07-18 09:00:29,来自浙江,3210180071269976,W且行且珍惜
7122656905897476864,加强经济发展，保持社会的稳定，提高民生福祉！为党中央的英明决策点赞[赞][赞][赞],0,140,0,2022-07-21 11:07:23,来自广西,2990324400005159,优美阳光24
7122652721127473935,二季度实现正增长！大好消息！展现出我们伟大祖国经济的巨大潜力与回旋余地！[玫瑰][玫瑰][玫瑰][玫瑰][玫瑰][玫瑰],0,148,0,2022-07-21 10:51:15,来自四川,52101960445,嘟嘟胖博美
7122644700360000256,争取经济走上新的里锃。[赞][赞][赞],0,110,0,2022-07-21 10:19:40,来自广东,3765190265,夜猫25929388
7122652641977156367,巩固经济恢复基础，争取今年我国经济发展达到较好的水亚。,0,108,0,2022-07-21 10:51:12,来自山东,1478166029546960,王思璇💓
7122656178987418371,巩固经济恢复基础，必能争取今年我国经济发展达到较好水平。,0,126,0,2022-07-21 11:05:28,来自重庆,2387758891664387,ii楚楚
7121529020587639593,"祝福伟大祖国越来越富强！
👍👍👍[点亮平安灯][给力][撒花][撒花][撒花]",0,57,0,2022-07-18 10:10:08,来自浙江,103629215644,凤仙396
7122646333860660003,二季度实现正增长，展现出中国经济的巨大潜力与回旋余地。为强大的祖国点赞！[赞][赞][赞],0,807,1,2022-07-21 10:26:29,来自河北,102994218489,理财源
7121530511268856611,"经济要稳住、发展要安全
上半年经济企稳回升
下半年期待更上层楼
祝祖国强大繁荣昌盛！",0,58,0,2022-07-18 10:16:44,来自天津,2348978326479711,头条老孙
7121530819164095263,"[赞][赞][赞]上半年经济企稳回升，
下半年期待更上层楼。
点赞👍👍",0,45,0,2022-07-18 10:17:20,来自广东,3808311020104576,银华姐
7121513987967075102,上半年经济稳中回升，顶住压力稳中求进，疫情要防住，经济要稳住！,0,33,0,2022-07-18 09:12:55,来自河北,2102712809039294,高原的红太阳
7121506030454113024,中国经济上半年经济企稳回升 ，下半年期待更上层楼。牢牢把握有利条件，坚定信心勇向前，“中国号”经济巨轮必定能够穿越激流险滩，驶向更加壮阔的胜利彼岸。[加油][加油][加油],0,133,0,2022-07-18 08:41:45,来自天津,108844068015,往事如昨88
7122656335615410974,巩固社会经济发展才能安全，疫情的肆虐，让我们更加有利的成长,0,156,1,2022-07-21 11:06:01,来自浙江,4455672661422109,有空聊
7121519347243778849,"伟大的祖国经济永远稳定增长！
上半年经济企稳回升 。
下半年期待更上层楼。",0,41,0,2022-07-18 09:34:18,来自北京,1125496744837911,马上马下
7121505960757543717,二季度经济顶住压力实现正增长，殊为不易。保持共克时艰的心态，增强信心，拿出踔厉奋发的劲头，在下半年交出平稳健康发展的经济成绩单！[加油][加油][加油],0,8,0,2022-07-18 08:41:56,来自湖北,4208578288956136,一江秋水111
7121536498368873249,可喜可贺，再接再厉，再创佳绩！[赞],0,25,0,2022-07-18 10:40:38,来自湖北,95041321100,北梦木兮5
7121531653356700449,"疫情要防住，经济要稳住，发展要安全。
多重压力考验下的中国经济平稳健康发展[赞][赞][赞]",0,16,0,2022-07-18 10:20:34,来自山东,496602291899758,知了知了安好
7121520522579657505,中国经济，未来可期,0,22,0,2022-07-18 09:38:45,来自辽宁,20897722246,孙药师科普
7121537461079376681,上半年在疫情情况下，能够取得如此成绩实属不易！😀😀😀,0,15,0,2022-07-18 10:43:34,来自黑龙江,2098321448508429,bjk等等
7121552986270810911,"上半年经济企稳回升，
下半年期待更上层楼！
祝祖国明天更美好！",0,17,0,2022-07-18 11:44:18,来自湖南,4424035660478472,繁体四维
7121510290990514947,上半年经济企稳回升，顶住压力，稳中求进，疫情要防住、经济要稳住、发展要安全”，在下半年交出平稳健康发展的经济成绩单！,1,36,0,2022-07-18 08:59:14,来自浙江,2559262495867373,縈薇
7122754303290655500,为经济发展达到较好水平[赞][赞][赞],0,20,0,2022-07-21 17:26:23,来自湖北,106540467619,怀揣梦想的周雅宁的妈
7122642726025691942,要保持经济稳步增长，保持社会的稳定，要做到防疫和经济发展两手抓。,0,191,0,2022-07-21 10:12:03,来自辽宁,111204085880,难得糊涂286646581
7121544981844083487,疫情要稳住、发展要安全、下半年取得更好的发展′[赞][赞][赞],0,12,0,2022-07-18 11:13:16,来自江苏,110305694419,非凡柳叶2U
7121525299384337187,上半年经济触底回升，下半年。,0,13,0,2022-07-18 09:55:41,来自广东,185174552745647,淡然棋乐2022
7121532383182668585,上半年经济企稳回升，下半年期待更上一层楼,0,11,0,2022-07-18 10:24:04,来自山东,703338575833067,用户ly李勇
7121293415740244766,在不同的遭遇里我发现你的瞬间，有种不可言说的温柔直觉。,0,3,0,2022-07-17 18:57:07,来自湖南,3492478907611197,天若有情1X1v
7121708233102459685,国内国际双循环起到了作用，尤其是国内市场，为伟大的祖国点赞！,0,1,0,2022-07-18 21:46:39,来自辽宁,82379185789,岁月如刀挥之不去
7121517917837247269,增强信心、踔厉奋发，紧紧抓住经济企稳回升的有利时机，更好激发市场活力和社会创造力，在下半年交出平稳健康发展的经济成绩单！,0,5,0,2022-07-18 09:28:11,来自重庆,1362995589167288,妙手浅谈
7121552155466744584,中国最棒！[赞][赞][赞],0,9,0,2022-07-18 11:40:43,来自广东,188741497403639,02一帆风顺
7121535238475645734,我们不仅要正视困难，保持共克时艰的心态，[祈祷][祈祷][祈祷][祈祷][祈祷][祈祷][祈祷],0,4,0,2022-07-18 10:34:30,来自黑龙江,4262174396003453,无双阳光uI
7122684985077138207,2.5个百分点已经非常不容易了！纵观西方，有多少正增长的？,0,0,0,2022-07-21 12:56:50,来自吉林,171132911101208,白雪15946
7121539543550952222,各种不确定性是经济发展的重要阻碍,1,11,0,2022-07-18 10:51:46,来自河南,4593321312,影幕
7122643941648352007,可以预见，国民经济有望逐步恢复、保持平稳增长，发展的质量、效益也会持续回升、向好。,0,107,0,2022-07-21 10:16:46,来自黑龙江,72194201597,天空若放晴2012
7121506386244338463,点赞！[赞],0,3,0,2022-07-18 08:43:33,来自广东,6168046706,168诗乐
7122656747956929320,在疫情的压力下，中国经济的发展能取得如此成绩，说明我们的抗疫策略是对的，更解说明中国经济是压垮的！,0,58,0,2022-07-21 11:06:51,来自广西,104437857585,鱼塘圣娃
7122646418435015462,说得好说得好说得好说得好说得好说得好说得好说得好,0,102,0,2022-07-21 10:27:39,来自河北,66201541246,千层雪千层雾
7121507885582369570,上半年经济企稳回升，下半年期待更上层楼。加油中国！,0,4,0,2022-07-18 08:48:51,来自黑龙江,3359752246272151,爱家大海8C3
7121551006336844585,"上半年经济企稳回升 
下半年期待更上层楼
祝愿伟大的祖国繁荣
[赞][赞][玫瑰][玫瑰][鼓掌][鼓掌]中国经济有强大韧性和旺盛活力，上半年经济稳步回升，下半年拿出踔厉奋发的劲头儿，交出更好的成绩单",0,10,0,2022-07-18 11:36:06,来自河南,4155794305597117,闵不忘初心
7122652702651958057,防住疫情稳固经济发展的上升态势是当前工作的重中之重。,0,58,0,2022-07-21 10:51:21,来自陕西,66951757355,雨亮88
7122645647437955876,要保持经济稳步增长，保持社会的稳定，要做到防疫和经济发展两手抓。为党中央的英明决策点赞[赞][赞][赞],0,73,0,2022-07-21 10:24:07,来自浙江,14970251654,边城牧野清笛
7122647482752271135,加强经济发展，提高民生福祉！,0,70,0,2022-07-21 10:31:34,来自安徽,2277833787321262,快乐平安老王
7122656210260116227,巩固社会经济发展才能安全，当下的中国经济进入，打好基础,0,49,0,2022-07-21 11:05:39,来自浙江,3523287132938542,拜拜天空中陪
7122645263688172323,防控疫情，稳定经济，行稳致远。,0,54,0,2022-07-21 10:21:48,来自广东,106105080256,仲华
7122653192697168674,加强经济发展，提高民生福祉，防控疫情，稳定经济，行稳致远！[玫瑰][玫瑰][玫瑰],0,64,0,2022-07-21 10:53:02,来自山东,111406832640,灵巧青山Zc
7122655750870696718,防疫和稳经济都要做好。,0,56,0,2022-07-21 11:03:37,来自广东,92837482106,用户虱子
7122654533180015400,及时出手克服困难保持增长，坚持不搞“大水漫灌”不留后遗症，沉着应对挑战保持社会大局稳定……,0,51,0,2022-07-21 10:58:20,来自甘肃,3815389394,春秋一生
7122643696591422243,加油加油加油加油加油！,0,67,0,2022-07-21 10:15:42,来自广东,110066986142,比卡丘不丘
7122643386712474402,中流击水，更需奋楫前行,0,96,1,2022-07-21 10:14:33,来自广东,1130766660800104,中山市特美达照明
7121605101084951296,大国经济，不能局限于一时得失，必须看全局、辨大势。,0,5,0,2022-07-18 15:06:09,来自山东,3378150521963183,晓君
7122653210669826850,发展经济才是硬道理，这是永恒的课题，也是国计民生大事！,0,45,0,2022-07-21 10:53:12,来自江苏,104503575695,临风3020
7122650722717893417,贯彻党中央的经济要稳住，疫情要防住，发展要安全的方针，保持经济健康平稳发展。,0,50,0,2022-07-21 10:43:32,来自河南,54925223396,马园丁
7122651650346631951,疫情影响太大，要不然我们经济会更好,0,40,0,2022-07-21 10:47:06,来自广西,53272602790,阳春面39
7122648307192988451,祝愿祖国繁荣昌盛，人民生活幸福美满！,0,38,0,2022-07-21 10:34:13,来自河南,62442040944,六顺吉祥如意
7121510320576905995,带来信心和希望，经济恢复发展未来可期。上半年经济企稳回升，下半年期待更上层楼，[赞][赞][赞],0,22,0,2022-07-18 08:59:05,来自广东,377825405703212,最有爱豆包
7122652116321518370,坚定不移的跟党走，努力做好每一件事,0,34,0,2022-07-21 10:48:56,来自江苏,82070127107,勇敢的一年年
7122656588582306591,保持经济稳定增长，争取经济走上新的里锃。,0,28,0,2022-07-21 11:06:59,来自广东,104356169624,自由的星辰aX
7121520180504757027,"以民为本，稳字当头。
提高质量，稳中求进。
国富民强，行稳致远。",0,19,0,2022-07-18 09:36:29,来自河北,6778106015,古涯
7122653109507425065,二季度实现正增长，展现出中国经济巨大潜力与回旋余地。[比心][比心][比心],0,32,0,2022-07-21 10:52:45,来自云南,880065151248351,阿平6526
7121515207834469124,中国经济稳步回升[点亮平安灯][点亮平安灯][点亮平安灯][点亮平安灯][点亮平安灯][点亮平安灯][点亮平安灯][点亮平安灯][点亮平安灯][玫瑰][玫瑰][玫瑰],0,11,0,2022-07-18 09:18:16,来自广西,102678413561,武均8慧军
7121372436008370976,下半年依然困难重重,0,1,0,2022-07-18 00:05:57,来自四川,3214605787086164,自由惊蛰
7121524909355991820,疫情要防住，经济要稳住、发展要安全。增强信心，踔厉奋发，下半年会取得更大更多的成绩，圆满完成全年经济发展目标！[赞][赞][赞],0,11,0,2022-07-18 09:54:23,来自四川,106053556007,刘书铄
7121590094129611532,内需是强大的经济推动引擎，但经济的增长除了内需外，还有中华民族利用自身智慧玩转全球的智商。,0,7,0,2022-07-18 14:08:50,来自河南,74027565626,子言孜语
7121543476705215235,上半年，在疫情影响下，中国经济发展逆袭上扬。相信下半年，全国人民团结一心，努力奋斗，经济发展肯定会再创辉煌！,0,12,0,2022-07-18 11:07:31,,4252520074718125,滩里雄鱼
7122699219773244200,希望一直好转,0,18,0,2022-07-21 13:51:49,来自摩洛哥,1583717452103255,北碚100倍
7121550651653522188,今年实现8％的增长目标可全面完成，举国欢庆！,0,11,0,2022-07-18 11:35:31,来自山东,69875136982,声之云琪
7122649176915067679,一定要做到防疫和经济发展两手抓。,0,28,0,2022-07-21 10:37:53,来自江苏,3218972531758040,鲨鱼骑行
7121512351975326479,上半年经济稳步回升，下半年再接再厉，再创辉煌！[赞][赞][赞],0,7,0,2022-07-18 09:06:25,来自陕西,1891601149591608,秦巴山妞
7121518098968363779,中国经济为全球“日益黯淡的经济前景”带来光亮。[赞][赞][赞],0,9,0,2022-07-18 09:29:28,来自法国,2155480272080955,幸福乱来
7121549090412167966,祝我们伟大的祖国经济永远稳定增长，步步升层！[鼓掌][加油][赞][赞][赞],0,9,0,2022-07-18 11:29:11,来自山东,58440855430,青涩饭团wy
7121570177396785954,在复杂多变的世界大环境下，我国经济发展稳定增长，提高了人民生活，也为世界经济贡献巨大力量。,0,6,0,2022-07-18 12:50:18,来自四川,63872742458,华庆双龙1陈先铭
7121531997771989797,上半年经济企稳回升 希望下半年经济更加牛势 祝福祖国兴旺发达,0,5,0,2022-07-18 10:21:57,,74995528156,温柔荷叶Ua
7122747532014469900,疫情下，保住经济稳步发展，也只有共产党的中国才能做到！,0,8,0,2022-07-21 16:59:49,来自吉林,99231496206,博学多才的沐沐阳
7121533761896579847,"正视困难，
共克时艰，
增强信心，
踔厉奋发。",0,6,0,2022-07-18 10:28:50,来自山东,3611230054137614,麻不麻叔
7121570392355603215,中国经济一直都很好,0,5,0,2022-07-18 12:51:20,来自江苏,14163133837,凯中庸
7121514853457920808,好，真好。。。[赞][赞][赞],0,7,0,2022-07-18 09:15:47,来自河南,110934957698,愉悦的星辰zH
7121698240193938211,叫一声好，虽然我工资低,0,1,0,2022-07-18 21:07:13,来自浙江,106015294935,自若小猫AA
7121555351325279009,"点赞[赞]
这是中国人民克服重重困难、努力实干的结果！",0,5,0,2022-07-18 11:53:36,来自四川,110473232000,云漫山巅
7121527720198046494,成绩来之不易，再接再厉，期待下半年更上层楼。祝伟大的祖国经济永远稳定增长！[比心][赞][赞][赞][赞],0,5,0,2022-07-18 10:05:16,来自陕西,65556248675,幽默的一片叶子
7121541833230123787,伟大的祖国越来越强盛，人民越来越富裕，值得点赞,0,6,0,2022-07-18 11:01:17,来自河北,66201541246,千层雪千层雾
7121855930765427490,内环是自身，外环可以促进内环，外环还是要大力扩展。才是稳定增长点。,0,1,0,2022-07-19 07:19:43,来自天津,104942720331,完美橙子xb
7121253616698770188,价格挺温和的，把涨的多的扣除出去挺好的。,0,2,0,2022-07-17 16:23:16,来自内蒙古,51822407190,明哥话健康
7121301659686273800,比起想念来，千年又何其长。比起相见来，千年又何其短。,0,1,0,2022-07-17 19:28:44,来自湖南,1940007039806861,乐天派蓝天1u9
7121795861579547400,上半年经济企稳回升，好！,0,0,0,2022-07-19 03:38:51,来自黑龙江,63285341621,北溟散人257
7122376704345391902,总理务实，兴国兴邦，高维格局，美丽前景。,0,2,0,2022-07-20 17:00:24,来自四川,2708844620558551,喜庆的花猫LT
7121554723622208291,稳定发展，才是国之根本，有了发展，人民才能过上好日子,0,4,0,2022-07-18 11:50:23,来自四川,3619216207913325,老吴18090231
7122935365538890500,中国经济韧性强、潜力大、疫情期间充分释放了经济的巨大潜力和动能，展现出应对国际局势动荡的韧性和潜力。,0,0,0,2022-07-22 05:12:24,来自山东,102527300463,运筹帷幄香瓜8Z
7120918822760416004,福州加油，福建加油！,0,1,0,2022-07-16 18:43:34,来自福建,2988026659,朝阳羽
7121723366721110818,面粉原来80元一袋，现在105,0,0,0,2022-07-18 22:44:49,来自河南,105218998078,海棠花之美丽
7121509922621293342,在新形势下为我国经济的平稳发展点赞！[赞][赞][赞],0,4,0,2022-07-18 08:57:05,来自山西,110713932700,戊子书会
7121280073856041761,今年小麦确实增产了！[赞],0,1,0,2022-07-17 18:05:26,来自浙江,52667369401,惞蹨
7121530127620096804,“疫情要防住、经济要稳住、发展要安全”[赞][赞][赞]中国经济加油[加油][加油][加油],0,5,0,2022-07-18 10:14:43,来自甘肃,6899328243,冰山雪莲117818746
7121536024404296488,齐心协力共同发展，团结一致紧紧团结在党中央周围，。,0,4,0,2022-07-18 10:37:56,来自安徽,3773138607805661,天下最颠
7122359299536028454,高质量发展经济！,0,0,0,2022-07-20 15:53:39,来自河南,2154674041138535,逐梦远方勇往直前
7122644921664389923,发展，既要看速度，更要看质量，看效果。不攀不比，坚定信心，走好自己的路。,0,0,0,2022-07-21 10:20:38,来自河南,67802633014,安逸枫叶nj
7121528309145846563,下半年我国经济发展必将一枝独秀！,0,0,0,2022-07-18 10:07:25,来自福建,99324962606,用户名积善生正气
7120905531472364302,这样的成就，也就只有中华民族才能配得上了,0,18,1,2022-07-16 17:51:41,来自北京,86340199351,大手大脚的飞
7121530184251327273,坚定信心，齐心协力，共担风雨，推动国民经济企稳回升！,0,1,0,2022-07-18 10:15:28,来自云南,12801937520456,淡定晚风N
7121579380098269990,我国上半年经济稳中有升，下半年应有更大突破[赞][赞],0,0,0,2022-07-18 13:26:48,来自上海,76052774963,浦西fanny
7122653952071435042,夺取疫情防控和经济社会发展双胜利注入信心。中流击水，更需奋楫前行。[加油][加油][加油][加油][加油],0,29,0,2022-07-21 10:55:52,来自河南,110482949819,幸运天空h
7122646624614171426,大国经济有韧性。我经济规模依然可观，长期积累的雄厚物质基础和超大市场规模优势明显[赞][赞][赞],0,40,0,2022-07-21 10:27:33,来自湖北,63316982297,无双微风8
7121601309874815756,可是这个暑假疫情又开始了,0,3,0,2022-07-18 14:52:26,来自湖北,50088644986,胸有不平气
7121521464389862159,增强信心，共克时艰，真正做到“疫情要防住、经济要稳住、发展要安全”，在下半年交出平稳健康发展的经济成绩单！[赞][赞][赞],0,8,0,2022-07-18 09:41:38,来自四川,3821552734046504,龙舞劲风
7121512311839376159,上半年，我国GDP同比增长2.5%，总体呈现企稳回升态势，较为成功地稳住了宏观经济大盘。尤其是二季度经济顶住压力实现正增长，殊为不易！！[加油][加油][加油],0,10,0,2022-07-18 09:06:28,来自湖南,4327497091,行者无名7777
7122648654280016675,疫情要防住、经济要稳住、发展要安全，继续做好“六稳”“六保”工作。持续增效力激活力添动力，努力保持经济平稳健康发展。,0,24,0,2022-07-21 10:35:28,来自福建,1887182337359517,执着的生活家zJ
7122647665506272040,中流击水，更需奋楫前行。站在年中节点，继续加大宏观政策实施力度，着力巩固经济恢复基础，必能争取今年我国经济发展达到较好水平。,0,35,0,2022-07-21 10:31:35,来自新疆,51646277066,轻尘吴建江
7122648528249357070,二季度实现正增长，展现出中国经济的巨大潜力和回旋余地。站在年中节点，继续加大宏观政策实施力度，着力巩固经济恢复基础，必能争取今年我国经济达到较好水平。中流击水，更需奋楫前行。,0,25,0,2022-07-21 10:35:32,来自江苏,4064242380318675,幸运星
7122652427450598184,转发了！,0,20,0,2022-07-21 10:50:09,来自江西,21799734132,业余的我1
7121592277738898191,确定了？,0,11,0,2022-07-18 14:16:24,来自广东,1478212627207476,蓝色海洋
7121562857304736526,必须的,0,5,0,2022-07-18 12:22:19,来自新疆,106074481692,分享未来者
7120656399059403535,中国加油,0,2,0,2022-07-16 01:49:56,来自福建,92806210656824,乖巧风声96
7121639803598209824,工资低,0,3,0,2022-07-18 17:21:05,来自江苏,2696451027122478,仁清生活
7121632842920149795,不得了,0,1,0,2022-07-18 16:53:28,来自山东,51112203166,国民哈
7122642888688681732,为伟大的祖国点赞！[赞][赞],0,66,0,2022-07-21 10:12:35,来自贵州,98892609440,好学笑笑
7121507363550823183,坚定信心，同舟共济，稳中求进，确保经济持续健康发展！为伟大祖国点赞！！[赞][赞][赞][赞],0,5,0,2022-07-18 08:46:49,来自湖南,3413352648289549,橘洲夜话
7121525734556091139,上半年经济企稳回升 ，下半年期待更上层楼。,0,14,0,2022-07-18 09:57:39,来自湖南,109144337841,冰岛日记1234shrj
7120612116000293672,成绩来之𣎴易，可喜可贺，再接再厉！,0,2,0,2022-07-15 22:53:00,来自四川,88508817315,扁豆478
7121504989985374984,"疫情下，上半年经济企稳回升
稳增长，下半年期待更上层楼[加油][加油]",0,16,0,2022-07-18 08:37:51,来自广东,897671576428371,真水有无香
7121507869887021836,热评丨上半年经济企稳回升、下半年期待更上层楼！,0,10,0,2022-07-18 08:49:48,来自上海,109554259110,马大帅278
