7122378541542998818,我是欧洲宇宙大学毕业的，我骄傲了吗？,0,0,0,2022-07-20 17:07:31,来自河南,1314645104661966,无所事事的的人
7122261836111643426,民国时期的名教授如钱钟书等是什么学历？关键是是否有真才实学。,0,1,0,2022-07-20 09:34:30,来自山东,4706119068,风卷云舒之
7122572088842093320,对北大的教学要人质疑,0,1,0,2022-07-21 05:40:37,来自天津,109713548995,简单饭团oW
7122244431734391552,这种克莱登学历在清华大学肯定行不通的，理科的研究没有真才实学想混也不敢。,0,2,0,2022-07-20 08:27:06,来自湖北,3087019048700808,小荷见头角
7122790736399172387,刚刚收到北大的录取通知书，去还是不去[打脸],2,5,2,2022-07-21 19:46:50,来自浙江,5862601030,风神69033337
7122485589252997928,陈寅恪可以没有文凭回来被聘请当教授，他没有造假。而现在这位陈造假了。当然，那是因为现在不造假就没有机会。,0,9,0,2022-07-21 00:03:30,来自江苏,109534862267,亲职教练
7122247410633949989,高校现在就要海归博士。,0,1,0,2022-07-20 08:39:04,来自四川,108956146226,车是小四
7122333281714504483,她是怎么混到北大教授的? 北大教授都这水平吗？,0,2,0,2022-07-20 14:11:52,来自江苏,5981054811,74159855
7122752353882702600,好多有真文凭的人也具备克莱登大学毕业生的水平！,0,0,0,2022-07-21 17:18:02,来自上海,3755554833698856,正本清源168
7122316978819597086,打假必须全方位，学历打假、论文打假、学术打假是文化教育和科学技术界的重要任务。,0,2,0,2022-07-20 13:08:03,来自辽宁,68247012225,MrGongZheng
7122432817992516386,我也是爱尔兰欧洲大学的博士毕业，公司不承认，不敢拿出来！[捂脸][捂脸][捂脸],0,4,0,2022-07-20 20:37:41,来自广东,3698950899,单纯百香果hE
7122241391723709215,德才兼备，以德为先，是为师者的必要条件,0,2,0,2022-07-20 08:15:47,来自北京,2101896072146669,Lynn植大战僵尸
7122330788146119454,买卖文凭，涉嫌犯罪，公安机关应该立案展开侦查啦！,0,23,0,2022-07-20 14:01:44,来自湖北,82646268563,一骑绝尘仁无边
7122268013323731747,陈春花教授确实厉害！一年就拿到了博士文凭！不知道含金量如何？,0,1,0,2022-07-20 09:58:39,来自河南,730490788644292,山为蜂
7120769317838734087,北大的春花，成了笑话[大笑][大笑][大笑],1,43,1,2022-07-16 09:03:27,来自四川,59168469016,黄203691411
7122952804264149768,"关键看看国内她有多少同学？多少校友？
这个大学为国内培养了多少“博士”？",0,16,1,2022-07-22 06:17:22,来自内蒙古,5523918662,白杨NMG
7122309289934816015,学识如何，讲课如何。都不行怎么就北京大学院长，教授了？,0,2,0,2022-07-20 12:37:57,来自浙江,96934791237,自由暖阳HV
7122270007232856836,本人：“克莱登大学”博士毕业！,0,1,0,2022-07-20 10:07:24,来自四川,5792412436,吴冶宋话
7122344287412896549,北大教授团队因陈春花博士出名了,0,0,0,2022-07-20 14:54:47,来自安徽,60619795107,赤膊男人
7122257769926755113,国外的硕士生博士生有速成，为什么国内的要2一5年？,0,2,0,2022-07-20 09:18:31,来自浙江,51609958403,原来你亦在这里
7122355056468935457,我只尊敬、佩服数理化博士、教授。,0,0,0,2022-07-20 15:37:13,来自四川,24709512143,顽强冰淇淋d1
7122994209451426568,北大尚且如此，其他大学不敢想象[捂脸],0,1,0,2022-07-22 08:56:47,来自北京,3752065378,传说哥-yeah
7121730709596963620,知识界的水太深，一般人不会懂的。,0,88,0,2022-07-18 23:14:22,来自江西,92524557917,飞哥9393
7122067162739163919,学历造假，学术道德问题,0,8,0,2022-07-19 20:58:54,来自河南,109749893637,一往无前清泉zr
7122837203650626340,教育部不认，但只要北大认就行,0,9,0,2022-07-21 22:47:50,来自重庆,56622673671,聪明柳叶AD
7121831606226305827,商学院都是老板镀金的地方，当院长只要有捞金能力就行。这逻辑没毛病啊。,0,38,1,2022-07-19 05:46:09,来自江西,80957941162,皛飝龘
7122295006140039948,同学们，静一静，让我们以热烈的掌声欢迎“克莱登大学”方鸿渐博士讲话,0,1,0,2022-07-20 11:43:47,来自陕西,55939328893,细雨亭
7122060723232342816,没想到:如今的北大教授竟然也是如此不堪，还有几何？[捂脸],0,8,0,2022-07-19 20:34:22,来自江苏,55494134109,小漆老漆小小漆
7122058318147388192,怪不得大学质量差，原来如此，,0,19,1,2022-07-19 20:25:17,来自江苏,1372620795675795,不凡的远山Y5
7122465839151891208,我更好奇，一个连国外都不认可的他国自己的大学，回国认证的时候，是怎么认证成功的,0,4,0,2022-07-20 22:46:29,来自日本,4212938065579295,奔跑的背包欢
7122734541525041952,"毋庸置疑，陈春花教授可以一年博士毕业，
透透的学霸啦，
985北大学生也少有这样的水平吧
将遇良才啊[ok]",0,0,0,2022-07-21 16:09:30,来自福建,105185567163,榮創置業
7122260975792882464,能力够不够教授更关建，是人才，无需学历高，有学历无能力更误人,0,1,0,2022-07-20 09:31:58,来自山东,22156106787,新泰人在济南
7122477031622935331,师德问题，假文凭，读错别字问题，都是不该发生的从业底线问题，但在北大接连不断的发生，真是匪夷所思！斯文扫地！,0,3,0,2022-07-20 23:29:48,来自北京,11199875218,1180511012
7122067954690753291,这样的教授能教出来诚信的学生吗？,0,8,0,2022-07-19 21:02:30,来自上海,2754265687,201802083555
7121718745525633796,最高学府啊！情何以堪？,0,166,3,2022-07-18 22:27:55,来自甘肃,588930180984903,土木慰心
7122074699689050919,学历造假应该严惩！,0,10,0,2022-07-19 21:28:36,来自陕西,57593962745,思无邪151738420
7122563113945334563,学位授权、院士评选等问题太多了，大家会由此想到什么？最危险的时刻！,0,0,0,2022-07-21 05:05:36,来自天津,61192158211,八爷1965
7122320561938236173,克莱登大学文凭好使吗,0,1,0,2022-07-20 13:22:41,来自广东,65352036334,taotod
7122919114926506783,今后清北不能有特招各省尖子生的特权了，应由西北工业大学，国防科大特招,0,8,1,2022-07-22 04:13:46,来自湖南,111150854097,微笑西柚BP
7122255718706889479,出国留学的文凭，是不是有造假,0,2,0,2022-07-20 09:11:18,来自福建,3188214576189806,爱自由爱家人
7122476140043944739,现在的科技通讯发达，方鸿渐式的学历应该不难核查?,0,2,0,2022-07-20 23:26:18,来自广东,52287783503,自由风声d6o
7122631524222075652,陈女士的课非常好。她入职北大，课程经过了教授委员会、教授代表和学生三论试听，全部合格才入职的。,0,2,0,2022-07-21 09:29:36,来自江西,2924354934942516,宁远城里的小阿七
7122066867653182245,@中国新闻周刊 请看看邵阳学院[大笑][大笑][大笑],0,8,0,2022-07-19 20:58:07,来自湖北,104275705345,清风河南信阳周彬
7122056074714497826,陈春花教授，主张共生和长期主义。自己却没长期~,0,7,0,2022-07-19 20:15:49,来自北京,97621048397,非常3721
7122238110489936653,学术，学历真的要打假才行,0,2,0,2022-07-20 08:02:50,来自江西,52199768539,成就小灵通
7122632320502432542,这说明了即使有名校文凭也不一定比假学历、假文凭的拥有者有能力！看样子我们的用人单位都不能只要文凭不要能力啊！,0,1,0,2022-07-21 09:32:38,来自陕西,96908602645,黑暗95589
7122446057489482503,不能偷换概念，学历不能造假，这是诚信问题。否则，博士价值失去了大众的敬畏。[灵光一闪][灵光一闪][灵光一闪],7,315,2,2022-07-20 21:29:34,来自湖北,3395743164932616,完美麻酱v3
7122308763125777165,陈春花博士？韩学愈主任？,0,1,0,2022-07-20 12:36:02,来自云南,106060620165,否极泰来5946
7122850185469756164,还有多少因为不是网红而末被发现假洋博士[捂脸][捂脸][捂脸],0,52,0,2022-07-21 23:38:32,来自海南,52855175636,工作外的歇息
7122299125865366279,请北大快回答。,0,28,0,2022-07-20 11:59:37,来自北京,4037032992847179,有趣的星星lq
7122823896848040742,陈春花很有实力。学历的确算是瑕疵,0,0,0,2022-07-21 21:56:00,来自广东,2924328340434584,七大名山
7122900600181818112,还有多少冒牌博士？,0,5,0,2022-07-22 02:59:13,来自河北,58216956341,端庄优雅蛋糕js
7122033065656222503,百花齐放，百舸争流。八仙过海，各显其能。,1,13,0,2022-07-19 18:47:29,来自北京,59594648620,直爽船帆RV
7122268904663663391,为何这么多真博士每年不能按期毕业？明显的假博士确能当导师，是不是应该有人勇敢的对此负责？,0,1,0,2022-07-20 10:02:27,来自新疆,5967568080,热情的沙滩Dy
7122573068928975657,北大早就不是原来的北大了,0,13,0,2022-07-21 05:43:28,来自河南,101953024179,天津晓月铜驼暮雨
7122260218238583555,对学历造假，要坚持零容忍。这不单纯是沽名钓誉问题，而是反映一个人的品德问题。,0,3,0,2022-07-20 09:28:56,来自四川,101667119569,自在如意妙宝
7122357007230960420,学历只是真才实学的一种可见证明，真才实学的人不一定有学历。,0,0,0,2022-07-20 15:43:47,来自河南,1063972270262408,禅心论万道
7122262113846068002,中国学校这种学历的老师可能不少了。,0,2,0,2022-07-20 09:35:38,来自山东,69771640342,村愚
7122230660890690338,说明现在好多高校的所谓教授水分太多了,0,2,0,2022-07-20 07:33:37,来自江苏,3879490346036680,导师李耳
7122060385532412709,现在的博士真是真假难辨，鱼龙混杂。花钱买个博士也太简单了。,0,9,0,2022-07-19 20:33:01,来自山东,1890778653397677,不凡光束X4
7122954253848822560,她学历怎么通过认证的,0,8,0,2022-07-22 06:23:30,来自上海,3190039685,小资Amy
7122231823903949583,深圳搞管理咨询的中旭公司照搬陈春花文章给各企业老板讲课收钱，陈春花照搬彼得德鲁克的观点收名又收钱[我想静静],0,2,0,2022-07-20 07:38:07,来自湖北,109208480146,就是1806
7122638615628776230,北大聘这样的教授，用该反思。,0,1,0,2022-07-21 09:56:06,来自上海,8322935509,达摩尼克
7122652903688799017,陈寅恪没有学位，但人家大大方方，没有弄假学位。这和花博士是不同的。,0,1,0,2022-07-21 10:51:52,来自辽宁,3144221181349211,笑而不答
7122987395696001804,能洗吗，你举例子的陈寅恪和王云五，人家有真才实学，并且也没去弄假文凭，但是陈春花是假学历，是欺骗，欺骗,0,0,0,2022-07-22 08:30:57,来自广东,1085948415194020,搞车老陆
7122238337049838350,只要是外国学历必须有这个用人条件是不是该改改了[呲牙],0,2,0,2022-07-20 08:03:59,来自天津,58184250850,QQ夜色阑珊
7122989367320445711,一个陈是读了十多个正规的大学不要博士证。另一个陈是没读正规的大学还要一个仿造的一张纸。真是是可忍，孰不可忍,0,0,0,2022-07-22 08:37:39,来自湖南,51055585957,袋子也行
7122043090273387276,求文凭水分所占比率？,0,9,0,2022-07-19 19:26:22,来自广西,3699175935452507,聚福6789
7122972429269959464,上海公务人员没出国的但有相当比例有这类外国大学的经历，都是联合办学一年拿学历,0,0,0,2022-07-22 07:32:14,来自上海,62998016822,自以为师
7122550325088977704,北大出来走两步[打脸][打脸][打脸],0,1,0,2022-07-21 04:20:09,来自河南,95205200744,我们祖国万岁
7122038891414569763,北大不应有这样的产品吧？,0,10,1,2022-07-19 19:09:18,来自四川,19440319413,沙河路人
7122984594294883105,没学历和造假是两回事,0,0,0,2022-07-22 08:20:06,来自上海,24916185412,上帝之眼里失落的世界
7122989689635767053,这女人厉害，明知道非法大学文凭还四处招摇撞骗。,0,3,0,2022-07-22 08:39:32,来自河北,62170858350,人生—若只如初见
7122704242116330247,不是说学历不重要吗,2,14,4,2022-07-21 14:11:32,来自青海,94782617024,天高和云淡
7122274752995099433,只要有真本事就好，什么博士硕士无所谓。,0,1,0,2022-07-20 10:24:24,来自广东,52805578253,敏锐豆花fS
7122312893583901480,我是朝鲜亚洲大学经济管理专业的硕士后,0,1,0,2022-07-20 12:52:21,来自海南,61271338200,世林广议
7122341671458849571,我猜测全国绝大多数的网民与我想法一样，对学历造假者，必须要追究刑事责任！它破坏了社会公平，践踏了法律，构成了诈骗与盗窃罪，侵犯了国家与他人的利益权力、危害公共教育安全罪！,0,0,0,2022-07-20 14:44:26,来自浙江,2990304299319296,顽强星辰bh
7122039254384919328,克莱登大学[捂脸][捂脸][捂脸]北大脸面何存？,0,17,0,2022-07-19 19:11:15,来自广东,104954402947,讲道理讲真话
7122316833982120745,所有博士的毕业论文要上网可查，接受监督,0,3,0,2022-07-20 13:07:54,来自陕西,73854142040,阳光64411
7122233500828730146,我准备办个韩国宇宙大学，起步博士后，学费只要十万，有报名的吗？,0,2,0,2022-07-20 07:44:42,来自江苏,1349828839222280,璑詺
7122779389531964198,没有博士学位和买博士学位能一样吗？？,0,1,0,2022-07-21 19:03:33,来自浙江,3210175614822942,彳金亍
7122841451675386627,陈春花到底是真有水平还是空有其名，让北大出来说话，北大每年考核，她到底能不能过关,0,0,0,2022-07-21 23:04:54,来自山西,4223811328,长风啸天
7122842400477348643,庆幸孩子没在北大读博士,0,1,1,2022-07-21 23:07:45,来自安徽,96791840610,奋发有为船帆J9
7122279607440720673,管理学博士都不稀奇,0,1,0,2022-07-20 10:44:03,来自江西,51920674302,乘风破浪的小鱼D
7122809955983754024,我宇宙大学毕业的我炫耀了吗？,1,2,1,2022-07-21 21:01:18,,14474758727,海米是虾
7122817845058487048,不管了那里出身，只要有能力，有才华，为什么不能在北大任教？请说出你的理由！,8,2,7,2022-07-21 21:32:09,来自甘肃,3927080563649820,丨5199135736
7122041820120728331,以前听陈春花教授报告，也常常提及华为,0,14,2,2022-07-19 19:21:23,来自陕西,3082648381829150,正能量辰星pP
7121761167596503808,这个东华国际人才学院，可不就是一个小型的“西湖大学”“长江商学院”之类的吗？,0,6,0,2022-07-19 01:15:03,来自贵州,73362517954,山海亦随风
7123000215481156393,大学导师，剥削压榨所带学生，学生不以导师名义发表论文能毕业吗,0,0,0,2022-07-22 09:19:56,来自甘肃,1609308992709726,山水蝶舞
7122284206587642624,国内大学不是搞培训发文凭吗？,0,1,0,2022-07-20 11:01:22,来自浙江,2450162594355616,机智的可乐1N
7122982918573835044,问题是北大还有多少像陈春🌹这种的教授,0,0,0,2022-07-22 08:13:07,来自广东,88787472214,才高八斗清风Z
