7122297032177517327,教授都会包装自己吗？兼任其他大学教授有工资吗？大学教授可以成立公司吗？可以盈利赚钱吗？可以兼任多家公司法人代表吗？可以在公司持股做股东吗？她平时还有时间备课教书吗？中国人就是能，能兼任这么多职务？牛🐮,7,58,0,2022-07-20 11:50:56,来自江苏,51200151869,沧海一粟wxniwind02
7122258183292224294,一年博士毕业，关键是被华南理工北大南大认可,1,1,0,2022-07-20 09:21:05,来自上海,3069434010015918,一个散淡的凡人
7122759178653303555,你说的陈寅恪等没文凭，也任教授，王云五甚至只是中学毕业，都获得尊重，这是事实，关健是他们没有做假！而陈春花即便能力再强，但只要做假，那她就不可能获得尊重。,1,23,1,2022-07-21 17:45:21,来自湖南,6179952954,小西的山月朗风清
7121835531495326478,北大落得如此，呜呼哀哉！其他大学呢？,0,112,0,2022-07-19 06:01:58,来自英国,13675891412,Buddy88
7122207391995118366,也就是说，如果没有那个欧洲假博士文凭，陈是应聘不了南京大学博士后的，更没有北大教授，院长头衔。那现在曝光了，应该怎么办呢？虽然此人有些能力是真的😊,3,15,1,2022-07-20 06:04:39,来自河北,9579036739,雪山之巅45
7121732902156911392,原来硕士学位也有问题，完全是一个本科生，通过各种包装，弄成国内管理学大师，简直是太牛了！佩服的五体投地！南京大学北大都很有意思啊！,10,67,1,2022-07-18 23:23:27,来自北京,1648923126541639,老猫20120226的故事
7122071688590000932,躲不是办法！@北京大学 @北大国发院,1,39,0,2022-07-19 21:16:40,来自广西,55558243140,开往秋天的船帆
7122236694275425065,在国外，读博士学位，不一定一定要3 4年的时间吧[酷拽][酷拽][酷拽],1,1,0,2022-07-20 07:57:05,来自海南,4474430932,永远不褪色
7122824732600795904,玷污北大，污染学术圈，罪无可赦,0,17,0,2022-07-21 21:58:39,来自江苏,104480257573,非鱼之乐呵
7122049028250338081,问题是，南京大学在接收她做博士后时没有经过教育部学历查询吗？如果查询了，其结果要么是教育部查询内容有误，要么是没查到。不管那种情况，都必须追责。,7,265,2,2022-07-19 19:49:14,来自湖南,55164875252,够痛快1
7122612480815235851,看看国人膜拜的北大！看看国人膜拜的北大教授！,0,9,0,2022-07-21 08:16:01,来自山西,7002556706,滑行时光
7122025542467568418,生活中又有多少学历掺水呢？比比皆是！,1,82,0,2022-07-19 18:17:38,来自浙江,6606333846,糊里糊涂99047252
7122980867823846152,北京大学南京大学被东京大学西京大学看笑话了吧。,1,6,0,2022-07-22 08:05:26,来自河南,6106233183,lsj5708
7122214625672020775,"硕士毕业一年后博士毕业，这件事也不是不可能的。
国内在前些年报考硕博士研究生时有个条件是“同等学力报考”，具体是工作满两年的大专生，可以参加硕士研究生入学考试，工作满五年且取得一定科研成果的本科生，可以参加博士研究生入学考试。
所以，处于读硕士研究生的阶段，不用等到硕士毕业，根据同等学力报考博士研究生的条件要求，就可以参加博士研究生入学考试了。
如果这个爱尔兰大学也有类似国内同等学力报考的政策，那么陈春花就可以在硕士没毕业之前就去读博士，她读博士的时间也就不是一年了",3,6,1,2022-07-20 06:32:47,来自辽宁,102126499794,时间是一条河
7122859225415697167,头衔如此之多，《围城》里的方鸿渐只能自叹弗如甘拜下风！在此大胆妄言，只要有关部门严查，全国各高校及科研机构不知还有多少个*春花！,0,0,0,2022-07-22 00:13:47,来自广西,4389668339321485,谁染霜林醉尽是离人泪
7122035624282604318,1、怎么进的北大？2、如果博士学位是假的，那么博士后经历就很尴尬了,2,331,2,2022-07-19 18:57:08,来自辽宁,2854768810144455,奋发梦想家5M
7122897647920825128,如果是一个造假学历的学术骗子，跻身到高大上的神圣知识殿堂，四处招摇撞骗，这是很难服众，很难让人们接受的。是否这种行为应该受到严厉的谴责，甚至惩罚？不然如何对得起那些，认认真真踏踏实实一步一个脚印儿去求学，获得博士学位的学子们。,0,0,0,2022-07-22 02:49:23,来自北京,6227146356,宋增建
7122513996682806057,民国有个教授胡适，拿了几十个博士学位～,4,11,1,2022-07-21 01:58:11,来自广东,97984654832,段启钧
7122843080646607656,真的假不了，假的真不了,0,0,0,2022-07-21 23:10:12,来自河南,97082511051,天蓝蓝   白云飘
7122198555682767657,陈老师已经从华南理工大学退休，已经从北大那边退下来，至于文凭造假那也不算造假，学历含金量可能会被质疑，等媒体和大家质疑的时候，人家都赚的盆钵体满了，你还能怎么样？,2,11,1,2022-07-20 05:30:12,来自贵州,52230355522,露天体育看台
7122015817093104421,克莱登大学[捂脸][捂脸][捂脸]北大脸面何存？,6,318,2,2022-07-19 17:40:34,来自四川,1019945429504739,如风哥哥8888
7122813429995701031,国外获得的学历学位，水分确实比较大，因为用人单位一时难以搞清这些学历的水分有多重！应该制定学历学位欺诈法，一旦查获造假，应承担严重的刑事责任，属于非法占有较大数额的公款行为。,2,18,0,2022-07-21 21:15:25,来自江苏,1459739562870269,温柔旭日jw
7122243792291971877,居然是方鸿渐牌的翟天临，看来教授好当，学位难拿,0,4,0,2022-07-20 08:25:10,来自江苏,52343353836,lantant
7122115895233299213,陈春花说 钱钟书数学考零分照样清华北大当教授呢,3,33,1,2022-07-20 00:10:39,来自江苏,54652036189,云淡风清154784777
7120787446681305856,人家是爱尔兰欧洲大学，类似克莱登大学，不是欧洲爱尔兰大学,5,25,1,2022-07-16 10:12:26,来自北京,1030485062,老西儿1967
7122263978168320806,事实再一次证明，学历代表不了能力，唯学历论是一种“自我标榜”！,1,1,0,2022-07-20 09:43:36,来自河南,22824229512,古月庄园
7122259617157399303,大学的校址竟然是一个宿舍地址，我也是醉了[酷拽],0,8,0,2022-07-20 09:26:13,来自广东,22926977077,思念是堵墙
7122250327202038541,支持严查学历造假行为，让更多真正有才华的人绽放光彩[给力],0,7,0,2022-07-20 08:50:27,来自山西,1521351820053444,东篱词话
7122070092808520481,这样的人都可以到北大做教授，能教出什么样的弟子？,2,81,1,2022-07-19 21:10:54,来自陕西,3739857765,路漫漫132
7122224685596574477,当年我插队农村十个年头，该授什么学位？,2,5,0,2022-07-20 07:10:53,,23724841466,新余老李
7122855204298769182,顶尖大学也这么水[捂脸][捂脸][捂脸][捂脸][捂脸],0,81,0,2022-07-21 23:58:39,来自广东,63587193129,杨铁明1
7122054418023023360,北大、南京大学、华南理工出来走两步,3,64,1,2022-07-19 20:09:18,来自河南,101323629125,喜庆的帆船Eo
7120606177054638859,又一个“克莱登大学”[灵光一闪],2,113,3,2022-07-15 22:30:42,来自上海,185162008112871,打醋的酱油瓶
7122843584789398307,新加坡国立大学企业管理研究生院的经历，我都表示怀疑了！,0,0,0,2022-07-21 23:12:23,来自广东,1732425850036295,梦幻风铃W
7122063020045878049,现在港、澳及海外还有大量的一年制研究生，这个水分有多少、含金量几何，相信内行人心里都清楚，国家对海外一年制研究生和远程网络授课等方式获得的文凭应该不予承认。,3,79,1,2022-07-19 20:43:11,来自广东,7057395101,野芥子
7121842224954000162,陈春花的事告诉我们，学历不重要，重要的是能力！,4,51,1,2022-07-19 06:26:36,来自美国,52905960963,闲庭信步够逍遥
7122032944449176334,陈春华真的挺不“学术”的…,0,73,0,2022-07-19 18:46:40,来自浙江,108736405785,poseidoness
7121726204503458594,虽然文凭不能代表能力，但用假文凭就是品德问题!,2,43,0,2022-07-18 22:56:06,来自上海,58820789543,反网游专业人士
7122988377779700514,若确有真才实学，学历拉胯，设法弥补以求教职，也就罢了；若借助利用教职进行大规模商业市场运作，吹得这么厉害，胆子太大！,0,0,0,2022-07-22 08:33:56,来自北京,1486127979824445,朴实白云n7
7122891234826011396,幸好没去北大上学，当年的选择太对了,0,0,0,2022-07-22 02:29:05,来自陕西,77097502914,西安空间美学
7122070801632969513,陈春花到底有什么能力？大家说说看？,1,7,0,2022-07-19 21:12:53,来自江苏,51200151869,沧海一粟wxniwind02
7122322303626822400,真是读书人的笑话，更是北大的笑话！,0,4,0,2022-07-20 13:29:04,来自福建,60746912736,味素3
7123007028578534180,所以“鸿浩”不影响校长干到退休[捂脸][捂脸][捂脸],0,0,0,2022-07-22 09:45:44,,52719301347,一路艳阳3
7122071824368124706,关键是陈春花究竟是如何通过学历和学位认证的，北京大学和华南理工没有进行学位认证审查？这几年一直在审查啊，没有人复核陈春花的档案吗？,1,46,2,2022-07-19 21:16:55,来自河南,3300002878,ww2hj
7122209385132327693,学历真假有变，学识真假如何？教授的职责是教书育人，师德和学识是根本！,0,10,0,2022-07-20 06:12:12,来自内蒙古,101439269793,xinxindema
7122235729341940487,学历造假，不诚信，何以为人师表?,0,8,0,2022-07-20 07:53:48,来自山东,2651660270177080,诚信快乐zh
7122230742083699489,很多老师师德败坏，为了学评，迎奉学生，哄着学生，导致学风日下，严格教学的老师倒成了异类，被学生诟病,0,7,0,2022-07-20 07:35:00,,6154257574,成熟水滴sL
7122810852717855495,问题来了，一个被浙大师生抵制的校长，顺利当上了浙大校长，后来还又调任北大校长,0,42,0,2022-07-21 21:05:17,来自福建,206314745114436,武陵郡公
7122021961072640803,一个善于造热词，蹭热点的培训讲师，搞得很能指点江山,2,134,0,2022-07-19 18:03:36,来自上海,54133132911,智者闲云野鹤1999
7122723459360883460,虽然博士后不是学历，但能在南京大学商学院做博士后在博士群体中也是百里挑一的存在了,4,0,2,2022-07-21 15:26:50,来自河北,62872457538,HBr2
7122039590168609566,现在好多国外大学对中国学生目的了如指掌，也投其所好，拿钱给文凭，不管你学不学，好多成绩差点就想法到国外弄个一年毕业的研究生回国找工作，其实还不如中国的本科,4,118,2,2022-07-19 19:12:25,来自新疆,1622519412425467,直言善意良心
7122654813613015839,各位网友请你们收下留情，给高考失利的留条后路吧。你们要把二本毕业生逼到没有退路吗？学术圈有多卷，你们不知道吗？陈老师如何不是牛人，怎么可能当上北大教授。,0,0,0,2022-07-21 11:00:01,来自北京,6543488397,palinz
7122298614131131150,扑朔迷离的学历，这是一个善于经营自己喜欢走捷径的人。,0,3,0,2022-07-20 11:57:34,来自辽宁,1103537038694375,夏老师3627
7122073374247191332,假学位问题不好解决，牵扯面过大。,1,9,0,2022-07-19 21:23:28,来自北京,102862891631,春眠自觉晓
7122250267961475880,"1.这说明，出来混总是要还的。
2.也说明，假学历也有人才。
3.更说明，唯学历论是不对的。",1,2,0,2022-07-20 08:49:36,来自山东,430640517622416,秋瘦山2
7122449344472580894,关于学历，现在还有业余大学毕业的，不知道业余大学坐标在哪里？……业余大学，职称评审竟然还算大学学历。,0,6,0,2022-07-20 21:42:04,来自山东,6647954930,72913limin
7120833252692706048,我想注册美国北美洲大学,1,16,0,2022-07-16 13:10:53,来自广东,4195843375,SASA123
7122242611179619086,我们公司之前批量搞的新加坡国立所谓研究生[我想静静],1,2,0,2022-07-20 08:20:21,来自广东,6844450804,快讯24H
7122962638858158882,连北大都如此，可见其它大学又有几个真正的博士,3,30,1,2022-07-22 06:54:15,来自湖南,1873193415741918,荣1818198
7122092476571173663,用人单位应对文凭的真实性负责。招聘要要认真严格验证文凭的真实性，如果只看应聘人拿出来的文凭就信以为真，而不跟发文凭的单位进行直接验证，就是不负责任。,2,7,0,2022-07-19 22:37:39,来自重庆,2994689852051548,高山老竹
7122052363174904588,无论她学历真假，她在这么多国内知名大学任教是怎么通过的？她又有什么贡献？她如果真的有贡献的话，咱也不能维文凭论。希望官方把她当个事儿。,2,23,1,2022-07-19 20:02:04,来自河南,59222324086,西域的天空4
7123016600966054667,北大，民众心目中神圣的高等学府，竟然如此这般，痛心！,0,0,0,2022-07-22 10:23:40,来自内蒙古,237142558376343,足智多谋饺子KS
7120796106921034531,之前看到陈春花的介绍感觉很牛逼，就找了她几个演讲，仔细看完觉得实在是一般般，当时就确认：盛名之下，难符其实。,2,22,0,2022-07-16 10:46:34,来自上海,85166205068,耐斯蛮
7122296335327822592,北大为何不给大家一个交待？,4,85,1,2022-07-20 11:48:20,来自广东,62269289943,北冰洋1769
7122041201443750691,怪不得现在大学的学生质量越来越不好,0,92,0,2022-07-19 19:18:00,来自陕西,4103032655588268,汉中豆米粒
7122464857164612384,"皮[大笑][大笑]
方鸿渐也没有将克莱登大学毕业证拿出来[大笑][大笑]",1,27,0,2022-07-20 22:42:49,来自广东,5198337937,冯旋光
7122602730032104205,春花教授应该不是假的文凭，合理的说法是春花这个文凭含金量不高。,4,7,2,2022-07-21 07:38:19,来自浙江,395478036129096,悠悠小民哥哥
7122275750958433035,如果真的是学历造假，那就有点不可思议了，她的头衔中的几所顶级大学都没有辩识力？,0,2,0,2022-07-20 10:29:09,来自四川,1750857400714203,可爱枫叶1Y0
7120737510719783721,方鸿渐的师妹[捂脸][捂脸][捂脸],1,90,1,2022-07-16 06:59:36,来自广东,1169470356465048,幸福来敲门哦p
7122242171314979619,走一圈，高学历也是编外[大笑][大笑],0,3,0,2022-07-20 08:18:19,来自湖北,5937106906,爱武汉一1
7122819935956452108,翟天临，一纸婚约……是北大的吗？,1,19,0,2022-07-21 21:40:29,来自湖南,3007888005802414,言吾心上秋
7122446615000089375,相比于钱穆这类人的水平，很多博士教授都白给。看不出那个陈春花的水平，除非看的人更没水平。做人就怕和纸一样肤浅。,0,52,0,2022-07-20 21:31:30,来自江苏,69637662648,2020我思故我在
7122239258115048227,很多正规毕业的商学博士还如春花教授的营销包装能力吧？,0,1,0,2022-07-20 08:06:58,来自四川,5405191205,胡侃高考
7122595325042328357,名利不可兼得，假文凭注定会被反噬。,0,13,0,2022-07-21 07:09:12,来自黑龙江,2510914844373107,面向大海6655
7122066995461374754,"陈春花老师的事件，本人不做过多评价，
本来也没有评价人家的能力呀[捂脸]
我真正关注到的一组网络词汇，对于我而言感觉很新鲜，学习啦😄
“流量反噬”  我理解它的同义词是“物极必反”
是不是能对上谱呢？还望网络大能们点拨一二[祈祷][祈祷][祈祷]
#哈尔滨设计之都# #励志# #文案# #哈尔滨头条#",1,10,2,2022-07-19 20:58:02,来自黑龙江,106069728696,北少金戈
7122263069757227814,这也是我不太喜欢读中国的哲学，心理书的一个原因，太多取巧和幸存者偏差，缺乏国外大师的普世价值观。比如李笑来，比如冯唐，非常敬佩他们的才华和高度的自律性，但是字里行间表现出来的傲气很让人不舒服。最喜欢的还是芒格，纳瓦尔，达•瑞利欧等，讲的是普世，通用的价值观，而且语气谦和，颇为受用,1,6,1,2022-07-20 09:40:02,来自北京,2361395649973943,刘铁雷老三
7122946974387192612,对待“蹭学历事件”，她应该像对待“蹭华为事件”一样发出声明，拿出法律武器维权～,0,0,0,2022-07-22 05:55:08,来自上海,104125662418,人力EXPERT
7122063639494116127,假如真有能力，是个天才，那么进大学、当教授也是可以的，但造假是万万不可容忍的。,1,7,0,2022-07-19 20:45:35,来自陕西,4366896347483068,直率山丘vA
7122048857063850752,有些洋学历太水，不要迷信详学历，一年硕士，一年博士，加起来两年，在国内可是6一7年才能完成。一年能学到啥？那些收钱就发文凭的大学，我们能认吗？这是对苦读书的国内硕博生最大的不公平。,0,59,1,2022-07-19 19:47:54,来自四川,61349451829,何哥171281300
7122824776410350350,教育行业乱象丛生，忧虑！,0,152,0,2022-07-21 21:59:12,来自山西,57189204816,清醒的人生yan521
7122323118966260494,北大教授都不查学历真伪？陈教授博士学位只用一年获得，爱尔兰“文凭工厂”荣誉出品！,0,54,0,2022-07-20 13:32:42,来自湖北,4822120276388,旅游爱好者佳佳
7121121134195639073,查一下爱尔兰教育机构或认证机构，有没有通过正式认证，查一下谷歌或bing地图，看看有没有实际办学场所。如果都没有，那肯定是假学校。另外，大学一般注册为非赢利机构，而不是有限公司，公司大部分是卖文凭。,0,1,0,2022-07-17 07:48:48,来自浙江,1538908332494989,俊俏荷叶K1
7123004049481925413,我入來看这文章，因为从未听过欧洲爱尔兰大学！？,0,0,0,2022-07-22 09:35:13,来自广东,59589397571,智慧的慢慢变富
7122027406387004194,所谓名校，频繁出现这样的造假丑闻，在国际上排名不高，不被接受，也是能理解的。,1,86,0,2022-07-19 18:24:52,来自山东,3624465636788435,林子里有鸟
7122793558574777128,是不是所以大学都应该对这些院长，教授、导师的学历普查一遍[what][what][what],0,86,2,2022-07-21 19:57:48,来自广东,3277907597,诚信判官
7122573286260900649,现大眼的是北大，弄了个假博士当教授，高度怀疑北大的校品！,0,40,0,2022-07-21 05:44:11,来自北京,1433351767207336,用户北海北
7122910564786897695,"北大清华就是牛！
啥都十分出名！",1,28,0,2022-07-22 03:41:07,来自福建,1464195458272781,进步和田3T
7122055513961317135,陈春花没有说他是岑春煊的妹妹，已经很够意思了。,2,6,0,2022-07-19 20:13:40,来自上海,663755239988839,王宇昆山
7122270750127719204,硕士也是假的，新加坡国立大学企业管理研究生院——没有这个机构,3,100,2,2022-07-20 10:09:30,来自广西,6479839762,非洲熊猫
7122019527147701032,一年就拿博士学位，真是个天才呀,2,220,4,2022-07-19 17:54:16,来自河北,85614624651,山石ssss
7122049044721435433,博士学位国家不承认，怎么申请的博后呢？,1,36,1,2022-07-19 19:48:41,来自北京,81701825313,赵师兄
7122251523513729833,"应该多想一想：为啥会这样！！！
我个人认为：是一点都不奇怪的现象！比如某公司刚招来几位才毕业的大学生，入职便提为班长，其实，他们还啥都不懂！因为学的专业都不对口！甚至还乱操作。
结论是：你再有能力、而缺了文凭是无用的！",0,3,0,2022-07-20 08:54:29,来自重庆,3060659696187486,幸福湖泊qD
7122284214418096911,方鸿渐含笑九泉[打脸][打脸][打脸]@北京大学,2,51,1,2022-07-20 11:01:09,来自山东,63771701601,真的不知道001
7122915570290803456,不知那个去街道办的北大核物理学博士作何感想？,0,27,0,2022-07-22 03:58:31,来自广东,1759643695069527,魏城镇阿龙连锁超市
7122145632986661666,国外学历认证都要从严,1,20,1,2022-07-20 02:08:33,来自福建,6026007582,福建都市文学
7120748640175424256,响彻中华大地的顶尖人才[呲牙][呲牙][呲牙][呲牙]哪个部门认定的人才？,4,46,2,2022-07-16 07:42:35,来自上海,111091074348,摄影与后期制作
7121832111300346660,哈哈哈笑死我了,1,12,0,2022-07-19 05:49:02,来自浙江,3069305976,不怕的好奇猫
7122083622217286435,大学，科研机构应该多吸收在工科领域的高层次人才。,2,10,1,2022-07-19 22:02:47,来自山东,84049762876,a晴朗的天441
7122221505735525123,支持严查学历造假行为，为学术营造风清气的环境，让更多更有才华的青年科学家发挥作用！,0,7,0,2022-07-20 06:59:05,来自辽宁,3809163030300771,知情达理原野9T
7122969386838983436,等待北大的调查结果,1,4,0,2022-07-22 07:21:24,来自安徽,80370327097,绿水青山94841
7122300341860991775,这些高校连文凭都不查一下的吗？,0,2,0,2022-07-20 12:04:12,来自湖南,1050750747681939,猫姐123
7122855993616646920,怎么招聘的，有的人是否违规？,1,24,0,2022-07-22 00:01:58,来自广东,338284556329499,深圳帮帮家教
7120694271015502592,感觉北大很搞笑！,3,76,0,2022-07-16 04:17:08,来自江苏,105726057412,用户wxm098
7122469273687802632,你的意思是说其实陈春花的学术水平很高是吗？,13,84,2,2022-07-20 23:00:18,来自福建,3210008395,人之初8793845
7122699511663035136,人文学科水分真是大啊,0,1,0,2022-07-21 13:52:53,来自上海,110502836187,sj1128
7122821982105699102,翟天临也是被北大录取为博士后的。,0,52,0,2022-07-21 21:48:03,来自北京,9486524285,大海流星111
7122959398909690654,教育是囯家的百年大计，也是国家发展未来的基础，教育强国不可立竿见影，重在质量博硕培养严格制度才培养出名符其实的人才。不在数量。,1,6,0,2022-07-22 06:42:43,来自甘肃,111496887070,开朗轮船YZ
7122701097680356130,其实关于学位这一问题，目前都是以西方教育体制为标准，其实我看有很多什么博士也不一定就学问博，硕士也不一定就学问硕。重点要看所学实际产岀能力，对育人，对社会的经济发展有没有实用价值，应该以这个为标准才对。可无奈的现实是只认认证书，有证才有机会，再有能力没证靠边站。这就不得不承认也不得不接受一个事实就是人人都要想方设法搞一个响亮的证为前提，就会产生这样的那样的真的假的各种证，产生了一个庞大的利益链。,0,4,0,2022-07-21 13:59:01,来自内蒙古,1077145668696651,爱书法的老马
7122280095347262239,如果真实情况就是这样，这位学者是凭本事赢得北大的青睐，那我们要为北大鼓掌，这打破了常规那些唯名校论水平的做派，无论你出自什么学校，只要你真的有水平，你的文凭是真实的，为什么不能发呢？,0,1,0,2022-07-20 10:45:33,来自上海,68590695485,朴实明月Zy
7122936397983433484,克莱登大学,0,0,0,2022-07-22 05:16:00,来自吉林,110441276689,思考的芦苇1965
7122055786523771680,感谢钱钟书先生的《围城》让我们知道了克莱登大学文凭的含金量。,0,37,0,2022-07-19 20:15:25,来自四川,6422291637,建哥88754906
7122632070324880162,梁启超不如谁？我认为谁也不如梁启超。文人，之神人也。,1,0,0,2022-07-21 09:31:10,来自四川,2524950081575823,英明果断春风JZ
7122407848943878925,北大牛，但老师是如此级别，令人寒心,1,23,1,2022-07-20 19:01:22,来自浙江,105299438993,缤纷溪水ar
7122629802313564964,写文章先学好逻辑再下笔。近代大家的文凭高低至少是货真价实的，聘用时考虑的是能力。现在有人造假已无底线，如果是假文凭，至少说明德有问题。毕竟德是第一位的，至于能力高低，是第二位的。,0,15,0,2022-07-21 09:22:54,来自河北,5747282963,飞耒
7122315127026320168,南大博士后估计是真的。南大也背锅了。,2,7,1,2022-07-20 13:01:15,来自安徽,25356380705,牧的歌
7121837931534369570,那个年代，崇洋思想严重，所以大批假洋学历肆虐，北大清华也不幸免。而近年中国人自信心增强，所以对水硕之类蔑视，洋学历的含金量就轻了,0,4,0,2022-07-19 06:10:08,来自安徽,93245243891,诗意枫叶HS
7122833355523719936,凡事不能一概而论，还是要具体问题具体分析。看看他们的所说所做是否有真本事。曾经被说成是“克莱登大学”毕业生唐骏，不仅担任微软高管，也是号称中国最高收入的打工人，至今仍活跃在中国创业界。再看看陈教授的所作所为，不就一清二楚了吗。,0,1,1,2022-07-21 22:32:15,来自江苏,104777049526,坐看风云1948
7121887273741910819,相信大师，难道都是算命专业的专家，做科学研究的专家只相信大师，我们怎么能相信她说的理论呢？,2,2,0,2022-07-19 09:20:57,来自江苏,100200425048,cg839
7121862889400648489,北大还要她吗？[大笑],1,5,0,2022-07-19 07:46:34,来自江苏,92944726403,阿美旅行
7122554928723182336,如果陈安之，俞凌雄，翟山鹰有类似的博士文凭，是不是也是名校教授？许多有口才的初高中生，只要弄个文科类的博士文凭，混个教授不难。坑蒙拐骗是道德问题！,0,9,0,2022-07-21 04:35:51,来自湖南,104307795354,篮球新看客
7122273421014188807,那学历认证是咋拿到的？,0,3,0,2022-07-20 10:19:50,来自山东,751714056579070,正北方风舞雪花
7122012263133004574,该北大出来走两步了，要给公众一个交代,1,298,1,2022-07-19 17:26:21,来自北京,8551531885,念秋望春
7122999679494718242,如果国内各高等学府、各大企业以个人能力为本，不为外国学历是从，也就没这个类事情发生了,0,1,0,2022-07-22 09:17:35,来自江苏,84622848957,小桥流水266963271
