7122057931260330792,一年博士毕业，关键是被华南理工北大南大认可,44,952,8,2022-07-19 20:23:01,来自天津,86839492515,涂歌里抃
7122845807757443874,无语，我们是不是进入了虚拟的世界,1,101,0,2022-07-21 23:20:52,来自湖北,50927785429,幽默星辰Xv
7122087125163721484,陈教授的书，我读过几本，初时觉得妙不可言，后来才发现原来是人家彼得德鲁克的观点。,19,631,7,2022-07-19 22:17:05,来自中国香港,61056184276,狄入卫郑弃其师
7122832856329732875,其实人生就是一场游戏，只是陈教授玩得游戏是做大学教授而你可能是玩泥巴罢了,1,57,0,2022-07-21 22:30:47,来自湖南,97175947176,段家成创生之柱18689710011
7122814502818612008,不是儿戏，都是关系,0,215,1,2022-07-21 21:18:52,来自北京,103859359509,风中的阿里
7121844650608509700,10万元/人[钱]中国有钱人是多,0,83,0,2022-07-19 06:38:00,,4371283998419731,宝里个咪
7122800537841517350,其实他们比我们明白。,0,104,0,2022-07-21 20:25:03,来自北京,92724505773,感谢爱国的人
7122017423947088673,能不能教书育人最重要，有文凭也有一肚子草的人。,34,553,34,2022-07-19 17:46:39,来自湖南,109829791703,诚敏君
7121829074267505422,这是很正常的事，只不过被抓住把柄罢了,3,112,4,2022-07-19 05:37:26,来自北京,4217365868581223,多才多艺苹果cq
7122846088360870690,怀念觉醒年代,0,45,0,2022-07-21 23:22:01,来自云南,76848400461,LDP590
7122819548797600544,轮回,0,6,0,2022-07-21 21:39:12,来自上海,5449352856,mr-xiaoding
7122951875645326093,清，北大已经沦为高教界的笑柄,0,97,0,2022-07-22 06:14:03,来自湖北,107966295716,三线记忆
7122237996874826536,对学历造假，要坚持零容忍。这不单纯是沽名钓誉问题，而是反映一个人的品德问题。,0,543,4,2022-07-20 08:02:01,来自福建,4142560058023691,薇薇逛红尘
7122303786139845380,终于有媒体跟进陈春花学历了，北大居然拒绝采访？应该发公告说明情况。,10,182,0,2022-07-20 12:16:50,来自上海,5513383832,职业咨询顾问陈凯
7122086927842820877,那陈春花的博士生，还有效吗？,28,545,4,2022-07-19 22:16:01,来自山西,1925971202815911,心理咨询师阿紫
7122271535410414367,中国亚洲大学，各位赶紧抢注,5,64,1,2022-07-20 10:12:26,来自湖北,6154232550,考研达人李然
7122324798658691852,春花教授的博士校友挺多的，比方鸿渐多多了。,3,114,0,2022-07-20 13:39:25,来自上海,4119891688,满楼读书
7122262978816164648,还好浙大的学子联名抵制了！,1,184,1,2022-07-20 09:38:58,来自浙江,109190370000,玲珑樱花语
7122619678392320779,满纸荒唐言！第一你对比的人没假文凭！可以没有，不能作假！第二她的学术能力早被质疑了！只是有些人介于她北大教授院长是名号不是太敢明说而已！第三她可不是被动碰瓷华为 那是往上贴！,14,369,1,2022-07-21 08:44:04,来自加拿大,104038490195,目函里
7122660675868001061,她是怎么被评为北大教授的？,3,14,0,2022-07-21 11:22:13,来自河南,3820961287,davilind
7122868600717427496,有的人拿着野鸡大学的学历混的风生水起，有的人拿着真是博士学历凑不齐首付。,1,180,0,2022-07-22 00:51:45,来自北京,6898115261,冬雨雪1
7121788422251119400,名字真好听!春天的花，当春天的花，开满北大……,3,81,1,2022-07-19 03:03:48,来自黑龙江,56012176688,奶奶带娃也精心
7122765480099791654,陈教授与北大原校长还有这层故事，钱💰是好东西，power也是。,3,70,0,2022-07-21 18:09:30,来自河北,111360618166,季乃礼
7122614040853152526,学校不回应，帮着改简历倒是挺快的！,2,38,0,2022-07-21 08:21:41,来自北京,110298170912,刚刚讲商业
7122604062398464776,陈春花有学术成绩吗？,0,142,1,2022-07-21 07:42:57,来自广东,100535038974,爱琴海的鸽子
7122633371481572131,北大也不过如此？是文凭问题？是学术问题？是人际关系问题？不得而知，知之甚少！看官方答复！,1,92,0,2022-07-21 09:36:08,来自辽宁,6257027736,陆小杰杰
7122464918057796363,讲席教授啊，一等一的荣誉和待遇啊！让真正的博士教授情何以堪啊！,2,117,0,2022-07-20 22:43:09,来自河北,93187417004,美丽江河
7122602857463202598,有个前提是不能学历造假，如果她只是本科学历却能得到北大的教职，那才值得点赞。,4,154,1,2022-07-21 07:39:07,来自黑龙江,83359499377,落花生
7122814587753808652,所有的学历，到底是谁说了算，这么多出国留学的什么硕士博士，又是怎么来的，会不会老外们玩弄中国人。如果真是造假的话，要么来一次学历大清理。真的搞不清到底是怎么一回事？,3,28,0,2022-07-21 21:19:45,来自广西,4090607531735616,顶级小鱼23
7122786629106500384,学历造假和没学历是两回事，没学历是没有文凭背书，学历造假是人品污点,0,1,0,2022-07-21 19:32:02,来自北京,60641377247,戴西2008
7122061035401659172,怎么进北大的，有点奇妙。,19,664,2,2022-07-19 20:35:19,来自黑龙江,2510914844373107,面向大海6655
7122130145816642311,学历造假，不诚信，何以为人师表?,0,336,6,2022-07-20 01:07:32,来自陕西,50627907047,辉常行游
7122078353175839500,流量反噬，做人要低调,1,72,1,2022-07-19 21:43:12,来自山东,2812777551,赵老师讲农技
7122060619884626722,“爱尔兰欧洲大学”现在广为人知了,7,334,2,2022-07-19 20:33:25,来自甘肃,108591440450,红蓝舟
7122228923966604036,学历造假、学历包装，错在当事者缺乏诚信，但根子在“学历崇拜”、尤其是“洋学历崇拜”上。,1,52,0,2022-07-20 07:28:09,来自黑龙江,2005978780283198,教育点燃梦想
7122283187443090215,玩大了! [笑哭][笑哭][捂脸][捂脸],1,119,0,2022-07-20 10:58:12,来自广东,55197117593,想要飞的鲢鱼
7123004288699368203,为什么教授也喜欢当网红？,1,3,0,2022-07-22 09:36:24,来自山东,3095851733094612,时光与亿
7122264939250828066,质疑的太晚了，2014年我就质疑她的学历了,2,54,0,2022-07-20 09:46:33,来自广西,51971563045,正念甘露
7122464413579379494,没拿到文凭，跟搞个假文凭不是一回事！,1,262,1,2022-07-20 22:41:04,来自河北,95903058375,Renold陈
7121833945154896670,幸好没去北大,2,47,0,2022-07-19 05:55:48,来自山东,52288538953,鹿鸣薇薇
7122870339482665769,“陈春花”这么容易，莫言需要多言啊！[捂脸],0,0,0,2022-07-22 00:58:08,来自湖北,1983167028016008,茂淇淋
7122245579396858656,北大不能让北大门小贩混迹,1,31,0,2022-07-20 08:32:30,来自北京,20414715249,观世大爷
7122206654497915685,一个博士生花了几年时间、为了几篇论文常常感到“崩溃”时，一些人却用几万元钱就轻轻松松获得了“博士”学位，这显然是不公平的。,3,129,1,2022-07-20 06:01:55,来自安徽,19104504280,云淡风轻
7122381292410962729,所以中国为啥要盲目相信国外的大学就是好大学呢？镀金就去国外，结果是国外旅游一趟即可。为什么不自信一点，用国内大学读了博的人来当教授呢？为什么在发布招聘时常常要求有国外留学经历或干脆就是国外博士毕业呢？这都是崇洋媚外的衍生品！,1,10,1,2022-07-20 17:18:12,来自四川,63708090806,旌城蜗牛
7121731727982478116,全世界，博士就没有一年学制的。英国一年的硕士学制都被称为水硕。老百姓不知道，教授不可能不知道！,17,95,2,2022-07-18 23:18:13,来自广东,62451829547,ly560916
7122920786356699939,教育行业乱象丛生，忧虑！,5,201,1,2022-07-22 04:17:12,来自河北,4388868237822430,锦绣中华美
7122055656143684363,支持严查学历造假行为，为学术营造风清气的环境，让更多更有才华的青年科学家发挥作用！,3,444,3,2022-07-19 20:14:41,来自重庆,71624906525,睿智晚风UU
7121838466602320674,洗出了一座人才国际学院——原来不只有一个陈春花！,1,43,1,2022-07-19 06:12:33,来自山东,2831968725121200,夏mao
7122252361825370915,论文需要一篇一篇写，书需要一本一本读，不可能弯道超车。[赞],1,25,0,2022-07-20 08:57:46,来自浙江,108450451331,纳兰july
7122080111717499661,在职研究生学历是一个什么学历,20,122,1,2022-07-19 21:49:38,来自贵州,102656585660,智勇双全糯米u0
7121849714613879583,在资本的裹挟下高等学府的殿堂也如此不堪，悲哀！,1,185,1,2022-07-19 06:56:12,来自山东,103372696099,AudreyLiu789
7120746002344674084,居然是个公司行为，简直亮瞎我的双眼[惊呆]真相越来越清楚了，水落石出！,2,106,0,2022-07-16 07:33:20,来自天津,62532958499,梅格桑朵
7122571362229224228,北大出来走一圈,1,15,0,2022-07-21 05:38:00,来自天津,109713548995,简单饭团oW
7122219498584916748,中国学校这种学历的老师可能不少了。,2,138,2,2022-07-20 06:51:35,来自山西,1877571425806044,用户名4122934
7122228113060889379,这种克莱登学历在清华肯定混不通的，理科的研究没有真才实学想混也不敢。,5,102,2,2022-07-20 07:23:59,来自安徽,3297011553,行走湖上
7122480678809617183,这个世道，不打造骇人的“人设”，没人会理会你，村花也许是众多打造人设的专家之一，也许能力真的超过了众多“博士”，不幸的是碰到了较真的华为。,3,48,1,2022-07-20 23:45:05,来自重庆,52719393789,拙视界
7122962158866023207,现在好多大学所谓教授都在花钱买学历职称，哈哈，产业链，各取所需！,1,74,1,2022-07-22 06:53:20,来自江苏,101920805928,想飞的鱼9366
7122224619385897743,当事人不回应，有关网页删除，这已经说明问题了。关键是有关大学也沉默，都怕牵扯到自己的责任。,1,65,1,2022-07-20 07:10:15,来自上海,1930355330515047,大地牧歌1413
7121731539406177054,不管是苏东水还是苏西水，都不可能为陈春花教授买过来的博士学位证书进行“背锅”，因为当时的陈春花已经成年，而且受过高等教育，理应分清楚真伪。,22,93,1,2022-07-18 23:17:16,来自赞比亚,5373164088,王新在赞比亚
7122214671058944782,她的博士生咋办，学校要有个交代。,1,33,1,2022-07-20 06:32:35,来自北京,92738721775,奇幻奶酪i3
7122046756967727872,知名学者陈春花，因博士文凭被置疑，再一次被推上风口浪尖。,2,301,2,2022-07-19 19:39:49,来自黑龙江,106659393325,淡墨疏影临书卷
7122988534009070374,方鸿渐没能当上北大教授表示很冤枉[流泪][流泪],0,20,0,2022-07-22 08:35:33,来自吉林,3689604324534347,NP自发光蜡烛
7122257951552717603,那些年总被国外留学的光环迷糊了，不分良莠。,0,36,0,2022-07-20 09:19:19,来自浙江,54290978767,独孤谜探
7122196366528955150,先看看这位陈教授教授实力再说事！,1,15,1,2022-07-20 05:23:40,来自江苏,954020316323943,用户慧眼后天成
7122208567780279071,克莱登大学的文凭现在好办吗？[灵光一闪],3,29,1,2022-07-20 06:09:09,来自江苏,1939989205622430,旱海钓客
7122224656807019279,北大国发院应该不是山寨机构吧,1,23,0,2022-07-20 07:10:19,来自安徽,5983342696,学术人
7122594559246631695,中国的学历本来不被外国承认。本来招聘全国分数应一样,3,9,3,2022-07-21 07:06:04,来自江苏,109162777890,原来幸福可以伪装
7122227309964231439,不管什么学历，教学能力如何？,1,14,1,2022-07-20 07:20:39,来自山东,5439014733,幸福歌声荟
7122609199246803719,“那些读遍天下名校的博士、教授，只能表明他们接受过相应的教育，却不能说明他们在学术造诣上，就一定高出教育背景不如他们的同行。”这话没错，学历和能力之间确实不能简单地划等号，但是在我们目前的社会里，不用“学历”做为选拔的硬条件之一，恐怕假的会更多，公平更难以保障吧。[捂脸],0,28,2,2022-07-21 08:03:15,来自安徽,62928226258,闲坐清溪听吹箫
7120774438912180992,你是想让复旦躺枪吗？,4,4,0,2022-07-16 09:22:49,来自江苏,78726931185,王寿兵
7122825194053436174,"爱尔兰欧洲大学
英国克莱登大学
菲律宾亚当森大学
都是出博士的“名”校啊！
哪天攒点钱，也弄个“博士”，好到北大应聘去！",11,289,0,2022-07-21 22:00:41,来自黑龙江,109906147538,闲l云x野c鹤
7122834385636197157,北大陈春花假博士学历，难道跟时任北大校长没关系？她是怎么样进北大任职的？,5,302,0,2022-07-21 22:36:47,来自广西,1987533166619630,奋发有为熊猫UA
7120787461009146624,1997年陈x花的男友注册的爱尔兰欧洲大学，2001年，陈获得了该校博士学位！,9,39,0,2022-07-16 10:12:31,来自海南,19977748188,江华宸
7122251569772577570,文凭只是个标签，在社会上，工作中展现出的各种能力，是不可能作假的。只看文凭，埋沒人才。,2,7,1,2022-07-20 08:54:32,来自新疆,92442825892,M乚0429
7122339514962133775,难道不出面回应就拿她没办法了吗？陈春花私人原因不回应没法强制，但是涉事的三所院校：华南理工大学、南京大学、北京大学，都是公费官办大学，属于社会公共资源，事关民众的知情权，面对如此公然的造假行为，应该必须出面做出回应和处理吧！,2,5,0,2022-07-20 14:36:11,来自四川,4415906356,猫眼观天下WORLD
7122472456405172992,北大居然三缄其口，熟视无睹,6,119,0,2022-07-20 23:11:57,来自广东,3790197147,同沙湖
7122987686750749480,学术都逃不过资本的洗礼,0,0,0,2022-07-22 08:31:05,来自广东,1099142210797198,深漂特穆尔
7122890220567495461,北大陈春花假博士学历，难道跟时任北大校长没关系？她是怎么样进北大任职的？,0,29,0,2022-07-22 02:22:18,来自新疆,98525230095,用户天晴一切都美好
7122803516623864611,可见现在的高校有多搞笑,0,111,0,2022-07-21 20:36:17,来自北京,1983171599543283,时间隔着屏幕
7122640877591872267,尽管这样，陈春花教授发表的诸多企业管理文章确实接地气，相比那些貌似学术，实为堆砌的学者论文倒是有去伪存真，抓住本质的风采；其行文流畅，文字洗练，让人愿意读下去。,4,6,8,2022-07-21 10:04:53,来自内蒙古,100513589008,笑傲江湖89508
7122986965049934599,博士后不是学位,0,5,0,2022-07-22 08:29:07,来自江苏,59132612117,newhi
7122069262839825189,著名学者博士竟持欧洲野鸡大学文凭，令人不可思议并瞠目结舌。,1,116,0,2022-07-19 21:07:24,来自广西,3531270964390926,火炬7722
7122597643028693767,北大尚且如此，其他大学𣎴敢想,0,54,0,2022-07-21 07:18:08,来自山西,470224850652989,聪慧漂流瓶eC
7122240638099522308,支持严查学历造假行为，为学术营造风清气的环境，让更多更有才华的青年科学家发挥作用！,0,28,0,2022-07-20 08:13:03,来自河北,110907630501,墨羽倾璇Anne
7120795783909180164,有人误解了图1—3的EUI中文名与陈教授简历中的不同。其实我解释的很清楚，图4—6的EUI英文原文是一模一样的，只不过图1—3是我的翻译器翻译的，我没有认为修改过来。请仔细核对。[作揖][作揖][作揖],0,24,4,2022-07-16 10:44:55,来自广东,2299803633194636,Jim博士
7122611816907801348,华罗庚初中文凭没人敢瞧不起他，但如果他伪造大学学历，一定会被人抨击。,1,54,0,2022-07-21 08:13:40,来自广西,3087058628785479,笨蛋老廖
7122849076475560735,哈哈哈哈[呲牙][呲牙]北大牛🐮,1,148,2,2022-07-21 23:34:38,来自北京,84999812695,风铃铃铃铃铃铃铃
7122224642253112067,"这人不少，但都有背景！不然咋会这么多头衔，这么多懂事！
昨天有一个报道，查一下肯定有问题，确是以励志样板发表。
这人，二本功课不好，和对象努力考取浙大研究生，然后短时间内斯坦福博士毕业！回国之前生小孩！回国后，去南京大学一个新成立的研究机构任职，该机构，不要论文，不要成果，只要有学历就好！！！",2,36,0,2022-07-20 07:11:28,来自天津,103825803941,祁华550
7122479257854935843,被剥夺北大教职了？,1,9,0,2022-07-20 23:38:45,来自江苏,101880231340,看风景CH
7122833999143289611,那照这么说，邵阳学院一群菲律宾哲学博士还得表扬一下啰，起码别人是正规学校的学历呐。,1,53,0,2022-07-21 22:35:17,来自重庆,6221582126,禤矚龘
7122651635918750503,这种学历造假不仅仅是道德瑕疵，实则是犯罪，要见一个严厉处理一个。,0,43,2,2022-07-21 10:47:59,来自陕西,3319766704,鱼221829260
7122038716503655168,我是🆕克莱登大学的博导[害羞],13,174,5,2022-07-19 19:08:36,来自陕西,111002382020,高地5377
7122953112335221539,华南理工大学慧眼识良才。,0,1,0,2022-07-22 06:17:22,来自江苏,1942114487,明哥月线
7122228817602790178,华南理工大学和新加坡国立大学都是顶尖学府，说明基础很好，能力应该不用质疑！,4,8,3,2022-07-20 07:26:29,,52422989248,深圳Gavin
7122058018581234443,特别想知道，她头顶那么多那么多的头衔，她是怎么做分身有术的？她做了哪些工作有什么贡献？,3,61,1,2022-07-19 20:23:59,来自湖北,105697764087,极客庄河8c1
7122056426284909353,很正常，好多明星都在北大买了博士[捂脸],4,104,0,2022-07-19 20:17:01,来自山西,6662716651,寂寞星座103087966
7122252312474616612,管理学学者陈春花文凭被质疑，时至今日，学历包装并不少见……,0,13,0,2022-07-20 08:57:43,来自广东,761313505850984,头条D新仔
7120586090314023718,既然花教授的支持者不断的提各种问题，我便继续以严格的数据调查予以答复。[作揖][作揖][作揖],7,241,4,2022-07-15 21:11:57,来自广东,2299803633194636,Jim博士
7122066369688158976,那个时代，能有这些博士信息都不简单，博士都未必知道这个爱尔兰大学的底细，因为不是那么容易辨认，信息渠道有限。别用现在来看那时候。顺便，要出名，要经得起大众质疑。这事情只有等陈博士自己澄清了，,5,34,0,2022-07-19 20:55:43,来自浙江,109598998226,鹏程738
7122773404406874920,中国那么多博士艰难毕业，还有一些博士硕士毕业要求这么严格毕不了业，看到这种操作，真是太嘲讽了,0,0,0,2022-07-21 18:39:39,来自山东,2700015580754636,直爽正义凛然花猫Ik
7122844909946077967,"这个林校长
应该是史上北大最差校长之一了吧[what]",1,4,0,2022-07-21 23:17:18,来自福建,106841614868,笔墨0余生
7122070118670713641,爱尔兰欧洲大学，因为陈春花，在中国已成为世界名校了！[捂脸][捂脸][捂脸],1,66,0,2022-07-19 21:10:20,来自江苏,94155592349,双鸿齐飞
7122904260001792779,如果春花博导不在简历中写上博士，也许北大会又落个＂不拘一格降人才的美名＂！著名的北大沈从文教授大学文凭都没有不也著名嘛！谁也没说什么。,2,1,0,2022-07-22 03:20:28,来自湖北,68286331872,與風散步
7122998953821389608,怎么进的北大，太儿戏了吧！名牌大学哦,0,8,0,2022-07-22 09:14:42,来自广东,3109024097385700,才高八斗宇宙uD
7122955338483335936,北大教授，为什么要南京大学严肃处理？ 这里有什么弯弯绕？,2,13,0,2022-07-22 06:26:15,来自江苏,56155387131,杨老师191543135
7122244916453081896,中国学校这种学历的老师可能不少了。,0,19,0,2022-07-20 08:28:51,来自福建,4081840560541710,XMNLXZ
7122801726981473037,城市水深，看来大学水更深！,2,233,0,2022-07-21 20:29:43,来自湖北,5979050389,ygz123好
7122238937300681509,爱尔兰欧洲大学，因为陈春花，在中国已成为世界名校了！[捂脸][捂脸][捂脸],0,17,0,2022-07-20 08:05:59,来自江苏,108255656164,秋日私语js
7122237981721314060,@北京大学 又有点尴尬了，这是当代版的克莱登大学,0,14,0,2022-07-20 08:03:08,来自北京,13070713745,密西西比河静静流过
7122260326494241571,可怕，各高校或教育科研机构，要担起学历审核的责任和义务，如果向社会输出伪劣人才，要付法律责任！,0,18,0,2022-07-20 09:28:53,来自四川,2629632392181944,薄荷醒
7122116505679954701,对学历造假，要坚持零容忍。这不单纯是沽名钓誉问题，而是反映一个人的品德问题。,1,72,0,2022-07-20 00:12:15,来自江西,3923529043291395,喜庆的星球2H
7121744062939562752,名师大师先生、大学公司、欧洲大学老板，你想说啥？,1,30,0,2022-07-19 00:06:12,来自上海,93613854617,小老倌747
7122832241977492259,北大不给社会一个交代吗？！,1,187,0,2022-07-21 22:27:51,来自北京,83779232488,充满正义的仗义执言人
7123002253178422047,"春花秋月何时了，
春花学历知多少？",0,0,0,2022-07-22 09:28:09,,64113818612,私董宗观察
7122018414058816270,那她是怎么通过“三龄两历”审核的呢[思考],21,392,3,2022-07-19 17:50:26,来自四川,54189354559,听闻远方有你5163187
7122955194669400832,首先完成一个管理学博士学位非常困难，但是市场需求很大，于是就催生了海外DBA产业的快速发展，陈某人的事件不是孤立事件，打完了菲律宾大学，还有马来西亚大学和索马里大学,0,7,1,2022-07-22 06:25:55,来自江苏,97099868819,康第84
7122202486270051086,爱尔兰政府没批准这个学校建立，这个大学属于非法办学。而且这学校连个教学楼都没有，只有一间办公室。,3,7,0,2022-07-20 05:46:12,来自江西,3420298780,一口一个奥特曼
7122068670255629097,"学历学位尚且造假，又有多少是真的呢？
要做商人，就好好去做商人，要做老师，那就正己修身、以德为先。身不正，言必歪。
拭目以待，相关高等学府，严肃人事纪律吧。",10,875,6,2022-07-19 21:04:40,来自北京,48019122946504,菁蔚博士
7122850558259905291,看来野鸡大学也未必完全不能读。,2,33,0,2022-07-21 23:40:43,来自四川,3887476296910556,港湾5170
7121834959710798624,博士学位的真假以及含金量陈春花本人不可能不清楚，反而是她比谁都清楚。,4,29,0,2022-07-19 06:00:19,来自天津,109473615260,观澜9888
7122714184319779624,北大被一骗子玩弄了,5,245,1,2022-07-21 14:49:49,来自天津,633756853485384,大云彩06
7120807754310189824,我晕！春花进北大，学校不审查简历背景吗？,3,27,0,2022-07-16 11:31:52,来自四川,54465380011,6G5G4G3G2G
7122817183545557799,现在看来中国的高等学府也不过如此！那清华！北大这样的导师教授是怎样进去的？这样的高等学府的门槛也太低了吧！！！！！！！#你最喜欢的好莱坞影视演员是谁，为什么#,0,0,0,2022-07-21 21:30:01,来自山东,22302775642,悠闲火车TH
7122848317943563023,这就是追求名利双收，贪心不足，欲壑难填的必然结果[马思纯的微笑]，同为知名大学，难道北大和南大都不知道欧大是什么大吗？😳,1,112,0,2022-07-21 23:30:43,来自北京,8314034856,高原牦牛仔
7122161153656193822,有几个国内名校，一直贩卖函授文凭，我已自己的人格担保我说的是真的！,4,12,0,2022-07-20 03:13:52,来自湖南,6545545223,为无知买单
7122089267551175439,我们的专家、教授到底有多少陈春花呢？[what][what][what],1,37,0,2022-07-19 22:24:35,来自湖北,2458103718087982,博学的星空Xj
7122074572698403618,我一同事孩子普高都没考上，现在英国知名大学大二,13,116,1,2022-07-19 21:27:34,来自上海,104131071102,海滨鲲鹏
7120857940147372840,北京大学陈春花老师的博士学位是爱尔兰欧洲大学颁发的，不是写的这个爱尔兰欧洲大学（有限公司）颁发的，爱尔兰欧洲大学不是爱尔兰欧洲大学（有限公司），一年制博士是内招点招特招直推招夏令营招提前招特长招。,4,10,2,2022-07-16 14:46:32,来自安徽,3266658822,观湖无限
7122043134615798543,爱尔兰欧洲大学工商管理: 好混的专业,2,53,0,2022-07-19 19:25:51,来自安徽,63662620643,成功112
7122062761487778575,贾浅浅都是副教授，我是博士怎么了？怎么了？[呲牙],1,20,0,2022-07-19 20:41:42,来自江苏,61737664471,依然如故173757079
7121723459356410628,哦，你帮陈老师解释了半天，原来她不知道这个文凭是假的[笑哭][捂脸]你信吗？,0,64,1,2022-07-18 22:45:57,来自上海,105261373815,智勇双全雪梨Tz
7122044690085937961,在知识大于天的今天，高学历造假是最大的造假。这种事件对社会造成的损害可以说是罪不容恕！,1,57,0,2022-07-19 19:31:46,来自山东,1750039402650548,秋韵清清
7121849760080315151,成功的女人背后站着一个男人,3,84,1,2022-07-19 06:56:01,来自上海,71319386360,我就是我你代替不了
7120747485995352846,感觉花教授可以申请金融学院士，空手套白狼的功夫了得！我大中华的骄傲！[捂脸],1,71,0,2022-07-16 07:38:58,来自上海,111561513861,魔都peter
7122825356868158239,北大引进人才时不做资历、经历和教育背景认证和查核吗？这样的北大，前景堪忧！,1,6,0,2022-07-21 22:01:31,来自瑞士,97159213261,苏村居士
7122626378561848099,只所以有假文凭，因为这里看重文凭。仅凭一个假文凭就能当上北大讲席教授，这个人的本事不是一点点大，一定有她的特长，北大不会这样失误，如果在不讲文凭的年代里，她真的是大有作为，“一个人或许没有文化，但不一定没有才华！”,3,4,4,2022-07-21 09:09:03,来自广东,1508214692,我是老幺
