7122676722868241187,北大，还有真才实学的人吗？好学生进里面也变得…！,0,4,0,2022-07-21 12:24:10,来自河北,93144130589,简单82296
7122986331797766912,真是原来如北——北大的学术界得有多假！,0,0,0,2022-07-22 08:25:52,来自北京,57151566485,执坚披锐
7122800264565752609,鸿浩大学，见怪不怪。,0,46,0,2022-07-21 20:24:07,来自山东,85023121306,乘风破浪的宇宙xM
7122849988413047585,北大清华校长可是正部级呀,1,6,0,2022-07-21 23:38:03,来自重庆,6894241182,远见卓识孔雀T
7122034140429517582,北大、南大、华工全让春花一个人搞定,1,22,1,2022-07-19 18:51:11,来自海南,107763682714,国农8801231
7122012131671180043,一年拿文科的博士学位，根本不存在，但她的本硕学历的含金量还是可以的，有的时候，学历并不重要尤其是文科，但这件事如是真的反映出她的道德有问题，这个对树立学风的高校是有影响的[灵光一闪][灵光一闪],7,90,10,2022-07-19 17:26:10,来自辽宁,4437263225718023,顽强柑桔1T
7122074836322566953,另一种形式的学历造价。,0,14,0,2022-07-19 21:28:29,来自北京,89191955076,菩提慢时光
7122241260475515687,代发论文的机构也存在，给钱可署名。,0,5,0,2022-07-20 08:15:47,来自云南,4085423088876104,纯净的白茉莉花
7120757882836632334,花教授在北大不知道培养了多少企业高管，他们都从花教授那学到了哪些精髓？,2,28,1,2022-07-16 08:19:15,来自广东,50740336143,Altay3
7122479903295177476,像邵阳学院的事，在全国各地的大学都有，赴海外读甚至买的野鸡大学学历，如果是学校子弟或关系户，认可和花大钱引进…邵阳学院用八千多万的大手笔把窗户纸撕破了…,0,11,0,2022-07-20 23:42:12,来自广东,5404005214,moonah
7122767622168658691,原来是春田花花学院[灵光一闪],0,0,0,2022-07-21 18:17:55,来自广东,1925969705175588,一笑而过罢
7120776457365865253,陈春花都算教授了？？？,1,20,1,2022-07-16 09:30:47,来自上海,6966156851,小生顿首
7122080854188802856,北大教授陈春花,0,15,1,2022-07-19 21:51:58,来自海南,18684556135,奇幻百灵鸟vL
7122268943020720934,还是钱老厉害，克莱登大学流行至今,0,120,1,2022-07-20 10:03:05,来自陕西,83264299496,尘埃之花
7122467915676418846,客观来说，学历只是一个过程，只是曾经求学过程中的历程！陈春花教授历任很多高校硕导、博导，不仅仅是靠学历才可以做到的！,25,41,35,2022-07-20 22:54:33,来自广东,59331890328,罗酒神
7122468983705830155,管理这玩意，东说东有理，人不是流水线上的产品，个人是不一样的，所以管理这东西我感觉很难辩驳！,1,15,0,2022-07-20 22:59:07,来自湖北,5575715547,hangfun
7122613940408042243,"一个是光明磊落一个是伪造诈骗
这能是一回事！
北大学问再高也得先教学生做人
否则学问越高危害越大",0,11,0,2022-07-21 08:21:43,来自陕西,52652719277,渭河边裸泳的少年
7122801663055840007,是不是《围城》里方鸿渐上的那个“格莱登”大学的改名？,0,0,0,2022-07-21 20:29:18,来自上海,24698292153,天外访客1
7122280775667876621,知名管理学者 谁给封的？,2,63,1,2022-07-20 10:48:26,来自江苏,6482139453,曼斯坦音
7122239346275189537,本科华南理工大学是可以的，后面的都水了,0,3,0,2022-07-20 08:08:30,来自北京,107867145453,刀鱼说
7122290489465979685,假博士也不少，只是没有深挖，挂羊头卖狗肉的也不在少数，这个人真的是影响极大，性质恶劣，行为可耻！,0,3,0,2022-07-20 11:25:56,来自北京,1292627740993454,博蘭
7122316228827300642,有钱，文凭不是问题[打脸][酷拽],0,2,0,2022-07-20 13:05:22,来自广东,290746586114648,扁豆君杂评
7122359577890407205,因为太重视学历，所以就有了学历市场，全世界都一样。,0,0,0,2022-07-20 15:53:48,来自广东,106805214204,向阳春木花满园
7122307604902724383,顶尖学府里如此复杂？可悲可叹[捂脸][捂脸][流泪][流泪],2,260,2,2022-07-20 12:31:40,来自广西,549398318681725,用户梦子后
7122461130672784168,钱穆弄了个假文凭吗？,0,33,0,2022-07-20 22:27:44,来自江西,56121320333,chinadragon01
7122964635753546535,聘用她的本身就是大学，他们会不知道这个学历的真假？只能说，他们不在乎真假，在乎背景！,0,20,0,2022-07-22 07:03:05,来自山东,5845280594,marlboro
7122845610910860066,能把面试官搞定就行，学历都不重要了,0,0,0,2022-07-21 23:20:16,来自广东,3096676642854221,凯博say
7122036196246897438,最恨学历造假，档案造假，一切造假！造假之人最可恨！,0,31,0,2022-07-19 18:59:19,来自广西,103335366545,勿拉拉的风
7121838638425522982,是为华为搞管理的那个陈春花吗？,1,4,1,2022-07-19 06:14:12,来自山东,93013316304,沉默是金60540
7122444462193787689,陈水博很矛盾。不碰华为吧，没有名气，没有名气，就没有收益！陈水博很后悔，没想到华为碰火了！[呲牙],2,46,0,2022-07-20 21:22:52,来自江苏,104687977926,虎踞龙盘独行侠
7120715113233416971,花教授沉默，北大不应该沉默，应该出来走两步，表个态,3,113,3,2022-07-16 05:35:45,来自广东,82807405056,科学交流8207
7122092020118291232,这么看，北大也有可能承认克莱登大学的博士学位，方鸿渐当时就应该去试一试。,0,10,0,2022-07-19 22:36:29,来自吉林,85304670820,有你我谁睇
7122315315765281575,北大、南大、华南理工，你们都不核实学历真假的？,0,23,0,2022-07-20 13:01:31,来自广东,4071763999,山谷方宏
7122274796301681442,陈春花，易烊千玺，2022大名人,1,36,0,2022-07-20 10:24:53,来自辽宁,6577157476,侠骨柔情96984236
7122040305851171584,文凭冇关系，关键是谁搞去了高校任职,0,40,0,2022-07-19 19:14:48,来自广西,3126602921947956,梦溪小聊
7122818625685357345,怎么跟方鸿渐是一个学校的？,1,102,1,2022-07-21 21:35:24,来自山东,4599025482,张某女士
7122959370371613447,打了谁的脸[打脸][打脸][打脸][打脸][打脸][打脸],0,0,0,2022-07-22 06:42:37,来自辽宁,3122223777066808,愉悦的露珠RO
7120780679616725791,看来我还是得把我的”湘西田野大学”赶紧注册了。,11,35,1,2022-07-16 09:47:14,来自广东,1921600411418436,西部散人
7122683408169976589,北大啊北大……贻笑大方,6,212,2,2022-07-21 12:50:59,来自北京,85865457101,真理在导弹射程之内
7122238761534391040,有些企业高管的博士都是拿钱买的。,1,2,0,2022-07-20 08:05:03,来自湖北,6873895358,地中海146592652
7122328504054203136,昨天才看到那个湖南邵阳的一个学院，批量返聘大批不知名大学的博士，今天这更厉害，博士后学历[晕][捂脸],0,2,0,2022-07-20 13:53:25,来自重庆,1684065861258404,取个名字真难都被占用
7122276258700313356,对假文凭的事要重视一下，不要形成气候,1,50,0,2022-07-20 10:31:27,来自宁夏,976014882642040,房山的空间
7122464152102912802,北大…呵呵呵呵。,1,16,0,2022-07-20 22:39:44,来自湖北,111553789927,坦荡的豆花F9
7122251622734054144,陈春花是谁？,0,1,0,2022-07-20 08:54:40,来自江苏,96483836172,Fh三叶草
7122675666780685056,有文凭不一定有能力，无文凭不一定沒能力。应该破除唯文凭论的桎梏。,0,0,0,2022-07-21 12:20:14,来自河南,20240715821,国205745980
7123009435395588895,北大不查真伪吗……,0,0,0,2022-07-22 09:55:00,来自陕西,87989440232,五月1981
7122021284770530055,清华 大学，，有法律专业吗？有多少人是这的法学 博 士,4,34,1,2022-07-19 18:01:20,来自北京,3082665095072910,用户正好1052
7122456595703202598,原来北大的陈春花大教授是在国外花钱买的一个博士本本？,0,1,0,2022-07-20 22:10:45,来自湖北,2669208542645358,用户皓月宁静明天晞曦
7122696003404841766,谁都可以讲看来学历没有那么重要,1,24,3,2022-07-21 13:40:17,来自上海,4631204051,云梦辙
7122467312485073664,陈教授很有才华，这个学校的文聘又怎样？,1,5,4,2022-07-20 22:51:43,来自陕西,62096591491,秦岭256271939
7122982264795431721,在985大学任教必须有国外留学经历的规定也该改改了吧,0,1,0,2022-07-22 08:10:17,来自河北,98342415980,小空间大舞台
7122993497057460992,主要是平时高高在上，没人去质疑，或者说没人敢去质疑。,0,4,0,2022-07-22 08:53:44,来自河南,1754474939688888,荷韵悠然
7122302302140039973,抖音曝光，简洁有效。,1,12,0,2022-07-20 12:11:44,来自江苏,50256334179,弹剑高歌笑红尘
7122016868793664264,请陈春花向学子们作个交代！,2,67,1,2022-07-19 17:44:31,来自辽宁,6309630500,虽有斑点依然发光
7122804091469906696,当代方鸿渐应该为数不少，,0,0,0,2022-07-21 20:38:45,来自广东,100783683917,木已2737
7122826226326274848,北大头大了,0,3,0,2022-07-21 22:05:01,来自辽宁,1939976201445667,我爱我的幸福之家
7122997996228690723,弱弱问一句，现在是不是还在北大啊？,0,0,0,2022-07-22 09:11:17,来自河南,5396002302,静待花开52883974
7120815603354698527,这么说来，我要是自己在海外注册个大学公司，然后给自己发个博士学位也是可以操作的了[灵光一闪],1,11,1,2022-07-16 12:02:38,来自广东,3935862772731246,呆菠萝
7122985258861069086,北大真牛逼，不管是学术还是管理，终于快赶上爱尔兰欧洲大学了！加油呀！,0,6,0,2022-07-22 08:22:11,来自北京,6134514254,瓦窑居士
7122056433877353255,方鸿渐校友。名字应该起的洋气一点就更好了。叫陈晓芙咋样呢？,1,10,1,2022-07-19 20:17:51,来自浙江,94346931958,大猫鲍勃
7122822268023046946,民国时期的大学教授校长才是真正的为人师表，学术大家！,0,14,0,2022-07-21 21:48:57,来自浙江,1416617950719256,博学蛋糕Z4五月的风
7122992979966591744,这是两个问题，不要混为一谈，瞎带方向！越是有能力的人诚信出了问题，对社会的为害牲越大！真不知道她每天在讲台上如何面对下面的学生！怪不得社会上传说北大净培养精致的利已主义者！,0,2,0,2022-07-22 08:51:33,来自湖北,201910305428900,乐观的宋明光
7122237671296549669,水博。目前中国高校面临的讽刺性最大的问题。不要水博吧，申请相关资格不够，要了吧水博的确太丢人。无语,1,1,0,2022-07-20 08:01:22,来自北京,70721906429,寸金难进223121658
7122476640781206279,[抠鼻]为何学校死不悔改！,1,21,0,2022-07-20 23:29:09,来自广东,9115816422,9115816422
7120769817967706921,即使花教授能力出众，深受欢迎，也绝不能以此借口掩盖其学历的真伪，这是做人的诚信和操守问题。,2,31,3,2022-07-16 09:04:49,来自陕西,96851608671,xie1973
7122702062999798566,这个要不要高校大清查啊,0,1,0,2022-07-21 14:03:54,来自山东,110076923523,微一微笑一笑
7122630281915761422,确实，梁簌冥也只有初中文凭，一样成为大师！,0,4,0,2022-07-21 09:24:42,来自湖北,7405769242,一切都为
7121998004139639592,林建华，不是林建发,1,7,0,2022-07-19 16:30:48,来自河北,62767252600,顺其自然1810081
7122237837017219847,搞了半天，原来是方鸿渐的师妹，方毕业于克莱登大学，陈毕业于爱尔兰欧洲大学。而且回国都混到大学教授的荣誉。,0,2,0,2022-07-20 08:01:43,来自湖北,100858487792,慕唐诗人
7122437435996717855,第一次听名称“爱尔兰欧洲大学”就存疑。“欧洲大学”，就像环球大学，世界大学，凭直觉，名称越是唬人，越是值得警惕。这是野鸡大学的一般特征。若是“欧洲爱尔兰大学”，倒觉正常。,0,9,1,2022-07-20 20:56:08,来自四川,96887965638,竹林闲人778
7122613515265245988,你说春花没有真文凭却比有文凭的厉害，＂因为此前从未见到过学历像24K金一样高纯度的同行从学术能力上质疑过她＂所有的正常博士教授都不如她，不就是当代陈寅恪么？,0,1,1,2022-07-21 08:19:51,来自湖南,4420488169534456,天天天蓝3134
7122652575794627358,又一个“方鸿渐”,0,0,0,2022-07-21 10:51:12,来自河南,602187258141885,八百里伏牛我的家
7122994454524478239,北大打脸自已。人际大于学术。,0,7,0,2022-07-22 08:57:43,来自河南,59276342118,热情的剑兰
7122822638004765471,商学院套路深。出钱的套北大。陈美女套住了出钱的。[鼓掌][鼓掌][鼓掌],0,29,1,2022-07-21 21:51:01,来自广东,106470613840,laker
7122291349335999236,围城作者钱钟书是根据真实现象写的书，应该知道一些事情。,0,2,1,2022-07-20 11:29:37,来自湖南,3267506880,秋水盈盈10086054
7122494669204357925,假作真时真亦假，真真假假陈春花，授业解惑在北大，博士学位能有假？,0,8,0,2022-07-21 00:41:16,来自广东,110683885469,巡天遥看星如灯
7122311010568061734,陈春花假博士文化为何能入职北大？是关系？是金钱？还是北大入职学历把关视如儿戏？,0,30,0,2022-07-20 12:44:48,来自安徽,79925545984,曲阳空竹
7121886460148187919,严查，这几年北大连连出事，这林建华脱不了干系吧！,0,92,1,2022-07-19 09:18:03,来自重庆,98166017738,多才多艺高山fv
7122073839223358249,今年怪事真多，北大又网红了。,0,14,0,2022-07-19 21:24:40,来自四川,77697522788,德才兼备山雀Lt
7122086500477092649,前些年都有人请枪手写的论文，评为了工程院院士,0,9,0,2022-07-19 22:14:02,来自甘肃,56357986928,璀璨风光666
7122837998118601513,各行各业都在搞创收，可能她能力超群，能为北大带来可观的收入,0,9,0,2022-07-21 22:50:14,来自广东,712899758922830,灯火通明138
7122988248766415620,今年北大招生还这么火爆，难为招生老师了。,0,3,0,2022-07-22 08:34:02,来自河南,97160820445,田瓜哥哥
7122458687352390412,在高校，反社会公知、假博士学位，多可怕啊！,0,8,0,2022-07-20 22:18:57,来自湖南,104525498873,肖家河的第三条岸
7122711506353341225,陈春花还是有真才实学的，学历有哪么重要吗？,16,18,18,2022-07-21 14:39:32,来自新疆,51223630943,一心一意麻酱f
7122464782271529741,北大的教授，不知道怎么说了,0,9,0,2022-07-20 22:42:35,来自安徽,54446925577,欧阳兵8
7122785086533567262,首先，凡事都有标准，突破标准必须具有响当当的成绩，否则如何服众。这是业务水平问题。其次，文凭造假，这是品德问题。有业务能力而品德低下被辞退的人不乏先例，何况业务、品德皆有欠缺的人。,0,1,0,2022-07-21 19:25:19,来自浙江,3544471920193395,活泼风铃D1
7121909187294429956,陈春花教授还是有几把刷子，没有和理论和实际，也不可能做到北大的教授和院长吧,0,1,0,2022-07-19 10:46:50,来自湖南,101472168609,航瑜论道
7122638287894020864,陈春花在文凭上作假应该批评，但是她是少有的学术能力强而且实战能力也很强的教授。,0,0,0,2022-07-21 09:54:46,来自四川,786885526437725,一心一意圆月Eg
7122246988590318339,国内高校 科研 体制内的假博士 水博士可是一大把一大把的。。。。,0,2,0,2022-07-20 08:37:45,来自江西,109066436851,Gxx小迷弟
7122459794942067488,学历和能力不能划等号，那么陈教授为什么还要造个假学历？,0,32,1,2022-07-20 22:23:06,来自江苏,3157399596697533,病树前头万木春啊
7122204256492995363,以前有段时间，文凭热的时候，什么在职研究生学历、博士学历等等，文凭都是糊弄来的，无真才实学！,0,7,1,2022-07-20 05:52:18,来自山东,71752366566,天朗风畅
7122971572549337863,是不是说明了，北大的一些教授就这个水平，唉，比较我的文凭也是真真实实花了几年时间啊，我情何以堪呀,0,0,0,2022-07-22 07:29:18,来自广东,92702809752,罗益林优秀培训师
7122272717458047776,对高校教授的文凭来一次彻查整理,0,4,0,2022-07-20 10:17:36,来自浙江,12096541561,大海灯塔2
7122057733541135108,我也去搞个太空大学学历，跑到哈佛，耶鲁去揽个教授来当[捂脸],0,9,0,2022-07-19 20:23:03,来自四川,110325069813,Jackey9648
7120764402155914019,那年代本科华工电子已经没什么好质疑了,1,4,4,2022-07-16 08:43:33,来自广东,4287723598523675,H工业连接器
7122617997306544932,陈春花尚可理解，北大居然是北京大学真的不可理解。,0,3,0,2022-07-21 08:37:14,来自河南,465789472219223,高级山丘N7
7122308391246447401,工商管理专业可以休矣，读了和没读完全没有区别，管理是一门实践课程，没必要设什么狗屁博士学位,0,2,0,2022-07-20 12:34:31,来自湖南,50857256831,阿土仔6
7122047066607731464,看来是一个假博士。,0,16,0,2022-07-19 19:41:11,来自四川,101684482640,知情达理鲸鱼JI
7122299250377261859,客观讲陈春花的水平可以的，即使没有学历，实力到了,0,2,0,2022-07-20 11:59:34,来自江苏,75605137174,足智多谋松鼠ux
7122320436230685474,如果自己都学历造假，那怎么开帮助企业？,0,1,0,2022-07-20 13:21:55,来自江苏,2585680531968862,晓理
7122478189691601695,按照作者的逻辑陈教授所任教的北大.华南理工大学也在造假了？所带出来的博士生文凭国家也不会认可了？,0,0,0,2022-07-20 23:35:19,来自河北,111223594532,热情明月YX
7121909606657426208,总而言之，陈春花不是什么有真才实学之人,0,4,0,2022-07-19 10:48:13,来自北京,4015069414041757,sooooo
7122062718378558223,她是怎么被北大聘用的？,0,15,0,2022-07-19 20:41:25,来自内蒙古,62609932266,天际线杭盖
7122069110590178082,估计都是文科，容易出水博士。,0,8,0,2022-07-19 21:06:13,来自广东,5578532592,大漠孤烟60730409
7122232602454688551,陈教授的书，我读过几本，初时觉得妙不可言，后来才发现原来是人家彼得德鲁克的观点。,0,2,0,2022-07-20 07:41:53,来自安徽,105093845421,李明375
7120656948777059112,支持你jim博士，陈春花一眼就看穿，是假的。他们一般认知，分析，判断力不行。,0,34,0,2022-07-16 01:51:10,来自四川,53235291471,45法正云起南
7122067807050842895,北大也有方鸿渐[捂脸],0,13,0,2022-07-19 21:01:11,来自北京,106724725142,freerain1
7122053984617562911,还有呢所有资料都显示是广东湛江人，其实是地道黑龙江齐齐哈尔昂昂溪出生长大的[捂脸],4,13,2,2022-07-19 20:08:12,来自北京,3694052143,卸下你的防备
7122339762723848973,这女人是克莱登大学的博士，方鸿渐的校友啊[呲牙],0,2,0,2022-07-20 14:37:13,来自河北,52251959257,凭海临风WDKp
7121851000851464996,一个学历教育的“皮包公司”发的“真文凭”，让那些坚难考上而且至少用3年甚至5、6年含辛茹苦的“真博士”们情何以堪。,0,6,0,2022-07-19 07:01:05,来自浙江,1706905600264891,易巴巴
7122659037992616734,自己运营自媒体炒作炒过头了；我也觉得学历不等同于学术上造诣，但是试问这位教授有没有如文中提到的几位先生般的学术成就；,0,3,0,2022-07-21 11:16:11,来自山东,54420822753,骆驼147340296
7122245841758995214,国内最顶级的大学，教授都可以这样干，可想而知,0,2,0,2022-07-20 08:33:09,来自江苏,50870426212,WP200858
7122969533706715944,原来陈春花教授和克莱登大学的优秀毕业生方鸿渐是一个水平啊。可是，北大和三闾大学毕竟还是不一样的。,0,0,0,2022-07-22 07:20:45,来自山东,62505478789,观澜说史
7122069335342351138,学历文凭市场化。,0,12,0,2022-07-19 21:07:16,来自吉林,19066686371,跳动产生级速
7122011004544041766,陈春花的所谓高学历？关注了。,0,95,1,2022-07-19 17:21:34,来自广东,2035902785267051,麦麦1978
7122378579484345092,国外的学历，经历，好尴尬！很多用人单位还就看好这一点！悲哀！,0,10,0,2022-07-20 17:08:13,来自山东,3782782734,博观星海
7122411174008144674,林建华出来走两步。,0,29,0,2022-07-20 19:13:55,来自山东,59121259515,大光明505
7122982438792053517,她的成功，只会让那些真才实学的人黯然失色。北大得到那一抹闪耀的光辉加持，注定成为披在身上的嘲笑光环。严谨治学的理念，原来不过如此，配得上北京大学之名。,0,0,0,2022-07-22 08:11:39,来自黑龙江,8091908219,是回忆让我忘不掉
7122623391022695182,好好查查这个林校长，一定有大收货,0,26,0,2022-07-21 08:57:56,来自黑龙江,553792740799224,匮乏人生
7122764667118191394,公主，还是那家少奶奶？或许是另有隐情。还是她为国为北大做出很重大的贡献，所以学校重情重义公职报恩。,0,2,0,2022-07-21 18:05:48,来自云南,22806441942,q q
7122854594610447112,投机取巧得到文凭的事例，早已见怪不怪了。但大学教授的学历，必须经得起推敲。,0,8,0,2022-07-21 23:56:13,来自浙江,2660449799906932,风雪星尘
7122281026566587151,在文凭工厂搞一个文凭，竟能在最顶尖大学担任院长，如果此事当真，问题严重吗？,0,2,0,2022-07-20 10:48:49,来自广东,179953190579420,上进荷叶d7
7122672191418385190,如果博士学位不真实，那通过博士学位后又做的博士后，这个博士后是真的吗？,0,0,0,2022-07-21 12:07:47,来自河北,93421972772,流坪
7122837480449770281,陈春花博士现在的心情会是这样？出来和全网聊聊你当院长的贡献呗。,0,15,0,2022-07-21 22:48:25,来自江苏,2946314977416776,优美海风FX
7122061830478299938,北大是一所神奇的大学,0,13,0,2022-07-19 20:38:06,来自陕西,93100648065,城门与城河
7123015931265434407,想知道北大是怎么回应的？,0,0,0,2022-07-22 10:20:15,来自广东,3893380405,wujingzhilin
7123008117658960677,不管怎样，陈春花骗得成功。虽然北大之类国内学校学术机构甚至公司也有过，但是她已经混得风生水起了，这辈子也不差钱了,0,0,0,2022-07-22 09:49:59,来自广东,3169556603,我是我的神7781854
7122626381305611038,论文是淘汰水货的试金石，国际顶级刊物论文，不交版面费也不是买枪手写的,0,1,0,2022-07-21 09:09:54,来自四川,102307122294,Liliyang538
7122783059065291555,这所大学明明是名校，校址在英属维尔京群岛。近代著名学者方鸿渐先生就曾就读过这所大学,0,2,0,2022-07-21 19:16:58,来自山东,6989151196,爱豆宝
7122310913297892109,英国一年硕士虽然水得很，但人家是正规的。博士也玩一年的，胆子确实够大,0,19,0,2022-07-20 12:44:24,来自上海,5567238166,笑对人生乘风破浪
7122810918727566110,闹剧不是笑话！,0,22,0,2022-07-21 21:05:10,来自广东,756942243905165,一蚁姓孙民
7122463652359766798,佩服浙大的学子！,0,26,0,2022-07-20 22:38:18,来自北京,3219811090304328,腊月j
7122795642346357541,学历造假的事情漫山遍野。,1,31,3,2022-07-21 20:06:07,来自陕西,1248636518285102,熊猫与竹子XXk
7122439963387921187,陈春花只是北大持有假大空学历的冰山一角,0,11,1,2022-07-20 21:05:30,来自河北,82976154795,深水静流194
7122255475080921888,顶尖大学的顶尖学者文凭竞是假的，真的是打脸,0,2,0,2022-07-20 09:10:41,来自湖南,59556649245,随意204047694
7122232142243169059,应该对博士生硕士生的学历重新做官方认证。后纳入信息管理系统。,0,3,0,2022-07-20 07:39:19,来自广东,3870761561898768,探索地球w
7122039729113236231,我国对于职称评审和晋升机制务必革除唯洋文品和外国刊物发表论文的篇数定论，才能抑制这种假文凭的泛滥，让有真才实学的人得到重用。,0,31,1,2022-07-19 19:12:59,来自湖南,55003904057,热情的金桔Jn
7122018202011370280,哈哈哈，围城里的梅教授,1,43,1,2022-07-19 17:48:57,来自安徽,2475705460342436,繁星驕陽
7122039598846870312,年限不是问题，把学位论文整出来看看。符不符合当时的学位要求。,0,8,0,2022-07-19 19:12:03,来自北京,3262242800,淡忘一切6619
7122992907468178215,有没有文凭是学术问题，造假文凭是道德问题，不是一回事。,0,0,0,2022-07-22 08:52:24,来自安徽,50020940472,兰亭琴韵1
7122792592206742287,这个评价中肯，陈春花教授学术能力还是很好的，最起码比一般博导教授强很多。,0,0,0,2022-07-21 19:54:03,来自安徽,5966599696,武永慎成WuYongcheng
7122045587763626793,估计那些顶级院校也不乏这种文凭,0,11,0,2022-07-19 19:35:15,来自广西,25318722836,真诚小羊Jz
7122457739061936927,作假和没有学历学位，是完全不同的两回事,0,95,1,2022-07-20 22:15:04,来自山东,6621090596,D2D3D
7122232482619704104,文凭和实际能力哪个更重要？,1,1,0,2022-07-20 07:40:49,来自北京,51527458582,沧海山涛
7122803476119716616,如果她的学历有问题，那么现在的在职研究生学历有一半以上都是有问题的。,1,9,2,2022-07-21 20:36:30,来自江苏,2774762973568179,用户悦力
7121829973828354851,都是生意，本来就是注册的爱尔兰欧洲大学有限公司[呲牙][捂脸],0,8,0,2022-07-19 05:39:48,来自加拿大,641738829732782,闲居多伦多
7120790574806500131,陈春花在“得到”是金牌高手……怎么听了几篇文章感觉江湖味很浓。,0,13,0,2022-07-16 10:25:17,来自安徽,80775943213,心平行直39166
7122372314813317888,严查学历造假，尤其是在高校，这涉及人的诚信问题！,0,1,0,2022-07-20 16:43:17,来自湖北,3063208398,朱剑明
7122978709421753129,说明教授，院长这些人对社会的贡献为零[捂脸],0,6,0,2022-07-22 07:56:20,来自江苏,103932960911,请你丫文明点
7122380746597221132,为什么现在许多人纷纷都到国外拿硕士，博士，博士后文凭。为什么？？？？？,0,0,0,2022-07-20 17:16:24,来自四川,87189468700,率真画板Ym
