7123177731692495651,俄罗斯🇷🇺原地不动等着乌克兰反攻？,4,33,2,2022-07-22 20:48:21,来自陕西,101410758920,聪明的溪水XUl
7123172860213986082,俄毛子暂停但乌克兰不停,2,185,10,2022-07-22 20:29:29,来自吉林,3377293963573856,用户大刀把
7123190579676234507,俄罗斯进入乌克兰最怕的是什么？全民皆兵，所以，得民心者得天下，只要民心所向，俄罗斯就会拥有土地和财富，就不怕战争长期化，这跟当年侵入阿富汗不一样。,2,4,1,2022-07-22 21:38:41,来自广东,1578547538837255,影视精华聚焦
7123180916259701504,英国媒体的报道几乎都是假消息！太不合情合理了！,0,31,2,2022-07-22 21:00:36,来自陕西,83212726451068,乐天派生活家dp
7123173689956483880,司机这几天好像不说反攻了[捂脸],1,32,2,2022-07-22 20:32:35,来自海南,51030908137,阿轩推拿
7123190051831481129,"乌克兰不论失败到什么程度，因为美英法德意波的拱火，源源不断向乌克兰输送大规模杀伤性远程武器，战争都不会停下来。
 西方武器只要进乌克兰，俄罗斯就要及时掌握信息，立即完全炸毁，才能胜利。",0,3,0,2022-07-22 21:36:07,来自山东,85317693491,Yifanfengshuun3658
7123191077418582797,这场行动俄罗斯高估了自己，低估了乌克兰。俄罗斯装备的都是苏联老式的装备几乎没有更新换代。很多战机只在原来的基础上进行了升级。目前俄军最有优势的是伊斯坦德尔。和口径巡航导弹。只有这个东西了，其他拿不出手。,0,0,1,2022-07-22 21:40:26,,167599557846189,聪明的111222333
7123180414700684073,英国人给乌克兰打气，让乌克兰战至最后一人。,1,29,1,2022-07-22 20:58:42,来自辽宁,6679053430,海之萤
7123177669533336360,军情六处的情报是越来越不准了,2,28,1,2022-07-22 20:48:06,来自内蒙古,63616455524,年少轻狂8866
7123180364876858146,这是三十六计中的欲擒故纵之计[机智][机智][机智],0,14,1,2022-07-22 20:58:33,来自河北,51227110528,手机用户满堂红
7123190255662482207,凛冬将至这个词用得恰如其分,0,2,0,2022-07-22 21:37:27,来自重庆,111400015290,乐天派老谢
7123182167840523040,这是要乌克兰战斗到最后一人的节奏？,0,17,1,2022-07-22 21:06:00,来自广西,7782733890,小头爸爸123
7123173220543021859,怎么老觉得俄罗斯要投降的样子？[呲牙][呲牙],3,58,4,2022-07-22 20:30:55,来自广东,522995863126110,绎璋
7123169964999721739,米国要求：战斗到最后一个乌克兰人,6,47,5,2022-07-22 20:18:53,来自海南,180742987460324,杰程充换电汽车超市
7123188202303341325,泽连斯基的剧本有续集了吗？,0,5,1,2022-07-22 21:29:22,来自四川,3025457560683159,开心的风姿卓越水滴If
7123179137640219431,典型的把乌克兰忽悠到最后一个人。,0,8,0,2022-07-22 20:54:19,来自江西,4416073021264846,岭霞万象
7123163799397499660,主动归零核武以及所有进攻性武器，渴望和平发展的人民一定能取得最后胜利,5,97,7,2022-07-22 19:54:40,来自山东,77852275016,千年只拜王阳明
7123163399684490022,俄罗斯外长拉夫罗夫20日说，由于西方国家向乌克兰输送越来越多远程武器，俄军在乌克兰的特别军事行动范围将进一步扩展。,1,23,7,2022-07-22 19:53:07,来自天津,21288854385,大坂砖
7123179436304483087,这是环环的报道吗，我还以为看错了。话风要转的节奏,0,13,0,2022-07-22 20:55:04,来自北京,3864351162,发呆的老李
7123171840310248229,希望俄罗斯不会受到太大的压力而走极端,3,19,5,2022-07-22 20:25:18,来自黑龙江,2792376408486135,我们这里还有鱼塘
7123172351977603875,美英国家这是烘火啊！,2,30,5,2022-07-22 20:27:25,来自河北,3105454395755997,高冷荷叶8B
7123153363072107305,英国又在忽悠司机[捂脸],3,144,16,2022-07-22 19:14:02,来自内蒙古,3807135752,骄阳27674905
7123160315126694690,俄罗斯是强大的，一定会战胜西方！,2,24,9,2022-07-22 19:40:54,来自四川,16484276962,足智多谋麻酱Xw
7123163649941832480,看来，有人（第三者）担心俄乌冲突停歇下来。反过来看，如果俄罗斯在乌东能巩固既有阵线，逐步恢复控制区域日常生活，就已经是赢家。,0,19,2,2022-07-22 19:54:13,来自四川,98504773508,一丝不苟光束nt
7123174032249488162,无需反击，俄罗斯兵合同到期，都不愿意续签，战争结束了。,0,52,4,2022-07-22 20:33:56,来自广东,70569395796,莫氏塑胶
7123168088031953678,英国人又给司机送来新剧本，大概不久乌克兰又要给世界上演一场新的闹剧。,3,57,13,2022-07-22 20:11:22,来自广西,39209328193374,清雅人2
7123171204328030987,英国和美国还有波兰那几个最怕乌克兰输了，不仅白忙了，钱也没出要了[呲牙],4,29,8,2022-07-22 20:23:31,来自辽宁,110700890866,风中禅
7123190120748401447,"理想很丰满，现实很骨感。
关键是俄罗斯掐断石油天然气，不只是欧盟要想办法熬过冬天，乌克兰也有冬天啊！难道乌克兰自带小太阳吗？",0,3,1,2022-07-22 21:37:02,来自陕西,54960675543,老杨 Liven
7123190731225023272,英国这个冬天怕是有点难熬啊！,0,0,0,2022-07-22 21:38:43,来自广东,2648054409202717,村间田野
7123177553405723429,还给乌克兰下套呢。,0,9,0,2022-07-22 20:47:59,来自辽宁,55056236215,紫龙有度
7123186196070990596,太坏！乌军目前很多阵地都是经营了很多年的国防工事，一旦转入进攻，就要离开工事，面对俄军防守火力，等于送死。,0,1,0,2022-07-22 21:21:42,来自北京,1257470887731815,老纪有点傻
7123188521619424000,有点意思！果真如此的话，有好戏看了[呲牙],0,0,0,2022-07-22 21:30:12,来自河北,5877058465,一见如故宇
7123171910686458658,这是给马前卒鼓气，怕它瘪了。,0,51,4,2022-07-22 20:25:40,来自上海,5993003961,冰雪路人
7123168746704749352,英国人又在煽风点火！,0,15,1,2022-07-22 20:13:21,来自四川,3179387860815636,自然的河流
7123178668205392654,007是军情五局 六局不行,0,4,0,2022-07-22 20:52:13,来自天津,108128693347,丹青乐事
7123184593817535271,英国的情报一点都不准确，反击机会并没有成熟，天然气高度依赖于俄罗斯的欧洲国家（如德国）必须做好过冬的准备，俄乌战争是一场旷日持久之战。,0,2,1,2022-07-22 21:15:28,来自广西,4212955033383662,神秘星星kqu
7123177178963542799,不希望俄军战败！但是面对西方的先进武器我也束手无策！,0,6,0,2022-07-22 20:46:09,来自四川,107777796864,雪绒花awoU
7123175749292540687,"呵呵，一只蚊子对大熊……就算你赢了，又能怎样？
更何况，你压根赢不了啊[作揖]",0,9,2,2022-07-22 20:40:35,来自宁夏,88692898166,白杨9Y7y
7123191290900251422,还没到最后一个乌克兰人，盎格鲁撒克逊人还在拱火[发怒],0,0,0,2022-07-22 21:41:21,来自广东,3274392524,流氓的美国虚伪的德国
7123186100465926920,英国情报机关的预测有点可笑。只要北约军队不直接参战，乌克兰的反攻要想短期改变战场态势难。大人打小孩要等成长了才有底气。,0,1,0,2022-07-22 21:21:08,来自贵州,94455367649,蓝天天马
7123129470738907935,摩尔乌克兰咋失去这么多土地，拱火也太心急了,0,1,0,2022-07-22 17:41:35,来自江苏,2781272503,流星雨
7123183565135086371,诱敌出动围而聚歼，佯装显弱出手反掌。兵不厌诈，水无常势，俄军阵法，乌头必杀，北约投入，竹监打水！,0,1,0,2022-07-22 21:10:56,来自贵州,86161982073,水曲柳888
7123190291364217604,俄军现在最好的行动就是马上回到自己领土上防御。,0,0,0,2022-07-22 21:37:44,来自浙江,12519045786,达摩三剑
7123190404899816231,盎格鲁萨克逊要把乌克兰坑惨 。可惜乌克兰人民不觉醒。,0,0,0,2022-07-22 21:38:14,来自河南,71351952154,P秋风起云飞扬
7123174278090736392,嗯 ，这个值得相信 。。,0,13,3,2022-07-22 20:35:05,来自河南,60040427482,空中的小飞
7123192149889286948,环球网媒体要转正了吗？[赞][祈祷],0,0,0,2022-07-22 21:44:32,来自河北,2903131611210772,听实讲义
7123182658366030599,英的情报是从2022版电影007得来的，他们与司机合拍的，司机主演…[大笑][大笑],0,1,0,2022-07-22 21:07:50,来自四川,102859641921,忠2112023865665
7123191914945381161,百万反攻大军在哪里？,0,0,0,2022-07-22 21:43:13,来自山西,77255620132,如沙数
7123179891914310436,英国在拱火,0,1,0,2022-07-22 20:56:53,来自辽宁,21287742989,缤纷松鼠mL
7123184892796109572,只怕乌克兰又要胜利大撤退了。,0,0,0,2022-07-22 21:16:48,来自广西,88293097617,孺子牛中国风原声音乐
7123192438868787980,情报可靠吗？如果真的，那就可惜了。,0,0,0,2022-07-22 21:46:07,来自广西,59859879630,博学的圆月Ym
7123177590890152739,基辅不保了,0,1,0,2022-07-22 20:47:50,来自湖南,25688908489,谭俊27
7123190955582259980,这个该有，这个真没有。[捂脸][捂脸][捂脸][捂脸],0,0,0,2022-07-22 21:40:10,来自山西,3966656625252904,分秒必争溪水nQ
7123190988059247395,通过这次战争看出来俄罗斯的实力也就如此,0,0,0,2022-07-22 21:39:53,来自河北,342649737850207,善恶天地知
7123187428407608068,乌克兰高层看到次新闻绝对比打鸡血还兴奋🥰,0,0,0,2022-07-22 21:26:33,来自河南,2137074406530893,金生水起12369
7123187114958947085,还点火扇风呢,0,1,0,2022-07-22 21:25:03,来自河北,8399558030157,可靠金桔RW
7123170328800445215,西方不希望冲突停下来！用心险恶,0,2,0,2022-07-22 20:19:42,来自四川,53159521518,天国劝慰师
7123184171451237157,我得到的情报是未来几周俄罗斯不会停手[呲牙],0,1,0,2022-07-22 21:13:48,来自山西,25554960332,2555496
7123184698821509892,战至最后一个乌克兰人。上帝是这么要求的。,0,0,0,2022-07-22 21:15:45,来自江苏,4551089476,智者圆月3r
7123114975761203979,他只听司机的会报！,0,6,1,2022-07-22 16:45:37,来自广东,259090928107899,成熟晚风m7
7123191633755472674,苏梅怎么被围了呢？,0,0,0,2022-07-22 21:42:18,来自广东,50311390047,聪颖凯风徐来
7123165313243529999,俄乌冲突几个月，只听乌鸡反攻，没見战情通报？只見反方向冲锋逃跑！,0,7,3,2022-07-22 20:00:07,来自重庆,70852279673,猪猪NKR
7123184470730998562,战斗到最后一个人难道不应该吗？,0,0,0,2022-07-22 21:14:24,来自河南,1780829006082356,清爽暖阳ZM
7123158148478747432,十几天前，不是百万军队要大反攻吗？,0,21,4,2022-07-22 19:32:22,来自北京,3298174691184840,非凡豆浆j
7123165543091651342,不知道，乌克兰组织的百万大军在哪里,0,9,3,2022-07-22 20:01:29,来自河南,91609628881,正义凛然扑克sl
7123180298124362528,螺狮把战争当游戏吗！,0,0,0,2022-07-22 20:58:41,来自重庆,5496142965,己所不欲勿施人
7123182365601743647,口头晦气而已。西方在乌克兰与俄掰手腕将输得精光。,0,0,0,2022-07-22 21:06:36,来自北京,2088661115208995,一普通消费者
7123166608419472131,乌克兰还没被忽悠缺[捂脸][捂脸]腿、少脚。,0,0,0,2022-07-22 20:05:42,来自广西,52576720238,乡下游人
7123153349586993934,英国自己都要分解了,0,40,14,2022-07-22 19:14:10,,59823378245,拼搏2022
7123187188007437056,即使你反攻赢了，那么重建要好多钱,0,0,0,2022-07-22 21:25:08,来自重庆,92909616958,远见卓识葡萄L
7123178440185955103,大俄必胜！！！,0,2,0,2022-07-22 20:51:14,来自四川,3962257646819116,用户袁龙
7123189120650232617,乌克兰因为实在找不到一百个叫伊万的人，所以百万大反攻不提了！,0,0,0,2022-07-22 21:32:37,来自北京,6514380169,吾乃巫儿
7123182733886931716,俄乌冲突几个月，只听乌鸡反攻，没見战情通报？只見反方向冲锋逃跑！,0,0,0,2022-07-22 21:08:16,来自河北,59135468060,217155575
7123182814614291235,英美的情报机关都这样说了，将信将疑了。看来俄要放手一搏了。,0,0,0,2022-07-22 21:07:54,来自广东,2255847458871559,大海与礁石123
7123160090894467840,乌克兰防长早十天前说组建百万大军，后又改口说英语不好说错了，没说这样的话,0,10,4,2022-07-22 19:39:52,来自湖南,55113491661,海阔天空1516131
7123170468227695394,能相信英郭人吗？,0,1,0,2022-07-22 20:20:06,来自河南,5771453647,清新艺术家iG
7123171233214563087,好像乌有很多人一样的,0,9,1,2022-07-22 20:23:09,来自江苏,1253089532195771,福毛V飘飘
7123173383604896542,相信你有这个实力。,0,3,0,2022-07-22 20:31:41,来自重庆,96837022635,重庆余哥二手车销售有限公司
7123146673227973417,不可不信不可全信,0,2,0,2022-07-22 18:47:51,来自广东,2255847458871559,大海与礁石123
7123135940197335847,我想告诉你英国，我们还真没把你们当回事。,0,0,0,2022-07-22 18:07:05,来自河北,107660100993,3一行白鹭9
7123158991442281223,那来的消息，怎么不说俄军撤军了呢！,0,20,8,2022-07-22 19:36:25,来自新疆,4455667913726029,思秦ca7O
7123152945369137953,盎格鲁撒克逊喊俄罗斯不行了已经喊了几个月。,0,23,8,2022-07-22 19:12:53,来自河南,3003519768208695,o夸父o
7123177992679260967,乌军很好补充吗？能运到前线也不容易吧？,0,0,0,2022-07-22 20:49:52,来自重庆,6676314145,梦幻溪流G
7123177084532654860,这个好像是激将法。,0,0,0,2022-07-22 20:46:19,来自山西,95940152691,莽夫老m
7123185196857737991,欲将剩勇追穷寇，不可沽名学霸王。,0,0,0,2022-07-22 21:17:41,来自山东,1550832010,闲云野鹤23754147
7123177082150716199,环球时报新媒体比1450卓卓有余,0,0,0,2022-07-22 20:46:33,,64012824955,微笑微风Vg
7123159887081095943,最后一个乌克兰人该上场了！,0,3,2,2022-07-22 19:39:39,,105445391735,客笑勤城
7123172955928429319,俄罗斯3比1在等比赛的哨声，到了冬天继续。,0,2,1,2022-07-22 20:29:51,来自甘肃,6878675391,坦荡的湖泊K
7123170975847465741,占了一大块地,0,1,0,2022-07-22 20:22:19,来自浙江,86424966126,清新辰星ET
7123183069536289577,我坚信！英国人是负责任的绅士！,0,0,0,2022-07-22 21:09:03,来自江苏,15172919675,说真话做真人88
7123186096888595204,肯定会发生的！我是一个乐观主义者,0,0,1,2022-07-22 21:21:37,来自辽宁,4292914303207020,浩渺001
7123170497336689446,乌克兰还想反败为胜，有可能吗？,0,0,1,2022-07-22 20:21:00,来自河北,4905254573,常青树48854517
7123156626244780839,乌克兰又要死伤精英！乌克兰不进功那来的机会被消灭！,0,8,5,2022-07-22 19:27:16,来自山东,3799502678405863,否好酸
7123175741235692320,英国还在哄泽连斯基这个小孩,0,1,1,2022-07-22 20:41:07,来自浙江,50463994952,向海蓝天1212ximi
7123169954434286347,双方都在打心理战,0,2,1,2022-07-22 20:18:53,来自陕西,4951792931,一个人也要呐喊
7123167349221720836,赫尔松为什么还不发起总攻？,0,1,0,2022-07-22 20:08:33,来自广东,75672922818,零光片羽潮
7123162643011044099,美国现在都顾不住自己了。,0,2,2,2022-07-22 19:50:15,来自河南,55773489427,岁月绵长5D
7123154991846212363,英真聪明什么都知道，均势是目的,0,9,3,2022-07-22 19:20:51,来自新疆,67960349490,夏日会来
7123174818031076111,英国那个首相在干啥？,0,0,1,2022-07-22 20:36:55,来自湖北,106412737484,罗露2111
7123175168008799017,又在挑事。,0,0,1,2022-07-22 20:38:33,来自福建,2040291680064152,直爽漂流瓶M
7123158245933662976,大国要有大国的定力!,0,1,2,2022-07-22 19:32:53,来自山东,99219393014,元气山丘2022
7123156797539910400,战斗到最后一个乌克兰人？,0,7,6,2022-07-22 19:27:13,来自湖北,2823172312805245,俺最傻
7123174717649601295,这几句话逻辑在哪里？,0,0,1,2022-07-22 20:36:42,来自江苏,100093800101,春风吹满怀
7123161179782202125,俄罗斯坚持住。,0,2,5,2022-07-22 19:44:30,来自河南,3518087104037111,缘是前世的结
7123189431179215630,喜剧演员发明出“胜利的撤离”一词。乌军要是反击了，又会发明出什么新词？,0,0,0,2022-07-22 21:33:59,来自黑龙江,52261923910,后来会来
7123160094254809863,所以你都说出来了 俄军会遵命行事是吧？,0,1,4,2022-07-22 19:40:40,来自广东,50764700110,散心天行
7123162157722354447,切中要害,0,14,1,2022-07-22 19:48:06,来自山东,57896290020,天外来仙321
7123162586602144551,天真想象,0,4,0,2022-07-22 19:50:16,来自北京,53222846592,斌141904519
7123176835324003087,谣言[ok],0,1,0,2022-07-22 20:44:51,来自四川,55068937868,逍遥150435231
7123180062370841378,笑死了,0,1,0,2022-07-22 20:57:14,来自河北,98085357028,朔方没有雪
7123174645150352168,加油！,0,0,0,2022-07-22 20:36:17,来自浙江,3126636118554855,chemhehe
7123178744214815503,加油💪💪,0,1,0,2022-07-22 20:52:23,来自江苏,79775600456,清风98153
7123180918856663820,拱火,0,0,0,2022-07-22 21:01:15,来自山西,1714878641606110,一心一意铅笔Af
7123172603526677251,司机,0,0,1,2022-07-22 20:28:47,来自四川,79749159109,王峰
7123188582588252962,这个局长在造谣。,0,1,0,2022-07-22 21:30:28,来自青海,105721521022,水云笔
7123168595437470472,如果乌胜，冬季一定降价供气。如果乌军败，欧州将是个寒冬。,0,1,0,2022-07-22 20:13:08,来自河南,4215152482,13838337768
7123158131936789255,英国人真坏，又在给司机打气拱火，会害死多少无辜的乌民众。,0,0,0,2022-07-22 19:32:52,来自湖南,5771011806,唐寅64062049
7123162896313697054,不停地拱火忽悠乌克兰人为美英去卖命！,0,0,0,2022-07-22 19:51:17,来自浙江,914395870006464,人生何处是樽前
7123171971835691779,俄罗斯似乎在积累进攻条件，等待秋冬行动。,0,1,1,2022-07-22 20:26:35,来自广东,1173895176525499,有趣的荷叶vU
7123170739838714664,这些欧美评论员都是从哪来的情报和自信，俄罗斯新一轮攻击已经开始了,0,0,1,2022-07-22 20:21:17,来自河北,102933758501,四方大管家
7123172728278041347,没有一点依据.,0,1,1,2022-07-22 20:29:20,来自内蒙古,110593367126,微笑西柚U
7123189075968246563,泽连斯基末日已到，欧洲一切👎都是徒劳，过不了冬天。,0,0,0,2022-07-22 21:32:22,来自广东,435049013194776,认真的白云nj
7123162803468288804,俄罗斯一定要胜利,1,4,6,2022-07-22 19:50:50,来自河北,98258079007,用户7371163159434
7123185044055409449,这说明乌克兰越来越不给力了，援助再多武器也没用，难以根本改变战场态势，乌军不断的丢失土地，士气低落，部队整建制的投降或溃散。英国人造出这种谣言无非是想提振乌军的士气，俄军现在新的战略，下一步是扩大占领区，谁也阻挡不了，打嘴炮有何用？,0,0,0,2022-07-22 21:16:48,来自北京,4392780143,用户4392780143
7123183774993089311,英国媒体的报道几乎都是假消息！太不合情合理了！,0,0,0,2022-07-22 21:12:13,来自河南,111403816804,用户7759854963210
7123165060264117024,还在给乌克兰撑腰打气。,1,3,1,2022-07-22 19:59:40,来自北京,1789625888154435,用户7150218009188
7123191719704986375,怎么混上处长的？,0,0,0,2022-07-22 21:42:54,来自河南,53003045289,手机用户53003045289
7123164853627912991,打仗需要经济实力，就凭整个俄罗斯的GDP只相当于中国的一个省，怎么能赢？而且是一场特別军事行动。头脑发热，髙估自己的能力了。,0,10,4,2022-07-22 19:58:53,来自重庆,1314634127122635,用户2424886787029
7123138690859598622,估计最多撑二年。,0,2,0,2022-07-22 18:17:13,来自广东,105219606636,用户1008518156312
7123172985599116046,表面是俄乌交战，我猜是欧美暗中已参战，双方都明白，只是没公开而己。这仗不好打了,0,1,0,2022-07-22 20:29:59,来自山东,20755957052,手机用户20755957052
7123174771026232104,这是赤裸裸地向乌克兰拱火……,0,0,0,2022-07-22 20:36:59,来自福建,104849191651,用户3373072839237
7123177444940776204,司机每天都说梦话。,0,1,0,2022-07-22 20:47:39,来自河北,108651268238,用户6494836589977
7123188077161726732,编剧过周末了，,0,0,0,2022-07-22 21:29:09,来自河南,50022959273,手机用户50022959273
7123183938302133029,主动归零核武以及所有进攻性武器，渴望和平发展的人民一定能取得最后胜利[赞][赞][赞][赞],0,0,0,2022-07-22 21:12:43,来自上海,105674669776,用户5627805317978
7123171275362714376,自从007死了以后，英国的情报工作就出了什么问题。,0,2,1,2022-07-22 20:23:29,来自黑龙江,3786366321433080,用户481874593271
7123160055977378560,战斗到最后一个乌克兰人。,0,5,3,2022-07-22 19:39:53,来自新疆,106524980796,用户7169213822397
7123187863726048014,乌克兰的百万大军呢？,0,0,0,2022-07-22 21:27:53,来自北京,3671975361520696,用户8505150622032
7123162860557239048,又在浇油了,0,5,3,2022-07-22 19:51:04,来自四川,6501723473,手机用户6501723473
7123154283277321001,英国人给司机打气,0,9,4,2022-07-22 19:17:36,来自山东,113938015985752,用户1286636215580
7123165464842683173,胜败仍兵家常事，主要看最后结果。,0,0,0,2022-07-22 20:01:08,,100405754509,用户1886937609035
7123171271868695335,将军，他站的远喊冲牙[呲牙],0,0,1,2022-07-22 20:23:34,来自湖北,51117996229,手机用户51117996229
7123190258904744719,美英帝国主义者快不行了！,0,0,0,2022-07-22 21:37:02,来自北京,4173369094177659,用户662383393827
7123154202460996382,这不是提前失密了？[捂脸]作者是有本事人。,0,4,1,2022-07-22 19:17:40,来自陕西,3967453434747056,用户8673326818722
7123162157881721615,司机到死都不明白自己是美国的炮灰！悲哀！,0,5,6,2022-07-22 19:48:07,来自浙江,110057809642,用户8669260507532
7123184610657813263,[赞][赞][赞][赞][赞][鼓掌][鼓掌][鼓掌],0,0,0,2022-07-22 21:15:00,来自云南,109124552664,用户8144870009901
7123157067808637730,可惨的乌克兰人居然心甘情愿当西方的炮灰,1,4,8,2022-07-22 19:28:25,来自广东,51849815530,清爽星辰x
7123184998592742144,俄军这种打法不行吗？是在等北约补充好了新一批海马斯和F15、F16、A10后，在开打吗？[捂脸][捂脸][捂脸][捂脸][捂脸][捂脸][捂脸][捂脸],0,0,0,2022-07-22 21:16:28,来自四川,63063558963,南人0146
7123153013904311043,英国的情报局开始忽悠了,0,3,1,2022-07-22 19:13:07,来自北京,108393475660,关心国家大事老百姓
7123161197876249352,又在忽悠乌克兰人！,0,0,0,2022-07-22 19:44:26,来自北京,5860694789,lxl68928352
7123173218046722857,英国佬又在忽悠司机了,0,0,0,2022-07-22 20:30:40,来自四川,74964639738,清爽辰星FE
7123172487856898828,英国的军情六处臭名昭著！妖言惑众无关大局。,0,2,1,2022-07-22 20:28:42,来自江西,62306617078,求知177738023
7123163111561626405,英国军情六处又在造谣撒谎欺骗世人！,0,2,1,2022-07-22 19:52:17,来自山东,6816244743,去美元化是美国的七寸
7123164579945186079,英国好象是在忽悠三岁小孩子。,0,5,3,2022-07-22 19:57:42,来自河南,91609628881,正义凛然扑克sl
7123166839274177317,俄罗斯如果打不败乌克兰以后还有什么底气和美英对抗,0,3,1,2022-07-22 20:06:32,来自河南,50095703147,我心依旧qwe
7123162521791906572,从来没有听过英国政客说过真话，号称谎言帝国名符其实。,0,1,1,2022-07-22 19:49:54,来自山西,52032435296,智慧的老冀
7123171204793615140,忽悠乌克兰士兵送死的,0,2,2,2022-07-22 20:23:23,来自河北,111531681444,琴韵286754629
7123176793972359951,就是你英国+乌克兰二国与俄罗斯打，也打不过俄罗斯的,0,1,2,2022-07-22 20:44:49,来自浙江,10173643783,海阔天空148072852
7123179045000430371,英国，呵呵,0,0,0,2022-07-22 20:53:20,来自黑龙江,60015207066,田蒿
7123167590087721765,真是死道友不死贫道,0,1,1,2022-07-22 20:09:02,来自重庆,54287788244,有一个骂架的机会
7123180312888722216,满口慌言……,0,0,0,2022-07-22 20:58:21,来自广东,103517319337,Sqiao480
7123171191535944482,一则笑话,0,0,2,2022-07-22 20:23:03,来自广西,81257328706,用户5879482718482
7123185946492764969,来个屁，乌克兰以没有能力继续下去,0,0,0,2022-07-22 21:20:10,来自山东,50001905040,夏日清风123756094
7123156286728028964,英国人太担心乌克兰人死不完了，这些盎格鲁撒克逊人太他妈坏。,0,0,0,2022-07-22 19:25:32,来自四川,5760564376,前哨—1
7123162584118805284,英国忽悠更多乌克兰人去死。,0,0,0,2022-07-22 19:49:59,来自北京,3668409591280264,内部与外部世界之间
7123178058059973409,美英这些西方国家太歹毒了，乌克兰又丅M太蠢了,0,1,0,2022-07-22 20:50:11,来自湖北,82204626104,楚风楚韵2
7123168574620893952,这英国佬经常做梦,0,0,0,2022-07-22 20:12:40,来自江西,1495811754570807,乡绅
7123168093492626212,死的反正不是你英国人,0,0,0,2022-07-22 20:11:11,来自上海,5765887475,博学鸿词
7123170855869858575,英国人包藏祸心,0,0,0,2022-07-22 20:21:46,来自江西,56645963787,林岭
7123171703182033698,鼓励勾引乌克兰人去送死就是犯罪,0,1,1,2022-07-22 20:25:02,来自四川,3395712817579104,珙桐121564
7123175168008258345,他又忽悠乌克兰人🇺🇦做炮灰！,0,0,0,2022-07-22 20:38:25,来自广东,259090928107899,成熟晚风m7
7123189014089614087,[ok][ok][ok],0,0,0,2022-07-22 21:32:29,来自四川,70246086644,自强不息小红花n
7123186648753586975,[赞][赞][赞],0,0,0,2022-07-22 21:23:12,来自西藏,63783982719,用户1206306958834
