7125769349289427727,难道之前不互认的？,31,132,5,2022-07-29 20:25:05,来自广东,103596433638,AIIT影像记
7125796802888581920,我今天做核酸感觉太假了[捂脸]拿个棉签在舌头那里搅两下就完事了,28,55,1,2022-07-29 22:12:30,来自广东,13196778691,莞漂小健
7125769796050305825,应该全国统一成一个健康码，否则苦的是百姓,3,96,3,2022-07-29 20:27:47,来自湖南,1780860105009251,瑞丽市粤海珠宝
7125780677219943168,就算不统一，全国互认也可以啊,6,77,3,2022-07-29 21:09:11,来自山西,1219116378,humble
7125769809245700867,3年了才现在才互通,2,15,1,2022-07-29 20:28:02,来自印度尼西亚,92761268719,灰度2234
7125770646688875298,出国标了！,1,8,0,2022-07-29 20:30:18,来自北京,111122879849,直爽书签wd
7125769426247025423,[我想静静]原来以前不互认啊，,5,54,3,2022-07-29 20:25:32,来自辽宁,24644162314,CarreraGT2
7125769614784512798,不认可又不认可理由，认可也得有认可的理由。取决于检测机构什么性质。,0,34,3,2022-07-29 20:26:25,来自陕西,5463984666,爱国者5
7125769025682522912,我每天在深圳做核酸，24小时都是绿码，北京给我弹窗。。。。,3,41,4,2022-07-29 20:24:50,来自广东,53528443742,摩谷子
7125780585373156130,全国人民必须要拥护支持贯彻执行：,0,39,2,2022-07-29 21:08:58,来自安徽,1838022584970302,鴻图大展撫
7125770896559686436,很有必要，点赞支持！[赞][赞][赞],0,4,0,2022-07-29 20:31:29,来自湖北,5751365079,生态老儿
7125770481418126111,记住！核酸检测结果全国互认，再也不让人刁难了！,0,9,0,2022-07-29 20:30:00,来自江西,3170616009037691,用户拥抱梦想
7125769153696318247,“都应”不是“必须”，没有强制性，各地还会我行我素,0,20,0,2022-07-29 20:25:10,来自北京,5873545044,W先生151163141
7125769496719328040,本就应该全国认可，毕竟你是在中国领土范围内，出国了那就不一样，,0,23,0,2022-07-29 20:25:50,来自江西,3043875944936256,123朗如风
7125769438238180109,也不知道真的假的，一天一个变化,0,7,0,2022-07-29 20:25:54,来自江苏,3545266767280300,一丝不苟火车9N
7125769027645571870,北京健康宝啥时候能跟外地同步。,0,4,0,2022-07-29 20:24:24,来自北京,60052830649,Steven821220
7125789696932135687,本就应该互人！,0,10,1,2022-07-29 21:44:32,来自福建,1068325864224205,李老师看事件3923
7125772060588442398,实践出真知,0,1,1,2022-07-29 20:36:07,来自江苏,2699989381297099,营长模式
7125787583686460173,唉！,0,1,0,2022-07-29 21:36:17,来自湖北,6486584072,浣西纱
7125770090439623439,何必呢,0,2,1,2022-07-29 20:28:00,来自辽宁,496611304412536,1丁不二
7125769994180231971,互认有利有弊，好处是方便的大家，缺点是，有的人做核酸很专业，有的是糊弄人,3,3,1,2022-07-29 20:27:35,来自江苏,18517689619,东方南飞雪
7125781263285748516,我妈身体不好每次要从扬州去南京住院，做核酸这个流程就把我们转晕，当地做一个去南京做一个，到省本院再做一个，我就带着70岁患癌老母亲到处做核酸，一路的不便让母亲在高温环境下数次中暑！,2,4,0,2022-07-29 21:11:46,,3320167589753587,分秒必争河流aH
7125772962552677161,[吃瓜群众]最好早点通知：疫情结束了,1,6,1,2022-07-29 20:39:17,来自广东,4305291831676684,汀以沚
7125779874820129536,不同渠道展示的核酸检测结果具有同等效力。群众通过国务院客户端、国家政务服务平台、各省份健康码、核酸检测机构网站或APP查询到的核酸检测结果及群众持有的纸质核酸检测结果，凡在当地防控政策有效时间内的（以出具报告时间为准），具有同等效力，各地在查验时都应当予以认可。,0,2,0,2022-07-29 21:06:03,来自山东,74016507370,人到中年新的开始
7125770929586242335,这个早应该有，大赞👍🏻👍🏻👍🏻,1,4,0,2022-07-29 20:31:54,来自北京,108606773056,机智的辰星QK
7125774888874459940,山东全免费,1,1,0,2022-07-29 20:46:59,来自山东,86126142907,不做妻不为娘
7125783894758277925,我以前就认为健康码是全国统一的[捂脸][捂脸][捂脸],3,14,1,2022-07-29 21:21:56,来自河北,58833323025,悟1566
7125787810333852456,推动核酸检测结果全国互认，是聪明之举。这次我们全家到北京去看病，临走在当地连着做了三次核酸检查，结果到了北京都不认可，真是耽误时间，耽误事情。,0,0,0,2022-07-29 21:36:44,来自安徽,3298145991154797,善良蛋糕WK
7125791385739363080,合肥落地检,1,0,0,2022-07-29 21:51:10,来自安徽,64851887278,糯米糍221166497
7125774046536581923,健康码能互认才真的是民心所向了！,0,4,0,2022-07-29 20:43:19,来自上海,111496079053,拂晓茉莉花开
7125770889433858847,全国核酸检测互通，这是防疫抗疫措施的一大进步，也为国家医保体系节省了很多。三年新冠肺炎免费治、免费隔离、免费核酸检测，花费了多少人力物力啊！,0,1,0,2022-07-29 20:31:39,来自安徽,2308617422511896,胡狐一生
7125781983837307688,便民利民好举措，健康码也应该全国一码通,1,2,0,2022-07-29 21:14:08,来自广西,1380584391711952,枫之流林
7125788948600849183,对的，全国互认省很多麻烦[赞][赞][赞],3,1,1,2022-07-29 21:41:41,来自河南,6673360445,舞动枫叶9Z9
7125782424453169961,先别说健康码全国统一了，就在同一个城市，有了健康码还不行，还得扫场所码[捂脸],9,18,0,2022-07-29 21:15:52,来自广东,6966755766,热心坦荡的河流tm
7125774673824662303,"疫情防控人人有责，积极参与核酸检测也是我们每个公民的义务和责任。
但是我发现一个弊端不知道是我刚发现还是其他人也注意过。在我们这里都有全民核酸检测登记码，注册登记后就可以截屏保存了，下次直接拿出来检测就行了。就是这样一个码我们就可以替别人检测了，比如a把他的注册码发给b，b拿着a的码去登记检测，完后a的健康码就会显示已经检测过了。",1,1,0,2022-07-29 20:46:25,来自山东,954827608175015,东营齐恒装饰
7125773806115144488,有核酸阴性报告，有绿码，还能被要求隔离。,0,6,0,2022-07-29 20:42:34,来自天津,98717580560,枉言摄影
7125798900891927332,别说全国互认了，我们这边同一个镇上两个村都不认同，早上上班在自己的村部做完核酸领取了核酸已采样的卡片，上班路上路过别外一个村直接不让过，给看守的人看了已采样的卡片都不行，就是不让过，必须要在他们的村子上在做一遍领取印有他们村名字的已采样卡片才能通行，,0,0,0,2022-07-29 22:20:26,来自江苏,18447627889,智者仓海
7125769169761026816,互联网时代终于可以互认了，是因为核酸检测价格下来了吗？,0,7,0,2022-07-29 20:24:34,来自浙江,1842379656798653,三江口水
7125780059226833664,支持黄教授提议，健康码，核酸检测报告，全国互认。,1,36,2,2022-07-29 21:06:44,来自湖北,2352559316801796,坦荡的阳光Ce
7125778044350055183,疫情3年，核酸终于互通了,2,3,0,2022-07-29 20:58:50,来自广东,71177990108,待我称王带您狂
7125812433398547200,一个小县城，在便民核酸点做的都不好使，到医院必须花16块钱重做，不然不让进病房,0,0,0,2022-07-29 23:12:50,来自辽宁,58725906208,过期的小孩1979
7125812229127308063,期待全国核酸尽快统一码,0,0,0,2022-07-29 23:12:29,来自广东,103384581758,心灵梦
7125781584519119649,这是好消息吗，哪一天彻底不检测了才是好消息。,3,9,0,2022-07-29 21:13:15,来自贵州,738491372412414,坦荡的芒果Uw
7125780732740076328,核酸证明要像人民币一样全国通用。,1,3,0,2022-07-29 21:09:26,来自河南,55056012212,踏雪无痕153460
7125780532747174671,全国互认，将会节省一大笔人力物力财力，利国利民！！,0,3,0,2022-07-29 21:13:35,来自山东,74016507370,人到中年新的开始
7125778107772306217,现在很多单位还是认当地核酸，外地的不认，不给进入,1,1,0,2022-07-29 20:59:06,来自广东,6711180325,想发达的人
7125776447780274955,人民币互认不？,3,7,0,2022-07-29 20:53:24,来自广东,59113533415,Sprite636939
7125777763453240095,事半功倍呵，一件小决定但也是一大进步，既避免了资源浪费又方便了大众，何乐不为也。,0,1,0,2022-07-29 20:58:07,来自四川,1183509585860574,清爽远山ie
7125794480120890147,这个项目，所有人都觉得应该早该启动了，就跟居民身份证一样，全国统一，制作起来也一个模板，省时省力，这个地方这个样，那个地方那个样，这个宝，那个通，难道这些设计和系统不用额外花钱搞吗？浪费的钱，干点啥也好，现在全国有规划了，好事多磨，越来越好值得点赞[赞],0,0,0,2022-07-29 22:02:55,来自河北,94394410178,我才是嘻嘻哈哈
7125785999405679398,这个才是大实事,1,3,0,2022-07-29 21:30:25,来自浙江,5452753083,任rfx飞翔
7125774654598005541,实事求是思想路线！,0,2,0,2022-07-29 20:46:17,来自广西,5919487033,壶城散人
7125774432043991838,这才是一个中国,0,3,0,2022-07-29 20:45:24,来自上海,110039698666,叶子的气
7125780352295027468,健康码不是统一的吗？,26,7,4,2022-07-29 21:08:20,来自云南,2384167704730484,雅轩的小号📣
7125787081892217633,呼唤医保全国互认[灵光一闪],0,2,0,2022-07-29 21:34:28,来自广东,853673255635422,问风诗文集
7125768565311095563,无锡早就可以了，上海太慢了,1,0,0,2022-07-29 20:22:39,来自江苏,60160667587,江南乡野一布衣
7125821746917786372,就是嘛！每次一个地方到一个地方核酸不承认,0,0,0,2022-07-29 23:50:50,来自四川,10620440324,秀儿的花花
7125816161971208992,原来核酸检测结果不是跨省互认的吗？怎么现在推动了？核酸检测不是一个标准吗？我的哥哥？,0,0,0,2022-07-29 23:28:36,来自河北,4473869731,七九河开
7125781296072622889,统一健康码，势在必行！支持黄教授。,0,23,2,2022-07-29 21:11:34,来自广东,5736216177,打开世界
7125784222396089127,不要搞各自为阵，应該信息互通，节约人力节约资源。,0,5,0,2022-07-29 21:23:22,来自湖北,3422101542536056,蓉儿
7125797088810238759,恢复正常生活吧,0,2,0,2022-07-29 22:13:44,来自北京,50858159084,西红柿叶子1
7125772060928246539,发热去医院，前一天做的核酸医院不认，让重新医院自费做,0,1,0,2022-07-29 20:36:26,来自浙江,1341024188237576,兰溪松沙
7125775791237415683,省了不少。,1,1,1,2022-07-29 20:50:57,来自广西,109202574420,迎风笑不露齿
7125777414965494565,啥时候能停止核酸，恢复正常sheng h q,0,9,1,2022-07-29 20:56:48,来自辽宁,105259581984,Z向日葵M
7125776044908610335,疫情结束才是最好的消息,0,1,0,2022-07-29 20:51:23,来自江苏,3363554308,淡泊的画板XU
7125807855542289186,全力支持健康码全国统一！,0,3,0,2022-07-29 22:54:54,来自福建,5979592558,羅家小爷儿
7125781543729185577,化繁为简，便民且能提高效率。,0,12,1,2022-07-29 21:12:30,来自浙江,6627780625,心意薇薇
7125775615613584136,基本上两三天做一次核酸，虽然频繁，但为了大家的健康还是积极配合工作，希望大家都保护好自己，早日脱掉口罩😷,0,1,0,2022-07-29 20:50:01,来自新疆,655780481604349,自强不息妍妤麻麻
7125769921976009508,那就方便多了，,0,3,0,2022-07-29 20:27:55,来自北京,85910289652,源青Jun
7125776518466863903,一盘散沙的认可终于等来了统一互认了.也是疫情三年来的一个进步。,0,1,0,2022-07-29 20:53:28,来自上海,97864317806,在水一方53281
7125771312983261987,愿各地疫情尽快结束！每个人都健健康康,0,1,0,2022-07-29 20:32:54,来自四川,70181191963,云220754479
7125771069407118121,全国通用，才有意义,0,2,0,2022-07-29 20:31:50,来自山西,95331420933,自由的百灵鸟xd
7125810696251573000,希望惠民政策早日落实,0,0,0,2022-07-29 23:06:21,来自甘肃,106378821954,瞌睡猫L
7125770144877986592,核酸互通，有利于防控抗击疫情，有利于百姓的出行，有利于经济的流通，有利于经济的复出和发展，希望国家尽快研制出治疗疫情的药物，实现全民自由流通。,0,1,0,2022-07-29 20:28:58,来自广西,3227786387919373,蓝海明月光
7125790737085956872,说白了就是统一健康码数据，互相认同核酸检测结果[泪奔],0,1,0,2022-07-29 21:48:37,来自广东,4244542282017031,胡小箬在广州
7125778162038473507,当时核酸检测还不免费，还要预约，麻烦死了,0,2,0,2022-07-29 21:04:26,来自山东,74016507370,人到中年新的开始
7125769853700735783,全国互人的话这给我们的生活带来很大方便！,0,3,0,2022-07-29 20:27:44,来自河南,2691203893050823,蒙檬爱娱乐
7125770806701409055,就一全国通用码的问题,0,1,0,2022-07-29 20:31:22,来自广东,12754057761,乔治老叔叔
7125773684794835749,每到一个省市就得扫当地的健康码，先把全国健康码统一了，这样方便查验核酸报告。,0,1,0,2022-07-29 20:42:24,来自四川,1654103229599821,圈圈旅迹
7125770678901113634,好事，终于出行方便了！,0,1,0,2022-07-29 20:30:29,来自山东,53512340497,清风wy
7125774672637395724,历经二年多，真是太不容易了,0,1,0,2022-07-29 20:46:31,来自浙江,73430576407,随性的玉兰花开
7125807951998812940,好事，疫情已经两年多了，终于盼到这一天了！希望尽快落地，简化出行政策。,0,2,0,2022-07-29 22:56:17,来自北京,276679596966196,灵魂走丢的人
7125776707747480335,什么意思？不一样吗？,0,1,0,2022-07-29 20:53:46,来自辽宁,71960284954,嘟嘟航
7125782840670716706,全国统一互认，减少浪费，支持黄教授的提议！,0,12,1,2022-07-29 21:17:23,来自四川,2594488230884472,友爱星星N6
7125770679139582761,我一直以为早就可以互认了。。。不过深圳的核酸结果，用南宁桂智通也是可以查的到的,0,0,0,2022-07-29 20:30:20,来自广东,4182154068114264,Y515Y
7125779935544918825,应该说是很得人心的事,0,0,0,2022-07-29 21:06:10,来自甘肃,108396805053,我的喜乐我知道
7125778997136786216,核酸检测不用重复做了。这样既方便群众。又节约了时间。[赞][赞],0,1,0,2022-07-29 21:02:39,来自贵州,2299767688805847,极客根河3J9
7125772265236710181,希望尽快落实，让大家出行方便,0,0,0,2022-07-29 20:36:46,来自陕西,97787167767,觉醒年代的声音
7125812430886175519,健康码为什么全国不同步？,0,0,0,2022-07-29 23:13:31,来自北京,4023856049954488,鱼儿悠悠闯天涯
7125778285162316575,跨省到哪里都要重新做,0,0,0,2022-07-29 21:00:16,来自山东,68104563070,Loieseven
7125776926509237025,从河北做的核酸不能上传到北京建康保坐地铁还要走人工通道。,0,0,0,2022-07-29 20:55:12,来自辽宁,73472053331,望天观地走不了
7125770368849740578,这个合理，减少了人力物力的耗费，方便人员流动[赞],0,1,0,2022-07-29 20:29:14,来自上海,106026241366655,细水长流
7125793230658601764,赞同，这样很好，方便了出行人员也减轻了防疫检测工作人员工作量。,0,0,0,2022-07-29 21:58:27,来自广西,24800173436,聖壹
7125790795500028687,更加科学便捷和人性化！！[赞][赞],0,0,0,2022-07-29 21:48:26,来自湖南,3413352648289549,橘洲夜话
7125777651218187048,早应该这样了,0,1,0,2022-07-29 20:57:27,来自江苏,1799240910640255,燕子带你看风景
7125776185174557440,应该全国统一核酸码，健康码。,0,0,0,2022-07-29 20:51:36,来自河南,92500597000,娇娇宝贝16GYM
7125800283430683406,没有发现不互认的,0,0,0,2022-07-29 22:25:44,来自江苏,111377567878,宁汉相通
7125778100671349511,"支持国家卫健委！赞赞赞！[赞]
推动核酸检测结果全国互认！",0,0,0,2022-07-29 20:59:21,来自天津,2713226492525294,longlong雨声
7125786297473778467,早就该这样了！昨晚在成都做了核酸，今天下午到了重庆又做一次，明天还要做一次，确实有点麻烦！,0,0,0,2022-07-29 21:31:01,来自重庆,3944680553186840,爱思小姐
7125779859820823332,坚决支持，出门再不用花钱做核酸了，不用特意等核酸结果算着时间再买票！[赞][赞][呲牙][呲牙],0,1,0,2022-07-29 21:06:14,来自黑龙江,1239880354771358,曾幻巧28
7125771197136667430,愿疫情早点结束！全国人民健康快乐,0,0,0,2022-07-29 20:33:08,来自江苏,4410875310513885,博学多才的陈敏棋
7125791881787114280,把核酸检测报告直接加到行程码里多好。现在先看行程码再看健康码，还要扫本地码,0,0,0,2022-07-29 21:52:43,来自辽宁,5770887060,我是小不点儿呀
7125786341812142848,我们现在一户只做一人,0,0,0,2022-07-29 21:31:11,来自河北,56868669655,薄荷柠檬88
7125790011634860835,对于经常外出的人员这真算了是一大利好消息，不用跑到一个人生地不熟的地方满大街去找测核酸的地方[赞],0,0,0,2022-07-29 21:45:21,来自江西,59733040549,爱静静的小仙女
7125795013602558754,很赞同健康码统一！,0,1,0,2022-07-29 22:04:56,来自河南,4100776795,乐天派智者远行
7125771982612300575,支持全国统一互认，这样孩子们开学，不会再出问题了！,0,0,0,2022-07-29 20:35:55,来自江西,3918266997943852,正大光明的豆子
7125798214003344158,给黄教授点赞！,0,0,0,2022-07-29 22:17:43,来自河南,5810811870,风起梧桐树
7125777634222588710,这真是一个好消息,0,0,0,2022-07-29 20:57:55,来自天津,527386172730317,乘风破浪爱咋咋地
7125781081693537058,很有必要，否则出行很困难，值得尽快推广,0,0,0,2022-07-29 21:10:47,来自陕西,874857111491725,穿越的天空吧
7125774552671617827,谢谢我们的祖国，感恩政府，我们很安全！[赞][赞][赞][玫瑰][玫瑰][玫瑰],0,0,0,2022-07-29 20:45:19,来自河北,55842934180,妞妞姥8
7125778444700517153,希望疫情全部早点结束就好了,0,0,0,2022-07-29 21:01:07,来自四川,1377052311697971,博学青山6
7125780318732567329,深圳加油安徽加油,0,0,0,2022-07-29 21:08:13,来自广东,2783581067553768,刘夕阳
7125772588546802471,强烈呼吁健康码也全国统一！！！全国核酸检测结果早就应该互认了！,0,0,0,2022-07-29 20:38:35,来自内蒙古,54989018716,泰格船长CaptainTiger
7125770371558867751,方便群众，点赞👍🏻,0,1,0,2022-07-29 20:29:43,来自山东,5259395548,美子书法
7125773139669746463,总之，防疫工作会越来越成熟有效！,0,0,0,2022-07-29 20:40:23,来自广西,3114269223954221,暖风隔岸sun
7125790796120556303,推动？为什么不是要求？,0,0,0,2022-07-29 21:48:29,来自河南,84842814853,可可心灵密码
7125798275650765606,下周就统一认可了吗,0,0,0,2022-07-29 22:17:58,来自北京,52784673525,宝贝妈妈50
7125775414488040232,支持，终于可以走到这一步了。,0,0,0,2022-07-29 20:48:40,来自湖南,21374772425,简单海浪kele
7125778439843988263,赞同，点赞,0,1,0,2022-07-29 21:01:11,来自山东,99032666985,幸运柳叶y
7125788779381932830,这样出门就方便多了,0,2,0,2022-07-29 21:41:08,来自安徽,2630478835760958,小熊不迷茫
7125781674889560840,应该有个全国健康互通码。,0,0,0,2022-07-29 21:13:25,来自广东,1170320744787341,我不摘月亮DvMf
7125777329414357798,为了出行顺畅，广州连续两天做核酸，到另一个城市下高铁一看是外省的，一样拦住做核酸，虽然是免费的，但分县登记，兜兜转转很不方便呀。[捂脸],0,12,0,2022-07-29 20:56:46,来自陕西,2616454642668648,不凡暖阳qb
7125769558132622115,现在省级平台核算报告各自分开显示，能不能合并到一起？或者在国家平台统一呈现？,1,8,1,2022-07-29 20:26:02,来自河南,52306282418,我们理财吧
7125814701430784809,前几天我去北京中信银行，就进不去，因为我的北京健康宝显示没有在北京做核酸，但是我每次进京前都提前一天做核酸，北京的医院承认，北京的中信银行不承认外地核酸，这是我的工资卡，美元业务必须要在柜台办理，但是不让进，太无语了！！！,0,3,0,2022-07-29 23:21:45,来自河北,99642211501,有趣的生活家Td
7125766332183986944,应该全国只用一种健康宝,12,357,10,2022-07-29 20:13:29,来自辽宁,30410230995395,钮祜禄后代
7125817108356907780,"[比心][比心][比心]国务院应对新型冠状病毒肺炎疫情联防联控机制综合组
2022年7月29日
一、高度重视核酸检测结果全国互认的重要性。
二、不同渠道展示的核酸检测结果具有同等效力。
三、强化宣传引导和督促落实。各地区要立即行动，将核酸检测结果全国互认的要求落实到基层一线，确保基层管理人员认真执行。",0,1,0,2022-07-29 23:32:15,来自广东,103535617664,东风小康解说三国杀
7125767421776397090,在我们这里住院。医院免费的不能入院，非得付费再检测一下[吃瓜群众][吃瓜群众][吃瓜群众],5,82,0,2022-07-29 20:17:45,来自河南,56333764407,天妒红颜15
7125812433398547200,一个小县城，在便民核酸点做的都不好使，到医院必须花16块钱重做，不然不让进病房,0,0,0,2022-07-29 23:12:50,来自辽宁,58725906208,过期的小孩1979
7125812229127308063,期待全国核酸尽快统一码,0,0,0,2022-07-29 23:12:29,来自广东,103384581758,心灵梦
7125781584519119649,这是好消息吗，哪一天彻底不检测了才是好消息。,3,9,0,2022-07-29 21:13:15,来自贵州,738491372412414,坦荡的芒果Uw
7125766718727258883,郑州杭州两地跑，这边做完那边不显示，那边做完这边不显示，太难了,3,13,0,2022-07-29 20:15:56,来自河南,81984058844,"远夜,,づ"
7125767765159428872,早就应该全国互认核酸检测结果！👍👍👍👍,1,189,4,2022-07-29 20:19:21,来自黑龙江,1393823146849224,我的世界我的芳华
7125780732740076328,核酸证明要像人民币一样全国通用。,1,3,0,2022-07-29 21:09:26,来自河南,55056012212,踏雪无痕153460
7125796567105209100,早就应该做啦，去个异地真闹心！,0,12,0,2022-07-29 22:11:23,来自江苏,50393681749,阳光沙滩大海
7125780532747174671,全国互认，将会节省一大笔人力物力财力，利国利民！！,0,3,0,2022-07-29 21:13:35,来自山东,74016507370,人到中年新的开始
7125767429380113159,不错，疫情迟迟不消灭的情况下就应该一码全国通用，然后就是跨省的就在各个交通枢纽站设一个核酸检测点。做到应检尽检，但是不要过度检测,4,108,3,2022-07-29 20:17:58,来自广东,88475179244,远方的故事123
7125778162038473507,当时核酸检测还不免费，还要预约，麻烦死了,0,2,0,2022-07-29 21:04:26,来自山东,74016507370,人到中年新的开始
7125755383846716190,确实需要同步，希望推动全国使用一码通，不能一个地区一个码，太烦了。[捂脸],5,492,12,2022-07-29 20:14:06,,21610703358540,和老杨聊健康
7125778107772306217,现在很多单位还是认当地核酸，外地的不认，不给进入,1,1,0,2022-07-29 20:59:06,来自广东,6711180325,想发达的人
7125821918154031880,今天回陕西老家，来之前做了核酸，落地西安后做了一次，高速口下来又做了一次抗原一次核酸，算不算层层加码？,0,0,0,2022-07-29 23:50:41,来自陕西,84718381590,mengxiang312
7125819265143964446,这很重要，不然出行真是麻烦，就湖北省武汉市持有的健康码到神农架，早上在武汉做了核酸，结果到当地又要做核酸，一等就是几个小时，汽车都排了几公里。简直是浪费资源和时间。烦死。,0,1,0,2022-07-29 23:40:36,来自湖北,6257314576,莲藕83653262
7125767336233009959,总算等到好消息了，核酸检测结果可以全国认可了！,8,126,5,2022-07-29 20:17:49,来自上海,4397642359258909,碧淼
7125772613339333383,终于各个地方核酸结果互通了，这样方便很多,3,35,2,2022-07-29 20:38:27,来自河南,3874325362120083,充满元气的睿智追梦人
7125776447780274955,人民币互认不？,3,7,0,2022-07-29 20:53:24,来自广东,59113533415,Sprite636939
7125777763453240095,事半功倍呵，一件小决定但也是一大进步，既避免了资源浪费又方便了大众，何乐不为也。,0,1,0,2022-07-29 20:58:07,来自四川,1183509585860574,清爽远山ie
7125819605561770791,江西南昌只认南昌市内核酸 赣通码显示有效时间核酸都不认 不让乘坐公共交通 出了南昌市均不认何况外省,0,0,0,2022-07-29 23:42:01,来自江西,102103475200,上进咖啡Rg
7125794480120890147,这个项目，所有人都觉得应该早该启动了，就跟居民身份证一样，全国统一，制作起来也一个模板，省时省力，这个地方这个样，那个地方那个样，这个宝，那个通，难道这些设计和系统不用额外花钱搞吗？浪费的钱，干点啥也好，现在全国有规划了，好事多磨，越来越好值得点赞[赞],0,0,0,2022-07-29 22:02:55,来自河北,94394410178,我才是嘻嘻哈哈
7125785999405679398,这个才是大实事,1,3,0,2022-07-29 21:30:25,来自浙江,5452753083,任rfx飞翔
7125774654598005541,实事求是思想路线！,0,2,0,2022-07-29 20:46:17,来自广西,5919487033,壶城散人
7125774432043991838,这才是一个中国,0,3,0,2022-07-29 20:45:24,来自上海,110039698666,叶子的气
7125780352295027468,健康码不是统一的吗？,26,7,4,2022-07-29 21:08:20,来自云南,2384167704730484,雅轩的小号📣
7125787081892217633,呼唤医保全国互认[灵光一闪],0,2,0,2022-07-29 21:34:28,来自广东,853673255635422,问风诗文集
