7125781934093271808,"本就应当如此，何况全国一盘棋！
核酸检测标准全国（乃至全世界）都是一致的，然而这48小时（或72小时）的时效却为什么各个地方互不认可呢？
现实中，但凡有进出于其他外地所辖区域的人，非得被强制性再做核酸检测；否则寸步难行！
如此一来，既给民众出行带来极大的不便，更是造成了不应该的人力物力和财力无端的浪费！",0,0,0,2022-07-29 21:14:01,来自重庆,5848477517,手机用户刘有才
7125774901465940751,核酸考虑假阴假阳的错误率了吗？只要不断的大规模核酸，疫情就不会停止。,0,1,0,2022-07-29 20:46:44,来自上海,91823267396,才高八斗小鱼VW
7125774059640177447,也不知道真的假的，一天一个变化,0,1,0,2022-07-29 20:44:26,来自广西,71942666429,手机维修佬221
7125777173536949022,之前住院 必须要他们自己医院的核酸证明 说白了就是搞钱,0,2,0,2022-07-29 20:55:43,来自安徽,51774697147,杨是的没错
7125773857633731342,就这个要花三年时间？效率如此之慢,0,1,0,2022-07-29 20:43:06,来自北京,3865537382202935,风趣鲸鱼Vc
7125772931208151811,少出门，不知道居然还是不互认的，匪夷所思！,0,1,0,2022-07-29 20:39:39,来自广西,106186426809,评论区资深潜水员
7125779323156022030,这还用推动吗？为啥不互认呢？,0,2,0,2022-07-29 21:04:20,来自北京,70429435981,左贝奇
7125772955413693191,这个问题不应该存在的。,0,1,0,2022-07-29 20:39:33,来自江苏,3544433512679006,俊俏柳叶AH
7125776425843524355,真好，最近天天遭捅喉捅怕了[捂脸],0,2,0,2022-07-29 20:52:59,来自青海,3372897639874220,梦梵记录生活
7125773887127978764,几家欢喜几家愁,0,1,0,2022-07-29 20:43:27,来自辽宁,109095450784,忆往昔99541
7125774714047365888,责任，，每个地方都怕责任，导致一直重复,0,1,0,2022-07-29 20:45:58,来自广东,80557569895,天天向上15661
7125771266744910605,核酸原来认，今年忽然就不认了，最让人费解的是疫苗各地认各地的，异地健康码根本不显示疫苗状况,0,0,0,2022-07-29 20:32:52,来自江苏,105923208662,抖皮跳跳弹
7125774260148519715,"就像是打仗。战争机器已经开动了。想让它停下来也是很难的。
让异地互认，你去串串门试试。",0,0,0,2022-07-29 20:44:16,来自广东,6035093966,帅帅16
7125812065621082914,难道现在只认核酸，不认疫苗了吗？全国将近百分之八十的人都打了疫苗，不是说只要达到这个数量就可以群体免疫了吗？,0,0,0,2022-07-29 23:11:29,来自浙江,6068279595,mars77897186
7125775304140522240,调查：核酸检测，本周男的，下周女的，你们见过吗？,0,0,0,2022-07-29 20:48:23,来自黑龙江,96402173497,李评天下
7125774506622518023,写几行代码的事,0,1,0,2022-07-29 20:45:39,来自广东,62431651837,CharlisGoo
7125773236180747042,空间很大……,0,1,0,2022-07-29 20:40:24,来自河北,1403162705,A六零后
7125772814284112680,一切亦为利。,0,1,0,2022-07-29 20:38:43,来自重庆,84700865096,弯刀5188
7125771657302229791,就应该互认，不能有地域性的，多浪费！,0,1,0,2022-07-29 20:34:50,来自广东,4459260132983720,幽默优雅精灵2N
7125777079550886667,有些程序明明可以一步到位，非绕路而行。,0,2,0,2022-07-29 20:55:33,,5999336279,蝉鸣蛙叫的时代
7125771963372454686,你说你的我干我的,0,1,0,2022-07-29 20:35:30,来自上海,1385034890360429,耿耿大胖子
7125771279461810985,地主家也没余粮了,0,1,0,2022-07-29 20:32:36,来自安徽,3773126473684560,清风拂山岗上
7125774027763270438,这是要把核酸检测运动进行到底呀！[捂脸][捂脸],0,0,0,2022-07-29 20:43:59,来自河南,2528485777085323,枫叶的春天
7125775530917380901,意思是河南会把红码你认不？？？,0,0,0,2022-07-29 20:49:25,来自四川,51857615921,opopm
7125775398880920352,如果核酸检测全国通认，这个政策太给力了，支持，特别支持！,0,0,0,2022-07-29 20:49:17,来自上海,57737472190,任我行152130049
7125775452144829184,三年没研究出结果，难啊，老百姓,0,0,0,2022-07-29 20:49:01,来自天津,1371782415152381,乘风破浪的画板jY
7125775199526126375,太好了，真是便利国民的举措，我们可以在出行时避免很多不必要的麻烦，但愿全国各地都能立即响应执行。,0,0,0,2022-07-29 20:48:52,来自湖北,18045868277,机智的风铃HQh
7125775256241210115,麻烦,0,0,0,2022-07-29 20:48:43,来自广东,3769578693595847,狮子大开口
7125775414488040232,支持，终于可以走到这一步了。,0,0,0,2022-07-29 20:48:40,来自湖南,21374772425,简单海浪kele
7125775304140522240,调查：核酸检测，本周男的，下周女的，你们见过吗？,0,0,0,2022-07-29 20:48:23,来自黑龙江,96402173497,李评天下
7125775094453977859,"有些地检测规范严格，具有权威性。有些地检测混乱，弄虚作假，可信度差。
所以，有利有弊。",0,0,0,2022-07-29 20:47:53,来自河南,545808226978621,厚厚5257
7125774847582012198,翻译：推动全国人民做更多的核酸,0,0,0,2022-07-29 20:47:21,来自浙江,103980120930,孤帆叠影锁心锁
7125779935544918825,应该说是很得人心的事,0,0,0,2022-07-29 21:06:10,来自甘肃,108396805053,我的喜乐我知道
7125774586985726753,北京弹窗中，坐不了车，有两次48小时内核酸，济南北京各一次，北京不认，要三天两次京内核酸,0,0,0,2022-07-29 20:46:14,来自北京,4061278538,蛮拼的32578563
7125774593365328654,[赞][赞][赞],0,0,0,2022-07-29 20:45:59,来自江苏,2018298714401995,自由三石
7125774510133314316,统一健康码才对。,0,0,0,2022-07-29 20:45:50,来自北京,923184237390093,仰望平行宇宙
7125774545801593615,贵州回重庆要做一次，第二重庆结果刚出来回贵州又要求3天两检！,0,0,0,2022-07-29 20:45:21,来自重庆,4388863012781912,妥妥的国宝
7125774552671617827,谢谢我们的祖国，感恩政府，我们很安全！[赞][赞][赞][玫瑰][玫瑰][玫瑰],0,0,0,2022-07-29 20:45:19,来自河北,55842934180,妞妞姥8
7125774361076417320,[赞],0,0,0,2022-07-29 20:44:44,来自新疆,109904657247,用户6408962544987
7125774239563268879,[赞][赞][赞],0,0,0,2022-07-29 20:44:20,来自辽宁,110024474072,adgkurvfznpq
7125774260148519715,"就像是打仗。战争机器已经开动了。想让它停下来也是很难的。
让异地互认，你去串串门试试。",0,0,0,2022-07-29 20:44:16,来自广东,6035093966,帅帅16
7125774134143451935,唉😔,0,0,0,2022-07-29 20:44:09,来自上海,51794407471,你好g2020
