7125771133902832399,昨天河南低风险来广东，今天下午14点到达广州火车站做核酸，19点出结果阴性，到我们所在的地方厂里不让进宿舍，非要本地的核酸检测结果，16点到汽车站做的结果还没有出，现在还在外面等，估计要到23点以后了,1,18,1,2022-07-29 20:32:04,,105082736993,乘风破浪的韭菜
7125767169728332556,不是中高风险地区，没有途径中高风险地区的人，有些地方还是一直查盘根问底。出行不易,0,7,0,2022-07-29 20:17:34,来自安徽,59834548187,章泽键
7125768565311095563,无锡早就可以了，上海太慢了,1,0,0,2022-07-29 20:22:39,来自江苏,60160667587,江南乡野一布衣
7125821130183246607,希望异地上学的不要说只能本地核酸结果了,0,0,0,2022-07-29 23:47:01,来自广东,4361090219,去庙里吃个素
7125819462540083983,这是说明我们各地检测方式和标准世界上是不一样的？不然为什么存在不互认的现象？,0,0,0,2022-07-29 23:40:21,来自上海,52952229080,冷眼旁观很困难
7125821746917786372,就是嘛！每次一个地方到一个地方核酸不承认,0,0,0,2022-07-29 23:50:50,来自四川,10620440324,秀儿的花花
7125766785412399904,今天有朋友从杭州到陕西省榆林市，拿出发地核酸检测报告人家就不认，非得要当地出具的检测报告才认。,1,33,0,2022-07-29 20:16:02,来自陕西,100507439883,利君纳米银营销经理
7125816161971208992,原来核酸检测结果不是跨省互认的吗？怎么现在推动了？核酸检测不是一个标准吗？我的哥哥？,0,0,0,2022-07-29 23:28:36,来自河北,4473869731,七九河开
7125781296072622889,统一健康码，势在必行！支持黄教授。,0,23,2,2022-07-29 21:11:34,来自广东,5736216177,打开世界
7125777699959849760,今天下午鄂州做的核酸，一个小时后到黄石就不认了，非得再做,0,1,0,2022-07-29 20:58:04,来自湖北,3286277727,Lask
7125771663580660510,早就该这么办了，效率还是低,0,1,0,2022-07-29 20:34:36,来自河北,2915495499544907,龙舌兰最迷人
7125784778703749903,本来不就互认吗？,0,1,0,2022-07-29 21:24:59,来自河南,2286604757767800,金牛戏水
7125776452733272870,这个必须！赣通码就显示全国核酸检测结果,0,1,0,2022-07-29 20:53:11,来自陕西,3868010642,米饭猴
7125780267734188837,现在，只要是从外地回来的进医院都要写承诺书，进几次写几次，有这个必要吗？,0,1,0,2022-07-29 21:08:01,来自江苏,11633207665,笔生字情
7125771630374519564,马上大学的新生要开学到校报到了，家长与亲属免不了送孩子到校，学校天南地北的一路车运航行核酸检测是一件麻烦的事？怎样顺利通过才好。,0,0,0,2022-07-29 20:34:39,来自辽宁,111312521995,暖洋洋286689223
7125779427371975437,到底时间以采样时间还是出报告时间？,0,1,0,2022-07-29 21:04:45,来自江苏,2079930853370780,叹息若尘
7125777986657747752,早就应该这样啦,0,1,0,2022-07-29 20:58:45,来自安徽,769276004802035,好学热情的天空DL
7125777545559212832,这绝对是为人民出行带来的方便,0,1,0,2022-07-29 20:57:29,来自广东,760512648317364,率真百香果fr
7125780590943011624,"#官方：推动核酸检测结果全国互认# 这个强烈支持。建议全国健康码统一，现在一个省都有不同的码太不方便了。

尤其是去外地，查核酸结果和出示健康码还得打开两个小程序。",0,0,0,2022-07-29 21:08:56,来自广东,6513272051,网观天下
7125807565015450371,首先把医院统一了，医院不但外地不认，本地也不认呀，就认自己医院做的。,0,1,0,2022-07-29 22:54:39,来自北京,101150610337,热闹荷叶vE
7125784826665714472,应该推动！该推动全国互认的还有啥？,0,1,0,2022-07-29 21:25:12,来自河北,659303492752787,司空見
7125779838824383235,早该这样了,0,1,0,2022-07-29 21:06:28,来自重庆,3742727970,一剪梅25188066
7125774586985726753,北京弹窗中，坐不了车，有两次48小时内核酸，济南北京各一次，北京不认，要三天两次京内核酸,0,0,0,2022-07-29 20:46:14,来自北京,4061278538,蛮拼的32578563
7125778003242189580,世卫组织是不是要宣布疫情结束后,0,1,0,2022-07-29 20:59:38,来自北京,3333319792014695,机智无双的小玲
7125770260905067302,我上上周六去北京窦店进企业就不认必须北京核酸，周一就改通知互认。,0,1,0,2022-07-29 20:29:29,来自天津,52541915352,满足156650795
7125780105167209216,互认核酸有利大一统市场，也有利于节约资源。,0,1,0,2022-07-29 21:07:00,来自新疆,1046386217846541,秦晋雄鹰
7125772524772377384,互认吧！湖南广州是互认的,0,1,0,2022-07-29 20:37:33,来自广东,1578525910112468,多彩星球oS
7125781455187673891,你总算说了个有效建议,0,3,0,2022-07-29 21:12:10,,7018427140,胡不疑
7125772997935547176,三年了，终于可以互认了,0,1,0,2022-07-29 20:39:24,来自新加坡,51565802488,那个NS谁谁谁
7125780882061492992,健康码，核酸都应该统一,0,0,0,2022-07-29 21:10:02,来自上海,6861148883,啊伦2
7125771293718299424,与大数据行程码合一块多好。或者强制统一传到国务院政务平台，随时都能查看。,0,1,0,2022-07-29 20:33:15,来自河南,96702722548,太璞666
7125785011093209860,早该如此了，吃过太多亏了，满眼都是泪。[流泪],0,1,0,2022-07-29 21:26:28,来自重庆,1516966472595716,汤姆瓜
7125815738522551051,万马(码）奔腾[打脸],0,1,0,2022-07-29 23:26:55,来自新疆,3157423815674157,三石2807
7125772193556546319,核酸检测全国应该是一盘棋，不间断的重复核酸，会给人们带来身体上的不适，检测试剂在少，他也会有化学反应。,0,0,0,2022-07-29 20:36:23,来自北京,5899192581,勇者求实
7125781666743927587,健康码最好全国统一，比互认更进一步。,0,7,1,2022-07-29 21:12:53,来自上海,4260090604,您笑我也笑
7125775131418395433,不是执行的一个标准？,0,1,0,2022-07-29 20:47:35,来自山西,1099117539110583,愚翁0159
7125773065191244547,本就应该全国认可，毕竟你是在中国领土范围内，出国了那就不一样，,0,0,0,2022-07-29 20:40:09,来自江苏,93157293719,天大地大没有我大1977
7125775787231429416,早该这样了，现在互联网那么发达，两头验多浪费资源。,0,1,0,2022-07-29 20:50:07,来自广东,87751914570,敏锐船帆dH
7125772718112899870,哈哈终于看到了胜利的希望！,0,1,0,2022-07-29 20:38:48,来自湖南,95939728324,志明2062
7125783570769314594,全国统一很好，支持！但核酸检测涉及的利益冲突是好政策推行的最大阻力。,0,5,0,2022-07-29 21:20:20,来自江苏,4628013808,凭栏观海45936666
7125778901376664323,行程码何时取消，一个健康码可以了,0,1,0,2022-07-29 21:02:59,来自安徽,6039077175,走近科学2006
7125780173852607247,现在核酸检测结果全国不通用啊？,0,0,0,2022-07-29 21:07:08,来自河南,5333124090,散人51422896
7125776749471990531,好，有利人员流动，有利经济进行，全国一盘棋，早该这样了！,0,1,0,2022-07-29 20:54:33,来自山东,97871572636,穆旭晨
7125784229849793321,这不是承认的问题，异地这段路程谁能保证,0,1,0,2022-07-29 21:22:56,来自江西,3936868095,陈酱品
7125772701969105699,难度挺大的，前不久这村与村之间都不互认！[捂脸],0,1,0,2022-07-29 20:38:16,来自江西,4149125694,秋阳正当顶
7125768921466585897,全国一码通，而不是层层加码，各说各的,0,1,0,2022-07-29 20:23:34,来自浙江,1534539843520167,清晨的幽默aYAU
7125779923641516841,什么意思?以前不互认吗？,0,1,0,2022-07-29 21:06:14,来自广东,54780208090,湛江华歌
7125780393709978408,医院不会认的，前两天刚做核酸 到医院还要做,0,1,0,2022-07-29 21:08:03,来自浙江,62036672318,人无完人225124809
7125775094453977859,"有些地检测规范严格，具有权威性。有些地检测混乱，弄虚作假，可信度差。
所以，有利有弊。",0,0,0,2022-07-29 20:47:53,来自河南,545808226978621,厚厚5257
7125819318247506688,也不要全国互认，能全省互认就可以了，到医院住院，还要在医院重新做核酸，还有双抗,0,0,0,2022-07-29 23:39:32,来自新疆,53223480651,江文辉4
7125771570311611177,真不容易，按说科技这么发达到现在才实现实属不应该，真是费时费力费人，也可能有国家自身的原因，算了不过多解释了，实现了就好。,0,1,0,2022-07-29 20:33:43,来自北京,6090590219,万图思瑞
7125790143680316173,这才是真正的便民措施[赞],0,1,0,2022-07-29 21:46:22,来自广东,50589301743,阿波闲话
7125779350519382818,核酸检测费这不就来了吗,0,1,0,2022-07-29 21:03:58,来自广东,7042213989,gggtghjug
7125783631510897443,第一次听说！,0,1,0,2022-07-29 21:20:34,,2194559553,不凡叶子UM
7125778058665591589,这个好，上午在成都做了，下午在西宁做，没意义，最少隔开一两天再去做。,0,1,0,2022-07-29 20:59:20,来自青海,57021355849,诚信盛林
7125772789834941184,疫情这么久！早该这么做了！全国联网互认互通早就不是技术问题，而是官方的调控问题！既节约资源，又便民！！,0,0,0,2022-07-29 20:38:31,来自广西,3664750074,郑钱花988
7125802691695149858,现在，在某城市，医院不认社区的结果，必须在医院重检，自费！,0,0,1,2022-07-29 22:34:41,来自浙江,96715482263,温州人走天下
7125772580442931971,听从国家安排,0,1,0,2022-07-29 20:38:32,来自河北,409468796675326,电影解说1080P
7125774468706157349,这是明智的，省钱省时间，促经济发展！,0,1,0,2022-07-29 20:45:25,来自阿联酋,1943553197736631,你是我的明珠
7125770339371959080,我24小时做了三遍，不同地区[呲牙],0,1,0,2022-07-29 20:29:02,来自新疆,93055894354,长禾蔬菜（寿光）--邢
7125773904983573278,互联互通，体现人性，更多的是社会进步,0,0,0,2022-07-29 20:43:19,来自辽宁,2000767224657789,天上圣湖
7125781164098568991,早就应该做的事情,0,2,0,2022-07-29 21:11:12,来自天津,1121119239158622,温一盏月光
7125783947606803238,应该联网联动，,0,1,0,2022-07-29 21:22:29,来自山东,89927925635,平安福280565856
7125784111528035080,各地的病毒不一样[捂脸],0,1,0,2022-07-29 21:22:45,来自北京,3535645161300711,王老爹0306
7125773708929090338,现在还有搞省域歧视的，外省来的单独一个通道，要求扫码领一个黑码，不管你之前在外省是24小时还是48小时核酸检测报告。,0,0,0,2022-07-29 20:42:12,来自四川,105121824858,劳资习惯了
7125774848256787237,各地检测时间要求不同，不是还需要重新检测吗？如何互认？,0,0,0,2022-07-29 20:46:44,来自黑龙江,101743668937,wuliwei19753
7125771027929596705,核酸检测全国各地都是一个标准，同样程序，检测结果阴性正常为什么各地“各说各话，评判不一＂，这没有道理呀，应该统一认定并承认通行无阻。,0,0,0,2022-07-29 20:32:19,来自江西,106405853988,岁月如歌一曲新
7125814011018838814,我扎的 疫苗 都不同步 我在外省扎的 回家这边的APP上不显示 上小地方扎针 还收不到 前两针的记录 哎麻烦,0,0,0,2022-07-29 23:19:34,来自辽宁,5449084637,大鹏奋斗日记
7125774510133314316,统一健康码才对。,0,0,0,2022-07-29 20:45:50,来自北京,923184237390093,仰望平行宇宙
7125776980184138507,搞一个平台都可以查到就完了,0,1,0,2022-07-29 20:55:34,来自上海,3641727828,微言微語
7125780033406518019,这样做可以解除各个地方的仼性政策。支持国家卫健委的这一明智的决定。,0,0,0,2022-07-29 21:07:12,来自北京,3847897711649294,自若春风FU
7125782835076268813,希望早日实现，前几天拿着24小时核酸从西安去甘肃庆阳，下车后只认当地的核酸。,0,0,0,2022-07-29 21:18:04,来自甘肃,71110506540,LK2856
7125818072531092257,对对，呼吁一下全国统一北京健康宝。,0,0,0,2022-07-29 23:35:53,来自北京,59634213903,紫金男爵2
7125794562928624425,每个省份有每个省份的健康码和核酸结果，即使在出发地做了核酸，到目的地还是被要求重新再做一次，真的是浪费人力物力和时间的。,0,0,0,2022-07-29 22:03:04,来自广西,2524131645470334,谢Helen124154
7125770587573928742,希望尽快落地核酸互认！目前太浪费资源了。,0,1,0,2022-07-29 20:30:36,来自浙江,59108093490,天涯飞鸿1973
7125815153773445923,辽宁做的就挺好，有省内的核酸结果，也能调出来全国的库，说明全国是有统一平台的。,0,0,0,2022-07-29 23:23:23,来自陕西,3511264343,沐杰Harry
7125778283341579023,疫情快点结束吧！,0,1,0,2022-07-29 20:59:50,来自山东,361061151418228,一往无前溪水0h
7125776015813133060,早该这样，都在一个县城，全员核酸不认，必须医院检测的才行。不合理。,0,0,0,2022-07-29 20:51:54,来自云南,57579343589,蒙幼164409152
7125770777802228487,不是一直可以吗,0,1,0,2022-07-29 20:31:07,来自辽宁,57166913122,斩尽朦胧
7125774934483436329,早就该这样了,0,1,0,2022-07-29 20:46:50,来自重庆,109866669788,爪子皿
7125775962478248734,河北，北京原来不能互通，只有通勤标志才行。这下可好多了！省事了！,0,0,0,2022-07-29 20:51:16,来自河北,19697359791,任性过生活
7125771225960039201,啊，我以为本来就是全国互认,0,1,0,2022-07-29 20:33:17,来自江苏,3346776990,岁月神偷2007
7125771391832048418,监测一定要标准，不能应付公事！！,0,1,0,2022-07-29 20:33:09,来自山东,2304171190270824,时间811023
7125770323269747497,起码节省很多开支,0,1,0,2022-07-29 20:29:02,来自天津,66098708797,谷蓦然
7125785858376073996,的确！今天下午三点做核酸检测时，有位下午一点做过。不行！[捂脸]必须在本小区才算！,0,0,0,2022-07-29 21:29:43,来自四川,4725372293,寸草47776641
7125772730771342093,防疫越来有经验了，互认核酸结果，能促进人口流动，调动积极性，便民又经济，点赞！,0,0,0,2022-07-29 20:38:49,来自安徽,109780139534,小王的WJGs
7125772035795796767,全国互认是好事，但检测机构、人员，必须規范达标。否则，存在安全隐患！,0,0,0,2022-07-29 20:35:53,来自辽宁,6835831362,用心说话8099
7125773454796079910,不容易啊！三年了太难了,0,1,0,2022-07-29 20:41:54,来自甘肃,2831996297947047,随意的风
7125783870351803173,居然不是全国互认,0,1,0,2022-07-29 21:21:52,来自江苏,79772828700,儒雅葡萄Q7z
7125784146139661068,不就是开发一套系统吗，估计微信优先了,0,1,0,2022-07-29 21:23:09,来自广东,59075434628,fuyun8899
7125771303239582476,各地为政，除了人民币都一样，各市都有入境和出境政策，和国家没差别,0,1,0,2022-07-29 20:33:25,,54551252235,半瓶水vlog
7125771101770826504,谢谢党和政府的关心和爱护！核酸阴性证明可以全国互认了！咱也是一证能走全国的牛人了！[祈祷][祈祷][祈祷][祈祷],0,0,0,2022-07-29 20:32:28,来自河北,1592548605307070,佛灵007
7125775398880920352,如果核酸检测全国通认，这个政策太给力了，支持，特别支持！,0,0,0,2022-07-29 20:49:17,来自上海,57737472190,任我行152130049
7125775810757772071,只有从①高风险地区来的②密接者才需要出示③72小时内核酸检测证明，这一点也要明确，否则过度防疫难以杜绝。,0,0,0,2022-07-29 20:50:57,来自内蒙古,51568311451,往事不谏来者可追
7125779816930624256,我一直以为是全国互认的。,0,0,0,2022-07-29 21:05:56,来自北京,52242645665,出世洞明1
7125786178053800739,好了好了 慢慢看到曙光了,0,1,0,2022-07-29 21:30:37,来自广西,2422927355545132,登镫等灯
7125771235367748386,支持。各省都因该通用,0,0,0,2022-07-29 20:32:32,来自江苏,2163463498246734,么么水龙头
7125780893826106146,全国一码通,0,1,0,2022-07-29 21:09:59,来自内蒙古,2577717310274671,正直火车no
7125785720828134144,确实应该，到处换各地健康码！,0,1,0,2022-07-29 21:28:35,来自河北,12657884268,君威60
7125787841556480801,赞同全国互认,0,2,0,2022-07-29 21:37:50,来自广东,54841727664,峰在江湖1
7125769092308402951,全国互认是正确的。支持！,0,0,0,2022-07-29 20:24:27,来自河南,62442092914,力维
7125775639940694798,早该这样了，简单的事情搞得这么复杂！[祈祷][祈祷][祈祷],0,0,0,2022-07-29 20:50:05,来自浙江,2978780874,风4377951
7125780262465962792,之前就是这样，回学校的话，家里的核酸不认，只认本地的医院的,0,1,0,2022-07-29 21:07:32,来自四川,4328053780,莫言安然
7125775199526126375,太好了，真是便利国民的举措，我们可以在出行时避免很多不必要的麻烦，但愿全国各地都能立即响应执行。,0,0,0,2022-07-29 20:48:52,来自湖北,18045868277,机智的风铃HQh
7125779117768852239,核酸检测结果互认，健康码统一、规范，真正为人们的正常出行提供便利。,0,0,0,2022-07-29 21:03:01,来自上海,4239350220458143,黄8140
7125771585075905317,坚决支持[赞][赞],0,2,0,2022-07-29 20:34:20,来自山东,3043079403893063,喵姐说法
7125774091822301985,河北健康宝显示北京核酸检测报告了,0,0,0,2022-07-29 20:44:08,来自北京,62077880542,我心依旧那么爱你
7125782440198996749,化繁为简，便民且能提高效率。,0,2,0,2022-07-29 21:16:17,来自广东,82784233218,东平牛牛
7125821933635109669,个人建议，看看能不能全国统一一个码，到哪里都能使用扫码就成，这样方便，起高效，有利于大家出行。,0,0,0,2022-07-29 23:50:53,来自陕西,4231398357211588,外向晚风2Q
7125769897501917989,长春市有的医院只认本家核酸检测结果,0,1,0,2022-07-29 20:27:39,来自吉林,10969828058,文墨清潭
7125820790880109351,早就应该这样了！信息不互通共享，浪费了多少人力物力和财力！？,0,0,0,2022-07-29 23:46:25,来自广东,56404269823,乒乓149332294
7125804776856077056,有道理，检测结果全国通用,0,0,0,2022-07-29 22:42:57,来自河北,5932749594,缘分五月72055692
7125796963269870350,虽然晚，但总算是来了,0,0,0,2022-07-29 22:12:42,来自北京,8719152993,wolf139196337
7125787472172630821,势在必行[鼓掌][鼓掌][鼓掌],0,1,0,2022-07-29 21:35:52,来自山东,105652635144,铁甲劲旅188
7125775790054245161,我在四川用的天府健康通，啥都正常，北京健康宝就给弹窗，买了票不让进，害的我们都又退票,0,0,0,2022-07-29 20:50:08,来自四川,3910107896,雍平29533206
7125817606136906529,支持，吸取教训，避免再出现豫赐黄码红码之类的事[奸笑],0,0,0,2022-07-29 23:33:45,来自浙江,60872235600,好听的名字都已占用
7125773911274783522,对于出差和通勤人员，是很大利好[赞],0,6,0,2022-07-29 20:42:51,来自河北,93095554340,亦黑亦白亦静亦动
7125807811581690658,一个县一个码好像,0,0,0,2022-07-29 22:54:41,来自北京,6322463578,聚光灯V
7125791954562614024,是否国外回国时，始发国和中转国相同时效内正规检查机构的核酸检测也可以互认呢？,0,0,0,2022-07-29 21:53:27,来自广东,3874321491829819,凡思凡思
7125771072506692382,早该互认啦,0,1,0,2022-07-29 20:32:22,来自河南,92986937975,奋发有为山丘4
7125781510032147237,支持互认全国一盘棋！,0,0,0,2022-07-29 21:12:34,来自浙江,51970812428,蔡瑞章1
7125806386981880615,一省一个码，到哪里下载哪里的，北京的健康码居然连外省的核酸检测结果都查不到，太不方便了！,0,0,0,2022-07-29 22:49:43,来自北京,101150610337,热闹荷叶vE
7125772886652224288,很多医院只认自家付钱的核酸检测报告,0,0,0,2022-07-29 20:39:29,来自浙江,6344659660,陈二胡子
7125820318073226023,这次来广东出差就遇上了,0,0,0,2022-07-29 23:44:44,来自广东,2018295847859235,楚门at厦门
7125778410290594567,早该这样了，健康码全国统一一下可以考虑。,0,0,0,2022-07-29 21:00:45,来自河北,105959529504,欢快鲸鱼q2
7125804343496442660,不是推动，而是必须互认统一，,0,0,0,2022-07-29 22:41:53,来自广西,69589874123,桂海致远
7125771353437061921,"省了好多事，终于是出台政策了，这才是体现便民的政策。
各地防疫政策 都不一样，希望疫情下政府多为老百姓考虑",0,0,0,2022-07-29 20:33:29,来自江西,63986768572,味道觉醒
7125812249642156831,很好，减少减少重复无用检测，节省国家资源,0,0,0,2022-07-29 23:12:52,来自上海,4001820274866936,86八荒六合唯我独尊功
7125796860727657227,我也是一名核算检测的义务工作者。赞同！,0,0,0,2022-07-29 22:12:38,来自河南,51910470670,不离不弃原执着的爱
7125812249642156831,很好，减少减少重复无用检测，节省国家资源,0,0,0,2022-07-29 23:12:52,来自上海,4001820274866936,86八荒六合唯我独尊功
7125796860727657227,我也是一名核算检测的义务工作者。赞同！,0,0,0,2022-07-29 22:12:38,来自河南,51910470670,不离不弃原执着的爱
7125807785887335176,希望疫情全部早点结束就好了,0,0,0,2022-07-29 22:55:08,来自广西,1803665474338301,运筹帷幄香瓜MN
7125786281694577442,健康码、行程卡、核酸结果全国应统一，这才是精准防控。,0,0,0,2022-07-29 21:30:50,来自河南,61972344040,万里雪飘212756665
7125769937373135624,早该如此！为何拖了这么久？！,0,1,0,2022-07-29 20:27:57,来自北京,12523967068,晨光6805
7125772756000162600,还是健康码做到全国统一再说吧,0,0,0,2022-07-29 20:38:35,来自广东,66121546024,廣閪仔在順德
7125779125134476043,敲开地方保护主义的壁垒，核酸终于互通，又进步了一小步，可喜可贺！,0,0,0,2022-07-29 21:03:50,来自湖北,5162354502,上官彬
7125773566939284235,检测标准一样，全国就应该互认,0,0,0,2022-07-29 20:42:10,来自北京,3571584669,北京赵大帅
7125774847582012198,翻译：推动全国人民做更多的核酸,0,0,0,2022-07-29 20:47:21,来自浙江,103980120930,孤帆叠影锁心锁
7125777262854914849,好啊，资源不浪费,0,1,0,2022-07-29 20:56:25,来自内蒙古,4745690843,chenjianfu
7125782773939454724,健康码应该统一！,0,0,0,2022-07-29 21:17:48,来自广西,2480932816160925,Xfx6609
7125816097907557150,上海认长三角的他们却不认上海的[打脸][打脸][打脸],0,0,0,2022-07-29 23:28:08,来自上海,14548030414,清新菠萝gY
7125811796724368168,就算不统一，全国互认也可以啊,0,0,0,2022-07-29 23:10:20,来自广西,99217318576,洒脱的顽强梦想家HG
7125821059244917504,这算是什么障碍？,0,0,0,2022-07-29 23:46:48,来自广东,58765704908,HaoseWillians
7125793324183290631,机场应设置“现场检测结果”窗口,0,0,0,2022-07-29 21:58:49,来自天津,2216233940557719,神秘饺子tX
7125778781318710031,健康码行程码应该全国统一,0,0,0,2022-07-29 21:01:45,来自湖北,3654422148429620,豹子纹蕾丝
7125789078603236131,青城码是呼市的，其他地区不用，每个地方都有自己的,0,1,0,2022-07-29 21:41:41,来自广东,110623923970,独一无二的高冷柑桔y
7125776564775797507,‘我们镇上做核酸检测要4块钱,0,0,0,2022-07-29 20:53:48,来自浙江,101966146017,聪慧冰淇淋OM
7125770608184689449,愿疫情早点结束，不然发个烧上个医院太麻烦了。,0,0,0,2022-07-29 20:30:03,来自江苏,103626114640,用户钮定波
7125773555946062623,我只关心，核酸检测何时休,0,0,0,2022-07-29 20:42:02,来自四川,97046312670,丑鱼和Nemo
7125771994070844195,以后核酸检测都是常态化了，所以这个很人性化,0,0,0,2022-07-29 20:35:26,来自辽宁,1772055923798142,本市风趣的洋芋
7125792439285383976,重点是检测的准确性如何得到保证。,0,0,0,2022-07-29 21:54:48,来自江苏,103286890861,太平洋东岸的光
7125799640972559119,检测结果不能互认，归根到底还是检测机构想多赚钱！[灵光一闪],0,0,0,2022-07-29 22:22:48,来自北京,97814571542,黑洞观测者
7125772158492099343,要相信科学,0,0,0,2022-07-29 20:36:09,来自新疆,99933806602,淡淡荷香183
7125770073444582159,本来就该这样,0,1,0,2022-07-29 20:28:01,来自四川,99510053900,1395999999
7125771228727804711,早就应该这样呢,0,0,0,2022-07-29 20:33:03,来自安徽,70366945324,勤奋努力之人
7125788467065504527,说得真好。,0,1,0,2022-07-29 21:39:25,来自重庆,104626609483,袅袅青烟伴我思
7125777050077725477,能不能吃药预防为主，减少管控范围。,0,0,0,2022-07-29 20:55:18,,61546750205,幽默铅笔uU
7125791735187292968,早就应该这样了，这样可以节约多少抗疫的成本，核酸检测报告各地相互不承认，自成一体，浪费很大。,0,0,0,2022-07-29 21:52:04,来自新疆,51251554299,英明果断饭团xW
7125770741119173410,早该这么做了，不仅仅是核酸，健康码也应该推动！,0,0,0,2022-07-29 20:30:39,来自四川,99797192552,11213131
7125794135067837214,关键是显示核酸检测结果的APP平台也得统一才行。,0,0,0,2022-07-29 22:01:56,来自上海,51267764470,失落天际线
7125781786529530639,一个市都好几个检测码[捂脸][捂脸][捂脸],0,2,0,2022-07-29 21:13:31,来自山东,4305300897146893,山上飞哥哥
7125794268874785569,就像身份证一样，全国唯一一个就可以！每个地方一个规定二维码，真麻烦,0,0,0,2022-07-29 22:02:47,来自江苏,2779986301821744,孟阳明先生
7125770329507152674,我还以为我国新冠核酸检测结果通用那，原来是不通用互认的。,0,0,0,2022-07-29 20:29:05,来自河南,4419692850064259,爱生活的香瓜CT
7125771578335511308,认可了核酸检测试剂要节省很多,0,0,0,2022-07-29 20:34:27,来自浙江,69144934776,似曾相识7263
