7125735294401987368,[祈祷][祈祷][祈祷]25个生命，让人痛心！依法彻查事故原因，及时回应社会关切。,20,763,15,2022-07-29 18:13:25,来自陕西,2590084826406547,秦观鹊桥仙
7125751273622045440,船上一共30人，救起了4个，落水遗体25具，那还少一个呢。,7,80,1,2022-07-29 19:15:14,来自浙江,11740252566,丁丁146231919
7125772476491596581,快一个月了才看到消息,1,18,0,2022-07-29 20:37:45,来自河南,62786574958,我是我自己看看不平论
7125746232449843968,这太惨了，渔民真是不容易,2,12,0,2022-07-29 18:55:30,来自广东,110188172003,红牛牛888
7125750303395447586,25条活生生的命呀，必须彻查事故原因,1,31,1,2022-07-29 19:11:27,来自陕西,3386148421129992,岭楠说
7125750704731734814,天啦，25人，这个数字让人多么心痛，25个家庭失去了至亲。为遇难者默哀,0,17,0,2022-07-29 19:13:18,来自重庆,110943164432,颖尔妹纸
7125751627558093571,船上不是有救生圈吗？怎么还会有那么多人走了？,1,6,0,2022-07-29 19:17:16,来自广东,2683272701422957,修行学者
7125761141229683460,001遇难船上共有30人。经过连日来不间断搜救，海上搜救力量成功救起4名船上人员，搜寻到落水船上人员遗体25具。愿死者安息一路走好。,2,46,3,2022-07-29 19:54:10,来自湖南,505424877986728,自强不息余笙有你
7125742602573316904,事故发生，必须聪明原因,1,6,0,2022-07-29 18:41:27,来自黑龙江,4152208190628000,雨水044
7125733997380223747,25个家庭破碎了！唉！一路好走！,11,533,9,2022-07-29 18:08:55,来自山东,97564927018,LYR烟花易冷
7125736048265265933,25具遗体！[流泪]必须彻查事故原因！,9,156,7,2022-07-29 18:16:59,来自上海,993555120396158,你好kRyc
7125736885100102437,阳江海域之前已经发生过一次类似事故了，为什么不从中吸取教训呢。,2,84,3,2022-07-29 18:20:04,来自辽宁,12502660367,聪明的钢琴VA
7125734019303539496,彻查事故原因！,25,259,11,2022-07-29 18:08:11,来自上海,4111295352,遥晨
7125734439015678761,太悲催！遇险的都是年轻力壮的施工人员，为他们默哀,4,291,4,2022-07-29 18:10:03,来自上海,6943731631,菊花秋香
7125735428057039627,这么久的事情今天还推送消息？,5,89,4,2022-07-29 18:14:30,来自北京,95673034717,鑫鑫85685
7125740674007532302,我有点理解不了，中国海上事故死亡率这么高呢？其中一个原因海上救援的力量和密度严重不足，中国应该加强这方面的建设，确保中国公民在海上遇到危机时能够得到及时救助！船的沉灭不同于陆地车祸，它会持续一段时间，所以及时救援非常重要！这一点有些国家做的就比较好，这方面要加强,6,71,2,2022-07-29 18:34:31,来自黑龙江,105113821010,蕾绽遍天下
7125734726295716612,将近一个月的搜寻，总算还有4名幸存者，向他们庆贺！向遇难者致哀，生死无常，愿在天之灵安息吧！,5,142,6,2022-07-29 18:11:49,来自江苏,111292035827,江南烟雨Fie7
7125735308708823843,怎么会这样呢，30人只有四人被救出？,8,84,1,2022-07-29 18:13:30,来自新疆,104713671126,视野伯内特4f4
7125744431131001615,海上作业不穿救生衣吗？怎么那么容易遇难？,10,7,0,2022-07-29 18:48:49,来自广东,50047757194,手扶拖拉斯吉
7125734942692705036,希望彻查事故发生原因，及时回应社会关切！,4,86,3,2022-07-29 18:12:48,来自四川,3997453644730915,蓉城阿朱
7125738448174662437,没搞懂为啥船沉了这么多人死，照理会游泳加上船上救生圈之类不应该死这么多吧,19,39,2,2022-07-29 18:26:02,来自广东,2334971937963927,天高海阔hy
7125733968594486052,公司就这事故要破产了……,14,153,5,2022-07-29 18:08:21,来自湖北,52435882144,闲聊撩闲
7125737602829304617,7月2日？,0,14,1,2022-07-29 18:22:19,,56940577839,文鴦
7125749990119162659,救援人员一直都在打捞，绝不放弃一点线索，现在接近一个月的时间，只能说向救援人员致敬！向遇难者默哀！愿死者安息！！,0,51,1,2022-07-29 19:10:19,来自北京,1807204371149086,姐妹排行老四
7125748620187910915,出事这么久才爆出来啊！这么多人没了啊？25个家庭破碎了！走的一路走好，幸运活的早日康复,1,20,1,2022-07-29 19:05:58,来自福建,4073071678326775,屿
7125783815100220193,广东通报“福景001轮”相关情况：救起4人，搜寻到25具遗体。愿死者安息，一路走好。,0,4,0,2022-07-29 21:22:08,来自福建,1244263130604359,欧阳楚陌
7125743040949846824,船员都会游泳吗？,9,3,0,2022-07-29 18:43:21,来自河南,6986364839,食材味觉
7125733702751732491,海事部门已成立事故调查组，依法开展全面调查，彻查事故发生原因，调查结果将及时向社会公布,4,60,7,2022-07-29 18:08:07,来自河南,237932696570403,依然
7125733873195696907,马上一月了才报道？,5,74,3,2022-07-29 18:08:42,来自宁夏,97533617033,友爱橘子gw
7125733870796407556,船员真的是拿命工作呀,3,38,2,2022-07-29 18:08:42,来自天津,111177764015,灵魂的十万个为什么
7125736361843311390,彻查事故发生原因，期待结果。,1,20,1,2022-07-29 18:17:47,来自上海,993555120396158,你好kRyc
7125765211512636201,灾难已经发生，找到事故原因，找到预防措施，才是必须做好的,0,0,0,2022-07-29 20:09:16,来自北京,108580561785,东北璟斐的Vlog
7125734188350964480,希望所有人获救,6,29,3,2022-07-29 18:08:57,来自天津,84177389192,智者向军人致敬
7125766497297171240,7月2日12时许，福景001轮上3人被香港特区政府飞行队救助直升机救起，其余27人落水失联,0,5,0,2022-07-29 20:14:16,,93011077758,tipsyprincess
7125734607047328545,但愿一切安好，无人员伤亡🙏🙏,6,38,3,2022-07-29 18:11:15,来自江苏,5971617681,风过九洲
7125734306228077346,希望不要有人员伤亡[祈祷][祈祷][祈祷],9,33,6,2022-07-29 18:09:30,来自上海,2058751443738667,洁
7125735673273189131,这么久了还搜救？这怎么当时没报此消息吗？,1,11,0,2022-07-29 18:15:45,来自辽宁,20720532674,纵云川
7125784786488476423,明知有台风，为什么不把船上的人都撤下来？留在船上的人二十四小时穿着救生衣没？,0,2,0,2022-07-29 21:25:25,来自广东,107861554952,昂首迈向新生活
7125735419748336388,又是25个家庭的悲伤[祈祷][祈祷][祈祷],2,16,0,2022-07-29 18:14:31,来自福建,2541696139400088,兰花姐97
7125735946511287074,现在天气预报预报台风相当准确！为什么船停泊避风后不立即撤离或减少船上人员以降低风险？不要拿台风做借口，这明显是严重的安全事故，应追责！！,1,42,1,2022-07-29 18:15:53,来自江苏,3034295184418525,灵巧咖啡xe
7125750270738400000,依法开展全面调查，彻查事故发生原因，调查结果将及时向社会公布。向遇难者致哀，生死无常，愿在天之灵安息吧！,0,8,0,2022-07-29 19:11:17,来自北京,59191602651,13261901666
7125737453880607521,波涛汹涌、风急浪高，伤亡太过惨重了，二十五个家庭的顶梁柱就这么毁了，愿警钟长鸣，愿逝者安息🙏愿再也不上演类似的悲剧！,0,34,1,2022-07-29 18:22:12,来自河北,50577328190,作家书童诺雅
7125744597267055397,我很好奇。这几天已经天天预警和台风新闻和手机短信。怎么还有人出事,2,2,0,2022-07-29 18:49:41,来自广东,59350339091,甜米菓菓
7125762123325834017,阳江海域之前已经发生过一次类似事故了，为什么不从中吸取教训呢。,0,3,0,2022-07-29 19:57:51,来自吉林,110937955536,Cln525
7125747651005973284,现在天气预报都能预测出台风为什么不提前上岸，造成这么多的人员死亡事故，谁能负得起责任？,0,7,0,2022-07-29 19:01:49,来自安徽,50308741063,蓉蓉菲冉
7125764811216306981,依法彻查事故原因，及时回应社会关切！,0,5,0,2022-07-29 20:08:09,来自浙江,440285617205627,香雨浓情
7125777204646593283,当时明知有台风，为什么轮船还要作业？必须严查事故原因，严惩事故责任人。,0,2,0,2022-07-29 20:56:24,来自云南,8122467052,东方早晓
7125770703928034063,船上30人，救了4人，25人遇难，还有1人呢？[捂脸],0,3,0,2022-07-29 20:30:22,来自广西,4402064004226199,清香的米兰
7125767082511385384,希望彻查事故发生原因，及时回应社会关切！,0,2,0,2022-07-29 20:16:24,来自安徽,111551505965,随遇而安1332900
7125736857492701967,二三十个家庭破碎了[泣不成声],0,24,1,2022-07-29 18:19:14,来自山东,55306257100,侃村里村外
7125740684459770628,这么多人的重大事故，希望国家能关注，查清原因，让悲剧不再上演，谁的命不是命，千万千万注意安全[祈祷][祈祷][祈祷],0,12,0,2022-07-29 18:34:56,来自江苏,77398409346,咸豆浆咸豆花
7125754491425145600,25个家庭破碎了！彻查事故原因！,0,1,0,2022-07-29 19:27:48,来自辽宁,2805599455680104,名门世家W684
7125772480639664937,25个人呐，痛心！必须严查此类事故。,0,2,0,2022-07-29 20:37:25,来自山东,317139196074503,夏天的虫子1999
7125793854221501223,在海上作业就怕这样的事情发生,0,1,0,2022-07-29 22:01:11,来自湖北,92338260104,美丽素颜219
7125743706145817356,伤亡人数太多了。[流泪],0,11,0,2022-07-29 18:46:52,,2392972089627352,小马一家在海南
7125744435576587044,锚链断裂，走锚遇险，那么粗的锚链怎么会断裂,0,9,0,2022-07-29 18:49:07,来自河南,105914166100,Royal郑
7125744709032575759,救不回来的25个生命，痛心疾首，查清事故发生的原因，给大家一个交代,0,10,0,2022-07-29 18:49:38,来自北京,99610548542,爱读书的观察员
7125739060240483108,调查事故原因，向遇难者致哀。,0,8,0,2022-07-29 18:28:17,来自内蒙古,93284585152,上进花猫1C
7125734698391438080,在海里会不会游泳都是徒劳的，必须有穿救生衣，有淡水干粮才能活下来,1,11,0,2022-07-29 18:11:04,来自上海,50028118252,天高云淡好风景
7125736579473818383,彻查原因！,0,9,1,2022-07-29 18:18:29,来自山东,55306257100,侃村里村外
7125734240884491039,这么长时间才曝光？,6,49,4,2022-07-29 18:09:27,来自辽宁,6219850407,半城烟沙Q
7125738130472878884,都快一个月了，是我看漏新闻了？,1,2,0,2022-07-29 18:24:51,来自云南,50237939100,诺邓1
7125759629535167269,"敬畏大自然的力量！
恶劣天气要做好防护！
工程可以延期，生命不能重来！",0,3,0,2022-07-29 19:47:49,来自浙江,3935591415,召吾哥
7125757275180450590,太惋惜了，愿遇难者一路走好[祈祷],0,3,0,2022-07-29 19:39:08,来自河南,1345457126119582,我的女儿愿你平安一生
7125756632264639232,事故原因是台风引起的，但风来之前为什么不叫人员上岸？为什么船上人员遇险不及时空中救援拖延半天直至船沉香港飞行救援队才赶到救起一个人，可怜不？,0,4,0,2022-07-29 19:35:50,来自广东,1987548804296335,认真的沙滩LYU
7125763767837180713,必须彻查事故原因！及时向社会公布。,0,3,0,2022-07-29 20:03:42,来自北京,2621655279469680,勇往直前的西柚IF
7125750784084149006,救援人员一直都在打捞，向遇难者默哀！愿死者安息！！,0,3,0,2022-07-29 19:13:53,来自广东,75997254137,幸福的路芳
7125738356721337129,25条人命啊！多少家庭支离破碎，彻查事故原因，给遇难者家属一个交代,0,2,0,2022-07-29 18:24:57,来自新疆,184335909002219,九月菊花傲枝头
7125776996105782029,老金：损失太大，搜救无力，令人痛心！！！25位兄弟一路走好！家人节哀保重！！！,0,3,0,2022-07-29 20:55:19,来自四川,6437216979,好学水滴0
7125792068265345822,[祈祷][祈祷][祈祷]25个生命，让人痛心！愿逝者安息，早日找出原因，以慰在天之灵。,0,0,0,2022-07-29 21:53:36,来自广东,4164547164513427,微风白沙海阔天湛蓝
7125760489258648354,希望彻查事故发生原因，及时回应社会关切！,0,2,0,2022-07-29 19:50:57,来自江苏,93512935673,清潭碧水772
7125752356867670791,25条活生生的命呀，必须彻查事故原因,0,0,0,2022-07-29 19:19:45,来自安徽,87199353088,萍水4604
7125752115251217159,将近一个月的搜寻，总算还有4名幸存者，向他们庆贺！向遇难者致哀，生死无常，愿在天之灵安息吧！,0,2,0,2022-07-29 19:19:03,来自浙江,60314466038,水瓶中的天使
7125752273367646987,必须彻查事故原因，还死者一个说法[祈祷],0,4,0,2022-07-29 19:19:47,来自河北,110907630501,墨羽倾璇Anne
7125745800768144135,感谢救援队救援！25人看来都没有跳船[祈祷][祈祷][祈祷],0,7,0,2022-07-29 18:54:31,来自山东,879211556119519,正直云朵h6
7125738191495381772,太惋惜了，愿遇难者一路走好[祈祷],0,3,0,2022-07-29 18:25:18,来自宁夏,52762753119,蓉儿5607
7125741583819391758,25条人命啊！多少家庭支离破碎，彻查事故原因，给遇难者家属一个交代,0,4,1,2022-07-29 18:38:12,来自浙江,72655557045,甘露涓涓润
7125740508609610532,悲哀，25人遇难，25个家庭该有多痛苦呀。,0,6,0,2022-07-29 18:34:15,来自江苏,1011143029031790,勇者花猫hU
7125758077311550243,船上都没有救生圈吗？真是太惨痛的事故了[捂脸][捂脸][捂脸][捂脸],0,2,0,2022-07-29 19:41:36,来自广西,650531902330103,冷月星空88888
7125753780896842532,将近一个月的搜寻，才救上4名船员，向遇难者致哀，愿在天之灵安息吧！,0,2,1,2022-07-29 19:25:09,来自广西,100732702774,番茄100732702774
7125745621020984098,怎么天天都是事故，2022注定不平凡的一年[祈祷][祈祷][祈祷][祈祷],0,2,0,2022-07-29 18:53:07,来自安徽,72508700111,土掉渣的女神
7125799787022484262,25个家庭破碎了！一路好走！,0,1,0,2022-07-29 22:24:09,来自四川,51077847064,旺旺86507
7125744988063089448,太悲催！遇险的都是年轻力壮的施工人员，为他们默哀,0,7,0,2022-07-29 18:50:54,来自福建,4476825439308259,花间提壶666
7125738632685978408,还有一个遗体都没有找到,0,6,0,2022-07-29 18:26:09,来自北京,91568890553,伶993
7125736225322861353,都知道台风要来了，为什么还要出海？是认为还是天灾,1,10,1,2022-07-29 18:16:44,来自广东,1809102559,花生瓜子八寶粥
7125740030920098567,彻查事故发生原因,0,4,0,2022-07-29 18:32:09,来自河南,92320611416,congcong146
7125772397340853006,太悲惨了！向遇难者默哀！[祈祷][祈祷][祈祷],0,2,0,2022-07-29 20:37:33,来自安徽,85217618351,文竹2191
7125752826860454668,愿遇难同胞一路走好[祈祷][祈祷][祈祷],0,2,0,2022-07-29 19:21:47,来自广西,65838670272,寒江雪281411681
7125756994329871134,怎么会发生锚链断裂事故？海洋作业，安全责任重于泰山！,0,4,0,2022-07-29 19:37:50,来自江苏,99850666465,赢才有意思
7125755671311680259,太不幸了，愿逝者安息！[祈祷][祈祷],0,8,0,2022-07-29 19:32:47,来自浙江,3210180071269976,W且行且珍惜
7125741487837037325,25个鲜活的生命遇难了，安息吧！,0,6,0,2022-07-29 18:37:56,,48032290971661,远见卓识雪碧Lo
7125749717438841614,愿生者坚强，遇难者一路走好，家属节哀[祈祷][祈祷][祈祷],0,3,0,2022-07-29 19:09:40,来自上海,66888841689,想想还是爱自己
7125742960159359785,二十五条生命，二十五个家庭，二十五个顶樑柱，痛心。,0,6,0,2022-07-29 18:43:03,来自广西,65616208333,李姐62584
7125739404022661923,共有30人，救起4人，25具遗体，还有一人呢？,0,5,0,2022-07-29 18:29:10,来自湖北,107916034062,清闲的梦想N5f
7125748445214016297,好令人心痛的新闻啊！25条鲜活的生命就这样没了…天灾无情[祈祷][祈祷][祈祷],0,3,0,2022-07-29 19:04:14,来自辽宁,52329349668,霓裳轻飘
7125734531495166755,7月2日，这消息在海上传了一个月才传到陆上,0,14,0,2022-07-29 18:10:08,来自重庆,6723655713,宇宙喷
7125753562000982821,这又是一场重大灾难事故，惨痛,0,0,0,2022-07-29 19:24:43,来自江苏,905647055189501,学习解惑
7125733828760994564,7月2日？？？,1,22,2,2022-07-29 18:08:32,,87034430490,凯撒只条边牧
7125763402022486824,那还有一个人呢？一共30个人啊船上。遇难25个4个获救。还有一个还没找到吗,0,0,0,2022-07-29 20:02:12,来自广东,4248143587978813,我是正版大狮子
7125765232035037967,海上遇难，搜救工作遇到诸多困难，只救起4人。,0,2,0,2022-07-29 20:09:15,来自四川,60639992989,余建国688
7125767016950563624,救不回来的25个生命，痛心疾首，查清事故发生的原因，给大家一个交代,0,3,0,2022-07-29 20:16:17,来自河南,4265693520072605,直率海洋St
7125741965240877828,逝者安息，一路走好！,0,10,0,2022-07-29 18:39:59,来自湖北,2933116308306711,文倩美好岁月
7125778819361506086,船上一共30人，救起了4个，落水遗体25具，那还少一个呢。,0,1,0,2022-07-29 21:02:44,来自河北,80702984250,微尘50311
7125758641231381288,7月2日的事件，今天報道還是新聞嗎？,1,0,0,2022-07-29 19:43:45,来自福建,4321961357,水中的魚
7125754562799436574,看标题以为25人获救，点进来看到这个消息，痛心[流泪]。,0,0,0,2022-07-29 19:28:32,来自山东,71404661656,金属材料达人
7125744150674948898,应急救援预案？,0,1,0,2022-07-29 18:47:48,来自广东,15750625361,乐观的钢琴R2
7125739199626052366,飞机和大海的伤亡让人恐惧,0,4,0,2022-07-29 18:29:06,来自四川,58871174343,长发姑姑ml
7125740193675658014,海事部门已成立事故调查组，依法开展全面调查，彻查事故发生原因，调查结果将及时向社会公布,0,4,0,2022-07-29 18:32:34,来自湖南,3082673853048867,周小平的号
7125786908759999236,为遇难船员默哀！,0,0,0,2022-07-29 21:33:49,来自江苏,103208934425,欢快百香果jV
7125750835014992680,七月二日的消息，怎么今天才出来？三十个人只有四个人被救出，二十几个生命就这样没了。,0,2,0,2022-07-29 19:13:28,来自甘肃,2862723676771404,落了灰的记忆gh
7125761112309875489,阳江海域之前已经发生过一次类似事故了，为什么不从中吸取教训呢。,0,2,0,2022-07-29 19:54:05,来自吉林,764883956675799,下棋还可以
7125741412435460864,太悲剧了，多少家庭破碎了，大事故,0,4,0,2022-07-29 18:36:49,来自辽宁,2327028233936109,芬芳人生
7125760890838237989,这么久了还搜救？这怎么当时没报此消息吗？,0,3,0,2022-07-29 19:52:55,来自辽宁,3712401411154416,笑得太过分
7125750515522519819,船员真不容易，孤独，大风浪，海难，拖欠工资无人管，疫情不让下地，无奈啊！没人给撑腰！,0,0,0,2022-07-29 19:13:05,来自山东,585369455433892,快乐比莉4g8
7125750826710352647,说明一下，这次事故真好是台风正在要登录广东时间，风大数米高大浪，还有船是直接中间腰断的,0,2,0,2022-07-29 19:13:48,来自广东,3729167712007224,你想听点什么
7125743064333173517,25具遗体！[流泪]必须彻查事故原因！,0,3,0,2022-07-29 18:43:55,来自四川,95705558744,月香清风
7125742608647160611,真是悲剧啊，沉痛悼念遇难者！🙏🙏🙏,0,6,0,2022-07-29 18:41:45,来自吉林,4089794587537235,朴朴实实的低调人
7125734001528046343,心疼[流泪],0,51,3,2022-07-29 18:08:25,来自浙江,110944927755,小薪解说
7125733818077709071,这到底是不是“新闻”？,5,70,3,2022-07-29 18:07:31,来自北京,3162176948,xitianmen
7125741817085608741,[祈祷][祈祷][祈祷]25个生命，让人痛心！依法彻查事故原因，及时回应社会关切。,0,4,0,2022-07-29 18:39:06,来自上海,500993335497672,端庄星空5土根
7125749344867074828,将近一个月的搜寻，总算还有4名幸存者，向他们庆贺！向遇难者致哀，生死无常，愿在天之灵安息吧！,0,4,0,2022-07-29 19:08:38,来自湖南,2661239138287803,翼龙察打一体
7125775850737320704,希望彻查事故发生原因，及时回应社会关切！,0,2,0,2022-07-29 20:50:18,来自重庆,72633641211,高星海
7125774482887033608,人命关天严查,0,2,0,2022-07-29 20:45:29,来自河南,1305849837396684,看斗条发平论为什么用
7125749056793969440,但愿一切安好，无人员伤亡,0,2,0,2022-07-29 19:07:38,来自上海,92807089979,rainflower1
7125785389159367437,[祈祷][祈祷][祈祷]强台风不回港避风，呜呼哀哉！哪个领导下令的要彻查！,0,0,0,2022-07-29 21:27:42,来自广东,51907765786,远足19
7125786908357362468,救4人有3个是第一个到场的香港直升机救起来的，应急救援措施还得加强,0,1,0,2022-07-29 21:33:42,来自黑龙江,6581216042,胖佛爷
7125779640966398735,一个月的搜救,0,0,0,2022-07-29 21:05:04,来自湖南,54076216137,狐山诗行
7125758018453127971,海员不会水嘛，船体出一点问题都要爬上最高处,0,2,0,2022-07-29 19:41:20,来自安徽,2119504498541837,勇往直前进冲
7125737168579855112,台风信息 不是提前几天收到了吗？为什么没有上岸？人命关天,0,8,0,2022-07-29 18:20:48,来自广东,51782018055,春天152340570
7125796084986921758,必须要彻查真相,0,0,0,2022-07-29 22:09:17,来自江苏,60736325717,金牛楠楠猪
7125785616825975590,尽快调查事故原因，给死者一个交代！愿死者安息[祈祷][祈祷][祈祷],0,2,0,2022-07-29 21:28:50,来自江苏,99514368272,张先生2962204479526
7125749923403940639,彻查事故发生原因，及时公布调查结果,0,2,0,2022-07-29 19:10:24,来自广东,5527177183,雨一直很大
7125738858020504354,避险时锚链断裂，走锚遇险沉没。是一起责任事故吗？,0,3,1,2022-07-29 18:27:02,来自重庆,62522413219,瞓鬦嚞
7125793662914773800,几十条生命没有了，非常痛心，逝者安息，生者坚强！[祈祷][祈祷][祈祷],0,1,0,2022-07-29 21:59:36,来自江苏,55166209665,与人为善146293431
7125754687047303971,悲痛！愿逝者安息[祈祷][祈祷][祈祷],0,1,0,2022-07-29 19:28:33,来自北京,69558331503,青青草278
7125741960186675976,有台风就不要出海了,0,4,0,2022-07-29 18:39:30,来自北京,71041795831,丰富铁力8E8
7125739388071985928,祈祷世界平安 中国平安 不要有灾难。阿弥陀佛,0,2,0,2022-07-29 18:29:43,来自上海,1323444421008795,紫格子女装
7125741858827256591,有准备救生圈，干粮，淡水，手电等应急包?,0,3,0,2022-07-29 18:38:45,来自广东,101751485936,机智的星球4ST
7125738095278211855,向遇难者致哀，为获救人员道贺。,0,2,0,2022-07-29 18:24:06,来自内蒙古,102984099952,玉皇李员外
7125743782502826752,还有一人是不是还没找到？愿平安🙏,1,3,0,2022-07-29 18:46:14,来自广东,3712418432419261,想好的無名
7125744114187895582,7月2日出的事故，现在才发出来[捂脸][捂脸][捂脸][流泪][流泪][流泪][流泪],0,2,0,2022-07-29 18:47:38,来自广东,3579643514333710,用户章洋
7125743177734406924,活活的生命就这样没了，令人痛心啊！严查事故，追究责任。,0,2,0,2022-07-29 18:44:41,来自广西,4822158243,正大光明海风Jl
7125751578728416014,向遇难者致哀，生死无常，愿在天之灵安息吧！,0,2,0,2022-07-29 19:16:54,来自江西,18627311729,乡下过路人
7125742122711958285,希望彻查事故发生原因，及时回应社会关切！,0,3,0,2022-07-29 18:40:16,来自上海,97826064223,天师音乐馆
7125734540790137607,过去一个月了，新闻的新提现在哪？为什么才报道 我才知道,3,9,1,2022-07-29 18:10:41,来自江苏,4228008749,半滴水
7125737445794546465,彻查事故原因，还原事故原因，还家属事故真相。,0,2,0,2022-07-29 18:36:02,,50868007392,梦幻漂流瓶He
7125739536331588360,坚决查处轮船遇到的险情事故责任人，依法依规严格处理。,0,2,0,2022-07-29 18:30:01,来自甘肃,1020787060380925,刘德成7v3G
7125773918014980868,救了个寂寞,0,0,0,2022-07-29 20:43:33,来自山东,1525759981140536,金瑞泰数控设备中心
7125755506354045727,彻查事故发生原因，期待结果。,0,1,0,2022-07-29 19:31:54,来自湖北,6932722261,JZJBB
7125762617138316044,心痛，一路走好[祈祷][祈祷][祈祷],0,2,0,2022-07-29 20:00:03,来自山东,61495991732,智勇双全船帆HUg
7125749636643996428,但愿一切安好，无人员伤亡🙏🙏,0,1,0,2022-07-29 19:09:51,来自广东,78046355278,Lin22246
7125740465458594575,台风是属于一种自然灾害，损失惨重，令人心疼！,0,4,0,2022-07-29 18:33:22,来自广东,3777542546009363,神秘柳叶A7
7125767991807312640,彻查事故原因，愿逝者安息![祈祷][祈祷][祈祷],0,1,0,2022-07-29 20:20:00,来自广东,3523257439629656,清风20220509
7125733971283526411,心碎的新闻啊,0,10,0,2022-07-29 18:09:06,来自广东,2488948544532119,啦啦啦种太阳韵菡科技
7125747376866181919,25个家庭破碎了！唉！一路好走！彻查事故原因！,0,1,0,2022-07-29 19:00:31,来自江西,3051873046637863,白云5乌云
7125757740554863373,七月二号的事，叫新闻吗？,0,1,0,2022-07-29 19:40:36,来自北京,80383907962,74341
7125760463983854373,危险无处不在……愿每个人都能安全出行，平安回家！,0,3,0,2022-07-29 19:51:12,来自河南,4252551615624887,五丫头CuiCan
7125766248822260513,竟然没有上热搜,0,1,0,2022-07-29 20:13:55,来自贵州,2475717181584199,真珍日上
7125747670811034383,海上救援经常演习，还出现这样的严重事情，不应该啊！,0,1,0,2022-07-29 19:01:10,来自广东,109340974130,每一步3942
7125796949819327263,25个家庭破碎了，愿逝者安息一路走好。[祈祷][祈祷][祈祷],0,0,0,2022-07-29 22:12:56,来自福建,2581305926626510,喜欢花花的妤
7125737960217182980,彻查事故发生原因，期待结果！,0,2,0,2022-07-29 18:24:16,来自广东,6352020090,往事只能回味85951943
