7125656159658558211,说明了什么,14,17,3,2022-07-29 13:06:57,来自广东,51726686285,演员吴云飞
7125596303266202408,被同行挤垮了？,41,92,0,2022-07-29 09:13:48,来自山东,55306257100,侃村里村外
7125380543977816835,曾经的生鲜到家第一品牌，可惜了,0,99,4,2022-07-28 19:17:29,来自福建,4142560058023691,薇薇逛红尘
7125597792042746627,每日优鲜的确不行，根本不新鲜，而且几年前我去面试，问我什么时候结婚要孩子刨根问底一大堆最后也没要我,24,158,3,2022-07-29 09:20:24,来自北京,67363855757,北京小松鼠姐姐
7125376773726290726,怎么做到上市公司的？,9,64,0,2022-07-28 19:02:50,来自辽宁,102522368682,多肉的多肉植物
7125601878465512203,每日优鲜总部人去楼空，6月份才刚刚入驻的办公室哦[流泪][流泪],2,33,0,2022-07-29 09:36:33,来自北京,91576362252,多尔duoer
7125585190386795299,感觉是被美团干掉了,35,161,5,2022-07-29 08:30:54,来自北京,63547086640,高秋红珍珠学堂创始人
7125619661177799460,"我在石家庄。19和20年用每日优鲜特别多，除了线下买菜，每周差不多都会在每日优鲜消费150左右。到了21年，感觉东西太少了，客服打过好几次电话问我为什么没有继续使用。
实话说东西算不错的，尤其是水果和酒水，品质价格都不错。蔬菜对比石家庄市场价格贵一些，不错品质和种类确实可以。
有一次买的火龙果比标注重量轻一些（大概20g吧），货品送达的时候直接退了我四毛钱。",0,21,0,2022-07-29 10:45:05,来自河北,3711603503798960,美食家夏琳9U9b9
7125437017340560135,这几年每日优鲜一直是我买菜的第一选择，每天下班坐在车上开始下单，我到家正好菜送来，省的每天晚九点到家我周末去大采购，还得吭哧瘪肚的提回来…为什么这个有需求的产品会到这个地步呢？,2,1,0,2022-07-28 22:56:06,来自山西,4344924354393143,平行宇宙M
7125602874428015372,每日优鲜我没去买过。只能说老板太有钱了。三年亏损100亿，历害[赞][赞][赞],11,49,1,2022-07-29 09:39:01,来自广东,4094219877356909,坝坝28
7125375898484278028,请问这是为社会输送人才吗？,3,96,1,2022-07-28 18:59:28,来自辽宁,2692179850,核弹财经
7125377432097899303,公司进行大的调整，肯定要影响股价。这样的公司怎么能让上市。,1,55,0,2022-07-28 19:05:17,来自内蒙古,103893639330,一生平安5456848286818
7125601216079725323,在上海困难时期，一直用每日优鲜，充五百用好久。大袋子装垃圾还装的多。我可以各种薅羊毛，一分钱一毛钱特惠。那时只出不进的日子，要养活孩子，还得吃饭。对每日优鲜的印象挺好的。同时，在2015年开始用叮咚买菜，然后用的每日优鲜，京东到家，后来用盒马，直到多多买菜。各种薅羊毛，比去楼下的菜市场便宜好多。疫情后带孩子回老家，这里很落后，一开始都没线上买菜，刚刚有的美团和多多买菜。即便东西也便宜挺好的，我老家这里的人都不买，地推拉客都不好使，他们不会网购，没支付宝，他们只用微信……连头条也不看[大笑]每天都是数落数落这家，数落数落那家，非买大马路摆摊的。,12,53,2,2022-07-29 09:33:55,来自辽宁,50059928815,阳阳小白
7125596528798597928,还好，充vip的钱退了点回来,3,6,0,2022-07-29 09:14:57,来自浙江,6101904867,sammi0801
7125599463372145419,看似一棵参天大树，实际里面已经掏空了。可惜了！这么有人气的实业。前几天刚刚买过东西，发现没有以往的马上送货，只有晚间的一个时间段可选，但终究还是已送力不足要求退费了。唉，建一座大厦要铺垫投入很多很久，坍塌下来只需片刻。无论怎样，还是感谢每日优鲜曾经带给我的那么多的便利和友好。,2,88,2,2022-07-29 09:26:56,来自北京,1191521175483821,泥泥猫猫泥泥365
7125603334975243008,"曾经是每日优鲜的忠实会员，大概是从去年开始，在市面上各大超市的线上服务和美团买菜这些的对比竞争下，作为消费者，真实感觉到每日优鲜确实性价比不高。
中间几次陆续接到客服送券激活的活动，我还会去采购一波，可是后来会觉得这些活动也一般，就基本放弃每日优鲜了。
一点点看它走向衰败，倒是没什么可惜不可惜的，生意就是这样：战略不对，卒；风控不及，卒……可卒的地方实在太多太多了，有时候甚至是任由一只蚂蚁在你办公室行走，你的企业都会卒。",1,35,1,2022-07-29 09:40:44,来自北京,111086560182,maoniangxiao
7125624292410721024,现在这个情况，估计投资人也不愿意烧钱了，下半年，人去楼空的企业会有不少吧，写字楼的空置率将会增加……,2,12,0,2022-07-29 11:08:10,,110957212979,商业地产参谋
7125582073410274060,疫情之下确实扛不住。别说企业没责任了。抗了两年了。不容易,28,226,6,2022-07-29 08:19:28,来自北京,4578091742,小驴子的臭美心境
7125588761228296971,还是当保安好最后一个遣散的,9,57,1,2022-07-29 08:45:31,来自四川,5756446514,老是怎么老是
7125441106170725150,20亿投资6个亿回扣,2,18,0,2022-07-28 23:12:25,来自山东,109234591292,起个名字真j费劲
7125598732179571497,国家应该管管互联网企业了,5,50,4,2022-07-29 09:23:26,来自北京,50507624408,乐观的考拉熊小白鸽
7125597828021404456,保安是个好保安，明知人去楼空了还要坚守岗位，都不考虑下月工资谁发吗？,5,15,0,2022-07-29 09:19:49,来自北京,97189805238,皮皮玩坏了
7125380528802726671,公司进行大的调整肯定会影响股价。,1,5,0,2022-07-28 19:16:28,来自新疆,6137087437,如意如意0909
7125585534973461289,说实话之前从每日优鲜买过很多次东西，还充了会员，前两年带孩子出不去门，它真的方便了我，但今年用的少了，因为价格真是高了，而且优惠力度也小了，前段时间上去看看竟然没有30分钟送达了，次日达就真的没有优势了，毕竟比某东要贵。,6,43,1,2022-07-29 08:32:00,来自北京,105543285500,小张儿是我的
7125654151161873159,"如果资本进入就繁荣，资本撤出就一地鸡毛，那么到底谁说了算，资本吗？资本是最敏感的！
每日优鲜北京总部人去楼空：千余名员工被遣散，保安称明天不用上班了",0,3,0,2022-07-29 12:58:46,来自河北,3334154721958140,生活不易愿被温柔以对
7125585212570436384,还有充值钱怎么办,16,36,2,2022-07-29 08:32:06,来自北京,637362767935709,睿智河流Zy
7125574018119271200,上海那时候 每日优鲜都抢不到下单 现在突然倒闭[抠鼻],6,12,3,2022-07-29 07:48:16,来自上海,2666092571,烟雨袭人
7125376069923504899,[捂脸][捂脸][捂脸]每日优鲜还上市了？我都没怎么用过,1,62,1,2022-07-28 18:59:43,来自北京,3017803115,奇妙豆子q7
7125599028657734400,大股东腾讯要不要对员工负责啊？,1,3,0,2022-07-29 09:24:27,来自广东,2909050163,渝鱼
7125376398763983655,下了个每日优鲜和叮咚，目前叮咚还在用着,2,14,0,2022-07-28 19:01:33,来自北京,79796064607,浪漫只是个故事
7125626714361152263,办公室这么豪华，员工工资那么高，这样的高科技公司，倒闭太可惜了。,1,1,0,2022-07-29 11:12:21,来自山东,58180996464,PrometheusMountain
7125584052102497031,这个软件确实很久没用过了，印象不好。还有京东物流,9,59,3,2022-07-29 08:26:45,来自北京,104501711560,张大嘴哈哈哈
7125601528480006944,又是跑路[泪奔],1,1,0,2022-07-29 09:35:10,来自广东,103191089018,小段有话
7125556745594143503,互联网企业千万不要承租高额租金的办公楼，这是发展的第一步。,2,32,1,2022-07-29 06:40:51,来自甘肃,1138696162122333,百禾畔官方
7125579947288380194,现在的企业都想甩包袱！员工缴纳社保成了包袱,0,21,1,2022-07-29 08:10:30,来自江苏,101509432187,瑞雪45931
7125557208376673058,城投国资这种损失，是否有人要负责？,1,4,0,2022-07-29 06:42:29,来自青海,105280570302,豚熊
7125376770114716420,请问这是为社会输送人才吗？,1,6,1,2022-07-28 19:02:34,来自安徽,84229077306,偷闲享受一下
7125405353369469734,我里面还有500块余额，花不掉了，怎么办啊[捂脸][流泪][流泪][流泪],3,0,0,2022-07-28 20:53:07,来自上海,51005374316,流氓飞儿1
7125570582896182028,吃亏的是普通员工，股东早就赚的盆满钵满了,13,145,1,2022-07-29 07:34:51,来自江苏,104596603456,烽烁8688
7125463529591325444,有投资就有风险，每日优鲜是受疫情影响啊。,2,1,2,2022-07-29 00:42:46,来自新疆,55024722840,挑灯看剑SG
7125673966475838212,网传每日优鲜公司解散，业务取消吗,0,1,0,2022-07-29 14:16:20,来自安徽,1679689086418110,活泼铅笔
7125613274074268420,想问，公司拖欠工资多久算违法？,2,3,0,2022-07-29 10:19:14,来自北京,88276032010,U克里里
7125578800272491298,以前还行，后来价格高种类少。我后来都在叮咚和美团买了。,15,31,2,2022-07-29 08:06:21,来自天津,111081385176,我爱喝汤0210
7125535384431690536,每日优鲜是我真正喜欢使用的APP，太可惜啦,3,61,2,2022-07-29 05:19:30,来自天津,99385941553,哈利嘟嘟妈
7125692477063185187,不是吧，上周还买他们家冰激凌生鲜啥的，都很好～4 5月上海封控时还和单位一起保供，让我们抗过菜篮子紧张的日子。真是好可惜啊～能不能扶持一下，里面好多东西还想继续买~,0,0,0,2022-07-29 15:27:10,来自上海,59741328848,上官真儿2
7125574228116161287,为何中国的企业总是亏损呢？,17,34,1,2022-07-29 07:49:04,来自北京,78282109851,快乐每一天256361093
7125569041062331149,去面试过，四个字，血汗工厂,2,40,0,2022-07-29 07:29:03,来自江苏,3914022497,馋嘴的狐狸
7125456908915655462,跟合肥的投资水平比，差的太远了。,1,6,1,2022-07-29 00:15:21,来自浙江,93500337294,合肥大都督
7125592840503690017,一直用每日优鲜，很方便，货真价实，售后也很好，后来，常买的商品越来越少，老是没有货，取而代之的是替代商品价格越来越高，也就很少来看了，每天都能在小区里看见不少送货的，看着生意挺好的啊。京东物流也一样，肯定不会再用，包括京东商城，越来越不行。,1,15,0,2022-07-29 09:01:33,来自北京,17933968812,胜利的博弈
7125599695489286942,一业兴，百业衰。这唯一的，就是核酸。,0,13,0,2022-07-29 09:27:30,来自天津,53235288530,开心可可豆豆
7125600508849079074,好好公司说破产就破产，那么多员工又要失业没事干了。搞哪一行都不易！,0,10,0,2022-07-29 09:30:19,来自江苏,3513657683881735,正能量善良精灵
7125594334141350670,良心保安，竟然坚持到最后一个走,3,9,1,2022-07-29 09:06:59,来自北京,830884234933811,cod是我的名字
7125626502313804547,每日优鲜在疫情最开始的时候解决了我们不足不出门的生活，送货快东西多。不知何时东西越来越少，价格也贵，再看已经变成云超了，它已不再是最初的那个每日优鲜了。挺伤感的，没有了每日优鲜。,0,2,0,2022-07-29 11:11:49,来自江苏,1376230794330651,臻杂选
7125558535081198367,社保负担太重，企业交的大部分都与员工无关，这个费用是用工成本，实际上是企业和员工共同承担,0,0,0,2022-07-29 06:48:19,来自北京,941659570314237,热闹明镜ky
7125584676294624035,自从盒马推出相似业务之后，我就不太用每日优鲜了。凡事怕比较。,3,14,0,2022-07-29 08:28:47,来自江苏,69639697407,生于上世纪1
7125651912640905991,出来看看，报道报道，怎么避免以后啊@央视新闻 @央视网 @央视财经,0,0,0,2022-07-29 12:50:18,来自北京,2910626916,一只快乐的小马驹
7125595062239019809,怎么说好呢，也是提供了就业，资本干预下出现的昙花一现，可能会过日子的人一定赚到便宜了，还有就是提供僵尸客户注册的自媒体人赚了钱，薅了羊毛，很多平台app只管数据不管真假，就有专门负责推广得来赚这个钱，但是对长期来说一定永没有,0,10,0,2022-07-29 09:09:58,来自山东,83989380462,那年明月照白头
7125632704418628386,赞一下保安，尽职尽责，人去楼空了还站好最后一班岗。,0,0,0,2022-07-29 11:35:08,来自广西,65616208333,李姐62584
7125597743464792832,6月刚搬新家，如今已经人去楼空。[捂脸],1,2,1,2022-07-29 09:19:36,来自重庆,103288789863,云雀0909
7125570596809098024,2020年疫情最重的时候，都靠在每日优鲜上买菜，希望每日优鲜能够渡过难关,3,16,3,2022-07-29 07:34:14,来自北京,51678225048,麻辣烫133280841
7125448344432149282,不应该追责吗,2,14,0,2022-07-28 23:40:15,来自山东,6083565976,十年78376333
7125599120332768012,这里距离机场直线距离仅有2公里，如果创始人要跑路，最快只需要20分钟。[捂脸][捂脸][捂脸],0,6,0,2022-07-29 09:25:41,来自北京,3078225569262563,努力的劳动人
7125598536775303940,国家应该重视怎样避免老板卷款跑路,0,6,0,2022-07-29 09:23:32,来自黑龙江,86899378153,旺旺fff
7125594459932508964,为啥中国没有拿得出手的好企业？值得深思,3,14,2,2022-07-29 09:07:08,来自北京,12787737439048,Fly觅金社
7125378440215266061,看来是生意不景气吧！员工都要解散了？,0,2,0,2022-07-28 19:08:44,来自北京,100255266103,用户周喜成
7125376411824636713,欠了我们140万,4,28,0,2022-07-28 19:00:26,来自北京,4389710105682311,只是很遗憾
7125598622389338914,每日优鲜北京总部人去楼空,0,6,1,2022-07-29 09:23:02,来自北京,62703445295,搜别墅
7125606885164090116,买过的人都知道，东西坏还不新鲜，最重点就是8两称，当客户是傻的，不知道是仓库问题还是老板就默认这样行为呢？,0,6,0,2022-07-29 09:54:34,来自广东,106297202706,语而不语
7125653959393690376,每日优鲜我没去买过。只能说老板太有钱了。三年亏损100亿，历害[赞][赞][赞],0,0,0,2022-07-29 12:57:50,来自广东,352294526269438,动感XMM
7125605676558844707,这么大规模的亏损，它不破产谁破产,0,4,0,2022-07-29 09:49:52,来自北京,6788989196,黑土地上的王子
7125409638908478220,我还有兑换进去的85元，刚才无法下单了,4,0,0,2022-07-28 21:10:04,来自浙江,6902109241,cysheep
7125598436904665856,还是搞好集贸菜市场，社区便利店靠谱,0,9,0,2022-07-29 09:22:14,来自广西,72414559299,行者无疆—勇者无畏
7125655097727730466,20年河东20年河西。网络资本上市泡沫后遗症,0,0,0,2022-07-29 13:01:56,来自上海,2198629301889711,自由的春风YO
7125598954812867362,我前几天还在想一个事情，不要享受会员之类的，消费一次就买一次单，我不想占你便宜，你也别坑我,0,4,0,2022-07-29 09:24:10,来自广东,628566181025547,钟和阿佳
7125615695756591906,每日优鲜北京总部人去楼空：千余名员工被遣散，保安称明天不用上班了 。市场经济的正常现象，见怪不怪！优胜劣汰，自然规律！,0,0,0,2022-07-29 10:28:39,来自安徽,95791042781,双木成林493
7125376320741491471,想不明白，这种公司怎么能让上市。,4,59,3,2022-07-28 19:00:13,来自湖南,63794649923,绿然果业
7125596898782233358,收了会员费就人去楼空了[笑哭][笑哭][笑哭][笑哭],0,3,0,2022-07-29 09:16:44,来自北京,78205349327,Miss柒7
7125603380872905483,和公司一起从北京最繁华的互联网公司聚集地之一的望京，搬到了26公里以外的顺义博润科技园。这里距离机场直线距离仅有2公里，如果创始人要跑路，最快只需要20分钟。,0,4,0,2022-07-29 09:40:45,来自天津,2946317859160782,大滨读书健身
7125602753602175774,互联网正在退潮，现在我提出这个观点都没人喷我了。每日优鲜不是第一个也绝不是最后一个，资本和互联网强行培养出用户的所谓刚需，常年优惠勉力维持活跃而已，一旦融资困难立刻崩塌,0,3,0,2022-07-29 09:38:31,来自北京,94103260816,天下第二8698
7125611787642274560,6月刚搬新家，如今已经人去楼空。[捂脸],0,2,0,2022-07-29 10:13:26,来自辽宁,2630506346725134,猫猫3109
7125376486433014559,哎[捂脸][捂脸],0,5,0,2022-07-28 19:01:10,来自北京,111636983363,宇宙宇
7125589061036720930,严厉追责！,0,2,0,2022-07-29 08:45:38,来自江苏,70967116251,青青岛的海风
7125640152399266568,部分这个词的使用的很恰当 99.9999999999%也是部分。,0,0,0,2022-07-29 12:04:22,来自河北,285517984048460,乐观的微风HX
7125441055017190179,公司进行大的调整，肯定要影响股价。这样的公司怎么能让上市。,0,1,0,2022-07-28 23:11:42,来自内蒙古,53326425477,月亮之上3978
7125604513570472704,有证据吗？,0,0,0,2022-07-29 09:45:18,来自山东,2383383935090424,智慧香瓜zx
7125605618173674254,卖不完就会损失，原来公司就有美日生鲜的贩卖机。,0,0,0,2022-07-29 09:49:32,来自河北,111062558926,IT三板斧
7125387767349314339,也不能把所有的企业都搞垮了。还是要给大家留条活路啊。,0,2,0,2022-07-28 19:44:36,来自北京,105716847198,丰厚跨年
7125382167991223048,每日优鲜愿地解散，部分员工离职。公司目前正积极寻求一切可能的方案，最大限度保障员工权益。,0,2,0,2022-07-28 19:23:21,来自江苏,1011143029031790,勇者花猫hU
7125564658966594334,太好了，生鲜实体店贺贺,0,2,0,2022-07-29 07:12:02,来自江苏,63185373336,仁爱小鱼Ni
7125451571433587497,这家公司老板人品就不好,0,0,0,2022-07-28 23:53:08,来自北京,5732072151,海总001
7125622821354488611,每日优鲜真不错，18年用到现在，可惜最近30分钟送货上门的都停了…,0,0,0,2022-07-29 10:56:36,来自江苏,73719028122,哎呦也不错哦
7125456481637794571,美国投资者被坑惨了，估计会提起诉讼！,0,1,0,2022-07-29 00:13:30,来自北京,108881123250,男儿当自强6698
7125672536930829071,本人预测 叮咚买菜也快了,0,0,0,2022-07-29 14:09:42,来自北京,104581435637,心中无魔却难成佛
7125385805346603816,每日优鲜在深圳多少年轻人在用。我还没有用过。,0,0,0,2022-07-28 19:37:11,来自江苏,61772094799,沉默的人
7125618630880363304,防疫要注意方式方法。,0,1,0,2022-07-29 10:40:30,来自北京,105716847198,丰厚跨年
7125380815663514399,在美国上市条件太简单了，这样的公司可以轻松上市圈钱，不过股价跌的也快,0,2,0,2022-07-28 19:18:01,来自河南,184312840854135,Ycy君莫笑
7125427109514248972,公司目前正积极寻求一切可能的方案，最大限度保障员工权益。,0,0,0,2022-07-28 22:18:05,来自广西,80812057463,不知道啊不容易啊
7125382889482519307,生鲜电商打价格战，战败是必然，不败是偶然，取胜是高质高价高端人群，求败是低质低价,0,2,0,2022-07-28 19:26:13,来自北京,3699231659,势为
7125384792119853836,已经没有当日达了,0,0,0,2022-07-28 19:33:46,来自北京,3795139452476620,大熊88998899
7125458330830963468,今天刚下的单啊[我想静静]，没发货,0,0,0,2022-07-29 00:21:24,来自广东,1605537900,丿赞丶yl
7125382172294316836,刺激，我还是更喜欢没有涨跌幅限制的,0,2,0,2022-07-28 19:23:09,来自陕西,2639280243474855,漂泊的虎仔
7125589011670205225,"市场应该还是需要生鲜行业的，有条件的应该可以""入场""了，现在的这个可能是在规划[尬笑]。",0,0,0,2022-07-29 08:45:38,来自江苏,6044020459,唠嗑啊9IVo
7125596410019398441,解散了怎么缴纳？哪来钱？[发怒],0,0,1,2022-07-29 09:14:19,来自江苏,3421290152861495,辉哥随手记
7125408810030334751,疫情期间就开了没几天，感觉就不是好现象。本来跟他们还有个合同，还好后来没合作。,0,1,0,2022-07-28 21:06:40,来自上海,50951006104,困境反转DAVID王
7125399685090607883,华尔街投行和这些骗子公司沆瀣一气，坑害普通投资者,0,0,0,2022-07-28 20:31:11,来自广东,104453590394,Soccernow
7125647603421168414,是不是预制菜也凉了,0,0,0,2022-07-29 12:33:16,来自上海,110395990520,yoghourtkkk
7125425704388723486,徐正不要公司了？生鲜难做,0,0,0,2022-07-28 22:12:09,来自青海,62975300318,杭君
7125551917241467687,好歹让我体验一回再关呀,0,0,0,2022-07-29 06:23:35,来自江苏,73654780541,虞城严哥
7125381890395783977,看样子还是不挣钱啊！要挣钱还解散,0,1,0,2022-07-28 19:21:53,来自安徽,76225764504,玻璃芯hjay
7125377268993753892,为啥不换个地方解散[灵光一闪],0,0,0,2022-07-28 19:04:17,来自广东,3001008081,裴多斐
7125402164377780996,每日优鲜宣布解散融资失败。,0,0,0,2022-07-28 20:41:06,来自浙江,67368141751,1314999王
7125406368244712232,叮咚优惠券好久没发了 我也好久没买过叮咚 也有凉凉的感觉！,0,1,0,2022-07-28 20:56:39,来自上海,64890593425,马宾王
7125420261284905762,我被安徽呆萝卜骗过一次，后面我再也不充钱了！,0,0,0,2022-07-28 21:50:24,来自江苏,4370069728,炒股壮阳
7125442200724800295,真是，钱都嚯嚯了,0,2,0,2022-07-28 23:17:20,来自山东,1944389399619704,小王子的星星
7125456978192925443,这么大的一个盘子，说解散就解散了？,0,0,0,2022-07-29 00:15:28,来自广东,58764527940,旭日初升中国
7125380630959538958,受此消息影响，每日优鲜美股盘前跳水，一度跌超40％。,0,1,0,2022-07-28 19:17:35,来自重庆,111536897727,孤独漂11
7125379045663114016,金融界≈分道扬镳[呲牙],0,0,0,2022-07-28 19:11:19,来自北京,4193065008,T看看在说T
7125395545698517794,怪不得最近看不到每日优鲜的配送员了！原来如此,0,1,0,2022-07-28 20:14:38,来自北京,5966696800,蓝色海洋7388
7125376100708139806,这是要倒闭啊,0,6,0,2022-07-28 18:59:43,来自湖北,5488050440,感同身受就是个笑话
7125402038699770624,请问这是为社会输送人才吗？嘿嘿嘿嘿嘿嘿嘿嘿加油努力,0,1,0,2022-07-28 20:39:55,来自天津,61023407383,旭日東升170341625
7125678686757798696,实控人跑路了吗 务必抓捕归案,0,0,0,2022-07-29 14:33:38,来自山东,6641487735,窗台上的猫Vlog
7125596108008964864,四年亏100亿，企业倒闭了，创始人和高管就不会少拿，都变成富人了,0,6,0,2022-07-29 09:13:11,来自河北,5530622841,cpicqhd007
7125603702299198216,被同行挤垮了？夕夕买菜？？！！美峦？？疫情影响？？？！！求解！,0,3,0,2022-07-29 09:42:04,来自浙江,72655557045,甘露涓涓润
7125596772939875102,每日优鲜的东西不便宜，这是倒下去的原因。,0,7,0,2022-07-29 09:15:59,来自北京,59337873813,大佬赵666
7125603888212198158,"我以前一直用每日优鲜，挺好的。
我相信没有人会希望自己建立起来的企业倒闭，只不过复杂因素太多了",0,3,0,2022-07-29 09:42:49,来自山东,1412186469565613,星空传媒陆肖
7125598804732363532,倒闭了，苦的是普通员工。,0,3,0,2022-07-29 09:24:29,来自内蒙古,81768906136,兰兰26884
7125597918488838946,亏的就是员工！,0,3,0,2022-07-29 09:20:13,来自吉林,4468853038130604,用户小禾青青
7125678527890228006,其实都是疫情的原因，倒闭了一批又一批的企业。,0,0,0,2022-07-29 14:33:53,来自河北,110289447460,AA楚楚283
7125606533123293965,谁来告诉我多多买菜，美团优选何时倒闭，人去楼空[捂脸],0,4,0,2022-07-29 09:53:04,来自江苏,52259650262,在谁一方lfy
7125611535368209187,良心保安，竟然坚持到最后一个走[赞][赞][赞],0,1,0,2022-07-29 10:12:38,来自河北,95471984598,平安人生97274
7125597790449271586,每日优鲜是我第一个买菜送到家的app 因为身体不好解决了我买菜的大难题。那个时候我觉得真的蛮价廉物美的。感谢每日优鲜。,0,5,0,2022-07-29 09:19:48,来自江苏,6717786692,希望jzhx福
7125643189532476167,每日优鲜的底层员工都是三方的，这么一看，反而是好事？三方每月延迟十天半个月的发工资，也不交社保，倒是没那么多欠薪麻烦，类似的美团买菜叮咚买菜都一样，看下一个是谁了。。,0,0,0,2022-07-29 12:15:57,来自北京,6336260395,太叔青
7125598132738065186,疫情之下谁又能独善其身？疫情之下有人欢喜有人忧。,0,4,0,2022-07-29 09:21:07,来自北京,2252215063422672,小丽0602
7125618241477051143,互联网的公司的高薪时代慢慢开始结束了。,0,1,0,2022-07-29 10:38:47,来自北京,5363925334,红胡子巴巴罗萨
7125595753579168519,高管弄家新公司继续，可惜了一线员工失业了,0,5,0,2022-07-29 09:12:16,来自北京,62378274764,SHGQUN
7125615321797083915,早就预测过，只是晚了一点，腾讯也救不了每日优鲜，啥模式也没用,0,0,0,2022-07-29 10:27:18,来自上海,73088202290,水果女王18
7125603574398305059,国家应该管管互联网企业了,0,4,0,2022-07-29 09:41:38,来自山东,60103664899,老班长165547779
7125613368727405323,本质还是生鲜电商没有解决生鲜行业的效率和成本，只靠烧钱补贴，没有盈利。生鲜电商我只看好社区团购，其他倒闭是迟早的事。,0,4,0,2022-07-29 10:19:39,来自广东,108310738912,浩乚621
7125606414449509131,可惜了，以前挺好的,0,4,0,2022-07-29 09:52:36,来自北京,55456747316,梦想170411848
7125656990508122887,公司倒闭很正常，这么多年我都干倒闭十多家公司了。,0,0,0,2022-07-29 13:09:47,来自北京,783275959797464,will.i.am
7125597734467912448,供应商惨了，钱打水漂了,0,6,0,2022-07-29 09:19:35,来自天津,57823487605,现实问题的思考者
