7125628034912535304,之前每日优鲜加盟店 注重客户体验 加盟商数据难做 …,0,0,0,2022-07-29 11:17:23,来自山东,92459550048,贝贝4L9t
7125602988462883620,是疯狂融资套现跑路模式吗,0,5,0,2022-07-29 09:39:24,来自北京,6873593497,北京润德堂
7125653861234180879,客服都跑了[捂脸],0,0,0,2022-07-29 12:57:00,来自浙江,98491431232,大巴888888
7125602115120120576,还有三千块的礼品卡怎么办？,0,4,0,2022-07-29 09:36:16,来自北京,5815003717,清舟Y
7125641350787711748,竞争激烈啊，这么好的企业都倒闭了？？,0,0,0,2022-07-29 12:09:33,,4147011246107054,山水与小溪
7125607360382993188,可惜了，用了好几年每日优鲜，后来有了叮咚买菜，感觉叮咚的菜比每日优鲜好，就一直用叮咚，前俩月叮咚撤了，没想到每日优鲜也撤了,0,5,0,2022-07-29 09:56:19,来自天津,101300558306,窗外的公园
7125605105822532387,倒霉的永远是供应商,0,3,0,2022-07-29 09:47:36,来自北京,6788989196,黑土地上的王子
7125605105118249728,都是游戏一场吧,0,4,0,2022-07-29 09:47:31,来自河北,110212556807,清白之年214
7125606046764385039,竞争太强了,0,4,0,2022-07-29 09:51:11,来自海南,888819673741523,风姿卓越芒果5i
7125609433505252110,这些平台基本惯用套路就是，建立平台并迅速扩张赢得足够数量储备资本然后诱惑社会融资进入。最后收获资金关闭平台结束企业或者跑路。这些都是这样操作的套路。,0,2,0,2022-07-29 10:04:17,来自广西,11680395532,爱吃的帅帅兔儿
7125600355378938656,第一次看到这家公司 却是跑路的消息,0,4,0,2022-07-29 09:30:14,来自北京,53499038782,非凡宇宙vB
7125608913814340388,账号注销都不行了,0,3,0,2022-07-29 10:02:18,来自北京,4033472404404232,步上夏娃后尘
7125603553255310095,搬到順義，臨近機場，為了跑路，方便快捷～～,0,5,0,2022-07-29 09:41:39,来自北京,1125503217187975,wheat007
7125611065350095654,用过每日优鲜的！还是有好多粉丝的！高层管理团队有瑕疵！基本员工最受苦！,0,4,0,2022-07-29 10:10:42,来自北京,82475585580,赤心商贸！
7125600974160315168,现实很骨感,0,4,0,2022-07-29 09:32:47,来自上海,104018562543,云妮167
7125624338425955113,"曾经是多么光鲜……
令人一声唏嘘——[微笑]",0,0,0,2022-07-29 11:02:31,来自广东,111602760357,小柚子希希
7125604462995358499,在阅读这篇文章的同时 叮咚买菜给我发来了14元优惠券[马思纯的微笑][马思纯的微笑][马思纯的微笑],0,4,0,2022-07-29 09:45:08,来自北京,2563667122201228,Nicolevi
7125663014124421929,以前经常用每日优鲜，最近一年用的少了，价格上没有优势,0,0,0,2022-07-29 13:32:46,来自北京,50399882521,小新老师好呀
7125590331231961887,没了资本的加持，根本玩不下去，更别说耗费巨资的前置仓模式,0,5,0,2022-07-29 08:51:12,来自北京,610942376482663,mufeng622
7125643564243043104,只有平台没有实体，随时跑路。这就是中国互联网的现状。都是平台盈利上下游累的要命不挣钱,0,0,0,2022-07-29 12:17:40,来自天津,94443140513,Chris
7125633048642339599,员工们可怎么办啊,0,1,0,2022-07-29 11:36:21,来自北京,66456219002,我是啊哈呀hh
7125397842486969100,又一家生鲜电商企业完犊子！但是，这不是最后一个[呲牙],0,3,0,2022-07-28 20:24:16,来自吉林,1780849009492507,延边老陈
7125599655551157006,还买了年会员呢,0,5,0,2022-07-29 09:27:34,来自北京,86403291632,卡通魔女
7125606685627958049,高房价榨干所有行业！不信走着瞧！,0,4,0,2022-07-29 09:53:36,来自重庆,85847364420,foulk
7125597139341771523,资本的加入，互联网的恶性竞争，不正当拿市场份额，咎由自取，亏了实体经济,0,4,0,2022-07-29 09:17:50,来自内蒙古,1824799201967676,郝海椿HAO
7125634596213293865,刚看到一个写的文章，说这个老板早已经把资产全部转移到国外了，人也跑路了。,0,0,0,2022-07-29 11:42:27,来自江苏,70716514469,屠狗不眨眼
7125671540590658341,去年还看到街头有优鲜的员工。现在没有了。,0,0,0,2022-07-29 14:06:11,来自北京,4297305362021149,乐观的百香果7A
7125595998746903334,之前一直用每日优鲜，后期感觉它的服务越来越差就放弃了。,0,7,0,2022-07-29 09:13:24,来自北京,63454669449,上进的清泉Hc
7125650590357029668,我们这里没有每日优鲜，有美团,0,0,0,2022-07-29 12:44:52,来自吉林,3647368634,天生励志20658795
7125597210918159143,互联网大潮开始退去。,0,6,0,2022-07-29 09:18:35,来自北京,50901320214,NidayedeMx
7125605203806159623,坑太多了[发怒],0,5,0,2022-07-29 09:48:02,来自江苏,6236990840,大虎头98
7125595089711547174,每日优鲜的东西卖太贵，所以倒闭了,0,7,0,2022-07-29 09:09:56,来自北京,103773232145,Csybywfc
7125600004148495138,从风口的红人，到互联网泡沫破灭，每天都不断在上演，珍惜当下,0,4,0,2022-07-29 09:28:26,来自北京,110738126803,云外锋寒
7125594812879455007,每日优鲜是谁旗下的？,0,8,0,2022-07-29 09:08:53,来自贵州,4292938343383789,亚平宁一抹蓝
7125582149398905612,北京秋果酒店拖欠员工工资半年没发了。,0,6,1,2022-07-29 08:20:08,来自北京,51996992400,古域猫奴
7125684459697062660,这里距离机场直线距离仅有2公里，如果创始人要跑路，最快只需要20分钟。,1,0,0,2022-07-29 14:56:40,来自重庆,5447798995,ToFun视频
7125608002644296479,类似这种生鲜电商，最大的问题是用户没法挑选，肉类稍好一点儿，果蔬基本就是碰运气，好坏都得接着。所以不到万不得已，现在很少用生鲜电商了,0,4,0,2022-07-29 09:58:51,来自北京,9880926195,上进的露珠jg
7125606700849447680,很久没用了，感觉这种类似的生鲜买菜平台都长久不了,0,4,0,2022-07-29 09:53:46,来自江苏,57168862723,不凡溪流jinsixjj
7125632857174704931,亏欠着这么多人的钱，然后还亏损，但是用户的钱都是实实在在花的，那到底钱都去哪了？,0,0,0,2022-07-29 11:35:33,来自北京,104729441363,一只小猪的日常
7125598681189499655,这个APP感觉好像是最早开始做送菜到家的吧,0,4,0,2022-07-29 09:23:53,来自上海,5996481019,小保同学1991
7125598505473262367,吃惊！惊到眼镜掉下来！就2020年那场疫情开始时候，小区封控，感觉一家人全靠每日优鲜活下来的。,0,4,0,2022-07-29 09:23:11,来自上海,3711552579181559,堇力的耳环
7125661773226803976,缺乏监管的互联网企业的必经之路！,0,0,0,2022-07-29 13:28:14,来自北京,3780240836,dingjian
7125599814645695232,这么多下岗的可怎么办了，现在看商场好多空商铺，之前起码还能看到是换人了，现在就彻底空了，一副破败的感觉，哎,0,4,0,2022-07-29 09:27:42,来自天津,109085108602,非鱼派
7125599817933472523,以前用的很多，近半年来发现货少了很多，价格却上去了，就不怎么用了。,0,3,0,2022-07-29 09:28:21,来自北京,4428440259009500,听音观色知世界
7125639790405583629,美团更次 份量不足缺斤少两 昨天团4盒杏 每盒重量250克 看看实际重量  没有一盒够重量的 退货太麻烦 以后不在买了 买的几样菜 重量都缺斤少两,0,0,0,2022-07-29 12:02:56,来自辽宁,3049047341,英明果断梦想睿智
7125599762183078669,我应该是第一批用户，从2015年开始，那时候平台也仅有不到十种水果…后来从兴到衰，品控越来越不行。今年开始用美团了,0,4,0,2022-07-29 09:27:46,来自北京,110190881425,柠檬菠萝蜜果
7125661429852209961,我旁边的每日优鲜，开在园区内，生意惨淡，我当时就断言过不久就倒闭。没想到，那么快，就三个月不到,0,0,0,2022-07-29 13:26:45,来自广东,85501667215,诺亚心A
7125624843923358476,体面！？ 不是老赖就是跑路 体面二字只能适用即将离场遵守中国法律的国际公司,0,1,0,2022-07-29 11:05:01,来自山东,3333316286362964,cq1050044585陈
7125601142171976448,比我强，我佩服他们。我也想亏损60亿，没那个能耐,0,3,0,2022-07-29 09:32:45,来自北京,98261481079,岂曰无衣与子同裳Tp6n
7125626796468978444,比起多多买菜，美团优选，淘菜菜，甚至叮咚，最初的每日优鲜是最棒的，只可惜没有坚持做下去,0,1,0,2022-07-29 11:13:14,来自江苏,1376230794330651,臻杂选
7125594851030221575,注册制下的企业，跑路的更多。应该对此类企业进行立法，不能任由其肆意损害股民的权益！,0,6,0,2022-07-29 09:08:36,来自广东,106203932528,用户枫亭醉晚
7125691417028559629,上市前青岛投资了20亿 说是总部放在青岛 难道总部根本不在青岛[捂脸] 青岛这20亿买了个寂寞！,0,1,0,2022-07-29 15:23:34,来自山东,1267103929998439,浮生未歇7402
7125683827150308129,这次上海疫情，每日优鲜不给力。我们全靠叮咚和团长,0,0,0,2022-07-29 14:54:31,来自上海,690909770429140,静芊蓝
7125634267283538728,每日优鲜是干什么的？我头一次听说！,0,0,0,2022-07-29 11:41:14,来自北京,6940035017,超越祥子
7125605382638699272,好几个月就发现每日优鲜里面没有菜了,0,3,0,2022-07-29 09:48:41,来自北京,3511349813,此生与爱无缘
7125604893322740483,变相融资，钱到人跑，资金外流！,0,5,0,2022-07-29 09:46:50,来自山东,85301951824,幸福光束jl
7125604941485474567,现在哪行都不好做,0,4,0,2022-07-29 09:46:54,来自江苏,60736325717,金牛楠楠猪
7125597043968197406,每日优鲜价格比美团、永辉超市、多点要贵，而且缺斤短两（虽然有退款），早就不在他家买了。,0,5,0,2022-07-29 09:17:31,来自北京,3222587324,长城脚下一块砖
7125597018143261451,每日优鲜倒了，疫情有很大关系，[捂脸][捂脸][捂脸][捂脸][捂脸][捂脸],0,6,0,2022-07-29 09:17:26,来自江苏,25942860990,平哥167246926
7125608756855276321,只要资金链断了，没有新资金注入，任何企业倒闭和破产都是太正常不过的事。,0,3,0,2022-07-29 10:01:45,来自河北,70550690803,人生奇谈怪论
7125602855787954981,烧钱赔本生意总不是长久,0,4,0,2022-07-29 09:38:47,来自河南,50032260098,四眉毛
7125639152623862536,我说咋好几天不送货呢，但是取消订单退款还是很快的,0,0,0,2022-07-29 12:00:22,来自北京,104940753907,魔法小红花的花
7125691922169250601,公司倒闭了、有些人却赚的盘满钵满,0,0,0,2022-07-29 15:24:59,来自北京,1305844305628747,三秦大地小男孩
7125603198752752422,这就是中国民营企业的作风。,0,3,0,2022-07-29 09:40:13,来自上海,5827914922,podpodzc
7125620168298201856,生意不好做了，被挤垮了。,0,1,0,2022-07-29 10:46:26,来自江苏,6847074733,人生如戏10546
7125622170025706275,这里距离机场直线距离仅有2公里，如果创始人要跑路，最快只需要20分钟。,0,0,0,2022-07-29 10:54:21,来自广东,5791147484,魔力萱L广州商贸
7125614658131706665,疫情对这些行业是利好，为什么会倒闭呢,0,2,0,2022-07-29 10:24:34,来自江苏,19498555877,骆驼在湖边
7125644216297947935,每日优鲜，架不住每日核酸,0,0,0,2022-07-29 12:20:02,来自北京,85605210378,小小野猪
7125597207839425314,之前一直在用，挺好的，商品价格便宜送货速度很快很方便。可惜了！,0,4,0,2022-07-29 09:17:27,来自山东,110789925092,爱吃猫粮的汪汪
7125596683676828423,橙心、十荟，这又每日，下一个轮到谁？[泪奔][泪奔][泪奔],0,3,0,2022-07-29 09:15:46,来自浙江,23673518262,人生在线2020
7125611353217876750,跑路的事屡见不鲜。,0,3,0,2022-07-29 10:11:51,来自山西,50055662473,和和49
7125631137581368096,和新东方比差远了，至少人家还补发了员工工资把桌椅板凳捐给贫困山区,0,0,0,2022-07-29 11:29:39,来自新加坡,98993476114,远753951
7125649642905486080,现在电商竞争太激烈了。,0,2,0,2022-07-29 12:40:42,来自山东,2075475886482414,冉冉667788
7125598230251438863,这是注定的结果，最初成立时，产品质量没的说，后来变了，搞各种优惠减免活动，一套操作下来，没便宜多少，因为东西质量是真的差,0,3,0,2022-07-29 09:21:34,来自北京,105150558722,北京老程
7125597918903747369,还没有用过买过占过便宜，就没了……,0,4,0,2022-07-29 09:20:11,来自辽宁,989978065905716,清缘慧馨
7125596816909026088,老板呢？卷钱润了？,0,3,0,2022-07-29 09:15:51,来自北京,1103564651111912,家有小豆丁儿
7125594325052359432,每日优鲜是谁旗下的？,0,5,0,2022-07-29 09:06:55,来自山东,3572437856,人生不是过家家
7125558675514639112,就是裁员，公司快不行,0,0,0,2022-07-29 06:48:34,来自广西,79300387696,身处泥泞遥看满山花开
7125605545960276766,互联网经济都不太正常，没有自己的核心技术和业务，靠融资迟早会倒闭的,0,4,0,2022-07-29 09:49:26,来自北京,83414489095,一碗老酷
7125385528882955023,这就很尴尬了，每日优鲜,0,3,0,2022-07-28 19:35:55,来自广西,68026245895,你的小红帽已上线
7125632688094528259,每日优鲜要破产了吗？[what][what],0,0,0,2022-07-29 11:35:56,来自北京,51411923197,秋色1944
7125613868298191648,这里距离机场直线距离仅有2公里，如果创始人要跑路，最快只需要20分钟。 ……………哈哈哈哈，这个报道不错,0,1,0,2022-07-29 10:21:31,来自广东,94540468327,喝车别开酒3379
7125603166670357289,没听说过，哪位说说，每日优鲜是干嘛的app？,0,3,0,2022-07-29 09:40:04,来自内蒙古,50271236398,北京吃瓜群众
7125577465917014821,每日优鲜没有守住独创的前置仓模式,0,6,1,2022-07-29 08:01:24,,3773490812,至善文创
7125598327899128611,吃亏的是普通员工，股东早就赚的盆满钵满了,0,3,0,2022-07-29 09:21:55,来自江苏,92327201089,认真的宇宙Ai
7125598472065712927,说真的我就没用过每日优鲜这个app，最习惯用京东。,0,4,0,2022-07-29 09:22:55,来自山西,105209202511592,88三界皆苦88
7125597079942038306,青岛市的战略投资项目啊 就这么凉凉了,0,4,0,2022-07-29 09:16:47,来自山东,62508169693,格林法尔新风吕英
7125602786422768424,皮包公司倒闭破产很正常,0,3,0,2022-07-29 09:38:33,来自四川,584582516710318,聪慧阳光jL
7125605300119290663,保安:坚守最后一班岗，我失业了！[捂脸],0,3,0,2022-07-29 09:48:16,来自辽宁,101738839687,丢了脑仁儿的脑花儿
7125605257623061289,企业也是不容易啊！[抠鼻][抠鼻][抠鼻],0,4,1,2022-07-29 09:48:15,来自辽宁,52329349668,霓裳轻飘
7125632447835849513,我们社区的，昨天直接线上通知解散，,0,1,0,2022-07-29 11:33:55,来自上海,61187725709,自在的小糊涂神
7125679373164200716,我都没听说过这个[捂脸],0,0,0,2022-07-29 14:37:21,来自广东,6261086011,奋发小猫68
7125598713200526087,它的股票走势能证明投资者，从来就没有看好过，下一个是谁？叮咚，永辉……,0,3,0,2022-07-29 09:23:47,来自北京,3765184278048519,ssacrac
7125598817159906061,每日优鲜就用过1-2次，现在一直用美团买菜，虽然比美团优选贵一点点，但是30分钟-1小时内，基本上能送货上门，美团优选还得上邻居家取，懒得取[捂脸],0,3,1,2022-07-29 09:24:08,来自北京,5999852175,嘟宝妈育儿
7125476266836558605,这个每日优鲜看着就不像正儿八经做企业，看看他们当初拉新的招数,0,3,0,2022-07-29 01:33:28,来自山东,549390592256739,为么是恁
7125552184338891535,每日优鲜是买菜的吗？,0,1,0,2022-07-29 06:23:15,来自广东,111570809673,千寻x
7125691270919684867,三年over了。,0,0,0,2022-07-29 15:23:02,来自北京,96457733420,快乐生活小门墩儿
7125469135118926595,跑了可以追着要回来投资吗？毕竟数额不少。,0,0,0,2022-07-29 01:05:16,来自山东,109071726699,常去信号山
7125600129477788423,生鲜电商第一股折戟！！！,0,3,0,2022-07-29 09:29:02,来自山东,4001872716512695,山东好工作
7125631625433514790,没用过，不会瞎评论,0,0,0,2022-07-29 11:31:26,来自北京,6442540302,阿敏89554446
7125635323182629662,从公司成立垮台天天都做着赔本的生意，厉害👍！,0,1,1,2022-07-29 11:45:44,来自北京,4003035810,俯仰斋
7125674528147030792,昨天还发信息会员自动扣费通知[震惊],0,0,0,2022-07-29 14:17:36,来自北京,53651791159,真实最好08
7125600459771020067,"资本运作下的一个缩影
大资本要决定下手时，会让目标连渣都不剩",0,3,0,2022-07-29 09:30:03,来自北京,79589405630492,仁爱星辰1o
7125579322962150185,每日优鲜真的挺好的，希望能挺过去啊,0,6,0,2022-07-29 08:08:07,来自北京,3050446610,乌啦啦啦乌啦啦啦
7125616580226401060,我也好久没用了，之前一直用的，感觉还可以，后来有段时间没用，前几天还准备用发现已经不能当天配送了,0,1,0,2022-07-29 10:32:08,来自江苏,96460964584,Fairg105
7125615267573154567,太甜了，不好喝,0,2,0,2022-07-29 10:27:04,来自上海,18360532398,空白130128
7125594801818878755,"这么大的企业都说倒就倒；经济是不是发达不是看数据，而是看整个市场是否都在一个相对公平，合规的环境里发展。
一个良性的市场应该是大鱼有饭吃，小虾也有饭吃。今天大鱼吃小鱼，明天群虾造反啃大鱼；这叫丛林法则，不叫市场经济。",0,11,1,2022-07-29 09:08:13,来自山东,1657698601142759,绛洞花主
7125595970612216616,资本完成嗜血，撤退之后，留下的只能是一地鸡毛！,0,5,0,2022-07-29 09:12:50,来自上海,51446414339,基本幸福
7125623791682192169,哎，现在做实业都很难的！,0,0,0,2022-07-29 11:00:32,来自北京,756879075064464,灵敏鲸鱼Va
7125617371977073412,相对来说每日优鲜其实菜价挺便宜的，我还充了年费会员[捂脸][捂脸],0,1,0,2022-07-29 10:35:16,来自山西,1939983969027908,白雪敦主✨
7125475558829507362,20亿不够恒大还利息的,0,0,0,2022-07-29 01:28:28,来自上海,3126142898,兽医研究所湿鞋嘛
7125660356663444228,亏了67亿这么多，请问这些钱被谁赚走了。可能是高管转跑了！,0,0,0,2022-07-29 13:23:05,来自广东,88245934594,正能量的华仔
7125621109840151304,现在还能用，谁下一单试试,1,0,0,2022-07-29 10:50:55,来自北京,6517480582,丶安琪拉本拉
7125475558829507362,20亿不够恒大还利息的,0,0,0,2022-07-29 01:28:28,来自上海,3126142898,兽医研究所湿鞋嘛
7125660356663444228,亏了67亿这么多，请问这些钱被谁赚走了。可能是高管转跑了！,0,0,0,2022-07-29 13:23:05,来自广东,88245934594,正能量的华仔
7125670325769110303,创始人去哪里了？,0,0,0,2022-07-29 14:01:34,来自广东,55710816149,幸福奶酪Wd
7125661992161493790,我就喜欢美团买菜，十多分钟就送到了。买的活虾到家个个还活蹦乱跳，我住六环边。,0,0,0,2022-07-29 13:29:18,来自北京,3307788929074664,知情达理漂流瓶dr
7125672309117059843,啊？怎么好突然的样子,0,0,0,2022-07-29 14:09:30,来自上海,4212924939774253,一杯咖啡啡
7125596828577350441,平台企业烧的钱哪儿来的？,0,4,0,2022-07-29 09:15:53,来自北京,60392781717,自若旭日a
7125688248806687525,完了，我还买会员了！,0,0,0,2022-07-29 15:11:23,来自北京,4364048668,天山童姥39327627
7125599486378181414,疫情之下确实扛不住。别说企业没责任了。抗了两年了。不容易,0,3,0,2022-07-29 09:27:15,来自山西,3284961075409118,薄雨收寒永
7125604924775760648,疫情之下确实扛不住。别说企业没责任了。抗了两年了。不容易,0,3,0,2022-07-29 09:46:55,来自山西,2225007968919320,大气咖啡2cu
7125686165319664415,每日优鲜买的水果非常差就没买到过好的，还不如美团买菜多多买菜的品相,0,0,0,2022-07-29 15:03:18,来自广东,3318669148,直播喵
7125645899988583171,前几年买过菜，今年用叮咚买菜了,0,0,0,2022-07-29 12:27:06,来自上海,1283847387881533,大熊大熊啥都不用愁
7125668542410359587,保安往往是知道真相的,0,0,0,2022-07-29 13:54:17,来自广东,2924330025495835,历史时势要闻
7125650760956052258,只要我隔一周不用，客服就打电话问候我，我上去看了看，水果种类变得特别少，没法用了。近期还取消了30分钟送达业务，更不想用了,0,0,0,2022-07-29 12:45:08,来自北京,6313236725,小优兔
7125692844572345129,供应商货款怎么说呢,0,0,0,2022-07-29 15:28:34,来自广东,5376446744,杰克船长Bk
7125622071283598115,亏的这么多钱是哪里来的,0,0,0,2022-07-29 10:54:01,来自陕西,3501278171,Neo100
7125613889661551395,一直在亏损撑住的企业一般很难搞…,0,3,0,2022-07-29 10:21:37,来自广东,118379416915556,已经诞生的特等奖
7125624283250279202,每日优鲜真的不错～可惜输给了资本～,0,0,0,2022-07-29 11:02:28,来自北京,4146987367929287,站在山头的二狗子
7125598287456944907,东西品质和美团差不多，但比美团贵很多，它不倒闭谁倒闭,0,3,0,2022-07-29 09:22:05,来自上海,53774912145,心静止水jc1999
7125597155242590991,互联网惨啊 一去不复返了,0,4,0,2022-07-29 09:17:12,来自北京,3887605552,滔滔肥皂泡
7125643328963838750,怎么韭菜已经割完了，倒不倒闭和老板没一点关系[捂脸],0,0,0,2022-07-29 12:16:39,来自北京,23966813118,墨月之城城主
7125599098719814431,以前价格便宜，东西好，现在价格贵没优惠，下个倒的是朴朴,0,3,0,2022-07-29 09:25:18,来自湖北,3830317507161992,传说之86
7125605816928961313,这是资本无序扩张的恶果！根本不是赚钱的模式！,0,4,0,2022-07-29 09:50:19,来自河北,58940173254,Mrpeng178969366
7125632824522720040,几千人的公司，2亿元投资就是打水漂,0,0,0,2022-07-29 11:35:39,来自北京,3540047244825271,一往无前水滴KT
7125688694883271436,印象中他们家的菜水果都很贵，比物美贵多了，奇怪的是买的东西贵还亏损到直接跑路，也挺有才。,0,0,0,2022-07-29 15:13:13,来自北京,59595189430,Zrkun
7125635757624263460,叮咚也够呛了，好久不用了。,0,0,0,2022-07-29 11:47:12,来自北京,70848696026,Cnl
7125664131931800350,互联网经济泡泡破了，实体才是王道！,0,0,0,2022-07-29 13:37:40,来自天津,98459981012,阿修罗5304
7125580684802278178,天啊，那我买的会员怎么办。。。,0,7,0,2022-07-29 08:13:24,来自北京,909990801718078,雪映奢品中古
7125610135431103266,属实快了一些，刚刚上市,0,3,0,2022-07-29 10:07:09,来自山东,6949477928,柒月不宣
7125653628471952143,内卷的结果,0,0,0,2022-07-29 12:56:13,来自北京,3642003351682696,袅袅炊烟
7125648541548757768,卡内还有钱呢？怎么办？,0,0,0,2022-07-29 12:36:55,来自北京,2431759651192535,勇敢的星球BD
7125621089292026636,用过每日优鲜，感觉比起其它平台没什么优势,0,0,0,2022-07-29 10:50:54,来自广东,111317086177,顶级光束m3
7125632381419127560,之前我每年用每日优鲜买菜和肉啥的得有花2万差不多,0,0,0,2022-07-29 11:34:09,来自北京,4820778612,秘密以后的秘密
7125617575509426956,疫情呀！没有切切实实把市场情况摸透，关门页数正常。,0,0,0,2022-07-29 10:35:54,来自甘肃,6944864017,飞越苍海120624426
7125688196180624168,已经解散了,0,0,0,2022-07-29 15:10:41,来自黑龙江,6859682104,SailingCGCP
7125617823455888163,电商已在走下坡路,0,0,0,2022-07-29 10:36:55,来自湖南,2101878848757311,伤感女人01
7125646522838287141,现在朴朴最好用,0,0,0,2022-07-29 12:29:05,来自广东,104475373729,华籍美人17
7125594859633017608,依托互联网的最后能活下来的太少了,0,5,0,2022-07-29 09:08:46,来自北京,4672158262,梦里的前门楼子
7125614339452584707,富了高管，坑了供应商,0,3,0,2022-07-29 10:23:22,来自山西,50240198861,流年似水云淡风轻
7125666997920252685,老板和钱哪去了,0,0,0,2022-07-29 13:48:43,来自山东,104637021858,秋实合春华
7125617108641366815,不光是每日优鲜吧，美团，叮咚都快不行了，2年内会大规模收缩。,0,2,0,2022-07-29 10:34:05,来自北京,64100517689,一切以大局为重
7125594268605203236,下一个朴朴，叮咚,0,5,0,2022-07-29 09:06:28,来自广东,96356870520,超级无敌小靓boy
7125621216417415976,那些高管都是赚的盆满钵满,0,0,0,2022-07-29 10:50:45,来自江苏,149128633127219,养猫的兔
7125618993293558541,企业的管理出问题了吗？,0,1,0,2022-07-29 10:42:31,来自辽宁,102492623768,舍得9263545914114
7125575938141979404,怪不得最近下单都是次日达，之前几乎每天用这个软件，货品和送货速度都满意，可惜了。,0,7,0,2022-07-29 07:55:57,来自北京,19836137811,萌化南极的小企鹅
7125585354111402793,对于我们来说自己去超市卖场买货是最佳选择，，谁会跟他们每日鲜不鲜的打交道。[困],0,7,0,2022-07-29 08:31:34,来自北京,63336231555,过往皆一片烟云
7125603597618152207,资本狂欢潮退去了而已,0,4,0,2022-07-29 09:41:45,来自四川,110434572156,聽説丶
7125660515640394528,每日优鲜比叮咚买菜要早，但叮咚买菜一进入行业时就不管多少免费配送，价格还便宜，每日优鲜就扛不住了[捂脸][捂脸],0,0,0,2022-07-29 13:23:45,来自北京,65349825467,laraft
7125581492252066574,每日优鲜的东西贵 所以很少买,0,5,0,2022-07-29 08:17:09,来自北京,78806296810,Aquarius9471
7125596492987515686,我曾经是忠实粉丝啊，最近几个月发现东西少了，很多都需要次日达就很少用了，现在看来几个月前就已经不行了,0,3,1,2022-07-29 09:15:42,来自北京,4208580112943795,欢快溪水xC
7125612089913754381,现在企业不好搞，老板更难做！,0,4,0,2022-07-29 10:14:44,来自广东,2018356999760540,弈轩竹
