7125627762022892291,天窗，全车最鸡肋的配置。,0,0,0,2022-07-29 11:16:51,,58790142830,宁懒懒
7125598505472623391,贴个太阳膜呗,0,0,0,2022-07-29 09:22:49,来自辽宁,106874757330,Yan2419
7124857373751067403,我想买没有天窗的中高配置，可惜没一家生产,0,0,0,2022-07-27 09:27:10,来自湖北,4568471943,寮寮
7125745774603928354,全景玻璃，理想很美满，现实很骨感[大笑][大笑][大笑],0,2,0,2022-07-29 18:53:53,来自上海,3274010188,老杨wZPV
7125589926263030561,能隔绝99%的紫外线 为什么还热？,2,0,0,2022-07-29 08:49:51,来自四川,4912787450,土土48912456
7124276894732387076,特斯拉车主都能接受的,0,0,0,2022-07-25 19:54:31,来自江苏,2097520968220299,我是丹小锋
7125789945759253278,开车看星星？？？,0,0,0,2022-07-29 21:45:35,来自广东,109844235107,爱生活的饺子tg
7125678961195336484,天窗真是个鸡肋。,0,0,0,2022-07-29 14:35:11,来自河北,108199138036,富强文具4
7125792380162949901,天幕一点都不高级，就是设计师偷懒！,0,0,0,2022-07-29 21:55:17,来自浙江,53011209033,奋发的肥肥
7125613722940703518,我直接加了个车顶行李箱 好了很多。 晒不住太阳了。玻璃也没那么烫手了。,0,0,0,2022-07-29 10:21:01,来自河南,56296498936,Gemini大鹏
7124676489241101095,特斯拉整车才是智商税,0,1,0,2022-07-26 21:45:07,来自江苏,5494410279,伏狐猛将
7124652525101302563,尊贵的特斯拉车主,0,1,0,2022-07-26 20:11:20,来自浙江,1147753434,MIAO丶MIAO
7125796284967027493,还好我的小宋有遮阳帘,0,0,0,2022-07-29 22:10:01,来自广东,334676731640302,太平圩
7125647385891701545,代步工具，何必折腾。,0,0,0,2022-07-29 12:31:49,来自广东,97871818156,旅者杂话
7125607167696274176,没买车的时候，天窗是必备的配置，砸锅卖铁也得上天窗；买车之后，天窗就是鸡肋的配置，一年打开不了几次。,0,0,0,2022-07-29 09:55:33,,5531377662,山居秋冥
7124824296404992776,除了几万块钱的车，高点的几乎找不到无天窗的。,0,0,0,2022-07-27 07:19:14,来自江苏,2952262041,HOT杂谈
7125621304878859012,新能源车，夏天太晒不敢开空调，冬天太冷也不敢开空调，呵呵,0,0,0,2022-07-29 10:51:13,来自云南,6366141348,滇东一郎
7125775592406106918,要是在车顶安把伞，刮风时会不会飞起来？,0,0,1,2022-07-29 20:49:53,来自北京,109877007571,绿嵩蒿子
7125752202702471977,第一次接触新能源车是小鹏，看了车顶就发誓绝对不买，不安全还晒死,0,0,1,2022-07-29 19:18:53,来自福建,3483838072,黑山老妖16760603
7124674134982492963,特斯拉没测嘛，红外线隔绝率多少？这文章不就说的这个事，结果没写？,0,0,0,2022-07-26 21:35:22,来自江苏,5807330450,高山下的牧马人
7125767250778669858,有失也有得，冬天太阳晒着暖和，就不用开空调了[捂脸][捂脸],0,0,0,2022-07-29 20:17:05,来自重庆,232715253981848,福娃0315
7125812739507290920,比亚迪宋PLUS DMI的天窗是两层的，防嗮隔热完全没有问题的，深圳这么热的天气，空调开26度，很舒服,0,0,0,2022-07-29 23:13:59,来自广东,51754313008,苍海2016
7124938956936020740,天窗对我而言没什么用，一年难得开一次，要我的车是这种大玻璃顶我就给他贴反射膜。,0,0,0,2022-07-27 14:43:45,来自浙江,110836813068,哦就是哦不一样的烟火
7123867820849038093,我的唐就有遮阳帘！我骄傲了,0,2,0,2022-07-24 17:27:03,来自新疆,6475144317,新疆文子哥
7125636542651597598,我喜欢躺在车顶上看星空，还能拍照,0,0,0,2022-07-29 11:50:38,来自江苏,52558038233,又菜又爱玩game
7125612374060892964,这些车没有遮阳帘？,0,0,0,2022-07-29 10:15:44,来自上海,6502964542,请输入用户名一已存在
7125797529538757410,开车就专心开车坐车归坐车，看什么星星？全球渐渐变暖难免不热成狗[呲牙],0,0,0,2022-07-29 22:14:35,来自广东,100052762425,满记模具
7125749217674789663,5008有遮阳的，隔热很好,0,0,0,2022-07-29 19:07:35,来自贵州,6688743530,勇者风铃pf
7124664277864596224,宝马ix3就不会这样啦 一点都不晒,0,0,0,2022-07-26 20:56:58,来自广东,110237926495,数字用户妥妥的冇问题
7123904466319393570,比亚迪都知道配个电动布帘，这个高级的车还没有吗？,0,1,0,2022-07-24 19:48:47,来自湖南,4305314221130332,路漫漫1234567
7125796345138709288,防紫外线只是防止晒伤而已，并不能隔热，隔热是看防红外指标,0,0,0,2022-07-29 22:09:57,来自上海,55583799140,越王
7125745529619448576,车上的天窗大概就刚买的时候开过一次，直到卖了,0,0,0,2022-07-29 18:52:59,来自海南,61659360024,老腰17
7125781955265774371,七十年代就有新能源了，长江沿岸码头就有无数的电瓶转运平板车[笑哭],0,0,0,2022-07-29 21:14:04,来自湖北,4107378759045885,才高八斗辰星CX
7124612271338750732,特斯拉属于豪车，咱不了解这种驾乘体验,0,2,0,2022-07-26 17:36:15,来自安徽,100578402903,wtw314
7125755231094588198,天窗很少打开的,0,0,0,2022-07-29 19:31:10,来自河南,50098576417,打扰一下谢谢
7124885071131771662,这叫晒不怕天窗,0,0,0,2022-07-27 11:14:33,来自湖北,77427011877,林海3016
7125804107935679270,那就把天窗改成太阳能板吧[捂脸][捂脸][捂脸]光能和热能转化成电能怎么样[捂脸][捂脸][捂脸],0,0,0,2022-07-29 22:41:10,来自上海,106759653599,夙兴夜寐的徐某
7124921567120900898,天幕就是赤裸裸的减配！厂家心里最清楚哪个更好，只是不说。,0,0,0,2022-07-27 13:35:34,来自辽宁,945192270314883,淡定光束xg
7125788671244518159,想起了以前嘲笑大众高级的那个笑话，现在把话语换换也差不多了。还是一体化好，天窗都要很小的那种。,0,0,0,2022-07-29 21:40:09,来自湖南,5479976229,TT56244698
7123869405582787368,国内的都喜欢全景天窗，,0,0,0,2022-07-24 17:32:45,来自广东,5424147941,守望麦田53670162
7124901746182570755,那天路上，发现一辆车，后车窗里，装帘子。,0,0,0,2022-07-27 12:19:14,来自北京,2172279821960679,友爱高山Ss
7125789983616631586,不是玻璃顶你也不买呀,0,0,0,2022-07-29 21:45:14,来自北京,3971071000984839,熵00678
7125754281152185122,油车没天窗吗？难道不热？,0,0,0,2022-07-29 19:27:00,来自北京,3849155595,双生法
7124705013528036111,十五块买个隔热垫搞定[泪奔],0,0,0,2022-07-26 23:35:51,来自福建,82704076254,飞扬的蒲公英512
7124635815095091971,好车。一辆车，让尊贵的车主，享受到四季的交替。。。,0,0,0,2022-07-26 19:07:22,来自广东,6026326112,上莲塘
7125745472455115555,这意思是只有新能源车有天幕？有天幕的绝对是新能源车？,0,0,0,2022-07-29 18:52:53,来自北京,106074876824,M兜丶
7125553233074242337,兄弟看好了再写，P5是有遮阳帘的好不好？,0,0,1,2022-07-29 06:28:35,来自四川,3812713147409716,简单的快乐9720
7124688421343494953,真没必要搞天窗，还有启停功能，全是浪费。,0,0,0,2022-07-26 22:30:39,来自北京,5864359593,街坊二大爷
7124676051422151459,想不晒，买瓶黑色喷漆，一通喷，啥太阳辐射都没了！！！,0,0,0,2022-07-26 21:42:35,来自广西,2506521270825240,用户懒洋洋睡大床
7124208431431074594,"哈儿才买全景天窗！
而且，全景天窗是真的哈！哈得不能再哈的一类！！！[偷笑][偷笑][偷笑]",0,1,0,2022-07-25 15:28:24,来自重庆,5402354570,zs时间空间
7125789363878839080,幸亏我选的是小天窗,0,0,0,2022-07-29 21:42:44,来自陕西,102034163788,难得糊涂42947
7125548619084268295,车开了六年天窗一次都没开过，里面的塑料膜还没拆[捂脸],0,9,1,2022-07-29 06:11:00,来自江苏,106074045717,随风js123456
7124140798215996160,贴膜没用吗？,0,0,0,2022-07-25 11:05:43,来自上海,107704835270,杨公子821
7125806146329854757,哎呀，新能源呀，高温起火，低温没电，啧啧,0,0,0,2022-07-29 22:48:50,来自天津,7008593957,平淡123367316
7125778983237108519,这和是不是新能源车有关系吗？设计师的问题吧,0,0,0,2022-07-29 21:03:23,来自北京,102412961985,爱养鱼的桃农
7124703182890468096,车不代天窗怎么能显得高极呢？,0,0,0,2022-07-26 23:28:28,,69560764109,人民工人小杨
7124188313262949161,买个遮阳的不香嘛[捂脸],0,0,0,2022-07-25 14:10:17,来自四川,2928712231688188,一个菠萝的希望
7123879274402824995,经历了七月初成都的太阳后果断下单遮阳帘,0,0,0,2022-07-24 18:11:03,来自四川,58413094498,156069679
7125577305354978061,看来还是H6良心 里面直接有遮阳帘,0,0,0,2022-07-29 08:00:53,来自山西,2836395501294285,浩然的噩梦
7124118322504860447,[捂脸]现在这车开了10年 开天窗的次数不超过10次。天窗完全没必要,0,0,0,2022-07-25 09:38:01,来自重庆,55129686802,Darkfaith146112972
7124741969658086181,如果各品牌有全景天窗的汽车无需增加费用，给你多一个不是全景天幕不透光车顶的选择你会要吗，这个全景天窗正在被各大车企选用，有阻热功能也不是很热，多少年青人都是冲着这个配置选择各自喜欢的品牌汽车，装上车载床垫露营时仰望星空，但如果年龄大了往往头发少了确实会觉得头皮被晒了，伯伯们可以选择一个遮阳帘价格也不是很贵。,0,0,0,2022-07-27 02:05:42,来自辽宁,104671886437,Kennydl
7124615558024758052,晚上看星星有都浪漫，白天晒太阳就多狼狈,0,4,0,2022-07-26 17:48:40,来自陕西,4533453957,小齐我很好
7124960752951902990,这些商家眼光真刁钻,0,0,0,2022-07-27 16:08:20,来自广西,347098023476359,轮印漫游记
7125795330386019084,这是广告，还有就是任何东西都有正反面，夏天不行冬天肯定好这是不变的规则,0,0,0,2022-07-29 22:06:56,来自江苏,6866606988,过江掹龙
7125764296482603776,隔紫外线又不隔红外线，热量是红外线传递的,0,0,0,2022-07-29 20:05:37,来自广东,72383527350,挥泪取京都
7124931525581570855,这就是说我不买全景天窗的原因！[捂脸][捂脸][捂脸][捂脸][擦汗][擦汗][擦汗],0,0,0,2022-07-27 14:15:10,来自广东,52504513691,冰雨156019662
7125760231204406031,是电动汽车，不是新能源汽车。,0,1,0,2022-07-29 19:49:57,来自云南,3742366849304974,闲人逸客666
7123862250192225055,[微笑][呲牙][呲牙]这设计是为灭菌用。。什么细菌病毒阳光暴晒都会芭比Q的,0,3,0,2022-07-24 17:05:07,来自江西,94484614295,漂泊一生微笑
7123868254648861480,这样不比普通天窗更有b格吗[大笑],0,1,0,2022-07-24 17:28:08,来自北京,6537292355,桃小夭2019
7125786954043441955,西方人车子大都没有天窗。,0,0,0,2022-07-29 21:33:26,来自湖北,52856328448,秋风140224210
7124608696696898311,特斯拉车主不怕热,0,2,0,2022-07-26 17:21:56,来自广东,3097450985,远见卓识香瓜l7
7125713859226157858,我……感觉中了一枪,0,0,0,2022-07-29 16:50:01,来自重庆,93966201408,元二使安西
7125770146039218980,不能隔绝红外线，远红外线，肩颈疼的倒是可以免费理疗了[呲牙],0,0,0,2022-07-29 20:28:34,来自四川,5876993514,宅家哥
7124695303714276133,为什么没太阳能的汽车呢[捂脸],0,1,0,2022-07-26 22:58:12,来自广东,1956768451148958,白切鸡卤水鹅
7125650101774729991,不会吧，哈哈哈哈 ，真的的这么不堪阿，亏我还想下一次换车，一定挑天慕，看来可以打消了，因为臭氧层空洞往后地球只会越来越晒，越来越热。,0,0,0,2022-07-29 12:42:45,来自广东,6046634797,Balal
7124603840506463014,玻璃顶不好。,0,3,1,2022-07-26 17:03:19,来自北京,6501644240,A飞行家
7125764013530891019,我一直觉得，在广州敢买全天窗的都是神人,0,0,0,2022-07-29 20:05:16,来自广东,7024215779,老K睇世界
7125593482743431971,热不热要看红外线隔绝率，而不是紫外线隔绝率。,0,0,0,2022-07-29 09:02:54,来自广东,5377620802,Anjo52341860
7125798791437402912,想不要天窗都难，只能买低配手动挡！唉，还经常没货！,0,0,0,2022-07-29 22:20:26,来自广东,1244263447266541,云飘扬pop
7124691538390975272,一张半幅车衣就可以解决的问题，至于这么严重吗？,0,0,0,2022-07-26 22:42:56,来自四川,3792881423,水木亚丁
7125771283077399299,可以设计双层，一层防紫外线，一层防红外线。冬天可以打开防红外线的一层。,0,0,0,2022-07-29 20:33:13,来自浙江,721724931049716,古越剑2021
7124627619425567526,我最讨厌全景天窗,0,1,0,2022-07-26 18:36:01,来自青海,100229375651,孙小伟娄烦
7125696394195305248,我差点买了，就是觉得好像不挡太阳才放弃的[呲牙],0,0,0,2022-07-29 15:43:12,来自江西,4304649293,平凶的快乐
7125766953486566159,全景的玻璃不叫天窗，只能叫玻璃顶，天窗是可以开可以遮的不一样[抠鼻],0,0,0,2022-07-29 20:15:58,来自福建,68623002110,眼花缭不乱
7124083828880638723,配置太低，连个全景天窗帘子都没有,0,0,0,2022-07-25 07:26:15,来自北京,50348895824,新野猴艺老艺术家
7124504936431911715,车，对大多数人来讲，安全，舒适这是头两个最重要的条件，特斯拉哪个有，但是一样大把吹捧它的崇外之人。,0,1,0,2022-07-26 10:38:49,来自广东,101348572757,peter浪淘
7124675765572125474,全景天幕就是沙雕，难道看天上的云彩比手机还好玩？,0,0,0,2022-07-26 21:41:30,来自江苏,3979888370129131,不买广汽车
7125721254426182431,个人感觉，开新能源车没有开燃油车心里踏实[捂脸][捂脸],0,0,0,2022-07-29 17:19:11,来自安徽,110496642478,勺头巴脑
7124711286210282279,这么省油的车，空调都舍不得开么？,0,0,0,2022-07-27 00:02:10,来自湖南,6014724983,青一色75868184
7125803372246319912,还有那个蔚来,0,0,0,2022-07-29 22:37:29,来自广东,527399223829103,深圳的阿美
7125793188233265934,热的时候就那么两个月，夏天加个遮阳篷就行了,0,0,0,2022-07-29 21:58:19,来自广东,3623629839939869,自由飞翔的羽毛
7124661189149950761,能买得起特斯拉的人，必须有车库啊，随车走的那种。,0,1,0,2022-07-26 20:45:05,来自山东,448202949802176,日月星陈2020
7125765416270054152,买个汽车伞，一切解决了。,0,0,0,2022-07-29 20:10:31,来自山东,105226479694,王孝弟892
7125799441805951783,看星星一般是晚上看的吧，晚上太阳也很大吗,0,0,0,2022-07-29 22:22:42,来自广东,110191829209,丝流云躺闲丽
7124843741772874536,阻隔紫/红外线，不代表不导热,0,0,0,2022-07-27 08:33:45,来自上海,26085392881,KyleXXX
7125800192129368845,把这些热量搞成电能给车充电呗,0,0,0,2022-07-29 22:25:25,来自江西,5572311546,只能自己打江山
7125623487393497896,全景天幕不适合中国，适合北欧，但是今年全世界都不适用,0,0,0,2022-07-29 10:59:18,来自浙江,1279435389281726,东兰轩
7123822085851415329,以前听到有人吃撑后再吃消化丸的，笑死。现在不笑了。,0,34,0,2022-07-24 14:29:23,来自浙江,6621430723,制性空
7125661677965607688,买不起的我就没这烦恼[呲牙][呲牙][呲牙],0,0,0,2022-07-29 13:27:46,来自河南,59200255832,田妈刘爸
7125768548148134671,特斯拉缺点真多,0,0,0,2022-07-29 20:22:02,来自广东,59419307900,龙美尔2
7125754022526796552,电动车为了延长里程只能减轻自身重量，所以减化用车材料,0,0,0,2022-07-29 19:26:10,来自北京,5442436471,于伯利
7125802549214888738,挡红外线才能挡高温,0,0,0,2022-07-29 22:34:12,来自广东,4478033147,Zhaozongwushi
7124635555883041574,我是很不喜欢带天窗的车[捂脸][捂脸][捂脸],0,0,0,2022-07-26 19:06:34,来自河南,102629750234,习惯不习惯0305
7125767153004888872,难怪那天看到一个女的开特斯拉，穿戴的防晒装备比我骑雅迪太多[看],0,0,0,2022-07-29 20:16:38,来自湖北,980368966564557,六角亭精神病院
7125787740842803983,特斯拉：来自太阳的温暖，绿色环保低碳烤肉,0,0,0,2022-07-29 21:36:27,来自湖南,11151584830,WuWei19690109
7125813689118851844,多贴几层膜呗,0,0,0,2022-07-29 23:19:03,来自河南,56428633045,209784537
7125754508487033640,天窗与新能源有关吗？,0,0,0,2022-07-29 19:27:45,来自新疆,5815757758,春暖66256614
7124673385082159886,买这样的车，这又何苦呢？,0,1,0,2022-07-26 21:32:23,来自广东,69972819443886,风飞花2021
