7123824739110109983,特斯拉卖1000-3000，1688卖60[捂脸],1,50,0,2022-07-24 14:39:55,来自北京,3759968485118423,苏照白
7124689596134654720,不知那个司机开车时可以仰望星空？,11,83,2,2022-07-26 22:35:22,来自上海,5723366304,天气晴朗笑嘻嘻
7125791864623547169,油车的天窗里面有个遮光板的，不是全景天窗那种全透明，还得另外加装隔热板！电动汽车就是一个笑话，被人为夸大！还不如电动自行车三轮车实惠，知道自己几斤几两，就跑近距离的路程，方便不怕堵车,9,88,0,2022-07-29 21:53:02,来自山东,110525498033,冰雪人445
7125616753098441512,我就喜欢天窗，刚发动时打开天窗，车里的脏空气一下子就散出去了，然后再关天窗，行驶途中，打开天窗不像打开侧窗风声很大，又能换气又不吵。以上行为，夏天的白天除外。唯一郁闷的是，有几次晚上忘关天窗了，夜里下大雨，车内补淹过几回了，还没长记性。[捂脸],17,5,0,2022-07-29 10:32:43,来自江苏,86096320336,断翅的小妖
7124088305767088907,遮阳帘不香吗，为什么要带草帽防晒,2,6,0,2022-07-25 07:43:10,来自湖南,103353576914,Nonodema
7125811304836891425,我很疑惑，新能源车这样的结构做过碰撞测试？能通过？,2,2,0,2022-07-29 23:09:12,来自山东,93013380428,天堂的谎言
7125810783069504297,当年买车，我要天窗，看璀璨星空；我要四驱，走不平凡之路；我要七座，阖家畅游美丽神州。结果买了七座、四驱、天窗.......四驱一次没用上，七座永远被放倒做了后备箱，天窗冬天开着冷夏天开着热，不开你就得勤洗车，关键是加不起油了，真的是啥也不是，车就是个代步工具，够用就好,1,0,0,2022-07-29 23:06:10,来自山东,5987616627,夭夭零事记
7125801126754386722,我开比亚迪唐，感觉空调很凉快。而且天窗带遮阳帘……,2,9,0,2022-07-29 22:28:38,来自河北,71995456131,马丁叔叔是火星人
7125796061192454926,"比亚迪也是全景天窗，那天去看比亚迪″宋""时就质疑了该车的大天窗，表达了𣎴喜欢。",6,20,0,2022-07-29 22:09:10,来自重庆,51156650719,光彩天地
7125581689657246501,我购车的首要条件就是不要全景天窗,11,30,0,2022-07-29 08:18:00,来自河南,4747785569,烟景48150239
7124144046116881191,前风挡遮阳伞确实好用，用了以后车里确实没有暴晒那么热了，但就是有一个缺点，能不能把伞把设计的长一点儿啊，我的车用的时候因为伞把太短，下面找不到支撑的地方，总是需要找东西垫着,2,4,0,2022-07-25 11:18:56,来自北京,51151377781,无忧猫
7123933248560415528,设计天幕天窗的肯定是直男 我出门恨不得把自己遮得只剩眼睛 家里的车就是拉了遮阳帘头顶都感觉要冒烟 感觉一个夏天过去头都晒秃噜皮了,2,9,0,2022-07-24 21:40:11,来自四川,4445958328,BiuBiuBiuBang
7125805966667006752,当初买车时，老公要买有天窗，我不同意，因为要多花2w多，有点舍不得，贫穷限制的我的想像，只图实用，也不想看星星了。那天去4s店保养的时候，人家说你买没天窗的就对了，如果有天窗，几年以后为防止天窗漏水，还要花几大千换密封条。,5,12,1,2022-07-29 22:48:29,来自四川,4014681826,天空的一片云飘来飘去
7125435747775726376,不能做个推拉的遮挡？加个推拉遮挡能有多难？,9,12,0,2022-07-28 22:51:00,来自广东,70410803693,心之所向ing
7125499075537273615,能有几次在车内赏星空的时候？搞不懂为什么有人喜欢天窗，我是不能接受。,13,59,1,2022-07-29 03:03:40,来自湖南,50833030482,花开月正圆L
7125799188750877454,我刚买了一个比亚迪宋，也是天窗，室外温度高一点就感觉热，有点后悔了,14,13,1,2022-07-29 22:21:20,来自四川,3144207764043252,敏锐柑桔Ig
7125767509101921027,不注重实际需要，异想天开地增加噱头以弥补在研发上的不足，通过营销占领市场但不一定坐稳市场是国产新能源车的通病。,7,130,3,2022-07-29 20:18:57,来自北京,1983134924552920,皇城东子哥
7125567262999970591,开空调不就行了吗？,11,0,0,2022-07-29 07:22:03,来自河北,50869074665,牧笛258
7124641287831323427,哪个新能源汽车厂家出一个常用顶原始配置就会成为爆款！,11,45,6,2022-07-26 19:27:55,来自山西,76620293076,先天下之忧
7124668286994023208,这还不叫智商税？还取决于用车场景？是说这种适合在室内兜圈玩？不适合室外？,2,23,0,2022-07-26 21:12:27,来自广东,2181878175507043,爱笑的创作者
7125774735883191051,我们家也有一辆电车，不开空调好点，还能省点电，开空调用不了多久就得充电。感觉开空调特别费电,22,21,2,2022-07-29 20:46:47,来自河北,4388902882252295,哭都没地方
7125545603341615872,我家是燃油车，当初买车的时候，我说买全景天窗，老公就不同意！,11,4,2,2022-07-29 05:57:56,来自湖北,83730851828,Min83730851828
7125565951999017761,我买极狐时，推销员强调是全景天窗，我就强调遮阳帘是不是能达到完全不透阳光？我同事的奔驰和雷克萨斯的遮阳帘就还能透进阳光，好在推销员拿电筒在遮阳帘上一照，没有见到光透下来一丁点。我立马买了。,3,1,3,2022-07-29 07:17:16,来自湖南,53061827743,亭伊141875150
7125805517033423616,反正我的大众ID4，既不晒也不热！天窗和天幕也只差1000元的选配费，成本方面没什么区别吧！电车怎么了？续航比加一次燃油跑的还多呢！,3,0,1,2022-07-29 22:45:53,来自天津,386660089988861,清爽山雀y7
7125756086434415401,我的也是全景天窗，把空调调到16度，感觉还好吧，因为我不是太怕热的人，主要是怕冷，一到冬天就想冬眠的那种，坐标广东[呲牙][呲牙],4,7,1,2022-07-29 19:33:46,来自广东,59018937909,秋173929828
7125561520448865038,我在海南坐滴滴，新能源车都有全景天窗但空调很好，没觉得这天窗有问题,2,0,2,2022-07-29 07:00:18,来自四川,110543533153,江野阔
7125735154089542413,买埃安y的时候销售怎么吹他们的天幕不热的，都是新的高科技巴拉巴拉的，我打死不信，直接选了天窗版本~,17,17,4,2022-07-29 18:13:02,来自广东,1581017858,不要叫我安导
7125629857282917133,我的是全景天窗，死的，不能打开！自购幕帘，很实用！以后新能源车企肯定会改善这些问题的,2,0,1,2022-07-29 11:24:33,来自河北,75362314020,走在安好无恙
7125597090138833679,哈哈哈哈哈哈[捂脸]这几天挺收音机里的节目也一直再说全景天窗夏天有多受罪[呲牙]还好我家天窗有遮阳板,1,1,0,2022-07-29 09:17:02,来自北京,1983171599543283,时间隔着屏幕
7125791836639675170,其实就是因为电动车电池包太大，如果往下走就容易托底，没办法只能往上找空间，但是地板抬太高又太压抑，只能拆东补西，把车顶换成一块5㎜得玻璃，一下就挖出来几厘米的空间，如果那天幕真的那么好的话为什么燃油车不用[抠鼻],1,26,0,2022-07-29 21:52:33,来自广西,5803119707,碳基生物旁观者
7124680051681477417,特斯拉已经想好了，选配遮阳帘，售价只要10个W[捂脸],2,28,1,2022-07-26 21:58:17,来自安徽,51025116464,摆渡人的生活
7124304120223859491,曾经单位在单位有辆金杯面包车当做工具车用，夏天热不过，经常还要停着当移动办公室，于是自己网上买了隔热真铝箔隔热棉贴一层，那隔温效果，旁边白车车壳温度56，我这里面摸车顶也就33度。同事都说太牛逼了。买了个没天窗的锐界，在车顶放了三张磁性遮字贴。隔温效果比原来带天窗的好太多，上车打开空调没几分钟就凉了，这还是SUV啊。,1,1,0,2022-07-25 21:39:25,来自湖北,800074403428928,sgfx3y
7125576917725823744,我家的是全景天幕，是在除了夏天以外才打开的，看风景确实好，但要保证天幕外面干净明亮，不然看到的就是鸟粪[尬笑],2,8,1,2022-07-29 07:58:45,来自湖北,11188524155,飞飞姐的小确幸
7123870398185243432,全景天窗就是智商税[捂脸][捂脸][捂脸],16,42,0,2022-07-24 17:36:25,来自江苏,16593258499,铭记历史——30万
7125603251244483367,新能源车，90%都是因为车牌拍不到才买的，如果车牌能像六月七月这样的中拍率，再看看新能源车的销量,1,5,1,2022-07-29 09:40:25,来自上海,71050419011,Candy81140
7123899961473041163,车顶都装太阳能电池就好了，防热又发电,2,9,0,2022-07-24 19:32:02,来自浙江,3049028512,七公户外
7125795918175585059,这个题目与内容是风马牛不相及，题目是“高温下的新能源车主：曾梦想开车看星星，却不料被晒得眼冒金星”，而所谓内容的实质与新能源车辆毫无关联，说的是车辆“全景天窗”给客户带来的困恼！难道这是他们对新能源车有看法又无法直接说出来？这不是媒体人所应有的素质！,3,12,0,2022-07-29 22:08:22,来自北京,104878526580,京北山民
7124908264689009445,"汽车挡风玻璃也分等级，白玻（卡罗拉后挡玻璃），F绿，A绿（太阳绿）白玻成本最低，隔绝紫外线能力越差，越高端的车玻璃隔离紫外线能力越强。天窗一般都是黑玻（PGPG,PG20等级越高，颜色越深，隔绝紫外线能力越强。）
特斯拉应该是圣戈班和福耀配套吧。可以看看玻璃上的3C认证编号，能够确认玻璃的型号。玻璃应该比一般的车配置高一点。",1,0,0,2022-07-27 12:44:14,来自北京,4032653580581639,人伴贤良品自高HT
7125780228554638094,新能源车车顶加装个太阳能板，既能挡太阳，又能发电,5,21,0,2022-07-29 21:07:38,来自上海,5472215146,国产大狮子狗
7125630796731351843,为什么新能源汽车不能出厂自带天窗遮阳帘,1,2,0,2022-07-29 11:27:35,来自江苏,5544013388,洛神红茶s
7125569854026924814,天气凉快开天窗，空气比较好,2,0,0,2022-07-29 07:31:46,来自四川,3095236981,有个院子不得了
7125579842212823845,我买车时本来有两个要求，一是不要全景天窗，二是不要自动启停功能。无奈，看中的车型都带这些功能，你说气不气。,3,9,0,2022-07-29 08:10:35,来自江苏,1015552804927460,乐观的西柚Iy
7125779496174732068,燃油车天窗都有遮阳板，并且本身就是双层隔热,2,9,0,2022-07-29 21:04:50,来自江苏,4558028888,锦瑟离人
7125459641437537024,我极其讨厌天窗,2,45,1,2022-07-29 00:24:55,来自湖北,3343008551,青椒西瓜
7123939359824626435,据中研普华产业研究院测算，到2026年，我国汽车用品市场规模将达2.24万亿元。市场囊括电子用品、美容养护、装饰用品、安全用品、改装用品、维修用品等，细分产品更多，竞争较为激烈。具备品质竞争力的企业，将更有机会突破商业周期，稳步发展。,0,0,0,2022-07-24 22:04:37,来自山东,8871173496,李逵在此
7125798323826541312,只要可以45度仰望星空、车内桑拿烧烤又何妨,0,0,0,2022-07-29 22:17:39,来自广东,2648054409202717,村间田野
7124074802214109986,特斯拉开着空调，续航只能达到200公里,2,2,0,2022-07-25 06:50:04,来自浙江,3783952135,正26446254
7124474176097993484,续航第一的竟然是宝马[666],1,0,0,2022-07-26 08:40:15,来自北京,1847640717275511,儒雅精灵7F
7123912747104584485,我一般都是平时无AC车厢过热保护，车内最热也就55℃，出发前十分钟远程开AC，没遮阳帘，没贴膜，挺好的呀，上车就凉快。遮阳帘开始一小时内确实有效，时间久了，车内热量主要来源于热传导了，遮阳帘就没啥用了，该热还是热。买电车舍不得开空调的人，我是无法理解，，，，,10,8,1,2022-07-24 20:21:15,来自上海,68516390628,去雷村开展
7125752779633247015,我看到一台特斯拉在接近四十度的高温下，开着车四个车窗玻璃都是降下来的[捂脸],23,42,2,2022-07-29 19:21:47,来自福建,3979853352676820,L不好玩
7125783255034725156,其实天幕很多车都有，包括燃油车，并标榜为高配。不过电动车怕热是必然的，因为舍不得开大空调，怕费电，不过专家说晒太阳可补钙，我吃钙片所以暂时不买电车。,2,6,0,2022-07-29 21:19:28,来自广东,96786231752,大鹏展翅75500
7124621145248170764,没有天窗 车企还减少不少成本呢,1,5,0,2022-07-26 18:10:32,来自安徽,93132932417,远见卓识明镜W
7124670735758541598,制冷30分钟后车内温度35.8°这是在烤人干么？,9,24,1,2022-07-26 21:22:21,来自上海,97336702843,Jackli007
7125740885132329767,为什么要带新能源，油车不也有天窗,12,14,1,2022-07-29 18:35:55,来自广东,111149591922,2019加油007
7125731870247404318,新能源汽车，就是因为电池仓的局限导致地板抬升，为了保障车内空间高度，不得已才出此下策的[呲牙],8,65,2,2022-07-29 18:00:24,来自湖北,56239577137,寻阳令
7124642565592843042,特斯拉不是有车内过热保护功能的吗？空调可以一直运行。,4,2,1,2022-07-26 19:32:58,来自浙江,4747830710,lx0096
7124689429356544775,"这些都不是重点，
重点是： 现在市面上的这些电动车有没有相关的碰撞测试标准？这些电动车经过碰撞测试了吗？
燃油车都有相关的碰撞测试标准，大家在买燃油车时对安全方面还是挺在意的，怎么到了电动车这里就没人问了？电动车到底能不能碰撞？要知道，路上发生的交通事故，基本上都是碰撞型。",4,14,0,2022-07-26 22:35:12,来自陕西,50064350303,相信科学6699
7123865433337824030,汽车厂商永远不会承认自身产品设计败笔[捂脸][捂脸][捂脸],1,42,1,2022-07-24 17:17:38,来自宁夏,6107587074,花生米863
7125732323202630434,紫外线和红外线是两种波长，所以得单独买专门防红外线的,3,19,4,2022-07-29 18:01:41,来自江苏,6857389929,谁的岁月给了流年
7125768312881431304,能打开的叫天窗，打不开的是大棚，玻璃大棚[捂脸][捂脸],2,19,1,2022-07-29 20:21:38,来自天津,5933340627,非默认昵称
7123903922544231171,这么说吧，特斯拉车主有车库的比例比较大，车不在太阳下暴晒，还是可以的。,3,0,0,2022-07-24 19:47:17,来自广东,54940427382,安全移除大容量设备
7123885836383011624,天窗是最没用的，再给我十次机会我都不会买！,5,8,0,2022-07-24 18:36:32,来自广东,50724015010,乐骑四少
7125770124006867743,真有这么晒[抠鼻][抠鼻]，我的车也是大天窗，基本上遮阳帘没关，就是在露天停车的时候会关，如果停车是车库，开出去基本上没关，感觉遮阳帘就是眼睛不刺眼，温度没感觉有什么区别啊，空调开二十三四度那样子。,0,2,0,2022-07-29 20:28:37,来自重庆,4821138644,一直都是你48442542
7124611662917370662,马斯克开不开这样天窗车？,3,13,0,2022-07-26 17:34:03,来自山东,65605133197,望黄山瀑布
7125739596960334599,我买车绝对不买带天窗的,7,21,1,2022-07-29 18:30:15,来自北京,3685173721838791,聪颖正义之声
7125778388358923043,看了评论，关键是新能源，就想问问大家这个能源新在哪里？难道是用电池做动力的叫（新）能源？七十年代末期八十年代初就有很多国营工厂里用来装卸货物送仓库的都是电瓶车！难道现在用电瓶的是新能源以前的叫电瓶车？,8,23,1,2022-07-29 21:00:19,来自湖南,3507570659,你我的他是谁
7125736892876014347,敞篷跑车为何没人说热?,25,15,1,2022-07-29 18:20:18,来自北京,50944670253,Tom170861142
7124608582108693260,天幕的车多了，人家很多车企至少有 有效遮阳帘，天幕不背这个锅，就是设计有问题,1,45,2,2022-07-26 17:22:06,来自江苏,2748435348860318,Luckyman2022
7124655958122955555,一张天窗冰甲才多少钱？犯得着这么纠结吗？,3,6,1,2022-07-26 20:24:47,来自江西,4515896907,ITF门徒
7125605708577424162,"啥叫无处可逃！这就是，车里的大部分地方都被晒的滚烫滚烫！手都没地方搭！
哪怕空调风开最大，车里也是一半凉的，但另一半还是热的，难受的不行，总感觉体质差一点，绝对会感冒！
万一露天停车以后更惨，如果没有早早远程把空调打开的话，车里根本进不去！",0,2,0,2022-07-29 09:49:50,来自陕西,16129032787,若有所思173
7125643170821800740,欧美很多地方比较靠北，平均温度也就20多点，最高温度才30多点，太阳也不会晒人，根本对干球温度接近40度的，室外太阳暴晒能达到6070度煎鸡蛋的气温没概念，太阳晒着能把皮肤烫伤更是超过他们想象。在他们那种环境下天幕确实舒服，但是在我们这里就完全水土不服了。,0,0,0,2022-07-29 12:16:06,来自重庆,62516703087,西山喵
7125817105517380383,为什么不开空调？燃油车天窗开空调也不热呀？燃油车主不懂,0,0,0,2022-07-29 23:31:44,来自湖南,3618888684,顺顺鱼19981409
7124476893444981537,中国人就是有头脑[泪奔]那个前车镜。。遮阳伞。异性骨。。。。确实不错[泪奔][泪奔][泪奔][泪奔][泪奔]很多人喜欢。收缩和方便。不想以前的。。搞来搞去。。粘在车上。。破坏车体美感[抠鼻][抠鼻],0,1,0,2022-07-26 08:50:49,来自新加坡,6556328444,jante95804001
7124669655184622377,特斯拉官方不建议贴玻璃膜，但我们贴了很多，客户说效果很好，也没有出现过爆玻。这么大玻璃不贴膜怎么行,6,2,0,2022-07-26 21:17:53,来自四川,62436171182,成都蓉漂
7125644359437288227,我想问一下，这样不会减低安全性吗,1,0,0,2022-07-29 12:20:11,来自广东,82996876216,华为联想电脑
7125801258418193185,我坐我们公司的车，就是玻璃天窗的设计，吉利，白天出门那个热哟，最大的空调都救不了，上面司机铺满报纸直尴尬。,0,0,0,2022-07-29 22:30:02,来自广东,101312919216,冰蓝6791
7124629089884930820,没有遮阳帘的全景天窗就是一个笑话[捂脸][捂脸][捂脸]，但是有些人就是嘴硬,0,15,0,2022-07-26 18:41:09,来自浙江,87079795106,简单雅人
7123839254233006883,事实是特斯拉天窗紫外线隔绝率98以上，很多国产牌子的全天窗80上下，懂车帝夏测可以看看,28,4,6,2022-07-24 15:35:46,来自浙江,10820999422,zcsm
7125809741158269711,天幕安全吗？万一翻车，玻璃比铁铝结实？伤害小？,0,0,0,2022-07-29 23:02:15,来自河北,70492498088,浮生事
7124502598312657700,哈哈哈，笑死人了，在车里打伞戴帽涂防晒霜……,0,2,0,2022-07-26 10:29:15,来自山东,3918273451141725,有只泰迪叫笑笑
7124636134558335744,天窗最好是选择购买的，我不喜欢天窗，从来没有开过,7,21,1,2022-07-26 19:07:52,来自安徽,99502710255,广德老梅
7125339317131657987,全景天窗车顶的硬度估计也没有不带全景天窗的结实,1,3,0,2022-07-28 16:37:19,来自北京,1961182089456528,高贵天空sy
7125800809949938463,很多造电动车的公司原本都不是造车的，只是有了电池技术，结果就以为具备了造车的本事，殊不知汽车是综合的产业，比如舒适性，用料，安全性等等，电池只是一方面。就比如一家卖了几十年川菜的老店，突然开始卖粤菜，你，吃了一次还会去吃第二次吗？,0,1,0,2022-07-29 22:27:48,来自四川,3746776073648375,平行和平衡
7125796360053703462,坐在车里再也笑不出来了,0,0,0,2022-07-29 22:10:40,来自江苏,91692503545,七哥说时事
7125691885893092135,特斯拉有温控过热保护系统，怎么会热？开车难道不开空调吗？,0,0,0,2022-07-29 15:25:41,来自浙江,63783240190,水慕容
7124607704651612959,开车停车通过天窗能看什么啊？,12,26,2,2022-07-26 17:18:02,来自山东,2942732512792344,霞客湘鲁情
7124601598214472479,红外线 紫外线和热是不是有什么误解 是玻璃都能透光 热感和紫外线红外线就不是一个问题,9,12,4,2022-07-26 16:54:17,来自上海,2295383701594919,LuckJerry
7125774765843530528,不知道全景天窗到底有啥好的，我觉得不管是夏天还是冬天，驾驶室开车都不喜欢光线太亮，眼睛不舒服，所以我的天窗除了抽烟或者散味用，其他时候都是关闭的，挡板都是关闭的，觉得全景天窗不可能有人喜欢吧,0,2,0,2022-07-29 20:46:52,来自江西,1932465041,空虚27067427
7125730282569433864,真的、汽车开什么天窗！即破财也不实用，看看有那位车主一年开几次天窗,13,39,5,2022-07-29 17:54:15,来自广东,104935760911,安佬安
7125761842869977896,其实就是抠天窗机构和遮阳布的成本。那块布占不了多少空间，实在不行设计的时候车顶抬高3～5cm就完事了。比较高端的电瓶车就配有遮阳布，包括特斯拉自己的ModS、奔驰EQS也配有遮阳布和可开启天窗。,0,0,0,2022-07-29 19:56:18,来自海南,616177658495679,自在凌源0N
7125623263736742671,防紫外线但是不隔热是所以玻璃天窗的通病，有天窗带遮阳板才是王道，遮阳帘都不隔热,0,2,0,2022-07-29 10:58:33,来自江苏,99512041105,外向圆月v
7125746073477563166,买车的时候就不想要全景天窗，可是选的那款车全系列全景天窗。还好配了幕帘，不是特别晒,0,3,0,2022-07-29 18:55:24,来自江西,97587274931,大雨霏洋
7125775668444660514,太阳光的长波辐射通过玻璃后成为短波辐射，但短波辐射不能穿透玻璃，这就造成了典型的“温室效应”。这就是天窗玻璃不隔热的最基本原因。,4,3,2,2022-07-29 20:49:41,来自湖北,63560156078,寂寞高手007
7125672278281159461,我的特斯拉车就是全景天窗，没有觉得很晒呀！天窗玻璃摸着烫头而己,0,0,0,2022-07-29 14:09:20,来自陕西,87172576142,穿越唐朝的女人
7124600280956011298,这位车主就聪明多了,18,80,1,2022-07-26 16:48:52,来自山东,3632407876998968,爱生活的正能量小菜地
7125600341630272287,玻璃天幕没有遮阳帘吗？,0,0,0,2022-07-29 09:30:04,来自贵州,1978726936491966,食乐达人
7125739217933779742,打击面有点大，标题惊人，全景天窗的油车一样热的要死。我这发现四，买车第一周就用隔热棉封死了，要不会蒸熟。,16,9,4,2022-07-29 18:28:54,来自广东,5475789559,庶民无敌狐
7124622188925928205,百分百隔绝紫外线红外线不就行了？,3,5,2,2022-07-26 18:14:27,来自天津,3954854587,著名喷子艺术家
7125748649463792391,如果有东西砸了车子 天幕是不是比铁皮更找不到全尸,0,6,0,2022-07-29 19:05:10,来自黑龙江,2861509458,呲花小青年
7124617108373472033,晒和热是两回事！开了空调只是晒。而且全景车窗，燃油车也有，难道燃油车就不晒了！,19,8,4,2022-07-26 17:54:52,来自江苏,75478627477,比你优秀的黄欣
7125816922683769640,难怪我总觉得全景天窗不靠谱,0,0,0,2022-07-29 23:30:20,来自福建,6156957879,圆宝贝
7125422609378362146,特斯拉车主也怪不容易的,0,0,0,2022-07-28 21:59:49,来自浙江,888023956593086,王一集
7125695760146596649,理想one有天幕的，车内开空调，不热啊！下大雨的时候，把天幕打开，泼天大雨打在全景天窗上，听着雨声，很治愈，刚刚自驾游回来！[呲牙],0,0,0,2022-07-29 15:40:03,来自浙江,931988862673863,乘风破浪的樱桃D588
7124623169189036803,全天窗也有遮窗布的嘛，什么车没窗布的呢用报纸遮挡笑话。,5,2,2,2022-07-26 18:18:27,来自广东,4041408667724220,清新海浪iI
7125664020106986251,话说我车是丰田天窗有遮阳板的，夏天阳光下开车总觉得哪里没关窗，一阵阵热气涌进来的感觉…如果没遮阳板，头顶冒烟了…,0,0,0,2022-07-29 13:37:25,来自广东,2638483305800366,笨噜妈
7123936125177316103,汽车挡风玻璃遮阳伞真的好用,0,2,0,2022-07-24 21:51:40,来自江苏,92670838084,烟火阑珊归来
7125787146329735975,有没有能贴到车顶上的反光膜，天窗直接封死，既防晒又防漏？,0,0,0,2022-07-29 21:34:56,来自河南,71694259240,少言少食少欲
7125666334306370342,特斯拉太晒了，坐在车里空调打到16°。晒的额头烫手。，,0,0,0,2022-07-29 13:46:40,来自安徽,69590841657,某某1217650783
7125809450480714503,八十年代我开解放牌货车，驾驶室热到受不了，然后给修理工焊了个遮阳棚，太阳大时有路边折树叶插上面，打开左边小三角窗抖风进来，别提有多凉快。[呲牙],0,0,0,2022-07-29 23:01:42,来自广西,76697332224,白桦林9766
7125692346284524302,自己买个遮阳板，夏天安上，拆下来也方便，我今天安好了，全车贴上玻璃膜，我今天就是去贴膜，贴好再装遮阳板。,0,0,0,2022-07-29 15:26:46,来自上海,3592832988489139,灵巧海洋GI
7125809487482929934,车里热不热跟新能源不新能源有关系吗？,0,1,0,2022-07-29 23:02:28,来自河北,2471317147496031,御姐梅蒂儿
7125806717082534697,我就奇了个怪了，这些新能源车设计之初、实验车试验时，不先去海南、新疆试验一两年？如果试验了，试车员会不知道存在这个问题？既然存在这个问题，那就只能说明了车厂根本没有做试车试验！,0,0,0,2022-07-29 22:50:29,来自广西,2897932427209915,IM天刚亮
7125810629386650379,我的也是大天窗，里边自带一层隔热的，所以，车里不热,0,0,0,2022-07-29 23:06:55,来自山东,53217622811,索菲娅42
