7125818269030269727,加装一个伸缩的遮阳帘不行吗,0,0,0,2022-07-29 23:36:30,来自贵州,3614832324523639,理想很懒
7124106578168955689,现在的车大多都是全景天窗，好多车子包括4s店都以这个为卖点忽悠第一次买车的人。其实全景天窗没啥用，一年开不到两次，而且夏天还不隔热,0,0,1,2022-07-25 08:53:03,来自广东,104680428678,和9967
7125765293620331267,全景天窗真是最最鸡肋的配置！,0,1,0,2022-07-29 20:10:25,来自安徽,50756438280,Ze154103444
7125751169527677734,在没有真正的防晒隔热技术出来之前，老牌车厂都是傻子吗,0,1,0,2022-07-29 19:15:29,来自江西,51054503221,熊先森的2013
7125778090235822882,一部车最鸡肋的设备就是天窗，更别说最最没用的天幕了,0,0,0,2022-07-29 20:59:04,来自浙江,51376058954,至尊宝0902
7125766612460471053,特斯拉这种全景天窗电动车在欧美会不会被人上诉索赔？,0,1,0,2022-07-29 20:15:07,来自广东,98330693680,中国心84097
7124666750171382540,讲真，我真心不喜欢全景天窗。第一部车的全景天窗，我几乎没用过，打开天窗，就是全景，哪怕我打开一条缝隙，天窗的遮光帘都会自动打开，太鸡肋了,0,0,0,2022-07-26 21:06:55,来自广东,99166775762,天狼星9493
7124732770735702795,特斯拉用车环境：只能在室外温度30℃以下的时候出行,0,0,0,2022-07-27 01:29:52,来自广东,16472234954,超跑俱乐部秘书长
7125793349050647330,天窗没多大用，夏天开车头顶很热,0,0,0,2022-07-29 21:58:14,来自广东,1648876932308244,快乐白云RY
7124799582919934735,双层隔热玻璃搞上，中间带水冷循环降温,0,0,0,2022-07-27 05:43:42,来自上海,108915689110,SOLOLUO
7125754950717899520,天窗华而不实的东西被汽车厂商吹死,0,0,0,2022-07-29 19:29:22,来自河北,79539510472,2018蓝风
7125816657318101795,在电池技术取得突破性进展之前，在电动车动力提供方案有了更优化更安全的设计以前，绿色能源车，绿色吗，火电厂发电，确定吗，呵呵,0,0,0,2022-07-29 23:29:12,来自山东,96138570227,闻之者足以戒
7124699686363071246,哈哈哈，全景天窗的好处[呲牙][呲牙]夏天的烤油神器[捂脸][捂脸][捂脸],0,1,0,2022-07-26 23:15:22,来自北京,51013950256,勿相左
7125707817666921257,夏天晒肉，冬天掉续航,0,0,0,2022-07-29 16:26:35,来自山东,102143998246,嗨文兄哈哈
7125806829120029481,油车的全景天窗就不热吗？,0,0,0,2022-07-29 22:50:43,来自山东,3592835746508995,峡谷小武
7125596938997039908,我喜欢天窗，但是真没啥太大用处，估计就剩下雨从车顶逃生了,0,1,1,2022-07-29 09:16:48,来自辽宁,106874757330,Yan2419
7125760964993303311,空调效果不好怪天窗？,0,1,0,2022-07-29 19:52:42,来自四川,71148077135,昨夜星辰已逝去
7124693769932555038,这么好的大玻璃 为何不用光光伏板发电,0,2,0,2022-07-26 22:52:06,来自陕西,3768745653439004,博学多才的柑桔5
7125821865037824809,难道不是为了做高车内空间吗？电池包已经把车底板做厚了,0,0,0,2022-07-29 23:49:55,来自山东,85082865389,Kyou1990
7124743040581026596,特斯拉车主心态真好,0,0,0,2022-07-27 02:08:18,来自天津,4499909091,大米的小米
7125782446691500808,人家只说隔紫外线，没说隔热。汽车销售诚不我欺[赞],0,0,0,2022-07-29 21:16:13,来自四川,106083808154,黄华625
7124633845584036649,反正我不喜欢天窗天幕。我车的天窗，从来不开。,0,7,0,2022-07-26 18:58:59,来自福建,1327838627369262,XXCross
7125666417541989157,[震惊]才知道，天窗竟然没遮阳帘，哈哈哈哈哈,0,0,0,2022-07-29 13:46:26,来自四川,110896702850,买什么不好呢
7125786142154605346,我的既有天幕也有天窗，还有电动窗帘,0,0,0,2022-07-29 21:30:19,来自安徽,1983166361644199,诗意阳光QJ
7124692775978763041,全景天窗好坏不论，但特斯拉没有遮阳棚就恶心了。,0,0,0,2022-07-26 22:48:20,来自北京,5988295834,我爱我车70
7125803388268626718,"汽车上最智障的设计，天窗！
没有之一，不接受反驳！",0,0,0,2022-07-29 22:37:52,来自云南,79607843757,Xxiao鑫
7125820106487431974,全景天窗就是恶梦！,0,0,0,2022-07-29 23:44:11,来自北京,2361389800495123,落叶里的秋水
7123976663897375522,[马思纯的微笑]天窗遮阳帘一样挡不住高温，行驶中开一点窗能缓解一下脖子以上的热量,0,0,0,2022-07-25 00:30:12,来自广东,5550106364,高山水不流
7125555323045233415,一次没开过天窗的有没有，举个手！,0,7,0,2022-07-29 06:35:42,来自河北,5569928396,青春已经散场
7125813409647936271,谁买的通稿？一天看这个好几个雷同的，就得把天幕的坏处跟新能源绑定…这天幕不是什么车都可能会有的么,0,0,0,2022-07-29 23:16:37,来自浙江,59260975885,二马程序猿
7124676921119507233,全景天幕热的要死，我想要个没天窗的[流泪],0,1,0,2022-07-26 21:46:25,来自天津,67243635801,火柿紫
7125802595651977997,听说北方的冬天 司机腿上盖着棉被 若干年后 有没有人会说 要是有一种液体几分钟加进去 续航几百公里[惊呆] 天冷不担心暖气 天热不担心冷气呢？,0,0,0,2022-07-29 22:34:58,来自广东,2079895132315228,博学多才的铅笔0
7125752947535463168,难道买车前不知道玻璃不隔热？,0,0,0,2022-07-29 19:21:47,来自海南,50782042273,wyj爱在天地间
7124621894753665805,全景天幕车商只有特斯拉和其他[奸笑]，这让我想起某新能源车商也用天幕，一说就有人说你看特斯拉也用天幕，怎么不喷他。,0,0,0,2022-07-26 18:13:00,来自四川,104009576487,南充在下雨
7124831820499157799,不只是特斯拉，现在全景天窗冬冷夏热，就是累赘,0,0,0,2022-07-27 07:48:13,来自浙江,3756879895,秋之叶舞25633829
7125779520187155233,这个天太热了 我看后档玻璃都用隔热垫封死了,0,0,0,2022-07-29 21:05:10,来自福建,1622519502350123,要想破产快就去做户外
7125787288881595170,我的比亚迪元Pro，觉得很好开啊，现在就算开空调也不觉得费电。真心觉得省钱[呲牙],0,0,0,2022-07-29 21:34:50,来自上海,102306467102,嗑CP嗑到上头
7125616409547490085,[抠鼻]人家特斯拉车主都说是高科技，人家都没说什么，你们担心上了。,0,0,0,2022-07-29 10:31:24,来自广东,69661623821,霸王云火
7125807275985847052,亲戚很久很久前买的雪佛兰~一个全景天窗~没半个月就后悔了~南京的夏天~活脱脱上一课,0,0,0,2022-07-29 22:53:44,来自江苏,1838368417,老头憨憨
7125812400766501671,白天就能看星星。四轮电瓶车多划算啊,0,0,0,2022-07-29 23:13:19,来自浙江,86097057870,烦人128
7125581300634845982,玻璃隔热？反正我不信。,0,0,0,2022-07-29 08:16:21,来自北京,50522342208,优美叶子DN
7125803772986999566,今年有全景天窗的是有苦难言！我就喜欢不带天窗的，不是舍不得那点钱。又热又晒！还要担心漏水！但是现在不带天窗的差不多都是最低配。,0,0,0,2022-07-29 22:39:24,来自四川,6452565448,柯南911
7124450555510637319,天窗？特斯拉没有吧？,0,0,0,2022-07-26 07:09:02,来自北京,4098626641737559,完美柑桔hFG
7125744664442897166,防紫外线不代表不热啊，没天窗的车还100%隔绝紫外线呢，不开空调能焖熟在里面,0,0,1,2022-07-29 18:49:42,来自福建,3135426232065723,冰冷的黑夜
7125742163593331489,还有不带遮阳帘的全景天窗？真是时代的倒退呀,0,1,0,2022-07-29 18:40:28,来自北京,104907913291,一米星辰
7125673193985311521,有人说全景天窗发生车祸时能逃生[呲牙],0,0,0,2022-07-29 14:13:05,来自甘肃,81659141657,岁月如歌275933021
7124862828171494184,什么车都要搞个大天窗，夏天热死,0,0,0,2022-07-27 09:47:14,来自贵州,5888760058,老白免70438260
7125812332278219528,天幕的车如果发生翻滚，车内的人非死即伤,0,0,0,2022-07-29 23:13:14,来自浙江,6714578541,王大爷之卧龙凤雏
7125784374842786560,买车两年天窗基本没打开过。,0,0,0,2022-07-29 21:23:31,来自云南,58848991621,YG158668161
7125765631332582174,天幕的目的其实是提高车内空间 减少车重,0,0,0,2022-07-29 20:11:09,来自天津,3255005060273847,一品带枪护卫
7125630641974510371,那这个全景天幕很适合昆明呀，即隔绝了紫外线，二十多度的昆明又不热，一举两得,0,0,0,2022-07-29 11:27:06,来自云南,6287157352,昆明花满楼
7125771761253368610,我的缤智天窗有两层，遮阳板一层，天窗玻璃一层，可以防晒的。,0,0,1,2022-07-29 20:34:31,来自北京,104968666135,引擎呼啸
7125761155741975330,可以买一块原装车顶遮阳布就解决了，哪那么多话呢[灵光一闪][泣不成声],0,0,0,2022-07-29 19:53:32,来自广东,5824358997,MAHAN丫l
7125801451175723783,全景天窗就是噩梦,0,0,0,2022-07-29 22:30:31,来自北京,1055970818273149,杰子
7125754904647336742,这么大个玻璃，中午车放外边暴晒电池会不会起火呀？,0,0,0,2022-07-29 19:29:49,来自北京,61260407841,祥霞怡瑞
7125782632203371305,文章指的是天幕，而不是自带遮阳板的天窗,0,0,0,2022-07-29 21:16:48,来自上海,61805330038,三月神鱼
7124639882798203662,开着车晒太阳，这是天窗最好的用途！,0,1,0,2022-07-26 19:22:53,来自广东,3518027153541373,小小小三炮
7125787063286760200,其实很多燃油车也是全景天窗为什么要强调新能源车呢,0,0,0,2022-07-29 21:34:26,来自广东,1772054347787180,聪明的星球xB
7124888899108881152,全景天幕就是噱头不实用！,0,0,0,2022-07-27 11:28:42,来自云南,765720585311092,五谷饭团
7125661115207959331,我的五菱宏光为什么没有全景天窗？,0,0,0,2022-07-29 13:25:27,来自江苏,4552976161,突然有了灵感
7125802216854143759,我家的电动车上有遮阳板啊,0,0,0,2022-07-29 22:32:59,来自江苏,1151895903943183,乘风破浪的饭团Z6
7125607949586285347,没有硬顶遮阳挡太痛苦,0,0,0,2022-07-29 09:58:37,来自黑龙江,4570322981,风行者希尔瓦娜斯
7125798532179149583,天幕能隔绝紫外线，却不能隔绝红外线，热量主要通过红外线辐射进来,0,0,0,2022-07-29 22:18:38,来自湖南,5480068305,jcdsl
7125819222185935646,本人20年老司机，最讨厌天窗、启停功能。不仅仅一点用处也没有，反而每次带来繁琐。,0,0,0,2022-07-29 23:40:25,来自广东,71976613245,浪一下Pro
7125772441611141922,无论是不是新能源汽车，天窗的配置很鸡肋。,0,0,0,2022-07-29 20:37:04,来自辽宁,4146083589,tybvcxzlgh
7125797594097976067,新能源开空调根本就拉不起来，热天空调带不动，冷天，电池不行，这就是电动车永远跳不出的怪圈,0,0,0,2022-07-29 22:15:41,来自河南,6999956088,2139545798
7125785005829833510,全景天窗釆用了阳光能源，这才是新能源。,0,0,0,2022-07-29 21:26:48,来自海南,55288348845,符君南1
7125807923389203236,全景天窗就是鸡肋,0,0,0,2022-07-29 22:55:50,来自北京,70768592859,北京爷542
7125798961663361833,再怎么搞也没用，热量已经进去车内了！,0,0,0,2022-07-29 22:20:15,来自福建,52275424269,oldking001
7125792881444635406,汽车的天窗就是一坑！当初买车时就坚决不要天窗款！,0,0,0,2022-07-29 21:56:53,来自江苏,95586015079,太平洋顺其自然
7125751622613156616,电动爹电量消耗快，能减重是最重要的。 燃油车的天窗复杂又重，电动车不愿意用,0,1,0,2022-07-29 19:16:58,来自浙江,16851226692,淡泊的橙子CZ
7125799679954666277,[呲牙]天窗除了多个救生通道，毛用没有,0,0,0,2022-07-29 22:23:33,来自广东,10708358946,伟兴印刷
7125771654365446912,防晒的叫天窗，不防晒的叫天幕。,0,0,2,2022-07-29 20:34:05,来自广东,6147188338,37度牛魔王
7125769247452136222,全景天窗就是天抗[捂脸][捂脸][捂脸],0,0,0,2022-07-29 20:25:20,来自山东,6967722880,睁眼一世
7125627926892790531,突然觉得我买油车很香，天窗遮阳棚一按，空调一开，空调开小点风大了冷。,0,0,0,2022-07-29 11:17:21,来自江苏,6965530708,夜晚一盏灯
7125793644988089101,我在想既然电车需要全景天窗，为啥不设计成和油车一样的全景天窗？,0,0,0,2022-07-29 21:59:47,来自陕西,57546096858,关中道故人
7125753495558718249,有的车发生碰撞火灾了，落水了车门锁死，天窗跳生多一条生路，是最多钱换不来的…,0,0,0,2022-07-29 19:23:43,来自浙江,6845136130,无拘无束的飞sir
7125763546348782336,作为一个有着近30年驾龄的老司机，上到BBA，下到昌河，夏利都开过，！确的说，天窗作用并不大，一年也开不了几回，并且带天窗的车安全性会大打折扣！,0,1,1,2022-07-29 20:02:51,来自安徽,2542501982119855,王大爷安徽分爷W
7125810415783052063,这个天幕显得高大上啊，车厂躺赚的,0,1,0,2022-07-29 23:05:23,来自广东,109157362626,万千烽光
7124667141936694057,好多车不需要全景天窗，安全性也大幅下降。,0,0,0,2022-07-26 21:08:03,来自浙江,3667609548238333,徐州热心市民张先生
7125805497915310863,新能源车追求的是外观漂亮，车饰好看，智能软件丰富，其他的都不重要了,0,0,0,2022-07-29 22:45:41,来自浙江,6568057426,油盏哥
7125782022932988676,天窗真是鸡肋！,0,0,0,2022-07-29 21:15:11,来自重庆,6908767902,针行八方
7124941260678824717,全景天窗感觉多戳鱼,0,0,0,2022-07-27 14:52:24,来自广西,6041288503,给你点赞77055881
7125786582820619040,全景天幕没有隔热板的广东车主请谈一下这大热天的感受,0,0,0,2022-07-29 21:32:40,来自广东,11601860337,LED灯珠
7125594252411405096,比亚迪有遮阳的呀,0,0,0,2022-07-29 09:06:05,来自江苏,7023536651,花辰月夕1
7125809885711385379,都买不到不带天窗的车了，也不知道厂家干嘛一定要出品天窗版，几年都用不了一次,0,0,0,2022-07-29 23:02:51,来自浙江,54557455878,135杜比
7125780414362436387,试试岚图汽车的，天幕-它的隔热效果不错。,0,0,0,2022-07-29 21:08:05,来自湖北,3150043910,钩子钓鱼
7124642632345174799,全景天窗和高空抛物更配哦[狗头],0,5,1,2022-07-26 19:33:13,来自上海,87042519724,你长得好好吃
7125807191264658208,这奇怪了，全部是车黑，电动汽车绝对是未来汽车市场的首选，不用质疑！,0,0,1,2022-07-29 22:52:59,来自湖北,4480409782,旅行诗人灰色
7125775673569952551,全景天窗真是最最鸡肋的配置！,0,1,1,2022-07-29 20:50:10,来自贵州,97988469104,騰雲駕霧
7124653155648488223,聪明的特斯拉车主都这样,0,3,0,2022-07-26 20:14:10,来自湖南,103700437474,汐朵漫
7125779618904687364,就是降成本减配，连仪表盘都省，还有底线吗。你见哪个油车有天窗不能开的，没遮阳布的都没有。,0,0,1,2022-07-29 21:05:50,来自福建,76468373762,last2000
7123840593519854370,买一张气凝胶隔热保温毡贴在车顶玻璃上就行，三防（水火电）功能,0,1,1,2022-07-24 15:40:39,来自上海,56555475266,乐语周老师
7124690703133360932,蔚来EC6也是全景天幕，但是官方有200元的第三方幕帘,0,0,0,2022-07-26 22:40:10,来自山东,3827199513,始熊猫厨具
7125612123690631976,能打开的叫天窗，打不开的叫天幕,0,0,0,2022-07-29 10:14:51,来自江苏,6085848816,少言莫生闲气
7124845664139854606,特斯拉车主都说不晒,0,0,0,2022-07-27 08:41:44,来自江苏,5874304905,月亮老爸
7125821363403277056,前年坐过一次某拉的车，大中午太阳晒得，开空调最大也不顶用。这个设计就蛋痛的设计,0,0,0,2022-07-29 23:48:04,来自广东,50522608080,宝期音
7125800142791787305,买埃安y的时候销售怎么吹他们的天幕不热的，都是新的高科技巴拉巴拉的，我打死不信，直接选了天窗版本~,0,0,0,2022-07-29 22:24:44,来自辽宁,4340522837613383,张亮51737
7125787249857495849,天窗车就如装了个浴霸,0,0,0,2022-07-29 21:34:31,来自广西,2414967363222111,豁达豆浆52
7125745525060109088,"带热量的不应该主要是红外线吗？你隔绝紫外线也就是防晒而已，离隔热差的远了。
特意去查了下，还好初中物理没有丢。",0,0,0,2022-07-29 18:53:58,来自江西,65827705384,磐松流云
7125792705674429187,天窗就是一个鸡肋,0,0,0,2022-07-29 21:56:44,来自辽宁,108893754981,加勒比海菜丝
7125748826736345890,众多新能源汽车里面只有极狐那个天窗可以打开，而且是两层，最下面那一层可以完全隔绝,0,0,0,2022-07-29 19:05:44,来自重庆,52870400544,临江听风2
7125780181813379853,能打开的叫天窗，不能打开的叫温室，那多暖和呀,0,0,0,2022-07-29 21:07:24,来自广东,6664954211,嘛哩边哞
7125606389695333160,实话实说，车上两大鸡肋，第一，启停。第二，天窗。,0,0,0,2022-07-29 09:52:39,来自山东,747289562067696,智障鉴定专家
7125793148898771727,我就不喜欢全景天窗，其实三分之一天窗己足够，,0,0,0,2022-07-29 21:57:38,来自广东,82472999326,雄狮登峰
7125806880823952169,哦，原来是买广告遮阳帘[赞][赞],0,0,0,2022-07-29 22:51:14,来自广东,62345407793,快乐人生193433849
7125589722252559134,天幕和天窗不一样，好一点的车都有遮阳帘。,0,0,0,2022-07-29 08:49:03,来自湖南,5147385165,望乡49924542
7125798572389892904,新能源随随便便停车开2小时空调，我油车肯定不会这么搞，夏天是新能源的绝对优势,0,0,0,2022-07-29 22:18:46,来自江苏,8180612924,发呆梦想家
7125788935372358435,玻璃车顶就是个坑，一旦发生翻车事故，乘员非受伤不可。,0,0,0,2022-07-29 21:41:15,来自山东,106627555846,转子泵98
7124839881834742542,现在越来越多的天幕车型，也就是头顶顶着浴霸，四周是烧烤架，坐在中间开车，,0,0,0,2022-07-27 08:19:28,来自浙江,3763498333,小撮棺材
7125605931354309383,全景天窗的好处就是后排的人不会晕车,0,0,0,2022-07-29 09:50:48,来自广东,6301830090,爱过人生无悔
7125690943638143747,顶上这个大玻璃是最没用的了，从买回车来，就没打开过几次天幕。,0,0,0,2022-07-29 15:21:59,来自云南,5398456643,认真的山丘6e
7125788156775269153,我的22款AⅠ0N Y星空顶，可能我的皮厚，晒不到，空调冻西瓜！,0,0,0,2022-07-29 21:38:51,来自广东,51170579783,国LiGuo
7124640416968393483,为什么不像单天窗那样设计一个遮阳帘,0,0,0,2022-07-26 19:25:38,来自四川,66893626294,塔谱a
7125778112478724898,天窗已经四年多没有打开过一次了。,0,0,0,2022-07-29 20:59:21,来自四川,5508966387,134388726
7125806399938216744,为什么不像油车一样加电动遮光板？,0,0,0,2022-07-29 22:49:10,来自河北,98085059141,5201Alex1025
7125807321464914699,天窗就是鸡肋，厂子的赚钱味精,0,0,0,2022-07-29 22:53:50,来自福建,6270427944,Wzp123
7125646694640960290,这玩意你得看它玻璃红外线隔断率，这才是决定热不热的关键[大笑],0,0,0,2022-07-29 12:29:10,来自山东,64359136442,不大不小的鱼
7124713994652386084,红外线隔绝100%？比墙还隔热？可能吗？,0,0,0,2022-07-27 00:12:06,来自上海,60412267193,咸鱼Jason
7125801213723673357,天窗就是鸡肋,0,0,0,2022-07-29 22:29:37,来自江苏,93320379031,爱在深秋4816
7125555522899886887,冬天怕电池续航下降，夏天怕暴晒。,0,2,0,2022-07-29 06:37:13,来自黑龙江,66939977782,人猿泰山412
7125811012263068457,夏天晒，冬天电池。,0,0,0,2022-07-29 23:07:07,来自北京,61609989492,知行者说
7124663842474885922,全景天窗根本不实用。,0,2,0,2022-07-26 20:55:15,来自湖北,70507061727,778588542
7125787487879889696,汽车天窗，其实就拿来搞笑的，一年开不了几次，,0,0,0,2022-07-29 21:36:07,来自广东,3008717877678871,沉着星球G4
7125752555589665567,现在的车子还有哪些不带天窗的车，你们去看看马路上跑的车，唉，国人就爱好面子，你去看看国外很少带天窗的车,0,0,0,2022-07-29 19:20:24,来自上海,5936309847,chiputaosuan
7123921354688496414,天窗就是鸡肋，影响汽车结构安全，基本属于无用摆设[灵光一闪],0,3,0,2022-07-24 20:54:17,来自广东,1706075746475687,老滕
7125767342000325391,天窗就是个笑话，用的人很少。多数人都忘记它的存在。,0,0,0,2022-07-29 20:17:27,来自甘肃,5721851145,BaiYangTong
7125752229159944960,估计汽车遮阳产品厂家与整车生产厂家原本就是一家人[呲牙],0,0,0,2022-07-29 19:19:01,来自广东,67153994491,幸福北票3R0
7124696143053210383,电动车使用全景天窗，最大好处就是在里面安装太阳能发电板，给电池充电。别的全是假的。,0,0,0,2022-07-26 23:00:52,来自安徽,223905147271475,诗意饼干9t
7125803212737151774,全景天窗就是鸡肋,0,0,0,2022-07-29 22:37:17,来自贵州,17841310899,让子弹飞飞飞
7125632808240268070,我的燃油车开了5年，天窗竟然从来没有打开过。,0,0,0,2022-07-29 11:36:09,来自陕西,87669974760,老骥扶犁9996
7124851647246942989,特斯拉设计师都想不到的事，你想到了，真牛！,0,0,0,2022-07-27 09:04:41,来自广东,663721187218541,有卖半岛铁盒
7125820596469924649,人家都说了，隔绝90％以上的紫外线。但是试车里热起来的不是紫外线啊！所以不隔绝。,0,0,0,2022-07-29 23:44:43,来自四川,82738185341,哈喽树xiansheng
7125819418177127182,我也梦想开车看星星，所以买了辆敞篷车[呲牙],0,0,0,2022-07-29 23:41:07,来自江苏,1786044880526349,博学辰星lF
7125643384069030697,全景玻璃真心毛用没有,0,0,0,2022-07-29 12:16:29,来自辽宁,2991091273701902,快乐饼干UO
7124604975132508942,不是新能源车主都喜欢等人开空调吗[捂脸],0,3,0,2022-07-26 17:07:20,来自上海,101745787034,一膘人才232
7125788402863473442,很多人不是说电车比油车好吗。随时都可以开空调吹一天都不耗啥电呢。不像油车得启动才能开空调,0,0,0,2022-07-29 21:39:09,来自广西,51837878927,斌临天下60
7125810589544563471,为什么我的新能源车即使满电空调也不凉快，开最大档也没效果，大家有这样的情况吗,0,0,0,2022-07-29 23:05:30,来自广西,2396583846484643,阿里山下的花环
7125749495727522596,既然买了就想开点儿，夏天热就别开遮阳帘，冬天的时候可以晒晒太阳,0,0,0,2022-07-29 19:08:38,来自北京,95854663906,暹气缭绕
7125559561767224102,我车有电动遮阳帘,0,0,0,2022-07-29 06:53:09,来自辽宁,93693302543,与日寸俱进
7125753893669257997,不管热不热省钱就可以了嘛，在家我都是关着空调扇扇子，省钱才重要,0,0,0,2022-07-29 19:25:49,来自贵州,6950753780,动力火锅厨师
7124824521743303439,说的好像没有全景天窗的油车就不热一样。,0,0,0,2022-07-27 07:19:03,来自广东,84690579596,HM是DoG
7125768697007915776,我买车就不想买带天窗的，但现在的车没有多少不带天窗的，厂家目的是为了提高售价，但天窗的作用实在不大。,0,0,0,2022-07-29 20:22:36,来自广东,52871665840,天涯孤客lk
7125798475350246181,天窗就是鸡肋，鸡肋都不是，就是没用！,0,0,0,2022-07-29 22:18:37,来自广西,6019297627,Lee76121603
7125801473392689928,氢能，水能，风能，太阳能，核能，潮汐能这些才是新能源！,0,0,0,2022-07-29 22:30:32,来自广西,5440637178,13238234518
7124639823411282701,全景天幕就是智商税,0,2,0,2022-07-26 19:22:47,来自重庆,111400015290,乐天派老谢
7123834189237453602,这是图啥[抠鼻],1,1,0,2022-07-24 15:16:08,来自北京,51034468780,袁宝21
7125544346430423844,全景天窗就是个鸡肋，城市里根本用不着,0,4,0,2022-07-29 05:53:58,来自陕西,101485013289,搞怪大妞妞
7125787833453298472,老年代步车没有空调的就一个小风扇也没有如此不堪,0,0,0,2022-07-29 21:36:54,来自河南,3474102566534839,元气风铃sY
7125806124040733480,这只是车身设计缺陷，跟用什么能源没关系。,0,0,0,2022-07-29 22:48:01,来自广东,52361653457,无定向影相佬
7124691509731132190,配置高一点，都是全景天窗，配置高一点，厂商能不能出不带天窗的。,0,0,0,2022-07-26 22:43:19,来自天津,4650499567,舍得46341396
7125788067050849039,续航显示298公里，高速90左右跑，实际跑了120公里就报警充电，然后就是看着续航里程快速减少。心都提嗓子眼了[捂脸],0,0,0,2022-07-29 21:37:52,来自四川,59036629408,廖廖159051730
7124684976683270915,劳斯莱斯连个天窗都不给，天花板就是天花板,0,0,1,2022-07-26 22:18:03,来自四川,4086255057,kk猪蛋
7125819533247562537,非高原地区，海拔2000以下，你挡什么紫外线！隔热才是王道,0,0,0,2022-07-29 23:40:29,来自西藏,237139212384893,暗夜守望者
7124611432318173955,12点，我喷水在天窗上直接雾化。。,0,2,0,2022-07-26 17:32:38,来自福建,61864902049,紫薯布丁丶
7125762240426345216,想想在车里打着太阳伞的样子，再想想屁股下面几十W的豪车，我的嘴角露出微笑,0,0,0,2022-07-29 19:57:36,来自新疆,4265721299742925,大西北林哥
7125806011877163788,害人的天窗。,0,0,0,2022-07-29 22:48:40,来自湖北,68218944552,AA前进AA
7124869068783452936,没有遮阳帘吗？,0,0,0,2022-07-27 10:11:22,来自广东,59181608023,敢博才会盈
7125819360215647010,我巴不得不要天窗,0,0,0,2022-07-29 23:39:39,来自河北,58758414164,镀锌带护栏
7125440311518020383,还好我家比亚迪秦没有天窗,0,1,1,2022-07-28 23:09:17,来自广东,54705987955,为生活打拼144199606
7125802331509752610,[狗头]再商场试乘就知道这个天幕是个坑,0,0,0,2022-07-29 22:33:32,来自广西,52573195737,普洱朗姆
7125806517240480512,比亚迪汉ev，空调冷得要命！,0,0,0,2022-07-29 22:49:40,来自广东,6061587282,房地产是经济的肿瘤
