7125799199622382369,但凡是个老司机都知道车真正需要什么配置，都是些花里胡哨的新车主偏偏要看中这些花里胡哨的配置，全景天窗和大屏幕是最反人类的设计,0,0,0,2022-07-29 22:21:39,来自浙江,2453699607135336,安逸喜鹊EE
7125816143864464128,我坐在老公的电动汽车里，时间长了热得撑遮阳伞。,0,0,0,2022-07-29 23:27:24,来自江苏,101003656763,vlongx691009
7125644679165166339,我有全景天窗，配的也有遮阳帘，但是不够，淘宝上买了防晒隔热层，服服帖帖，非常好用,0,0,0,2022-07-29 12:22:27,,4684999165,岁月流深
7125669880938414855,昨天坐特斯拉中暑了，进去的时候差点烫熟，然后冷气一打，直接嗝屁！我在想这车若是在太阳下暴晒一天那不是里面得烧起来？,0,0,0,2022-07-29 14:00:02,来自上海,5897544612,杰拉德你兔子
7125667399478690600,特斯拉没有遮阳板呀[捂脸],0,0,0,2022-07-29 13:49:39,来自重庆,2937499492298142,做一朵向日葵呀
7124605568609993512,没有遮阳帘？,3,2,1,2022-07-26 17:09:19,来自山东,57961640407,中国大陆北方的网友
7125819462988972841,现在的环境，室外都不容易看见星星了，你还幻想车里看[捂脸],0,0,0,2022-07-29 23:40:16,来自江西,93915979869,倦鸟75432
7125807339240194824,新能源也有遮阳帘的，看你买的哪一款车好吧,0,0,0,2022-07-29 22:53:30,来自海南,51095614844,自由滑翔伞
7125806874003292959,零跑C11真香，大天窗配电动遮阳帘,0,0,0,2022-07-29 22:51:24,来自海南,51095614844,自由滑翔伞
7123878426385154848,去年看车，看到玻璃天幕的车直接闪人，长沙的暴晒从不吹牛,0,9,0,2022-07-24 18:08:07,来自湖南,505381643884339,芝麻荷苗
7125736867047883532,你应该换个题目~全景天窗车,3,9,1,2022-07-29 18:20:18,来自山西,103818285157,追忆逝去的80
7125787300973380355,都是因为玻璃比较便宜，安装时更方便，看起来上档次。其实，这东西翻车就要命，夏天晒死人，现在的造车企业一点点良心都没了。,0,0,0,2022-07-29 21:35:26,来自浙江,72094337042,ysdm4321
7125679101570564878,我买的小蚂蚁带天窗，还有可拉的遮阳板在下面，就挺好,0,0,0,2022-07-29 14:35:54,来自安徽,105483617309,家有牛宝215
7125804341134705412,我买的遮阳帘，夏天打开，冬天收起，挺好的，也不晒,0,0,0,2022-07-29 22:42:01,来自江苏,79806348351,~suki~
7124871647261672224,开玩笑，加个遮阳帘又得贵五万,1,0,0,2022-07-27 10:21:23,来自湖北,5784665652,IT民工64806442
7125580288956302121,我个人认为，天窗真的挺鸡肋的，打开晒的慌，不开又体现不出来它的价值，停楼下又怕高空抛物砸了它，毕竟那块玻璃挺值钱的。,0,2,0,2022-07-29 08:11:49,来自河北,22464474061,纪尚希
7125806071889134373,建议参考宝马X系列的天窗,0,0,0,2022-07-29 22:48:22,来自浙江,87902234925,盈盈教主R
7125809911292003072,现代好多车型车顶是全玻璃而且天窗可以打开有电动遮阳帘的,0,0,0,2022-07-29 23:02:56,来自广东,58446185214,健将体育1
7124849393593303849,没有遮阳帘吗？,0,0,0,2022-07-27 08:55:33,来自陕西,94679975116,龙井青青
7124954688977912617,买车就为了不要日晒雨淋，天窗是为了掉进水的时候能出来，天幕2个作用都没有,0,0,0,2022-07-27 15:44:10,来自广东,104286565379,看星光璀璨
7125821432554701605,这个天窗就是个设计缺陷！不仅无用还会漏水！我下回换车不管电车油车，坚决不要有天窗的！10年里淹了5回！晾车、换电路板，每次都是花费2000到6000！,0,0,0,2022-07-29 23:48:56,来自四川,2941939112488427,眺望贡嘎
7125622190120518400,哈哈！我20年买车，看到这个设计，果断放弃。就因为考虑到夏天会晒死去。,0,0,0,2022-07-29 10:54:19,来自江西,5963461145,南昌游玩
7124734128632857379,制冷30分钟后车内温度35.8?特斯拉这破车还能开吗？我十几万的买菜车随便设置26度，三四分钟车里就很凉快了，这几天广东暴热，开特斯拉不得和进蒸笼一样[抠鼻],0,0,0,2022-07-27 01:31:38,来自广东,1725485570,红旗九哥
7125609471543853858,好的时候看风景确实好看，但绝大多数时候都不实用。晒死人不说，我们这气候，车很难保证干净，开出去一趟就脏了，很那保证那块玻璃是干净的，除了土还有鸟屎,0,0,0,2022-07-29 10:04:33,来自内蒙古,8253582053,柠萌么么
7124816942481310499,买的时候难道不知道是全景天幕[我想静静][我想静静][我想静静] 自己买的，高温酷暑天也要咬牙坚持住。[呲牙],0,0,0,2022-07-27 06:50:07,来自四川,1523361261,唐糖和果果
7125804855583261471,我就是全景大天窗，我们有自动遮阳软顶啊，也可以全收看星星，坐标…国产7座SUV,0,0,0,2022-07-29 22:44:04,来自陕西,14075779762,冬雨111
7125687421211034382,纯电动的汽车夏天开空调很费吗？,0,0,0,2022-07-29 15:07:42,来自浙江,1264293496,倚着朝阳看晚霞
7125607201460536100,买车时特意加钱订的全景天窗，有黑色隔热帘的，挺好呀,0,0,0,2022-07-29 09:55:40,来自安徽,53127858255,想飞的猪0—0
7125805015998055168,我在车里边加装遮阳布，车顶也装，并装一水管，停车时车顶布打开，开车时车内布打开，车顶布收起，间歇喷水，很凉快啊！,0,0,0,2022-07-29 22:43:45,来自广东,2787971627487240,高级葡萄K
7125801091228697383,那不是全景天窗，无法开启的其实是全景玻璃，这样的配置看着高大上，其实比可以开启的天窗更省钱，网络上有博主已经出了价格对比，大家可以搜索试试。,0,0,0,2022-07-29 22:29:09,来自浙江,92332197118,何超军717
7125808891023770399,不要一杆子打死全部，不是所有的新能源都这样，我也是新能源汽车车主，我的全景天窗➕遮阳帘➕天窗就很香,0,0,0,2022-07-29 22:59:34,来自广东,109086231986,时髦溪水vN
7124639798669001509,有个小天窗就足够了，全景天窗就是耗能大户，冬天散热多、夏天吸热多、浪费能源浪费资源。,0,2,0,2022-07-26 19:22:36,来自山西,14683668415,Fante2018
7125782605278200589,阳光里7%是紫外线，44%是红外线。产生热量的主要是红外线。所以，天幕即使能隔绝99%的紫外线，而不隔绝红外线，车里还会很热的。,0,0,0,2022-07-29 21:16:55,来自辽宁,105159101483,公海海钓
7125796773494915854,汽车隔热防晒是最基本的质量要求，不知道特拉斯是怎么通过汽车质量审查的？汽车制造厂家如果这一点不能完善，广大消费者就不要购买。,0,1,0,2022-07-29 22:12:12,来自江西,1345400277313854,花无花有定乾坤
7125647253611660063,要是华为出一种卷帘式太阳能发电顶棚膜就好了。平时全景天窗，热的话开始自发电模式，还能隔热,0,1,0,2022-07-29 12:31:52,来自陕西,3733116656,倒草人
7125633393651647264,主要是今年实在太热，设计师想的是给你看星空谁知道你去看太阳[捂脸],0,1,0,2022-07-29 11:38:28,来自四川,12783384011165,漫小漫7
7125819399721894689,天窗才真的应该成为选装，一是不防晒，二是安全性肯定比无天窗车顶差一些。,0,0,0,2022-07-29 23:40:59,来自四川,5521625179,開心的石頭
7125810759036355362,天窗玻璃下面不带遮挡板的，那热气根本挡不住，我天窗都另外贴了两层全黑太阳膜也只是比不贴强点，真正太阳底下还得关上遮挡板,0,0,0,2022-07-29 23:06:15,来自西藏,101737680465,雪域高原小人物
7125801437204513551,关键是，高配的，都有天窗,0,0,0,2022-07-29 22:29:58,,522967696290110,春城瑕想
7125650791394378529,第一辆车的时候加钱买天窗，后来发现根本不会打开，第二辆车不想要天窗，可是没有不带天窗的款式,0,0,0,2022-07-29 12:46:00,来自四川,1780052996,没有如果26923066
7125818728470053673,天幕再加遮阳帘，和全封闭车顶有什么区别，还多花了二份钱。,0,0,0,2022-07-29 23:37:32,来自辽宁,3633246176551159,端庄小鱼IC
7125772218449789732,标致天窗隔热效果秒杀二田一产加韩系。,0,2,0,2022-07-29 20:36:46,来自广东,103371021575,万中财经
7125800816199860999,奇葩。就是敞篷车都有升降式遮挡风雨阳光的外壳，天窗更有移动式遮阳板，搞不懂没有移动式遮阳板的全景天窗电动车，为啥你要买,0,0,0,2022-07-29 22:27:54,来自四川,3623596557081879,风戒
7125817811754435328,以前买车，防晒的车顶是标配，现在买车，价格没有便宜，防晒车顶却成了选配,0,0,0,2022-07-29 23:33:45,来自广东,6694920538,JOwen
7125783404070617859,看到油价涨了以为新能源车吃香，其实新能源汽车的技术上还未完全成熟，真的算下来还油车好,0,1,0,2022-07-29 21:20:11,来自湖北,2656052159725303,*乖乖兔*
7124707310395998990,啥天幕不天幕的，夏天还是老辉腾和老A8的太阳能天窗强，车内设置好25度，大夏天车停外面，车内温度高了自动打开空调[呲牙],0,0,1,2022-07-26 23:45:35,来自江苏,106875506344,風雲凱嵐
7125812470500836126,我觉得五菱不错，空调也好用，便宜实用上下班神器！,0,0,0,2022-07-29 23:13:16,来自河南,4586226049,jeepchina
7125628176306602792,我想知道什么车有全景天窗没有专门的遮阳板，然后玻璃还不是隔热玻璃，是在给自己买烤箱吗？,0,0,0,2022-07-29 11:17:30,来自陕西,4403647672,山海天40116271
7125801022731567908,高温下车热，与能源车没有关系吧？,0,1,1,2022-07-29 22:28:49,来自广东,66542413830,淼蓝儿
7125810433835533067,全景天窗就是个鸡肋，买车千万别买，花钱还没用,0,0,0,2022-07-29 23:06:02,来自新疆,106897354180,多才麻酱vj
7125817639209124646,"钉子到是很像一把伞[笑哭][笑哭][笑哭]
“我们干脆在车里打起了伞。”福建的一位特斯拉车主表示。",0,0,0,2022-07-29 23:34:07,来自重庆,52244750996,9华少爷9
7123850745140806435,特斯拉赶紧推出汽车配件-特斯拉草帽、防晒霜、防晒衣系列…[捂脸][抠鼻],0,5,1,2022-07-24 16:20:11,来自广东,1877599867645092,李起武律师
7125796445197910821,@曹德旺先生，做天幕玻璃可以加卤化银物质呀，有太阳时车顶变成五颜六色的，既好看又隔热，还可以卖高价，多好[呲牙],0,0,0,2022-07-29 22:10:49,来自湖北,99842410327,亚力山大普拉斯
7125810632188281608,难道电动车天窗没有遮阳板？这是什么设计？我的油车天窗都有遮阳板的呀！,0,0,0,2022-07-29 23:06:22,来自四川,6702010776,快乐鼠123
7125809213342909218,蔚来自带遮阳帘，还行,0,0,0,2022-07-29 23:00:07,来自上海,104596716408,不鸡不佛的狗子妈
7125809600485606184,全景天窗没有电动遮阳板？？？,0,0,0,2022-07-29 23:01:41,来自山东,16640777640,还有二毛钱
7124931574927328034,很早之前就有特斯拉车主吐槽过这个问题了，后来又被公关过去了,0,1,0,2022-07-27 14:14:19,来自湖北,1033131921791880,次玛格登
7125808871339672359,我的黑汉带个遮阳帘，最后还是去贴了隔热膜，感觉能订两小时，准备再贴个冰晶不知道玻璃受得了不，感觉玻璃70—80℃,0,0,0,2022-07-29 22:59:39,来自四川,52555991099,凡夫俗子153654966
7125810351123743523,苹果坏了手机行情 电池不能卸 特斯拉坏了汽车行情 不能开的天窗 其实可能就是节约成本,0,0,0,2022-07-29 23:04:40,来自陕西,106106082738,辰辰515
7124661897995223842,隔绝紫外线、红外线没啥用，主要是导热，玻璃吸收的热量往下导热，就像一个热锅在你头顶上烤着你。,0,1,0,2022-07-26 20:47:41,来自海南,5428488667,N南海一粟
7125636411604206368,[捂脸][捂脸]全景天窗原来是不带遮挡板的呀……,0,0,0,2022-07-29 11:50:05,来自广东,5722937615,Cirol熙
7124658961965449988,我实在受不了特斯拉天幕玻璃，太热太晒,0,4,0,2022-07-26 20:36:45,来自江苏,103619988449,借点信任双倍偿还
7125803705840206606,第一次坐这种全景天窗的车正好是大夏天，那层薄薄的黑布有个毛用，当然比没有要好一点。跟站浴霸底下似的,0,0,0,2022-07-29 22:39:06,来自浙江,1908360817151533,硕人俣俣兮
7125817046176875299,这事儿也不是一天两天了，全国有1000多万台电动汽车车主，以前为啥没人敢公开吐槽？,0,1,0,2022-07-29 23:31:00,来自北京,50250003741,天亮的渔
7125810611359499048,现在有种天窗膜叫冰甲，巨隔热就是有点贵哈哈！,0,0,1,2022-07-29 23:05:51,来自四川,58792979322,洒脱光束ui
7125808665332106015,一体式压铸、天目玻璃、隐藏式门把手[做鬼脸][做鬼脸][做鬼脸],0,0,0,2022-07-29 22:58:32,来自天津,5876727150,天拖北道
7125804024447681310,谁能突破解决车内异味，漆面防晒隔热的问题，一定会大卖！,0,0,0,2022-07-29 22:40:19,来自江西,59441095208,家和万事兴162623145
7125809480184775424,天幕搞笑的设计，徒增烦恼，车身强度也降低了。天窗已无多大用处。,0,0,0,2022-07-29 23:01:15,来自广东,171157702587939,法道常人
7125651165211181855,新能源高档车什么都要讲究一个大字[捂脸][捂脸]屏幕够大了发现天窗不够大就来个全景大天幕[捂脸][捂脸][捂脸][捂脸],0,0,0,2022-07-29 12:47:01,来自广东,61636539392,Binbinpe
7125815762064786210,买车不买有天窗的，容易漏水，出太阳又晒。,0,0,0,2022-07-29 23:25:38,来自湖南,5780883925,今日头炮123
7124584084818445094,这制冷和没有制冷一样[捂脸],5,4,0,2022-07-26 15:46:29,来自陕西,92332788065,木木老头555
7125783389537993480,遮阳帘装在车内，热量也就到达了车内，在车里发热，一样热。遮阳帘最好是装在车外。,0,0,0,2022-07-29 21:20:12,来自广东,3664067841,半边烧鸡
7125559666549031680,我是油车，买的全景天窗，现在一年四季车顶贴着铝箔隔热。。。,0,2,0,2022-07-29 06:52:00,来自江苏,3245113908,你确定吃饱了吗
7124537644667372329,买了带天窗都后悔了。中午出门开空调跟没开差不多 又热又闷,0,0,0,2022-07-26 12:45:39,来自广东,5572791979,只愿一生平顺
7125618404132111142,即使全景天窗隔绝百分之百的红外线车内依然会很热，因为经过暴晒的天窗本身已经热的烫手,0,0,0,2022-07-29 10:40:21,来自新疆,4604512901,你若安好45538055
7125808983986258701,天窗不都是自带隔板的吗？特斯拉没有吗？,0,0,0,2022-07-29 22:59:56,来自河南,2366619775672807,小刚925521
7125810048663978787,什么天窗天幕的，完全都不实用，在南方隔热就是最重要的！,0,0,0,2022-07-29 23:03:26,来自广东,74096464929,赢钱假面12
7125799223953474334,燃油车的全景天窗都有自动遮阳帘！,0,0,0,2022-07-29 22:21:35,来自甘肃,104587681141,西北田田
7125802875598963468,[泪奔]全景天窗看星星看月亮的，确实很不错，奈何这大夏天的晒死你们,0,0,0,2022-07-29 22:36:15,来自江苏,2947105294397176,解忧人小龙
7125745239813636879,全景天幕天窗高端啥，仰望星空，玻璃上鸟屎树胶泥汤印，今年这天气，三十多天大太阳，加上其他地方的冰雹……,0,0,0,2022-07-29 18:51:52,来自浙江,87155203715,牛不喝按头娃不喝狠揍
7125751423672927011,十年前，都开始天窗，越大越好.十年后，天窗做大了，又嫌弃天窗太大不防晒.[泪奔] 这个新能源油车有啥必然联系,0,1,0,2022-07-29 19:15:47,来自陕西,100681060565,DDDDDDDDD灬
7125724088781603616,这是什么反人类设计啊，坚决不买带天幕的车,0,0,0,2022-07-29 17:30:21,来自四川,3358502699,流光君
7125816422194021158,为啥不设计成可以打开的天窗，天窗打开风大的很，必然有风阻，我觉的厂家是为了省电。,0,0,0,2022-07-29 23:29:20,来自四川,103000602949,留恋于红尘之中
7125810014417470248,汽车玻璃生产商应该开发空调蒸发器金属导热型玻璃,0,0,0,2022-07-29 23:03:19,来自广东,3249771323330744,A天天天晴A
7125816958901355303,我现在坚决不换哈弗H6（2014款手动精英版）就是此款车没有在棚顶上挖个窟窿。诺诺的问一句各位，你们购买的座驾带天窗的开过几次？,0,0,0,2022-07-29 23:31:33,来自福建,92460089399,黑土地362
7124704746913137423,铁皮顶的隔紫外线红外线能达到100%。我还是喜欢传统的,0,1,0,2022-07-26 23:34:58,来自广西,85285771139,MOTOR
7125748817542464267,我也是带全景天窗的汽油车，但有遮阳帘，自动空调开21°都嫌冷,0,2,0,2022-07-29 19:06:29,来自江苏,98860423657,alexwwf
7125811139426091788,怎么不去看看那些高档油车有没有这种大玻璃天窗，为什么他们都不用，国内这些厂家都是怎么想的，玻璃出事故意碎，不是更危险吗,0,0,0,2022-07-29 23:08:35,来自江苏,92220812800,一心一意清泉V
7125820510755373839,紫外线晒黑皮肤，红外线才真加热啊。隔紫外线不隔热[抠鼻],0,0,0,2022-07-29 23:44:22,来自北京,53540277412,风和筱雨999
7125808794013156134,不懂就问：天幕～车里面贴层玻璃膜管用吗，能隔热吗？,0,0,0,2022-07-29 22:59:08,来自天津,105167677789,悠悠我心yx
7125783544567890723,三年特斯拉车主表示，全玻璃车顶完全没有问题，别说遮阳帘，连膜都没贴,0,0,1,2022-07-29 21:20:18,来自新疆,6909810184,浪迹的Casablanca
7125586229542126371,加个全景幕布又不费事，新能源车企就是不搞，要看全景天窗，把幕布收进去，不看把幕布打开,0,1,0,2022-07-29 08:34:53,,1090324744387719,榴莲炖雪蛤
7125808225521550093,买车时觉得有天幕漂亮，买了后又要加装遮阳帘，这些车主的心思真的猜不透啊[捂脸],0,0,0,2022-07-29 22:56:46,来自海南,3107719304,无泪天蝎
7125818906505741068,没办法，谁让消费者喜欢呢？天窗、天幕都成标配了，没有的话，这车肯定就是乞丐版，没人买啊。,0,0,0,2022-07-29 23:39:34,来自四川,5521625179,開心的石頭
7125689214985061135,我的车天窗那么多年基本没开过。,0,0,0,2022-07-29 15:14:27,来自广东,3825934581901496,淡泊幸运春风6P
7125624692547044096,天窗没有遮阳帘？设计师不考虑汽车在南方使用？,0,0,0,2022-07-29 11:03:57,来自广东,1578491160831406,肖洒逍遥
7125723770853180201,全景天窗就车商的噱头，影响车子结构强度，增加自重，冬冷夏热。,0,0,0,2022-07-29 17:28:25,,5888760058,老白免70438260
7125713090557362980,刚买车的时候，手痒痒，晚上开去溜达显B，打开过全景天窗，也是唯一一次。之后，天窗与窗幕之间的空隙，塞块遮阳板就没拿开过。,0,0,0,2022-07-29 16:47:33,来自广西,9628795581,梦筑浪潮头
7124826203793605376,全景天窗其实一点儿用也没有，这设计就为提高销售价格，再说 特斯拉 不如比亚迪纯电动！,0,1,0,2022-07-27 07:25:38,来自天津,50007334437,浅巷长歌851
7125814078866195215,全景天窗油车不会这么拉垮吧…我这两天开的18度半路冷的想开窗…车外面34度～,0,0,0,2022-07-29 23:19:29,来自陕西,105094615945,时间都去哪儿了灬371
7125810298560201485,大玻璃顶棚可以贴防爆隔热膜[得意],0,0,0,2022-07-29 23:04:45,来自广西,2027140688651992,可靠漂流瓶aI
7125641225294218025,我国产车天窗都有电动遮阳帘，我不信这些车没有,0,0,0,2022-07-29 12:08:09,来自贵州,96800787092,LY剪刀手
7125624558316864259,哈哈哈哈路虎发现表示带自动遮挡的天幕太香了,0,0,0,2022-07-29 11:04:27,来自河北,50934628404,灰色130297285
7125802789225104128,标志4008车主，我完全感受不到天窗有热气，后来查看一下资料，本身就带隔热，做车也要厚道啊！,0,0,0,2022-07-29 22:35:04,来自天津,4528665870,V_dongge
7125794154361635597,隔绝紫外线只能防晒伤。红外线全部进来行成温室效应了！冬天很不错，夏天就…不说了，我去给天窗降降温,0,0,0,2022-07-29 22:01:52,来自四川,83160068528956,moogle
7125698756019995426,先卖你星光天幕，再卖你防晒遮阳，汽车行业能拉动很多产业呢！,0,0,0,2022-07-29 15:51:28,来自天津,15343993891,爱读书的老赵
7125804498794578724,安装遮阳帘算不算非法改装呢？交警叔叔,0,0,0,2022-07-29 22:42:19,来自广东,6708791814,天涯砱石
7125671121529848588,全景天窗真的没用，夏天热死了。,0,0,0,2022-07-29 14:05:19,来自重庆,6183042292,飘香剑雨81666592
7125787741408871168,昨天开同事特斯拉真热啊，空调凉快，头顶呼呼热很恶心不知道为啥不弄个遮阳帘。,0,0,0,2022-07-29 21:36:27,来自辽宁,6041798320,小黄人杀手
7125696102879642402,全景天幕是适合欧洲那种难得见到太阳的鬼天气吧,0,0,0,2022-07-29 15:41:17,来自广东,6589766227,leeeee97937306
7125716021985919748,本人开燃油车，不知道新能源车在高温天气中耗电量是多少，所以不敢乱说。,0,1,0,2022-07-29 16:59:21,来自广东,23248116846,黎立中
7124967085591577379,特斯拉车主说不晒啊，人家这样设计工程师肯定没问题，[抠鼻]为了减配，尽快交车，省掉尽可能多的配件，车主又养活了改装厂[捂脸],0,0,0,2022-07-27 16:32:18,来自河北,9400623268,幽默的可可乐
7123924120148050701,我十几年前买车直接就不要天窗，我是真怕晒，不是因为钱的原因。,0,0,0,2022-07-24 21:04:59,来自江苏,101406710444,平然75
7125593890568225547,吉利GS天幕带遮阳板冬天打开遮阳板在车里晒太阳很暖和的夏天有遮阳板挡太阳感觉和其他车一样,0,0,0,2022-07-29 09:05:15,来自山东,2862739944387627,晒的黑不溜秋的小白
7125803423744377635,全景天窗设计个电动遮阳板成本很高？,0,0,0,2022-07-29 22:37:48,来自上海,84119676970,仰天大笑出门去拈花
7125366176733168414,起码比我开台小蚂蚁半路抛锚强多了,2,0,0,2022-07-28 18:21:12,来自广东,52347434136,上帝之小笼包
7125792864386450206,我们家，小V就是 全景天幕， 但它配得有电动遮阳帘耶[大笑][大笑][大笑][大笑],0,0,0,2022-07-29 21:56:51,来自四川,3307390631,丶久玥
7125793404470428431,热是天幕的事，天窗也很悲惨：天窗漏水！整车全废！[泣不成声][泣不成声][泣不成声],0,0,0,2022-07-29 21:58:39,来自贵州,106716507855,股海滑板508
7124684098685354756,还是比亚迪比较人性化，有全景天窗，但有布帘可以遮住光,0,1,0,2022-07-26 22:14:30,来自广东,2194272126764942,乐天派橙子JP
7125792842613654287,能打开的叫天窗，打不开的叫天幕，刹车失灵以后就成了坟墓,0,0,0,2022-07-29 21:56:21,来自广西,3182638098,便利峡
7125758632394490639,开空调也没用，去年夏天在延安用过一段时间全景天窗的车，开空调还不如开窗舒服也是服了,0,0,0,2022-07-29 19:43:52,来自山东,53280763706,充满元气的呆呆的风
7125759947429708578,有一种全景天幕是自带电动遮阳板的。,0,1,0,2022-07-29 19:48:41,来自河南,108929820017,看清再说可好
7125622185359721256,哈哈，又催生了一个全新的行业，为新能源车加装遮阳帘,0,0,0,2022-07-29 10:54:13,来自广东,6911682272,HH118462181
7125807151708291843,我的锐界全景天窗还有遮阳帘我都想找块板子封死,0,0,0,2022-07-29 22:52:59,来自湖北,62257234931,蓑烟雨任平生176921032
7124636057500566283,全景天窗就是个噱头！,0,5,0,2022-07-26 19:08:18,来自江苏,55507503284,网事如烟212728946
7125640139099407119,"省成本，特斯拉带了头，国内车企都以特斯拉为参考，其实就是为了省成本，
绝对不买这种车，哪有天天坐着车上看天空看星星",0,0,0,2022-07-29 12:03:59,,5755043937,想着自由自在的可乐
7124083742872027904,车内几乎没有紫外线，玻璃隔离紫外线99%，空调开大点就解决所有问题了,0,0,0,2022-07-25 07:24:37,来自北京,3956052227,米粒皮蛋Dfhe
7125816549608866590,为啥外国人大部分车都没有天窗，这下该明白了吧。,0,0,0,2022-07-29 23:29:45,来自贵州,3580243099,qcdn
7125743492630364964,所以意思是燃油车的全景天窗不热咯，尤其是敞篷跑车更是透心凉是吧,0,2,0,2022-07-29 18:45:29,来自广东,50223475850,静静看2
7125816965541282600,好车[赞]，没想到特斯拉还能带动遮阳帘产业发展,0,0,0,2022-07-29 23:30:38,来自江苏,5826768069,永遠太遙遠66849469
7125788103750992677,问界5的天幕车顶好像还可以，哪天试驾时也是高温37、8度，没感觉晒呢,0,0,0,2022-07-29 21:38:23,来自上海,101761164757,不惑而惑465
7125800825238192896,新能源汽车的空调功率一般是多少？,0,0,0,2022-07-29 22:27:14,来自山东,52691051955,美丽得传说
7124512157328802595,一辆车盘活了一个产业，为特斯拉点赞,0,1,0,2022-07-26 11:07:02,来自江苏,5826768069,永遠太遙遠66849469
7125762596850107171,两台车都是全景，觉得热的是不会拉隔热帘吗,0,0,0,2022-07-29 19:59:02,来自广东,89802645099,普达星人
7125784890851197727,我看过好多小型电动车，动力不行，夏天只能打开车窗，挂一块毛巾遮挡阳光,0,0,0,2022-07-29 21:26:00,来自湖南,6280083463,无双苹果sY
7125785194669327144,大概是车上最没用的装备了，中看不中用，还不如装太阳能电池板，防晒还能发电延长续航里程。,0,0,0,2022-07-29 21:26:35,来自广西,56330970202,有道之年
7125595525583504143,天窗真好，阳光一丝不落的照进我的车里，照的我躲也没处躲，藏也没处藏，40°的高温照单全收，那是多么的享受呀！没天窗，你不懂的！,0,0,0,2022-07-29 09:10:53,来自江苏,3305765460,路在脚下10921319
