7121638830029636364,每一个小镇做题家都值得被肯定与尊重！他们靠自己剥开云雾迎来人生的曙光！有韧性能吃苦，在哪里都会闪光,0,0,0,2022-07-18 17:17:44,来自北京,6070870600,悦之铛铛铛
7121597262886732557,每个行业的精英，都是他们口中所谓的做题家，是国家的中流砥柱智商高且勤奋！,0,3,0,2022-07-18 14:35:47,来自河北,2370179556969437,中年宝爸
7121517346573091588,历史规律，当小城镇做题家的上升通道都阻死了，历史上的规律恐再现。,1,28,0,2022-07-18 09:26:25,来自湖南,99374224366,山秀河清
7121568026629751567,我就是妥妥的一枚小镇做题家！！我年轻时努力学习，进入社会认真工作，我打心眼里尊重每一位小镇做题家,2,29,0,2022-07-18 12:42:06,来自贵州,632973304793160,远见卓识钢笔hX
7121384283335901992,张伟果然是爱情公寓最有种的男人[捂脸],5,279,12,2022-07-18 00:51:05,来自湖南,3604486929,就是爱说大实话
7121497412715250469,去年在网上看到黄国平的事迹，真的是非常敬佩，他确实是位励志的人，用百折不挠，顽强拼搏这些词语都匹配，当然在他成长过程中许多好心人的帮助，也给他许多温暖的支持！,0,19,0,2022-07-18 08:08:44,,80777278907,乐天派清泉lo
7121321182162535182,为中华崛起而读书。,1,37,0,2022-07-17 20:44:19,来自陕西,2488903474876735,段公子5xp
7119510551788864286,首先他现在肯定是高端人才。其次复读上的西南大学，考研才上的中科院，还不能称为做题家,0,16,0,2022-07-12 23:39:21,来自江西,4388849765,任意评说
7121687943240745731,我们都是小镇做题家，解的是时代的难题,3,61,1,2022-07-18 20:28:15,来自江西,62255932136,kiss娜娜
7121660961635369762,小镇做题家，没什么不好，应试教育，就是要会做题，你不会做，985和你无缘。失去了往上拔的机会。靠本事安身立命。别人爱咋說就咋说。先会做题上了大平台再学大本事。,2,3,0,2022-07-18 18:42:53,来自新疆,3210179527586200,欧长松一评论员
7121658463377376040,农村孩子靠读书改变命运。努力学习，难道应该被嘲笑？,1,4,0,2022-07-18 18:33:03,来自上海,6903937868,倔强的大牙
7121621796004365097,努力拼搏的人在任何时候都是值得让人尊敬的！致敬每一个优秀又刻苦的小镇做题家！[赞][赞][赞],0,3,0,2022-07-18 16:10:46,来自云南,52617699625,素兮娆媚小英子
7121637430453338910,我不能称之为优秀的小镇做题家，但我也是一直靠自己努力奋斗，尝试改变自己的命运,0,0,0,2022-07-18 17:12:18,来自甘肃,1407811628314461,夏末的雪
7121555936560481037,有太多人拿着巨额资源，不干道德的事。然后还嘲笑着为翻身奋斗的贫苦者。,0,42,0,2022-07-18 11:55:33,来自北京,106332394392,起早一点
7121551519518573353,"这类人都能被嘲讽
我这普通至极的人
该不配喘气了吧",2,72,0,2022-07-18 11:38:10,来自山西,52961469344,百尺竿头1981
7121560921310298919,绝大部分人连小镇做题家的资格都没有。211平均录取率占高考人数也就5％-8％。,1,49,0,2022-07-18 12:15:01,来自江苏,4120621656578059,人生若能是初见
7119649020917695232,能取得博士学位，进入腾讯工作，那是天才，怎么会是做题家呢，中国社会应该敞开读书这个阶层上升渠道，历史上这也是中国有别于西方的一大优势,0,14,1,2022-07-13 08:35:23,来自上海,5737701964,摇椅小琦
7121554452053902114,小镇做题家的天分普遍优于千万学区房带来的学位。,0,10,1,2022-07-18 11:49:26,来自北京,101159521448,吉奥兽
7121670865976197896,小镇做题家，勤奋刻苦的代名词，不该被媒界扁低嘲讽。,0,7,0,2022-07-18 19:21:24,来自重庆,51644407334,"青平果
"
7121033100364251911,脱离群众，高高在上。这是危险的。,1,98,0,2022-07-17 02:13:37,来自北京,6313662921,刘文止
7121115194147128099,小镇做题家是转化工程师与科技人员最大的群体。。这些人才是国家的基石。。,0,17,0,2022-07-17 07:25:09,来自广东,1059571292968644,聪慧的梦幻郁金香
7121647311042085644,依靠自身努力同命运抗争的群体是不应当受到嘲讽和鄙夷的。反而那些说那种话的人才让人鄙夷。,0,0,0,2022-07-18 17:50:45,来自河南,2128263407733518,啊行人
7121500058302071556,他是博士不是院士，不过无论怎样他都让人尊敬。没有任何理由嘲讽一个出生就是下下签的人，通过自己不懈的努力达到这一高度。心疼并敬佩。,0,8,1,2022-07-18 08:19:40,来自广东,5431103200,差它岁月53903276
7121732241868505864,终于有一家官方媒体看到了＂小镇做题家＂，是应该高兴呢？还是悲哀？,0,0,0,2022-07-18 23:20:13,来自江苏,110936688751,风轻889
7121465030105367311,机会给了资本，给了不会唱歌的歌手，不会演戏的演员，唯一标准的称呼是小鲜肉。其他小镇做题家哪来公平的机会？,7,23,1,2022-07-18 06:03:18,来自上海,52809590975,陶之灼灼
7121141145975161604,是谁挑起了“小镇做题家”的话题,5,16,1,2022-07-17 09:06:39,来自广东,3149468508,hspeed
7121587485817324328,他们一直在挑衅，只不过现在公开放在桌面上说了。,0,11,0,2022-07-18 13:57:45,来自新疆,3469693645231431,猫和老鼠的孩子
7121587290153337634,当一个社会开始嘲讽通过自己努力改变命运的时候，就非常危险了,0,33,0,2022-07-18 13:57:00,来自广东,92366175327,油炸白斩鸡
7121723423428690729,普通人的奋斗更值得尊重！,0,5,0,2022-07-18 22:45:26,来自上海,59119370402,竹林深处有人家777
7121532105918038799,做题改变自己的命运，国家鼓励支持的啊！高考是唯一一个最公平最可以让寒门学子还能改变命运的机会。如果普通人没有高考，如果没努力做题，我们国家靠演员演技繁荣富强吗？,0,0,0,2022-07-18 10:23:00,来自河南,1292621335494926,自在随风的黄叶子
7119455988294058759,小镇做题家比大城市的孩子更不容易，值得尊敬,0,116,0,2022-07-12 20:06:55,来自广东,5508924633,三十不惑9527
7119495205380408072,中国能有这四十年的巨大成绩，靠的就是这些出身寒微而又兢兢业业的小镇做题家们。他们不惧命运努力向上，才有这个国家每一点的发展和进步。,0,61,0,2022-07-12 22:39:18,来自广西,5416548470,正能量1239
7121559708091613964,现实中大城市如北京、天津的孩子们在教育乃至高考和以后找工作中确实高人一等。,2,13,0,2022-07-18 12:10:37,来自湖北,109286981633,巧克力8433
7121526211850830603,各行各业要成功都不能走捷径，不知道医学的哪那么玻璃心。,0,1,0,2022-07-18 09:59:23,来自四川,4070520992,北纬第几度
7121665344582386443,至少小镇做题家清清白白,0,14,0,2022-07-18 19:00:46,来自山东,7612175656,木棉143878168
7121679768114348800,我自豪我骄傲，我是小镇做题家。,0,0,0,2022-07-18 19:55:50,来自广东,796458836570344,七心摩羯
7121450312904377124,努力求学的样子很美，赞同支持友友，早上好[赞][玫瑰],0,12,0,2022-07-18 05:08:10,来自吉林,1170305990814680,小清新iiiiiiiii
7121367592719401764,支持！希望严惩下这个定义的人,1,20,0,2022-07-17 23:45:47,来自吉林,55136274407,豁达青山1
7121494255809512203,国家的未来不靠努力读书的人，难道靠富二代？,1,23,1,2022-07-18 07:56:41,来自河北,83681489489,年月日702
7119653702944097039,我梦想成为小镇做题家，但实力不允许啊！！,0,7,0,2022-07-13 08:53:39,来自四川,101859653888,瞎眼观察
7121688330567844615,有的时候，疯狂做科研/疯狂做事也不行，得荣誉/分蛋糕的时候还是轮不到老实人。,0,1,0,2022-07-18 20:29:19,来自江苏,105801529607,wanqing7686
7121602881589134110,五个字逼反天下读书人，真是硬核啊[捂脸],1,17,0,2022-07-18 14:57:53,来自上海,13234634304,三千栩栩
7121552338413896463,普通人有几个不是靠小镇做题出来的,0,1,0,2022-07-18 11:41:06,来自重庆,73499397454,糖果云2
7121253156780311331,图片满满的回忆过去吧！,1,25,0,2022-07-17 16:20:22,来自四川,131558257208765,雷诺电动工具
7121645488239215394,小镇做题家呼吁：教育、就业要公平。,0,0,0,2022-07-18 17:42:38,来自山东,2722006464990668,墨河秋水
7121571810495873825,瞧不起小镇做题家的是新闻周刊和杨主任,0,30,1,2022-07-18 12:57:37,来自江苏,2524949285715531,善良春天真美啊
7121116743879426829,小镇做题家应该是褒义词吧，至少说明学习好，智商在线，努力勤奋。,7,12,3,2022-07-17 07:31:47,来自北京,71998210490,萝卜柳
7121518442754294568,一直觉得他还蛮不错的 演技有目共睹的在线,1,34,1,2022-07-18 09:29:44,来自浙江,86225266238,早安Mathilda🎵
