7121553047150576388,"作为一名小镇做题家，坚信哪怕没有背景，只要自己肯努力，就有希望。这是对自己的鼓励，是自信的源泉。
初到异国他乡举目无亲的时候，学业与经济双重压力山大的时候，在挫折失败的泥泞里挣扎的时候，是曾经、现在以及未来，不卑不亢行走于人世间的力量。
这是许许多多小镇做题家们的信仰啊！",0,1486,2,2022-07-18 11:44:43,来自日本,92981524290,这里是东京
7121554122977542912,"没错，嘲讽“小镇做题家”是病，得治！
他们口中所嘲讽的“小镇做题家”代表着这个时代现实生活中的大部分年轻人，他们努力上进、勤奋好学、有学识有见解，他们严格遵守国家体制内“逢进必考”的要求，只是希望能在公平公正透明的同等情况下争取向上的机会，他们才是正能量，他们才能代表现实中的奋斗者。",0,1670,0,2022-07-18 11:48:17,来自湖北,6241060828,墨墨努力ing
7121565892588503847,我也是一枚小镇做题家，一直在努力奋斗尝试改变现状，让自己过的好一点。但最近一直对某主编对“小镇做题家”正大光明的傲慢与嘲讽无法释怀，看到团团如此正能量的文章，终于顺了顺情绪。对啊，我们这些小镇做题家那个不是努力在自己身上克服这个时代，追求物质满足的同时追求精神富足，用的手段其中之一就是“做题”。,0,617,0,2022-07-18 12:34:28,来自新疆,153553778517287,落雨593
7121552211884213023,任何时候都不能嘲笑“小镇做题家”，他们扛起了国家勇毅前行的每个支点,0,653,0,2022-07-18 11:41:09,来自江苏,66648782197,康宝宝48
7121565358058029863,我也属于小镇做题家，所以评中级职称用了七年，工作第十二年才艰难的评上，因为我们规定是工作五年后才能评中级。目前情况是，比我晚工作很多年、业务能力一般的都已经是副高了。这就是小镇做题家在高校真实的处境。,0,361,0,2022-07-18 12:32:21,来自四川,6698858141,开花的树why
7121552003272753954,每一个奋斗的人都值得尊重！支持团团,0,357,0,2022-07-18 11:40:03,来自浙江,79775594434,时光清浅70后
7121547821312459552,"有人把自己的成功归因于自己的努力和优秀，以一种高高在上的优越对所谓的普通人指指点点。其实很多时候，人与人的差异是出生和环境决定的。那些不肯向出生和环境屈服的人，没人有资格嘲笑他们。
 小镇做题家值得",1,450,1,2022-07-18 11:24:47,来自重庆,6149302103,就不数三80719967
7121546823755694848,"靠努力改变人生的人。不但不该被嘲笑，反而应该被钦佩赞扬。
他们没有办法改变自己出身的环境，但是在努力改变自己将来的命运。
不摆烂，不躺平的本身就是非常可贵的坚持。
我们很多人缺乏的不就是努力和坚持么。。",0,193,0,2022-07-18 11:19:52,来自四川,7012911571,猪头家的姑奶奶
7121540310047720229,这才是正能量,0,621,0,2022-07-18 10:54:59,来自福建,3865491423626461,ZG7722
7121551657657336609,终于等到团团为小镇做题家发声了！,0,306,0,2022-07-18 11:39:16,来自四川,61784733984,观点杂货铺
7121543832864310019,"不是每个人都含着“金钥匙”出生，有些奋斗也许笨拙而沉重，但每一份不愿低头的奋斗，每一个负重坚韧的人生，每一位勇毅前行的普通中国青年，都值得尊重。
[赞][赞][赞][赞][赞][赞]",0,578,2,2022-07-18 11:08:59,来自江苏,976837051693304,九月的高跟鞋123
7121565791639962405,这个称谓违反了“学而优则仕”、“学成文武艺，货卖帝王家”的儒家观点，几千年儒家灌输的成绩被一个称谓嘲讽了。而且是对他人努力生存的不尊重，太高高在上了，真要警惕！,0,115,0,2022-07-18 12:33:49,来自河北,6831632092,爱吃辣椒罐的遁空尊者
7121564562263966467,让嘲讽小镇做题家的杨主编出来道歉！,0,321,1,2022-07-18 12:29:11,来自江苏,54038082281,南宫清玄
7121558514253726479,可以让写的人下岗吗？他的道德素养业务水平不适合这个岗位了,0,299,0,2022-07-18 12:05:06,来自四川,3874314351285005,快乐齐天的齐天
7121562928779641615,果然是我们热爱的团团[送心][送心][送心]，看到你的支持莫名心酸，眼见奋战在各行各业的中坚力量被嘲讽“小镇做题家”，确实很难接受,0,131,0,2022-07-18 12:22:15,来自四川,281063339338616,秦川的晴川
7121562937135301380,给共青团点赞，嘲讽别人的努力本身就是一种病，得治。,0,112,0,2022-07-18 12:23:06,来自湖北,75249210155,雨滴砸不出水花
7121552678844924712,现在各种妖魔真多，创造种种标新立异的词，故意拉偏人们的价值观！正能量加油！,0,150,0,2022-07-18 11:42:40,来自北京,54409183897,nana6121
7121563376501031683,共青团就是有正能量，为勇敢奋斗的年轻人发声估计[鼓掌][赞],0,98,0,2022-07-18 12:24:38,来自安徽,63957310312,雾里看花小丫丫
7121562451266831144,靠自己的努力奋斗改变命运，还被资本嘲笑，其实还是会心酸的，在他们面前我们的努力就是个笑话……,0,83,0,2022-07-18 12:20:24,来自江苏,356709331898940,小镇做题家a
7121561543389184808,这年头，走捷径的高高在上，拼汗水的低人一等！这个时代是怎么了？,0,97,0,2022-07-18 12:17:03,来自山东,61019922964,可乐雪碧芬达七喜
7121562890871554848,"讲得好！
人没有贵贱之分！
尊重他人，你才能赢得他人的尊重！
奋斗者永远前行！
前行路更宽广！",0,77,0,2022-07-18 12:22:30,来自山东,105691650845,刘洪堂
7121552694867313442,团团发声了，中国新闻周刊的杨主应该快任要失去他的编制了[爱慕][爱慕][爱慕],0,143,0,2022-07-18 11:42:45,来自云南,51569025304,商业娱乐
7121234031961768745,这么些天来总算看到一篇官方正能量的文章,0,75,0,2022-07-17 15:05:59,来自浙江,66949997370,L269688711
7121560284703736588,共青团中央 正能量官媒 点赞[赞][赞][赞][赞],0,80,0,2022-07-18 12:12:58,来自辽宁,6326857709,洗发精的麻麻
7121550120378008320,无论在什么地方，都需要努力！！！重点是，努力的人更应该被尊重！！尤其没有伞的孩子！,0,85,0,2022-07-18 11:32:31,来自安徽,311909030568775,蜗牛和梦想家
7121547314191368993,能担上小镇做题家的人是勤奋、刻苦的人，从来不觉得这五个字是贬义词。[加油][加油],0,74,0,2022-07-18 11:22:07,来自湖南,9515197796,囿囿5
7121563084732416783,尊敬每个努力奋斗的基层人,0,38,0,2022-07-18 12:22:48,来自云南,110670588310,柳絮FIY
7121563866484146975,小镇做题家是一个自嘲的称号，而不能用于贬低别人，努力的人都不该被嘲笑,0,37,0,2022-07-18 12:26:28,来自江西,791250671767768,糖糖塘沽
7121557354700653348,在没有这个词之前，人们把这类人称之为寒门贵子，称之为早上八九点钟的太阳，称之为为中华崛起而读书，什么时候出生成为原罪，什么时候普通就是卑微，什么时候努力改变命运，得到的不是尊重和掌声，而是嘲讽和不屑。,0,101,0,2022-07-18 12:00:49,来自天津,108066614574,Ashleysilk
7121597903634301700,小镇做题家努力做题改变自己命运，也努力奋斗创造财富，勇毅前行，不负韶华。他们是祖国的建设者，国家需要他们，值得尊重的劳动者！,0,17,0,2022-07-18 14:39:07,来自四川,58761912946,鹿鸣呦呦612
7121112270570472196,制度优势要体现！,3,172,1,2022-07-17 07:15:06,来自福建,5446451226,火力全开-苏华
7121553165195166497,唉，寒门再难出贵子，小镇做题家，最后在大城市，被写进电视剧，也是变成了大家唯恐避之不及的凤凰男！,0,42,0,2022-07-18 11:45:05,来自河北,58614797890,美好小绿
7121560513385546533,这个世界每一个努力奔跑的人不该被嘲笑,0,31,0,2022-07-18 12:13:33,来自河南,3237387970,迷你世界璎落游戏解说
7121606390615458600,感谢正能量官媒。新时代是奋斗者的时代，幸福都是奋斗出来的！,0,11,0,2022-07-18 15:11:01,来自山东,59599831834,小丸子1986
7121584863799165700,我从小镇走出来，没取得很大的成就。在我们行业内我考取最难的证书，从事这艰苦的工作。我能养活自己，为建设祖国而努力。我为我自己曾做过的题熬过的夜而光荣。,0,17,0,2022-07-18 13:48:39,来自山东,70982772004,WinterQ
7121563173211226880,我也是千千万万小镇做题家中的一员，我是，我自豪,0,20,0,2022-07-18 12:23:06,来自浙江,2282188432215956,健康好运的vanya
7121549437742449416,奋斗的人生最美丽！绝大多数人通过奋斗建设国家，通过奋斗改变命运，通过奋斗追求更好的生活！！！,0,23,0,2022-07-18 11:30:20,来自湖南,4376980866,天山童姥又如何
7121563743477105411,新时代是奋斗者的时代。居高临下地嘲讽“小镇做题家”，其本质是在解构“奋斗”——不是每个人都含着“金钥匙”出生，有些奋斗也许笨拙而沉重，但每一份不愿低头的奋斗，每一个负重坚韧的人生，每一位勇毅前行的普通中国青年，都值得尊重。,0,11,0,2022-07-18 12:25:55,来自江苏,3679072529,wjssb
7121285778277761826,我怎么觉得是个褒义词，没有超高智商，靠自己的勤奋努力刷题开辟出来的一片天地，怎么就成了贬义词了？,0,13,0,2022-07-17 18:27:03,来自广东,47996406598035,沐子的阳光
7121545010352587557,好文章要大家都看见。,0,39,0,2022-07-18 11:13:18,来自广东,23452699295,喜欢乱逛的懒妹子
7121549543430210315,感谢团团为普通青年发声[泣不成声],0,27,0,2022-07-18 11:31:03,来自四川,6892869070,种花盆的喵喵
7121578460241511200,这种嘲讽就是否认自己奋斗的重要性,0,7,0,2022-07-18 13:23:28,来自福建,1129929147155115,dogyu
7121561250492072718,有些奋斗确实笨拙而沉重，看着别人一脸轻松 还被嘲笑你那么累搞得看的人的累，能不能消停会，但是不能啊。。,0,9,0,2022-07-18 12:16:05,来自湖北,77176283566,忽然又夏天
7121537709197624102,团团说的太棒了，只要没有害人，每一个努力的人都应该得到尊重[心],0,141,0,2022-07-18 10:45:21,来自北京,1789631391859847,心自无暇
7121546508478235427,我也属于一名小镇做题家，我努力奋斗改变命运有错吗？,0,22,0,2022-07-18 11:18:37,来自河南,106536126189,正义的阿红妹妹
7121561057050936101,"待到秋来九月八，我花开后百花杀。
冲天香阵透长安，满城尽带黄金甲
以上是唐末小镇做题家所著，希望以史为鉴，秦人不暇自哀，而后人哀之，后人哀之而不鉴之，亦使后人而复哀后人也。",0,25,0,2022-07-18 12:15:22,来自上海,53603725759,雨165327370
7121542877234692868,团团你终于发声了……[大哭][大哭],0,165,0,2022-07-18 11:05:35,来自湖南,3632384182072684,用功读书的学生46
7121565590753886991,终于有人为小镇做题家发声了,0,8,0,2022-07-18 12:32:33,来自江苏,3012294345231037,九漏鱼888
7121539984699933451,我是“小镇做题家”，我骄傲我自豪！！！,0,119,0,2022-07-18 10:54:11,来自广东,1767608420939358,顿悟的鱼PD
7121562679776576287,小镇做题家很棒的，我努力，我奋斗，靠自己的勤奋改变一切！,0,14,1,2022-07-18 12:21:37,来自江苏,3513667397356941,ai花椒
7121552116124173094,中华上下五千年，都没有嘲讽过读书的，以前是“万般皆下品，惟有读书高”，现在好了，小镇做题家 农村错题本,0,33,0,2022-07-18 11:41:01,来自浙江,1767662353391384,渣男当自强
7121565801303491343,只要符合规则，每个梦想都值得尊重。大多数人是理智的，不是为了观看闹剧，只想维护力所能及范围内的公平以及社会公信力。,0,7,0,2022-07-18 12:33:20,来自广东,92796274937,端端端1995
7121565099496063755,说明他们已经居高临下了，觉得自己永远可以高高在上，你们永远无法超越了,0,11,0,2022-07-18 12:31:37,来自辽宁,60655576609,哈哈熊666
7121566801779278622,昨天到今天看了下广东省的重点中学，发现南科大录取了不少厉害的孩子，也感慨现在的教育素质比起我那个时候上学那是强的太多太多，看到这么多理科类人才和本季度屏蔽的中考状元分数的数量，还是感觉浑身充满了力量，有干活的冲劲了[大笑],0,5,0,2022-07-18 12:37:36,来自广东,1807222585163963,童路caler
7121292111723021090,“小镇做题家”原本是知乎上985高校毕业雕丝的自嘲，结果被一些人真拿来嘲笑了。中华民族自古以来就提倡勤学苦练的优秀品质，当代更要发扬艰苦奋斗、勤学好问的精神，摆正价值观。,0,18,0,2022-07-17 18:51:33,来自江苏,78277515872,RaymondIT
7121564887230939941,小镇做题家也是有门槛的，我是小镇的，做题经常不及格，哪里配称为做题家呢？我不生气，那是骂我们班第一名。,0,6,0,2022-07-18 12:30:18,来自北京,610967385282071,元气葡萄In
7121539281155916559,每一位勇毅前行的普通中国青年，都值得尊重。,0,51,0,2022-07-18 10:50:37,来自海南,61890632831,一分秋色
7121202461071016737,“小镇做题家”这个说法是对寒门学子赤裸裸的歧视,0,135,0,2022-07-17 13:04:20,来自北京,82214699890,冰壶2022
7121566254212825889,也不用这么生气。我是小镇做题家，我挺骄傲的，谁要是嘲讽我，那他可能要大失所望了，我就小镇怎么了，我就做题家怎么了。他这样说我，倒让我忆苦思甜啦！反倒是嘲讽的人嘲讽完了得到什么了呢？我也不是很懂大家这么激动的原因在哪儿，就坐看小丑跳梁不好玩吗。,0,75,0,2022-07-18 12:35:53,来自广东,2625264534951368,真诚西柚QY
7121378699014587149,我觉得小镇做题家有什么错？他们所在的地方给他们的帮助有限，他们唯一的努力方法就是做题，怎么了，有啥错？我还招聘过几个山村做体家出身的孩子呢，这样优秀。有啥可嘲笑的，这就和嘲笑别人衣服不是名牌一样，有啥,0,2,0,2022-07-18 00:30:53,来自北京,12445978747,仗剑天涯行天下
7121562803202360098,感谢团中央的正本清源！从小镇中走出去的我们要不忘初心，大部分人都是从普通的群众中奋力一跃到达更高的地方，即使在山顶也绝不能忘记来时的路！也绝不能嘲笑甚至否定来时的路！,0,13,0,2022-07-18 12:21:41,来自安徽,53153899209,杨阳洋羊洋阳杨
7121561918338892544,以前他说我们是八九点钟的太阳，让我们努力读书，为国家奋斗。现在说我们是小镇做题家[捂脸][捂脸],0,13,0,2022-07-18 12:18:27,来自广西,2076320761644971,巨星卷毛14
7121094722860598016,有个短视频，欧洲某国街头随机访问我们是否应该救助难民，被采访的每个人都持赞成态度，但是问道现在能否直接领一个难民到他家里住一段时间，好像只有一个人说可以。,12,147,4,2022-07-17 06:06:17,来自上海,19120074357,同往却同归
7121201706947920644,小镇做题家不应该是贬义词。无数种人生方式之一，都值得尊敬。,0,80,1,2022-07-17 13:01:17,来自北京,75775845813,张京团团圆圆
7121565796920820521,点赞共青团，高档次文章,0,7,0,2022-07-18 12:33:23,,2129116044207581,青丝三千散千结
7121695370241131300,就是，出生不由己，道路可选择，命运靠自己，毕竟，命运的一半还掌握在自己手里,0,0,0,2022-07-18 20:56:13,来自新疆,2559311467511816,繁花若梦入流年
7121566386073895695,点赞，我就是小镇做题家，凭什么被嘲讽。,0,7,0,2022-07-18 12:35:45,来自广东,59616811673,奋斗在广州2016
7121266757058675495,被嘲笑的既不是做题家，也不是小镇，而是他们的向上通道太窄，除了做题，已经一无所有一无所能。因为全社会的资源，已经被那些人霸占光了。,0,36,1,2022-07-17 17:14:00,来自北京,55216967009,你的用户名已被收回
7121232200179827470,资本已经野蛮到完全不顾及普通民众和舆论的地步[泪奔],0,78,0,2022-07-17 14:59:28,来自江苏,4571827799,灼热滴莎莫
7121561397506786079,每位不甘于普通和平凡的奋斗者都是可敬的！！！！,0,5,0,2022-07-18 12:16:52,来自重庆,50294206937,甜言谜语
7121553450676536071,同意，小镇做题家是刻苦努力的奋斗者，奋斗者不应该被嘲笑。,0,10,0,2022-07-18 11:46:00,来自广东,50694089444,望月的冰雕
7121561193206334223,对嘲笑“小镇做题家”的机构和单位，要严厉打击！通过个人奋斗成为受人尊敬的人，是值得光荣和骄傲的！,0,8,0,2022-07-18 12:15:29,来自上海,95623386943,乐洪凯
7121563943763493662,每一位不愿低头的奋斗，都值得尊重[赞],0,7,0,2022-07-18 12:26:19,来自广东,91856648962,gg我想我是海36
7121559467908416259,感谢共青团中央的认可，小镇做题家，用自己的努力换来的一切，值得骄傲和自豪！,0,6,0,2022-07-18 12:09:20,来自山东,1099156038617855,画堂雅宴
7121557674950296350,默默支撑我中华大国崛起民族复兴的，正是这些“小镇做题家”。不是那些什么二代。,0,14,0,2022-07-18 12:02:19,来自山西,5795817259,A山有扶苏A
7121545271389012769,是哪些人在解构奋斗？为什么要解构奋斗？值得思考！,0,21,0,2022-07-18 11:14:34,来自湖北,4746848632,郑刚177801770
7121550057543549709,星光不负赶路人，成功处于奋斗者，诋毁努力和勤劳，是这些自私自利者最后的伎俩,0,9,0,2022-07-18 11:33:02,来自河南,5761404274,有些人活着
7121549096489812739,不是所有人都可以成为小镇做题家的！,0,8,0,2022-07-18 11:29:29,来自广西,6756394111,猫小咩U
7121562954449257256,超燃，出身不能选择，但努力奋斗可以，讽刺小镇做题家的人可以闭嘴了,0,5,0,2022-07-18 12:22:26,来自新疆,5498506426,凤凰台上梦
7121552146541134622,昨天和侄女说了这个小镇做题家的事，她说这个称谓给人不适感。我说，我觉得，这个小镇做题家，不是一种侮辱的称呼，在我看来，没有资源，靠自己努力，成功了，这样的人，比很多人都优秀。他努力，自律，刻苦，向上。,0,148,0,2022-07-18 11:40:57,来自广东,6107570556,吃饱来杯茶
7121564110600471304,努力奋斗的人值得信赖和好评！,0,6,0,2022-07-18 12:27:06,来自河北,2968335468732088,柳暗花明LppHi
7121555581919413030,说得好[赞][赞][赞][赞][赞],0,8,0,2022-07-18 11:54:26,来自江苏,97801316370,上山下乡整日忙
7121562077235675936,说的太好了，为团中央点赞，向每一个奋斗者致敬。,0,6,0,2022-07-18 12:19:43,来自北京,98916843060,永远的19491001
7121549164684854024,团团，希望我们一道努力，把小镇做题家打造成对我们的赞美之词！[心][心][心],0,10,0,2022-07-18 11:29:19,来自辽宁,2471298738173628,萌男or猛男
7121557387361764131,嘲讽“小镇做题家”和吴某人的“精英主义”是一样的！,0,12,0,2022-07-18 12:00:46,来自广东,104310724639,小财客栈
7121566229432713988,确实正解，嘲讽底层奋斗者的歪风不可长,0,6,0,2022-07-18 12:35:35,来自山东,48013775738939,一玄一柱百味生
7121552692908344098,团团出手不凡，支持、点赞![赞][赞],0,9,0,2022-07-18 11:42:39,来自贵州,2542509116104064,贪睡书屋
7121551824678650658,我就是“小镇做题家”，我靠自己努力追求更好的生活有问题吗？你嘲讽你的，我努力我的,0,7,0,2022-07-18 11:39:04,来自广东,60151036265,中山君
7121562717165175559,我这个小镇错题集锦都能感到“小镇做题家”是对学霸们的侮辱,0,6,0,2022-07-18 12:21:58,来自北京,92160695139,魏江涛261
7121564378927186703,向每一个奋斗中的小镇做题家致敬！,0,6,0,2022-07-18 12:27:53,来自浙江,5453781835,白衣翩翩好少年
7121563057432003369,我连小镇做题家都算不上，是小村做题家。那又如何？靠自己的努力奋斗出的生活，不香吗？,0,4,0,2022-07-18 12:22:48,来自江苏,2532899724473679,不丑的小九
7121553068830769961,有点泪目，走过来的人都知道，刷题的嘞，奋斗的苦。不容易。,0,9,0,2022-07-18 11:43:58,来自贵州,105153732647,闲人野记
7121207677816144653,小镇做题家只能用于自嘲,0,33,0,2022-07-17 13:24:10,来自湖南,6975454926,迈克二毛
7121545933497664287,说得太好啦[赞][赞][赞],0,10,0,2022-07-18 11:16:39,来自广东,110869549534,简单快乐5866
7121563577609356046,成为“小镇做题家”，这也是千千万万没有好出身的中国年轻人的梦想！有梦就有未来，以梦为马，不负韶华！,0,4,0,2022-07-18 12:25:08,来自湖南,3650803581323235,榜一大戈
7121564929349387008,人生而不公，又如何有资格去嘲笑那些处于公平洼地的人们呢,0,1,0,2022-07-18 12:29:48,来自北京,50257280884,率真愚者
7121548019124077345,那句铿锵有力的呐喊还犹在耳边“为中华崛起而读书”，这才过去多久啊[流泪],0,20,0,2022-07-18 11:25:21,来自陕西,1631283982646712,一路向北春风犹在
7121553427960365839,意难平，大家都不是刚出社会的毛头小子，其中的猫腻心知肚明见得太多也不想计较也没法计较普通人嘛，老老实实按规矩来。拿着利益嘲讽按规矩的人？是真的猖狂，嚣张啊！,0,8,0,2022-07-18 11:45:39,来自广东,52019718692,158592721
7121200341370684160,之江轩文章，批评所谓“小镇做题家”，非常到位！赞同您的观点！！,0,13,0,2022-07-17 12:55:22,来自湖南,3413352648289549,橘洲夜话
7121563952483631911,应该反思的是为什么会出现“小镇做题家”，和越来越多的“小镇做题家”，互相伤害是没有意义的,0,3,0,2022-07-18 12:26:43,来自湖南,7639772479,坛旺
7121373193117418277,浙江传媒学院副校长被警告同样是个危险的信号，而且更危险。,0,1,0,2022-07-18 00:08:11,来自北京,6724507170,北京偏北NFoE
7121203880599683876,小镇做题家更多的是那些期望靠高考改变人生却发现没啥用的人的自嘲,0,10,0,2022-07-17 13:09:25,来自浙江,58520413593,杭州七院精神科童主任
7121564018124915494,谢谢团团，没关系的，已经习惯了！该刷题刷题，该搬砖搬砖,0,5,0,2022-07-18 12:27:27,来自北京,3729198118356744,乐乐猪5535
7121243464649556751,“小镇做题家”不该是贬义词，和“寒门学子”、“狮子山精神”有类似的含义。,0,8,0,2022-07-17 15:42:39,来自上海,5825933164,啊哈徐
7121563637882045199,正能量。[赞],0,4,0,2022-07-18 12:25:06,来自福建,51019729448,悄悄晚星
7121552734130029351,大同还有点远，要持续奋斗，我自己的题做的还算可以，没大的追求，下一步就是尽量培养儿子能正确面对答题，每一代都有自己的责任。,0,4,0,2022-07-18 11:43:47,来自江西,6875589686,你的戈壁老王啊
7121023183906095875,小镇做题家直接PK为中华之崛起而读书。,4,216,5,2022-07-17 01:36:37,来自北京,3259393974993646,番茄3259393974993646
7121567231649104655,非常喜欢团团，满满的正能量，在我们青年人最需要支持的时候，你总是勇敢的出来[赞],0,4,0,2022-07-18 12:38:49,来自上海,50665729394,中华战斗兔
7121565716327351073,小镇做题家vs躺平,0,1,0,2022-07-18 12:33:56,来自江苏,1704940947,感动中国UP
7121553891833496352,团团说得掷地有声,0,7,0,2022-07-18 11:48:14,来自福建,61718142832,属途舍给
7121720661353071399,支持共青团中央,0,36,0,2022-07-18 22:34:52,来自河北,93143799504,唯一279645121
7121551181528875791,小镇做题时是我一生中最高光时刻，所向披靡。。。我骄傲！,0,5,0,2022-07-18 11:36:53,来自墨西哥,68687129717,Diieguito
7121552094037082892,对，是病，得治。大家都是同一个物种，谁瞧不起谁了！,0,6,0,2022-07-18 11:41:04,来自浙江,83045714597,凹凸曼在说话
7121553004989367040,终于看到替我们说话的官媒了！为中华崛起而读书！,0,9,0,2022-07-18 11:43:42,来自贵州,4093382604,迷失33183378
7121555250192319270,一开始我以为小镇做题家只是我们的自嘲,0,3,0,2022-07-18 11:53:10,来自安徽,104392496709,沐子遥希
7121553568867926784,官方终于回应小镇做题家了[赞],0,4,0,2022-07-18 11:45:59,来自山东,6085195931,神奇的小战士
7121552538692174632,不应该嘲笑任何一位努力的人,0,4,0,2022-07-18 11:42:05,来自广西,6647240092,乌龙红尘茶
7121328310461825792,观察者网比中国新闻周刊要正能量多了,0,2,0,2022-07-17 21:11:39,来自河南,3051870186121592,龙叔谈高职
7121555450918880004,“小镇做题家”原本是一个自嘲的词，都出来好几年了，也没见火，怎么就突然成了贬义词？[我想静静],0,0,0,2022-07-18 11:53:57,来自甘肃,8342583621,流火如兵
7121563406783496964,俄国作家普希金创作的童话叙事诗《农夫和金鱼的故事》告诉人们：什么都想要，最后什么都要不了……,0,2,0,2022-07-18 12:24:38,来自安徽,6732005256,小池藏月
7121559756837749516,我是小镇做题学渣。甚至觉得小镇做题家的称号好不错,0,2,0,2022-07-18 12:10:52,来自天津,3279739224,小猫八九只
7120993694777410336,我从小学的是“为中华崛起读书”,27,578,3,2022-07-16 23:34:57,来自山东,5891574357,梦想随心185
7121551545648857891,历朝历代也没人敢嘲讽读书人,0,7,0,2022-07-18 11:38:16,来自广东,8440109722,蜗牛lyhdr
7121564978490360580,团中央好样的[赞][赞][赞],0,2,0,2022-07-18 12:30:57,来自浙江,79169222617,资管裕道人
