7121267827117900574,老子奋斗了20年，才能坐下来和你一起喝咖啡。[打脸][灵光一闪],0,0,0,2022-07-17 17:17:44,来自广东,58068535630,小潘潘的小猫猫
7121548964448535296,共青团[赞][赞],0,0,0,2022-07-18 11:28:02,来自广东,85440535748,小小林克
7121625621214085888,无非就是讨论一下，讨论完该咋样还是咋样,0,0,0,2022-07-18 16:25:43,来自江苏,109250673632,禁你言同学
7121545832670692103,那些已经是新资本门阀了,0,1,0,2022-07-18 11:16:11,来自江苏,11732949988,王改改55
7121561917646193440,那白手起家的经商奇才王橙橙女士呢？您不能厚此薄彼啊。,0,0,0,2022-07-18 12:18:56,来自四川,5771480929,莫念老七
7121555016896971535,清风，正气,0,0,0,2022-07-18 11:51:34,来自广西,1679705195686975,问道天天
7121552350112006947,韩红姐姐 快来力挺一下[大笑][大笑]@韩红工作室,0,1,0,2022-07-18 11:41:21,来自江苏,93583279269,jifering
7121550085158175529,说的太好了,0,1,0,2022-07-18 11:32:23,来自北京,101786365881,浅夜风临
7121550918319129355,确实得治。关键是治了吗？怎么治？,0,1,0,2022-07-18 11:36:30,来自广东,53052049476,ZQ的自由之路
7121567344748741391,说的好！,0,0,0,2022-07-18 12:39:20,来自北京,71233717405,Odieee
7121552010461397795,团团真棒👍,0,1,0,2022-07-18 11:39:57,来自北京,110916479658,大蜗牛飞飞飞
7121555598075855652,你发声啦？,0,0,0,2022-07-18 11:54:12,来自福建,67348896009,你好陈平安
7121551630143243011,这才对,0,1,0,2022-07-18 11:39:41,来自浙江,110083911157,Coco1823
7121548590992016132,在理,0,1,0,2022-07-18 11:27:26,来自四川,3922661891,翌晨33
7121549202568004393,得治，得好好治治。,0,1,0,2022-07-18 11:29:07,来自山西,80574904492,鱼鱼鱼鱼鱼游泳
7121561547163812640,咋治？,0,0,0,2022-07-18 12:17:46,来自陕西,53150146802,勇者可乐乐
7121548838078497574,强烈支持,0,1,0,2022-07-18 11:28:20,来自贵州,109181142549,格局越大道路越宽
7121560115542901516,哭😭,0,0,0,2022-07-18 12:12:08,来自上海,64036545537,美食一点点
7121553974259630855,行动呢,0,2,0,2022-07-18 11:47:57,来自重庆,421844148295480,嚣张的王木木
7121552164598121251,代代相传,0,1,0,2022-07-18 11:40:41,来自上海,64150590130,印栏
7121565410482471691,说的对,0,0,0,2022-07-18 12:32:28,来自福建,57281293223,命运197380699
7121547880539652875,怎么治？,0,0,0,2022-07-18 11:24:34,来自河南,6800765576,从头再来20211109
7121550686676009743,要🉐,0,0,0,2022-07-18 11:34:48,来自天津,1538911475347357,凡人小卒
7121551713915994916,是吗？,0,0,0,2022-07-18 11:39:24,来自重庆,55143400301,橙呈小禾
7121562076128068366,你咋才来,0,0,0,2022-07-18 12:19:13,来自内蒙古,15468097103,国际双喜买不到了
7121628247057515271,刷题怎么了做题怎么了，靠自己努力拼搏奋斗有问题？难道要找个有钱有权的爹走后门走捷径才值得称赞？这些媒体都是些什么东西，宣扬传播又是啥,3,162,0,2022-07-18 16:35:57,来自河北,6284209420,老陈聊金银币
7121542387746489088,新时代是奋斗者的时代，每个平凡的工作者都有向往的圣地，为此拼搏，为此努力，为此奋斗，并不是人人都是“二代”，所以，加油奋斗者，祖国因你奋斗而富强，家庭因你奋斗而幸福[加油][点亮平安灯],0,1,0,2022-07-18 11:14:25,,58203514510,非凡先僧
7121199516506358563,我觉得不是人们在嘲笑，而是社会发展到一定阶段，高学历的人才已经严重贬值，仅靠学历进行人才筛选的机制已经没什么效果，只有985/211或者部分优秀的一本高校同学毕业才好找工作，其他人很难只通过学历找到合适的工作了。,0,4,0,2022-07-17 12:52:13,来自湖北,3436939177,每特
7121276321028014889,小镇做题家是自嘲，现在真的喜欢把那些流量明星，伸手千万，几亿合同的资本宠儿和努力改变原身家庭放在一起说，彰显平等还是努力帮高高在上的演员们好好多捞几年，怕风气改变，演员明星成为职业，大多数都只能赚份工资？,0,0,0,2022-07-17 17:50:08,来自广东,65196439828,猫商HAEt
7121565996280365828,嘲讽“小镇做题家”不仅仅是病，而且是一种恶毒，恶意。需要点名批判。,0,0,0,2022-07-18 12:35:01,来自山东,2647246091074285,瓷资恣
7121565775139373858,易烊千玺有200多家媒体替其发声，而数亿小镇做题家却只有一两家媒体的发声。这是为什么？,0,2,0,2022-07-18 12:33:14,来自江苏,5847837133,贫下中农斗地主
7121306054889456423,小镇做题家不应该被讽刺，但是因为认可小镇做题家而去否定任何大城市出身的人，觉得任何东西都是阴谋，那么就是病态,0,0,0,2022-07-17 19:46:08,来自云南,5390387402,雪平Eric
7121546581488190221,有些人历来带着傲慢与偏见，对其他人冷嘲热讽，这是对所有奋斗者最大的侮辱，必须得管管这些既得利益者，让其付出应有的责任，受到相应的处罚！,0,0,0,2022-07-18 11:19:13,来自四川,3296659741,清闲的星空棒棒糖
7121288873330148110,希望媒体，自媒体。控制一下编辑的阅历，层次，年纪。求求了，别让一些没有阅历，没有层次，没有人性的人，写文章了。,0,0,0,2022-07-17 18:39:34,来自辽宁,94048331236,这个杀手挺暖呼
7121542204699083531,中国新闻周刊的作者是什么样的操作？制造意识对立吗？,0,12,0,2022-07-18 11:02:53,来自河北,4134602862246942,山头斜照却相赢
7121494523603239713,官方嘲讽读书人，历史罕见,0,0,0,2022-07-18 07:57:59,来自福建,54572581835,jsoc
7121535896549442319,愿赌服输。大家一天起跑线，比不过人家就是技不如人。阴阳怪气只能更丢人。,0,0,0,2022-07-18 10:37:29,来自上海,3254177670,轴9813847
7121553826112439055,打到那些，嘲笑别人努力的人。,0,0,0,2022-07-18 11:46:58,来自河南,85327696330,晨中国
7121545160072151840,"多发声，更要多亮剑！
坚决及时铲除文化渗透毒瘤！！",0,3,0,2022-07-18 11:14:07,来自安徽,19125908958,说好了大家一起玩
7121549081264112416,现实中，确实有很多高分低能儿啊！不能以单单分数来对人进行能力高低的划分。,0,0,0,2022-07-18 11:29:22,来自湖南,53198669592,芒果战斗员
7121524628287193889,那总比四字弟弟搞阴阳话题要好,0,0,0,2022-07-18 09:53:13,来自广东,69564919905,在彼方在吃番的泡面
7121563233206453022,都是自以为是的精英意识太强。,0,1,0,2022-07-18 12:23:49,来自福建,4020289873390071,混炖鱼
7121524977525949225,我只能说其心可诛！有些人就是要从思想上断绝你努力的欲望,0,0,0,2022-07-18 09:54:25,来自广东,3842171505,道系青年w
7121549801375941412,某些官媒需要加强管理，树立正确的三观！,0,0,0,2022-07-18 11:31:41,来自江苏,92470695584,煮海听涛品鱼
7121325510290408233,流量明星都不咋地,0,0,0,2022-07-17 21:00:58,来自上海,61068621498,beachro
7121565377033274147,城里人的傲慢与偏见，,0,1,0,2022-07-18 12:31:53,来自北京,104864030665,小黄3660
7121553833636971297,支持团团 某些东西只配作路灯挂件,0,1,0,2022-07-18 11:47:33,来自北京,53880103288,丨魂之轮回丨
7121601057671168800,他日若遂凌云志，敢笑黄巢不丈夫。横批：胜天半子。,0,0,0,2022-07-18 14:51:11,来自山西,97125021481,凡日月所照皆为华夏土
7121156305238442764,"浙江宣委 向你致敬！
这是我看到的第一个官方态度 [赞]",2,152,0,2022-07-17 10:05:10,来自上海,3742381656778488,悠闲风铃kH
7121009046064972552,让劳动人民有尊严地工作生活[白眼],1,213,0,2022-07-17 00:36:27,来自广东,92679496153,熊宝宝的麻麻
7121337334800630563,勇敢的人给人感动的人为什么都是普通民众！航天英雄，战斗英雄都是农民的儿女！！！,10,437,2,2022-07-17 21:46:40,来自山东,2463350633531024,551928
7121204343013622569,现在居然嘲讽读书人，确实没想得通,1,81,0,2022-07-17 13:10:52,来自河北,106845672899,猫女狼
7121337557350744843,高考是唯一一个最公平最可以让寒门学子还能改变命运的机会。如果没有高考，很多穷人家庭将毫无希望。,15,529,0,2022-07-17 21:48:18,来自黑龙江,24086033234,有容乃大a无欲则刚
7121177107870515976,万般皆下品，唯有读书高。,4,27,0,2022-07-17 11:25:33,来自河南,64109203498,自由231838351
7121499252152894220,只要在中国高考体制内，管你身处何地，谁不做题？就怕没有那个水平成不了做题家！,10,177,0,2022-07-18 08:16:32,来自重庆,1591703989133752,自由的漂流瓶rf
7121677723718386445,普通人的努力不应该被嘲讽！,9,231,0,2022-07-18 19:48:25,来自吉林,92658032331,风吹花过
7121147962130268963,大城市还在为中考50%的升学率发愁呢，羡慕小镇做题家还来不及[捂脸],4,32,0,2022-07-17 09:32:04,来自浙江,60720030266,heidi0309
7121601849110807326,"我庆幸我成为了小镇做题家！
庆幸自己还在为了梦想拼搏！
正是因为出自小镇，所以才要拼搏；
正是因为源自寒门，所以才要努力。
努力，永远值得掌声，谁也没有资格鄙视和嘲笑！
小镇做题家从来不是贬义词！
我骄傲我成为了小镇做题家！
小镇做题家是我努力的勋章！",0,2,0,2022-07-18 14:53:55,来自河南,4240141605147208,九思的树洞
7121123650463417128,浙江能发出这样的观点，宽松，包容，认可底层人的努力，必发展的更好。,0,115,1,2022-07-17 07:57:43,来自内蒙古,60323645030,暖
7121115267518038787,好文，转发[赞][赞][赞],1,22,0,2022-07-17 07:57:43,,19153198019,闹市散人
7121519694036697889,我是小镇做题‘‘小家’’，大家谈不上，我很骄傲，因为我靠自己的努力改变了命运的足迹,8,63,0,2022-07-18 09:35:20,来自广东,4469958681,手机用户猪猪的妈妈
7121568757767488264,看看医院那些主任教授，很多都是农村出来的，是小镇做题家出来的,11,144,0,2022-07-18 12:45:10,来自广东,1095546910023166,幸运奶茶OZ
7121167682338538252,努力了却依旧平凡,6,11,0,2022-07-17 10:48:08,来自重庆,6948019271,眸小木
7121578457615844135,当他们说出小镇做题家的时候，说明小镇做题家已经让他们产生了恐惧，已经有了威胁。,9,281,3,2022-07-18 13:23:23,来自山东,56196052962,江南烟雨季
7121129960106459945,期待更多的小镇做题家发声,1,72,0,2022-07-17 08:22:24,来自河南,3961095902,_38度
7121513246196695812,靠自己的努力奋斗得来的人生，不拼爹不拼妈，应该值得社会尊重，更何况撑起祖国半个河山的都是小镇做题家走出来的人！,4,85,1,2022-07-18 09:10:51,来自山东,4028257480750558,平安竹子19
7121559996689220392,韩雪事件时就觉得李佳航是真有种的,4,57,1,2022-07-18 12:10:58,来自陕西,110024490383,数学半导体
7121491821620577055,我们有什么理由去嘲笑一个努力向上的人？,29,400,2,2022-07-18 07:47:35,来自上海,5962473036,vivi14814
7121499558995231526,小镇做题家和科举时代的读书人不是一样的嘛，通过自己的努力读书，层层考试一步步跳出原来的社会圈层，有什么不对吗[what],10,173,2,2022-07-18 08:17:32,来自上海,58697162729,趣郎中
7121533380806329103,什么时候出生成为原罪，什么时候普通就是卑微，什么时候努力改变命运，得到的不是尊重和掌声，而是嘲讽和不屑。,3,518,2,2022-07-18 10:27:51,来自江苏,56440726767,可劲儿薅羊毛
7121005671286014756,搁在古代就是危害江山社稷,3,231,0,2022-07-17 00:23:03,来自浙江,2390617003,安然6666
7121580594240881423,如此公开耻笑勤奋努力的人民，这是危险的苗头！,5,229,2,2022-07-18 13:31:04,来自广东,105983081094,zq782
7121372435140133640,这文章作者是谁,2,25,1,2022-07-18 00:05:19,来自浙江,75908769806,michellelxy
7121353797670617890,是央视的言论吗？,3,18,0,2022-07-17 22:51:06,来自四川,105855600121,语在云上
7121583014232556328,上下历史5000千多年，万般皆下品，唯有读书高，怎么社会发展到现在，读书努力还有罪了！[翻白眼],5,165,0,2022-07-18 13:40:26,来自江西,796493893867808,无怖365
7121701902517584672,从来没觉得四字演技有多好，运气倒是更好。,3,36,0,2022-07-18 21:22:09,来自北京,76566017106,只走花路吧
7121329052476064515,现在又给配了一个词“群氓效应”,1,141,1,2022-07-17 21:15:02,来自四川,96607028685,春花秋月1012
7121523171643425571,十年寒窗，应该是寒门子弟唯一一条走出大山，走进理想的道路了，而他们就连这个唯一的希望都要扼杀掉，让贫困的代代贫困，真的是其言可鄙，其心可诛！,0,66,0,2022-07-18 09:47:27,来自浙江,24283856455,代云树
7121701538099118859,网友说，我没想动他们的蛋糕，他们为什么要抢走我的窝窝头呢？,1,8,0,2022-07-18 21:20:33,来自新疆,1196728053928632,晨雁飞
7121469549287080719,出啥事了？我是看见韦正和李佳航就想起爱情公寓了，所以就没看破事精英,10,16,2,2022-07-18 06:20:50,来自江苏,6386489461,秦玉老师
7121533228867519272,网友说，我没想动他们的蛋糕，他们为什么要抢走我的窝窝头呢？,1,66,1,2022-07-18 10:27:13,来自江苏,56440726767,可劲儿薅羊毛
7121609908562395939,对，不能挑衅公俗良序。中国民族最起码的道德底线！,1,18,0,2022-07-18 15:24:38,来自四川,68199933725,黄元先生
7121497569100038945,小镇做题家，恰恰说明这些普通人的不平凡之处，随生而普通，却不屈服于命运，拼尽全力，努力生活，这不就是我们中国近代史的缩影吗？这么伟大的事情，应该被褒扬！,2,126,1,2022-07-18 08:09:42,来自江苏,4867034004,兮兮2007
7121708984050500359,小镇做题家是什么意思?,6,6,1,2022-07-18 21:49:23,来自上海,6321873859,四季分明五谷丰登
7121536594292671247,寒门贵子就是小镇做题家，支持他们。,0,11,0,2022-07-18 10:40:03,来自湖北,104681564766,神秘柳叶刀
7121700098232943360,《新闻周刊》是帮了倒忙！,5,45,2,2022-07-18 21:14:30,来自河南,3817121447675565,涵清雅
7120405451019125538,我庆幸自己有机会读书，看到了更大的世界。小镇做题家又如何呢？在人生的道路上，只有自己过得好才是真的好。—— 确实如此，我也是小镇做题家！,1,2,0,2022-07-15 09:30:40,来自广东,61219649295,柠檬格格
7121268693883159311,不努力有结果吗？,6,53,0,2022-07-17 17:20:32,来自天津,85842584450,爱在深秋4485
7121600053927904035,万般皆下品，惟有读书高，还能成立吗,1,10,0,2022-07-18 14:46:34,来自安徽,106162789927,梦兮之笔谈
7121342945642578725,很多人甚至还没有成为“家”，只是个小镇做题人，但他们坦坦荡荡的生活，为自己骄傲,2,273,2,2022-07-17 22:08:51,来自河北,3193440368856926,宁萌酱a
7121655114959536911,中国的发展，恰恰大大的依靠小镇做题家，适应性比较强,0,0,0,2022-07-18 18:19:56,来自上海,6350473423,小乔带你飞
7121652053877048104,每一个奋斗的人都值得尊重！任何时候都不能嘲笑“小镇做题家”，他们扛起了国家勇毅前行的每个支点，嘲讽别人的努力本身就是一种病，得治，共青团中央 正能量官媒 点赞[赞][赞][赞][赞],0,1,0,2022-07-18 18:08:18,来自广东,255557236433271,雪莱的碎念
7121549331102352166,说得好，凭什么出生地就决定了人生,12,178,4,2022-07-18 11:30:24,来自山东,610953447619292,一蓑烟雨任平生117
7121565392615228160,没觉得小镇做题家是贬义，通过自己的努力，让自己实现跨阶层。知识改变命运,10,46,4,2022-07-18 12:31:58,来自天津,52606057967,寒雨连江50
7121235732177388322,你可以永远相信浙江[加油][加油][加油],0,10,0,2022-07-17 15:12:35,来自浙江,3378128441320524,紫气东来风999
7121689089183236879,这个主任为什么不开除，明显就是挑动矛盾,1,47,1,2022-07-18 20:31:45,来自江苏,78679073087,蔷薇语录
7121660384847102754,我也不追星，但也不讨厌明星，就好像本文作者说的一样，我讨厌那种自以为高人一等的行为！每一个中国人和中国人或者外国人都是平等的，我更喜欢我们国家的一切科研人员和努力奋斗的人,6,150,2,2022-07-18 18:40:35,来自广西,2450165914143358,哎呀！
7121557902737130247,努力苦读不是贬义词，小镇做题家就是贬义词,2,52,2,2022-07-18 12:03:12,来自山东,21882326651,一身正气的反矫
7121616619025040169,小镇做题家是那些考上985的大学生的自嘲，并不是社会上嘲笑小城镇来的人，他们认为自己除了会做题什么也不会，和来自大城市的孩子差距很大，每个人的努力都值得尊重，没有人嘲笑他们，是他们之中的佼佼者的自嘲而已。,2,8,0,2022-07-18 15:50:42,来自陕西,68838889847,智勇双全露珠hA
7121564810948625192,主要是小镇做题家让一些有家境的人走不了捷径，选拔面前人人平等。,8,89,1,2022-07-18 12:29:33,来自宁夏,92957052817,蒙以养政
7121244423677543201,浙江能发出这样的观点，宽松，包容，认可底层人的努力，必发展的更好。为作者点赞！,0,3,0,2022-07-17 15:47:17,来自广东,4142583411913679,极客辛集2E2
7121506244426629902,我咋没看到这篇文章的作者，干嘛不公布出来，让大家认识下。,1,7,0,2022-07-18 08:43:11,来自湖北,3334197281045384,勇往直前的春风4Y
7121699029083718436,要感谢《新闻周刊》，没他小镇做题家这热度早就过去了,0,102,0,2022-07-18 21:10:33,来自辽宁,2397394231627156,蔓菁箐
7121337967469839139,美国人奴役底层人却又鄙视底层人！说明资本家思维成了精英群体共识！！！,0,36,0,2022-07-17 21:49:15,来自山东,2463350633531024,551928
7120778610508251941,都有卖枣的了？,2,0,0,2022-07-16 09:39:32,来自北京,98197170748,做设计的小龚
7121129132272550663,现在所谓的快乐教育 不公布成绩 就是减少底层逆袭的机会,3,57,0,2022-07-17 08:19:52,来自山东,5992287812,youhan74653084
7120209646585332513,过好自己的生活！,3,5,0,2022-07-14 20:51:28,来自北京,3971028707185934,月桂树家
7121545062077137677,本来就是，努力的人尽管努力就行了，难道因为别人一个嘲讽就放弃自己的理想和目标?那也称不上努力吧，我总坚信，是金子迟早会发光，真正的努力，怀揣着信念，是不会被辜负的。人都是为自己而努力为自己而奋斗，不是为了别人的赞许和掌声，踏踏实实走好脚下的路，最终会抵达梦想。,0,9,0,2022-07-18 11:13:31,来自湖南,1332244817909175,跨境电商小阿姨
7121354883819012872,那些嘲笑小镇做题家的无非就是自己有些更好的外部条件，却在职场和各种唱歌竞争不过这些从小地方爬上来的年轻人，所以只能嘲讽，但事实上谁是小丑，大家都很清楚。,3,243,0,2022-07-17 22:55:37,来自福建,104013013393,财经不复杂
7121530775060693793,俄乌战争，最先逃的是谁？,11,129,3,2022-07-18 10:17:04,来自上海,100490289537,时光缈影
7121459475907363599,古人说万般皆下品惟有读书高。到他们嘴里成了小镇做题家。，，,1,64,0,2022-07-18 05:42:37,来自北京,77391261549,四喜齐来sixiqilai
7121148143924396840,傲慢的资本,0,53,0,2022-07-17 09:32:51,来自天津,101648598894,晓月关山雪初晴
7121690829160760098,他们的奋斗也许笨拙而沉重，但每一份不愿低头的奋斗，每一个负重坚韧的人生，每一位勇毅前行的小镇做题家，都值得尊重。[流泪],0,37,0,2022-07-18 20:38:25,来自安徽,92463251624,吴晔768
7121284040631812895,友友下午好，看着友友发的图片上的孩子们在那么不好的环境下，一双双求知的眼睛。我的心酸酸的。,2,83,0,2022-07-17 18:20:34,来自山西,1297077428555015,奶孙俩
7121699159262036773,小镇做题明明是小镇做题家们自嘲的，现在又觉得是讽刺自己了[捂脸],2,3,0,2022-07-18 21:11:06,来自北京,52221215983,老胡81
7121515812422730528,没有任何理由去嘲讽一个上进的人，小镇怎样，大城市又怎样，英雄不问出处！,0,24,0,2022-07-18 09:20:41,,67895519160,峰清云和
7121148061904683789,做题是学习知识的一个过程，从古至今，我们古人是推崇学习，有求知欲，不管大镇还是小镇的老师也是传道授业解惑。为什么今天赋予如此难听，充满鄙视的词汇?,0,29,1,2022-07-17 09:33:03,来自上海,84492923922,向阳而生Q玖富P2P诈骗
7121147917636993824,一个县十几万，考出来几个985以上的，然后被资本压榨到35岁，就弃之如敝履了。所以一定要发挥制度优势，进编进公，这才是真的为人民服务,1,16,0,2022-07-17 09:32:46,来自河北,101878585913,长安阿土伯
7121222351744123688,我还是农村做题家，我骄傲。,0,17,0,2022-07-17 14:20:50,来自广东,55768771548,成年人的世界不简单
7121663851472388871,鼓励励志儿童[赞][赞][赞],1,6,0,2022-07-18 18:54:16,来自河北,61870271585,书缘堂主人
7121689345467810575,往上数三代，谁不是普通平民,2,31,1,2022-07-18 20:32:50,来自广东,14476123117,快乐星球y
7121643553788363558,为小镇做题家自豪，靠自己改变命运。,0,1,0,2022-07-18 17:35:45,来自山东,50416978766,土豆170319661
7121852869694751500,自古以来靠努力勤奋学习，改变命运是值得钦佩的。而有些却是靠着优越的自身环境和人脉赢在了起跑线的人，并不属于自身的能力，有什么资格看不起努力学习奋进的人？,0,0,0,2022-07-19 07:08:43,来自黑龙江,3230033868,平凡的一颗小草
7121509341416571651,我国的高考制度，就是要让先天输人一步的小镇做题家成长起来，拥有在更好资源平台上竞争的机会，这是我国制度决定的，是社会制度的优势，封建时期能万般皆下品，惟有读书高，新时代的小镇做题家有任何不合理之处吗？,1,24,0,2022-07-18 08:55:16,来自浙江,58892302105,整理内存
7120249545963242281,从你的文字看得出你是个活得很通透的人[玫瑰],1,3,0,2022-07-14 23:26:05,来自重庆,408644390754359,川妹子织织
7121142250046341901,危险的信号@中国政府网 @共青团中央 我是“小镇做题家”,2,27,0,2022-07-17 09:10:38,来自江苏,55091535544,leostone
7121070499429401359,小镇做题家是转化工程师与科技人员最大的群体。。这些人才是国家的基石。。,2,173,1,2022-07-17 04:35:13,来自山东,104246454324,藏于泥O绚于野
7121650617835733797,合着别人努力也是错？,1,5,0,2022-07-18 18:03:14,来自北京,85038745518,鲨雕233
7121498388709376783,为啥不嘲笑“都市做题家”?,1,3,0,2022-07-18 08:12:17,来自上海,55661663073,高中学习号
7121472990210147110,谁敢否认小镇做题家，否认人生需要拼搏奋斗，谁就是历史的罪人！,1,67,0,2022-07-18 06:35:04,来自辽宁,5964356466,小槐树58
7121180865841464105,我是小镇做题渣，我也在努力！,1,20,0,2022-07-17 11:39:51,来自广西,4375692898210795,博学的饼干CF
7121476488641528611,靠做题起码学到知识而且公平，靠社交、所谓素质上位能公平吗？,1,50,0,2022-07-18 06:47:34,来自广东,5449129339,ArSaint
7121584558822130464,保留个人意见，既然有规则，自然就有利用规则的人，就和越位和反越位一样。居然考试的方式相对来说是“静止”的，那么通过掌握这种规律获得更好成绩，这是合理的。,1,2,1,2022-07-18 13:47:11,来自广东,5727311351,硬派偏执狂
7121702170097173281,无论什么人，只要是努力都不该被嘲讽,0,41,0,2022-07-18 21:23:00,来自湖北,5368229504,亮亮芥末吻吻
7121846579681575688,其实我们现在的中流抵柱，许多都是这些小镇做题家，他们靠自己的奋斗成才后为国家做贡献，为他们点赞！,0,0,0,2022-07-19 06:43:47,来自河南,83273917311,随性自由的钢琴Xu
7121492181734753057,寒门不靠做题，连展示天赋的机会都没有。,1,34,0,2022-07-18 07:49:07,来自广东,99385561578,乐乐2963434214355
7121652579654419231,现实是70、80相当一批目前做到了各行各业中高层的人，都是小镇做题家。不偷不抢靠努力拼搏走出自己的人生，改变自己的命运有什么可讥笑的？,0,1,0,2022-07-18 18:10:55,来自北京,92760633210,千江有水1119
7121638830029636364,每一个小镇做题家都值得被肯定与尊重！他们靠自己剥开云雾迎来人生的曙光！有韧性能吃苦，在哪里都会闪光,0,0,0,2022-07-18 17:17:44,来自北京,6070870600,悦之铛铛铛
7121597262886732557,每个行业的精英，都是他们口中所谓的做题家，是国家的中流砥柱智商高且勤奋！,0,3,0,2022-07-18 14:35:47,来自河北,2370179556969437,中年宝爸
7121517346573091588,历史规律，当小城镇做题家的上升通道都阻死了，历史上的规律恐再现。,1,28,0,2022-07-18 09:26:25,来自湖南,99374224366,山秀河清
7121568026629751567,我就是妥妥的一枚小镇做题家！！我年轻时努力学习，进入社会认真工作，我打心眼里尊重每一位小镇做题家,2,29,0,2022-07-18 12:42:06,来自贵州,632973304793160,远见卓识钢笔hX
7121652579654419231,现实是70、80相当一批目前做到了各行各业中高层的人，都是小镇做题家。不偷不抢靠努力拼搏走出自己的人生，改变自己的命运有什么可讥笑的？,0,1,0,2022-07-18 18:10:55,来自北京,92760633210,千江有水1119
7119647722315596585,小镇做题家又如何，骂他的人可能让他们做做题家都做不成，纯粹的嫉妒恨,0,17,0,2022-07-13 08:30:31,来自福建,6239440841,碧芸天83227971
