7121658532847584000,这个人也是厉害了，在得到赔偿后，还能霸占病房三年！试问全国有几个人能做到这样？这时候就得采取强制措施才能起到作用！,71,957,14,2022-07-18 18:33:16,来自内蒙古,4380898211927312,月上挽歌
7121884570471285544,事实清楚，判决生效，对这样的无赖竟能霸占医院病房几年，简直不可思议。我们应该感谢谁呢？,4,63,2,2022-07-19 09:10:36,来自河南,53087797864,我是庶人
7121648682965549828,霸占三年？拘留15天？[我想静静][我想静静][我想静静],48,1293,6,2022-07-18 17:56:02,来自河南,9737530691,是恐龙小姐姐哈
7121695613125329667,对这种无赖，应绳之以法，并赔付医院三年的床位费、干扰公共秩序罪均应判罚！,9,521,2,2022-07-18 20:57:49,来自青海,1578504016375102,优雅精灵19
7121671235721102080,霸占三年后才执行啊？!![发怒],12,804,7,2022-07-18 19:22:38,来自广西,3435863192,西米鲁鲁
7121709081714656041,医院到底做错了什么？为什么得到赔偿？,13,162,8,2022-07-18 21:49:22,来自湖北,267920996580419,梦幻花猫nW
7121860674782872361,三年了？现在都执行到位了，效率挺快的啊[捂脸][捂脸][捂脸],3,25,1,2022-07-19 07:37:54,来自河南,54668762088,皮肤专家樊教授
7121724082731008803,长期霸占病房也是一种韦法行为。要处理重一点。,3,155,2,2022-07-18 22:47:46,来自广西,1073595488142579,清闲的海洋7a
7121720961242022693,这家医院挺能忍的 ，霸占三年才被解决，医院的损失谁来承担？,10,217,5,2022-07-18 22:36:03,来自内蒙古,91708060155,豁达柑桔a6
7121664003788997408,他霸占病房的理由是什么？,9,173,7,2022-07-18 18:55:11,来自山东,105055431015,小妮可凡
7121722301724230433,医院住多一天都浑身难受，谁愿意去霸占医院病房喔,11,87,8,2022-07-18 22:41:32,来自湖南,3825893677479492,虫子日常
7121687996428682023,要么是有官司的，要么是贫困户。正常人谁敢住医院三年。,19,133,12,2022-07-18 20:28:14,来自河南,6164912893,策换书
7121743373392364303,估计医疗事故对赔偿款不满意，所以一直霸占病床抗议。我一个亲戚也是医疗事故，刚开始医院会报销复健费和生活费，但是一直拖到过法律追诉期了，突然医院停止一切报销，而且不认账了，也是真的很过分,4,41,13,2022-07-19 00:03:51,来自浙江,5719254851,Fayechow
7121657829173789475,为什么能霸占三年？,13,400,7,2022-07-18 18:30:42,来自甘肃,5957852657,淡然72991787
7121906843747894020,该医院应该起诉方某，违法强占医院病房，要求法院判决方某缴纳强占时的床位费、物耗费、水电暖气费。还应要求法院判决方某赔偿在其侵占期间该病房不能收治病人的一切损失费用。这才是公道！,1,4,0,2022-07-19 10:37:33,来自河北,2686824341309419,爱生活的何人可
7121671173498422050,给光山县法院点赞,4,205,11,2022-07-18 19:22:16,来自湖南,75758125018,用户483318031112玉兔
7121659300573446912,快一年了才执行，可见民间类似纠纷有多么不容易处理,2,118,4,2022-07-18 18:36:30,来自北京,681324976021835,宇宙超级美女
7121826771213271822,纠纷处理了:还霸占病房3年:为什么法院才执行:?,0,16,0,2022-07-19 05:29:17,来自广西,2414980100528136,xlxlx
7121669518438646562,霸占了三年，医院可以索赔,2,144,5,2022-07-18 19:15:57,来自上海,2252231189211277,一起喝白茶
7121856431120646920,仅仅只是被拘留吗？,0,15,1,2022-07-19 07:22:46,来自广东,86237644431,哭泣的农民1978
7121684311589471014,我也见过一个。2010年我腿骨折在我们县医院做手术，隔壁病房住着一个人，已经在里面住了快4年了。据说是医院医疗事故把他老婆治死了，赔偿方案他不满意。他就一个搬到病房里住下了，应该确实是医院理亏，要不然也早报警了。,5,45,3,2022-07-18 20:13:58,来自甘肃,110864303631,三年二班周星星
7121724804021044009,肯定有原因，之前的纠纷估计被迫同意的，有后遗症,3,77,14,2022-07-18 22:50:35,来自河南,50101460061,盈盈125530333
7121668192342868777,拖了这么久才执行，难道这很光荣？,5,247,7,2022-07-18 19:10:54,来自四川,3140680415711629,星辰大海的CUCC
7121840321432355596,才拘留十五天？他应该赔偿医院点啥吧？,0,24,0,2022-07-19 06:21:12,来自广西,4322882454310925,里丁奶奶
7121726112450937614,大概率：前期有纠纷，最后医院赔偿了6万多，但是这家伙倚仗有点关系还想多要，就一直懒着不走。期间医院肯定报过警也协调过，但是迫于无奈没办法。后来这家伙后面的关系不是退休就是调动走了，所以医院走法律程序强制执行了。这个其实完全可以按照扰乱正常社会秩序拘留的，所以他的关系应该在公ang。,7,29,3,2022-07-18 22:56:00,来自河北,6949783107,山东人老姜
7121682636904416036,医院应该算算三年床位费，起诉追讨。,2,78,0,2022-07-18 20:07:01,来自乌干达,954019099982343,本心安处是吾乡
7121643812891788062,这样的人居然能霸占三年才被执行[捂脸]该说些什么呢？,4,358,5,2022-07-18 17:36:47,来自安徽,3730886697,幸福心怀大志
7121872933538267915,小心这个人又开始霸占拘留所了,0,3,0,2022-07-19 08:26:09,来自广东,91824380169,云裳飞舞13
7121649445074207526,我们科室一个植物人被儿子扔在医院两年了，因为车祸的对方没钱赔，就不管了，别说医药费，就连卫生纸都不拿来,13,71,2,2022-07-18 17:58:42,来自浙江,4015045432320717,清爽云朵DK
7121686265980273440,这三年的病房使用费咋整？,7,114,3,2022-07-18 20:21:34,来自河南,106287673870,亮山2049
7121709524440023808,我邻居 因为酒驾进监狱 突发脑梗送到医院 监狱花了20多万 出狱后天天去监狱找麻烦 要求监狱给个房间他要在里面养老 最后讹了监狱6-7万 写了保证书 今天早上我送儿子上学还看到他在那打乒乓球 扣球动作可标准了[灵光一闪][灵光一闪],13,33,5,2022-07-18 21:51:01,来自山东,5773750070,娱乐圈纨绔
7121872951796581124,为什么要霸占三年才执行？三年才到强制执行的时间期限吗？,0,6,0,2022-07-19 08:26:35,来自广西,104587987707,芳孞
7121735238425903872,像这样无理取闹的人才是真实的医闹，对这种医闹人员就必须要依法打击，医院还可以以，寻衅滋事罪向检查院提起诉讼，追究当事人的法律责任，并附带经济赔偿，让当事人为其不法行为，付出相应的代价。,1,37,1,2022-07-18 23:31:31,来自河北,9017013541,知情达理喜鹊Y
7121715040813630216,没写清楚，他为什么能霸占医院。,4,11,0,2022-07-18 22:12:44,来自吉林,57069642180,布龙云v
7121828550327419656,把医院当成家来生活过日子的人确实是牛人,0,8,0,2022-07-19 05:34:59,来自甘肃,82228245242,马艳玲8811
7121873512323154722,拘留十五天太便宜这些混混了吧？医院三年的损失也应该合理计算以后要求其予以赔偿。看图片这还是个较大的病房，空无一人，只有他一人霸占着。影响收治其他病不说，起码的水、电费、卫等费用得拿吧？作出惩戒后，应该对其未来可能的违法行为形成震慑呢，使其不敢再次违法！,0,7,1,2022-07-19 08:27:39,来自山东,21025879003,笠辰
7121654779189084935,拘留十五天？出来继续霸占,4,54,1,2022-07-18 18:19:16,来自浙江,3896258486075843,悠闲宇宙as
7121683516823503624,生病住院的人都知道，住院是一件很难受的事，不是要命要健康，谁愿意住院呢？住在医院3年，怎么做到的。其中的故事不清楚，不评论。支持依法处理,7,82,8,2022-07-18 20:10:24,来自湖南,65850520483,瓶子198750031
7121769223159972621,民间无赖太多，应从重从快严打！,0,5,0,2022-07-19 01:49:56,来自湖北,81411525670,足智多谋橙子LL
7121696734484841247,霸占了三年，才被执行走，这叫什么？[抠鼻],1,16,1,2022-07-18 21:01:44,来自湖南,84326760214,俺在红旗下
7121648979045401374,会不会霸占牢房[泣不成声],4,90,0,2022-07-18 17:56:45,来自上海,4582698865,l杰拉多尼MKloo0
7121679489360462595,到拘留所以后是不是赖着不走了呢？！,7,119,1,2022-07-18 19:55:07,来自广西,63860730128,晨曦190315906
7121699466222699298,应该理顺关系，该医院承担的责任必须承担，向受害者赔礼道歉，赔偿一切经济损失，但受害方责任，必须给院方一个交待，补交三年来的医疗费用，赔偿院方的经济损失和名誉损失。,1,16,3,2022-07-18 21:12:07,来自江苏,103813339261,693284880
7121700216474157865,纠纷处理了:还霸占病房3年:为什么法院才执行:?,1,46,1,2022-07-18 21:14:49,来自山西,61567135658,贾爱民393
7121662454396470057,断章取义了，这年头法院能判医院赔六万，这个不能一笔带过，也许人家受了很大冤屈,11,32,12,2022-07-18 18:48:43,来自上海,3728402643,淡泊以明志8
7121917737655845636,难道医院从一开始就没收过他的钱？或者他在医院的一切费用都是国家出的？,0,1,0,2022-07-19 11:19:58,来自四川,22434254306,一个正精的骨头
7121685777637425951,法律不能让这无赖之人扰乱医疗秩序，早就应该采取法律措施，还医院一个安宁！,2,73,4,2022-07-18 20:19:25,来自湖南,2194230681809832,黄花未开
7121722774426534694,为什么霸占三年，否则能拿到赔款6万？ 医院有理为什么不申请三年的损失？,0,3,0,2022-07-18 22:43:11,来自山西,4375648774405075,富足海风Jz
7121875660448334631,类似的事情其它地方也有上演，只是没有人家这家医院运气好，执行力度上不去。[捂脸],0,2,0,2022-07-19 08:36:56,来自山西,5564648755,晋绥往事
7121862627558736681,镇江江滨医院骨科住院病房内 一个镇江老太霸占病房十几年了。 吃喝拉撒睡独霸一间病房。医院不照样拿她无办法。,0,6,1,2022-07-19 07:45:31,来自江苏,15381100901,无术不学3
7121877108837942027,接着直接霸占拘留所不用出去了,0,2,0,2022-07-19 08:42:36,来自福建,68191561061,滴落的泪2020
7121715486852907809,执行就将近一年，真的该感谢法院啊,1,12,1,2022-07-18 22:14:54,来自贵州,110124748182,我就叫胡松松
7121917141175026464,医院病原菌那么多，也不怕交叉感染，服了,0,0,0,2022-07-19 11:17:30,来自福建,2862757095943021,清闲的云朵Qy
7121654519968236326,占了三年，医院的这个损失该由法院和派出所赔偿吗？,4,44,3,2022-07-18 18:18:34,来自海南,53655469467,德才兼备梦想家Wr
7121857097302262528,嚣张气焰好旺盛啊，霸占三年，才拘留十五天。,0,2,0,2022-07-19 07:24:21,来自湖北,303095960049485,thz幽幽
7121661773497385743,霸占了三年，才被执行走，这叫什么？[抠鼻],0,23,0,2022-07-18 18:46:04,来自上海,2674432704001639,来世做棵树
7121726433155695395,真的是无话可说了，赖了三年只拘留半个月，医院这间病房三年来的损失又该怎么判决？？？,0,6,0,2022-07-18 22:56:51,来自广东,51941810344,言行于思
7121901810478416655,什么事情都有两面性，这个报道的正面是医院，如果是病人出来报道网友吐槽的就该是医院了，能住三年没赶得走绝对不是病人耍耍无赖就就得行的，一定有他的原因！,0,1,0,2022-07-19 10:17:39,来自河南,23231967093,春华秋实138780586
7121858045802087168,前几年山西吧，煤矿总院就有货这种事情，法院上门强制给送回家，他整天说做手术后脚不能动，结果查监控，只要没人他就下楼遛弯。也是霸占了几年。,0,4,1,2022-07-19 07:28:03,来自云南,54461182396,矮穷丑20
7121661098180395780,看来老赖收益不小，三年白住，也不用赔偿，拘留所住15天就清零了！医院损失谁承担？！,1,43,3,2022-07-18 18:43:56,来自江苏,98436040688,二丁538
7121666427723432743,病房60元一天*1000天=60000元，方某把赔偿金还给医院[捂脸],3,24,2,2022-07-18 19:04:45,来自四川,4323260473,暮色斜阳38505465
7121626626852602658,法院判了，早该这样不至于霸占三年。,0,174,0,2022-07-18 16:29:32,来自江苏,102467962643,一丝不苟苹果vz
7121818908676047620,不仅仅是耍赖，是不是还有其它的原因，比如无房户，比如特困户。,1,2,0,2022-07-19 05:02:22,来自河北,56653205413,取信于民
7121774723716973346,医院这么包容，忍三年[惊呆],0,3,0,2022-07-19 02:09:01,来自陕西,5830481312,清早别开灯
7121865116576564009,医院房租比外面便宜吗,0,2,0,2022-07-19 07:55:11,来自广西,101175181970,直爽的小馋猫
7121708268006933256,为强制执法这么长时间点赞,1,8,1,2022-07-18 21:46:29,来自重庆,23097886072,我是阿童木3
7121670504671068936,被占三年了，感谢法院。要是被占十年是不是更应该感谢法院[看],1,80,2,2022-07-18 19:20:16,来自河南,92460882389,光明正大顺
7121693103689794342,是不是还得霸占看守所[捂脸],0,39,1,2022-07-18 20:47:55,来自四川,60758996401,南风煦暖
7121847420270904076,三年才强制执行？,0,3,0,2022-07-19 06:48:09,来自河北,2110710626917459,云无形
7121735651862840099,任何理由也不能霸占公共场所。长期霸占，性质恶劣，影响太恶劣，这已经属于犯罪行为了，还只是拘留处罚？,0,6,0,2022-07-18 23:33:00,来自广东,82162473041,策鸟入林
7121712374365012774,这么小的事，执行了三年！,1,8,0,2022-07-18 22:02:49,来自河南,3974814475,狂飙30893198
7121707991472653095,事出有因，一个人没可能无缘无故在医院住了三年啊！,3,20,5,2022-07-18 21:45:51,来自广西,1402571989980488,一往无前白云k6
7121680539764933412,我哥们霸占殡仪馆停尸房近六年，上个月才抬出来。起因是当时征地拆迁费有出入。,9,4,2,2022-07-18 19:58:54,来自广西,6801804732,老夫子的
7121835093915796258,快一年了才执行，可见民间类似纠纷有多么不容易处理,0,3,1,2022-07-19 05:59:21,来自重庆,73308272835,强哥67702
7121913505028784927,拘留出来再去医院住，住了再拘留！两头换着住，[大笑][大笑][大笑][赞][赞],0,1,0,2022-07-19 11:03:27,来自陕西,575763139273891,浐灞新城农贸市场彩票
7121692854099460872,他为什么这样做？难道住在医院里面舒服吗？咱们不知道内情，不做任何评论...[微笑],1,41,3,2022-07-18 20:46:44,来自河南,75045587286,张伟健168
7121858662745768738,抗法的成本太低，为何三年才执行?对霸占三年的床位如何处理?白住了吗？,0,4,0,2022-07-19 07:30:03,来自辽宁,50554051144,善良芒果fr
7121735999515919104,三年了、被占病房要创收多少利润、就要求法院判决多少给医院才是。,0,5,0,2022-07-18 23:34:22,来自重庆,6256133220,张张234
7121845448742404877,这样的处理还不够。医院还应提起民事赔偿诉讼，讨回该病房因霸占带来经济损失！,0,6,0,2022-07-19 06:39:42,来自重庆,73902273132,智者人民至上
7121669020520153860,为什么能霸占3年？,2,87,3,2022-07-18 19:14:35,来自河南,387479645728670,H天天收金
7121701166091404035,早就应该处理了，拖这么久，浪费了社会成本，不值得为法院点赞！,0,20,0,2022-07-18 21:19:10,来自湖北,59156508027,中西医结合官医生
7121850507073159943,这种老赖才拘留15天，还应该赔偿这三年的床位费，,0,2,1,2022-07-19 06:59:42,来自河北,61445114188,占根2596
7121883986217681678,霸占病房三年的费用怎么办？医院应该起诉追讨吧？,0,2,0,2022-07-19 09:08:58,来自广西,5759258635,一切都好551013
7121835380000899840,不可思议！三年？为什么不早点执行？！都像他这样，简直了！,0,2,0,2022-07-19 06:00:22,来自江苏,1143131697594111,ABc与aOe
7121870782388503310,这种医霸就应该严惩,0,3,0,2022-07-19 08:17:25,来自浙江,105627757924,细心晋州0W8
7121836839153124137,医院还可以对这个霸占病房近三年的男子提起民事诉讼，追讨床位费和水电费！不能惯着他！,0,5,1,2022-07-19 06:06:01,来自云南,5569618000,香山思学
7121866870785458976,还是有前因后果的，不可能无原无故霸占病房三年，没原因你让吗？,0,1,1,2022-07-19 08:03:07,来自黑龙江,95109395119,爱康916
7121663996763325215,医院的损失怎么说？,1,3,0,2022-07-18 18:54:55,来自陕西,25591773025,云横秦岭6
7121725930623845132,法院判了应搬出，医院申请了执行程序，就应该依法执行，就不需要在什么沟通,0,4,0,2022-07-18 22:55:55,来自重庆,782491001578014,清爽雪梨3Ju
7121688863071814411,一般老百姓不为无缘无故赖在医院不走，终究有原因的吧？,4,20,1,2022-07-18 20:31:13,来自浙江,1416627891475075,小鼻孔啦啦
7121841062503170856,这下看守所又要“倒霉”了，既然不让霸占医院，拘留它，肯定会气得要霸占看守所！[捂脸],0,3,0,2022-07-19 06:22:25,来自江苏,5755663817,纵横四海63190043
7121874780277883685,现在人怎么了？病房还有霸占的[what],0,1,0,2022-07-19 08:33:13,来自山东,105075652690,人体能量调理
7121683924174553894,这叫得寸进尺！社会把这样的无来惯坏了！支持严格教育！给法院点赞！[赞][碰拳][碰拳][玫瑰],0,27,0,2022-07-18 20:12:30,来自上海,5764132988,中国山东省烟台市莱州
7121744291302605579,既然法庭一二审都判决了，也接受了赔偿，本人再耍赖没有道理。,0,7,0,2022-07-19 00:08:12,来自陕西,98930497167,老铁匠5008
7121710736716088096,恶人有好处，是鼓励大家变坏。坚决打击恶人,0,6,0,2022-07-18 21:56:20,来自山东,24992211566,自由饼干jS
7121706125086868239,怎么做到霸占三年的？,0,6,0,2022-07-18 21:37:52,来自湖南,2234641548051752,明天会更好🥰
7121879697767891748,霸占3年才出手,0,4,0,2022-07-19 08:52:11,来自山西,106804234876,斩妖斩妖斩到零
7121844940338545421,霸占三年病房。这简直是无赖。拘留他都不行。还让她赔偿医院的损失。,0,3,0,2022-07-19 06:38:13,来自山西,501837784944220,宗騰
7121909739248108323,霸占病房三年只是拘留，是否轻了点,0,1,0,2022-07-19 10:48:12,来自湖北,108816587077,博学多才的光束v
7121909033107440418,如果是真的为何要等到三年才处理，拘留15天～这种事情不能惯着，医院，警察早该行动～医院费用全部由肇事者个人承担，判刑～,0,0,0,2022-07-19 10:45:21,来自四川,63200118077,510502老滴滴
7121866420401193728,霸占三年，腾空出院，这样的新闻还报道，照这样下去，医院岂不成了养老院。,0,2,0,2022-07-19 08:00:22,来自内蒙古,108725108250,端庄优雅山丘ix
7121813399344104224,为法院点赞，这么点小事三年时间就解决了,0,2,0,2022-07-19 04:42:46,来自广东,109901785238,风之韵JQL4
7121835379233850124,一般老人住几年这三年没收床弗为什么霸占三年,0,3,1,2022-07-19 06:02:52,来自浙江,3105434061513428,上进橘子6U
7121779318980100864,别拘留直接判刑，以霸占公共资源罪起诉法院。医院住够了再换到监狱里住几年，这样他的心情会更好！[抠鼻],0,4,0,2022-07-19 02:28:29,来自黑龙江,51355916008,寒野dn5n
7121900692511752999,霸占三年，不给医院赔偿损失，就拘留一下了事？也太简单了吧。,0,1,0,2022-07-19 10:13:51,来自江西,63715125038,cRG
7121874818941305637,霸占三年？不清警察叔叔，法院干警介入？,0,2,0,2022-07-19 08:33:31,来自浙江,69527308513,AF7595
7121910763840766754,请猜谜语，为什么有人霸占病房三年多才执行腾房？,0,0,0,2022-07-19 10:52:03,来自陕西,59360942351,一往情深
7121730426624459554,如果这人真的是无赖，那就应绳之以法，并赔付医院三年的床位费、干扰公共秩序罪均应判罚！不能就此结束！,0,11,0,2022-07-18 23:12:46,来自四川,5729575557,天逸61871518
7121848162121925388,太便宜这家伙了，最起码对他提起民事诉讼，赔偿医院一切经济损失。,0,1,0,2022-07-19 06:51:08,来自山西,68749881198,用户8251420711牛韶山
7121727063807509287,拘留15天就算完了？霸占病房（床）三年给医院带来了多少损失，耽误了多少患者住院治疗，必须让这个无赖承担赔偿责任！,0,2,0,2022-07-18 23:00:18,来自北京,60265205437,超凡脱俗170155697
7121747996269675267,看来老赖收益不小，三年白住，也不用赔偿，拘留所住15天就清零了！医院损失谁承担？,1,4,0,2022-07-19 00:23:27,来自浙江,6791323441,义乌博缆贸易有限公司
7121854340091888416,医院应起诉他非法占有公共资，对其提出民事赔偿！15天拘留太便宜了。,0,2,0,2022-07-19 07:14:26,来自山东,53659722813,新气象489
7121909229837189928,这个人和医院肯定是有纠缠不清的事情要不然怎么会在医院里住这么长时间。,0,0,0,2022-07-19 10:46:14,来自山西,75630450508,勇敢的蛋糕fz
7121702938438828800,霸占病房几年，医院不要房租费吗？拘留十五天就完事了，这样处理结果也太草率了吧。,0,9,1,2022-07-18 21:25:21,,6112504539,认真的海浪W3
7121912357655446312,执行的好！把医院当成了自己的家，太不象话了。支持法院的判决。[给力],0,0,0,2022-07-19 10:58:12,来自陕西,96156199336,乘风破浪的万马奔腾
7121725787380089607,要实行免费医疗，这样的事多了！夏天热，他就赖着病房不走。冬天冷，医院有暖气，他更是小病大养不愿回家。,0,2,0,2022-07-18 22:54:57,来自江苏,6108624445,安逸风声cA
7121904108566676255,哪有这种无法无天的人？把病房当作无租金的长期居住？支持警方！,0,0,0,2022-07-19 10:26:44,来自广西,51961364599,宝宝230732845
7121916500289930025,过去这样的事情还是有一些的，除了医院，还有宾馆工厂，不讲理的人总是占便宜。希望法制社会最大限度扬善除恶，给社会以公平公正。,0,0,0,2022-07-19 11:14:22,来自山东,78784331522244,优美晚风JI
7121820909320864550,对这种人就该说不！为执行法院点赞！,0,3,0,2022-07-19 05:08:21,来自辽宁,6002425842,沧海一粟Han
7121812093552116520,医院三年的损失怎么箅？拘留十五天？应判三年。,0,2,0,2022-07-19 04:32:54,来自甘肃,101441044845,wjr400
7121794071051436834,霸占三年？拘留15天？[我想静静][我想静静][我想静静],0,2,1,2022-07-19 03:26:12,来自浙江,50514078842,星辰大海KYJ
7121874287124202281,对这样的无赖必须依法惩处！！！还医院安宁！,0,1,0,2022-07-19 08:30:42,来自辽宁,65752687486,小帽25
7121896656492495646,医院应该给他三年住院费用的账单，通过法律手续获取。,0,1,0,2022-07-19 09:57:59,来自美国,2858334453236830,坦荡火车f
7121865080639341320,这样的无赖，应该拘留判刑！,0,3,0,2022-07-19 07:55:33,来自湖北,3522456902703639,亲切远山a7
7121833622247686927,必须严惩，以彰显法律的威严，已经判了，不服可以上诉，霸占医院算什么！,0,2,0,2022-07-19 05:53:41,来自辽宁,53022431403,大漠雄鹰155974816
7121915179826299682,等于在那里养老了，怎么三年了才执行，不懂,0,0,0,2022-07-19 11:09:17,来自广东,5609511765,手机用户路漫漫
7121725643464721186,太牛逼啦！还有这样的人。我不信。医院能容忍他？想想吧，为啥,0,0,0,2022-07-18 22:53:52,来自江苏,3819519966,好人一生平安27924808
7121903659877368584,19年9月判决就下来了，到了20年10月才给人家结清赔偿款，是医院缺钱，还是故意拖着不给呢？,0,0,0,2022-07-19 10:25:27,来自浙江,3273367421,自在乐观的露珠
7121871826434933539,三年了，强行霸占，扰乱医院秩序，治安处罚法不能处理吗？,0,0,0,2022-07-19 08:21:04,来自河南,67270373609,我本善良hn
7121723621235852047,为什么霸占了三年法院才采取强制措施？医院能就这样忍吗？，觉得医院一方还是有点理亏,0,1,1,2022-07-18 22:46:01,来自陕西,4283304336954495,博学多才的荷叶nP
7121911861196718851,无一个无赖，无法无天,0,0,0,2022-07-19 10:57:05,来自浙江,63160958249,高贵葡萄Nz
7121697303517709096,为何不走没说，是不是有医疗纠纷没有得到根本解决，如果是这样，我想不从根本上解决问题，他出来后会怎样不好说!,2,14,2,2022-07-18 21:03:35,来自辽宁,63910065691,记录美好大连
7121851692840502054,终于在2019年9月，医院放法院提起了对方某的诉讼，要求方面搬离医院病房,0,0,0,2022-07-19 07:04:24,来自陕西,62044647164,锦绣人生幸福生活
7121693368442848030,这一拘留要霸占拘留所了[捂脸]。,0,9,0,2022-07-18 20:48:43,来自河南,6532367847,网易小米腾讯水军盟主
7121732651375018793,医院不应该直接抬走丢路边吗？,0,1,0,2022-07-18 23:21:20,来自广东,4419681393850364,差一个女朋友o
7121884104043299624,仅拘留是不够的，可以按扰乱公共场所，以危害公共安全罪名义判刑！,0,1,0,2022-07-19 09:08:38,来自浙江,102537255259,认真的小羊Un
7121851651874407202,有果都有因，为何不公布该案情由呢？,0,2,0,2022-07-19 07:02:52,来自河南,55826983095,多彩水滴Sl
7121646848762872583,应当以“寻衅滋事罪”追究其刑事责任。,2,62,2,2022-07-18 17:48:37,来自海南,58749375731,陋室里的俗人
7121872614561825573,有法必纠！有懒必查！大快人心！,0,1,0,2022-07-19 08:25:00,来自广东,59504483769,灵巧松鼠fh
7121867678339564326,建议医疗纠纷，涉事医生有明显违规失职的，承担刑事责任，不能只赔偿了事。,0,0,0,2022-07-19 08:06:05,来自河南,103977665973,谦和宜人的大王
