7121855558474580750,河南省信阳市光山县某医院负责人不顾炎炎烈日，难到是走路去的？,0,2,1,2022-07-19 07:18:38,来自福建,57792587410,识英雄中英雄
7121730276748804895,谁能霸占医院病房还真没见过？,0,0,0,2022-07-18 23:12:20,来自山东,57455795012,炎开1
7121719553130480424,司法拘留期满，他要继续住进去，咋办？继续司法拘留还是改为刑事拘留？,0,1,0,2022-07-18 22:30:21,来自江苏,2893526477585944,倦鸟之家
7121875170247164685,还是纠纷没有处理妥当，否则，谁愿意在医院那样的环境中生活几年？没病也整成病人了。住过院的人哪个不知道医院里是最不适宜人长期居住的地方？,0,1,0,2022-07-19 08:34:28,来自河南,2199442815769647,真诚永远健康
7121691049957311247,霸占医院病床3年，为啥就没有人管，真让人无语！,0,11,1,2022-07-18 20:39:25,来自河南,5490010090,好学善忘
7121914654137860904,霸占三年了！！！必须法律制裁，不能只是拘留！！！,0,0,0,2022-07-19 11:07:18,来自陕西,104216902157,天行健陽
7121673424778904323,法院判了，早该这样不至于霸占三年。,0,6,0,2022-07-18 19:31:52,来自湖南,5749466513,少华62871718
7121902521102779166,跟医院管理有问题，我们这边医院没有这种现象发生。,0,0,0,2022-07-19 10:20:39,来自重庆,77674330786,微笑海洋Tj
7121659617243579167,医院为什么不索赔占用病房费用，已经撕破脸了，还怕啥,0,10,0,2022-07-18 18:38:09,来自辽宁,6629957865,东北之东
7121871037344088869,霸占了三年，医院可以索赔。,0,1,0,2022-07-19 08:18:42,来自吉林,53507765431,郁闷de小猪
7121744111254258469,这么简单的案子，哦！不，可能只够上民事纠纷吧，经历了一审和二审，三年才把问题解决，为执法部门的办事效率点赞[赞][赞],0,1,0,2022-07-19 00:07:55,来自河南,17925402685,幸福满满127292406
7121732502926623491,司法拘留15日期满后，方某拒绝走出拘留所，继续在里面住怎么办？,0,0,0,2022-07-18 23:22:12,来自福建,5509464992,山松塔
7121856919316398852,应该让他付这三年的费用，我觉得应该超出六万了吧？,0,1,0,2022-07-19 07:24:28,来自山东,50271405405,思念126378062
7121672025428984609,"霸占三年，还得感谢法院？
够奇葩的了。",0,13,1,2022-07-18 19:26:26,来自江西,201926598466286,霍去病对辛弃疾
7121845269959820040,针对此种情况应在全国范围内开展一次专项清理，对任何无赖行径必须对其本人及家人进行严肃处理，还医院一个清白。,0,2,0,2022-07-19 06:38:52,来自江苏,62683654557,挑战者824
7121886642738053903,遇到了无赖不能手软，依法处理，确保社会安定。,0,0,0,2022-07-19 09:18:30,来自四川,108061702259,进取暖阳IK
7121738367569675019,就算有纠纷没有解决，也应该走司法程序，不能霸占病房，病房是公共资源！,0,4,2,2022-07-18 23:44:37,来自山西,5941868152,心者寄语
7121900515507569439,法治社会还有这种无赖之人，必须严惩！,0,0,0,2022-07-19 10:12:44,来自湖北,3513669937271879,勇者苹果62
7121883871792431903,为什么要等三年才执行？对这样的无赖早就该依法处理。,0,1,0,2022-07-19 09:08:25,来自山东,50824368523,菏心悦
7121867321072796431,霸占医院病房三年，他是怎么想的？一般人要是没什么事都不想去医院。,0,0,0,2022-07-19 08:03:35,来自广东,4246189314,风铃里的风声
7121869147248083748,三年的床位费用谁出？医院不能安排病人入住损失谁负责？不能就稀里糊涂完事吧。,0,1,0,2022-07-19 08:11:35,来自辽宁,51200561097,梦里芳华253979359
7121728393309569832,维护法律权威，支持法院依法行使职权！,0,1,0,2022-07-18 23:04:42,来自陕西,4322903420052573,积极的麻酱kQ
7121693629722166023,"三年不工作吗？
是否真的处理不公呢？
这也是奇葩事，谁愿意住医院？
长期霸占病房也是一种违法行为！",0,7,2,2022-07-18 20:49:34,来自湖北,108159991002,书香万年好
7121874216173388555,这样的人居然能霸占三年才被执行。该说些什么呢？,0,1,0,2022-07-19 08:31:14,来自安徽,50573686464,木缘轻尘333
7121909059548447501,这个时候医院可以起诉啊，霸占病房三年的费用让他交了吧。按照医院的基本收费要求,0,0,0,2022-07-19 10:46:00,来自四川,1812415556120606,城府要深待人要善
7121895166462149389,万一拘留出来，继续回到医院呢,0,0,0,2022-07-19 09:52:18,来自河北,2999067630897415,此西周非彼西周
7121869708957287198,对方某只拘留太轻松了，应处于违规处理。,0,1,0,2022-07-19 08:13:28,来自浙江,5649539116,端庄溪流ja
7121725440519406340,霸占病房，侵害了他人利益。对这种老赖理应严惩。,0,3,1,2022-07-18 22:53:51,来自山西,72290363629,热情的饭团OZ
7121916036223796002,方某其实心里希望能拘留3年,0,0,0,2022-07-19 11:12:39,来自浙江,84582306934,堕落冷月
7121864419277194016,会不会拘留15天之后，到期又霸占着牢房不走了呢，又霸占三年，又拘留十五天,0,1,0,2022-07-19 07:53:29,来自广东,2831398570,1690173563
7121898314731324201,对方某霸占病房造成的损失追不追究？三年也有三十万元,0,0,0,2022-07-19 10:03:46,来自安徽,104937864488,CZVVAHJPD
7121834376660747049,十足的无赖，拘留十五日，太便宜他了。,0,2,0,2022-07-19 05:56:48,来自湖南,3909486706692270,乐观的单纯白云6y
7121871623027786496,不能自以为是的就认定是“医闹、霸占”，毕竟我们不是“当事人”。还是要回到“讲道理”的源头去看问题。事件当初：有无讲道理，按照“理字”去解决问题？,0,0,0,2022-07-19 08:20:13,来自河南,2867952819375791,心存阳光去修行
7121836866466661156,法院为医院办实事了，三年时间不算短,0,1,0,2022-07-19 06:06:54,来自山东,4322867644213837,远见卓识糯米ff
7121742126769275689,医院有过失所以能忍他至今 在医院躺了几年 这几年医院赔的钱也吃完了也该换个地方了 出院了接着拘留所管吃管住[捂脸],0,0,0,2022-07-18 23:58:41,来自广西,98790717791,bxxjkigawthkknjklyte
7121880246629958439,为什么要霸占三年才执行？三年才到强制执行的时间期限吗？[发怒][发怒][发怒],0,0,0,2022-07-19 08:54:32,来自辽宁,110267935704,你好利剑
7121910375028638472,对这种无赖，应绳之以法，并赔付医院三年的床位费、干扰公共秩序罪均应判罚！,0,0,0,2022-07-19 10:50:53,来自重庆,89924450390,老周37823
7121841735038829346,如果是郑大一附院，一天都给他清理了，人家一个床位，一年可是1000万收入啊。,0,1,1,2022-07-19 06:24:59,来自河南,3681630151261879,梦幻春风9z
7121712198849970977,"一个狠人！
这下 拘留所所长要紧张了，这个狠人要是再赖在拘留所三年，该咋整？",0,2,0,2022-07-18 22:02:01,来自河南,108604389638,清风明月听松涛
7121676959146984231,为什么能霸占三年？为什么早不执行？,0,3,0,2022-07-18 19:45:42,来自北京,435006821375180,3142902207353
7121654146017149734,霸占3年才拘留？值了！,0,9,0,2022-07-18 18:17:22,,105942152551,R未末
7121648241112335141,无语了，既然法院已判决应该执行！,0,46,1,2022-07-18 17:53:54,来自河南,3101396544,静水深流Wangenpei
7121771066141508393,这个人靠山也够硬气的！病房一呆就三年[赞][赞],0,1,0,2022-07-19 01:54:09,来自陕西,23722674797,可爱黄桃9T
7121851442960892707,霸占病房三年才解决是否有点长？,0,1,0,2022-07-19 07:02:24,来自吉林,54846414669,真诚喜鹊uT
7121875754433954575,霸占一个月就应该拘留，为什么让他占三年？,0,1,0,2022-07-19 08:36:08,来自天津,294296905581588,心语悦聆
7121879911044285224,要是在抖音，底下的评论都是骂医生骂医院，同情老赖，追求“真相”，头条的评论区就理性多了。,0,1,0,2022-07-19 08:52:32,来自福建,50611776393,聪慧与正义的化身
7121746641094181667,人民医院人民住，人家不想出院为啥非得让人家出院？再说了，出院到哪去住？外面房子那么贵，你医院给买一套房子吧！,0,1,0,2022-07-19 00:16:19,来自吉林,59017213538,冬季的寒冷5
7121860287078662923,你问医院到底做错了什么这问题应该是问问写作者？？？？头条新闻就是这样的说一半一半让你我他她猜猜,0,0,0,2022-07-19 07:37:38,来自海南,637346116012747,热心饭团mu
7121872910972797734,白住了三年，才拘留15天，这人赚了。,0,1,0,2022-07-19 08:25:57,来自河北,1033177552134036,优美火车P
7121743830760309511,三年换15天拘留，还不是刑事的，血赚啊,0,1,0,2022-07-19 00:06:47,来自浙江,110713517447,dzya
7121895569492132620,霸占十年也比不上老干部病房,0,0,0,2022-07-19 09:53:56,来自四川,870424275848574,自若轮船Mp
7121879556160094980,这种老赖己超出常人品德！无视法律！法院强制执行漳显法律严肃。为法院点👍。,0,0,0,2022-07-19 08:52:05,来自广东,104824192816,实话实说郎
7121738078511399721,这个不应当是民事案件，可以刑法“扰乱单位秩序罪”来处理昂。,0,1,0,2022-07-18 23:42:54,来自甘肃,111237593428,橄榄树YSB
7121850953774793487,应该继续追收住院病房费用，维护法律的尊严。,0,1,0,2022-07-19 07:00:19,来自河南,5530750579,刚58600516
7121873204976780072,真是什么人都有，明显是大赖皮，为什么不早诉讼法律！,0,1,0,2022-07-19 08:26:21,来自河北,50012508198,聪慧沙滩ZI
7121839658082452259,快一年了才执行，可见民间类似纠纷有多么不容易处理,0,0,0,2022-07-19 06:17:01,来自山东,3686039913763197,温柔晋州4F8
7121878656816890631,法制社会！发生这种事！让人无语！丢人呀！,0,0,0,2022-07-19 08:48:10,来自河北,5965830374,老同志任
7121863449663537920,这刑期太短了吧，在医院三年，蹲监狱也得二年吧。,0,2,0,2022-07-19 07:48:55,来自吉林,237124640052007,平凡中寻找快乐幸福
7121886421367505678,霸占三年，拘留十五天？太合适了！光辉的榜样！,0,0,0,2022-07-19 09:18:22,来自山东,1569725983491912,乐天派糯米rt
7121729086501847842,这不是法院应该做的么？为什么要感谢,0,1,0,2022-07-18 23:07:18,来自浙江,53568566044,真水无香161178434
7121892144361079555,为什么是司法拘留,0,0,0,2022-07-19 09:40:51,来自陕西,1064752311960768,A傲骨丹心
7121849591984702219,他霸占的不是医院的病房，而更是人民紧缺的医疗资源！！,0,1,0,2022-07-19 06:56:07,来自贵州,2818786587840692,勇往直前的柑桔K7
7121865571046130432,霸占了三年才出警，速度太快了,0,1,0,2022-07-19 07:57:03,来自北京,106142851702,beer149
7121724100800283427,法院这个行动我支持！毕竟是法治社会！,0,1,0,2022-07-18 22:48:02,来自湖北,6864428042,歪哥5
7121667620407018240,给光山县法院点赞,0,8,2,2022-07-18 19:08:32,来自河南,2066678878055248,奇幻面条QX
7121726127458255655,这效率太高了，才三年就执行完毕了！佩服！,0,1,0,2022-07-18 22:56:28,来自天津,6180935298,安逸ylc
7121854299453915939,三年房租会是多少？[呲牙],0,2,0,2022-07-19 07:13:29,来自湖南,5333014695,风是秋后爽
7121853620458881799,为法院点赞,0,0,0,2022-07-19 07:11:18,来自山东,111424750395,高冷青山54
7121717612824331047,为法院点赞,0,1,0,2022-07-18 22:23:24,来自贵州,86656644792,友爱荷叶to
7121872278065267494,涉恶案件，依法处置，绝不手软。,0,1,0,2022-07-19 08:23:44,来自河南,3348515663,我的好友12149332
7121645033941811998,为维护司法权威和司法公信力，打击方某的拒执行为，全力保障医院的医疗次序,0,3,0,2022-07-18 17:41:23,来自江西,3526869983178440,独目可阅
7121868800303203105,对这样无法无天的人，严惩不贷，坚决打击，决不能手软。,0,1,0,2022-07-19 08:10:18,来自陕西,2616489209513512,诗意百灵鸟D7
7121719577020465953,这次要霸占拘留所的床位了,0,0,0,2022-07-18 22:30:30,来自福建,3240982518712712,张洸
7121921978101564201,报警不就马上能拉走？还要法院起诉[捂脸],0,0,0,2022-07-19 11:35:48,来自福建,2466960038956532,守旺者2022
7121664475648099103,拘留15天后，会不会霸占拘留所3年[大笑],0,8,1,2022-07-18 18:56:58,来自安徽,4403244250,想用户名真麻烦
7121885811645809439,这个法院的工作效率真叫人吃惊！,0,0,0,2022-07-19 09:16:03,来自广东,21623198465716,儒雅喜鹊8g
7121691885907149601,霸占三年，才执行拘留！[赞][呲牙],0,5,1,2022-07-18 20:43:16,来自重庆,111041007619,悠闲溪水DT
7121875590680412967,法律不可亵渎！违法必究！维护公共秩序。,0,1,0,2022-07-19 08:36:40,来自河南,5861937686,東方虹莲
7121913670825394979,医院好居住吗？现实的社会什么人都有[捂脸],0,0,0,2022-07-19 11:03:35,来自广西,52236576734,真诚车夫
7121689243516568360,坚决严厉打击，恢复医院正常秩序。,0,9,1,2022-07-18 20:32:18,来自四川,1126328906300768,时髦河流zJ
7121891875195601664,病房，床位应按正常标准收取，不能只是拘留了事，,0,0,0,2022-07-19 09:38:51,来自广东,1455362953459203,云水悠悠B
7121901402926613281,支持执法干警的文明执法，伸张正义，该出手时就出手，体现法律的神圣不可侵犯！,0,0,0,2022-07-19 10:17:04,来自辽宁,2418564102621535,启蒙的呐喊
7121878913798013730,对这个无赖早都应该强制执行。,0,0,0,2022-07-19 08:48:38,来自黑龙江,1437749084426708,友爱艺术家Zu
7121676688056566563,成本合适，三年才拘留十五天,0,3,0,2022-07-18 19:43:48,来自山东,52608655445,壹叶知秋19
7121688294064653096,霸占三年付费了吗？,0,6,1,2022-07-18 20:28:37,来自北京,106470811813,大北路路
7121882174844125966,这世道永远都是耍无赖才能更好生活,0,0,0,2022-07-19 09:01:43,来自贵州,5524481168,糯米饭吃了
7121715202596930319,是的，对这种无赖直接罚款。医院的损失呢？谁来承担？,0,1,0,2022-07-18 22:13:13,来自贵州,5806830416,符杰盲人保健按摩
7121903904769491719,最欢迎有纠纷这样的丙人，小丙大志利益丰厚。只可惜这次纠纷是衣圆自己，应该不受欢迎。,0,0,0,2022-07-19 10:25:54,来自河南,74466147781,博学的明镜la
7121854232797856524,"医院是救死扶伤的地方，怎么病房会被人坝佔？
那坝佔病房挪作它用，究竟是何方神仙？那么权大气粗……。",0,2,0,2022-07-19 07:14:22,来自四川,74342834093,肃然寒非
7121647226140984104,怎么不提建设合谐社会了？,1,6,1,2022-07-18 17:49:31,来自湖南,56058979570,永州包租婆
7121894779838956329,支持公安干警做的好！,0,0,0,2022-07-19 09:50:09,来自湖南,56042950471,向胶园
7121895374608515872,这样的医闹让人深恶痛绝！,0,0,0,2022-07-19 09:53:20,来自山东,65633072048,勇敢的祥和
7121742535492059939,这样的无赖，就该法律严惩！！,0,3,0,2022-07-19 00:00:34,来自河南,100795757635051,修身养性阿威
7121912155515192064,小心，这人在拘留所赖着不走,0,0,0,2022-07-19 10:57:34,来自广西,1402566238026247,宝戈2167514141127
7121877806523073313,司法公正，执法必严，维护国家社会稳定，使人人懂得遵纪守法。,0,0,0,2022-07-19 08:45:32,来自上海,96651842517,陈新81
7121674749960471332,一会他霸占牢房不肯出怎么办[泪奔][泪奔],0,9,1,2022-07-18 19:36:40,来自广东,89920492371,Lu菇凉200
7121919555290858240,这样的处罚无异于纵容。,0,0,0,2022-07-19 11:26:15,来自广东,6926611003,大树1195676
7121695661921682211,他什么原因不出院医院治疗事故造成什么症状了？,0,1,0,2022-07-18 20:57:14,来自江苏,66097131410,海明260554258
7121850139715207972,医院只是去年起诉，证明忍了2年，显然医院知道6万解决问题是占大便宜了。,0,0,0,2022-07-19 06:58:02,来自上海,6320487146,我是猫南北l你哪
7121878336359809827,这么长时间？这就是好人受气，坏人嚣张跋扈的原因！,0,0,0,2022-07-19 08:46:30,来自山西,71289257501,忍者238171584
7121869998318568227,还有喜欢在医院住着的，也太奇葩了吧。[晕][晕][晕][晕],0,0,0,2022-07-19 08:14:19,来自河北,483419244998704,可爱的波斯猫喵喵喵
7121742830628029224,三年啊……他也能住得舒服吗？这家医院也忍无可忍了。真的无奇不有。,0,0,0,2022-07-19 00:01:20,来自广东,67313116545,啊明462
7121849182667375373,霸占3年，拘留15天；[撇嘴],0,1,1,2022-07-19 06:54:27,来自江苏,3702773403631671,端庄蜻蜓5S
7121703160880104229,贫困户，低保户住院免费肯定不想走，回家要用水电费的，,0,2,0,2022-07-18 21:26:45,来自河南,50095703147,我心依旧qwe
7121729158052381470,他霸占医院的理由是什么？为什么能霸占三年？,0,0,0,2022-07-18 23:08:02,来自广东,50071618912,那场雨的温柔
7121872144497476352,我住院半个月，象入监了10年。说实话，出院的时候我一分钟都不想多待，好多东西我都忘记带了。我在考虑光山这家医院是不是有什么特殊服务？,0,0,0,2022-07-19 08:22:13,来自四川,2383358445749646,千寻之万水千山
7121844687928853286,三年是什么概念，三天要损失多少床位费药费水电费，现在怎还有这么多恶霸，唉，不说了。,0,1,0,2022-07-19 06:37:23,来自广西,61522065884,听哑铃
7121896246343942942,三年了，没有清走，医院该是理亏。那是三年，不是三天，三月。,0,0,0,2022-07-19 09:56:05,来自黑龙江,852856670262973,奋发海燕nl
7121724598806594336,"这是下集，看来关键在上集。
医院做了什么才能这么忍气吞声容忍了三年？",0,0,0,2022-07-18 22:50:34,来自山东,3698396729195028,不敢匿名
7121881748903969575,绝不纵容，坚决打击，不能让刁蛮之人胡作非为。,0,1,0,2022-07-19 09:00:21,来自江苏,6928663187,多才明镜pi
7121881172724564771,此医院的床位费比租用房费还便宜？,0,0,0,2022-07-19 08:57:27,来自重庆,80132763283,波音LXB
7121691918602044195,没有报道是什么原因吗？我觉得没有无缘无故的爱也没用无缘无故的恨，此做法肯定不妥，但是不是事出有因呢？,0,3,0,2022-07-18 20:42:42,来自江苏,98731971296,潇洒熊猫LS
7121858890727228193,做人不要这样！给你台阶下为什么要执迷不悟呢？看来他的家人做事也不对为什么不规劝他呢？,0,0,0,2022-07-19 07:31:51,来自加拿大,1530110142338190,Fskclifeng
7121906092733104907,闻所未闻，来头条真是长见识了,0,0,0,2022-07-19 10:35:04,来自吉林,92866834710,还是糊涂点吧
7121622615211049731,干得好，坚决支持！👍👍👍,0,30,1,2022-07-18 16:14:55,来自北京,61509905767,花儿朵朵1699
7121862145121747719,要看医院所负的责任，如果造成病人终身残废疾病，那么补偿是否少了点？,0,0,0,2022-07-19 07:44:18,来自湖南,918834355906452,微笑火车Hy
7121855700615545634,这大哥终于出院了[捂脸],0,0,0,2022-07-19 07:18:44,来自福建,6653566728,留恋少年时
7121676756570211113,医院再起诉他要住宿费,0,10,0,2022-07-18 19:44:00,来自天津,6571107662,灌水专用
7121736573200548646,医院负责人不顾炎炎夏日？这词用的好啊？,0,0,0,2022-07-18 23:37:37,来自湖北,2722000603713134,神秘露珠a1
7121735343342650153,医院应反告，每天占用该病房就成医疗的经济损失及其负面影响（形象）经济补偿。,0,0,0,2022-07-18 23:31:56,来自广西,4217354525619187,温柔雪碧AD
7121702436133503776,到拘留所再赖着不走，继续拘留，[捂脸][捂脸][捂脸],0,0,0,2022-07-18 21:24:03,来自河南,3714548246,鲲鹏飞天
7121893570340733696,事出一定有因，各有各的诉求。这报道为何没有被执行人的说法呢？,0,0,0,2022-07-19 09:45:40,来自河南,2000726698246013,尘土飞扬zzg
7121864406690497321,对老赖更应依法办事，决不可谁赖谁占便宜！,0,0,0,2022-07-19 07:52:30,来自上海,67217177946,高贵溪水JR
7121832396479169295,无懒的到了极致!,0,1,0,2022-07-19 05:49:06,来自陕西,92777021106,诗意芒果x
7121789392171156231,为什么霸占三年，可能有一定的理由。,0,1,0,2022-07-19 03:12:00,来自湖南,51205861485,幽默海燕VA
7121854270122935072,被霸占2年，医院的损失咋办？,0,0,0,2022-07-19 07:14:24,来自河南,50082189860,农民工m
7121915609914966824,他要赔偿医院多少钱？,0,1,0,2022-07-19 11:10:59,来自广东,3973335140,光头佬30864245
7121858280141669151,这种新闻不予置评，个人估计另有隐情！,0,0,0,2022-07-19 07:29:15,来自湖南,2097519885818884,家乐我也乐
7121695463350747939,奇闻，住医院有什么味道？法院叫你去住15天的院，是否也争取多住几天？,0,2,0,2022-07-18 20:56:29,来自浙江,102397492972,特别年代的知青
7121914958564754191,既然都在赔偿协议上签了名，再如此闹实属无赖行为，支持强制执行！,0,0,0,2022-07-19 11:08:35,来自四川,1363867940175677,心静勿躁
7121851050134553377,为什么拖到现在才申请执行？,0,0,0,2022-07-19 07:01:29,来自湖北,4375672423453101,陈汉应
7121722194983846692,三年都没有解决，肯定有问题纠纷。,0,0,1,2022-07-18 22:40:47,来自河南,92928648143,只求实在的
7121827377688855303,说明医院有错在先。,0,1,0,2022-07-19 05:31:42,来自湖北,1011163950230429,微笑饭团KS
7121780604332720937,虽然对医院的冷漠有点意见，但也不赞成这名男子的行为。[捂脸],0,0,0,2022-07-19 02:32:55,来自黑龙江,50034467725,可望爱你
7121911912728068901,我等网上的读者不是当地人，不知真实情况，反真谁说谁有理。不过总觉得那个能獭医院三年不走的可能就是无可奈何之人，不然怎能獭三年？,0,0,0,2022-07-19 10:56:58,来自浙江,1983151091231053,友善是一一一交流的起
7121888946669372197,纠纷可能某些环节上未达成共识或者说还需继续医治为由！,0,0,0,2022-07-19 09:27:59,来自贵州,5533004629,自强不息海风xu
7121876010291446543,医院应索赔三年的损失费,0,0,0,2022-07-19 08:37:34,来自四川,95339677281,刚刚好62995
7121736855808410376,什么原因不出院为什么不讲呢，我的院长检查长们,0,0,0,2022-07-18 23:38:32,来自广东,259076793572728,阳光00088
7121683178062037793,对老赖就应该以法执行,0,5,0,2022-07-18 20:09:33,来自安徽,71200961754,云淡风轻4325
7121828319146427143,对这种无赖行为就要强制执行追究其刑事责任！,0,1,1,2022-07-19 05:34:41,来自江苏,71700901345,善良铅笔t9
7121800766667047715,装箱后拖到法院去了？,0,0,0,2022-07-19 03:53:13,,5853653878,cdyeye
7121910760418525993,为啥三年未决,0,0,0,2022-07-19 10:52:08,来自天津,3684562053,时来运转21785476
7121880488406663976,以前是什么纠纷，这三年是怎么过的，谁不想在家里过温暖[捂脸][捂脸],0,0,0,2022-07-19 08:54:42,来自河南,782487954920110,濮东
7121891855847080715,这病房太高级，单间独立房，他当然不愿走；集体大间病房早走了。[捂脸]怪医院设计错误，把病房分三六九等！[灵光一闪],0,0,0,2022-07-19 09:39:44,来自湖南,3749730817,缘来是妳25461981
7121668604025815841,光山还有这种人……！,7,12,1,2022-07-18 19:13:04,来自浙江,53922192782,5牛牛牛牛牛
7121694830849229568,方某还应赔偿医院的损失费。,0,1,0,2022-07-18 20:53:53,来自河南,105697294644,七音八弦
7121893326173192971,医院损失了什么？医院是国家的，就算被占三年，对医院的收入来说算不上九牛一毛，只是不再忍受下去了。,0,0,0,2022-07-19 09:45:43,来自广西,96068655438,自由的清风YI
7121657433474319143,必须严惩将这种人绳之以法。,0,75,2,2022-07-18 18:29:46,来自天津,2375406637813518,战狼
7121679640410342177,霸占三年是对法律的藐视,0,12,0,2022-07-18 19:56:02,来自河南,6592852456,沙龙98140531
7121694678558835490,三年才强制执行，感觉晚了点,0,0,0,2022-07-18 20:53:23,来自河南,53491003379,春天里88888888
7121869697729594145,才拘留十五天，以后还会更多这种事,0,0,0,2022-07-19 08:14:00,来自浙江,50463994952,向海蓝天1212ximi
7121875831881728783,不会霸占拘留所吧？,0,0,0,2022-07-19 08:36:36,来自河南,6087641256,Lyxzgz
7121730912680706851,可见该医院未有涉黑现象[尬笑],0,0,0,2022-07-18 23:14:19,来自江苏,54564274290,神秘水滴Kp
7121874966785590049,通过该事件对医院也是一个教训，希望医院在今后工作中不出错少出错，即使出了错也要积极赔偿，减少不必要的麻烦。,0,0,0,2022-07-19 08:34:01,来自黑龙江,10979504440,幽默梦想家UH
7121665525000127267,拒不执行判决罪。,0,5,0,2022-07-18 19:00:25,来自湖北,79441096196,水与波浪
7121857630171824896,霸占拘留所三所，该咋办？,0,0,0,2022-07-19 07:26:20,来自浙江,59787175698,hym680724
7121672438416982823,必须严惩！拘留的迟了！,0,5,0,2022-07-18 19:28:08,来自甘肃,58800156883,爱在感情线1
7121688363178623755,没原因吗？应该公式原因,2,3,0,2022-07-18 20:29:48,来自安徽,62475406179,正大光明船帆u
7121855674468172555,医院应索赔病床费，医疗费。而费用不进医保，应打击医霸。,0,0,0,2022-07-19 07:19:42,来自贵州,82392263376,热心百灵鸟xj
7121887879748141824,3年了才有人想起来报警了,0,0,0,2022-07-19 09:23:33,来自河南,103612083378,童话74190
7121894502801441577,扰民为什么不会被拘留呢,0,0,0,2022-07-19 09:49:13,来自天津,65322658584,一别就是一生fff
7121887140061414183,住三天都急得要命，住三年在医院不可想象,0,0,0,2022-07-19 09:21:29,来自陕西,1556524398033662,一个人的生活
