7123956439261217568,这支日本队其实是二队，在欧洲各大联赛效力的明星球员一个都没有来。,2,1,0,2022-07-24 23:11:17,来自新疆,59187975193,董三乐
7123964720087843615,这次压力终于给到了对手，也算胜利,1,3,0,2022-07-24 23:43:27,来自北京,111124225135,炒股养花
7123948013013451555,国足要是能有这场比赛的这种拼劲，也不至于长期沦落，比赛不是不能输是不能输斗志,0,63,2,2022-07-24 22:37:37,来自广西,1380584391711952,枫之流林
7123929399354737449,不管怎样，从日本球迷的评论来看，根本就没有把中国队当回事！全部都是没赢球就是输之类的，既骂教练无能又骂球员都想个人表现，都想争取到世界杯的参赛球员资格而不想出现失误等等！所以我们虽然平了，也更应该改革中国足球的方方面面！争取又能力让对手都畏惧！,19,49,1,2022-07-24 21:25:07,来自日本,52058859614,国外居住的中国人
7123937436081603340,日本人不了解中国男足，青年队才是男足最强的队伍，因为还没被染缸污染，,16,218,2,2022-07-24 21:56:56,来自江西,1838008265607214,杉杉33来迟
7123945537170096903,昨天看了女足的直播，好几次险些被破门！,1,0,0,2022-07-24 22:28:17,来自山东,59302222817,快播老会员
7123938417985176335,没想到国足有反弹了,5,20,1,2022-07-24 22:00:11,来自吉林,3108309644,lecibupi000
7123934076255879950,中国青年队踢平了日本三队,7,49,3,2022-07-24 21:43:46,来自河北,162352086922078,涅槃天蝎夜无眠
7123946253344064268,大陆，台港澳，四方搞个中华杯，我估计夺冠问题不大,8,15,2,2022-07-24 22:31:44,来自河南,91648407840,车载华
7123943736510006051,当我们为一场被动平局高兴时，🇯🇵日本男足在被国内批评，别忘了邻居已脱亚入欧，2050目标世界杯！而中国男足的规划呢，靠归化[灵光一闪],3,6,1,2022-07-24 22:21:06,来自四川,70733857216,后半生微笑
7123931669534540585,有看球历史的球迷都知道，中国男足克日本男足，实力差距很大，但是中国男足经常以弱胜强,10,15,3,2022-07-24 21:34:01,来自山东,24495284494,东楚英豪
7123937790471242530,国足最怕的就是像韩国那种贴身压迫式的打法，日本虽然技术一流，但是身体条件一般，他们反而踢的舒服一点。多少年的通病了。[捂脸][捂脸][捂脸],9,52,2,2022-07-24 21:57:43,来自江苏,5859356742,江边的朱小鱼
7123968594354225955,国足这也算是触底反弹了吧,0,0,0,2022-07-24 23:58:13,来自河南,3123044888613116,清爽奶酪0l
7123950705534632745,噗，，，到时候世界杯首发估计这队里一个人也挤不进去吧,1,0,0,2022-07-24 22:48:12,来自上海,3523256640,Mr_Sanqi
7123932921060131588,我爱国足,3,7,3,2022-07-24 21:39:15,来自辽宁,2853978444925271,晨曦宏阳
7123933946638828303,中国队被这些鄙视，可想而知中国队给亚洲各球队是什么水平了,3,9,1,2022-07-24 21:42:47,来自广西,1402598303473453,日出东方有鸿儒
7123959448225874703,东亚杯门将对比世预赛国门就是怎样去扑出对手有效射程必进之球，世预赛国门逢对手有效射程打门几乎无还手之力扑出然后失球，东亚杯门将看对阵日本时是基本功扎实有一定实力。,0,0,0,2022-07-24 23:22:23,来自广西,71926672120,殷殷919
7123957696155976456,最大冷门，日本队被超级弱队男足逼平。,0,3,0,2022-07-24 23:16:18,来自海南,2484542335880940,乐天派西柚of
7123941297366418212,而我们还在沾沾自喜0-0[捂脸][捂脸][捂脸],3,10,0,2022-07-24 22:11:47,来自天津,65909292213,他就是个直男
7123951831579214623,日本🇯🇵队以为肯定会赢的，可惜了,0,3,0,2022-07-24 22:53:12,来自江苏,2173093471061512,我是猴子搬来的救兵呀
7123942003058344734,小伙子们这场球比上一场踢韩国好多了，至少敢于拼抢，积极围抢，后边守住了，前边若不是朱中卫奋力解围，还有可能掀翻日本队了。,0,6,0,2022-07-24 22:14:34,来自湖北,1610113513424699,悠闲牛栏关猫
7123957585119937292,被u23逼平很正常，他们敢打敢拼，不是国足主力的那些老油条。,0,2,0,2022-07-24 23:16:00,来自广东,101900245970,完美星辰FA
7123952899939795746,"日本一队是传说中的，从没见过；
日本二队是世界杯阵容，只在世界杯出现；
其余日本队全是三队。",0,4,0,2022-07-24 22:56:44,来自江苏,3667578179825102,溝圞方陽糇
7123952581570806563,最低级的球队都没有进球，日本队要换教练了,0,2,0,2022-07-24 22:55:22,来自浙江,71868453204,咏歌667
7123967968597951263,连国足青年队都打不过，哈哈,0,0,0,2022-07-24 23:56:49,来自广东,9115400815,yc1608
7123938343658242851,中国男足居然能逼平日本队，这个真是冷门,0,9,0,2022-07-24 22:00:01,来自浙江,57688627838,淡泊名利66
7123952738190344963,今天我承认低估了成绩一直稳定的男足，竞彩打票比分4—0，结果0—0，赌输了。但心里些许有点安慰的意思[尬笑],0,3,0,2022-07-24 22:56:42,来自云南,102177191524,龙岛hsc
7123959190351233823,国足加油！！加油,0,0,1,2022-07-24 23:21:55,来自河南,59871598325,微笑的草莓君
7123932530817942272,日本球队收钱了吧,0,0,0,2022-07-24 21:37:19,来自四川,2947121975659196,细微之处听惊雷
7123956974227849996,日媒和日球迷也太挑剔了，日本队又不是一队,0,0,0,2022-07-24 23:13:31,来自山东,52010237940,后退我要开始装X了
7123966218733896489,有个传统，打日本球队不用任何动员……技术可能比不过，这是客观事实，但是战斗力，至少提升两个档次……,0,0,0,2022-07-24 23:48:49,来自天津,6291718099,漂移入位
7123952188090712869,被那么说 青年队是我们的最强队 国家队只是一个拖,0,1,0,2022-07-24 22:54:23,来自黑龙江,738470376514007,Jy海纳百川
7123954614986310408,关键日本也不是世界杯那波主力啊,0,1,0,2022-07-24 23:03:42,来自黑龙江,5794829025,圆宇宙设计师
7123948858513900329,这次中国媒体把国足吹上天了,0,2,0,2022-07-24 22:40:53,来自海南,53385158124,宁静致远NOd6
7123949940652458790,这场比赛看结果就可以了 千万别看过程 太虐了 中国队真是被全方位碾压 还好守住了大门,0,2,0,2022-07-24 22:45:37,来自辽宁,59135172083,设计院2080
7123956470198207266,国足总是给人意外的惊喜，下场可能输香港,0,2,0,2022-07-24 23:10:34,来自陕西,1200290098315724,鼎立方
7123939066420249359,下一场对韩国，会不会打起来[呲牙],0,3,0,2022-07-24 22:02:43,来自新疆,4731661469,向西600
7123950573480674063,中国男子足球队让日本队产生困扰了，牛逼[赞],0,1,0,2022-07-24 22:47:30,来自上海,60507468017,WmJpY
7123961784901993216,国足胜了吗？这么激动干嘛,0,0,0,2022-07-24 23:31:36,来自北京,2792360475376323,正义不让泪流
7123947952598795043,日本队太差了， 也就三流水平，个三流打平了，那就是三流水平,0,2,0,2022-07-24 22:37:20,来自江苏,1908347963707037,小雨1253
7123943207897400102,还是认真对待吧！必定日本没出牌，可是态度不一样，千万国人别高兴，认清自己吧,0,1,0,2022-07-24 22:19:48,来自北京,52335299450,丁次1
7123961263457469217,日本球员不会射门,0,0,0,2022-07-24 23:30:20,来自吉林,6808943527,爱依迪美发屋
7123967889291707169,我们的心态已经稳到战平即大胜！,0,0,0,2022-07-24 23:56:34,来自广东,4089775600176119,逸曦
7123945002401202979,中国队要好好反省，连日本都胜不了怎么能进步。,0,1,0,2022-07-24 22:26:08,来自广东,101937451562,沉着梦想家Wd
7123953119247270691,男足是触底反弹了吗？,0,1,0,2022-07-24 22:57:29,来自广东,1465013751003440,睿智呵呵嘻嘻哈哈
7123953848154489635,错中国最强就是青年队,0,3,0,2022-07-24 23:00:27,来自贵州,12104926476,xctotti
7123959041890042638,还没飘起来，国足很牛逼牛的,0,0,0,2022-07-24 23:21:34,来自天津,3682210281,眼泪啲錵吙21709791
7123935177851814688,看来各国都一样，球迷是主教练最难战胜的。,0,3,0,2022-07-24 21:48:12,来自山东,18255652308,峰公授法
7123951797781545768,还好是青年队。要是国家队上，不得打个0：10,0,3,0,2022-07-24 22:52:26,来自陕西,51112367594,弘历爷爷玄烨
7123953060963435301,中国三队平了日本二队，还是不错的结果！说明中国国家队虽然不行，但未来有希望！,0,1,0,2022-07-24 22:57:56,来自广东,5776457412,shinhwabill
7123955641060344611,你们把中国队都逼平了 还想怎样？,0,1,0,2022-07-24 23:07:33,来自广西,4294508344,金色年华万年青
7123960373593981737,90年代处我们打不过韩国时候，收拾日本很容易，。那时候日本还在争取嬴我们。我们那时候用高中锋，手拿把掐的收拾日本。,0,0,0,2022-07-24 23:25:57,来自辽宁,85096200269,EIRIN
7123957030608044833,嘛的！我买的日本3：0赢，4：0赢，结果打平了！我的米啊[捂脸][捂脸][捂脸],0,1,0,2022-07-24 23:13:50,来自安徽,109110627997,爱音乐艾罗
7123968444244230927,相当于国足输越南那样难以接受,0,0,0,2022-07-24 23:57:38,来自河南,716472729737272,开什么玩笑p2
7123935923967951647,有这样日本媒体，日本足球有希望？,0,0,0,2022-07-24 21:50:43,来自湖北,106755498438,败家子oLZG
7123945204297909006,总之，国足是不会进球的……输不输就看对面进不进,0,2,1,2022-07-24 22:27:08,来自陕西,50258099450,拆可夫司机
7123953800611726080,有没有可能是假球[捂脸][捂脸]买中国队输球的都挂了,0,1,0,2022-07-24 23:00:02,来自上海,11502549605,蓝天白云SXM
7123965548899795720,拥有顽强的斗志和拼搏精神，即使输了也能接受，就怕躺平,0,2,0,2022-07-24 23:47:19,来自江苏,3466081838574983,一路狂飙赚钱
7123953778252219136,中国队保持这股拼劲，争一口气！,0,2,0,2022-07-24 23:00:14,来自河南,111463581601,敬亭山人123
7123948651721982756,如果是那些老国足这场比赛就好难看了,0,2,0,2022-07-24 22:40:21,来自江西,4592449782,远航不扬帆
7123936426358162208,日媒不知道了吧，中国青年队比成年队强,0,5,0,2022-07-24 21:53:15,来自广西,3715695900,火枪手24250980
7123938445931676452,我们球迷感觉很满意[捂脸],0,3,0,2022-07-24 22:00:35,来自北京,100481708860,弗拉基米尔普鲸
7123956011320787725,国足看门员超常发挥了，要不是几个神扑早就翻车了,0,0,0,2022-07-24 23:09:29,来自广东,2713219558288734,怡红苑小桃红
7123942022192513807,国足表示，纯属失误,0,1,0,2022-07-24 22:14:11,来自湖南,4711012131,消散无形
7123948044403901224,还有被我们挡在世界杯外的球队？[皱眉],0,1,0,2022-07-24 22:37:48,来自北京,54605575903,lulu166806719
7123952587489346319,现在谁当男足主教练？,0,1,0,2022-07-24 22:55:32,来自广东,51200730131,舜哥4
7123963074532410142,踢日本是国仇家恨.要没裁判得出人命.,0,1,0,2022-07-24 23:36:56,来自江苏,3298699654,艺术幻想森
7123947264947045157,如果森保一被迫下课，这可不能怨中国选拨队啊！这锅咱不能背，因为我们不是故意的，纯属不小心偶然罢了！,0,1,0,2022-07-24 22:35:13,来自江西,102806110878,朝气蓬勃的快乐晴天
7123950275517514507,是的，以后国家队就用这个思路，别再挑那些大爷了，给年轻人机会吧,0,2,0,2022-07-24 22:47:14,来自福建,50366337117,爱冒险的鱼1
7123961694548312843,日本二队的全替补都赢不了了啊,0,0,0,2022-07-24 23:32:25,来自新疆,104310604361,夏雪冻花
7123954736625599265,中国男足至少未来4届世界杯都没有希望了！,0,0,0,2022-07-24 23:04:49,来自安徽,91742313505,二哥的三弟
7123965894606897927,说实话，不管是中国哪个年龄段，还是有点儿不怕日本这种打法。怕的是韩国的那种紧逼贴人打法。遇到韩国就蒙圈儿了。,0,0,0,2022-07-24 23:48:48,来自北京,105043781037,幸福梦想家KJ
7123936115933135616,这场比赛我们的小伙子干的该不错，就是说还凑合！,0,2,0,2022-07-24 21:51:21,来自山东,3944686591942408,琪琪的饭厨
7123959357041328931,"[狗头]越南足球＞中国足球✔
 中国足球=日本足球✔
 越南足球＞日本足球✔",0,1,0,2022-07-24 23:21:52,来自广东,3140482855,你看这个人他又高又帅
7123956192401277727,放心，中国足球成年队以下都难搞，国家队轻松愉快,0,1,0,2022-07-24 23:10:15,来自上海,61929180951,罗斌209309043
7123957482682467084,本场开两球半0.72,0,1,0,2022-07-24 23:15:22,来自江苏,1003174382799342,中华保镖TM
7123968063053398819,日本踢的是人情世故,0,0,0,2022-07-24 23:56:11,来自广东,54810658770,无所畏惧的胖哥
7123956075992941351,这是一场两边都挨骂的比赛,0,1,0,2022-07-24 23:10:28,来自江西,4608926882,非我非非我45596196
7123944698628784910,中国男足希望之星,0,0,0,2022-07-24 22:25:16,来自江苏,63850512353,宁缺勿滥344
7123950050635416358,不会吧！这么快日媒就这样评了吧！自评吧[捂脸][捂脸][捂脸][捂脸],0,0,0,2022-07-24 22:46:06,来自四川,69608542957,幸运星空vM
7123936374709207823,中国男足的进步神速,0,0,0,2022-07-24 21:52:19,来自广东,5937617638,1023专家
7123965450446750476,足球不是打打杀杀，是人情世故。现在青年队还是年轻啊,0,0,0,2022-07-24 23:47:28,来自浙江,50238482785,玩剧大叔
7123940389123261218,日媒说得对啊,0,0,0,2022-07-24 22:07:49,来自安徽,73584937225,不科学11
7123946764474516257,日本也没上全主力 都是练兵,0,0,0,2022-07-24 22:33:40,来自广东,76059817396,kkzyq
7123961767679836959,能拼下平局也是不错了,0,1,0,2022-07-24 23:32:06,来自广东,61814759857,JR527
7123957576664122124,这是传说中的怎么才考了98分跟考了60分吃大餐吗,0,0,0,2022-07-24 23:15:57,来自浙江,59533764737,小cheng说
7123962033615864591,其他肯定不可能，不过男足随便让他们怎么喷吧,0,0,0,2022-07-24 23:32:34,来自四川,9041965996,渝淳的浢浢
7123958157864862497,抗日还是有血性的,0,1,0,2022-07-24 23:18:23,来自广西,3955236320,率真喵大福
7123953620559086343,实话说，0-0我还挺惊喜的,0,1,0,2022-07-24 23:00:10,来自河南,74076996714,业余地球人啊
7123950600609809164,中国成年队与青年队是半斤八两,0,1,0,2022-07-24 22:48:29,来自湖南,62293235153,晨曦279859186
7123959693064078119,别批了，背后博彩应该赢了不少钱，晚上开开心逛银座去吧,0,0,0,2022-07-24 23:24:08,来自安徽,6828437973,喵仙卡林
7123953638108267264,那不是青年队时候外籍加入的吧,0,0,0,2022-07-24 22:59:44,来自陕西,102895231268,尚有部分
7123945390172619555,森保一:你们尽管骂，反正我的口袋鼓鼓的,0,1,0,2022-07-24 22:27:17,来自贵州,52363151430,Snakay
7123949803054121758,足彩庄家赢了,0,1,0,2022-07-24 22:44:53,来自辽宁,100709702861,幸运咖啡4F
7123959660943967010,制霸 是啥意思,0,0,0,2022-07-24 23:23:11,来自广东,5578227202,骑摩托车去游泳
7123943494376358690,是不是夸我们了[泪奔],0,0,0,2022-07-24 22:19:56,来自河南,4591353259,电影志
7123965877686616863,我们又牛逼了,0,0,0,2022-07-24 23:48:10,来自广西,4203255975,35474196
7123960431563227918,。。。青年人不好惹,0,0,0,2022-07-24 23:26:50,来自浙江,6926369926,战歌游侠
7123965728918979335,唉 没指望了,0,0,0,2022-07-24 23:47:50,来自湖北,6801849077,月球上的人0523
7123959789713228551,谁还不吃顿饺子,0,0,0,2022-07-24 23:24:21,来自山西,51042767279,一路向东244630909
7123956776332051215,回光反照的苗头,0,0,0,2022-07-24 23:11:42,来自云南,110776516434,淡定雪梨kE
7123953540201956126,we都跨不过，还谈什么世界赛,0,0,0,2022-07-24 22:59:40,来自山西,1794038012320974,非凡雪碧vl
7123967137714651940,人家说的在理,0,0,0,2022-07-24 23:53:28,来自广东,52972844359,柒叁柒陆
7123963927595057958,打铁还得自身硬,0,0,0,2022-07-24 23:40:53,来自河北,109248988896,同意啊亏OK了
7123954582799631115,不予置评，也就是不肖一顾,0,0,0,2022-07-24 23:04:11,来自广西,66562813146,本杰13
7123953050720682756,还是要用新面孔，跑动积极的新人。,0,0,0,2022-07-24 22:57:51,来自陕西,2269011918469628,博学的铅笔sp
7123942842405290788,怎么这回没有乌龙球？[捂脸][捂脸][捂脸],0,1,0,2022-07-24 22:17:43,来自贵州,4292938343383789,亚平宁一抹蓝
7123947774093591296,唯一买中国输…把💰输了[捂脸],0,0,0,2022-07-24 22:36:45,来自重庆,342681702369182,热闹阳光qL
7123939837207626510,确实平了特能输，搁谁都不满,0,0,0,2022-07-24 22:06:00,来自江苏,57138667820,qzuser211428137
7123946448341156649,总觉得这个扬科维奇会在中国比较成功,0,0,0,2022-07-24 22:31:34,来自浙江,4587043328,诺坎普剪草师
7123949469712483111,哇噻，我们可以哦,0,0,0,2022-07-24 22:44:26,来自广东,78690412893,全线开火
7123964341577106183,彩票中奖了,0,0,0,2022-07-24 23:41:54,来自新疆,10467125707,精彩6482
7123949623915692840,别人怕受伤,0,0,0,2022-07-24 22:43:52,来自湖北,6865533099,二百五乘二
7123942404386145062,没办法，国乒上全替补，没拿下柬埔寨也要被喷的,0,0,0,2022-07-24 22:16:26,来自北京,69101061994,Jiang230607335
7123966062625964803,哈哈哈哈哈哈,0,0,0,2022-07-24 23:49:18,来自浙江,3950783798,Tom30315952
7123934335333401355,是成年队对少年队的教学赛吗？不过这些人都不小了啊,0,1,0,2022-07-24 21:45:00,来自上海,101437635003,英明果断冰淇淋g6
7123952956419883808,竟然无言以对,0,0,0,2022-07-24 22:57:31,来自湖南,681292884621949,Double流星
7123938131472827136,我觉得 说的有道理 [捂脸],0,0,0,2022-07-24 21:59:20,来自北京,1341036412541844,66心静自然凉66
7123933394437735207,对俺来说，平了就是赢啦！,0,3,0,2022-07-24 21:41:05,来自河南,997959898235325,润生有话
7123935018732634913,俗话说出门不捡就算丢,0,0,0,2022-07-24 21:47:46,来自江苏,7020463997,道里大呲花道外15甩
7123941894014485282,德国 :呵呵,0,0,0,2022-07-24 22:13:40,来自天津,2115101477842020,福彘
7123968227751035678,欢迎评论,0,0,0,2022-07-24 23:57:25,来自新疆,53417769349,悬在空中的红鹰
7123944019473728259,厉害！,1,0,0,2022-07-24 22:22:28,来自山东,2111488874527070,阳光部落格
7123942961385095971,其实也是,0,0,0,2022-07-24 22:17:54,来自四川,94131656849,卡宾187
7123954791885194021,哈哈哈,0,0,0,2022-07-24 23:04:23,来自广东,110747231568,率真荷叶ql
7123938718834705188,中国再怎么鱼腩，打日本从来都挺拼的，但是一遇到韩国就彻底报废，现在中国队真的太烂了，以前好歹还被称为热身赛之王,1,0,0,2022-07-24 22:01:52,来自辽宁,66437422204,还我至尊
7123960172686803719,国足真有意思，老年队打不过派个青年队搅屎棍输了也没事，把韩国和日本打急眼了哈哈,0,1,0,2022-07-24 23:25:51,来自浙江,1983114766728347,奸酸刻薄
7123965616012362530,0-0，也叫顽强，中国就是这样害了国家队，[呲牙],0,0,0,2022-07-24 23:46:23,来自浙江,1239849432516155,利方塑料
7123947753895510784,国家队球员基本功太差！,0,0,0,2022-07-24 22:36:44,来自四川,681318430804076,云端漫步006
7123961757240050464,日本媒体不会感觉自己是世界一流吧？[尬笑],0,0,0,2022-07-24 23:32:13,来自福建,360231630288787,石络索
7123957796047553313,说的好，中国球员就是没有这种精神，,0,0,0,2022-07-24 23:17:04,来自四川,6346371502,飘哥的车
7123942690894644003,日本队如果再有一两个好的射手，真是可以和世界一流強队PK下了。,0,0,0,2022-07-24 22:16:50,来自江西,3988640832431468,fox416
7123968521884959502,所谓的报道太假…,0,0,0,2022-07-24 23:58:45,来自广东,7410091508,2Eleven
7123960047805891343,日本队还想在世界杯上打进淘汰赛？拭目以待。,0,0,0,2022-07-24 23:24:48,来自山西,101386375809,用户8808635375509
7123959875679552293,这个日本教练是不行，连中国队都赢不了,0,0,0,2022-07-24 23:24:31,来自江苏,54842726557,用户5958422413019
7123951201992999714,越南缅甸等国教练盛赞中国男足近几年发展迅猛，已对他们形成威胁。,0,0,0,2022-07-24 22:50:02,来自江苏,1996366077508750,用户5107648921703
7123949937796055844,国足要是能有这场比赛的这种拼劲，也不至于长期沦落，比赛不是不能输是不能输斗志,0,1,0,2022-07-24 22:45:20,来自广东,72632595117,用户9906606523761
7123957652109181711,正常，青年队不一样的，他们没有肚腩，成年那些海鲜吃多了球场上只是享受比赛出不了力,0,1,0,2022-07-24 23:15:32,来自广西,105096327485,用户6613918049599
7123955596960842536,还是水平高的教练团队好一些,0,0,0,2022-07-24 23:07:14,来自广东,2379784787066928,用户4861549120214
7123946881432273698,那是日本三队而已，中国是二队,0,0,0,2022-07-24 22:33:12,来自北京,111148745000,用户8436664811552
7123939500183257863,唉，伤害性不大，侮辱性极强,0,0,0,2022-07-24 22:04:59,来自河南,52238462208,手机用户52238462208
7123954339035235104,行，教练没有私心腐败肯定行[呲牙],0,0,0,2022-07-24 23:03:26,来自河北,3377291305958032,用户1382317521748
7123948651277435682,这个杨科维奇比泽连司基，利害…………,0,0,0,2022-07-24 22:40:06,来自天津,110865727437,用户497209486493
7123953266979324685,日本主力没上。当然中国主力也没上。可以理解为中国二队打平了日本三队,1,0,0,2022-07-24 22:58:48,来自江西,60587637740,小都督3
7123950350406681347,这就是差别，中国队能踢平在国内好比要打鸡血，在日本那是耻辱,0,0,0,2022-07-24 22:47:27,来自山东,5999607296,中正厚泽
7123942718119969544,日媒批得很对，连中国队都打不赢还谈啥世界杯复赛,0,0,0,2022-07-24 22:17:27,来自广西,98642131253,聊个求啊
7123946478430683918,日本还是深藏不露，中国男足还是一贯的差。,0,0,0,2022-07-24 22:31:47,来自北京,94938580389,chenhai1973
7123952726370960167,日本韩国输球可比中国输球承受的压力大得多！,0,0,0,2022-07-24 22:56:48,来自河南,1468588165959303,用户4019867955950
7123955789794411268,森保一不滚，日本小组出现不了,0,0,0,2022-07-24 23:09:02,来自上海,6656394821,正义联盟将继续
7123961173594620672,没想到日本也有喷子。[捂脸],0,0,0,2022-07-24 23:29:12,来自山东,3731490943,海岛海角
7123950165245461255,日本队肯定买体彩了[捂脸],0,0,0,2022-07-24 22:46:40,来自河南,70390990192,后知后觉222873401
7123940296769045279,你不能蠃，蠃了中国队，中国队照样吃海参,0,0,0,2022-07-24 22:07:45,来自安徽,52443452500,手机用户52443452500
7123941124230038284,94年前中国踢日本跟玩一样，就是94年市场化后就踢不过日本了,0,0,0,2022-07-24 22:11:26,来自四川,1640923473392795,小小晓晓
7123952375450190599,搞得好像我们能接受一样[抠鼻][抠鼻],0,0,0,2022-07-24 22:55:12,来自广西,10759620195,香附子Hgkui
7123953109537686280,也是，连中国青年队都搞不定还想干嘛？,0,0,0,2022-07-24 22:58:15,来自广东,5521189559,罗汉大哥
7123959864140874537,哇😯,0,0,0,2022-07-24 23:23:48,来自河北,3922387532,可乐爸比喝可可
7123955218631000866,人家日本球迷要说了，你连中国队都搞不赢，脸都不要了！,0,0,0,2022-07-24 23:05:56,来自云南,953997972222156,谈话晓声
7123968250568065800,[鼓掌][鼓掌][鼓掌],0,0,0,2022-07-24 23:57:30,来自新疆,53417769349,悬在空中的红鹰
7123954188958647080,[呲牙],0,0,0,2022-07-24 23:01:49,来自上海,1464173958280411,阿贾克斯AND埃因霍温
