7123824952502928165,应该全世界推广中文！,0,9,0,2022-07-24 14:40:17,来自河南,66220270935,飘浮的人生5
7123836935281361705,祝贺🎉，中国科技越引领未来！,0,1,0,2022-07-24 15:26:30,来自河北,659329331504877,果冻乐读
7123825418456580905,外国网友问：中国每个月都发射一个空间站嘛？[可爱][呲牙],0,2,0,2022-07-24 14:41:53,来自上海,4375655111470532,友爱光束ts
7123819876938416903,中国航天事业越来越好，祝祖国繁荣昌盛,0,6,0,2022-07-24 14:20:51,来自四川,57762790000,优美饼干vU
7123825535788761860,问天升空进入軌道时为何不見太阳帆板展开？,1,2,0,2022-07-24 14:43:28,来自浙江,4406441207143277,聪颖梦想家hO
7122001934516601634,科普一下：火箭的末级都有钝化和离轨操作，钝化包括高压气瓶放气、贮箱推进剂排放等，离是脱离把火箭推向地球，进入大气层后绝大部分烧掉，长五的末级也一样。,1,9,1,2022-07-19 16:45:49,来自陕西,87622651799,小处平平
7123814195388990245,问天，就是问问天下，谁还不服？[赞],0,8,0,2022-07-24 13:58:45,来自天津,97112199772,唐天山道治所
7123827218270503712,祝贺我的祖国，航天科技工作者辛苦啦！,0,2,0,2022-07-24 14:49:55,来自黑龙江,100714073208,敏锐钢笔zR
7123803841509753608,预祝发射成功，大国重器,0,15,0,2022-07-24 13:18:23,来自河北,70845781514519,乐天派芒果8M1
7122623653748998953,九天揽月，逐梦星空，为航天员点赞，为中国航天事业点赞[赞][赞][赞],0,19,0,2022-07-21 08:58:05,来自天津,108844068015,往事如昨88
7121540269597868815,问天是对接空间站的吗,1,7,0,2022-07-18 10:54:23,来自广东,3131837978781261,三百无尾熊
7121989438112154379,中国航天不用回应西方无脑的问题。,1,120,3,2022-07-19 15:58:05,来自浙江,59184693855,灿烂海燕GC
7123839600187278083,一切顺利！大吉大利！,0,1,0,2022-07-24 15:37:44,来自河南,1266254595754061,奥迪舅妈说科技
7123828872663008003,九天揽月，追梦星空!古人问天，充满了对历史兴亡的慨叹和对宇宙规律的思考。而今人问天，彰显了探索浩瀚宇宙，建设航天强国的攀登精神。点赞中国航天人!,0,2,0,2022-07-24 14:55:58,来自江苏,6661309839,志在永胜
7123825837489046283,为航天人点赞[赞][赞][赞],0,1,0,2022-07-24 14:44:33,来自黑龙江,6039818587,热心枫叶Iq
7123846054357205795,这就是航天强国的标志！,0,0,0,2022-07-24 16:02:03,来自天津,50043271787,郡上闲人
7123832496894706435,伟大的祖国，太空舱空间要保密啊不可泄露！[赞][赞][赞][心][心][呲牙][心][玫瑰],0,1,0,2022-07-24 15:10:20,来自湖南,3518027737081774,博学南宫9f9金异彩
7122626024076165899,中国制造千变万化，大国重器永创世界高峰，为国争光中华儿女奋力拼搏永向前！,0,11,0,2022-07-21 09:08:33,来自江苏,1530967648908595,大兵
7123825357563855646,为祖国骄傲！[赞]中国航天真牛！🐮,0,1,0,2022-07-24 14:41:59,来自江苏,98702309456,充满元气的达雅
7123838574956593920,为我国的航天航空事业又迈上了新的台阶而感到骄傲，自豪。,0,1,0,2022-07-24 15:33:01,来自四川,6431736093,四川成都人海沉浮
7122624127072404256,现代科技与神话传说遥相辉映，构成了一种独特的中国式浪漫。,0,12,0,2022-07-21 09:01:01,来自广东,84785852501,一路生花9527
7121986806941762338,先搞电磁弹射的航天飞机，建造大型空间站，再整轨道电梯，外层空间货运不返回地球就简单多了，建造小行星带采矿穿梭机，在火星建造综合性空间站，开发火星。,1,12,3,2022-07-19 15:47:19,来自四川,62111951826,音爆3
7123827146237903648,为祖国点赞[赞][赞],0,2,0,2022-07-24 14:49:51,来自陕西,96698134762,爱生活的香瓜00
7123822471048086308,祝福祖国繁荣昌盛，预祝发射圆满成功![祈祷][祈祷][祈祷][送自己一朵花][送自己一朵花][送自己一朵花],0,4,0,2022-07-24 14:30:49,来自黑龙江,104368636132,我若精彩天自安排31
7123771088886645538,如果发射失败有备用方案吗？,4,6,3,2022-07-24 11:11:05,来自重庆,857237407408148,重庆邓浩
7123826931527320357,祝贺中国航天一飞冲天！[赞][赞][赞],0,1,0,2022-07-24 14:48:21,来自湖北,91564673354,暖男陈开义
7121544992673710884,在北京的湖北網友，預㊗問天實驗艙發射取得圓滿成功。,6,5,0,2022-07-18 11:13:11,来自北京,4113433723,枕著你的名字入眠
7123830612368507683,热烈祝贺我国长征五号遥测B火箭搭载的问天实验舱发射圆满成功！,0,2,0,2022-07-24 15:02:08,来自辽宁,26116672386,春雷从何处想起
7123805267673826048,祝发射成功，祖国万年繁荣昌盛！,0,13,0,2022-07-24 13:23:36,来自江苏,3148654811027839,南佳木2021
7123836932622877453,我骄傲，我自豪，我强大的祖国为。,0,1,0,2022-07-24 15:27:21,来自陕西,111242564998,素心科技
7123846651135001359,中国的空间站，当然用中文了[灵光一闪][灵光一闪][灵光一闪][玫瑰][玫瑰][玫瑰],0,0,0,2022-07-24 16:04:12,来自河北,4478955769,云河L
7123827783356678912,热烈祝贺中国空间站问天舱发射任务取得圆满成功！祝伟大的祖国繁荣昌盛，国泰民安。全体中国航空航天科技人员辛苦了！向全体航空航天科技人员致敬！,0,2,0,2022-07-24 14:51:09,来自青海,86341908374,悠闲A梦
7121562166544745250,这个资金不是一般国家能承受的起的。,2,6,0,2022-07-18 12:19:15,来自天津,52493040419,快乐圆月aj
7122629274037044002,现代科技与神话传说遥相辉映，构成了一种独特的中国式浪漫[心][心][心][心][心],0,16,0,2022-07-21 09:20:21,来自陕西,3975447906367656,沉静wl
7122627428321051426,天尊不可问，故曰天问也！,0,11,0,2022-07-21 09:13:19,来自四川,100857907156,weilongsong
7123840366306378529,为祖国的航天业点赞[赞][赞][赞],0,1,0,2022-07-24 15:40:57,来自江苏,30407782828268,热心小鱼7n
7123801877644968704,致敬为中国航天作出贡献的人们！[玫瑰][玫瑰][玫瑰],0,2,0,2022-07-24 13:10:35,来自广西,50703214268,在水一芳800
7123838854884999971,下一步就是月球常驻，中国航天必将引领世界。,1,2,0,2022-07-24 15:34:11,来自吉林,2708836370874559,聪颖连山易
7123802656430670603,好久发射？,5,19,3,2022-07-24 13:14:20,来自四川,100308302669,老柏纪实
7123836726992814883,感恩航天所有科学家们为你们[赞][赞][赞][赞][赞][赞][赞][赞]为祖国的航天事业蒸蒸日上[赞][赞][赞][赞][赞][赞],0,1,0,2022-07-24 15:25:56,来自甘肃,2440521003832155,幽默湖泊Uq
7122628115335070471,现代科技与神话传说遥相辉映，构成了一种独特的中国式浪漫,0,10,0,2022-07-21 09:16:13,来自北京,109550164184,看窗外雪花飞
7123826691151659776,祝贺问天实验舱发射圆满成功！,0,2,0,2022-07-24 14:46:59,来自广东,70979961427,郁郁聪聪8
7123825841117250336,祝贺祖国，感恩生活在这个时代！,0,2,0,2022-07-24 14:44:39,来自四川,94898903313,雅烧堂主林萍
7123830700239192871,点赞我伟大的祖国！[赞][赞][赞],0,1,0,2022-07-24 15:03:29,来自黑龙江,55979297488,和风细语30
7123826097833313062,恭贺我们伟大的祖国，在科技领域又迈出了坚实的一步！,0,1,0,2022-07-24 14:45:18,来自辽宁,105476217471,喝一杯热可可
7123817588609680160,从神舟五号到神十四号，中国的航天人默默无闻的奉献造就了一个个辉煌，一步步铸就航天大国，问天实验舱又是一个中国的航天人伟大壮举。,0,1,0,2022-07-24 14:12:19,来自海南,111382884281,6789yohoo
7123847555666068224,为伟大的祖国点赞！致敬中国航天！致敬中国航天人！不负时代伟大使命，逐梦太空，场面震撼、惊叹！满满的自豪感！,0,1,0,2022-07-24 16:07:48,来自甘肃,1922417901442172,祥瑞好物分享
7123827727756722952,"祝贺问天试验舱发射成功！
祝愿我们的祖国更加强大！",0,2,0,2022-07-24 14:51:14,来自四川,5408672965,棋在局外ABC
7123833303241229097,运载火箭何时返回大气层？落点在哪里？,0,2,0,2022-07-24 15:12:43,来自江苏,50956311544,嘉庆192163642
7123831443855328032,"太空舱如人们居住的房子一样！
高科技中国！[赞][赞][赞][心][心][赞][呲牙][呲牙]",0,1,0,2022-07-24 15:06:03,来自湖南,3518027737081774,博学南宫9f9金异彩
7121983692776162088,有一点必须要说清楚的，运载火箭完成任务后返回地球，不是没有控制，而是进入大气层前都需要调整角度，落点必须是安全地带。,1,16,2,2022-07-19 15:35:14,来自江苏,107749239453,千里草影像
7123802123678663456,下午两点，期待精彩，棒棒哒,0,3,0,2022-07-24 13:12:15,来自湖北,108840268684,堂吉诃德和他的驴
7123831910291866401,强大的祖国培养了有赤子心的团队，赤子的队伍凭团队的精神，为航天事业写下了不惧一切艰苦的诗篇，为强大的祖国点赞，为拼博的科技者骄傲！,0,1,0,2022-07-24 15:08:10,来自上海,1191507353418739,自若梦想t
7123824790368092928,我们又成功了！[比心][鼓掌],0,2,0,2022-07-24 14:39:29,来自广东,3262948483530820,自由的远山aP
7123842497822229281,热烈庆祝问天舱发射圆满成功！为伟大的祖国点赞！！！[小鼓掌][赞][鼓掌][玫瑰],0,2,0,2022-07-24 15:48:46,来自广东,2946300903162159,真诚柑桔pG
7123827245009421096,热烈祝贺我国空间站问天实验舱发射成功！我们要再接再厉创造更多奇迹，甩开美国，勇攀世界最高峰，一览纵山小……。,0,3,0,2022-07-24 14:49:06,来自上海,4042613722,七佛灭罪真言
7123825923912270604,"热烈祝贺问天实验舱发射圆满成功！[鼓掌][鼓掌][鼓掌]
祝伟大祖国蒸蒸日上！繁荣昌盛！[祈祷][祈祷][祈祷]
科学家们辛苦了[玫瑰][玫瑰][玫瑰]",0,1,0,2022-07-24 14:44:37,来自天津,1156296814897108,中华之子大成
7123830611177030441,祝贺中国航天！！！,0,2,0,2022-07-24 15:02:08,来自山西,10859495499,高山流水le
7121530899577324321,快了，也就这一两天。,11,27,0,2022-07-18 10:17:34,来自江苏,79359957235,Soap271
7123836798488855327,太厉害了，值得庆祝[赞][赞],0,1,0,2022-07-24 15:26:40,来自安徽,2199471937820423,雨
7123836709686575905,这是中国空间站，又不是国际空间站，凭什么考虑其他人的需要,0,3,0,2022-07-24 15:26:28,来自北京,2655338638,金子毅
7123822490463617827,为祖国点赞[赞][赞][赞][赞][赞][赞][赞][赞],0,38,0,2022-07-24 14:30:38,来自黑龙江,470220193668775,多彩星空UT
7122628451487826725,梦天问，天天舟，天河，中国空间站有每个名字都是从5000年的历史长河中得来的。为我们伟大的航天科技点赞，中国加油！[赞][赞][赞][微笑][微笑][微笑],0,12,0,2022-07-21 09:17:39,来自广东,2110655964920248,鸿哥gold
7123846736732652301,"为国家的强大点赞，为中国航天加油，
祝发射圆满成功，中国空间站加油。#我要上 头条# #中国空间站核心舱“天和”发射成功# #热点# @头条热榜",0,0,0,2022-07-24 16:05:04,来自河南,4124974024237376,怀旧自媒体
7123827198012408617,祝贺发射圆满成功[玫瑰][玫瑰][玫瑰],0,2,0,2022-07-24 14:48:59,来自浙江,571359646453245,风趣的杭州倪哥
7123821384287552294,致敬中国航天力量！,0,2,0,2022-07-24 14:27:21,来自江苏,980376712912519,tlda
7123780150386639650,预祝发射成功，航天工作者辛苦了[祈祷][祈祷],1,60,2,2022-07-24 11:46:12,来自浙江,2893530728506827,韵达君
7123822328437654272,祝福问天发射成功[祈祷],0,3,0,2022-07-24 14:29:58,来自山西,106799149524,沧海之水3u0i
7123801632022184717,为国自豪[赞]预祝发射成功,0,2,0,2022-07-24 13:10:01,来自湖北,51123954733,时髦星星or
7123826726194610959,祝贺发射圆满成功。,0,4,0,2022-07-24 14:46:59,来自湖南,104758285697,平凡人生只是看戏
7123829462860710696,问天舱发射圆满成功，是全球大事件，可喜可贺，只有咱们自己见怪不怪，反应平平淡淡[呲牙],0,2,0,2022-07-24 14:57:44,来自河南,110446756991,清风传播正能量
7123816799531008808,预祝:我国空间站发射成功！,0,2,0,2022-07-24 14:08:22,来自湖北,55233621481,蓝天白云8mQE
7123834071927145227,用中文体现文化自信，中文也可以是国际通用语音，我们现在就是打基础做准备，美国人提意见，不予采纳。,0,2,0,2022-07-24 15:16:35,来自陕西,4160964539983268,不胜酒力
7123846059638096652,"今天进到现场去看的，震撼！！！
 好震撼哦，今天天气太好的不要不要的，平时能看几十秒，这次我们看了将近5分钟。",0,0,0,2022-07-24 16:02:54,来自海南,5410451768,踏雪随缘4
7123825767280378658,祝贺伟大的祖国！中国万岁！,0,2,0,2022-07-24 14:43:21,来自河北,3272595390859415,乐天派柳叶Qg
7123827257353437992,祝贺发射圆满成功[撒花][撒花][撒花],0,3,0,2022-07-24 14:49:15,来自甘肃,66918309347,林中的风11
7123828077385515816,长征五号B遥三运载火箭搭载中国空间站问天实验舱，在海南文昌航天发射场发射升空取得成功！,0,1,0,2022-07-24 14:52:08,来自江苏,83422208767,三少爷的剑6888
7123836712664957732,祝贺问天舱发射圆满成功！为伟大祖国点赞，为中国航天点赞！向中国航天人致敬！,0,1,0,2022-07-24 15:26:01,来自辽宁,2858370171147896,正直老彬子
7123826523278377735,"祝贺问天舱发射圆满成功！
预祝所有中国航天项目顺利完成！",0,1,0,2022-07-24 14:46:35,来自四川,50410767744,真不会玩哈
7123826579604259592,祝贺问天实验舱发射圆满成功,0,2,0,2022-07-24 14:46:59,,3189045155081800,多才多艺梦想Uf
7123826120046560015,问天实验仓段发射成功标志着，中国空间站工程的圆满成功。祝伟大祖国繁荣昌盛，国泰民安！,0,1,0,2022-07-24 14:44:46,来自辽宁,3183786268310416,大契丹王朝
7123848319893586723,山东沂源人民，热烈祝贺空间站问天实验舱发射任务圆满成功！[烟花][烟花][烟花],0,0,0,2022-07-24 16:10:51,来自山东,51339388077,欢乐搜寻
7123829739857134369,热烈祝贺中国空间站问天实验舱发射任务圆满成功！,0,1,0,2022-07-24 14:59:50,来自江苏,435033670420072,乐观的山丘kU
7123831857955095308,热烈庆祝问天舱发射成功，祝贺中国航天科技！祝贺伟大的祖国繁荣昌盛，科技越来越发达！,0,0,0,2022-07-24 15:07:45,来自山东,4006214905370045,遇速则不达
7123826729256305419,祝贺发射圆满成功[撒花][撒花][撒花],0,8,0,2022-07-24 14:47:30,来自安徽,12118337340,衣画谢华华
7123828245174469391,祝贺发射圆满成功[撒花][撒花][撒花],0,2,0,2022-07-24 14:52:52,来自江西,6370300015,格拉多吉
7123827152323248911,祝贺我们的胖五顺利发射成功！为中国航天喝彩点赞，为祖国骄傲！[赞][赞][赞][玫瑰][玫瑰][玫瑰],0,1,0,2022-07-24 14:48:34,来自北京,65642807322,三月雪72
7123845506539094819,问天下谁主沉浮，唯有中国航天事业,0,2,0,2022-07-24 15:59:59,来自内蒙古,95675912162,格尔图青年
7123848348314321699,每次看到航天发射，心情格外激动，感恩自己生活在一个伟大的时代！,0,1,0,2022-07-24 16:10:54,来自四川,55140107789,HC147435448观察员
7123836100707779341,我特别的自豪，骄傲，幸福。,0,2,0,2022-07-24 15:23:55,来自山东,4283294728338812,科技小昂
7123801892681483020,预祝发射圆满成功！！！[玫瑰][玫瑰][玫瑰],1,15,1,2022-07-24 13:11:27,来自福建,72466088051,行悟浪人
7123828279475372831,大家热烈祝贺问天实验舱搭乘长征五号B火箭发射成功🎉🎉🎉,0,3,0,2022-07-24 14:53:23,来自江苏,3218972531758040,鲨鱼骑行
7122629702787482402,"致敬航天人！点赞航天事业
天和·天舟·问天·梦天
中国空间站母港带你领略浪漫航天[赞][赞][赞][赞][赞][赞][赞]",0,11,0,2022-07-21 09:22:06,来自福建,61493666380,红丹615
7123826971821884195,热烈祝贺我国问天舱发射成功，,0,1,0,2022-07-24 14:48:06,来自江苏,106263552499,国家安稳重泰山
7123831699121111808,山西人民祝贺问天实验舱发射成功[烟花][烟花][烟花][烟花],0,2,0,2022-07-24 15:06:26,来自山西,3105497526056839,雄狮196
7123831203030893353,祝福问天舱发射圆满成功，祖国更加强盛，人民平安幸福！[玫瑰][玫瑰][玫瑰][祈祷][祈祷][祈祷]尚雅芳原创诗词对联！@中国新闻网,0,1,0,2022-07-24 15:04:20,来自云南,1939989989965628,尚雅芳尚雅芳
7121977134314357516,希望以后把货运飞船改造成返回式，月球上采矿，送到航天站交给货运飞船，返回地面回收。,7,15,2,2022-07-19 15:10:36,来自上海,2656840876827032,world wide
7123818251540513551,2：13分看到新闻，期待5B发射成功！,0,3,0,2022-07-24 14:14:11,来自湖南,2850081859,美丽从心而始
7123825025349731107,祝贺问天实验舱发射成功！,0,2,0,2022-07-24 14:40:20,来自上海,67725631456,双屏手写
7123796785570808576,为祖国的航天事业点赞[赞][赞][赞],1,15,1,2022-07-24 12:50:46,来自贵州,13199442861,1453198
7123835227713438464,单个国家，中国人口最多，空间站是中国自主建造，自己地盘自己做主，不奇怪。,0,2,0,2022-07-24 15:20:02,来自广东,12837820841027,率真麻酱pc
7123835506886345512,中文也是联合国五种文字之一，欢迎你们努力学习中文,0,4,0,2022-07-24 15:21:12,来自北京,58646650004,临江赏风
7123825239699882759,再问苍穹，逐梦太空，为祖国骄傲自豪，为祖国航天航空事业的蓬勃发展点赞[赞][赞][赞],0,2,0,2022-07-24 14:41:32,来自河南,66220270935,飘浮的人生5
7123827511892624141,热烈祝贺问天实验舱发射成功[撒花][撒花][撒花],0,2,0,2022-07-24 14:50:37,来自陕西,6716138346,品味999s
7122004429175718660,中国航天发射坚定不移，准备充分，检测细緻，祝贺成功！,0,6,0,2022-07-19 16:56:31,来自湖北,3777566025714317,雨辰0018
7123809820390163234,祝祖国繁荣富强，问天逐梦[赞][赞][赞],0,6,0,2022-07-24 13:41:29,来自福建,68359834748,MrsWu
7123847965202203400,这才说明这是中国空间站，想来用，想来学，先学中文吧[呲牙],0,0,0,2022-07-24 16:09:51,来自浙江,9566733902,当年瘦猴
7123830426824606464,祝贺问天舱发射圆满成功,0,1,0,2022-07-24 15:01:19,来自辽宁,87627647522,勇敢的风声5i
7123767352688329487,祝贺发射成功,0,1,0,2022-07-24 10:56:32,来自贵州,11683141327,许晨685
7123838432690291488,祖国的强大是每一个中国人的福分，祝问天仓发射成功，为科学家点赞！[赞][赞][赞][加油],0,1,0,2022-07-24 15:33:21,来自江苏,62225471130,135565315531551
7123827881599976231,热烈祝贺，问天发射成功。,0,2,0,2022-07-24 14:52:40,来自广西,23293667778,华夏V星辰大海
7123826594502427404,热烈祝贺问天实验舱发射成功[鼓掌][鼓掌][鼓掌],0,2,0,2022-07-24 14:47:35,来自广东,5259757032,佬莫
7123827329126171425,致敬千千万万航天英雄,0,2,0,2022-07-24 14:50:13,来自江苏,97869694291,振兴中华w7n
7123792458009363235,预祝发射成功；我们的征途是星辰大海,0,21,0,2022-07-24 12:33:50,来自上海,59871990919,夜里的春雷
7123809858574680846,"长征太空，
问天升空。
遨游太空，
发射成功。",0,4,1,2022-07-24 13:41:38,来自广东,96653861437,快乐的香瓜Yn6
7123844064067945253,热烈祝贺“天问一号”发射圆满成功，向航天人致敬，为祖国点赞！为中国人自豪！,0,0,0,2022-07-24 15:54:38,来自四川,56827622199832,舞动阿利森5P
7123830403143959311,为强大的祖国点赞。,0,3,0,2022-07-24 15:01:20,来自广西,3298169995401246,热情的晚老师
7121597706925310720,期待“问天试验舱”早日成功对接“天和”,0,3,0,2022-07-18 14:37:21,来自广东,4727186270,谁向江南处处栽
7123847345607426819,遨游太空，我们一直在努力!祝贺我们的祖国越来越强大!,0,1,0,2022-07-24 16:08:06,来自福建,704138663432467,五谷杂粮最健康
7123831827236356899,感恩伟大的祖国！感谢辛勤的航天人！[中国赞][作揖][作揖][作揖],0,1,0,2022-07-24 15:06:56,来自陕西,2418519657167678,李玲摄影
7123846859331945250,祝贺：问天实验舱发射圆满成功！祝愿伟大祖国繁荣昌盛！,0,0,0,2022-07-24 16:05:02,来自河南,50014308221,大师兄-99
7123840460846072611,祝贺问天发射成功！也提示一下记者们，不能啥问题都问，需要重视保密工作…,0,0,0,2022-07-24 15:40:24,来自新疆,3865489623235694,自由沉淀的风
7123802987344364288,新疆人民预祝发射成功[祈祷],0,7,0,2022-07-24 13:14:55,来自新疆,4503829707,这里醉逍遥
7123789768596570892,定发射成功[比心][比心][比心],0,52,1,2022-07-24 12:24:12,来自江西,4195334022506157,热闹扑克MW
7123828226954658601,中国航天给力！问天舱发射让中国人倍感自豪！,0,3,0,2022-07-24 14:52:56,来自湖北,75985496870,仙鹤CYS
7123829391901442851,祝贺成功发射！,0,2,0,2022-07-24 14:57:25,来自江西,13466183691,德行动1258669
7123825174759523113,祝贺神十四发射成功[给力]祝福祖国航天事业[烟花]祝福祖国[爆竹],0,1,0,2022-07-24 14:41:06,来自北京,1538960033580615,不二观之
7123831861721268996,我们的航天员又不懂英语，难不成我们要做英语按键为难我们自己？[哈欠],0,3,0,2022-07-24 15:07:36,来自福建,111224541244,弓之月神
7123816522732094247,天和，天舟，问天，梦天……中国航天为梦想一次次或即将腾空飞向太空。预祝成功,0,1,0,2022-07-24 14:08:03,来自广西,3386972384014436,涛声潮
7123827417801671458,逐梦太空，为国家点赞👍,0,1,0,2022-07-24 14:49:44,来自甘肃,5808496169,西北马铃薯
7123827317965161230,祝贺问天成功，为我中华喝彩！,0,3,0,2022-07-24 14:49:53,来自福建,2507359320281325,长虹飞天
7122626599299629857,"现代科技与神话传说遥相辉映，构成了一种独特的中国式浪漫，
领略浪漫航天[赞][赞][赞][玫瑰][玫瑰][玫瑰]",0,10,0,2022-07-21 09:10:32,来自河北,2911094870392135,流金岁月一抹痕
7123822985370534689,我们有我们的标志，要来请学好中文以及汉语。,0,3,0,2022-07-24 14:33:23,来自甘肃,3034273575089694,美美的西北丫
7123825868748686112,学习中文，你才能更好了解世界潮流,0,2,0,2022-07-24 14:44:19,来自广东,62143942420,武顿山下
7123837294817198882,热烈祝贺问天发射圆满成功！,0,0,0,2022-07-24 15:28:03,来自安徽,1750882968149872,爱生活的香瓜bw
7123825337254937385,祝贺发射成功！祖国万岁！,0,2,0,2022-07-24 14:41:35,来自广西,4248109503222871,走阅天涯
7123796754549916456,预祝发射圆满成功[祈祷][祈祷][祈祷],0,5,0,2022-07-24 12:50:37,来自天津,6457947088,o本草纲目o
7123804129281065766,满心期待！预祝发射圆满成功！[祈祷],0,4,0,2022-07-24 13:19:55,来自河北,4237084297,有钱没钱都要过年
7123816109429818115,预祝发射成功，中国万岁！中国人民万岁！,0,4,0,2022-07-24 14:06:33,来自河北,111211067659,热闹豆花HI
7123806648044847886,祝长征5B 我们的航天舱 圆满发射成功！ 致敬我们伟大的科学家[赞][赞][赞][赞][赞],0,2,0,2022-07-24 13:29:21,来自江苏,109654377237,端庄清风Tm
7123808122703414023,"祝福中国航天！
徐州人民来电：预祝发射成功！",0,3,0,2022-07-24 13:35:06,来自江苏,50698536223,醉卧万花坳
7123813396059439902,预祝发射圆满成功！,0,4,0,2022-07-24 13:55:47,来自上海,65121280335,封狼居胥刘01
7123804276107084581,预祝发射圆满成功！为航天科技人点赞！[赞][玫瑰],0,3,0,2022-07-24 13:20:11,来自上海,81707719782,乐乐97392
7123829252243571495,热烈庆祝问天实验舱成功大气的。祝愿伟大祖国繁荣昌盛，祝愿伟大祖国再不受美帝讹诈和欺凌。,0,1,0,2022-07-24 14:57:27,来自河北,3786371106872750,九天升明月
7123824520242873118,再问苍穹，逐梦太空，为祖国骄傲自豪，为祖国航天航空事业的蓬勃发展点赞[赞][赞][赞],0,1,0,2022-07-24 14:39:03,来自河南,66220270935,飘浮的人生5
7123809172583727906,预祝发射成功！[祈祷][祈祷][祈祷],0,4,0,2022-07-24 13:38:52,来自陕西,6759330986,三少爷乐乐
7123835050298196748,问天舱发射圆满成功[赞][赞][赞][赞][赞],0,1,0,2022-07-24 15:19:53,来自广东,1218677149533502,闭眼听雨A
7123825105369285410,祝贺🎉成功发射,0,2,0,2022-07-24 14:40:50,来自陕西,51945185822,泡泡糖糕
7123827845776425762,问天发射成功，致敬所有英雄，祖国富强伟大，东风压倒西风。,0,1,0,2022-07-24 14:51:24,来自广东,61496702079,龙驭乾坤
7123802069429076773,期待发射成功！壮我国威，军威！全国人民共享荣光！加油！中国航天人！,0,5,0,2022-07-24 13:11:37,来自湖北,6626503120,汝胜
7123846431907119887,为中国航天科技点赞！,0,0,0,2022-07-24 16:03:26,来自重庆,84700865096,弯刀5188
7123800677758796544,预祝发射成功！[玫瑰][玫瑰][玫瑰],0,3,0,2022-07-24 13:05:42,来自浙江,107942844537,夜之聻
7122296032024838953,内陆发射场，掉落区会提前通知村民撤离，砸中房子 农作物什么的也是有的，会赔偿,0,1,0,2022-07-20 11:47:02,来自浙江,6444735352,量子餐饮
7123797297347183392,预祝发射成功！祖国繁荣昌盛！[祈祷][祈祷][祈祷],0,6,0,2022-07-24 12:53:30,来自陕西,197555237426216,坦荡的风筝j
