7123811004458582816,祝福祖国繁荣昌盛，越来越强大[赞][赞],1,12,0,2022-07-24 13:46:50,来自上海,2612875172776798,梦幻后知后觉
7122628114463048484,天和、天舟、问天……中国空间站母港带你领略浪漫航天[赞][赞][赞][赞],0,14,0,2022-07-21 09:16:28,来自福建,69888289150,夕顏673
7123808622735655683,非常期待！激动人心[赞][赞][赞],0,9,1,2022-07-24 13:37:17,来自山东,3131008018816364,未来的好物
7123931208102757155,今天是个喜庆的日子，热烈问天实验发射成功,0,0,0,2022-07-24 21:32:18,来自四川,3386108346106734,用户认识世界
7123887945463497504,祝贺航天发射圆满成功,0,1,0,2022-07-24 18:45:26,来自江苏,3588431777629987,唯美的女人
7123840173506298655,恭喜恭喜，中国航天再谱现篇[赞][赞][赞][赞][赞],0,1,0,2022-07-24 15:39:13,来自江苏,100776299148,清爽葡萄A1
7123780856866931492,科技是一个国家的强国之本，点赞助力科技强国[奋斗],0,5,0,2022-07-24 11:49:25,来自天津,106175528302,工程师看海
7123904295820641060,默默地点个赞[赞][赞][赞],0,1,0,2022-07-24 19:48:23,来自北京,4047684333,己所不欲勿多言
7121977646036517668,自从人类有航天发射以来，还不见有人在地面被残骸砸中过[偷笑],6,64,3,2022-07-19 15:12:15,来自广东,6856794518,小葡萄不酸
7123922289502470942,祝贺问天发射成功，祝愿祖国的航天事业蒸蒸日上，再创辉煌。,0,0,0,2022-07-24 20:58:05,来自四川,1434243755700765,水中的鱼w
7123844381245309734,太棒了！恭喜中国航天人！祝福祖国风调雨顺、国泰民安！,0,3,0,2022-07-24 15:56:30,来自北京,1965546790978260,闲坐竹堂听风过
7123835927101244160,祝贺祝贺！祝贺航天事业再创高峰，向航天人致敬。[赞][赞][赞][赞],0,4,0,2022-07-24 15:22:51,来自山东,3122208718987368,认真的松鼠Ro
7123922185374696226,祝贺发射成功，向航天事业的工作人员致敬,0,1,0,2022-07-24 20:57:14,来自四川,111042716144,Qiougao
7123856138646848269,敬畏心有没有不知道，反正有病是真的。,0,7,0,2022-07-24 16:41:20,来自天津,3531229547202404,盈量知归
7123883647107220224,中国航天事业的发展会越来越好,0,2,0,2022-07-24 18:27:57,来自上海,111073939647,大张伟蓝弧侵权奥特曼
7123908029766697759,[烟花][烟花][烟花]为强大的祖国点赞！向中国航天人致敬！你们辛苦了！🙏🙏🙏,0,1,0,2022-07-24 20:03:02,来自江苏,6481384837,18761847212
7123797418033988393,咱也不知道，50个立方米啥概念。应该很大吧。,8,10,1,2022-07-24 12:53:05,来自河南,52164495653,头版新乡
7121975670750200609,咋可能只有4发5B？Y1 新飞船试验，Y2 天和核心舱，Y3问天实验舱，Y4梦天实验舱，Y5巡天光学舱，光这算下来都有5发了,7,21,1,2022-07-19 15:04:58,来自陕西,5767236408,busdc
7123902764367135529,为中国航天 科技人点赞,0,1,0,2022-07-24 19:42:05,来自山西,1742066716517456,清心
7123869396812120867,伟大的祖国，我们伟大的祖国母亲，爱你！也感谢为航空航天事业付出的科学家们点赞，你们辛苦了！,0,1,0,2022-07-24 17:32:36,来自浙江,111224927714,好学荷叶Bu
7123930577669161768,祝贺问天发射成功，,0,0,0,2022-07-24 21:29:48,来自山东,110815386421,ZYR四姑
7123874769044439811,祝贺！祝愿祖国的明天越来越好！,0,2,0,2022-07-24 17:54:01,来自山东,17432279337,顺风行舟2021
7123866065880941344,祝福祖国繁荣昌盛[赞][赞][赞],0,1,0,2022-07-24 17:20:44,来自山东,24583838308,晨光暖暖晨光
7123847350476604171,问天成功，成功问天！,0,2,0,2022-07-24 16:07:38,来自北京,12014166111,KO平凡
7123925989952521000,祝贺为航天事业工作的同志们，祝福祖国！,0,1,0,2022-07-24 21:12:08,来自北京,1279452307270455,阳小阳观影
7123779224217109289,我们的征途是星辰大海。[点亮平安灯][V5][给力],8,171,2,2022-07-24 11:42:36,来自陕西,3137113530,征途独行
7122627541625586473,中国空间站母港带你领略浪漫航天。[赞][赞][赞],0,15,1,2022-07-21 09:13:29,来自湖北,89435166117,安逸生活家3t
7123929082375062310,向辛苦工作的航天人致敬，航天英雄，为伟大的祖国点赞！,0,0,0,2022-07-24 21:24:41,来自福建,2234650777362189,清新百香果2M
7123794929192534817,祝愿祖国越来越强大,1,22,1,2022-07-24 12:43:59,来自浙江,2713031014,和睦相处66666
7123869334656844584,热烈祝贺问天实验舱发射成功，祝祖国繁荣强大。[赞][赞][赞],1,3,0,2022-07-24 17:32:23,来自山东,93010837674,大海72534
7123902684650488580,致敬中国的航天人、航天英雄！,0,2,0,2022-07-24 19:42:34,来自广东,50248812456,天晋4b2d
7122001934516601634,科普一下：火箭的末级都有钝化和离轨操作，钝化包括高压气瓶放气、贮箱推进剂排放等，离是脱离把火箭推向地球，进入大气层后绝大部分烧掉，长五的末级也一样。,1,11,1,2022-07-19 16:45:49,来自陕西,87622651799,小处平平
7122623653748998953,九天揽月，逐梦星空，为航天员点赞，为中国航天事业点赞[赞][赞][赞],0,20,0,2022-07-21 08:58:05,来自天津,108844068015,往事如昨88
7122626024076165899,中国制造千变万化，大国重器永创世界高峰，为国争光中华儿女奋力拼搏永向前！,0,12,0,2022-07-21 09:08:33,来自江苏,1530967648908595,大兵
7123897233669440297,向我国航天科技工作者致敬！！！,0,2,0,2022-07-24 19:20:30,来自广东,67711375537,淡然处之1998
7121540269597868815,问天是对接空间站的吗,1,9,0,2022-07-18 10:54:23,来自广东,3131837978781261,三百无尾熊
7123807658985243406,预祝发射成功！,1,5,0,2022-07-24 13:33:16,来自上海,3465231493,三万路
7123846054357205795,这就是航天强国的标志！,0,2,0,2022-07-24 16:02:03,来自天津,50043271787,郡上闲人
7123826569939845926,热烈祝贺问天实验舱发射成功[鼓掌][鼓掌][鼓掌],0,81,0,2022-07-24 14:47:01,来自广东,5259757032,佬莫
7123803841509753608,预祝发射成功，大国重器,0,16,0,2022-07-24 13:18:23,来自河北,70845781514519,乐天派芒果8M1
7123846651135001359,中国的空间站，当然用中文了[灵光一闪][灵光一闪][灵光一闪][玫瑰][玫瑰][玫瑰],0,2,0,2022-07-24 16:04:12,来自河北,4478955769,云河L
7121989438112154379,中国航天不用回应西方无脑的问题。,1,121,3,2022-07-19 15:58:05,来自浙江,59184693855,灿烂海燕GC
7123832496894706435,伟大的祖国，太空舱空间要保密啊不可泄露！[赞][赞][赞][心][心][呲牙][心][玫瑰],0,3,0,2022-07-24 15:10:20,来自湖南,3518027737081774,博学南宫9f9金异彩
7123882749635035907,发射、入轨、着陆，九天揽月，一气呵成、追赶、并跑、领跑，五十年差距，一载跨越。环宇问天，探月逐梦，五星红旗一次次闪耀太空，中国航天必将行稳至远！,0,2,0,2022-07-24 18:25:18,来自湖南,1500203743717331,墨s染
7123805267673826048,祝发射成功，祖国万年繁荣昌盛！,0,15,0,2022-07-24 13:23:36,来自江苏,3148654811027839,南佳木2021
7122624127072404256,现代科技与神话传说遥相辉映，构成了一种独特的中国式浪漫。,0,13,0,2022-07-21 09:01:01,来自广东,84785852501,一路生花9527
7123819876938416903,中国航天事业越来越好，祝祖国繁荣昌盛,0,9,0,2022-07-24 14:20:51,来自四川,57762790000,优美饼干vU
7121986806941762338,先搞电磁弹射的航天飞机，建造大型空间站，再整轨道电梯，外层空间货运不返回地球就简单多了，建造小行星带采矿穿梭机，在火星建造综合性空间站，开发火星。,1,13,3,2022-07-19 15:47:19,来自四川,62111951826,音爆3
7123771088886645538,如果发射失败有备用方案吗？,5,8,3,2022-07-24 11:11:05,来自重庆,857237407408148,重庆邓浩
7122629274037044002,现代科技与神话传说遥相辉映，构成了一种独特的中国式浪漫[心][心][心][心][心],0,17,0,2022-07-21 09:20:21,来自陕西,3975447906367656,沉静wl
7122628115335070471,现代科技与神话传说遥相辉映，构成了一种独特的中国式浪漫,0,11,0,2022-07-21 09:16:13,来自北京,109550164184,看窗外雪花飞
7123822471048086308,祝福祖国繁荣昌盛，预祝发射圆满成功![祈祷][祈祷][祈祷][送自己一朵花][送自己一朵花][送自己一朵花],0,5,0,2022-07-24 14:30:49,来自黑龙江,104368636132,我若精彩天自安排31
7121544992673710884,在北京的湖北網友，預㊗問天實驗艙發射取得圓滿成功。,6,6,0,2022-07-18 11:13:11,来自北京,4113433723,枕著你的名字入眠
7123906469694653219,为祖国点赞,0,1,0,2022-07-24 19:56:21,来自黑龙江,1539746228087560,灿烂蛋糕8M9
7123861438409622272,说明有些国家的人太失落了。,0,8,0,2022-07-24 17:01:43,来自四川,102270115171,见说道
7122627428321051426,天尊不可问，故曰天问也！,0,12,0,2022-07-21 09:13:19,来自四川,100857907156,weilongsong
7123826726194610959,祝贺发射圆满成功。,0,9,0,2022-07-24 14:46:59,来自湖南,104758285697,平凡人生只是看戏
7123802123678663456,下午两点，期待精彩，棒棒哒,0,4,0,2022-07-24 13:12:15,来自湖北,108840268684,堂吉诃德和他的驴
7121562166544745250,这个资金不是一般国家能承受的起的。,2,7,0,2022-07-18 12:19:15,来自天津,52493040419,快乐圆月aj
7123842497822229281,热烈庆祝问天舱发射圆满成功！为伟大的祖国点赞！！！[小鼓掌][赞][鼓掌][玫瑰],0,4,0,2022-07-24 15:48:46,来自广东,2946300903162159,真诚柑桔pG
7123898655974949673,祝贺问天实验舱发射成功，让我们共同见证问天实验舱将与神舟十四空间站交汇对接的美好时刻。祝我国航天科技再创辉煌！[赞][赞][赞],0,1,0,2022-07-24 19:26:09,来自湖北,67891091024,高兴老乐
7123851121419993868,"锣鼓喧天，鞭炮齐鸣！
祝福祖国繁荣昌盛，国富民强！",0,2,0,2022-07-24 16:22:18,来自几内亚,6475047691,漂泊云在外
7123827257353437992,祝贺发射圆满成功[撒花][撒花][撒花],0,7,0,2022-07-24 14:49:15,来自甘肃,66918309347,林中的风11
7123826729256305419,祝贺发射圆满成功[撒花][撒花][撒花],0,16,0,2022-07-24 14:47:30,来自安徽,12118337340,衣画谢华华
7123849025190757132,赞祝，问天实验舱，发射任务圆满成功。问天腾飞筑梦天宫，祖国振兴航天显神通。向航天科技工作者，致敬！中华繁荣昌盛富强，国泰民安。石人，润发语祝。,0,0,0,2022-07-24 16:14:13,来自贵州,2656056218233996,智者星空wT
7123871471952937764,恭喜恭喜！祖国强大！[比心],0,1,0,2022-07-24 17:41:08,来自贵州,103170287725,随意668899
7123830403143959311,为强大的祖国点赞。,0,7,0,2022-07-24 15:01:20,来自广西,3298169995401246,热情的晚老师
7123873325101105950,祖国的明天更美好,0,5,0,2022-07-24 17:48:27,来自山东,102876446707,伟伟的猪猪朵朵
7123827198012408617,祝贺发射圆满成功[玫瑰][玫瑰][玫瑰],0,6,0,2022-07-24 14:48:59,来自浙江,571359646453245,风趣的杭州倪哥
7123933079126704936,祝贺问天实验舱发射成功，致敬每一个航天人，伟大祖国我爱你！,0,1,0,2022-07-24 21:39:26,来自江苏,1443030343095263,ylpyllove
7123828245174469391,祝贺发射圆满成功[撒花][撒花][撒花],0,6,0,2022-07-24 14:52:52,来自江西,6370300015,格拉多吉
7123814195388990245,问天，就是问问天下，谁还不服？[赞],0,9,1,2022-07-24 13:58:45,来自天津,97112199772,唐天山道治所
7123802656430670603,好久发射？,5,23,4,2022-07-24 13:14:20,来自四川,100308302669,老柏纪实
7123845506539094819,问天下谁主沉浮，唯有中国航天事业,0,2,0,2022-07-24 15:59:59,来自内蒙古,95675912162,格尔图青年
7123827245009421096,热烈祝贺我国空间站问天实验舱发射成功！我们要再接再厉创造更多奇迹，甩开美国，勇攀世界最高峰，一览纵山小……。,0,4,0,2022-07-24 14:49:06,来自上海,4042613722,七佛灭罪真言
7121530899577324321,快了，也就这一两天。,11,28,0,2022-07-18 10:17:34,来自江苏,79359957235,Soap271
7121983692776162088,有一点必须要说清楚的，运载火箭完成任务后返回地球，不是没有控制，而是进入大气层前都需要调整角度，落点必须是安全地带。,1,17,2,2022-07-19 15:35:14,来自江苏,107749239453,千里草影像
7123831443855328032,"太空舱如人们居住的房子一样！
高科技中国！[赞][赞][赞][心][心][赞][呲牙][呲牙]",0,3,0,2022-07-24 15:06:03,来自湖南,3518027737081774,博学南宫9f9金异彩
7123834071927145227,用中文体现文化自信，中文也可以是国际通用语音，我们现在就是打基础做准备，美国人提意见，不予采纳。,0,4,0,2022-07-24 15:16:35,来自陕西,4160964539983268,不胜酒力
7123816799531008808,预祝:我国空间站发射成功！,0,3,0,2022-07-24 14:08:22,来自湖北,55233621481,蓝天白云8mQE
7123827511892624141,热烈祝贺问天实验舱发射成功[撒花][撒花][撒花],0,7,0,2022-07-24 14:50:37,来自陕西,6716138346,品味999s
7123828279475372831,大家热烈祝贺问天实验舱搭乘长征五号B火箭发射成功🎉🎉🎉,0,8,0,2022-07-24 14:53:23,来自江苏,3218972531758040,鲨鱼骑行
7123780150386639650,预祝发射成功，航天工作者辛苦了[祈祷][祈祷],1,60,2,2022-07-24 11:46:12,来自浙江,2893530728506827,韵达君
7123867445865038626,为国家的航天事业取得成功点赞,0,13,0,2022-07-24 17:24:54,来自贵州,4028212936970848,静心宇赐
7123836709686575905,这是中国空间站，又不是国际空间站，凭什么考虑其他人的需要,0,5,0,2022-07-24 15:26:28,来自北京,2655338638,金子毅
7123835227713438464,单个国家，中国人口最多，空间站是中国自主建造，自己地盘自己做主，不奇怪。,0,3,0,2022-07-24 15:20:02,来自广东,12837820841027,率真麻酱pc
7122628451487826725,梦天问，天天舟，天河，中国空间站有每个名字都是从5000年的历史长河中得来的。为我们伟大的航天科技点赞，中国加油！[赞][赞][赞][微笑][微笑][微笑],0,13,0,2022-07-21 09:17:39,来自广东,2110655964920248,鸿哥gold
7123898783699829508,热烈祝贺问天实验舱发射圆满成功。,0,1,0,2022-07-24 19:27:11,来自上海,95748482986,闻鸡即起舞
7123862687246779177,祝贺问天发射圆满成功！！！,0,1,0,2022-07-24 17:06:29,来自天津,100599394186,一往无前河流EM
7123864416613319465,祝贺问天发射完满成功！,0,1,0,2022-07-24 17:13:20,来自广东,4076608934127031,chenbaisen
7123817382237733646,预祝发射成功！[祈祷][祈祷][祈祷],0,4,0,2022-07-24 14:11:05,来自广东,2291015077598664,清新山雀GV
7121977134314357516,希望以后把货运飞船改造成返回式，月球上采矿，送到航天站交给货运飞船，返回地面回收。,7,15,2,2022-07-19 15:10:36,来自上海,2656840876827032,world wide
7122629702787482402,"致敬航天人！点赞航天事业
天和·天舟·问天·梦天
中国空间站母港带你领略浪漫航天[赞][赞][赞][赞][赞][赞][赞]",0,11,0,2022-07-21 09:22:06,来自福建,61493666380,红丹615
7123848348314321699,每次看到航天发射，心情格外激动，感恩自己生活在一个伟大的时代！,0,2,0,2022-07-24 16:10:54,来自四川,55140107789,HC147435448观察员
7123927689815261956,问天发射成功，为航天科技人员点赞，为祖国建设航天强国点赞！,0,0,0,2022-07-24 21:19:12,来自湖南,4274494647307629,好学沙滩1R
7123792458009363235,预祝发射成功；我们的征途是星辰大海,0,22,0,2022-07-24 12:33:50,来自上海,59871990919,夜里的春雷
7123847555666068224,为伟大的祖国点赞！致敬中国航天！致敬中国航天人！不负时代伟大使命，逐梦太空，场面震撼、惊叹！满满的自豪感！,0,1,0,2022-07-24 16:07:48,来自甘肃,1922417901442172,祥瑞好物分享
7123856452531454735,祝贺！问天实验舱成功发射。向中国航天人致敬！,0,1,0,2022-07-24 16:42:26,来自天津,106255153639,大鲨鱼720422
7123796785570808576,为祖国的航天事业点赞[赞][赞][赞],1,15,1,2022-07-24 12:50:46,来自贵州,13199442861,1453198
7123935532446745374,青海人民发来贺电[撒花][撒花][撒花]向伟大的航天人致敬[心][心][心]祝祖国航天事业一飞冲天，问鼎苍穹！！！[点亮平安灯][点亮平安灯][点亮平安灯],0,0,0,2022-07-24 21:49:24,来自青海,1050775554104171,神州观澜
7123840657521263368,胖5液氢主要源自法国进口，不久会完全国产化，自给自足。,0,3,0,2022-07-24 15:41:19,来自辽宁,53327600754,世界未来属于我大中华
7123818251540513551,2：13分看到新闻，期待5B发射成功！,0,4,0,2022-07-24 14:14:11,来自湖南,2850081859,美丽从心而始
7123914379246224169,向航天人致敬，恭贺伟大祖国繁荣昌盛！,0,0,0,2022-07-24 20:26:56,来自黑龙江,54644532511,彤彤红红
7123846736732652301,"为国家的强大点赞，为中国航天加油，
祝发射圆满成功，中国空间站加油。#我要上 头条# #中国空间站核心舱“天和”发射成功# #热点# @头条热榜",0,0,0,2022-07-24 16:05:04,来自河南,4124974024237376,怀旧自媒体
7123867580280537892,祝贺问天试验舱成功发射！为祖国点赞！,0,0,0,2022-07-24 17:26:08,来自河北,105555028675,怪龙笨
7123929936750265123,祝愿我的祖国繁荣昌盛！,0,0,0,2022-07-24 21:27:17,来自山东,5753461758,曾是大院一少年1
7122004429175718660,中国航天发射坚定不移，准备充分，检测细緻，祝贺成功！,0,6,0,2022-07-19 16:56:31,来自湖北,3777566025714317,雨辰0018
7123831861721268996,我们的航天员又不懂英语，难不成我们要做英语按键为难我们自己？[哈欠],0,5,0,2022-07-24 15:07:36,来自福建,111224541244,弓之月神
7123802987344364288,新疆人民预祝发射成功[祈祷],0,9,0,2022-07-24 13:14:55,来自新疆,4503829707,这里醉逍遥
7123767352688329487,祝贺发射成功,0,1,0,2022-07-24 10:56:32,来自贵州,11683141327,许晨685
7123809172583727906,预祝发射成功！[祈祷][祈祷][祈祷],0,5,0,2022-07-24 13:38:52,来自陕西,6759330986,三少爷乐乐
7123809820390163234,祝祖国繁荣富强，问天逐梦[赞][赞][赞],0,10,0,2022-07-24 13:41:29,来自福建,68359834748,MrsWu
7121597706925310720,期待“问天试验舱”早日成功对接“天和”,0,3,0,2022-07-18 14:37:21,来自广东,4727186270,谁向江南处处栽
7123876379053490958,问天实验舱成功发射，标志中国航天事业跃上新台阶，祝贺！,0,0,0,2022-07-24 18:00:08,来自新疆,316247804234109,热情风声lB
7123846059638096652,"今天进到现场去看的，震撼！！！
 好震撼哦，今天天气太好的不要不要的，平时能看几十秒，这次我们看了将近5分钟。",0,0,0,2022-07-24 16:02:54,来自海南,5410451768,踏雪随缘4
7123855075613115151,祖国强盛，科技进步！,0,0,0,2022-07-24 16:37:08,来自福建,1605740899870319,希望之星永远璀璨
7123813396059439902,预祝发射圆满成功！,0,5,0,2022-07-24 13:55:47,来自上海,65121280335,封狼居胥刘01
7123801892681483020,预祝发射圆满成功！！！[玫瑰][玫瑰][玫瑰],1,16,1,2022-07-24 13:11:27,来自福建,72466088051,行悟浪人
7123844064067945253,热烈祝贺“天问一号”发射圆满成功，向航天人致敬，为祖国点赞！为中国人自豪！,0,0,0,2022-07-24 15:54:38,来自四川,56827622199832,舞动阿利森5P
7123870730642785035,问天直播圆满发射，再次感到祖国的强大，先进，自信，完备,0,0,0,2022-07-24 17:38:19,来自河南,93015059207,锻奴
7123826035166593796,热烈祝贺！中国航天一飞冲天！,0,6,0,2022-07-24 14:45:14,来自天津,12424214843,土豆也不错
7123874121267626784,中国境内什么地点什么物品一律用中文，凭什么迁就外国人？？？,0,1,0,2022-07-24 17:51:37,来自江西,6100771403,雷门文
7123803921218355979,预祝发射圆满成功！,0,5,0,2022-07-24 13:19:02,来自上海,408662095956215,极速铅笔5Z
7123904178380112681,恭祝我伟大的祖国越来越强大,0,0,0,2022-07-24 19:47:36,来自福建,800053085080206,淡泊人生13
7123847345607426819,遨游太空，我们一直在努力!祝贺我们的祖国越来越强大!,0,2,0,2022-07-24 16:08:06,来自福建,704138663432467,五谷杂粮最健康
7122626599299629857,"现代科技与神话传说遥相辉映，构成了一种独特的中国式浪漫，
领略浪漫航天[赞][赞][赞][玫瑰][玫瑰][玫瑰]",0,10,0,2022-07-21 09:10:32,来自河北,2911094870392135,流金岁月一抹痕
7123847965202203400,这才说明这是中国空间站，想来用，想来学，先学中文吧[呲牙],0,0,0,2022-07-24 16:09:51,来自浙江,9566733902,当年瘦猴
7123789768596570892,定发射成功[比心][比心][比心],0,53,1,2022-07-24 12:24:12,来自江西,4195334022506157,热闹扑克MW
7123867045477106473,祖国的航天科技真是也天一个样的响前发展，祝贺问天实验舱发射成功。[玫瑰][玫瑰][玫瑰][鼓掌][鼓掌][鼓掌][赞][赞][赞],0,1,0,2022-07-24 17:23:32,来自河南,2809973182833483,热情的菠萝fI
7123804129281065766,满心期待！预祝发射圆满成功！[祈祷],0,5,0,2022-07-24 13:19:55,来自河北,4237084297,有钱没钱都要过年
7123822985370534689,我们有我们的标志，要来请学好中文以及汉语。,0,4,0,2022-07-24 14:33:23,来自甘肃,3034273575089694,美美的西北丫
7123808122703414023,"祝福中国航天！
徐州人民来电：预祝发射成功！",0,4,0,2022-07-24 13:35:06,来自江苏,50698536223,醉卧万花坳
7123889389927039781,航天技术越来越强大，期待祖国繁荣昌盛，国强民富！,0,0,0,2022-07-24 18:50:38,来自广东,2217082524796093,聪明天空GT
7123846859331945250,祝贺：问天实验舱发射圆满成功！祝愿伟大祖国繁荣昌盛！,0,0,0,2022-07-24 16:05:02,来自河南,50014308221,大师兄-99
7123881752745624351,中国NB!!!!!祝愿后续任务圆满成功!!!,0,0,0,2022-07-24 18:21:08,来自山东,10460775848,陌上花开缓缓归146815213
7123806648044847886,祝长征5B 我们的航天舱 圆满发射成功！ 致敬我们伟大的科学家[赞][赞][赞][赞][赞],0,3,0,2022-07-24 13:29:21,来自江苏,109654377237,端庄清风Tm
7123797297347183392,预祝发射成功！祖国繁荣昌盛！[祈祷][祈祷][祈祷],0,7,0,2022-07-24 12:53:30,来自陕西,197555237426216,坦荡的风筝j
7123796754549916456,预祝发射圆满成功[祈祷][祈祷][祈祷],0,6,0,2022-07-24 12:50:37,来自天津,6457947088,o本草纲目o
7123816109429818115,预祝发射成功，中国万岁！中国人民万岁！,0,5,0,2022-07-24 14:06:33,来自河北,111211067659,热闹豆花HI
7123800677758796544,预祝发射成功！[玫瑰][玫瑰][玫瑰],0,4,0,2022-07-24 13:05:42,来自浙江,107942844537,夜之聻
7123812189018227463,预祝发射成功！,0,5,0,2022-07-24 13:50:46,来自重庆,4374022844,廊苑鹤
7123836900288791309,四川人民祈祷发射成功,0,2,0,2022-07-24 15:27:01,来自四川,53477813782,李志刚刚刚好
7123827673775751939,一直在看，现在正在浩瀚的天空中稳稳地，正在走向中国的空间站。,0,4,0,2022-07-24 14:51:27,来自四川,5858789107,老李68810042
7123816065381614371,祝贺发射成功,0,4,0,2022-07-24 14:05:45,来自浙江,75468451356,也无风雨也无晴zmh
7123817351262733056,有求必应的观世音菩萨，请保佑中国航天，保佑发射圆满成功！,0,5,0,2022-07-24 14:10:41,来自湖北,64526366247,游乐场阜康0v5
7123803641093292840,这么大，肯定很贵吧？,0,5,0,2022-07-24 13:17:14,来自宁夏,54528528664,不留行
7123899584036078343,祝贺问天试验舱发射成功！,0,0,0,2022-07-24 19:30:18,来自陕西,1437774158765790,我爱头条05
7123794568344748840,预祝成功发射,0,4,0,2022-07-24 12:42:14,来自甘肃,6597577772,冰封98461586
7122628217567167273,为伟大的祖国点赞！致敬中国航天！致敬中国航天人！不负时代伟大使命，逐梦太空，探索无穷，为实现中华民族航天复兴而不懈奋斗！天和、天舟、问天……中国空间站母港带你领略浪漫航天！场面震撼、惊叹！满满的自豪感！,0,12,0,2022-07-21 09:16:15,来自河南,923189563362632,暖暖的晨晨晨曦
7123916064735888163,标志我国又一个里程碑,0,0,0,2022-07-24 20:33:36,来自辽宁,3918311639758631,rosegirl33随想
7123863284968669985,航天事业步步高升，突飞猛进。加油点赞,0,0,0,2022-07-24 17:09:24,来自山东,2608503257042728,小叮当
7123804276107084581,预祝发射圆满成功！为航天科技人点赞！[赞][玫瑰],0,4,0,2022-07-24 13:20:11,来自上海,81707719782,乐乐97392
7123794847387157262,祝贺发射成功啊,0,5,0,2022-07-24 12:43:41,来自四川,9519018281,昆鹏展翅798
7123803757917389599,安徽人民预祝发射圆满成功~[玫瑰],0,4,0,2022-07-24 13:18:06,来自安徽,2454528949749179,视野沙拉
7123802069429076773,期待发射成功！壮我国威，军威！全国人民共享荣光！加油！中国航天人！,0,6,0,2022-07-24 13:11:37,来自湖北,6626503120,汝胜
7123854134537192225,为祖国点赞。,0,0,0,2022-07-24 16:34:09,来自江苏,4371270002816526,悠闲张琳
7123790754233336607,预祝！成功发射[祈祷][祈祷][祈祷],0,5,0,2022-07-24 12:27:58,来自陕西,57055828384,骑着鬼子打美帝
7123848319893586723,山东沂源人民，热烈祝贺空间站问天实验舱发射任务圆满成功！[烟花][烟花][烟花],0,0,0,2022-07-24 16:10:51,来自山东,51339388077,欢乐搜寻
7123795062827254566,预祝发射成功！,0,5,0,2022-07-24 12:44:37,来自广东,1574120015528557,幽默海风D
7123825868748686112,学习中文，你才能更好了解世界潮流,0,3,0,2022-07-24 14:44:19,来自广东,62143942420,武顿山下
