7122625002004366120,中国空间站建造首战告捷，正式迈入空间站时代。现代科技与神话传说遥相辉映，构成了一种独特的中国式浪漫[赞][赞],0,1906,5,2022-07-21 09:03:50,来自福建,4142560058023691,薇薇逛红尘
7122623612012004129,天和、天舟、问天……中国空间站母港带你领略浪漫航天。,0,1418,0,2022-07-21 08:59:09,来自湖南,109144337841,冰岛日记1234shrj
7123827049638314763,祝贺！祝愿祖国的明天越来越好！,0,1833,0,2022-07-24 14:48:57,来自河北,106217872197,人生就是画个圈
7122625720173937449,[玫瑰][玫瑰][玫瑰]为伟大的祖国点赞！致敬中国航天！致敬中国航天人！不负时代伟大使命，逐梦太空，探索无穷，为实现中华民族航天复兴而不懈奋斗！天和、天舟、问天……中国空间站母港带你领略浪漫航天！场面震撼、惊叹！满满的自豪感！,0,1342,2,2022-07-21 09:06:30,来自陕西,2590084826406547,秦观鹊桥仙
7122625770669327139,逐梦太空。,0,719,0,2022-07-21 09:06:53,来自福建,99826012087,信仰的颜色中国红
7122629410637366020,灵槎准拟泛银河，剩摘天星几个,0,506,0,2022-07-21 09:21:57,来自江西,2802002941444379,铭果果好歌
7122625665199112971,"为天和贺！
为天舟赞！
为问天自豪！
中国空间站母港带你领略浪漫航天。",0,553,0,2022-07-21 09:07:01,来自北京,1125496744837911,马上马下
7122626951655375646,中国空间站母港带你领略浪漫航天[赞][赞][赞],0,475,0,2022-07-21 09:12:01,来自广西,5769561735,月儿话情感
7123828087162831650,"我们的目标是星辰大海！
一飞冲天，问鼎苍穹！[比心][比心][比心]",0,935,0,2022-07-24 14:52:25,来自北京,5758653094,六月雪520
7123826838648652584,祝贺问天实验仓发射任务圆满成功，向辛苦工作的航天人致敬，希望再接再厉再创辉煌,0,1459,2,2022-07-24 14:47:35,来自广西,1380584391711952,枫之流林
7122624068775691046,天和、天舟、问天......中国空间站母港带你领略浪漫航天！向中国航天事业工作者致敬！为伟大的祖国点赞！,0,451,0,2022-07-21 09:00:48,来自上海,109554259110,宝上帅278
7123850813290300190,致敬中国的航天人、航天英雄！,1,110,1,2022-07-24 16:21:12,来自辽宁,50267026603,刘天怡
7123843522440053537,[烟花][烟花][烟花]为强大的祖国点赞！向中国航天人致敬！你们辛苦了！🙏🙏🙏,0,132,1,2022-07-24 15:52:42,来自北京,61509905767,花儿朵朵1699
7123826240100254494,祝贺为航天事业工作的同志们[中国赞][鼓掌]祝福祖国！,0,781,2,2022-07-24 14:45:46,来自辽宁,56698801447,EDDIEWONG620
7122624223772394280,"中国空间站叫“天宫”
核心舱叫“天和”
货运飞船叫“天舟”
实验舱叫“问天”“梦天”
为中国航天科技强国点赞！",0,225,0,2022-07-21 09:00:52,来自天津,2348978326479711,头条老孙
7122625818005701416,"天和、天舟、问天、梦天……
名字承载都中华悠久历史文明，
现代科技与神话传说遥相辉映，
构成了天人合一的中国式浪漫。",0,220,0,2022-07-21 09:06:51,来自山西,106061531616,真诚真水无香
7122626586180158212,"大国重器数航天，
神州系列世震撼。
中国强来航天强，
前程似锦更璀璨。[玫瑰][玫瑰][玫瑰]",0,216,0,2022-07-21 09:10:39,来自广东,77712306155,搞网络运营的江湖哥
7123826219665097502,中国航天科技牛🐮，中国航天人牛🐮，中国航天事业牛🐮！！！,0,1095,2,2022-07-24 14:45:15,来自福建,2770368159563501,实象
7123848582109233961,"祝贺天问发射成功！
致敬！中国航天人！",1,71,1,2022-07-24 16:12:03,来自甘肃,50958133212,丁占爱
7122625758568612643,中国空间站母港带你领略浪漫航天。中国建造的“太空家园”，让神话传说一步步走进现实。[比心][玫瑰][比心][玫瑰][比心][玫瑰],0,248,0,2022-07-21 09:06:47,来自江苏,3131005062886039,小猫咪咪唉咪咕
7122627994648085261,"探索浩瀚宇宙 ，建设航天强国 ！
航天人追梦太空、建造“天宫”，更是新时代“梦天”的生动写照！[赞][赞][赞]",0,210,0,2022-07-21 09:15:38,来自湖北,4208578288956136,一江秋水111
7123849941856125700,祝贺！祝愿祖国的航天事业明天越来越好！,0,245,0,2022-07-24 16:17:58,来自四川,2378994549792663,杨孜鑫的妈妈
7123826394890994465,祖国的强大，骄傲感倍增！祝贺[赞][赞][赞],0,331,0,2022-07-24 14:46:38,来自广东,4498801137294684,燕儿
7122627063303242499,"致敬航天人！点赞航天事业
天和·天舟·问天·梦天
中国空间站母港带你领略浪漫航天",0,174,0,2022-07-21 09:12:37,来自湖北,77774610439,里七宝多
7122623649978729227,天和、天舟、问天、梦天……中国空间站，每个名字都是从五千年的历史长河中来。现代科技与神话传说遥相辉映，构成了一种独特的中国式浪漫。[赞][赞][赞],0,491,3,2022-07-21 08:59:08,来自浙江,3210180071269976,W且行且珍惜
7122625568507986723,天和、天舟、问天、梦天……中国空间站，每个名字都是从五千年的历史长河中来。为祖国航天事业点赞！致敬航天人逐梦太空、建造“天宫”。[玫瑰],0,305,1,2022-07-21 09:06:07,来自河北,102994218489,理财源
7122624116716225284,天和、天舟、问天、梦天……中国空间站，现代科技与神话传说遥相辉映，构成了一种独特的中国式浪漫。[玫瑰][玫瑰][玫瑰],0,98,0,2022-07-21 09:00:47,来自湖南,2528468542161444,姹紫亦千红
7122627322658423559,天和、天舟、问天、梦天……中国空间站，每个名字都是从五千年的历史长河中来,0,106,0,2022-07-21 09:13:22,来自安徽,3812732120341901,傅水娥
7122625790658740999,为中国航天科技“独树一帜”、“星光璀璨”、“荣耀世界”：点赞！[赞],0,129,0,2022-07-21 09:07:05,来自安徽,1129938611343757,大皖孤者何惧
7122626083799302946,航天空间站建设是人类对宇宙最大的探索，为发展人类提供丰富的智慧掌握更多的智慧，为航天科技人员点赞👍,0,112,0,2022-07-21 09:08:03,来自江苏,628554519296376,洒脱不一样的烟火
7122625547221811976,中国空间站问天实验舱与长征五号B遥三运载火箭组合体已垂直转运至发射区，发射任务进入倒计时。点赞,0,86,0,2022-07-21 09:06:21,,3465288997670944,直率叶依依
7122627815425835789,问天！充满了人类对宇宙规律的思考，彰显了探索浩瀚宇宙，建设航天强国的攀登精神。,0,95,0,2022-07-21 09:15:13,来自广东,54598533374,品味醇香茶
7122626647437853444,古人问天，充满了对历史兴亡的慨叹和对宇宙规律的思考；而今人问天，彰显了探索浩瀚宇宙，建设航天强国的攀登精神。,0,64,0,2022-07-21 09:10:55,来自重庆,1006785236317288,萍ping168
7123827360708920079,看直播，热烈祝贺问天发射成功，向亲爱的同学们致敬[比心][比心][比心][比心][比心],0,365,2,2022-07-24 14:49:31,来自天津,4199788573632237,满天星G
7122622230064317219,九天揽月，追梦星空，为航天人点赞[赞],0,61,0,2022-07-21 09:10:27,,101755417898,高宇妈妈
7123849615967355648,热烈祝贺中国问天实验仓发射成功[赞][赞][赞],0,52,0,2022-07-24 16:15:55,来自四川,59282317721,刘志佩liu
7122626600566637312,梦天问，天天舟，天河，中国空间站有每个名字都是从5000年的历史长河中得来的。为我们伟大的航天科技点赞，中国加油！,0,81,0,2022-07-21 09:09:58,来自内蒙古,87332502256,冰部落的鸟
7123827969034453763,祝贺发射圆满成功！,0,281,1,2022-07-24 14:52:52,来自湖北,2648101092332126,头条速览
7122626585517654818,九天揽月，逐梦星空，为中国航天事业点赞,0,67,0,2022-07-21 09:09:58,来自辽宁,496614879015659,正能量1921
7122626806440166185,天和，天舟，问天，梦天[赞][赞][赞],0,75,0,2022-07-21 09:10:54,来自黑龙江,4089819516119031,索伦河上的彩虹
7122626935242654494,古人对宇宙的向往和思考变成了现实，中国人的航天事业突飞猛进，日新月异，中国人的骄傲[撒花][撒花][撒花][撒花][撒花],0,47,0,2022-07-21 09:11:44,来自四川,64206558031,Pnews极速
7122626893111313166,航天人遂梦天空，建造天宫，更是时代梦天的生动写照，为航天人点赞点赞点赞。[赞][赞][赞][赞][赞][赞],0,58,0,2022-07-21 09:11:53,来自北京,5512402123,15910578419
7122626769874207529,现代科技与神话传说遥相辉映，带我们领略中国式浪漫[玫瑰][玫瑰][鼓掌][鼓掌][赞][赞],0,54,0,2022-07-21 09:10:44,来自北京,483394843852168,无双苹果Sk
7122625938658968359,而今人问天，彰显了探索浩瀚宇宙，建设航天强国的攀登精神。,0,64,0,2022-07-21 09:08:10,来自辽宁,104311867914,祝福洛阳
7122626942675010344,我国正式迈入空间站时代,0,45,0,2022-07-21 09:11:23,来自广西,3773145766966832,桂林李玉珍
7122624862006641443,中国空间站 厉害👍,0,40,0,2022-07-21 09:03:13,来自江苏,89876936565,小可爱
7122625581006979875,中国空间站建造母港“太空家园”，让神话传说一步步走进现实。为伟大的祖国点赞！[赞][赞][赞],0,98,1,2022-07-21 09:06:05,来自四川,3821552734046504,龙舞劲风
7122627654947488525,中国制造千变万化，大国重器永创世界高峰，为国争光中华儿女奋力拼搏永向前！[赞][赞][赞],0,38,0,2022-07-21 09:14:37,来自广东,63868096478,用户陈5427258037582
7122629027164422948,中国空间站用历史命名，用独特的方式展现中国式浪漫[比心],0,39,0,2022-07-21 09:19:46,来自江苏,4000064897,团子糯米糍
7122625980895642398,“浪漫航天，”现代科技与神话传说遥相辉映，独特的中国式浪漫！[赞][赞][赞],0,62,0,2022-07-21 09:07:56,来自河南,1095526451779358,candy6699
7122624127253021451,为祖国点赞[赞][赞],0,214,1,2022-07-21 09:01:27,来自广东,107692414969,杨杨Ya
7123826247251723046,在我们不知不觉中，有些人一直都在默默努力，让我们的祖国越来越强大，越来越好,0,423,2,2022-07-24 14:46:18,来自青海,70392259830,偷得浮生半日闲mmy
7122628767352554252,中国航天太牛了[玫瑰][玫瑰][玫瑰][赞][赞][赞][赞][赞][赞][赞][赞][赞],0,31,0,2022-07-21 09:19:26,来自黑龙江,26848346520491,9J宽容是福
7122625052797371136,航天人逐梦太空、建造“天宫”，更是新时代“梦天”的生动写照。,0,92,1,2022-07-21 09:03:58,来自山东,11472414162,我爱我家275322711
7122627203670082312,为伟大的祖国点赞👍致敬航天员！,0,28,0,2022-07-21 09:12:51,来自新疆,92447140917,雨过天晴275055541
7122624647044596492,文明看东方，东方看中国，文化与文物活络起来，相依相连,0,40,0,2022-07-21 09:03:18,来自安徽,4139025389071326,统计一下
7122626260265878303,古典神话与现代科技的碰撞，是中国人骨子里的浪漫情怀[赞][赞][赞],0,54,0,2022-07-21 09:09:01,来自重庆,1362995589167288,妙手浅谈
7123827736728634149,祝贺问天实验舱发射成功！兴奋之余，自己倍感振奋！在自己平凡的岗位上，一定鼓足干劲，加倍努力，为祖国的日益强大添砖加瓦！,0,259,0,2022-07-24 14:51:21,来自山西,74267775984,衡水湖的微风
7122628817806181154,为祖国的航天事业点赞[赞][赞][赞],0,42,1,2022-07-21 09:18:42,来自贵州,1557324933113662,阿芳
7122687519129060100,古时的神话传说慢慢的都要变成现实，中国空间站的建成，让现代科技与神话传说遥相辉映，构成了一种独特的中国式浪漫。,0,7,0,2022-07-21 13:07:12,来自浙江,2718410300207248,仙仙
7123826990762804008,河南三门峡人民，热烈祝贺空间站问天实验舱发射任务圆满成功！[烟花][烟花][烟花],0,135,0,2022-07-24 14:47:56,来自河南,54561173317,ShuraEarl
7123828262299976487,祝贺问天试验舱成功发射！为祖国点赞！,0,176,0,2022-07-24 14:53:46,来自湖南,106021037016,心乐在胸
7123935522992505600,祝贺，问天实验舱成功发射[赞][赞][赞],0,0,0,2022-07-24 21:48:59,来自辽宁,2261071195540445,米苏aaa
7122624768465240870,"领略浪漫航天，追梦太空家园。
中国自立自强，续写航天新篇。",0,56,0,2022-07-21 09:03:29,来自广东,106458029257,我爱老家湛江奋勇
7123929849131598600,热烈祝贺！中国航天一飞冲天！[赞][赞][赞],0,6,0,2022-07-24 21:27:26,来自山东,2327012099761892,讲课
7122625552376316709,天和、天舟、问天、梦天……中国空间站，每个名字都是从五千年的历史长河中来。现代科技与神话传说遥相辉映，构成了一种独特的中国式浪漫。为强大的祖国点赞！,0,27,0,2022-07-21 09:06:23,来自山东,308329615721960,博学多才的虎啸影视
7122627425950827268,逐梦天宫！为中国航天强大点赞致敬！！！[赞][赞][赞],0,39,0,2022-07-21 09:13:40,来自山东,2260190513336667,用户利剑出鞘
7122626322623120169,中国空间站叫“天宫”，核心舱叫“天和”，货运飞船叫“天舟”，实验舱叫“问天”“梦天”……,0,31,0,2022-07-21 09:09:02,来自上海,105958183606,公平公正120
7122625708044059400,为中国航天加油点赞！[给力][给力][给力],0,30,0,2022-07-21 09:07:05,来自湖南,4327497091,行者无名7777
7123808209097556773,祝贺问天实验舱搭乘长征五号B火箭发射成功🎉🎉🎉,0,165,0,2022-07-24 14:46:33,,3416915972985544,无言的萧邦
7122626168733778701,"西昌卫星发射中心追梦奋斗建造""太空家园""，让神话传说一步步走进现实。为科技工作者点赞[赞][赞][赞][赞][赞][赞]",0,29,0,2022-07-21 09:08:51,来自云南,927627203062603,平心心心心心心心心
7123826569021932326,热烈祝贺中国🇨🇳 空间站问天实验舱发射成功！[赞][赞][赞],0,64,0,2022-07-24 14:47:27,来自安徽,4054615434464260,叶卫东
7123826154058089255,热烈祝贺🎉🎉问天实验舱发射圆满成功！！祝伟大的祖国繁荣昌盛，祖国万岁！,0,189,0,2022-07-24 14:45:35,来自山东,4111799069981319,聆听幸福的旋律
7122626621840147232,而今问天，彰显探索浩瀚宇宙，建设航天强国。,0,25,0,2022-07-21 09:11:04,来自江苏,87156062729,用户1530040743894光
7123826884110140194,祝贺我的祖国[给力][给力][给力],0,21,0,2022-07-24 14:47:40,来自浙江,104180169019,蓝冰墩墩
7123814693256561416,以后就是全世界学中文了，还什么英文,7,233,1,2022-07-24 14:00:31,来自广东,15317330924,不凡圆月v
7122629616627761924,天和，天舟，问天，梦天。中国的空间站。[赞][赞][赞][赞][赞],0,26,0,2022-07-21 09:22:23,来自安徽,92986844434,用户6975055447601章
7122623912151909134,致敬航天人！,0,31,0,2022-07-21 08:59:45,来自重庆,50273494665,高云o
7122626036940096294,为中国航天点赞！为中国航天加油！发展航天事业，探索浩瀚宇宙，建设航天强国是我们不懈追求的航天梦。,0,36,0,2022-07-21 09:08:25,来自云南,52500563914,我心无罣碍
7122627433282847488,为建设中国空间站母港的科技人员点赞,0,24,0,2022-07-21 09:13:16,来自天津,104341835918,金丝侠梦
7122629047032890143,"探索浩瀚宇宙，勇攀科技高峰
致敬中国航天英雄[赞][赞][赞]祝愿祖国航天科技强国事业蒸蒸日上争创世界一流[赞][赞][赞]",0,22,0,2022-07-21 09:20:03,来自安徽,153540419924413,极速集安5z4
7122626878233805579,敢上九天揽月，敢下五洋捉鳖！中华民族有能力有信心，利用太空造福全人类！,0,23,0,2022-07-21 09:11:49,来自江苏,1094744727887982,优雅戴娜4d9
7122628037715608320,中国空间站，中国的“太空家园〞正在让神话传说变成现实！为中国航天人点赞！[赞][赞][赞][玫瑰][玫瑰][玫瑰],0,26,0,2022-07-21 09:15:36,来自四川,3325340798738816,爱生活dr
7122629795963274018,探索太空的天和、天舟、问天、梦天…共游太空，这是中国人民的骄傲，祝祖国繁荣富强！国泰民安！,0,23,0,2022-07-21 09:22:19,,111066931081,智勇双全喜鹊eC
7122625983236555535,🎊祝贺祖国在我们的星辰大海更进一步！🙏期待中国空间站早日全面建成并发挥巨大的科研和实用价值！！中国航天，加油！中国航天人，辛苦。,0,26,0,2022-07-21 09:07:37,来自河北,53047813172,我不是二黑
7122628671227052834,祝贺中国空间站建造首战告捷，我国正式迈入空间站时代。致敬为航天事业默默奉献的科学家们！致敬航天人！,0,24,0,2022-07-21 09:17:56,来自贵州,110763464890,悠闲清风di
7123820721016521512,应该用中文，这是我们的空间站，其它人想用，那就先学中文吧！,0,125,0,2022-07-24 14:23:45,来自青海,102515229481,自若小鱼9M
7122626219149050658,“天”与“和”相结合，其实就是古人所讲的“天人合一”，包涵天地自然与人类和谐相处之义，充分彰显了中国和平利用太空、造福全人类的理念。,0,26,0,2022-07-21 09:08:28,来自四川,52476419638,爱观影9g0u
7122626811699168040,神话传说变现实，这是中国人建造的太空家园。点赞中国。,0,24,0,2022-07-21 09:10:41,来自四川,65452104691,二鼠闹金猴吴良全
7123827859441271560,中国航天加油！[赞][赞][赞][玫瑰][玫瑰][玫瑰],0,49,0,2022-07-24 14:51:56,来自安徽,64700690579,敬亭水乡
7122629597720232738,中国航天事业日新月异，正在逐步将神话变为现实，问天、梦天、天问等响亮的名字体现了中国式浪漫,0,23,0,2022-07-21 09:21:43,来自内蒙古,84559942677,天马行空一生情
7123826674974130975,祝贺！对接顺利！,0,187,0,2022-07-24 14:47:26,来自广东,2383358418492125,暗香SU影
7122629955032515341,曾经毛主席也豪迈的呼喊过:可上九天揽月，五下五洋捉鳖。如今都实现了，离不开中国科研人，航天人的辛苦付出，强国有您，万分感谢！[比心][比心][比心],0,23,0,2022-07-21 09:23:20,来自山西,1934781366407853,kanboy
7122628095471076136,“天人合一”，包涵天地自然与人类和谐相处之义，充分彰显了中国和平利用太空、造福全人类的理念。,0,18,0,2022-07-21 09:15:42,来自浙江,1367407609789917,部落银行
7122627181519831808,好文，浪漫中逐步对科学的追求，浪漫中彰显祖国日益强盛！为航天人点赞，为伟大的祖国点赞！！！,0,22,0,2022-07-21 09:12:16,来自江苏,584586472469015,无忧的海燕bi
7122629290541695755,"中国航天，[赞][赞][赞]
世界瞩目！[加油][加油][加油]",0,27,0,2022-07-21 09:21:22,来自河南,53309163768,文瀚第一
7122624547538404129,中国航天，后来居上。为祖国的航天工作者点赞！,0,23,0,2022-07-21 09:02:40,来自吉林,100788577705,年轮3881728786146
7123826410363716367,祝贺问天实验舱发射圆满成功[撒花][撒花][撒花],0,67,0,2022-07-24 14:45:51,来自山东,677765788494119,花儿与少年156
7122629898048422686,"现代科技与神话传说遥相辉映，
构成了一种独特的中国式浪漫！",0,17,0,2022-07-21 09:23:02,来自上海,110491856198,春天春风里
7122626654287250189,如今我们中国的航天世界突飞猛进。表现了我们中华民族奋斗的精神。,0,20,0,2022-07-21 09:10:35,来自陕西,3699262949,愉悦的漂流瓶666
7122623843764257551,中国航天的目的地是星辰大海，加油！,0,22,0,2022-07-21 08:59:03,来自山西,95776259992,沐逸晨光
7122626820905943849,为我们祖国的航天事业喝彩点赞[赞][赞][赞],0,18,0,2022-07-21 09:10:51,来自上海,109083337018,老周827278
7122624275651576607,为中国航天事业和航天科技人点赞！[赞][赞][赞][赞][赞][赞][赞],0,25,0,2022-07-21 09:01:22,来自安徽,1538949383720398,高冷云朵uH
7123827170992227084,庆祝问天号发射圆满成功。,0,52,0,2022-07-24 14:49:36,来自江苏,6571559979,赛尔洛夫斯基
7122626411470439208,上九天揽月，下五洋捉鳖！！！,0,18,0,2022-07-21 09:09:09,来自河南,61305650300,听海观涛556
7122629710081426210,为祖国航天点赞！[赞][赞][赞],0,16,0,2022-07-21 09:22:09,来自山东,2497736967725368,平安福兔
7123827057637180198,祝贺发射完满成功。厉害了我的国！[赞][赞][赞],0,27,0,2022-07-24 14:49:22,来自陕西,109237149865,西沣公元
7122626030598619940,大力建设航天强国，实现中华民族伟大复兴,0,19,0,2022-07-21 09:08:18,来自辽宁,3430111359017639,平静的ljl
7123827831385293575,发展航天事业，建设航天强国。祝贺伟大的祖国！,0,80,0,2022-07-24 14:51:36,来自江西,3170616009037691,用户拥抱梦想
7123899505547985700,祝贺问天实验仓发射任务可圆满成功！向航天人致敬，点赞[赞][赞][赞],0,11,0,2022-07-24 19:29:48,来自江苏,105783321362,灵敏蜻蜓8w
7122628577799553827,何不言问天？天尊不可问，故曰天问也。,0,16,0,2022-07-21 09:17:40,来自广东,2101911635637387,糊涂虫Aiden
7122626116804035328,中国的航天科技突飞猛进。,0,21,0,2022-07-21 09:08:07,来自四川,69837875520,上进豆花QN
7123826216217789218,祝贺祝贺[撒花][撒花][撒花][撒花][撒花][撒花],0,72,0,2022-07-24 14:44:59,来自湖北,1293464732705867,苏玖娘
7123826045383525155,祝贺问天成功发射！,0,27,0,2022-07-24 14:44:21,来自辽宁,3780058649,MOON满月社长
7122625611340120845,中国空间站，中国人的梦想！真是牛！[赞][赞][赞]祝早日建成运行！,0,19,0,2022-07-21 09:06:42,来自山东,84931853524,仙人指
7123826407855407909,祝发射圆满成功，祝祖国繁荣昌盛[赞][赞],0,18,0,2022-07-24 14:46:10,来自湖南,50259643529,风中落叶140267430
7123827748686480128,吴刚捧出桂花酒，欢迎问天来做客。,0,41,0,2022-07-24 14:51:06,来自浙江,53506473928,觅乐探览
7123836999051772675,强大如中国。飞翔吧问天，飞翔吧中国！为你自豪，为你祝福！[赞][赞][赞],0,88,0,2022-07-24 15:27:31,来自广东,77712306155,搞网络运营的江湖哥
7122625226575905576,中国航天，太伟大了，太辉煌[赞][赞][赞][赞],0,17,0,2022-07-21 09:04:47,来自四川,3619216207913325,老吴18090231
7123827751534297886,祝愿祖国的航天事业蒸蒸日上，再创辉煌！,0,42,0,2022-07-24 14:51:20,来自甘肃,4015872678310472,狻猊和祥一
7122627098564363020,我们的征途是星辰大海！,0,16,0,2022-07-21 09:12:28,来自广东,1803620746795955,奇妙帆船lE
7122653077429420800,为国家强大的航天事业自豪。,0,9,0,2022-07-21 10:52:40,来自广西,51184873404,石深大海
7122626851364897567,培养好爱国人才，发展好科技创新，实现中国人掌握核心科技！,0,18,0,2022-07-21 09:11:21,来自浙江,78737667873,三樵
7123827059184386831,祝贺圆满成功[赞],0,28,0,2022-07-24 14:48:16,来自海南,4428459995839886,陈翔六个蛋
7123827034840892173,我爱五星红旗，希望我们下一代的人可以畅游太空,0,29,0,2022-07-24 14:48:30,来自重庆,104353029297,巴渝山人
7122672658705515300,和平利用太空、造福全人类,0,6,0,2022-07-21 12:09:02,来自江苏,817649208526712,龙凤呈祥虎虎生威
7122624041013969704,中国空间站天和天舟，问天带领大家领略浪漫航天，了不起我的国，祝福祖国繁荣富强[赞][赞][赞],0,28,0,2022-07-21 08:59:53,来自广西,110909263922,大国方度
7123827139375399684,祝贺祝贺祝贺中国航天[中国赞][中国赞][中国赞][比心][比心][比心],0,22,0,2022-07-24 14:49:50,来自陕西,5002197559,八宝粥49314986
7123827160959304480,为伟大祖国点赞！,0,12,0,2022-07-24 14:49:23,来自河北,25897608589,淡定梦想HZC
7123826653289693988,祝贺伟大祖国繁荣昌盛！再创辉煌！,0,28,0,2022-07-24 14:47:22,来自山东,52228160279,一九八九精品服饰
7123826485580251940,转发，祝贺，,0,30,0,2022-07-24 14:46:27,来自吉林,51041817362,澎137181492
7123844964077142819,能战才能止战，敢战方能言和！💪💪💪💪💪💪✊✊✊✊✊✊✊,0,47,0,2022-07-24 15:57:48,来自河南,52425806805,行云流水157522795
7123827445765374753,热烈祝贺我们伟大的祖国！国强则民强！[赞][赞][赞][撒花][撒花][撒花],0,45,1,2022-07-24 14:50:36,来自广东,97404220219,Live出正能量
7122628515598140199,为伟大的祖国点赞！,0,17,0,2022-07-21 09:18:23,来自山东,57506743199,鱼猎户
7123828111132918569,中国的航天技术已经非常成熟了，这些航天工作的科学家们辛苦了。,0,24,0,2022-07-24 14:52:28,来自广东,71765552852,拜骑士
7122625115648869153,天和、天舟、问天……中国空间站母港带你领略浪漫航天，为我国的航天事业点赞[赞][赞][赞][赞][赞][赞][赞][赞],0,22,0,2022-07-21 09:05:16,来自浙江,1671703997191053,dy1cw0bllh7jr
7123826051997958947,下半年目标就是：彩票中特奖[我想静静][我想静静][我想静静],0,34,0,2022-07-24 14:44:19,来自湖北,985590729284703,心哊灵犀
7123827715555885862,祝贺中国航天发射圆满成功！[祈祷],0,19,0,2022-07-24 14:51:52,来自内蒙古,3096690536220815,智慧突破自我提升价值
7123826701439746848,河南表示祝贺，祝任务圆满完成，祝祖国繁荣昌盛！！,0,17,0,2022-07-24 14:47:34,来自河南,98186728949,聪明的艺术家kl
7123818163645203233,我们有我们的标志，要来请学好中文以及汉语。,0,52,0,2022-07-24 14:14:50,来自福建,5817825229,伸手可触蓝天
7123827548379071265,祝贺中国航天。,0,18,0,2022-07-24 14:51:05,来自河南,1434215243320251,初遇微光
7123826074324599593,目标，星辰大海！,0,52,0,2022-07-24 14:44:30,来自广西,4234926134919476,追忆轻狂年少
7123827058635621133,中国的太空技术独树一帜,0,14,1,2022-07-24 14:48:49,来自新疆,2603293691097367,率真不想
