7131950254962393863,周围不少人都是癌症，还有三十多岁的小伙子和年轻女子,0,0,0,2022-08-15 12:10:53,来自陕西,14609676641,脑门上的胎记
7131001729156121378,我家也有癌症遗传基因，太爷爷是肠癌60多岁走的，太爷爷只有一个孩子就是我爷爷也是肠癌69岁走的，大伯前列腺癌60多岁走的，三叔67岁食道癌走的，大伯儿子肺癌57走了，我是2015年得了卵巢癌，幸运的是这七年来恢复的还挺好，正常工作和生活，感谢上天眷顾我[祈祷],0,0,0,2022-08-12 22:49:56,来自安徽,64554835591,kangkang妮
7131924944774726432,家族遗传也有可能,0,0,0,2022-08-15 10:33:12,来自河北,105821603036,三道合一三位一体
7131929603409036032,还是别把这些基因遗传下去了，后代也受罪,0,0,0,2022-08-15 10:50:29,来自北京,110917352235,端庄星辰XH
7131957083087651624,因果能解释。阿弥陀佛。,0,2,0,2022-08-15 12:36:49,来自广东,3724777885274983,6688阿弥陀佛6688
7131971658059170599,谈癌色变，这样的病是非常怕人的！会遗传！以前是麻风病！但是现在减少了几乎没有看见了！,0,0,0,2022-08-15 13:34:19,来自福建,4037006563483165,端庄画板l1
7131927415005643527,有些病遗传啊基本上百分之八十,0,0,0,2022-08-15 10:42:18,来自黑龙江,888002111605998,大聪明男男
7130876469055881996,“并”会不会遗传呢？只想回答意识内容会传！能不能删除意识内容呢？！不知道？,1,0,1,2022-08-12 14:44:28,来自上海,3687511606,虚空愛
7131927534652097310,重症终得死，轻症中药医。化疗早归西，快乐面对病自消！,0,0,0,2022-08-15 10:42:44,来自广东,67484119621,宇宙启星
7130955635558187776,"癌症的治病不仅仅跟基因有关联，也跟生活，饮食，情绪心态等关联吧。看到文章，还是认可观点。
我爷爷是九十年代初患肾尿结石走72岁的。父亲兄弟八个，二叔是50岁肝癌走的，大叔70岁胃癌走的，父亲是老三、今年初也因胃癌走了，73岁。二叔的儿子肝功能异常，我家哥哥也是肺有问题。希望其他叔叔，兄弟姐妹都健健康康的吧。",0,0,0,2022-08-12 19:50:38,来自四川,1525767675594408,睿智的善良葡萄8q
7130920439388013315,怎么这么多人得癌啊！太可怕了！,0,0,0,2022-08-12 17:35:12,来自山东,3281369582017147,智者橙子60
7131933028712121129,所以说良好的家族基因很重要，,0,0,0,2022-08-15 11:03:30,来自山东,66658592158,背影202383616
7131929191037715234,第一有遗传因素，第二一家人都环境和饮食相近，,0,1,0,2022-08-15 10:48:43,来自江苏,941599768185630,恐力有办法
7131965009106158371,父亲的遗传几率大还是母亲的几率大？,0,0,0,2022-08-15 13:07:47,来自北京,52332305670,酷酷蛇9999
7131933542837748492,生的孩子怎么办？怀孕前找到原因能在怀孕前干预是关键。,0,0,0,2022-08-15 11:06:26,来自陕西,52160841381,天蓝蓝绿绿的草
7131921217812480809,这种遗传病国家还是不要让结婚好。,0,1,0,2022-08-15 10:17:53,来自陕西,92863750357,越来越好47125
7131971483936785183,基因问题吧，基因可是很强大的,0,0,0,2022-08-15 13:33:15,来自湖南,56934114302,暴雨行走的青年
7131969236364264227,预防重于治疗…！,0,0,0,2022-08-15 13:23:55,来自广东,105566865188,广东华夏之子
7131955080407876390,基因检测结果能作为筛选标准吗？,0,0,0,2022-08-15 12:29:26,来自北京,50944670253,Tom170861142
7131968487681475343,优生优育太重要了。强烈建议加强婚前检查的强度，增加检查项目。利国利民。,0,0,0,2022-08-15 13:21:15,来自上海,3168041361,学问不深
7131956000252461860,遗传的，没办法,0,0,0,2022-08-15 12:32:56,来自广西,74851797303,谈没拢
7131950522646463236,遗传基因强大啊,0,10,0,2022-08-15 12:11:46,来自安徽,6058262146,晴雨天77644018
7131949623010738951,癌症遗传是有的，不过一家这密集的癌症，考虑下生活习惯，饮食习惯吧！癌症高发和饮食，生活，情绪是密切相关的，建议学点中医吧！中医有预防癌症的方法。,0,0,0,2022-08-15 12:08:21,来自河南,92320611416,congcong146
7131965678730920738,家族癌，和饮食情绪都有关系,0,1,0,2022-08-15 13:10:18,来自广东,4457963253,糯米果41213561
7131954038052586277,遗传病真的可怕，出生就注定了人生。,0,0,0,2022-08-15 12:25:30,来自贵州,17484609394,WJ先生
7131961998627046148,真不幸，家里很么多人都欢癌,0,0,0,2022-08-15 12:56:32,来自江苏,10586146369,she516
7131974221035143967,赚钱新手段而已！该有的怎么也跑不掉！！！,0,0,0,2022-08-15 13:44:06,来自安徽,96610427418,大狮子的摩羯鑫鑫
7131950737739383567,检测出来又能怎么样？啥用也没有，不能预防也不能治疗,0,0,0,2022-08-15 12:12:18,来自黑龙江,51617043553,东北爷们166354294
7131924913790993159,这种病是不是和精神病一样，有的人基因天生易得，虽然天生没有这些病但是容易获得,0,0,0,2022-08-15 10:32:37,来自江苏,85341348380,我是小猪zhu
7131951446513795843,正常，你把堂表算进了，每个家族里起码三个以上。我们家就四个了。还不算上婶婶这样外嫁过来的亲戚。,0,0,0,2022-08-15 12:15:53,来自浙江,223917356351790,随便写的66
7131967877544313634,自然选择下这些基因都会被淘汰的，现在人为干预了，痛苦只能自己承受！,0,1,1,2022-08-15 13:18:50,来自辽宁,56538466575,梦在归途v冰琅
7131963002886816547,这一查完了，这家小的都找不到朋友了,0,0,0,2022-08-15 12:59:55,来自湖北,3385338077,落尘9888
7130888823617405709,有些病发现应该吃药西医就是没有办法是不是可以考虑一下中医,0,0,0,2022-08-12 15:32:03,来自广西,110444369645,章家人520
7131966348137775876,说重点，都活多大去世的！,0,0,0,2022-08-15 13:13:57,来自江苏,96353157144,乾乾909
7131960265767224071,基因很强大！比如长寿！也是某种基因！根保养一点关系不大！,0,0,0,2022-08-15 12:49:31,来自吉林,2923740006,吉林大乌拉
7131929252550968104,基因疗法。,0,0,0,2022-08-15 10:48:51,来自广西,7008047692,老猛2
7131943920908845831,遗传，环境，饮食，差不多就这三样，挨个排查吧！,0,0,0,2022-08-15 11:46:19,来自四川,98039420260,晨曦烬冢
7131926655462818591,一个是跟遗传基因，一个跟饮食习惯有关！,0,0,0,2022-08-15 10:39:07,来自广东,85852454728,Ping8725
7131956652378719011,希望每个人都健康,0,0,0,2022-08-15 12:35:06,来自江苏,3579622492475199,费颖
7131971988117209868,终于明白年轻的时候处对象要结婚了要看看对方的父母长辈了。一方面看看出身，另一方面估计也有看看遗传基因这方面的考量。[思考],0,0,0,2022-08-15 13:35:34,来自吉林,105145602331,吃瓜观察员
7131950632164147976,病都会遗传的，所以找对象的时候要父母双全的(离婚除外),0,0,0,2022-08-15 12:12:06,来自浙江,2120285517522331,扁舟
7130948166664766242,要心态平和，多做善事，,0,0,0,2022-08-12 19:21:48,来自湖南,5547337781,果果59439405
7131955904291308292,婚前一定要充分了解对象家庭,0,0,0,2022-08-15 12:33:09,来自陕西,435037997898973,喜欢数字关你屁事
7131947366965789480,遗传通常好的遗传不到坏的一传就有，命里注定无法改变,0,0,0,2022-08-15 11:59:14,来自江苏,83913203413,北极寒冰158
7131965932742050597,要么基因有问题，要么家里有辐射，或者饮食有关系，小孩最好离开，换一个地方养。,0,0,0,2022-08-15 13:11:41,来自江苏,8680851019,Bridge18
7131964142692729600,基因加持，身体再牛逼也够呛,0,0,0,2022-08-15 13:04:13,来自广东,193114934877847,得闲饮茶455
7131933960942322472,我爸三个亲兄弟都死于心肌梗塞！感觉也是基因出问题了！,0,0,0,2022-08-15 11:07:03,来自加拿大,2463321443541232,一盏香茗清心
7130905264161014558,其实病毒没有错，错的是人类过度开发……,0,0,0,2022-08-12 16:35:47,来自福建,4369858787,韭菜你好
7130895006365647653,适者生存，不适者淘汰，大自然规律，好的基因被遗传生存下去，差一点基因被选择淘汰，非常残酷！,0,0,0,2022-08-12 15:56:10,来自广东,70885213514,灵敏宇宙R2
7130871622420644615,遗传家史。重视起来,0,0,0,2022-08-12 14:25:25,来自上海,95178684372,桂华893
7131960495397372703,西医8千多种癌，找中医吧！,0,0,0,2022-08-15 12:50:33,来自河南,5467007482,没病走两步55916241
7131961892360487693,基因改变一下,0,1,0,2022-08-15 12:55:51,来自江苏,2938342460107134,热情的奶茶Ur
7131942763737727758,少吃碘盐，哪有多少缺碘的，一片海带就办了,0,0,0,2022-08-15 11:41:32,来自山东,5880590237,既济随缘
7130852932400481035,不奇怪，家族遗传。,0,2,0,2022-08-12 13:13:15,来自四川,12655721660,糖城之光
7131967635755008768,"基因
相似的生活饮食习惯",0,0,0,2022-08-15 13:17:50,来自山东,97465836970,北北北北栀
7130949451035706150,基因是最重要的因素,0,0,0,2022-08-12 19:27:05,来自山东,70955811301,杠精大本营营长
7131952491851318019,不一定遗传！水源跟环境肯定有影响,0,0,0,2022-08-15 12:19:35,来自福建,63307883779,往后余生520堕落
7131965075849921320,检查下吃的、水、用具、放射性污染……,0,0,0,2022-08-15 13:07:57,来自北京,85994697168,嘘一一安静
7131931342451196712,好吓人，婚前检查很有必要,0,0,0,2022-08-15 10:57:00,来自内蒙古,2018310553873405,风姿卓越柑桔Ys
7131954432660800263,我没听过有世界分另外不治之症没死人，唯有这么多,0,0,0,2022-08-15 12:26:52,来自浙江,3469708244563372,乾坤一瓢
7131959820747309864,基因不好 谁也没有办法,0,0,0,2022-08-15 12:47:22,来自广东,6023351014,feng13531
7131946800923558690,这个……是命,0,0,0,2022-08-15 11:56:58,来自内蒙古,3693655189,冰川22249669
7131968308731020044,基因问题或者是易癌体质，也有可能是饮食习惯和环境因素,0,0,0,2022-08-15 13:21:07,来自广西,63563482294,突出6
7131960293122917155,中医治未病，拍拍，打打，拉拉，捏捏，敲敲，刮刮，推推，灸灸，食饮有节，起居有常，工作生活一切有度，气顺经通，病从何来？,0,0,0,2022-08-15 12:49:22,来自浙江,102635592659,松沉柔顺
7131952755119538985,所以婚检真的是有必要的吗？（并无恶意[祈祷][祈祷][祈祷]）……,0,1,0,2022-08-15 12:20:01,来自广东,52618134330,白玫瑰不野
7131910074817151757,这要不饮用水有问题，要不就是基因问题,0,1,0,2022-08-15 09:34:48,,4493018126,子小人七川
7131945527612719913,环境、遗传、习惯等多重原因,0,0,0,2022-08-15 11:52:07,来自上海,51904812026,瞎BB的大脸猫
7131937190108103439,没有科学依据说会遗传，但是大量数据显示就是会遗传,0,0,0,2022-08-15 11:19:50,来自上海,5407159496,血怒米
7131931493433770786,主要是还有两个孩子，孩子以后会不会也……太可怜了,0,0,0,2022-08-15 10:57:41,来自广东,3932289190335886,我啊了就
7131928938787455744,科学才能解释这些疑难杂症！,0,0,0,2022-08-15 10:47:34,来自湖北,92592332480,林培培
7131915430259852065,这是在给基因检测打广告吗？,0,1,0,2022-08-15 09:56:17,来自安徽,4533923211,无边落木43227628
7131962363955249934,一定是家庭饮食造成的，,0,0,0,2022-08-15 12:57:39,来自安徽,4439791529,真诚明月J
7131931083435672354,好的基因真的太重要了,0,0,0,2022-08-15 10:55:51,来自广东,92481858077,明人达事
7131969329754637090,家里的风水和阴宅还好吗？,0,0,0,2022-08-15 13:24:18,来自北京,6305923189,Cathy甜甜
7131946963775734563,遗传真厉害,0,0,0,2022-08-15 11:57:35,来自湖北,104375101873,用户兰竹梅松
7131967820845761283,太可怕，盼科学飞速发展，能治好哪些顽疾。,0,1,0,2022-08-15 13:19:29,来自山东,73116176506,清风徐来乐
7131927994368951081,可怜了她的两个孩子，这个病应该是从她奶奶那里来的,0,0,0,2022-08-15 10:44:06,来自山东,111235447531,程序媛名字好难取8888
7131970214236914432,西医叫基因，遗传基因怎么来的呢，其实还是佛法的因果，万事万物皆有因有果，所以佛劝人向善，善恶影响深远，祸及子孙后代,0,0,0,2022-08-15 13:27:46,来自四川,87074456903,（四哥副食店）春
7131941802894033664,请问亿万富翁有遗传吗？,0,0,0,2022-08-15 11:37:34,来自江苏,64064279087,坚决打击不法行为
7131928596696498947,二胎了......,0,0,0,2022-08-15 10:47:16,来自山东,4150886279,茗舒
7131940460289360674,应该是风火问题,0,0,0,2022-08-15 11:32:28,来自山西,56994018569,解忧阁1638
7130839956578222878,生活习惯改变一下,2,2,1,2022-08-12 12:22:13,来自西藏,1512558500513620,岁月并非如歌2388
7131945291682579213,任何保养哪怕保持愉快心情最终也干不掉基因,0,0,0,2022-08-15 11:51:28,来自天津,5004694896,阿里萨德
7131936886217523982,其实这个在婚前了解一下还是有必要的,0,0,0,2022-08-15 11:18:54,来自安徽,93108583656,卡帝L
7131955287195796238,怎么查遗传这个,0,0,0,2022-08-15 12:30:20,来自陕西,55924682489,大鸟飞得高
7130901784079876875,遗传基因太强大了,0,1,0,2022-08-12 16:22:58,来自江苏,1882824284055917,MXM9787
7131937140078101252,现在随随便便就这么多癌了吗？太可怕了,0,0,0,2022-08-15 11:20:23,来自浙江,111518273408,邓子笨笨
7131944068770939651,遗传，还有个环境影响吃的住的，有些危害因素不排查处理就会扎堆出现,0,0,0,2022-08-15 11:47:23,来自湖南,91615545088,故乡花已开
7131965038604206863,饮食习惯问题,0,0,0,2022-08-15 13:07:39,来自安徽,3764325981895358,奇幻风声v9
7131965413801722655,看样子是遗传啊,0,0,0,2022-08-15 13:09:37,来自江苏,5944498676,零下2731572369793
7131938024568668963,吃转基因西红柿，圣女果也有很大关系,0,0,0,2022-08-15 11:22:56,来自江苏,3192594214169400,坦荡的山丘8c
7131973009711416097,遗传，风水,0,0,0,2022-08-15 13:39:38,来自山东,3744138253,懂你25229795
7131945715626197797,她的孩子会不会很无辜,0,0,0,2022-08-15 11:53:16,来自四川,55047328075,鱼鱼241876346
7131965336370463488,共业，习性导致，想改变，修身,0,0,1,2022-08-15 13:08:48,来自广东,8481490229,心若菩提LJY
7131969945172312867,自然界针对每一个物种都有一种病菌，而且是一种病毒只对一种物种有效。神奇吧？,0,0,0,2022-08-15 13:26:42,来自四川,51194376869,吴雨夜
7131927498229089059,所以说结婚必须要查户口，知根知底才可靠,0,0,0,2022-08-15 10:42:11,来自四川,51190356152,妹妹猫
7130898087337722636,营养不能改变基因，但可以改变基因的表达。,0,0,0,2022-08-12 16:08:28,来自辽宁,16449667738,249582658
7131938246078726925,能做基因修复吗,0,0,0,2022-08-15 11:24:18,来自广东,3191399215,上善若水8332560
7131919542368027396,就这样还生二胎？,0,1,0,2022-08-15 10:11:59,来自北京,61859531818,李艳香30
7131956057731695400,如果夫妻是一个地方的那就是水土饮食,0,0,0,2022-08-15 12:32:48,来自山东,53542742588,藏叉
7131968557743014671,饮食不健康，作息时间不规律。,0,0,0,2022-08-15 13:21:32,来自湖北,93245794040,明心见性空
7131925911049372457,基因造成的,0,0,0,2022-08-15 10:35:51,来自江苏,50014392204,猫咪858585
7131972942585594661,从你家的环境，作息，饮食找问题,0,0,0,2022-08-15 13:38:41,来自江苏,85036004187,裕美咨询—戴老板
7131929860381311751,还没看完的时候以为生活习惯导致的呢,0,0,0,2022-08-15 10:51:44,来自青海,4034808399,南宫影汐
7130876690498093865,这也真是罕见[捂脸][捂脸][捂脸][捂脸][捂脸],0,2,0,2022-08-12 14:44:27,来自湖南,1534560038555486,用户宣宝奶奶
7131935494715851527,是不是房子周围有放射性物质？,0,0,0,2022-08-15 11:13:47,来自四川,62594540074,悠心探玉月
7131954656754090792,所以基因真的很重要。,0,0,0,2022-08-15 12:27:21,来自浙江,99638614734,王一诺爸爸
7131939597797442344,基因遗传,0,0,0,2022-08-15 11:29:01,来自广东,5937617638,1023专家
7131965121790411550,这年头，没病变罢，若有一查都是这癌 那癌！看淡、看透也就那么回事了，顺其自然了,0,0,0,2022-08-15 13:08:39,来自陕西,88786510207,静谧修儿
7131973590203351845,仔细想想，比新冠可怕百信的病多的是，国家怎不能拿出防新冠的气势攻克这些病毒？完全是新冠而非其它并,0,0,0,2022-08-15 13:41:36,来自山东,1020785030603021,端庄优雅辰星Hv
7131924298906419975,基因问题，自然选择，你要违背,0,0,0,2022-08-15 10:30:29,来自河北,3460755684,善解人意花猫
7131947689361277699,我记得小时候医院没人，基本都可以抗过去，现在医院天天爆满，,0,0,0,2022-08-15 12:01:35,来自陕西,109017893850,犁十针
7131924013517620005,现在看来结婚前还要去做个基因测试,0,1,0,2022-08-15 10:29:15,来自浙江,72186426214,44岁1978
7131952440005477160,我遗传了我妈的唠叨和我爸的不管事，我好难啊[流泪],0,0,0,2022-08-15 12:18:41,来自浙江,104902638543,热心橙子j4
7131950862356398888,免疫力一方面，食品安全查一下,0,1,0,2022-08-15 12:12:52,来自宁夏,5542819736,卓越十三男
7131967870719755022,癌这个子都怕,0,0,0,2022-08-15 13:18:54,来自湖南,67306984502,xcy206035287
7130895515121943337,估计跟家庭环境和生活习惯生活方式有关,0,1,0,2022-08-12 15:57:37,来自山东,35625608426812,兰丶
7131969571468247839,自身找原因吧。,0,0,0,2022-08-15 13:25:49,来自北京,50314084816,手机用户胖妞
7131954082327069443,家族遗传或生活方式,0,0,0,2022-08-15 12:25:48,来自广西,4885175933,畅所欲言中
