7131960568239358756,自带癌症基因，假如自身免疫力强大，癌症估计不会发生。,21,45,1,2022-08-15 12:50:33,来自四川,5993561314,茉苿
7131961247980864294,目前为止。。我父母家族四代以内还没有一个癌症。。而且除了我妈妈心梗走了。。其余还都挺长寿的。。应该是基因好的原因。。,11,25,0,2022-08-15 12:53:25,来自新疆,109508246075,卉0999
7131954471814693647,我们村也是有一家人，老公公，老婆婆，两个姑娘，两个儿子，两个女婿，三个外甥都是癌症，这种遗传真的很可怕,9,16,0,2022-08-15 12:26:42,来自云南,3808653239,爱喝矿泉水呢妮
7131205429807891239,我妈妈的爷爷3.40岁就去世了，妈妈的奶奶没改嫁带大了四个儿子。我外公也在我十一二岁的时候就去世了，60多岁吧，不知道是什么病就知道每天吃很多药还咳嗽厉害。我小舅舅是我妈妈的哥哥59岁肺癌去世，第二年他的女儿又鼻咽癌去世才36岁。我妈妈的堂哥也在40多岁的年纪肺癌去世，另一个堂弟40多岁没有病在睡梦中去世也不知道是什么原因！我爷爷奶奶这边都是寿终正寝都活到了80多岁，爸爸五姐弟现在最大的70多岁最小的姑姑也50多岁！,2,3,0,2022-08-13 12:01:06,来自湖南,95656891881,建平3567
7131960786125161231,结婚前看对方长辈是否健在？是否长寿？过世的死于什么？基因影响子孙后代，所以美貌智慧健康基因尤其重要。,7,36,2,2022-08-15 12:51:10,来自重庆,9822786466,欧阳诺菲
7131953634698986273,"痛心[流泪]
癌症啥时候能治愈",18,33,1,2022-08-15 12:24:19,来自山东,94329185693,寂静欢喜Z
7131930598088393484,我同学的爷爷是肺癌去世的，他才38岁也是肺癌去世的，他从高中毕业就去了部队当兵，然后一直在部队服役升为军官，生活规律不吸烟不喝酒，部队在深山，所以千万别说饮食起居，基因遗传病很可怕,0,2,0,2022-08-15 10:55:02,来自广西,6430137090,冰儿89179221
7131949485869449984,认识的一个叔叔得了肠癌治疗2年还是走了，同一年才40多岁的儿子也查出肠癌，查出不到三个月就走了，是生活习惯影响还是遗传？,16,13,1,2022-08-15 12:11:35,,1346216481796587,善良星空ZB
7131954191924232997,所以婚前检测一下双方家族基因，会不会更好。我身边目前有个真实案例:表兄妹结婚，生育俩娃，俩娃现在20多岁了都还单身，正在找对象.......,14,29,1,2022-08-15 12:25:46,来自四川,92949437856,成都油腻老男人
7131939803608171267,我们家是6个患癌的，我是25岁查出来的乳腺癌，做了基因检测，属于遗传,14,47,3,2022-08-15 11:30:39,来自青海,4136354415,关于笑容
7131949960131691303,找对象还得做基因检测？,11,29,1,2022-08-15 12:09:51,来自上海,2493309649960622,健康3q2A
7130901798520898307,"癌症的治病不仅仅跟基因有关联，也跟生活，饮食，情绪心态等关联吧。看到文章，还是认可观点。
我爷爷是九十年代初患肾尿结石走72岁的。父亲兄弟八个，二叔是50岁肝癌走的，大叔70岁胃癌走的，父亲是老三、今年初也因胃癌走了，73岁。二叔的儿子肝功能异常，我家哥哥也是肺有问题。希望其他叔叔，兄弟姐妹都健健康康的吧。",1,17,2,2022-08-12 16:22:42,来自上海,870410977295886,上善若水0305
7131962385753539342,现在一生病就查家族史，动不动就是遗传，家族史，为什么以前没那么多病？以前没有家族史吗？现在吃的用的东西没以前环保，应该是主要原因,22,31,2,2022-08-15 12:57:52,来自贵州,59281095391,梦幻乐天派晚风
7131936072636187425,我外公外婆肺癌胃癌，爷爷直肠癌。但我叔叔姑姑目前还没有得癌症的。舅舅姨妈也没有得癌的。不知道我们这一辈有没有那么好运,31,34,6,2022-08-15 11:16:12,来自贵州,104689382229,尔鸽
7131958997686502157,这么说我爷爷活到九十四岁没有打过针吃过药，因为自己活够了！抑郁而死，我们子孙是不是遗传长寿了[翻白眼],8,7,2,2022-08-15 12:44:29,来自吉林,65241043215,梦的记录者1314
7130932377035490059,癌症与日常生生活息息相关，如净化水，塑料包装，化肥及增熟剂使用。尤其是水，都用桶装水或净水器，对人体细胞有结构上的改变，如PH值。参透压的改变，直接影响细胞及器管正常的新陈代谢。原古时代都靠天吃喝，有这多肿瘤吗？值得深思！！！,11,17,3,2022-08-12 18:21:18,来自广东,676903280715527,富足湖泊31
7131960786846745378,我爷爷奶奶都是八九十岁去世了，我爸爸妈妈都是五十岁去世的，我妈是尿毒症，我爸是脑出血，但是他俩都有高血压，现在我姨他们两个都有高血压，还有糖尿病，我婆婆脑梗偏瘫，高血压糖尿病，我老公他小姨也是高血压，唉我现在就害怕,12,7,2,2022-08-15 12:51:07,来自河南,65504623164,开心果祈祷中国平安
7131949588369949454,癌症第一因素是基因，外界环境只占一点点,34,92,5,2022-08-15 12:08:11,来自美国,566984986338616,东风无力百花残了
7130884237846479656,这种基因测试不知贵吗？是否可以进医保呢？,1,0,0,2022-08-12 15:13:47,来自浙江,60419214679,高山雪莲805
7131966142709187342,我隔房的三个堂哥，他们是亲兄弟，大的堂哥在19年7月中旬肝癌去世，三哥20年春节后发现肝癌做了手术，小哥去年春节期间发现肺癌，今年5月26号去世，现在三哥病情复发，在医院躺着数倒计时了。哎，真的是好惨。,0,4,1,2022-08-15 13:12:40,来自四川,63115685609,凤136681
7131910555233420039,做了基因检测，知道有遗传史，也不能摘掉这个基因，也不能根治，更害怕，以后得日子担心这个担心那个的,45,241,8,2022-08-15 09:37:13,来自黑龙江,6375237090,曼曼加油耶耶耶
7130886996146651945,我一同事年纪轻轻的肺癌，他爸爸姑姑都是癌症走的，后来女儿初中时查出白血病，现在就剩下老婆一人，很可怜。我娘家村上一户人家，父母80多健在，二个儿子肝癌走了，一个外甥也是肝癌,15,20,5,2022-08-12 15:24:31,来自江苏,1081531341735184,梅要幸福哦
7131938704365093640,第一次听说癌症会遗传！,71,71,10,2022-08-15 11:26:29,来自陕西,59095494838,栀子花开一夜秋
7131963285515469603,癌症基因的家族聚集性,0,9,0,2022-08-15 13:00:53,来自甘肃,795681735320652,飞舞的三叶草
7131935981305611048,前几年我做过基因检测，好像是得精神疾病的风险大，老年痴呆那种，好担心未来有一天自己会忘记家人，忘记孩子[泪奔],19,25,2,2022-08-15 11:15:11,来自北京,51508672534,MO南夕
7130885357348242183,好在科技越来越发达了可以预检各种各样的癌细胞基因[赞][祈祷],1,2,0,2022-08-12 15:18:37,来自湖北,92521965686,彭大侠812
7131910702289912617,以前喜欢一个男生，因为都是一个地方的，家庭啥的都比较了解，我妈死活不同意，我问她为什么不同意我们在一起，我妈说，他爸爸有癌症，说我跟他一起，怕他有遗传，而且家里有个需要照顾的人，我跟他一起会很苦，我当时也没觉得咋样，不过可能我们缘分也不够，突然有一天，他要结婚了才告诉我，我哭了好久，他说最觉得内疚就是我，所以还是要跟我说一声，从那以后，我们再也没有联系过了。,61,79,12,2022-08-15 09:37:21,来自湖北,98022836420,执着的原野8E
7131922228723057422,别总上医院躺着，我肝肿瘤，我查出来了就吃中药了，草药，吃差不多一年，四五年前面事，现在活得好好的，挣钱养孩子，没死，每年有几次去医院复查，看看有没有变化，都还好，各功能都正常，那东西也没长大,18,69,5,2022-08-15 10:21:55,来自福建,102989921224,洒脱的清泉pKew
7130845754440188683,甲状腺未分化也能治疗，牛，愿越来越好！,8,19,2,2022-08-12 12:44:54,来自浙江,106877754872,彬28528
7130880974061552415,我父亲鼻咽癌[流泪]我大姐宫颈癌[流泪]我哥鼻咽癌[流泪]我也逃不了[流泪][流泪][流泪][流泪][流泪][流泪][流泪][流泪][流泪][流泪][流泪][流泪][流泪][流泪][流泪][流泪][流泪][流泪][流泪][流泪][流泪][流泪],16,4,4,2022-08-12 15:01:37,来自广东,94808091015,萤火虫9803
7131904659622642471,脑梗或者老年痴呆会有遗传吗？,83,26,3,2022-08-15 09:14:20,来自江苏,3882761391,花开茶靡29046942
7130907105456177961,癌症遗传基因太可怕了， 提前预防吧，加强锻炼，千万不要吃发霉的和烧烤类的食品。身体要旦检查早预防。才昱保障生活质量的根本。,1,2,1,2022-08-12 16:42:28,来自河北,3883070059451859,朝夕民生
7131935326939317005,癌症就是遗传，前美国总统李根姐姐妹妹父亲都是癌。我还是8几年看过的一个报纸说的。但有的遗传概率低有的概率高。比如我们村里有一家人她儿子和我儿子是发小，他儿子十二岁就肝癌走了，这个小孩的舅爷就是他妈妈的舅舅都是肝癌走的，这小孩他妈去年没的也是肝癌走的60几岁。还有我们村里娶回的一个媳妇，离我们村不远她奶奶骨癌走的她30左右岁就也是骨癌走了，据说她叔也是癌症走的。由此可见，确实有遗传性。,20,54,7,2022-08-15 11:13:05,来自山东,53495214448,家是一盏明亮的灯1357
7131924696324916009,这家人也太不幸了，竟然8人都患有癌症。多亏这女人想到了科学检测，才算弄明白了什么原因。,9,35,3,2022-08-15 10:31:22,来自江苏,1543353839399891,自由百香果GH
7131909521525752611,都8个人了还没有医生建议做基因检测吗？上个月我母亲肺癌早期，在南京鼓楼医院做的手术，里面主任已经建议最好去做基因检测了，把医院的切片报告带给实验室的人，他们都说没有必要做，最后还是做了，家族没有过得癌症的,49,48,15,2022-08-15 09:32:26,来自江苏,52039198079,大牛大牛不吃青草
7131965037015040771,以前是因为科技不发达吗？基本很少听说，现在经常听说这病那病的,2,2,0,2022-08-15 13:08:29,来自浙江,2674432825887182,儒雅橙子g8
7131907420284125990,卵巢癌遗传吗,33,28,6,2022-08-15 09:25:00,来自江苏,1310270155133856,坦荡的风铃VE
7130976477302293285,我大侄子一家四口一个喉癌三个肝ca！儿子14岁肝癌死去女儿大学毕业肝癌死去！侄子喉癌65岁去世侄媳60肝癌去世！侄媳父亲兄长均肝癌去世！最可怜的一家人！,0,0,0,2022-08-12 21:11:47,来自湖南,22650186782,端庄优雅荷叶V
7131912351049237261,老公的家族应该就有癌症的基因 一个叔叔胃癌去逝了 老公公也是胃癌 治好了 现在又得了白血病 另一个叔叔食道癌在治疗 一个姑姑胃癌在治疗 而且也都淋巴转移了,18,39,6,2022-08-15 09:43:44,来自吉林,6722944950,一片虚幻
7130846651749024524,基因检测还是必要的。我的家族中有4位直系亲属确诊癌症，我也很想做基因检测，为自己，也是为了孩子。,12,18,4,2022-08-12 12:48:30,来自云南,54924560914,自在的德才兼备咖啡zK
7131914375132775179,我认识一个老人她家丈夫家族就是的，好几个都是癌症去世，而且年纪都不大，最小的侄女二十来岁就生癌，她老公及兄弟姐妹也是五十多就癌症。想反她家这边就很长寿，父母九十多了还行动自如，姑妈也是，这个真的就是基因遗传,19,48,4,2022-08-15 09:52:17,来自江苏,22611156956,没有我自己
7131917328215868160,我遗传了妈妈的牌瘾,68,140,9,2022-08-15 10:02:36,来自上海,111581803461,小猪佩塔
7130930165026718471,照这么说我也难逃癌症哦：爷爷爸爸奶奶都高血压；大伯高血压走的！外婆心脏病去世；外公肝癌去世；我妈肺癌现在动手术两年了；小姨乳腺癌4年了！这基因也是绝了,0,3,1,2022-08-12 18:12:33,来自广东,108372881217,泽野
7131909375840912163,有这种家族遗传病的要早点买重疾险,39,52,4,2022-08-15 09:31:59,来自浙江,56835647068,彩云飘飘EZ4f
7130891826911167273,我奶奶癌症去世，结果我大伯二伯爸爸二姑都是癌症去世，就大姑是正常去世，还有小姑活着，但愿她能健健康康的。我们这下一辈目前为止还好，还没有亲戚得癌症，反正就是自求多福吧[祈祷],0,8,1,2022-08-12 15:43:17,来自四川,3905204044,微光633
7131963348502676224,西医叫基因，遗传基因怎么来的呢，其实还是佛法的因果，万事万物皆有因有果，所以佛劝人向善，善恶影响深远，祸及子孙后代,8,22,5,2022-08-15 13:01:10,来自陕西,105736825474,xlkhgy
7131936794865746728,与饮食卫生有很大的关系，刀，砧板，筷子，碗，盆，，，，发霉，有时候肉眼看不到，长期吃了就会病变，所以，现在的人不愁吃，不愁穿，伙食非常好，但是，就是不注意厨房卫生，后果很严重。这也是过去人平均寿命短的主要原因。,13,26,3,2022-08-15 11:18:09,来自江苏,2808385258,和气自然生财
7131939603388482319,家公家三兄弟也都是癌，大伯肝癌，二伯食道癌，家公肺癌。他们每一个人的生活习惯都不好，大伯是营养差，二伯是爱干吃方便面(一买一整箱)和烫的东西，家公则是抽烟厉害同时爱喝浓茶长期不外出就看电视，电视可以24小时开机。纵观他们三人，再看我婆婆，也只能听天由命，说了也没用,9,22,9,2022-08-15 11:29:01,来自湖北,2211823043487320,雅洁凤雅
7130885776644637481,我父亲兄弟五个，四个鼻咽癌，爷爷也是奶奶子宫癌，就是爱吃腌制咸菜，我们下一代，不怎么吃咸菜不喝酒不吸烟，最大的快70了，身材都好者呢,0,11,1,2022-08-12 15:19:51,来自北京,110767155055,清爽糯米Hs
7131911789842793229,很多病都有遗传性，婆家奶奶兄弟姐妹几个都是癌症走的，公公前些年就帕金森了，当时还不到六十，我家两个孩子，其实我也挺担心的，后来意外怀孕三胎就果断做了。,6,22,2,2022-08-15 09:41:25,来自河南,111083950660,微微雪碧
7131919610055803686,那这个家族的孩子找结婚对象的时候会告知对方家族的这个遗传病吗？,1,7,1,2022-08-15 10:12:20,来自山东,3027528036,无寻857
7130886437218140969,有一段时期找对象很奇葩的，有些女孩找对象要找沒有公婆的，免得嫁去以后要恃奉公婆，还碍眼，后又发现家里长辈寿不长的，也会影响下一代的身体健康，才消停了不在乎对方父母都长寿活着！寿命长短，多少和遗传基因有些关联。,2,14,2,2022-08-12 15:22:26,来自广东,3214616430385547,智勇双全辰星Fp
7131956420543202051,癌症到底传染不传染人？,7,4,0,2022-08-15 12:35:03,来自安徽,716507700274199,颍风
7130863114937336607,大家不用担心，如果一个病症变成常态化的时候，意味着这个病快被攻破了,1,3,0,2022-08-12 13:52:08,来自山东,1855596980090813,爱思考的湖泊S
7131942112563888907,这样遗传的，后代可不可以预防？有什么手段可以提前干预呢？,1,3,2,2022-08-15 11:39:31,来自广西,101321466822,凯妈思瑗
7131945676690686734,遗传是一方面，食品健康问题是关键，希望国家要加大力度管管了,0,10,0,2022-08-15 11:53:10,来自湖北,8417815040231,茶颜悦色C
7130858783169037096,找对象一定要了解对方家庭的健康状况。,21,60,2,2022-08-12 13:34:56,来自天津,2031514706525277,心存善念天感之
7131971821888684834,"我爷爷80多岁，今年得胃癌去世的，我外公80多岁，前几年得肝癌去世！都是八十多，我奶奶跟外婆都健在，也是八十几快九十了…
我父母那一辈兄弟姐妹12个，目前平均都是五六十岁，没有一例患癌！
我这一辈二三十岁，二三十个，没有一例患癌！
请问我们家遗传癌症的风险大吗！",1,0,0,2022-08-15 13:34:12,来自安徽,5431020187,花爷来了
7131959394535031588,肝癌会不会遗传？我爸兄弟四个都是肝癌，我爸的表兄弟也有好几个肝癌，但是我爷爷奶奶那一辈没有肝癌，我们这一辈也还没检查出肝癌，肝癌会隔代遗传吗？[流泪],6,1,0,2022-08-15 12:46:05,来自浙江,58928021591,not途径
7131936908565185320,为什么古代没有遗传癌症病人也很少,9,3,0,2022-08-15 11:18:35,来自浙江,4452275950,单纯雪碧U
7130875930347569954,家族遣传病很历害，我家老公妈妈唐尿病，我老公妈妈生了九个孩子，现在就我老公，和他五妹，四妹没得唐尿病，那六个现在全得唐尿病了。,4,4,4,2022-08-12 14:41:24,来自黑龙江,95132465111,快乐百灵鸟6
7131905072400958240,好多 病都不好治动不动就是好几十万，能 治的治 不能的就听天由 命了。我腰突和肩周炎好多年了不是什么大 病但是也很磨 人，大家还有什么法子吗？,18,23,2,2022-08-15 09:15:45,来自福建,4279764075417768,博学安德烈娅6d1
7131953773144130345,婚检！！！,5,3,0,2022-08-15 12:23:57,来自陕西,62417762490,长安美玉
7131952735372460840,肝癌，遗传吗,9,2,0,2022-08-15 12:19:46,来自河北,52789472756,媒体V
7130831183168340775,做了基因检测 然后呢…该🉐️不是还得得 无解了,5,30,5,2022-08-12 11:48:32,来自北京,100870688334,四月天晴ing
7130875042342454030,我老婆的大姨肺癌，她女儿子宫癌，儿子胃癌，媳妇肝癌,2,3,0,2022-08-12 14:38:29,来自广东,102717021274,快乐饺子cL
7131948439545922338,"农村老家4兄弟，3个都是肝癌去世。留下的那个因为是老师，肝也有问题，因为在镇上教书，经常做检查和调养。但长期也在吃药，人也很瘦。如果他也是在农村估计早就走了，对了去世的几兄弟年纪30几岁的，40岁左右。
还有在外工作期间，碰到一同事，状况跟我老家那一家差不多，几个兄弟都是肝癌走了。",2,3,1,2022-08-15 12:03:25,来自浙江,1954536320,浩瀚星云
7131946762624992035,我外公外婆都是癌症走的，我爷爷奶奶80多身体还行。这种遗传谁的呢？,1,1,0,2022-08-15 11:56:47,来自四川,2088721591836957,小禄禄8
7131930546287952640,我外婆三姐弟全部癌症，同一年去世的，到了我姑妈癌症，乳腺癌，子宫癌，手术放疗化疗，医院常客。我妈妈鼻咽癌，确诊到过世五年多，确诊前还被市人民医院当做偏头痛误诊了1年多。也就是从开始身体有异样到去世有接近7年。奉劝大家去找中医，看西医明明白白的死，化疗放疗做到不能做为止，切除手术都会转移。尽早看中医糊里糊涂的活，看中医别去那些被西化的中医院，挂着中医院的牌子干着西医院的事！要看就去找知名的名老中医，花几百上千诊断费也各种西医检测强！,6,13,1,2022-08-15 10:53:53,来自广东,50922477968,智者达伦
7130861485873513229,还没发生疾病的赶紧预防，然后把保险买上，首先是600万的医疗保险，然后是150万的重疾险（确诊即赔）终身寿险，500万意外险，这些都买上,8,8,0,2022-08-12 13:45:47,来自四川,6016301016,Mak
7131948209521328928,万般皆是命,3,82,3,2022-08-15 12:02:59,来自河南,92327923382,这个人很懒啥也没有留
7131935917828817664,为什么没人去指责大环境污染，祖辈都把你们带到这时代了，偏偏都在这一阶段爆发，还单单去指责基因，如果真不行，断层了。甚思呦,1,2,0,2022-08-15 11:14:52,来自江西,63889804811,金秋子夜
7130841677451019016,像我一个堂叔就是遗传的肝癌，外公、舅舅、母亲都是四十几五十来岁去世，现在另外一个兄弟肝也是有问题了,5,10,0,2022-08-12 12:28:52,来自广东,85722028921,桂K369147
7131916810466706210,我家里边，爸爸是肺癌，妈妈乳腺癌，奶奶食道癌。大姑是肝癌，他们都去世了，家里就剩我自己我好害怕。我才25岁。,27,9,1,2022-08-15 10:00:41,来自江苏,63615215336,郯城刘德华
7131960015715681039,一般这种基因遗传取决于父系一旁，有没这个可能？,2,1,0,2022-08-15 12:48:16,来自浙江,5502855681,山垟人
7130846254417937186,估计跟家庭环境和生活习惯生活方式有关,5,16,1,2022-08-12 12:46:13,来自上海,3657893541,金花大姑
7131910930061427467,区里一个领导，他父亲，妹妹，他自己都是胰腺癌不在了，可能他爷爷也是。他每半年检查一遍身体也不行，去医院看他，听他说这是遗传，从有癌变信号到癌症晚期发展极快，他检查完身体一切正常，到发现癌变到死亡一共不到三个月,3,11,1,2022-08-15 09:39:00,来自河南,4479006119,龍寵鑨窿
7131943507958285070,癌症会遗传给下一代的，我堂大伯父肝癌五十多岁走了，他儿子也是肝癌五十多岁走的，孙子也是肝癌三十多岁走的，婚都没结，可惜了！,0,3,0,2022-08-15 11:44:24,来自广东,110225743760,099099小渔
7131936141170967296,唉，我不孕不育，担心遗传给小孩子,1,1,0,2022-08-15 11:15:39,来自上海,1424578796600920,上岸先斩意中人
7131973457575035661,我的父亲也是胃癌去世的，享年七十六岁，我现在也有胃病，是不是遗传了父亲的？,0,0,0,2022-08-15 13:40:59,来自甘肃,3755548301858973,运筹帷幄露珠TcG
7131908751422358312,就是检查出来，判定遗传基因导致，又能如何？,6,13,0,2022-08-15 09:29:27,来自陕西,4072396687,夜听风雨李布衣
7130860678634193676,邻居是一位教师，他家几年内相继几个亲人癌症去世，他爷爷癌症，父亲癌症，姑姑癌症，他叔叔癌症，他也是，可见，遗传基因还是非常重要的,3,9,1,2022-08-12 13:43:11,来自安徽,6452230205,开朗大方博学的百灵鸟
7131899541670363939,患癌还能有什么办法，能治就治不能治就听天由命，八人患癌谁治得起。,10,54,0,2022-08-15 08:53:48,来自湖北,98011691660,因墨堂
7131973699305030440,我老公的爷爷，堂叔糖尿病，奶奶胰腺癌，爸爸高血压，叔叔胃癌，姑姑乳腺癌,0,0,0,2022-08-15 13:41:18,来自江苏,52280940052,弃医从商的俩宝妈
7131973368911332130,爸爸以前的前辈都没有癌症，爸爸有癌症会不会遗传呢？,0,0,0,2022-08-15 13:40:02,来自安徽,892411581565844,春华秋实L
7130838025474966276,糖尿病可以基因检测吗？,3,5,0,2022-08-12 12:15:01,来自浙江,101863319105,lingchaoming1975
7131973122177303300,确实有些病是伪遗传的， 我们家族是有高血压遗传 ，我爷爷是因高血压 逝世的，我大伯也是我叔叔也是,0,0,0,2022-08-15 13:39:59,来自福建,105307881930,王雪卿wangxue
7131970718220534564,多么期待权威专家能研究出治疗癌症的药物，为癌症患者重新获得新生！[祈祷][祈祷][赞],0,0,0,2022-08-15 13:30:23,,141177015515758,欢快帆船HL
7130890356522386206,细看身边上了年纪的，感觉身体不舒服，一查就癌症，今天是中元节，听到好多人都说，今年七月节怎么这么人过中月节的。,0,0,0,2022-08-12 15:38:03,来自安徽,6004432141,晴天75291840
7131972599638491912,很早以前就听说过癌症可以遗传[捂脸][捂脸][捂脸],0,0,0,2022-08-15 13:37:36,来自湖北,4309712333729470,用户可可家家
7131973987135144719,科学这么发达了癌症什么时候能治愈呢！,0,0,0,2022-08-15 13:42:27,来自黑龙江,110272196343,爱生活的火车2T
7131918822034506508,很多东西都遗传的，深埋在基因里，甚至包括性格，习惯……,1,16,2,2022-08-15 10:09:34,来自吉林,51097595710,少年壮志没烟抽
7131927795759973134,我奶奶之前有肠癌 治好了 这两年有两个姑姑也得了癌症 医生说跟遗传因素有关 好在奶奶的这个只传女的 而我这两个姑姑正好都只有儿子,0,4,0,2022-08-15 10:43:39,来自陕西,2724808803,积极的豆花LS
7131962376102282025,我老公家，公公胃癌，婆婆肠癌，婆婆的大哥和小弟都是肝癌（都在50岁左右走了）婆婆的弟媳肠癌，婆婆的姐姐子宫癌（也在50岁走的）,0,0,0,2022-08-15 12:57:22,来自江苏,2722039186076404,乐观的画板qr
7131951416041702181,优生学的意义就在这里，不想踩坑的话，婚前可以调查一下对方家族病史，年长家庭成员患癌率超过50%的建议pass，当然真爱除外。,3,15,1,2022-08-15 12:15:09,来自山东,51394024461,朔雪罡风
7131946308151804685,我大姨和我的舅舅都是肝癌去世的，我姥姥姥爷，爷爷奶奶都没有癌症 会有影响吗？,0,2,0,2022-08-15 11:55:42,来自河北,55191653991,1493043
7131961915698037519,"上工治未病，中工治欲病，下工治已病。黄帝内经 几千年前就为我们揭示人体生命的奥秘！一个人有病症出现，身体会早早的发出预警信号。
 然而随着所谓的现代医学技术的发展与提高，却并未能阻止和治疗这些情况和疾病的发生！
 这是什么？传统文化的丢失！！！而不是所谓的基因遗传！！！",0,5,1,2022-08-15 12:55:45,来自内蒙古,1556498373681011,九原阿水
7131908611504227113,我过敏紫癜反反复复,2,2,1,2022-08-15 09:28:55,来自黑龙江,95468046183,趙潇璇
7131948373868528399,大概率是生活习惯上的某个点导致的，或者是生活环境，不然只是遗传一说，可能不能完全解释。,7,26,3,2022-08-15 12:02:59,来自浙江,3306340919,就是来怼人的
