7131971817254437663,为啥从前得癌症的特别少，现在得癌症的太多，过去不遗传？现在遗传？是大环境变了，还是自己的生活方式出了问题？不应该一有病就怪祖先吧。,0,0,0,2022-08-15 13:34:48,来自辽宁,98263895928,用户清静致远
7130846949410538279,相似的性格造成的,1,2,0,2022-08-12 12:49:51,来自上海,2845130098477374,喵喵喵98
7131961466164757288,遗传性肿瘤。建议不要结婚。,0,2,0,2022-08-15 12:53:51,来自辽宁,6111091655,有趣的奶茶G8
7131962394863354663,是啊，所以说找男女朋友时，都要看其家族的长辈，同辈是否健康长寿，这是由基因决定的，有必要进行考量。,0,1,0,2022-08-15 12:58:06,来自云南,55456903008,坦荡夏日菲儿
7131911709282796300,什么时候我才能患癌症啊，可以早点解脱，真活够了！,12,6,1,2022-08-15 09:41:35,来自陕西,3781594651,湛卢君
7131950039936844548,是食物引起还是基因遗传,2,7,0,2022-08-15 12:10:24,来自广西,80519465645,随缘6337
7131950335849497348,网上说癌症不会传染，但是有器官移植了癌症患者的人又患癌的很多列子,3,5,1,2022-08-15 12:11:29,来自云南,52554134587,中华家的接班人
7130832534204318471,基因检测广告,2,31,1,2022-08-12 11:53:41,来自浙江,20437385729,李全220567433
7131959016951431970,容易长痣和肉瘤的体质，比较危险,1,0,0,2022-08-15 12:44:20,来自福建,6017598962,小少76025051
7130987360967426846,基因检测要的，能够及时查出病因，找出治疗方案。,0,0,0,2022-08-12 21:54:10,来自江西,738511622247639,千娇百媚
7131973196605588254,我爷爷食道癌，我父亲肝癌，我连续三年肿瘤指标多高但还不是癌,0,0,0,2022-08-15 13:39:56,来自安徽,241502964944147,佛在云端
7131951207802880779,我们村兄弟四个都是肝癌，而且都是五十岁左右去世的，他们就是遗传造成的,0,1,0,2022-08-15 12:14:37,来自北京,111653645222,货真价实绝味鸭
7131971288830673702,这种遗传的真可怕，代代遗传下去，不能抑制吗？,0,0,0,2022-08-15 13:33:03,来自安徽,111042964917,铁树也开花结果
7131948306154128166,有一定遗传性，但不是都会遗传.建议家庭长辈或近亲有，自己去做个基因检测，有的话可以预防和重视，没有就安心了。,0,1,0,2022-08-15 12:03:25,来自浙江,105321355475,机智的湖泊kQ
7131972015774270238,知道是基因问题以后能怎么办呢？癌症也不能预防，只能不断的体检,0,0,0,2022-08-15 13:35:01,来自安徽,102482753208,藤上的风铃sss
7131951667121095432,我老公公是血癌，公公是肾癌俩人都已去世，但是二叔和三叔现在正常，这种遗传吗,0,1,0,2022-08-15 12:16:07,来自山东,4305301694054903,勤快的阿牛
7131967572975239948,我妈肠癌，后来扩散至肝去世。我弟肠癌早发现手术切除，已正常生存21年了。我婆婆90岁发现胃癌后去世。我小姑胃癌早发现，手术后已生存16年。,0,0,0,2022-08-15 13:18:36,来自福建,59102306629,随风起舞随运而安
7131971323705787176,我公公公，还有两个叔叔（我公公的兄弟）都是得癌症去世的[泣不成声][泣不成声][泣不成声],0,0,0,2022-08-15 13:32:06,来自河南,3806259143,瞳27666376
7130919124087603975,有一堂婶，她的父母和两个哥哥一个姐姐还有一个弟弟和她本人都是癌症死的，她的两个儿子也是癌症,0,1,0,2022-08-12 17:29:37,来自安徽,50972795758,354524206898
7131968585651634974,这癌症不定是遗传，现在环境就有问题，人们吃的，喝的多多少少也是问题。,0,4,0,2022-08-15 13:21:55,来自山东,4488727745,易名morning
7131971937701724959,癌症体质家族，我认识的一个朋友就是，她们家父亲那边的直系亲属，没有活过35岁的，我朋友也是30岁那年患癌去世的。,0,0,0,2022-08-15 13:35:05,来自四川,4155779852535627,Ellie81192
7131970140740010792,发现现在得癌症的年龄都提前了,0,2,0,2022-08-15 13:27:29,来自广东,85996963437,辣木辣木
7130910598778831656,几十年前听医生讲，若家庭（三代内）个别有不好病史，提早的可查可防治可调整生活，工作，饮食习惯，为后来少花钱少烦恼有个健康的身体。当然，现今科技发达，即查即治。,0,0,0,2022-08-12 16:56:03,来自福建,2339387829129935,用户2018102018102乐
7131942378084041484,癌症不是遗传的，只是生活方式一样，所以患病也差不多,0,2,0,2022-08-15 11:40:19,来自河南,54390747602,吴静琴健康饮食
7131962049357775656,我就说癌症会通过基因遗传，我们村好几个父亲癌症死了，儿子四十几岁查出癌症，孙子也经常生病住院[恐惧][恐惧][恐惧],0,2,0,2022-08-15 12:56:11,来自江西,93915979869,倦鸟75432
7130903942019842831,我家亲戚是医生，他告诉我找对象要了解家族病史。,0,2,0,2022-08-12 16:30:15,来自山东,4062149487,MiaT
7130983924909949711,病人的希望啊……,0,0,0,2022-08-12 21:40:30,来自上海,1341059431936988,进取星辰tZ
7131968863218434846,做了基因检测有什么预防措施吗,0,1,0,2022-08-15 13:23:07,来自河北,97876627889,荷锄田园
7131960807415907108,基因问题，我婆婆的家族也，一家七口，其中5个是肺癌走了的，好在我婆婆暂时七十多还健在[祈祷][祈祷][祈祷],0,1,0,2022-08-15 12:51:51,来自广东,73926790038,定制专业户
7131962040016896776,癌症好可怕,0,1,0,2022-08-15 12:56:20,来自北京,2472132772904060,敏锐生活家5w
7131972835018998566,我觉得三高也有家族基因,1,0,0,2022-08-15 13:39:08,来自浙江,4138216614793735,luciazz
7131928865441874703,谈癌色变，年青人交伴侣还真要看前几代人的长寿基因，有癌的家庭慎重考虑一下，就怕遗传啊，一个病人拖累几代人的家庭不在少数吧,0,2,0,2022-08-15 10:47:26,来自四川,70384341176,淡看人情
7131973466760758016,定期做好体检，早发现早治疗,0,0,0,2022-08-15 13:40:38,来自四川,989208830550957,萌猫萌宠
7131950123844256527,癌症也会遗传吗？第一次听说,0,0,0,2022-08-15 12:10:03,来自湖南,10830391065,遗忘142085620
7130837003843027727,以后不愁房子车子了。找老婆找老公估计要看家族基因了，有没有这些不好的基因[抠鼻],2,13,0,2022-08-12 12:10:24,来自江苏,52378846009,Ji阿伟6686
7131938747260257060,是不是应该与饮食有关,0,0,0,2022-08-15 11:26:12,来自山东,5684442136,笔墨情怀我的爱
7131924243465487117,遗传癌症基因最可怕…[捂脸][捂脸][捂脸],0,2,0,2022-08-15 10:29:53,来自四川,111355236223,1春江水暖鸭先知
7131902262800712483,这么看来我们家族基本上四十多岁就糖尿病也不是啥大事了[我想静静],24,15,1,2022-08-15 09:04:30,来自江苏,3269381239,诸葛村夫2号
7131951448833131298,肝癌也是遗传性很大,0,1,0,2022-08-15 12:15:03,来自海南,52765653785,ff听自己唱歌
7131941600476824357,好可怕！还会有遗传！,2,7,1,2022-08-15 11:37:08,来自江西,3170616009037691,用户拥抱梦想
7131974085017731880,这病能治愈那有多好,0,1,0,2022-08-15 13:42:53,来自浙江,108649830535,高峰蛋蛋妈
7131944145131750151,癌症有遗传基因，体检要定期，早发现早治疗,0,0,0,2022-08-15 11:46:56,来自广东,3725520201,玥曈
7130859955363709729,三十岁还叫女孩，那我就是少女了[笑哭],3,4,2,2022-08-12 13:40:15,来自湖南,111377950198,小梅故事汇
7131965189309793038,万般皆是命，半点不由人，别紧张过度，没病也吓病了，情绪好，养成良好的习惯，坏基因，在你身上也会变好。,0,1,0,2022-08-15 13:08:41,来自山东,2151095159752024,乐在其中候
7130916101571527439,基因遗传因素倒致一系列疾病,0,0,0,2022-08-12 17:17:28,来自辽宁,71896393733,梧桐雨26128
7130961044755055400,我同志哥哥膀胱癌，姐姐子宫颈癌，最近她查出乳腺癌，做了切除术。,0,0,0,2022-08-12 20:11:40,来自辽宁,2999896849006196,舒闽
7131973963710251817,看来每年的定期体检必不可少呀，及早发现问题就不会危害了人的生命呀。,0,0,0,2022-08-15 13:42:31,来自河北,237931602915763,活泼柑桔2u
7131932658187535142,我爸肺癌妈妈淋巴癌，我也担心,0,0,0,2022-08-15 11:02:52,来自广西,2801976087681767,小李爱吃糖
7131947409789240104,我公公的爸爸，妈妈都是癌走了，公公也得癌走了，婆婆也得癌走的，基因遗传也有一定原因，生活习惯也很重要。,0,0,0,2022-08-15 11:59:11,来自湖北,52713689990,宇旱
7131902845204742924,现在120万就能把癌症治好,25,6,2,2022-08-15 09:07:23,来自山东,92496306778,梦想有个p用
7131963882360488718,癌症也遗传,0,0,0,2022-08-15 13:03:34,来自江苏,5572501664,清澈心菲
7131942670024672000,一直不知道癌症真的会遗传,0,0,0,2022-08-15 11:40:56,来自四川,3545272074114476,无忧的豆浆7u
7130858569842410254,有钱人会这么刨根问底的治疗，没钱人只能老天决定命运。,2,6,1,2022-08-12 13:34:30,来自江苏,13529674653,zxf5411
7131954239400100644,机器设备越来越先进，医疗技术也越来越发达，早期查出来的越来越多，癌症也逐渐普及化，年轻化。,0,0,0,2022-08-15 12:26:12,来自浙江,2880351396173164,似水流年066
7131955835055555341,癌症也互相感染吗各位朋友们？,0,0,0,2022-08-15 12:32:12,来自新疆,3570863409989213,菲菲~好物
7130973675410719527,找对象一定先了解对方家庭父母有没有遗传病因，再结婚不然给后代带来疾病和痛苦,0,0,0,2022-08-12 21:01:12,来自江苏,54254858179,Zcdzcd1960
7131939037141091079,第一次听说癌症还会遗传的，还好家族里没有人有这些毛病！,0,0,1,2022-08-15 11:27:26,来自四川,81415589771,微笑很甜美
7130847932944859945,"化学未普及，造成人们对化学的毒害认知肤浅。
如我家装修，一年内南北通风，寒冬腊月亦如此，多盖一床被子即可。
半加工食品避开，新鲜始终贯穿。
再严格点，家里的胡椒粉、咖喱粉、面粉、淀粉等都放置零下18℃的冻柜，避免霉变。
注重自我防护很重要。",8,7,2,2022-08-12 12:52:40,来自上海,1209059994504020,z工匠
7130847075067167502,干脆不要检测，知道了治不了心里也不舒服,3,8,1,2022-08-12 12:49:47,来自广西,54945322403,七军
7131969947945009933,现在动不动解释不了的病就归咎于基因了，感觉生活习惯和饮食方式的影响更大！,0,0,0,2022-08-15 13:27:12,来自甘肃,59936054626,穷则思变则通
7131966361597362956,这个基因测序能不能加入到常规孕检中？,0,0,0,2022-08-15 13:13:58,来自山东,109138005318,冷夜风竹
7131964269029196582,我爸淋巴癌，我叔叔肝癌，我瑟瑟发抖🥶,0,1,0,2022-08-15 13:05:21,来自福建,111257440898,奇思妙想小天才
7131906220592218892,遗传癌症基因最可怕…,0,13,1,2022-08-15 09:20:43,来自陕西,826477801383456,太阳去哪了
7131927226798342946,幸好我和老公家人里都往前数三代没一个癌症病人，[祈祷][祈祷][祈祷],0,1,0,2022-08-15 10:40:57,来自四川,70384341176,淡看人情
7131962185110422311,我妈家族高血压和结石高发，我一个都没躲过。[捂脸][捂脸][捂脸],0,1,0,2022-08-15 12:57:11,来自河南,50222865781,125744744
7131923134961894152,希望医学发展研究出此类家族遗传病解决的方法。[加油][加油],0,0,0,2022-08-15 10:25:49,来自江苏,84559525230,菲飞论美学
7130912198532678434,看来以后结婚还要看家族有没有患癌症的人多不多啊，有多的可得注意点啊。,0,0,0,2022-08-12 17:02:23,来自河南,104876329381,桂花海棠562
7131925525446755075,水果蔬菜超过三分之一，穿紧身内衣，炒菜方式错误，吃寒凉食物，都与得癌症并且恶化有关系，所以还是病从口入啊,0,0,0,2022-08-15 10:35:31,来自广东,1821245500307419,荷糖约58
7131939983090549537,这种遗传基因突变的体质，能不能医学干预，能不能治疗啊，挺倒霉的。,0,1,0,2022-08-15 11:31:14,来自广东,566975809192574,橡树旁边的木棉
7130880022126658312,常人去医院看病，恐怕即便是专家也鲜于深刻的认知和诊断的必备条件吧。,0,0,0,2022-08-12 14:58:04,来自重庆,3117832689707191,天更蓝4304335797501
7131940822425158440,不是癌症遗传，是生活环境、饮食习惯的遗传造成的,0,0,0,2022-08-15 11:33:41,来自广西,739297979270736,生命食物缔造者
7131953968230171392,癌变基因是百分百会遗传的，这个目前没有办法。,0,0,0,2022-08-15 12:24:54,来自云南,52166006620,精彩秒秒现
7131921267678020386,孩子也携带这种基因 太可怕了,0,2,0,2022-08-15 10:17:51,来自新疆,2031519353810731,猫小姐～
7130974368511148840,基因检测都可以做吗？,0,0,0,2022-08-12 21:03:18,来自湖南,84968368534,菲帆雨
7130887726249181991,其实就是因为所谓的科技进步，导致环境各种污染，还有人工生殖医疗技术导致有基因缺陷的胎儿出生。,0,2,0,2022-08-12 15:28:17,来自广西,60019653650,秋枫LQ
7130876535766172455,环境育人，风水造就人生。象这个家族代代有这种不治之症，最好请一个比较精通的风水大师检查家族住宅和阴宅的风水，尽快处理，否则影响下一代。,0,0,0,2022-08-12 14:44:32,来自广西,800041056338167,ZQ2813v
7131957449845916455,我们家还不止8人，我岂不是也有基因问题?,0,0,0,2022-08-15 12:38:47,来自安徽,2852705555,minier
7131965523147227935,癌症遗传，据说癌细胞在一出生就在身体内，在合适的环境下就会被激活。,0,0,0,2022-08-15 13:10:01,来自内蒙古,4322883919693901,幸福河池2C
7131928354273559309,癌症是遗传的……,0,0,1,2022-08-15 10:45:43,来自上海,6351358630,天才小狮子
7130875674298467085,找到了病因，又能对症治疗，对患者来说真的很庆幸。,0,1,0,2022-08-12 14:40:52,来自河北,3971069539779308,思海姐姐
7131932415354323750,很多东西都遗传的，深埋在基因里，甚至包括性格，习惯……,0,5,0,2022-08-15 11:01:58,来自江苏,59918806867,大别山的姑娘你好吗
7131965303621468939,以前很少有癌症也是基因吗,0,0,0,2022-08-15 13:09:21,来自天津,4296554904,糖糖999
7130945714691605278,医学进步了，很多病都能检查出来了，找到病根对症治疗，应该都能治好,0,0,0,2022-08-12 19:12:52,来自河北,1890760925909310,60的生活
7131949468379153160,额。。家族里有超过两个得癌症的就要注意了吧，真么多居然都没有人去做基因筛查,0,0,0,2022-08-15 12:07:43,来自广东,2987727616,朝颜一样肆意
7130890253036503838,这是医学的进步，患者的福音。,0,0,0,2022-08-12 15:37:45,来自广西,1508127424914814,金海浪
7131953087191073574,可怕的基因[恐惧]还会遗传,0,2,0,2022-08-15 12:22:01,来自浙江,4340525641240317,徐伊娜娜
7131934899959284491,基因很重要。后天饮食习惯生活方式更重要。我们要健康生活，好好享受生活。,0,1,0,2022-08-15 11:12:16,,1868793144153469,有趣的冰淇淋5q
7131955819973460769,检测出来又能怎么样？基因的问题怎么防？只能是每年体检有问题及时治疗了,0,0,0,2022-08-15 12:32:47,来自广西,2229413239062907,春风得意LuLu
7131924628762903327,现在患癌人太多了,0,0,0,2022-08-15 10:31:36,来自安徽,2106309888710595,户名难寻you
7130937221049664297,这些患癌病人至今国际中无治愈的技术，只能延长几年的生命。这么年轻就将走了，深感同情。医学界应该着力研究有突破，以挽救更多的癌症患者，都搞得人财两空，多么痛心啊！,0,0,0,2022-08-12 18:39:26,来自江西,51544750598,明亮的蓝天1
7131920299566105352,很多慢性病都会遗传，不是连近视、鼻炎也会遗传吗？是不是慢性病会改变基因？,0,3,0,2022-08-15 10:14:54,来自上海,96708403654,sky星辰1
7130947933796664096,我感慨的是，医学那么倡明为什么人类还是对各种癌束手无策？,0,0,0,2022-08-12 19:21:22,来自广东,93864868558,自在冰淇淋P1
7131971001428460322,遗传真可怕,0,0,0,2022-08-15 13:31:04,来自山东,51927641936,热心船帆nk
7130895206329140004,这个癌症真的是会遗传的，好恐怖,0,0,0,2022-08-12 15:56:53,来自上海,1873191370491483,Amy 喵
7130940366911898406,还周围的我知道的不只一家，从爷爷到父辈都是癌症的,0,0,0,2022-08-12 18:52:28,来自四川,6692036776,搞镩镩
7131137706247078656,癌症在家族里有一定的遗传性。我兄妹三个都是癌症患者。哥哥肝癌姐姐子宫癌我乳腺癌。真是不幸啊！,0,0,0,2022-08-13 07:37:21,来自新疆,980385905254046,极速饭团6Z
7130863443707822848,基因太強大了，遺傳很難避免,0,6,0,2022-08-12 13:53:05,,102794934875,MissMingming
7131930747954414370,基因有问题，没办法的事情。,0,0,0,2022-08-15 10:54:43,来自广东,93894622292,愉悦的海洋Md困啃
7131947780654367495,我们这边结婚，还要打听一下对方家族是否人丁兴旺。没什么出入的话平平安安的，反的话人员总是会有意外。这是很大概率的事！,0,2,0,2022-08-15 12:01:19,来自广东,60723706292,吟180224391
7131929507523052326,有癌症遗传基因是不是不适合生孩子,0,1,0,2022-08-15 10:50:58,来自四川,6892869070,种花盆的喵喵
7131951389127312136,我怎么感觉挺正常的，我姥爷胃癌 我姥肺癌，我叔肺癌 俺二姑乳腺癌,0,1,1,2022-08-15 12:15:19,来自辽宁,4557265341,兔兔娜
7131952758034760484,可怕的家族遗传史,0,0,0,2022-08-15 12:20:22,来自山东,59547808048,元气轮船79
7131953439101223719,生死有命富贵在天，科学叫基因，宗教叫承负。有因就有果。万般皆是命半点不由人。有些事情己经超出人自己能掌控的范围，既然无能为力就只有顺其自然。,0,18,0,2022-08-15 12:23:08,来自四川,254726442071111,叶娃之恋
7131921910925263628,所以以后结婚家族史也要了解清楚,0,2,0,2022-08-15 10:21:13,来自湖北,67647828914,宣伶Y
7131966396703179554,我婆婆几兄妹除了老大身体比较健康，老三已经走了，老二，老四，老五都是长年吃药，我老公38也高血压，哎，人生呀,0,0,0,2022-08-15 13:12:52,来自福建,55719636313,仔仔147868271
7131949959976993571,家族遗传史，所以一定要定期检查。,0,0,0,2022-08-15 12:09:18,来自江苏,106747678082,Happy开心就好88
7131930243560506145,有这种家族遗传病的要早点买重疾险,0,2,0,2022-08-15 10:53:38,来自湖北,111192806520,用户福气盈门
7131945098212016930,如果早早差出有癌症遗传基因就不要生孩子，孩子好可怜,0,0,0,2022-08-15 11:50:19,来自山东,95995437702,轻风细雨回忆如沙
7131950545946493736,我大学一男同学父母三个弟兄都是肝癌 全部都走了！包括我同学2018年12月走的[流泪][流泪][流泪],0,1,0,2022-08-15 12:11:33,来自新疆,3991062766,红袖添香1030
7131954217874604840,很多东西都遗传的，深埋在基因里，甚至包括性格，习惯……,0,0,0,2022-08-15 12:25:38,来自广东,704108910355389,小小小船331
7130886974629872423,医疗科技发展得真不错哦！甲状腺未分化癌也能治了，真好！,0,2,0,2022-08-12 15:25:23,来自河南,66888900906,我心向暖1216
7131937212882682654,以后结婚得充分考虑对方的家族病史。。。,0,0,0,2022-08-15 11:20:11,来自北京,6205333894,挖煤葫芦
7131963616207323939,“比如罗女士的父亲有胃癌、肾癌、肺癌、结肠癌病史，经过治疗现在生存状况良好。”,0,0,0,2022-08-15 13:02:25,来自贵州,6341989186,教政治的刘老师
7130966109515711235,中医治未病未来会被更多人认可，也就是说保健品虽然没有治疗的功效但是可以提高免疫力，免疫力提高了一些慢性病也会好转。,0,0,0,2022-08-12 20:31:53,来自内蒙古,308318626130157,w米兰
7131935585765638945,我们村子今年去世四位老人，三位是癌症,0,0,0,2022-08-15 11:14:09,来自河北,62468260851,名字再长也有重复的
7131920644250026787,她运气算好的了，甲状腺癌是懒癌，不转移的那种，基本上带癌生存二十多年比比皆是,0,2,1,2022-08-15 10:15:40,来自安徽,84700012356,微微笑笑的向日葵
7131924779657511684,我爸这边也都是癌症，寿命都不长,0,0,0,2022-08-15 10:32:39,来自湖北,55952046327,丽丽173099927
7131939357527278377,做了基因检测，知道有遗传史，也不能摘掉这个基因，也不能根治，更害怕，以后得日子担心这个担心那个的,0,0,0,2022-08-15 11:28:11,来自江苏,3790758981679085,星星小雨点
7131910205441049348,甲状腺没事的,0,1,0,2022-08-15 09:36:18,来自上海,3894753469,凭窗听海
7131926931372638976,应该有家族遗传历史,0,0,0,2022-08-15 10:39:43,来自湖北,4385323405805095,幸福凌海0D1
7131945034211083015,身体还是要定期检查才好，可以早点发现早治疗,0,0,0,2022-08-15 11:50:22,来自江苏,72559896629,独自旅行888
7131938035431899936,这就是遗传，我外婆家五兄妹，我外婆两年前九十多岁去世，几个弟弟妹妹现在最小的也有八十，都还好好的。没有一个人患癌。我外婆也是摔了一跤才去世的。,0,0,0,2022-08-15 11:23:44,来自湖北,91653524395,純黒色407
7130960016013886249,基因检测是很有必要的,0,0,0,2022-08-12 20:07:39,来自江苏,93127065128,蓝莓1291
7130975455574082304,基因突变能修补改变吗？家族性癌症太可怕了。,0,0,0,2022-08-12 21:07:31,来自浙江,677744613801310,花城葡萄
7131924575155503909,所以，说癌症是遗传病是对的了？,0,0,0,2022-08-15 10:31:21,来自河南,96455288072,喜欢静静地独处
7131908295346406152,癌症是肿瘤的恶化，发现早期可以切掉多数人不会再复发，有些人在上班身体不舒服一直熬到晚期神仙也救不了！遇到身体不舒服早检查早治疗，身体健康才是本钱。,0,4,0,2022-08-15 09:28:07,来自福建,15241686631,一颗坚信不移的心
7131939221631238950,一种罕见的遗传性肿瘤综合征，主要是由抑癌基因TP53种系突变导致,0,0,0,2022-08-15 11:28:06,来自安徽,646126638466371,pinqiu
7130970370987426595,我二叔肝癌我小叔膀胱癌二姑甲状腺癌表弟白血病我也好害怕,0,0,0,2022-08-12 20:47:54,来自山东,108909732448,青涩梦想家RE
7130885244135392040,人的命天注定啊！出生就注定了基因。,0,0,0,2022-08-12 15:17:41,来自辽宁,63655960678,其二66
7131968705097237262,唉，我现在真的好担心。我爷爷喉癌去世83岁。我大伯喉癌去世78岁。我二伯喉癌去世76岁。现在我三伯74岁。四伯71岁。姑姑69岁。我爸爸65岁。都还健在。身体都还挺好。,0,0,0,2022-08-15 13:22:20,来自湖北,6309075185,上官棋枫1
7131931191020241697,现在又有几个家庭的老人和病人去世不是癌症就是3高死的,0,0,0,2022-08-15 10:57:33,来自安徽,3232189550432547,wY99
7130900090218693417,基因诊断清楚了。基因治疗呢？还要继续拿奖啊！中国这方面的病例很多，但开发研究的很少，用于临床治疗的就更少了。还是基础研究不足啊！,0,0,0,2022-08-12 16:15:25,来自湖北,100230632569,淡定双花
7131956896394855205,我爷爷肠癌，爸爸也肠癌，唉 逃不过,0,0,0,2022-08-15 12:36:25,来自江苏,110791184621,王富贵and李铁柱
7131972771563275043,现在病死因，除了心脑血管的突发意外，再就是各种各样的癌症了。,0,0,0,2022-08-15 13:37:54,来自广东,1490533143292771,璀璨红棉
7131967061672379144,癌症有遗传的，很多家有一个有癌症后代好多都有。相反家族没有癌症的后代很少很少出现癌症。。,0,0,0,2022-08-15 13:16:02,来自江苏,5466972264,风之影55915491
7131972650599318272,"虽然遗传性肿瘤看起来比较夸张，但无论是患者还是患者都不用恐慌
无论是患者还是患者？",0,0,0,2022-08-15 13:37:26,来自上海,4257566658,西江韵
7131948660681802536,常染色体显性遗传肿瘤综合症，是无法通过改变生活环境逃脱。到了一定年纪就形成出现Cancer。,0,0,0,2022-08-15 12:04:05,来自广东,5442129948,fatchiyip
7131948540179677992,遗传的不是癌症，遗传的是基因中对癌症的抗性,0,1,0,2022-08-15 12:03:49,来自湖南,3474099994894128,oo恭禧发财
7130844601267028775,家族中有遗传的致病基因是不幸的事，或许有什么办法可以治疗，但是效果如何因人而异。,0,10,0,2022-08-12 12:40:40,来自加拿大,2167886749906526,非凡风声ZO
7131945865673212675,以前村里有一家，年龄最小的男孩遗传了他妈妈的小脑萎缩，相反他的两个哥哥都没有遗传，而他才三十岁就得了,0,0,0,2022-08-15 11:53:57,来自河南,104633222776,贺常安
7131972991470371618,家族基因 还没有问题的族人们也可以去检查检查,0,0,0,2022-08-15 13:38:43,来自江苏,56911542020,这应该不是我
7131928717495927552,未分化癌很凶险，最容易扩散,2,1,0,2022-08-15 10:46:46,来自湖南,105008605630,亲切山丘EN
7131963603624264459,这一定是有遗传基因，我同村一个，他爷爷，爸爸，叔叔，姑妈全是直肠癌去世，他90后，前几年也检查出直肠癌早期。,0,0,0,2022-08-15 13:03:07,来自湖北,58970512763,不装饰你的梦15971336
7131973663259476777,高血压家族遗传能治好吗,0,0,0,2022-08-15 13:41:15,来自江苏,3073838033676571,我是老男孩儿
7131934088797438728,嫁娶一定得知道对方家族的遗传病史吗？及时止损？,0,0,0,2022-08-15 11:08:07,来自广东,50897190147,心海小愚
7131953412568023844,一切癌都跟心态，吃，休息，运动有关系，不能长期吃：有盐的隔夜菜，油炸，腌制，2个小时以上老火汤，深海鱼(特别虾蟹)等。不能挨夜,0,0,0,2022-08-15 12:22:49,来自广东,3553272383678919,Candy
