7131912804831249164,家族应该建立好基因库，为自己，为别人。,0,1,0,2022-08-15 09:45:59,来自江苏,3839136422701436,古香斋
7131947033375671043,癌症遗传是有的，不过一家这密集的癌症，考虑下生活习惯，饮食习惯吧！癌症高发和饮食，生活，情绪是密切相关的，建议学点中医吧！中医有预防癌症的方法。,0,0,0,2022-08-15 11:58:20,来自湖北,109565229456,愉悦的菜团
7131954830893351714,知道婚前检查的重要性了不？,1,0,0,2022-08-15 12:28:05,来自广东,101988004651,炎一一库
7131941012859273995,太可怕了，这个都有遗传！！！！,0,0,0,2022-08-15 11:35:07,来自浙江,2779977792622328,非凡火车L0
7131934806060860175,遗传这玩意你还真别不信……我姥姥家遗传心脑血管这类的病，我妈兄妹6个，清一色高血压，5个支架了，还有一个马上支架[白眼]还好我遗传我爸家的低血压了,0,0,0,2022-08-15 11:10:19,来自河北,3694128514,雷诺22256194
7131970572996707112,遗传有问题就传不到现在了！我来到浙江就知道这的癌症发病率会高！,0,0,0,2022-08-15 13:29:08,来自浙江,3759950467695288,独股一剑v
7131926857997796129,一个基因检测下来就要差不多两万多块，八个做下来的话…这个不少钱哦？没必要做八个那么多吧？,2,0,1,2022-08-15 10:40:28,来自广东,2234636994872040,蜜蜂2888
7131973782180791052,俺们镇上有一家人全家得癌症，致癌物竟是自家种的茶油，后来检测是除草剂残留过量所致,0,0,0,2022-08-15 13:42:30,来自江西,1072712160645287,朝天椒不辣H
7131942740279690018,爸爸那一脉的基因有问题,0,0,0,2022-08-15 11:41:22,来自江苏,2704425743035043,苏州达美出国
7131910699181589248,生活方式的遗传，饮食习惯的相似，可否做些这方面的研究。,0,2,0,2022-08-15 09:37:00,来自新疆,85477832116,永兰营养师说新疆食品
7131910119889847077,我奶奶（老爸的继母）有病毒性角膜炎，现在三个姑一个叔都是。,0,1,0,2022-08-15 09:35:28,来自河南,5574875762,多才柑桔1
7131946799893431080,就像疫苗一样的耦合率，如果不是因为环境污染，添加剂太多可能一辈子癌症都不会爆发,0,0,0,2022-08-15 11:57:02,来自江苏,111192147029,奕辰关注
7131954077130703630,适时知道体检的重要性。,0,0,0,2022-08-15 12:25:40,来自江西,105187302708750,智者海风tV
7131966889256813353,所以基因很重要，要想长寿健康，结婚对象要多了解一下他们家族史,0,0,0,2022-08-15 13:14:48,来自浙江,4481230335914923,岁月无声忆无痕
7131939227902067467,很多东西都遗传的，深埋在基因里，甚至包括性格，习惯……,0,0,0,2022-08-15 11:28:28,来自广东,65484973962,凝雨紫蝶14
7131914517659353869,遗传 饮食 家庭氛围 情绪影响都有关系吧,0,2,0,2022-08-15 09:52:23,来自广东,6536540710,皮皮卡卡丘丘O
7131970756543824674,癌症也有遗传倾向？,0,0,0,2022-08-15 13:29:58,来自北京,60642642952,Friedrich8
7131931962654819072,我妈妈生了双胞胎，我爸爸的妹妹也怀过双胞胎没生下来，那我有没有这种遗传基因,0,0,0,2022-08-15 10:59:29,来自广东,82551238086,海阔天空lmm127
7131973856776618786,癌症有一定的遗传性，高中上学那会儿生物老师说过,0,0,0,2022-08-15 13:42:08,来自浙江,84986431389,哪就这样吧o
7131966452269253408,刚生了二胎，那俩个宝宝也可能遗传到奥,0,0,0,2022-08-15 13:13:53,来自山东,88407592154531,哪个闫
7131952287160746793,所以，婚前调查对方家族遗传疾病很重要！！！,0,0,0,2022-08-15 12:18:10,来自贵州,108213862635,Qinyouduzhong
7130860815598961449,家族群里基因结构都相似，所以遗传概率高。,0,3,0,2022-08-12 13:42:57,来自浙江,492183740487944,自由的云朵Ce
7131974079565153065,遗传只能通过基因检测确定后优生优育。,0,0,0,2022-08-15 13:43:02,来自浙江,58243741746,小古原创女装工作室
7131949578441524002,第一次听说癌症会遗传！,0,0,0,2022-08-15 12:07:40,来自广东,92588774017,微波2223
7130886116505010980,应该是我们国家是癌症大国，我家里也是有好几位得癌症的。,0,0,0,2022-08-12 15:21:42,来自广东,1886407519115341,翔wxl
7131952534960210702,癌症也会遗传吗？高血压才有遗传。,0,0,0,2022-08-15 12:19:27,来自广东,7014296963,天光幻觉
7131951157947450148,我就遗传了脑血管病，今年住院我是科室最年轻的一个。,0,0,0,2022-08-15 12:14:27,来自陕西,102919209391,优质小煤球
7131971739231896323,我们这也有一家七口得癌的，就连新过门的媳妇，在生下一个孩子后就得了癌症，不久就去世了。,0,0,0,2022-08-15 13:34:55,来自湖南,919655479784891,昼伏夜出的精灵
7131941433086853920,老夫四十多岁了只有一种癌症——穷癌[捂脸][捂脸][捂脸],0,2,0,2022-08-15 11:37:00,来自河南,62614091076,苦咖啡412
7131949615024407336,基因，这个有遗传,0,0,0,2022-08-15 12:07:46,来自四川,5437059282,逆风思之
7131928867371156262,遗传的疾病难防[赞][玫瑰],0,0,1,2022-08-15 10:48:00,来自广东,1816815099980813,你觉得天空是什么颜色的
7130900292224959232,闻癌色变，很怕得癌症，我的父亲肺癌，，爷爷肝癌，得了癌症真的生不如死[石化],0,0,0,2022-08-12 16:16:12,来自广东,4054158041,海阔天空WJH
7131941395816055563,癌症不遗传，容易得癌症的体质遗传,0,0,0,2022-08-15 11:36:39,来自河北,64381212215,八达岭781
7131949336845959968,跟遗传是有点关系。但一般的癌症没有多大的关系。以前也不是有这么多人得癌症。现在感觉好多。我觉得还是空气，水，食物，心情，虽然现在富裕了，但这四点，却越来越差。,0,0,0,2022-08-15 12:07:34,来自河南,4702045503,飞鹰47264781
7131952464210871081,这么多家族人员，患癌症，家族风水，或者住宅风水，有很大关系。但是科学不信这些，但实际人类，一方水土，养一方人，宁愿信其有，不愿信其无啊！,0,0,0,2022-08-15 12:18:52,来自广东,2128251030876000,爱喷你
7131933766121587490,我老伴患有甲状腺结节，一直在观察治疗，想想挺担心的！,0,0,0,2022-08-15 11:06:35,来自江苏,50854480306,定埠老好人
7131951573261402883,遗传就是很恐怖的，,0,7,0,2022-08-15 12:16:17,来自浙江,918839795649927,芸尔飘啊飘
7131940965404705536,国人患癌的机率高，大概跟日常饮食脱不了关系，食品、饮品、油盐酱醋，以至餐具器皿的安全问题不容忽视,0,0,0,2022-08-15 11:34:16,来自广东,110797491608,青灯浊酒慰红尘
7131925651284296479,不是吧，在我的认知里面，甲状腺癌是最轻微的癌，之前支付宝的相互宝还把甲状腺癌的赔付标准由原来的30万降到了5万[抠鼻],0,0,0,2022-08-15 10:35:38,来自广西,52130108232,佩奇我社会
7131958232390206211,看来以后孩子找对象还要测基因[泪奔],0,0,0,2022-08-15 12:42:11,来自广东,108723061656,两个可乐杯
7131970134096560911,为什么中国现在这么多的癌症？是以前医学不发达，没发现这么多，还是现在医学发达,0,0,0,2022-08-15 13:27:39,来自黑龙江,107750885698,自在的热情旭日
7131937314318238498,遗传病挺可怕的，躲是够不了，除非自己免疫力强大。[捂脸],0,0,0,2022-08-15 11:20:20,来自江苏,3372923574294180,悠闲宇宙bQ
7130900896762102569,我只想知道做这检测费用多少？好害怕去医院，就检查费我农民都承受不起了。,0,0,0,2022-08-12 16:18:28,来自湖南,311909665744440,极速廊坊0s
7130936583653917470,"是基因？还是生活习惯？
篇幅中，更多的是说治疗！",0,0,0,2022-08-12 18:37:25,来自江苏,59977160692,我的眼光
7131972175195816739,最神奇的事，癌症还分这癌，那癌，药还不是通用的。难道癌不是同一种病症吗，难道你感冒了还分左鼻感冒和右鼻感冒，还要买不同的药物治疗吗，想不通,0,0,0,2022-08-15 13:35:21,来自广西,4164567623810107,妖天一言
7130972320931513099,以后找对象要看看对方的基因了，感觉是很重要的,0,0,0,2022-08-12 20:55:53,来自浙江,1068333777559643,洒脱的桃李仙子
7131936458709648135,癌症遗传的！下一代没有，下下代可能会有！我大伯那一系每代人只要到60岁去检查都有癌症！唉,0,0,0,2022-08-15 11:17:31,来自海南,102207261358,赖床分子呀
7131929422273610533,肿瘤不能跟癌症划等号，基本是两种病,0,0,0,2022-08-15 10:50:02,,69817162745,夏日炎炎m88E
7131962178273788672,癌症感觉基因的因素比较大，隔壁家两个大哥都是得肺癌，一个走了，一个刚确诊,0,0,0,2022-08-15 12:56:34,来自江苏,103511524346,小印7504
7130897687897391872,目前我父母双方往上数三代之内，我老婆父母双方往上数三代之内均无肿瘤病史，平均年龄均在75岁以上！,0,0,0,2022-08-12 16:06:04,来自四川,97215599665,友爱湖泊H
7131972223279792896,真是麻烦，族人风险都很高！,0,0,0,2022-08-15 13:35:51,来自河北,93187752104,本名唯一
7131947752157840131,白血病与乙肝有遗传，其它应该没有遗传。,0,0,0,2022-08-15 12:01:17,来自福建,103276680466,智勇双全阳光aZ
7131929155709010696,糖尿病遗传下一代,0,0,0,2022-08-15 10:49:04,来自天津,7022258302,水晶123678666
7131971857988993804,山西，本地新闻前两年有个就是，姥姥，妈妈，女儿，三个人都患癌症,0,0,0,2022-08-15 13:34:56,来自山西,6938749667,卧室以外都沉没
7131946287821275936,那他奶奶跟他妈妈的癌症是怎么遗传过来的？？？,0,0,0,2022-08-15 11:55:29,来自浙江,1244242119236718,邪恶克星钟神通
7131954499433923359,现在有些年轻人结婚都会询问祖父母，外祖父母的情况，感觉是有道理的。主要是环境污染癌症太多了。,0,0,0,2022-08-15 12:27:06,来自浙江,93184519471,人小大头
7131940958903763747,这真的是太可怜了，一家子这样，特别难治，只能等到奇迹。,0,0,0,2022-08-15 11:34:22,来自上海,3021102398308503,马甲号称作
7131968518170002191,家族里前辈 同辈癌症人多了，就别生那么多,0,0,0,2022-08-15 13:21:22,来自广东,106130712835,粤行摄
7131963432361886495,其实我觉着是遗传的因素更大，我婆婆有，我老公也有。,0,0,0,2022-08-15 13:01:53,来自辽宁,98164853785,缘自内心
7131919436365841193,我的一个朋友他们一个楼一家就是，先是孩子得了癌症死了，时间不长男的也是癌症死了，就是遗传的,0,1,0,2022-08-15 10:10:53,来自河北,16438075616,飞鸟的天空30
7131941068882936591,是不是现在的饮食和自然环境的变差导致人类基因突变出这种患癌基因？,0,0,0,2022-08-15 11:34:56,来自广东,20613321987,IS梦游先生
7131966929791304463,癌症遗传病，真难啊,0,0,0,2022-08-15 13:15:11,来自山东,55190313374,简简单单
7130878015298814760,癌症还是有遗传的。,0,1,0,2022-08-12 14:49:42,来自北京,104871579729,火山2517324250362
7131950501494719272,我遗传了中国人传统特质: 贫穷,0,1,0,2022-08-15 12:11:13,来自广东,3096855824,鸡鸭联萌
7131955706987217699,主要还是基因，从基因的复制原理，每个人都有患癌的可能，如果基因强大，那么就能抵抗诱导的外因。,0,2,0,2022-08-15 12:31:33,来自广西,884450462538768,污笼苑砖家
7131960532613432105,原来老人以前说的男婚女嫁要找父母双全的，是有一定道理的。,0,0,0,2022-08-15 12:50:15,来自山东,26156551484,Zero星空
7131966991677817635,婚检是否能检出这种情况？,0,2,0,2022-08-15 13:15:20,来自河北,408655522970318,诗意柑桔lM
7131955071549702927,什么病都有遗传的可能性比较高，不遗传的病极少数。,0,0,0,2022-08-15 12:28:55,来自广东,3307785332200029,草药肾病
7131938551469474599,治疗癌症还是要从基因入手，基因表达是关键,0,0,0,2022-08-15 11:25:36,来自安徽,63988033532,散人说诗词
7131961441846068001,XXX综合症，会起名不会治病,0,1,0,2022-08-15 12:54:27,来自陕西,3671973914217672,外向星空Dm
7131958666156835618,我家里没有人得癌症，我爷爷外公都90多岁了，还活着,0,0,0,2022-08-15 12:43:02,来自广东,88051505483,甪甪00
7131952533828158243,我一直坚信当今癌症高发，跟饮食脱不了干系。,0,0,0,2022-08-15 12:19:11,来自安徽,1249457598104174,别拿自己当回事
7131948566721610511,定期做好检查，是有必要的。早发现早治疗,0,0,0,2022-08-15 12:03:59,来自广西,1736823330836252,钟小湲
7131954700127765262,找对象的时候，先了解一下家族病史,0,3,0,2022-08-15 12:28:05,来自山西,3651964736,振衣高岗濯足长流
7131930296689705760,病不会遗传，只能说这家人的体质不容易抑制癌细胞增长，所以会有“遗传”。,0,0,0,2022-08-15 10:53:57,来自浙江,2612051548573016,数字到底123456789
7130914827945378560,和现在所有的食物，蔬菜，水果里都植入的色素，添加剂，农药，化肥，催长素有关系吧。真不知道还能吃些啥？[灵光一闪][灵光一闪][泪奔][泪奔],0,0,0,2022-08-12 17:12:26,来自甘肃,3786350628701262,菲尔嘚啵嘚
7131958832913744648,人类基因里都有，个人体质免疫系统不同，再加上外部环境激发,0,4,0,2022-08-15 12:44:03,来自广东,1987568166504557,创意原野4U5
7130875542647325455,癌细胞不会传染。只适合于自己的环境中生存。近亲的话，由于血液，基因，染色体都相同。有传染性的可能。,0,1,1,2022-08-12 14:40:05,来自黑龙江,6023246018,中医自然疗法创始人
7131958741536097064,可能严重污染造成的！检查一下房子水和周围环境！没听癌症遗传！,0,0,0,2022-08-15 12:43:09,来自黑龙江,883652677867068,无双小羊wQ
7131932929575846694,高三学过生物，癌症和遗传关系很大，原癌基因和抑癌基因,0,0,0,2022-08-15 11:04:09,来自江苏,93356039269,StevenJoery
7131953061228069670,父辈，祖父辈遗传，而且甲状腺未分化癌也是真的少见,0,1,0,2022-08-15 12:21:44,来自河北,4000995081,九霄神龙首
7131930001355719437,好像癌症就是遗传因素更大，后天能改变的较小，真不是养生能解决的,0,1,0,2022-08-15 10:52:07,来自江苏,69839357788,木易940
7131937688298865446,家族基因问题，不适合结婚繁衍后代。话虽然难听，但事实就是这样，优胜劣汰，任何物种都难逃自然法则。,0,0,0,2022-08-15 11:22:19,来自安徽,63988033532,散人说诗词
7131967269752177441,一家有那么多的癌症人，也并不是抽烟饮酒和生活上的事，如果是在农村与家里凤水气运有关，,0,0,0,2022-08-15 13:17:24,来自江西,79309595101,大鹏与雄鹰
7131967912629945118,肿瘤也开始会遗传了吗？？,0,0,0,2022-08-15 13:19:36,来自福建,63765808940,开着空调盖被子666
7131925907702301455,现在癌症患者真的好多，希望有关部门重视,0,1,0,2022-08-15 10:35:49,来自江西,1538919275957611,中国一江西一宜春沧海一粟
7131945430014804749,可以通过第三代试管生育去掉这个基因遗传,0,0,0,2022-08-15 11:51:53,来自湖南,96233290736,愚公移山123456
7131965652486996770,癌症能遗传，不过也看脸，万一没发。。。,0,0,0,2022-08-15 13:10:10,来自江苏,76001012171,远书依梦
7131968040572486440,还是有遗传的，,0,0,0,2022-08-15 13:19:22,来自河南,2427331652093710,自信博比6h
7131971749105337118,基因理论我觉得不靠谱，祖宗到现在不知有几代了，病估计什么都有，那现在不是都是在等死。最主要还是跟你的生活环境和你的生活方式有关。,0,0,0,2022-08-15 13:34:24,来自福建,50417865336,长信0A8V
7131922869382218530,是不是婚检也要查一下基因检测,0,3,1,2022-08-15 10:24:04,来自四川,54266151498,温柔溪水HM
7131930975356928768,真要是恶性肿瘤果断保守治疗，有限的生命中提高生活质量,0,0,0,2022-08-15 10:55:31,来自山西,1072779096240016,如果是
7131957043208651523,医疗科技永无止境，期待生命的保护神们深稽博考、潜精研思再创包括医除各种肿瘤、癌症的专利！,0,0,0,2022-08-15 12:37:31,来自山东,56151392112,鲁石A
7131945936339059497,这种病主要是遗传，现在完全可以治疗没多大点事，,0,0,0,2022-08-15 11:53:31,来自陕西,52162560350,亮剑1362533
7131957093090951974,有癌症的建议不要结婚,0,0,0,2022-08-15 12:37:32,来自上海,1082347670476798,幻想淋雨
7131940834974483200,有条件的话 体检时候做个基因检测吧,0,0,0,2022-08-15 11:33:45,来自福建,3325810084,逗比逗比闪闪亮
7131968139885757216,除了遗传，基因等原因之外，住房地下，附近有没有极強的放射性物质。,0,0,0,2022-08-15 13:20:35,来自广西,100790686903,白首渔翁
7131961036533465891,现在哪个家族里没有癌症的已经很少了，环境和食物是主要因素,0,3,0,2022-08-15 12:52:07,来自浙江,4134800024,阿峰33972806
7131936978039833383,现在找对象了解对方家庭疾病史很有必要的。,0,0,0,2022-08-15 11:19:49,来自安徽,17601252681,踏雪花花
7131928774983762703,好可怕的遗传基因！,0,0,0,2022-08-15 10:47:12,来自广东,549396343161291,自强不息香瓜DQ
7131930735866823427,评论区说会遗传，那为何奶奶，妈妈也会遗传到[捂脸],0,1,0,2022-08-15 10:55:35,来自福建,3623616762359360,h荒h
7131941376891552547,遗传基因真的没办法。吓都吓死了。,0,0,0,2022-08-15 11:35:59,来自浙江,3843481606041022,敏锐苹果py
7131930734428062468,就是检查出来，判定遗传基因导致，又能如何？,0,0,1,2022-08-15 10:55:35,来自辽宁,3263817226401688,分秒必争溪流m3
7130967666034328360,恐慌，遗传基因强大[流泪],0,0,0,2022-08-12 20:37:20,来自山东,52925924157,知情达理暖阳C
7131931715631153961,定期检查，很有必要，为什么现在这么多得癌的呢？,0,0,0,2022-08-15 10:58:31,来自山东,71756825822,宁静致远
7131965772708086542,太可怕了，家族史！,0,0,0,2022-08-15 13:10:52,来自新加坡,58737932186,有梦想老头
7131939852878201615,有遗传基因，那是没办法改变的事，除非不结婚，免得遗传给下一步,0,0,0,2022-08-15 11:29:56,来自河南,747312492339412,直爽小羊t3
7130835487908152097,知道了就防范啊，多么幸运的事，家人用生命探求得的答案，一定要努力保护好自己，替他们好好看这世界,0,7,1,2022-08-12 12:05:16,来自广东,105116233285,敏锐饺子Vr
7131943030542123810,我遗传了我家的穷癌,0,0,0,2022-08-15 11:42:29,来自陕西,108894589653,西安网友
7131944931681239821,基因遗传啦，正常,0,1,0,2022-08-15 11:50:07,来自四川,50051033242,中冕建设集团v李鑫
7131924409513722637,有遗传病的建议就不要结婚生子了，不联系差基因遗传下去,0,0,0,2022-08-15 10:30:24,来自黑龙江,593342972559684,没啥好玩的的名字
7131965515027022626,现在怎么不婚前体检了?,0,0,0,2022-08-15 13:09:35,来自四川,65410302828,竹楼听雨a
7131947051256562473,遗传基因强大的让人害怕😨,0,0,0,2022-08-15 11:58:04,来自吉林,804470113180430,平常心98340
7131972902089933579,这是一个家族不是一家！,0,1,0,2022-08-15 13:39:19,来自广西,104587987707,芳孞
7131930778497434398,所以找男女朋友必须了解对方家族病史！,0,0,0,2022-08-15 10:55:11,来自安徽,80603670237,明天
7131939740685239074,帕金森病遗传不[流泪],0,0,0,2022-08-15 11:29:40,来自安徽,2101900742761431,淮北平原莽撞人
7131935522331296542,堂兄，堂弟与奶奶一个基因吗?,0,0,0,2022-08-15 11:13:58,来自江苏,106546692718,大气轮船fx
7131953003644683011,查查你家饮食习惯？经常食酸菜，干头，添加剂的肉食品，加工过食物？致癌物？检查发现要切彻改变饮食习惯？,0,0,0,2022-08-15 12:21:43,来自广东,3615547951,睿智菠萝LV
7131957542179504936,原来认识的一个女朋友，除了她全家都是癌症，很好的姑娘可惜了,0,0,0,2022-08-15 12:38:34,来自山东,104480671878,隰勇男
7131947622830687014,有遗传的，我爷爷肝不好，我爸也是，我也是,0,0,0,2022-08-15 12:00:53,来自广西,4419666453207404,不要乱剪辑
7131934076101034791,基因问题，这个，目前是没办法医治的,0,0,0,2022-08-15 11:08:14,,59556665310,徘徊的狼3
7130878117207704353,人生一世福祸相倚，谁也无法预料明天和意外哪个先到来。生老病死自然规律，坦然面对命运安排。,0,2,0,2022-08-12 14:50:55,来自上海,3931455508458590,梅荣春银
7131962949794661153,重点是饮食习惯，一定要使用公筷，碗筷得消毒，这样才能减少病毒传播,0,2,0,2022-08-15 13:00:10,来自广东,54944464003,追风探险者
7131944059119665957,大部分病都遗传,0,0,0,2022-08-15 11:46:55,来自甘肃,73801328299,木子237409425
7131933160568881933,癌症大部分都是遗传基因作用，后天的生活习惯也占一小部分。,0,0,0,2022-08-15 11:04:37,来自重庆,105887384828,0天堂地址不详0
7130874332368454415,长寿、患病与生活习惯和遗传都有很大的关系，所以找对象需谨慎！[比心],0,1,0,2022-08-12 14:35:21,来自上海,78804635075,墨飛1895
7131946622069719811,活着不易！摊上这样的事和病是命中注定的！无奈啊！,0,0,0,2022-08-15 11:56:54,来自江苏,6949106206,6949106206
7131943401250931497,我妈的过敏体质，偏头痛，都遗传给我了[泪奔],0,0,0,2022-08-15 11:43:39,来自甘肃,108244758068,梅时暮雨
7131926625993982756,"全家人，赶紧找中医治疗！
全家都能治愈！",0,1,0,2022-08-15 10:39:19,来自河北,2744002950201502,老婆是铁扇公主
7131960619922146083,可不可检测一下那些单身的可能走单身癌症[抠鼻],0,0,1,2022-08-15 12:50:37,来自天津,215123729070893,我叫九吻呀
7131961416986673951,同时患癌，属于外部因素激发导致,0,0,0,2022-08-15 12:54:04,来自山东,1178328330413389,故事机动画
7131964950377661219,能平平安安活到80岁，多么不容易[泪奔],0,0,0,2022-08-15 13:07:32,来自江西,86482181073,六月齐霁
7131939899884438287,病遗传多。各安天命。,0,0,0,2022-08-15 11:30:21,来自四川,50108178177,家荣Ac米兰
7131950969617007390,这种情况要孩子得做三代试管才行吧，可以筛选基因好像！,0,0,0,2022-08-15 12:13:36,来自山东,50030979691,常烦人1987
7131948868903699213,查一查周边环境，吃的东西以及家族病史就会有答案。,0,0,0,2022-08-15 12:05:17,来自上海,14660690979,jackli11
7130952835793437474,科技越来越发达，更好造福人类。,0,0,0,2022-08-12 19:39:48,来自河南,5206010045,晗宝宝妈142864968
7131938786476573480,找结婚对象要查基因检测报告？,0,0,0,2022-08-15 11:25:52,来自江苏,93311516306,川上歌手738
7131943687847822114,弄清楚又奈何，又没有办法提前干预,0,0,0,2022-08-15 11:44:47,来自浙江,3738813844431484,秋水伊人
7130860045998801664,太可怕了，其实很多病都会遗传的，只是有些机率高有些机率低而且,0,2,0,2022-08-12 13:40:01,来自广东,3558464291869579,羽言心语
7131941146288489227,有些病是遗传，但有些病科学解释不了的,0,0,0,2022-08-15 11:35:51,来自内蒙古,1244283156050267,微笑海风iw
7131930678920397571,婚前了解双方家族人寿命有必要 我小时候长辈这么说的,0,0,0,2022-08-15 10:55:02,来自浙江,4576762927,LaurenePowell
7131973777206346507,看看风水吧 肯定有问题,0,0,0,2022-08-15 13:42:27,来自山东,5981596236,野子ono
7131959691151983400,遗传是一方面，什么原因诱发病变的才是主要问题,0,0,0,2022-08-15 12:46:54,来自江苏,50340790797,给你一面镜子
7131960851342770980,我和爸爸都得了癌症,0,0,0,2022-08-15 12:51:46,来自湖北,4045202700,夜深人不静JACK
7131963890636047145,这个要去他们家里看看他们一家饮食起居习惯，能够找出蛛丝马迹,0,1,0,2022-08-15 13:03:13,来自北京,69361942281,爱生活的星星知心
7131971730855576324,估计与饮食有关，儿媳和婆婆不存在遗传基因。,0,1,0,2022-08-15 13:34:39,来自安哥拉,64627557100,开心带给你
7131970336979485440,这样的家族，生二胎是爱孩子还是害孩子？,0,0,0,2022-08-15 13:28:29,来自江苏,50463781719,wind4978
7131945361043669800,活了33岁都不知道自己有地中海贫血 直到我女儿三周的时候被发现[捂脸],0,0,0,2022-08-15 11:51:19,来自浙江,5758240220,不敢表达的爱
7131952536549901091,请问懒癌晚期怎么治？[奸笑],0,0,0,2022-08-15 12:19:03,来自浙江,96114908273,瞬间永恒281
7131902471550927652,环境，吃的菜等都是问题,3,8,1,2022-08-15 09:05:31,来自江苏,51333100602,独行153276911
7131956047127773967,那八种遗传癌感觉很常见啊😱大部分基本上都是得这些,0,0,0,2022-08-15 12:32:37,来自北京,56604690611,呆屁桃
7131946054639289125,综合症，不是综合征,0,0,0,2022-08-15 11:54:33,来自辽宁,96358682104,美好的生活aaaaaa
7131945996917293856,我遗传了懒癌！,0,0,0,2022-08-15 11:54:39,来自江苏,104681392100,夜雨始如一
7131957476970627854,个人身体素质很大一部分是基因决定,0,0,0,2022-08-15 12:38:50,来自江苏,3650843935250064,杀手直奔西
7131932267958256415,我外婆98去世，我妈妈乳腺癌56去世，我奶奶80多去世，我爸爸75肺癌去世，我姑姑糖尿病10年了，我姑的女儿就是表姐42岁肺癌晚期，我也很担心我自己，上个月做了基因检测，还没出结果,0,0,0,2022-08-15 11:01:08,来自广东,610943678814211,王宝宝的宝宝吖
7131973785351193384,谈恋爱看来要了解对方的全部家族，不然的话，后悔都来不及。,0,0,0,2022-08-15 13:41:38,来自山东,106459325248,自在平安a
