7129817126965592832,放假了，能放羊真不错！,16,236,3,2022-08-09 18:12:48,来自山东,53106413819,爱情消痛片心岸姐姐
7129791109143839528,把劳资笑死，我小时候经常放牛，牛都回家了，我还在跟小伙伴们打牌,23,230,0,2022-08-09 16:31:54,来自四川,4186018091,如鱼得水板姐
7129883556889051904,"我就纳闷了，这件事跟读不读好书有什么关系？
这是一个很偶然的事件，她可能就是顾着这头羊正在怀孕没吃饱，不忍心赶走，其实这不正反映了她内心细致的一面吗？而且她也没有真正的走丢，不是通过手机定位联系上了父亲，并找到了吗？
如果没读过书，可能连手机定位也不知道怎么找！[可爱]",3,19,0,2022-08-09 22:30:36,来自广东,440261976526567,惠风天朗读书
7130010603413881634,我小时候也是，放羊时候睡觉💤，等睡醒了一看羊全不见了，到处去找，到天黑了也没找到，也不敢回家怕挨打，后来还是爸爸去找我回家的，爸爸说羊早就回家了，你怎么玩到现在都不回家吃饭真贪玩，我听爸爸这样说我就大哭😭起来，我都快吓死了还有心玩，从那以后都被家里人笑:-D说我是小迷糊，早ﾉ☀晚把自己给丢了[捂脸][捂脸][捂脸],22,35,1,2022-08-10 06:43:53,来自上海,1450959760526487,梦幻枫叶
7129811434682729249,爸爸：生了个什么玩意儿？[捂脸],1,16,0,2022-08-09 17:51:46,来自广西,55002737832,灵奚落
7129732262992216832,爸爸:逆子啊！,2,11,0,2022-08-09 12:43:28,来自上海,52871010361,无限快乐与你分享
7129803770112508684,爸爸发个定位，你应该去找爸爸[奸笑],5,26,3,2022-08-09 17:22:00,来自陕西,4044879963,峰的爱人
7129787528973959973,突然感觉这可能只是个营销模式,14,197,5,2022-08-09 16:18:19,来自山东,102747575183,佛系無玄
7129782599161529127,你爸爸太粗心了[呲牙],2,37,3,2022-08-09 15:59:52,来自湖南,3149478804852535,湘妹子hh
7129766970320601868,要不是疫情，我原计划这个时候到草原同学家放羊的,28,274,3,2022-08-09 14:59:04,来自四川,6704847439,就要这般
7129790716855370508,我觉得很正常，毕竟内蒙古那么大。要是平时只上学也不弄家里事情的，丢了不正常吗？万一再是个路痴更容易丢,1,40,0,2022-08-09 16:31:11,来自浙江,6129382907,柚子味的大牙兔
7129912000109265694,"[呲牙]一个女大学生，放羊把这放丢了。。。这还蛮有意思的！
[害羞]我小时候放牛也曾经把牛放丢了，但是现在回忆起来还是很美好的。
说说我印象中，我唯一一次放牛经历吧！
我小时候很羡慕放牛娃，觉得别人骑着牛去山上吃草很神气。
终于有一天，我爷爷没空就安排我跟堂哥去放牛，结果去到了山上看见了各种野果（暑假七八月份），作为吃货的我，看见野果就挪不动腿了，就是不走了。山上到处都是野果吃得真开心呀。堂哥看见我就是不走也懒得理了，也跟我一起吃野果。
等我们吃饱喝足了，牛已经不知所踪了。然后我们到处找呀，天黑了还没找到。
[害羞]少了一根筋的我不仅不害怕，反而很开心，因为野外好多萤火虫呀，好好玩。
大人们很晚发现我们还是没有回来，就来山上找我们。
最后，牛丢了，堂哥被狠狠揍了一顿。牛据说叔叔跟邻居三更半夜去找了一夜找回来了。
现在想起来还是很美好呢。好想再去放一次牛呀，可是爷爷再也不允许我靠近牛一步了[吐血]",7,21,1,2022-08-10 00:43:20,,5928036133,二胎宝妈在深圳
7129800758132458273,大学生去放羊，不小心把自己和羊都放丢了，这是一种什么样的体验？我并不想说现在的孩子们没有什么人生经验之类，我是觉得，现在的网络发展时代，我们都习惯用导航去寻找位置了。反观我们自己，就算在自己住的城市，出一趟都要开导航，看路看牌的时代有点渐行渐远的感觉，现如今人们看路牌主要是为了不违反交通吧。发达的导航寻人寻物也的确是神速，但是我也想说一下，日常我们还是要普及一下在没有手机信号和导航信号时要怎么办，否则特殊情况下，就只能束手无策了。,6,39,3,2022-08-09 17:15:02,,109025594941,秋悦诗画歌
7129798777326043912,我出嫁第三天回门找不到婆家，跟老公打了个电话让他出来接的我[笑哭]从见面到结婚就十八天，只有订婚那天去过一次，第二次去就过门了，蒙着盖头也没看清路,69,145,2,2022-08-09 17:02:05,来自河南,108892142048,儒雅星辰7U
7129788517538579207,羊：要不是怕你回不了家，我早就赶上其他羊了[看]记得小时候放羊，等羊吃饱了给它牵回家。绳子我都拉不住的，跑的太快了，我直接送了绳子跟着羊一起跑回家的[捂脸],9,97,2,2022-08-09 16:22:18,来自浙江,67352257246,荣荣yv
7129769512958346025,女大学生放一只羊，居然还数错了[大笑]，我们看到了羊的样子，没看到女大学生的全貌，我不信。[呲牙][奸笑][捂脸],10,143,4,2022-08-09 15:08:12,来自江苏,2808385258,和气自然生财
7129777539765568295,为什么要叫女大学生，自己家如果是以放羊为生的，像这样走丢了的，只能说跟人家家里种田但是五谷不分一样,21,51,5,2022-08-09 15:40:05,来自广东,87629232742,了了
7129696935233258247,看来放羊不是谁都能干了的，以后不许瞧不起放羊这个职业[捂脸],3,38,1,2022-08-09 10:26:51,来自内蒙古,58821133094,敏165547545
7129837615708766990,只有我猜出来了，你想带着它私奔,1,2,0,2022-08-09 19:32:47,来自山东,8438322043015,秋枫
7129806924342215438,“那个爸，我有一个好消息和一个假消息要告诉你，你要听那个?好消息是，我和那只小羊在一起，坏消息是，我和小羊都迷路了”,1,26,1,2022-08-09 17:33:51,来自四川,3716815048686557,奋斗吧阿帅
7130015129953452835,"好孩子，放羊还没有经验，但是在努力，在帮着父亲放羊，这很好。
有时我们专注做一件事，专注在一个点上，忘了照顾面，忘了顾及全局，会出差错，这是成长过程中的问题，是小苗成长过程中的问题。
英雄也有青葱岁月，科学家一样有稚嫩童年。愿快乐伴你成长。[赞][玫瑰]",0,2,0,2022-08-10 07:01:35,来自北京,4230513262597796,有点想法的老六
7129768856469881614,老爸：找羊的路上顺带捡个闺女[捂脸],0,27,0,2022-08-09 15:06:09,来自山东,102137691530,更准更快更强
7129794974161503006,小时候我也帮爸爸放牛，一边放牛一边画画写生。后来跑到上海定居了，前几年带我女儿回老家，看到新出生不就得小马驹，她非要抱着小马驹回上海[捂脸][笑哭],3,20,0,2022-08-09 16:47:13,来自上海,5517289677,创e派
7129820674269037344,丢了很正常，草地那么大如果不是平时经常走很容易迷路，我是路痴很理解，注意没，那羊好肥呀！,4,17,1,2022-08-09 18:27:40,来自内蒙古,108068309538,楷齐W
7129796541443425063,孩子，下次和爸爸去放羊，让爸爸在导航上弄个车队模式，他当头车，你跟着走。[呲牙],2,11,1,2022-08-09 16:53:50,来自江苏,3337758233607582,端庄优雅柑桔I
7129767640151278374,不念书连一只羊也放不了啊,91,482,13,2022-08-09 15:02:10,来自山西,5460414460,怡然55675953
7129783730226725663,羊丢了没大事，你丢了麻烦,0,12,0,2022-08-09 16:03:46,来自河北,102108127752,暮歌对口型
7129766141870162696,爸爸：哎呀呀，还不如边牧好使[熊吉],6,221,4,2022-08-09 14:55:38,来自上海,3103723310,Aurora曙光女神
7129791328749830912,"我不想读书
我只放羊
我只放一只羊
我骑在羊背上
羊吃草我睡觉
羊去哪我去哪
羊走丢了
我也走丢了",2,66,1,2022-08-09 16:32:54,来自河南,95846307943,一个叫大熊的熊孩子
7129807310679278373,读大学没学个放羊专业可惜了。。。[挑眉][挑眉],1,5,0,2022-08-09 17:35:14,来自湖南,2959531205733351,坐云山庄
7129784588196741928,这草场都没有什么草呢，和我想像的草原不一样，看着有点小失望,3,2,1,2022-08-09 16:06:37,来自广西,2639250011746989,扁人
7129806755802350375,有羊图片，没看到大学生，这个事情不算数[呲牙],0,21,2,2022-08-09 17:33:24,来自贵州,108148379535,乡村莫姐
7129769350747751182,"好像辞职去放羊，
也不多放，
就放一只，
羊吃草，
我睡觉，
羊丢了，
我也丢了。",8,39,0,2022-08-09 15:07:52,来自湖北,3918263476043204,数据就是报告上写的
7129809091639378718,小羊，怀孕?,1,3,0,2022-08-09 17:41:59,来自四川,92788623182,fff梦蝶飞飞飞
7129804054804497156,小时候帮着外公放牛，也把牛放丢了，跑回家叫外公去找，没想到牛跑去别人的农田里吃禾苗了，搞得被人骂了一顿，最后外公还要拿着自家的禾苗帮别人补种[捂脸],0,5,0,2022-08-09 17:22:47,来自广东,72409439243,一如既往
7129797676740657957,你爸爸发动全羊出去找你，你记得同只羊别动，呆在那里😂😂😂,1,10,0,2022-08-09 16:57:47,来自广东,1759836684,劲26905129
7129801075200574247,"爸:你不好好上学，长大能干什么？
女:长大放羊。
爸:放羊也不识数，丢了都不知道。
女:我放一只。
爸:大学了，放一只还丢了。连自己也丢了。",1,23,1,2022-08-09 17:11:24,来自山东,5092559626,奉献131190006
7130021600334431009,记得回家的路就好！羊羊丢了，小事，你丢了是大事。放假能回家放羊就是好孩子！记得以后的假期多回来看看爸妈！[玫瑰][玫瑰][玫瑰][玫瑰],0,0,0,2022-08-10 07:28:01,来自广东,71558459781,正能量侃妈
7129773067525604134,实不相瞒我的理想就是去草原放羊，骑着马儿，叫上狗子，随身带个烧烤架。完美[机智],27,40,1,2022-08-09 15:22:37,来自浙江,62195225779,Hi嗨Hi
7129803002445464352,我小时候暑假去山里玩，有一次帮幺爸放羊，也跟着羊走呀走，一直到曲麻黑也没找到回幺爸家的路。幺爸发动了几家人打着马灯，敲着脸盆找我。[捂脸][捂脸][捂脸][捂脸],3,12,1,2022-08-09 17:19:01,来自广东,6107269271,健行天117
7129851594934076201,小时候也放过羊，那是生活无奈。父亲是老肝炎，身体不好，生产队算照顾，去放羊吧，一群五六十只，都是山羊，放羊时父亲和头羊在前面走，我就在后面跟着，有的羊淘气不跟群，就跑着去赶，上山时放羊时可没少摔跤，腿上总是青一块紫一块的。晚上兄弟几个轮流替父亲夜里看羊圈，和一个五保户老爷爷睡在一个连锅炕上，冬天半夜起来还要给羊群喂草，好在那时是文革，与父亲一起放羊却成了儿时的学业，想想现在的大学生太幸福了,0,7,1,2022-08-09 20:26:32,来自北京,747267062510336,顶级清泉88
7129793745129866019,地上有羊脚印吧，羊走过的地方草要稀疏点吧，我这南方人的想法对么？,2,2,1,2022-08-09 16:42:02,来自湖北,66193558139,成精大猪哥
7129815206926582532,我怀疑她爸爸发现少了只母羊回来找结果找到了丢失的女儿[捂脸],1,1,0,2022-08-09 18:06:32,来自广西,53313759892,彬彬有148378176
7129814626455798535,娱乐一下。[呲牙][呲牙][呲牙][呲牙][呲牙],1,1,0,2022-08-09 18:03:37,来自河南,71989753151,a山山水水
7129805991176799017,丢的时间不长，时间长了就只剩下你，羊会变成羊肉[捂脸][捂脸],0,0,0,2022-08-09 17:29:49,来自湖北,69998240931,Wendy说保险7923
7129787679306777357,有你在，羊丢不了！,1,18,1,2022-08-09 16:19:09,来自安徽,3689553113910532,安庆孝肃路助听器
7129823793715528478,有一次小时候下大雨，打雷把羊都吓跑了，我找半天没找到，等我回家叫爷爷的时候才发现，羊都回家半天了[害羞][害羞][害羞],1,5,0,2022-08-09 18:39:14,来自浙江,50053574136,凉水太热
7129806308206756646,哈哈哈，你太会讲故事了[赞][赞][赞],1,2,1,2022-08-09 17:31:17,来自湖北,106134018976,永不放弃用户
7129765263171765027,爸爸：要不是少了一只羊，我都忘记自己还有个女儿,5,151,2,2022-08-09 14:51:39,来自山东,88804569768,聪明的麻酱sr
7129780219590263586,羊：不要一直看着我，吃饱了我带你回家[尬笑],0,3,0,2022-08-09 15:49:45,来自印度尼西亚,131580863196840,远远不是葱
7129777158595625760,一在校大学生因每交一次费用就让家里卖一只羊而成了帮困对象，直到大学毕业同学们才知道他家有几万只的羊！,2,12,0,2022-08-09 15:38:43,来自广西,10572144825,竹兜nphU
7130045693305783072,爸爸再也不敢让你放羊了……,0,0,0,2022-08-10 09:01:05,来自重庆,61455895300,鹤一鸣
7129769236112786188,以后放羊只能放一只，多了看不过来。,2,33,0,2022-08-09 15:07:46,来自重庆,60910316765,正义凛然风筝de
7129796600305845023,我不相信去放羊能离家十万八千里,3,4,1,2022-08-09 16:53:41,来自广西,101107898168,积极的孔雀U7
7129806076337308429,你识了千张字，读了万卷书，确放不了一只羊。大学生放羊趣事！看看这个美丽大学生暑假做了什么？,0,2,0,2022-08-09 17:30:31,来自山东,4274531033169304,用户蓝色水仙
7129864484910269188,以后再也不敢跟我女儿说不好好念书就回家放羊了，毕竟念了书的都放不好[捂脸],0,4,1,2022-08-09 21:17:01,来自甘肃,3175847354,世态炎凉Amor
7129805031104774953,小时候帮大人放牛，不认识路，天还马上要黑了，那时候也没手机啥的，然后害怕死了。爬到牛背上，关键个子小爬不上去，试了好多次，然后牛居然跪下来，我就上去了，然后我扒在牛背上哭，还有很多苍蝇。后来牛就带着我走回家了。,1,19,0,2022-08-09 17:25:57,来自上海,6193321125,相知是份
7129773544560542477,我也想去放羊，原理工作的嘈杂,4,9,0,2022-08-09 15:24:03,来自安徽,110232953227,广州的金字塔
7129795466799842063,小时候我爸吓我 不读书就去放羊 难道现在长大了 还要被这种恐惧支配嘛[捂脸][捂脸],0,0,0,2022-08-09 16:48:51,来自福建,6406860247,cherrypopo
7130024951549346573,也就是调侃，放羊的地方肯定在女孩村子附近，是他们的势力范围,0,0,0,2022-08-10 07:40:03,来自山东,3245375859987997,正直钢琴2X
7129883591379010336,我小时候和爷爷放羊也是的，被丢了[流泪],0,1,0,2022-08-09 22:31:26,来自上海,110578923256,柴女木子
7130046654879351560,平时常和孩子说，不好好读书，以后去放羊，没想到放羊还是个技术活，这条路都被堵死了[呲牙][呲牙][呲牙],0,0,0,2022-08-10 09:04:21,来自天津,97819439746,Jayelou
7129772291940401954,在草原上放羊，真是让人羡慕的生活,2,6,0,2022-08-09 15:18:53,来自河北,111279891112,仁爱小羊26
7130046761707799334,"那天想步行看看黄河，明明地图上看着很近，翻过几座土山就到了，只是没有路，试过在这山区开导航，发现不好使，给我指示到很远的公路。无奈，自己步行翻土山，因为杂草丛生，加上沟壑纵横，有些地方是落差几十米的悬崖下不去，需要不停的绕路，最终绕绕绕，绕的自己找不到方向，才翻过了一道山梁。瞅瞅四野渺无人烟，想想怕从哪摔下去，山沟里又没信号，到时候摇人摇不到，还是放弃了。
估计她就是这种情况，不是说给个定位，你就能直着回家，得熟悉地形路线",0,0,0,2022-08-10 09:04:54,来自内蒙古,85699255390,吴彦祖外蒙古分祖
7130035261295051550,一望无际美丽碧绿的草原一直是我心中的圣地！看到这个图片太让我失望了！没想到草原沙化得这么严重！以前的愿望是一定要到陈阵的狼图腾的草原去看看，现在没兴趣了[捂脸],0,0,0,2022-08-10 08:19:51,来自湖南,100094722081,怡情心屋
7129824835806528286,你会让大家觉得内蒙古真的只有羊群和马群,0,0,0,2022-08-09 18:42:59,来自陕西,97067568879,ALICEBerry
7129797800208614144,包头哪里还可以放羊吗,0,5,0,2022-08-09 16:58:02,来自上海,52912618122,乔永风
7129897068747326241,大学毕业完了，再回去重新跟你老爸学放羊，看羊本领不能丢了。[大笑][泪奔][泪奔],0,0,0,2022-08-09 23:24:45,来自广东,111195905959,灿烂香瓜OU
7129829747131548446,这届网友太皮了,0,5,0,2022-08-09 19:02:32,来自湖北,6888426123,乐乐117285986
7129870523362132751,人家第一次放羊，定位自己，方便寻找，没毛病啊！又不是在我们这地方。,1,0,0,2022-08-09 21:39:58,来自江苏,51253654492,雨燕风尘
7129908014995686155,哈哈哈，我是包头出生滴，不过1岁就回北京了。[大笑][大笑][大笑],0,0,0,2022-08-10 00:08:26,来自北京,4571676072,纳兰漪
7129836274974343977,放假陪爸爸放羊，是位好姑娘。点赞！,0,2,0,2022-08-09 19:27:06,来自江苏,59157179603,生命底色是善良
7129853527249208071,十年搞笑无人闻，一朝丢羊天下知。放羊把自己放丢了。哈哈哈,0,3,0,2022-08-09 20:34:05,来自河北,1846810099855495,远见卓识远山ZR
7129867240027390720,我小时候放牛，天黑了牛不见了，全家出去找牛，结果牛抛别人苞米地里吃饱了睡着了[呲牙][呲牙][呲牙][呲牙],0,0,0,2022-08-09 21:27:05,来自重庆,549385391317179,外婆家的猪女婿
7129814846656774952,我也想放羊，看羊吃草，我也思考思考人生,0,0,0,2022-08-09 18:04:05,来自北京,3689553894058180,小小蚂蚁人小力量大
7129788117300658957,你识了千张字，读了万卷书，确放不了一只羊。大学生放羊趣事！看看这个美丽大学生暑假做了什么？[心][心][心],0,14,2,2022-08-09 16:20:42,来自河北,58663820429,九月的云
7129822162642404110,我小时候骑牛背上走，大人跟在后边，牛进栏了大人还没到，跟一牛栏的牛呆在一起，吓得直哭[呲牙],0,4,1,2022-08-09 18:32:41,来自广西,109693329096,可可托海等我
7129870322488476451,我们小时候放羊，羊吃饱以后就直接把绳子盘在羊身上，羊在前面走，我和弟弟妹妹后面跟着。,0,1,0,2022-08-09 21:39:04,来自河南,25292640227,茉莉花789
7129793510559548193,可能走失吗？一个成年人怎么也能不记着回家的路呢？准确的说是走散了才对。,0,0,0,2022-08-09 16:42:13,来自辽宁,215947944403019,幽默沙滩Td
7129774526291903239,[呲牙][呲牙][呲牙]一只羊也能放丢，你是第一个,4,8,0,2022-08-09 15:27:45,来自河南,11650208219,满堂花醉万千客
7129866867867140896,爸爸：要不是少了一只羊，我都忘记自己还有个女儿,0,0,0,2022-08-09 21:26:36,来自河南,866047320393326,陈陈0375
7129893678759445284,看来还要多学习放羊技术。怎样能让羊听自己的话，需要时快速离开？,0,0,0,2022-08-09 23:10:32,来自天津,2062319889942764,威威wang
7130018890331210535,大学生不会用手机导航回家吗,0,0,0,2022-08-10 07:17:05,来自广东,281925800692894,荷花母女在广州
7129859427113992991,这说明我们现在的教育，急需往素质教育转变，人类需要的更多是生活能力，生存能力，自理能力，而我们现在过重的看重学习能力是反人类的，我们需要从素质教育的角度多考虑教育改革，而且逐渐的教育改革已经滞后，现在急需的是教育改革加速推进，全力推进,0,6,0,2022-08-09 20:56:52,来自天津,68606307410,河畔花园
7129750778449281796,现在的孩子已经不会放羊了！,0,1,1,2022-08-09 13:56:28,来自湖南,4463671651349580,云淡风清小龙女
7129768991983895337,真是应了那句话，只放一只，多了怕你管不过来[吐血],18,565,4,2022-08-09 15:06:10,来自陕西,4274562066,想想更健康
7129808062524818215,没事的，有爸爸在肯定丢不了！能放一只羊已经很好了，就算没放羊也不会丢的，相信父亲的力量[加油][加油][加油],0,3,0,2022-08-09 17:38:15,来自江苏,111618695750,姑苏金阊
7130023018151478047,爸爸应该说：要不是发现羊丢了，我都忘记你也丢了,0,0,0,2022-08-10 07:32:44,,6266681951,淡定小羊an
7129844925688660767,这不好好上学，放羊都整不明白了。,0,1,0,2022-08-09 20:01:04,来自湖北,874829102713924,Anna恒宝儿的妈咪
7129789598616011561,你爸心说……养娃儿还真不如养个牧羊犬了[捂脸]。,0,10,0,2022-08-09 16:26:07,来自北京,6999062291,搅和1
7129891073744864040,也说你想和小羊讨厌校园故事，你在默默诉，小羊在认真听，只是它还要思考与吃饭。,0,0,0,2022-08-09 23:00:11,来自河南,3918276773816004,武衣与布衣
7129793733793137422,以后放羊只能放一只，多了看不过来。,0,2,0,2022-08-09 16:42:46,来自湖北,1218689517227223,阿啦胖头鱼
7129805976798429964,86年的，小时候真的是天天放羊。十来岁的小孩子每人放着二三十只羊，羊吃草，我们几个羊倌就玩牌。,0,3,0,2022-08-09 17:30:30,来自山东,3104662876337420,花开无声胜有声a
7130016724871217923,找羊是牧羊犬的事啊,0,0,0,2022-08-10 07:09:08,来自黑龙江,109685619297,wenru1986
7129872859761591073,爸爸：要不是少了一只羊，我都忘记自己还有个女儿[捂脸][捂脸][捂脸][捂脸][捂脸],0,0,0,2022-08-09 21:49:40,来自广西,3780200646,羽蛇26332164
7129865452947702558,"“女主：毕业以后我就放羊，就放一头，多了我也数不过来，羊吃草，我在旁边睡觉，羊丢了，我也就丢了。”
“爸爸：这么多羊，要不是发现你丢了，我都不知道少了一只羊。”",0,0,0,2022-08-09 21:20:33,来自河北,61630133160,喝酒不好9k8j
7129877528315183887,"女大学生暑假放羊、把自己和羊放丟、自嘲“一朝丢羊天下知”人们笑趴。
[赞][赞][赞][赞][赞][赞]",0,0,0,2022-08-09 22:07:06,来自内蒙古,59266950488,至高无上AA
7129762787236086563,让我想起了个笑话，那夜我走丢了,3,14,0,2022-08-09 14:41:54,来自辽宁,4307952448,看似太平
7129803694761329408,真是让网友们脑洞大开啊，哈哈😊,0,1,0,2022-08-09 17:20:39,来自天津,52022933273,傲雪寒梅不畏严寒
7129885508989469471,把这叫做事？,1,0,0,2022-08-09 22:38:46,来自新疆,81239286303,天山脚下的丫头子
7129793748724351748,光大网友对田园生活的向往,0,4,0,2022-08-09 16:42:41,来自陕西,3470496852346301,火炮开火
7129773701897536271,带个指南针出门,5,3,1,2022-08-09 15:24:22,来自江西,92827312413,浅酌低唱唤浮名497
7129788440711021316,网友的留言莫名的好笑[呲牙][呲牙][呲牙],0,3,0,2022-08-09 16:22:25,来自黑龙江,228288718204647,列兰
7129840278441804580,叫领头羊给你爸爸发定位就可以，然后你爸爸骑着领头羊，你骑着那头羊，一起开心回家,0,2,0,2022-08-09 19:43:09,来自福建,2172249680131885,城的南北
7129864718482998050,以后放羊只能放一只，多了看不过来。,0,1,0,2022-08-09 21:17:16,来自河南,106019213026083,蜜橘.颖与鞠
7129873356564103940,小时候每次放假都要放牛，别人家放牛都可以几家轮流来，我们就一家子一头牛，放牛简直是童年的恶梦啊,0,1,0,2022-08-09 21:51:28,来自安徽,6058262146,晴雨天77644018
7129705810195890985,大学寒暑假一直有社会实践活动的，开学交报告。看来得加强生活常识、适应环境的选项了。[皱眉][捂脸],0,2,0,2022-08-09 11:00:46,来自辽宁,52327574915,咖啡加冰
7129838965079130888,要不孩子都说放羊就放一只了，多了数不过来,0,1,0,2022-08-09 19:38:03,来自内蒙古,6327218899,魂断梦相yang
7129839760163734302,放丢了那个羊和丢了那个女学生，羊不走你不走，羊走你走，跟着羊，不是找到爸和羊了吗[我想静静][我想静静][我想静静],0,1,0,2022-08-09 19:40:53,来自广东,3562008677726391,无双星空gd
7129838974369694505,我们家也是养羊的，儿子也是大学生，跟着我放羊同样的事情也发生过，作为家长真替你们大学生担忧啊。[捂脸],0,1,0,2022-08-09 19:37:39,来自甘肃,1789626150826036,真诚原野fX
7130021977812763423,我小时候放羊，一只[泪奔],0,0,0,2022-08-10 07:28:24,来自江苏,51472664808,毕竟你和他不同
7129890984552383272,友友们，你们认为放羊跟大学生读不读好书有关系吗？,0,0,0,2022-08-09 22:59:35,来自广东,440261976526567,惠风天朗读书
7129804768200999712,她老爸应该挺绝望的，这娃为了不放羊居然假装迷路,0,1,0,2022-08-09 17:25:26,来自广东,108702595581,看看新闻了解时迅
7129832935196246792,大学生怎么了，因为她学的专业不是放羊，隔行如隔山,0,4,1,2022-08-09 19:14:27,来自广西,1570545948695133,湖广叶儿
7129803449323635489,不，你没放羊，你爸爸只是放羊的时候顺带多放了一个人,0,4,0,2022-08-09 17:20:38,来自四川,53357057463,孤149076906
7129817748196426529,"改题目:
爸爸带孩子放羊孩子和羊都走失",0,0,0,2022-08-09 18:16:05,来自山西,66034221265,若鱼DE洋
7129809262402290473,这羊是故意的[捂脸],0,4,0,2022-08-09 17:42:22,来自陕西,48001580535863,墨染幻尘
7129787076262052644,生活中的每件事，对我们都是不可多得的磨练！这种磨练能使我们有足够的勇气，在生存的浩瀚大海中航行！！！,0,7,0,2022-08-09 16:16:44,来自广东,3632420648655917,淡定星河w2
7129826376081457954,哈哈😄，应该是爸爸不是发现怀孕的羊丢了，还没发现女儿也丢了呢[捂脸],0,2,0,2022-08-09 18:48:19,来自山东,70623891315,花想容kk
