7130033641446605600,"放一只羊是放，放一群羊也是放。只是看那放羊人和羊哪个聪明。
人聪明人就能回家，羊聪明羊也丢不了。😂😂😂",0,0,0,2022-08-10 08:13:54,来自湖北,254717262037888,尹玉专
7129833277048800039,又是这种营销模式，两个人一拍一合发个视频，立刻出来说明开头一句都是: 大家好，我是那个随意拍摄视频，记录生活，没想好火了，****************************,0,0,0,2022-08-09 19:16:28,来自广东,71430316837,辰溪numberone
7129769353352200971,哈哈，下次让羊带你回家，估计比你自己回家靠谱,0,11,0,2022-08-09 15:08:20,来自甘肃,63418624867,acoa
7129862234162856734,羊抬头的那一刻，发现有点熟悉又陌生,0,1,0,2022-08-09 21:07:50,来自福建,4398517921525056,沧海砺剑
7130008856201265960,完了，内蒙古高考，考放羊这件事瞒不住了。全国人民都知道了。[捂脸],0,0,0,2022-08-10 06:37:20,来自河北,6406794856,罗师傅罗师傅
7129826152654979881,"大学生 放羊把自己和一只羊🐑丢了
内蒙 地大草美 羊🐑多
大学生善良陪伴怀孕母羊 而丢失
🐑 🐑 🐑",0,2,0,2022-08-09 18:47:57,来自云南,64127826019,盛世风行
7129852005128471303,靠大自然的天然标识辨别方向毕竟不是大学生的专业课程，现在野外生存大概也就特种兵可以真正落实到生活中,0,1,0,2022-08-09 20:28:25,来自山东,3632396939047902,行至半世
7129812974286029572,听说有学生暑假回到家，发现爸妈赶着牛羊离开定居点去草原深处了，一时半会找不到的[憨笑],0,3,0,2022-08-09 17:57:32,来自甘肃,4204997465614360,艾斯考
7130040792189600551,毕业后去内蒙古牧场超好，去应聘放羊🐑岗位。,0,0,0,2022-08-10 08:41:45,来自天津,5871335202,木子69547041
7130034163369149223,捡到了是交公呢还是带回家？我的想想，嗯嗯，小羊一定要还的，小姑娘吗跟老丈人商量商量，留下行吗？[大笑][大笑][捂脸][捂脸][呲牙][呲牙][玫瑰][玫瑰][玫瑰],0,0,0,2022-08-10 08:16:06,来自江苏,9158094821,朱子39
7129825119396659976,你适合放羊，放一只[赞][赞][赞],0,2,0,2022-08-09 18:44:30,来自陕西,2959530647631127,渭水润关中
7129840310443787044,"迷途的“羔羊”[捂脸]
以后，放假就帮家里放羊。熟悉线路后，妈妈再也不担心你迷路了[玫瑰][玫瑰][玫瑰]",0,1,0,2022-08-09 19:42:57,来自河北,95303390632,北京老猫房上睡
7129874094531035939,看来放羊比放女大学生容易多了。[狗头][狗头][狗头],0,1,0,2022-08-09 21:53:47,来自广东,3773150902359992,秋水音弦
7129830270022599432,传说中的爸爸卖了几只羊才凑齐学费[捂脸],0,3,0,2022-08-09 19:04:09,来自广东,2071100280016621,Mrwang一
7129803395312911119,包头是山口地区，天气变化无常，你是迷失了方向吧！,0,0,0,2022-08-09 17:19:31,来自上海,102089950149,战舰启航
7129843073785873156,爸爸:这丫头不如咱家狗子[捂脸],0,1,0,2022-08-09 19:54:04,来自北京,1063977566344238,高兴的没头脑33
7130023612198748964,你爸爸是不是因为羊才顺道把你带回去的[我想静静],0,0,0,2022-08-10 07:34:56,来自吉林,3734892430,天一146809178
7129711107282944806,唉，放羊把自己放丢了，不省心啊！,0,6,0,2022-08-09 11:22:04,来自内蒙古,58657939737,飞越苍茫
7129877369020187424,迷路就迷路，跟是不是大学生没关系。,0,0,0,2022-08-09 22:07:17,来自广西,106324288162,bingan123
7129802947827483427,最怕人丢了，羊自己回家[捂脸][捂脸][大笑],0,1,0,2022-08-09 17:17:59,来自广东,22992492101,深圳桥洞居民
7129834231333258018,看来放羊以后都得研究生学历了[呲牙],0,0,0,2022-08-09 19:19:10,来自河北,2474948079,种玉之人
7129853415722795817,9月上学的时候带个羊去听课吧，下次再丢了，让羊领回家去，靠谱[我想静静][我想静静][我想静静],0,1,0,2022-08-09 20:33:21,来自福建,67222230603,小汽车走起来
7129789614663041805,放假了和父亲一起放羊，体会父母的艰辛，父亲一定很开心。为小女孩点赞[赞],0,9,1,2022-08-09 16:26:19,来自内蒙古,105793706490,行者之旅609
7130048663451484943,等着羊吃饱了，就会带你回家的[捂脸][捂脸][捂脸][捂脸],0,0,0,2022-08-10 09:11:25,来自甘肃,106003550976483,前世谁约了我
7129889589778809603,小时候父母教育我不好好读书将来就在家放羊……,0,0,0,2022-08-09 22:55:01,来自河南,52506785025,大清晰
7129791374417412871,差点成为“龙梅”或“玉荣”？还好现在有手机了[捂脸],0,2,0,2022-08-09 16:33:28,来自北京,2075490184857432,希望之旅蘇
7129834786302427944,都说啦，放羊只能放一只羊，跟是不是大学生无关...[我想静静][我想静静][我想静静],0,1,0,2022-08-09 19:21:27,来自重庆,92360040749,牽伊捭瞬
7129793364089963264,我小时候放养把羊群丢了，自己回家还迷路了[捂脸][捂脸],0,6,0,2022-08-09 16:40:39,来自内蒙古,4234884433,香雪36165951
7129826910246470400,别自卑！因为我感觉我也会把羊和自己都丢了。[捂脸],0,1,0,2022-08-09 18:50:43,来自上海,87997432349,懂事小宝和乖巧小七
7129816965229069094,记得之前有个视频：突然好想去放牛，最多放一只，多了也数不过来，牛吃草，我在它身上睡觉，牛丢了，我也就丢了，省心……,0,2,0,2022-08-09 18:13:06,来自广西,75710198568,子萧301
7129883178357736227,没事就好，吓我一跳,0,0,0,2022-08-09 22:29:18,来自重庆,817635806942503,悠闲梦想家Zk
7129819101014606622,羊说先吃饱再回家[呲牙],0,1,0,2022-08-09 18:33:16,,2911108713953368,成熟孔雀J
7129833989330273064,下回你留下看管大羊群，让你爸爸去找那一只羊,0,0,0,2022-08-09 19:18:16,来自北京,54599769339,美的求所
7129820812106138408,好嘛，《关于大学生放羊把羊和自己放丢了的这件事》,0,1,0,2022-08-09 18:27:13,来自山东,1631314501702551,积极的胖兔子
7130049215811552036,"[捂脸][捂脸][捂脸]小时候放了一群羊，好几十只，大中午的羊都不吃草了，都趴那休息，于是，我们也找了个阴凉地睡觉去了，你们知道这群羊多无良吗？我们睡着了他们居然跑了，然后，等醒来一看，傻眼了啊，羊没了，我们就按蹄印找，然后…迷路了…这群羊在里面打转，然后转悠一直到天黑，最后一个连队的人都出来找我们了[捂脸]
到晚上12点多才找到，主要还是我们看到他们的亮光往这个方向走才遇到
然后怕啊，一群羊丢了，小心翼翼的说羊丢了，结果你知道嘛，这群羊居然跑回家了[捂脸]是大人发现羊回来，人没回来，就知道出事了",0,0,0,2022-08-10 09:13:51,来自上海,75378032728,阿伟165643
7129817717049328425,孩子，一定要好好读书。放羊是指望不上你了。,0,0,0,2022-08-09 18:15:11,来自广东,2692062315295984,喜哥随拍
7129863847309148968,你就不知道带着它羊妈妈一起走，可能羊妈妈会带你们两个一起回家[点亮平安灯],0,1,0,2022-08-09 21:13:58,来自湖南,422677982490520,李渔文苑
7129821981163520809,还好还有手机这东西，不然找不着老爸了！[捂脸],0,1,0,2022-08-09 18:31:44,来自浙江,108450451331,纳兰july
7129838783444452131,内蒙古的孩子不是出生的时候就自带放羊技能吗,0,0,0,2022-08-09 19:36:45,来自辽宁,74887818490,lingchen3240795440
7129805460839908134,你可以迷路，羊不会迷路是它不想回家，不要问我是咋知道的，哥放过羊一次睡着了羊自己回家了,0,1,0,2022-08-09 17:28:09,来自山东,64922995615,勇敢的沙滩wq
7129822138861126440,这么可爱的人居然有人嘲讽人家一只羊都放不好。,0,1,0,2022-08-09 18:32:16,来自广东,67693799254,歪脖子树鸭
7130010850785985313,作为一个从小放羊的人告诉你们：一群羊很好放，很听话。一只羊就不好放了。,0,0,0,2022-08-10 06:46:32,来自辽宁,769302672455415,嘻嘻87478
7129806563644703524,真是应了那句话，只放一只，多了怕你管不过来[吐血],0,3,0,2022-08-09 17:32:17,来自湖北,1460581359429165,风趣松鼠Ax
7129858227315213091,我小时候放过羊，羊吃饱了真的会自己回家的,0,2,0,2022-08-09 20:52:06,来自湖南,3605528406,此心如玉
7129859272896824100,小时候放牛，才离一坐山，牛回家了，自己还没回来，还到处找牛,0,1,0,2022-08-09 20:56:36,来自广东,66534506382,冬天阳光768
7129808947695092520,其实反过来说是羊放你，怕你丢了所以不肯走，,0,2,0,2022-08-09 17:41:07,来自江苏,21318903431,凡人六
7129817287687242510,羊都记得额回家的路，你不记得没有关系啊，你丢了它都丢不了，放心！,0,1,0,2022-08-09 18:14:04,来自浙江,74414827773411,温柔艺术家eu
7129990105649398542,就放羊这件事，你得好好向草原英雄小姐妹俩取经学习[捂脸],0,0,0,2022-08-10 05:27:14,来自江西,980356853405764,普今次
7129853013950579464,爸爸到家发个定位不就好了,0,0,0,2022-08-09 20:32:14,来自江苏,103708092576,薇69薇
7129861477942625059,[耶]没事，羊羊肯定自己能回家,0,0,0,2022-08-09 21:04:36,来自辽宁,4182147791860139,孙炎爸
7130042286628455172,哈哈！大清早的看见这篇文章，心情不错，这个女大学生要火了！,0,0,0,2022-08-10 08:47:21,来自山东,2840734787714301,姜素芝
7129805527798055694,放一只都能丢，而且把人连羊一块都丢了[呲牙][呲牙][呲牙]真是个大学生，大，学生,0,2,0,2022-08-09 17:28:21,来自山东,84972515410,山川131419
7129848987238761254,我家在湖南边界，小时候放牛在草地上睡着，牛跑广西那边去。,0,1,0,2022-08-09 20:17:08,来自湖南,82398993406,南岭笑笑生vip
7129801642979492647,只学会了摸鱼，连放羊的技能都生疏了啊！[呲牙],0,1,0,2022-08-09 17:13:52,来自安徽,61975953698,六两一钱
7130019304300380941,羊边走边吃半小时能走多远？,0,0,0,2022-08-10 07:18:13,来自广东,58025605175,寻梦99718
7129870676655719183,看来放羊不适合你[捂脸]，放一只都丢了,0,0,0,2022-08-09 21:40:33,来自广东,3835518476628686,自由梦想家fg
7129816293343642403,"要是放的是牛，自己就知道家门
羊群必须有头羊领着[泪奔]",0,1,0,2022-08-09 18:09:48,来自北京,53130425690,篮球早点半
7129791621046207273,"妈妈：你这数数都不会，放羊怎么办
娃娃：放一只",0,2,0,2022-08-09 16:33:50,来自广东,4406544794,启航教育杨老师
7129768782549402409,我愿变一只小羊啊，跟在她身旁哈。,4,9,0,2022-08-09 15:05:23,来自上海,105085637489,赢元
7129881340749267753,这只羊要交给恩克了。,0,0,0,2022-08-09 22:22:06,来自湖南,89983166679,大雷chanle
7129808633562612512,没事，这不算啥！草原地方大，稍微一个低洼就有可能看不到。你平时又不怎么放，理解！[爱慕],0,1,0,2022-08-09 17:40:39,来自北京,83808476797,一腔豪情满尘衣
7129805492889060109,这是被羊给放丢了啊[泪奔][泪奔][泪奔],0,3,0,2022-08-09 17:28:06,来自北京,106459127446,丽的生活小日记
7129818964372226851,你们说的都不对，我觉得，是爸爸放羊把自己放丢了。,0,0,0,2022-08-09 18:19:51,来自广东,945210657096220,这里的黎明静悄悄丫
7129799599816147749,不用麻烦你爸爸，过一会羊吃饱了，就能把你领回家[我想静静][我想静静][我想静静],0,0,0,2022-08-09 17:05:07,来自黑龙江,3494986615,霸道的大二八
7129817978744996615,不怪你，怪羊贪吃[捂脸][捂脸],0,1,0,2022-08-09 18:16:39,来自山东,100048993992,远见卓识梦想家xk
7129816145313547019,有句话怎么说来着：城市套路深，我要回农村，单纯的放羊，羊丢了我也丢了[泪奔][泪奔][泪奔][泪奔][泪奔],0,0,0,2022-08-09 18:09:36,来自浙江,72307809265,今晚上你可好
7129814830466269987,似不似这样：我木有走丢，而是多陪了🐏一会儿吃草[憨笑],0,0,0,2022-08-09 18:03:47,来自河北,68824526745,福虎娱乐有料想说667
7130050065108501252,“羊丢了，我也丢了”。错！是我丢了，羊却不领我回去！羊是没有丢的，它认识回家的路，它自己能回。你丢了那是真的，羊没吃饱不愿领你回去也是事实。,0,0,0,2022-08-10 09:18:04,来自湖南,91988016771491,阳旭aaa
7129838715950121766,高中时给老舅放牛，就放一只，牛吃草，我在旁边看着，牛丢了，我也丢了。,0,1,0,2022-08-09 19:37:16,来自河北,105096398088,生活两三事live
7129872456109769509,不是说内蒙人只放羊不数羊吗,0,0,0,2022-08-09 21:47:39,来自河南,1610122120674743,船夫壹见
7130045706597040911,学校是摸鱼 家里是放羊 垮专业实习可以理解,0,0,0,2022-08-10 08:59:52,来自四川,100419444889,飞鸟89
7129826286184317700,幸亏你爸爸找不到你了，不然羊不得丢了。[捂脸][捂脸][捂脸],0,0,0,2022-08-09 18:48:57,来自北京,99184380597,水中望月3273
7129917018803487495,忍不住问一句：你还能干点啥？,0,0,0,2022-08-10 00:44:24,来自山东,4503207542788263,你好小石榴
7129820033794360099,以前没有放过羊吗？,0,0,0,2022-08-09 18:24:05,来自福建,3988633799889240,Zhtl
7129971933525033743,羊：要不是我你可能真的就丢了，你爸是找我顺带吧你带回去,0,0,0,2022-08-10 04:19:20,来自陕西,2361397365705816,职业牛氓
7129880662517400351,想不到因为放羊跟着火了,0,0,0,2022-08-09 22:19:53,来自湖南,106646259175,简简单单8000465279923
7129899324469035817,嗯，还好不是失踪，只丢了半个小时[抠鼻],0,0,0,2022-08-09 23:32:14,来自安徽,3822346395987324,HomeCooK
7129791117557908239,下次你还是不要去放羊了，免得羊为你担心。,0,2,0,2022-08-09 16:31:54,来自广东,1323451588023867,易起说事
7129825929866199849,很有趣的聊天！也是女大学生对生活的真实体验。[赞],0,1,0,2022-08-09 18:46:58,来自四川,927581737064893,关心教育的退休老师
7129789465870172941,只知道内蒙放羊的很有钱，见过卖羊的，一起就卖了几卡车羊。牧场距离用骑摩托车时间衡量,0,0,0,2022-08-09 16:25:45,来自河北,50046025805,集团娱乐
7129799612814836513,羊认识家，它吃饱了就把你领回家了，着啥急啊,0,0,0,2022-08-09 17:05:51,来自北京,4384480390283496,僵尸看社会
7129820093336306472,放心，跟着羊就先到家了[大笑][大笑][大笑][大笑],0,0,0,2022-08-09 18:24:19,来自陕西,54737804046,小七wss
7129869883139326756,放羊娃把自己和羊儿都放丢了，幸亏有微信被自己的父亲把自己和羊儿又都找回来啦，有些拗口，但这是真事啊！,0,0,0,2022-08-09 21:48:03,,100398767793,小虫日记
7129776623893168937,网友太可爱了[呲牙],0,1,0,2022-08-09 15:35:50,来自广东,8038555786,fanglinrong
7129817409581859622,还在养只牧羊犬靠谱,0,1,0,2022-08-09 18:14:38,来自山东,65445704497,夏荷田田林雨间
7129858663145440015,感谢现代的通讯技术，不然不是半个小时能找回的事了！,0,0,0,2022-08-09 20:53:50,来自浙江,3105472647542999,吾心安处吾自在
7129790960502178564,关键咱上大学老师没教怎么放羊啊，对不对？对不对？怪我咯~,0,1,0,2022-08-09 16:32:00,来自山东,5518319513,尤怜故乡水
7129787764027065122,羊：别把我捎带进去，我没丢！我只是想叛逆几天，我知道回家。,0,2,1,2022-08-09 16:18:46,来自湖北,101936334680,同行天下xu
7129827134818026281,羊吃饱了，会对你说：乖乖，跟我回家吧！咩咩！,0,0,0,2022-08-09 18:51:32,来自广西,3888332797390052,多彩旭日5
7129886740483048199,好想放下所有去放牛，只放一只，多了放不了，牛在草地吃草，我在牛背睡觉，牛丢了，我也丢了！！！,0,0,0,2022-08-09 22:43:16,来自湖南,395433135842859,煦风丶
7129872155806040871,是的，羊吃饱了会带你回家的！,0,0,0,2022-08-09 21:46:50,来自吉林,108292392799,忠义之子1
7129816717639254824,估计这羊跟你爸说了，有它在，你就丢不了，所以你爸才放心的和羊群一起走的,0,0,0,2022-08-09 18:11:16,来自陕西,102157505837,朴实河流aF
7129768549660656422,羊，我吃饱了带你回家。,0,20,1,2022-08-09 15:05:22,来自山东,5413824560,闲云野鹤whb
7129874929826857759,还有羊群，富裕得很啊！我一头羊都没有啊！[我想静静][我想静静][我想静静],0,1,0,2022-08-09 21:57:29,来自上海,2806405869872429,听雨寒梅
7129790281142207271,你让羊带路吧,0,2,0,2022-08-09 16:29:21,来自广东,4019410454973037,自在山雀Zd
7129871410541232931,羡慕有羊放,0,0,0,2022-08-09 21:43:16,来自广西,105071153486,打死不再追剧
7129833405331800844,把自己都走丢了，那羊怎么办？,0,1,0,2022-08-09 19:16:57,来自甘肃,106039681087,平凡黑丑在在
7129874265133941504,家里羊多吗？还需不需要人帮放羊[灵光一闪],0,0,0,2022-08-09 21:54:19,来自广东,4371298649375367,o创
7129800917796930318,上学没教放羊这一课。,0,0,0,2022-08-09 17:10:35,来自北京,1385014943035251,墨雨春归
7129865091650405160,羊吃饱了，你跟着羊就能回家了[大笑][捂脸][捂脸],0,1,0,2022-08-09 21:18:44,来自北京,2296219349839287,可浓可淡小火锅
7129832810676224772,放羊的时候，只顾玩手机了。就忘了放羊的事了。,0,0,0,2022-08-09 19:14:34,来自黑龙江,2141486702135101,聪明菠萝1C
7129817904765862689,没事干了无聊，不会去看草原风景。,0,0,0,2022-08-09 18:16:51,来自广东,761300885965229,其乐融融布莱恩5x4
7129786582475244300,大姐，拴根绳吧，不然羊吃饱了跑回家你跟不上[捂脸][捂脸][捂脸],0,2,0,2022-08-09 16:15:20,来自江苏,4195333698756080,超奈斯七七
7129815340808553256,风景咋样阿！想去玩一圈！顺便帮忙放个羊啥子的,0,0,0,2022-08-09 18:05:56,来自四川,6115276123,灵钥曌韵溪
7129869566406181672,这种人适合当兵，当兵是集体活动，除非站岗，那也是固定的,0,0,0,2022-08-09 21:36:04,来自山东,14494451806,听松181
7129846067402687271,你爸没去找你，也太粗心了吧,1,3,0,2022-08-09 20:05:22,来自广东,659316979283214,星河入梦9H1p
7129860395908825889,小姐姐，需要放羊的吗，管吃住就行[狗头][狗头][狗头],0,1,0,2022-08-09 21:01:06,来自贵州,3492512498991528,九度观察
7129849335105848103,看来抖音里那个说放一头羊的小朋友要注意了。,0,1,0,2022-08-09 20:18:25,来自江苏,98841959299,一亩三分地442
7129867309816398596,小学时，课间10钟休息把书包背身上，结果上课时找不到书包，急哭了被同学笑了好一阵,0,0,0,2022-08-09 21:28:08,来自广东,77970213691,白杨
7130006463695274784,有羊图片，没看到大学生，这个事情不算数[呲牙],0,0,0,2022-08-10 06:29:58,来自重庆,3579104739,净化心灵19099344
7129821916504245024,羊是怕你丢了，要不早就走了,0,0,0,2022-08-09 18:32:12,来自贵州,78986073345,雲傳說
7129785923528885028,等我有钱吃饱了，我也去放羊，放一只丢一只。,0,2,0,2022-08-09 16:12:12,来自四川,105102885826,你饿不饿我饿
7129846298459194119,想起那个笑话，生活好累，想放牛去，只放一只，多了数不过来，躺在牛背上，牛去哪里，我去哪里，牛丢了，我也丢了,0,1,0,2022-08-09 20:06:24,来自内蒙古,59124016358,贫僧不吃早饭
7129868628102644493,不念书的从小放羊不会丢，念了书的反倒把自己丢了，由此可见知识改变命运啊！,0,0,0,2022-08-09 21:32:41,来自浙江,109927702398,来看戏了
7129846868053476135,我也想和你一起去放羊…,0,0,0,2022-08-09 20:08:40,来自广西,3531004971,过期的男神
7129757757091791656,我这种路痴肯定放不了羊🐏,0,1,0,2022-08-09 14:22:44,来自上海,734121392607991,糯玉米的vlog
7129813427589186341,还好没有遇到狼，不然你俩都悬了……,0,2,2,2022-08-09 17:58:54,来自山东,8040263072,王海洋纵论天下
7129834540478120707,放羊玩直播入迷了，把羊忘部队丢了[呲牙],0,0,0,2022-08-09 19:21:08,来自山西,78762521139534,狂人音悦
7129802809939247887,我6岁就开始放羊，也不至于你这样,0,0,0,2022-08-09 17:17:10,来自内蒙古,82276788938,木子学有所成
7129968678132974376,可爱的大学生，有爱的大学生。,0,0,0,2022-08-10 04:06:41,来自天津,1442154786326144,用户3626971085457心
7129845456464904974,把羊放开，你跟着它们走。,0,1,0,2022-08-09 20:03:00,来自山东,5355300023,布衣修行者
7129871668691895055,不是接你来了，是接羊顺路把你一起接走的[泪奔],0,0,0,2022-08-09 21:44:13,来自北京,59591149970,派大星YY
7130022356487324419,要不是少了一只羊，爸爸都不知道闺女丢了[捂脸][捂脸],0,0,0,2022-08-10 07:30:35,来自河北,58051630038,雨中看海7
7129875521274086159,有没有一种可能 那只羊🐏把你带到了我家[捂脸],0,0,0,2022-08-09 21:59:23,来自广西,76181328809,拔腊490
7129772685504643881,关于暑假帮家里忙活结果越帮越忙这件事,0,5,0,2022-08-09 15:20:28,来自广东,1648017466,Secretxxx
7129999787017569039,从小在农村长大，对自己家乡的一山一水都熟悉的很，不可能走丢了，要说在自己的家乡走丢了就考虑你的智商了。,0,0,0,2022-08-10 06:02:46,来自北京,198355463440557,上进用户求知
7129800655589376803,羊认得回家的路，只要抓住羊尾巴不撒手，你就丢不了[呲牙],0,1,0,2022-08-09 17:08:52,来自四川,100464767783,蜀道言秦
7129797776313680673,在草原上放羊走哪吃那睡那。处处无家处处家。,0,2,0,2022-08-09 16:58:43,来自河南,7385406010,味道
7129807271567409928,蒙上眼，骑在羊身上，它会带你回家的,0,0,0,2022-08-09 17:35:14,来自山东,175567909424510,敏锐铅笔If
7129777028856890115,"妈妈：数学学不好，长大了能干吗？
儿子：放羊
妈妈：放羊你也数不清啊
妹妹：放一只羊
[吐血]",0,3,0,2022-08-09 15:37:56,来自山西,76494281350,用户不存在4823
7129783474588041991,我也想去放羊,0,0,1,2022-08-09 16:02:43,来自河南,50006921084,哎我逗
7129827895501013775,有羊图片，没看到大学生，这个事情不算数[呲牙],0,0,0,2022-08-09 18:54:32,来自辽宁,93017925254,一草一天堂lxl
7130045976026333952,有可能是爸爸发现羊少了一只，才回来找的，顺便看到了女儿。[大笑],0,0,0,2022-08-10 09:00:58,来自上海,51646667634,大圣未成圣
7129818185188147979,没有科学放羊你都放不了[泪奔],0,0,0,2022-08-09 18:17:38,来自福建,6091584447,森森与铠铠
7129811669668250401,你要是和大羊群一起，单独的羊就会赶上了，你陪它，就不会去合群。,0,1,0,2022-08-09 17:52:19,来自河北,3438903581748574,富足西柚vd
7129766124677841664,给头羊买个苹果手机，加好友位置……从此不再迷路了,4,8,0,2022-08-09 14:55:08,来自湖南,60838435681,君子能舍即得
7129836165137842976,记得小时候父母会说，不好好学习，以后你只能去放羊！现在想想，我不考大学，去放羊多好[泪奔][泪奔][泪奔],0,1,0,2022-08-09 19:27:25,来自北京,59928575734,耗子打洞0
7129860742303908638,可爱的羊🐑,0,1,0,2022-08-09 21:02:12,来自浙江,66035443237,60后军嫂
7130004139374822182,大家看了一乐就行了，别啥事都较真,0,0,0,2022-08-10 06:20:28,来自北京,558147110188724,爱生活的笑而不语
7130047734807069448,一数少只羊，找到羊才发现女儿也丢了[吐血][吐血][吐血],0,0,0,2022-08-10 09:08:15,来自四川,51215186990,李老头儿没意思
7129783968140313374,看来放羊跟学历无关，能放多少羊也跟知识毫无瓜葛。,0,1,0,2022-08-09 16:04:31,来自山东,75681808210,豆浆配咖啡D
7130042020324229892,"爸:你不好好上学，长大能干什么？
女:长大放羊。
爸:放羊也不识数，丢了都不知道。
女:我就放一只，数得过来。
爸:你看看，都大学了，就放一只羊还丢了。把自己也丢了。",1,2,0,2022-08-10 08:46:43,来自辽宁,1988351745604484,锵锵
7129781468511109924,小姐姐下次来我家放牛[捂脸]昨晚我打电话回家，我家还养有十几头黄牛。,0,2,0,2022-08-09 15:54:58,来自广东,23485325169,主角滴故事
7129803699815449351,就像看笑话一样，妈妈让他放羊，就放一只，多了数不过来。,0,0,0,2022-08-09 17:21:02,来自山东,8794663225,奇妙小红花vZ
7130048547231138560,肯定是在放羊的时候耍手机了,0,0,0,2022-08-10 09:10:48,来自四川,4305283953732743,合作共赢迈进梦想
7129809239602004751,还不错，知道随身带电话有事打电话，安全就好。以后外出多观察环境，不要长时间被吸引注意力,0,0,0,2022-08-09 17:42:16,来自北京,3106369885,菜根之谈
7129861506002912041,幸好现在有手机，不然你爸爸不知道你丢了，我也不知道[泣不成声],0,1,0,2022-08-09 21:04:57,来自广东,5004851886,老表看头条
7129834631016563459,现在他们说的放羊放一只，极品阿。把羊和自己弄丢。,0,0,0,2022-08-09 19:21:25,来自福建,100468542248,书与烟eh
7129821596302738217,是你放羊还是羊放你[捂脸],0,0,0,2022-08-09 18:30:10,来自山东,92662500957,刚赛来hello
7129849385554494223,固阳那没看到这么大山啊？[捂脸][捂脸][捂脸]，我有次去白云那草原玩就差点找不到回来的路,0,1,0,2022-08-09 20:17:48,来自江苏,2963883291050747,聪明的海浪dL
7129880250103726882,这是人放羊还是羊放人！,0,1,0,2022-08-09 22:17:41,来自宁夏,2955105863222375,水中太阳
7129796432210543396,有没有可能是爸爸回去数数少了一只羊，才发现闺女也丢了？,0,1,0,2022-08-09 16:52:52,来自安徽,3113500289,随风6276977
